22:37:18.269169 IP 10.8.2.12 > 192.154.198.15: ICMP echo request, id 1845, seq 2, length 64
22:37:18.585984 IP 192.154.198.15 > 10.8.2.12: ICMP echo reply, id 1845, seq 2, length 64
22:37:19.270905 IP 10.8.2.12 > 192.154.198.15: ICMP echo request, id 1845, seq 3, length 64
22:37:19.587672 IP 192.154.198.15 > 10.8.2.12: ICMP echo reply, id 1845, seq 3, length 64
22:37:20.272592 IP 10.8.2.12 > 192.154.198.15: ICMP echo request, id 1845, seq 4, length 64
22:37:20.589420 IP 192.154.198.15 > 10.8.2.12: ICMP echo reply, id 1845, seq 4, length 64
22:37:21.273341 IP 10.8.2.12 > 192.154.198.15: ICMP echo request, id 1845, seq 5, length 64
22:37:21.590814 IP 192.154.198.15 > 10.8.2.12: ICMP echo reply, id 1845, seq 5, length 64
22:37:22.274736 IP 10.8.2.12 > 192.154.198.15: ICMP echo request, id 1845, seq 6, length 64
22:37:22.591434 IP 192.154.198.15 > 10.8.2.12: ICMP echo reply, id 1845, seq 6, length 64
22:37:23.276352 IP 10.8.2.12 > 192.154.198.15: ICMP echo request, id 1845, seq 7, length 64
22:37:23.593067 IP 192.154.198.15 > 10.8.2.12: ICMP echo reply, id 1845, seq 7, length 64
22:37:24.277992 IP 10.8.2.12 > 192.154.198.15: ICMP echo request, id 1845, seq 8, length 64
22:37:24.594649 IP 192.154.198.15 > 10.8.2.12: ICMP echo reply, id 1845, seq 8, length 64
22:37:25.279568 IP 10.8.2.12 > 192.154.198.15: ICMP echo request, id 1845, seq 9, length 64
22:37:25.596178 IP 192.154.198.15 > 10.8.2.12: ICMP echo reply, id 1845, seq 9, length 64
22:37:26.281094 IP 10.8.2.12 > 192.154.198.15: ICMP echo request, id 1845, seq 10, length 64
22:37:26.598245 IP 192.154.198.15 > 10.8.2.12: ICMP echo reply, id 1845, seq 10, length 64
22:37:27.282163 IP 10.8.2.12 > 192.154.198.15: ICMP echo request, id 1845, seq 11, length 64
22:37:27.598941 IP 192.154.198.15 > 10.8.2.12: ICMP echo reply, id 1845, seq 11, length 64
22:37:28.283829 IP 10.8.2.12 > 192.154.198.15: ICMP echo request, id 1845, seq 12, length 64
22:37:28.600553 IP 192.154.198.15 > 10.8.2.12: ICMP echo reply, id 1845, seq 12, length 64
22:37:29.285474 IP 10.8.2.12 > 192.154.198.15: ICMP echo request, id 1845, seq 13, length 64
22:37:29.602178 IP 192.154.198.15 > 10.8.2.12: ICMP echo reply, id 1845, seq 13, length 64
22:37:30.287098 IP 10.8.2.12 > 192.154.198.15: ICMP echo request, id 1845, seq 14, length 64
22:37:30.603774 IP 192.154.198.15 > 10.8.2.12: ICMP echo reply, id 1845, seq 14, length 64
22:37:31.288685 IP 10.8.2.12 > 192.154.198.15: ICMP echo request, id 1845, seq 15, length 64
22:37:31.605602 IP 192.154.198.15 > 10.8.2.12: ICMP echo reply, id 1845, seq 15, length 64
22:37:32.289515 IP 10.8.2.12 > 192.154.198.15: ICMP echo request, id 1845, seq 16, length 64
22:37:32.606164 IP 192.154.198.15 > 10.8.2.12: ICMP echo reply, id 1845, seq 16, length 64
22:37:33.291085 IP 10.8.2.12 > 192.154.198.15: ICMP echo request, id 1845, seq 17, length 64
22:37:33.607804 IP 192.154.198.15 > 10.8.2.12: ICMP echo reply, id 1845, seq 17, length 64
22:37:34.292725 IP 10.8.2.12 > 192.154.198.15: ICMP echo request, id 1845, seq 18, length 64
22:37:34.609421 IP 192.154.198.15 > 10.8.2.12: ICMP echo reply, id 1845, seq 18, length 64
22:37:35.294339 IP 10.8.2.12 > 192.154.198.15: ICMP echo request, id 1845, seq 19, length 64
22:37:35.611099 IP 192.154.198.15 > 10.8.2.12: ICMP echo reply, id 1845, seq 19, length 64
22:37:36.295998 IP 10.8.2.12 > 192.154.198.15: ICMP echo request, id 1845, seq 20, length 64
22:37:36.612864 IP 192.154.198.15 > 10.8.2.12: ICMP echo reply, id 1845, seq 20, length 64
22:37:37.296785 IP 10.8.2.12 > 192.154.198.15: ICMP echo request, id 1845, seq 21, length 64
22:37:37.613662 IP 192.154.198.15 > 10.8.2.12: ICMP echo reply, id 1845, seq 21, length 64
22:37:38.297574 IP 10.8.2.12 > 192.154.198.15: ICMP echo request, id 1845, seq 22, length 64
22:37:38.615464 IP 192.154.198.15 > 10.8.2.12: ICMP echo reply, id 1845, seq 22, length 64
22:37:39.298376 IP 10.8.2.12 > 192.154.198.15: ICMP echo request, id 1845, seq 23, length 64
22:37:39.615272 IP 192.154.198.15 > 10.8.2.12: ICMP echo reply, id 1845, seq 23, length 64
22:37:40.299193 IP 10.8.2.12 > 192.154.198.15: ICMP echo request, id 1845, seq 24, length 64
22:37:40.616125 IP 192.154.198.15 > 10.8.2.12: ICMP echo reply, id 1845, seq 24, length 64
22:37:41.300051 IP 10.8.2.12 > 192.154.198.15: ICMP echo request, id 1845, seq 25, length 64
22:37:41.616925 IP 192.154.198.15 > 10.8.2.12: ICMP echo reply, id 1845, seq 25, length 64
22:37:42.300809 IP 10.8.2.12 > 192.154.198.15: ICMP echo request, id 1845, seq 26, length 64
22:37:42.617571 IP 192.154.198.15 > 10.8.2.12: ICMP echo reply, id 1845, seq 26, length 64
22:37:43.302479 IP 10.8.2.12 > 192.154.198.15: ICMP echo request, id 1845, seq 27, length 64
22:37:43.619173 IP 192.154.198.15 > 10.8.2.12: ICMP echo reply, id 1845, seq 27, length 64
22:37:44.304074 IP 10.8.2.12 > 192.154.198.15: ICMP echo request, id 1845, seq 28, length 64
22:37:44.620774 IP 192.154.198.15 > 10.8.2.12: ICMP echo reply, id 1845, seq 28, length 64
22:37:45.305707 IP 10.8.2.12 > 192.154.198.15: ICMP echo request, id 1845, seq 29, length 64
22:37:45.622426 IP 192.154.198.15 > 10.8.2.12: ICMP echo reply, id 1845, seq 29, length 64
22:37:46.307358 IP 10.8.2.12 > 192.154.198.15: ICMP echo request, id 1845, seq 30, length 64
22:37:46.624019 IP 192.154.198.15 > 10.8.2.12: ICMP echo reply, id 1845, seq 30, length 64
22:37:47.308928 IP 10.8.2.12 > 192.154.198.15: ICMP echo request, id 1845, seq 31, length 64
22:37:47.625615 IP 192.154.198.15 > 10.8.2.12: ICMP echo reply, id 1845, seq 31, length 64
22:37:48.310540 IP 10.8.2.12 > 192.154.198.15: ICMP echo request, id 1845, seq 32, length 64
22:37:48.627504 IP 192.154.198.15 > 10.8.2.12: ICMP echo reply, id 1845, seq 32, length 64
22:37:49.311394 IP 10.8.2.12 > 192.154.198.15: ICMP echo request, id 1845, seq 33, length 64
22:37:49.628121 IP 192.154.198.15 > 10.8.2.12: ICMP echo reply, id 1845, seq 33, length 64
22:37:50.313042 IP 10.8.2.12 > 192.154.198.15: ICMP echo request, id 1845, seq 34, length 64
22:37:50.630160 IP 192.154.198.15 > 10.8.2.12: ICMP echo reply, id 1845, seq 34, length 64
22:37:51.314075 IP 10.8.2.12 > 192.154.198.15: ICMP echo request, id 1845, seq 35, length 64
22:37:51.630837 IP 192.154.198.15 > 10.8.2.12: ICMP echo reply, id 1845, seq 35, length 64
22:37:52.315716 IP 10.8.2.12 > 192.154.198.15: ICMP echo request, id 1845, seq 36, length 64
22:37:52.632754 IP 192.154.198.15 > 10.8.2.12: ICMP echo reply, id 1845, seq 36, length 64
22:37:53.316665 IP 10.8.2.12 > 192.154.198.15: ICMP echo request, id 1845, seq 37, length 64
22:37:53.633356 IP 192.154.198.15 > 10.8.2.12: ICMP echo reply, id 1845, seq 37, length 64
22:37:54.318277 IP 10.8.2.12 > 192.154.198.15: ICMP echo request, id 1845, seq 38, length 64
22:37:54.634968 IP 192.154.198.15 > 10.8.2.12: ICMP echo reply, id 1845, seq 38, length 64
22:37:55.319879 IP 10.8.2.12 > 192.154.198.15: ICMP echo request, id 1845, seq 39, length 64
22:37:55.636582 IP 192.154.198.15 > 10.8.2.12: ICMP echo reply, id 1845, seq 39, length 64
22:37:56.321502 IP 10.8.2.12 > 192.154.198.15: ICMP echo request, id 1845, seq 40, length 64
22:37:56.638454 IP 192.154.198.15 > 10.8.2.12: ICMP echo reply, id 1845, seq 40, length 64
22:37:57.322375 IP 10.8.2.12 > 192.154.198.15: ICMP echo request, id 1845, seq 41, length 64
22:37:57.639065 IP 192.154.198.15 > 10.8.2.12: ICMP echo reply, id 1845, seq 41, length 64
22:37:58.323969 IP 10.8.2.12 > 192.154.198.15: ICMP echo request, id 1845, seq 42, length 64
22:37:58.640771 IP 192.154.198.15 > 10.8.2.12: ICMP echo reply, id 1845, seq 42, length 64
22:37:59.325692 IP 10.8.2.12 > 192.154.198.15: ICMP echo request, id 1845, seq 43, length 64
22:37:59.642577 IP 192.154.198.15 > 10.8.2.12: ICMP echo reply, id 1845, seq 43, length 64
22:38:00.326452 IP 10.8.2.12 > 192.154.198.15: ICMP echo request, id 1845, seq 44, length 64
22:38:00.643299 IP 192.154.198.15 > 10.8.2.12: ICMP echo reply, id 1845, seq 44, length 64
22:38:01.327225 IP 10.8.2.12 > 192.154.198.15: ICMP echo request, id 1845, seq 45, length 64
22:38:01.653650 IP 192.154.198.15 > 10.8.2.12: ICMP echo reply, id 1845, seq 45, length 64
22:38:02.328550 IP 10.8.2.12 > 192.154.198.15: ICMP echo request, id 1845, seq 46, length 64
22:38:02.645297 IP 192.154.198.15 > 10.8.2.12: ICMP echo reply, id 1845, seq 46, length 64
22:38:03.330212 IP 10.8.2.12 > 192.154.198.15: ICMP echo request, id 1845, seq 47, length 64
22:38:03.647090 IP 192.154.198.15 > 10.8.2.12: ICMP echo reply, id 1845, seq 47, length 64
22:38:04.330994 IP 10.8.2.12 > 192.154.198.15: ICMP echo request, id 1845, seq 48, length 64
22:38:04.647899 IP 192.154.198.15 > 10.8.2.12: ICMP echo reply, id 1845, seq 48, length 64
22:38:05.331815 IP 10.8.2.12 > 192.154.198.15: ICMP echo request, id 1845, seq 49, length 64
22:38:05.648536 IP 192.154.198.15 > 10.8.2.12: ICMP echo reply, id 1845, seq 49, length 64
22:38:06.333451 IP 10.8.2.12 > 192.154.198.15: ICMP echo request, id 1845, seq 50, length 64
22:38:06.651208 IP 192.154.198.15 > 10.8.2.12: ICMP echo reply, id 1845, seq 50, length 64
22:38:07.335148 IP 10.8.2.12 > 192.154.198.15: ICMP echo request, id 1845, seq 51, length 64
22:38:07.652963 IP 192.154.198.15 > 10.8.2.12: ICMP echo reply, id 1845, seq 51, length 64
22:38:08.336883 IP 10.8.2.12 > 192.154.198.15: ICMP echo request, id 1845, seq 52, length 64
22:38:08.656206 IP 192.154.198.15 > 10.8.2.12: ICMP echo reply, id 1845, seq 52, length 64
22:38:09.338115 IP 10.8.2.12 > 192.154.198.15: ICMP echo request, id 1845, seq 53, length 64
22:38:09.655003 IP 192.154.198.15 > 10.8.2.12: ICMP echo reply, id 1845, seq 53, length 64
22:38:10.338863 IP 10.8.2.12 > 192.154.198.15: ICMP echo request, id 1845, seq 54, length 64
22:38:10.655764 IP 192.154.198.15 > 10.8.2.12: ICMP echo reply, id 1845, seq 54, length 64
22:38:11.339686 IP 10.8.2.12 > 192.154.198.15: ICMP echo request, id 1845, seq 55, length 64
22:38:11.656543 IP 192.154.198.15 > 10.8.2.12: ICMP echo reply, id 1845, seq 55, length 64
22:38:12.341415 IP 10.8.2.12 > 192.154.198.15: ICMP echo request, id 1845, seq 56, length 64
22:38:12.658094 IP 192.154.198.15 > 10.8.2.12: ICMP echo reply, id 1845, seq 56, length 64
22:38:13.343010 IP 10.8.2.12 > 192.154.198.15: ICMP echo request, id 1845, seq 57, length 64
22:38:13.659876 IP 192.154.198.15 > 10.8.2.12: ICMP echo reply, id 1845, seq 57, length 64
22:38:14.343788 IP 10.8.2.12 > 192.154.198.15: ICMP echo request, id 1845, seq 58, length 64
