08:02:26.082823 IP 10.8.0.2 > 103.156.51.81: ICMP echo request, id 815, seq 2, length 64
08:02:26.514028 IP 103.156.51.81 > 10.8.0.2: ICMP echo reply, id 815, seq 2, length 64
08:02:27.083856 IP 10.8.0.2 > 103.156.51.81: ICMP echo request, id 815, seq 3, length 64
08:02:27.515248 IP 103.156.51.81 > 10.8.0.2: ICMP echo reply, id 815, seq 3, length 64
08:02:28.085083 IP 10.8.0.2 > 103.156.51.81: ICMP echo request, id 815, seq 4, length 64
08:02:29.086202 IP 10.8.0.2 > 103.156.51.81: ICMP echo request, id 815, seq 5, length 64
08:02:29.517488 IP 103.156.51.81 > 10.8.0.2: ICMP echo reply, id 815, seq 5, length 64
08:02:30.087299 IP 10.8.0.2 > 103.156.51.81: ICMP echo request, id 815, seq 6, length 64
08:02:30.518461 IP 103.156.51.81 > 10.8.0.2: ICMP echo reply, id 815, seq 6, length 64
08:02:31.088273 IP 10.8.0.2 > 103.156.51.81: ICMP echo request, id 815, seq 7, length 64
08:02:31.519300 IP 103.156.51.81 > 10.8.0.2: ICMP echo reply, id 815, seq 7, length 64
08:02:32.089117 IP 10.8.0.2 > 103.156.51.81: ICMP echo request, id 815, seq 8, length 64
08:02:33.118215 IP 10.8.0.2 > 103.156.51.81: ICMP echo request, id 815, seq 9, length 64
08:02:33.549721 IP 103.156.51.81 > 10.8.0.2: ICMP echo reply, id 815, seq 9, length 64
08:02:34.119559 IP 10.8.0.2 > 103.156.51.81: ICMP echo request, id 815, seq 10, length 64
08:02:34.550651 IP 103.156.51.81 > 10.8.0.2: ICMP echo reply, id 815, seq 10, length 64
08:02:35.120496 IP 10.8.0.2 > 103.156.51.81: ICMP echo request, id 815, seq 11, length 64
08:02:36.126228 IP 10.8.0.2 > 103.156.51.81: ICMP echo request, id 815, seq 12, length 64
08:02:36.581564 IP 103.156.51.81 > 10.8.0.2: ICMP echo reply, id 815, seq 12, length 64
08:02:37.127362 IP 10.8.0.2 > 103.156.51.81: ICMP echo request, id 815, seq 13, length 64
08:02:37.607312 IP 103.156.51.81 > 10.8.0.2: ICMP echo reply, id 815, seq 13, length 64
08:02:38.128089 IP 10.8.0.2 > 103.156.51.81: ICMP echo request, id 815, seq 14, length 64
08:02:39.134254 IP 10.8.0.2 > 103.156.51.81: ICMP echo request, id 815, seq 15, length 64
08:02:40.158229 IP 10.8.0.2 > 103.156.51.81: ICMP echo request, id 815, seq 16, length 64
08:02:41.182220 IP 10.8.0.2 > 103.156.51.81: ICMP echo request, id 815, seq 17, length 64
08:02:41.627650 IP 103.156.51.81 > 10.8.0.2: ICMP echo reply, id 815, seq 17, length 64
08:02:42.183456 IP 10.8.0.2 > 103.156.51.81: ICMP echo request, id 815, seq 18, length 64
08:02:42.698607 IP 103.156.51.81 > 10.8.0.2: ICMP echo reply, id 815, seq 18, length 64
08:02:43.184347 IP 10.8.0.2 > 103.156.51.81: ICMP echo request, id 815, seq 19, length 64
08:02:43.717611 IP 103.156.51.81 > 10.8.0.2: ICMP echo reply, id 815, seq 19, length 64
08:02:44.185340 IP 10.8.0.2 > 103.156.51.81: ICMP echo request, id 815, seq 20, length 64
08:02:44.661267 IP 103.156.51.81 > 10.8.0.2: ICMP echo reply, id 815, seq 20, length 64
08:02:45.186010 IP 10.8.0.2 > 103.156.51.81: ICMP echo request, id 815, seq 21, length 64
08:02:45.620781 IP 103.156.51.81 > 10.8.0.2: ICMP echo reply, id 815, seq 21, length 64
08:02:46.187561 IP 10.8.0.2 > 103.156.51.81: ICMP echo request, id 815, seq 22, length 64
08:02:46.622497 IP 103.156.51.81 > 10.8.0.2: ICMP echo reply, id 815, seq 22, length 64
08:02:47.188279 IP 10.8.0.2 > 103.156.51.81: ICMP echo request, id 815, seq 23, length 64
08:02:47.622921 IP 103.156.51.81 > 10.8.0.2: ICMP echo reply, id 815, seq 23, length 64
08:02:48.189704 IP 10.8.0.2 > 103.156.51.81: ICMP echo request, id 815, seq 24, length 64
08:02:48.624705 IP 103.156.51.81 > 10.8.0.2: ICMP echo reply, id 815, seq 24, length 64
08:02:49.190488 IP 10.8.0.2 > 103.156.51.81: ICMP echo request, id 815, seq 25, length 64
08:02:49.625355 IP 103.156.51.81 > 10.8.0.2: ICMP echo reply, id 815, seq 25, length 64
08:02:50.191141 IP 10.8.0.2 > 103.156.51.81: ICMP echo request, id 815, seq 26, length 64
08:02:50.626163 IP 103.156.51.81 > 10.8.0.2: ICMP echo reply, id 815, seq 26, length 64
08:02:51.191951 IP 10.8.0.2 > 103.156.51.81: ICMP echo request, id 815, seq 27, length 64
08:02:52.222211 IP 10.8.0.2 > 103.156.51.81: ICMP echo request, id 815, seq 28, length 64
08:02:52.657116 IP 103.156.51.81 > 10.8.0.2: ICMP echo reply, id 815, seq 28, length 64
08:02:53.222898 IP 10.8.0.2 > 103.156.51.81: ICMP echo request, id 815, seq 29, length 64
08:02:53.657781 IP 103.156.51.81 > 10.8.0.2: ICMP echo reply, id 815, seq 29, length 64
08:02:54.223567 IP 10.8.0.2 > 103.156.51.81: ICMP echo request, id 815, seq 30, length 64
08:02:54.658026 IP 103.156.51.81 > 10.8.0.2: ICMP echo reply, id 815, seq 30, length 64
08:02:55.224847 IP 10.8.0.2 > 103.156.51.81: ICMP echo request, id 815, seq 31, length 64
08:02:55.659444 IP 103.156.51.81 > 10.8.0.2: ICMP echo reply, id 815, seq 31, length 64
08:02:56.226271 IP 10.8.0.2 > 103.156.51.81: ICMP echo request, id 815, seq 32, length 64
08:02:56.660645 IP 103.156.51.81 > 10.8.0.2: ICMP echo reply, id 815, seq 32, length 64
08:02:57.227467 IP 10.8.0.2 > 103.156.51.81: ICMP echo request, id 815, seq 33, length 64
08:02:57.662041 IP 103.156.51.81 > 10.8.0.2: ICMP echo reply, id 815, seq 33, length 64
08:02:58.228873 IP 10.8.0.2 > 103.156.51.81: ICMP echo request, id 815, seq 34, length 64
08:02:58.663515 IP 103.156.51.81 > 10.8.0.2: ICMP echo reply, id 815, seq 34, length 64
08:02:59.230340 IP 10.8.0.2 > 103.156.51.81: ICMP echo request, id 815, seq 35, length 64
08:02:59.665491 IP 103.156.51.81 > 10.8.0.2: ICMP echo reply, id 815, seq 35, length 64
08:03:00.231320 IP 10.8.0.2 > 103.156.51.81: ICMP echo request, id 815, seq 36, length 64
08:03:00.665683 IP 103.156.51.81 > 10.8.0.2: ICMP echo reply, id 815, seq 36, length 64
08:03:01.232511 IP 10.8.0.2 > 103.156.51.81: ICMP echo request, id 815, seq 37, length 64
08:03:01.667552 IP 103.156.51.81 > 10.8.0.2: ICMP echo reply, id 815, seq 37, length 64
08:03:02.233374 IP 10.8.0.2 > 103.156.51.81: ICMP echo request, id 815, seq 38, length 64
08:03:03.262207 IP 10.8.0.2 > 103.156.51.81: ICMP echo request, id 815, seq 39, length 64
08:03:04.286211 IP 10.8.0.2 > 103.156.51.81: ICMP echo request, id 815, seq 40, length 64
08:03:04.720355 IP 103.156.51.81 > 10.8.0.2: ICMP echo reply, id 815, seq 40, length 64
08:03:05.287165 IP 10.8.0.2 > 103.156.51.81: ICMP echo request, id 815, seq 41, length 64
08:03:05.721549 IP 103.156.51.81 > 10.8.0.2: ICMP echo reply, id 815, seq 41, length 64
08:03:06.288361 IP 10.8.0.2 > 103.156.51.81: ICMP echo request, id 815, seq 42, length 64
08:03:06.723367 IP 103.156.51.81 > 10.8.0.2: ICMP echo reply, id 815, seq 42, length 64
08:03:07.289182 IP 10.8.0.2 > 103.156.51.81: ICMP echo request, id 815, seq 43, length 64
08:03:07.723966 IP 103.156.51.81 > 10.8.0.2: ICMP echo reply, id 815, seq 43, length 64
08:03:08.290780 IP 10.8.0.2 > 103.156.51.81: ICMP echo request, id 815, seq 44, length 64
08:03:08.725691 IP 103.156.51.81 > 10.8.0.2: ICMP echo reply, id 815, seq 44, length 64
08:03:09.291496 IP 10.8.0.2 > 103.156.51.81: ICMP echo request, id 815, seq 45, length 64
08:03:09.726436 IP 103.156.51.81 > 10.8.0.2: ICMP echo reply, id 815, seq 45, length 64
08:03:10.292249 IP 10.8.0.2 > 103.156.51.81: ICMP echo request, id 815, seq 46, length 64
08:03:10.726829 IP 103.156.51.81 > 10.8.0.2: ICMP echo reply, id 815, seq 46, length 64
08:03:11.293646 IP 10.8.0.2 > 103.156.51.81: ICMP echo request, id 815, seq 47, length 64
08:03:11.728643 IP 103.156.51.81 > 10.8.0.2: ICMP echo reply, id 815, seq 47, length 64
08:03:12.294446 IP 10.8.0.2 > 103.156.51.81: ICMP echo request, id 815, seq 48, length 64
08:03:12.729072 IP 103.156.51.81 > 10.8.0.2: ICMP echo reply, id 815, seq 48, length 64
08:03:13.295899 IP 10.8.0.2 > 103.156.51.81: ICMP echo request, id 815, seq 49, length 64
08:03:13.730726 IP 103.156.51.81 > 10.8.0.2: ICMP echo reply, id 815, seq 49, length 64
08:03:14.296536 IP 10.8.0.2 > 103.156.51.81: ICMP echo request, id 815, seq 50, length 64
08:03:14.731088 IP 103.156.51.81 > 10.8.0.2: ICMP echo reply, id 815, seq 50, length 64
08:03:15.297901 IP 10.8.0.2 > 103.156.51.81: ICMP echo request, id 815, seq 51, length 64
08:03:15.732699 IP 103.156.51.81 > 10.8.0.2: ICMP echo reply, id 815, seq 51, length 64
08:03:16.299512 IP 10.8.0.2 > 103.156.51.81: ICMP echo request, id 815, seq 52, length 64
08:03:17.310208 IP 10.8.0.2 > 103.156.51.81: ICMP echo request, id 815, seq 53, length 64
08:03:18.334203 IP 10.8.0.2 > 103.156.51.81: ICMP echo request, id 815, seq 54, length 64
08:03:18.768577 IP 103.156.51.81 > 10.8.0.2: ICMP echo reply, id 815, seq 54, length 64
08:03:19.335397 IP 10.8.0.2 > 103.156.51.81: ICMP echo request, id 815, seq 55, length 64
08:03:19.770179 IP 103.156.51.81 > 10.8.0.2: ICMP echo reply, id 815, seq 55, length 64
08:03:20.336995 IP 10.8.0.2 > 103.156.51.81: ICMP echo request, id 815, seq 56, length 64
