14:26:52.619370 IP 10.8.0.5 > 185.216.34.100: ICMP echo request, id 6, seq 2, length 64
14:26:52.880651 IP 185.216.34.100 > 10.8.0.5: ICMP echo reply, id 6, seq 2, length 64
14:26:53.620633 IP 10.8.0.5 > 185.216.34.100: ICMP echo request, id 6, seq 3, length 64
14:26:53.882492 IP 185.216.34.100 > 10.8.0.5: ICMP echo reply, id 6, seq 3, length 64
14:26:54.622405 IP 10.8.0.5 > 185.216.34.100: ICMP echo request, id 6, seq 4, length 64
14:26:54.884093 IP 185.216.34.100 > 10.8.0.5: ICMP echo reply, id 6, seq 4, length 64
14:26:55.624090 IP 10.8.0.5 > 185.216.34.100: ICMP echo request, id 6, seq 5, length 64
14:26:55.885688 IP 185.216.34.100 > 10.8.0.5: ICMP echo reply, id 6, seq 5, length 64
14:26:56.625529 IP 10.8.0.5 > 185.216.34.100: ICMP echo request, id 6, seq 6, length 64
14:26:56.887251 IP 185.216.34.100 > 10.8.0.5: ICMP echo reply, id 6, seq 6, length 64
14:26:57.627235 IP 10.8.0.5 > 185.216.34.100: ICMP echo request, id 6, seq 7, length 64
14:26:57.888590 IP 185.216.34.100 > 10.8.0.5: ICMP echo reply, id 6, seq 7, length 64
14:26:58.628576 IP 10.8.0.5 > 185.216.34.100: ICMP echo request, id 6, seq 8, length 64
14:26:58.889880 IP 185.216.34.100 > 10.8.0.5: ICMP echo reply, id 6, seq 8, length 64
14:26:59.629742 IP 10.8.0.5 > 185.216.34.100: ICMP echo request, id 6, seq 9, length 64
14:26:59.891168 IP 185.216.34.100 > 10.8.0.5: ICMP echo reply, id 6, seq 9, length 64
14:27:00.631168 IP 10.8.0.5 > 185.216.34.100: ICMP echo request, id 6, seq 10, length 64
14:27:00.892589 IP 185.216.34.100 > 10.8.0.5: ICMP echo reply, id 6, seq 10, length 64
14:27:01.632567 IP 10.8.0.5 > 185.216.34.100: ICMP echo request, id 6, seq 11, length 64
14:27:01.894017 IP 185.216.34.100 > 10.8.0.5: ICMP echo reply, id 6, seq 11, length 64
14:27:02.633997 IP 10.8.0.5 > 185.216.34.100: ICMP echo request, id 6, seq 12, length 64
14:27:02.895335 IP 185.216.34.100 > 10.8.0.5: ICMP echo reply, id 6, seq 12, length 64
14:27:03.635313 IP 10.8.0.5 > 185.216.34.100: ICMP echo request, id 6, seq 13, length 64
14:27:03.896610 IP 185.216.34.100 > 10.8.0.5: ICMP echo reply, id 6, seq 13, length 64
14:27:04.636587 IP 10.8.0.5 > 185.216.34.100: ICMP echo request, id 6, seq 14, length 64
14:27:04.898053 IP 185.216.34.100 > 10.8.0.5: ICMP echo reply, id 6, seq 14, length 64
14:27:05.638023 IP 10.8.0.5 > 185.216.34.100: ICMP echo request, id 6, seq 15, length 64
14:27:05.901085 IP 185.216.34.100 > 10.8.0.5: ICMP echo reply, id 6, seq 15, length 64
14:27:06.639060 IP 10.8.0.5 > 185.216.34.100: ICMP echo request, id 6, seq 16, length 64
14:27:06.900708 IP 185.216.34.100 > 10.8.0.5: ICMP echo reply, id 6, seq 16, length 64
14:27:07.640684 IP 10.8.0.5 > 185.216.34.100: ICMP echo request, id 6, seq 17, length 64
14:27:07.902107 IP 185.216.34.100 > 10.8.0.5: ICMP echo reply, id 6, seq 17, length 64
14:27:08.642074 IP 10.8.0.5 > 185.216.34.100: ICMP echo request, id 6, seq 18, length 64
14:27:08.903472 IP 185.216.34.100 > 10.8.0.5: ICMP echo reply, id 6, seq 18, length 64
14:27:09.643409 IP 10.8.0.5 > 185.216.34.100: ICMP echo request, id 6, seq 19, length 64
14:27:09.905232 IP 185.216.34.100 > 10.8.0.5: ICMP echo reply, id 6, seq 19, length 64
14:27:10.645206 IP 10.8.0.5 > 185.216.34.100: ICMP echo request, id 6, seq 20, length 64
14:27:10.910932 IP 185.216.34.100 > 10.8.0.5: ICMP echo reply, id 6, seq 20, length 64
14:27:11.646890 IP 10.8.0.5 > 185.216.34.100: ICMP echo request, id 6, seq 21, length 64
14:27:11.908437 IP 185.216.34.100 > 10.8.0.5: ICMP echo reply, id 6, seq 21, length 64
14:27:12.648402 IP 10.8.0.5 > 185.216.34.100: ICMP echo request, id 6, seq 22, length 64
14:27:12.909958 IP 185.216.34.100 > 10.8.0.5: ICMP echo reply, id 6, seq 22, length 64
14:27:13.649919 IP 10.8.0.5 > 185.216.34.100: ICMP echo request, id 6, seq 23, length 64
14:27:13.911463 IP 185.216.34.100 > 10.8.0.5: ICMP echo reply, id 6, seq 23, length 64
14:27:14.651263 IP 10.8.0.5 > 185.216.34.100: ICMP echo request, id 6, seq 24, length 64
14:27:14.912758 IP 185.216.34.100 > 10.8.0.5: ICMP echo reply, id 6, seq 24, length 64
14:27:15.652722 IP 10.8.0.5 > 185.216.34.100: ICMP echo request, id 6, seq 25, length 64
14:27:15.914368 IP 185.216.34.100 > 10.8.0.5: ICMP echo reply, id 6, seq 25, length 64
14:27:16.654327 IP 10.8.0.5 > 185.216.34.100: ICMP echo request, id 6, seq 26, length 64
14:27:16.915777 IP 185.216.34.100 > 10.8.0.5: ICMP echo reply, id 6, seq 26, length 64
14:27:17.655745 IP 10.8.0.5 > 185.216.34.100: ICMP echo request, id 6, seq 27, length 64
14:27:17.917186 IP 185.216.34.100 > 10.8.0.5: ICMP echo reply, id 6, seq 27, length 64
14:27:18.657148 IP 10.8.0.5 > 185.216.34.100: ICMP echo request, id 6, seq 28, length 64
14:27:18.918440 IP 185.216.34.100 > 10.8.0.5: ICMP echo reply, id 6, seq 28, length 64
14:27:19.658402 IP 10.8.0.5 > 185.216.34.100: ICMP echo request, id 6, seq 29, length 64
14:27:19.920044 IP 185.216.34.100 > 10.8.0.5: ICMP echo reply, id 6, seq 29, length 64
14:27:20.660013 IP 10.8.0.5 > 185.216.34.100: ICMP echo request, id 6, seq 30, length 64
14:27:20.921485 IP 185.216.34.100 > 10.8.0.5: ICMP echo reply, id 6, seq 30, length 64
14:27:21.661451 IP 10.8.0.5 > 185.216.34.100: ICMP echo request, id 6, seq 31, length 64
14:27:21.923424 IP 185.216.34.100 > 10.8.0.5: ICMP echo reply, id 6, seq 31, length 64
14:27:22.662384 IP 10.8.0.5 > 185.216.34.100: ICMP echo request, id 6, seq 32, length 64
14:27:22.923855 IP 185.216.34.100 > 10.8.0.5: ICMP echo reply, id 6, seq 32, length 64
14:27:23.663815 IP 10.8.0.5 > 185.216.34.100: ICMP echo request, id 6, seq 33, length 64
14:27:23.928822 IP 185.216.34.100 > 10.8.0.5: ICMP echo reply, id 6, seq 33, length 64
14:27:24.664791 IP 10.8.0.5 > 185.216.34.100: ICMP echo request, id 6, seq 34, length 64
14:27:24.926261 IP 185.216.34.100 > 10.8.0.5: ICMP echo reply, id 6, seq 34, length 64
14:27:25.666238 IP 10.8.0.5 > 185.216.34.100: ICMP echo request, id 6, seq 35, length 64
14:27:25.962187 IP 185.216.34.100 > 10.8.0.5: ICMP echo reply, id 6, seq 35, length 64
14:27:26.667125 IP 10.8.0.5 > 185.216.34.100: ICMP echo request, id 6, seq 36, length 64
14:27:26.961989 IP 185.216.34.100 > 10.8.0.5: ICMP echo reply, id 6, seq 36, length 64
14:27:27.667933 IP 10.8.0.5 > 185.216.34.100: ICMP echo request, id 6, seq 37, length 64
14:27:27.941219 IP 185.216.34.100 > 10.8.0.5: ICMP echo reply, id 6, seq 37, length 64
14:27:28.669172 IP 10.8.0.5 > 185.216.34.100: ICMP echo request, id 6, seq 38, length 64
14:27:28.945447 IP 185.216.34.100 > 10.8.0.5: ICMP echo reply, id 6, seq 38, length 64
14:27:29.670412 IP 10.8.0.5 > 185.216.34.100: ICMP echo request, id 6, seq 39, length 64
14:27:29.943632 IP 185.216.34.100 > 10.8.0.5: ICMP echo reply, id 6, seq 39, length 64
14:27:30.671596 IP 10.8.0.5 > 185.216.34.100: ICMP echo request, id 6, seq 40, length 64
14:27:30.933066 IP 185.216.34.100 > 10.8.0.5: ICMP echo reply, id 6, seq 40, length 64
14:27:31.673032 IP 10.8.0.5 > 185.216.34.100: ICMP echo request, id 6, seq 41, length 64
14:27:31.935468 IP 185.216.34.100 > 10.8.0.5: ICMP echo reply, id 6, seq 41, length 64
14:27:32.674432 IP 10.8.0.5 > 185.216.34.100: ICMP echo request, id 6, seq 42, length 64
14:27:32.936014 IP 185.216.34.100 > 10.8.0.5: ICMP echo reply, id 6, seq 42, length 64
14:27:33.675994 IP 10.8.0.5 > 185.216.34.100: ICMP echo request, id 6, seq 43, length 64
14:27:33.937669 IP 185.216.34.100 > 10.8.0.5: ICMP echo reply, id 6, seq 43, length 64
14:27:34.677646 IP 10.8.0.5 > 185.216.34.100: ICMP echo request, id 6, seq 44, length 64
14:27:34.944144 IP 185.216.34.100 > 10.8.0.5: ICMP echo reply, id 6, seq 44, length 64
14:27:35.679117 IP 10.8.0.5 > 185.216.34.100: ICMP echo request, id 6, seq 45, length 64
14:27:35.940531 IP 185.216.34.100 > 10.8.0.5: ICMP echo reply, id 6, seq 45, length 64
14:27:36.680505 IP 10.8.0.5 > 185.216.34.100: ICMP echo request, id 6, seq 46, length 64
14:27:36.942179 IP 185.216.34.100 > 10.8.0.5: ICMP echo reply, id 6, seq 46, length 64
14:27:37.682167 IP 10.8.0.5 > 185.216.34.100: ICMP echo request, id 6, seq 47, length 64
14:27:37.943953 IP 185.216.34.100 > 10.8.0.5: ICMP echo reply, id 6, seq 47, length 64
14:27:38.683914 IP 10.8.0.5 > 185.216.34.100: ICMP echo request, id 6, seq 48, length 64
14:27:38.945554 IP 185.216.34.100 > 10.8.0.5: ICMP echo reply, id 6, seq 48, length 64
14:27:39.685519 IP 10.8.0.5 > 185.216.34.100: ICMP echo request, id 6, seq 49, length 64
14:27:39.950995 IP 185.216.34.100 > 10.8.0.5: ICMP echo reply, id 6, seq 49, length 64
14:27:40.686955 IP 10.8.0.5 > 185.216.34.100: ICMP echo request, id 6, seq 50, length 64
14:27:40.948136 IP 185.216.34.100 > 10.8.0.5: ICMP echo reply, id 6, seq 50, length 64
14:27:41.688099 IP 10.8.0.5 > 185.216.34.100: ICMP echo request, id 6, seq 51, length 64
14:27:41.949605 IP 185.216.34.100 > 10.8.0.5: ICMP echo reply, id 6, seq 51, length 64
14:27:42.689579 IP 10.8.0.5 > 185.216.34.100: ICMP echo request, id 6, seq 52, length 64
14:27:42.951062 IP 185.216.34.100 > 10.8.0.5: ICMP echo reply, id 6, seq 52, length 64
14:27:43.691049 IP 10.8.0.5 > 185.216.34.100: ICMP echo request, id 6, seq 53, length 64
14:27:43.962822 IP 185.216.34.100 > 10.8.0.5: ICMP echo reply, id 6, seq 53, length 64
14:27:44.692783 IP 10.8.0.5 > 185.216.34.100: ICMP echo request, id 6, seq 54, length 64
14:27:44.954070 IP 185.216.34.100 > 10.8.0.5: ICMP echo reply, id 6, seq 54, length 64
14:27:45.694035 IP 10.8.0.5 > 185.216.34.100: ICMP echo request, id 6, seq 55, length 64
14:27:45.956896 IP 185.216.34.100 > 10.8.0.5: ICMP echo reply, id 6, seq 55, length 64
14:27:46.694855 IP 10.8.0.5 > 185.216.34.100: ICMP echo request, id 6, seq 56, length 64
14:27:46.956237 IP 185.216.34.100 > 10.8.0.5: ICMP echo reply, id 6, seq 56, length 64
14:27:47.696186 IP 10.8.0.5 > 185.216.34.100: ICMP echo request, id 6, seq 57, length 64
14:27:47.957801 IP 185.216.34.100 > 10.8.0.5: ICMP echo reply, id 6, seq 57, length 64
14:27:48.697762 IP 10.8.0.5 > 185.216.34.100: ICMP echo request, id 6, seq 58, length 64
14:27:48.959799 IP 185.216.34.100 > 10.8.0.5: ICMP echo reply, id 6, seq 58, length 64
14:27:49.698782 IP 10.8.0.5 > 185.216.34.100: ICMP echo request, id 6, seq 59, length 64
14:27:49.960224 IP 185.216.34.100 > 10.8.0.5: ICMP echo reply, id 6, seq 59, length 64
14:27:50.700200 IP 10.8.0.5 > 185.216.34.100: ICMP echo request, id 6, seq 60, length 64
14:27:50.961662 IP 185.216.34.100 > 10.8.0.5: ICMP echo reply, id 6, seq 60, length 64
14:27:51.701645 IP 10.8.0.5 > 185.216.34.100: ICMP echo request, id 6, seq 61, length 64
