01:51:49.179348 IP 10.8.2.5 > 185.134.114.44: ICMP echo request, id 2574, seq 2, length 64
01:51:49.630841 IP 185.134.114.44 > 10.8.2.5: ICMP echo reply, id 2574, seq 2, length 64
01:51:50.180641 IP 10.8.2.5 > 185.134.114.44: ICMP echo request, id 2574, seq 3, length 64
01:51:50.632278 IP 185.134.114.44 > 10.8.2.5: ICMP echo reply, id 2574, seq 3, length 64
01:51:51.182104 IP 10.8.2.5 > 185.134.114.44: ICMP echo request, id 2574, seq 4, length 64
01:51:51.633743 IP 185.134.114.44 > 10.8.2.5: ICMP echo reply, id 2574, seq 4, length 64
01:51:52.183526 IP 10.8.2.5 > 185.134.114.44: ICMP echo request, id 2574, seq 5, length 64
01:51:52.635194 IP 185.134.114.44 > 10.8.2.5: ICMP echo reply, id 2574, seq 5, length 64
01:51:53.184970 IP 10.8.2.5 > 185.134.114.44: ICMP echo request, id 2574, seq 6, length 64
01:51:53.636333 IP 185.134.114.44 > 10.8.2.5: ICMP echo reply, id 2574, seq 6, length 64
01:51:54.186119 IP 10.8.2.5 > 185.134.114.44: ICMP echo request, id 2574, seq 7, length 64
01:51:54.637605 IP 185.134.114.44 > 10.8.2.5: ICMP echo reply, id 2574, seq 7, length 64
01:51:55.187399 IP 10.8.2.5 > 185.134.114.44: ICMP echo request, id 2574, seq 8, length 64
01:51:55.639323 IP 185.134.114.44 > 10.8.2.5: ICMP echo reply, id 2574, seq 8, length 64
01:51:56.188116 IP 10.8.2.5 > 185.134.114.44: ICMP echo request, id 2574, seq 9, length 64
01:51:56.639561 IP 185.134.114.44 > 10.8.2.5: ICMP echo reply, id 2574, seq 9, length 64
01:51:57.189355 IP 10.8.2.5 > 185.134.114.44: ICMP echo request, id 2574, seq 10, length 64
01:51:57.644397 IP 185.134.114.44 > 10.8.2.5: ICMP echo reply, id 2574, seq 10, length 64
01:51:58.190187 IP 10.8.2.5 > 185.134.114.44: ICMP echo request, id 2574, seq 11, length 64
01:51:58.642099 IP 185.134.114.44 > 10.8.2.5: ICMP echo reply, id 2574, seq 11, length 64
01:51:59.190883 IP 10.8.2.5 > 185.134.114.44: ICMP echo request, id 2574, seq 12, length 64
01:51:59.642425 IP 185.134.114.44 > 10.8.2.5: ICMP echo reply, id 2574, seq 12, length 64
01:52:00.192226 IP 10.8.2.5 > 185.134.114.44: ICMP echo request, id 2574, seq 13, length 64
01:52:00.643757 IP 185.134.114.44 > 10.8.2.5: ICMP echo reply, id 2574, seq 13, length 64
01:52:01.193541 IP 10.8.2.5 > 185.134.114.44: ICMP echo request, id 2574, seq 14, length 64
01:52:01.645193 IP 185.134.114.44 > 10.8.2.5: ICMP echo reply, id 2574, seq 14, length 64
01:52:02.194967 IP 10.8.2.5 > 185.134.114.44: ICMP echo request, id 2574, seq 15, length 64
01:52:02.646488 IP 185.134.114.44 > 10.8.2.5: ICMP echo reply, id 2574, seq 15, length 64
01:52:03.196277 IP 10.8.2.5 > 185.134.114.44: ICMP echo request, id 2574, seq 16, length 64
01:52:03.647756 IP 185.134.114.44 > 10.8.2.5: ICMP echo reply, id 2574, seq 16, length 64
01:52:04.197471 IP 10.8.2.5 > 185.134.114.44: ICMP echo request, id 2574, seq 17, length 64
01:52:04.652065 IP 185.134.114.44 > 10.8.2.5: ICMP echo reply, id 2574, seq 17, length 64
01:52:05.198848 IP 10.8.2.5 > 185.134.114.44: ICMP echo request, id 2574, seq 18, length 64
01:52:05.654821 IP 185.134.114.44 > 10.8.2.5: ICMP echo reply, id 2574, seq 18, length 64
01:52:06.199630 IP 10.8.2.5 > 185.134.114.44: ICMP echo request, id 2574, seq 19, length 64
01:52:06.651385 IP 185.134.114.44 > 10.8.2.5: ICMP echo reply, id 2574, seq 19, length 64
01:52:07.201175 IP 10.8.2.5 > 185.134.114.44: ICMP echo request, id 2574, seq 20, length 64
01:52:07.652688 IP 185.134.114.44 > 10.8.2.5: ICMP echo reply, id 2574, seq 20, length 64
01:52:08.202461 IP 10.8.2.5 > 185.134.114.44: ICMP echo request, id 2574, seq 21, length 64
01:52:08.654550 IP 185.134.114.44 > 10.8.2.5: ICMP echo reply, id 2574, seq 21, length 64
01:52:09.203344 IP 10.8.2.5 > 185.134.114.44: ICMP echo request, id 2574, seq 22, length 64
01:52:09.654846 IP 185.134.114.44 > 10.8.2.5: ICMP echo reply, id 2574, seq 22, length 64
01:52:10.204633 IP 10.8.2.5 > 185.134.114.44: ICMP echo request, id 2574, seq 23, length 64
01:52:10.656332 IP 185.134.114.44 > 10.8.2.5: ICMP echo reply, id 2574, seq 23, length 64
01:52:11.206115 IP 10.8.2.5 > 185.134.114.44: ICMP echo request, id 2574, seq 24, length 64
01:52:11.657388 IP 185.134.114.44 > 10.8.2.5: ICMP echo reply, id 2574, seq 24, length 64
01:52:12.207190 IP 10.8.2.5 > 185.134.114.44: ICMP echo request, id 2574, seq 25, length 64
01:52:12.659266 IP 185.134.114.44 > 10.8.2.5: ICMP echo reply, id 2574, seq 25, length 64
01:52:13.208036 IP 10.8.2.5 > 185.134.114.44: ICMP echo request, id 2574, seq 26, length 64
01:52:13.659538 IP 185.134.114.44 > 10.8.2.5: ICMP echo reply, id 2574, seq 26, length 64
01:52:14.209335 IP 10.8.2.5 > 185.134.114.44: ICMP echo request, id 2574, seq 27, length 64
01:52:14.661420 IP 185.134.114.44 > 10.8.2.5: ICMP echo reply, id 2574, seq 27, length 64
01:52:15.210197 IP 10.8.2.5 > 185.134.114.44: ICMP echo request, id 2574, seq 28, length 64
01:52:15.661956 IP 185.134.114.44 > 10.8.2.5: ICMP echo reply, id 2574, seq 28, length 64
01:52:16.211752 IP 10.8.2.5 > 185.134.114.44: ICMP echo request, id 2574, seq 29, length 64
01:52:16.663388 IP 185.134.114.44 > 10.8.2.5: ICMP echo reply, id 2574, seq 29, length 64
01:52:17.213179 IP 10.8.2.5 > 185.134.114.44: ICMP echo request, id 2574, seq 30, length 64
01:52:17.664658 IP 185.134.114.44 > 10.8.2.5: ICMP echo reply, id 2574, seq 30, length 64
01:52:18.214450 IP 10.8.2.5 > 185.134.114.44: ICMP echo request, id 2574, seq 31, length 64
01:52:18.669754 IP 185.134.114.44 > 10.8.2.5: ICMP echo reply, id 2574, seq 31, length 64
01:52:19.215547 IP 10.8.2.5 > 185.134.114.44: ICMP echo request, id 2574, seq 32, length 64
01:52:19.674435 IP 185.134.114.44 > 10.8.2.5: ICMP echo reply, id 2574, seq 32, length 64
01:52:20.216219 IP 10.8.2.5 > 185.134.114.44: ICMP echo request, id 2574, seq 33, length 64
01:52:20.671106 IP 185.134.114.44 > 10.8.2.5: ICMP echo reply, id 2574, seq 33, length 64
01:52:21.216917 IP 10.8.2.5 > 185.134.114.44: ICMP echo request, id 2574, seq 34, length 64
01:52:21.672223 IP 185.134.114.44 > 10.8.2.5: ICMP echo reply, id 2574, seq 34, length 64
01:52:22.218017 IP 10.8.2.5 > 185.134.114.44: ICMP echo request, id 2574, seq 35, length 64
01:52:22.669854 IP 185.134.114.44 > 10.8.2.5: ICMP echo reply, id 2574, seq 35, length 64
01:52:23.218657 IP 10.8.2.5 > 185.134.114.44: ICMP echo request, id 2574, seq 36, length 64
01:52:23.669768 IP 185.134.114.44 > 10.8.2.5: ICMP echo reply, id 2574, seq 36, length 64
01:52:24.219564 IP 10.8.2.5 > 185.134.114.44: ICMP echo request, id 2574, seq 37, length 64
01:52:24.671002 IP 185.134.114.44 > 10.8.2.5: ICMP echo reply, id 2574, seq 37, length 64
01:52:25.220826 IP 10.8.2.5 > 185.134.114.44: ICMP echo request, id 2574, seq 38, length 64
01:52:25.672349 IP 185.134.114.44 > 10.8.2.5: ICMP echo reply, id 2574, seq 38, length 64
01:52:26.222131 IP 10.8.2.5 > 185.134.114.44: ICMP echo request, id 2574, seq 39, length 64
01:52:26.673818 IP 185.134.114.44 > 10.8.2.5: ICMP echo reply, id 2574, seq 39, length 64
01:52:27.223612 IP 10.8.2.5 > 185.134.114.44: ICMP echo request, id 2574, seq 40, length 64
01:52:27.675193 IP 185.134.114.44 > 10.8.2.5: ICMP echo reply, id 2574, seq 40, length 64
01:52:28.224984 IP 10.8.2.5 > 185.134.114.44: ICMP echo request, id 2574, seq 41, length 64
01:52:28.678752 IP 185.134.114.44 > 10.8.2.5: ICMP echo reply, id 2574, seq 41, length 64
01:52:29.226549 IP 10.8.2.5 > 185.134.114.44: ICMP echo request, id 2574, seq 42, length 64
01:52:29.678888 IP 185.134.114.44 > 10.8.2.5: ICMP echo reply, id 2574, seq 42, length 64
01:52:30.227679 IP 10.8.2.5 > 185.134.114.44: ICMP echo request, id 2574, seq 43, length 64
01:52:30.679321 IP 185.134.114.44 > 10.8.2.5: ICMP echo reply, id 2574, seq 43, length 64
01:52:31.229122 IP 10.8.2.5 > 185.134.114.44: ICMP echo request, id 2574, seq 44, length 64
01:52:31.680743 IP 185.134.114.44 > 10.8.2.5: ICMP echo reply, id 2574, seq 44, length 64
01:52:32.230492 IP 10.8.2.5 > 185.134.114.44: ICMP echo request, id 2574, seq 45, length 64
01:52:32.682066 IP 185.134.114.44 > 10.8.2.5: ICMP echo reply, id 2574, seq 45, length 64
01:52:33.231857 IP 10.8.2.5 > 185.134.114.44: ICMP echo request, id 2574, seq 46, length 64
01:52:33.683399 IP 185.134.114.44 > 10.8.2.5: ICMP echo reply, id 2574, seq 46, length 64
01:52:34.233187 IP 10.8.2.5 > 185.134.114.44: ICMP echo request, id 2574, seq 47, length 64
01:52:34.701669 IP 185.134.114.44 > 10.8.2.5: ICMP echo reply, id 2574, seq 47, length 64
01:52:35.234432 IP 10.8.2.5 > 185.134.114.44: ICMP echo request, id 2574, seq 48, length 64
01:52:35.696996 IP 185.134.114.44 > 10.8.2.5: ICMP echo reply, id 2574, seq 48, length 64
01:52:36.235763 IP 10.8.2.5 > 185.134.114.44: ICMP echo request, id 2574, seq 49, length 64
01:52:36.700968 IP 185.134.114.44 > 10.8.2.5: ICMP echo reply, id 2574, seq 49, length 64
01:52:37.236732 IP 10.8.2.5 > 185.134.114.44: ICMP echo request, id 2574, seq 50, length 64
01:52:37.698867 IP 185.134.114.44 > 10.8.2.5: ICMP echo reply, id 2574, seq 50, length 64
01:52:38.237625 IP 10.8.2.5 > 185.134.114.44: ICMP echo request, id 2574, seq 51, length 64
01:52:38.693352 IP 185.134.114.44 > 10.8.2.5: ICMP echo reply, id 2574, seq 51, length 64
01:52:39.239131 IP 10.8.2.5 > 185.134.114.44: ICMP echo request, id 2574, seq 52, length 64
01:52:39.690387 IP 185.134.114.44 > 10.8.2.5: ICMP echo reply, id 2574, seq 52, length 64
01:52:40.240180 IP 10.8.2.5 > 185.134.114.44: ICMP echo request, id 2574, seq 53, length 64
01:52:40.713676 IP 185.134.114.44 > 10.8.2.5: ICMP echo reply, id 2574, seq 53, length 64
01:52:41.241454 IP 10.8.2.5 > 185.134.114.44: ICMP echo request, id 2574, seq 54, length 64
01:52:41.699173 IP 185.134.114.44 > 10.8.2.5: ICMP echo reply, id 2574, seq 54, length 64
01:52:42.242951 IP 10.8.2.5 > 185.134.114.44: ICMP echo request, id 2574, seq 55, length 64
01:52:42.694479 IP 185.134.114.44 > 10.8.2.5: ICMP echo reply, id 2574, seq 55, length 64
01:52:43.244275 IP 10.8.2.5 > 185.134.114.44: ICMP echo request, id 2574, seq 56, length 64
01:52:43.695944 IP 185.134.114.44 > 10.8.2.5: ICMP echo reply, id 2574, seq 56, length 64
01:52:44.245739 IP 10.8.2.5 > 185.134.114.44: ICMP echo request, id 2574, seq 57, length 64
01:52:44.697873 IP 185.134.114.44 > 10.8.2.5: ICMP echo reply, id 2574, seq 57, length 64
01:52:45.246663 IP 10.8.2.5 > 185.134.114.44: ICMP echo request, id 2574, seq 58, length 64
01:52:45.700710 IP 185.134.114.44 > 10.8.2.5: ICMP echo reply, id 2574, seq 58, length 64
01:52:46.247486 IP 10.8.2.5 > 185.134.114.44: ICMP echo request, id 2574, seq 59, length 64
01:52:46.698571 IP 185.134.114.44 > 10.8.2.5: ICMP echo reply, id 2574, seq 59, length 64
01:52:47.248362 IP 10.8.2.5 > 185.134.114.44: ICMP echo request, id 2574, seq 60, length 64
01:52:47.702020 IP 185.134.114.44 > 10.8.2.5: ICMP echo reply, id 2574, seq 60, length 64
01:52:48.249801 IP 10.8.2.5 > 185.134.114.44: ICMP echo request, id 2574, seq 61, length 64
