19:34:50.378312 IP 10.8.1.3 > 185.191.204.132: ICMP echo request, id 1166, seq 2, length 64
19:34:50.773845 IP 185.191.204.132 > 10.8.1.3: ICMP echo reply, id 1166, seq 2, length 64
19:34:51.379279 IP 10.8.1.3 > 185.191.204.132: ICMP echo request, id 1166, seq 3, length 64
19:34:51.769991 IP 185.191.204.132 > 10.8.1.3: ICMP echo reply, id 1166, seq 3, length 64
19:34:52.380874 IP 10.8.1.3 > 185.191.204.132: ICMP echo request, id 1166, seq 4, length 64
19:34:52.772047 IP 185.191.204.132 > 10.8.1.3: ICMP echo reply, id 1166, seq 4, length 64
19:34:53.381911 IP 10.8.1.3 > 185.191.204.132: ICMP echo request, id 1166, seq 5, length 64
19:34:53.775036 IP 185.191.204.132 > 10.8.1.3: ICMP echo reply, id 1166, seq 5, length 64
19:34:54.382934 IP 10.8.1.3 > 185.191.204.132: ICMP echo request, id 1166, seq 6, length 64
19:34:54.772824 IP 185.191.204.132 > 10.8.1.3: ICMP echo reply, id 1166, seq 6, length 64
19:34:55.383256 IP 10.8.1.3 > 185.191.204.132: ICMP echo request, id 1166, seq 7, length 64
19:34:55.773803 IP 185.191.204.132 > 10.8.1.3: ICMP echo reply, id 1166, seq 7, length 64
19:34:56.384672 IP 10.8.1.3 > 185.191.204.132: ICMP echo request, id 1166, seq 8, length 64
19:34:56.776413 IP 185.191.204.132 > 10.8.1.3: ICMP echo reply, id 1166, seq 8, length 64
19:34:57.386237 IP 10.8.1.3 > 185.191.204.132: ICMP echo request, id 1166, seq 9, length 64
19:34:57.777072 IP 185.191.204.132 > 10.8.1.3: ICMP echo reply, id 1166, seq 9, length 64
19:34:58.386912 IP 10.8.1.3 > 185.191.204.132: ICMP echo request, id 1166, seq 10, length 64
19:34:58.783472 IP 185.191.204.132 > 10.8.1.3: ICMP echo reply, id 1166, seq 10, length 64
19:34:59.388333 IP 10.8.1.3 > 185.191.204.132: ICMP echo request, id 1166, seq 11, length 64
19:34:59.784008 IP 185.191.204.132 > 10.8.1.3: ICMP echo reply, id 1166, seq 11, length 64
19:35:00.389675 IP 10.8.1.3 > 185.191.204.132: ICMP echo request, id 1166, seq 12, length 64
19:35:00.784735 IP 185.191.204.132 > 10.8.1.3: ICMP echo reply, id 1166, seq 12, length 64
19:35:01.390598 IP 10.8.1.3 > 185.191.204.132: ICMP echo request, id 1166, seq 13, length 64
19:35:01.781802 IP 185.191.204.132 > 10.8.1.3: ICMP echo reply, id 1166, seq 13, length 64
19:35:02.391266 IP 10.8.1.3 > 185.191.204.132: ICMP echo request, id 1166, seq 14, length 64
19:35:02.783564 IP 185.191.204.132 > 10.8.1.3: ICMP echo reply, id 1166, seq 14, length 64
19:35:03.392427 IP 10.8.1.3 > 185.191.204.132: ICMP echo request, id 1166, seq 15, length 64
19:35:04.411286 IP 10.8.1.3 > 185.191.204.132: ICMP echo request, id 1166, seq 16, length 64
19:35:04.801206 IP 185.191.204.132 > 10.8.1.3: ICMP echo reply, id 1166, seq 16, length 64
19:35:05.412035 IP 10.8.1.3 > 185.191.204.132: ICMP echo request, id 1166, seq 17, length 64
19:35:05.803236 IP 185.191.204.132 > 10.8.1.3: ICMP echo reply, id 1166, seq 17, length 64
19:35:06.413112 IP 10.8.1.3 > 185.191.204.132: ICMP echo request, id 1166, seq 18, length 64
19:35:06.803785 IP 185.191.204.132 > 10.8.1.3: ICMP echo reply, id 1166, seq 18, length 64
19:35:07.414653 IP 10.8.1.3 > 185.191.204.132: ICMP echo request, id 1166, seq 19, length 64
19:35:07.805539 IP 185.191.204.132 > 10.8.1.3: ICMP echo reply, id 1166, seq 19, length 64
19:35:08.415266 IP 10.8.1.3 > 185.191.204.132: ICMP echo request, id 1166, seq 20, length 64
19:35:08.806155 IP 185.191.204.132 > 10.8.1.3: ICMP echo reply, id 1166, seq 20, length 64
19:35:09.416019 IP 10.8.1.3 > 185.191.204.132: ICMP echo request, id 1166, seq 21, length 64
19:35:09.806352 IP 185.191.204.132 > 10.8.1.3: ICMP echo reply, id 1166, seq 21, length 64
19:35:10.417217 IP 10.8.1.3 > 185.191.204.132: ICMP echo request, id 1166, seq 22, length 64
19:35:10.810370 IP 185.191.204.132 > 10.8.1.3: ICMP echo reply, id 1166, seq 22, length 64
19:35:11.418239 IP 10.8.1.3 > 185.191.204.132: ICMP echo request, id 1166, seq 23, length 64
19:35:11.810519 IP 185.191.204.132 > 10.8.1.3: ICMP echo reply, id 1166, seq 23, length 64
19:35:12.419267 IP 10.8.1.3 > 185.191.204.132: ICMP echo request, id 1166, seq 24, length 64
19:35:12.809273 IP 185.191.204.132 > 10.8.1.3: ICMP echo reply, id 1166, seq 24, length 64
19:35:13.420135 IP 10.8.1.3 > 185.191.204.132: ICMP echo request, id 1166, seq 25, length 64
19:35:13.811202 IP 185.191.204.132 > 10.8.1.3: ICMP echo reply, id 1166, seq 25, length 64
19:35:14.421065 IP 10.8.1.3 > 185.191.204.132: ICMP echo request, id 1166, seq 26, length 64
19:35:14.811922 IP 185.191.204.132 > 10.8.1.3: ICMP echo reply, id 1166, seq 26, length 64
19:35:15.421787 IP 10.8.1.3 > 185.191.204.132: ICMP echo request, id 1166, seq 27, length 64
19:35:15.812758 IP 185.191.204.132 > 10.8.1.3: ICMP echo reply, id 1166, seq 27, length 64
19:35:16.422625 IP 10.8.1.3 > 185.191.204.132: ICMP echo request, id 1166, seq 28, length 64
19:35:16.812691 IP 185.191.204.132 > 10.8.1.3: ICMP echo reply, id 1166, seq 28, length 64
19:35:17.423254 IP 10.8.1.3 > 185.191.204.132: ICMP echo request, id 1166, seq 29, length 64
19:35:17.813503 IP 185.191.204.132 > 10.8.1.3: ICMP echo reply, id 1166, seq 29, length 64
19:35:18.424371 IP 10.8.1.3 > 185.191.204.132: ICMP echo request, id 1166, seq 30, length 64
19:35:18.814367 IP 185.191.204.132 > 10.8.1.3: ICMP echo reply, id 1166, seq 30, length 64
19:35:19.425238 IP 10.8.1.3 > 185.191.204.132: ICMP echo request, id 1166, seq 31, length 64
19:35:19.815531 IP 185.191.204.132 > 10.8.1.3: ICMP echo reply, id 1166, seq 31, length 64
19:35:20.426398 IP 10.8.1.3 > 185.191.204.132: ICMP echo request, id 1166, seq 32, length 64
19:35:20.819878 IP 185.191.204.132 > 10.8.1.3: ICMP echo reply, id 1166, seq 32, length 64
19:35:21.427742 IP 10.8.1.3 > 185.191.204.132: ICMP echo request, id 1166, seq 33, length 64
19:35:21.819507 IP 185.191.204.132 > 10.8.1.3: ICMP echo reply, id 1166, seq 33, length 64
19:35:22.429386 IP 10.8.1.3 > 185.191.204.132: ICMP echo request, id 1166, seq 34, length 64
19:35:22.820266 IP 185.191.204.132 > 10.8.1.3: ICMP echo reply, id 1166, seq 34, length 64
19:35:23.430137 IP 10.8.1.3 > 185.191.204.132: ICMP echo request, id 1166, seq 35, length 64
19:35:23.820304 IP 185.191.204.132 > 10.8.1.3: ICMP echo reply, id 1166, seq 35, length 64
19:35:24.431189 IP 10.8.1.3 > 185.191.204.132: ICMP echo request, id 1166, seq 36, length 64
19:35:24.821084 IP 185.191.204.132 > 10.8.1.3: ICMP echo reply, id 1166, seq 36, length 64
19:35:25.431914 IP 10.8.1.3 > 185.191.204.132: ICMP echo request, id 1166, seq 37, length 64
19:35:25.824473 IP 185.191.204.132 > 10.8.1.3: ICMP echo reply, id 1166, seq 37, length 64
19:35:26.433313 IP 10.8.1.3 > 185.191.204.132: ICMP echo request, id 1166, seq 38, length 64
19:35:26.823460 IP 185.191.204.132 > 10.8.1.3: ICMP echo reply, id 1166, seq 38, length 64
19:35:27.434288 IP 10.8.1.3 > 185.191.204.132: ICMP echo request, id 1166, seq 39, length 64
19:35:27.824678 IP 185.191.204.132 > 10.8.1.3: ICMP echo reply, id 1166, seq 39, length 64
19:35:28.435543 IP 10.8.1.3 > 185.191.204.132: ICMP echo request, id 1166, seq 40, length 64
19:35:28.828221 IP 185.191.204.132 > 10.8.1.3: ICMP echo reply, id 1166, seq 40, length 64
19:35:29.437088 IP 10.8.1.3 > 185.191.204.132: ICMP echo request, id 1166, seq 41, length 64
19:35:29.827239 IP 185.191.204.132 > 10.8.1.3: ICMP echo reply, id 1166, seq 41, length 64
19:35:30.438107 IP 10.8.1.3 > 185.191.204.132: ICMP echo request, id 1166, seq 42, length 64
19:35:30.833606 IP 185.191.204.132 > 10.8.1.3: ICMP echo reply, id 1166, seq 42, length 64
19:35:31.439283 IP 10.8.1.3 > 185.191.204.132: ICMP echo request, id 1166, seq 43, length 64
19:35:31.829480 IP 185.191.204.132 > 10.8.1.3: ICMP echo reply, id 1166, seq 43, length 64
19:35:32.440355 IP 10.8.1.3 > 185.191.204.132: ICMP echo request, id 1166, seq 44, length 64
19:35:32.830654 IP 185.191.204.132 > 10.8.1.3: ICMP echo reply, id 1166, seq 44, length 64
19:35:33.441522 IP 10.8.1.3 > 185.191.204.132: ICMP echo request, id 1166, seq 45, length 64
19:35:33.832250 IP 185.191.204.132 > 10.8.1.3: ICMP echo reply, id 1166, seq 45, length 64
19:35:34.443084 IP 10.8.1.3 > 185.191.204.132: ICMP echo request, id 1166, seq 46, length 64
19:35:34.833566 IP 185.191.204.132 > 10.8.1.3: ICMP echo reply, id 1166, seq 46, length 64
19:35:35.444447 IP 10.8.1.3 > 185.191.204.132: ICMP echo request, id 1166, seq 47, length 64
19:35:35.837214 IP 185.191.204.132 > 10.8.1.3: ICMP echo reply, id 1166, seq 47, length 64
19:35:36.446075 IP 10.8.1.3 > 185.191.204.132: ICMP echo request, id 1166, seq 48, length 64
19:35:36.838417 IP 185.191.204.132 > 10.8.1.3: ICMP echo reply, id 1166, seq 48, length 64
19:35:37.447264 IP 10.8.1.3 > 185.191.204.132: ICMP echo request, id 1166, seq 49, length 64
19:35:37.838823 IP 185.191.204.132 > 10.8.1.3: ICMP echo reply, id 1166, seq 49, length 64
19:35:38.448692 IP 10.8.1.3 > 185.191.204.132: ICMP echo request, id 1166, seq 50, length 64
19:35:38.840553 IP 185.191.204.132 > 10.8.1.3: ICMP echo reply, id 1166, seq 50, length 64
19:35:39.449413 IP 10.8.1.3 > 185.191.204.132: ICMP echo request, id 1166, seq 51, length 64
19:35:39.839604 IP 185.191.204.132 > 10.8.1.3: ICMP echo reply, id 1166, seq 51, length 64
19:35:40.450469 IP 10.8.1.3 > 185.191.204.132: ICMP echo request, id 1166, seq 52, length 64
19:35:40.841192 IP 185.191.204.132 > 10.8.1.3: ICMP echo reply, id 1166, seq 52, length 64
19:35:41.452014 IP 10.8.1.3 > 185.191.204.132: ICMP echo request, id 1166, seq 53, length 64
19:35:41.843838 IP 185.191.204.132 > 10.8.1.3: ICMP echo reply, id 1166, seq 53, length 64
19:35:42.452697 IP 10.8.1.3 > 185.191.204.132: ICMP echo request, id 1166, seq 54, length 64
19:35:42.843999 IP 185.191.204.132 > 10.8.1.3: ICMP echo reply, id 1166, seq 54, length 64
19:35:43.453612 IP 10.8.1.3 > 185.191.204.132: ICMP echo request, id 1166, seq 55, length 64
19:35:43.844224 IP 185.191.204.132 > 10.8.1.3: ICMP echo reply, id 1166, seq 55, length 64
19:35:44.455104 IP 10.8.1.3 > 185.191.204.132: ICMP echo request, id 1166, seq 56, length 64
19:35:44.845323 IP 185.191.204.132 > 10.8.1.3: ICMP echo reply, id 1166, seq 56, length 64
19:35:45.456197 IP 10.8.1.3 > 185.191.204.132: ICMP echo request, id 1166, seq 57, length 64
19:35:45.847495 IP 185.191.204.132 > 10.8.1.3: ICMP echo reply, id 1166, seq 57, length 64
19:35:46.457367 IP 10.8.1.3 > 185.191.204.132: ICMP echo request, id 1166, seq 58, length 64
19:35:46.849125 IP 185.191.204.132 > 10.8.1.3: ICMP echo reply, id 1166, seq 58, length 64
19:35:47.458948 IP 10.8.1.3 > 185.191.204.132: ICMP echo request, id 1166, seq 59, length 64
19:35:47.849554 IP 185.191.204.132 > 10.8.1.3: ICMP echo reply, id 1166, seq 59, length 64
19:35:48.460434 IP 10.8.1.3 > 185.191.204.132: ICMP echo request, id 1166, seq 60, length 64
19:35:48.852018 IP 185.191.204.132 > 10.8.1.3: ICMP echo reply, id 1166, seq 60, length 64
19:35:49.461897 IP 10.8.1.3 > 185.191.204.132: ICMP echo request, id 1166, seq 61, length 64
