15:57:24.000673 IP 185.191.204.132 > 10.8.2.19: ICMP echo reply, id 346, seq 2, length 64
15:57:24.626456 IP 10.8.2.19 > 185.191.204.132: ICMP echo request, id 346, seq 3, length 64
15:57:25.001212 IP 185.191.204.132 > 10.8.2.19: ICMP echo reply, id 346, seq 3, length 64
15:57:25.627101 IP 10.8.2.19 > 185.191.204.132: ICMP echo request, id 346, seq 4, length 64
15:57:26.001664 IP 185.191.204.132 > 10.8.2.19: ICMP echo reply, id 346, seq 4, length 64
15:57:26.627525 IP 10.8.2.19 > 185.191.204.132: ICMP echo request, id 346, seq 5, length 64
15:57:27.002206 IP 185.191.204.132 > 10.8.2.19: ICMP echo reply, id 346, seq 5, length 64
15:57:27.628058 IP 10.8.2.19 > 185.191.204.132: ICMP echo request, id 346, seq 6, length 64
15:57:28.002254 IP 185.191.204.132 > 10.8.2.19: ICMP echo reply, id 346, seq 6, length 64
15:57:28.628101 IP 10.8.2.19 > 185.191.204.132: ICMP echo request, id 346, seq 7, length 64
15:57:29.002548 IP 185.191.204.132 > 10.8.2.19: ICMP echo reply, id 346, seq 7, length 64
15:57:29.628368 IP 10.8.2.19 > 185.191.204.132: ICMP echo request, id 346, seq 8, length 64
15:57:30.002270 IP 185.191.204.132 > 10.8.2.19: ICMP echo reply, id 346, seq 8, length 64
15:57:30.628096 IP 10.8.2.19 > 185.191.204.132: ICMP echo request, id 346, seq 9, length 64
15:57:31.643240 IP 10.8.2.19 > 185.191.204.132: ICMP echo request, id 346, seq 10, length 64
15:57:32.667238 IP 10.8.2.19 > 185.191.204.132: ICMP echo request, id 346, seq 11, length 64
15:57:32.953200 IP 185.191.204.132 > 10.8.2.19: ICMP echo reply, id 346, seq 10, length 64
15:57:33.042178 IP 185.191.204.132 > 10.8.2.19: ICMP echo reply, id 346, seq 11, length 64
15:57:33.667022 IP 10.8.2.19 > 185.191.204.132: ICMP echo request, id 346, seq 12, length 64
15:57:34.044034 IP 185.191.204.132 > 10.8.2.19: ICMP echo reply, id 346, seq 12, length 64
15:57:34.666872 IP 10.8.2.19 > 185.191.204.132: ICMP echo request, id 346, seq 13, length 64
15:57:35.041065 IP 185.191.204.132 > 10.8.2.19: ICMP echo reply, id 346, seq 13, length 64
15:57:35.666914 IP 10.8.2.19 > 185.191.204.132: ICMP echo request, id 346, seq 14, length 64
15:57:36.041449 IP 185.191.204.132 > 10.8.2.19: ICMP echo reply, id 346, seq 14, length 64
15:57:36.667263 IP 10.8.2.19 > 185.191.204.132: ICMP echo request, id 346, seq 15, length 64
15:57:37.042514 IP 185.191.204.132 > 10.8.2.19: ICMP echo reply, id 346, seq 15, length 64
15:57:37.667322 IP 10.8.2.19 > 185.191.204.132: ICMP echo request, id 346, seq 16, length 64
15:57:38.041529 IP 185.191.204.132 > 10.8.2.19: ICMP echo reply, id 346, seq 16, length 64
15:57:38.667337 IP 10.8.2.19 > 185.191.204.132: ICMP echo request, id 346, seq 17, length 64
15:57:39.043097 IP 185.191.204.132 > 10.8.2.19: ICMP echo reply, id 346, seq 17, length 64
15:57:39.667953 IP 10.8.2.19 > 185.191.204.132: ICMP echo request, id 346, seq 18, length 64
15:57:40.043705 IP 185.191.204.132 > 10.8.2.19: ICMP echo reply, id 346, seq 18, length 64
15:57:40.668546 IP 10.8.2.19 > 185.191.204.132: ICMP echo request, id 346, seq 19, length 64
15:57:41.043637 IP 185.191.204.132 > 10.8.2.19: ICMP echo reply, id 346, seq 19, length 64
15:57:41.668480 IP 10.8.2.19 > 185.191.204.132: ICMP echo request, id 346, seq 20, length 64
15:57:42.058851 IP 185.191.204.132 > 10.8.2.19: ICMP echo reply, id 346, seq 20, length 64
15:57:42.668682 IP 10.8.2.19 > 185.191.204.132: ICMP echo request, id 346, seq 21, length 64
15:57:43.043051 IP 185.191.204.132 > 10.8.2.19: ICMP echo reply, id 346, seq 21, length 64
15:57:43.668918 IP 10.8.2.19 > 185.191.204.132: ICMP echo request, id 346, seq 22, length 64
15:57:44.043108 IP 185.191.204.132 > 10.8.2.19: ICMP echo reply, id 346, seq 22, length 64
15:57:44.668958 IP 10.8.2.19 > 185.191.204.132: ICMP echo request, id 346, seq 23, length 64
15:57:45.691243 IP 10.8.2.19 > 185.191.204.132: ICMP echo request, id 346, seq 24, length 64
15:57:46.258413 IP 185.191.204.132 > 10.8.2.19: ICMP echo reply, id 346, seq 23, length 64
15:57:46.258945 IP 185.191.204.132 > 10.8.2.19: ICMP echo reply, id 346, seq 24, length 64
15:57:46.691599 IP 10.8.2.19 > 185.191.204.132: ICMP echo request, id 346, seq 25, length 64
15:57:47.066348 IP 185.191.204.132 > 10.8.2.19: ICMP echo reply, id 346, seq 25, length 64
15:57:47.692190 IP 10.8.2.19 > 185.191.204.132: ICMP echo request, id 346, seq 26, length 64
15:57:48.066900 IP 185.191.204.132 > 10.8.2.19: ICMP echo reply, id 346, seq 26, length 64
15:57:48.692748 IP 10.8.2.19 > 185.191.204.132: ICMP echo request, id 346, seq 27, length 64
15:57:49.066573 IP 185.191.204.132 > 10.8.2.19: ICMP echo reply, id 346, seq 27, length 64
15:57:49.693412 IP 10.8.2.19 > 185.191.204.132: ICMP echo request, id 346, seq 28, length 64
15:57:50.715244 IP 10.8.2.19 > 185.191.204.132: ICMP echo request, id 346, seq 29, length 64
15:57:51.090849 IP 185.191.204.132 > 10.8.2.19: ICMP echo reply, id 346, seq 29, length 64
15:57:51.715698 IP 10.8.2.19 > 185.191.204.132: ICMP echo request, id 346, seq 30, length 64
15:57:52.090596 IP 185.191.204.132 > 10.8.2.19: ICMP echo reply, id 346, seq 30, length 64
15:57:52.715434 IP 10.8.2.19 > 185.191.204.132: ICMP echo request, id 346, seq 31, length 64
15:57:53.093057 IP 185.191.204.132 > 10.8.2.19: ICMP echo reply, id 346, seq 31, length 64
15:57:53.715897 IP 10.8.2.19 > 185.191.204.132: ICMP echo request, id 346, seq 32, length 64
15:57:54.090302 IP 185.191.204.132 > 10.8.2.19: ICMP echo reply, id 346, seq 32, length 64
15:57:54.716153 IP 10.8.2.19 > 185.191.204.132: ICMP echo request, id 346, seq 33, length 64
15:57:55.090095 IP 185.191.204.132 > 10.8.2.19: ICMP echo reply, id 346, seq 33, length 64
15:57:55.715902 IP 10.8.2.19 > 185.191.204.132: ICMP echo request, id 346, seq 34, length 64
15:57:56.090539 IP 185.191.204.132 > 10.8.2.19: ICMP echo reply, id 346, seq 34, length 64
15:57:56.716390 IP 10.8.2.19 > 185.191.204.132: ICMP echo request, id 346, seq 35, length 64
15:57:57.091590 IP 185.191.204.132 > 10.8.2.19: ICMP echo reply, id 346, seq 35, length 64
15:57:57.716443 IP 10.8.2.19 > 185.191.204.132: ICMP echo request, id 346, seq 36, length 64
15:57:58.090372 IP 185.191.204.132 > 10.8.2.19: ICMP echo reply, id 346, seq 36, length 64
15:57:58.716224 IP 10.8.2.19 > 185.191.204.132: ICMP echo request, id 346, seq 37, length 64
15:57:59.090633 IP 185.191.204.132 > 10.8.2.19: ICMP echo reply, id 346, seq 37, length 64
15:57:59.716486 IP 10.8.2.19 > 185.191.204.132: ICMP echo request, id 346, seq 38, length 64
15:58:00.091157 IP 185.191.204.132 > 10.8.2.19: ICMP echo reply, id 346, seq 38, length 64
15:58:00.717018 IP 10.8.2.19 > 185.191.204.132: ICMP echo request, id 346, seq 39, length 64
15:58:01.091839 IP 185.191.204.132 > 10.8.2.19: ICMP echo reply, id 346, seq 39, length 64
15:58:01.717689 IP 10.8.2.19 > 185.191.204.132: ICMP echo request, id 346, seq 40, length 64
15:58:02.092610 IP 185.191.204.132 > 10.8.2.19: ICMP echo reply, id 346, seq 40, length 64
15:58:02.717461 IP 10.8.2.19 > 185.191.204.132: ICMP echo request, id 346, seq 41, length 64
15:58:03.092579 IP 185.191.204.132 > 10.8.2.19: ICMP echo reply, id 346, seq 41, length 64
15:58:03.717429 IP 10.8.2.19 > 185.191.204.132: ICMP echo request, id 346, seq 42, length 64
15:58:04.091771 IP 185.191.204.132 > 10.8.2.19: ICMP echo reply, id 346, seq 42, length 64
15:58:04.717630 IP 10.8.2.19 > 185.191.204.132: ICMP echo request, id 346, seq 43, length 64
15:58:05.097782 IP 185.191.204.132 > 10.8.2.19: ICMP echo reply, id 346, seq 43, length 64
15:58:05.717627 IP 10.8.2.19 > 185.191.204.132: ICMP echo request, id 346, seq 44, length 64
15:58:06.092139 IP 185.191.204.132 > 10.8.2.19: ICMP echo reply, id 346, seq 44, length 64
15:58:06.717985 IP 10.8.2.19 > 185.191.204.132: ICMP echo request, id 346, seq 45, length 64
15:58:07.094590 IP 185.191.204.132 > 10.8.2.19: ICMP echo reply, id 346, seq 45, length 64
15:58:07.718432 IP 10.8.2.19 > 185.191.204.132: ICMP echo request, id 346, seq 46, length 64
15:58:08.093200 IP 185.191.204.132 > 10.8.2.19: ICMP echo reply, id 346, seq 46, length 64
15:58:08.719044 IP 10.8.2.19 > 185.191.204.132: ICMP echo request, id 346, seq 47, length 64
15:58:09.093824 IP 185.191.204.132 > 10.8.2.19: ICMP echo reply, id 346, seq 47, length 64
15:58:09.719666 IP 10.8.2.19 > 185.191.204.132: ICMP echo request, id 346, seq 48, length 64
15:58:10.093887 IP 185.191.204.132 > 10.8.2.19: ICMP echo reply, id 346, seq 48, length 64
15:58:10.719734 IP 10.8.2.19 > 185.191.204.132: ICMP echo request, id 346, seq 49, length 64
15:58:11.094670 IP 185.191.204.132 > 10.8.2.19: ICMP echo reply, id 346, seq 49, length 64
15:58:11.719507 IP 10.8.2.19 > 185.191.204.132: ICMP echo request, id 346, seq 50, length 64
15:58:12.093684 IP 185.191.204.132 > 10.8.2.19: ICMP echo reply, id 346, seq 50, length 64
15:58:12.719530 IP 10.8.2.19 > 185.191.204.132: ICMP echo request, id 346, seq 51, length 64
15:58:13.094118 IP 185.191.204.132 > 10.8.2.19: ICMP echo reply, id 346, seq 51, length 64
15:58:13.719958 IP 10.8.2.19 > 185.191.204.132: ICMP echo request, id 346, seq 52, length 64
15:58:14.094576 IP 185.191.204.132 > 10.8.2.19: ICMP echo reply, id 346, seq 52, length 64
15:58:14.720416 IP 10.8.2.19 > 185.191.204.132: ICMP echo request, id 346, seq 53, length 64
15:58:15.095533 IP 185.191.204.132 > 10.8.2.19: ICMP echo reply, id 346, seq 53, length 64
15:58:15.720374 IP 10.8.2.19 > 185.191.204.132: ICMP echo request, id 346, seq 54, length 64
15:58:16.095452 IP 185.191.204.132 > 10.8.2.19: ICMP echo reply, id 346, seq 54, length 64
15:58:16.720293 IP 10.8.2.19 > 185.191.204.132: ICMP echo request, id 346, seq 55, length 64
15:58:17.094265 IP 185.191.204.132 > 10.8.2.19: ICMP echo reply, id 346, seq 55, length 64
15:58:17.720106 IP 10.8.2.19 > 185.191.204.132: ICMP echo request, id 346, seq 56, length 64
15:58:18.094299 IP 185.191.204.132 > 10.8.2.19: ICMP echo reply, id 346, seq 56, length 64
15:58:18.720139 IP 10.8.2.19 > 185.191.204.132: ICMP echo request, id 346, seq 57, length 64
15:58:19.093880 IP 185.191.204.132 > 10.8.2.19: ICMP echo reply, id 346, seq 57, length 64
15:58:19.720721 IP 10.8.2.19 > 185.191.204.132: ICMP echo request, id 346, seq 58, length 64
15:58:20.095073 IP 185.191.204.132 > 10.8.2.19: ICMP echo reply, id 346, seq 58, length 64
15:58:20.720940 IP 10.8.2.19 > 185.191.204.132: ICMP echo request, id 346, seq 59, length 64
15:58:21.095516 IP 185.191.204.132 > 10.8.2.19: ICMP echo reply, id 346, seq 59, length 64
15:58:21.721355 IP 10.8.2.19 > 185.191.204.132: ICMP echo request, id 346, seq 60, length 64
15:58:22.095992 IP 185.191.204.132 > 10.8.2.19: ICMP echo reply, id 346, seq 60, length 64
15:58:22.721835 IP 10.8.2.19 > 185.191.204.132: ICMP echo request, id 346, seq 61, length 64
