23:34:52.554285 IP 10.8.2.9 > 185.106.102.201: ICMP echo request, id 2065, seq 1, length 64
23:34:52.841591 IP 185.106.102.201 > 10.8.2.9: ICMP echo reply, id 2065, seq 1, length 64
23:34:53.553693 IP 10.8.2.9 > 185.106.102.201: ICMP echo request, id 2065, seq 2, length 64
23:34:53.857494 IP 185.106.102.201 > 10.8.2.9: ICMP echo reply, id 2065, seq 2, length 64
23:34:54.555218 IP 10.8.2.9 > 185.106.102.201: ICMP echo request, id 2065, seq 3, length 64
23:34:54.842664 IP 185.106.102.201 > 10.8.2.9: ICMP echo reply, id 2065, seq 3, length 64
23:34:55.556593 IP 10.8.2.9 > 185.106.102.201: ICMP echo request, id 2065, seq 4, length 64
23:34:55.856255 IP 185.106.102.201 > 10.8.2.9: ICMP echo reply, id 2065, seq 4, length 64
23:34:56.558179 IP 10.8.2.9 > 185.106.102.201: ICMP echo request, id 2065, seq 5, length 64
23:34:56.858303 IP 185.106.102.201 > 10.8.2.9: ICMP echo reply, id 2065, seq 5, length 64
23:34:57.559195 IP 10.8.2.9 > 185.106.102.201: ICMP echo request, id 2065, seq 6, length 64
23:34:57.846552 IP 185.106.102.201 > 10.8.2.9: ICMP echo reply, id 2065, seq 6, length 64
23:34:58.560488 IP 10.8.2.9 > 185.106.102.201: ICMP echo request, id 2065, seq 7, length 64
23:34:58.861389 IP 185.106.102.201 > 10.8.2.9: ICMP echo reply, id 2065, seq 7, length 64
23:34:59.561306 IP 10.8.2.9 > 185.106.102.201: ICMP echo request, id 2065, seq 8, length 64
23:34:59.862207 IP 185.106.102.201 > 10.8.2.9: ICMP echo reply, id 2065, seq 8, length 64
23:35:00.562131 IP 10.8.2.9 > 185.106.102.201: ICMP echo request, id 2065, seq 9, length 64
23:35:00.865857 IP 185.106.102.201 > 10.8.2.9: ICMP echo reply, id 2065, seq 9, length 64
23:35:01.563781 IP 10.8.2.9 > 185.106.102.201: ICMP echo request, id 2065, seq 10, length 64
23:35:01.873795 IP 185.106.102.201 > 10.8.2.9: ICMP echo reply, id 2065, seq 10, length 64
23:35:02.564710 IP 10.8.2.9 > 185.106.102.201: ICMP echo request, id 2065, seq 11, length 64
23:35:02.880856 IP 185.106.102.201 > 10.8.2.9: ICMP echo reply, id 2065, seq 11, length 64
23:35:03.565756 IP 10.8.2.9 > 185.106.102.201: ICMP echo request, id 2065, seq 12, length 64
23:35:03.869516 IP 185.106.102.201 > 10.8.2.9: ICMP echo reply, id 2065, seq 12, length 64
23:35:04.567439 IP 10.8.2.9 > 185.106.102.201: ICMP echo request, id 2065, seq 13, length 64
23:35:04.871178 IP 185.106.102.201 > 10.8.2.9: ICMP echo reply, id 2065, seq 13, length 64
23:35:05.569063 IP 10.8.2.9 > 185.106.102.201: ICMP echo request, id 2065, seq 14, length 64
23:35:05.856904 IP 185.106.102.201 > 10.8.2.9: ICMP echo reply, id 2065, seq 14, length 64
23:35:06.569839 IP 10.8.2.9 > 185.106.102.201: ICMP echo request, id 2065, seq 15, length 64
23:35:06.856860 IP 185.106.102.201 > 10.8.2.9: ICMP echo reply, id 2065, seq 15, length 64
23:35:07.570787 IP 10.8.2.9 > 185.106.102.201: ICMP echo request, id 2065, seq 16, length 64
23:35:07.872028 IP 185.106.102.201 > 10.8.2.9: ICMP echo reply, id 2065, seq 16, length 64
23:35:08.571941 IP 10.8.2.9 > 185.106.102.201: ICMP echo request, id 2065, seq 17, length 64
23:35:08.859202 IP 185.106.102.201 > 10.8.2.9: ICMP echo reply, id 2065, seq 17, length 64
23:35:09.573102 IP 10.8.2.9 > 185.106.102.201: ICMP echo request, id 2065, seq 18, length 64
23:35:09.876601 IP 185.106.102.201 > 10.8.2.9: ICMP echo reply, id 2065, seq 18, length 64
23:35:10.574524 IP 10.8.2.9 > 185.106.102.201: ICMP echo request, id 2065, seq 19, length 64
23:35:10.861620 IP 185.106.102.201 > 10.8.2.9: ICMP echo reply, id 2065, seq 19, length 64
23:35:11.575552 IP 10.8.2.9 > 185.106.102.201: ICMP echo request, id 2065, seq 20, length 64
23:35:11.875235 IP 185.106.102.201 > 10.8.2.9: ICMP echo reply, id 2065, seq 20, length 64
23:35:12.577150 IP 10.8.2.9 > 185.106.102.201: ICMP echo request, id 2065, seq 21, length 64
23:35:12.892454 IP 185.106.102.201 > 10.8.2.9: ICMP echo reply, id 2065, seq 21, length 64
23:35:13.578365 IP 10.8.2.9 > 185.106.102.201: ICMP echo request, id 2065, seq 22, length 64
23:35:14.587265 IP 10.8.2.9 > 185.106.102.201: ICMP echo request, id 2065, seq 23, length 64
23:35:14.874461 IP 185.106.102.201 > 10.8.2.9: ICMP echo reply, id 2065, seq 23, length 64
23:35:15.588405 IP 10.8.2.9 > 185.106.102.201: ICMP echo request, id 2065, seq 24, length 64
23:35:15.886048 IP 185.106.102.201 > 10.8.2.9: ICMP echo reply, id 2065, seq 24, length 64
23:35:16.589986 IP 10.8.2.9 > 185.106.102.201: ICMP echo request, id 2065, seq 25, length 64
23:35:16.877300 IP 185.106.102.201 > 10.8.2.9: ICMP echo reply, id 2065, seq 25, length 64
23:35:17.591233 IP 10.8.2.9 > 185.106.102.201: ICMP echo request, id 2065, seq 26, length 64
23:35:17.892127 IP 185.106.102.201 > 10.8.2.9: ICMP echo reply, id 2065, seq 26, length 64
23:35:18.592050 IP 10.8.2.9 > 185.106.102.201: ICMP echo request, id 2065, seq 27, length 64
23:35:18.879753 IP 185.106.102.201 > 10.8.2.9: ICMP echo reply, id 2065, seq 27, length 64
23:35:19.593675 IP 10.8.2.9 > 185.106.102.201: ICMP echo request, id 2065, seq 28, length 64
23:35:19.894749 IP 185.106.102.201 > 10.8.2.9: ICMP echo reply, id 2065, seq 28, length 64
23:35:20.594671 IP 10.8.2.9 > 185.106.102.201: ICMP echo request, id 2065, seq 29, length 64
23:35:20.881842 IP 185.106.102.201 > 10.8.2.9: ICMP echo reply, id 2065, seq 29, length 64
23:35:21.595781 IP 10.8.2.9 > 185.106.102.201: ICMP echo request, id 2065, seq 30, length 64
23:35:21.895801 IP 185.106.102.201 > 10.8.2.9: ICMP echo reply, id 2065, seq 30, length 64
23:35:22.596721 IP 10.8.2.9 > 185.106.102.201: ICMP echo request, id 2065, seq 31, length 64
23:35:22.897105 IP 185.106.102.201 > 10.8.2.9: ICMP echo reply, id 2065, seq 31, length 64
23:35:23.598023 IP 10.8.2.9 > 185.106.102.201: ICMP echo request, id 2065, seq 32, length 64
23:35:23.914687 IP 185.106.102.201 > 10.8.2.9: ICMP echo reply, id 2065, seq 32, length 64
23:35:24.599236 IP 10.8.2.9 > 185.106.102.201: ICMP echo request, id 2065, seq 33, length 64
23:35:24.886492 IP 185.106.102.201 > 10.8.2.9: ICMP echo reply, id 2065, seq 33, length 64
23:35:25.600402 IP 10.8.2.9 > 185.106.102.201: ICMP echo request, id 2065, seq 34, length 64
23:35:25.901176 IP 185.106.102.201 > 10.8.2.9: ICMP echo reply, id 2065, seq 34, length 64
23:35:26.602104 IP 10.8.2.9 > 185.106.102.201: ICMP echo request, id 2065, seq 35, length 64
23:35:26.903108 IP 185.106.102.201 > 10.8.2.9: ICMP echo reply, id 2065, seq 35, length 64
23:35:27.603031 IP 10.8.2.9 > 185.106.102.201: ICMP echo request, id 2065, seq 36, length 64
23:35:27.914952 IP 185.106.102.201 > 10.8.2.9: ICMP echo reply, id 2065, seq 36, length 64
23:35:28.603866 IP 10.8.2.9 > 185.106.102.201: ICMP echo request, id 2065, seq 37, length 64
23:35:28.896602 IP 185.106.102.201 > 10.8.2.9: ICMP echo reply, id 2065, seq 37, length 64
23:35:29.605533 IP 10.8.2.9 > 185.106.102.201: ICMP echo request, id 2065, seq 38, length 64
23:35:29.908984 IP 185.106.102.201 > 10.8.2.9: ICMP echo reply, id 2065, seq 38, length 64
23:35:30.606905 IP 10.8.2.9 > 185.106.102.201: ICMP echo request, id 2065, seq 39, length 64
23:35:30.910197 IP 185.106.102.201 > 10.8.2.9: ICMP echo reply, id 2065, seq 39, length 64
23:35:31.608127 IP 10.8.2.9 > 185.106.102.201: ICMP echo request, id 2065, seq 40, length 64
23:35:31.925021 IP 185.106.102.201 > 10.8.2.9: ICMP echo reply, id 2065, seq 40, length 64
23:35:32.608929 IP 10.8.2.9 > 185.106.102.201: ICMP echo request, id 2065, seq 41, length 64
23:35:32.913054 IP 185.106.102.201 > 10.8.2.9: ICMP echo reply, id 2065, seq 41, length 64
23:35:33.609974 IP 10.8.2.9 > 185.106.102.201: ICMP echo request, id 2065, seq 42, length 64
23:35:33.909709 IP 185.106.102.201 > 10.8.2.9: ICMP echo reply, id 2065, seq 42, length 64
23:35:34.611560 IP 10.8.2.9 > 185.106.102.201: ICMP echo request, id 2065, seq 43, length 64
23:35:34.898904 IP 185.106.102.201 > 10.8.2.9: ICMP echo reply, id 2065, seq 43, length 64
23:35:35.612835 IP 10.8.2.9 > 185.106.102.201: ICMP echo request, id 2065, seq 44, length 64
23:35:35.927499 IP 185.106.102.201 > 10.8.2.9: ICMP echo reply, id 2065, seq 44, length 64
23:35:36.614412 IP 10.8.2.9 > 185.106.102.201: ICMP echo request, id 2065, seq 45, length 64
23:35:36.901566 IP 185.106.102.201 > 10.8.2.9: ICMP echo reply, id 2065, seq 45, length 64
23:35:37.615491 IP 10.8.2.9 > 185.106.102.201: ICMP echo request, id 2065, seq 46, length 64
23:35:38.619252 IP 10.8.2.9 > 185.106.102.201: ICMP echo request, id 2065, seq 47, length 64
23:35:38.920395 IP 185.106.102.201 > 10.8.2.9: ICMP echo reply, id 2065, seq 47, length 64
23:35:39.620311 IP 10.8.2.9 > 185.106.102.201: ICMP echo request, id 2065, seq 48, length 64
23:35:39.907370 IP 185.106.102.201 > 10.8.2.9: ICMP echo reply, id 2065, seq 48, length 64
23:35:40.621305 IP 10.8.2.9 > 185.106.102.201: ICMP echo request, id 2065, seq 49, length 64
23:35:40.908819 IP 185.106.102.201 > 10.8.2.9: ICMP echo reply, id 2065, seq 49, length 64
23:35:41.622769 IP 10.8.2.9 > 185.106.102.201: ICMP echo request, id 2065, seq 50, length 64
23:35:41.910082 IP 185.106.102.201 > 10.8.2.9: ICMP echo reply, id 2065, seq 50, length 64
23:35:42.624029 IP 10.8.2.9 > 185.106.102.201: ICMP echo request, id 2065, seq 51, length 64
23:35:42.918259 IP 185.106.102.201 > 10.8.2.9: ICMP echo reply, id 2065, seq 51, length 64
23:35:43.625198 IP 10.8.2.9 > 185.106.102.201: ICMP echo request, id 2065, seq 52, length 64
23:35:43.926228 IP 185.106.102.201 > 10.8.2.9: ICMP echo reply, id 2065, seq 52, length 64
23:35:44.626161 IP 10.8.2.9 > 185.106.102.201: ICMP echo request, id 2065, seq 53, length 64
23:35:45.627269 IP 10.8.2.9 > 185.106.102.201: ICMP echo request, id 2065, seq 54, length 64
23:35:45.928538 IP 185.106.102.201 > 10.8.2.9: ICMP echo reply, id 2065, seq 54, length 64
23:35:46.628469 IP 10.8.2.9 > 185.106.102.201: ICMP echo request, id 2065, seq 55, length 64
23:35:46.932179 IP 185.106.102.201 > 10.8.2.9: ICMP echo reply, id 2065, seq 55, length 64
23:35:47.630103 IP 10.8.2.9 > 185.106.102.201: ICMP echo request, id 2065, seq 56, length 64
23:35:47.943933 IP 185.106.102.201 > 10.8.2.9: ICMP echo reply, id 2065, seq 56, length 64
23:35:48.631854 IP 10.8.2.9 > 185.106.102.201: ICMP echo request, id 2065, seq 57, length 64
23:35:48.930146 IP 185.106.102.201 > 10.8.2.9: ICMP echo reply, id 2065, seq 57, length 64
23:35:49.633080 IP 10.8.2.9 > 185.106.102.201: ICMP echo request, id 2065, seq 58, length 64
23:35:49.933418 IP 185.106.102.201 > 10.8.2.9: ICMP echo reply, id 2065, seq 58, length 64
23:35:50.634362 IP 10.8.2.9 > 185.106.102.201: ICMP echo request, id 2065, seq 59, length 64
23:35:50.934242 IP 185.106.102.201 > 10.8.2.9: ICMP echo reply, id 2065, seq 59, length 64
23:35:51.635207 IP 10.8.2.9 > 185.106.102.201: ICMP echo request, id 2065, seq 60, length 64
