21:29:38.061544 IP 165.73.240.43 > 10.8.2.9: ICMP echo reply, id 1588, seq 1, length 64
21:29:38.880637 IP 10.8.2.9 > 165.73.240.43: ICMP echo request, id 1588, seq 2, length 64
21:29:39.375274 IP 165.73.240.43 > 10.8.2.9: ICMP echo reply, id 1588, seq 2, length 64
21:29:39.881038 IP 10.8.2.9 > 165.73.240.43: ICMP echo request, id 1588, seq 3, length 64
21:29:40.374121 IP 165.73.240.43 > 10.8.2.9: ICMP echo reply, id 1588, seq 3, length 64
21:29:40.880855 IP 10.8.2.9 > 165.73.240.43: ICMP echo request, id 1588, seq 4, length 64
21:29:41.369295 IP 165.73.240.43 > 10.8.2.9: ICMP echo reply, id 1588, seq 4, length 64
21:29:41.881050 IP 10.8.2.9 > 165.73.240.43: ICMP echo request, id 1588, seq 5, length 64
21:29:42.366631 IP 165.73.240.43 > 10.8.2.9: ICMP echo reply, id 1588, seq 5, length 64
21:29:42.881378 IP 10.8.2.9 > 165.73.240.43: ICMP echo request, id 1588, seq 6, length 64
21:29:43.365758 IP 165.73.240.43 > 10.8.2.9: ICMP echo reply, id 1588, seq 6, length 64
21:29:43.881508 IP 10.8.2.9 > 165.73.240.43: ICMP echo request, id 1588, seq 7, length 64
21:29:44.366363 IP 165.73.240.43 > 10.8.2.9: ICMP echo reply, id 1588, seq 7, length 64
21:29:44.881113 IP 10.8.2.9 > 165.73.240.43: ICMP echo request, id 1588, seq 8, length 64
21:29:45.374243 IP 165.73.240.43 > 10.8.2.9: ICMP echo reply, id 1588, seq 8, length 64
21:29:45.880985 IP 10.8.2.9 > 165.73.240.43: ICMP echo request, id 1588, seq 9, length 64
21:29:46.365688 IP 165.73.240.43 > 10.8.2.9: ICMP echo reply, id 1588, seq 9, length 64
21:29:46.881436 IP 10.8.2.9 > 165.73.240.43: ICMP echo request, id 1588, seq 10, length 64
21:29:47.374760 IP 165.73.240.43 > 10.8.2.9: ICMP echo reply, id 1588, seq 10, length 64
21:29:47.881496 IP 10.8.2.9 > 165.73.240.43: ICMP echo request, id 1588, seq 11, length 64
21:29:48.371901 IP 165.73.240.43 > 10.8.2.9: ICMP echo reply, id 1588, seq 11, length 64
21:29:48.881648 IP 10.8.2.9 > 165.73.240.43: ICMP echo request, id 1588, seq 12, length 64
21:29:49.370761 IP 165.73.240.43 > 10.8.2.9: ICMP echo reply, id 1588, seq 12, length 64
21:29:49.881509 IP 10.8.2.9 > 165.73.240.43: ICMP echo request, id 1588, seq 13, length 64
21:29:50.371551 IP 165.73.240.43 > 10.8.2.9: ICMP echo reply, id 1588, seq 13, length 64
21:29:50.881291 IP 10.8.2.9 > 165.73.240.43: ICMP echo request, id 1588, seq 14, length 64
21:29:51.365983 IP 165.73.240.43 > 10.8.2.9: ICMP echo reply, id 1588, seq 14, length 64
21:29:51.881723 IP 10.8.2.9 > 165.73.240.43: ICMP echo request, id 1588, seq 15, length 64
21:29:52.366873 IP 165.73.240.43 > 10.8.2.9: ICMP echo reply, id 1588, seq 15, length 64
21:29:52.881621 IP 10.8.2.9 > 165.73.240.43: ICMP echo request, id 1588, seq 16, length 64
21:29:53.365874 IP 165.73.240.43 > 10.8.2.9: ICMP echo reply, id 1588, seq 16, length 64
21:29:53.881622 IP 10.8.2.9 > 165.73.240.43: ICMP echo request, id 1588, seq 17, length 64
21:29:54.367059 IP 165.73.240.43 > 10.8.2.9: ICMP echo reply, id 1588, seq 17, length 64
21:29:54.881815 IP 10.8.2.9 > 165.73.240.43: ICMP echo request, id 1588, seq 18, length 64
21:29:55.366303 IP 165.73.240.43 > 10.8.2.9: ICMP echo reply, id 1588, seq 18, length 64
21:29:55.882051 IP 10.8.2.9 > 165.73.240.43: ICMP echo request, id 1588, seq 19, length 64
21:29:56.372775 IP 165.73.240.43 > 10.8.2.9: ICMP echo reply, id 1588, seq 19, length 64
21:29:56.882518 IP 10.8.2.9 > 165.73.240.43: ICMP echo request, id 1588, seq 20, length 64
21:29:57.366967 IP 165.73.240.43 > 10.8.2.9: ICMP echo reply, id 1588, seq 20, length 64
21:29:57.882721 IP 10.8.2.9 > 165.73.240.43: ICMP echo request, id 1588, seq 21, length 64
21:29:58.371220 IP 165.73.240.43 > 10.8.2.9: ICMP echo reply, id 1588, seq 21, length 64
21:29:58.882971 IP 10.8.2.9 > 165.73.240.43: ICMP echo request, id 1588, seq 22, length 64
21:29:59.376059 IP 165.73.240.43 > 10.8.2.9: ICMP echo reply, id 1588, seq 22, length 64
21:29:59.882803 IP 10.8.2.9 > 165.73.240.43: ICMP echo request, id 1588, seq 23, length 64
21:30:00.367450 IP 165.73.240.43 > 10.8.2.9: ICMP echo reply, id 1588, seq 23, length 64
21:30:00.883236 IP 10.8.2.9 > 165.73.240.43: ICMP echo request, id 1588, seq 24, length 64
21:30:01.368114 IP 165.73.240.43 > 10.8.2.9: ICMP echo reply, id 1588, seq 24, length 64
21:30:01.882866 IP 10.8.2.9 > 165.73.240.43: ICMP echo request, id 1588, seq 25, length 64
21:30:02.367363 IP 165.73.240.43 > 10.8.2.9: ICMP echo reply, id 1588, seq 25, length 64
21:30:02.883114 IP 10.8.2.9 > 165.73.240.43: ICMP echo request, id 1588, seq 26, length 64
21:30:03.376156 IP 165.73.240.43 > 10.8.2.9: ICMP echo reply, id 1588, seq 26, length 64
21:30:03.882898 IP 10.8.2.9 > 165.73.240.43: ICMP echo request, id 1588, seq 27, length 64
21:30:04.367986 IP 165.73.240.43 > 10.8.2.9: ICMP echo reply, id 1588, seq 27, length 64
21:30:04.882736 IP 10.8.2.9 > 165.73.240.43: ICMP echo request, id 1588, seq 28, length 64
21:30:05.374781 IP 165.73.240.43 > 10.8.2.9: ICMP echo reply, id 1588, seq 28, length 64
21:30:05.882522 IP 10.8.2.9 > 165.73.240.43: ICMP echo request, id 1588, seq 29, length 64
21:30:06.373822 IP 165.73.240.43 > 10.8.2.9: ICMP echo reply, id 1588, seq 29, length 64
21:30:06.882568 IP 10.8.2.9 > 165.73.240.43: ICMP echo request, id 1588, seq 30, length 64
21:30:07.367213 IP 165.73.240.43 > 10.8.2.9: ICMP echo reply, id 1588, seq 30, length 64
21:30:07.882909 IP 10.8.2.9 > 165.73.240.43: ICMP echo request, id 1588, seq 31, length 64
21:30:08.372872 IP 165.73.240.43 > 10.8.2.9: ICMP echo reply, id 1588, seq 31, length 64
21:30:08.882622 IP 10.8.2.9 > 165.73.240.43: ICMP echo request, id 1588, seq 32, length 64
21:30:09.374721 IP 165.73.240.43 > 10.8.2.9: ICMP echo reply, id 1588, seq 32, length 64
21:30:09.882461 IP 10.8.2.9 > 165.73.240.43: ICMP echo request, id 1588, seq 33, length 64
21:30:10.907246 IP 10.8.2.9 > 165.73.240.43: ICMP echo request, id 1588, seq 34, length 64
21:30:11.392009 IP 165.73.240.43 > 10.8.2.9: ICMP echo reply, id 1588, seq 34, length 64
21:30:11.907763 IP 10.8.2.9 > 165.73.240.43: ICMP echo request, id 1588, seq 35, length 64
21:30:12.400850 IP 165.73.240.43 > 10.8.2.9: ICMP echo reply, id 1588, seq 35, length 64
21:30:12.907597 IP 10.8.2.9 > 165.73.240.43: ICMP echo request, id 1588, seq 36, length 64
21:30:13.393233 IP 165.73.240.43 > 10.8.2.9: ICMP echo reply, id 1588, seq 36, length 64
21:30:13.907981 IP 10.8.2.9 > 165.73.240.43: ICMP echo request, id 1588, seq 37, length 64
21:30:14.392440 IP 165.73.240.43 > 10.8.2.9: ICMP echo reply, id 1588, seq 37, length 64
21:30:14.908196 IP 10.8.2.9 > 165.73.240.43: ICMP echo request, id 1588, seq 38, length 64
21:30:15.401346 IP 165.73.240.43 > 10.8.2.9: ICMP echo reply, id 1588, seq 38, length 64
21:30:15.908093 IP 10.8.2.9 > 165.73.240.43: ICMP echo request, id 1588, seq 39, length 64
21:30:16.392730 IP 165.73.240.43 > 10.8.2.9: ICMP echo reply, id 1588, seq 39, length 64
21:30:16.908475 IP 10.8.2.9 > 165.73.240.43: ICMP echo request, id 1588, seq 40, length 64
21:30:17.394348 IP 165.73.240.43 > 10.8.2.9: ICMP echo reply, id 1588, seq 40, length 64
21:30:17.908102 IP 10.8.2.9 > 165.73.240.43: ICMP echo request, id 1588, seq 41, length 64
21:30:18.401085 IP 165.73.240.43 > 10.8.2.9: ICMP echo reply, id 1588, seq 41, length 64
21:30:18.907834 IP 10.8.2.9 > 165.73.240.43: ICMP echo request, id 1588, seq 42, length 64
21:30:19.392404 IP 165.73.240.43 > 10.8.2.9: ICMP echo reply, id 1588, seq 42, length 64
21:30:19.908163 IP 10.8.2.9 > 165.73.240.43: ICMP echo request, id 1588, seq 43, length 64
21:30:20.401865 IP 165.73.240.43 > 10.8.2.9: ICMP echo reply, id 1588, seq 43, length 64
21:30:20.908619 IP 10.8.2.9 > 165.73.240.43: ICMP echo request, id 1588, seq 44, length 64
21:30:21.393055 IP 165.73.240.43 > 10.8.2.9: ICMP echo reply, id 1588, seq 44, length 64
21:30:21.908810 IP 10.8.2.9 > 165.73.240.43: ICMP echo request, id 1588, seq 45, length 64
21:30:22.394469 IP 165.73.240.43 > 10.8.2.9: ICMP echo reply, id 1588, seq 45, length 64
21:30:22.909224 IP 10.8.2.9 > 165.73.240.43: ICMP echo request, id 1588, seq 46, length 64
21:30:23.931259 IP 10.8.2.9 > 165.73.240.43: ICMP echo request, id 1588, seq 47, length 64
21:30:24.424965 IP 165.73.240.43 > 10.8.2.9: ICMP echo reply, id 1588, seq 47, length 64
21:30:24.931706 IP 10.8.2.9 > 165.73.240.43: ICMP echo request, id 1588, seq 48, length 64
21:30:25.425361 IP 165.73.240.43 > 10.8.2.9: ICMP echo reply, id 1588, seq 48, length 64
21:30:25.932100 IP 10.8.2.9 > 165.73.240.43: ICMP echo request, id 1588, seq 49, length 64
21:30:26.419187 IP 165.73.240.43 > 10.8.2.9: ICMP echo reply, id 1588, seq 49, length 64
21:30:26.931939 IP 10.8.2.9 > 165.73.240.43: ICMP echo request, id 1588, seq 50, length 64
21:30:27.420968 IP 165.73.240.43 > 10.8.2.9: ICMP echo reply, id 1588, seq 50, length 64
21:30:27.931707 IP 10.8.2.9 > 165.73.240.43: ICMP echo request, id 1588, seq 51, length 64
21:30:28.416429 IP 165.73.240.43 > 10.8.2.9: ICMP echo reply, id 1588, seq 51, length 64
21:30:28.932176 IP 10.8.2.9 > 165.73.240.43: ICMP echo request, id 1588, seq 52, length 64
21:30:29.422420 IP 165.73.240.43 > 10.8.2.9: ICMP echo reply, id 1588, seq 52, length 64
21:30:29.932156 IP 10.8.2.9 > 165.73.240.43: ICMP echo request, id 1588, seq 53, length 64
21:30:30.422878 IP 165.73.240.43 > 10.8.2.9: ICMP echo reply, id 1588, seq 53, length 64
21:30:30.932624 IP 10.8.2.9 > 165.73.240.43: ICMP echo request, id 1588, seq 54, length 64
21:30:31.426468 IP 165.73.240.43 > 10.8.2.9: ICMP echo reply, id 1588, seq 54, length 64
21:30:31.932207 IP 10.8.2.9 > 165.73.240.43: ICMP echo request, id 1588, seq 55, length 64
21:30:32.416550 IP 165.73.240.43 > 10.8.2.9: ICMP echo reply, id 1588, seq 55, length 64
21:30:32.932301 IP 10.8.2.9 > 165.73.240.43: ICMP echo request, id 1588, seq 56, length 64
21:30:33.416614 IP 165.73.240.43 > 10.8.2.9: ICMP echo reply, id 1588, seq 56, length 64
21:30:33.932371 IP 10.8.2.9 > 165.73.240.43: ICMP echo request, id 1588, seq 57, length 64
21:30:34.416856 IP 165.73.240.43 > 10.8.2.9: ICMP echo reply, id 1588, seq 57, length 64
21:30:34.932616 IP 10.8.2.9 > 165.73.240.43: ICMP echo request, id 1588, seq 58, length 64
21:30:35.417057 IP 165.73.240.43 > 10.8.2.9: ICMP echo reply, id 1588, seq 58, length 64
21:30:35.932808 IP 10.8.2.9 > 165.73.240.43: ICMP echo request, id 1588, seq 59, length 64
21:30:36.429027 IP 165.73.240.43 > 10.8.2.9: ICMP echo reply, id 1588, seq 59, length 64
21:30:36.932764 IP 10.8.2.9 > 165.73.240.43: ICMP echo request, id 1588, seq 60, length 64
