10:46:00.994477 IP 10.8.2.5 > 185.134.114.44: ICMP echo request, id 1427, seq 3, length 64
10:46:01.298773 IP 185.134.114.44 > 10.8.2.5: ICMP echo reply, id 1427, seq 3, length 64
10:46:01.994695 IP 10.8.2.5 > 185.134.114.44: ICMP echo request, id 1427, seq 4, length 64
10:46:02.294523 IP 185.134.114.44 > 10.8.2.5: ICMP echo reply, id 1427, seq 4, length 64
10:46:02.995433 IP 10.8.2.5 > 185.134.114.44: ICMP echo request, id 1427, seq 5, length 64
10:46:03.292444 IP 185.134.114.44 > 10.8.2.5: ICMP echo reply, id 1427, seq 5, length 64
10:46:03.995384 IP 10.8.2.5 > 185.134.114.44: ICMP echo request, id 1427, seq 6, length 64
10:46:04.293164 IP 185.134.114.44 > 10.8.2.5: ICMP echo reply, id 1427, seq 6, length 64
10:46:04.996103 IP 10.8.2.5 > 185.134.114.44: ICMP echo request, id 1427, seq 7, length 64
10:46:05.293514 IP 185.134.114.44 > 10.8.2.5: ICMP echo reply, id 1427, seq 7, length 64
10:46:05.996452 IP 10.8.2.5 > 185.134.114.44: ICMP echo request, id 1427, seq 8, length 64
10:46:06.293796 IP 185.134.114.44 > 10.8.2.5: ICMP echo reply, id 1427, seq 8, length 64
10:46:06.996729 IP 10.8.2.5 > 185.134.114.44: ICMP echo request, id 1427, seq 9, length 64
10:46:07.301188 IP 185.134.114.44 > 10.8.2.5: ICMP echo reply, id 1427, seq 9, length 64
10:46:07.997120 IP 10.8.2.5 > 185.134.114.44: ICMP echo request, id 1427, seq 10, length 64
10:46:08.294616 IP 185.134.114.44 > 10.8.2.5: ICMP echo reply, id 1427, seq 10, length 64
10:46:08.997551 IP 10.8.2.5 > 185.134.114.44: ICMP echo request, id 1427, seq 11, length 64
10:46:09.297010 IP 185.134.114.44 > 10.8.2.5: ICMP echo reply, id 1427, seq 11, length 64
10:46:09.997946 IP 10.8.2.5 > 185.134.114.44: ICMP echo request, id 1427, seq 12, length 64
10:46:10.295232 IP 185.134.114.44 > 10.8.2.5: ICMP echo reply, id 1427, seq 12, length 64
10:46:10.998158 IP 10.8.2.5 > 185.134.114.44: ICMP echo request, id 1427, seq 13, length 64
10:46:11.300819 IP 185.134.114.44 > 10.8.2.5: ICMP echo reply, id 1427, seq 13, length 64
10:46:11.998750 IP 10.8.2.5 > 185.134.114.44: ICMP echo request, id 1427, seq 14, length 64
10:46:12.295641 IP 185.134.114.44 > 10.8.2.5: ICMP echo reply, id 1427, seq 14, length 64
10:46:12.998211 IP 10.8.2.5 > 185.134.114.44: ICMP echo request, id 1427, seq 15, length 64
10:46:13.295453 IP 185.134.114.44 > 10.8.2.5: ICMP echo reply, id 1427, seq 15, length 64
10:46:13.998216 IP 10.8.2.5 > 185.134.114.44: ICMP echo request, id 1427, seq 16, length 64
10:46:14.299902 IP 185.134.114.44 > 10.8.2.5: ICMP echo reply, id 1427, seq 16, length 64
10:46:14.998199 IP 10.8.2.5 > 185.134.114.44: ICMP echo request, id 1427, seq 17, length 64
10:46:15.295097 IP 185.134.114.44 > 10.8.2.5: ICMP echo reply, id 1427, seq 17, length 64
10:46:15.998036 IP 10.8.2.5 > 185.134.114.44: ICMP echo request, id 1427, seq 18, length 64
10:46:16.297050 IP 185.134.114.44 > 10.8.2.5: ICMP echo reply, id 1427, seq 18, length 64
10:46:16.997974 IP 10.8.2.5 > 185.134.114.44: ICMP echo request, id 1427, seq 19, length 64
10:46:17.298308 IP 185.134.114.44 > 10.8.2.5: ICMP echo reply, id 1427, seq 19, length 64
10:46:17.998233 IP 10.8.2.5 > 185.134.114.44: ICMP echo request, id 1427, seq 20, length 64
10:46:18.296496 IP 185.134.114.44 > 10.8.2.5: ICMP echo reply, id 1427, seq 20, length 64
10:46:18.998213 IP 10.8.2.5 > 185.134.114.44: ICMP echo request, id 1427, seq 21, length 64
10:46:19.295156 IP 185.134.114.44 > 10.8.2.5: ICMP echo reply, id 1427, seq 21, length 64
10:46:19.998125 IP 10.8.2.5 > 185.134.114.44: ICMP echo request, id 1427, seq 22, length 64
10:46:20.295316 IP 185.134.114.44 > 10.8.2.5: ICMP echo reply, id 1427, seq 22, length 64
10:46:20.998208 IP 10.8.2.5 > 185.134.114.44: ICMP echo request, id 1427, seq 23, length 64
10:46:21.295769 IP 185.134.114.44 > 10.8.2.5: ICMP echo reply, id 1427, seq 23, length 64
10:46:21.998705 IP 10.8.2.5 > 185.134.114.44: ICMP echo request, id 1427, seq 24, length 64
10:46:22.295940 IP 185.134.114.44 > 10.8.2.5: ICMP echo reply, id 1427, seq 24, length 64
10:46:22.998195 IP 10.8.2.5 > 185.134.114.44: ICMP echo request, id 1427, seq 25, length 64
10:46:23.295346 IP 185.134.114.44 > 10.8.2.5: ICMP echo reply, id 1427, seq 25, length 64
10:46:23.998207 IP 10.8.2.5 > 185.134.114.44: ICMP echo request, id 1427, seq 26, length 64
10:46:24.295324 IP 185.134.114.44 > 10.8.2.5: ICMP echo reply, id 1427, seq 26, length 64
10:46:24.998211 IP 10.8.2.5 > 185.134.114.44: ICMP echo request, id 1427, seq 27, length 64
10:46:25.295215 IP 185.134.114.44 > 10.8.2.5: ICMP echo reply, id 1427, seq 27, length 64
10:46:25.998166 IP 10.8.2.5 > 185.134.114.44: ICMP echo request, id 1427, seq 28, length 64
10:46:26.299673 IP 185.134.114.44 > 10.8.2.5: ICMP echo reply, id 1427, seq 28, length 64
10:46:26.998204 IP 10.8.2.5 > 185.134.114.44: ICMP echo request, id 1427, seq 29, length 64
10:46:27.295377 IP 185.134.114.44 > 10.8.2.5: ICMP echo reply, id 1427, seq 29, length 64
10:46:27.998202 IP 10.8.2.5 > 185.134.114.44: ICMP echo request, id 1427, seq 30, length 64
10:46:28.295227 IP 185.134.114.44 > 10.8.2.5: ICMP echo reply, id 1427, seq 30, length 64
10:46:28.998175 IP 10.8.2.5 > 185.134.114.44: ICMP echo request, id 1427, seq 31, length 64
10:46:29.295201 IP 185.134.114.44 > 10.8.2.5: ICMP echo reply, id 1427, seq 31, length 64
10:46:29.998155 IP 10.8.2.5 > 185.134.114.44: ICMP echo request, id 1427, seq 32, length 64
10:46:30.295676 IP 185.134.114.44 > 10.8.2.5: ICMP echo reply, id 1427, seq 32, length 64
10:46:30.998614 IP 10.8.2.5 > 185.134.114.44: ICMP echo request, id 1427, seq 33, length 64
10:46:31.295814 IP 185.134.114.44 > 10.8.2.5: ICMP echo reply, id 1427, seq 33, length 64
10:46:31.998761 IP 10.8.2.5 > 185.134.114.44: ICMP echo request, id 1427, seq 34, length 64
10:46:32.295886 IP 185.134.114.44 > 10.8.2.5: ICMP echo reply, id 1427, seq 34, length 64
10:46:32.998833 IP 10.8.2.5 > 185.134.114.44: ICMP echo request, id 1427, seq 35, length 64
10:46:33.295875 IP 185.134.114.44 > 10.8.2.5: ICMP echo reply, id 1427, seq 35, length 64
10:46:33.998818 IP 10.8.2.5 > 185.134.114.44: ICMP echo request, id 1427, seq 36, length 64
10:46:34.296136 IP 185.134.114.44 > 10.8.2.5: ICMP echo reply, id 1427, seq 36, length 64
10:46:34.999076 IP 10.8.2.5 > 185.134.114.44: ICMP echo request, id 1427, seq 37, length 64
10:46:35.296264 IP 185.134.114.44 > 10.8.2.5: ICMP echo reply, id 1427, seq 37, length 64
10:46:35.999201 IP 10.8.2.5 > 185.134.114.44: ICMP echo request, id 1427, seq 38, length 64
10:46:36.296323 IP 185.134.114.44 > 10.8.2.5: ICMP echo reply, id 1427, seq 38, length 64
10:46:36.999272 IP 10.8.2.5 > 185.134.114.44: ICMP echo request, id 1427, seq 39, length 64
10:46:37.297060 IP 185.134.114.44 > 10.8.2.5: ICMP echo reply, id 1427, seq 39, length 64
10:46:38.000005 IP 10.8.2.5 > 185.134.114.44: ICMP echo request, id 1427, seq 40, length 64
10:46:38.297114 IP 185.134.114.44 > 10.8.2.5: ICMP echo reply, id 1427, seq 40, length 64
10:46:39.000053 IP 10.8.2.5 > 185.134.114.44: ICMP echo request, id 1427, seq 41, length 64
10:46:39.297194 IP 185.134.114.44 > 10.8.2.5: ICMP echo reply, id 1427, seq 41, length 64
10:46:40.001137 IP 10.8.2.5 > 185.134.114.44: ICMP echo request, id 1427, seq 42, length 64
10:46:40.298210 IP 185.134.114.44 > 10.8.2.5: ICMP echo reply, id 1427, seq 42, length 64
10:46:41.002148 IP 10.8.2.5 > 185.134.114.44: ICMP echo request, id 1427, seq 43, length 64
10:46:41.300121 IP 185.134.114.44 > 10.8.2.5: ICMP echo reply, id 1427, seq 43, length 64
10:46:42.003059 IP 10.8.2.5 > 185.134.114.44: ICMP echo request, id 1427, seq 44, length 64
10:46:42.300377 IP 185.134.114.44 > 10.8.2.5: ICMP echo reply, id 1427, seq 44, length 64
10:46:43.004324 IP 10.8.2.5 > 185.134.114.44: ICMP echo request, id 1427, seq 45, length 64
10:46:43.301557 IP 185.134.114.44 > 10.8.2.5: ICMP echo reply, id 1427, seq 45, length 64
10:46:44.005485 IP 10.8.2.5 > 185.134.114.44: ICMP echo request, id 1427, seq 46, length 64
10:46:44.302785 IP 185.134.114.44 > 10.8.2.5: ICMP echo reply, id 1427, seq 46, length 64
10:46:45.006722 IP 10.8.2.5 > 185.134.114.44: ICMP echo request, id 1427, seq 47, length 64
10:46:45.303835 IP 185.134.114.44 > 10.8.2.5: ICMP echo reply, id 1427, seq 47, length 64
10:46:46.007772 IP 10.8.2.5 > 185.134.114.44: ICMP echo request, id 1427, seq 48, length 64
10:46:46.305012 IP 185.134.114.44 > 10.8.2.5: ICMP echo reply, id 1427, seq 48, length 64
10:46:47.008950 IP 10.8.2.5 > 185.134.114.44: ICMP echo request, id 1427, seq 49, length 64
10:46:47.306243 IP 185.134.114.44 > 10.8.2.5: ICMP echo reply, id 1427, seq 49, length 64
10:46:48.010183 IP 10.8.2.5 > 185.134.114.44: ICMP echo request, id 1427, seq 50, length 64
10:46:48.307448 IP 185.134.114.44 > 10.8.2.5: ICMP echo reply, id 1427, seq 50, length 64
10:46:49.011386 IP 10.8.2.5 > 185.134.114.44: ICMP echo request, id 1427, seq 51, length 64
10:46:49.308553 IP 185.134.114.44 > 10.8.2.5: ICMP echo reply, id 1427, seq 51, length 64
10:46:50.012514 IP 10.8.2.5 > 185.134.114.44: ICMP echo request, id 1427, seq 52, length 64
10:46:50.309874 IP 185.134.114.44 > 10.8.2.5: ICMP echo reply, id 1427, seq 52, length 64
10:46:51.013832 IP 10.8.2.5 > 185.134.114.44: ICMP echo request, id 1427, seq 53, length 64
10:46:51.311282 IP 185.134.114.44 > 10.8.2.5: ICMP echo reply, id 1427, seq 53, length 64
10:46:52.015220 IP 10.8.2.5 > 185.134.114.44: ICMP echo request, id 1427, seq 54, length 64
10:46:52.312541 IP 185.134.114.44 > 10.8.2.5: ICMP echo reply, id 1427, seq 54, length 64
10:46:53.016481 IP 10.8.2.5 > 185.134.114.44: ICMP echo request, id 1427, seq 55, length 64
10:46:53.314007 IP 185.134.114.44 > 10.8.2.5: ICMP echo reply, id 1427, seq 55, length 64
10:46:54.017981 IP 10.8.2.5 > 185.134.114.44: ICMP echo request, id 1427, seq 56, length 64
10:46:54.325660 IP 185.134.114.44 > 10.8.2.5: ICMP echo reply, id 1427, seq 56, length 64
10:46:55.019584 IP 10.8.2.5 > 185.134.114.44: ICMP echo request, id 1427, seq 57, length 64
10:46:55.316673 IP 185.134.114.44 > 10.8.2.5: ICMP echo reply, id 1427, seq 57, length 64
10:46:56.020619 IP 10.8.2.5 > 185.134.114.44: ICMP echo request, id 1427, seq 58, length 64
10:46:56.317761 IP 185.134.114.44 > 10.8.2.5: ICMP echo reply, id 1427, seq 58, length 64
10:46:57.021699 IP 10.8.2.5 > 185.134.114.44: ICMP echo request, id 1427, seq 59, length 64
10:46:57.318966 IP 185.134.114.44 > 10.8.2.5: ICMP echo reply, id 1427, seq 59, length 64
10:46:58.022915 IP 10.8.2.5 > 185.134.114.44: ICMP echo request, id 1427, seq 60, length 64
10:46:58.323616 IP 185.134.114.44 > 10.8.2.5: ICMP echo reply, id 1427, seq 60, length 64
10:46:59.024553 IP 10.8.2.5 > 185.134.114.44: ICMP echo request, id 1427, seq 61, length 64
10:46:59.321924 IP 185.134.114.44 > 10.8.2.5: ICMP echo reply, id 1427, seq 61, length 64
10:47:00.025869 IP 10.8.2.5 > 185.134.114.44: ICMP echo request, id 1427, seq 62, length 64
