01:51:49.256190 IP 10.8.2.5 > 103.107.198.131: ICMP echo request, id 2577, seq 1, length 64
01:51:49.823300 IP 103.107.198.131 > 10.8.2.5: ICMP echo reply, id 2577, seq 1, length 64
01:51:50.942978 IP 10.8.2.5 > 103.107.198.131: ICMP echo request, id 2577, seq 2, length 64
01:51:51.510515 IP 103.107.198.131 > 10.8.2.5: ICMP echo reply, id 2577, seq 2, length 64
01:51:51.943188 IP 10.8.2.5 > 103.107.198.131: ICMP echo request, id 2577, seq 3, length 64
01:51:52.510567 IP 103.107.198.131 > 10.8.2.5: ICMP echo reply, id 2577, seq 3, length 64
01:51:52.943235 IP 10.8.2.5 > 103.107.198.131: ICMP echo request, id 2577, seq 4, length 64
01:51:53.511344 IP 103.107.198.131 > 10.8.2.5: ICMP echo reply, id 2577, seq 4, length 64
01:51:53.942976 IP 10.8.2.5 > 103.107.198.131: ICMP echo request, id 2577, seq 5, length 64
01:51:54.509989 IP 103.107.198.131 > 10.8.2.5: ICMP echo reply, id 2577, seq 5, length 64
01:51:54.942653 IP 10.8.2.5 > 103.107.198.131: ICMP echo request, id 2577, seq 6, length 64
01:51:55.510005 IP 103.107.198.131 > 10.8.2.5: ICMP echo reply, id 2577, seq 6, length 64
01:51:55.942679 IP 10.8.2.5 > 103.107.198.131: ICMP echo request, id 2577, seq 7, length 64
01:51:56.510550 IP 103.107.198.131 > 10.8.2.5: ICMP echo reply, id 2577, seq 7, length 64
01:51:56.942219 IP 10.8.2.5 > 103.107.198.131: ICMP echo request, id 2577, seq 8, length 64
01:51:57.509815 IP 103.107.198.131 > 10.8.2.5: ICMP echo reply, id 2577, seq 8, length 64
01:51:57.942483 IP 10.8.2.5 > 103.107.198.131: ICMP echo request, id 2577, seq 9, length 64
01:51:58.510102 IP 103.107.198.131 > 10.8.2.5: ICMP echo reply, id 2577, seq 9, length 64
01:51:58.942772 IP 10.8.2.5 > 103.107.198.131: ICMP echo request, id 2577, seq 10, length 64
01:51:59.510053 IP 103.107.198.131 > 10.8.2.5: ICMP echo reply, id 2577, seq 10, length 64
01:51:59.942761 IP 10.8.2.5 > 103.107.198.131: ICMP echo request, id 2577, seq 11, length 64
01:52:00.511272 IP 103.107.198.131 > 10.8.2.5: ICMP echo reply, id 2577, seq 11, length 64
01:52:00.942804 IP 10.8.2.5 > 103.107.198.131: ICMP echo request, id 2577, seq 12, length 64
01:52:01.510196 IP 103.107.198.131 > 10.8.2.5: ICMP echo reply, id 2577, seq 12, length 64
01:52:01.942864 IP 10.8.2.5 > 103.107.198.131: ICMP echo request, id 2577, seq 13, length 64
01:52:02.510234 IP 103.107.198.131 > 10.8.2.5: ICMP echo reply, id 2577, seq 13, length 64
01:52:02.942903 IP 10.8.2.5 > 103.107.198.131: ICMP echo request, id 2577, seq 14, length 64
01:52:03.521659 IP 103.107.198.131 > 10.8.2.5: ICMP echo reply, id 2577, seq 14, length 64
01:52:03.943231 IP 10.8.2.5 > 103.107.198.131: ICMP echo request, id 2577, seq 15, length 64
01:52:04.523391 IP 103.107.198.131 > 10.8.2.5: ICMP echo reply, id 2577, seq 15, length 64
01:52:04.943046 IP 10.8.2.5 > 103.107.198.131: ICMP echo request, id 2577, seq 16, length 64
01:52:05.520473 IP 103.107.198.131 > 10.8.2.5: ICMP echo reply, id 2577, seq 16, length 64
01:52:05.943132 IP 10.8.2.5 > 103.107.198.131: ICMP echo request, id 2577, seq 17, length 64
01:52:06.510387 IP 103.107.198.131 > 10.8.2.5: ICMP echo reply, id 2577, seq 17, length 64
01:52:06.943057 IP 10.8.2.5 > 103.107.198.131: ICMP echo request, id 2577, seq 18, length 64
01:52:07.510270 IP 103.107.198.131 > 10.8.2.5: ICMP echo reply, id 2577, seq 18, length 64
01:52:07.942942 IP 10.8.2.5 > 103.107.198.131: ICMP echo request, id 2577, seq 19, length 64
01:52:08.510336 IP 103.107.198.131 > 10.8.2.5: ICMP echo reply, id 2577, seq 19, length 64
01:52:08.943005 IP 10.8.2.5 > 103.107.198.131: ICMP echo request, id 2577, seq 20, length 64
01:52:09.510015 IP 103.107.198.131 > 10.8.2.5: ICMP echo reply, id 2577, seq 20, length 64
01:52:09.942691 IP 10.8.2.5 > 103.107.198.131: ICMP echo request, id 2577, seq 21, length 64
01:52:10.511111 IP 103.107.198.131 > 10.8.2.5: ICMP echo reply, id 2577, seq 21, length 64
01:52:10.942804 IP 10.8.2.5 > 103.107.198.131: ICMP echo request, id 2577, seq 22, length 64
01:52:11.510002 IP 103.107.198.131 > 10.8.2.5: ICMP echo reply, id 2577, seq 22, length 64
01:52:11.942674 IP 10.8.2.5 > 103.107.198.131: ICMP echo request, id 2577, seq 23, length 64
01:52:12.510544 IP 103.107.198.131 > 10.8.2.5: ICMP echo reply, id 2577, seq 23, length 64
01:52:12.942213 IP 10.8.2.5 > 103.107.198.131: ICMP echo request, id 2577, seq 24, length 64
01:52:13.509300 IP 103.107.198.131 > 10.8.2.5: ICMP echo reply, id 2577, seq 24, length 64
01:52:13.941970 IP 10.8.2.5 > 103.107.198.131: ICMP echo request, id 2577, seq 25, length 64
01:52:14.509223 IP 103.107.198.131 > 10.8.2.5: ICMP echo reply, id 2577, seq 25, length 64
01:52:14.941893 IP 10.8.2.5 > 103.107.198.131: ICMP echo request, id 2577, seq 26, length 64
01:52:15.509158 IP 103.107.198.131 > 10.8.2.5: ICMP echo reply, id 2577, seq 26, length 64
01:52:15.941827 IP 10.8.2.5 > 103.107.198.131: ICMP echo request, id 2577, seq 27, length 64
01:52:16.509364 IP 103.107.198.131 > 10.8.2.5: ICMP echo reply, id 2577, seq 27, length 64
01:52:16.942032 IP 10.8.2.5 > 103.107.198.131: ICMP echo request, id 2577, seq 28, length 64
01:52:17.509469 IP 103.107.198.131 > 10.8.2.5: ICMP echo reply, id 2577, seq 28, length 64
01:52:17.942125 IP 10.8.2.5 > 103.107.198.131: ICMP echo request, id 2577, seq 29, length 64
01:52:18.509947 IP 103.107.198.131 > 10.8.2.5: ICMP echo reply, id 2577, seq 29, length 64
01:52:18.942617 IP 10.8.2.5 > 103.107.198.131: ICMP echo request, id 2577, seq 30, length 64
01:52:19.511442 IP 103.107.198.131 > 10.8.2.5: ICMP echo reply, id 2577, seq 30, length 64
01:52:19.943117 IP 10.8.2.5 > 103.107.198.131: ICMP echo request, id 2577, seq 31, length 64
01:52:20.518318 IP 103.107.198.131 > 10.8.2.5: ICMP echo reply, id 2577, seq 31, length 64
01:52:20.942978 IP 10.8.2.5 > 103.107.198.131: ICMP echo request, id 2577, seq 32, length 64
01:52:21.521948 IP 103.107.198.131 > 10.8.2.5: ICMP echo reply, id 2577, seq 32, length 64
01:52:21.942604 IP 10.8.2.5 > 103.107.198.131: ICMP echo request, id 2577, seq 33, length 64
01:52:22.528149 IP 103.107.198.131 > 10.8.2.5: ICMP echo reply, id 2577, seq 33, length 64
01:52:22.942804 IP 10.8.2.5 > 103.107.198.131: ICMP echo request, id 2577, seq 34, length 64
01:52:23.510297 IP 103.107.198.131 > 10.8.2.5: ICMP echo reply, id 2577, seq 34, length 64
01:52:23.942965 IP 10.8.2.5 > 103.107.198.131: ICMP echo request, id 2577, seq 35, length 64
01:52:24.513429 IP 103.107.198.131 > 10.8.2.5: ICMP echo reply, id 2577, seq 35, length 64
01:52:24.943104 IP 10.8.2.5 > 103.107.198.131: ICMP echo request, id 2577, seq 36, length 64
01:52:25.511119 IP 103.107.198.131 > 10.8.2.5: ICMP echo reply, id 2577, seq 36, length 64
01:52:25.942842 IP 10.8.2.5 > 103.107.198.131: ICMP echo request, id 2577, seq 37, length 64
01:52:26.510036 IP 103.107.198.131 > 10.8.2.5: ICMP echo reply, id 2577, seq 37, length 64
01:52:26.942711 IP 10.8.2.5 > 103.107.198.131: ICMP echo request, id 2577, seq 38, length 64
01:52:27.510077 IP 103.107.198.131 > 10.8.2.5: ICMP echo reply, id 2577, seq 38, length 64
01:52:27.942758 IP 10.8.2.5 > 103.107.198.131: ICMP echo request, id 2577, seq 39, length 64
01:52:28.510370 IP 103.107.198.131 > 10.8.2.5: ICMP echo reply, id 2577, seq 39, length 64
01:52:28.943041 IP 10.8.2.5 > 103.107.198.131: ICMP echo request, id 2577, seq 40, length 64
01:52:29.510237 IP 103.107.198.131 > 10.8.2.5: ICMP echo reply, id 2577, seq 40, length 64
01:52:29.942908 IP 10.8.2.5 > 103.107.198.131: ICMP echo request, id 2577, seq 41, length 64
01:52:30.510330 IP 103.107.198.131 > 10.8.2.5: ICMP echo reply, id 2577, seq 41, length 64
01:52:30.943008 IP 10.8.2.5 > 103.107.198.131: ICMP echo request, id 2577, seq 42, length 64
01:52:31.510170 IP 103.107.198.131 > 10.8.2.5: ICMP echo reply, id 2577, seq 42, length 64
01:52:31.942865 IP 10.8.2.5 > 103.107.198.131: ICMP echo request, id 2577, seq 43, length 64
01:52:32.515491 IP 103.107.198.131 > 10.8.2.5: ICMP echo reply, id 2577, seq 43, length 64
01:52:32.943175 IP 10.8.2.5 > 103.107.198.131: ICMP echo request, id 2577, seq 44, length 64
01:52:33.529286 IP 103.107.198.131 > 10.8.2.5: ICMP echo reply, id 2577, seq 44, length 64
01:52:33.942938 IP 10.8.2.5 > 103.107.198.131: ICMP echo request, id 2577, seq 45, length 64
01:52:34.510687 IP 103.107.198.131 > 10.8.2.5: ICMP echo reply, id 2577, seq 45, length 64
01:52:34.943362 IP 10.8.2.5 > 103.107.198.131: ICMP echo request, id 2577, seq 46, length 64
01:52:35.510925 IP 103.107.198.131 > 10.8.2.5: ICMP echo reply, id 2577, seq 46, length 64
01:52:35.943605 IP 10.8.2.5 > 103.107.198.131: ICMP echo request, id 2577, seq 47, length 64
01:52:36.518572 IP 103.107.198.131 > 10.8.2.5: ICMP echo reply, id 2577, seq 47, length 64
01:52:36.943236 IP 10.8.2.5 > 103.107.198.131: ICMP echo request, id 2577, seq 48, length 64
01:52:37.518052 IP 103.107.198.131 > 10.8.2.5: ICMP echo reply, id 2577, seq 48, length 64
01:52:37.943729 IP 10.8.2.5 > 103.107.198.131: ICMP echo request, id 2577, seq 49, length 64
01:52:38.511294 IP 103.107.198.131 > 10.8.2.5: ICMP echo reply, id 2577, seq 49, length 64
01:52:38.943967 IP 10.8.2.5 > 103.107.198.131: ICMP echo request, id 2577, seq 50, length 64
01:52:39.512029 IP 103.107.198.131 > 10.8.2.5: ICMP echo reply, id 2577, seq 50, length 64
01:52:39.943717 IP 10.8.2.5 > 103.107.198.131: ICMP echo request, id 2577, seq 51, length 64
01:52:40.518684 IP 103.107.198.131 > 10.8.2.5: ICMP echo reply, id 2577, seq 51, length 64
01:52:40.943362 IP 10.8.2.5 > 103.107.198.131: ICMP echo request, id 2577, seq 52, length 64
01:52:41.511344 IP 103.107.198.131 > 10.8.2.5: ICMP echo reply, id 2577, seq 52, length 64
01:52:41.943032 IP 10.8.2.5 > 103.107.198.131: ICMP echo request, id 2577, seq 53, length 64
01:52:42.516472 IP 103.107.198.131 > 10.8.2.5: ICMP echo reply, id 2577, seq 53, length 64
01:52:42.943149 IP 10.8.2.5 > 103.107.198.131: ICMP echo request, id 2577, seq 54, length 64
01:52:43.510526 IP 103.107.198.131 > 10.8.2.5: ICMP echo reply, id 2577, seq 54, length 64
01:52:43.943176 IP 10.8.2.5 > 103.107.198.131: ICMP echo request, id 2577, seq 55, length 64
01:52:44.520432 IP 103.107.198.131 > 10.8.2.5: ICMP echo reply, id 2577, seq 55, length 64
01:52:44.943082 IP 10.8.2.5 > 103.107.198.131: ICMP echo request, id 2577, seq 56, length 64
01:52:45.510274 IP 103.107.198.131 > 10.8.2.5: ICMP echo reply, id 2577, seq 56, length 64
01:52:45.942945 IP 10.8.2.5 > 103.107.198.131: ICMP echo request, id 2577, seq 57, length 64
01:52:46.510911 IP 103.107.198.131 > 10.8.2.5: ICMP echo reply, id 2577, seq 57, length 64
01:52:46.942573 IP 10.8.2.5 > 103.107.198.131: ICMP echo request, id 2577, seq 58, length 64
01:52:47.520245 IP 103.107.198.131 > 10.8.2.5: ICMP echo reply, id 2577, seq 58, length 64
01:52:47.942924 IP 10.8.2.5 > 103.107.198.131: ICMP echo request, id 2577, seq 59, length 64
