23:21:59.519075 IP 10.8.0.87 > 195.158.248.3: ICMP echo request, id 1183, seq 2, length 64
23:21:59.823062 IP 195.158.248.3 > 10.8.0.87: ICMP echo reply, id 1183, seq 2, length 64
23:22:00.520032 IP 10.8.0.87 > 195.158.248.3: ICMP echo request, id 1183, seq 3, length 64
23:22:00.823618 IP 195.158.248.3 > 10.8.0.87: ICMP echo reply, id 1183, seq 3, length 64
23:22:01.521563 IP 10.8.0.87 > 195.158.248.3: ICMP echo request, id 1183, seq 4, length 64
23:22:01.825245 IP 195.158.248.3 > 10.8.0.87: ICMP echo reply, id 1183, seq 4, length 64
23:22:02.523190 IP 10.8.0.87 > 195.158.248.3: ICMP echo request, id 1183, seq 5, length 64
23:22:02.826850 IP 195.158.248.3 > 10.8.0.87: ICMP echo reply, id 1183, seq 5, length 64
23:22:03.524210 IP 10.8.0.87 > 195.158.248.3: ICMP echo request, id 1183, seq 6, length 64
23:22:03.828066 IP 195.158.248.3 > 10.8.0.87: ICMP echo reply, id 1183, seq 6, length 64
23:22:04.524998 IP 10.8.0.87 > 195.158.248.3: ICMP echo request, id 1183, seq 7, length 64
23:22:04.828257 IP 195.158.248.3 > 10.8.0.87: ICMP echo reply, id 1183, seq 7, length 64
23:22:05.526200 IP 10.8.0.87 > 195.158.248.3: ICMP echo request, id 1183, seq 8, length 64
23:22:05.830421 IP 195.158.248.3 > 10.8.0.87: ICMP echo reply, id 1183, seq 8, length 64
23:22:06.527351 IP 10.8.0.87 > 195.158.248.3: ICMP echo request, id 1183, seq 9, length 64
23:22:06.831063 IP 195.158.248.3 > 10.8.0.87: ICMP echo reply, id 1183, seq 9, length 64
23:22:07.529009 IP 10.8.0.87 > 195.158.248.3: ICMP echo request, id 1183, seq 10, length 64
23:22:07.832708 IP 195.158.248.3 > 10.8.0.87: ICMP echo reply, id 1183, seq 10, length 64
23:22:08.530659 IP 10.8.0.87 > 195.158.248.3: ICMP echo request, id 1183, seq 11, length 64
23:22:08.834261 IP 195.158.248.3 > 10.8.0.87: ICMP echo reply, id 1183, seq 11, length 64
23:22:09.532234 IP 10.8.0.87 > 195.158.248.3: ICMP echo request, id 1183, seq 12, length 64
23:22:09.836073 IP 195.158.248.3 > 10.8.0.87: ICMP echo reply, id 1183, seq 12, length 64
23:22:10.533998 IP 10.8.0.87 > 195.158.248.3: ICMP echo request, id 1183, seq 13, length 64
23:22:10.837719 IP 195.158.248.3 > 10.8.0.87: ICMP echo reply, id 1183, seq 13, length 64
23:22:11.535669 IP 10.8.0.87 > 195.158.248.3: ICMP echo request, id 1183, seq 14, length 64
23:22:11.839447 IP 195.158.248.3 > 10.8.0.87: ICMP echo reply, id 1183, seq 14, length 64
23:22:12.537379 IP 10.8.0.87 > 195.158.248.3: ICMP echo request, id 1183, seq 15, length 64
23:22:12.841102 IP 195.158.248.3 > 10.8.0.87: ICMP echo reply, id 1183, seq 15, length 64
23:22:13.539045 IP 10.8.0.87 > 195.158.248.3: ICMP echo request, id 1183, seq 16, length 64
23:22:13.842592 IP 195.158.248.3 > 10.8.0.87: ICMP echo reply, id 1183, seq 16, length 64
23:22:14.540204 IP 10.8.0.87 > 195.158.248.3: ICMP echo request, id 1183, seq 17, length 64
23:22:14.843734 IP 195.158.248.3 > 10.8.0.87: ICMP echo reply, id 1183, seq 17, length 64
23:22:15.541681 IP 10.8.0.87 > 195.158.248.3: ICMP echo request, id 1183, seq 18, length 64
23:22:15.845553 IP 195.158.248.3 > 10.8.0.87: ICMP echo reply, id 1183, seq 18, length 64
23:22:16.542487 IP 10.8.0.87 > 195.158.248.3: ICMP echo request, id 1183, seq 19, length 64
23:22:16.846339 IP 195.158.248.3 > 10.8.0.87: ICMP echo reply, id 1183, seq 19, length 64
23:22:17.543276 IP 10.8.0.87 > 195.158.248.3: ICMP echo request, id 1183, seq 20, length 64
23:22:17.846735 IP 195.158.248.3 > 10.8.0.87: ICMP echo reply, id 1183, seq 20, length 64
23:22:18.544681 IP 10.8.0.87 > 195.158.248.3: ICMP echo request, id 1183, seq 21, length 64
23:22:18.848187 IP 195.158.248.3 > 10.8.0.87: ICMP echo reply, id 1183, seq 21, length 64
23:22:19.546129 IP 10.8.0.87 > 195.158.248.3: ICMP echo request, id 1183, seq 22, length 64
23:22:19.849631 IP 195.158.248.3 > 10.8.0.87: ICMP echo reply, id 1183, seq 22, length 64
23:22:20.547471 IP 10.8.0.87 > 195.158.248.3: ICMP echo request, id 1183, seq 23, length 64
23:22:20.851158 IP 195.158.248.3 > 10.8.0.87: ICMP echo reply, id 1183, seq 23, length 64
23:22:21.549008 IP 10.8.0.87 > 195.158.248.3: ICMP echo request, id 1183, seq 24, length 64
23:22:21.852558 IP 195.158.248.3 > 10.8.0.87: ICMP echo reply, id 1183, seq 24, length 64
23:22:22.550495 IP 10.8.0.87 > 195.158.248.3: ICMP echo request, id 1183, seq 25, length 64
23:22:22.854089 IP 195.158.248.3 > 10.8.0.87: ICMP echo reply, id 1183, seq 25, length 64
23:22:23.552020 IP 10.8.0.87 > 195.158.248.3: ICMP echo request, id 1183, seq 26, length 64
23:22:23.855592 IP 195.158.248.3 > 10.8.0.87: ICMP echo reply, id 1183, seq 26, length 64
23:22:24.553515 IP 10.8.0.87 > 195.158.248.3: ICMP echo request, id 1183, seq 27, length 64
23:22:24.857230 IP 195.158.248.3 > 10.8.0.87: ICMP echo reply, id 1183, seq 27, length 64
23:22:25.555148 IP 10.8.0.87 > 195.158.248.3: ICMP echo request, id 1183, seq 28, length 64
23:22:25.858969 IP 195.158.248.3 > 10.8.0.87: ICMP echo reply, id 1183, seq 28, length 64
23:22:26.556896 IP 10.8.0.87 > 195.158.248.3: ICMP echo request, id 1183, seq 29, length 64
23:22:26.860783 IP 195.158.248.3 > 10.8.0.87: ICMP echo reply, id 1183, seq 29, length 64
23:22:27.557713 IP 10.8.0.87 > 195.158.248.3: ICMP echo request, id 1183, seq 30, length 64
23:22:27.861260 IP 195.158.248.3 > 10.8.0.87: ICMP echo reply, id 1183, seq 30, length 64
23:22:28.559199 IP 10.8.0.87 > 195.158.248.3: ICMP echo request, id 1183, seq 31, length 64
23:22:28.862796 IP 195.158.248.3 > 10.8.0.87: ICMP echo reply, id 1183, seq 31, length 64
23:22:29.560222 IP 10.8.0.87 > 195.158.248.3: ICMP echo request, id 1183, seq 32, length 64
23:22:29.863818 IP 195.158.248.3 > 10.8.0.87: ICMP echo reply, id 1183, seq 32, length 64
23:22:30.561750 IP 10.8.0.87 > 195.158.248.3: ICMP echo request, id 1183, seq 33, length 64
23:22:30.865356 IP 195.158.248.3 > 10.8.0.87: ICMP echo reply, id 1183, seq 33, length 64
23:22:31.563205 IP 10.8.0.87 > 195.158.248.3: ICMP echo request, id 1183, seq 34, length 64
23:22:31.867230 IP 195.158.248.3 > 10.8.0.87: ICMP echo reply, id 1183, seq 34, length 64
23:22:32.564154 IP 10.8.0.87 > 195.158.248.3: ICMP echo request, id 1183, seq 35, length 64
23:22:32.867628 IP 195.158.248.3 > 10.8.0.87: ICMP echo reply, id 1183, seq 35, length 64
23:22:33.565548 IP 10.8.0.87 > 195.158.248.3: ICMP echo request, id 1183, seq 36, length 64
23:22:33.869074 IP 195.158.248.3 > 10.8.0.87: ICMP echo reply, id 1183, seq 36, length 64
23:22:34.567007 IP 10.8.0.87 > 195.158.248.3: ICMP echo request, id 1183, seq 37, length 64
23:22:34.870469 IP 195.158.248.3 > 10.8.0.87: ICMP echo reply, id 1183, seq 37, length 64
23:22:35.568195 IP 10.8.0.87 > 195.158.248.3: ICMP echo request, id 1183, seq 38, length 64
23:22:35.871670 IP 195.158.248.3 > 10.8.0.87: ICMP echo reply, id 1183, seq 38, length 64
23:22:36.569600 IP 10.8.0.87 > 195.158.248.3: ICMP echo request, id 1183, seq 39, length 64
23:22:36.873115 IP 195.158.248.3 > 10.8.0.87: ICMP echo reply, id 1183, seq 39, length 64
23:22:37.571051 IP 10.8.0.87 > 195.158.248.3: ICMP echo request, id 1183, seq 40, length 64
23:22:37.874528 IP 195.158.248.3 > 10.8.0.87: ICMP echo reply, id 1183, seq 40, length 64
23:22:38.572465 IP 10.8.0.87 > 195.158.248.3: ICMP echo request, id 1183, seq 41, length 64
23:22:38.875967 IP 195.158.248.3 > 10.8.0.87: ICMP echo reply, id 1183, seq 41, length 64
23:22:39.573918 IP 10.8.0.87 > 195.158.248.3: ICMP echo request, id 1183, seq 42, length 64
23:22:39.877687 IP 195.158.248.3 > 10.8.0.87: ICMP echo reply, id 1183, seq 42, length 64
23:22:40.575623 IP 10.8.0.87 > 195.158.248.3: ICMP echo request, id 1183, seq 43, length 64
23:22:40.879211 IP 195.158.248.3 > 10.8.0.87: ICMP echo reply, id 1183, seq 43, length 64
23:22:41.577140 IP 10.8.0.87 > 195.158.248.3: ICMP echo request, id 1183, seq 44, length 64
23:22:41.880556 IP 195.158.248.3 > 10.8.0.87: ICMP echo reply, id 1183, seq 44, length 64
23:22:42.578477 IP 10.8.0.87 > 195.158.248.3: ICMP echo request, id 1183, seq 45, length 64
23:22:42.881824 IP 195.158.248.3 > 10.8.0.87: ICMP echo reply, id 1183, seq 45, length 64
23:22:43.579673 IP 10.8.0.87 > 195.158.248.3: ICMP echo request, id 1183, seq 46, length 64
23:22:43.883303 IP 195.158.248.3 > 10.8.0.87: ICMP echo reply, id 1183, seq 46, length 64
23:22:44.581221 IP 10.8.0.87 > 195.158.248.3: ICMP echo request, id 1183, seq 47, length 64
23:22:44.884952 IP 195.158.248.3 > 10.8.0.87: ICMP echo reply, id 1183, seq 47, length 64
23:22:45.582896 IP 10.8.0.87 > 195.158.248.3: ICMP echo request, id 1183, seq 48, length 64
23:22:45.886808 IP 195.158.248.3 > 10.8.0.87: ICMP echo reply, id 1183, seq 48, length 64
23:22:46.583748 IP 10.8.0.87 > 195.158.248.3: ICMP echo request, id 1183, seq 49, length 64
23:22:46.887568 IP 195.158.248.3 > 10.8.0.87: ICMP echo reply, id 1183, seq 49, length 64
23:22:47.585508 IP 10.8.0.87 > 195.158.248.3: ICMP echo request, id 1183, seq 50, length 64
23:22:47.888754 IP 195.158.248.3 > 10.8.0.87: ICMP echo reply, id 1183, seq 50, length 64
23:22:48.586701 IP 10.8.0.87 > 195.158.248.3: ICMP echo request, id 1183, seq 51, length 64
23:22:48.890387 IP 195.158.248.3 > 10.8.0.87: ICMP echo reply, id 1183, seq 51, length 64
23:22:49.588327 IP 10.8.0.87 > 195.158.248.3: ICMP echo request, id 1183, seq 52, length 64
23:22:49.892044 IP 195.158.248.3 > 10.8.0.87: ICMP echo reply, id 1183, seq 52, length 64
23:22:50.589973 IP 10.8.0.87 > 195.158.248.3: ICMP echo request, id 1183, seq 53, length 64
23:22:50.893804 IP 195.158.248.3 > 10.8.0.87: ICMP echo reply, id 1183, seq 53, length 64
23:22:51.590739 IP 10.8.0.87 > 195.158.248.3: ICMP echo request, id 1183, seq 54, length 64
23:22:51.894167 IP 195.158.248.3 > 10.8.0.87: ICMP echo reply, id 1183, seq 54, length 64
23:22:52.592103 IP 10.8.0.87 > 195.158.248.3: ICMP echo request, id 1183, seq 55, length 64
23:22:52.895850 IP 195.158.248.3 > 10.8.0.87: ICMP echo reply, id 1183, seq 55, length 64
23:22:53.593781 IP 10.8.0.87 > 195.158.248.3: ICMP echo request, id 1183, seq 56, length 64
23:22:53.897687 IP 195.158.248.3 > 10.8.0.87: ICMP echo reply, id 1183, seq 56, length 64
23:22:54.594621 IP 10.8.0.87 > 195.158.248.3: ICMP echo request, id 1183, seq 57, length 64
23:22:54.898019 IP 195.158.248.3 > 10.8.0.87: ICMP echo reply, id 1183, seq 57, length 64
23:22:55.595944 IP 10.8.0.87 > 195.158.248.3: ICMP echo request, id 1183, seq 58, length 64
23:22:55.899652 IP 195.158.248.3 > 10.8.0.87: ICMP echo reply, id 1183, seq 58, length 64
23:22:56.597575 IP 10.8.0.87 > 195.158.248.3: ICMP echo request, id 1183, seq 59, length 64
23:22:56.901240 IP 195.158.248.3 > 10.8.0.87: ICMP echo reply, id 1183, seq 59, length 64
23:22:57.599165 IP 10.8.0.87 > 195.158.248.3: ICMP echo request, id 1183, seq 60, length 64
23:22:57.903086 IP 195.158.248.3 > 10.8.0.87: ICMP echo reply, id 1183, seq 60, length 64
