22:20:01.380855 IP 10.8.0.59 > 103.1.212.91: ICMP echo request, id 952, seq 2, length 64
22:20:01.718205 IP 103.1.212.91 > 10.8.0.59: ICMP echo reply, id 952, seq 2, length 64
22:20:02.382028 IP 10.8.0.59 > 103.1.212.91: ICMP echo request, id 952, seq 3, length 64
22:20:02.719524 IP 103.1.212.91 > 10.8.0.59: ICMP echo reply, id 952, seq 3, length 64
22:20:03.383435 IP 10.8.0.59 > 103.1.212.91: ICMP echo request, id 952, seq 4, length 64
22:20:03.720901 IP 103.1.212.91 > 10.8.0.59: ICMP echo reply, id 952, seq 4, length 64
22:20:04.384803 IP 10.8.0.59 > 103.1.212.91: ICMP echo request, id 952, seq 5, length 64
22:20:04.722330 IP 103.1.212.91 > 10.8.0.59: ICMP echo reply, id 952, seq 5, length 64
22:20:05.386225 IP 10.8.0.59 > 103.1.212.91: ICMP echo request, id 952, seq 6, length 64
22:20:05.723686 IP 103.1.212.91 > 10.8.0.59: ICMP echo reply, id 952, seq 6, length 64
22:20:06.387585 IP 10.8.0.59 > 103.1.212.91: ICMP echo request, id 952, seq 7, length 64
22:20:06.724928 IP 103.1.212.91 > 10.8.0.59: ICMP echo reply, id 952, seq 7, length 64
22:20:07.388829 IP 10.8.0.59 > 103.1.212.91: ICMP echo request, id 952, seq 8, length 64
22:20:07.726242 IP 103.1.212.91 > 10.8.0.59: ICMP echo reply, id 952, seq 8, length 64
22:20:08.390125 IP 10.8.0.59 > 103.1.212.91: ICMP echo request, id 952, seq 9, length 64
22:20:08.727632 IP 103.1.212.91 > 10.8.0.59: ICMP echo reply, id 952, seq 9, length 64
22:20:09.391528 IP 10.8.0.59 > 103.1.212.91: ICMP echo request, id 952, seq 10, length 64
22:20:09.729071 IP 103.1.212.91 > 10.8.0.59: ICMP echo reply, id 952, seq 10, length 64
22:20:10.392963 IP 10.8.0.59 > 103.1.212.91: ICMP echo request, id 952, seq 11, length 64
22:20:10.730406 IP 103.1.212.91 > 10.8.0.59: ICMP echo reply, id 952, seq 11, length 64
22:20:11.394302 IP 10.8.0.59 > 103.1.212.91: ICMP echo request, id 952, seq 12, length 64
22:20:11.732121 IP 103.1.212.91 > 10.8.0.59: ICMP echo reply, id 952, seq 12, length 64
22:20:12.395984 IP 10.8.0.59 > 103.1.212.91: ICMP echo request, id 952, seq 13, length 64
22:20:12.733484 IP 103.1.212.91 > 10.8.0.59: ICMP echo reply, id 952, seq 13, length 64
22:20:13.397391 IP 10.8.0.59 > 103.1.212.91: ICMP echo request, id 952, seq 14, length 64
22:20:13.734944 IP 103.1.212.91 > 10.8.0.59: ICMP echo reply, id 952, seq 14, length 64
22:20:14.398852 IP 10.8.0.59 > 103.1.212.91: ICMP echo request, id 952, seq 15, length 64
22:20:14.736141 IP 103.1.212.91 > 10.8.0.59: ICMP echo reply, id 952, seq 15, length 64
22:20:15.400036 IP 10.8.0.59 > 103.1.212.91: ICMP echo request, id 952, seq 16, length 64
22:20:15.737741 IP 103.1.212.91 > 10.8.0.59: ICMP echo reply, id 952, seq 16, length 64
22:20:16.401640 IP 10.8.0.59 > 103.1.212.91: ICMP echo request, id 952, seq 17, length 64
22:20:16.739151 IP 103.1.212.91 > 10.8.0.59: ICMP echo reply, id 952, seq 17, length 64
22:20:17.403044 IP 10.8.0.59 > 103.1.212.91: ICMP echo request, id 952, seq 18, length 64
22:20:17.740746 IP 103.1.212.91 > 10.8.0.59: ICMP echo reply, id 952, seq 18, length 64
22:20:18.404638 IP 10.8.0.59 > 103.1.212.91: ICMP echo request, id 952, seq 19, length 64
22:20:18.742162 IP 103.1.212.91 > 10.8.0.59: ICMP echo reply, id 952, seq 19, length 64
22:20:19.406052 IP 10.8.0.59 > 103.1.212.91: ICMP echo request, id 952, seq 20, length 64
22:20:19.743499 IP 103.1.212.91 > 10.8.0.59: ICMP echo reply, id 952, seq 20, length 64
22:20:20.407395 IP 10.8.0.59 > 103.1.212.91: ICMP echo request, id 952, seq 21, length 64
22:20:20.813358 IP 103.1.212.91 > 10.8.0.59: ICMP echo reply, id 952, seq 21, length 64
22:20:21.408195 IP 10.8.0.59 > 103.1.212.91: ICMP echo request, id 952, seq 22, length 64
22:20:21.745756 IP 103.1.212.91 > 10.8.0.59: ICMP echo reply, id 952, seq 22, length 64
22:20:22.409654 IP 10.8.0.59 > 103.1.212.91: ICMP echo request, id 952, seq 23, length 64
22:20:22.746994 IP 103.1.212.91 > 10.8.0.59: ICMP echo reply, id 952, seq 23, length 64
22:20:23.410891 IP 10.8.0.59 > 103.1.212.91: ICMP echo request, id 952, seq 24, length 64
22:20:23.748261 IP 103.1.212.91 > 10.8.0.59: ICMP echo reply, id 952, seq 24, length 64
22:20:24.412165 IP 10.8.0.59 > 103.1.212.91: ICMP echo request, id 952, seq 25, length 64
22:20:24.749560 IP 103.1.212.91 > 10.8.0.59: ICMP echo reply, id 952, seq 25, length 64
22:20:25.413467 IP 10.8.0.59 > 103.1.212.91: ICMP echo request, id 952, seq 26, length 64
22:20:25.750723 IP 103.1.212.91 > 10.8.0.59: ICMP echo reply, id 952, seq 26, length 64
22:20:26.414617 IP 10.8.0.59 > 103.1.212.91: ICMP echo request, id 952, seq 27, length 64
22:20:26.752139 IP 103.1.212.91 > 10.8.0.59: ICMP echo reply, id 952, seq 27, length 64
22:20:27.416027 IP 10.8.0.59 > 103.1.212.91: ICMP echo request, id 952, seq 28, length 64
22:20:27.753578 IP 103.1.212.91 > 10.8.0.59: ICMP echo reply, id 952, seq 28, length 64
22:20:28.417468 IP 10.8.0.59 > 103.1.212.91: ICMP echo request, id 952, seq 29, length 64
22:20:28.754778 IP 103.1.212.91 > 10.8.0.59: ICMP echo reply, id 952, seq 29, length 64
22:20:29.418669 IP 10.8.0.59 > 103.1.212.91: ICMP echo request, id 952, seq 30, length 64
22:20:29.755977 IP 103.1.212.91 > 10.8.0.59: ICMP echo reply, id 952, seq 30, length 64
22:20:30.419885 IP 10.8.0.59 > 103.1.212.91: ICMP echo request, id 952, seq 31, length 64
22:20:30.757397 IP 103.1.212.91 > 10.8.0.59: ICMP echo reply, id 952, seq 31, length 64
22:20:31.421285 IP 10.8.0.59 > 103.1.212.91: ICMP echo request, id 952, seq 32, length 64
22:20:31.758786 IP 103.1.212.91 > 10.8.0.59: ICMP echo reply, id 952, seq 32, length 64
22:20:32.422676 IP 10.8.0.59 > 103.1.212.91: ICMP echo request, id 952, seq 33, length 64
22:20:32.760183 IP 103.1.212.91 > 10.8.0.59: ICMP echo reply, id 952, seq 33, length 64
22:20:33.424072 IP 10.8.0.59 > 103.1.212.91: ICMP echo request, id 952, seq 34, length 64
22:20:33.761484 IP 103.1.212.91 > 10.8.0.59: ICMP echo reply, id 952, seq 34, length 64
22:20:34.425374 IP 10.8.0.59 > 103.1.212.91: ICMP echo request, id 952, seq 35, length 64
22:20:34.852797 IP 103.1.212.91 > 10.8.0.59: ICMP echo reply, id 952, seq 35, length 64
22:20:35.426597 IP 10.8.0.59 > 103.1.212.91: ICMP echo request, id 952, seq 36, length 64
22:20:35.763994 IP 103.1.212.91 > 10.8.0.59: ICMP echo reply, id 952, seq 36, length 64
22:20:36.427869 IP 10.8.0.59 > 103.1.212.91: ICMP echo request, id 952, seq 37, length 64
22:20:36.765416 IP 103.1.212.91 > 10.8.0.59: ICMP echo reply, id 952, seq 37, length 64
22:20:37.429315 IP 10.8.0.59 > 103.1.212.91: ICMP echo request, id 952, seq 38, length 64
22:20:37.767032 IP 103.1.212.91 > 10.8.0.59: ICMP echo reply, id 952, seq 38, length 64
22:20:38.430922 IP 10.8.0.59 > 103.1.212.91: ICMP echo request, id 952, seq 39, length 64
22:20:38.768413 IP 103.1.212.91 > 10.8.0.59: ICMP echo reply, id 952, seq 39, length 64
22:20:39.432219 IP 10.8.0.59 > 103.1.212.91: ICMP echo request, id 952, seq 40, length 64
22:20:39.770016 IP 103.1.212.91 > 10.8.0.59: ICMP echo reply, id 952, seq 40, length 64
22:20:40.433914 IP 10.8.0.59 > 103.1.212.91: ICMP echo request, id 952, seq 41, length 64
22:20:40.771795 IP 103.1.212.91 > 10.8.0.59: ICMP echo reply, id 952, seq 41, length 64
22:20:41.434688 IP 10.8.0.59 > 103.1.212.91: ICMP echo request, id 952, seq 42, length 64
22:20:41.772018 IP 103.1.212.91 > 10.8.0.59: ICMP echo reply, id 952, seq 42, length 64
22:20:42.435926 IP 10.8.0.59 > 103.1.212.91: ICMP echo request, id 952, seq 43, length 64
22:20:42.773841 IP 103.1.212.91 > 10.8.0.59: ICMP echo reply, id 952, seq 43, length 64
22:20:43.436237 IP 10.8.0.59 > 103.1.212.91: ICMP echo request, id 952, seq 44, length 64
22:20:43.774099 IP 103.1.212.91 > 10.8.0.59: ICMP echo reply, id 952, seq 44, length 64
22:20:44.437000 IP 10.8.0.59 > 103.1.212.91: ICMP echo request, id 952, seq 45, length 64
22:20:44.774850 IP 103.1.212.91 > 10.8.0.59: ICMP echo reply, id 952, seq 45, length 64
22:20:45.437751 IP 10.8.0.59 > 103.1.212.91: ICMP echo request, id 952, seq 46, length 64
22:20:45.775252 IP 103.1.212.91 > 10.8.0.59: ICMP echo reply, id 952, seq 46, length 64
22:20:46.439154 IP 10.8.0.59 > 103.1.212.91: ICMP echo request, id 952, seq 47, length 64
22:20:46.776674 IP 103.1.212.91 > 10.8.0.59: ICMP echo reply, id 952, seq 47, length 64
22:20:47.440218 IP 10.8.0.59 > 103.1.212.91: ICMP echo request, id 952, seq 48, length 64
22:20:47.777734 IP 103.1.212.91 > 10.8.0.59: ICMP echo reply, id 952, seq 48, length 64
22:20:48.441637 IP 10.8.0.59 > 103.1.212.91: ICMP echo request, id 952, seq 49, length 64
22:20:48.779134 IP 103.1.212.91 > 10.8.0.59: ICMP echo reply, id 952, seq 49, length 64
22:20:49.443037 IP 10.8.0.59 > 103.1.212.91: ICMP echo request, id 952, seq 50, length 64
22:20:49.780643 IP 103.1.212.91 > 10.8.0.59: ICMP echo reply, id 952, seq 50, length 64
22:20:50.444207 IP 10.8.0.59 > 103.1.212.91: ICMP echo request, id 952, seq 51, length 64
22:20:50.781954 IP 103.1.212.91 > 10.8.0.59: ICMP echo reply, id 952, seq 51, length 64
22:20:51.445857 IP 10.8.0.59 > 103.1.212.91: ICMP echo request, id 952, seq 52, length 64
22:20:51.783321 IP 103.1.212.91 > 10.8.0.59: ICMP echo reply, id 952, seq 52, length 64
22:20:52.447220 IP 10.8.0.59 > 103.1.212.91: ICMP echo request, id 952, seq 53, length 64
22:20:52.784680 IP 103.1.212.91 > 10.8.0.59: ICMP echo reply, id 952, seq 53, length 64
22:20:53.448216 IP 10.8.0.59 > 103.1.212.91: ICMP echo request, id 952, seq 54, length 64
22:20:53.785897 IP 103.1.212.91 > 10.8.0.59: ICMP echo reply, id 952, seq 54, length 64
22:20:54.449792 IP 10.8.0.59 > 103.1.212.91: ICMP echo request, id 952, seq 55, length 64
22:20:54.787515 IP 103.1.212.91 > 10.8.0.59: ICMP echo reply, id 952, seq 55, length 64
22:20:55.451411 IP 10.8.0.59 > 103.1.212.91: ICMP echo request, id 952, seq 56, length 64
22:20:55.789142 IP 103.1.212.91 > 10.8.0.59: ICMP echo reply, id 952, seq 56, length 64
22:20:56.453038 IP 10.8.0.59 > 103.1.212.91: ICMP echo request, id 952, seq 57, length 64
22:20:56.790775 IP 103.1.212.91 > 10.8.0.59: ICMP echo reply, id 952, seq 57, length 64
22:20:57.454675 IP 10.8.0.59 > 103.1.212.91: ICMP echo request, id 952, seq 58, length 64
22:20:57.792385 IP 103.1.212.91 > 10.8.0.59: ICMP echo reply, id 952, seq 58, length 64
22:20:58.456298 IP 10.8.0.59 > 103.1.212.91: ICMP echo request, id 952, seq 59, length 64
22:20:58.793706 IP 103.1.212.91 > 10.8.0.59: ICMP echo reply, id 952, seq 59, length 64
22:20:59.457606 IP 10.8.0.59 > 103.1.212.91: ICMP echo request, id 952, seq 60, length 64
22:20:59.794897 IP 103.1.212.91 > 10.8.0.59: ICMP echo reply, id 952, seq 60, length 64
