04:45:11.267768 IP 179.48.249.195 > 10.8.2.3: ICMP echo reply, id 79, seq 1, length 64
04:45:12.102484 IP 10.8.2.3 > 179.48.249.195: ICMP echo request, id 79, seq 2, length 64
04:45:12.550175 IP 179.48.249.195 > 10.8.2.3: ICMP echo reply, id 79, seq 2, length 64
04:45:13.103954 IP 10.8.2.3 > 179.48.249.195: ICMP echo request, id 79, seq 3, length 64
04:45:13.554353 IP 179.48.249.195 > 10.8.2.3: ICMP echo reply, id 79, seq 3, length 64
04:45:14.105112 IP 10.8.2.3 > 179.48.249.195: ICMP echo request, id 79, seq 4, length 64
04:45:14.551772 IP 179.48.249.195 > 10.8.2.3: ICMP echo reply, id 79, seq 4, length 64
04:45:15.106519 IP 10.8.2.3 > 179.48.249.195: ICMP echo request, id 79, seq 5, length 64
04:45:15.560385 IP 179.48.249.195 > 10.8.2.3: ICMP echo reply, id 79, seq 5, length 64
04:45:16.108123 IP 10.8.2.3 > 179.48.249.195: ICMP echo request, id 79, seq 6, length 64
04:45:16.556000 IP 179.48.249.195 > 10.8.2.3: ICMP echo reply, id 79, seq 6, length 64
04:45:17.108746 IP 10.8.2.3 > 179.48.249.195: ICMP echo request, id 79, seq 7, length 64
04:45:17.555918 IP 179.48.249.195 > 10.8.2.3: ICMP echo reply, id 79, seq 7, length 64
04:45:18.109538 IP 10.8.2.3 > 179.48.249.195: ICMP echo request, id 79, seq 8, length 64
04:45:18.559405 IP 179.48.249.195 > 10.8.2.3: ICMP echo reply, id 79, seq 8, length 64
04:45:19.111170 IP 10.8.2.3 > 179.48.249.195: ICMP echo request, id 79, seq 9, length 64
04:45:19.561817 IP 179.48.249.195 > 10.8.2.3: ICMP echo reply, id 79, seq 9, length 64
04:45:20.112618 IP 10.8.2.3 > 179.48.249.195: ICMP echo request, id 79, seq 10, length 64
04:45:20.559910 IP 179.48.249.195 > 10.8.2.3: ICMP echo reply, id 79, seq 10, length 64
04:45:21.113703 IP 10.8.2.3 > 179.48.249.195: ICMP echo request, id 79, seq 11, length 64
04:45:21.560590 IP 179.48.249.195 > 10.8.2.3: ICMP echo reply, id 79, seq 11, length 64
04:45:22.114197 IP 10.8.2.3 > 179.48.249.195: ICMP echo request, id 79, seq 12, length 64
04:45:22.564232 IP 179.48.249.195 > 10.8.2.3: ICMP echo reply, id 79, seq 12, length 64
04:45:23.115027 IP 10.8.2.3 > 179.48.249.195: ICMP echo request, id 79, seq 13, length 64
04:45:23.563902 IP 179.48.249.195 > 10.8.2.3: ICMP echo reply, id 79, seq 13, length 64
04:45:24.115705 IP 10.8.2.3 > 179.48.249.195: ICMP echo request, id 79, seq 14, length 64
04:45:24.564230 IP 179.48.249.195 > 10.8.2.3: ICMP echo reply, id 79, seq 14, length 64
04:45:25.117027 IP 10.8.2.3 > 179.48.249.195: ICMP echo request, id 79, seq 15, length 64
04:45:25.566657 IP 179.48.249.195 > 10.8.2.3: ICMP echo reply, id 79, seq 15, length 64
04:45:26.118228 IP 10.8.2.3 > 179.48.249.195: ICMP echo request, id 79, seq 16, length 64
04:45:26.570125 IP 179.48.249.195 > 10.8.2.3: ICMP echo reply, id 79, seq 16, length 64
04:45:27.118932 IP 10.8.2.3 > 179.48.249.195: ICMP echo request, id 79, seq 17, length 64
04:45:27.567487 IP 179.48.249.195 > 10.8.2.3: ICMP echo reply, id 79, seq 17, length 64
04:45:28.120294 IP 10.8.2.3 > 179.48.249.195: ICMP echo request, id 79, seq 18, length 64
04:45:28.568060 IP 179.48.249.195 > 10.8.2.3: ICMP echo reply, id 79, seq 18, length 64
04:45:29.121874 IP 10.8.2.3 > 179.48.249.195: ICMP echo request, id 79, seq 19, length 64
04:45:29.574494 IP 179.48.249.195 > 10.8.2.3: ICMP echo reply, id 79, seq 19, length 64
04:45:30.123295 IP 10.8.2.3 > 179.48.249.195: ICMP echo request, id 79, seq 20, length 64
04:45:30.576095 IP 179.48.249.195 > 10.8.2.3: ICMP echo reply, id 79, seq 20, length 64
04:45:31.124895 IP 10.8.2.3 > 179.48.249.195: ICMP echo request, id 79, seq 21, length 64
04:45:31.580685 IP 179.48.249.195 > 10.8.2.3: ICMP echo reply, id 79, seq 21, length 64
04:45:32.126344 IP 10.8.2.3 > 179.48.249.195: ICMP echo request, id 79, seq 22, length 64
04:45:32.586121 IP 179.48.249.195 > 10.8.2.3: ICMP echo reply, id 79, seq 22, length 64
04:45:33.127924 IP 10.8.2.3 > 179.48.249.195: ICMP echo request, id 79, seq 23, length 64
04:45:33.591707 IP 179.48.249.195 > 10.8.2.3: ICMP echo reply, id 79, seq 23, length 64
04:45:34.129463 IP 10.8.2.3 > 179.48.249.195: ICMP echo request, id 79, seq 24, length 64
04:45:34.586580 IP 179.48.249.195 > 10.8.2.3: ICMP echo reply, id 79, seq 24, length 64
04:45:35.130336 IP 10.8.2.3 > 179.48.249.195: ICMP echo request, id 79, seq 25, length 64
04:45:35.595321 IP 179.48.249.195 > 10.8.2.3: ICMP echo reply, id 79, seq 25, length 64
04:45:36.131075 IP 10.8.2.3 > 179.48.249.195: ICMP echo request, id 79, seq 26, length 64
04:45:36.591156 IP 179.48.249.195 > 10.8.2.3: ICMP echo reply, id 79, seq 26, length 64
04:45:37.131912 IP 10.8.2.3 > 179.48.249.195: ICMP echo request, id 79, seq 27, length 64
04:45:37.587159 IP 179.48.249.195 > 10.8.2.3: ICMP echo reply, id 79, seq 27, length 64
04:45:38.132952 IP 10.8.2.3 > 179.48.249.195: ICMP echo request, id 79, seq 28, length 64
04:45:38.590753 IP 179.48.249.195 > 10.8.2.3: ICMP echo reply, id 79, seq 28, length 64
04:45:39.134175 IP 10.8.2.3 > 179.48.249.195: ICMP echo request, id 79, seq 29, length 64
04:45:39.580835 IP 179.48.249.195 > 10.8.2.3: ICMP echo reply, id 79, seq 29, length 64
04:45:40.135628 IP 10.8.2.3 > 179.48.249.195: ICMP echo request, id 79, seq 30, length 64
04:45:40.600685 IP 179.48.249.195 > 10.8.2.3: ICMP echo reply, id 79, seq 30, length 64
04:45:41.136474 IP 10.8.2.3 > 179.48.249.195: ICMP echo request, id 79, seq 31, length 64
04:45:41.583172 IP 179.48.249.195 > 10.8.2.3: ICMP echo reply, id 79, seq 31, length 64
04:45:42.137990 IP 10.8.2.3 > 179.48.249.195: ICMP echo request, id 79, seq 32, length 64
04:45:42.584682 IP 179.48.249.195 > 10.8.2.3: ICMP echo reply, id 79, seq 32, length 64
04:45:43.139483 IP 10.8.2.3 > 179.48.249.195: ICMP echo request, id 79, seq 33, length 64
04:45:43.587208 IP 179.48.249.195 > 10.8.2.3: ICMP echo reply, id 79, seq 33, length 64
04:45:44.141011 IP 10.8.2.3 > 179.48.249.195: ICMP echo request, id 79, seq 34, length 64
04:45:44.604058 IP 179.48.249.195 > 10.8.2.3: ICMP echo reply, id 79, seq 34, length 64
04:45:45.141842 IP 10.8.2.3 > 179.48.249.195: ICMP echo request, id 79, seq 35, length 64
04:45:45.589444 IP 179.48.249.195 > 10.8.2.3: ICMP echo reply, id 79, seq 35, length 64
04:45:46.143236 IP 10.8.2.3 > 179.48.249.195: ICMP echo request, id 79, seq 36, length 64
04:45:46.607457 IP 179.48.249.195 > 10.8.2.3: ICMP echo reply, id 79, seq 36, length 64
04:45:47.144235 IP 10.8.2.3 > 179.48.249.195: ICMP echo request, id 79, seq 37, length 64
04:45:47.622224 IP 179.48.249.195 > 10.8.2.3: ICMP echo reply, id 79, seq 37, length 64
04:45:48.145013 IP 10.8.2.3 > 179.48.249.195: ICMP echo request, id 79, seq 38, length 64
04:45:48.592945 IP 179.48.249.195 > 10.8.2.3: ICMP echo reply, id 79, seq 38, length 64
04:45:49.145745 IP 10.8.2.3 > 179.48.249.195: ICMP echo request, id 79, seq 39, length 64
04:45:49.592539 IP 179.48.249.195 > 10.8.2.3: ICMP echo reply, id 79, seq 39, length 64
04:45:50.147337 IP 10.8.2.3 > 179.48.249.195: ICMP echo request, id 79, seq 40, length 64
04:45:50.603194 IP 179.48.249.195 > 10.8.2.3: ICMP echo reply, id 79, seq 40, length 64
04:45:51.147984 IP 10.8.2.3 > 179.48.249.195: ICMP echo request, id 79, seq 41, length 64
04:45:51.600516 IP 179.48.249.195 > 10.8.2.3: ICMP echo reply, id 79, seq 41, length 64
04:45:52.149299 IP 10.8.2.3 > 179.48.249.195: ICMP echo request, id 79, seq 42, length 64
04:45:52.596184 IP 179.48.249.195 > 10.8.2.3: ICMP echo reply, id 79, seq 42, length 64
04:45:53.149982 IP 10.8.2.3 > 179.48.249.195: ICMP echo request, id 79, seq 43, length 64
04:45:53.603105 IP 179.48.249.195 > 10.8.2.3: ICMP echo reply, id 79, seq 43, length 64
04:45:54.150903 IP 10.8.2.3 > 179.48.249.195: ICMP echo request, id 79, seq 44, length 64
04:45:54.598546 IP 179.48.249.195 > 10.8.2.3: ICMP echo reply, id 79, seq 44, length 64
04:45:55.152342 IP 10.8.2.3 > 179.48.249.195: ICMP echo request, id 79, seq 45, length 64
04:45:55.602576 IP 179.48.249.195 > 10.8.2.3: ICMP echo reply, id 79, seq 45, length 64
04:45:56.153369 IP 10.8.2.3 > 179.48.249.195: ICMP echo request, id 79, seq 46, length 64
04:45:56.600577 IP 179.48.249.195 > 10.8.2.3: ICMP echo reply, id 79, seq 46, length 64
04:45:57.154377 IP 10.8.2.3 > 179.48.249.195: ICMP echo request, id 79, seq 47, length 64
04:45:57.602768 IP 179.48.249.195 > 10.8.2.3: ICMP echo reply, id 79, seq 47, length 64
04:45:58.155570 IP 10.8.2.3 > 179.48.249.195: ICMP echo request, id 79, seq 48, length 64
04:45:58.612788 IP 179.48.249.195 > 10.8.2.3: ICMP echo reply, id 79, seq 48, length 64
04:45:59.156576 IP 10.8.2.3 > 179.48.249.195: ICMP echo request, id 79, seq 49, length 64
04:45:59.620455 IP 179.48.249.195 > 10.8.2.3: ICMP echo reply, id 79, seq 49, length 64
04:46:00.157248 IP 10.8.2.3 > 179.48.249.195: ICMP echo request, id 79, seq 50, length 64
04:46:00.613979 IP 179.48.249.195 > 10.8.2.3: ICMP echo reply, id 79, seq 50, length 64
04:46:01.158809 IP 10.8.2.3 > 179.48.249.195: ICMP echo request, id 79, seq 51, length 64
04:46:01.605473 IP 179.48.249.195 > 10.8.2.3: ICMP echo reply, id 79, seq 51, length 64
04:46:02.160275 IP 10.8.2.3 > 179.48.249.195: ICMP echo request, id 79, seq 52, length 64
04:46:02.607072 IP 179.48.249.195 > 10.8.2.3: ICMP echo reply, id 79, seq 52, length 64
04:46:03.161867 IP 10.8.2.3 > 179.48.249.195: ICMP echo request, id 79, seq 53, length 64
04:46:03.608334 IP 179.48.249.195 > 10.8.2.3: ICMP echo reply, id 79, seq 53, length 64
04:46:04.163134 IP 10.8.2.3 > 179.48.249.195: ICMP echo request, id 79, seq 54, length 64
04:46:04.624134 IP 179.48.249.195 > 10.8.2.3: ICMP echo reply, id 79, seq 54, length 64
04:46:05.163962 IP 10.8.2.3 > 179.48.249.195: ICMP echo request, id 79, seq 55, length 64
04:46:05.610736 IP 179.48.249.195 > 10.8.2.3: ICMP echo reply, id 79, seq 55, length 64
04:46:06.165523 IP 10.8.2.3 > 179.48.249.195: ICMP echo request, id 79, seq 56, length 64
04:46:06.627196 IP 179.48.249.195 > 10.8.2.3: ICMP echo reply, id 79, seq 56, length 64
04:46:07.166988 IP 10.8.2.3 > 179.48.249.195: ICMP echo request, id 79, seq 57, length 64
04:46:07.614159 IP 179.48.249.195 > 10.8.2.3: ICMP echo reply, id 79, seq 57, length 64
04:46:08.167970 IP 10.8.2.3 > 179.48.249.195: ICMP echo request, id 79, seq 58, length 64
04:46:08.617904 IP 179.48.249.195 > 10.8.2.3: ICMP echo reply, id 79, seq 58, length 64
04:46:09.168694 IP 10.8.2.3 > 179.48.249.195: ICMP echo request, id 79, seq 59, length 64
04:46:09.615141 IP 179.48.249.195 > 10.8.2.3: ICMP echo reply, id 79, seq 59, length 64
04:46:10.169899 IP 10.8.2.3 > 179.48.249.195: ICMP echo request, id 79, seq 60, length 64
