16:13:07.998443 IP 179.48.249.195 > 10.8.2.19: ICMP echo reply, id 407, seq 1, length 64
16:13:09.393516 IP 10.8.2.19 > 179.48.249.195: ICMP echo request, id 407, seq 2, length 64
16:13:09.871948 IP 179.48.249.195 > 10.8.2.19: ICMP echo reply, id 407, seq 2, length 64
16:13:10.394711 IP 10.8.2.19 > 179.48.249.195: ICMP echo request, id 407, seq 3, length 64
16:13:10.876476 IP 179.48.249.195 > 10.8.2.19: ICMP echo reply, id 407, seq 3, length 64
16:13:11.396215 IP 10.8.2.19 > 179.48.249.195: ICMP echo request, id 407, seq 4, length 64
16:13:11.874402 IP 179.48.249.195 > 10.8.2.19: ICMP echo reply, id 407, seq 4, length 64
16:13:12.397140 IP 10.8.2.19 > 179.48.249.195: ICMP echo request, id 407, seq 5, length 64
16:13:12.875195 IP 179.48.249.195 > 10.8.2.19: ICMP echo reply, id 407, seq 5, length 64
16:13:13.397904 IP 10.8.2.19 > 179.48.249.195: ICMP echo request, id 407, seq 6, length 64
16:13:13.876041 IP 179.48.249.195 > 10.8.2.19: ICMP echo reply, id 407, seq 6, length 64
16:13:14.398779 IP 10.8.2.19 > 179.48.249.195: ICMP echo request, id 407, seq 7, length 64
16:13:14.877220 IP 179.48.249.195 > 10.8.2.19: ICMP echo reply, id 407, seq 7, length 64
16:13:15.399963 IP 10.8.2.19 > 179.48.249.195: ICMP echo request, id 407, seq 8, length 64
16:13:15.878788 IP 179.48.249.195 > 10.8.2.19: ICMP echo reply, id 407, seq 8, length 64
16:13:16.401529 IP 10.8.2.19 > 179.48.249.195: ICMP echo request, id 407, seq 9, length 64
16:13:16.880285 IP 179.48.249.195 > 10.8.2.19: ICMP echo reply, id 407, seq 9, length 64
16:13:17.403022 IP 10.8.2.19 > 179.48.249.195: ICMP echo request, id 407, seq 10, length 64
16:13:17.881296 IP 179.48.249.195 > 10.8.2.19: ICMP echo reply, id 407, seq 10, length 64
16:13:18.404033 IP 10.8.2.19 > 179.48.249.195: ICMP echo request, id 407, seq 11, length 64
16:13:18.882476 IP 179.48.249.195 > 10.8.2.19: ICMP echo reply, id 407, seq 11, length 64
16:13:19.405224 IP 10.8.2.19 > 179.48.249.195: ICMP echo request, id 407, seq 12, length 64
16:13:19.883522 IP 179.48.249.195 > 10.8.2.19: ICMP echo reply, id 407, seq 12, length 64
16:13:20.406261 IP 10.8.2.19 > 179.48.249.195: ICMP echo request, id 407, seq 13, length 64
16:13:20.884390 IP 179.48.249.195 > 10.8.2.19: ICMP echo reply, id 407, seq 13, length 64
16:13:21.407130 IP 10.8.2.19 > 179.48.249.195: ICMP echo request, id 407, seq 14, length 64
16:13:21.886410 IP 179.48.249.195 > 10.8.2.19: ICMP echo reply, id 407, seq 14, length 64
16:13:22.408149 IP 10.8.2.19 > 179.48.249.195: ICMP echo request, id 407, seq 15, length 64
16:13:22.899464 IP 179.48.249.195 > 10.8.2.19: ICMP echo reply, id 407, seq 15, length 64
16:13:23.409206 IP 10.8.2.19 > 179.48.249.195: ICMP echo request, id 407, seq 16, length 64
16:13:23.937024 IP 179.48.249.195 > 10.8.2.19: ICMP echo reply, id 407, seq 16, length 64
16:13:24.410725 IP 10.8.2.19 > 179.48.249.195: ICMP echo request, id 407, seq 17, length 64
16:13:24.892294 IP 179.48.249.195 > 10.8.2.19: ICMP echo reply, id 407, seq 17, length 64
16:13:25.412039 IP 10.8.2.19 > 179.48.249.195: ICMP echo request, id 407, seq 18, length 64
16:13:25.890308 IP 179.48.249.195 > 10.8.2.19: ICMP echo reply, id 407, seq 18, length 64
16:13:26.413060 IP 10.8.2.19 > 179.48.249.195: ICMP echo request, id 407, seq 19, length 64
16:13:26.891679 IP 179.48.249.195 > 10.8.2.19: ICMP echo reply, id 407, seq 19, length 64
16:13:27.414427 IP 10.8.2.19 > 179.48.249.195: ICMP echo request, id 407, seq 20, length 64
16:13:27.892740 IP 179.48.249.195 > 10.8.2.19: ICMP echo reply, id 407, seq 20, length 64
16:13:28.415488 IP 10.8.2.19 > 179.48.249.195: ICMP echo request, id 407, seq 21, length 64
16:13:28.893941 IP 179.48.249.195 > 10.8.2.19: ICMP echo reply, id 407, seq 21, length 64
16:13:29.416692 IP 10.8.2.19 > 179.48.249.195: ICMP echo request, id 407, seq 22, length 64
16:13:29.895425 IP 179.48.249.195 > 10.8.2.19: ICMP echo reply, id 407, seq 22, length 64
16:13:30.418185 IP 10.8.2.19 > 179.48.249.195: ICMP echo request, id 407, seq 23, length 64
16:13:30.896406 IP 179.48.249.195 > 10.8.2.19: ICMP echo reply, id 407, seq 23, length 64
16:13:31.419176 IP 10.8.2.19 > 179.48.249.195: ICMP echo request, id 407, seq 24, length 64
16:13:31.897684 IP 179.48.249.195 > 10.8.2.19: ICMP echo reply, id 407, seq 24, length 64
16:13:32.420434 IP 10.8.2.19 > 179.48.249.195: ICMP echo request, id 407, seq 25, length 64
16:13:32.898795 IP 179.48.249.195 > 10.8.2.19: ICMP echo reply, id 407, seq 25, length 64
16:13:33.421540 IP 10.8.2.19 > 179.48.249.195: ICMP echo request, id 407, seq 26, length 64
16:13:33.900016 IP 179.48.249.195 > 10.8.2.19: ICMP echo reply, id 407, seq 26, length 64
16:13:34.422765 IP 10.8.2.19 > 179.48.249.195: ICMP echo request, id 407, seq 27, length 64
16:13:34.901297 IP 179.48.249.195 > 10.8.2.19: ICMP echo reply, id 407, seq 27, length 64
16:13:35.424049 IP 10.8.2.19 > 179.48.249.195: ICMP echo request, id 407, seq 28, length 64
16:13:35.902330 IP 179.48.249.195 > 10.8.2.19: ICMP echo reply, id 407, seq 28, length 64
16:13:36.425033 IP 10.8.2.19 > 179.48.249.195: ICMP echo request, id 407, seq 29, length 64
16:13:36.903818 IP 179.48.249.195 > 10.8.2.19: ICMP echo reply, id 407, seq 29, length 64
16:13:37.426567 IP 10.8.2.19 > 179.48.249.195: ICMP echo request, id 407, seq 30, length 64
16:13:37.905129 IP 179.48.249.195 > 10.8.2.19: ICMP echo reply, id 407, seq 30, length 64
16:13:38.427882 IP 10.8.2.19 > 179.48.249.195: ICMP echo request, id 407, seq 31, length 64
16:13:38.906012 IP 179.48.249.195 > 10.8.2.19: ICMP echo reply, id 407, seq 31, length 64
16:13:39.428761 IP 10.8.2.19 > 179.48.249.195: ICMP echo request, id 407, seq 32, length 64
16:13:39.906980 IP 179.48.249.195 > 10.8.2.19: ICMP echo reply, id 407, seq 32, length 64
16:13:40.429735 IP 10.8.2.19 > 179.48.249.195: ICMP echo request, id 407, seq 33, length 64
16:13:40.908069 IP 179.48.249.195 > 10.8.2.19: ICMP echo reply, id 407, seq 33, length 64
16:13:41.430818 IP 10.8.2.19 > 179.48.249.195: ICMP echo request, id 407, seq 34, length 64
16:13:41.909046 IP 179.48.249.195 > 10.8.2.19: ICMP echo reply, id 407, seq 34, length 64
16:13:42.431794 IP 10.8.2.19 > 179.48.249.195: ICMP echo request, id 407, seq 35, length 64
16:13:42.910762 IP 179.48.249.195 > 10.8.2.19: ICMP echo reply, id 407, seq 35, length 64
16:13:43.432511 IP 10.8.2.19 > 179.48.249.195: ICMP echo request, id 407, seq 36, length 64
16:13:43.913376 IP 179.48.249.195 > 10.8.2.19: ICMP echo reply, id 407, seq 36, length 64
16:13:44.433126 IP 10.8.2.19 > 179.48.249.195: ICMP echo request, id 407, seq 37, length 64
16:13:44.911504 IP 179.48.249.195 > 10.8.2.19: ICMP echo reply, id 407, seq 37, length 64
16:13:45.434260 IP 10.8.2.19 > 179.48.249.195: ICMP echo request, id 407, seq 38, length 64
16:13:45.912756 IP 179.48.249.195 > 10.8.2.19: ICMP echo reply, id 407, seq 38, length 64
16:13:46.435506 IP 10.8.2.19 > 179.48.249.195: ICMP echo request, id 407, seq 39, length 64
16:13:46.913585 IP 179.48.249.195 > 10.8.2.19: ICMP echo reply, id 407, seq 39, length 64
16:13:47.436341 IP 10.8.2.19 > 179.48.249.195: ICMP echo request, id 407, seq 40, length 64
16:13:47.914563 IP 179.48.249.195 > 10.8.2.19: ICMP echo reply, id 407, seq 40, length 64
16:13:48.437311 IP 10.8.2.19 > 179.48.249.195: ICMP echo request, id 407, seq 41, length 64
16:13:48.919231 IP 179.48.249.195 > 10.8.2.19: ICMP echo reply, id 407, seq 41, length 64
16:13:49.437978 IP 10.8.2.19 > 179.48.249.195: ICMP echo request, id 407, seq 42, length 64
16:13:49.916267 IP 179.48.249.195 > 10.8.2.19: ICMP echo reply, id 407, seq 42, length 64
16:13:50.439018 IP 10.8.2.19 > 179.48.249.195: ICMP echo request, id 407, seq 43, length 64
16:13:50.917138 IP 179.48.249.195 > 10.8.2.19: ICMP echo reply, id 407, seq 43, length 64
16:13:51.439889 IP 10.8.2.19 > 179.48.249.195: ICMP echo request, id 407, seq 44, length 64
16:13:51.918550 IP 179.48.249.195 > 10.8.2.19: ICMP echo reply, id 407, seq 44, length 64
16:13:52.441300 IP 10.8.2.19 > 179.48.249.195: ICMP echo request, id 407, seq 45, length 64
16:13:52.919584 IP 179.48.249.195 > 10.8.2.19: ICMP echo reply, id 407, seq 45, length 64
16:13:53.442296 IP 10.8.2.19 > 179.48.249.195: ICMP echo request, id 407, seq 46, length 64
16:13:53.921045 IP 179.48.249.195 > 10.8.2.19: ICMP echo reply, id 407, seq 46, length 64
16:13:54.443797 IP 10.8.2.19 > 179.48.249.195: ICMP echo request, id 407, seq 47, length 64
16:13:54.922190 IP 179.48.249.195 > 10.8.2.19: ICMP echo reply, id 407, seq 47, length 64
16:13:55.444941 IP 10.8.2.19 > 179.48.249.195: ICMP echo request, id 407, seq 48, length 64
16:13:55.923444 IP 179.48.249.195 > 10.8.2.19: ICMP echo reply, id 407, seq 48, length 64
16:13:56.446190 IP 10.8.2.19 > 179.48.249.195: ICMP echo request, id 407, seq 49, length 64
16:13:56.924656 IP 179.48.249.195 > 10.8.2.19: ICMP echo reply, id 407, seq 49, length 64
16:13:57.447405 IP 10.8.2.19 > 179.48.249.195: ICMP echo request, id 407, seq 50, length 64
16:13:57.926437 IP 179.48.249.195 > 10.8.2.19: ICMP echo reply, id 407, seq 50, length 64
16:13:58.448200 IP 10.8.2.19 > 179.48.249.195: ICMP echo request, id 407, seq 51, length 64
16:13:58.931358 IP 179.48.249.195 > 10.8.2.19: ICMP echo reply, id 407, seq 51, length 64
16:13:59.449106 IP 10.8.2.19 > 179.48.249.195: ICMP echo request, id 407, seq 52, length 64
16:13:59.941322 IP 179.48.249.195 > 10.8.2.19: ICMP echo reply, id 407, seq 52, length 64
16:14:00.450060 IP 10.8.2.19 > 179.48.249.195: ICMP echo request, id 407, seq 53, length 64
16:14:00.928915 IP 179.48.249.195 > 10.8.2.19: ICMP echo reply, id 407, seq 53, length 64
16:14:01.450663 IP 10.8.2.19 > 179.48.249.195: ICMP echo request, id 407, seq 54, length 64
16:14:01.954142 IP 179.48.249.195 > 10.8.2.19: ICMP echo reply, id 407, seq 54, length 64
16:14:02.451868 IP 10.8.2.19 > 179.48.249.195: ICMP echo request, id 407, seq 55, length 64
16:14:02.961561 IP 179.48.249.195 > 10.8.2.19: ICMP echo reply, id 407, seq 55, length 64
16:14:03.453281 IP 10.8.2.19 > 179.48.249.195: ICMP echo request, id 407, seq 56, length 64
16:14:04.475246 IP 10.8.2.19 > 179.48.249.195: ICMP echo request, id 407, seq 57, length 64
16:14:05.499239 IP 10.8.2.19 > 179.48.249.195: ICMP echo request, id 407, seq 58, length 64
16:14:05.696044 IP 179.48.249.195 > 10.8.2.19: ICMP echo reply, id 407, seq 56, length 64
16:14:05.696100 IP 179.48.249.195 > 10.8.2.19: ICMP echo reply, id 407, seq 57, length 64
16:14:05.982868 IP 179.48.249.195 > 10.8.2.19: ICMP echo reply, id 407, seq 58, length 64
16:14:06.500613 IP 10.8.2.19 > 179.48.249.195: ICMP echo request, id 407, seq 59, length 64
16:14:07.230970 IP 179.48.249.195 > 10.8.2.19: ICMP echo reply, id 407, seq 59, length 64
