07:52:27.289251 IP 10.8.0.2 > 192.154.198.15: ICMP echo request, id 780, seq 2, length 64
07:52:28.318233 IP 10.8.0.2 > 192.154.198.15: ICMP echo request, id 780, seq 3, length 64
07:52:29.342222 IP 10.8.0.2 > 192.154.198.15: ICMP echo request, id 780, seq 4, length 64
07:52:29.776111 IP 192.154.198.15 > 10.8.0.2: ICMP echo reply, id 780, seq 4, length 64
07:52:30.342924 IP 10.8.0.2 > 192.154.198.15: ICMP echo request, id 780, seq 5, length 64
07:52:30.772328 IP 192.154.198.15 > 10.8.0.2: ICMP echo reply, id 780, seq 5, length 64
07:52:31.343903 IP 10.8.0.2 > 192.154.198.15: ICMP echo request, id 780, seq 6, length 64
07:52:31.774314 IP 192.154.198.15 > 10.8.0.2: ICMP echo reply, id 780, seq 6, length 64
07:52:32.345129 IP 10.8.0.2 > 192.154.198.15: ICMP echo request, id 780, seq 7, length 64
07:52:32.776548 IP 192.154.198.15 > 10.8.0.2: ICMP echo reply, id 780, seq 7, length 64
07:52:33.346165 IP 10.8.0.2 > 192.154.198.15: ICMP echo request, id 780, seq 8, length 64
07:52:33.777177 IP 192.154.198.15 > 10.8.0.2: ICMP echo reply, id 780, seq 8, length 64
07:52:34.346988 IP 10.8.0.2 > 192.154.198.15: ICMP echo request, id 780, seq 9, length 64
07:52:34.773188 IP 192.154.198.15 > 10.8.0.2: ICMP echo reply, id 780, seq 9, length 64
07:52:35.348004 IP 10.8.0.2 > 192.154.198.15: ICMP echo request, id 780, seq 10, length 64
07:52:35.776193 IP 192.154.198.15 > 10.8.0.2: ICMP echo reply, id 780, seq 10, length 64
07:52:36.349013 IP 10.8.0.2 > 192.154.198.15: ICMP echo request, id 780, seq 11, length 64
07:52:36.775815 IP 192.154.198.15 > 10.8.0.2: ICMP echo reply, id 780, seq 11, length 64
07:52:37.350642 IP 10.8.0.2 > 192.154.198.15: ICMP echo request, id 780, seq 12, length 64
07:52:37.777293 IP 192.154.198.15 > 10.8.0.2: ICMP echo reply, id 780, seq 12, length 64
07:52:38.352112 IP 10.8.0.2 > 192.154.198.15: ICMP echo request, id 780, seq 13, length 64
07:52:38.779656 IP 192.154.198.15 > 10.8.0.2: ICMP echo reply, id 780, seq 13, length 64
07:52:39.353478 IP 10.8.0.2 > 192.154.198.15: ICMP echo request, id 780, seq 14, length 64
07:52:39.780250 IP 192.154.198.15 > 10.8.0.2: ICMP echo reply, id 780, seq 14, length 64
07:52:40.355071 IP 10.8.0.2 > 192.154.198.15: ICMP echo request, id 780, seq 15, length 64
07:52:40.782049 IP 192.154.198.15 > 10.8.0.2: ICMP echo reply, id 780, seq 15, length 64
07:52:41.355864 IP 10.8.0.2 > 192.154.198.15: ICMP echo request, id 780, seq 16, length 64
07:52:41.782318 IP 192.154.198.15 > 10.8.0.2: ICMP echo reply, id 780, seq 16, length 64
07:52:42.357138 IP 10.8.0.2 > 192.154.198.15: ICMP echo request, id 780, seq 17, length 64
07:52:42.783675 IP 192.154.198.15 > 10.8.0.2: ICMP echo reply, id 780, seq 17, length 64
07:52:43.358495 IP 10.8.0.2 > 192.154.198.15: ICMP echo request, id 780, seq 18, length 64
07:52:43.785111 IP 192.154.198.15 > 10.8.0.2: ICMP echo reply, id 780, seq 18, length 64
07:52:44.359928 IP 10.8.0.2 > 192.154.198.15: ICMP echo request, id 780, seq 19, length 64
07:52:44.786156 IP 192.154.198.15 > 10.8.0.2: ICMP echo reply, id 780, seq 19, length 64
07:52:45.360976 IP 10.8.0.2 > 192.154.198.15: ICMP echo request, id 780, seq 20, length 64
07:52:45.788350 IP 192.154.198.15 > 10.8.0.2: ICMP echo reply, id 780, seq 20, length 64
07:52:46.362172 IP 10.8.0.2 > 192.154.198.15: ICMP echo request, id 780, seq 21, length 64
07:52:47.390203 IP 10.8.0.2 > 192.154.198.15: ICMP echo request, id 780, seq 22, length 64
07:52:47.817443 IP 192.154.198.15 > 10.8.0.2: ICMP echo reply, id 780, seq 22, length 64
07:52:48.391258 IP 10.8.0.2 > 192.154.198.15: ICMP echo request, id 780, seq 23, length 64
07:52:49.406199 IP 10.8.0.2 > 192.154.198.15: ICMP echo request, id 780, seq 24, length 64
07:52:49.838036 IP 192.154.198.15 > 10.8.0.2: ICMP echo reply, id 780, seq 24, length 64
07:52:50.406850 IP 10.8.0.2 > 192.154.198.15: ICMP echo request, id 780, seq 25, length 64
07:52:50.833420 IP 192.154.198.15 > 10.8.0.2: ICMP echo reply, id 780, seq 25, length 64
07:52:51.408237 IP 10.8.0.2 > 192.154.198.15: ICMP echo request, id 780, seq 26, length 64
07:52:51.834750 IP 192.154.198.15 > 10.8.0.2: ICMP echo reply, id 780, seq 26, length 64
07:52:52.409576 IP 10.8.0.2 > 192.154.198.15: ICMP echo request, id 780, seq 27, length 64
07:52:52.836146 IP 192.154.198.15 > 10.8.0.2: ICMP echo reply, id 780, seq 27, length 64
07:52:53.410970 IP 10.8.0.2 > 192.154.198.15: ICMP echo request, id 780, seq 28, length 64
07:52:54.430200 IP 10.8.0.2 > 192.154.198.15: ICMP echo request, id 780, seq 29, length 64
07:52:54.856866 IP 192.154.198.15 > 10.8.0.2: ICMP echo reply, id 780, seq 29, length 64
07:52:55.431693 IP 10.8.0.2 > 192.154.198.15: ICMP echo request, id 780, seq 30, length 64
07:52:55.858671 IP 192.154.198.15 > 10.8.0.2: ICMP echo reply, id 780, seq 30, length 64
07:52:56.432484 IP 10.8.0.2 > 192.154.198.15: ICMP echo request, id 780, seq 31, length 64
07:52:56.858903 IP 192.154.198.15 > 10.8.0.2: ICMP echo reply, id 780, seq 31, length 64
07:52:57.433724 IP 10.8.0.2 > 192.154.198.15: ICMP echo request, id 780, seq 32, length 64
07:52:57.860127 IP 192.154.198.15 > 10.8.0.2: ICMP echo reply, id 780, seq 32, length 64
07:52:58.434950 IP 10.8.0.2 > 192.154.198.15: ICMP echo request, id 780, seq 33, length 64
07:52:58.861756 IP 192.154.198.15 > 10.8.0.2: ICMP echo reply, id 780, seq 33, length 64
07:52:59.436578 IP 10.8.0.2 > 192.154.198.15: ICMP echo request, id 780, seq 34, length 64
07:52:59.866374 IP 192.154.198.15 > 10.8.0.2: ICMP echo reply, id 780, seq 34, length 64
07:53:00.438195 IP 10.8.0.2 > 192.154.198.15: ICMP echo request, id 780, seq 35, length 64
07:53:00.864959 IP 192.154.198.15 > 10.8.0.2: ICMP echo reply, id 780, seq 35, length 64
07:53:01.439775 IP 10.8.0.2 > 192.154.198.15: ICMP echo request, id 780, seq 36, length 64
07:53:01.869228 IP 192.154.198.15 > 10.8.0.2: ICMP echo reply, id 780, seq 36, length 64
07:53:02.441049 IP 10.8.0.2 > 192.154.198.15: ICMP echo request, id 780, seq 37, length 64
07:53:02.867391 IP 192.154.198.15 > 10.8.0.2: ICMP echo reply, id 780, seq 37, length 64
07:53:03.442210 IP 10.8.0.2 > 192.154.198.15: ICMP echo request, id 780, seq 38, length 64
07:53:03.868621 IP 192.154.198.15 > 10.8.0.2: ICMP echo reply, id 780, seq 38, length 64
07:53:04.443438 IP 10.8.0.2 > 192.154.198.15: ICMP echo request, id 780, seq 39, length 64
07:53:05.470207 IP 10.8.0.2 > 192.154.198.15: ICMP echo request, id 780, seq 40, length 64
07:53:05.897217 IP 192.154.198.15 > 10.8.0.2: ICMP echo reply, id 780, seq 40, length 64
07:53:06.471038 IP 10.8.0.2 > 192.154.198.15: ICMP echo request, id 780, seq 41, length 64
07:53:07.486219 IP 10.8.0.2 > 192.154.198.15: ICMP echo request, id 780, seq 42, length 64
07:53:07.912684 IP 192.154.198.15 > 10.8.0.2: ICMP echo reply, id 780, seq 42, length 64
07:53:08.487505 IP 10.8.0.2 > 192.154.198.15: ICMP echo request, id 780, seq 43, length 64
07:53:08.914088 IP 192.154.198.15 > 10.8.0.2: ICMP echo reply, id 780, seq 43, length 64
07:53:09.488919 IP 10.8.0.2 > 192.154.198.15: ICMP echo request, id 780, seq 44, length 64
07:53:09.915430 IP 192.154.198.15 > 10.8.0.2: ICMP echo reply, id 780, seq 44, length 64
07:53:10.490180 IP 10.8.0.2 > 192.154.198.15: ICMP echo request, id 780, seq 45, length 64
07:53:10.916605 IP 192.154.198.15 > 10.8.0.2: ICMP echo reply, id 780, seq 45, length 64
07:53:11.491432 IP 10.8.0.2 > 192.154.198.15: ICMP echo request, id 780, seq 46, length 64
07:53:12.510222 IP 10.8.0.2 > 192.154.198.15: ICMP echo request, id 780, seq 47, length 64
07:53:12.936767 IP 192.154.198.15 > 10.8.0.2: ICMP echo reply, id 780, seq 47, length 64
07:53:13.511586 IP 10.8.0.2 > 192.154.198.15: ICMP echo request, id 780, seq 48, length 64
07:53:13.938007 IP 192.154.198.15 > 10.8.0.2: ICMP echo reply, id 780, seq 48, length 64
07:53:14.512847 IP 10.8.0.2 > 192.154.198.15: ICMP echo request, id 780, seq 49, length 64
07:53:14.939011 IP 192.154.198.15 > 10.8.0.2: ICMP echo reply, id 780, seq 49, length 64
07:53:15.513834 IP 10.8.0.2 > 192.154.198.15: ICMP echo request, id 780, seq 50, length 64
07:53:15.940199 IP 192.154.198.15 > 10.8.0.2: ICMP echo reply, id 780, seq 50, length 64
07:53:16.515021 IP 10.8.0.2 > 192.154.198.15: ICMP echo request, id 780, seq 51, length 64
