13:42:30.459586 IP 10.8.0.2 > 103.107.198.131: ICMP echo request, id 2084, seq 1, length 64
13:42:31.486215 IP 10.8.0.2 > 103.107.198.131: ICMP echo request, id 2084, seq 2, length 64
13:42:32.277260 IP 103.107.198.131 > 10.8.0.2: ICMP echo reply, id 2084, seq 2, length 64
13:42:33.707502 IP 10.8.0.2 > 103.107.198.131: ICMP echo request, id 2084, seq 3, length 64
13:42:34.481217 IP 103.107.198.131 > 10.8.0.2: ICMP echo reply, id 2084, seq 3, length 64
13:42:34.707676 IP 10.8.0.2 > 103.107.198.131: ICMP echo request, id 2084, seq 4, length 64
13:42:35.417837 IP 103.107.198.131 > 10.8.0.2: ICMP echo reply, id 2084, seq 4, length 64
13:42:35.707368 IP 10.8.0.2 > 103.107.198.131: ICMP echo request, id 2084, seq 5, length 64
13:42:36.734203 IP 10.8.0.2 > 103.107.198.131: ICMP echo request, id 2084, seq 6, length 64
13:42:37.499166 IP 103.107.198.131 > 10.8.0.2: ICMP echo reply, id 2084, seq 6, length 64
13:42:37.733659 IP 10.8.0.2 > 103.107.198.131: ICMP echo request, id 2084, seq 7, length 64
13:42:38.513860 IP 103.107.198.131 > 10.8.0.2: ICMP echo reply, id 2084, seq 7, length 64
13:42:38.733325 IP 10.8.0.2 > 103.107.198.131: ICMP echo request, id 2084, seq 8, length 64
13:42:39.499151 IP 103.107.198.131 > 10.8.0.2: ICMP echo reply, id 2084, seq 8, length 64
13:42:39.733614 IP 10.8.0.2 > 103.107.198.131: ICMP echo request, id 2084, seq 9, length 64
13:42:40.484717 IP 103.107.198.131 > 10.8.0.2: ICMP echo reply, id 2084, seq 9, length 64
13:42:40.733187 IP 10.8.0.2 > 103.107.198.131: ICMP echo request, id 2084, seq 10, length 64
13:42:41.521184 IP 103.107.198.131 > 10.8.0.2: ICMP echo reply, id 2084, seq 10, length 64
13:42:41.732618 IP 10.8.0.2 > 103.107.198.131: ICMP echo request, id 2084, seq 11, length 64
13:42:42.442573 IP 103.107.198.131 > 10.8.0.2: ICMP echo reply, id 2084, seq 11, length 64
13:42:42.732087 IP 10.8.0.2 > 103.107.198.131: ICMP echo request, id 2084, seq 12, length 64
13:42:43.441943 IP 103.107.198.131 > 10.8.0.2: ICMP echo reply, id 2084, seq 12, length 64
13:42:43.731457 IP 10.8.0.2 > 103.107.198.131: ICMP echo request, id 2084, seq 13, length 64
13:42:44.734196 IP 10.8.0.2 > 103.107.198.131: ICMP echo request, id 2084, seq 14, length 64
13:42:45.491121 IP 103.107.198.131 > 10.8.0.2: ICMP echo reply, id 2084, seq 14, length 64
13:42:45.733602 IP 10.8.0.2 > 103.107.198.131: ICMP echo request, id 2084, seq 15, length 64
13:42:46.488873 IP 103.107.198.131 > 10.8.0.2: ICMP echo reply, id 2084, seq 15, length 64
13:42:46.733345 IP 10.8.0.2 > 103.107.198.131: ICMP echo request, id 2084, seq 16, length 64
13:42:47.742197 IP 10.8.0.2 > 103.107.198.131: ICMP echo request, id 2084, seq 17, length 64
13:42:48.766200 IP 10.8.0.2 > 103.107.198.131: ICMP echo request, id 2084, seq 18, length 64
13:42:49.565094 IP 103.107.198.131 > 10.8.0.2: ICMP echo reply, id 2084, seq 18, length 64
13:42:49.765521 IP 10.8.0.2 > 103.107.198.131: ICMP echo request, id 2084, seq 19, length 64
13:42:50.549917 IP 103.107.198.131 > 10.8.0.2: ICMP echo reply, id 2084, seq 19, length 64
13:42:50.765376 IP 10.8.0.2 > 103.107.198.131: ICMP echo request, id 2084, seq 20, length 64
13:42:51.774217 IP 10.8.0.2 > 103.107.198.131: ICMP echo request, id 2084, seq 21, length 64
13:42:52.500567 IP 103.107.198.131 > 10.8.0.2: ICMP echo reply, id 2084, seq 21, length 64
13:42:52.774073 IP 10.8.0.2 > 103.107.198.131: ICMP echo request, id 2084, seq 22, length 64
13:42:53.484607 IP 103.107.198.131 > 10.8.0.2: ICMP echo reply, id 2084, seq 22, length 64
13:42:53.774138 IP 10.8.0.2 > 103.107.198.131: ICMP echo request, id 2084, seq 23, length 64
13:42:54.552999 IP 103.107.198.131 > 10.8.0.2: ICMP echo reply, id 2084, seq 23, length 64
13:42:54.773451 IP 10.8.0.2 > 103.107.198.131: ICMP echo request, id 2084, seq 24, length 64
13:42:55.557653 IP 103.107.198.131 > 10.8.0.2: ICMP echo reply, id 2084, seq 24, length 64
13:42:55.773092 IP 10.8.0.2 > 103.107.198.131: ICMP echo request, id 2084, seq 25, length 64
13:42:56.553271 IP 103.107.198.131 > 10.8.0.2: ICMP echo reply, id 2084, seq 25, length 64
13:42:56.772722 IP 10.8.0.2 > 103.107.198.131: ICMP echo request, id 2084, seq 26, length 64
13:42:57.525694 IP 103.107.198.131 > 10.8.0.2: ICMP echo reply, id 2084, seq 26, length 64
13:42:57.772175 IP 10.8.0.2 > 103.107.198.131: ICMP echo request, id 2084, seq 27, length 64
13:42:58.533831 IP 103.107.198.131 > 10.8.0.2: ICMP echo reply, id 2084, seq 27, length 64
13:42:58.772322 IP 10.8.0.2 > 103.107.198.131: ICMP echo request, id 2084, seq 28, length 64
13:42:59.538880 IP 103.107.198.131 > 10.8.0.2: ICMP echo reply, id 2084, seq 28, length 64
13:42:59.772350 IP 10.8.0.2 > 103.107.198.131: ICMP echo request, id 2084, seq 29, length 64
13:43:00.532698 IP 103.107.198.131 > 10.8.0.2: ICMP echo reply, id 2084, seq 29, length 64
13:43:00.772186 IP 10.8.0.2 > 103.107.198.131: ICMP echo request, id 2084, seq 30, length 64
13:43:01.529290 IP 103.107.198.131 > 10.8.0.2: ICMP echo reply, id 2084, seq 30, length 64
13:43:01.771773 IP 10.8.0.2 > 103.107.198.131: ICMP echo request, id 2084, seq 31, length 64
13:43:02.516383 IP 103.107.198.131 > 10.8.0.2: ICMP echo reply, id 2084, seq 31, length 64
13:43:02.771880 IP 10.8.0.2 > 103.107.198.131: ICMP echo request, id 2084, seq 32, length 64
13:43:03.525266 IP 103.107.198.131 > 10.8.0.2: ICMP echo reply, id 2084, seq 32, length 64
13:43:03.771757 IP 10.8.0.2 > 103.107.198.131: ICMP echo request, id 2084, seq 33, length 64
13:43:04.518578 IP 103.107.198.131 > 10.8.0.2: ICMP echo reply, id 2084, seq 33, length 64
13:43:04.772073 IP 10.8.0.2 > 103.107.198.131: ICMP echo request, id 2084, seq 34, length 64
13:43:05.526532 IP 103.107.198.131 > 10.8.0.2: ICMP echo reply, id 2084, seq 34, length 64
13:43:05.772012 IP 10.8.0.2 > 103.107.198.131: ICMP echo request, id 2084, seq 35, length 64
13:43:06.527819 IP 103.107.198.131 > 10.8.0.2: ICMP echo reply, id 2084, seq 35, length 64
13:43:06.772299 IP 10.8.0.2 > 103.107.198.131: ICMP echo request, id 2084, seq 36, length 64
13:43:07.774215 IP 10.8.0.2 > 103.107.198.131: ICMP echo request, id 2084, seq 37, length 64
13:43:08.537649 IP 103.107.198.131 > 10.8.0.2: ICMP echo reply, id 2084, seq 37, length 64
13:43:08.774139 IP 10.8.0.2 > 103.107.198.131: ICMP echo request, id 2084, seq 38, length 64
13:43:09.484274 IP 103.107.198.131 > 10.8.0.2: ICMP echo reply, id 2084, seq 38, length 64
13:43:09.773798 IP 10.8.0.2 > 103.107.198.131: ICMP echo request, id 2084, seq 39, length 64
13:43:10.512383 IP 103.107.198.131 > 10.8.0.2: ICMP echo reply, id 2084, seq 39, length 64
13:43:10.773893 IP 10.8.0.2 > 103.107.198.131: ICMP echo request, id 2084, seq 40, length 64
13:43:11.774213 IP 10.8.0.2 > 103.107.198.131: ICMP echo request, id 2084, seq 41, length 64
13:43:12.560912 IP 103.107.198.131 > 10.8.0.2: ICMP echo reply, id 2084, seq 41, length 64
13:43:12.774372 IP 10.8.0.2 > 103.107.198.131: ICMP echo request, id 2084, seq 42, length 64
13:43:13.576955 IP 103.107.198.131 > 10.8.0.2: ICMP echo reply, id 2084, seq 42, length 64
13:43:13.774386 IP 10.8.0.2 > 103.107.198.131: ICMP echo request, id 2084, seq 43, length 64
13:43:14.567785 IP 103.107.198.131 > 10.8.0.2: ICMP echo reply, id 2084, seq 43, length 64
13:43:14.774236 IP 10.8.0.2 > 103.107.198.131: ICMP echo request, id 2084, seq 44, length 64
13:43:15.806201 IP 10.8.0.2 > 103.107.198.131: ICMP echo request, id 2084, seq 45, length 64
13:43:16.539039 IP 103.107.198.131 > 10.8.0.2: ICMP echo reply, id 2084, seq 45, length 64
13:43:16.806540 IP 10.8.0.2 > 103.107.198.131: ICMP echo request, id 2084, seq 46, length 64
13:43:17.592012 IP 103.107.198.131 > 10.8.0.2: ICMP echo reply, id 2084, seq 46, length 64
13:43:17.806466 IP 10.8.0.2 > 103.107.198.131: ICMP echo request, id 2084, seq 47, length 64
13:43:18.558634 IP 103.107.198.131 > 10.8.0.2: ICMP echo reply, id 2084, seq 47, length 64
13:43:18.806133 IP 10.8.0.2 > 103.107.198.131: ICMP echo request, id 2084, seq 48, length 64
13:43:19.516230 IP 103.107.198.131 > 10.8.0.2: ICMP echo reply, id 2084, seq 48, length 64
13:43:19.805755 IP 10.8.0.2 > 103.107.198.131: ICMP echo request, id 2084, seq 49, length 64
13:43:20.515722 IP 103.107.198.131 > 10.8.0.2: ICMP echo reply, id 2084, seq 49, length 64
13:43:20.805254 IP 10.8.0.2 > 103.107.198.131: ICMP echo request, id 2084, seq 50, length 64
13:43:21.516738 IP 103.107.198.131 > 10.8.0.2: ICMP echo reply, id 2084, seq 50, length 64
13:43:21.805268 IP 10.8.0.2 > 103.107.198.131: ICMP echo request, id 2084, seq 51, length 64
13:43:22.515518 IP 103.107.198.131 > 10.8.0.2: ICMP echo reply, id 2084, seq 51, length 64
13:43:22.805043 IP 10.8.0.2 > 103.107.198.131: ICMP echo request, id 2084, seq 52, length 64
13:43:23.515296 IP 103.107.198.131 > 10.8.0.2: ICMP echo reply, id 2084, seq 52, length 64
13:43:23.804821 IP 10.8.0.2 > 103.107.198.131: ICMP echo request, id 2084, seq 53, length 64
13:43:24.515935 IP 103.107.198.131 > 10.8.0.2: ICMP echo reply, id 2084, seq 53, length 64
13:43:24.804457 IP 10.8.0.2 > 103.107.198.131: ICMP echo request, id 2084, seq 54, length 64
13:43:25.515728 IP 103.107.198.131 > 10.8.0.2: ICMP echo reply, id 2084, seq 54, length 64
13:43:25.804250 IP 10.8.0.2 > 103.107.198.131: ICMP echo request, id 2084, seq 55, length 64
13:43:26.514679 IP 103.107.198.131 > 10.8.0.2: ICMP echo reply, id 2084, seq 55, length 64
13:43:26.804192 IP 10.8.0.2 > 103.107.198.131: ICMP echo request, id 2084, seq 56, length 64
13:43:27.806207 IP 10.8.0.2 > 103.107.198.131: ICMP echo request, id 2084, seq 57, length 64
13:43:28.830204 IP 10.8.0.2 > 103.107.198.131: ICMP echo request, id 2084, seq 58, length 64
