04:44:09.090465 IP 10.8.2.3 > 107.150.94.35: ICMP echo request, id 74, seq 2, length 64
04:44:09.391307 IP 107.150.94.35 > 10.8.2.3: ICMP echo reply, id 74, seq 2, length 64
04:44:10.092235 IP 10.8.2.3 > 107.150.94.35: ICMP echo request, id 74, seq 3, length 64
04:44:10.396672 IP 107.150.94.35 > 10.8.2.3: ICMP echo reply, id 74, seq 3, length 64
04:44:11.093630 IP 10.8.2.3 > 107.150.94.35: ICMP echo request, id 74, seq 4, length 64
04:44:11.393530 IP 107.150.94.35 > 10.8.2.3: ICMP echo reply, id 74, seq 4, length 64
04:44:12.094467 IP 10.8.2.3 > 107.150.94.35: ICMP echo request, id 74, seq 5, length 64
04:44:12.403501 IP 107.150.94.35 > 10.8.2.3: ICMP echo reply, id 74, seq 5, length 64
04:44:13.095431 IP 10.8.2.3 > 107.150.94.35: ICMP echo request, id 74, seq 6, length 64
04:44:13.426291 IP 107.150.94.35 > 10.8.2.3: ICMP echo reply, id 74, seq 6, length 64
04:44:14.096215 IP 10.8.2.3 > 107.150.94.35: ICMP echo request, id 74, seq 7, length 64
04:44:14.396285 IP 107.150.94.35 > 10.8.2.3: ICMP echo reply, id 74, seq 7, length 64
04:44:15.097225 IP 10.8.2.3 > 107.150.94.35: ICMP echo request, id 74, seq 8, length 64
04:44:15.402656 IP 107.150.94.35 > 10.8.2.3: ICMP echo reply, id 74, seq 8, length 64
04:44:16.098591 IP 10.8.2.3 > 107.150.94.35: ICMP echo request, id 74, seq 9, length 64
04:44:16.412270 IP 107.150.94.35 > 10.8.2.3: ICMP echo reply, id 74, seq 9, length 64
04:44:17.100201 IP 10.8.2.3 > 107.150.94.35: ICMP echo request, id 74, seq 10, length 64
04:44:17.400843 IP 107.150.94.35 > 10.8.2.3: ICMP echo reply, id 74, seq 10, length 64
04:44:18.101779 IP 10.8.2.3 > 107.150.94.35: ICMP echo request, id 74, seq 11, length 64
04:44:18.404846 IP 107.150.94.35 > 10.8.2.3: ICMP echo reply, id 74, seq 11, length 64
04:44:19.102782 IP 10.8.2.3 > 107.150.94.35: ICMP echo request, id 74, seq 12, length 64
04:44:19.403557 IP 107.150.94.35 > 10.8.2.3: ICMP echo reply, id 74, seq 12, length 64
04:44:20.104496 IP 10.8.2.3 > 107.150.94.35: ICMP echo request, id 74, seq 13, length 64
04:44:20.407536 IP 107.150.94.35 > 10.8.2.3: ICMP echo reply, id 74, seq 13, length 64
04:44:21.105473 IP 10.8.2.3 > 107.150.94.35: ICMP echo request, id 74, seq 14, length 64
04:44:21.437797 IP 107.150.94.35 > 10.8.2.3: ICMP echo reply, id 74, seq 14, length 64
04:44:22.106702 IP 10.8.2.3 > 107.150.94.35: ICMP echo request, id 74, seq 15, length 64
04:44:22.406419 IP 107.150.94.35 > 10.8.2.3: ICMP echo reply, id 74, seq 15, length 64
04:44:23.108361 IP 10.8.2.3 > 107.150.94.35: ICMP echo request, id 74, seq 16, length 64
04:44:23.408439 IP 107.150.94.35 > 10.8.2.3: ICMP echo reply, id 74, seq 16, length 64
04:44:24.109376 IP 10.8.2.3 > 107.150.94.35: ICMP echo request, id 74, seq 17, length 64
04:44:24.430238 IP 107.150.94.35 > 10.8.2.3: ICMP echo reply, id 74, seq 17, length 64
04:44:25.110193 IP 10.8.2.3 > 107.150.94.35: ICMP echo request, id 74, seq 18, length 64
04:44:25.415797 IP 107.150.94.35 > 10.8.2.3: ICMP echo reply, id 74, seq 18, length 64
04:44:26.111743 IP 10.8.2.3 > 107.150.94.35: ICMP echo request, id 74, seq 19, length 64
04:44:26.411735 IP 107.150.94.35 > 10.8.2.3: ICMP echo reply, id 74, seq 19, length 64
04:44:27.112675 IP 10.8.2.3 > 107.150.94.35: ICMP echo request, id 74, seq 20, length 64
04:44:27.416740 IP 107.150.94.35 > 10.8.2.3: ICMP echo reply, id 74, seq 20, length 64
04:44:28.113645 IP 10.8.2.3 > 107.150.94.35: ICMP echo request, id 74, seq 21, length 64
04:44:28.413449 IP 107.150.94.35 > 10.8.2.3: ICMP echo reply, id 74, seq 21, length 64
04:44:29.115407 IP 10.8.2.3 > 107.150.94.35: ICMP echo request, id 74, seq 22, length 64
04:44:29.424923 IP 107.150.94.35 > 10.8.2.3: ICMP echo reply, id 74, seq 22, length 64
04:44:30.116860 IP 10.8.2.3 > 107.150.94.35: ICMP echo request, id 74, seq 23, length 64
04:44:30.426990 IP 107.150.94.35 > 10.8.2.3: ICMP echo reply, id 74, seq 23, length 64
04:44:31.117934 IP 10.8.2.3 > 107.150.94.35: ICMP echo request, id 74, seq 24, length 64
04:44:31.427967 IP 107.150.94.35 > 10.8.2.3: ICMP echo reply, id 74, seq 24, length 64
04:44:32.118914 IP 10.8.2.3 > 107.150.94.35: ICMP echo request, id 74, seq 25, length 64
04:44:32.419319 IP 107.150.94.35 > 10.8.2.3: ICMP echo reply, id 74, seq 25, length 64
04:44:33.120268 IP 10.8.2.3 > 107.150.94.35: ICMP echo request, id 74, seq 26, length 64
04:44:33.421343 IP 107.150.94.35 > 10.8.2.3: ICMP echo reply, id 74, seq 26, length 64
04:44:34.121303 IP 10.8.2.3 > 107.150.94.35: ICMP echo request, id 74, seq 27, length 64
04:44:34.432737 IP 107.150.94.35 > 10.8.2.3: ICMP echo reply, id 74, seq 27, length 64
04:44:35.122238 IP 10.8.2.3 > 107.150.94.35: ICMP echo request, id 74, seq 28, length 64
04:44:35.423156 IP 107.150.94.35 > 10.8.2.3: ICMP echo reply, id 74, seq 28, length 64
04:44:36.123119 IP 10.8.2.3 > 107.150.94.35: ICMP echo request, id 74, seq 29, length 64
04:44:36.425531 IP 107.150.94.35 > 10.8.2.3: ICMP echo reply, id 74, seq 29, length 64
04:44:37.124481 IP 10.8.2.3 > 107.150.94.35: ICMP echo request, id 74, seq 30, length 64
04:44:37.424345 IP 107.150.94.35 > 10.8.2.3: ICMP echo reply, id 74, seq 30, length 64
04:44:38.125291 IP 10.8.2.3 > 107.150.94.35: ICMP echo request, id 74, seq 31, length 64
04:44:38.433124 IP 107.150.94.35 > 10.8.2.3: ICMP echo reply, id 74, seq 31, length 64
04:44:39.126065 IP 10.8.2.3 > 107.150.94.35: ICMP echo request, id 74, seq 32, length 64
04:44:39.460511 IP 107.150.94.35 > 10.8.2.3: ICMP echo reply, id 74, seq 32, length 64
04:44:40.127428 IP 10.8.2.3 > 107.150.94.35: ICMP echo request, id 74, seq 33, length 64
04:44:40.446310 IP 107.150.94.35 > 10.8.2.3: ICMP echo reply, id 74, seq 33, length 64
04:44:41.128243 IP 10.8.2.3 > 107.150.94.35: ICMP echo request, id 74, seq 34, length 64
04:44:41.436749 IP 107.150.94.35 > 10.8.2.3: ICMP echo reply, id 74, seq 34, length 64
04:44:42.129695 IP 10.8.2.3 > 107.150.94.35: ICMP echo request, id 74, seq 35, length 64
04:44:42.433780 IP 107.150.94.35 > 10.8.2.3: ICMP echo reply, id 74, seq 35, length 64
04:44:43.130230 IP 10.8.2.3 > 107.150.94.35: ICMP echo request, id 74, seq 36, length 64
04:44:43.439904 IP 107.150.94.35 > 10.8.2.3: ICMP echo reply, id 74, seq 36, length 64
04:44:44.131844 IP 10.8.2.3 > 107.150.94.35: ICMP echo request, id 74, seq 37, length 64
04:44:44.431898 IP 107.150.94.35 > 10.8.2.3: ICMP echo reply, id 74, seq 37, length 64
04:44:45.132849 IP 10.8.2.3 > 107.150.94.35: ICMP echo request, id 74, seq 38, length 64
04:44:45.441856 IP 107.150.94.35 > 10.8.2.3: ICMP echo reply, id 74, seq 38, length 64
04:44:46.133812 IP 10.8.2.3 > 107.150.94.35: ICMP echo request, id 74, seq 39, length 64
04:44:46.434090 IP 107.150.94.35 > 10.8.2.3: ICMP echo reply, id 74, seq 39, length 64
04:44:47.135051 IP 10.8.2.3 > 107.150.94.35: ICMP echo request, id 74, seq 40, length 64
04:44:47.441130 IP 107.150.94.35 > 10.8.2.3: ICMP echo reply, id 74, seq 40, length 64
04:44:48.136087 IP 10.8.2.3 > 107.150.94.35: ICMP echo request, id 74, seq 41, length 64
04:44:48.437107 IP 107.150.94.35 > 10.8.2.3: ICMP echo reply, id 74, seq 41, length 64
04:44:49.137057 IP 10.8.2.3 > 107.150.94.35: ICMP echo request, id 74, seq 42, length 64
04:44:49.438536 IP 107.150.94.35 > 10.8.2.3: ICMP echo reply, id 74, seq 42, length 64
04:44:50.138229 IP 10.8.2.3 > 107.150.94.35: ICMP echo request, id 74, seq 43, length 64
04:44:50.447262 IP 107.150.94.35 > 10.8.2.3: ICMP echo reply, id 74, seq 43, length 64
04:44:51.139206 IP 10.8.2.3 > 107.150.94.35: ICMP echo request, id 74, seq 44, length 64
04:44:51.440131 IP 107.150.94.35 > 10.8.2.3: ICMP echo reply, id 74, seq 44, length 64
04:44:52.140075 IP 10.8.2.3 > 107.150.94.35: ICMP echo request, id 74, seq 45, length 64
04:44:52.440168 IP 107.150.94.35 > 10.8.2.3: ICMP echo reply, id 74, seq 45, length 64
04:44:53.141118 IP 10.8.2.3 > 107.150.94.35: ICMP echo request, id 74, seq 46, length 64
04:44:53.445912 IP 107.150.94.35 > 10.8.2.3: ICMP echo reply, id 74, seq 46, length 64
04:44:54.142861 IP 10.8.2.3 > 107.150.94.35: ICMP echo request, id 74, seq 47, length 64
04:44:54.445635 IP 107.150.94.35 > 10.8.2.3: ICMP echo reply, id 74, seq 47, length 64
04:44:55.144580 IP 10.8.2.3 > 107.150.94.35: ICMP echo request, id 74, seq 48, length 64
04:44:55.462119 IP 107.150.94.35 > 10.8.2.3: ICMP echo reply, id 74, seq 48, length 64
04:44:56.146053 IP 10.8.2.3 > 107.150.94.35: ICMP echo request, id 74, seq 49, length 64
04:44:56.453904 IP 107.150.94.35 > 10.8.2.3: ICMP echo reply, id 74, seq 49, length 64
04:44:57.146868 IP 10.8.2.3 > 107.150.94.35: ICMP echo request, id 74, seq 50, length 64
04:44:57.485681 IP 107.150.94.35 > 10.8.2.3: ICMP echo reply, id 74, seq 50, length 64
04:44:58.147603 IP 10.8.2.3 > 107.150.94.35: ICMP echo request, id 74, seq 51, length 64
04:44:58.456750 IP 107.150.94.35 > 10.8.2.3: ICMP echo reply, id 74, seq 51, length 64
04:44:59.148701 IP 10.8.2.3 > 107.150.94.35: ICMP echo request, id 74, seq 52, length 64
04:44:59.467711 IP 107.150.94.35 > 10.8.2.3: ICMP echo reply, id 74, seq 52, length 64
04:45:00.149645 IP 10.8.2.3 > 107.150.94.35: ICMP echo request, id 74, seq 53, length 64
04:45:00.449284 IP 107.150.94.35 > 10.8.2.3: ICMP echo reply, id 74, seq 53, length 64
04:45:01.151237 IP 10.8.2.3 > 107.150.94.35: ICMP echo request, id 74, seq 54, length 64
04:45:01.451927 IP 107.150.94.35 > 10.8.2.3: ICMP echo reply, id 74, seq 54, length 64
04:45:02.152875 IP 10.8.2.3 > 107.150.94.35: ICMP echo request, id 74, seq 55, length 64
04:45:02.466143 IP 107.150.94.35 > 10.8.2.3: ICMP echo reply, id 74, seq 55, length 64
04:45:03.154050 IP 10.8.2.3 > 107.150.94.35: ICMP echo request, id 74, seq 56, length 64
04:45:03.454904 IP 107.150.94.35 > 10.8.2.3: ICMP echo reply, id 74, seq 56, length 64
04:45:04.154240 IP 10.8.2.3 > 107.150.94.35: ICMP echo request, id 74, seq 57, length 64
04:45:04.477786 IP 107.150.94.35 > 10.8.2.3: ICMP echo reply, id 74, seq 57, length 64
04:45:05.155679 IP 10.8.2.3 > 107.150.94.35: ICMP echo request, id 74, seq 58, length 64
04:45:05.470420 IP 107.150.94.35 > 10.8.2.3: ICMP echo reply, id 74, seq 58, length 64
04:45:06.157353 IP 10.8.2.3 > 107.150.94.35: ICMP echo request, id 74, seq 59, length 64
04:45:06.458888 IP 107.150.94.35 > 10.8.2.3: ICMP echo reply, id 74, seq 59, length 64
04:45:07.158840 IP 10.8.2.3 > 107.150.94.35: ICMP echo request, id 74, seq 60, length 64
04:45:07.460699 IP 107.150.94.35 > 10.8.2.3: ICMP echo reply, id 74, seq 60, length 64
04:45:08.159645 IP 10.8.2.3 > 107.150.94.35: ICMP echo request, id 74, seq 61, length 64
