23:16:50.315369 IP 10.8.0.87 > 185.106.102.201: ICMP echo request, id 1164, seq 1, length 64
23:16:50.660816 IP 185.106.102.201 > 10.8.0.87: ICMP echo reply, id 1164, seq 1, length 64
23:16:51.315271 IP 10.8.0.87 > 185.106.102.201: ICMP echo request, id 1164, seq 2, length 64
23:16:51.663355 IP 185.106.102.201 > 10.8.0.87: ICMP echo reply, id 1164, seq 2, length 64
23:16:52.316271 IP 10.8.0.87 > 185.106.102.201: ICMP echo request, id 1164, seq 3, length 64
23:16:52.658973 IP 185.106.102.201 > 10.8.0.87: ICMP echo reply, id 1164, seq 3, length 64
23:16:53.317864 IP 10.8.0.87 > 185.106.102.201: ICMP echo request, id 1164, seq 4, length 64
23:16:53.662177 IP 185.106.102.201 > 10.8.0.87: ICMP echo reply, id 1164, seq 4, length 64
23:16:54.319068 IP 10.8.0.87 > 185.106.102.201: ICMP echo request, id 1164, seq 5, length 64
23:16:55.324220 IP 10.8.0.87 > 185.106.102.201: ICMP echo request, id 1164, seq 6, length 64
23:16:56.348199 IP 10.8.0.87 > 185.106.102.201: ICMP echo request, id 1164, seq 7, length 64
23:16:56.693873 IP 185.106.102.201 > 10.8.0.87: ICMP echo reply, id 1164, seq 7, length 64
23:16:57.349767 IP 10.8.0.87 > 185.106.102.201: ICMP echo request, id 1164, seq 8, length 64
23:16:57.695261 IP 185.106.102.201 > 10.8.0.87: ICMP echo reply, id 1164, seq 8, length 64
23:16:58.351148 IP 10.8.0.87 > 185.106.102.201: ICMP echo request, id 1164, seq 9, length 64
23:16:58.684310 IP 185.106.102.201 > 10.8.0.87: ICMP echo reply, id 1164, seq 9, length 64
23:16:59.352222 IP 10.8.0.87 > 185.106.102.201: ICMP echo request, id 1164, seq 10, length 64
23:16:59.700310 IP 185.106.102.201 > 10.8.0.87: ICMP echo reply, id 1164, seq 10, length 64
23:17:00.353211 IP 10.8.0.87 > 185.106.102.201: ICMP echo request, id 1164, seq 11, length 64
23:17:00.699852 IP 185.106.102.201 > 10.8.0.87: ICMP echo reply, id 1164, seq 11, length 64
23:17:01.354743 IP 10.8.0.87 > 185.106.102.201: ICMP echo request, id 1164, seq 12, length 64
23:17:02.364202 IP 10.8.0.87 > 185.106.102.201: ICMP echo request, id 1164, seq 13, length 64
23:17:02.712811 IP 185.106.102.201 > 10.8.0.87: ICMP echo reply, id 1164, seq 13, length 64
23:17:03.365692 IP 10.8.0.87 > 185.106.102.201: ICMP echo request, id 1164, seq 14, length 64
23:17:03.711244 IP 185.106.102.201 > 10.8.0.87: ICMP echo reply, id 1164, seq 14, length 64
23:17:04.367138 IP 10.8.0.87 > 185.106.102.201: ICMP echo request, id 1164, seq 15, length 64
23:17:04.714825 IP 185.106.102.201 > 10.8.0.87: ICMP echo reply, id 1164, seq 15, length 64
23:17:05.368727 IP 10.8.0.87 > 185.106.102.201: ICMP echo request, id 1164, seq 16, length 64
23:17:05.715597 IP 185.106.102.201 > 10.8.0.87: ICMP echo reply, id 1164, seq 16, length 64
23:17:06.369436 IP 10.8.0.87 > 185.106.102.201: ICMP echo request, id 1164, seq 17, length 64
23:17:06.719112 IP 185.106.102.201 > 10.8.0.87: ICMP echo reply, id 1164, seq 17, length 64
23:17:07.371003 IP 10.8.0.87 > 185.106.102.201: ICMP echo request, id 1164, seq 18, length 64
23:17:07.710894 IP 185.106.102.201 > 10.8.0.87: ICMP echo reply, id 1164, seq 18, length 64
23:17:08.371792 IP 10.8.0.87 > 185.106.102.201: ICMP echo request, id 1164, seq 19, length 64
23:17:08.718178 IP 185.106.102.201 > 10.8.0.87: ICMP echo reply, id 1164, seq 19, length 64
23:17:09.373077 IP 10.8.0.87 > 185.106.102.201: ICMP echo request, id 1164, seq 20, length 64
23:17:09.710360 IP 185.106.102.201 > 10.8.0.87: ICMP echo reply, id 1164, seq 20, length 64
23:17:10.374259 IP 10.8.0.87 > 185.106.102.201: ICMP echo request, id 1164, seq 21, length 64
23:17:10.720400 IP 185.106.102.201 > 10.8.0.87: ICMP echo reply, id 1164, seq 21, length 64
23:17:11.375306 IP 10.8.0.87 > 185.106.102.201: ICMP echo request, id 1164, seq 22, length 64
23:17:11.722215 IP 185.106.102.201 > 10.8.0.87: ICMP echo reply, id 1164, seq 22, length 64
23:17:12.376063 IP 10.8.0.87 > 185.106.102.201: ICMP echo request, id 1164, seq 23, length 64
23:17:12.724914 IP 185.106.102.201 > 10.8.0.87: ICMP echo reply, id 1164, seq 23, length 64
23:17:13.376197 IP 10.8.0.87 > 185.106.102.201: ICMP echo request, id 1164, seq 24, length 64
23:17:14.396208 IP 10.8.0.87 > 185.106.102.201: ICMP echo request, id 1164, seq 25, length 64
23:17:15.420205 IP 10.8.0.87 > 185.106.102.201: ICMP echo request, id 1164, seq 26, length 64
23:17:15.766261 IP 185.106.102.201 > 10.8.0.87: ICMP echo reply, id 1164, seq 26, length 64
23:17:16.421156 IP 10.8.0.87 > 185.106.102.201: ICMP echo request, id 1164, seq 27, length 64
23:17:16.766817 IP 185.106.102.201 > 10.8.0.87: ICMP echo reply, id 1164, seq 27, length 64
23:17:17.422709 IP 10.8.0.87 > 185.106.102.201: ICMP echo request, id 1164, seq 28, length 64
23:17:17.768122 IP 185.106.102.201 > 10.8.0.87: ICMP echo reply, id 1164, seq 28, length 64
23:17:18.424022 IP 10.8.0.87 > 185.106.102.201: ICMP echo request, id 1164, seq 29, length 64
23:17:18.774488 IP 185.106.102.201 > 10.8.0.87: ICMP echo reply, id 1164, seq 29, length 64
23:17:19.425384 IP 10.8.0.87 > 185.106.102.201: ICMP echo request, id 1164, seq 30, length 64
23:17:20.444206 IP 10.8.0.87 > 185.106.102.201: ICMP echo request, id 1164, seq 31, length 64
23:17:20.780144 IP 185.106.102.201 > 10.8.0.87: ICMP echo reply, id 1164, seq 31, length 64
23:17:21.445055 IP 10.8.0.87 > 185.106.102.201: ICMP echo request, id 1164, seq 32, length 64
23:17:21.785571 IP 185.106.102.201 > 10.8.0.87: ICMP echo reply, id 1164, seq 32, length 64
23:17:22.446471 IP 10.8.0.87 > 185.106.102.201: ICMP echo request, id 1164, seq 33, length 64
23:17:22.794047 IP 185.106.102.201 > 10.8.0.87: ICMP echo reply, id 1164, seq 33, length 64
23:17:23.447938 IP 10.8.0.87 > 185.106.102.201: ICMP echo request, id 1164, seq 34, length 64
23:17:23.795388 IP 185.106.102.201 > 10.8.0.87: ICMP echo reply, id 1164, seq 34, length 64
23:17:24.449281 IP 10.8.0.87 > 185.106.102.201: ICMP echo request, id 1164, seq 35, length 64
23:17:24.796994 IP 185.106.102.201 > 10.8.0.87: ICMP echo reply, id 1164, seq 35, length 64
23:17:25.450884 IP 10.8.0.87 > 185.106.102.201: ICMP echo request, id 1164, seq 36, length 64
23:17:25.795034 IP 185.106.102.201 > 10.8.0.87: ICMP echo reply, id 1164, seq 36, length 64
23:17:26.451929 IP 10.8.0.87 > 185.106.102.201: ICMP echo request, id 1164, seq 37, length 64
23:17:26.801849 IP 185.106.102.201 > 10.8.0.87: ICMP echo reply, id 1164, seq 37, length 64
23:17:27.452738 IP 10.8.0.87 > 185.106.102.201: ICMP echo request, id 1164, seq 38, length 64
23:17:27.889088 IP 185.106.102.201 > 10.8.0.87: ICMP echo reply, id 1164, seq 38, length 64
23:17:28.453894 IP 10.8.0.87 > 185.106.102.201: ICMP echo request, id 1164, seq 39, length 64
23:17:29.468202 IP 10.8.0.87 > 185.106.102.201: ICMP echo request, id 1164, seq 40, length 64
23:17:29.800500 IP 185.106.102.201 > 10.8.0.87: ICMP echo reply, id 1164, seq 40, length 64
23:17:30.469407 IP 10.8.0.87 > 185.106.102.201: ICMP echo request, id 1164, seq 41, length 64
23:17:30.823538 IP 185.106.102.201 > 10.8.0.87: ICMP echo reply, id 1164, seq 41, length 64
23:17:31.470430 IP 10.8.0.87 > 185.106.102.201: ICMP echo request, id 1164, seq 42, length 64
23:17:32.476224 IP 10.8.0.87 > 185.106.102.201: ICMP echo request, id 1164, seq 43, length 64
23:17:32.824530 IP 185.106.102.201 > 10.8.0.87: ICMP echo reply, id 1164, seq 43, length 64
23:17:33.477420 IP 10.8.0.87 > 185.106.102.201: ICMP echo request, id 1164, seq 44, length 64
23:17:33.822770 IP 185.106.102.201 > 10.8.0.87: ICMP echo reply, id 1164, seq 44, length 64
23:17:34.478666 IP 10.8.0.87 > 185.106.102.201: ICMP echo request, id 1164, seq 45, length 64
23:17:34.829406 IP 185.106.102.201 > 10.8.0.87: ICMP echo reply, id 1164, seq 45, length 64
23:17:35.480304 IP 10.8.0.87 > 185.106.102.201: ICMP echo request, id 1164, seq 46, length 64
23:17:35.828040 IP 185.106.102.201 > 10.8.0.87: ICMP echo reply, id 1164, seq 46, length 64
23:17:36.481848 IP 10.8.0.87 > 185.106.102.201: ICMP echo request, id 1164, seq 47, length 64
23:17:36.828081 IP 185.106.102.201 > 10.8.0.87: ICMP echo reply, id 1164, seq 47, length 64
23:17:37.482999 IP 10.8.0.87 > 185.106.102.201: ICMP echo request, id 1164, seq 48, length 64
23:17:37.827203 IP 185.106.102.201 > 10.8.0.87: ICMP echo reply, id 1164, seq 48, length 64
23:17:38.484116 IP 10.8.0.87 > 185.106.102.201: ICMP echo request, id 1164, seq 49, length 64
23:17:38.835639 IP 185.106.102.201 > 10.8.0.87: ICMP echo reply, id 1164, seq 49, length 64
23:17:39.485529 IP 10.8.0.87 > 185.106.102.201: ICMP echo request, id 1164, seq 50, length 64
23:17:39.828726 IP 185.106.102.201 > 10.8.0.87: ICMP echo reply, id 1164, seq 50, length 64
23:17:40.486624 IP 10.8.0.87 > 185.106.102.201: ICMP echo request, id 1164, seq 51, length 64
23:17:40.834792 IP 185.106.102.201 > 10.8.0.87: ICMP echo reply, id 1164, seq 51, length 64
23:17:41.487684 IP 10.8.0.87 > 185.106.102.201: ICMP echo request, id 1164, seq 52, length 64
23:17:41.846374 IP 185.106.102.201 > 10.8.0.87: ICMP echo reply, id 1164, seq 52, length 64
23:17:42.489260 IP 10.8.0.87 > 185.106.102.201: ICMP echo request, id 1164, seq 53, length 64
23:17:42.834804 IP 185.106.102.201 > 10.8.0.87: ICMP echo reply, id 1164, seq 53, length 64
23:17:43.490700 IP 10.8.0.87 > 185.106.102.201: ICMP echo request, id 1164, seq 54, length 64
23:17:44.512202 IP 10.8.0.87 > 185.106.102.201: ICMP echo request, id 1164, seq 55, length 64
23:17:44.862834 IP 185.106.102.201 > 10.8.0.87: ICMP echo reply, id 1164, seq 55, length 64
23:17:45.513721 IP 10.8.0.87 > 185.106.102.201: ICMP echo request, id 1164, seq 56, length 64
23:17:45.875428 IP 185.106.102.201 > 10.8.0.87: ICMP echo reply, id 1164, seq 56, length 64
23:17:46.515311 IP 10.8.0.87 > 185.106.102.201: ICMP echo request, id 1164, seq 57, length 64
23:17:46.863429 IP 185.106.102.201 > 10.8.0.87: ICMP echo reply, id 1164, seq 57, length 64
23:17:47.516285 IP 10.8.0.87 > 185.106.102.201: ICMP echo request, id 1164, seq 58, length 64
23:17:47.851147 IP 185.106.102.201 > 10.8.0.87: ICMP echo reply, id 1164, seq 58, length 64
23:17:48.517052 IP 10.8.0.87 > 185.106.102.201: ICMP echo request, id 1164, seq 59, length 64
23:17:49.532228 IP 10.8.0.87 > 185.106.102.201: ICMP echo request, id 1164, seq 60, length 64
