15:46:46.990218 IP 10.8.2.13 > 192.154.196.13: ICMP echo request, id 310, seq 1, length 64
15:46:47.412322 IP 192.154.196.13 > 10.8.2.13: ICMP echo reply, id 310, seq 1, length 64
15:46:57.415314 IP 10.8.2.13 > 192.154.196.13: ICMP echo request, id 310, seq 2, length 64
15:46:57.827801 IP 192.154.196.13 > 10.8.2.13: ICMP echo reply, id 310, seq 2, length 64
15:46:58.416613 IP 10.8.2.13 > 192.154.196.13: ICMP echo request, id 310, seq 3, length 64
15:46:58.829289 IP 192.154.196.13 > 10.8.2.13: ICMP echo reply, id 310, seq 3, length 64
15:46:59.418101 IP 10.8.2.13 > 192.154.196.13: ICMP echo request, id 310, seq 4, length 64
15:46:59.830669 IP 192.154.196.13 > 10.8.2.13: ICMP echo reply, id 310, seq 4, length 64
15:47:00.419484 IP 10.8.2.13 > 192.154.196.13: ICMP echo request, id 310, seq 5, length 64
15:47:00.833517 IP 192.154.196.13 > 10.8.2.13: ICMP echo reply, id 310, seq 5, length 64
15:47:01.420337 IP 10.8.2.13 > 192.154.196.13: ICMP echo request, id 310, seq 6, length 64
15:47:01.839313 IP 192.154.196.13 > 10.8.2.13: ICMP echo reply, id 310, seq 6, length 64
15:47:02.421126 IP 10.8.2.13 > 192.154.196.13: ICMP echo request, id 310, seq 7, length 64
15:47:02.838736 IP 192.154.196.13 > 10.8.2.13: ICMP echo reply, id 310, seq 7, length 64
15:47:03.422546 IP 10.8.2.13 > 192.154.196.13: ICMP echo request, id 310, seq 8, length 64
15:47:03.835532 IP 192.154.196.13 > 10.8.2.13: ICMP echo reply, id 310, seq 8, length 64
15:47:04.423345 IP 10.8.2.13 > 192.154.196.13: ICMP echo request, id 310, seq 9, length 64
15:47:04.836372 IP 192.154.196.13 > 10.8.2.13: ICMP echo reply, id 310, seq 9, length 64
15:47:05.424183 IP 10.8.2.13 > 192.154.196.13: ICMP echo request, id 310, seq 10, length 64
15:47:05.836795 IP 192.154.196.13 > 10.8.2.13: ICMP echo reply, id 310, seq 10, length 64
15:47:06.425606 IP 10.8.2.13 > 192.154.196.13: ICMP echo request, id 310, seq 11, length 64
15:47:06.862263 IP 192.154.196.13 > 10.8.2.13: ICMP echo reply, id 310, seq 11, length 64
15:47:07.427052 IP 10.8.2.13 > 192.154.196.13: ICMP echo request, id 310, seq 12, length 64
15:47:07.839621 IP 192.154.196.13 > 10.8.2.13: ICMP echo reply, id 310, seq 12, length 64
15:47:08.428435 IP 10.8.2.13 > 192.154.196.13: ICMP echo request, id 310, seq 13, length 64
15:47:08.841671 IP 192.154.196.13 > 10.8.2.13: ICMP echo reply, id 310, seq 13, length 64
15:47:09.429485 IP 10.8.2.13 > 192.154.196.13: ICMP echo request, id 310, seq 14, length 64
15:47:09.842480 IP 192.154.196.13 > 10.8.2.13: ICMP echo reply, id 310, seq 14, length 64
15:47:10.430289 IP 10.8.2.13 > 192.154.196.13: ICMP echo request, id 310, seq 15, length 64
15:47:10.902588 IP 192.154.196.13 > 10.8.2.13: ICMP echo reply, id 310, seq 15, length 64
15:47:11.431245 IP 10.8.2.13 > 192.154.196.13: ICMP echo request, id 310, seq 16, length 64
15:47:11.845566 IP 192.154.196.13 > 10.8.2.13: ICMP echo reply, id 310, seq 16, length 64
15:47:12.432372 IP 10.8.2.13 > 192.154.196.13: ICMP echo request, id 310, seq 17, length 64
15:47:12.844990 IP 192.154.196.13 > 10.8.2.13: ICMP echo reply, id 310, seq 17, length 64
15:47:13.433800 IP 10.8.2.13 > 192.154.196.13: ICMP echo request, id 310, seq 18, length 64
15:47:13.846790 IP 192.154.196.13 > 10.8.2.13: ICMP echo reply, id 310, seq 18, length 64
15:47:14.434605 IP 10.8.2.13 > 192.154.196.13: ICMP echo request, id 310, seq 19, length 64
15:47:14.847241 IP 192.154.196.13 > 10.8.2.13: ICMP echo reply, id 310, seq 19, length 64
15:47:15.436066 IP 10.8.2.13 > 192.154.196.13: ICMP echo request, id 310, seq 20, length 64
15:47:15.848794 IP 192.154.196.13 > 10.8.2.13: ICMP echo reply, id 310, seq 20, length 64
15:47:16.437604 IP 10.8.2.13 > 192.154.196.13: ICMP echo request, id 310, seq 21, length 64
15:47:16.850298 IP 192.154.196.13 > 10.8.2.13: ICMP echo reply, id 310, seq 21, length 64
15:47:17.439118 IP 10.8.2.13 > 192.154.196.13: ICMP echo request, id 310, seq 22, length 64
15:47:17.851776 IP 192.154.196.13 > 10.8.2.13: ICMP echo reply, id 310, seq 22, length 64
15:47:18.440585 IP 10.8.2.13 > 192.154.196.13: ICMP echo request, id 310, seq 23, length 64
15:47:18.853107 IP 192.154.196.13 > 10.8.2.13: ICMP echo reply, id 310, seq 23, length 64
15:47:19.441926 IP 10.8.2.13 > 192.154.196.13: ICMP echo request, id 310, seq 24, length 64
15:47:19.858329 IP 192.154.196.13 > 10.8.2.13: ICMP echo reply, id 310, seq 24, length 64
15:47:20.443136 IP 10.8.2.13 > 192.154.196.13: ICMP echo request, id 310, seq 25, length 64
15:47:20.856946 IP 192.154.196.13 > 10.8.2.13: ICMP echo reply, id 310, seq 25, length 64
15:47:21.444753 IP 10.8.2.13 > 192.154.196.13: ICMP echo request, id 310, seq 26, length 64
15:47:21.857967 IP 192.154.196.13 > 10.8.2.13: ICMP echo reply, id 310, seq 26, length 64
15:47:22.445777 IP 10.8.2.13 > 192.154.196.13: ICMP echo request, id 310, seq 27, length 64
15:47:22.858510 IP 192.154.196.13 > 10.8.2.13: ICMP echo reply, id 310, seq 27, length 64
15:47:23.447242 IP 10.8.2.13 > 192.154.196.13: ICMP echo request, id 310, seq 28, length 64
15:47:23.859804 IP 192.154.196.13 > 10.8.2.13: ICMP echo reply, id 310, seq 28, length 64
15:47:24.448617 IP 10.8.2.13 > 192.154.196.13: ICMP echo request, id 310, seq 29, length 64
15:47:24.861201 IP 192.154.196.13 > 10.8.2.13: ICMP echo reply, id 310, seq 29, length 64
15:47:25.450010 IP 10.8.2.13 > 192.154.196.13: ICMP echo request, id 310, seq 30, length 64
15:47:25.862991 IP 192.154.196.13 > 10.8.2.13: ICMP echo reply, id 310, seq 30, length 64
15:47:26.450798 IP 10.8.2.13 > 192.154.196.13: ICMP echo request, id 310, seq 31, length 64
15:47:26.863313 IP 192.154.196.13 > 10.8.2.13: ICMP echo reply, id 310, seq 31, length 64
15:47:27.452120 IP 10.8.2.13 > 192.154.196.13: ICMP echo request, id 310, seq 32, length 64
15:47:27.865543 IP 192.154.196.13 > 10.8.2.13: ICMP echo reply, id 310, seq 32, length 64
15:47:28.453350 IP 10.8.2.13 > 192.154.196.13: ICMP echo request, id 310, seq 33, length 64
15:47:28.866630 IP 192.154.196.13 > 10.8.2.13: ICMP echo reply, id 310, seq 33, length 64
15:47:29.454486 IP 10.8.2.13 > 192.154.196.13: ICMP echo request, id 310, seq 34, length 64
15:47:29.876596 IP 192.154.196.13 > 10.8.2.13: ICMP echo reply, id 310, seq 34, length 64
15:47:30.455404 IP 10.8.2.13 > 192.154.196.13: ICMP echo request, id 310, seq 35, length 64
15:47:30.868219 IP 192.154.196.13 > 10.8.2.13: ICMP echo reply, id 310, seq 35, length 64
15:47:31.457037 IP 10.8.2.13 > 192.154.196.13: ICMP echo request, id 310, seq 36, length 64
15:47:31.870629 IP 192.154.196.13 > 10.8.2.13: ICMP echo reply, id 310, seq 36, length 64
15:47:32.458440 IP 10.8.2.13 > 192.154.196.13: ICMP echo request, id 310, seq 37, length 64
15:47:32.874446 IP 192.154.196.13 > 10.8.2.13: ICMP echo reply, id 310, seq 37, length 64
15:47:33.459256 IP 10.8.2.13 > 192.154.196.13: ICMP echo request, id 310, seq 38, length 64
15:47:33.872224 IP 192.154.196.13 > 10.8.2.13: ICMP echo reply, id 310, seq 38, length 64
15:47:34.460042 IP 10.8.2.13 > 192.154.196.13: ICMP echo request, id 310, seq 39, length 64
15:47:34.873448 IP 192.154.196.13 > 10.8.2.13: ICMP echo reply, id 310, seq 39, length 64
15:47:35.461260 IP 10.8.2.13 > 192.154.196.13: ICMP echo request, id 310, seq 40, length 64
15:47:35.874443 IP 192.154.196.13 > 10.8.2.13: ICMP echo reply, id 310, seq 40, length 64
15:47:36.462253 IP 10.8.2.13 > 192.154.196.13: ICMP echo request, id 310, seq 41, length 64
15:47:36.875092 IP 192.154.196.13 > 10.8.2.13: ICMP echo reply, id 310, seq 41, length 64
15:47:37.462918 IP 10.8.2.13 > 192.154.196.13: ICMP echo request, id 310, seq 42, length 64
15:47:37.875529 IP 192.154.196.13 > 10.8.2.13: ICMP echo reply, id 310, seq 42, length 64
15:47:38.464342 IP 10.8.2.13 > 192.154.196.13: ICMP echo request, id 310, seq 43, length 64
15:47:38.879827 IP 192.154.196.13 > 10.8.2.13: ICMP echo reply, id 310, seq 43, length 64
15:47:39.465640 IP 10.8.2.13 > 192.154.196.13: ICMP echo request, id 310, seq 44, length 64
15:47:39.880473 IP 192.154.196.13 > 10.8.2.13: ICMP echo reply, id 310, seq 44, length 64
15:47:40.467287 IP 10.8.2.13 > 192.154.196.13: ICMP echo request, id 310, seq 45, length 64
15:47:40.880033 IP 192.154.196.13 > 10.8.2.13: ICMP echo reply, id 310, seq 45, length 64
15:47:41.468853 IP 10.8.2.13 > 192.154.196.13: ICMP echo request, id 310, seq 46, length 64
15:47:41.882082 IP 192.154.196.13 > 10.8.2.13: ICMP echo reply, id 310, seq 46, length 64
15:47:42.469890 IP 10.8.2.13 > 192.154.196.13: ICMP echo request, id 310, seq 47, length 64
15:47:42.883482 IP 192.154.196.13 > 10.8.2.13: ICMP echo reply, id 310, seq 47, length 64
15:47:43.471293 IP 10.8.2.13 > 192.154.196.13: ICMP echo request, id 310, seq 48, length 64
15:47:43.883894 IP 192.154.196.13 > 10.8.2.13: ICMP echo reply, id 310, seq 48, length 64
15:47:44.472710 IP 10.8.2.13 > 192.154.196.13: ICMP echo request, id 310, seq 49, length 64
15:47:44.886513 IP 192.154.196.13 > 10.8.2.13: ICMP echo reply, id 310, seq 49, length 64
15:47:45.474324 IP 10.8.2.13 > 192.154.196.13: ICMP echo request, id 310, seq 50, length 64
15:47:45.887317 IP 192.154.196.13 > 10.8.2.13: ICMP echo reply, id 310, seq 50, length 64
