15:40:39.506427 IP 10.8.2.13 > 37.120.209.163: ICMP echo request, id 283, seq 2, length 64
15:40:39.900253 IP 37.120.209.163 > 10.8.2.13: ICMP echo reply, id 283, seq 2, length 64
15:40:40.508095 IP 10.8.2.13 > 37.120.209.163: ICMP echo request, id 283, seq 3, length 64
15:40:40.901341 IP 37.120.209.163 > 10.8.2.13: ICMP echo reply, id 283, seq 3, length 64
15:40:41.509193 IP 10.8.2.13 > 37.120.209.163: ICMP echo request, id 283, seq 4, length 64
15:40:41.913719 IP 37.120.209.163 > 10.8.2.13: ICMP echo reply, id 283, seq 4, length 64
15:40:42.510547 IP 10.8.2.13 > 37.120.209.163: ICMP echo request, id 283, seq 5, length 64
15:40:42.903742 IP 37.120.209.163 > 10.8.2.13: ICMP echo reply, id 283, seq 5, length 64
15:40:43.511586 IP 10.8.2.13 > 37.120.209.163: ICMP echo request, id 283, seq 6, length 64
15:40:43.904737 IP 37.120.209.163 > 10.8.2.13: ICMP echo reply, id 283, seq 6, length 64
15:40:44.512597 IP 10.8.2.13 > 37.120.209.163: ICMP echo request, id 283, seq 7, length 64
15:40:44.908525 IP 37.120.209.163 > 10.8.2.13: ICMP echo reply, id 283, seq 7, length 64
15:40:45.513351 IP 10.8.2.13 > 37.120.209.163: ICMP echo request, id 283, seq 8, length 64
15:40:45.911634 IP 37.120.209.163 > 10.8.2.13: ICMP echo reply, id 283, seq 8, length 64
15:40:46.514474 IP 10.8.2.13 > 37.120.209.163: ICMP echo request, id 283, seq 9, length 64
15:40:46.912273 IP 37.120.209.163 > 10.8.2.13: ICMP echo reply, id 283, seq 9, length 64
15:40:47.516099 IP 10.8.2.13 > 37.120.209.163: ICMP echo request, id 283, seq 10, length 64
15:40:47.909254 IP 37.120.209.163 > 10.8.2.13: ICMP echo reply, id 283, seq 10, length 64
15:40:48.517097 IP 10.8.2.13 > 37.120.209.163: ICMP echo request, id 283, seq 11, length 64
15:40:48.910479 IP 37.120.209.163 > 10.8.2.13: ICMP echo reply, id 283, seq 11, length 64
15:40:49.518315 IP 10.8.2.13 > 37.120.209.163: ICMP echo request, id 283, seq 12, length 64
15:40:49.911913 IP 37.120.209.163 > 10.8.2.13: ICMP echo reply, id 283, seq 12, length 64
15:40:50.519755 IP 10.8.2.13 > 37.120.209.163: ICMP echo request, id 283, seq 13, length 64
15:40:50.915499 IP 37.120.209.163 > 10.8.2.13: ICMP echo reply, id 283, seq 13, length 64
15:40:51.521331 IP 10.8.2.13 > 37.120.209.163: ICMP echo request, id 283, seq 14, length 64
15:40:51.915000 IP 37.120.209.163 > 10.8.2.13: ICMP echo reply, id 283, seq 14, length 64
15:40:52.522835 IP 10.8.2.13 > 37.120.209.163: ICMP echo request, id 283, seq 15, length 64
15:40:52.916164 IP 37.120.209.163 > 10.8.2.13: ICMP echo reply, id 283, seq 15, length 64
15:40:53.524004 IP 10.8.2.13 > 37.120.209.163: ICMP echo request, id 283, seq 16, length 64
15:40:53.917281 IP 37.120.209.163 > 10.8.2.13: ICMP echo reply, id 283, seq 16, length 64
15:40:54.525125 IP 10.8.2.13 > 37.120.209.163: ICMP echo request, id 283, seq 17, length 64
15:40:54.920512 IP 37.120.209.163 > 10.8.2.13: ICMP echo reply, id 283, seq 17, length 64
15:40:55.526338 IP 10.8.2.13 > 37.120.209.163: ICMP echo request, id 283, seq 18, length 64
15:40:55.920084 IP 37.120.209.163 > 10.8.2.13: ICMP echo reply, id 283, seq 18, length 64
15:40:56.527934 IP 10.8.2.13 > 37.120.209.163: ICMP echo request, id 283, seq 19, length 64
15:40:56.921681 IP 37.120.209.163 > 10.8.2.13: ICMP echo reply, id 283, seq 19, length 64
15:40:57.529511 IP 10.8.2.13 > 37.120.209.163: ICMP echo request, id 283, seq 20, length 64
15:40:57.928210 IP 37.120.209.163 > 10.8.2.13: ICMP echo reply, id 283, seq 20, length 64
15:40:58.531046 IP 10.8.2.13 > 37.120.209.163: ICMP echo request, id 283, seq 21, length 64
15:40:58.925020 IP 37.120.209.163 > 10.8.2.13: ICMP echo reply, id 283, seq 21, length 64
15:40:59.531858 IP 10.8.2.13 > 37.120.209.163: ICMP echo request, id 283, seq 22, length 64
15:40:59.925358 IP 37.120.209.163 > 10.8.2.13: ICMP echo reply, id 283, seq 22, length 64
15:41:00.533201 IP 10.8.2.13 > 37.120.209.163: ICMP echo request, id 283, seq 23, length 64
15:41:00.927181 IP 37.120.209.163 > 10.8.2.13: ICMP echo reply, id 283, seq 23, length 64
15:41:01.534023 IP 10.8.2.13 > 37.120.209.163: ICMP echo request, id 283, seq 24, length 64
15:41:01.929926 IP 37.120.209.163 > 10.8.2.13: ICMP echo reply, id 283, seq 24, length 64
15:41:02.534759 IP 10.8.2.13 > 37.120.209.163: ICMP echo request, id 283, seq 25, length 64
15:41:02.928605 IP 37.120.209.163 > 10.8.2.13: ICMP echo reply, id 283, seq 25, length 64
15:41:03.535431 IP 10.8.2.13 > 37.120.209.163: ICMP echo request, id 283, seq 26, length 64
15:41:03.929232 IP 37.120.209.163 > 10.8.2.13: ICMP echo reply, id 283, seq 26, length 64
15:41:04.537081 IP 10.8.2.13 > 37.120.209.163: ICMP echo request, id 283, seq 27, length 64
15:41:04.931295 IP 37.120.209.163 > 10.8.2.13: ICMP echo reply, id 283, seq 27, length 64
15:41:05.538127 IP 10.8.2.13 > 37.120.209.163: ICMP echo request, id 283, seq 28, length 64
15:41:05.931543 IP 37.120.209.163 > 10.8.2.13: ICMP echo reply, id 283, seq 28, length 64
15:41:06.539373 IP 10.8.2.13 > 37.120.209.163: ICMP echo request, id 283, seq 29, length 64
15:41:06.933940 IP 37.120.209.163 > 10.8.2.13: ICMP echo reply, id 283, seq 29, length 64
15:41:07.540772 IP 10.8.2.13 > 37.120.209.163: ICMP echo request, id 283, seq 30, length 64
15:41:07.938540 IP 37.120.209.163 > 10.8.2.13: ICMP echo reply, id 283, seq 30, length 64
15:41:08.542369 IP 10.8.2.13 > 37.120.209.163: ICMP echo request, id 283, seq 31, length 64
15:41:08.935620 IP 37.120.209.163 > 10.8.2.13: ICMP echo reply, id 283, seq 31, length 64
15:41:09.543463 IP 10.8.2.13 > 37.120.209.163: ICMP echo request, id 283, seq 32, length 64
15:41:09.936809 IP 37.120.209.163 > 10.8.2.13: ICMP echo reply, id 283, seq 32, length 64
15:41:10.544644 IP 10.8.2.13 > 37.120.209.163: ICMP echo request, id 283, seq 33, length 64
15:41:10.937862 IP 37.120.209.163 > 10.8.2.13: ICMP echo reply, id 283, seq 33, length 64
15:41:11.545706 IP 10.8.2.13 > 37.120.209.163: ICMP echo request, id 283, seq 34, length 64
15:41:11.940372 IP 37.120.209.163 > 10.8.2.13: ICMP echo reply, id 283, seq 34, length 64
15:41:12.547228 IP 10.8.2.13 > 37.120.209.163: ICMP echo request, id 283, seq 35, length 64
15:41:12.941467 IP 37.120.209.163 > 10.8.2.13: ICMP echo reply, id 283, seq 35, length 64
15:41:13.548300 IP 10.8.2.13 > 37.120.209.163: ICMP echo request, id 283, seq 36, length 64
15:41:13.941674 IP 37.120.209.163 > 10.8.2.13: ICMP echo reply, id 283, seq 36, length 64
15:41:14.549470 IP 10.8.2.13 > 37.120.209.163: ICMP echo request, id 283, seq 37, length 64
15:41:14.942712 IP 37.120.209.163 > 10.8.2.13: ICMP echo reply, id 283, seq 37, length 64
15:41:15.550553 IP 10.8.2.13 > 37.120.209.163: ICMP echo request, id 283, seq 38, length 64
15:41:15.944108 IP 37.120.209.163 > 10.8.2.13: ICMP echo reply, id 283, seq 38, length 64
15:41:16.551889 IP 10.8.2.13 > 37.120.209.163: ICMP echo request, id 283, seq 39, length 64
15:41:16.945573 IP 37.120.209.163 > 10.8.2.13: ICMP echo reply, id 283, seq 39, length 64
15:41:17.553416 IP 10.8.2.13 > 37.120.209.163: ICMP echo request, id 283, seq 40, length 64
15:41:17.948376 IP 37.120.209.163 > 10.8.2.13: ICMP echo reply, id 283, seq 40, length 64
15:41:18.554168 IP 10.8.2.13 > 37.120.209.163: ICMP echo request, id 283, seq 41, length 64
15:41:18.958368 IP 37.120.209.163 > 10.8.2.13: ICMP echo reply, id 283, seq 41, length 64
15:41:19.555190 IP 10.8.2.13 > 37.120.209.163: ICMP echo request, id 283, seq 42, length 64
15:41:19.948459 IP 37.120.209.163 > 10.8.2.13: ICMP echo reply, id 283, seq 42, length 64
15:41:20.556291 IP 10.8.2.13 > 37.120.209.163: ICMP echo request, id 283, seq 43, length 64
15:41:20.949635 IP 37.120.209.163 > 10.8.2.13: ICMP echo reply, id 283, seq 43, length 64
15:41:21.557413 IP 10.8.2.13 > 37.120.209.163: ICMP echo request, id 283, seq 44, length 64
15:41:21.950659 IP 37.120.209.163 > 10.8.2.13: ICMP echo reply, id 283, seq 44, length 64
15:41:22.558491 IP 10.8.2.13 > 37.120.209.163: ICMP echo request, id 283, seq 45, length 64
15:41:22.951886 IP 37.120.209.163 > 10.8.2.13: ICMP echo reply, id 283, seq 45, length 64
15:41:23.559720 IP 10.8.2.13 > 37.120.209.163: ICMP echo request, id 283, seq 46, length 64
15:41:23.953508 IP 37.120.209.163 > 10.8.2.13: ICMP echo reply, id 283, seq 46, length 64
15:41:24.561342 IP 10.8.2.13 > 37.120.209.163: ICMP echo request, id 283, seq 47, length 64
15:41:24.954776 IP 37.120.209.163 > 10.8.2.13: ICMP echo reply, id 283, seq 47, length 64
15:41:25.562610 IP 10.8.2.13 > 37.120.209.163: ICMP echo request, id 283, seq 48, length 64
15:41:25.955798 IP 37.120.209.163 > 10.8.2.13: ICMP echo reply, id 283, seq 48, length 64
15:41:26.563245 IP 10.8.2.13 > 37.120.209.163: ICMP echo request, id 283, seq 49, length 64
15:41:26.956601 IP 37.120.209.163 > 10.8.2.13: ICMP echo reply, id 283, seq 49, length 64
15:41:27.564432 IP 10.8.2.13 > 37.120.209.163: ICMP echo request, id 283, seq 50, length 64
15:41:27.964481 IP 37.120.209.163 > 10.8.2.13: ICMP echo reply, id 283, seq 50, length 64
15:41:28.565313 IP 10.8.2.13 > 37.120.209.163: ICMP echo request, id 283, seq 51, length 64
15:41:28.958641 IP 37.120.209.163 > 10.8.2.13: ICMP echo reply, id 283, seq 51, length 64
15:41:29.566473 IP 10.8.2.13 > 37.120.209.163: ICMP echo request, id 283, seq 52, length 64
15:41:29.965113 IP 37.120.209.163 > 10.8.2.13: ICMP echo reply, id 283, seq 52, length 64
15:41:30.567939 IP 10.8.2.13 > 37.120.209.163: ICMP echo request, id 283, seq 53, length 64
15:41:30.961492 IP 37.120.209.163 > 10.8.2.13: ICMP echo reply, id 283, seq 53, length 64
15:41:31.569324 IP 10.8.2.13 > 37.120.209.163: ICMP echo request, id 283, seq 54, length 64
15:41:31.962674 IP 37.120.209.163 > 10.8.2.13: ICMP echo reply, id 283, seq 54, length 64
15:41:32.570505 IP 10.8.2.13 > 37.120.209.163: ICMP echo request, id 283, seq 55, length 64
15:41:32.969112 IP 37.120.209.163 > 10.8.2.13: ICMP echo reply, id 283, seq 55, length 64
15:41:33.571939 IP 10.8.2.13 > 37.120.209.163: ICMP echo request, id 283, seq 56, length 64
15:41:33.965183 IP 37.120.209.163 > 10.8.2.13: ICMP echo reply, id 283, seq 56, length 64
15:41:34.573013 IP 10.8.2.13 > 37.120.209.163: ICMP echo request, id 283, seq 57, length 64
15:41:34.970796 IP 37.120.209.163 > 10.8.2.13: ICMP echo reply, id 283, seq 57, length 64
15:41:35.574634 IP 10.8.2.13 > 37.120.209.163: ICMP echo request, id 283, seq 58, length 64
15:41:35.968071 IP 37.120.209.163 > 10.8.2.13: ICMP echo reply, id 283, seq 58, length 64
15:41:36.575900 IP 10.8.2.13 > 37.120.209.163: ICMP echo request, id 283, seq 59, length 64
15:41:36.970780 IP 37.120.209.163 > 10.8.2.13: ICMP echo reply, id 283, seq 59, length 64
15:41:37.576609 IP 10.8.2.13 > 37.120.209.163: ICMP echo request, id 283, seq 60, length 64
15:41:37.970051 IP 37.120.209.163 > 10.8.2.13: ICMP echo reply, id 283, seq 60, length 64
15:41:38.577884 IP 10.8.2.13 > 37.120.209.163: ICMP echo request, id 283, seq 61, length 64
