23:31:17.882068 IP 10.8.0.87 > 192.145.117.100: ICMP echo request, id 1218, seq 2, length 64
23:31:18.101746 IP 192.145.117.100 > 10.8.0.87: ICMP echo reply, id 1218, seq 2, length 64
23:31:18.882714 IP 10.8.0.87 > 192.145.117.100: ICMP echo request, id 1218, seq 3, length 64
23:31:19.102350 IP 192.145.117.100 > 10.8.0.87: ICMP echo reply, id 1218, seq 3, length 64
23:31:19.883354 IP 10.8.0.87 > 192.145.117.100: ICMP echo request, id 1218, seq 4, length 64
23:31:20.103192 IP 192.145.117.100 > 10.8.0.87: ICMP echo reply, id 1218, seq 4, length 64
23:31:20.884197 IP 10.8.0.87 > 192.145.117.100: ICMP echo request, id 1218, seq 5, length 64
23:31:21.103984 IP 192.145.117.100 > 10.8.0.87: ICMP echo reply, id 1218, seq 5, length 64
23:31:21.885022 IP 10.8.0.87 > 192.145.117.100: ICMP echo request, id 1218, seq 6, length 64
23:31:22.104731 IP 192.145.117.100 > 10.8.0.87: ICMP echo reply, id 1218, seq 6, length 64
23:31:22.885735 IP 10.8.0.87 > 192.145.117.100: ICMP echo request, id 1218, seq 7, length 64
23:31:23.105079 IP 192.145.117.100 > 10.8.0.87: ICMP echo reply, id 1218, seq 7, length 64
23:31:23.886083 IP 10.8.0.87 > 192.145.117.100: ICMP echo request, id 1218, seq 8, length 64
23:31:24.105655 IP 192.145.117.100 > 10.8.0.87: ICMP echo reply, id 1218, seq 8, length 64
23:31:24.886668 IP 10.8.0.87 > 192.145.117.100: ICMP echo request, id 1218, seq 9, length 64
23:31:25.106271 IP 192.145.117.100 > 10.8.0.87: ICMP echo reply, id 1218, seq 9, length 64
23:31:25.887290 IP 10.8.0.87 > 192.145.117.100: ICMP echo request, id 1218, seq 10, length 64
23:31:26.106890 IP 192.145.117.100 > 10.8.0.87: ICMP echo reply, id 1218, seq 10, length 64
23:31:26.887858 IP 10.8.0.87 > 192.145.117.100: ICMP echo request, id 1218, seq 11, length 64
23:31:27.107866 IP 192.145.117.100 > 10.8.0.87: ICMP echo reply, id 1218, seq 11, length 64
23:31:27.887887 IP 10.8.0.87 > 192.145.117.100: ICMP echo request, id 1218, seq 12, length 64
23:31:28.107889 IP 192.145.117.100 > 10.8.0.87: ICMP echo reply, id 1218, seq 12, length 64
23:31:28.887870 IP 10.8.0.87 > 192.145.117.100: ICMP echo request, id 1218, seq 13, length 64
23:31:29.107132 IP 192.145.117.100 > 10.8.0.87: ICMP echo reply, id 1218, seq 13, length 64
23:31:29.888146 IP 10.8.0.87 > 192.145.117.100: ICMP echo request, id 1218, seq 14, length 64
23:31:30.107728 IP 192.145.117.100 > 10.8.0.87: ICMP echo reply, id 1218, seq 14, length 64
23:31:30.888739 IP 10.8.0.87 > 192.145.117.100: ICMP echo request, id 1218, seq 15, length 64
23:31:31.108564 IP 192.145.117.100 > 10.8.0.87: ICMP echo reply, id 1218, seq 15, length 64
23:31:31.888594 IP 10.8.0.87 > 192.145.117.100: ICMP echo request, id 1218, seq 16, length 64
23:31:32.108532 IP 192.145.117.100 > 10.8.0.87: ICMP echo reply, id 1218, seq 16, length 64
23:31:32.888196 IP 10.8.0.87 > 192.145.117.100: ICMP echo request, id 1218, seq 17, length 64
23:31:33.107762 IP 192.145.117.100 > 10.8.0.87: ICMP echo reply, id 1218, seq 17, length 64
23:31:33.888771 IP 10.8.0.87 > 192.145.117.100: ICMP echo request, id 1218, seq 18, length 64
23:31:34.108544 IP 192.145.117.100 > 10.8.0.87: ICMP echo reply, id 1218, seq 18, length 64
23:31:34.889556 IP 10.8.0.87 > 192.145.117.100: ICMP echo request, id 1218, seq 19, length 64
23:31:35.109416 IP 192.145.117.100 > 10.8.0.87: ICMP echo reply, id 1218, seq 19, length 64
23:31:35.889423 IP 10.8.0.87 > 192.145.117.100: ICMP echo request, id 1218, seq 20, length 64
23:31:36.109416 IP 192.145.117.100 > 10.8.0.87: ICMP echo reply, id 1218, seq 20, length 64
23:31:36.889432 IP 10.8.0.87 > 192.145.117.100: ICMP echo request, id 1218, seq 21, length 64
23:31:37.109052 IP 192.145.117.100 > 10.8.0.87: ICMP echo reply, id 1218, seq 21, length 64
23:31:37.890029 IP 10.8.0.87 > 192.145.117.100: ICMP echo request, id 1218, seq 22, length 64
23:31:38.109604 IP 192.145.117.100 > 10.8.0.87: ICMP echo reply, id 1218, seq 22, length 64
23:31:38.890557 IP 10.8.0.87 > 192.145.117.100: ICMP echo request, id 1218, seq 23, length 64
23:31:39.110172 IP 192.145.117.100 > 10.8.0.87: ICMP echo reply, id 1218, seq 23, length 64
23:31:39.891180 IP 10.8.0.87 > 192.145.117.100: ICMP echo request, id 1218, seq 24, length 64
23:31:40.110597 IP 192.145.117.100 > 10.8.0.87: ICMP echo reply, id 1218, seq 24, length 64
23:31:40.891613 IP 10.8.0.87 > 192.145.117.100: ICMP echo request, id 1218, seq 25, length 64
23:31:41.111428 IP 192.145.117.100 > 10.8.0.87: ICMP echo reply, id 1218, seq 25, length 64
23:31:41.892437 IP 10.8.0.87 > 192.145.117.100: ICMP echo request, id 1218, seq 26, length 64
23:31:42.112305 IP 192.145.117.100 > 10.8.0.87: ICMP echo reply, id 1218, seq 26, length 64
23:31:42.892312 IP 10.8.0.87 > 192.145.117.100: ICMP echo request, id 1218, seq 27, length 64
23:31:43.111858 IP 192.145.117.100 > 10.8.0.87: ICMP echo reply, id 1218, seq 27, length 64
23:31:43.892838 IP 10.8.0.87 > 192.145.117.100: ICMP echo request, id 1218, seq 28, length 64
23:31:44.112317 IP 192.145.117.100 > 10.8.0.87: ICMP echo reply, id 1218, seq 28, length 64
23:31:44.893334 IP 10.8.0.87 > 192.145.117.100: ICMP echo request, id 1218, seq 29, length 64
23:31:45.113107 IP 192.145.117.100 > 10.8.0.87: ICMP echo reply, id 1218, seq 29, length 64
23:31:45.894115 IP 10.8.0.87 > 192.145.117.100: ICMP echo request, id 1218, seq 30, length 64
23:31:46.114132 IP 192.145.117.100 > 10.8.0.87: ICMP echo reply, id 1218, seq 30, length 64
23:31:46.894149 IP 10.8.0.87 > 192.145.117.100: ICMP echo request, id 1218, seq 31, length 64
23:31:47.113908 IP 192.145.117.100 > 10.8.0.87: ICMP echo reply, id 1218, seq 31, length 64
23:31:47.894921 IP 10.8.0.87 > 192.145.117.100: ICMP echo request, id 1218, seq 32, length 64
23:31:48.114764 IP 192.145.117.100 > 10.8.0.87: ICMP echo reply, id 1218, seq 32, length 64
23:31:48.894778 IP 10.8.0.87 > 192.145.117.100: ICMP echo request, id 1218, seq 33, length 64
23:31:49.114601 IP 192.145.117.100 > 10.8.0.87: ICMP echo reply, id 1218, seq 33, length 64
23:31:49.895611 IP 10.8.0.87 > 192.145.117.100: ICMP echo request, id 1218, seq 34, length 64
23:31:50.115009 IP 192.145.117.100 > 10.8.0.87: ICMP echo reply, id 1218, seq 34, length 64
23:31:50.896024 IP 10.8.0.87 > 192.145.117.100: ICMP echo request, id 1218, seq 35, length 64
23:31:51.115867 IP 192.145.117.100 > 10.8.0.87: ICMP echo reply, id 1218, seq 35, length 64
23:31:51.895883 IP 10.8.0.87 > 192.145.117.100: ICMP echo request, id 1218, seq 36, length 64
23:31:52.115433 IP 192.145.117.100 > 10.8.0.87: ICMP echo reply, id 1218, seq 36, length 64
23:31:52.896438 IP 10.8.0.87 > 192.145.117.100: ICMP echo request, id 1218, seq 37, length 64
23:31:53.116046 IP 192.145.117.100 > 10.8.0.87: ICMP echo reply, id 1218, seq 37, length 64
23:31:53.897080 IP 10.8.0.87 > 192.145.117.100: ICMP echo request, id 1218, seq 38, length 64
23:31:54.116849 IP 192.145.117.100 > 10.8.0.87: ICMP echo reply, id 1218, seq 38, length 64
23:31:54.897870 IP 10.8.0.87 > 192.145.117.100: ICMP echo request, id 1218, seq 39, length 64
23:31:55.117470 IP 192.145.117.100 > 10.8.0.87: ICMP echo reply, id 1218, seq 39, length 64
23:31:55.898478 IP 10.8.0.87 > 192.145.117.100: ICMP echo request, id 1218, seq 40, length 64
23:31:56.118273 IP 192.145.117.100 > 10.8.0.87: ICMP echo reply, id 1218, seq 40, length 64
23:31:56.899288 IP 10.8.0.87 > 192.145.117.100: ICMP echo request, id 1218, seq 41, length 64
23:31:57.119041 IP 192.145.117.100 > 10.8.0.87: ICMP echo reply, id 1218, seq 41, length 64
23:31:57.900082 IP 10.8.0.87 > 192.145.117.100: ICMP echo request, id 1218, seq 42, length 64
23:31:58.119691 IP 192.145.117.100 > 10.8.0.87: ICMP echo reply, id 1218, seq 42, length 64
23:31:58.900724 IP 10.8.0.87 > 192.145.117.100: ICMP echo request, id 1218, seq 43, length 64
23:31:59.121756 IP 192.145.117.100 > 10.8.0.87: ICMP echo reply, id 1218, seq 43, length 64
23:31:59.900773 IP 10.8.0.87 > 192.145.117.100: ICMP echo request, id 1218, seq 44, length 64
23:32:00.124365 IP 192.145.117.100 > 10.8.0.87: ICMP echo reply, id 1218, seq 44, length 64
23:32:00.901383 IP 10.8.0.87 > 192.145.117.100: ICMP echo request, id 1218, seq 45, length 64
23:32:01.121776 IP 192.145.117.100 > 10.8.0.87: ICMP echo reply, id 1218, seq 45, length 64
23:32:01.901794 IP 10.8.0.87 > 192.145.117.100: ICMP echo request, id 1218, seq 46, length 64
23:32:02.121548 IP 192.145.117.100 > 10.8.0.87: ICMP echo reply, id 1218, seq 46, length 64
23:32:02.902565 IP 10.8.0.87 > 192.145.117.100: ICMP echo request, id 1218, seq 47, length 64
23:32:03.122144 IP 192.145.117.100 > 10.8.0.87: ICMP echo reply, id 1218, seq 47, length 64
23:32:03.903161 IP 10.8.0.87 > 192.145.117.100: ICMP echo request, id 1218, seq 48, length 64
23:32:04.123022 IP 192.145.117.100 > 10.8.0.87: ICMP echo reply, id 1218, seq 48, length 64
23:32:04.903023 IP 10.8.0.87 > 192.145.117.100: ICMP echo request, id 1218, seq 49, length 64
23:32:05.122854 IP 192.145.117.100 > 10.8.0.87: ICMP echo reply, id 1218, seq 49, length 64
23:32:05.903870 IP 10.8.0.87 > 192.145.117.100: ICMP echo request, id 1218, seq 50, length 64
23:32:06.123826 IP 192.145.117.100 > 10.8.0.87: ICMP echo reply, id 1218, seq 50, length 64
23:32:06.903833 IP 10.8.0.87 > 192.145.117.100: ICMP echo request, id 1218, seq 51, length 64
23:32:07.123569 IP 192.145.117.100 > 10.8.0.87: ICMP echo reply, id 1218, seq 51, length 64
23:32:07.904580 IP 10.8.0.87 > 192.145.117.100: ICMP echo request, id 1218, seq 52, length 64
23:32:08.124248 IP 192.145.117.100 > 10.8.0.87: ICMP echo reply, id 1218, seq 52, length 64
23:32:08.905262 IP 10.8.0.87 > 192.145.117.100: ICMP echo request, id 1218, seq 53, length 64
23:32:09.124874 IP 192.145.117.100 > 10.8.0.87: ICMP echo reply, id 1218, seq 53, length 64
23:32:09.905887 IP 10.8.0.87 > 192.145.117.100: ICMP echo request, id 1218, seq 54, length 64
23:32:10.125470 IP 192.145.117.100 > 10.8.0.87: ICMP echo reply, id 1218, seq 54, length 64
23:32:10.906478 IP 10.8.0.87 > 192.145.117.100: ICMP echo request, id 1218, seq 55, length 64
23:32:11.126834 IP 192.145.117.100 > 10.8.0.87: ICMP echo reply, id 1218, seq 55, length 64
23:32:11.906846 IP 10.8.0.87 > 192.145.117.100: ICMP echo request, id 1218, seq 56, length 64
23:32:12.126457 IP 192.145.117.100 > 10.8.0.87: ICMP echo reply, id 1218, seq 56, length 64
23:32:12.907469 IP 10.8.0.87 > 192.145.117.100: ICMP echo request, id 1218, seq 57, length 64
23:32:13.126916 IP 192.145.117.100 > 10.8.0.87: ICMP echo reply, id 1218, seq 57, length 64
