12:23:16.487574 IP 10.8.0.5 > 107.150.94.35: ICMP echo request, id 1796, seq 2, length 64
12:23:17.030249 IP 107.150.94.35 > 10.8.0.5: ICMP echo reply, id 1796, seq 2, length 64
12:23:17.487865 IP 10.8.0.5 > 107.150.94.35: ICMP echo request, id 1796, seq 3, length 64
12:23:18.030981 IP 107.150.94.35 > 10.8.0.5: ICMP echo reply, id 1796, seq 3, length 64
12:23:18.487670 IP 10.8.0.5 > 107.150.94.35: ICMP echo request, id 1796, seq 4, length 64
12:23:19.030728 IP 107.150.94.35 > 10.8.0.5: ICMP echo reply, id 1796, seq 4, length 64
12:23:19.487413 IP 10.8.0.5 > 107.150.94.35: ICMP echo request, id 1796, seq 5, length 64
12:23:20.030414 IP 107.150.94.35 > 10.8.0.5: ICMP echo reply, id 1796, seq 5, length 64
12:23:20.487098 IP 10.8.0.5 > 107.150.94.35: ICMP echo request, id 1796, seq 6, length 64
12:23:21.030255 IP 107.150.94.35 > 10.8.0.5: ICMP echo reply, id 1796, seq 6, length 64
12:23:21.486942 IP 10.8.0.5 > 107.150.94.35: ICMP echo request, id 1796, seq 7, length 64
12:23:22.030230 IP 107.150.94.35 > 10.8.0.5: ICMP echo reply, id 1796, seq 7, length 64
12:23:22.486915 IP 10.8.0.5 > 107.150.94.35: ICMP echo request, id 1796, seq 8, length 64
12:23:23.029663 IP 107.150.94.35 > 10.8.0.5: ICMP echo reply, id 1796, seq 8, length 64
12:23:23.487369 IP 10.8.0.5 > 107.150.94.35: ICMP echo request, id 1796, seq 9, length 64
12:23:24.030266 IP 107.150.94.35 > 10.8.0.5: ICMP echo reply, id 1796, seq 9, length 64
12:23:24.486951 IP 10.8.0.5 > 107.150.94.35: ICMP echo request, id 1796, seq 10, length 64
12:23:25.029883 IP 107.150.94.35 > 10.8.0.5: ICMP echo reply, id 1796, seq 10, length 64
12:23:25.486572 IP 10.8.0.5 > 107.150.94.35: ICMP echo request, id 1796, seq 11, length 64
12:23:26.029682 IP 107.150.94.35 > 10.8.0.5: ICMP echo reply, id 1796, seq 11, length 64
12:23:26.486369 IP 10.8.0.5 > 107.150.94.35: ICMP echo request, id 1796, seq 12, length 64
12:23:27.029274 IP 107.150.94.35 > 10.8.0.5: ICMP echo reply, id 1796, seq 12, length 64
12:23:27.485961 IP 10.8.0.5 > 107.150.94.35: ICMP echo request, id 1796, seq 13, length 64
12:23:28.029656 IP 107.150.94.35 > 10.8.0.5: ICMP echo reply, id 1796, seq 13, length 64
12:23:28.486283 IP 10.8.0.5 > 107.150.94.35: ICMP echo request, id 1796, seq 14, length 64
12:23:29.029370 IP 107.150.94.35 > 10.8.0.5: ICMP echo reply, id 1796, seq 14, length 64
12:23:29.486059 IP 10.8.0.5 > 107.150.94.35: ICMP echo request, id 1796, seq 15, length 64
12:23:30.029173 IP 107.150.94.35 > 10.8.0.5: ICMP echo reply, id 1796, seq 15, length 64
12:23:30.485858 IP 10.8.0.5 > 107.150.94.35: ICMP echo request, id 1796, seq 16, length 64
12:23:31.029028 IP 107.150.94.35 > 10.8.0.5: ICMP echo reply, id 1796, seq 16, length 64
12:23:31.485716 IP 10.8.0.5 > 107.150.94.35: ICMP echo request, id 1796, seq 17, length 64
12:23:32.028791 IP 107.150.94.35 > 10.8.0.5: ICMP echo reply, id 1796, seq 17, length 64
12:23:32.485483 IP 10.8.0.5 > 107.150.94.35: ICMP echo request, id 1796, seq 18, length 64
12:23:33.028641 IP 107.150.94.35 > 10.8.0.5: ICMP echo reply, id 1796, seq 18, length 64
12:23:33.485321 IP 10.8.0.5 > 107.150.94.35: ICMP echo request, id 1796, seq 19, length 64
12:23:34.028360 IP 107.150.94.35 > 10.8.0.5: ICMP echo reply, id 1796, seq 19, length 64
12:23:34.485051 IP 10.8.0.5 > 107.150.94.35: ICMP echo request, id 1796, seq 20, length 64
12:23:35.028231 IP 107.150.94.35 > 10.8.0.5: ICMP echo reply, id 1796, seq 20, length 64
12:23:35.484904 IP 10.8.0.5 > 107.150.94.35: ICMP echo request, id 1796, seq 21, length 64
12:23:36.027834 IP 107.150.94.35 > 10.8.0.5: ICMP echo reply, id 1796, seq 21, length 64
12:23:36.484510 IP 10.8.0.5 > 107.150.94.35: ICMP echo request, id 1796, seq 22, length 64
12:23:37.033879 IP 107.150.94.35 > 10.8.0.5: ICMP echo reply, id 1796, seq 22, length 64
12:23:37.484548 IP 10.8.0.5 > 107.150.94.35: ICMP echo request, id 1796, seq 23, length 64
12:23:38.027447 IP 107.150.94.35 > 10.8.0.5: ICMP echo reply, id 1796, seq 23, length 64
12:23:38.484130 IP 10.8.0.5 > 107.150.94.35: ICMP echo request, id 1796, seq 24, length 64
12:23:39.027730 IP 107.150.94.35 > 10.8.0.5: ICMP echo reply, id 1796, seq 24, length 64
12:23:39.484405 IP 10.8.0.5 > 107.150.94.35: ICMP echo request, id 1796, seq 25, length 64
12:23:40.027559 IP 107.150.94.35 > 10.8.0.5: ICMP echo reply, id 1796, seq 25, length 64
12:23:40.484235 IP 10.8.0.5 > 107.150.94.35: ICMP echo request, id 1796, seq 26, length 64
12:23:41.027347 IP 107.150.94.35 > 10.8.0.5: ICMP echo reply, id 1796, seq 26, length 64
12:23:41.484025 IP 10.8.0.5 > 107.150.94.35: ICMP echo request, id 1796, seq 27, length 64
12:23:42.027160 IP 107.150.94.35 > 10.8.0.5: ICMP echo reply, id 1796, seq 27, length 64
12:23:42.483833 IP 10.8.0.5 > 107.150.94.35: ICMP echo request, id 1796, seq 28, length 64
12:23:43.026742 IP 107.150.94.35 > 10.8.0.5: ICMP echo reply, id 1796, seq 28, length 64
12:23:43.483420 IP 10.8.0.5 > 107.150.94.35: ICMP echo request, id 1796, seq 29, length 64
12:23:44.026706 IP 107.150.94.35 > 10.8.0.5: ICMP echo reply, id 1796, seq 29, length 64
12:23:44.483384 IP 10.8.0.5 > 107.150.94.35: ICMP echo request, id 1796, seq 30, length 64
12:23:45.026187 IP 107.150.94.35 > 10.8.0.5: ICMP echo reply, id 1796, seq 30, length 64
12:23:45.483876 IP 10.8.0.5 > 107.150.94.35: ICMP echo request, id 1796, seq 31, length 64
12:23:46.027019 IP 107.150.94.35 > 10.8.0.5: ICMP echo reply, id 1796, seq 31, length 64
12:23:46.483692 IP 10.8.0.5 > 107.150.94.35: ICMP echo request, id 1796, seq 32, length 64
12:23:47.026979 IP 107.150.94.35 > 10.8.0.5: ICMP echo reply, id 1796, seq 32, length 64
12:23:47.483653 IP 10.8.0.5 > 107.150.94.35: ICMP echo request, id 1796, seq 33, length 64
12:23:48.026842 IP 107.150.94.35 > 10.8.0.5: ICMP echo reply, id 1796, seq 33, length 64
12:23:48.483524 IP 10.8.0.5 > 107.150.94.35: ICMP echo request, id 1796, seq 34, length 64
12:23:49.027039 IP 107.150.94.35 > 10.8.0.5: ICMP echo reply, id 1796, seq 34, length 64
12:23:49.483711 IP 10.8.0.5 > 107.150.94.35: ICMP echo request, id 1796, seq 35, length 64
12:23:50.026680 IP 107.150.94.35 > 10.8.0.5: ICMP echo reply, id 1796, seq 35, length 64
12:23:50.483353 IP 10.8.0.5 > 107.150.94.35: ICMP echo request, id 1796, seq 36, length 64
12:23:51.030087 IP 107.150.94.35 > 10.8.0.5: ICMP echo reply, id 1796, seq 36, length 64
12:23:51.483778 IP 10.8.0.5 > 107.150.94.35: ICMP echo request, id 1796, seq 37, length 64
12:23:52.026694 IP 107.150.94.35 > 10.8.0.5: ICMP echo reply, id 1796, seq 37, length 64
12:23:52.483366 IP 10.8.0.5 > 107.150.94.35: ICMP echo request, id 1796, seq 38, length 64
12:23:53.027345 IP 107.150.94.35 > 10.8.0.5: ICMP echo reply, id 1796, seq 38, length 64
12:23:53.483021 IP 10.8.0.5 > 107.150.94.35: ICMP echo request, id 1796, seq 39, length 64
12:23:54.026325 IP 107.150.94.35 > 10.8.0.5: ICMP echo reply, id 1796, seq 39, length 64
12:23:54.483007 IP 10.8.0.5 > 107.150.94.35: ICMP echo request, id 1796, seq 40, length 64
12:23:55.033922 IP 107.150.94.35 > 10.8.0.5: ICMP echo reply, id 1796, seq 40, length 64
12:23:55.482598 IP 10.8.0.5 > 107.150.94.35: ICMP echo request, id 1796, seq 41, length 64
12:23:56.031574 IP 107.150.94.35 > 10.8.0.5: ICMP echo reply, id 1796, seq 41, length 64
12:23:56.482243 IP 10.8.0.5 > 107.150.94.35: ICMP echo request, id 1796, seq 42, length 64
12:23:57.025395 IP 107.150.94.35 > 10.8.0.5: ICMP echo reply, id 1796, seq 42, length 64
12:23:57.482081 IP 10.8.0.5 > 107.150.94.35: ICMP echo request, id 1796, seq 43, length 64
12:23:58.025412 IP 107.150.94.35 > 10.8.0.5: ICMP echo reply, id 1796, seq 43, length 64
12:23:58.482108 IP 10.8.0.5 > 107.150.94.35: ICMP echo request, id 1796, seq 44, length 64
12:23:59.024980 IP 107.150.94.35 > 10.8.0.5: ICMP echo reply, id 1796, seq 44, length 64
12:23:59.481666 IP 10.8.0.5 > 107.150.94.35: ICMP echo request, id 1796, seq 45, length 64
12:24:00.024635 IP 107.150.94.35 > 10.8.0.5: ICMP echo reply, id 1796, seq 45, length 64
12:24:00.481258 IP 10.8.0.5 > 107.150.94.35: ICMP echo request, id 1796, seq 46, length 64
12:24:01.024644 IP 107.150.94.35 > 10.8.0.5: ICMP echo reply, id 1796, seq 46, length 64
12:24:01.481326 IP 10.8.0.5 > 107.150.94.35: ICMP echo request, id 1796, seq 47, length 64
12:24:02.024266 IP 107.150.94.35 > 10.8.0.5: ICMP echo reply, id 1796, seq 47, length 64
12:24:02.480949 IP 10.8.0.5 > 107.150.94.35: ICMP echo request, id 1796, seq 48, length 64
12:24:03.023876 IP 107.150.94.35 > 10.8.0.5: ICMP echo reply, id 1796, seq 48, length 64
12:24:03.480557 IP 10.8.0.5 > 107.150.94.35: ICMP echo request, id 1796, seq 49, length 64
12:24:04.023889 IP 107.150.94.35 > 10.8.0.5: ICMP echo reply, id 1796, seq 49, length 64
12:24:04.480568 IP 10.8.0.5 > 107.150.94.35: ICMP echo request, id 1796, seq 50, length 64
12:24:05.023930 IP 107.150.94.35 > 10.8.0.5: ICMP echo reply, id 1796, seq 50, length 64
12:24:05.480611 IP 10.8.0.5 > 107.150.94.35: ICMP echo request, id 1796, seq 51, length 64
12:24:06.023464 IP 107.150.94.35 > 10.8.0.5: ICMP echo reply, id 1796, seq 51, length 64
12:24:06.480141 IP 10.8.0.5 > 107.150.94.35: ICMP echo request, id 1796, seq 52, length 64
12:24:07.023401 IP 107.150.94.35 > 10.8.0.5: ICMP echo reply, id 1796, seq 52, length 64
12:24:07.480084 IP 10.8.0.5 > 107.150.94.35: ICMP echo request, id 1796, seq 53, length 64
12:24:08.023186 IP 107.150.94.35 > 10.8.0.5: ICMP echo reply, id 1796, seq 53, length 64
12:24:08.479865 IP 10.8.0.5 > 107.150.94.35: ICMP echo request, id 1796, seq 54, length 64
12:24:09.022823 IP 107.150.94.35 > 10.8.0.5: ICMP echo reply, id 1796, seq 54, length 64
12:24:09.479504 IP 10.8.0.5 > 107.150.94.35: ICMP echo request, id 1796, seq 55, length 64
12:24:10.023106 IP 107.150.94.35 > 10.8.0.5: ICMP echo reply, id 1796, seq 55, length 64
12:24:10.479788 IP 10.8.0.5 > 107.150.94.35: ICMP echo request, id 1796, seq 56, length 64
12:24:11.023052 IP 107.150.94.35 > 10.8.0.5: ICMP echo reply, id 1796, seq 56, length 64
12:24:11.479734 IP 10.8.0.5 > 107.150.94.35: ICMP echo request, id 1796, seq 57, length 64
12:24:12.022862 IP 107.150.94.35 > 10.8.0.5: ICMP echo reply, id 1796, seq 57, length 64
12:24:12.479542 IP 10.8.0.5 > 107.150.94.35: ICMP echo request, id 1796, seq 58, length 64
12:24:13.022427 IP 107.150.94.35 > 10.8.0.5: ICMP echo reply, id 1796, seq 58, length 64
12:24:13.479104 IP 10.8.0.5 > 107.150.94.35: ICMP echo request, id 1796, seq 59, length 64
12:24:14.022709 IP 107.150.94.35 > 10.8.0.5: ICMP echo reply, id 1796, seq 59, length 64
12:24:14.479391 IP 10.8.0.5 > 107.150.94.35: ICMP echo request, id 1796, seq 60, length 64
12:24:15.022719 IP 107.150.94.35 > 10.8.0.5: ICMP echo reply, id 1796, seq 60, length 64
12:24:15.479400 IP 10.8.0.5 > 107.150.94.35: ICMP echo request, id 1796, seq 61, length 64
