16:42:15.219203 IP 37.120.210.107 > 10.8.3.5: ICMP echo reply, id 515, seq 1, length 64
16:42:16.442400 IP 10.8.3.5 > 37.120.210.107: ICMP echo request, id 515, seq 2, length 64
16:42:16.719286 IP 37.120.210.107 > 10.8.3.5: ICMP echo reply, id 515, seq 2, length 64
16:42:17.443256 IP 10.8.3.5 > 37.120.210.107: ICMP echo request, id 515, seq 3, length 64
16:42:17.719216 IP 37.120.210.107 > 10.8.3.5: ICMP echo reply, id 515, seq 3, length 64
16:42:18.444160 IP 10.8.3.5 > 37.120.210.107: ICMP echo request, id 515, seq 4, length 64
16:42:18.720244 IP 37.120.210.107 > 10.8.3.5: ICMP echo reply, id 515, seq 4, length 64
16:42:19.445187 IP 10.8.3.5 > 37.120.210.107: ICMP echo request, id 515, seq 5, length 64
16:42:19.721258 IP 37.120.210.107 > 10.8.3.5: ICMP echo reply, id 515, seq 5, length 64
16:42:20.446206 IP 10.8.3.5 > 37.120.210.107: ICMP echo request, id 515, seq 6, length 64
16:42:20.722523 IP 37.120.210.107 > 10.8.3.5: ICMP echo reply, id 515, seq 6, length 64
16:42:21.447480 IP 10.8.3.5 > 37.120.210.107: ICMP echo request, id 515, seq 7, length 64
16:42:21.724199 IP 37.120.210.107 > 10.8.3.5: ICMP echo reply, id 515, seq 7, length 64
16:42:22.449149 IP 10.8.3.5 > 37.120.210.107: ICMP echo request, id 515, seq 8, length 64
16:42:22.725376 IP 37.120.210.107 > 10.8.3.5: ICMP echo reply, id 515, seq 8, length 64
16:42:23.450328 IP 10.8.3.5 > 37.120.210.107: ICMP echo request, id 515, seq 9, length 64
16:42:23.726581 IP 37.120.210.107 > 10.8.3.5: ICMP echo reply, id 515, seq 9, length 64
16:42:24.451530 IP 10.8.3.5 > 37.120.210.107: ICMP echo request, id 515, seq 10, length 64
16:42:24.727684 IP 37.120.210.107 > 10.8.3.5: ICMP echo reply, id 515, seq 10, length 64
16:42:25.452643 IP 10.8.3.5 > 37.120.210.107: ICMP echo request, id 515, seq 11, length 64
16:42:25.728647 IP 37.120.210.107 > 10.8.3.5: ICMP echo reply, id 515, seq 11, length 64
16:42:26.453595 IP 10.8.3.5 > 37.120.210.107: ICMP echo request, id 515, seq 12, length 64
16:42:26.729813 IP 37.120.210.107 > 10.8.3.5: ICMP echo reply, id 515, seq 12, length 64
16:42:27.454758 IP 10.8.3.5 > 37.120.210.107: ICMP echo request, id 515, seq 13, length 64
16:42:27.731115 IP 37.120.210.107 > 10.8.3.5: ICMP echo reply, id 515, seq 13, length 64
16:42:28.456089 IP 10.8.3.5 > 37.120.210.107: ICMP echo request, id 515, seq 14, length 64
16:42:28.732066 IP 37.120.210.107 > 10.8.3.5: ICMP echo reply, id 515, seq 14, length 64
16:42:29.457015 IP 10.8.3.5 > 37.120.210.107: ICMP echo request, id 515, seq 15, length 64
16:42:29.733464 IP 37.120.210.107 > 10.8.3.5: ICMP echo reply, id 515, seq 15, length 64
16:42:30.458413 IP 10.8.3.5 > 37.120.210.107: ICMP echo request, id 515, seq 16, length 64
16:42:30.734409 IP 37.120.210.107 > 10.8.3.5: ICMP echo reply, id 515, seq 16, length 64
16:42:31.459368 IP 10.8.3.5 > 37.120.210.107: ICMP echo request, id 515, seq 17, length 64
16:42:31.735537 IP 37.120.210.107 > 10.8.3.5: ICMP echo reply, id 515, seq 17, length 64
16:42:32.460490 IP 10.8.3.5 > 37.120.210.107: ICMP echo request, id 515, seq 18, length 64
16:42:32.737019 IP 37.120.210.107 > 10.8.3.5: ICMP echo reply, id 515, seq 18, length 64
16:42:33.461979 IP 10.8.3.5 > 37.120.210.107: ICMP echo request, id 515, seq 19, length 64
16:42:33.743353 IP 37.120.210.107 > 10.8.3.5: ICMP echo reply, id 515, seq 19, length 64
16:42:34.463297 IP 10.8.3.5 > 37.120.210.107: ICMP echo request, id 515, seq 20, length 64
16:42:34.739809 IP 37.120.210.107 > 10.8.3.5: ICMP echo reply, id 515, seq 20, length 64
16:42:35.464767 IP 10.8.3.5 > 37.120.210.107: ICMP echo request, id 515, seq 21, length 64
16:42:35.741615 IP 37.120.210.107 > 10.8.3.5: ICMP echo reply, id 515, seq 21, length 64
16:42:36.465566 IP 10.8.3.5 > 37.120.210.107: ICMP echo request, id 515, seq 22, length 64
16:42:36.743250 IP 37.120.210.107 > 10.8.3.5: ICMP echo reply, id 515, seq 22, length 64
16:42:37.467206 IP 10.8.3.5 > 37.120.210.107: ICMP echo request, id 515, seq 23, length 64
16:42:37.743322 IP 37.120.210.107 > 10.8.3.5: ICMP echo reply, id 515, seq 23, length 64
16:42:38.468275 IP 10.8.3.5 > 37.120.210.107: ICMP echo request, id 515, seq 24, length 64
16:42:38.744307 IP 37.120.210.107 > 10.8.3.5: ICMP echo reply, id 515, seq 24, length 64
16:42:39.469262 IP 10.8.3.5 > 37.120.210.107: ICMP echo request, id 515, seq 25, length 64
16:42:39.745567 IP 37.120.210.107 > 10.8.3.5: ICMP echo reply, id 515, seq 25, length 64
16:42:40.470518 IP 10.8.3.5 > 37.120.210.107: ICMP echo request, id 515, seq 26, length 64
16:42:40.746582 IP 37.120.210.107 > 10.8.3.5: ICMP echo reply, id 515, seq 26, length 64
16:42:41.471530 IP 10.8.3.5 > 37.120.210.107: ICMP echo request, id 515, seq 27, length 64
16:42:41.747823 IP 37.120.210.107 > 10.8.3.5: ICMP echo reply, id 515, seq 27, length 64
16:42:42.472772 IP 10.8.3.5 > 37.120.210.107: ICMP echo request, id 515, seq 28, length 64
16:42:42.749027 IP 37.120.210.107 > 10.8.3.5: ICMP echo reply, id 515, seq 28, length 64
16:42:43.473977 IP 10.8.3.5 > 37.120.210.107: ICMP echo request, id 515, seq 29, length 64
16:42:43.750133 IP 37.120.210.107 > 10.8.3.5: ICMP echo reply, id 515, seq 29, length 64
16:42:44.475090 IP 10.8.3.5 > 37.120.210.107: ICMP echo request, id 515, seq 30, length 64
16:42:44.751434 IP 37.120.210.107 > 10.8.3.5: ICMP echo reply, id 515, seq 30, length 64
16:42:45.476384 IP 10.8.3.5 > 37.120.210.107: ICMP echo request, id 515, seq 31, length 64
16:42:45.752472 IP 37.120.210.107 > 10.8.3.5: ICMP echo reply, id 515, seq 31, length 64
16:42:46.477420 IP 10.8.3.5 > 37.120.210.107: ICMP echo request, id 515, seq 32, length 64
16:42:46.753553 IP 37.120.210.107 > 10.8.3.5: ICMP echo reply, id 515, seq 32, length 64
16:42:47.478500 IP 10.8.3.5 > 37.120.210.107: ICMP echo request, id 515, seq 33, length 64
16:42:47.754761 IP 37.120.210.107 > 10.8.3.5: ICMP echo reply, id 515, seq 33, length 64
16:42:48.479720 IP 10.8.3.5 > 37.120.210.107: ICMP echo request, id 515, seq 34, length 64
16:42:48.756916 IP 37.120.210.107 > 10.8.3.5: ICMP echo reply, id 515, seq 34, length 64
16:42:49.480866 IP 10.8.3.5 > 37.120.210.107: ICMP echo request, id 515, seq 35, length 64
16:42:49.757024 IP 37.120.210.107 > 10.8.3.5: ICMP echo reply, id 515, seq 35, length 64
16:42:50.481972 IP 10.8.3.5 > 37.120.210.107: ICMP echo request, id 515, seq 36, length 64
16:42:50.758178 IP 37.120.210.107 > 10.8.3.5: ICMP echo reply, id 515, seq 36, length 64
16:42:51.483134 IP 10.8.3.5 > 37.120.210.107: ICMP echo request, id 515, seq 37, length 64
16:42:51.759462 IP 37.120.210.107 > 10.8.3.5: ICMP echo reply, id 515, seq 37, length 64
16:42:52.484420 IP 10.8.3.5 > 37.120.210.107: ICMP echo request, id 515, seq 38, length 64
16:42:52.760662 IP 37.120.210.107 > 10.8.3.5: ICMP echo reply, id 515, seq 38, length 64
16:42:53.485616 IP 10.8.3.5 > 37.120.210.107: ICMP echo request, id 515, seq 39, length 64
16:42:53.762078 IP 37.120.210.107 > 10.8.3.5: ICMP echo reply, id 515, seq 39, length 64
16:42:54.487027 IP 10.8.3.5 > 37.120.210.107: ICMP echo request, id 515, seq 40, length 64
16:42:54.763891 IP 37.120.210.107 > 10.8.3.5: ICMP echo reply, id 515, seq 40, length 64
16:42:55.487839 IP 10.8.3.5 > 37.120.210.107: ICMP echo request, id 515, seq 41, length 64
16:42:55.764004 IP 37.120.210.107 > 10.8.3.5: ICMP echo reply, id 515, seq 41, length 64
16:42:56.488955 IP 10.8.3.5 > 37.120.210.107: ICMP echo request, id 515, seq 42, length 64
16:42:56.765529 IP 37.120.210.107 > 10.8.3.5: ICMP echo reply, id 515, seq 42, length 64
16:42:57.490463 IP 10.8.3.5 > 37.120.210.107: ICMP echo request, id 515, seq 43, length 64
16:42:57.766575 IP 37.120.210.107 > 10.8.3.5: ICMP echo reply, id 515, seq 43, length 64
16:42:58.491534 IP 10.8.3.5 > 37.120.210.107: ICMP echo request, id 515, seq 44, length 64
16:42:58.768096 IP 37.120.210.107 > 10.8.3.5: ICMP echo reply, id 515, seq 44, length 64
16:42:59.492977 IP 10.8.3.5 > 37.120.210.107: ICMP echo request, id 515, seq 45, length 64
16:42:59.769222 IP 37.120.210.107 > 10.8.3.5: ICMP echo reply, id 515, seq 45, length 64
16:43:00.494183 IP 10.8.3.5 > 37.120.210.107: ICMP echo request, id 515, seq 46, length 64
16:43:00.770427 IP 37.120.210.107 > 10.8.3.5: ICMP echo reply, id 515, seq 46, length 64
16:43:01.495347 IP 10.8.3.5 > 37.120.210.107: ICMP echo request, id 515, seq 47, length 64
16:43:01.771484 IP 37.120.210.107 > 10.8.3.5: ICMP echo reply, id 515, seq 47, length 64
16:43:02.496423 IP 10.8.3.5 > 37.120.210.107: ICMP echo request, id 515, seq 48, length 64
16:43:02.772517 IP 37.120.210.107 > 10.8.3.5: ICMP echo reply, id 515, seq 48, length 64
16:43:03.497456 IP 10.8.3.5 > 37.120.210.107: ICMP echo request, id 515, seq 49, length 64
16:43:03.773661 IP 37.120.210.107 > 10.8.3.5: ICMP echo reply, id 515, seq 49, length 64
16:43:04.498596 IP 10.8.3.5 > 37.120.210.107: ICMP echo request, id 515, seq 50, length 64
16:43:04.774527 IP 37.120.210.107 > 10.8.3.5: ICMP echo reply, id 515, seq 50, length 64
16:43:05.499463 IP 10.8.3.5 > 37.120.210.107: ICMP echo request, id 515, seq 51, length 64
16:43:05.775743 IP 37.120.210.107 > 10.8.3.5: ICMP echo reply, id 515, seq 51, length 64
16:43:06.500681 IP 10.8.3.5 > 37.120.210.107: ICMP echo request, id 515, seq 52, length 64
16:43:06.776972 IP 37.120.210.107 > 10.8.3.5: ICMP echo reply, id 515, seq 52, length 64
16:43:07.501913 IP 10.8.3.5 > 37.120.210.107: ICMP echo request, id 515, seq 53, length 64
16:43:07.778180 IP 37.120.210.107 > 10.8.3.5: ICMP echo reply, id 515, seq 53, length 64
16:43:08.503124 IP 10.8.3.5 > 37.120.210.107: ICMP echo request, id 515, seq 54, length 64
16:43:08.780968 IP 37.120.210.107 > 10.8.3.5: ICMP echo reply, id 515, seq 54, length 64
16:43:09.504905 IP 10.8.3.5 > 37.120.210.107: ICMP echo request, id 515, seq 55, length 64
16:43:09.786369 IP 37.120.210.107 > 10.8.3.5: ICMP echo reply, id 515, seq 55, length 64
16:43:10.506305 IP 10.8.3.5 > 37.120.210.107: ICMP echo request, id 515, seq 56, length 64
16:43:10.782623 IP 37.120.210.107 > 10.8.3.5: ICMP echo reply, id 515, seq 56, length 64
16:43:11.507563 IP 10.8.3.5 > 37.120.210.107: ICMP echo request, id 515, seq 57, length 64
16:43:11.783709 IP 37.120.210.107 > 10.8.3.5: ICMP echo reply, id 515, seq 57, length 64
16:43:12.508658 IP 10.8.3.5 > 37.120.210.107: ICMP echo request, id 515, seq 58, length 64
16:43:12.784888 IP 37.120.210.107 > 10.8.3.5: ICMP echo reply, id 515, seq 58, length 64
16:43:13.509828 IP 10.8.3.5 > 37.120.210.107: ICMP echo request, id 515, seq 59, length 64
16:43:13.785766 IP 37.120.210.107 > 10.8.3.5: ICMP echo reply, id 515, seq 59, length 64
16:43:14.510717 IP 10.8.3.5 > 37.120.210.107: ICMP echo request, id 515, seq 60, length 64
