17:28:09.625385 IP 10.8.0.10 > 185.176.222.47: ICMP echo request, id 690, seq 2, length 64
17:28:10.033844 IP 185.176.222.47 > 10.8.0.10: ICMP echo reply, id 690, seq 2, length 64
17:28:10.625630 IP 10.8.0.10 > 185.176.222.47: ICMP echo request, id 690, seq 3, length 64
17:28:11.033930 IP 185.176.222.47 > 10.8.0.10: ICMP echo reply, id 690, seq 3, length 64
17:28:11.625771 IP 10.8.0.10 > 185.176.222.47: ICMP echo request, id 690, seq 4, length 64
17:28:12.034216 IP 185.176.222.47 > 10.8.0.10: ICMP echo reply, id 690, seq 4, length 64
17:28:12.626031 IP 10.8.0.10 > 185.176.222.47: ICMP echo request, id 690, seq 5, length 64
17:28:13.034786 IP 185.176.222.47 > 10.8.0.10: ICMP echo reply, id 690, seq 5, length 64
17:28:13.626598 IP 10.8.0.10 > 185.176.222.47: ICMP echo request, id 690, seq 6, length 64
17:28:14.034962 IP 185.176.222.47 > 10.8.0.10: ICMP echo reply, id 690, seq 6, length 64
17:28:14.626771 IP 10.8.0.10 > 185.176.222.47: ICMP echo request, id 690, seq 7, length 64
17:28:15.036196 IP 185.176.222.47 > 10.8.0.10: ICMP echo reply, id 690, seq 7, length 64
17:28:15.627002 IP 10.8.0.10 > 185.176.222.47: ICMP echo request, id 690, seq 8, length 64
17:28:16.035392 IP 185.176.222.47 > 10.8.0.10: ICMP echo reply, id 690, seq 8, length 64
17:28:16.627175 IP 10.8.0.10 > 185.176.222.47: ICMP echo request, id 690, seq 9, length 64
17:28:17.035572 IP 185.176.222.47 > 10.8.0.10: ICMP echo reply, id 690, seq 9, length 64
17:28:17.627235 IP 10.8.0.10 > 185.176.222.47: ICMP echo request, id 690, seq 10, length 64
17:28:18.035759 IP 185.176.222.47 > 10.8.0.10: ICMP echo reply, id 690, seq 10, length 64
17:28:18.627543 IP 10.8.0.10 > 185.176.222.47: ICMP echo request, id 690, seq 11, length 64
17:28:19.036026 IP 185.176.222.47 > 10.8.0.10: ICMP echo reply, id 690, seq 11, length 64
17:28:19.627842 IP 10.8.0.10 > 185.176.222.47: ICMP echo request, id 690, seq 12, length 64
17:28:20.036231 IP 185.176.222.47 > 10.8.0.10: ICMP echo reply, id 690, seq 12, length 64
17:28:20.628047 IP 10.8.0.10 > 185.176.222.47: ICMP echo request, id 690, seq 13, length 64
17:28:21.036523 IP 185.176.222.47 > 10.8.0.10: ICMP echo reply, id 690, seq 13, length 64
17:28:21.628357 IP 10.8.0.10 > 185.176.222.47: ICMP echo request, id 690, seq 14, length 64
17:28:22.036630 IP 185.176.222.47 > 10.8.0.10: ICMP echo reply, id 690, seq 14, length 64
17:28:22.628458 IP 10.8.0.10 > 185.176.222.47: ICMP echo request, id 690, seq 15, length 64
17:28:23.037226 IP 185.176.222.47 > 10.8.0.10: ICMP echo reply, id 690, seq 15, length 64
17:28:23.629047 IP 10.8.0.10 > 185.176.222.47: ICMP echo request, id 690, seq 16, length 64
17:28:24.037531 IP 185.176.222.47 > 10.8.0.10: ICMP echo reply, id 690, seq 16, length 64
17:28:24.629345 IP 10.8.0.10 > 185.176.222.47: ICMP echo request, id 690, seq 17, length 64
17:28:25.037532 IP 185.176.222.47 > 10.8.0.10: ICMP echo reply, id 690, seq 17, length 64
17:28:25.629346 IP 10.8.0.10 > 185.176.222.47: ICMP echo request, id 690, seq 18, length 64
17:28:26.037972 IP 185.176.222.47 > 10.8.0.10: ICMP echo reply, id 690, seq 18, length 64
17:28:26.629782 IP 10.8.0.10 > 185.176.222.47: ICMP echo request, id 690, seq 19, length 64
17:28:27.038394 IP 185.176.222.47 > 10.8.0.10: ICMP echo reply, id 690, seq 19, length 64
17:28:27.630208 IP 10.8.0.10 > 185.176.222.47: ICMP echo request, id 690, seq 20, length 64
17:28:28.038751 IP 185.176.222.47 > 10.8.0.10: ICMP echo reply, id 690, seq 20, length 64
17:28:28.630572 IP 10.8.0.10 > 185.176.222.47: ICMP echo request, id 690, seq 21, length 64
17:28:29.039356 IP 185.176.222.47 > 10.8.0.10: ICMP echo reply, id 690, seq 21, length 64
17:28:29.631192 IP 10.8.0.10 > 185.176.222.47: ICMP echo request, id 690, seq 22, length 64
17:28:30.039773 IP 185.176.222.47 > 10.8.0.10: ICMP echo reply, id 690, seq 22, length 64
17:28:30.631579 IP 10.8.0.10 > 185.176.222.47: ICMP echo request, id 690, seq 23, length 64
17:28:31.040046 IP 185.176.222.47 > 10.8.0.10: ICMP echo reply, id 690, seq 23, length 64
17:28:31.631864 IP 10.8.0.10 > 185.176.222.47: ICMP echo request, id 690, seq 24, length 64
17:28:32.040174 IP 185.176.222.47 > 10.8.0.10: ICMP echo reply, id 690, seq 24, length 64
17:28:32.631992 IP 10.8.0.10 > 185.176.222.47: ICMP echo request, id 690, seq 25, length 64
17:28:33.040520 IP 185.176.222.47 > 10.8.0.10: ICMP echo reply, id 690, seq 25, length 64
17:28:33.632335 IP 10.8.0.10 > 185.176.222.47: ICMP echo request, id 690, seq 26, length 64
17:28:34.040623 IP 185.176.222.47 > 10.8.0.10: ICMP echo reply, id 690, seq 26, length 64
17:28:34.632444 IP 10.8.0.10 > 185.176.222.47: ICMP echo request, id 690, seq 27, length 64
17:28:35.043996 IP 185.176.222.47 > 10.8.0.10: ICMP echo reply, id 690, seq 27, length 64
17:28:35.632816 IP 10.8.0.10 > 185.176.222.47: ICMP echo request, id 690, seq 28, length 64
17:28:36.041574 IP 185.176.222.47 > 10.8.0.10: ICMP echo reply, id 690, seq 28, length 64
17:28:36.633401 IP 10.8.0.10 > 185.176.222.47: ICMP echo request, id 690, seq 29, length 64
17:28:37.041793 IP 185.176.222.47 > 10.8.0.10: ICMP echo reply, id 690, seq 29, length 64
17:28:37.633617 IP 10.8.0.10 > 185.176.222.47: ICMP echo request, id 690, seq 30, length 64
17:28:38.042260 IP 185.176.222.47 > 10.8.0.10: ICMP echo reply, id 690, seq 30, length 64
17:28:38.634089 IP 10.8.0.10 > 185.176.222.47: ICMP echo request, id 690, seq 31, length 64
17:28:39.042414 IP 185.176.222.47 > 10.8.0.10: ICMP echo reply, id 690, seq 31, length 64
17:28:39.634240 IP 10.8.0.10 > 185.176.222.47: ICMP echo request, id 690, seq 32, length 64
17:28:40.043022 IP 185.176.222.47 > 10.8.0.10: ICMP echo reply, id 690, seq 32, length 64
17:28:40.634871 IP 10.8.0.10 > 185.176.222.47: ICMP echo request, id 690, seq 33, length 64
17:28:41.043426 IP 185.176.222.47 > 10.8.0.10: ICMP echo reply, id 690, seq 33, length 64
17:28:41.635257 IP 10.8.0.10 > 185.176.222.47: ICMP echo request, id 690, seq 34, length 64
17:28:42.043851 IP 185.176.222.47 > 10.8.0.10: ICMP echo reply, id 690, seq 34, length 64
17:28:42.635678 IP 10.8.0.10 > 185.176.222.47: ICMP echo request, id 690, seq 35, length 64
17:28:43.044095 IP 185.176.222.47 > 10.8.0.10: ICMP echo reply, id 690, seq 35, length 64
17:28:43.635912 IP 10.8.0.10 > 185.176.222.47: ICMP echo request, id 690, seq 36, length 64
17:28:44.044439 IP 185.176.222.47 > 10.8.0.10: ICMP echo reply, id 690, seq 36, length 64
17:28:44.636256 IP 10.8.0.10 > 185.176.222.47: ICMP echo request, id 690, seq 37, length 64
17:28:45.044886 IP 185.176.222.47 > 10.8.0.10: ICMP echo reply, id 690, seq 37, length 64
17:28:45.636708 IP 10.8.0.10 > 185.176.222.47: ICMP echo request, id 690, seq 38, length 64
17:28:46.045236 IP 185.176.222.47 > 10.8.0.10: ICMP echo reply, id 690, seq 38, length 64
17:28:46.637062 IP 10.8.0.10 > 185.176.222.47: ICMP echo request, id 690, seq 39, length 64
17:28:47.045575 IP 185.176.222.47 > 10.8.0.10: ICMP echo reply, id 690, seq 39, length 64
17:28:47.637400 IP 10.8.0.10 > 185.176.222.47: ICMP echo request, id 690, seq 40, length 64
17:28:48.046597 IP 185.176.222.47 > 10.8.0.10: ICMP echo reply, id 690, seq 40, length 64
17:28:48.637419 IP 10.8.0.10 > 185.176.222.47: ICMP echo request, id 690, seq 41, length 64
17:28:49.046040 IP 185.176.222.47 > 10.8.0.10: ICMP echo reply, id 690, seq 41, length 64
17:28:49.637860 IP 10.8.0.10 > 185.176.222.47: ICMP echo request, id 690, seq 42, length 64
17:28:50.046406 IP 185.176.222.47 > 10.8.0.10: ICMP echo reply, id 690, seq 42, length 64
17:28:50.638232 IP 10.8.0.10 > 185.176.222.47: ICMP echo request, id 690, seq 43, length 64
17:28:51.046570 IP 185.176.222.47 > 10.8.0.10: ICMP echo reply, id 690, seq 43, length 64
17:28:51.638394 IP 10.8.0.10 > 185.176.222.47: ICMP echo request, id 690, seq 44, length 64
17:28:52.047211 IP 185.176.222.47 > 10.8.0.10: ICMP echo reply, id 690, seq 44, length 64
17:28:52.639030 IP 10.8.0.10 > 185.176.222.47: ICMP echo request, id 690, seq 45, length 64
17:28:53.047466 IP 185.176.222.47 > 10.8.0.10: ICMP echo reply, id 690, seq 45, length 64
17:28:53.639288 IP 10.8.0.10 > 185.176.222.47: ICMP echo request, id 690, seq 46, length 64
17:28:54.047782 IP 185.176.222.47 > 10.8.0.10: ICMP echo reply, id 690, seq 46, length 64
17:28:54.639600 IP 10.8.0.10 > 185.176.222.47: ICMP echo request, id 690, seq 47, length 64
17:28:55.048217 IP 185.176.222.47 > 10.8.0.10: ICMP echo reply, id 690, seq 47, length 64
17:28:55.640037 IP 10.8.0.10 > 185.176.222.47: ICMP echo request, id 690, seq 48, length 64
17:28:56.048620 IP 185.176.222.47 > 10.8.0.10: ICMP echo reply, id 690, seq 48, length 64
17:28:56.640439 IP 10.8.0.10 > 185.176.222.47: ICMP echo request, id 690, seq 49, length 64
17:28:57.048817 IP 185.176.222.47 > 10.8.0.10: ICMP echo reply, id 690, seq 49, length 64
17:28:57.640637 IP 10.8.0.10 > 185.176.222.47: ICMP echo request, id 690, seq 50, length 64
17:28:58.049048 IP 185.176.222.47 > 10.8.0.10: ICMP echo reply, id 690, seq 50, length 64
17:28:58.640872 IP 10.8.0.10 > 185.176.222.47: ICMP echo request, id 690, seq 51, length 64
17:28:59.049592 IP 185.176.222.47 > 10.8.0.10: ICMP echo reply, id 690, seq 51, length 64
17:28:59.641407 IP 10.8.0.10 > 185.176.222.47: ICMP echo request, id 690, seq 52, length 64
17:29:00.049824 IP 185.176.222.47 > 10.8.0.10: ICMP echo reply, id 690, seq 52, length 64
17:29:00.641655 IP 10.8.0.10 > 185.176.222.47: ICMP echo request, id 690, seq 53, length 64
17:29:01.050216 IP 185.176.222.47 > 10.8.0.10: ICMP echo reply, id 690, seq 53, length 64
17:29:01.642046 IP 10.8.0.10 > 185.176.222.47: ICMP echo request, id 690, seq 54, length 64
17:29:02.050418 IP 185.176.222.47 > 10.8.0.10: ICMP echo reply, id 690, seq 54, length 64
17:29:02.642244 IP 10.8.0.10 > 185.176.222.47: ICMP echo request, id 690, seq 55, length 64
17:29:03.050627 IP 185.176.222.47 > 10.8.0.10: ICMP echo reply, id 690, seq 55, length 64
17:29:03.642454 IP 10.8.0.10 > 185.176.222.47: ICMP echo request, id 690, seq 56, length 64
17:29:04.051042 IP 185.176.222.47 > 10.8.0.10: ICMP echo reply, id 690, seq 56, length 64
17:29:04.642880 IP 10.8.0.10 > 185.176.222.47: ICMP echo request, id 690, seq 57, length 64
17:29:05.051274 IP 185.176.222.47 > 10.8.0.10: ICMP echo reply, id 690, seq 57, length 64
17:29:05.643105 IP 10.8.0.10 > 185.176.222.47: ICMP echo request, id 690, seq 58, length 64
17:29:06.051394 IP 185.176.222.47 > 10.8.0.10: ICMP echo reply, id 690, seq 58, length 64
17:29:06.643222 IP 10.8.0.10 > 185.176.222.47: ICMP echo request, id 690, seq 59, length 64
17:29:07.051662 IP 185.176.222.47 > 10.8.0.10: ICMP echo reply, id 690, seq 59, length 64
17:29:07.643482 IP 10.8.0.10 > 185.176.222.47: ICMP echo request, id 690, seq 60, length 64
17:29:08.052223 IP 185.176.222.47 > 10.8.0.10: ICMP echo reply, id 690, seq 60, length 64
