08:24:41.030832 IP 10.8.2.5 > 148.72.164.38: ICMP echo request, id 898, seq 2, length 64
08:24:41.669477 IP 148.72.164.38 > 10.8.2.5: ICMP echo reply, id 898, seq 2, length 64
08:24:42.032128 IP 10.8.2.5 > 148.72.164.38: ICMP echo request, id 898, seq 3, length 64
08:24:42.670782 IP 148.72.164.38 > 10.8.2.5: ICMP echo reply, id 898, seq 3, length 64
08:24:43.033395 IP 10.8.2.5 > 148.72.164.38: ICMP echo request, id 898, seq 4, length 64
08:24:43.671848 IP 148.72.164.38 > 10.8.2.5: ICMP echo reply, id 898, seq 4, length 64
08:24:44.034445 IP 10.8.2.5 > 148.72.164.38: ICMP echo request, id 898, seq 5, length 64
08:24:44.672922 IP 148.72.164.38 > 10.8.2.5: ICMP echo reply, id 898, seq 5, length 64
08:24:45.035529 IP 10.8.2.5 > 148.72.164.38: ICMP echo request, id 898, seq 6, length 64
08:24:45.674133 IP 148.72.164.38 > 10.8.2.5: ICMP echo reply, id 898, seq 6, length 64
08:24:46.036727 IP 10.8.2.5 > 148.72.164.38: ICMP echo request, id 898, seq 7, length 64
08:24:46.675306 IP 148.72.164.38 > 10.8.2.5: ICMP echo reply, id 898, seq 7, length 64
08:24:47.037928 IP 10.8.2.5 > 148.72.164.38: ICMP echo request, id 898, seq 8, length 64
08:24:47.676179 IP 148.72.164.38 > 10.8.2.5: ICMP echo reply, id 898, seq 8, length 64
08:24:48.038777 IP 10.8.2.5 > 148.72.164.38: ICMP echo request, id 898, seq 9, length 64
08:24:48.677443 IP 148.72.164.38 > 10.8.2.5: ICMP echo reply, id 898, seq 9, length 64
08:24:49.040045 IP 10.8.2.5 > 148.72.164.38: ICMP echo request, id 898, seq 10, length 64
08:24:49.678613 IP 148.72.164.38 > 10.8.2.5: ICMP echo reply, id 898, seq 10, length 64
08:24:50.041217 IP 10.8.2.5 > 148.72.164.38: ICMP echo request, id 898, seq 11, length 64
08:24:50.679875 IP 148.72.164.38 > 10.8.2.5: ICMP echo reply, id 898, seq 11, length 64
08:24:51.042203 IP 10.8.2.5 > 148.72.164.38: ICMP echo request, id 898, seq 12, length 64
08:24:51.680815 IP 148.72.164.38 > 10.8.2.5: ICMP echo reply, id 898, seq 12, length 64
08:24:52.043419 IP 10.8.2.5 > 148.72.164.38: ICMP echo request, id 898, seq 13, length 64
08:24:52.681637 IP 148.72.164.38 > 10.8.2.5: ICMP echo reply, id 898, seq 13, length 64
08:24:53.044240 IP 10.8.2.5 > 148.72.164.38: ICMP echo request, id 898, seq 14, length 64
08:24:53.687677 IP 148.72.164.38 > 10.8.2.5: ICMP echo reply, id 898, seq 14, length 64
08:24:54.045273 IP 10.8.2.5 > 148.72.164.38: ICMP echo request, id 898, seq 15, length 64
08:24:54.683705 IP 148.72.164.38 > 10.8.2.5: ICMP echo reply, id 898, seq 15, length 64
08:24:55.046204 IP 10.8.2.5 > 148.72.164.38: ICMP echo request, id 898, seq 16, length 64
08:24:55.684772 IP 148.72.164.38 > 10.8.2.5: ICMP echo reply, id 898, seq 16, length 64
08:24:56.047379 IP 10.8.2.5 > 148.72.164.38: ICMP echo request, id 898, seq 17, length 64
08:24:56.685624 IP 148.72.164.38 > 10.8.2.5: ICMP echo reply, id 898, seq 17, length 64
08:24:57.048231 IP 10.8.2.5 > 148.72.164.38: ICMP echo request, id 898, seq 18, length 64
08:24:57.686661 IP 148.72.164.38 > 10.8.2.5: ICMP echo reply, id 898, seq 18, length 64
08:24:58.049268 IP 10.8.2.5 > 148.72.164.38: ICMP echo request, id 898, seq 19, length 64
08:24:58.687681 IP 148.72.164.38 > 10.8.2.5: ICMP echo reply, id 898, seq 19, length 64
08:24:59.050307 IP 10.8.2.5 > 148.72.164.38: ICMP echo request, id 898, seq 20, length 64
08:24:59.688744 IP 148.72.164.38 > 10.8.2.5: ICMP echo reply, id 898, seq 20, length 64
08:25:00.051336 IP 10.8.2.5 > 148.72.164.38: ICMP echo request, id 898, seq 21, length 64
08:25:00.690009 IP 148.72.164.38 > 10.8.2.5: ICMP echo reply, id 898, seq 21, length 64
08:25:01.052632 IP 10.8.2.5 > 148.72.164.38: ICMP echo request, id 898, seq 22, length 64
08:25:01.691041 IP 148.72.164.38 > 10.8.2.5: ICMP echo reply, id 898, seq 22, length 64
08:25:02.053649 IP 10.8.2.5 > 148.72.164.38: ICMP echo request, id 898, seq 23, length 64
08:25:02.696690 IP 148.72.164.38 > 10.8.2.5: ICMP echo reply, id 898, seq 23, length 64
08:25:03.054291 IP 10.8.2.5 > 148.72.164.38: ICMP echo request, id 898, seq 24, length 64
08:25:03.696923 IP 148.72.164.38 > 10.8.2.5: ICMP echo reply, id 898, seq 24, length 64
08:25:04.055524 IP 10.8.2.5 > 148.72.164.38: ICMP echo request, id 898, seq 25, length 64
08:25:04.696965 IP 148.72.164.38 > 10.8.2.5: ICMP echo reply, id 898, seq 25, length 64
08:25:05.056554 IP 10.8.2.5 > 148.72.164.38: ICMP echo request, id 898, seq 26, length 64
08:25:05.697406 IP 148.72.164.38 > 10.8.2.5: ICMP echo reply, id 898, seq 26, length 64
08:25:06.056996 IP 10.8.2.5 > 148.72.164.38: ICMP echo request, id 898, seq 27, length 64
08:25:06.696891 IP 148.72.164.38 > 10.8.2.5: ICMP echo reply, id 898, seq 27, length 64
08:25:07.057489 IP 10.8.2.5 > 148.72.164.38: ICMP echo request, id 898, seq 28, length 64
08:25:07.697618 IP 148.72.164.38 > 10.8.2.5: ICMP echo reply, id 898, seq 28, length 64
08:25:08.058233 IP 10.8.2.5 > 148.72.164.38: ICMP echo request, id 898, seq 29, length 64
08:25:08.700955 IP 148.72.164.38 > 10.8.2.5: ICMP echo reply, id 898, seq 29, length 64
08:25:09.059540 IP 10.8.2.5 > 148.72.164.38: ICMP echo request, id 898, seq 30, length 64
08:25:09.697984 IP 148.72.164.38 > 10.8.2.5: ICMP echo reply, id 898, seq 30, length 64
08:25:10.060592 IP 10.8.2.5 > 148.72.164.38: ICMP echo request, id 898, seq 31, length 64
08:25:10.699069 IP 148.72.164.38 > 10.8.2.5: ICMP echo reply, id 898, seq 31, length 64
08:25:11.061662 IP 10.8.2.5 > 148.72.164.38: ICMP echo request, id 898, seq 32, length 64
08:25:11.700282 IP 148.72.164.38 > 10.8.2.5: ICMP echo reply, id 898, seq 32, length 64
08:25:12.062885 IP 10.8.2.5 > 148.72.164.38: ICMP echo request, id 898, seq 33, length 64
08:25:12.701347 IP 148.72.164.38 > 10.8.2.5: ICMP echo reply, id 898, seq 33, length 64
08:25:13.063957 IP 10.8.2.5 > 148.72.164.38: ICMP echo request, id 898, seq 34, length 64
08:25:13.702192 IP 148.72.164.38 > 10.8.2.5: ICMP echo reply, id 898, seq 34, length 64
08:25:14.064791 IP 10.8.2.5 > 148.72.164.38: ICMP echo request, id 898, seq 35, length 64
08:25:14.705877 IP 148.72.164.38 > 10.8.2.5: ICMP echo reply, id 898, seq 35, length 64
08:25:15.065482 IP 10.8.2.5 > 148.72.164.38: ICMP echo request, id 898, seq 36, length 64
08:25:15.708456 IP 148.72.164.38 > 10.8.2.5: ICMP echo reply, id 898, seq 36, length 64
08:25:16.066067 IP 10.8.2.5 > 148.72.164.38: ICMP echo request, id 898, seq 37, length 64
08:25:16.704504 IP 148.72.164.38 > 10.8.2.5: ICMP echo reply, id 898, seq 37, length 64
08:25:17.067108 IP 10.8.2.5 > 148.72.164.38: ICMP echo request, id 898, seq 38, length 64
08:25:17.705815 IP 148.72.164.38 > 10.8.2.5: ICMP echo reply, id 898, seq 38, length 64
08:25:18.068421 IP 10.8.2.5 > 148.72.164.38: ICMP echo request, id 898, seq 39, length 64
08:25:18.706830 IP 148.72.164.38 > 10.8.2.5: ICMP echo reply, id 898, seq 39, length 64
08:25:19.069441 IP 10.8.2.5 > 148.72.164.38: ICMP echo request, id 898, seq 40, length 64
08:25:19.708175 IP 148.72.164.38 > 10.8.2.5: ICMP echo reply, id 898, seq 40, length 64
08:25:20.070782 IP 10.8.2.5 > 148.72.164.38: ICMP echo request, id 898, seq 41, length 64
08:25:20.709099 IP 148.72.164.38 > 10.8.2.5: ICMP echo reply, id 898, seq 41, length 64
08:25:21.071706 IP 10.8.2.5 > 148.72.164.38: ICMP echo request, id 898, seq 42, length 64
08:25:21.712073 IP 148.72.164.38 > 10.8.2.5: ICMP echo reply, id 898, seq 42, length 64
08:25:22.072680 IP 10.8.2.5 > 148.72.164.38: ICMP echo request, id 898, seq 43, length 64
08:25:22.711213 IP 148.72.164.38 > 10.8.2.5: ICMP echo reply, id 898, seq 43, length 64
08:25:23.073813 IP 10.8.2.5 > 148.72.164.38: ICMP echo request, id 898, seq 44, length 64
08:25:23.712364 IP 148.72.164.38 > 10.8.2.5: ICMP echo reply, id 898, seq 44, length 64
08:25:24.074972 IP 10.8.2.5 > 148.72.164.38: ICMP echo request, id 898, seq 45, length 64
08:25:24.713242 IP 148.72.164.38 > 10.8.2.5: ICMP echo reply, id 898, seq 45, length 64
08:25:25.075853 IP 10.8.2.5 > 148.72.164.38: ICMP echo request, id 898, seq 46, length 64
08:25:25.716545 IP 148.72.164.38 > 10.8.2.5: ICMP echo reply, id 898, seq 46, length 64
08:25:26.077149 IP 10.8.2.5 > 148.72.164.38: ICMP echo request, id 898, seq 47, length 64
08:25:26.715823 IP 148.72.164.38 > 10.8.2.5: ICMP echo reply, id 898, seq 47, length 64
08:25:27.078433 IP 10.8.2.5 > 148.72.164.38: ICMP echo request, id 898, seq 48, length 64
08:25:27.717030 IP 148.72.164.38 > 10.8.2.5: ICMP echo reply, id 898, seq 48, length 64
08:25:28.079641 IP 10.8.2.5 > 148.72.164.38: ICMP echo request, id 898, seq 49, length 64
08:25:28.718735 IP 148.72.164.38 > 10.8.2.5: ICMP echo reply, id 898, seq 49, length 64
08:25:29.080350 IP 10.8.2.5 > 148.72.164.38: ICMP echo request, id 898, seq 50, length 64
08:25:29.719474 IP 148.72.164.38 > 10.8.2.5: ICMP echo reply, id 898, seq 50, length 64
08:25:30.081073 IP 10.8.2.5 > 148.72.164.38: ICMP echo request, id 898, seq 51, length 64
08:25:30.720583 IP 148.72.164.38 > 10.8.2.5: ICMP echo reply, id 898, seq 51, length 64
08:25:31.082196 IP 10.8.2.5 > 148.72.164.38: ICMP echo request, id 898, seq 52, length 64
08:25:31.720536 IP 148.72.164.38 > 10.8.2.5: ICMP echo reply, id 898, seq 52, length 64
08:25:32.083143 IP 10.8.2.5 > 148.72.164.38: ICMP echo request, id 898, seq 53, length 64
08:25:32.721446 IP 148.72.164.38 > 10.8.2.5: ICMP echo reply, id 898, seq 53, length 64
08:25:33.084056 IP 10.8.2.5 > 148.72.164.38: ICMP echo request, id 898, seq 54, length 64
08:25:33.722295 IP 148.72.164.38 > 10.8.2.5: ICMP echo reply, id 898, seq 54, length 64
08:25:34.084894 IP 10.8.2.5 > 148.72.164.38: ICMP echo request, id 898, seq 55, length 64
08:25:34.723128 IP 148.72.164.38 > 10.8.2.5: ICMP echo reply, id 898, seq 55, length 64
08:25:35.085731 IP 10.8.2.5 > 148.72.164.38: ICMP echo request, id 898, seq 56, length 64
08:25:35.723927 IP 148.72.164.38 > 10.8.2.5: ICMP echo reply, id 898, seq 56, length 64
08:25:36.086528 IP 10.8.2.5 > 148.72.164.38: ICMP echo request, id 898, seq 57, length 64
08:25:36.724620 IP 148.72.164.38 > 10.8.2.5: ICMP echo reply, id 898, seq 57, length 64
08:25:37.087225 IP 10.8.2.5 > 148.72.164.38: ICMP echo request, id 898, seq 58, length 64
08:25:37.725874 IP 148.72.164.38 > 10.8.2.5: ICMP echo reply, id 898, seq 58, length 64
08:25:38.088486 IP 10.8.2.5 > 148.72.164.38: ICMP echo request, id 898, seq 59, length 64
08:25:38.727485 IP 148.72.164.38 > 10.8.2.5: ICMP echo reply, id 898, seq 59, length 64
08:25:39.089087 IP 10.8.2.5 > 148.72.164.38: ICMP echo request, id 898, seq 60, length 64
