12:27:30.674706 IP 185.245.87.59 > 10.8.2.5: ICMP echo reply, id 1809, seq 2, length 64
12:27:31.275493 IP 10.8.2.5 > 185.245.87.59: ICMP echo request, id 1809, seq 3, length 64
12:27:31.675888 IP 185.245.87.59 > 10.8.2.5: ICMP echo reply, id 1809, seq 3, length 64
12:27:32.276734 IP 10.8.2.5 > 185.245.87.59: ICMP echo request, id 1809, seq 4, length 64
12:27:32.677186 IP 185.245.87.59 > 10.8.2.5: ICMP echo reply, id 1809, seq 4, length 64
12:27:33.278035 IP 10.8.2.5 > 185.245.87.59: ICMP echo request, id 1809, seq 5, length 64
12:27:33.678325 IP 185.245.87.59 > 10.8.2.5: ICMP echo reply, id 1809, seq 5, length 64
12:27:34.279169 IP 10.8.2.5 > 185.245.87.59: ICMP echo request, id 1809, seq 6, length 64
12:27:34.693573 IP 185.245.87.59 > 10.8.2.5: ICMP echo reply, id 1809, seq 6, length 64
12:27:35.280395 IP 10.8.2.5 > 185.245.87.59: ICMP echo request, id 1809, seq 7, length 64
12:27:35.680596 IP 185.245.87.59 > 10.8.2.5: ICMP echo reply, id 1809, seq 7, length 64
12:27:36.281387 IP 10.8.2.5 > 185.245.87.59: ICMP echo request, id 1809, seq 8, length 64
12:27:36.681614 IP 185.245.87.59 > 10.8.2.5: ICMP echo reply, id 1809, seq 8, length 64
12:27:37.282460 IP 10.8.2.5 > 185.245.87.59: ICMP echo request, id 1809, seq 9, length 64
12:27:37.682822 IP 185.245.87.59 > 10.8.2.5: ICMP echo reply, id 1809, seq 9, length 64
12:27:38.283656 IP 10.8.2.5 > 185.245.87.59: ICMP echo request, id 1809, seq 10, length 64
12:27:38.683795 IP 185.245.87.59 > 10.8.2.5: ICMP echo reply, id 1809, seq 10, length 64
12:27:39.284631 IP 10.8.2.5 > 185.245.87.59: ICMP echo request, id 1809, seq 11, length 64
12:27:39.684851 IP 185.245.87.59 > 10.8.2.5: ICMP echo reply, id 1809, seq 11, length 64
12:27:40.285683 IP 10.8.2.5 > 185.245.87.59: ICMP echo request, id 1809, seq 12, length 64
12:27:40.685915 IP 185.245.87.59 > 10.8.2.5: ICMP echo reply, id 1809, seq 12, length 64
12:27:41.286749 IP 10.8.2.5 > 185.245.87.59: ICMP echo request, id 1809, seq 13, length 64
12:27:41.687281 IP 185.245.87.59 > 10.8.2.5: ICMP echo reply, id 1809, seq 13, length 64
12:27:42.288114 IP 10.8.2.5 > 185.245.87.59: ICMP echo request, id 1809, seq 14, length 64
12:27:42.688485 IP 185.245.87.59 > 10.8.2.5: ICMP echo reply, id 1809, seq 14, length 64
12:27:43.289321 IP 10.8.2.5 > 185.245.87.59: ICMP echo request, id 1809, seq 15, length 64
12:27:43.689745 IP 185.245.87.59 > 10.8.2.5: ICMP echo reply, id 1809, seq 15, length 64
12:27:44.290588 IP 10.8.2.5 > 185.245.87.59: ICMP echo request, id 1809, seq 16, length 64
12:27:44.690928 IP 185.245.87.59 > 10.8.2.5: ICMP echo reply, id 1809, seq 16, length 64
12:27:45.291756 IP 10.8.2.5 > 185.245.87.59: ICMP echo request, id 1809, seq 17, length 64
12:27:45.691928 IP 185.245.87.59 > 10.8.2.5: ICMP echo reply, id 1809, seq 17, length 64
12:27:46.292761 IP 10.8.2.5 > 185.245.87.59: ICMP echo request, id 1809, seq 18, length 64
12:27:46.692919 IP 185.245.87.59 > 10.8.2.5: ICMP echo reply, id 1809, seq 18, length 64
12:27:47.293751 IP 10.8.2.5 > 185.245.87.59: ICMP echo request, id 1809, seq 19, length 64
12:27:47.694359 IP 185.245.87.59 > 10.8.2.5: ICMP echo reply, id 1809, seq 19, length 64
12:27:48.295188 IP 10.8.2.5 > 185.245.87.59: ICMP echo request, id 1809, seq 20, length 64
12:27:48.695389 IP 185.245.87.59 > 10.8.2.5: ICMP echo reply, id 1809, seq 20, length 64
12:27:49.296239 IP 10.8.2.5 > 185.245.87.59: ICMP echo request, id 1809, seq 21, length 64
12:27:49.696594 IP 185.245.87.59 > 10.8.2.5: ICMP echo reply, id 1809, seq 21, length 64
12:27:50.297428 IP 10.8.2.5 > 185.245.87.59: ICMP echo request, id 1809, seq 22, length 64
12:27:50.703806 IP 185.245.87.59 > 10.8.2.5: ICMP echo reply, id 1809, seq 22, length 64
12:27:51.298667 IP 10.8.2.5 > 185.245.87.59: ICMP echo request, id 1809, seq 23, length 64
12:27:51.699045 IP 185.245.87.59 > 10.8.2.5: ICMP echo reply, id 1809, seq 23, length 64
12:27:52.299879 IP 10.8.2.5 > 185.245.87.59: ICMP echo request, id 1809, seq 24, length 64
12:27:52.700315 IP 185.245.87.59 > 10.8.2.5: ICMP echo reply, id 1809, seq 24, length 64
12:27:53.301148 IP 10.8.2.5 > 185.245.87.59: ICMP echo request, id 1809, seq 25, length 64
12:27:53.701434 IP 185.245.87.59 > 10.8.2.5: ICMP echo reply, id 1809, seq 25, length 64
12:27:54.302240 IP 10.8.2.5 > 185.245.87.59: ICMP echo request, id 1809, seq 26, length 64
12:27:54.702685 IP 185.245.87.59 > 10.8.2.5: ICMP echo reply, id 1809, seq 26, length 64
12:27:55.303524 IP 10.8.2.5 > 185.245.87.59: ICMP echo request, id 1809, seq 27, length 64
12:27:55.703707 IP 185.245.87.59 > 10.8.2.5: ICMP echo reply, id 1809, seq 27, length 64
12:27:56.304540 IP 10.8.2.5 > 185.245.87.59: ICMP echo request, id 1809, seq 28, length 64
12:27:56.704689 IP 185.245.87.59 > 10.8.2.5: ICMP echo reply, id 1809, seq 28, length 64
12:27:57.305523 IP 10.8.2.5 > 185.245.87.59: ICMP echo request, id 1809, seq 29, length 64
12:27:57.706305 IP 185.245.87.59 > 10.8.2.5: ICMP echo reply, id 1809, seq 29, length 64
12:27:58.307148 IP 10.8.2.5 > 185.245.87.59: ICMP echo request, id 1809, seq 30, length 64
12:27:58.708671 IP 185.245.87.59 > 10.8.2.5: ICMP echo reply, id 1809, seq 30, length 64
12:27:59.308518 IP 10.8.2.5 > 185.245.87.59: ICMP echo request, id 1809, seq 31, length 64
12:27:59.709154 IP 185.245.87.59 > 10.8.2.5: ICMP echo reply, id 1809, seq 31, length 64
12:28:00.309989 IP 10.8.2.5 > 185.245.87.59: ICMP echo request, id 1809, seq 32, length 64
12:28:00.710219 IP 185.245.87.59 > 10.8.2.5: ICMP echo reply, id 1809, seq 32, length 64
12:28:01.311049 IP 10.8.2.5 > 185.245.87.59: ICMP echo request, id 1809, seq 33, length 64
12:28:01.711168 IP 185.245.87.59 > 10.8.2.5: ICMP echo reply, id 1809, seq 33, length 64
12:28:02.312001 IP 10.8.2.5 > 185.245.87.59: ICMP echo request, id 1809, seq 34, length 64
12:28:02.712586 IP 185.245.87.59 > 10.8.2.5: ICMP echo reply, id 1809, seq 34, length 64
12:28:03.313425 IP 10.8.2.5 > 185.245.87.59: ICMP echo request, id 1809, seq 35, length 64
12:28:03.714020 IP 185.245.87.59 > 10.8.2.5: ICMP echo reply, id 1809, seq 35, length 64
12:28:04.314872 IP 10.8.2.5 > 185.245.87.59: ICMP echo request, id 1809, seq 36, length 64
12:28:04.715170 IP 185.245.87.59 > 10.8.2.5: ICMP echo reply, id 1809, seq 36, length 64
12:28:05.316016 IP 10.8.2.5 > 185.245.87.59: ICMP echo request, id 1809, seq 37, length 64
12:28:05.716481 IP 185.245.87.59 > 10.8.2.5: ICMP echo reply, id 1809, seq 37, length 64
12:28:06.317327 IP 10.8.2.5 > 185.245.87.59: ICMP echo request, id 1809, seq 38, length 64
12:28:06.717681 IP 185.245.87.59 > 10.8.2.5: ICMP echo reply, id 1809, seq 38, length 64
12:28:07.318535 IP 10.8.2.5 > 185.245.87.59: ICMP echo request, id 1809, seq 39, length 64
12:28:07.718679 IP 185.245.87.59 > 10.8.2.5: ICMP echo reply, id 1809, seq 39, length 64
12:28:08.319516 IP 10.8.2.5 > 185.245.87.59: ICMP echo request, id 1809, seq 40, length 64
12:28:08.719889 IP 185.245.87.59 > 10.8.2.5: ICMP echo reply, id 1809, seq 40, length 64
12:28:09.320733 IP 10.8.2.5 > 185.245.87.59: ICMP echo request, id 1809, seq 41, length 64
12:28:09.721192 IP 185.245.87.59 > 10.8.2.5: ICMP echo reply, id 1809, seq 41, length 64
12:28:10.322034 IP 10.8.2.5 > 185.245.87.59: ICMP echo request, id 1809, seq 42, length 64
12:28:10.722333 IP 185.245.87.59 > 10.8.2.5: ICMP echo reply, id 1809, seq 42, length 64
12:28:11.323181 IP 10.8.2.5 > 185.245.87.59: ICMP echo request, id 1809, seq 43, length 64
12:28:11.723322 IP 185.245.87.59 > 10.8.2.5: ICMP echo reply, id 1809, seq 43, length 64
12:28:12.324159 IP 10.8.2.5 > 185.245.87.59: ICMP echo request, id 1809, seq 44, length 64
12:28:12.724722 IP 185.245.87.59 > 10.8.2.5: ICMP echo reply, id 1809, seq 44, length 64
12:28:13.325568 IP 10.8.2.5 > 185.245.87.59: ICMP echo request, id 1809, seq 45, length 64
12:28:13.725932 IP 185.245.87.59 > 10.8.2.5: ICMP echo reply, id 1809, seq 45, length 64
12:28:14.326767 IP 10.8.2.5 > 185.245.87.59: ICMP echo request, id 1809, seq 46, length 64
12:28:14.727065 IP 185.245.87.59 > 10.8.2.5: ICMP echo reply, id 1809, seq 46, length 64
12:28:15.327900 IP 10.8.2.5 > 185.245.87.59: ICMP echo request, id 1809, seq 47, length 64
12:28:15.740025 IP 185.245.87.59 > 10.8.2.5: ICMP echo reply, id 1809, seq 47, length 64
12:28:16.328849 IP 10.8.2.5 > 185.245.87.59: ICMP echo request, id 1809, seq 48, length 64
12:28:16.729232 IP 185.245.87.59 > 10.8.2.5: ICMP echo reply, id 1809, seq 48, length 64
12:28:17.330065 IP 10.8.2.5 > 185.245.87.59: ICMP echo request, id 1809, seq 49, length 64
12:28:17.730350 IP 185.245.87.59 > 10.8.2.5: ICMP echo reply, id 1809, seq 49, length 64
12:28:18.331193 IP 10.8.2.5 > 185.245.87.59: ICMP echo request, id 1809, seq 50, length 64
12:28:18.732016 IP 185.245.87.59 > 10.8.2.5: ICMP echo reply, id 1809, seq 50, length 64
12:28:19.332852 IP 10.8.2.5 > 185.245.87.59: ICMP echo request, id 1809, seq 51, length 64
12:28:19.733250 IP 185.245.87.59 > 10.8.2.5: ICMP echo reply, id 1809, seq 51, length 64
12:28:20.334083 IP 10.8.2.5 > 185.245.87.59: ICMP echo request, id 1809, seq 52, length 64
12:28:20.734483 IP 185.245.87.59 > 10.8.2.5: ICMP echo reply, id 1809, seq 52, length 64
12:28:21.335326 IP 10.8.2.5 > 185.245.87.59: ICMP echo request, id 1809, seq 53, length 64
12:28:21.735469 IP 185.245.87.59 > 10.8.2.5: ICMP echo reply, id 1809, seq 53, length 64
12:28:22.336300 IP 10.8.2.5 > 185.245.87.59: ICMP echo request, id 1809, seq 54, length 64
12:28:22.736861 IP 185.245.87.59 > 10.8.2.5: ICMP echo reply, id 1809, seq 54, length 64
12:28:23.337695 IP 10.8.2.5 > 185.245.87.59: ICMP echo request, id 1809, seq 55, length 64
12:28:23.738378 IP 185.245.87.59 > 10.8.2.5: ICMP echo reply, id 1809, seq 55, length 64
12:28:24.339220 IP 10.8.2.5 > 185.245.87.59: ICMP echo request, id 1809, seq 56, length 64
12:28:24.739281 IP 185.245.87.59 > 10.8.2.5: ICMP echo reply, id 1809, seq 56, length 64
12:28:25.340112 IP 10.8.2.5 > 185.245.87.59: ICMP echo request, id 1809, seq 57, length 64
12:28:25.740518 IP 185.245.87.59 > 10.8.2.5: ICMP echo reply, id 1809, seq 57, length 64
12:28:26.341351 IP 10.8.2.5 > 185.245.87.59: ICMP echo request, id 1809, seq 58, length 64
12:28:26.741952 IP 185.245.87.59 > 10.8.2.5: ICMP echo reply, id 1809, seq 58, length 64
12:28:27.342821 IP 10.8.2.5 > 185.245.87.59: ICMP echo request, id 1809, seq 59, length 64
12:28:27.743182 IP 185.245.87.59 > 10.8.2.5: ICMP echo reply, id 1809, seq 59, length 64
12:28:28.344017 IP 10.8.2.5 > 185.245.87.59: ICMP echo request, id 1809, seq 60, length 64
12:28:28.744857 IP 185.245.87.59 > 10.8.2.5: ICMP echo reply, id 1809, seq 60, length 64
12:28:29.344689 IP 10.8.2.5 > 185.245.87.59: ICMP echo request, id 1809, seq 61, length 64
12:28:29.744993 IP 185.245.87.59 > 10.8.2.5: ICMP echo reply, id 1809, seq 61, length 64
