22:14:58.750440 IP 10.8.0.59 > 125.212.220.51: ICMP echo request, id 932, seq 2, length 64
22:14:59.154258 IP 125.212.220.51 > 10.8.0.59: ICMP echo reply, id 932, seq 2, length 64
22:14:59.751086 IP 10.8.0.59 > 125.212.220.51: ICMP echo request, id 932, seq 3, length 64
22:15:00.154171 IP 125.212.220.51 > 10.8.0.59: ICMP echo reply, id 932, seq 3, length 64
22:15:00.751018 IP 10.8.0.59 > 125.212.220.51: ICMP echo request, id 932, seq 4, length 64
22:15:01.153913 IP 125.212.220.51 > 10.8.0.59: ICMP echo reply, id 932, seq 4, length 64
22:15:01.750749 IP 10.8.0.59 > 125.212.220.51: ICMP echo request, id 932, seq 5, length 64
22:15:02.153929 IP 125.212.220.51 > 10.8.0.59: ICMP echo reply, id 932, seq 5, length 64
22:15:02.750764 IP 10.8.0.59 > 125.212.220.51: ICMP echo request, id 932, seq 6, length 64
22:15:03.155491 IP 125.212.220.51 > 10.8.0.59: ICMP echo reply, id 932, seq 6, length 64
22:15:03.751321 IP 10.8.0.59 > 125.212.220.51: ICMP echo request, id 932, seq 7, length 64
22:15:04.156117 IP 125.212.220.51 > 10.8.0.59: ICMP echo reply, id 932, seq 7, length 64
22:15:04.751961 IP 10.8.0.59 > 125.212.220.51: ICMP echo request, id 932, seq 8, length 64
22:15:05.154764 IP 125.212.220.51 > 10.8.0.59: ICMP echo reply, id 932, seq 8, length 64
22:15:05.752198 IP 10.8.0.59 > 125.212.220.51: ICMP echo request, id 932, seq 9, length 64
22:15:06.155910 IP 125.212.220.51 > 10.8.0.59: ICMP echo reply, id 932, seq 9, length 64
22:15:06.752753 IP 10.8.0.59 > 125.212.220.51: ICMP echo request, id 932, seq 10, length 64
22:15:07.155496 IP 125.212.220.51 > 10.8.0.59: ICMP echo reply, id 932, seq 10, length 64
22:15:07.753335 IP 10.8.0.59 > 125.212.220.51: ICMP echo request, id 932, seq 11, length 64
22:15:08.156692 IP 125.212.220.51 > 10.8.0.59: ICMP echo reply, id 932, seq 11, length 64
22:15:08.753527 IP 10.8.0.59 > 125.212.220.51: ICMP echo request, id 932, seq 12, length 64
22:15:09.159857 IP 125.212.220.51 > 10.8.0.59: ICMP echo reply, id 932, seq 12, length 64
22:15:09.753699 IP 10.8.0.59 > 125.212.220.51: ICMP echo request, id 932, seq 13, length 64
22:15:10.158027 IP 125.212.220.51 > 10.8.0.59: ICMP echo reply, id 932, seq 13, length 64
22:15:10.753862 IP 10.8.0.59 > 125.212.220.51: ICMP echo request, id 932, seq 14, length 64
22:15:11.157093 IP 125.212.220.51 > 10.8.0.59: ICMP echo reply, id 932, seq 14, length 64
22:15:11.753931 IP 10.8.0.59 > 125.212.220.51: ICMP echo request, id 932, seq 15, length 64
22:15:12.159032 IP 125.212.220.51 > 10.8.0.59: ICMP echo reply, id 932, seq 15, length 64
22:15:12.753869 IP 10.8.0.59 > 125.212.220.51: ICMP echo request, id 932, seq 16, length 64
22:15:13.156435 IP 125.212.220.51 > 10.8.0.59: ICMP echo reply, id 932, seq 16, length 64
22:15:13.754272 IP 10.8.0.59 > 125.212.220.51: ICMP echo request, id 932, seq 17, length 64
22:15:14.163809 IP 125.212.220.51 > 10.8.0.59: ICMP echo reply, id 932, seq 17, length 64
22:15:14.754605 IP 10.8.0.59 > 125.212.220.51: ICMP echo request, id 932, seq 18, length 64
22:15:15.159013 IP 125.212.220.51 > 10.8.0.59: ICMP echo reply, id 932, seq 18, length 64
22:15:15.754841 IP 10.8.0.59 > 125.212.220.51: ICMP echo request, id 932, seq 19, length 64
22:15:16.158048 IP 125.212.220.51 > 10.8.0.59: ICMP echo reply, id 932, seq 19, length 64
22:15:16.754880 IP 10.8.0.59 > 125.212.220.51: ICMP echo request, id 932, seq 20, length 64
22:15:17.163424 IP 125.212.220.51 > 10.8.0.59: ICMP echo reply, id 932, seq 20, length 64
22:15:17.755246 IP 10.8.0.59 > 125.212.220.51: ICMP echo request, id 932, seq 21, length 64
22:15:18.157810 IP 125.212.220.51 > 10.8.0.59: ICMP echo reply, id 932, seq 21, length 64
22:15:18.755643 IP 10.8.0.59 > 125.212.220.51: ICMP echo request, id 932, seq 22, length 64
22:15:19.160458 IP 125.212.220.51 > 10.8.0.59: ICMP echo reply, id 932, seq 22, length 64
22:15:19.756294 IP 10.8.0.59 > 125.212.220.51: ICMP echo request, id 932, seq 23, length 64
22:15:20.159434 IP 125.212.220.51 > 10.8.0.59: ICMP echo reply, id 932, seq 23, length 64
22:15:20.756278 IP 10.8.0.59 > 125.212.220.51: ICMP echo request, id 932, seq 24, length 64
22:15:21.159351 IP 125.212.220.51 > 10.8.0.59: ICMP echo reply, id 932, seq 24, length 64
22:15:21.756214 IP 10.8.0.59 > 125.212.220.51: ICMP echo request, id 932, seq 25, length 64
22:15:22.165768 IP 125.212.220.51 > 10.8.0.59: ICMP echo reply, id 932, seq 25, length 64
22:15:22.756595 IP 10.8.0.59 > 125.212.220.51: ICMP echo request, id 932, seq 26, length 64
22:15:23.160027 IP 125.212.220.51 > 10.8.0.59: ICMP echo reply, id 932, seq 26, length 64
22:15:23.756853 IP 10.8.0.59 > 125.212.220.51: ICMP echo request, id 932, seq 27, length 64
22:15:24.172275 IP 125.212.220.51 > 10.8.0.59: ICMP echo reply, id 932, seq 27, length 64
22:15:24.757092 IP 10.8.0.59 > 125.212.220.51: ICMP echo request, id 932, seq 28, length 64
22:15:25.160398 IP 125.212.220.51 > 10.8.0.59: ICMP echo reply, id 932, seq 28, length 64
22:15:25.757230 IP 10.8.0.59 > 125.212.220.51: ICMP echo request, id 932, seq 29, length 64
22:15:26.159910 IP 125.212.220.51 > 10.8.0.59: ICMP echo reply, id 932, seq 29, length 64
22:15:26.757742 IP 10.8.0.59 > 125.212.220.51: ICMP echo request, id 932, seq 30, length 64
22:15:27.160795 IP 125.212.220.51 > 10.8.0.59: ICMP echo reply, id 932, seq 30, length 64
22:15:27.757630 IP 10.8.0.59 > 125.212.220.51: ICMP echo request, id 932, seq 31, length 64
22:15:28.160772 IP 125.212.220.51 > 10.8.0.59: ICMP echo reply, id 932, seq 31, length 64
22:15:28.757602 IP 10.8.0.59 > 125.212.220.51: ICMP echo request, id 932, seq 32, length 64
22:15:29.160568 IP 125.212.220.51 > 10.8.0.59: ICMP echo reply, id 932, seq 32, length 64
22:15:29.757393 IP 10.8.0.59 > 125.212.220.51: ICMP echo request, id 932, seq 33, length 64
22:15:30.160320 IP 125.212.220.51 > 10.8.0.59: ICMP echo reply, id 932, seq 33, length 64
22:15:30.757152 IP 10.8.0.59 > 125.212.220.51: ICMP echo request, id 932, seq 34, length 64
22:15:31.159553 IP 125.212.220.51 > 10.8.0.59: ICMP echo reply, id 932, seq 34, length 64
22:15:31.757383 IP 10.8.0.59 > 125.212.220.51: ICMP echo request, id 932, seq 35, length 64
22:15:32.160220 IP 125.212.220.51 > 10.8.0.59: ICMP echo reply, id 932, seq 35, length 64
22:15:32.757043 IP 10.8.0.59 > 125.212.220.51: ICMP echo request, id 932, seq 36, length 64
22:15:33.166515 IP 125.212.220.51 > 10.8.0.59: ICMP echo reply, id 932, seq 36, length 64
22:15:33.757342 IP 10.8.0.59 > 125.212.220.51: ICMP echo request, id 932, seq 37, length 64
22:15:34.159882 IP 125.212.220.51 > 10.8.0.59: ICMP echo reply, id 932, seq 37, length 64
22:15:34.757713 IP 10.8.0.59 > 125.212.220.51: ICMP echo request, id 932, seq 38, length 64
22:15:35.218660 IP 125.212.220.51 > 10.8.0.59: ICMP echo reply, id 932, seq 38, length 64
22:15:35.757432 IP 10.8.0.59 > 125.212.220.51: ICMP echo request, id 932, seq 39, length 64
22:15:36.160333 IP 125.212.220.51 > 10.8.0.59: ICMP echo reply, id 932, seq 39, length 64
22:15:36.757113 IP 10.8.0.59 > 125.212.220.51: ICMP echo request, id 932, seq 40, length 64
22:15:37.159882 IP 125.212.220.51 > 10.8.0.59: ICMP echo reply, id 932, seq 40, length 64
22:15:37.757733 IP 10.8.0.59 > 125.212.220.51: ICMP echo request, id 932, seq 41, length 64
22:15:38.160125 IP 125.212.220.51 > 10.8.0.59: ICMP echo reply, id 932, seq 41, length 64
22:15:38.757947 IP 10.8.0.59 > 125.212.220.51: ICMP echo request, id 932, seq 42, length 64
22:15:39.160819 IP 125.212.220.51 > 10.8.0.59: ICMP echo reply, id 932, seq 42, length 64
22:15:39.757662 IP 10.8.0.59 > 125.212.220.51: ICMP echo request, id 932, seq 43, length 64
22:15:40.160866 IP 125.212.220.51 > 10.8.0.59: ICMP echo reply, id 932, seq 43, length 64
22:15:40.757703 IP 10.8.0.59 > 125.212.220.51: ICMP echo request, id 932, seq 44, length 64
22:15:41.160660 IP 125.212.220.51 > 10.8.0.59: ICMP echo reply, id 932, seq 44, length 64
22:15:41.757493 IP 10.8.0.59 > 125.212.220.51: ICMP echo request, id 932, seq 45, length 64
22:15:42.163694 IP 125.212.220.51 > 10.8.0.59: ICMP echo reply, id 932, seq 45, length 64
22:15:42.757532 IP 10.8.0.59 > 125.212.220.51: ICMP echo request, id 932, seq 46, length 64
22:15:43.160273 IP 125.212.220.51 > 10.8.0.59: ICMP echo reply, id 932, seq 46, length 64
22:15:43.758105 IP 10.8.0.59 > 125.212.220.51: ICMP echo request, id 932, seq 47, length 64
22:15:44.160849 IP 125.212.220.51 > 10.8.0.59: ICMP echo reply, id 932, seq 47, length 64
22:15:44.758683 IP 10.8.0.59 > 125.212.220.51: ICMP echo request, id 932, seq 48, length 64
22:15:45.161777 IP 125.212.220.51 > 10.8.0.59: ICMP echo reply, id 932, seq 48, length 64
22:15:45.758609 IP 10.8.0.59 > 125.212.220.51: ICMP echo request, id 932, seq 49, length 64
22:15:46.161261 IP 125.212.220.51 > 10.8.0.59: ICMP echo reply, id 932, seq 49, length 64
22:15:46.759089 IP 10.8.0.59 > 125.212.220.51: ICMP echo request, id 932, seq 50, length 64
22:15:47.162821 IP 125.212.220.51 > 10.8.0.59: ICMP echo reply, id 932, seq 50, length 64
22:15:47.759656 IP 10.8.0.59 > 125.212.220.51: ICMP echo request, id 932, seq 51, length 64
22:15:48.162218 IP 125.212.220.51 > 10.8.0.59: ICMP echo reply, id 932, seq 51, length 64
22:15:48.760039 IP 10.8.0.59 > 125.212.220.51: ICMP echo request, id 932, seq 52, length 64
22:15:49.163284 IP 125.212.220.51 > 10.8.0.59: ICMP echo reply, id 932, seq 52, length 64
22:15:49.760139 IP 10.8.0.59 > 125.212.220.51: ICMP echo request, id 932, seq 53, length 64
22:15:50.162622 IP 125.212.220.51 > 10.8.0.59: ICMP echo reply, id 932, seq 53, length 64
22:15:50.760447 IP 10.8.0.59 > 125.212.220.51: ICMP echo request, id 932, seq 54, length 64
22:15:51.163429 IP 125.212.220.51 > 10.8.0.59: ICMP echo reply, id 932, seq 54, length 64
22:15:51.760263 IP 10.8.0.59 > 125.212.220.51: ICMP echo request, id 932, seq 55, length 64
22:15:52.164805 IP 125.212.220.51 > 10.8.0.59: ICMP echo reply, id 932, seq 55, length 64
22:15:52.760637 IP 10.8.0.59 > 125.212.220.51: ICMP echo request, id 932, seq 56, length 64
