12:45:06.914476 IP 10.8.2.5 > 185.65.50.11: ICMP echo request, id 1880, seq 1, length 64
12:45:07.207168 IP 185.65.50.11 > 10.8.2.5: ICMP echo reply, id 1880, seq 1, length 64
12:45:07.914091 IP 10.8.2.5 > 185.65.50.11: ICMP echo request, id 1880, seq 2, length 64
12:45:08.206470 IP 185.65.50.11 > 10.8.2.5: ICMP echo reply, id 1880, seq 2, length 64
12:45:08.914228 IP 10.8.2.5 > 185.65.50.11: ICMP echo request, id 1880, seq 3, length 64
12:45:09.206918 IP 185.65.50.11 > 10.8.2.5: ICMP echo reply, id 1880, seq 3, length 64
12:45:09.914864 IP 10.8.2.5 > 185.65.50.11: ICMP echo request, id 1880, seq 4, length 64
12:45:10.207368 IP 185.65.50.11 > 10.8.2.5: ICMP echo reply, id 1880, seq 4, length 64
12:45:10.915303 IP 10.8.2.5 > 185.65.50.11: ICMP echo request, id 1880, seq 5, length 64
12:45:11.207811 IP 185.65.50.11 > 10.8.2.5: ICMP echo reply, id 1880, seq 5, length 64
12:45:11.915749 IP 10.8.2.5 > 185.65.50.11: ICMP echo request, id 1880, seq 6, length 64
12:45:12.207999 IP 185.65.50.11 > 10.8.2.5: ICMP echo reply, id 1880, seq 6, length 64
12:45:12.915937 IP 10.8.2.5 > 185.65.50.11: ICMP echo request, id 1880, seq 7, length 64
12:45:13.208497 IP 185.65.50.11 > 10.8.2.5: ICMP echo reply, id 1880, seq 7, length 64
12:45:13.916444 IP 10.8.2.5 > 185.65.50.11: ICMP echo request, id 1880, seq 8, length 64
12:45:14.209578 IP 185.65.50.11 > 10.8.2.5: ICMP echo reply, id 1880, seq 8, length 64
12:45:14.916511 IP 10.8.2.5 > 185.65.50.11: ICMP echo request, id 1880, seq 9, length 64
12:45:15.209048 IP 185.65.50.11 > 10.8.2.5: ICMP echo reply, id 1880, seq 9, length 64
12:45:15.916988 IP 10.8.2.5 > 185.65.50.11: ICMP echo request, id 1880, seq 10, length 64
12:45:16.209230 IP 185.65.50.11 > 10.8.2.5: ICMP echo reply, id 1880, seq 10, length 64
12:45:16.917165 IP 10.8.2.5 > 185.65.50.11: ICMP echo request, id 1880, seq 11, length 64
12:45:17.209969 IP 185.65.50.11 > 10.8.2.5: ICMP echo reply, id 1880, seq 11, length 64
12:45:17.916945 IP 10.8.2.5 > 185.65.50.11: ICMP echo request, id 1880, seq 12, length 64
12:45:18.209821 IP 185.65.50.11 > 10.8.2.5: ICMP echo reply, id 1880, seq 12, length 64
12:45:18.916778 IP 10.8.2.5 > 185.65.50.11: ICMP echo request, id 1880, seq 13, length 64
12:45:19.209228 IP 185.65.50.11 > 10.8.2.5: ICMP echo reply, id 1880, seq 13, length 64
12:45:19.917189 IP 10.8.2.5 > 185.65.50.11: ICMP echo request, id 1880, seq 14, length 64
12:45:20.209610 IP 185.65.50.11 > 10.8.2.5: ICMP echo reply, id 1880, seq 14, length 64
12:45:20.917596 IP 10.8.2.5 > 185.65.50.11: ICMP echo request, id 1880, seq 15, length 64
12:45:21.210360 IP 185.65.50.11 > 10.8.2.5: ICMP echo reply, id 1880, seq 15, length 64
12:45:21.918313 IP 10.8.2.5 > 185.65.50.11: ICMP echo request, id 1880, seq 16, length 64
12:45:22.210829 IP 185.65.50.11 > 10.8.2.5: ICMP echo reply, id 1880, seq 16, length 64
12:45:22.918795 IP 10.8.2.5 > 185.65.50.11: ICMP echo request, id 1880, seq 17, length 64
12:45:23.211530 IP 185.65.50.11 > 10.8.2.5: ICMP echo reply, id 1880, seq 17, length 64
12:45:23.919472 IP 10.8.2.5 > 185.65.50.11: ICMP echo request, id 1880, seq 18, length 64
12:45:24.212229 IP 185.65.50.11 > 10.8.2.5: ICMP echo reply, id 1880, seq 18, length 64
12:45:24.920169 IP 10.8.2.5 > 185.65.50.11: ICMP echo request, id 1880, seq 19, length 64
12:45:25.212786 IP 185.65.50.11 > 10.8.2.5: ICMP echo reply, id 1880, seq 19, length 64
12:45:25.920736 IP 10.8.2.5 > 185.65.50.11: ICMP echo request, id 1880, seq 20, length 64
12:45:26.213276 IP 185.65.50.11 > 10.8.2.5: ICMP echo reply, id 1880, seq 20, length 64
12:45:26.921218 IP 10.8.2.5 > 185.65.50.11: ICMP echo request, id 1880, seq 21, length 64
12:45:27.213885 IP 185.65.50.11 > 10.8.2.5: ICMP echo reply, id 1880, seq 21, length 64
12:45:27.921803 IP 10.8.2.5 > 185.65.50.11: ICMP echo request, id 1880, seq 22, length 64
12:45:28.214762 IP 185.65.50.11 > 10.8.2.5: ICMP echo reply, id 1880, seq 22, length 64
12:45:28.921705 IP 10.8.2.5 > 185.65.50.11: ICMP echo request, id 1880, seq 23, length 64
12:45:29.220429 IP 185.65.50.11 > 10.8.2.5: ICMP echo reply, id 1880, seq 23, length 64
12:45:29.922363 IP 10.8.2.5 > 185.65.50.11: ICMP echo request, id 1880, seq 24, length 64
12:45:30.214845 IP 185.65.50.11 > 10.8.2.5: ICMP echo reply, id 1880, seq 24, length 64
12:45:30.922796 IP 10.8.2.5 > 185.65.50.11: ICMP echo request, id 1880, seq 25, length 64
12:45:31.215313 IP 185.65.50.11 > 10.8.2.5: ICMP echo reply, id 1880, seq 25, length 64
12:45:31.923270 IP 10.8.2.5 > 185.65.50.11: ICMP echo request, id 1880, seq 26, length 64
12:45:32.215899 IP 185.65.50.11 > 10.8.2.5: ICMP echo reply, id 1880, seq 26, length 64
12:45:32.923843 IP 10.8.2.5 > 185.65.50.11: ICMP echo request, id 1880, seq 27, length 64
12:45:33.216251 IP 185.65.50.11 > 10.8.2.5: ICMP echo reply, id 1880, seq 27, length 64
12:45:33.924194 IP 10.8.2.5 > 185.65.50.11: ICMP echo request, id 1880, seq 28, length 64
12:45:34.216737 IP 185.65.50.11 > 10.8.2.5: ICMP echo reply, id 1880, seq 28, length 64
12:45:34.924673 IP 10.8.2.5 > 185.65.50.11: ICMP echo request, id 1880, seq 29, length 64
12:45:35.217317 IP 185.65.50.11 > 10.8.2.5: ICMP echo reply, id 1880, seq 29, length 64
12:45:35.925251 IP 10.8.2.5 > 185.65.50.11: ICMP echo request, id 1880, seq 30, length 64
12:45:36.217786 IP 185.65.50.11 > 10.8.2.5: ICMP echo reply, id 1880, seq 30, length 64
12:45:36.925738 IP 10.8.2.5 > 185.65.50.11: ICMP echo request, id 1880, seq 31, length 64
12:45:37.218513 IP 185.65.50.11 > 10.8.2.5: ICMP echo reply, id 1880, seq 31, length 64
12:45:37.926451 IP 10.8.2.5 > 185.65.50.11: ICMP echo request, id 1880, seq 32, length 64
12:45:38.219125 IP 185.65.50.11 > 10.8.2.5: ICMP echo reply, id 1880, seq 32, length 64
12:45:38.927066 IP 10.8.2.5 > 185.65.50.11: ICMP echo request, id 1880, seq 33, length 64
12:45:39.219529 IP 185.65.50.11 > 10.8.2.5: ICMP echo reply, id 1880, seq 33, length 64
12:45:39.927462 IP 10.8.2.5 > 185.65.50.11: ICMP echo request, id 1880, seq 34, length 64
12:45:40.220064 IP 185.65.50.11 > 10.8.2.5: ICMP echo reply, id 1880, seq 34, length 64
12:45:40.928001 IP 10.8.2.5 > 185.65.50.11: ICMP echo request, id 1880, seq 35, length 64
12:45:41.220646 IP 185.65.50.11 > 10.8.2.5: ICMP echo reply, id 1880, seq 35, length 64
12:45:41.928585 IP 10.8.2.5 > 185.65.50.11: ICMP echo request, id 1880, seq 36, length 64
12:45:42.220932 IP 185.65.50.11 > 10.8.2.5: ICMP echo reply, id 1880, seq 36, length 64
12:45:42.928872 IP 10.8.2.5 > 185.65.50.11: ICMP echo request, id 1880, seq 37, length 64
12:45:43.221570 IP 185.65.50.11 > 10.8.2.5: ICMP echo reply, id 1880, seq 37, length 64
12:45:43.929506 IP 10.8.2.5 > 185.65.50.11: ICMP echo request, id 1880, seq 38, length 64
12:45:44.222157 IP 185.65.50.11 > 10.8.2.5: ICMP echo reply, id 1880, seq 38, length 64
12:45:44.930126 IP 10.8.2.5 > 185.65.50.11: ICMP echo request, id 1880, seq 39, length 64
12:45:45.222698 IP 185.65.50.11 > 10.8.2.5: ICMP echo reply, id 1880, seq 39, length 64
12:45:45.930650 IP 10.8.2.5 > 185.65.50.11: ICMP echo request, id 1880, seq 40, length 64
12:45:46.223121 IP 185.65.50.11 > 10.8.2.5: ICMP echo reply, id 1880, seq 40, length 64
12:45:46.931056 IP 10.8.2.5 > 185.65.50.11: ICMP echo request, id 1880, seq 41, length 64
12:45:47.223673 IP 185.65.50.11 > 10.8.2.5: ICMP echo reply, id 1880, seq 41, length 64
12:45:47.931626 IP 10.8.2.5 > 185.65.50.11: ICMP echo request, id 1880, seq 42, length 64
12:45:48.224012 IP 185.65.50.11 > 10.8.2.5: ICMP echo reply, id 1880, seq 42, length 64
12:45:48.931949 IP 10.8.2.5 > 185.65.50.11: ICMP echo request, id 1880, seq 43, length 64
12:45:49.224573 IP 185.65.50.11 > 10.8.2.5: ICMP echo reply, id 1880, seq 43, length 64
12:45:49.932511 IP 10.8.2.5 > 185.65.50.11: ICMP echo request, id 1880, seq 44, length 64
12:45:50.224891 IP 185.65.50.11 > 10.8.2.5: ICMP echo reply, id 1880, seq 44, length 64
12:45:50.932817 IP 10.8.2.5 > 185.65.50.11: ICMP echo request, id 1880, seq 45, length 64
12:45:51.225365 IP 185.65.50.11 > 10.8.2.5: ICMP echo reply, id 1880, seq 45, length 64
12:45:51.933302 IP 10.8.2.5 > 185.65.50.11: ICMP echo request, id 1880, seq 46, length 64
12:45:52.225813 IP 185.65.50.11 > 10.8.2.5: ICMP echo reply, id 1880, seq 46, length 64
12:45:52.933746 IP 10.8.2.5 > 185.65.50.11: ICMP echo request, id 1880, seq 47, length 64
12:45:53.226271 IP 185.65.50.11 > 10.8.2.5: ICMP echo reply, id 1880, seq 47, length 64
12:45:53.934221 IP 10.8.2.5 > 185.65.50.11: ICMP echo request, id 1880, seq 48, length 64
12:45:54.226544 IP 185.65.50.11 > 10.8.2.5: ICMP echo reply, id 1880, seq 48, length 64
12:45:54.934481 IP 10.8.2.5 > 185.65.50.11: ICMP echo request, id 1880, seq 49, length 64
12:45:55.227229 IP 185.65.50.11 > 10.8.2.5: ICMP echo reply, id 1880, seq 49, length 64
12:45:55.935155 IP 10.8.2.5 > 185.65.50.11: ICMP echo request, id 1880, seq 50, length 64
12:45:56.227592 IP 185.65.50.11 > 10.8.2.5: ICMP echo reply, id 1880, seq 50, length 64
12:45:56.935525 IP 10.8.2.5 > 185.65.50.11: ICMP echo request, id 1880, seq 51, length 64
12:45:57.229493 IP 185.65.50.11 > 10.8.2.5: ICMP echo reply, id 1880, seq 51, length 64
12:45:57.935417 IP 10.8.2.5 > 185.65.50.11: ICMP echo request, id 1880, seq 52, length 64
12:45:58.231767 IP 185.65.50.11 > 10.8.2.5: ICMP echo reply, id 1880, seq 52, length 64
12:45:58.935697 IP 10.8.2.5 > 185.65.50.11: ICMP echo request, id 1880, seq 53, length 64
12:45:59.228178 IP 185.65.50.11 > 10.8.2.5: ICMP echo reply, id 1880, seq 53, length 64
12:45:59.936120 IP 10.8.2.5 > 185.65.50.11: ICMP echo request, id 1880, seq 54, length 64
12:46:00.230890 IP 185.65.50.11 > 10.8.2.5: ICMP echo reply, id 1880, seq 54, length 64
12:46:00.936831 IP 10.8.2.5 > 185.65.50.11: ICMP echo request, id 1880, seq 55, length 64
12:46:01.234387 IP 185.65.50.11 > 10.8.2.5: ICMP echo reply, id 1880, seq 55, length 64
12:46:01.937337 IP 10.8.2.5 > 185.65.50.11: ICMP echo request, id 1880, seq 56, length 64
12:46:02.229815 IP 185.65.50.11 > 10.8.2.5: ICMP echo reply, id 1880, seq 56, length 64
12:46:02.937770 IP 10.8.2.5 > 185.65.50.11: ICMP echo request, id 1880, seq 57, length 64
12:46:03.230158 IP 185.65.50.11 > 10.8.2.5: ICMP echo reply, id 1880, seq 57, length 64
12:46:03.938123 IP 10.8.2.5 > 185.65.50.11: ICMP echo request, id 1880, seq 58, length 64
12:46:04.230869 IP 185.65.50.11 > 10.8.2.5: ICMP echo reply, id 1880, seq 58, length 64
12:46:04.938806 IP 10.8.2.5 > 185.65.50.11: ICMP echo request, id 1880, seq 59, length 64
12:46:05.231548 IP 185.65.50.11 > 10.8.2.5: ICMP echo reply, id 1880, seq 59, length 64
12:46:05.939488 IP 10.8.2.5 > 185.65.50.11: ICMP echo request, id 1880, seq 60, length 64
