00:24:52.691086 IP 10.8.3.8 > 84.17.41.130: ICMP echo request, id 2253, seq 1, length 64
00:24:53.156156 IP 84.17.41.130 > 10.8.3.8: ICMP echo reply, id 2253, seq 1, length 64
00:24:53.690620 IP 10.8.3.8 > 84.17.41.130: ICMP echo request, id 2253, seq 2, length 64
00:24:54.155808 IP 84.17.41.130 > 10.8.3.8: ICMP echo reply, id 2253, seq 2, length 64
00:24:54.690604 IP 10.8.3.8 > 84.17.41.130: ICMP echo request, id 2253, seq 3, length 64
00:24:55.155823 IP 84.17.41.130 > 10.8.3.8: ICMP echo reply, id 2253, seq 3, length 64
00:24:55.690594 IP 10.8.3.8 > 84.17.41.130: ICMP echo request, id 2253, seq 4, length 64
00:24:56.155809 IP 84.17.41.130 > 10.8.3.8: ICMP echo reply, id 2253, seq 4, length 64
00:24:56.690577 IP 10.8.3.8 > 84.17.41.130: ICMP echo request, id 2253, seq 5, length 64
00:24:57.155622 IP 84.17.41.130 > 10.8.3.8: ICMP echo reply, id 2253, seq 5, length 64
00:24:57.690390 IP 10.8.3.8 > 84.17.41.130: ICMP echo request, id 2253, seq 6, length 64
00:24:58.155438 IP 84.17.41.130 > 10.8.3.8: ICMP echo reply, id 2253, seq 6, length 64
00:24:58.690202 IP 10.8.3.8 > 84.17.41.130: ICMP echo request, id 2253, seq 7, length 64
00:24:59.155299 IP 84.17.41.130 > 10.8.3.8: ICMP echo reply, id 2253, seq 7, length 64
00:24:59.690063 IP 10.8.3.8 > 84.17.41.130: ICMP echo request, id 2253, seq 8, length 64
00:25:00.155267 IP 84.17.41.130 > 10.8.3.8: ICMP echo reply, id 2253, seq 8, length 64
00:25:00.690042 IP 10.8.3.8 > 84.17.41.130: ICMP echo request, id 2253, seq 9, length 64
00:25:01.154937 IP 84.17.41.130 > 10.8.3.8: ICMP echo reply, id 2253, seq 9, length 64
00:25:01.689701 IP 10.8.3.8 > 84.17.41.130: ICMP echo request, id 2253, seq 10, length 64
00:25:02.154799 IP 84.17.41.130 > 10.8.3.8: ICMP echo reply, id 2253, seq 10, length 64
00:25:02.689564 IP 10.8.3.8 > 84.17.41.130: ICMP echo request, id 2253, seq 11, length 64
00:25:03.154813 IP 84.17.41.130 > 10.8.3.8: ICMP echo reply, id 2253, seq 11, length 64
00:25:03.689580 IP 10.8.3.8 > 84.17.41.130: ICMP echo request, id 2253, seq 12, length 64
00:25:04.154836 IP 84.17.41.130 > 10.8.3.8: ICMP echo reply, id 2253, seq 12, length 64
00:25:04.689610 IP 10.8.3.8 > 84.17.41.130: ICMP echo request, id 2253, seq 13, length 64
00:25:05.154631 IP 84.17.41.130 > 10.8.3.8: ICMP echo reply, id 2253, seq 13, length 64
00:25:05.689397 IP 10.8.3.8 > 84.17.41.130: ICMP echo request, id 2253, seq 14, length 64
00:25:06.154236 IP 84.17.41.130 > 10.8.3.8: ICMP echo reply, id 2253, seq 14, length 64
00:25:06.689000 IP 10.8.3.8 > 84.17.41.130: ICMP echo request, id 2253, seq 15, length 64
00:25:07.153916 IP 84.17.41.130 > 10.8.3.8: ICMP echo reply, id 2253, seq 15, length 64
00:25:07.688685 IP 10.8.3.8 > 84.17.41.130: ICMP echo request, id 2253, seq 16, length 64
00:25:08.153937 IP 84.17.41.130 > 10.8.3.8: ICMP echo reply, id 2253, seq 16, length 64
00:25:08.688707 IP 10.8.3.8 > 84.17.41.130: ICMP echo request, id 2253, seq 17, length 64
00:25:09.153728 IP 84.17.41.130 > 10.8.3.8: ICMP echo reply, id 2253, seq 17, length 64
00:25:09.688499 IP 10.8.3.8 > 84.17.41.130: ICMP echo request, id 2253, seq 18, length 64
00:25:10.153516 IP 84.17.41.130 > 10.8.3.8: ICMP echo reply, id 2253, seq 18, length 64
00:25:10.688289 IP 10.8.3.8 > 84.17.41.130: ICMP echo request, id 2253, seq 19, length 64
00:25:11.153566 IP 84.17.41.130 > 10.8.3.8: ICMP echo reply, id 2253, seq 19, length 64
00:25:11.688334 IP 10.8.3.8 > 84.17.41.130: ICMP echo request, id 2253, seq 20, length 64
00:25:12.153212 IP 84.17.41.130 > 10.8.3.8: ICMP echo reply, id 2253, seq 20, length 64
00:25:12.687983 IP 10.8.3.8 > 84.17.41.130: ICMP echo request, id 2253, seq 21, length 64
00:25:13.153253 IP 84.17.41.130 > 10.8.3.8: ICMP echo reply, id 2253, seq 21, length 64
00:25:13.688029 IP 10.8.3.8 > 84.17.41.130: ICMP echo request, id 2253, seq 22, length 64
00:25:14.153083 IP 84.17.41.130 > 10.8.3.8: ICMP echo reply, id 2253, seq 22, length 64
00:25:14.687860 IP 10.8.3.8 > 84.17.41.130: ICMP echo request, id 2253, seq 23, length 64
00:25:15.153058 IP 84.17.41.130 > 10.8.3.8: ICMP echo reply, id 2253, seq 23, length 64
00:25:15.687818 IP 10.8.3.8 > 84.17.41.130: ICMP echo request, id 2253, seq 24, length 64
00:25:16.152848 IP 84.17.41.130 > 10.8.3.8: ICMP echo reply, id 2253, seq 24, length 64
00:25:16.687614 IP 10.8.3.8 > 84.17.41.130: ICMP echo request, id 2253, seq 25, length 64
00:25:17.152742 IP 84.17.41.130 > 10.8.3.8: ICMP echo reply, id 2253, seq 25, length 64
00:25:17.687506 IP 10.8.3.8 > 84.17.41.130: ICMP echo request, id 2253, seq 26, length 64
00:25:18.152529 IP 84.17.41.130 > 10.8.3.8: ICMP echo reply, id 2253, seq 26, length 64
00:25:18.687298 IP 10.8.3.8 > 84.17.41.130: ICMP echo request, id 2253, seq 27, length 64
00:25:19.152397 IP 84.17.41.130 > 10.8.3.8: ICMP echo reply, id 2253, seq 27, length 64
00:25:19.687185 IP 10.8.3.8 > 84.17.41.130: ICMP echo request, id 2253, seq 28, length 64
00:25:20.152613 IP 84.17.41.130 > 10.8.3.8: ICMP echo reply, id 2253, seq 28, length 64
00:25:20.687380 IP 10.8.3.8 > 84.17.41.130: ICMP echo request, id 2253, seq 29, length 64
00:25:21.152627 IP 84.17.41.130 > 10.8.3.8: ICMP echo reply, id 2253, seq 29, length 64
00:25:21.687394 IP 10.8.3.8 > 84.17.41.130: ICMP echo request, id 2253, seq 30, length 64
00:25:22.152829 IP 84.17.41.130 > 10.8.3.8: ICMP echo reply, id 2253, seq 30, length 64
00:25:22.687596 IP 10.8.3.8 > 84.17.41.130: ICMP echo request, id 2253, seq 31, length 64
00:25:23.152709 IP 84.17.41.130 > 10.8.3.8: ICMP echo reply, id 2253, seq 31, length 64
00:25:23.687473 IP 10.8.3.8 > 84.17.41.130: ICMP echo request, id 2253, seq 32, length 64
00:25:24.152650 IP 84.17.41.130 > 10.8.3.8: ICMP echo reply, id 2253, seq 32, length 64
00:25:24.687418 IP 10.8.3.8 > 84.17.41.130: ICMP echo request, id 2253, seq 33, length 64
00:25:25.152524 IP 84.17.41.130 > 10.8.3.8: ICMP echo reply, id 2253, seq 33, length 64
00:25:25.687300 IP 10.8.3.8 > 84.17.41.130: ICMP echo request, id 2253, seq 34, length 64
00:25:26.152332 IP 84.17.41.130 > 10.8.3.8: ICMP echo reply, id 2253, seq 34, length 64
00:25:26.687098 IP 10.8.3.8 > 84.17.41.130: ICMP echo request, id 2253, seq 35, length 64
00:25:27.152124 IP 84.17.41.130 > 10.8.3.8: ICMP echo reply, id 2253, seq 35, length 64
00:25:27.686880 IP 10.8.3.8 > 84.17.41.130: ICMP echo request, id 2253, seq 36, length 64
00:25:28.151939 IP 84.17.41.130 > 10.8.3.8: ICMP echo reply, id 2253, seq 36, length 64
00:25:28.686704 IP 10.8.3.8 > 84.17.41.130: ICMP echo request, id 2253, seq 37, length 64
00:25:29.151607 IP 84.17.41.130 > 10.8.3.8: ICMP echo reply, id 2253, seq 37, length 64
00:25:29.686368 IP 10.8.3.8 > 84.17.41.130: ICMP echo request, id 2253, seq 38, length 64
00:25:30.151453 IP 84.17.41.130 > 10.8.3.8: ICMP echo reply, id 2253, seq 38, length 64
00:25:30.686221 IP 10.8.3.8 > 84.17.41.130: ICMP echo request, id 2253, seq 39, length 64
00:25:31.151461 IP 84.17.41.130 > 10.8.3.8: ICMP echo reply, id 2253, seq 39, length 64
00:25:31.686227 IP 10.8.3.8 > 84.17.41.130: ICMP echo request, id 2253, seq 40, length 64
00:25:32.151307 IP 84.17.41.130 > 10.8.3.8: ICMP echo reply, id 2253, seq 40, length 64
00:25:32.686079 IP 10.8.3.8 > 84.17.41.130: ICMP echo request, id 2253, seq 41, length 64
00:25:33.151174 IP 84.17.41.130 > 10.8.3.8: ICMP echo reply, id 2253, seq 41, length 64
00:25:33.685943 IP 10.8.3.8 > 84.17.41.130: ICMP echo request, id 2253, seq 42, length 64
00:25:34.151190 IP 84.17.41.130 > 10.8.3.8: ICMP echo reply, id 2253, seq 42, length 64
00:25:34.685959 IP 10.8.3.8 > 84.17.41.130: ICMP echo request, id 2253, seq 43, length 64
00:25:35.151320 IP 84.17.41.130 > 10.8.3.8: ICMP echo reply, id 2253, seq 43, length 64
00:25:35.686076 IP 10.8.3.8 > 84.17.41.130: ICMP echo request, id 2253, seq 44, length 64
00:25:36.204776 IP 84.17.41.130 > 10.8.3.8: ICMP echo reply, id 2253, seq 44, length 64
00:25:36.686491 IP 10.8.3.8 > 84.17.41.130: ICMP echo request, id 2253, seq 45, length 64
00:25:37.151665 IP 84.17.41.130 > 10.8.3.8: ICMP echo reply, id 2253, seq 45, length 64
00:25:37.686432 IP 10.8.3.8 > 84.17.41.130: ICMP echo request, id 2253, seq 46, length 64
00:25:38.151698 IP 84.17.41.130 > 10.8.3.8: ICMP echo reply, id 2253, seq 46, length 64
00:25:38.686466 IP 10.8.3.8 > 84.17.41.130: ICMP echo request, id 2253, seq 47, length 64
00:25:39.151662 IP 84.17.41.130 > 10.8.3.8: ICMP echo reply, id 2253, seq 47, length 64
00:25:39.686425 IP 10.8.3.8 > 84.17.41.130: ICMP echo request, id 2253, seq 48, length 64
00:25:40.151522 IP 84.17.41.130 > 10.8.3.8: ICMP echo reply, id 2253, seq 48, length 64
00:25:40.686291 IP 10.8.3.8 > 84.17.41.130: ICMP echo request, id 2253, seq 49, length 64
00:25:41.151311 IP 84.17.41.130 > 10.8.3.8: ICMP echo reply, id 2253, seq 49, length 64
00:25:41.686077 IP 10.8.3.8 > 84.17.41.130: ICMP echo request, id 2253, seq 50, length 64
00:25:42.151349 IP 84.17.41.130 > 10.8.3.8: ICMP echo reply, id 2253, seq 50, length 64
00:25:42.686116 IP 10.8.3.8 > 84.17.41.130: ICMP echo request, id 2253, seq 51, length 64
00:25:43.151159 IP 84.17.41.130 > 10.8.3.8: ICMP echo reply, id 2253, seq 51, length 64
00:25:43.685924 IP 10.8.3.8 > 84.17.41.130: ICMP echo request, id 2253, seq 52, length 64
00:25:44.151090 IP 84.17.41.130 > 10.8.3.8: ICMP echo reply, id 2253, seq 52, length 64
00:25:44.685855 IP 10.8.3.8 > 84.17.41.130: ICMP echo request, id 2253, seq 53, length 64
00:25:45.151048 IP 84.17.41.130 > 10.8.3.8: ICMP echo reply, id 2253, seq 53, length 64
00:25:45.685836 IP 10.8.3.8 > 84.17.41.130: ICMP echo request, id 2253, seq 54, length 64
00:25:46.151006 IP 84.17.41.130 > 10.8.3.8: ICMP echo reply, id 2253, seq 54, length 64
00:25:46.685789 IP 10.8.3.8 > 84.17.41.130: ICMP echo request, id 2253, seq 55, length 64
00:25:47.150943 IP 84.17.41.130 > 10.8.3.8: ICMP echo reply, id 2253, seq 55, length 64
00:25:47.685709 IP 10.8.3.8 > 84.17.41.130: ICMP echo request, id 2253, seq 56, length 64
00:25:48.150746 IP 84.17.41.130 > 10.8.3.8: ICMP echo reply, id 2253, seq 56, length 64
00:25:48.685517 IP 10.8.3.8 > 84.17.41.130: ICMP echo request, id 2253, seq 57, length 64
00:25:49.150516 IP 84.17.41.130 > 10.8.3.8: ICMP echo reply, id 2253, seq 57, length 64
00:25:49.685288 IP 10.8.3.8 > 84.17.41.130: ICMP echo request, id 2253, seq 58, length 64
00:25:50.150515 IP 84.17.41.130 > 10.8.3.8: ICMP echo reply, id 2253, seq 58, length 64
00:25:50.685283 IP 10.8.3.8 > 84.17.41.130: ICMP echo request, id 2253, seq 59, length 64
00:25:51.150240 IP 84.17.41.130 > 10.8.3.8: ICMP echo reply, id 2253, seq 59, length 64
00:25:51.685009 IP 10.8.3.8 > 84.17.41.130: ICMP echo request, id 2253, seq 60, length 64
