20:54:10.879023 IP 185.225.28.43 > 10.8.2.8: ICMP echo reply, id 1456, seq 1, length 64
20:54:11.505785 IP 10.8.2.8 > 185.225.28.43: ICMP echo request, id 1456, seq 2, length 64
20:54:12.507274 IP 10.8.2.8 > 185.225.28.43: ICMP echo request, id 1456, seq 3, length 64
20:54:12.900831 IP 185.225.28.43 > 10.8.2.8: ICMP echo reply, id 1456, seq 3, length 64
20:54:13.508669 IP 10.8.2.8 > 185.225.28.43: ICMP echo request, id 1456, seq 4, length 64
20:54:14.523236 IP 10.8.2.8 > 185.225.28.43: ICMP echo request, id 1456, seq 5, length 64
20:54:14.911227 IP 185.225.28.43 > 10.8.2.8: ICMP echo reply, id 1456, seq 5, length 64
20:54:15.524078 IP 10.8.2.8 > 185.225.28.43: ICMP echo request, id 1456, seq 6, length 64
20:54:15.914092 IP 185.225.28.43 > 10.8.2.8: ICMP echo reply, id 1456, seq 6, length 64
20:54:16.524935 IP 10.8.2.8 > 185.225.28.43: ICMP echo request, id 1456, seq 7, length 64
20:54:16.920550 IP 185.225.28.43 > 10.8.2.8: ICMP echo reply, id 1456, seq 7, length 64
20:54:17.526398 IP 10.8.2.8 > 185.225.28.43: ICMP echo request, id 1456, seq 8, length 64
20:54:17.896512 IP 185.225.28.43 > 10.8.2.8: ICMP echo reply, id 1456, seq 8, length 64
20:54:18.527381 IP 10.8.2.8 > 185.225.28.43: ICMP echo request, id 1456, seq 9, length 64
20:54:18.916968 IP 185.225.28.43 > 10.8.2.8: ICMP echo reply, id 1456, seq 9, length 64
20:54:19.528806 IP 10.8.2.8 > 185.225.28.43: ICMP echo request, id 1456, seq 10, length 64
20:54:19.933784 IP 185.225.28.43 > 10.8.2.8: ICMP echo reply, id 1456, seq 10, length 64
20:54:20.529613 IP 10.8.2.8 > 185.225.28.43: ICMP echo request, id 1456, seq 11, length 64
20:54:20.907761 IP 185.225.28.43 > 10.8.2.8: ICMP echo reply, id 1456, seq 11, length 64
20:54:21.530619 IP 10.8.2.8 > 185.225.28.43: ICMP echo request, id 1456, seq 12, length 64
20:54:21.914712 IP 185.225.28.43 > 10.8.2.8: ICMP echo reply, id 1456, seq 12, length 64
20:54:22.531559 IP 10.8.2.8 > 185.225.28.43: ICMP echo request, id 1456, seq 13, length 64
20:54:22.931583 IP 185.225.28.43 > 10.8.2.8: ICMP echo reply, id 1456, seq 13, length 64
20:54:23.532418 IP 10.8.2.8 > 185.225.28.43: ICMP echo request, id 1456, seq 14, length 64
20:54:23.924975 IP 185.225.28.43 > 10.8.2.8: ICMP echo reply, id 1456, seq 14, length 64
20:54:24.533816 IP 10.8.2.8 > 185.225.28.43: ICMP echo request, id 1456, seq 15, length 64
20:54:24.930783 IP 185.225.28.43 > 10.8.2.8: ICMP echo reply, id 1456, seq 15, length 64
20:54:25.534629 IP 10.8.2.8 > 185.225.28.43: ICMP echo request, id 1456, seq 16, length 64
20:54:25.911163 IP 185.225.28.43 > 10.8.2.8: ICMP echo reply, id 1456, seq 16, length 64
20:54:26.536029 IP 10.8.2.8 > 185.225.28.43: ICMP echo request, id 1456, seq 17, length 64
20:54:26.932969 IP 185.225.28.43 > 10.8.2.8: ICMP echo reply, id 1456, seq 17, length 64
20:54:27.536803 IP 10.8.2.8 > 185.225.28.43: ICMP echo request, id 1456, seq 18, length 64
20:54:28.539236 IP 10.8.2.8 > 185.225.28.43: ICMP echo request, id 1456, seq 19, length 64
20:54:28.919055 IP 185.225.28.43 > 10.8.2.8: ICMP echo reply, id 1456, seq 19, length 64
20:54:29.539924 IP 10.8.2.8 > 185.225.28.43: ICMP echo request, id 1456, seq 20, length 64
20:54:30.555258 IP 10.8.2.8 > 185.225.28.43: ICMP echo request, id 1456, seq 21, length 64
20:54:30.954269 IP 185.225.28.43 > 10.8.2.8: ICMP echo reply, id 1456, seq 21, length 64
20:54:31.556098 IP 10.8.2.8 > 185.225.28.43: ICMP echo request, id 1456, seq 22, length 64
20:54:32.571261 IP 10.8.2.8 > 185.225.28.43: ICMP echo request, id 1456, seq 23, length 64
20:54:32.966060 IP 185.225.28.43 > 10.8.2.8: ICMP echo reply, id 1456, seq 23, length 64
20:54:33.572903 IP 10.8.2.8 > 185.225.28.43: ICMP echo request, id 1456, seq 24, length 64
20:54:33.958424 IP 185.225.28.43 > 10.8.2.8: ICMP echo reply, id 1456, seq 24, length 64
20:54:34.574270 IP 10.8.2.8 > 185.225.28.43: ICMP echo request, id 1456, seq 25, length 64
20:54:34.947220 IP 185.225.28.43 > 10.8.2.8: ICMP echo reply, id 1456, seq 25, length 64
20:54:35.575005 IP 10.8.2.8 > 185.225.28.43: ICMP echo request, id 1456, seq 26, length 64
20:54:36.603234 IP 10.8.2.8 > 185.225.28.43: ICMP echo request, id 1456, seq 27, length 64
20:54:36.987581 IP 185.225.28.43 > 10.8.2.8: ICMP echo reply, id 1456, seq 27, length 64
20:54:37.604353 IP 10.8.2.8 > 185.225.28.43: ICMP echo request, id 1456, seq 28, length 64
20:54:37.988616 IP 185.225.28.43 > 10.8.2.8: ICMP echo reply, id 1456, seq 28, length 64
20:54:38.605463 IP 10.8.2.8 > 185.225.28.43: ICMP echo request, id 1456, seq 29, length 64
20:54:38.977429 IP 185.225.28.43 > 10.8.2.8: ICMP echo reply, id 1456, seq 29, length 64
20:54:39.606283 IP 10.8.2.8 > 185.225.28.43: ICMP echo request, id 1456, seq 30, length 64
20:54:40.007073 IP 185.225.28.43 > 10.8.2.8: ICMP echo reply, id 1456, seq 30, length 64
20:54:40.606905 IP 10.8.2.8 > 185.225.28.43: ICMP echo request, id 1456, seq 31, length 64
20:54:41.007214 IP 185.225.28.43 > 10.8.2.8: ICMP echo reply, id 1456, seq 31, length 64
20:54:41.607045 IP 10.8.2.8 > 185.225.28.43: ICMP echo request, id 1456, seq 32, length 64
20:54:42.619233 IP 10.8.2.8 > 185.225.28.43: ICMP echo request, id 1456, seq 33, length 64
20:54:42.989598 IP 185.225.28.43 > 10.8.2.8: ICMP echo reply, id 1456, seq 33, length 64
20:54:43.620461 IP 10.8.2.8 > 185.225.28.43: ICMP echo request, id 1456, seq 34, length 64
20:54:44.635242 IP 10.8.2.8 > 185.225.28.43: ICMP echo request, id 1456, seq 35, length 64
20:54:45.036981 IP 185.225.28.43 > 10.8.2.8: ICMP echo reply, id 1456, seq 35, length 64
20:54:45.635811 IP 10.8.2.8 > 185.225.28.43: ICMP echo request, id 1456, seq 36, length 64
20:54:46.039616 IP 185.225.28.43 > 10.8.2.8: ICMP echo reply, id 1456, seq 36, length 64
20:54:46.636448 IP 10.8.2.8 > 185.225.28.43: ICMP echo request, id 1456, seq 37, length 64
20:54:47.024202 IP 185.225.28.43 > 10.8.2.8: ICMP echo reply, id 1456, seq 37, length 64
20:54:47.637042 IP 10.8.2.8 > 185.225.28.43: ICMP echo request, id 1456, seq 38, length 64
20:54:48.036319 IP 185.225.28.43 > 10.8.2.8: ICMP echo reply, id 1456, seq 38, length 64
20:54:48.637142 IP 10.8.2.8 > 185.225.28.43: ICMP echo request, id 1456, seq 39, length 64
20:54:49.026927 IP 185.225.28.43 > 10.8.2.8: ICMP echo reply, id 1456, seq 39, length 64
20:54:49.637767 IP 10.8.2.8 > 185.225.28.43: ICMP echo request, id 1456, seq 40, length 64
20:54:50.033965 IP 185.225.28.43 > 10.8.2.8: ICMP echo reply, id 1456, seq 40, length 64
20:54:50.637790 IP 10.8.2.8 > 185.225.28.43: ICMP echo request, id 1456, seq 41, length 64
20:54:51.028592 IP 185.225.28.43 > 10.8.2.8: ICMP echo reply, id 1456, seq 41, length 64
20:54:51.638428 IP 10.8.2.8 > 185.225.28.43: ICMP echo request, id 1456, seq 42, length 64
20:54:52.009593 IP 185.225.28.43 > 10.8.2.8: ICMP echo reply, id 1456, seq 42, length 64
20:54:52.638453 IP 10.8.2.8 > 185.225.28.43: ICMP echo request, id 1456, seq 43, length 64
20:54:53.659246 IP 10.8.2.8 > 185.225.28.43: ICMP echo request, id 1456, seq 44, length 64
20:54:54.056404 IP 185.225.28.43 > 10.8.2.8: ICMP echo reply, id 1456, seq 44, length 64
20:54:54.659240 IP 10.8.2.8 > 185.225.28.43: ICMP echo request, id 1456, seq 45, length 64
20:54:55.052223 IP 185.225.28.43 > 10.8.2.8: ICMP echo reply, id 1456, seq 45, length 64
20:54:55.659052 IP 10.8.2.8 > 185.225.28.43: ICMP echo request, id 1456, seq 46, length 64
20:54:56.055176 IP 185.225.28.43 > 10.8.2.8: ICMP echo reply, id 1456, seq 46, length 64
20:54:56.659008 IP 10.8.2.8 > 185.225.28.43: ICMP echo request, id 1456, seq 47, length 64
20:54:57.029807 IP 185.225.28.43 > 10.8.2.8: ICMP echo reply, id 1456, seq 47, length 64
20:54:57.659666 IP 10.8.2.8 > 185.225.28.43: ICMP echo request, id 1456, seq 48, length 64
20:54:58.049549 IP 185.225.28.43 > 10.8.2.8: ICMP echo reply, id 1456, seq 48, length 64
20:54:58.659381 IP 10.8.2.8 > 185.225.28.43: ICMP echo request, id 1456, seq 49, length 64
20:54:59.675242 IP 10.8.2.8 > 185.225.28.43: ICMP echo request, id 1456, seq 50, length 64
20:55:00.053484 IP 185.225.28.43 > 10.8.2.8: ICMP echo reply, id 1456, seq 50, length 64
20:55:00.675335 IP 10.8.2.8 > 185.225.28.43: ICMP echo request, id 1456, seq 51, length 64
20:55:01.072167 IP 185.225.28.43 > 10.8.2.8: ICMP echo reply, id 1456, seq 51, length 64
20:55:01.676001 IP 10.8.2.8 > 185.225.28.43: ICMP echo request, id 1456, seq 52, length 64
20:55:02.074732 IP 185.225.28.43 > 10.8.2.8: ICMP echo reply, id 1456, seq 52, length 64
20:55:02.676558 IP 10.8.2.8 > 185.225.28.43: ICMP echo request, id 1456, seq 53, length 64
20:55:03.070123 IP 185.225.28.43 > 10.8.2.8: ICMP echo reply, id 1456, seq 53, length 64
20:55:03.676958 IP 10.8.2.8 > 185.225.28.43: ICMP echo request, id 1456, seq 54, length 64
20:55:04.073928 IP 185.225.28.43 > 10.8.2.8: ICMP echo reply, id 1456, seq 54, length 64
20:55:04.676762 IP 10.8.2.8 > 185.225.28.43: ICMP echo request, id 1456, seq 55, length 64
20:55:05.052732 IP 185.225.28.43 > 10.8.2.8: ICMP echo reply, id 1456, seq 55, length 64
20:55:05.676586 IP 10.8.2.8 > 185.225.28.43: ICMP echo request, id 1456, seq 56, length 64
20:55:06.072130 IP 185.225.28.43 > 10.8.2.8: ICMP echo reply, id 1456, seq 56, length 64
20:55:06.676966 IP 10.8.2.8 > 185.225.28.43: ICMP echo request, id 1456, seq 57, length 64
20:55:07.071729 IP 185.225.28.43 > 10.8.2.8: ICMP echo reply, id 1456, seq 57, length 64
20:55:07.677570 IP 10.8.2.8 > 185.225.28.43: ICMP echo request, id 1456, seq 58, length 64
20:55:08.061749 IP 185.225.28.43 > 10.8.2.8: ICMP echo reply, id 1456, seq 58, length 64
20:55:08.677595 IP 10.8.2.8 > 185.225.28.43: ICMP echo request, id 1456, seq 59, length 64
20:55:09.048277 IP 185.225.28.43 > 10.8.2.8: ICMP echo reply, id 1456, seq 59, length 64
20:55:09.678133 IP 10.8.2.8 > 185.225.28.43: ICMP echo request, id 1456, seq 60, length 64
20:55:10.076771 IP 185.225.28.43 > 10.8.2.8: ICMP echo reply, id 1456, seq 60, length 64
