08:07:52.152816 IP 10.8.2.5 > 66.55.146.98: ICMP echo request, id 834, seq 2, length 64
08:07:52.772396 IP 66.55.146.98 > 10.8.2.5: ICMP echo reply, id 834, seq 2, length 64
08:07:53.154053 IP 10.8.2.5 > 66.55.146.98: ICMP echo request, id 834, seq 3, length 64
08:07:53.773474 IP 66.55.146.98 > 10.8.2.5: ICMP echo reply, id 834, seq 3, length 64
08:07:54.155096 IP 10.8.2.5 > 66.55.146.98: ICMP echo request, id 834, seq 4, length 64
08:07:54.774628 IP 66.55.146.98 > 10.8.2.5: ICMP echo reply, id 834, seq 4, length 64
08:07:55.156254 IP 10.8.2.5 > 66.55.146.98: ICMP echo request, id 834, seq 5, length 64
08:07:55.775735 IP 66.55.146.98 > 10.8.2.5: ICMP echo reply, id 834, seq 5, length 64
08:07:56.157354 IP 10.8.2.5 > 66.55.146.98: ICMP echo request, id 834, seq 6, length 64
08:07:56.776823 IP 66.55.146.98 > 10.8.2.5: ICMP echo reply, id 834, seq 6, length 64
08:07:57.158442 IP 10.8.2.5 > 66.55.146.98: ICMP echo request, id 834, seq 7, length 64
08:07:57.778278 IP 66.55.146.98 > 10.8.2.5: ICMP echo reply, id 834, seq 7, length 64
08:07:58.158904 IP 10.8.2.5 > 66.55.146.98: ICMP echo request, id 834, seq 8, length 64
08:07:58.778297 IP 66.55.146.98 > 10.8.2.5: ICMP echo reply, id 834, seq 8, length 64
08:07:59.159928 IP 10.8.2.5 > 66.55.146.98: ICMP echo request, id 834, seq 9, length 64
08:07:59.779230 IP 66.55.146.98 > 10.8.2.5: ICMP echo reply, id 834, seq 9, length 64
08:08:00.160850 IP 10.8.2.5 > 66.55.146.98: ICMP echo request, id 834, seq 10, length 64
08:08:00.780410 IP 66.55.146.98 > 10.8.2.5: ICMP echo reply, id 834, seq 10, length 64
08:08:01.162047 IP 10.8.2.5 > 66.55.146.98: ICMP echo request, id 834, seq 11, length 64
08:08:01.781521 IP 66.55.146.98 > 10.8.2.5: ICMP echo reply, id 834, seq 11, length 64
08:08:02.163152 IP 10.8.2.5 > 66.55.146.98: ICMP echo request, id 834, seq 12, length 64
08:08:02.782779 IP 66.55.146.98 > 10.8.2.5: ICMP echo reply, id 834, seq 12, length 64
08:08:03.164408 IP 10.8.2.5 > 66.55.146.98: ICMP echo request, id 834, seq 13, length 64
08:08:03.783591 IP 66.55.146.98 > 10.8.2.5: ICMP echo reply, id 834, seq 13, length 64
08:08:04.165208 IP 10.8.2.5 > 66.55.146.98: ICMP echo request, id 834, seq 14, length 64
08:08:04.784660 IP 66.55.146.98 > 10.8.2.5: ICMP echo reply, id 834, seq 14, length 64
08:08:05.166295 IP 10.8.2.5 > 66.55.146.98: ICMP echo request, id 834, seq 15, length 64
08:08:05.785693 IP 66.55.146.98 > 10.8.2.5: ICMP echo reply, id 834, seq 15, length 64
08:08:06.167319 IP 10.8.2.5 > 66.55.146.98: ICMP echo request, id 834, seq 16, length 64
08:08:06.790331 IP 66.55.146.98 > 10.8.2.5: ICMP echo reply, id 834, seq 16, length 64
08:08:07.167904 IP 10.8.2.5 > 66.55.146.98: ICMP echo request, id 834, seq 17, length 64
08:08:07.787284 IP 66.55.146.98 > 10.8.2.5: ICMP echo reply, id 834, seq 17, length 64
08:08:08.168905 IP 10.8.2.5 > 66.55.146.98: ICMP echo request, id 834, seq 18, length 64
08:08:08.788965 IP 66.55.146.98 > 10.8.2.5: ICMP echo reply, id 834, seq 18, length 64
08:08:09.169579 IP 10.8.2.5 > 66.55.146.98: ICMP echo request, id 834, seq 19, length 64
08:08:09.788910 IP 66.55.146.98 > 10.8.2.5: ICMP echo reply, id 834, seq 19, length 64
08:08:10.170538 IP 10.8.2.5 > 66.55.146.98: ICMP echo request, id 834, seq 20, length 64
08:08:10.789768 IP 66.55.146.98 > 10.8.2.5: ICMP echo reply, id 834, seq 20, length 64
08:08:11.171381 IP 10.8.2.5 > 66.55.146.98: ICMP echo request, id 834, seq 21, length 64
08:08:11.791313 IP 66.55.146.98 > 10.8.2.5: ICMP echo reply, id 834, seq 21, length 64
08:08:12.171930 IP 10.8.2.5 > 66.55.146.98: ICMP echo request, id 834, seq 22, length 64
08:08:12.791627 IP 66.55.146.98 > 10.8.2.5: ICMP echo reply, id 834, seq 22, length 64
08:08:13.173246 IP 10.8.2.5 > 66.55.146.98: ICMP echo request, id 834, seq 23, length 64
08:08:13.792767 IP 66.55.146.98 > 10.8.2.5: ICMP echo reply, id 834, seq 23, length 64
08:08:14.174384 IP 10.8.2.5 > 66.55.146.98: ICMP echo request, id 834, seq 24, length 64
08:08:14.793659 IP 66.55.146.98 > 10.8.2.5: ICMP echo reply, id 834, seq 24, length 64
08:08:15.175281 IP 10.8.2.5 > 66.55.146.98: ICMP echo request, id 834, seq 25, length 64
08:08:15.794993 IP 66.55.146.98 > 10.8.2.5: ICMP echo reply, id 834, seq 25, length 64
08:08:16.176605 IP 10.8.2.5 > 66.55.146.98: ICMP echo request, id 834, seq 26, length 64
08:08:16.796061 IP 66.55.146.98 > 10.8.2.5: ICMP echo reply, id 834, seq 26, length 64
08:08:17.177681 IP 10.8.2.5 > 66.55.146.98: ICMP echo request, id 834, seq 27, length 64
08:08:17.797003 IP 66.55.146.98 > 10.8.2.5: ICMP echo reply, id 834, seq 27, length 64
08:08:18.178625 IP 10.8.2.5 > 66.55.146.98: ICMP echo request, id 834, seq 28, length 64
08:08:18.797874 IP 66.55.146.98 > 10.8.2.5: ICMP echo reply, id 834, seq 28, length 64
08:08:19.179499 IP 10.8.2.5 > 66.55.146.98: ICMP echo request, id 834, seq 29, length 64
08:08:19.798848 IP 66.55.146.98 > 10.8.2.5: ICMP echo reply, id 834, seq 29, length 64
08:08:20.180472 IP 10.8.2.5 > 66.55.146.98: ICMP echo request, id 834, seq 30, length 64
08:08:20.799899 IP 66.55.146.98 > 10.8.2.5: ICMP echo reply, id 834, seq 30, length 64
08:08:21.181522 IP 10.8.2.5 > 66.55.146.98: ICMP echo request, id 834, seq 31, length 64
08:08:21.801054 IP 66.55.146.98 > 10.8.2.5: ICMP echo reply, id 834, seq 31, length 64
08:08:22.182686 IP 10.8.2.5 > 66.55.146.98: ICMP echo request, id 834, seq 32, length 64
08:08:22.802007 IP 66.55.146.98 > 10.8.2.5: ICMP echo reply, id 834, seq 32, length 64
08:08:23.183647 IP 10.8.2.5 > 66.55.146.98: ICMP echo request, id 834, seq 33, length 64
08:08:23.809918 IP 66.55.146.98 > 10.8.2.5: ICMP echo reply, id 834, seq 33, length 64
08:08:24.184540 IP 10.8.2.5 > 66.55.146.98: ICMP echo request, id 834, seq 34, length 64
08:08:24.803991 IP 66.55.146.98 > 10.8.2.5: ICMP echo reply, id 834, seq 34, length 64
08:08:25.185620 IP 10.8.2.5 > 66.55.146.98: ICMP echo request, id 834, seq 35, length 64
08:08:25.805257 IP 66.55.146.98 > 10.8.2.5: ICMP echo reply, id 834, seq 35, length 64
08:08:26.186885 IP 10.8.2.5 > 66.55.146.98: ICMP echo request, id 834, seq 36, length 64
08:08:26.808040 IP 66.55.146.98 > 10.8.2.5: ICMP echo reply, id 834, seq 36, length 64
08:08:27.187673 IP 10.8.2.5 > 66.55.146.98: ICMP echo request, id 834, seq 37, length 64
08:08:27.807035 IP 66.55.146.98 > 10.8.2.5: ICMP echo reply, id 834, seq 37, length 64
08:08:28.188575 IP 10.8.2.5 > 66.55.146.98: ICMP echo request, id 834, seq 38, length 64
08:08:28.808011 IP 66.55.146.98 > 10.8.2.5: ICMP echo reply, id 834, seq 38, length 64
08:08:29.189655 IP 10.8.2.5 > 66.55.146.98: ICMP echo request, id 834, seq 39, length 64
08:08:29.809361 IP 66.55.146.98 > 10.8.2.5: ICMP echo reply, id 834, seq 39, length 64
08:08:30.190998 IP 10.8.2.5 > 66.55.146.98: ICMP echo request, id 834, seq 40, length 64
08:08:30.810281 IP 66.55.146.98 > 10.8.2.5: ICMP echo reply, id 834, seq 40, length 64
08:08:31.191913 IP 10.8.2.5 > 66.55.146.98: ICMP echo request, id 834, seq 41, length 64
08:08:31.811392 IP 66.55.146.98 > 10.8.2.5: ICMP echo reply, id 834, seq 41, length 64
08:08:32.193022 IP 10.8.2.5 > 66.55.146.98: ICMP echo request, id 834, seq 42, length 64
08:08:32.812695 IP 66.55.146.98 > 10.8.2.5: ICMP echo reply, id 834, seq 42, length 64
08:08:33.194326 IP 10.8.2.5 > 66.55.146.98: ICMP echo request, id 834, seq 43, length 64
08:08:33.814173 IP 66.55.146.98 > 10.8.2.5: ICMP echo reply, id 834, seq 43, length 64
08:08:34.195771 IP 10.8.2.5 > 66.55.146.98: ICMP echo request, id 834, seq 44, length 64
08:08:34.814896 IP 66.55.146.98 > 10.8.2.5: ICMP echo reply, id 834, seq 44, length 64
08:08:35.196524 IP 10.8.2.5 > 66.55.146.98: ICMP echo request, id 834, seq 45, length 64
08:08:35.815847 IP 66.55.146.98 > 10.8.2.5: ICMP echo reply, id 834, seq 45, length 64
08:08:36.197479 IP 10.8.2.5 > 66.55.146.98: ICMP echo request, id 834, seq 46, length 64
08:08:36.816698 IP 66.55.146.98 > 10.8.2.5: ICMP echo reply, id 834, seq 46, length 64
08:08:37.198322 IP 10.8.2.5 > 66.55.146.98: ICMP echo request, id 834, seq 47, length 64
08:08:37.817398 IP 66.55.146.98 > 10.8.2.5: ICMP echo reply, id 834, seq 47, length 64
08:08:38.199027 IP 10.8.2.5 > 66.55.146.98: ICMP echo request, id 834, seq 48, length 64
08:08:38.818546 IP 66.55.146.98 > 10.8.2.5: ICMP echo reply, id 834, seq 48, length 64
08:08:39.200173 IP 10.8.2.5 > 66.55.146.98: ICMP echo request, id 834, seq 49, length 64
08:08:39.819653 IP 66.55.146.98 > 10.8.2.5: ICMP echo reply, id 834, seq 49, length 64
08:08:40.201291 IP 10.8.2.5 > 66.55.146.98: ICMP echo request, id 834, seq 50, length 64
08:08:40.820589 IP 66.55.146.98 > 10.8.2.5: ICMP echo reply, id 834, seq 50, length 64
08:08:41.202219 IP 10.8.2.5 > 66.55.146.98: ICMP echo request, id 834, seq 51, length 64
08:08:41.821478 IP 66.55.146.98 > 10.8.2.5: ICMP echo reply, id 834, seq 51, length 64
08:08:42.203108 IP 10.8.2.5 > 66.55.146.98: ICMP echo request, id 834, seq 52, length 64
08:08:42.824590 IP 66.55.146.98 > 10.8.2.5: ICMP echo reply, id 834, seq 52, length 64
08:08:43.204212 IP 10.8.2.5 > 66.55.146.98: ICMP echo request, id 834, seq 53, length 64
08:08:43.825901 IP 66.55.146.98 > 10.8.2.5: ICMP echo reply, id 834, seq 53, length 64
08:08:44.205533 IP 10.8.2.5 > 66.55.146.98: ICMP echo request, id 834, seq 54, length 64
08:08:44.825200 IP 66.55.146.98 > 10.8.2.5: ICMP echo reply, id 834, seq 54, length 64
08:08:45.206821 IP 10.8.2.5 > 66.55.146.98: ICMP echo request, id 834, seq 55, length 64
08:08:45.826488 IP 66.55.146.98 > 10.8.2.5: ICMP echo reply, id 834, seq 55, length 64
08:08:46.208111 IP 10.8.2.5 > 66.55.146.98: ICMP echo request, id 834, seq 56, length 64
08:08:46.827608 IP 66.55.146.98 > 10.8.2.5: ICMP echo reply, id 834, seq 56, length 64
08:08:47.209229 IP 10.8.2.5 > 66.55.146.98: ICMP echo request, id 834, seq 57, length 64
08:08:47.828493 IP 66.55.146.98 > 10.8.2.5: ICMP echo reply, id 834, seq 57, length 64
08:08:48.210129 IP 10.8.2.5 > 66.55.146.98: ICMP echo request, id 834, seq 58, length 64
08:08:48.830002 IP 66.55.146.98 > 10.8.2.5: ICMP echo reply, id 834, seq 58, length 64
08:08:49.210642 IP 10.8.2.5 > 66.55.146.98: ICMP echo request, id 834, seq 59, length 64
08:08:49.830186 IP 66.55.146.98 > 10.8.2.5: ICMP echo reply, id 834, seq 59, length 64
