10:40:48.722580 IP 10.8.2.5 > 217.23.2.31: ICMP echo request, id 1409, seq 2, length 64
10:40:49.016536 IP 217.23.2.31 > 10.8.2.5: ICMP echo reply, id 1409, seq 2, length 64
10:40:49.722211 IP 10.8.2.5 > 217.23.2.31: ICMP echo request, id 1409, seq 3, length 64
10:40:50.016097 IP 217.23.2.31 > 10.8.2.5: ICMP echo reply, id 1409, seq 3, length 64
10:40:50.722049 IP 10.8.2.5 > 217.23.2.31: ICMP echo request, id 1409, seq 4, length 64
10:40:51.016513 IP 217.23.2.31 > 10.8.2.5: ICMP echo reply, id 1409, seq 4, length 64
10:40:51.721763 IP 10.8.2.5 > 217.23.2.31: ICMP echo request, id 1409, seq 5, length 64
10:40:52.015664 IP 217.23.2.31 > 10.8.2.5: ICMP echo reply, id 1409, seq 5, length 64
10:40:52.721612 IP 10.8.2.5 > 217.23.2.31: ICMP echo request, id 1409, seq 6, length 64
10:40:53.015866 IP 217.23.2.31 > 10.8.2.5: ICMP echo reply, id 1409, seq 6, length 64
10:40:53.721809 IP 10.8.2.5 > 217.23.2.31: ICMP echo request, id 1409, seq 7, length 64
10:40:54.015479 IP 217.23.2.31 > 10.8.2.5: ICMP echo reply, id 1409, seq 7, length 64
10:40:54.722394 IP 10.8.2.5 > 217.23.2.31: ICMP echo request, id 1409, seq 8, length 64
10:40:55.016087 IP 217.23.2.31 > 10.8.2.5: ICMP echo reply, id 1409, seq 8, length 64
10:40:55.723047 IP 10.8.2.5 > 217.23.2.31: ICMP echo request, id 1409, seq 9, length 64
10:40:56.017520 IP 217.23.2.31 > 10.8.2.5: ICMP echo reply, id 1409, seq 9, length 64
10:40:56.723491 IP 10.8.2.5 > 217.23.2.31: ICMP echo request, id 1409, seq 10, length 64
10:40:57.017348 IP 217.23.2.31 > 10.8.2.5: ICMP echo reply, id 1409, seq 10, length 64
10:40:57.723294 IP 10.8.2.5 > 217.23.2.31: ICMP echo request, id 1409, seq 11, length 64
10:40:58.017381 IP 217.23.2.31 > 10.8.2.5: ICMP echo reply, id 1409, seq 11, length 64
10:40:58.723337 IP 10.8.2.5 > 217.23.2.31: ICMP echo request, id 1409, seq 12, length 64
10:40:59.017322 IP 217.23.2.31 > 10.8.2.5: ICMP echo reply, id 1409, seq 12, length 64
10:40:59.723278 IP 10.8.2.5 > 217.23.2.31: ICMP echo request, id 1409, seq 13, length 64
10:41:00.017174 IP 217.23.2.31 > 10.8.2.5: ICMP echo reply, id 1409, seq 13, length 64
10:41:00.723123 IP 10.8.2.5 > 217.23.2.31: ICMP echo request, id 1409, seq 14, length 64
10:41:01.020193 IP 217.23.2.31 > 10.8.2.5: ICMP echo reply, id 1409, seq 14, length 64
10:41:01.723137 IP 10.8.2.5 > 217.23.2.31: ICMP echo request, id 1409, seq 15, length 64
10:41:02.017386 IP 217.23.2.31 > 10.8.2.5: ICMP echo reply, id 1409, seq 15, length 64
10:41:02.723333 IP 10.8.2.5 > 217.23.2.31: ICMP echo request, id 1409, seq 16, length 64
10:41:03.017556 IP 217.23.2.31 > 10.8.2.5: ICMP echo reply, id 1409, seq 16, length 64
10:41:03.723506 IP 10.8.2.5 > 217.23.2.31: ICMP echo request, id 1409, seq 17, length 64
10:41:04.017589 IP 217.23.2.31 > 10.8.2.5: ICMP echo reply, id 1409, seq 17, length 64
10:41:04.723535 IP 10.8.2.5 > 217.23.2.31: ICMP echo request, id 1409, seq 18, length 64
10:41:05.017426 IP 217.23.2.31 > 10.8.2.5: ICMP echo reply, id 1409, seq 18, length 64
10:41:05.723385 IP 10.8.2.5 > 217.23.2.31: ICMP echo request, id 1409, seq 19, length 64
10:41:06.017394 IP 217.23.2.31 > 10.8.2.5: ICMP echo reply, id 1409, seq 19, length 64
10:41:06.723338 IP 10.8.2.5 > 217.23.2.31: ICMP echo request, id 1409, seq 20, length 64
10:41:07.017317 IP 217.23.2.31 > 10.8.2.5: ICMP echo reply, id 1409, seq 20, length 64
10:41:07.723272 IP 10.8.2.5 > 217.23.2.31: ICMP echo request, id 1409, seq 21, length 64
10:41:08.017078 IP 217.23.2.31 > 10.8.2.5: ICMP echo reply, id 1409, seq 21, length 64
10:41:08.724032 IP 10.8.2.5 > 217.23.2.31: ICMP echo request, id 1409, seq 22, length 64
10:41:09.018413 IP 217.23.2.31 > 10.8.2.5: ICMP echo reply, id 1409, seq 22, length 64
10:41:09.724364 IP 10.8.2.5 > 217.23.2.31: ICMP echo request, id 1409, seq 23, length 64
10:41:10.018245 IP 217.23.2.31 > 10.8.2.5: ICMP echo reply, id 1409, seq 23, length 64
10:41:10.724201 IP 10.8.2.5 > 217.23.2.31: ICMP echo request, id 1409, seq 24, length 64
10:41:11.018018 IP 217.23.2.31 > 10.8.2.5: ICMP echo reply, id 1409, seq 24, length 64
10:41:11.724961 IP 10.8.2.5 > 217.23.2.31: ICMP echo request, id 1409, seq 25, length 64
10:41:12.018894 IP 217.23.2.31 > 10.8.2.5: ICMP echo reply, id 1409, seq 25, length 64
10:41:12.724840 IP 10.8.2.5 > 217.23.2.31: ICMP echo request, id 1409, seq 26, length 64
10:41:13.018666 IP 217.23.2.31 > 10.8.2.5: ICMP echo reply, id 1409, seq 26, length 64
10:41:13.725614 IP 10.8.2.5 > 217.23.2.31: ICMP echo request, id 1409, seq 27, length 64
10:41:14.019655 IP 217.23.2.31 > 10.8.2.5: ICMP echo reply, id 1409, seq 27, length 64
10:41:14.725561 IP 10.8.2.5 > 217.23.2.31: ICMP echo request, id 1409, seq 28, length 64
10:41:15.019893 IP 217.23.2.31 > 10.8.2.5: ICMP echo reply, id 1409, seq 28, length 64
10:41:15.725836 IP 10.8.2.5 > 217.23.2.31: ICMP echo request, id 1409, seq 29, length 64
10:41:16.019759 IP 217.23.2.31 > 10.8.2.5: ICMP echo reply, id 1409, seq 29, length 64
10:41:16.725712 IP 10.8.2.5 > 217.23.2.31: ICMP echo request, id 1409, seq 30, length 64
10:41:17.019692 IP 217.23.2.31 > 10.8.2.5: ICMP echo reply, id 1409, seq 30, length 64
10:41:17.725635 IP 10.8.2.5 > 217.23.2.31: ICMP echo request, id 1409, seq 31, length 64
10:41:18.019521 IP 217.23.2.31 > 10.8.2.5: ICMP echo reply, id 1409, seq 31, length 64
10:41:18.725461 IP 10.8.2.5 > 217.23.2.31: ICMP echo request, id 1409, seq 32, length 64
10:41:19.019309 IP 217.23.2.31 > 10.8.2.5: ICMP echo reply, id 1409, seq 32, length 64
10:41:19.725247 IP 10.8.2.5 > 217.23.2.31: ICMP echo request, id 1409, seq 33, length 64
10:41:20.019096 IP 217.23.2.31 > 10.8.2.5: ICMP echo reply, id 1409, seq 33, length 64
10:41:20.725033 IP 10.8.2.5 > 217.23.2.31: ICMP echo request, id 1409, seq 34, length 64
10:41:21.018800 IP 217.23.2.31 > 10.8.2.5: ICMP echo reply, id 1409, seq 34, length 64
10:41:21.725743 IP 10.8.2.5 > 217.23.2.31: ICMP echo request, id 1409, seq 35, length 64
10:41:22.019777 IP 217.23.2.31 > 10.8.2.5: ICMP echo reply, id 1409, seq 35, length 64
10:41:22.725713 IP 10.8.2.5 > 217.23.2.31: ICMP echo request, id 1409, seq 36, length 64
10:41:23.019777 IP 217.23.2.31 > 10.8.2.5: ICMP echo reply, id 1409, seq 36, length 64
10:41:23.725716 IP 10.8.2.5 > 217.23.2.31: ICMP echo request, id 1409, seq 37, length 64
10:41:24.019405 IP 217.23.2.31 > 10.8.2.5: ICMP echo reply, id 1409, seq 37, length 64
10:41:24.726344 IP 10.8.2.5 > 217.23.2.31: ICMP echo request, id 1409, seq 38, length 64
10:41:25.020169 IP 217.23.2.31 > 10.8.2.5: ICMP echo reply, id 1409, seq 38, length 64
10:41:25.727111 IP 10.8.2.5 > 217.23.2.31: ICMP echo request, id 1409, seq 39, length 64
10:41:26.021016 IP 217.23.2.31 > 10.8.2.5: ICMP echo reply, id 1409, seq 39, length 64
10:41:26.726947 IP 10.8.2.5 > 217.23.2.31: ICMP echo request, id 1409, seq 40, length 64
10:41:27.020987 IP 217.23.2.31 > 10.8.2.5: ICMP echo reply, id 1409, seq 40, length 64
10:41:27.726921 IP 10.8.2.5 > 217.23.2.31: ICMP echo request, id 1409, seq 41, length 64
10:41:28.020787 IP 217.23.2.31 > 10.8.2.5: ICMP echo reply, id 1409, seq 41, length 64
10:41:28.726716 IP 10.8.2.5 > 217.23.2.31: ICMP echo request, id 1409, seq 42, length 64
10:41:29.020856 IP 217.23.2.31 > 10.8.2.5: ICMP echo reply, id 1409, seq 42, length 64
10:41:29.726788 IP 10.8.2.5 > 217.23.2.31: ICMP echo request, id 1409, seq 43, length 64
10:41:30.020680 IP 217.23.2.31 > 10.8.2.5: ICMP echo reply, id 1409, seq 43, length 64
10:41:30.726611 IP 10.8.2.5 > 217.23.2.31: ICMP echo request, id 1409, seq 44, length 64
10:41:31.020230 IP 217.23.2.31 > 10.8.2.5: ICMP echo reply, id 1409, seq 44, length 64
10:41:31.727172 IP 10.8.2.5 > 217.23.2.31: ICMP echo request, id 1409, seq 45, length 64
10:41:32.022945 IP 217.23.2.31 > 10.8.2.5: ICMP echo reply, id 1409, seq 45, length 64
10:41:32.727883 IP 10.8.2.5 > 217.23.2.31: ICMP echo request, id 1409, seq 46, length 64
10:41:33.022023 IP 217.23.2.31 > 10.8.2.5: ICMP echo reply, id 1409, seq 46, length 64
10:41:33.727985 IP 10.8.2.5 > 217.23.2.31: ICMP echo request, id 1409, seq 47, length 64
10:41:34.021861 IP 217.23.2.31 > 10.8.2.5: ICMP echo reply, id 1409, seq 47, length 64
10:41:34.727800 IP 10.8.2.5 > 217.23.2.31: ICMP echo request, id 1409, seq 48, length 64
10:41:35.021890 IP 217.23.2.31 > 10.8.2.5: ICMP echo reply, id 1409, seq 48, length 64
10:41:35.727824 IP 10.8.2.5 > 217.23.2.31: ICMP echo request, id 1409, seq 49, length 64
10:41:36.021509 IP 217.23.2.31 > 10.8.2.5: ICMP echo reply, id 1409, seq 49, length 64
10:41:36.728423 IP 10.8.2.5 > 217.23.2.31: ICMP echo request, id 1409, seq 50, length 64
10:41:37.022269 IP 217.23.2.31 > 10.8.2.5: ICMP echo reply, id 1409, seq 50, length 64
10:41:37.729184 IP 10.8.2.5 > 217.23.2.31: ICMP echo request, id 1409, seq 51, length 64
10:41:38.022965 IP 217.23.2.31 > 10.8.2.5: ICMP echo reply, id 1409, seq 51, length 64
10:41:38.729883 IP 10.8.2.5 > 217.23.2.31: ICMP echo request, id 1409, seq 52, length 64
10:41:39.023518 IP 217.23.2.31 > 10.8.2.5: ICMP echo reply, id 1409, seq 52, length 64
10:41:39.730431 IP 10.8.2.5 > 217.23.2.31: ICMP echo request, id 1409, seq 53, length 64
10:41:40.024361 IP 217.23.2.31 > 10.8.2.5: ICMP echo reply, id 1409, seq 53, length 64
10:41:40.730272 IP 10.8.2.5 > 217.23.2.31: ICMP echo request, id 1409, seq 54, length 64
10:41:41.024585 IP 217.23.2.31 > 10.8.2.5: ICMP echo reply, id 1409, seq 54, length 64
10:41:41.730513 IP 10.8.2.5 > 217.23.2.31: ICMP echo request, id 1409, seq 55, length 64
10:41:42.024168 IP 217.23.2.31 > 10.8.2.5: ICMP echo reply, id 1409, seq 55, length 64
10:41:42.731096 IP 10.8.2.5 > 217.23.2.31: ICMP echo request, id 1409, seq 56, length 64
10:41:43.024790 IP 217.23.2.31 > 10.8.2.5: ICMP echo reply, id 1409, seq 56, length 64
10:41:43.731713 IP 10.8.2.5 > 217.23.2.31: ICMP echo request, id 1409, seq 57, length 64
10:41:44.025602 IP 217.23.2.31 > 10.8.2.5: ICMP echo reply, id 1409, seq 57, length 64
10:41:44.731523 IP 10.8.2.5 > 217.23.2.31: ICMP echo request, id 1409, seq 58, length 64
10:41:45.025313 IP 217.23.2.31 > 10.8.2.5: ICMP echo reply, id 1409, seq 58, length 64
10:41:45.732254 IP 10.8.2.5 > 217.23.2.31: ICMP echo request, id 1409, seq 59, length 64
10:41:46.026170 IP 217.23.2.31 > 10.8.2.5: ICMP echo reply, id 1409, seq 59, length 64
10:41:46.732105 IP 10.8.2.5 > 217.23.2.31: ICMP echo request, id 1409, seq 60, length 64
10:41:47.025782 IP 217.23.2.31 > 10.8.2.5: ICMP echo reply, id 1409, seq 60, length 64
