09:08:26.766440 IP 10.8.2.7 > 165.231.177.51: ICMP echo request, id 1064, seq 1, length 64
09:08:27.115991 IP 165.231.177.51 > 10.8.2.7: ICMP echo reply, id 1064, seq 1, length 64
09:08:27.765848 IP 10.8.2.7 > 165.231.177.51: ICMP echo request, id 1064, seq 2, length 64
09:08:28.115217 IP 165.231.177.51 > 10.8.2.7: ICMP echo reply, id 1064, seq 2, length 64
09:08:28.766152 IP 10.8.2.7 > 165.231.177.51: ICMP echo request, id 1064, seq 3, length 64
09:08:29.115782 IP 165.231.177.51 > 10.8.2.7: ICMP echo reply, id 1064, seq 3, length 64
09:08:29.766693 IP 10.8.2.7 > 165.231.177.51: ICMP echo request, id 1064, seq 4, length 64
09:08:30.115970 IP 165.231.177.51 > 10.8.2.7: ICMP echo reply, id 1064, seq 4, length 64
09:08:30.766202 IP 10.8.2.7 > 165.231.177.51: ICMP echo request, id 1064, seq 5, length 64
09:08:31.116059 IP 165.231.177.51 > 10.8.2.7: ICMP echo reply, id 1064, seq 5, length 64
09:08:31.765963 IP 10.8.2.7 > 165.231.177.51: ICMP echo request, id 1064, seq 6, length 64
09:08:32.115094 IP 165.231.177.51 > 10.8.2.7: ICMP echo reply, id 1064, seq 6, length 64
09:08:32.765966 IP 10.8.2.7 > 165.231.177.51: ICMP echo request, id 1064, seq 7, length 64
09:08:33.117066 IP 165.231.177.51 > 10.8.2.7: ICMP echo reply, id 1064, seq 7, length 64
09:08:33.765937 IP 10.8.2.7 > 165.231.177.51: ICMP echo request, id 1064, seq 8, length 64
09:08:34.115276 IP 165.231.177.51 > 10.8.2.7: ICMP echo reply, id 1064, seq 8, length 64
09:08:34.766148 IP 10.8.2.7 > 165.231.177.51: ICMP echo request, id 1064, seq 9, length 64
09:08:35.115504 IP 165.231.177.51 > 10.8.2.7: ICMP echo reply, id 1064, seq 9, length 64
09:08:35.766361 IP 10.8.2.7 > 165.231.177.51: ICMP echo request, id 1064, seq 10, length 64
09:08:36.116076 IP 165.231.177.51 > 10.8.2.7: ICMP echo reply, id 1064, seq 10, length 64
09:08:36.766950 IP 10.8.2.7 > 165.231.177.51: ICMP echo request, id 1064, seq 11, length 64
09:08:37.116354 IP 165.231.177.51 > 10.8.2.7: ICMP echo reply, id 1064, seq 11, length 64
09:08:37.767244 IP 10.8.2.7 > 165.231.177.51: ICMP echo request, id 1064, seq 12, length 64
09:08:38.116360 IP 165.231.177.51 > 10.8.2.7: ICMP echo reply, id 1064, seq 12, length 64
09:08:38.767230 IP 10.8.2.7 > 165.231.177.51: ICMP echo request, id 1064, seq 13, length 64
09:08:39.116538 IP 165.231.177.51 > 10.8.2.7: ICMP echo reply, id 1064, seq 13, length 64
09:08:39.767431 IP 10.8.2.7 > 165.231.177.51: ICMP echo request, id 1064, seq 14, length 64
09:08:40.116940 IP 165.231.177.51 > 10.8.2.7: ICMP echo reply, id 1064, seq 14, length 64
09:08:40.767807 IP 10.8.2.7 > 165.231.177.51: ICMP echo request, id 1064, seq 15, length 64
09:08:41.117173 IP 165.231.177.51 > 10.8.2.7: ICMP echo reply, id 1064, seq 15, length 64
09:08:41.768043 IP 10.8.2.7 > 165.231.177.51: ICMP echo request, id 1064, seq 16, length 64
09:08:42.117604 IP 165.231.177.51 > 10.8.2.7: ICMP echo reply, id 1064, seq 16, length 64
09:08:42.768493 IP 10.8.2.7 > 165.231.177.51: ICMP echo request, id 1064, seq 17, length 64
09:08:43.117878 IP 165.231.177.51 > 10.8.2.7: ICMP echo reply, id 1064, seq 17, length 64
09:08:43.768744 IP 10.8.2.7 > 165.231.177.51: ICMP echo request, id 1064, seq 18, length 64
09:08:44.118138 IP 165.231.177.51 > 10.8.2.7: ICMP echo reply, id 1064, seq 18, length 64
09:08:44.769036 IP 10.8.2.7 > 165.231.177.51: ICMP echo request, id 1064, seq 19, length 64
09:08:45.118385 IP 165.231.177.51 > 10.8.2.7: ICMP echo reply, id 1064, seq 19, length 64
09:08:45.769276 IP 10.8.2.7 > 165.231.177.51: ICMP echo request, id 1064, seq 20, length 64
09:08:46.119045 IP 165.231.177.51 > 10.8.2.7: ICMP echo reply, id 1064, seq 20, length 64
09:08:46.769922 IP 10.8.2.7 > 165.231.177.51: ICMP echo request, id 1064, seq 21, length 64
09:08:47.119271 IP 165.231.177.51 > 10.8.2.7: ICMP echo reply, id 1064, seq 21, length 64
09:08:47.770156 IP 10.8.2.7 > 165.231.177.51: ICMP echo request, id 1064, seq 22, length 64
09:08:48.119967 IP 165.231.177.51 > 10.8.2.7: ICMP echo reply, id 1064, seq 22, length 64
09:08:48.770851 IP 10.8.2.7 > 165.231.177.51: ICMP echo request, id 1064, seq 23, length 64
09:08:49.120499 IP 165.231.177.51 > 10.8.2.7: ICMP echo reply, id 1064, seq 23, length 64
09:08:49.771378 IP 10.8.2.7 > 165.231.177.51: ICMP echo request, id 1064, seq 24, length 64
09:08:50.120779 IP 165.231.177.51 > 10.8.2.7: ICMP echo reply, id 1064, seq 24, length 64
09:08:50.771658 IP 10.8.2.7 > 165.231.177.51: ICMP echo request, id 1064, seq 25, length 64
09:08:51.121150 IP 165.231.177.51 > 10.8.2.7: ICMP echo reply, id 1064, seq 25, length 64
09:08:51.772032 IP 10.8.2.7 > 165.231.177.51: ICMP echo request, id 1064, seq 26, length 64
09:08:52.121568 IP 165.231.177.51 > 10.8.2.7: ICMP echo reply, id 1064, seq 26, length 64
09:08:52.772445 IP 10.8.2.7 > 165.231.177.51: ICMP echo request, id 1064, seq 27, length 64
09:08:53.121824 IP 165.231.177.51 > 10.8.2.7: ICMP echo reply, id 1064, seq 27, length 64
09:08:53.772707 IP 10.8.2.7 > 165.231.177.51: ICMP echo request, id 1064, seq 28, length 64
09:08:54.121840 IP 165.231.177.51 > 10.8.2.7: ICMP echo reply, id 1064, seq 28, length 64
09:08:54.772740 IP 10.8.2.7 > 165.231.177.51: ICMP echo request, id 1064, seq 29, length 64
09:08:55.122500 IP 165.231.177.51 > 10.8.2.7: ICMP echo reply, id 1064, seq 29, length 64
09:08:55.773363 IP 10.8.2.7 > 165.231.177.51: ICMP echo request, id 1064, seq 30, length 64
09:08:56.122636 IP 165.231.177.51 > 10.8.2.7: ICMP echo reply, id 1064, seq 30, length 64
09:08:56.773512 IP 10.8.2.7 > 165.231.177.51: ICMP echo request, id 1064, seq 31, length 64
09:08:57.123468 IP 165.231.177.51 > 10.8.2.7: ICMP echo reply, id 1064, seq 31, length 64
09:08:57.773369 IP 10.8.2.7 > 165.231.177.51: ICMP echo request, id 1064, seq 32, length 64
09:08:58.122673 IP 165.231.177.51 > 10.8.2.7: ICMP echo reply, id 1064, seq 32, length 64
09:08:58.773539 IP 10.8.2.7 > 165.231.177.51: ICMP echo request, id 1064, seq 33, length 64
09:08:59.123121 IP 165.231.177.51 > 10.8.2.7: ICMP echo reply, id 1064, seq 33, length 64
09:08:59.774023 IP 10.8.2.7 > 165.231.177.51: ICMP echo request, id 1064, seq 34, length 64
09:09:00.123542 IP 165.231.177.51 > 10.8.2.7: ICMP echo reply, id 1064, seq 34, length 64
09:09:00.774218 IP 10.8.2.7 > 165.231.177.51: ICMP echo request, id 1064, seq 35, length 64
09:09:01.123706 IP 165.231.177.51 > 10.8.2.7: ICMP echo reply, id 1064, seq 35, length 64
09:09:01.774218 IP 10.8.2.7 > 165.231.177.51: ICMP echo request, id 1064, seq 36, length 64
09:09:02.123351 IP 165.231.177.51 > 10.8.2.7: ICMP echo reply, id 1064, seq 36, length 64
09:09:02.774202 IP 10.8.2.7 > 165.231.177.51: ICMP echo request, id 1064, seq 37, length 64
09:09:03.123565 IP 165.231.177.51 > 10.8.2.7: ICMP echo reply, id 1064, seq 37, length 64
09:09:03.774447 IP 10.8.2.7 > 165.231.177.51: ICMP echo request, id 1064, seq 38, length 64
09:09:04.123979 IP 165.231.177.51 > 10.8.2.7: ICMP echo reply, id 1064, seq 38, length 64
09:09:04.774863 IP 10.8.2.7 > 165.231.177.51: ICMP echo request, id 1064, seq 39, length 64
09:09:05.124199 IP 165.231.177.51 > 10.8.2.7: ICMP echo reply, id 1064, seq 39, length 64
09:09:05.775091 IP 10.8.2.7 > 165.231.177.51: ICMP echo request, id 1064, seq 40, length 64
09:09:06.127275 IP 165.231.177.51 > 10.8.2.7: ICMP echo reply, id 1064, seq 40, length 64
09:09:06.775173 IP 10.8.2.7 > 165.231.177.51: ICMP echo request, id 1064, seq 41, length 64
09:09:07.124439 IP 165.231.177.51 > 10.8.2.7: ICMP echo reply, id 1064, seq 41, length 64
09:09:07.775335 IP 10.8.2.7 > 165.231.177.51: ICMP echo request, id 1064, seq 42, length 64
09:09:08.124684 IP 165.231.177.51 > 10.8.2.7: ICMP echo reply, id 1064, seq 42, length 64
09:09:08.775581 IP 10.8.2.7 > 165.231.177.51: ICMP echo request, id 1064, seq 43, length 64
09:09:09.125087 IP 165.231.177.51 > 10.8.2.7: ICMP echo reply, id 1064, seq 43, length 64
09:09:09.775963 IP 10.8.2.7 > 165.231.177.51: ICMP echo request, id 1064, seq 44, length 64
09:09:10.125560 IP 165.231.177.51 > 10.8.2.7: ICMP echo reply, id 1064, seq 44, length 64
09:09:10.776458 IP 10.8.2.7 > 165.231.177.51: ICMP echo request, id 1064, seq 45, length 64
09:09:11.125907 IP 165.231.177.51 > 10.8.2.7: ICMP echo reply, id 1064, seq 45, length 64
09:09:11.776707 IP 10.8.2.7 > 165.231.177.51: ICMP echo request, id 1064, seq 46, length 64
09:09:12.126352 IP 165.231.177.51 > 10.8.2.7: ICMP echo reply, id 1064, seq 46, length 64
09:09:12.777262 IP 10.8.2.7 > 165.231.177.51: ICMP echo request, id 1064, seq 47, length 64
09:09:13.126543 IP 165.231.177.51 > 10.8.2.7: ICMP echo reply, id 1064, seq 47, length 64
09:09:13.777438 IP 10.8.2.7 > 165.231.177.51: ICMP echo request, id 1064, seq 48, length 64
09:09:14.126763 IP 165.231.177.51 > 10.8.2.7: ICMP echo reply, id 1064, seq 48, length 64
09:09:14.777662 IP 10.8.2.7 > 165.231.177.51: ICMP echo request, id 1064, seq 49, length 64
09:09:15.126990 IP 165.231.177.51 > 10.8.2.7: ICMP echo reply, id 1064, seq 49, length 64
09:09:15.777887 IP 10.8.2.7 > 165.231.177.51: ICMP echo request, id 1064, seq 50, length 64
09:09:16.127254 IP 165.231.177.51 > 10.8.2.7: ICMP echo reply, id 1064, seq 50, length 64
09:09:16.778160 IP 10.8.2.7 > 165.231.177.51: ICMP echo request, id 1064, seq 51, length 64
09:09:17.127431 IP 165.231.177.51 > 10.8.2.7: ICMP echo reply, id 1064, seq 51, length 64
09:09:17.778306 IP 10.8.2.7 > 165.231.177.51: ICMP echo request, id 1064, seq 52, length 64
09:09:18.129596 IP 165.231.177.51 > 10.8.2.7: ICMP echo reply, id 1064, seq 52, length 64
09:09:18.778492 IP 10.8.2.7 > 165.231.177.51: ICMP echo request, id 1064, seq 53, length 64
09:09:19.127882 IP 165.231.177.51 > 10.8.2.7: ICMP echo reply, id 1064, seq 53, length 64
09:09:19.778759 IP 10.8.2.7 > 165.231.177.51: ICMP echo request, id 1064, seq 54, length 64
09:09:20.127943 IP 165.231.177.51 > 10.8.2.7: ICMP echo reply, id 1064, seq 54, length 64
09:09:20.778831 IP 10.8.2.7 > 165.231.177.51: ICMP echo request, id 1064, seq 55, length 64
09:09:21.127895 IP 165.231.177.51 > 10.8.2.7: ICMP echo reply, id 1064, seq 55, length 64
09:09:21.778783 IP 10.8.2.7 > 165.231.177.51: ICMP echo request, id 1064, seq 56, length 64
09:09:22.128294 IP 165.231.177.51 > 10.8.2.7: ICMP echo reply, id 1064, seq 56, length 64
09:09:22.779182 IP 10.8.2.7 > 165.231.177.51: ICMP echo request, id 1064, seq 57, length 64
09:09:23.129042 IP 165.231.177.51 > 10.8.2.7: ICMP echo reply, id 1064, seq 57, length 64
09:09:23.778949 IP 10.8.2.7 > 165.231.177.51: ICMP echo request, id 1064, seq 58, length 64
09:09:24.128533 IP 165.231.177.51 > 10.8.2.7: ICMP echo reply, id 1064, seq 58, length 64
09:09:24.779440 IP 10.8.2.7 > 165.231.177.51: ICMP echo request, id 1064, seq 59, length 64
09:09:25.129136 IP 165.231.177.51 > 10.8.2.7: ICMP echo reply, id 1064, seq 59, length 64
09:09:25.780041 IP 10.8.2.7 > 165.231.177.51: ICMP echo request, id 1064, seq 60, length 64
