13:44:45.013236 IP 10.8.0.2 > 192.154.198.15: ICMP echo request, id 2090, seq 2, length 64
13:44:45.375309 IP 192.154.198.15 > 10.8.0.2: ICMP echo reply, id 2090, seq 2, length 64
13:44:46.014154 IP 10.8.0.2 > 192.154.198.15: ICMP echo request, id 2090, seq 3, length 64
13:44:46.376178 IP 192.154.198.15 > 10.8.0.2: ICMP echo reply, id 2090, seq 3, length 64
13:44:47.015019 IP 10.8.0.2 > 192.154.198.15: ICMP echo request, id 2090, seq 4, length 64
13:44:47.377623 IP 192.154.198.15 > 10.8.0.2: ICMP echo reply, id 2090, seq 4, length 64
13:44:48.016461 IP 10.8.0.2 > 192.154.198.15: ICMP echo request, id 2090, seq 5, length 64
13:44:48.378405 IP 192.154.198.15 > 10.8.0.2: ICMP echo reply, id 2090, seq 5, length 64
13:44:49.017244 IP 10.8.0.2 > 192.154.198.15: ICMP echo request, id 2090, seq 6, length 64
13:44:49.474411 IP 192.154.198.15 > 10.8.0.2: ICMP echo reply, id 2090, seq 6, length 64
13:44:50.018152 IP 10.8.0.2 > 192.154.198.15: ICMP echo request, id 2090, seq 7, length 64
13:44:51.038205 IP 10.8.0.2 > 192.154.198.15: ICMP echo request, id 2090, seq 8, length 64
13:44:52.062203 IP 10.8.0.2 > 192.154.198.15: ICMP echo request, id 2090, seq 9, length 64
13:44:53.086197 IP 10.8.0.2 > 192.154.198.15: ICMP echo request, id 2090, seq 10, length 64
13:44:54.110155 IP 10.8.0.2 > 192.154.198.15: ICMP echo request, id 2090, seq 11, length 64
13:44:54.537495 IP 192.154.198.15 > 10.8.0.2: ICMP echo reply, id 2090, seq 11, length 64
13:44:55.111223 IP 10.8.0.2 > 192.154.198.15: ICMP echo request, id 2090, seq 12, length 64
13:44:55.548327 IP 192.154.198.15 > 10.8.0.2: ICMP echo reply, id 2090, seq 12, length 64
13:44:56.112088 IP 10.8.0.2 > 192.154.198.15: ICMP echo request, id 2090, seq 13, length 64
13:44:57.118199 IP 10.8.0.2 > 192.154.198.15: ICMP echo request, id 2090, seq 14, length 64
13:44:58.142199 IP 10.8.0.2 > 192.154.198.15: ICMP echo request, id 2090, seq 15, length 64
13:44:59.166197 IP 10.8.0.2 > 192.154.198.15: ICMP echo request, id 2090, seq 16, length 64
13:44:59.528144 IP 192.154.198.15 > 10.8.0.2: ICMP echo reply, id 2090, seq 16, length 64
13:45:00.166985 IP 10.8.0.2 > 192.154.198.15: ICMP echo request, id 2090, seq 17, length 64
13:45:00.616613 IP 192.154.198.15 > 10.8.0.2: ICMP echo reply, id 2090, seq 17, length 64
13:45:01.168364 IP 10.8.0.2 > 192.154.198.15: ICMP echo request, id 2090, seq 18, length 64
13:45:02.174201 IP 10.8.0.2 > 192.154.198.15: ICMP echo request, id 2090, seq 19, length 64
13:45:03.198200 IP 10.8.0.2 > 192.154.198.15: ICMP echo request, id 2090, seq 20, length 64
13:45:03.645449 IP 192.154.198.15 > 10.8.0.2: ICMP echo reply, id 2090, seq 20, length 64
13:45:04.199206 IP 10.8.0.2 > 192.154.198.15: ICMP echo request, id 2090, seq 21, length 64
13:45:04.625435 IP 192.154.198.15 > 10.8.0.2: ICMP echo reply, id 2090, seq 21, length 64
13:45:05.200202 IP 10.8.0.2 > 192.154.198.15: ICMP echo request, id 2090, seq 22, length 64
13:45:05.640415 IP 192.154.198.15 > 10.8.0.2: ICMP echo reply, id 2090, seq 22, length 64
13:45:06.201169 IP 10.8.0.2 > 192.154.198.15: ICMP echo request, id 2090, seq 23, length 64
13:45:06.641443 IP 192.154.198.15 > 10.8.0.2: ICMP echo reply, id 2090, seq 23, length 64
13:45:07.202201 IP 10.8.0.2 > 192.154.198.15: ICMP echo request, id 2090, seq 24, length 64
13:45:08.222204 IP 10.8.0.2 > 192.154.198.15: ICMP echo request, id 2090, seq 25, length 64
13:45:08.584138 IP 192.154.198.15 > 10.8.0.2: ICMP echo reply, id 2090, seq 25, length 64
13:45:09.222997 IP 10.8.0.2 > 192.154.198.15: ICMP echo request, id 2090, seq 26, length 64
13:45:09.640912 IP 192.154.198.15 > 10.8.0.2: ICMP echo reply, id 2090, seq 26, length 64
13:45:10.223722 IP 10.8.0.2 > 192.154.198.15: ICMP echo request, id 2090, seq 27, length 64
13:45:10.680310 IP 192.154.198.15 > 10.8.0.2: ICMP echo reply, id 2090, seq 27, length 64
13:45:11.225111 IP 10.8.0.2 > 192.154.198.15: ICMP echo request, id 2090, seq 28, length 64
13:45:12.254230 IP 10.8.0.2 > 192.154.198.15: ICMP echo request, id 2090, seq 29, length 64
13:45:12.701993 IP 192.154.198.15 > 10.8.0.2: ICMP echo reply, id 2090, seq 29, length 64
13:45:13.255791 IP 10.8.0.2 > 192.154.198.15: ICMP echo request, id 2090, seq 30, length 64
13:45:13.687220 IP 192.154.198.15 > 10.8.0.2: ICMP echo reply, id 2090, seq 30, length 64
13:45:14.256999 IP 10.8.0.2 > 192.154.198.15: ICMP echo request, id 2090, seq 31, length 64
13:45:14.687562 IP 192.154.198.15 > 10.8.0.2: ICMP echo reply, id 2090, seq 31, length 64
13:45:15.258208 IP 10.8.0.2 > 192.154.198.15: ICMP echo request, id 2090, seq 32, length 64
13:45:16.286220 IP 10.8.0.2 > 192.154.198.15: ICMP echo request, id 2090, seq 33, length 64
13:45:16.647865 IP 192.154.198.15 > 10.8.0.2: ICMP echo reply, id 2090, seq 33, length 64
13:45:17.287724 IP 10.8.0.2 > 192.154.198.15: ICMP echo request, id 2090, seq 34, length 64
13:45:18.302216 IP 10.8.0.2 > 192.154.198.15: ICMP echo request, id 2090, seq 35, length 64
13:45:18.723108 IP 192.154.198.15 > 10.8.0.2: ICMP echo reply, id 2090, seq 35, length 64
13:45:19.302906 IP 10.8.0.2 > 192.154.198.15: ICMP echo request, id 2090, seq 36, length 64
13:45:19.683368 IP 192.154.198.15 > 10.8.0.2: ICMP echo reply, id 2090, seq 36, length 64
13:45:20.304205 IP 10.8.0.2 > 192.154.198.15: ICMP echo request, id 2090, seq 37, length 64
13:45:20.745345 IP 192.154.198.15 > 10.8.0.2: ICMP echo reply, id 2090, seq 37, length 64
13:45:21.305119 IP 10.8.0.2 > 192.154.198.15: ICMP echo request, id 2090, seq 38, length 64
13:45:21.736357 IP 192.154.198.15 > 10.8.0.2: ICMP echo reply, id 2090, seq 38, length 64
13:45:22.306147 IP 10.8.0.2 > 192.154.198.15: ICMP echo request, id 2090, seq 39, length 64
13:45:23.326207 IP 10.8.0.2 > 192.154.198.15: ICMP echo request, id 2090, seq 40, length 64
13:45:23.962381 IP 192.154.198.15 > 10.8.0.2: ICMP echo reply, id 2090, seq 39, length 64
13:45:23.962425 IP 192.154.198.15 > 10.8.0.2: ICMP echo reply, id 2090, seq 40, length 64
13:45:24.326972 IP 10.8.0.2 > 192.154.198.15: ICMP echo request, id 2090, seq 41, length 64
13:45:24.757895 IP 192.154.198.15 > 10.8.0.2: ICMP echo reply, id 2090, seq 41, length 64
13:45:25.327679 IP 10.8.0.2 > 192.154.198.15: ICMP echo request, id 2090, seq 42, length 64
13:45:26.334210 IP 10.8.0.2 > 192.154.198.15: ICMP echo request, id 2090, seq 43, length 64
13:45:27.358202 IP 10.8.0.2 > 192.154.198.15: ICMP echo request, id 2090, seq 44, length 64
13:45:27.824895 IP 192.154.198.15 > 10.8.0.2: ICMP echo reply, id 2090, seq 44, length 64
13:45:28.359653 IP 10.8.0.2 > 192.154.198.15: ICMP echo request, id 2090, seq 45, length 64
13:45:29.374207 IP 10.8.0.2 > 192.154.198.15: ICMP echo request, id 2090, seq 46, length 64
13:45:29.830515 IP 192.154.198.15 > 10.8.0.2: ICMP echo reply, id 2090, seq 46, length 64
13:45:30.375274 IP 10.8.0.2 > 192.154.198.15: ICMP echo request, id 2090, seq 47, length 64
13:45:30.823107 IP 192.154.198.15 > 10.8.0.2: ICMP echo reply, id 2090, seq 47, length 64
13:45:31.376875 IP 10.8.0.2 > 192.154.198.15: ICMP echo request, id 2090, seq 48, length 64
13:45:31.839774 IP 192.154.198.15 > 10.8.0.2: ICMP echo reply, id 2090, seq 48, length 64
13:45:32.377538 IP 10.8.0.2 > 192.154.198.15: ICMP echo request, id 2090, seq 49, length 64
13:45:33.406207 IP 10.8.0.2 > 192.154.198.15: ICMP echo request, id 2090, seq 50, length 64
13:45:33.847684 IP 192.154.198.15 > 10.8.0.2: ICMP echo reply, id 2090, seq 50, length 64
13:45:34.407467 IP 10.8.0.2 > 192.154.198.15: ICMP echo request, id 2090, seq 51, length 64
13:45:35.422215 IP 10.8.0.2 > 192.154.198.15: ICMP echo request, id 2090, seq 52, length 64
13:45:35.862605 IP 192.154.198.15 > 10.8.0.2: ICMP echo reply, id 2090, seq 52, length 64
