16:04:43.785154 IP 10.8.2.19 > 178.175.133.99: ICMP echo request, id 376, seq 1, length 64
16:04:44.116441 IP 178.175.133.99 > 10.8.2.19: ICMP echo reply, id 376, seq 1, length 64
16:04:45.155376 IP 10.8.2.19 > 178.175.133.99: ICMP echo request, id 376, seq 2, length 64
16:04:45.487458 IP 178.175.133.99 > 10.8.2.19: ICMP echo reply, id 376, seq 2, length 64
16:04:46.156393 IP 10.8.2.19 > 178.175.133.99: ICMP echo request, id 376, seq 3, length 64
16:04:46.487343 IP 178.175.133.99 > 10.8.2.19: ICMP echo reply, id 376, seq 3, length 64
16:04:47.157240 IP 10.8.2.19 > 178.175.133.99: ICMP echo request, id 376, seq 4, length 64
16:04:47.488256 IP 178.175.133.99 > 10.8.2.19: ICMP echo reply, id 376, seq 4, length 64
16:04:48.158156 IP 10.8.2.19 > 178.175.133.99: ICMP echo request, id 376, seq 5, length 64
16:04:48.489879 IP 178.175.133.99 > 10.8.2.19: ICMP echo reply, id 376, seq 5, length 64
16:04:49.159773 IP 10.8.2.19 > 178.175.133.99: ICMP echo request, id 376, seq 6, length 64
16:04:49.490980 IP 178.175.133.99 > 10.8.2.19: ICMP echo reply, id 376, seq 6, length 64
16:04:50.160874 IP 10.8.2.19 > 178.175.133.99: ICMP echo request, id 376, seq 7, length 64
16:04:50.492157 IP 178.175.133.99 > 10.8.2.19: ICMP echo reply, id 376, seq 7, length 64
16:04:51.162059 IP 10.8.2.19 > 178.175.133.99: ICMP echo request, id 376, seq 8, length 64
16:04:51.493226 IP 178.175.133.99 > 10.8.2.19: ICMP echo reply, id 376, seq 8, length 64
16:04:52.163134 IP 10.8.2.19 > 178.175.133.99: ICMP echo request, id 376, seq 9, length 64
16:04:52.494756 IP 178.175.133.99 > 10.8.2.19: ICMP echo reply, id 376, seq 9, length 64
16:04:53.164656 IP 10.8.2.19 > 178.175.133.99: ICMP echo request, id 376, seq 10, length 64
16:04:53.495982 IP 178.175.133.99 > 10.8.2.19: ICMP echo reply, id 376, seq 10, length 64
16:04:54.165879 IP 10.8.2.19 > 178.175.133.99: ICMP echo request, id 376, seq 11, length 64
16:04:54.498856 IP 178.175.133.99 > 10.8.2.19: ICMP echo reply, id 376, seq 11, length 64
16:04:55.166761 IP 10.8.2.19 > 178.175.133.99: ICMP echo request, id 376, seq 12, length 64
16:04:55.497899 IP 178.175.133.99 > 10.8.2.19: ICMP echo reply, id 376, seq 12, length 64
16:04:56.167802 IP 10.8.2.19 > 178.175.133.99: ICMP echo request, id 376, seq 13, length 64
16:04:56.499856 IP 178.175.133.99 > 10.8.2.19: ICMP echo reply, id 376, seq 13, length 64
16:04:57.168758 IP 10.8.2.19 > 178.175.133.99: ICMP echo request, id 376, seq 14, length 64
16:04:57.500309 IP 178.175.133.99 > 10.8.2.19: ICMP echo reply, id 376, seq 14, length 64
16:04:58.170201 IP 10.8.2.19 > 178.175.133.99: ICMP echo request, id 376, seq 15, length 64
16:04:58.504295 IP 178.175.133.99 > 10.8.2.19: ICMP echo reply, id 376, seq 15, length 64
16:04:59.171190 IP 10.8.2.19 > 178.175.133.99: ICMP echo request, id 376, seq 16, length 64
16:04:59.502266 IP 178.175.133.99 > 10.8.2.19: ICMP echo reply, id 376, seq 16, length 64
16:05:00.172168 IP 10.8.2.19 > 178.175.133.99: ICMP echo request, id 376, seq 17, length 64
16:05:00.504220 IP 178.175.133.99 > 10.8.2.19: ICMP echo reply, id 376, seq 17, length 64
16:05:01.173117 IP 10.8.2.19 > 178.175.133.99: ICMP echo request, id 376, seq 18, length 64
16:05:01.504160 IP 178.175.133.99 > 10.8.2.19: ICMP echo reply, id 376, seq 18, length 64
16:05:02.174061 IP 10.8.2.19 > 178.175.133.99: ICMP echo request, id 376, seq 19, length 64
16:05:02.505600 IP 178.175.133.99 > 10.8.2.19: ICMP echo reply, id 376, seq 19, length 64
16:05:03.175468 IP 10.8.2.19 > 178.175.133.99: ICMP echo request, id 376, seq 20, length 64
16:05:03.506660 IP 178.175.133.99 > 10.8.2.19: ICMP echo reply, id 376, seq 20, length 64
16:05:04.176561 IP 10.8.2.19 > 178.175.133.99: ICMP echo request, id 376, seq 21, length 64
16:05:04.509135 IP 178.175.133.99 > 10.8.2.19: ICMP echo reply, id 376, seq 21, length 64
16:05:05.178025 IP 10.8.2.19 > 178.175.133.99: ICMP echo request, id 376, seq 22, length 64
16:05:05.509341 IP 178.175.133.99 > 10.8.2.19: ICMP echo reply, id 376, seq 22, length 64
16:05:06.179242 IP 10.8.2.19 > 178.175.133.99: ICMP echo request, id 376, seq 23, length 64
16:05:06.510336 IP 178.175.133.99 > 10.8.2.19: ICMP echo reply, id 376, seq 23, length 64
16:05:07.180235 IP 10.8.2.19 > 178.175.133.99: ICMP echo request, id 376, seq 24, length 64
16:05:07.511748 IP 178.175.133.99 > 10.8.2.19: ICMP echo reply, id 376, seq 24, length 64
16:05:08.181649 IP 10.8.2.19 > 178.175.133.99: ICMP echo request, id 376, seq 25, length 64
16:05:08.512769 IP 178.175.133.99 > 10.8.2.19: ICMP echo reply, id 376, seq 25, length 64
16:05:09.182661 IP 10.8.2.19 > 178.175.133.99: ICMP echo request, id 376, seq 26, length 64
16:05:09.514000 IP 178.175.133.99 > 10.8.2.19: ICMP echo reply, id 376, seq 26, length 64
16:05:10.183896 IP 10.8.2.19 > 178.175.133.99: ICMP echo request, id 376, seq 27, length 64
16:05:10.514993 IP 178.175.133.99 > 10.8.2.19: ICMP echo reply, id 376, seq 27, length 64
16:05:11.184891 IP 10.8.2.19 > 178.175.133.99: ICMP echo request, id 376, seq 28, length 64
16:05:11.516482 IP 178.175.133.99 > 10.8.2.19: ICMP echo reply, id 376, seq 28, length 64
16:05:12.186379 IP 10.8.2.19 > 178.175.133.99: ICMP echo request, id 376, seq 29, length 64
16:05:12.518245 IP 178.175.133.99 > 10.8.2.19: ICMP echo reply, id 376, seq 29, length 64
16:05:13.187148 IP 10.8.2.19 > 178.175.133.99: ICMP echo request, id 376, seq 30, length 64
16:05:13.518863 IP 178.175.133.99 > 10.8.2.19: ICMP echo reply, id 376, seq 30, length 64
16:05:14.188770 IP 10.8.2.19 > 178.175.133.99: ICMP echo request, id 376, seq 31, length 64
16:05:14.519702 IP 178.175.133.99 > 10.8.2.19: ICMP echo reply, id 376, seq 31, length 64
16:05:15.189598 IP 10.8.2.19 > 178.175.133.99: ICMP echo request, id 376, seq 32, length 64
16:05:15.520961 IP 178.175.133.99 > 10.8.2.19: ICMP echo reply, id 376, seq 32, length 64
16:05:16.190855 IP 10.8.2.19 > 178.175.133.99: ICMP echo request, id 376, seq 33, length 64
16:05:16.521936 IP 178.175.133.99 > 10.8.2.19: ICMP echo reply, id 376, seq 33, length 64
16:05:17.191831 IP 10.8.2.19 > 178.175.133.99: ICMP echo request, id 376, seq 34, length 64
16:05:17.522949 IP 178.175.133.99 > 10.8.2.19: ICMP echo reply, id 376, seq 34, length 64
16:05:18.192842 IP 10.8.2.19 > 178.175.133.99: ICMP echo request, id 376, seq 35, length 64
16:05:18.523841 IP 178.175.133.99 > 10.8.2.19: ICMP echo reply, id 376, seq 35, length 64
16:05:19.193733 IP 10.8.2.19 > 178.175.133.99: ICMP echo request, id 376, seq 36, length 64
16:05:19.525225 IP 178.175.133.99 > 10.8.2.19: ICMP echo reply, id 376, seq 36, length 64
16:05:20.195119 IP 10.8.2.19 > 178.175.133.99: ICMP echo request, id 376, seq 37, length 64
16:05:20.526245 IP 178.175.133.99 > 10.8.2.19: ICMP echo reply, id 376, seq 37, length 64
16:05:21.196140 IP 10.8.2.19 > 178.175.133.99: ICMP echo request, id 376, seq 38, length 64
16:05:21.527259 IP 178.175.133.99 > 10.8.2.19: ICMP echo reply, id 376, seq 38, length 64
16:05:22.197154 IP 10.8.2.19 > 178.175.133.99: ICMP echo request, id 376, seq 39, length 64
16:05:22.528096 IP 178.175.133.99 > 10.8.2.19: ICMP echo reply, id 376, seq 39, length 64
16:05:23.197989 IP 10.8.2.19 > 178.175.133.99: ICMP echo request, id 376, seq 40, length 64
16:05:23.529107 IP 178.175.133.99 > 10.8.2.19: ICMP echo reply, id 376, seq 40, length 64
16:05:24.199003 IP 10.8.2.19 > 178.175.133.99: ICMP echo request, id 376, seq 41, length 64
16:05:24.529948 IP 178.175.133.99 > 10.8.2.19: ICMP echo reply, id 376, seq 41, length 64
16:05:25.199850 IP 10.8.2.19 > 178.175.133.99: ICMP echo request, id 376, seq 42, length 64
16:05:25.532570 IP 178.175.133.99 > 10.8.2.19: ICMP echo reply, id 376, seq 42, length 64
16:05:26.201476 IP 10.8.2.19 > 178.175.133.99: ICMP echo request, id 376, seq 43, length 64
16:05:26.533191 IP 178.175.133.99 > 10.8.2.19: ICMP echo reply, id 376, seq 43, length 64
16:05:27.203085 IP 10.8.2.19 > 178.175.133.99: ICMP echo request, id 376, seq 44, length 64
16:05:27.534417 IP 178.175.133.99 > 10.8.2.19: ICMP echo reply, id 376, seq 44, length 64
16:05:28.204313 IP 10.8.2.19 > 178.175.133.99: ICMP echo request, id 376, seq 45, length 64
16:05:28.535619 IP 178.175.133.99 > 10.8.2.19: ICMP echo reply, id 376, seq 45, length 64
16:05:29.205514 IP 10.8.2.19 > 178.175.133.99: ICMP echo request, id 376, seq 46, length 64
16:05:29.536812 IP 178.175.133.99 > 10.8.2.19: ICMP echo reply, id 376, seq 46, length 64
16:05:30.206712 IP 10.8.2.19 > 178.175.133.99: ICMP echo request, id 376, seq 47, length 64
16:05:30.537844 IP 178.175.133.99 > 10.8.2.19: ICMP echo reply, id 376, seq 47, length 64
16:05:31.207736 IP 10.8.2.19 > 178.175.133.99: ICMP echo request, id 376, seq 48, length 64
16:05:31.538882 IP 178.175.133.99 > 10.8.2.19: ICMP echo reply, id 376, seq 48, length 64
16:05:32.208775 IP 10.8.2.19 > 178.175.133.99: ICMP echo request, id 376, seq 49, length 64
16:05:32.539786 IP 178.175.133.99 > 10.8.2.19: ICMP echo reply, id 376, seq 49, length 64
16:05:33.209680 IP 10.8.2.19 > 178.175.133.99: ICMP echo request, id 376, seq 50, length 64
16:05:33.540535 IP 178.175.133.99 > 10.8.2.19: ICMP echo reply, id 376, seq 50, length 64
16:05:34.210431 IP 10.8.2.19 > 178.175.133.99: ICMP echo request, id 376, seq 51, length 64
16:05:34.541349 IP 178.175.133.99 > 10.8.2.19: ICMP echo reply, id 376, seq 51, length 64
16:05:35.211246 IP 10.8.2.19 > 178.175.133.99: ICMP echo request, id 376, seq 52, length 64
16:05:35.543013 IP 178.175.133.99 > 10.8.2.19: ICMP echo reply, id 376, seq 52, length 64
16:05:36.212949 IP 10.8.2.19 > 178.175.133.99: ICMP echo request, id 376, seq 53, length 64
16:05:36.544045 IP 178.175.133.99 > 10.8.2.19: ICMP echo reply, id 376, seq 53, length 64
16:05:37.213948 IP 10.8.2.19 > 178.175.133.99: ICMP echo request, id 376, seq 54, length 64
16:05:37.545023 IP 178.175.133.99 > 10.8.2.19: ICMP echo reply, id 376, seq 54, length 64
16:05:38.214930 IP 10.8.2.19 > 178.175.133.99: ICMP echo request, id 376, seq 55, length 64
16:05:38.546296 IP 178.175.133.99 > 10.8.2.19: ICMP echo reply, id 376, seq 55, length 64
16:05:39.216192 IP 10.8.2.19 > 178.175.133.99: ICMP echo request, id 376, seq 56, length 64
16:05:39.547308 IP 178.175.133.99 > 10.8.2.19: ICMP echo reply, id 376, seq 56, length 64
16:05:40.217208 IP 10.8.2.19 > 178.175.133.99: ICMP echo request, id 376, seq 57, length 64
16:05:40.548707 IP 178.175.133.99 > 10.8.2.19: ICMP echo reply, id 376, seq 57, length 64
16:05:41.218612 IP 10.8.2.19 > 178.175.133.99: ICMP echo request, id 376, seq 58, length 64
16:05:41.552100 IP 178.175.133.99 > 10.8.2.19: ICMP echo reply, id 376, seq 58, length 64
16:05:42.219992 IP 10.8.2.19 > 178.175.133.99: ICMP echo request, id 376, seq 59, length 64
16:05:42.554335 IP 178.175.133.99 > 10.8.2.19: ICMP echo reply, id 376, seq 59, length 64
