21:22:46.341159 IP 10.8.1.2 > 185.229.59.100: ICMP echo request, id 738, seq 1, length 64
21:22:46.738601 IP 185.229.59.100 > 10.8.1.2: ICMP echo reply, id 738, seq 1, length 64
21:22:47.340611 IP 10.8.1.2 > 185.229.59.100: ICMP echo request, id 738, seq 2, length 64
21:22:47.737918 IP 185.229.59.100 > 10.8.1.2: ICMP echo reply, id 738, seq 2, length 64
21:22:48.341768 IP 10.8.1.2 > 185.229.59.100: ICMP echo request, id 738, seq 3, length 64
21:22:48.739219 IP 185.229.59.100 > 10.8.1.2: ICMP echo reply, id 738, seq 3, length 64
21:22:49.343073 IP 10.8.1.2 > 185.229.59.100: ICMP echo request, id 738, seq 4, length 64
21:22:49.740486 IP 185.229.59.100 > 10.8.1.2: ICMP echo reply, id 738, seq 4, length 64
21:22:50.344325 IP 10.8.1.2 > 185.229.59.100: ICMP echo request, id 738, seq 5, length 64
21:22:50.741707 IP 185.229.59.100 > 10.8.1.2: ICMP echo reply, id 738, seq 5, length 64
21:22:51.345549 IP 10.8.1.2 > 185.229.59.100: ICMP echo request, id 738, seq 6, length 64
21:22:51.742881 IP 185.229.59.100 > 10.8.1.2: ICMP echo reply, id 738, seq 6, length 64
21:22:52.346723 IP 10.8.1.2 > 185.229.59.100: ICMP echo request, id 738, seq 7, length 64
21:22:52.744151 IP 185.229.59.100 > 10.8.1.2: ICMP echo reply, id 738, seq 7, length 64
21:22:53.347995 IP 10.8.1.2 > 185.229.59.100: ICMP echo request, id 738, seq 8, length 64
21:22:53.745329 IP 185.229.59.100 > 10.8.1.2: ICMP echo reply, id 738, seq 8, length 64
21:22:54.349168 IP 10.8.1.2 > 185.229.59.100: ICMP echo request, id 738, seq 9, length 64
21:22:54.746741 IP 185.229.59.100 > 10.8.1.2: ICMP echo reply, id 738, seq 9, length 64
21:22:55.350577 IP 10.8.1.2 > 185.229.59.100: ICMP echo request, id 738, seq 10, length 64
21:22:55.747966 IP 185.229.59.100 > 10.8.1.2: ICMP echo reply, id 738, seq 10, length 64
21:22:56.351814 IP 10.8.1.2 > 185.229.59.100: ICMP echo request, id 738, seq 11, length 64
21:22:56.749287 IP 185.229.59.100 > 10.8.1.2: ICMP echo reply, id 738, seq 11, length 64
21:22:57.353128 IP 10.8.1.2 > 185.229.59.100: ICMP echo request, id 738, seq 12, length 64
21:22:57.750619 IP 185.229.59.100 > 10.8.1.2: ICMP echo reply, id 738, seq 12, length 64
21:22:58.354456 IP 10.8.1.2 > 185.229.59.100: ICMP echo request, id 738, seq 13, length 64
21:22:58.751860 IP 185.229.59.100 > 10.8.1.2: ICMP echo reply, id 738, seq 13, length 64
21:22:59.355714 IP 10.8.1.2 > 185.229.59.100: ICMP echo request, id 738, seq 14, length 64
21:22:59.753213 IP 185.229.59.100 > 10.8.1.2: ICMP echo reply, id 738, seq 14, length 64
21:23:00.357058 IP 10.8.1.2 > 185.229.59.100: ICMP echo request, id 738, seq 15, length 64
21:23:00.754268 IP 185.229.59.100 > 10.8.1.2: ICMP echo reply, id 738, seq 15, length 64
21:23:01.358109 IP 10.8.1.2 > 185.229.59.100: ICMP echo request, id 738, seq 16, length 64
21:23:01.755665 IP 185.229.59.100 > 10.8.1.2: ICMP echo reply, id 738, seq 16, length 64
21:23:02.359490 IP 10.8.1.2 > 185.229.59.100: ICMP echo request, id 738, seq 17, length 64
21:23:02.756872 IP 185.229.59.100 > 10.8.1.2: ICMP echo reply, id 738, seq 17, length 64
21:23:03.360707 IP 10.8.1.2 > 185.229.59.100: ICMP echo request, id 738, seq 18, length 64
21:23:03.758222 IP 185.229.59.100 > 10.8.1.2: ICMP echo reply, id 738, seq 18, length 64
21:23:04.362058 IP 10.8.1.2 > 185.229.59.100: ICMP echo request, id 738, seq 19, length 64
21:23:04.759327 IP 185.229.59.100 > 10.8.1.2: ICMP echo reply, id 738, seq 19, length 64
21:23:05.363161 IP 10.8.1.2 > 185.229.59.100: ICMP echo request, id 738, seq 20, length 64
21:23:05.760468 IP 185.229.59.100 > 10.8.1.2: ICMP echo reply, id 738, seq 20, length 64
21:23:06.364310 IP 10.8.1.2 > 185.229.59.100: ICMP echo request, id 738, seq 21, length 64
21:23:06.761892 IP 185.229.59.100 > 10.8.1.2: ICMP echo reply, id 738, seq 21, length 64
21:23:07.365741 IP 10.8.1.2 > 185.229.59.100: ICMP echo request, id 738, seq 22, length 64
21:23:07.763144 IP 185.229.59.100 > 10.8.1.2: ICMP echo reply, id 738, seq 22, length 64
21:23:08.366984 IP 10.8.1.2 > 185.229.59.100: ICMP echo request, id 738, seq 23, length 64
21:23:08.764483 IP 185.229.59.100 > 10.8.1.2: ICMP echo reply, id 738, seq 23, length 64
21:23:09.368222 IP 10.8.1.2 > 185.229.59.100: ICMP echo request, id 738, seq 24, length 64
21:23:09.765545 IP 185.229.59.100 > 10.8.1.2: ICMP echo reply, id 738, seq 24, length 64
21:23:10.369391 IP 10.8.1.2 > 185.229.59.100: ICMP echo request, id 738, seq 25, length 64
21:23:10.766589 IP 185.229.59.100 > 10.8.1.2: ICMP echo reply, id 738, seq 25, length 64
21:23:11.370435 IP 10.8.1.2 > 185.229.59.100: ICMP echo request, id 738, seq 26, length 64
21:23:11.767796 IP 185.229.59.100 > 10.8.1.2: ICMP echo reply, id 738, seq 26, length 64
21:23:12.371624 IP 10.8.1.2 > 185.229.59.100: ICMP echo request, id 738, seq 27, length 64
21:23:12.769025 IP 185.229.59.100 > 10.8.1.2: ICMP echo reply, id 738, seq 27, length 64
21:23:13.372860 IP 10.8.1.2 > 185.229.59.100: ICMP echo request, id 738, seq 28, length 64
21:23:13.770345 IP 185.229.59.100 > 10.8.1.2: ICMP echo reply, id 738, seq 28, length 64
21:23:14.374185 IP 10.8.1.2 > 185.229.59.100: ICMP echo request, id 738, seq 29, length 64
21:23:14.771622 IP 185.229.59.100 > 10.8.1.2: ICMP echo reply, id 738, seq 29, length 64
21:23:15.375456 IP 10.8.1.2 > 185.229.59.100: ICMP echo request, id 738, seq 30, length 64
21:23:15.773277 IP 185.229.59.100 > 10.8.1.2: ICMP echo reply, id 738, seq 30, length 64
21:23:16.377126 IP 10.8.1.2 > 185.229.59.100: ICMP echo request, id 738, seq 31, length 64
21:23:16.774435 IP 185.229.59.100 > 10.8.1.2: ICMP echo reply, id 738, seq 31, length 64
21:23:17.378275 IP 10.8.1.2 > 185.229.59.100: ICMP echo request, id 738, seq 32, length 64
21:23:17.775644 IP 185.229.59.100 > 10.8.1.2: ICMP echo reply, id 738, seq 32, length 64
21:23:18.379482 IP 10.8.1.2 > 185.229.59.100: ICMP echo request, id 738, seq 33, length 64
21:23:18.776873 IP 185.229.59.100 > 10.8.1.2: ICMP echo reply, id 738, seq 33, length 64
21:23:19.380710 IP 10.8.1.2 > 185.229.59.100: ICMP echo request, id 738, seq 34, length 64
21:23:19.778896 IP 185.229.59.100 > 10.8.1.2: ICMP echo reply, id 738, seq 34, length 64
21:23:20.381729 IP 10.8.1.2 > 185.229.59.100: ICMP echo request, id 738, seq 35, length 64
21:23:20.778915 IP 185.229.59.100 > 10.8.1.2: ICMP echo reply, id 738, seq 35, length 64
21:23:21.382759 IP 10.8.1.2 > 185.229.59.100: ICMP echo request, id 738, seq 36, length 64
21:23:21.780149 IP 185.229.59.100 > 10.8.1.2: ICMP echo reply, id 738, seq 36, length 64
21:23:22.383998 IP 10.8.1.2 > 185.229.59.100: ICMP echo request, id 738, seq 37, length 64
21:23:22.781341 IP 185.229.59.100 > 10.8.1.2: ICMP echo reply, id 738, seq 37, length 64
21:23:23.385177 IP 10.8.1.2 > 185.229.59.100: ICMP echo request, id 738, seq 38, length 64
21:23:23.782487 IP 185.229.59.100 > 10.8.1.2: ICMP echo reply, id 738, seq 38, length 64
21:23:24.386324 IP 10.8.1.2 > 185.229.59.100: ICMP echo request, id 738, seq 39, length 64
21:23:24.783981 IP 185.229.59.100 > 10.8.1.2: ICMP echo reply, id 738, seq 39, length 64
21:23:25.387835 IP 10.8.1.2 > 185.229.59.100: ICMP echo request, id 738, seq 40, length 64
21:23:25.785096 IP 185.229.59.100 > 10.8.1.2: ICMP echo reply, id 738, seq 40, length 64
21:23:26.388934 IP 10.8.1.2 > 185.229.59.100: ICMP echo request, id 738, seq 41, length 64
21:23:26.786366 IP 185.229.59.100 > 10.8.1.2: ICMP echo reply, id 738, seq 41, length 64
21:23:27.390199 IP 10.8.1.2 > 185.229.59.100: ICMP echo request, id 738, seq 42, length 64
21:23:27.787321 IP 185.229.59.100 > 10.8.1.2: ICMP echo reply, id 738, seq 42, length 64
21:23:28.391146 IP 10.8.1.2 > 185.229.59.100: ICMP echo request, id 738, seq 43, length 64
21:23:28.788570 IP 185.229.59.100 > 10.8.1.2: ICMP echo reply, id 738, seq 43, length 64
21:23:29.392410 IP 10.8.1.2 > 185.229.59.100: ICMP echo request, id 738, seq 44, length 64
21:23:29.789795 IP 185.229.59.100 > 10.8.1.2: ICMP echo reply, id 738, seq 44, length 64
21:23:30.393620 IP 10.8.1.2 > 185.229.59.100: ICMP echo request, id 738, seq 45, length 64
21:23:30.790806 IP 185.229.59.100 > 10.8.1.2: ICMP echo reply, id 738, seq 45, length 64
21:23:31.394638 IP 10.8.1.2 > 185.229.59.100: ICMP echo request, id 738, seq 46, length 64
21:23:31.792257 IP 185.229.59.100 > 10.8.1.2: ICMP echo reply, id 738, seq 46, length 64
21:23:32.396044 IP 10.8.1.2 > 185.229.59.100: ICMP echo request, id 738, seq 47, length 64
21:23:32.793151 IP 185.229.59.100 > 10.8.1.2: ICMP echo reply, id 738, seq 47, length 64
21:23:33.396895 IP 10.8.1.2 > 185.229.59.100: ICMP echo request, id 738, seq 48, length 64
21:23:33.794080 IP 185.229.59.100 > 10.8.1.2: ICMP echo reply, id 738, seq 48, length 64
21:23:34.397931 IP 10.8.1.2 > 185.229.59.100: ICMP echo request, id 738, seq 49, length 64
21:23:34.795683 IP 185.229.59.100 > 10.8.1.2: ICMP echo reply, id 738, seq 49, length 64
21:23:35.399464 IP 10.8.1.2 > 185.229.59.100: ICMP echo request, id 738, seq 50, length 64
21:23:35.796595 IP 185.229.59.100 > 10.8.1.2: ICMP echo reply, id 738, seq 50, length 64
21:23:36.400216 IP 10.8.1.2 > 185.229.59.100: ICMP echo request, id 738, seq 51, length 64
21:23:36.797531 IP 185.229.59.100 > 10.8.1.2: ICMP echo reply, id 738, seq 51, length 64
21:23:37.401366 IP 10.8.1.2 > 185.229.59.100: ICMP echo request, id 738, seq 52, length 64
21:23:37.798670 IP 185.229.59.100 > 10.8.1.2: ICMP echo reply, id 738, seq 52, length 64
21:23:38.402498 IP 10.8.1.2 > 185.229.59.100: ICMP echo request, id 738, seq 53, length 64
21:23:38.799741 IP 185.229.59.100 > 10.8.1.2: ICMP echo reply, id 738, seq 53, length 64
21:23:39.403589 IP 10.8.1.2 > 185.229.59.100: ICMP echo request, id 738, seq 54, length 64
21:23:39.801292 IP 185.229.59.100 > 10.8.1.2: ICMP echo reply, id 738, seq 54, length 64
21:23:40.405119 IP 10.8.1.2 > 185.229.59.100: ICMP echo request, id 738, seq 55, length 64
21:23:40.802194 IP 185.229.59.100 > 10.8.1.2: ICMP echo reply, id 738, seq 55, length 64
21:23:41.406027 IP 10.8.1.2 > 185.229.59.100: ICMP echo request, id 738, seq 56, length 64
21:23:41.803384 IP 185.229.59.100 > 10.8.1.2: ICMP echo reply, id 738, seq 56, length 64
21:23:42.407209 IP 10.8.1.2 > 185.229.59.100: ICMP echo request, id 738, seq 57, length 64
21:23:42.804568 IP 185.229.59.100 > 10.8.1.2: ICMP echo reply, id 738, seq 57, length 64
21:23:43.408402 IP 10.8.1.2 > 185.229.59.100: ICMP echo request, id 738, seq 58, length 64
21:23:43.805754 IP 185.229.59.100 > 10.8.1.2: ICMP echo reply, id 738, seq 58, length 64
21:23:44.409587 IP 10.8.1.2 > 185.229.59.100: ICMP echo request, id 738, seq 59, length 64
21:23:44.807213 IP 185.229.59.100 > 10.8.1.2: ICMP echo reply, id 738, seq 59, length 64
21:23:45.411036 IP 10.8.1.2 > 185.229.59.100: ICMP echo request, id 738, seq 60, length 64
