23:18:53.904147 IP 85.10.51.63 > 10.8.0.87: ICMP echo reply, id 1169, seq 2, length 64
23:18:54.609015 IP 10.8.0.87 > 85.10.51.63: ICMP echo request, id 1169, seq 3, length 64
23:18:54.908183 IP 85.10.51.63 > 10.8.0.87: ICMP echo reply, id 1169, seq 3, length 64
23:18:55.610065 IP 10.8.0.87 > 85.10.51.63: ICMP echo request, id 1169, seq 4, length 64
23:18:55.904962 IP 85.10.51.63 > 10.8.0.87: ICMP echo reply, id 1169, seq 4, length 64
23:18:56.610910 IP 10.8.0.87 > 85.10.51.63: ICMP echo request, id 1169, seq 5, length 64
23:18:56.905819 IP 85.10.51.63 > 10.8.0.87: ICMP echo reply, id 1169, seq 5, length 64
23:18:57.611768 IP 10.8.0.87 > 85.10.51.63: ICMP echo request, id 1169, seq 6, length 64
23:18:57.906473 IP 85.10.51.63 > 10.8.0.87: ICMP echo reply, id 1169, seq 6, length 64
23:18:58.613431 IP 10.8.0.87 > 85.10.51.63: ICMP echo request, id 1169, seq 7, length 64
23:18:58.917109 IP 85.10.51.63 > 10.8.0.87: ICMP echo reply, id 1169, seq 7, length 64
23:18:59.615045 IP 10.8.0.87 > 85.10.51.63: ICMP echo request, id 1169, seq 8, length 64
23:18:59.916889 IP 85.10.51.63 > 10.8.0.87: ICMP echo reply, id 1169, seq 8, length 64
23:19:00.615827 IP 10.8.0.87 > 85.10.51.63: ICMP echo request, id 1169, seq 9, length 64
23:19:00.910097 IP 85.10.51.63 > 10.8.0.87: ICMP echo reply, id 1169, seq 9, length 64
23:19:01.617042 IP 10.8.0.87 > 85.10.51.63: ICMP echo request, id 1169, seq 10, length 64
23:19:01.911523 IP 85.10.51.63 > 10.8.0.87: ICMP echo reply, id 1169, seq 10, length 64
23:19:02.618467 IP 10.8.0.87 > 85.10.51.63: ICMP echo request, id 1169, seq 11, length 64
23:19:02.926188 IP 85.10.51.63 > 10.8.0.87: ICMP echo reply, id 1169, seq 11, length 64
23:19:03.620136 IP 10.8.0.87 > 85.10.51.63: ICMP echo request, id 1169, seq 12, length 64
23:19:03.926374 IP 85.10.51.63 > 10.8.0.87: ICMP echo reply, id 1169, seq 12, length 64
23:19:04.621307 IP 10.8.0.87 > 85.10.51.63: ICMP echo request, id 1169, seq 13, length 64
23:19:04.922454 IP 85.10.51.63 > 10.8.0.87: ICMP echo reply, id 1169, seq 13, length 64
23:19:05.622383 IP 10.8.0.87 > 85.10.51.63: ICMP echo request, id 1169, seq 14, length 64
23:19:05.917157 IP 85.10.51.63 > 10.8.0.87: ICMP echo reply, id 1169, seq 14, length 64
23:19:06.624126 IP 10.8.0.87 > 85.10.51.63: ICMP echo request, id 1169, seq 15, length 64
23:19:06.919197 IP 85.10.51.63 > 10.8.0.87: ICMP echo reply, id 1169, seq 15, length 64
23:19:07.625143 IP 10.8.0.87 > 85.10.51.63: ICMP echo request, id 1169, seq 16, length 64
23:19:07.929219 IP 85.10.51.63 > 10.8.0.87: ICMP echo reply, id 1169, seq 16, length 64
23:19:08.626146 IP 10.8.0.87 > 85.10.51.63: ICMP echo request, id 1169, seq 17, length 64
23:19:08.920669 IP 85.10.51.63 > 10.8.0.87: ICMP echo reply, id 1169, seq 17, length 64
23:19:09.627611 IP 10.8.0.87 > 85.10.51.63: ICMP echo request, id 1169, seq 18, length 64
23:19:09.922697 IP 85.10.51.63 > 10.8.0.87: ICMP echo reply, id 1169, seq 18, length 64
23:19:10.628645 IP 10.8.0.87 > 85.10.51.63: ICMP echo request, id 1169, seq 19, length 64
23:19:10.923779 IP 85.10.51.63 > 10.8.0.87: ICMP echo reply, id 1169, seq 19, length 64
23:19:11.629722 IP 10.8.0.87 > 85.10.51.63: ICMP echo request, id 1169, seq 20, length 64
23:19:11.924343 IP 85.10.51.63 > 10.8.0.87: ICMP echo reply, id 1169, seq 20, length 64
23:19:12.631292 IP 10.8.0.87 > 85.10.51.63: ICMP echo request, id 1169, seq 21, length 64
23:19:12.926155 IP 85.10.51.63 > 10.8.0.87: ICMP echo reply, id 1169, seq 21, length 64
23:19:13.632125 IP 10.8.0.87 > 85.10.51.63: ICMP echo request, id 1169, seq 22, length 64
23:19:13.929877 IP 85.10.51.63 > 10.8.0.87: ICMP echo reply, id 1169, seq 22, length 64
23:19:14.633743 IP 10.8.0.87 > 85.10.51.63: ICMP echo request, id 1169, seq 23, length 64
23:19:14.948838 IP 85.10.51.63 > 10.8.0.87: ICMP echo reply, id 1169, seq 23, length 64
23:19:15.634760 IP 10.8.0.87 > 85.10.51.63: ICMP echo request, id 1169, seq 24, length 64
23:19:15.929415 IP 85.10.51.63 > 10.8.0.87: ICMP echo reply, id 1169, seq 24, length 64
23:19:16.636362 IP 10.8.0.87 > 85.10.51.63: ICMP echo request, id 1169, seq 25, length 64
23:19:16.930840 IP 85.10.51.63 > 10.8.0.87: ICMP echo reply, id 1169, seq 25, length 64
23:19:17.637788 IP 10.8.0.87 > 85.10.51.63: ICMP echo request, id 1169, seq 26, length 64
23:19:17.933585 IP 85.10.51.63 > 10.8.0.87: ICMP echo reply, id 1169, seq 26, length 64
23:19:18.639543 IP 10.8.0.87 > 85.10.51.63: ICMP echo request, id 1169, seq 27, length 64
23:19:18.934488 IP 85.10.51.63 > 10.8.0.87: ICMP echo reply, id 1169, seq 27, length 64
23:19:19.640435 IP 10.8.0.87 > 85.10.51.63: ICMP echo request, id 1169, seq 28, length 64
23:19:19.934846 IP 85.10.51.63 > 10.8.0.87: ICMP echo reply, id 1169, seq 28, length 64
23:19:20.641788 IP 10.8.0.87 > 85.10.51.63: ICMP echo request, id 1169, seq 29, length 64
23:19:20.936918 IP 85.10.51.63 > 10.8.0.87: ICMP echo reply, id 1169, seq 29, length 64
23:19:21.642856 IP 10.8.0.87 > 85.10.51.63: ICMP echo request, id 1169, seq 30, length 64
23:19:21.937714 IP 85.10.51.63 > 10.8.0.87: ICMP echo reply, id 1169, seq 30, length 64
23:19:22.643660 IP 10.8.0.87 > 85.10.51.63: ICMP echo request, id 1169, seq 31, length 64
23:19:22.938453 IP 85.10.51.63 > 10.8.0.87: ICMP echo reply, id 1169, seq 31, length 64
23:19:23.645397 IP 10.8.0.87 > 85.10.51.63: ICMP echo request, id 1169, seq 32, length 64
23:19:23.940127 IP 85.10.51.63 > 10.8.0.87: ICMP echo reply, id 1169, seq 32, length 64
23:19:24.647089 IP 10.8.0.87 > 85.10.51.63: ICMP echo request, id 1169, seq 33, length 64
23:19:24.944982 IP 85.10.51.63 > 10.8.0.87: ICMP echo reply, id 1169, seq 33, length 64
23:19:25.647874 IP 10.8.0.87 > 85.10.51.63: ICMP echo request, id 1169, seq 34, length 64
23:19:25.942504 IP 85.10.51.63 > 10.8.0.87: ICMP echo reply, id 1169, seq 34, length 64
23:19:26.648763 IP 10.8.0.87 > 85.10.51.63: ICMP echo request, id 1169, seq 35, length 64
23:19:26.944150 IP 85.10.51.63 > 10.8.0.87: ICMP echo reply, id 1169, seq 35, length 64
23:19:27.650086 IP 10.8.0.87 > 85.10.51.63: ICMP echo request, id 1169, seq 36, length 64
23:19:27.950123 IP 85.10.51.63 > 10.8.0.87: ICMP echo reply, id 1169, seq 36, length 64
23:19:28.651072 IP 10.8.0.87 > 85.10.51.63: ICMP echo request, id 1169, seq 37, length 64
23:19:28.945847 IP 85.10.51.63 > 10.8.0.87: ICMP echo reply, id 1169, seq 37, length 64
23:19:29.652202 IP 10.8.0.87 > 85.10.51.63: ICMP echo request, id 1169, seq 38, length 64
23:19:29.946595 IP 85.10.51.63 > 10.8.0.87: ICMP echo reply, id 1169, seq 38, length 64
23:19:30.653532 IP 10.8.0.87 > 85.10.51.63: ICMP echo request, id 1169, seq 39, length 64
23:19:30.948377 IP 85.10.51.63 > 10.8.0.87: ICMP echo reply, id 1169, seq 39, length 64
23:19:31.654310 IP 10.8.0.87 > 85.10.51.63: ICMP echo request, id 1169, seq 40, length 64
23:19:31.949564 IP 85.10.51.63 > 10.8.0.87: ICMP echo reply, id 1169, seq 40, length 64
23:19:32.655506 IP 10.8.0.87 > 85.10.51.63: ICMP echo request, id 1169, seq 41, length 64
23:19:32.949807 IP 85.10.51.63 > 10.8.0.87: ICMP echo reply, id 1169, seq 41, length 64
23:19:33.656751 IP 10.8.0.87 > 85.10.51.63: ICMP echo request, id 1169, seq 42, length 64
23:19:33.951592 IP 85.10.51.63 > 10.8.0.87: ICMP echo reply, id 1169, seq 42, length 64
23:19:34.657535 IP 10.8.0.87 > 85.10.51.63: ICMP echo request, id 1169, seq 43, length 64
23:19:34.959613 IP 85.10.51.63 > 10.8.0.87: ICMP echo reply, id 1169, seq 43, length 64
23:19:35.658552 IP 10.8.0.87 > 85.10.51.63: ICMP echo request, id 1169, seq 44, length 64
23:19:35.953049 IP 85.10.51.63 > 10.8.0.87: ICMP echo reply, id 1169, seq 44, length 64
23:19:36.659997 IP 10.8.0.87 > 85.10.51.63: ICMP echo request, id 1169, seq 45, length 64
23:19:36.954806 IP 85.10.51.63 > 10.8.0.87: ICMP echo reply, id 1169, seq 45, length 64
23:19:37.661751 IP 10.8.0.87 > 85.10.51.63: ICMP echo request, id 1169, seq 46, length 64
23:19:37.958201 IP 85.10.51.63 > 10.8.0.87: ICMP echo reply, id 1169, seq 46, length 64
23:19:38.663143 IP 10.8.0.87 > 85.10.51.63: ICMP echo request, id 1169, seq 47, length 64
23:19:38.958816 IP 85.10.51.63 > 10.8.0.87: ICMP echo reply, id 1169, seq 47, length 64
23:19:39.664755 IP 10.8.0.87 > 85.10.51.63: ICMP echo request, id 1169, seq 48, length 64
23:19:39.959660 IP 85.10.51.63 > 10.8.0.87: ICMP echo reply, id 1169, seq 48, length 64
23:19:40.665609 IP 10.8.0.87 > 85.10.51.63: ICMP echo request, id 1169, seq 49, length 64
23:19:40.960603 IP 85.10.51.63 > 10.8.0.87: ICMP echo reply, id 1169, seq 49, length 64
23:19:41.666537 IP 10.8.0.87 > 85.10.51.63: ICMP echo request, id 1169, seq 50, length 64
23:19:41.961436 IP 85.10.51.63 > 10.8.0.87: ICMP echo reply, id 1169, seq 50, length 64
23:19:42.667391 IP 10.8.0.87 > 85.10.51.63: ICMP echo request, id 1169, seq 51, length 64
23:19:42.978064 IP 85.10.51.63 > 10.8.0.87: ICMP echo reply, id 1169, seq 51, length 64
23:19:43.668990 IP 10.8.0.87 > 85.10.51.63: ICMP echo request, id 1169, seq 52, length 64
23:19:43.963416 IP 85.10.51.63 > 10.8.0.87: ICMP echo reply, id 1169, seq 52, length 64
23:19:44.670363 IP 10.8.0.87 > 85.10.51.63: ICMP echo request, id 1169, seq 53, length 64
23:19:44.965248 IP 85.10.51.63 > 10.8.0.87: ICMP echo reply, id 1169, seq 53, length 64
23:19:45.671195 IP 10.8.0.87 > 85.10.51.63: ICMP echo request, id 1169, seq 54, length 64
23:19:45.969623 IP 85.10.51.63 > 10.8.0.87: ICMP echo reply, id 1169, seq 54, length 64
23:19:46.672566 IP 10.8.0.87 > 85.10.51.63: ICMP echo request, id 1169, seq 55, length 64
23:19:46.967062 IP 85.10.51.63 > 10.8.0.87: ICMP echo reply, id 1169, seq 55, length 64
23:19:47.674011 IP 10.8.0.87 > 85.10.51.63: ICMP echo request, id 1169, seq 56, length 64
23:19:47.970412 IP 85.10.51.63 > 10.8.0.87: ICMP echo reply, id 1169, seq 56, length 64
23:19:48.675299 IP 10.8.0.87 > 85.10.51.63: ICMP echo request, id 1169, seq 57, length 64
23:19:48.969797 IP 85.10.51.63 > 10.8.0.87: ICMP echo reply, id 1169, seq 57, length 64
23:19:49.676736 IP 10.8.0.87 > 85.10.51.63: ICMP echo request, id 1169, seq 58, length 64
23:19:49.971383 IP 85.10.51.63 > 10.8.0.87: ICMP echo reply, id 1169, seq 58, length 64
23:19:50.678329 IP 10.8.0.87 > 85.10.51.63: ICMP echo request, id 1169, seq 59, length 64
23:19:50.973021 IP 85.10.51.63 > 10.8.0.87: ICMP echo reply, id 1169, seq 59, length 64
23:19:51.679963 IP 10.8.0.87 > 85.10.51.63: ICMP echo request, id 1169, seq 60, length 64
23:19:51.974840 IP 85.10.51.63 > 10.8.0.87: ICMP echo reply, id 1169, seq 60, length 64
23:19:52.680779 IP 10.8.0.87 > 85.10.51.63: ICMP echo request, id 1169, seq 61, length 64
23:19:52.975249 IP 85.10.51.63 > 10.8.0.87: ICMP echo reply, id 1169, seq 61, length 64
