23:55:22.369017 IP 10.8.1.27 > 165.231.177.51: ICMP echo request, id 1310, seq 1, length 64
23:55:22.646267 IP 165.231.177.51 > 10.8.1.27: ICMP echo reply, id 1310, seq 1, length 64
23:55:23.368871 IP 10.8.1.27 > 165.231.177.51: ICMP echo request, id 1310, seq 2, length 64
23:55:23.648459 IP 165.231.177.51 > 10.8.1.27: ICMP echo reply, id 1310, seq 2, length 64
23:55:24.370413 IP 10.8.1.27 > 165.231.177.51: ICMP echo request, id 1310, seq 3, length 64
23:55:24.648087 IP 165.231.177.51 > 10.8.1.27: ICMP echo reply, id 1310, seq 3, length 64
23:55:25.372043 IP 10.8.1.27 > 165.231.177.51: ICMP echo request, id 1310, seq 4, length 64
23:55:25.649146 IP 165.231.177.51 > 10.8.1.27: ICMP echo reply, id 1310, seq 4, length 64
23:55:26.373092 IP 10.8.1.27 > 165.231.177.51: ICMP echo request, id 1310, seq 5, length 64
23:55:26.650195 IP 165.231.177.51 > 10.8.1.27: ICMP echo reply, id 1310, seq 5, length 64
23:55:27.374140 IP 10.8.1.27 > 165.231.177.51: ICMP echo request, id 1310, seq 6, length 64
23:55:27.650789 IP 165.231.177.51 > 10.8.1.27: ICMP echo reply, id 1310, seq 6, length 64
23:55:28.375728 IP 10.8.1.27 > 165.231.177.51: ICMP echo request, id 1310, seq 7, length 64
23:55:28.658294 IP 165.231.177.51 > 10.8.1.27: ICMP echo reply, id 1310, seq 7, length 64
23:55:29.377237 IP 10.8.1.27 > 165.231.177.51: ICMP echo request, id 1310, seq 8, length 64
23:55:29.661088 IP 165.231.177.51 > 10.8.1.27: ICMP echo reply, id 1310, seq 8, length 64
23:55:30.378030 IP 10.8.1.27 > 165.231.177.51: ICMP echo request, id 1310, seq 9, length 64
23:55:30.656714 IP 165.231.177.51 > 10.8.1.27: ICMP echo reply, id 1310, seq 9, length 64
23:55:31.379648 IP 10.8.1.27 > 165.231.177.51: ICMP echo request, id 1310, seq 10, length 64
23:55:31.657427 IP 165.231.177.51 > 10.8.1.27: ICMP echo reply, id 1310, seq 10, length 64
23:55:32.381373 IP 10.8.1.27 > 165.231.177.51: ICMP echo request, id 1310, seq 11, length 64
23:55:32.658081 IP 165.231.177.51 > 10.8.1.27: ICMP echo reply, id 1310, seq 11, length 64
23:55:33.383026 IP 10.8.1.27 > 165.231.177.51: ICMP echo request, id 1310, seq 12, length 64
23:55:33.659700 IP 165.231.177.51 > 10.8.1.27: ICMP echo reply, id 1310, seq 12, length 64
23:55:34.384209 IP 10.8.1.27 > 165.231.177.51: ICMP echo request, id 1310, seq 13, length 64
23:55:34.662745 IP 165.231.177.51 > 10.8.1.27: ICMP echo reply, id 1310, seq 13, length 64
23:55:35.385710 IP 10.8.1.27 > 165.231.177.51: ICMP echo request, id 1310, seq 14, length 64
23:55:35.675143 IP 165.231.177.51 > 10.8.1.27: ICMP echo reply, id 1310, seq 14, length 64
23:55:36.387071 IP 10.8.1.27 > 165.231.177.51: ICMP echo request, id 1310, seq 15, length 64
23:55:36.664479 IP 165.231.177.51 > 10.8.1.27: ICMP echo reply, id 1310, seq 15, length 64
23:55:37.388441 IP 10.8.1.27 > 165.231.177.51: ICMP echo request, id 1310, seq 16, length 64
23:55:37.665475 IP 165.231.177.51 > 10.8.1.27: ICMP echo reply, id 1310, seq 16, length 64
23:55:38.389439 IP 10.8.1.27 > 165.231.177.51: ICMP echo request, id 1310, seq 17, length 64
23:55:38.672014 IP 165.231.177.51 > 10.8.1.27: ICMP echo reply, id 1310, seq 17, length 64
23:55:39.390994 IP 10.8.1.27 > 165.231.177.51: ICMP echo request, id 1310, seq 18, length 64
23:55:39.668568 IP 165.231.177.51 > 10.8.1.27: ICMP echo reply, id 1310, seq 18, length 64
23:55:40.392528 IP 10.8.1.27 > 165.231.177.51: ICMP echo request, id 1310, seq 19, length 64
23:55:40.670097 IP 165.231.177.51 > 10.8.1.27: ICMP echo reply, id 1310, seq 19, length 64
23:55:41.394071 IP 10.8.1.27 > 165.231.177.51: ICMP echo request, id 1310, seq 20, length 64
23:55:41.675191 IP 165.231.177.51 > 10.8.1.27: ICMP echo reply, id 1310, seq 20, length 64
23:55:42.395163 IP 10.8.1.27 > 165.231.177.51: ICMP echo request, id 1310, seq 21, length 64
23:55:42.677213 IP 165.231.177.51 > 10.8.1.27: ICMP echo reply, id 1310, seq 21, length 64
23:55:43.396168 IP 10.8.1.27 > 165.231.177.51: ICMP echo request, id 1310, seq 22, length 64
23:55:43.677055 IP 165.231.177.51 > 10.8.1.27: ICMP echo reply, id 1310, seq 22, length 64
23:55:44.397018 IP 10.8.1.27 > 165.231.177.51: ICMP echo request, id 1310, seq 23, length 64
23:55:44.680503 IP 165.231.177.51 > 10.8.1.27: ICMP echo reply, id 1310, seq 23, length 64
23:55:45.398461 IP 10.8.1.27 > 165.231.177.51: ICMP echo request, id 1310, seq 24, length 64
23:55:45.676687 IP 165.231.177.51 > 10.8.1.27: ICMP echo reply, id 1310, seq 24, length 64
23:55:46.399653 IP 10.8.1.27 > 165.231.177.51: ICMP echo request, id 1310, seq 25, length 64
23:55:46.680168 IP 165.231.177.51 > 10.8.1.27: ICMP echo reply, id 1310, seq 25, length 64
23:55:47.401117 IP 10.8.1.27 > 165.231.177.51: ICMP echo request, id 1310, seq 26, length 64
23:55:47.678999 IP 165.231.177.51 > 10.8.1.27: ICMP echo reply, id 1310, seq 26, length 64
23:55:48.401973 IP 10.8.1.27 > 165.231.177.51: ICMP echo request, id 1310, seq 27, length 64
23:55:48.685560 IP 165.231.177.51 > 10.8.1.27: ICMP echo reply, id 1310, seq 27, length 64
23:55:49.403533 IP 10.8.1.27 > 165.231.177.51: ICMP echo request, id 1310, seq 28, length 64
23:55:49.683733 IP 165.231.177.51 > 10.8.1.27: ICMP echo reply, id 1310, seq 28, length 64
23:55:50.404684 IP 10.8.1.27 > 165.231.177.51: ICMP echo request, id 1310, seq 29, length 64
23:55:50.683363 IP 165.231.177.51 > 10.8.1.27: ICMP echo reply, id 1310, seq 29, length 64
23:55:51.406312 IP 10.8.1.27 > 165.231.177.51: ICMP echo request, id 1310, seq 30, length 64
23:55:51.684818 IP 165.231.177.51 > 10.8.1.27: ICMP echo reply, id 1310, seq 30, length 64
23:55:52.407779 IP 10.8.1.27 > 165.231.177.51: ICMP echo request, id 1310, seq 31, length 64
23:55:52.687680 IP 165.231.177.51 > 10.8.1.27: ICMP echo reply, id 1310, seq 31, length 64
23:55:53.408638 IP 10.8.1.27 > 165.231.177.51: ICMP echo request, id 1310, seq 32, length 64
23:55:53.690326 IP 165.231.177.51 > 10.8.1.27: ICMP echo reply, id 1310, seq 32, length 64
23:55:54.410287 IP 10.8.1.27 > 165.231.177.51: ICMP echo request, id 1310, seq 33, length 64
23:55:54.687562 IP 165.231.177.51 > 10.8.1.27: ICMP echo reply, id 1310, seq 33, length 64
23:55:55.411522 IP 10.8.1.27 > 165.231.177.51: ICMP echo request, id 1310, seq 34, length 64
23:55:55.690007 IP 165.231.177.51 > 10.8.1.27: ICMP echo reply, id 1310, seq 34, length 64
23:55:56.412964 IP 10.8.1.27 > 165.231.177.51: ICMP echo request, id 1310, seq 35, length 64
23:55:56.691893 IP 165.231.177.51 > 10.8.1.27: ICMP echo reply, id 1310, seq 35, length 64
23:55:57.413854 IP 10.8.1.27 > 165.231.177.51: ICMP echo request, id 1310, seq 36, length 64
23:55:58.428212 IP 10.8.1.27 > 165.231.177.51: ICMP echo request, id 1310, seq 37, length 64
23:55:59.452222 IP 10.8.1.27 > 165.231.177.51: ICMP echo request, id 1310, seq 38, length 64
23:55:59.730002 IP 165.231.177.51 > 10.8.1.27: ICMP echo reply, id 1310, seq 38, length 64
23:56:00.453980 IP 10.8.1.27 > 165.231.177.51: ICMP echo request, id 1310, seq 39, length 64
23:56:00.730658 IP 165.231.177.51 > 10.8.1.27: ICMP echo reply, id 1310, seq 39, length 64
23:56:01.455622 IP 10.8.1.27 > 165.231.177.51: ICMP echo request, id 1310, seq 40, length 64
23:56:01.733701 IP 165.231.177.51 > 10.8.1.27: ICMP echo reply, id 1310, seq 40, length 64
23:56:02.456653 IP 10.8.1.27 > 165.231.177.51: ICMP echo request, id 1310, seq 41, length 64
23:56:02.738566 IP 165.231.177.51 > 10.8.1.27: ICMP echo reply, id 1310, seq 41, length 64
23:56:03.457509 IP 10.8.1.27 > 165.231.177.51: ICMP echo request, id 1310, seq 42, length 64
23:56:03.736183 IP 165.231.177.51 > 10.8.1.27: ICMP echo reply, id 1310, seq 42, length 64
23:56:04.459128 IP 10.8.1.27 > 165.231.177.51: ICMP echo request, id 1310, seq 43, length 64
23:56:04.736224 IP 165.231.177.51 > 10.8.1.27: ICMP echo reply, id 1310, seq 43, length 64
23:56:05.460114 IP 10.8.1.27 > 165.231.177.51: ICMP echo request, id 1310, seq 44, length 64
23:56:05.739251 IP 165.231.177.51 > 10.8.1.27: ICMP echo reply, id 1310, seq 44, length 64
23:56:06.461214 IP 10.8.1.27 > 165.231.177.51: ICMP echo request, id 1310, seq 45, length 64
23:56:06.739165 IP 165.231.177.51 > 10.8.1.27: ICMP echo reply, id 1310, seq 45, length 64
23:56:07.462129 IP 10.8.1.27 > 165.231.177.51: ICMP echo request, id 1310, seq 46, length 64
23:56:07.740759 IP 165.231.177.51 > 10.8.1.27: ICMP echo reply, id 1310, seq 46, length 64
23:56:08.463723 IP 10.8.1.27 > 165.231.177.51: ICMP echo request, id 1310, seq 47, length 64
23:56:08.742960 IP 165.231.177.51 > 10.8.1.27: ICMP echo reply, id 1310, seq 47, length 64
23:56:09.464924 IP 10.8.1.27 > 165.231.177.51: ICMP echo request, id 1310, seq 48, length 64
23:56:09.754835 IP 165.231.177.51 > 10.8.1.27: ICMP echo reply, id 1310, seq 48, length 64
23:56:10.465771 IP 10.8.1.27 > 165.231.177.51: ICMP echo request, id 1310, seq 49, length 64
23:56:10.743083 IP 165.231.177.51 > 10.8.1.27: ICMP echo reply, id 1310, seq 49, length 64
23:56:11.467050 IP 10.8.1.27 > 165.231.177.51: ICMP echo request, id 1310, seq 50, length 64
23:56:11.747165 IP 165.231.177.51 > 10.8.1.27: ICMP echo reply, id 1310, seq 50, length 64
23:56:12.468148 IP 10.8.1.27 > 165.231.177.51: ICMP echo request, id 1310, seq 51, length 64
23:56:12.745206 IP 165.231.177.51 > 10.8.1.27: ICMP echo reply, id 1310, seq 51, length 64
23:56:13.469166 IP 10.8.1.27 > 165.231.177.51: ICMP echo request, id 1310, seq 52, length 64
23:56:13.747007 IP 165.231.177.51 > 10.8.1.27: ICMP echo reply, id 1310, seq 52, length 64
23:56:14.469962 IP 10.8.1.27 > 165.231.177.51: ICMP echo request, id 1310, seq 53, length 64
23:56:14.750089 IP 165.231.177.51 > 10.8.1.27: ICMP echo reply, id 1310, seq 53, length 64
23:56:15.471042 IP 10.8.1.27 > 165.231.177.51: ICMP echo request, id 1310, seq 54, length 64
23:56:15.748156 IP 165.231.177.51 > 10.8.1.27: ICMP echo reply, id 1310, seq 54, length 64
23:56:16.472148 IP 10.8.1.27 > 165.231.177.51: ICMP echo request, id 1310, seq 55, length 64
23:56:16.751813 IP 165.231.177.51 > 10.8.1.27: ICMP echo reply, id 1310, seq 55, length 64
23:56:17.473765 IP 10.8.1.27 > 165.231.177.51: ICMP echo request, id 1310, seq 56, length 64
23:56:17.751397 IP 165.231.177.51 > 10.8.1.27: ICMP echo reply, id 1310, seq 56, length 64
23:56:18.475360 IP 10.8.1.27 > 165.231.177.51: ICMP echo request, id 1310, seq 57, length 64
23:56:18.753855 IP 165.231.177.51 > 10.8.1.27: ICMP echo reply, id 1310, seq 57, length 64
23:56:19.476816 IP 10.8.1.27 > 165.231.177.51: ICMP echo request, id 1310, seq 58, length 64
23:56:19.776295 IP 165.231.177.51 > 10.8.1.27: ICMP echo reply, id 1310, seq 58, length 64
23:56:20.478226 IP 10.8.1.27 > 165.231.177.51: ICMP echo request, id 1310, seq 59, length 64
23:56:20.771789 IP 165.231.177.51 > 10.8.1.27: ICMP echo reply, id 1310, seq 59, length 64
23:56:21.479737 IP 10.8.1.27 > 165.231.177.51: ICMP echo request, id 1310, seq 60, length 64
