11:15:59.266998 IP 194.110.84.100 > 10.8.3.7: ICMP echo reply, id 1543, seq 1, length 64
11:15:59.975721 IP 10.8.3.7 > 194.110.84.100: ICMP echo request, id 1543, seq 2, length 64
11:16:00.267482 IP 194.110.84.100 > 10.8.3.7: ICMP echo reply, id 1543, seq 2, length 64
11:16:00.976430 IP 10.8.3.7 > 194.110.84.100: ICMP echo request, id 1543, seq 3, length 64
11:16:01.266893 IP 194.110.84.100 > 10.8.3.7: ICMP echo reply, id 1543, seq 3, length 64
11:16:01.976827 IP 10.8.3.7 > 194.110.84.100: ICMP echo request, id 1543, seq 4, length 64
11:16:02.267244 IP 194.110.84.100 > 10.8.3.7: ICMP echo reply, id 1543, seq 4, length 64
11:16:02.977173 IP 10.8.3.7 > 194.110.84.100: ICMP echo request, id 1543, seq 5, length 64
11:16:03.269679 IP 194.110.84.100 > 10.8.3.7: ICMP echo reply, id 1543, seq 5, length 64
11:16:03.977603 IP 10.8.3.7 > 194.110.84.100: ICMP echo request, id 1543, seq 6, length 64
11:16:04.268286 IP 194.110.84.100 > 10.8.3.7: ICMP echo reply, id 1543, seq 6, length 64
11:16:04.978213 IP 10.8.3.7 > 194.110.84.100: ICMP echo request, id 1543, seq 7, length 64
11:16:05.268955 IP 194.110.84.100 > 10.8.3.7: ICMP echo reply, id 1543, seq 7, length 64
11:16:05.978889 IP 10.8.3.7 > 194.110.84.100: ICMP echo request, id 1543, seq 8, length 64
11:16:06.269316 IP 194.110.84.100 > 10.8.3.7: ICMP echo reply, id 1543, seq 8, length 64
11:16:06.979241 IP 10.8.3.7 > 194.110.84.100: ICMP echo request, id 1543, seq 9, length 64
11:16:07.270223 IP 194.110.84.100 > 10.8.3.7: ICMP echo reply, id 1543, seq 9, length 64
11:16:07.979151 IP 10.8.3.7 > 194.110.84.100: ICMP echo request, id 1543, seq 10, length 64
11:16:08.269614 IP 194.110.84.100 > 10.8.3.7: ICMP echo reply, id 1543, seq 10, length 64
11:16:08.979538 IP 10.8.3.7 > 194.110.84.100: ICMP echo request, id 1543, seq 11, length 64
11:16:09.270240 IP 194.110.84.100 > 10.8.3.7: ICMP echo reply, id 1543, seq 11, length 64
11:16:09.980173 IP 10.8.3.7 > 194.110.84.100: ICMP echo request, id 1543, seq 12, length 64
11:16:10.270667 IP 194.110.84.100 > 10.8.3.7: ICMP echo reply, id 1543, seq 12, length 64
11:16:10.980595 IP 10.8.3.7 > 194.110.84.100: ICMP echo request, id 1543, seq 13, length 64
11:16:11.271171 IP 194.110.84.100 > 10.8.3.7: ICMP echo reply, id 1543, seq 13, length 64
11:16:11.981096 IP 10.8.3.7 > 194.110.84.100: ICMP echo request, id 1543, seq 14, length 64
11:16:12.271523 IP 194.110.84.100 > 10.8.3.7: ICMP echo reply, id 1543, seq 14, length 64
11:16:12.981446 IP 10.8.3.7 > 194.110.84.100: ICMP echo request, id 1543, seq 15, length 64
11:16:13.273170 IP 194.110.84.100 > 10.8.3.7: ICMP echo reply, id 1543, seq 15, length 64
11:16:13.982104 IP 10.8.3.7 > 194.110.84.100: ICMP echo request, id 1543, seq 16, length 64
11:16:14.273823 IP 194.110.84.100 > 10.8.3.7: ICMP echo reply, id 1543, seq 16, length 64
11:16:14.982681 IP 10.8.3.7 > 194.110.84.100: ICMP echo request, id 1543, seq 17, length 64
11:16:15.273432 IP 194.110.84.100 > 10.8.3.7: ICMP echo reply, id 1543, seq 17, length 64
11:16:15.983369 IP 10.8.3.7 > 194.110.84.100: ICMP echo request, id 1543, seq 18, length 64
11:16:16.274045 IP 194.110.84.100 > 10.8.3.7: ICMP echo reply, id 1543, seq 18, length 64
11:16:16.984000 IP 10.8.3.7 > 194.110.84.100: ICMP echo request, id 1543, seq 19, length 64
11:16:17.275266 IP 194.110.84.100 > 10.8.3.7: ICMP echo reply, id 1543, seq 19, length 64
11:16:17.984202 IP 10.8.3.7 > 194.110.84.100: ICMP echo request, id 1543, seq 20, length 64
11:16:18.274708 IP 194.110.84.100 > 10.8.3.7: ICMP echo reply, id 1543, seq 20, length 64
11:16:18.984644 IP 10.8.3.7 > 194.110.84.100: ICMP echo request, id 1543, seq 21, length 64
11:16:19.275146 IP 194.110.84.100 > 10.8.3.7: ICMP echo reply, id 1543, seq 21, length 64
11:16:19.985083 IP 10.8.3.7 > 194.110.84.100: ICMP echo request, id 1543, seq 22, length 64
11:16:20.276664 IP 194.110.84.100 > 10.8.3.7: ICMP echo reply, id 1543, seq 22, length 64
11:16:20.985522 IP 10.8.3.7 > 194.110.84.100: ICMP echo request, id 1543, seq 23, length 64
11:16:21.277372 IP 194.110.84.100 > 10.8.3.7: ICMP echo reply, id 1543, seq 23, length 64
11:16:21.986232 IP 10.8.3.7 > 194.110.84.100: ICMP echo request, id 1543, seq 24, length 64
11:16:22.276778 IP 194.110.84.100 > 10.8.3.7: ICMP echo reply, id 1543, seq 24, length 64
11:16:22.986717 IP 10.8.3.7 > 194.110.84.100: ICMP echo request, id 1543, seq 25, length 64
11:16:23.277565 IP 194.110.84.100 > 10.8.3.7: ICMP echo reply, id 1543, seq 25, length 64
11:16:23.986501 IP 10.8.3.7 > 194.110.84.100: ICMP echo request, id 1543, seq 26, length 64
11:16:24.277260 IP 194.110.84.100 > 10.8.3.7: ICMP echo reply, id 1543, seq 26, length 64
11:16:24.987194 IP 10.8.3.7 > 194.110.84.100: ICMP echo request, id 1543, seq 27, length 64
11:16:25.278129 IP 194.110.84.100 > 10.8.3.7: ICMP echo reply, id 1543, seq 27, length 64
11:16:25.987081 IP 10.8.3.7 > 194.110.84.100: ICMP echo request, id 1543, seq 28, length 64
11:16:26.277616 IP 194.110.84.100 > 10.8.3.7: ICMP echo reply, id 1543, seq 28, length 64
11:16:26.987562 IP 10.8.3.7 > 194.110.84.100: ICMP echo request, id 1543, seq 29, length 64
11:16:27.278113 IP 194.110.84.100 > 10.8.3.7: ICMP echo reply, id 1543, seq 29, length 64
11:16:27.988072 IP 10.8.3.7 > 194.110.84.100: ICMP echo request, id 1543, seq 30, length 64
11:16:28.278539 IP 194.110.84.100 > 10.8.3.7: ICMP echo reply, id 1543, seq 30, length 64
11:16:28.988487 IP 10.8.3.7 > 194.110.84.100: ICMP echo request, id 1543, seq 31, length 64
11:16:29.279275 IP 194.110.84.100 > 10.8.3.7: ICMP echo reply, id 1543, seq 31, length 64
11:16:29.989231 IP 10.8.3.7 > 194.110.84.100: ICMP echo request, id 1543, seq 32, length 64
11:16:30.279946 IP 194.110.84.100 > 10.8.3.7: ICMP echo reply, id 1543, seq 32, length 64
11:16:30.989900 IP 10.8.3.7 > 194.110.84.100: ICMP echo request, id 1543, seq 33, length 64
11:16:31.280580 IP 194.110.84.100 > 10.8.3.7: ICMP echo reply, id 1543, seq 33, length 64
11:16:31.990519 IP 10.8.3.7 > 194.110.84.100: ICMP echo request, id 1543, seq 34, length 64
11:16:32.281040 IP 194.110.84.100 > 10.8.3.7: ICMP echo reply, id 1543, seq 34, length 64
11:16:32.990983 IP 10.8.3.7 > 194.110.84.100: ICMP echo request, id 1543, seq 35, length 64
11:16:33.281857 IP 194.110.84.100 > 10.8.3.7: ICMP echo reply, id 1543, seq 35, length 64
11:16:33.990798 IP 10.8.3.7 > 194.110.84.100: ICMP echo request, id 1543, seq 36, length 64
11:16:34.281341 IP 194.110.84.100 > 10.8.3.7: ICMP echo reply, id 1543, seq 36, length 64
11:16:34.991284 IP 10.8.3.7 > 194.110.84.100: ICMP echo request, id 1543, seq 37, length 64
11:16:35.281717 IP 194.110.84.100 > 10.8.3.7: ICMP echo reply, id 1543, seq 37, length 64
11:16:35.991659 IP 10.8.3.7 > 194.110.84.100: ICMP echo request, id 1543, seq 38, length 64
11:16:36.282352 IP 194.110.84.100 > 10.8.3.7: ICMP echo reply, id 1543, seq 38, length 64
11:16:36.992287 IP 10.8.3.7 > 194.110.84.100: ICMP echo request, id 1543, seq 39, length 64
11:16:37.283338 IP 194.110.84.100 > 10.8.3.7: ICMP echo reply, id 1543, seq 39, length 64
11:16:37.992276 IP 10.8.3.7 > 194.110.84.100: ICMP echo request, id 1543, seq 40, length 64
11:16:38.282959 IP 194.110.84.100 > 10.8.3.7: ICMP echo reply, id 1543, seq 40, length 64
11:16:38.992906 IP 10.8.3.7 > 194.110.84.100: ICMP echo request, id 1543, seq 41, length 64
11:16:39.283574 IP 194.110.84.100 > 10.8.3.7: ICMP echo reply, id 1543, seq 41, length 64
11:16:39.993511 IP 10.8.3.7 > 194.110.84.100: ICMP echo request, id 1543, seq 42, length 64
11:16:40.284216 IP 194.110.84.100 > 10.8.3.7: ICMP echo reply, id 1543, seq 42, length 64
11:16:40.994175 IP 10.8.3.7 > 194.110.84.100: ICMP echo request, id 1543, seq 43, length 64
11:16:41.284816 IP 194.110.84.100 > 10.8.3.7: ICMP echo reply, id 1543, seq 43, length 64
11:16:41.994752 IP 10.8.3.7 > 194.110.84.100: ICMP echo request, id 1543, seq 44, length 64
11:16:42.285220 IP 194.110.84.100 > 10.8.3.7: ICMP echo reply, id 1543, seq 44, length 64
11:16:42.995097 IP 10.8.3.7 > 194.110.84.100: ICMP echo request, id 1543, seq 45, length 64
11:16:43.286024 IP 194.110.84.100 > 10.8.3.7: ICMP echo reply, id 1543, seq 45, length 64
11:16:43.994984 IP 10.8.3.7 > 194.110.84.100: ICMP echo request, id 1543, seq 46, length 64
11:16:44.285722 IP 194.110.84.100 > 10.8.3.7: ICMP echo reply, id 1543, seq 46, length 64
11:16:44.995669 IP 10.8.3.7 > 194.110.84.100: ICMP echo request, id 1543, seq 47, length 64
11:16:45.286168 IP 194.110.84.100 > 10.8.3.7: ICMP echo reply, id 1543, seq 47, length 64
11:16:45.996104 IP 10.8.3.7 > 194.110.84.100: ICMP echo request, id 1543, seq 48, length 64
11:16:46.286735 IP 194.110.84.100 > 10.8.3.7: ICMP echo reply, id 1543, seq 48, length 64
11:16:46.996671 IP 10.8.3.7 > 194.110.84.100: ICMP echo request, id 1543, seq 49, length 64
11:16:47.287183 IP 194.110.84.100 > 10.8.3.7: ICMP echo reply, id 1543, seq 49, length 64
11:16:47.997134 IP 10.8.3.7 > 194.110.84.100: ICMP echo request, id 1543, seq 50, length 64
11:16:48.287811 IP 194.110.84.100 > 10.8.3.7: ICMP echo reply, id 1543, seq 50, length 64
11:16:48.997759 IP 10.8.3.7 > 194.110.84.100: ICMP echo request, id 1543, seq 51, length 64
11:16:49.288431 IP 194.110.84.100 > 10.8.3.7: ICMP echo reply, id 1543, seq 51, length 64
11:16:49.998378 IP 10.8.3.7 > 194.110.84.100: ICMP echo request, id 1543, seq 52, length 64
11:16:50.288840 IP 194.110.84.100 > 10.8.3.7: ICMP echo reply, id 1543, seq 52, length 64
11:16:50.998789 IP 10.8.3.7 > 194.110.84.100: ICMP echo request, id 1543, seq 53, length 64
11:16:51.289425 IP 194.110.84.100 > 10.8.3.7: ICMP echo reply, id 1543, seq 53, length 64
11:16:51.999373 IP 10.8.3.7 > 194.110.84.100: ICMP echo request, id 1543, seq 54, length 64
11:16:52.289822 IP 194.110.84.100 > 10.8.3.7: ICMP echo reply, id 1543, seq 54, length 64
11:16:52.999763 IP 10.8.3.7 > 194.110.84.100: ICMP echo request, id 1543, seq 55, length 64
11:16:53.291742 IP 194.110.84.100 > 10.8.3.7: ICMP echo reply, id 1543, seq 55, length 64
11:16:53.999681 IP 10.8.3.7 > 194.110.84.100: ICMP echo request, id 1543, seq 56, length 64
11:16:54.290504 IP 194.110.84.100 > 10.8.3.7: ICMP echo reply, id 1543, seq 56, length 64
11:16:55.000452 IP 10.8.3.7 > 194.110.84.100: ICMP echo request, id 1543, seq 57, length 64
11:16:55.291101 IP 194.110.84.100 > 10.8.3.7: ICMP echo reply, id 1543, seq 57, length 64
11:16:56.002038 IP 10.8.3.7 > 194.110.84.100: ICMP echo request, id 1543, seq 58, length 64
11:16:56.292554 IP 194.110.84.100 > 10.8.3.7: ICMP echo reply, id 1543, seq 58, length 64
11:16:57.003493 IP 10.8.3.7 > 194.110.84.100: ICMP echo request, id 1543, seq 59, length 64
11:16:57.295553 IP 194.110.84.100 > 10.8.3.7: ICMP echo reply, id 1543, seq 59, length 64
11:16:58.004498 IP 10.8.3.7 > 194.110.84.100: ICMP echo request, id 1543, seq 60, length 64
11:16:58.295236 IP 194.110.84.100 > 10.8.3.7: ICMP echo reply, id 1543, seq 60, length 64
