21:54:24.102756 IP 192.154.198.15 > 10.8.3.5: ICMP echo reply, id 1681, seq 1, length 64
21:54:28.209625 IP 10.8.3.5 > 192.154.198.15: ICMP echo request, id 1681, seq 2, length 64
21:54:28.621634 IP 192.154.198.15 > 10.8.3.5: ICMP echo reply, id 1681, seq 2, length 64
21:54:29.210469 IP 10.8.3.5 > 192.154.198.15: ICMP echo request, id 1681, seq 3, length 64
21:54:29.622280 IP 192.154.198.15 > 10.8.3.5: ICMP echo reply, id 1681, seq 3, length 64
21:54:30.212112 IP 10.8.3.5 > 192.154.198.15: ICMP echo request, id 1681, seq 4, length 64
21:54:30.624009 IP 192.154.198.15 > 10.8.3.5: ICMP echo reply, id 1681, seq 4, length 64
21:54:31.212805 IP 10.8.3.5 > 192.154.198.15: ICMP echo request, id 1681, seq 5, length 64
21:54:31.624670 IP 192.154.198.15 > 10.8.3.5: ICMP echo reply, id 1681, seq 5, length 64
21:54:32.213480 IP 10.8.3.5 > 192.154.198.15: ICMP echo request, id 1681, seq 6, length 64
21:54:32.625245 IP 192.154.198.15 > 10.8.3.5: ICMP echo reply, id 1681, seq 6, length 64
21:54:33.215083 IP 10.8.3.5 > 192.154.198.15: ICMP echo request, id 1681, seq 7, length 64
21:54:33.627069 IP 192.154.198.15 > 10.8.3.5: ICMP echo reply, id 1681, seq 7, length 64
21:54:34.215914 IP 10.8.3.5 > 192.154.198.15: ICMP echo request, id 1681, seq 8, length 64
21:54:34.627833 IP 192.154.198.15 > 10.8.3.5: ICMP echo reply, id 1681, seq 8, length 64
21:54:35.216624 IP 10.8.3.5 > 192.154.198.15: ICMP echo request, id 1681, seq 9, length 64
21:54:35.628704 IP 192.154.198.15 > 10.8.3.5: ICMP echo reply, id 1681, seq 9, length 64
21:54:36.217534 IP 10.8.3.5 > 192.154.198.15: ICMP echo request, id 1681, seq 10, length 64
21:54:37.243279 IP 10.8.3.5 > 192.154.198.15: ICMP echo request, id 1681, seq 11, length 64
21:54:37.655898 IP 192.154.198.15 > 10.8.3.5: ICMP echo reply, id 1681, seq 11, length 64
21:54:38.244727 IP 10.8.3.5 > 192.154.198.15: ICMP echo request, id 1681, seq 12, length 64
21:54:38.656862 IP 192.154.198.15 > 10.8.3.5: ICMP echo reply, id 1681, seq 12, length 64
21:54:39.245692 IP 10.8.3.5 > 192.154.198.15: ICMP echo request, id 1681, seq 13, length 64
21:54:39.657549 IP 192.154.198.15 > 10.8.3.5: ICMP echo reply, id 1681, seq 13, length 64
21:54:40.246393 IP 10.8.3.5 > 192.154.198.15: ICMP echo request, id 1681, seq 14, length 64
21:54:40.658265 IP 192.154.198.15 > 10.8.3.5: ICMP echo reply, id 1681, seq 14, length 64
21:54:41.247098 IP 10.8.3.5 > 192.154.198.15: ICMP echo request, id 1681, seq 15, length 64
21:54:41.659037 IP 192.154.198.15 > 10.8.3.5: ICMP echo reply, id 1681, seq 15, length 64
21:54:42.247903 IP 10.8.3.5 > 192.154.198.15: ICMP echo request, id 1681, seq 16, length 64
21:54:42.660076 IP 192.154.198.15 > 10.8.3.5: ICMP echo reply, id 1681, seq 16, length 64
21:54:43.248909 IP 10.8.3.5 > 192.154.198.15: ICMP echo request, id 1681, seq 17, length 64
21:54:44.251271 IP 10.8.3.5 > 192.154.198.15: ICMP echo request, id 1681, seq 18, length 64
21:54:44.663278 IP 192.154.198.15 > 10.8.3.5: ICMP echo reply, id 1681, seq 18, length 64
21:54:45.252070 IP 10.8.3.5 > 192.154.198.15: ICMP echo request, id 1681, seq 19, length 64
21:54:45.663880 IP 192.154.198.15 > 10.8.3.5: ICMP echo reply, id 1681, seq 19, length 64
21:54:46.253717 IP 10.8.3.5 > 192.154.198.15: ICMP echo request, id 1681, seq 20, length 64
21:54:46.665509 IP 192.154.198.15 > 10.8.3.5: ICMP echo reply, id 1681, seq 20, length 64
21:54:47.255268 IP 10.8.3.5 > 192.154.198.15: ICMP echo request, id 1681, seq 21, length 64
21:54:47.667250 IP 192.154.198.15 > 10.8.3.5: ICMP echo reply, id 1681, seq 21, length 64
21:54:48.256091 IP 10.8.3.5 > 192.154.198.15: ICMP echo request, id 1681, seq 22, length 64
21:54:49.275275 IP 10.8.3.5 > 192.154.198.15: ICMP echo request, id 1681, seq 23, length 64
21:54:49.687105 IP 192.154.198.15 > 10.8.3.5: ICMP echo reply, id 1681, seq 23, length 64
21:54:50.275951 IP 10.8.3.5 > 192.154.198.15: ICMP echo request, id 1681, seq 24, length 64
21:54:51.291284 IP 10.8.3.5 > 192.154.198.15: ICMP echo request, id 1681, seq 25, length 64
21:54:51.703262 IP 192.154.198.15 > 10.8.3.5: ICMP echo reply, id 1681, seq 25, length 64
21:54:52.292106 IP 10.8.3.5 > 192.154.198.15: ICMP echo request, id 1681, seq 26, length 64
21:54:53.307272 IP 10.8.3.5 > 192.154.198.15: ICMP echo request, id 1681, seq 27, length 64
21:54:53.719482 IP 192.154.198.15 > 10.8.3.5: ICMP echo reply, id 1681, seq 27, length 64
21:54:54.308306 IP 10.8.3.5 > 192.154.198.15: ICMP echo request, id 1681, seq 28, length 64
21:54:54.720089 IP 192.154.198.15 > 10.8.3.5: ICMP echo reply, id 1681, seq 28, length 64
21:54:55.309880 IP 10.8.3.5 > 192.154.198.15: ICMP echo request, id 1681, seq 29, length 64
21:54:55.721738 IP 192.154.198.15 > 10.8.3.5: ICMP echo reply, id 1681, seq 29, length 64
21:54:56.310573 IP 10.8.3.5 > 192.154.198.15: ICMP echo request, id 1681, seq 30, length 64
21:54:56.722529 IP 192.154.198.15 > 10.8.3.5: ICMP echo reply, id 1681, seq 30, length 64
21:54:57.311272 IP 10.8.3.5 > 192.154.198.15: ICMP echo request, id 1681, seq 31, length 64
21:54:57.723072 IP 192.154.198.15 > 10.8.3.5: ICMP echo reply, id 1681, seq 31, length 64
21:54:58.312909 IP 10.8.3.5 > 192.154.198.15: ICMP echo request, id 1681, seq 32, length 64
21:54:59.323266 IP 10.8.3.5 > 192.154.198.15: ICMP echo request, id 1681, seq 33, length 64
21:54:59.735297 IP 192.154.198.15 > 10.8.3.5: ICMP echo reply, id 1681, seq 33, length 64
21:55:00.324127 IP 10.8.3.5 > 192.154.198.15: ICMP echo request, id 1681, seq 34, length 64
21:55:01.339285 IP 10.8.3.5 > 192.154.198.15: ICMP echo request, id 1681, seq 35, length 64
21:55:01.751096 IP 192.154.198.15 > 10.8.3.5: ICMP echo reply, id 1681, seq 35, length 64
21:55:02.340931 IP 10.8.3.5 > 192.154.198.15: ICMP echo request, id 1681, seq 36, length 64
21:55:02.752749 IP 192.154.198.15 > 10.8.3.5: ICMP echo reply, id 1681, seq 36, length 64
21:55:03.342577 IP 10.8.3.5 > 192.154.198.15: ICMP echo request, id 1681, seq 37, length 64
21:55:03.754587 IP 192.154.198.15 > 10.8.3.5: ICMP echo reply, id 1681, seq 37, length 64
21:55:04.343263 IP 10.8.3.5 > 192.154.198.15: ICMP echo request, id 1681, seq 38, length 64
21:55:04.755127 IP 192.154.198.15 > 10.8.3.5: ICMP echo reply, id 1681, seq 38, length 64
21:55:05.343979 IP 10.8.3.5 > 192.154.198.15: ICMP echo request, id 1681, seq 39, length 64
21:55:05.755949 IP 192.154.198.15 > 10.8.3.5: ICMP echo reply, id 1681, seq 39, length 64
21:55:06.344775 IP 10.8.3.5 > 192.154.198.15: ICMP echo request, id 1681, seq 40, length 64
21:55:06.756546 IP 192.154.198.15 > 10.8.3.5: ICMP echo reply, id 1681, seq 40, length 64
21:55:07.346342 IP 10.8.3.5 > 192.154.198.15: ICMP echo request, id 1681, seq 41, length 64
21:55:08.351267 IP 10.8.3.5 > 192.154.198.15: ICMP echo request, id 1681, seq 42, length 64
21:55:09.371252 IP 10.8.3.5 > 192.154.198.15: ICMP echo request, id 1681, seq 43, length 64
21:55:09.783124 IP 192.154.198.15 > 10.8.3.5: ICMP echo reply, id 1681, seq 43, length 64
21:55:10.371386 IP 10.8.3.5 > 192.154.198.15: ICMP echo request, id 1681, seq 44, length 64
21:55:10.784311 IP 192.154.198.15 > 10.8.3.5: ICMP echo reply, id 1681, seq 44, length 64
21:55:11.372135 IP 10.8.3.5 > 192.154.198.15: ICMP echo request, id 1681, seq 45, length 64
21:55:12.379295 IP 10.8.3.5 > 192.154.198.15: ICMP echo request, id 1681, seq 46, length 64
21:55:12.791057 IP 192.154.198.15 > 10.8.3.5: ICMP echo reply, id 1681, seq 46, length 64
21:55:13.380900 IP 10.8.3.5 > 192.154.198.15: ICMP echo request, id 1681, seq 47, length 64
21:55:13.793006 IP 192.154.198.15 > 10.8.3.5: ICMP echo reply, id 1681, seq 47, length 64
21:55:14.381824 IP 10.8.3.5 > 192.154.198.15: ICMP echo request, id 1681, seq 48, length 64
21:55:14.793540 IP 192.154.198.15 > 10.8.3.5: ICMP echo reply, id 1681, seq 48, length 64
21:55:15.383248 IP 10.8.3.5 > 192.154.198.15: ICMP echo request, id 1681, seq 49, length 64
21:55:15.795397 IP 192.154.198.15 > 10.8.3.5: ICMP echo reply, id 1681, seq 49, length 64
21:55:16.384216 IP 10.8.3.5 > 192.154.198.15: ICMP echo request, id 1681, seq 50, length 64
21:55:16.795948 IP 192.154.198.15 > 10.8.3.5: ICMP echo reply, id 1681, seq 50, length 64
21:55:17.385780 IP 10.8.3.5 > 192.154.198.15: ICMP echo request, id 1681, seq 51, length 64
21:55:17.798220 IP 192.154.198.15 > 10.8.3.5: ICMP echo reply, id 1681, seq 51, length 64
21:55:18.387058 IP 10.8.3.5 > 192.154.198.15: ICMP echo request, id 1681, seq 52, length 64
21:55:18.799228 IP 192.154.198.15 > 10.8.3.5: ICMP echo reply, id 1681, seq 52, length 64
21:55:19.388022 IP 10.8.3.5 > 192.154.198.15: ICMP echo request, id 1681, seq 53, length 64
21:55:19.799957 IP 192.154.198.15 > 10.8.3.5: ICMP echo reply, id 1681, seq 53, length 64
21:55:20.388787 IP 10.8.3.5 > 192.154.198.15: ICMP echo request, id 1681, seq 54, length 64
21:55:20.800628 IP 192.154.198.15 > 10.8.3.5: ICMP echo reply, id 1681, seq 54, length 64
21:55:21.389473 IP 10.8.3.5 > 192.154.198.15: ICMP echo request, id 1681, seq 55, length 64
21:55:21.801430 IP 192.154.198.15 > 10.8.3.5: ICMP echo reply, id 1681, seq 55, length 64
21:55:22.390257 IP 10.8.3.5 > 192.154.198.15: ICMP echo request, id 1681, seq 56, length 64
21:55:22.802210 IP 192.154.198.15 > 10.8.3.5: ICMP echo reply, id 1681, seq 56, length 64
21:55:23.391041 IP 10.8.3.5 > 192.154.198.15: ICMP echo request, id 1681, seq 57, length 64
