06:02:33.944442 IP 10.8.0.14 > 192.154.198.15: ICMP echo request, id 370, seq 2, length 64
06:02:34.393518 IP 192.154.198.15 > 10.8.0.14: ICMP echo reply, id 370, seq 2, length 64
06:02:34.944302 IP 10.8.0.14 > 192.154.198.15: ICMP echo request, id 370, seq 3, length 64
06:02:35.966213 IP 10.8.0.14 > 192.154.198.15: ICMP echo request, id 370, seq 4, length 64
06:02:36.415507 IP 192.154.198.15 > 10.8.0.14: ICMP echo reply, id 370, seq 4, length 64
06:02:36.966293 IP 10.8.0.14 > 192.154.198.15: ICMP echo request, id 370, seq 5, length 64
06:02:37.415301 IP 192.154.198.15 > 10.8.0.14: ICMP echo reply, id 370, seq 5, length 64
06:02:37.966076 IP 10.8.0.14 > 192.154.198.15: ICMP echo request, id 370, seq 6, length 64
06:02:38.415592 IP 192.154.198.15 > 10.8.0.14: ICMP echo reply, id 370, seq 6, length 64
06:02:38.966370 IP 10.8.0.14 > 192.154.198.15: ICMP echo request, id 370, seq 7, length 64
06:02:39.415542 IP 192.154.198.15 > 10.8.0.14: ICMP echo reply, id 370, seq 7, length 64
06:02:39.966330 IP 10.8.0.14 > 192.154.198.15: ICMP echo request, id 370, seq 8, length 64
06:02:40.416002 IP 192.154.198.15 > 10.8.0.14: ICMP echo reply, id 370, seq 8, length 64
06:02:40.966789 IP 10.8.0.14 > 192.154.198.15: ICMP echo request, id 370, seq 9, length 64
06:02:41.416030 IP 192.154.198.15 > 10.8.0.14: ICMP echo reply, id 370, seq 9, length 64
06:02:41.966822 IP 10.8.0.14 > 192.154.198.15: ICMP echo request, id 370, seq 10, length 64
06:02:42.415843 IP 192.154.198.15 > 10.8.0.14: ICMP echo reply, id 370, seq 10, length 64
06:02:42.966631 IP 10.8.0.14 > 192.154.198.15: ICMP echo request, id 370, seq 11, length 64
06:02:43.416009 IP 192.154.198.15 > 10.8.0.14: ICMP echo reply, id 370, seq 11, length 64
06:02:43.966784 IP 10.8.0.14 > 192.154.198.15: ICMP echo request, id 370, seq 12, length 64
06:02:44.415850 IP 192.154.198.15 > 10.8.0.14: ICMP echo reply, id 370, seq 12, length 64
06:02:44.966637 IP 10.8.0.14 > 192.154.198.15: ICMP echo request, id 370, seq 13, length 64
06:02:45.416627 IP 192.154.198.15 > 10.8.0.14: ICMP echo reply, id 370, seq 13, length 64
06:02:45.966415 IP 10.8.0.14 > 192.154.198.15: ICMP echo request, id 370, seq 14, length 64
06:02:46.415441 IP 192.154.198.15 > 10.8.0.14: ICMP echo reply, id 370, seq 14, length 64
06:02:46.966229 IP 10.8.0.14 > 192.154.198.15: ICMP echo request, id 370, seq 15, length 64
06:02:47.415464 IP 192.154.198.15 > 10.8.0.14: ICMP echo reply, id 370, seq 15, length 64
06:02:47.966262 IP 10.8.0.14 > 192.154.198.15: ICMP echo request, id 370, seq 16, length 64
06:02:48.415645 IP 192.154.198.15 > 10.8.0.14: ICMP echo reply, id 370, seq 16, length 64
06:02:48.966435 IP 10.8.0.14 > 192.154.198.15: ICMP echo request, id 370, seq 17, length 64
06:02:49.415411 IP 192.154.198.15 > 10.8.0.14: ICMP echo reply, id 370, seq 17, length 64
06:02:49.966200 IP 10.8.0.14 > 192.154.198.15: ICMP echo request, id 370, seq 18, length 64
06:02:50.415326 IP 192.154.198.15 > 10.8.0.14: ICMP echo reply, id 370, seq 18, length 64
06:02:50.966135 IP 10.8.0.14 > 192.154.198.15: ICMP echo request, id 370, seq 19, length 64
06:02:51.415323 IP 192.154.198.15 > 10.8.0.14: ICMP echo reply, id 370, seq 19, length 64
06:02:51.966130 IP 10.8.0.14 > 192.154.198.15: ICMP echo request, id 370, seq 20, length 64
06:02:52.415215 IP 192.154.198.15 > 10.8.0.14: ICMP echo reply, id 370, seq 20, length 64
06:02:52.966004 IP 10.8.0.14 > 192.154.198.15: ICMP echo request, id 370, seq 21, length 64
06:02:53.415152 IP 192.154.198.15 > 10.8.0.14: ICMP echo reply, id 370, seq 21, length 64
06:02:53.965944 IP 10.8.0.14 > 192.154.198.15: ICMP echo request, id 370, seq 22, length 64
06:02:54.416179 IP 192.154.198.15 > 10.8.0.14: ICMP echo reply, id 370, seq 22, length 64
06:02:54.965967 IP 10.8.0.14 > 192.154.198.15: ICMP echo request, id 370, seq 23, length 64
06:02:55.416057 IP 192.154.198.15 > 10.8.0.14: ICMP echo reply, id 370, seq 23, length 64
06:02:55.965847 IP 10.8.0.14 > 192.154.198.15: ICMP echo request, id 370, seq 24, length 64
06:02:56.414803 IP 192.154.198.15 > 10.8.0.14: ICMP echo reply, id 370, seq 24, length 64
06:02:56.965595 IP 10.8.0.14 > 192.154.198.15: ICMP echo request, id 370, seq 25, length 64
06:02:57.414635 IP 192.154.198.15 > 10.8.0.14: ICMP echo reply, id 370, seq 25, length 64
06:02:57.965424 IP 10.8.0.14 > 192.154.198.15: ICMP echo request, id 370, seq 26, length 64
06:02:58.414607 IP 192.154.198.15 > 10.8.0.14: ICMP echo reply, id 370, seq 26, length 64
06:02:58.965391 IP 10.8.0.14 > 192.154.198.15: ICMP echo request, id 370, seq 27, length 64
06:02:59.414644 IP 192.154.198.15 > 10.8.0.14: ICMP echo reply, id 370, seq 27, length 64
06:02:59.965435 IP 10.8.0.14 > 192.154.198.15: ICMP echo request, id 370, seq 28, length 64
06:03:00.415261 IP 192.154.198.15 > 10.8.0.14: ICMP echo reply, id 370, seq 28, length 64
06:03:00.966050 IP 10.8.0.14 > 192.154.198.15: ICMP echo request, id 370, seq 29, length 64
06:03:01.415238 IP 192.154.198.15 > 10.8.0.14: ICMP echo reply, id 370, seq 29, length 64
06:03:01.966028 IP 10.8.0.14 > 192.154.198.15: ICMP echo request, id 370, seq 30, length 64
06:03:02.418294 IP 192.154.198.15 > 10.8.0.14: ICMP echo reply, id 370, seq 30, length 64
06:03:02.966078 IP 10.8.0.14 > 192.154.198.15: ICMP echo request, id 370, seq 31, length 64
06:03:03.415448 IP 192.154.198.15 > 10.8.0.14: ICMP echo reply, id 370, seq 31, length 64
06:03:03.966239 IP 10.8.0.14 > 192.154.198.15: ICMP echo request, id 370, seq 32, length 64
06:03:04.415110 IP 192.154.198.15 > 10.8.0.14: ICMP echo reply, id 370, seq 32, length 64
06:03:04.965896 IP 10.8.0.14 > 192.154.198.15: ICMP echo request, id 370, seq 33, length 64
06:03:05.415722 IP 192.154.198.15 > 10.8.0.14: ICMP echo reply, id 370, seq 33, length 64
06:03:05.966514 IP 10.8.0.14 > 192.154.198.15: ICMP echo request, id 370, seq 34, length 64
06:03:06.415691 IP 192.154.198.15 > 10.8.0.14: ICMP echo reply, id 370, seq 34, length 64
06:03:06.966484 IP 10.8.0.14 > 192.154.198.15: ICMP echo request, id 370, seq 35, length 64
06:03:07.415381 IP 192.154.198.15 > 10.8.0.14: ICMP echo reply, id 370, seq 35, length 64
06:03:07.966188 IP 10.8.0.14 > 192.154.198.15: ICMP echo request, id 370, seq 36, length 64
06:03:08.415153 IP 192.154.198.15 > 10.8.0.14: ICMP echo reply, id 370, seq 36, length 64
06:03:08.965943 IP 10.8.0.14 > 192.154.198.15: ICMP echo request, id 370, seq 37, length 64
06:03:09.414946 IP 192.154.198.15 > 10.8.0.14: ICMP echo reply, id 370, seq 37, length 64
06:03:09.965734 IP 10.8.0.14 > 192.154.198.15: ICMP echo request, id 370, seq 38, length 64
06:03:10.415390 IP 192.154.198.15 > 10.8.0.14: ICMP echo reply, id 370, seq 38, length 64
06:03:10.966158 IP 10.8.0.14 > 192.154.198.15: ICMP echo request, id 370, seq 39, length 64
06:03:11.415009 IP 192.154.198.15 > 10.8.0.14: ICMP echo reply, id 370, seq 39, length 64
06:03:11.966211 IP 10.8.0.14 > 192.154.198.15: ICMP echo request, id 370, seq 40, length 64
06:03:12.415199 IP 192.154.198.15 > 10.8.0.14: ICMP echo reply, id 370, seq 40, length 64
06:03:12.965958 IP 10.8.0.14 > 192.154.198.15: ICMP echo request, id 370, seq 41, length 64
06:03:13.414969 IP 192.154.198.15 > 10.8.0.14: ICMP echo reply, id 370, seq 41, length 64
06:03:13.965725 IP 10.8.0.14 > 192.154.198.15: ICMP echo request, id 370, seq 42, length 64
06:03:14.415431 IP 192.154.198.15 > 10.8.0.14: ICMP echo reply, id 370, seq 42, length 64
06:03:14.966187 IP 10.8.0.14 > 192.154.198.15: ICMP echo request, id 370, seq 43, length 64
06:03:15.415848 IP 192.154.198.15 > 10.8.0.14: ICMP echo reply, id 370, seq 43, length 64
06:03:15.966214 IP 10.8.0.14 > 192.154.198.15: ICMP echo request, id 370, seq 44, length 64
06:03:16.415469 IP 192.154.198.15 > 10.8.0.14: ICMP echo reply, id 370, seq 44, length 64
06:03:16.966262 IP 10.8.0.14 > 192.154.198.15: ICMP echo request, id 370, seq 45, length 64
06:03:17.415281 IP 192.154.198.15 > 10.8.0.14: ICMP echo reply, id 370, seq 45, length 64
06:03:17.966069 IP 10.8.0.14 > 192.154.198.15: ICMP echo request, id 370, seq 46, length 64
06:03:18.415322 IP 192.154.198.15 > 10.8.0.14: ICMP echo reply, id 370, seq 46, length 64
06:03:18.966123 IP 10.8.0.14 > 192.154.198.15: ICMP echo request, id 370, seq 47, length 64
06:03:19.415339 IP 192.154.198.15 > 10.8.0.14: ICMP echo reply, id 370, seq 47, length 64
06:03:19.966147 IP 10.8.0.14 > 192.154.198.15: ICMP echo request, id 370, seq 48, length 64
06:03:20.415418 IP 192.154.198.15 > 10.8.0.14: ICMP echo reply, id 370, seq 48, length 64
06:03:20.966205 IP 10.8.0.14 > 192.154.198.15: ICMP echo request, id 370, seq 49, length 64
06:03:21.415321 IP 192.154.198.15 > 10.8.0.14: ICMP echo reply, id 370, seq 49, length 64
06:03:21.966126 IP 10.8.0.14 > 192.154.198.15: ICMP echo request, id 370, seq 50, length 64
06:03:22.415517 IP 192.154.198.15 > 10.8.0.14: ICMP echo reply, id 370, seq 50, length 64
06:03:22.966309 IP 10.8.0.14 > 192.154.198.15: ICMP echo request, id 370, seq 51, length 64
06:03:23.415186 IP 192.154.198.15 > 10.8.0.14: ICMP echo reply, id 370, seq 51, length 64
06:03:23.965975 IP 10.8.0.14 > 192.154.198.15: ICMP echo request, id 370, seq 52, length 64
06:03:24.414951 IP 192.154.198.15 > 10.8.0.14: ICMP echo reply, id 370, seq 52, length 64
06:03:24.965737 IP 10.8.0.14 > 192.154.198.15: ICMP echo request, id 370, seq 53, length 64
06:03:25.415006 IP 192.154.198.15 > 10.8.0.14: ICMP echo reply, id 370, seq 53, length 64
06:03:25.965852 IP 10.8.0.14 > 192.154.198.15: ICMP echo request, id 370, seq 54, length 64
06:03:26.414973 IP 192.154.198.15 > 10.8.0.14: ICMP echo reply, id 370, seq 54, length 64
06:03:26.965761 IP 10.8.0.14 > 192.154.198.15: ICMP echo request, id 370, seq 55, length 64
06:03:27.414959 IP 192.154.198.15 > 10.8.0.14: ICMP echo reply, id 370, seq 55, length 64
06:03:27.965747 IP 10.8.0.14 > 192.154.198.15: ICMP echo request, id 370, seq 56, length 64
06:03:28.415442 IP 192.154.198.15 > 10.8.0.14: ICMP echo reply, id 370, seq 56, length 64
06:03:28.966239 IP 10.8.0.14 > 192.154.198.15: ICMP echo request, id 370, seq 57, length 64
