05:37:37.648781 IP 10.8.0.2 > 185.153.151.42: ICMP echo request, id 278, seq 1, length 64
05:37:37.893830 IP 185.153.151.42 > 10.8.0.2: ICMP echo reply, id 278, seq 1, length 64
05:37:38.648276 IP 10.8.0.2 > 185.153.151.42: ICMP echo request, id 278, seq 2, length 64
05:37:38.893287 IP 185.153.151.42 > 10.8.0.2: ICMP echo reply, id 278, seq 2, length 64
05:37:39.649305 IP 10.8.0.2 > 185.153.151.42: ICMP echo request, id 278, seq 3, length 64
05:37:39.894375 IP 185.153.151.42 > 10.8.0.2: ICMP echo reply, id 278, seq 3, length 64
05:37:40.650208 IP 10.8.0.2 > 185.153.151.42: ICMP echo request, id 278, seq 4, length 64
05:37:40.895146 IP 185.153.151.42 > 10.8.0.2: ICMP echo reply, id 278, seq 4, length 64
05:37:41.651145 IP 10.8.0.2 > 185.153.151.42: ICMP echo request, id 278, seq 5, length 64
05:37:41.896262 IP 185.153.151.42 > 10.8.0.2: ICMP echo reply, id 278, seq 5, length 64
05:37:42.652260 IP 10.8.0.2 > 185.153.151.42: ICMP echo request, id 278, seq 6, length 64
05:37:42.897344 IP 185.153.151.42 > 10.8.0.2: ICMP echo reply, id 278, seq 6, length 64
05:37:43.653352 IP 10.8.0.2 > 185.153.151.42: ICMP echo request, id 278, seq 7, length 64
05:37:43.898271 IP 185.153.151.42 > 10.8.0.2: ICMP echo reply, id 278, seq 7, length 64
05:37:44.654277 IP 10.8.0.2 > 185.153.151.42: ICMP echo request, id 278, seq 8, length 64
05:37:44.899496 IP 185.153.151.42 > 10.8.0.2: ICMP echo reply, id 278, seq 8, length 64
05:37:45.655493 IP 10.8.0.2 > 185.153.151.42: ICMP echo request, id 278, seq 9, length 64
05:37:45.900654 IP 185.153.151.42 > 10.8.0.2: ICMP echo reply, id 278, seq 9, length 64
05:37:46.656661 IP 10.8.0.2 > 185.153.151.42: ICMP echo request, id 278, seq 10, length 64
05:37:46.902145 IP 185.153.151.42 > 10.8.0.2: ICMP echo reply, id 278, seq 10, length 64
05:37:47.658153 IP 10.8.0.2 > 185.153.151.42: ICMP echo request, id 278, seq 11, length 64
05:37:47.903207 IP 185.153.151.42 > 10.8.0.2: ICMP echo reply, id 278, seq 11, length 64
05:37:48.659214 IP 10.8.0.2 > 185.153.151.42: ICMP echo request, id 278, seq 12, length 64
05:37:48.904114 IP 185.153.151.42 > 10.8.0.2: ICMP echo reply, id 278, seq 12, length 64
05:37:49.660075 IP 10.8.0.2 > 185.153.151.42: ICMP echo request, id 278, seq 13, length 64
05:37:49.905051 IP 185.153.151.42 > 10.8.0.2: ICMP echo reply, id 278, seq 13, length 64
05:37:50.661051 IP 10.8.0.2 > 185.153.151.42: ICMP echo request, id 278, seq 14, length 64
05:37:50.907902 IP 185.153.151.42 > 10.8.0.2: ICMP echo reply, id 278, seq 14, length 64
05:37:51.661908 IP 10.8.0.2 > 185.153.151.42: ICMP echo request, id 278, seq 15, length 64
05:37:51.906917 IP 185.153.151.42 > 10.8.0.2: ICMP echo reply, id 278, seq 15, length 64
05:37:52.662925 IP 10.8.0.2 > 185.153.151.42: ICMP echo request, id 278, seq 16, length 64
05:37:52.908344 IP 185.153.151.42 > 10.8.0.2: ICMP echo reply, id 278, seq 16, length 64
05:37:53.664350 IP 10.8.0.2 > 185.153.151.42: ICMP echo request, id 278, seq 17, length 64
05:37:53.909746 IP 185.153.151.42 > 10.8.0.2: ICMP echo reply, id 278, seq 17, length 64
05:37:54.665739 IP 10.8.0.2 > 185.153.151.42: ICMP echo request, id 278, seq 18, length 64
05:37:54.910703 IP 185.153.151.42 > 10.8.0.2: ICMP echo reply, id 278, seq 18, length 64
05:37:55.666712 IP 10.8.0.2 > 185.153.151.42: ICMP echo request, id 278, seq 19, length 64
05:37:55.917238 IP 185.153.151.42 > 10.8.0.2: ICMP echo reply, id 278, seq 19, length 64
05:37:56.668240 IP 10.8.0.2 > 185.153.151.42: ICMP echo request, id 278, seq 20, length 64
05:37:56.913277 IP 185.153.151.42 > 10.8.0.2: ICMP echo reply, id 278, seq 20, length 64
05:37:57.669281 IP 10.8.0.2 > 185.153.151.42: ICMP echo request, id 278, seq 21, length 64
05:37:57.914281 IP 185.153.151.42 > 10.8.0.2: ICMP echo reply, id 278, seq 21, length 64
05:37:58.670296 IP 10.8.0.2 > 185.153.151.42: ICMP echo request, id 278, seq 22, length 64
05:37:58.915321 IP 185.153.151.42 > 10.8.0.2: ICMP echo reply, id 278, seq 22, length 64
05:37:59.671324 IP 10.8.0.2 > 185.153.151.42: ICMP echo request, id 278, seq 23, length 64
05:37:59.916356 IP 185.153.151.42 > 10.8.0.2: ICMP echo reply, id 278, seq 23, length 64
05:38:00.672360 IP 10.8.0.2 > 185.153.151.42: ICMP echo request, id 278, seq 24, length 64
05:38:00.918579 IP 185.153.151.42 > 10.8.0.2: ICMP echo reply, id 278, seq 24, length 64
05:38:01.673576 IP 10.8.0.2 > 185.153.151.42: ICMP echo request, id 278, seq 25, length 64
05:38:01.918733 IP 185.153.151.42 > 10.8.0.2: ICMP echo reply, id 278, seq 25, length 64
05:38:02.674738 IP 10.8.0.2 > 185.153.151.42: ICMP echo request, id 278, seq 26, length 64
05:38:02.919818 IP 185.153.151.42 > 10.8.0.2: ICMP echo reply, id 278, seq 26, length 64
05:38:03.675813 IP 10.8.0.2 > 185.153.151.42: ICMP echo request, id 278, seq 27, length 64
05:38:03.920760 IP 185.153.151.42 > 10.8.0.2: ICMP echo reply, id 278, seq 27, length 64
05:38:04.676755 IP 10.8.0.2 > 185.153.151.42: ICMP echo request, id 278, seq 28, length 64
05:38:04.922027 IP 185.153.151.42 > 10.8.0.2: ICMP echo reply, id 278, seq 28, length 64
05:38:05.678036 IP 10.8.0.2 > 185.153.151.42: ICMP echo request, id 278, seq 29, length 64
05:38:05.923143 IP 185.153.151.42 > 10.8.0.2: ICMP echo reply, id 278, seq 29, length 64
05:38:06.679151 IP 10.8.0.2 > 185.153.151.42: ICMP echo request, id 278, seq 30, length 64
05:38:06.924347 IP 185.153.151.42 > 10.8.0.2: ICMP echo reply, id 278, seq 30, length 64
05:38:07.680352 IP 10.8.0.2 > 185.153.151.42: ICMP echo request, id 278, seq 31, length 64
05:38:07.933408 IP 185.153.151.42 > 10.8.0.2: ICMP echo reply, id 278, seq 31, length 64
05:38:08.681401 IP 10.8.0.2 > 185.153.151.42: ICMP echo request, id 278, seq 32, length 64
05:38:08.926383 IP 185.153.151.42 > 10.8.0.2: ICMP echo reply, id 278, seq 32, length 64
05:38:09.682389 IP 10.8.0.2 > 185.153.151.42: ICMP echo request, id 278, seq 33, length 64
05:38:09.927446 IP 185.153.151.42 > 10.8.0.2: ICMP echo reply, id 278, seq 33, length 64
05:38:10.683425 IP 10.8.0.2 > 185.153.151.42: ICMP echo request, id 278, seq 34, length 64
05:38:10.930141 IP 185.153.151.42 > 10.8.0.2: ICMP echo reply, id 278, seq 34, length 64
05:38:11.685138 IP 10.8.0.2 > 185.153.151.42: ICMP echo request, id 278, seq 35, length 64
05:38:11.930360 IP 185.153.151.42 > 10.8.0.2: ICMP echo reply, id 278, seq 35, length 64
05:38:12.686362 IP 10.8.0.2 > 185.153.151.42: ICMP echo request, id 278, seq 36, length 64
05:38:12.931768 IP 185.153.151.42 > 10.8.0.2: ICMP echo reply, id 278, seq 36, length 64
05:38:13.687769 IP 10.8.0.2 > 185.153.151.42: ICMP echo request, id 278, seq 37, length 64
05:38:13.934518 IP 185.153.151.42 > 10.8.0.2: ICMP echo reply, id 278, seq 37, length 64
05:38:14.689516 IP 10.8.0.2 > 185.153.151.42: ICMP echo request, id 278, seq 38, length 64
05:38:14.934822 IP 185.153.151.42 > 10.8.0.2: ICMP echo reply, id 278, seq 38, length 64
05:38:15.690828 IP 10.8.0.2 > 185.153.151.42: ICMP echo request, id 278, seq 39, length 64
05:38:15.935875 IP 185.153.151.42 > 10.8.0.2: ICMP echo reply, id 278, seq 39, length 64
05:38:16.691887 IP 10.8.0.2 > 185.153.151.42: ICMP echo request, id 278, seq 40, length 64
05:38:16.936888 IP 185.153.151.42 > 10.8.0.2: ICMP echo reply, id 278, seq 40, length 64
05:38:17.692892 IP 10.8.0.2 > 185.153.151.42: ICMP echo request, id 278, seq 41, length 64
05:38:17.937926 IP 185.153.151.42 > 10.8.0.2: ICMP echo reply, id 278, seq 41, length 64
05:38:18.693923 IP 10.8.0.2 > 185.153.151.42: ICMP echo request, id 278, seq 42, length 64
05:38:18.939136 IP 185.153.151.42 > 10.8.0.2: ICMP echo reply, id 278, seq 42, length 64
05:38:19.695138 IP 10.8.0.2 > 185.153.151.42: ICMP echo request, id 278, seq 43, length 64
05:38:19.940195 IP 185.153.151.42 > 10.8.0.2: ICMP echo reply, id 278, seq 43, length 64
05:38:20.696198 IP 10.8.0.2 > 185.153.151.42: ICMP echo request, id 278, seq 44, length 64
05:38:20.941183 IP 185.153.151.42 > 10.8.0.2: ICMP echo reply, id 278, seq 44, length 64
05:38:21.697186 IP 10.8.0.2 > 185.153.151.42: ICMP echo request, id 278, seq 45, length 64
05:38:21.942226 IP 185.153.151.42 > 10.8.0.2: ICMP echo reply, id 278, seq 45, length 64
05:38:22.698228 IP 10.8.0.2 > 185.153.151.42: ICMP echo request, id 278, seq 46, length 64
05:38:22.943452 IP 185.153.151.42 > 10.8.0.2: ICMP echo reply, id 278, seq 46, length 64
05:38:23.699462 IP 10.8.0.2 > 185.153.151.42: ICMP echo request, id 278, seq 47, length 64
05:38:23.944520 IP 185.153.151.42 > 10.8.0.2: ICMP echo reply, id 278, seq 47, length 64
05:38:24.700516 IP 10.8.0.2 > 185.153.151.42: ICMP echo request, id 278, seq 48, length 64
05:38:24.945615 IP 185.153.151.42 > 10.8.0.2: ICMP echo reply, id 278, seq 48, length 64
05:38:25.701617 IP 10.8.0.2 > 185.153.151.42: ICMP echo request, id 278, seq 49, length 64
05:38:25.946776 IP 185.153.151.42 > 10.8.0.2: ICMP echo reply, id 278, seq 49, length 64
05:38:26.702776 IP 10.8.0.2 > 185.153.151.42: ICMP echo request, id 278, seq 50, length 64
05:38:26.947992 IP 185.153.151.42 > 10.8.0.2: ICMP echo reply, id 278, seq 50, length 64
05:38:27.703938 IP 10.8.0.2 > 185.153.151.42: ICMP echo request, id 278, seq 51, length 64
05:38:27.949043 IP 185.153.151.42 > 10.8.0.2: ICMP echo reply, id 278, seq 51, length 64
05:38:28.705045 IP 10.8.0.2 > 185.153.151.42: ICMP echo request, id 278, seq 52, length 64
05:38:28.950285 IP 185.153.151.42 > 10.8.0.2: ICMP echo reply, id 278, seq 52, length 64
05:38:29.706289 IP 10.8.0.2 > 185.153.151.42: ICMP echo request, id 278, seq 53, length 64
05:38:29.951872 IP 185.153.151.42 > 10.8.0.2: ICMP echo reply, id 278, seq 53, length 64
05:38:30.707874 IP 10.8.0.2 > 185.153.151.42: ICMP echo request, id 278, seq 54, length 64
05:38:30.953033 IP 185.153.151.42 > 10.8.0.2: ICMP echo reply, id 278, seq 54, length 64
05:38:31.709032 IP 10.8.0.2 > 185.153.151.42: ICMP echo request, id 278, seq 55, length 64
05:38:31.954155 IP 185.153.151.42 > 10.8.0.2: ICMP echo reply, id 278, seq 55, length 64
05:38:32.710158 IP 10.8.0.2 > 185.153.151.42: ICMP echo request, id 278, seq 56, length 64
05:38:32.955380 IP 185.153.151.42 > 10.8.0.2: ICMP echo reply, id 278, seq 56, length 64
05:38:33.711379 IP 10.8.0.2 > 185.153.151.42: ICMP echo request, id 278, seq 57, length 64
05:38:33.956412 IP 185.153.151.42 > 10.8.0.2: ICMP echo reply, id 278, seq 57, length 64
05:38:34.712415 IP 10.8.0.2 > 185.153.151.42: ICMP echo request, id 278, seq 58, length 64
05:38:34.957630 IP 185.153.151.42 > 10.8.0.2: ICMP echo reply, id 278, seq 58, length 64
05:38:35.713630 IP 10.8.0.2 > 185.153.151.42: ICMP echo request, id 278, seq 59, length 64
05:38:35.958869 IP 185.153.151.42 > 10.8.0.2: ICMP echo reply, id 278, seq 59, length 64
05:38:36.714869 IP 10.8.0.2 > 185.153.151.42: ICMP echo request, id 278, seq 60, length 64
