18:31:53.326478 IP 165.73.240.43 > 10.8.0.3: ICMP echo reply, id 933, seq 1, length 64
18:31:55.099133 IP 10.8.0.3 > 165.73.240.43: ICMP echo request, id 933, seq 2, length 64
18:31:55.753422 IP 165.73.240.43 > 10.8.0.3: ICMP echo reply, id 933, seq 2, length 64
18:31:56.100023 IP 10.8.0.3 > 165.73.240.43: ICMP echo request, id 933, seq 3, length 64
18:31:56.754630 IP 165.73.240.43 > 10.8.0.3: ICMP echo reply, id 933, seq 3, length 64
18:31:57.101182 IP 10.8.0.3 > 165.73.240.43: ICMP echo request, id 933, seq 4, length 64
18:31:58.107258 IP 10.8.0.3 > 165.73.240.43: ICMP echo request, id 933, seq 5, length 64
18:31:58.761382 IP 165.73.240.43 > 10.8.0.3: ICMP echo reply, id 933, seq 5, length 64
18:31:59.107958 IP 10.8.0.3 > 165.73.240.43: ICMP echo request, id 933, seq 6, length 64
18:31:59.760434 IP 165.73.240.43 > 10.8.0.3: ICMP echo reply, id 933, seq 6, length 64
18:32:00.109020 IP 10.8.0.3 > 165.73.240.43: ICMP echo request, id 933, seq 7, length 64
18:32:00.764445 IP 165.73.240.43 > 10.8.0.3: ICMP echo reply, id 933, seq 7, length 64
18:32:01.110027 IP 10.8.0.3 > 165.73.240.43: ICMP echo request, id 933, seq 8, length 64
18:32:02.139270 IP 10.8.0.3 > 165.73.240.43: ICMP echo request, id 933, seq 9, length 64
18:32:03.163242 IP 10.8.0.3 > 165.73.240.43: ICMP echo request, id 933, seq 10, length 64
18:32:04.187270 IP 10.8.0.3 > 165.73.240.43: ICMP echo request, id 933, seq 11, length 64
18:32:05.211260 IP 10.8.0.3 > 165.73.240.43: ICMP echo request, id 933, seq 12, length 64
18:32:05.864289 IP 165.73.240.43 > 10.8.0.3: ICMP echo reply, id 933, seq 12, length 64
18:32:06.211871 IP 10.8.0.3 > 165.73.240.43: ICMP echo request, id 933, seq 13, length 64
18:32:06.865319 IP 165.73.240.43 > 10.8.0.3: ICMP echo reply, id 933, seq 13, length 64
18:32:07.212904 IP 10.8.0.3 > 165.73.240.43: ICMP echo request, id 933, seq 14, length 64
18:32:07.866614 IP 165.73.240.43 > 10.8.0.3: ICMP echo reply, id 933, seq 14, length 64
18:32:08.214204 IP 10.8.0.3 > 165.73.240.43: ICMP echo request, id 933, seq 15, length 64
18:32:08.866059 IP 165.73.240.43 > 10.8.0.3: ICMP echo reply, id 933, seq 15, length 64
18:32:09.214644 IP 10.8.0.3 > 165.73.240.43: ICMP echo request, id 933, seq 16, length 64
18:32:09.868872 IP 165.73.240.43 > 10.8.0.3: ICMP echo reply, id 933, seq 16, length 64
18:32:10.215455 IP 10.8.0.3 > 165.73.240.43: ICMP echo request, id 933, seq 17, length 64
18:32:10.868544 IP 165.73.240.43 > 10.8.0.3: ICMP echo reply, id 933, seq 17, length 64
18:32:11.216131 IP 10.8.0.3 > 165.73.240.43: ICMP echo request, id 933, seq 18, length 64
18:32:11.868812 IP 165.73.240.43 > 10.8.0.3: ICMP echo reply, id 933, seq 18, length 64
18:32:12.217395 IP 10.8.0.3 > 165.73.240.43: ICMP echo request, id 933, seq 19, length 64
18:32:12.870975 IP 165.73.240.43 > 10.8.0.3: ICMP echo reply, id 933, seq 19, length 64
18:32:13.218554 IP 10.8.0.3 > 165.73.240.43: ICMP echo request, id 933, seq 20, length 64
18:32:13.870865 IP 165.73.240.43 > 10.8.0.3: ICMP echo reply, id 933, seq 20, length 64
18:32:14.219455 IP 10.8.0.3 > 165.73.240.43: ICMP echo request, id 933, seq 21, length 64
18:32:14.873015 IP 165.73.240.43 > 10.8.0.3: ICMP echo reply, id 933, seq 21, length 64
18:32:15.220601 IP 10.8.0.3 > 165.73.240.43: ICMP echo request, id 933, seq 22, length 64
18:32:15.873450 IP 165.73.240.43 > 10.8.0.3: ICMP echo reply, id 933, seq 22, length 64
18:32:16.221031 IP 10.8.0.3 > 165.73.240.43: ICMP echo request, id 933, seq 23, length 64
18:32:16.874003 IP 165.73.240.43 > 10.8.0.3: ICMP echo reply, id 933, seq 23, length 64
18:32:17.221587 IP 10.8.0.3 > 165.73.240.43: ICMP echo request, id 933, seq 24, length 64
18:32:17.878526 IP 165.73.240.43 > 10.8.0.3: ICMP echo reply, id 933, seq 24, length 64
18:32:18.222146 IP 10.8.0.3 > 165.73.240.43: ICMP echo request, id 933, seq 25, length 64
18:32:18.875164 IP 165.73.240.43 > 10.8.0.3: ICMP echo reply, id 933, seq 25, length 64
18:32:19.222755 IP 10.8.0.3 > 165.73.240.43: ICMP echo request, id 933, seq 26, length 64
18:32:20.251247 IP 10.8.0.3 > 165.73.240.43: ICMP echo request, id 933, seq 27, length 64
18:32:21.275261 IP 10.8.0.3 > 165.73.240.43: ICMP echo request, id 933, seq 28, length 64
18:32:21.928252 IP 165.73.240.43 > 10.8.0.3: ICMP echo reply, id 933, seq 28, length 64
18:32:22.275838 IP 10.8.0.3 > 165.73.240.43: ICMP echo request, id 933, seq 29, length 64
18:32:23.291275 IP 10.8.0.3 > 165.73.240.43: ICMP echo request, id 933, seq 30, length 64
18:32:23.944963 IP 165.73.240.43 > 10.8.0.3: ICMP echo reply, id 933, seq 30, length 64
18:32:24.292555 IP 10.8.0.3 > 165.73.240.43: ICMP echo request, id 933, seq 31, length 64
18:32:24.947615 IP 165.73.240.43 > 10.8.0.3: ICMP echo reply, id 933, seq 31, length 64
18:32:25.293196 IP 10.8.0.3 > 165.73.240.43: ICMP echo request, id 933, seq 32, length 64
18:32:25.948685 IP 165.73.240.43 > 10.8.0.3: ICMP echo reply, id 933, seq 32, length 64
18:32:26.294269 IP 10.8.0.3 > 165.73.240.43: ICMP echo request, id 933, seq 33, length 64
18:32:26.946728 IP 165.73.240.43 > 10.8.0.3: ICMP echo reply, id 933, seq 33, length 64
18:32:27.295239 IP 10.8.0.3 > 165.73.240.43: ICMP echo request, id 933, seq 34, length 64
18:32:28.315263 IP 10.8.0.3 > 165.73.240.43: ICMP echo request, id 933, seq 35, length 64
18:32:28.968140 IP 165.73.240.43 > 10.8.0.3: ICMP echo reply, id 933, seq 35, length 64
18:32:29.315721 IP 10.8.0.3 > 165.73.240.43: ICMP echo request, id 933, seq 36, length 64
18:32:29.969849 IP 165.73.240.43 > 10.8.0.3: ICMP echo reply, id 933, seq 36, length 64
18:32:30.316437 IP 10.8.0.3 > 165.73.240.43: ICMP echo request, id 933, seq 37, length 64
18:32:30.969879 IP 165.73.240.43 > 10.8.0.3: ICMP echo reply, id 933, seq 37, length 64
18:32:31.317458 IP 10.8.0.3 > 165.73.240.43: ICMP echo request, id 933, seq 38, length 64
18:32:31.970535 IP 165.73.240.43 > 10.8.0.3: ICMP echo reply, id 933, seq 38, length 64
18:32:32.318116 IP 10.8.0.3 > 165.73.240.43: ICMP echo request, id 933, seq 39, length 64
18:32:32.971532 IP 165.73.240.43 > 10.8.0.3: ICMP echo reply, id 933, seq 39, length 64
18:32:33.319116 IP 10.8.0.3 > 165.73.240.43: ICMP echo request, id 933, seq 40, length 64
18:32:33.971065 IP 165.73.240.43 > 10.8.0.3: ICMP echo reply, id 933, seq 40, length 64
18:32:34.319658 IP 10.8.0.3 > 165.73.240.43: ICMP echo request, id 933, seq 41, length 64
18:32:34.980671 IP 165.73.240.43 > 10.8.0.3: ICMP echo reply, id 933, seq 41, length 64
18:32:35.320254 IP 10.8.0.3 > 165.73.240.43: ICMP echo request, id 933, seq 42, length 64
18:32:35.972950 IP 165.73.240.43 > 10.8.0.3: ICMP echo reply, id 933, seq 42, length 64
18:32:36.321654 IP 10.8.0.3 > 165.73.240.43: ICMP echo request, id 933, seq 43, length 64
18:32:36.974790 IP 165.73.240.43 > 10.8.0.3: ICMP echo reply, id 933, seq 43, length 64
18:32:37.322374 IP 10.8.0.3 > 165.73.240.43: ICMP echo request, id 933, seq 44, length 64
18:32:37.976784 IP 165.73.240.43 > 10.8.0.3: ICMP echo reply, id 933, seq 44, length 64
18:32:38.323368 IP 10.8.0.3 > 165.73.240.43: ICMP echo request, id 933, seq 45, length 64
18:32:39.355255 IP 10.8.0.3 > 165.73.240.43: ICMP echo request, id 933, seq 46, length 64
18:32:40.008455 IP 165.73.240.43 > 10.8.0.3: ICMP echo reply, id 933, seq 46, length 64
18:32:40.355025 IP 10.8.0.3 > 165.73.240.43: ICMP echo request, id 933, seq 47, length 64
18:32:41.371232 IP 10.8.0.3 > 165.73.240.43: ICMP echo request, id 933, seq 48, length 64
18:32:42.024829 IP 165.73.240.43 > 10.8.0.3: ICMP echo reply, id 933, seq 48, length 64
18:32:42.371414 IP 10.8.0.3 > 165.73.240.43: ICMP echo request, id 933, seq 49, length 64
18:32:43.024016 IP 165.73.240.43 > 10.8.0.3: ICMP echo reply, id 933, seq 49, length 64
18:32:43.371602 IP 10.8.0.3 > 165.73.240.43: ICMP echo request, id 933, seq 50, length 64
18:32:44.026478 IP 165.73.240.43 > 10.8.0.3: ICMP echo reply, id 933, seq 50, length 64
18:32:44.371062 IP 10.8.0.3 > 165.73.240.43: ICMP echo request, id 933, seq 51, length 64
18:32:45.024386 IP 165.73.240.43 > 10.8.0.3: ICMP echo reply, id 933, seq 51, length 64
18:32:45.370973 IP 10.8.0.3 > 165.73.240.43: ICMP echo request, id 933, seq 52, length 64
18:32:46.395274 IP 10.8.0.3 > 165.73.240.43: ICMP echo request, id 933, seq 53, length 64
18:32:47.049369 IP 165.73.240.43 > 10.8.0.3: ICMP echo reply, id 933, seq 53, length 64
18:32:47.394961 IP 10.8.0.3 > 165.73.240.43: ICMP echo request, id 933, seq 54, length 64
18:32:48.047244 IP 165.73.240.43 > 10.8.0.3: ICMP echo reply, id 933, seq 54, length 64
18:32:48.394834 IP 10.8.0.3 > 165.73.240.43: ICMP echo request, id 933, seq 55, length 64
18:32:49.048345 IP 165.73.240.43 > 10.8.0.3: ICMP echo reply, id 933, seq 55, length 64
18:32:49.394932 IP 10.8.0.3 > 165.73.240.43: ICMP echo request, id 933, seq 56, length 64
18:32:50.048234 IP 165.73.240.43 > 10.8.0.3: ICMP echo reply, id 933, seq 56, length 64
18:32:50.394815 IP 10.8.0.3 > 165.73.240.43: ICMP echo request, id 933, seq 57, length 64
18:32:51.049359 IP 165.73.240.43 > 10.8.0.3: ICMP echo reply, id 933, seq 57, length 64
18:32:51.394952 IP 10.8.0.3 > 165.73.240.43: ICMP echo request, id 933, seq 58, length 64
18:32:52.053844 IP 165.73.240.43 > 10.8.0.3: ICMP echo reply, id 933, seq 58, length 64
18:32:52.394385 IP 10.8.0.3 > 165.73.240.43: ICMP echo request, id 933, seq 59, length 64
