18:07:10.124174 IP 10.8.2.7 > 185.191.204.132: ICMP echo request, id 838, seq 2, length 64
18:07:10.499760 IP 185.191.204.132 > 10.8.2.7: ICMP echo reply, id 838, seq 2, length 64
18:07:11.125635 IP 10.8.2.7 > 185.191.204.132: ICMP echo request, id 838, seq 3, length 64
18:07:11.501165 IP 185.191.204.132 > 10.8.2.7: ICMP echo reply, id 838, seq 3, length 64
18:07:12.127062 IP 10.8.2.7 > 185.191.204.132: ICMP echo request, id 838, seq 4, length 64
18:07:12.503270 IP 185.191.204.132 > 10.8.2.7: ICMP echo reply, id 838, seq 4, length 64
18:07:13.128124 IP 10.8.2.7 > 185.191.204.132: ICMP echo request, id 838, seq 5, length 64
18:07:13.503486 IP 185.191.204.132 > 10.8.2.7: ICMP echo reply, id 838, seq 5, length 64
18:07:14.129338 IP 10.8.2.7 > 185.191.204.132: ICMP echo request, id 838, seq 6, length 64
18:07:14.505329 IP 185.191.204.132 > 10.8.2.7: ICMP echo reply, id 838, seq 6, length 64
18:07:15.130177 IP 10.8.2.7 > 185.191.204.132: ICMP echo request, id 838, seq 7, length 64
18:07:15.506569 IP 185.191.204.132 > 10.8.2.7: ICMP echo reply, id 838, seq 7, length 64
18:07:16.131415 IP 10.8.2.7 > 185.191.204.132: ICMP echo request, id 838, seq 8, length 64
18:07:16.507754 IP 185.191.204.132 > 10.8.2.7: ICMP echo reply, id 838, seq 8, length 64
18:07:17.132599 IP 10.8.2.7 > 185.191.204.132: ICMP echo request, id 838, seq 9, length 64
18:07:17.508123 IP 185.191.204.132 > 10.8.2.7: ICMP echo reply, id 838, seq 9, length 64
18:07:18.133969 IP 10.8.2.7 > 185.191.204.132: ICMP echo request, id 838, seq 10, length 64
18:07:18.509601 IP 185.191.204.132 > 10.8.2.7: ICMP echo reply, id 838, seq 10, length 64
18:07:19.135459 IP 10.8.2.7 > 185.191.204.132: ICMP echo request, id 838, seq 11, length 64
18:07:19.510803 IP 185.191.204.132 > 10.8.2.7: ICMP echo reply, id 838, seq 11, length 64
18:07:20.136649 IP 10.8.2.7 > 185.191.204.132: ICMP echo request, id 838, seq 12, length 64
18:07:20.512084 IP 185.191.204.132 > 10.8.2.7: ICMP echo reply, id 838, seq 12, length 64
18:07:21.137930 IP 10.8.2.7 > 185.191.204.132: ICMP echo request, id 838, seq 13, length 64
18:07:21.514191 IP 185.191.204.132 > 10.8.2.7: ICMP echo reply, id 838, seq 13, length 64
18:07:22.139036 IP 10.8.2.7 > 185.191.204.132: ICMP echo request, id 838, seq 14, length 64
18:07:22.515307 IP 185.191.204.132 > 10.8.2.7: ICMP echo reply, id 838, seq 14, length 64
18:07:23.140157 IP 10.8.2.7 > 185.191.204.132: ICMP echo request, id 838, seq 15, length 64
18:07:23.515811 IP 185.191.204.132 > 10.8.2.7: ICMP echo reply, id 838, seq 15, length 64
18:07:24.141672 IP 10.8.2.7 > 185.191.204.132: ICMP echo request, id 838, seq 16, length 64
18:07:24.517200 IP 185.191.204.132 > 10.8.2.7: ICMP echo reply, id 838, seq 16, length 64
18:07:25.143046 IP 10.8.2.7 > 185.191.204.132: ICMP echo request, id 838, seq 17, length 64
18:07:25.518707 IP 185.191.204.132 > 10.8.2.7: ICMP echo reply, id 838, seq 17, length 64
18:07:26.144557 IP 10.8.2.7 > 185.191.204.132: ICMP echo request, id 838, seq 18, length 64
18:07:26.521326 IP 185.191.204.132 > 10.8.2.7: ICMP echo reply, id 838, seq 18, length 64
18:07:27.146173 IP 10.8.2.7 > 185.191.204.132: ICMP echo request, id 838, seq 19, length 64
18:07:27.522228 IP 185.191.204.132 > 10.8.2.7: ICMP echo reply, id 838, seq 19, length 64
18:07:28.147079 IP 10.8.2.7 > 185.191.204.132: ICMP echo request, id 838, seq 20, length 64
18:07:28.522439 IP 185.191.204.132 > 10.8.2.7: ICMP echo reply, id 838, seq 20, length 64
18:07:29.148288 IP 10.8.2.7 > 185.191.204.132: ICMP echo request, id 838, seq 21, length 64
18:07:29.524525 IP 185.191.204.132 > 10.8.2.7: ICMP echo reply, id 838, seq 21, length 64
18:07:30.149382 IP 10.8.2.7 > 185.191.204.132: ICMP echo request, id 838, seq 22, length 64
18:07:30.525047 IP 185.191.204.132 > 10.8.2.7: ICMP echo reply, id 838, seq 22, length 64
18:07:31.150915 IP 10.8.2.7 > 185.191.204.132: ICMP echo request, id 838, seq 23, length 64
18:07:31.526077 IP 185.191.204.132 > 10.8.2.7: ICMP echo reply, id 838, seq 23, length 64
18:07:32.151932 IP 10.8.2.7 > 185.191.204.132: ICMP echo request, id 838, seq 24, length 64
18:07:32.527884 IP 185.191.204.132 > 10.8.2.7: ICMP echo reply, id 838, seq 24, length 64
18:07:33.152737 IP 10.8.2.7 > 185.191.204.132: ICMP echo request, id 838, seq 25, length 64
18:07:33.528108 IP 185.191.204.132 > 10.8.2.7: ICMP echo reply, id 838, seq 25, length 64
18:07:34.153958 IP 10.8.2.7 > 185.191.204.132: ICMP echo request, id 838, seq 26, length 64
18:07:34.529466 IP 185.191.204.132 > 10.8.2.7: ICMP echo reply, id 838, seq 26, length 64
18:07:35.155311 IP 10.8.2.7 > 185.191.204.132: ICMP echo request, id 838, seq 27, length 64
18:07:35.532117 IP 185.191.204.132 > 10.8.2.7: ICMP echo reply, id 838, seq 27, length 64
18:07:36.156965 IP 10.8.2.7 > 185.191.204.132: ICMP echo request, id 838, seq 28, length 64
18:07:36.538442 IP 185.191.204.132 > 10.8.2.7: ICMP echo reply, id 838, seq 28, length 64
18:07:37.158284 IP 10.8.2.7 > 185.191.204.132: ICMP echo request, id 838, seq 29, length 64
18:07:37.533572 IP 185.191.204.132 > 10.8.2.7: ICMP echo reply, id 838, seq 29, length 64
18:07:38.159426 IP 10.8.2.7 > 185.191.204.132: ICMP echo request, id 838, seq 30, length 64
18:07:38.535031 IP 185.191.204.132 > 10.8.2.7: ICMP echo reply, id 838, seq 30, length 64
18:07:39.160912 IP 10.8.2.7 > 185.191.204.132: ICMP echo request, id 838, seq 31, length 64
18:07:39.537189 IP 185.191.204.132 > 10.8.2.7: ICMP echo reply, id 838, seq 31, length 64
18:07:40.162039 IP 10.8.2.7 > 185.191.204.132: ICMP echo request, id 838, seq 32, length 64
18:07:40.538762 IP 185.191.204.132 > 10.8.2.7: ICMP echo reply, id 838, seq 32, length 64
18:07:41.163617 IP 10.8.2.7 > 185.191.204.132: ICMP echo request, id 838, seq 33, length 64
18:07:42.171244 IP 10.8.2.7 > 185.191.204.132: ICMP echo request, id 838, seq 34, length 64
18:07:42.546775 IP 185.191.204.132 > 10.8.2.7: ICMP echo reply, id 838, seq 34, length 64
18:07:43.172632 IP 10.8.2.7 > 185.191.204.132: ICMP echo request, id 838, seq 35, length 64
18:07:43.550184 IP 185.191.204.132 > 10.8.2.7: ICMP echo reply, id 838, seq 35, length 64
18:07:44.174033 IP 10.8.2.7 > 185.191.204.132: ICMP echo request, id 838, seq 36, length 64
18:07:44.549789 IP 185.191.204.132 > 10.8.2.7: ICMP echo reply, id 838, seq 36, length 64
18:07:45.175639 IP 10.8.2.7 > 185.191.204.132: ICMP echo request, id 838, seq 37, length 64
18:07:45.552159 IP 185.191.204.132 > 10.8.2.7: ICMP echo reply, id 838, seq 37, length 64
18:07:46.177010 IP 10.8.2.7 > 185.191.204.132: ICMP echo request, id 838, seq 38, length 64
18:07:46.553831 IP 185.191.204.132 > 10.8.2.7: ICMP echo reply, id 838, seq 38, length 64
18:07:47.178681 IP 10.8.2.7 > 185.191.204.132: ICMP echo request, id 838, seq 39, length 64
18:07:47.554398 IP 185.191.204.132 > 10.8.2.7: ICMP echo reply, id 838, seq 39, length 64
18:07:48.180251 IP 10.8.2.7 > 185.191.204.132: ICMP echo request, id 838, seq 40, length 64
18:07:48.556818 IP 185.191.204.132 > 10.8.2.7: ICMP echo reply, id 838, seq 40, length 64
18:07:49.181656 IP 10.8.2.7 > 185.191.204.132: ICMP echo request, id 838, seq 41, length 64
18:07:49.557202 IP 185.191.204.132 > 10.8.2.7: ICMP echo reply, id 838, seq 41, length 64
18:07:50.183050 IP 10.8.2.7 > 185.191.204.132: ICMP echo request, id 838, seq 42, length 64
18:07:50.560043 IP 185.191.204.132 > 10.8.2.7: ICMP echo reply, id 838, seq 42, length 64
18:07:51.183894 IP 10.8.2.7 > 185.191.204.132: ICMP echo request, id 838, seq 43, length 64
18:07:51.559670 IP 185.191.204.132 > 10.8.2.7: ICMP echo reply, id 838, seq 43, length 64
18:07:52.185539 IP 10.8.2.7 > 185.191.204.132: ICMP echo request, id 838, seq 44, length 64
18:07:52.560822 IP 185.191.204.132 > 10.8.2.7: ICMP echo reply, id 838, seq 44, length 64
18:07:53.186675 IP 10.8.2.7 > 185.191.204.132: ICMP echo request, id 838, seq 45, length 64
18:07:53.562490 IP 185.191.204.132 > 10.8.2.7: ICMP echo reply, id 838, seq 45, length 64
18:07:54.188346 IP 10.8.2.7 > 185.191.204.132: ICMP echo request, id 838, seq 46, length 64
18:07:54.563869 IP 185.191.204.132 > 10.8.2.7: ICMP echo reply, id 838, seq 46, length 64
18:07:55.189719 IP 10.8.2.7 > 185.191.204.132: ICMP echo request, id 838, seq 47, length 64
18:07:55.565503 IP 185.191.204.132 > 10.8.2.7: ICMP echo reply, id 838, seq 47, length 64
18:07:56.191364 IP 10.8.2.7 > 185.191.204.132: ICMP echo request, id 838, seq 48, length 64
18:07:56.573751 IP 185.191.204.132 > 10.8.2.7: ICMP echo reply, id 838, seq 48, length 64
18:07:57.192616 IP 10.8.2.7 > 185.191.204.132: ICMP echo request, id 838, seq 49, length 64
18:07:57.568753 IP 185.191.204.132 > 10.8.2.7: ICMP echo reply, id 838, seq 49, length 64
18:07:58.193619 IP 10.8.2.7 > 185.191.204.132: ICMP echo request, id 838, seq 50, length 64
18:07:58.569735 IP 185.191.204.132 > 10.8.2.7: ICMP echo reply, id 838, seq 50, length 64
18:07:59.194593 IP 10.8.2.7 > 185.191.204.132: ICMP echo request, id 838, seq 51, length 64
18:07:59.570542 IP 185.191.204.132 > 10.8.2.7: ICMP echo reply, id 838, seq 51, length 64
18:08:00.195401 IP 10.8.2.7 > 185.191.204.132: ICMP echo request, id 838, seq 52, length 64
18:08:00.570799 IP 185.191.204.132 > 10.8.2.7: ICMP echo reply, id 838, seq 52, length 64
18:08:01.196654 IP 10.8.2.7 > 185.191.204.132: ICMP echo request, id 838, seq 53, length 64
18:08:01.572356 IP 185.191.204.132 > 10.8.2.7: ICMP echo reply, id 838, seq 53, length 64
18:08:02.198215 IP 10.8.2.7 > 185.191.204.132: ICMP echo request, id 838, seq 54, length 64
18:08:02.574568 IP 185.191.204.132 > 10.8.2.7: ICMP echo reply, id 838, seq 54, length 64
18:08:03.199431 IP 10.8.2.7 > 185.191.204.132: ICMP echo request, id 838, seq 55, length 64
18:08:03.575747 IP 185.191.204.132 > 10.8.2.7: ICMP echo reply, id 838, seq 55, length 64
18:08:04.200608 IP 10.8.2.7 > 185.191.204.132: ICMP echo request, id 838, seq 56, length 64
18:08:04.576463 IP 185.191.204.132 > 10.8.2.7: ICMP echo reply, id 838, seq 56, length 64
18:08:05.201319 IP 10.8.2.7 > 185.191.204.132: ICMP echo request, id 838, seq 57, length 64
18:08:06.203245 IP 10.8.2.7 > 185.191.204.132: ICMP echo request, id 838, seq 58, length 64
18:08:06.579196 IP 185.191.204.132 > 10.8.2.7: ICMP echo reply, id 838, seq 58, length 64
18:08:07.204059 IP 10.8.2.7 > 185.191.204.132: ICMP echo request, id 838, seq 59, length 64
18:08:07.579750 IP 185.191.204.132 > 10.8.2.7: ICMP echo reply, id 838, seq 59, length 64
18:08:08.205617 IP 10.8.2.7 > 185.191.204.132: ICMP echo request, id 838, seq 60, length 64
18:08:08.581038 IP 185.191.204.132 > 10.8.2.7: ICMP echo reply, id 838, seq 60, length 64
