18:21:28.671103 IP 10.8.2.3 > 45.228.209.43: ICMP echo request, id 58, seq 2, length 64
18:21:29.020920 IP 45.228.209.43 > 10.8.2.3: ICMP echo reply, id 58, seq 2, length 64
18:21:29.670797 IP 10.8.2.3 > 45.228.209.43: ICMP echo request, id 58, seq 3, length 64
18:21:30.019720 IP 45.228.209.43 > 10.8.2.3: ICMP echo reply, id 58, seq 3, length 64
18:21:30.670642 IP 10.8.2.3 > 45.228.209.43: ICMP echo request, id 58, seq 4, length 64
18:21:31.018453 IP 45.228.209.43 > 10.8.2.3: ICMP echo reply, id 58, seq 4, length 64
18:21:31.671332 IP 10.8.2.3 > 45.228.209.43: ICMP echo request, id 58, seq 5, length 64
18:21:32.031076 IP 45.228.209.43 > 10.8.2.3: ICMP echo reply, id 58, seq 5, length 64
18:21:32.671940 IP 10.8.2.3 > 45.228.209.43: ICMP echo request, id 58, seq 6, length 64
18:21:33.018311 IP 45.228.209.43 > 10.8.2.3: ICMP echo reply, id 58, seq 6, length 64
18:21:33.672189 IP 10.8.2.3 > 45.228.209.43: ICMP echo request, id 58, seq 7, length 64
18:21:34.018694 IP 45.228.209.43 > 10.8.2.3: ICMP echo reply, id 58, seq 7, length 64
18:21:34.672573 IP 10.8.2.3 > 45.228.209.43: ICMP echo request, id 58, seq 8, length 64
18:21:35.024697 IP 45.228.209.43 > 10.8.2.3: ICMP echo reply, id 58, seq 8, length 64
18:21:35.672569 IP 10.8.2.3 > 45.228.209.43: ICMP echo request, id 58, seq 9, length 64
18:21:36.019144 IP 45.228.209.43 > 10.8.2.3: ICMP echo reply, id 58, seq 9, length 64
18:21:36.673033 IP 10.8.2.3 > 45.228.209.43: ICMP echo request, id 58, seq 10, length 64
18:21:37.023730 IP 45.228.209.43 > 10.8.2.3: ICMP echo reply, id 58, seq 10, length 64
18:21:37.673616 IP 10.8.2.3 > 45.228.209.43: ICMP echo request, id 58, seq 11, length 64
18:21:38.020622 IP 45.228.209.43 > 10.8.2.3: ICMP echo reply, id 58, seq 11, length 64
18:21:38.673499 IP 10.8.2.3 > 45.228.209.43: ICMP echo request, id 58, seq 12, length 64
18:21:39.020399 IP 45.228.209.43 > 10.8.2.3: ICMP echo reply, id 58, seq 12, length 64
18:21:39.673278 IP 10.8.2.3 > 45.228.209.43: ICMP echo request, id 58, seq 13, length 64
18:21:40.020014 IP 45.228.209.43 > 10.8.2.3: ICMP echo reply, id 58, seq 13, length 64
18:21:40.673916 IP 10.8.2.3 > 45.228.209.43: ICMP echo request, id 58, seq 14, length 64
18:21:41.020475 IP 45.228.209.43 > 10.8.2.3: ICMP echo reply, id 58, seq 14, length 64
18:21:41.674352 IP 10.8.2.3 > 45.228.209.43: ICMP echo request, id 58, seq 15, length 64
18:21:42.020679 IP 45.228.209.43 > 10.8.2.3: ICMP echo reply, id 58, seq 15, length 64
18:21:42.674557 IP 10.8.2.3 > 45.228.209.43: ICMP echo request, id 58, seq 16, length 64
18:21:43.020849 IP 45.228.209.43 > 10.8.2.3: ICMP echo reply, id 58, seq 16, length 64
18:21:43.674755 IP 10.8.2.3 > 45.228.209.43: ICMP echo request, id 58, seq 17, length 64
18:21:44.021347 IP 45.228.209.43 > 10.8.2.3: ICMP echo reply, id 58, seq 17, length 64
18:21:44.675230 IP 10.8.2.3 > 45.228.209.43: ICMP echo request, id 58, seq 18, length 64
18:21:45.026351 IP 45.228.209.43 > 10.8.2.3: ICMP echo reply, id 58, seq 18, length 64
18:21:45.675234 IP 10.8.2.3 > 45.228.209.43: ICMP echo request, id 58, seq 19, length 64
18:21:46.021717 IP 45.228.209.43 > 10.8.2.3: ICMP echo reply, id 58, seq 19, length 64
18:21:46.675598 IP 10.8.2.3 > 45.228.209.43: ICMP echo request, id 58, seq 20, length 64
18:21:47.022151 IP 45.228.209.43 > 10.8.2.3: ICMP echo reply, id 58, seq 20, length 64
18:21:47.676025 IP 10.8.2.3 > 45.228.209.43: ICMP echo request, id 58, seq 21, length 64
18:21:48.035385 IP 45.228.209.43 > 10.8.2.3: ICMP echo reply, id 58, seq 21, length 64
18:21:48.676245 IP 10.8.2.3 > 45.228.209.43: ICMP echo request, id 58, seq 22, length 64
18:21:49.023431 IP 45.228.209.43 > 10.8.2.3: ICMP echo reply, id 58, seq 22, length 64
18:21:49.676307 IP 10.8.2.3 > 45.228.209.43: ICMP echo request, id 58, seq 23, length 64
18:21:50.022813 IP 45.228.209.43 > 10.8.2.3: ICMP echo reply, id 58, seq 23, length 64
18:21:50.676690 IP 10.8.2.3 > 45.228.209.43: ICMP echo request, id 58, seq 24, length 64
18:21:51.023056 IP 45.228.209.43 > 10.8.2.3: ICMP echo reply, id 58, seq 24, length 64
18:21:51.676932 IP 10.8.2.3 > 45.228.209.43: ICMP echo request, id 58, seq 25, length 64
18:21:52.023285 IP 45.228.209.43 > 10.8.2.3: ICMP echo reply, id 58, seq 25, length 64
18:21:52.677167 IP 10.8.2.3 > 45.228.209.43: ICMP echo request, id 58, seq 26, length 64
18:21:53.024256 IP 45.228.209.43 > 10.8.2.3: ICMP echo reply, id 58, seq 26, length 64
18:21:53.677128 IP 10.8.2.3 > 45.228.209.43: ICMP echo request, id 58, seq 27, length 64
18:21:54.023652 IP 45.228.209.43 > 10.8.2.3: ICMP echo reply, id 58, seq 27, length 64
18:21:54.677532 IP 10.8.2.3 > 45.228.209.43: ICMP echo request, id 58, seq 28, length 64
18:21:55.029905 IP 45.228.209.43 > 10.8.2.3: ICMP echo reply, id 58, seq 28, length 64
18:21:55.677759 IP 10.8.2.3 > 45.228.209.43: ICMP echo request, id 58, seq 29, length 64
18:21:56.024730 IP 45.228.209.43 > 10.8.2.3: ICMP echo reply, id 58, seq 29, length 64
18:21:56.677606 IP 10.8.2.3 > 45.228.209.43: ICMP echo request, id 58, seq 30, length 64
18:21:57.024555 IP 45.228.209.43 > 10.8.2.3: ICMP echo reply, id 58, seq 30, length 64
18:21:57.677450 IP 10.8.2.3 > 45.228.209.43: ICMP echo request, id 58, seq 31, length 64
18:21:58.023965 IP 45.228.209.43 > 10.8.2.3: ICMP echo reply, id 58, seq 31, length 64
18:21:58.677821 IP 10.8.2.3 > 45.228.209.43: ICMP echo request, id 58, seq 32, length 64
18:21:59.024671 IP 45.228.209.43 > 10.8.2.3: ICMP echo reply, id 58, seq 32, length 64
18:21:59.677549 IP 10.8.2.3 > 45.228.209.43: ICMP echo request, id 58, seq 33, length 64
18:22:00.023974 IP 45.228.209.43 > 10.8.2.3: ICMP echo reply, id 58, seq 33, length 64
18:22:00.677889 IP 10.8.2.3 > 45.228.209.43: ICMP echo request, id 58, seq 34, length 64
18:22:01.024222 IP 45.228.209.43 > 10.8.2.3: ICMP echo reply, id 58, seq 34, length 64
18:22:01.678102 IP 10.8.2.3 > 45.228.209.43: ICMP echo request, id 58, seq 35, length 64
18:22:02.024654 IP 45.228.209.43 > 10.8.2.3: ICMP echo reply, id 58, seq 35, length 64
18:22:02.678543 IP 10.8.2.3 > 45.228.209.43: ICMP echo request, id 58, seq 36, length 64
18:22:03.025041 IP 45.228.209.43 > 10.8.2.3: ICMP echo reply, id 58, seq 36, length 64
18:22:03.678934 IP 10.8.2.3 > 45.228.209.43: ICMP echo request, id 58, seq 37, length 64
18:22:04.025480 IP 45.228.209.43 > 10.8.2.3: ICMP echo reply, id 58, seq 37, length 64
18:22:04.679363 IP 10.8.2.3 > 45.228.209.43: ICMP echo request, id 58, seq 38, length 64
18:22:05.030862 IP 45.228.209.43 > 10.8.2.3: ICMP echo reply, id 58, seq 38, length 64
18:22:05.679714 IP 10.8.2.3 > 45.228.209.43: ICMP echo request, id 58, seq 39, length 64
18:22:06.026275 IP 45.228.209.43 > 10.8.2.3: ICMP echo reply, id 58, seq 39, length 64
18:22:06.680159 IP 10.8.2.3 > 45.228.209.43: ICMP echo request, id 58, seq 40, length 64
18:22:07.026583 IP 45.228.209.43 > 10.8.2.3: ICMP echo reply, id 58, seq 40, length 64
18:22:07.680465 IP 10.8.2.3 > 45.228.209.43: ICMP echo request, id 58, seq 41, length 64
18:22:08.026908 IP 45.228.209.43 > 10.8.2.3: ICMP echo reply, id 58, seq 41, length 64
18:22:08.680791 IP 10.8.2.3 > 45.228.209.43: ICMP echo request, id 58, seq 42, length 64
18:22:09.027572 IP 45.228.209.43 > 10.8.2.3: ICMP echo reply, id 58, seq 42, length 64
18:22:09.681457 IP 10.8.2.3 > 45.228.209.43: ICMP echo request, id 58, seq 43, length 64
18:22:10.028175 IP 45.228.209.43 > 10.8.2.3: ICMP echo reply, id 58, seq 43, length 64
18:22:10.682059 IP 10.8.2.3 > 45.228.209.43: ICMP echo request, id 58, seq 44, length 64
18:22:11.028409 IP 45.228.209.43 > 10.8.2.3: ICMP echo reply, id 58, seq 44, length 64
18:22:11.682302 IP 10.8.2.3 > 45.228.209.43: ICMP echo request, id 58, seq 45, length 64
18:22:12.028605 IP 45.228.209.43 > 10.8.2.3: ICMP echo reply, id 58, seq 45, length 64
18:22:12.682488 IP 10.8.2.3 > 45.228.209.43: ICMP echo request, id 58, seq 46, length 64
18:22:13.031056 IP 45.228.209.43 > 10.8.2.3: ICMP echo reply, id 58, seq 46, length 64
18:22:13.682946 IP 10.8.2.3 > 45.228.209.43: ICMP echo request, id 58, seq 47, length 64
18:22:14.029523 IP 45.228.209.43 > 10.8.2.3: ICMP echo reply, id 58, seq 47, length 64
18:22:14.683406 IP 10.8.2.3 > 45.228.209.43: ICMP echo request, id 58, seq 48, length 64
18:22:15.030090 IP 45.228.209.43 > 10.8.2.3: ICMP echo reply, id 58, seq 48, length 64
18:22:15.683972 IP 10.8.2.3 > 45.228.209.43: ICMP echo request, id 58, seq 49, length 64
18:22:16.030817 IP 45.228.209.43 > 10.8.2.3: ICMP echo reply, id 58, seq 49, length 64
18:22:16.683699 IP 10.8.2.3 > 45.228.209.43: ICMP echo request, id 58, seq 50, length 64
18:22:17.030298 IP 45.228.209.43 > 10.8.2.3: ICMP echo reply, id 58, seq 50, length 64
18:22:17.684193 IP 10.8.2.3 > 45.228.209.43: ICMP echo request, id 58, seq 51, length 64
18:22:18.030746 IP 45.228.209.43 > 10.8.2.3: ICMP echo reply, id 58, seq 51, length 64
18:22:18.684628 IP 10.8.2.3 > 45.228.209.43: ICMP echo request, id 58, seq 52, length 64
18:22:19.030996 IP 45.228.209.43 > 10.8.2.3: ICMP echo reply, id 58, seq 52, length 64
18:22:19.684876 IP 10.8.2.3 > 45.228.209.43: ICMP echo request, id 58, seq 53, length 64
18:22:20.031362 IP 45.228.209.43 > 10.8.2.3: ICMP echo reply, id 58, seq 53, length 64
18:22:20.685246 IP 10.8.2.3 > 45.228.209.43: ICMP echo request, id 58, seq 54, length 64
18:22:21.031574 IP 45.228.209.43 > 10.8.2.3: ICMP echo reply, id 58, seq 54, length 64
18:22:21.685457 IP 10.8.2.3 > 45.228.209.43: ICMP echo request, id 58, seq 55, length 64
18:22:22.032035 IP 45.228.209.43 > 10.8.2.3: ICMP echo reply, id 58, seq 55, length 64
18:22:22.685924 IP 10.8.2.3 > 45.228.209.43: ICMP echo request, id 58, seq 56, length 64
18:22:23.032215 IP 45.228.209.43 > 10.8.2.3: ICMP echo reply, id 58, seq 56, length 64
18:22:23.686097 IP 10.8.2.3 > 45.228.209.43: ICMP echo request, id 58, seq 57, length 64
18:22:24.033364 IP 45.228.209.43 > 10.8.2.3: ICMP echo reply, id 58, seq 57, length 64
18:22:24.686207 IP 10.8.2.3 > 45.228.209.43: ICMP echo request, id 58, seq 58, length 64
18:22:25.032652 IP 45.228.209.43 > 10.8.2.3: ICMP echo reply, id 58, seq 58, length 64
18:22:25.686500 IP 10.8.2.3 > 45.228.209.43: ICMP echo request, id 58, seq 59, length 64
18:22:26.054630 IP 45.228.209.43 > 10.8.2.3: ICMP echo reply, id 58, seq 59, length 64
18:22:26.686452 IP 10.8.2.3 > 45.228.209.43: ICMP echo request, id 58, seq 60, length 64
18:22:27.033255 IP 45.228.209.43 > 10.8.2.3: ICMP echo reply, id 58, seq 60, length 64
