23:03:45.444663 IP 31.171.152.19 > 10.8.0.75: ICMP echo reply, id 1117, seq 1, length 64
23:03:46.561694 IP 10.8.0.75 > 31.171.152.19: ICMP echo request, id 1117, seq 2, length 64
23:03:46.882389 IP 31.171.152.19 > 10.8.0.75: ICMP echo reply, id 1117, seq 2, length 64
23:03:47.563319 IP 10.8.0.75 > 31.171.152.19: ICMP echo request, id 1117, seq 3, length 64
23:03:47.883706 IP 31.171.152.19 > 10.8.0.75: ICMP echo reply, id 1117, seq 3, length 64
23:03:48.564619 IP 10.8.0.75 > 31.171.152.19: ICMP echo request, id 1117, seq 4, length 64
23:03:48.884881 IP 31.171.152.19 > 10.8.0.75: ICMP echo reply, id 1117, seq 4, length 64
23:03:49.565797 IP 10.8.0.75 > 31.171.152.19: ICMP echo request, id 1117, seq 5, length 64
23:03:49.885923 IP 31.171.152.19 > 10.8.0.75: ICMP echo reply, id 1117, seq 5, length 64
23:03:50.566836 IP 10.8.0.75 > 31.171.152.19: ICMP echo request, id 1117, seq 6, length 64
23:03:50.886749 IP 31.171.152.19 > 10.8.0.75: ICMP echo reply, id 1117, seq 6, length 64
23:03:51.567665 IP 10.8.0.75 > 31.171.152.19: ICMP echo request, id 1117, seq 7, length 64
23:03:51.887963 IP 31.171.152.19 > 10.8.0.75: ICMP echo reply, id 1117, seq 7, length 64
23:03:52.568915 IP 10.8.0.75 > 31.171.152.19: ICMP echo request, id 1117, seq 8, length 64
23:03:52.889181 IP 31.171.152.19 > 10.8.0.75: ICMP echo reply, id 1117, seq 8, length 64
23:03:53.570092 IP 10.8.0.75 > 31.171.152.19: ICMP echo request, id 1117, seq 9, length 64
23:03:53.890166 IP 31.171.152.19 > 10.8.0.75: ICMP echo reply, id 1117, seq 9, length 64
23:03:54.571084 IP 10.8.0.75 > 31.171.152.19: ICMP echo request, id 1117, seq 10, length 64
23:03:54.891210 IP 31.171.152.19 > 10.8.0.75: ICMP echo reply, id 1117, seq 10, length 64
23:03:55.572145 IP 10.8.0.75 > 31.171.152.19: ICMP echo request, id 1117, seq 11, length 64
23:03:55.892263 IP 31.171.152.19 > 10.8.0.75: ICMP echo reply, id 1117, seq 11, length 64
23:03:56.573176 IP 10.8.0.75 > 31.171.152.19: ICMP echo request, id 1117, seq 12, length 64
23:03:57.596206 IP 10.8.0.75 > 31.171.152.19: ICMP echo request, id 1117, seq 13, length 64
23:03:58.620247 IP 10.8.0.75 > 31.171.152.19: ICMP echo request, id 1117, seq 14, length 64
23:03:58.636739 IP 31.171.152.19 > 10.8.0.75: ICMP echo reply, id 1117, seq 12, length 64
23:03:58.644926 IP 31.171.152.19 > 10.8.0.75: ICMP echo reply, id 1117, seq 13, length 64
23:03:58.940328 IP 31.171.152.19 > 10.8.0.75: ICMP echo reply, id 1117, seq 14, length 64
23:03:59.621257 IP 10.8.0.75 > 31.171.152.19: ICMP echo request, id 1117, seq 15, length 64
23:03:59.941361 IP 31.171.152.19 > 10.8.0.75: ICMP echo reply, id 1117, seq 15, length 64
23:04:00.622278 IP 10.8.0.75 > 31.171.152.19: ICMP echo request, id 1117, seq 16, length 64
23:04:00.942362 IP 31.171.152.19 > 10.8.0.75: ICMP echo reply, id 1117, seq 16, length 64
23:04:01.623280 IP 10.8.0.75 > 31.171.152.19: ICMP echo request, id 1117, seq 17, length 64
23:04:01.943626 IP 31.171.152.19 > 10.8.0.75: ICMP echo reply, id 1117, seq 17, length 64
23:04:02.624192 IP 10.8.0.75 > 31.171.152.19: ICMP echo request, id 1117, seq 18, length 64
23:04:02.944207 IP 31.171.152.19 > 10.8.0.75: ICMP echo reply, id 1117, seq 18, length 64
23:04:03.625121 IP 10.8.0.75 > 31.171.152.19: ICMP echo request, id 1117, seq 19, length 64
23:04:03.945267 IP 31.171.152.19 > 10.8.0.75: ICMP echo reply, id 1117, seq 19, length 64
23:04:04.626194 IP 10.8.0.75 > 31.171.152.19: ICMP echo request, id 1117, seq 20, length 64
23:04:04.946805 IP 31.171.152.19 > 10.8.0.75: ICMP echo reply, id 1117, seq 20, length 64
23:04:05.627712 IP 10.8.0.75 > 31.171.152.19: ICMP echo request, id 1117, seq 21, length 64
23:04:05.948157 IP 31.171.152.19 > 10.8.0.75: ICMP echo reply, id 1117, seq 21, length 64
23:04:06.629078 IP 10.8.0.75 > 31.171.152.19: ICMP echo request, id 1117, seq 22, length 64
23:04:06.949288 IP 31.171.152.19 > 10.8.0.75: ICMP echo reply, id 1117, seq 22, length 64
23:04:07.630208 IP 10.8.0.75 > 31.171.152.19: ICMP echo request, id 1117, seq 23, length 64
23:04:07.950318 IP 31.171.152.19 > 10.8.0.75: ICMP echo reply, id 1117, seq 23, length 64
23:04:08.631242 IP 10.8.0.75 > 31.171.152.19: ICMP echo request, id 1117, seq 24, length 64
23:04:08.951741 IP 31.171.152.19 > 10.8.0.75: ICMP echo reply, id 1117, seq 24, length 64
23:04:09.632664 IP 10.8.0.75 > 31.171.152.19: ICMP echo request, id 1117, seq 25, length 64
23:04:09.952749 IP 31.171.152.19 > 10.8.0.75: ICMP echo reply, id 1117, seq 25, length 64
23:04:10.633681 IP 10.8.0.75 > 31.171.152.19: ICMP echo request, id 1117, seq 26, length 64
23:04:10.953794 IP 31.171.152.19 > 10.8.0.75: ICMP echo reply, id 1117, seq 26, length 64
23:04:11.634714 IP 10.8.0.75 > 31.171.152.19: ICMP echo request, id 1117, seq 27, length 64
23:04:11.954758 IP 31.171.152.19 > 10.8.0.75: ICMP echo reply, id 1117, seq 27, length 64
23:04:12.635675 IP 10.8.0.75 > 31.171.152.19: ICMP echo request, id 1117, seq 28, length 64
23:04:12.955862 IP 31.171.152.19 > 10.8.0.75: ICMP echo reply, id 1117, seq 28, length 64
23:04:13.636784 IP 10.8.0.75 > 31.171.152.19: ICMP echo request, id 1117, seq 29, length 64
23:04:14.652198 IP 10.8.0.75 > 31.171.152.19: ICMP echo request, id 1117, seq 30, length 64
23:04:15.129696 IP 31.171.152.19 > 10.8.0.75: ICMP echo reply, id 1117, seq 29, length 64
23:04:15.652389 IP 10.8.0.75 > 31.171.152.19: ICMP echo request, id 1117, seq 31, length 64
23:04:15.972320 IP 31.171.152.19 > 10.8.0.75: ICMP echo reply, id 1117, seq 31, length 64
23:04:16.653238 IP 10.8.0.75 > 31.171.152.19: ICMP echo request, id 1117, seq 32, length 64
23:04:16.973508 IP 31.171.152.19 > 10.8.0.75: ICMP echo reply, id 1117, seq 32, length 64
23:04:17.654420 IP 10.8.0.75 > 31.171.152.19: ICMP echo request, id 1117, seq 33, length 64
23:04:17.974870 IP 31.171.152.19 > 10.8.0.75: ICMP echo reply, id 1117, seq 33, length 64
23:04:18.655782 IP 10.8.0.75 > 31.171.152.19: ICMP echo request, id 1117, seq 34, length 64
23:04:18.975948 IP 31.171.152.19 > 10.8.0.75: ICMP echo reply, id 1117, seq 34, length 64
23:04:19.656861 IP 10.8.0.75 > 31.171.152.19: ICMP echo request, id 1117, seq 35, length 64
23:04:19.976940 IP 31.171.152.19 > 10.8.0.75: ICMP echo reply, id 1117, seq 35, length 64
23:04:20.657853 IP 10.8.0.75 > 31.171.152.19: ICMP echo request, id 1117, seq 36, length 64
23:04:20.978417 IP 31.171.152.19 > 10.8.0.75: ICMP echo reply, id 1117, seq 36, length 64
23:04:21.659332 IP 10.8.0.75 > 31.171.152.19: ICMP echo request, id 1117, seq 37, length 64
23:04:21.979416 IP 31.171.152.19 > 10.8.0.75: ICMP echo reply, id 1117, seq 37, length 64
23:04:22.660404 IP 10.8.0.75 > 31.171.152.19: ICMP echo request, id 1117, seq 38, length 64
23:04:22.980655 IP 31.171.152.19 > 10.8.0.75: ICMP echo reply, id 1117, seq 38, length 64
23:04:23.661567 IP 10.8.0.75 > 31.171.152.19: ICMP echo request, id 1117, seq 39, length 64
23:04:23.981864 IP 31.171.152.19 > 10.8.0.75: ICMP echo reply, id 1117, seq 39, length 64
23:04:24.662795 IP 10.8.0.75 > 31.171.152.19: ICMP echo request, id 1117, seq 40, length 64
23:04:24.983487 IP 31.171.152.19 > 10.8.0.75: ICMP echo reply, id 1117, seq 40, length 64
23:04:25.664362 IP 10.8.0.75 > 31.171.152.19: ICMP echo request, id 1117, seq 41, length 64
23:04:25.984737 IP 31.171.152.19 > 10.8.0.75: ICMP echo reply, id 1117, seq 41, length 64
23:04:26.665648 IP 10.8.0.75 > 31.171.152.19: ICMP echo request, id 1117, seq 42, length 64
23:04:26.986108 IP 31.171.152.19 > 10.8.0.75: ICMP echo reply, id 1117, seq 42, length 64
23:04:27.667033 IP 10.8.0.75 > 31.171.152.19: ICMP echo request, id 1117, seq 43, length 64
23:04:27.987288 IP 31.171.152.19 > 10.8.0.75: ICMP echo reply, id 1117, seq 43, length 64
23:04:28.668153 IP 10.8.0.75 > 31.171.152.19: ICMP echo request, id 1117, seq 44, length 64
23:04:28.988333 IP 31.171.152.19 > 10.8.0.75: ICMP echo reply, id 1117, seq 44, length 64
23:04:29.669168 IP 10.8.0.75 > 31.171.152.19: ICMP echo request, id 1117, seq 45, length 64
23:04:30.684226 IP 10.8.0.75 > 31.171.152.19: ICMP echo request, id 1117, seq 46, length 64
23:04:31.708219 IP 10.8.0.75 > 31.171.152.19: ICMP echo request, id 1117, seq 47, length 64
23:04:31.968866 IP 31.171.152.19 > 10.8.0.75: ICMP echo reply, id 1117, seq 45, length 64
23:04:32.078857 IP 31.171.152.19 > 10.8.0.75: ICMP echo reply, id 1117, seq 46, length 64
23:04:32.088608 IP 31.171.152.19 > 10.8.0.75: ICMP echo reply, id 1117, seq 47, length 64
23:04:32.708151 IP 10.8.0.75 > 31.171.152.19: ICMP echo request, id 1117, seq 48, length 64
23:04:33.028452 IP 31.171.152.19 > 10.8.0.75: ICMP echo reply, id 1117, seq 48, length 64
23:04:33.708188 IP 10.8.0.75 > 31.171.152.19: ICMP echo request, id 1117, seq 49, length 64
23:04:34.028204 IP 31.171.152.19 > 10.8.0.75: ICMP echo reply, id 1117, seq 49, length 64
23:04:34.708145 IP 10.8.0.75 > 31.171.152.19: ICMP echo request, id 1117, seq 50, length 64
23:04:35.028379 IP 31.171.152.19 > 10.8.0.75: ICMP echo reply, id 1117, seq 50, length 64
23:04:35.708202 IP 10.8.0.75 > 31.171.152.19: ICMP echo request, id 1117, seq 51, length 64
23:04:36.028285 IP 31.171.152.19 > 10.8.0.75: ICMP echo reply, id 1117, seq 51, length 64
23:04:36.708217 IP 10.8.0.75 > 31.171.152.19: ICMP echo request, id 1117, seq 52, length 64
23:04:37.028498 IP 31.171.152.19 > 10.8.0.75: ICMP echo reply, id 1117, seq 52, length 64
23:04:37.708419 IP 10.8.0.75 > 31.171.152.19: ICMP echo request, id 1117, seq 53, length 64
23:04:38.028767 IP 31.171.152.19 > 10.8.0.75: ICMP echo reply, id 1117, seq 53, length 64
23:04:38.708686 IP 10.8.0.75 > 31.171.152.19: ICMP echo request, id 1117, seq 54, length 64
23:04:39.028774 IP 31.171.152.19 > 10.8.0.75: ICMP echo reply, id 1117, seq 54, length 64
23:04:39.708690 IP 10.8.0.75 > 31.171.152.19: ICMP echo request, id 1117, seq 55, length 64
23:04:40.028593 IP 31.171.152.19 > 10.8.0.75: ICMP echo reply, id 1117, seq 55, length 64
23:04:40.708531 IP 10.8.0.75 > 31.171.152.19: ICMP echo request, id 1117, seq 56, length 64
23:04:41.028623 IP 31.171.152.19 > 10.8.0.75: ICMP echo reply, id 1117, seq 56, length 64
23:04:41.708542 IP 10.8.0.75 > 31.171.152.19: ICMP echo request, id 1117, seq 57, length 64
23:04:42.029657 IP 31.171.152.19 > 10.8.0.75: ICMP echo reply, id 1117, seq 57, length 64
23:04:42.708578 IP 10.8.0.75 > 31.171.152.19: ICMP echo request, id 1117, seq 58, length 64
23:04:43.028645 IP 31.171.152.19 > 10.8.0.75: ICMP echo reply, id 1117, seq 58, length 64
23:04:43.708565 IP 10.8.0.75 > 31.171.152.19: ICMP echo request, id 1117, seq 59, length 64
23:04:44.028495 IP 31.171.152.19 > 10.8.0.75: ICMP echo reply, id 1117, seq 59, length 64
23:04:44.708417 IP 10.8.0.75 > 31.171.152.19: ICMP echo request, id 1117, seq 60, length 64
