15:03:04.165208 IP 52.223.226.170.1935 > 10.8.1.3.33966: Flags [.], ack 4090391078, win 126, options [nop,nop,TS val 2306402205 ecr 1124537278], length 0
15:03:04.166893 IP 10.8.1.3.33966 > 52.223.226.170.1935: Flags [.], seq 9614:10928, ack 0, win 501, options [nop,nop,TS val 1124537712 ecr 2306402205], length 1314
15:03:04.193932 IP 10.8.1.3.33966 > 52.223.226.170.1935: Flags [.], seq 10928:12242, ack 0, win 501, options [nop,nop,TS val 1124537739 ecr 2306402205], length 1314
15:03:04.231536 IP 52.223.226.170.1935 > 10.8.1.3.33966: Flags [.], ack 2629, win 126, options [nop,nop,TS val 2306402272 ecr 1124537375], length 0
15:03:04.233139 IP 10.8.1.3.33966 > 52.223.226.170.1935: Flags [.], seq 12242:13556, ack 0, win 501, options [nop,nop,TS val 1124537778 ecr 2306402272], length 1314
15:03:04.300091 IP 10.8.1.3.33966 > 52.223.226.170.1935: Flags [.], seq 13556:14870, ack 0, win 501, options [nop,nop,TS val 1124537845 ecr 2306402272], length 1314
15:03:04.322912 IP 52.223.226.170.1935 > 10.8.1.3.33966: Flags [.], ack 5257, win 126, options [nop,nop,TS val 2306402363 ecr 1124537477], length 0
15:03:04.330511 IP 10.8.1.3.33966 > 52.223.226.170.1935: Flags [.], seq 14870:16184, ack 0, win 501, options [nop,nop,TS val 1124537875 ecr 2306402363], length 1314
15:03:04.343049 IP 52.223.226.170.1935 > 10.8.1.3.33966: Flags [.], ack 5672, win 126, options [nop,nop,TS val 2306402383 ecr 1124537523], length 0
15:03:04.343065 IP 10.8.1.3.33966 > 52.223.226.170.1935: Flags [P.], seq 16184:16610, ack 0, win 501, options [nop,nop,TS val 1124537888 ecr 2306402383], length 426
15:03:04.400156 IP 10.8.1.3.33966 > 52.223.226.170.1935: Flags [.], seq 16610:17924, ack 0, win 501, options [nop,nop,TS val 1124537945 ecr 2306402383], length 1314
15:03:04.429132 IP 52.223.226.170.1935 > 10.8.1.3.33966: Flags [.], ack 8300, win 126, options [nop,nop,TS val 2306402469 ecr 1124537578], length 0
15:03:04.429354 IP 10.8.1.3.33966 > 52.223.226.170.1935: Flags [.], seq 17924:19238, ack 0, win 501, options [nop,nop,TS val 1124537974 ecr 2306402469], length 1314
15:03:04.464056 IP 10.8.1.3.33966 > 52.223.226.170.1935: Flags [.], seq 19238:20552, ack 0, win 501, options [nop,nop,TS val 1124538009 ecr 2306402469], length 1314
15:03:04.531530 IP 52.223.226.170.1935 > 10.8.1.3.33966: Flags [.], ack 10928, win 126, options [nop,nop,TS val 2306402571 ecr 1124537644], length 0
15:03:04.533561 IP 10.8.1.3.33966 > 52.223.226.170.1935: Flags [.], seq 20552:21866, ack 0, win 501, options [nop,nop,TS val 1124538078 ecr 2306402571], length 1314
15:03:04.566852 IP 10.8.1.3.33966 > 52.223.226.170.1935: Flags [.], seq 21866:23180, ack 0, win 501, options [nop,nop,TS val 1124538112 ecr 2306402571], length 1314
15:03:04.597396 IP 10.8.1.3.33966 > 52.223.226.170.1935: Flags [.], seq 23180:24494, ack 0, win 501, options [nop,nop,TS val 1124538142 ecr 2306402571], length 1314
15:03:04.597752 IP 52.223.226.170.1935 > 10.8.1.3.33966: Flags [.], ack 13556, win 126, options [nop,nop,TS val 2306402638 ecr 1124537739], length 0
15:03:04.664218 IP 10.8.1.3.33966 > 52.223.226.170.1935: Flags [.], seq 24494:25808, ack 0, win 501, options [nop,nop,TS val 1124538209 ecr 2306402638], length 1314
15:03:04.695268 IP 52.223.226.170.1935 > 10.8.1.3.33966: Flags [.], ack 16184, win 126, options [nop,nop,TS val 2306402735 ecr 1124537845], length 0
15:03:04.696406 IP 10.8.1.3.33966 > 52.223.226.170.1935: Flags [.], seq 25808:27122, ack 0, win 501, options [nop,nop,TS val 1124538241 ecr 2306402735], length 1314
15:03:04.707278 IP 52.223.226.170.1935 > 10.8.1.3.33966: Flags [.], ack 16610, win 126, options [nop,nop,TS val 2306402747 ecr 1124537888], length 0
15:03:04.707289 IP 10.8.1.3.33966 > 52.223.226.170.1935: Flags [P.], seq 27122:27634, ack 0, win 501, options [nop,nop,TS val 1124538252 ecr 2306402747], length 512
15:03:04.763212 IP 10.8.1.3.33966 > 52.223.226.170.1935: Flags [.], seq 27634:28948, ack 0, win 501, options [nop,nop,TS val 1124538308 ecr 2306402747], length 1314
15:03:04.795453 IP 52.223.226.170.1935 > 10.8.1.3.33966: Flags [.], ack 19238, win 126, options [nop,nop,TS val 2306402835 ecr 1124537945], length 0
15:03:04.799189 IP 10.8.1.3.33966 > 52.223.226.170.1935: Flags [.], seq 28948:30262, ack 0, win 501, options [nop,nop,TS val 1124538344 ecr 2306402835], length 1314
15:03:04.833731 IP 10.8.1.3.33966 > 52.223.226.170.1935: Flags [.], seq 30262:31576, ack 0, win 501, options [nop,nop,TS val 1124538378 ecr 2306402835], length 1314
15:03:04.897444 IP 10.8.1.3.33966 > 52.223.226.170.1935: Flags [.], seq 31576:32890, ack 0, win 501, options [nop,nop,TS val 1124538442 ecr 2306402835], length 1314
15:03:04.898023 IP 52.223.226.170.1935 > 10.8.1.3.33966: Flags [.], ack 21866, win 126, options [nop,nop,TS val 2306402938 ecr 1124538009], length 0
15:03:04.929887 IP 10.8.1.3.33966 > 52.223.226.170.1935: Flags [.], seq 32890:34204, ack 0, win 501, options [nop,nop,TS val 1124538475 ecr 2306402938], length 1314
15:03:04.962133 IP 52.223.226.170.1935 > 10.8.1.3.33966: Flags [.], ack 24494, win 126, options [nop,nop,TS val 2306403002 ecr 1124538112], length 0
15:03:04.967068 IP 10.8.1.3.33966 > 52.223.226.170.1935: Flags [.], seq 34204:35518, ack 0, win 501, options [nop,nop,TS val 1124538512 ecr 2306403002], length 1314
15:03:05.025852 IP 10.8.1.3.33966 > 52.223.226.170.1935: Flags [.], seq 35518:36832, ack 0, win 501, options [nop,nop,TS val 1124538571 ecr 2306403002], length 1314
15:03:05.060946 IP 52.223.226.170.1935 > 10.8.1.3.33966: Flags [.], ack 27122, win 126, options [nop,nop,TS val 2306403101 ecr 1124538209], length 0
15:03:05.063987 IP 10.8.1.3.33966 > 52.223.226.170.1935: Flags [.], seq 36832:38146, ack 0, win 501, options [nop,nop,TS val 1124538609 ecr 2306403101], length 1314
15:03:05.071659 IP 52.223.226.170.1935 > 10.8.1.3.33966: Flags [.], ack 27634, win 126, options [nop,nop,TS val 2306403112 ecr 1124538252], length 0
15:03:05.071671 IP 10.8.1.3.33966 > 52.223.226.170.1935: Flags [P.], seq 38146:38571, ack 0, win 501, options [nop,nop,TS val 1124538616 ecr 2306403112], length 425
15:03:05.129636 IP 10.8.1.3.33966 > 52.223.226.170.1935: Flags [.], seq 38571:39885, ack 0, win 501, options [nop,nop,TS val 1124538674 ecr 2306403112], length 1314
15:03:05.163581 IP 52.223.226.170.1935 > 10.8.1.3.33966: Flags [.], ack 30262, win 126, options [nop,nop,TS val 2306403204 ecr 1124538308], length 0
15:03:05.166451 IP 10.8.1.3.33966 > 52.223.226.170.1935: Flags [.], seq 39885:41199, ack 0, win 501, options [nop,nop,TS val 1124538711 ecr 2306403204], length 1314
15:03:05.200569 IP 10.8.1.3.33966 > 52.223.226.170.1935: Flags [.], seq 41199:42513, ack 0, win 501, options [nop,nop,TS val 1124538745 ecr 2306403204], length 1314
15:03:05.259998 IP 10.8.1.3.33966 > 52.223.226.170.1935: Flags [.], seq 42513:43827, ack 0, win 501, options [nop,nop,TS val 1124538805 ecr 2306403204], length 1314
15:03:05.262004 IP 52.223.226.170.1935 > 10.8.1.3.33966: Flags [.], ack 32890, win 126, options [nop,nop,TS val 2306403302 ecr 1124538378], length 0
15:03:05.299476 IP 10.8.1.3.33966 > 52.223.226.170.1935: Flags [.], seq 43827:45141, ack 0, win 501, options [nop,nop,TS val 1124538844 ecr 2306403302], length 1314
15:03:05.331523 IP 52.223.226.170.1935 > 10.8.1.3.33966: Flags [.], ack 35518, win 126, options [nop,nop,TS val 2306403372 ecr 1124538475], length 0
15:03:05.333800 IP 10.8.1.3.33966 > 52.223.226.170.1935: Flags [.], seq 45141:46455, ack 0, win 501, options [nop,nop,TS val 1124538878 ecr 2306403372], length 1314
15:03:05.398416 IP 10.8.1.3.33966 > 52.223.226.170.1935: Flags [.], seq 46455:47769, ack 0, win 501, options [nop,nop,TS val 1124538943 ecr 2306403372], length 1314
15:03:05.428483 IP 52.223.226.170.1935 > 10.8.1.3.33966: Flags [.], ack 38146, win 126, options [nop,nop,TS val 2306403468 ecr 1124538571], length 0
15:03:05.431241 IP 10.8.1.3.33966 > 52.223.226.170.1935: Flags [.], seq 47769:49083, ack 0, win 501, options [nop,nop,TS val 1124538976 ecr 2306403468], length 1314
15:03:05.435886 IP 52.223.226.170.1935 > 10.8.1.3.33966: Flags [.], ack 38571, win 126, options [nop,nop,TS val 2306403476 ecr 1124538616], length 0
15:03:05.435911 IP 10.8.1.3.33966 > 52.223.226.170.1935: Flags [P.], seq 49083:49505, ack 0, win 501, options [nop,nop,TS val 1124538981 ecr 2306403476], length 422
15:03:05.495099 IP 10.8.1.3.33966 > 52.223.226.170.1935: Flags [.], seq 49505:50819, ack 0, win 501, options [nop,nop,TS val 1124539040 ecr 2306403476], length 1314
15:03:05.531105 IP 52.223.226.170.1935 > 10.8.1.3.33966: Flags [.], ack 41199, win 126, options [nop,nop,TS val 2306403571 ecr 1124538674], length 0
15:03:05.531127 IP 10.8.1.3.33966 > 52.223.226.170.1935: Flags [.], seq 50819:52133, ack 0, win 501, options [nop,nop,TS val 1124539076 ecr 2306403476], length 1314
15:03:05.564781 IP 10.8.1.3.33966 > 52.223.226.170.1935: Flags [.], seq 52133:53447, ack 0, win 501, options [nop,nop,TS val 1124539109 ecr 2306403571], length 1314
15:03:05.624718 IP 52.223.226.170.1935 > 10.8.1.3.33966: Flags [.], ack 43827, win 126, options [nop,nop,TS val 2306403665 ecr 1124538745], length 0
15:03:05.630997 IP 10.8.1.3.33966 > 52.223.226.170.1935: Flags [.], seq 53447:54761, ack 0, win 501, options [nop,nop,TS val 1124539176 ecr 2306403665], length 1314
15:03:05.664947 IP 10.8.1.3.33966 > 52.223.226.170.1935: Flags [.], seq 54761:56075, ack 0, win 501, options [nop,nop,TS val 1124539210 ecr 2306403665], length 1314
15:03:05.698380 IP 52.223.226.170.1935 > 10.8.1.3.33966: Flags [.], ack 46455, win 126, options [nop,nop,TS val 2306403738 ecr 1124538844], length 0
15:03:05.699493 IP 10.8.1.3.33966 > 52.223.226.170.1935: Flags [.], seq 56075:57389, ack 0, win 501, options [nop,nop,TS val 1124539244 ecr 2306403738], length 1314
15:03:05.764477 IP 10.8.1.3.33966 > 52.223.226.170.1935: Flags [.], seq 57389:58703, ack 0, win 501, options [nop,nop,TS val 1124539309 ecr 2306403738], length 1314
15:03:05.792616 IP 10.8.1.3.33966 > 52.223.226.170.1935: Flags [.], seq 58703:60017, ack 0, win 501, options [nop,nop,TS val 1124539337 ecr 2306403738], length 1314
15:03:05.795940 IP 52.223.226.170.1935 > 10.8.1.3.33966: Flags [.], ack 49083, win 126, options [nop,nop,TS val 2306403836 ecr 1124538943], length 0
15:03:05.800375 IP 52.223.226.170.1935 > 10.8.1.3.33966: Flags [.], ack 49505, win 126, options [nop,nop,TS val 2306403840 ecr 1124538981], length 0
15:03:05.800405 IP 10.8.1.3.33966 > 52.223.226.170.1935: Flags [P.], seq 60017:60435, ack 0, win 501, options [nop,nop,TS val 1124539345 ecr 2306403840], length 418
15:03:05.867906 IP 10.8.1.3.33966 > 52.223.226.170.1935: Flags [.], seq 60435:61749, ack 0, win 501, options [nop,nop,TS val 1124539413 ecr 2306403840], length 1314
15:03:05.895545 IP 52.223.226.170.1935 > 10.8.1.3.33966: Flags [.], ack 52133, win 126, options [nop,nop,TS val 2306403936 ecr 1124539040], length 0
15:03:05.900034 IP 10.8.1.3.33966 > 52.223.226.170.1935: Flags [.], seq 61749:63063, ack 0, win 501, options [nop,nop,TS val 1124539445 ecr 2306403936], length 1314
15:03:05.932197 IP 10.8.1.3.33966 > 52.223.226.170.1935: Flags [.], seq 63063:64377, ack 0, win 501, options [nop,nop,TS val 1124539477 ecr 2306403936], length 1314
15:03:05.995045 IP 52.223.226.170.1935 > 10.8.1.3.33966: Flags [.], ack 53447, win 126, options [nop,nop,TS val 2306404035 ecr 1124539109], length 0
15:03:06.000203 IP 10.8.1.3.33966 > 52.223.226.170.1935: Flags [.], seq 64377:65691, ack 0, win 501, options [nop,nop,TS val 1124539545 ecr 2306404035], length 1314
15:03:06.028335 IP 10.8.1.3.33966 > 52.223.226.170.1935: Flags [.], seq 65691:67005, ack 0, win 501, options [nop,nop,TS val 1124539573 ecr 2306404035], length 1314
15:03:06.029741 IP 52.223.226.170.1935 > 10.8.1.3.33966: Flags [.], ack 56075, win 126, options [nop,nop,TS val 2306404070 ecr 1124539176], length 0
15:03:06.067682 IP 10.8.1.3.33966 > 52.223.226.170.1935: Flags [.], seq 67005:68319, ack 0, win 501, options [nop,nop,TS val 1124539612 ecr 2306404070], length 1314
15:03:06.129160 IP 52.223.226.170.1935 > 10.8.1.3.33966: Flags [.], ack 58703, win 126, options [nop,nop,TS val 2306404169 ecr 1124539244], length 0
15:03:06.131246 IP 10.8.1.3.33966 > 52.223.226.170.1935: Flags [.], seq 68319:69633, ack 0, win 501, options [nop,nop,TS val 1124539676 ecr 2306404169], length 1314
15:03:06.162868 IP 10.8.1.3.33966 > 52.223.226.170.1935: Flags [.], seq 69633:70947, ack 0, win 501, options [nop,nop,TS val 1124539708 ecr 2306404169], length 1314
15:03:06.164888 IP 52.223.226.170.1935 > 10.8.1.3.33966: Flags [.], ack 60435, win 126, options [nop,nop,TS val 2306404205 ecr 1124539337], length 0
15:03:06.164897 IP 10.8.1.3.33966 > 52.223.226.170.1935: Flags [P.], seq 70947:71372, ack 0, win 501, options [nop,nop,TS val 1124539710 ecr 2306404205], length 425
15:03:06.233445 IP 10.8.1.3.33966 > 52.223.226.170.1935: Flags [.], seq 71372:72686, ack 0, win 501, options [nop,nop,TS val 1124539778 ecr 2306404205], length 1314
15:03:06.263468 IP 10.8.1.3.33966 > 52.223.226.170.1935: Flags [.], seq 72686:74000, ack 0, win 501, options [nop,nop,TS val 1124539808 ecr 2306404205], length 1314
15:03:06.264570 IP 52.223.226.170.1935 > 10.8.1.3.33966: Flags [.], ack 63063, win 126, options [nop,nop,TS val 2306404305 ecr 1124539413], length 0
15:03:06.300474 IP 10.8.1.3.33966 > 52.223.226.170.1935: Flags [.], seq 74000:75314, ack 0, win 501, options [nop,nop,TS val 1124539845 ecr 2306404305], length 1314
15:03:06.365525 IP 10.8.1.3.33966 > 52.223.226.170.1935: Flags [.], seq 75314:76628, ack 0, win 501, options [nop,nop,TS val 1124539910 ecr 2306404305], length 1314
15:03:06.383358 IP 52.223.226.170.1935 > 10.8.1.3.33966: Flags [.], ack 64377, win 126, options [nop,nop,TS val 2306404403 ecr 1124539477], length 0
15:03:06.395842 IP 52.223.226.170.1935 > 10.8.1.3.33966: Flags [.], ack 67005, win 126, options [nop,nop,TS val 2306404433 ecr 1124539545], length 0
15:03:06.399741 IP 10.8.1.3.33966 > 52.223.226.170.1935: Flags [.], seq 76628:77942, ack 0, win 501, options [nop,nop,TS val 1124539944 ecr 2306404433], length 1314
15:03:06.433260 IP 10.8.1.3.33966 > 52.223.226.170.1935: Flags [.], seq 77942:79256, ack 0, win 501, options [nop,nop,TS val 1124539978 ecr 2306404433], length 1314
15:03:06.498453 IP 10.8.1.3.33966 > 52.223.226.170.1935: Flags [.], seq 79256:80570, ack 0, win 501, options [nop,nop,TS val 1124540043 ecr 2306404433], length 1314
15:03:06.498588 IP 52.223.226.170.1935 > 10.8.1.3.33966: Flags [.], ack 69633, win 126, options [nop,nop,TS val 2306404536 ecr 1124539612], length 0
15:03:06.529260 IP 52.223.226.170.1935 > 10.8.1.3.33966: Flags [.], ack 71372, win 126, options [nop,nop,TS val 2306404569 ecr 1124539708], length 0
15:03:06.529299 IP 10.8.1.3.33966 > 52.223.226.170.1935: Flags [P.], seq 80570:81454, ack 0, win 501, options [nop,nop,TS val 1124540074 ecr 2306404569], length 884
15:03:06.562980 IP 10.8.1.3.33966 > 52.223.226.170.1935: Flags [.], seq 81454:82768, ack 0, win 501, options [nop,nop,TS val 1124540108 ecr 2306404569], length 1314
15:03:06.598100 IP 10.8.1.3.33966 > 52.223.226.170.1935: Flags [.], seq 82768:84082, ack 0, win 501, options [nop,nop,TS val 1124540143 ecr 2306404569], length 1314
15:03:06.628620 IP 52.223.226.170.1935 > 10.8.1.3.33966: Flags [.], ack 74000, win 126, options [nop,nop,TS val 2306404668 ecr 1124539778], length 0
15:03:06.648358 IP 10.8.1.3.33966 > 52.223.226.170.1935: Flags [.], seq 84082:85396, ack 0, win 501, options [nop,nop,TS val 1124540193 ecr 2306404668], length 1314
15:03:06.696383 IP 10.8.1.3.33966 > 52.223.226.170.1935: Flags [.], seq 85396:86710, ack 0, win 501, options [nop,nop,TS val 1124540241 ecr 2306404668], length 1314
15:03:06.730990 IP 52.223.226.170.1935 > 10.8.1.3.33966: Flags [.], ack 75314, win 126, options [nop,nop,TS val 2306404771 ecr 1124539845], length 0
15:03:06.731780 IP 10.8.1.3.33966 > 52.223.226.170.1935: Flags [.], seq 86710:88024, ack 0, win 501, options [nop,nop,TS val 1124540276 ecr 2306404771], length 1314
15:03:06.764585 IP 52.223.226.170.1935 > 10.8.1.3.33966: Flags [.], ack 77942, win 126, options [nop,nop,TS val 2306404804 ecr 1124539910], length 0
15:03:06.776516 IP 10.8.1.3.33966 > 52.223.226.170.1935: Flags [.], seq 88024:89338, ack 0, win 501, options [nop,nop,TS val 1124540321 ecr 2306404804], length 1314
15:03:06.833722 IP 10.8.1.3.33966 > 52.223.226.170.1935: Flags [.], seq 89338:90652, ack 0, win 501, options [nop,nop,TS val 1124540378 ecr 2306404804], length 1314
15:03:06.862550 IP 10.8.1.3.33966 > 52.223.226.170.1935: Flags [.], seq 90652:91966, ack 0, win 501, options [nop,nop,TS val 1124540407 ecr 2306404804], length 1314
15:03:06.863775 IP 52.223.226.170.1935 > 10.8.1.3.33966: Flags [.], ack 80570, win 126, options [nop,nop,TS val 2306404904 ecr 1124539978], length 0
15:03:06.893783 IP 52.223.226.170.1935 > 10.8.1.3.33966: Flags [.], ack 81454, win 126, options [nop,nop,TS val 2306404934 ecr 1124540074], length 0
15:03:06.893808 IP 10.8.1.3.33966 > 52.223.226.170.1935: Flags [P.], seq 91966:92396, ack 0, win 501, options [nop,nop,TS val 1124540439 ecr 2306404934], length 430
15:03:06.932044 IP 10.8.1.3.33966 > 52.223.226.170.1935: Flags [.], seq 92396:93710, ack 0, win 501, options [nop,nop,TS val 1124540477 ecr 2306404934], length 1314
15:03:06.962864 IP 52.223.226.170.1935 > 10.8.1.3.33966: Flags [.], ack 84082, win 126, options [nop,nop,TS val 2306405003 ecr 1124540108], length 0
15:03:06.966711 IP 10.8.1.3.33966 > 52.223.226.170.1935: Flags [.], seq 93710:95024, ack 0, win 501, options [nop,nop,TS val 1124540511 ecr 2306405003], length 1314
15:03:07.012253 IP 10.8.1.3.33966 > 52.223.226.170.1935: Flags [.], seq 95024:96338, ack 0, win 501, options [nop,nop,TS val 1124540557 ecr 2306405003], length 1314
15:03:07.061205 IP 52.223.226.170.1935 > 10.8.1.3.33966: Flags [.], ack 86710, win 126, options [nop,nop,TS val 2306405101 ecr 1124540193], length 0
15:03:07.064412 IP 10.8.1.3.33966 > 52.223.226.170.1935: Flags [.], seq 96338:97652, ack 0, win 501, options [nop,nop,TS val 1124540609 ecr 2306405101], length 1314
15:03:07.096147 IP 10.8.1.3.33966 > 52.223.226.170.1935: Flags [.], seq 97652:98966, ack 0, win 501, options [nop,nop,TS val 1124540641 ecr 2306405101], length 1314
15:03:07.139798 IP 10.8.1.3.33966 > 52.223.226.170.1935: Flags [.], seq 98966:100280, ack 0, win 501, options [nop,nop,TS val 1124540684 ecr 2306405101], length 1314
15:03:07.141401 IP 52.223.226.170.1935 > 10.8.1.3.33966: Flags [.], ack 89338, win 126, options [nop,nop,TS val 2306405181 ecr 1124540276], length 0
15:03:07.200072 IP 10.8.1.3.33966 > 52.223.226.170.1935: Flags [.], seq 100280:101594, ack 0, win 501, options [nop,nop,TS val 1124540745 ecr 2306405181], length 1314
15:03:07.227232 IP 52.223.226.170.1935 > 10.8.1.3.33966: Flags [.], ack 91966, win 126, options [nop,nop,TS val 2306405267 ecr 1124540378], length 0
15:03:07.233846 IP 10.8.1.3.33966 > 52.223.226.170.1935: Flags [.], seq 101594:102908, ack 0, win 501, options [nop,nop,TS val 1124540779 ecr 2306405267], length 1314
15:03:07.258269 IP 52.223.226.170.1935 > 10.8.1.3.33966: Flags [.], ack 92396, win 126, options [nop,nop,TS val 2306405298 ecr 1124540439], length 0
15:03:07.258304 IP 10.8.1.3.33966 > 52.223.226.170.1935: Flags [P.], seq 102908:103317, ack 0, win 501, options [nop,nop,TS val 1124540803 ecr 2306405298], length 409
15:03:07.300356 IP 10.8.1.3.33966 > 52.223.226.170.1935: Flags [.], seq 103317:104631, ack 0, win 501, options [nop,nop,TS val 1124540845 ecr 2306405298], length 1314
15:03:07.331260 IP 52.223.226.170.1935 > 10.8.1.3.33966: Flags [.], ack 95024, win 126, options [nop,nop,TS val 2306405371 ecr 1124540477], length 0
15:03:07.333094 IP 10.8.1.3.33966 > 52.223.226.170.1935: Flags [.], seq 104631:105945, ack 0, win 501, options [nop,nop,TS val 1124540878 ecr 2306405371], length 1314
15:03:07.375724 IP 10.8.1.3.33966 > 52.223.226.170.1935: Flags [.], seq 105945:107259, ack 0, win 501, options [nop,nop,TS val 1124540920 ecr 2306405371], length 1314
15:03:07.429168 IP 52.223.226.170.1935 > 10.8.1.3.33966: Flags [.], ack 97652, win 126, options [nop,nop,TS val 2306405469 ecr 1124540557], length 0
15:03:07.431792 IP 10.8.1.3.33966 > 52.223.226.170.1935: Flags [.], seq 107259:108573, ack 0, win 501, options [nop,nop,TS val 1124540976 ecr 2306405469], length 1314
15:03:07.462756 IP 10.8.1.3.33966 > 52.223.226.170.1935: Flags [.], seq 108573:109887, ack 0, win 501, options [nop,nop,TS val 1124541007 ecr 2306405469], length 1314
15:03:07.504158 IP 10.8.1.3.33966 > 52.223.226.170.1935: Flags [.], seq 109887:111201, ack 0, win 501, options [nop,nop,TS val 1124541049 ecr 2306405469], length 1314
15:03:07.504256 IP 52.223.226.170.1935 > 10.8.1.3.33966: Flags [.], ack 100280, win 126, options [nop,nop,TS val 2306405544 ecr 1124540641], length 0
15:03:07.566828 IP 10.8.1.3.33966 > 52.223.226.170.1935: Flags [.], seq 111201:112515, ack 0, win 501, options [nop,nop,TS val 1124541112 ecr 2306405544], length 1314
15:03:07.598394 IP 52.223.226.170.1935 > 10.8.1.3.33966: Flags [.], ack 102908, win 126, options [nop,nop,TS val 2306405638 ecr 1124540745], length 0
15:03:07.600274 IP 10.8.1.3.33966 > 52.223.226.170.1935: Flags [.], seq 112515:113829, ack 0, win 501, options [nop,nop,TS val 1124541145 ecr 2306405638], length 1314
15:03:07.622638 IP 52.223.226.170.1935 > 10.8.1.3.33966: Flags [.], ack 103317, win 126, options [nop,nop,TS val 2306405663 ecr 1124540803], length 0
15:03:07.622673 IP 10.8.1.3.33966 > 52.223.226.170.1935: Flags [P.], seq 113829:114258, ack 0, win 501, options [nop,nop,TS val 1124541167 ecr 2306405663], length 429
15:03:07.665385 IP 10.8.1.3.33966 > 52.223.226.170.1935: Flags [.], seq 114258:115572, ack 0, win 501, options [nop,nop,TS val 1124541210 ecr 2306405663], length 1314
15:03:07.697589 IP 10.8.1.3.33966 > 52.223.226.170.1935: Flags [.], seq 115572:116886, ack 0, win 501, options [nop,nop,TS val 1124541242 ecr 2306405663], length 1314
15:03:07.697627 IP 52.223.226.170.1935 > 10.8.1.3.33966: Flags [.], ack 105945, win 126, options [nop,nop,TS val 2306405738 ecr 1124540845], length 0
15:03:07.740247 IP 10.8.1.3.33966 > 52.223.226.170.1935: Flags [.], seq 116886:118200, ack 0, win 501, options [nop,nop,TS val 1124541285 ecr 2306405738], length 1314
15:03:07.796377 IP 52.223.226.170.1935 > 10.8.1.3.33966: Flags [.], ack 108573, win 126, options [nop,nop,TS val 2306405836 ecr 1124540920], length 0
15:03:07.796497 IP 10.8.1.3.33966 > 52.223.226.170.1935: Flags [.], seq 118200:119514, ack 0, win 501, options [nop,nop,TS val 1124541341 ecr 2306405836], length 1314
15:03:07.833046 IP 10.8.1.3.33966 > 52.223.226.170.1935: Flags [.], seq 119514:120828, ack 0, win 501, options [nop,nop,TS val 1124541378 ecr 2306405836], length 1314
15:03:07.868169 IP 10.8.1.3.33966 > 52.223.226.170.1935: Flags [.], seq 120828:122142, ack 0, win 501, options [nop,nop,TS val 1124541413 ecr 2306405836], length 1314
15:03:07.868880 IP 52.223.226.170.1935 > 10.8.1.3.33966: Flags [.], ack 111201, win 126, options [nop,nop,TS val 2306405909 ecr 1124541007], length 0
15:03:07.931079 IP 10.8.1.3.33966 > 52.223.226.170.1935: Flags [.], seq 122142:123456, ack 0, win 501, options [nop,nop,TS val 1124541476 ecr 2306405909], length 1314
15:03:07.963840 IP 10.8.1.3.33966 > 52.223.226.170.1935: Flags [.], seq 123456:124770, ack 0, win 501, options [nop,nop,TS val 1124541509 ecr 2306405909], length 1314
15:03:07.964558 IP 52.223.226.170.1935 > 10.8.1.3.33966: Flags [.], ack 113829, win 126, options [nop,nop,TS val 2306406005 ecr 1124541112], length 0
15:03:07.987033 IP 52.223.226.170.1935 > 10.8.1.3.33966: Flags [.], ack 114258, win 126, options [nop,nop,TS val 2306406027 ecr 1124541167], length 0
15:03:07.987049 IP 10.8.1.3.33966 > 52.223.226.170.1935: Flags [P.], seq 124770:125185, ack 0, win 501, options [nop,nop,TS val 1124541532 ecr 2306406027], length 415
15:03:08.029379 IP 10.8.1.3.33966 > 52.223.226.170.1935: Flags [.], seq 125185:126499, ack 0, win 501, options [nop,nop,TS val 1124541574 ecr 2306406027], length 1314
15:03:08.062286 IP 52.223.226.170.1935 > 10.8.1.3.33966: Flags [.], ack 116886, win 126, options [nop,nop,TS val 2306406102 ecr 1124541210], length 0
15:03:08.063421 IP 10.8.1.3.33966 > 52.223.226.170.1935: Flags [.], seq 126499:127813, ack 0, win 501, options [nop,nop,TS val 1124541608 ecr 2306406102], length 1314
15:03:08.102618 IP 10.8.1.3.33966 > 52.223.226.170.1935: Flags [.], seq 127813:129127, ack 0, win 501, options [nop,nop,TS val 1124541647 ecr 2306406102], length 1314
15:03:08.161132 IP 52.223.226.170.1935 > 10.8.1.3.33966: Flags [.], ack 119514, win 126, options [nop,nop,TS val 2306406201 ecr 1124541285], length 0
15:03:08.167077 IP 10.8.1.3.33966 > 52.223.226.170.1935: Flags [.], seq 129127:130441, ack 0, win 501, options [nop,nop,TS val 1124541712 ecr 2306406201], length 1314
15:03:08.198843 IP 10.8.1.3.33966 > 52.223.226.170.1935: Flags [.], seq 130441:131755, ack 0, win 501, options [nop,nop,TS val 1124541744 ecr 2306406201], length 1314
15:03:08.232601 IP 10.8.1.3.33966 > 52.223.226.170.1935: Flags [.], seq 131755:133069, ack 0, win 501, options [nop,nop,TS val 1124541777 ecr 2306406201], length 1314
15:03:08.233030 IP 52.223.226.170.1935 > 10.8.1.3.33966: Flags [.], ack 122142, win 126, options [nop,nop,TS val 2306406273 ecr 1124541378], length 0
15:03:08.300431 IP 10.8.1.3.33966 > 52.223.226.170.1935: Flags [.], seq 133069:134383, ack 0, win 501, options [nop,nop,TS val 1124541845 ecr 2306406273], length 1314
15:03:08.328216 IP 52.223.226.170.1935 > 10.8.1.3.33966: Flags [.], ack 124770, win 126, options [nop,nop,TS val 2306406368 ecr 1124541476], length 0
15:03:08.333829 IP 10.8.1.3.33966 > 52.223.226.170.1935: Flags [.], seq 134383:135697, ack 0, win 501, options [nop,nop,TS val 1124541879 ecr 2306406368], length 1314
15:03:08.352428 IP 52.223.226.170.1935 > 10.8.1.3.33966: Flags [.], ack 125185, win 126, options [nop,nop,TS val 2306406391 ecr 1124541532], length 0
15:03:08.352448 IP 10.8.1.3.33966 > 52.223.226.170.1935: Flags [P.], seq 135697:136126, ack 0, win 501, options [nop,nop,TS val 1124541897 ecr 2306406391], length 429
15:03:08.400338 IP 10.8.1.3.33966 > 52.223.226.170.1935: Flags [.], seq 136126:137440, ack 0, win 501, options [nop,nop,TS val 1124541945 ecr 2306406391], length 1314
15:03:08.428205 IP 52.223.226.170.1935 > 10.8.1.3.33966: Flags [.], ack 127813, win 126, options [nop,nop,TS val 2306406468 ecr 1124541574], length 0
15:03:08.433821 IP 10.8.1.3.33966 > 52.223.226.170.1935: Flags [.], seq 137440:138754, ack 0, win 501, options [nop,nop,TS val 1124541979 ecr 2306406468], length 1314
15:03:08.467224 IP 10.8.1.3.33966 > 52.223.226.170.1935: Flags [.], seq 138754:140068, ack 0, win 501, options [nop,nop,TS val 1124542012 ecr 2306406468], length 1314
15:03:08.531632 IP 52.223.226.170.1935 > 10.8.1.3.33966: Flags [.], ack 130441, win 126, options [nop,nop,TS val 2306406572 ecr 1124541647], length 0
15:03:08.534002 IP 10.8.1.3.33966 > 52.223.226.170.1935: Flags [.], seq 140068:141382, ack 0, win 501, options [nop,nop,TS val 1124542079 ecr 2306406572], length 1314
15:03:08.567146 IP 10.8.1.3.33966 > 52.223.226.170.1935: Flags [.], seq 141382:142696, ack 0, win 501, options [nop,nop,TS val 1124542112 ecr 2306406572], length 1314
15:03:08.597335 IP 52.223.226.170.1935 > 10.8.1.3.33966: Flags [.], ack 133069, win 126, options [nop,nop,TS val 2306406637 ecr 1124541744], length 0
15:03:08.600362 IP 10.8.1.3.33966 > 52.223.226.170.1935: Flags [.], seq 142696:144010, ack 0, win 501, options [nop,nop,TS val 1124542145 ecr 2306406637], length 1314
15:03:08.667241 IP 10.8.1.3.33966 > 52.223.226.170.1935: Flags [.], seq 144010:145324, ack 0, win 501, options [nop,nop,TS val 1124542212 ecr 2306406637], length 1314
15:03:08.697846 IP 10.8.1.3.33966 > 52.223.226.170.1935: Flags [.], seq 145324:146638, ack 0, win 501, options [nop,nop,TS val 1124542243 ecr 2306406637], length 1314
15:03:08.698373 IP 52.223.226.170.1935 > 10.8.1.3.33966: Flags [.], ack 135697, win 126, options [nop,nop,TS val 2306406738 ecr 1124541845], length 0
15:03:08.716965 IP 52.223.226.170.1935 > 10.8.1.3.33966: Flags [.], ack 136126, win 126, options [nop,nop,TS val 2306406757 ecr 1124541897], length 0
15:03:08.716984 IP 10.8.1.3.33966 > 52.223.226.170.1935: Flags [P.], seq 146638:147055, ack 0, win 501, options [nop,nop,TS val 1124542262 ecr 2306406757], length 417
15:03:08.767410 IP 10.8.1.3.33966 > 52.223.226.170.1935: Flags [.], seq 147055:148369, ack 0, win 501, options [nop,nop,TS val 1124542312 ecr 2306406757], length 1314
15:03:08.798728 IP 52.223.226.170.1935 > 10.8.1.3.33966: Flags [.], ack 138754, win 126, options [nop,nop,TS val 2306406839 ecr 1124541945], length 0
15:03:08.800649 IP 10.8.1.3.33966 > 52.223.226.170.1935: Flags [.], seq 148369:149683, ack 0, win 501, options [nop,nop,TS val 1124542345 ecr 2306406839], length 1314
15:03:08.831983 IP 10.8.1.3.33966 > 52.223.226.170.1935: Flags [.], seq 149683:150997, ack 0, win 501, options [nop,nop,TS val 1124542377 ecr 2306406839], length 1314
15:03:08.898637 IP 52.223.226.170.1935 > 10.8.1.3.33966: Flags [.], ack 141382, win 126, options [nop,nop,TS val 2306406938 ecr 1124542012], length 0
15:03:08.899701 IP 10.8.1.3.33966 > 52.223.226.170.1935: Flags [.], seq 150997:152311, ack 0, win 501, options [nop,nop,TS val 1124542444 ecr 2306406938], length 1314
15:03:08.933161 IP 10.8.1.3.33966 > 52.223.226.170.1935: Flags [.], seq 152311:153625, ack 0, win 501, options [nop,nop,TS val 1124542478 ecr 2306406938], length 1314
15:03:08.965331 IP 52.223.226.170.1935 > 10.8.1.3.33966: Flags [.], ack 144010, win 126, options [nop,nop,TS val 2306407005 ecr 1124542112], length 0
15:03:08.966331 IP 10.8.1.3.33966 > 52.223.226.170.1935: Flags [.], seq 153625:154939, ack 0, win 501, options [nop,nop,TS val 1124542511 ecr 2306407005], length 1314
15:03:09.032875 IP 10.8.1.3.33966 > 52.223.226.170.1935: Flags [.], seq 154939:156253, ack 0, win 501, options [nop,nop,TS val 1124542578 ecr 2306407005], length 1314
15:03:09.062530 IP 52.223.226.170.1935 > 10.8.1.3.33966: Flags [.], ack 146638, win 126, options [nop,nop,TS val 2306407102 ecr 1124542212], length 0
15:03:09.067544 IP 10.8.1.3.33966 > 52.223.226.170.1935: Flags [.], seq 156253:157567, ack 0, win 501, options [nop,nop,TS val 1124542612 ecr 2306407102], length 1314
15:03:09.081459 IP 52.223.226.170.1935 > 10.8.1.3.33966: Flags [.], ack 147055, win 126, options [nop,nop,TS val 2306407121 ecr 1124542262], length 0
15:03:09.081469 IP 10.8.1.3.33966 > 52.223.226.170.1935: Flags [P.], seq 157567:157989, ack 0, win 501, options [nop,nop,TS val 1124542626 ecr 2306407121], length 422
15:03:09.131127 IP 10.8.1.3.33966 > 52.223.226.170.1935: Flags [.], seq 157989:159303, ack 0, win 501, options [nop,nop,TS val 1124542676 ecr 2306407121], length 1314
15:03:09.164838 IP 10.8.1.3.33966 > 52.223.226.170.1935: Flags [.], seq 159303:160617, ack 0, win 501, options [nop,nop,TS val 1124542710 ecr 2306407121], length 1314
15:03:09.165408 IP 52.223.226.170.1935 > 10.8.1.3.33966: Flags [.], ack 149683, win 126, options [nop,nop,TS val 2306407205 ecr 1124542312], length 0
15:03:09.200525 IP 10.8.1.3.33966 > 52.223.226.170.1935: Flags [.], seq 160617:161931, ack 0, win 501, options [nop,nop,TS val 1124542745 ecr 2306407205], length 1314
15:03:09.264219 IP 52.223.226.170.1935 > 10.8.1.3.33966: Flags [.], ack 152311, win 126, options [nop,nop,TS val 2306407304 ecr 1124542377], length 0
15:03:09.267387 IP 10.8.1.3.33966 > 52.223.226.170.1935: Flags [.], seq 161931:163245, ack 0, win 501, options [nop,nop,TS val 1124542812 ecr 2306407304], length 1314
15:03:09.300862 IP 10.8.1.3.33966 > 52.223.226.170.1935: Flags [.], seq 163245:164559, ack 0, win 501, options [nop,nop,TS val 1124542846 ecr 2306407304], length 1314
15:03:09.331079 IP 52.223.226.170.1935 > 10.8.1.3.33966: Flags [.], ack 154939, win 126, options [nop,nop,TS val 2306407371 ecr 1124542478], length 0
15:03:09.334249 IP 10.8.1.3.33966 > 52.223.226.170.1935: Flags [.], seq 164559:165873, ack 0, win 501, options [nop,nop,TS val 1124542879 ecr 2306407371], length 1314
15:03:09.397750 IP 10.8.1.3.33966 > 52.223.226.170.1935: Flags [.], seq 165873:167187, ack 0, win 501, options [nop,nop,TS val 1124542942 ecr 2306407371], length 1314
15:03:09.432210 IP 52.223.226.170.1935 > 10.8.1.3.33966: Flags [.], ack 157567, win 126, options [nop,nop,TS val 2306407472 ecr 1124542578], length 0
15:03:09.432997 IP 10.8.1.3.33966 > 52.223.226.170.1935: Flags [.], seq 167187:168501, ack 0, win 501, options [nop,nop,TS val 1124542978 ecr 2306407472], length 1314
15:03:09.445727 IP 52.223.226.170.1935 > 10.8.1.3.33966: Flags [.], ack 157989, win 126, options [nop,nop,TS val 2306407486 ecr 1124542626], length 0
15:03:09.445756 IP 10.8.1.3.33966 > 52.223.226.170.1935: Flags [P.], seq 168501:168922, ack 0, win 501, options [nop,nop,TS val 1124542990 ecr 2306407486], length 421
15:03:09.496339 IP 10.8.1.3.33966 > 52.223.226.170.1935: Flags [.], seq 168922:170236, ack 0, win 501, options [nop,nop,TS val 1124543041 ecr 2306407486], length 1314
15:03:09.529467 IP 52.223.226.170.1935 > 10.8.1.3.33966: Flags [.], ack 160617, win 126, options [nop,nop,TS val 2306407569 ecr 1124542676], length 0
15:03:09.529590 IP 10.8.1.3.33966 > 52.223.226.170.1935: Flags [.], seq 170236:171550, ack 0, win 501, options [nop,nop,TS val 1124543074 ecr 2306407569], length 1314
15:03:09.563892 IP 10.8.1.3.33966 > 52.223.226.170.1935: Flags [.], seq 171550:172864, ack 0, win 501, options [nop,nop,TS val 1124543109 ecr 2306407569], length 1314
15:03:09.632043 IP 52.223.226.170.1935 > 10.8.1.3.33966: Flags [.], ack 163245, win 126, options [nop,nop,TS val 2306407672 ecr 1124542745], length 0
15:03:09.633754 IP 10.8.1.3.33966 > 52.223.226.170.1935: Flags [.], seq 172864:174178, ack 0, win 501, options [nop,nop,TS val 1124543178 ecr 2306407672], length 1314
15:03:09.666493 IP 10.8.1.3.33966 > 52.223.226.170.1935: Flags [.], seq 174178:175492, ack 0, win 501, options [nop,nop,TS val 1124543211 ecr 2306407672], length 1314
15:03:09.698186 IP 10.8.1.3.33966 > 52.223.226.170.1935: Flags [.], seq 175492:176806, ack 0, win 501, options [nop,nop,TS val 1124543243 ecr 2306407672], length 1314
15:03:09.698659 IP 52.223.226.170.1935 > 10.8.1.3.33966: Flags [.], ack 165873, win 126, options [nop,nop,TS val 2306407739 ecr 1124542846], length 0
15:03:09.762735 IP 10.8.1.3.33966 > 52.223.226.170.1935: Flags [.], seq 176806:178120, ack 0, win 501, options [nop,nop,TS val 1124543307 ecr 2306407739], length 1314
15:03:09.796503 IP 10.8.1.3.33966 > 52.223.226.170.1935: Flags [.], seq 178120:179434, ack 0, win 501, options [nop,nop,TS val 1124543341 ecr 2306407739], length 1314
15:03:09.797746 IP 52.223.226.170.1935 > 10.8.1.3.33966: Flags [.], ack 168501, win 126, options [nop,nop,TS val 2306407838 ecr 1124542942], length 0
15:03:09.810070 IP 52.223.226.170.1935 > 10.8.1.3.33966: Flags [.], ack 168922, win 126, options [nop,nop,TS val 2306407850 ecr 1124542990], length 0
15:03:09.810088 IP 10.8.1.3.33966 > 52.223.226.170.1935: Flags [P.], seq 179434:179856, ack 0, win 501, options [nop,nop,TS val 1124543355 ecr 2306407850], length 422
15:03:09.867087 IP 10.8.1.3.33966 > 52.223.226.170.1935: Flags [.], seq 179856:181170, ack 0, win 501, options [nop,nop,TS val 1124543412 ecr 2306407850], length 1314
15:03:09.894043 IP 52.223.226.170.1935 > 10.8.1.3.33966: Flags [.], ack 171550, win 126, options [nop,nop,TS val 2306407934 ecr 1124543041], length 0
15:03:09.901556 IP 10.8.1.3.33966 > 52.223.226.170.1935: Flags [.], seq 181170:182484, ack 0, win 501, options [nop,nop,TS val 1124543446 ecr 2306407934], length 1314
15:03:09.931117 IP 10.8.1.3.33966 > 52.223.226.170.1935: Flags [.], seq 182484:183798, ack 0, win 501, options [nop,nop,TS val 1124543476 ecr 2306407934], length 1314
15:03:09.996392 IP 52.223.226.170.1935 > 10.8.1.3.33966: Flags [.], ack 172864, win 126, options [nop,nop,TS val 2306408035 ecr 1124543109], length 0
15:03:09.997501 IP 10.8.1.3.33966 > 52.223.226.170.1935: Flags [.], seq 183798:185112, ack 0, win 501, options [nop,nop,TS val 1124543542 ecr 2306408035], length 1314
15:03:10.029653 IP 10.8.1.3.33966 > 52.223.226.170.1935: Flags [.], seq 185112:186426, ack 0, win 501, options [nop,nop,TS val 1124543574 ecr 2306408035], length 1314
15:03:10.030836 IP 52.223.226.170.1935 > 10.8.1.3.33966: Flags [.], ack 175492, win 126, options [nop,nop,TS val 2306408071 ecr 1124543178], length 0
15:03:10.064865 IP 10.8.1.3.33966 > 52.223.226.170.1935: Flags [.], seq 186426:187740, ack 0, win 501, options [nop,nop,TS val 1124543610 ecr 2306408071], length 1314
15:03:10.127295 IP 52.223.226.170.1935 > 10.8.1.3.33966: Flags [.], ack 178120, win 126, options [nop,nop,TS val 2306408167 ecr 1124543243], length 0
15:03:10.136145 IP 10.8.1.3.33966 > 52.223.226.170.1935: Flags [.], seq 187740:189054, ack 0, win 501, options [nop,nop,TS val 1124543681 ecr 2306408167], length 1314
15:03:10.165311 IP 10.8.1.3.33966 > 52.223.226.170.1935: Flags [.], seq 189054:190368, ack 0, win 501, options [nop,nop,TS val 1124543710 ecr 2306408167], length 1314
15:03:10.174443 IP 52.223.226.170.1935 > 10.8.1.3.33966: Flags [.], ack 179856, win 126, options [nop,nop,TS val 2306408214 ecr 1124543341], length 0
15:03:10.174483 IP 10.8.1.3.33966 > 52.223.226.170.1935: Flags [P.], seq 190368:190794, ack 0, win 501, options [nop,nop,TS val 1124543719 ecr 2306408214], length 426
15:03:10.232085 IP 10.8.1.3.33966 > 52.223.226.170.1935: Flags [.], seq 190794:192108, ack 0, win 501, options [nop,nop,TS val 1124543777 ecr 2306408214], length 1314
15:03:10.265419 IP 10.8.1.3.33966 > 52.223.226.170.1935: Flags [.], seq 192108:193422, ack 0, win 501, options [nop,nop,TS val 1124543810 ecr 2306408214], length 1314
15:03:10.266105 IP 52.223.226.170.1935 > 10.8.1.3.33966: Flags [.], ack 182484, win 126, options [nop,nop,TS val 2306408306 ecr 1124543412], length 0
15:03:10.298748 IP 10.8.1.3.33966 > 52.223.226.170.1935: Flags [.], seq 193422:194736, ack 0, win 501, options [nop,nop,TS val 1124543843 ecr 2306408306], length 1314
15:03:10.362154 IP 52.223.226.170.1935 > 10.8.1.3.33966: Flags [.], ack 185112, win 126, options [nop,nop,TS val 2306408402 ecr 1124543476], length 0
15:03:10.365229 IP 10.8.1.3.33966 > 52.223.226.170.1935: Flags [.], seq 194736:196050, ack 0, win 501, options [nop,nop,TS val 1124543910 ecr 2306408402], length 1314
15:03:10.398890 IP 10.8.1.3.33966 > 52.223.226.170.1935: Flags [.], seq 196050:197364, ack 0, win 501, options [nop,nop,TS val 1124543944 ecr 2306408402], length 1314
15:03:10.429479 IP 52.223.226.170.1935 > 10.8.1.3.33966: Flags [.], ack 187740, win 126, options [nop,nop,TS val 2306408469 ecr 1124543574], length 0
15:03:10.435219 IP 10.8.1.3.33966 > 52.223.226.170.1935: Flags [.], seq 197364:198678, ack 0, win 501, options [nop,nop,TS val 1124543980 ecr 2306408469], length 1314
15:03:10.499061 IP 10.8.1.3.33966 > 52.223.226.170.1935: Flags [.], seq 198678:199992, ack 0, win 501, options [nop,nop,TS val 1124544044 ecr 2306408469], length 1314
15:03:10.529972 IP 52.223.226.170.1935 > 10.8.1.3.33966: Flags [.], ack 190368, win 126, options [nop,nop,TS val 2306408570 ecr 1124543681], length 0
15:03:10.533820 IP 10.8.1.3.33966 > 52.223.226.170.1935: Flags [.], seq 199992:201306, ack 0, win 501, options [nop,nop,TS val 1124544079 ecr 2306408570], length 1314
15:03:10.538724 IP 52.223.226.170.1935 > 10.8.1.3.33966: Flags [.], ack 190794, win 126, options [nop,nop,TS val 2306408579 ecr 1124543719], length 0
15:03:10.538732 IP 10.8.1.3.33966 > 52.223.226.170.1935: Flags [P.], seq 201306:201719, ack 0, win 501, options [nop,nop,TS val 1124544083 ecr 2306408579], length 413
15:03:10.596606 IP 10.8.1.3.33966 > 52.223.226.170.1935: Flags [.], seq 201719:203033, ack 0, win 501, options [nop,nop,TS val 1124544141 ecr 2306408579], length 1314
15:03:10.629869 IP 52.223.226.170.1935 > 10.8.1.3.33966: Flags [.], ack 193422, win 126, options [nop,nop,TS val 2306408670 ecr 1124543777], length 0
