20:15:59.683153 IP 10.8.3.2.35624 > 99.181.88.186.1935: Flags [.], seq 3995039840:3995041154, ack 2809961518, win 501, options [nop,nop,TS val 26766766 ecr 3617202667], length 1314
20:15:59.714930 IP 10.8.3.2.35624 > 99.181.88.186.1935: Flags [.], seq 1314:2628, ack 1, win 501, options [nop,nop,TS val 26766798 ecr 3617202667], length 1314
20:15:59.726092 IP 99.181.88.186.1935 > 10.8.3.2.35624: Flags [.], ack 4294960876, win 126, options [nop,nop,TS val 3617202761 ecr 26766459], length 0
20:15:59.759581 IP 10.8.3.2.35624 > 99.181.88.186.1935: Flags [.], seq 2628:3942, ack 1, win 501, options [nop,nop,TS val 26766843 ecr 3617202761], length 1314
20:15:59.819091 IP 10.8.3.2.35624 > 99.181.88.186.1935: Flags [.], seq 3942:5256, ack 1, win 501, options [nop,nop,TS val 26766902 ecr 3617202761], length 1314
20:15:59.822566 IP 99.181.88.186.1935 > 10.8.3.2.35624: Flags [.], ack 4294963504, win 126, options [nop,nop,TS val 3617202857 ecr 26766532], length 0
20:15:59.845391 IP 10.8.3.2.35624 > 99.181.88.186.1935: Flags [.], seq 5256:6570, ack 1, win 501, options [nop,nop,TS val 26766929 ecr 3617202857], length 1314
20:15:59.888152 IP 10.8.3.2.35624 > 99.181.88.186.1935: Flags [.], seq 6570:7884, ack 1, win 501, options [nop,nop,TS val 26766971 ecr 3617202857], length 1314
20:15:59.894439 IP 99.181.88.186.1935 > 10.8.3.2.35624: Flags [.], ack 4294966132, win 126, options [nop,nop,TS val 3617202928 ecr 26766629], length 0
20:15:59.940583 IP 99.181.88.186.1935 > 10.8.3.2.35624: Flags [.], ack 0, win 126, options [nop,nop,TS val 3617202975 ecr 26766716], length 0
20:15:59.940618 IP 10.8.3.2.35624 > 99.181.88.186.1935: Flags [P.], seq 7884:8961, ack 1, win 501, options [nop,nop,TS val 26767024 ecr 3617202975], length 1077
20:15:59.982042 IP 10.8.3.2.35624 > 99.181.88.186.1935: Flags [.], seq 8961:10275, ack 1, win 501, options [nop,nop,TS val 26767065 ecr 3617202975], length 1314
20:16:00.016262 IP 10.8.3.2.35624 > 99.181.88.186.1935: Flags [.], seq 10275:11589, ack 1, win 501, options [nop,nop,TS val 26767100 ecr 3617202975], length 1314
20:16:00.023063 IP 99.181.88.186.1935 > 10.8.3.2.35624: Flags [.], ack 2628, win 126, options [nop,nop,TS val 3617203057 ecr 26766766], length 0
20:16:00.059006 IP 10.8.3.2.35624 > 99.181.88.186.1935: Flags [.], seq 11589:12903, ack 1, win 501, options [nop,nop,TS val 26767142 ecr 3617203057], length 1314
20:16:00.117464 IP 10.8.3.2.35624 > 99.181.88.186.1935: Flags [.], seq 12903:14217, ack 1, win 501, options [nop,nop,TS val 26767201 ecr 3617203057], length 1314
20:16:00.126782 IP 99.181.88.186.1935 > 10.8.3.2.35624: Flags [.], ack 5256, win 126, options [nop,nop,TS val 3617203161 ecr 26766843], length 0
20:16:00.144688 IP 10.8.3.2.35624 > 99.181.88.186.1935: Flags [.], seq 14217:15531, ack 1, win 501, options [nop,nop,TS val 26767228 ecr 3617203161], length 1314
20:16:00.187406 IP 10.8.3.2.35624 > 99.181.88.186.1935: Flags [.], seq 15531:16845, ack 1, win 501, options [nop,nop,TS val 26767271 ecr 3617203161], length 1314
20:16:00.196435 IP 99.181.88.186.1935 > 10.8.3.2.35624: Flags [.], ack 7884, win 126, options [nop,nop,TS val 3617203231 ecr 26766929], length 0
20:16:00.247864 IP 99.181.88.186.1935 > 10.8.3.2.35624: Flags [.], ack 8961, win 126, options [nop,nop,TS val 3617203282 ecr 26767024], length 0
20:16:00.247934 IP 10.8.3.2.35624 > 99.181.88.186.1935: Flags [P.], seq 16845:17905, ack 1, win 501, options [nop,nop,TS val 26767331 ecr 3617203282], length 1060
20:16:00.281928 IP 10.8.3.2.35624 > 99.181.88.186.1935: Flags [.], seq 17905:19219, ack 1, win 501, options [nop,nop,TS val 26767365 ecr 3617203282], length 1314
20:16:00.314841 IP 10.8.3.2.35624 > 99.181.88.186.1935: Flags [.], seq 19219:20533, ack 1, win 501, options [nop,nop,TS val 26767398 ecr 3617203282], length 1314
20:16:00.324561 IP 99.181.88.186.1935 > 10.8.3.2.35624: Flags [.], ack 11589, win 126, options [nop,nop,TS val 3617203359 ecr 26767065], length 0
20:16:00.357098 IP 10.8.3.2.35624 > 99.181.88.186.1935: Flags [.], seq 20533:21847, ack 1, win 501, options [nop,nop,TS val 26767440 ecr 3617203359], length 1314
20:16:00.416440 IP 10.8.3.2.35624 > 99.181.88.186.1935: Flags [.], seq 21847:23161, ack 1, win 501, options [nop,nop,TS val 26767500 ecr 3617203359], length 1314
20:16:00.425207 IP 99.181.88.186.1935 > 10.8.3.2.35624: Flags [.], ack 14217, win 126, options [nop,nop,TS val 3617203459 ecr 26767142], length 0
20:16:00.442390 IP 10.8.3.2.35624 > 99.181.88.186.1935: Flags [.], seq 23161:24475, ack 1, win 501, options [nop,nop,TS val 26767526 ecr 3617203459], length 1314
20:16:00.485092 IP 10.8.3.2.35624 > 99.181.88.186.1935: Flags [.], seq 24475:25789, ack 1, win 501, options [nop,nop,TS val 26767568 ecr 3617203459], length 1314
20:16:00.494825 IP 99.181.88.186.1935 > 10.8.3.2.35624: Flags [.], ack 16845, win 126, options [nop,nop,TS val 3617203529 ecr 26767228], length 0
20:16:00.548491 IP 10.8.3.2.35624 > 99.181.88.186.1935: Flags [.], seq 25789:27103, ack 1, win 501, options [nop,nop,TS val 26767632 ecr 3617203529], length 1314
20:16:00.555556 IP 99.181.88.186.1935 > 10.8.3.2.35624: Flags [.], ack 17905, win 126, options [nop,nop,TS val 3617203590 ecr 26767331], length 0
20:16:00.555573 IP 10.8.3.2.35624 > 99.181.88.186.1935: Flags [P.], seq 27103:27809, ack 1, win 501, options [nop,nop,TS val 26767639 ecr 3617203590], length 706
20:16:00.612817 IP 10.8.3.2.35624 > 99.181.88.186.1935: Flags [.], seq 27809:29123, ack 1, win 501, options [nop,nop,TS val 26767696 ecr 3617203590], length 1314
20:16:00.622273 IP 99.181.88.186.1935 > 10.8.3.2.35624: Flags [.], ack 20533, win 126, options [nop,nop,TS val 3617203657 ecr 26767365], length 0
20:16:00.648351 IP 10.8.3.2.35624 > 99.181.88.186.1935: Flags [.], seq 29123:30437, ack 1, win 501, options [nop,nop,TS val 26767732 ecr 3617203657], length 1314
20:16:00.682243 IP 10.8.3.2.35624 > 99.181.88.186.1935: Flags [.], seq 30437:31751, ack 1, win 501, options [nop,nop,TS val 26767766 ecr 3617203657], length 1314
20:16:00.723865 IP 99.181.88.186.1935 > 10.8.3.2.35624: Flags [.], ack 23161, win 126, options [nop,nop,TS val 3617203758 ecr 26767440], length 0
20:16:00.752386 IP 10.8.3.2.35624 > 99.181.88.186.1935: Flags [.], seq 31751:33065, ack 1, win 501, options [nop,nop,TS val 26767836 ecr 3617203758], length 1314
20:16:00.783430 IP 10.8.3.2.35624 > 99.181.88.186.1935: Flags [.], seq 33065:34379, ack 1, win 501, options [nop,nop,TS val 26767867 ecr 3617203758], length 1314
20:16:00.792632 IP 99.181.88.186.1935 > 10.8.3.2.35624: Flags [.], ack 25789, win 126, options [nop,nop,TS val 3617203827 ecr 26767526], length 0
20:16:00.816817 IP 10.8.3.2.35624 > 99.181.88.186.1935: Flags [.], seq 34379:35693, ack 1, win 501, options [nop,nop,TS val 26767900 ecr 3617203827], length 1314
20:16:00.863393 IP 99.181.88.186.1935 > 10.8.3.2.35624: Flags [.], ack 27809, win 126, options [nop,nop,TS val 3617203897 ecr 26767632], length 0
20:16:00.863439 IP 10.8.3.2.35624 > 99.181.88.186.1935: Flags [P.], seq 35693:36762, ack 1, win 501, options [nop,nop,TS val 26767947 ecr 3617203897], length 1069
20:16:00.911828 IP 10.8.3.2.35624 > 99.181.88.186.1935: Flags [.], seq 36762:38076, ack 1, win 501, options [nop,nop,TS val 26767995 ecr 3617203897], length 1314
20:16:00.950751 IP 10.8.3.2.35624 > 99.181.88.186.1935: Flags [.], seq 38076:39390, ack 1, win 501, options [nop,nop,TS val 26768034 ecr 3617203897], length 1314
20:16:00.956414 IP 99.181.88.186.1935 > 10.8.3.2.35624: Flags [.], ack 30437, win 126, options [nop,nop,TS val 3617203990 ecr 26767696], length 0
20:16:00.982699 IP 10.8.3.2.35624 > 99.181.88.186.1935: Flags [.], seq 39390:40704, ack 1, win 501, options [nop,nop,TS val 26768066 ecr 3617203990], length 1314
20:16:01.050046 IP 10.8.3.2.35624 > 99.181.88.186.1935: Flags [.], seq 40704:42018, ack 1, win 501, options [nop,nop,TS val 26768133 ecr 3617203990], length 1314
20:16:01.059864 IP 99.181.88.186.1935 > 10.8.3.2.35624: Flags [.], ack 33065, win 126, options [nop,nop,TS val 3617204094 ecr 26767766], length 0
20:16:01.081669 IP 10.8.3.2.35624 > 99.181.88.186.1935: Flags [.], seq 42018:43332, ack 1, win 501, options [nop,nop,TS val 26768165 ecr 3617204094], length 1314
20:16:01.118043 IP 10.8.3.2.35624 > 99.181.88.186.1935: Flags [.], seq 43332:44646, ack 1, win 501, options [nop,nop,TS val 26768201 ecr 3617204094], length 1314
20:16:01.124791 IP 99.181.88.186.1935 > 10.8.3.2.35624: Flags [.], ack 35693, win 126, options [nop,nop,TS val 3617204159 ecr 26767867], length 0
20:16:01.172202 IP 99.181.88.186.1935 > 10.8.3.2.35624: Flags [.], ack 36762, win 126, options [nop,nop,TS val 3617204205 ecr 26767947], length 0
20:16:01.172237 IP 10.8.3.2.35624 > 99.181.88.186.1935: Flags [P.], seq 44646:45807, ack 1, win 501, options [nop,nop,TS val 26768256 ecr 3617204205], length 1161
20:16:01.210139 IP 10.8.3.2.35624 > 99.181.88.186.1935: Flags [.], seq 45807:47121, ack 1, win 501, options [nop,nop,TS val 26768293 ecr 3617204205], length 1314
20:16:01.252984 IP 10.8.3.2.35624 > 99.181.88.186.1935: Flags [.], seq 47121:48435, ack 1, win 501, options [nop,nop,TS val 26768336 ecr 3617204205], length 1314
20:16:01.259973 IP 99.181.88.186.1935 > 10.8.3.2.35624: Flags [.], ack 39390, win 126, options [nop,nop,TS val 3617204293 ecr 26767995], length 0
20:16:01.295815 IP 10.8.3.2.35624 > 99.181.88.186.1935: Flags [.], seq 48435:49749, ack 1, win 501, options [nop,nop,TS val 26768379 ecr 3617204293], length 1314
20:16:01.352152 IP 10.8.3.2.35624 > 99.181.88.186.1935: Flags [.], seq 49749:51063, ack 1, win 501, options [nop,nop,TS val 26768435 ecr 3617204293], length 1314
20:16:01.357389 IP 99.181.88.186.1935 > 10.8.3.2.35624: Flags [.], ack 42018, win 126, options [nop,nop,TS val 3617204392 ecr 26768066], length 0
20:16:01.381274 IP 10.8.3.2.35624 > 99.181.88.186.1935: Flags [.], seq 51063:52377, ack 1, win 501, options [nop,nop,TS val 26768465 ecr 3617204392], length 1314
20:16:01.423764 IP 10.8.3.2.35624 > 99.181.88.186.1935: Flags [.], seq 52377:53691, ack 1, win 501, options [nop,nop,TS val 26768507 ecr 3617204392], length 1314
20:16:01.425314 IP 99.181.88.186.1935 > 10.8.3.2.35624: Flags [.], ack 44646, win 126, options [nop,nop,TS val 3617204460 ecr 26768165], length 0
20:16:01.479593 IP 99.181.88.186.1935 > 10.8.3.2.35624: Flags [.], ack 45807, win 126, options [nop,nop,TS val 3617204514 ecr 26768256], length 0
20:16:01.479613 IP 10.8.3.2.35624 > 99.181.88.186.1935: Flags [P.], seq 53691:54768, ack 1, win 501, options [nop,nop,TS val 26768563 ecr 3617204514], length 1077
20:16:01.508762 IP 10.8.3.2.35624 > 99.181.88.186.1935: Flags [.], seq 54768:56082, ack 1, win 501, options [nop,nop,TS val 26768592 ecr 3617204514], length 1314
20:16:01.551469 IP 10.8.3.2.35624 > 99.181.88.186.1935: Flags [.], seq 56082:57396, ack 1, win 501, options [nop,nop,TS val 26768635 ecr 3617204514], length 1314
20:16:01.560776 IP 99.181.88.186.1935 > 10.8.3.2.35624: Flags [.], ack 48435, win 126, options [nop,nop,TS val 3617204595 ecr 26768293], length 0
20:16:01.593794 IP 10.8.3.2.35624 > 99.181.88.186.1935: Flags [.], seq 57396:58710, ack 1, win 501, options [nop,nop,TS val 26768677 ecr 3617204595], length 1314
20:16:01.652533 IP 10.8.3.2.35624 > 99.181.88.186.1935: Flags [.], seq 58710:60024, ack 1, win 501, options [nop,nop,TS val 26768736 ecr 3617204595], length 1314
20:16:01.659632 IP 99.181.88.186.1935 > 10.8.3.2.35624: Flags [.], ack 51063, win 126, options [nop,nop,TS val 3617204694 ecr 26768379], length 0
20:16:01.679344 IP 10.8.3.2.35624 > 99.181.88.186.1935: Flags [.], seq 60024:61338, ack 1, win 501, options [nop,nop,TS val 26768763 ecr 3617204694], length 1314
20:16:01.722281 IP 10.8.3.2.35624 > 99.181.88.186.1935: Flags [.], seq 61338:62652, ack 1, win 501, options [nop,nop,TS val 26768806 ecr 3617204694], length 1314
20:16:01.732028 IP 99.181.88.186.1935 > 10.8.3.2.35624: Flags [.], ack 53691, win 126, options [nop,nop,TS val 3617204766 ecr 26768465], length 0
20:16:01.785128 IP 10.8.3.2.35624 > 99.181.88.186.1935: Flags [.], seq 62652:63966, ack 1, win 501, options [nop,nop,TS val 26768868 ecr 3617204766], length 1314
20:16:01.787800 IP 99.181.88.186.1935 > 10.8.3.2.35624: Flags [.], ack 54768, win 126, options [nop,nop,TS val 3617204821 ecr 26768563], length 0
20:16:01.787830 IP 10.8.3.2.35624 > 99.181.88.186.1935: Flags [P.], seq 63966:64655, ack 1, win 501, options [nop,nop,TS val 26768871 ecr 3617204821], length 689
20:16:01.849888 IP 10.8.3.2.35624 > 99.181.88.186.1935: Flags [.], seq 64655:65969, ack 1, win 501, options [nop,nop,TS val 26768933 ecr 3617204821], length 1314
20:16:01.858739 IP 99.181.88.186.1935 > 10.8.3.2.35624: Flags [.], ack 57396, win 126, options [nop,nop,TS val 3617204893 ecr 26768592], length 0
20:16:01.884127 IP 10.8.3.2.35624 > 99.181.88.186.1935: Flags [.], seq 65969:67283, ack 1, win 501, options [nop,nop,TS val 26768967 ecr 3617204893], length 1314
20:16:01.918114 IP 10.8.3.2.35624 > 99.181.88.186.1935: Flags [.], seq 67283:68597, ack 1, win 501, options [nop,nop,TS val 26769001 ecr 3617204893], length 1314
20:16:01.959989 IP 99.181.88.186.1935 > 10.8.3.2.35624: Flags [.], ack 60024, win 126, options [nop,nop,TS val 3617204994 ecr 26768677], length 0
20:16:01.978871 IP 10.8.3.2.35624 > 99.181.88.186.1935: Flags [.], seq 68597:69911, ack 1, win 501, options [nop,nop,TS val 26769062 ecr 3617204994], length 1314
20:16:02.017006 IP 10.8.3.2.35624 > 99.181.88.186.1935: Flags [.], seq 69911:71225, ack 1, win 501, options [nop,nop,TS val 26769100 ecr 3617204994], length 1314
20:16:02.030159 IP 99.181.88.186.1935 > 10.8.3.2.35624: Flags [.], ack 62652, win 126, options [nop,nop,TS val 3617205065 ecr 26768763], length 0
20:16:02.052432 IP 10.8.3.2.35624 > 99.181.88.186.1935: Flags [.], seq 71225:72539, ack 1, win 501, options [nop,nop,TS val 26769136 ecr 3617205065], length 1314
20:16:02.095208 IP 99.181.88.186.1935 > 10.8.3.2.35624: Flags [.], ack 64655, win 126, options [nop,nop,TS val 3617205130 ecr 26768868], length 0
20:16:02.095258 IP 10.8.3.2.35624 > 99.181.88.186.1935: Flags [P.], seq 72539:73615, ack 1, win 501, options [nop,nop,TS val 26769179 ecr 3617205130], length 1076
20:16:02.149874 IP 10.8.3.2.35624 > 99.181.88.186.1935: Flags [.], seq 73615:74929, ack 1, win 501, options [nop,nop,TS val 26769233 ecr 3617205130], length 1314
20:16:02.185125 IP 10.8.3.2.35624 > 99.181.88.186.1935: Flags [.], seq 74929:76243, ack 1, win 501, options [nop,nop,TS val 26769268 ecr 3617205130], length 1314
20:16:02.191404 IP 99.181.88.186.1935 > 10.8.3.2.35624: Flags [.], ack 67283, win 126, options [nop,nop,TS val 3617205226 ecr 26768933], length 0
20:16:02.219415 IP 10.8.3.2.35624 > 99.181.88.186.1935: Flags [.], seq 76243:77557, ack 1, win 501, options [nop,nop,TS val 26769303 ecr 3617205226], length 1314
20:16:02.278654 IP 10.8.3.2.35624 > 99.181.88.186.1935: Flags [.], seq 77557:78871, ack 1, win 501, options [nop,nop,TS val 26769362 ecr 3617205226], length 1314
20:16:02.286378 IP 99.181.88.186.1935 > 10.8.3.2.35624: Flags [.], ack 69911, win 126, options [nop,nop,TS val 3617205321 ecr 26769001], length 0
20:16:02.316150 IP 10.8.3.2.35624 > 99.181.88.186.1935: Flags [.], seq 78871:80185, ack 1, win 501, options [nop,nop,TS val 26769399 ecr 3617205321], length 1314
20:16:02.348595 IP 10.8.3.2.35624 > 99.181.88.186.1935: Flags [.], seq 80185:81499, ack 1, win 501, options [nop,nop,TS val 26769432 ecr 3617205321], length 1314
20:16:02.359982 IP 99.181.88.186.1935 > 10.8.3.2.35624: Flags [.], ack 72539, win 126, options [nop,nop,TS val 3617205394 ecr 26769100], length 0
20:16:02.403463 IP 99.181.88.186.1935 > 10.8.3.2.35624: Flags [.], ack 73615, win 126, options [nop,nop,TS val 3617205437 ecr 26769179], length 0
20:16:02.403499 IP 10.8.3.2.35624 > 99.181.88.186.1935: Flags [P.], seq 81499:82572, ack 1, win 501, options [nop,nop,TS val 26769487 ecr 3617205437], length 1073
20:16:02.449568 IP 10.8.3.2.35624 > 99.181.88.186.1935: Flags [.], seq 82572:83886, ack 1, win 501, options [nop,nop,TS val 26769533 ecr 3617205437], length 1314
20:16:02.482803 IP 10.8.3.2.35624 > 99.181.88.186.1935: Flags [.], seq 83886:85200, ack 1, win 501, options [nop,nop,TS val 26769566 ecr 3617205437], length 1314
20:16:02.492766 IP 99.181.88.186.1935 > 10.8.3.2.35624: Flags [.], ack 76243, win 126, options [nop,nop,TS val 3617205527 ecr 26769233], length 0
20:16:02.514945 IP 10.8.3.2.35624 > 99.181.88.186.1935: Flags [.], seq 85200:86514, ack 1, win 501, options [nop,nop,TS val 26769598 ecr 3617205527], length 1314
20:16:02.576986 IP 10.8.3.2.35624 > 99.181.88.186.1935: Flags [.], seq 86514:87828, ack 1, win 501, options [nop,nop,TS val 26769660 ecr 3617205527], length 1314
20:16:02.586529 IP 99.181.88.186.1935 > 10.8.3.2.35624: Flags [.], ack 78871, win 126, options [nop,nop,TS val 3617205620 ecr 26769303], length 0
20:16:02.619081 IP 10.8.3.2.35624 > 99.181.88.186.1935: Flags [.], seq 87828:89142, ack 1, win 501, options [nop,nop,TS val 26769702 ecr 3617205620], length 1314
20:16:02.652462 IP 10.8.3.2.35624 > 99.181.88.186.1935: Flags [.], seq 89142:90456, ack 1, win 501, options [nop,nop,TS val 26769736 ecr 3617205620], length 1314
20:16:02.657029 IP 99.181.88.186.1935 > 10.8.3.2.35624: Flags [.], ack 81499, win 126, options [nop,nop,TS val 3617205690 ecr 26769399], length 0
20:16:02.711973 IP 99.181.88.186.1935 > 10.8.3.2.35624: Flags [.], ack 82572, win 126, options [nop,nop,TS val 3617205745 ecr 26769487], length 0
20:16:02.712000 IP 10.8.3.2.35624 > 99.181.88.186.1935: Flags [P.], seq 90456:91612, ack 1, win 501, options [nop,nop,TS val 26769795 ecr 3617205745], length 1156
20:16:02.748665 IP 10.8.3.2.35624 > 99.181.88.186.1935: Flags [.], seq 91612:92926, ack 1, win 501, options [nop,nop,TS val 26769832 ecr 3617205745], length 1314
20:16:02.785806 IP 10.8.3.2.35624 > 99.181.88.186.1935: Flags [.], seq 92926:94240, ack 1, win 501, options [nop,nop,TS val 26769869 ecr 3617205745], length 1314
20:16:02.790205 IP 99.181.88.186.1935 > 10.8.3.2.35624: Flags [.], ack 85200, win 126, options [nop,nop,TS val 3617205825 ecr 26769533], length 0
20:16:02.834409 IP 10.8.3.2.35624 > 99.181.88.186.1935: Flags [.], seq 94240:95554, ack 1, win 501, options [nop,nop,TS val 26769918 ecr 3617205825], length 1314
20:16:02.884399 IP 99.181.88.186.1935 > 10.8.3.2.35624: Flags [.], ack 87828, win 126, options [nop,nop,TS val 3617205919 ecr 26769598], length 0
20:16:02.885694 IP 10.8.3.2.35624 > 99.181.88.186.1935: Flags [.], seq 95554:96868, ack 1, win 501, options [nop,nop,TS val 26769969 ecr 3617205919], length 1314
20:16:02.919140 IP 10.8.3.2.35624 > 99.181.88.186.1935: Flags [.], seq 96868:98182, ack 1, win 501, options [nop,nop,TS val 26770002 ecr 3617205919], length 1314
20:16:02.959867 IP 99.181.88.186.1935 > 10.8.3.2.35624: Flags [.], ack 90456, win 126, options [nop,nop,TS val 3617205994 ecr 26769702], length 0
20:16:02.962728 IP 10.8.3.2.35624 > 99.181.88.186.1935: Flags [.], seq 98182:99496, ack 1, win 501, options [nop,nop,TS val 26770046 ecr 3617205994], length 1314
20:16:03.018581 IP 10.8.3.2.35624 > 99.181.88.186.1935: Flags [.], seq 99496:100810, ack 1, win 501, options [nop,nop,TS val 26770102 ecr 3617205994], length 1314
20:16:03.019255 IP 99.181.88.186.1935 > 10.8.3.2.35624: Flags [.], ack 91612, win 126, options [nop,nop,TS val 3617206054 ecr 26769795], length 0
20:16:03.019291 IP 10.8.3.2.35624 > 99.181.88.186.1935: Flags [P.], seq 100810:101420, ack 1, win 501, options [nop,nop,TS val 26770103 ecr 3617206054], length 610
20:16:03.082000 IP 10.8.3.2.35624 > 99.181.88.186.1935: Flags [.], seq 101420:102734, ack 1, win 501, options [nop,nop,TS val 26770165 ecr 3617206054], length 1314
20:16:03.093374 IP 99.181.88.186.1935 > 10.8.3.2.35624: Flags [.], ack 94240, win 126, options [nop,nop,TS val 3617206128 ecr 26769832], length 0
20:16:03.111965 IP 10.8.3.2.35624 > 99.181.88.186.1935: Flags [.], seq 102734:104048, ack 1, win 501, options [nop,nop,TS val 26770195 ecr 3617206128], length 1314
20:16:03.152545 IP 10.8.3.2.35624 > 99.181.88.186.1935: Flags [.], seq 104048:105362, ack 1, win 501, options [nop,nop,TS val 26770236 ecr 3617206128], length 1314
20:16:03.193457 IP 99.181.88.186.1935 > 10.8.3.2.35624: Flags [.], ack 96868, win 126, options [nop,nop,TS val 3617206227 ecr 26769918], length 0
20:16:03.216537 IP 10.8.3.2.35624 > 99.181.88.186.1935: Flags [.], seq 105362:106676, ack 1, win 501, options [nop,nop,TS val 26770300 ecr 3617206227], length 1314
20:16:03.251998 IP 10.8.3.2.35624 > 99.181.88.186.1935: Flags [.], seq 106676:107990, ack 1, win 501, options [nop,nop,TS val 26770335 ecr 3617206227], length 1314
20:16:03.271653 IP 99.181.88.186.1935 > 10.8.3.2.35624: Flags [.], ack 99496, win 126, options [nop,nop,TS val 3617206305 ecr 26770002], length 0
20:16:03.283612 IP 10.8.3.2.35624 > 99.181.88.186.1935: Flags [.], seq 107990:109304, ack 1, win 501, options [nop,nop,TS val 26770367 ecr 3617206305], length 1314
20:16:03.327865 IP 99.181.88.186.1935 > 10.8.3.2.35624: Flags [.], ack 101420, win 126, options [nop,nop,TS val 3617206361 ecr 26770102], length 0
20:16:03.327904 IP 10.8.3.2.35624 > 99.181.88.186.1935: Flags [P.], seq 109304:110465, ack 1, win 501, options [nop,nop,TS val 26770411 ecr 3617206361], length 1161
20:16:03.385398 IP 10.8.3.2.35624 > 99.181.88.186.1935: Flags [.], seq 110465:111779, ack 1, win 501, options [nop,nop,TS val 26770469 ecr 3617206361], length 1314
20:16:03.419158 IP 99.181.88.186.1935 > 10.8.3.2.35624: Flags [.], ack 104048, win 126, options [nop,nop,TS val 3617206454 ecr 26770165], length 0
20:16:03.419418 IP 10.8.3.2.35624 > 99.181.88.186.1935: Flags [.], seq 111779:113093, ack 1, win 501, options [nop,nop,TS val 26770503 ecr 3617206454], length 1314
20:16:03.455112 IP 10.8.3.2.35624 > 99.181.88.186.1935: Flags [.], seq 113093:114407, ack 1, win 501, options [nop,nop,TS val 26770538 ecr 3617206454], length 1314
20:16:03.518888 IP 10.8.3.2.35624 > 99.181.88.186.1935: Flags [.], seq 114407:115721, ack 1, win 501, options [nop,nop,TS val 26770602 ecr 3617206454], length 1314
20:16:03.523911 IP 99.181.88.186.1935 > 10.8.3.2.35624: Flags [.], ack 106676, win 126, options [nop,nop,TS val 3617206558 ecr 26770236], length 0
20:16:03.552726 IP 10.8.3.2.35624 > 99.181.88.186.1935: Flags [.], seq 115721:117035, ack 1, win 501, options [nop,nop,TS val 26770636 ecr 3617206558], length 1314
20:16:03.585595 IP 10.8.3.2.35624 > 99.181.88.186.1935: Flags [.], seq 117035:118349, ack 1, win 501, options [nop,nop,TS val 26770669 ecr 3617206558], length 1314
20:16:03.591050 IP 99.181.88.186.1935 > 10.8.3.2.35624: Flags [.], ack 109304, win 126, options [nop,nop,TS val 3617206625 ecr 26770335], length 0
20:16:03.635316 IP 99.181.88.186.1935 > 10.8.3.2.35624: Flags [.], ack 110465, win 126, options [nop,nop,TS val 3617206670 ecr 26770411], length 0
20:16:03.635353 IP 10.8.3.2.35624 > 99.181.88.186.1935: Flags [P.], seq 118349:119421, ack 1, win 501, options [nop,nop,TS val 26770719 ecr 3617206670], length 1072
20:16:03.684252 IP 10.8.3.2.35624 > 99.181.88.186.1935: Flags [.], seq 119421:120735, ack 1, win 501, options [nop,nop,TS val 26770768 ecr 3617206670], length 1314
20:16:03.714975 IP 10.8.3.2.35624 > 99.181.88.186.1935: Flags [.], seq 120735:122049, ack 1, win 501, options [nop,nop,TS val 26770798 ecr 3617206670], length 1314
20:16:03.726739 IP 99.181.88.186.1935 > 10.8.3.2.35624: Flags [.], ack 113093, win 126, options [nop,nop,TS val 3617206761 ecr 26770469], length 0
20:16:03.754675 IP 10.8.3.2.35624 > 99.181.88.186.1935: Flags [.], seq 122049:123363, ack 1, win 501, options [nop,nop,TS val 26770838 ecr 3617206761], length 1314
20:16:03.818955 IP 10.8.3.2.35624 > 99.181.88.186.1935: Flags [.], seq 123363:124677, ack 1, win 501, options [nop,nop,TS val 26770902 ecr 3617206761], length 1314
20:16:03.826259 IP 99.181.88.186.1935 > 10.8.3.2.35624: Flags [.], ack 115721, win 126, options [nop,nop,TS val 3617206861 ecr 26770538], length 0
20:16:03.852626 IP 10.8.3.2.35624 > 99.181.88.186.1935: Flags [.], seq 124677:125991, ack 1, win 501, options [nop,nop,TS val 26770936 ecr 3617206861], length 1314
20:16:03.885818 IP 10.8.3.2.35624 > 99.181.88.186.1935: Flags [.], seq 125991:127305, ack 1, win 501, options [nop,nop,TS val 26770969 ecr 3617206861], length 1314
20:16:03.893787 IP 99.181.88.186.1935 > 10.8.3.2.35624: Flags [.], ack 118349, win 126, options [nop,nop,TS val 3617206928 ecr 26770636], length 0
20:16:03.942972 IP 99.181.88.186.1935 > 10.8.3.2.35624: Flags [.], ack 119421, win 126, options [nop,nop,TS val 3617206977 ecr 26770719], length 0
20:16:03.942995 IP 10.8.3.2.35624 > 99.181.88.186.1935: Flags [P.], seq 127305:128382, ack 1, win 501, options [nop,nop,TS val 26771026 ecr 3617206977], length 1077
20:16:03.985812 IP 10.8.3.2.35624 > 99.181.88.186.1935: Flags [.], seq 128382:129696, ack 1, win 501, options [nop,nop,TS val 26771069 ecr 3617206977], length 1314
20:16:04.019911 IP 10.8.3.2.35624 > 99.181.88.186.1935: Flags [.], seq 129696:131010, ack 1, win 501, options [nop,nop,TS val 26771103 ecr 3617206977], length 1314
20:16:04.022996 IP 99.181.88.186.1935 > 10.8.3.2.35624: Flags [.], ack 122049, win 126, options [nop,nop,TS val 3617207057 ecr 26770768], length 0
20:16:04.054622 IP 10.8.3.2.35624 > 99.181.88.186.1935: Flags [.], seq 131010:132324, ack 1, win 501, options [nop,nop,TS val 26771138 ecr 3617207057], length 1314
20:16:04.115992 IP 10.8.3.2.35624 > 99.181.88.186.1935: Flags [.], seq 132324:133638, ack 1, win 501, options [nop,nop,TS val 26771199 ecr 3617207057], length 1314
20:16:04.127202 IP 99.181.88.186.1935 > 10.8.3.2.35624: Flags [.], ack 124677, win 126, options [nop,nop,TS val 3617207161 ecr 26770838], length 0
20:16:04.150404 IP 10.8.3.2.35624 > 99.181.88.186.1935: Flags [.], seq 133638:134952, ack 1, win 501, options [nop,nop,TS val 26771234 ecr 3617207161], length 1314
20:16:04.185937 IP 10.8.3.2.35624 > 99.181.88.186.1935: Flags [.], seq 134952:136266, ack 1, win 501, options [nop,nop,TS val 26771269 ecr 3617207161], length 1314
20:16:04.194214 IP 99.181.88.186.1935 > 10.8.3.2.35624: Flags [.], ack 127305, win 126, options [nop,nop,TS val 3617207228 ecr 26770936], length 0
20:16:04.250759 IP 99.181.88.186.1935 > 10.8.3.2.35624: Flags [.], ack 128382, win 126, options [nop,nop,TS val 3617207285 ecr 26771026], length 0
20:16:04.250779 IP 10.8.3.2.35624 > 99.181.88.186.1935: Flags [P.], seq 136266:137418, ack 1, win 501, options [nop,nop,TS val 26771334 ecr 3617207285], length 1152
20:16:04.283900 IP 10.8.3.2.35624 > 99.181.88.186.1935: Flags [.], seq 137418:138732, ack 1, win 501, options [nop,nop,TS val 26771367 ecr 3617207285], length 1314
20:16:04.318404 IP 10.8.3.2.35624 > 99.181.88.186.1935: Flags [.], seq 138732:140046, ack 1, win 501, options [nop,nop,TS val 26771402 ecr 3617207285], length 1314
20:16:04.327239 IP 99.181.88.186.1935 > 10.8.3.2.35624: Flags [.], ack 131010, win 126, options [nop,nop,TS val 3617207362 ecr 26771069], length 0
20:16:04.375727 IP 10.8.3.2.35624 > 99.181.88.186.1935: Flags [.], seq 140046:141360, ack 1, win 501, options [nop,nop,TS val 26771459 ecr 3617207362], length 1314
20:16:04.418630 IP 10.8.3.2.35624 > 99.181.88.186.1935: Flags [.], seq 141360:142674, ack 1, win 501, options [nop,nop,TS val 26771502 ecr 3617207362], length 1314
20:16:04.423432 IP 99.181.88.186.1935 > 10.8.3.2.35624: Flags [.], ack 133638, win 126, options [nop,nop,TS val 3617207458 ecr 26771138], length 0
20:16:04.452406 IP 10.8.3.2.35624 > 99.181.88.186.1935: Flags [.], seq 142674:143988, ack 1, win 501, options [nop,nop,TS val 26771536 ecr 3617207458], length 1314
20:16:04.493418 IP 99.181.88.186.1935 > 10.8.3.2.35624: Flags [.], ack 136266, win 126, options [nop,nop,TS val 3617207528 ecr 26771234], length 0
20:16:04.504256 IP 10.8.3.2.35624 > 99.181.88.186.1935: Flags [.], seq 143988:145302, ack 1, win 501, options [nop,nop,TS val 26771588 ecr 3617207528], length 1314
20:16:04.548708 IP 10.8.3.2.35624 > 99.181.88.186.1935: Flags [.], seq 145302:146616, ack 1, win 501, options [nop,nop,TS val 26771632 ecr 3617207528], length 1314
20:16:04.558123 IP 99.181.88.186.1935 > 10.8.3.2.35624: Flags [.], ack 137418, win 126, options [nop,nop,TS val 3617207593 ecr 26771334], length 0
20:16:04.558140 IP 10.8.3.2.35624 > 99.181.88.186.1935: Flags [P.], seq 146616:147227, ack 1, win 501, options [nop,nop,TS val 26771641 ecr 3617207593], length 611
20:16:04.619410 IP 10.8.3.2.35624 > 99.181.88.186.1935: Flags [.], seq 147227:148541, ack 1, win 501, options [nop,nop,TS val 26771703 ecr 3617207593], length 1314
20:16:04.625804 IP 99.181.88.186.1935 > 10.8.3.2.35624: Flags [.], ack 140046, win 126, options [nop,nop,TS val 3617207660 ecr 26771367], length 0
20:16:04.652508 IP 10.8.3.2.35624 > 99.181.88.186.1935: Flags [.], seq 148541:149855, ack 1, win 501, options [nop,nop,TS val 26771736 ecr 3617207660], length 1314
20:16:04.683376 IP 10.8.3.2.35624 > 99.181.88.186.1935: Flags [.], seq 149855:151169, ack 1, win 501, options [nop,nop,TS val 26771767 ecr 3617207660], length 1314
20:16:04.726707 IP 99.181.88.186.1935 > 10.8.3.2.35624: Flags [.], ack 142674, win 126, options [nop,nop,TS val 3617207761 ecr 26771459], length 0
20:16:04.752655 IP 10.8.3.2.35624 > 99.181.88.186.1935: Flags [.], seq 151169:152483, ack 1, win 501, options [nop,nop,TS val 26771836 ecr 3617207761], length 1314
20:16:04.785724 IP 10.8.3.2.35624 > 99.181.88.186.1935: Flags [.], seq 152483:153797, ack 1, win 501, options [nop,nop,TS val 26771869 ecr 3617207761], length 1314
20:16:04.811557 IP 99.181.88.186.1935 > 10.8.3.2.35624: Flags [.], ack 145302, win 126, options [nop,nop,TS val 3617207846 ecr 26771536], length 0
20:16:04.815923 IP 10.8.3.2.35624 > 99.181.88.186.1935: Flags [.], seq 153797:155111, ack 1, win 501, options [nop,nop,TS val 26771899 ecr 3617207846], length 1314
20:16:04.865387 IP 99.181.88.186.1935 > 10.8.3.2.35624: Flags [.], ack 147227, win 126, options [nop,nop,TS val 3617207900 ecr 26771632], length 0
20:16:04.865404 IP 10.8.3.2.35624 > 99.181.88.186.1935: Flags [P.], seq 155111:156179, ack 1, win 501, options [nop,nop,TS val 26771949 ecr 3617207900], length 1068
20:16:04.915080 IP 10.8.3.2.35624 > 99.181.88.186.1935: Flags [.], seq 156179:157493, ack 1, win 501, options [nop,nop,TS val 26771998 ecr 3617207900], length 1314
20:16:04.950869 IP 10.8.3.2.35624 > 99.181.88.186.1935: Flags [.], seq 157493:158807, ack 1, win 501, options [nop,nop,TS val 26772034 ecr 3617207900], length 1314
20:16:04.960850 IP 99.181.88.186.1935 > 10.8.3.2.35624: Flags [.], ack 149855, win 126, options [nop,nop,TS val 3617207994 ecr 26771703], length 0
20:16:04.986773 IP 10.8.3.2.35624 > 99.181.88.186.1935: Flags [.], seq 158807:160121, ack 1, win 501, options [nop,nop,TS val 26772070 ecr 3617207994], length 1314
20:16:05.050280 IP 10.8.3.2.35624 > 99.181.88.186.1935: Flags [.], seq 160121:161435, ack 1, win 501, options [nop,nop,TS val 26772134 ecr 3617207994], length 1314
20:16:05.060569 IP 99.181.88.186.1935 > 10.8.3.2.35624: Flags [.], ack 152483, win 126, options [nop,nop,TS val 3617208094 ecr 26771767], length 0
20:16:05.084375 IP 10.8.3.2.35624 > 99.181.88.186.1935: Flags [.], seq 161435:162749, ack 1, win 501, options [nop,nop,TS val 26772168 ecr 3617208094], length 1314
20:16:05.118902 IP 10.8.3.2.35624 > 99.181.88.186.1935: Flags [.], seq 162749:164063, ack 1, win 501, options [nop,nop,TS val 26772202 ecr 3617208094], length 1314
20:16:05.123353 IP 99.181.88.186.1935 > 10.8.3.2.35624: Flags [.], ack 155111, win 126, options [nop,nop,TS val 3617208158 ecr 26771869], length 0
20:16:05.173401 IP 99.181.88.186.1935 > 10.8.3.2.35624: Flags [.], ack 156179, win 126, options [nop,nop,TS val 3617208207 ecr 26771949], length 0
20:16:05.173437 IP 10.8.3.2.35624 > 99.181.88.186.1935: Flags [P.], seq 164063:165228, ack 1, win 501, options [nop,nop,TS val 26772257 ecr 3617208207], length 1165
20:16:05.219796 IP 10.8.3.2.35624 > 99.181.88.186.1935: Flags [.], seq 165228:166542, ack 1, win 501, options [nop,nop,TS val 26772303 ecr 3617208207], length 1314
20:16:05.252469 IP 10.8.3.2.35624 > 99.181.88.186.1935: Flags [.], seq 166542:167856, ack 1, win 501, options [nop,nop,TS val 26772336 ecr 3617208207], length 1314
20:16:05.258121 IP 99.181.88.186.1935 > 10.8.3.2.35624: Flags [.], ack 158807, win 126, options [nop,nop,TS val 3617208293 ecr 26771998], length 0
20:16:05.295590 IP 10.8.3.2.35624 > 99.181.88.186.1935: Flags [.], seq 167856:169170, ack 1, win 501, options [nop,nop,TS val 26772379 ecr 3617208293], length 1314
20:16:05.351162 IP 10.8.3.2.35624 > 99.181.88.186.1935: Flags [.], seq 169170:170484, ack 1, win 501, options [nop,nop,TS val 26772434 ecr 3617208293], length 1314
20:16:05.357650 IP 99.181.88.186.1935 > 10.8.3.2.35624: Flags [.], ack 161435, win 126, options [nop,nop,TS val 3617208392 ecr 26772070], length 0
20:16:05.385745 IP 10.8.3.2.35624 > 99.181.88.186.1935: Flags [.], seq 170484:171798, ack 1, win 501, options [nop,nop,TS val 26772469 ecr 3617208392], length 1314
20:16:05.424498 IP 10.8.3.2.35624 > 99.181.88.186.1935: Flags [.], seq 171798:173112, ack 1, win 501, options [nop,nop,TS val 26772508 ecr 3617208392], length 1314
20:16:05.426214 IP 99.181.88.186.1935 > 10.8.3.2.35624: Flags [.], ack 164063, win 126, options [nop,nop,TS val 3617208461 ecr 26772168], length 0
20:16:05.481334 IP 99.181.88.186.1935 > 10.8.3.2.35624: Flags [.], ack 165228, win 126, options [nop,nop,TS val 3617208515 ecr 26772257], length 0
20:16:05.481377 IP 10.8.3.2.35624 > 99.181.88.186.1935: Flags [P.], seq 173112:174189, ack 1, win 501, options [nop,nop,TS val 26772565 ecr 3617208515], length 1077
20:16:05.519444 IP 10.8.3.2.35624 > 99.181.88.186.1935: Flags [.], seq 174189:175503, ack 1, win 501, options [nop,nop,TS val 26772603 ecr 3617208515], length 1314
20:16:05.553377 IP 10.8.3.2.35624 > 99.181.88.186.1935: Flags [.], seq 175503:176817, ack 1, win 501, options [nop,nop,TS val 26772637 ecr 3617208515], length 1314
20:16:05.560056 IP 99.181.88.186.1935 > 10.8.3.2.35624: Flags [.], ack 167856, win 126, options [nop,nop,TS val 3617208594 ecr 26772303], length 0
20:16:05.596339 IP 10.8.3.2.35624 > 99.181.88.186.1935: Flags [.], seq 176817:178131, ack 1, win 501, options [nop,nop,TS val 26772680 ecr 3617208594], length 1314
20:16:05.651491 IP 10.8.3.2.35624 > 99.181.88.186.1935: Flags [.], seq 178131:179445, ack 1, win 501, options [nop,nop,TS val 26772735 ecr 3617208594], length 1314
20:16:05.658596 IP 99.181.88.186.1935 > 10.8.3.2.35624: Flags [.], ack 170484, win 126, options [nop,nop,TS val 3617208693 ecr 26772379], length 0
20:16:05.685328 IP 10.8.3.2.35624 > 99.181.88.186.1935: Flags [.], seq 179445:180759, ack 1, win 501, options [nop,nop,TS val 26772769 ecr 3617208693], length 1314
20:16:05.724794 IP 10.8.3.2.35624 > 99.181.88.186.1935: Flags [.], seq 180759:182073, ack 1, win 501, options [nop,nop,TS val 26772808 ecr 3617208693], length 1314
20:16:05.732885 IP 99.181.88.186.1935 > 10.8.3.2.35624: Flags [.], ack 173112, win 126, options [nop,nop,TS val 3617208766 ecr 26772469], length 0
20:16:05.785103 IP 10.8.3.2.35624 > 99.181.88.186.1935: Flags [.], seq 182073:183387, ack 1, win 501, options [nop,nop,TS val 26772868 ecr 3617208766], length 1314
20:16:05.789880 IP 99.181.88.186.1935 > 10.8.3.2.35624: Flags [.], ack 174189, win 126, options [nop,nop,TS val 3617208823 ecr 26772565], length 0
20:16:05.789913 IP 10.8.3.2.35624 > 99.181.88.186.1935: Flags [P.], seq 183387:184076, ack 1, win 501, options [nop,nop,TS val 26772873 ecr 3617208823], length 689
20:16:05.850735 IP 10.8.3.2.35624 > 99.181.88.186.1935: Flags [.], seq 184076:185390, ack 1, win 501, options [nop,nop,TS val 26772934 ecr 3617208823], length 1314
20:16:05.861814 IP 99.181.88.186.1935 > 10.8.3.2.35624: Flags [.], ack 176817, win 126, options [nop,nop,TS val 3617208895 ecr 26772603], length 0
20:16:05.874560 IP 10.8.3.2.35624 > 99.181.88.186.1935: Flags [.], seq 185390:186704, ack 1, win 501, options [nop,nop,TS val 26772958 ecr 3617208895], length 1314
20:16:05.916727 IP 10.8.3.2.35624 > 99.181.88.186.1935: Flags [.], seq 186704:188018, ack 1, win 501, options [nop,nop,TS val 26773000 ecr 3617208895], length 1314
20:16:05.958837 IP 99.181.88.186.1935 > 10.8.3.2.35624: Flags [.], ack 179445, win 126, options [nop,nop,TS val 3617208993 ecr 26772680], length 0
20:16:05.981655 IP 10.8.3.2.35624 > 99.181.88.186.1935: Flags [.], seq 188018:189332, ack 1, win 501, options [nop,nop,TS val 26773065 ecr 3617208993], length 1314
20:16:06.003135 IP 10.8.3.2.35624 > 99.181.88.186.1935: Flags [.], seq 189332:190646, ack 1, win 501, options [nop,nop,TS val 26773086 ecr 3617208993], length 1314
20:16:06.032262 IP 99.181.88.186.1935 > 10.8.3.2.35624: Flags [.], ack 182073, win 126, options [nop,nop,TS val 3617209067 ecr 26772769], length 0
20:16:06.046011 IP 10.8.3.2.35624 > 99.181.88.186.1935: Flags [.], seq 190646:191960, ack 1, win 501, options [nop,nop,TS val 26773129 ecr 3617209067], length 1314
20:16:06.097202 IP 99.181.88.186.1935 > 10.8.3.2.35624: Flags [.], ack 184076, win 126, options [nop,nop,TS val 3617209132 ecr 26772868], length 0
20:16:06.097243 IP 10.8.3.2.35624 > 99.181.88.186.1935: Flags [P.], seq 191960:193128, ack 1, win 501, options [nop,nop,TS val 26773181 ecr 3617209132], length 1168
20:16:06.151011 IP 10.8.3.2.35624 > 99.181.88.186.1935: Flags [.], seq 193128:194442, ack 1, win 501, options [nop,nop,TS val 26773234 ecr 3617209132], length 1314
20:16:06.174533 IP 10.8.3.2.35624 > 99.181.88.186.1935: Flags [.], seq 194442:195756, ack 1, win 501, options [nop,nop,TS val 26773258 ecr 3617209132], length 1314
20:16:06.182045 IP 99.181.88.186.1935 > 10.8.3.2.35624: Flags [.], ack 186704, win 126, options [nop,nop,TS val 3617209216 ecr 26772934], length 0
20:16:06.218854 IP 10.8.3.2.35624 > 99.181.88.186.1935: Flags [.], seq 195756:197070, ack 1, win 501, options [nop,nop,TS val 26773302 ecr 3617209216], length 1314
20:16:06.281683 IP 10.8.3.2.35624 > 99.181.88.186.1935: Flags [.], seq 197070:198384, ack 1, win 501, options [nop,nop,TS val 26773365 ecr 3617209216], length 1314
20:16:06.289641 IP 99.181.88.186.1935 > 10.8.3.2.35624: Flags [.], ack 189332, win 126, options [nop,nop,TS val 3617209324 ecr 26773000], length 0
20:16:06.302981 IP 10.8.3.2.35624 > 99.181.88.186.1935: Flags [.], seq 198384:199698, ack 1, win 501, options [nop,nop,TS val 26773386 ecr 3617209324], length 1314
20:16:06.352524 IP 10.8.3.2.35624 > 99.181.88.186.1935: Flags [.], seq 199698:201012, ack 1, win 501, options [nop,nop,TS val 26773436 ecr 3617209324], length 1314
20:16:06.353376 IP 99.181.88.186.1935 > 10.8.3.2.35624: Flags [.], ack 191960, win 126, options [nop,nop,TS val 3617209388 ecr 26773086], length 0
20:16:06.404814 IP 99.181.88.186.1935 > 10.8.3.2.35624: Flags [.], ack 193128, win 126, options [nop,nop,TS val 3617209439 ecr 26773181], length 0
20:16:06.404844 IP 10.8.3.2.35624 > 99.181.88.186.1935: Flags [P.], seq 201012:202085, ack 1, win 501, options [nop,nop,TS val 26773488 ecr 3617209439], length 1073
20:16:06.450573 IP 10.8.3.2.35624 > 99.181.88.186.1935: Flags [.], seq 202085:203399, ack 1, win 501, options [nop,nop,TS val 26773534 ecr 3617209439], length 1314
20:16:06.474349 IP 10.8.3.2.35624 > 99.181.88.186.1935: Flags [.], seq 203399:204713, ack 1, win 501, options [nop,nop,TS val 26773558 ecr 3617209439], length 1314
20:16:06.482839 IP 99.181.88.186.1935 > 10.8.3.2.35624: Flags [.], ack 195756, win 126, options [nop,nop,TS val 3617209516 ecr 26773234], length 0
20:16:06.517885 IP 10.8.3.2.35624 > 99.181.88.186.1935: Flags [.], seq 204713:206027, ack 1, win 501, options [nop,nop,TS val 26773601 ecr 3617209516], length 1314
20:16:06.581411 IP 10.8.3.2.35624 > 99.181.88.186.1935: Flags [.], seq 206027:207341, ack 1, win 501, options [nop,nop,TS val 26773665 ecr 3617209516], length 1314
20:16:06.589909 IP 99.181.88.186.1935 > 10.8.3.2.35624: Flags [.], ack 198384, win 126, options [nop,nop,TS val 3617209624 ecr 26773302], length 0
20:16:06.618587 IP 10.8.3.2.35624 > 99.181.88.186.1935: Flags [.], seq 207341:208655, ack 1, win 501, options [nop,nop,TS val 26773702 ecr 3617209624], length 1314
