08:42:59.986878 IP 10.8.3.3.36984 > 45.113.130.199.1935: Flags [.], seq 3384931306:3384932620, ack 2622768727, win 501, options [nop,nop,TS val 798203279 ecr 858974216], length 1314
08:43:00.033895 IP 45.113.130.199.1935 > 10.8.3.3.36984: Flags [.], ack 4294957113, win 126, options [nop,nop,TS val 858974316 ecr 798202856], length 0
08:43:00.049742 IP 10.8.3.3.36984 > 45.113.130.199.1935: Flags [.], seq 1314:2628, ack 1, win 501, options [nop,nop,TS val 798203342 ecr 858974316], length 1314
08:43:00.085073 IP 10.8.3.3.36984 > 45.113.130.199.1935: Flags [.], seq 2628:3942, ack 1, win 501, options [nop,nop,TS val 798203377 ecr 858974316], length 1314
08:43:00.108602 IP 45.113.130.199.1935 > 10.8.3.3.36984: Flags [.], ack 4294959741, win 126, options [nop,nop,TS val 858974390 ecr 798202941], length 0
08:43:00.119920 IP 10.8.3.3.36984 > 45.113.130.199.1935: Flags [.], seq 3942:5256, ack 1, win 501, options [nop,nop,TS val 798203412 ecr 858974390], length 1314
08:43:00.183772 IP 10.8.3.3.36984 > 45.113.130.199.1935: Flags [.], seq 5256:6570, ack 1, win 501, options [nop,nop,TS val 798203476 ecr 858974390], length 1314
08:43:00.203683 IP 45.113.130.199.1935 > 10.8.3.3.36984: Flags [.], ack 4294962369, win 126, options [nop,nop,TS val 858974486 ecr 798203046], length 0
08:43:00.220042 IP 10.8.3.3.36984 > 45.113.130.199.1935: Flags [.], seq 6570:7884, ack 1, win 501, options [nop,nop,TS val 798203512 ecr 858974486], length 1314
08:43:00.254157 IP 10.8.3.3.36984 > 45.113.130.199.1935: Flags [.], seq 7884:9198, ack 1, win 501, options [nop,nop,TS val 798203546 ecr 858974486], length 1314
08:43:00.279883 IP 45.113.130.199.1935 > 10.8.3.3.36984: Flags [.], ack 4294964668, win 126, options [nop,nop,TS val 858974562 ecr 798203113], length 0
08:43:00.279905 IP 10.8.3.3.36984 > 45.113.130.199.1935: Flags [P.], seq 9198:9444, ack 1, win 501, options [nop,nop,TS val 798203572 ecr 858974562], length 246
08:43:00.317689 IP 10.8.3.3.36984 > 45.113.130.199.1935: Flags [.], seq 9444:10758, ack 1, win 501, options [nop,nop,TS val 798203610 ecr 858974562], length 1314
08:43:00.352249 IP 10.8.3.3.36984 > 45.113.130.199.1935: Flags [.], seq 10758:12072, ack 1, win 501, options [nop,nop,TS val 798203645 ecr 858974562], length 1314
08:43:00.365578 IP 45.113.130.199.1935 > 10.8.3.3.36984: Flags [.], ack 0, win 126, options [nop,nop,TS val 858974647 ecr 798203210], length 0
08:43:00.397358 IP 10.8.3.3.36984 > 45.113.130.199.1935: Flags [.], seq 12072:13386, ack 1, win 501, options [nop,nop,TS val 798203690 ecr 858974647], length 1314
08:43:00.451478 IP 10.8.3.3.36984 > 45.113.130.199.1935: Flags [.], seq 13386:14700, ack 1, win 501, options [nop,nop,TS val 798203744 ecr 858974647], length 1314
08:43:00.465890 IP 45.113.130.199.1935 > 10.8.3.3.36984: Flags [.], ack 2628, win 126, options [nop,nop,TS val 858974748 ecr 798203279], length 0
08:43:00.482736 IP 10.8.3.3.36984 > 45.113.130.199.1935: Flags [.], seq 14700:16014, ack 1, win 501, options [nop,nop,TS val 798203775 ecr 858974748], length 1314
08:43:00.524957 IP 10.8.3.3.36984 > 45.113.130.199.1935: Flags [.], seq 16014:17328, ack 1, win 501, options [nop,nop,TS val 798203817 ecr 858974748], length 1314
08:43:00.536088 IP 45.113.130.199.1935 > 10.8.3.3.36984: Flags [.], ack 5256, win 126, options [nop,nop,TS val 858974818 ecr 798203377], length 0
08:43:00.583254 IP 10.8.3.3.36984 > 45.113.130.199.1935: Flags [.], seq 17328:18642, ack 1, win 501, options [nop,nop,TS val 798203876 ecr 858974818], length 1314
08:43:00.620075 IP 10.8.3.3.36984 > 45.113.130.199.1935: Flags [.], seq 18642:19956, ack 1, win 501, options [nop,nop,TS val 798203912 ecr 858974818], length 1314
08:43:00.636635 IP 45.113.130.199.1935 > 10.8.3.3.36984: Flags [.], ack 7884, win 126, options [nop,nop,TS val 858974918 ecr 798203476], length 0
08:43:00.653813 IP 10.8.3.3.36984 > 45.113.130.199.1935: Flags [.], seq 19956:21270, ack 1, win 501, options [nop,nop,TS val 798203946 ecr 858974918], length 1314
08:43:00.695925 IP 45.113.130.199.1935 > 10.8.3.3.36984: Flags [.], ack 9444, win 126, options [nop,nop,TS val 858974978 ecr 798203546], length 0
08:43:00.695964 IP 10.8.3.3.36984 > 45.113.130.199.1935: Flags [P.], seq 21270:22349, ack 1, win 501, options [nop,nop,TS val 798203988 ecr 858974978], length 1079
08:43:00.750701 IP 10.8.3.3.36984 > 45.113.130.199.1935: Flags [.], seq 22349:23663, ack 1, win 501, options [nop,nop,TS val 798204043 ecr 858974978], length 1314
08:43:00.768464 IP 45.113.130.199.1935 > 10.8.3.3.36984: Flags [.], ack 12072, win 126, options [nop,nop,TS val 858975050 ecr 798203610], length 0
08:43:00.784488 IP 10.8.3.3.36984 > 45.113.130.199.1935: Flags [.], seq 23663:24977, ack 1, win 501, options [nop,nop,TS val 798204077 ecr 858975050], length 1314
08:43:00.823576 IP 10.8.3.3.36984 > 45.113.130.199.1935: Flags [.], seq 24977:26291, ack 1, win 501, options [nop,nop,TS val 798204116 ecr 858975050], length 1314
08:43:00.867477 IP 45.113.130.199.1935 > 10.8.3.3.36984: Flags [.], ack 14700, win 126, options [nop,nop,TS val 858975149 ecr 798203690], length 0
08:43:00.886271 IP 10.8.3.3.36984 > 45.113.130.199.1935: Flags [.], seq 26291:27605, ack 1, win 501, options [nop,nop,TS val 798204179 ecr 858975149], length 1314
08:43:00.920634 IP 10.8.3.3.36984 > 45.113.130.199.1935: Flags [.], seq 27605:28919, ack 1, win 501, options [nop,nop,TS val 798204213 ecr 858975149], length 1314
08:43:00.941139 IP 45.113.130.199.1935 > 10.8.3.3.36984: Flags [.], ack 17328, win 126, options [nop,nop,TS val 858975223 ecr 798203775], length 0
08:43:00.952091 IP 10.8.3.3.36984 > 45.113.130.199.1935: Flags [.], seq 28919:30233, ack 1, win 501, options [nop,nop,TS val 798204244 ecr 858975223], length 1314
08:43:01.016106 IP 10.8.3.3.36984 > 45.113.130.199.1935: Flags [.], seq 30233:31547, ack 1, win 501, options [nop,nop,TS val 798204308 ecr 858975223], length 1314
08:43:01.036092 IP 45.113.130.199.1935 > 10.8.3.3.36984: Flags [.], ack 19956, win 126, options [nop,nop,TS val 858975318 ecr 798203876], length 0
08:43:01.053718 IP 10.8.3.3.36984 > 45.113.130.199.1935: Flags [.], seq 31547:32861, ack 1, win 501, options [nop,nop,TS val 798204346 ecr 858975318], length 1314
08:43:01.087416 IP 10.8.3.3.36984 > 45.113.130.199.1935: Flags [.], seq 32861:34175, ack 1, win 501, options [nop,nop,TS val 798204380 ecr 858975318], length 1314
08:43:01.112124 IP 45.113.130.199.1935 > 10.8.3.3.36984: Flags [.], ack 22349, win 126, options [nop,nop,TS val 858975394 ecr 798203946], length 0
08:43:01.112169 IP 10.8.3.3.36984 > 45.113.130.199.1935: Flags [P.], seq 34175:34325, ack 1, win 501, options [nop,nop,TS val 798204404 ecr 858975394], length 150
08:43:01.152357 IP 10.8.3.3.36984 > 45.113.130.199.1935: Flags [.], seq 34325:35639, ack 1, win 501, options [nop,nop,TS val 798204445 ecr 858975394], length 1314
08:43:01.186061 IP 10.8.3.3.36984 > 45.113.130.199.1935: Flags [.], seq 35639:36953, ack 1, win 501, options [nop,nop,TS val 798204478 ecr 858975394], length 1314
08:43:01.200678 IP 45.113.130.199.1935 > 10.8.3.3.36984: Flags [.], ack 24977, win 126, options [nop,nop,TS val 858975483 ecr 798204043], length 0
08:43:01.229658 IP 10.8.3.3.36984 > 45.113.130.199.1935: Flags [.], seq 36953:38267, ack 1, win 501, options [nop,nop,TS val 798204522 ecr 858975483], length 1314
08:43:01.287015 IP 10.8.3.3.36984 > 45.113.130.199.1935: Flags [.], seq 38267:39581, ack 1, win 501, options [nop,nop,TS val 798204579 ecr 858975483], length 1314
08:43:01.302352 IP 45.113.130.199.1935 > 10.8.3.3.36984: Flags [.], ack 27605, win 126, options [nop,nop,TS val 858975584 ecr 798204116], length 0
08:43:01.321378 IP 10.8.3.3.36984 > 45.113.130.199.1935: Flags [.], seq 39581:40895, ack 1, win 501, options [nop,nop,TS val 798204614 ecr 858975584], length 1314
08:43:01.358226 IP 10.8.3.3.36984 > 45.113.130.199.1935: Flags [.], seq 40895:42209, ack 1, win 501, options [nop,nop,TS val 798204651 ecr 858975584], length 1314
08:43:01.368275 IP 45.113.130.199.1935 > 10.8.3.3.36984: Flags [.], ack 30233, win 126, options [nop,nop,TS val 858975650 ecr 798204213], length 0
08:43:01.418831 IP 10.8.3.3.36984 > 45.113.130.199.1935: Flags [.], seq 42209:43523, ack 1, win 501, options [nop,nop,TS val 798204711 ecr 858975650], length 1314
08:43:01.453732 IP 10.8.3.3.36984 > 45.113.130.199.1935: Flags [.], seq 43523:44837, ack 1, win 501, options [nop,nop,TS val 798204746 ecr 858975650], length 1314
08:43:01.470634 IP 45.113.130.199.1935 > 10.8.3.3.36984: Flags [.], ack 32861, win 126, options [nop,nop,TS val 858975752 ecr 798204308], length 0
08:43:01.486833 IP 10.8.3.3.36984 > 45.113.130.199.1935: Flags [.], seq 44837:46151, ack 1, win 501, options [nop,nop,TS val 798204779 ecr 858975752], length 1314
08:43:01.528780 IP 45.113.130.199.1935 > 10.8.3.3.36984: Flags [.], ack 34325, win 126, options [nop,nop,TS val 858975810 ecr 798204380], length 0
08:43:01.528816 IP 10.8.3.3.36984 > 45.113.130.199.1935: Flags [P.], seq 46151:47139, ack 1, win 501, options [nop,nop,TS val 798204821 ecr 858975810], length 988
08:43:01.584723 IP 10.8.3.3.36984 > 45.113.130.199.1935: Flags [.], seq 47139:48453, ack 1, win 501, options [nop,nop,TS val 798204877 ecr 858975810], length 1314
08:43:01.602141 IP 45.113.130.199.1935 > 10.8.3.3.36984: Flags [.], ack 36953, win 126, options [nop,nop,TS val 858975884 ecr 798204445], length 0
08:43:01.616045 IP 10.8.3.3.36984 > 45.113.130.199.1935: Flags [.], seq 48453:49767, ack 1, win 501, options [nop,nop,TS val 798204908 ecr 858975884], length 1314
08:43:01.649566 IP 10.8.3.3.36984 > 45.113.130.199.1935: Flags [.], seq 49767:51081, ack 1, win 501, options [nop,nop,TS val 798204942 ecr 858975884], length 1314
08:43:01.703278 IP 45.113.130.199.1935 > 10.8.3.3.36984: Flags [.], ack 39581, win 126, options [nop,nop,TS val 858975985 ecr 798204522], length 0
08:43:01.720595 IP 10.8.3.3.36984 > 45.113.130.199.1935: Flags [.], seq 51081:52395, ack 1, win 501, options [nop,nop,TS val 798205013 ecr 858975985], length 1314
08:43:01.754555 IP 10.8.3.3.36984 > 45.113.130.199.1935: Flags [.], seq 52395:53709, ack 1, win 501, options [nop,nop,TS val 798205047 ecr 858975985], length 1314
08:43:01.774485 IP 45.113.130.199.1935 > 10.8.3.3.36984: Flags [.], ack 42209, win 126, options [nop,nop,TS val 858976056 ecr 798204614], length 0
08:43:01.784287 IP 10.8.3.3.36984 > 45.113.130.199.1935: Flags [.], seq 53709:55023, ack 1, win 501, options [nop,nop,TS val 798205077 ecr 858976056], length 1314
08:43:01.852632 IP 10.8.3.3.36984 > 45.113.130.199.1935: Flags [.], seq 55023:56337, ack 1, win 501, options [nop,nop,TS val 798205145 ecr 858976056], length 1314
08:43:01.870013 IP 45.113.130.199.1935 > 10.8.3.3.36984: Flags [.], ack 44837, win 126, options [nop,nop,TS val 858976152 ecr 798204711], length 0
08:43:01.885614 IP 10.8.3.3.36984 > 45.113.130.199.1935: Flags [.], seq 56337:57651, ack 1, win 501, options [nop,nop,TS val 798205178 ecr 858976152], length 1314
08:43:01.919185 IP 10.8.3.3.36984 > 45.113.130.199.1935: Flags [.], seq 57651:58965, ack 1, win 501, options [nop,nop,TS val 798205211 ecr 858976152], length 1314
08:43:01.944756 IP 45.113.130.199.1935 > 10.8.3.3.36984: Flags [.], ack 47139, win 126, options [nop,nop,TS val 858976227 ecr 798204779], length 0
08:43:01.944789 IP 10.8.3.3.36984 > 45.113.130.199.1935: Flags [P.], seq 58965:59206, ack 1, win 501, options [nop,nop,TS val 798205237 ecr 858976227], length 241
08:43:01.985943 IP 10.8.3.3.36984 > 45.113.130.199.1935: Flags [.], seq 59206:60520, ack 1, win 501, options [nop,nop,TS val 798205278 ecr 858976227], length 1314
08:43:02.019394 IP 10.8.3.3.36984 > 45.113.130.199.1935: Flags [.], seq 60520:61834, ack 1, win 501, options [nop,nop,TS val 798205312 ecr 858976227], length 1314
08:43:02.031978 IP 45.113.130.199.1935 > 10.8.3.3.36984: Flags [.], ack 49767, win 126, options [nop,nop,TS val 858976314 ecr 798204877], length 0
08:43:02.063490 IP 10.8.3.3.36984 > 45.113.130.199.1935: Flags [.], seq 61834:63148, ack 1, win 501, options [nop,nop,TS val 798205356 ecr 858976314], length 1314
08:43:02.120392 IP 10.8.3.3.36984 > 45.113.130.199.1935: Flags [.], seq 63148:64462, ack 1, win 501, options [nop,nop,TS val 798205413 ecr 858976314], length 1314
08:43:02.136912 IP 45.113.130.199.1935 > 10.8.3.3.36984: Flags [.], ack 52395, win 126, options [nop,nop,TS val 858976419 ecr 798204942], length 0
08:43:02.153851 IP 10.8.3.3.36984 > 45.113.130.199.1935: Flags [.], seq 64462:65776, ack 1, win 501, options [nop,nop,TS val 798205446 ecr 858976419], length 1314
08:43:02.191827 IP 10.8.3.3.36984 > 45.113.130.199.1935: Flags [.], seq 65776:67090, ack 1, win 501, options [nop,nop,TS val 798205484 ecr 858976419], length 1314
08:43:02.200349 IP 45.113.130.199.1935 > 10.8.3.3.36984: Flags [.], ack 55023, win 126, options [nop,nop,TS val 858976482 ecr 798205047], length 0
08:43:02.251525 IP 10.8.3.3.36984 > 45.113.130.199.1935: Flags [.], seq 67090:68404, ack 1, win 501, options [nop,nop,TS val 798205544 ecr 858976482], length 1314
08:43:02.282869 IP 10.8.3.3.36984 > 45.113.130.199.1935: Flags [.], seq 68404:69718, ack 1, win 501, options [nop,nop,TS val 798205575 ecr 858976482], length 1314
08:43:02.301733 IP 45.113.130.199.1935 > 10.8.3.3.36984: Flags [.], ack 57651, win 126, options [nop,nop,TS val 858976584 ecr 798205145], length 0
08:43:02.319277 IP 10.8.3.3.36984 > 45.113.130.199.1935: Flags [.], seq 69718:71032, ack 1, win 501, options [nop,nop,TS val 798205612 ecr 858976584], length 1314
08:43:02.360625 IP 45.113.130.199.1935 > 10.8.3.3.36984: Flags [.], ack 59206, win 126, options [nop,nop,TS val 858976642 ecr 798205211], length 0
08:43:02.360664 IP 10.8.3.3.36984 > 45.113.130.199.1935: Flags [P.], seq 71032:72022, ack 1, win 501, options [nop,nop,TS val 798205653 ecr 858976642], length 990
08:43:02.416246 IP 10.8.3.3.36984 > 45.113.130.199.1935: Flags [.], seq 72022:73336, ack 1, win 501, options [nop,nop,TS val 798205709 ecr 858976642], length 1314
08:43:02.435360 IP 45.113.130.199.1935 > 10.8.3.3.36984: Flags [.], ack 61834, win 126, options [nop,nop,TS val 858976717 ecr 798205278], length 0
08:43:02.450394 IP 10.8.3.3.36984 > 45.113.130.199.1935: Flags [.], seq 73336:74650, ack 1, win 501, options [nop,nop,TS val 798205743 ecr 858976717], length 1314
08:43:02.487124 IP 10.8.3.3.36984 > 45.113.130.199.1935: Flags [.], seq 74650:75964, ack 1, win 501, options [nop,nop,TS val 798205779 ecr 858976717], length 1314
08:43:02.536566 IP 45.113.130.199.1935 > 10.8.3.3.36984: Flags [.], ack 64462, win 126, options [nop,nop,TS val 858976818 ecr 798205356], length 0
08:43:02.553728 IP 10.8.3.3.36984 > 45.113.130.199.1935: Flags [.], seq 75964:77278, ack 1, win 501, options [nop,nop,TS val 798205846 ecr 858976818], length 1314
08:43:02.584407 IP 10.8.3.3.36984 > 45.113.130.199.1935: Flags [.], seq 77278:78592, ack 1, win 501, options [nop,nop,TS val 798205877 ecr 858976818], length 1314
08:43:02.607727 IP 45.113.130.199.1935 > 10.8.3.3.36984: Flags [.], ack 67090, win 126, options [nop,nop,TS val 858976890 ecr 798205446], length 0
08:43:02.617376 IP 10.8.3.3.36984 > 45.113.130.199.1935: Flags [.], seq 78592:79906, ack 1, win 501, options [nop,nop,TS val 798205910 ecr 858976890], length 1314
08:43:02.682948 IP 10.8.3.3.36984 > 45.113.130.199.1935: Flags [.], seq 79906:81220, ack 1, win 501, options [nop,nop,TS val 798205975 ecr 858976890], length 1314
08:43:02.698748 IP 45.113.130.199.1935 > 10.8.3.3.36984: Flags [.], ack 69718, win 126, options [nop,nop,TS val 858976981 ecr 798205544], length 0
08:43:02.717367 IP 10.8.3.3.36984 > 45.113.130.199.1935: Flags [.], seq 81220:82534, ack 1, win 501, options [nop,nop,TS val 798206010 ecr 858976981], length 1314
08:43:02.753468 IP 10.8.3.3.36984 > 45.113.130.199.1935: Flags [.], seq 82534:83848, ack 1, win 501, options [nop,nop,TS val 798206046 ecr 858976981], length 1314
08:43:02.776618 IP 45.113.130.199.1935 > 10.8.3.3.36984: Flags [.], ack 72022, win 126, options [nop,nop,TS val 858977058 ecr 798205612], length 0
08:43:02.776653 IP 10.8.3.3.36984 > 45.113.130.199.1935: Flags [P.], seq 83848:84089, ack 1, win 501, options [nop,nop,TS val 798206069 ecr 858977058], length 241
08:43:02.820408 IP 10.8.3.3.36984 > 45.113.130.199.1935: Flags [.], seq 84089:85403, ack 1, win 501, options [nop,nop,TS val 798206113 ecr 858977058], length 1314
08:43:02.851190 IP 10.8.3.3.36984 > 45.113.130.199.1935: Flags [.], seq 85403:86717, ack 1, win 501, options [nop,nop,TS val 798206144 ecr 858977058], length 1314
08:43:02.867331 IP 45.113.130.199.1935 > 10.8.3.3.36984: Flags [.], ack 74650, win 126, options [nop,nop,TS val 858977148 ecr 798205709], length 0
08:43:02.896582 IP 10.8.3.3.36984 > 45.113.130.199.1935: Flags [.], seq 86717:88031, ack 1, win 501, options [nop,nop,TS val 798206189 ecr 858977148], length 1314
08:43:02.953760 IP 10.8.3.3.36984 > 45.113.130.199.1935: Flags [.], seq 88031:89345, ack 1, win 501, options [nop,nop,TS val 798206246 ecr 858977148], length 1314
08:43:02.969808 IP 45.113.130.199.1935 > 10.8.3.3.36984: Flags [.], ack 77278, win 126, options [nop,nop,TS val 858977252 ecr 798205779], length 0
08:43:02.986966 IP 10.8.3.3.36984 > 45.113.130.199.1935: Flags [.], seq 89345:90659, ack 1, win 501, options [nop,nop,TS val 798206279 ecr 858977252], length 1314
08:43:03.025232 IP 10.8.3.3.36984 > 45.113.130.199.1935: Flags [.], seq 90659:91973, ack 1, win 501, options [nop,nop,TS val 798206318 ecr 858977252], length 1314
08:43:03.033613 IP 45.113.130.199.1935 > 10.8.3.3.36984: Flags [.], ack 79906, win 126, options [nop,nop,TS val 858977315 ecr 798205877], length 0
08:43:03.087151 IP 10.8.3.3.36984 > 45.113.130.199.1935: Flags [.], seq 91973:93287, ack 1, win 501, options [nop,nop,TS val 798206379 ecr 858977315], length 1314
08:43:03.117850 IP 10.8.3.3.36984 > 45.113.130.199.1935: Flags [.], seq 93287:94601, ack 1, win 501, options [nop,nop,TS val 798206410 ecr 858977315], length 1314
08:43:03.133377 IP 45.113.130.199.1935 > 10.8.3.3.36984: Flags [.], ack 82534, win 126, options [nop,nop,TS val 858977415 ecr 798205975], length 0
08:43:03.153403 IP 10.8.3.3.36984 > 45.113.130.199.1935: Flags [.], seq 94601:95915, ack 1, win 501, options [nop,nop,TS val 798206446 ecr 858977415], length 1314
08:43:03.192556 IP 45.113.130.199.1935 > 10.8.3.3.36984: Flags [.], ack 84089, win 126, options [nop,nop,TS val 858977475 ecr 798206046], length 0
08:43:03.192591 IP 10.8.3.3.36984 > 45.113.130.199.1935: Flags [P.], seq 95915:96907, ack 1, win 501, options [nop,nop,TS val 798206485 ecr 858977475], length 992
08:43:03.253752 IP 10.8.3.3.36984 > 45.113.130.199.1935: Flags [.], seq 96907:98221, ack 1, win 501, options [nop,nop,TS val 798206546 ecr 858977475], length 1314
08:43:03.267346 IP 45.113.130.199.1935 > 10.8.3.3.36984: Flags [.], ack 86717, win 126, options [nop,nop,TS val 858977549 ecr 798206113], length 0
08:43:03.287032 IP 10.8.3.3.36984 > 45.113.130.199.1935: Flags [.], seq 98221:99535, ack 1, win 501, options [nop,nop,TS val 798206579 ecr 858977549], length 1314
08:43:03.320386 IP 10.8.3.3.36984 > 45.113.130.199.1935: Flags [.], seq 99535:100849, ack 1, win 501, options [nop,nop,TS val 798206613 ecr 858977549], length 1314
08:43:03.369729 IP 45.113.130.199.1935 > 10.8.3.3.36984: Flags [.], ack 89345, win 126, options [nop,nop,TS val 858977652 ecr 798206189], length 0
08:43:03.384384 IP 10.8.3.3.36984 > 45.113.130.199.1935: Flags [.], seq 100849:102163, ack 1, win 501, options [nop,nop,TS val 798206677 ecr 858977652], length 1314
08:43:03.417382 IP 10.8.3.3.36984 > 45.113.130.199.1935: Flags [.], seq 102163:103477, ack 1, win 501, options [nop,nop,TS val 798206710 ecr 858977652], length 1314
08:43:03.441549 IP 45.113.130.199.1935 > 10.8.3.3.36984: Flags [.], ack 91973, win 126, options [nop,nop,TS val 858977723 ecr 798206279], length 0
08:43:03.453214 IP 10.8.3.3.36984 > 45.113.130.199.1935: Flags [.], seq 103477:104791, ack 1, win 501, options [nop,nop,TS val 798206746 ecr 858977723], length 1314
08:43:03.520318 IP 10.8.3.3.36984 > 45.113.130.199.1935: Flags [.], seq 104791:106105, ack 1, win 501, options [nop,nop,TS val 798206813 ecr 858977723], length 1314
08:43:03.533753 IP 45.113.130.199.1935 > 10.8.3.3.36984: Flags [.], ack 94601, win 126, options [nop,nop,TS val 858977816 ecr 798206379], length 0
08:43:03.553632 IP 10.8.3.3.36984 > 45.113.130.199.1935: Flags [.], seq 106105:107419, ack 1, win 501, options [nop,nop,TS val 798206846 ecr 858977816], length 1314
08:43:03.583893 IP 10.8.3.3.36984 > 45.113.130.199.1935: Flags [.], seq 107419:108733, ack 1, win 501, options [nop,nop,TS val 798206876 ecr 858977816], length 1314
08:43:03.608592 IP 45.113.130.199.1935 > 10.8.3.3.36984: Flags [.], ack 96907, win 126, options [nop,nop,TS val 858977890 ecr 798206446], length 0
08:43:03.608630 IP 10.8.3.3.36984 > 45.113.130.199.1935: Flags [P.], seq 108733:108970, ack 1, win 501, options [nop,nop,TS val 798206901 ecr 858977890], length 237
08:43:03.651176 IP 10.8.3.3.36984 > 45.113.130.199.1935: Flags [.], seq 108970:110284, ack 1, win 501, options [nop,nop,TS val 798206943 ecr 858977890], length 1314
08:43:03.683480 IP 10.8.3.3.36984 > 45.113.130.199.1935: Flags [.], seq 110284:111598, ack 1, win 501, options [nop,nop,TS val 798206976 ecr 858977890], length 1314
08:43:03.703154 IP 45.113.130.199.1935 > 10.8.3.3.36984: Flags [.], ack 99535, win 126, options [nop,nop,TS val 858977985 ecr 798206546], length 0
08:43:03.730930 IP 10.8.3.3.36984 > 45.113.130.199.1935: Flags [.], seq 111598:112912, ack 1, win 501, options [nop,nop,TS val 798207023 ecr 858977985], length 1314
08:43:03.785227 IP 10.8.3.3.36984 > 45.113.130.199.1935: Flags [.], seq 112912:114226, ack 1, win 501, options [nop,nop,TS val 798207078 ecr 858977985], length 1314
08:43:03.800569 IP 45.113.130.199.1935 > 10.8.3.3.36984: Flags [.], ack 102163, win 126, options [nop,nop,TS val 858978082 ecr 798206613], length 0
08:43:03.820119 IP 10.8.3.3.36984 > 45.113.130.199.1935: Flags [.], seq 114226:115540, ack 1, win 501, options [nop,nop,TS val 798207112 ecr 858978082], length 1314
08:43:03.859178 IP 10.8.3.3.36984 > 45.113.130.199.1935: Flags [.], seq 115540:116854, ack 1, win 501, options [nop,nop,TS val 798207151 ecr 858978082], length 1314
08:43:03.869240 IP 45.113.130.199.1935 > 10.8.3.3.36984: Flags [.], ack 104791, win 126, options [nop,nop,TS val 858978151 ecr 798206710], length 0
08:43:03.916924 IP 10.8.3.3.36984 > 45.113.130.199.1935: Flags [.], seq 116854:118168, ack 1, win 501, options [nop,nop,TS val 798207209 ecr 858978151], length 1314
08:43:03.952674 IP 10.8.3.3.36984 > 45.113.130.199.1935: Flags [.], seq 118168:119482, ack 1, win 501, options [nop,nop,TS val 798207245 ecr 858978151], length 1314
08:43:03.970160 IP 45.113.130.199.1935 > 10.8.3.3.36984: Flags [.], ack 107419, win 126, options [nop,nop,TS val 858978252 ecr 798206813], length 0
08:43:03.987360 IP 10.8.3.3.36984 > 45.113.130.199.1935: Flags [.], seq 119482:120796, ack 1, win 501, options [nop,nop,TS val 798207280 ecr 858978252], length 1314
08:43:04.024524 IP 45.113.130.199.1935 > 10.8.3.3.36984: Flags [.], ack 108970, win 126, options [nop,nop,TS val 858978306 ecr 798206876], length 0
08:43:04.024564 IP 10.8.3.3.36984 > 45.113.130.199.1935: Flags [P.], seq 120796:121788, ack 1, win 501, options [nop,nop,TS val 798207317 ecr 858978306], length 992
08:43:04.085535 IP 10.8.3.3.36984 > 45.113.130.199.1935: Flags [.], seq 121788:123102, ack 1, win 501, options [nop,nop,TS val 798207378 ecr 858978306], length 1314
08:43:04.099405 IP 45.113.130.199.1935 > 10.8.3.3.36984: Flags [.], ack 111598, win 126, options [nop,nop,TS val 858978381 ecr 798206943], length 0
08:43:04.119579 IP 10.8.3.3.36984 > 45.113.130.199.1935: Flags [.], seq 123102:124416, ack 1, win 501, options [nop,nop,TS val 798207412 ecr 858978381], length 1314
08:43:04.153052 IP 10.8.3.3.36984 > 45.113.130.199.1935: Flags [.], seq 124416:125730, ack 1, win 501, options [nop,nop,TS val 798207445 ecr 858978381], length 1314
08:43:04.201418 IP 45.113.130.199.1935 > 10.8.3.3.36984: Flags [.], ack 114226, win 126, options [nop,nop,TS val 858978483 ecr 798207023], length 0
08:43:04.219617 IP 10.8.3.3.36984 > 45.113.130.199.1935: Flags [.], seq 125730:127044, ack 1, win 501, options [nop,nop,TS val 798207512 ecr 858978483], length 1314
08:43:04.252912 IP 10.8.3.3.36984 > 45.113.130.199.1935: Flags [.], seq 127044:128358, ack 1, win 501, options [nop,nop,TS val 798207545 ecr 858978483], length 1314
08:43:04.275612 IP 45.113.130.199.1935 > 10.8.3.3.36984: Flags [.], ack 116854, win 126, options [nop,nop,TS val 858978557 ecr 798207112], length 0
08:43:04.286542 IP 10.8.3.3.36984 > 45.113.130.199.1935: Flags [.], seq 128358:129672, ack 1, win 501, options [nop,nop,TS val 798207579 ecr 858978557], length 1314
08:43:04.351637 IP 10.8.3.3.36984 > 45.113.130.199.1935: Flags [.], seq 129672:130986, ack 1, win 501, options [nop,nop,TS val 798207644 ecr 858978557], length 1314
08:43:04.368981 IP 45.113.130.199.1935 > 10.8.3.3.36984: Flags [.], ack 119482, win 126, options [nop,nop,TS val 858978651 ecr 798207209], length 0
08:43:04.387041 IP 10.8.3.3.36984 > 45.113.130.199.1935: Flags [.], seq 130986:132300, ack 1, win 501, options [nop,nop,TS val 798207679 ecr 858978651], length 1314
08:43:04.420322 IP 10.8.3.3.36984 > 45.113.130.199.1935: Flags [.], seq 132300:133614, ack 1, win 501, options [nop,nop,TS val 798207713 ecr 858978651], length 1314
08:43:04.440593 IP 45.113.130.199.1935 > 10.8.3.3.36984: Flags [.], ack 121788, win 126, options [nop,nop,TS val 858978722 ecr 798207280], length 0
08:43:04.440626 IP 10.8.3.3.36984 > 45.113.130.199.1935: Flags [P.], seq 133614:133852, ack 1, win 501, options [nop,nop,TS val 798207733 ecr 858978722], length 238
08:43:04.483376 IP 10.8.3.3.36984 > 45.113.130.199.1935: Flags [.], seq 133852:135166, ack 1, win 501, options [nop,nop,TS val 798207776 ecr 858978722], length 1314
08:43:04.521719 IP 10.8.3.3.36984 > 45.113.130.199.1935: Flags [.], seq 135166:136480, ack 1, win 501, options [nop,nop,TS val 798207814 ecr 858978722], length 1314
08:43:04.535697 IP 45.113.130.199.1935 > 10.8.3.3.36984: Flags [.], ack 124416, win 126, options [nop,nop,TS val 858978818 ecr 798207378], length 0
08:43:04.564084 IP 10.8.3.3.36984 > 45.113.130.199.1935: Flags [.], seq 136480:137794, ack 1, win 501, options [nop,nop,TS val 798207856 ecr 858978818], length 1314
08:43:04.619670 IP 10.8.3.3.36984 > 45.113.130.199.1935: Flags [.], seq 137794:139108, ack 1, win 501, options [nop,nop,TS val 798207912 ecr 858978818], length 1314
08:43:04.635824 IP 45.113.130.199.1935 > 10.8.3.3.36984: Flags [.], ack 127044, win 126, options [nop,nop,TS val 858978918 ecr 798207445], length 0
08:43:04.653780 IP 10.8.3.3.36984 > 45.113.130.199.1935: Flags [.], seq 139108:140422, ack 1, win 501, options [nop,nop,TS val 798207946 ecr 858978918], length 1314
08:43:04.692772 IP 10.8.3.3.36984 > 45.113.130.199.1935: Flags [.], seq 140422:141736, ack 1, win 501, options [nop,nop,TS val 798207985 ecr 858978918], length 1314
08:43:04.702910 IP 45.113.130.199.1935 > 10.8.3.3.36984: Flags [.], ack 129672, win 126, options [nop,nop,TS val 858978985 ecr 798207545], length 0
08:43:04.750697 IP 10.8.3.3.36984 > 45.113.130.199.1935: Flags [.], seq 141736:143050, ack 1, win 501, options [nop,nop,TS val 798208043 ecr 858978985], length 1314
08:43:04.784432 IP 10.8.3.3.36984 > 45.113.130.199.1935: Flags [.], seq 143050:144364, ack 1, win 501, options [nop,nop,TS val 798208077 ecr 858978985], length 1314
08:43:04.803459 IP 45.113.130.199.1935 > 10.8.3.3.36984: Flags [.], ack 132300, win 126, options [nop,nop,TS val 858979085 ecr 798207644], length 0
08:43:04.820830 IP 10.8.3.3.36984 > 45.113.130.199.1935: Flags [.], seq 144364:145678, ack 1, win 501, options [nop,nop,TS val 798208113 ecr 858979085], length 1314
08:43:04.856408 IP 45.113.130.199.1935 > 10.8.3.3.36984: Flags [.], ack 133852, win 126, options [nop,nop,TS val 858979138 ecr 798207713], length 0
08:43:04.856449 IP 10.8.3.3.36984 > 45.113.130.199.1935: Flags [P.], seq 145678:146675, ack 1, win 501, options [nop,nop,TS val 798208149 ecr 858979138], length 997
08:43:04.920212 IP 10.8.3.3.36984 > 45.113.130.199.1935: Flags [.], seq 146675:147989, ack 1, win 501, options [nop,nop,TS val 798208213 ecr 858979138], length 1314
08:43:04.937725 IP 45.113.130.199.1935 > 10.8.3.3.36984: Flags [.], ack 136480, win 126, options [nop,nop,TS val 858979220 ecr 798207776], length 0
08:43:04.950489 IP 10.8.3.3.36984 > 45.113.130.199.1935: Flags [.], seq 147989:149303, ack 1, win 501, options [nop,nop,TS val 798208243 ecr 858979220], length 1314
08:43:04.971984 IP 10.8.3.3.36984 > 45.113.130.199.1935: Flags [.], seq 149303:150617, ack 1, win 501, options [nop,nop,TS val 798208264 ecr 858979220], length 1314
08:43:05.035757 IP 45.113.130.199.1935 > 10.8.3.3.36984: Flags [.], ack 139108, win 126, options [nop,nop,TS val 858979318 ecr 798207856], length 0
08:43:05.053046 IP 10.8.3.3.36984 > 45.113.130.199.1935: Flags [.], seq 150617:151931, ack 1, win 501, options [nop,nop,TS val 798208345 ecr 858979318], length 1314
08:43:05.078699 IP 10.8.3.3.36984 > 45.113.130.199.1935: Flags [.], seq 151931:153245, ack 1, win 501, options [nop,nop,TS val 798208371 ecr 858979318], length 1314
08:43:05.109016 IP 45.113.130.199.1935 > 10.8.3.3.36984: Flags [.], ack 141736, win 126, options [nop,nop,TS val 858979391 ecr 798207946], length 0
08:43:05.120240 IP 10.8.3.3.36984 > 45.113.130.199.1935: Flags [.], seq 153245:154559, ack 1, win 501, options [nop,nop,TS val 798208413 ecr 858979391], length 1314
08:43:05.186163 IP 10.8.3.3.36984 > 45.113.130.199.1935: Flags [.], seq 154559:155873, ack 1, win 501, options [nop,nop,TS val 798208478 ecr 858979391], length 1314
08:43:05.200588 IP 45.113.130.199.1935 > 10.8.3.3.36984: Flags [.], ack 144364, win 126, options [nop,nop,TS val 858979482 ecr 798208043], length 0
08:43:05.207560 IP 10.8.3.3.36984 > 45.113.130.199.1935: Flags [.], seq 155873:157187, ack 1, win 501, options [nop,nop,TS val 798208500 ecr 858979482], length 1314
08:43:05.250761 IP 10.8.3.3.36984 > 45.113.130.199.1935: Flags [.], seq 157187:158501, ack 1, win 501, options [nop,nop,TS val 798208543 ecr 858979482], length 1314
08:43:05.272575 IP 45.113.130.199.1935 > 10.8.3.3.36984: Flags [.], ack 146675, win 126, options [nop,nop,TS val 858979554 ecr 798208113], length 0
08:43:05.272593 IP 10.8.3.3.36984 > 45.113.130.199.1935: Flags [P.], seq 158501:159581, ack 1, win 501, options [nop,nop,TS val 798208565 ecr 858979554], length 1080
08:43:05.353484 IP 10.8.3.3.36984 > 45.113.130.199.1935: Flags [.], seq 159581:160895, ack 1, win 501, options [nop,nop,TS val 798208646 ecr 858979554], length 1314
08:43:05.366838 IP 45.113.130.199.1935 > 10.8.3.3.36984: Flags [.], ack 149303, win 126, options [nop,nop,TS val 858979649 ecr 798208213], length 0
08:43:05.378845 IP 10.8.3.3.36984 > 45.113.130.199.1935: Flags [.], seq 160895:162209, ack 1, win 501, options [nop,nop,TS val 798208671 ecr 858979649], length 1314
08:43:05.420398 IP 10.8.3.3.36984 > 45.113.130.199.1935: Flags [.], seq 162209:163523, ack 1, win 501, options [nop,nop,TS val 798208713 ecr 858979649], length 1314
08:43:05.449447 IP 45.113.130.199.1935 > 10.8.3.3.36984: Flags [.], ack 150617, win 126, options [nop,nop,TS val 858979731 ecr 798208264], length 0
08:43:05.486217 IP 10.8.3.3.36984 > 45.113.130.199.1935: Flags [.], seq 163523:164837, ack 1, win 501, options [nop,nop,TS val 798208779 ecr 858979731], length 1314
08:43:05.495099 IP 45.113.130.199.1935 > 10.8.3.3.36984: Flags [.], ack 153245, win 126, options [nop,nop,TS val 858979777 ecr 798208345], length 0
08:43:05.507629 IP 10.8.3.3.36984 > 45.113.130.199.1935: Flags [.], seq 164837:166151, ack 1, win 501, options [nop,nop,TS val 798208800 ecr 858979777], length 1314
08:43:05.550261 IP 10.8.3.3.36984 > 45.113.130.199.1935: Flags [.], seq 166151:167465, ack 1, win 501, options [nop,nop,TS val 798208843 ecr 858979777], length 1314
08:43:05.602388 IP 45.113.130.199.1935 > 10.8.3.3.36984: Flags [.], ack 155873, win 126, options [nop,nop,TS val 858979884 ecr 798208413], length 0
08:43:05.613862 IP 10.8.3.3.36984 > 45.113.130.199.1935: Flags [.], seq 167465:168779, ack 1, win 501, options [nop,nop,TS val 798208906 ecr 858979884], length 1314
08:43:05.650954 IP 10.8.3.3.36984 > 45.113.130.199.1935: Flags [.], seq 168779:170093, ack 1, win 501, options [nop,nop,TS val 798208943 ecr 858979884], length 1314
08:43:05.666948 IP 45.113.130.199.1935 > 10.8.3.3.36984: Flags [.], ack 158501, win 126, options [nop,nop,TS val 858979949 ecr 798208500], length 0
08:43:05.677811 IP 10.8.3.3.36984 > 45.113.130.199.1935: Flags [.], seq 170093:171407, ack 1, win 501, options [nop,nop,TS val 798208970 ecr 858979949], length 1314
08:43:05.691619 IP 45.113.130.199.1935 > 10.8.3.3.36984: Flags [.], ack 159581, win 126, options [nop,nop,TS val 858979973 ecr 798208565], length 0
08:43:05.691656 IP 10.8.3.3.36984 > 45.113.130.199.1935: Flags [P.], seq 171407:171651, ack 1, win 501, options [nop,nop,TS val 798208984 ecr 858979973], length 244
08:43:05.742345 IP 10.8.3.3.36984 > 45.113.130.199.1935: Flags [.], seq 171651:172965, ack 1, win 501, options [nop,nop,TS val 798209035 ecr 858979973], length 1314
08:43:05.785058 IP 10.8.3.3.36984 > 45.113.130.199.1935: Flags [.], seq 172965:174279, ack 1, win 501, options [nop,nop,TS val 798209077 ecr 858979973], length 1314
08:43:05.795228 IP 45.113.130.199.1935 > 10.8.3.3.36984: Flags [.], ack 162209, win 126, options [nop,nop,TS val 858980077 ecr 798208646], length 0
08:43:05.820054 IP 10.8.3.3.36984 > 45.113.130.199.1935: Flags [.], seq 174279:175593, ack 1, win 501, options [nop,nop,TS val 798209112 ecr 858980077], length 1314
08:43:05.884864 IP 10.8.3.3.36984 > 45.113.130.199.1935: Flags [.], seq 175593:176907, ack 1, win 501, options [nop,nop,TS val 798209177 ecr 858980077], length 1314
08:43:05.902345 IP 45.113.130.199.1935 > 10.8.3.3.36984: Flags [.], ack 164837, win 126, options [nop,nop,TS val 858980184 ecr 798208713], length 0
08:43:05.913358 IP 10.8.3.3.36984 > 45.113.130.199.1935: Flags [.], seq 176907:178221, ack 1, win 501, options [nop,nop,TS val 798209206 ecr 858980184], length 1314
08:43:05.951237 IP 10.8.3.3.36984 > 45.113.130.199.1935: Flags [.], seq 178221:179535, ack 1, win 501, options [nop,nop,TS val 798209244 ecr 858980184], length 1314
08:43:05.966168 IP 45.113.130.199.1935 > 10.8.3.3.36984: Flags [.], ack 167465, win 126, options [nop,nop,TS val 858980248 ecr 798208800], length 0
08:43:06.016361 IP 10.8.3.3.36984 > 45.113.130.199.1935: Flags [.], seq 179535:180849, ack 1, win 501, options [nop,nop,TS val 798209309 ecr 858980248], length 1314
08:43:06.040768 IP 10.8.3.3.36984 > 45.113.130.199.1935: Flags [.], seq 180849:182163, ack 1, win 501, options [nop,nop,TS val 798209333 ecr 858980248], length 1314
08:43:06.067079 IP 45.113.130.199.1935 > 10.8.3.3.36984: Flags [.], ack 170093, win 126, options [nop,nop,TS val 858980349 ecr 798208906], length 0
08:43:06.083925 IP 10.8.3.3.36984 > 45.113.130.199.1935: Flags [.], seq 182163:183477, ack 1, win 501, options [nop,nop,TS val 798209376 ecr 858980349], length 1314
08:43:06.107626 IP 45.113.130.199.1935 > 10.8.3.3.36984: Flags [.], ack 171651, win 126, options [nop,nop,TS val 858980389 ecr 798208970], length 0
08:43:06.107654 IP 10.8.3.3.36984 > 45.113.130.199.1935: Flags [P.], seq 183477:183710, ack 1, win 501, options [nop,nop,TS val 798209400 ecr 858980389], length 233
08:43:06.147753 IP 10.8.3.3.36984 > 45.113.130.199.1935: Flags [.], seq 183710:185024, ack 1, win 501, options [nop,nop,TS val 798209440 ecr 858980389], length 1314
08:43:06.183214 IP 10.8.3.3.36984 > 45.113.130.199.1935: Flags [.], seq 185024:186338, ack 1, win 501, options [nop,nop,TS val 798209476 ecr 858980389], length 1314
08:43:06.201007 IP 45.113.130.199.1935 > 10.8.3.3.36984: Flags [.], ack 174279, win 126, options [nop,nop,TS val 858980483 ecr 798209035], length 0
08:43:06.233207 IP 10.8.3.3.36984 > 45.113.130.199.1935: Flags [.], seq 186338:187652, ack 1, win 501, options [nop,nop,TS val 798209526 ecr 858980483], length 1314
08:43:06.276067 IP 10.8.3.3.36984 > 45.113.130.199.1935: Flags [.], seq 187652:188966, ack 1, win 501, options [nop,nop,TS val 798209568 ecr 858980483], length 1314
08:43:06.300817 IP 45.113.130.199.1935 > 10.8.3.3.36984: Flags [.], ack 176907, win 126, options [nop,nop,TS val 858980583 ecr 798209112], length 0
08:43:06.317766 IP 10.8.3.3.36984 > 45.113.130.199.1935: Flags [.], seq 188966:190280, ack 1, win 501, options [nop,nop,TS val 798209610 ecr 858980583], length 1314
08:43:06.361721 IP 10.8.3.3.36984 > 45.113.130.199.1935: Flags [.], seq 190280:191594, ack 1, win 501, options [nop,nop,TS val 798209654 ecr 858980583], length 1314
08:43:06.367253 IP 45.113.130.199.1935 > 10.8.3.3.36984: Flags [.], ack 179535, win 126, options [nop,nop,TS val 858980649 ecr 798209206], length 0
08:43:06.417800 IP 10.8.3.3.36984 > 45.113.130.199.1935: Flags [.], seq 191594:192908, ack 1, win 501, options [nop,nop,TS val 798209710 ecr 858980649], length 1314
08:43:06.447043 IP 10.8.3.3.36984 > 45.113.130.199.1935: Flags [.], seq 192908:194222, ack 1, win 501, options [nop,nop,TS val 798209739 ecr 858980649], length 1314
08:43:06.456815 IP 45.113.130.199.1935 > 10.8.3.3.36984: Flags [.], ack 182163, win 126, options [nop,nop,TS val 858980739 ecr 798209309], length 0
08:43:06.489870 IP 10.8.3.3.36984 > 45.113.130.199.1935: Flags [.], seq 194222:195536, ack 1, win 501, options [nop,nop,TS val 798209782 ecr 858980739], length 1314
08:43:06.523656 IP 45.113.130.199.1935 > 10.8.3.3.36984: Flags [.], ack 183710, win 126, options [nop,nop,TS val 858980806 ecr 798209376], length 0
08:43:06.523701 IP 10.8.3.3.36984 > 45.113.130.199.1935: Flags [P.], seq 195536:196537, ack 1, win 501, options [nop,nop,TS val 798209816 ecr 858980806], length 1001
08:43:06.575775 IP 10.8.3.3.36984 > 45.113.130.199.1935: Flags [.], seq 196537:197851, ack 1, win 501, options [nop,nop,TS val 798209868 ecr 858980806], length 1314
08:43:06.599227 IP 45.113.130.199.1935 > 10.8.3.3.36984: Flags [.], ack 186338, win 126, options [nop,nop,TS val 858980881 ecr 798209440], length 0
08:43:06.617177 IP 10.8.3.3.36984 > 45.113.130.199.1935: Flags [.], seq 197851:199165, ack 1, win 501, options [nop,nop,TS val 798209909 ecr 858980881], length 1314
08:43:06.650819 IP 10.8.3.3.36984 > 45.113.130.199.1935: Flags [.], seq 199165:200479, ack 1, win 501, options [nop,nop,TS val 798209943 ecr 858980881], length 1314
08:43:06.691964 IP 45.113.130.199.1935 > 10.8.3.3.36984: Flags [.], ack 188966, win 126, options [nop,nop,TS val 858980974 ecr 798209526], length 0
08:43:06.718099 IP 10.8.3.3.36984 > 45.113.130.199.1935: Flags [.], seq 200479:201793, ack 1, win 501, options [nop,nop,TS val 798210010 ecr 858980974], length 1314
08:43:06.746277 IP 10.8.3.3.36984 > 45.113.130.199.1935: Flags [.], seq 201793:203107, ack 1, win 501, options [nop,nop,TS val 798210039 ecr 858980974], length 1314
08:43:06.777909 IP 45.113.130.199.1935 > 10.8.3.3.36984: Flags [.], ack 191594, win 126, options [nop,nop,TS val 858981060 ecr 798209610], length 0
08:43:06.785706 IP 10.8.3.3.36984 > 45.113.130.199.1935: Flags [.], seq 203107:204421, ack 1, win 501, options [nop,nop,TS val 798210078 ecr 858981060], length 1314
08:43:06.849623 IP 10.8.3.3.36984 > 45.113.130.199.1935: Flags [.], seq 204421:205735, ack 1, win 501, options [nop,nop,TS val 798210142 ecr 858981060], length 1314
08:43:06.863007 IP 45.113.130.199.1935 > 10.8.3.3.36984: Flags [.], ack 194222, win 126, options [nop,nop,TS val 858981145 ecr 798209710], length 0
08:43:06.873747 IP 10.8.3.3.36984 > 45.113.130.199.1935: Flags [.], seq 205735:207049, ack 1, win 501, options [nop,nop,TS val 798210166 ecr 858981145], length 1314
08:43:06.916566 IP 10.8.3.3.36984 > 45.113.130.199.1935: Flags [.], seq 207049:208363, ack 1, win 501, options [nop,nop,TS val 798210209 ecr 858981145], length 1314
08:43:06.939678 IP 45.113.130.199.1935 > 10.8.3.3.36984: Flags [.], ack 196537, win 126, options [nop,nop,TS val 858981222 ecr 798209782], length 0
