15:52:09.263330 IP 10.8.2.7.59200 > 99.181.69.110.1935: Flags [.], seq 4154039167:4154040481, ack 3865657443, win 501, options [nop,nop,TS val 87326843 ecr 2787645423], length 1314
15:52:09.264827 IP 99.181.69.110.1935 > 10.8.2.7.59200: Flags [.], ack 4294960700, win 126, options [nop,nop,TS val 2787645516 ecr 87326540], length 0
15:52:09.295219 IP 10.8.2.7.59200 > 99.181.69.110.1935: Flags [.], seq 1314:2628, ack 1, win 501, options [nop,nop,TS val 87326875 ecr 2787645516], length 1314
15:52:09.363150 IP 10.8.2.7.59200 > 99.181.69.110.1935: Flags [.], seq 2628:3942, ack 1, win 501, options [nop,nop,TS val 87326942 ecr 2787645516], length 1314
15:52:09.364983 IP 99.181.69.110.1935 > 10.8.2.7.59200: Flags [.], ack 4294962014, win 126, options [nop,nop,TS val 2787645616 ecr 87326606], length 0
15:52:09.396720 IP 10.8.2.7.59200 > 99.181.69.110.1935: Flags [.], seq 3942:5256, ack 1, win 501, options [nop,nop,TS val 87326976 ecr 2787645616], length 1314
15:52:09.398760 IP 99.181.69.110.1935 > 10.8.2.7.59200: Flags [.], ack 4294964642, win 126, options [nop,nop,TS val 2787645650 ecr 87326676], length 0
15:52:09.430381 IP 10.8.2.7.59200 > 99.181.69.110.1935: Flags [.], seq 5256:6570, ack 1, win 501, options [nop,nop,TS val 87327010 ecr 2787645650], length 1314
15:52:09.441495 IP 99.181.69.110.1935 > 10.8.2.7.59200: Flags [.], ack 4294965982, win 126, options [nop,nop,TS val 2787645693 ecr 87326741], length 0
15:52:09.441530 IP 10.8.2.7.59200 > 99.181.69.110.1935: Flags [P.], seq 6570:6701, ack 1, win 501, options [nop,nop,TS val 87327021 ecr 2787645693], length 131
15:52:09.493549 IP 10.8.2.7.59200 > 99.181.69.110.1935: Flags [.], seq 6701:8015, ack 1, win 501, options [nop,nop,TS val 87327073 ecr 2787645693], length 1314
15:52:09.527452 IP 10.8.2.7.59200 > 99.181.69.110.1935: Flags [.], seq 8015:9329, ack 1, win 501, options [nop,nop,TS val 87327107 ecr 2787645693], length 1314
15:52:09.531984 IP 99.181.69.110.1935 > 10.8.2.7.59200: Flags [.], ack 1314, win 126, options [nop,nop,TS val 2787645783 ecr 87326809], length 0
15:52:09.563247 IP 10.8.2.7.59200 > 99.181.69.110.1935: Flags [.], seq 9329:10643, ack 1, win 501, options [nop,nop,TS val 87327143 ecr 2787645783], length 1314
15:52:09.627102 IP 10.8.2.7.59200 > 99.181.69.110.1935: Flags [.], seq 10643:11957, ack 1, win 501, options [nop,nop,TS val 87327206 ecr 2787645783], length 1314
15:52:09.632168 IP 99.181.69.110.1935 > 10.8.2.7.59200: Flags [.], ack 3942, win 126, options [nop,nop,TS val 2787645883 ecr 87326875], length 0
15:52:09.660628 IP 10.8.2.7.59200 > 99.181.69.110.1935: Flags [.], seq 11957:13271, ack 1, win 501, options [nop,nop,TS val 87327240 ecr 2787645883], length 1314
15:52:09.692960 IP 10.8.2.7.59200 > 99.181.69.110.1935: Flags [.], seq 13271:14585, ack 1, win 501, options [nop,nop,TS val 87327272 ecr 2787645883], length 1314
15:52:09.698871 IP 99.181.69.110.1935 > 10.8.2.7.59200: Flags [.], ack 6570, win 126, options [nop,nop,TS val 2787645950 ecr 87326976], length 0
15:52:09.709927 IP 99.181.69.110.1935 > 10.8.2.7.59200: Flags [.], ack 6701, win 126, options [nop,nop,TS val 2787645961 ecr 87327021], length 0
15:52:09.709943 IP 10.8.2.7.59200 > 99.181.69.110.1935: Flags [P.], seq 14585:14624, ack 1, win 501, options [nop,nop,TS val 87327289 ecr 2787645961], length 39
15:52:09.759503 IP 10.8.2.7.59200 > 99.181.69.110.1935: Flags [.], seq 14624:15938, ack 1, win 501, options [nop,nop,TS val 87327339 ecr 2787645961], length 1314
15:52:09.795589 IP 10.8.2.7.59200 > 99.181.69.110.1935: Flags [.], seq 15938:17252, ack 1, win 501, options [nop,nop,TS val 87327375 ecr 2787645961], length 1314
15:52:09.796207 IP 99.181.69.110.1935 > 10.8.2.7.59200: Flags [.], ack 9329, win 126, options [nop,nop,TS val 2787646047 ecr 87327073], length 0
15:52:09.826389 IP 10.8.2.7.59200 > 99.181.69.110.1935: Flags [.], seq 17252:18566, ack 1, win 501, options [nop,nop,TS val 87327406 ecr 2787646047], length 1314
15:52:09.892813 IP 10.8.2.7.59200 > 99.181.69.110.1935: Flags [.], seq 18566:19880, ack 1, win 501, options [nop,nop,TS val 87327472 ecr 2787646047], length 1314
15:52:09.895836 IP 99.181.69.110.1935 > 10.8.2.7.59200: Flags [.], ack 11957, win 126, options [nop,nop,TS val 2787646147 ecr 87327143], length 0
15:52:09.928889 IP 10.8.2.7.59200 > 99.181.69.110.1935: Flags [.], seq 19880:21194, ack 1, win 501, options [nop,nop,TS val 87327508 ecr 2787646147], length 1314
15:52:09.959445 IP 10.8.2.7.59200 > 99.181.69.110.1935: Flags [.], seq 21194:22508, ack 1, win 501, options [nop,nop,TS val 87327539 ecr 2787646147], length 1314
15:52:09.961548 IP 99.181.69.110.1935 > 10.8.2.7.59200: Flags [.], ack 14585, win 126, options [nop,nop,TS val 2787646213 ecr 87327240], length 0
15:52:09.978557 IP 99.181.69.110.1935 > 10.8.2.7.59200: Flags [.], ack 14624, win 126, options [nop,nop,TS val 2787646230 ecr 87327289], length 0
15:52:09.978569 IP 10.8.2.7.59200 > 99.181.69.110.1935: Flags [P.], seq 22508:22629, ack 1, win 501, options [nop,nop,TS val 87327558 ecr 2787646230], length 121
15:52:10.028426 IP 10.8.2.7.59200 > 99.181.69.110.1935: Flags [.], seq 22629:23943, ack 1, win 501, options [nop,nop,TS val 87327608 ecr 2787646230], length 1314
15:52:10.063649 IP 10.8.2.7.59200 > 99.181.69.110.1935: Flags [.], seq 23943:25257, ack 1, win 501, options [nop,nop,TS val 87327643 ecr 2787646230], length 1314
15:52:10.064078 IP 99.181.69.110.1935 > 10.8.2.7.59200: Flags [.], ack 17252, win 126, options [nop,nop,TS val 2787646315 ecr 87327339], length 0
15:52:10.095446 IP 10.8.2.7.59200 > 99.181.69.110.1935: Flags [.], seq 25257:26571, ack 1, win 501, options [nop,nop,TS val 87327675 ecr 2787646315], length 1314
15:52:10.161406 IP 99.181.69.110.1935 > 10.8.2.7.59200: Flags [.], ack 19880, win 126, options [nop,nop,TS val 2787646413 ecr 87327406], length 0
15:52:10.162120 IP 10.8.2.7.59200 > 99.181.69.110.1935: Flags [.], seq 26571:27885, ack 1, win 501, options [nop,nop,TS val 87327741 ecr 2787646413], length 1314
15:52:10.195374 IP 10.8.2.7.59200 > 99.181.69.110.1935: Flags [.], seq 27885:29199, ack 1, win 501, options [nop,nop,TS val 87327775 ecr 2787646413], length 1314
15:52:10.228230 IP 99.181.69.110.1935 > 10.8.2.7.59200: Flags [.], ack 22508, win 126, options [nop,nop,TS val 2787646479 ecr 87327508], length 0
15:52:10.228679 IP 10.8.2.7.59200 > 99.181.69.110.1935: Flags [.], seq 29199:30513, ack 1, win 501, options [nop,nop,TS val 87327808 ecr 2787646479], length 1314
15:52:10.247038 IP 99.181.69.110.1935 > 10.8.2.7.59200: Flags [.], ack 22629, win 126, options [nop,nop,TS val 2787646498 ecr 87327558], length 0
15:52:10.247070 IP 10.8.2.7.59200 > 99.181.69.110.1935: Flags [P.], seq 30513:30640, ack 1, win 501, options [nop,nop,TS val 87327826 ecr 2787646498], length 127
15:52:10.295037 IP 10.8.2.7.59200 > 99.181.69.110.1935: Flags [.], seq 30640:31954, ack 1, win 501, options [nop,nop,TS val 87327874 ecr 2787646498], length 1314
15:52:10.330378 IP 10.8.2.7.59200 > 99.181.69.110.1935: Flags [.], seq 31954:33268, ack 1, win 501, options [nop,nop,TS val 87327910 ecr 2787646498], length 1314
15:52:10.332486 IP 99.181.69.110.1935 > 10.8.2.7.59200: Flags [.], ack 25257, win 126, options [nop,nop,TS val 2787646584 ecr 87327608], length 0
15:52:10.371603 IP 10.8.2.7.59200 > 99.181.69.110.1935: Flags [.], seq 33268:34582, ack 1, win 501, options [nop,nop,TS val 87327951 ecr 2787646584], length 1314
15:52:10.427781 IP 10.8.2.7.59200 > 99.181.69.110.1935: Flags [.], seq 34582:35896, ack 1, win 501, options [nop,nop,TS val 87328007 ecr 2787646584], length 1314
15:52:10.428826 IP 99.181.69.110.1935 > 10.8.2.7.59200: Flags [.], ack 26571, win 126, options [nop,nop,TS val 2787646680 ecr 87327675], length 0
15:52:10.461595 IP 10.8.2.7.59200 > 99.181.69.110.1935: Flags [.], seq 35896:37210, ack 1, win 501, options [nop,nop,TS val 87328041 ecr 2787646680], length 1314
15:52:10.464016 IP 99.181.69.110.1935 > 10.8.2.7.59200: Flags [.], ack 29199, win 126, options [nop,nop,TS val 2787646715 ecr 87327741], length 0
15:52:10.499240 IP 10.8.2.7.59200 > 99.181.69.110.1935: Flags [.], seq 37210:38524, ack 1, win 501, options [nop,nop,TS val 87328079 ecr 2787646715], length 1314
15:52:10.515571 IP 99.181.69.110.1935 > 10.8.2.7.59200: Flags [.], ack 30640, win 126, options [nop,nop,TS val 2787646767 ecr 87327808], length 0
15:52:10.515640 IP 10.8.2.7.59200 > 99.181.69.110.1935: Flags [P.], seq 38524:38563, ack 1, win 501, options [nop,nop,TS val 87328095 ecr 2787646767], length 39
15:52:10.560038 IP 10.8.2.7.59200 > 99.181.69.110.1935: Flags [.], seq 38563:39877, ack 1, win 501, options [nop,nop,TS val 87328139 ecr 2787646767], length 1314
15:52:10.595385 IP 10.8.2.7.59200 > 99.181.69.110.1935: Flags [.], seq 39877:41191, ack 1, win 501, options [nop,nop,TS val 87328175 ecr 2787646767], length 1314
15:52:10.599013 IP 99.181.69.110.1935 > 10.8.2.7.59200: Flags [.], ack 33268, win 126, options [nop,nop,TS val 2787646850 ecr 87327874], length 0
15:52:10.626586 IP 10.8.2.7.59200 > 99.181.69.110.1935: Flags [.], seq 41191:42505, ack 1, win 501, options [nop,nop,TS val 87328206 ecr 2787646850], length 1314
15:52:10.694391 IP 10.8.2.7.59200 > 99.181.69.110.1935: Flags [.], seq 42505:43819, ack 1, win 501, options [nop,nop,TS val 87328274 ecr 2787646850], length 1314
15:52:10.696591 IP 99.181.69.110.1935 > 10.8.2.7.59200: Flags [.], ack 35896, win 126, options [nop,nop,TS val 2787646948 ecr 87327951], length 0
15:52:10.728046 IP 10.8.2.7.59200 > 99.181.69.110.1935: Flags [.], seq 43819:45133, ack 1, win 501, options [nop,nop,TS val 87328307 ecr 2787646948], length 1314
15:52:10.759266 IP 10.8.2.7.59200 > 99.181.69.110.1935: Flags [.], seq 45133:46447, ack 1, win 501, options [nop,nop,TS val 87328339 ecr 2787646948], length 1314
15:52:10.768009 IP 99.181.69.110.1935 > 10.8.2.7.59200: Flags [.], ack 38524, win 126, options [nop,nop,TS val 2787647019 ecr 87328041], length 0
15:52:10.784637 IP 99.181.69.110.1935 > 10.8.2.7.59200: Flags [.], ack 38563, win 126, options [nop,nop,TS val 2787647036 ecr 87328095], length 0
15:52:10.784660 IP 10.8.2.7.59200 > 99.181.69.110.1935: Flags [P.], seq 46447:46569, ack 1, win 501, options [nop,nop,TS val 87328364 ecr 2787647036], length 122
15:52:10.828608 IP 10.8.2.7.59200 > 99.181.69.110.1935: Flags [.], seq 46569:47883, ack 1, win 501, options [nop,nop,TS val 87328408 ecr 2787647036], length 1314
15:52:10.862697 IP 10.8.2.7.59200 > 99.181.69.110.1935: Flags [.], seq 47883:49197, ack 1, win 501, options [nop,nop,TS val 87328442 ecr 2787647036], length 1314
15:52:10.864234 IP 99.181.69.110.1935 > 10.8.2.7.59200: Flags [.], ack 41191, win 126, options [nop,nop,TS val 2787647116 ecr 87328139], length 0
15:52:10.903980 IP 10.8.2.7.59200 > 99.181.69.110.1935: Flags [.], seq 49197:50511, ack 1, win 501, options [nop,nop,TS val 87328483 ecr 2787647116], length 1314
15:52:10.960912 IP 99.181.69.110.1935 > 10.8.2.7.59200: Flags [.], ack 42505, win 126, options [nop,nop,TS val 2787647212 ecr 87328206], length 0
15:52:10.963011 IP 10.8.2.7.59200 > 99.181.69.110.1935: Flags [.], seq 50511:51825, ack 1, win 501, options [nop,nop,TS val 87328542 ecr 2787647212], length 1314
15:52:10.995867 IP 10.8.2.7.59200 > 99.181.69.110.1935: Flags [.], seq 51825:53139, ack 1, win 501, options [nop,nop,TS val 87328575 ecr 2787647212], length 1314
15:52:10.997405 IP 99.181.69.110.1935 > 10.8.2.7.59200: Flags [.], ack 45133, win 126, options [nop,nop,TS val 2787647248 ecr 87328274], length 0
15:52:11.031917 IP 10.8.2.7.59200 > 99.181.69.110.1935: Flags [.], seq 53139:54453, ack 1, win 501, options [nop,nop,TS val 87328611 ecr 2787647248], length 1314
15:52:11.053572 IP 99.181.69.110.1935 > 10.8.2.7.59200: Flags [.], ack 46569, win 126, options [nop,nop,TS val 2787647304 ecr 87328339], length 0
15:52:11.053586 IP 10.8.2.7.59200 > 99.181.69.110.1935: Flags [P.], seq 54453:54583, ack 1, win 501, options [nop,nop,TS val 87328633 ecr 2787647304], length 130
15:52:11.095505 IP 10.8.2.7.59200 > 99.181.69.110.1935: Flags [.], seq 54583:55897, ack 1, win 501, options [nop,nop,TS val 87328675 ecr 2787647304], length 1314
15:52:11.131250 IP 99.181.69.110.1935 > 10.8.2.7.59200: Flags [.], ack 49197, win 126, options [nop,nop,TS val 2787647382 ecr 87328408], length 0
15:52:11.131541 IP 10.8.2.7.59200 > 99.181.69.110.1935: Flags [.], seq 55897:57211, ack 1, win 501, options [nop,nop,TS val 87328711 ecr 2787647382], length 1314
15:52:11.181126 IP 10.8.2.7.59200 > 99.181.69.110.1935: Flags [.], seq 57211:58525, ack 1, win 501, options [nop,nop,TS val 87328760 ecr 2787647382], length 1314
15:52:11.227789 IP 10.8.2.7.59200 > 99.181.69.110.1935: Flags [.], seq 58525:59839, ack 1, win 501, options [nop,nop,TS val 87328807 ecr 2787647382], length 1314
15:52:11.235040 IP 99.181.69.110.1935 > 10.8.2.7.59200: Flags [.], ack 51825, win 126, options [nop,nop,TS val 2787647484 ecr 87328483], length 0
15:52:11.262543 IP 10.8.2.7.59200 > 99.181.69.110.1935: Flags [.], seq 59839:61153, ack 1, win 501, options [nop,nop,TS val 87328842 ecr 2787647484], length 1314
15:52:11.300655 IP 99.181.69.110.1935 > 10.8.2.7.59200: Flags [.], ack 54453, win 126, options [nop,nop,TS val 2787647552 ecr 87328575], length 0
15:52:11.309309 IP 10.8.2.7.59200 > 99.181.69.110.1935: Flags [.], seq 61153:62467, ack 1, win 501, options [nop,nop,TS val 87328889 ecr 2787647552], length 1314
15:52:11.322608 IP 99.181.69.110.1935 > 10.8.2.7.59200: Flags [.], ack 54583, win 126, options [nop,nop,TS val 2787647574 ecr 87328633], length 0
15:52:11.322647 IP 10.8.2.7.59200 > 99.181.69.110.1935: Flags [P.], seq 62467:62506, ack 1, win 501, options [nop,nop,TS val 87328902 ecr 2787647574], length 39
15:52:11.361637 IP 10.8.2.7.59200 > 99.181.69.110.1935: Flags [.], seq 62506:63820, ack 1, win 501, options [nop,nop,TS val 87328941 ecr 2787647574], length 1314
15:52:11.394946 IP 10.8.2.7.59200 > 99.181.69.110.1935: Flags [.], seq 63820:65134, ack 1, win 501, options [nop,nop,TS val 87328974 ecr 2787647574], length 1314
15:52:11.400405 IP 99.181.69.110.1935 > 10.8.2.7.59200: Flags [.], ack 57211, win 126, options [nop,nop,TS val 2787647652 ecr 87328675], length 0
15:52:11.437332 IP 10.8.2.7.59200 > 99.181.69.110.1935: Flags [.], seq 65134:66448, ack 1, win 501, options [nop,nop,TS val 87329017 ecr 2787647652], length 1314
15:52:11.497520 IP 10.8.2.7.59200 > 99.181.69.110.1935: Flags [.], seq 66448:67762, ack 1, win 501, options [nop,nop,TS val 87329077 ecr 2787647652], length 1314
15:52:11.502282 IP 99.181.69.110.1935 > 10.8.2.7.59200: Flags [.], ack 59839, win 126, options [nop,nop,TS val 2787647753 ecr 87328760], length 0
15:52:11.529196 IP 10.8.2.7.59200 > 99.181.69.110.1935: Flags [.], seq 67762:69076, ack 1, win 501, options [nop,nop,TS val 87329109 ecr 2787647753], length 1314
15:52:11.565241 IP 10.8.2.7.59200 > 99.181.69.110.1935: Flags [.], seq 69076:70390, ack 1, win 501, options [nop,nop,TS val 87329145 ecr 2787647753], length 1314
15:52:11.578258 IP 99.181.69.110.1935 > 10.8.2.7.59200: Flags [.], ack 62467, win 126, options [nop,nop,TS val 2787647829 ecr 87328842], length 0
15:52:11.591011 IP 99.181.69.110.1935 > 10.8.2.7.59200: Flags [.], ack 62506, win 126, options [nop,nop,TS val 2787647842 ecr 87328902], length 0
15:52:11.591037 IP 10.8.2.7.59200 > 99.181.69.110.1935: Flags [P.], seq 70390:70507, ack 1, win 501, options [nop,nop,TS val 87329170 ecr 2787647842], length 117
15:52:11.629206 IP 10.8.2.7.59200 > 99.181.69.110.1935: Flags [.], seq 70507:71821, ack 1, win 501, options [nop,nop,TS val 87329209 ecr 2787647842], length 1314
15:52:11.663758 IP 10.8.2.7.59200 > 99.181.69.110.1935: Flags [.], seq 71821:73135, ack 1, win 501, options [nop,nop,TS val 87329243 ecr 2787647842], length 1314
15:52:11.664064 IP 99.181.69.110.1935 > 10.8.2.7.59200: Flags [.], ack 65134, win 126, options [nop,nop,TS val 2787647915 ecr 87328941], length 0
15:52:11.715132 IP 10.8.2.7.59200 > 99.181.69.110.1935: Flags [.], seq 73135:74449, ack 1, win 501, options [nop,nop,TS val 87329294 ecr 2787647915], length 1314
15:52:11.761064 IP 10.8.2.7.59200 > 99.181.69.110.1935: Flags [.], seq 74449:75763, ack 1, win 501, options [nop,nop,TS val 87329340 ecr 2787647915], length 1314
15:52:11.767594 IP 99.181.69.110.1935 > 10.8.2.7.59200: Flags [.], ack 67762, win 126, options [nop,nop,TS val 2787648019 ecr 87329017], length 0
15:52:11.796806 IP 10.8.2.7.59200 > 99.181.69.110.1935: Flags [.], seq 75763:77077, ack 1, win 501, options [nop,nop,TS val 87329376 ecr 2787648019], length 1314
15:52:11.834272 IP 99.181.69.110.1935 > 10.8.2.7.59200: Flags [.], ack 70390, win 126, options [nop,nop,TS val 2787648085 ecr 87329109], length 0
15:52:11.843798 IP 10.8.2.7.59200 > 99.181.69.110.1935: Flags [.], seq 77077:78391, ack 1, win 501, options [nop,nop,TS val 87329423 ecr 2787648085], length 1314
15:52:11.859443 IP 99.181.69.110.1935 > 10.8.2.7.59200: Flags [.], ack 70507, win 126, options [nop,nop,TS val 2787648111 ecr 87329170], length 0
15:52:11.859474 IP 10.8.2.7.59200 > 99.181.69.110.1935: Flags [P.], seq 78391:78426, ack 1, win 501, options [nop,nop,TS val 87329439 ecr 2787648111], length 35
15:52:11.896823 IP 10.8.2.7.59200 > 99.181.69.110.1935: Flags [.], seq 78426:79740, ack 1, win 501, options [nop,nop,TS val 87329476 ecr 2787648111], length 1314
15:52:11.930670 IP 10.8.2.7.59200 > 99.181.69.110.1935: Flags [.], seq 79740:81054, ack 1, win 501, options [nop,nop,TS val 87329510 ecr 2787648111], length 1314
15:52:11.932727 IP 99.181.69.110.1935 > 10.8.2.7.59200: Flags [.], ack 73135, win 126, options [nop,nop,TS val 2787648184 ecr 87329209], length 0
15:52:11.971972 IP 10.8.2.7.59200 > 99.181.69.110.1935: Flags [.], seq 81054:82368, ack 1, win 501, options [nop,nop,TS val 87329551 ecr 2787648184], length 1314
15:52:12.028138 IP 10.8.2.7.59200 > 99.181.69.110.1935: Flags [.], seq 82368:83682, ack 1, win 501, options [nop,nop,TS val 87329607 ecr 2787648184], length 1314
15:52:12.030048 IP 99.181.69.110.1935 > 10.8.2.7.59200: Flags [.], ack 75763, win 126, options [nop,nop,TS val 2787648281 ecr 87329294], length 0
15:52:12.063945 IP 10.8.2.7.59200 > 99.181.69.110.1935: Flags [.], seq 83682:84996, ack 1, win 501, options [nop,nop,TS val 87329643 ecr 2787648281], length 1314
15:52:12.100422 IP 10.8.2.7.59200 > 99.181.69.110.1935: Flags [.], seq 84996:86310, ack 1, win 501, options [nop,nop,TS val 87329680 ecr 2787648281], length 1314
15:52:12.112612 IP 99.181.69.110.1935 > 10.8.2.7.59200: Flags [.], ack 78391, win 126, options [nop,nop,TS val 2787648364 ecr 87329376], length 0
15:52:12.128085 IP 99.181.69.110.1935 > 10.8.2.7.59200: Flags [.], ack 78426, win 126, options [nop,nop,TS val 2787648379 ecr 87329439], length 0
15:52:12.128105 IP 10.8.2.7.59200 > 99.181.69.110.1935: Flags [P.], seq 86310:87293, ack 1, win 501, options [nop,nop,TS val 87329707 ecr 2787648379], length 983
15:52:12.197080 IP 10.8.2.7.59200 > 99.181.69.110.1935: Flags [.], seq 87293:88607, ack 1, win 501, options [nop,nop,TS val 87329776 ecr 2787648379], length 1314
15:52:12.199657 IP 99.181.69.110.1935 > 10.8.2.7.59200: Flags [.], ack 81054, win 126, options [nop,nop,TS val 2787648451 ecr 87329476], length 0
15:52:12.230172 IP 10.8.2.7.59200 > 99.181.69.110.1935: Flags [.], seq 88607:89921, ack 1, win 501, options [nop,nop,TS val 87329809 ecr 2787648451], length 1314
15:52:12.263670 IP 10.8.2.7.59200 > 99.181.69.110.1935: Flags [.], seq 89921:91235, ack 1, win 501, options [nop,nop,TS val 87329843 ecr 2787648451], length 1314
15:52:12.296732 IP 99.181.69.110.1935 > 10.8.2.7.59200: Flags [.], ack 83682, win 126, options [nop,nop,TS val 2787648548 ecr 87329551], length 0
15:52:12.330345 IP 10.8.2.7.59200 > 99.181.69.110.1935: Flags [.], seq 91235:92549, ack 1, win 501, options [nop,nop,TS val 87329910 ecr 2787648548], length 1314
15:52:12.363459 IP 10.8.2.7.59200 > 99.181.69.110.1935: Flags [.], seq 92549:93863, ack 1, win 501, options [nop,nop,TS val 87329943 ecr 2787648548], length 1314
15:52:12.369021 IP 99.181.69.110.1935 > 10.8.2.7.59200: Flags [.], ack 86310, win 126, options [nop,nop,TS val 2787648620 ecr 87329643], length 0
15:52:12.395419 IP 10.8.2.7.59200 > 99.181.69.110.1935: Flags [.], seq 93863:95177, ack 1, win 501, options [nop,nop,TS val 87329975 ecr 2787648620], length 1314
15:52:12.396671 IP 99.181.69.110.1935 > 10.8.2.7.59200: Flags [.], ack 87293, win 126, options [nop,nop,TS val 2787648648 ecr 87329707], length 0
15:52:12.396695 IP 10.8.2.7.59200 > 99.181.69.110.1935: Flags [P.], seq 95177:95204, ack 1, win 501, options [nop,nop,TS val 87329976 ecr 2787648648], length 27
15:52:12.465150 IP 10.8.2.7.59200 > 99.181.69.110.1935: Flags [.], seq 95204:96518, ack 1, win 501, options [nop,nop,TS val 87330044 ecr 2787648648], length 1314
15:52:12.492770 IP 10.8.2.7.59200 > 99.181.69.110.1935: Flags [.], seq 96518:97832, ack 1, win 501, options [nop,nop,TS val 87330072 ecr 2787648648], length 1314
15:52:12.499011 IP 99.181.69.110.1935 > 10.8.2.7.59200: Flags [.], ack 89921, win 126, options [nop,nop,TS val 2787648750 ecr 87329776], length 0
15:52:12.528762 IP 10.8.2.7.59200 > 99.181.69.110.1935: Flags [.], seq 97832:99146, ack 1, win 501, options [nop,nop,TS val 87330108 ecr 2787648750], length 1314
15:52:12.597240 IP 10.8.2.7.59200 > 99.181.69.110.1935: Flags [.], seq 99146:100460, ack 1, win 501, options [nop,nop,TS val 87330177 ecr 2787648750], length 1314
15:52:12.599022 IP 99.181.69.110.1935 > 10.8.2.7.59200: Flags [.], ack 92549, win 126, options [nop,nop,TS val 2787648850 ecr 87329843], length 0
15:52:12.630070 IP 10.8.2.7.59200 > 99.181.69.110.1935: Flags [.], seq 100460:101774, ack 1, win 501, options [nop,nop,TS val 87330209 ecr 2787648850], length 1314
15:52:12.662049 IP 10.8.2.7.59200 > 99.181.69.110.1935: Flags [.], seq 101774:103088, ack 1, win 501, options [nop,nop,TS val 87330241 ecr 2787648850], length 1314
15:52:12.664500 IP 99.181.69.110.1935 > 10.8.2.7.59200: Flags [.], ack 95177, win 126, options [nop,nop,TS val 2787648916 ecr 87329943], length 0
15:52:12.665103 IP 99.181.69.110.1935 > 10.8.2.7.59200: Flags [.], ack 95204, win 126, options [nop,nop,TS val 2787648916 ecr 87329976], length 0
15:52:12.665123 IP 10.8.2.7.59200 > 99.181.69.110.1935: Flags [P.], seq 103088:103217, ack 1, win 501, options [nop,nop,TS val 87330244 ecr 2787648916], length 129
15:52:12.730602 IP 10.8.2.7.59200 > 99.181.69.110.1935: Flags [.], seq 103217:104531, ack 1, win 501, options [nop,nop,TS val 87330310 ecr 2787648916], length 1314
15:52:12.761641 IP 99.181.69.110.1935 > 10.8.2.7.59200: Flags [.], ack 97832, win 126, options [nop,nop,TS val 2787649013 ecr 87330044], length 0
15:52:12.764251 IP 10.8.2.7.59200 > 99.181.69.110.1935: Flags [.], seq 104531:105845, ack 1, win 501, options [nop,nop,TS val 87330344 ecr 2787649013], length 1314
15:52:12.796933 IP 10.8.2.7.59200 > 99.181.69.110.1935: Flags [.], seq 105845:107159, ack 1, win 501, options [nop,nop,TS val 87330376 ecr 2787649013], length 1314
15:52:12.863998 IP 10.8.2.7.59200 > 99.181.69.110.1935: Flags [.], seq 107159:108473, ack 1, win 501, options [nop,nop,TS val 87330443 ecr 2787649013], length 1314
15:52:12.864857 IP 99.181.69.110.1935 > 10.8.2.7.59200: Flags [.], ack 99146, win 126, options [nop,nop,TS val 2787649116 ecr 87330108], length 0
15:52:12.896907 IP 10.8.2.7.59200 > 99.181.69.110.1935: Flags [.], seq 108473:109787, ack 1, win 501, options [nop,nop,TS val 87330476 ecr 2787649116], length 1314
15:52:12.898689 IP 99.181.69.110.1935 > 10.8.2.7.59200: Flags [.], ack 101774, win 126, options [nop,nop,TS val 2787649150 ecr 87330177], length 0
15:52:12.928779 IP 10.8.2.7.59200 > 99.181.69.110.1935: Flags [.], seq 109787:111101, ack 1, win 501, options [nop,nop,TS val 87330508 ecr 2787649150], length 1314
15:52:12.933493 IP 99.181.69.110.1935 > 10.8.2.7.59200: Flags [.], ack 103217, win 126, options [nop,nop,TS val 2787649185 ecr 87330241], length 0
15:52:12.933518 IP 10.8.2.7.59200 > 99.181.69.110.1935: Flags [P.], seq 111101:111140, ack 1, win 501, options [nop,nop,TS val 87330513 ecr 2787649185], length 39
15:52:13.000312 IP 10.8.2.7.59200 > 99.181.69.110.1935: Flags [.], seq 111140:112454, ack 1, win 501, options [nop,nop,TS val 87330580 ecr 2787649185], length 1314
15:52:13.029817 IP 10.8.2.7.59200 > 99.181.69.110.1935: Flags [.], seq 112454:113768, ack 1, win 501, options [nop,nop,TS val 87330609 ecr 2787649185], length 1314
15:52:13.033356 IP 99.181.69.110.1935 > 10.8.2.7.59200: Flags [.], ack 105845, win 126, options [nop,nop,TS val 2787649284 ecr 87330310], length 0
15:52:13.064501 IP 10.8.2.7.59200 > 99.181.69.110.1935: Flags [.], seq 113768:115082, ack 1, win 501, options [nop,nop,TS val 87330644 ecr 2787649284], length 1314
15:52:13.130635 IP 10.8.2.7.59200 > 99.181.69.110.1935: Flags [.], seq 115082:116396, ack 1, win 501, options [nop,nop,TS val 87330710 ecr 2787649284], length 1314
15:52:13.132871 IP 99.181.69.110.1935 > 10.8.2.7.59200: Flags [.], ack 108473, win 126, options [nop,nop,TS val 2787649384 ecr 87330376], length 0
15:52:13.163601 IP 10.8.2.7.59200 > 99.181.69.110.1935: Flags [.], seq 116396:117710, ack 1, win 501, options [nop,nop,TS val 87330743 ecr 2787649384], length 1314
15:52:13.195374 IP 10.8.2.7.59200 > 99.181.69.110.1935: Flags [.], seq 117710:119024, ack 1, win 501, options [nop,nop,TS val 87330775 ecr 2787649384], length 1314
15:52:13.197659 IP 99.181.69.110.1935 > 10.8.2.7.59200: Flags [.], ack 111101, win 126, options [nop,nop,TS val 2787649449 ecr 87330476], length 0
15:52:13.202450 IP 99.181.69.110.1935 > 10.8.2.7.59200: Flags [.], ack 111140, win 126, options [nop,nop,TS val 2787649454 ecr 87330513], length 0
15:52:13.202471 IP 10.8.2.7.59200 > 99.181.69.110.1935: Flags [P.], seq 119024:119142, ack 1, win 501, options [nop,nop,TS val 87330782 ecr 2787649454], length 118
15:52:13.262272 IP 10.8.2.7.59200 > 99.181.69.110.1935: Flags [.], seq 119142:120456, ack 1, win 501, options [nop,nop,TS val 87330842 ecr 2787649454], length 1314
15:52:13.298701 IP 99.181.69.110.1935 > 10.8.2.7.59200: Flags [.], ack 113768, win 126, options [nop,nop,TS val 2787649550 ecr 87330580], length 0
15:52:13.300024 IP 10.8.2.7.59200 > 99.181.69.110.1935: Flags [.], seq 120456:121770, ack 1, win 501, options [nop,nop,TS val 87330879 ecr 2787649550], length 1314
15:52:13.328663 IP 10.8.2.7.59200 > 99.181.69.110.1935: Flags [.], seq 121770:123084, ack 1, win 501, options [nop,nop,TS val 87330908 ecr 2787649550], length 1314
15:52:13.397106 IP 10.8.2.7.59200 > 99.181.69.110.1935: Flags [.], seq 123084:124398, ack 1, win 501, options [nop,nop,TS val 87330976 ecr 2787649550], length 1314
15:52:13.399565 IP 99.181.69.110.1935 > 10.8.2.7.59200: Flags [.], ack 116396, win 126, options [nop,nop,TS val 2787649651 ecr 87330644], length 0
15:52:13.430046 IP 10.8.2.7.59200 > 99.181.69.110.1935: Flags [.], seq 124398:125712, ack 1, win 501, options [nop,nop,TS val 87331009 ecr 2787649651], length 1314
15:52:13.463831 IP 10.8.2.7.59200 > 99.181.69.110.1935: Flags [.], seq 125712:127026, ack 1, win 501, options [nop,nop,TS val 87331043 ecr 2787649651], length 1314
15:52:13.464090 IP 99.181.69.110.1935 > 10.8.2.7.59200: Flags [.], ack 119024, win 126, options [nop,nop,TS val 2787649715 ecr 87330743], length 0
15:52:13.470738 IP 99.181.69.110.1935 > 10.8.2.7.59200: Flags [.], ack 119142, win 126, options [nop,nop,TS val 2787649722 ecr 87330782], length 0
15:52:13.470764 IP 10.8.2.7.59200 > 99.181.69.110.1935: Flags [P.], seq 127026:127060, ack 1, win 501, options [nop,nop,TS val 87331050 ecr 2787649722], length 34
15:52:13.535195 IP 10.8.2.7.59200 > 99.181.69.110.1935: Flags [.], seq 127060:128374, ack 1, win 501, options [nop,nop,TS val 87331115 ecr 2787649722], length 1314
15:52:13.559470 IP 10.8.2.7.59200 > 99.181.69.110.1935: Flags [.], seq 128374:129688, ack 1, win 501, options [nop,nop,TS val 87331139 ecr 2787649722], length 1314
15:52:13.568688 IP 99.181.69.110.1935 > 10.8.2.7.59200: Flags [.], ack 121770, win 126, options [nop,nop,TS val 2787649820 ecr 87330842], length 0
15:52:13.599047 IP 10.8.2.7.59200 > 99.181.69.110.1935: Flags [.], seq 129688:131002, ack 1, win 501, options [nop,nop,TS val 87331178 ecr 2787649820], length 1314
15:52:13.661068 IP 99.181.69.110.1935 > 10.8.2.7.59200: Flags [.], ack 123084, win 126, options [nop,nop,TS val 2787649912 ecr 87330908], length 0
15:52:13.663626 IP 10.8.2.7.59200 > 99.181.69.110.1935: Flags [.], seq 131002:132316, ack 1, win 501, options [nop,nop,TS val 87331243 ecr 2787649912], length 1314
15:52:13.692799 IP 10.8.2.7.59200 > 99.181.69.110.1935: Flags [.], seq 132316:133630, ack 1, win 501, options [nop,nop,TS val 87331272 ecr 2787649912], length 1314
15:52:13.698720 IP 99.181.69.110.1935 > 10.8.2.7.59200: Flags [.], ack 125712, win 126, options [nop,nop,TS val 2787649950 ecr 87330976], length 0
15:52:13.727042 IP 10.8.2.7.59200 > 99.181.69.110.1935: Flags [.], seq 133630:134944, ack 1, win 501, options [nop,nop,TS val 87331306 ecr 2787649950], length 1314
15:52:13.739277 IP 99.181.69.110.1935 > 10.8.2.7.59200: Flags [.], ack 127060, win 126, options [nop,nop,TS val 2787649990 ecr 87331043], length 0
15:52:13.739292 IP 10.8.2.7.59200 > 99.181.69.110.1935: Flags [P.], seq 134944:135079, ack 1, win 501, options [nop,nop,TS val 87331319 ecr 2787649990], length 135
15:52:13.797209 IP 10.8.2.7.59200 > 99.181.69.110.1935: Flags [.], seq 135079:136393, ack 1, win 501, options [nop,nop,TS val 87331377 ecr 2787649990], length 1314
15:52:13.827858 IP 99.181.69.110.1935 > 10.8.2.7.59200: Flags [.], ack 129688, win 126, options [nop,nop,TS val 2787650079 ecr 87331115], length 0
15:52:13.833613 IP 10.8.2.7.59200 > 99.181.69.110.1935: Flags [.], seq 136393:137707, ack 1, win 501, options [nop,nop,TS val 87331413 ecr 2787650079], length 1314
15:52:13.860918 IP 10.8.2.7.59200 > 99.181.69.110.1935: Flags [.], seq 137707:139021, ack 1, win 501, options [nop,nop,TS val 87331440 ecr 2787650079], length 1314
15:52:13.928843 IP 10.8.2.7.59200 > 99.181.69.110.1935: Flags [.], seq 139021:140335, ack 1, win 501, options [nop,nop,TS val 87331508 ecr 2787650079], length 1314
15:52:13.932353 IP 99.181.69.110.1935 > 10.8.2.7.59200: Flags [.], ack 132316, win 126, options [nop,nop,TS val 2787650184 ecr 87331178], length 0
15:52:13.961436 IP 10.8.2.7.59200 > 99.181.69.110.1935: Flags [.], seq 140335:141649, ack 1, win 501, options [nop,nop,TS val 87331541 ecr 2787650184], length 1314
15:52:13.992804 IP 10.8.2.7.59200 > 99.181.69.110.1935: Flags [.], seq 141649:142963, ack 1, win 501, options [nop,nop,TS val 87331572 ecr 2787650184], length 1314
15:52:13.998291 IP 99.181.69.110.1935 > 10.8.2.7.59200: Flags [.], ack 134944, win 126, options [nop,nop,TS val 2787650247 ecr 87331272], length 0
15:52:14.007607 IP 99.181.69.110.1935 > 10.8.2.7.59200: Flags [.], ack 135079, win 126, options [nop,nop,TS val 2787650259 ecr 87331319], length 0
15:52:14.007623 IP 10.8.2.7.59200 > 99.181.69.110.1935: Flags [P.], seq 142963:143085, ack 1, win 501, options [nop,nop,TS val 87331587 ecr 2787650259], length 122
15:52:14.068574 IP 10.8.2.7.59200 > 99.181.69.110.1935: Flags [.], seq 143085:144399, ack 1, win 501, options [nop,nop,TS val 87331648 ecr 2787650259], length 1314
15:52:14.092915 IP 10.8.2.7.59200 > 99.181.69.110.1935: Flags [.], seq 144399:145713, ack 1, win 501, options [nop,nop,TS val 87331672 ecr 2787650259], length 1314
15:52:14.102445 IP 99.181.69.110.1935 > 10.8.2.7.59200: Flags [.], ack 137707, win 126, options [nop,nop,TS val 2787650353 ecr 87331377], length 0
15:52:14.132547 IP 10.8.2.7.59200 > 99.181.69.110.1935: Flags [.], seq 145713:147027, ack 1, win 501, options [nop,nop,TS val 87331712 ecr 2787650353], length 1314
15:52:14.192388 IP 99.181.69.110.1935 > 10.8.2.7.59200: Flags [.], ack 139021, win 126, options [nop,nop,TS val 2787650440 ecr 87331440], length 0
15:52:14.197094 IP 10.8.2.7.59200 > 99.181.69.110.1935: Flags [.], seq 147027:148341, ack 1, win 501, options [nop,nop,TS val 87331776 ecr 2787650440], length 1314
15:52:14.230069 IP 10.8.2.7.59200 > 99.181.69.110.1935: Flags [.], seq 148341:149655, ack 1, win 501, options [nop,nop,TS val 87331809 ecr 2787650440], length 1314
15:52:14.230164 IP 99.181.69.110.1935 > 10.8.2.7.59200: Flags [.], ack 141649, win 126, options [nop,nop,TS val 2787650481 ecr 87331508], length 0
15:52:14.261983 IP 10.8.2.7.59200 > 99.181.69.110.1935: Flags [.], seq 149655:150969, ack 1, win 501, options [nop,nop,TS val 87331841 ecr 2787650481], length 1314
15:52:14.276585 IP 99.181.69.110.1935 > 10.8.2.7.59200: Flags [.], ack 143085, win 126, options [nop,nop,TS val 2787650527 ecr 87331572], length 0
15:52:14.276604 IP 10.8.2.7.59200 > 99.181.69.110.1935: Flags [P.], seq 150969:151004, ack 1, win 501, options [nop,nop,TS val 87331856 ecr 2787650527], length 35
15:52:14.327668 IP 10.8.2.7.59200 > 99.181.69.110.1935: Flags [.], seq 151004:152318, ack 1, win 501, options [nop,nop,TS val 87331907 ecr 2787650527], length 1314
15:52:14.361453 IP 99.181.69.110.1935 > 10.8.2.7.59200: Flags [.], ack 145713, win 126, options [nop,nop,TS val 2787650613 ecr 87331648], length 0
15:52:14.367502 IP 10.8.2.7.59200 > 99.181.69.110.1935: Flags [.], seq 152318:153632, ack 1, win 501, options [nop,nop,TS val 87331947 ecr 2787650613], length 1314
15:52:14.394050 IP 10.8.2.7.59200 > 99.181.69.110.1935: Flags [.], seq 153632:154946, ack 1, win 501, options [nop,nop,TS val 87331973 ecr 2787650613], length 1314
15:52:14.463830 IP 10.8.2.7.59200 > 99.181.69.110.1935: Flags [.], seq 154946:156260, ack 1, win 501, options [nop,nop,TS val 87332043 ecr 2787650613], length 1314
15:52:14.466030 IP 99.181.69.110.1935 > 10.8.2.7.59200: Flags [.], ack 148341, win 126, options [nop,nop,TS val 2787650717 ecr 87331712], length 0
15:52:14.496903 IP 10.8.2.7.59200 > 99.181.69.110.1935: Flags [.], seq 156260:157574, ack 1, win 501, options [nop,nop,TS val 87332076 ecr 2787650717], length 1314
15:52:14.527665 IP 10.8.2.7.59200 > 99.181.69.110.1935: Flags [.], seq 157574:158888, ack 1, win 501, options [nop,nop,TS val 87332107 ecr 2787650717], length 1314
15:52:14.530716 IP 99.181.69.110.1935 > 10.8.2.7.59200: Flags [.], ack 150969, win 126, options [nop,nop,TS val 2787650782 ecr 87331809], length 0
15:52:14.545161 IP 99.181.69.110.1935 > 10.8.2.7.59200: Flags [.], ack 151004, win 126, options [nop,nop,TS val 2787650796 ecr 87331856], length 0
15:52:14.545175 IP 10.8.2.7.59200 > 99.181.69.110.1935: Flags [P.], seq 158888:159022, ack 1, win 501, options [nop,nop,TS val 87332124 ecr 2787650796], length 134
15:52:14.602920 IP 10.8.2.7.59200 > 99.181.69.110.1935: Flags [.], seq 159022:160336, ack 1, win 501, options [nop,nop,TS val 87332182 ecr 2787650796], length 1314
15:52:14.630516 IP 10.8.2.7.59200 > 99.181.69.110.1935: Flags [.], seq 160336:161650, ack 1, win 501, options [nop,nop,TS val 87332210 ecr 2787650796], length 1314
15:52:14.636078 IP 99.181.69.110.1935 > 10.8.2.7.59200: Flags [.], ack 153632, win 126, options [nop,nop,TS val 2787650887 ecr 87331907], length 0
15:52:14.667356 IP 10.8.2.7.59200 > 99.181.69.110.1935: Flags [.], seq 161650:162964, ack 1, win 501, options [nop,nop,TS val 87332247 ecr 2787650887], length 1314
15:52:14.731606 IP 10.8.2.7.59200 > 99.181.69.110.1935: Flags [.], seq 162964:164278, ack 1, win 501, options [nop,nop,TS val 87332311 ecr 2787650887], length 1314
15:52:14.732646 IP 99.181.69.110.1935 > 10.8.2.7.59200: Flags [.], ack 156260, win 126, options [nop,nop,TS val 2787650984 ecr 87331973], length 0
15:52:14.763612 IP 10.8.2.7.59200 > 99.181.69.110.1935: Flags [.], seq 164278:165592, ack 1, win 501, options [nop,nop,TS val 87332343 ecr 2787650984], length 1314
15:52:14.795902 IP 10.8.2.7.59200 > 99.181.69.110.1935: Flags [.], seq 165592:166906, ack 1, win 501, options [nop,nop,TS val 87332375 ecr 2787650984], length 1314
15:52:14.796266 IP 99.181.69.110.1935 > 10.8.2.7.59200: Flags [.], ack 158888, win 126, options [nop,nop,TS val 2787651048 ecr 87332076], length 0
15:52:14.813885 IP 99.181.69.110.1935 > 10.8.2.7.59200: Flags [.], ack 159022, win 126, options [nop,nop,TS val 2787651065 ecr 87332124], length 0
15:52:14.813901 IP 10.8.2.7.59200 > 99.181.69.110.1935: Flags [P.], seq 166906:166929, ack 1, win 501, options [nop,nop,TS val 87332393 ecr 2787651065], length 23
15:52:14.863964 IP 10.8.2.7.59200 > 99.181.69.110.1935: Flags [.], seq 166929:168243, ack 1, win 501, options [nop,nop,TS val 87332443 ecr 2787651065], length 1314
15:52:14.899079 IP 99.181.69.110.1935 > 10.8.2.7.59200: Flags [.], ack 161650, win 126, options [nop,nop,TS val 2787651150 ecr 87332182], length 0
15:52:14.902251 IP 10.8.2.7.59200 > 99.181.69.110.1935: Flags [.], seq 168243:169557, ack 1, win 501, options [nop,nop,TS val 87332482 ecr 2787651150], length 1314
15:52:14.926893 IP 10.8.2.7.59200 > 99.181.69.110.1935: Flags [.], seq 169557:170871, ack 1, win 501, options [nop,nop,TS val 87332506 ecr 2787651150], length 1314
15:52:14.993970 IP 10.8.2.7.59200 > 99.181.69.110.1935: Flags [.], seq 170871:172185, ack 1, win 501, options [nop,nop,TS val 87332573 ecr 2787651150], length 1314
15:52:14.997467 IP 99.181.69.110.1935 > 10.8.2.7.59200: Flags [.], ack 162964, win 126, options [nop,nop,TS val 2787651248 ecr 87332247], length 0
15:52:15.030150 IP 10.8.2.7.59200 > 99.181.69.110.1935: Flags [.], seq 172185:173499, ack 1, win 501, options [nop,nop,TS val 87332609 ecr 2787651248], length 1314
15:52:15.032673 IP 99.181.69.110.1935 > 10.8.2.7.59200: Flags [.], ack 165592, win 126, options [nop,nop,TS val 2787651284 ecr 87332311], length 0
15:52:15.061530 IP 10.8.2.7.59200 > 99.181.69.110.1935: Flags [.], seq 173499:174813, ack 1, win 501, options [nop,nop,TS val 87332641 ecr 2787651284], length 1314
15:52:15.082425 IP 99.181.69.110.1935 > 10.8.2.7.59200: Flags [.], ack 166929, win 126, options [nop,nop,TS val 2787651333 ecr 87332375], length 0
15:52:15.082465 IP 10.8.2.7.59200 > 99.181.69.110.1935: Flags [P.], seq 174813:174943, ack 1, win 501, options [nop,nop,TS val 87332662 ecr 2787651333], length 130
15:52:15.137415 IP 10.8.2.7.59200 > 99.181.69.110.1935: Flags [.], seq 174943:176257, ack 1, win 501, options [nop,nop,TS val 87332717 ecr 2787651333], length 1314
15:52:15.163797 IP 10.8.2.7.59200 > 99.181.69.110.1935: Flags [.], seq 176257:177571, ack 1, win 501, options [nop,nop,TS val 87332743 ecr 2787651333], length 1314
15:52:15.170703 IP 99.181.69.110.1935 > 10.8.2.7.59200: Flags [.], ack 169557, win 126, options [nop,nop,TS val 2787651422 ecr 87332443], length 0
15:52:15.201665 IP 10.8.2.7.59200 > 99.181.69.110.1935: Flags [.], seq 177571:178885, ack 1, win 501, options [nop,nop,TS val 87332781 ecr 2787651422], length 1314
15:52:15.260838 IP 99.181.69.110.1935 > 10.8.2.7.59200: Flags [.], ack 170871, win 126, options [nop,nop,TS val 2787651512 ecr 87332506], length 0
15:52:15.265387 IP 10.8.2.7.59200 > 99.181.69.110.1935: Flags [.], seq 178885:180199, ack 1, win 501, options [nop,nop,TS val 87332845 ecr 2787651512], length 1314
15:52:15.292693 IP 10.8.2.7.59200 > 99.181.69.110.1935: Flags [.], seq 180199:181513, ack 1, win 501, options [nop,nop,TS val 87332872 ecr 2787651512], length 1314
15:52:15.299414 IP 99.181.69.110.1935 > 10.8.2.7.59200: Flags [.], ack 173499, win 126, options [nop,nop,TS val 2787651551 ecr 87332573], length 0
15:52:15.329104 IP 10.8.2.7.59200 > 99.181.69.110.1935: Flags [.], seq 181513:182827, ack 1, win 501, options [nop,nop,TS val 87332908 ecr 2787651551], length 1314
15:52:15.350917 IP 99.181.69.110.1935 > 10.8.2.7.59200: Flags [.], ack 174943, win 126, options [nop,nop,TS val 2787651602 ecr 87332641], length 0
15:52:15.350947 IP 10.8.2.7.59200 > 99.181.69.110.1935: Flags [P.], seq 182827:182961, ack 1, win 501, options [nop,nop,TS val 87332930 ecr 2787651602], length 134
15:52:15.397011 IP 10.8.2.7.59200 > 99.181.69.110.1935: Flags [.], seq 182961:184275, ack 1, win 501, options [nop,nop,TS val 87332976 ecr 2787651602], length 1314
15:52:15.432363 IP 99.181.69.110.1935 > 10.8.2.7.59200: Flags [.], ack 177571, win 126, options [nop,nop,TS val 2787651684 ecr 87332717], length 0
