16:04:23.876008 IP 52.223.225.153.1935 > 10.8.1.3.35184: Flags [.], ack 404675057, win 126, options [nop,nop,TS val 3040486272 ecr 3603169679], length 0
16:04:23.889567 IP 10.8.1.3.35184 > 52.223.225.153.1935: Flags [.], seq 10560:11874, ack 0, win 501, options [nop,nop,TS val 3603170129 ecr 3040486272], length 1314
16:04:23.918705 IP 10.8.1.3.35184 > 52.223.225.153.1935: Flags [.], seq 11874:13188, ack 0, win 501, options [nop,nop,TS val 3603170158 ecr 3040486272], length 1314
16:04:23.954036 IP 10.8.1.3.35184 > 52.223.225.153.1935: Flags [.], seq 13188:14502, ack 0, win 501, options [nop,nop,TS val 3603170193 ecr 3040486272], length 1314
16:04:23.961644 IP 52.223.225.153.1935 > 10.8.1.3.35184: Flags [.], ack 2629, win 126, options [nop,nop,TS val 3040486358 ecr 3603169765], length 0
16:04:24.018013 IP 10.8.1.3.35184 > 52.223.225.153.1935: Flags [.], seq 14502:15816, ack 0, win 501, options [nop,nop,TS val 3603170257 ecr 3040486358], length 1314
16:04:24.051794 IP 52.223.225.153.1935 > 10.8.1.3.35184: Flags [.], ack 5257, win 126, options [nop,nop,TS val 3040486443 ecr 3603169857], length 0
16:04:24.060778 IP 10.8.1.3.35184 > 52.223.225.153.1935: Flags [.], seq 15816:17130, ack 0, win 501, options [nop,nop,TS val 3603170300 ecr 3040486443], length 1314
16:04:24.084116 IP 10.8.1.3.35184 > 52.223.225.153.1935: Flags [.], seq 17130:18444, ack 0, win 501, options [nop,nop,TS val 3603170323 ecr 3040486443], length 1314
16:04:24.102233 IP 52.223.225.153.1935 > 10.8.1.3.35184: Flags [.], ack 6618, win 126, options [nop,nop,TS val 3040486498 ecr 3603169936], length 0
16:04:24.102266 IP 10.8.1.3.35184 > 52.223.225.153.1935: Flags [P.], seq 18444:18494, ack 0, win 501, options [nop,nop,TS val 3603170342 ecr 3040486498], length 50
16:04:24.151268 IP 10.8.1.3.35184 > 52.223.225.153.1935: Flags [.], seq 18494:19808, ack 0, win 501, options [nop,nop,TS val 3603170391 ecr 3040486498], length 1314
16:04:24.181445 IP 52.223.225.153.1935 > 10.8.1.3.35184: Flags [.], ack 9246, win 126, options [nop,nop,TS val 3040486577 ecr 3603169991], length 0
16:04:24.189326 IP 10.8.1.3.35184 > 52.223.225.153.1935: Flags [.], seq 19808:21122, ack 0, win 501, options [nop,nop,TS val 3603170429 ecr 3040486577], length 1314
16:04:24.217581 IP 10.8.1.3.35184 > 52.223.225.153.1935: Flags [.], seq 21122:22436, ack 0, win 501, options [nop,nop,TS val 3603170457 ecr 3040486577], length 1314
16:04:24.283024 IP 52.223.225.153.1935 > 10.8.1.3.35184: Flags [.], ack 11874, win 126, options [nop,nop,TS val 3040486679 ecr 3603170065], length 0
16:04:24.285232 IP 10.8.1.3.35184 > 52.223.225.153.1935: Flags [.], seq 22436:23750, ack 0, win 501, options [nop,nop,TS val 3603170525 ecr 3040486679], length 1314
16:04:24.318741 IP 10.8.1.3.35184 > 52.223.225.153.1935: Flags [.], seq 23750:25064, ack 0, win 501, options [nop,nop,TS val 3603170558 ecr 3040486679], length 1314
16:04:24.347434 IP 52.223.225.153.1935 > 10.8.1.3.35184: Flags [.], ack 14502, win 126, options [nop,nop,TS val 3040486744 ecr 3603170158], length 0
16:04:24.360560 IP 10.8.1.3.35184 > 52.223.225.153.1935: Flags [.], seq 25064:26378, ack 0, win 501, options [nop,nop,TS val 3603170600 ecr 3040486744], length 1314
16:04:24.424213 IP 10.8.1.3.35184 > 52.223.225.153.1935: Flags [.], seq 26378:27692, ack 0, win 501, options [nop,nop,TS val 3603170664 ecr 3040486744], length 1314
16:04:24.451141 IP 10.8.1.3.35184 > 52.223.225.153.1935: Flags [.], seq 27692:29006, ack 0, win 501, options [nop,nop,TS val 3603170690 ecr 3040486744], length 1314
16:04:24.453886 IP 52.223.225.153.1935 > 10.8.1.3.35184: Flags [.], ack 17130, win 126, options [nop,nop,TS val 3040486850 ecr 3603170257], length 0
16:04:24.487822 IP 10.8.1.3.35184 > 52.223.225.153.1935: Flags [.], seq 29006:30320, ack 0, win 501, options [nop,nop,TS val 3603170727 ecr 3040486850], length 1314
16:04:24.495995 IP 52.223.225.153.1935 > 10.8.1.3.35184: Flags [.], ack 18494, win 126, options [nop,nop,TS val 3040486891 ecr 3603170323], length 0
16:04:24.496009 IP 10.8.1.3.35184 > 52.223.225.153.1935: Flags [P.], seq 30320:30461, ack 0, win 501, options [nop,nop,TS val 3603170735 ecr 3040486891], length 141
16:04:24.552008 IP 10.8.1.3.35184 > 52.223.225.153.1935: Flags [.], seq 30461:31775, ack 0, win 501, options [nop,nop,TS val 3603170791 ecr 3040486891], length 1314
16:04:24.583134 IP 52.223.225.153.1935 > 10.8.1.3.35184: Flags [.], ack 21122, win 126, options [nop,nop,TS val 3040486979 ecr 3603170391], length 0
16:04:24.594779 IP 10.8.1.3.35184 > 52.223.225.153.1935: Flags [.], seq 31775:33089, ack 0, win 501, options [nop,nop,TS val 3603170834 ecr 3040486979], length 1314
16:04:24.616082 IP 10.8.1.3.35184 > 52.223.225.153.1935: Flags [.], seq 33089:34403, ack 0, win 501, options [nop,nop,TS val 3603170855 ecr 3040486979], length 1314
16:04:24.671385 IP 52.223.225.153.1935 > 10.8.1.3.35184: Flags [.], ack 22436, win 126, options [nop,nop,TS val 3040487067 ecr 3603170457], length 0
16:04:24.685287 IP 10.8.1.3.35184 > 52.223.225.153.1935: Flags [.], seq 34403:35717, ack 0, win 501, options [nop,nop,TS val 3603170925 ecr 3040487067], length 1314
16:04:24.711853 IP 52.223.225.153.1935 > 10.8.1.3.35184: Flags [.], ack 25064, win 126, options [nop,nop,TS val 3040487108 ecr 3603170525], length 0
16:04:24.723495 IP 10.8.1.3.35184 > 52.223.225.153.1935: Flags [.], seq 35717:37031, ack 0, win 501, options [nop,nop,TS val 3603170963 ecr 3040487108], length 1314
16:04:24.750317 IP 10.8.1.3.35184 > 52.223.225.153.1935: Flags [.], seq 37031:38345, ack 0, win 501, options [nop,nop,TS val 3603170990 ecr 3040487108], length 1314
16:04:24.816881 IP 10.8.1.3.35184 > 52.223.225.153.1935: Flags [.], seq 38345:39659, ack 0, win 501, options [nop,nop,TS val 3603171056 ecr 3040487108], length 1314
16:04:24.817522 IP 52.223.225.153.1935 > 10.8.1.3.35184: Flags [.], ack 27692, win 126, options [nop,nop,TS val 3040487213 ecr 3603170600], length 0
16:04:24.851560 IP 10.8.1.3.35184 > 52.223.225.153.1935: Flags [.], seq 39659:40973, ack 0, win 501, options [nop,nop,TS val 3603171091 ecr 3040487213], length 1314
16:04:24.881115 IP 52.223.225.153.1935 > 10.8.1.3.35184: Flags [.], ack 30320, win 126, options [nop,nop,TS val 3040487277 ecr 3603170690], length 0
16:04:24.888880 IP 52.223.225.153.1935 > 10.8.1.3.35184: Flags [.], ack 30461, win 126, options [nop,nop,TS val 3040487285 ecr 3603170735], length 0
16:04:24.888891 IP 10.8.1.3.35184 > 52.223.225.153.1935: Flags [P.], seq 40973:41590, ack 0, win 501, options [nop,nop,TS val 3603171128 ecr 3040487285], length 617
16:04:24.916426 IP 10.8.1.3.35184 > 52.223.225.153.1935: Flags [.], seq 41590:42904, ack 0, win 501, options [nop,nop,TS val 3603171156 ecr 3040487285], length 1314
16:04:24.957764 IP 10.8.1.3.35184 > 52.223.225.153.1935: Flags [.], seq 42904:44218, ack 0, win 501, options [nop,nop,TS val 3603171197 ecr 3040487285], length 1314
16:04:24.988108 IP 52.223.225.153.1935 > 10.8.1.3.35184: Flags [.], ack 33089, win 126, options [nop,nop,TS val 3040487384 ecr 3603170791], length 0
16:04:25.016681 IP 10.8.1.3.35184 > 52.223.225.153.1935: Flags [.], seq 44218:45532, ack 0, win 501, options [nop,nop,TS val 3603171256 ecr 3040487384], length 1314
16:04:25.050064 IP 10.8.1.3.35184 > 52.223.225.153.1935: Flags [.], seq 45532:46846, ack 0, win 501, options [nop,nop,TS val 3603171289 ecr 3040487384], length 1314
16:04:25.071617 IP 52.223.225.153.1935 > 10.8.1.3.35184: Flags [.], ack 34403, win 126, options [nop,nop,TS val 3040487467 ecr 3603170855], length 0
16:04:25.085266 IP 10.8.1.3.35184 > 52.223.225.153.1935: Flags [.], seq 46846:48160, ack 0, win 501, options [nop,nop,TS val 3603171325 ecr 3040487467], length 1314
16:04:25.117254 IP 52.223.225.153.1935 > 10.8.1.3.35184: Flags [.], ack 37031, win 126, options [nop,nop,TS val 3040487513 ecr 3603170925], length 0
16:04:25.149815 IP 10.8.1.3.35184 > 52.223.225.153.1935: Flags [.], seq 48160:49474, ack 0, win 501, options [nop,nop,TS val 3603171389 ecr 3040487513], length 1314
16:04:25.192716 IP 10.8.1.3.35184 > 52.223.225.153.1935: Flags [.], seq 49474:50788, ack 0, win 501, options [nop,nop,TS val 3603171432 ecr 3040487513], length 1314
16:04:25.210356 IP 52.223.225.153.1935 > 10.8.1.3.35184: Flags [.], ack 39659, win 126, options [nop,nop,TS val 3040487606 ecr 3603170990], length 0
16:04:25.219414 IP 10.8.1.3.35184 > 52.223.225.153.1935: Flags [.], seq 50788:52102, ack 0, win 501, options [nop,nop,TS val 3603171459 ecr 3040487606], length 1314
16:04:25.278459 IP 10.8.1.3.35184 > 52.223.225.153.1935: Flags [.], seq 52102:53416, ack 0, win 501, options [nop,nop,TS val 3603171518 ecr 3040487606], length 1314
16:04:25.282022 IP 52.223.225.153.1935 > 10.8.1.3.35184: Flags [.], ack 41590, win 126, options [nop,nop,TS val 3040487678 ecr 3603171091], length 0
16:04:25.282065 IP 10.8.1.3.35184 > 52.223.225.153.1935: Flags [P.], seq 53416:53462, ack 0, win 501, options [nop,nop,TS val 3603171521 ecr 3040487678], length 46
16:04:25.320821 IP 10.8.1.3.35184 > 52.223.225.153.1935: Flags [.], seq 53462:54776, ack 0, win 501, options [nop,nop,TS val 3603171560 ecr 3040487678], length 1314
16:04:25.350948 IP 10.8.1.3.35184 > 52.223.225.153.1935: Flags [.], seq 54776:56090, ack 0, win 501, options [nop,nop,TS val 3603171590 ecr 3040487678], length 1314
16:04:25.350971 IP 52.223.225.153.1935 > 10.8.1.3.35184: Flags [.], ack 44218, win 126, options [nop,nop,TS val 3040487747 ecr 3603171156], length 0
16:04:25.406082 IP 10.8.1.3.35184 > 52.223.225.153.1935: Flags [.], seq 56090:57404, ack 0, win 501, options [nop,nop,TS val 3603171645 ecr 3040487747], length 1314
16:04:25.443511 IP 52.223.225.153.1935 > 10.8.1.3.35184: Flags [.], ack 46846, win 126, options [nop,nop,TS val 3040487840 ecr 3603171256], length 0
16:04:25.450278 IP 10.8.1.3.35184 > 52.223.225.153.1935: Flags [.], seq 57404:58718, ack 0, win 501, options [nop,nop,TS val 3603171690 ecr 3040487840], length 1314
16:04:25.491425 IP 10.8.1.3.35184 > 52.223.225.153.1935: Flags [.], seq 58718:60032, ack 0, win 501, options [nop,nop,TS val 3603171731 ecr 3040487840], length 1314
16:04:25.534160 IP 10.8.1.3.35184 > 52.223.225.153.1935: Flags [.], seq 60032:61346, ack 0, win 501, options [nop,nop,TS val 3603171773 ecr 3040487840], length 1314
16:04:25.543057 IP 52.223.225.153.1935 > 10.8.1.3.35184: Flags [.], ack 49474, win 126, options [nop,nop,TS val 3040487939 ecr 3603171325], length 0
16:04:25.583061 IP 10.8.1.3.35184 > 52.223.225.153.1935: Flags [.], seq 61346:62660, ack 0, win 501, options [nop,nop,TS val 3603171822 ecr 3040487939], length 1314
16:04:25.613129 IP 52.223.225.153.1935 > 10.8.1.3.35184: Flags [.], ack 52102, win 126, options [nop,nop,TS val 3040488009 ecr 3603171432], length 0
16:04:25.619468 IP 10.8.1.3.35184 > 52.223.225.153.1935: Flags [.], seq 62660:63974, ack 0, win 501, options [nop,nop,TS val 3603171859 ecr 3040488009], length 1314
16:04:25.662583 IP 10.8.1.3.35184 > 52.223.225.153.1935: Flags [.], seq 63974:65288, ack 0, win 501, options [nop,nop,TS val 3603171902 ecr 3040488009], length 1314
16:04:25.675248 IP 52.223.225.153.1935 > 10.8.1.3.35184: Flags [.], ack 53462, win 126, options [nop,nop,TS val 3040488071 ecr 3603171518], length 0
16:04:25.675270 IP 10.8.1.3.35184 > 52.223.225.153.1935: Flags [P.], seq 65288:65339, ack 0, win 501, options [nop,nop,TS val 3603171915 ecr 3040488071], length 51
16:04:25.726382 IP 10.8.1.3.35184 > 52.223.225.153.1935: Flags [.], seq 65339:66653, ack 0, win 501, options [nop,nop,TS val 3603171966 ecr 3040488071], length 1314
16:04:25.744348 IP 52.223.225.153.1935 > 10.8.1.3.35184: Flags [.], ack 56090, win 126, options [nop,nop,TS val 3040488140 ecr 3603171560], length 0
16:04:25.750284 IP 10.8.1.3.35184 > 52.223.225.153.1935: Flags [.], seq 66653:67967, ack 0, win 501, options [nop,nop,TS val 3603171990 ecr 3040488140], length 1314
16:04:25.790482 IP 10.8.1.3.35184 > 52.223.225.153.1935: Flags [.], seq 67967:69281, ack 0, win 501, options [nop,nop,TS val 3603172030 ecr 3040488140], length 1314
16:04:25.843639 IP 52.223.225.153.1935 > 10.8.1.3.35184: Flags [.], ack 58718, win 126, options [nop,nop,TS val 3040488240 ecr 3603171645], length 0
16:04:25.854707 IP 10.8.1.3.35184 > 52.223.225.153.1935: Flags [.], seq 69281:70595, ack 0, win 501, options [nop,nop,TS val 3603172094 ecr 3040488240], length 1314
16:04:25.885319 IP 10.8.1.3.35184 > 52.223.225.153.1935: Flags [.], seq 70595:71909, ack 0, win 501, options [nop,nop,TS val 3603172125 ecr 3040488240], length 1314
16:04:25.919425 IP 10.8.1.3.35184 > 52.223.225.153.1935: Flags [.], seq 71909:73223, ack 0, win 501, options [nop,nop,TS val 3603172159 ecr 3040488240], length 1314
16:04:25.927698 IP 52.223.225.153.1935 > 10.8.1.3.35184: Flags [.], ack 61346, win 126, options [nop,nop,TS val 3040488323 ecr 3603171731], length 0
16:04:25.983768 IP 10.8.1.3.35184 > 52.223.225.153.1935: Flags [.], seq 73223:74537, ack 0, win 501, options [nop,nop,TS val 3603172223 ecr 3040488323], length 1314
16:04:26.013047 IP 52.223.225.153.1935 > 10.8.1.3.35184: Flags [.], ack 63974, win 126, options [nop,nop,TS val 3040488409 ecr 3603171822], length 0
16:04:26.026241 IP 10.8.1.3.35184 > 52.223.225.153.1935: Flags [.], seq 74537:75851, ack 0, win 501, options [nop,nop,TS val 3603172266 ecr 3040488409], length 1314
16:04:26.050505 IP 10.8.1.3.35184 > 52.223.225.153.1935: Flags [.], seq 75851:77165, ack 0, win 501, options [nop,nop,TS val 3603172290 ecr 3040488409], length 1314
16:04:26.068883 IP 52.223.225.153.1935 > 10.8.1.3.35184: Flags [.], ack 65339, win 126, options [nop,nop,TS val 3040488465 ecr 3603171902], length 0
16:04:26.068908 IP 10.8.1.3.35184 > 52.223.225.153.1935: Flags [P.], seq 77165:77215, ack 0, win 501, options [nop,nop,TS val 3603172308 ecr 3040488465], length 50
16:04:26.118171 IP 10.8.1.3.35184 > 52.223.225.153.1935: Flags [.], seq 77215:78529, ack 0, win 501, options [nop,nop,TS val 3603172357 ecr 3040488465], length 1314
16:04:26.147974 IP 52.223.225.153.1935 > 10.8.1.3.35184: Flags [.], ack 67967, win 126, options [nop,nop,TS val 3040488540 ecr 3603171966], length 0
16:04:26.154940 IP 10.8.1.3.35184 > 52.223.225.153.1935: Flags [.], seq 78529:79843, ack 0, win 501, options [nop,nop,TS val 3603172394 ecr 3040488540], length 1314
16:04:26.197885 IP 10.8.1.3.35184 > 52.223.225.153.1935: Flags [.], seq 79843:81157, ack 0, win 501, options [nop,nop,TS val 3603172437 ecr 3040488540], length 1314
16:04:26.252207 IP 52.223.225.153.1935 > 10.8.1.3.35184: Flags [.], ack 70595, win 126, options [nop,nop,TS val 3040488648 ecr 3603172030], length 0
16:04:26.261836 IP 10.8.1.3.35184 > 52.223.225.153.1935: Flags [.], seq 81157:82471, ack 0, win 501, options [nop,nop,TS val 3603172501 ecr 3040488648], length 1314
16:04:26.284586 IP 10.8.1.3.35184 > 52.223.225.153.1935: Flags [.], seq 82471:83785, ack 0, win 501, options [nop,nop,TS val 3603172524 ecr 3040488648], length 1314
16:04:26.313220 IP 52.223.225.153.1935 > 10.8.1.3.35184: Flags [.], ack 73223, win 126, options [nop,nop,TS val 3040488709 ecr 3603172125], length 0
16:04:26.326304 IP 10.8.1.3.35184 > 52.223.225.153.1935: Flags [.], seq 83785:85099, ack 0, win 501, options [nop,nop,TS val 3603172566 ecr 3040488709], length 1314
16:04:26.390359 IP 10.8.1.3.35184 > 52.223.225.153.1935: Flags [.], seq 85099:86413, ack 0, win 501, options [nop,nop,TS val 3603172630 ecr 3040488709], length 1314
16:04:26.416222 IP 10.8.1.3.35184 > 52.223.225.153.1935: Flags [.], seq 86413:87727, ack 0, win 501, options [nop,nop,TS val 3603172656 ecr 3040488709], length 1314
16:04:26.419957 IP 52.223.225.153.1935 > 10.8.1.3.35184: Flags [.], ack 75851, win 126, options [nop,nop,TS val 3040488816 ecr 3603172223], length 0
16:04:26.454359 IP 10.8.1.3.35184 > 52.223.225.153.1935: Flags [.], seq 87727:89041, ack 0, win 501, options [nop,nop,TS val 3603172694 ecr 3040488816], length 1314
16:04:26.461999 IP 52.223.225.153.1935 > 10.8.1.3.35184: Flags [.], ack 77215, win 126, options [nop,nop,TS val 3040488858 ecr 3603172290], length 0
16:04:26.462011 IP 10.8.1.3.35184 > 52.223.225.153.1935: Flags [P.], seq 89041:89186, ack 0, win 501, options [nop,nop,TS val 3603172701 ecr 3040488858], length 145
16:04:26.518155 IP 10.8.1.3.35184 > 52.223.225.153.1935: Flags [.], seq 89186:90500, ack 0, win 501, options [nop,nop,TS val 3603172757 ecr 3040488858], length 1314
16:04:26.548443 IP 52.223.225.153.1935 > 10.8.1.3.35184: Flags [.], ack 79843, win 126, options [nop,nop,TS val 3040488944 ecr 3603172357], length 0
16:04:26.560972 IP 10.8.1.3.35184 > 52.223.225.153.1935: Flags [.], seq 90500:91814, ack 0, win 501, options [nop,nop,TS val 3603172800 ecr 3040488944], length 1314
16:04:26.585681 IP 10.8.1.3.35184 > 52.223.225.153.1935: Flags [.], seq 91814:93128, ack 0, win 501, options [nop,nop,TS val 3603172825 ecr 3040488944], length 1314
16:04:26.647822 IP 10.8.1.3.35184 > 52.223.225.153.1935: Flags [.], seq 93128:94442, ack 0, win 501, options [nop,nop,TS val 3603172887 ecr 3040488944], length 1314
16:04:26.655085 IP 52.223.225.153.1935 > 10.8.1.3.35184: Flags [.], ack 82471, win 126, options [nop,nop,TS val 3040489051 ecr 3603172437], length 0
16:04:26.688927 IP 10.8.1.3.35184 > 52.223.225.153.1935: Flags [.], seq 94442:95756, ack 0, win 501, options [nop,nop,TS val 3603172928 ecr 3040489051], length 1314
16:04:26.720001 IP 52.223.225.153.1935 > 10.8.1.3.35184: Flags [.], ack 85099, win 126, options [nop,nop,TS val 3040489116 ecr 3603172524], length 0
16:04:26.731912 IP 10.8.1.3.35184 > 52.223.225.153.1935: Flags [.], seq 95756:97070, ack 0, win 501, options [nop,nop,TS val 3603172971 ecr 3040489116], length 1314
16:04:26.796312 IP 10.8.1.3.35184 > 52.223.225.153.1935: Flags [.], seq 97070:98384, ack 0, win 501, options [nop,nop,TS val 3603173036 ecr 3040489116], length 1314
16:04:26.809721 IP 52.223.225.153.1935 > 10.8.1.3.35184: Flags [.], ack 87727, win 126, options [nop,nop,TS val 3040489206 ecr 3603172630], length 0
16:04:26.818305 IP 10.8.1.3.35184 > 52.223.225.153.1935: Flags [.], seq 98384:99698, ack 0, win 501, options [nop,nop,TS val 3603173058 ecr 3040489206], length 1314
16:04:26.855100 IP 52.223.225.153.1935 > 10.8.1.3.35184: Flags [.], ack 89186, win 126, options [nop,nop,TS val 3040489251 ecr 3603172694], length 0
16:04:26.855121 IP 10.8.1.3.35184 > 52.223.225.153.1935: Flags [P.], seq 99698:100306, ack 0, win 501, options [nop,nop,TS val 3603173094 ecr 3040489251], length 608
16:04:26.881362 IP 10.8.1.3.35184 > 52.223.225.153.1935: Flags [.], seq 100306:101620, ack 0, win 501, options [nop,nop,TS val 3603173121 ecr 3040489251], length 1314
16:04:26.923973 IP 10.8.1.3.35184 > 52.223.225.153.1935: Flags [.], seq 101620:102934, ack 0, win 501, options [nop,nop,TS val 3603173163 ecr 3040489251], length 1314
16:04:26.954656 IP 52.223.225.153.1935 > 10.8.1.3.35184: Flags [.], ack 91814, win 126, options [nop,nop,TS val 3040489351 ecr 3603172757], length 0
16:04:26.985244 IP 10.8.1.3.35184 > 52.223.225.153.1935: Flags [.], seq 102934:104248, ack 0, win 501, options [nop,nop,TS val 3603173225 ecr 3040489351], length 1314
16:04:27.030697 IP 10.8.1.3.35184 > 52.223.225.153.1935: Flags [.], seq 104248:105562, ack 0, win 501, options [nop,nop,TS val 3603173270 ecr 3040489351], length 1314
16:04:27.035589 IP 52.223.225.153.1935 > 10.8.1.3.35184: Flags [.], ack 93128, win 126, options [nop,nop,TS val 3040489431 ecr 3603172825], length 0
16:04:27.051909 IP 10.8.1.3.35184 > 52.223.225.153.1935: Flags [.], seq 105562:106876, ack 0, win 501, options [nop,nop,TS val 3603173291 ecr 3040489431], length 1314
16:04:27.082570 IP 52.223.225.153.1935 > 10.8.1.3.35184: Flags [.], ack 95756, win 126, options [nop,nop,TS val 3040489479 ecr 3603172887], length 0
16:04:27.116487 IP 10.8.1.3.35184 > 52.223.225.153.1935: Flags [.], seq 106876:108190, ack 0, win 501, options [nop,nop,TS val 3603173356 ecr 3040489479], length 1314
16:04:27.158827 IP 10.8.1.3.35184 > 52.223.225.153.1935: Flags [.], seq 108190:109504, ack 0, win 501, options [nop,nop,TS val 3603173398 ecr 3040489479], length 1314
16:04:27.182510 IP 10.8.1.3.35184 > 52.223.225.153.1935: Flags [.], seq 109504:110818, ack 0, win 501, options [nop,nop,TS val 3603173422 ecr 3040489479], length 1314
16:04:27.190556 IP 52.223.225.153.1935 > 10.8.1.3.35184: Flags [.], ack 98384, win 126, options [nop,nop,TS val 3040489587 ecr 3603172971], length 0
16:04:27.244501 IP 10.8.1.3.35184 > 52.223.225.153.1935: Flags [.], seq 110818:112132, ack 0, win 501, options [nop,nop,TS val 3603173484 ecr 3040489587], length 1314
16:04:27.248321 IP 52.223.225.153.1935 > 10.8.1.3.35184: Flags [.], ack 100306, win 126, options [nop,nop,TS val 3040489644 ecr 3603173058], length 0
16:04:27.248365 IP 10.8.1.3.35184 > 52.223.225.153.1935: Flags [P.], seq 112132:112182, ack 0, win 501, options [nop,nop,TS val 3603173488 ecr 3040489644], length 50
16:04:27.287403 IP 10.8.1.3.35184 > 52.223.225.153.1935: Flags [.], seq 112182:113496, ack 0, win 501, options [nop,nop,TS val 3603173527 ecr 3040489644], length 1314
16:04:27.317100 IP 10.8.1.3.35184 > 52.223.225.153.1935: Flags [.], seq 113496:114810, ack 0, win 501, options [nop,nop,TS val 3603173556 ecr 3040489644], length 1314
16:04:27.317260 IP 52.223.225.153.1935 > 10.8.1.3.35184: Flags [.], ack 102934, win 126, options [nop,nop,TS val 3040489714 ecr 3603173121], length 0
16:04:27.351961 IP 10.8.1.3.35184 > 52.223.225.153.1935: Flags [.], seq 114810:116124, ack 0, win 501, options [nop,nop,TS val 3603173591 ecr 3040489714], length 1314
16:04:27.416790 IP 10.8.1.3.35184 > 52.223.225.153.1935: Flags [.], seq 116124:117438, ack 0, win 501, options [nop,nop,TS val 3603173656 ecr 3040489714], length 1314
16:04:27.423967 IP 52.223.225.153.1935 > 10.8.1.3.35184: Flags [.], ack 105562, win 126, options [nop,nop,TS val 3040489820 ecr 3603173225], length 0
16:04:27.452707 IP 10.8.1.3.35184 > 52.223.225.153.1935: Flags [.], seq 117438:118752, ack 0, win 501, options [nop,nop,TS val 3603173692 ecr 3040489820], length 1314
16:04:27.482756 IP 10.8.1.3.35184 > 52.223.225.153.1935: Flags [.], seq 118752:120066, ack 0, win 501, options [nop,nop,TS val 3603173722 ecr 3040489820], length 1314
16:04:27.510451 IP 52.223.225.153.1935 > 10.8.1.3.35184: Flags [.], ack 108190, win 126, options [nop,nop,TS val 3040489906 ecr 3603173291], length 0
16:04:27.551942 IP 10.8.1.3.35184 > 52.223.225.153.1935: Flags [.], seq 120066:121380, ack 0, win 501, options [nop,nop,TS val 3603173791 ecr 3040489906], length 1314
16:04:27.576118 IP 52.223.225.153.1935 > 10.8.1.3.35184: Flags [.], ack 110818, win 126, options [nop,nop,TS val 3040489972 ecr 3603173398], length 0
16:04:27.585270 IP 10.8.1.3.35184 > 52.223.225.153.1935: Flags [.], seq 121380:122694, ack 0, win 501, options [nop,nop,TS val 3603173825 ecr 3040489972], length 1314
16:04:27.618736 IP 10.8.1.3.35184 > 52.223.225.153.1935: Flags [.], seq 122694:124008, ack 0, win 501, options [nop,nop,TS val 3603173858 ecr 3040489972], length 1314
16:04:27.641758 IP 52.223.225.153.1935 > 10.8.1.3.35184: Flags [.], ack 112182, win 126, options [nop,nop,TS val 3040490037 ecr 3603173484], length 0
16:04:27.641797 IP 10.8.1.3.35184 > 52.223.225.153.1935: Flags [P.], seq 124008:124155, ack 0, win 501, options [nop,nop,TS val 3603173881 ecr 3040490037], length 147
16:04:27.685295 IP 10.8.1.3.35184 > 52.223.225.153.1935: Flags [.], seq 124155:125469, ack 0, win 501, options [nop,nop,TS val 3603173925 ecr 3040490037], length 1314
16:04:27.710994 IP 52.223.225.153.1935 > 10.8.1.3.35184: Flags [.], ack 114810, win 126, options [nop,nop,TS val 3040490107 ecr 3603173527], length 0
16:04:27.715962 IP 10.8.1.3.35184 > 52.223.225.153.1935: Flags [.], seq 125469:126783, ack 0, win 501, options [nop,nop,TS val 3603173955 ecr 3040490107], length 1314
16:04:27.760014 IP 10.8.1.3.35184 > 52.223.225.153.1935: Flags [.], seq 126783:128097, ack 0, win 501, options [nop,nop,TS val 3603173999 ecr 3040490107], length 1314
16:04:27.810213 IP 52.223.225.153.1935 > 10.8.1.3.35184: Flags [.], ack 117438, win 126, options [nop,nop,TS val 3040490206 ecr 3603173591], length 0
16:04:27.818539 IP 10.8.1.3.35184 > 52.223.225.153.1935: Flags [.], seq 128097:129411, ack 0, win 501, options [nop,nop,TS val 3603174058 ecr 3040490206], length 1314
16:04:27.852170 IP 10.8.1.3.35184 > 52.223.225.153.1935: Flags [.], seq 129411:130725, ack 0, win 501, options [nop,nop,TS val 3603174091 ecr 3040490206], length 1314
16:04:27.876161 IP 52.223.225.153.1935 > 10.8.1.3.35184: Flags [.], ack 120066, win 126, options [nop,nop,TS val 3040490272 ecr 3603173692], length 0
16:04:27.888554 IP 10.8.1.3.35184 > 52.223.225.153.1935: Flags [.], seq 130725:132039, ack 0, win 501, options [nop,nop,TS val 3603174128 ecr 3040490272], length 1314
16:04:27.951822 IP 10.8.1.3.35184 > 52.223.225.153.1935: Flags [.], seq 132039:133353, ack 0, win 501, options [nop,nop,TS val 3603174191 ecr 3040490272], length 1314
16:04:27.979027 IP 52.223.225.153.1935 > 10.8.1.3.35184: Flags [.], ack 122694, win 126, options [nop,nop,TS val 3040490375 ecr 3603173791], length 0
16:04:27.982199 IP 10.8.1.3.35184 > 52.223.225.153.1935: Flags [.], seq 133353:134667, ack 0, win 501, options [nop,nop,TS val 3603174222 ecr 3040490375], length 1314
16:04:28.016733 IP 10.8.1.3.35184 > 52.223.225.153.1935: Flags [.], seq 134667:135981, ack 0, win 501, options [nop,nop,TS val 3603174256 ecr 3040490375], length 1314
16:04:28.041118 IP 52.223.225.153.1935 > 10.8.1.3.35184: Flags [.], ack 124155, win 126, options [nop,nop,TS val 3040490431 ecr 3603173858], length 0
16:04:28.041154 IP 10.8.1.3.35184 > 52.223.225.153.1935: Flags [P.], seq 135981:136126, ack 0, win 501, options [nop,nop,TS val 3603174280 ecr 3040490431], length 145
16:04:28.084963 IP 10.8.1.3.35184 > 52.223.225.153.1935: Flags [.], seq 136126:137440, ack 0, win 501, options [nop,nop,TS val 3603174324 ecr 3040490431], length 1314
16:04:28.109665 IP 52.223.225.153.1935 > 10.8.1.3.35184: Flags [.], ack 126783, win 126, options [nop,nop,TS val 3040490505 ecr 3603173925], length 0
16:04:28.115929 IP 10.8.1.3.35184 > 52.223.225.153.1935: Flags [.], seq 137440:138754, ack 0, win 501, options [nop,nop,TS val 3603174355 ecr 3040490505], length 1314
16:04:28.166949 IP 10.8.1.3.35184 > 52.223.225.153.1935: Flags [.], seq 138754:140068, ack 0, win 501, options [nop,nop,TS val 3603174406 ecr 3040490505], length 1314
16:04:28.212028 IP 52.223.225.153.1935 > 10.8.1.3.35184: Flags [.], ack 129411, win 126, options [nop,nop,TS val 3040490608 ecr 3603173999], length 0
16:04:28.215784 IP 10.8.1.3.35184 > 52.223.225.153.1935: Flags [.], seq 140068:141382, ack 0, win 501, options [nop,nop,TS val 3603174455 ecr 3040490608], length 1314
16:04:28.248903 IP 10.8.1.3.35184 > 52.223.225.153.1935: Flags [.], seq 141382:142696, ack 0, win 501, options [nop,nop,TS val 3603174488 ecr 3040490608], length 1314
16:04:28.283403 IP 52.223.225.153.1935 > 10.8.1.3.35184: Flags [.], ack 132039, win 126, options [nop,nop,TS val 3040490679 ecr 3603174091], length 0
16:04:28.295208 IP 10.8.1.3.35184 > 52.223.225.153.1935: Flags [.], seq 142696:144010, ack 0, win 501, options [nop,nop,TS val 3603174535 ecr 3040490679], length 1314
16:04:28.351772 IP 10.8.1.3.35184 > 52.223.225.153.1935: Flags [.], seq 144010:145324, ack 0, win 501, options [nop,nop,TS val 3603174591 ecr 3040490679], length 1314
16:04:28.375830 IP 52.223.225.153.1935 > 10.8.1.3.35184: Flags [.], ack 134667, win 126, options [nop,nop,TS val 3040490772 ecr 3603174191], length 0
16:04:28.382718 IP 10.8.1.3.35184 > 52.223.225.153.1935: Flags [.], seq 145324:146638, ack 0, win 501, options [nop,nop,TS val 3603174622 ecr 3040490772], length 1314
16:04:28.423837 IP 10.8.1.3.35184 > 52.223.225.153.1935: Flags [.], seq 146638:147952, ack 0, win 501, options [nop,nop,TS val 3603174663 ecr 3040490772], length 1314
16:04:28.434216 IP 52.223.225.153.1935 > 10.8.1.3.35184: Flags [.], ack 136126, win 126, options [nop,nop,TS val 3040490830 ecr 3603174256], length 0
16:04:28.434246 IP 10.8.1.3.35184 > 52.223.225.153.1935: Flags [P.], seq 147952:148002, ack 0, win 501, options [nop,nop,TS val 3603174674 ecr 3040490830], length 50
16:04:28.485457 IP 10.8.1.3.35184 > 52.223.225.153.1935: Flags [.], seq 148002:149316, ack 0, win 501, options [nop,nop,TS val 3603174725 ecr 3040490830], length 1314
16:04:28.509089 IP 52.223.225.153.1935 > 10.8.1.3.35184: Flags [.], ack 138754, win 126, options [nop,nop,TS val 3040490905 ecr 3603174324], length 0
16:04:28.518634 IP 10.8.1.3.35184 > 52.223.225.153.1935: Flags [.], seq 149316:150630, ack 0, win 501, options [nop,nop,TS val 3603174758 ecr 3040490905], length 1314
16:04:28.552490 IP 10.8.1.3.35184 > 52.223.225.153.1935: Flags [.], seq 150630:151944, ack 0, win 501, options [nop,nop,TS val 3603174792 ecr 3040490905], length 1314
16:04:28.609901 IP 52.223.225.153.1935 > 10.8.1.3.35184: Flags [.], ack 141382, win 126, options [nop,nop,TS val 3040491006 ecr 3603174406], length 0
16:04:28.618464 IP 10.8.1.3.35184 > 52.223.225.153.1935: Flags [.], seq 151944:153258, ack 0, win 501, options [nop,nop,TS val 3603174858 ecr 3040491006], length 1314
16:04:28.651922 IP 10.8.1.3.35184 > 52.223.225.153.1935: Flags [.], seq 153258:154572, ack 0, win 501, options [nop,nop,TS val 3603174891 ecr 3040491006], length 1314
16:04:28.685353 IP 10.8.1.3.35184 > 52.223.225.153.1935: Flags [.], seq 154572:155886, ack 0, win 501, options [nop,nop,TS val 3603174925 ecr 3040491006], length 1314
16:04:28.688646 IP 52.223.225.153.1935 > 10.8.1.3.35184: Flags [.], ack 144010, win 126, options [nop,nop,TS val 3040491085 ecr 3603174488], length 0
16:04:28.751885 IP 10.8.1.3.35184 > 52.223.225.153.1935: Flags [.], seq 155886:157200, ack 0, win 501, options [nop,nop,TS val 3603174991 ecr 3040491085], length 1314
16:04:28.776029 IP 52.223.225.153.1935 > 10.8.1.3.35184: Flags [.], ack 146638, win 126, options [nop,nop,TS val 3040491172 ecr 3603174591], length 0
16:04:28.783674 IP 10.8.1.3.35184 > 52.223.225.153.1935: Flags [.], seq 157200:158514, ack 0, win 501, options [nop,nop,TS val 3603175023 ecr 3040491172], length 1314
16:04:28.818434 IP 10.8.1.3.35184 > 52.223.225.153.1935: Flags [.], seq 158514:159828, ack 0, win 501, options [nop,nop,TS val 3603175058 ecr 3040491172], length 1314
16:04:28.833851 IP 52.223.225.153.1935 > 10.8.1.3.35184: Flags [.], ack 148002, win 126, options [nop,nop,TS val 3040491230 ecr 3603174663], length 0
16:04:28.833885 IP 10.8.1.3.35184 > 52.223.225.153.1935: Flags [P.], seq 159828:159969, ack 0, win 501, options [nop,nop,TS val 3603175073 ecr 3040491230], length 141
16:04:28.880948 IP 10.8.1.3.35184 > 52.223.225.153.1935: Flags [.], seq 159969:161283, ack 0, win 501, options [nop,nop,TS val 3603175120 ecr 3040491230], length 1314
16:04:28.912171 IP 52.223.225.153.1935 > 10.8.1.3.35184: Flags [.], ack 150630, win 126, options [nop,nop,TS val 3040491308 ecr 3603174725], length 0
16:04:28.916642 IP 10.8.1.3.35184 > 52.223.225.153.1935: Flags [.], seq 161283:162597, ack 0, win 501, options [nop,nop,TS val 3603175156 ecr 3040491308], length 1314
16:04:28.959526 IP 10.8.1.3.35184 > 52.223.225.153.1935: Flags [.], seq 162597:163911, ack 0, win 501, options [nop,nop,TS val 3603175199 ecr 3040491308], length 1314
16:04:29.011943 IP 52.223.225.153.1935 > 10.8.1.3.35184: Flags [.], ack 153258, win 126, options [nop,nop,TS val 3040491408 ecr 3603174792], length 0
16:04:29.018615 IP 10.8.1.3.35184 > 52.223.225.153.1935: Flags [.], seq 163911:165225, ack 0, win 501, options [nop,nop,TS val 3603175258 ecr 3040491408], length 1314
16:04:29.049413 IP 10.8.1.3.35184 > 52.223.225.153.1935: Flags [.], seq 165225:166539, ack 0, win 501, options [nop,nop,TS val 3603175289 ecr 3040491408], length 1314
16:04:29.079412 IP 52.223.225.153.1935 > 10.8.1.3.35184: Flags [.], ack 155886, win 126, options [nop,nop,TS val 3040491475 ecr 3603174891], length 0
16:04:29.087819 IP 10.8.1.3.35184 > 52.223.225.153.1935: Flags [.], seq 166539:167853, ack 0, win 501, options [nop,nop,TS val 3603175327 ecr 3040491475], length 1314
16:04:29.152717 IP 10.8.1.3.35184 > 52.223.225.153.1935: Flags [.], seq 167853:169167, ack 0, win 501, options [nop,nop,TS val 3603175392 ecr 3040491475], length 1314
16:04:29.177072 IP 52.223.225.153.1935 > 10.8.1.3.35184: Flags [.], ack 158514, win 126, options [nop,nop,TS val 3040491573 ecr 3603174991], length 0
16:04:29.185242 IP 10.8.1.3.35184 > 52.223.225.153.1935: Flags [.], seq 169167:170481, ack 0, win 501, options [nop,nop,TS val 3603175425 ecr 3040491573], length 1314
16:04:29.215885 IP 10.8.1.3.35184 > 52.223.225.153.1935: Flags [.], seq 170481:171795, ack 0, win 501, options [nop,nop,TS val 3603175455 ecr 3040491573], length 1314
16:04:29.227284 IP 52.223.225.153.1935 > 10.8.1.3.35184: Flags [.], ack 159969, win 126, options [nop,nop,TS val 3040491623 ecr 3603175058], length 0
16:04:29.227302 IP 10.8.1.3.35184 > 52.223.225.153.1935: Flags [P.], seq 171795:171845, ack 0, win 501, options [nop,nop,TS val 3603175467 ecr 3040491623], length 50
16:04:29.281080 IP 10.8.1.3.35184 > 52.223.225.153.1935: Flags [.], seq 171845:173159, ack 0, win 501, options [nop,nop,TS val 3603175520 ecr 3040491623], length 1314
16:04:29.310181 IP 52.223.225.153.1935 > 10.8.1.3.35184: Flags [.], ack 162597, win 126, options [nop,nop,TS val 3040491706 ecr 3603175120], length 0
16:04:29.315865 IP 10.8.1.3.35184 > 52.223.225.153.1935: Flags [.], seq 173159:174473, ack 0, win 501, options [nop,nop,TS val 3603175555 ecr 3040491706], length 1314
16:04:29.351522 IP 10.8.1.3.35184 > 52.223.225.153.1935: Flags [.], seq 174473:175787, ack 0, win 501, options [nop,nop,TS val 3603175591 ecr 3040491706], length 1314
16:04:29.412016 IP 52.223.225.153.1935 > 10.8.1.3.35184: Flags [.], ack 165225, win 126, options [nop,nop,TS val 3040491808 ecr 3603175199], length 0
16:04:29.414379 IP 10.8.1.3.35184 > 52.223.225.153.1935: Flags [.], seq 175787:177101, ack 0, win 501, options [nop,nop,TS val 3603175654 ecr 3040491808], length 1314
16:04:29.450051 IP 10.8.1.3.35184 > 52.223.225.153.1935: Flags [.], seq 177101:178415, ack 0, win 501, options [nop,nop,TS val 3603175689 ecr 3040491808], length 1314
16:04:29.481464 IP 52.223.225.153.1935 > 10.8.1.3.35184: Flags [.], ack 167853, win 126, options [nop,nop,TS val 3040491877 ecr 3603175289], length 0
16:04:29.482516 IP 10.8.1.3.35184 > 52.223.225.153.1935: Flags [.], seq 178415:179729, ack 0, win 501, options [nop,nop,TS val 3603175722 ecr 3040491877], length 1314
16:04:29.547684 IP 10.8.1.3.35184 > 52.223.225.153.1935: Flags [.], seq 179729:181043, ack 0, win 501, options [nop,nop,TS val 3603175787 ecr 3040491877], length 1314
16:04:29.578385 IP 52.223.225.153.1935 > 10.8.1.3.35184: Flags [.], ack 170481, win 126, options [nop,nop,TS val 3040491974 ecr 3603175392], length 0
16:04:29.582540 IP 10.8.1.3.35184 > 52.223.225.153.1935: Flags [.], seq 181043:182357, ack 0, win 501, options [nop,nop,TS val 3603175822 ecr 3040491974], length 1314
16:04:29.618232 IP 10.8.1.3.35184 > 52.223.225.153.1935: Flags [.], seq 182357:183671, ack 0, win 501, options [nop,nop,TS val 3603175858 ecr 3040491974], length 1314
16:04:29.620453 IP 52.223.225.153.1935 > 10.8.1.3.35184: Flags [.], ack 171845, win 126, options [nop,nop,TS val 3040492016 ecr 3603175455], length 0
16:04:29.620484 IP 10.8.1.3.35184 > 52.223.225.153.1935: Flags [P.], seq 183671:183722, ack 0, win 501, options [nop,nop,TS val 3603175860 ecr 3040492016], length 51
16:04:29.685686 IP 10.8.1.3.35184 > 52.223.225.153.1935: Flags [.], seq 183722:185036, ack 0, win 501, options [nop,nop,TS val 3603175925 ecr 3040492016], length 1314
16:04:29.709231 IP 52.223.225.153.1935 > 10.8.1.3.35184: Flags [.], ack 174473, win 126, options [nop,nop,TS val 3040492105 ecr 3603175520], length 0
16:04:29.715896 IP 10.8.1.3.35184 > 52.223.225.153.1935: Flags [.], seq 185036:186350, ack 0, win 501, options [nop,nop,TS val 3603175955 ecr 3040492105], length 1314
16:04:29.749119 IP 10.8.1.3.35184 > 52.223.225.153.1935: Flags [.], seq 186350:187664, ack 0, win 501, options [nop,nop,TS val 3603175988 ecr 3040492105], length 1314
16:04:29.807651 IP 52.223.225.153.1935 > 10.8.1.3.35184: Flags [.], ack 177101, win 126, options [nop,nop,TS val 3040492204 ecr 3603175591], length 0
16:04:29.818971 IP 10.8.1.3.35184 > 52.223.225.153.1935: Flags [.], seq 187664:188978, ack 0, win 501, options [nop,nop,TS val 3603176058 ecr 3040492204], length 1314
16:04:29.850278 IP 10.8.1.3.35184 > 52.223.225.153.1935: Flags [.], seq 188978:190292, ack 0, win 501, options [nop,nop,TS val 3603176090 ecr 3040492204], length 1314
16:04:29.876020 IP 52.223.225.153.1935 > 10.8.1.3.35184: Flags [.], ack 179729, win 126, options [nop,nop,TS val 3040492272 ecr 3603175689], length 0
16:04:29.883669 IP 10.8.1.3.35184 > 52.223.225.153.1935: Flags [.], seq 190292:191606, ack 0, win 501, options [nop,nop,TS val 3603176123 ecr 3040492272], length 1314
16:04:29.951516 IP 10.8.1.3.35184 > 52.223.225.153.1935: Flags [.], seq 191606:192920, ack 0, win 501, options [nop,nop,TS val 3603176191 ecr 3040492272], length 1314
16:04:29.976195 IP 52.223.225.153.1935 > 10.8.1.3.35184: Flags [.], ack 182357, win 126, options [nop,nop,TS val 3040492372 ecr 3603175787], length 0
16:04:29.984601 IP 10.8.1.3.35184 > 52.223.225.153.1935: Flags [.], seq 192920:194234, ack 0, win 501, options [nop,nop,TS val 3603176224 ecr 3040492372], length 1314
16:04:30.013344 IP 52.223.225.153.1935 > 10.8.1.3.35184: Flags [.], ack 183722, win 126, options [nop,nop,TS val 3040492409 ecr 3603175858], length 0
16:04:30.013372 IP 10.8.1.3.35184 > 52.223.225.153.1935: Flags [P.], seq 194234:194846, ack 0, win 501, options [nop,nop,TS val 3603176253 ecr 3040492409], length 612
16:04:30.050005 IP 10.8.1.3.35184 > 52.223.225.153.1935: Flags [.], seq 194846:196160, ack 0, win 501, options [nop,nop,TS val 3603176289 ecr 3040492409], length 1314
16:04:30.085447 IP 10.8.1.3.35184 > 52.223.225.153.1935: Flags [.], seq 196160:197474, ack 0, win 501, options [nop,nop,TS val 3603176325 ecr 3040492409], length 1314
16:04:30.109770 IP 52.223.225.153.1935 > 10.8.1.3.35184: Flags [.], ack 186350, win 126, options [nop,nop,TS val 3040492505 ecr 3603175925], length 0
16:04:30.134367 IP 10.8.1.3.35184 > 52.223.225.153.1935: Flags [.], seq 197474:198788, ack 0, win 501, options [nop,nop,TS val 3603176374 ecr 3040492505], length 1314
16:04:30.182448 IP 10.8.1.3.35184 > 52.223.225.153.1935: Flags [.], seq 198788:200102, ack 0, win 501, options [nop,nop,TS val 3603176422 ecr 3040492505], length 1314
16:04:30.203703 IP 52.223.225.153.1935 > 10.8.1.3.35184: Flags [.], ack 187664, win 126, options [nop,nop,TS val 3040492599 ecr 3603175988], length 0
16:04:30.219172 IP 10.8.1.3.35184 > 52.223.225.153.1935: Flags [.], seq 200102:201416, ack 0, win 501, options [nop,nop,TS val 3603176458 ecr 3040492599], length 1314
16:04:30.243433 IP 52.223.225.153.1935 > 10.8.1.3.35184: Flags [.], ack 190292, win 126, options [nop,nop,TS val 3040492639 ecr 3603176058], length 0
16:04:30.261959 IP 10.8.1.3.35184 > 52.223.225.153.1935: Flags [.], seq 201416:202730, ack 0, win 501, options [nop,nop,TS val 3603176501 ecr 3040492639], length 1314
16:04:30.318495 IP 10.8.1.3.35184 > 52.223.225.153.1935: Flags [.], seq 202730:204044, ack 0, win 501, options [nop,nop,TS val 3603176558 ecr 3040492639], length 1314
16:04:30.344927 IP 52.223.225.153.1935 > 10.8.1.3.35184: Flags [.], ack 192920, win 126, options [nop,nop,TS val 3040492741 ecr 3603176123], length 0
16:04:30.349798 IP 10.8.1.3.35184 > 52.223.225.153.1935: Flags [.], seq 204044:205358, ack 0, win 501, options [nop,nop,TS val 3603176589 ecr 3040492741], length 1314
16:04:30.390410 IP 10.8.1.3.35184 > 52.223.225.153.1935: Flags [.], seq 205358:206672, ack 0, win 501, options [nop,nop,TS val 3603176630 ecr 3040492741], length 1314
16:04:30.406508 IP 52.223.225.153.1935 > 10.8.1.3.35184: Flags [.], ack 194846, win 126, options [nop,nop,TS val 3040492802 ecr 3603176224], length 0
16:04:30.406527 IP 10.8.1.3.35184 > 52.223.225.153.1935: Flags [P.], seq 206672:206718, ack 0, win 501, options [nop,nop,TS val 3603176646 ecr 3040492802], length 46
