01:29:13.142271 IP 99.181.97.46.1935 > 10.8.1.3.40170: Flags [.], ack 4246310882, win 126, options [nop,nop,TS val 1355178025 ecr 493842281], length 0
01:29:13.143262 IP 10.8.1.3.40170 > 99.181.97.46.1935: Flags [.], seq 5559:6873, ack 0, win 501, options [nop,nop,TS val 493842574 ecr 1355178025], length 1314
01:29:13.176529 IP 10.8.1.3.40170 > 99.181.97.46.1935: Flags [.], seq 6873:8187, ack 0, win 501, options [nop,nop,TS val 493842607 ecr 1355178025], length 1314
01:29:13.185599 IP 99.181.97.46.1935 > 10.8.1.3.40170: Flags [.], ack 1617, win 126, options [nop,nop,TS val 1355178068 ecr 493842375], length 0
01:29:13.185624 IP 10.8.1.3.40170 > 99.181.97.46.1935: Flags [P.], seq 8187:8590, ack 0, win 501, options [nop,nop,TS val 493842616 ecr 1355178068], length 403
01:29:13.243289 IP 10.8.1.3.40170 > 99.181.97.46.1935: Flags [.], seq 8590:9904, ack 0, win 501, options [nop,nop,TS val 493842674 ecr 1355178068], length 1314
01:29:13.275474 IP 10.8.1.3.40170 > 99.181.97.46.1935: Flags [.], seq 9904:11218, ack 0, win 501, options [nop,nop,TS val 493842706 ecr 1355178068], length 1314
01:29:13.278186 IP 99.181.97.46.1935 > 10.8.1.3.40170: Flags [.], ack 4245, win 126, options [nop,nop,TS val 1355178156 ecr 493842438], length 0
01:29:13.311104 IP 10.8.1.3.40170 > 99.181.97.46.1935: Flags [.], seq 11218:12532, ack 0, win 501, options [nop,nop,TS val 493842741 ecr 1355178156], length 1314
01:29:13.377745 IP 10.8.1.3.40170 > 99.181.97.46.1935: Flags [.], seq 12532:13846, ack 0, win 501, options [nop,nop,TS val 493842808 ecr 1355178156], length 1314
01:29:13.389512 IP 99.181.97.46.1935 > 10.8.1.3.40170: Flags [.], ack 6873, win 126, options [nop,nop,TS val 1355178256 ecr 493842509], length 0
01:29:13.408688 IP 10.8.1.3.40170 > 99.181.97.46.1935: Flags [.], seq 13846:15160, ack 0, win 501, options [nop,nop,TS val 493842839 ecr 1355178256], length 1314
01:29:13.430827 IP 99.181.97.46.1935 > 10.8.1.3.40170: Flags [.], ack 8590, win 126, options [nop,nop,TS val 1355178298 ecr 493842607], length 0
01:29:13.430841 IP 10.8.1.3.40170 > 99.181.97.46.1935: Flags [P.], seq 15160:15666, ack 0, win 501, options [nop,nop,TS val 493842861 ecr 1355178298], length 506
01:29:13.475910 IP 10.8.1.3.40170 > 99.181.97.46.1935: Flags [.], seq 15666:16980, ack 0, win 501, options [nop,nop,TS val 493842906 ecr 1355178298], length 1314
01:29:13.510612 IP 10.8.1.3.40170 > 99.181.97.46.1935: Flags [.], seq 16980:18294, ack 0, win 501, options [nop,nop,TS val 493842941 ecr 1355178298], length 1314
01:29:13.512900 IP 99.181.97.46.1935 > 10.8.1.3.40170: Flags [.], ack 11218, win 126, options [nop,nop,TS val 1355178388 ecr 493842674], length 0
01:29:13.556835 IP 10.8.1.3.40170 > 99.181.97.46.1935: Flags [.], seq 18294:19608, ack 0, win 501, options [nop,nop,TS val 493842987 ecr 1355178388], length 1314
01:29:13.609576 IP 10.8.1.3.40170 > 99.181.97.46.1935: Flags [.], seq 19608:20922, ack 0, win 501, options [nop,nop,TS val 493843040 ecr 1355178388], length 1314
01:29:13.616991 IP 99.181.97.46.1935 > 10.8.1.3.40170: Flags [.], ack 13846, win 126, options [nop,nop,TS val 1355178491 ecr 493842741], length 0
01:29:13.641891 IP 10.8.1.3.40170 > 99.181.97.46.1935: Flags [.], seq 20922:22236, ack 0, win 501, options [nop,nop,TS val 493843072 ecr 1355178491], length 1314
01:29:13.670677 IP 99.181.97.46.1935 > 10.8.1.3.40170: Flags [.], ack 15666, win 126, options [nop,nop,TS val 1355178544 ecr 493842839], length 0
01:29:13.670715 IP 10.8.1.3.40170 > 99.181.97.46.1935: Flags [P.], seq 22236:22642, ack 0, win 501, options [nop,nop,TS val 493843101 ecr 1355178544], length 406
01:29:13.709609 IP 10.8.1.3.40170 > 99.181.97.46.1935: Flags [.], seq 22642:23956, ack 0, win 501, options [nop,nop,TS val 493843140 ecr 1355178544], length 1314
01:29:13.742303 IP 10.8.1.3.40170 > 99.181.97.46.1935: Flags [.], seq 23956:25270, ack 0, win 501, options [nop,nop,TS val 493843173 ecr 1355178544], length 1314
01:29:13.750814 IP 99.181.97.46.1935 > 10.8.1.3.40170: Flags [.], ack 18294, win 126, options [nop,nop,TS val 1355178624 ecr 493842906], length 0
01:29:13.790513 IP 10.8.1.3.40170 > 99.181.97.46.1935: Flags [.], seq 25270:26584, ack 0, win 501, options [nop,nop,TS val 493843221 ecr 1355178624], length 1314
01:29:13.844770 IP 10.8.1.3.40170 > 99.181.97.46.1935: Flags [.], seq 26584:27898, ack 0, win 501, options [nop,nop,TS val 493843275 ecr 1355178624], length 1314
01:29:13.845189 IP 99.181.97.46.1935 > 10.8.1.3.40170: Flags [.], ack 20922, win 126, options [nop,nop,TS val 1355178722 ecr 493842987], length 0
01:29:13.877871 IP 10.8.1.3.40170 > 99.181.97.46.1935: Flags [.], seq 27898:29212, ack 0, win 501, options [nop,nop,TS val 493843308 ecr 1355178722], length 1314
01:29:13.907505 IP 99.181.97.46.1935 > 10.8.1.3.40170: Flags [.], ack 22642, win 126, options [nop,nop,TS val 1355178783 ecr 493843072], length 0
01:29:13.907549 IP 10.8.1.3.40170 > 99.181.97.46.1935: Flags [P.], seq 29212:29609, ack 0, win 501, options [nop,nop,TS val 493843338 ecr 1355178783], length 397
01:29:13.942275 IP 10.8.1.3.40170 > 99.181.97.46.1935: Flags [.], seq 29609:30923, ack 0, win 501, options [nop,nop,TS val 493843373 ecr 1355178783], length 1314
01:29:13.977877 IP 10.8.1.3.40170 > 99.181.97.46.1935: Flags [.], seq 30923:32237, ack 0, win 501, options [nop,nop,TS val 493843408 ecr 1355178783], length 1314
01:29:13.980263 IP 99.181.97.46.1935 > 10.8.1.3.40170: Flags [.], ack 25270, win 126, options [nop,nop,TS val 1355178857 ecr 493843140], length 0
01:29:14.026090 IP 10.8.1.3.40170 > 99.181.97.46.1935: Flags [.], seq 32237:33551, ack 0, win 501, options [nop,nop,TS val 493843456 ecr 1355178857], length 1314
01:29:14.075626 IP 10.8.1.3.40170 > 99.181.97.46.1935: Flags [.], seq 33551:34865, ack 0, win 501, options [nop,nop,TS val 493843506 ecr 1355178857], length 1314
01:29:14.078754 IP 99.181.97.46.1935 > 10.8.1.3.40170: Flags [.], ack 27898, win 126, options [nop,nop,TS val 1355178958 ecr 493843221], length 0
01:29:14.108412 IP 10.8.1.3.40170 > 99.181.97.46.1935: Flags [.], seq 34865:36179, ack 0, win 501, options [nop,nop,TS val 493843539 ecr 1355178958], length 1314
01:29:14.142639 IP 99.181.97.46.1935 > 10.8.1.3.40170: Flags [.], ack 29609, win 126, options [nop,nop,TS val 1355179022 ecr 493843308], length 0
01:29:14.142740 IP 10.8.1.3.40170 > 99.181.97.46.1935: Flags [P.], seq 36179:36590, ack 0, win 501, options [nop,nop,TS val 493843573 ecr 1355179022], length 411
01:29:14.180704 IP 10.8.1.3.40170 > 99.181.97.46.1935: Flags [.], seq 36590:37904, ack 0, win 501, options [nop,nop,TS val 493843611 ecr 1355179022], length 1314
01:29:14.210786 IP 10.8.1.3.40170 > 99.181.97.46.1935: Flags [.], seq 37904:39218, ack 0, win 501, options [nop,nop,TS val 493843641 ecr 1355179022], length 1314
01:29:14.220650 IP 99.181.97.46.1935 > 10.8.1.3.40170: Flags [.], ack 32237, win 126, options [nop,nop,TS val 1355179096 ecr 493843373], length 0
01:29:14.261174 IP 10.8.1.3.40170 > 99.181.97.46.1935: Flags [.], seq 39218:40532, ack 0, win 501, options [nop,nop,TS val 493843691 ecr 1355179096], length 1314
01:29:14.309527 IP 10.8.1.3.40170 > 99.181.97.46.1935: Flags [.], seq 40532:41846, ack 0, win 501, options [nop,nop,TS val 493843740 ecr 1355179096], length 1314
01:29:14.316874 IP 99.181.97.46.1935 > 10.8.1.3.40170: Flags [.], ack 34865, win 126, options [nop,nop,TS val 1355179190 ecr 493843456], length 0
01:29:14.342885 IP 10.8.1.3.40170 > 99.181.97.46.1935: Flags [.], seq 41846:43160, ack 0, win 501, options [nop,nop,TS val 493843773 ecr 1355179190], length 1314
01:29:14.379432 IP 99.181.97.46.1935 > 10.8.1.3.40170: Flags [.], ack 36590, win 126, options [nop,nop,TS val 1355179256 ecr 493843539], length 0
01:29:14.379454 IP 10.8.1.3.40170 > 99.181.97.46.1935: Flags [P.], seq 43160:44417, ack 0, win 501, options [nop,nop,TS val 493843810 ecr 1355179256], length 1257
01:29:14.442638 IP 10.8.1.3.40170 > 99.181.97.46.1935: Flags [.], seq 44417:45731, ack 0, win 501, options [nop,nop,TS val 493843873 ecr 1355179256], length 1314
01:29:14.449819 IP 99.181.97.46.1935 > 10.8.1.3.40170: Flags [.], ack 39218, win 126, options [nop,nop,TS val 1355179324 ecr 493843611], length 0
01:29:14.478672 IP 10.8.1.3.40170 > 99.181.97.46.1935: Flags [.], seq 45731:47045, ack 0, win 501, options [nop,nop,TS val 493843909 ecr 1355179324], length 1314
01:29:14.512360 IP 10.8.1.3.40170 > 99.181.97.46.1935: Flags [.], seq 47045:48359, ack 0, win 501, options [nop,nop,TS val 493843943 ecr 1355179324], length 1314
01:29:14.549537 IP 99.181.97.46.1935 > 10.8.1.3.40170: Flags [.], ack 41846, win 126, options [nop,nop,TS val 1355179423 ecr 493843691], length 0
01:29:14.575800 IP 10.8.1.3.40170 > 99.181.97.46.1935: Flags [.], seq 48359:49673, ack 0, win 501, options [nop,nop,TS val 493844006 ecr 1355179423], length 1314
01:29:14.609420 IP 10.8.1.3.40170 > 99.181.97.46.1935: Flags [.], seq 49673:50987, ack 0, win 501, options [nop,nop,TS val 493844040 ecr 1355179423], length 1314
01:29:14.618575 IP 99.181.97.46.1935 > 10.8.1.3.40170: Flags [.], ack 44417, win 126, options [nop,nop,TS val 1355179493 ecr 493843773], length 0
01:29:14.618588 IP 10.8.1.3.40170 > 99.181.97.46.1935: Flags [P.], seq 50987:51381, ack 0, win 501, options [nop,nop,TS val 493844049 ecr 1355179493], length 394
01:29:14.677348 IP 10.8.1.3.40170 > 99.181.97.46.1935: Flags [.], seq 51381:52695, ack 0, win 501, options [nop,nop,TS val 493844108 ecr 1355179493], length 1314
01:29:14.709080 IP 10.8.1.3.40170 > 99.181.97.46.1935: Flags [.], seq 52695:54009, ack 0, win 501, options [nop,nop,TS val 493844139 ecr 1355179493], length 1314
01:29:14.714418 IP 99.181.97.46.1935 > 10.8.1.3.40170: Flags [.], ack 47045, win 126, options [nop,nop,TS val 1355179593 ecr 493843873], length 0
01:29:14.742442 IP 10.8.1.3.40170 > 99.181.97.46.1935: Flags [.], seq 54009:55323, ack 0, win 501, options [nop,nop,TS val 493844173 ecr 1355179593], length 1314
01:29:14.808131 IP 99.181.97.46.1935 > 10.8.1.3.40170: Flags [.], ack 49673, win 126, options [nop,nop,TS val 1355179689 ecr 493843943], length 0
01:29:14.812497 IP 10.8.1.3.40170 > 99.181.97.46.1935: Flags [.], seq 55323:56637, ack 0, win 501, options [nop,nop,TS val 493844243 ecr 1355179689], length 1314
01:29:14.845737 IP 10.8.1.3.40170 > 99.181.97.46.1935: Flags [.], seq 56637:57951, ack 0, win 501, options [nop,nop,TS val 493844276 ecr 1355179689], length 1314
01:29:14.849305 IP 99.181.97.46.1935 > 10.8.1.3.40170: Flags [.], ack 51381, win 126, options [nop,nop,TS val 1355179732 ecr 493844040], length 0
01:29:14.849340 IP 10.8.1.3.40170 > 99.181.97.46.1935: Flags [P.], seq 57951:58357, ack 0, win 501, options [nop,nop,TS val 493844280 ecr 1355179732], length 406
01:29:14.910133 IP 10.8.1.3.40170 > 99.181.97.46.1935: Flags [.], seq 58357:59671, ack 0, win 501, options [nop,nop,TS val 493844340 ecr 1355179732], length 1314
01:29:14.943531 IP 99.181.97.46.1935 > 10.8.1.3.40170: Flags [.], ack 54009, win 126, options [nop,nop,TS val 1355179826 ecr 493844108], length 0
01:29:14.943843 IP 10.8.1.3.40170 > 99.181.97.46.1935: Flags [.], seq 59671:60985, ack 0, win 501, options [nop,nop,TS val 493844374 ecr 1355179826], length 1314
01:29:14.975059 IP 10.8.1.3.40170 > 99.181.97.46.1935: Flags [.], seq 60985:62299, ack 0, win 501, options [nop,nop,TS val 493844405 ecr 1355179826], length 1314
01:29:15.038916 IP 99.181.97.46.1935 > 10.8.1.3.40170: Flags [.], ack 56637, win 126, options [nop,nop,TS val 1355179925 ecr 493844173], length 0
01:29:15.044648 IP 10.8.1.3.40170 > 99.181.97.46.1935: Flags [.], seq 62299:63613, ack 0, win 501, options [nop,nop,TS val 493844475 ecr 1355179925], length 1314
01:29:15.076818 IP 99.181.97.46.1935 > 10.8.1.3.40170: Flags [.], ack 58357, win 126, options [nop,nop,TS val 1355179963 ecr 493844276], length 0
01:29:15.076866 IP 10.8.1.3.40170 > 99.181.97.46.1935: Flags [P.], seq 63613:64490, ack 0, win 501, options [nop,nop,TS val 493844507 ecr 1355179963], length 877
01:29:15.111437 IP 10.8.1.3.40170 > 99.181.97.46.1935: Flags [.], seq 64490:65804, ack 0, win 501, options [nop,nop,TS val 493844542 ecr 1355179963], length 1314
01:29:15.142357 IP 10.8.1.3.40170 > 99.181.97.46.1935: Flags [.], seq 65804:67118, ack 0, win 501, options [nop,nop,TS val 493844573 ecr 1355179963], length 1314
01:29:15.173107 IP 99.181.97.46.1935 > 10.8.1.3.40170: Flags [.], ack 60985, win 126, options [nop,nop,TS val 1355180057 ecr 493844340], length 0
01:29:15.200068 IP 10.8.1.3.40170 > 99.181.97.46.1935: Flags [.], seq 67118:68432, ack 0, win 501, options [nop,nop,TS val 493844630 ecr 1355180057], length 1314
01:29:15.243885 IP 10.8.1.3.40170 > 99.181.97.46.1935: Flags [.], seq 68432:69746, ack 0, win 501, options [nop,nop,TS val 493844674 ecr 1355180057], length 1314
01:29:15.266619 IP 99.181.97.46.1935 > 10.8.1.3.40170: Flags [.], ack 62299, win 126, options [nop,nop,TS val 1355180151 ecr 493844405], length 0
01:29:15.275778 IP 10.8.1.3.40170 > 99.181.97.46.1935: Flags [.], seq 69746:71060, ack 0, win 501, options [nop,nop,TS val 493844706 ecr 1355180151], length 1314
01:29:15.304330 IP 99.181.97.46.1935 > 10.8.1.3.40170: Flags [.], ack 64490, win 126, options [nop,nop,TS val 1355180190 ecr 493844475], length 0
01:29:15.304369 IP 10.8.1.3.40170 > 99.181.97.46.1935: Flags [P.], seq 71060:71371, ack 0, win 501, options [nop,nop,TS val 493844735 ecr 1355180190], length 311
01:29:15.344897 IP 10.8.1.3.40170 > 99.181.97.46.1935: Flags [.], seq 71371:72685, ack 0, win 501, options [nop,nop,TS val 493844775 ecr 1355180190], length 1314
01:29:15.370670 IP 99.181.97.46.1935 > 10.8.1.3.40170: Flags [.], ack 67118, win 126, options [nop,nop,TS val 1355180257 ecr 493844542], length 0
01:29:15.377963 IP 10.8.1.3.40170 > 99.181.97.46.1935: Flags [.], seq 72685:73999, ack 0, win 501, options [nop,nop,TS val 493844808 ecr 1355180257], length 1314
01:29:15.414189 IP 10.8.1.3.40170 > 99.181.97.46.1935: Flags [.], seq 73999:75313, ack 0, win 501, options [nop,nop,TS val 493844844 ecr 1355180257], length 1314
01:29:15.470576 IP 99.181.97.46.1935 > 10.8.1.3.40170: Flags [.], ack 69746, win 126, options [nop,nop,TS val 1355180357 ecr 493844630], length 0
01:29:15.478510 IP 10.8.1.3.40170 > 99.181.97.46.1935: Flags [.], seq 75313:76627, ack 0, win 501, options [nop,nop,TS val 493844909 ecr 1355180357], length 1314
01:29:15.511552 IP 10.8.1.3.40170 > 99.181.97.46.1935: Flags [.], seq 76627:77941, ack 0, win 501, options [nop,nop,TS val 493844942 ecr 1355180357], length 1314
01:29:15.534697 IP 99.181.97.46.1935 > 10.8.1.3.40170: Flags [.], ack 71371, win 126, options [nop,nop,TS val 1355180421 ecr 493844706], length 0
01:29:15.534720 IP 10.8.1.3.40170 > 99.181.97.46.1935: Flags [P.], seq 77941:78340, ack 0, win 501, options [nop,nop,TS val 493844965 ecr 1355180421], length 399
01:29:15.574499 IP 10.8.1.3.40170 > 99.181.97.46.1935: Flags [.], seq 78340:79654, ack 0, win 501, options [nop,nop,TS val 493845005 ecr 1355180421], length 1314
01:29:15.608604 IP 99.181.97.46.1935 > 10.8.1.3.40170: Flags [.], ack 73999, win 126, options [nop,nop,TS val 1355180494 ecr 493844775], length 0
01:29:15.611722 IP 10.8.1.3.40170 > 99.181.97.46.1935: Flags [.], seq 79654:80968, ack 0, win 501, options [nop,nop,TS val 493845042 ecr 1355180494], length 1314
01:29:15.649640 IP 10.8.1.3.40170 > 99.181.97.46.1935: Flags [.], seq 80968:82282, ack 0, win 501, options [nop,nop,TS val 493845080 ecr 1355180494], length 1314
01:29:15.710277 IP 99.181.97.46.1935 > 10.8.1.3.40170: Flags [.], ack 76627, win 126, options [nop,nop,TS val 1355180592 ecr 493844844], length 0
01:29:15.711136 IP 10.8.1.3.40170 > 99.181.97.46.1935: Flags [.], seq 82282:83596, ack 0, win 501, options [nop,nop,TS val 493845141 ecr 1355180592], length 1314
01:29:15.745028 IP 10.8.1.3.40170 > 99.181.97.46.1935: Flags [.], seq 83596:84910, ack 0, win 501, options [nop,nop,TS val 493845175 ecr 1355180592], length 1314
01:29:15.766595 IP 99.181.97.46.1935 > 10.8.1.3.40170: Flags [.], ack 78340, win 126, options [nop,nop,TS val 1355180649 ecr 493844942], length 0
01:29:15.766636 IP 10.8.1.3.40170 > 99.181.97.46.1935: Flags [P.], seq 84910:85319, ack 0, win 501, options [nop,nop,TS val 493845197 ecr 1355180649], length 409
01:29:15.809629 IP 10.8.1.3.40170 > 99.181.97.46.1935: Flags [.], seq 85319:86633, ack 0, win 501, options [nop,nop,TS val 493845240 ecr 1355180649], length 1314
01:29:15.839443 IP 99.181.97.46.1935 > 10.8.1.3.40170: Flags [.], ack 80968, win 126, options [nop,nop,TS val 1355180726 ecr 493845005], length 0
01:29:15.843920 IP 10.8.1.3.40170 > 99.181.97.46.1935: Flags [.], seq 86633:87947, ack 0, win 501, options [nop,nop,TS val 493845274 ecr 1355180726], length 1314
01:29:15.884950 IP 10.8.1.3.40170 > 99.181.97.46.1935: Flags [.], seq 87947:89261, ack 0, win 501, options [nop,nop,TS val 493845315 ecr 1355180726], length 1314
01:29:15.938728 IP 99.181.97.46.1935 > 10.8.1.3.40170: Flags [.], ack 83596, win 126, options [nop,nop,TS val 1355180824 ecr 493845080], length 0
01:29:15.942394 IP 10.8.1.3.40170 > 99.181.97.46.1935: Flags [.], seq 89261:90575, ack 0, win 501, options [nop,nop,TS val 493845373 ecr 1355180824], length 1314
01:29:15.975459 IP 10.8.1.3.40170 > 99.181.97.46.1935: Flags [.], seq 90575:91889, ack 0, win 501, options [nop,nop,TS val 493845406 ecr 1355180824], length 1314
01:29:16.003542 IP 99.181.97.46.1935 > 10.8.1.3.40170: Flags [.], ack 85319, win 126, options [nop,nop,TS val 1355180883 ecr 493845175], length 0
01:29:16.003565 IP 10.8.1.3.40170 > 99.181.97.46.1935: Flags [P.], seq 91889:92299, ack 0, win 501, options [nop,nop,TS val 493845434 ecr 1355180883], length 410
01:29:16.040715 IP 10.8.1.3.40170 > 99.181.97.46.1935: Flags [.], seq 92299:93613, ack 0, win 501, options [nop,nop,TS val 493845471 ecr 1355180883], length 1314
01:29:16.076543 IP 10.8.1.3.40170 > 99.181.97.46.1935: Flags [.], seq 93613:94927, ack 0, win 501, options [nop,nop,TS val 493845507 ecr 1355180883], length 1314
01:29:16.082755 IP 99.181.97.46.1935 > 10.8.1.3.40170: Flags [.], ack 87947, win 126, options [nop,nop,TS val 1355180962 ecr 493845240], length 0
01:29:16.119591 IP 10.8.1.3.40170 > 99.181.97.46.1935: Flags [.], seq 94927:96241, ack 0, win 501, options [nop,nop,TS val 493845550 ecr 1355180962], length 1314
01:29:16.177799 IP 10.8.1.3.40170 > 99.181.97.46.1935: Flags [.], seq 96241:97555, ack 0, win 501, options [nop,nop,TS val 493845608 ecr 1355180962], length 1314
01:29:16.183204 IP 99.181.97.46.1935 > 10.8.1.3.40170: Flags [.], ack 90575, win 126, options [nop,nop,TS val 1355181060 ecr 493845315], length 0
01:29:16.205579 IP 10.8.1.3.40170 > 99.181.97.46.1935: Flags [.], seq 97555:98869, ack 0, win 501, options [nop,nop,TS val 493845636 ecr 1355181060], length 1314
01:29:16.242505 IP 99.181.97.46.1935 > 10.8.1.3.40170: Flags [.], ack 92299, win 126, options [nop,nop,TS val 1355181117 ecr 493845406], length 0
01:29:16.242535 IP 10.8.1.3.40170 > 99.181.97.46.1935: Flags [P.], seq 98869:100111, ack 0, win 501, options [nop,nop,TS val 493845673 ecr 1355181117], length 1242
01:29:16.310972 IP 10.8.1.3.40170 > 99.181.97.46.1935: Flags [.], seq 100111:101425, ack 0, win 501, options [nop,nop,TS val 493845741 ecr 1355181117], length 1314
01:29:16.314750 IP 99.181.97.46.1935 > 10.8.1.3.40170: Flags [.], ack 94927, win 126, options [nop,nop,TS val 1355181189 ecr 493845471], length 0
01:29:16.334101 IP 10.8.1.3.40170 > 99.181.97.46.1935: Flags [.], seq 101425:102739, ack 0, win 501, options [nop,nop,TS val 493845764 ecr 1355181189], length 1314
01:29:16.376881 IP 10.8.1.3.40170 > 99.181.97.46.1935: Flags [.], seq 102739:104053, ack 0, win 501, options [nop,nop,TS val 493845807 ecr 1355181189], length 1314
01:29:16.418307 IP 99.181.97.46.1935 > 10.8.1.3.40170: Flags [.], ack 97555, win 126, options [nop,nop,TS val 1355181292 ecr 493845550], length 0
01:29:16.441245 IP 10.8.1.3.40170 > 99.181.97.46.1935: Flags [.], seq 104053:105367, ack 0, win 501, options [nop,nop,TS val 493845872 ecr 1355181292], length 1314
01:29:16.462523 IP 10.8.1.3.40170 > 99.181.97.46.1935: Flags [.], seq 105367:106681, ack 0, win 501, options [nop,nop,TS val 493845893 ecr 1355181292], length 1314
01:29:16.484361 IP 99.181.97.46.1935 > 10.8.1.3.40170: Flags [.], ack 100111, win 126, options [nop,nop,TS val 1355181355 ecr 493845636], length 0
01:29:16.484392 IP 10.8.1.3.40170 > 99.181.97.46.1935: Flags [P.], seq 106681:107277, ack 0, win 501, options [nop,nop,TS val 493845915 ecr 1355181355], length 596
01:29:16.544205 IP 10.8.1.3.40170 > 99.181.97.46.1935: Flags [.], seq 107277:108591, ack 0, win 501, options [nop,nop,TS val 493845975 ecr 1355181355], length 1314
01:29:16.569172 IP 10.8.1.3.40170 > 99.181.97.46.1935: Flags [.], seq 108591:109905, ack 0, win 501, options [nop,nop,TS val 493845999 ecr 1355181355], length 1314
01:29:16.577447 IP 99.181.97.46.1935 > 10.8.1.3.40170: Flags [.], ack 102739, win 126, options [nop,nop,TS val 1355181449 ecr 493845741], length 0
01:29:16.611459 IP 10.8.1.3.40170 > 99.181.97.46.1935: Flags [.], seq 109905:111219, ack 0, win 501, options [nop,nop,TS val 493846042 ecr 1355181449], length 1314
01:29:16.675846 IP 10.8.1.3.40170 > 99.181.97.46.1935: Flags [.], seq 111219:112533, ack 0, win 501, options [nop,nop,TS val 493846106 ecr 1355181449], length 1314
01:29:16.686773 IP 99.181.97.46.1935 > 10.8.1.3.40170: Flags [.], ack 105367, win 126, options [nop,nop,TS val 1355181554 ecr 493845807], length 0
01:29:16.697090 IP 10.8.1.3.40170 > 99.181.97.46.1935: Flags [.], seq 112533:113847, ack 0, win 501, options [nop,nop,TS val 493846127 ecr 1355181554], length 1314
01:29:16.731137 IP 99.181.97.46.1935 > 10.8.1.3.40170: Flags [.], ack 107277, win 126, options [nop,nop,TS val 1355181598 ecr 493845893], length 0
01:29:16.731160 IP 10.8.1.3.40170 > 99.181.97.46.1935: Flags [P.], seq 113847:114258, ack 0, win 501, options [nop,nop,TS val 493846161 ecr 1355181598], length 411
01:29:16.761356 IP 10.8.1.3.40170 > 99.181.97.46.1935: Flags [.], seq 114258:115572, ack 0, win 501, options [nop,nop,TS val 493846192 ecr 1355181598], length 1314
01:29:16.804285 IP 10.8.1.3.40170 > 99.181.97.46.1935: Flags [.], seq 115572:116886, ack 0, win 501, options [nop,nop,TS val 493846235 ecr 1355181598], length 1314
01:29:16.812770 IP 99.181.97.46.1935 > 10.8.1.3.40170: Flags [.], ack 109905, win 126, options [nop,nop,TS val 1355181682 ecr 493845975], length 0
01:29:16.847005 IP 10.8.1.3.40170 > 99.181.97.46.1935: Flags [.], seq 116886:118200, ack 0, win 501, options [nop,nop,TS val 493846277 ecr 1355181682], length 1314
01:29:16.910940 IP 10.8.1.3.40170 > 99.181.97.46.1935: Flags [.], seq 118200:119514, ack 0, win 501, options [nop,nop,TS val 493846341 ecr 1355181682], length 1314
01:29:16.916193 IP 99.181.97.46.1935 > 10.8.1.3.40170: Flags [.], ack 112533, win 126, options [nop,nop,TS val 1355181789 ecr 493846042], length 0
01:29:16.932652 IP 10.8.1.3.40170 > 99.181.97.46.1935: Flags [.], seq 119514:120828, ack 0, win 501, options [nop,nop,TS val 493846363 ecr 1355181789], length 1314
01:29:16.969940 IP 99.181.97.46.1935 > 10.8.1.3.40170: Flags [.], ack 114258, win 126, options [nop,nop,TS val 1355181845 ecr 493846127], length 0
01:29:16.969954 IP 10.8.1.3.40170 > 99.181.97.46.1935: Flags [P.], seq 120828:121225, ack 0, win 501, options [nop,nop,TS val 493846400 ecr 1355181845], length 397
01:29:16.996321 IP 10.8.1.3.40170 > 99.181.97.46.1935: Flags [.], seq 121225:122539, ack 0, win 501, options [nop,nop,TS val 493846427 ecr 1355181845], length 1314
01:29:17.038983 IP 10.8.1.3.40170 > 99.181.97.46.1935: Flags [.], seq 122539:123853, ack 0, win 501, options [nop,nop,TS val 493846469 ecr 1355181845], length 1314
01:29:17.039533 IP 99.181.97.46.1935 > 10.8.1.3.40170: Flags [.], ack 116886, win 126, options [nop,nop,TS val 1355181917 ecr 493846192], length 0
01:29:17.081962 IP 10.8.1.3.40170 > 99.181.97.46.1935: Flags [.], seq 123853:125167, ack 0, win 501, options [nop,nop,TS val 493846512 ecr 1355181917], length 1314
01:29:17.143228 IP 10.8.1.3.40170 > 99.181.97.46.1935: Flags [.], seq 125167:126481, ack 0, win 501, options [nop,nop,TS val 493846574 ecr 1355181917], length 1314
01:29:17.149125 IP 99.181.97.46.1935 > 10.8.1.3.40170: Flags [.], ack 119514, win 126, options [nop,nop,TS val 1355182024 ecr 493846277], length 0
01:29:17.167711 IP 10.8.1.3.40170 > 99.181.97.46.1935: Flags [.], seq 126481:127795, ack 0, win 501, options [nop,nop,TS val 493846598 ecr 1355182024], length 1314
01:29:17.203888 IP 99.181.97.46.1935 > 10.8.1.3.40170: Flags [.], ack 121225, win 126, options [nop,nop,TS val 1355182083 ecr 493846363], length 0
01:29:17.203920 IP 10.8.1.3.40170 > 99.181.97.46.1935: Flags [P.], seq 127795:128202, ack 0, win 501, options [nop,nop,TS val 493846634 ecr 1355182083], length 407
01:29:17.232078 IP 10.8.1.3.40170 > 99.181.97.46.1935: Flags [.], seq 128202:129516, ack 0, win 501, options [nop,nop,TS val 493846662 ecr 1355182083], length 1314
01:29:17.275069 IP 10.8.1.3.40170 > 99.181.97.46.1935: Flags [.], seq 129516:130830, ack 0, win 501, options [nop,nop,TS val 493846705 ecr 1355182083], length 1314
01:29:17.283747 IP 99.181.97.46.1935 > 10.8.1.3.40170: Flags [.], ack 123853, win 126, options [nop,nop,TS val 1355182154 ecr 493846427], length 0
01:29:17.317850 IP 10.8.1.3.40170 > 99.181.97.46.1935: Flags [.], seq 130830:132144, ack 0, win 501, options [nop,nop,TS val 493846748 ecr 1355182154], length 1314
01:29:17.375989 IP 99.181.97.46.1935 > 10.8.1.3.40170: Flags [.], ack 126481, win 126, options [nop,nop,TS val 1355182261 ecr 493846512], length 0
01:29:17.378819 IP 10.8.1.3.40170 > 99.181.97.46.1935: Flags [.], seq 132144:133458, ack 0, win 501, options [nop,nop,TS val 493846809 ecr 1355182261], length 1314
01:29:17.403630 IP 10.8.1.3.40170 > 99.181.97.46.1935: Flags [.], seq 133458:134772, ack 0, win 501, options [nop,nop,TS val 493846834 ecr 1355182261], length 1314
01:29:17.432104 IP 99.181.97.46.1935 > 10.8.1.3.40170: Flags [.], ack 128202, win 126, options [nop,nop,TS val 1355182317 ecr 493846598], length 0
01:29:17.432126 IP 10.8.1.3.40170 > 99.181.97.46.1935: Flags [P.], seq 134772:135183, ack 0, win 501, options [nop,nop,TS val 493846862 ecr 1355182317], length 411
01:29:17.467676 IP 10.8.1.3.40170 > 99.181.97.46.1935: Flags [.], seq 135183:136497, ack 0, win 501, options [nop,nop,TS val 493846898 ecr 1355182317], length 1314
01:29:17.510292 IP 99.181.97.46.1935 > 10.8.1.3.40170: Flags [.], ack 130830, win 126, options [nop,nop,TS val 1355182396 ecr 493846662], length 0
01:29:17.510551 IP 10.8.1.3.40170 > 99.181.97.46.1935: Flags [.], seq 136497:137811, ack 0, win 501, options [nop,nop,TS val 493846941 ecr 1355182396], length 1314
01:29:17.553297 IP 10.8.1.3.40170 > 99.181.97.46.1935: Flags [.], seq 137811:139125, ack 0, win 501, options [nop,nop,TS val 493846984 ecr 1355182396], length 1314
01:29:17.608300 IP 99.181.97.46.1935 > 10.8.1.3.40170: Flags [.], ack 133458, win 126, options [nop,nop,TS val 1355182494 ecr 493846748], length 0
01:29:17.608822 IP 10.8.1.3.40170 > 99.181.97.46.1935: Flags [.], seq 139125:140439, ack 0, win 501, options [nop,nop,TS val 493847039 ecr 1355182494], length 1314
01:29:17.638388 IP 10.8.1.3.40170 > 99.181.97.46.1935: Flags [.], seq 140439:141753, ack 0, win 501, options [nop,nop,TS val 493847069 ecr 1355182494], length 1314
01:29:17.660655 IP 99.181.97.46.1935 > 10.8.1.3.40170: Flags [.], ack 135183, win 126, options [nop,nop,TS val 1355182545 ecr 493846834], length 0
01:29:17.660670 IP 10.8.1.3.40170 > 99.181.97.46.1935: Flags [P.], seq 141753:142154, ack 0, win 501, options [nop,nop,TS val 493847091 ecr 1355182545], length 401
01:29:17.702329 IP 10.8.1.3.40170 > 99.181.97.46.1935: Flags [.], seq 142154:143468, ack 0, win 501, options [nop,nop,TS val 493847133 ecr 1355182545], length 1314
01:29:17.738663 IP 99.181.97.46.1935 > 10.8.1.3.40170: Flags [.], ack 137811, win 126, options [nop,nop,TS val 1355182624 ecr 493846898], length 0
01:29:17.740877 IP 10.8.1.3.40170 > 99.181.97.46.1935: Flags [.], seq 143468:144782, ack 0, win 501, options [nop,nop,TS val 493847171 ecr 1355182624], length 1314
01:29:17.787084 IP 10.8.1.3.40170 > 99.181.97.46.1935: Flags [.], seq 144782:146096, ack 0, win 501, options [nop,nop,TS val 493847217 ecr 1355182624], length 1314
01:29:17.830320 IP 10.8.1.3.40170 > 99.181.97.46.1935: Flags [.], seq 146096:147410, ack 0, win 501, options [nop,nop,TS val 493847261 ecr 1355182624], length 1314
01:29:17.836435 IP 99.181.97.46.1935 > 10.8.1.3.40170: Flags [.], ack 140439, win 126, options [nop,nop,TS val 1355182723 ecr 493846984], length 0
01:29:17.873336 IP 10.8.1.3.40170 > 99.181.97.46.1935: Flags [.], seq 147410:148724, ack 0, win 501, options [nop,nop,TS val 493847304 ecr 1355182723], length 1314
01:29:17.886859 IP 99.181.97.46.1935 > 10.8.1.3.40170: Flags [.], ack 142154, win 126, options [nop,nop,TS val 1355182773 ecr 493847069], length 0
01:29:17.886875 IP 10.8.1.3.40170 > 99.181.97.46.1935: Flags [P.], seq 148724:149027, ack 0, win 501, options [nop,nop,TS val 493847317 ecr 1355182773], length 303
01:29:17.936870 IP 10.8.1.3.40170 > 99.181.97.46.1935: Flags [.], seq 149027:150341, ack 0, win 501, options [nop,nop,TS val 493847367 ecr 1355182773], length 1314
01:29:17.967143 IP 99.181.97.46.1935 > 10.8.1.3.40170: Flags [.], ack 144782, win 126, options [nop,nop,TS val 1355182854 ecr 493847133], length 0
01:29:17.977845 IP 10.8.1.3.40170 > 99.181.97.46.1935: Flags [.], seq 150341:151655, ack 0, win 501, options [nop,nop,TS val 493847408 ecr 1355182854], length 1314
01:29:18.011386 IP 10.8.1.3.40170 > 99.181.97.46.1935: Flags [.], seq 151655:152969, ack 0, win 501, options [nop,nop,TS val 493847442 ecr 1355182854], length 1314
01:29:18.058572 IP 99.181.97.46.1935 > 10.8.1.3.40170: Flags [.], ack 147410, win 126, options [nop,nop,TS val 1355182945 ecr 493847217], length 0
01:29:18.065223 IP 10.8.1.3.40170 > 99.181.97.46.1935: Flags [.], seq 152969:154283, ack 0, win 501, options [nop,nop,TS val 493847496 ecr 1355182945], length 1314
01:29:18.108084 IP 10.8.1.3.40170 > 99.181.97.46.1935: Flags [.], seq 154283:155597, ack 0, win 501, options [nop,nop,TS val 493847538 ecr 1355182945], length 1314
01:29:18.114052 IP 99.181.97.46.1935 > 10.8.1.3.40170: Flags [.], ack 149027, win 126, options [nop,nop,TS val 1355183000 ecr 493847304], length 0
01:29:18.114113 IP 10.8.1.3.40170 > 99.181.97.46.1935: Flags [P.], seq 155597:156007, ack 0, win 501, options [nop,nop,TS val 493847544 ecr 1355183000], length 410
01:29:18.172725 IP 10.8.1.3.40170 > 99.181.97.46.1935: Flags [.], seq 156007:157321, ack 0, win 501, options [nop,nop,TS val 493847603 ecr 1355183000], length 1314
01:29:18.204587 IP 99.181.97.46.1935 > 10.8.1.3.40170: Flags [.], ack 151655, win 126, options [nop,nop,TS val 1355183091 ecr 493847367], length 0
01:29:18.211568 IP 10.8.1.3.40170 > 99.181.97.46.1935: Flags [.], seq 157321:158635, ack 0, win 501, options [nop,nop,TS val 493847642 ecr 1355183091], length 1314
01:29:18.244752 IP 10.8.1.3.40170 > 99.181.97.46.1935: Flags [.], seq 158635:159949, ack 0, win 501, options [nop,nop,TS val 493847675 ecr 1355183091], length 1314
01:29:18.300191 IP 99.181.97.46.1935 > 10.8.1.3.40170: Flags [.], ack 154283, win 126, options [nop,nop,TS val 1355183184 ecr 493847442], length 0
01:29:18.301542 IP 10.8.1.3.40170 > 99.181.97.46.1935: Flags [.], seq 159949:161263, ack 0, win 501, options [nop,nop,TS val 493847732 ecr 1355183184], length 1314
01:29:18.340940 IP 10.8.1.3.40170 > 99.181.97.46.1935: Flags [.], seq 161263:162577, ack 0, win 501, options [nop,nop,TS val 493847771 ecr 1355183184], length 1314
01:29:18.352131 IP 99.181.97.46.1935 > 10.8.1.3.40170: Flags [.], ack 156007, win 126, options [nop,nop,TS val 1355183233 ecr 493847538], length 0
01:29:18.352147 IP 10.8.1.3.40170 > 99.181.97.46.1935: Flags [P.], seq 162577:162987, ack 0, win 501, options [nop,nop,TS val 493847782 ecr 1355183233], length 410
01:29:18.408170 IP 10.8.1.3.40170 > 99.181.97.46.1935: Flags [.], seq 162987:164301, ack 0, win 501, options [nop,nop,TS val 493847838 ecr 1355183233], length 1314
01:29:18.443284 IP 10.8.1.3.40170 > 99.181.97.46.1935: Flags [.], seq 164301:165615, ack 0, win 501, options [nop,nop,TS val 493847874 ecr 1355183233], length 1314
01:29:18.453559 IP 99.181.97.46.1935 > 10.8.1.3.40170: Flags [.], ack 158635, win 126, options [nop,nop,TS val 1355183330 ecr 493847603], length 0
01:29:18.476413 IP 10.8.1.3.40170 > 99.181.97.46.1935: Flags [.], seq 165615:166929, ack 0, win 501, options [nop,nop,TS val 493847907 ecr 1355183330], length 1314
01:29:18.536368 IP 10.8.1.3.40170 > 99.181.97.46.1935: Flags [.], seq 166929:168243, ack 0, win 501, options [nop,nop,TS val 493847967 ecr 1355183330], length 1314
01:29:18.542183 IP 99.181.97.46.1935 > 10.8.1.3.40170: Flags [.], ack 161263, win 126, options [nop,nop,TS val 1355183417 ecr 493847675], length 0
01:29:18.575417 IP 10.8.1.3.40170 > 99.181.97.46.1935: Flags [.], seq 168243:169557, ack 0, win 501, options [nop,nop,TS val 493848006 ecr 1355183417], length 1314
01:29:18.594315 IP 99.181.97.46.1935 > 10.8.1.3.40170: Flags [.], ack 162987, win 126, options [nop,nop,TS val 1355183468 ecr 493847771], length 0
01:29:18.594337 IP 10.8.1.3.40170 > 99.181.97.46.1935: Flags [P.], seq 169557:169955, ack 0, win 501, options [nop,nop,TS val 493848025 ecr 1355183468], length 398
01:29:18.642890 IP 10.8.1.3.40170 > 99.181.97.46.1935: Flags [.], seq 169955:171269, ack 0, win 501, options [nop,nop,TS val 493848073 ecr 1355183468], length 1314
01:29:18.677977 IP 10.8.1.3.40170 > 99.181.97.46.1935: Flags [.], seq 171269:172583, ack 0, win 501, options [nop,nop,TS val 493848108 ecr 1355183468], length 1314
01:29:18.684162 IP 99.181.97.46.1935 > 10.8.1.3.40170: Flags [.], ack 165615, win 126, options [nop,nop,TS val 1355183557 ecr 493847838], length 0
01:29:18.709607 IP 10.8.1.3.40170 > 99.181.97.46.1935: Flags [.], seq 172583:173897, ack 0, win 501, options [nop,nop,TS val 493848140 ecr 1355183557], length 1314
01:29:18.771123 IP 10.8.1.3.40170 > 99.181.97.46.1935: Flags [.], seq 173897:175211, ack 0, win 501, options [nop,nop,TS val 493848201 ecr 1355183557], length 1314
01:29:18.774941 IP 99.181.97.46.1935 > 10.8.1.3.40170: Flags [.], ack 168243, win 126, options [nop,nop,TS val 1355183649 ecr 493847907], length 0
01:29:18.811132 IP 10.8.1.3.40170 > 99.181.97.46.1935: Flags [.], seq 175211:176525, ack 0, win 501, options [nop,nop,TS val 493848241 ecr 1355183649], length 1314
01:29:18.830051 IP 99.181.97.46.1935 > 10.8.1.3.40170: Flags [.], ack 169955, win 126, options [nop,nop,TS val 1355183707 ecr 493848006], length 0
01:29:18.830107 IP 10.8.1.3.40170 > 99.181.97.46.1935: Flags [P.], seq 176525:176931, ack 0, win 501, options [nop,nop,TS val 493848260 ecr 1355183707], length 406
01:29:18.877558 IP 10.8.1.3.40170 > 99.181.97.46.1935: Flags [.], seq 176931:178245, ack 0, win 501, options [nop,nop,TS val 493848308 ecr 1355183707], length 1314
01:29:18.899746 IP 10.8.1.3.40170 > 99.181.97.46.1935: Flags [.], seq 178245:179559, ack 0, win 501, options [nop,nop,TS val 493848330 ecr 1355183707], length 1314
01:29:18.912378 IP 99.181.97.46.1935 > 10.8.1.3.40170: Flags [.], ack 172583, win 126, options [nop,nop,TS val 1355183791 ecr 493848073], length 0
01:29:18.943225 IP 10.8.1.3.40170 > 99.181.97.46.1935: Flags [.], seq 179559:180873, ack 0, win 501, options [nop,nop,TS val 493848374 ecr 1355183791], length 1314
01:29:19.003454 IP 99.181.97.46.1935 > 10.8.1.3.40170: Flags [.], ack 175211, win 126, options [nop,nop,TS val 1355183885 ecr 493848140], length 0
01:29:19.006430 IP 10.8.1.3.40170 > 99.181.97.46.1935: Flags [.], seq 180873:182187, ack 0, win 501, options [nop,nop,TS val 493848437 ecr 1355183885], length 1314
01:29:19.044588 IP 10.8.1.3.40170 > 99.181.97.46.1935: Flags [.], seq 182187:183501, ack 0, win 501, options [nop,nop,TS val 493848475 ecr 1355183885], length 1314
01:29:19.057820 IP 99.181.97.46.1935 > 10.8.1.3.40170: Flags [.], ack 176931, win 126, options [nop,nop,TS val 1355183943 ecr 493848241], length 0
01:29:19.057859 IP 10.8.1.3.40170 > 99.181.97.46.1935: Flags [P.], seq 183501:183911, ack 0, win 501, options [nop,nop,TS val 493848488 ecr 1355183943], length 410
01:29:19.108879 IP 10.8.1.3.40170 > 99.181.97.46.1935: Flags [.], seq 183911:185225, ack 0, win 501, options [nop,nop,TS val 493848539 ecr 1355183943], length 1314
01:29:19.127958 IP 99.181.97.46.1935 > 10.8.1.3.40170: Flags [.], ack 179559, win 126, options [nop,nop,TS val 1355184013 ecr 493848308], length 0
01:29:19.134694 IP 10.8.1.3.40170 > 99.181.97.46.1935: Flags [.], seq 185225:186539, ack 0, win 501, options [nop,nop,TS val 493848565 ecr 1355184013], length 1314
01:29:19.177514 IP 10.8.1.3.40170 > 99.181.97.46.1935: Flags [.], seq 186539:187853, ack 0, win 501, options [nop,nop,TS val 493848608 ecr 1355184013], length 1314
01:29:19.234064 IP 99.181.97.46.1935 > 10.8.1.3.40170: Flags [.], ack 182187, win 126, options [nop,nop,TS val 1355184121 ecr 493848374], length 0
01:29:19.241946 IP 10.8.1.3.40170 > 99.181.97.46.1935: Flags [.], seq 187853:189167, ack 0, win 501, options [nop,nop,TS val 493848672 ecr 1355184121], length 1314
01:29:19.275626 IP 10.8.1.3.40170 > 99.181.97.46.1935: Flags [.], seq 189167:190481, ack 0, win 501, options [nop,nop,TS val 493848706 ecr 1355184121], length 1314
01:29:19.285378 IP 99.181.97.46.1935 > 10.8.1.3.40170: Flags [.], ack 183911, win 126, options [nop,nop,TS val 1355184171 ecr 493848475], length 0
01:29:19.285401 IP 10.8.1.3.40170 > 99.181.97.46.1935: Flags [P.], seq 190481:190884, ack 0, win 501, options [nop,nop,TS val 493848716 ecr 1355184171], length 403
01:29:19.344691 IP 10.8.1.3.40170 > 99.181.97.46.1935: Flags [.], seq 190884:192198, ack 0, win 501, options [nop,nop,TS val 493848775 ecr 1355184171], length 1314
01:29:19.363919 IP 99.181.97.46.1935 > 10.8.1.3.40170: Flags [.], ack 186539, win 126, options [nop,nop,TS val 1355184248 ecr 493848539], length 0
01:29:19.370278 IP 10.8.1.3.40170 > 99.181.97.46.1935: Flags [.], seq 192198:193512, ack 0, win 501, options [nop,nop,TS val 493848801 ecr 1355184248], length 1314
01:29:19.413106 IP 10.8.1.3.40170 > 99.181.97.46.1935: Flags [.], seq 193512:194826, ack 0, win 501, options [nop,nop,TS val 493848843 ecr 1355184248], length 1314
01:29:19.475023 IP 10.8.1.3.40170 > 99.181.97.46.1935: Flags [.], seq 194826:196140, ack 0, win 501, options [nop,nop,TS val 493848905 ecr 1355184248], length 1314
01:29:19.477667 IP 99.181.97.46.1935 > 10.8.1.3.40170: Flags [.], ack 189167, win 126, options [nop,nop,TS val 1355184355 ecr 493848608], length 0
01:29:19.507500 IP 10.8.1.3.40170 > 99.181.97.46.1935: Flags [.], seq 196140:197454, ack 0, win 501, options [nop,nop,TS val 493848938 ecr 1355184355], length 1314
01:29:19.524766 IP 99.181.97.46.1935 > 10.8.1.3.40170: Flags [.], ack 190884, win 126, options [nop,nop,TS val 1355184398 ecr 493848706], length 0
01:29:19.524784 IP 10.8.1.3.40170 > 99.181.97.46.1935: Flags [P.], seq 197454:197852, ack 0, win 501, options [nop,nop,TS val 493848955 ecr 1355184398], length 398
01:29:19.577241 IP 10.8.1.3.40170 > 99.181.97.46.1935: Flags [.], seq 197852:199166, ack 0, win 501, options [nop,nop,TS val 493849008 ecr 1355184398], length 1314
01:29:19.604938 IP 10.8.1.3.40170 > 99.181.97.46.1935: Flags [.], seq 199166:200480, ack 0, win 501, options [nop,nop,TS val 493849035 ecr 1355184398], length 1314
01:29:19.610569 IP 99.181.97.46.1935 > 10.8.1.3.40170: Flags [.], ack 193512, win 126, options [nop,nop,TS val 1355184483 ecr 493848775], length 0
01:29:19.647835 IP 10.8.1.3.40170 > 99.181.97.46.1935: Flags [.], seq 200480:201794, ack 0, win 501, options [nop,nop,TS val 493849078 ecr 1355184483], length 1314
01:29:19.707643 IP 10.8.1.3.40170 > 99.181.97.46.1935: Flags [.], seq 201794:203108, ack 0, win 501, options [nop,nop,TS val 493849138 ecr 1355184483], length 1314
01:29:19.713675 IP 99.181.97.46.1935 > 10.8.1.3.40170: Flags [.], ack 196140, win 126, options [nop,nop,TS val 1355184588 ecr 493848843], length 0
