07:33:49.088234 IP 52.223.224.181.1935 > 10.8.0.2.44144: Flags [.], ack 1484353805, win 134, options [nop,nop,TS val 3381875291 ecr 1216912869], length 0
07:33:49.096761 IP 10.8.0.2.44144 > 52.223.224.181.1935: Flags [.], seq 8582:9896, ack 0, win 501, options [nop,nop,TS val 1216913263 ecr 3381875291], length 1314
07:33:49.129804 IP 10.8.0.2.44144 > 52.223.224.181.1935: Flags [.], seq 9896:11210, ack 0, win 501, options [nop,nop,TS val 1216913296 ecr 3381875291], length 1314
07:33:49.153192 IP 52.223.224.181.1935 > 10.8.0.2.44144: Flags [.], ack 2629, win 134, options [nop,nop,TS val 3381875356 ecr 1216912962], length 0
07:33:49.161715 IP 10.8.0.2.44144 > 52.223.224.181.1935: Flags [.], seq 11210:12524, ack 0, win 501, options [nop,nop,TS val 1216913328 ecr 3381875356], length 1314
07:33:49.223216 IP 52.223.224.181.1935 > 10.8.0.2.44144: Flags [.], ack 4640, win 134, options [nop,nop,TS val 3381875426 ecr 1216913061], length 0
07:33:49.223251 IP 10.8.0.2.44144 > 52.223.224.181.1935: Flags [P.], seq 12524:13697, ack 0, win 501, options [nop,nop,TS val 1216913389 ecr 3381875426], length 1173
07:33:49.261683 IP 10.8.0.2.44144 > 52.223.224.181.1935: Flags [.], seq 13697:15011, ack 0, win 501, options [nop,nop,TS val 1216913428 ecr 3381875426], length 1314
07:33:49.301051 IP 10.8.0.2.44144 > 52.223.224.181.1935: Flags [.], seq 15011:16325, ack 0, win 501, options [nop,nop,TS val 1216913467 ecr 3381875426], length 1314
07:33:49.323356 IP 52.223.224.181.1935 > 10.8.0.2.44144: Flags [.], ack 7268, win 134, options [nop,nop,TS val 3381875526 ecr 1216913128], length 0
07:33:49.343904 IP 10.8.0.2.44144 > 52.223.224.181.1935: Flags [.], seq 16325:17639, ack 0, win 501, options [nop,nop,TS val 1216913510 ecr 3381875526], length 1314
07:33:49.396623 IP 10.8.0.2.44144 > 52.223.224.181.1935: Flags [.], seq 17639:18953, ack 0, win 501, options [nop,nop,TS val 1216913563 ecr 3381875526], length 1314
07:33:49.418446 IP 52.223.224.181.1935 > 10.8.0.2.44144: Flags [.], ack 8582, win 134, options [nop,nop,TS val 3381875621 ecr 1216913192], length 0
07:33:49.429500 IP 10.8.0.2.44144 > 52.223.224.181.1935: Flags [.], seq 18953:20267, ack 0, win 501, options [nop,nop,TS val 1216913595 ecr 3381875621], length 1314
07:33:49.451795 IP 52.223.224.181.1935 > 10.8.0.2.44144: Flags [.], ack 11210, win 134, options [nop,nop,TS val 3381875655 ecr 1216913263], length 0
07:33:49.472088 IP 10.8.0.2.44144 > 52.223.224.181.1935: Flags [.], seq 20267:21581, ack 0, win 501, options [nop,nop,TS val 1216913638 ecr 3381875655], length 1314
07:33:49.536565 IP 10.8.0.2.44144 > 52.223.224.181.1935: Flags [.], seq 21581:22895, ack 0, win 501, options [nop,nop,TS val 1216913703 ecr 3381875655], length 1314
07:33:49.545260 IP 52.223.224.181.1935 > 10.8.0.2.44144: Flags [.], ack 13697, win 134, options [nop,nop,TS val 3381875748 ecr 1216913328], length 0
07:33:49.545295 IP 10.8.0.2.44144 > 52.223.224.181.1935: Flags [P.], seq 22895:23581, ack 0, win 501, options [nop,nop,TS val 1216913711 ecr 3381875748], length 686
07:33:49.600774 IP 10.8.0.2.44144 > 52.223.224.181.1935: Flags [.], seq 23581:24895, ack 0, win 501, options [nop,nop,TS val 1216913767 ecr 3381875748], length 1314
07:33:49.623202 IP 52.223.224.181.1935 > 10.8.0.2.44144: Flags [.], ack 16325, win 134, options [nop,nop,TS val 3381875826 ecr 1216913428], length 0
07:33:49.630129 IP 10.8.0.2.44144 > 52.223.224.181.1935: Flags [.], seq 24895:26209, ack 0, win 501, options [nop,nop,TS val 1216913796 ecr 3381875826], length 1314
07:33:49.665327 IP 10.8.0.2.44144 > 52.223.224.181.1935: Flags [.], seq 26209:27523, ack 0, win 501, options [nop,nop,TS val 1216913831 ecr 3381875826], length 1314
07:33:49.718578 IP 52.223.224.181.1935 > 10.8.0.2.44144: Flags [.], ack 18953, win 134, options [nop,nop,TS val 3381875921 ecr 1216913510], length 0
07:33:49.729523 IP 10.8.0.2.44144 > 52.223.224.181.1935: Flags [.], seq 27523:28837, ack 0, win 501, options [nop,nop,TS val 1216913895 ecr 3381875921], length 1314
07:33:49.772264 IP 10.8.0.2.44144 > 52.223.224.181.1935: Flags [.], seq 28837:30151, ack 0, win 501, options [nop,nop,TS val 1216913938 ecr 3381875921], length 1314
07:33:49.793358 IP 10.8.0.2.44144 > 52.223.224.181.1935: Flags [.], seq 30151:31465, ack 0, win 501, options [nop,nop,TS val 1216913959 ecr 3381875921], length 1314
07:33:49.793518 IP 52.223.224.181.1935 > 10.8.0.2.44144: Flags [.], ack 21581, win 134, options [nop,nop,TS val 3381875996 ecr 1216913595], length 0
07:33:49.860712 IP 10.8.0.2.44144 > 52.223.224.181.1935: Flags [.], seq 31465:32779, ack 0, win 501, options [nop,nop,TS val 1216914027 ecr 3381875996], length 1314
07:33:49.867417 IP 52.223.224.181.1935 > 10.8.0.2.44144: Flags [.], ack 23581, win 134, options [nop,nop,TS val 3381876070 ecr 1216913703], length 0
07:33:49.867460 IP 10.8.0.2.44144 > 52.223.224.181.1935: Flags [P.], seq 32779:33484, ack 0, win 501, options [nop,nop,TS val 1216914033 ecr 3381876070], length 705
07:33:49.930421 IP 10.8.0.2.44144 > 52.223.224.181.1935: Flags [.], seq 33484:34798, ack 0, win 501, options [nop,nop,TS val 1216914096 ecr 3381876070], length 1314
07:33:49.952461 IP 52.223.224.181.1935 > 10.8.0.2.44144: Flags [.], ack 26209, win 134, options [nop,nop,TS val 3381876155 ecr 1216913767], length 0
07:33:49.964450 IP 10.8.0.2.44144 > 52.223.224.181.1935: Flags [.], seq 34798:36112, ack 0, win 501, options [nop,nop,TS val 1216914130 ecr 3381876155], length 1314
07:33:49.996842 IP 10.8.0.2.44144 > 52.223.224.181.1935: Flags [.], seq 36112:37426, ack 0, win 501, options [nop,nop,TS val 1216914163 ecr 3381876155], length 1314
07:33:50.051201 IP 52.223.224.181.1935 > 10.8.0.2.44144: Flags [.], ack 28837, win 134, options [nop,nop,TS val 3381876254 ecr 1216913831], length 0
07:33:50.070867 IP 10.8.0.2.44144 > 52.223.224.181.1935: Flags [.], seq 37426:38740, ack 0, win 501, options [nop,nop,TS val 1216914237 ecr 3381876254], length 1314
07:33:50.093032 IP 10.8.0.2.44144 > 52.223.224.181.1935: Flags [.], seq 38740:40054, ack 0, win 501, options [nop,nop,TS val 1216914259 ecr 3381876254], length 1314
07:33:50.115004 IP 52.223.224.181.1935 > 10.8.0.2.44144: Flags [.], ack 31465, win 134, options [nop,nop,TS val 3381876318 ecr 1216913938], length 0
07:33:50.135276 IP 10.8.0.2.44144 > 52.223.224.181.1935: Flags [.], seq 40054:41368, ack 0, win 501, options [nop,nop,TS val 1216914301 ecr 3381876318], length 1314
07:33:50.189401 IP 52.223.224.181.1935 > 10.8.0.2.44144: Flags [.], ack 33484, win 134, options [nop,nop,TS val 3381876392 ecr 1216914027], length 0
07:33:50.189435 IP 10.8.0.2.44144 > 52.223.224.181.1935: Flags [P.], seq 41368:42532, ack 0, win 501, options [nop,nop,TS val 1216914355 ecr 3381876392], length 1164
07:33:50.229847 IP 10.8.0.2.44144 > 52.223.224.181.1935: Flags [.], seq 42532:43846, ack 0, win 501, options [nop,nop,TS val 1216914396 ecr 3381876392], length 1314
07:33:50.263982 IP 10.8.0.2.44144 > 52.223.224.181.1935: Flags [.], seq 43846:45160, ack 0, win 501, options [nop,nop,TS val 1216914430 ecr 3381876392], length 1314
07:33:50.286533 IP 52.223.224.181.1935 > 10.8.0.2.44144: Flags [.], ack 36112, win 134, options [nop,nop,TS val 3381876489 ecr 1216914096], length 0
07:33:50.306367 IP 10.8.0.2.44144 > 52.223.224.181.1935: Flags [.], seq 45160:46474, ack 0, win 501, options [nop,nop,TS val 1216914472 ecr 3381876489], length 1314
07:33:50.370061 IP 10.8.0.2.44144 > 52.223.224.181.1935: Flags [.], seq 46474:47788, ack 0, win 501, options [nop,nop,TS val 1216914536 ecr 3381876489], length 1314
07:33:50.386586 IP 52.223.224.181.1935 > 10.8.0.2.44144: Flags [.], ack 37426, win 134, options [nop,nop,TS val 3381876589 ecr 1216914163], length 0
07:33:50.396726 IP 10.8.0.2.44144 > 52.223.224.181.1935: Flags [.], seq 47788:49102, ack 0, win 501, options [nop,nop,TS val 1216914563 ecr 3381876589], length 1314
07:33:50.415007 IP 52.223.224.181.1935 > 10.8.0.2.44144: Flags [.], ack 40054, win 134, options [nop,nop,TS val 3381876618 ecr 1216914237], length 0
07:33:50.434584 IP 10.8.0.2.44144 > 52.223.224.181.1935: Flags [.], seq 49102:50416, ack 0, win 501, options [nop,nop,TS val 1216914601 ecr 3381876618], length 1314
07:33:50.498834 IP 10.8.0.2.44144 > 52.223.224.181.1935: Flags [.], seq 50416:51730, ack 0, win 501, options [nop,nop,TS val 1216914665 ecr 3381876618], length 1314
07:33:50.511202 IP 52.223.224.181.1935 > 10.8.0.2.44144: Flags [.], ack 42532, win 134, options [nop,nop,TS val 3381876714 ecr 1216914301], length 0
07:33:50.511227 IP 10.8.0.2.44144 > 52.223.224.181.1935: Flags [P.], seq 51730:52427, ack 0, win 501, options [nop,nop,TS val 1216914677 ecr 3381876714], length 697
07:33:50.562898 IP 10.8.0.2.44144 > 52.223.224.181.1935: Flags [.], seq 52427:53741, ack 0, win 501, options [nop,nop,TS val 1216914729 ecr 3381876714], length 1314
07:33:50.586380 IP 52.223.224.181.1935 > 10.8.0.2.44144: Flags [.], ack 45160, win 134, options [nop,nop,TS val 3381876789 ecr 1216914396], length 0
07:33:50.605325 IP 10.8.0.2.44144 > 52.223.224.181.1935: Flags [.], seq 53741:55055, ack 0, win 501, options [nop,nop,TS val 1216914771 ecr 3381876789], length 1314
07:33:50.626478 IP 10.8.0.2.44144 > 52.223.224.181.1935: Flags [.], seq 55055:56369, ack 0, win 501, options [nop,nop,TS val 1216914792 ecr 3381876789], length 1314
07:33:50.692223 IP 52.223.224.181.1935 > 10.8.0.2.44144: Flags [.], ack 47788, win 134, options [nop,nop,TS val 3381876895 ecr 1216914472], length 0
07:33:50.696808 IP 10.8.0.2.44144 > 52.223.224.181.1935: Flags [.], seq 56369:57683, ack 0, win 501, options [nop,nop,TS val 1216914863 ecr 3381876895], length 1314
07:33:50.733690 IP 10.8.0.2.44144 > 52.223.224.181.1935: Flags [.], seq 57683:58997, ack 0, win 501, options [nop,nop,TS val 1216914900 ecr 3381876895], length 1314
07:33:50.756410 IP 52.223.224.181.1935 > 10.8.0.2.44144: Flags [.], ack 50416, win 134, options [nop,nop,TS val 3381876959 ecr 1216914563], length 0
07:33:50.763124 IP 10.8.0.2.44144 > 52.223.224.181.1935: Flags [.], seq 58997:60311, ack 0, win 501, options [nop,nop,TS val 1216914929 ecr 3381876959], length 1314
07:33:50.840842 IP 10.8.0.2.44144 > 52.223.224.181.1935: Flags [.], seq 60311:61625, ack 0, win 501, options [nop,nop,TS val 1216915007 ecr 3381876959], length 1314
07:33:50.862030 IP 10.8.0.2.44144 > 52.223.224.181.1935: Flags [.], seq 61625:62939, ack 0, win 501, options [nop,nop,TS val 1216915028 ecr 3381876959], length 1314
07:33:50.904609 IP 10.8.0.2.44144 > 52.223.224.181.1935: Flags [.], seq 62939:64253, ack 0, win 501, options [nop,nop,TS val 1216915071 ecr 3381876959], length 1314
07:33:50.969196 IP 10.8.0.2.44144 > 52.223.224.181.1935: Flags [.], seq 64253:65567, ack 0, win 501, options [nop,nop,TS val 1216915135 ecr 3381876959], length 1314
07:33:50.995403 IP 10.8.0.2.44144 > 52.223.224.181.1935: Flags [.], seq 65567:66881, ack 0, win 501, options [nop,nop,TS val 1216915161 ecr 3381876959], length 1314
07:33:51.010241 IP 52.223.224.181.1935 > 10.8.0.2.44144: Flags [.], ack 56369, win 134, options [nop,nop,TS val 3381877213 ecr 1216914792], length 0
07:33:51.010267 IP 10.8.0.2.44144 > 52.223.224.181.1935: Flags [P.], seq 66881:67318, ack 0, win 501, options [nop,nop,TS val 1216915176 ecr 3381877213], length 437
07:33:51.055663 IP 52.223.224.181.1935 > 10.8.0.2.44144: Flags [.], ack 58997, win 134, options [nop,nop,TS val 3381877258 ecr 1216914863], length 0
07:33:51.063355 IP 10.8.0.2.44144 > 52.223.224.181.1935: Flags [.], seq 67318:68632, ack 0, win 501, options [nop,nop,TS val 1216915229 ecr 3381877258], length 1314
07:33:51.097553 IP 10.8.0.2.44144 > 52.223.224.181.1935: Flags [.], seq 68632:69946, ack 0, win 501, options [nop,nop,TS val 1216915263 ecr 3381877258], length 1314
07:33:51.140421 IP 10.8.0.2.44144 > 52.223.224.181.1935: Flags [.], seq 69946:71260, ack 0, win 501, options [nop,nop,TS val 1216915306 ecr 3381877258], length 1314
07:33:51.162374 IP 52.223.224.181.1935 > 10.8.0.2.44144: Flags [.], ack 60311, win 134, options [nop,nop,TS val 3381877365 ecr 1216914929], length 0
07:33:51.184163 IP 52.223.224.181.1935 > 10.8.0.2.44144: Flags [.], ack 62939, win 134, options [nop,nop,TS val 3381877387 ecr 1216915007], length 0
07:33:51.204171 IP 10.8.0.2.44144 > 52.223.224.181.1935: Flags [.], seq 71260:72574, ack 0, win 501, options [nop,nop,TS val 1216915370 ecr 3381877387], length 1314
07:33:51.227020 IP 10.8.0.2.44144 > 52.223.224.181.1935: Flags [.], seq 72574:73888, ack 0, win 501, options [nop,nop,TS val 1216915393 ecr 3381877387], length 1314
07:33:51.268046 IP 10.8.0.2.44144 > 52.223.224.181.1935: Flags [.], seq 73888:75202, ack 0, win 501, options [nop,nop,TS val 1216915434 ecr 3381877387], length 1314
07:33:51.291202 IP 52.223.224.181.1935 > 10.8.0.2.44144: Flags [.], ack 65567, win 134, options [nop,nop,TS val 3381877494 ecr 1216915071], length 0
07:33:51.331840 IP 52.223.224.181.1935 > 10.8.0.2.44144: Flags [.], ack 67318, win 134, options [nop,nop,TS val 3381877534 ecr 1216915161], length 0
07:33:51.331878 IP 10.8.0.2.44144 > 52.223.224.181.1935: Flags [P.], seq 75202:76462, ack 0, win 501, options [nop,nop,TS val 1216915498 ecr 3381877534], length 1260
07:33:51.374830 IP 10.8.0.2.44144 > 52.223.224.181.1935: Flags [.], seq 76462:77776, ack 0, win 501, options [nop,nop,TS val 1216915541 ecr 3381877534], length 1314
07:33:51.396023 IP 10.8.0.2.44144 > 52.223.224.181.1935: Flags [.], seq 77776:79090, ack 0, win 501, options [nop,nop,TS val 1216915562 ecr 3381877534], length 1314
07:33:51.419957 IP 52.223.224.181.1935 > 10.8.0.2.44144: Flags [.], ack 69946, win 134, options [nop,nop,TS val 3381877622 ecr 1216915229], length 0
07:33:51.459944 IP 10.8.0.2.44144 > 52.223.224.181.1935: Flags [.], seq 79090:80404, ack 0, win 501, options [nop,nop,TS val 1216915626 ecr 3381877622], length 1314
07:33:51.503026 IP 10.8.0.2.44144 > 52.223.224.181.1935: Flags [.], seq 80404:81718, ack 0, win 501, options [nop,nop,TS val 1216915669 ecr 3381877622], length 1314
07:33:51.525785 IP 52.223.224.181.1935 > 10.8.0.2.44144: Flags [.], ack 72574, win 134, options [nop,nop,TS val 3381877729 ecr 1216915306], length 0
07:33:51.528406 IP 10.8.0.2.44144 > 52.223.224.181.1935: Flags [.], seq 81718:83032, ack 0, win 501, options [nop,nop,TS val 1216915694 ecr 3381877729], length 1314
07:33:51.588432 IP 10.8.0.2.44144 > 52.223.224.181.1935: Flags [.], seq 83032:84346, ack 0, win 501, options [nop,nop,TS val 1216915754 ecr 3381877729], length 1314
07:33:51.589998 IP 52.223.224.181.1935 > 10.8.0.2.44144: Flags [.], ack 75202, win 134, options [nop,nop,TS val 3381877793 ecr 1216915393], length 0
07:33:51.631154 IP 10.8.0.2.44144 > 52.223.224.181.1935: Flags [.], seq 84346:85660, ack 0, win 501, options [nop,nop,TS val 1216915797 ecr 3381877793], length 1314
07:33:51.653946 IP 52.223.224.181.1935 > 10.8.0.2.44144: Flags [.], ack 76462, win 134, options [nop,nop,TS val 3381877856 ecr 1216915498], length 0
07:33:51.653956 IP 10.8.0.2.44144 > 52.223.224.181.1935: Flags [P.], seq 85660:86366, ack 0, win 501, options [nop,nop,TS val 1216915820 ecr 3381877856], length 706
07:33:51.694735 IP 10.8.0.2.44144 > 52.223.224.181.1935: Flags [.], seq 86366:87680, ack 0, win 501, options [nop,nop,TS val 1216915861 ecr 3381877856], length 1314
07:33:51.717972 IP 52.223.224.181.1935 > 10.8.0.2.44144: Flags [.], ack 79090, win 134, options [nop,nop,TS val 3381877921 ecr 1216915541], length 0
07:33:51.737561 IP 10.8.0.2.44144 > 52.223.224.181.1935: Flags [.], seq 87680:88994, ack 0, win 501, options [nop,nop,TS val 1216915904 ecr 3381877921], length 1314
07:33:51.780437 IP 10.8.0.2.44144 > 52.223.224.181.1935: Flags [.], seq 88994:90308, ack 0, win 501, options [nop,nop,TS val 1216915946 ecr 3381877921], length 1314
07:33:51.824883 IP 52.223.224.181.1935 > 10.8.0.2.44144: Flags [.], ack 81718, win 134, options [nop,nop,TS val 3381878027 ecr 1216915626], length 0
07:33:51.828290 IP 10.8.0.2.44144 > 52.223.224.181.1935: Flags [.], seq 90308:91622, ack 0, win 501, options [nop,nop,TS val 1216915994 ecr 3381878027], length 1314
07:33:51.866145 IP 10.8.0.2.44144 > 52.223.224.181.1935: Flags [.], seq 91622:92936, ack 0, win 501, options [nop,nop,TS val 1216916032 ecr 3381878027], length 1314
07:33:51.909070 IP 10.8.0.2.44144 > 52.223.224.181.1935: Flags [.], seq 92936:94250, ack 0, win 501, options [nop,nop,TS val 1216916075 ecr 3381878027], length 1314
07:33:51.910185 IP 52.223.224.181.1935 > 10.8.0.2.44144: Flags [.], ack 84346, win 134, options [nop,nop,TS val 3381878113 ecr 1216915694], length 0
07:33:51.973113 IP 10.8.0.2.44144 > 52.223.224.181.1935: Flags [.], seq 94250:95564, ack 0, win 501, options [nop,nop,TS val 1216916139 ecr 3381878113], length 1314
07:33:51.975547 IP 52.223.224.181.1935 > 10.8.0.2.44144: Flags [.], ack 86366, win 134, options [nop,nop,TS val 3381878178 ecr 1216915797], length 0
07:33:51.975560 IP 10.8.0.2.44144 > 52.223.224.181.1935: Flags [P.], seq 95564:96253, ack 0, win 501, options [nop,nop,TS val 1216916142 ecr 3381878178], length 689
07:33:52.036713 IP 10.8.0.2.44144 > 52.223.224.181.1935: Flags [.], seq 96253:97567, ack 0, win 501, options [nop,nop,TS val 1216916203 ecr 3381878178], length 1314
07:33:52.059347 IP 10.8.0.2.44144 > 52.223.224.181.1935: Flags [.], seq 97567:98881, ack 0, win 501, options [nop,nop,TS val 1216916225 ecr 3381878178], length 1314
07:33:52.059707 IP 52.223.224.181.1935 > 10.8.0.2.44144: Flags [.], ack 88994, win 134, options [nop,nop,TS val 3381878262 ecr 1216915861], length 0
07:33:52.100681 IP 10.8.0.2.44144 > 52.223.224.181.1935: Flags [.], seq 98881:100195, ack 0, win 501, options [nop,nop,TS val 1216916267 ecr 3381878262], length 1314
07:33:52.150236 IP 52.223.224.181.1935 > 10.8.0.2.44144: Flags [.], ack 91622, win 134, options [nop,nop,TS val 3381878353 ecr 1216915946], length 0
07:33:52.165164 IP 10.8.0.2.44144 > 52.223.224.181.1935: Flags [.], seq 100195:101509, ack 0, win 501, options [nop,nop,TS val 1216916331 ecr 3381878353], length 1314
07:33:52.208187 IP 10.8.0.2.44144 > 52.223.224.181.1935: Flags [.], seq 101509:102823, ack 0, win 501, options [nop,nop,TS val 1216916374 ecr 3381878353], length 1314
07:33:52.229508 IP 10.8.0.2.44144 > 52.223.224.181.1935: Flags [.], seq 102823:104137, ack 0, win 501, options [nop,nop,TS val 1216916395 ecr 3381878353], length 1314
07:33:52.296832 IP 10.8.0.2.44144 > 52.223.224.181.1935: Flags [.], seq 104137:105451, ack 0, win 501, options [nop,nop,TS val 1216916463 ecr 3381878353], length 1314
07:33:52.297390 IP 52.223.224.181.1935 > 10.8.0.2.44144: Flags [.], ack 96253, win 134, options [nop,nop,TS val 3381878500 ecr 1216916139], length 0
07:33:52.297428 IP 10.8.0.2.44144 > 52.223.224.181.1935: Flags [P.], seq 105451:106156, ack 0, win 501, options [nop,nop,TS val 1216916463 ecr 3381878500], length 705
07:33:52.361598 IP 10.8.0.2.44144 > 52.223.224.181.1935: Flags [.], seq 106156:107470, ack 0, win 501, options [nop,nop,TS val 1216916528 ecr 3381878500], length 1314
07:33:52.381034 IP 52.223.224.181.1935 > 10.8.0.2.44144: Flags [.], ack 98881, win 134, options [nop,nop,TS val 3381878584 ecr 1216916203], length 0
07:33:52.400433 IP 10.8.0.2.44144 > 52.223.224.181.1935: Flags [.], seq 107470:108784, ack 0, win 501, options [nop,nop,TS val 1216916566 ecr 3381878584], length 1314
07:33:52.442803 IP 10.8.0.2.44144 > 52.223.224.181.1935: Flags [.], seq 108784:110098, ack 0, win 501, options [nop,nop,TS val 1216916609 ecr 3381878584], length 1314
07:33:52.487856 IP 52.223.224.181.1935 > 10.8.0.2.44144: Flags [.], ack 101509, win 134, options [nop,nop,TS val 3381878690 ecr 1216916267], length 0
07:33:52.506742 IP 10.8.0.2.44144 > 52.223.224.181.1935: Flags [.], seq 110098:111412, ack 0, win 501, options [nop,nop,TS val 1216916673 ecr 3381878690], length 1314
07:33:52.528891 IP 10.8.0.2.44144 > 52.223.224.181.1935: Flags [.], seq 111412:112726, ack 0, win 501, options [nop,nop,TS val 1216916695 ecr 3381878690], length 1314
07:33:52.551197 IP 52.223.224.181.1935 > 10.8.0.2.44144: Flags [.], ack 104137, win 134, options [nop,nop,TS val 3381878754 ecr 1216916374], length 0
07:33:52.570531 IP 10.8.0.2.44144 > 52.223.224.181.1935: Flags [.], seq 112726:114040, ack 0, win 501, options [nop,nop,TS val 1216916736 ecr 3381878754], length 1314
07:33:52.619229 IP 52.223.224.181.1935 > 10.8.0.2.44144: Flags [.], ack 106156, win 134, options [nop,nop,TS val 3381878822 ecr 1216916463], length 0
07:33:52.619243 IP 10.8.0.2.44144 > 52.223.224.181.1935: Flags [P.], seq 114040:115200, ack 0, win 501, options [nop,nop,TS val 1216916785 ecr 3381878822], length 1160
07:33:52.663265 IP 10.8.0.2.44144 > 52.223.224.181.1935: Flags [.], seq 115200:116514, ack 0, win 501, options [nop,nop,TS val 1216916829 ecr 3381878822], length 1314
07:33:52.698798 IP 10.8.0.2.44144 > 52.223.224.181.1935: Flags [.], seq 116514:117828, ack 0, win 501, options [nop,nop,TS val 1216916865 ecr 3381878822], length 1314
07:33:52.722328 IP 52.223.224.181.1935 > 10.8.0.2.44144: Flags [.], ack 108784, win 134, options [nop,nop,TS val 3381878925 ecr 1216916528], length 0
07:33:52.741189 IP 10.8.0.2.44144 > 52.223.224.181.1935: Flags [.], seq 117828:119142, ack 0, win 501, options [nop,nop,TS val 1216916907 ecr 3381878925], length 1314
07:33:52.805270 IP 10.8.0.2.44144 > 52.223.224.181.1935: Flags [.], seq 119142:120456, ack 0, win 501, options [nop,nop,TS val 1216916971 ecr 3381878925], length 1314
07:33:52.829934 IP 10.8.0.2.44144 > 52.223.224.181.1935: Flags [.], seq 120456:121770, ack 0, win 501, options [nop,nop,TS val 1216916996 ecr 3381878925], length 1314
07:33:52.869063 IP 10.8.0.2.44144 > 52.223.224.181.1935: Flags [.], seq 121770:123084, ack 0, win 501, options [nop,nop,TS val 1216917035 ecr 3381878925], length 1314
07:33:52.892582 IP 52.223.224.181.1935 > 10.8.0.2.44144: Flags [.], ack 114040, win 134, options [nop,nop,TS val 3381879095 ecr 1216916695], length 0
07:33:52.933243 IP 10.8.0.2.44144 > 52.223.224.181.1935: Flags [.], seq 123084:124398, ack 0, win 501, options [nop,nop,TS val 1216917099 ecr 3381879095], length 1314
07:33:52.941293 IP 52.223.224.181.1935 > 10.8.0.2.44144: Flags [.], ack 115200, win 134, options [nop,nop,TS val 3381879144 ecr 1216916785], length 0
07:33:52.941328 IP 10.8.0.2.44144 > 52.223.224.181.1935: Flags [P.], seq 124398:125096, ack 0, win 501, options [nop,nop,TS val 1216917107 ecr 3381879144], length 698
07:33:52.997570 IP 10.8.0.2.44144 > 52.223.224.181.1935: Flags [.], seq 125096:126410, ack 0, win 501, options [nop,nop,TS val 1216917164 ecr 3381879144], length 1314
07:33:53.021005 IP 52.223.224.181.1935 > 10.8.0.2.44144: Flags [.], ack 117828, win 134, options [nop,nop,TS val 3381879223 ecr 1216916829], length 0
07:33:53.040007 IP 10.8.0.2.44144 > 52.223.224.181.1935: Flags [.], seq 126410:127724, ack 0, win 501, options [nop,nop,TS val 1216917206 ecr 3381879223], length 1314
07:33:53.061271 IP 10.8.0.2.44144 > 52.223.224.181.1935: Flags [.], seq 127724:129038, ack 0, win 501, options [nop,nop,TS val 1216917227 ecr 3381879223], length 1314
07:33:53.127347 IP 52.223.224.181.1935 > 10.8.0.2.44144: Flags [.], ack 120456, win 134, options [nop,nop,TS val 3381879330 ecr 1216916907], length 0
07:33:53.129780 IP 10.8.0.2.44144 > 52.223.224.181.1935: Flags [.], seq 129038:130352, ack 0, win 501, options [nop,nop,TS val 1216917296 ecr 3381879330], length 1314
07:33:53.168431 IP 10.8.0.2.44144 > 52.223.224.181.1935: Flags [.], seq 130352:131666, ack 0, win 501, options [nop,nop,TS val 1216917334 ecr 3381879330], length 1314
07:33:53.191220 IP 52.223.224.181.1935 > 10.8.0.2.44144: Flags [.], ack 123084, win 134, options [nop,nop,TS val 3381879394 ecr 1216916996], length 0
07:33:53.193530 IP 10.8.0.2.44144 > 52.223.224.181.1935: Flags [.], seq 131666:132980, ack 0, win 501, options [nop,nop,TS val 1216917359 ecr 3381879394], length 1314
07:33:53.263232 IP 52.223.224.181.1935 > 10.8.0.2.44144: Flags [.], ack 125096, win 134, options [nop,nop,TS val 3381879466 ecr 1216917099], length 0
07:33:53.263270 IP 10.8.0.2.44144 > 52.223.224.181.1935: Flags [P.], seq 132980:134244, ack 0, win 501, options [nop,nop,TS val 1216917429 ecr 3381879466], length 1264
07:33:53.296651 IP 10.8.0.2.44144 > 52.223.224.181.1935: Flags [.], seq 134244:135558, ack 0, win 501, options [nop,nop,TS val 1216917463 ecr 3381879466], length 1314
07:33:53.339370 IP 10.8.0.2.44144 > 52.223.224.181.1935: Flags [.], seq 135558:136872, ack 0, win 501, options [nop,nop,TS val 1216917505 ecr 3381879466], length 1314
07:33:53.361861 IP 52.223.224.181.1935 > 10.8.0.2.44144: Flags [.], ack 127724, win 134, options [nop,nop,TS val 3381879565 ecr 1216917164], length 0
07:33:53.392451 IP 10.8.0.2.44144 > 52.223.224.181.1935: Flags [.], seq 136872:138186, ack 0, win 501, options [nop,nop,TS val 1216917558 ecr 3381879565], length 1314
07:33:53.426011 IP 10.8.0.2.44144 > 52.223.224.181.1935: Flags [.], seq 138186:139500, ack 0, win 501, options [nop,nop,TS val 1216917592 ecr 3381879565], length 1314
07:33:53.450297 IP 52.223.224.181.1935 > 10.8.0.2.44144: Flags [.], ack 129038, win 134, options [nop,nop,TS val 3381879653 ecr 1216917227], length 0
07:33:53.467158 IP 10.8.0.2.44144 > 52.223.224.181.1935: Flags [.], seq 139500:140814, ack 0, win 501, options [nop,nop,TS val 1216917633 ecr 3381879653], length 1314
07:33:53.490481 IP 52.223.224.181.1935 > 10.8.0.2.44144: Flags [.], ack 131666, win 134, options [nop,nop,TS val 3381879693 ecr 1216917296], length 0
07:33:53.529849 IP 10.8.0.2.44144 > 52.223.224.181.1935: Flags [.], seq 140814:142128, ack 0, win 501, options [nop,nop,TS val 1216917696 ecr 3381879693], length 1314
07:33:53.574481 IP 10.8.0.2.44144 > 52.223.224.181.1935: Flags [.], seq 142128:143442, ack 0, win 501, options [nop,nop,TS val 1216917740 ecr 3381879693], length 1314
07:33:53.585082 IP 52.223.224.181.1935 > 10.8.0.2.44144: Flags [.], ack 134244, win 134, options [nop,nop,TS val 3381879788 ecr 1216917359], length 0
07:33:53.585116 IP 10.8.0.2.44144 > 52.223.224.181.1935: Flags [P.], seq 143442:144040, ack 0, win 501, options [nop,nop,TS val 1216917751 ecr 3381879788], length 598
07:33:53.638310 IP 10.8.0.2.44144 > 52.223.224.181.1935: Flags [.], seq 144040:145354, ack 0, win 501, options [nop,nop,TS val 1216917804 ecr 3381879788], length 1314
07:33:53.659486 IP 10.8.0.2.44144 > 52.223.224.181.1935: Flags [.], seq 145354:146668, ack 0, win 501, options [nop,nop,TS val 1216917825 ecr 3381879788], length 1314
07:33:53.661189 IP 52.223.224.181.1935 > 10.8.0.2.44144: Flags [.], ack 136872, win 134, options [nop,nop,TS val 3381879864 ecr 1216917463], length 0
07:33:53.702092 IP 10.8.0.2.44144 > 52.223.224.181.1935: Flags [.], seq 146668:147982, ack 0, win 501, options [nop,nop,TS val 1216917868 ecr 3381879864], length 1314
07:33:53.748267 IP 52.223.224.181.1935 > 10.8.0.2.44144: Flags [.], ack 139500, win 134, options [nop,nop,TS val 3381879951 ecr 1216917558], length 0
07:33:53.766475 IP 10.8.0.2.44144 > 52.223.224.181.1935: Flags [.], seq 147982:149296, ack 0, win 501, options [nop,nop,TS val 1216917932 ecr 3381879951], length 1314
07:33:53.808918 IP 10.8.0.2.44144 > 52.223.224.181.1935: Flags [.], seq 149296:150610, ack 0, win 501, options [nop,nop,TS val 1216917975 ecr 3381879951], length 1314
07:33:53.830220 IP 10.8.0.2.44144 > 52.223.224.181.1935: Flags [.], seq 150610:151924, ack 0, win 501, options [nop,nop,TS val 1216917996 ecr 3381879951], length 1314
07:33:53.851859 IP 52.223.224.181.1935 > 10.8.0.2.44144: Flags [.], ack 142128, win 134, options [nop,nop,TS val 3381880055 ecr 1216917633], length 0
07:33:53.896369 IP 10.8.0.2.44144 > 52.223.224.181.1935: Flags [.], seq 151924:153238, ack 0, win 501, options [nop,nop,TS val 1216918062 ecr 3381880055], length 1314
07:33:53.907221 IP 52.223.224.181.1935 > 10.8.0.2.44144: Flags [.], ack 144040, win 134, options [nop,nop,TS val 3381880110 ecr 1216917740], length 0
07:33:53.907253 IP 10.8.0.2.44144 > 52.223.224.181.1935: Flags [P.], seq 153238:153943, ack 0, win 501, options [nop,nop,TS val 1216918073 ecr 3381880110], length 705
07:33:53.960702 IP 10.8.0.2.44144 > 52.223.224.181.1935: Flags [.], seq 153943:155257, ack 0, win 501, options [nop,nop,TS val 1216918127 ecr 3381880110], length 1314
07:33:53.981585 IP 52.223.224.181.1935 > 10.8.0.2.44144: Flags [.], ack 146668, win 134, options [nop,nop,TS val 3381880184 ecr 1216917804], length 0
07:33:54.001607 IP 10.8.0.2.44144 > 52.223.224.181.1935: Flags [.], seq 155257:156571, ack 0, win 501, options [nop,nop,TS val 1216918168 ecr 3381880184], length 1314
07:33:54.044102 IP 10.8.0.2.44144 > 52.223.224.181.1935: Flags [.], seq 156571:157885, ack 0, win 501, options [nop,nop,TS val 1216918210 ecr 3381880184], length 1314
07:33:54.088473 IP 52.223.224.181.1935 > 10.8.0.2.44144: Flags [.], ack 149296, win 134, options [nop,nop,TS val 3381880291 ecr 1216917868], length 0
07:33:54.107786 IP 10.8.0.2.44144 > 52.223.224.181.1935: Flags [.], seq 157885:159199, ack 0, win 501, options [nop,nop,TS val 1216918274 ecr 3381880291], length 1314
07:33:54.129177 IP 10.8.0.2.44144 > 52.223.224.181.1935: Flags [.], seq 159199:160513, ack 0, win 501, options [nop,nop,TS val 1216918295 ecr 3381880291], length 1314
07:33:54.152277 IP 52.223.224.181.1935 > 10.8.0.2.44144: Flags [.], ack 151924, win 134, options [nop,nop,TS val 3381880355 ecr 1216917975], length 0
07:33:54.172142 IP 10.8.0.2.44144 > 52.223.224.181.1935: Flags [.], seq 160513:161827, ack 0, win 501, options [nop,nop,TS val 1216918338 ecr 3381880355], length 1314
07:33:54.229213 IP 52.223.224.181.1935 > 10.8.0.2.44144: Flags [.], ack 153943, win 134, options [nop,nop,TS val 3381880432 ecr 1216918062], length 0
07:33:54.229236 IP 10.8.0.2.44144 > 52.223.224.181.1935: Flags [P.], seq 161827:163078, ack 0, win 501, options [nop,nop,TS val 1216918395 ecr 3381880432], length 1251
07:33:54.262708 IP 10.8.0.2.44144 > 52.223.224.181.1935: Flags [.], seq 163078:164392, ack 0, win 501, options [nop,nop,TS val 1216918429 ecr 3381880432], length 1314
07:33:54.300508 IP 10.8.0.2.44144 > 52.223.224.181.1935: Flags [.], seq 164392:165706, ack 0, win 501, options [nop,nop,TS val 1216918466 ecr 3381880432], length 1314
07:33:54.323877 IP 52.223.224.181.1935 > 10.8.0.2.44144: Flags [.], ack 156571, win 134, options [nop,nop,TS val 3381880526 ecr 1216918127], length 0
07:33:54.343830 IP 10.8.0.2.44144 > 52.223.224.181.1935: Flags [.], seq 165706:167020, ack 0, win 501, options [nop,nop,TS val 1216918510 ecr 3381880526], length 1314
07:33:54.393512 IP 10.8.0.2.44144 > 52.223.224.181.1935: Flags [.], seq 167020:168334, ack 0, win 501, options [nop,nop,TS val 1216918559 ecr 3381880526], length 1314
07:33:54.425842 IP 10.8.0.2.44144 > 52.223.224.181.1935: Flags [.], seq 168334:169648, ack 0, win 501, options [nop,nop,TS val 1216918592 ecr 3381880526], length 1314
07:33:54.429625 IP 52.223.224.181.1935 > 10.8.0.2.44144: Flags [.], ack 159199, win 134, options [nop,nop,TS val 3381880632 ecr 1216918210], length 0
07:33:54.471257 IP 10.8.0.2.44144 > 52.223.224.181.1935: Flags [.], seq 169648:170962, ack 0, win 501, options [nop,nop,TS val 1216918637 ecr 3381880632], length 1314
07:33:54.494243 IP 52.223.224.181.1935 > 10.8.0.2.44144: Flags [.], ack 161827, win 134, options [nop,nop,TS val 3381880697 ecr 1216918295], length 0
07:33:54.528875 IP 10.8.0.2.44144 > 52.223.224.181.1935: Flags [.], seq 170962:172276, ack 0, win 501, options [nop,nop,TS val 1216918695 ecr 3381880697], length 1314
07:33:54.550980 IP 52.223.224.181.1935 > 10.8.0.2.44144: Flags [.], ack 163078, win 134, options [nop,nop,TS val 3381880754 ecr 1216918395], length 0
07:33:54.550995 IP 10.8.0.2.44144 > 52.223.224.181.1935: Flags [P.], seq 172276:172978, ack 0, win 501, options [nop,nop,TS val 1216918717 ecr 3381880754], length 702
07:33:54.592464 IP 10.8.0.2.44144 > 52.223.224.181.1935: Flags [.], seq 172978:174292, ack 0, win 501, options [nop,nop,TS val 1216918758 ecr 3381880754], length 1314
07:33:54.622369 IP 52.223.224.181.1935 > 10.8.0.2.44144: Flags [.], ack 165706, win 134, options [nop,nop,TS val 3381880825 ecr 1216918429], length 0
07:33:54.626251 IP 10.8.0.2.44144 > 52.223.224.181.1935: Flags [.], seq 174292:175606, ack 0, win 501, options [nop,nop,TS val 1216918792 ecr 3381880825], length 1314
07:33:54.684087 IP 10.8.0.2.44144 > 52.223.224.181.1935: Flags [.], seq 175606:176920, ack 0, win 501, options [nop,nop,TS val 1216918850 ecr 3381880825], length 1314
07:33:54.715184 IP 52.223.224.181.1935 > 10.8.0.2.44144: Flags [.], ack 168334, win 134, options [nop,nop,TS val 3381880918 ecr 1216918510], length 0
07:33:54.726600 IP 10.8.0.2.44144 > 52.223.224.181.1935: Flags [.], seq 176920:178234, ack 0, win 501, options [nop,nop,TS val 1216918893 ecr 3381880918], length 1314
07:33:54.768866 IP 10.8.0.2.44144 > 52.223.224.181.1935: Flags [.], seq 178234:179548, ack 0, win 501, options [nop,nop,TS val 1216918935 ecr 3381880918], length 1314
07:33:54.793318 IP 52.223.224.181.1935 > 10.8.0.2.44144: Flags [.], ack 170962, win 134, options [nop,nop,TS val 3381880996 ecr 1216918592], length 0
07:33:54.811499 IP 10.8.0.2.44144 > 52.223.224.181.1935: Flags [.], seq 179548:180862, ack 0, win 501, options [nop,nop,TS val 1216918977 ecr 3381880996], length 1314
07:33:54.873064 IP 52.223.224.181.1935 > 10.8.0.2.44144: Flags [.], ack 172978, win 134, options [nop,nop,TS val 3381881075 ecr 1216918695], length 0
07:33:54.873097 IP 10.8.0.2.44144 > 52.223.224.181.1935: Flags [P.], seq 180862:182030, ack 0, win 501, options [nop,nop,TS val 1216919039 ecr 3381881075], length 1168
07:33:54.897091 IP 10.8.0.2.44144 > 52.223.224.181.1935: Flags [.], seq 182030:183344, ack 0, win 501, options [nop,nop,TS val 1216919063 ecr 3381881075], length 1314
07:33:54.939680 IP 10.8.0.2.44144 > 52.223.224.181.1935: Flags [.], seq 183344:184658, ack 0, win 501, options [nop,nop,TS val 1216919106 ecr 3381881075], length 1314
07:33:54.948218 IP 52.223.224.181.1935 > 10.8.0.2.44144: Flags [.], ack 175606, win 134, options [nop,nop,TS val 3381881151 ecr 1216918758], length 0
07:33:54.995411 IP 10.8.0.2.44144 > 52.223.224.181.1935: Flags [.], seq 184658:185972, ack 0, win 501, options [nop,nop,TS val 1216919161 ecr 3381881151], length 1314
07:33:55.026005 IP 10.8.0.2.44144 > 52.223.224.181.1935: Flags [.], seq 185972:187286, ack 0, win 501, options [nop,nop,TS val 1216919192 ecr 3381881151], length 1314
07:33:55.048371 IP 52.223.224.181.1935 > 10.8.0.2.44144: Flags [.], ack 178234, win 134, options [nop,nop,TS val 3381881251 ecr 1216918850], length 0
07:33:55.068155 IP 10.8.0.2.44144 > 52.223.224.181.1935: Flags [.], seq 187286:188600, ack 0, win 501, options [nop,nop,TS val 1216919234 ecr 3381881251], length 1314
07:33:55.125603 IP 10.8.0.2.44144 > 52.223.224.181.1935: Flags [.], seq 188600:189914, ack 0, win 501, options [nop,nop,TS val 1216919292 ecr 3381881251], length 1314
07:33:55.133629 IP 52.223.224.181.1935 > 10.8.0.2.44144: Flags [.], ack 180862, win 134, options [nop,nop,TS val 3381881336 ecr 1216918935], length 0
07:33:55.174290 IP 10.8.0.2.44144 > 52.223.224.181.1935: Flags [.], seq 189914:191228, ack 0, win 501, options [nop,nop,TS val 1216919340 ecr 3381881336], length 1314
07:33:55.195029 IP 52.223.224.181.1935 > 10.8.0.2.44144: Flags [.], ack 182030, win 134, options [nop,nop,TS val 3381881398 ecr 1216919039], length 0
07:33:55.195054 IP 10.8.0.2.44144 > 52.223.224.181.1935: Flags [P.], seq 191228:191827, ack 0, win 501, options [nop,nop,TS val 1216919361 ecr 3381881398], length 599
07:33:55.238741 IP 10.8.0.2.44144 > 52.223.224.181.1935: Flags [.], seq 191827:193141, ack 0, win 501, options [nop,nop,TS val 1216919405 ecr 3381881398], length 1314
07:33:55.261886 IP 52.223.224.181.1935 > 10.8.0.2.44144: Flags [.], ack 184658, win 134, options [nop,nop,TS val 3381881464 ecr 1216919063], length 0
07:33:55.263930 IP 10.8.0.2.44144 > 52.223.224.181.1935: Flags [.], seq 193141:194455, ack 0, win 501, options [nop,nop,TS val 1216919430 ecr 3381881464], length 1314
07:33:55.302946 IP 10.8.0.2.44144 > 52.223.224.181.1935: Flags [.], seq 194455:195769, ack 0, win 501, options [nop,nop,TS val 1216919469 ecr 3381881464], length 1314
07:33:55.348213 IP 52.223.224.181.1935 > 10.8.0.2.44144: Flags [.], ack 187286, win 134, options [nop,nop,TS val 3381881551 ecr 1216919161], length 0
07:33:55.366504 IP 10.8.0.2.44144 > 52.223.224.181.1935: Flags [.], seq 195769:197083, ack 0, win 501, options [nop,nop,TS val 1216919532 ecr 3381881551], length 1314
07:33:55.408903 IP 10.8.0.2.44144 > 52.223.224.181.1935: Flags [.], seq 197083:198397, ack 0, win 501, options [nop,nop,TS val 1216919575 ecr 3381881551], length 1314
07:33:55.430173 IP 10.8.0.2.44144 > 52.223.224.181.1935: Flags [.], seq 198397:199711, ack 0, win 501, options [nop,nop,TS val 1216919596 ecr 3381881551], length 1314
07:33:55.447803 IP 52.223.224.181.1935 > 10.8.0.2.44144: Flags [.], ack 189914, win 134, options [nop,nop,TS val 3381881651 ecr 1216919234], length 0
07:33:55.496903 IP 10.8.0.2.44144 > 52.223.224.181.1935: Flags [.], seq 199711:201025, ack 0, win 501, options [nop,nop,TS val 1216919663 ecr 3381881651], length 1314
07:33:55.516748 IP 52.223.224.181.1935 > 10.8.0.2.44144: Flags [.], ack 191827, win 134, options [nop,nop,TS val 3381881720 ecr 1216919340], length 0
07:33:55.516760 IP 10.8.0.2.44144 > 52.223.224.181.1935: Flags [P.], seq 201025:201825, ack 0, win 501, options [nop,nop,TS val 1216919683 ecr 3381881720], length 800
07:33:55.560227 IP 10.8.0.2.44144 > 52.223.224.181.1935: Flags [.], seq 201825:203139, ack 0, win 501, options [nop,nop,TS val 1216919726 ecr 3381881720], length 1314
07:33:55.586068 IP 52.223.224.181.1935 > 10.8.0.2.44144: Flags [.], ack 194455, win 134, options [nop,nop,TS val 3381881789 ecr 1216919405], length 0
07:33:55.601082 IP 10.8.0.2.44144 > 52.223.224.181.1935: Flags [.], seq 203139:204453, ack 0, win 501, options [nop,nop,TS val 1216919767 ecr 3381881789], length 1314
07:33:55.644148 IP 10.8.0.2.44144 > 52.223.224.181.1935: Flags [.], seq 204453:205767, ack 0, win 501, options [nop,nop,TS val 1216919810 ecr 3381881789], length 1314
07:33:55.708158 IP 10.8.0.2.44144 > 52.223.224.181.1935: Flags [.], seq 205767:207081, ack 0, win 501, options [nop,nop,TS val 1216919874 ecr 3381881789], length 1314
07:33:55.729361 IP 10.8.0.2.44144 > 52.223.224.181.1935: Flags [.], seq 207081:208395, ack 0, win 501, options [nop,nop,TS val 1216919895 ecr 3381881789], length 1314
07:33:55.752011 IP 52.223.224.181.1935 > 10.8.0.2.44144: Flags [.], ack 199711, win 134, options [nop,nop,TS val 3381881955 ecr 1216919575], length 0
07:33:55.771789 IP 10.8.0.2.44144 > 52.223.224.181.1935: Flags [.], seq 208395:209709, ack 0, win 501, options [nop,nop,TS val 1216919938 ecr 3381881955], length 1314
07:33:55.835770 IP 10.8.0.2.44144 > 52.223.224.181.1935: Flags [.], seq 209709:211023, ack 0, win 501, options [nop,nop,TS val 1216920002 ecr 3381881955], length 1314
07:33:55.838767 IP 52.223.224.181.1935 > 10.8.0.2.44144: Flags [.], ack 201825, win 134, options [nop,nop,TS val 3381882041 ecr 1216919663], length 0
07:33:55.838804 IP 10.8.0.2.44144 > 52.223.224.181.1935: Flags [P.], seq 211023:211713, ack 0, win 501, options [nop,nop,TS val 1216920005 ecr 3381882041], length 690
07:33:55.899965 IP 10.8.0.2.44144 > 52.223.224.181.1935: Flags [.], seq 211713:213027, ack 0, win 501, options [nop,nop,TS val 1216920066 ecr 3381882041], length 1314
07:33:55.922978 IP 52.223.224.181.1935 > 10.8.0.2.44144: Flags [.], ack 204453, win 134, options [nop,nop,TS val 3381882126 ecr 1216919726], length 0
07:33:55.942336 IP 10.8.0.2.44144 > 52.223.224.181.1935: Flags [.], seq 213027:214341, ack 0, win 501, options [nop,nop,TS val 1216920108 ecr 3381882126], length 1314
07:33:55.963527 IP 10.8.0.2.44144 > 52.223.224.181.1935: Flags [.], seq 214341:215655, ack 0, win 501, options [nop,nop,TS val 1216920129 ecr 3381882126], length 1314
07:33:56.030065 IP 52.223.224.181.1935 > 10.8.0.2.44144: Flags [.], ack 207081, win 134, options [nop,nop,TS val 3381882233 ecr 1216919810], length 0
07:33:56.030704 IP 10.8.0.2.44144 > 52.223.224.181.1935: Flags [.], seq 215655:216969, ack 0, win 501, options [nop,nop,TS val 1216920197 ecr 3381882233], length 1314
