14:36:11.665167 IP 10.8.0.2.47626 > 185.42.206.120.1935: Flags [.], seq 1052991180:1052992494, ack 2156002917, win 501, options [nop,nop,TS val 1006984697 ecr 4079723085], length 1314
14:36:11.682669 IP 185.42.206.120.1935 > 10.8.0.2.47626: Flags [.], ack 4294961071, win 126, options [nop,nop,TS val 4079723162 ecr 1006984397], length 0
14:36:11.699821 IP 10.8.0.2.47626 > 185.42.206.120.1935: Flags [.], seq 1314:2628, ack 1, win 501, options [nop,nop,TS val 1006984732 ecr 4079723162], length 1314
14:36:11.728609 IP 10.8.0.2.47626 > 185.42.206.120.1935: Flags [.], seq 2628:3942, ack 1, win 501, options [nop,nop,TS val 1006984761 ecr 4079723162], length 1314
14:36:11.781031 IP 185.42.206.120.1935 > 10.8.0.2.47626: Flags [.], ack 4294963699, win 126, options [nop,nop,TS val 4079723260 ecr 1006984475], length 0
14:36:11.799685 IP 10.8.0.2.47626 > 185.42.206.120.1935: Flags [.], seq 3942:5256, ack 1, win 501, options [nop,nop,TS val 1006984832 ecr 4079723260], length 1314
14:36:11.831495 IP 10.8.0.2.47626 > 185.42.206.120.1935: Flags [.], seq 5256:6570, ack 1, win 501, options [nop,nop,TS val 1006984864 ecr 4079723260], length 1314
14:36:11.855657 IP 185.42.206.120.1935 > 10.8.0.2.47626: Flags [.], ack 4294966327, win 126, options [nop,nop,TS val 4079723334 ecr 1006984563], length 0
14:36:11.864920 IP 10.8.0.2.47626 > 185.42.206.120.1935: Flags [.], seq 6570:7884, ack 1, win 501, options [nop,nop,TS val 1006984897 ecr 4079723334], length 1314
14:36:11.889851 IP 185.42.206.120.1935 > 10.8.0.2.47626: Flags [.], ack 0, win 126, options [nop,nop,TS val 4079723369 ecr 1006984639], length 0
14:36:11.889882 IP 10.8.0.2.47626 > 185.42.206.120.1935: Flags [P.], seq 7884:8015, ack 1, win 501, options [nop,nop,TS val 1006984922 ecr 4079723369], length 131
14:36:11.932044 IP 10.8.0.2.47626 > 185.42.206.120.1935: Flags [.], seq 8015:9329, ack 1, win 501, options [nop,nop,TS val 1006984964 ecr 4079723369], length 1314
14:36:11.965213 IP 10.8.0.2.47626 > 185.42.206.120.1935: Flags [.], seq 9329:10643, ack 1, win 501, options [nop,nop,TS val 1006984998 ecr 4079723369], length 1314
14:36:11.983488 IP 185.42.206.120.1935 > 10.8.0.2.47626: Flags [.], ack 2628, win 126, options [nop,nop,TS val 4079723463 ecr 1006984697], length 0
14:36:11.998552 IP 10.8.0.2.47626 > 185.42.206.120.1935: Flags [.], seq 10643:11957, ack 1, win 501, options [nop,nop,TS val 1006985031 ecr 4079723463], length 1314
14:36:12.066107 IP 10.8.0.2.47626 > 185.42.206.120.1935: Flags [.], seq 11957:13271, ack 1, win 501, options [nop,nop,TS val 1006985098 ecr 4079723463], length 1314
14:36:12.081248 IP 185.42.206.120.1935 > 10.8.0.2.47626: Flags [.], ack 3942, win 126, options [nop,nop,TS val 4079723561 ecr 1006984761], length 0
14:36:12.099309 IP 10.8.0.2.47626 > 185.42.206.120.1935: Flags [.], seq 13271:14585, ack 1, win 501, options [nop,nop,TS val 1006985132 ecr 4079723561], length 1314
14:36:12.115249 IP 185.42.206.120.1935 > 10.8.0.2.47626: Flags [.], ack 6570, win 126, options [nop,nop,TS val 4079723594 ecr 1006984832], length 0
14:36:12.133197 IP 10.8.0.2.47626 > 185.42.206.120.1935: Flags [.], seq 14585:15899, ack 1, win 501, options [nop,nop,TS val 1006985165 ecr 4079723594], length 1314
14:36:12.173159 IP 185.42.206.120.1935 > 10.8.0.2.47626: Flags [.], ack 8015, win 126, options [nop,nop,TS val 4079723652 ecr 1006984897], length 0
14:36:12.173170 IP 10.8.0.2.47626 > 185.42.206.120.1935: Flags [P.], seq 15899:16975, ack 1, win 501, options [nop,nop,TS val 1006985205 ecr 4079723652], length 1076
14:36:12.233420 IP 10.8.0.2.47626 > 185.42.206.120.1935: Flags [.], seq 16975:18289, ack 1, win 501, options [nop,nop,TS val 1006985266 ecr 4079723652], length 1314
14:36:12.249505 IP 185.42.206.120.1935 > 10.8.0.2.47626: Flags [.], ack 10643, win 126, options [nop,nop,TS val 4079723729 ecr 1006984964], length 0
14:36:12.263159 IP 10.8.0.2.47626 > 185.42.206.120.1935: Flags [.], seq 18289:19603, ack 1, win 501, options [nop,nop,TS val 1006985295 ecr 4079723729], length 1314
14:36:12.297960 IP 10.8.0.2.47626 > 185.42.206.120.1935: Flags [.], seq 19603:20917, ack 1, win 501, options [nop,nop,TS val 1006985330 ecr 4079723729], length 1314
14:36:12.349731 IP 185.42.206.120.1935 > 10.8.0.2.47626: Flags [.], ack 13271, win 126, options [nop,nop,TS val 4079723829 ecr 1006985031], length 0
14:36:12.364143 IP 10.8.0.2.47626 > 185.42.206.120.1935: Flags [.], seq 20917:22231, ack 1, win 501, options [nop,nop,TS val 1006985396 ecr 4079723829], length 1314
14:36:12.395143 IP 10.8.0.2.47626 > 185.42.206.120.1935: Flags [.], seq 22231:23545, ack 1, win 501, options [nop,nop,TS val 1006985427 ecr 4079723829], length 1314
14:36:12.416818 IP 185.42.206.120.1935 > 10.8.0.2.47626: Flags [.], ack 15899, win 126, options [nop,nop,TS val 4079723896 ecr 1006985132], length 0
14:36:12.428892 IP 10.8.0.2.47626 > 185.42.206.120.1935: Flags [.], seq 23545:24859, ack 1, win 501, options [nop,nop,TS val 1006985461 ecr 4079723896], length 1314
14:36:12.456638 IP 185.42.206.120.1935 > 10.8.0.2.47626: Flags [.], ack 16975, win 126, options [nop,nop,TS val 4079723936 ecr 1006985205], length 0
14:36:12.456667 IP 10.8.0.2.47626 > 185.42.206.120.1935: Flags [P.], seq 24859:24978, ack 1, win 501, options [nop,nop,TS val 1006985489 ecr 4079723936], length 119
14:36:12.500307 IP 10.8.0.2.47626 > 185.42.206.120.1935: Flags [.], seq 24978:26292, ack 1, win 501, options [nop,nop,TS val 1006985533 ecr 4079723936], length 1314
14:36:12.533904 IP 10.8.0.2.47626 > 185.42.206.120.1935: Flags [.], seq 26292:27606, ack 1, win 501, options [nop,nop,TS val 1006985566 ecr 4079723936], length 1314
14:36:12.546678 IP 185.42.206.120.1935 > 10.8.0.2.47626: Flags [.], ack 19603, win 126, options [nop,nop,TS val 4079724026 ecr 1006985266], length 0
14:36:12.574419 IP 10.8.0.2.47626 > 185.42.206.120.1935: Flags [.], seq 27606:28920, ack 1, win 501, options [nop,nop,TS val 1006985607 ecr 4079724026], length 1314
14:36:12.628687 IP 10.8.0.2.47626 > 185.42.206.120.1935: Flags [.], seq 28920:30234, ack 1, win 501, options [nop,nop,TS val 1006985661 ecr 4079724026], length 1314
14:36:12.647704 IP 185.42.206.120.1935 > 10.8.0.2.47626: Flags [.], ack 22231, win 126, options [nop,nop,TS val 4079724127 ecr 1006985330], length 0
14:36:12.661970 IP 10.8.0.2.47626 > 185.42.206.120.1935: Flags [.], seq 30234:31548, ack 1, win 501, options [nop,nop,TS val 1006985694 ecr 4079724127], length 1314
14:36:12.701886 IP 10.8.0.2.47626 > 185.42.206.120.1935: Flags [.], seq 31548:32862, ack 1, win 501, options [nop,nop,TS val 1006985734 ecr 4079724127], length 1314
14:36:12.712481 IP 185.42.206.120.1935 > 10.8.0.2.47626: Flags [.], ack 24859, win 126, options [nop,nop,TS val 4079724192 ecr 1006985427], length 0
14:36:12.740064 IP 185.42.206.120.1935 > 10.8.0.2.47626: Flags [.], ack 24978, win 126, options [nop,nop,TS val 4079724219 ecr 1006985489], length 0
14:36:12.740096 IP 10.8.0.2.47626 > 185.42.206.120.1935: Flags [P.], seq 32862:33840, ack 1, win 501, options [nop,nop,TS val 1006985772 ecr 4079724219], length 978
14:36:12.795773 IP 10.8.0.2.47626 > 185.42.206.120.1935: Flags [.], seq 33840:35154, ack 1, win 501, options [nop,nop,TS val 1006985828 ecr 4079724219], length 1314
14:36:12.817429 IP 185.42.206.120.1935 > 10.8.0.2.47626: Flags [.], ack 27606, win 126, options [nop,nop,TS val 4079724297 ecr 1006985533], length 0
14:36:12.829958 IP 10.8.0.2.47626 > 185.42.206.120.1935: Flags [.], seq 35154:36468, ack 1, win 501, options [nop,nop,TS val 1006985862 ecr 4079724297], length 1314
14:36:12.866151 IP 10.8.0.2.47626 > 185.42.206.120.1935: Flags [.], seq 36468:37782, ack 1, win 501, options [nop,nop,TS val 1006985898 ecr 4079724297], length 1314
14:36:12.912161 IP 185.42.206.120.1935 > 10.8.0.2.47626: Flags [.], ack 30234, win 126, options [nop,nop,TS val 4079724391 ecr 1006985607], length 0
14:36:12.933477 IP 10.8.0.2.47626 > 185.42.206.120.1935: Flags [.], seq 37782:39096, ack 1, win 501, options [nop,nop,TS val 1006985966 ecr 4079724391], length 1314
14:36:12.965200 IP 10.8.0.2.47626 > 185.42.206.120.1935: Flags [.], seq 39096:40410, ack 1, win 501, options [nop,nop,TS val 1006985998 ecr 4079724391], length 1314
14:36:12.985737 IP 185.42.206.120.1935 > 10.8.0.2.47626: Flags [.], ack 32862, win 126, options [nop,nop,TS val 4079724465 ecr 1006985694], length 0
14:36:12.998217 IP 10.8.0.2.47626 > 185.42.206.120.1935: Flags [.], seq 40410:41724, ack 1, win 501, options [nop,nop,TS val 1006986031 ecr 4079724465], length 1314
14:36:13.023460 IP 185.42.206.120.1935 > 10.8.0.2.47626: Flags [.], ack 33840, win 126, options [nop,nop,TS val 4079724503 ecr 1006985772], length 0
14:36:13.023488 IP 10.8.0.2.47626 > 185.42.206.120.1935: Flags [P.], seq 41724:41953, ack 1, win 501, options [nop,nop,TS val 1006986056 ecr 4079724503], length 229
14:36:13.064853 IP 10.8.0.2.47626 > 185.42.206.120.1935: Flags [.], seq 41953:43267, ack 1, win 501, options [nop,nop,TS val 1006986097 ecr 4079724503], length 1314
14:36:13.096085 IP 10.8.0.2.47626 > 185.42.206.120.1935: Flags [.], seq 43267:44581, ack 1, win 501, options [nop,nop,TS val 1006986128 ecr 4079724503], length 1314
14:36:13.113470 IP 185.42.206.120.1935 > 10.8.0.2.47626: Flags [.], ack 36468, win 126, options [nop,nop,TS val 4079724593 ecr 1006985828], length 0
14:36:13.150389 IP 10.8.0.2.47626 > 185.42.206.120.1935: Flags [.], seq 44581:45895, ack 1, win 501, options [nop,nop,TS val 1006986183 ecr 4079724593], length 1314
14:36:13.199823 IP 10.8.0.2.47626 > 185.42.206.120.1935: Flags [.], seq 45895:47209, ack 1, win 501, options [nop,nop,TS val 1006986232 ecr 4079724593], length 1314
14:36:13.217042 IP 185.42.206.120.1935 > 10.8.0.2.47626: Flags [.], ack 39096, win 126, options [nop,nop,TS val 4079724696 ecr 1006985898], length 0
14:36:13.230072 IP 10.8.0.2.47626 > 185.42.206.120.1935: Flags [.], seq 47209:48523, ack 1, win 501, options [nop,nop,TS val 1006986262 ecr 4079724696], length 1314
14:36:13.278477 IP 10.8.0.2.47626 > 185.42.206.120.1935: Flags [.], seq 48523:49837, ack 1, win 501, options [nop,nop,TS val 1006986311 ecr 4079724696], length 1314
14:36:13.284226 IP 185.42.206.120.1935 > 10.8.0.2.47626: Flags [.], ack 41724, win 126, options [nop,nop,TS val 4079724763 ecr 1006985998], length 0
14:36:13.307247 IP 185.42.206.120.1935 > 10.8.0.2.47626: Flags [.], ack 41953, win 126, options [nop,nop,TS val 4079724786 ecr 1006986056], length 0
14:36:13.307294 IP 10.8.0.2.47626 > 185.42.206.120.1935: Flags [P.], seq 49837:50802, ack 1, win 501, options [nop,nop,TS val 1006986340 ecr 4079724786], length 965
14:36:13.363454 IP 10.8.0.2.47626 > 185.42.206.120.1935: Flags [.], seq 50802:52116, ack 1, win 501, options [nop,nop,TS val 1006986396 ecr 4079724786], length 1314
14:36:13.379580 IP 185.42.206.120.1935 > 10.8.0.2.47626: Flags [.], ack 44581, win 126, options [nop,nop,TS val 4079724859 ecr 1006986097], length 0
14:36:13.397209 IP 10.8.0.2.47626 > 185.42.206.120.1935: Flags [.], seq 52116:53430, ack 1, win 501, options [nop,nop,TS val 1006986430 ecr 4079724859], length 1314
14:36:13.433348 IP 10.8.0.2.47626 > 185.42.206.120.1935: Flags [.], seq 53430:54744, ack 1, win 501, options [nop,nop,TS val 1006986466 ecr 4079724859], length 1314
14:36:13.483833 IP 185.42.206.120.1935 > 10.8.0.2.47626: Flags [.], ack 47209, win 126, options [nop,nop,TS val 4079724963 ecr 1006986183], length 0
14:36:13.497347 IP 10.8.0.2.47626 > 185.42.206.120.1935: Flags [.], seq 54744:56058, ack 1, win 501, options [nop,nop,TS val 1006986530 ecr 4079724963], length 1314
14:36:13.530945 IP 10.8.0.2.47626 > 185.42.206.120.1935: Flags [.], seq 56058:57372, ack 1, win 501, options [nop,nop,TS val 1006986563 ecr 4079724963], length 1314
14:36:13.562063 IP 185.42.206.120.1935 > 10.8.0.2.47626: Flags [.], ack 49837, win 126, options [nop,nop,TS val 4079725041 ecr 1006986262], length 0
14:36:13.565237 IP 10.8.0.2.47626 > 185.42.206.120.1935: Flags [.], seq 57372:58686, ack 1, win 501, options [nop,nop,TS val 1006986598 ecr 4079725041], length 1314
14:36:13.591043 IP 185.42.206.120.1935 > 10.8.0.2.47626: Flags [.], ack 50802, win 126, options [nop,nop,TS val 4079725070 ecr 1006986340], length 0
14:36:13.591076 IP 10.8.0.2.47626 > 185.42.206.120.1935: Flags [P.], seq 58686:58820, ack 1, win 501, options [nop,nop,TS val 1006986623 ecr 4079725070], length 134
14:36:13.631865 IP 10.8.0.2.47626 > 185.42.206.120.1935: Flags [.], seq 58820:60134, ack 1, win 501, options [nop,nop,TS val 1006986664 ecr 4079725070], length 1314
14:36:13.666067 IP 10.8.0.2.47626 > 185.42.206.120.1935: Flags [.], seq 60134:61448, ack 1, win 501, options [nop,nop,TS val 1006986698 ecr 4079725070], length 1314
14:36:13.680836 IP 185.42.206.120.1935 > 10.8.0.2.47626: Flags [.], ack 53430, win 126, options [nop,nop,TS val 4079725160 ecr 1006986396], length 0
14:36:13.705943 IP 10.8.0.2.47626 > 185.42.206.120.1935: Flags [.], seq 61448:62762, ack 1, win 501, options [nop,nop,TS val 1006986738 ecr 4079725160], length 1314
14:36:13.762920 IP 10.8.0.2.47626 > 185.42.206.120.1935: Flags [.], seq 62762:64076, ack 1, win 501, options [nop,nop,TS val 1006986795 ecr 4079725160], length 1314
14:36:13.780774 IP 185.42.206.120.1935 > 10.8.0.2.47626: Flags [.], ack 56058, win 126, options [nop,nop,TS val 4079725260 ecr 1006986466], length 0
14:36:13.796668 IP 10.8.0.2.47626 > 185.42.206.120.1935: Flags [.], seq 64076:65390, ack 1, win 501, options [nop,nop,TS val 1006986829 ecr 4079725260], length 1314
14:36:13.834118 IP 10.8.0.2.47626 > 185.42.206.120.1935: Flags [.], seq 65390:66704, ack 1, win 501, options [nop,nop,TS val 1006986866 ecr 4079725260], length 1314
14:36:13.848667 IP 185.42.206.120.1935 > 10.8.0.2.47626: Flags [.], ack 58686, win 126, options [nop,nop,TS val 4079725328 ecr 1006986563], length 0
14:36:13.874504 IP 185.42.206.120.1935 > 10.8.0.2.47626: Flags [.], ack 58820, win 126, options [nop,nop,TS val 4079725354 ecr 1006986623], length 0
14:36:13.874544 IP 10.8.0.2.47626 > 185.42.206.120.1935: Flags [P.], seq 66704:67682, ack 1, win 501, options [nop,nop,TS val 1006986907 ecr 4079725354], length 978
14:36:13.932623 IP 10.8.0.2.47626 > 185.42.206.120.1935: Flags [.], seq 67682:68996, ack 1, win 501, options [nop,nop,TS val 1006986965 ecr 4079725354], length 1314
14:36:13.949690 IP 185.42.206.120.1935 > 10.8.0.2.47626: Flags [.], ack 61448, win 126, options [nop,nop,TS val 4079725429 ecr 1006986664], length 0
14:36:13.964008 IP 10.8.0.2.47626 > 185.42.206.120.1935: Flags [.], seq 68996:70310, ack 1, win 501, options [nop,nop,TS val 1006986996 ecr 4079725429], length 1314
14:36:13.995132 IP 10.8.0.2.47626 > 185.42.206.120.1935: Flags [.], seq 70310:71624, ack 1, win 501, options [nop,nop,TS val 1006987027 ecr 4079725429], length 1314
14:36:14.046700 IP 185.42.206.120.1935 > 10.8.0.2.47626: Flags [.], ack 64076, win 126, options [nop,nop,TS val 4079725526 ecr 1006986738], length 0
14:36:14.066019 IP 10.8.0.2.47626 > 185.42.206.120.1935: Flags [.], seq 71624:72938, ack 1, win 501, options [nop,nop,TS val 1006987098 ecr 4079725526], length 1314
14:36:14.099515 IP 10.8.0.2.47626 > 185.42.206.120.1935: Flags [.], seq 72938:74252, ack 1, win 501, options [nop,nop,TS val 1006987132 ecr 4079725526], length 1314
14:36:14.117737 IP 185.42.206.120.1935 > 10.8.0.2.47626: Flags [.], ack 66704, win 126, options [nop,nop,TS val 4079725597 ecr 1006986829], length 0
14:36:14.133721 IP 10.8.0.2.47626 > 185.42.206.120.1935: Flags [.], seq 74252:75566, ack 1, win 501, options [nop,nop,TS val 1006987166 ecr 4079725597], length 1314
14:36:14.158133 IP 185.42.206.120.1935 > 10.8.0.2.47626: Flags [.], ack 67682, win 126, options [nop,nop,TS val 4079725637 ecr 1006986907], length 0
14:36:14.158169 IP 10.8.0.2.47626 > 185.42.206.120.1935: Flags [P.], seq 75566:75779, ack 1, win 501, options [nop,nop,TS val 1006987190 ecr 4079725637], length 213
14:36:14.197769 IP 10.8.0.2.47626 > 185.42.206.120.1935: Flags [.], seq 75779:77093, ack 1, win 501, options [nop,nop,TS val 1006987230 ecr 4079725637], length 1314
14:36:14.231858 IP 10.8.0.2.47626 > 185.42.206.120.1935: Flags [.], seq 77093:78407, ack 1, win 501, options [nop,nop,TS val 1006987264 ecr 4079725637], length 1314
14:36:14.247577 IP 185.42.206.120.1935 > 10.8.0.2.47626: Flags [.], ack 70310, win 126, options [nop,nop,TS val 4079725727 ecr 1006986965], length 0
14:36:14.283430 IP 10.8.0.2.47626 > 185.42.206.120.1935: Flags [.], seq 78407:79721, ack 1, win 501, options [nop,nop,TS val 1006987316 ecr 4079725727], length 1314
14:36:14.331980 IP 10.8.0.2.47626 > 185.42.206.120.1935: Flags [.], seq 79721:81035, ack 1, win 501, options [nop,nop,TS val 1006987364 ecr 4079725727], length 1314
14:36:14.349106 IP 185.42.206.120.1935 > 10.8.0.2.47626: Flags [.], ack 71624, win 126, options [nop,nop,TS val 4079725829 ecr 1006987027], length 0
14:36:14.369346 IP 10.8.0.2.47626 > 185.42.206.120.1935: Flags [.], seq 81035:82349, ack 1, win 501, options [nop,nop,TS val 1006987402 ecr 4079725829], length 1314
14:36:14.383299 IP 185.42.206.120.1935 > 10.8.0.2.47626: Flags [.], ack 74252, win 126, options [nop,nop,TS val 4079725863 ecr 1006987098], length 0
14:36:14.412237 IP 10.8.0.2.47626 > 185.42.206.120.1935: Flags [.], seq 82349:83663, ack 1, win 501, options [nop,nop,TS val 1006987445 ecr 4079725863], length 1314
14:36:14.441547 IP 185.42.206.120.1935 > 10.8.0.2.47626: Flags [.], ack 75779, win 126, options [nop,nop,TS val 4079725921 ecr 1006987166], length 0
14:36:14.441585 IP 10.8.0.2.47626 > 185.42.206.120.1935: Flags [P.], seq 83663:84645, ack 1, win 501, options [nop,nop,TS val 1006987474 ecr 4079725921], length 982
14:36:14.499423 IP 10.8.0.2.47626 > 185.42.206.120.1935: Flags [.], seq 84645:85959, ack 1, win 501, options [nop,nop,TS val 1006987532 ecr 4079725921], length 1314
14:36:14.515518 IP 185.42.206.120.1935 > 10.8.0.2.47626: Flags [.], ack 78407, win 126, options [nop,nop,TS val 4079725995 ecr 1006987230], length 0
14:36:14.532761 IP 10.8.0.2.47626 > 185.42.206.120.1935: Flags [.], seq 85959:87273, ack 1, win 501, options [nop,nop,TS val 1006987565 ecr 4079725995], length 1314
14:36:14.563476 IP 10.8.0.2.47626 > 185.42.206.120.1935: Flags [.], seq 87273:88587, ack 1, win 501, options [nop,nop,TS val 1006987596 ecr 4079725995], length 1314
14:36:14.615592 IP 185.42.206.120.1935 > 10.8.0.2.47626: Flags [.], ack 81035, win 126, options [nop,nop,TS val 4079726095 ecr 1006987316], length 0
14:36:14.629899 IP 10.8.0.2.47626 > 185.42.206.120.1935: Flags [.], seq 88587:89901, ack 1, win 501, options [nop,nop,TS val 1006987662 ecr 4079726095], length 1314
14:36:14.669126 IP 10.8.0.2.47626 > 185.42.206.120.1935: Flags [.], seq 89901:91215, ack 1, win 501, options [nop,nop,TS val 1006987701 ecr 4079726095], length 1314
14:36:14.695925 IP 185.42.206.120.1935 > 10.8.0.2.47626: Flags [.], ack 83663, win 126, options [nop,nop,TS val 4079726175 ecr 1006987402], length 0
14:36:14.699560 IP 10.8.0.2.47626 > 185.42.206.120.1935: Flags [.], seq 91215:92529, ack 1, win 501, options [nop,nop,TS val 1006987732 ecr 4079726175], length 1314
14:36:14.725097 IP 185.42.206.120.1935 > 10.8.0.2.47626: Flags [.], ack 84645, win 126, options [nop,nop,TS val 4079726204 ecr 1006987474], length 0
14:36:14.725130 IP 10.8.0.2.47626 > 185.42.206.120.1935: Flags [P.], seq 92529:92659, ack 1, win 501, options [nop,nop,TS val 1006987757 ecr 4079726204], length 130
14:36:14.766154 IP 10.8.0.2.47626 > 185.42.206.120.1935: Flags [.], seq 92659:93973, ack 1, win 501, options [nop,nop,TS val 1006987798 ecr 4079726204], length 1314
14:36:14.797679 IP 10.8.0.2.47626 > 185.42.206.120.1935: Flags [.], seq 93973:95287, ack 1, win 501, options [nop,nop,TS val 1006987830 ecr 4079726204], length 1314
14:36:14.816472 IP 185.42.206.120.1935 > 10.8.0.2.47626: Flags [.], ack 87273, win 126, options [nop,nop,TS val 4079726296 ecr 1006987532], length 0
14:36:14.840515 IP 10.8.0.2.47626 > 185.42.206.120.1935: Flags [.], seq 95287:96601, ack 1, win 501, options [nop,nop,TS val 1006987873 ecr 4079726296], length 1314
14:36:14.905083 IP 10.8.0.2.47626 > 185.42.206.120.1935: Flags [.], seq 96601:97915, ack 1, win 501, options [nop,nop,TS val 1006987937 ecr 4079726296], length 1314
14:36:14.913285 IP 185.42.206.120.1935 > 10.8.0.2.47626: Flags [.], ack 89901, win 126, options [nop,nop,TS val 4079726393 ecr 1006987596], length 0
14:36:14.932527 IP 10.8.0.2.47626 > 185.42.206.120.1935: Flags [.], seq 97915:99229, ack 1, win 501, options [nop,nop,TS val 1006987965 ecr 4079726393], length 1314
14:36:14.969282 IP 10.8.0.2.47626 > 185.42.206.120.1935: Flags [.], seq 99229:100543, ack 1, win 501, options [nop,nop,TS val 1006988002 ecr 4079726393], length 1314
14:36:14.983152 IP 185.42.206.120.1935 > 10.8.0.2.47626: Flags [.], ack 92529, win 126, options [nop,nop,TS val 4079726463 ecr 1006987701], length 0
14:36:15.008482 IP 185.42.206.120.1935 > 10.8.0.2.47626: Flags [.], ack 92659, win 126, options [nop,nop,TS val 4079726488 ecr 1006987757], length 0
14:36:15.008498 IP 10.8.0.2.47626 > 185.42.206.120.1935: Flags [P.], seq 100543:101512, ack 1, win 501, options [nop,nop,TS val 1006988041 ecr 4079726488], length 969
14:36:15.065865 IP 10.8.0.2.47626 > 185.42.206.120.1935: Flags [.], seq 101512:102826, ack 1, win 501, options [nop,nop,TS val 1006988098 ecr 4079726488], length 1314
14:36:15.081116 IP 185.42.206.120.1935 > 10.8.0.2.47626: Flags [.], ack 95287, win 126, options [nop,nop,TS val 4079726560 ecr 1006987798], length 0
14:36:15.099339 IP 10.8.0.2.47626 > 185.42.206.120.1935: Flags [.], seq 102826:104140, ack 1, win 501, options [nop,nop,TS val 1006988132 ecr 4079726560], length 1314
14:36:15.132620 IP 10.8.0.2.47626 > 185.42.206.120.1935: Flags [.], seq 104140:105454, ack 1, win 501, options [nop,nop,TS val 1006988165 ecr 4079726560], length 1314
14:36:15.188726 IP 185.42.206.120.1935 > 10.8.0.2.47626: Flags [.], ack 97915, win 126, options [nop,nop,TS val 4079726668 ecr 1006987873], length 0
14:36:15.204796 IP 10.8.0.2.47626 > 185.42.206.120.1935: Flags [.], seq 105454:106768, ack 1, win 501, options [nop,nop,TS val 1006988237 ecr 4079726668], length 1314
14:36:15.231281 IP 10.8.0.2.47626 > 185.42.206.120.1935: Flags [.], seq 106768:108082, ack 1, win 501, options [nop,nop,TS val 1006988264 ecr 4079726668], length 1314
14:36:15.252859 IP 185.42.206.120.1935 > 10.8.0.2.47626: Flags [.], ack 100543, win 126, options [nop,nop,TS val 4079726732 ecr 1006987965], length 0
14:36:15.268924 IP 10.8.0.2.47626 > 185.42.206.120.1935: Flags [.], seq 108082:109396, ack 1, win 501, options [nop,nop,TS val 1006988301 ecr 4079726732], length 1314
14:36:15.291858 IP 185.42.206.120.1935 > 10.8.0.2.47626: Flags [.], ack 101512, win 126, options [nop,nop,TS val 4079726771 ecr 1006988041], length 0
14:36:15.291889 IP 10.8.0.2.47626 > 185.42.206.120.1935: Flags [P.], seq 109396:109626, ack 1, win 501, options [nop,nop,TS val 1006988324 ecr 4079726771], length 230
14:36:15.333228 IP 10.8.0.2.47626 > 185.42.206.120.1935: Flags [.], seq 109626:110940, ack 1, win 501, options [nop,nop,TS val 1006988366 ecr 4079726771], length 1314
14:36:15.365405 IP 10.8.0.2.47626 > 185.42.206.120.1935: Flags [.], seq 110940:112254, ack 1, win 501, options [nop,nop,TS val 1006988398 ecr 4079726771], length 1314
14:36:15.382722 IP 185.42.206.120.1935 > 10.8.0.2.47626: Flags [.], ack 104140, win 126, options [nop,nop,TS val 4079726862 ecr 1006988098], length 0
14:36:15.418951 IP 10.8.0.2.47626 > 185.42.206.120.1935: Flags [.], seq 112254:113568, ack 1, win 501, options [nop,nop,TS val 1006988451 ecr 4079726862], length 1314
14:36:15.464582 IP 10.8.0.2.47626 > 185.42.206.120.1935: Flags [.], seq 113568:114882, ack 1, win 501, options [nop,nop,TS val 1006988497 ecr 4079726862], length 1314
14:36:15.488334 IP 185.42.206.120.1935 > 10.8.0.2.47626: Flags [.], ack 106768, win 126, options [nop,nop,TS val 4079726968 ecr 1006988165], length 0
14:36:15.504815 IP 10.8.0.2.47626 > 185.42.206.120.1935: Flags [.], seq 114882:116196, ack 1, win 501, options [nop,nop,TS val 1006988537 ecr 4079726968], length 1314
14:36:15.547718 IP 10.8.0.2.47626 > 185.42.206.120.1935: Flags [.], seq 116196:117510, ack 1, win 501, options [nop,nop,TS val 1006988580 ecr 4079726968], length 1314
14:36:15.552483 IP 185.42.206.120.1935 > 10.8.0.2.47626: Flags [.], ack 109396, win 126, options [nop,nop,TS val 4079727032 ecr 1006988264], length 0
14:36:15.575351 IP 185.42.206.120.1935 > 10.8.0.2.47626: Flags [.], ack 109626, win 126, options [nop,nop,TS val 4079727055 ecr 1006988324], length 0
14:36:15.575396 IP 10.8.0.2.47626 > 185.42.206.120.1935: Flags [P.], seq 117510:118479, ack 1, win 501, options [nop,nop,TS val 1006988608 ecr 4079727055], length 969
14:36:15.633537 IP 10.8.0.2.47626 > 185.42.206.120.1935: Flags [.], seq 118479:119793, ack 1, win 501, options [nop,nop,TS val 1006988666 ecr 4079727055], length 1314
14:36:15.649088 IP 185.42.206.120.1935 > 10.8.0.2.47626: Flags [.], ack 112254, win 126, options [nop,nop,TS val 4079727128 ecr 1006988366], length 0
14:36:15.664024 IP 10.8.0.2.47626 > 185.42.206.120.1935: Flags [.], seq 119793:121107, ack 1, win 501, options [nop,nop,TS val 1006988696 ecr 4079727128], length 1314
14:36:15.697544 IP 10.8.0.2.47626 > 185.42.206.120.1935: Flags [.], seq 121107:122421, ack 1, win 501, options [nop,nop,TS val 1006988730 ecr 4079727128], length 1314
14:36:15.748112 IP 185.42.206.120.1935 > 10.8.0.2.47626: Flags [.], ack 114882, win 126, options [nop,nop,TS val 4079727227 ecr 1006988451], length 0
14:36:15.765028 IP 10.8.0.2.47626 > 185.42.206.120.1935: Flags [.], seq 122421:123735, ack 1, win 501, options [nop,nop,TS val 1006988797 ecr 4079727227], length 1314
14:36:15.804783 IP 10.8.0.2.47626 > 185.42.206.120.1935: Flags [.], seq 123735:125049, ack 1, win 501, options [nop,nop,TS val 1006988837 ecr 4079727227], length 1314
14:36:15.831458 IP 185.42.206.120.1935 > 10.8.0.2.47626: Flags [.], ack 117510, win 126, options [nop,nop,TS val 4079727311 ecr 1006988537], length 0
14:36:15.832667 IP 10.8.0.2.47626 > 185.42.206.120.1935: Flags [.], seq 125049:126363, ack 1, win 501, options [nop,nop,TS val 1006988865 ecr 4079727311], length 1314
14:36:15.858872 IP 185.42.206.120.1935 > 10.8.0.2.47626: Flags [.], ack 118479, win 126, options [nop,nop,TS val 4079727338 ecr 1006988608], length 0
14:36:15.858911 IP 10.8.0.2.47626 > 185.42.206.120.1935: Flags [P.], seq 126363:126490, ack 1, win 501, options [nop,nop,TS val 1006988891 ecr 4079727338], length 127
14:36:15.899305 IP 10.8.0.2.47626 > 185.42.206.120.1935: Flags [.], seq 126490:127804, ack 1, win 501, options [nop,nop,TS val 1006988932 ecr 4079727338], length 1314
14:36:15.933676 IP 10.8.0.2.47626 > 185.42.206.120.1935: Flags [.], seq 127804:129118, ack 1, win 501, options [nop,nop,TS val 1006988966 ecr 4079727338], length 1314
14:36:15.947519 IP 185.42.206.120.1935 > 10.8.0.2.47626: Flags [.], ack 121107, win 126, options [nop,nop,TS val 4079727427 ecr 1006988666], length 0
14:36:15.976109 IP 10.8.0.2.47626 > 185.42.206.120.1935: Flags [.], seq 129118:130432, ack 1, win 501, options [nop,nop,TS val 1006989008 ecr 4079727427], length 1314
14:36:16.039739 IP 10.8.0.2.47626 > 185.42.206.120.1935: Flags [.], seq 130432:131746, ack 1, win 501, options [nop,nop,TS val 1006989072 ecr 4079727427], length 1314
14:36:16.048646 IP 185.42.206.120.1935 > 10.8.0.2.47626: Flags [.], ack 123735, win 126, options [nop,nop,TS val 4079727528 ecr 1006988730], length 0
14:36:16.064550 IP 10.8.0.2.47626 > 185.42.206.120.1935: Flags [.], seq 131746:133060, ack 1, win 501, options [nop,nop,TS val 1006989097 ecr 4079727528], length 1314
14:36:16.104064 IP 10.8.0.2.47626 > 185.42.206.120.1935: Flags [.], seq 133060:134374, ack 1, win 501, options [nop,nop,TS val 1006989136 ecr 4079727528], length 1314
14:36:16.116220 IP 185.42.206.120.1935 > 10.8.0.2.47626: Flags [.], ack 126363, win 126, options [nop,nop,TS val 4079727595 ecr 1006988837], length 0
14:36:16.142240 IP 185.42.206.120.1935 > 10.8.0.2.47626: Flags [.], ack 126490, win 126, options [nop,nop,TS val 4079727622 ecr 1006988891], length 0
14:36:16.142278 IP 10.8.0.2.47626 > 185.42.206.120.1935: Flags [P.], seq 134374:135355, ack 1, win 501, options [nop,nop,TS val 1006989175 ecr 4079727622], length 981
14:36:16.199444 IP 10.8.0.2.47626 > 185.42.206.120.1935: Flags [.], seq 135355:136669, ack 1, win 501, options [nop,nop,TS val 1006989232 ecr 4079727622], length 1314
14:36:16.217170 IP 185.42.206.120.1935 > 10.8.0.2.47626: Flags [.], ack 129118, win 126, options [nop,nop,TS val 4079727697 ecr 1006988932], length 0
14:36:16.232674 IP 10.8.0.2.47626 > 185.42.206.120.1935: Flags [.], seq 136669:137983, ack 1, win 501, options [nop,nop,TS val 1006989265 ecr 4079727697], length 1314
14:36:16.275261 IP 10.8.0.2.47626 > 185.42.206.120.1935: Flags [.], seq 137983:139297, ack 1, win 501, options [nop,nop,TS val 1006989308 ecr 4079727697], length 1314
14:36:16.323258 IP 185.42.206.120.1935 > 10.8.0.2.47626: Flags [.], ack 131746, win 126, options [nop,nop,TS val 4079727803 ecr 1006989008], length 0
14:36:16.339334 IP 10.8.0.2.47626 > 185.42.206.120.1935: Flags [.], seq 139297:140611, ack 1, win 501, options [nop,nop,TS val 1006989372 ecr 4079727803], length 1314
14:36:16.364553 IP 10.8.0.2.47626 > 185.42.206.120.1935: Flags [.], seq 140611:141925, ack 1, win 501, options [nop,nop,TS val 1006989397 ecr 4079727803], length 1314
14:36:16.387661 IP 185.42.206.120.1935 > 10.8.0.2.47626: Flags [.], ack 134374, win 126, options [nop,nop,TS val 4079727867 ecr 1006989097], length 0
14:36:16.403114 IP 10.8.0.2.47626 > 185.42.206.120.1935: Flags [.], seq 141925:143239, ack 1, win 501, options [nop,nop,TS val 1006989435 ecr 4079727867], length 1314
14:36:16.425778 IP 185.42.206.120.1935 > 10.8.0.2.47626: Flags [.], ack 135355, win 126, options [nop,nop,TS val 4079727905 ecr 1006989175], length 0
14:36:16.425799 IP 10.8.0.2.47626 > 185.42.206.120.1935: Flags [P.], seq 143239:143456, ack 1, win 501, options [nop,nop,TS val 1006989458 ecr 4079727905], length 217
14:36:16.467034 IP 10.8.0.2.47626 > 185.42.206.120.1935: Flags [.], seq 143456:144770, ack 1, win 501, options [nop,nop,TS val 1006989499 ecr 4079727905], length 1314
14:36:16.509895 IP 10.8.0.2.47626 > 185.42.206.120.1935: Flags [.], seq 144770:146084, ack 1, win 501, options [nop,nop,TS val 1006989542 ecr 4079727905], length 1314
14:36:16.521206 IP 185.42.206.120.1935 > 10.8.0.2.47626: Flags [.], ack 137983, win 126, options [nop,nop,TS val 4079728000 ecr 1006989232], length 0
14:36:16.552806 IP 10.8.0.2.47626 > 185.42.206.120.1935: Flags [.], seq 146084:147398, ack 1, win 501, options [nop,nop,TS val 1006989585 ecr 4079728000], length 1314
14:36:16.596162 IP 10.8.0.2.47626 > 185.42.206.120.1935: Flags [.], seq 147398:148712, ack 1, win 501, options [nop,nop,TS val 1006989628 ecr 4079728000], length 1314
14:36:16.622821 IP 185.42.206.120.1935 > 10.8.0.2.47626: Flags [.], ack 140611, win 126, options [nop,nop,TS val 4079728102 ecr 1006989308], length 0
14:36:16.637960 IP 10.8.0.2.47626 > 185.42.206.120.1935: Flags [.], seq 148712:150026, ack 1, win 501, options [nop,nop,TS val 1006989670 ecr 4079728102], length 1314
14:36:16.680352 IP 10.8.0.2.47626 > 185.42.206.120.1935: Flags [.], seq 150026:151340, ack 1, win 501, options [nop,nop,TS val 1006989713 ecr 4079728102], length 1314
14:36:16.686436 IP 185.42.206.120.1935 > 10.8.0.2.47626: Flags [.], ack 143239, win 126, options [nop,nop,TS val 4079728166 ecr 1006989397], length 0
14:36:16.709054 IP 185.42.206.120.1935 > 10.8.0.2.47626: Flags [.], ack 143456, win 126, options [nop,nop,TS val 4079728188 ecr 1006989458], length 0
14:36:16.709085 IP 10.8.0.2.47626 > 185.42.206.120.1935: Flags [P.], seq 151340:152318, ack 1, win 501, options [nop,nop,TS val 1006989741 ecr 4079728188], length 978
14:36:16.766159 IP 10.8.0.2.47626 > 185.42.206.120.1935: Flags [.], seq 152318:153632, ack 1, win 501, options [nop,nop,TS val 1006989798 ecr 4079728188], length 1314
14:36:16.793208 IP 185.42.206.120.1935 > 10.8.0.2.47626: Flags [.], ack 146084, win 126, options [nop,nop,TS val 4079728273 ecr 1006989499], length 0
14:36:16.808514 IP 10.8.0.2.47626 > 185.42.206.120.1935: Flags [.], seq 153632:154946, ack 1, win 501, options [nop,nop,TS val 1006989841 ecr 4079728273], length 1314
14:36:16.829674 IP 10.8.0.2.47626 > 185.42.206.120.1935: Flags [.], seq 154946:156260, ack 1, win 501, options [nop,nop,TS val 1006989862 ecr 4079728273], length 1314
14:36:16.879552 IP 185.42.206.120.1935 > 10.8.0.2.47626: Flags [.], ack 148712, win 126, options [nop,nop,TS val 4079728359 ecr 1006989585], length 0
14:36:16.899525 IP 10.8.0.2.47626 > 185.42.206.120.1935: Flags [.], seq 156260:157574, ack 1, win 501, options [nop,nop,TS val 1006989932 ecr 4079728359], length 1314
14:36:16.936945 IP 10.8.0.2.47626 > 185.42.206.120.1935: Flags [.], seq 157574:158888, ack 1, win 501, options [nop,nop,TS val 1006989969 ecr 4079728359], length 1314
14:36:16.963331 IP 10.8.0.2.47626 > 185.42.206.120.1935: Flags [.], seq 158888:160202, ack 1, win 501, options [nop,nop,TS val 1006989996 ecr 4079728359], length 1314
14:36:16.963665 IP 185.42.206.120.1935 > 10.8.0.2.47626: Flags [.], ack 151340, win 126, options [nop,nop,TS val 4079728443 ecr 1006989670], length 0
14:36:16.992672 IP 185.42.206.120.1935 > 10.8.0.2.47626: Flags [.], ack 152318, win 126, options [nop,nop,TS val 4079728472 ecr 1006989741], length 0
14:36:16.992701 IP 10.8.0.2.47626 > 185.42.206.120.1935: Flags [P.], seq 160202:160336, ack 1, win 501, options [nop,nop,TS val 1006990025 ecr 4079728472], length 134
14:36:17.043781 IP 10.8.0.2.47626 > 185.42.206.120.1935: Flags [.], seq 160336:161650, ack 1, win 501, options [nop,nop,TS val 1006990076 ecr 4079728472], length 1314
14:36:17.065167 IP 10.8.0.2.47626 > 185.42.206.120.1935: Flags [.], seq 161650:162964, ack 1, win 501, options [nop,nop,TS val 1006990097 ecr 4079728472], length 1314
14:36:17.092055 IP 185.42.206.120.1935 > 10.8.0.2.47626: Flags [.], ack 154946, win 126, options [nop,nop,TS val 4079728571 ecr 1006989798], length 0
14:36:17.107934 IP 10.8.0.2.47626 > 185.42.206.120.1935: Flags [.], seq 162964:164278, ack 1, win 501, options [nop,nop,TS val 1006990140 ecr 4079728571], length 1314
14:36:17.172161 IP 10.8.0.2.47626 > 185.42.206.120.1935: Flags [.], seq 164278:165592, ack 1, win 501, options [nop,nop,TS val 1006990204 ecr 4079728571], length 1314
14:36:17.183087 IP 185.42.206.120.1935 > 10.8.0.2.47626: Flags [.], ack 157574, win 126, options [nop,nop,TS val 4079728662 ecr 1006989862], length 0
14:36:17.198401 IP 10.8.0.2.47626 > 185.42.206.120.1935: Flags [.], seq 165592:166906, ack 1, win 501, options [nop,nop,TS val 1006990231 ecr 4079728662], length 1314
14:36:17.235975 IP 10.8.0.2.47626 > 185.42.206.120.1935: Flags [.], seq 166906:168220, ack 1, win 501, options [nop,nop,TS val 1006990268 ecr 4079728662], length 1314
14:36:17.253680 IP 185.42.206.120.1935 > 10.8.0.2.47626: Flags [.], ack 160202, win 126, options [nop,nop,TS val 4079728726 ecr 1006989969], length 0
14:36:17.276504 IP 185.42.206.120.1935 > 10.8.0.2.47626: Flags [.], ack 160336, win 126, options [nop,nop,TS val 4079728756 ecr 1006990025], length 0
14:36:17.276540 IP 10.8.0.2.47626 > 185.42.206.120.1935: Flags [P.], seq 168220:169186, ack 1, win 501, options [nop,nop,TS val 1006990309 ecr 4079728756], length 966
14:36:17.343216 IP 10.8.0.2.47626 > 185.42.206.120.1935: Flags [.], seq 169186:170500, ack 1, win 501, options [nop,nop,TS val 1006990376 ecr 4079728756], length 1314
14:36:17.348680 IP 185.42.206.120.1935 > 10.8.0.2.47626: Flags [.], ack 162964, win 126, options [nop,nop,TS val 4079728828 ecr 1006990076], length 0
14:36:17.366164 IP 10.8.0.2.47626 > 185.42.206.120.1935: Flags [.], seq 170500:171814, ack 1, win 501, options [nop,nop,TS val 1006990398 ecr 4079728828], length 1314
14:36:17.407680 IP 10.8.0.2.47626 > 185.42.206.120.1935: Flags [.], seq 171814:173128, ack 1, win 501, options [nop,nop,TS val 1006990440 ecr 4079728828], length 1314
14:36:17.455709 IP 185.42.206.120.1935 > 10.8.0.2.47626: Flags [.], ack 165592, win 126, options [nop,nop,TS val 4079728935 ecr 1006990140], length 0
14:36:17.465373 IP 10.8.0.2.47626 > 185.42.206.120.1935: Flags [.], seq 173128:174442, ack 1, win 501, options [nop,nop,TS val 1006990498 ecr 4079728935], length 1314
14:36:17.493569 IP 10.8.0.2.47626 > 185.42.206.120.1935: Flags [.], seq 174442:175756, ack 1, win 501, options [nop,nop,TS val 1006990526 ecr 4079728935], length 1314
14:36:17.519267 IP 185.42.206.120.1935 > 10.8.0.2.47626: Flags [.], ack 168220, win 126, options [nop,nop,TS val 4079728999 ecr 1006990231], length 0
14:36:17.531861 IP 10.8.0.2.47626 > 185.42.206.120.1935: Flags [.], seq 175756:177070, ack 1, win 501, options [nop,nop,TS val 1006990564 ecr 4079728999], length 1314
14:36:17.560303 IP 185.42.206.120.1935 > 10.8.0.2.47626: Flags [.], ack 169186, win 126, options [nop,nop,TS val 4079729040 ecr 1006990309], length 0
14:36:17.560342 IP 10.8.0.2.47626 > 185.42.206.120.1935: Flags [P.], seq 177070:177391, ack 1, win 501, options [nop,nop,TS val 1006990593 ecr 4079729040], length 321
14:36:17.599584 IP 10.8.0.2.47626 > 185.42.206.120.1935: Flags [.], seq 177391:178705, ack 1, win 501, options [nop,nop,TS val 1006990632 ecr 4079729040], length 1314
14:36:17.631228 IP 10.8.0.2.47626 > 185.42.206.120.1935: Flags [.], seq 178705:180019, ack 1, win 501, options [nop,nop,TS val 1006990664 ecr 4079729040], length 1314
14:36:17.649997 IP 185.42.206.120.1935 > 10.8.0.2.47626: Flags [.], ack 171814, win 126, options [nop,nop,TS val 4079729129 ecr 1006990376], length 0
14:36:17.685697 IP 10.8.0.2.47626 > 185.42.206.120.1935: Flags [.], seq 180019:181333, ack 1, win 501, options [nop,nop,TS val 1006990718 ecr 4079729129], length 1314
14:36:17.728378 IP 10.8.0.2.47626 > 185.42.206.120.1935: Flags [.], seq 181333:182647, ack 1, win 501, options [nop,nop,TS val 1006990761 ecr 4079729129], length 1314
14:36:17.748866 IP 185.42.206.120.1935 > 10.8.0.2.47626: Flags [.], ack 174442, win 126, options [nop,nop,TS val 4079729228 ecr 1006990440], length 0
14:36:17.763032 IP 10.8.0.2.47626 > 185.42.206.120.1935: Flags [.], seq 182647:183961, ack 1, win 501, options [nop,nop,TS val 1006990795 ecr 4079729228], length 1314
14:36:17.813891 IP 10.8.0.2.47626 > 185.42.206.120.1935: Flags [.], seq 183961:185275, ack 1, win 501, options [nop,nop,TS val 1006990846 ecr 4079729228], length 1314
14:36:17.815269 IP 185.42.206.120.1935 > 10.8.0.2.47626: Flags [.], ack 177070, win 126, options [nop,nop,TS val 4079729295 ecr 1006990526], length 0
14:36:17.843892 IP 185.42.206.120.1935 > 10.8.0.2.47626: Flags [.], ack 177391, win 126, options [nop,nop,TS val 4079729323 ecr 1006990593], length 0
14:36:17.843930 IP 10.8.0.2.47626 > 185.42.206.120.1935: Flags [P.], seq 185275:186256, ack 1, win 501, options [nop,nop,TS val 1006990876 ecr 4079729323], length 981
14:36:17.899314 IP 10.8.0.2.47626 > 185.42.206.120.1935: Flags [.], seq 186256:187570, ack 1, win 501, options [nop,nop,TS val 1006990932 ecr 4079729323], length 1314
14:36:17.914665 IP 185.42.206.120.1935 > 10.8.0.2.47626: Flags [.], ack 180019, win 126, options [nop,nop,TS val 4079729394 ecr 1006990632], length 0
14:36:17.929644 IP 10.8.0.2.47626 > 185.42.206.120.1935: Flags [.], seq 187570:188884, ack 1, win 501, options [nop,nop,TS val 1006990962 ecr 4079729394], length 1314
14:36:17.963614 IP 10.8.0.2.47626 > 185.42.206.120.1935: Flags [.], seq 188884:190198, ack 1, win 501, options [nop,nop,TS val 1006990996 ecr 4079729394], length 1314
14:36:18.011660 IP 185.42.206.120.1935 > 10.8.0.2.47626: Flags [.], ack 182647, win 126, options [nop,nop,TS val 4079729491 ecr 1006990718], length 0
14:36:18.027547 IP 10.8.0.2.47626 > 185.42.206.120.1935: Flags [.], seq 190198:191512, ack 1, win 501, options [nop,nop,TS val 1006991060 ecr 4079729491], length 1314
14:36:18.066031 IP 10.8.0.2.47626 > 185.42.206.120.1935: Flags [.], seq 191512:192826, ack 1, win 501, options [nop,nop,TS val 1006991098 ecr 4079729491], length 1314
14:36:18.097557 IP 185.42.206.120.1935 > 10.8.0.2.47626: Flags [.], ack 185275, win 126, options [nop,nop,TS val 4079729577 ecr 1006990795], length 0
