05:09:14.088698 IP 99.181.101.248.1935 > 10.8.3.4.43722: Flags [.], ack 1038240558, win 126, options [nop,nop,TS val 3796213210 ecr 3706250468], length 0
05:09:14.092208 IP 10.8.3.4.43722 > 99.181.101.248.1935: Flags [.], seq 5655:6969, ack 0, win 501, options [nop,nop,TS val 3706250725 ecr 3796213210], length 1314
05:09:14.135111 IP 10.8.3.4.43722 > 99.181.101.248.1935: Flags [.], seq 6969:8283, ack 0, win 501, options [nop,nop,TS val 3706250768 ecr 3796213210], length 1314
05:09:14.194694 IP 99.181.101.248.1935 > 10.8.3.4.43722: Flags [.], ack 2629, win 126, options [nop,nop,TS val 3796213316 ecr 3706250533], length 0
05:09:14.199552 IP 10.8.3.4.43722 > 99.181.101.248.1935: Flags [.], seq 8283:9597, ack 0, win 501, options [nop,nop,TS val 3706250832 ecr 3796213316], length 1314
05:09:14.224135 IP 10.8.3.4.43722 > 99.181.101.248.1935: Flags [.], seq 9597:10911, ack 0, win 501, options [nop,nop,TS val 3706250857 ecr 3796213316], length 1314
05:09:14.244615 IP 99.181.101.248.1935 > 10.8.3.4.43722: Flags [.], ack 4341, win 126, options [nop,nop,TS val 3796213366 ecr 3706250624], length 0
05:09:14.244630 IP 10.8.3.4.43722 > 99.181.101.248.1935: Flags [P.], seq 10911:11318, ack 0, win 501, options [nop,nop,TS val 3706250877 ecr 3796213366], length 407
05:09:14.305702 IP 10.8.3.4.43722 > 99.181.101.248.1935: Flags [.], seq 11318:12632, ack 0, win 501, options [nop,nop,TS val 3706250938 ecr 3796213366], length 1314
05:09:14.322522 IP 99.181.101.248.1935 > 10.8.3.4.43722: Flags [.], ack 6969, win 126, options [nop,nop,TS val 3796213443 ecr 3706250704], length 0
05:09:14.327007 IP 10.8.3.4.43722 > 99.181.101.248.1935: Flags [.], seq 12632:13946, ack 0, win 501, options [nop,nop,TS val 3706250960 ecr 3796213443], length 1314
05:09:14.369598 IP 10.8.3.4.43722 > 99.181.101.248.1935: Flags [.], seq 13946:15260, ack 0, win 501, options [nop,nop,TS val 3706251002 ecr 3796213443], length 1314
05:09:14.429840 IP 99.181.101.248.1935 > 10.8.3.4.43722: Flags [.], ack 9597, win 126, options [nop,nop,TS val 3796213551 ecr 3706250768], length 0
05:09:14.433967 IP 10.8.3.4.43722 > 99.181.101.248.1935: Flags [.], seq 15260:16574, ack 0, win 501, options [nop,nop,TS val 3706251067 ecr 3796213551], length 1314
05:09:14.455713 IP 10.8.3.4.43722 > 99.181.101.248.1935: Flags [.], seq 16574:17888, ack 0, win 501, options [nop,nop,TS val 3706251088 ecr 3796213551], length 1314
05:09:14.474406 IP 99.181.101.248.1935 > 10.8.3.4.43722: Flags [.], ack 11318, win 126, options [nop,nop,TS val 3796213596 ecr 3706250857], length 0
05:09:14.474421 IP 10.8.3.4.43722 > 99.181.101.248.1935: Flags [P.], seq 17888:18203, ack 0, win 501, options [nop,nop,TS val 3706251107 ecr 3796213596], length 315
05:09:14.526527 IP 10.8.3.4.43722 > 99.181.101.248.1935: Flags [.], seq 18203:19517, ack 0, win 501, options [nop,nop,TS val 3706251159 ecr 3796213596], length 1314
05:09:14.557226 IP 99.181.101.248.1935 > 10.8.3.4.43722: Flags [.], ack 13946, win 126, options [nop,nop,TS val 3796213678 ecr 3706250938], length 0
05:09:14.562407 IP 10.8.3.4.43722 > 99.181.101.248.1935: Flags [.], seq 19517:20831, ack 0, win 501, options [nop,nop,TS val 3706251195 ecr 3796213678], length 1314
05:09:14.605029 IP 10.8.3.4.43722 > 99.181.101.248.1935: Flags [.], seq 20831:22145, ack 0, win 501, options [nop,nop,TS val 3706251238 ecr 3796213678], length 1314
05:09:14.664119 IP 99.181.101.248.1935 > 10.8.3.4.43722: Flags [.], ack 16574, win 126, options [nop,nop,TS val 3796213785 ecr 3706251002], length 0
05:09:14.668604 IP 10.8.3.4.43722 > 99.181.101.248.1935: Flags [.], seq 22145:23459, ack 0, win 501, options [nop,nop,TS val 3706251301 ecr 3796213785], length 1314
05:09:14.689750 IP 10.8.3.4.43722 > 99.181.101.248.1935: Flags [.], seq 23459:24773, ack 0, win 501, options [nop,nop,TS val 3706251322 ecr 3796213785], length 1314
05:09:14.704187 IP 99.181.101.248.1935 > 10.8.3.4.43722: Flags [.], ack 18203, win 126, options [nop,nop,TS val 3796213825 ecr 3706251088], length 0
05:09:14.704200 IP 10.8.3.4.43722 > 99.181.101.248.1935: Flags [P.], seq 24773:25175, ack 0, win 501, options [nop,nop,TS val 3706251337 ecr 3796213825], length 402
05:09:14.755431 IP 10.8.3.4.43722 > 99.181.101.248.1935: Flags [.], seq 25175:26489, ack 0, win 501, options [nop,nop,TS val 3706251388 ecr 3796213825], length 1314
05:09:14.792819 IP 99.181.101.248.1935 > 10.8.3.4.43722: Flags [.], ack 20831, win 126, options [nop,nop,TS val 3796213914 ecr 3706251159], length 0
05:09:14.795871 IP 10.8.3.4.43722 > 99.181.101.248.1935: Flags [.], seq 26489:27803, ack 0, win 501, options [nop,nop,TS val 3706251429 ecr 3796213914], length 1314
05:09:14.838660 IP 10.8.3.4.43722 > 99.181.101.248.1935: Flags [.], seq 27803:29117, ack 0, win 501, options [nop,nop,TS val 3706251471 ecr 3796213914], length 1314
05:09:14.898650 IP 99.181.101.248.1935 > 10.8.3.4.43722: Flags [.], ack 23459, win 126, options [nop,nop,TS val 3796214020 ecr 3706251238], length 0
05:09:14.903091 IP 10.8.3.4.43722 > 99.181.101.248.1935: Flags [.], seq 29117:30431, ack 0, win 501, options [nop,nop,TS val 3706251536 ecr 3796214020], length 1314
05:09:14.925109 IP 10.8.3.4.43722 > 99.181.101.248.1935: Flags [.], seq 30431:31745, ack 0, win 501, options [nop,nop,TS val 3706251558 ecr 3796214020], length 1314
05:09:14.934193 IP 99.181.101.248.1935 > 10.8.3.4.43722: Flags [.], ack 25175, win 126, options [nop,nop,TS val 3796214055 ecr 3706251322], length 0
05:09:14.934222 IP 10.8.3.4.43722 > 99.181.101.248.1935: Flags [P.], seq 31745:32146, ack 0, win 501, options [nop,nop,TS val 3706251567 ecr 3796214055], length 401
05:09:14.989029 IP 10.8.3.4.43722 > 99.181.101.248.1935: Flags [.], seq 32146:33460, ack 0, win 501, options [nop,nop,TS val 3706251622 ecr 3796214055], length 1314
05:09:15.026000 IP 99.181.101.248.1935 > 10.8.3.4.43722: Flags [.], ack 27803, win 126, options [nop,nop,TS val 3796214147 ecr 3706251388], length 0
05:09:15.030794 IP 10.8.3.4.43722 > 99.181.101.248.1935: Flags [.], seq 33460:34774, ack 0, win 501, options [nop,nop,TS val 3706251663 ecr 3796214147], length 1314
05:09:15.058137 IP 10.8.3.4.43722 > 99.181.101.248.1935: Flags [.], seq 34774:36088, ack 0, win 501, options [nop,nop,TS val 3706251691 ecr 3796214147], length 1314
05:09:15.133637 IP 99.181.101.248.1935 > 10.8.3.4.43722: Flags [.], ack 30431, win 126, options [nop,nop,TS val 3796214255 ecr 3706251471], length 0
05:09:15.138038 IP 10.8.3.4.43722 > 99.181.101.248.1935: Flags [.], seq 36088:37402, ack 0, win 501, options [nop,nop,TS val 3706251771 ecr 3796214255], length 1314
05:09:15.160138 IP 10.8.3.4.43722 > 99.181.101.248.1935: Flags [.], seq 37402:38716, ack 0, win 501, options [nop,nop,TS val 3706251793 ecr 3796214255], length 1314
05:09:15.164233 IP 99.181.101.248.1935 > 10.8.3.4.43722: Flags [.], ack 32146, win 126, options [nop,nop,TS val 3796214285 ecr 3706251558], length 0
05:09:15.164263 IP 10.8.3.4.43722 > 99.181.101.248.1935: Flags [P.], seq 38716:39127, ack 0, win 501, options [nop,nop,TS val 3706251797 ecr 3796214285], length 411
05:09:15.227498 IP 10.8.3.4.43722 > 99.181.101.248.1935: Flags [.], seq 39127:40441, ack 0, win 501, options [nop,nop,TS val 3706251860 ecr 3796214285], length 1314
05:09:15.261040 IP 99.181.101.248.1935 > 10.8.3.4.43722: Flags [.], ack 34774, win 126, options [nop,nop,TS val 3796214382 ecr 3706251622], length 0
05:09:15.266387 IP 10.8.3.4.43722 > 99.181.101.248.1935: Flags [.], seq 40441:41755, ack 0, win 501, options [nop,nop,TS val 3706251899 ecr 3796214382], length 1314
05:09:15.288928 IP 10.8.3.4.43722 > 99.181.101.248.1935: Flags [.], seq 41755:43069, ack 0, win 501, options [nop,nop,TS val 3706251922 ecr 3796214382], length 1314
05:09:15.351228 IP 99.181.101.248.1935 > 10.8.3.4.43722: Flags [.], ack 36088, win 126, options [nop,nop,TS val 3796214472 ecr 3706251691], length 0
05:09:15.372951 IP 10.8.3.4.43722 > 99.181.101.248.1935: Flags [.], seq 43069:44383, ack 0, win 501, options [nop,nop,TS val 3706252006 ecr 3796214472], length 1314
05:09:15.390378 IP 99.181.101.248.1935 > 10.8.3.4.43722: Flags [.], ack 38716, win 126, options [nop,nop,TS val 3796214511 ecr 3706251771], length 0
05:09:15.394205 IP 99.181.101.248.1935 > 10.8.3.4.43722: Flags [.], ack 39127, win 126, options [nop,nop,TS val 3796214515 ecr 3706251797], length 0
05:09:15.394266 IP 10.8.3.4.43722 > 99.181.101.248.1935: Flags [P.], seq 44383:45256, ack 0, win 501, options [nop,nop,TS val 3706252027 ecr 3796214515], length 873
05:09:15.437325 IP 10.8.3.4.43722 > 99.181.101.248.1935: Flags [.], seq 45256:46570, ack 0, win 501, options [nop,nop,TS val 3706252070 ecr 3796214515], length 1314
05:09:15.458758 IP 10.8.3.4.43722 > 99.181.101.248.1935: Flags [.], seq 46570:47884, ack 0, win 501, options [nop,nop,TS val 3706252091 ecr 3796214515], length 1314
05:09:15.496431 IP 99.181.101.248.1935 > 10.8.3.4.43722: Flags [.], ack 41755, win 126, options [nop,nop,TS val 3796214617 ecr 3706251860], length 0
05:09:15.522279 IP 10.8.3.4.43722 > 99.181.101.248.1935: Flags [.], seq 47884:49198, ack 0, win 501, options [nop,nop,TS val 3706252155 ecr 3796214617], length 1314
05:09:15.564711 IP 10.8.3.4.43722 > 99.181.101.248.1935: Flags [.], seq 49198:50512, ack 0, win 501, options [nop,nop,TS val 3706252197 ecr 3796214617], length 1314
05:09:15.575159 IP 99.181.101.248.1935 > 10.8.3.4.43722: Flags [.], ack 43069, win 126, options [nop,nop,TS val 3796214696 ecr 3706251922], length 0
05:09:15.591985 IP 10.8.3.4.43722 > 99.181.101.248.1935: Flags [.], seq 50512:51826, ack 0, win 501, options [nop,nop,TS val 3706252225 ecr 3796214696], length 1314
05:09:15.624471 IP 99.181.101.248.1935 > 10.8.3.4.43722: Flags [.], ack 45256, win 126, options [nop,nop,TS val 3796214745 ecr 3706252006], length 0
05:09:15.624524 IP 10.8.3.4.43722 > 99.181.101.248.1935: Flags [P.], seq 51826:52128, ack 0, win 501, options [nop,nop,TS val 3706252257 ecr 3796214745], length 302
05:09:15.671653 IP 10.8.3.4.43722 > 99.181.101.248.1935: Flags [.], seq 52128:53442, ack 0, win 501, options [nop,nop,TS val 3706252304 ecr 3796214745], length 1314
05:09:15.689043 IP 99.181.101.248.1935 > 10.8.3.4.43722: Flags [.], ack 47884, win 126, options [nop,nop,TS val 3796214810 ecr 3706252070], length 0
05:09:15.693114 IP 10.8.3.4.43722 > 99.181.101.248.1935: Flags [.], seq 53442:54756, ack 0, win 501, options [nop,nop,TS val 3706252326 ecr 3796214810], length 1314
05:09:15.735913 IP 10.8.3.4.43722 > 99.181.101.248.1935: Flags [.], seq 54756:56070, ack 0, win 501, options [nop,nop,TS val 3706252369 ecr 3796214810], length 1314
05:09:15.794829 IP 99.181.101.248.1935 > 10.8.3.4.43722: Flags [.], ack 50512, win 126, options [nop,nop,TS val 3796214916 ecr 3706252155], length 0
05:09:15.799684 IP 10.8.3.4.43722 > 99.181.101.248.1935: Flags [.], seq 56070:57384, ack 0, win 501, options [nop,nop,TS val 3706252432 ecr 3796214916], length 1314
05:09:15.822708 IP 10.8.3.4.43722 > 99.181.101.248.1935: Flags [.], seq 57384:58698, ack 0, win 501, options [nop,nop,TS val 3706252455 ecr 3796214916], length 1314
05:09:15.854428 IP 99.181.101.248.1935 > 10.8.3.4.43722: Flags [.], ack 52128, win 126, options [nop,nop,TS val 3796214976 ecr 3706252225], length 0
05:09:15.854453 IP 10.8.3.4.43722 > 99.181.101.248.1935: Flags [P.], seq 58698:59104, ack 0, win 501, options [nop,nop,TS val 3706252487 ecr 3796214976], length 406
05:09:15.906113 IP 10.8.3.4.43722 > 99.181.101.248.1935: Flags [.], seq 59104:60418, ack 0, win 501, options [nop,nop,TS val 3706252539 ecr 3796214976], length 1314
05:09:15.923420 IP 99.181.101.248.1935 > 10.8.3.4.43722: Flags [.], ack 54756, win 126, options [nop,nop,TS val 3796215044 ecr 3706252304], length 0
05:09:15.927356 IP 10.8.3.4.43722 > 99.181.101.248.1935: Flags [.], seq 60418:61732, ack 0, win 501, options [nop,nop,TS val 3706252560 ecr 3796215044], length 1314
05:09:15.969813 IP 10.8.3.4.43722 > 99.181.101.248.1935: Flags [.], seq 61732:63046, ack 0, win 501, options [nop,nop,TS val 3706252603 ecr 3796215044], length 1314
05:09:16.029846 IP 99.181.101.248.1935 > 10.8.3.4.43722: Flags [.], ack 57384, win 126, options [nop,nop,TS val 3796215151 ecr 3706252369], length 0
05:09:16.033958 IP 10.8.3.4.43722 > 99.181.101.248.1935: Flags [.], seq 63046:64360, ack 0, win 501, options [nop,nop,TS val 3706252667 ecr 3796215151], length 1314
05:09:16.055604 IP 10.8.3.4.43722 > 99.181.101.248.1935: Flags [.], seq 64360:65674, ack 0, win 501, options [nop,nop,TS val 3706252688 ecr 3796215151], length 1314
05:09:16.084590 IP 99.181.101.248.1935 > 10.8.3.4.43722: Flags [.], ack 59104, win 126, options [nop,nop,TS val 3796215206 ecr 3706252455], length 0
05:09:16.084604 IP 10.8.3.4.43722 > 99.181.101.248.1935: Flags [P.], seq 65674:66085, ack 0, win 501, options [nop,nop,TS val 3706252717 ecr 3796215206], length 411
05:09:16.124588 IP 10.8.3.4.43722 > 99.181.101.248.1935: Flags [.], seq 66085:67399, ack 0, win 501, options [nop,nop,TS val 3706252757 ecr 3796215206], length 1314
05:09:16.157425 IP 99.181.101.248.1935 > 10.8.3.4.43722: Flags [.], ack 61732, win 126, options [nop,nop,TS val 3796215278 ecr 3706252539], length 0
05:09:16.161802 IP 10.8.3.4.43722 > 99.181.101.248.1935: Flags [.], seq 67399:68713, ack 0, win 501, options [nop,nop,TS val 3706252794 ecr 3796215278], length 1314
05:09:16.204786 IP 10.8.3.4.43722 > 99.181.101.248.1935: Flags [.], seq 68713:70027, ack 0, win 501, options [nop,nop,TS val 3706252837 ecr 3796215278], length 1314
05:09:16.264199 IP 99.181.101.248.1935 > 10.8.3.4.43722: Flags [.], ack 64360, win 126, options [nop,nop,TS val 3796215385 ecr 3706252603], length 0
05:09:16.268671 IP 10.8.3.4.43722 > 99.181.101.248.1935: Flags [.], seq 70027:71341, ack 0, win 501, options [nop,nop,TS val 3706252901 ecr 3796215385], length 1314
05:09:16.293264 IP 10.8.3.4.43722 > 99.181.101.248.1935: Flags [.], seq 71341:72655, ack 0, win 501, options [nop,nop,TS val 3706252926 ecr 3796215385], length 1314
05:09:16.319492 IP 99.181.101.248.1935 > 10.8.3.4.43722: Flags [.], ack 66085, win 126, options [nop,nop,TS val 3796215440 ecr 3706252688], length 0
05:09:16.319532 IP 10.8.3.4.43722 > 99.181.101.248.1935: Flags [P.], seq 72655:73057, ack 0, win 501, options [nop,nop,TS val 3706252952 ecr 3796215440], length 402
05:09:16.357299 IP 10.8.3.4.43722 > 99.181.101.248.1935: Flags [.], seq 73057:74371, ack 0, win 501, options [nop,nop,TS val 3706252990 ecr 3796215440], length 1314
05:09:16.392301 IP 99.181.101.248.1935 > 10.8.3.4.43722: Flags [.], ack 68713, win 126, options [nop,nop,TS val 3796215513 ecr 3706252757], length 0
05:09:16.397167 IP 10.8.3.4.43722 > 99.181.101.248.1935: Flags [.], seq 74371:75685, ack 0, win 501, options [nop,nop,TS val 3706253030 ecr 3796215513], length 1314
05:09:16.439941 IP 10.8.3.4.43722 > 99.181.101.248.1935: Flags [.], seq 75685:76999, ack 0, win 501, options [nop,nop,TS val 3706253073 ecr 3796215513], length 1314
05:09:16.499245 IP 99.181.101.248.1935 > 10.8.3.4.43722: Flags [.], ack 71341, win 126, options [nop,nop,TS val 3796215620 ecr 3706252837], length 0
05:09:16.504068 IP 10.8.3.4.43722 > 99.181.101.248.1935: Flags [.], seq 76999:78313, ack 0, win 501, options [nop,nop,TS val 3706253137 ecr 3796215620], length 1314
05:09:16.525365 IP 10.8.3.4.43722 > 99.181.101.248.1935: Flags [.], seq 78313:79627, ack 0, win 501, options [nop,nop,TS val 3706253158 ecr 3796215620], length 1314
05:09:16.549639 IP 99.181.101.248.1935 > 10.8.3.4.43722: Flags [.], ack 73057, win 126, options [nop,nop,TS val 3796215671 ecr 3706252926], length 0
05:09:16.549661 IP 10.8.3.4.43722 > 99.181.101.248.1935: Flags [P.], seq 79627:80029, ack 0, win 501, options [nop,nop,TS val 3706253182 ecr 3796215671], length 402
05:09:16.589172 IP 10.8.3.4.43722 > 99.181.101.248.1935: Flags [.], seq 80029:81343, ack 0, win 501, options [nop,nop,TS val 3706253222 ecr 3796215671], length 1314
05:09:16.627390 IP 99.181.101.248.1935 > 10.8.3.4.43722: Flags [.], ack 75685, win 126, options [nop,nop,TS val 3796215748 ecr 3706252990], length 0
05:09:16.631905 IP 10.8.3.4.43722 > 99.181.101.248.1935: Flags [.], seq 81343:82657, ack 0, win 501, options [nop,nop,TS val 3706253265 ecr 3796215748], length 1314
05:09:16.674786 IP 10.8.3.4.43722 > 99.181.101.248.1935: Flags [.], seq 82657:83971, ack 0, win 501, options [nop,nop,TS val 3706253307 ecr 3796215748], length 1314
05:09:16.734445 IP 99.181.101.248.1935 > 10.8.3.4.43722: Flags [.], ack 78313, win 126, options [nop,nop,TS val 3796215855 ecr 3706253073], length 0
05:09:16.738523 IP 10.8.3.4.43722 > 99.181.101.248.1935: Flags [.], seq 83971:85285, ack 0, win 501, options [nop,nop,TS val 3706253371 ecr 3796215855], length 1314
05:09:16.759812 IP 10.8.3.4.43722 > 99.181.101.248.1935: Flags [.], seq 85285:86599, ack 0, win 501, options [nop,nop,TS val 3706253393 ecr 3796215855], length 1314
05:09:16.779639 IP 99.181.101.248.1935 > 10.8.3.4.43722: Flags [.], ack 80029, win 126, options [nop,nop,TS val 3796215901 ecr 3706253158], length 0
05:09:16.779658 IP 10.8.3.4.43722 > 99.181.101.248.1935: Flags [P.], seq 86599:86914, ack 0, win 501, options [nop,nop,TS val 3706253412 ecr 3796215901], length 315
05:09:16.825193 IP 10.8.3.4.43722 > 99.181.101.248.1935: Flags [.], seq 86914:88228, ack 0, win 501, options [nop,nop,TS val 3706253458 ecr 3796215901], length 1314
05:09:16.862147 IP 99.181.101.248.1935 > 10.8.3.4.43722: Flags [.], ack 82657, win 126, options [nop,nop,TS val 3796215983 ecr 3706253222], length 0
05:09:16.866347 IP 10.8.3.4.43722 > 99.181.101.248.1935: Flags [.], seq 88228:89542, ack 0, win 501, options [nop,nop,TS val 3706253499 ecr 3796215983], length 1314
05:09:16.890554 IP 10.8.3.4.43722 > 99.181.101.248.1935: Flags [.], seq 89542:90856, ack 0, win 501, options [nop,nop,TS val 3706253523 ecr 3796215983], length 1314
05:09:16.968700 IP 99.181.101.248.1935 > 10.8.3.4.43722: Flags [.], ack 85285, win 126, options [nop,nop,TS val 3796216090 ecr 3706253307], length 0
05:09:16.973550 IP 10.8.3.4.43722 > 99.181.101.248.1935: Flags [.], seq 90856:92170, ack 0, win 501, options [nop,nop,TS val 3706253606 ecr 3796216090], length 1314
05:09:16.995031 IP 10.8.3.4.43722 > 99.181.101.248.1935: Flags [.], seq 92170:93484, ack 0, win 501, options [nop,nop,TS val 3706253628 ecr 3796216090], length 1314
05:09:17.009684 IP 99.181.101.248.1935 > 10.8.3.4.43722: Flags [.], ack 86914, win 126, options [nop,nop,TS val 3796216131 ecr 3706253393], length 0
05:09:17.009723 IP 10.8.3.4.43722 > 99.181.101.248.1935: Flags [P.], seq 93484:93890, ack 0, win 501, options [nop,nop,TS val 3706253642 ecr 3796216131], length 406
05:09:17.058743 IP 10.8.3.4.43722 > 99.181.101.248.1935: Flags [.], seq 93890:95204, ack 0, win 501, options [nop,nop,TS val 3706253691 ecr 3796216131], length 1314
05:09:17.096521 IP 99.181.101.248.1935 > 10.8.3.4.43722: Flags [.], ack 89542, win 126, options [nop,nop,TS val 3796216218 ecr 3706253458], length 0
05:09:17.101104 IP 10.8.3.4.43722 > 99.181.101.248.1935: Flags [.], seq 95204:96518, ack 0, win 501, options [nop,nop,TS val 3706253734 ecr 3796216218], length 1314
05:09:17.122456 IP 10.8.3.4.43722 > 99.181.101.248.1935: Flags [.], seq 96518:97832, ack 0, win 501, options [nop,nop,TS val 3706253755 ecr 3796216218], length 1314
05:09:17.183108 IP 99.181.101.248.1935 > 10.8.3.4.43722: Flags [.], ack 90856, win 126, options [nop,nop,TS val 3796216304 ecr 3706253523], length 0
05:09:17.193201 IP 10.8.3.4.43722 > 99.181.101.248.1935: Flags [.], seq 97832:99146, ack 0, win 501, options [nop,nop,TS val 3706253826 ecr 3796216304], length 1314
05:09:17.229061 IP 99.181.101.248.1935 > 10.8.3.4.43722: Flags [.], ack 93484, win 126, options [nop,nop,TS val 3796216350 ecr 3706253606], length 0
05:09:17.229376 IP 10.8.3.4.43722 > 99.181.101.248.1935: Flags [.], seq 99146:100460, ack 0, win 501, options [nop,nop,TS val 3706253862 ecr 3796216350], length 1314
05:09:17.239889 IP 99.181.101.248.1935 > 10.8.3.4.43722: Flags [.], ack 93890, win 126, options [nop,nop,TS val 3796216361 ecr 3706253642], length 0
05:09:17.239921 IP 10.8.3.4.43722 > 99.181.101.248.1935: Flags [P.], seq 100460:100853, ack 0, win 501, options [nop,nop,TS val 3706253873 ecr 3796216361], length 393
05:09:17.293223 IP 10.8.3.4.43722 > 99.181.101.248.1935: Flags [.], seq 100853:102167, ack 0, win 501, options [nop,nop,TS val 3706253926 ecr 3796216361], length 1314
05:09:17.331222 IP 99.181.101.248.1935 > 10.8.3.4.43722: Flags [.], ack 96518, win 126, options [nop,nop,TS val 3796216452 ecr 3706253691], length 0
05:09:17.335909 IP 10.8.3.4.43722 > 99.181.101.248.1935: Flags [.], seq 102167:103481, ack 0, win 501, options [nop,nop,TS val 3706253969 ecr 3796216452], length 1314
05:09:17.360241 IP 10.8.3.4.43722 > 99.181.101.248.1935: Flags [.], seq 103481:104795, ack 0, win 501, options [nop,nop,TS val 3706253993 ecr 3796216452], length 1314
05:09:17.415351 IP 99.181.101.248.1935 > 10.8.3.4.43722: Flags [.], ack 97832, win 126, options [nop,nop,TS val 3796216536 ecr 3706253755], length 0
05:09:17.426727 IP 10.8.3.4.43722 > 99.181.101.248.1935: Flags [.], seq 104795:106109, ack 0, win 501, options [nop,nop,TS val 3706254059 ecr 3796216536], length 1314
05:09:17.459693 IP 99.181.101.248.1935 > 10.8.3.4.43722: Flags [.], ack 100460, win 126, options [nop,nop,TS val 3796216581 ecr 3706253826], length 0
05:09:17.464792 IP 10.8.3.4.43722 > 99.181.101.248.1935: Flags [.], seq 106109:107423, ack 0, win 501, options [nop,nop,TS val 3706254097 ecr 3796216581], length 1314
05:09:17.470092 IP 99.181.101.248.1935 > 10.8.3.4.43722: Flags [.], ack 100853, win 126, options [nop,nop,TS val 3796216591 ecr 3706253873], length 0
05:09:17.470123 IP 10.8.3.4.43722 > 99.181.101.248.1935: Flags [P.], seq 107423:107834, ack 0, win 501, options [nop,nop,TS val 3706254103 ecr 3796216591], length 411
05:09:17.528470 IP 10.8.3.4.43722 > 99.181.101.248.1935: Flags [.], seq 107834:109148, ack 0, win 501, options [nop,nop,TS val 3706254161 ecr 3796216591], length 1314
05:09:17.566075 IP 99.181.101.248.1935 > 10.8.3.4.43722: Flags [.], ack 103481, win 126, options [nop,nop,TS val 3796216687 ecr 3706253926], length 0
05:09:17.570925 IP 10.8.3.4.43722 > 99.181.101.248.1935: Flags [.], seq 109148:110462, ack 0, win 501, options [nop,nop,TS val 3706254204 ecr 3796216687], length 1314
05:09:17.593120 IP 10.8.3.4.43722 > 99.181.101.248.1935: Flags [.], seq 110462:111776, ack 0, win 501, options [nop,nop,TS val 3706254226 ecr 3796216687], length 1314
05:09:17.656940 IP 99.181.101.248.1935 > 10.8.3.4.43722: Flags [.], ack 106109, win 126, options [nop,nop,TS val 3796216778 ecr 3706253993], length 0
05:09:17.659901 IP 10.8.3.4.43722 > 99.181.101.248.1935: Flags [.], seq 111776:113090, ack 0, win 501, options [nop,nop,TS val 3706254293 ecr 3796216778], length 1314
05:09:17.699352 IP 10.8.3.4.43722 > 99.181.101.248.1935: Flags [.], seq 113090:114404, ack 0, win 501, options [nop,nop,TS val 3706254332 ecr 3796216778], length 1314
05:09:17.700234 IP 99.181.101.248.1935 > 10.8.3.4.43722: Flags [.], ack 107834, win 126, options [nop,nop,TS val 3796216821 ecr 3706254097], length 0
05:09:17.700246 IP 10.8.3.4.43722 > 99.181.101.248.1935: Flags [P.], seq 114404:114814, ack 0, win 501, options [nop,nop,TS val 3706254333 ecr 3796216821], length 410
05:09:17.763116 IP 10.8.3.4.43722 > 99.181.101.248.1935: Flags [.], seq 114814:116128, ack 0, win 501, options [nop,nop,TS val 3706254396 ecr 3796216821], length 1314
05:09:17.801042 IP 99.181.101.248.1935 > 10.8.3.4.43722: Flags [.], ack 110462, win 126, options [nop,nop,TS val 3796216922 ecr 3706254161], length 0
05:09:17.805540 IP 10.8.3.4.43722 > 99.181.101.248.1935: Flags [.], seq 116128:117442, ack 0, win 501, options [nop,nop,TS val 3706254438 ecr 3796216922], length 1314
05:09:17.826805 IP 10.8.3.4.43722 > 99.181.101.248.1935: Flags [.], seq 117442:118756, ack 0, win 501, options [nop,nop,TS val 3706254459 ecr 3796216922], length 1314
05:09:17.883358 IP 99.181.101.248.1935 > 10.8.3.4.43722: Flags [.], ack 111776, win 126, options [nop,nop,TS val 3796217004 ecr 3706254226], length 0
05:09:17.893500 IP 10.8.3.4.43722 > 99.181.101.248.1935: Flags [.], seq 118756:120070, ack 0, win 501, options [nop,nop,TS val 3706254526 ecr 3796217004], length 1314
05:09:17.929693 IP 99.181.101.248.1935 > 10.8.3.4.43722: Flags [.], ack 114404, win 126, options [nop,nop,TS val 3796217051 ecr 3706254293], length 0
05:09:17.930229 IP 99.181.101.248.1935 > 10.8.3.4.43722: Flags [.], ack 114814, win 126, options [nop,nop,TS val 3796217051 ecr 3706254333], length 0
05:09:17.930257 IP 10.8.3.4.43722 > 99.181.101.248.1935: Flags [P.], seq 120070:120934, ack 0, win 501, options [nop,nop,TS val 3706254563 ecr 3796217051], length 864
05:09:17.958368 IP 10.8.3.4.43722 > 99.181.101.248.1935: Flags [.], seq 120934:122248, ack 0, win 501, options [nop,nop,TS val 3706254591 ecr 3796217051], length 1314
05:09:17.998100 IP 10.8.3.4.43722 > 99.181.101.248.1935: Flags [.], seq 122248:123562, ack 0, win 501, options [nop,nop,TS val 3706254631 ecr 3796217051], length 1314
05:09:18.035865 IP 99.181.101.248.1935 > 10.8.3.4.43722: Flags [.], ack 117442, win 126, options [nop,nop,TS val 3796217157 ecr 3706254396], length 0
05:09:18.059630 IP 10.8.3.4.43722 > 99.181.101.248.1935: Flags [.], seq 123562:124876, ack 0, win 501, options [nop,nop,TS val 3706254692 ecr 3796217157], length 1314
05:09:18.105010 IP 10.8.3.4.43722 > 99.181.101.248.1935: Flags [.], seq 124876:126190, ack 0, win 501, options [nop,nop,TS val 3706254738 ecr 3796217157], length 1314
05:09:18.123900 IP 99.181.101.248.1935 > 10.8.3.4.43722: Flags [.], ack 120070, win 126, options [nop,nop,TS val 3796217245 ecr 3706254459], length 0
05:09:18.126360 IP 10.8.3.4.43722 > 99.181.101.248.1935: Flags [.], seq 126190:127504, ack 0, win 501, options [nop,nop,TS val 3706254759 ecr 3796217245], length 1314
05:09:18.160288 IP 99.181.101.248.1935 > 10.8.3.4.43722: Flags [.], ack 120934, win 126, options [nop,nop,TS val 3796217281 ecr 3706254563], length 0
05:09:18.160320 IP 10.8.3.4.43722 > 99.181.101.248.1935: Flags [P.], seq 127504:127911, ack 0, win 501, options [nop,nop,TS val 3706254793 ecr 3796217281], length 407
05:09:18.192444 IP 10.8.3.4.43722 > 99.181.101.248.1935: Flags [.], seq 127911:129225, ack 0, win 501, options [nop,nop,TS val 3706254825 ecr 3796217281], length 1314
05:09:18.229261 IP 99.181.101.248.1935 > 10.8.3.4.43722: Flags [.], ack 123562, win 126, options [nop,nop,TS val 3796217350 ecr 3706254591], length 0
05:09:18.233578 IP 10.8.3.4.43722 > 99.181.101.248.1935: Flags [.], seq 129225:130539, ack 0, win 501, options [nop,nop,TS val 3706254866 ecr 3796217350], length 1314
05:09:18.291204 IP 10.8.3.4.43722 > 99.181.101.248.1935: Flags [.], seq 130539:131853, ack 0, win 501, options [nop,nop,TS val 3706254924 ecr 3796217350], length 1314
05:09:18.335228 IP 99.181.101.248.1935 > 10.8.3.4.43722: Flags [.], ack 126190, win 126, options [nop,nop,TS val 3796217456 ecr 3706254692], length 0
05:09:18.339899 IP 10.8.3.4.43722 > 99.181.101.248.1935: Flags [.], seq 131853:133167, ack 0, win 501, options [nop,nop,TS val 3706254973 ecr 3796217456], length 1314
05:09:18.361151 IP 10.8.3.4.43722 > 99.181.101.248.1935: Flags [.], seq 133167:134481, ack 0, win 501, options [nop,nop,TS val 3706254994 ecr 3796217456], length 1314
05:09:18.390572 IP 99.181.101.248.1935 > 10.8.3.4.43722: Flags [.], ack 127911, win 126, options [nop,nop,TS val 3796217511 ecr 3706254759], length 0
05:09:18.390681 IP 10.8.3.4.43722 > 99.181.101.248.1935: Flags [P.], seq 134481:134796, ack 0, win 501, options [nop,nop,TS val 3706255023 ecr 3796217511], length 315
05:09:18.426924 IP 10.8.3.4.43722 > 99.181.101.248.1935: Flags [.], seq 134796:136110, ack 0, win 501, options [nop,nop,TS val 3706255060 ecr 3796217511], length 1314
05:09:18.464110 IP 99.181.101.248.1935 > 10.8.3.4.43722: Flags [.], ack 130539, win 126, options [nop,nop,TS val 3796217585 ecr 3706254825], length 0
05:09:18.468484 IP 10.8.3.4.43722 > 99.181.101.248.1935: Flags [.], seq 136110:137424, ack 0, win 501, options [nop,nop,TS val 3706255101 ecr 3796217585], length 1314
05:09:18.511192 IP 10.8.3.4.43722 > 99.181.101.248.1935: Flags [.], seq 137424:138738, ack 0, win 501, options [nop,nop,TS val 3706255144 ecr 3796217585], length 1314
05:09:18.570091 IP 99.181.101.248.1935 > 10.8.3.4.43722: Flags [.], ack 133167, win 126, options [nop,nop,TS val 3796217691 ecr 3706254924], length 0
05:09:18.575289 IP 10.8.3.4.43722 > 99.181.101.248.1935: Flags [.], seq 138738:140052, ack 0, win 501, options [nop,nop,TS val 3706255208 ecr 3796217691], length 1314
05:09:18.596852 IP 10.8.3.4.43722 > 99.181.101.248.1935: Flags [.], seq 140052:141366, ack 0, win 501, options [nop,nop,TS val 3706255230 ecr 3796217691], length 1314
05:09:18.620958 IP 99.181.101.248.1935 > 10.8.3.4.43722: Flags [.], ack 134796, win 126, options [nop,nop,TS val 3796217742 ecr 3706254994], length 0
05:09:18.621001 IP 10.8.3.4.43722 > 99.181.101.248.1935: Flags [P.], seq 141366:141863, ack 0, win 501, options [nop,nop,TS val 3706255254 ecr 3796217742], length 497
05:09:18.660005 IP 10.8.3.4.43722 > 99.181.101.248.1935: Flags [.], seq 141863:143177, ack 0, win 501, options [nop,nop,TS val 3706255293 ecr 3796217742], length 1314
05:09:18.693416 IP 10.8.3.4.43722 > 99.181.101.248.1935: Flags [.], seq 143177:144491, ack 0, win 501, options [nop,nop,TS val 3706255326 ecr 3796217742], length 1314
05:09:18.698707 IP 99.181.101.248.1935 > 10.8.3.4.43722: Flags [.], ack 137424, win 126, options [nop,nop,TS val 3796217820 ecr 3706255060], length 0
05:09:18.746887 IP 10.8.3.4.43722 > 99.181.101.248.1935: Flags [.], seq 144491:145805, ack 0, win 501, options [nop,nop,TS val 3706255380 ecr 3796217820], length 1314
05:09:18.789671 IP 10.8.3.4.43722 > 99.181.101.248.1935: Flags [.], seq 145805:147119, ack 0, win 501, options [nop,nop,TS val 3706255422 ecr 3796217820], length 1314
05:09:18.805710 IP 99.181.101.248.1935 > 10.8.3.4.43722: Flags [.], ack 140052, win 126, options [nop,nop,TS val 3796217926 ecr 3706255144], length 0
05:09:18.826880 IP 10.8.3.4.43722 > 99.181.101.248.1935: Flags [.], seq 147119:148433, ack 0, win 501, options [nop,nop,TS val 3706255460 ecr 3796217926], length 1314
05:09:18.851395 IP 99.181.101.248.1935 > 10.8.3.4.43722: Flags [.], ack 141863, win 126, options [nop,nop,TS val 3796217972 ecr 3706255230], length 0
05:09:18.851436 IP 10.8.3.4.43722 > 99.181.101.248.1935: Flags [P.], seq 148433:148736, ack 0, win 501, options [nop,nop,TS val 3706255484 ecr 3796217972], length 303
05:09:18.891837 IP 10.8.3.4.43722 > 99.181.101.248.1935: Flags [.], seq 148736:150050, ack 0, win 501, options [nop,nop,TS val 3706255525 ecr 3796217972], length 1314
05:09:18.923888 IP 99.181.101.248.1935 > 10.8.3.4.43722: Flags [.], ack 144491, win 126, options [nop,nop,TS val 3796218045 ecr 3706255293], length 0
05:09:18.925753 IP 10.8.3.4.43722 > 99.181.101.248.1935: Flags [.], seq 150050:151364, ack 0, win 501, options [nop,nop,TS val 3706255558 ecr 3796218045], length 1314
05:09:18.961141 IP 10.8.3.4.43722 > 99.181.101.248.1935: Flags [.], seq 151364:152678, ack 0, win 501, options [nop,nop,TS val 3706255594 ecr 3796218045], length 1314
05:09:19.020113 IP 99.181.101.248.1935 > 10.8.3.4.43722: Flags [.], ack 147119, win 126, options [nop,nop,TS val 3796218141 ecr 3706255380], length 0
05:09:19.023893 IP 10.8.3.4.43722 > 99.181.101.248.1935: Flags [.], seq 152678:153992, ack 0, win 501, options [nop,nop,TS val 3706255657 ecr 3796218141], length 1314
05:09:19.057248 IP 10.8.3.4.43722 > 99.181.101.248.1935: Flags [.], seq 153992:155306, ack 0, win 501, options [nop,nop,TS val 3706255690 ecr 3796218141], length 1314
05:09:19.081434 IP 99.181.101.248.1935 > 10.8.3.4.43722: Flags [.], ack 148736, win 126, options [nop,nop,TS val 3796218202 ecr 3706255460], length 0
05:09:19.081454 IP 10.8.3.4.43722 > 99.181.101.248.1935: Flags [P.], seq 155306:155716, ack 0, win 501, options [nop,nop,TS val 3706255714 ecr 3796218202], length 410
05:09:19.125431 IP 10.8.3.4.43722 > 99.181.101.248.1935: Flags [.], seq 155716:157030, ack 0, win 501, options [nop,nop,TS val 3706255758 ecr 3796218202], length 1314
05:09:19.155956 IP 99.181.101.248.1935 > 10.8.3.4.43722: Flags [.], ack 151364, win 126, options [nop,nop,TS val 3796218277 ecr 3706255525], length 0
05:09:19.158749 IP 10.8.3.4.43722 > 99.181.101.248.1935: Flags [.], seq 157030:158344, ack 0, win 501, options [nop,nop,TS val 3706255791 ecr 3796218277], length 1314
05:09:19.195950 IP 10.8.3.4.43722 > 99.181.101.248.1935: Flags [.], seq 158344:159658, ack 0, win 501, options [nop,nop,TS val 3706255829 ecr 3796218277], length 1314
05:09:19.254168 IP 99.181.101.248.1935 > 10.8.3.4.43722: Flags [.], ack 153992, win 126, options [nop,nop,TS val 3796218375 ecr 3706255594], length 0
05:09:19.258844 IP 10.8.3.4.43722 > 99.181.101.248.1935: Flags [.], seq 159658:160972, ack 0, win 501, options [nop,nop,TS val 3706255892 ecr 3796218375], length 1314
05:09:19.292051 IP 10.8.3.4.43722 > 99.181.101.248.1935: Flags [.], seq 160972:162286, ack 0, win 501, options [nop,nop,TS val 3706255925 ecr 3796218375], length 1314
05:09:19.311502 IP 99.181.101.248.1935 > 10.8.3.4.43722: Flags [.], ack 155716, win 126, options [nop,nop,TS val 3796218432 ecr 3706255690], length 0
05:09:19.311525 IP 10.8.3.4.43722 > 99.181.101.248.1935: Flags [P.], seq 162286:162696, ack 0, win 501, options [nop,nop,TS val 3706255944 ecr 3796218432], length 410
05:09:19.360210 IP 10.8.3.4.43722 > 99.181.101.248.1935: Flags [.], seq 162696:164010, ack 0, win 501, options [nop,nop,TS val 3706255993 ecr 3796218432], length 1314
05:09:19.388974 IP 99.181.101.248.1935 > 10.8.3.4.43722: Flags [.], ack 158344, win 126, options [nop,nop,TS val 3796218510 ecr 3706255758], length 0
05:09:19.393226 IP 10.8.3.4.43722 > 99.181.101.248.1935: Flags [.], seq 164010:165324, ack 0, win 501, options [nop,nop,TS val 3706256026 ecr 3796218510], length 1314
05:09:19.431470 IP 10.8.3.4.43722 > 99.181.101.248.1935: Flags [.], seq 165324:166638, ack 0, win 501, options [nop,nop,TS val 3706256064 ecr 3796218510], length 1314
05:09:19.489266 IP 99.181.101.248.1935 > 10.8.3.4.43722: Flags [.], ack 160972, win 126, options [nop,nop,TS val 3796218610 ecr 3706255829], length 0
05:09:19.490237 IP 10.8.3.4.43722 > 99.181.101.248.1935: Flags [.], seq 166638:167952, ack 0, win 501, options [nop,nop,TS val 3706256123 ecr 3796218610], length 1314
05:09:19.522403 IP 10.8.3.4.43722 > 99.181.101.248.1935: Flags [.], seq 167952:169266, ack 0, win 501, options [nop,nop,TS val 3706256155 ecr 3796218610], length 1314
05:09:19.541615 IP 99.181.101.248.1935 > 10.8.3.4.43722: Flags [.], ack 162696, win 126, options [nop,nop,TS val 3796218663 ecr 3706255925], length 0
05:09:19.541627 IP 10.8.3.4.43722 > 99.181.101.248.1935: Flags [P.], seq 169266:169664, ack 0, win 501, options [nop,nop,TS val 3706256174 ecr 3796218663], length 398
05:09:19.589935 IP 10.8.3.4.43722 > 99.181.101.248.1935: Flags [.], seq 169664:170978, ack 0, win 501, options [nop,nop,TS val 3706256223 ecr 3796218663], length 1314
05:09:19.623770 IP 99.181.101.248.1935 > 10.8.3.4.43722: Flags [.], ack 165324, win 126, options [nop,nop,TS val 3796218745 ecr 3706255993], length 0
05:09:19.626548 IP 10.8.3.4.43722 > 99.181.101.248.1935: Flags [.], seq 170978:172292, ack 0, win 501, options [nop,nop,TS val 3706256259 ecr 3796218745], length 1314
05:09:19.666247 IP 10.8.3.4.43722 > 99.181.101.248.1935: Flags [.], seq 172292:173606, ack 0, win 501, options [nop,nop,TS val 3706256299 ecr 3796218745], length 1314
05:09:19.720367 IP 99.181.101.248.1935 > 10.8.3.4.43722: Flags [.], ack 167952, win 126, options [nop,nop,TS val 3796218841 ecr 3706256064], length 0
05:09:19.726007 IP 10.8.3.4.43722 > 99.181.101.248.1935: Flags [.], seq 173606:174920, ack 0, win 501, options [nop,nop,TS val 3706256359 ecr 3796218841], length 1314
05:09:19.759467 IP 10.8.3.4.43722 > 99.181.101.248.1935: Flags [.], seq 174920:176234, ack 0, win 501, options [nop,nop,TS val 3706256392 ecr 3796218841], length 1314
05:09:19.771662 IP 99.181.101.248.1935 > 10.8.3.4.43722: Flags [.], ack 169664, win 126, options [nop,nop,TS val 3796218893 ecr 3706256155], length 0
05:09:19.771698 IP 10.8.3.4.43722 > 99.181.101.248.1935: Flags [P.], seq 176234:176545, ack 0, win 501, options [nop,nop,TS val 3706256404 ecr 3796218893], length 311
05:09:19.823656 IP 10.8.3.4.43722 > 99.181.101.248.1935: Flags [.], seq 176545:177859, ack 0, win 501, options [nop,nop,TS val 3706256456 ecr 3796218893], length 1314
05:09:19.856934 IP 99.181.101.248.1935 > 10.8.3.4.43722: Flags [.], ack 172292, win 126, options [nop,nop,TS val 3796218978 ecr 3706256223], length 0
05:09:19.857450 IP 10.8.3.4.43722 > 99.181.101.248.1935: Flags [.], seq 177859:179173, ack 0, win 501, options [nop,nop,TS val 3706256490 ecr 3796218978], length 1314
05:09:19.891143 IP 10.8.3.4.43722 > 99.181.101.248.1935: Flags [.], seq 179173:180487, ack 0, win 501, options [nop,nop,TS val 3706256524 ecr 3796218978], length 1314
05:09:19.956363 IP 99.181.101.248.1935 > 10.8.3.4.43722: Flags [.], ack 174920, win 126, options [nop,nop,TS val 3796219077 ecr 3706256299], length 0
05:09:19.957042 IP 10.8.3.4.43722 > 99.181.101.248.1935: Flags [.], seq 180487:181801, ack 0, win 501, options [nop,nop,TS val 3706256590 ecr 3796219077], length 1314
05:09:19.993147 IP 10.8.3.4.43722 > 99.181.101.248.1935: Flags [.], seq 181801:183115, ack 0, win 501, options [nop,nop,TS val 3706256626 ecr 3796219077], length 1314
05:09:20.001647 IP 99.181.101.248.1935 > 10.8.3.4.43722: Flags [.], ack 176545, win 126, options [nop,nop,TS val 3796219123 ecr 3706256392], length 0
05:09:20.001661 IP 10.8.3.4.43722 > 99.181.101.248.1935: Flags [P.], seq 183115:183525, ack 0, win 501, options [nop,nop,TS val 3706256634 ecr 3796219123], length 410
05:09:20.055780 IP 10.8.3.4.43722 > 99.181.101.248.1935: Flags [.], seq 183525:184839, ack 0, win 501, options [nop,nop,TS val 3706256688 ecr 3796219123], length 1314
05:09:20.087735 IP 99.181.101.248.1935 > 10.8.3.4.43722: Flags [.], ack 179173, win 126, options [nop,nop,TS val 3796219209 ecr 3706256456], length 0
05:09:20.091318 IP 10.8.3.4.43722 > 99.181.101.248.1935: Flags [.], seq 184839:186153, ack 0, win 501, options [nop,nop,TS val 3706256724 ecr 3796219209], length 1314
05:09:20.125340 IP 10.8.3.4.43722 > 99.181.101.248.1935: Flags [.], seq 186153:187467, ack 0, win 501, options [nop,nop,TS val 3706256758 ecr 3796219209], length 1314
05:09:20.187089 IP 99.181.101.248.1935 > 10.8.3.4.43722: Flags [.], ack 181801, win 126, options [nop,nop,TS val 3796219308 ecr 3706256524], length 0
05:09:20.189281 IP 10.8.3.4.43722 > 99.181.101.248.1935: Flags [.], seq 187467:188781, ack 0, win 501, options [nop,nop,TS val 3706256822 ecr 3796219308], length 1314
05:09:20.223783 IP 10.8.3.4.43722 > 99.181.101.248.1935: Flags [.], seq 188781:190095, ack 0, win 501, options [nop,nop,TS val 3706256856 ecr 3796219308], length 1314
05:09:20.231856 IP 99.181.101.248.1935 > 10.8.3.4.43722: Flags [.], ack 183525, win 126, options [nop,nop,TS val 3796219353 ecr 3706256626], length 0
05:09:20.231877 IP 10.8.3.4.43722 > 99.181.101.248.1935: Flags [P.], seq 190095:190497, ack 0, win 501, options [nop,nop,TS val 3706256865 ecr 3796219353], length 402
05:09:20.293306 IP 10.8.3.4.43722 > 99.181.101.248.1935: Flags [.], seq 190497:191811, ack 0, win 501, options [nop,nop,TS val 3706256926 ecr 3796219353], length 1314
05:09:20.321567 IP 99.181.101.248.1935 > 10.8.3.4.43722: Flags [.], ack 186153, win 126, options [nop,nop,TS val 3796219443 ecr 3706256688], length 0
05:09:20.326468 IP 10.8.3.4.43722 > 99.181.101.248.1935: Flags [.], seq 191811:193125, ack 0, win 501, options [nop,nop,TS val 3706256959 ecr 3796219443], length 1314
05:09:20.358410 IP 10.8.3.4.43722 > 99.181.101.248.1935: Flags [.], seq 193125:194439, ack 0, win 501, options [nop,nop,TS val 3706256991 ecr 3796219443], length 1314
05:09:20.419492 IP 99.181.101.248.1935 > 10.8.3.4.43722: Flags [.], ack 188781, win 126, options [nop,nop,TS val 3796219541 ecr 3706256758], length 0
