01:44:22.264378 IP 10.8.0.3.55302 > 52.223.202.244.1935: Flags [.], seq 2577318277:2577319591, ack 1816010279, win 501, options [nop,nop,TS val 1028700455 ecr 120613280], length 1314
01:44:22.309223 IP 52.223.202.244.1935 > 10.8.0.3.55302: Flags [.], ack 4294959934, win 126, options [nop,nop,TS val 120613381 ecr 1028700113], length 0
01:44:22.313752 IP 10.8.0.3.55302 > 52.223.202.244.1935: Flags [.], seq 1314:2628, ack 1, win 501, options [nop,nop,TS val 1028700504 ecr 120613381], length 1314
01:44:22.347051 IP 10.8.0.3.55302 > 52.223.202.244.1935: Flags [.], seq 2628:3942, ack 1, win 501, options [nop,nop,TS val 1028700537 ecr 120613381], length 1314
01:44:22.381044 IP 52.223.202.244.1935 > 10.8.0.3.55302: Flags [.], ack 4294962562, win 126, options [nop,nop,TS val 120613453 ecr 1028700203], length 0
01:44:22.392950 IP 10.8.0.3.55302 > 52.223.202.244.1935: Flags [.], seq 3942:5256, ack 1, win 501, options [nop,nop,TS val 1028700583 ecr 120613453], length 1314
01:44:22.448066 IP 10.8.0.3.55302 > 52.223.202.244.1935: Flags [.], seq 5256:6570, ack 1, win 501, options [nop,nop,TS val 1028700638 ecr 120613453], length 1314
01:44:22.475002 IP 52.223.202.244.1935 > 10.8.0.3.55302: Flags [.], ack 4294964668, win 126, options [nop,nop,TS val 120613547 ecr 1028700304], length 0
01:44:22.475037 IP 10.8.0.3.55302 > 52.223.202.244.1935: Flags [P.], seq 6570:7276, ack 1, win 501, options [nop,nop,TS val 1028700665 ecr 120613547], length 706
01:44:22.513052 IP 10.8.0.3.55302 > 52.223.202.244.1935: Flags [.], seq 7276:8590, ack 1, win 501, options [nop,nop,TS val 1028700703 ecr 120613547], length 1314
01:44:22.545535 IP 52.223.202.244.1935 > 10.8.0.3.55302: Flags [.], ack 0, win 126, options [nop,nop,TS val 120613617 ecr 1028700371], length 0
01:44:22.547262 IP 10.8.0.3.55302 > 52.223.202.244.1935: Flags [.], seq 8590:9904, ack 1, win 501, options [nop,nop,TS val 1028700738 ecr 120613617], length 1314
01:44:22.585604 IP 10.8.0.3.55302 > 52.223.202.244.1935: Flags [.], seq 9904:11218, ack 1, win 501, options [nop,nop,TS val 1028700776 ecr 120613617], length 1314
01:44:22.643997 IP 52.223.202.244.1935 > 10.8.0.3.55302: Flags [.], ack 2628, win 126, options [nop,nop,TS val 120613716 ecr 1028700455], length 0
01:44:22.645966 IP 10.8.0.3.55302 > 52.223.202.244.1935: Flags [.], seq 11218:12532, ack 1, win 501, options [nop,nop,TS val 1028700836 ecr 120613716], length 1314
01:44:22.678024 IP 10.8.0.3.55302 > 52.223.202.244.1935: Flags [.], seq 12532:13846, ack 1, win 501, options [nop,nop,TS val 1028700868 ecr 120613716], length 1314
01:44:22.715197 IP 10.8.0.3.55302 > 52.223.202.244.1935: Flags [.], seq 13846:15160, ack 1, win 501, options [nop,nop,TS val 1028700905 ecr 120613716], length 1314
01:44:22.723301 IP 52.223.202.244.1935 > 10.8.0.3.55302: Flags [.], ack 5256, win 126, options [nop,nop,TS val 120613795 ecr 1028700537], length 0
01:44:22.778969 IP 10.8.0.3.55302 > 52.223.202.244.1935: Flags [.], seq 15160:16474, ack 1, win 501, options [nop,nop,TS val 1028700969 ecr 120613795], length 1314
01:44:22.805413 IP 52.223.202.244.1935 > 10.8.0.3.55302: Flags [.], ack 7276, win 126, options [nop,nop,TS val 120613877 ecr 1028700638], length 0
01:44:22.805427 IP 10.8.0.3.55302 > 52.223.202.244.1935: Flags [P.], seq 16474:17258, ack 1, win 501, options [nop,nop,TS val 1028700996 ecr 120613877], length 784
01:44:22.843700 IP 10.8.0.3.55302 > 52.223.202.244.1935: Flags [.], seq 17258:18572, ack 1, win 501, options [nop,nop,TS val 1028701034 ecr 120613877], length 1314
01:44:22.877963 IP 52.223.202.244.1935 > 10.8.0.3.55302: Flags [.], ack 9904, win 126, options [nop,nop,TS val 120613950 ecr 1028700703], length 0
01:44:22.878339 IP 10.8.0.3.55302 > 52.223.202.244.1935: Flags [.], seq 18572:19886, ack 1, win 501, options [nop,nop,TS val 1028701069 ecr 120613950], length 1314
01:44:22.927418 IP 10.8.0.3.55302 > 52.223.202.244.1935: Flags [.], seq 19886:21200, ack 1, win 501, options [nop,nop,TS val 1028701118 ecr 120613950], length 1314
01:44:22.976768 IP 52.223.202.244.1935 > 10.8.0.3.55302: Flags [.], ack 12532, win 126, options [nop,nop,TS val 120614048 ecr 1028700776], length 0
01:44:22.977782 IP 10.8.0.3.55302 > 52.223.202.244.1935: Flags [.], seq 21200:22514, ack 1, win 501, options [nop,nop,TS val 1028701168 ecr 120614048], length 1314
01:44:23.012409 IP 10.8.0.3.55302 > 52.223.202.244.1935: Flags [.], seq 22514:23828, ack 1, win 501, options [nop,nop,TS val 1028701203 ecr 120614048], length 1314
01:44:23.045814 IP 52.223.202.244.1935 > 10.8.0.3.55302: Flags [.], ack 15160, win 126, options [nop,nop,TS val 120614117 ecr 1028700868], length 0
01:44:23.054949 IP 10.8.0.3.55302 > 52.223.202.244.1935: Flags [.], seq 23828:25142, ack 1, win 501, options [nop,nop,TS val 1028701245 ecr 120614117], length 1314
01:44:23.115029 IP 10.8.0.3.55302 > 52.223.202.244.1935: Flags [.], seq 25142:26456, ack 1, win 501, options [nop,nop,TS val 1028701305 ecr 120614117], length 1314
01:44:23.135478 IP 52.223.202.244.1935 > 10.8.0.3.55302: Flags [.], ack 17258, win 126, options [nop,nop,TS val 120614207 ecr 1028700969], length 0
01:44:23.135519 IP 10.8.0.3.55302 > 52.223.202.244.1935: Flags [P.], seq 26456:27161, ack 1, win 501, options [nop,nop,TS val 1028701326 ecr 120614207], length 705
01:44:23.179656 IP 10.8.0.3.55302 > 52.223.202.244.1935: Flags [.], seq 27161:28475, ack 1, win 501, options [nop,nop,TS val 1028701370 ecr 120614207], length 1314
01:44:23.208742 IP 52.223.202.244.1935 > 10.8.0.3.55302: Flags [.], ack 19886, win 126, options [nop,nop,TS val 120614280 ecr 1028701034], length 0
01:44:23.213819 IP 10.8.0.3.55302 > 52.223.202.244.1935: Flags [.], seq 28475:29789, ack 1, win 501, options [nop,nop,TS val 1028701404 ecr 120614280], length 1314
01:44:23.247672 IP 10.8.0.3.55302 > 52.223.202.244.1935: Flags [.], seq 29789:31103, ack 1, win 501, options [nop,nop,TS val 1028701438 ecr 120614280], length 1314
01:44:23.308038 IP 52.223.202.244.1935 > 10.8.0.3.55302: Flags [.], ack 22514, win 126, options [nop,nop,TS val 120614380 ecr 1028701118], length 0
01:44:23.312225 IP 10.8.0.3.55302 > 52.223.202.244.1935: Flags [.], seq 31103:32417, ack 1, win 501, options [nop,nop,TS val 1028701503 ecr 120614380], length 1314
01:44:23.344505 IP 10.8.0.3.55302 > 52.223.202.244.1935: Flags [.], seq 32417:33731, ack 1, win 501, options [nop,nop,TS val 1028701535 ecr 120614380], length 1314
01:44:23.378401 IP 10.8.0.3.55302 > 52.223.202.244.1935: Flags [.], seq 33731:35045, ack 1, win 501, options [nop,nop,TS val 1028701569 ecr 120614380], length 1314
01:44:23.385613 IP 52.223.202.244.1935 > 10.8.0.3.55302: Flags [.], ack 25142, win 126, options [nop,nop,TS val 120614457 ecr 1028701203], length 0
01:44:23.449196 IP 10.8.0.3.55302 > 52.223.202.244.1935: Flags [.], seq 35045:36359, ack 1, win 501, options [nop,nop,TS val 1028701639 ecr 120614457], length 1314
01:44:23.465890 IP 52.223.202.244.1935 > 10.8.0.3.55302: Flags [.], ack 27161, win 126, options [nop,nop,TS val 120614538 ecr 1028701305], length 0
01:44:23.465958 IP 10.8.0.3.55302 > 52.223.202.244.1935: Flags [P.], seq 36359:37145, ack 1, win 501, options [nop,nop,TS val 1028701656 ecr 120614538], length 786
01:44:23.515958 IP 10.8.0.3.55302 > 52.223.202.244.1935: Flags [.], seq 37145:38459, ack 1, win 501, options [nop,nop,TS val 1028701706 ecr 120614538], length 1314
01:44:23.544868 IP 52.223.202.244.1935 > 10.8.0.3.55302: Flags [.], ack 29789, win 126, options [nop,nop,TS val 120614617 ecr 1028701370], length 0
01:44:23.547567 IP 10.8.0.3.55302 > 52.223.202.244.1935: Flags [.], seq 38459:39773, ack 1, win 501, options [nop,nop,TS val 1028701738 ecr 120614617], length 1314
01:44:23.590361 IP 10.8.0.3.55302 > 52.223.202.244.1935: Flags [.], seq 39773:41087, ack 1, win 501, options [nop,nop,TS val 1028701781 ecr 120614617], length 1314
01:44:23.642682 IP 52.223.202.244.1935 > 10.8.0.3.55302: Flags [.], ack 32417, win 126, options [nop,nop,TS val 120614714 ecr 1028701438], length 0
01:44:23.648318 IP 10.8.0.3.55302 > 52.223.202.244.1935: Flags [.], seq 41087:42401, ack 1, win 501, options [nop,nop,TS val 1028701839 ecr 120614714], length 1314
01:44:23.681956 IP 10.8.0.3.55302 > 52.223.202.244.1935: Flags [.], seq 42401:43715, ack 1, win 501, options [nop,nop,TS val 1028701872 ecr 120614714], length 1314
01:44:23.708614 IP 52.223.202.244.1935 > 10.8.0.3.55302: Flags [.], ack 35045, win 126, options [nop,nop,TS val 120614780 ecr 1028701535], length 0
01:44:23.718762 IP 10.8.0.3.55302 > 52.223.202.244.1935: Flags [.], seq 43715:45029, ack 1, win 501, options [nop,nop,TS val 1028701909 ecr 120614780], length 1314
01:44:23.782820 IP 10.8.0.3.55302 > 52.223.202.244.1935: Flags [.], seq 45029:46343, ack 1, win 501, options [nop,nop,TS val 1028701973 ecr 120614780], length 1314
01:44:23.796329 IP 52.223.202.244.1935 > 10.8.0.3.55302: Flags [.], ack 37145, win 126, options [nop,nop,TS val 120614868 ecr 1028701639], length 0
01:44:23.796342 IP 10.8.0.3.55302 > 52.223.202.244.1935: Flags [P.], seq 46343:47045, ack 1, win 501, options [nop,nop,TS val 1028701987 ecr 120614868], length 702
01:44:23.846377 IP 10.8.0.3.55302 > 52.223.202.244.1935: Flags [.], seq 47045:48359, ack 1, win 501, options [nop,nop,TS val 1028702037 ecr 120614868], length 1314
01:44:23.877993 IP 52.223.202.244.1935 > 10.8.0.3.55302: Flags [.], ack 39773, win 126, options [nop,nop,TS val 120614950 ecr 1028701706], length 0
01:44:23.878915 IP 10.8.0.3.55302 > 52.223.202.244.1935: Flags [.], seq 48359:49673, ack 1, win 501, options [nop,nop,TS val 1028702069 ecr 120614950], length 1314
01:44:23.916220 IP 10.8.0.3.55302 > 52.223.202.244.1935: Flags [.], seq 49673:50987, ack 1, win 501, options [nop,nop,TS val 1028702107 ecr 120614950], length 1314
01:44:23.978610 IP 52.223.202.244.1935 > 10.8.0.3.55302: Flags [.], ack 42401, win 126, options [nop,nop,TS val 120615050 ecr 1028701781], length 0
01:44:23.978764 IP 10.8.0.3.55302 > 52.223.202.244.1935: Flags [.], seq 50987:52301, ack 1, win 501, options [nop,nop,TS val 1028702169 ecr 120615050], length 1314
01:44:24.011925 IP 10.8.0.3.55302 > 52.223.202.244.1935: Flags [.], seq 52301:53615, ack 1, win 501, options [nop,nop,TS val 1028702202 ecr 120615050], length 1314
01:44:24.049094 IP 10.8.0.3.55302 > 52.223.202.244.1935: Flags [.], seq 53615:54929, ack 1, win 501, options [nop,nop,TS val 1028702239 ecr 120615050], length 1314
01:44:24.049439 IP 52.223.202.244.1935 > 10.8.0.3.55302: Flags [.], ack 45029, win 126, options [nop,nop,TS val 120615121 ecr 1028701872], length 0
01:44:24.111624 IP 10.8.0.3.55302 > 52.223.202.244.1935: Flags [.], seq 54929:56243, ack 1, win 501, options [nop,nop,TS val 1028702302 ecr 120615121], length 1314
01:44:24.126993 IP 52.223.202.244.1935 > 10.8.0.3.55302: Flags [.], ack 47045, win 126, options [nop,nop,TS val 120615199 ecr 1028701973], length 0
01:44:24.127010 IP 10.8.0.3.55302 > 52.223.202.244.1935: Flags [P.], seq 56243:57039, ack 1, win 501, options [nop,nop,TS val 1028702317 ecr 120615199], length 796
01:44:24.179088 IP 10.8.0.3.55302 > 52.223.202.244.1935: Flags [.], seq 57039:58353, ack 1, win 501, options [nop,nop,TS val 1028702369 ecr 120615199], length 1314
01:44:24.209727 IP 52.223.202.244.1935 > 10.8.0.3.55302: Flags [.], ack 49673, win 126, options [nop,nop,TS val 120615281 ecr 1028702037], length 0
01:44:24.214047 IP 10.8.0.3.55302 > 52.223.202.244.1935: Flags [.], seq 58353:59667, ack 1, win 501, options [nop,nop,TS val 1028702404 ecr 120615281], length 1314
01:44:24.252238 IP 10.8.0.3.55302 > 52.223.202.244.1935: Flags [.], seq 59667:60981, ack 1, win 501, options [nop,nop,TS val 1028702443 ecr 120615281], length 1314
01:44:24.309004 IP 52.223.202.244.1935 > 10.8.0.3.55302: Flags [.], ack 52301, win 126, options [nop,nop,TS val 120615381 ecr 1028702107], length 0
01:44:24.316224 IP 10.8.0.3.55302 > 52.223.202.244.1935: Flags [.], seq 60981:62295, ack 1, win 501, options [nop,nop,TS val 1028702507 ecr 120615381], length 1314
01:44:24.347865 IP 10.8.0.3.55302 > 52.223.202.244.1935: Flags [.], seq 62295:63609, ack 1, win 501, options [nop,nop,TS val 1028702538 ecr 120615381], length 1314
01:44:24.380059 IP 52.223.202.244.1935 > 10.8.0.3.55302: Flags [.], ack 54929, win 126, options [nop,nop,TS val 120615452 ecr 1028702202], length 0
01:44:24.380420 IP 10.8.0.3.55302 > 52.223.202.244.1935: Flags [.], seq 63609:64923, ack 1, win 501, options [nop,nop,TS val 1028702571 ecr 120615452], length 1314
01:44:24.444873 IP 10.8.0.3.55302 > 52.223.202.244.1935: Flags [.], seq 64923:66237, ack 1, win 501, options [nop,nop,TS val 1028702635 ecr 120615452], length 1314
01:44:24.457296 IP 52.223.202.244.1935 > 10.8.0.3.55302: Flags [.], ack 57039, win 126, options [nop,nop,TS val 120615529 ecr 1028702302], length 0
01:44:24.457339 IP 10.8.0.3.55302 > 52.223.202.244.1935: Flags [P.], seq 66237:66931, ack 1, win 501, options [nop,nop,TS val 1028702648 ecr 120615529], length 694
01:44:24.512716 IP 10.8.0.3.55302 > 52.223.202.244.1935: Flags [.], seq 66931:68245, ack 1, win 501, options [nop,nop,TS val 1028702703 ecr 120615529], length 1314
01:44:24.544418 IP 52.223.202.244.1935 > 10.8.0.3.55302: Flags [.], ack 59667, win 126, options [nop,nop,TS val 120615616 ecr 1028702369], length 0
01:44:24.544870 IP 10.8.0.3.55302 > 52.223.202.244.1935: Flags [.], seq 68245:69559, ack 1, win 501, options [nop,nop,TS val 1028702735 ecr 120615616], length 1314
01:44:24.578536 IP 10.8.0.3.55302 > 52.223.202.244.1935: Flags [.], seq 69559:70873, ack 1, win 501, options [nop,nop,TS val 1028702769 ecr 120615616], length 1314
01:44:24.644066 IP 10.8.0.3.55302 > 52.223.202.244.1935: Flags [.], seq 70873:72187, ack 1, win 501, options [nop,nop,TS val 1028702834 ecr 120615616], length 1314
01:44:24.646655 IP 52.223.202.244.1935 > 10.8.0.3.55302: Flags [.], ack 62295, win 126, options [nop,nop,TS val 120615719 ecr 1028702443], length 0
01:44:24.680425 IP 10.8.0.3.55302 > 52.223.202.244.1935: Flags [.], seq 72187:73501, ack 1, win 501, options [nop,nop,TS val 1028702871 ecr 120615719], length 1314
01:44:24.710768 IP 52.223.202.244.1935 > 10.8.0.3.55302: Flags [.], ack 64923, win 126, options [nop,nop,TS val 120615783 ecr 1028702538], length 0
01:44:24.714708 IP 10.8.0.3.55302 > 52.223.202.244.1935: Flags [.], seq 73501:74815, ack 1, win 501, options [nop,nop,TS val 1028702905 ecr 120615783], length 1314
01:44:24.778021 IP 10.8.0.3.55302 > 52.223.202.244.1935: Flags [.], seq 74815:76129, ack 1, win 501, options [nop,nop,TS val 1028702968 ecr 120615783], length 1314
01:44:24.787607 IP 52.223.202.244.1935 > 10.8.0.3.55302: Flags [.], ack 66931, win 126, options [nop,nop,TS val 120615860 ecr 1028702635], length 0
01:44:24.787625 IP 10.8.0.3.55302 > 52.223.202.244.1935: Flags [P.], seq 76129:76929, ack 1, win 501, options [nop,nop,TS val 1028702978 ecr 120615860], length 800
01:44:24.850042 IP 10.8.0.3.55302 > 52.223.202.244.1935: Flags [.], seq 76929:78243, ack 1, win 501, options [nop,nop,TS val 1028703040 ecr 120615860], length 1314
01:44:24.875095 IP 52.223.202.244.1935 > 10.8.0.3.55302: Flags [.], ack 69559, win 126, options [nop,nop,TS val 120615947 ecr 1028702703], length 0
01:44:24.881349 IP 10.8.0.3.55302 > 52.223.202.244.1935: Flags [.], seq 78243:79557, ack 1, win 501, options [nop,nop,TS val 1028703072 ecr 120615947], length 1314
01:44:24.914734 IP 10.8.0.3.55302 > 52.223.202.244.1935: Flags [.], seq 79557:80871, ack 1, win 501, options [nop,nop,TS val 1028703105 ecr 120615947], length 1314
01:44:24.974545 IP 52.223.202.244.1935 > 10.8.0.3.55302: Flags [.], ack 72187, win 126, options [nop,nop,TS val 120616046 ecr 1028702769], length 0
01:44:24.981396 IP 10.8.0.3.55302 > 52.223.202.244.1935: Flags [.], seq 80871:82185, ack 1, win 501, options [nop,nop,TS val 1028703172 ecr 120616046], length 1314
01:44:25.010379 IP 10.8.0.3.55302 > 52.223.202.244.1935: Flags [.], seq 82185:83499, ack 1, win 501, options [nop,nop,TS val 1028703201 ecr 120616046], length 1314
01:44:25.043701 IP 10.8.0.3.55302 > 52.223.202.244.1935: Flags [.], seq 83499:84813, ack 1, win 501, options [nop,nop,TS val 1028703234 ecr 120616046], length 1314
01:44:25.044759 IP 52.223.202.244.1935 > 10.8.0.3.55302: Flags [.], ack 74815, win 126, options [nop,nop,TS val 120616117 ecr 1028702871], length 0
01:44:25.114865 IP 10.8.0.3.55302 > 52.223.202.244.1935: Flags [.], seq 84813:86127, ack 1, win 501, options [nop,nop,TS val 1028703305 ecr 120616117], length 1314
01:44:25.117673 IP 52.223.202.244.1935 > 10.8.0.3.55302: Flags [.], ack 76929, win 126, options [nop,nop,TS val 120616190 ecr 1028702968], length 0
01:44:25.117716 IP 10.8.0.3.55302 > 52.223.202.244.1935: Flags [P.], seq 86127:86812, ack 1, win 501, options [nop,nop,TS val 1028703308 ecr 120616190], length 685
01:44:25.181272 IP 10.8.0.3.55302 > 52.223.202.244.1935: Flags [.], seq 86812:88126, ack 1, win 501, options [nop,nop,TS val 1028703372 ecr 120616190], length 1314
01:44:25.212422 IP 52.223.202.244.1935 > 10.8.0.3.55302: Flags [.], ack 79557, win 126, options [nop,nop,TS val 120616284 ecr 1028703040], length 0
01:44:25.214418 IP 10.8.0.3.55302 > 52.223.202.244.1935: Flags [.], seq 88126:89440, ack 1, win 501, options [nop,nop,TS val 1028703405 ecr 120616284], length 1314
01:44:25.236514 IP 10.8.0.3.55302 > 52.223.202.244.1935: Flags [.], seq 89440:90754, ack 1, win 501, options [nop,nop,TS val 1028703427 ecr 120616284], length 1314
01:44:25.301013 IP 10.8.0.3.55302 > 52.223.202.244.1935: Flags [.], seq 90754:92068, ack 1, win 501, options [nop,nop,TS val 1028703491 ecr 120616284], length 1314
01:44:25.309986 IP 52.223.202.244.1935 > 10.8.0.3.55302: Flags [.], ack 80871, win 126, options [nop,nop,TS val 120616382 ecr 1028703105], length 0
01:44:25.341387 IP 52.223.202.244.1935 > 10.8.0.3.55302: Flags [.], ack 83499, win 126, options [nop,nop,TS val 120616413 ecr 1028703172], length 0
01:44:25.344094 IP 10.8.0.3.55302 > 52.223.202.244.1935: Flags [.], seq 92068:93382, ack 1, win 501, options [nop,nop,TS val 1028703534 ecr 120616413], length 1314
01:44:25.381408 IP 10.8.0.3.55302 > 52.223.202.244.1935: Flags [.], seq 93382:94696, ack 1, win 501, options [nop,nop,TS val 1028703572 ecr 120616413], length 1314
01:44:25.445269 IP 52.223.202.244.1935 > 10.8.0.3.55302: Flags [.], ack 86127, win 126, options [nop,nop,TS val 120616517 ecr 1028703234], length 0
01:44:25.445589 IP 10.8.0.3.55302 > 52.223.202.244.1935: Flags [.], seq 94696:96010, ack 1, win 501, options [nop,nop,TS val 1028703636 ecr 120616517], length 1314
01:44:25.448291 IP 52.223.202.244.1935 > 10.8.0.3.55302: Flags [.], ack 86812, win 126, options [nop,nop,TS val 120616520 ecr 1028703308], length 0
01:44:25.448312 IP 10.8.0.3.55302 > 52.223.202.244.1935: Flags [P.], seq 96010:96812, ack 1, win 501, options [nop,nop,TS val 1028703639 ecr 120616520], length 802
01:44:25.512451 IP 10.8.0.3.55302 > 52.223.202.244.1935: Flags [.], seq 96812:98126, ack 1, win 501, options [nop,nop,TS val 1028703703 ecr 120616520], length 1314
01:44:25.535981 IP 10.8.0.3.55302 > 52.223.202.244.1935: Flags [.], seq 98126:99440, ack 1, win 501, options [nop,nop,TS val 1028703726 ecr 120616520], length 1314
01:44:25.544844 IP 52.223.202.244.1935 > 10.8.0.3.55302: Flags [.], ack 89440, win 126, options [nop,nop,TS val 120616617 ecr 1028703372], length 0
01:44:25.577450 IP 10.8.0.3.55302 > 52.223.202.244.1935: Flags [.], seq 99440:100754, ack 1, win 501, options [nop,nop,TS val 1028703768 ecr 120616617], length 1314
01:44:25.631517 IP 52.223.202.244.1935 > 10.8.0.3.55302: Flags [.], ack 92068, win 126, options [nop,nop,TS val 120616703 ecr 1028703427], length 0
01:44:25.642826 IP 10.8.0.3.55302 > 52.223.202.244.1935: Flags [.], seq 100754:102068, ack 1, win 501, options [nop,nop,TS val 1028703833 ecr 120616703], length 1314
01:44:25.681072 IP 10.8.0.3.55302 > 52.223.202.244.1935: Flags [.], seq 102068:103382, ack 1, win 501, options [nop,nop,TS val 1028703871 ecr 120616703], length 1314
01:44:25.707157 IP 10.8.0.3.55302 > 52.223.202.244.1935: Flags [.], seq 103382:104696, ack 1, win 501, options [nop,nop,TS val 1028703897 ecr 120616703], length 1314
01:44:25.712227 IP 52.223.202.244.1935 > 10.8.0.3.55302: Flags [.], ack 94696, win 126, options [nop,nop,TS val 120616784 ecr 1028703534], length 0
01:44:25.771595 IP 10.8.0.3.55302 > 52.223.202.244.1935: Flags [.], seq 104696:106010, ack 1, win 501, options [nop,nop,TS val 1028703962 ecr 120616784], length 1314
01:44:25.779782 IP 52.223.202.244.1935 > 10.8.0.3.55302: Flags [.], ack 96812, win 126, options [nop,nop,TS val 120616851 ecr 1028703636], length 0
01:44:25.779817 IP 10.8.0.3.55302 > 52.223.202.244.1935: Flags [P.], seq 106010:106708, ack 1, win 501, options [nop,nop,TS val 1028703970 ecr 120616851], length 698
01:44:25.835789 IP 10.8.0.3.55302 > 52.223.202.244.1935: Flags [.], seq 106708:108022, ack 1, win 501, options [nop,nop,TS val 1028704026 ecr 120616851], length 1314
01:44:25.866073 IP 52.223.202.244.1935 > 10.8.0.3.55302: Flags [.], ack 99440, win 126, options [nop,nop,TS val 120616938 ecr 1028703703], length 0
01:44:25.878346 IP 10.8.0.3.55302 > 52.223.202.244.1935: Flags [.], seq 108022:109336, ack 1, win 501, options [nop,nop,TS val 1028704069 ecr 120616938], length 1314
01:44:25.914799 IP 10.8.0.3.55302 > 52.223.202.244.1935: Flags [.], seq 109336:110650, ack 1, win 501, options [nop,nop,TS val 1028704105 ecr 120616938], length 1314
01:44:25.974249 IP 52.223.202.244.1935 > 10.8.0.3.55302: Flags [.], ack 102068, win 126, options [nop,nop,TS val 120617045 ecr 1028703768], length 0
01:44:25.978021 IP 10.8.0.3.55302 > 52.223.202.244.1935: Flags [.], seq 110650:111964, ack 1, win 501, options [nop,nop,TS val 1028704168 ecr 120617045], length 1314
01:44:26.006768 IP 10.8.0.3.55302 > 52.223.202.244.1935: Flags [.], seq 111964:113278, ack 1, win 501, options [nop,nop,TS val 1028704197 ecr 120617045], length 1314
01:44:26.037474 IP 52.223.202.244.1935 > 10.8.0.3.55302: Flags [.], ack 104696, win 126, options [nop,nop,TS val 120617109 ecr 1028703871], length 0
01:44:26.048153 IP 10.8.0.3.55302 > 52.223.202.244.1935: Flags [.], seq 113278:114592, ack 1, win 501, options [nop,nop,TS val 1028704238 ecr 120617109], length 1314
01:44:26.110071 IP 52.223.202.244.1935 > 10.8.0.3.55302: Flags [.], ack 106708, win 126, options [nop,nop,TS val 120617182 ecr 1028703962], length 0
01:44:26.110106 IP 10.8.0.3.55302 > 52.223.202.244.1935: Flags [P.], seq 114592:115851, ack 1, win 501, options [nop,nop,TS val 1028704300 ecr 120617182], length 1259
01:44:26.135147 IP 10.8.0.3.55302 > 52.223.202.244.1935: Flags [.], seq 115851:117165, ack 1, win 501, options [nop,nop,TS val 1028704325 ecr 120617182], length 1314
01:44:26.178217 IP 10.8.0.3.55302 > 52.223.202.244.1935: Flags [.], seq 117165:118479, ack 1, win 501, options [nop,nop,TS val 1028704369 ecr 120617182], length 1314
01:44:26.208965 IP 52.223.202.244.1935 > 10.8.0.3.55302: Flags [.], ack 109336, win 126, options [nop,nop,TS val 120617281 ecr 1028704026], length 0
01:44:26.221302 IP 10.8.0.3.55302 > 52.223.202.244.1935: Flags [.], seq 118479:119793, ack 1, win 501, options [nop,nop,TS val 1028704412 ecr 120617281], length 1314
01:44:26.280358 IP 10.8.0.3.55302 > 52.223.202.244.1935: Flags [.], seq 119793:121107, ack 1, win 501, options [nop,nop,TS val 1028704471 ecr 120617281], length 1314
01:44:26.306791 IP 10.8.0.3.55302 > 52.223.202.244.1935: Flags [.], seq 121107:122421, ack 1, win 501, options [nop,nop,TS val 1028704497 ecr 120617281], length 1314
01:44:26.308111 IP 52.223.202.244.1935 > 10.8.0.3.55302: Flags [.], ack 111964, win 126, options [nop,nop,TS val 120617380 ecr 1028704105], length 0
01:44:26.349694 IP 10.8.0.3.55302 > 52.223.202.244.1935: Flags [.], seq 122421:123735, ack 1, win 501, options [nop,nop,TS val 1028704540 ecr 120617380], length 1314
01:44:26.379110 IP 52.223.202.244.1935 > 10.8.0.3.55302: Flags [.], ack 114592, win 126, options [nop,nop,TS val 120617450 ecr 1028704197], length 0
01:44:26.411500 IP 10.8.0.3.55302 > 52.223.202.244.1935: Flags [.], seq 123735:125049, ack 1, win 501, options [nop,nop,TS val 1028704602 ecr 120617450], length 1314
01:44:26.440984 IP 52.223.202.244.1935 > 10.8.0.3.55302: Flags [.], ack 115851, win 126, options [nop,nop,TS val 120617513 ecr 1028704300], length 0
01:44:26.441005 IP 10.8.0.3.55302 > 52.223.202.244.1935: Flags [P.], seq 125049:125845, ack 1, win 501, options [nop,nop,TS val 1028704631 ecr 120617513], length 796
01:44:26.477177 IP 10.8.0.3.55302 > 52.223.202.244.1935: Flags [.], seq 125845:127159, ack 1, win 501, options [nop,nop,TS val 1028704667 ecr 120617513], length 1314
01:44:26.508950 IP 52.223.202.244.1935 > 10.8.0.3.55302: Flags [.], ack 118479, win 126, options [nop,nop,TS val 120617581 ecr 1028704325], length 0
01:44:26.511573 IP 10.8.0.3.55302 > 52.223.202.244.1935: Flags [.], seq 127159:128473, ack 1, win 501, options [nop,nop,TS val 1028704702 ecr 120617581], length 1314
01:44:26.562646 IP 10.8.0.3.55302 > 52.223.202.244.1935: Flags [.], seq 128473:129787, ack 1, win 501, options [nop,nop,TS val 1028704753 ecr 120617581], length 1314
01:44:26.605603 IP 10.8.0.3.55302 > 52.223.202.244.1935: Flags [.], seq 129787:131101, ack 1, win 501, options [nop,nop,TS val 1028704796 ecr 120617581], length 1314
01:44:26.634129 IP 52.223.202.244.1935 > 10.8.0.3.55302: Flags [.], ack 119793, win 126, options [nop,nop,TS val 120617706 ecr 1028704412], length 0
01:44:26.638116 IP 52.223.202.244.1935 > 10.8.0.3.55302: Flags [.], ack 119793, win 126, options [nop,nop,TS val 120617709 ecr 1028704412,nop,nop,sack 1 {121107:122421}], length 0
01:44:26.646255 IP 10.8.0.3.55302 > 52.223.202.244.1935: Flags [.], seq 131101:132415, ack 1, win 501, options [nop,nop,TS val 1028704837 ecr 120617709], length 1314
01:44:26.680720 IP 52.223.202.244.1935 > 10.8.0.3.55302: Flags [.], ack 119793, win 126, options [nop,nop,TS val 120617753 ecr 1028704412,nop,nop,sack 1 {121107:123735}], length 0
01:44:26.691096 IP 10.8.0.3.55302 > 52.223.202.244.1935: Flags [.], seq 132415:133729, ack 1, win 501, options [nop,nop,TS val 1028704881 ecr 120617753], length 1314
01:44:26.710155 IP 10.8.0.3.55302 > 52.223.202.244.1935: Flags [.], seq 119793:121107, ack 1, win 501, options [nop,nop,TS val 1028704900 ecr 120617753], length 1314
01:44:26.742629 IP 52.223.202.244.1935 > 10.8.0.3.55302: Flags [.], ack 119793, win 126, options [nop,nop,TS val 120617814 ecr 1028704412,nop,nop,sack 1 {121107:125049}], length 0
01:44:26.743755 IP 10.8.0.3.55302 > 52.223.202.244.1935: Flags [.], seq 133729:135043, ack 1, win 501, options [nop,nop,TS val 1028704934 ecr 120617814], length 1314
01:44:26.772847 IP 52.223.202.244.1935 > 10.8.0.3.55302: Flags [.], ack 119793, win 126, options [nop,nop,TS val 120617844 ecr 1028704412,nop,nop,sack 1 {121107:125845}], length 0
01:44:26.775984 IP 10.8.0.3.55302 > 52.223.202.244.1935: Flags [.], seq 135043:136357, ack 1, win 501, options [nop,nop,TS val 1028704966 ecr 120617844], length 1314
01:44:26.809359 IP 52.223.202.244.1935 > 10.8.0.3.55302: Flags [.], ack 119793, win 126, options [nop,nop,TS val 120617880 ecr 1028704412,nop,nop,sack 1 {121107:127159}], length 0
01:44:26.818672 IP 10.8.0.3.55302 > 52.223.202.244.1935: Flags [.], seq 136357:137671, ack 1, win 501, options [nop,nop,TS val 1028705009 ecr 120617880], length 1314
01:44:26.843802 IP 52.223.202.244.1935 > 10.8.0.3.55302: Flags [.], ack 119793, win 126, options [nop,nop,TS val 120617915 ecr 1028704412,nop,nop,sack 1 {121107:128473}], length 0
01:44:26.881297 IP 10.8.0.3.55302 > 52.223.202.244.1935: Flags [.], seq 137671:138985, ack 1, win 501, options [nop,nop,TS val 1028705072 ecr 120617915], length 1314
01:44:26.894773 IP 52.223.202.244.1935 > 10.8.0.3.55302: Flags [.], ack 119793, win 126, options [nop,nop,TS val 120617965 ecr 1028704412,nop,nop,sack 1 {121107:129787}], length 0
01:44:26.904659 IP 10.8.0.3.55302 > 52.223.202.244.1935: Flags [.], seq 138985:140299, ack 1, win 501, options [nop,nop,TS val 1028705095 ecr 120617965], length 1314
01:44:26.937925 IP 52.223.202.244.1935 > 10.8.0.3.55302: Flags [.], ack 119793, win 126, options [nop,nop,TS val 120618008 ecr 1028704412,nop,nop,sack 1 {121107:131101}], length 0
01:44:26.947397 IP 10.8.0.3.55302 > 52.223.202.244.1935: Flags [.], seq 140299:141613, ack 1, win 501, options [nop,nop,TS val 1028705138 ecr 120618008], length 1314
01:44:26.978048 IP 52.223.202.244.1935 > 10.8.0.3.55302: Flags [.], ack 119793, win 126, options [nop,nop,TS val 120618049 ecr 1028704412,nop,nop,sack 1 {121107:132415}], length 0
01:44:27.010387 IP 10.8.0.3.55302 > 52.223.202.244.1935: Flags [.], seq 141613:142927, ack 1, win 501, options [nop,nop,TS val 1028705201 ecr 120618049], length 1314
01:44:27.023076 IP 52.223.202.244.1935 > 10.8.0.3.55302: Flags [.], ack 119793, win 126, options [nop,nop,TS val 120618094 ecr 1028704412,nop,nop,sack 1 {121107:133729}], length 0
01:44:27.041401 IP 52.223.202.244.1935 > 10.8.0.3.55302: Flags [.], ack 133729, win 109, options [nop,nop,TS val 120618113 ecr 1028704900], length 0
01:44:27.041431 IP 10.8.0.3.55302 > 52.223.202.244.1935: Flags [P.], seq 142927:143751, ack 1, win 501, options [nop,nop,TS val 1028705232 ecr 120618113], length 824
01:44:27.074776 IP 52.223.202.244.1935 > 10.8.0.3.55302: Flags [.], ack 135043, win 131, options [nop,nop,TS val 120618146 ecr 1028704934], length 0
01:44:27.075142 IP 10.8.0.3.55302 > 52.223.202.244.1935: Flags [.], seq 143751:145065, ack 1, win 501, options [nop,nop,TS val 1028705265 ecr 120618146], length 1314
01:44:27.106947 IP 52.223.202.244.1935 > 10.8.0.3.55302: Flags [.], ack 136357, win 137, options [nop,nop,TS val 120618179 ecr 1028704966], length 0
01:44:27.114771 IP 10.8.0.3.55302 > 52.223.202.244.1935: Flags [.], seq 145065:146379, ack 1, win 501, options [nop,nop,TS val 1028705305 ecr 120618179], length 1314
01:44:27.149107 IP 52.223.202.244.1935 > 10.8.0.3.55302: Flags [.], ack 137671, win 141, options [nop,nop,TS val 120618221 ecr 1028705009], length 0
01:44:27.160382 IP 10.8.0.3.55302 > 52.223.202.244.1935: Flags [.], seq 146379:147693, ack 1, win 501, options [nop,nop,TS val 1028705351 ecr 120618221], length 1314
01:44:27.203090 IP 10.8.0.3.55302 > 52.223.202.244.1935: Flags [.], seq 147693:149007, ack 1, win 501, options [nop,nop,TS val 1028705393 ecr 120618221], length 1314
01:44:27.235963 IP 52.223.202.244.1935 > 10.8.0.3.55302: Flags [.], ack 140299, win 141, options [nop,nop,TS val 120618308 ecr 1028705072], length 0
01:44:27.246372 IP 10.8.0.3.55302 > 52.223.202.244.1935: Flags [.], seq 149007:150321, ack 1, win 501, options [nop,nop,TS val 1028705437 ecr 120618308], length 1314
01:44:27.289018 IP 10.8.0.3.55302 > 52.223.202.244.1935: Flags [.], seq 150321:151635, ack 1, win 501, options [nop,nop,TS val 1028705479 ecr 120618308], length 1314
01:44:27.329931 IP 52.223.202.244.1935 > 10.8.0.3.55302: Flags [.], ack 141613, win 141, options [nop,nop,TS val 120618402 ecr 1028705138], length 0
01:44:27.346189 IP 10.8.0.3.55302 > 52.223.202.244.1935: Flags [.], seq 151635:152949, ack 1, win 501, options [nop,nop,TS val 1028705536 ecr 120618402], length 1314
01:44:27.371929 IP 52.223.202.244.1935 > 10.8.0.3.55302: Flags [.], ack 143751, win 141, options [nop,nop,TS val 120618444 ecr 1028705201], length 0
01:44:27.371956 IP 10.8.0.3.55302 > 52.223.202.244.1935: Flags [P.], seq 152949:153647, ack 1, win 501, options [nop,nop,TS val 1028705562 ecr 120618444], length 698
01:44:27.413775 IP 10.8.0.3.55302 > 52.223.202.244.1935: Flags [.], seq 153647:154961, ack 1, win 501, options [nop,nop,TS val 1028705604 ecr 120618444], length 1314
01:44:27.438689 IP 10.8.0.3.55302 > 52.223.202.244.1935: Flags [.], seq 154961:156275, ack 1, win 501, options [nop,nop,TS val 1028705629 ecr 120618444], length 1314
01:44:27.445462 IP 52.223.202.244.1935 > 10.8.0.3.55302: Flags [.], ack 146379, win 141, options [nop,nop,TS val 120618517 ecr 1028705265], length 0
01:44:27.481318 IP 10.8.0.3.55302 > 52.223.202.244.1935: Flags [.], seq 156275:157589, ack 1, win 501, options [nop,nop,TS val 1028705672 ecr 120618517], length 1314
01:44:27.533521 IP 52.223.202.244.1935 > 10.8.0.3.55302: Flags [.], ack 149007, win 141, options [nop,nop,TS val 120618605 ecr 1028705351], length 0
01:44:27.546182 IP 10.8.0.3.55302 > 52.223.202.244.1935: Flags [.], seq 157589:158903, ack 1, win 501, options [nop,nop,TS val 1028705736 ecr 120618605], length 1314
01:44:27.579458 IP 10.8.0.3.55302 > 52.223.202.244.1935: Flags [.], seq 158903:160217, ack 1, win 501, options [nop,nop,TS val 1028705770 ecr 120618605], length 1314
01:44:27.613693 IP 10.8.0.3.55302 > 52.223.202.244.1935: Flags [.], seq 160217:161531, ack 1, win 501, options [nop,nop,TS val 1028705804 ecr 120618605], length 1314
01:44:27.619509 IP 52.223.202.244.1935 > 10.8.0.3.55302: Flags [.], ack 151635, win 141, options [nop,nop,TS val 120618691 ecr 1028705437], length 0
01:44:27.674827 IP 10.8.0.3.55302 > 52.223.202.244.1935: Flags [.], seq 161531:162845, ack 1, win 501, options [nop,nop,TS val 1028705865 ecr 120618691], length 1314
01:44:27.702749 IP 52.223.202.244.1935 > 10.8.0.3.55302: Flags [.], ack 153647, win 141, options [nop,nop,TS val 120618774 ecr 1028705536], length 0
01:44:27.702777 IP 10.8.0.3.55302 > 52.223.202.244.1935: Flags [P.], seq 162845:163638, ack 1, win 501, options [nop,nop,TS val 1028705893 ecr 120618774], length 793
01:44:27.738914 IP 10.8.0.3.55302 > 52.223.202.244.1935: Flags [.], seq 163638:164952, ack 1, win 501, options [nop,nop,TS val 1028705929 ecr 120618774], length 1314
01:44:27.769148 IP 52.223.202.244.1935 > 10.8.0.3.55302: Flags [.], ack 156275, win 141, options [nop,nop,TS val 120618841 ecr 1028705604], length 0
01:44:27.780977 IP 10.8.0.3.55302 > 52.223.202.244.1935: Flags [.], seq 164952:166266, ack 1, win 501, options [nop,nop,TS val 1028705971 ecr 120618841], length 1314
01:44:27.824784 IP 10.8.0.3.55302 > 52.223.202.244.1935: Flags [.], seq 166266:167580, ack 1, win 501, options [nop,nop,TS val 1028706015 ecr 120618841], length 1314
01:44:27.858131 IP 52.223.202.244.1935 > 10.8.0.3.55302: Flags [.], ack 157589, win 141, options [nop,nop,TS val 120618930 ecr 1028705672], length 0
01:44:27.880699 IP 10.8.0.3.55302 > 52.223.202.244.1935: Flags [.], seq 167580:168894, ack 1, win 501, options [nop,nop,TS val 1028706071 ecr 120618930], length 1314
01:44:27.910237 IP 52.223.202.244.1935 > 10.8.0.3.55302: Flags [.], ack 160217, win 141, options [nop,nop,TS val 120618982 ecr 1028705736], length 0
01:44:27.910344 IP 10.8.0.3.55302 > 52.223.202.244.1935: Flags [.], seq 168894:170208, ack 1, win 501, options [nop,nop,TS val 1028706101 ecr 120618982], length 1314
01:44:27.953272 IP 10.8.0.3.55302 > 52.223.202.244.1935: Flags [.], seq 170208:171522, ack 1, win 501, options [nop,nop,TS val 1028706144 ecr 120618982], length 1314
01:44:28.005215 IP 52.223.202.244.1935 > 10.8.0.3.55302: Flags [.], ack 162845, win 141, options [nop,nop,TS val 120619077 ecr 1028705804], length 0
01:44:28.012916 IP 10.8.0.3.55302 > 52.223.202.244.1935: Flags [.], seq 171522:172836, ack 1, win 501, options [nop,nop,TS val 1028706203 ecr 120619077], length 1314
01:44:28.035183 IP 52.223.202.244.1935 > 10.8.0.3.55302: Flags [.], ack 163638, win 141, options [nop,nop,TS val 120619105 ecr 1028705893], length 0
01:44:28.035209 IP 10.8.0.3.55302 > 52.223.202.244.1935: Flags [P.], seq 172836:173541, ack 1, win 501, options [nop,nop,TS val 1028706226 ecr 120619105], length 705
01:44:28.081135 IP 10.8.0.3.55302 > 52.223.202.244.1935: Flags [.], seq 173541:174855, ack 1, win 501, options [nop,nop,TS val 1028706271 ecr 120619105], length 1314
01:44:28.111596 IP 52.223.202.244.1935 > 10.8.0.3.55302: Flags [.], ack 166266, win 141, options [nop,nop,TS val 120619183 ecr 1028705929], length 0
01:44:28.112821 IP 10.8.0.3.55302 > 52.223.202.244.1935: Flags [.], seq 174855:176169, ack 1, win 501, options [nop,nop,TS val 1028706303 ecr 120619183], length 1314
01:44:28.146970 IP 10.8.0.3.55302 > 52.223.202.244.1935: Flags [.], seq 176169:177483, ack 1, win 501, options [nop,nop,TS val 1028706337 ecr 120619183], length 1314
01:44:28.210118 IP 10.8.0.3.55302 > 52.223.202.244.1935: Flags [.], seq 177483:178797, ack 1, win 501, options [nop,nop,TS val 1028706400 ecr 120619183], length 1314
01:44:28.210982 IP 52.223.202.244.1935 > 10.8.0.3.55302: Flags [.], ack 168894, win 141, options [nop,nop,TS val 120619283 ecr 1028706015], length 0
01:44:28.247470 IP 10.8.0.3.55302 > 52.223.202.244.1935: Flags [.], seq 178797:180111, ack 1, win 501, options [nop,nop,TS val 1028706438 ecr 120619283], length 1314
01:44:28.280621 IP 10.8.0.3.55302 > 52.223.202.244.1935: Flags [.], seq 180111:181425, ack 1, win 501, options [nop,nop,TS val 1028706471 ecr 120619283], length 1314
01:44:28.284182 IP 52.223.202.244.1935 > 10.8.0.3.55302: Flags [.], ack 171522, win 141, options [nop,nop,TS val 120619356 ecr 1028706101], length 0
01:44:28.346036 IP 10.8.0.3.55302 > 52.223.202.244.1935: Flags [.], seq 181425:182739, ack 1, win 501, options [nop,nop,TS val 1028706536 ecr 120619356], length 1314
01:44:28.366175 IP 52.223.202.244.1935 > 10.8.0.3.55302: Flags [.], ack 173541, win 141, options [nop,nop,TS val 120619437 ecr 1028706203], length 0
01:44:28.366207 IP 10.8.0.3.55302 > 52.223.202.244.1935: Flags [P.], seq 182739:183520, ack 1, win 501, options [nop,nop,TS val 1028706557 ecr 120619437], length 781
01:44:28.414636 IP 10.8.0.3.55302 > 52.223.202.244.1935: Flags [.], seq 183520:184834, ack 1, win 501, options [nop,nop,TS val 1028706605 ecr 120619437], length 1314
01:44:28.443463 IP 52.223.202.244.1935 > 10.8.0.3.55302: Flags [.], ack 176169, win 141, options [nop,nop,TS val 120619515 ecr 1028706271], length 0
01:44:28.446205 IP 10.8.0.3.55302 > 52.223.202.244.1935: Flags [.], seq 184834:186148, ack 1, win 501, options [nop,nop,TS val 1028706636 ecr 120619515], length 1314
01:44:28.489280 IP 10.8.0.3.55302 > 52.223.202.244.1935: Flags [.], seq 186148:187462, ack 1, win 501, options [nop,nop,TS val 1028706680 ecr 120619515], length 1314
01:44:28.540562 IP 52.223.202.244.1935 > 10.8.0.3.55302: Flags [.], ack 178797, win 141, options [nop,nop,TS val 120619612 ecr 1028706337], length 0
01:44:28.546143 IP 10.8.0.3.55302 > 52.223.202.244.1935: Flags [.], seq 187462:188776, ack 1, win 501, options [nop,nop,TS val 1028706736 ecr 120619612], length 1314
01:44:28.581578 IP 10.8.0.3.55302 > 52.223.202.244.1935: Flags [.], seq 188776:190090, ack 1, win 501, options [nop,nop,TS val 1028706772 ecr 120619612], length 1314
01:44:28.611159 IP 52.223.202.244.1935 > 10.8.0.3.55302: Flags [.], ack 181425, win 141, options [nop,nop,TS val 120619683 ecr 1028706438], length 0
01:44:28.618019 IP 10.8.0.3.55302 > 52.223.202.244.1935: Flags [.], seq 190090:191404, ack 1, win 501, options [nop,nop,TS val 1028706808 ecr 120619683], length 1314
01:44:28.680631 IP 10.8.0.3.55302 > 52.223.202.244.1935: Flags [.], seq 191404:192718, ack 1, win 501, options [nop,nop,TS val 1028706871 ecr 120619683], length 1314
01:44:28.696559 IP 52.223.202.244.1935 > 10.8.0.3.55302: Flags [.], ack 183520, win 141, options [nop,nop,TS val 120619768 ecr 1028706536], length 0
01:44:28.696592 IP 10.8.0.3.55302 > 52.223.202.244.1935: Flags [P.], seq 192718:193423, ack 1, win 501, options [nop,nop,TS val 1028706887 ecr 120619768], length 705
01:44:28.746568 IP 10.8.0.3.55302 > 52.223.202.244.1935: Flags [.], seq 193423:194737, ack 1, win 501, options [nop,nop,TS val 1028706937 ecr 120619768], length 1314
01:44:28.776612 IP 52.223.202.244.1935 > 10.8.0.3.55302: Flags [.], ack 186148, win 141, options [nop,nop,TS val 120619848 ecr 1028706605], length 0
01:44:28.781143 IP 10.8.0.3.55302 > 52.223.202.244.1935: Flags [.], seq 194737:196051, ack 1, win 501, options [nop,nop,TS val 1028706971 ecr 120619848], length 1314
01:44:28.814646 IP 10.8.0.3.55302 > 52.223.202.244.1935: Flags [.], seq 196051:197365, ack 1, win 501, options [nop,nop,TS val 1028707005 ecr 120619848], length 1314
01:44:28.877196 IP 52.223.202.244.1935 > 10.8.0.3.55302: Flags [.], ack 188776, win 141, options [nop,nop,TS val 120619949 ecr 1028706680], length 0
