19:33:30.362734 IP 10.8.3.3.43140 > 99.181.64.200.1935: Flags [.], seq 1730400730:1730402044, ack 1388229021, win 501, options [nop,nop,TS val 891151218 ecr 2536873055], length 1314
19:33:30.426099 IP 10.8.3.3.43140 > 99.181.64.200.1935: Flags [.], seq 1314:2628, ack 1, win 501, options [nop,nop,TS val 891151281 ecr 2536873055], length 1314
19:33:30.429741 IP 99.181.64.200.1935 > 10.8.3.3.43140: Flags [.], ack 4294960700, win 126, options [nop,nop,TS val 2536873154 ecr 891150950], length 0
19:33:30.460721 IP 10.8.3.3.43140 > 99.181.64.200.1935: Flags [.], seq 2628:3942, ack 1, win 501, options [nop,nop,TS val 891151316 ecr 2536873154], length 1314
19:33:30.464185 IP 99.181.64.200.1935 > 10.8.3.3.43140: Flags [.], ack 4294963328, win 126, options [nop,nop,TS val 2536873189 ecr 891151017], length 0
19:33:30.495057 IP 10.8.3.3.43140 > 99.181.64.200.1935: Flags [.], seq 3942:5256, ack 1, win 501, options [nop,nop,TS val 891151350 ecr 2536873189], length 1314
19:33:30.508985 IP 99.181.64.200.1935 > 10.8.3.3.43140: Flags [.], ack 4294964668, win 126, options [nop,nop,TS val 2536873233 ecr 891151084], length 0
19:33:30.509021 IP 10.8.3.3.43140 > 99.181.64.200.1935: Flags [P.], seq 5256:5387, ack 1, win 501, options [nop,nop,TS val 891151364 ecr 2536873233], length 131
19:33:30.559973 IP 10.8.3.3.43140 > 99.181.64.200.1935: Flags [.], seq 5387:6701, ack 1, win 501, options [nop,nop,TS val 891151415 ecr 2536873233], length 1314
19:33:30.593464 IP 10.8.3.3.43140 > 99.181.64.200.1935: Flags [.], seq 6701:8015, ack 1, win 501, options [nop,nop,TS val 891151449 ecr 2536873233], length 1314
19:33:30.597459 IP 99.181.64.200.1935 > 10.8.3.3.43140: Flags [.], ack 0, win 126, options [nop,nop,TS val 2536873322 ecr 891151149], length 0
19:33:30.624766 IP 10.8.3.3.43140 > 99.181.64.200.1935: Flags [.], seq 8015:9329, ack 1, win 501, options [nop,nop,TS val 891151480 ecr 2536873322], length 1314
19:33:30.695142 IP 10.8.3.3.43140 > 99.181.64.200.1935: Flags [.], seq 9329:10643, ack 1, win 501, options [nop,nop,TS val 891151550 ecr 2536873322], length 1314
19:33:30.695416 IP 99.181.64.200.1935 > 10.8.3.3.43140: Flags [.], ack 2628, win 126, options [nop,nop,TS val 2536873420 ecr 891151218], length 0
19:33:30.728421 IP 10.8.3.3.43140 > 99.181.64.200.1935: Flags [.], seq 10643:11957, ack 1, win 501, options [nop,nop,TS val 891151584 ecr 2536873420], length 1314
19:33:30.761803 IP 10.8.3.3.43140 > 99.181.64.200.1935: Flags [.], seq 11957:13271, ack 1, win 501, options [nop,nop,TS val 891151617 ecr 2536873420], length 1314
19:33:30.764284 IP 99.181.64.200.1935 > 10.8.3.3.43140: Flags [.], ack 5256, win 126, options [nop,nop,TS val 2536873489 ecr 891151316], length 0
19:33:30.777764 IP 99.181.64.200.1935 > 10.8.3.3.43140: Flags [.], ack 5387, win 126, options [nop,nop,TS val 2536873502 ecr 891151364], length 0
19:33:30.777799 IP 10.8.3.3.43140 > 99.181.64.200.1935: Flags [P.], seq 13271:13405, ack 1, win 501, options [nop,nop,TS val 891151633 ecr 2536873502], length 134
19:33:30.827816 IP 10.8.3.3.43140 > 99.181.64.200.1935: Flags [.], seq 13405:14719, ack 1, win 501, options [nop,nop,TS val 891151683 ecr 2536873502], length 1314
19:33:30.860367 IP 10.8.3.3.43140 > 99.181.64.200.1935: Flags [.], seq 14719:16033, ack 1, win 501, options [nop,nop,TS val 891151716 ecr 2536873502], length 1314
19:33:30.862429 IP 99.181.64.200.1935 > 10.8.3.3.43140: Flags [.], ack 8015, win 126, options [nop,nop,TS val 2536873587 ecr 891151415], length 0
19:33:30.902661 IP 10.8.3.3.43140 > 99.181.64.200.1935: Flags [.], seq 16033:17347, ack 1, win 501, options [nop,nop,TS val 891151758 ecr 2536873587], length 1314
19:33:30.958650 IP 10.8.3.3.43140 > 99.181.64.200.1935: Flags [.], seq 17347:18661, ack 1, win 501, options [nop,nop,TS val 891151814 ecr 2536873587], length 1314
19:33:30.964097 IP 99.181.64.200.1935 > 10.8.3.3.43140: Flags [.], ack 10643, win 126, options [nop,nop,TS val 2536873689 ecr 891151480], length 0
19:33:30.991853 IP 10.8.3.3.43140 > 99.181.64.200.1935: Flags [.], seq 18661:19975, ack 1, win 501, options [nop,nop,TS val 891151847 ecr 2536873689], length 1314
19:33:31.030114 IP 10.8.3.3.43140 > 99.181.64.200.1935: Flags [.], seq 19975:21289, ack 1, win 501, options [nop,nop,TS val 891151885 ecr 2536873689], length 1314
19:33:31.031073 IP 99.181.64.200.1935 > 10.8.3.3.43140: Flags [.], ack 13271, win 126, options [nop,nop,TS val 2536873756 ecr 891151584], length 0
19:33:31.046676 IP 99.181.64.200.1935 > 10.8.3.3.43140: Flags [.], ack 13405, win 126, options [nop,nop,TS val 2536873771 ecr 891151633], length 0
19:33:31.046694 IP 10.8.3.3.43140 > 99.181.64.200.1935: Flags [P.], seq 21289:21315, ack 1, win 501, options [nop,nop,TS val 891151902 ecr 2536873771], length 26
19:33:31.093873 IP 10.8.3.3.43140 > 99.181.64.200.1935: Flags [.], seq 21315:22629, ack 1, win 501, options [nop,nop,TS val 891151949 ecr 2536873771], length 1314
19:33:31.128617 IP 10.8.3.3.43140 > 99.181.64.200.1935: Flags [.], seq 22629:23943, ack 1, win 501, options [nop,nop,TS val 891151984 ecr 2536873771], length 1314
19:33:31.129209 IP 99.181.64.200.1935 > 10.8.3.3.43140: Flags [.], ack 16033, win 126, options [nop,nop,TS val 2536873854 ecr 891151683], length 0
19:33:31.161485 IP 10.8.3.3.43140 > 99.181.64.200.1935: Flags [.], seq 23943:25257, ack 1, win 501, options [nop,nop,TS val 891152017 ecr 2536873854], length 1314
19:33:31.226860 IP 10.8.3.3.43140 > 99.181.64.200.1935: Flags [.], seq 25257:26571, ack 1, win 501, options [nop,nop,TS val 891152082 ecr 2536873854], length 1314
19:33:31.227694 IP 99.181.64.200.1935 > 10.8.3.3.43140: Flags [.], ack 18661, win 126, options [nop,nop,TS val 2536873952 ecr 891151758], length 0
19:33:31.262003 IP 10.8.3.3.43140 > 99.181.64.200.1935: Flags [.], seq 26571:27885, ack 1, win 501, options [nop,nop,TS val 891152117 ecr 2536873952], length 1314
19:33:31.294898 IP 10.8.3.3.43140 > 99.181.64.200.1935: Flags [.], seq 27885:29199, ack 1, win 501, options [nop,nop,TS val 891152150 ecr 2536873952], length 1314
19:33:31.299364 IP 99.181.64.200.1935 > 10.8.3.3.43140: Flags [.], ack 21289, win 126, options [nop,nop,TS val 2536874024 ecr 891151847], length 0
19:33:31.315326 IP 99.181.64.200.1935 > 10.8.3.3.43140: Flags [.], ack 21315, win 126, options [nop,nop,TS val 2536874040 ecr 891151902], length 0
19:33:31.315359 IP 10.8.3.3.43140 > 99.181.64.200.1935: Flags [P.], seq 29199:29326, ack 1, win 501, options [nop,nop,TS val 891152171 ecr 2536874040], length 127
19:33:31.361020 IP 10.8.3.3.43140 > 99.181.64.200.1935: Flags [.], seq 29326:30640, ack 1, win 501, options [nop,nop,TS val 891152216 ecr 2536874040], length 1314
19:33:31.395310 IP 10.8.3.3.43140 > 99.181.64.200.1935: Flags [.], seq 30640:31954, ack 1, win 501, options [nop,nop,TS val 891152251 ecr 2536874040], length 1314
19:33:31.397504 IP 99.181.64.200.1935 > 10.8.3.3.43140: Flags [.], ack 23943, win 126, options [nop,nop,TS val 2536874122 ecr 891151949], length 0
19:33:31.437309 IP 10.8.3.3.43140 > 99.181.64.200.1935: Flags [.], seq 31954:33268, ack 1, win 501, options [nop,nop,TS val 891152293 ecr 2536874122], length 1314
19:33:31.493061 IP 10.8.3.3.43140 > 99.181.64.200.1935: Flags [.], seq 33268:34582, ack 1, win 501, options [nop,nop,TS val 891152348 ecr 2536874122], length 1314
19:33:31.495896 IP 99.181.64.200.1935 > 10.8.3.3.43140: Flags [.], ack 26571, win 126, options [nop,nop,TS val 2536874220 ecr 891152017], length 0
19:33:31.527770 IP 10.8.3.3.43140 > 99.181.64.200.1935: Flags [.], seq 34582:35896, ack 1, win 501, options [nop,nop,TS val 891152383 ecr 2536874220], length 1314
19:33:31.563745 IP 99.181.64.200.1935 > 10.8.3.3.43140: Flags [.], ack 29199, win 126, options [nop,nop,TS val 2536874288 ecr 891152117], length 0
19:33:31.565699 IP 10.8.3.3.43140 > 99.181.64.200.1935: Flags [.], seq 35896:37210, ack 1, win 501, options [nop,nop,TS val 891152421 ecr 2536874288], length 1314
19:33:31.585111 IP 99.181.64.200.1935 > 10.8.3.3.43140: Flags [.], ack 29326, win 126, options [nop,nop,TS val 2536874309 ecr 891152171], length 0
19:33:31.585145 IP 10.8.3.3.43140 > 99.181.64.200.1935: Flags [P.], seq 37210:37249, ack 1, win 501, options [nop,nop,TS val 891152440 ecr 2536874309], length 39
19:33:31.628277 IP 10.8.3.3.43140 > 99.181.64.200.1935: Flags [.], seq 37249:38563, ack 1, win 501, options [nop,nop,TS val 891152484 ecr 2536874309], length 1314
19:33:31.662060 IP 10.8.3.3.43140 > 99.181.64.200.1935: Flags [.], seq 38563:39877, ack 1, win 501, options [nop,nop,TS val 891152517 ecr 2536874309], length 1314
19:33:31.664260 IP 99.181.64.200.1935 > 10.8.3.3.43140: Flags [.], ack 31954, win 126, options [nop,nop,TS val 2536874389 ecr 891152216], length 0
19:33:31.694047 IP 10.8.3.3.43140 > 99.181.64.200.1935: Flags [.], seq 39877:41191, ack 1, win 501, options [nop,nop,TS val 891152549 ecr 2536874389], length 1314
19:33:31.760058 IP 10.8.3.3.43140 > 99.181.64.200.1935: Flags [.], seq 41191:42505, ack 1, win 501, options [nop,nop,TS val 891152615 ecr 2536874389], length 1314
19:33:31.761921 IP 99.181.64.200.1935 > 10.8.3.3.43140: Flags [.], ack 34582, win 126, options [nop,nop,TS val 2536874486 ecr 891152293], length 0
19:33:31.796297 IP 10.8.3.3.43140 > 99.181.64.200.1935: Flags [.], seq 42505:43819, ack 1, win 501, options [nop,nop,TS val 891152652 ecr 2536874486], length 1314
19:33:31.829154 IP 10.8.3.3.43140 > 99.181.64.200.1935: Flags [.], seq 43819:45133, ack 1, win 501, options [nop,nop,TS val 891152684 ecr 2536874486], length 1314
19:33:31.834822 IP 99.181.64.200.1935 > 10.8.3.3.43140: Flags [.], ack 37210, win 126, options [nop,nop,TS val 2536874559 ecr 891152383], length 0
19:33:31.853909 IP 99.181.64.200.1935 > 10.8.3.3.43140: Flags [.], ack 37249, win 126, options [nop,nop,TS val 2536874578 ecr 891152440], length 0
19:33:31.853933 IP 10.8.3.3.43140 > 99.181.64.200.1935: Flags [P.], seq 45133:45255, ack 1, win 501, options [nop,nop,TS val 891152709 ecr 2536874578], length 122
19:33:31.894067 IP 10.8.3.3.43140 > 99.181.64.200.1935: Flags [.], seq 45255:46569, ack 1, win 501, options [nop,nop,TS val 891152749 ecr 2536874578], length 1314
19:33:31.929669 IP 10.8.3.3.43140 > 99.181.64.200.1935: Flags [.], seq 46569:47883, ack 1, win 501, options [nop,nop,TS val 891152785 ecr 2536874578], length 1314
19:33:31.931348 IP 99.181.64.200.1935 > 10.8.3.3.43140: Flags [.], ack 39877, win 126, options [nop,nop,TS val 2536874656 ecr 891152484], length 0
19:33:31.972435 IP 10.8.3.3.43140 > 99.181.64.200.1935: Flags [.], seq 47883:49197, ack 1, win 501, options [nop,nop,TS val 891152828 ecr 2536874656], length 1314
19:33:32.027880 IP 10.8.3.3.43140 > 99.181.64.200.1935: Flags [.], seq 49197:50511, ack 1, win 501, options [nop,nop,TS val 891152883 ecr 2536874656], length 1314
19:33:32.028977 IP 99.181.64.200.1935 > 10.8.3.3.43140: Flags [.], ack 42505, win 126, options [nop,nop,TS val 2536874753 ecr 891152549], length 0
19:33:32.061395 IP 10.8.3.3.43140 > 99.181.64.200.1935: Flags [.], seq 50511:51825, ack 1, win 501, options [nop,nop,TS val 891152917 ecr 2536874753], length 1314
19:33:32.098093 IP 99.181.64.200.1935 > 10.8.3.3.43140: Flags [.], ack 45133, win 126, options [nop,nop,TS val 2536874823 ecr 891152652], length 0
19:33:32.100512 IP 10.8.3.3.43140 > 99.181.64.200.1935: Flags [.], seq 51825:53139, ack 1, win 501, options [nop,nop,TS val 891152956 ecr 2536874823], length 1314
19:33:32.122503 IP 99.181.64.200.1935 > 10.8.3.3.43140: Flags [.], ack 45255, win 126, options [nop,nop,TS val 2536874847 ecr 891152709], length 0
19:33:32.122522 IP 10.8.3.3.43140 > 99.181.64.200.1935: Flags [P.], seq 53139:53269, ack 1, win 501, options [nop,nop,TS val 891152978 ecr 2536874847], length 130
19:33:32.161321 IP 10.8.3.3.43140 > 99.181.64.200.1935: Flags [.], seq 53269:54583, ack 1, win 501, options [nop,nop,TS val 891153017 ecr 2536874847], length 1314
19:33:32.195788 IP 10.8.3.3.43140 > 99.181.64.200.1935: Flags [.], seq 54583:55897, ack 1, win 501, options [nop,nop,TS val 891153051 ecr 2536874847], length 1314
19:33:32.198852 IP 99.181.64.200.1935 > 10.8.3.3.43140: Flags [.], ack 47883, win 126, options [nop,nop,TS val 2536874923 ecr 891152749], length 0
19:33:32.250701 IP 10.8.3.3.43140 > 99.181.64.200.1935: Flags [.], seq 55897:57211, ack 1, win 501, options [nop,nop,TS val 891153106 ecr 2536874923], length 1314
19:33:32.293287 IP 10.8.3.3.43140 > 99.181.64.200.1935: Flags [.], seq 57211:58525, ack 1, win 501, options [nop,nop,TS val 891153149 ecr 2536874923], length 1314
19:33:32.296860 IP 99.181.64.200.1935 > 10.8.3.3.43140: Flags [.], ack 50511, win 126, options [nop,nop,TS val 2536875021 ecr 891152828], length 0
19:33:32.328689 IP 10.8.3.3.43140 > 99.181.64.200.1935: Flags [.], seq 58525:59839, ack 1, win 501, options [nop,nop,TS val 891153184 ecr 2536875021], length 1314
19:33:32.369342 IP 99.181.64.200.1935 > 10.8.3.3.43140: Flags [.], ack 53139, win 126, options [nop,nop,TS val 2536875094 ecr 891152917], length 0
19:33:32.378615 IP 10.8.3.3.43140 > 99.181.64.200.1935: Flags [.], seq 59839:61153, ack 1, win 501, options [nop,nop,TS val 891153234 ecr 2536875094], length 1314
19:33:32.391262 IP 99.181.64.200.1935 > 10.8.3.3.43140: Flags [.], ack 53269, win 126, options [nop,nop,TS val 2536875116 ecr 891152978], length 0
19:33:32.391305 IP 10.8.3.3.43140 > 99.181.64.200.1935: Flags [P.], seq 61153:61192, ack 1, win 501, options [nop,nop,TS val 891153247 ecr 2536875116], length 39
19:33:32.426788 IP 10.8.3.3.43140 > 99.181.64.200.1935: Flags [.], seq 61192:62506, ack 1, win 501, options [nop,nop,TS val 891153282 ecr 2536875116], length 1314
19:33:32.463979 IP 10.8.3.3.43140 > 99.181.64.200.1935: Flags [.], seq 62506:63820, ack 1, win 501, options [nop,nop,TS val 891153319 ecr 2536875116], length 1314
19:33:32.464875 IP 99.181.64.200.1935 > 10.8.3.3.43140: Flags [.], ack 55897, win 126, options [nop,nop,TS val 2536875189 ecr 891153017], length 0
19:33:32.506892 IP 10.8.3.3.43140 > 99.181.64.200.1935: Flags [.], seq 63820:65134, ack 1, win 501, options [nop,nop,TS val 891153362 ecr 2536875189], length 1314
19:33:32.560436 IP 10.8.3.3.43140 > 99.181.64.200.1935: Flags [.], seq 65134:66448, ack 1, win 501, options [nop,nop,TS val 891153416 ecr 2536875189], length 1314
19:33:32.562200 IP 99.181.64.200.1935 > 10.8.3.3.43140: Flags [.], ack 58525, win 126, options [nop,nop,TS val 2536875287 ecr 891153106], length 0
19:33:32.592122 IP 10.8.3.3.43140 > 99.181.64.200.1935: Flags [.], seq 66448:67762, ack 1, win 501, options [nop,nop,TS val 891153447 ecr 2536875287], length 1314
19:33:32.634534 IP 10.8.3.3.43140 > 99.181.64.200.1935: Flags [.], seq 67762:69076, ack 1, win 501, options [nop,nop,TS val 891153490 ecr 2536875287], length 1314
19:33:32.647759 IP 99.181.64.200.1935 > 10.8.3.3.43140: Flags [.], ack 61153, win 126, options [nop,nop,TS val 2536875372 ecr 891153184], length 0
19:33:32.659951 IP 99.181.64.200.1935 > 10.8.3.3.43140: Flags [.], ack 61192, win 126, options [nop,nop,TS val 2536875385 ecr 891153247], length 0
19:33:32.659978 IP 10.8.3.3.43140 > 99.181.64.200.1935: Flags [P.], seq 69076:70041, ack 1, win 501, options [nop,nop,TS val 891153515 ecr 2536875385], length 965
19:33:32.728227 IP 10.8.3.3.43140 > 99.181.64.200.1935: Flags [.], seq 70041:71355, ack 1, win 501, options [nop,nop,TS val 891153584 ecr 2536875385], length 1314
19:33:32.732803 IP 99.181.64.200.1935 > 10.8.3.3.43140: Flags [.], ack 63820, win 126, options [nop,nop,TS val 2536875457 ecr 891153282], length 0
19:33:32.763135 IP 10.8.3.3.43140 > 99.181.64.200.1935: Flags [.], seq 71355:72669, ack 1, win 501, options [nop,nop,TS val 891153618 ecr 2536875457], length 1314
19:33:32.792267 IP 10.8.3.3.43140 > 99.181.64.200.1935: Flags [.], seq 72669:73983, ack 1, win 501, options [nop,nop,TS val 891153648 ecr 2536875457], length 1314
19:33:32.829566 IP 99.181.64.200.1935 > 10.8.3.3.43140: Flags [.], ack 66448, win 126, options [nop,nop,TS val 2536875554 ecr 891153362], length 0
19:33:32.861733 IP 10.8.3.3.43140 > 99.181.64.200.1935: Flags [.], seq 73983:75297, ack 1, win 501, options [nop,nop,TS val 891153717 ecr 2536875554], length 1314
19:33:32.894825 IP 10.8.3.3.43140 > 99.181.64.200.1935: Flags [.], seq 75297:76611, ack 1, win 501, options [nop,nop,TS val 891153750 ecr 2536875554], length 1314
19:33:32.905608 IP 99.181.64.200.1935 > 10.8.3.3.43140: Flags [.], ack 69076, win 126, options [nop,nop,TS val 2536875628 ecr 891153447], length 0
19:33:32.913236 IP 10.8.3.3.43140 > 99.181.64.200.1935: Flags [.], seq 76611:77925, ack 1, win 501, options [nop,nop,TS val 891153769 ecr 2536875628], length 1314
19:33:32.928968 IP 99.181.64.200.1935 > 10.8.3.3.43140: Flags [.], ack 70041, win 126, options [nop,nop,TS val 2536875654 ecr 891153515], length 0
19:33:32.928994 IP 10.8.3.3.43140 > 99.181.64.200.1935: Flags [P.], seq 77925:78055, ack 1, win 501, options [nop,nop,TS val 891153784 ecr 2536875654], length 130
19:33:32.994938 IP 10.8.3.3.43140 > 99.181.64.200.1935: Flags [.], seq 78055:79369, ack 1, win 501, options [nop,nop,TS val 891153850 ecr 2536875654], length 1314
19:33:33.020029 IP 10.8.3.3.43140 > 99.181.64.200.1935: Flags [.], seq 79369:80683, ack 1, win 501, options [nop,nop,TS val 891153875 ecr 2536875654], length 1314
19:33:33.035048 IP 99.181.64.200.1935 > 10.8.3.3.43140: Flags [.], ack 72669, win 126, options [nop,nop,TS val 2536875760 ecr 891153584], length 0
19:33:33.057623 IP 10.8.3.3.43140 > 99.181.64.200.1935: Flags [.], seq 80683:81997, ack 1, win 501, options [nop,nop,TS val 891153913 ecr 2536875760], length 1314
19:33:33.121982 IP 99.181.64.200.1935 > 10.8.3.3.43140: Flags [.], ack 73983, win 126, options [nop,nop,TS val 2536875846 ecr 891153648], length 0
19:33:33.126811 IP 10.8.3.3.43140 > 99.181.64.200.1935: Flags [.], seq 81997:83311, ack 1, win 501, options [nop,nop,TS val 891153982 ecr 2536875846], length 1314
19:33:33.148123 IP 10.8.3.3.43140 > 99.181.64.200.1935: Flags [.], seq 83311:84625, ack 1, win 501, options [nop,nop,TS val 891154003 ecr 2536875846], length 1314
19:33:33.163952 IP 99.181.64.200.1935 > 10.8.3.3.43140: Flags [.], ack 76611, win 126, options [nop,nop,TS val 2536875889 ecr 891153717], length 0
19:33:33.191114 IP 10.8.3.3.43140 > 99.181.64.200.1935: Flags [.], seq 84625:85939, ack 1, win 501, options [nop,nop,TS val 891154046 ecr 2536875889], length 1314
19:33:33.197568 IP 99.181.64.200.1935 > 10.8.3.3.43140: Flags [.], ack 78055, win 126, options [nop,nop,TS val 2536875922 ecr 891153769], length 0
19:33:33.197593 IP 10.8.3.3.43140 > 99.181.64.200.1935: Flags [P.], seq 85939:86074, ack 1, win 501, options [nop,nop,TS val 891154053 ecr 2536875922], length 135
19:33:33.255022 IP 10.8.3.3.43140 > 99.181.64.200.1935: Flags [.], seq 86074:87388, ack 1, win 501, options [nop,nop,TS val 891154110 ecr 2536875922], length 1314
19:33:33.288748 IP 99.181.64.200.1935 > 10.8.3.3.43140: Flags [.], ack 80683, win 126, options [nop,nop,TS val 2536876013 ecr 891153850], length 0
19:33:33.290815 IP 10.8.3.3.43140 > 99.181.64.200.1935: Flags [.], seq 87388:88702, ack 1, win 501, options [nop,nop,TS val 891154146 ecr 2536876013], length 1314
19:33:33.324386 IP 10.8.3.3.43140 > 99.181.64.200.1935: Flags [.], seq 88702:90016, ack 1, win 501, options [nop,nop,TS val 891154180 ecr 2536876013], length 1314
19:33:33.382764 IP 10.8.3.3.43140 > 99.181.64.200.1935: Flags [.], seq 90016:91330, ack 1, win 501, options [nop,nop,TS val 891154238 ecr 2536876013], length 1314
19:33:33.393990 IP 99.181.64.200.1935 > 10.8.3.3.43140: Flags [.], ack 81997, win 126, options [nop,nop,TS val 2536876118 ecr 891153913], length 0
19:33:33.417217 IP 99.181.64.200.1935 > 10.8.3.3.43140: Flags [.], ack 84625, win 126, options [nop,nop,TS val 2536876142 ecr 891153982], length 0
19:33:33.425749 IP 10.8.3.3.43140 > 99.181.64.200.1935: Flags [.], seq 91330:92644, ack 1, win 501, options [nop,nop,TS val 891154281 ecr 2536876142], length 1314
19:33:33.461736 IP 10.8.3.3.43140 > 99.181.64.200.1935: Flags [.], seq 92644:93958, ack 1, win 501, options [nop,nop,TS val 891154317 ecr 2536876142], length 1314
19:33:33.466319 IP 99.181.64.200.1935 > 10.8.3.3.43140: Flags [.], ack 86074, win 126, options [nop,nop,TS val 2536876191 ecr 891154046], length 0
19:33:33.466352 IP 10.8.3.3.43140 > 99.181.64.200.1935: Flags [P.], seq 93958:93985, ack 1, win 501, options [nop,nop,TS val 891154322 ecr 2536876191], length 27
19:33:33.528433 IP 10.8.3.3.43140 > 99.181.64.200.1935: Flags [.], seq 93985:95299, ack 1, win 501, options [nop,nop,TS val 891154384 ecr 2536876191], length 1314
19:33:33.554703 IP 10.8.3.3.43140 > 99.181.64.200.1935: Flags [.], seq 95299:96613, ack 1, win 501, options [nop,nop,TS val 891154410 ecr 2536876191], length 1314
19:33:33.559800 IP 99.181.64.200.1935 > 10.8.3.3.43140: Flags [.], ack 88702, win 126, options [nop,nop,TS val 2536876284 ecr 891154110], length 0
19:33:33.593370 IP 10.8.3.3.43140 > 99.181.64.200.1935: Flags [.], seq 96613:97927, ack 1, win 501, options [nop,nop,TS val 891154449 ecr 2536876284], length 1314
19:33:33.651527 IP 99.181.64.200.1935 > 10.8.3.3.43140: Flags [.], ack 91330, win 126, options [nop,nop,TS val 2536876376 ecr 891154180], length 0
19:33:33.658890 IP 10.8.3.3.43140 > 99.181.64.200.1935: Flags [.], seq 97927:99241, ack 1, win 501, options [nop,nop,TS val 891154514 ecr 2536876376], length 1314
19:33:33.682629 IP 10.8.3.3.43140 > 99.181.64.200.1935: Flags [.], seq 99241:100555, ack 1, win 501, options [nop,nop,TS val 891154538 ecr 2536876376], length 1314
19:33:33.725175 IP 10.8.3.3.43140 > 99.181.64.200.1935: Flags [.], seq 100555:101869, ack 1, win 501, options [nop,nop,TS val 891154580 ecr 2536876376], length 1314
19:33:33.730760 IP 99.181.64.200.1935 > 10.8.3.3.43140: Flags [.], ack 93958, win 126, options [nop,nop,TS val 2536876455 ecr 891154281], length 0
19:33:33.735349 IP 99.181.64.200.1935 > 10.8.3.3.43140: Flags [.], ack 93985, win 126, options [nop,nop,TS val 2536876460 ecr 891154322], length 0
19:33:33.735376 IP 10.8.3.3.43140 > 99.181.64.200.1935: Flags [P.], seq 101869:101998, ack 1, win 501, options [nop,nop,TS val 891154591 ecr 2536876460], length 129
19:33:33.789673 IP 10.8.3.3.43140 > 99.181.64.200.1935: Flags [.], seq 101998:103312, ack 1, win 501, options [nop,nop,TS val 891154645 ecr 2536876460], length 1314
19:33:33.823671 IP 99.181.64.200.1935 > 10.8.3.3.43140: Flags [.], ack 96613, win 126, options [nop,nop,TS val 2536876548 ecr 891154384], length 0
19:33:33.828243 IP 10.8.3.3.43140 > 99.181.64.200.1935: Flags [.], seq 103312:104626, ack 1, win 501, options [nop,nop,TS val 891154684 ecr 2536876548], length 1314
19:33:33.861763 IP 10.8.3.3.43140 > 99.181.64.200.1935: Flags [.], seq 104626:105940, ack 1, win 501, options [nop,nop,TS val 891154717 ecr 2536876548], length 1314
19:33:33.918669 IP 10.8.3.3.43140 > 99.181.64.200.1935: Flags [.], seq 105940:107254, ack 1, win 501, options [nop,nop,TS val 891154774 ecr 2536876548], length 1314
19:33:33.927840 IP 99.181.64.200.1935 > 10.8.3.3.43140: Flags [.], ack 99241, win 126, options [nop,nop,TS val 2536876652 ecr 891154449], length 0
19:33:33.959012 IP 10.8.3.3.43140 > 99.181.64.200.1935: Flags [.], seq 107254:108568, ack 1, win 501, options [nop,nop,TS val 891154814 ecr 2536876652], length 1314
19:33:33.993371 IP 10.8.3.3.43140 > 99.181.64.200.1935: Flags [.], seq 108568:109882, ack 1, win 501, options [nop,nop,TS val 891154849 ecr 2536876652], length 1314
19:33:33.994062 IP 99.181.64.200.1935 > 10.8.3.3.43140: Flags [.], ack 101869, win 126, options [nop,nop,TS val 2536876719 ecr 891154538], length 0
19:33:34.007189 IP 99.181.64.200.1935 > 10.8.3.3.43140: Flags [.], ack 101998, win 126, options [nop,nop,TS val 2536876732 ecr 891154591], length 0
19:33:34.007220 IP 10.8.3.3.43140 > 99.181.64.200.1935: Flags [P.], seq 109882:110017, ack 1, win 501, options [nop,nop,TS val 891154863 ecr 2536876732], length 135
19:33:34.061680 IP 10.8.3.3.43140 > 99.181.64.200.1935: Flags [.], seq 110017:111331, ack 1, win 501, options [nop,nop,TS val 891154917 ecr 2536876732], length 1314
19:33:34.090460 IP 10.8.3.3.43140 > 99.181.64.200.1935: Flags [.], seq 111331:112645, ack 1, win 501, options [nop,nop,TS val 891154946 ecr 2536876732], length 1314
19:33:34.097386 IP 99.181.64.200.1935 > 10.8.3.3.43140: Flags [.], ack 104626, win 126, options [nop,nop,TS val 2536876822 ecr 891154645], length 0
19:33:34.133217 IP 10.8.3.3.43140 > 99.181.64.200.1935: Flags [.], seq 112645:113959, ack 1, win 501, options [nop,nop,TS val 891154989 ecr 2536876822], length 1314
19:33:34.187844 IP 99.181.64.200.1935 > 10.8.3.3.43140: Flags [.], ack 107254, win 126, options [nop,nop,TS val 2536876912 ecr 891154717], length 0
19:33:34.194985 IP 10.8.3.3.43140 > 99.181.64.200.1935: Flags [.], seq 113959:115273, ack 1, win 501, options [nop,nop,TS val 891155050 ecr 2536876912], length 1314
19:33:34.218919 IP 10.8.3.3.43140 > 99.181.64.200.1935: Flags [.], seq 115273:116587, ack 1, win 501, options [nop,nop,TS val 891155074 ecr 2536876912], length 1314
19:33:34.261636 IP 10.8.3.3.43140 > 99.181.64.200.1935: Flags [.], seq 116587:117901, ack 1, win 501, options [nop,nop,TS val 891155117 ecr 2536876912], length 1314
19:33:34.262327 IP 99.181.64.200.1935 > 10.8.3.3.43140: Flags [.], ack 109882, win 126, options [nop,nop,TS val 2536876987 ecr 891154814], length 0
19:33:34.276166 IP 99.181.64.200.1935 > 10.8.3.3.43140: Flags [.], ack 110017, win 126, options [nop,nop,TS val 2536877001 ecr 891154863], length 0
19:33:34.276183 IP 10.8.3.3.43140 > 99.181.64.200.1935: Flags [P.], seq 117901:117924, ack 1, win 501, options [nop,nop,TS val 891155132 ecr 2536877001], length 23
19:33:34.326020 IP 10.8.3.3.43140 > 99.181.64.200.1935: Flags [.], seq 117924:119238, ack 1, win 501, options [nop,nop,TS val 891155181 ecr 2536877001], length 1314
19:33:34.360047 IP 99.181.64.200.1935 > 10.8.3.3.43140: Flags [.], ack 112645, win 126, options [nop,nop,TS val 2536877085 ecr 891154917], length 0
19:33:34.361745 IP 10.8.3.3.43140 > 99.181.64.200.1935: Flags [.], seq 119238:120552, ack 1, win 501, options [nop,nop,TS val 891155217 ecr 2536877085], length 1314
19:33:34.393353 IP 10.8.3.3.43140 > 99.181.64.200.1935: Flags [.], seq 120552:121866, ack 1, win 501, options [nop,nop,TS val 891155249 ecr 2536877085], length 1314
19:33:34.454484 IP 10.8.3.3.43140 > 99.181.64.200.1935: Flags [.], seq 121866:123180, ack 1, win 501, options [nop,nop,TS val 891155310 ecr 2536877085], length 1314
19:33:34.464164 IP 99.181.64.200.1935 > 10.8.3.3.43140: Flags [.], ack 115273, win 126, options [nop,nop,TS val 2536877189 ecr 891154989], length 0
19:33:34.493821 IP 10.8.3.3.43140 > 99.181.64.200.1935: Flags [.], seq 123180:124494, ack 1, win 501, options [nop,nop,TS val 891155349 ecr 2536877189], length 1314
19:33:34.528264 IP 10.8.3.3.43140 > 99.181.64.200.1935: Flags [.], seq 124494:125808, ack 1, win 501, options [nop,nop,TS val 891155384 ecr 2536877189], length 1314
19:33:34.530582 IP 99.181.64.200.1935 > 10.8.3.3.43140: Flags [.], ack 117901, win 126, options [nop,nop,TS val 2536877255 ecr 891155074], length 0
19:33:34.544809 IP 99.181.64.200.1935 > 10.8.3.3.43140: Flags [.], ack 117924, win 126, options [nop,nop,TS val 2536877269 ecr 891155132], length 0
19:33:34.544839 IP 10.8.3.3.43140 > 99.181.64.200.1935: Flags [P.], seq 125808:125937, ack 1, win 501, options [nop,nop,TS val 891155400 ecr 2536877269], length 129
19:33:34.593616 IP 10.8.3.3.43140 > 99.181.64.200.1935: Flags [.], seq 125937:127251, ack 1, win 501, options [nop,nop,TS val 891155449 ecr 2536877269], length 1314
19:33:34.624152 IP 10.8.3.3.43140 > 99.181.64.200.1935: Flags [.], seq 127251:128565, ack 1, win 501, options [nop,nop,TS val 891155479 ecr 2536877269], length 1314
19:33:34.630629 IP 99.181.64.200.1935 > 10.8.3.3.43140: Flags [.], ack 120552, win 126, options [nop,nop,TS val 2536877355 ecr 891155181], length 0
19:33:34.667947 IP 10.8.3.3.43140 > 99.181.64.200.1935: Flags [.], seq 128565:129879, ack 1, win 501, options [nop,nop,TS val 891155523 ecr 2536877355], length 1314
19:33:34.723505 IP 99.181.64.200.1935 > 10.8.3.3.43140: Flags [.], ack 123180, win 126, options [nop,nop,TS val 2536877448 ecr 891155249], length 0
19:33:34.728315 IP 10.8.3.3.43140 > 99.181.64.200.1935: Flags [.], seq 129879:131193, ack 1, win 501, options [nop,nop,TS val 891155584 ecr 2536877448], length 1314
19:33:34.753947 IP 10.8.3.3.43140 > 99.181.64.200.1935: Flags [.], seq 131193:132507, ack 1, win 501, options [nop,nop,TS val 891155609 ecr 2536877448], length 1314
19:33:34.796634 IP 10.8.3.3.43140 > 99.181.64.200.1935: Flags [.], seq 132507:133821, ack 1, win 501, options [nop,nop,TS val 891155652 ecr 2536877448], length 1314
19:33:34.797154 IP 99.181.64.200.1935 > 10.8.3.3.43140: Flags [.], ack 125808, win 126, options [nop,nop,TS val 2536877522 ecr 891155349], length 0
19:33:34.813739 IP 99.181.64.200.1935 > 10.8.3.3.43140: Flags [.], ack 125937, win 126, options [nop,nop,TS val 2536877538 ecr 891155400], length 0
19:33:34.813752 IP 10.8.3.3.43140 > 99.181.64.200.1935: Flags [P.], seq 133821:133860, ack 1, win 501, options [nop,nop,TS val 891155669 ecr 2536877538], length 39
19:33:34.859469 IP 10.8.3.3.43140 > 99.181.64.200.1935: Flags [.], seq 133860:135174, ack 1, win 501, options [nop,nop,TS val 891155715 ecr 2536877538], length 1314
19:33:34.890798 IP 10.8.3.3.43140 > 99.181.64.200.1935: Flags [.], seq 135174:136488, ack 1, win 501, options [nop,nop,TS val 891155746 ecr 2536877538], length 1314
19:33:34.892932 IP 99.181.64.200.1935 > 10.8.3.3.43140: Flags [.], ack 128565, win 126, options [nop,nop,TS val 2536877618 ecr 891155449], length 0
19:33:34.925324 IP 10.8.3.3.43140 > 99.181.64.200.1935: Flags [.], seq 136488:137802, ack 1, win 501, options [nop,nop,TS val 891155781 ecr 2536877618], length 1314
19:33:34.988824 IP 10.8.3.3.43140 > 99.181.64.200.1935: Flags [.], seq 137802:139116, ack 1, win 501, options [nop,nop,TS val 891155844 ecr 2536877618], length 1314
19:33:34.997385 IP 99.181.64.200.1935 > 10.8.3.3.43140: Flags [.], ack 131193, win 126, options [nop,nop,TS val 2536877722 ecr 891155523], length 0
19:33:35.025839 IP 10.8.3.3.43140 > 99.181.64.200.1935: Flags [.], seq 139116:140430, ack 1, win 501, options [nop,nop,TS val 891155881 ecr 2536877722], length 1314
19:33:35.059040 IP 10.8.3.3.43140 > 99.181.64.200.1935: Flags [.], seq 140430:141744, ack 1, win 501, options [nop,nop,TS val 891155914 ecr 2536877722], length 1314
19:33:35.065327 IP 99.181.64.200.1935 > 10.8.3.3.43140: Flags [.], ack 133821, win 126, options [nop,nop,TS val 2536877790 ecr 891155609], length 0
19:33:35.082177 IP 99.181.64.200.1935 > 10.8.3.3.43140: Flags [.], ack 133860, win 126, options [nop,nop,TS val 2536877807 ecr 891155669], length 0
19:33:35.082198 IP 10.8.3.3.43140 > 99.181.64.200.1935: Flags [P.], seq 141744:141862, ack 1, win 501, options [nop,nop,TS val 891155938 ecr 2536877807], length 118
19:33:35.128200 IP 10.8.3.3.43140 > 99.181.64.200.1935: Flags [.], seq 141862:143176, ack 1, win 501, options [nop,nop,TS val 891155983 ecr 2536877807], length 1314
19:33:35.159630 IP 99.181.64.200.1935 > 10.8.3.3.43140: Flags [.], ack 136488, win 126, options [nop,nop,TS val 2536877884 ecr 891155715], length 0
19:33:35.160070 IP 10.8.3.3.43140 > 99.181.64.200.1935: Flags [.], seq 143176:144490, ack 1, win 501, options [nop,nop,TS val 891156015 ecr 2536877884], length 1314
19:33:35.202673 IP 10.8.3.3.43140 > 99.181.64.200.1935: Flags [.], seq 144490:145804, ack 1, win 501, options [nop,nop,TS val 891156058 ecr 2536877884], length 1314
19:33:35.258596 IP 99.181.64.200.1935 > 10.8.3.3.43140: Flags [.], ack 139116, win 126, options [nop,nop,TS val 2536877983 ecr 891155781], length 0
19:33:35.261867 IP 10.8.3.3.43140 > 99.181.64.200.1935: Flags [.], seq 145804:147118, ack 1, win 501, options [nop,nop,TS val 891156117 ecr 2536877983], length 1314
19:33:35.288379 IP 10.8.3.3.43140 > 99.181.64.200.1935: Flags [.], seq 147118:148432, ack 1, win 501, options [nop,nop,TS val 891156144 ecr 2536877983], length 1314
19:33:35.327831 IP 99.181.64.200.1935 > 10.8.3.3.43140: Flags [.], ack 141744, win 126, options [nop,nop,TS val 2536878052 ecr 891155881], length 0
19:33:35.331206 IP 10.8.3.3.43140 > 99.181.64.200.1935: Flags [.], seq 148432:149746, ack 1, win 501, options [nop,nop,TS val 891156187 ecr 2536878052], length 1314
19:33:35.351195 IP 99.181.64.200.1935 > 10.8.3.3.43140: Flags [.], ack 141862, win 126, options [nop,nop,TS val 2536878076 ecr 891155938], length 0
19:33:35.351219 IP 10.8.3.3.43140 > 99.181.64.200.1935: Flags [P.], seq 149746:149785, ack 1, win 501, options [nop,nop,TS val 891156207 ecr 2536878076], length 39
19:33:35.393192 IP 10.8.3.3.43140 > 99.181.64.200.1935: Flags [.], seq 149785:151099, ack 1, win 501, options [nop,nop,TS val 891156248 ecr 2536878076], length 1314
19:33:35.424176 IP 10.8.3.3.43140 > 99.181.64.200.1935: Flags [.], seq 151099:152413, ack 1, win 501, options [nop,nop,TS val 891156279 ecr 2536878076], length 1314
19:33:35.429088 IP 99.181.64.200.1935 > 10.8.3.3.43140: Flags [.], ack 144490, win 126, options [nop,nop,TS val 2536878154 ecr 891155983], length 0
19:33:35.458871 IP 10.8.3.3.43140 > 99.181.64.200.1935: Flags [.], seq 152413:153727, ack 1, win 501, options [nop,nop,TS val 891156314 ecr 2536878154], length 1314
19:33:35.523100 IP 10.8.3.3.43140 > 99.181.64.200.1935: Flags [.], seq 153727:155041, ack 1, win 501, options [nop,nop,TS val 891156378 ecr 2536878154], length 1314
19:33:35.531094 IP 99.181.64.200.1935 > 10.8.3.3.43140: Flags [.], ack 147118, win 126, options [nop,nop,TS val 2536878255 ecr 891156058], length 0
19:33:35.561672 IP 10.8.3.3.43140 > 99.181.64.200.1935: Flags [.], seq 155041:156355, ack 1, win 501, options [nop,nop,TS val 891156417 ecr 2536878255], length 1314
19:33:35.594893 IP 10.8.3.3.43140 > 99.181.64.200.1935: Flags [.], seq 156355:157669, ack 1, win 501, options [nop,nop,TS val 891156450 ecr 2536878255], length 1314
19:33:35.600219 IP 99.181.64.200.1935 > 10.8.3.3.43140: Flags [.], ack 149746, win 126, options [nop,nop,TS val 2536878325 ecr 891156144], length 0
19:33:35.620191 IP 99.181.64.200.1935 > 10.8.3.3.43140: Flags [.], ack 149785, win 126, options [nop,nop,TS val 2536878345 ecr 891156207], length 0
19:33:35.620226 IP 10.8.3.3.43140 > 99.181.64.200.1935: Flags [P.], seq 157669:157804, ack 1, win 501, options [nop,nop,TS val 891156476 ecr 2536878345], length 135
19:33:35.661722 IP 10.8.3.3.43140 > 99.181.64.200.1935: Flags [.], seq 157804:159118, ack 1, win 501, options [nop,nop,TS val 891156517 ecr 2536878345], length 1314
19:33:35.692389 IP 10.8.3.3.43140 > 99.181.64.200.1935: Flags [.], seq 159118:160432, ack 1, win 501, options [nop,nop,TS val 891156548 ecr 2536878345], length 1314
19:33:35.692944 IP 99.181.64.200.1935 > 10.8.3.3.43140: Flags [.], ack 152413, win 126, options [nop,nop,TS val 2536878418 ecr 891156248], length 0
19:33:35.737318 IP 10.8.3.3.43140 > 99.181.64.200.1935: Flags [.], seq 160432:161746, ack 1, win 501, options [nop,nop,TS val 891156593 ecr 2536878418], length 1314
19:33:35.792277 IP 99.181.64.200.1935 > 10.8.3.3.43140: Flags [.], ack 155041, win 126, options [nop,nop,TS val 2536878517 ecr 891156314], length 0
19:33:35.793611 IP 10.8.3.3.43140 > 99.181.64.200.1935: Flags [.], seq 161746:163060, ack 1, win 501, options [nop,nop,TS val 891156649 ecr 2536878517], length 1314
19:33:35.823075 IP 10.8.3.3.43140 > 99.181.64.200.1935: Flags [.], seq 163060:164374, ack 1, win 501, options [nop,nop,TS val 891156678 ecr 2536878517], length 1314
19:33:35.863819 IP 99.181.64.200.1935 > 10.8.3.3.43140: Flags [.], ack 157669, win 126, options [nop,nop,TS val 2536878588 ecr 891156417], length 0
19:33:35.866021 IP 10.8.3.3.43140 > 99.181.64.200.1935: Flags [.], seq 164374:165688, ack 1, win 501, options [nop,nop,TS val 891156721 ecr 2536878588], length 1314
19:33:35.888944 IP 99.181.64.200.1935 > 10.8.3.3.43140: Flags [.], ack 157804, win 126, options [nop,nop,TS val 2536878613 ecr 891156476], length 0
19:33:35.888988 IP 10.8.3.3.43140 > 99.181.64.200.1935: Flags [P.], seq 165688:166558, ack 1, win 501, options [nop,nop,TS val 891156744 ecr 2536878613], length 870
19:33:35.957405 IP 10.8.3.3.43140 > 99.181.64.200.1935: Flags [.], seq 166558:167872, ack 1, win 501, options [nop,nop,TS val 891156813 ecr 2536878613], length 1314
19:33:35.961302 IP 99.181.64.200.1935 > 10.8.3.3.43140: Flags [.], ack 160432, win 126, options [nop,nop,TS val 2536878686 ecr 891156517], length 0
19:33:35.992216 IP 10.8.3.3.43140 > 99.181.64.200.1935: Flags [.], seq 167872:169186, ack 1, win 501, options [nop,nop,TS val 891156848 ecr 2536878686], length 1314
19:33:36.028177 IP 10.8.3.3.43140 > 99.181.64.200.1935: Flags [.], seq 169186:170500, ack 1, win 501, options [nop,nop,TS val 891156883 ecr 2536878686], length 1314
19:33:36.062620 IP 99.181.64.200.1935 > 10.8.3.3.43140: Flags [.], ack 163060, win 126, options [nop,nop,TS val 2536878787 ecr 891156593], length 0
19:33:36.095115 IP 10.8.3.3.43140 > 99.181.64.200.1935: Flags [.], seq 170500:171814, ack 1, win 501, options [nop,nop,TS val 891156950 ecr 2536878787], length 1314
19:33:36.122877 IP 10.8.3.3.43140 > 99.181.64.200.1935: Flags [.], seq 171814:173128, ack 1, win 501, options [nop,nop,TS val 891156978 ecr 2536878787], length 1314
19:33:36.135043 IP 99.181.64.200.1935 > 10.8.3.3.43140: Flags [.], ack 165688, win 126, options [nop,nop,TS val 2536878860 ecr 891156678], length 0
19:33:36.157829 IP 99.181.64.200.1935 > 10.8.3.3.43140: Flags [.], ack 166558, win 126, options [nop,nop,TS val 2536878882 ecr 891156744], length 0
19:33:36.157875 IP 10.8.3.3.43140 > 99.181.64.200.1935: Flags [P.], seq 173128:173724, ack 1, win 501, options [nop,nop,TS val 891157013 ecr 2536878882], length 596
19:33:36.195305 IP 10.8.3.3.43140 > 99.181.64.200.1935: Flags [.], seq 173724:175038, ack 1, win 501, options [nop,nop,TS val 891157051 ecr 2536878882], length 1314
19:33:36.228362 IP 10.8.3.3.43140 > 99.181.64.200.1935: Flags [.], seq 175038:176352, ack 1, win 501, options [nop,nop,TS val 891157084 ecr 2536878882], length 1314
19:33:36.261269 IP 99.181.64.200.1935 > 10.8.3.3.43140: Flags [.], ack 169186, win 126, options [nop,nop,TS val 2536878986 ecr 891156813], length 0
19:33:36.272857 IP 10.8.3.3.43140 > 99.181.64.200.1935: Flags [.], seq 176352:177666, ack 1, win 501, options [nop,nop,TS val 891157128 ecr 2536878986], length 1314
19:33:36.326524 IP 10.8.3.3.43140 > 99.181.64.200.1935: Flags [.], seq 177666:178980, ack 1, win 501, options [nop,nop,TS val 891157182 ecr 2536878986], length 1314
19:33:36.358623 IP 10.8.3.3.43140 > 99.181.64.200.1935: Flags [.], seq 178980:180294, ack 1, win 501, options [nop,nop,TS val 891157214 ecr 2536878986], length 1314
19:33:36.364185 IP 99.181.64.200.1935 > 10.8.3.3.43140: Flags [.], ack 171814, win 126, options [nop,nop,TS val 2536879089 ecr 891156883], length 0
19:33:36.401419 IP 10.8.3.3.43140 > 99.181.64.200.1935: Flags [.], seq 180294:181608, ack 1, win 501, options [nop,nop,TS val 891157257 ecr 2536879089], length 1314
19:33:36.426583 IP 99.181.64.200.1935 > 10.8.3.3.43140: Flags [.], ack 173724, win 126, options [nop,nop,TS val 2536879151 ecr 891156978], length 0
19:33:36.426605 IP 10.8.3.3.43140 > 99.181.64.200.1935: Flags [P.], seq 181608:182589, ack 1, win 501, options [nop,nop,TS val 891157282 ecr 2536879151], length 981
19:33:36.494939 IP 10.8.3.3.43140 > 99.181.64.200.1935: Flags [.], seq 182589:183903, ack 1, win 501, options [nop,nop,TS val 891157350 ecr 2536879151], length 1314
19:33:36.497363 IP 99.181.64.200.1935 > 10.8.3.3.43140: Flags [.], ack 176352, win 126, options [nop,nop,TS val 2536879222 ecr 891157051], length 0
19:33:36.528387 IP 10.8.3.3.43140 > 99.181.64.200.1935: Flags [.], seq 183903:185217, ack 1, win 501, options [nop,nop,TS val 891157384 ecr 2536879222], length 1314
19:33:36.558344 IP 10.8.3.3.43140 > 99.181.64.200.1935: Flags [.], seq 185217:186531, ack 1, win 501, options [nop,nop,TS val 891157414 ecr 2536879222], length 1314
19:33:36.595318 IP 99.181.64.200.1935 > 10.8.3.3.43140: Flags [.], ack 178980, win 126, options [nop,nop,TS val 2536879320 ecr 891157128], length 0
