08:48:40.407533 IP 10.8.1.7.54164 > 99.181.101.237.1935: Flags [.], seq 1140017385:1140018699, ack 1941151014, win 501, options [nop,nop,TS val 697559257 ecr 3809673124], length 1314
08:48:40.433482 IP 99.181.101.237.1935 > 10.8.1.7.54164: Flags [.], ack 4294956075, win 126, options [nop,nop,TS val 3809673213 ecr 697558786], length 0
08:48:40.439245 IP 10.8.1.7.54164 > 99.181.101.237.1935: Flags [.], seq 1314:2628, ack 1, win 501, options [nop,nop,TS val 697559289 ecr 3809673213], length 1314
08:48:40.472432 IP 10.8.1.7.54164 > 99.181.101.237.1935: Flags [.], seq 2628:3942, ack 1, win 501, options [nop,nop,TS val 697559322 ecr 3809673213], length 1314
08:48:40.536547 IP 99.181.101.237.1935 > 10.8.1.7.54164: Flags [.], ack 4294958703, win 126, options [nop,nop,TS val 3809673316 ecr 697558861], length 0
08:48:40.545875 IP 10.8.1.7.54164 > 99.181.101.237.1935: Flags [.], seq 3942:5256, ack 1, win 501, options [nop,nop,TS val 697559396 ecr 3809673316], length 1314
08:48:40.550271 IP 99.181.101.237.1935 > 10.8.1.7.54164: Flags [.], ack 4294959412, win 126, options [nop,nop,TS val 3809673330 ecr 697558940], length 0
08:48:40.550302 IP 10.8.1.7.54164 > 99.181.101.237.1935: Flags [P.], seq 5256:6073, ack 1, win 501, options [nop,nop,TS val 697559400 ecr 3809673330], length 817
08:48:40.610212 IP 10.8.1.7.54164 > 99.181.101.237.1935: Flags [.], seq 6073:7387, ack 1, win 501, options [nop,nop,TS val 697559460 ecr 3809673330], length 1314
08:48:40.634376 IP 99.181.101.237.1935 > 10.8.1.7.54164: Flags [.], ack 4294962040, win 126, options [nop,nop,TS val 3809673414 ecr 697558991], length 0
08:48:40.640145 IP 10.8.1.7.54164 > 99.181.101.237.1935: Flags [.], seq 7387:8701, ack 1, win 501, options [nop,nop,TS val 697559490 ecr 3809673414], length 1314
08:48:40.674616 IP 10.8.1.7.54164 > 99.181.101.237.1935: Flags [.], seq 8701:10015, ack 1, win 501, options [nop,nop,TS val 697559524 ecr 3809673414], length 1314
08:48:40.734633 IP 99.181.101.237.1935 > 10.8.1.7.54164: Flags [.], ack 4294964668, win 126, options [nop,nop,TS val 3809673514 ecr 697559056], length 0
08:48:40.738719 IP 10.8.1.7.54164 > 99.181.101.237.1935: Flags [.], seq 10015:11329, ack 1, win 501, options [nop,nop,TS val 697559588 ecr 3809673514], length 1314
08:48:40.772911 IP 10.8.1.7.54164 > 99.181.101.237.1935: Flags [.], seq 11329:12643, ack 1, win 501, options [nop,nop,TS val 697559623 ecr 3809673514], length 1314
08:48:40.797108 IP 99.181.101.237.1935 > 10.8.1.7.54164: Flags [.], ack 0, win 126, options [nop,nop,TS val 3809673577 ecr 697559160], length 0
08:48:40.807810 IP 10.8.1.7.54164 > 99.181.101.237.1935: Flags [.], seq 12643:13957, ack 1, win 501, options [nop,nop,TS val 697559657 ecr 3809673577], length 1314
08:48:40.872465 IP 10.8.1.7.54164 > 99.181.101.237.1935: Flags [.], seq 13957:15271, ack 1, win 501, options [nop,nop,TS val 697559722 ecr 3809673577], length 1314
08:48:40.899870 IP 99.181.101.237.1935 > 10.8.1.7.54164: Flags [.], ack 2628, win 126, options [nop,nop,TS val 3809673679 ecr 697559257], length 0
08:48:40.910076 IP 10.8.1.7.54164 > 99.181.101.237.1935: Flags [.], seq 15271:16585, ack 1, win 501, options [nop,nop,TS val 697559760 ecr 3809673679], length 1314
08:48:40.937634 IP 10.8.1.7.54164 > 99.181.101.237.1935: Flags [.], seq 16585:17899, ack 1, win 501, options [nop,nop,TS val 697559787 ecr 3809673679], length 1314
08:48:41.000211 IP 99.181.101.237.1935 > 10.8.1.7.54164: Flags [.], ack 3942, win 126, options [nop,nop,TS val 3809673780 ecr 697559322], length 0
08:48:41.003358 IP 10.8.1.7.54164 > 99.181.101.237.1935: Flags [.], seq 17899:19213, ack 1, win 501, options [nop,nop,TS val 697559853 ecr 3809673780], length 1314
08:48:41.010242 IP 99.181.101.237.1935 > 10.8.1.7.54164: Flags [.], ack 6073, win 126, options [nop,nop,TS val 3809673790 ecr 697559396], length 0
08:48:41.010258 IP 10.8.1.7.54164 > 99.181.101.237.1935: Flags [P.], seq 19213:19921, ack 1, win 501, options [nop,nop,TS val 697559860 ecr 3809673790], length 708
08:48:41.079636 IP 10.8.1.7.54164 > 99.181.101.237.1935: Flags [.], seq 19921:21235, ack 1, win 501, options [nop,nop,TS val 697559929 ecr 3809673790], length 1314
08:48:41.100411 IP 99.181.101.237.1935 > 10.8.1.7.54164: Flags [.], ack 8701, win 126, options [nop,nop,TS val 3809673880 ecr 697559460], length 0
08:48:41.102988 IP 10.8.1.7.54164 > 99.181.101.237.1935: Flags [.], seq 21235:22549, ack 1, win 501, options [nop,nop,TS val 697559953 ecr 3809673880], length 1314
08:48:41.143320 IP 10.8.1.7.54164 > 99.181.101.237.1935: Flags [.], seq 22549:23863, ack 1, win 501, options [nop,nop,TS val 697559993 ecr 3809673880], length 1314
08:48:41.199074 IP 99.181.101.237.1935 > 10.8.1.7.54164: Flags [.], ack 11329, win 126, options [nop,nop,TS val 3809673979 ecr 697559524], length 0
08:48:41.207430 IP 10.8.1.7.54164 > 99.181.101.237.1935: Flags [.], seq 23863:25177, ack 1, win 501, options [nop,nop,TS val 697560057 ecr 3809673979], length 1314
08:48:41.236540 IP 10.8.1.7.54164 > 99.181.101.237.1935: Flags [.], seq 25177:26491, ack 1, win 501, options [nop,nop,TS val 697560086 ecr 3809673979], length 1314
08:48:41.268253 IP 99.181.101.237.1935 > 10.8.1.7.54164: Flags [.], ack 13957, win 126, options [nop,nop,TS val 3809674048 ecr 697559623], length 0
08:48:41.271031 IP 10.8.1.7.54164 > 99.181.101.237.1935: Flags [.], seq 26491:27805, ack 1, win 501, options [nop,nop,TS val 697560121 ecr 3809674048], length 1314
08:48:41.340749 IP 10.8.1.7.54164 > 99.181.101.237.1935: Flags [.], seq 27805:29119, ack 1, win 501, options [nop,nop,TS val 697560190 ecr 3809674048], length 1314
08:48:41.370900 IP 99.181.101.237.1935 > 10.8.1.7.54164: Flags [.], ack 16585, win 126, options [nop,nop,TS val 3809674150 ecr 697559722], length 0
08:48:41.378844 IP 10.8.1.7.54164 > 99.181.101.237.1935: Flags [.], seq 29119:30433, ack 1, win 501, options [nop,nop,TS val 697560229 ecr 3809674150], length 1314
08:48:41.404831 IP 10.8.1.7.54164 > 99.181.101.237.1935: Flags [.], seq 30433:31747, ack 1, win 501, options [nop,nop,TS val 697560255 ecr 3809674150], length 1314
08:48:41.463561 IP 99.181.101.237.1935 > 10.8.1.7.54164: Flags [.], ack 19213, win 126, options [nop,nop,TS val 3809674243 ecr 697559787], length 0
08:48:41.471123 IP 99.181.101.237.1935 > 10.8.1.7.54164: Flags [.], ack 19921, win 126, options [nop,nop,TS val 3809674251 ecr 697559860], length 0
08:48:41.471149 IP 10.8.1.7.54164 > 99.181.101.237.1935: Flags [P.], seq 31747:33027, ack 1, win 501, options [nop,nop,TS val 697560321 ecr 3809674251], length 1280
08:48:41.506860 IP 10.8.1.7.54164 > 99.181.101.237.1935: Flags [.], seq 33027:34341, ack 1, win 501, options [nop,nop,TS val 697560357 ecr 3809674251], length 1314
08:48:41.538351 IP 10.8.1.7.54164 > 99.181.101.237.1935: Flags [.], seq 34341:35655, ack 1, win 501, options [nop,nop,TS val 697560388 ecr 3809674251], length 1314
08:48:41.563249 IP 99.181.101.237.1935 > 10.8.1.7.54164: Flags [.], ack 22549, win 126, options [nop,nop,TS val 3809674343 ecr 697559929], length 0
08:48:41.592065 IP 10.8.1.7.54164 > 99.181.101.237.1935: Flags [.], seq 35655:36969, ack 1, win 501, options [nop,nop,TS val 697560442 ecr 3809674343], length 1314
08:48:41.639326 IP 10.8.1.7.54164 > 99.181.101.237.1935: Flags [.], seq 36969:38283, ack 1, win 501, options [nop,nop,TS val 697560489 ecr 3809674343], length 1314
08:48:41.667877 IP 99.181.101.237.1935 > 10.8.1.7.54164: Flags [.], ack 25177, win 126, options [nop,nop,TS val 3809674448 ecr 697559993], length 0
08:48:41.677502 IP 10.8.1.7.54164 > 99.181.101.237.1935: Flags [.], seq 38283:39597, ack 1, win 501, options [nop,nop,TS val 697560527 ecr 3809674448], length 1314
08:48:41.720464 IP 10.8.1.7.54164 > 99.181.101.237.1935: Flags [.], seq 39597:40911, ack 1, win 501, options [nop,nop,TS val 697560570 ecr 3809674448], length 1314
08:48:41.731132 IP 99.181.101.237.1935 > 10.8.1.7.54164: Flags [.], ack 27805, win 126, options [nop,nop,TS val 3809674511 ecr 697560086], length 0
08:48:41.773694 IP 10.8.1.7.54164 > 99.181.101.237.1935: Flags [.], seq 40911:42225, ack 1, win 501, options [nop,nop,TS val 697560623 ecr 3809674511], length 1314
08:48:41.805896 IP 10.8.1.7.54164 > 99.181.101.237.1935: Flags [.], seq 42225:43539, ack 1, win 501, options [nop,nop,TS val 697560656 ecr 3809674511], length 1314
08:48:41.839165 IP 99.181.101.237.1935 > 10.8.1.7.54164: Flags [.], ack 30433, win 126, options [nop,nop,TS val 3809674619 ecr 697560190], length 0
08:48:41.848772 IP 10.8.1.7.54164 > 99.181.101.237.1935: Flags [.], seq 43539:44853, ack 1, win 501, options [nop,nop,TS val 697560698 ecr 3809674619], length 1314
08:48:41.912507 IP 10.8.1.7.54164 > 99.181.101.237.1935: Flags [.], seq 44853:46167, ack 1, win 501, options [nop,nop,TS val 697560762 ecr 3809674619], length 1314
08:48:41.931224 IP 99.181.101.237.1935 > 10.8.1.7.54164: Flags [.], ack 33027, win 126, options [nop,nop,TS val 3809674711 ecr 697560255], length 0
08:48:41.931239 IP 10.8.1.7.54164 > 99.181.101.237.1935: Flags [P.], seq 46167:46883, ack 1, win 501, options [nop,nop,TS val 697560781 ecr 3809674711], length 716
08:48:41.976389 IP 10.8.1.7.54164 > 99.181.101.237.1935: Flags [.], seq 46883:48197, ack 1, win 501, options [nop,nop,TS val 697560826 ecr 3809674711], length 1314
08:48:41.998848 IP 99.181.101.237.1935 > 10.8.1.7.54164: Flags [.], ack 35655, win 126, options [nop,nop,TS val 3809674778 ecr 697560357], length 0
08:48:42.007110 IP 10.8.1.7.54164 > 99.181.101.237.1935: Flags [.], seq 48197:49511, ack 1, win 501, options [nop,nop,TS val 697560857 ecr 3809674778], length 1314
08:48:42.040676 IP 10.8.1.7.54164 > 99.181.101.237.1935: Flags [.], seq 49511:50825, ack 1, win 501, options [nop,nop,TS val 697560890 ecr 3809674778], length 1314
08:48:42.099586 IP 99.181.101.237.1935 > 10.8.1.7.54164: Flags [.], ack 38283, win 126, options [nop,nop,TS val 3809674879 ecr 697560442], length 0
08:48:42.107115 IP 10.8.1.7.54164 > 99.181.101.237.1935: Flags [.], seq 50825:52139, ack 1, win 501, options [nop,nop,TS val 697560957 ecr 3809674879], length 1314
08:48:42.147887 IP 10.8.1.7.54164 > 99.181.101.237.1935: Flags [.], seq 52139:53453, ack 1, win 501, options [nop,nop,TS val 697560998 ecr 3809674879], length 1314
08:48:42.169630 IP 10.8.1.7.54164 > 99.181.101.237.1935: Flags [.], seq 53453:54767, ack 1, win 501, options [nop,nop,TS val 697561019 ecr 3809674879], length 1314
08:48:42.180674 IP 99.181.101.237.1935 > 10.8.1.7.54164: Flags [.], ack 40911, win 126, options [nop,nop,TS val 3809674961 ecr 697560527], length 0
08:48:42.239195 IP 10.8.1.7.54164 > 99.181.101.237.1935: Flags [.], seq 54767:56081, ack 1, win 501, options [nop,nop,TS val 697561089 ecr 3809674961], length 1314
08:48:42.266277 IP 99.181.101.237.1935 > 10.8.1.7.54164: Flags [.], ack 43539, win 126, options [nop,nop,TS val 3809675046 ecr 697560623], length 0
08:48:42.275812 IP 10.8.1.7.54164 > 99.181.101.237.1935: Flags [.], seq 56081:57395, ack 1, win 501, options [nop,nop,TS val 697561125 ecr 3809675046], length 1314
08:48:42.306763 IP 10.8.1.7.54164 > 99.181.101.237.1935: Flags [.], seq 57395:58709, ack 1, win 501, options [nop,nop,TS val 697561156 ecr 3809675046], length 1314
08:48:42.371638 IP 10.8.1.7.54164 > 99.181.101.237.1935: Flags [.], seq 58709:60023, ack 1, win 501, options [nop,nop,TS val 697561221 ecr 3809675046], length 1314
08:48:42.372883 IP 99.181.101.237.1935 > 10.8.1.7.54164: Flags [.], ack 46167, win 126, options [nop,nop,TS val 3809675153 ecr 697560698], length 0
08:48:42.391525 IP 99.181.101.237.1935 > 10.8.1.7.54164: Flags [.], ack 46883, win 126, options [nop,nop,TS val 3809675171 ecr 697560781], length 0
08:48:42.391547 IP 10.8.1.7.54164 > 99.181.101.237.1935: Flags [P.], seq 60023:60827, ack 1, win 501, options [nop,nop,TS val 697561241 ecr 3809675171], length 804
08:48:42.447248 IP 10.8.1.7.54164 > 99.181.101.237.1935: Flags [.], seq 60827:62141, ack 1, win 501, options [nop,nop,TS val 697561297 ecr 3809675171], length 1314
08:48:42.467528 IP 99.181.101.237.1935 > 10.8.1.7.54164: Flags [.], ack 49511, win 126, options [nop,nop,TS val 3809675247 ecr 697560826], length 0
08:48:42.470846 IP 10.8.1.7.54164 > 99.181.101.237.1935: Flags [.], seq 62141:63455, ack 1, win 501, options [nop,nop,TS val 697561321 ecr 3809675247], length 1314
08:48:42.510975 IP 10.8.1.7.54164 > 99.181.101.237.1935: Flags [.], seq 63455:64769, ack 1, win 501, options [nop,nop,TS val 697561361 ecr 3809675247], length 1314
08:48:42.567488 IP 99.181.101.237.1935 > 10.8.1.7.54164: Flags [.], ack 52139, win 126, options [nop,nop,TS val 3809675347 ecr 697560890], length 0
08:48:42.574721 IP 10.8.1.7.54164 > 99.181.101.237.1935: Flags [.], seq 64769:66083, ack 1, win 501, options [nop,nop,TS val 697561424 ecr 3809675347], length 1314
08:48:42.607223 IP 10.8.1.7.54164 > 99.181.101.237.1935: Flags [.], seq 66083:67397, ack 1, win 501, options [nop,nop,TS val 697561457 ecr 3809675347], length 1314
08:48:42.629765 IP 99.181.101.237.1935 > 10.8.1.7.54164: Flags [.], ack 54767, win 126, options [nop,nop,TS val 3809675410 ecr 697560998], length 0
08:48:42.640689 IP 10.8.1.7.54164 > 99.181.101.237.1935: Flags [.], seq 67397:68711, ack 1, win 501, options [nop,nop,TS val 697561490 ecr 3809675410], length 1314
08:48:42.705771 IP 10.8.1.7.54164 > 99.181.101.237.1935: Flags [.], seq 68711:70025, ack 1, win 501, options [nop,nop,TS val 697561555 ecr 3809675410], length 1314
08:48:42.745783 IP 10.8.1.7.54164 > 99.181.101.237.1935: Flags [.], seq 70025:71339, ack 1, win 501, options [nop,nop,TS val 697561595 ecr 3809675410], length 1314
08:48:42.767129 IP 99.181.101.237.1935 > 10.8.1.7.54164: Flags [.], ack 56081, win 126, options [nop,nop,TS val 3809675547 ecr 697561089,nop,nop,sack 1 {57395:58709}], length 0
08:48:42.771411 IP 10.8.1.7.54164 > 99.181.101.237.1935: Flags [.], seq 71339:72653, ack 1, win 501, options [nop,nop,TS val 697561621 ecr 3809675547], length 1314
08:48:42.832116 IP 99.181.101.237.1935 > 10.8.1.7.54164: Flags [.], ack 56081, win 126, options [nop,nop,TS val 3809675612 ecr 697561089,nop,nop,sack 1 {57395:60023}], length 0
08:48:42.836577 IP 10.8.1.7.54164 > 99.181.101.237.1935: Flags [.], seq 72653:73967, ack 1, win 501, options [nop,nop,TS val 697561686 ecr 3809675612], length 1314
08:48:42.851858 IP 99.181.101.237.1935 > 10.8.1.7.54164: Flags [.], ack 56081, win 126, options [nop,nop,TS val 3809675632 ecr 697561089,nop,nop,sack 1 {57395:60827}], length 0
08:48:42.851873 IP 10.8.1.7.54164 > 99.181.101.237.1935: Flags [.], seq 56081:57395, ack 1, win 501, options [nop,nop,TS val 697561702 ecr 3809675632], length 1314
08:48:42.908553 IP 99.181.101.237.1935 > 10.8.1.7.54164: Flags [.], ack 56081, win 126, options [nop,nop,TS val 3809675687 ecr 697561089,nop,nop,sack 1 {57395:62141}], length 0
08:48:42.908610 IP 10.8.1.7.54164 > 99.181.101.237.1935: Flags [.], seq 73967:75281, ack 1, win 501, options [nop,nop,TS val 697561758 ecr 3809675687], length 1314
08:48:42.932363 IP 99.181.101.237.1935 > 10.8.1.7.54164: Flags [.], ack 56081, win 126, options [nop,nop,TS val 3809675711 ecr 697561089,nop,nop,sack 1 {57395:63455}], length 0
08:48:42.932404 IP 10.8.1.7.54164 > 99.181.101.237.1935: Flags [.], seq 75281:76595, ack 1, win 501, options [nop,nop,TS val 697561782 ecr 3809675711], length 1314
08:48:42.972296 IP 99.181.101.237.1935 > 10.8.1.7.54164: Flags [.], ack 56081, win 126, options [nop,nop,TS val 3809675751 ecr 697561089,nop,nop,sack 1 {57395:64769}], length 0
08:48:42.980155 IP 10.8.1.7.54164 > 99.181.101.237.1935: Flags [.], seq 76595:77909, ack 1, win 501, options [nop,nop,TS val 697561830 ecr 3809675751], length 1314
08:48:43.036102 IP 99.181.101.237.1935 > 10.8.1.7.54164: Flags [.], ack 56081, win 126, options [nop,nop,TS val 3809675815 ecr 697561089,nop,nop,sack 1 {57395:66083}], length 0
08:48:43.036137 IP 10.8.1.7.54164 > 99.181.101.237.1935: Flags [.], seq 77909:79223, ack 1, win 501, options [nop,nop,TS val 697561886 ecr 3809675815], length 1314
08:48:43.068782 IP 99.181.101.237.1935 > 10.8.1.7.54164: Flags [.], ack 56081, win 126, options [nop,nop,TS val 3809675847 ecr 697561089,nop,nop,sack 1 {57395:67397}], length 0
08:48:43.068828 IP 10.8.1.7.54164 > 99.181.101.237.1935: Flags [.], seq 79223:80537, ack 1, win 501, options [nop,nop,TS val 697561919 ecr 3809675847], length 1314
08:48:43.102566 IP 99.181.101.237.1935 > 10.8.1.7.54164: Flags [.], ack 56081, win 126, options [nop,nop,TS val 3809675881 ecr 697561089,nop,nop,sack 1 {57395:68711}], length 0
08:48:43.107801 IP 10.8.1.7.54164 > 99.181.101.237.1935: Flags [.], seq 80537:81851, ack 1, win 501, options [nop,nop,TS val 697561957 ecr 3809675881], length 1314
08:48:43.167075 IP 99.181.101.237.1935 > 10.8.1.7.54164: Flags [.], ack 56081, win 126, options [nop,nop,TS val 3809675946 ecr 697561089,nop,nop,sack 1 {57395:70025}], length 0
08:48:43.167108 IP 10.8.1.7.54164 > 99.181.101.237.1935: Flags [.], seq 81851:83165, ack 1, win 501, options [nop,nop,TS val 697562017 ecr 3809675946], length 1314
08:48:43.207251 IP 99.181.101.237.1935 > 10.8.1.7.54164: Flags [.], ack 56081, win 126, options [nop,nop,TS val 3809675986 ecr 697561089,nop,nop,sack 1 {57395:71339}], length 0
08:48:43.207309 IP 10.8.1.7.54164 > 99.181.101.237.1935: Flags [.], seq 83165:84479, ack 1, win 501, options [nop,nop,TS val 697562057 ecr 3809675986], length 1314
08:48:43.232772 IP 99.181.101.237.1935 > 10.8.1.7.54164: Flags [.], ack 56081, win 126, options [nop,nop,TS val 3809676011 ecr 697561089,nop,nop,sack 1 {57395:72653}], length 0
08:48:43.236116 IP 10.8.1.7.54164 > 99.181.101.237.1935: Flags [.], seq 84479:85793, ack 1, win 501, options [nop,nop,TS val 697562086 ecr 3809676011], length 1314
08:48:43.297881 IP 99.181.101.237.1935 > 10.8.1.7.54164: Flags [.], ack 56081, win 126, options [nop,nop,TS val 3809676077 ecr 697561089,nop,nop,sack 1 {57395:73967}], length 0
08:48:43.297901 IP 10.8.1.7.54164 > 99.181.101.237.1935: Flags [.], seq 85793:87107, ack 1, win 501, options [nop,nop,TS val 697562148 ecr 3809676077], length 1314
08:48:43.311847 IP 99.181.101.237.1935 > 10.8.1.7.54164: Flags [.], ack 73967, win 104, options [nop,nop,TS val 3809676092 ecr 697561702], length 0
08:48:43.311869 IP 10.8.1.7.54164 > 99.181.101.237.1935: Flags [.], seq 87107:88421, ack 1, win 501, options [nop,nop,TS val 697562162 ecr 3809676092], length 1314
08:48:43.311870 IP 10.8.1.7.54164 > 99.181.101.237.1935: Flags [P.], seq 88421:88632, ack 1, win 501, options [nop,nop,TS val 697562162 ecr 3809676092], length 211
08:48:43.374218 IP 10.8.1.7.54164 > 99.181.101.237.1935: Flags [.], seq 88632:89946, ack 1, win 501, options [nop,nop,TS val 697562224 ecr 3809676092], length 1314
08:48:43.393900 IP 99.181.101.237.1935 > 10.8.1.7.54164: Flags [.], ack 76595, win 126, options [nop,nop,TS val 3809676174 ecr 697561758], length 0
08:48:43.406748 IP 10.8.1.7.54164 > 99.181.101.237.1935: Flags [.], seq 89946:91260, ack 1, win 501, options [nop,nop,TS val 697562256 ecr 3809676174], length 1314
08:48:43.437745 IP 10.8.1.7.54164 > 99.181.101.237.1935: Flags [.], seq 91260:92574, ack 1, win 501, options [nop,nop,TS val 697562287 ecr 3809676174], length 1314
08:48:43.497431 IP 99.181.101.237.1935 > 10.8.1.7.54164: Flags [.], ack 79223, win 126, options [nop,nop,TS val 3809676277 ecr 697561830], length 0
08:48:43.513128 IP 10.8.1.7.54164 > 99.181.101.237.1935: Flags [.], seq 92574:93888, ack 1, win 501, options [nop,nop,TS val 697562363 ecr 3809676277], length 1314
08:48:43.536567 IP 10.8.1.7.54164 > 99.181.101.237.1935: Flags [.], seq 93888:95202, ack 1, win 501, options [nop,nop,TS val 697562386 ecr 3809676277], length 1314
08:48:43.569057 IP 99.181.101.237.1935 > 10.8.1.7.54164: Flags [.], ack 81851, win 126, options [nop,nop,TS val 3809676349 ecr 697561919], length 0
08:48:43.576988 IP 10.8.1.7.54164 > 99.181.101.237.1935: Flags [.], seq 95202:96516, ack 1, win 501, options [nop,nop,TS val 697562427 ecr 3809676349], length 1314
08:48:43.641313 IP 10.8.1.7.54164 > 99.181.101.237.1935: Flags [.], seq 96516:97830, ack 1, win 501, options [nop,nop,TS val 697562491 ecr 3809676349], length 1314
08:48:43.668737 IP 99.181.101.237.1935 > 10.8.1.7.54164: Flags [.], ack 84479, win 126, options [nop,nop,TS val 3809676449 ecr 697562017], length 0
08:48:43.672305 IP 10.8.1.7.54164 > 99.181.101.237.1935: Flags [.], seq 97830:99144, ack 1, win 501, options [nop,nop,TS val 697562522 ecr 3809676449], length 1314
08:48:43.705107 IP 10.8.1.7.54164 > 99.181.101.237.1935: Flags [.], seq 99144:100458, ack 1, win 501, options [nop,nop,TS val 697562555 ecr 3809676449], length 1314
08:48:43.759491 IP 99.181.101.237.1935 > 10.8.1.7.54164: Flags [.], ack 87107, win 126, options [nop,nop,TS val 3809676539 ecr 697562086], length 0
08:48:43.771262 IP 10.8.1.7.54164 > 99.181.101.237.1935: Flags [.], seq 100458:101772, ack 1, win 501, options [nop,nop,TS val 697562621 ecr 3809676539], length 1314
08:48:43.773320 IP 99.181.101.237.1935 > 10.8.1.7.54164: Flags [.], ack 88632, win 126, options [nop,nop,TS val 3809676553 ecr 697562162], length 0
08:48:43.773341 IP 10.8.1.7.54164 > 99.181.101.237.1935: Flags [P.], seq 101772:102589, ack 1, win 501, options [nop,nop,TS val 697562623 ecr 3809676553], length 817
08:48:43.840509 IP 10.8.1.7.54164 > 99.181.101.237.1935: Flags [.], seq 102589:103903, ack 1, win 501, options [nop,nop,TS val 697562690 ecr 3809676553], length 1314
08:48:43.867947 IP 99.181.101.237.1935 > 10.8.1.7.54164: Flags [.], ack 91260, win 131, options [nop,nop,TS val 3809676648 ecr 697562224], length 0
08:48:43.875793 IP 10.8.1.7.54164 > 99.181.101.237.1935: Flags [.], seq 103903:105217, ack 1, win 501, options [nop,nop,TS val 697562725 ecr 3809676648], length 1314
08:48:43.899098 IP 99.181.101.237.1935 > 10.8.1.7.54164: Flags [.], ack 92574, win 137, options [nop,nop,TS val 3809676679 ecr 697562287], length 0
08:48:43.903027 IP 10.8.1.7.54164 > 99.181.101.237.1935: Flags [.], seq 105217:106531, ack 1, win 501, options [nop,nop,TS val 697562753 ecr 3809676679], length 1314
08:48:43.971269 IP 10.8.1.7.54164 > 99.181.101.237.1935: Flags [.], seq 106531:107845, ack 1, win 501, options [nop,nop,TS val 697562821 ecr 3809676679], length 1314
08:48:43.974723 IP 99.181.101.237.1935 > 10.8.1.7.54164: Flags [.], ack 93888, win 143, options [nop,nop,TS val 3809676754 ecr 697562363], length 0
08:48:43.997870 IP 99.181.101.237.1935 > 10.8.1.7.54164: Flags [.], ack 95202, win 148, options [nop,nop,TS val 3809676778 ecr 697562386], length 0
08:48:44.003128 IP 10.8.1.7.54164 > 99.181.101.237.1935: Flags [.], seq 107845:109159, ack 1, win 501, options [nop,nop,TS val 697562853 ecr 3809676778], length 1314
08:48:44.038277 IP 99.181.101.237.1935 > 10.8.1.7.54164: Flags [.], ack 96516, win 154, options [nop,nop,TS val 3809676818 ecr 697562427], length 0
08:48:44.045545 IP 10.8.1.7.54164 > 99.181.101.237.1935: Flags [.], seq 109159:110473, ack 1, win 501, options [nop,nop,TS val 697562895 ecr 3809676818], length 1314
08:48:44.102817 IP 99.181.101.237.1935 > 10.8.1.7.54164: Flags [.], ack 97830, win 160, options [nop,nop,TS val 3809676883 ecr 697562491], length 0
08:48:44.109696 IP 10.8.1.7.54164 > 99.181.101.237.1935: Flags [.], seq 110473:111787, ack 1, win 501, options [nop,nop,TS val 697562959 ecr 3809676883], length 1314
08:48:44.133722 IP 99.181.101.237.1935 > 10.8.1.7.54164: Flags [.], ack 99144, win 165, options [nop,nop,TS val 3809676914 ecr 697562522], length 0
08:48:44.140592 IP 10.8.1.7.54164 > 99.181.101.237.1935: Flags [.], seq 111787:113101, ack 1, win 501, options [nop,nop,TS val 697562990 ecr 3809676914], length 1314
08:48:44.166544 IP 99.181.101.237.1935 > 10.8.1.7.54164: Flags [.], ack 100458, win 171, options [nop,nop,TS val 3809676946 ecr 697562555], length 0
08:48:44.174216 IP 10.8.1.7.54164 > 99.181.101.237.1935: Flags [.], seq 113101:114415, ack 1, win 501, options [nop,nop,TS val 697563024 ecr 3809676946], length 1314
08:48:44.232712 IP 99.181.101.237.1935 > 10.8.1.7.54164: Flags [.], ack 101772, win 177, options [nop,nop,TS val 3809677012 ecr 697562621], length 0
08:48:44.234700 IP 99.181.101.237.1935 > 10.8.1.7.54164: Flags [.], ack 102589, win 182, options [nop,nop,TS val 3809677014 ecr 697562623], length 0
08:48:44.234722 IP 10.8.1.7.54164 > 99.181.101.237.1935: Flags [P.], seq 114415:115590, ack 1, win 501, options [nop,nop,TS val 697563084 ecr 3809677014], length 1175
08:48:44.280736 IP 10.8.1.7.54164 > 99.181.101.237.1935: Flags [.], seq 115590:116904, ack 1, win 501, options [nop,nop,TS val 697563130 ecr 3809677014], length 1314
08:48:44.302261 IP 99.181.101.237.1935 > 10.8.1.7.54164: Flags [.], ack 103903, win 188, options [nop,nop,TS val 3809677082 ecr 697562690], length 0
08:48:44.303130 IP 10.8.1.7.54164 > 99.181.101.237.1935: Flags [.], seq 116904:118218, ack 1, win 501, options [nop,nop,TS val 697563153 ecr 3809677082], length 1314
08:48:44.337282 IP 99.181.101.237.1935 > 10.8.1.7.54164: Flags [.], ack 105217, win 194, options [nop,nop,TS val 3809677117 ecr 697562725], length 0
08:48:44.344854 IP 10.8.1.7.54164 > 99.181.101.237.1935: Flags [.], seq 118218:119532, ack 1, win 501, options [nop,nop,TS val 697563195 ecr 3809677117], length 1314
08:48:44.364183 IP 99.181.101.237.1935 > 10.8.1.7.54164: Flags [.], ack 106531, win 199, options [nop,nop,TS val 3809677144 ecr 697562753], length 0
08:48:44.409381 IP 10.8.1.7.54164 > 99.181.101.237.1935: Flags [.], seq 119532:120846, ack 1, win 501, options [nop,nop,TS val 697563259 ecr 3809677144], length 1314
08:48:44.432457 IP 99.181.101.237.1935 > 10.8.1.7.54164: Flags [.], ack 107845, win 205, options [nop,nop,TS val 3809677212 ecr 697562821], length 0
08:48:44.436563 IP 10.8.1.7.54164 > 99.181.101.237.1935: Flags [.], seq 120846:122160, ack 1, win 501, options [nop,nop,TS val 697563286 ecr 3809677212], length 1314
08:48:44.464523 IP 99.181.101.237.1935 > 10.8.1.7.54164: Flags [.], ack 109159, win 210, options [nop,nop,TS val 3809677244 ecr 697562853], length 0
08:48:44.472951 IP 10.8.1.7.54164 > 99.181.101.237.1935: Flags [.], seq 122160:123474, ack 1, win 501, options [nop,nop,TS val 697563323 ecr 3809677244], length 1314
08:48:44.507256 IP 99.181.101.237.1935 > 10.8.1.7.54164: Flags [.], ack 110473, win 216, options [nop,nop,TS val 3809677287 ecr 697562895], length 0
08:48:44.538568 IP 10.8.1.7.54164 > 99.181.101.237.1935: Flags [.], seq 123474:124788, ack 1, win 501, options [nop,nop,TS val 697563388 ecr 3809677287], length 1314
08:48:44.571026 IP 99.181.101.237.1935 > 10.8.1.7.54164: Flags [.], ack 111787, win 222, options [nop,nop,TS val 3809677351 ecr 697562959], length 0
08:48:44.579493 IP 10.8.1.7.54164 > 99.181.101.237.1935: Flags [.], seq 124788:126102, ack 1, win 501, options [nop,nop,TS val 697563429 ecr 3809677351], length 1314
08:48:44.602405 IP 99.181.101.237.1935 > 10.8.1.7.54164: Flags [.], ack 113101, win 227, options [nop,nop,TS val 3809677382 ecr 697562990], length 0
08:48:44.603349 IP 10.8.1.7.54164 > 99.181.101.237.1935: Flags [.], seq 126102:127416, ack 1, win 501, options [nop,nop,TS val 697563453 ecr 3809677382], length 1314
08:48:44.635767 IP 99.181.101.237.1935 > 10.8.1.7.54164: Flags [.], ack 114415, win 233, options [nop,nop,TS val 3809677416 ecr 697563024], length 0
08:48:44.672659 IP 10.8.1.7.54164 > 99.181.101.237.1935: Flags [.], seq 127416:128730, ack 1, win 501, options [nop,nop,TS val 697563522 ecr 3809677416], length 1314
08:48:44.707498 IP 10.8.1.7.54164 > 99.181.101.237.1935: Flags [.], seq 128730:130044, ack 1, win 501, options [nop,nop,TS val 697563557 ecr 3809677416], length 1314
08:48:44.739476 IP 10.8.1.7.54164 > 99.181.101.237.1935: Flags [.], seq 130044:131358, ack 1, win 501, options [nop,nop,TS val 697563589 ecr 3809677416], length 1314
08:48:44.742154 IP 99.181.101.237.1935 > 10.8.1.7.54164: Flags [.], ack 114415, win 239, options [nop,nop,TS val 3809677522 ecr 697563024,nop,nop,sack 1 {115590:116904}], length 0
08:48:44.764590 IP 99.181.101.237.1935 > 10.8.1.7.54164: Flags [.], ack 114415, win 244, options [nop,nop,TS val 3809677544 ecr 697563024,nop,nop,sack 1 {115590:118218}], length 0
08:48:44.806117 IP 99.181.101.237.1935 > 10.8.1.7.54164: Flags [.], ack 114415, win 250, options [nop,nop,TS val 3809677586 ecr 697563024,nop,nop,sack 1 {115590:119532}], length 0
08:48:44.806176 IP 10.8.1.7.54164 > 99.181.101.237.1935: Flags [P.], seq 114415:115590, ack 1, win 501, options [nop,nop,TS val 697563656 ecr 3809677586], length 1175
08:48:44.870929 IP 99.181.101.237.1935 > 10.8.1.7.54164: Flags [.], ack 114415, win 256, options [nop,nop,TS val 3809677651 ecr 697563024,nop,nop,sack 1 {115590:120846}], length 0
08:48:44.870958 IP 10.8.1.7.54164 > 99.181.101.237.1935: Flags [.], seq 131358:132672, ack 1, win 501, options [nop,nop,TS val 697563721 ecr 3809677651], length 1314
08:48:44.897921 IP 99.181.101.237.1935 > 10.8.1.7.54164: Flags [.], ack 114415, win 261, options [nop,nop,TS val 3809677678 ecr 697563024,nop,nop,sack 1 {115590:122160}], length 0
08:48:44.897939 IP 10.8.1.7.54164 > 99.181.101.237.1935: Flags [.], seq 132672:133986, ack 1, win 501, options [nop,nop,TS val 697563748 ecr 3809677678], length 1314
08:48:44.934413 IP 99.181.101.237.1935 > 10.8.1.7.54164: Flags [.], ack 114415, win 267, options [nop,nop,TS val 3809677714 ecr 697563024,nop,nop,sack 1 {115590:123474}], length 0
08:48:44.934442 IP 10.8.1.7.54164 > 99.181.101.237.1935: Flags [.], seq 133986:135300, ack 1, win 501, options [nop,nop,TS val 697563784 ecr 3809677714], length 1314
08:48:44.999932 IP 99.181.101.237.1935 > 10.8.1.7.54164: Flags [.], ack 114415, win 273, options [nop,nop,TS val 3809677780 ecr 697563024,nop,nop,sack 1 {115590:124788}], length 0
08:48:44.999965 IP 10.8.1.7.54164 > 99.181.101.237.1935: Flags [.], seq 135300:136614, ack 1, win 501, options [nop,nop,TS val 697563850 ecr 3809677780], length 1314
08:48:45.040970 IP 99.181.101.237.1935 > 10.8.1.7.54164: Flags [.], ack 114415, win 278, options [nop,nop,TS val 3809677821 ecr 697563024,nop,nop,sack 1 {115590:126102}], length 0
08:48:45.041006 IP 10.8.1.7.54164 > 99.181.101.237.1935: Flags [.], seq 136614:137928, ack 1, win 501, options [nop,nop,TS val 697563891 ecr 3809677821], length 1314
08:48:45.066022 IP 99.181.101.237.1935 > 10.8.1.7.54164: Flags [.], ack 114415, win 284, options [nop,nop,TS val 3809677845 ecr 697563024,nop,nop,sack 1 {115590:127416}], length 0
08:48:45.066068 IP 10.8.1.7.54164 > 99.181.101.237.1935: Flags [.], seq 137928:139242, ack 1, win 501, options [nop,nop,TS val 697563916 ecr 3809677845], length 1314
08:48:45.134213 IP 99.181.101.237.1935 > 10.8.1.7.54164: Flags [.], ack 114415, win 290, options [nop,nop,TS val 3809677914 ecr 697563024,nop,nop,sack 1 {115590:128730}], length 0
08:48:45.134262 IP 10.8.1.7.54164 > 99.181.101.237.1935: Flags [.], seq 139242:140556, ack 1, win 501, options [nop,nop,TS val 697563984 ecr 3809677914], length 1314
08:48:45.169035 IP 99.181.101.237.1935 > 10.8.1.7.54164: Flags [.], ack 114415, win 295, options [nop,nop,TS val 3809677949 ecr 697563024,nop,nop,sack 1 {115590:130044}], length 0
08:48:45.169075 IP 10.8.1.7.54164 > 99.181.101.237.1935: Flags [.], seq 140556:141870, ack 1, win 501, options [nop,nop,TS val 697564019 ecr 3809677949], length 1314
08:48:45.200788 IP 99.181.101.237.1935 > 10.8.1.7.54164: Flags [.], ack 114415, win 301, options [nop,nop,TS val 3809677981 ecr 697563024,nop,nop,sack 1 {115590:131358}], length 0
08:48:45.200820 IP 10.8.1.7.54164 > 99.181.101.237.1935: Flags [.], seq 141870:143184, ack 1, win 501, options [nop,nop,TS val 697564051 ecr 3809677981], length 1314
08:48:45.267762 IP 99.181.101.237.1935 > 10.8.1.7.54164: Flags [.], ack 131358, win 307, options [nop,nop,TS val 3809678047 ecr 697563656], length 0
08:48:45.267800 IP 10.8.1.7.54164 > 99.181.101.237.1935: Flags [.], seq 143184:144498, ack 1, win 501, options [nop,nop,TS val 697564117 ecr 3809678047], length 1314
08:48:45.267801 IP 10.8.1.7.54164 > 99.181.101.237.1935: Flags [P.], seq 144498:145812, ack 1, win 501, options [nop,nop,TS val 697564117 ecr 3809678047], length 1314
08:48:45.267808 IP 10.8.1.7.54164 > 99.181.101.237.1935: Flags [P.], seq 145812:146514, ack 1, win 501, options [nop,nop,TS val 697564117 ecr 3809678047], length 702
08:48:45.306028 IP 10.8.1.7.54164 > 99.181.101.237.1935: Flags [.], seq 146514:147828, ack 1, win 501, options [nop,nop,TS val 697564156 ecr 3809678047], length 1314
08:48:45.332396 IP 99.181.101.237.1935 > 10.8.1.7.54164: Flags [.], ack 132672, win 312, options [nop,nop,TS val 3809678112 ecr 697563721], length 0
08:48:45.348831 IP 10.8.1.7.54164 > 99.181.101.237.1935: Flags [.], seq 147828:149142, ack 1, win 501, options [nop,nop,TS val 697564199 ecr 3809678112], length 1314
08:48:45.359247 IP 99.181.101.237.1935 > 10.8.1.7.54164: Flags [.], ack 133986, win 318, options [nop,nop,TS val 3809678139 ecr 697563748], length 0
08:48:45.391624 IP 10.8.1.7.54164 > 99.181.101.237.1935: Flags [.], seq 149142:150456, ack 1, win 501, options [nop,nop,TS val 697564241 ecr 3809678139], length 1314
08:48:45.395828 IP 99.181.101.237.1935 > 10.8.1.7.54164: Flags [.], ack 135300, win 324, options [nop,nop,TS val 3809678176 ecr 697563784], length 0
08:48:45.439267 IP 10.8.1.7.54164 > 99.181.101.237.1935: Flags [.], seq 150456:151770, ack 1, win 501, options [nop,nop,TS val 697564289 ecr 3809678176], length 1314
08:48:45.476659 IP 10.8.1.7.54164 > 99.181.101.237.1935: Flags [.], seq 151770:153084, ack 1, win 501, options [nop,nop,TS val 697564326 ecr 3809678176], length 1314
08:48:45.502612 IP 99.181.101.237.1935 > 10.8.1.7.54164: Flags [.], ack 137928, win 335, options [nop,nop,TS val 3809678282 ecr 697563891], length 0
08:48:45.519164 IP 10.8.1.7.54164 > 99.181.101.237.1935: Flags [.], seq 153084:154398, ack 1, win 501, options [nop,nop,TS val 697564369 ecr 3809678282], length 1314
08:48:45.528140 IP 99.181.101.237.1935 > 10.8.1.7.54164: Flags [.], ack 139242, win 341, options [nop,nop,TS val 3809678308 ecr 697563916], length 0
08:48:45.574084 IP 10.8.1.7.54164 > 99.181.101.237.1935: Flags [.], seq 154398:155712, ack 1, win 501, options [nop,nop,TS val 697564424 ecr 3809678308], length 1314
08:48:45.595774 IP 99.181.101.237.1935 > 10.8.1.7.54164: Flags [.], ack 140556, win 346, options [nop,nop,TS val 3809678375 ecr 697563984], length 0
08:48:45.607621 IP 10.8.1.7.54164 > 99.181.101.237.1935: Flags [.], seq 155712:157026, ack 1, win 501, options [nop,nop,TS val 697564457 ecr 3809678375], length 1314
08:48:45.630366 IP 99.181.101.237.1935 > 10.8.1.7.54164: Flags [.], ack 141870, win 352, options [nop,nop,TS val 3809678410 ecr 697564019], length 0
08:48:45.648144 IP 10.8.1.7.54164 > 99.181.101.237.1935: Flags [.], seq 157026:158340, ack 1, win 501, options [nop,nop,TS val 697564498 ecr 3809678410], length 1314
08:48:45.662212 IP 99.181.101.237.1935 > 10.8.1.7.54164: Flags [.], ack 143184, win 358, options [nop,nop,TS val 3809678442 ecr 697564051], length 0
08:48:45.712739 IP 10.8.1.7.54164 > 99.181.101.237.1935: Flags [.], seq 158340:159654, ack 1, win 501, options [nop,nop,TS val 697564562 ecr 3809678442], length 1314
08:48:45.740907 IP 10.8.1.7.54164 > 99.181.101.237.1935: Flags [.], seq 159654:160968, ack 1, win 501, options [nop,nop,TS val 697564591 ecr 3809678442], length 1314
08:48:45.767389 IP 99.181.101.237.1935 > 10.8.1.7.54164: Flags [.], ack 147828, win 380, options [nop,nop,TS val 3809678547 ecr 697564156], length 0
08:48:45.767421 IP 10.8.1.7.54164 > 99.181.101.237.1935: Flags [P.], seq 160968:161397, ack 1, win 501, options [nop,nop,TS val 697564617 ecr 3809678547], length 429
08:48:45.805563 IP 10.8.1.7.54164 > 99.181.101.237.1935: Flags [.], seq 161397:162711, ack 1, win 501, options [nop,nop,TS val 697564655 ecr 3809678547], length 1314
08:48:45.810364 IP 99.181.101.237.1935 > 10.8.1.7.54164: Flags [.], ack 149142, win 385, options [nop,nop,TS val 3809678590 ecr 697564199], length 0
08:48:45.841148 IP 10.8.1.7.54164 > 99.181.101.237.1935: Flags [.], seq 162711:164025, ack 1, win 501, options [nop,nop,TS val 697564691 ecr 3809678590], length 1314
08:48:45.852976 IP 99.181.101.237.1935 > 10.8.1.7.54164: Flags [.], ack 150456, win 391, options [nop,nop,TS val 3809678633 ecr 697564241], length 0
08:48:45.883700 IP 10.8.1.7.54164 > 99.181.101.237.1935: Flags [.], seq 164025:165339, ack 1, win 501, options [nop,nop,TS val 697564733 ecr 3809678633], length 1314
08:48:45.900702 IP 99.181.101.237.1935 > 10.8.1.7.54164: Flags [.], ack 151770, win 397, options [nop,nop,TS val 3809678681 ecr 697564289], length 0
08:48:45.937958 IP 99.181.101.237.1935 > 10.8.1.7.54164: Flags [.], ack 153084, win 402, options [nop,nop,TS val 3809678718 ecr 697564326], length 0
08:48:45.947303 IP 10.8.1.7.54164 > 99.181.101.237.1935: Flags [.], seq 165339:166653, ack 1, win 501, options [nop,nop,TS val 697564797 ecr 3809678718], length 1314
08:48:45.970921 IP 10.8.1.7.54164 > 99.181.101.237.1935: Flags [.], seq 166653:167967, ack 1, win 501, options [nop,nop,TS val 697564821 ecr 3809678718], length 1314
08:48:45.980879 IP 99.181.101.237.1935 > 10.8.1.7.54164: Flags [.], ack 154398, win 408, options [nop,nop,TS val 3809678761 ecr 697564369], length 0
08:48:46.011562 IP 10.8.1.7.54164 > 99.181.101.237.1935: Flags [.], seq 167967:169281, ack 1, win 501, options [nop,nop,TS val 697564861 ecr 3809678761], length 1314
08:48:46.036053 IP 99.181.101.237.1935 > 10.8.1.7.54164: Flags [.], ack 155712, win 414, options [nop,nop,TS val 3809678816 ecr 697564424], length 0
08:48:46.069539 IP 99.181.101.237.1935 > 10.8.1.7.54164: Flags [.], ack 157026, win 419, options [nop,nop,TS val 3809678849 ecr 697564457], length 0
08:48:46.075262 IP 10.8.1.7.54164 > 99.181.101.237.1935: Flags [.], seq 169281:170595, ack 1, win 501, options [nop,nop,TS val 697564925 ecr 3809678849], length 1314
08:48:46.107407 IP 10.8.1.7.54164 > 99.181.101.237.1935: Flags [.], seq 170595:171909, ack 1, win 501, options [nop,nop,TS val 697564957 ecr 3809678849], length 1314
08:48:46.109675 IP 99.181.101.237.1935 > 10.8.1.7.54164: Flags [.], ack 158340, win 425, options [nop,nop,TS val 3809678889 ecr 697564498], length 0
08:48:46.140825 IP 10.8.1.7.54164 > 99.181.101.237.1935: Flags [.], seq 171909:173223, ack 1, win 501, options [nop,nop,TS val 697564991 ecr 3809678889], length 1314
08:48:46.174239 IP 99.181.101.237.1935 > 10.8.1.7.54164: Flags [.], ack 159654, win 431, options [nop,nop,TS val 3809678954 ecr 697564562], length 0
08:48:46.202569 IP 99.181.101.237.1935 > 10.8.1.7.54164: Flags [.], ack 160968, win 436, options [nop,nop,TS val 3809678982 ecr 697564591], length 0
08:48:46.204656 IP 10.8.1.7.54164 > 99.181.101.237.1935: Flags [.], seq 173223:174537, ack 1, win 501, options [nop,nop,TS val 697565054 ecr 3809678982], length 1314
08:48:46.228755 IP 99.181.101.237.1935 > 10.8.1.7.54164: Flags [.], ack 161397, win 441, options [nop,nop,TS val 3809679008 ecr 697564617], length 0
08:48:46.228777 IP 10.8.1.7.54164 > 99.181.101.237.1935: Flags [P.], seq 174537:175352, ack 1, win 501, options [nop,nop,TS val 697565078 ecr 3809679008], length 815
08:48:46.266976 IP 99.181.101.237.1935 > 10.8.1.7.54164: Flags [.], ack 162711, win 447, options [nop,nop,TS val 3809679047 ecr 697564655], length 0
08:48:46.271863 IP 10.8.1.7.54164 > 99.181.101.237.1935: Flags [.], seq 175352:176666, ack 1, win 501, options [nop,nop,TS val 697565122 ecr 3809679047], length 1314
08:48:46.302562 IP 99.181.101.237.1935 > 10.8.1.7.54164: Flags [.], ack 164025, win 453, options [nop,nop,TS val 3809679082 ecr 697564691], length 0
08:48:46.310094 IP 10.8.1.7.54164 > 99.181.101.237.1935: Flags [.], seq 176666:177980, ack 1, win 501, options [nop,nop,TS val 697565160 ecr 3809679082], length 1314
08:48:46.345018 IP 99.181.101.237.1935 > 10.8.1.7.54164: Flags [.], ack 165339, win 458, options [nop,nop,TS val 3809679125 ecr 697564733], length 0
08:48:46.352666 IP 10.8.1.7.54164 > 99.181.101.237.1935: Flags [.], seq 177980:179294, ack 1, win 501, options [nop,nop,TS val 697565202 ecr 3809679125], length 1314
08:48:46.408594 IP 99.181.101.237.1935 > 10.8.1.7.54164: Flags [.], ack 166653, win 464, options [nop,nop,TS val 3809679189 ecr 697564797], length 0
