09:00:05.591517 IP 10.8.1.4.51676 > 99.181.88.116.1935: Flags [.], seq 3503664279:3503665593, ack 2576357075, win 501, options [nop,nop,TS val 3159889919 ecr 3719927213], length 1314
09:00:05.618704 IP 99.181.88.116.1935 > 10.8.1.4.51676: Flags [.], ack 4294954086, win 155, options [nop,nop,TS val 3719927305 ecr 3159889387], length 0
09:00:05.625377 IP 10.8.1.4.51676 > 99.181.88.116.1935: Flags [.], seq 1314:2628, ack 1, win 501, options [nop,nop,TS val 3159889953 ecr 3719927305], length 1314
09:00:05.657579 IP 10.8.1.4.51676 > 99.181.88.116.1935: Flags [.], seq 2628:3942, ack 1, win 501, options [nop,nop,TS val 3159889985 ecr 3719927305], length 1314
09:00:05.721150 IP 99.181.88.116.1935 > 10.8.1.4.51676: Flags [.], ack 4294956714, win 155, options [nop,nop,TS val 3719927407 ecr 3159889457], length 0
09:00:05.728977 IP 10.8.1.4.51676 > 99.181.88.116.1935: Flags [.], seq 3942:5256, ack 1, win 501, options [nop,nop,TS val 3159890057 ecr 3719927407], length 1314
09:00:05.760588 IP 10.8.1.4.51676 > 99.181.88.116.1935: Flags [.], seq 5256:6570, ack 1, win 501, options [nop,nop,TS val 3159890088 ecr 3719927407], length 1314
09:00:05.785718 IP 99.181.88.116.1935 > 10.8.1.4.51676: Flags [.], ack 4294959342, win 155, options [nop,nop,TS val 3719927472 ecr 3159889555], length 0
09:00:05.793814 IP 10.8.1.4.51676 > 99.181.88.116.1935: Flags [.], seq 6570:7884, ack 1, win 501, options [nop,nop,TS val 3159890122 ecr 3719927472], length 1314
09:00:05.858296 IP 10.8.1.4.51676 > 99.181.88.116.1935: Flags [.], seq 7884:9198, ack 1, win 501, options [nop,nop,TS val 3159890186 ecr 3719927472], length 1314
09:00:05.884262 IP 99.181.88.116.1935 > 10.8.1.4.51676: Flags [.], ack 4294961970, win 155, options [nop,nop,TS val 3719927570 ecr 3159889653], length 0
09:00:05.892408 IP 10.8.1.4.51676 > 99.181.88.116.1935: Flags [.], seq 9198:10512, ack 1, win 501, options [nop,nop,TS val 3159890220 ecr 3719927570], length 1314
09:00:05.928764 IP 10.8.1.4.51676 > 99.181.88.116.1935: Flags [.], seq 10512:11826, ack 1, win 501, options [nop,nop,TS val 3159890256 ecr 3719927570], length 1314
09:00:05.985318 IP 99.181.88.116.1935 > 10.8.1.4.51676: Flags [.], ack 4294964598, win 155, options [nop,nop,TS val 3719927671 ecr 3159889724], length 0
09:00:05.995883 IP 10.8.1.4.51676 > 99.181.88.116.1935: Flags [.], seq 11826:13140, ack 1, win 501, options [nop,nop,TS val 3159890324 ecr 3719927671], length 1314
09:00:06.025816 IP 10.8.1.4.51676 > 99.181.88.116.1935: Flags [.], seq 13140:14454, ack 1, win 501, options [nop,nop,TS val 3159890354 ecr 3719927671], length 1314
09:00:06.052916 IP 99.181.88.116.1935 > 10.8.1.4.51676: Flags [.], ack 4294967226, win 155, options [nop,nop,TS val 3719927739 ecr 3159889820], length 0
09:00:06.053136 IP 99.181.88.116.1935 > 10.8.1.4.51676: Flags [.], ack 0, win 156, options [nop,nop,TS val 3719927739 ecr 3159889855], length 0
09:00:06.053153 IP 10.8.1.4.51676 > 99.181.88.116.1935: Flags [P.], seq 14454:15081, ack 1, win 501, options [nop,nop,TS val 3159890381 ecr 3719927739], length 627
09:00:06.095547 IP 10.8.1.4.51676 > 99.181.88.116.1935: Flags [.], seq 15081:16395, ack 1, win 501, options [nop,nop,TS val 3159890423 ecr 3719927739], length 1314
09:00:06.125801 IP 10.8.1.4.51676 > 99.181.88.116.1935: Flags [.], seq 16395:17709, ack 1, win 501, options [nop,nop,TS val 3159890454 ecr 3719927739], length 1314
09:00:06.169973 IP 10.8.1.4.51676 > 99.181.88.116.1935: Flags [.], seq 17709:19023, ack 1, win 501, options [nop,nop,TS val 3159890498 ecr 3719927739], length 1314
09:00:06.225258 IP 10.8.1.4.51676 > 99.181.88.116.1935: Flags [.], seq 19023:20337, ack 1, win 501, options [nop,nop,TS val 3159890553 ecr 3719927739], length 1314
09:00:06.258242 IP 10.8.1.4.51676 > 99.181.88.116.1935: Flags [.], seq 20337:21651, ack 1, win 501, options [nop,nop,TS val 3159890586 ecr 3719927739], length 1314
09:00:06.297449 IP 10.8.1.4.51676 > 99.181.88.116.1935: Flags [.], seq 21651:22965, ack 1, win 501, options [nop,nop,TS val 3159890625 ecr 3719927739], length 1314
09:00:06.361491 IP 10.8.1.4.51676 > 99.181.88.116.1935: Flags [.], seq 22965:24279, ack 1, win 501, options [nop,nop,TS val 3159890689 ecr 3719927739], length 1314
09:00:06.386205 IP 10.8.1.4.51676 > 99.181.88.116.1935: Flags [P.], seq 24279:25067, ack 1, win 501, options [nop,nop,TS val 3159890714 ecr 3719927739], length 788
09:00:07.198231 IP 10.8.1.4.51676 > 99.181.88.116.1935: Flags [.], seq 0:1314, ack 1, win 501, options [nop,nop,TS val 3159891526 ecr 3719927739], length 1314
09:00:08.139661 IP 99.181.88.116.1935 > 10.8.1.4.51676: Flags [.], ack 2628, win 156, options [nop,nop,TS val 3719927837 ecr 3159889919], length 0
09:00:08.139723 IP 99.181.88.116.1935 > 10.8.1.4.51676: Flags [.], ack 6570, win 156, options [nop,nop,TS val 3719927980 ecr 3159890057], length 0
09:00:08.139747 IP 99.181.88.116.1935 > 10.8.1.4.51676: Flags [.], ack 3942, win 156, options [nop,nop,TS val 3719927936 ecr 3159889985], length 0
09:00:08.139765 IP 10.8.1.4.51676 > 99.181.88.116.1935: Flags [.], ack 1, win 501, options [nop,nop,TS val 3159892467 ecr 3719927980], length 0
09:00:08.139784 IP 99.181.88.116.1935 > 10.8.1.4.51676: Flags [.], ack 9198, win 155, options [nop,nop,TS val 3719928069 ecr 3159890122], length 0
09:00:08.139851 IP 10.8.1.4.51676 > 99.181.88.116.1935: Flags [.], seq 25067:26381, ack 1, win 501, options [nop,nop,TS val 3159892468 ecr 3719928069], length 1314
09:00:08.139944 IP 10.8.1.4.51676 > 99.181.88.116.1935: Flags [.], seq 26381:27695, ack 1, win 501, options [nop,nop,TS val 3159892468 ecr 3719928069], length 1314
09:00:08.139994 IP 10.8.1.4.51676 > 99.181.88.116.1935: Flags [.], seq 27695:29009, ack 1, win 501, options [nop,nop,TS val 3159892468 ecr 3719928069], length 1314
09:00:08.140062 IP 10.8.1.4.51676 > 99.181.88.116.1935: Flags [.], seq 29009:30323, ack 1, win 501, options [nop,nop,TS val 3159892468 ecr 3719928069], length 1314
09:00:08.140134 IP 10.8.1.4.51676 > 99.181.88.116.1935: Flags [.], seq 30323:31637, ack 1, win 501, options [nop,nop,TS val 3159892468 ecr 3719928069], length 1314
09:00:08.140206 IP 10.8.1.4.51676 > 99.181.88.116.1935: Flags [.], seq 31637:32951, ack 1, win 501, options [nop,nop,TS val 3159892468 ecr 3719928069], length 1314
09:00:08.140278 IP 10.8.1.4.51676 > 99.181.88.116.1935: Flags [.], seq 32951:34265, ack 1, win 501, options [nop,nop,TS val 3159892468 ecr 3719928069], length 1314
09:00:08.369517 IP 10.8.1.4.51676 > 99.181.88.116.1935: Flags [.], seq 34265:35579, ack 1, win 501, options [nop,nop,TS val 3159892697 ecr 3719928069], length 1314
09:00:08.389583 IP 99.181.88.116.1935 > 10.8.1.4.51676: Flags [.], ack 10512, win 155, options [nop,nop,TS val 3719930075 ecr 3159890220], length 0
09:00:08.389603 IP 99.181.88.116.1935 > 10.8.1.4.51676: Flags [.], ack 11826, win 155, options [nop,nop,TS val 3719930075 ecr 3159890256], length 0
09:00:08.389611 IP 99.181.88.116.1935 > 10.8.1.4.51676: Flags [.], ack 11826, win 155, options [nop,nop,TS val 3719930075 ecr 3159890256,nop,nop,sack 1 {13140:14454}], length 0
09:00:08.389619 IP 99.181.88.116.1935 > 10.8.1.4.51676: Flags [.], ack 14454, win 153, options [nop,nop,TS val 3719930075 ecr 3159890324], length 0
09:00:08.389637 IP 99.181.88.116.1935 > 10.8.1.4.51676: Flags [.], ack 15081, win 154, options [nop,nop,TS val 3719930075 ecr 3159890381], length 0
09:00:08.389641 IP 99.181.88.116.1935 > 10.8.1.4.51676: Flags [.], ack 16395, win 155, options [nop,nop,TS val 3719930075 ecr 3159890423], length 0
09:00:08.389661 IP 99.181.88.116.1935 > 10.8.1.4.51676: Flags [.], ack 17709, win 155, options [nop,nop,TS val 3719930076 ecr 3159890454], length 0
09:00:08.389665 IP 99.181.88.116.1935 > 10.8.1.4.51676: Flags [.], ack 19023, win 155, options [nop,nop,TS val 3719930076 ecr 3159890498], length 0
09:00:08.389669 IP 99.181.88.116.1935 > 10.8.1.4.51676: Flags [.], ack 20337, win 153, options [nop,nop,TS val 3719930076 ecr 3159890553], length 0
09:00:08.389828 IP 99.181.88.116.1935 > 10.8.1.4.51676: Flags [.], ack 20337, win 155, options [nop,nop,TS val 3719930076 ecr 3159890553,nop,nop,sack 1 {21651:22965}], length 0
09:00:08.389835 IP 99.181.88.116.1935 > 10.8.1.4.51676: Flags [.], ack 22965, win 153, options [nop,nop,TS val 3719930076 ecr 3159890586], length 0
09:00:08.390053 IP 99.181.88.116.1935 > 10.8.1.4.51676: Flags [.], ack 24279, win 155, options [nop,nop,TS val 3719930076 ecr 3159890689], length 0
09:00:08.390071 IP 99.181.88.116.1935 > 10.8.1.4.51676: Flags [.], ack 25067, win 156, options [nop,nop,TS val 3719930076 ecr 3159890714], length 0
09:00:08.390101 IP 10.8.1.4.51676 > 99.181.88.116.1935: Flags [P.], seq 35579:35601, ack 1, win 501, options [nop,nop,TS val 3159892718 ecr 3719930076], length 22
09:00:08.390109 IP 99.181.88.116.1935 > 10.8.1.4.51676: Flags [.], ack 25067, win 157, options [nop,nop,TS val 3719930076 ecr 3159890714,nop,nop,sack 1 {0:1314}], length 0
09:00:08.665092 IP 99.181.88.116.1935 > 10.8.1.4.51676: Flags [.], ack 26381, win 155, options [nop,nop,TS val 3719930351 ecr 3159892468], length 0
09:00:08.665132 IP 99.181.88.116.1935 > 10.8.1.4.51676: Flags [.], ack 27695, win 155, options [nop,nop,TS val 3719930351 ecr 3159892468], length 0
09:00:08.665355 IP 99.181.88.116.1935 > 10.8.1.4.51676: Flags [.], ack 29009, win 155, options [nop,nop,TS val 3719930351 ecr 3159892468], length 0
09:00:08.665389 IP 99.181.88.116.1935 > 10.8.1.4.51676: Flags [.], ack 30323, win 155, options [nop,nop,TS val 3719930351 ecr 3159892468], length 0
09:00:08.665432 IP 99.181.88.116.1935 > 10.8.1.4.51676: Flags [.], ack 31637, win 155, options [nop,nop,TS val 3719930351 ecr 3159892468], length 0
09:00:08.665450 IP 99.181.88.116.1935 > 10.8.1.4.51676: Flags [.], ack 32951, win 155, options [nop,nop,TS val 3719930351 ecr 3159892468], length 0
09:00:08.665468 IP 99.181.88.116.1935 > 10.8.1.4.51676: Flags [.], ack 34265, win 155, options [nop,nop,TS val 3719930351 ecr 3159892468], length 0
09:00:08.669214 IP 10.8.1.4.51676 > 99.181.88.116.1935: Flags [P.], seq 35601:36915, ack 1, win 501, options [nop,nop,TS val 3159892997 ecr 3719930351], length 1314
09:00:08.895590 IP 99.181.88.116.1935 > 10.8.1.4.51676: Flags [.], ack 35579, win 155, options [nop,nop,TS val 3719930580 ecr 3159892697], length 0
09:00:08.914789 IP 99.181.88.116.1935 > 10.8.1.4.51676: Flags [.], ack 35601, win 156, options [nop,nop,TS val 3719930601 ecr 3159892718], length 0
09:00:08.914800 IP 10.8.1.4.51676 > 99.181.88.116.1935: Flags [P.], seq 36915:37952, ack 1, win 501, options [nop,nop,TS val 3159893243 ecr 3719930601], length 1037
09:00:08.947250 IP 10.8.1.4.51676 > 99.181.88.116.1935: Flags [.], seq 37952:39266, ack 1, win 501, options [nop,nop,TS val 3159893275 ecr 3719930601], length 1314
09:00:08.989942 IP 10.8.1.4.51676 > 99.181.88.116.1935: Flags [.], seq 39266:40580, ack 1, win 501, options [nop,nop,TS val 3159893318 ecr 3719930601], length 1314
09:00:09.032892 IP 10.8.1.4.51676 > 99.181.88.116.1935: Flags [.], seq 40580:41894, ack 1, win 501, options [nop,nop,TS val 3159893361 ecr 3719930601], length 1314
09:00:09.075209 IP 10.8.1.4.51676 > 99.181.88.116.1935: Flags [.], seq 41894:43208, ack 1, win 501, options [nop,nop,TS val 3159893403 ecr 3719930601], length 1314
09:00:09.117795 IP 10.8.1.4.51676 > 99.181.88.116.1935: Flags [.], seq 43208:44522, ack 1, win 501, options [nop,nop,TS val 3159893445 ecr 3719930601], length 1314
09:00:09.162698 IP 10.8.1.4.51676 > 99.181.88.116.1935: Flags [.], seq 44522:45836, ack 1, win 501, options [nop,nop,TS val 3159893490 ecr 3719930601], length 1314
09:00:09.199305 IP 99.181.88.116.1935 > 10.8.1.4.51676: Flags [.], ack 36915, win 155, options [nop,nop,TS val 3719930885 ecr 3159892997], length 0
09:00:09.224960 IP 10.8.1.4.51676 > 99.181.88.116.1935: Flags [.], seq 45836:47150, ack 1, win 501, options [nop,nop,TS val 3159893553 ecr 3719930885], length 1314
09:00:09.246211 IP 10.8.1.4.51676 > 99.181.88.116.1935: Flags [.], seq 47150:48464, ack 1, win 501, options [nop,nop,TS val 3159893574 ecr 3719930885], length 1314
09:00:09.292100 IP 10.8.1.4.51676 > 99.181.88.116.1935: Flags [.], seq 48464:49778, ack 1, win 501, options [nop,nop,TS val 3159893620 ecr 3719930885], length 1314
09:00:09.352392 IP 10.8.1.4.51676 > 99.181.88.116.1935: Flags [.], seq 49778:51092, ack 1, win 501, options [nop,nop,TS val 3159893680 ecr 3719930885], length 1314
09:00:09.373908 IP 10.8.1.4.51676 > 99.181.88.116.1935: Flags [.], seq 51092:52406, ack 1, win 501, options [nop,nop,TS val 3159893702 ecr 3719930885], length 1314
09:00:09.437903 IP 10.8.1.4.51676 > 99.181.88.116.1935: Flags [.], seq 52406:53720, ack 1, win 501, options [nop,nop,TS val 3159893766 ecr 3719930885], length 1314
09:00:09.439572 IP 99.181.88.116.1935 > 10.8.1.4.51676: Flags [.], ack 37952, win 155, options [nop,nop,TS val 3719931125 ecr 3159893243], length 0
09:00:09.439591 IP 10.8.1.4.51676 > 99.181.88.116.1935: Flags [P.], seq 53720:53799, ack 1, win 501, options [nop,nop,TS val 3159893767 ecr 3719931125], length 79
09:00:09.474322 IP 99.181.88.116.1935 > 10.8.1.4.51676: Flags [.], ack 39266, win 155, options [nop,nop,TS val 3719931160 ecr 3159893275], length 0
09:00:09.493159 IP 10.8.1.4.51676 > 99.181.88.116.1935: Flags [.], seq 53799:55113, ack 1, win 501, options [nop,nop,TS val 3159893821 ecr 3719931160], length 1314
09:00:09.515174 IP 99.181.88.116.1935 > 10.8.1.4.51676: Flags [.], ack 40580, win 163, options [nop,nop,TS val 3719931201 ecr 3159893318], length 0
09:00:09.527002 IP 10.8.1.4.51676 > 99.181.88.116.1935: Flags [.], seq 55113:56427, ack 1, win 501, options [nop,nop,TS val 3159893855 ecr 3719931201], length 1314
09:00:09.558072 IP 99.181.88.116.1935 > 10.8.1.4.51676: Flags [.], ack 41894, win 168, options [nop,nop,TS val 3719931244 ecr 3159893361], length 0
09:00:09.566023 IP 10.8.1.4.51676 > 99.181.88.116.1935: Flags [.], seq 56427:57741, ack 1, win 501, options [nop,nop,TS val 3159893894 ecr 3719931244], length 1314
09:00:09.600094 IP 99.181.88.116.1935 > 10.8.1.4.51676: Flags [.], ack 43208, win 174, options [nop,nop,TS val 3719931286 ecr 3159893403], length 0
09:00:09.628982 IP 10.8.1.4.51676 > 99.181.88.116.1935: Flags [.], seq 57741:59055, ack 1, win 501, options [nop,nop,TS val 3159893957 ecr 3719931286], length 1314
09:00:09.643024 IP 99.181.88.116.1935 > 10.8.1.4.51676: Flags [.], ack 44522, win 180, options [nop,nop,TS val 3719931329 ecr 3159893445], length 0
09:00:09.662368 IP 10.8.1.4.51676 > 99.181.88.116.1935: Flags [.], seq 59055:60369, ack 1, win 501, options [nop,nop,TS val 3159893990 ecr 3719931329], length 1314
09:00:09.687993 IP 99.181.88.116.1935 > 10.8.1.4.51676: Flags [.], ack 45836, win 185, options [nop,nop,TS val 3719931374 ecr 3159893490], length 0
09:00:09.695898 IP 10.8.1.4.51676 > 99.181.88.116.1935: Flags [.], seq 60369:61683, ack 1, win 501, options [nop,nop,TS val 3159894024 ecr 3719931374], length 1314
09:00:09.750021 IP 99.181.88.116.1935 > 10.8.1.4.51676: Flags [.], ack 47150, win 191, options [nop,nop,TS val 3719931436 ecr 3159893553], length 0
09:00:09.762684 IP 10.8.1.4.51676 > 99.181.88.116.1935: Flags [.], seq 61683:62997, ack 1, win 501, options [nop,nop,TS val 3159894090 ecr 3719931436], length 1314
09:00:09.772085 IP 99.181.88.116.1935 > 10.8.1.4.51676: Flags [.], ack 48464, win 197, options [nop,nop,TS val 3719931457 ecr 3159893574], length 0
09:00:09.795955 IP 10.8.1.4.51676 > 99.181.88.116.1935: Flags [.], seq 62997:64311, ack 1, win 501, options [nop,nop,TS val 3159894124 ecr 3719931457], length 1314
09:00:09.816943 IP 99.181.88.116.1935 > 10.8.1.4.51676: Flags [.], ack 49778, win 202, options [nop,nop,TS val 3719931503 ecr 3159893620], length 0
09:00:09.826624 IP 10.8.1.4.51676 > 99.181.88.116.1935: Flags [.], seq 64311:65625, ack 1, win 501, options [nop,nop,TS val 3159894154 ecr 3719931503], length 1314
09:00:09.877149 IP 99.181.88.116.1935 > 10.8.1.4.51676: Flags [.], ack 51092, win 208, options [nop,nop,TS val 3719931563 ecr 3159893680], length 0
09:00:09.892477 IP 10.8.1.4.51676 > 99.181.88.116.1935: Flags [.], seq 65625:66939, ack 1, win 501, options [nop,nop,TS val 3159894220 ecr 3719931563], length 1314
09:00:09.899290 IP 99.181.88.116.1935 > 10.8.1.4.51676: Flags [.], ack 52406, win 214, options [nop,nop,TS val 3719931585 ecr 3159893702], length 0
09:00:09.929020 IP 10.8.1.4.51676 > 99.181.88.116.1935: Flags [.], seq 66939:68253, ack 1, win 501, options [nop,nop,TS val 3159894257 ecr 3719931585], length 1314
09:00:09.962275 IP 10.8.1.4.51676 > 99.181.88.116.1935: Flags [.], seq 68253:69567, ack 1, win 501, options [nop,nop,TS val 3159894290 ecr 3719931585], length 1314
09:00:09.963157 IP 99.181.88.116.1935 > 10.8.1.4.51676: Flags [.], ack 53720, win 219, options [nop,nop,TS val 3719931649 ecr 3159893766], length 0
09:00:09.964351 IP 99.181.88.116.1935 > 10.8.1.4.51676: Flags [.], ack 53799, win 219, options [nop,nop,TS val 3719931650 ecr 3159893767], length 0
09:00:09.964386 IP 10.8.1.4.51676 > 99.181.88.116.1935: Flags [P.], seq 69567:69628, ack 1, win 501, options [nop,nop,TS val 3159894292 ecr 3719931650], length 61
09:00:10.020606 IP 99.181.88.116.1935 > 10.8.1.4.51676: Flags [.], ack 55113, win 225, options [nop,nop,TS val 3719931704 ecr 3159893821], length 0
09:00:10.027551 IP 10.8.1.4.51676 > 99.181.88.116.1935: Flags [.], seq 69628:70942, ack 1, win 501, options [nop,nop,TS val 3159894355 ecr 3719931704], length 1314
09:00:10.052738 IP 99.181.88.116.1935 > 10.8.1.4.51676: Flags [.], ack 56427, win 231, options [nop,nop,TS val 3719931738 ecr 3159893855], length 0
09:00:10.059272 IP 10.8.1.4.51676 > 99.181.88.116.1935: Flags [.], seq 70942:72256, ack 1, win 501, options [nop,nop,TS val 3159894387 ecr 3719931738], length 1314
09:00:10.091887 IP 99.181.88.116.1935 > 10.8.1.4.51676: Flags [.], ack 57741, win 236, options [nop,nop,TS val 3719931778 ecr 3159893894], length 0
09:00:10.093135 IP 10.8.1.4.51676 > 99.181.88.116.1935: Flags [.], seq 72256:73570, ack 1, win 501, options [nop,nop,TS val 3159894421 ecr 3719931778], length 1314
09:00:10.158945 IP 99.181.88.116.1935 > 10.8.1.4.51676: Flags [.], ack 59055, win 242, options [nop,nop,TS val 3719931840 ecr 3159893957], length 0
09:00:10.159726 IP 10.8.1.4.51676 > 99.181.88.116.1935: Flags [.], seq 73570:74884, ack 1, win 501, options [nop,nop,TS val 3159894487 ecr 3719931840], length 1314
09:00:10.188346 IP 99.181.88.116.1935 > 10.8.1.4.51676: Flags [.], ack 60369, win 248, options [nop,nop,TS val 3719931873 ecr 3159893990], length 0
09:00:10.194683 IP 10.8.1.4.51676 > 99.181.88.116.1935: Flags [.], seq 74884:76198, ack 1, win 501, options [nop,nop,TS val 3159894522 ecr 3719931873], length 1314
09:00:10.220975 IP 99.181.88.116.1935 > 10.8.1.4.51676: Flags [.], ack 61683, win 253, options [nop,nop,TS val 3719931907 ecr 3159894024], length 0
09:00:10.228816 IP 10.8.1.4.51676 > 99.181.88.116.1935: Flags [.], seq 76198:77512, ack 1, win 501, options [nop,nop,TS val 3159894557 ecr 3719931907], length 1314
09:00:10.287915 IP 99.181.88.116.1935 > 10.8.1.4.51676: Flags [.], ack 62997, win 259, options [nop,nop,TS val 3719931974 ecr 3159894090], length 0
09:00:10.293607 IP 10.8.1.4.51676 > 99.181.88.116.1935: Flags [.], seq 77512:78826, ack 1, win 501, options [nop,nop,TS val 3159894621 ecr 3719931974], length 1314
09:00:10.321554 IP 99.181.88.116.1935 > 10.8.1.4.51676: Flags [.], ack 64311, win 264, options [nop,nop,TS val 3719932007 ecr 3159894124], length 0
09:00:10.327298 IP 10.8.1.4.51676 > 99.181.88.116.1935: Flags [.], seq 78826:80140, ack 1, win 501, options [nop,nop,TS val 3159894655 ecr 3719932007], length 1314
09:00:10.351535 IP 99.181.88.116.1935 > 10.8.1.4.51676: Flags [.], ack 65625, win 270, options [nop,nop,TS val 3719932038 ecr 3159894154], length 0
09:00:10.359348 IP 10.8.1.4.51676 > 99.181.88.116.1935: Flags [.], seq 80140:81454, ack 1, win 501, options [nop,nop,TS val 3159894687 ecr 3719932038], length 1314
09:00:10.417957 IP 99.181.88.116.1935 > 10.8.1.4.51676: Flags [.], ack 66939, win 276, options [nop,nop,TS val 3719932104 ecr 3159894220], length 0
09:00:10.425134 IP 10.8.1.4.51676 > 99.181.88.116.1935: Flags [.], seq 81454:82768, ack 1, win 501, options [nop,nop,TS val 3159894753 ecr 3719932104], length 1314
09:00:10.454381 IP 99.181.88.116.1935 > 10.8.1.4.51676: Flags [.], ack 68253, win 281, options [nop,nop,TS val 3719932140 ecr 3159894257], length 0
09:00:10.460511 IP 10.8.1.4.51676 > 99.181.88.116.1935: Flags [.], seq 82768:84082, ack 1, win 501, options [nop,nop,TS val 3159894788 ecr 3719932140], length 1314
09:00:10.487409 IP 99.181.88.116.1935 > 10.8.1.4.51676: Flags [.], ack 69567, win 287, options [nop,nop,TS val 3719932173 ecr 3159894290], length 0
09:00:10.489351 IP 99.181.88.116.1935 > 10.8.1.4.51676: Flags [.], ack 69628, win 287, options [nop,nop,TS val 3719932175 ecr 3159894292], length 0
09:00:10.489375 IP 10.8.1.4.51676 > 99.181.88.116.1935: Flags [P.], seq 84082:84701, ack 1, win 501, options [nop,nop,TS val 3159894817 ecr 3719932175], length 619
09:00:10.526918 IP 10.8.1.4.51676 > 99.181.88.116.1935: Flags [.], seq 84701:86015, ack 1, win 501, options [nop,nop,TS val 3159894855 ecr 3719932175], length 1314
09:00:10.552552 IP 99.181.88.116.1935 > 10.8.1.4.51676: Flags [.], ack 70942, win 293, options [nop,nop,TS val 3719932239 ecr 3159894355], length 0
09:00:10.558386 IP 10.8.1.4.51676 > 99.181.88.116.1935: Flags [.], seq 86015:87329, ack 1, win 501, options [nop,nop,TS val 3159894886 ecr 3719932239], length 1314
09:00:10.584172 IP 99.181.88.116.1935 > 10.8.1.4.51676: Flags [.], ack 72256, win 298, options [nop,nop,TS val 3719932270 ecr 3159894387], length 0
09:00:10.612220 IP 10.8.1.4.51676 > 99.181.88.116.1935: Flags [.], seq 87329:88643, ack 1, win 501, options [nop,nop,TS val 3159894940 ecr 3719932270], length 1314
09:00:10.618134 IP 99.181.88.116.1935 > 10.8.1.4.51676: Flags [.], ack 73570, win 304, options [nop,nop,TS val 3719932304 ecr 3159894421], length 0
09:00:10.658255 IP 10.8.1.4.51676 > 99.181.88.116.1935: Flags [.], seq 88643:89957, ack 1, win 501, options [nop,nop,TS val 3159894986 ecr 3719932304], length 1314
09:00:10.685323 IP 99.181.88.116.1935 > 10.8.1.4.51676: Flags [.], ack 74884, win 310, options [nop,nop,TS val 3719932371 ecr 3159894487], length 0
09:00:10.692651 IP 10.8.1.4.51676 > 99.181.88.116.1935: Flags [.], seq 89957:91271, ack 1, win 501, options [nop,nop,TS val 3159895020 ecr 3719932371], length 1314
09:00:10.720352 IP 99.181.88.116.1935 > 10.8.1.4.51676: Flags [.], ack 76198, win 315, options [nop,nop,TS val 3719932406 ecr 3159894522], length 0
09:00:10.740038 IP 10.8.1.4.51676 > 99.181.88.116.1935: Flags [.], seq 91271:92585, ack 1, win 501, options [nop,nop,TS val 3159895068 ecr 3719932406], length 1314
09:00:10.753771 IP 99.181.88.116.1935 > 10.8.1.4.51676: Flags [.], ack 77512, win 321, options [nop,nop,TS val 3719932440 ecr 3159894557], length 0
09:00:10.792859 IP 10.8.1.4.51676 > 99.181.88.116.1935: Flags [.], seq 92585:93899, ack 1, win 501, options [nop,nop,TS val 3159895121 ecr 3719932440], length 1314
09:00:10.818755 IP 99.181.88.116.1935 > 10.8.1.4.51676: Flags [.], ack 78826, win 327, options [nop,nop,TS val 3719932504 ecr 3159894621], length 0
09:00:10.826769 IP 10.8.1.4.51676 > 99.181.88.116.1935: Flags [.], seq 93899:95213, ack 1, win 501, options [nop,nop,TS val 3159895154 ecr 3719932504], length 1314
09:00:10.853168 IP 99.181.88.116.1935 > 10.8.1.4.51676: Flags [.], ack 80140, win 332, options [nop,nop,TS val 3719932538 ecr 3159894655], length 0
09:00:10.868256 IP 10.8.1.4.51676 > 99.181.88.116.1935: Flags [.], seq 95213:96527, ack 1, win 501, options [nop,nop,TS val 3159895196 ecr 3719932538], length 1314
09:00:10.884389 IP 99.181.88.116.1935 > 10.8.1.4.51676: Flags [.], ack 81454, win 338, options [nop,nop,TS val 3719932570 ecr 3159894687], length 0
09:00:10.929092 IP 10.8.1.4.51676 > 99.181.88.116.1935: Flags [.], seq 96527:97841, ack 1, win 501, options [nop,nop,TS val 3159895257 ecr 3719932570], length 1314
09:00:10.950203 IP 99.181.88.116.1935 > 10.8.1.4.51676: Flags [.], ack 82768, win 344, options [nop,nop,TS val 3719932636 ecr 3159894753], length 0
09:00:10.959220 IP 10.8.1.4.51676 > 99.181.88.116.1935: Flags [.], seq 97841:99155, ack 1, win 501, options [nop,nop,TS val 3159895287 ecr 3719932636], length 1314
09:00:10.990349 IP 99.181.88.116.1935 > 10.8.1.4.51676: Flags [.], ack 84082, win 349, options [nop,nop,TS val 3719932675 ecr 3159894788], length 0
09:00:10.996625 IP 10.8.1.4.51676 > 99.181.88.116.1935: Flags [.], seq 99155:100469, ack 1, win 501, options [nop,nop,TS val 3159895324 ecr 3719932675], length 1314
09:00:11.013992 IP 99.181.88.116.1935 > 10.8.1.4.51676: Flags [.], ack 84701, win 354, options [nop,nop,TS val 3719932700 ecr 3159894817], length 0
09:00:11.014026 IP 10.8.1.4.51676 > 99.181.88.116.1935: Flags [P.], seq 100469:100547, ack 1, win 501, options [nop,nop,TS val 3159895342 ecr 3719932700], length 78
09:00:11.052843 IP 99.181.88.116.1935 > 10.8.1.4.51676: Flags [.], ack 86015, win 360, options [nop,nop,TS val 3719932738 ecr 3159894855], length 0
09:00:11.062284 IP 10.8.1.4.51676 > 99.181.88.116.1935: Flags [.], seq 100547:101861, ack 1, win 501, options [nop,nop,TS val 3159895390 ecr 3719932738], length 1314
09:00:11.084628 IP 99.181.88.116.1935 > 10.8.1.4.51676: Flags [.], ack 87329, win 366, options [nop,nop,TS val 3719932770 ecr 3159894886], length 0
09:00:11.093322 IP 10.8.1.4.51676 > 99.181.88.116.1935: Flags [.], seq 101861:103175, ack 1, win 501, options [nop,nop,TS val 3159895421 ecr 3719932770], length 1314
09:00:11.127854 IP 10.8.1.4.51676 > 99.181.88.116.1935: Flags [.], seq 103175:104489, ack 1, win 501, options [nop,nop,TS val 3159895456 ecr 3719932770], length 1314
09:00:11.138413 IP 99.181.88.116.1935 > 10.8.1.4.51676: Flags [.], ack 88643, win 371, options [nop,nop,TS val 3719932824 ecr 3159894940], length 0
09:00:11.188041 IP 99.181.88.116.1935 > 10.8.1.4.51676: Flags [.], ack 89957, win 375, options [nop,nop,TS val 3719932872 ecr 3159894986], length 0
09:00:11.194510 IP 10.8.1.4.51676 > 99.181.88.116.1935: Flags [.], seq 104489:105803, ack 1, win 501, options [nop,nop,TS val 3159895522 ecr 3719932872], length 1314
09:00:11.227582 IP 10.8.1.4.51676 > 99.181.88.116.1935: Flags [.], seq 105803:107117, ack 1, win 501, options [nop,nop,TS val 3159895555 ecr 3719932872], length 1314
09:00:11.260605 IP 10.8.1.4.51676 > 99.181.88.116.1935: Flags [.], seq 107117:108431, ack 1, win 501, options [nop,nop,TS val 3159895588 ecr 3719932872], length 1314
09:00:11.269150 IP 99.181.88.116.1935 > 10.8.1.4.51676: Flags [.], ack 92585, win 375, options [nop,nop,TS val 3719932952 ecr 3159895020], length 0
09:00:11.328111 IP 10.8.1.4.51676 > 99.181.88.116.1935: Flags [.], seq 108431:109745, ack 1, win 501, options [nop,nop,TS val 3159895656 ecr 3719932952], length 1314
09:00:11.354005 IP 99.181.88.116.1935 > 10.8.1.4.51676: Flags [.], ack 95213, win 375, options [nop,nop,TS val 3719933038 ecr 3159895121], length 0
09:00:11.360636 IP 10.8.1.4.51676 > 99.181.88.116.1935: Flags [.], seq 109745:111059, ack 1, win 501, options [nop,nop,TS val 3159895688 ecr 3719933038], length 1314
09:00:11.394846 IP 10.8.1.4.51676 > 99.181.88.116.1935: Flags [.], seq 111059:112373, ack 1, win 501, options [nop,nop,TS val 3159895723 ecr 3719933038], length 1314
09:00:11.454041 IP 99.181.88.116.1935 > 10.8.1.4.51676: Flags [.], ack 97841, win 375, options [nop,nop,TS val 3719933140 ecr 3159895196], length 0
09:00:11.461217 IP 10.8.1.4.51676 > 99.181.88.116.1935: Flags [.], seq 112373:113687, ack 1, win 501, options [nop,nop,TS val 3159895789 ecr 3719933140], length 1314
09:00:11.494928 IP 10.8.1.4.51676 > 99.181.88.116.1935: Flags [.], seq 113687:115001, ack 1, win 501, options [nop,nop,TS val 3159895823 ecr 3719933140], length 1314
09:00:11.524281 IP 99.181.88.116.1935 > 10.8.1.4.51676: Flags [.], ack 100469, win 375, options [nop,nop,TS val 3719933210 ecr 3159895287], length 0
09:00:11.528184 IP 10.8.1.4.51676 > 99.181.88.116.1935: Flags [.], seq 115001:116315, ack 1, win 501, options [nop,nop,TS val 3159895856 ecr 3719933210], length 1314
09:00:11.544406 IP 99.181.88.116.1935 > 10.8.1.4.51676: Flags [.], ack 100547, win 375, options [nop,nop,TS val 3719933228 ecr 3159895342], length 0
09:00:11.544436 IP 10.8.1.4.51676 > 99.181.88.116.1935: Flags [P.], seq 116315:116473, ack 1, win 501, options [nop,nop,TS val 3159895872 ecr 3719933228], length 158
09:00:11.596220 IP 10.8.1.4.51676 > 99.181.88.116.1935: Flags [.], seq 116473:117787, ack 1, win 501, options [nop,nop,TS val 3159895924 ecr 3719933228], length 1314
09:00:11.618224 IP 99.181.88.116.1935 > 10.8.1.4.51676: Flags [.], ack 103175, win 375, options [nop,nop,TS val 3719933304 ecr 3159895390], length 0
09:00:11.628099 IP 10.8.1.4.51676 > 99.181.88.116.1935: Flags [.], seq 117787:119101, ack 1, win 501, options [nop,nop,TS val 3159895956 ecr 3719933304], length 1314
09:00:11.661385 IP 10.8.1.4.51676 > 99.181.88.116.1935: Flags [.], seq 119101:120415, ack 1, win 501, options [nop,nop,TS val 3159895989 ecr 3719933304], length 1314
09:00:11.718210 IP 99.181.88.116.1935 > 10.8.1.4.51676: Flags [.], ack 104489, win 375, options [nop,nop,TS val 3719933404 ecr 3159895456], length 0
09:00:11.728036 IP 10.8.1.4.51676 > 99.181.88.116.1935: Flags [.], seq 120415:121729, ack 1, win 501, options [nop,nop,TS val 3159896056 ecr 3719933404], length 1314
09:00:11.752690 IP 99.181.88.116.1935 > 10.8.1.4.51676: Flags [.], ack 107117, win 375, options [nop,nop,TS val 3719933439 ecr 3159895522], length 0
09:00:11.760023 IP 10.8.1.4.51676 > 99.181.88.116.1935: Flags [.], seq 121729:123043, ack 1, win 501, options [nop,nop,TS val 3159896088 ecr 3719933439], length 1314
09:00:11.793568 IP 10.8.1.4.51676 > 99.181.88.116.1935: Flags [.], seq 123043:124357, ack 1, win 501, options [nop,nop,TS val 3159896121 ecr 3719933439], length 1314
09:00:11.854480 IP 99.181.88.116.1935 > 10.8.1.4.51676: Flags [.], ack 109745, win 375, options [nop,nop,TS val 3719933540 ecr 3159895588], length 0
09:00:11.861115 IP 10.8.1.4.51676 > 99.181.88.116.1935: Flags [.], seq 124357:125671, ack 1, win 501, options [nop,nop,TS val 3159896189 ecr 3719933540], length 1314
09:00:11.895433 IP 10.8.1.4.51676 > 99.181.88.116.1935: Flags [.], seq 125671:126985, ack 1, win 501, options [nop,nop,TS val 3159896223 ecr 3719933540], length 1314
09:00:11.919632 IP 99.181.88.116.1935 > 10.8.1.4.51676: Flags [.], ack 112373, win 375, options [nop,nop,TS val 3719933606 ecr 3159895688], length 0
09:00:11.928694 IP 10.8.1.4.51676 > 99.181.88.116.1935: Flags [.], seq 126985:128299, ack 1, win 501, options [nop,nop,TS val 3159896256 ecr 3719933606], length 1314
09:00:11.995909 IP 10.8.1.4.51676 > 99.181.88.116.1935: Flags [.], seq 128299:129613, ack 1, win 501, options [nop,nop,TS val 3159896324 ecr 3719933606], length 1314
09:00:12.022450 IP 99.181.88.116.1935 > 10.8.1.4.51676: Flags [.], ack 115001, win 375, options [nop,nop,TS val 3719933706 ecr 3159895789], length 0
09:00:12.029024 IP 10.8.1.4.51676 > 99.181.88.116.1935: Flags [.], seq 129613:130927, ack 1, win 501, options [nop,nop,TS val 3159896357 ecr 3719933706], length 1314
09:00:12.062244 IP 10.8.1.4.51676 > 99.181.88.116.1935: Flags [.], seq 130927:132241, ack 1, win 501, options [nop,nop,TS val 3159896390 ecr 3719933706], length 1314
09:00:12.070488 IP 99.181.88.116.1935 > 10.8.1.4.51676: Flags [.], ack 116473, win 376, options [nop,nop,TS val 3719933756 ecr 3159895856], length 0
09:00:12.070523 IP 10.8.1.4.51676 > 99.181.88.116.1935: Flags [P.], seq 132241:132397, ack 1, win 501, options [nop,nop,TS val 3159896398 ecr 3719933756], length 156
09:00:12.131000 IP 10.8.1.4.51676 > 99.181.88.116.1935: Flags [.], seq 132397:133711, ack 1, win 501, options [nop,nop,TS val 3159896459 ecr 3719933756], length 1314
09:00:12.153905 IP 99.181.88.116.1935 > 10.8.1.4.51676: Flags [.], ack 119101, win 375, options [nop,nop,TS val 3719933839 ecr 3159895924], length 0
09:00:12.158359 IP 10.8.1.4.51676 > 99.181.88.116.1935: Flags [.], seq 133711:135025, ack 1, win 501, options [nop,nop,TS val 3159896486 ecr 3719933839], length 1314
09:00:12.194754 IP 10.8.1.4.51676 > 99.181.88.116.1935: Flags [.], seq 135025:136339, ack 1, win 501, options [nop,nop,TS val 3159896522 ecr 3719933839], length 1314
09:00:12.250252 IP 99.181.88.116.1935 > 10.8.1.4.51676: Flags [.], ack 120415, win 376, options [nop,nop,TS val 3719933936 ecr 3159895989], length 0
09:00:12.260913 IP 10.8.1.4.51676 > 99.181.88.116.1935: Flags [.], seq 136339:137653, ack 1, win 501, options [nop,nop,TS val 3159896589 ecr 3719933936], length 1314
09:00:12.286224 IP 99.181.88.116.1935 > 10.8.1.4.51676: Flags [.], ack 123043, win 376, options [nop,nop,TS val 3719933972 ecr 3159896056], length 0
09:00:12.293933 IP 10.8.1.4.51676 > 99.181.88.116.1935: Flags [.], seq 137653:138967, ack 1, win 501, options [nop,nop,TS val 3159896622 ecr 3719933972], length 1314
09:00:12.327211 IP 10.8.1.4.51676 > 99.181.88.116.1935: Flags [.], seq 138967:140281, ack 1, win 501, options [nop,nop,TS val 3159896655 ecr 3719933972], length 1314
09:00:12.386848 IP 99.181.88.116.1935 > 10.8.1.4.51676: Flags [.], ack 125671, win 375, options [nop,nop,TS val 3719934072 ecr 3159896121], length 0
09:00:12.391455 IP 10.8.1.4.51676 > 99.181.88.116.1935: Flags [.], seq 140281:141595, ack 1, win 501, options [nop,nop,TS val 3159896719 ecr 3719934072], length 1314
09:00:12.429693 IP 10.8.1.4.51676 > 99.181.88.116.1935: Flags [.], seq 141595:142909, ack 1, win 501, options [nop,nop,TS val 3159896757 ecr 3719934072], length 1314
09:00:12.454101 IP 99.181.88.116.1935 > 10.8.1.4.51676: Flags [.], ack 128299, win 375, options [nop,nop,TS val 3719934140 ecr 3159896223], length 0
09:00:12.462183 IP 10.8.1.4.51676 > 99.181.88.116.1935: Flags [.], seq 142909:144223, ack 1, win 501, options [nop,nop,TS val 3159896790 ecr 3719934140], length 1314
09:00:12.528847 IP 10.8.1.4.51676 > 99.181.88.116.1935: Flags [.], seq 144223:145537, ack 1, win 501, options [nop,nop,TS val 3159896857 ecr 3719934140], length 1314
09:00:12.553999 IP 99.181.88.116.1935 > 10.8.1.4.51676: Flags [.], ack 130927, win 375, options [nop,nop,TS val 3719934240 ecr 3159896324], length 0
09:00:12.559682 IP 10.8.1.4.51676 > 99.181.88.116.1935: Flags [.], seq 145537:146851, ack 1, win 501, options [nop,nop,TS val 3159896887 ecr 3719934240], length 1314
09:00:12.592581 IP 10.8.1.4.51676 > 99.181.88.116.1935: Flags [.], seq 146851:148165, ack 1, win 501, options [nop,nop,TS val 3159896920 ecr 3719934240], length 1314
09:00:12.595590 IP 99.181.88.116.1935 > 10.8.1.4.51676: Flags [.], ack 132397, win 376, options [nop,nop,TS val 3719934281 ecr 3159896390], length 0
09:00:12.595606 IP 10.8.1.4.51676 > 99.181.88.116.1935: Flags [P.], seq 148165:148238, ack 1, win 501, options [nop,nop,TS val 3159896923 ecr 3719934281], length 73
09:00:12.665244 IP 10.8.1.4.51676 > 99.181.88.116.1935: Flags [.], seq 148238:149552, ack 1, win 501, options [nop,nop,TS val 3159896993 ecr 3719934281], length 1314
09:00:12.683736 IP 99.181.88.116.1935 > 10.8.1.4.51676: Flags [.], ack 135025, win 376, options [nop,nop,TS val 3719934369 ecr 3159896459], length 0
09:00:12.694343 IP 10.8.1.4.51676 > 99.181.88.116.1935: Flags [.], seq 149552:150866, ack 1, win 501, options [nop,nop,TS val 3159897022 ecr 3719934369], length 1314
09:00:12.729353 IP 10.8.1.4.51676 > 99.181.88.116.1935: Flags [.], seq 150866:152180, ack 1, win 501, options [nop,nop,TS val 3159897057 ecr 3719934369], length 1314
09:00:12.794124 IP 10.8.1.4.51676 > 99.181.88.116.1935: Flags [.], seq 152180:153494, ack 1, win 501, options [nop,nop,TS val 3159897122 ecr 3719934369], length 1314
09:00:12.819027 IP 99.181.88.116.1935 > 10.8.1.4.51676: Flags [.], ack 138967, win 376, options [nop,nop,TS val 3719934505 ecr 3159896589], length 0
09:00:12.827382 IP 10.8.1.4.51676 > 99.181.88.116.1935: Flags [.], seq 153494:154808, ack 1, win 501, options [nop,nop,TS val 3159897155 ecr 3719934505], length 1314
09:00:12.860996 IP 10.8.1.4.51676 > 99.181.88.116.1935: Flags [.], seq 154808:156122, ack 1, win 501, options [nop,nop,TS val 3159897189 ecr 3719934505], length 1314
09:00:12.928455 IP 10.8.1.4.51676 > 99.181.88.116.1935: Flags [.], seq 156122:157436, ack 1, win 501, options [nop,nop,TS val 3159897256 ecr 3719934505], length 1314
09:00:12.964639 IP 10.8.1.4.51676 > 99.181.88.116.1935: Flags [.], seq 157436:158750, ack 1, win 501, options [nop,nop,TS val 3159897292 ecr 3719934505], length 1314
09:00:12.995457 IP 10.8.1.4.51676 > 99.181.88.116.1935: Flags [.], seq 158750:160064, ack 1, win 501, options [nop,nop,TS val 3159897323 ecr 3719934505], length 1314
09:00:13.062285 IP 10.8.1.4.51676 > 99.181.88.116.1935: Flags [.], seq 160064:161378, ack 1, win 501, options [nop,nop,TS val 3159897390 ecr 3719934505], length 1314
09:00:13.095530 IP 10.8.1.4.51676 > 99.181.88.116.1935: Flags [.], seq 161378:162692, ack 1, win 501, options [nop,nop,TS val 3159897423 ecr 3719934505], length 1314
09:00:13.128894 IP 10.8.1.4.51676 > 99.181.88.116.1935: Flags [.], seq 162692:164006, ack 1, win 501, options [nop,nop,TS val 3159897457 ecr 3719934505], length 1314
09:00:13.195861 IP 10.8.1.4.51676 > 99.181.88.116.1935: Flags [.], seq 164006:165320, ack 1, win 501, options [nop,nop,TS val 3159897524 ecr 3719934505], length 1314
09:00:13.227556 IP 10.8.1.4.51676 > 99.181.88.116.1935: Flags [.], seq 165320:166634, ack 1, win 501, options [nop,nop,TS val 3159897555 ecr 3719934505], length 1314
09:00:13.265340 IP 10.8.1.4.51676 > 99.181.88.116.1935: Flags [.], seq 166634:167948, ack 1, win 501, options [nop,nop,TS val 3159897593 ecr 3719934505], length 1314
09:00:13.324943 IP 10.8.1.4.51676 > 99.181.88.116.1935: Flags [.], seq 167948:169262, ack 1, win 501, options [nop,nop,TS val 3159897653 ecr 3719934505], length 1314
09:00:13.359345 IP 10.8.1.4.51676 > 99.181.88.116.1935: Flags [.], seq 169262:170576, ack 1, win 501, options [nop,nop,TS val 3159897687 ecr 3719934505], length 1314
09:00:13.395619 IP 10.8.1.4.51676 > 99.181.88.116.1935: Flags [.], seq 170576:171890, ack 1, win 501, options [nop,nop,TS val 3159897723 ecr 3719934505], length 1314
09:00:13.435827 IP 10.8.1.4.51676 > 99.181.88.116.1935: Flags [.], seq 171890:173204, ack 1, win 501, options [nop,nop,TS val 3159897764 ecr 3719934505], length 1314
09:00:13.500080 IP 10.8.1.4.51676 > 99.181.88.116.1935: Flags [.], seq 173204:174518, ack 1, win 501, options [nop,nop,TS val 3159897828 ecr 3719934505], length 1314
09:00:13.527985 IP 10.8.1.4.51676 > 99.181.88.116.1935: Flags [.], seq 174518:175832, ack 1, win 501, options [nop,nop,TS val 3159897856 ecr 3719934505], length 1314
09:00:13.564401 IP 10.8.1.4.51676 > 99.181.88.116.1935: Flags [.], seq 175832:177146, ack 1, win 501, options [nop,nop,TS val 3159897892 ecr 3719934505], length 1314
09:00:13.628310 IP 10.8.1.4.51676 > 99.181.88.116.1935: Flags [.], seq 177146:178460, ack 1, win 501, options [nop,nop,TS val 3159897956 ecr 3719934505], length 1314
09:00:13.662361 IP 10.8.1.4.51676 > 99.181.88.116.1935: Flags [.], seq 178460:179774, ack 1, win 501, options [nop,nop,TS val 3159897990 ecr 3719934505], length 1314
09:00:13.695753 IP 10.8.1.4.51676 > 99.181.88.116.1935: Flags [.], seq 179774:181088, ack 1, win 501, options [nop,nop,TS val 3159898023 ecr 3719934505], length 1314
09:00:13.746227 IP 10.8.1.4.51676 > 99.181.88.116.1935: Flags [P.], seq 181088:182161, ack 1, win 501, options [nop,nop,TS val 3159898074 ecr 3719934505], length 1073
09:00:13.799829 IP 10.8.1.4.51676 > 99.181.88.116.1935: Flags [.], seq 182161:183475, ack 1, win 501, options [nop,nop,TS val 3159898128 ecr 3719934505], length 1314
09:00:13.827377 IP 10.8.1.4.51676 > 99.181.88.116.1935: Flags [.], seq 183475:184789, ack 1, win 501, options [nop,nop,TS val 3159898155 ecr 3719934505], length 1314
09:00:13.863556 IP 10.8.1.4.51676 > 99.181.88.116.1935: Flags [.], seq 184789:186103, ack 1, win 501, options [nop,nop,TS val 3159898191 ecr 3719934505], length 1314
09:00:13.928936 IP 10.8.1.4.51676 > 99.181.88.116.1935: Flags [.], seq 186103:187417, ack 1, win 501, options [nop,nop,TS val 3159898257 ecr 3719934505], length 1314
