04:54:00.126943 IP 52.223.224.104.1935 > 10.8.0.18.35682: Flags [.], ack 1518050635, win 126, options [nop,nop,TS val 2749714268 ecr 658250331], length 0
04:54:00.130355 IP 10.8.0.18.35682 > 52.223.224.104.1935: Flags [.], seq 9626:10940, ack 0, win 501, options [nop,nop,TS val 658250731 ecr 2749714268], length 1314
04:54:00.162219 IP 52.223.224.104.1935 > 10.8.0.18.35682: Flags [.], ack 428, win 126, options [nop,nop,TS val 2749714295 ecr 658250390], length 0
04:54:00.162255 IP 10.8.0.18.35682 > 52.223.224.104.1935: Flags [P.], seq 10940:11352, ack 0, win 501, options [nop,nop,TS val 658250763 ecr 2749714295], length 412
04:54:00.192876 IP 10.8.0.18.35682 > 52.223.224.104.1935: Flags [.], seq 11352:12666, ack 0, win 501, options [nop,nop,TS val 658250793 ecr 2749714295], length 1314
04:54:00.225488 IP 52.223.224.104.1935 > 10.8.0.18.35682: Flags [.], ack 3056, win 126, options [nop,nop,TS val 2749714367 ecr 658250431], length 0
04:54:00.226828 IP 10.8.0.18.35682 > 52.223.224.104.1935: Flags [.], seq 12666:13980, ack 0, win 501, options [nop,nop,TS val 658250827 ecr 2749714367], length 1314
04:54:00.274129 IP 10.8.0.18.35682 > 52.223.224.104.1935: Flags [.], seq 13980:15294, ack 0, win 501, options [nop,nop,TS val 658250874 ecr 2749714367], length 1314
04:54:00.330340 IP 10.8.0.18.35682 > 52.223.224.104.1935: Flags [.], seq 15294:16608, ack 0, win 501, options [nop,nop,TS val 658250931 ecr 2749714367], length 1314
04:54:00.361262 IP 10.8.0.18.35682 > 52.223.224.104.1935: Flags [.], seq 16608:17922, ack 0, win 501, options [nop,nop,TS val 658250962 ecr 2749714367], length 1314
04:54:00.402720 IP 10.8.0.18.35682 > 52.223.224.104.1935: Flags [.], seq 17922:19236, ack 0, win 501, options [nop,nop,TS val 658251003 ecr 2749714367], length 1314
04:54:00.403506 IP 52.223.224.104.1935 > 10.8.0.18.35682: Flags [.], ack 8312, win 126, options [nop,nop,TS val 2749714545 ecr 658250593], length 0
04:54:00.463778 IP 10.8.0.18.35682 > 52.223.224.104.1935: Flags [.], seq 19236:20550, ack 0, win 501, options [nop,nop,TS val 658251064 ecr 2749714545], length 1314
04:54:00.493231 IP 52.223.224.104.1935 > 10.8.0.18.35682: Flags [.], ack 10940, win 126, options [nop,nop,TS val 2749714635 ecr 658250696], length 0
04:54:00.494758 IP 10.8.0.18.35682 > 52.223.224.104.1935: Flags [.], seq 20550:21864, ack 0, win 501, options [nop,nop,TS val 658251095 ecr 2749714635], length 1314
04:54:00.524602 IP 52.223.224.104.1935 > 10.8.0.18.35682: Flags [.], ack 11352, win 126, options [nop,nop,TS val 2749714667 ecr 658250763], length 0
04:54:00.524629 IP 10.8.0.18.35682 > 52.223.224.104.1935: Flags [P.], seq 21864:22294, ack 0, win 501, options [nop,nop,TS val 658251125 ecr 2749714667], length 430
04:54:00.561196 IP 10.8.0.18.35682 > 52.223.224.104.1935: Flags [.], seq 22294:23608, ack 0, win 501, options [nop,nop,TS val 658251162 ecr 2749714667], length 1314
04:54:00.589561 IP 52.223.224.104.1935 > 10.8.0.18.35682: Flags [.], ack 13980, win 126, options [nop,nop,TS val 2749714731 ecr 658250793], length 0
04:54:00.594585 IP 10.8.0.18.35682 > 52.223.224.104.1935: Flags [.], seq 23608:24922, ack 0, win 501, options [nop,nop,TS val 658251195 ecr 2749714731], length 1314
04:54:00.637188 IP 10.8.0.18.35682 > 52.223.224.104.1935: Flags [.], seq 24922:26236, ack 0, win 501, options [nop,nop,TS val 658251237 ecr 2749714731], length 1314
04:54:00.693388 IP 52.223.224.104.1935 > 10.8.0.18.35682: Flags [.], ack 16608, win 126, options [nop,nop,TS val 2749714835 ecr 658250874], length 0
04:54:00.697465 IP 10.8.0.18.35682 > 52.223.224.104.1935: Flags [.], seq 26236:27550, ack 0, win 501, options [nop,nop,TS val 658251298 ecr 2749714835], length 1314
04:54:00.726371 IP 10.8.0.18.35682 > 52.223.224.104.1935: Flags [.], seq 27550:28864, ack 0, win 501, options [nop,nop,TS val 658251327 ecr 2749714835], length 1314
04:54:00.765535 IP 10.8.0.18.35682 > 52.223.224.104.1935: Flags [.], seq 28864:30178, ack 0, win 501, options [nop,nop,TS val 658251366 ecr 2749714835], length 1314
04:54:00.766317 IP 52.223.224.104.1935 > 10.8.0.18.35682: Flags [.], ack 19236, win 126, options [nop,nop,TS val 2749714908 ecr 658250962], length 0
04:54:00.830683 IP 10.8.0.18.35682 > 52.223.224.104.1935: Flags [.], seq 30178:31492, ack 0, win 501, options [nop,nop,TS val 658251431 ecr 2749714908], length 1314
04:54:00.858042 IP 52.223.224.104.1935 > 10.8.0.18.35682: Flags [.], ack 21864, win 126, options [nop,nop,TS val 2749714999 ecr 658251064], length 0
04:54:00.863730 IP 10.8.0.18.35682 > 52.223.224.104.1935: Flags [.], seq 31492:32806, ack 0, win 501, options [nop,nop,TS val 658251464 ecr 2749714999], length 1314
04:54:00.887341 IP 52.223.224.104.1935 > 10.8.0.18.35682: Flags [.], ack 22294, win 126, options [nop,nop,TS val 2749715029 ecr 658251125], length 0
04:54:00.887368 IP 10.8.0.18.35682 > 52.223.224.104.1935: Flags [P.], seq 32806:33220, ack 0, win 501, options [nop,nop,TS val 658251488 ecr 2749715029], length 414
04:54:00.927709 IP 10.8.0.18.35682 > 52.223.224.104.1935: Flags [.], seq 33220:34534, ack 0, win 501, options [nop,nop,TS val 658251528 ecr 2749715029], length 1314
04:54:00.957400 IP 52.223.224.104.1935 > 10.8.0.18.35682: Flags [.], ack 24922, win 126, options [nop,nop,TS val 2749715099 ecr 658251162], length 0
04:54:00.959860 IP 10.8.0.18.35682 > 52.223.224.104.1935: Flags [.], seq 34534:35848, ack 0, win 501, options [nop,nop,TS val 658251560 ecr 2749715099], length 1314
04:54:01.000418 IP 10.8.0.18.35682 > 52.223.224.104.1935: Flags [.], seq 35848:37162, ack 0, win 501, options [nop,nop,TS val 658251601 ecr 2749715099], length 1314
04:54:01.060739 IP 52.223.224.104.1935 > 10.8.0.18.35682: Flags [.], ack 27550, win 126, options [nop,nop,TS val 2749715202 ecr 658251237], length 0
04:54:01.063807 IP 10.8.0.18.35682 > 52.223.224.104.1935: Flags [.], seq 37162:38476, ack 0, win 501, options [nop,nop,TS val 658251664 ecr 2749715202], length 1314
04:54:01.093075 IP 10.8.0.18.35682 > 52.223.224.104.1935: Flags [.], seq 38476:39790, ack 0, win 501, options [nop,nop,TS val 658251693 ecr 2749715202], length 1314
04:54:01.128277 IP 10.8.0.18.35682 > 52.223.224.104.1935: Flags [.], seq 39790:41104, ack 0, win 501, options [nop,nop,TS val 658251729 ecr 2749715202], length 1314
04:54:01.130474 IP 52.223.224.104.1935 > 10.8.0.18.35682: Flags [.], ack 30178, win 126, options [nop,nop,TS val 2749715270 ecr 658251327], length 0
04:54:01.193325 IP 10.8.0.18.35682 > 52.223.224.104.1935: Flags [.], seq 41104:42418, ack 0, win 501, options [nop,nop,TS val 658251794 ecr 2749715270], length 1314
04:54:01.226792 IP 10.8.0.18.35682 > 52.223.224.104.1935: Flags [.], seq 42418:43732, ack 0, win 501, options [nop,nop,TS val 658251827 ecr 2749715270], length 1314
04:54:01.227896 IP 52.223.224.104.1935 > 10.8.0.18.35682: Flags [.], ack 32806, win 126, options [nop,nop,TS val 2749715370 ecr 658251431], length 0
04:54:01.249962 IP 52.223.224.104.1935 > 10.8.0.18.35682: Flags [.], ack 33220, win 126, options [nop,nop,TS val 2749715392 ecr 658251488], length 0
04:54:01.249974 IP 10.8.0.18.35682 > 52.223.224.104.1935: Flags [P.], seq 43732:44160, ack 0, win 501, options [nop,nop,TS val 658251850 ecr 2749715392], length 428
04:54:01.295299 IP 10.8.0.18.35682 > 52.223.224.104.1935: Flags [.], seq 44160:45474, ack 0, win 501, options [nop,nop,TS val 658251896 ecr 2749715392], length 1314
04:54:01.322688 IP 52.223.224.104.1935 > 10.8.0.18.35682: Flags [.], ack 35848, win 126, options [nop,nop,TS val 2749715464 ecr 658251528], length 0
04:54:01.330209 IP 10.8.0.18.35682 > 52.223.224.104.1935: Flags [.], seq 45474:46788, ack 0, win 501, options [nop,nop,TS val 658251931 ecr 2749715464], length 1314
04:54:01.363862 IP 10.8.0.18.35682 > 52.223.224.104.1935: Flags [.], seq 46788:48102, ack 0, win 501, options [nop,nop,TS val 658251964 ecr 2749715464], length 1314
04:54:01.426425 IP 52.223.224.104.1935 > 10.8.0.18.35682: Flags [.], ack 38476, win 126, options [nop,nop,TS val 2749715568 ecr 658251601], length 0
04:54:01.430439 IP 10.8.0.18.35682 > 52.223.224.104.1935: Flags [.], seq 48102:49416, ack 0, win 501, options [nop,nop,TS val 658252031 ecr 2749715568], length 1314
04:54:01.462252 IP 10.8.0.18.35682 > 52.223.224.104.1935: Flags [.], seq 49416:50730, ack 0, win 501, options [nop,nop,TS val 658252063 ecr 2749715568], length 1314
04:54:01.492149 IP 52.223.224.104.1935 > 10.8.0.18.35682: Flags [.], ack 41104, win 126, options [nop,nop,TS val 2749715634 ecr 658251693], length 0
04:54:01.496613 IP 10.8.0.18.35682 > 52.223.224.104.1935: Flags [.], seq 50730:52044, ack 0, win 501, options [nop,nop,TS val 658252097 ecr 2749715634], length 1314
04:54:01.563454 IP 10.8.0.18.35682 > 52.223.224.104.1935: Flags [.], seq 52044:53358, ack 0, win 501, options [nop,nop,TS val 658252164 ecr 2749715634], length 1314
04:54:01.589605 IP 52.223.224.104.1935 > 10.8.0.18.35682: Flags [.], ack 43732, win 126, options [nop,nop,TS val 2749715731 ecr 658251794], length 0
04:54:01.597595 IP 10.8.0.18.35682 > 52.223.224.104.1935: Flags [.], seq 53358:54672, ack 0, win 501, options [nop,nop,TS val 658252198 ecr 2749715731], length 1314
04:54:01.612602 IP 52.223.224.104.1935 > 10.8.0.18.35682: Flags [.], ack 44160, win 126, options [nop,nop,TS val 2749715754 ecr 658251850], length 0
04:54:01.612636 IP 10.8.0.18.35682 > 52.223.224.104.1935: Flags [P.], seq 54672:55086, ack 0, win 501, options [nop,nop,TS val 658252213 ecr 2749715754], length 414
04:54:01.663849 IP 10.8.0.18.35682 > 52.223.224.104.1935: Flags [.], seq 55086:56400, ack 0, win 501, options [nop,nop,TS val 658252264 ecr 2749715754], length 1314
04:54:01.693035 IP 52.223.224.104.1935 > 10.8.0.18.35682: Flags [.], ack 46788, win 126, options [nop,nop,TS val 2749715835 ecr 658251896], length 0
04:54:01.697134 IP 10.8.0.18.35682 > 52.223.224.104.1935: Flags [.], seq 56400:57714, ack 0, win 501, options [nop,nop,TS val 658252297 ecr 2749715835], length 1314
04:54:01.728899 IP 10.8.0.18.35682 > 52.223.224.104.1935: Flags [.], seq 57714:59028, ack 0, win 501, options [nop,nop,TS val 658252329 ecr 2749715835], length 1314
04:54:01.793148 IP 52.223.224.104.1935 > 10.8.0.18.35682: Flags [.], ack 49416, win 126, options [nop,nop,TS val 2749715935 ecr 658251964], length 0
04:54:01.793151 IP 10.8.0.18.35682 > 52.223.224.104.1935: Flags [.], seq 59028:60342, ack 0, win 501, options [nop,nop,TS val 658252393 ecr 2749715835], length 1314
04:54:01.827425 IP 10.8.0.18.35682 > 52.223.224.104.1935: Flags [.], seq 60342:61656, ack 0, win 501, options [nop,nop,TS val 658252428 ecr 2749715935], length 1314
04:54:01.859429 IP 52.223.224.104.1935 > 10.8.0.18.35682: Flags [.], ack 52044, win 126, options [nop,nop,TS val 2749716001 ecr 658252063], length 0
04:54:01.863820 IP 10.8.0.18.35682 > 52.223.224.104.1935: Flags [.], seq 61656:62970, ack 0, win 501, options [nop,nop,TS val 658252464 ecr 2749716001], length 1314
04:54:01.930511 IP 10.8.0.18.35682 > 52.223.224.104.1935: Flags [.], seq 62970:64284, ack 0, win 501, options [nop,nop,TS val 658252531 ecr 2749716001], length 1314
04:54:01.960476 IP 52.223.224.104.1935 > 10.8.0.18.35682: Flags [.], ack 54672, win 126, options [nop,nop,TS val 2749716102 ecr 658252164], length 0
04:54:01.963533 IP 10.8.0.18.35682 > 52.223.224.104.1935: Flags [.], seq 64284:65598, ack 0, win 501, options [nop,nop,TS val 658252564 ecr 2749716102], length 1314
04:54:01.974949 IP 52.223.224.104.1935 > 10.8.0.18.35682: Flags [.], ack 55086, win 126, options [nop,nop,TS val 2749716117 ecr 658252213], length 0
04:54:01.974981 IP 10.8.0.18.35682 > 52.223.224.104.1935: Flags [P.], seq 65598:66025, ack 0, win 501, options [nop,nop,TS val 658252575 ecr 2749716117], length 427
04:54:02.028939 IP 10.8.0.18.35682 > 52.223.224.104.1935: Flags [.], seq 66025:67339, ack 0, win 501, options [nop,nop,TS val 658252629 ecr 2749716117], length 1314
04:54:02.059579 IP 10.8.0.18.35682 > 52.223.224.104.1935: Flags [.], seq 67339:68653, ack 0, win 501, options [nop,nop,TS val 658252660 ecr 2749716117], length 1314
04:54:02.059708 IP 52.223.224.104.1935 > 10.8.0.18.35682: Flags [.], ack 57714, win 126, options [nop,nop,TS val 2749716202 ecr 658252264], length 0
04:54:02.094278 IP 10.8.0.18.35682 > 52.223.224.104.1935: Flags [.], seq 68653:69967, ack 0, win 501, options [nop,nop,TS val 658252695 ecr 2749716202], length 1314
04:54:02.155561 IP 52.223.224.104.1935 > 10.8.0.18.35682: Flags [.], ack 60342, win 126, options [nop,nop,TS val 2749716297 ecr 658252329], length 0
04:54:02.163771 IP 10.8.0.18.35682 > 52.223.224.104.1935: Flags [.], seq 69967:71281, ack 0, win 501, options [nop,nop,TS val 658252764 ecr 2749716297], length 1314
04:54:02.199065 IP 10.8.0.18.35682 > 52.223.224.104.1935: Flags [.], seq 71281:72595, ack 0, win 501, options [nop,nop,TS val 658252799 ecr 2749716297], length 1314
04:54:02.226594 IP 52.223.224.104.1935 > 10.8.0.18.35682: Flags [.], ack 62970, win 126, options [nop,nop,TS val 2749716368 ecr 658252428], length 0
04:54:02.227423 IP 10.8.0.18.35682 > 52.223.224.104.1935: Flags [.], seq 72595:73909, ack 0, win 501, options [nop,nop,TS val 658252828 ecr 2749716368], length 1314
04:54:02.297192 IP 10.8.0.18.35682 > 52.223.224.104.1935: Flags [.], seq 73909:75223, ack 0, win 501, options [nop,nop,TS val 658252897 ecr 2749716368], length 1314
04:54:02.326723 IP 52.223.224.104.1935 > 10.8.0.18.35682: Flags [.], ack 65598, win 126, options [nop,nop,TS val 2749716468 ecr 658252531], length 0
04:54:02.327734 IP 10.8.0.18.35682 > 52.223.224.104.1935: Flags [.], seq 75223:76537, ack 0, win 501, options [nop,nop,TS val 658252928 ecr 2749716468], length 1314
04:54:02.360612 IP 10.8.0.18.35682 > 52.223.224.104.1935: Flags [.], seq 76537:77851, ack 0, win 501, options [nop,nop,TS val 658252961 ecr 2749716468], length 1314
04:54:02.422355 IP 52.223.224.104.1935 > 10.8.0.18.35682: Flags [.], ack 68653, win 126, options [nop,nop,TS val 2749716564 ecr 658252629], length 0
04:54:02.422399 IP 10.8.0.18.35682 > 52.223.224.104.1935: Flags [P.], seq 77851:79026, ack 0, win 501, options [nop,nop,TS val 658253023 ecr 2749716564], length 1175
04:54:02.462691 IP 10.8.0.18.35682 > 52.223.224.104.1935: Flags [.], seq 79026:80340, ack 0, win 501, options [nop,nop,TS val 658253063 ecr 2749716564], length 1314
04:54:02.498181 IP 10.8.0.18.35682 > 52.223.224.104.1935: Flags [.], seq 80340:81654, ack 0, win 501, options [nop,nop,TS val 658253098 ecr 2749716564], length 1314
04:54:02.526374 IP 52.223.224.104.1935 > 10.8.0.18.35682: Flags [.], ack 71281, win 126, options [nop,nop,TS val 2749716668 ecr 658252695], length 0
04:54:02.541017 IP 10.8.0.18.35682 > 52.223.224.104.1935: Flags [.], seq 81654:82968, ack 0, win 501, options [nop,nop,TS val 658253141 ecr 2749716668], length 1314
04:54:02.590126 IP 52.223.224.104.1935 > 10.8.0.18.35682: Flags [.], ack 73909, win 126, options [nop,nop,TS val 2749716732 ecr 658252799], length 0
04:54:02.595965 IP 10.8.0.18.35682 > 52.223.224.104.1935: Flags [.], seq 82968:84282, ack 0, win 501, options [nop,nop,TS val 658253196 ecr 2749716732], length 1314
04:54:02.628057 IP 10.8.0.18.35682 > 52.223.224.104.1935: Flags [.], seq 84282:85596, ack 0, win 501, options [nop,nop,TS val 658253228 ecr 2749716732], length 1314
04:54:02.669702 IP 10.8.0.18.35682 > 52.223.224.104.1935: Flags [.], seq 85596:86910, ack 0, win 501, options [nop,nop,TS val 658253270 ecr 2749716732], length 1314
04:54:02.690607 IP 52.223.224.104.1935 > 10.8.0.18.35682: Flags [.], ack 76537, win 126, options [nop,nop,TS val 2749716832 ecr 658252897], length 0
04:54:02.733769 IP 10.8.0.18.35682 > 52.223.224.104.1935: Flags [.], seq 86910:88224, ack 0, win 501, options [nop,nop,TS val 658253334 ecr 2749716832], length 1314
04:54:02.762811 IP 10.8.0.18.35682 > 52.223.224.104.1935: Flags [.], seq 88224:89538, ack 0, win 501, options [nop,nop,TS val 658253363 ecr 2749716832], length 1314
04:54:02.785190 IP 52.223.224.104.1935 > 10.8.0.18.35682: Flags [.], ack 79026, win 126, options [nop,nop,TS val 2749716927 ecr 658252961], length 0
04:54:02.785227 IP 10.8.0.18.35682 > 52.223.224.104.1935: Flags [P.], seq 89538:89967, ack 0, win 501, options [nop,nop,TS val 658253386 ecr 2749716927], length 429
04:54:02.819876 IP 10.8.0.18.35682 > 52.223.224.104.1935: Flags [.], seq 89967:91281, ack 0, win 501, options [nop,nop,TS val 658253420 ecr 2749716927], length 1314
04:54:02.861070 IP 52.223.224.104.1935 > 10.8.0.18.35682: Flags [.], ack 81654, win 126, options [nop,nop,TS val 2749717003 ecr 658253063], length 0
04:54:02.862728 IP 10.8.0.18.35682 > 52.223.224.104.1935: Flags [.], seq 91281:92595, ack 0, win 501, options [nop,nop,TS val 658253463 ecr 2749717003], length 1314
04:54:02.895540 IP 10.8.0.18.35682 > 52.223.224.104.1935: Flags [.], seq 92595:93909, ack 0, win 501, options [nop,nop,TS val 658253496 ecr 2749717003], length 1314
04:54:02.958603 IP 52.223.224.104.1935 > 10.8.0.18.35682: Flags [.], ack 84282, win 126, options [nop,nop,TS val 2749717100 ecr 658253141], length 0
04:54:02.963775 IP 10.8.0.18.35682 > 52.223.224.104.1935: Flags [.], seq 93909:95223, ack 0, win 501, options [nop,nop,TS val 658253564 ecr 2749717100], length 1314
04:54:02.991794 IP 10.8.0.18.35682 > 52.223.224.104.1935: Flags [.], seq 95223:96537, ack 0, win 501, options [nop,nop,TS val 658253592 ecr 2749717100], length 1314
04:54:03.030603 IP 10.8.0.18.35682 > 52.223.224.104.1935: Flags [.], seq 96537:97851, ack 0, win 501, options [nop,nop,TS val 658253631 ecr 2749717100], length 1314
04:54:03.032557 IP 52.223.224.104.1935 > 10.8.0.18.35682: Flags [.], ack 86910, win 126, options [nop,nop,TS val 2749717174 ecr 658253228], length 0
04:54:03.094600 IP 10.8.0.18.35682 > 52.223.224.104.1935: Flags [.], seq 97851:99165, ack 0, win 501, options [nop,nop,TS val 658253695 ecr 2749717174], length 1314
04:54:03.119642 IP 10.8.0.18.35682 > 52.223.224.104.1935: Flags [.], seq 99165:100479, ack 0, win 501, options [nop,nop,TS val 658253720 ecr 2749717174], length 1314
04:54:03.125675 IP 52.223.224.104.1935 > 10.8.0.18.35682: Flags [.], ack 89538, win 126, options [nop,nop,TS val 2749717267 ecr 658253334], length 0
04:54:03.148718 IP 52.223.224.104.1935 > 10.8.0.18.35682: Flags [.], ack 89967, win 126, options [nop,nop,TS val 2749717290 ecr 658253386], length 0
04:54:03.148734 IP 10.8.0.18.35682 > 52.223.224.104.1935: Flags [P.], seq 100479:100987, ack 0, win 501, options [nop,nop,TS val 658253749 ecr 2749717290], length 508
04:54:03.183566 IP 10.8.0.18.35682 > 52.223.224.104.1935: Flags [.], seq 100987:102301, ack 0, win 501, options [nop,nop,TS val 658253784 ecr 2749717290], length 1314
04:54:03.225617 IP 52.223.224.104.1935 > 10.8.0.18.35682: Flags [.], ack 92595, win 126, options [nop,nop,TS val 2749717367 ecr 658253420], length 0
04:54:03.226569 IP 10.8.0.18.35682 > 52.223.224.104.1935: Flags [.], seq 102301:103615, ack 0, win 501, options [nop,nop,TS val 658253827 ecr 2749717367], length 1314
04:54:03.269034 IP 10.8.0.18.35682 > 52.223.224.104.1935: Flags [.], seq 103615:104929, ack 0, win 501, options [nop,nop,TS val 658253869 ecr 2749717367], length 1314
04:54:03.326387 IP 52.223.224.104.1935 > 10.8.0.18.35682: Flags [.], ack 95223, win 126, options [nop,nop,TS val 2749717468 ecr 658253496], length 0
04:54:03.330270 IP 10.8.0.18.35682 > 52.223.224.104.1935: Flags [.], seq 104929:106243, ack 0, win 501, options [nop,nop,TS val 658253931 ecr 2749717468], length 1314
04:54:03.354612 IP 10.8.0.18.35682 > 52.223.224.104.1935: Flags [.], seq 106243:107557, ack 0, win 501, options [nop,nop,TS val 658253955 ecr 2749717468], length 1314
04:54:03.396917 IP 10.8.0.18.35682 > 52.223.224.104.1935: Flags [.], seq 107557:108871, ack 0, win 501, options [nop,nop,TS val 658253997 ecr 2749717468], length 1314
04:54:03.397856 IP 52.223.224.104.1935 > 10.8.0.18.35682: Flags [.], ack 97851, win 126, options [nop,nop,TS val 2749717535 ecr 658253592], length 0
04:54:03.460943 IP 10.8.0.18.35682 > 52.223.224.104.1935: Flags [.], seq 108871:110185, ack 0, win 501, options [nop,nop,TS val 658254061 ecr 2749717535], length 1314
04:54:03.483144 IP 52.223.224.104.1935 > 10.8.0.18.35682: Flags [.], ack 100479, win 126, options [nop,nop,TS val 2749717625 ecr 658253695], length 0
04:54:03.497729 IP 10.8.0.18.35682 > 52.223.224.104.1935: Flags [.], seq 110185:111499, ack 0, win 501, options [nop,nop,TS val 658254098 ecr 2749717625], length 1314
04:54:03.511122 IP 52.223.224.104.1935 > 10.8.0.18.35682: Flags [.], ack 100987, win 126, options [nop,nop,TS val 2749717653 ecr 658253749], length 0
04:54:03.511146 IP 10.8.0.18.35682 > 52.223.224.104.1935: Flags [P.], seq 111499:111925, ack 0, win 501, options [nop,nop,TS val 658254111 ecr 2749717653], length 426
04:54:03.561688 IP 10.8.0.18.35682 > 52.223.224.104.1935: Flags [.], seq 111925:113239, ack 0, win 501, options [nop,nop,TS val 658254162 ecr 2749717653], length 1314
04:54:03.589383 IP 10.8.0.18.35682 > 52.223.224.104.1935: Flags [.], seq 113239:114553, ack 0, win 501, options [nop,nop,TS val 658254190 ecr 2749717653], length 1314
04:54:03.589612 IP 52.223.224.104.1935 > 10.8.0.18.35682: Flags [.], ack 103615, win 126, options [nop,nop,TS val 2749717731 ecr 658253784], length 0
04:54:03.632316 IP 10.8.0.18.35682 > 52.223.224.104.1935: Flags [.], seq 114553:115867, ack 0, win 501, options [nop,nop,TS val 658254233 ecr 2749717731], length 1314
04:54:03.694536 IP 10.8.0.18.35682 > 52.223.224.104.1935: Flags [.], seq 115867:117181, ack 0, win 501, options [nop,nop,TS val 658254295 ecr 2749717731], length 1314
04:54:03.695311 IP 52.223.224.104.1935 > 10.8.0.18.35682: Flags [.], ack 106243, win 126, options [nop,nop,TS val 2749717837 ecr 658253869], length 0
04:54:03.717953 IP 10.8.0.18.35682 > 52.223.224.104.1935: Flags [.], seq 117181:118495, ack 0, win 501, options [nop,nop,TS val 658254318 ecr 2749717837], length 1314
04:54:03.760436 IP 52.223.224.104.1935 > 10.8.0.18.35682: Flags [.], ack 108871, win 126, options [nop,nop,TS val 2749717902 ecr 658253955], length 0
04:54:03.763776 IP 10.8.0.18.35682 > 52.223.224.104.1935: Flags [.], seq 118495:119809, ack 0, win 501, options [nop,nop,TS val 658254364 ecr 2749717902], length 1314
04:54:03.824808 IP 10.8.0.18.35682 > 52.223.224.104.1935: Flags [.], seq 119809:121123, ack 0, win 501, options [nop,nop,TS val 658254425 ecr 2749717902], length 1314
04:54:03.860528 IP 52.223.224.104.1935 > 10.8.0.18.35682: Flags [.], ack 111499, win 126, options [nop,nop,TS val 2749718002 ecr 658254061], length 0
04:54:03.861824 IP 10.8.0.18.35682 > 52.223.224.104.1935: Flags [.], seq 121123:122437, ack 0, win 501, options [nop,nop,TS val 658254462 ecr 2749718002], length 1314
04:54:03.873589 IP 52.223.224.104.1935 > 10.8.0.18.35682: Flags [.], ack 111925, win 126, options [nop,nop,TS val 2749718015 ecr 658254111], length 0
04:54:03.873619 IP 10.8.0.18.35682 > 52.223.224.104.1935: Flags [P.], seq 122437:122860, ack 0, win 501, options [nop,nop,TS val 658254474 ecr 2749718015], length 423
04:54:03.926207 IP 10.8.0.18.35682 > 52.223.224.104.1935: Flags [.], seq 122860:124174, ack 0, win 501, options [nop,nop,TS val 658254527 ecr 2749718015], length 1314
04:54:03.951999 IP 52.223.224.104.1935 > 10.8.0.18.35682: Flags [.], ack 114553, win 126, options [nop,nop,TS val 2749718094 ecr 658254162], length 0
04:54:03.952842 IP 10.8.0.18.35682 > 52.223.224.104.1935: Flags [.], seq 124174:125488, ack 0, win 501, options [nop,nop,TS val 658254553 ecr 2749718094], length 1314
04:54:03.995381 IP 10.8.0.18.35682 > 52.223.224.104.1935: Flags [.], seq 125488:126802, ack 0, win 501, options [nop,nop,TS val 658254596 ecr 2749718094], length 1314
04:54:04.059924 IP 10.8.0.18.35682 > 52.223.224.104.1935: Flags [.], seq 126802:128116, ack 0, win 501, options [nop,nop,TS val 658254660 ecr 2749718094], length 1314
04:54:04.063156 IP 52.223.224.104.1935 > 10.8.0.18.35682: Flags [.], ack 117181, win 126, options [nop,nop,TS val 2749718199 ecr 658254233], length 0
04:54:04.095937 IP 10.8.0.18.35682 > 52.223.224.104.1935: Flags [.], seq 128116:129430, ack 0, win 501, options [nop,nop,TS val 658254696 ecr 2749718199], length 1314
04:54:04.126345 IP 52.223.224.104.1935 > 10.8.0.18.35682: Flags [.], ack 119809, win 126, options [nop,nop,TS val 2749718268 ecr 658254318], length 0
04:54:04.128747 IP 10.8.0.18.35682 > 52.223.224.104.1935: Flags [.], seq 129430:130744, ack 0, win 501, options [nop,nop,TS val 658254729 ecr 2749718268], length 1314
04:54:04.188293 IP 10.8.0.18.35682 > 52.223.224.104.1935: Flags [.], seq 130744:132058, ack 0, win 501, options [nop,nop,TS val 658254789 ecr 2749718268], length 1314
04:54:04.224600 IP 52.223.224.104.1935 > 10.8.0.18.35682: Flags [.], ack 122437, win 126, options [nop,nop,TS val 2749718366 ecr 658254425], length 0
04:54:04.229828 IP 10.8.0.18.35682 > 52.223.224.104.1935: Flags [.], seq 132058:133372, ack 0, win 501, options [nop,nop,TS val 658254830 ecr 2749718366], length 1314
04:54:04.236382 IP 52.223.224.104.1935 > 10.8.0.18.35682: Flags [.], ack 122860, win 126, options [nop,nop,TS val 2749718378 ecr 658254474], length 0
04:54:04.236410 IP 10.8.0.18.35682 > 52.223.224.104.1935: Flags [P.], seq 133372:133792, ack 0, win 501, options [nop,nop,TS val 658254837 ecr 2749718378], length 420
04:54:04.295535 IP 10.8.0.18.35682 > 52.223.224.104.1935: Flags [.], seq 133792:135106, ack 0, win 501, options [nop,nop,TS val 658254896 ecr 2749718378], length 1314
04:54:04.315553 IP 52.223.224.104.1935 > 10.8.0.18.35682: Flags [.], ack 125488, win 126, options [nop,nop,TS val 2749718457 ecr 658254527], length 0
04:54:04.330582 IP 10.8.0.18.35682 > 52.223.224.104.1935: Flags [.], seq 135106:136420, ack 0, win 501, options [nop,nop,TS val 658254931 ecr 2749718457], length 1314
04:54:04.363462 IP 10.8.0.18.35682 > 52.223.224.104.1935: Flags [.], seq 136420:137734, ack 0, win 501, options [nop,nop,TS val 658254964 ecr 2749718457], length 1314
04:54:04.424176 IP 10.8.0.18.35682 > 52.223.224.104.1935: Flags [.], seq 137734:139048, ack 0, win 501, options [nop,nop,TS val 658255024 ecr 2749718457], length 1314
04:54:04.426398 IP 52.223.224.104.1935 > 10.8.0.18.35682: Flags [.], ack 128116, win 126, options [nop,nop,TS val 2749718568 ecr 658254596], length 0
04:54:04.463205 IP 10.8.0.18.35682 > 52.223.224.104.1935: Flags [.], seq 139048:140362, ack 0, win 501, options [nop,nop,TS val 658255064 ecr 2749718568], length 1314
04:54:04.491779 IP 52.223.224.104.1935 > 10.8.0.18.35682: Flags [.], ack 130744, win 126, options [nop,nop,TS val 2749718633 ecr 658254696], length 0
04:54:04.494501 IP 10.8.0.18.35682 > 52.223.224.104.1935: Flags [.], seq 140362:141676, ack 0, win 501, options [nop,nop,TS val 658255095 ecr 2749718633], length 1314
04:54:04.564347 IP 10.8.0.18.35682 > 52.223.224.104.1935: Flags [.], seq 141676:142990, ack 0, win 501, options [nop,nop,TS val 658255165 ecr 2749718633], length 1314
04:54:04.593456 IP 52.223.224.104.1935 > 10.8.0.18.35682: Flags [.], ack 133372, win 126, options [nop,nop,TS val 2749718735 ecr 658254789], length 0
04:54:04.595170 IP 10.8.0.18.35682 > 52.223.224.104.1935: Flags [.], seq 142990:144304, ack 0, win 501, options [nop,nop,TS val 658255195 ecr 2749718735], length 1314
04:54:04.598810 IP 52.223.224.104.1935 > 10.8.0.18.35682: Flags [.], ack 133792, win 126, options [nop,nop,TS val 2749718741 ecr 658254837], length 0
04:54:04.598841 IP 10.8.0.18.35682 > 52.223.224.104.1935: Flags [P.], seq 144304:144730, ack 0, win 501, options [nop,nop,TS val 658255199 ecr 2749718741], length 426
04:54:04.659522 IP 10.8.0.18.35682 > 52.223.224.104.1935: Flags [.], seq 144730:146044, ack 0, win 501, options [nop,nop,TS val 658255260 ecr 2749718741], length 1314
04:54:04.693509 IP 52.223.224.104.1935 > 10.8.0.18.35682: Flags [.], ack 136420, win 126, options [nop,nop,TS val 2749718835 ecr 658254896], length 0
04:54:04.694523 IP 10.8.0.18.35682 > 52.223.224.104.1935: Flags [.], seq 146044:147358, ack 0, win 501, options [nop,nop,TS val 658255295 ecr 2749718835], length 1314
04:54:04.726262 IP 10.8.0.18.35682 > 52.223.224.104.1935: Flags [.], seq 147358:148672, ack 0, win 501, options [nop,nop,TS val 658255327 ecr 2749718835], length 1314
04:54:04.786959 IP 52.223.224.104.1935 > 10.8.0.18.35682: Flags [.], ack 139048, win 126, options [nop,nop,TS val 2749718929 ecr 658254964], length 0
04:54:04.787169 IP 10.8.0.18.35682 > 52.223.224.104.1935: Flags [.], seq 148672:149986, ack 0, win 501, options [nop,nop,TS val 658255387 ecr 2749718929], length 1314
04:54:04.830241 IP 10.8.0.18.35682 > 52.223.224.104.1935: Flags [.], seq 149986:151300, ack 0, win 501, options [nop,nop,TS val 658255431 ecr 2749718929], length 1314
04:54:04.857150 IP 52.223.224.104.1935 > 10.8.0.18.35682: Flags [.], ack 141676, win 126, options [nop,nop,TS val 2749718999 ecr 658255064], length 0
04:54:04.863860 IP 10.8.0.18.35682 > 52.223.224.104.1935: Flags [.], seq 151300:152614, ack 0, win 501, options [nop,nop,TS val 658255464 ecr 2749718999], length 1314
04:54:04.929766 IP 10.8.0.18.35682 > 52.223.224.104.1935: Flags [.], seq 152614:153928, ack 0, win 501, options [nop,nop,TS val 658255530 ecr 2749718999], length 1314
04:54:04.958033 IP 52.223.224.104.1935 > 10.8.0.18.35682: Flags [.], ack 144304, win 126, options [nop,nop,TS val 2749719100 ecr 658255165], length 0
04:54:04.958655 IP 10.8.0.18.35682 > 52.223.224.104.1935: Flags [.], seq 153928:155242, ack 0, win 501, options [nop,nop,TS val 658255559 ecr 2749719100], length 1314
04:54:04.961826 IP 52.223.224.104.1935 > 10.8.0.18.35682: Flags [.], ack 144730, win 126, options [nop,nop,TS val 2749719103 ecr 658255199], length 0
04:54:04.961881 IP 10.8.0.18.35682 > 52.223.224.104.1935: Flags [P.], seq 155242:155560, ack 0, win 501, options [nop,nop,TS val 658255562 ecr 2749719103], length 318
04:54:05.022653 IP 10.8.0.18.35682 > 52.223.224.104.1935: Flags [.], seq 155560:156874, ack 0, win 501, options [nop,nop,TS val 658255623 ecr 2749719103], length 1314
04:54:05.058410 IP 52.223.224.104.1935 > 10.8.0.18.35682: Flags [.], ack 147358, win 126, options [nop,nop,TS val 2749719199 ecr 658255260], length 0
04:54:05.063564 IP 10.8.0.18.35682 > 52.223.224.104.1935: Flags [.], seq 156874:158188, ack 0, win 501, options [nop,nop,TS val 658255664 ecr 2749719199], length 1314
04:54:05.095363 IP 10.8.0.18.35682 > 52.223.224.104.1935: Flags [.], seq 158188:159502, ack 0, win 501, options [nop,nop,TS val 658255696 ecr 2749719199], length 1314
04:54:05.151954 IP 52.223.224.104.1935 > 10.8.0.18.35682: Flags [.], ack 148672, win 126, options [nop,nop,TS val 2749719291 ecr 658255327], length 0
04:54:05.160279 IP 10.8.0.18.35682 > 52.223.224.104.1935: Flags [.], seq 159502:160816, ack 0, win 501, options [nop,nop,TS val 658255761 ecr 2749719291], length 1314
04:54:05.193071 IP 52.223.224.104.1935 > 10.8.0.18.35682: Flags [.], ack 151300, win 126, options [nop,nop,TS val 2749719335 ecr 658255387], length 0
04:54:05.193385 IP 10.8.0.18.35682 > 52.223.224.104.1935: Flags [.], seq 160816:162130, ack 0, win 501, options [nop,nop,TS val 658255794 ecr 2749719335], length 1314
04:54:05.230685 IP 10.8.0.18.35682 > 52.223.224.104.1935: Flags [.], seq 162130:163444, ack 0, win 501, options [nop,nop,TS val 658255831 ecr 2749719335], length 1314
04:54:05.292757 IP 52.223.224.104.1935 > 10.8.0.18.35682: Flags [.], ack 153928, win 126, options [nop,nop,TS val 2749719435 ecr 658255464], length 0
04:54:05.298141 IP 10.8.0.18.35682 > 52.223.224.104.1935: Flags [.], seq 163444:164758, ack 0, win 501, options [nop,nop,TS val 658255898 ecr 2749719435], length 1314
04:54:05.322048 IP 10.8.0.18.35682 > 52.223.224.104.1935: Flags [.], seq 164758:166072, ack 0, win 501, options [nop,nop,TS val 658255922 ecr 2749719435], length 1314
04:54:05.324791 IP 52.223.224.104.1935 > 10.8.0.18.35682: Flags [.], ack 155560, win 126, options [nop,nop,TS val 2749719466 ecr 658255559], length 0
04:54:05.324818 IP 10.8.0.18.35682 > 52.223.224.104.1935: Flags [P.], seq 166072:166501, ack 0, win 501, options [nop,nop,TS val 658255925 ecr 2749719466], length 429
04:54:05.398336 IP 10.8.0.18.35682 > 52.223.224.104.1935: Flags [.], seq 166501:167815, ack 0, win 501, options [nop,nop,TS val 658255999 ecr 2749719466], length 1314
04:54:05.428410 IP 52.223.224.104.1935 > 10.8.0.18.35682: Flags [.], ack 158188, win 126, options [nop,nop,TS val 2749719570 ecr 658255623], length 0
04:54:05.429376 IP 10.8.0.18.35682 > 52.223.224.104.1935: Flags [.], seq 167815:169129, ack 0, win 501, options [nop,nop,TS val 658256030 ecr 2749719570], length 1314
04:54:05.463632 IP 10.8.0.18.35682 > 52.223.224.104.1935: Flags [.], seq 169129:170443, ack 0, win 501, options [nop,nop,TS val 658256064 ecr 2749719570], length 1314
04:54:05.522903 IP 52.223.224.104.1935 > 10.8.0.18.35682: Flags [.], ack 160816, win 126, options [nop,nop,TS val 2749719665 ecr 658255696], length 0
04:54:05.530556 IP 10.8.0.18.35682 > 52.223.224.104.1935: Flags [.], seq 170443:171757, ack 0, win 501, options [nop,nop,TS val 658256131 ecr 2749719665], length 1314
04:54:05.557965 IP 10.8.0.18.35682 > 52.223.224.104.1935: Flags [.], seq 171757:173071, ack 0, win 501, options [nop,nop,TS val 658256158 ecr 2749719665], length 1314
04:54:05.593406 IP 52.223.224.104.1935 > 10.8.0.18.35682: Flags [.], ack 163444, win 126, options [nop,nop,TS val 2749719735 ecr 658255794], length 0
04:54:05.596576 IP 10.8.0.18.35682 > 52.223.224.104.1935: Flags [.], seq 173071:174385, ack 0, win 501, options [nop,nop,TS val 658256197 ecr 2749719735], length 1314
04:54:05.663731 IP 10.8.0.18.35682 > 52.223.224.104.1935: Flags [.], seq 174385:175699, ack 0, win 501, options [nop,nop,TS val 658256264 ecr 2749719735], length 1314
04:54:05.685017 IP 52.223.224.104.1935 > 10.8.0.18.35682: Flags [.], ack 166072, win 126, options [nop,nop,TS val 2749719827 ecr 658255898], length 0
04:54:05.688033 IP 52.223.224.104.1935 > 10.8.0.18.35682: Flags [.], ack 166501, win 126, options [nop,nop,TS val 2749719829 ecr 658255925], length 0
04:54:05.688055 IP 10.8.0.18.35682 > 52.223.224.104.1935: Flags [P.], seq 175699:176676, ack 0, win 501, options [nop,nop,TS val 658256288 ecr 2749719829], length 977
04:54:05.729464 IP 10.8.0.18.35682 > 52.223.224.104.1935: Flags [.], seq 176676:177990, ack 0, win 501, options [nop,nop,TS val 658256330 ecr 2749719829], length 1314
04:54:05.763889 IP 10.8.0.18.35682 > 52.223.224.104.1935: Flags [.], seq 177990:179304, ack 0, win 501, options [nop,nop,TS val 658256364 ecr 2749719829], length 1314
04:54:05.792484 IP 52.223.224.104.1935 > 10.8.0.18.35682: Flags [.], ack 169129, win 126, options [nop,nop,TS val 2749719934 ecr 658255999], length 0
04:54:05.815374 IP 10.8.0.18.35682 > 52.223.224.104.1935: Flags [.], seq 179304:180618, ack 0, win 501, options [nop,nop,TS val 658256416 ecr 2749719934], length 1314
04:54:05.858398 IP 10.8.0.18.35682 > 52.223.224.104.1935: Flags [.], seq 180618:181932, ack 0, win 501, options [nop,nop,TS val 658256459 ecr 2749719934], length 1314
04:54:05.893214 IP 52.223.224.104.1935 > 10.8.0.18.35682: Flags [.], ack 171757, win 126, options [nop,nop,TS val 2749720035 ecr 658256064], length 0
04:54:05.897129 IP 10.8.0.18.35682 > 52.223.224.104.1935: Flags [.], seq 181932:183246, ack 0, win 501, options [nop,nop,TS val 658256497 ecr 2749720035], length 1314
04:54:05.944313 IP 10.8.0.18.35682 > 52.223.224.104.1935: Flags [.], seq 183246:184560, ack 0, win 501, options [nop,nop,TS val 658256545 ecr 2749720035], length 1314
04:54:05.959522 IP 52.223.224.104.1935 > 10.8.0.18.35682: Flags [.], ack 174385, win 126, options [nop,nop,TS val 2749720101 ecr 658256158], length 0
04:54:05.995496 IP 10.8.0.18.35682 > 52.223.224.104.1935: Flags [.], seq 184560:185874, ack 0, win 501, options [nop,nop,TS val 658256596 ecr 2749720101], length 1314
04:54:06.029576 IP 10.8.0.18.35682 > 52.223.224.104.1935: Flags [.], seq 185874:187188, ack 0, win 501, options [nop,nop,TS val 658256630 ecr 2749720101], length 1314
04:54:06.050986 IP 52.223.224.104.1935 > 10.8.0.18.35682: Flags [.], ack 176676, win 126, options [nop,nop,TS val 2749720193 ecr 658256264], length 0
04:54:06.051023 IP 10.8.0.18.35682 > 52.223.224.104.1935: Flags [P.], seq 187188:187521, ack 0, win 501, options [nop,nop,TS val 658256651 ecr 2749720193], length 333
04:54:06.093957 IP 10.8.0.18.35682 > 52.223.224.104.1935: Flags [.], seq 187521:188835, ack 0, win 501, options [nop,nop,TS val 658256694 ecr 2749720193], length 1314
04:54:06.126941 IP 52.223.224.104.1935 > 10.8.0.18.35682: Flags [.], ack 179304, win 126, options [nop,nop,TS val 2749720269 ecr 658256330], length 0
04:54:06.128190 IP 10.8.0.18.35682 > 52.223.224.104.1935: Flags [.], seq 188835:190149, ack 0, win 501, options [nop,nop,TS val 658256729 ecr 2749720269], length 1314
04:54:06.163755 IP 10.8.0.18.35682 > 52.223.224.104.1935: Flags [.], seq 190149:191463, ack 0, win 501, options [nop,nop,TS val 658256764 ecr 2749720269], length 1314
04:54:06.221796 IP 52.223.224.104.1935 > 10.8.0.18.35682: Flags [.], ack 181932, win 126, options [nop,nop,TS val 2749720363 ecr 658256416], length 0
04:54:06.230628 IP 10.8.0.18.35682 > 52.223.224.104.1935: Flags [.], seq 191463:192777, ack 0, win 501, options [nop,nop,TS val 658256831 ecr 2749720363], length 1314
04:54:06.263729 IP 10.8.0.18.35682 > 52.223.224.104.1935: Flags [.], seq 192777:194091, ack 0, win 501, options [nop,nop,TS val 658256864 ecr 2749720363], length 1314
04:54:06.297163 IP 10.8.0.18.35682 > 52.223.224.104.1935: Flags [.], seq 194091:195405, ack 0, win 501, options [nop,nop,TS val 658256897 ecr 2749720363], length 1314
04:54:06.313952 IP 52.223.224.104.1935 > 10.8.0.18.35682: Flags [.], ack 184560, win 126, options [nop,nop,TS val 2749720449 ecr 658256497], length 0
04:54:06.362140 IP 10.8.0.18.35682 > 52.223.224.104.1935: Flags [.], seq 195405:196719, ack 0, win 501, options [nop,nop,TS val 658256962 ecr 2749720449], length 1314
04:54:06.392705 IP 52.223.224.104.1935 > 10.8.0.18.35682: Flags [.], ack 187188, win 126, options [nop,nop,TS val 2749720534 ecr 658256596], length 0
04:54:06.394541 IP 10.8.0.18.35682 > 52.223.224.104.1935: Flags [.], seq 196719:198033, ack 0, win 501, options [nop,nop,TS val 658256995 ecr 2749720534], length 1314
04:54:06.413859 IP 52.223.224.104.1935 > 10.8.0.18.35682: Flags [.], ack 187521, win 126, options [nop,nop,TS val 2749720556 ecr 658256651], length 0
04:54:06.413898 IP 10.8.0.18.35682 > 52.223.224.104.1935: Flags [P.], seq 198033:198447, ack 0, win 501, options [nop,nop,TS val 658257014 ecr 2749720556], length 414
04:54:06.463920 IP 10.8.0.18.35682 > 52.223.224.104.1935: Flags [.], seq 198447:199761, ack 0, win 501, options [nop,nop,TS val 658257064 ecr 2749720556], length 1314
04:54:06.491034 IP 52.223.224.104.1935 > 10.8.0.18.35682: Flags [.], ack 190149, win 126, options [nop,nop,TS val 2749720633 ecr 658256694], length 0
04:54:06.493992 IP 10.8.0.18.35682 > 52.223.224.104.1935: Flags [.], seq 199761:201075, ack 0, win 501, options [nop,nop,TS val 658257094 ecr 2749720633], length 1314
04:54:06.527309 IP 10.8.0.18.35682 > 52.223.224.104.1935: Flags [.], seq 201075:202389, ack 0, win 501, options [nop,nop,TS val 658257128 ecr 2749720633], length 1314
04:54:06.593368 IP 52.223.224.104.1935 > 10.8.0.18.35682: Flags [.], ack 192777, win 126, options [nop,nop,TS val 2749720735 ecr 658256764], length 0
04:54:06.595581 IP 10.8.0.18.35682 > 52.223.224.104.1935: Flags [.], seq 202389:203703, ack 0, win 501, options [nop,nop,TS val 658257196 ecr 2749720735], length 1314
04:54:06.629693 IP 10.8.0.18.35682 > 52.223.224.104.1935: Flags [.], seq 203703:205017, ack 0, win 501, options [nop,nop,TS val 658257230 ecr 2749720735], length 1314
04:54:06.663660 IP 52.223.224.104.1935 > 10.8.0.18.35682: Flags [.], ack 195405, win 126, options [nop,nop,TS val 2749720802 ecr 658256864], length 0
04:54:06.663678 IP 10.8.0.18.35682 > 52.223.224.104.1935: Flags [.], seq 205017:206331, ack 0, win 501, options [nop,nop,TS val 658257264 ecr 2749720735], length 1314
04:54:06.730623 IP 10.8.0.18.35682 > 52.223.224.104.1935: Flags [.], seq 206331:207645, ack 0, win 501, options [nop,nop,TS val 658257331 ecr 2749720802], length 1314
