03:59:26.987629 IP 10.8.2.11.42060 > 99.181.69.125.1935: Flags [.], seq 2811628119:2811629433, ack 4147982128, win 501, options [nop,nop,TS val 1148104220 ecr 3208595347], length 1314
03:59:27.002417 IP 99.181.69.125.1935 > 10.8.2.11.42060: Flags [.], ack 4294960596, win 164, options [nop,nop,TS val 3208595414 ecr 1148103917], length 0
03:59:27.025010 IP 99.181.69.125.1935 > 10.8.2.11.42060: Flags [.], ack 4294960726, win 165, options [nop,nop,TS val 3208595437 ecr 1148103975], length 0
03:59:27.025023 IP 10.8.2.11.42060 > 99.181.69.125.1935: Flags [P.], seq 1314:2296, ack 1, win 501, options [nop,nop,TS val 1148104257 ecr 3208595437], length 982
03:59:27.085336 IP 10.8.2.11.42060 > 99.181.69.125.1935: Flags [.], seq 2296:3610, ack 1, win 501, options [nop,nop,TS val 1148104318 ecr 3208595437], length 1314
03:59:27.100515 IP 99.181.69.125.1935 > 10.8.2.11.42060: Flags [.], ack 4294963354, win 165, options [nop,nop,TS val 3208595512 ecr 1148104019], length 0
03:59:27.119407 IP 10.8.2.11.42060 > 99.181.69.125.1935: Flags [.], seq 3610:4924, ack 1, win 501, options [nop,nop,TS val 1148104352 ecr 3208595512], length 1314
03:59:27.152751 IP 10.8.2.11.42060 > 99.181.69.125.1935: Flags [.], seq 4924:6238, ack 1, win 501, options [nop,nop,TS val 1148104385 ecr 3208595512], length 1314
03:59:27.200722 IP 99.181.69.125.1935 > 10.8.2.11.42060: Flags [.], ack 4294965982, win 164, options [nop,nop,TS val 3208595612 ecr 1148104092], length 0
03:59:27.202014 IP 10.8.2.11.42060 > 99.181.69.125.1935: Flags [.], seq 6238:7552, ack 1, win 501, options [nop,nop,TS val 1148104434 ecr 3208595612], length 1314
03:59:27.244416 IP 10.8.2.11.42060 > 99.181.69.125.1935: Flags [.], seq 7552:8866, ack 1, win 501, options [nop,nop,TS val 1148104477 ecr 3208595612], length 1314
03:59:27.272113 IP 99.181.69.125.1935 > 10.8.2.11.42060: Flags [.], ack 1314, win 164, options [nop,nop,TS val 3208595684 ecr 1148104184], length 0
03:59:27.286206 IP 10.8.2.11.42060 > 99.181.69.125.1935: Flags [.], seq 8866:10180, ack 1, win 501, options [nop,nop,TS val 1148104519 ecr 3208595684], length 1314
03:59:27.308581 IP 99.181.69.125.1935 > 10.8.2.11.42060: Flags [.], ack 2296, win 165, options [nop,nop,TS val 3208595720 ecr 1148104257], length 0
03:59:27.308622 IP 10.8.2.11.42060 > 99.181.69.125.1935: Flags [P.], seq 10180:10392, ack 1, win 501, options [nop,nop,TS val 1148104541 ecr 3208595720], length 212
03:59:27.351498 IP 10.8.2.11.42060 > 99.181.69.125.1935: Flags [.], seq 10392:11706, ack 1, win 501, options [nop,nop,TS val 1148104584 ecr 3208595720], length 1314
03:59:27.372923 IP 10.8.2.11.42060 > 99.181.69.125.1935: Flags [.], seq 11706:13020, ack 1, win 501, options [nop,nop,TS val 1148104605 ecr 3208595720], length 1314
03:59:27.402117 IP 99.181.69.125.1935 > 10.8.2.11.42060: Flags [.], ack 4924, win 165, options [nop,nop,TS val 3208595814 ecr 1148104318], length 0
03:59:27.419484 IP 10.8.2.11.42060 > 99.181.69.125.1935: Flags [.], seq 13020:14334, ack 1, win 501, options [nop,nop,TS val 1148104652 ecr 3208595814], length 1314
03:59:27.480045 IP 10.8.2.11.42060 > 99.181.69.125.1935: Flags [.], seq 14334:15648, ack 1, win 501, options [nop,nop,TS val 1148104712 ecr 3208595814], length 1314
03:59:27.484649 IP 99.181.69.125.1935 > 10.8.2.11.42060: Flags [.], ack 7552, win 164, options [nop,nop,TS val 3208595896 ecr 1148104385], length 0
03:59:27.501233 IP 10.8.2.11.42060 > 99.181.69.125.1935: Flags [.], seq 15648:16962, ack 1, win 501, options [nop,nop,TS val 1148104734 ecr 3208595896], length 1314
03:59:27.548680 IP 10.8.2.11.42060 > 99.181.69.125.1935: Flags [.], seq 16962:18276, ack 1, win 501, options [nop,nop,TS val 1148104781 ecr 3208595896], length 1314
03:59:27.568684 IP 99.181.69.125.1935 > 10.8.2.11.42060: Flags [.], ack 10180, win 164, options [nop,nop,TS val 3208595980 ecr 1148104477], length 0
03:59:27.590810 IP 99.181.69.125.1935 > 10.8.2.11.42060: Flags [.], ack 10392, win 165, options [nop,nop,TS val 3208596003 ecr 1148104541], length 0
03:59:27.590823 IP 10.8.2.11.42060 > 99.181.69.125.1935: Flags [P.], seq 18276:19353, ack 1, win 501, options [nop,nop,TS val 1148104823 ecr 3208596003], length 1077
03:59:27.650224 IP 10.8.2.11.42060 > 99.181.69.125.1935: Flags [.], seq 19353:20667, ack 1, win 501, options [nop,nop,TS val 1148104883 ecr 3208596003], length 1314
03:59:27.655368 IP 99.181.69.125.1935 > 10.8.2.11.42060: Flags [.], ack 13020, win 165, options [nop,nop,TS val 3208596067 ecr 1148104584], length 0
03:59:27.671649 IP 10.8.2.11.42060 > 99.181.69.125.1935: Flags [.], seq 20667:21981, ack 1, win 501, options [nop,nop,TS val 1148104904 ecr 3208596067], length 1314
03:59:27.717474 IP 10.8.2.11.42060 > 99.181.69.125.1935: Flags [.], seq 21981:23295, ack 1, win 501, options [nop,nop,TS val 1148104950 ecr 3208596067], length 1314
03:59:27.762693 IP 99.181.69.125.1935 > 10.8.2.11.42060: Flags [.], ack 15648, win 164, options [nop,nop,TS val 3208596174 ecr 1148104652], length 0
03:59:27.778330 IP 10.8.2.11.42060 > 99.181.69.125.1935: Flags [.], seq 23295:24609, ack 1, win 501, options [nop,nop,TS val 1148105011 ecr 3208596174], length 1314
03:59:27.817765 IP 10.8.2.11.42060 > 99.181.69.125.1935: Flags [.], seq 24609:25923, ack 1, win 501, options [nop,nop,TS val 1148105050 ecr 3208596174], length 1314
03:59:27.831248 IP 99.181.69.125.1935 > 10.8.2.11.42060: Flags [.], ack 18276, win 164, options [nop,nop,TS val 3208596243 ecr 1148104734], length 0
03:59:27.848820 IP 10.8.2.11.42060 > 99.181.69.125.1935: Flags [.], seq 25923:27237, ack 1, win 501, options [nop,nop,TS val 1148105081 ecr 3208596243], length 1314
03:59:27.873064 IP 99.181.69.125.1935 > 10.8.2.11.42060: Flags [.], ack 19353, win 165, options [nop,nop,TS val 3208596285 ecr 1148104823], length 0
03:59:27.873079 IP 10.8.2.11.42060 > 99.181.69.125.1935: Flags [P.], seq 27237:27363, ack 1, win 501, options [nop,nop,TS val 1148105105 ecr 3208596285], length 126
03:59:27.905925 IP 10.8.2.11.42060 > 99.181.69.125.1935: Flags [.], seq 27363:28677, ack 1, win 501, options [nop,nop,TS val 1148105138 ecr 3208596285], length 1314
03:59:27.948639 IP 10.8.2.11.42060 > 99.181.69.125.1935: Flags [.], seq 28677:29991, ack 1, win 501, options [nop,nop,TS val 1148105181 ecr 3208596285], length 1314
03:59:27.954406 IP 99.181.69.125.1935 > 10.8.2.11.42060: Flags [.], ack 21981, win 165, options [nop,nop,TS val 3208596366 ecr 1148104883], length 0
03:59:27.991043 IP 10.8.2.11.42060 > 99.181.69.125.1935: Flags [.], seq 29991:31305, ack 1, win 501, options [nop,nop,TS val 1148105223 ecr 3208596366], length 1314
03:59:28.033778 IP 10.8.2.11.42060 > 99.181.69.125.1935: Flags [.], seq 31305:32619, ack 1, win 501, options [nop,nop,TS val 1148105266 ecr 3208596366], length 1314
03:59:28.062591 IP 99.181.69.125.1935 > 10.8.2.11.42060: Flags [.], ack 24609, win 164, options [nop,nop,TS val 3208596473 ecr 1148104950], length 0
03:59:28.076856 IP 10.8.2.11.42060 > 99.181.69.125.1935: Flags [.], seq 32619:33933, ack 1, win 501, options [nop,nop,TS val 1148105309 ecr 3208596473], length 1314
03:59:28.121680 IP 10.8.2.11.42060 > 99.181.69.125.1935: Flags [.], seq 33933:35247, ack 1, win 501, options [nop,nop,TS val 1148105354 ecr 3208596473], length 1314
03:59:28.133924 IP 99.181.69.125.1935 > 10.8.2.11.42060: Flags [.], ack 27237, win 164, options [nop,nop,TS val 3208596545 ecr 1148105050], length 0
03:59:28.155640 IP 99.181.69.125.1935 > 10.8.2.11.42060: Flags [.], ack 27363, win 165, options [nop,nop,TS val 3208596567 ecr 1148105105], length 0
03:59:28.155661 IP 10.8.2.11.42060 > 99.181.69.125.1935: Flags [P.], seq 35247:36218, ack 1, win 501, options [nop,nop,TS val 1148105388 ecr 3208596567], length 971
03:59:28.205127 IP 10.8.2.11.42060 > 99.181.69.125.1935: Flags [.], seq 36218:37532, ack 1, win 501, options [nop,nop,TS val 1148105437 ecr 3208596567], length 1314
03:59:28.232338 IP 99.181.69.125.1935 > 10.8.2.11.42060: Flags [.], ack 29991, win 164, options [nop,nop,TS val 3208596644 ecr 1148105138], length 0
03:59:28.248081 IP 10.8.2.11.42060 > 99.181.69.125.1935: Flags [.], seq 37532:38846, ack 1, win 501, options [nop,nop,TS val 1148105480 ecr 3208596644], length 1314
03:59:28.286272 IP 10.8.2.11.42060 > 99.181.69.125.1935: Flags [.], seq 38846:40160, ack 1, win 501, options [nop,nop,TS val 1148105519 ecr 3208596644], length 1314
03:59:28.316093 IP 99.181.69.125.1935 > 10.8.2.11.42060: Flags [.], ack 32619, win 164, options [nop,nop,TS val 3208596728 ecr 1148105223], length 0
03:59:28.352648 IP 10.8.2.11.42060 > 99.181.69.125.1935: Flags [.], seq 40160:41474, ack 1, win 501, options [nop,nop,TS val 1148105585 ecr 3208596728], length 1314
03:59:28.376158 IP 10.8.2.11.42060 > 99.181.69.125.1935: Flags [.], seq 41474:42788, ack 1, win 501, options [nop,nop,TS val 1148105608 ecr 3208596728], length 1314
03:59:28.404339 IP 99.181.69.125.1935 > 10.8.2.11.42060: Flags [.], ack 35247, win 164, options [nop,nop,TS val 3208596816 ecr 1148105309], length 0
03:59:28.419127 IP 10.8.2.11.42060 > 99.181.69.125.1935: Flags [.], seq 42788:44102, ack 1, win 501, options [nop,nop,TS val 1148105651 ecr 3208596816], length 1314
03:59:28.437911 IP 99.181.69.125.1935 > 10.8.2.11.42060: Flags [.], ack 36218, win 165, options [nop,nop,TS val 3208596850 ecr 1148105388], length 0
03:59:28.437929 IP 10.8.2.11.42060 > 99.181.69.125.1935: Flags [P.], seq 44102:44236, ack 1, win 501, options [nop,nop,TS val 1148105670 ecr 3208596850], length 134
03:59:28.483043 IP 10.8.2.11.42060 > 99.181.69.125.1935: Flags [.], seq 44236:45550, ack 1, win 501, options [nop,nop,TS val 1148105715 ecr 3208596850], length 1314
03:59:28.504427 IP 10.8.2.11.42060 > 99.181.69.125.1935: Flags [.], seq 45550:46864, ack 1, win 501, options [nop,nop,TS val 1148105737 ecr 3208596850], length 1314
03:59:28.530564 IP 99.181.69.125.1935 > 10.8.2.11.42060: Flags [.], ack 38846, win 165, options [nop,nop,TS val 3208596942 ecr 1148105437], length 0
03:59:28.552395 IP 10.8.2.11.42060 > 99.181.69.125.1935: Flags [.], seq 46864:48178, ack 1, win 501, options [nop,nop,TS val 1148105785 ecr 3208596942], length 1314
03:59:28.611362 IP 10.8.2.11.42060 > 99.181.69.125.1935: Flags [.], seq 48178:49492, ack 1, win 501, options [nop,nop,TS val 1148105844 ecr 3208596942], length 1314
03:59:28.635169 IP 99.181.69.125.1935 > 10.8.2.11.42060: Flags [.], ack 41474, win 164, options [nop,nop,TS val 3208597047 ecr 1148105519], length 0
03:59:28.654330 IP 10.8.2.11.42060 > 99.181.69.125.1935: Flags [.], seq 49492:50806, ack 1, win 501, options [nop,nop,TS val 1148105887 ecr 3208597047], length 1314
03:59:28.685727 IP 10.8.2.11.42060 > 99.181.69.125.1935: Flags [.], seq 50806:52120, ack 1, win 501, options [nop,nop,TS val 1148105918 ecr 3208597047], length 1314
03:59:28.701720 IP 99.181.69.125.1935 > 10.8.2.11.42060: Flags [.], ack 44102, win 164, options [nop,nop,TS val 3208597113 ecr 1148105608], length 0
03:59:28.720096 IP 99.181.69.125.1935 > 10.8.2.11.42060: Flags [.], ack 44236, win 165, options [nop,nop,TS val 3208597132 ecr 1148105670], length 0
03:59:28.720122 IP 10.8.2.11.42060 > 99.181.69.125.1935: Flags [P.], seq 52120:53189, ack 1, win 501, options [nop,nop,TS val 1148105952 ecr 3208597132], length 1069
03:59:28.782702 IP 10.8.2.11.42060 > 99.181.69.125.1935: Flags [.], seq 53189:54503, ack 1, win 501, options [nop,nop,TS val 1148106015 ecr 3208597132], length 1314
03:59:28.787041 IP 99.181.69.125.1935 > 10.8.2.11.42060: Flags [.], ack 46864, win 165, options [nop,nop,TS val 3208597199 ecr 1148105715], length 0
03:59:28.803849 IP 10.8.2.11.42060 > 99.181.69.125.1935: Flags [.], seq 54503:55817, ack 1, win 501, options [nop,nop,TS val 1148106036 ecr 3208597199], length 1314
03:59:28.853514 IP 10.8.2.11.42060 > 99.181.69.125.1935: Flags [.], seq 55817:57131, ack 1, win 501, options [nop,nop,TS val 1148106086 ecr 3208597199], length 1314
03:59:28.893687 IP 99.181.69.125.1935 > 10.8.2.11.42060: Flags [.], ack 49492, win 164, options [nop,nop,TS val 3208597305 ecr 1148105785], length 0
03:59:28.910870 IP 10.8.2.11.42060 > 99.181.69.125.1935: Flags [.], seq 57131:58445, ack 1, win 501, options [nop,nop,TS val 1148106143 ecr 3208597305], length 1314
03:59:28.952009 IP 10.8.2.11.42060 > 99.181.69.125.1935: Flags [.], seq 58445:59759, ack 1, win 501, options [nop,nop,TS val 1148106184 ecr 3208597305], length 1314
03:59:28.968248 IP 99.181.69.125.1935 > 10.8.2.11.42060: Flags [.], ack 52120, win 164, options [nop,nop,TS val 3208597380 ecr 1148105887], length 0
03:59:28.983954 IP 10.8.2.11.42060 > 99.181.69.125.1935: Flags [.], seq 59759:61073, ack 1, win 501, options [nop,nop,TS val 1148106216 ecr 3208597380], length 1314
03:59:29.002701 IP 99.181.69.125.1935 > 10.8.2.11.42060: Flags [.], ack 53189, win 165, options [nop,nop,TS val 3208597414 ecr 1148105952], length 0
03:59:29.002723 IP 10.8.2.11.42060 > 99.181.69.125.1935: Flags [P.], seq 61073:61198, ack 1, win 501, options [nop,nop,TS val 1148106235 ecr 3208597414], length 125
03:59:29.038927 IP 10.8.2.11.42060 > 99.181.69.125.1935: Flags [.], seq 61198:62512, ack 1, win 501, options [nop,nop,TS val 1148106271 ecr 3208597414], length 1314
03:59:29.081513 IP 10.8.2.11.42060 > 99.181.69.125.1935: Flags [.], seq 62512:63826, ack 1, win 501, options [nop,nop,TS val 1148106314 ecr 3208597414], length 1314
03:59:29.086270 IP 99.181.69.125.1935 > 10.8.2.11.42060: Flags [.], ack 55817, win 165, options [nop,nop,TS val 3208597498 ecr 1148106015], length 0
03:59:29.124393 IP 10.8.2.11.42060 > 99.181.69.125.1935: Flags [.], seq 63826:65140, ack 1, win 501, options [nop,nop,TS val 1148106357 ecr 3208597498], length 1314
03:59:29.186445 IP 10.8.2.11.42060 > 99.181.69.125.1935: Flags [.], seq 65140:66454, ack 1, win 501, options [nop,nop,TS val 1148106419 ecr 3208597498], length 1314
03:59:29.193304 IP 99.181.69.125.1935 > 10.8.2.11.42060: Flags [.], ack 58445, win 165, options [nop,nop,TS val 3208597605 ecr 1148106086], length 0
03:59:29.210198 IP 10.8.2.11.42060 > 99.181.69.125.1935: Flags [.], seq 66454:67768, ack 1, win 501, options [nop,nop,TS val 1148106443 ecr 3208597605], length 1314
03:59:29.253051 IP 10.8.2.11.42060 > 99.181.69.125.1935: Flags [.], seq 67768:69082, ack 1, win 501, options [nop,nop,TS val 1148106485 ecr 3208597605], length 1314
03:59:29.266519 IP 99.181.69.125.1935 > 10.8.2.11.42060: Flags [.], ack 61073, win 165, options [nop,nop,TS val 3208597678 ecr 1148106184], length 0
03:59:29.284942 IP 99.181.69.125.1935 > 10.8.2.11.42060: Flags [.], ack 61198, win 165, options [nop,nop,TS val 3208597697 ecr 1148106235], length 0
03:59:29.284972 IP 10.8.2.11.42060 > 99.181.69.125.1935: Flags [P.], seq 69082:69968, ack 1, win 501, options [nop,nop,TS val 1148106517 ecr 3208597697], length 886
03:59:29.338987 IP 10.8.2.11.42060 > 99.181.69.125.1935: Flags [.], seq 69968:71282, ack 1, win 501, options [nop,nop,TS val 1148106571 ecr 3208597697], length 1314
03:59:29.365744 IP 99.181.69.125.1935 > 10.8.2.11.42060: Flags [.], ack 63826, win 165, options [nop,nop,TS val 3208597776 ecr 1148106271], length 0
03:59:29.381923 IP 10.8.2.11.42060 > 99.181.69.125.1935: Flags [.], seq 71282:72596, ack 1, win 501, options [nop,nop,TS val 1148106614 ecr 3208597776], length 1314
03:59:29.419443 IP 10.8.2.11.42060 > 99.181.69.125.1935: Flags [.], seq 72596:73910, ack 1, win 501, options [nop,nop,TS val 1148106652 ecr 3208597776], length 1314
03:59:29.469396 IP 99.181.69.125.1935 > 10.8.2.11.42060: Flags [.], ack 66454, win 164, options [nop,nop,TS val 3208597881 ecr 1148106357], length 0
03:59:29.485933 IP 10.8.2.11.42060 > 99.181.69.125.1935: Flags [.], seq 73910:75224, ack 1, win 501, options [nop,nop,TS val 1148106718 ecr 3208597881], length 1314
03:59:29.510586 IP 10.8.2.11.42060 > 99.181.69.125.1935: Flags [.], seq 75224:76538, ack 1, win 501, options [nop,nop,TS val 1148106743 ecr 3208597881], length 1314
03:59:29.535612 IP 99.181.69.125.1935 > 10.8.2.11.42060: Flags [.], ack 69082, win 164, options [nop,nop,TS val 3208597947 ecr 1148106443], length 0
03:59:29.549953 IP 10.8.2.11.42060 > 99.181.69.125.1935: Flags [.], seq 76538:77852, ack 1, win 501, options [nop,nop,TS val 1148106782 ecr 3208597947], length 1314
03:59:29.567418 IP 99.181.69.125.1935 > 10.8.2.11.42060: Flags [.], ack 69968, win 165, options [nop,nop,TS val 3208597979 ecr 1148106517], length 0
03:59:29.567430 IP 10.8.2.11.42060 > 99.181.69.125.1935: Flags [P.], seq 77852:78070, ack 1, win 501, options [nop,nop,TS val 1148106800 ecr 3208597979], length 218
03:59:29.616018 IP 10.8.2.11.42060 > 99.181.69.125.1935: Flags [.], seq 78070:79384, ack 1, win 501, options [nop,nop,TS val 1148106848 ecr 3208597979], length 1314
03:59:29.638046 IP 10.8.2.11.42060 > 99.181.69.125.1935: Flags [.], seq 79384:80698, ack 1, win 501, options [nop,nop,TS val 1148106870 ecr 3208597979], length 1314
03:59:29.664631 IP 99.181.69.125.1935 > 10.8.2.11.42060: Flags [.], ack 72596, win 165, options [nop,nop,TS val 3208598076 ecr 1148106571], length 0
03:59:29.686630 IP 10.8.2.11.42060 > 99.181.69.125.1935: Flags [.], seq 80698:82012, ack 1, win 501, options [nop,nop,TS val 1148106919 ecr 3208598076], length 1314
03:59:29.745382 IP 10.8.2.11.42060 > 99.181.69.125.1935: Flags [.], seq 82012:83326, ack 1, win 501, options [nop,nop,TS val 1148106978 ecr 3208598076], length 1314
03:59:29.768475 IP 99.181.69.125.1935 > 10.8.2.11.42060: Flags [.], ack 75224, win 164, options [nop,nop,TS val 3208598180 ecr 1148106652], length 0
03:59:29.786148 IP 10.8.2.11.42060 > 99.181.69.125.1935: Flags [.], seq 83326:84640, ack 1, win 501, options [nop,nop,TS val 1148107018 ecr 3208598180], length 1314
03:59:29.819758 IP 10.8.2.11.42060 > 99.181.69.125.1935: Flags [.], seq 84640:85954, ack 1, win 501, options [nop,nop,TS val 1148107052 ecr 3208598180], length 1314
03:59:29.832326 IP 99.181.69.125.1935 > 10.8.2.11.42060: Flags [.], ack 77852, win 164, options [nop,nop,TS val 3208598244 ecr 1148106743], length 0
03:59:29.849781 IP 99.181.69.125.1935 > 10.8.2.11.42060: Flags [.], ack 78070, win 165, options [nop,nop,TS val 3208598261 ecr 1148106800], length 0
03:59:29.849824 IP 10.8.2.11.42060 > 99.181.69.125.1935: Flags [P.], seq 85954:86080, ack 1, win 501, options [nop,nop,TS val 1148107082 ecr 3208598261], length 126
03:59:29.874342 IP 10.8.2.11.42060 > 99.181.69.125.1935: Flags [.], seq 86080:87394, ack 1, win 501, options [nop,nop,TS val 1148107107 ecr 3208598261], length 1314
03:59:29.917470 IP 10.8.2.11.42060 > 99.181.69.125.1935: Flags [.], seq 87394:88708, ack 1, win 501, options [nop,nop,TS val 1148107150 ecr 3208598261], length 1314
03:59:29.920546 IP 99.181.69.125.1935 > 10.8.2.11.42060: Flags [.], ack 80698, win 165, options [nop,nop,TS val 3208598332 ecr 1148106848], length 0
03:59:29.960349 IP 10.8.2.11.42060 > 99.181.69.125.1935: Flags [.], seq 88708:90022, ack 1, win 501, options [nop,nop,TS val 1148107193 ecr 3208598332], length 1314
03:59:30.018416 IP 10.8.2.11.42060 > 99.181.69.125.1935: Flags [.], seq 90022:91336, ack 1, win 501, options [nop,nop,TS val 1148107251 ecr 3208598332], length 1314
03:59:30.027750 IP 99.181.69.125.1935 > 10.8.2.11.42060: Flags [.], ack 83326, win 164, options [nop,nop,TS val 3208598439 ecr 1148106919], length 0
03:59:30.045822 IP 10.8.2.11.42060 > 99.181.69.125.1935: Flags [.], seq 91336:92650, ack 1, win 501, options [nop,nop,TS val 1148107278 ecr 3208598439], length 1314
03:59:30.088585 IP 10.8.2.11.42060 > 99.181.69.125.1935: Flags [.], seq 92650:93964, ack 1, win 501, options [nop,nop,TS val 1148107321 ecr 3208598439], length 1314
03:59:30.103290 IP 99.181.69.125.1935 > 10.8.2.11.42060: Flags [.], ack 85954, win 164, options [nop,nop,TS val 3208598514 ecr 1148107018], length 0
03:59:30.132137 IP 99.181.69.125.1935 > 10.8.2.11.42060: Flags [.], ack 86080, win 165, options [nop,nop,TS val 3208598544 ecr 1148107082], length 0
03:59:30.132165 IP 10.8.2.11.42060 > 99.181.69.125.1935: Flags [P.], seq 93964:95042, ack 1, win 501, options [nop,nop,TS val 1148107364 ecr 3208598544], length 1078
03:59:30.173926 IP 10.8.2.11.42060 > 99.181.69.125.1935: Flags [.], seq 95042:96356, ack 1, win 501, options [nop,nop,TS val 1148107406 ecr 3208598544], length 1314
03:59:30.200134 IP 99.181.69.125.1935 > 10.8.2.11.42060: Flags [.], ack 88708, win 164, options [nop,nop,TS val 3208598612 ecr 1148107107], length 0
03:59:30.216711 IP 10.8.2.11.42060 > 99.181.69.125.1935: Flags [.], seq 96356:97670, ack 1, win 501, options [nop,nop,TS val 1148107449 ecr 3208598612], length 1314
03:59:30.259742 IP 10.8.2.11.42060 > 99.181.69.125.1935: Flags [.], seq 97670:98984, ack 1, win 501, options [nop,nop,TS val 1148107492 ecr 3208598612], length 1314
03:59:30.300884 IP 99.181.69.125.1935 > 10.8.2.11.42060: Flags [.], ack 91336, win 164, options [nop,nop,TS val 3208598712 ecr 1148107193], length 0
03:59:30.316771 IP 10.8.2.11.42060 > 99.181.69.125.1935: Flags [.], seq 98984:100298, ack 1, win 501, options [nop,nop,TS val 1148107549 ecr 3208598712], length 1314
03:59:30.344857 IP 10.8.2.11.42060 > 99.181.69.125.1935: Flags [.], seq 100298:101612, ack 1, win 501, options [nop,nop,TS val 1148107577 ecr 3208598712], length 1314
03:59:30.370897 IP 99.181.69.125.1935 > 10.8.2.11.42060: Flags [.], ack 93964, win 164, options [nop,nop,TS val 3208598783 ecr 1148107278], length 0
03:59:30.387166 IP 10.8.2.11.42060 > 99.181.69.125.1935: Flags [.], seq 101612:102926, ack 1, win 501, options [nop,nop,TS val 1148107619 ecr 3208598783], length 1314
03:59:30.414929 IP 99.181.69.125.1935 > 10.8.2.11.42060: Flags [.], ack 95042, win 165, options [nop,nop,TS val 3208598826 ecr 1148107364], length 0
03:59:30.414955 IP 10.8.2.11.42060 > 99.181.69.125.1935: Flags [P.], seq 102926:103800, ack 1, win 501, options [nop,nop,TS val 1148107647 ecr 3208598826], length 874
03:59:30.486936 IP 10.8.2.11.42060 > 99.181.69.125.1935: Flags [.], seq 103800:105114, ack 1, win 501, options [nop,nop,TS val 1148107719 ecr 3208598826], length 1314
03:59:30.499146 IP 99.181.69.125.1935 > 10.8.2.11.42060: Flags [.], ack 97670, win 165, options [nop,nop,TS val 3208598911 ecr 1148107406], length 0
03:59:30.515131 IP 10.8.2.11.42060 > 99.181.69.125.1935: Flags [.], seq 105114:106428, ack 1, win 501, options [nop,nop,TS val 1148107747 ecr 3208598911], length 1314
03:59:30.550271 IP 10.8.2.11.42060 > 99.181.69.125.1935: Flags [.], seq 106428:107742, ack 1, win 501, options [nop,nop,TS val 1148107783 ecr 3208598911], length 1314
03:59:30.600307 IP 99.181.69.125.1935 > 10.8.2.11.42060: Flags [.], ack 100298, win 164, options [nop,nop,TS val 3208599011 ecr 1148107492], length 0
03:59:30.620302 IP 10.8.2.11.42060 > 99.181.69.125.1935: Flags [.], seq 107742:109056, ack 1, win 501, options [nop,nop,TS val 1148107853 ecr 3208599011], length 1314
03:59:30.642607 IP 10.8.2.11.42060 > 99.181.69.125.1935: Flags [.], seq 109056:110370, ack 1, win 501, options [nop,nop,TS val 1148107875 ecr 3208599011], length 1314
03:59:30.670725 IP 99.181.69.125.1935 > 10.8.2.11.42060: Flags [.], ack 102926, win 164, options [nop,nop,TS val 3208599082 ecr 1148107577], length 0
03:59:30.683482 IP 10.8.2.11.42060 > 99.181.69.125.1935: Flags [.], seq 110370:111684, ack 1, win 501, options [nop,nop,TS val 1148107916 ecr 3208599082], length 1314
03:59:30.697411 IP 99.181.69.125.1935 > 10.8.2.11.42060: Flags [.], ack 103800, win 165, options [nop,nop,TS val 3208599109 ecr 1148107647], length 0
03:59:30.697430 IP 10.8.2.11.42060 > 99.181.69.125.1935: Flags [P.], seq 111684:111908, ack 1, win 501, options [nop,nop,TS val 1148107930 ecr 3208599109], length 224
03:59:30.749392 IP 10.8.2.11.42060 > 99.181.69.125.1935: Flags [.], seq 111908:113222, ack 1, win 501, options [nop,nop,TS val 1148107982 ecr 3208599109], length 1314
03:59:30.782300 IP 10.8.2.11.42060 > 99.181.69.125.1935: Flags [.], seq 113222:114536, ack 1, win 501, options [nop,nop,TS val 1148108015 ecr 3208599109], length 1314
03:59:30.801704 IP 99.181.69.125.1935 > 10.8.2.11.42060: Flags [.], ack 106428, win 165, options [nop,nop,TS val 3208599212 ecr 1148107719], length 0
03:59:30.815865 IP 10.8.2.11.42060 > 99.181.69.125.1935: Flags [.], seq 114536:115850, ack 1, win 501, options [nop,nop,TS val 1148108048 ecr 3208599212], length 1314
03:59:30.877242 IP 10.8.2.11.42060 > 99.181.69.125.1935: Flags [.], seq 115850:117164, ack 1, win 501, options [nop,nop,TS val 1148108110 ecr 3208599212], length 1314
03:59:30.902920 IP 99.181.69.125.1935 > 10.8.2.11.42060: Flags [.], ack 109056, win 164, options [nop,nop,TS val 3208599315 ecr 1148107783], length 0
03:59:30.919760 IP 10.8.2.11.42060 > 99.181.69.125.1935: Flags [.], seq 117164:118478, ack 1, win 501, options [nop,nop,TS val 1148108152 ecr 3208599315], length 1314
03:59:30.950590 IP 10.8.2.11.42060 > 99.181.69.125.1935: Flags [.], seq 118478:119792, ack 1, win 501, options [nop,nop,TS val 1148108183 ecr 3208599315], length 1314
03:59:30.965767 IP 99.181.69.125.1935 > 10.8.2.11.42060: Flags [.], ack 111684, win 164, options [nop,nop,TS val 3208599377 ecr 1148107875], length 0
03:59:30.979758 IP 99.181.69.125.1935 > 10.8.2.11.42060: Flags [.], ack 111908, win 165, options [nop,nop,TS val 3208599391 ecr 1148107930], length 0
03:59:30.979780 IP 10.8.2.11.42060 > 99.181.69.125.1935: Flags [P.], seq 119792:119927, ack 1, win 501, options [nop,nop,TS val 1148108212 ecr 3208599391], length 135
03:59:31.019281 IP 10.8.2.11.42060 > 99.181.69.125.1935: Flags [.], seq 119927:121241, ack 1, win 501, options [nop,nop,TS val 1148108252 ecr 3208599391], length 1314
03:59:31.048249 IP 10.8.2.11.42060 > 99.181.69.125.1935: Flags [.], seq 121241:122555, ack 1, win 501, options [nop,nop,TS val 1148108281 ecr 3208599391], length 1314
03:59:31.064988 IP 99.181.69.125.1935 > 10.8.2.11.42060: Flags [.], ack 114536, win 165, options [nop,nop,TS val 3208599477 ecr 1148107982], length 0
03:59:31.091167 IP 10.8.2.11.42060 > 99.181.69.125.1935: Flags [.], seq 122555:123869, ack 1, win 501, options [nop,nop,TS val 1148108323 ecr 3208599477], length 1314
03:59:31.152462 IP 10.8.2.11.42060 > 99.181.69.125.1935: Flags [.], seq 123869:125183, ack 1, win 501, options [nop,nop,TS val 1148108385 ecr 3208599477], length 1314
03:59:31.159715 IP 99.181.69.125.1935 > 10.8.2.11.42060: Flags [.], ack 117164, win 164, options [nop,nop,TS val 3208599571 ecr 1148108048], length 0
03:59:31.176931 IP 10.8.2.11.42060 > 99.181.69.125.1935: Flags [.], seq 125183:126497, ack 1, win 501, options [nop,nop,TS val 1148108409 ecr 3208599571], length 1314
03:59:31.219829 IP 10.8.2.11.42060 > 99.181.69.125.1935: Flags [.], seq 126497:127811, ack 1, win 501, options [nop,nop,TS val 1148108452 ecr 3208599571], length 1314
03:59:31.233164 IP 99.181.69.125.1935 > 10.8.2.11.42060: Flags [.], ack 119792, win 164, options [nop,nop,TS val 3208599645 ecr 1148108152], length 0
03:59:31.261965 IP 99.181.69.125.1935 > 10.8.2.11.42060: Flags [.], ack 119927, win 165, options [nop,nop,TS val 3208599674 ecr 1148108212], length 0
03:59:31.262008 IP 10.8.2.11.42060 > 99.181.69.125.1935: Flags [P.], seq 127811:128776, ack 1, win 501, options [nop,nop,TS val 1148108494 ecr 3208599674], length 965
03:59:31.318849 IP 10.8.2.11.42060 > 99.181.69.125.1935: Flags [.], seq 128776:130090, ack 1, win 501, options [nop,nop,TS val 1148108551 ecr 3208599674], length 1314
03:59:31.330786 IP 99.181.69.125.1935 > 10.8.2.11.42060: Flags [.], ack 122555, win 165, options [nop,nop,TS val 3208599743 ecr 1148108252], length 0
03:59:31.348616 IP 10.8.2.11.42060 > 99.181.69.125.1935: Flags [.], seq 130090:131404, ack 1, win 501, options [nop,nop,TS val 1148108581 ecr 3208599743], length 1314
03:59:31.385524 IP 10.8.2.11.42060 > 99.181.69.125.1935: Flags [.], seq 131404:132718, ack 1, win 501, options [nop,nop,TS val 1148108618 ecr 3208599743], length 1314
03:59:31.434962 IP 99.181.69.125.1935 > 10.8.2.11.42060: Flags [.], ack 125183, win 164, options [nop,nop,TS val 3208599847 ecr 1148108323], length 0
03:59:31.451131 IP 10.8.2.11.42060 > 99.181.69.125.1935: Flags [.], seq 132718:134032, ack 1, win 501, options [nop,nop,TS val 1148108683 ecr 3208599847], length 1314
03:59:31.476835 IP 10.8.2.11.42060 > 99.181.69.125.1935: Flags [.], seq 134032:135346, ack 1, win 501, options [nop,nop,TS val 1148108709 ecr 3208599847], length 1314
03:59:31.502408 IP 99.181.69.125.1935 > 10.8.2.11.42060: Flags [.], ack 127811, win 164, options [nop,nop,TS val 3208599914 ecr 1148108409], length 0
03:59:31.519718 IP 10.8.2.11.42060 > 99.181.69.125.1935: Flags [.], seq 135346:136660, ack 1, win 501, options [nop,nop,TS val 1148108752 ecr 3208599914], length 1314
03:59:31.544501 IP 99.181.69.125.1935 > 10.8.2.11.42060: Flags [.], ack 128776, win 165, options [nop,nop,TS val 3208599956 ecr 1148108494], length 0
03:59:31.544526 IP 10.8.2.11.42060 > 99.181.69.125.1935: Flags [P.], seq 136660:136886, ack 1, win 501, options [nop,nop,TS val 1148108777 ecr 3208599956], length 226
03:59:31.582397 IP 10.8.2.11.42060 > 99.181.69.125.1935: Flags [.], seq 136886:138200, ack 1, win 501, options [nop,nop,TS val 1148108815 ecr 3208599956], length 1314
03:59:31.615605 IP 10.8.2.11.42060 > 99.181.69.125.1935: Flags [.], seq 138200:139514, ack 1, win 501, options [nop,nop,TS val 1148108848 ecr 3208599956], length 1314
03:59:31.630935 IP 99.181.69.125.1935 > 10.8.2.11.42060: Flags [.], ack 131404, win 165, options [nop,nop,TS val 3208600043 ecr 1148108551], length 0
03:59:31.668597 IP 10.8.2.11.42060 > 99.181.69.125.1935: Flags [.], seq 139514:140828, ack 1, win 501, options [nop,nop,TS val 1148108901 ecr 3208600043], length 1314
03:59:31.711232 IP 10.8.2.11.42060 > 99.181.69.125.1935: Flags [.], seq 140828:142142, ack 1, win 501, options [nop,nop,TS val 1148108944 ecr 3208600043], length 1314
03:59:31.734753 IP 99.181.69.125.1935 > 10.8.2.11.42060: Flags [.], ack 134032, win 164, options [nop,nop,TS val 3208600146 ecr 1148108618], length 0
03:59:31.750062 IP 10.8.2.11.42060 > 99.181.69.125.1935: Flags [.], seq 142142:143456, ack 1, win 501, options [nop,nop,TS val 1148108982 ecr 3208600146], length 1314
03:59:31.796712 IP 10.8.2.11.42060 > 99.181.69.125.1935: Flags [.], seq 143456:144770, ack 1, win 501, options [nop,nop,TS val 1148109029 ecr 3208600146], length 1314
03:59:31.802310 IP 99.181.69.125.1935 > 10.8.2.11.42060: Flags [.], ack 136660, win 164, options [nop,nop,TS val 3208600214 ecr 1148108709], length 0
03:59:31.826756 IP 99.181.69.125.1935 > 10.8.2.11.42060: Flags [.], ack 136886, win 165, options [nop,nop,TS val 3208600238 ecr 1148108777], length 0
03:59:31.826802 IP 10.8.2.11.42060 > 99.181.69.125.1935: Flags [P.], seq 144770:145751, ack 1, win 501, options [nop,nop,TS val 1148109059 ecr 3208600238], length 981
03:59:31.882418 IP 10.8.2.11.42060 > 99.181.69.125.1935: Flags [.], seq 145751:147065, ack 1, win 501, options [nop,nop,TS val 1148109115 ecr 3208600238], length 1314
03:59:31.897938 IP 99.181.69.125.1935 > 10.8.2.11.42060: Flags [.], ack 139514, win 165, options [nop,nop,TS val 3208600310 ecr 1148108815], length 0
03:59:31.916971 IP 10.8.2.11.42060 > 99.181.69.125.1935: Flags [.], seq 147065:148379, ack 1, win 501, options [nop,nop,TS val 1148109149 ecr 3208600310], length 1314
03:59:31.953026 IP 10.8.2.11.42060 > 99.181.69.125.1935: Flags [.], seq 148379:149693, ack 1, win 501, options [nop,nop,TS val 1148109185 ecr 3208600310], length 1314
03:59:31.993817 IP 99.181.69.125.1935 > 10.8.2.11.42060: Flags [.], ack 142142, win 165, options [nop,nop,TS val 3208600405 ecr 1148108901], length 0
03:59:32.011098 IP 10.8.2.11.42060 > 99.181.69.125.1935: Flags [.], seq 149693:151007, ack 1, win 501, options [nop,nop,TS val 1148109243 ecr 3208600405], length 1314
03:59:32.053104 IP 10.8.2.11.42060 > 99.181.69.125.1935: Flags [.], seq 151007:152321, ack 1, win 501, options [nop,nop,TS val 1148109285 ecr 3208600405], length 1314
03:59:32.079385 IP 99.181.69.125.1935 > 10.8.2.11.42060: Flags [.], ack 144770, win 165, options [nop,nop,TS val 3208600491 ecr 1148108982], length 0
03:59:32.083867 IP 10.8.2.11.42060 > 99.181.69.125.1935: Flags [.], seq 152321:153635, ack 1, win 501, options [nop,nop,TS val 1148109316 ecr 3208600491], length 1314
03:59:32.149595 IP 10.8.2.11.42060 > 99.181.69.125.1935: Flags [.], seq 153635:154949, ack 1, win 501, options [nop,nop,TS val 1148109382 ecr 3208600491], length 1314
03:59:32.181715 IP 10.8.2.11.42060 > 99.181.69.125.1935: Flags [.], seq 154949:156263, ack 1, win 501, options [nop,nop,TS val 1148109414 ecr 3208600491], length 1314
03:59:32.202031 IP 99.181.69.125.1935 > 10.8.2.11.42060: Flags [.], ack 148379, win 165, options [nop,nop,TS val 3208600612 ecr 1148109115], length 0
03:59:32.202073 IP 10.8.2.11.42060 > 99.181.69.125.1935: Flags [P.], seq 156263:156677, ack 1, win 501, options [nop,nop,TS val 1148109434 ecr 3208600612], length 414
03:59:32.246024 IP 10.8.2.11.42060 > 99.181.69.125.1935: Flags [.], seq 156677:157991, ack 1, win 501, options [nop,nop,TS val 1148109478 ecr 3208600612], length 1314
03:59:32.283647 IP 10.8.2.11.42060 > 99.181.69.125.1935: Flags [.], seq 157991:159305, ack 1, win 501, options [nop,nop,TS val 1148109516 ecr 3208600612], length 1314
03:59:32.293794 IP 99.181.69.125.1935 > 10.8.2.11.42060: Flags [.], ack 151007, win 164, options [nop,nop,TS val 3208600705 ecr 1148109185], length 0
03:59:32.319581 IP 10.8.2.11.42060 > 99.181.69.125.1935: Flags [.], seq 159305:160619, ack 1, win 501, options [nop,nop,TS val 1148109552 ecr 3208600705], length 1314
03:59:32.367526 IP 99.181.69.125.1935 > 10.8.2.11.42060: Flags [.], ack 153635, win 164, options [nop,nop,TS val 3208600778 ecr 1148109285], length 0
03:59:32.386380 IP 10.8.2.11.42060 > 99.181.69.125.1935: Flags [.], seq 160619:161933, ack 1, win 501, options [nop,nop,TS val 1148109619 ecr 3208600778], length 1314
03:59:32.416715 IP 10.8.2.11.42060 > 99.181.69.125.1935: Flags [.], seq 161933:163247, ack 1, win 501, options [nop,nop,TS val 1148109649 ecr 3208600778], length 1314
03:59:32.451149 IP 10.8.2.11.42060 > 99.181.69.125.1935: Flags [.], seq 163247:164561, ack 1, win 501, options [nop,nop,TS val 1148109683 ecr 3208600778], length 1314
03:59:32.464188 IP 99.181.69.125.1935 > 10.8.2.11.42060: Flags [.], ack 156263, win 164, options [nop,nop,TS val 3208600876 ecr 1148109382], length 0
03:59:32.484942 IP 99.181.69.125.1935 > 10.8.2.11.42060: Flags [.], ack 156677, win 165, options [nop,nop,TS val 3208600897 ecr 1148109434], length 0
03:59:32.485001 IP 10.8.2.11.42060 > 99.181.69.125.1935: Flags [P.], seq 164561:165542, ack 1, win 501, options [nop,nop,TS val 1148109717 ecr 3208600897], length 981
03:59:32.544959 IP 10.8.2.11.42060 > 99.181.69.125.1935: Flags [.], seq 165542:166856, ack 1, win 501, options [nop,nop,TS val 1148109777 ecr 3208600897], length 1314
03:59:32.566177 IP 99.181.69.125.1935 > 10.8.2.11.42060: Flags [.], ack 159305, win 165, options [nop,nop,TS val 3208600978 ecr 1148109478], length 0
03:59:32.584141 IP 10.8.2.11.42060 > 99.181.69.125.1935: Flags [.], seq 166856:168170, ack 1, win 501, options [nop,nop,TS val 1148109816 ecr 3208600978], length 1314
03:59:32.619610 IP 10.8.2.11.42060 > 99.181.69.125.1935: Flags [.], seq 168170:169484, ack 1, win 501, options [nop,nop,TS val 1148109852 ecr 3208600978], length 1314
03:59:32.669216 IP 99.181.69.125.1935 > 10.8.2.11.42060: Flags [.], ack 161933, win 164, options [nop,nop,TS val 3208601081 ecr 1148109552], length 0
03:59:32.686236 IP 10.8.2.11.42060 > 99.181.69.125.1935: Flags [.], seq 169484:170798, ack 1, win 501, options [nop,nop,TS val 1148109919 ecr 3208601081], length 1314
03:59:32.716529 IP 10.8.2.11.42060 > 99.181.69.125.1935: Flags [.], seq 170798:172112, ack 1, win 501, options [nop,nop,TS val 1148109949 ecr 3208601081], length 1314
03:59:32.733826 IP 99.181.69.125.1935 > 10.8.2.11.42060: Flags [.], ack 164561, win 164, options [nop,nop,TS val 3208601145 ecr 1148109649], length 0
03:59:32.753151 IP 10.8.2.11.42060 > 99.181.69.125.1935: Flags [.], seq 172112:173426, ack 1, win 501, options [nop,nop,TS val 1148109985 ecr 3208601145], length 1314
03:59:32.767571 IP 99.181.69.125.1935 > 10.8.2.11.42060: Flags [.], ack 165542, win 165, options [nop,nop,TS val 3208601179 ecr 1148109717], length 0
03:59:32.767608 IP 10.8.2.11.42060 > 99.181.69.125.1935: Flags [P.], seq 173426:173644, ack 1, win 501, options [nop,nop,TS val 1148110000 ecr 3208601179], length 218
03:59:32.818343 IP 10.8.2.11.42060 > 99.181.69.125.1935: Flags [.], seq 173644:174958, ack 1, win 501, options [nop,nop,TS val 1148110051 ecr 3208601179], length 1314
03:59:32.845084 IP 10.8.2.11.42060 > 99.181.69.125.1935: Flags [.], seq 174958:176272, ack 1, win 501, options [nop,nop,TS val 1148110077 ecr 3208601179], length 1314
03:59:32.867088 IP 99.181.69.125.1935 > 10.8.2.11.42060: Flags [.], ack 168170, win 165, options [nop,nop,TS val 3208601279 ecr 1148109777], length 0
03:59:32.887944 IP 10.8.2.11.42060 > 99.181.69.125.1935: Flags [.], seq 176272:177586, ack 1, win 501, options [nop,nop,TS val 1148110120 ecr 3208601279], length 1314
03:59:32.951446 IP 10.8.2.11.42060 > 99.181.69.125.1935: Flags [.], seq 177586:178900, ack 1, win 501, options [nop,nop,TS val 1148110184 ecr 3208601279], length 1314
03:59:32.968989 IP 99.181.69.125.1935 > 10.8.2.11.42060: Flags [.], ack 170798, win 164, options [nop,nop,TS val 3208601381 ecr 1148109852], length 0
03:59:32.984288 IP 10.8.2.11.42060 > 99.181.69.125.1935: Flags [.], seq 178900:180214, ack 1, win 501, options [nop,nop,TS val 1148110217 ecr 3208601381], length 1314
03:59:33.021518 IP 10.8.2.11.42060 > 99.181.69.125.1935: Flags [.], seq 180214:181528, ack 1, win 501, options [nop,nop,TS val 1148110254 ecr 3208601381], length 1314
03:59:33.035746 IP 99.181.69.125.1935 > 10.8.2.11.42060: Flags [.], ack 173426, win 164, options [nop,nop,TS val 3208601447 ecr 1148109949], length 0
03:59:33.050026 IP 99.181.69.125.1935 > 10.8.2.11.42060: Flags [.], ack 173644, win 165, options [nop,nop,TS val 3208601462 ecr 1148110000], length 0
03:59:33.050098 IP 10.8.2.11.42060 > 99.181.69.125.1935: Flags [P.], seq 181528:181654, ack 1, win 501, options [nop,nop,TS val 1148110282 ecr 3208601462], length 126
03:59:33.080918 IP 10.8.2.11.42060 > 99.181.69.125.1935: Flags [.], seq 181654:182968, ack 1, win 501, options [nop,nop,TS val 1148110313 ecr 3208601462], length 1314
03:59:33.119713 IP 10.8.2.11.42060 > 99.181.69.125.1935: Flags [.], seq 182968:184282, ack 1, win 501, options [nop,nop,TS val 1148110352 ecr 3208601462], length 1314
03:59:33.127616 IP 99.181.69.125.1935 > 10.8.2.11.42060: Flags [.], ack 176272, win 165, options [nop,nop,TS val 3208601539 ecr 1148110051], length 0
03:59:33.166927 IP 10.8.2.11.42060 > 99.181.69.125.1935: Flags [.], seq 184282:185596, ack 1, win 501, options [nop,nop,TS val 1148110399 ecr 3208601539], length 1314
03:59:33.219551 IP 10.8.2.11.42060 > 99.181.69.125.1935: Flags [.], seq 185596:186910, ack 1, win 501, options [nop,nop,TS val 1148110452 ecr 3208601539], length 1314
03:59:33.235582 IP 99.181.69.125.1935 > 10.8.2.11.42060: Flags [.], ack 178900, win 164, options [nop,nop,TS val 3208601647 ecr 1148110120], length 0
03:59:33.252920 IP 10.8.2.11.42060 > 99.181.69.125.1935: Flags [.], seq 186910:188224, ack 1, win 501, options [nop,nop,TS val 1148110485 ecr 3208601647], length 1314
03:59:33.295924 IP 10.8.2.11.42060 > 99.181.69.125.1935: Flags [.], seq 188224:189538, ack 1, win 501, options [nop,nop,TS val 1148110528 ecr 3208601647], length 1314
03:59:33.303970 IP 99.181.69.125.1935 > 10.8.2.11.42060: Flags [.], ack 181528, win 164, options [nop,nop,TS val 3208601716 ecr 1148110217], length 0
03:59:33.332418 IP 99.181.69.125.1935 > 10.8.2.11.42060: Flags [.], ack 181654, win 165, options [nop,nop,TS val 3208601744 ecr 1148110282], length 0
03:59:33.332457 IP 10.8.2.11.42060 > 99.181.69.125.1935: Flags [P.], seq 189538:190519, ack 1, win 501, options [nop,nop,TS val 1148110565 ecr 3208601744], length 981
03:59:33.381875 IP 10.8.2.11.42060 > 99.181.69.125.1935: Flags [.], seq 190519:191833, ack 1, win 501, options [nop,nop,TS val 1148110614 ecr 3208601744], length 1314
