02:34:25.448065 IP 10.8.0.5.34486 > 52.223.217.245.1935: Flags [.], seq 3163755645:3163756959, ack 2686853121, win 501, options [nop,nop,TS val 208622904 ecr 524951191], length 1314
02:34:25.449300 IP 52.223.217.245.1935 > 10.8.0.5.34486: Flags [.], ack 4294955696, win 126, options [nop,nop,TS val 524951290 ecr 208622434], length 0
02:34:25.477586 IP 10.8.0.5.34486 > 52.223.217.245.1935: Flags [.], seq 1314:2628, ack 1, win 501, options [nop,nop,TS val 208622933 ecr 524951290], length 1314
02:34:25.546535 IP 52.223.217.245.1935 > 10.8.0.5.34486: Flags [.], ack 4294958324, win 126, options [nop,nop,TS val 524951388 ecr 208622505], length 0
02:34:25.547257 IP 10.8.0.5.34486 > 52.223.217.245.1935: Flags [.], seq 2628:3942, ack 1, win 501, options [nop,nop,TS val 208623003 ecr 524951388], length 1314
02:34:25.582223 IP 10.8.0.5.34486 > 52.223.217.245.1935: Flags [.], seq 3942:5256, ack 1, win 501, options [nop,nop,TS val 208623038 ecr 524951388], length 1314
02:34:25.615886 IP 10.8.0.5.34486 > 52.223.217.245.1935: Flags [.], seq 5256:6570, ack 1, win 501, options [nop,nop,TS val 208623072 ecr 524951388], length 1314
02:34:25.615934 IP 52.223.217.245.1935 > 10.8.0.5.34486: Flags [.], ack 4294960952, win 126, options [nop,nop,TS val 524951457 ecr 208622605], length 0
02:34:25.679083 IP 10.8.0.5.34486 > 52.223.217.245.1935: Flags [.], seq 6570:7884, ack 1, win 501, options [nop,nop,TS val 208623135 ecr 524951457], length 1314
02:34:25.711573 IP 52.223.217.245.1935 > 10.8.0.5.34486: Flags [.], ack 4294963580, win 126, options [nop,nop,TS val 524951553 ecr 208622702], length 0
02:34:25.715932 IP 10.8.0.5.34486 > 52.223.217.245.1935: Flags [.], seq 7884:9198, ack 1, win 501, options [nop,nop,TS val 208623172 ecr 524951553], length 1314
02:34:25.748580 IP 10.8.0.5.34486 > 52.223.217.245.1935: Flags [.], seq 9198:10512, ack 1, win 501, options [nop,nop,TS val 208623204 ecr 524951553], length 1314
02:34:25.783188 IP 52.223.217.245.1935 > 10.8.0.5.34486: Flags [.], ack 4294965982, win 126, options [nop,nop,TS val 524951624 ecr 208622772], length 0
02:34:25.783226 IP 10.8.0.5.34486 > 52.223.217.245.1935: Flags [P.], seq 10512:11593, ack 1, win 501, options [nop,nop,TS val 208623239 ecr 524951624], length 1081
02:34:25.848995 IP 10.8.0.5.34486 > 52.223.217.245.1935: Flags [.], seq 11593:12907, ack 1, win 501, options [nop,nop,TS val 208623305 ecr 524951624], length 1314
02:34:25.881753 IP 52.223.217.245.1935 > 10.8.0.5.34486: Flags [.], ack 1314, win 126, options [nop,nop,TS val 524951723 ecr 208622869], length 0
02:34:25.882141 IP 10.8.0.5.34486 > 52.223.217.245.1935: Flags [.], seq 12907:14221, ack 1, win 501, options [nop,nop,TS val 208623338 ecr 524951723], length 1314
02:34:25.912880 IP 10.8.0.5.34486 > 52.223.217.245.1935: Flags [.], seq 14221:15535, ack 1, win 501, options [nop,nop,TS val 208623369 ecr 524951723], length 1314
02:34:25.979531 IP 10.8.0.5.34486 > 52.223.217.245.1935: Flags [.], seq 15535:16849, ack 1, win 501, options [nop,nop,TS val 208623435 ecr 524951723], length 1314
02:34:25.980924 IP 52.223.217.245.1935 > 10.8.0.5.34486: Flags [.], ack 3942, win 126, options [nop,nop,TS val 524951822 ecr 208622933], length 0
02:34:26.011911 IP 10.8.0.5.34486 > 52.223.217.245.1935: Flags [.], seq 16849:18163, ack 1, win 501, options [nop,nop,TS val 208623468 ecr 524951822], length 1314
02:34:26.045762 IP 10.8.0.5.34486 > 52.223.217.245.1935: Flags [.], seq 18163:19477, ack 1, win 501, options [nop,nop,TS val 208623501 ecr 524951822], length 1314
02:34:26.049075 IP 52.223.217.245.1935 > 10.8.0.5.34486: Flags [.], ack 6570, win 126, options [nop,nop,TS val 524951890 ecr 208623038], length 0
02:34:26.114701 IP 10.8.0.5.34486 > 52.223.217.245.1935: Flags [.], seq 19477:20791, ack 1, win 501, options [nop,nop,TS val 208623570 ecr 524951890], length 1314
02:34:26.146953 IP 10.8.0.5.34486 > 52.223.217.245.1935: Flags [.], seq 20791:22105, ack 1, win 501, options [nop,nop,TS val 208623603 ecr 524951890], length 1314
02:34:26.149190 IP 52.223.217.245.1935 > 10.8.0.5.34486: Flags [.], ack 9198, win 126, options [nop,nop,TS val 524951990 ecr 208623135], length 0
02:34:26.178248 IP 10.8.0.5.34486 > 52.223.217.245.1935: Flags [.], seq 22105:23419, ack 1, win 501, options [nop,nop,TS val 208623634 ecr 524951990], length 1314
02:34:26.217755 IP 52.223.217.245.1935 > 10.8.0.5.34486: Flags [.], ack 11593, win 126, options [nop,nop,TS val 524952058 ecr 208623204], length 0
02:34:26.217792 IP 10.8.0.5.34486 > 52.223.217.245.1935: Flags [P.], seq 23419:24606, ack 1, win 501, options [nop,nop,TS val 208623673 ecr 524952058], length 1187
02:34:26.281504 IP 10.8.0.5.34486 > 52.223.217.245.1935: Flags [.], seq 24606:25920, ack 1, win 501, options [nop,nop,TS val 208623737 ecr 524952058], length 1314
02:34:26.314071 IP 10.8.0.5.34486 > 52.223.217.245.1935: Flags [.], seq 25920:27234, ack 1, win 501, options [nop,nop,TS val 208623770 ecr 524952058], length 1314
02:34:26.315501 IP 52.223.217.245.1935 > 10.8.0.5.34486: Flags [.], ack 14221, win 126, options [nop,nop,TS val 524952157 ecr 208623305], length 0
02:34:26.348898 IP 10.8.0.5.34486 > 52.223.217.245.1935: Flags [.], seq 27234:28548, ack 1, win 501, options [nop,nop,TS val 208623805 ecr 524952157], length 1314
02:34:26.413115 IP 52.223.217.245.1935 > 10.8.0.5.34486: Flags [.], ack 16849, win 126, options [nop,nop,TS val 524952254 ecr 208623369], length 0
02:34:26.415481 IP 10.8.0.5.34486 > 52.223.217.245.1935: Flags [.], seq 28548:29862, ack 1, win 501, options [nop,nop,TS val 208623871 ecr 524952254], length 1314
02:34:26.447452 IP 10.8.0.5.34486 > 52.223.217.245.1935: Flags [.], seq 29862:31176, ack 1, win 501, options [nop,nop,TS val 208623903 ecr 524952254], length 1314
02:34:26.479259 IP 52.223.217.245.1935 > 10.8.0.5.34486: Flags [.], ack 19477, win 126, options [nop,nop,TS val 524952320 ecr 208623468], length 0
02:34:26.481548 IP 10.8.0.5.34486 > 52.223.217.245.1935: Flags [.], seq 31176:32490, ack 1, win 501, options [nop,nop,TS val 208623937 ecr 524952320], length 1314
02:34:26.548040 IP 10.8.0.5.34486 > 52.223.217.245.1935: Flags [.], seq 32490:33804, ack 1, win 501, options [nop,nop,TS val 208624004 ecr 524952320], length 1314
02:34:26.580224 IP 52.223.217.245.1935 > 10.8.0.5.34486: Flags [.], ack 22105, win 126, options [nop,nop,TS val 524952421 ecr 208623570], length 0
02:34:26.581423 IP 10.8.0.5.34486 > 52.223.217.245.1935: Flags [.], seq 33804:35118, ack 1, win 501, options [nop,nop,TS val 208624037 ecr 524952421], length 1314
02:34:26.615307 IP 10.8.0.5.34486 > 52.223.217.245.1935: Flags [.], seq 35118:36432, ack 1, win 501, options [nop,nop,TS val 208624071 ecr 524952421], length 1314
02:34:26.651736 IP 52.223.217.245.1935 > 10.8.0.5.34486: Flags [.], ack 24606, win 126, options [nop,nop,TS val 524952493 ecr 208623634], length 0
02:34:26.651778 IP 10.8.0.5.34486 > 52.223.217.245.1935: Flags [P.], seq 36432:37512, ack 1, win 501, options [nop,nop,TS val 208624107 ecr 524952493], length 1080
02:34:26.715851 IP 10.8.0.5.34486 > 52.223.217.245.1935: Flags [.], seq 37512:38826, ack 1, win 501, options [nop,nop,TS val 208624172 ecr 524952493], length 1314
02:34:26.747612 IP 52.223.217.245.1935 > 10.8.0.5.34486: Flags [.], ack 27234, win 126, options [nop,nop,TS val 524952589 ecr 208623737], length 0
02:34:26.748871 IP 10.8.0.5.34486 > 52.223.217.245.1935: Flags [.], seq 38826:40140, ack 1, win 501, options [nop,nop,TS val 208624205 ecr 524952589], length 1314
02:34:26.782309 IP 10.8.0.5.34486 > 52.223.217.245.1935: Flags [.], seq 40140:41454, ack 1, win 501, options [nop,nop,TS val 208624238 ecr 524952589], length 1314
02:34:26.847894 IP 10.8.0.5.34486 > 52.223.217.245.1935: Flags [.], seq 41454:42768, ack 1, win 501, options [nop,nop,TS val 208624304 ecr 524952589], length 1314
02:34:26.848894 IP 52.223.217.245.1935 > 10.8.0.5.34486: Flags [.], ack 29862, win 126, options [nop,nop,TS val 524952690 ecr 208623805], length 0
02:34:26.881093 IP 10.8.0.5.34486 > 52.223.217.245.1935: Flags [.], seq 42768:44082, ack 1, win 501, options [nop,nop,TS val 208624337 ecr 524952690], length 1314
02:34:26.914741 IP 10.8.0.5.34486 > 52.223.217.245.1935: Flags [.], seq 44082:45396, ack 1, win 501, options [nop,nop,TS val 208624370 ecr 524952690], length 1314
02:34:26.916464 IP 52.223.217.245.1935 > 10.8.0.5.34486: Flags [.], ack 32490, win 126, options [nop,nop,TS val 524952756 ecr 208623903], length 0
02:34:26.980708 IP 10.8.0.5.34486 > 52.223.217.245.1935: Flags [.], seq 45396:46710, ack 1, win 501, options [nop,nop,TS val 208624436 ecr 524952756], length 1314
02:34:27.014528 IP 10.8.0.5.34486 > 52.223.217.245.1935: Flags [.], seq 46710:48024, ack 1, win 501, options [nop,nop,TS val 208624470 ecr 524952756], length 1314
02:34:27.014700 IP 52.223.217.245.1935 > 10.8.0.5.34486: Flags [.], ack 35118, win 126, options [nop,nop,TS val 524952856 ecr 208624004], length 0
02:34:27.048535 IP 10.8.0.5.34486 > 52.223.217.245.1935: Flags [.], seq 48024:49338, ack 1, win 501, options [nop,nop,TS val 208624504 ecr 524952856], length 1314
02:34:27.085169 IP 52.223.217.245.1935 > 10.8.0.5.34486: Flags [.], ack 37512, win 126, options [nop,nop,TS val 524952926 ecr 208624071], length 0
02:34:27.085218 IP 10.8.0.5.34486 > 52.223.217.245.1935: Flags [P.], seq 49338:50435, ack 1, win 501, options [nop,nop,TS val 208624541 ecr 524952926], length 1097
02:34:27.148834 IP 10.8.0.5.34486 > 52.223.217.245.1935: Flags [.], seq 50435:51749, ack 1, win 501, options [nop,nop,TS val 208624605 ecr 524952926], length 1314
02:34:27.182296 IP 52.223.217.245.1935 > 10.8.0.5.34486: Flags [.], ack 40140, win 126, options [nop,nop,TS val 524953024 ecr 208624172], length 0
02:34:27.182566 IP 10.8.0.5.34486 > 52.223.217.245.1935: Flags [.], seq 51749:53063, ack 1, win 501, options [nop,nop,TS val 208624638 ecr 524953024], length 1314
02:34:27.216251 IP 10.8.0.5.34486 > 52.223.217.245.1935: Flags [.], seq 53063:54377, ack 1, win 501, options [nop,nop,TS val 208624672 ecr 524953024], length 1314
02:34:27.281356 IP 52.223.217.245.1935 > 10.8.0.5.34486: Flags [.], ack 42768, win 126, options [nop,nop,TS val 524953122 ecr 208624238], length 0
02:34:27.281423 IP 10.8.0.5.34486 > 52.223.217.245.1935: Flags [.], seq 54377:55691, ack 1, win 501, options [nop,nop,TS val 208624737 ecr 524953122], length 1314
02:34:27.314724 IP 10.8.0.5.34486 > 52.223.217.245.1935: Flags [.], seq 55691:57005, ack 1, win 501, options [nop,nop,TS val 208624770 ecr 524953122], length 1314
02:34:27.345073 IP 10.8.0.5.34486 > 52.223.217.245.1935: Flags [.], seq 57005:58319, ack 1, win 501, options [nop,nop,TS val 208624801 ecr 524953122], length 1314
02:34:27.349252 IP 52.223.217.245.1935 > 10.8.0.5.34486: Flags [.], ack 45396, win 126, options [nop,nop,TS val 524953190 ecr 208624337], length 0
02:34:27.414848 IP 10.8.0.5.34486 > 52.223.217.245.1935: Flags [.], seq 58319:59633, ack 1, win 501, options [nop,nop,TS val 208624871 ecr 524953190], length 1314
02:34:27.447784 IP 52.223.217.245.1935 > 10.8.0.5.34486: Flags [.], ack 48024, win 126, options [nop,nop,TS val 524953289 ecr 208624436], length 0
02:34:27.448922 IP 10.8.0.5.34486 > 52.223.217.245.1935: Flags [.], seq 59633:60947, ack 1, win 501, options [nop,nop,TS val 208624905 ecr 524953289], length 1314
02:34:27.480445 IP 10.8.0.5.34486 > 52.223.217.245.1935: Flags [.], seq 60947:62261, ack 1, win 501, options [nop,nop,TS val 208624936 ecr 524953289], length 1314
02:34:27.518750 IP 52.223.217.245.1935 > 10.8.0.5.34486: Flags [.], ack 50435, win 126, options [nop,nop,TS val 524953360 ecr 208624504], length 0
02:34:27.518776 IP 10.8.0.5.34486 > 52.223.217.245.1935: Flags [P.], seq 62261:63337, ack 1, win 501, options [nop,nop,TS val 208624974 ecr 524953360], length 1076
02:34:27.581962 IP 10.8.0.5.34486 > 52.223.217.245.1935: Flags [.], seq 63337:64651, ack 1, win 501, options [nop,nop,TS val 208625038 ecr 524953360], length 1314
02:34:27.615527 IP 10.8.0.5.34486 > 52.223.217.245.1935: Flags [.], seq 64651:65965, ack 1, win 501, options [nop,nop,TS val 208625071 ecr 524953360], length 1314
02:34:27.615800 IP 52.223.217.245.1935 > 10.8.0.5.34486: Flags [.], ack 53063, win 126, options [nop,nop,TS val 524953457 ecr 208624605], length 0
02:34:27.647261 IP 10.8.0.5.34486 > 52.223.217.245.1935: Flags [.], seq 65965:67279, ack 1, win 501, options [nop,nop,TS val 208625103 ecr 524953457], length 1314
02:34:27.714794 IP 52.223.217.245.1935 > 10.8.0.5.34486: Flags [.], ack 55691, win 126, options [nop,nop,TS val 524953556 ecr 208624672], length 0
02:34:27.715186 IP 10.8.0.5.34486 > 52.223.217.245.1935: Flags [.], seq 67279:68593, ack 1, win 501, options [nop,nop,TS val 208625171 ecr 524953556], length 1314
02:34:27.745060 IP 10.8.0.5.34486 > 52.223.217.245.1935: Flags [.], seq 68593:69907, ack 1, win 501, options [nop,nop,TS val 208625201 ecr 524953556], length 1314
02:34:27.778459 IP 52.223.217.245.1935 > 10.8.0.5.34486: Flags [.], ack 58319, win 126, options [nop,nop,TS val 524953620 ecr 208624770], length 0
02:34:27.781590 IP 10.8.0.5.34486 > 52.223.217.245.1935: Flags [.], seq 69907:71221, ack 1, win 501, options [nop,nop,TS val 208625237 ecr 524953620], length 1314
02:34:27.848795 IP 10.8.0.5.34486 > 52.223.217.245.1935: Flags [.], seq 71221:72535, ack 1, win 501, options [nop,nop,TS val 208625304 ecr 524953620], length 1314
02:34:27.882211 IP 52.223.217.245.1935 > 10.8.0.5.34486: Flags [.], ack 60947, win 126, options [nop,nop,TS val 524953723 ecr 208624871], length 0
02:34:27.882936 IP 10.8.0.5.34486 > 52.223.217.245.1935: Flags [.], seq 72535:73849, ack 1, win 501, options [nop,nop,TS val 208625339 ecr 524953723], length 1314
02:34:27.913011 IP 10.8.0.5.34486 > 52.223.217.245.1935: Flags [.], seq 73849:75163, ack 1, win 501, options [nop,nop,TS val 208625369 ecr 524953723], length 1314
02:34:27.952179 IP 52.223.217.245.1935 > 10.8.0.5.34486: Flags [.], ack 63337, win 126, options [nop,nop,TS val 524953793 ecr 208624936], length 0
02:34:27.952211 IP 10.8.0.5.34486 > 52.223.217.245.1935: Flags [P.], seq 75163:76354, ack 1, win 501, options [nop,nop,TS val 208625408 ecr 524953793], length 1191
02:34:28.014658 IP 10.8.0.5.34486 > 52.223.217.245.1935: Flags [.], seq 76354:77668, ack 1, win 501, options [nop,nop,TS val 208625470 ecr 524953793], length 1314
02:34:28.045432 IP 10.8.0.5.34486 > 52.223.217.245.1935: Flags [.], seq 77668:78982, ack 1, win 501, options [nop,nop,TS val 208625501 ecr 524953793], length 1314
02:34:28.048693 IP 52.223.217.245.1935 > 10.8.0.5.34486: Flags [.], ack 65965, win 126, options [nop,nop,TS val 524953890 ecr 208625038], length 0
02:34:28.083233 IP 10.8.0.5.34486 > 52.223.217.245.1935: Flags [.], seq 78982:80296, ack 1, win 501, options [nop,nop,TS val 208625539 ecr 524953890], length 1314
02:34:28.148312 IP 10.8.0.5.34486 > 52.223.217.245.1935: Flags [.], seq 80296:81610, ack 1, win 501, options [nop,nop,TS val 208625604 ecr 524953890], length 1314
02:34:28.148909 IP 52.223.217.245.1935 > 10.8.0.5.34486: Flags [.], ack 68593, win 126, options [nop,nop,TS val 524953990 ecr 208625103], length 0
02:34:28.180404 IP 10.8.0.5.34486 > 52.223.217.245.1935: Flags [.], seq 81610:82924, ack 1, win 501, options [nop,nop,TS val 208625636 ecr 524953990], length 1314
02:34:28.213864 IP 10.8.0.5.34486 > 52.223.217.245.1935: Flags [.], seq 82924:84238, ack 1, win 501, options [nop,nop,TS val 208625670 ecr 524953990], length 1314
02:34:28.215361 IP 52.223.217.245.1935 > 10.8.0.5.34486: Flags [.], ack 71221, win 126, options [nop,nop,TS val 524954056 ecr 208625201], length 0
02:34:28.278065 IP 10.8.0.5.34486 > 52.223.217.245.1935: Flags [.], seq 84238:85552, ack 1, win 501, options [nop,nop,TS val 208625734 ecr 524954056], length 1314
02:34:28.313588 IP 10.8.0.5.34486 > 52.223.217.245.1935: Flags [.], seq 85552:86866, ack 1, win 501, options [nop,nop,TS val 208625769 ecr 524954056], length 1314
02:34:28.316375 IP 52.223.217.245.1935 > 10.8.0.5.34486: Flags [.], ack 73849, win 126, options [nop,nop,TS val 524954158 ecr 208625304], length 0
02:34:28.349583 IP 10.8.0.5.34486 > 52.223.217.245.1935: Flags [.], seq 86866:88180, ack 1, win 501, options [nop,nop,TS val 208625805 ecr 524954158], length 1314
02:34:28.385614 IP 52.223.217.245.1935 > 10.8.0.5.34486: Flags [.], ack 76354, win 126, options [nop,nop,TS val 524954227 ecr 208625369], length 0
02:34:28.385659 IP 10.8.0.5.34486 > 52.223.217.245.1935: Flags [P.], seq 88180:89261, ack 1, win 501, options [nop,nop,TS val 208625841 ecr 524954227], length 1081
02:34:28.447466 IP 10.8.0.5.34486 > 52.223.217.245.1935: Flags [.], seq 89261:90575, ack 1, win 501, options [nop,nop,TS val 208625903 ecr 524954227], length 1314
02:34:28.478945 IP 52.223.217.245.1935 > 10.8.0.5.34486: Flags [.], ack 78982, win 126, options [nop,nop,TS val 524954320 ecr 208625470], length 0
02:34:28.481469 IP 10.8.0.5.34486 > 52.223.217.245.1935: Flags [.], seq 90575:91889, ack 1, win 501, options [nop,nop,TS val 208625937 ecr 524954320], length 1314
02:34:28.515060 IP 10.8.0.5.34486 > 52.223.217.245.1935: Flags [.], seq 91889:93203, ack 1, win 501, options [nop,nop,TS val 208625971 ecr 524954320], length 1314
02:34:28.580311 IP 10.8.0.5.34486 > 52.223.217.245.1935: Flags [.], seq 93203:94517, ack 1, win 501, options [nop,nop,TS val 208626036 ecr 524954320], length 1314
02:34:28.581789 IP 52.223.217.245.1935 > 10.8.0.5.34486: Flags [.], ack 81610, win 126, options [nop,nop,TS val 524954423 ecr 208625539], length 0
02:34:28.614762 IP 10.8.0.5.34486 > 52.223.217.245.1935: Flags [.], seq 94517:95831, ack 1, win 501, options [nop,nop,TS val 208626070 ecr 524954423], length 1314
02:34:28.647197 IP 52.223.217.245.1935 > 10.8.0.5.34486: Flags [.], ack 84238, win 126, options [nop,nop,TS val 524954488 ecr 208625636], length 0
02:34:28.648284 IP 10.8.0.5.34486 > 52.223.217.245.1935: Flags [.], seq 95831:97145, ack 1, win 501, options [nop,nop,TS val 208626104 ecr 524954488], length 1314
02:34:28.714760 IP 10.8.0.5.34486 > 52.223.217.245.1935: Flags [.], seq 97145:98459, ack 1, win 501, options [nop,nop,TS val 208626170 ecr 524954488], length 1314
02:34:28.747045 IP 52.223.217.245.1935 > 10.8.0.5.34486: Flags [.], ack 86866, win 126, options [nop,nop,TS val 524954588 ecr 208625734], length 0
02:34:28.748103 IP 10.8.0.5.34486 > 52.223.217.245.1935: Flags [.], seq 98459:99773, ack 1, win 501, options [nop,nop,TS val 208626204 ecr 524954588], length 1314
02:34:28.785097 IP 10.8.0.5.34486 > 52.223.217.245.1935: Flags [.], seq 99773:101087, ack 1, win 501, options [nop,nop,TS val 208626241 ecr 524954588], length 1314
02:34:28.819207 IP 52.223.217.245.1935 > 10.8.0.5.34486: Flags [.], ack 89261, win 126, options [nop,nop,TS val 524954660 ecr 208625805], length 0
02:34:28.819241 IP 10.8.0.5.34486 > 52.223.217.245.1935: Flags [P.], seq 101087:102179, ack 1, win 501, options [nop,nop,TS val 208626275 ecr 524954660], length 1092
02:34:28.881230 IP 10.8.0.5.34486 > 52.223.217.245.1935: Flags [.], seq 102179:103493, ack 1, win 501, options [nop,nop,TS val 208626337 ecr 524954660], length 1314
02:34:28.915035 IP 52.223.217.245.1935 > 10.8.0.5.34486: Flags [.], ack 91889, win 126, options [nop,nop,TS val 524954756 ecr 208625903], length 0
02:34:28.915496 IP 10.8.0.5.34486 > 52.223.217.245.1935: Flags [.], seq 103493:104807, ack 1, win 501, options [nop,nop,TS val 208626371 ecr 524954756], length 1314
02:34:28.944854 IP 10.8.0.5.34486 > 52.223.217.245.1935: Flags [.], seq 104807:106121, ack 1, win 501, options [nop,nop,TS val 208626401 ecr 524954756], length 1314
02:34:29.013930 IP 52.223.217.245.1935 > 10.8.0.5.34486: Flags [.], ack 94517, win 126, options [nop,nop,TS val 524954855 ecr 208625971], length 0
02:34:29.015804 IP 10.8.0.5.34486 > 52.223.217.245.1935: Flags [.], seq 106121:107435, ack 1, win 501, options [nop,nop,TS val 208626471 ecr 524954855], length 1314
02:34:29.048998 IP 10.8.0.5.34486 > 52.223.217.245.1935: Flags [.], seq 107435:108749, ack 1, win 501, options [nop,nop,TS val 208626505 ecr 524954855], length 1314
02:34:29.081749 IP 52.223.217.245.1935 > 10.8.0.5.34486: Flags [.], ack 97145, win 126, options [nop,nop,TS val 524954923 ecr 208626070], length 0
02:34:29.084332 IP 10.8.0.5.34486 > 52.223.217.245.1935: Flags [.], seq 108749:110063, ack 1, win 501, options [nop,nop,TS val 208626540 ecr 524954923], length 1314
02:34:29.148829 IP 10.8.0.5.34486 > 52.223.217.245.1935: Flags [.], seq 110063:111377, ack 1, win 501, options [nop,nop,TS val 208626605 ecr 524954923], length 1314
02:34:29.181561 IP 52.223.217.245.1935 > 10.8.0.5.34486: Flags [.], ack 99773, win 126, options [nop,nop,TS val 524955023 ecr 208626170], length 0
02:34:29.182799 IP 10.8.0.5.34486 > 52.223.217.245.1935: Flags [.], seq 111377:112691, ack 1, win 501, options [nop,nop,TS val 208626638 ecr 524955023], length 1314
02:34:29.215804 IP 10.8.0.5.34486 > 52.223.217.245.1935: Flags [.], seq 112691:114005, ack 1, win 501, options [nop,nop,TS val 208626671 ecr 524955023], length 1314
02:34:29.252611 IP 52.223.217.245.1935 > 10.8.0.5.34486: Flags [.], ack 102179, win 126, options [nop,nop,TS val 524955094 ecr 208626241], length 0
02:34:29.252644 IP 10.8.0.5.34486 > 52.223.217.245.1935: Flags [P.], seq 114005:115084, ack 1, win 501, options [nop,nop,TS val 208626708 ecr 524955094], length 1079
02:34:29.315498 IP 10.8.0.5.34486 > 52.223.217.245.1935: Flags [.], seq 115084:116398, ack 1, win 501, options [nop,nop,TS val 208626771 ecr 524955094], length 1314
02:34:29.342453 IP 10.8.0.5.34486 > 52.223.217.245.1935: Flags [.], seq 116398:117712, ack 1, win 501, options [nop,nop,TS val 208626798 ecr 524955094], length 1314
02:34:29.348838 IP 52.223.217.245.1935 > 10.8.0.5.34486: Flags [.], ack 104807, win 126, options [nop,nop,TS val 524955190 ecr 208626337], length 0
02:34:29.380586 IP 10.8.0.5.34486 > 52.223.217.245.1935: Flags [.], seq 117712:119026, ack 1, win 501, options [nop,nop,TS val 208626836 ecr 524955190], length 1314
02:34:29.447732 IP 10.8.0.5.34486 > 52.223.217.245.1935: Flags [.], seq 119026:120340, ack 1, win 501, options [nop,nop,TS val 208626903 ecr 524955190], length 1314
02:34:29.448952 IP 52.223.217.245.1935 > 10.8.0.5.34486: Flags [.], ack 107435, win 126, options [nop,nop,TS val 524955290 ecr 208626401], length 0
02:34:29.470621 IP 10.8.0.5.34486 > 52.223.217.245.1935: Flags [.], seq 120340:121654, ack 1, win 501, options [nop,nop,TS val 208626926 ecr 524955290], length 1314
02:34:29.511705 IP 10.8.0.5.34486 > 52.223.217.245.1935: Flags [.], seq 121654:122968, ack 1, win 501, options [nop,nop,TS val 208626967 ecr 524955290], length 1314
02:34:29.517559 IP 52.223.217.245.1935 > 10.8.0.5.34486: Flags [.], ack 110063, win 126, options [nop,nop,TS val 524955359 ecr 208626505], length 0
02:34:29.577617 IP 10.8.0.5.34486 > 52.223.217.245.1935: Flags [.], seq 122968:124282, ack 1, win 501, options [nop,nop,TS val 208627033 ecr 524955359], length 1314
02:34:29.615598 IP 10.8.0.5.34486 > 52.223.217.245.1935: Flags [.], seq 124282:125596, ack 1, win 501, options [nop,nop,TS val 208627071 ecr 524955359], length 1314
02:34:29.616283 IP 52.223.217.245.1935 > 10.8.0.5.34486: Flags [.], ack 112691, win 126, options [nop,nop,TS val 524955457 ecr 208626605], length 0
02:34:29.642012 IP 10.8.0.5.34486 > 52.223.217.245.1935: Flags [.], seq 125596:126910, ack 1, win 501, options [nop,nop,TS val 208627098 ecr 524955457], length 1314
02:34:29.686066 IP 52.223.217.245.1935 > 10.8.0.5.34486: Flags [.], ack 115084, win 126, options [nop,nop,TS val 524955527 ecr 208626671], length 0
02:34:29.686110 IP 10.8.0.5.34486 > 52.223.217.245.1935: Flags [P.], seq 126910:128191, ack 1, win 501, options [nop,nop,TS val 208627142 ecr 524955527], length 1281
02:34:29.748904 IP 10.8.0.5.34486 > 52.223.217.245.1935: Flags [.], seq 128191:129505, ack 1, win 501, options [nop,nop,TS val 208627205 ecr 524955527], length 1314
02:34:29.770878 IP 10.8.0.5.34486 > 52.223.217.245.1935: Flags [.], seq 129505:130819, ack 1, win 501, options [nop,nop,TS val 208627227 ecr 524955527], length 1314
02:34:29.776516 IP 52.223.217.245.1935 > 10.8.0.5.34486: Flags [.], ack 117712, win 126, options [nop,nop,TS val 524955617 ecr 208626771], length 0
02:34:29.815616 IP 10.8.0.5.34486 > 52.223.217.245.1935: Flags [.], seq 130819:132133, ack 1, win 501, options [nop,nop,TS val 208627271 ecr 524955617], length 1314
02:34:29.878566 IP 10.8.0.5.34486 > 52.223.217.245.1935: Flags [.], seq 132133:133447, ack 1, win 501, options [nop,nop,TS val 208627334 ecr 524955617], length 1314
02:34:29.881051 IP 52.223.217.245.1935 > 10.8.0.5.34486: Flags [.], ack 120340, win 126, options [nop,nop,TS val 524955722 ecr 208626836], length 0
02:34:29.913162 IP 10.8.0.5.34486 > 52.223.217.245.1935: Flags [.], seq 133447:134761, ack 1, win 501, options [nop,nop,TS val 208627369 ecr 524955722], length 1314
02:34:29.944868 IP 52.223.217.245.1935 > 10.8.0.5.34486: Flags [.], ack 122968, win 126, options [nop,nop,TS val 524955786 ecr 208626926], length 0
02:34:29.948287 IP 10.8.0.5.34486 > 52.223.217.245.1935: Flags [.], seq 134761:136075, ack 1, win 501, options [nop,nop,TS val 208627404 ecr 524955786], length 1314
02:34:30.007291 IP 10.8.0.5.34486 > 52.223.217.245.1935: Flags [.], seq 136075:137389, ack 1, win 501, options [nop,nop,TS val 208627463 ecr 524955786], length 1314
02:34:30.046537 IP 10.8.0.5.34486 > 52.223.217.245.1935: Flags [.], seq 137389:138703, ack 1, win 501, options [nop,nop,TS val 208627502 ecr 524955786], length 1314
02:34:30.048947 IP 52.223.217.245.1935 > 10.8.0.5.34486: Flags [.], ack 125596, win 126, options [nop,nop,TS val 524955890 ecr 208627033], length 0
02:34:30.079748 IP 10.8.0.5.34486 > 52.223.217.245.1935: Flags [.], seq 138703:140017, ack 1, win 501, options [nop,nop,TS val 208627535 ecr 524955890], length 1314
02:34:30.119829 IP 52.223.217.245.1935 > 10.8.0.5.34486: Flags [.], ack 128191, win 126, options [nop,nop,TS val 524955961 ecr 208627098], length 0
02:34:30.119868 IP 10.8.0.5.34486 > 52.223.217.245.1935: Flags [P.], seq 140017:141104, ack 1, win 501, options [nop,nop,TS val 208627576 ecr 524955961], length 1087
02:34:30.178402 IP 10.8.0.5.34486 > 52.223.217.245.1935: Flags [.], seq 141104:142418, ack 1, win 501, options [nop,nop,TS val 208627634 ecr 524955961], length 1314
02:34:30.204385 IP 52.223.217.245.1935 > 10.8.0.5.34486: Flags [.], ack 130819, win 126, options [nop,nop,TS val 524956046 ecr 208627205], length 0
02:34:30.214711 IP 10.8.0.5.34486 > 52.223.217.245.1935: Flags [.], seq 142418:143732, ack 1, win 501, options [nop,nop,TS val 208627670 ecr 524956046], length 1314
02:34:30.248860 IP 10.8.0.5.34486 > 52.223.217.245.1935: Flags [.], seq 143732:145046, ack 1, win 501, options [nop,nop,TS val 208627705 ecr 524956046], length 1314
02:34:30.306925 IP 10.8.0.5.34486 > 52.223.217.245.1935: Flags [.], seq 145046:146360, ack 1, win 501, options [nop,nop,TS val 208627763 ecr 524956046], length 1314
02:34:30.312123 IP 52.223.217.245.1935 > 10.8.0.5.34486: Flags [.], ack 133447, win 126, options [nop,nop,TS val 524956153 ecr 208627271], length 0
02:34:30.347239 IP 10.8.0.5.34486 > 52.223.217.245.1935: Flags [.], seq 146360:147674, ack 1, win 501, options [nop,nop,TS val 208627803 ecr 524956153], length 1314
02:34:30.381275 IP 10.8.0.5.34486 > 52.223.217.245.1935: Flags [.], seq 147674:148988, ack 1, win 501, options [nop,nop,TS val 208627837 ecr 524956153], length 1314
02:34:30.381793 IP 52.223.217.245.1935 > 10.8.0.5.34486: Flags [.], ack 136075, win 126, options [nop,nop,TS val 524956223 ecr 208627369], length 0
02:34:30.446970 IP 10.8.0.5.34486 > 52.223.217.245.1935: Flags [.], seq 148988:150302, ack 1, win 501, options [nop,nop,TS val 208627903 ecr 524956223], length 1314
02:34:30.477679 IP 10.8.0.5.34486 > 52.223.217.245.1935: Flags [.], seq 150302:151616, ack 1, win 501, options [nop,nop,TS val 208627933 ecr 524956223], length 1314
02:34:30.479945 IP 52.223.217.245.1935 > 10.8.0.5.34486: Flags [.], ack 138703, win 126, options [nop,nop,TS val 524956321 ecr 208627463], length 0
02:34:30.515505 IP 10.8.0.5.34486 > 52.223.217.245.1935: Flags [.], seq 151616:152930, ack 1, win 501, options [nop,nop,TS val 208627971 ecr 524956321], length 1314
02:34:30.553283 IP 52.223.217.245.1935 > 10.8.0.5.34486: Flags [.], ack 141104, win 126, options [nop,nop,TS val 524956394 ecr 208627535], length 0
02:34:30.553322 IP 10.8.0.5.34486 > 52.223.217.245.1935: Flags [P.], seq 152930:154014, ack 1, win 501, options [nop,nop,TS val 208628009 ecr 524956394], length 1084
02:34:30.606093 IP 10.8.0.5.34486 > 52.223.217.245.1935: Flags [.], seq 154014:155328, ack 1, win 501, options [nop,nop,TS val 208628062 ecr 524956394], length 1314
02:34:30.648286 IP 52.223.217.245.1935 > 10.8.0.5.34486: Flags [.], ack 143732, win 126, options [nop,nop,TS val 524956490 ecr 208627634], length 0
02:34:30.649269 IP 10.8.0.5.34486 > 52.223.217.245.1935: Flags [.], seq 155328:156642, ack 1, win 501, options [nop,nop,TS val 208628105 ecr 524956490], length 1314
02:34:30.682077 IP 10.8.0.5.34486 > 52.223.217.245.1935: Flags [.], seq 156642:157956, ack 1, win 501, options [nop,nop,TS val 208628138 ecr 524956490], length 1314
02:34:30.740597 IP 52.223.217.245.1935 > 10.8.0.5.34486: Flags [.], ack 146360, win 126, options [nop,nop,TS val 524956582 ecr 208627705], length 0
02:34:30.748379 IP 10.8.0.5.34486 > 52.223.217.245.1935: Flags [.], seq 157956:159270, ack 1, win 501, options [nop,nop,TS val 208628204 ecr 524956582], length 1314
02:34:30.777919 IP 10.8.0.5.34486 > 52.223.217.245.1935: Flags [.], seq 159270:160584, ack 1, win 501, options [nop,nop,TS val 208628234 ecr 524956582], length 1314
02:34:30.814663 IP 52.223.217.245.1935 > 10.8.0.5.34486: Flags [.], ack 148988, win 126, options [nop,nop,TS val 524956656 ecr 208627803], length 0
02:34:30.816136 IP 10.8.0.5.34486 > 52.223.217.245.1935: Flags [.], seq 160584:161898, ack 1, win 501, options [nop,nop,TS val 208628272 ecr 524956656], length 1314
02:34:30.882222 IP 10.8.0.5.34486 > 52.223.217.245.1935: Flags [.], seq 161898:163212, ack 1, win 501, options [nop,nop,TS val 208628338 ecr 524956656], length 1314
02:34:30.911030 IP 52.223.217.245.1935 > 10.8.0.5.34486: Flags [.], ack 151616, win 126, options [nop,nop,TS val 524956752 ecr 208627903], length 0
02:34:30.914900 IP 10.8.0.5.34486 > 52.223.217.245.1935: Flags [.], seq 163212:164526, ack 1, win 501, options [nop,nop,TS val 208628371 ecr 524956752], length 1314
02:34:30.949131 IP 10.8.0.5.34486 > 52.223.217.245.1935: Flags [.], seq 164526:165840, ack 1, win 501, options [nop,nop,TS val 208628405 ecr 524956752], length 1314
02:34:30.986622 IP 52.223.217.245.1935 > 10.8.0.5.34486: Flags [.], ack 154014, win 126, options [nop,nop,TS val 524956828 ecr 208627971], length 0
02:34:30.986646 IP 10.8.0.5.34486 > 52.223.217.245.1935: Flags [P.], seq 165840:166929, ack 1, win 501, options [nop,nop,TS val 208628442 ecr 524956828], length 1089
02:34:31.047949 IP 10.8.0.5.34486 > 52.223.217.245.1935: Flags [.], seq 166929:168243, ack 1, win 501, options [nop,nop,TS val 208628504 ecr 524956828], length 1314
02:34:31.077418 IP 10.8.0.5.34486 > 52.223.217.245.1935: Flags [.], seq 168243:169557, ack 1, win 501, options [nop,nop,TS val 208628533 ecr 524956828], length 1314
02:34:31.082585 IP 52.223.217.245.1935 > 10.8.0.5.34486: Flags [.], ack 156642, win 126, options [nop,nop,TS val 524956924 ecr 208628062], length 0
02:34:31.114671 IP 10.8.0.5.34486 > 52.223.217.245.1935: Flags [.], seq 169557:170871, ack 1, win 501, options [nop,nop,TS val 208628570 ecr 524956924], length 1314
02:34:31.181298 IP 10.8.0.5.34486 > 52.223.217.245.1935: Flags [.], seq 170871:172185, ack 1, win 501, options [nop,nop,TS val 208628637 ecr 524956924], length 1314
02:34:31.181737 IP 52.223.217.245.1935 > 10.8.0.5.34486: Flags [.], ack 159270, win 126, options [nop,nop,TS val 524957023 ecr 208628138], length 0
02:34:31.214670 IP 10.8.0.5.34486 > 52.223.217.245.1935: Flags [.], seq 172185:173499, ack 1, win 501, options [nop,nop,TS val 208628670 ecr 524957023], length 1314
02:34:31.246722 IP 10.8.0.5.34486 > 52.223.217.245.1935: Flags [.], seq 173499:174813, ack 1, win 501, options [nop,nop,TS val 208628702 ecr 524957023], length 1314
02:34:31.249426 IP 52.223.217.245.1935 > 10.8.0.5.34486: Flags [.], ack 161898, win 126, options [nop,nop,TS val 524957091 ecr 208628234], length 0
02:34:31.312479 IP 10.8.0.5.34486 > 52.223.217.245.1935: Flags [.], seq 174813:176127, ack 1, win 501, options [nop,nop,TS val 208628768 ecr 524957091], length 1314
02:34:31.348273 IP 52.223.217.245.1935 > 10.8.0.5.34486: Flags [.], ack 164526, win 126, options [nop,nop,TS val 524957189 ecr 208628338], length 0
02:34:31.349005 IP 10.8.0.5.34486 > 52.223.217.245.1935: Flags [.], seq 176127:177441, ack 1, win 501, options [nop,nop,TS val 208628805 ecr 524957189], length 1314
02:34:31.377146 IP 10.8.0.5.34486 > 52.223.217.245.1935: Flags [.], seq 177441:178755, ack 1, win 501, options [nop,nop,TS val 208628833 ecr 524957189], length 1314
02:34:31.419890 IP 52.223.217.245.1935 > 10.8.0.5.34486: Flags [.], ack 166929, win 126, options [nop,nop,TS val 524957261 ecr 208628405], length 0
02:34:31.419938 IP 10.8.0.5.34486 > 52.223.217.245.1935: Flags [P.], seq 178755:179834, ack 1, win 501, options [nop,nop,TS val 208628876 ecr 524957261], length 1079
02:34:31.480983 IP 10.8.0.5.34486 > 52.223.217.245.1935: Flags [.], seq 179834:181148, ack 1, win 501, options [nop,nop,TS val 208628937 ecr 524957261], length 1314
02:34:31.510901 IP 52.223.217.245.1935 > 10.8.0.5.34486: Flags [.], ack 169557, win 126, options [nop,nop,TS val 524957352 ecr 208628504], length 0
02:34:31.513960 IP 10.8.0.5.34486 > 52.223.217.245.1935: Flags [.], seq 181148:182462, ack 1, win 501, options [nop,nop,TS val 208628970 ecr 524957352], length 1314
02:34:31.547542 IP 10.8.0.5.34486 > 52.223.217.245.1935: Flags [.], seq 182462:183776, ack 1, win 501, options [nop,nop,TS val 208629003 ecr 524957352], length 1314
02:34:31.612758 IP 10.8.0.5.34486 > 52.223.217.245.1935: Flags [.], seq 183776:185090, ack 1, win 501, options [nop,nop,TS val 208629068 ecr 524957352], length 1314
02:34:31.614571 IP 52.223.217.245.1935 > 10.8.0.5.34486: Flags [.], ack 172185, win 126, options [nop,nop,TS val 524957456 ecr 208628570], length 0
02:34:31.649162 IP 10.8.0.5.34486 > 52.223.217.245.1935: Flags [.], seq 185090:186404, ack 1, win 501, options [nop,nop,TS val 208629105 ecr 524957456], length 1314
02:34:31.677147 IP 10.8.0.5.34486 > 52.223.217.245.1935: Flags [.], seq 186404:187718, ack 1, win 501, options [nop,nop,TS val 208629133 ecr 524957456], length 1314
02:34:31.680116 IP 52.223.217.245.1935 > 10.8.0.5.34486: Flags [.], ack 174813, win 126, options [nop,nop,TS val 524957521 ecr 208628670], length 0
02:34:31.748664 IP 10.8.0.5.34486 > 52.223.217.245.1935: Flags [.], seq 187718:189032, ack 1, win 501, options [nop,nop,TS val 208629204 ecr 524957521], length 1314
02:34:31.780773 IP 10.8.0.5.34486 > 52.223.217.245.1935: Flags [.], seq 189032:190346, ack 1, win 501, options [nop,nop,TS val 208629236 ecr 524957521], length 1314
02:34:31.782252 IP 52.223.217.245.1935 > 10.8.0.5.34486: Flags [.], ack 177441, win 126, options [nop,nop,TS val 524957623 ecr 208628768], length 0
02:34:31.814782 IP 10.8.0.5.34486 > 52.223.217.245.1935: Flags [.], seq 190346:191660, ack 1, win 501, options [nop,nop,TS val 208629270 ecr 524957623], length 1314
02:34:31.853399 IP 52.223.217.245.1935 > 10.8.0.5.34486: Flags [.], ack 179834, win 126, options [nop,nop,TS val 524957695 ecr 208628833], length 0
02:34:31.853448 IP 10.8.0.5.34486 > 52.223.217.245.1935: Flags [P.], seq 191660:192852, ack 1, win 501, options [nop,nop,TS val 208629309 ecr 524957695], length 1192
02:34:31.913196 IP 10.8.0.5.34486 > 52.223.217.245.1935: Flags [.], seq 192852:194166, ack 1, win 501, options [nop,nop,TS val 208629369 ecr 524957695], length 1314
02:34:31.947246 IP 52.223.217.245.1935 > 10.8.0.5.34486: Flags [.], ack 182462, win 126, options [nop,nop,TS val 524957788 ecr 208628937], length 0
02:34:31.948613 IP 10.8.0.5.34486 > 52.223.217.245.1935: Flags [.], seq 194166:195480, ack 1, win 501, options [nop,nop,TS val 208629404 ecr 524957788], length 1314
02:34:31.982077 IP 10.8.0.5.34486 > 52.223.217.245.1935: Flags [.], seq 195480:196794, ack 1, win 501, options [nop,nop,TS val 208629438 ecr 524957788], length 1314
02:34:32.046453 IP 52.223.217.245.1935 > 10.8.0.5.34486: Flags [.], ack 185090, win 126, options [nop,nop,TS val 524957887 ecr 208629003], length 0
02:34:32.048663 IP 10.8.0.5.34486 > 52.223.217.245.1935: Flags [.], seq 196794:198108, ack 1, win 501, options [nop,nop,TS val 208629504 ecr 524957887], length 1314
02:34:32.081907 IP 10.8.0.5.34486 > 52.223.217.245.1935: Flags [.], seq 198108:199422, ack 1, win 501, options [nop,nop,TS val 208629538 ecr 524957887], length 1314
02:34:32.110673 IP 52.223.217.245.1935 > 10.8.0.5.34486: Flags [.], ack 187718, win 126, options [nop,nop,TS val 524957952 ecr 208629105], length 0
02:34:32.115799 IP 10.8.0.5.34486 > 52.223.217.245.1935: Flags [.], seq 199422:200736, ack 1, win 501, options [nop,nop,TS val 208629571 ecr 524957952], length 1314
02:34:32.178370 IP 10.8.0.5.34486 > 52.223.217.245.1935: Flags [.], seq 200736:202050, ack 1, win 501, options [nop,nop,TS val 208629634 ecr 524957952], length 1314
02:34:32.212603 IP 10.8.0.5.34486 > 52.223.217.245.1935: Flags [.], seq 202050:203364, ack 1, win 501, options [nop,nop,TS val 208629668 ecr 524957952], length 1314
02:34:32.213983 IP 52.223.217.245.1935 > 10.8.0.5.34486: Flags [.], ack 190346, win 126, options [nop,nop,TS val 524958055 ecr 208629204], length 0
02:34:32.249433 IP 10.8.0.5.34486 > 52.223.217.245.1935: Flags [.], seq 203364:204678, ack 1, win 501, options [nop,nop,TS val 208629705 ecr 524958055], length 1314
02:34:32.287106 IP 52.223.217.245.1935 > 10.8.0.5.34486: Flags [.], ack 192852, win 126, options [nop,nop,TS val 524958128 ecr 208629270], length 0
02:34:32.287121 IP 10.8.0.5.34486 > 52.223.217.245.1935: Flags [P.], seq 204678:205755, ack 1, win 501, options [nop,nop,TS val 208629743 ecr 524958128], length 1077
02:34:32.349049 IP 10.8.0.5.34486 > 52.223.217.245.1935: Flags [.], seq 205755:207069, ack 1, win 501, options [nop,nop,TS val 208629805 ecr 524958128], length 1314
02:34:32.381833 IP 52.223.217.245.1935 > 10.8.0.5.34486: Flags [.], ack 195480, win 126, options [nop,nop,TS val 524958223 ecr 208629369], length 0
02:34:32.382742 IP 10.8.0.5.34486 > 52.223.217.245.1935: Flags [.], seq 207069:208383, ack 1, win 501, options [nop,nop,TS val 208629838 ecr 524958223], length 1314
02:34:32.415919 IP 10.8.0.5.34486 > 52.223.217.245.1935: Flags [.], seq 208383:209697, ack 1, win 501, options [nop,nop,TS val 208629872 ecr 524958223], length 1314
02:34:32.480908 IP 10.8.0.5.34486 > 52.223.217.245.1935: Flags [.], seq 209697:211011, ack 1, win 501, options [nop,nop,TS val 208629937 ecr 524958223], length 1314
02:34:32.482002 IP 52.223.217.245.1935 > 10.8.0.5.34486: Flags [.], ack 198108, win 126, options [nop,nop,TS val 524958323 ecr 208629438], length 0
02:34:32.514178 IP 10.8.0.5.34486 > 52.223.217.245.1935: Flags [.], seq 211011:212325, ack 1, win 501, options [nop,nop,TS val 208629970 ecr 524958323], length 1314
02:34:32.548631 IP 10.8.0.5.34486 > 52.223.217.245.1935: Flags [.], seq 212325:213639, ack 1, win 501, options [nop,nop,TS val 208630004 ecr 524958323], length 1314
02:34:32.549265 IP 52.223.217.245.1935 > 10.8.0.5.34486: Flags [.], ack 200736, win 126, options [nop,nop,TS val 524958390 ecr 208629538], length 0
02:34:32.615811 IP 10.8.0.5.34486 > 52.223.217.245.1935: Flags [.], seq 213639:214953, ack 1, win 501, options [nop,nop,TS val 208630072 ecr 524958390], length 1314
02:34:32.646068 IP 52.223.217.245.1935 > 10.8.0.5.34486: Flags [.], ack 203364, win 126, options [nop,nop,TS val 524958487 ecr 208629634], length 0
02:34:32.649327 IP 10.8.0.5.34486 > 52.223.217.245.1935: Flags [.], seq 214953:216267, ack 1, win 501, options [nop,nop,TS val 208630105 ecr 524958487], length 1314
02:34:32.679929 IP 10.8.0.5.34486 > 52.223.217.245.1935: Flags [.], seq 216267:217581, ack 1, win 501, options [nop,nop,TS val 208630136 ecr 524958487], length 1314
