10:25:24.656388 IP 10.8.3.10.56832 > 185.42.204.236.1935: Flags [.], seq 2485468652:2485469966, ack 1519084046, win 501, options [nop,nop,TS val 1516099349 ecr 2768024220], length 1314
10:25:24.661823 IP 185.42.204.236.1935 > 10.8.3.10.56832: Flags [.], ack 4294954650, win 126, options [nop,nop,TS val 2768024321 ecr 1516098817], length 0
10:25:24.687290 IP 185.42.204.236.1935 > 10.8.3.10.56832: Flags [.], ack 4294955470, win 126, options [nop,nop,TS val 2768024346 ecr 1516098909], length 0
10:25:24.687327 IP 10.8.3.10.56832 > 185.42.204.236.1935: Flags [P.], seq 1314:2118, ack 1, win 501, options [nop,nop,TS val 1516099380 ecr 2768024346], length 804
10:25:24.724333 IP 10.8.3.10.56832 > 185.42.204.236.1935: Flags [.], seq 2118:3432, ack 1, win 501, options [nop,nop,TS val 1516099417 ecr 2768024346], length 1314
10:25:24.754601 IP 10.8.3.10.56832 > 185.42.204.236.1935: Flags [.], seq 3432:4746, ack 1, win 501, options [nop,nop,TS val 1516099447 ecr 2768024346], length 1314
10:25:24.761889 IP 185.42.204.236.1935 > 10.8.3.10.56832: Flags [.], ack 4294958098, win 126, options [nop,nop,TS val 2768024421 ecr 1516098951], length 0
10:25:24.797161 IP 10.8.3.10.56832 > 185.42.204.236.1935: Flags [.], seq 4746:6060, ack 1, win 501, options [nop,nop,TS val 1516099489 ecr 2768024421], length 1314
10:25:24.854751 IP 10.8.3.10.56832 > 185.42.204.236.1935: Flags [.], seq 6060:7374, ack 1, win 501, options [nop,nop,TS val 1516099547 ecr 2768024421], length 1314
10:25:24.859949 IP 185.42.204.236.1935 > 10.8.3.10.56832: Flags [.], ack 4294960726, win 126, options [nop,nop,TS val 2768024520 ecr 1516099019], length 0
10:25:24.890959 IP 10.8.3.10.56832 > 185.42.204.236.1935: Flags [.], seq 7374:8688, ack 1, win 501, options [nop,nop,TS val 1516099583 ecr 2768024520], length 1314
10:25:24.925355 IP 10.8.3.10.56832 > 185.42.204.236.1935: Flags [.], seq 8688:10002, ack 1, win 501, options [nop,nop,TS val 1516099618 ecr 2768024520], length 1314
10:25:24.926804 IP 185.42.204.236.1935 > 10.8.3.10.56832: Flags [.], ack 4294963354, win 126, options [nop,nop,TS val 2768024584 ecr 1516099113], length 0
10:25:24.989158 IP 10.8.3.10.56832 > 185.42.204.236.1935: Flags [.], seq 10002:11316, ack 1, win 501, options [nop,nop,TS val 1516099681 ecr 2768024584], length 1314
10:25:25.023631 IP 10.8.3.10.56832 > 185.42.204.236.1935: Flags [.], seq 11316:12630, ack 1, win 501, options [nop,nop,TS val 1516099716 ecr 2768024584], length 1314
10:25:25.027839 IP 185.42.204.236.1935 > 10.8.3.10.56832: Flags [.], ack 4294965982, win 126, options [nop,nop,TS val 2768024687 ecr 1516099217], length 0
10:25:25.057644 IP 10.8.3.10.56832 > 185.42.204.236.1935: Flags [.], seq 12630:13944, ack 1, win 501, options [nop,nop,TS val 1516099750 ecr 2768024687], length 1314
10:25:25.121364 IP 10.8.3.10.56832 > 185.42.204.236.1935: Flags [.], seq 13944:15258, ack 1, win 501, options [nop,nop,TS val 1516099814 ecr 2768024687], length 1314
10:25:25.126118 IP 185.42.204.236.1935 > 10.8.3.10.56832: Flags [.], ack 1314, win 126, options [nop,nop,TS val 2768024786 ecr 1516099283], length 0
10:25:25.154201 IP 10.8.3.10.56832 > 185.42.204.236.1935: Flags [.], seq 15258:16572, ack 1, win 501, options [nop,nop,TS val 1516099847 ecr 2768024786], length 1314
10:25:25.156905 IP 185.42.204.236.1935 > 10.8.3.10.56832: Flags [.], ack 2118, win 126, options [nop,nop,TS val 2768024817 ecr 1516099380], length 0
10:25:25.156917 IP 10.8.3.10.56832 > 185.42.204.236.1935: Flags [P.], seq 16572:16919, ack 1, win 501, options [nop,nop,TS val 1516099849 ecr 2768024817], length 347
10:25:25.220576 IP 10.8.3.10.56832 > 185.42.204.236.1935: Flags [.], seq 16919:18233, ack 1, win 501, options [nop,nop,TS val 1516099913 ecr 2768024817], length 1314
10:25:25.224667 IP 185.42.204.236.1935 > 10.8.3.10.56832: Flags [.], ack 4746, win 126, options [nop,nop,TS val 2768024884 ecr 1516099417], length 0
10:25:25.254063 IP 10.8.3.10.56832 > 185.42.204.236.1935: Flags [.], seq 18233:19547, ack 1, win 501, options [nop,nop,TS val 1516099946 ecr 2768024884], length 1314
10:25:25.287246 IP 10.8.3.10.56832 > 185.42.204.236.1935: Flags [.], seq 19547:20861, ack 1, win 501, options [nop,nop,TS val 1516099980 ecr 2768024884], length 1314
10:25:25.324547 IP 185.42.204.236.1935 > 10.8.3.10.56832: Flags [.], ack 7374, win 126, options [nop,nop,TS val 2768024984 ecr 1516099489], length 0
10:25:25.353972 IP 10.8.3.10.56832 > 185.42.204.236.1935: Flags [.], seq 20861:22175, ack 1, win 501, options [nop,nop,TS val 1516100046 ecr 2768024984], length 1314
10:25:25.387419 IP 10.8.3.10.56832 > 185.42.204.236.1935: Flags [.], seq 22175:23489, ack 1, win 501, options [nop,nop,TS val 1516100080 ecr 2768024984], length 1314
10:25:25.395957 IP 185.42.204.236.1935 > 10.8.3.10.56832: Flags [.], ack 10002, win 126, options [nop,nop,TS val 2768025056 ecr 1516099583], length 0
10:25:25.421782 IP 10.8.3.10.56832 > 185.42.204.236.1935: Flags [.], seq 23489:24803, ack 1, win 501, options [nop,nop,TS val 1516100114 ecr 2768025056], length 1314
10:25:25.490436 IP 10.8.3.10.56832 > 185.42.204.236.1935: Flags [.], seq 24803:26117, ack 1, win 501, options [nop,nop,TS val 1516100183 ecr 2768025056], length 1314
10:25:25.493397 IP 185.42.204.236.1935 > 10.8.3.10.56832: Flags [.], ack 12630, win 126, options [nop,nop,TS val 2768025153 ecr 1516099681], length 0
10:25:25.522111 IP 10.8.3.10.56832 > 185.42.204.236.1935: Flags [.], seq 26117:27431, ack 1, win 501, options [nop,nop,TS val 1516100214 ecr 2768025153], length 1314
10:25:25.555908 IP 10.8.3.10.56832 > 185.42.204.236.1935: Flags [.], seq 27431:28745, ack 1, win 501, options [nop,nop,TS val 1516100248 ecr 2768025153], length 1314
10:25:25.590923 IP 185.42.204.236.1935 > 10.8.3.10.56832: Flags [.], ack 15258, win 126, options [nop,nop,TS val 2768025251 ecr 1516099750], length 0
10:25:25.620634 IP 10.8.3.10.56832 > 185.42.204.236.1935: Flags [.], seq 28745:30059, ack 1, win 501, options [nop,nop,TS val 1516100313 ecr 2768025251], length 1314
10:25:25.626960 IP 185.42.204.236.1935 > 10.8.3.10.56832: Flags [.], ack 16919, win 126, options [nop,nop,TS val 2768025286 ecr 1516099847], length 0
10:25:25.626975 IP 10.8.3.10.56832 > 185.42.204.236.1935: Flags [P.], seq 30059:30866, ack 1, win 501, options [nop,nop,TS val 1516100319 ecr 2768025286], length 807
10:25:25.691804 IP 10.8.3.10.56832 > 185.42.204.236.1935: Flags [.], seq 30866:32180, ack 1, win 501, options [nop,nop,TS val 1516100384 ecr 2768025286], length 1314
10:25:25.723901 IP 185.42.204.236.1935 > 10.8.3.10.56832: Flags [.], ack 19547, win 126, options [nop,nop,TS val 2768025383 ecr 1516099913], length 0
10:25:25.725592 IP 10.8.3.10.56832 > 185.42.204.236.1935: Flags [.], seq 32180:33494, ack 1, win 501, options [nop,nop,TS val 1516100418 ecr 2768025383], length 1314
10:25:25.757058 IP 10.8.3.10.56832 > 185.42.204.236.1935: Flags [.], seq 33494:34808, ack 1, win 501, options [nop,nop,TS val 1516100449 ecr 2768025383], length 1314
10:25:25.821275 IP 10.8.3.10.56832 > 185.42.204.236.1935: Flags [.], seq 34808:36122, ack 1, win 501, options [nop,nop,TS val 1516100514 ecr 2768025383], length 1314
10:25:25.823769 IP 185.42.204.236.1935 > 10.8.3.10.56832: Flags [.], ack 22175, win 126, options [nop,nop,TS val 2768025483 ecr 1516099980], length 0
10:25:25.857968 IP 10.8.3.10.56832 > 185.42.204.236.1935: Flags [.], seq 36122:37436, ack 1, win 501, options [nop,nop,TS val 1516100550 ecr 2768025483], length 1314
10:25:25.891509 IP 185.42.204.236.1935 > 10.8.3.10.56832: Flags [.], ack 24803, win 126, options [nop,nop,TS val 2768025551 ecr 1516100080], length 0
10:25:25.891584 IP 10.8.3.10.56832 > 185.42.204.236.1935: Flags [.], seq 37436:38750, ack 1, win 501, options [nop,nop,TS val 1516100584 ecr 2768025551], length 1314
10:25:25.956926 IP 10.8.3.10.56832 > 185.42.204.236.1935: Flags [.], seq 38750:40064, ack 1, win 501, options [nop,nop,TS val 1516100649 ecr 2768025551], length 1314
10:25:25.990605 IP 10.8.3.10.56832 > 185.42.204.236.1935: Flags [.], seq 40064:41378, ack 1, win 501, options [nop,nop,TS val 1516100683 ecr 2768025551], length 1314
10:25:25.991859 IP 185.42.204.236.1935 > 10.8.3.10.56832: Flags [.], ack 27431, win 126, options [nop,nop,TS val 2768025652 ecr 1516100183], length 0
10:25:26.020492 IP 10.8.3.10.56832 > 185.42.204.236.1935: Flags [.], seq 41378:42692, ack 1, win 501, options [nop,nop,TS val 1516100713 ecr 2768025652], length 1314
10:25:26.088874 IP 10.8.3.10.56832 > 185.42.204.236.1935: Flags [.], seq 42692:44006, ack 1, win 501, options [nop,nop,TS val 1516100781 ecr 2768025652], length 1314
10:25:26.090268 IP 185.42.204.236.1935 > 10.8.3.10.56832: Flags [.], ack 30059, win 126, options [nop,nop,TS val 2768025750 ecr 1516100248], length 0
10:25:26.096729 IP 185.42.204.236.1935 > 10.8.3.10.56832: Flags [.], ack 30866, win 126, options [nop,nop,TS val 2768025756 ecr 1516100319], length 0
10:25:26.096756 IP 10.8.3.10.56832 > 185.42.204.236.1935: Flags [P.], seq 44006:44810, ack 1, win 501, options [nop,nop,TS val 1516100789 ecr 2768025756], length 804
10:25:26.158096 IP 10.8.3.10.56832 > 185.42.204.236.1935: Flags [.], seq 44810:46124, ack 1, win 501, options [nop,nop,TS val 1516100850 ecr 2768025756], length 1314
10:25:26.191333 IP 10.8.3.10.56832 > 185.42.204.236.1935: Flags [.], seq 46124:47438, ack 1, win 501, options [nop,nop,TS val 1516100884 ecr 2768025756], length 1314
10:25:26.223254 IP 10.8.3.10.56832 > 185.42.204.236.1935: Flags [.], seq 47438:48752, ack 1, win 501, options [nop,nop,TS val 1516100916 ecr 2768025756], length 1314
10:25:26.287456 IP 10.8.3.10.56832 > 185.42.204.236.1935: Flags [.], seq 48752:50066, ack 1, win 501, options [nop,nop,TS val 1516100980 ecr 2768025756], length 1314
10:25:26.321621 IP 10.8.3.10.56832 > 185.42.204.236.1935: Flags [.], seq 50066:51380, ack 1, win 501, options [nop,nop,TS val 1516101014 ecr 2768025756], length 1314
10:25:26.355452 IP 10.8.3.10.56832 > 185.42.204.236.1935: Flags [.], seq 51380:52694, ack 1, win 501, options [nop,nop,TS val 1516101048 ecr 2768025756], length 1314
10:25:26.418154 IP 10.8.3.10.56832 > 185.42.204.236.1935: Flags [P.], seq 52694:53866, ack 1, win 501, options [nop,nop,TS val 1516101110 ecr 2768025756], length 1172
10:25:26.454135 IP 10.8.3.10.56832 > 185.42.204.236.1935: Flags [.], seq 53866:55180, ack 1, win 501, options [nop,nop,TS val 1516101146 ecr 2768025756], length 1314
10:25:26.488764 IP 10.8.3.10.56832 > 185.42.204.236.1935: Flags [.], seq 55180:56494, ack 1, win 501, options [nop,nop,TS val 1516101181 ecr 2768025756], length 1314
10:25:26.526152 IP 10.8.3.10.56832 > 185.42.204.236.1935: Flags [.], seq 56494:57808, ack 1, win 501, options [nop,nop,TS val 1516101218 ecr 2768025756], length 1314
10:25:26.590581 IP 10.8.3.10.56832 > 185.42.204.236.1935: Flags [.], seq 57808:59122, ack 1, win 501, options [nop,nop,TS val 1516101283 ecr 2768025756], length 1314
10:25:26.625152 IP 10.8.3.10.56832 > 185.42.204.236.1935: Flags [.], seq 59122:60436, ack 1, win 501, options [nop,nop,TS val 1516101317 ecr 2768025756], length 1314
10:25:26.657980 IP 10.8.3.10.56832 > 185.42.204.236.1935: Flags [.], seq 60436:61750, ack 1, win 501, options [nop,nop,TS val 1516101350 ecr 2768025756], length 1314
10:25:26.722396 IP 10.8.3.10.56832 > 185.42.204.236.1935: Flags [.], seq 61750:63064, ack 1, win 501, options [nop,nop,TS val 1516101415 ecr 2768025756], length 1314
10:25:26.757172 IP 10.8.3.10.56832 > 185.42.204.236.1935: Flags [.], seq 63064:64378, ack 1, win 501, options [nop,nop,TS val 1516101449 ecr 2768025756], length 1314
10:25:26.791707 IP 10.8.3.10.56832 > 185.42.204.236.1935: Flags [.], seq 64378:65692, ack 1, win 501, options [nop,nop,TS val 1516101484 ecr 2768025756], length 1314
10:25:27.838159 IP 10.8.3.10.56832 > 185.42.204.236.1935: Flags [.], seq 30866:32180, ack 1, win 501, options [nop,nop,TS val 1516102530 ecr 2768025756], length 1314
10:25:28.112513 IP 185.42.204.236.1935 > 10.8.3.10.56832: Flags [.], ack 33494, win 126, options [nop,nop,TS val 2768025855 ecr 1516100384], length 0
10:25:28.112567 IP 10.8.3.10.56832 > 185.42.204.236.1935: Flags [.], seq 65692:67006, ack 1, win 501, options [nop,nop,TS val 1516102805 ecr 2768025855], length 1314
10:25:28.112570 IP 10.8.3.10.56832 > 185.42.204.236.1935: Flags [P.], seq 67006:68320, ack 1, win 501, options [nop,nop,TS val 1516102805 ecr 2768025855], length 1314
10:25:28.112582 IP 10.8.3.10.56832 > 185.42.204.236.1935: Flags [.], seq 68320:69634, ack 1, win 501, options [nop,nop,TS val 1516102805 ecr 2768025855], length 1314
10:25:28.112583 IP 10.8.3.10.56832 > 185.42.204.236.1935: Flags [P.], seq 69634:70948, ack 1, win 501, options [nop,nop,TS val 1516102805 ecr 2768025855], length 1314
10:25:28.112611 IP 185.42.204.236.1935 > 10.8.3.10.56832: Flags [.], ack 34808, win 126, options [nop,nop,TS val 2768025947 ecr 1516100449], length 0
10:25:28.112627 IP 10.8.3.10.56832 > 185.42.204.236.1935: Flags [.], seq 70948:72262, ack 1, win 501, options [nop,nop,TS val 1516102805 ecr 2768025947], length 1314
10:25:28.112628 IP 10.8.3.10.56832 > 185.42.204.236.1935: Flags [P.], seq 72262:73576, ack 1, win 501, options [nop,nop,TS val 1516102805 ecr 2768025947], length 1314
10:25:28.112646 IP 185.42.204.236.1935 > 10.8.3.10.56832: Flags [.], ack 37436, win 126, options [nop,nop,TS val 2768025988 ecr 1516100514], length 0
10:25:28.112662 IP 10.8.3.10.56832 > 185.42.204.236.1935: Flags [.], seq 73576:74890, ack 1, win 501, options [nop,nop,TS val 1516102805 ecr 2768025988], length 1314
10:25:28.112663 IP 10.8.3.10.56832 > 185.42.204.236.1935: Flags [P.], seq 74890:76204, ack 1, win 501, options [nop,nop,TS val 1516102805 ecr 2768025988], length 1314
10:25:28.112672 IP 10.8.3.10.56832 > 185.42.204.236.1935: Flags [.], seq 76204:77518, ack 1, win 501, options [nop,nop,TS val 1516102805 ecr 2768025988], length 1314
10:25:28.112673 IP 10.8.3.10.56832 > 185.42.204.236.1935: Flags [P.], seq 77518:78832, ack 1, win 501, options [nop,nop,TS val 1516102805 ecr 2768025988], length 1314
10:25:28.112690 IP 185.42.204.236.1935 > 10.8.3.10.56832: Flags [.], ack 38750, win 126, options [nop,nop,TS val 2768026103 ecr 1516100584], length 0
10:25:28.112703 IP 10.8.3.10.56832 > 185.42.204.236.1935: Flags [.], seq 78832:80146, ack 1, win 501, options [nop,nop,TS val 1516102805 ecr 2768026103], length 1314
10:25:28.112704 IP 10.8.3.10.56832 > 185.42.204.236.1935: Flags [P.], seq 80146:81460, ack 1, win 501, options [nop,nop,TS val 1516102805 ecr 2768026103], length 1314
10:25:28.364147 IP 185.42.204.236.1935 > 10.8.3.10.56832: Flags [.], ack 40064, win 126, options [nop,nop,TS val 2768028024 ecr 1516100649], length 0
10:25:28.364171 IP 10.8.3.10.56832 > 185.42.204.236.1935: Flags [.], seq 81460:82774, ack 1, win 501, options [nop,nop,TS val 1516103056 ecr 2768028024], length 1314
10:25:28.364172 IP 10.8.3.10.56832 > 185.42.204.236.1935: Flags [P.], seq 82774:84088, ack 1, win 501, options [nop,nop,TS val 1516103056 ecr 2768028024], length 1314
10:25:28.364186 IP 185.42.204.236.1935 > 10.8.3.10.56832: Flags [.], ack 41378, win 124, options [nop,nop,TS val 2768028024 ecr 1516100683], length 0
10:25:28.364194 IP 10.8.3.10.56832 > 185.42.204.236.1935: Flags [.], seq 84088:85402, ack 1, win 501, options [nop,nop,TS val 1516103057 ecr 2768028024], length 1314
10:25:28.364194 IP 10.8.3.10.56832 > 185.42.204.236.1935: Flags [P.], seq 85402:86716, ack 1, win 501, options [nop,nop,TS val 1516103057 ecr 2768028024], length 1314
10:25:28.364202 IP 185.42.204.236.1935 > 10.8.3.10.56832: Flags [.], ack 42692, win 122, options [nop,nop,TS val 2768028024 ecr 1516100713], length 0
10:25:28.364208 IP 10.8.3.10.56832 > 185.42.204.236.1935: Flags [.], seq 86716:88030, ack 1, win 501, options [nop,nop,TS val 1516103057 ecr 2768028024], length 1314
10:25:28.364209 IP 10.8.3.10.56832 > 185.42.204.236.1935: Flags [P.], seq 88030:89344, ack 1, win 501, options [nop,nop,TS val 1516103057 ecr 2768028024], length 1314
10:25:28.364216 IP 185.42.204.236.1935 > 10.8.3.10.56832: Flags [.], ack 44006, win 120, options [nop,nop,TS val 2768028024 ecr 1516100781], length 0
10:25:28.364223 IP 10.8.3.10.56832 > 185.42.204.236.1935: Flags [.], seq 89344:90658, ack 1, win 501, options [nop,nop,TS val 1516103057 ecr 2768028024], length 1314
10:25:28.364223 IP 10.8.3.10.56832 > 185.42.204.236.1935: Flags [P.], seq 90658:91972, ack 1, win 501, options [nop,nop,TS val 1516103057 ecr 2768028024], length 1314
10:25:28.364230 IP 185.42.204.236.1935 > 10.8.3.10.56832: Flags [.], ack 44810, win 131, options [nop,nop,TS val 2768028024 ecr 1516100789], length 0
10:25:28.364236 IP 10.8.3.10.56832 > 185.42.204.236.1935: Flags [.], seq 91972:93286, ack 1, win 501, options [nop,nop,TS val 1516103057 ecr 2768028024], length 1314
10:25:28.364237 IP 10.8.3.10.56832 > 185.42.204.236.1935: Flags [P.], seq 93286:94600, ack 1, win 501, options [nop,nop,TS val 1516103057 ecr 2768028024], length 1314
10:25:28.364244 IP 185.42.204.236.1935 > 10.8.3.10.56832: Flags [.], ack 46124, win 136, options [nop,nop,TS val 2768028024 ecr 1516100850], length 0
10:25:28.364250 IP 10.8.3.10.56832 > 185.42.204.236.1935: Flags [.], seq 94600:95914, ack 1, win 501, options [nop,nop,TS val 1516103057 ecr 2768028024], length 1314
10:25:28.364251 IP 10.8.3.10.56832 > 185.42.204.236.1935: Flags [P.], seq 95914:97228, ack 1, win 501, options [nop,nop,TS val 1516103057 ecr 2768028024], length 1314
10:25:28.364258 IP 185.42.204.236.1935 > 10.8.3.10.56832: Flags [.], ack 47438, win 142, options [nop,nop,TS val 2768028024 ecr 1516100884], length 0
10:25:28.364275 IP 185.42.204.236.1935 > 10.8.3.10.56832: Flags [.], ack 48752, win 148, options [nop,nop,TS val 2768028024 ecr 1516100916], length 0
10:25:28.364285 IP 185.42.204.236.1935 > 10.8.3.10.56832: Flags [.], ack 50066, win 153, options [nop,nop,TS val 2768028024 ecr 1516100980], length 0
10:25:28.364296 IP 185.42.204.236.1935 > 10.8.3.10.56832: Flags [.], ack 51380, win 155, options [nop,nop,TS val 2768028024 ecr 1516101014], length 0
10:25:28.364307 IP 185.42.204.236.1935 > 10.8.3.10.56832: Flags [.], ack 52694, win 155, options [nop,nop,TS val 2768028024 ecr 1516101048], length 0
10:25:28.364319 IP 185.42.204.236.1935 > 10.8.3.10.56832: Flags [.], ack 53866, win 155, options [nop,nop,TS val 2768028024 ecr 1516101110], length 0
10:25:28.364319 IP 10.8.3.10.56832 > 185.42.204.236.1935: Flags [.], seq 97228:98542, ack 1, win 501, options [nop,nop,TS val 1516103057 ecr 2768028024], length 1314
10:25:28.364327 IP 10.8.3.10.56832 > 185.42.204.236.1935: Flags [P.], seq 98542:98635, ack 1, win 501, options [nop,nop,TS val 1516103057 ecr 2768028024], length 93
10:25:28.364328 IP 185.42.204.236.1935 > 10.8.3.10.56832: Flags [.], ack 55180, win 153, options [nop,nop,TS val 2768028024 ecr 1516101146], length 0
10:25:28.364340 IP 185.42.204.236.1935 > 10.8.3.10.56832: Flags [.], ack 56494, win 155, options [nop,nop,TS val 2768028024 ecr 1516101181], length 0
10:25:28.364354 IP 185.42.204.236.1935 > 10.8.3.10.56832: Flags [.], ack 57808, win 153, options [nop,nop,TS val 2768028024 ecr 1516101218], length 0
10:25:28.364354 IP 10.8.3.10.56832 > 185.42.204.236.1935: Flags [.], seq 98635:99949, ack 1, win 501, options [nop,nop,TS val 1516103057 ecr 2768028024], length 1314
10:25:28.364363 IP 185.42.204.236.1935 > 10.8.3.10.56832: Flags [.], ack 59122, win 155, options [nop,nop,TS val 2768028024 ecr 1516101283], length 0
10:25:28.364376 IP 10.8.3.10.56832 > 185.42.204.236.1935: Flags [.], seq 99949:101263, ack 1, win 501, options [nop,nop,TS val 1516103057 ecr 2768028024], length 1314
10:25:28.364376 IP 185.42.204.236.1935 > 10.8.3.10.56832: Flags [.], ack 60436, win 153, options [nop,nop,TS val 2768028024 ecr 1516101317], length 0
10:25:28.364385 IP 185.42.204.236.1935 > 10.8.3.10.56832: Flags [.], ack 61750, win 155, options [nop,nop,TS val 2768028024 ecr 1516101350], length 0
10:25:28.364395 IP 185.42.204.236.1935 > 10.8.3.10.56832: Flags [.], ack 63064, win 155, options [nop,nop,TS val 2768028024 ecr 1516101415], length 0
10:25:28.364397 IP 10.8.3.10.56832 > 185.42.204.236.1935: Flags [.], seq 101263:102577, ack 1, win 501, options [nop,nop,TS val 1516103057 ecr 2768028024], length 1314
10:25:28.364405 IP 185.42.204.236.1935 > 10.8.3.10.56832: Flags [.], ack 64378, win 155, options [nop,nop,TS val 2768028024 ecr 1516101449], length 0
10:25:28.364417 IP 185.42.204.236.1935 > 10.8.3.10.56832: Flags [.], ack 65692, win 155, options [nop,nop,TS val 2768028024 ecr 1516101484], length 0
10:25:28.364427 IP 185.42.204.236.1935 > 10.8.3.10.56832: Flags [.], ack 65692, win 155, options [nop,nop,TS val 2768028024 ecr 1516101484,nop,nop,sack 1 {30866:32180}], length 0
10:25:28.364429 IP 10.8.3.10.56832 > 185.42.204.236.1935: Flags [.], seq 102577:103891, ack 1, win 501, options [nop,nop,TS val 1516103057 ecr 2768028024], length 1314
10:25:28.364447 IP 10.8.3.10.56832 > 185.42.204.236.1935: Flags [.], seq 103891:105205, ack 1, win 501, options [nop,nop,TS val 1516103057 ecr 2768028024], length 1314
10:25:28.364462 IP 10.8.3.10.56832 > 185.42.204.236.1935: Flags [.], seq 105205:106519, ack 1, win 501, options [nop,nop,TS val 1516103057 ecr 2768028024], length 1314
10:25:28.364483 IP 10.8.3.10.56832 > 185.42.204.236.1935: Flags [.], seq 106519:107833, ack 1, win 501, options [nop,nop,TS val 1516103057 ecr 2768028024], length 1314
10:25:28.364500 IP 10.8.3.10.56832 > 185.42.204.236.1935: Flags [.], seq 107833:109147, ack 1, win 501, options [nop,nop,TS val 1516103057 ecr 2768028024], length 1314
10:25:28.364511 IP 10.8.3.10.56832 > 185.42.204.236.1935: Flags [.], seq 109147:110461, ack 1, win 501, options [nop,nop,TS val 1516103057 ecr 2768028024], length 1314
10:25:28.364534 IP 10.8.3.10.56832 > 185.42.204.236.1935: Flags [.], seq 110461:111775, ack 1, win 501, options [nop,nop,TS val 1516103057 ecr 2768028024], length 1314
10:25:28.387866 IP 10.8.3.10.56832 > 185.42.204.236.1935: Flags [.], seq 111775:113089, ack 1, win 501, options [nop,nop,TS val 1516103080 ecr 2768028024], length 1314
10:25:28.422598 IP 10.8.3.10.56832 > 185.42.204.236.1935: Flags [.], seq 113089:114403, ack 1, win 501, options [nop,nop,TS val 1516103115 ecr 2768028024], length 1314
10:25:28.489864 IP 10.8.3.10.56832 > 185.42.204.236.1935: Flags [.], seq 114403:115717, ack 1, win 501, options [nop,nop,TS val 1516103182 ecr 2768028024], length 1314
10:25:28.523435 IP 10.8.3.10.56832 > 185.42.204.236.1935: Flags [.], seq 115717:117031, ack 1, win 501, options [nop,nop,TS val 1516103216 ecr 2768028024], length 1314
10:25:28.554721 IP 10.8.3.10.56832 > 185.42.204.236.1935: Flags [.], seq 117031:118345, ack 1, win 501, options [nop,nop,TS val 1516103247 ecr 2768028024], length 1314
10:25:28.582401 IP 185.42.204.236.1935 > 10.8.3.10.56832: Flags [.], ack 67006, win 155, options [nop,nop,TS val 2768028242 ecr 1516102805], length 0
10:25:28.582534 IP 185.42.204.236.1935 > 10.8.3.10.56832: Flags [.], ack 68320, win 155, options [nop,nop,TS val 2768028242 ecr 1516102805], length 0
10:25:28.582554 IP 185.42.204.236.1935 > 10.8.3.10.56832: Flags [.], ack 69634, win 153, options [nop,nop,TS val 2768028242 ecr 1516102805], length 0
10:25:28.582744 IP 185.42.204.236.1935 > 10.8.3.10.56832: Flags [.], ack 70948, win 155, options [nop,nop,TS val 2768028242 ecr 1516102805], length 0
10:25:28.582764 IP 185.42.204.236.1935 > 10.8.3.10.56832: Flags [.], ack 72262, win 155, options [nop,nop,TS val 2768028243 ecr 1516102805], length 0
10:25:28.582773 IP 185.42.204.236.1935 > 10.8.3.10.56832: Flags [.], ack 73576, win 155, options [nop,nop,TS val 2768028243 ecr 1516102805], length 0
10:25:28.582782 IP 185.42.204.236.1935 > 10.8.3.10.56832: Flags [.], ack 74890, win 155, options [nop,nop,TS val 2768028243 ecr 1516102805], length 0
10:25:28.582790 IP 185.42.204.236.1935 > 10.8.3.10.56832: Flags [.], ack 76204, win 155, options [nop,nop,TS val 2768028243 ecr 1516102805], length 0
10:25:28.582909 IP 185.42.204.236.1935 > 10.8.3.10.56832: Flags [.], ack 77518, win 155, options [nop,nop,TS val 2768028243 ecr 1516102805], length 0
10:25:28.582928 IP 185.42.204.236.1935 > 10.8.3.10.56832: Flags [.], ack 78832, win 155, options [nop,nop,TS val 2768028243 ecr 1516102805], length 0
10:25:28.582938 IP 185.42.204.236.1935 > 10.8.3.10.56832: Flags [.], ack 80146, win 153, options [nop,nop,TS val 2768028243 ecr 1516102805], length 0
10:25:28.583101 IP 185.42.204.236.1935 > 10.8.3.10.56832: Flags [.], ack 81460, win 155, options [nop,nop,TS val 2768028243 ecr 1516102805], length 0
10:25:28.624883 IP 10.8.3.10.56832 > 185.42.204.236.1935: Flags [.], seq 118345:119659, ack 1, win 501, options [nop,nop,TS val 1516103317 ecr 2768028243], length 1314
10:25:28.658315 IP 10.8.3.10.56832 > 185.42.204.236.1935: Flags [.], seq 119659:120973, ack 1, win 501, options [nop,nop,TS val 1516103351 ecr 2768028243], length 1314
10:25:28.687086 IP 10.8.3.10.56832 > 185.42.204.236.1935: Flags [.], seq 120973:122287, ack 1, win 501, options [nop,nop,TS val 1516103379 ecr 2768028243], length 1314
10:25:28.746787 IP 10.8.3.10.56832 > 185.42.204.236.1935: Flags [.], seq 122287:123601, ack 1, win 501, options [nop,nop,TS val 1516103439 ecr 2768028243], length 1314
10:25:28.791895 IP 10.8.3.10.56832 > 185.42.204.236.1935: Flags [.], seq 123601:124915, ack 1, win 501, options [nop,nop,TS val 1516103484 ecr 2768028243], length 1314
10:25:28.824766 IP 10.8.3.10.56832 > 185.42.204.236.1935: Flags [.], seq 124915:126229, ack 1, win 501, options [nop,nop,TS val 1516103517 ecr 2768028243], length 1314
10:25:28.834193 IP 185.42.204.236.1935 > 10.8.3.10.56832: Flags [.], ack 82774, win 155, options [nop,nop,TS val 2768028494 ecr 1516103056], length 0
10:25:28.834236 IP 185.42.204.236.1935 > 10.8.3.10.56832: Flags [.], ack 84088, win 155, options [nop,nop,TS val 2768028494 ecr 1516103056], length 0
10:25:28.834258 IP 185.42.204.236.1935 > 10.8.3.10.56832: Flags [.], ack 86716, win 153, options [nop,nop,TS val 2768028494 ecr 1516103057], length 0
10:25:28.834277 IP 185.42.204.236.1935 > 10.8.3.10.56832: Flags [.], ack 89344, win 155, options [nop,nop,TS val 2768028494 ecr 1516103057], length 0
10:25:28.834298 IP 185.42.204.236.1935 > 10.8.3.10.56832: Flags [.], ack 91972, win 155, options [nop,nop,TS val 2768028494 ecr 1516103057], length 0
10:25:28.834315 IP 185.42.204.236.1935 > 10.8.3.10.56832: Flags [.], ack 94600, win 155, options [nop,nop,TS val 2768028494 ecr 1516103057], length 0
10:25:28.834334 IP 185.42.204.236.1935 > 10.8.3.10.56832: Flags [.], ack 97228, win 155, options [nop,nop,TS val 2768028494 ecr 1516103057], length 0
10:25:28.834473 IP 185.42.204.236.1935 > 10.8.3.10.56832: Flags [.], ack 98635, win 155, options [nop,nop,TS val 2768028494 ecr 1516103057], length 0
10:25:28.834504 IP 10.8.3.10.56832 > 185.42.204.236.1935: Flags [P.], seq 126229:126534, ack 1, win 501, options [nop,nop,TS val 1516103527 ecr 2768028494], length 305
10:25:28.834532 IP 185.42.204.236.1935 > 10.8.3.10.56832: Flags [.], ack 101263, win 155, options [nop,nop,TS val 2768028494 ecr 1516103057], length 0
10:25:28.834879 IP 185.42.204.236.1935 > 10.8.3.10.56832: Flags [.], ack 105205, win 155, options [nop,nop,TS val 2768028495 ecr 1516103057], length 0
10:25:28.834921 IP 185.42.204.236.1935 > 10.8.3.10.56832: Flags [.], ack 110461, win 155, options [nop,nop,TS val 2768028495 ecr 1516103057], length 0
10:25:28.857586 IP 185.42.204.236.1935 > 10.8.3.10.56832: Flags [.], ack 113089, win 155, options [nop,nop,TS val 2768028517 ecr 1516103057], length 0
10:25:28.889604 IP 10.8.3.10.56832 > 185.42.204.236.1935: Flags [.], seq 126534:127848, ack 1, win 501, options [nop,nop,TS val 1516103582 ecr 2768028517], length 1314
10:25:28.923832 IP 10.8.3.10.56832 > 185.42.204.236.1935: Flags [.], seq 127848:129162, ack 1, win 501, options [nop,nop,TS val 1516103616 ecr 2768028517], length 1314
10:25:28.955580 IP 185.42.204.236.1935 > 10.8.3.10.56832: Flags [.], ack 114403, win 155, options [nop,nop,TS val 2768028615 ecr 1516103115], length 0
10:25:28.961157 IP 10.8.3.10.56832 > 185.42.204.236.1935: Flags [.], seq 129162:130476, ack 1, win 501, options [nop,nop,TS val 1516103653 ecr 2768028615], length 1314
10:25:28.993526 IP 185.42.204.236.1935 > 10.8.3.10.56832: Flags [.], ack 117031, win 155, options [nop,nop,TS val 2768028653 ecr 1516103182], length 0
10:25:29.024076 IP 10.8.3.10.56832 > 185.42.204.236.1935: Flags [.], seq 130476:131790, ack 1, win 501, options [nop,nop,TS val 1516103716 ecr 2768028653], length 1314
10:25:29.058389 IP 10.8.3.10.56832 > 185.42.204.236.1935: Flags [.], seq 131790:133104, ack 1, win 501, options [nop,nop,TS val 1516103751 ecr 2768028653], length 1314
10:25:29.091719 IP 10.8.3.10.56832 > 185.42.204.236.1935: Flags [.], seq 133104:134418, ack 1, win 501, options [nop,nop,TS val 1516103784 ecr 2768028653], length 1314
10:25:29.094741 IP 185.42.204.236.1935 > 10.8.3.10.56832: Flags [.], ack 119659, win 155, options [nop,nop,TS val 2768028755 ecr 1516103247], length 0
10:25:29.156737 IP 185.42.204.236.1935 > 10.8.3.10.56832: Flags [.], ack 122287, win 155, options [nop,nop,TS val 2768028817 ecr 1516103351], length 0
10:25:29.158005 IP 10.8.3.10.56832 > 185.42.204.236.1935: Flags [.], seq 134418:135732, ack 1, win 501, options [nop,nop,TS val 1516103850 ecr 2768028817], length 1314
10:25:29.192010 IP 10.8.3.10.56832 > 185.42.204.236.1935: Flags [.], seq 135732:137046, ack 1, win 501, options [nop,nop,TS val 1516103884 ecr 2768028817], length 1314
10:25:29.224771 IP 10.8.3.10.56832 > 185.42.204.236.1935: Flags [.], seq 137046:138360, ack 1, win 501, options [nop,nop,TS val 1516103917 ecr 2768028817], length 1314
10:25:29.261710 IP 185.42.204.236.1935 > 10.8.3.10.56832: Flags [.], ack 124915, win 155, options [nop,nop,TS val 2768028922 ecr 1516103439], length 0
10:25:29.287754 IP 10.8.3.10.56832 > 185.42.204.236.1935: Flags [.], seq 138360:139674, ack 1, win 501, options [nop,nop,TS val 1516103980 ecr 2768028922], length 1314
10:25:29.304029 IP 185.42.204.236.1935 > 10.8.3.10.56832: Flags [.], ack 126534, win 155, options [nop,nop,TS val 2768028964 ecr 1516103517], length 0
10:25:29.304044 IP 10.8.3.10.56832 > 185.42.204.236.1935: Flags [P.], seq 139674:140480, ack 1, win 501, options [nop,nop,TS val 1516103996 ecr 2768028964], length 806
10:25:29.358025 IP 10.8.3.10.56832 > 185.42.204.236.1935: Flags [.], seq 140480:141794, ack 1, win 501, options [nop,nop,TS val 1516104050 ecr 2768028964], length 1314
10:25:29.389517 IP 10.8.3.10.56832 > 185.42.204.236.1935: Flags [.], seq 141794:143108, ack 1, win 501, options [nop,nop,TS val 1516104082 ecr 2768028964], length 1314
10:25:29.394127 IP 185.42.204.236.1935 > 10.8.3.10.56832: Flags [.], ack 129162, win 155, options [nop,nop,TS val 2768029054 ecr 1516103582], length 0
10:25:29.432116 IP 10.8.3.10.56832 > 185.42.204.236.1935: Flags [.], seq 143108:144422, ack 1, win 501, options [nop,nop,TS val 1516104124 ecr 2768029054], length 1314
10:25:29.490691 IP 10.8.3.10.56832 > 185.42.204.236.1935: Flags [.], seq 144422:145736, ack 1, win 501, options [nop,nop,TS val 1516104183 ecr 2768029054], length 1314
10:25:29.494268 IP 185.42.204.236.1935 > 10.8.3.10.56832: Flags [.], ack 131790, win 160, options [nop,nop,TS val 2768029154 ecr 1516103653], length 0
10:25:29.524026 IP 10.8.3.10.56832 > 185.42.204.236.1935: Flags [.], seq 145736:147050, ack 1, win 501, options [nop,nop,TS val 1516104216 ecr 2768029154], length 1314
10:25:29.528730 IP 185.42.204.236.1935 > 10.8.3.10.56832: Flags [.], ack 133104, win 166, options [nop,nop,TS val 2768029188 ecr 1516103751], length 0
10:25:29.560642 IP 10.8.3.10.56832 > 185.42.204.236.1935: Flags [.], seq 147050:148364, ack 1, win 501, options [nop,nop,TS val 1516104253 ecr 2768029188], length 1314
10:25:29.561689 IP 185.42.204.236.1935 > 10.8.3.10.56832: Flags [.], ack 134418, win 172, options [nop,nop,TS val 2768029222 ecr 1516103784], length 0
10:25:29.624362 IP 10.8.3.10.56832 > 185.42.204.236.1935: Flags [.], seq 148364:149678, ack 1, win 501, options [nop,nop,TS val 1516104317 ecr 2768029222], length 1314
10:25:29.628243 IP 185.42.204.236.1935 > 10.8.3.10.56832: Flags [.], ack 135732, win 177, options [nop,nop,TS val 2768029288 ecr 1516103850], length 0
10:25:29.654931 IP 10.8.3.10.56832 > 185.42.204.236.1935: Flags [.], seq 149678:150992, ack 1, win 501, options [nop,nop,TS val 1516104347 ecr 2768029288], length 1314
10:25:29.661987 IP 185.42.204.236.1935 > 10.8.3.10.56832: Flags [.], ack 137046, win 183, options [nop,nop,TS val 2768029322 ecr 1516103884], length 0
10:25:29.691792 IP 10.8.3.10.56832 > 185.42.204.236.1935: Flags [.], seq 150992:152306, ack 1, win 501, options [nop,nop,TS val 1516104384 ecr 2768029322], length 1314
10:25:29.694645 IP 185.42.204.236.1935 > 10.8.3.10.56832: Flags [.], ack 138360, win 189, options [nop,nop,TS val 2768029354 ecr 1516103917], length 0
10:25:29.757467 IP 185.42.204.236.1935 > 10.8.3.10.56832: Flags [.], ack 139674, win 194, options [nop,nop,TS val 2768029417 ecr 1516103980], length 0
10:25:29.758344 IP 10.8.3.10.56832 > 185.42.204.236.1935: Flags [.], seq 152306:153620, ack 1, win 501, options [nop,nop,TS val 1516104451 ecr 2768029417], length 1314
10:25:29.773663 IP 185.42.204.236.1935 > 10.8.3.10.56832: Flags [.], ack 140480, win 199, options [nop,nop,TS val 2768029434 ecr 1516103996], length 0
10:25:29.773701 IP 10.8.3.10.56832 > 185.42.204.236.1935: Flags [P.], seq 153620:154345, ack 1, win 501, options [nop,nop,TS val 1516104466 ecr 2768029434], length 725
10:25:29.824780 IP 10.8.3.10.56832 > 185.42.204.236.1935: Flags [.], seq 154345:155659, ack 1, win 501, options [nop,nop,TS val 1516104517 ecr 2768029434], length 1314
10:25:29.828063 IP 185.42.204.236.1935 > 10.8.3.10.56832: Flags [.], ack 141794, win 205, options [nop,nop,TS val 2768029488 ecr 1516104050], length 0
10:25:29.859453 IP 185.42.204.236.1935 > 10.8.3.10.56832: Flags [.], ack 143108, win 211, options [nop,nop,TS val 2768029519 ecr 1516104082], length 0
10:25:29.859773 IP 10.8.3.10.56832 > 185.42.204.236.1935: Flags [.], seq 155659:156973, ack 1, win 501, options [nop,nop,TS val 1516104552 ecr 2768029519], length 1314
10:25:29.887149 IP 10.8.3.10.56832 > 185.42.204.236.1935: Flags [.], seq 156973:158287, ack 1, win 501, options [nop,nop,TS val 1516104579 ecr 2768029519], length 1314
10:25:29.901837 IP 185.42.204.236.1935 > 10.8.3.10.56832: Flags [.], ack 144422, win 216, options [nop,nop,TS val 2768029562 ecr 1516104124], length 0
10:25:29.957999 IP 10.8.3.10.56832 > 185.42.204.236.1935: Flags [.], seq 158287:159601, ack 1, win 501, options [nop,nop,TS val 1516104650 ecr 2768029562], length 1314
10:25:29.960683 IP 185.42.204.236.1935 > 10.8.3.10.56832: Flags [.], ack 145736, win 222, options [nop,nop,TS val 2768029621 ecr 1516104183], length 0
10:25:29.991157 IP 10.8.3.10.56832 > 185.42.204.236.1935: Flags [.], seq 159601:160915, ack 1, win 501, options [nop,nop,TS val 1516104683 ecr 2768029621], length 1314
10:25:29.993740 IP 185.42.204.236.1935 > 10.8.3.10.56832: Flags [.], ack 147050, win 228, options [nop,nop,TS val 2768029654 ecr 1516104216], length 0
10:25:30.020735 IP 10.8.3.10.56832 > 185.42.204.236.1935: Flags [.], seq 160915:162229, ack 1, win 501, options [nop,nop,TS val 1516104713 ecr 2768029654], length 1314
10:25:30.031033 IP 185.42.204.236.1935 > 10.8.3.10.56832: Flags [.], ack 148364, win 233, options [nop,nop,TS val 2768029690 ecr 1516104253], length 0
10:25:30.091929 IP 10.8.3.10.56832 > 185.42.204.236.1935: Flags [.], seq 162229:163543, ack 1, win 501, options [nop,nop,TS val 1516104784 ecr 2768029690], length 1314
10:25:30.094394 IP 185.42.204.236.1935 > 10.8.3.10.56832: Flags [.], ack 149678, win 239, options [nop,nop,TS val 2768029754 ecr 1516104317], length 0
10:25:30.124844 IP 185.42.204.236.1935 > 10.8.3.10.56832: Flags [.], ack 150992, win 245, options [nop,nop,TS val 2768029785 ecr 1516104347], length 0
10:25:30.124925 IP 10.8.3.10.56832 > 185.42.204.236.1935: Flags [.], seq 163543:164857, ack 1, win 501, options [nop,nop,TS val 1516104817 ecr 2768029785], length 1314
10:25:30.158599 IP 10.8.3.10.56832 > 185.42.204.236.1935: Flags [.], seq 164857:166171, ack 1, win 501, options [nop,nop,TS val 1516104851 ecr 2768029785], length 1314
10:25:30.161795 IP 185.42.204.236.1935 > 10.8.3.10.56832: Flags [.], ack 152306, win 250, options [nop,nop,TS val 2768029822 ecr 1516104384], length 0
10:25:30.222395 IP 10.8.3.10.56832 > 185.42.204.236.1935: Flags [.], seq 166171:167485, ack 1, win 501, options [nop,nop,TS val 1516104915 ecr 2768029822], length 1314
10:25:30.227973 IP 185.42.204.236.1935 > 10.8.3.10.56832: Flags [.], ack 153620, win 256, options [nop,nop,TS val 2768029888 ecr 1516104451], length 0
10:25:30.243460 IP 185.42.204.236.1935 > 10.8.3.10.56832: Flags [.], ack 154345, win 261, options [nop,nop,TS val 2768029903 ecr 1516104466], length 0
10:25:30.243473 IP 10.8.3.10.56832 > 185.42.204.236.1935: Flags [P.], seq 167485:168284, ack 1, win 501, options [nop,nop,TS val 1516104936 ecr 2768029903], length 799
10:25:30.288052 IP 10.8.3.10.56832 > 185.42.204.236.1935: Flags [.], seq 168284:169598, ack 1, win 501, options [nop,nop,TS val 1516104980 ecr 2768029903], length 1314
10:25:30.294399 IP 185.42.204.236.1935 > 10.8.3.10.56832: Flags [.], ack 155659, win 267, options [nop,nop,TS val 2768029955 ecr 1516104517], length 0
10:25:30.324398 IP 10.8.3.10.56832 > 185.42.204.236.1935: Flags [.], seq 169598:170912, ack 1, win 501, options [nop,nop,TS val 1516105017 ecr 2768029955], length 1314
10:25:30.329855 IP 185.42.204.236.1935 > 10.8.3.10.56832: Flags [.], ack 156973, win 272, options [nop,nop,TS val 2768029990 ecr 1516104552], length 0
10:25:30.356810 IP 185.42.204.236.1935 > 10.8.3.10.56832: Flags [.], ack 158287, win 278, options [nop,nop,TS val 2768030017 ecr 1516104579], length 0
10:25:30.358109 IP 10.8.3.10.56832 > 185.42.204.236.1935: Flags [.], seq 170912:172226, ack 1, win 501, options [nop,nop,TS val 1516105050 ecr 2768030017], length 1314
10:25:30.420669 IP 10.8.3.10.56832 > 185.42.204.236.1935: Flags [.], seq 172226:173540, ack 1, win 501, options [nop,nop,TS val 1516105113 ecr 2768030017], length 1314
10:25:30.427772 IP 185.42.204.236.1935 > 10.8.3.10.56832: Flags [.], ack 159601, win 284, options [nop,nop,TS val 2768030088 ecr 1516104650], length 0
10:25:30.456749 IP 10.8.3.10.56832 > 185.42.204.236.1935: Flags [.], seq 173540:174854, ack 1, win 501, options [nop,nop,TS val 1516105149 ecr 2768030088], length 1314
10:25:30.460964 IP 185.42.204.236.1935 > 10.8.3.10.56832: Flags [.], ack 160915, win 289, options [nop,nop,TS val 2768030121 ecr 1516104683], length 0
10:25:30.490640 IP 185.42.204.236.1935 > 10.8.3.10.56832: Flags [.], ack 162229, win 295, options [nop,nop,TS val 2768030150 ecr 1516104713], length 0
10:25:30.491127 IP 10.8.3.10.56832 > 185.42.204.236.1935: Flags [.], seq 174854:176168, ack 1, win 501, options [nop,nop,TS val 1516105183 ecr 2768030150], length 1314
10:25:30.558288 IP 10.8.3.10.56832 > 185.42.204.236.1935: Flags [.], seq 176168:177482, ack 1, win 501, options [nop,nop,TS val 1516105251 ecr 2768030150], length 1314
10:25:30.561780 IP 185.42.204.236.1935 > 10.8.3.10.56832: Flags [.], ack 163543, win 301, options [nop,nop,TS val 2768030222 ecr 1516104784], length 0
10:25:30.591615 IP 10.8.3.10.56832 > 185.42.204.236.1935: Flags [.], seq 177482:178796, ack 1, win 501, options [nop,nop,TS val 1516105284 ecr 2768030222], length 1314
10:25:30.595403 IP 185.42.204.236.1935 > 10.8.3.10.56832: Flags [.], ack 164857, win 306, options [nop,nop,TS val 2768030255 ecr 1516104817], length 0
10:25:30.622382 IP 10.8.3.10.56832 > 185.42.204.236.1935: Flags [.], seq 178796:180110, ack 1, win 501, options [nop,nop,TS val 1516105315 ecr 2768030255], length 1314
10:25:30.628389 IP 185.42.204.236.1935 > 10.8.3.10.56832: Flags [.], ack 166171, win 312, options [nop,nop,TS val 2768030289 ecr 1516104851], length 0
10:25:30.691386 IP 10.8.3.10.56832 > 185.42.204.236.1935: Flags [.], seq 180110:181424, ack 1, win 501, options [nop,nop,TS val 1516105384 ecr 2768030289], length 1314
