17:08:30.560186 IP 99.181.91.33.1935 > 10.8.2.4.40018: Flags [.], ack 476895617, win 126, options [nop,nop,TS val 4090641027 ecr 762143253], length 0
17:08:30.567325 IP 10.8.2.4.40018 > 99.181.91.33.1935: Flags [.], seq 13681:14995, ack 0, win 501, options [nop,nop,TS val 762143796 ecr 4090641027], length 1314
17:08:30.602819 IP 10.8.2.4.40018 > 99.181.91.33.1935: Flags [.], seq 14995:16309, ack 0, win 501, options [nop,nop,TS val 762143832 ecr 4090641027], length 1314
17:08:30.666412 IP 10.8.2.4.40018 > 99.181.91.33.1935: Flags [.], seq 16309:17623, ack 0, win 501, options [nop,nop,TS val 762143895 ecr 4090641027], length 1314
17:08:30.671636 IP 99.181.91.33.1935 > 10.8.2.4.40018: Flags [.], ack 1315, win 126, options [nop,nop,TS val 4090641138 ecr 762143317], length 0
17:08:30.700247 IP 10.8.2.4.40018 > 99.181.91.33.1935: Flags [.], seq 17623:18937, ack 0, win 501, options [nop,nop,TS val 762143929 ecr 4090641138], length 1314
17:08:30.714265 IP 99.181.91.33.1935 > 10.8.2.4.40018: Flags [.], ack 3943, win 126, options [nop,nop,TS val 4090641181 ecr 762143395], length 0
17:08:30.732157 IP 10.8.2.4.40018 > 99.181.91.33.1935: Flags [.], seq 18937:20251, ack 0, win 501, options [nop,nop,TS val 762143961 ecr 4090641181], length 1314
17:08:30.799595 IP 10.8.2.4.40018 > 99.181.91.33.1935: Flags [.], seq 20251:21565, ack 0, win 501, options [nop,nop,TS val 762144028 ecr 4090641181], length 1314
17:08:30.815283 IP 99.181.91.33.1935 > 10.8.2.4.40018: Flags [.], ack 6571, win 126, options [nop,nop,TS val 4090641282 ecr 762143462], length 0
17:08:30.833561 IP 10.8.2.4.40018 > 99.181.91.33.1935: Flags [.], seq 21565:22879, ack 0, win 501, options [nop,nop,TS val 762144062 ecr 4090641282], length 1314
17:08:30.866988 IP 10.8.2.4.40018 > 99.181.91.33.1935: Flags [.], seq 22879:24193, ack 0, win 501, options [nop,nop,TS val 762144096 ecr 4090641282], length 1314
17:08:30.880762 IP 99.181.91.33.1935 > 10.8.2.4.40018: Flags [.], ack 9199, win 126, options [nop,nop,TS val 4090641347 ecr 762143562], length 0
17:08:30.932505 IP 10.8.2.4.40018 > 99.181.91.33.1935: Flags [.], seq 24193:25507, ack 0, win 501, options [nop,nop,TS val 762144161 ecr 4090641347], length 1314
17:08:30.967118 IP 10.8.2.4.40018 > 99.181.91.33.1935: Flags [.], seq 25507:26821, ack 0, win 501, options [nop,nop,TS val 762144196 ecr 4090641347], length 1314
17:08:30.980920 IP 99.181.91.33.1935 > 10.8.2.4.40018: Flags [.], ack 11827, win 126, options [nop,nop,TS val 4090641447 ecr 762143662], length 0
17:08:30.991280 IP 99.181.91.33.1935 > 10.8.2.4.40018: Flags [.], ack 12367, win 126, options [nop,nop,TS val 4090641458 ecr 762143706], length 0
17:08:30.991308 IP 10.8.2.4.40018 > 99.181.91.33.1935: Flags [P.], seq 26821:27349, ack 0, win 501, options [nop,nop,TS val 762144220 ecr 4090641458], length 528
17:08:31.030948 IP 10.8.2.4.40018 > 99.181.91.33.1935: Flags [.], seq 27349:28663, ack 0, win 501, options [nop,nop,TS val 762144260 ecr 4090641458], length 1314
17:08:31.066874 IP 10.8.2.4.40018 > 99.181.91.33.1935: Flags [.], seq 28663:29977, ack 0, win 501, options [nop,nop,TS val 762144296 ecr 4090641458], length 1314
17:08:31.081624 IP 99.181.91.33.1935 > 10.8.2.4.40018: Flags [.], ack 14995, win 126, options [nop,nop,TS val 4090641548 ecr 762143760], length 0
17:08:31.116673 IP 10.8.2.4.40018 > 99.181.91.33.1935: Flags [.], seq 29977:31291, ack 0, win 501, options [nop,nop,TS val 762144345 ecr 4090641548], length 1314
17:08:31.164964 IP 10.8.2.4.40018 > 99.181.91.33.1935: Flags [.], seq 31291:32605, ack 0, win 501, options [nop,nop,TS val 762144394 ecr 4090641548], length 1314
17:08:31.180963 IP 99.181.91.33.1935 > 10.8.2.4.40018: Flags [.], ack 17623, win 126, options [nop,nop,TS val 4090641647 ecr 762143832], length 0
17:08:31.199318 IP 10.8.2.4.40018 > 99.181.91.33.1935: Flags [.], seq 32605:33919, ack 0, win 501, options [nop,nop,TS val 762144428 ecr 4090641647], length 1314
17:08:31.245239 IP 10.8.2.4.40018 > 99.181.91.33.1935: Flags [.], seq 33919:35233, ack 0, win 501, options [nop,nop,TS val 762144474 ecr 4090641647], length 1314
17:08:31.246615 IP 99.181.91.33.1935 > 10.8.2.4.40018: Flags [.], ack 20251, win 126, options [nop,nop,TS val 4090641713 ecr 762143929], length 0
17:08:31.299570 IP 10.8.2.4.40018 > 99.181.91.33.1935: Flags [.], seq 35233:36547, ack 0, win 501, options [nop,nop,TS val 762144528 ecr 4090641713], length 1314
17:08:31.330731 IP 10.8.2.4.40018 > 99.181.91.33.1935: Flags [.], seq 36547:37861, ack 0, win 501, options [nop,nop,TS val 762144559 ecr 4090641713], length 1314
17:08:31.348128 IP 99.181.91.33.1935 > 10.8.2.4.40018: Flags [.], ack 22879, win 126, options [nop,nop,TS val 4090641815 ecr 762144028], length 0
17:08:31.373119 IP 10.8.2.4.40018 > 99.181.91.33.1935: Flags [.], seq 37861:39175, ack 0, win 501, options [nop,nop,TS val 762144602 ecr 4090641815], length 1314
17:08:31.433258 IP 10.8.2.4.40018 > 99.181.91.33.1935: Flags [.], seq 39175:40489, ack 0, win 501, options [nop,nop,TS val 762144662 ecr 4090641815], length 1314
17:08:31.447220 IP 99.181.91.33.1935 > 10.8.2.4.40018: Flags [.], ack 25507, win 126, options [nop,nop,TS val 4090641914 ecr 762144096], length 0
17:08:31.466574 IP 10.8.2.4.40018 > 99.181.91.33.1935: Flags [.], seq 40489:41803, ack 0, win 501, options [nop,nop,TS val 762144695 ecr 4090641914], length 1314
17:08:31.502136 IP 10.8.2.4.40018 > 99.181.91.33.1935: Flags [.], seq 41803:43117, ack 0, win 501, options [nop,nop,TS val 762144731 ecr 4090641914], length 1314
17:08:31.505724 IP 99.181.91.33.1935 > 10.8.2.4.40018: Flags [.], ack 27349, win 126, options [nop,nop,TS val 4090641972 ecr 762144196], length 0
17:08:31.505766 IP 10.8.2.4.40018 > 99.181.91.33.1935: Flags [P.], seq 43117:43178, ack 0, win 501, options [nop,nop,TS val 762144734 ecr 4090641972], length 61
17:08:31.566228 IP 10.8.2.4.40018 > 99.181.91.33.1935: Flags [.], seq 43178:44492, ack 0, win 501, options [nop,nop,TS val 762144795 ecr 4090641972], length 1314
17:08:31.581297 IP 99.181.91.33.1935 > 10.8.2.4.40018: Flags [.], ack 29977, win 126, options [nop,nop,TS val 4090642048 ecr 762144260], length 0
17:08:31.597740 IP 10.8.2.4.40018 > 99.181.91.33.1935: Flags [.], seq 44492:45806, ack 0, win 501, options [nop,nop,TS val 762144826 ecr 4090642048], length 1314
17:08:31.631078 IP 10.8.2.4.40018 > 99.181.91.33.1935: Flags [.], seq 45806:47120, ack 0, win 501, options [nop,nop,TS val 762144860 ecr 4090642048], length 1314
17:08:31.679390 IP 99.181.91.33.1935 > 10.8.2.4.40018: Flags [.], ack 32605, win 126, options [nop,nop,TS val 4090642146 ecr 762144345], length 0
17:08:31.696542 IP 10.8.2.4.40018 > 99.181.91.33.1935: Flags [.], seq 47120:48434, ack 0, win 501, options [nop,nop,TS val 762144925 ecr 4090642146], length 1314
17:08:31.733052 IP 10.8.2.4.40018 > 99.181.91.33.1935: Flags [.], seq 48434:49748, ack 0, win 501, options [nop,nop,TS val 762144962 ecr 4090642146], length 1314
17:08:31.759627 IP 99.181.91.33.1935 > 10.8.2.4.40018: Flags [.], ack 35233, win 126, options [nop,nop,TS val 4090642226 ecr 762144428], length 0
17:08:31.766415 IP 10.8.2.4.40018 > 99.181.91.33.1935: Flags [.], seq 49748:51062, ack 0, win 501, options [nop,nop,TS val 762144995 ecr 4090642226], length 1314
17:08:31.829498 IP 10.8.2.4.40018 > 99.181.91.33.1935: Flags [.], seq 51062:52376, ack 0, win 501, options [nop,nop,TS val 762145058 ecr 4090642226], length 1314
17:08:31.845131 IP 99.181.91.33.1935 > 10.8.2.4.40018: Flags [.], ack 37861, win 126, options [nop,nop,TS val 4090642311 ecr 762144528], length 0
17:08:31.863894 IP 10.8.2.4.40018 > 99.181.91.33.1935: Flags [.], seq 52376:53690, ack 0, win 501, options [nop,nop,TS val 762145093 ecr 4090642311], length 1314
17:08:31.896811 IP 10.8.2.4.40018 > 99.181.91.33.1935: Flags [.], seq 53690:55004, ack 0, win 501, options [nop,nop,TS val 762145125 ecr 4090642311], length 1314
17:08:31.947803 IP 99.181.91.33.1935 > 10.8.2.4.40018: Flags [.], ack 40489, win 126, options [nop,nop,TS val 4090642414 ecr 762144602], length 0
17:08:31.964589 IP 10.8.2.4.40018 > 99.181.91.33.1935: Flags [.], seq 55004:56318, ack 0, win 501, options [nop,nop,TS val 762145193 ecr 4090642414], length 1314
17:08:31.998241 IP 10.8.2.4.40018 > 99.181.91.33.1935: Flags [.], seq 56318:57632, ack 0, win 501, options [nop,nop,TS val 762145227 ecr 4090642414], length 1314
17:08:32.016652 IP 99.181.91.33.1935 > 10.8.2.4.40018: Flags [.], ack 43117, win 126, options [nop,nop,TS val 4090642483 ecr 762144695], length 0
17:08:32.019999 IP 99.181.91.33.1935 > 10.8.2.4.40018: Flags [.], ack 43178, win 126, options [nop,nop,TS val 4090642486 ecr 762144734], length 0
17:08:32.020013 IP 10.8.2.4.40018 > 99.181.91.33.1935: Flags [P.], seq 57632:58177, ack 0, win 501, options [nop,nop,TS val 762145249 ecr 4090642486], length 545
17:08:32.066766 IP 10.8.2.4.40018 > 99.181.91.33.1935: Flags [.], seq 58177:59491, ack 0, win 501, options [nop,nop,TS val 762145295 ecr 4090642486], length 1314
17:08:32.098618 IP 10.8.2.4.40018 > 99.181.91.33.1935: Flags [.], seq 59491:60805, ack 0, win 501, options [nop,nop,TS val 762145327 ecr 4090642486], length 1314
17:08:32.112376 IP 99.181.91.33.1935 > 10.8.2.4.40018: Flags [.], ack 45806, win 126, options [nop,nop,TS val 4090642579 ecr 762144795], length 0
17:08:32.140863 IP 10.8.2.4.40018 > 99.181.91.33.1935: Flags [.], seq 60805:62119, ack 0, win 501, options [nop,nop,TS val 762145370 ecr 4090642579], length 1314
17:08:32.200463 IP 10.8.2.4.40018 > 99.181.91.33.1935: Flags [.], seq 62119:63433, ack 0, win 501, options [nop,nop,TS val 762145429 ecr 4090642579], length 1314
17:08:32.207657 IP 99.181.91.33.1935 > 10.8.2.4.40018: Flags [.], ack 47120, win 126, options [nop,nop,TS val 4090642674 ecr 762144860], length 0
17:08:32.231986 IP 10.8.2.4.40018 > 99.181.91.33.1935: Flags [.], seq 63433:64747, ack 0, win 501, options [nop,nop,TS val 762145461 ecr 4090642674], length 1314
17:08:32.247453 IP 99.181.91.33.1935 > 10.8.2.4.40018: Flags [.], ack 49748, win 126, options [nop,nop,TS val 4090642714 ecr 762144925], length 0
17:08:32.269068 IP 10.8.2.4.40018 > 99.181.91.33.1935: Flags [.], seq 64747:66061, ack 0, win 501, options [nop,nop,TS val 762145498 ecr 4090642714], length 1314
17:08:32.333455 IP 10.8.2.4.40018 > 99.181.91.33.1935: Flags [.], seq 66061:67375, ack 0, win 501, options [nop,nop,TS val 762145562 ecr 4090642714], length 1314
17:08:32.343760 IP 99.181.91.33.1935 > 10.8.2.4.40018: Flags [.], ack 52376, win 126, options [nop,nop,TS val 4090642810 ecr 762144995], length 0
17:08:32.365276 IP 10.8.2.4.40018 > 99.181.91.33.1935: Flags [.], seq 67375:68689, ack 0, win 501, options [nop,nop,TS val 762145594 ecr 4090642810], length 1314
17:08:32.400565 IP 10.8.2.4.40018 > 99.181.91.33.1935: Flags [.], seq 68689:70003, ack 0, win 501, options [nop,nop,TS val 762145629 ecr 4090642810], length 1314
17:08:32.411297 IP 99.181.91.33.1935 > 10.8.2.4.40018: Flags [.], ack 55004, win 126, options [nop,nop,TS val 4090642878 ecr 762145093], length 0
17:08:32.465035 IP 10.8.2.4.40018 > 99.181.91.33.1935: Flags [.], seq 70003:71317, ack 0, win 501, options [nop,nop,TS val 762145694 ecr 4090642878], length 1314
17:08:32.498571 IP 10.8.2.4.40018 > 99.181.91.33.1935: Flags [.], seq 71317:72631, ack 0, win 501, options [nop,nop,TS val 762145727 ecr 4090642878], length 1314
17:08:32.512573 IP 99.181.91.33.1935 > 10.8.2.4.40018: Flags [.], ack 57632, win 126, options [nop,nop,TS val 4090642979 ecr 762145193], length 0
17:08:32.533308 IP 10.8.2.4.40018 > 99.181.91.33.1935: Flags [.], seq 72631:73945, ack 0, win 501, options [nop,nop,TS val 762145762 ecr 4090642979], length 1314
17:08:32.534223 IP 99.181.91.33.1935 > 10.8.2.4.40018: Flags [.], ack 58177, win 126, options [nop,nop,TS val 4090643001 ecr 762145249], length 0
17:08:32.534266 IP 10.8.2.4.40018 > 99.181.91.33.1935: Flags [P.], seq 73945:74003, ack 0, win 501, options [nop,nop,TS val 762145763 ecr 4090643001], length 58
17:08:32.597019 IP 10.8.2.4.40018 > 99.181.91.33.1935: Flags [.], seq 74003:75317, ack 0, win 501, options [nop,nop,TS val 762145826 ecr 4090643001], length 1314
17:08:32.612973 IP 99.181.91.33.1935 > 10.8.2.4.40018: Flags [.], ack 60805, win 126, options [nop,nop,TS val 4090643079 ecr 762145295], length 0
17:08:32.632375 IP 10.8.2.4.40018 > 99.181.91.33.1935: Flags [.], seq 75317:76631, ack 0, win 501, options [nop,nop,TS val 762145861 ecr 4090643079], length 1314
17:08:32.665068 IP 10.8.2.4.40018 > 99.181.91.33.1935: Flags [.], seq 76631:77945, ack 0, win 501, options [nop,nop,TS val 762145894 ecr 4090643079], length 1314
17:08:32.715710 IP 99.181.91.33.1935 > 10.8.2.4.40018: Flags [.], ack 63433, win 126, options [nop,nop,TS val 4090643181 ecr 762145370], length 0
17:08:32.734420 IP 10.8.2.4.40018 > 99.181.91.33.1935: Flags [.], seq 77945:79259, ack 0, win 501, options [nop,nop,TS val 762145963 ecr 4090643181], length 1314
17:08:32.765192 IP 10.8.2.4.40018 > 99.181.91.33.1935: Flags [.], seq 79259:80573, ack 0, win 501, options [nop,nop,TS val 762145994 ecr 4090643181], length 1314
17:08:32.783764 IP 99.181.91.33.1935 > 10.8.2.4.40018: Flags [.], ack 66061, win 126, options [nop,nop,TS val 4090643250 ecr 762145461], length 0
17:08:32.799231 IP 10.8.2.4.40018 > 99.181.91.33.1935: Flags [.], seq 80573:81887, ack 0, win 501, options [nop,nop,TS val 762146028 ecr 4090643250], length 1314
17:08:32.867379 IP 10.8.2.4.40018 > 99.181.91.33.1935: Flags [.], seq 81887:83201, ack 0, win 501, options [nop,nop,TS val 762146096 ecr 4090643250], length 1314
17:08:32.879730 IP 99.181.91.33.1935 > 10.8.2.4.40018: Flags [.], ack 68689, win 126, options [nop,nop,TS val 4090643346 ecr 762145562], length 0
17:08:32.897384 IP 10.8.2.4.40018 > 99.181.91.33.1935: Flags [.], seq 83201:84515, ack 0, win 501, options [nop,nop,TS val 762146126 ecr 4090643346], length 1314
17:08:32.931791 IP 10.8.2.4.40018 > 99.181.91.33.1935: Flags [.], seq 84515:85829, ack 0, win 501, options [nop,nop,TS val 762146160 ecr 4090643346], length 1314
17:08:32.979430 IP 99.181.91.33.1935 > 10.8.2.4.40018: Flags [.], ack 71317, win 126, options [nop,nop,TS val 4090643446 ecr 762145629], length 0
17:08:32.999419 IP 10.8.2.4.40018 > 99.181.91.33.1935: Flags [.], seq 85829:87143, ack 0, win 501, options [nop,nop,TS val 762146228 ecr 4090643446], length 1314
17:08:33.032390 IP 10.8.2.4.40018 > 99.181.91.33.1935: Flags [.], seq 87143:88457, ack 0, win 501, options [nop,nop,TS val 762146261 ecr 4090643446], length 1314
17:08:33.047807 IP 99.181.91.33.1935 > 10.8.2.4.40018: Flags [.], ack 73945, win 126, options [nop,nop,TS val 4090643514 ecr 762145727], length 0
17:08:33.048385 IP 99.181.91.33.1935 > 10.8.2.4.40018: Flags [.], ack 74003, win 126, options [nop,nop,TS val 4090643515 ecr 762145763], length 0
17:08:33.048406 IP 10.8.2.4.40018 > 99.181.91.33.1935: Flags [P.], seq 88457:88989, ack 0, win 501, options [nop,nop,TS val 762146277 ecr 4090643515], length 532
17:08:33.101974 IP 10.8.2.4.40018 > 99.181.91.33.1935: Flags [.], seq 88989:90303, ack 0, win 501, options [nop,nop,TS val 762146331 ecr 4090643515], length 1314
17:08:33.133538 IP 10.8.2.4.40018 > 99.181.91.33.1935: Flags [.], seq 90303:91617, ack 0, win 501, options [nop,nop,TS val 762146362 ecr 4090643515], length 1314
17:08:33.147018 IP 99.181.91.33.1935 > 10.8.2.4.40018: Flags [.], ack 76631, win 126, options [nop,nop,TS val 4090643613 ecr 762145826], length 0
17:08:33.166095 IP 10.8.2.4.40018 > 99.181.91.33.1935: Flags [.], seq 91617:92931, ack 0, win 501, options [nop,nop,TS val 762146395 ecr 4090643613], length 1314
17:08:33.229626 IP 10.8.2.4.40018 > 99.181.91.33.1935: Flags [.], seq 92931:94245, ack 0, win 501, options [nop,nop,TS val 762146458 ecr 4090643613], length 1314
17:08:33.243590 IP 99.181.91.33.1935 > 10.8.2.4.40018: Flags [.], ack 77945, win 126, options [nop,nop,TS val 4090643710 ecr 762145894], length 0
17:08:33.265014 IP 10.8.2.4.40018 > 99.181.91.33.1935: Flags [.], seq 94245:95559, ack 0, win 501, options [nop,nop,TS val 762146494 ecr 4090643710], length 1314
17:08:33.279859 IP 99.181.91.33.1935 > 10.8.2.4.40018: Flags [.], ack 80573, win 126, options [nop,nop,TS val 4090643746 ecr 762145963], length 0
17:08:33.300057 IP 10.8.2.4.40018 > 99.181.91.33.1935: Flags [.], seq 95559:96873, ack 0, win 501, options [nop,nop,TS val 762146529 ecr 4090643746], length 1314
17:08:33.366118 IP 10.8.2.4.40018 > 99.181.91.33.1935: Flags [.], seq 96873:98187, ack 0, win 501, options [nop,nop,TS val 762146595 ecr 4090643746], length 1314
17:08:33.381433 IP 99.181.91.33.1935 > 10.8.2.4.40018: Flags [.], ack 83201, win 126, options [nop,nop,TS val 4090643848 ecr 762146028], length 0
17:08:33.401012 IP 10.8.2.4.40018 > 99.181.91.33.1935: Flags [.], seq 98187:99501, ack 0, win 501, options [nop,nop,TS val 762146630 ecr 4090643848], length 1314
17:08:33.430930 IP 10.8.2.4.40018 > 99.181.91.33.1935: Flags [.], seq 99501:100815, ack 0, win 501, options [nop,nop,TS val 762146660 ecr 4090643848], length 1314
17:08:33.446371 IP 99.181.91.33.1935 > 10.8.2.4.40018: Flags [.], ack 85829, win 126, options [nop,nop,TS val 4090643913 ecr 762146126], length 0
17:08:33.500091 IP 10.8.2.4.40018 > 99.181.91.33.1935: Flags [.], seq 100815:102129, ack 0, win 501, options [nop,nop,TS val 762146729 ecr 4090643913], length 1314
17:08:33.533543 IP 10.8.2.4.40018 > 99.181.91.33.1935: Flags [.], seq 102129:103443, ack 0, win 501, options [nop,nop,TS val 762146762 ecr 4090643913], length 1314
17:08:33.546866 IP 99.181.91.33.1935 > 10.8.2.4.40018: Flags [.], ack 88457, win 126, options [nop,nop,TS val 4090644013 ecr 762146228], length 0
17:08:33.562945 IP 99.181.91.33.1935 > 10.8.2.4.40018: Flags [.], ack 88989, win 126, options [nop,nop,TS val 4090644029 ecr 762146277], length 0
17:08:33.562969 IP 10.8.2.4.40018 > 99.181.91.33.1935: Flags [P.], seq 103443:103983, ack 0, win 501, options [nop,nop,TS val 762146792 ecr 4090644029], length 540
17:08:33.599254 IP 10.8.2.4.40018 > 99.181.91.33.1935: Flags [.], seq 103983:105297, ack 0, win 501, options [nop,nop,TS val 762146828 ecr 4090644029], length 1314
17:08:33.636851 IP 10.8.2.4.40018 > 99.181.91.33.1935: Flags [.], seq 105297:106611, ack 0, win 501, options [nop,nop,TS val 762146866 ecr 4090644029], length 1314
17:08:33.648062 IP 99.181.91.33.1935 > 10.8.2.4.40018: Flags [.], ack 91617, win 126, options [nop,nop,TS val 4090644114 ecr 762146331], length 0
17:08:33.679817 IP 10.8.2.4.40018 > 99.181.91.33.1935: Flags [.], seq 106611:107925, ack 0, win 501, options [nop,nop,TS val 762146909 ecr 4090644114], length 1314
17:08:33.732441 IP 10.8.2.4.40018 > 99.181.91.33.1935: Flags [.], seq 107925:109239, ack 0, win 501, options [nop,nop,TS val 762146961 ecr 4090644114], length 1314
17:08:33.743858 IP 99.181.91.33.1935 > 10.8.2.4.40018: Flags [.], ack 94245, win 126, options [nop,nop,TS val 4090644210 ecr 762146395], length 0
17:08:33.766703 IP 10.8.2.4.40018 > 99.181.91.33.1935: Flags [.], seq 109239:110553, ack 0, win 501, options [nop,nop,TS val 762146995 ecr 4090644210], length 1314
17:08:33.807711 IP 10.8.2.4.40018 > 99.181.91.33.1935: Flags [.], seq 110553:111867, ack 0, win 501, options [nop,nop,TS val 762147036 ecr 4090644210], length 1314
17:08:33.814333 IP 99.181.91.33.1935 > 10.8.2.4.40018: Flags [.], ack 96873, win 126, options [nop,nop,TS val 4090644281 ecr 762146494], length 0
17:08:33.866801 IP 10.8.2.4.40018 > 99.181.91.33.1935: Flags [.], seq 111867:113181, ack 0, win 501, options [nop,nop,TS val 762147095 ecr 4090644281], length 1314
17:08:33.900271 IP 10.8.2.4.40018 > 99.181.91.33.1935: Flags [.], seq 113181:114495, ack 0, win 501, options [nop,nop,TS val 762147129 ecr 4090644281], length 1314
17:08:33.917384 IP 99.181.91.33.1935 > 10.8.2.4.40018: Flags [.], ack 99501, win 126, options [nop,nop,TS val 4090644384 ecr 762146595], length 0
17:08:33.936333 IP 10.8.2.4.40018 > 99.181.91.33.1935: Flags [.], seq 114495:115809, ack 0, win 501, options [nop,nop,TS val 762147165 ecr 4090644384], length 1314
17:08:34.000530 IP 10.8.2.4.40018 > 99.181.91.33.1935: Flags [.], seq 115809:117123, ack 0, win 501, options [nop,nop,TS val 762147229 ecr 4090644384], length 1314
17:08:34.014488 IP 99.181.91.33.1935 > 10.8.2.4.40018: Flags [.], ack 102129, win 126, options [nop,nop,TS val 4090644481 ecr 762146660], length 0
17:08:34.033331 IP 10.8.2.4.40018 > 99.181.91.33.1935: Flags [.], seq 117123:118437, ack 0, win 501, options [nop,nop,TS val 762147262 ecr 4090644481], length 1314
17:08:34.067141 IP 10.8.2.4.40018 > 99.181.91.33.1935: Flags [.], seq 118437:119751, ack 0, win 501, options [nop,nop,TS val 762147296 ecr 4090644481], length 1314
17:08:34.077094 IP 99.181.91.33.1935 > 10.8.2.4.40018: Flags [.], ack 103983, win 126, options [nop,nop,TS val 4090644543 ecr 762146762], length 0
17:08:34.077138 IP 10.8.2.4.40018 > 99.181.91.33.1935: Flags [P.], seq 119751:119809, ack 0, win 501, options [nop,nop,TS val 762147306 ecr 4090644543], length 58
17:08:34.133046 IP 10.8.2.4.40018 > 99.181.91.33.1935: Flags [.], seq 119809:121123, ack 0, win 501, options [nop,nop,TS val 762147362 ecr 4090644543], length 1314
17:08:34.151708 IP 99.181.91.33.1935 > 10.8.2.4.40018: Flags [.], ack 106611, win 126, options [nop,nop,TS val 4090644618 ecr 762146828], length 0
17:08:34.172296 IP 10.8.2.4.40018 > 99.181.91.33.1935: Flags [.], seq 121123:122437, ack 0, win 501, options [nop,nop,TS val 762147401 ecr 4090644618], length 1314
17:08:34.199904 IP 10.8.2.4.40018 > 99.181.91.33.1935: Flags [.], seq 122437:123751, ack 0, win 501, options [nop,nop,TS val 762147429 ecr 4090644618], length 1314
17:08:34.246874 IP 99.181.91.33.1935 > 10.8.2.4.40018: Flags [.], ack 109239, win 126, options [nop,nop,TS val 4090644713 ecr 762146909], length 0
17:08:34.265479 IP 10.8.2.4.40018 > 99.181.91.33.1935: Flags [.], seq 123751:125065, ack 0, win 501, options [nop,nop,TS val 762147494 ecr 4090644713], length 1314
17:08:34.300998 IP 10.8.2.4.40018 > 99.181.91.33.1935: Flags [.], seq 125065:126379, ack 0, win 501, options [nop,nop,TS val 762147530 ecr 4090644713], length 1314
17:08:34.322127 IP 99.181.91.33.1935 > 10.8.2.4.40018: Flags [.], ack 111867, win 126, options [nop,nop,TS val 4090644788 ecr 762146995], length 0
17:08:34.333117 IP 10.8.2.4.40018 > 99.181.91.33.1935: Flags [.], seq 126379:127693, ack 0, win 501, options [nop,nop,TS val 762147562 ecr 4090644788], length 1314
17:08:34.399986 IP 10.8.2.4.40018 > 99.181.91.33.1935: Flags [.], seq 127693:129007, ack 0, win 501, options [nop,nop,TS val 762147629 ecr 4090644788], length 1314
17:08:34.414894 IP 99.181.91.33.1935 > 10.8.2.4.40018: Flags [.], ack 114495, win 126, options [nop,nop,TS val 4090644881 ecr 762147095], length 0
17:08:34.433624 IP 10.8.2.4.40018 > 99.181.91.33.1935: Flags [.], seq 129007:130321, ack 0, win 501, options [nop,nop,TS val 762147662 ecr 4090644881], length 1314
17:08:34.472823 IP 10.8.2.4.40018 > 99.181.91.33.1935: Flags [.], seq 130321:131635, ack 0, win 501, options [nop,nop,TS val 762147702 ecr 4090644881], length 1314
17:08:34.515131 IP 99.181.91.33.1935 > 10.8.2.4.40018: Flags [.], ack 117123, win 126, options [nop,nop,TS val 4090644981 ecr 762147165], length 0
17:08:34.537143 IP 10.8.2.4.40018 > 99.181.91.33.1935: Flags [.], seq 131635:132949, ack 0, win 501, options [nop,nop,TS val 762147766 ecr 4090644981], length 1314
17:08:34.566534 IP 10.8.2.4.40018 > 99.181.91.33.1935: Flags [.], seq 132949:134263, ack 0, win 501, options [nop,nop,TS val 762147795 ecr 4090644981], length 1314
17:08:34.581817 IP 99.181.91.33.1935 > 10.8.2.4.40018: Flags [.], ack 119751, win 126, options [nop,nop,TS val 4090645048 ecr 762147262], length 0
17:08:34.591431 IP 99.181.91.33.1935 > 10.8.2.4.40018: Flags [.], ack 119809, win 126, options [nop,nop,TS val 4090645058 ecr 762147306], length 0
17:08:34.591460 IP 10.8.2.4.40018 > 99.181.91.33.1935: Flags [P.], seq 134263:134799, ack 0, win 501, options [nop,nop,TS val 762147820 ecr 4090645058], length 536
17:08:34.631489 IP 10.8.2.4.40018 > 99.181.91.33.1935: Flags [.], seq 134799:136113, ack 0, win 501, options [nop,nop,TS val 762147860 ecr 4090645058], length 1314
17:08:34.666114 IP 10.8.2.4.40018 > 99.181.91.33.1935: Flags [.], seq 136113:137427, ack 0, win 501, options [nop,nop,TS val 762147895 ecr 4090645058], length 1314
17:08:34.686893 IP 99.181.91.33.1935 > 10.8.2.4.40018: Flags [.], ack 122437, win 126, options [nop,nop,TS val 4090645153 ecr 762147362], length 0
17:08:34.708713 IP 10.8.2.4.40018 > 99.181.91.33.1935: Flags [.], seq 137427:138741, ack 0, win 501, options [nop,nop,TS val 762147937 ecr 4090645153], length 1314
17:08:34.773119 IP 10.8.2.4.40018 > 99.181.91.33.1935: Flags [.], seq 138741:140055, ack 0, win 501, options [nop,nop,TS val 762148002 ecr 4090645153], length 1314
17:08:34.775738 IP 99.181.91.33.1935 > 10.8.2.4.40018: Flags [.], ack 123751, win 126, options [nop,nop,TS val 4090645242 ecr 762147429], length 0
17:08:34.800084 IP 10.8.2.4.40018 > 99.181.91.33.1935: Flags [.], seq 140055:141369, ack 0, win 501, options [nop,nop,TS val 762148029 ecr 4090645242], length 1314
17:08:34.815547 IP 99.181.91.33.1935 > 10.8.2.4.40018: Flags [.], ack 126379, win 126, options [nop,nop,TS val 4090645282 ecr 762147494], length 0
17:08:34.837558 IP 10.8.2.4.40018 > 99.181.91.33.1935: Flags [.], seq 141369:142683, ack 0, win 501, options [nop,nop,TS val 762148066 ecr 4090645282], length 1314
17:08:34.901950 IP 10.8.2.4.40018 > 99.181.91.33.1935: Flags [.], seq 142683:143997, ack 0, win 501, options [nop,nop,TS val 762148131 ecr 4090645282], length 1314
17:08:34.914318 IP 99.181.91.33.1935 > 10.8.2.4.40018: Flags [.], ack 129007, win 126, options [nop,nop,TS val 4090645381 ecr 762147562], length 0
17:08:34.933485 IP 10.8.2.4.40018 > 99.181.91.33.1935: Flags [.], seq 143997:145311, ack 0, win 501, options [nop,nop,TS val 762148162 ecr 4090645381], length 1314
17:08:34.966852 IP 10.8.2.4.40018 > 99.181.91.33.1935: Flags [.], seq 145311:146625, ack 0, win 501, options [nop,nop,TS val 762148196 ecr 4090645381], length 1314
17:08:34.988956 IP 99.181.91.33.1935 > 10.8.2.4.40018: Flags [.], ack 131635, win 126, options [nop,nop,TS val 4090645454 ecr 762147662], length 0
17:08:35.031637 IP 10.8.2.4.40018 > 99.181.91.33.1935: Flags [.], seq 146625:147939, ack 0, win 501, options [nop,nop,TS val 762148260 ecr 4090645454], length 1314
17:08:35.073342 IP 10.8.2.4.40018 > 99.181.91.33.1935: Flags [.], seq 147939:149253, ack 0, win 501, options [nop,nop,TS val 762148302 ecr 4090645454], length 1314
17:08:35.081060 IP 99.181.91.33.1935 > 10.8.2.4.40018: Flags [.], ack 134263, win 126, options [nop,nop,TS val 4090645547 ecr 762147766], length 0
17:08:35.100317 IP 10.8.2.4.40018 > 99.181.91.33.1935: Flags [.], seq 149253:150567, ack 0, win 501, options [nop,nop,TS val 762148329 ecr 4090645547], length 1314
17:08:35.105693 IP 99.181.91.33.1935 > 10.8.2.4.40018: Flags [.], ack 134799, win 126, options [nop,nop,TS val 4090645572 ecr 762147820], length 0
17:08:35.105732 IP 10.8.2.4.40018 > 99.181.91.33.1935: Flags [P.], seq 150567:150636, ack 0, win 501, options [nop,nop,TS val 762148334 ecr 4090645572], length 69
17:08:35.165024 IP 10.8.2.4.40018 > 99.181.91.33.1935: Flags [.], seq 150636:151950, ack 0, win 501, options [nop,nop,TS val 762148394 ecr 4090645572], length 1314
17:08:35.180766 IP 99.181.91.33.1935 > 10.8.2.4.40018: Flags [.], ack 137427, win 126, options [nop,nop,TS val 4090645647 ecr 762147860], length 0
17:08:35.201893 IP 10.8.2.4.40018 > 99.181.91.33.1935: Flags [.], seq 151950:153264, ack 0, win 501, options [nop,nop,TS val 762148431 ecr 4090645647], length 1314
17:08:35.244668 IP 10.8.2.4.40018 > 99.181.91.33.1935: Flags [.], seq 153264:154578, ack 0, win 501, options [nop,nop,TS val 762148473 ecr 4090645647], length 1314
17:08:35.287291 IP 99.181.91.33.1935 > 10.8.2.4.40018: Flags [.], ack 140055, win 126, options [nop,nop,TS val 4090645754 ecr 762147937], length 0
17:08:35.308691 IP 10.8.2.4.40018 > 99.181.91.33.1935: Flags [.], seq 154578:155892, ack 0, win 501, options [nop,nop,TS val 762148537 ecr 4090645754], length 1314
17:08:35.332227 IP 10.8.2.4.40018 > 99.181.91.33.1935: Flags [.], seq 155892:157206, ack 0, win 501, options [nop,nop,TS val 762148561 ecr 4090645754], length 1314
17:08:35.351942 IP 99.181.91.33.1935 > 10.8.2.4.40018: Flags [.], ack 142683, win 126, options [nop,nop,TS val 4090645818 ecr 762148029], length 0
17:08:35.372813 IP 10.8.2.4.40018 > 99.181.91.33.1935: Flags [.], seq 157206:158520, ack 0, win 501, options [nop,nop,TS val 762148602 ecr 4090645818], length 1314
17:08:35.436547 IP 10.8.2.4.40018 > 99.181.91.33.1935: Flags [.], seq 158520:159834, ack 0, win 501, options [nop,nop,TS val 762148665 ecr 4090645818], length 1314
17:08:35.447745 IP 99.181.91.33.1935 > 10.8.2.4.40018: Flags [.], ack 145311, win 126, options [nop,nop,TS val 4090645914 ecr 762148131], length 0
17:08:35.466901 IP 10.8.2.4.40018 > 99.181.91.33.1935: Flags [.], seq 159834:161148, ack 0, win 501, options [nop,nop,TS val 762148696 ecr 4090645914], length 1314
17:08:35.501095 IP 10.8.2.4.40018 > 99.181.91.33.1935: Flags [.], seq 161148:162462, ack 0, win 501, options [nop,nop,TS val 762148730 ecr 4090645914], length 1314
17:08:35.546127 IP 99.181.91.33.1935 > 10.8.2.4.40018: Flags [.], ack 147939, win 126, options [nop,nop,TS val 4090646012 ecr 762148196], length 0
17:08:35.565377 IP 10.8.2.4.40018 > 99.181.91.33.1935: Flags [.], seq 162462:163776, ack 0, win 501, options [nop,nop,TS val 762148794 ecr 4090646012], length 1314
17:08:35.608211 IP 10.8.2.4.40018 > 99.181.91.33.1935: Flags [.], seq 163776:165090, ack 0, win 501, options [nop,nop,TS val 762148837 ecr 4090646012], length 1314
17:08:35.614764 IP 99.181.91.33.1935 > 10.8.2.4.40018: Flags [.], ack 150567, win 126, options [nop,nop,TS val 4090646081 ecr 762148302], length 0
17:08:35.620137 IP 99.181.91.33.1935 > 10.8.2.4.40018: Flags [.], ack 150636, win 126, options [nop,nop,TS val 4090646086 ecr 762148334], length 0
17:08:35.620166 IP 10.8.2.4.40018 > 99.181.91.33.1935: Flags [P.], seq 165090:165614, ack 0, win 501, options [nop,nop,TS val 762148849 ecr 4090646086], length 524
17:08:35.672673 IP 10.8.2.4.40018 > 99.181.91.33.1935: Flags [.], seq 165614:166928, ack 0, win 501, options [nop,nop,TS val 762148901 ecr 4090646086], length 1314
17:08:35.700208 IP 10.8.2.4.40018 > 99.181.91.33.1935: Flags [.], seq 166928:168242, ack 0, win 501, options [nop,nop,TS val 762148929 ecr 4090646086], length 1314
17:08:35.716124 IP 99.181.91.33.1935 > 10.8.2.4.40018: Flags [.], ack 153264, win 126, options [nop,nop,TS val 4090646183 ecr 762148394], length 0
17:08:35.737208 IP 10.8.2.4.40018 > 99.181.91.33.1935: Flags [.], seq 168242:169556, ack 0, win 501, options [nop,nop,TS val 762148966 ecr 4090646183], length 1314
17:08:35.801593 IP 10.8.2.4.40018 > 99.181.91.33.1935: Flags [.], seq 169556:170870, ack 0, win 501, options [nop,nop,TS val 762149030 ecr 4090646183], length 1314
17:08:35.823105 IP 99.181.91.33.1935 > 10.8.2.4.40018: Flags [.], ack 155892, win 126, options [nop,nop,TS val 4090646289 ecr 762148473], length 0
17:08:35.844439 IP 10.8.2.4.40018 > 99.181.91.33.1935: Flags [.], seq 170870:172184, ack 0, win 501, options [nop,nop,TS val 762149073 ecr 4090646289], length 1314
17:08:35.866582 IP 10.8.2.4.40018 > 99.181.91.33.1935: Flags [.], seq 172184:173498, ack 0, win 501, options [nop,nop,TS val 762149095 ecr 4090646289], length 1314
17:08:35.887291 IP 99.181.91.33.1935 > 10.8.2.4.40018: Flags [.], ack 158520, win 126, options [nop,nop,TS val 4090646354 ecr 762148561], length 0
17:08:35.933102 IP 10.8.2.4.40018 > 99.181.91.33.1935: Flags [.], seq 173498:174812, ack 0, win 501, options [nop,nop,TS val 762149162 ecr 4090646354], length 1314
17:08:35.973270 IP 10.8.2.4.40018 > 99.181.91.33.1935: Flags [.], seq 174812:176126, ack 0, win 501, options [nop,nop,TS val 762149202 ecr 4090646354], length 1314
17:08:35.981165 IP 99.181.91.33.1935 > 10.8.2.4.40018: Flags [.], ack 161148, win 126, options [nop,nop,TS val 4090646448 ecr 762148665], length 0
17:08:35.999911 IP 10.8.2.4.40018 > 99.181.91.33.1935: Flags [.], seq 176126:177440, ack 0, win 501, options [nop,nop,TS val 762149229 ecr 4090646448], length 1314
17:08:36.079999 IP 99.181.91.33.1935 > 10.8.2.4.40018: Flags [.], ack 163776, win 126, options [nop,nop,TS val 4090646546 ecr 762148730], length 0
17:08:36.080695 IP 10.8.2.4.40018 > 99.181.91.33.1935: Flags [.], seq 177440:178754, ack 0, win 501, options [nop,nop,TS val 762149309 ecr 4090646546], length 1314
17:08:36.101967 IP 10.8.2.4.40018 > 99.181.91.33.1935: Flags [.], seq 178754:180068, ack 0, win 501, options [nop,nop,TS val 762149331 ecr 4090646546], length 1314
17:08:36.134981 IP 99.181.91.33.1935 > 10.8.2.4.40018: Flags [.], ack 165614, win 126, options [nop,nop,TS val 4090646601 ecr 762148837], length 0
17:08:36.135006 IP 10.8.2.4.40018 > 99.181.91.33.1935: Flags [P.], seq 180068:180700, ack 0, win 501, options [nop,nop,TS val 762149364 ecr 4090646601], length 632
17:08:36.166072 IP 10.8.2.4.40018 > 99.181.91.33.1935: Flags [.], seq 180700:182014, ack 0, win 501, options [nop,nop,TS val 762149395 ecr 4090646601], length 1314
17:08:36.208848 IP 10.8.2.4.40018 > 99.181.91.33.1935: Flags [.], seq 182014:183328, ack 0, win 501, options [nop,nop,TS val 762149438 ecr 4090646601], length 1314
17:08:36.214780 IP 99.181.91.33.1935 > 10.8.2.4.40018: Flags [.], ack 168242, win 126, options [nop,nop,TS val 4090646681 ecr 762148901], length 0
17:08:36.263732 IP 10.8.2.4.40018 > 99.181.91.33.1935: Flags [.], seq 183328:184642, ack 0, win 501, options [nop,nop,TS val 762149492 ecr 4090646681], length 1314
17:08:36.315512 IP 10.8.2.4.40018 > 99.181.91.33.1935: Flags [.], seq 184642:185956, ack 0, win 501, options [nop,nop,TS val 762149544 ecr 4090646681], length 1314
17:08:36.315884 IP 99.181.91.33.1935 > 10.8.2.4.40018: Flags [.], ack 170870, win 126, options [nop,nop,TS val 4090646782 ecr 762148966], length 0
17:08:36.336741 IP 10.8.2.4.40018 > 99.181.91.33.1935: Flags [.], seq 185956:187270, ack 0, win 501, options [nop,nop,TS val 762149565 ecr 4090646782], length 1314
17:08:36.381149 IP 99.181.91.33.1935 > 10.8.2.4.40018: Flags [.], ack 173498, win 126, options [nop,nop,TS val 4090646847 ecr 762149073], length 0
17:08:36.398373 IP 10.8.2.4.40018 > 99.181.91.33.1935: Flags [.], seq 187270:188584, ack 0, win 501, options [nop,nop,TS val 762149627 ecr 4090646847], length 1314
17:08:36.443587 IP 10.8.2.4.40018 > 99.181.91.33.1935: Flags [.], seq 188584:189898, ack 0, win 501, options [nop,nop,TS val 762149672 ecr 4090646847], length 1314
17:08:36.466549 IP 10.8.2.4.40018 > 99.181.91.33.1935: Flags [.], seq 189898:191212, ack 0, win 501, options [nop,nop,TS val 762149695 ecr 4090646847], length 1314
17:08:36.487800 IP 99.181.91.33.1935 > 10.8.2.4.40018: Flags [.], ack 176126, win 126, options [nop,nop,TS val 4090646954 ecr 762149162], length 0
17:08:36.529331 IP 10.8.2.4.40018 > 99.181.91.33.1935: Flags [.], seq 191212:192526, ack 0, win 501, options [nop,nop,TS val 762149758 ecr 4090646954], length 1314
17:08:36.571985 IP 10.8.2.4.40018 > 99.181.91.33.1935: Flags [.], seq 192526:193840, ack 0, win 501, options [nop,nop,TS val 762149801 ecr 4090646954], length 1314
17:08:36.579719 IP 99.181.91.33.1935 > 10.8.2.4.40018: Flags [.], ack 177440, win 126, options [nop,nop,TS val 4090647046 ecr 762149229], length 0
17:08:36.614556 IP 10.8.2.4.40018 > 99.181.91.33.1935: Flags [.], seq 193840:195154, ack 0, win 501, options [nop,nop,TS val 762149843 ecr 4090647046], length 1314
17:08:36.616356 IP 99.181.91.33.1935 > 10.8.2.4.40018: Flags [.], ack 180068, win 126, options [nop,nop,TS val 4090647083 ecr 762149309], length 0
17:08:36.649795 IP 99.181.91.33.1935 > 10.8.2.4.40018: Flags [.], ack 180700, win 126, options [nop,nop,TS val 4090647116 ecr 762149364], length 0
17:08:36.649830 IP 10.8.2.4.40018 > 99.181.91.33.1935: Flags [P.], seq 195154:196443, ack 0, win 501, options [nop,nop,TS val 762149879 ecr 4090647116], length 1289
17:08:36.700281 IP 10.8.2.4.40018 > 99.181.91.33.1935: Flags [.], seq 196443:197757, ack 0, win 501, options [nop,nop,TS val 762149929 ecr 4090647116], length 1314
17:08:36.723402 IP 99.181.91.33.1935 > 10.8.2.4.40018: Flags [.], ack 183328, win 126, options [nop,nop,TS val 4090647190 ecr 762149395], length 0
17:08:36.743208 IP 10.8.2.4.40018 > 99.181.91.33.1935: Flags [.], seq 197757:199071, ack 0, win 501, options [nop,nop,TS val 762149972 ecr 4090647190], length 1314
17:08:36.764777 IP 10.8.2.4.40018 > 99.181.91.33.1935: Flags [.], seq 199071:200385, ack 0, win 501, options [nop,nop,TS val 762149993 ecr 4090647190], length 1314
17:08:36.829827 IP 99.181.91.33.1935 > 10.8.2.4.40018: Flags [.], ack 185956, win 126, options [nop,nop,TS val 4090647296 ecr 762149492], length 0
17:08:36.833117 IP 10.8.2.4.40018 > 99.181.91.33.1935: Flags [.], seq 200385:201699, ack 0, win 501, options [nop,nop,TS val 762150062 ecr 4090647296], length 1314
17:08:36.866828 IP 10.8.2.4.40018 > 99.181.91.33.1935: Flags [.], seq 201699:203013, ack 0, win 501, options [nop,nop,TS val 762150096 ecr 4090647296], length 1314
17:08:36.898309 IP 10.8.2.4.40018 > 99.181.91.33.1935: Flags [.], seq 203013:204327, ack 0, win 501, options [nop,nop,TS val 762150127 ecr 4090647296], length 1314
17:08:36.912761 IP 99.181.91.33.1935 > 10.8.2.4.40018: Flags [.], ack 188584, win 126, options [nop,nop,TS val 4090647379 ecr 762149565], length 0
17:08:36.966590 IP 10.8.2.4.40018 > 99.181.91.33.1935: Flags [.], seq 204327:205641, ack 0, win 501, options [nop,nop,TS val 762150195 ecr 4090647379], length 1314
17:08:36.980938 IP 99.181.91.33.1935 > 10.8.2.4.40018: Flags [.], ack 191212, win 126, options [nop,nop,TS val 4090647447 ecr 762149672], length 0
17:08:36.997420 IP 10.8.2.4.40018 > 99.181.91.33.1935: Flags [.], seq 205641:206955, ack 0, win 501, options [nop,nop,TS val 762150226 ecr 4090647447], length 1314
17:08:37.032000 IP 10.8.2.4.40018 > 99.181.91.33.1935: Flags [.], seq 206955:208269, ack 0, win 501, options [nop,nop,TS val 762150261 ecr 4090647447], length 1314
17:08:37.086759 IP 99.181.91.33.1935 > 10.8.2.4.40018: Flags [.], ack 193840, win 126, options [nop,nop,TS val 4090647553 ecr 762149758], length 0
17:08:37.098547 IP 10.8.2.4.40018 > 99.181.91.33.1935: Flags [.], seq 208269:209583, ack 0, win 501, options [nop,nop,TS val 762150327 ecr 4090647553], length 1314
17:08:37.131760 IP 10.8.2.4.40018 > 99.181.91.33.1935: Flags [.], seq 209583:210897, ack 0, win 501, options [nop,nop,TS val 762150360 ecr 4090647553], length 1314
17:08:37.164151 IP 99.181.91.33.1935 > 10.8.2.4.40018: Flags [.], ack 196443, win 126, options [nop,nop,TS val 4090647630 ecr 762149843], length 0
17:08:37.164178 IP 10.8.2.4.40018 > 99.181.91.33.1935: Flags [P.], seq 210897:211516, ack 0, win 501, options [nop,nop,TS val 762150393 ecr 4090647630], length 619
17:08:37.199594 IP 10.8.2.4.40018 > 99.181.91.33.1935: Flags [.], seq 211516:212830, ack 0, win 501, options [nop,nop,TS val 762150428 ecr 4090647630], length 1314
17:08:37.233678 IP 10.8.2.4.40018 > 99.181.91.33.1935: Flags [.], seq 212830:214144, ack 0, win 501, options [nop,nop,TS val 762150462 ecr 4090647630], length 1314
17:08:37.257558 IP 99.181.91.33.1935 > 10.8.2.4.40018: Flags [.], ack 199071, win 126, options [nop,nop,TS val 4090647724 ecr 762149929], length 0
17:08:37.278503 IP 10.8.2.4.40018 > 99.181.91.33.1935: Flags [.], seq 214144:215458, ack 0, win 501, options [nop,nop,TS val 762150507 ecr 4090647724], length 1314
17:08:37.332652 IP 10.8.2.4.40018 > 99.181.91.33.1935: Flags [.], seq 215458:216772, ack 0, win 501, options [nop,nop,TS val 762150561 ecr 4090647724], length 1314
17:08:37.343831 IP 99.181.91.33.1935 > 10.8.2.4.40018: Flags [.], ack 200385, win 126, options [nop,nop,TS val 4090647810 ecr 762149993], length 0
17:08:37.365608 IP 10.8.2.4.40018 > 99.181.91.33.1935: Flags [.], seq 216772:218086, ack 0, win 501, options [nop,nop,TS val 762150594 ecr 4090647810], length 1314
17:08:37.381210 IP 99.181.91.33.1935 > 10.8.2.4.40018: Flags [.], ack 203013, win 126, options [nop,nop,TS val 4090647848 ecr 762150062], length 0
