22:33:02.861364 IP 10.8.2.8.49368 > 99.181.97.172.1935: Flags [.], seq 682624690:682626004, ack 1487354242, win 501, options [nop,nop,TS val 3332501403 ecr 2978977375], length 1314
22:33:02.890712 IP 10.8.2.8.49368 > 99.181.97.172.1935: Flags [.], seq 1314:2628, ack 1, win 501, options [nop,nop,TS val 3332501432 ecr 2978977375], length 1314
22:33:02.895992 IP 99.181.97.172.1935 > 10.8.2.8.49368: Flags [.], ack 4294956631, win 126, options [nop,nop,TS val 2978977480 ecr 3332500939], length 0
22:33:02.931787 IP 10.8.2.8.49368 > 99.181.97.172.1935: Flags [.], seq 2628:3942, ack 1, win 501, options [nop,nop,TS val 3332501473 ecr 2978977480], length 1314
22:33:02.932107 IP 99.181.97.172.1935 > 10.8.2.8.49368: Flags [.], ack 4294959259, win 126, options [nop,nop,TS val 2978977540 ecr 3332501034], length 0
22:33:02.995848 IP 10.8.2.8.49368 > 99.181.97.172.1935: Flags [.], seq 3942:5256, ack 1, win 501, options [nop,nop,TS val 3332501537 ecr 2978977540], length 1314
22:33:03.028099 IP 10.8.2.8.49368 > 99.181.97.172.1935: Flags [.], seq 5256:6570, ack 1, win 501, options [nop,nop,TS val 3332501569 ecr 2978977540], length 1314
22:33:03.034606 IP 99.181.97.172.1935 > 10.8.2.8.49368: Flags [.], ack 4294961887, win 126, options [nop,nop,TS val 2978977642 ecr 3332501136], length 0
22:33:03.060160 IP 10.8.2.8.49368 > 99.181.97.172.1935: Flags [.], seq 6570:7884, ack 1, win 501, options [nop,nop,TS val 3332501602 ecr 2978977642], length 1314
22:33:03.093202 IP 99.181.97.172.1935 > 10.8.2.8.49368: Flags [.], ack 4294963354, win 126, options [nop,nop,TS val 2978977701 ecr 3332501202], length 0
22:33:03.093237 IP 10.8.2.8.49368 > 99.181.97.172.1935: Flags [P.], seq 7884:8021, ack 1, win 501, options [nop,nop,TS val 3332501635 ecr 2978977701], length 137
22:33:03.127795 IP 10.8.2.8.49368 > 99.181.97.172.1935: Flags [.], seq 8021:9335, ack 1, win 501, options [nop,nop,TS val 3332501669 ecr 2978977701], length 1314
22:33:03.160637 IP 10.8.2.8.49368 > 99.181.97.172.1935: Flags [.], seq 9335:10649, ack 1, win 501, options [nop,nop,TS val 3332501702 ecr 2978977701], length 1314
22:33:03.170592 IP 99.181.97.172.1935 > 10.8.2.8.49368: Flags [.], ack 4294965982, win 126, options [nop,nop,TS val 2978977775 ecr 3332501269], length 0
22:33:03.209695 IP 10.8.2.8.49368 > 99.181.97.172.1935: Flags [.], seq 10649:11963, ack 1, win 501, options [nop,nop,TS val 3332501751 ecr 2978977775], length 1314
22:33:03.261486 IP 10.8.2.8.49368 > 99.181.97.172.1935: Flags [.], seq 11963:13277, ack 1, win 501, options [nop,nop,TS val 3332501803 ecr 2978977775], length 1314
22:33:03.271067 IP 99.181.97.172.1935 > 10.8.2.8.49368: Flags [.], ack 1314, win 126, options [nop,nop,TS val 2978977878 ecr 3332501345], length 0
22:33:03.295562 IP 10.8.2.8.49368 > 99.181.97.172.1935: Flags [.], seq 13277:14591, ack 1, win 501, options [nop,nop,TS val 3332501837 ecr 2978977878], length 1314
22:33:03.338100 IP 10.8.2.8.49368 > 99.181.97.172.1935: Flags [.], seq 14591:15905, ack 1, win 501, options [nop,nop,TS val 3332501879 ecr 2978977878], length 1314
22:33:03.340051 IP 99.181.97.172.1935 > 10.8.2.8.49368: Flags [.], ack 3942, win 126, options [nop,nop,TS val 2978977947 ecr 3332501432], length 0
22:33:03.393141 IP 10.8.2.8.49368 > 99.181.97.172.1935: Flags [.], seq 15905:17219, ack 1, win 501, options [nop,nop,TS val 3332501935 ecr 2978977947], length 1314
22:33:03.428721 IP 10.8.2.8.49368 > 99.181.97.172.1935: Flags [.], seq 17219:18533, ack 1, win 501, options [nop,nop,TS val 3332501970 ecr 2978977947], length 1314
22:33:03.442481 IP 99.181.97.172.1935 > 10.8.2.8.49368: Flags [.], ack 6570, win 126, options [nop,nop,TS val 2978978050 ecr 3332501537], length 0
22:33:03.466295 IP 10.8.2.8.49368 > 99.181.97.172.1935: Flags [.], seq 18533:19847, ack 1, win 501, options [nop,nop,TS val 3332502008 ecr 2978978050], length 1314
22:33:03.499553 IP 99.181.97.172.1935 > 10.8.2.8.49368: Flags [.], ack 8021, win 126, options [nop,nop,TS val 2978978107 ecr 3332501602], length 0
22:33:03.499594 IP 10.8.2.8.49368 > 99.181.97.172.1935: Flags [P.], seq 19847:20849, ack 1, win 501, options [nop,nop,TS val 3332502041 ecr 2978978107], length 1002
22:33:03.561295 IP 10.8.2.8.49368 > 99.181.97.172.1935: Flags [.], seq 20849:22163, ack 1, win 501, options [nop,nop,TS val 3332502103 ecr 2978978107], length 1314
22:33:03.570153 IP 99.181.97.172.1935 > 10.8.2.8.49368: Flags [.], ack 10649, win 126, options [nop,nop,TS val 2978978178 ecr 3332501669], length 0
22:33:03.594844 IP 10.8.2.8.49368 > 99.181.97.172.1935: Flags [.], seq 22163:23477, ack 1, win 501, options [nop,nop,TS val 3332502136 ecr 2978978178], length 1314
22:33:03.628019 IP 10.8.2.8.49368 > 99.181.97.172.1935: Flags [.], seq 23477:24791, ack 1, win 501, options [nop,nop,TS val 3332502169 ecr 2978978178], length 1314
22:33:03.669500 IP 99.181.97.172.1935 > 10.8.2.8.49368: Flags [.], ack 13277, win 126, options [nop,nop,TS val 2978978276 ecr 3332501751], length 0
22:33:03.694917 IP 10.8.2.8.49368 > 99.181.97.172.1935: Flags [.], seq 24791:26105, ack 1, win 501, options [nop,nop,TS val 3332502236 ecr 2978978276], length 1314
22:33:03.725568 IP 10.8.2.8.49368 > 99.181.97.172.1935: Flags [.], seq 26105:27419, ack 1, win 501, options [nop,nop,TS val 3332502267 ecr 2978978276], length 1314
22:33:03.745835 IP 99.181.97.172.1935 > 10.8.2.8.49368: Flags [.], ack 15905, win 126, options [nop,nop,TS val 2978978354 ecr 3332501837], length 0
22:33:03.760516 IP 10.8.2.8.49368 > 99.181.97.172.1935: Flags [.], seq 27419:28733, ack 1, win 501, options [nop,nop,TS val 3332502302 ecr 2978978354], length 1314
22:33:03.830667 IP 10.8.2.8.49368 > 99.181.97.172.1935: Flags [.], seq 28733:30047, ack 1, win 501, options [nop,nop,TS val 3332502372 ecr 2978978354], length 1314
22:33:03.836231 IP 99.181.97.172.1935 > 10.8.2.8.49368: Flags [.], ack 18533, win 126, options [nop,nop,TS val 2978978444 ecr 3332501935], length 0
22:33:03.861069 IP 10.8.2.8.49368 > 99.181.97.172.1935: Flags [.], seq 30047:31361, ack 1, win 501, options [nop,nop,TS val 3332502402 ecr 2978978444], length 1314
22:33:03.894816 IP 10.8.2.8.49368 > 99.181.97.172.1935: Flags [.], seq 31361:32675, ack 1, win 501, options [nop,nop,TS val 3332502436 ecr 2978978444], length 1314
22:33:03.910817 IP 99.181.97.172.1935 > 10.8.2.8.49368: Flags [.], ack 20849, win 126, options [nop,nop,TS val 2978978517 ecr 3332502008], length 0
22:33:03.910843 IP 10.8.2.8.49368 > 99.181.97.172.1935: Flags [P.], seq 32675:32808, ack 1, win 501, options [nop,nop,TS val 3332502452 ecr 2978978517], length 133
22:33:03.961014 IP 10.8.2.8.49368 > 99.181.97.172.1935: Flags [.], seq 32808:34122, ack 1, win 501, options [nop,nop,TS val 3332502502 ecr 2978978517], length 1314
22:33:03.994153 IP 10.8.2.8.49368 > 99.181.97.172.1935: Flags [.], seq 34122:35436, ack 1, win 501, options [nop,nop,TS val 3332502536 ecr 2978978517], length 1314
22:33:04.001624 IP 99.181.97.172.1935 > 10.8.2.8.49368: Flags [.], ack 23477, win 126, options [nop,nop,TS val 2978978609 ecr 3332502103], length 0
22:33:04.028376 IP 10.8.2.8.49368 > 99.181.97.172.1935: Flags [.], seq 35436:36750, ack 1, win 501, options [nop,nop,TS val 3332502570 ecr 2978978609], length 1314
22:33:04.093417 IP 10.8.2.8.49368 > 99.181.97.172.1935: Flags [.], seq 36750:38064, ack 1, win 501, options [nop,nop,TS val 3332502635 ecr 2978978609], length 1314
22:33:04.103794 IP 99.181.97.172.1935 > 10.8.2.8.49368: Flags [.], ack 26105, win 126, options [nop,nop,TS val 2978978711 ecr 3332502169], length 0
22:33:04.129562 IP 10.8.2.8.49368 > 99.181.97.172.1935: Flags [.], seq 38064:39378, ack 1, win 501, options [nop,nop,TS val 3332502671 ecr 2978978711], length 1314
22:33:04.160112 IP 10.8.2.8.49368 > 99.181.97.172.1935: Flags [.], seq 39378:40692, ack 1, win 501, options [nop,nop,TS val 3332502702 ecr 2978978711], length 1314
22:33:04.170466 IP 99.181.97.172.1935 > 10.8.2.8.49368: Flags [.], ack 28733, win 126, options [nop,nop,TS val 2978978778 ecr 3332502267], length 0
22:33:04.226392 IP 10.8.2.8.49368 > 99.181.97.172.1935: Flags [.], seq 40692:42006, ack 1, win 501, options [nop,nop,TS val 3332502768 ecr 2978978778], length 1314
22:33:04.259930 IP 10.8.2.8.49368 > 99.181.97.172.1935: Flags [.], seq 42006:43320, ack 1, win 501, options [nop,nop,TS val 3332502801 ecr 2978978778], length 1314
22:33:04.268469 IP 99.181.97.172.1935 > 10.8.2.8.49368: Flags [.], ack 31361, win 126, options [nop,nop,TS val 2978978876 ecr 3332502372], length 0
22:33:04.294063 IP 10.8.2.8.49368 > 99.181.97.172.1935: Flags [.], seq 43320:44634, ack 1, win 501, options [nop,nop,TS val 3332502835 ecr 2978978876], length 1314
22:33:04.318213 IP 99.181.97.172.1935 > 10.8.2.8.49368: Flags [.], ack 32808, win 126, options [nop,nop,TS val 2978978925 ecr 3332502436], length 0
22:33:04.318249 IP 10.8.2.8.49368 > 99.181.97.172.1935: Flags [P.], seq 44634:44787, ack 1, win 501, options [nop,nop,TS val 3332502860 ecr 2978978925], length 153
22:33:04.363929 IP 10.8.2.8.49368 > 99.181.97.172.1935: Flags [.], seq 44787:46101, ack 1, win 501, options [nop,nop,TS val 3332502905 ecr 2978978925], length 1314
22:33:04.393842 IP 10.8.2.8.49368 > 99.181.97.172.1935: Flags [.], seq 46101:47415, ack 1, win 501, options [nop,nop,TS val 3332502935 ecr 2978978925], length 1314
22:33:04.403977 IP 99.181.97.172.1935 > 10.8.2.8.49368: Flags [.], ack 35436, win 126, options [nop,nop,TS val 2978979009 ecr 3332502502], length 0
22:33:04.427894 IP 10.8.2.8.49368 > 99.181.97.172.1935: Flags [.], seq 47415:48729, ack 1, win 501, options [nop,nop,TS val 3332502969 ecr 2978979009], length 1314
22:33:04.492735 IP 10.8.2.8.49368 > 99.181.97.172.1935: Flags [.], seq 48729:50043, ack 1, win 501, options [nop,nop,TS val 3332503034 ecr 2978979009], length 1314
22:33:04.502866 IP 99.181.97.172.1935 > 10.8.2.8.49368: Flags [.], ack 38064, win 126, options [nop,nop,TS val 2978979110 ecr 3332502570], length 0
22:33:04.526324 IP 10.8.2.8.49368 > 99.181.97.172.1935: Flags [.], seq 50043:51357, ack 1, win 501, options [nop,nop,TS val 3332503068 ecr 2978979110], length 1314
22:33:04.561954 IP 10.8.2.8.49368 > 99.181.97.172.1935: Flags [.], seq 51357:52671, ack 1, win 501, options [nop,nop,TS val 3332503103 ecr 2978979110], length 1314
22:33:04.569021 IP 99.181.97.172.1935 > 10.8.2.8.49368: Flags [.], ack 40692, win 126, options [nop,nop,TS val 2978979174 ecr 3332502671], length 0
22:33:04.628239 IP 10.8.2.8.49368 > 99.181.97.172.1935: Flags [.], seq 52671:53985, ack 1, win 501, options [nop,nop,TS val 3332503170 ecr 2978979174], length 1314
22:33:04.662552 IP 10.8.2.8.49368 > 99.181.97.172.1935: Flags [.], seq 53985:55299, ack 1, win 501, options [nop,nop,TS val 3332503204 ecr 2978979174], length 1314
22:33:04.668773 IP 99.181.97.172.1935 > 10.8.2.8.49368: Flags [.], ack 43320, win 126, options [nop,nop,TS val 2978979275 ecr 3332502768], length 0
22:33:04.692074 IP 10.8.2.8.49368 > 99.181.97.172.1935: Flags [.], seq 55299:56613, ack 1, win 501, options [nop,nop,TS val 3332503233 ecr 2978979275], length 1314
22:33:04.725426 IP 99.181.97.172.1935 > 10.8.2.8.49368: Flags [.], ack 44787, win 126, options [nop,nop,TS val 2978979333 ecr 3332502835], length 0
22:33:04.725441 IP 10.8.2.8.49368 > 99.181.97.172.1935: Flags [P.], seq 56613:56846, ack 1, win 501, options [nop,nop,TS val 3332503267 ecr 2978979333], length 233
22:33:04.759011 IP 10.8.2.8.49368 > 99.181.97.172.1935: Flags [.], seq 56846:58160, ack 1, win 501, options [nop,nop,TS val 3332503300 ecr 2978979333], length 1314
22:33:04.794153 IP 10.8.2.8.49368 > 99.181.97.172.1935: Flags [.], seq 58160:59474, ack 1, win 501, options [nop,nop,TS val 3332503336 ecr 2978979333], length 1314
22:33:04.803024 IP 99.181.97.172.1935 > 10.8.2.8.49368: Flags [.], ack 47415, win 126, options [nop,nop,TS val 2978979411 ecr 3332502905], length 0
22:33:04.854818 IP 10.8.2.8.49368 > 99.181.97.172.1935: Flags [.], seq 59474:60788, ack 1, win 501, options [nop,nop,TS val 3332503396 ecr 2978979411], length 1314
22:33:04.897230 IP 10.8.2.8.49368 > 99.181.97.172.1935: Flags [.], seq 60788:62102, ack 1, win 501, options [nop,nop,TS val 3332503439 ecr 2978979411], length 1314
22:33:04.900223 IP 99.181.97.172.1935 > 10.8.2.8.49368: Flags [.], ack 50043, win 126, options [nop,nop,TS val 2978979508 ecr 3332502969], length 0
22:33:04.924660 IP 10.8.2.8.49368 > 99.181.97.172.1935: Flags [.], seq 62102:63416, ack 1, win 501, options [nop,nop,TS val 3332503466 ecr 2978979508], length 1314
22:33:04.970498 IP 99.181.97.172.1935 > 10.8.2.8.49368: Flags [.], ack 52671, win 126, options [nop,nop,TS val 2978979577 ecr 3332503068], length 0
22:33:04.982721 IP 10.8.2.8.49368 > 99.181.97.172.1935: Flags [.], seq 63416:64730, ack 1, win 501, options [nop,nop,TS val 3332503524 ecr 2978979577], length 1314
22:33:05.026493 IP 10.8.2.8.49368 > 99.181.97.172.1935: Flags [.], seq 64730:66044, ack 1, win 501, options [nop,nop,TS val 3332503568 ecr 2978979577], length 1314
22:33:05.059639 IP 10.8.2.8.49368 > 99.181.97.172.1935: Flags [.], seq 66044:67358, ack 1, win 501, options [nop,nop,TS val 3332503601 ecr 2978979577], length 1314
22:33:05.069256 IP 99.181.97.172.1935 > 10.8.2.8.49368: Flags [.], ack 55299, win 126, options [nop,nop,TS val 2978979677 ecr 3332503170], length 0
22:33:05.111269 IP 10.8.2.8.49368 > 99.181.97.172.1935: Flags [.], seq 67358:68672, ack 1, win 501, options [nop,nop,TS val 3332503653 ecr 2978979677], length 1314
22:33:05.132324 IP 99.181.97.172.1935 > 10.8.2.8.49368: Flags [.], ack 56846, win 126, options [nop,nop,TS val 2978979740 ecr 3332503233], length 0
22:33:05.132364 IP 10.8.2.8.49368 > 99.181.97.172.1935: Flags [P.], seq 68672:68821, ack 1, win 501, options [nop,nop,TS val 3332503674 ecr 2978979740], length 149
22:33:05.161256 IP 10.8.2.8.49368 > 99.181.97.172.1935: Flags [.], seq 68821:70135, ack 1, win 501, options [nop,nop,TS val 3332503703 ecr 2978979740], length 1314
22:33:05.197042 IP 10.8.2.8.49368 > 99.181.97.172.1935: Flags [.], seq 70135:71449, ack 1, win 501, options [nop,nop,TS val 3332503738 ecr 2978979740], length 1314
22:33:05.200735 IP 99.181.97.172.1935 > 10.8.2.8.49368: Flags [.], ack 59474, win 126, options [nop,nop,TS val 2978979808 ecr 3332503300], length 0
22:33:05.260993 IP 10.8.2.8.49368 > 99.181.97.172.1935: Flags [.], seq 71449:72763, ack 1, win 501, options [nop,nop,TS val 3332503802 ecr 2978979808], length 1314
22:33:05.294494 IP 10.8.2.8.49368 > 99.181.97.172.1935: Flags [.], seq 72763:74077, ack 1, win 501, options [nop,nop,TS val 3332503836 ecr 2978979808], length 1314
22:33:05.304819 IP 99.181.97.172.1935 > 10.8.2.8.49368: Flags [.], ack 62102, win 126, options [nop,nop,TS val 2978979912 ecr 3332503396], length 0
22:33:05.326312 IP 10.8.2.8.49368 > 99.181.97.172.1935: Flags [.], seq 74077:75391, ack 1, win 501, options [nop,nop,TS val 3332503868 ecr 2978979912], length 1314
22:33:05.389567 IP 99.181.97.172.1935 > 10.8.2.8.49368: Flags [.], ack 64730, win 126, options [nop,nop,TS val 2978979997 ecr 3332503466], length 0
22:33:05.390006 IP 10.8.2.8.49368 > 99.181.97.172.1935: Flags [.], seq 75391:76705, ack 1, win 501, options [nop,nop,TS val 3332503931 ecr 2978979997], length 1314
22:33:05.432956 IP 10.8.2.8.49368 > 99.181.97.172.1935: Flags [.], seq 76705:78019, ack 1, win 501, options [nop,nop,TS val 3332503974 ecr 2978979997], length 1314
22:33:05.459867 IP 10.8.2.8.49368 > 99.181.97.172.1935: Flags [.], seq 78019:79333, ack 1, win 501, options [nop,nop,TS val 3332504001 ecr 2978979997], length 1314
22:33:05.467296 IP 99.181.97.172.1935 > 10.8.2.8.49368: Flags [.], ack 67358, win 126, options [nop,nop,TS val 2978980074 ecr 3332503568], length 0
22:33:05.518687 IP 10.8.2.8.49368 > 99.181.97.172.1935: Flags [.], seq 79333:80647, ack 1, win 501, options [nop,nop,TS val 3332504060 ecr 2978980074], length 1314
22:33:05.540664 IP 99.181.97.172.1935 > 10.8.2.8.49368: Flags [.], ack 68821, win 126, options [nop,nop,TS val 2978980148 ecr 3332503653], length 0
22:33:05.540693 IP 10.8.2.8.49368 > 99.181.97.172.1935: Flags [P.], seq 80647:81634, ack 1, win 501, options [nop,nop,TS val 3332504082 ecr 2978980148], length 987
22:33:05.593774 IP 10.8.2.8.49368 > 99.181.97.172.1935: Flags [.], seq 81634:82948, ack 1, win 501, options [nop,nop,TS val 3332504135 ecr 2978980148], length 1314
22:33:05.604278 IP 99.181.97.172.1935 > 10.8.2.8.49368: Flags [.], ack 71449, win 126, options [nop,nop,TS val 2978980212 ecr 3332503703], length 0
22:33:05.628172 IP 10.8.2.8.49368 > 99.181.97.172.1935: Flags [.], seq 82948:84262, ack 1, win 501, options [nop,nop,TS val 3332504170 ecr 2978980212], length 1314
22:33:05.668327 IP 10.8.2.8.49368 > 99.181.97.172.1935: Flags [.], seq 84262:85576, ack 1, win 501, options [nop,nop,TS val 3332504210 ecr 2978980212], length 1314
22:33:05.702066 IP 99.181.97.172.1935 > 10.8.2.8.49368: Flags [.], ack 74077, win 126, options [nop,nop,TS val 2978980309 ecr 3332503802], length 0
22:33:05.732735 IP 10.8.2.8.49368 > 99.181.97.172.1935: Flags [.], seq 85576:86890, ack 1, win 501, options [nop,nop,TS val 3332504274 ecr 2978980309], length 1314
22:33:05.761510 IP 10.8.2.8.49368 > 99.181.97.172.1935: Flags [.], seq 86890:88204, ack 1, win 501, options [nop,nop,TS val 3332504303 ecr 2978980309], length 1314
22:33:05.797186 IP 10.8.2.8.49368 > 99.181.97.172.1935: Flags [.], seq 88204:89518, ack 1, win 501, options [nop,nop,TS val 3332504339 ecr 2978980309], length 1314
22:33:05.798059 IP 99.181.97.172.1935 > 10.8.2.8.49368: Flags [.], ack 76705, win 126, options [nop,nop,TS val 2978980406 ecr 3332503868], length 0
22:33:05.861710 IP 10.8.2.8.49368 > 99.181.97.172.1935: Flags [.], seq 89518:90832, ack 1, win 501, options [nop,nop,TS val 3332504403 ecr 2978980406], length 1314
22:33:05.870503 IP 99.181.97.172.1935 > 10.8.2.8.49368: Flags [.], ack 79333, win 126, options [nop,nop,TS val 2978980476 ecr 3332503974], length 0
22:33:05.894992 IP 10.8.2.8.49368 > 99.181.97.172.1935: Flags [.], seq 90832:92146, ack 1, win 501, options [nop,nop,TS val 3332504436 ecr 2978980476], length 1314
22:33:05.928312 IP 10.8.2.8.49368 > 99.181.97.172.1935: Flags [.], seq 92146:93460, ack 1, win 501, options [nop,nop,TS val 3332504470 ecr 2978980476], length 1314
22:33:05.948102 IP 99.181.97.172.1935 > 10.8.2.8.49368: Flags [.], ack 81634, win 126, options [nop,nop,TS val 2978980555 ecr 3332504060], length 0
22:33:05.948137 IP 10.8.2.8.49368 > 99.181.97.172.1935: Flags [P.], seq 93460:93613, ack 1, win 501, options [nop,nop,TS val 3332504490 ecr 2978980555], length 153
22:33:05.991644 IP 10.8.2.8.49368 > 99.181.97.172.1935: Flags [.], seq 93613:94927, ack 1, win 501, options [nop,nop,TS val 3332504533 ecr 2978980555], length 1314
22:33:06.033715 IP 10.8.2.8.49368 > 99.181.97.172.1935: Flags [.], seq 94927:96241, ack 1, win 501, options [nop,nop,TS val 3332504575 ecr 2978980555], length 1314
22:33:06.035011 IP 99.181.97.172.1935 > 10.8.2.8.49368: Flags [.], ack 84262, win 126, options [nop,nop,TS val 2978980642 ecr 3332504135], length 0
22:33:06.076417 IP 10.8.2.8.49368 > 99.181.97.172.1935: Flags [.], seq 96241:97555, ack 1, win 501, options [nop,nop,TS val 3332504618 ecr 2978980642], length 1314
22:33:06.124022 IP 10.8.2.8.49368 > 99.181.97.172.1935: Flags [.], seq 97555:98869, ack 1, win 501, options [nop,nop,TS val 3332504665 ecr 2978980642], length 1314
22:33:06.139241 IP 99.181.97.172.1935 > 10.8.2.8.49368: Flags [.], ack 86890, win 126, options [nop,nop,TS val 2978980747 ecr 3332504210], length 0
22:33:06.161170 IP 10.8.2.8.49368 > 99.181.97.172.1935: Flags [.], seq 98869:100183, ack 1, win 501, options [nop,nop,TS val 3332504703 ecr 2978980747], length 1314
22:33:06.204013 IP 10.8.2.8.49368 > 99.181.97.172.1935: Flags [.], seq 100183:101497, ack 1, win 501, options [nop,nop,TS val 3332504745 ecr 2978980747], length 1314
22:33:06.204697 IP 99.181.97.172.1935 > 10.8.2.8.49368: Flags [.], ack 89518, win 126, options [nop,nop,TS val 2978980812 ecr 3332504303], length 0
22:33:06.268026 IP 10.8.2.8.49368 > 99.181.97.172.1935: Flags [.], seq 101497:102811, ack 1, win 501, options [nop,nop,TS val 3332504809 ecr 2978980812], length 1314
22:33:06.294730 IP 10.8.2.8.49368 > 99.181.97.172.1935: Flags [.], seq 102811:104125, ack 1, win 501, options [nop,nop,TS val 3332504836 ecr 2978980812], length 1314
22:33:06.302860 IP 99.181.97.172.1935 > 10.8.2.8.49368: Flags [.], ack 92146, win 126, options [nop,nop,TS val 2978980909 ecr 3332504403], length 0
22:33:06.332431 IP 10.8.2.8.49368 > 99.181.97.172.1935: Flags [.], seq 104125:105439, ack 1, win 501, options [nop,nop,TS val 3332504874 ecr 2978980909], length 1314
22:33:06.356120 IP 99.181.97.172.1935 > 10.8.2.8.49368: Flags [.], ack 93613, win 126, options [nop,nop,TS val 2978980962 ecr 3332504470], length 0
22:33:06.356162 IP 10.8.2.8.49368 > 99.181.97.172.1935: Flags [P.], seq 105439:105576, ack 1, win 501, options [nop,nop,TS val 3332504898 ecr 2978980962], length 137
22:33:06.396682 IP 10.8.2.8.49368 > 99.181.97.172.1935: Flags [.], seq 105576:106890, ack 1, win 501, options [nop,nop,TS val 3332504938 ecr 2978980962], length 1314
22:33:06.427859 IP 10.8.2.8.49368 > 99.181.97.172.1935: Flags [.], seq 106890:108204, ack 1, win 501, options [nop,nop,TS val 3332504969 ecr 2978980962], length 1314
22:33:06.442702 IP 99.181.97.172.1935 > 10.8.2.8.49368: Flags [.], ack 96241, win 126, options [nop,nop,TS val 2978981050 ecr 3332504533], length 0
22:33:06.482417 IP 10.8.2.8.49368 > 99.181.97.172.1935: Flags [.], seq 108204:109518, ack 1, win 501, options [nop,nop,TS val 3332505024 ecr 2978981050], length 1314
22:33:06.525231 IP 10.8.2.8.49368 > 99.181.97.172.1935: Flags [.], seq 109518:110832, ack 1, win 501, options [nop,nop,TS val 3332505067 ecr 2978981050], length 1314
22:33:06.531435 IP 99.181.97.172.1935 > 10.8.2.8.49368: Flags [.], ack 98869, win 126, options [nop,nop,TS val 2978981139 ecr 3332504618], length 0
22:33:06.567924 IP 10.8.2.8.49368 > 99.181.97.172.1935: Flags [.], seq 110832:112146, ack 1, win 501, options [nop,nop,TS val 3332505109 ecr 2978981139], length 1314
22:33:06.610856 IP 10.8.2.8.49368 > 99.181.97.172.1935: Flags [.], seq 112146:113460, ack 1, win 501, options [nop,nop,TS val 3332505152 ecr 2978981139], length 1314
22:33:06.610927 IP 99.181.97.172.1935 > 10.8.2.8.49368: Flags [.], ack 101497, win 126, options [nop,nop,TS val 2978981218 ecr 3332504703], length 0
22:33:06.658932 IP 10.8.2.8.49368 > 99.181.97.172.1935: Flags [.], seq 113460:114774, ack 1, win 501, options [nop,nop,TS val 3332505200 ecr 2978981218], length 1314
22:33:06.696360 IP 10.8.2.8.49368 > 99.181.97.172.1935: Flags [.], seq 114774:116088, ack 1, win 501, options [nop,nop,TS val 3332505238 ecr 2978981218], length 1314
22:33:06.702709 IP 99.181.97.172.1935 > 10.8.2.8.49368: Flags [.], ack 104125, win 126, options [nop,nop,TS val 2978981310 ecr 3332504809], length 0
22:33:06.739196 IP 10.8.2.8.49368 > 99.181.97.172.1935: Flags [.], seq 116088:117402, ack 1, win 501, options [nop,nop,TS val 3332505281 ecr 2978981310], length 1314
22:33:06.768602 IP 99.181.97.172.1935 > 10.8.2.8.49368: Flags [.], ack 105576, win 126, options [nop,nop,TS val 2978981370 ecr 3332504874], length 0
22:33:06.768642 IP 10.8.2.8.49368 > 99.181.97.172.1935: Flags [P.], seq 117402:118399, ack 1, win 501, options [nop,nop,TS val 3332505310 ecr 2978981370], length 997
22:33:06.827741 IP 10.8.2.8.49368 > 99.181.97.172.1935: Flags [.], seq 118399:119713, ack 1, win 501, options [nop,nop,TS val 3332505369 ecr 2978981370], length 1314
22:33:06.835538 IP 99.181.97.172.1935 > 10.8.2.8.49368: Flags [.], ack 108204, win 126, options [nop,nop,TS val 2978981442 ecr 3332504938], length 0
22:33:06.867684 IP 10.8.2.8.49368 > 99.181.97.172.1935: Flags [.], seq 119713:121027, ack 1, win 501, options [nop,nop,TS val 3332505409 ecr 2978981442], length 1314
22:33:06.891997 IP 10.8.2.8.49368 > 99.181.97.172.1935: Flags [.], seq 121027:122341, ack 1, win 501, options [nop,nop,TS val 3332505433 ecr 2978981442], length 1314
22:33:06.932672 IP 99.181.97.172.1935 > 10.8.2.8.49368: Flags [.], ack 110832, win 126, options [nop,nop,TS val 2978981540 ecr 3332505024], length 0
22:33:06.959844 IP 10.8.2.8.49368 > 99.181.97.172.1935: Flags [.], seq 122341:123655, ack 1, win 501, options [nop,nop,TS val 3332505501 ecr 2978981540], length 1314
22:33:06.995837 IP 10.8.2.8.49368 > 99.181.97.172.1935: Flags [.], seq 123655:124969, ack 1, win 501, options [nop,nop,TS val 3332505537 ecr 2978981540], length 1314
22:33:07.019766 IP 99.181.97.172.1935 > 10.8.2.8.49368: Flags [.], ack 113460, win 126, options [nop,nop,TS val 2978981626 ecr 3332505109], length 0
22:33:07.038618 IP 10.8.2.8.49368 > 99.181.97.172.1935: Flags [.], seq 124969:126283, ack 1, win 501, options [nop,nop,TS val 3332505580 ecr 2978981626], length 1314
22:33:07.103034 IP 10.8.2.8.49368 > 99.181.97.172.1935: Flags [.], seq 126283:127597, ack 1, win 501, options [nop,nop,TS val 3332505644 ecr 2978981626], length 1314
22:33:07.105582 IP 99.181.97.172.1935 > 10.8.2.8.49368: Flags [.], ack 116088, win 126, options [nop,nop,TS val 2978981712 ecr 3332505200], length 0
22:33:07.126611 IP 10.8.2.8.49368 > 99.181.97.172.1935: Flags [.], seq 127597:128911, ack 1, win 501, options [nop,nop,TS val 3332505668 ecr 2978981712], length 1314
22:33:07.166875 IP 10.8.2.8.49368 > 99.181.97.172.1935: Flags [.], seq 128911:130225, ack 1, win 501, options [nop,nop,TS val 3332505708 ecr 2978981712], length 1314
22:33:07.176460 IP 99.181.97.172.1935 > 10.8.2.8.49368: Flags [.], ack 118399, win 126, options [nop,nop,TS val 2978981784 ecr 3332505281], length 0
22:33:07.176475 IP 10.8.2.8.49368 > 99.181.97.172.1935: Flags [P.], seq 130225:130362, ack 1, win 501, options [nop,nop,TS val 3332505718 ecr 2978981784], length 137
22:33:07.230876 IP 10.8.2.8.49368 > 99.181.97.172.1935: Flags [.], seq 130362:131676, ack 1, win 501, options [nop,nop,TS val 3332505772 ecr 2978981784], length 1314
22:33:07.273893 IP 10.8.2.8.49368 > 99.181.97.172.1935: Flags [.], seq 131676:132990, ack 1, win 501, options [nop,nop,TS val 3332505815 ecr 2978981784], length 1314
22:33:07.275537 IP 99.181.97.172.1935 > 10.8.2.8.49368: Flags [.], ack 121027, win 126, options [nop,nop,TS val 2978981882 ecr 3332505369], length 0
22:33:07.295331 IP 10.8.2.8.49368 > 99.181.97.172.1935: Flags [.], seq 132990:134304, ack 1, win 501, options [nop,nop,TS val 3332505837 ecr 2978981882], length 1314
22:33:07.359064 IP 10.8.2.8.49368 > 99.181.97.172.1935: Flags [.], seq 134304:135618, ack 1, win 501, options [nop,nop,TS val 3332505900 ecr 2978981882], length 1314
22:33:07.364492 IP 99.181.97.172.1935 > 10.8.2.8.49368: Flags [.], ack 122341, win 126, options [nop,nop,TS val 2978981972 ecr 3332505433], length 0
22:33:07.401434 IP 10.8.2.8.49368 > 99.181.97.172.1935: Flags [.], seq 135618:136932, ack 1, win 501, options [nop,nop,TS val 3332505943 ecr 2978981972], length 1314
22:33:07.404973 IP 99.181.97.172.1935 > 10.8.2.8.49368: Flags [.], ack 124969, win 126, options [nop,nop,TS val 2978982010 ecr 3332505501], length 0
22:33:07.423815 IP 10.8.2.8.49368 > 99.181.97.172.1935: Flags [.], seq 136932:138246, ack 1, win 501, options [nop,nop,TS val 3332505965 ecr 2978982010], length 1314
22:33:07.492067 IP 10.8.2.8.49368 > 99.181.97.172.1935: Flags [.], seq 138246:139560, ack 1, win 501, options [nop,nop,TS val 3332506033 ecr 2978982010], length 1314
22:33:07.509864 IP 99.181.97.172.1935 > 10.8.2.8.49368: Flags [.], ack 127597, win 126, options [nop,nop,TS val 2978982117 ecr 3332505580], length 0
22:33:07.528782 IP 10.8.2.8.49368 > 99.181.97.172.1935: Flags [.], seq 139560:140874, ack 1, win 501, options [nop,nop,TS val 3332506070 ecr 2978982117], length 1314
22:33:07.571251 IP 10.8.2.8.49368 > 99.181.97.172.1935: Flags [.], seq 140874:142188, ack 1, win 501, options [nop,nop,TS val 3332506113 ecr 2978982117], length 1314
22:33:07.573511 IP 99.181.97.172.1935 > 10.8.2.8.49368: Flags [.], ack 130225, win 126, options [nop,nop,TS val 2978982181 ecr 3332505668], length 0
22:33:07.583283 IP 99.181.97.172.1935 > 10.8.2.8.49368: Flags [.], ack 130362, win 126, options [nop,nop,TS val 2978982190 ecr 3332505718], length 0
22:33:07.583295 IP 10.8.2.8.49368 > 99.181.97.172.1935: Flags [P.], seq 142188:142338, ack 1, win 501, options [nop,nop,TS val 3332506125 ecr 2978982190], length 150
22:33:07.635385 IP 10.8.2.8.49368 > 99.181.97.172.1935: Flags [.], seq 142338:143652, ack 1, win 501, options [nop,nop,TS val 3332506177 ecr 2978982190], length 1314
22:33:07.659105 IP 10.8.2.8.49368 > 99.181.97.172.1935: Flags [.], seq 143652:144966, ack 1, win 501, options [nop,nop,TS val 3332506200 ecr 2978982190], length 1314
22:33:07.680962 IP 99.181.97.172.1935 > 10.8.2.8.49368: Flags [.], ack 132990, win 126, options [nop,nop,TS val 2978982289 ecr 3332505772], length 0
22:33:07.699106 IP 10.8.2.8.49368 > 99.181.97.172.1935: Flags [.], seq 144966:146280, ack 1, win 501, options [nop,nop,TS val 3332506241 ecr 2978982289], length 1314
22:33:07.762912 IP 10.8.2.8.49368 > 99.181.97.172.1935: Flags [.], seq 146280:147594, ack 1, win 501, options [nop,nop,TS val 3332506304 ecr 2978982289], length 1314
22:33:07.765097 IP 99.181.97.172.1935 > 10.8.2.8.49368: Flags [.], ack 134304, win 126, options [nop,nop,TS val 2978982372 ecr 3332505837], length 0
22:33:07.805643 IP 10.8.2.8.49368 > 99.181.97.172.1935: Flags [.], seq 147594:148908, ack 1, win 501, options [nop,nop,TS val 3332506347 ecr 2978982372], length 1314
22:33:07.811874 IP 99.181.97.172.1935 > 10.8.2.8.49368: Flags [.], ack 136932, win 126, options [nop,nop,TS val 2978982416 ecr 3332505900], length 0
22:33:07.828365 IP 10.8.2.8.49368 > 99.181.97.172.1935: Flags [.], seq 148908:150222, ack 1, win 501, options [nop,nop,TS val 3332506370 ecr 2978982416], length 1314
22:33:07.890970 IP 10.8.2.8.49368 > 99.181.97.172.1935: Flags [.], seq 150222:151536, ack 1, win 501, options [nop,nop,TS val 3332506432 ecr 2978982416], length 1314
22:33:07.899142 IP 99.181.97.172.1935 > 10.8.2.8.49368: Flags [.], ack 139560, win 126, options [nop,nop,TS val 2978982506 ecr 3332505965], length 0
22:33:07.933560 IP 10.8.2.8.49368 > 99.181.97.172.1935: Flags [.], seq 151536:152850, ack 1, win 501, options [nop,nop,TS val 3332506475 ecr 2978982506], length 1314
22:33:07.959272 IP 10.8.2.8.49368 > 99.181.97.172.1935: Flags [.], seq 152850:154164, ack 1, win 501, options [nop,nop,TS val 3332506501 ecr 2978982506], length 1314
22:33:07.978137 IP 99.181.97.172.1935 > 10.8.2.8.49368: Flags [.], ack 142188, win 126, options [nop,nop,TS val 2978982586 ecr 3332506070], length 0
22:33:07.989693 IP 99.181.97.172.1935 > 10.8.2.8.49368: Flags [.], ack 142338, win 126, options [nop,nop,TS val 2978982597 ecr 3332506125], length 0
22:33:07.989717 IP 10.8.2.8.49368 > 99.181.97.172.1935: Flags [P.], seq 154164:154306, ack 1, win 501, options [nop,nop,TS val 3332506531 ecr 2978982597], length 142
22:33:08.027670 IP 10.8.2.8.49368 > 99.181.97.172.1935: Flags [.], seq 154306:155620, ack 1, win 501, options [nop,nop,TS val 3332506569 ecr 2978982597], length 1314
22:33:08.061949 IP 10.8.2.8.49368 > 99.181.97.172.1935: Flags [.], seq 155620:156934, ack 1, win 501, options [nop,nop,TS val 3332506603 ecr 2978982597], length 1314
22:33:08.068124 IP 99.181.97.172.1935 > 10.8.2.8.49368: Flags [.], ack 144966, win 126, options [nop,nop,TS val 2978982675 ecr 3332506177], length 0
22:33:08.104964 IP 10.8.2.8.49368 > 99.181.97.172.1935: Flags [.], seq 156934:158248, ack 1, win 501, options [nop,nop,TS val 3332506646 ecr 2978982675], length 1314
22:33:08.169154 IP 10.8.2.8.49368 > 99.181.97.172.1935: Flags [.], seq 158248:159562, ack 1, win 501, options [nop,nop,TS val 3332506711 ecr 2978982675], length 1314
22:33:08.171233 IP 99.181.97.172.1935 > 10.8.2.8.49368: Flags [.], ack 147594, win 126, options [nop,nop,TS val 2978982778 ecr 3332506241], length 0
22:33:08.195064 IP 10.8.2.8.49368 > 99.181.97.172.1935: Flags [.], seq 159562:160876, ack 1, win 501, options [nop,nop,TS val 3332506736 ecr 2978982778], length 1314
22:33:08.233718 IP 10.8.2.8.49368 > 99.181.97.172.1935: Flags [.], seq 160876:162190, ack 1, win 501, options [nop,nop,TS val 3332506775 ecr 2978982778], length 1314
22:33:08.238165 IP 99.181.97.172.1935 > 10.8.2.8.49368: Flags [.], ack 150222, win 126, options [nop,nop,TS val 2978982844 ecr 3332506347], length 0
22:33:08.297800 IP 10.8.2.8.49368 > 99.181.97.172.1935: Flags [.], seq 162190:163504, ack 1, win 501, options [nop,nop,TS val 3332506839 ecr 2978982844], length 1314
22:33:08.340744 IP 10.8.2.8.49368 > 99.181.97.172.1935: Flags [.], seq 163504:164818, ack 1, win 501, options [nop,nop,TS val 3332506882 ecr 2978982844], length 1314
22:33:08.340789 IP 99.181.97.172.1935 > 10.8.2.8.49368: Flags [.], ack 152850, win 126, options [nop,nop,TS val 2978982948 ecr 3332506432], length 0
22:33:08.362190 IP 10.8.2.8.49368 > 99.181.97.172.1935: Flags [.], seq 164818:166132, ack 1, win 501, options [nop,nop,TS val 3332506904 ecr 2978982948], length 1314
22:33:08.395838 IP 99.181.97.172.1935 > 10.8.2.8.49368: Flags [.], ack 154306, win 126, options [nop,nop,TS val 2978983004 ecr 3332506501], length 0
22:33:08.395870 IP 10.8.2.8.49368 > 99.181.97.172.1935: Flags [P.], seq 166132:166372, ack 1, win 501, options [nop,nop,TS val 3332506937 ecr 2978983004], length 240
22:33:08.426206 IP 10.8.2.8.49368 > 99.181.97.172.1935: Flags [.], seq 166372:167686, ack 1, win 501, options [nop,nop,TS val 3332506968 ecr 2978983004], length 1314
22:33:08.469175 IP 10.8.2.8.49368 > 99.181.97.172.1935: Flags [.], seq 167686:169000, ack 1, win 501, options [nop,nop,TS val 3332507011 ecr 2978983004], length 1314
22:33:08.469746 IP 99.181.97.172.1935 > 10.8.2.8.49368: Flags [.], ack 156934, win 126, options [nop,nop,TS val 2978983077 ecr 3332506569], length 0
22:33:08.525343 IP 10.8.2.8.49368 > 99.181.97.172.1935: Flags [.], seq 169000:170314, ack 1, win 501, options [nop,nop,TS val 3332507067 ecr 2978983077], length 1314
22:33:08.559589 IP 10.8.2.8.49368 > 99.181.97.172.1935: Flags [.], seq 170314:171628, ack 1, win 501, options [nop,nop,TS val 3332507101 ecr 2978983077], length 1314
22:33:08.581364 IP 99.181.97.172.1935 > 10.8.2.8.49368: Flags [.], ack 159562, win 126, options [nop,nop,TS val 2978983189 ecr 3332506646], length 0
22:33:08.597741 IP 10.8.2.8.49368 > 99.181.97.172.1935: Flags [.], seq 171628:172942, ack 1, win 501, options [nop,nop,TS val 3332507139 ecr 2978983189], length 1314
22:33:08.643361 IP 99.181.97.172.1935 > 10.8.2.8.49368: Flags [.], ack 162190, win 126, options [nop,nop,TS val 2978983250 ecr 3332506736], length 0
22:33:08.660445 IP 10.8.2.8.49368 > 99.181.97.172.1935: Flags [.], seq 172942:174256, ack 1, win 501, options [nop,nop,TS val 3332507202 ecr 2978983250], length 1314
22:33:08.704672 IP 10.8.2.8.49368 > 99.181.97.172.1935: Flags [.], seq 174256:175570, ack 1, win 501, options [nop,nop,TS val 3332507246 ecr 2978983250], length 1314
22:33:08.726453 IP 10.8.2.8.49368 > 99.181.97.172.1935: Flags [.], seq 175570:176884, ack 1, win 501, options [nop,nop,TS val 3332507268 ecr 2978983250], length 1314
22:33:08.751750 IP 99.181.97.172.1935 > 10.8.2.8.49368: Flags [.], ack 164818, win 126, options [nop,nop,TS val 2978983358 ecr 3332506839], length 0
22:33:08.790430 IP 10.8.2.8.49368 > 99.181.97.172.1935: Flags [.], seq 176884:178198, ack 1, win 501, options [nop,nop,TS val 3332507332 ecr 2978983358], length 1314
22:33:08.804006 IP 99.181.97.172.1935 > 10.8.2.8.49368: Flags [.], ack 166372, win 126, options [nop,nop,TS val 2978983412 ecr 3332506904], length 0
22:33:08.804045 IP 10.8.2.8.49368 > 99.181.97.172.1935: Flags [P.], seq 178198:179091, ack 1, win 501, options [nop,nop,TS val 3332507345 ecr 2978983412], length 893
22:33:08.875927 IP 10.8.2.8.49368 > 99.181.97.172.1935: Flags [.], seq 179091:180405, ack 1, win 501, options [nop,nop,TS val 3332507417 ecr 2978983412], length 1314
22:33:08.879332 IP 99.181.97.172.1935 > 10.8.2.8.49368: Flags [.], ack 166372, win 126, options [nop,nop,TS val 2978983487 ecr 3332506904,nop,nop,sack 1 {167686:169000}], length 0
22:33:08.897178 IP 10.8.2.8.49368 > 99.181.97.172.1935: Flags [.], seq 180405:181719, ack 1, win 501, options [nop,nop,TS val 3332507439 ecr 2978983487], length 1314
22:33:08.933287 IP 99.181.97.172.1935 > 10.8.2.8.49368: Flags [.], ack 166372, win 126, options [nop,nop,TS val 2978983541 ecr 3332506904,nop,nop,sack 1 {167686:170314}], length 0
22:33:08.939622 IP 10.8.2.8.49368 > 99.181.97.172.1935: Flags [.], seq 181719:183033, ack 1, win 501, options [nop,nop,TS val 3332507481 ecr 2978983541], length 1314
22:33:08.946163 IP 10.8.2.8.49368 > 99.181.97.172.1935: Flags [.], seq 166372:167686, ack 1, win 501, options [nop,nop,TS val 3332507488 ecr 2978983541], length 1314
22:33:08.967367 IP 99.181.97.172.1935 > 10.8.2.8.49368: Flags [.], ack 166372, win 126, options [nop,nop,TS val 2978983574 ecr 3332506904,nop,nop,sack 1 {167686:171628}], length 0
22:33:09.004089 IP 10.8.2.8.49368 > 99.181.97.172.1935: Flags [.], seq 183033:184347, ack 1, win 501, options [nop,nop,TS val 3332507545 ecr 2978983574], length 1314
22:33:09.006588 IP 99.181.97.172.1935 > 10.8.2.8.49368: Flags [.], ack 166372, win 126, options [nop,nop,TS val 2978983613 ecr 3332506904,nop,nop,sack 1 {167686:172942}], length 0
22:33:09.025488 IP 10.8.2.8.49368 > 99.181.97.172.1935: Flags [.], seq 184347:185661, ack 1, win 501, options [nop,nop,TS val 3332507567 ecr 2978983613], length 1314
22:33:09.070627 IP 99.181.97.172.1935 > 10.8.2.8.49368: Flags [.], ack 166372, win 126, options [nop,nop,TS val 2978983677 ecr 3332506904,nop,nop,sack 1 {167686:174256}], length 0
22:33:09.070672 IP 10.8.2.8.49368 > 99.181.97.172.1935: Flags [.], seq 185661:186975, ack 1, win 501, options [nop,nop,TS val 3332507612 ecr 2978983677], length 1314
22:33:09.112773 IP 99.181.97.172.1935 > 10.8.2.8.49368: Flags [.], ack 166372, win 126, options [nop,nop,TS val 2978983719 ecr 3332506904,nop,nop,sack 1 {167686:175570}], length 0
22:33:09.132595 IP 10.8.2.8.49368 > 99.181.97.172.1935: Flags [.], seq 186975:188289, ack 1, win 501, options [nop,nop,TS val 3332507674 ecr 2978983719], length 1314
22:33:09.134740 IP 99.181.97.172.1935 > 10.8.2.8.49368: Flags [.], ack 166372, win 126, options [nop,nop,TS val 2978983741 ecr 3332506904,nop,nop,sack 1 {167686:176884}], length 0
22:33:09.175390 IP 10.8.2.8.49368 > 99.181.97.172.1935: Flags [.], seq 188289:189603, ack 1, win 501, options [nop,nop,TS val 3332507717 ecr 2978983741], length 1314
22:33:09.199327 IP 99.181.97.172.1935 > 10.8.2.8.49368: Flags [.], ack 166372, win 126, options [nop,nop,TS val 2978983805 ecr 3332506904,nop,nop,sack 1 {167686:178198}], length 0
22:33:09.199346 IP 10.8.2.8.49368 > 99.181.97.172.1935: Flags [.], seq 189603:190917, ack 1, win 501, options [nop,nop,TS val 3332507741 ecr 2978983805], length 1314
22:33:09.219663 IP 99.181.97.172.1935 > 10.8.2.8.49368: Flags [.], ack 166372, win 126, options [nop,nop,TS val 2978983825 ecr 3332506904,nop,nop,sack 1 {167686:179091}], length 0
22:33:09.261768 IP 10.8.2.8.49368 > 99.181.97.172.1935: Flags [.], seq 190917:192231, ack 1, win 501, options [nop,nop,TS val 3332507803 ecr 2978983825], length 1314
22:33:09.284354 IP 99.181.97.172.1935 > 10.8.2.8.49368: Flags [.], ack 166372, win 126, options [nop,nop,TS val 2978983891 ecr 3332506904,nop,nop,sack 1 {167686:180405}], length 0
22:33:09.303811 IP 10.8.2.8.49368 > 99.181.97.172.1935: Flags [.], seq 192231:193545, ack 1, win 501, options [nop,nop,TS val 3332507845 ecr 2978983891], length 1314
22:33:09.307196 IP 99.181.97.172.1935 > 10.8.2.8.49368: Flags [.], ack 166372, win 126, options [nop,nop,TS val 2978983911 ecr 3332506904,nop,nop,sack 1 {167686:181719}], length 0
22:33:09.327990 IP 10.8.2.8.49368 > 99.181.97.172.1935: Flags [.], seq 193545:194859, ack 1, win 501, options [nop,nop,TS val 3332507869 ecr 2978983911], length 1314
22:33:09.348158 IP 99.181.97.172.1935 > 10.8.2.8.49368: Flags [.], ack 166372, win 126, options [nop,nop,TS val 2978983955 ecr 3332506904,nop,nop,sack 1 {167686:183033}], length 0
