19:23:47.444685 IP 10.8.3.4.60620 > 99.181.90.103.1935: Flags [.], seq 2808151281:2808152595, ack 487915449, win 501, options [nop,nop,TS val 1276828695 ecr 3928197857], length 1314
19:23:47.452095 IP 99.181.90.103.1935 > 10.8.3.4.60620: Flags [.], ack 4294955696, win 126, options [nop,nop,TS val 3928197964 ecr 1276828218], length 0
19:23:47.479427 IP 10.8.3.4.60620 > 99.181.90.103.1935: Flags [.], seq 1314:2628, ack 1, win 501, options [nop,nop,TS val 1276828730 ecr 3928197964], length 1314
19:23:47.521848 IP 10.8.3.4.60620 > 99.181.90.103.1935: Flags [.], seq 2628:3942, ack 1, win 501, options [nop,nop,TS val 1276828772 ecr 3928197964], length 1314
19:23:47.538066 IP 99.181.90.103.1935 > 10.8.3.4.60620: Flags [.], ack 4294958324, win 126, options [nop,nop,TS val 3928198050 ecr 1276828294], length 0
19:23:47.585741 IP 10.8.3.4.60620 > 99.181.90.103.1935: Flags [.], seq 3942:5256, ack 1, win 501, options [nop,nop,TS val 1276828836 ecr 3928198050], length 1314
19:23:47.619979 IP 99.181.90.103.1935 > 10.8.3.4.60620: Flags [.], ack 4294960952, win 126, options [nop,nop,TS val 3928198132 ecr 1276828398], length 0
19:23:47.628479 IP 10.8.3.4.60620 > 99.181.90.103.1935: Flags [.], seq 5256:6570, ack 1, win 501, options [nop,nop,TS val 1276828879 ecr 3928198132], length 1314
19:23:47.670943 IP 10.8.3.4.60620 > 99.181.90.103.1935: Flags [.], seq 6570:7884, ack 1, win 501, options [nop,nop,TS val 1276828921 ecr 3928198132], length 1314
19:23:47.713385 IP 10.8.3.4.60620 > 99.181.90.103.1935: Flags [.], seq 7884:9198, ack 1, win 501, options [nop,nop,TS val 1276828964 ecr 3928198132], length 1314
19:23:47.716052 IP 99.181.90.103.1935 > 10.8.3.4.60620: Flags [.], ack 4294963354, win 126, options [nop,nop,TS val 3928198228 ecr 1276828474], length 0
19:23:47.716061 IP 10.8.3.4.60620 > 99.181.90.103.1935: Flags [P.], seq 9198:9816, ack 1, win 501, options [nop,nop,TS val 1276828966 ecr 3928198228], length 618
19:23:47.786180 IP 99.181.90.103.1935 > 10.8.3.4.60620: Flags [.], ack 4294965982, win 126, options [nop,nop,TS val 3928198298 ecr 1276828564], length 0
19:23:47.798959 IP 10.8.3.4.60620 > 99.181.90.103.1935: Flags [.], seq 9816:11130, ack 1, win 501, options [nop,nop,TS val 1276829049 ecr 3928198298], length 1314
19:23:47.820462 IP 10.8.3.4.60620 > 99.181.90.103.1935: Flags [.], seq 11130:12444, ack 1, win 501, options [nop,nop,TS val 1276829071 ecr 3928198298], length 1314
19:23:47.863050 IP 10.8.3.4.60620 > 99.181.90.103.1935: Flags [.], seq 12444:13758, ack 1, win 501, options [nop,nop,TS val 1276829113 ecr 3928198298], length 1314
19:23:47.886280 IP 99.181.90.103.1935 > 10.8.3.4.60620: Flags [.], ack 1314, win 126, options [nop,nop,TS val 3928198399 ecr 1276828644], length 0
19:23:47.926839 IP 10.8.3.4.60620 > 99.181.90.103.1935: Flags [.], seq 13758:15072, ack 1, win 501, options [nop,nop,TS val 1276829177 ecr 3928198399], length 1314
19:23:47.948011 IP 10.8.3.4.60620 > 99.181.90.103.1935: Flags [.], seq 15072:16386, ack 1, win 501, options [nop,nop,TS val 1276829198 ecr 3928198399], length 1314
19:23:47.963669 IP 99.181.90.103.1935 > 10.8.3.4.60620: Flags [.], ack 3942, win 126, options [nop,nop,TS val 3928198476 ecr 1276828730], length 0
19:23:47.990365 IP 10.8.3.4.60620 > 99.181.90.103.1935: Flags [.], seq 16386:17700, ack 1, win 501, options [nop,nop,TS val 1276829241 ecr 3928198476], length 1314
19:23:48.054233 IP 10.8.3.4.60620 > 99.181.90.103.1935: Flags [.], seq 17700:19014, ack 1, win 501, options [nop,nop,TS val 1276829305 ecr 3928198476], length 1314
19:23:48.070325 IP 99.181.90.103.1935 > 10.8.3.4.60620: Flags [.], ack 6570, win 126, options [nop,nop,TS val 3928198582 ecr 1276828836], length 0
19:23:48.096658 IP 10.8.3.4.60620 > 99.181.90.103.1935: Flags [.], seq 19014:20328, ack 1, win 501, options [nop,nop,TS val 1276829347 ecr 3928198582], length 1314
19:23:48.118215 IP 10.8.3.4.60620 > 99.181.90.103.1935: Flags [.], seq 20328:21642, ack 1, win 501, options [nop,nop,TS val 1276829369 ecr 3928198582], length 1314
19:23:48.154965 IP 99.181.90.103.1935 > 10.8.3.4.60620: Flags [.], ack 9198, win 126, options [nop,nop,TS val 3928198667 ecr 1276828921], length 0
19:23:48.157515 IP 99.181.90.103.1935 > 10.8.3.4.60620: Flags [.], ack 9816, win 126, options [nop,nop,TS val 3928198670 ecr 1276828966], length 0
19:23:48.157548 IP 10.8.3.4.60620 > 99.181.90.103.1935: Flags [P.], seq 21642:21982, ack 1, win 501, options [nop,nop,TS val 1276829408 ecr 3928198670], length 340
19:23:48.182302 IP 10.8.3.4.60620 > 99.181.90.103.1935: Flags [.], seq 21982:23296, ack 1, win 501, options [nop,nop,TS val 1276829433 ecr 3928198670], length 1314
19:23:48.225054 IP 10.8.3.4.60620 > 99.181.90.103.1935: Flags [.], seq 23296:24610, ack 1, win 501, options [nop,nop,TS val 1276829475 ecr 3928198670], length 1314
19:23:48.261949 IP 99.181.90.103.1935 > 10.8.3.4.60620: Flags [.], ack 12444, win 126, options [nop,nop,TS val 3928198774 ecr 1276829049], length 0
19:23:48.278848 IP 10.8.3.4.60620 > 99.181.90.103.1935: Flags [.], seq 24610:25924, ack 1, win 501, options [nop,nop,TS val 1276829529 ecr 3928198774], length 1314
19:23:48.331887 IP 10.8.3.4.60620 > 99.181.90.103.1935: Flags [.], seq 25924:27238, ack 1, win 501, options [nop,nop,TS val 1276829582 ecr 3928198774], length 1314
19:23:48.353401 IP 10.8.3.4.60620 > 99.181.90.103.1935: Flags [.], seq 27238:28552, ack 1, win 501, options [nop,nop,TS val 1276829604 ecr 3928198774], length 1314
19:23:48.368366 IP 99.181.90.103.1935 > 10.8.3.4.60620: Flags [.], ack 15072, win 126, options [nop,nop,TS val 3928198881 ecr 1276829113], length 0
19:23:48.414033 IP 10.8.3.4.60620 > 99.181.90.103.1935: Flags [.], seq 28552:29866, ack 1, win 501, options [nop,nop,TS val 1276829664 ecr 3928198881], length 1314
19:23:48.431927 IP 99.181.90.103.1935 > 10.8.3.4.60620: Flags [.], ack 17700, win 126, options [nop,nop,TS val 3928198944 ecr 1276829198], length 0
19:23:48.460260 IP 10.8.3.4.60620 > 99.181.90.103.1935: Flags [.], seq 29866:31180, ack 1, win 501, options [nop,nop,TS val 1276829711 ecr 3928198944], length 1314
19:23:48.481435 IP 10.8.3.4.60620 > 99.181.90.103.1935: Flags [.], seq 31180:32494, ack 1, win 501, options [nop,nop,TS val 1276829732 ecr 3928198944], length 1314
19:23:48.538746 IP 99.181.90.103.1935 > 10.8.3.4.60620: Flags [.], ack 20328, win 126, options [nop,nop,TS val 3928199051 ecr 1276829305], length 0
19:23:48.545392 IP 10.8.3.4.60620 > 99.181.90.103.1935: Flags [.], seq 32494:33808, ack 1, win 501, options [nop,nop,TS val 1276829796 ecr 3928199051], length 1314
19:23:48.588312 IP 10.8.3.4.60620 > 99.181.90.103.1935: Flags [.], seq 33808:35122, ack 1, win 501, options [nop,nop,TS val 1276829839 ecr 3928199051], length 1314
19:23:48.599152 IP 99.181.90.103.1935 > 10.8.3.4.60620: Flags [.], ack 21982, win 126, options [nop,nop,TS val 3928199111 ecr 1276829369], length 0
19:23:48.599192 IP 10.8.3.4.60620 > 99.181.90.103.1935: Flags [P.], seq 35122:35731, ack 1, win 501, options [nop,nop,TS val 1276829850 ecr 3928199111], length 609
19:23:48.652601 IP 10.8.3.4.60620 > 99.181.90.103.1935: Flags [.], seq 35731:37045, ack 1, win 501, options [nop,nop,TS val 1276829903 ecr 3928199111], length 1314
19:23:48.666796 IP 99.181.90.103.1935 > 10.8.3.4.60620: Flags [.], ack 24610, win 126, options [nop,nop,TS val 3928199179 ecr 1276829433], length 0
19:23:48.679520 IP 10.8.3.4.60620 > 99.181.90.103.1935: Flags [.], seq 37045:38359, ack 1, win 501, options [nop,nop,TS val 1276829930 ecr 3928199179], length 1314
19:23:48.711911 IP 10.8.3.4.60620 > 99.181.90.103.1935: Flags [.], seq 38359:39673, ack 1, win 501, options [nop,nop,TS val 1276829962 ecr 3928199179], length 1314
19:23:48.773499 IP 99.181.90.103.1935 > 10.8.3.4.60620: Flags [.], ack 27238, win 126, options [nop,nop,TS val 3928199286 ecr 1276829529], length 0
19:23:48.776407 IP 10.8.3.4.60620 > 99.181.90.103.1935: Flags [.], seq 39673:40987, ack 1, win 501, options [nop,nop,TS val 1276830027 ecr 3928199286], length 1314
19:23:48.822757 IP 10.8.3.4.60620 > 99.181.90.103.1935: Flags [.], seq 40987:42301, ack 1, win 501, options [nop,nop,TS val 1276830073 ecr 3928199286], length 1314
19:23:48.855681 IP 99.181.90.103.1935 > 10.8.3.4.60620: Flags [.], ack 29866, win 126, options [nop,nop,TS val 3928199368 ecr 1276829604], length 0
19:23:48.865399 IP 10.8.3.4.60620 > 99.181.90.103.1935: Flags [.], seq 42301:43615, ack 1, win 501, options [nop,nop,TS val 1276830116 ecr 3928199368], length 1314
19:23:48.923012 IP 99.181.90.103.1935 > 10.8.3.4.60620: Flags [.], ack 32494, win 126, options [nop,nop,TS val 3928199435 ecr 1276829711], length 0
19:23:48.929485 IP 10.8.3.4.60620 > 99.181.90.103.1935: Flags [.], seq 43615:44929, ack 1, win 501, options [nop,nop,TS val 1276830180 ecr 3928199435], length 1314
19:23:48.950863 IP 10.8.3.4.60620 > 99.181.90.103.1935: Flags [.], seq 44929:46243, ack 1, win 501, options [nop,nop,TS val 1276830201 ecr 3928199435], length 1314
19:23:48.993269 IP 10.8.3.4.60620 > 99.181.90.103.1935: Flags [.], seq 46243:47557, ack 1, win 501, options [nop,nop,TS val 1276830244 ecr 3928199435], length 1314
19:23:49.030005 IP 99.181.90.103.1935 > 10.8.3.4.60620: Flags [.], ack 35122, win 126, options [nop,nop,TS val 3928199542 ecr 1276829796], length 0
19:23:49.040818 IP 99.181.90.103.1935 > 10.8.3.4.60620: Flags [.], ack 35731, win 126, options [nop,nop,TS val 3928199553 ecr 1276829850], length 0
19:23:49.040856 IP 10.8.3.4.60620 > 99.181.90.103.1935: Flags [P.], seq 47557:48749, ack 1, win 501, options [nop,nop,TS val 1276830291 ecr 3928199553], length 1192
19:23:49.080209 IP 10.8.3.4.60620 > 99.181.90.103.1935: Flags [.], seq 48749:50063, ack 1, win 501, options [nop,nop,TS val 1276830331 ecr 3928199553], length 1314
19:23:49.121136 IP 99.181.90.103.1935 > 10.8.3.4.60620: Flags [.], ack 38359, win 126, options [nop,nop,TS val 3928199633 ecr 1276829903], length 0
19:23:49.122108 IP 10.8.3.4.60620 > 99.181.90.103.1935: Flags [.], seq 50063:51377, ack 1, win 501, options [nop,nop,TS val 1276830372 ecr 3928199633], length 1314
19:23:49.147306 IP 10.8.3.4.60620 > 99.181.90.103.1935: Flags [.], seq 51377:52691, ack 1, win 501, options [nop,nop,TS val 1276830398 ecr 3928199633], length 1314
19:23:49.212857 IP 10.8.3.4.60620 > 99.181.90.103.1935: Flags [.], seq 52691:54005, ack 1, win 501, options [nop,nop,TS val 1276830463 ecr 3928199633], length 1314
19:23:49.218115 IP 99.181.90.103.1935 > 10.8.3.4.60620: Flags [.], ack 39673, win 126, options [nop,nop,TS val 3928199730 ecr 1276829962], length 0
19:23:49.245210 IP 10.8.3.4.60620 > 99.181.90.103.1935: Flags [.], seq 54005:55319, ack 1, win 501, options [nop,nop,TS val 1276830496 ecr 3928199730], length 1314
19:23:49.264483 IP 99.181.90.103.1935 > 10.8.3.4.60620: Flags [.], ack 42301, win 126, options [nop,nop,TS val 3928199777 ecr 1276830027], length 0
19:23:49.276702 IP 10.8.3.4.60620 > 99.181.90.103.1935: Flags [.], seq 55319:56633, ack 1, win 501, options [nop,nop,TS val 1276830527 ecr 3928199777], length 1314
19:23:49.347408 IP 10.8.3.4.60620 > 99.181.90.103.1935: Flags [.], seq 56633:57947, ack 1, win 501, options [nop,nop,TS val 1276830598 ecr 3928199777], length 1314
19:23:49.371187 IP 99.181.90.103.1935 > 10.8.3.4.60620: Flags [.], ack 44929, win 126, options [nop,nop,TS val 3928199883 ecr 1276830116], length 0
19:23:49.380757 IP 10.8.3.4.60620 > 99.181.90.103.1935: Flags [.], seq 57947:59261, ack 1, win 501, options [nop,nop,TS val 1276830631 ecr 3928199883], length 1314
19:23:49.414343 IP 10.8.3.4.60620 > 99.181.90.103.1935: Flags [.], seq 59261:60575, ack 1, win 501, options [nop,nop,TS val 1276830665 ecr 3928199883], length 1314
19:23:49.435156 IP 99.181.90.103.1935 > 10.8.3.4.60620: Flags [.], ack 47557, win 126, options [nop,nop,TS val 3928199947 ecr 1276830201], length 0
19:23:49.479995 IP 10.8.3.4.60620 > 99.181.90.103.1935: Flags [.], seq 60575:61889, ack 1, win 501, options [nop,nop,TS val 1276830730 ecr 3928199947], length 1314
19:23:49.482528 IP 99.181.90.103.1935 > 10.8.3.4.60620: Flags [.], ack 48749, win 126, options [nop,nop,TS val 3928199995 ecr 1276830291], length 0
19:23:49.482550 IP 10.8.3.4.60620 > 99.181.90.103.1935: Flags [P.], seq 61889:62597, ack 1, win 501, options [nop,nop,TS val 1276830733 ecr 3928199995], length 708
19:23:49.546724 IP 10.8.3.4.60620 > 99.181.90.103.1935: Flags [.], seq 62597:63911, ack 1, win 501, options [nop,nop,TS val 1276830797 ecr 3928199995], length 1314
19:23:49.563780 IP 99.181.90.103.1935 > 10.8.3.4.60620: Flags [.], ack 51377, win 126, options [nop,nop,TS val 3928200076 ecr 1276830331], length 0
19:23:49.580754 IP 10.8.3.4.60620 > 99.181.90.103.1935: Flags [.], seq 63911:65225, ack 1, win 501, options [nop,nop,TS val 1276830831 ecr 3928200076], length 1314
19:23:49.613044 IP 10.8.3.4.60620 > 99.181.90.103.1935: Flags [.], seq 65225:66539, ack 1, win 501, options [nop,nop,TS val 1276830863 ecr 3928200076], length 1314
19:23:49.654275 IP 99.181.90.103.1935 > 10.8.3.4.60620: Flags [.], ack 52691, win 126, options [nop,nop,TS val 3928200166 ecr 1276830398], length 0
19:23:49.677308 IP 10.8.3.4.60620 > 99.181.90.103.1935: Flags [.], seq 66539:67853, ack 1, win 501, options [nop,nop,TS val 1276830928 ecr 3928200166], length 1314
19:23:49.686657 IP 99.181.90.103.1935 > 10.8.3.4.60620: Flags [.], ack 55319, win 126, options [nop,nop,TS val 3928200199 ecr 1276830463], length 0
19:23:49.711250 IP 10.8.3.4.60620 > 99.181.90.103.1935: Flags [.], seq 67853:69167, ack 1, win 501, options [nop,nop,TS val 1276830962 ecr 3928200199], length 1314
19:23:49.747515 IP 10.8.3.4.60620 > 99.181.90.103.1935: Flags [.], seq 69167:70481, ack 1, win 501, options [nop,nop,TS val 1276830998 ecr 3928200199], length 1314
19:23:49.789291 IP 99.181.90.103.1935 > 10.8.3.4.60620: Flags [.], ack 57947, win 126, options [nop,nop,TS val 3928200301 ecr 1276830527], length 0
19:23:49.809933 IP 10.8.3.4.60620 > 99.181.90.103.1935: Flags [.], seq 70481:71795, ack 1, win 501, options [nop,nop,TS val 1276831060 ecr 3928200301], length 1314
19:23:49.843892 IP 10.8.3.4.60620 > 99.181.90.103.1935: Flags [.], seq 71795:73109, ack 1, win 501, options [nop,nop,TS val 1276831094 ecr 3928200301], length 1314
19:23:49.856371 IP 99.181.90.103.1935 > 10.8.3.4.60620: Flags [.], ack 60575, win 126, options [nop,nop,TS val 3928200368 ecr 1276830631], length 0
19:23:49.880592 IP 10.8.3.4.60620 > 99.181.90.103.1935: Flags [.], seq 73109:74423, ack 1, win 501, options [nop,nop,TS val 1276831131 ecr 3928200368], length 1314
19:23:49.923922 IP 99.181.90.103.1935 > 10.8.3.4.60620: Flags [.], ack 62597, win 126, options [nop,nop,TS val 3928200436 ecr 1276830730], length 0
19:23:49.923935 IP 10.8.3.4.60620 > 99.181.90.103.1935: Flags [P.], seq 74423:75611, ack 1, win 501, options [nop,nop,TS val 1276831174 ecr 3928200436], length 1188
19:23:49.977519 IP 10.8.3.4.60620 > 99.181.90.103.1935: Flags [.], seq 75611:76925, ack 1, win 501, options [nop,nop,TS val 1276831228 ecr 3928200436], length 1314
19:23:50.014439 IP 10.8.3.4.60620 > 99.181.90.103.1935: Flags [.], seq 76925:78239, ack 1, win 501, options [nop,nop,TS val 1276831265 ecr 3928200436], length 1314
19:23:50.022608 IP 99.181.90.103.1935 > 10.8.3.4.60620: Flags [.], ack 65225, win 126, options [nop,nop,TS val 3928200535 ecr 1276830797], length 0
19:23:50.047601 IP 10.8.3.4.60620 > 99.181.90.103.1935: Flags [.], seq 78239:79553, ack 1, win 501, options [nop,nop,TS val 1276831298 ecr 3928200535], length 1314
19:23:50.111591 IP 10.8.3.4.60620 > 99.181.90.103.1935: Flags [.], seq 79553:80867, ack 1, win 501, options [nop,nop,TS val 1276831362 ecr 3928200535], length 1314
19:23:50.119145 IP 99.181.90.103.1935 > 10.8.3.4.60620: Flags [.], ack 67853, win 126, options [nop,nop,TS val 3928200631 ecr 1276830863], length 0
19:23:50.143779 IP 10.8.3.4.60620 > 99.181.90.103.1935: Flags [.], seq 80867:82181, ack 1, win 501, options [nop,nop,TS val 1276831394 ecr 3928200631], length 1314
19:23:50.180267 IP 10.8.3.4.60620 > 99.181.90.103.1935: Flags [.], seq 82181:83495, ack 1, win 501, options [nop,nop,TS val 1276831431 ecr 3928200631], length 1314
19:23:50.189368 IP 99.181.90.103.1935 > 10.8.3.4.60620: Flags [.], ack 70481, win 126, options [nop,nop,TS val 3928200702 ecr 1276830962], length 0
19:23:50.247510 IP 10.8.3.4.60620 > 99.181.90.103.1935: Flags [.], seq 83495:84809, ack 1, win 501, options [nop,nop,TS val 1276831498 ecr 3928200702], length 1314
19:23:50.280985 IP 10.8.3.4.60620 > 99.181.90.103.1935: Flags [.], seq 84809:86123, ack 1, win 501, options [nop,nop,TS val 1276831531 ecr 3928200702], length 1314
19:23:50.286058 IP 99.181.90.103.1935 > 10.8.3.4.60620: Flags [.], ack 73109, win 126, options [nop,nop,TS val 3928200798 ecr 1276831060], length 0
19:23:50.311410 IP 10.8.3.4.60620 > 99.181.90.103.1935: Flags [.], seq 86123:87437, ack 1, win 501, options [nop,nop,TS val 1276831562 ecr 3928200798], length 1314
19:23:50.365546 IP 99.181.90.103.1935 > 10.8.3.4.60620: Flags [.], ack 75611, win 126, options [nop,nop,TS val 3928200877 ecr 1276831131], length 0
19:23:50.365563 IP 10.8.3.4.60620 > 99.181.90.103.1935: Flags [P.], seq 87437:88613, ack 1, win 501, options [nop,nop,TS val 1276831616 ecr 3928200877], length 1176
19:23:50.414281 IP 10.8.3.4.60620 > 99.181.90.103.1935: Flags [.], seq 88613:89927, ack 1, win 501, options [nop,nop,TS val 1276831665 ecr 3928200877], length 1314
19:23:50.447934 IP 10.8.3.4.60620 > 99.181.90.103.1935: Flags [.], seq 89927:91241, ack 1, win 501, options [nop,nop,TS val 1276831698 ecr 3928200877], length 1314
19:23:50.456163 IP 99.181.90.103.1935 > 10.8.3.4.60620: Flags [.], ack 78239, win 126, options [nop,nop,TS val 3928200968 ecr 1276831228], length 0
19:23:50.489682 IP 10.8.3.4.60620 > 99.181.90.103.1935: Flags [.], seq 91241:92555, ack 1, win 501, options [nop,nop,TS val 1276831740 ecr 3928200968], length 1314
19:23:50.543794 IP 10.8.3.4.60620 > 99.181.90.103.1935: Flags [.], seq 92555:93869, ack 1, win 501, options [nop,nop,TS val 1276831794 ecr 3928200968], length 1314
19:23:50.553491 IP 99.181.90.103.1935 > 10.8.3.4.60620: Flags [.], ack 80867, win 126, options [nop,nop,TS val 3928201066 ecr 1276831298], length 0
19:23:50.579855 IP 10.8.3.4.60620 > 99.181.90.103.1935: Flags [.], seq 93869:95183, ack 1, win 501, options [nop,nop,TS val 1276831830 ecr 3928201066], length 1314
19:23:50.617946 IP 10.8.3.4.60620 > 99.181.90.103.1935: Flags [.], seq 95183:96497, ack 1, win 501, options [nop,nop,TS val 1276831868 ecr 3928201066], length 1314
19:23:50.621800 IP 99.181.90.103.1935 > 10.8.3.4.60620: Flags [.], ack 83495, win 126, options [nop,nop,TS val 3928201134 ecr 1276831394], length 0
19:23:50.680952 IP 10.8.3.4.60620 > 99.181.90.103.1935: Flags [.], seq 96497:97811, ack 1, win 501, options [nop,nop,TS val 1276831931 ecr 3928201134], length 1314
19:23:50.711588 IP 10.8.3.4.60620 > 99.181.90.103.1935: Flags [.], seq 97811:99125, ack 1, win 501, options [nop,nop,TS val 1276831962 ecr 3928201134], length 1314
19:23:50.722499 IP 99.181.90.103.1935 > 10.8.3.4.60620: Flags [.], ack 86123, win 126, options [nop,nop,TS val 3928201235 ecr 1276831498], length 0
19:23:50.746172 IP 10.8.3.4.60620 > 99.181.90.103.1935: Flags [.], seq 99125:100439, ack 1, win 501, options [nop,nop,TS val 1276831996 ecr 3928201235], length 1314
19:23:50.806993 IP 99.181.90.103.1935 > 10.8.3.4.60620: Flags [.], ack 88613, win 126, options [nop,nop,TS val 3928201319 ecr 1276831562], length 0
19:23:50.807025 IP 10.8.3.4.60620 > 99.181.90.103.1935: Flags [P.], seq 100439:101531, ack 1, win 501, options [nop,nop,TS val 1276832057 ecr 3928201319], length 1092
19:23:50.847843 IP 10.8.3.4.60620 > 99.181.90.103.1935: Flags [.], seq 101531:102845, ack 1, win 501, options [nop,nop,TS val 1276832098 ecr 3928201319], length 1314
19:23:50.878452 IP 10.8.3.4.60620 > 99.181.90.103.1935: Flags [.], seq 102845:104159, ack 1, win 501, options [nop,nop,TS val 1276832129 ecr 3928201319], length 1314
19:23:50.889553 IP 99.181.90.103.1935 > 10.8.3.4.60620: Flags [.], ack 91241, win 126, options [nop,nop,TS val 3928201402 ecr 1276831665], length 0
19:23:50.916791 IP 10.8.3.4.60620 > 99.181.90.103.1935: Flags [.], seq 104159:105473, ack 1, win 501, options [nop,nop,TS val 1276832167 ecr 3928201402], length 1314
19:23:50.980873 IP 10.8.3.4.60620 > 99.181.90.103.1935: Flags [.], seq 105473:106787, ack 1, win 501, options [nop,nop,TS val 1276832231 ecr 3928201402], length 1314
19:23:50.985394 IP 99.181.90.103.1935 > 10.8.3.4.60620: Flags [.], ack 93869, win 126, options [nop,nop,TS val 3928201497 ecr 1276831740], length 0
19:23:51.014009 IP 10.8.3.4.60620 > 99.181.90.103.1935: Flags [.], seq 106787:108101, ack 1, win 501, options [nop,nop,TS val 1276832264 ecr 3928201497], length 1314
19:23:51.044971 IP 10.8.3.4.60620 > 99.181.90.103.1935: Flags [.], seq 108101:109415, ack 1, win 501, options [nop,nop,TS val 1276832295 ecr 3928201497], length 1314
19:23:51.059759 IP 99.181.90.103.1935 > 10.8.3.4.60620: Flags [.], ack 96497, win 126, options [nop,nop,TS val 3928201572 ecr 1276831830], length 0
19:23:51.114315 IP 10.8.3.4.60620 > 99.181.90.103.1935: Flags [.], seq 109415:110729, ack 1, win 501, options [nop,nop,TS val 1276832365 ecr 3928201572], length 1314
19:23:51.144960 IP 10.8.3.4.60620 > 99.181.90.103.1935: Flags [.], seq 110729:112043, ack 1, win 501, options [nop,nop,TS val 1276832395 ecr 3928201572], length 1314
19:23:51.153182 IP 99.181.90.103.1935 > 10.8.3.4.60620: Flags [.], ack 99125, win 126, options [nop,nop,TS val 3928201665 ecr 1276831931], length 0
19:23:51.178432 IP 10.8.3.4.60620 > 99.181.90.103.1935: Flags [.], seq 112043:113357, ack 1, win 501, options [nop,nop,TS val 1276832429 ecr 3928201665], length 1314
19:23:51.246580 IP 10.8.3.4.60620 > 99.181.90.103.1935: Flags [.], seq 113357:114671, ack 1, win 501, options [nop,nop,TS val 1276832497 ecr 3928201665], length 1314
19:23:51.248566 IP 99.181.90.103.1935 > 10.8.3.4.60620: Flags [.], ack 101531, win 126, options [nop,nop,TS val 3928201761 ecr 1276831996], length 0
19:23:51.248597 IP 10.8.3.4.60620 > 99.181.90.103.1935: Flags [P.], seq 114671:115384, ack 1, win 501, options [nop,nop,TS val 1276832499 ecr 3928201761], length 713
19:23:51.312918 IP 10.8.3.4.60620 > 99.181.90.103.1935: Flags [.], seq 115384:116698, ack 1, win 501, options [nop,nop,TS val 1276832563 ecr 3928201761], length 1314
19:23:51.320468 IP 99.181.90.103.1935 > 10.8.3.4.60620: Flags [.], ack 104159, win 126, options [nop,nop,TS val 3928201832 ecr 1276832098], length 0
19:23:51.345100 IP 10.8.3.4.60620 > 99.181.90.103.1935: Flags [.], seq 116698:118012, ack 1, win 501, options [nop,nop,TS val 1276832595 ecr 3928201832], length 1314
19:23:51.378917 IP 10.8.3.4.60620 > 99.181.90.103.1935: Flags [.], seq 118012:119326, ack 1, win 501, options [nop,nop,TS val 1276832629 ecr 3928201832], length 1314
19:23:51.422462 IP 99.181.90.103.1935 > 10.8.3.4.60620: Flags [.], ack 106787, win 126, options [nop,nop,TS val 3928201935 ecr 1276832167], length 0
19:23:51.447663 IP 10.8.3.4.60620 > 99.181.90.103.1935: Flags [.], seq 119326:120640, ack 1, win 501, options [nop,nop,TS val 1276832698 ecr 3928201935], length 1314
19:23:51.481054 IP 10.8.3.4.60620 > 99.181.90.103.1935: Flags [.], seq 120640:121954, ack 1, win 501, options [nop,nop,TS val 1276832731 ecr 3928201935], length 1314
19:23:51.486777 IP 99.181.90.103.1935 > 10.8.3.4.60620: Flags [.], ack 109415, win 126, options [nop,nop,TS val 3928201999 ecr 1276832264], length 0
19:23:51.515741 IP 10.8.3.4.60620 > 99.181.90.103.1935: Flags [.], seq 121954:123268, ack 1, win 501, options [nop,nop,TS val 1276832766 ecr 3928201999], length 1314
19:23:51.580133 IP 10.8.3.4.60620 > 99.181.90.103.1935: Flags [.], seq 123268:124582, ack 1, win 501, options [nop,nop,TS val 1276832830 ecr 3928201999], length 1314
19:23:51.586353 IP 99.181.90.103.1935 > 10.8.3.4.60620: Flags [.], ack 112043, win 126, options [nop,nop,TS val 3928202099 ecr 1276832365], length 0
19:23:51.611367 IP 10.8.3.4.60620 > 99.181.90.103.1935: Flags [.], seq 124582:125896, ack 1, win 501, options [nop,nop,TS val 1276832862 ecr 3928202099], length 1314
19:23:51.645344 IP 10.8.3.4.60620 > 99.181.90.103.1935: Flags [.], seq 125896:127210, ack 1, win 501, options [nop,nop,TS val 1276832896 ecr 3928202099], length 1314
19:23:51.688435 IP 99.181.90.103.1935 > 10.8.3.4.60620: Flags [.], ack 114671, win 126, options [nop,nop,TS val 3928202201 ecr 1276832429], length 0
19:23:51.689955 IP 99.181.90.103.1935 > 10.8.3.4.60620: Flags [.], ack 115384, win 126, options [nop,nop,TS val 3928202202 ecr 1276832499], length 0
19:23:51.689988 IP 10.8.3.4.60620 > 99.181.90.103.1935: Flags [P.], seq 127210:128389, ack 1, win 501, options [nop,nop,TS val 1276832940 ecr 3928202202], length 1179
19:23:51.745174 IP 10.8.3.4.60620 > 99.181.90.103.1935: Flags [.], seq 128389:129703, ack 1, win 501, options [nop,nop,TS val 1276832995 ecr 3928202202], length 1314
19:23:51.778610 IP 10.8.3.4.60620 > 99.181.90.103.1935: Flags [.], seq 129703:131017, ack 1, win 501, options [nop,nop,TS val 1276833029 ecr 3928202202], length 1314
19:23:51.786794 IP 99.181.90.103.1935 > 10.8.3.4.60620: Flags [.], ack 118012, win 126, options [nop,nop,TS val 3928202299 ecr 1276832563], length 0
19:23:51.814189 IP 10.8.3.4.60620 > 99.181.90.103.1935: Flags [.], seq 131017:132331, ack 1, win 501, options [nop,nop,TS val 1276833065 ecr 3928202299], length 1314
19:23:51.880824 IP 10.8.3.4.60620 > 99.181.90.103.1935: Flags [.], seq 132331:133645, ack 1, win 501, options [nop,nop,TS val 1276833131 ecr 3928202299], length 1314
19:23:51.889589 IP 99.181.90.103.1935 > 10.8.3.4.60620: Flags [.], ack 120640, win 126, options [nop,nop,TS val 3928202402 ecr 1276832629], length 0
19:23:51.914095 IP 10.8.3.4.60620 > 99.181.90.103.1935: Flags [.], seq 133645:134959, ack 1, win 501, options [nop,nop,TS val 1276833164 ecr 3928202402], length 1314
19:23:51.945818 IP 10.8.3.4.60620 > 99.181.90.103.1935: Flags [.], seq 134959:136273, ack 1, win 501, options [nop,nop,TS val 1276833196 ecr 3928202402], length 1314
19:23:51.957389 IP 99.181.90.103.1935 > 10.8.3.4.60620: Flags [.], ack 123268, win 126, options [nop,nop,TS val 3928202470 ecr 1276832731], length 0
19:23:52.012770 IP 10.8.3.4.60620 > 99.181.90.103.1935: Flags [.], seq 136273:137587, ack 1, win 501, options [nop,nop,TS val 1276833263 ecr 3928202470], length 1314
19:23:52.049466 IP 10.8.3.4.60620 > 99.181.90.103.1935: Flags [.], seq 137587:138901, ack 1, win 501, options [nop,nop,TS val 1276833300 ecr 3928202470], length 1314
19:23:52.053160 IP 99.181.90.103.1935 > 10.8.3.4.60620: Flags [.], ack 125896, win 126, options [nop,nop,TS val 3928202565 ecr 1276832830], length 0
19:23:52.079333 IP 10.8.3.4.60620 > 99.181.90.103.1935: Flags [.], seq 138901:140215, ack 1, win 501, options [nop,nop,TS val 1276833330 ecr 3928202565], length 1314
19:23:52.131723 IP 99.181.90.103.1935 > 10.8.3.4.60620: Flags [.], ack 128389, win 126, options [nop,nop,TS val 3928202644 ecr 1276832896], length 0
19:23:52.131752 IP 10.8.3.4.60620 > 99.181.90.103.1935: Flags [P.], seq 140215:141304, ack 1, win 501, options [nop,nop,TS val 1276833382 ecr 3928202644], length 1089
19:23:52.180671 IP 10.8.3.4.60620 > 99.181.90.103.1935: Flags [.], seq 141304:142618, ack 1, win 501, options [nop,nop,TS val 1276833431 ecr 3928202644], length 1314
19:23:52.214132 IP 10.8.3.4.60620 > 99.181.90.103.1935: Flags [.], seq 142618:143932, ack 1, win 501, options [nop,nop,TS val 1276833464 ecr 3928202644], length 1314
19:23:52.220577 IP 99.181.90.103.1935 > 10.8.3.4.60620: Flags [.], ack 131017, win 126, options [nop,nop,TS val 3928202732 ecr 1276832995], length 0
19:23:52.244244 IP 10.8.3.4.60620 > 99.181.90.103.1935: Flags [.], seq 143932:145246, ack 1, win 501, options [nop,nop,TS val 1276833495 ecr 3928202732], length 1314
19:23:52.314146 IP 10.8.3.4.60620 > 99.181.90.103.1935: Flags [.], seq 145246:146560, ack 1, win 501, options [nop,nop,TS val 1276833564 ecr 3928202732], length 1314
19:23:52.322339 IP 99.181.90.103.1935 > 10.8.3.4.60620: Flags [.], ack 133645, win 126, options [nop,nop,TS val 3928202835 ecr 1276833065], length 0
19:23:52.349292 IP 10.8.3.4.60620 > 99.181.90.103.1935: Flags [.], seq 146560:147874, ack 1, win 501, options [nop,nop,TS val 1276833600 ecr 3928202835], length 1314
19:23:52.378378 IP 10.8.3.4.60620 > 99.181.90.103.1935: Flags [.], seq 147874:149188, ack 1, win 501, options [nop,nop,TS val 1276833629 ecr 3928202835], length 1314
19:23:52.387403 IP 99.181.90.103.1935 > 10.8.3.4.60620: Flags [.], ack 136273, win 126, options [nop,nop,TS val 3928202900 ecr 1276833164], length 0
19:23:52.447623 IP 10.8.3.4.60620 > 99.181.90.103.1935: Flags [.], seq 149188:150502, ack 1, win 501, options [nop,nop,TS val 1276833698 ecr 3928202900], length 1314
19:23:52.480851 IP 10.8.3.4.60620 > 99.181.90.103.1935: Flags [.], seq 150502:151816, ack 1, win 501, options [nop,nop,TS val 1276833731 ecr 3928202900], length 1314
19:23:52.491064 IP 99.181.90.103.1935 > 10.8.3.4.60620: Flags [.], ack 138901, win 126, options [nop,nop,TS val 3928203003 ecr 1276833263], length 0
19:23:52.511653 IP 10.8.3.4.60620 > 99.181.90.103.1935: Flags [.], seq 151816:153130, ack 1, win 501, options [nop,nop,TS val 1276833762 ecr 3928203003], length 1314
19:23:52.573405 IP 99.181.90.103.1935 > 10.8.3.4.60620: Flags [.], ack 141304, win 126, options [nop,nop,TS val 3928203085 ecr 1276833330], length 0
19:23:52.573432 IP 10.8.3.4.60620 > 99.181.90.103.1935: Flags [P.], seq 153130:154306, ack 1, win 501, options [nop,nop,TS val 1276833824 ecr 3928203085], length 1176
19:23:52.614111 IP 10.8.3.4.60620 > 99.181.90.103.1935: Flags [.], seq 154306:155620, ack 1, win 501, options [nop,nop,TS val 1276833864 ecr 3928203085], length 1314
19:23:52.648554 IP 10.8.3.4.60620 > 99.181.90.103.1935: Flags [.], seq 155620:156934, ack 1, win 501, options [nop,nop,TS val 1276833899 ecr 3928203085], length 1314
19:23:52.656018 IP 99.181.90.103.1935 > 10.8.3.4.60620: Flags [.], ack 143932, win 126, options [nop,nop,TS val 3928203168 ecr 1276833431], length 0
19:23:52.691371 IP 10.8.3.4.60620 > 99.181.90.103.1935: Flags [.], seq 156934:158248, ack 1, win 501, options [nop,nop,TS val 1276833942 ecr 3928203168], length 1314
19:23:52.743391 IP 10.8.3.4.60620 > 99.181.90.103.1935: Flags [.], seq 158248:159562, ack 1, win 501, options [nop,nop,TS val 1276833994 ecr 3928203168], length 1314
19:23:52.754096 IP 99.181.90.103.1935 > 10.8.3.4.60620: Flags [.], ack 145246, win 126, options [nop,nop,TS val 3928203266 ecr 1276833495], length 0
19:23:52.777207 IP 10.8.3.4.60620 > 99.181.90.103.1935: Flags [.], seq 159562:160876, ack 1, win 501, options [nop,nop,TS val 1276834028 ecr 3928203266], length 1314
19:23:52.790986 IP 99.181.90.103.1935 > 10.8.3.4.60620: Flags [.], ack 147874, win 126, options [nop,nop,TS val 3928203303 ecr 1276833564], length 0
19:23:52.819196 IP 10.8.3.4.60620 > 99.181.90.103.1935: Flags [.], seq 160876:162190, ack 1, win 501, options [nop,nop,TS val 1276834069 ecr 3928203303], length 1314
19:23:52.883462 IP 10.8.3.4.60620 > 99.181.90.103.1935: Flags [.], seq 162190:163504, ack 1, win 501, options [nop,nop,TS val 1276834134 ecr 3928203303], length 1314
19:23:52.889438 IP 99.181.90.103.1935 > 10.8.3.4.60620: Flags [.], ack 150502, win 126, options [nop,nop,TS val 3928203402 ecr 1276833629], length 0
19:23:52.912529 IP 10.8.3.4.60620 > 99.181.90.103.1935: Flags [.], seq 163504:164818, ack 1, win 501, options [nop,nop,TS val 1276834163 ecr 3928203402], length 1314
19:23:52.947603 IP 10.8.3.4.60620 > 99.181.90.103.1935: Flags [.], seq 164818:166132, ack 1, win 501, options [nop,nop,TS val 1276834198 ecr 3928203402], length 1314
19:23:52.953185 IP 99.181.90.103.1935 > 10.8.3.4.60620: Flags [.], ack 153130, win 126, options [nop,nop,TS val 3928203465 ecr 1276833731], length 0
19:23:53.011393 IP 10.8.3.4.60620 > 99.181.90.103.1935: Flags [.], seq 166132:167446, ack 1, win 501, options [nop,nop,TS val 1276834262 ecr 3928203465], length 1314
19:23:53.015164 IP 99.181.90.103.1935 > 10.8.3.4.60620: Flags [.], ack 154306, win 126, options [nop,nop,TS val 3928203527 ecr 1276833824], length 0
19:23:53.015175 IP 10.8.3.4.60620 > 99.181.90.103.1935: Flags [P.], seq 167446:168171, ack 1, win 501, options [nop,nop,TS val 1276834266 ecr 3928203527], length 725
19:23:53.080615 IP 10.8.3.4.60620 > 99.181.90.103.1935: Flags [.], seq 168171:169485, ack 1, win 501, options [nop,nop,TS val 1276834331 ecr 3928203527], length 1314
19:23:53.090375 IP 99.181.90.103.1935 > 10.8.3.4.60620: Flags [.], ack 156934, win 126, options [nop,nop,TS val 3928203603 ecr 1276833864], length 0
19:23:53.118581 IP 10.8.3.4.60620 > 99.181.90.103.1935: Flags [.], seq 169485:170799, ack 1, win 501, options [nop,nop,TS val 1276834369 ecr 3928203603], length 1314
19:23:53.147333 IP 10.8.3.4.60620 > 99.181.90.103.1935: Flags [.], seq 170799:172113, ack 1, win 501, options [nop,nop,TS val 1276834398 ecr 3928203603], length 1314
19:23:53.185159 IP 99.181.90.103.1935 > 10.8.3.4.60620: Flags [.], ack 159562, win 126, options [nop,nop,TS val 3928203697 ecr 1276833942], length 0
19:23:53.212154 IP 10.8.3.4.60620 > 99.181.90.103.1935: Flags [.], seq 172113:173427, ack 1, win 501, options [nop,nop,TS val 1276834462 ecr 3928203697], length 1314
19:23:53.247516 IP 10.8.3.4.60620 > 99.181.90.103.1935: Flags [.], seq 173427:174741, ack 1, win 501, options [nop,nop,TS val 1276834498 ecr 3928203697], length 1314
19:23:53.260739 IP 99.181.90.103.1935 > 10.8.3.4.60620: Flags [.], ack 162190, win 126, options [nop,nop,TS val 3928203773 ecr 1276834028], length 0
19:23:53.280797 IP 10.8.3.4.60620 > 99.181.90.103.1935: Flags [.], seq 174741:176055, ack 1, win 501, options [nop,nop,TS val 1276834531 ecr 3928203773], length 1314
19:23:53.347691 IP 10.8.3.4.60620 > 99.181.90.103.1935: Flags [.], seq 176055:177369, ack 1, win 501, options [nop,nop,TS val 1276834598 ecr 3928203773], length 1314
19:23:53.354219 IP 99.181.90.103.1935 > 10.8.3.4.60620: Flags [.], ack 164818, win 126, options [nop,nop,TS val 3928203866 ecr 1276834134], length 0
19:23:53.378351 IP 10.8.3.4.60620 > 99.181.90.103.1935: Flags [.], seq 177369:178683, ack 1, win 501, options [nop,nop,TS val 1276834629 ecr 3928203866], length 1314
19:23:53.418037 IP 10.8.3.4.60620 > 99.181.90.103.1935: Flags [.], seq 178683:179997, ack 1, win 501, options [nop,nop,TS val 1276834668 ecr 3928203866], length 1314
19:23:53.453295 IP 99.181.90.103.1935 > 10.8.3.4.60620: Flags [.], ack 167446, win 126, options [nop,nop,TS val 3928203965 ecr 1276834198], length 0
19:23:53.456807 IP 99.181.90.103.1935 > 10.8.3.4.60620: Flags [.], ack 168171, win 126, options [nop,nop,TS val 3928203969 ecr 1276834266], length 0
19:23:53.456821 IP 10.8.3.4.60620 > 99.181.90.103.1935: Flags [P.], seq 179997:181072, ack 1, win 501, options [nop,nop,TS val 1276834707 ecr 3928203969], length 1075
19:23:53.514468 IP 10.8.3.4.60620 > 99.181.90.103.1935: Flags [.], seq 181072:182386, ack 1, win 501, options [nop,nop,TS val 1276834765 ecr 3928203969], length 1314
19:23:53.547759 IP 10.8.3.4.60620 > 99.181.90.103.1935: Flags [.], seq 182386:183700, ack 1, win 501, options [nop,nop,TS val 1276834798 ecr 3928203969], length 1314
19:23:53.560432 IP 99.181.90.103.1935 > 10.8.3.4.60620: Flags [.], ack 170799, win 126, options [nop,nop,TS val 3928204072 ecr 1276834331], length 0
19:23:53.579323 IP 10.8.3.4.60620 > 99.181.90.103.1935: Flags [.], seq 183700:185014, ack 1, win 501, options [nop,nop,TS val 1276834830 ecr 3928204072], length 1314
19:23:53.650025 IP 99.181.90.103.1935 > 10.8.3.4.60620: Flags [.], ack 172113, win 126, options [nop,nop,TS val 3928204162 ecr 1276834398], length 0
19:23:53.653006 IP 10.8.3.4.60620 > 99.181.90.103.1935: Flags [.], seq 185014:186328, ack 1, win 501, options [nop,nop,TS val 1276834903 ecr 3928204162], length 1314
19:23:53.680385 IP 10.8.3.4.60620 > 99.181.90.103.1935: Flags [.], seq 186328:187642, ack 1, win 501, options [nop,nop,TS val 1276834931 ecr 3928204162], length 1314
19:23:53.689117 IP 99.181.90.103.1935 > 10.8.3.4.60620: Flags [.], ack 174741, win 126, options [nop,nop,TS val 3928204201 ecr 1276834462], length 0
19:23:53.717322 IP 10.8.3.4.60620 > 99.181.90.103.1935: Flags [.], seq 187642:188956, ack 1, win 501, options [nop,nop,TS val 1276834968 ecr 3928204201], length 1314
19:23:53.781429 IP 10.8.3.4.60620 > 99.181.90.103.1935: Flags [.], seq 188956:190270, ack 1, win 501, options [nop,nop,TS val 1276835032 ecr 3928204201], length 1314
19:23:53.789345 IP 99.181.90.103.1935 > 10.8.3.4.60620: Flags [.], ack 177369, win 126, options [nop,nop,TS val 3928204301 ecr 1276834531], length 0
19:23:53.813373 IP 10.8.3.4.60620 > 99.181.90.103.1935: Flags [.], seq 190270:191584, ack 1, win 501, options [nop,nop,TS val 1276835064 ecr 3928204301], length 1314
19:23:53.845519 IP 10.8.3.4.60620 > 99.181.90.103.1935: Flags [.], seq 191584:192898, ack 1, win 501, options [nop,nop,TS val 1276835096 ecr 3928204301], length 1314
19:23:53.859635 IP 99.181.90.103.1935 > 10.8.3.4.60620: Flags [.], ack 179997, win 126, options [nop,nop,TS val 3928204372 ecr 1276834629], length 0
19:23:53.898312 IP 99.181.90.103.1935 > 10.8.3.4.60620: Flags [.], ack 181072, win 126, options [nop,nop,TS val 3928204410 ecr 1276834707], length 0
19:23:53.898348 IP 10.8.3.4.60620 > 99.181.90.103.1935: Flags [P.], seq 192898:194089, ack 1, win 501, options [nop,nop,TS val 1276835149 ecr 3928204410], length 1191
19:23:53.952122 IP 10.8.3.4.60620 > 99.181.90.103.1935: Flags [.], seq 194089:195403, ack 1, win 501, options [nop,nop,TS val 1276835202 ecr 3928204410], length 1314
19:23:53.977267 IP 10.8.3.4.60620 > 99.181.90.103.1935: Flags [.], seq 195403:196717, ack 1, win 501, options [nop,nop,TS val 1276835228 ecr 3928204410], length 1314
19:23:53.989441 IP 99.181.90.103.1935 > 10.8.3.4.60620: Flags [.], ack 183700, win 126, options [nop,nop,TS val 3928204502 ecr 1276834765], length 0
19:23:54.016094 IP 10.8.3.4.60620 > 99.181.90.103.1935: Flags [.], seq 196717:198031, ack 1, win 501, options [nop,nop,TS val 1276835266 ecr 3928204502], length 1314
19:23:54.080327 IP 10.8.3.4.60620 > 99.181.90.103.1935: Flags [.], seq 198031:199345, ack 1, win 501, options [nop,nop,TS val 1276835331 ecr 3928204502], length 1314
19:23:54.094067 IP 99.181.90.103.1935 > 10.8.3.4.60620: Flags [.], ack 185014, win 126, options [nop,nop,TS val 3928204606 ecr 1276834830], length 0
19:23:54.112540 IP 10.8.3.4.60620 > 99.181.90.103.1935: Flags [.], seq 199345:200659, ack 1, win 501, options [nop,nop,TS val 1276835363 ecr 3928204606], length 1314
19:23:54.122100 IP 99.181.90.103.1935 > 10.8.3.4.60620: Flags [.], ack 187642, win 126, options [nop,nop,TS val 3928204634 ecr 1276834903], length 0
19:23:54.147333 IP 10.8.3.4.60620 > 99.181.90.103.1935: Flags [.], seq 200659:201973, ack 1, win 501, options [nop,nop,TS val 1276835398 ecr 3928204634], length 1314
19:23:54.214423 IP 10.8.3.4.60620 > 99.181.90.103.1935: Flags [.], seq 201973:203287, ack 1, win 501, options [nop,nop,TS val 1276835465 ecr 3928204634], length 1314
19:23:54.223253 IP 99.181.90.103.1935 > 10.8.3.4.60620: Flags [.], ack 190270, win 126, options [nop,nop,TS val 3928204735 ecr 1276834968], length 0
19:23:54.251723 IP 10.8.3.4.60620 > 99.181.90.103.1935: Flags [.], seq 203287:204601, ack 1, win 501, options [nop,nop,TS val 1276835502 ecr 3928204735], length 1314
19:23:54.279559 IP 10.8.3.4.60620 > 99.181.90.103.1935: Flags [.], seq 204601:205915, ack 1, win 501, options [nop,nop,TS val 1276835530 ecr 3928204735], length 1314
19:23:54.287078 IP 99.181.90.103.1935 > 10.8.3.4.60620: Flags [.], ack 192898, win 126, options [nop,nop,TS val 3928204799 ecr 1276835064], length 0
19:23:54.340098 IP 99.181.90.103.1935 > 10.8.3.4.60620: Flags [.], ack 194089, win 126, options [nop,nop,TS val 3928204852 ecr 1276835149], length 0
19:23:54.340133 IP 10.8.3.4.60620 > 99.181.90.103.1935: Flags [P.], seq 205915:207092, ack 1, win 501, options [nop,nop,TS val 1276835590 ecr 3928204852], length 1177
19:23:54.380306 IP 10.8.3.4.60620 > 99.181.90.103.1935: Flags [.], seq 207092:208406, ack 1, win 501, options [nop,nop,TS val 1276835631 ecr 3928204852], length 1314
