14:29:13.189714 IP 10.8.1.3.42020 > 99.181.88.116.1935: Flags [.], seq 109614390:109615704, ack 2320672417, win 501, options [nop,nop,TS val 1159525364 ecr 3739674906], length 1314
14:29:13.248996 IP 10.8.1.3.42020 > 99.181.88.116.1935: Flags [.], seq 1314:2628, ack 1, win 501, options [nop,nop,TS val 1159525424 ecr 3739674906], length 1314
14:29:13.272261 IP 99.181.88.116.1935 > 10.8.1.3.42020: Flags [.], ack 4294954479, win 126, options [nop,nop,TS val 3739675010 ecr 1159524889], length 0
14:29:13.275297 IP 10.8.1.3.42020 > 99.181.88.116.1935: Flags [.], seq 2628:3942, ack 1, win 501, options [nop,nop,TS val 1159525450 ecr 3739675010], length 1314
14:29:13.296498 IP 99.181.88.116.1935 > 10.8.1.3.42020: Flags [.], ack 4294957107, win 126, options [nop,nop,TS val 3739675034 ecr 1159524957], length 0
14:29:13.318237 IP 10.8.1.3.42020 > 99.181.88.116.1935: Flags [.], seq 3942:5256, ack 1, win 501, options [nop,nop,TS val 1159525493 ecr 3739675034], length 1314
14:29:13.380880 IP 10.8.1.3.42020 > 99.181.88.116.1935: Flags [.], seq 5256:6570, ack 1, win 501, options [nop,nop,TS val 1159525556 ecr 3739675034], length 1314
14:29:13.403226 IP 10.8.1.3.42020 > 99.181.88.116.1935: Flags [.], seq 6570:7884, ack 1, win 501, options [nop,nop,TS val 1159525578 ecr 3739675034], length 1314
14:29:13.403868 IP 99.181.88.116.1935 > 10.8.1.3.42020: Flags [.], ack 4294959735, win 126, options [nop,nop,TS val 3739675142 ecr 1159525022], length 0
14:29:13.451517 IP 10.8.1.3.42020 > 99.181.88.116.1935: Flags [.], seq 7884:9198, ack 1, win 501, options [nop,nop,TS val 1159525626 ecr 3739675142], length 1314
14:29:13.468044 IP 99.181.88.116.1935 > 10.8.1.3.42020: Flags [.], ack 4294962363, win 126, options [nop,nop,TS val 3739675206 ecr 1159525126], length 0
14:29:13.510242 IP 10.8.1.3.42020 > 99.181.88.116.1935: Flags [.], seq 9198:10512, ack 1, win 501, options [nop,nop,TS val 1159525685 ecr 3739675206], length 1314
14:29:13.547405 IP 10.8.1.3.42020 > 99.181.88.116.1935: Flags [.], seq 10512:11826, ack 1, win 501, options [nop,nop,TS val 1159525722 ecr 3739675206], length 1314
14:29:13.566821 IP 99.181.88.116.1935 > 10.8.1.3.42020: Flags [.], ack 4294964668, win 126, options [nop,nop,TS val 3739675304 ecr 1159525214], length 0
14:29:13.566835 IP 10.8.1.3.42020 > 99.181.88.116.1935: Flags [P.], seq 11826:12267, ack 1, win 501, options [nop,nop,TS val 1159525742 ecr 3739675304], length 441
14:29:13.614088 IP 10.8.1.3.42020 > 99.181.88.116.1935: Flags [.], seq 12267:13581, ack 1, win 501, options [nop,nop,TS val 1159525789 ecr 3739675304], length 1314
14:29:13.637527 IP 10.8.1.3.42020 > 99.181.88.116.1935: Flags [.], seq 13581:14895, ack 1, win 501, options [nop,nop,TS val 1159525812 ecr 3739675304], length 1314
14:29:13.639224 IP 99.181.88.116.1935 > 10.8.1.3.42020: Flags [.], ack 0, win 126, options [nop,nop,TS val 3739675377 ecr 1159525279], length 0
14:29:13.684780 IP 10.8.1.3.42020 > 99.181.88.116.1935: Flags [.], seq 14895:16209, ack 1, win 501, options [nop,nop,TS val 1159525859 ecr 3739675377], length 1314
14:29:13.741332 IP 99.181.88.116.1935 > 10.8.1.3.42020: Flags [.], ack 2628, win 126, options [nop,nop,TS val 3739675479 ecr 1159525364], length 0
14:29:13.744566 IP 10.8.1.3.42020 > 99.181.88.116.1935: Flags [.], seq 16209:17523, ack 1, win 501, options [nop,nop,TS val 1159525919 ecr 3739675479], length 1314
14:29:13.780904 IP 10.8.1.3.42020 > 99.181.88.116.1935: Flags [.], seq 17523:18837, ack 1, win 501, options [nop,nop,TS val 1159525956 ecr 3739675479], length 1314
14:29:13.810547 IP 99.181.88.116.1935 > 10.8.1.3.42020: Flags [.], ack 5256, win 126, options [nop,nop,TS val 3739675548 ecr 1159525450], length 0
14:29:13.814216 IP 10.8.1.3.42020 > 99.181.88.116.1935: Flags [.], seq 18837:20151, ack 1, win 501, options [nop,nop,TS val 1159525989 ecr 3739675548], length 1314
14:29:13.871898 IP 10.8.1.3.42020 > 99.181.88.116.1935: Flags [.], seq 20151:21465, ack 1, win 501, options [nop,nop,TS val 1159526047 ecr 3739675548], length 1314
14:29:13.895696 IP 99.181.88.116.1935 > 10.8.1.3.42020: Flags [.], ack 7884, win 126, options [nop,nop,TS val 3739675634 ecr 1159525556], length 0
14:29:13.914100 IP 10.8.1.3.42020 > 99.181.88.116.1935: Flags [.], seq 21465:22779, ack 1, win 501, options [nop,nop,TS val 1159526089 ecr 3739675634], length 1314
14:29:13.947585 IP 10.8.1.3.42020 > 99.181.88.116.1935: Flags [.], seq 22779:24093, ack 1, win 501, options [nop,nop,TS val 1159526122 ecr 3739675634], length 1314
14:29:14.004590 IP 99.181.88.116.1935 > 10.8.1.3.42020: Flags [.], ack 10512, win 126, options [nop,nop,TS val 3739675741 ecr 1159525626], length 0
14:29:14.017903 IP 10.8.1.3.42020 > 99.181.88.116.1935: Flags [.], seq 24093:25407, ack 1, win 501, options [nop,nop,TS val 1159526193 ecr 3739675741], length 1314
14:29:14.042634 IP 10.8.1.3.42020 > 99.181.88.116.1935: Flags [.], seq 25407:26721, ack 1, win 501, options [nop,nop,TS val 1159526217 ecr 3739675741], length 1314
14:29:14.059219 IP 99.181.88.116.1935 > 10.8.1.3.42020: Flags [.], ack 12267, win 126, options [nop,nop,TS val 3739675797 ecr 1159525722], length 0
14:29:14.059237 IP 10.8.1.3.42020 > 99.181.88.116.1935: Flags [P.], seq 26721:27161, ack 1, win 501, options [nop,nop,TS val 1159526234 ecr 3739675797], length 440
14:29:14.106368 IP 10.8.1.3.42020 > 99.181.88.116.1935: Flags [.], seq 27161:28475, ack 1, win 501, options [nop,nop,TS val 1159526281 ecr 3739675797], length 1314
14:29:14.129825 IP 99.181.88.116.1935 > 10.8.1.3.42020: Flags [.], ack 14895, win 126, options [nop,nop,TS val 3739675868 ecr 1159525789], length 0
14:29:14.149331 IP 10.8.1.3.42020 > 99.181.88.116.1935: Flags [.], seq 28475:29789, ack 1, win 501, options [nop,nop,TS val 1159526324 ecr 3739675868], length 1314
14:29:14.183104 IP 10.8.1.3.42020 > 99.181.88.116.1935: Flags [.], seq 29789:31103, ack 1, win 501, options [nop,nop,TS val 1159526358 ecr 3739675868], length 1314
14:29:14.236861 IP 99.181.88.116.1935 > 10.8.1.3.42020: Flags [.], ack 17523, win 126, options [nop,nop,TS val 3739675975 ecr 1159525859], length 0
14:29:14.249755 IP 10.8.1.3.42020 > 99.181.88.116.1935: Flags [.], seq 31103:32417, ack 1, win 501, options [nop,nop,TS val 1159526424 ecr 3739675975], length 1314
14:29:14.277543 IP 10.8.1.3.42020 > 99.181.88.116.1935: Flags [.], seq 32417:33731, ack 1, win 501, options [nop,nop,TS val 1159526452 ecr 3739675975], length 1314
14:29:14.306575 IP 99.181.88.116.1935 > 10.8.1.3.42020: Flags [.], ack 20151, win 126, options [nop,nop,TS val 3739676044 ecr 1159525956], length 0
14:29:14.316267 IP 10.8.1.3.42020 > 99.181.88.116.1935: Flags [.], seq 33731:35045, ack 1, win 501, options [nop,nop,TS val 1159526491 ecr 3739676044], length 1314
14:29:14.384842 IP 10.8.1.3.42020 > 99.181.88.116.1935: Flags [.], seq 35045:36359, ack 1, win 501, options [nop,nop,TS val 1159526560 ecr 3739676044], length 1314
14:29:14.405963 IP 10.8.1.3.42020 > 99.181.88.116.1935: Flags [.], seq 36359:37673, ack 1, win 501, options [nop,nop,TS val 1159526581 ecr 3739676044], length 1314
14:29:14.406330 IP 99.181.88.116.1935 > 10.8.1.3.42020: Flags [.], ack 22779, win 126, options [nop,nop,TS val 3739676144 ecr 1159526047], length 0
14:29:14.447250 IP 10.8.1.3.42020 > 99.181.88.116.1935: Flags [.], seq 37673:38987, ack 1, win 501, options [nop,nop,TS val 1159526622 ecr 3739676144], length 1314
14:29:14.510427 IP 99.181.88.116.1935 > 10.8.1.3.42020: Flags [.], ack 25407, win 126, options [nop,nop,TS val 3739676248 ecr 1159526122], length 0
14:29:14.512394 IP 10.8.1.3.42020 > 99.181.88.116.1935: Flags [.], seq 38987:40301, ack 1, win 501, options [nop,nop,TS val 1159526687 ecr 3739676248], length 1314
14:29:14.550030 IP 10.8.1.3.42020 > 99.181.88.116.1935: Flags [.], seq 40301:41615, ack 1, win 501, options [nop,nop,TS val 1159526725 ecr 3739676248], length 1314
14:29:14.551556 IP 99.181.88.116.1935 > 10.8.1.3.42020: Flags [.], ack 27161, win 126, options [nop,nop,TS val 3739676289 ecr 1159526217], length 0
14:29:14.551579 IP 10.8.1.3.42020 > 99.181.88.116.1935: Flags [P.], seq 41615:42045, ack 1, win 501, options [nop,nop,TS val 1159526726 ecr 3739676289], length 430
14:29:14.615634 IP 10.8.1.3.42020 > 99.181.88.116.1935: Flags [.], seq 42045:43359, ack 1, win 501, options [nop,nop,TS val 1159526790 ecr 3739676289], length 1314
14:29:14.640370 IP 10.8.1.3.42020 > 99.181.88.116.1935: Flags [.], seq 43359:44673, ack 1, win 501, options [nop,nop,TS val 1159526815 ecr 3739676289], length 1314
14:29:14.641818 IP 99.181.88.116.1935 > 10.8.1.3.42020: Flags [.], ack 29789, win 126, options [nop,nop,TS val 3739676380 ecr 1159526281], length 0
14:29:14.680442 IP 10.8.1.3.42020 > 99.181.88.116.1935: Flags [.], seq 44673:45987, ack 1, win 501, options [nop,nop,TS val 1159526855 ecr 3739676380], length 1314
14:29:14.742196 IP 99.181.88.116.1935 > 10.8.1.3.42020: Flags [.], ack 32417, win 126, options [nop,nop,TS val 3739676480 ecr 1159526358], length 0
14:29:14.746464 IP 10.8.1.3.42020 > 99.181.88.116.1935: Flags [.], seq 45987:47301, ack 1, win 501, options [nop,nop,TS val 1159526921 ecr 3739676480], length 1314
14:29:14.783816 IP 10.8.1.3.42020 > 99.181.88.116.1935: Flags [.], seq 47301:48615, ack 1, win 501, options [nop,nop,TS val 1159526958 ecr 3739676480], length 1314
14:29:14.808847 IP 99.181.88.116.1935 > 10.8.1.3.42020: Flags [.], ack 35045, win 126, options [nop,nop,TS val 3739676547 ecr 1159526452], length 0
14:29:14.810655 IP 10.8.1.3.42020 > 99.181.88.116.1935: Flags [.], seq 48615:49929, ack 1, win 501, options [nop,nop,TS val 1159526985 ecr 3739676547], length 1314
14:29:14.874739 IP 10.8.1.3.42020 > 99.181.88.116.1935: Flags [.], seq 49929:51243, ack 1, win 501, options [nop,nop,TS val 1159527049 ecr 3739676547], length 1314
14:29:14.898264 IP 99.181.88.116.1935 > 10.8.1.3.42020: Flags [.], ack 37673, win 126, options [nop,nop,TS val 3739676636 ecr 1159526560], length 0
14:29:14.917511 IP 10.8.1.3.42020 > 99.181.88.116.1935: Flags [.], seq 51243:52557, ack 1, win 501, options [nop,nop,TS val 1159527092 ecr 3739676636], length 1314
14:29:14.938632 IP 10.8.1.3.42020 > 99.181.88.116.1935: Flags [.], seq 52557:53871, ack 1, win 501, options [nop,nop,TS val 1159527113 ecr 3739676636], length 1314
14:29:15.002209 IP 10.8.1.3.42020 > 99.181.88.116.1935: Flags [.], seq 53871:55185, ack 1, win 501, options [nop,nop,TS val 1159527177 ecr 3739676636], length 1314
14:29:15.005142 IP 99.181.88.116.1935 > 10.8.1.3.42020: Flags [.], ack 40301, win 126, options [nop,nop,TS val 3739676743 ecr 1159526622], length 0
14:29:15.043806 IP 99.181.88.116.1935 > 10.8.1.3.42020: Flags [.], ack 42045, win 126, options [nop,nop,TS val 3739676782 ecr 1159526725], length 0
14:29:15.043831 IP 10.8.1.3.42020 > 99.181.88.116.1935: Flags [P.], seq 55185:56100, ack 1, win 501, options [nop,nop,TS val 1159527219 ecr 3739676782], length 915
14:29:15.080575 IP 10.8.1.3.42020 > 99.181.88.116.1935: Flags [.], seq 56100:57414, ack 1, win 501, options [nop,nop,TS val 1159527255 ecr 3739676782], length 1314
14:29:15.108550 IP 10.8.1.3.42020 > 99.181.88.116.1935: Flags [.], seq 57414:58728, ack 1, win 501, options [nop,nop,TS val 1159527283 ecr 3739676782], length 1314
14:29:15.132878 IP 99.181.88.116.1935 > 10.8.1.3.42020: Flags [.], ack 44673, win 126, options [nop,nop,TS val 3739676871 ecr 1159526790], length 0
14:29:15.152174 IP 10.8.1.3.42020 > 99.181.88.116.1935: Flags [.], seq 58728:60042, ack 1, win 501, options [nop,nop,TS val 1159527327 ecr 3739676871], length 1314
14:29:15.216208 IP 10.8.1.3.42020 > 99.181.88.116.1935: Flags [.], seq 60042:61356, ack 1, win 501, options [nop,nop,TS val 1159527391 ecr 3739676871], length 1314
14:29:15.237751 IP 10.8.1.3.42020 > 99.181.88.116.1935: Flags [.], seq 61356:62670, ack 1, win 501, options [nop,nop,TS val 1159527412 ecr 3739676871], length 1314
14:29:15.238821 IP 99.181.88.116.1935 > 10.8.1.3.42020: Flags [.], ack 47301, win 126, options [nop,nop,TS val 3739676977 ecr 1159526855], length 0
14:29:15.281657 IP 10.8.1.3.42020 > 99.181.88.116.1935: Flags [.], seq 62670:63984, ack 1, win 501, options [nop,nop,TS val 1159527456 ecr 3739676977], length 1314
14:29:15.303066 IP 99.181.88.116.1935 > 10.8.1.3.42020: Flags [.], ack 49929, win 126, options [nop,nop,TS val 3739677041 ecr 1159526958], length 0
14:29:15.344534 IP 10.8.1.3.42020 > 99.181.88.116.1935: Flags [.], seq 63984:65298, ack 1, win 501, options [nop,nop,TS val 1159527519 ecr 3739677041], length 1314
14:29:15.383261 IP 10.8.1.3.42020 > 99.181.88.116.1935: Flags [.], seq 65298:66612, ack 1, win 501, options [nop,nop,TS val 1159527558 ecr 3739677041], length 1314
14:29:15.409816 IP 99.181.88.116.1935 > 10.8.1.3.42020: Flags [.], ack 52557, win 126, options [nop,nop,TS val 3739677148 ecr 1159527049], length 0
14:29:15.414992 IP 10.8.1.3.42020 > 99.181.88.116.1935: Flags [.], seq 66612:67926, ack 1, win 501, options [nop,nop,TS val 1159527590 ecr 3739677148], length 1314
14:29:15.472506 IP 10.8.1.3.42020 > 99.181.88.116.1935: Flags [.], seq 67926:69240, ack 1, win 501, options [nop,nop,TS val 1159527647 ecr 3739677148], length 1314
14:29:15.496132 IP 99.181.88.116.1935 > 10.8.1.3.42020: Flags [.], ack 55185, win 126, options [nop,nop,TS val 3739677234 ecr 1159527113], length 0
14:29:15.515675 IP 10.8.1.3.42020 > 99.181.88.116.1935: Flags [.], seq 69240:70554, ack 1, win 501, options [nop,nop,TS val 1159527690 ecr 3739677234], length 1314
14:29:15.536272 IP 99.181.88.116.1935 > 10.8.1.3.42020: Flags [.], ack 56100, win 126, options [nop,nop,TS val 3739677274 ecr 1159527219], length 0
14:29:15.536295 IP 10.8.1.3.42020 > 99.181.88.116.1935: Flags [P.], seq 70554:70986, ack 1, win 501, options [nop,nop,TS val 1159527711 ecr 3739677274], length 432
14:29:15.579851 IP 10.8.1.3.42020 > 99.181.88.116.1935: Flags [.], seq 70986:72300, ack 1, win 501, options [nop,nop,TS val 1159527755 ecr 3739677274], length 1314
14:29:15.600910 IP 99.181.88.116.1935 > 10.8.1.3.42020: Flags [.], ack 58728, win 126, options [nop,nop,TS val 3739677339 ecr 1159527255], length 0
14:29:15.616970 IP 10.8.1.3.42020 > 99.181.88.116.1935: Flags [.], seq 72300:73614, ack 1, win 501, options [nop,nop,TS val 1159527792 ecr 3739677339], length 1314
14:29:15.649117 IP 10.8.1.3.42020 > 99.181.88.116.1935: Flags [.], seq 73614:74928, ack 1, win 501, options [nop,nop,TS val 1159527824 ecr 3739677339], length 1314
14:29:15.707906 IP 10.8.1.3.42020 > 99.181.88.116.1935: Flags [.], seq 74928:76242, ack 1, win 501, options [nop,nop,TS val 1159527883 ecr 3739677339], length 1314
14:29:15.708633 IP 99.181.88.116.1935 > 10.8.1.3.42020: Flags [.], ack 61356, win 126, options [nop,nop,TS val 3739677447 ecr 1159527327], length 0
14:29:15.750737 IP 10.8.1.3.42020 > 99.181.88.116.1935: Flags [.], seq 76242:77556, ack 1, win 501, options [nop,nop,TS val 1159527925 ecr 3739677447], length 1314
14:29:15.773898 IP 99.181.88.116.1935 > 10.8.1.3.42020: Flags [.], ack 63984, win 126, options [nop,nop,TS val 3739677512 ecr 1159527412], length 0
14:29:15.784187 IP 10.8.1.3.42020 > 99.181.88.116.1935: Flags [.], seq 77556:78870, ack 1, win 501, options [nop,nop,TS val 1159527959 ecr 3739677512], length 1314
14:29:15.851466 IP 10.8.1.3.42020 > 99.181.88.116.1935: Flags [.], seq 78870:80184, ack 1, win 501, options [nop,nop,TS val 1159528026 ecr 3739677512], length 1314
14:29:15.875656 IP 99.181.88.116.1935 > 10.8.1.3.42020: Flags [.], ack 66612, win 126, options [nop,nop,TS val 3739677614 ecr 1159527519], length 0
14:29:15.879419 IP 10.8.1.3.42020 > 99.181.88.116.1935: Flags [.], seq 80184:81498, ack 1, win 501, options [nop,nop,TS val 1159528054 ecr 3739677614], length 1314
14:29:15.915486 IP 10.8.1.3.42020 > 99.181.88.116.1935: Flags [.], seq 81498:82812, ack 1, win 501, options [nop,nop,TS val 1159528090 ecr 3739677614], length 1314
14:29:15.964905 IP 99.181.88.116.1935 > 10.8.1.3.42020: Flags [.], ack 69240, win 126, options [nop,nop,TS val 3739677703 ecr 1159527590], length 0
14:29:15.984596 IP 10.8.1.3.42020 > 99.181.88.116.1935: Flags [.], seq 82812:84126, ack 1, win 501, options [nop,nop,TS val 1159528159 ecr 3739677703], length 1314
14:29:16.008008 IP 10.8.1.3.42020 > 99.181.88.116.1935: Flags [.], seq 84126:85440, ack 1, win 501, options [nop,nop,TS val 1159528183 ecr 3739677703], length 1314
14:29:16.028628 IP 99.181.88.116.1935 > 10.8.1.3.42020: Flags [.], ack 70986, win 126, options [nop,nop,TS val 3739677767 ecr 1159527690], length 0
14:29:16.028659 IP 10.8.1.3.42020 > 99.181.88.116.1935: Flags [P.], seq 85440:85877, ack 1, win 501, options [nop,nop,TS val 1159528203 ecr 3739677767], length 437
14:29:16.072050 IP 10.8.1.3.42020 > 99.181.88.116.1935: Flags [.], seq 85877:87191, ack 1, win 501, options [nop,nop,TS val 1159528247 ecr 3739677767], length 1314
14:29:16.109398 IP 99.181.88.116.1935 > 10.8.1.3.42020: Flags [.], ack 73614, win 126, options [nop,nop,TS val 3739677847 ecr 1159527755], length 0
14:29:16.115039 IP 10.8.1.3.42020 > 99.181.88.116.1935: Flags [.], seq 87191:88505, ack 1, win 501, options [nop,nop,TS val 1159528290 ecr 3739677847], length 1314
14:29:16.151297 IP 10.8.1.3.42020 > 99.181.88.116.1935: Flags [.], seq 88505:89819, ack 1, win 501, options [nop,nop,TS val 1159528326 ecr 3739677847], length 1314
14:29:16.200499 IP 99.181.88.116.1935 > 10.8.1.3.42020: Flags [.], ack 76242, win 126, options [nop,nop,TS val 3739677938 ecr 1159527824], length 0
14:29:16.217582 IP 10.8.1.3.42020 > 99.181.88.116.1935: Flags [.], seq 89819:91133, ack 1, win 501, options [nop,nop,TS val 1159528392 ecr 3739677938], length 1314
14:29:16.243718 IP 10.8.1.3.42020 > 99.181.88.116.1935: Flags [.], seq 91133:92447, ack 1, win 501, options [nop,nop,TS val 1159528418 ecr 3739677938], length 1314
14:29:16.276694 IP 99.181.88.116.1935 > 10.8.1.3.42020: Flags [.], ack 78870, win 126, options [nop,nop,TS val 3739678015 ecr 1159527925], length 0
14:29:16.284734 IP 10.8.1.3.42020 > 99.181.88.116.1935: Flags [.], seq 92447:93761, ack 1, win 501, options [nop,nop,TS val 1159528459 ecr 3739678015], length 1314
14:29:16.350637 IP 10.8.1.3.42020 > 99.181.88.116.1935: Flags [.], seq 93761:95075, ack 1, win 501, options [nop,nop,TS val 1159528525 ecr 3739678015], length 1314
14:29:16.371882 IP 99.181.88.116.1935 > 10.8.1.3.42020: Flags [.], ack 81498, win 126, options [nop,nop,TS val 3739678110 ecr 1159528026], length 0
14:29:16.384754 IP 10.8.1.3.42020 > 99.181.88.116.1935: Flags [.], seq 95075:96389, ack 1, win 501, options [nop,nop,TS val 1159528559 ecr 3739678110], length 1314
14:29:16.415573 IP 10.8.1.3.42020 > 99.181.88.116.1935: Flags [.], seq 96389:97703, ack 1, win 501, options [nop,nop,TS val 1159528590 ecr 3739678110], length 1314
14:29:16.477110 IP 99.181.88.116.1935 > 10.8.1.3.42020: Flags [.], ack 84126, win 126, options [nop,nop,TS val 3739678215 ecr 1159528090], length 0
14:29:16.480047 IP 10.8.1.3.42020 > 99.181.88.116.1935: Flags [.], seq 97703:99017, ack 1, win 501, options [nop,nop,TS val 1159528655 ecr 3739678215], length 1314
14:29:16.518116 IP 10.8.1.3.42020 > 99.181.88.116.1935: Flags [.], seq 99017:100331, ack 1, win 501, options [nop,nop,TS val 1159528693 ecr 3739678215], length 1314
14:29:16.520804 IP 99.181.88.116.1935 > 10.8.1.3.42020: Flags [.], ack 85877, win 126, options [nop,nop,TS val 3739678259 ecr 1159528183], length 0
14:29:16.520840 IP 10.8.1.3.42020 > 99.181.88.116.1935: Flags [P.], seq 100331:100773, ack 1, win 501, options [nop,nop,TS val 1159528696 ecr 3739678259], length 442
14:29:16.582152 IP 10.8.1.3.42020 > 99.181.88.116.1935: Flags [.], seq 100773:102087, ack 1, win 501, options [nop,nop,TS val 1159528757 ecr 3739678259], length 1314
14:29:16.607575 IP 99.181.88.116.1935 > 10.8.1.3.42020: Flags [.], ack 88505, win 126, options [nop,nop,TS val 3739678345 ecr 1159528247], length 0
14:29:16.608302 IP 10.8.1.3.42020 > 99.181.88.116.1935: Flags [.], seq 102087:103401, ack 1, win 501, options [nop,nop,TS val 1159528783 ecr 3739678345], length 1314
14:29:16.651235 IP 10.8.1.3.42020 > 99.181.88.116.1935: Flags [.], seq 103401:104715, ack 1, win 501, options [nop,nop,TS val 1159528826 ecr 3739678345], length 1314
14:29:16.710437 IP 99.181.88.116.1935 > 10.8.1.3.42020: Flags [.], ack 91133, win 126, options [nop,nop,TS val 3739678448 ecr 1159528326], length 0
14:29:16.715278 IP 10.8.1.3.42020 > 99.181.88.116.1935: Flags [.], seq 104715:106029, ack 1, win 501, options [nop,nop,TS val 1159528890 ecr 3739678448], length 1314
14:29:16.749432 IP 10.8.1.3.42020 > 99.181.88.116.1935: Flags [.], seq 106029:107343, ack 1, win 501, options [nop,nop,TS val 1159528924 ecr 3739678448], length 1314
14:29:16.777437 IP 99.181.88.116.1935 > 10.8.1.3.42020: Flags [.], ack 93761, win 126, options [nop,nop,TS val 3739678515 ecr 1159528418], length 0
14:29:16.779442 IP 10.8.1.3.42020 > 99.181.88.116.1935: Flags [.], seq 107343:108657, ack 1, win 501, options [nop,nop,TS val 1159528954 ecr 3739678515], length 1314
14:29:16.843826 IP 10.8.1.3.42020 > 99.181.88.116.1935: Flags [.], seq 108657:109971, ack 1, win 501, options [nop,nop,TS val 1159529019 ecr 3739678515], length 1314
14:29:16.877775 IP 99.181.88.116.1935 > 10.8.1.3.42020: Flags [.], ack 96389, win 126, options [nop,nop,TS val 3739678616 ecr 1159528525], length 0
14:29:16.881231 IP 10.8.1.3.42020 > 99.181.88.116.1935: Flags [.], seq 109971:111285, ack 1, win 501, options [nop,nop,TS val 1159529056 ecr 3739678616], length 1314
14:29:16.917792 IP 10.8.1.3.42020 > 99.181.88.116.1935: Flags [.], seq 111285:112599, ack 1, win 501, options [nop,nop,TS val 1159529092 ecr 3739678616], length 1314
14:29:16.972589 IP 99.181.88.116.1935 > 10.8.1.3.42020: Flags [.], ack 99017, win 126, options [nop,nop,TS val 3739678710 ecr 1159528590], length 0
14:29:16.984694 IP 10.8.1.3.42020 > 99.181.88.116.1935: Flags [.], seq 112599:113913, ack 1, win 501, options [nop,nop,TS val 1159529159 ecr 3739678710], length 1314
14:29:17.013165 IP 99.181.88.116.1935 > 10.8.1.3.42020: Flags [.], ack 100773, win 126, options [nop,nop,TS val 3739678751 ecr 1159528693], length 0
14:29:17.013210 IP 10.8.1.3.42020 > 99.181.88.116.1935: Flags [P.], seq 113913:114812, ack 1, win 501, options [nop,nop,TS val 1159529188 ecr 3739678751], length 899
14:29:17.048803 IP 10.8.1.3.42020 > 99.181.88.116.1935: Flags [.], seq 114812:116126, ack 1, win 501, options [nop,nop,TS val 1159529223 ecr 3739678751], length 1314
14:29:17.078988 IP 10.8.1.3.42020 > 99.181.88.116.1935: Flags [.], seq 116126:117440, ack 1, win 501, options [nop,nop,TS val 1159529254 ecr 3739678751], length 1314
14:29:17.100633 IP 99.181.88.116.1935 > 10.8.1.3.42020: Flags [.], ack 103401, win 126, options [nop,nop,TS val 3739678839 ecr 1159528757], length 0
14:29:17.121384 IP 10.8.1.3.42020 > 99.181.88.116.1935: Flags [.], seq 117440:118754, ack 1, win 501, options [nop,nop,TS val 1159529296 ecr 3739678839], length 1314
14:29:17.184360 IP 10.8.1.3.42020 > 99.181.88.116.1935: Flags [.], seq 118754:120068, ack 1, win 501, options [nop,nop,TS val 1159529359 ecr 3739678839], length 1314
14:29:17.207672 IP 99.181.88.116.1935 > 10.8.1.3.42020: Flags [.], ack 106029, win 126, options [nop,nop,TS val 3739678945 ecr 1159528826], length 0
14:29:17.217954 IP 10.8.1.3.42020 > 99.181.88.116.1935: Flags [.], seq 120068:121382, ack 1, win 501, options [nop,nop,TS val 1159529393 ecr 3739678945], length 1314
14:29:17.249921 IP 10.8.1.3.42020 > 99.181.88.116.1935: Flags [.], seq 121382:122696, ack 1, win 501, options [nop,nop,TS val 1159529425 ecr 3739678945], length 1314
14:29:17.271760 IP 99.181.88.116.1935 > 10.8.1.3.42020: Flags [.], ack 108657, win 126, options [nop,nop,TS val 3739679010 ecr 1159528924], length 0
14:29:17.313919 IP 10.8.1.3.42020 > 99.181.88.116.1935: Flags [.], seq 122696:124010, ack 1, win 501, options [nop,nop,TS val 1159529489 ecr 3739679010], length 1314
14:29:17.347423 IP 10.8.1.3.42020 > 99.181.88.116.1935: Flags [.], seq 124010:125324, ack 1, win 501, options [nop,nop,TS val 1159529522 ecr 3739679010], length 1314
14:29:17.373655 IP 99.181.88.116.1935 > 10.8.1.3.42020: Flags [.], ack 111285, win 126, options [nop,nop,TS val 3739679112 ecr 1159529019], length 0
14:29:17.381858 IP 10.8.1.3.42020 > 99.181.88.116.1935: Flags [.], seq 125324:126638, ack 1, win 501, options [nop,nop,TS val 1159529557 ecr 3739679112], length 1314
14:29:17.451641 IP 10.8.1.3.42020 > 99.181.88.116.1935: Flags [.], seq 126638:127952, ack 1, win 501, options [nop,nop,TS val 1159529626 ecr 3739679112], length 1314
14:29:17.477337 IP 99.181.88.116.1935 > 10.8.1.3.42020: Flags [.], ack 113913, win 126, options [nop,nop,TS val 3739679215 ecr 1159529092], length 0
14:29:17.484491 IP 10.8.1.3.42020 > 99.181.88.116.1935: Flags [.], seq 127952:129266, ack 1, win 501, options [nop,nop,TS val 1159529659 ecr 3739679215], length 1314
14:29:17.505678 IP 99.181.88.116.1935 > 10.8.1.3.42020: Flags [.], ack 114812, win 126, options [nop,nop,TS val 3739679244 ecr 1159529188], length 0
14:29:17.505714 IP 10.8.1.3.42020 > 99.181.88.116.1935: Flags [P.], seq 129266:129711, ack 1, win 501, options [nop,nop,TS val 1159529680 ecr 3739679244], length 445
14:29:17.549338 IP 10.8.1.3.42020 > 99.181.88.116.1935: Flags [.], seq 129711:131025, ack 1, win 501, options [nop,nop,TS val 1159529724 ecr 3739679244], length 1314
14:29:17.571376 IP 99.181.88.116.1935 > 10.8.1.3.42020: Flags [.], ack 117440, win 126, options [nop,nop,TS val 3739679309 ecr 1159529223], length 0
14:29:17.583334 IP 10.8.1.3.42020 > 99.181.88.116.1935: Flags [.], seq 131025:132339, ack 1, win 501, options [nop,nop,TS val 1159529758 ecr 3739679309], length 1314
14:29:17.614071 IP 10.8.1.3.42020 > 99.181.88.116.1935: Flags [.], seq 132339:133653, ack 1, win 501, options [nop,nop,TS val 1159529789 ecr 3739679309], length 1314
14:29:17.676926 IP 99.181.88.116.1935 > 10.8.1.3.42020: Flags [.], ack 120068, win 126, options [nop,nop,TS val 3739679415 ecr 1159529296], length 0
14:29:17.677506 IP 10.8.1.3.42020 > 99.181.88.116.1935: Flags [.], seq 133653:134967, ack 1, win 501, options [nop,nop,TS val 1159529852 ecr 3739679415], length 1314
14:29:17.718100 IP 10.8.1.3.42020 > 99.181.88.116.1935: Flags [.], seq 134967:136281, ack 1, win 501, options [nop,nop,TS val 1159529893 ecr 3739679415], length 1314
14:29:17.742495 IP 99.181.88.116.1935 > 10.8.1.3.42020: Flags [.], ack 122696, win 126, options [nop,nop,TS val 3739679480 ecr 1159529393], length 0
14:29:17.751181 IP 10.8.1.3.42020 > 99.181.88.116.1935: Flags [.], seq 136281:137595, ack 1, win 501, options [nop,nop,TS val 1159529926 ecr 3739679480], length 1314
14:29:17.817940 IP 10.8.1.3.42020 > 99.181.88.116.1935: Flags [.], seq 137595:138909, ack 1, win 501, options [nop,nop,TS val 1159529993 ecr 3739679480], length 1314
14:29:17.840072 IP 99.181.88.116.1935 > 10.8.1.3.42020: Flags [.], ack 125324, win 126, options [nop,nop,TS val 3739679578 ecr 1159529489], length 0
14:29:17.848838 IP 10.8.1.3.42020 > 99.181.88.116.1935: Flags [.], seq 138909:140223, ack 1, win 501, options [nop,nop,TS val 1159530024 ecr 3739679578], length 1314
14:29:17.883534 IP 10.8.1.3.42020 > 99.181.88.116.1935: Flags [.], seq 140223:141537, ack 1, win 501, options [nop,nop,TS val 1159530058 ecr 3739679578], length 1314
14:29:17.944088 IP 99.181.88.116.1935 > 10.8.1.3.42020: Flags [.], ack 127952, win 126, options [nop,nop,TS val 3739679682 ecr 1159529557], length 0
14:29:17.951394 IP 10.8.1.3.42020 > 99.181.88.116.1935: Flags [.], seq 141537:142851, ack 1, win 501, options [nop,nop,TS val 1159530126 ecr 3739679682], length 1314
14:29:17.984784 IP 10.8.1.3.42020 > 99.181.88.116.1935: Flags [.], seq 142851:144165, ack 1, win 501, options [nop,nop,TS val 1159530159 ecr 3739679682], length 1314
14:29:17.998064 IP 99.181.88.116.1935 > 10.8.1.3.42020: Flags [.], ack 129711, win 126, options [nop,nop,TS val 3739679736 ecr 1159529659], length 0
14:29:17.998120 IP 10.8.1.3.42020 > 99.181.88.116.1935: Flags [P.], seq 144165:144598, ack 1, win 501, options [nop,nop,TS val 1159530173 ecr 3739679736], length 433
14:29:18.048824 IP 10.8.1.3.42020 > 99.181.88.116.1935: Flags [.], seq 144598:145912, ack 1, win 501, options [nop,nop,TS val 1159530224 ecr 3739679736], length 1314
14:29:18.075904 IP 99.181.88.116.1935 > 10.8.1.3.42020: Flags [.], ack 132339, win 126, options [nop,nop,TS val 3739679814 ecr 1159529724], length 0
14:29:18.082621 IP 10.8.1.3.42020 > 99.181.88.116.1935: Flags [.], seq 145912:147226, ack 1, win 501, options [nop,nop,TS val 1159530257 ecr 3739679814], length 1314
14:29:18.116069 IP 10.8.1.3.42020 > 99.181.88.116.1935: Flags [.], seq 147226:148540, ack 1, win 501, options [nop,nop,TS val 1159530291 ecr 3739679814], length 1314
14:29:18.169782 IP 99.181.88.116.1935 > 10.8.1.3.42020: Flags [.], ack 134967, win 126, options [nop,nop,TS val 3739679908 ecr 1159529789], length 0
14:29:18.181863 IP 10.8.1.3.42020 > 99.181.88.116.1935: Flags [.], seq 148540:149854, ack 1, win 501, options [nop,nop,TS val 1159530357 ecr 3739679908], length 1314
14:29:18.212500 IP 10.8.1.3.42020 > 99.181.88.116.1935: Flags [.], seq 149854:151168, ack 1, win 501, options [nop,nop,TS val 1159530387 ecr 3739679908], length 1314
14:29:18.243889 IP 99.181.88.116.1935 > 10.8.1.3.42020: Flags [.], ack 137595, win 126, options [nop,nop,TS val 3739679982 ecr 1159529893], length 0
14:29:18.251406 IP 10.8.1.3.42020 > 99.181.88.116.1935: Flags [.], seq 151168:152482, ack 1, win 501, options [nop,nop,TS val 1159530426 ecr 3739679982], length 1314
14:29:18.316319 IP 10.8.1.3.42020 > 99.181.88.116.1935: Flags [.], seq 152482:153796, ack 1, win 501, options [nop,nop,TS val 1159530491 ecr 3739679982], length 1314
14:29:18.341313 IP 99.181.88.116.1935 > 10.8.1.3.42020: Flags [.], ack 140223, win 126, options [nop,nop,TS val 3739680079 ecr 1159529993], length 0
14:29:18.349734 IP 10.8.1.3.42020 > 99.181.88.116.1935: Flags [.], seq 153796:155110, ack 1, win 501, options [nop,nop,TS val 1159530524 ecr 3739680079], length 1314
14:29:18.383306 IP 10.8.1.3.42020 > 99.181.88.116.1935: Flags [.], seq 155110:156424, ack 1, win 501, options [nop,nop,TS val 1159530558 ecr 3739680079], length 1314
14:29:18.443910 IP 99.181.88.116.1935 > 10.8.1.3.42020: Flags [.], ack 142851, win 126, options [nop,nop,TS val 3739680182 ecr 1159530058], length 0
14:29:18.448124 IP 10.8.1.3.42020 > 99.181.88.116.1935: Flags [.], seq 156424:157738, ack 1, win 501, options [nop,nop,TS val 1159530623 ecr 3739680182], length 1314
14:29:18.483154 IP 10.8.1.3.42020 > 99.181.88.116.1935: Flags [.], seq 157738:159052, ack 1, win 501, options [nop,nop,TS val 1159530658 ecr 3739680182], length 1314
14:29:18.493214 IP 99.181.88.116.1935 > 10.8.1.3.42020: Flags [.], ack 144598, win 126, options [nop,nop,TS val 3739680231 ecr 1159530159], length 0
14:29:18.493236 IP 10.8.1.3.42020 > 99.181.88.116.1935: Flags [P.], seq 159052:159581, ack 1, win 501, options [nop,nop,TS val 1159530668 ecr 3739680231], length 529
14:29:18.550887 IP 10.8.1.3.42020 > 99.181.88.116.1935: Flags [.], seq 159581:160895, ack 1, win 501, options [nop,nop,TS val 1159530726 ecr 3739680231], length 1314
14:29:18.575231 IP 99.181.88.116.1935 > 10.8.1.3.42020: Flags [.], ack 147226, win 126, options [nop,nop,TS val 3739680313 ecr 1159530224], length 0
14:29:18.584155 IP 10.8.1.3.42020 > 99.181.88.116.1935: Flags [.], seq 160895:162209, ack 1, win 501, options [nop,nop,TS val 1159530759 ecr 3739680313], length 1314
14:29:18.618777 IP 10.8.1.3.42020 > 99.181.88.116.1935: Flags [.], seq 162209:163523, ack 1, win 501, options [nop,nop,TS val 1159530793 ecr 3739680313], length 1314
14:29:18.674649 IP 99.181.88.116.1935 > 10.8.1.3.42020: Flags [.], ack 149854, win 126, options [nop,nop,TS val 3739680412 ecr 1159530291], length 0
14:29:18.680839 IP 10.8.1.3.42020 > 99.181.88.116.1935: Flags [.], seq 163523:164837, ack 1, win 501, options [nop,nop,TS val 1159530856 ecr 3739680412], length 1314
14:29:18.716022 IP 10.8.1.3.42020 > 99.181.88.116.1935: Flags [.], seq 164837:166151, ack 1, win 501, options [nop,nop,TS val 1159530891 ecr 3739680412], length 1314
14:29:18.743905 IP 99.181.88.116.1935 > 10.8.1.3.42020: Flags [.], ack 152482, win 126, options [nop,nop,TS val 3739680482 ecr 1159530387], length 0
14:29:18.751468 IP 10.8.1.3.42020 > 99.181.88.116.1935: Flags [.], seq 166151:167465, ack 1, win 501, options [nop,nop,TS val 1159530926 ecr 3739680482], length 1314
14:29:18.814038 IP 10.8.1.3.42020 > 99.181.88.116.1935: Flags [.], seq 167465:168779, ack 1, win 501, options [nop,nop,TS val 1159530989 ecr 3739680482], length 1314
14:29:18.842113 IP 99.181.88.116.1935 > 10.8.1.3.42020: Flags [.], ack 155110, win 126, options [nop,nop,TS val 3739680580 ecr 1159530491], length 0
14:29:18.847699 IP 10.8.1.3.42020 > 99.181.88.116.1935: Flags [.], seq 168779:170093, ack 1, win 501, options [nop,nop,TS val 1159531022 ecr 3739680580], length 1314
14:29:18.884316 IP 10.8.1.3.42020 > 99.181.88.116.1935: Flags [.], seq 170093:171407, ack 1, win 501, options [nop,nop,TS val 1159531059 ecr 3739680580], length 1314
14:29:18.940910 IP 99.181.88.116.1935 > 10.8.1.3.42020: Flags [.], ack 157738, win 126, options [nop,nop,TS val 3739680679 ecr 1159530558], length 0
14:29:18.948777 IP 10.8.1.3.42020 > 99.181.88.116.1935: Flags [.], seq 171407:172721, ack 1, win 501, options [nop,nop,TS val 1159531123 ecr 3739680679], length 1314
14:29:18.981096 IP 10.8.1.3.42020 > 99.181.88.116.1935: Flags [.], seq 172721:174035, ack 1, win 501, options [nop,nop,TS val 1159531156 ecr 3739680679], length 1314
14:29:18.985681 IP 99.181.88.116.1935 > 10.8.1.3.42020: Flags [.], ack 159581, win 126, options [nop,nop,TS val 3739680723 ecr 1159530658], length 0
14:29:18.985698 IP 10.8.1.3.42020 > 99.181.88.116.1935: Flags [P.], seq 174035:174483, ack 1, win 501, options [nop,nop,TS val 1159531160 ecr 3739680723], length 448
14:29:19.051370 IP 10.8.1.3.42020 > 99.181.88.116.1935: Flags [.], seq 174483:175797, ack 1, win 501, options [nop,nop,TS val 1159531226 ecr 3739680723], length 1314
14:29:19.076757 IP 99.181.88.116.1935 > 10.8.1.3.42020: Flags [.], ack 162209, win 126, options [nop,nop,TS val 3739680815 ecr 1159530726], length 0
14:29:19.084666 IP 10.8.1.3.42020 > 99.181.88.116.1935: Flags [.], seq 175797:177111, ack 1, win 501, options [nop,nop,TS val 1159531259 ecr 3739680815], length 1314
14:29:19.115004 IP 10.8.1.3.42020 > 99.181.88.116.1935: Flags [.], seq 177111:178425, ack 1, win 501, options [nop,nop,TS val 1159531290 ecr 3739680815], length 1314
14:29:19.173075 IP 99.181.88.116.1935 > 10.8.1.3.42020: Flags [.], ack 164837, win 126, options [nop,nop,TS val 3739680911 ecr 1159530793], length 0
14:29:19.182286 IP 10.8.1.3.42020 > 99.181.88.116.1935: Flags [.], seq 178425:179739, ack 1, win 501, options [nop,nop,TS val 1159531357 ecr 3739680911], length 1314
14:29:19.214016 IP 10.8.1.3.42020 > 99.181.88.116.1935: Flags [.], seq 179739:181053, ack 1, win 501, options [nop,nop,TS val 1159531389 ecr 3739680911], length 1314
14:29:19.243974 IP 99.181.88.116.1935 > 10.8.1.3.42020: Flags [.], ack 167465, win 126, options [nop,nop,TS val 3739680982 ecr 1159530891], length 0
14:29:19.249245 IP 10.8.1.3.42020 > 99.181.88.116.1935: Flags [.], seq 181053:182367, ack 1, win 501, options [nop,nop,TS val 1159531424 ecr 3739680982], length 1314
14:29:19.317694 IP 10.8.1.3.42020 > 99.181.88.116.1935: Flags [.], seq 182367:183681, ack 1, win 501, options [nop,nop,TS val 1159531492 ecr 3739680982], length 1314
14:29:19.340211 IP 99.181.88.116.1935 > 10.8.1.3.42020: Flags [.], ack 170093, win 126, options [nop,nop,TS val 3739681078 ecr 1159530989], length 0
14:29:19.351355 IP 10.8.1.3.42020 > 99.181.88.116.1935: Flags [.], seq 183681:184995, ack 1, win 501, options [nop,nop,TS val 1159531526 ecr 3739681078], length 1314
14:29:19.382192 IP 10.8.1.3.42020 > 99.181.88.116.1935: Flags [.], seq 184995:186309, ack 1, win 501, options [nop,nop,TS val 1159531557 ecr 3739681078], length 1314
14:29:19.441238 IP 99.181.88.116.1935 > 10.8.1.3.42020: Flags [.], ack 172721, win 126, options [nop,nop,TS val 3739681179 ecr 1159531059], length 0
14:29:19.451146 IP 10.8.1.3.42020 > 99.181.88.116.1935: Flags [.], seq 186309:187623, ack 1, win 501, options [nop,nop,TS val 1159531626 ecr 3739681179], length 1314
14:29:19.478015 IP 99.181.88.116.1935 > 10.8.1.3.42020: Flags [.], ack 174483, win 126, options [nop,nop,TS val 3739681216 ecr 1159531156], length 0
14:29:19.478053 IP 10.8.1.3.42020 > 99.181.88.116.1935: Flags [P.], seq 187623:188519, ack 1, win 501, options [nop,nop,TS val 1159531653 ecr 3739681216], length 896
14:29:19.515292 IP 10.8.1.3.42020 > 99.181.88.116.1935: Flags [.], seq 188519:189833, ack 1, win 501, options [nop,nop,TS val 1159531690 ecr 3739681216], length 1314
14:29:19.550354 IP 10.8.1.3.42020 > 99.181.88.116.1935: Flags [.], seq 189833:191147, ack 1, win 501, options [nop,nop,TS val 1159531725 ecr 3739681216], length 1314
14:29:19.577345 IP 99.181.88.116.1935 > 10.8.1.3.42020: Flags [.], ack 177111, win 126, options [nop,nop,TS val 3739681315 ecr 1159531226], length 0
14:29:19.600596 IP 10.8.1.3.42020 > 99.181.88.116.1935: Flags [.], seq 191147:192461, ack 1, win 501, options [nop,nop,TS val 1159531775 ecr 3739681315], length 1314
14:29:19.647868 IP 10.8.1.3.42020 > 99.181.88.116.1935: Flags [.], seq 192461:193775, ack 1, win 501, options [nop,nop,TS val 1159531823 ecr 3739681315], length 1314
14:29:19.674814 IP 99.181.88.116.1935 > 10.8.1.3.42020: Flags [.], ack 179739, win 126, options [nop,nop,TS val 3739681413 ecr 1159531290], length 0
14:29:19.684473 IP 10.8.1.3.42020 > 99.181.88.116.1935: Flags [.], seq 193775:195089, ack 1, win 501, options [nop,nop,TS val 1159531859 ecr 3739681413], length 1314
14:29:19.728922 IP 10.8.1.3.42020 > 99.181.88.116.1935: Flags [.], seq 195089:196403, ack 1, win 501, options [nop,nop,TS val 1159531904 ecr 3739681413], length 1314
14:29:19.741700 IP 99.181.88.116.1935 > 10.8.1.3.42020: Flags [.], ack 182367, win 126, options [nop,nop,TS val 3739681480 ecr 1159531389], length 0
14:29:19.781043 IP 10.8.1.3.42020 > 99.181.88.116.1935: Flags [.], seq 196403:197717, ack 1, win 501, options [nop,nop,TS val 1159531956 ecr 3739681480], length 1314
14:29:19.813928 IP 10.8.1.3.42020 > 99.181.88.116.1935: Flags [.], seq 197717:199031, ack 1, win 501, options [nop,nop,TS val 1159531989 ecr 3739681480], length 1314
14:29:19.843845 IP 99.181.88.116.1935 > 10.8.1.3.42020: Flags [.], ack 184995, win 126, options [nop,nop,TS val 3739681582 ecr 1159531492], length 0
14:29:19.856815 IP 10.8.1.3.42020 > 99.181.88.116.1935: Flags [.], seq 199031:200345, ack 1, win 501, options [nop,nop,TS val 1159532031 ecr 3739681582], length 1314
14:29:19.916264 IP 10.8.1.3.42020 > 99.181.88.116.1935: Flags [.], seq 200345:201659, ack 1, win 501, options [nop,nop,TS val 1159532091 ecr 3739681582], length 1314
14:29:19.943550 IP 99.181.88.116.1935 > 10.8.1.3.42020: Flags [.], ack 187623, win 126, options [nop,nop,TS val 3739681681 ecr 1159531557], length 0
14:29:19.948154 IP 10.8.1.3.42020 > 99.181.88.116.1935: Flags [.], seq 201659:202973, ack 1, win 501, options [nop,nop,TS val 1159532123 ecr 3739681681], length 1314
14:29:19.970298 IP 99.181.88.116.1935 > 10.8.1.3.42020: Flags [.], ack 188519, win 126, options [nop,nop,TS val 3739681708 ecr 1159531653], length 0
14:29:19.970313 IP 10.8.1.3.42020 > 99.181.88.116.1935: Flags [P.], seq 202973:203414, ack 1, win 501, options [nop,nop,TS val 1159532145 ecr 3739681708], length 441
14:29:20.013892 IP 10.8.1.3.42020 > 99.181.88.116.1935: Flags [.], seq 203414:204728, ack 1, win 501, options [nop,nop,TS val 1159532189 ecr 3739681708], length 1314
14:29:20.042881 IP 99.181.88.116.1935 > 10.8.1.3.42020: Flags [.], ack 191147, win 126, options [nop,nop,TS val 3739681781 ecr 1159531690], length 0
14:29:20.048594 IP 10.8.1.3.42020 > 99.181.88.116.1935: Flags [.], seq 204728:206042, ack 1, win 501, options [nop,nop,TS val 1159532223 ecr 3739681781], length 1314
14:29:20.091617 IP 10.8.1.3.42020 > 99.181.88.116.1935: Flags [.], seq 206042:207356, ack 1, win 501, options [nop,nop,TS val 1159532266 ecr 3739681781], length 1314
