07:54:39.449323 IP 10.8.3.3.47634 > 99.181.80.7.1935: Flags [.], seq 3205607147:3205608461, ack 113224861, win 501, options [nop,nop,TS val 1177181408 ecr 2699938627], length 1314
07:54:39.494990 IP 99.181.80.7.1935 > 10.8.3.3.47634: Flags [.], ack 4294956075, win 126, options [nop,nop,TS val 2699938725 ecr 1177180945], length 0
07:54:39.512383 IP 10.8.3.3.47634 > 99.181.80.7.1935: Flags [.], seq 1314:2628, ack 1, win 501, options [nop,nop,TS val 1177181471 ecr 2699938725], length 1314
07:54:39.546615 IP 10.8.3.3.47634 > 99.181.80.7.1935: Flags [.], seq 2628:3942, ack 1, win 501, options [nop,nop,TS val 1177181505 ecr 2699938725], length 1314
07:54:39.561253 IP 99.181.80.7.1935 > 10.8.3.3.47634: Flags [.], ack 4294958703, win 126, options [nop,nop,TS val 2699938792 ecr 1177181042], length 0
07:54:39.581897 IP 10.8.3.3.47634 > 99.181.80.7.1935: Flags [.], seq 3942:5256, ack 1, win 501, options [nop,nop,TS val 1177181541 ecr 2699938792], length 1314
07:54:39.649277 IP 10.8.3.3.47634 > 99.181.80.7.1935: Flags [.], seq 5256:6570, ack 1, win 501, options [nop,nop,TS val 1177181608 ecr 2699938792], length 1314
07:54:39.659684 IP 99.181.80.7.1935 > 10.8.3.3.47634: Flags [.], ack 4294961331, win 126, options [nop,nop,TS val 2699938890 ecr 1177181140], length 0
07:54:39.679297 IP 10.8.3.3.47634 > 99.181.80.7.1935: Flags [.], seq 6570:7884, ack 1, win 501, options [nop,nop,TS val 1177181638 ecr 2699938890], length 1314
07:54:39.714375 IP 10.8.3.3.47634 > 99.181.80.7.1935: Flags [.], seq 7884:9198, ack 1, win 501, options [nop,nop,TS val 1177181673 ecr 2699938890], length 1314
07:54:39.757493 IP 99.181.80.7.1935 > 10.8.3.3.47634: Flags [.], ack 4294962645, win 126, options [nop,nop,TS val 2699938988 ecr 1177181204], length 0
07:54:39.765497 IP 99.181.80.7.1935 > 10.8.3.3.47634: Flags [.], ack 4294964668, win 126, options [nop,nop,TS val 2699938996 ecr 1177181275], length 0
07:54:39.765536 IP 10.8.3.3.47634 > 99.181.80.7.1935: Flags [P.], seq 9198:10389, ack 1, win 501, options [nop,nop,TS val 1177181724 ecr 2699938996], length 1191
07:54:39.813761 IP 10.8.3.3.47634 > 99.181.80.7.1935: Flags [.], seq 10389:11703, ack 1, win 501, options [nop,nop,TS val 1177181772 ecr 2699938996], length 1314
07:54:39.848650 IP 10.8.3.3.47634 > 99.181.80.7.1935: Flags [.], seq 11703:13017, ack 1, win 501, options [nop,nop,TS val 1177181807 ecr 2699938996], length 1314
07:54:39.859689 IP 99.181.80.7.1935 > 10.8.3.3.47634: Flags [.], ack 0, win 126, options [nop,nop,TS val 2699939090 ecr 1177181337], length 0
07:54:39.883200 IP 10.8.3.3.47634 > 99.181.80.7.1935: Flags [.], seq 13017:14331, ack 1, win 501, options [nop,nop,TS val 1177181842 ecr 2699939090], length 1314
07:54:39.947017 IP 10.8.3.3.47634 > 99.181.80.7.1935: Flags [.], seq 14331:15645, ack 1, win 501, options [nop,nop,TS val 1177181906 ecr 2699939090], length 1314
07:54:39.958597 IP 99.181.80.7.1935 > 10.8.3.3.47634: Flags [.], ack 2628, win 126, options [nop,nop,TS val 2699939189 ecr 1177181408], length 0
07:54:39.979199 IP 10.8.3.3.47634 > 99.181.80.7.1935: Flags [.], seq 15645:16959, ack 1, win 501, options [nop,nop,TS val 1177181938 ecr 2699939189], length 1314
07:54:40.012630 IP 10.8.3.3.47634 > 99.181.80.7.1935: Flags [.], seq 16959:18273, ack 1, win 501, options [nop,nop,TS val 1177181971 ecr 2699939189], length 1314
07:54:40.028218 IP 99.181.80.7.1935 > 10.8.3.3.47634: Flags [.], ack 5256, win 126, options [nop,nop,TS val 2699939259 ecr 1177181505], length 0
07:54:40.079137 IP 10.8.3.3.47634 > 99.181.80.7.1935: Flags [.], seq 18273:19587, ack 1, win 501, options [nop,nop,TS val 1177182038 ecr 2699939259], length 1314
07:54:40.113598 IP 10.8.3.3.47634 > 99.181.80.7.1935: Flags [.], seq 19587:20901, ack 1, win 501, options [nop,nop,TS val 1177182072 ecr 2699939259], length 1314
07:54:40.125479 IP 99.181.80.7.1935 > 10.8.3.3.47634: Flags [.], ack 7884, win 126, options [nop,nop,TS val 2699939356 ecr 1177181608], length 0
07:54:40.148128 IP 10.8.3.3.47634 > 99.181.80.7.1935: Flags [.], seq 20901:22215, ack 1, win 501, options [nop,nop,TS val 1177182107 ecr 2699939356], length 1314
07:54:40.211643 IP 99.181.80.7.1935 > 10.8.3.3.47634: Flags [.], ack 10389, win 126, options [nop,nop,TS val 2699939442 ecr 1177181673], length 0
07:54:40.211674 IP 10.8.3.3.47634 > 99.181.80.7.1935: Flags [P.], seq 22215:23388, ack 1, win 501, options [nop,nop,TS val 1177182170 ecr 2699939442], length 1173
07:54:40.249663 IP 10.8.3.3.47634 > 99.181.80.7.1935: Flags [.], seq 23388:24702, ack 1, win 501, options [nop,nop,TS val 1177182208 ecr 2699939442], length 1314
07:54:40.281436 IP 10.8.3.3.47634 > 99.181.80.7.1935: Flags [.], seq 24702:26016, ack 1, win 501, options [nop,nop,TS val 1177182240 ecr 2699939442], length 1314
07:54:40.300838 IP 99.181.80.7.1935 > 10.8.3.3.47634: Flags [.], ack 13017, win 126, options [nop,nop,TS val 2699939531 ecr 1177181772], length 0
07:54:40.329754 IP 10.8.3.3.47634 > 99.181.80.7.1935: Flags [.], seq 26016:27330, ack 1, win 501, options [nop,nop,TS val 1177182288 ecr 2699939531], length 1314
07:54:40.382317 IP 10.8.3.3.47634 > 99.181.80.7.1935: Flags [.], seq 27330:28644, ack 1, win 501, options [nop,nop,TS val 1177182341 ecr 2699939531], length 1314
07:54:40.393330 IP 99.181.80.7.1935 > 10.8.3.3.47634: Flags [.], ack 15645, win 126, options [nop,nop,TS val 2699939624 ecr 1177181842], length 0
07:54:40.416584 IP 10.8.3.3.47634 > 99.181.80.7.1935: Flags [.], seq 28644:29958, ack 1, win 501, options [nop,nop,TS val 1177182375 ecr 2699939624], length 1314
07:54:40.457765 IP 10.8.3.3.47634 > 99.181.80.7.1935: Flags [.], seq 29958:31272, ack 1, win 501, options [nop,nop,TS val 1177182416 ecr 2699939624], length 1314
07:54:40.458916 IP 99.181.80.7.1935 > 10.8.3.3.47634: Flags [.], ack 18273, win 126, options [nop,nop,TS val 2699939689 ecr 1177181938], length 0
07:54:40.516661 IP 10.8.3.3.47634 > 99.181.80.7.1935: Flags [.], seq 31272:32586, ack 1, win 501, options [nop,nop,TS val 1177182475 ecr 2699939689], length 1314
07:54:40.548686 IP 10.8.3.3.47634 > 99.181.80.7.1935: Flags [.], seq 32586:33900, ack 1, win 501, options [nop,nop,TS val 1177182507 ecr 2699939689], length 1314
07:54:40.586332 IP 10.8.3.3.47634 > 99.181.80.7.1935: Flags [.], seq 33900:35214, ack 1, win 501, options [nop,nop,TS val 1177182545 ecr 2699939689], length 1314
07:54:40.594588 IP 99.181.80.7.1935 > 10.8.3.3.47634: Flags [.], ack 19587, win 126, options [nop,nop,TS val 2699939825 ecr 1177182038,nop,nop,sack 1 {20901:22215}], length 0
07:54:40.650661 IP 10.8.3.3.47634 > 99.181.80.7.1935: Flags [.], seq 35214:36528, ack 1, win 501, options [nop,nop,TS val 1177182609 ecr 2699939825], length 1314
07:54:40.657886 IP 99.181.80.7.1935 > 10.8.3.3.47634: Flags [.], ack 19587, win 126, options [nop,nop,TS val 2699939888 ecr 1177182038,nop,nop,sack 1 {20901:23388}], length 0
07:54:40.682212 IP 10.8.3.3.47634 > 99.181.80.7.1935: Flags [.], seq 19587:20901, ack 1, win 501, options [nop,nop,TS val 1177182641 ecr 2699939888], length 1314
07:54:40.695820 IP 99.181.80.7.1935 > 10.8.3.3.47634: Flags [.], ack 19587, win 126, options [nop,nop,TS val 2699939926 ecr 1177182038,nop,nop,sack 1 {20901:24702}], length 0
07:54:40.695832 IP 10.8.3.3.47634 > 99.181.80.7.1935: Flags [.], seq 36528:37842, ack 1, win 501, options [nop,nop,TS val 1177182655 ecr 2699939926], length 1314
07:54:40.728855 IP 99.181.80.7.1935 > 10.8.3.3.47634: Flags [.], ack 19587, win 126, options [nop,nop,TS val 2699939958 ecr 1177182038,nop,nop,sack 1 {20901:26016}], length 0
07:54:40.728871 IP 10.8.3.3.47634 > 99.181.80.7.1935: Flags [.], seq 37842:39156, ack 1, win 501, options [nop,nop,TS val 1177182688 ecr 2699939958], length 1314
07:54:40.777093 IP 99.181.80.7.1935 > 10.8.3.3.47634: Flags [.], ack 19587, win 126, options [nop,nop,TS val 2699940006 ecr 1177182038,nop,nop,sack 1 {20901:27330}], length 0
07:54:40.782543 IP 10.8.3.3.47634 > 99.181.80.7.1935: Flags [.], seq 39156:40470, ack 1, win 501, options [nop,nop,TS val 1177182741 ecr 2699940006], length 1314
07:54:40.829560 IP 99.181.80.7.1935 > 10.8.3.3.47634: Flags [.], ack 19587, win 126, options [nop,nop,TS val 2699940059 ecr 1177182038,nop,nop,sack 1 {20901:28644}], length 0
07:54:40.829576 IP 10.8.3.3.47634 > 99.181.80.7.1935: Flags [.], seq 40470:41784, ack 1, win 501, options [nop,nop,TS val 1177182788 ecr 2699940059], length 1314
07:54:40.863876 IP 99.181.80.7.1935 > 10.8.3.3.47634: Flags [.], ack 19587, win 126, options [nop,nop,TS val 2699940093 ecr 1177182038,nop,nop,sack 1 {20901:29958}], length 0
07:54:40.863930 IP 10.8.3.3.47634 > 99.181.80.7.1935: Flags [.], seq 41784:43098, ack 1, win 501, options [nop,nop,TS val 1177182823 ecr 2699940093], length 1314
07:54:40.904869 IP 99.181.80.7.1935 > 10.8.3.3.47634: Flags [.], ack 19587, win 126, options [nop,nop,TS val 2699940134 ecr 1177182038,nop,nop,sack 1 {20901:31272}], length 0
07:54:40.914722 IP 10.8.3.3.47634 > 99.181.80.7.1935: Flags [.], seq 43098:44412, ack 1, win 501, options [nop,nop,TS val 1177182873 ecr 2699940134], length 1314
07:54:40.963888 IP 99.181.80.7.1935 > 10.8.3.3.47634: Flags [.], ack 19587, win 126, options [nop,nop,TS val 2699940193 ecr 1177182038,nop,nop,sack 1 {20901:32586}], length 0
07:54:40.963904 IP 10.8.3.3.47634 > 99.181.80.7.1935: Flags [.], seq 44412:45726, ack 1, win 501, options [nop,nop,TS val 1177182923 ecr 2699940193], length 1314
07:54:40.996128 IP 99.181.80.7.1935 > 10.8.3.3.47634: Flags [.], ack 19587, win 126, options [nop,nop,TS val 2699940226 ecr 1177182038,nop,nop,sack 1 {20901:33900}], length 0
07:54:40.996145 IP 10.8.3.3.47634 > 99.181.80.7.1935: Flags [.], seq 45726:47040, ack 1, win 501, options [nop,nop,TS val 1177182955 ecr 2699940226], length 1314
07:54:41.033647 IP 99.181.80.7.1935 > 10.8.3.3.47634: Flags [.], ack 19587, win 126, options [nop,nop,TS val 2699940263 ecr 1177182038,nop,nop,sack 1 {20901:35214}], length 0
07:54:41.050128 IP 10.8.3.3.47634 > 99.181.80.7.1935: Flags [.], seq 47040:48354, ack 1, win 501, options [nop,nop,TS val 1177183009 ecr 2699940263], length 1314
07:54:41.097898 IP 99.181.80.7.1935 > 10.8.3.3.47634: Flags [.], ack 19587, win 126, options [nop,nop,TS val 2699940327 ecr 1177182038,nop,nop,sack 1 {20901:36528}], length 0
07:54:41.097945 IP 10.8.3.3.47634 > 99.181.80.7.1935: Flags [.], seq 48354:49668, ack 1, win 501, options [nop,nop,TS val 1177183057 ecr 2699940327], length 1314
07:54:41.128356 IP 99.181.80.7.1935 > 10.8.3.3.47634: Flags [.], ack 36528, win 106, options [nop,nop,TS val 2699940359 ecr 1177182641], length 0
07:54:41.128438 IP 10.8.3.3.47634 > 99.181.80.7.1935: Flags [.], seq 49668:50982, ack 1, win 501, options [nop,nop,TS val 1177183087 ecr 2699940359], length 1314
07:54:41.128442 IP 10.8.3.3.47634 > 99.181.80.7.1935: Flags [P.], seq 50982:51197, ack 1, win 501, options [nop,nop,TS val 1177183087 ecr 2699940359], length 215
07:54:41.141820 IP 99.181.80.7.1935 > 10.8.3.3.47634: Flags [.], ack 37842, win 131, options [nop,nop,TS val 2699940372 ecr 1177182655], length 0
07:54:41.174859 IP 99.181.80.7.1935 > 10.8.3.3.47634: Flags [.], ack 39156, win 137, options [nop,nop,TS val 2699940405 ecr 1177182688], length 0
07:54:41.182136 IP 10.8.3.3.47634 > 99.181.80.7.1935: Flags [.], seq 51197:52511, ack 1, win 501, options [nop,nop,TS val 1177183141 ecr 2699940405], length 1314
07:54:41.216075 IP 10.8.3.3.47634 > 99.181.80.7.1935: Flags [.], seq 52511:53825, ack 1, win 501, options [nop,nop,TS val 1177183175 ecr 2699940405], length 1314
07:54:41.228818 IP 99.181.80.7.1935 > 10.8.3.3.47634: Flags [.], ack 40470, win 143, options [nop,nop,TS val 2699940459 ecr 1177182741], length 0
07:54:41.248178 IP 10.8.3.3.47634 > 99.181.80.7.1935: Flags [.], seq 53825:55139, ack 1, win 501, options [nop,nop,TS val 1177183207 ecr 2699940459], length 1314
07:54:41.275649 IP 99.181.80.7.1935 > 10.8.3.3.47634: Flags [.], ack 41784, win 148, options [nop,nop,TS val 2699940506 ecr 1177182788], length 0
07:54:41.310299 IP 99.181.80.7.1935 > 10.8.3.3.47634: Flags [.], ack 43098, win 154, options [nop,nop,TS val 2699940541 ecr 1177182823], length 0
07:54:41.317087 IP 10.8.3.3.47634 > 99.181.80.7.1935: Flags [.], seq 55139:56453, ack 1, win 501, options [nop,nop,TS val 1177183276 ecr 2699940541], length 1314
07:54:41.349174 IP 10.8.3.3.47634 > 99.181.80.7.1935: Flags [.], seq 56453:57767, ack 1, win 501, options [nop,nop,TS val 1177183308 ecr 2699940541], length 1314
07:54:41.361154 IP 99.181.80.7.1935 > 10.8.3.3.47634: Flags [.], ack 44412, win 160, options [nop,nop,TS val 2699940591 ecr 1177182873], length 0
07:54:41.378808 IP 10.8.3.3.47634 > 99.181.80.7.1935: Flags [.], seq 57767:59081, ack 1, win 501, options [nop,nop,TS val 1177183338 ecr 2699940591], length 1314
07:54:41.410089 IP 99.181.80.7.1935 > 10.8.3.3.47634: Flags [.], ack 45726, win 165, options [nop,nop,TS val 2699940640 ecr 1177182923], length 0
07:54:41.442267 IP 99.181.80.7.1935 > 10.8.3.3.47634: Flags [.], ack 47040, win 171, options [nop,nop,TS val 2699940673 ecr 1177182955], length 0
07:54:41.447071 IP 10.8.3.3.47634 > 99.181.80.7.1935: Flags [.], seq 59081:60395, ack 1, win 501, options [nop,nop,TS val 1177183406 ecr 2699940673], length 1314
07:54:41.483280 IP 10.8.3.3.47634 > 99.181.80.7.1935: Flags [.], seq 60395:61709, ack 1, win 501, options [nop,nop,TS val 1177183442 ecr 2699940673], length 1314
07:54:41.496486 IP 99.181.80.7.1935 > 10.8.3.3.47634: Flags [.], ack 48354, win 177, options [nop,nop,TS val 2699940727 ecr 1177183009], length 0
07:54:41.516369 IP 10.8.3.3.47634 > 99.181.80.7.1935: Flags [.], seq 61709:63023, ack 1, win 501, options [nop,nop,TS val 1177183475 ecr 2699940727], length 1314
07:54:41.544315 IP 99.181.80.7.1935 > 10.8.3.3.47634: Flags [.], ack 49668, win 182, options [nop,nop,TS val 2699940775 ecr 1177183057], length 0
07:54:41.575188 IP 99.181.80.7.1935 > 10.8.3.3.47634: Flags [.], ack 51197, win 188, options [nop,nop,TS val 2699940805 ecr 1177183087], length 0
07:54:41.575222 IP 10.8.3.3.47634 > 99.181.80.7.1935: Flags [P.], seq 63023:64206, ack 1, win 501, options [nop,nop,TS val 1177183534 ecr 2699940805], length 1183
07:54:41.613926 IP 10.8.3.3.47634 > 99.181.80.7.1935: Flags [.], seq 64206:65520, ack 1, win 501, options [nop,nop,TS val 1177183573 ecr 2699940805], length 1314
07:54:41.628512 IP 99.181.80.7.1935 > 10.8.3.3.47634: Flags [.], ack 52511, win 194, options [nop,nop,TS val 2699940859 ecr 1177183141], length 0
07:54:41.647748 IP 10.8.3.3.47634 > 99.181.80.7.1935: Flags [.], seq 65520:66834, ack 1, win 501, options [nop,nop,TS val 1177183606 ecr 2699940859], length 1314
07:54:41.662239 IP 99.181.80.7.1935 > 10.8.3.3.47634: Flags [.], ack 53825, win 199, options [nop,nop,TS val 2699940893 ecr 1177183175], length 0
07:54:41.694286 IP 99.181.80.7.1935 > 10.8.3.3.47634: Flags [.], ack 55139, win 205, options [nop,nop,TS val 2699940925 ecr 1177183207], length 0
07:54:41.695772 IP 10.8.3.3.47634 > 99.181.80.7.1935: Flags [.], seq 66834:68148, ack 1, win 501, options [nop,nop,TS val 1177183654 ecr 2699940925], length 1314
07:54:41.747731 IP 10.8.3.3.47634 > 99.181.80.7.1935: Flags [.], seq 68148:69462, ack 1, win 501, options [nop,nop,TS val 1177183706 ecr 2699940925], length 1314
07:54:41.763400 IP 99.181.80.7.1935 > 10.8.3.3.47634: Flags [.], ack 56453, win 211, options [nop,nop,TS val 2699940994 ecr 1177183276], length 0
07:54:41.780788 IP 10.8.3.3.47634 > 99.181.80.7.1935: Flags [.], seq 69462:70776, ack 1, win 501, options [nop,nop,TS val 1177183739 ecr 2699940994], length 1314
07:54:41.795454 IP 99.181.80.7.1935 > 10.8.3.3.47634: Flags [.], ack 57767, win 216, options [nop,nop,TS val 2699941026 ecr 1177183308], length 0
07:54:41.823456 IP 10.8.3.3.47634 > 99.181.80.7.1935: Flags [.], seq 70776:72090, ack 1, win 501, options [nop,nop,TS val 1177183782 ecr 2699941026], length 1314
07:54:41.825466 IP 99.181.80.7.1935 > 10.8.3.3.47634: Flags [.], ack 59081, win 222, options [nop,nop,TS val 2699941056 ecr 1177183338], length 0
07:54:41.883247 IP 10.8.3.3.47634 > 99.181.80.7.1935: Flags [.], seq 72090:73404, ack 1, win 501, options [nop,nop,TS val 1177183842 ecr 2699941056], length 1314
07:54:41.893056 IP 99.181.80.7.1935 > 10.8.3.3.47634: Flags [.], ack 60395, win 228, options [nop,nop,TS val 2699941124 ecr 1177183406], length 0
07:54:41.912259 IP 10.8.3.3.47634 > 99.181.80.7.1935: Flags [.], seq 73404:74718, ack 1, win 501, options [nop,nop,TS val 1177183871 ecr 2699941124], length 1314
07:54:41.929477 IP 99.181.80.7.1935 > 10.8.3.3.47634: Flags [.], ack 61709, win 233, options [nop,nop,TS val 2699941160 ecr 1177183442], length 0
07:54:41.951972 IP 10.8.3.3.47634 > 99.181.80.7.1935: Flags [.], seq 74718:76032, ack 1, win 501, options [nop,nop,TS val 1177183911 ecr 2699941160], length 1314
07:54:41.962744 IP 99.181.80.7.1935 > 10.8.3.3.47634: Flags [.], ack 63023, win 239, options [nop,nop,TS val 2699941193 ecr 1177183475], length 0
07:54:42.016431 IP 10.8.3.3.47634 > 99.181.80.7.1935: Flags [.], seq 76032:77346, ack 1, win 501, options [nop,nop,TS val 1177183975 ecr 2699941193], length 1314
07:54:42.021467 IP 99.181.80.7.1935 > 10.8.3.3.47634: Flags [.], ack 64206, win 245, options [nop,nop,TS val 2699941252 ecr 1177183534], length 0
07:54:42.021500 IP 10.8.3.3.47634 > 99.181.80.7.1935: Flags [P.], seq 77346:78060, ack 1, win 501, options [nop,nop,TS val 1177183980 ecr 2699941252], length 714
07:54:42.060068 IP 99.181.80.7.1935 > 10.8.3.3.47634: Flags [.], ack 65520, win 250, options [nop,nop,TS val 2699941291 ecr 1177183573], length 0
07:54:42.079993 IP 10.8.3.3.47634 > 99.181.80.7.1935: Flags [.], seq 78060:79374, ack 1, win 501, options [nop,nop,TS val 1177184039 ecr 2699941291], length 1314
07:54:42.093897 IP 99.181.80.7.1935 > 10.8.3.3.47634: Flags [.], ack 66834, win 256, options [nop,nop,TS val 2699941324 ecr 1177183606], length 0
07:54:42.115923 IP 10.8.3.3.47634 > 99.181.80.7.1935: Flags [.], seq 79374:80688, ack 1, win 501, options [nop,nop,TS val 1177184075 ecr 2699941324], length 1314
07:54:42.142210 IP 99.181.80.7.1935 > 10.8.3.3.47634: Flags [.], ack 68148, win 262, options [nop,nop,TS val 2699941373 ecr 1177183654], length 0
07:54:42.149706 IP 10.8.3.3.47634 > 99.181.80.7.1935: Flags [.], seq 80688:82002, ack 1, win 501, options [nop,nop,TS val 1177184108 ecr 2699941373], length 1314
07:54:42.194191 IP 99.181.80.7.1935 > 10.8.3.3.47634: Flags [.], ack 69462, win 267, options [nop,nop,TS val 2699941425 ecr 1177183706], length 0
07:54:42.214899 IP 10.8.3.3.47634 > 99.181.80.7.1935: Flags [.], seq 82002:83316, ack 1, win 501, options [nop,nop,TS val 1177184174 ecr 2699941425], length 1314
07:54:42.227510 IP 99.181.80.7.1935 > 10.8.3.3.47634: Flags [.], ack 70776, win 273, options [nop,nop,TS val 2699941458 ecr 1177183739], length 0
07:54:42.249282 IP 10.8.3.3.47634 > 99.181.80.7.1935: Flags [.], seq 83316:84630, ack 1, win 501, options [nop,nop,TS val 1177184208 ecr 2699941458], length 1314
07:54:42.269752 IP 99.181.80.7.1935 > 10.8.3.3.47634: Flags [.], ack 72090, win 279, options [nop,nop,TS val 2699941500 ecr 1177183782], length 0
07:54:42.283046 IP 10.8.3.3.47634 > 99.181.80.7.1935: Flags [.], seq 84630:85944, ack 1, win 501, options [nop,nop,TS val 1177184242 ecr 2699941500], length 1314
07:54:42.329586 IP 99.181.80.7.1935 > 10.8.3.3.47634: Flags [.], ack 73404, win 284, options [nop,nop,TS val 2699941560 ecr 1177183842], length 0
07:54:42.349669 IP 10.8.3.3.47634 > 99.181.80.7.1935: Flags [.], seq 85944:87258, ack 1, win 501, options [nop,nop,TS val 1177184308 ecr 2699941560], length 1314
07:54:42.358355 IP 99.181.80.7.1935 > 10.8.3.3.47634: Flags [.], ack 74718, win 290, options [nop,nop,TS val 2699941589 ecr 1177183871], length 0
07:54:42.383009 IP 10.8.3.3.47634 > 99.181.80.7.1935: Flags [.], seq 87258:88572, ack 1, win 501, options [nop,nop,TS val 1177184342 ecr 2699941589], length 1314
07:54:42.398336 IP 99.181.80.7.1935 > 10.8.3.3.47634: Flags [.], ack 76032, win 296, options [nop,nop,TS val 2699941629 ecr 1177183911], length 0
07:54:42.413889 IP 10.8.3.3.47634 > 99.181.80.7.1935: Flags [.], seq 88572:89886, ack 1, win 501, options [nop,nop,TS val 1177184373 ecr 2699941629], length 1314
07:54:42.462827 IP 99.181.80.7.1935 > 10.8.3.3.47634: Flags [.], ack 77346, win 301, options [nop,nop,TS val 2699941693 ecr 1177183975], length 0
07:54:42.467794 IP 99.181.80.7.1935 > 10.8.3.3.47634: Flags [.], ack 78060, win 306, options [nop,nop,TS val 2699941698 ecr 1177183980], length 0
07:54:42.467806 IP 10.8.3.3.47634 > 99.181.80.7.1935: Flags [P.], seq 89886:91065, ack 1, win 501, options [nop,nop,TS val 1177184427 ecr 2699941698], length 1179
07:54:42.514544 IP 10.8.3.3.47634 > 99.181.80.7.1935: Flags [.], seq 91065:92379, ack 1, win 501, options [nop,nop,TS val 1177184473 ecr 2699941698], length 1314
07:54:42.526296 IP 99.181.80.7.1935 > 10.8.3.3.47634: Flags [.], ack 79374, win 312, options [nop,nop,TS val 2699941757 ecr 1177184039], length 0
07:54:42.550882 IP 10.8.3.3.47634 > 99.181.80.7.1935: Flags [.], seq 92379:93693, ack 1, win 501, options [nop,nop,TS val 1177184510 ecr 2699941757], length 1314
07:54:42.562820 IP 99.181.80.7.1935 > 10.8.3.3.47634: Flags [.], ack 80688, win 318, options [nop,nop,TS val 2699941793 ecr 1177184075], length 0
07:54:42.593739 IP 10.8.3.3.47634 > 99.181.80.7.1935: Flags [.], seq 93693:95007, ack 1, win 501, options [nop,nop,TS val 1177184552 ecr 2699941793], length 1314
07:54:42.596070 IP 99.181.80.7.1935 > 10.8.3.3.47634: Flags [.], ack 82002, win 323, options [nop,nop,TS val 2699941826 ecr 1177184108], length 0
07:54:42.649100 IP 10.8.3.3.47634 > 99.181.80.7.1935: Flags [.], seq 95007:96321, ack 1, win 501, options [nop,nop,TS val 1177184608 ecr 2699941826], length 1314
07:54:42.661262 IP 99.181.80.7.1935 > 10.8.3.3.47634: Flags [.], ack 83316, win 329, options [nop,nop,TS val 2699941892 ecr 1177184174], length 0
07:54:42.683157 IP 10.8.3.3.47634 > 99.181.80.7.1935: Flags [.], seq 96321:97635, ack 1, win 501, options [nop,nop,TS val 1177184642 ecr 2699941892], length 1314
07:54:42.695456 IP 99.181.80.7.1935 > 10.8.3.3.47634: Flags [.], ack 84630, win 335, options [nop,nop,TS val 2699941926 ecr 1177184208], length 0
07:54:42.722495 IP 10.8.3.3.47634 > 99.181.80.7.1935: Flags [.], seq 97635:98949, ack 1, win 501, options [nop,nop,TS val 1177184681 ecr 2699941926], length 1314
07:54:42.729311 IP 99.181.80.7.1935 > 10.8.3.3.47634: Flags [.], ack 85944, win 340, options [nop,nop,TS val 2699941960 ecr 1177184242], length 0
07:54:42.783049 IP 10.8.3.3.47634 > 99.181.80.7.1935: Flags [.], seq 98949:100263, ack 1, win 501, options [nop,nop,TS val 1177184742 ecr 2699941960], length 1314
07:54:42.796318 IP 99.181.80.7.1935 > 10.8.3.3.47634: Flags [.], ack 87258, win 346, options [nop,nop,TS val 2699942027 ecr 1177184308], length 0
07:54:42.816200 IP 10.8.3.3.47634 > 99.181.80.7.1935: Flags [.], seq 100263:101577, ack 1, win 501, options [nop,nop,TS val 1177184775 ecr 2699942027], length 1314
07:54:42.829476 IP 99.181.80.7.1935 > 10.8.3.3.47634: Flags [.], ack 88572, win 352, options [nop,nop,TS val 2699942060 ecr 1177184342], length 0
07:54:42.851222 IP 10.8.3.3.47634 > 99.181.80.7.1935: Flags [.], seq 101577:102891, ack 1, win 501, options [nop,nop,TS val 1177184810 ecr 2699942060], length 1314
07:54:42.860317 IP 99.181.80.7.1935 > 10.8.3.3.47634: Flags [.], ack 89886, win 357, options [nop,nop,TS val 2699942091 ecr 1177184373], length 0
07:54:42.913872 IP 99.181.80.7.1935 > 10.8.3.3.47634: Flags [.], ack 91065, win 363, options [nop,nop,TS val 2699942144 ecr 1177184427], length 0
07:54:42.913900 IP 10.8.3.3.47634 > 99.181.80.7.1935: Flags [P.], seq 102891:103983, ack 1, win 501, options [nop,nop,TS val 1177184873 ecr 2699942144], length 1092
07:54:42.948204 IP 10.8.3.3.47634 > 99.181.80.7.1935: Flags [.], seq 103983:105297, ack 1, win 501, options [nop,nop,TS val 1177184907 ecr 2699942144], length 1314
07:54:42.961050 IP 99.181.80.7.1935 > 10.8.3.3.47634: Flags [.], ack 92379, win 369, options [nop,nop,TS val 2699942192 ecr 1177184473], length 0
07:54:42.981533 IP 10.8.3.3.47634 > 99.181.80.7.1935: Flags [.], seq 105297:106611, ack 1, win 501, options [nop,nop,TS val 1177184940 ecr 2699942192], length 1314
07:54:42.997645 IP 99.181.80.7.1935 > 10.8.3.3.47634: Flags [.], ack 93693, win 374, options [nop,nop,TS val 2699942228 ecr 1177184510], length 0
07:54:43.022168 IP 10.8.3.3.47634 > 99.181.80.7.1935: Flags [.], seq 106611:107925, ack 1, win 501, options [nop,nop,TS val 1177184981 ecr 2699942228], length 1314
07:54:43.040043 IP 99.181.80.7.1935 > 10.8.3.3.47634: Flags [.], ack 95007, win 380, options [nop,nop,TS val 2699942271 ecr 1177184552], length 0
07:54:43.086155 IP 10.8.3.3.47634 > 99.181.80.7.1935: Flags [.], seq 107925:109239, ack 1, win 501, options [nop,nop,TS val 1177185045 ecr 2699942271], length 1314
07:54:43.095648 IP 99.181.80.7.1935 > 10.8.3.3.47634: Flags [.], ack 96321, win 386, options [nop,nop,TS val 2699942326 ecr 1177184608], length 0
07:54:43.116034 IP 10.8.3.3.47634 > 99.181.80.7.1935: Flags [.], seq 109239:110553, ack 1, win 501, options [nop,nop,TS val 1177185075 ecr 2699942326], length 1314
07:54:43.130064 IP 99.181.80.7.1935 > 10.8.3.3.47634: Flags [.], ack 97635, win 391, options [nop,nop,TS val 2699942361 ecr 1177184642], length 0
07:54:43.150377 IP 10.8.3.3.47634 > 99.181.80.7.1935: Flags [.], seq 110553:111867, ack 1, win 501, options [nop,nop,TS val 1177185109 ecr 2699942361], length 1314
07:54:43.168830 IP 99.181.80.7.1935 > 10.8.3.3.47634: Flags [.], ack 98949, win 397, options [nop,nop,TS val 2699942399 ecr 1177184681], length 0
07:54:43.214068 IP 10.8.3.3.47634 > 99.181.80.7.1935: Flags [.], seq 111867:113181, ack 1, win 501, options [nop,nop,TS val 1177185173 ecr 2699942399], length 1314
07:54:43.229463 IP 99.181.80.7.1935 > 10.8.3.3.47634: Flags [.], ack 100263, win 403, options [nop,nop,TS val 2699942460 ecr 1177184742], length 0
07:54:43.245559 IP 10.8.3.3.47634 > 99.181.80.7.1935: Flags [.], seq 113181:114495, ack 1, win 501, options [nop,nop,TS val 1177185204 ecr 2699942460], length 1314
07:54:43.262626 IP 99.181.80.7.1935 > 10.8.3.3.47634: Flags [.], ack 101577, win 408, options [nop,nop,TS val 2699942493 ecr 1177184775], length 0
07:54:43.279161 IP 10.8.3.3.47634 > 99.181.80.7.1935: Flags [.], seq 114495:115809, ack 1, win 501, options [nop,nop,TS val 1177185238 ecr 2699942493], length 1314
07:54:43.297459 IP 99.181.80.7.1935 > 10.8.3.3.47634: Flags [.], ack 102891, win 414, options [nop,nop,TS val 2699942528 ecr 1177184810], length 0
07:54:43.349467 IP 10.8.3.3.47634 > 99.181.80.7.1935: Flags [.], seq 115809:117123, ack 1, win 501, options [nop,nop,TS val 1177185308 ecr 2699942528], length 1314
07:54:43.360246 IP 99.181.80.7.1935 > 10.8.3.3.47634: Flags [.], ack 103983, win 420, options [nop,nop,TS val 2699942591 ecr 1177184873], length 0
07:54:43.360287 IP 10.8.3.3.47634 > 99.181.80.7.1935: Flags [P.], seq 117123:117827, ack 1, win 501, options [nop,nop,TS val 1177185319 ecr 2699942591], length 704
07:54:43.394685 IP 99.181.80.7.1935 > 10.8.3.3.47634: Flags [.], ack 105297, win 425, options [nop,nop,TS val 2699942625 ecr 1177184907], length 0
07:54:43.413735 IP 10.8.3.3.47634 > 99.181.80.7.1935: Flags [.], seq 117827:119141, ack 1, win 501, options [nop,nop,TS val 1177185372 ecr 2699942625], length 1314
07:54:43.428044 IP 99.181.80.7.1935 > 10.8.3.3.47634: Flags [.], ack 106611, win 431, options [nop,nop,TS val 2699942659 ecr 1177184940], length 0
07:54:43.449460 IP 10.8.3.3.47634 > 99.181.80.7.1935: Flags [.], seq 119141:120455, ack 1, win 501, options [nop,nop,TS val 1177185408 ecr 2699942659], length 1314
07:54:43.469547 IP 99.181.80.7.1935 > 10.8.3.3.47634: Flags [.], ack 107925, win 437, options [nop,nop,TS val 2699942700 ecr 1177184981], length 0
07:54:43.482794 IP 10.8.3.3.47634 > 99.181.80.7.1935: Flags [.], seq 120455:121769, ack 1, win 501, options [nop,nop,TS val 1177185441 ecr 2699942700], length 1314
07:54:43.532569 IP 99.181.80.7.1935 > 10.8.3.3.47634: Flags [.], ack 109239, win 442, options [nop,nop,TS val 2699942763 ecr 1177185045], length 0
07:54:43.547036 IP 10.8.3.3.47634 > 99.181.80.7.1935: Flags [.], seq 121769:123083, ack 1, win 501, options [nop,nop,TS val 1177185506 ecr 2699942763], length 1314
07:54:43.562561 IP 99.181.80.7.1935 > 10.8.3.3.47634: Flags [.], ack 110553, win 448, options [nop,nop,TS val 2699942793 ecr 1177185075], length 0
07:54:43.580063 IP 10.8.3.3.47634 > 99.181.80.7.1935: Flags [.], seq 123083:124397, ack 1, win 501, options [nop,nop,TS val 1177185539 ecr 2699942793], length 1314
07:54:43.596628 IP 99.181.80.7.1935 > 10.8.3.3.47634: Flags [.], ack 111867, win 454, options [nop,nop,TS val 2699942827 ecr 1177185109], length 0
07:54:43.621388 IP 10.8.3.3.47634 > 99.181.80.7.1935: Flags [.], seq 124397:125711, ack 1, win 501, options [nop,nop,TS val 1177185580 ecr 2699942827], length 1314
07:54:43.660253 IP 99.181.80.7.1935 > 10.8.3.3.47634: Flags [.], ack 113181, win 459, options [nop,nop,TS val 2699942891 ecr 1177185173], length 0
07:54:43.685067 IP 10.8.3.3.47634 > 99.181.80.7.1935: Flags [.], seq 125711:127025, ack 1, win 501, options [nop,nop,TS val 1177185644 ecr 2699942891], length 1314
07:54:43.691801 IP 99.181.80.7.1935 > 10.8.3.3.47634: Flags [.], ack 114495, win 465, options [nop,nop,TS val 2699942922 ecr 1177185204], length 0
07:54:43.716228 IP 10.8.3.3.47634 > 99.181.80.7.1935: Flags [.], seq 127025:128339, ack 1, win 501, options [nop,nop,TS val 1177185675 ecr 2699942922], length 1314
07:54:43.725461 IP 99.181.80.7.1935 > 10.8.3.3.47634: Flags [.], ack 115809, win 468, options [nop,nop,TS val 2699942956 ecr 1177185238], length 0
07:54:43.749470 IP 10.8.3.3.47634 > 99.181.80.7.1935: Flags [.], seq 128339:129653, ack 1, win 501, options [nop,nop,TS val 1177185708 ecr 2699942956], length 1314
07:54:43.806455 IP 99.181.80.7.1935 > 10.8.3.3.47634: Flags [.], ack 117827, win 469, options [nop,nop,TS val 2699943037 ecr 1177185308], length 0
07:54:43.806480 IP 10.8.3.3.47634 > 99.181.80.7.1935: Flags [P.], seq 129653:130846, ack 1, win 501, options [nop,nop,TS val 1177185765 ecr 2699943037], length 1193
07:54:43.848454 IP 10.8.3.3.47634 > 99.181.80.7.1935: Flags [.], seq 130846:132160, ack 1, win 501, options [nop,nop,TS val 1177185807 ecr 2699943037], length 1314
07:54:43.882886 IP 10.8.3.3.47634 > 99.181.80.7.1935: Flags [.], seq 132160:133474, ack 1, win 501, options [nop,nop,TS val 1177185842 ecr 2699943037], length 1314
07:54:43.895692 IP 99.181.80.7.1935 > 10.8.3.3.47634: Flags [.], ack 120455, win 468, options [nop,nop,TS val 2699943126 ecr 1177185372], length 0
07:54:43.920920 IP 10.8.3.3.47634 > 99.181.80.7.1935: Flags [.], seq 133474:134788, ack 1, win 501, options [nop,nop,TS val 1177185880 ecr 2699943126], length 1314
07:54:43.985040 IP 10.8.3.3.47634 > 99.181.80.7.1935: Flags [.], seq 134788:136102, ack 1, win 501, options [nop,nop,TS val 1177185944 ecr 2699943126], length 1314
07:54:43.989288 IP 99.181.80.7.1935 > 10.8.3.3.47634: Flags [.], ack 121769, win 469, options [nop,nop,TS val 2699943220 ecr 1177185441], length 0
07:54:44.016266 IP 10.8.3.3.47634 > 99.181.80.7.1935: Flags [.], seq 136102:137416, ack 1, win 501, options [nop,nop,TS val 1177185975 ecr 2699943220], length 1314
07:54:44.026881 IP 99.181.80.7.1935 > 10.8.3.3.47634: Flags [.], ack 124397, win 469, options [nop,nop,TS val 2699943257 ecr 1177185506], length 0
07:54:44.049361 IP 10.8.3.3.47634 > 99.181.80.7.1935: Flags [.], seq 137416:138730, ack 1, win 501, options [nop,nop,TS val 1177186008 ecr 2699943257], length 1314
07:54:44.114939 IP 10.8.3.3.47634 > 99.181.80.7.1935: Flags [.], seq 138730:140044, ack 1, win 501, options [nop,nop,TS val 1177186074 ecr 2699943257], length 1314
07:54:44.131468 IP 99.181.80.7.1935 > 10.8.3.3.47634: Flags [.], ack 127025, win 468, options [nop,nop,TS val 2699943362 ecr 1177185580], length 0
07:54:44.156521 IP 10.8.3.3.47634 > 99.181.80.7.1935: Flags [.], seq 140044:141358, ack 1, win 501, options [nop,nop,TS val 1177186115 ecr 2699943362], length 1314
07:54:44.182236 IP 10.8.3.3.47634 > 99.181.80.7.1935: Flags [.], seq 141358:142672, ack 1, win 501, options [nop,nop,TS val 1177186141 ecr 2699943362], length 1314
07:54:44.196018 IP 99.181.80.7.1935 > 10.8.3.3.47634: Flags [.], ack 129653, win 468, options [nop,nop,TS val 2699943427 ecr 1177185675], length 0
07:54:44.246873 IP 10.8.3.3.47634 > 99.181.80.7.1935: Flags [.], seq 142672:143986, ack 1, win 501, options [nop,nop,TS val 1177186206 ecr 2699943427], length 1314
07:54:44.252632 IP 99.181.80.7.1935 > 10.8.3.3.47634: Flags [.], ack 130846, win 469, options [nop,nop,TS val 2699943483 ecr 1177185765], length 0
07:54:44.252659 IP 10.8.3.3.47634 > 99.181.80.7.1935: Flags [P.], seq 143986:144694, ack 1, win 501, options [nop,nop,TS val 1177186211 ecr 2699943483], length 708
07:54:44.316228 IP 10.8.3.3.47634 > 99.181.80.7.1935: Flags [.], seq 144694:146008, ack 1, win 501, options [nop,nop,TS val 1177186275 ecr 2699943483], length 1314
07:54:44.329207 IP 99.181.80.7.1935 > 10.8.3.3.47634: Flags [.], ack 133474, win 469, options [nop,nop,TS val 2699943560 ecr 1177185807], length 0
07:54:44.349586 IP 10.8.3.3.47634 > 99.181.80.7.1935: Flags [.], seq 146008:147322, ack 1, win 501, options [nop,nop,TS val 1177186308 ecr 2699943560], length 1314
07:54:44.379709 IP 10.8.3.3.47634 > 99.181.80.7.1935: Flags [.], seq 147322:148636, ack 1, win 501, options [nop,nop,TS val 1177186338 ecr 2699943560], length 1314
07:54:44.431242 IP 99.181.80.7.1935 > 10.8.3.3.47634: Flags [.], ack 136102, win 468, options [nop,nop,TS val 2699943662 ecr 1177185880], length 0
07:54:44.455012 IP 10.8.3.3.47634 > 99.181.80.7.1935: Flags [.], seq 148636:149950, ack 1, win 501, options [nop,nop,TS val 1177186414 ecr 2699943662], length 1314
07:54:44.480510 IP 10.8.3.3.47634 > 99.181.80.7.1935: Flags [.], seq 149950:151264, ack 1, win 501, options [nop,nop,TS val 1177186439 ecr 2699943662], length 1314
07:54:44.495815 IP 99.181.80.7.1935 > 10.8.3.3.47634: Flags [.], ack 138730, win 468, options [nop,nop,TS val 2699943726 ecr 1177185975], length 0
07:54:44.519091 IP 10.8.3.3.47634 > 99.181.80.7.1935: Flags [.], seq 151264:152578, ack 1, win 501, options [nop,nop,TS val 1177186478 ecr 2699943726], length 1314
07:54:44.582829 IP 10.8.3.3.47634 > 99.181.80.7.1935: Flags [.], seq 152578:153892, ack 1, win 501, options [nop,nop,TS val 1177186542 ecr 2699943726], length 1314
07:54:44.602988 IP 99.181.80.7.1935 > 10.8.3.3.47634: Flags [.], ack 141358, win 468, options [nop,nop,TS val 2699943834 ecr 1177186074], length 0
07:54:44.612671 IP 10.8.3.3.47634 > 99.181.80.7.1935: Flags [.], seq 153892:155206, ack 1, win 501, options [nop,nop,TS val 1177186571 ecr 2699943834], length 1314
07:54:44.649535 IP 10.8.3.3.47634 > 99.181.80.7.1935: Flags [.], seq 155206:156520, ack 1, win 501, options [nop,nop,TS val 1177186608 ecr 2699943834], length 1314
07:54:44.693204 IP 99.181.80.7.1935 > 10.8.3.3.47634: Flags [.], ack 143986, win 468, options [nop,nop,TS val 2699943924 ecr 1177186141], length 0
07:54:44.698792 IP 99.181.80.7.1935 > 10.8.3.3.47634: Flags [.], ack 144694, win 469, options [nop,nop,TS val 2699943929 ecr 1177186211], length 0
07:54:44.698816 IP 10.8.3.3.47634 > 99.181.80.7.1935: Flags [P.], seq 156520:157708, ack 1, win 501, options [nop,nop,TS val 1177186658 ecr 2699943929], length 1188
07:54:44.753865 IP 10.8.3.3.47634 > 99.181.80.7.1935: Flags [.], seq 157708:159022, ack 1, win 501, options [nop,nop,TS val 1177186713 ecr 2699943929], length 1314
07:54:44.779887 IP 10.8.3.3.47634 > 99.181.80.7.1935: Flags [.], seq 159022:160336, ack 1, win 501, options [nop,nop,TS val 1177186739 ecr 2699943929], length 1314
07:54:44.795982 IP 99.181.80.7.1935 > 10.8.3.3.47634: Flags [.], ack 147322, win 469, options [nop,nop,TS val 2699944027 ecr 1177186275], length 0
07:54:44.817953 IP 10.8.3.3.47634 > 99.181.80.7.1935: Flags [.], seq 160336:161650, ack 1, win 501, options [nop,nop,TS val 1177186777 ecr 2699944027], length 1314
07:54:44.882235 IP 10.8.3.3.47634 > 99.181.80.7.1935: Flags [.], seq 161650:162964, ack 1, win 501, options [nop,nop,TS val 1177186841 ecr 2699944027], length 1314
07:54:44.901230 IP 99.181.80.7.1935 > 10.8.3.3.47634: Flags [.], ack 149950, win 468, options [nop,nop,TS val 2699944132 ecr 1177186338], length 0
07:54:44.914860 IP 10.8.3.3.47634 > 99.181.80.7.1935: Flags [.], seq 162964:164278, ack 1, win 501, options [nop,nop,TS val 1177186874 ecr 2699944132], length 1314
07:54:44.949123 IP 10.8.3.3.47634 > 99.181.80.7.1935: Flags [.], seq 164278:165592, ack 1, win 501, options [nop,nop,TS val 1177186908 ecr 2699944132], length 1314
07:54:44.965159 IP 99.181.80.7.1935 > 10.8.3.3.47634: Flags [.], ack 152578, win 468, options [nop,nop,TS val 2699944196 ecr 1177186439], length 0
07:54:45.013660 IP 10.8.3.3.47634 > 99.181.80.7.1935: Flags [.], seq 165592:166906, ack 1, win 501, options [nop,nop,TS val 1177186972 ecr 2699944196], length 1314
07:54:45.053234 IP 10.8.3.3.47634 > 99.181.80.7.1935: Flags [.], seq 166906:168220, ack 1, win 501, options [nop,nop,TS val 1177187012 ecr 2699944196], length 1314
07:54:45.059018 IP 99.181.80.7.1935 > 10.8.3.3.47634: Flags [.], ack 155206, win 468, options [nop,nop,TS val 2699944290 ecr 1177186542], length 0
07:54:45.083052 IP 10.8.3.3.47634 > 99.181.80.7.1935: Flags [.], seq 168220:169534, ack 1, win 501, options [nop,nop,TS val 1177187042 ecr 2699944290], length 1314
07:54:45.145035 IP 99.181.80.7.1935 > 10.8.3.3.47634: Flags [.], ack 157708, win 468, options [nop,nop,TS val 2699944376 ecr 1177186608], length 0
07:54:45.145068 IP 10.8.3.3.47634 > 99.181.80.7.1935: Flags [P.], seq 169534:170709, ack 1, win 501, options [nop,nop,TS val 1177187104 ecr 2699944376], length 1175
07:54:45.182432 IP 10.8.3.3.47634 > 99.181.80.7.1935: Flags [.], seq 170709:172023, ack 1, win 501, options [nop,nop,TS val 1177187141 ecr 2699944376], length 1314
07:54:45.224393 IP 10.8.3.3.47634 > 99.181.80.7.1935: Flags [.], seq 172023:173337, ack 1, win 501, options [nop,nop,TS val 1177187183 ecr 2699944376], length 1314
07:54:45.226076 IP 99.181.80.7.1935 > 10.8.3.3.47634: Flags [.], ack 160336, win 468, options [nop,nop,TS val 2699944457 ecr 1177186713], length 0
07:54:45.266745 IP 10.8.3.3.47634 > 99.181.80.7.1935: Flags [.], seq 173337:174651, ack 1, win 501, options [nop,nop,TS val 1177187225 ecr 2699944457], length 1314
07:54:45.315396 IP 10.8.3.3.47634 > 99.181.80.7.1935: Flags [.], seq 174651:175965, ack 1, win 501, options [nop,nop,TS val 1177187274 ecr 2699944457], length 1314
07:54:45.328684 IP 99.181.80.7.1935 > 10.8.3.3.47634: Flags [.], ack 162964, win 468, options [nop,nop,TS val 2699944559 ecr 1177186777], length 0
07:54:45.352380 IP 10.8.3.3.47634 > 99.181.80.7.1935: Flags [.], seq 175965:177279, ack 1, win 501, options [nop,nop,TS val 1177187311 ecr 2699944559], length 1314
07:54:45.395338 IP 10.8.3.3.47634 > 99.181.80.7.1935: Flags [.], seq 177279:178593, ack 1, win 501, options [nop,nop,TS val 1177187354 ecr 2699944559], length 1314
07:54:45.395440 IP 99.181.80.7.1935 > 10.8.3.3.47634: Flags [.], ack 165592, win 468, options [nop,nop,TS val 2699944626 ecr 1177186874], length 0
07:54:45.449505 IP 10.8.3.3.47634 > 99.181.80.7.1935: Flags [.], seq 178593:179907, ack 1, win 501, options [nop,nop,TS val 1177187408 ecr 2699944626], length 1314
07:54:45.483035 IP 10.8.3.3.47634 > 99.181.80.7.1935: Flags [.], seq 179907:181221, ack 1, win 501, options [nop,nop,TS val 1177187442 ecr 2699944626], length 1314
07:54:45.499604 IP 99.181.80.7.1935 > 10.8.3.3.47634: Flags [.], ack 168220, win 468, options [nop,nop,TS val 2699944730 ecr 1177186972], length 0
07:54:45.524362 IP 10.8.3.3.47634 > 99.181.80.7.1935: Flags [.], seq 181221:182535, ack 1, win 501, options [nop,nop,TS val 1177187483 ecr 2699944730], length 1314
07:54:45.588614 IP 10.8.3.3.47634 > 99.181.80.7.1935: Flags [.], seq 182535:183849, ack 1, win 501, options [nop,nop,TS val 1177187547 ecr 2699944730], length 1314
07:54:45.591208 IP 99.181.80.7.1935 > 10.8.3.3.47634: Flags [.], ack 170709, win 468, options [nop,nop,TS val 2699944822 ecr 1177187042], length 0
