08:23:30.056979 IP 52.223.226.180.1935 > 10.8.3.4.34204: Flags [.], ack 2341107317, win 126, options [nop,nop,TS val 1635803356 ecr 4108468034], length 0
08:23:30.061992 IP 10.8.3.4.34204 > 52.223.226.180.1935: Flags [.], seq 10648:11962, ack 0, win 501, options [nop,nop,TS val 4108468467 ecr 1635803356], length 1314
08:23:30.098115 IP 10.8.3.4.34204 > 52.223.226.180.1935: Flags [.], seq 11962:13276, ack 0, win 501, options [nop,nop,TS val 4108468503 ecr 1635803356], length 1314
08:23:30.108444 IP 52.223.226.180.1935 > 10.8.3.4.34204: Flags [.], ack 1450, win 126, options [nop,nop,TS val 1635803408 ecr 4108468103], length 0
08:23:30.108477 IP 10.8.3.4.34204 > 52.223.226.180.1935: Flags [P.], seq 13276:13429, ack 0, win 501, options [nop,nop,TS val 4108468513 ecr 1635803408], length 153
08:23:30.164988 IP 10.8.3.4.34204 > 52.223.226.180.1935: Flags [.], seq 13429:14743, ack 0, win 501, options [nop,nop,TS val 4108468570 ecr 1635803408], length 1314
08:23:30.191030 IP 10.8.3.4.34204 > 52.223.226.180.1935: Flags [.], seq 14743:16057, ack 0, win 501, options [nop,nop,TS val 4108468596 ecr 1635803408], length 1314
08:23:30.198578 IP 52.223.226.180.1935 > 10.8.3.4.34204: Flags [.], ack 4078, win 126, options [nop,nop,TS val 1635803498 ecr 4108468167], length 0
08:23:30.234096 IP 10.8.3.4.34204 > 52.223.226.180.1935: Flags [.], seq 16057:17371, ack 0, win 501, options [nop,nop,TS val 4108468639 ecr 1635803498], length 1314
08:23:30.292140 IP 52.223.226.180.1935 > 10.8.3.4.34204: Flags [.], ack 6706, win 126, options [nop,nop,TS val 1635803591 ecr 4108468237], length 0
08:23:30.295673 IP 10.8.3.4.34204 > 52.223.226.180.1935: Flags [.], seq 17371:18685, ack 0, win 501, options [nop,nop,TS val 4108468701 ecr 1635803591], length 1314
08:23:30.327823 IP 10.8.3.4.34204 > 52.223.226.180.1935: Flags [.], seq 18685:19999, ack 0, win 501, options [nop,nop,TS val 4108468733 ecr 1635803591], length 1314
08:23:30.362266 IP 10.8.3.4.34204 > 52.223.226.180.1935: Flags [.], seq 19999:21313, ack 0, win 501, options [nop,nop,TS val 4108468767 ecr 1635803591], length 1314
08:23:30.364178 IP 52.223.226.180.1935 > 10.8.3.4.34204: Flags [.], ack 9334, win 126, options [nop,nop,TS val 1635803663 ecr 4108468333], length 0
08:23:30.425997 IP 10.8.3.4.34204 > 52.223.226.180.1935: Flags [.], seq 21313:22627, ack 0, win 501, options [nop,nop,TS val 4108468831 ecr 1635803663], length 1314
08:23:30.463275 IP 52.223.226.180.1935 > 10.8.3.4.34204: Flags [.], ack 11962, win 126, options [nop,nop,TS val 1635803762 ecr 4108468435], length 0
08:23:30.465026 IP 10.8.3.4.34204 > 52.223.226.180.1935: Flags [.], seq 22627:23941, ack 0, win 501, options [nop,nop,TS val 4108468870 ecr 1635803762], length 1314
08:23:30.495748 IP 10.8.3.4.34204 > 52.223.226.180.1935: Flags [.], seq 23941:25255, ack 0, win 501, options [nop,nop,TS val 4108468901 ecr 1635803762], length 1314
08:23:30.509238 IP 52.223.226.180.1935 > 10.8.3.4.34204: Flags [.], ack 13429, win 126, options [nop,nop,TS val 1635803808 ecr 4108468503], length 0
08:23:30.509259 IP 10.8.3.4.34204 > 52.223.226.180.1935: Flags [P.], seq 25255:25297, ack 0, win 501, options [nop,nop,TS val 4108468914 ecr 1635803808], length 42
08:23:30.560711 IP 10.8.3.4.34204 > 52.223.226.180.1935: Flags [.], seq 25297:26611, ack 0, win 501, options [nop,nop,TS val 4108468966 ecr 1635803808], length 1314
08:23:30.592212 IP 52.223.226.180.1935 > 10.8.3.4.34204: Flags [.], ack 16057, win 126, options [nop,nop,TS val 1635803891 ecr 4108468570], length 0
08:23:30.595065 IP 10.8.3.4.34204 > 52.223.226.180.1935: Flags [.], seq 26611:27925, ack 0, win 501, options [nop,nop,TS val 4108469000 ecr 1635803891], length 1314
08:23:30.629361 IP 10.8.3.4.34204 > 52.223.226.180.1935: Flags [.], seq 27925:29239, ack 0, win 501, options [nop,nop,TS val 4108469034 ecr 1635803891], length 1314
08:23:30.696632 IP 52.223.226.180.1935 > 10.8.3.4.34204: Flags [.], ack 18685, win 126, options [nop,nop,TS val 1635803996 ecr 4108468639], length 0
08:23:30.697236 IP 10.8.3.4.34204 > 52.223.226.180.1935: Flags [.], seq 29239:30553, ack 0, win 501, options [nop,nop,TS val 4108469102 ecr 1635803996], length 1314
08:23:30.724725 IP 10.8.3.4.34204 > 52.223.226.180.1935: Flags [.], seq 30553:31867, ack 0, win 501, options [nop,nop,TS val 4108469130 ecr 1635803996], length 1314
08:23:30.761648 IP 10.8.3.4.34204 > 52.223.226.180.1935: Flags [.], seq 31867:33181, ack 0, win 501, options [nop,nop,TS val 4108469167 ecr 1635803996], length 1314
08:23:30.763428 IP 52.223.226.180.1935 > 10.8.3.4.34204: Flags [.], ack 21313, win 126, options [nop,nop,TS val 1635804062 ecr 4108468733], length 0
08:23:30.827705 IP 10.8.3.4.34204 > 52.223.226.180.1935: Flags [.], seq 33181:34495, ack 0, win 501, options [nop,nop,TS val 4108469233 ecr 1635804062], length 1314
08:23:30.863505 IP 10.8.3.4.34204 > 52.223.226.180.1935: Flags [.], seq 34495:35809, ack 0, win 501, options [nop,nop,TS val 4108469268 ecr 1635804062], length 1314
08:23:30.866161 IP 52.223.226.180.1935 > 10.8.3.4.34204: Flags [.], ack 23941, win 126, options [nop,nop,TS val 1635804165 ecr 4108468831], length 0
08:23:30.895096 IP 10.8.3.4.34204 > 52.223.226.180.1935: Flags [.], seq 35809:37123, ack 0, win 501, options [nop,nop,TS val 4108469300 ecr 1635804165], length 1314
08:23:30.910031 IP 52.223.226.180.1935 > 10.8.3.4.34204: Flags [.], ack 25297, win 126, options [nop,nop,TS val 1635804209 ecr 4108468901], length 0
08:23:30.910044 IP 10.8.3.4.34204 > 52.223.226.180.1935: Flags [P.], seq 37123:37276, ack 0, win 501, options [nop,nop,TS val 4108469315 ecr 1635804209], length 153
08:23:30.959478 IP 10.8.3.4.34204 > 52.223.226.180.1935: Flags [.], seq 37276:38590, ack 0, win 501, options [nop,nop,TS val 4108469364 ecr 1635804209], length 1314
08:23:30.994993 IP 10.8.3.4.34204 > 52.223.226.180.1935: Flags [.], seq 38590:39904, ack 0, win 501, options [nop,nop,TS val 4108469400 ecr 1635804209], length 1314
08:23:30.996022 IP 52.223.226.180.1935 > 10.8.3.4.34204: Flags [.], ack 27925, win 126, options [nop,nop,TS val 1635804295 ecr 4108468966], length 0
08:23:31.028927 IP 10.8.3.4.34204 > 52.223.226.180.1935: Flags [.], seq 39904:41218, ack 0, win 501, options [nop,nop,TS val 4108469434 ecr 1635804295], length 1314
08:23:31.094943 IP 10.8.3.4.34204 > 52.223.226.180.1935: Flags [.], seq 41218:42532, ack 0, win 501, options [nop,nop,TS val 4108469500 ecr 1635804295], length 1314
08:23:31.098211 IP 52.223.226.180.1935 > 10.8.3.4.34204: Flags [.], ack 30553, win 126, options [nop,nop,TS val 1635804397 ecr 4108469034], length 0
08:23:31.129164 IP 10.8.3.4.34204 > 52.223.226.180.1935: Flags [.], seq 42532:43846, ack 0, win 501, options [nop,nop,TS val 4108469534 ecr 1635804397], length 1314
08:23:31.162457 IP 52.223.226.180.1935 > 10.8.3.4.34204: Flags [.], ack 33181, win 126, options [nop,nop,TS val 1635804461 ecr 4108469130], length 0
08:23:31.162739 IP 10.8.3.4.34204 > 52.223.226.180.1935: Flags [.], seq 43846:45160, ack 0, win 501, options [nop,nop,TS val 4108469568 ecr 1635804461], length 1314
08:23:31.227409 IP 10.8.3.4.34204 > 52.223.226.180.1935: Flags [.], seq 45160:46474, ack 0, win 501, options [nop,nop,TS val 4108469632 ecr 1635804461], length 1314
08:23:31.257257 IP 10.8.3.4.34204 > 52.223.226.180.1935: Flags [.], seq 46474:47788, ack 0, win 501, options [nop,nop,TS val 4108469662 ecr 1635804461], length 1314
08:23:31.264528 IP 52.223.226.180.1935 > 10.8.3.4.34204: Flags [.], ack 35809, win 126, options [nop,nop,TS val 1635804563 ecr 4108469233], length 0
08:23:31.299411 IP 10.8.3.4.34204 > 52.223.226.180.1935: Flags [.], seq 47788:49102, ack 0, win 501, options [nop,nop,TS val 4108469704 ecr 1635804563], length 1314
08:23:31.310879 IP 52.223.226.180.1935 > 10.8.3.4.34204: Flags [.], ack 37276, win 126, options [nop,nop,TS val 1635804610 ecr 4108469300], length 0
08:23:31.310928 IP 10.8.3.4.34204 > 52.223.226.180.1935: Flags [P.], seq 49102:49236, ack 0, win 501, options [nop,nop,TS val 4108469716 ecr 1635804610], length 134
08:23:31.363401 IP 10.8.3.4.34204 > 52.223.226.180.1935: Flags [.], seq 49236:50550, ack 0, win 501, options [nop,nop,TS val 4108469768 ecr 1635804610], length 1314
08:23:31.395930 IP 52.223.226.180.1935 > 10.8.3.4.34204: Flags [.], ack 39904, win 126, options [nop,nop,TS val 1635804695 ecr 4108469364], length 0
08:23:31.397071 IP 10.8.3.4.34204 > 52.223.226.180.1935: Flags [.], seq 50550:51864, ack 0, win 501, options [nop,nop,TS val 4108469802 ecr 1635804695], length 1314
08:23:31.429861 IP 10.8.3.4.34204 > 52.223.226.180.1935: Flags [.], seq 51864:53178, ack 0, win 501, options [nop,nop,TS val 4108469835 ecr 1635804695], length 1314
08:23:31.491273 IP 52.223.226.180.1935 > 10.8.3.4.34204: Flags [.], ack 41218, win 126, options [nop,nop,TS val 1635804790 ecr 4108469434], length 0
08:23:31.492280 IP 10.8.3.4.34204 > 52.223.226.180.1935: Flags [.], seq 53178:54492, ack 0, win 501, options [nop,nop,TS val 4108469897 ecr 1635804790], length 1314
08:23:31.529653 IP 10.8.3.4.34204 > 52.223.226.180.1935: Flags [.], seq 54492:55806, ack 0, win 501, options [nop,nop,TS val 4108469935 ecr 1635804790], length 1314
08:23:31.530344 IP 52.223.226.180.1935 > 10.8.3.4.34204: Flags [.], ack 43846, win 126, options [nop,nop,TS val 1635804829 ecr 4108469500], length 0
08:23:31.564308 IP 10.8.3.4.34204 > 52.223.226.180.1935: Flags [.], seq 55806:57120, ack 0, win 501, options [nop,nop,TS val 4108469969 ecr 1635804829], length 1314
08:23:31.627234 IP 10.8.3.4.34204 > 52.223.226.180.1935: Flags [.], seq 57120:58434, ack 0, win 501, options [nop,nop,TS val 4108470032 ecr 1635804829], length 1314
08:23:31.628773 IP 52.223.226.180.1935 > 10.8.3.4.34204: Flags [.], ack 46474, win 126, options [nop,nop,TS val 1635804928 ecr 4108469568], length 0
08:23:31.662485 IP 10.8.3.4.34204 > 52.223.226.180.1935: Flags [.], seq 58434:59748, ack 0, win 501, options [nop,nop,TS val 4108470067 ecr 1635804928], length 1314
08:23:31.699230 IP 10.8.3.4.34204 > 52.223.226.180.1935: Flags [.], seq 59748:61062, ack 0, win 501, options [nop,nop,TS val 4108470104 ecr 1635804928], length 1314
08:23:31.700689 IP 52.223.226.180.1935 > 10.8.3.4.34204: Flags [.], ack 49102, win 126, options [nop,nop,TS val 1635805000 ecr 4108469662], length 0
08:23:31.711891 IP 52.223.226.180.1935 > 10.8.3.4.34204: Flags [.], ack 49236, win 126, options [nop,nop,TS val 1635805011 ecr 4108469716], length 0
08:23:31.711931 IP 10.8.3.4.34204 > 52.223.226.180.1935: Flags [P.], seq 61062:61216, ack 0, win 501, options [nop,nop,TS val 4108470117 ecr 1635805011], length 154
08:23:31.760737 IP 10.8.3.4.34204 > 52.223.226.180.1935: Flags [.], seq 61216:62530, ack 0, win 501, options [nop,nop,TS val 4108470166 ecr 1635805011], length 1314
08:23:31.790412 IP 10.8.3.4.34204 > 52.223.226.180.1935: Flags [.], seq 62530:63844, ack 0, win 501, options [nop,nop,TS val 4108470195 ecr 1635805011], length 1314
08:23:31.798137 IP 52.223.226.180.1935 > 10.8.3.4.34204: Flags [.], ack 51864, win 126, options [nop,nop,TS val 1635805097 ecr 4108469768], length 0
08:23:31.833175 IP 10.8.3.4.34204 > 52.223.226.180.1935: Flags [.], seq 63844:65158, ack 0, win 501, options [nop,nop,TS val 4108470238 ecr 1635805097], length 1314
08:23:31.893118 IP 52.223.226.180.1935 > 10.8.3.4.34204: Flags [.], ack 54492, win 126, options [nop,nop,TS val 1635805192 ecr 4108469835], length 0
08:23:31.895640 IP 10.8.3.4.34204 > 52.223.226.180.1935: Flags [.], seq 65158:66472, ack 0, win 501, options [nop,nop,TS val 4108470301 ecr 1635805192], length 1314
08:23:31.928836 IP 10.8.3.4.34204 > 52.223.226.180.1935: Flags [.], seq 66472:67786, ack 0, win 501, options [nop,nop,TS val 4108470334 ecr 1635805192], length 1314
08:23:31.962555 IP 10.8.3.4.34204 > 52.223.226.180.1935: Flags [.], seq 67786:69100, ack 0, win 501, options [nop,nop,TS val 4108470368 ecr 1635805192], length 1314
08:23:31.965515 IP 52.223.226.180.1935 > 10.8.3.4.34204: Flags [.], ack 57120, win 126, options [nop,nop,TS val 1635805264 ecr 4108469935], length 0
08:23:32.025428 IP 10.8.3.4.34204 > 52.223.226.180.1935: Flags [.], seq 69100:70414, ack 0, win 501, options [nop,nop,TS val 4108470430 ecr 1635805264], length 1314
08:23:32.063774 IP 52.223.226.180.1935 > 10.8.3.4.34204: Flags [.], ack 59748, win 126, options [nop,nop,TS val 1635805363 ecr 4108470032], length 0
08:23:32.064964 IP 10.8.3.4.34204 > 52.223.226.180.1935: Flags [.], seq 70414:71728, ack 0, win 501, options [nop,nop,TS val 4108470470 ecr 1635805363], length 1314
08:23:32.098364 IP 10.8.3.4.34204 > 52.223.226.180.1935: Flags [.], seq 71728:73042, ack 0, win 501, options [nop,nop,TS val 4108470503 ecr 1635805363], length 1314
08:23:32.112853 IP 52.223.226.180.1935 > 10.8.3.4.34204: Flags [.], ack 61216, win 126, options [nop,nop,TS val 1635805412 ecr 4108470104], length 0
08:23:32.112865 IP 10.8.3.4.34204 > 52.223.226.180.1935: Flags [P.], seq 73042:73179, ack 0, win 501, options [nop,nop,TS val 4108470518 ecr 1635805412], length 137
08:23:32.163051 IP 10.8.3.4.34204 > 52.223.226.180.1935: Flags [.], seq 73179:74493, ack 0, win 501, options [nop,nop,TS val 4108470568 ecr 1635805412], length 1314
08:23:32.191337 IP 52.223.226.180.1935 > 10.8.3.4.34204: Flags [.], ack 63844, win 126, options [nop,nop,TS val 1635805490 ecr 4108470166], length 0
08:23:32.196366 IP 10.8.3.4.34204 > 52.223.226.180.1935: Flags [.], seq 74493:75807, ack 0, win 501, options [nop,nop,TS val 4108470601 ecr 1635805490], length 1314
08:23:32.239234 IP 10.8.3.4.34204 > 52.223.226.180.1935: Flags [.], seq 75807:77121, ack 0, win 501, options [nop,nop,TS val 4108470644 ecr 1635805490], length 1314
08:23:32.294587 IP 10.8.3.4.34204 > 52.223.226.180.1935: Flags [.], seq 77121:78435, ack 0, win 501, options [nop,nop,TS val 4108470700 ecr 1635805490], length 1314
08:23:32.296822 IP 52.223.226.180.1935 > 10.8.3.4.34204: Flags [.], ack 66472, win 126, options [nop,nop,TS val 1635805596 ecr 4108470238], length 0
08:23:32.324301 IP 10.8.3.4.34204 > 52.223.226.180.1935: Flags [.], seq 78435:79749, ack 0, win 501, options [nop,nop,TS val 4108470729 ecr 1635805596], length 1314
08:23:32.363747 IP 52.223.226.180.1935 > 10.8.3.4.34204: Flags [.], ack 69100, win 126, options [nop,nop,TS val 1635805663 ecr 4108470334], length 0
08:23:32.367048 IP 10.8.3.4.34204 > 52.223.226.180.1935: Flags [.], seq 79749:81063, ack 0, win 501, options [nop,nop,TS val 4108470772 ecr 1635805663], length 1314
08:23:32.431333 IP 10.8.3.4.34204 > 52.223.226.180.1935: Flags [.], seq 81063:82377, ack 0, win 501, options [nop,nop,TS val 4108470836 ecr 1635805663], length 1314
08:23:32.462306 IP 10.8.3.4.34204 > 52.223.226.180.1935: Flags [.], seq 82377:83691, ack 0, win 501, options [nop,nop,TS val 4108470867 ecr 1635805663], length 1314
08:23:32.466067 IP 52.223.226.180.1935 > 10.8.3.4.34204: Flags [.], ack 71728, win 126, options [nop,nop,TS val 1635805765 ecr 4108470430], length 0
08:23:32.498340 IP 10.8.3.4.34204 > 52.223.226.180.1935: Flags [.], seq 83691:85005, ack 0, win 501, options [nop,nop,TS val 4108470903 ecr 1635805765], length 1314
08:23:32.513710 IP 52.223.226.180.1935 > 10.8.3.4.34204: Flags [.], ack 73179, win 126, options [nop,nop,TS val 1635805813 ecr 4108470503], length 0
08:23:32.513748 IP 10.8.3.4.34204 > 52.223.226.180.1935: Flags [P.], seq 85005:85063, ack 0, win 501, options [nop,nop,TS val 4108470919 ecr 1635805813], length 58
08:23:32.559847 IP 10.8.3.4.34204 > 52.223.226.180.1935: Flags [.], seq 85063:86377, ack 0, win 501, options [nop,nop,TS val 4108470965 ecr 1635805813], length 1314
08:23:32.595237 IP 10.8.3.4.34204 > 52.223.226.180.1935: Flags [.], seq 86377:87691, ack 0, win 501, options [nop,nop,TS val 4108471000 ecr 1635805813], length 1314
08:23:32.597295 IP 52.223.226.180.1935 > 10.8.3.4.34204: Flags [.], ack 75807, win 126, options [nop,nop,TS val 1635805896 ecr 4108470568], length 0
08:23:32.629587 IP 10.8.3.4.34204 > 52.223.226.180.1935: Flags [.], seq 87691:89005, ack 0, win 501, options [nop,nop,TS val 4108471035 ecr 1635805896], length 1314
08:23:32.695719 IP 52.223.226.180.1935 > 10.8.3.4.34204: Flags [.], ack 78435, win 126, options [nop,nop,TS val 1635805995 ecr 4108470644], length 0
08:23:32.696499 IP 10.8.3.4.34204 > 52.223.226.180.1935: Flags [.], seq 89005:90319, ack 0, win 501, options [nop,nop,TS val 4108471101 ecr 1635805995], length 1314
08:23:32.729885 IP 10.8.3.4.34204 > 52.223.226.180.1935: Flags [.], seq 90319:91633, ack 0, win 501, options [nop,nop,TS val 4108471135 ecr 1635805995], length 1314
08:23:32.762502 IP 10.8.3.4.34204 > 52.223.226.180.1935: Flags [.], seq 91633:92947, ack 0, win 501, options [nop,nop,TS val 4108471167 ecr 1635805995], length 1314
08:23:32.768083 IP 52.223.226.180.1935 > 10.8.3.4.34204: Flags [.], ack 81063, win 126, options [nop,nop,TS val 1635806067 ecr 4108470729], length 0
08:23:32.828882 IP 10.8.3.4.34204 > 52.223.226.180.1935: Flags [.], seq 92947:94261, ack 0, win 501, options [nop,nop,TS val 4108471234 ecr 1635806067], length 1314
08:23:32.858495 IP 10.8.3.4.34204 > 52.223.226.180.1935: Flags [.], seq 94261:95575, ack 0, win 501, options [nop,nop,TS val 4108471263 ecr 1635806067], length 1314
08:23:32.863349 IP 52.223.226.180.1935 > 10.8.3.4.34204: Flags [.], ack 83691, win 126, options [nop,nop,TS val 1635806162 ecr 4108470836], length 0
08:23:32.897098 IP 10.8.3.4.34204 > 52.223.226.180.1935: Flags [.], seq 95575:96889, ack 0, win 501, options [nop,nop,TS val 4108471302 ecr 1635806162], length 1314
08:23:32.914702 IP 52.223.226.180.1935 > 10.8.3.4.34204: Flags [.], ack 85063, win 126, options [nop,nop,TS val 1635806214 ecr 4108470903], length 0
08:23:32.914715 IP 10.8.3.4.34204 > 52.223.226.180.1935: Flags [P.], seq 96889:97023, ack 0, win 501, options [nop,nop,TS val 4108471320 ecr 1635806214], length 134
08:23:32.962116 IP 10.8.3.4.34204 > 52.223.226.180.1935: Flags [.], seq 97023:98337, ack 0, win 501, options [nop,nop,TS val 4108471367 ecr 1635806214], length 1314
08:23:32.996180 IP 52.223.226.180.1935 > 10.8.3.4.34204: Flags [.], ack 87691, win 126, options [nop,nop,TS val 1635806295 ecr 4108470965], length 0
08:23:32.997792 IP 10.8.3.4.34204 > 52.223.226.180.1935: Flags [.], seq 98337:99651, ack 0, win 501, options [nop,nop,TS val 4108471403 ecr 1635806295], length 1314
08:23:33.031630 IP 10.8.3.4.34204 > 52.223.226.180.1935: Flags [.], seq 99651:100965, ack 0, win 501, options [nop,nop,TS val 4108471437 ecr 1635806295], length 1314
08:23:33.093014 IP 10.8.3.4.34204 > 52.223.226.180.1935: Flags [.], seq 100965:102279, ack 0, win 501, options [nop,nop,TS val 4108471498 ecr 1635806295], length 1314
08:23:33.097952 IP 52.223.226.180.1935 > 10.8.3.4.34204: Flags [.], ack 90319, win 126, options [nop,nop,TS val 1635806397 ecr 4108471035], length 0
08:23:33.129011 IP 10.8.3.4.34204 > 52.223.226.180.1935: Flags [.], seq 102279:103593, ack 0, win 501, options [nop,nop,TS val 4108471534 ecr 1635806397], length 1314
08:23:33.163592 IP 52.223.226.180.1935 > 10.8.3.4.34204: Flags [.], ack 92947, win 126, options [nop,nop,TS val 1635806462 ecr 4108471135], length 0
08:23:33.164881 IP 10.8.3.4.34204 > 52.223.226.180.1935: Flags [.], seq 103593:104907, ack 0, win 501, options [nop,nop,TS val 4108471570 ecr 1635806462], length 1314
08:23:33.228585 IP 10.8.3.4.34204 > 52.223.226.180.1935: Flags [.], seq 104907:106221, ack 0, win 501, options [nop,nop,TS val 4108471634 ecr 1635806462], length 1314
08:23:33.259645 IP 52.223.226.180.1935 > 10.8.3.4.34204: Flags [.], ack 95575, win 126, options [nop,nop,TS val 1635806558 ecr 4108471234], length 0
08:23:33.263496 IP 10.8.3.4.34204 > 52.223.226.180.1935: Flags [.], seq 106221:107535, ack 0, win 501, options [nop,nop,TS val 4108471668 ecr 1635806558], length 1314
08:23:33.298324 IP 10.8.3.4.34204 > 52.223.226.180.1935: Flags [.], seq 107535:108849, ack 0, win 501, options [nop,nop,TS val 4108471703 ecr 1635806558], length 1314
08:23:33.315570 IP 52.223.226.180.1935 > 10.8.3.4.34204: Flags [.], ack 97023, win 126, options [nop,nop,TS val 1635806614 ecr 4108471302], length 0
08:23:33.315619 IP 10.8.3.4.34204 > 52.223.226.180.1935: Flags [P.], seq 108849:109002, ack 0, win 501, options [nop,nop,TS val 4108471721 ecr 1635806614], length 153
08:23:33.360891 IP 10.8.3.4.34204 > 52.223.226.180.1935: Flags [.], seq 109002:110316, ack 0, win 501, options [nop,nop,TS val 4108471766 ecr 1635806614], length 1314
08:23:33.391615 IP 10.8.3.4.34204 > 52.223.226.180.1935: Flags [.], seq 110316:111630, ack 0, win 501, options [nop,nop,TS val 4108471797 ecr 1635806614], length 1314
08:23:33.398952 IP 52.223.226.180.1935 > 10.8.3.4.34204: Flags [.], ack 99651, win 126, options [nop,nop,TS val 1635806698 ecr 4108471367], length 0
08:23:33.434507 IP 10.8.3.4.34204 > 52.223.226.180.1935: Flags [.], seq 111630:112944, ack 0, win 501, options [nop,nop,TS val 4108471839 ecr 1635806698], length 1314
08:23:33.494018 IP 52.223.226.180.1935 > 10.8.3.4.34204: Flags [.], ack 102279, win 126, options [nop,nop,TS val 1635806793 ecr 4108471437], length 0
08:23:33.498447 IP 10.8.3.4.34204 > 52.223.226.180.1935: Flags [.], seq 112944:114258, ack 0, win 501, options [nop,nop,TS val 4108471903 ecr 1635806793], length 1314
08:23:33.531831 IP 10.8.3.4.34204 > 52.223.226.180.1935: Flags [.], seq 114258:115572, ack 0, win 501, options [nop,nop,TS val 4108471937 ecr 1635806793], length 1314
08:23:33.563229 IP 10.8.3.4.34204 > 52.223.226.180.1935: Flags [.], seq 115572:116886, ack 0, win 501, options [nop,nop,TS val 4108471968 ecr 1635806793], length 1314
08:23:33.566064 IP 52.223.226.180.1935 > 10.8.3.4.34204: Flags [.], ack 104907, win 126, options [nop,nop,TS val 1635806865 ecr 4108471534], length 0
08:23:33.626968 IP 10.8.3.4.34204 > 52.223.226.180.1935: Flags [.], seq 116886:118200, ack 0, win 501, options [nop,nop,TS val 4108472032 ecr 1635806865], length 1314
08:23:33.662294 IP 10.8.3.4.34204 > 52.223.226.180.1935: Flags [.], seq 118200:119514, ack 0, win 501, options [nop,nop,TS val 4108472067 ecr 1635806865], length 1314
08:23:33.664497 IP 52.223.226.180.1935 > 10.8.3.4.34204: Flags [.], ack 107535, win 126, options [nop,nop,TS val 1635806963 ecr 4108471634], length 0
08:23:33.698372 IP 10.8.3.4.34204 > 52.223.226.180.1935: Flags [.], seq 119514:120828, ack 0, win 501, options [nop,nop,TS val 4108472103 ecr 1635806963], length 1314
08:23:33.716548 IP 52.223.226.180.1935 > 10.8.3.4.34204: Flags [.], ack 109002, win 126, options [nop,nop,TS val 1635807015 ecr 4108471703], length 0
08:23:33.716560 IP 10.8.3.4.34204 > 52.223.226.180.1935: Flags [P.], seq 120828:120966, ack 0, win 501, options [nop,nop,TS val 4108472122 ecr 1635807015], length 138
08:23:33.762817 IP 10.8.3.4.34204 > 52.223.226.180.1935: Flags [.], seq 120966:122280, ack 0, win 501, options [nop,nop,TS val 4108472168 ecr 1635807015], length 1314
08:23:33.792627 IP 52.223.226.180.1935 > 10.8.3.4.34204: Flags [.], ack 111630, win 126, options [nop,nop,TS val 1635807091 ecr 4108471766], length 0
08:23:33.797424 IP 10.8.3.4.34204 > 52.223.226.180.1935: Flags [.], seq 122280:123594, ack 0, win 501, options [nop,nop,TS val 4108472202 ecr 1635807091], length 1314
08:23:33.840278 IP 10.8.3.4.34204 > 52.223.226.180.1935: Flags [.], seq 123594:124908, ack 0, win 501, options [nop,nop,TS val 4108472245 ecr 1635807091], length 1314
08:23:33.895648 IP 10.8.3.4.34204 > 52.223.226.180.1935: Flags [.], seq 124908:126222, ack 0, win 501, options [nop,nop,TS val 4108472301 ecr 1635807091], length 1314
08:23:33.899531 IP 52.223.226.180.1935 > 10.8.3.4.34204: Flags [.], ack 114258, win 126, options [nop,nop,TS val 1635807198 ecr 4108471839], length 0
08:23:33.925736 IP 10.8.3.4.34204 > 52.223.226.180.1935: Flags [.], seq 126222:127536, ack 0, win 501, options [nop,nop,TS val 4108472331 ecr 1635807198], length 1314
08:23:33.964405 IP 52.223.226.180.1935 > 10.8.3.4.34204: Flags [.], ack 116886, win 126, options [nop,nop,TS val 1635807263 ecr 4108471937], length 0
08:23:33.968507 IP 10.8.3.4.34204 > 52.223.226.180.1935: Flags [.], seq 127536:128850, ack 0, win 501, options [nop,nop,TS val 4108472373 ecr 1635807263], length 1314
08:23:34.028953 IP 10.8.3.4.34204 > 52.223.226.180.1935: Flags [.], seq 128850:130164, ack 0, win 501, options [nop,nop,TS val 4108472434 ecr 1635807263], length 1314
08:23:34.063372 IP 52.223.226.180.1935 > 10.8.3.4.34204: Flags [.], ack 119514, win 126, options [nop,nop,TS val 1635807362 ecr 4108472032], length 0
08:23:34.064637 IP 10.8.3.4.34204 > 52.223.226.180.1935: Flags [.], seq 130164:131478, ack 0, win 501, options [nop,nop,TS val 4108472470 ecr 1635807362], length 1314
08:23:34.098065 IP 10.8.3.4.34204 > 52.223.226.180.1935: Flags [.], seq 131478:132792, ack 0, win 501, options [nop,nop,TS val 4108472503 ecr 1635807362], length 1314
08:23:34.117402 IP 52.223.226.180.1935 > 10.8.3.4.34204: Flags [.], ack 120966, win 126, options [nop,nop,TS val 1635807416 ecr 4108472103], length 0
08:23:34.117438 IP 10.8.3.4.34204 > 52.223.226.180.1935: Flags [P.], seq 132792:132850, ack 0, win 501, options [nop,nop,TS val 4108472522 ecr 1635807416], length 58
08:23:34.161445 IP 10.8.3.4.34204 > 52.223.226.180.1935: Flags [.], seq 132850:134164, ack 0, win 501, options [nop,nop,TS val 4108472566 ecr 1635807416], length 1314
08:23:34.198416 IP 52.223.226.180.1935 > 10.8.3.4.34204: Flags [.], ack 123594, win 126, options [nop,nop,TS val 1635807497 ecr 4108472168], length 0
08:23:34.198417 IP 10.8.3.4.34204 > 52.223.226.180.1935: Flags [.], seq 134164:135478, ack 0, win 501, options [nop,nop,TS val 4108472603 ecr 1635807416], length 1314
08:23:34.229111 IP 10.8.3.4.34204 > 52.223.226.180.1935: Flags [.], seq 135478:136792, ack 0, win 501, options [nop,nop,TS val 4108472634 ecr 1635807497], length 1314
08:23:34.294279 IP 10.8.3.4.34204 > 52.223.226.180.1935: Flags [.], seq 136792:138106, ack 0, win 501, options [nop,nop,TS val 4108472699 ecr 1635807497], length 1314
08:23:34.296691 IP 52.223.226.180.1935 > 10.8.3.4.34204: Flags [.], ack 126222, win 126, options [nop,nop,TS val 1635807596 ecr 4108472245], length 0
08:23:34.329041 IP 10.8.3.4.34204 > 52.223.226.180.1935: Flags [.], seq 138106:139420, ack 0, win 501, options [nop,nop,TS val 4108472734 ecr 1635807596], length 1314
08:23:34.364769 IP 10.8.3.4.34204 > 52.223.226.180.1935: Flags [.], seq 139420:140734, ack 0, win 501, options [nop,nop,TS val 4108472770 ecr 1635807596], length 1314
08:23:34.369835 IP 52.223.226.180.1935 > 10.8.3.4.34204: Flags [.], ack 128850, win 126, options [nop,nop,TS val 1635807669 ecr 4108472331], length 0
08:23:34.428822 IP 10.8.3.4.34204 > 52.223.226.180.1935: Flags [.], seq 140734:142048, ack 0, win 501, options [nop,nop,TS val 4108472834 ecr 1635807669], length 1314
08:23:34.459559 IP 10.8.3.4.34204 > 52.223.226.180.1935: Flags [.], seq 142048:143362, ack 0, win 501, options [nop,nop,TS val 4108472864 ecr 1635807669], length 1314
08:23:34.466634 IP 52.223.226.180.1935 > 10.8.3.4.34204: Flags [.], ack 131478, win 126, options [nop,nop,TS val 1635807765 ecr 4108472434], length 0
08:23:34.498227 IP 10.8.3.4.34204 > 52.223.226.180.1935: Flags [.], seq 143362:144676, ack 0, win 501, options [nop,nop,TS val 4108472903 ecr 1635807765], length 1314
08:23:34.518550 IP 52.223.226.180.1935 > 10.8.3.4.34204: Flags [.], ack 132850, win 126, options [nop,nop,TS val 1635807817 ecr 4108472503], length 0
08:23:34.518580 IP 10.8.3.4.34204 > 52.223.226.180.1935: Flags [P.], seq 144676:144810, ack 0, win 501, options [nop,nop,TS val 4108472924 ecr 1635807817], length 134
08:23:34.562544 IP 10.8.3.4.34204 > 52.223.226.180.1935: Flags [.], seq 144810:146124, ack 0, win 501, options [nop,nop,TS val 4108472967 ecr 1635807817], length 1314
08:23:34.595769 IP 10.8.3.4.34204 > 52.223.226.180.1935: Flags [.], seq 146124:147438, ack 0, win 501, options [nop,nop,TS val 4108473001 ecr 1635807817], length 1314
08:23:34.599331 IP 52.223.226.180.1935 > 10.8.3.4.34204: Flags [.], ack 135478, win 126, options [nop,nop,TS val 1635807898 ecr 4108472566], length 0
08:23:34.631967 IP 10.8.3.4.34204 > 52.223.226.180.1935: Flags [.], seq 147438:148752, ack 0, win 501, options [nop,nop,TS val 4108473037 ecr 1635807898], length 1314
08:23:34.694991 IP 10.8.3.4.34204 > 52.223.226.180.1935: Flags [.], seq 148752:150066, ack 0, win 501, options [nop,nop,TS val 4108473100 ecr 1635807898], length 1314
08:23:34.695175 IP 52.223.226.180.1935 > 10.8.3.4.34204: Flags [.], ack 138106, win 126, options [nop,nop,TS val 1635807994 ecr 4108472634], length 0
08:23:34.730575 IP 10.8.3.4.34204 > 52.223.226.180.1935: Flags [.], seq 150066:151380, ack 0, win 501, options [nop,nop,TS val 4108473136 ecr 1635807994], length 1314
08:23:34.762386 IP 10.8.3.4.34204 > 52.223.226.180.1935: Flags [.], seq 151380:152694, ack 0, win 501, options [nop,nop,TS val 4108473167 ecr 1635807994], length 1314
08:23:34.765674 IP 52.223.226.180.1935 > 10.8.3.4.34204: Flags [.], ack 140734, win 126, options [nop,nop,TS val 1635808065 ecr 4108472734], length 0
08:23:34.827462 IP 10.8.3.4.34204 > 52.223.226.180.1935: Flags [.], seq 152694:154008, ack 0, win 501, options [nop,nop,TS val 4108473232 ecr 1635808065], length 1314
08:23:34.860546 IP 52.223.226.180.1935 > 10.8.3.4.34204: Flags [.], ack 143362, win 126, options [nop,nop,TS val 1635808159 ecr 4108472834], length 0
08:23:34.862768 IP 10.8.3.4.34204 > 52.223.226.180.1935: Flags [.], seq 154008:155322, ack 0, win 501, options [nop,nop,TS val 4108473268 ecr 1635808159], length 1314
08:23:34.897871 IP 10.8.3.4.34204 > 52.223.226.180.1935: Flags [.], seq 155322:156636, ack 0, win 501, options [nop,nop,TS val 4108473303 ecr 1635808159], length 1314
08:23:34.919384 IP 52.223.226.180.1935 > 10.8.3.4.34204: Flags [.], ack 144810, win 126, options [nop,nop,TS val 1635808218 ecr 4108472903], length 0
08:23:34.919423 IP 10.8.3.4.34204 > 52.223.226.180.1935: Flags [P.], seq 156636:156789, ack 0, win 501, options [nop,nop,TS val 4108473324 ecr 1635808218], length 153
08:23:34.961828 IP 10.8.3.4.34204 > 52.223.226.180.1935: Flags [.], seq 156789:158103, ack 0, win 501, options [nop,nop,TS val 4108473367 ecr 1635808218], length 1314
08:23:34.993481 IP 10.8.3.4.34204 > 52.223.226.180.1935: Flags [.], seq 158103:159417, ack 0, win 501, options [nop,nop,TS val 4108473398 ecr 1635808218], length 1314
08:23:34.997174 IP 52.223.226.180.1935 > 10.8.3.4.34204: Flags [.], ack 147438, win 126, options [nop,nop,TS val 1635808296 ecr 4108472967], length 0
08:23:35.036194 IP 10.8.3.4.34204 > 52.223.226.180.1935: Flags [.], seq 159417:160731, ack 0, win 501, options [nop,nop,TS val 4108473441 ecr 1635808296], length 1314
08:23:35.095714 IP 10.8.3.4.34204 > 52.223.226.180.1935: Flags [.], seq 160731:162045, ack 0, win 501, options [nop,nop,TS val 4108473501 ecr 1635808296], length 1314
08:23:35.095962 IP 52.223.226.180.1935 > 10.8.3.4.34204: Flags [.], ack 150066, win 126, options [nop,nop,TS val 1635808395 ecr 4108473037], length 0
08:23:35.128610 IP 10.8.3.4.34204 > 52.223.226.180.1935: Flags [.], seq 162045:163359, ack 0, win 501, options [nop,nop,TS val 4108473534 ecr 1635808395], length 1314
08:23:35.163578 IP 52.223.226.180.1935 > 10.8.3.4.34204: Flags [.], ack 152694, win 126, options [nop,nop,TS val 1635808462 ecr 4108473136], length 0
08:23:35.164114 IP 10.8.3.4.34204 > 52.223.226.180.1935: Flags [.], seq 163359:164673, ack 0, win 501, options [nop,nop,TS val 4108473569 ecr 1635808462], length 1314
08:23:35.228002 IP 10.8.3.4.34204 > 52.223.226.180.1935: Flags [.], seq 164673:165987, ack 0, win 501, options [nop,nop,TS val 4108473633 ecr 1635808462], length 1314
08:23:35.263811 IP 52.223.226.180.1935 > 10.8.3.4.34204: Flags [.], ack 155322, win 126, options [nop,nop,TS val 1635808563 ecr 4108473232], length 0
08:23:35.264833 IP 10.8.3.4.34204 > 52.223.226.180.1935: Flags [.], seq 165987:167301, ack 0, win 501, options [nop,nop,TS val 4108473670 ecr 1635808563], length 1314
08:23:35.298438 IP 10.8.3.4.34204 > 52.223.226.180.1935: Flags [.], seq 167301:168615, ack 0, win 501, options [nop,nop,TS val 4108473703 ecr 1635808563], length 1314
08:23:35.320621 IP 52.223.226.180.1935 > 10.8.3.4.34204: Flags [.], ack 156789, win 126, options [nop,nop,TS val 1635808619 ecr 4108473303], length 0
08:23:35.320633 IP 10.8.3.4.34204 > 52.223.226.180.1935: Flags [P.], seq 168615:168752, ack 0, win 501, options [nop,nop,TS val 4108473726 ecr 1635808619], length 137
08:23:35.360747 IP 10.8.3.4.34204 > 52.223.226.180.1935: Flags [.], seq 168752:170066, ack 0, win 501, options [nop,nop,TS val 4108473766 ecr 1635808619], length 1314
08:23:35.394678 IP 52.223.226.180.1935 > 10.8.3.4.34204: Flags [.], ack 159417, win 126, options [nop,nop,TS val 1635808693 ecr 4108473367], length 0
08:23:35.395387 IP 10.8.3.4.34204 > 52.223.226.180.1935: Flags [.], seq 170066:171380, ack 0, win 501, options [nop,nop,TS val 4108473800 ecr 1635808693], length 1314
08:23:35.440528 IP 10.8.3.4.34204 > 52.223.226.180.1935: Flags [.], seq 171380:172694, ack 0, win 501, options [nop,nop,TS val 4108473845 ecr 1635808693], length 1314
08:23:35.494440 IP 10.8.3.4.34204 > 52.223.226.180.1935: Flags [.], seq 172694:174008, ack 0, win 501, options [nop,nop,TS val 4108473899 ecr 1635808693], length 1314
08:23:35.496734 IP 52.223.226.180.1935 > 10.8.3.4.34204: Flags [.], ack 162045, win 126, options [nop,nop,TS val 1635808796 ecr 4108473441], length 0
08:23:35.525411 IP 10.8.3.4.34204 > 52.223.226.180.1935: Flags [.], seq 174008:175322, ack 0, win 501, options [nop,nop,TS val 4108473930 ecr 1635808796], length 1314
08:23:35.565059 IP 52.223.226.180.1935 > 10.8.3.4.34204: Flags [.], ack 164673, win 126, options [nop,nop,TS val 1635808864 ecr 4108473534], length 0
08:23:35.568134 IP 10.8.3.4.34204 > 52.223.226.180.1935: Flags [.], seq 175322:176636, ack 0, win 501, options [nop,nop,TS val 4108473973 ecr 1635808864], length 1314
08:23:35.629347 IP 10.8.3.4.34204 > 52.223.226.180.1935: Flags [.], seq 176636:177950, ack 0, win 501, options [nop,nop,TS val 4108474034 ecr 1635808864], length 1314
08:23:35.662751 IP 10.8.3.4.34204 > 52.223.226.180.1935: Flags [.], seq 177950:179264, ack 0, win 501, options [nop,nop,TS val 4108474068 ecr 1635808864], length 1314
08:23:35.665778 IP 52.223.226.180.1935 > 10.8.3.4.34204: Flags [.], ack 167301, win 126, options [nop,nop,TS val 1635808965 ecr 4108473633], length 0
08:23:35.695717 IP 10.8.3.4.34204 > 52.223.226.180.1935: Flags [.], seq 179264:180578, ack 0, win 501, options [nop,nop,TS val 4108474101 ecr 1635808965], length 1314
08:23:35.721827 IP 52.223.226.180.1935 > 10.8.3.4.34204: Flags [.], ack 168752, win 126, options [nop,nop,TS val 1635809020 ecr 4108473703], length 0
08:23:35.721839 IP 10.8.3.4.34204 > 52.223.226.180.1935: Flags [P.], seq 180578:180733, ack 0, win 501, options [nop,nop,TS val 4108474127 ecr 1635809020], length 155
08:23:35.759479 IP 10.8.3.4.34204 > 52.223.226.180.1935: Flags [.], seq 180733:182047, ack 0, win 501, options [nop,nop,TS val 4108474164 ecr 1635809020], length 1314
08:23:35.794390 IP 10.8.3.4.34204 > 52.223.226.180.1935: Flags [.], seq 182047:183361, ack 0, win 501, options [nop,nop,TS val 4108474199 ecr 1635809020], length 1314
08:23:35.797364 IP 52.223.226.180.1935 > 10.8.3.4.34204: Flags [.], ack 171380, win 126, options [nop,nop,TS val 1635809095 ecr 4108473766], length 0
08:23:35.844789 IP 10.8.3.4.34204 > 52.223.226.180.1935: Flags [.], seq 183361:184675, ack 0, win 501, options [nop,nop,TS val 4108474250 ecr 1635809095], length 1314
08:23:35.895787 IP 52.223.226.180.1935 > 10.8.3.4.34204: Flags [.], ack 174008, win 126, options [nop,nop,TS val 1635809195 ecr 4108473845], length 0
08:23:35.898467 IP 10.8.3.4.34204 > 52.223.226.180.1935: Flags [.], seq 184675:185989, ack 0, win 501, options [nop,nop,TS val 4108474303 ecr 1635809195], length 1314
08:23:35.930726 IP 10.8.3.4.34204 > 52.223.226.180.1935: Flags [.], seq 185989:187303, ack 0, win 501, options [nop,nop,TS val 4108474336 ecr 1635809195], length 1314
08:23:35.969239 IP 52.223.226.180.1935 > 10.8.3.4.34204: Flags [.], ack 176636, win 126, options [nop,nop,TS val 1635809268 ecr 4108473930], length 0
08:23:35.973628 IP 10.8.3.4.34204 > 52.223.226.180.1935: Flags [.], seq 187303:188617, ack 0, win 501, options [nop,nop,TS val 4108474379 ecr 1635809268], length 1314
08:23:36.029207 IP 10.8.3.4.34204 > 52.223.226.180.1935: Flags [.], seq 188617:189931, ack 0, win 501, options [nop,nop,TS val 4108474434 ecr 1635809268], length 1314
08:23:36.059332 IP 10.8.3.4.34204 > 52.223.226.180.1935: Flags [.], seq 189931:191245, ack 0, win 501, options [nop,nop,TS val 4108474464 ecr 1635809268], length 1314
08:23:36.064221 IP 52.223.226.180.1935 > 10.8.3.4.34204: Flags [.], ack 179264, win 126, options [nop,nop,TS val 1635809363 ecr 4108474034], length 0
08:23:36.102158 IP 10.8.3.4.34204 > 52.223.226.180.1935: Flags [.], seq 191245:192559, ack 0, win 501, options [nop,nop,TS val 4108474507 ecr 1635809363], length 1314
08:23:36.122831 IP 52.223.226.180.1935 > 10.8.3.4.34204: Flags [.], ack 180733, win 126, options [nop,nop,TS val 1635809422 ecr 4108474101], length 0
08:23:36.122864 IP 10.8.3.4.34204 > 52.223.226.180.1935: Flags [P.], seq 192559:192597, ack 0, win 501, options [nop,nop,TS val 4108474528 ecr 1635809422], length 38
08:23:36.162791 IP 10.8.3.4.34204 > 52.223.226.180.1935: Flags [.], seq 192597:193911, ack 0, win 501, options [nop,nop,TS val 4108474568 ecr 1635809422], length 1314
08:23:36.195497 IP 10.8.3.4.34204 > 52.223.226.180.1935: Flags [.], seq 193911:195225, ack 0, win 501, options [nop,nop,TS val 4108474600 ecr 1635809422], length 1314
08:23:36.196169 IP 52.223.226.180.1935 > 10.8.3.4.34204: Flags [.], ack 183361, win 126, options [nop,nop,TS val 1635809494 ecr 4108474164], length 0
08:23:36.230022 IP 10.8.3.4.34204 > 52.223.226.180.1935: Flags [.], seq 195225:196539, ack 0, win 501, options [nop,nop,TS val 4108474635 ecr 1635809494], length 1314
08:23:36.293989 IP 10.8.3.4.34204 > 52.223.226.180.1935: Flags [.], seq 196539:197853, ack 0, win 501, options [nop,nop,TS val 4108474699 ecr 1635809494], length 1314
08:23:36.299581 IP 52.223.226.180.1935 > 10.8.3.4.34204: Flags [.], ack 185989, win 126, options [nop,nop,TS val 1635809598 ecr 4108474250], length 0
08:23:36.329580 IP 10.8.3.4.34204 > 52.223.226.180.1935: Flags [.], seq 197853:199167, ack 0, win 501, options [nop,nop,TS val 4108474735 ecr 1635809598], length 1314
08:23:36.364954 IP 10.8.3.4.34204 > 52.223.226.180.1935: Flags [.], seq 199167:200481, ack 0, win 501, options [nop,nop,TS val 4108474770 ecr 1635809598], length 1314
08:23:36.374669 IP 52.223.226.180.1935 > 10.8.3.4.34204: Flags [.], ack 188617, win 126, options [nop,nop,TS val 1635809674 ecr 4108474336], length 0
08:23:36.431886 IP 10.8.3.4.34204 > 52.223.226.180.1935: Flags [.], seq 200481:201795, ack 0, win 501, options [nop,nop,TS val 4108474837 ecr 1635809674], length 1314
08:23:36.460499 IP 52.223.226.180.1935 > 10.8.3.4.34204: Flags [.], ack 191245, win 126, options [nop,nop,TS val 1635809759 ecr 4108474434], length 0
08:23:36.465007 IP 10.8.3.4.34204 > 52.223.226.180.1935: Flags [.], seq 201795:203109, ack 0, win 501, options [nop,nop,TS val 4108474870 ecr 1635809759], length 1314
08:23:36.498441 IP 10.8.3.4.34204 > 52.223.226.180.1935: Flags [.], seq 203109:204423, ack 0, win 501, options [nop,nop,TS val 4108474903 ecr 1635809759], length 1314
08:23:36.524113 IP 52.223.226.180.1935 > 10.8.3.4.34204: Flags [.], ack 192597, win 126, options [nop,nop,TS val 1635809823 ecr 4108474507], length 0
08:23:36.524148 IP 10.8.3.4.34204 > 52.223.226.180.1935: Flags [P.], seq 204423:204576, ack 0, win 501, options [nop,nop,TS val 4108474929 ecr 1635809823], length 153
08:23:36.562490 IP 10.8.3.4.34204 > 52.223.226.180.1935: Flags [.], seq 204576:205890, ack 0, win 501, options [nop,nop,TS val 4108474967 ecr 1635809823], length 1314
08:23:36.594208 IP 10.8.3.4.34204 > 52.223.226.180.1935: Flags [.], seq 205890:207204, ack 0, win 501, options [nop,nop,TS val 4108474999 ecr 1635809823], length 1314
08:23:36.596336 IP 52.223.226.180.1935 > 10.8.3.4.34204: Flags [.], ack 195225, win 126, options [nop,nop,TS val 1635809895 ecr 4108474568], length 0
