21:22:49.330829 IP 52.223.226.58.1935 > 10.8.1.8.51028: Flags [.], ack 171908618, win 126, options [nop,nop,TS val 1984521719 ecr 3246724944], length 0
21:22:49.330846 IP 10.8.1.8.51028 > 52.223.226.58.1935: Flags [P.], seq 11827:12912, ack 0, win 501, options [nop,nop,TS val 3246725413 ecr 1984521719], length 1085
21:22:49.395837 IP 10.8.1.8.51028 > 52.223.226.58.1935: Flags [.], seq 12912:14226, ack 0, win 501, options [nop,nop,TS val 3246725477 ecr 1984521719], length 1314
21:22:49.425537 IP 52.223.226.58.1935 > 10.8.1.8.51028: Flags [.], ack 2629, win 126, options [nop,nop,TS val 1984521814 ecr 3246725043], length 0
21:22:49.431826 IP 10.8.1.8.51028 > 52.223.226.58.1935: Flags [.], seq 14226:15540, ack 0, win 501, options [nop,nop,TS val 3246725514 ecr 1984521814], length 1314
21:22:49.465005 IP 10.8.1.8.51028 > 52.223.226.58.1935: Flags [.], seq 15540:16854, ack 0, win 501, options [nop,nop,TS val 3246725547 ecr 1984521814], length 1314
21:22:49.526495 IP 52.223.226.58.1935 > 10.8.1.8.51028: Flags [.], ack 5257, win 126, options [nop,nop,TS val 1984521915 ecr 3246725109], length 0
21:22:49.529300 IP 10.8.1.8.51028 > 52.223.226.58.1935: Flags [.], seq 16854:18168, ack 0, win 501, options [nop,nop,TS val 3246725611 ecr 1984521915], length 1314
21:22:49.563133 IP 10.8.1.8.51028 > 52.223.226.58.1935: Flags [.], seq 18168:19482, ack 0, win 501, options [nop,nop,TS val 3246725645 ecr 1984521915], length 1314
21:22:49.593861 IP 52.223.226.58.1935 > 10.8.1.8.51028: Flags [.], ack 7885, win 126, options [nop,nop,TS val 1984521983 ecr 3246725213], length 0
21:22:49.596217 IP 10.8.1.8.51028 > 52.223.226.58.1935: Flags [.], seq 19482:20796, ack 0, win 501, options [nop,nop,TS val 3246725678 ecr 1984521983], length 1314
21:22:49.665122 IP 10.8.1.8.51028 > 52.223.226.58.1935: Flags [.], seq 20796:22110, ack 0, win 501, options [nop,nop,TS val 3246725747 ecr 1984521983], length 1314
21:22:49.690253 IP 52.223.226.58.1935 > 10.8.1.8.51028: Flags [.], ack 10513, win 126, options [nop,nop,TS val 1984522079 ecr 3246725311], length 0
21:22:49.698817 IP 10.8.1.8.51028 > 52.223.226.58.1935: Flags [.], seq 22110:23424, ack 0, win 501, options [nop,nop,TS val 3246725780 ecr 1984522079], length 1314
21:22:49.730203 IP 10.8.1.8.51028 > 52.223.226.58.1935: Flags [.], seq 23424:24738, ack 0, win 501, options [nop,nop,TS val 3246725812 ecr 1984522079], length 1314
21:22:49.759531 IP 52.223.226.58.1935 > 10.8.1.8.51028: Flags [.], ack 12912, win 126, options [nop,nop,TS val 1984522148 ecr 3246725377], length 0
21:22:49.759564 IP 10.8.1.8.51028 > 52.223.226.58.1935: Flags [P.], seq 24738:25074, ack 0, win 501, options [nop,nop,TS val 3246725841 ecr 1984522148], length 336
21:22:49.796708 IP 10.8.1.8.51028 > 52.223.226.58.1935: Flags [.], seq 25074:26388, ack 0, win 501, options [nop,nop,TS val 3246725878 ecr 1984522148], length 1314
21:22:49.829195 IP 10.8.1.8.51028 > 52.223.226.58.1935: Flags [.], seq 26388:27702, ack 0, win 501, options [nop,nop,TS val 3246725911 ecr 1984522148], length 1314
21:22:49.860936 IP 52.223.226.58.1935 > 10.8.1.8.51028: Flags [.], ack 15540, win 126, options [nop,nop,TS val 1984522249 ecr 3246725477], length 0
21:22:49.886800 IP 10.8.1.8.51028 > 52.223.226.58.1935: Flags [.], seq 27702:29016, ack 0, win 501, options [nop,nop,TS val 3246725969 ecr 1984522249], length 1314
21:22:49.927775 IP 10.8.1.8.51028 > 52.223.226.58.1935: Flags [.], seq 29016:30330, ack 0, win 501, options [nop,nop,TS val 3246726009 ecr 1984522249], length 1314
21:22:49.957953 IP 52.223.226.58.1935 > 10.8.1.8.51028: Flags [.], ack 18168, win 126, options [nop,nop,TS val 1984522347 ecr 3246725547], length 0
21:22:49.963494 IP 10.8.1.8.51028 > 52.223.226.58.1935: Flags [.], seq 30330:31644, ack 0, win 501, options [nop,nop,TS val 3246726045 ecr 1984522347], length 1314
21:22:50.013867 IP 10.8.1.8.51028 > 52.223.226.58.1935: Flags [.], seq 31644:32958, ack 0, win 501, options [nop,nop,TS val 3246726096 ecr 1984522347], length 1314
21:22:50.025514 IP 52.223.226.58.1935 > 10.8.1.8.51028: Flags [.], ack 20796, win 126, options [nop,nop,TS val 1984522414 ecr 3246725645], length 0
21:22:50.061375 IP 10.8.1.8.51028 > 52.223.226.58.1935: Flags [.], seq 32958:34272, ack 0, win 501, options [nop,nop,TS val 3246726143 ecr 1984522414], length 1314
21:22:50.098998 IP 10.8.1.8.51028 > 52.223.226.58.1935: Flags [.], seq 34272:35586, ack 0, win 501, options [nop,nop,TS val 3246726181 ecr 1984522414], length 1314
21:22:50.127555 IP 52.223.226.58.1935 > 10.8.1.8.51028: Flags [.], ack 23424, win 126, options [nop,nop,TS val 1984522516 ecr 3246725747], length 0
21:22:50.142135 IP 10.8.1.8.51028 > 52.223.226.58.1935: Flags [.], seq 35586:36900, ack 0, win 501, options [nop,nop,TS val 3246726224 ecr 1984522516], length 1314
21:22:50.188288 IP 52.223.226.58.1935 > 10.8.1.8.51028: Flags [.], ack 25074, win 126, options [nop,nop,TS val 1984522577 ecr 3246725812], length 0
21:22:50.188317 IP 10.8.1.8.51028 > 52.223.226.58.1935: Flags [P.], seq 36900:37980, ack 0, win 501, options [nop,nop,TS val 3246726270 ecr 1984522577], length 1080
21:22:50.230378 IP 10.8.1.8.51028 > 52.223.226.58.1935: Flags [.], seq 37980:39294, ack 0, win 501, options [nop,nop,TS val 3246726312 ecr 1984522577], length 1314
21:22:50.258105 IP 52.223.226.58.1935 > 10.8.1.8.51028: Flags [.], ack 27702, win 126, options [nop,nop,TS val 1984522647 ecr 3246725878], length 0
21:22:50.263504 IP 10.8.1.8.51028 > 52.223.226.58.1935: Flags [.], seq 39294:40608, ack 0, win 501, options [nop,nop,TS val 3246726345 ecr 1984522647], length 1314
21:22:50.313012 IP 10.8.1.8.51028 > 52.223.226.58.1935: Flags [.], seq 40608:41922, ack 0, win 501, options [nop,nop,TS val 3246726395 ecr 1984522647], length 1314
21:22:50.356727 IP 52.223.226.58.1935 > 10.8.1.8.51028: Flags [.], ack 30330, win 126, options [nop,nop,TS val 1984522745 ecr 3246725969], length 0
21:22:50.363744 IP 10.8.1.8.51028 > 52.223.226.58.1935: Flags [.], seq 41922:43236, ack 0, win 501, options [nop,nop,TS val 3246726445 ecr 1984522745], length 1314
21:22:50.397913 IP 10.8.1.8.51028 > 52.223.226.58.1935: Flags [.], seq 43236:44550, ack 0, win 501, options [nop,nop,TS val 3246726480 ecr 1984522745], length 1314
21:22:50.441399 IP 10.8.1.8.51028 > 52.223.226.58.1935: Flags [.], seq 44550:45864, ack 0, win 501, options [nop,nop,TS val 3246726523 ecr 1984522745], length 1314
21:22:50.442721 IP 52.223.226.58.1935 > 10.8.1.8.51028: Flags [.], ack 32958, win 126, options [nop,nop,TS val 1984522831 ecr 3246726045], length 0
21:22:50.495649 IP 10.8.1.8.51028 > 52.223.226.58.1935: Flags [.], seq 45864:47178, ack 0, win 501, options [nop,nop,TS val 3246726577 ecr 1984522831], length 1314
21:22:50.527339 IP 10.8.1.8.51028 > 52.223.226.58.1935: Flags [.], seq 47178:48492, ack 0, win 501, options [nop,nop,TS val 3246726609 ecr 1984522831], length 1314
21:22:50.528026 IP 52.223.226.58.1935 > 10.8.1.8.51028: Flags [.], ack 35586, win 126, options [nop,nop,TS val 1984522917 ecr 3246726143], length 0
21:22:50.569377 IP 10.8.1.8.51028 > 52.223.226.58.1935: Flags [.], seq 48492:49806, ack 0, win 501, options [nop,nop,TS val 3246726651 ecr 1984522917], length 1314
21:22:50.617116 IP 52.223.226.58.1935 > 10.8.1.8.51028: Flags [.], ack 37980, win 126, options [nop,nop,TS val 1984523006 ecr 3246726224], length 0
21:22:50.617158 IP 10.8.1.8.51028 > 52.223.226.58.1935: Flags [P.], seq 49806:50902, ack 0, win 501, options [nop,nop,TS val 3246726699 ecr 1984523006], length 1096
21:22:50.664019 IP 10.8.1.8.51028 > 52.223.226.58.1935: Flags [.], seq 50902:52216, ack 0, win 501, options [nop,nop,TS val 3246726746 ecr 1984523006], length 1314
21:22:50.692244 IP 52.223.226.58.1935 > 10.8.1.8.51028: Flags [.], ack 40608, win 126, options [nop,nop,TS val 1984523081 ecr 3246726312], length 0
21:22:50.695382 IP 10.8.1.8.51028 > 52.223.226.58.1935: Flags [.], seq 52216:53530, ack 0, win 501, options [nop,nop,TS val 3246726777 ecr 1984523081], length 1314
21:22:50.740267 IP 10.8.1.8.51028 > 52.223.226.58.1935: Flags [.], seq 53530:54844, ack 0, win 501, options [nop,nop,TS val 3246726822 ecr 1984523081], length 1314
21:22:50.792414 IP 52.223.226.58.1935 > 10.8.1.8.51028: Flags [.], ack 43236, win 126, options [nop,nop,TS val 1984523181 ecr 3246726395], length 0
21:22:50.794332 IP 10.8.1.8.51028 > 52.223.226.58.1935: Flags [.], seq 54844:56158, ack 0, win 501, options [nop,nop,TS val 3246726876 ecr 1984523181], length 1314
21:22:50.828438 IP 10.8.1.8.51028 > 52.223.226.58.1935: Flags [.], seq 56158:57472, ack 0, win 501, options [nop,nop,TS val 3246726910 ecr 1984523181], length 1314
21:22:50.868066 IP 10.8.1.8.51028 > 52.223.226.58.1935: Flags [.], seq 57472:58786, ack 0, win 501, options [nop,nop,TS val 3246726950 ecr 1984523181], length 1314
21:22:50.870041 IP 52.223.226.58.1935 > 10.8.1.8.51028: Flags [.], ack 45864, win 126, options [nop,nop,TS val 1984523259 ecr 3246726480], length 0
21:22:50.927416 IP 10.8.1.8.51028 > 52.223.226.58.1935: Flags [.], seq 58786:60100, ack 0, win 501, options [nop,nop,TS val 3246727009 ecr 1984523259], length 1314
21:22:50.955905 IP 52.223.226.58.1935 > 10.8.1.8.51028: Flags [.], ack 48492, win 126, options [nop,nop,TS val 1984523345 ecr 3246726577], length 0
21:22:50.961859 IP 10.8.1.8.51028 > 52.223.226.58.1935: Flags [.], seq 60100:61414, ack 0, win 501, options [nop,nop,TS val 3246727044 ecr 1984523345], length 1314
21:22:50.998627 IP 10.8.1.8.51028 > 52.223.226.58.1935: Flags [.], seq 61414:62728, ack 0, win 501, options [nop,nop,TS val 3246727080 ecr 1984523345], length 1314
21:22:51.045928 IP 52.223.226.58.1935 > 10.8.1.8.51028: Flags [.], ack 50902, win 126, options [nop,nop,TS val 1984523435 ecr 3246726651], length 0
21:22:51.045968 IP 10.8.1.8.51028 > 52.223.226.58.1935: Flags [P.], seq 62728:63804, ack 0, win 501, options [nop,nop,TS val 3246727128 ecr 1984523435], length 1076
21:22:51.098862 IP 10.8.1.8.51028 > 52.223.226.58.1935: Flags [.], seq 63804:65118, ack 0, win 501, options [nop,nop,TS val 3246727181 ecr 1984523435], length 1314
21:22:51.124119 IP 52.223.226.58.1935 > 10.8.1.8.51028: Flags [.], ack 53530, win 126, options [nop,nop,TS val 1984523513 ecr 3246726746], length 0
21:22:51.131944 IP 10.8.1.8.51028 > 52.223.226.58.1935: Flags [.], seq 65118:66432, ack 0, win 501, options [nop,nop,TS val 3246727214 ecr 1984523513], length 1314
21:22:51.167493 IP 10.8.1.8.51028 > 52.223.226.58.1935: Flags [.], seq 66432:67746, ack 0, win 501, options [nop,nop,TS val 3246727249 ecr 1984523513], length 1314
21:22:51.223012 IP 52.223.226.58.1935 > 10.8.1.8.51028: Flags [.], ack 56158, win 126, options [nop,nop,TS val 1984523612 ecr 3246726822], length 0
21:22:51.227568 IP 10.8.1.8.51028 > 52.223.226.58.1935: Flags [.], seq 67746:69060, ack 0, win 501, options [nop,nop,TS val 3246727309 ecr 1984523612], length 1314
21:22:51.262338 IP 10.8.1.8.51028 > 52.223.226.58.1935: Flags [.], seq 69060:70374, ack 0, win 501, options [nop,nop,TS val 3246727344 ecr 1984523612], length 1314
21:22:51.296854 IP 52.223.226.58.1935 > 10.8.1.8.51028: Flags [.], ack 58786, win 126, options [nop,nop,TS val 1984523686 ecr 3246726910], length 0
21:22:51.298963 IP 10.8.1.8.51028 > 52.223.226.58.1935: Flags [.], seq 70374:71688, ack 0, win 501, options [nop,nop,TS val 3246727381 ecr 1984523686], length 1314
21:22:51.362629 IP 10.8.1.8.51028 > 52.223.226.58.1935: Flags [.], seq 71688:73002, ack 0, win 501, options [nop,nop,TS val 3246727444 ecr 1984523686], length 1314
21:22:51.390868 IP 52.223.226.58.1935 > 10.8.1.8.51028: Flags [.], ack 61414, win 126, options [nop,nop,TS val 1984523780 ecr 3246727009], length 0
21:22:51.395369 IP 10.8.1.8.51028 > 52.223.226.58.1935: Flags [.], seq 73002:74316, ack 0, win 501, options [nop,nop,TS val 3246727477 ecr 1984523780], length 1314
21:22:51.429151 IP 10.8.1.8.51028 > 52.223.226.58.1935: Flags [.], seq 74316:75630, ack 0, win 501, options [nop,nop,TS val 3246727511 ecr 1984523780], length 1314
21:22:51.474876 IP 52.223.226.58.1935 > 10.8.1.8.51028: Flags [.], ack 63804, win 126, options [nop,nop,TS val 1984523863 ecr 3246727080], length 0
21:22:51.474911 IP 10.8.1.8.51028 > 52.223.226.58.1935: Flags [P.], seq 75630:76727, ack 0, win 501, options [nop,nop,TS val 3246727557 ecr 1984523863], length 1097
21:22:51.530112 IP 10.8.1.8.51028 > 52.223.226.58.1935: Flags [.], seq 76727:78041, ack 0, win 501, options [nop,nop,TS val 3246727612 ecr 1984523863], length 1314
21:22:51.561134 IP 52.223.226.58.1935 > 10.8.1.8.51028: Flags [.], ack 66432, win 126, options [nop,nop,TS val 1984523949 ecr 3246727181], length 0
21:22:51.564020 IP 10.8.1.8.51028 > 52.223.226.58.1935: Flags [.], seq 78041:79355, ack 0, win 501, options [nop,nop,TS val 3246727646 ecr 1984523949], length 1314
21:22:51.597168 IP 10.8.1.8.51028 > 52.223.226.58.1935: Flags [.], seq 79355:80669, ack 0, win 501, options [nop,nop,TS val 3246727679 ecr 1984523949], length 1314
21:22:51.656502 IP 52.223.226.58.1935 > 10.8.1.8.51028: Flags [.], ack 69060, win 126, options [nop,nop,TS val 1984524045 ecr 3246727249], length 0
21:22:51.662808 IP 10.8.1.8.51028 > 52.223.226.58.1935: Flags [.], seq 80669:81983, ack 0, win 501, options [nop,nop,TS val 3246727745 ecr 1984524045], length 1314
21:22:51.696091 IP 10.8.1.8.51028 > 52.223.226.58.1935: Flags [.], seq 81983:83297, ack 0, win 501, options [nop,nop,TS val 3246727778 ecr 1984524045], length 1314
21:22:51.727562 IP 10.8.1.8.51028 > 52.223.226.58.1935: Flags [.], seq 83297:84611, ack 0, win 501, options [nop,nop,TS val 3246727809 ecr 1984524045], length 1314
21:22:51.727571 IP 52.223.226.58.1935 > 10.8.1.8.51028: Flags [.], ack 71688, win 126, options [nop,nop,TS val 1984524116 ecr 3246727344], length 0
21:22:51.797547 IP 10.8.1.8.51028 > 52.223.226.58.1935: Flags [.], seq 84611:85925, ack 0, win 501, options [nop,nop,TS val 3246727879 ecr 1984524116], length 1314
21:22:51.824180 IP 52.223.226.58.1935 > 10.8.1.8.51028: Flags [.], ack 74316, win 126, options [nop,nop,TS val 1984524213 ecr 3246727444], length 0
21:22:51.832081 IP 10.8.1.8.51028 > 52.223.226.58.1935: Flags [.], seq 85925:87239, ack 0, win 501, options [nop,nop,TS val 3246727914 ecr 1984524213], length 1314
21:22:51.866092 IP 10.8.1.8.51028 > 52.223.226.58.1935: Flags [.], seq 87239:88553, ack 0, win 501, options [nop,nop,TS val 3246727948 ecr 1984524213], length 1314
21:22:51.903916 IP 52.223.226.58.1935 > 10.8.1.8.51028: Flags [.], ack 76727, win 126, options [nop,nop,TS val 1984524293 ecr 3246727511], length 0
21:22:51.903941 IP 10.8.1.8.51028 > 52.223.226.58.1935: Flags [P.], seq 88553:89633, ack 0, win 501, options [nop,nop,TS val 3246727986 ecr 1984524293], length 1080
21:22:51.962870 IP 10.8.1.8.51028 > 52.223.226.58.1935: Flags [.], seq 89633:90947, ack 0, win 501, options [nop,nop,TS val 3246728045 ecr 1984524293], length 1314
21:22:51.994495 IP 10.8.1.8.51028 > 52.223.226.58.1935: Flags [.], seq 90947:92261, ack 0, win 501, options [nop,nop,TS val 3246728076 ecr 1984524293], length 1314
21:22:51.995895 IP 52.223.226.58.1935 > 10.8.1.8.51028: Flags [.], ack 79355, win 126, options [nop,nop,TS val 1984524382 ecr 3246727612], length 0
21:22:52.029193 IP 10.8.1.8.51028 > 52.223.226.58.1935: Flags [.], seq 92261:93575, ack 0, win 501, options [nop,nop,TS val 3246728111 ecr 1984524382], length 1314
21:22:52.091700 IP 52.223.226.58.1935 > 10.8.1.8.51028: Flags [.], ack 81983, win 126, options [nop,nop,TS val 1984524480 ecr 3246727679], length 0
21:22:52.098491 IP 10.8.1.8.51028 > 52.223.226.58.1935: Flags [.], seq 93575:94889, ack 0, win 501, options [nop,nop,TS val 3246728180 ecr 1984524480], length 1314
21:22:52.131783 IP 10.8.1.8.51028 > 52.223.226.58.1935: Flags [.], seq 94889:96203, ack 0, win 501, options [nop,nop,TS val 3246728213 ecr 1984524480], length 1314
21:22:52.156429 IP 52.223.226.58.1935 > 10.8.1.8.51028: Flags [.], ack 84611, win 126, options [nop,nop,TS val 1984524545 ecr 3246727778], length 0
21:22:52.162029 IP 10.8.1.8.51028 > 52.223.226.58.1935: Flags [.], seq 96203:97517, ack 0, win 501, options [nop,nop,TS val 3246728244 ecr 1984524545], length 1314
21:22:52.228541 IP 10.8.1.8.51028 > 52.223.226.58.1935: Flags [.], seq 97517:98831, ack 0, win 501, options [nop,nop,TS val 3246728310 ecr 1984524545], length 1314
21:22:52.260778 IP 52.223.226.58.1935 > 10.8.1.8.51028: Flags [.], ack 87239, win 126, options [nop,nop,TS val 1984524649 ecr 3246727879], length 0
21:22:52.261073 IP 10.8.1.8.51028 > 52.223.226.58.1935: Flags [.], seq 98831:100145, ack 0, win 501, options [nop,nop,TS val 3246728343 ecr 1984524649], length 1314
21:22:52.295667 IP 10.8.1.8.51028 > 52.223.226.58.1935: Flags [.], seq 100145:101459, ack 0, win 501, options [nop,nop,TS val 3246728377 ecr 1984524649], length 1314
21:22:52.332727 IP 52.223.226.58.1935 > 10.8.1.8.51028: Flags [.], ack 89633, win 126, options [nop,nop,TS val 1984524721 ecr 3246727948], length 0
21:22:52.332777 IP 10.8.1.8.51028 > 52.223.226.58.1935: Flags [P.], seq 101459:102555, ack 0, win 501, options [nop,nop,TS val 3246728414 ecr 1984524721], length 1096
21:22:52.398519 IP 10.8.1.8.51028 > 52.223.226.58.1935: Flags [.], seq 102555:103869, ack 0, win 501, options [nop,nop,TS val 3246728480 ecr 1984524721], length 1314
21:22:52.424518 IP 52.223.226.58.1935 > 10.8.1.8.51028: Flags [.], ack 92261, win 126, options [nop,nop,TS val 1984524813 ecr 3246728045], length 0
21:22:52.431797 IP 10.8.1.8.51028 > 52.223.226.58.1935: Flags [.], seq 103869:105183, ack 0, win 501, options [nop,nop,TS val 3246728513 ecr 1984524813], length 1314
21:22:52.464881 IP 10.8.1.8.51028 > 52.223.226.58.1935: Flags [.], seq 105183:106497, ack 0, win 501, options [nop,nop,TS val 3246728547 ecr 1984524813], length 1314
21:22:52.527391 IP 10.8.1.8.51028 > 52.223.226.58.1935: Flags [.], seq 106497:107811, ack 0, win 501, options [nop,nop,TS val 3246728609 ecr 1984524813], length 1314
21:22:52.527459 IP 52.223.226.58.1935 > 10.8.1.8.51028: Flags [.], ack 94889, win 126, options [nop,nop,TS val 1984524916 ecr 3246728111], length 0
21:22:52.561478 IP 10.8.1.8.51028 > 52.223.226.58.1935: Flags [.], seq 107811:109125, ack 0, win 501, options [nop,nop,TS val 3246728643 ecr 1984524916], length 1314
21:22:52.591181 IP 52.223.226.58.1935 > 10.8.1.8.51028: Flags [.], ack 97517, win 126, options [nop,nop,TS val 1984524980 ecr 3246728213], length 0
21:22:52.597775 IP 10.8.1.8.51028 > 52.223.226.58.1935: Flags [.], seq 109125:110439, ack 0, win 501, options [nop,nop,TS val 3246728679 ecr 1984524980], length 1314
21:22:52.662480 IP 10.8.1.8.51028 > 52.223.226.58.1935: Flags [.], seq 110439:111753, ack 0, win 501, options [nop,nop,TS val 3246728744 ecr 1984524980], length 1314
21:22:52.689862 IP 52.223.226.58.1935 > 10.8.1.8.51028: Flags [.], ack 100145, win 126, options [nop,nop,TS val 1984525078 ecr 3246728310], length 0
21:22:52.695644 IP 10.8.1.8.51028 > 52.223.226.58.1935: Flags [.], seq 111753:113067, ack 0, win 501, options [nop,nop,TS val 3246728777 ecr 1984525078], length 1314
21:22:52.729536 IP 10.8.1.8.51028 > 52.223.226.58.1935: Flags [.], seq 113067:114381, ack 0, win 501, options [nop,nop,TS val 3246728811 ecr 1984525078], length 1314
21:22:52.761863 IP 52.223.226.58.1935 > 10.8.1.8.51028: Flags [.], ack 102555, win 126, options [nop,nop,TS val 1984525150 ecr 3246728377], length 0
21:22:52.761942 IP 10.8.1.8.51028 > 52.223.226.58.1935: Flags [P.], seq 114381:114609, ack 0, win 501, options [nop,nop,TS val 3246728844 ecr 1984525150], length 228
21:22:52.797352 IP 10.8.1.8.51028 > 52.223.226.58.1935: Flags [.], seq 114609:115923, ack 0, win 501, options [nop,nop,TS val 3246728879 ecr 1984525150], length 1314
21:22:52.830586 IP 10.8.1.8.51028 > 52.223.226.58.1935: Flags [.], seq 115923:117237, ack 0, win 501, options [nop,nop,TS val 3246728912 ecr 1984525150], length 1314
21:22:52.860709 IP 52.223.226.58.1935 > 10.8.1.8.51028: Flags [.], ack 105183, win 126, options [nop,nop,TS val 1984525249 ecr 3246728480], length 0
21:22:52.875854 IP 10.8.1.8.51028 > 52.223.226.58.1935: Flags [.], seq 117237:118551, ack 0, win 501, options [nop,nop,TS val 3246728958 ecr 1984525249], length 1314
21:22:52.928902 IP 10.8.1.8.51028 > 52.223.226.58.1935: Flags [.], seq 118551:119865, ack 0, win 501, options [nop,nop,TS val 3246729011 ecr 1984525249], length 1314
21:22:52.960356 IP 52.223.226.58.1935 > 10.8.1.8.51028: Flags [.], ack 107811, win 126, options [nop,nop,TS val 1984525345 ecr 3246728547], length 0
21:22:52.961171 IP 10.8.1.8.51028 > 52.223.226.58.1935: Flags [.], seq 119865:121179, ack 0, win 501, options [nop,nop,TS val 3246729043 ecr 1984525345], length 1314
21:22:53.003690 IP 10.8.1.8.51028 > 52.223.226.58.1935: Flags [.], seq 121179:122493, ack 0, win 501, options [nop,nop,TS val 3246729085 ecr 1984525345], length 1314
21:22:53.026595 IP 52.223.226.58.1935 > 10.8.1.8.51028: Flags [.], ack 110439, win 126, options [nop,nop,TS val 1984525415 ecr 3246728643], length 0
21:22:53.065137 IP 10.8.1.8.51028 > 52.223.226.58.1935: Flags [.], seq 122493:123807, ack 0, win 501, options [nop,nop,TS val 3246729147 ecr 1984525415], length 1314
21:22:53.095857 IP 10.8.1.8.51028 > 52.223.226.58.1935: Flags [.], seq 123807:125121, ack 0, win 501, options [nop,nop,TS val 3246729178 ecr 1984525415], length 1314
21:22:53.124236 IP 52.223.226.58.1935 > 10.8.1.8.51028: Flags [.], ack 113067, win 126, options [nop,nop,TS val 1984525513 ecr 3246728744], length 0
21:22:53.131983 IP 10.8.1.8.51028 > 52.223.226.58.1935: Flags [.], seq 125121:126435, ack 0, win 501, options [nop,nop,TS val 3246729214 ecr 1984525513], length 1314
21:22:53.190564 IP 52.223.226.58.1935 > 10.8.1.8.51028: Flags [.], ack 114609, win 126, options [nop,nop,TS val 1984525579 ecr 3246728811], length 0
21:22:53.190592 IP 10.8.1.8.51028 > 52.223.226.58.1935: Flags [P.], seq 126435:127533, ack 0, win 501, options [nop,nop,TS val 3246729272 ecr 1984525579], length 1098
21:22:53.229418 IP 10.8.1.8.51028 > 52.223.226.58.1935: Flags [.], seq 127533:128847, ack 0, win 501, options [nop,nop,TS val 3246729311 ecr 1984525579], length 1314
21:22:53.259688 IP 52.223.226.58.1935 > 10.8.1.8.51028: Flags [.], ack 117237, win 126, options [nop,nop,TS val 1984525648 ecr 3246728879], length 0
21:22:53.262083 IP 10.8.1.8.51028 > 52.223.226.58.1935: Flags [.], seq 128847:130161, ack 0, win 501, options [nop,nop,TS val 3246729344 ecr 1984525648], length 1314
21:22:53.302710 IP 10.8.1.8.51028 > 52.223.226.58.1935: Flags [.], seq 130161:131475, ack 0, win 501, options [nop,nop,TS val 3246729384 ecr 1984525648], length 1314
21:22:53.357680 IP 52.223.226.58.1935 > 10.8.1.8.51028: Flags [.], ack 119865, win 126, options [nop,nop,TS val 1984525746 ecr 3246728958], length 0
21:22:53.361626 IP 10.8.1.8.51028 > 52.223.226.58.1935: Flags [.], seq 131475:132789, ack 0, win 501, options [nop,nop,TS val 3246729443 ecr 1984525746], length 1314
21:22:53.397348 IP 10.8.1.8.51028 > 52.223.226.58.1935: Flags [.], seq 132789:134103, ack 0, win 501, options [nop,nop,TS val 3246729479 ecr 1984525746], length 1314
21:22:53.431880 IP 10.8.1.8.51028 > 52.223.226.58.1935: Flags [.], seq 134103:135417, ack 0, win 501, options [nop,nop,TS val 3246729514 ecr 1984525746], length 1314
21:22:53.432491 IP 52.223.226.58.1935 > 10.8.1.8.51028: Flags [.], ack 122493, win 126, options [nop,nop,TS val 1984525821 ecr 3246729043], length 0
21:22:53.494884 IP 10.8.1.8.51028 > 52.223.226.58.1935: Flags [.], seq 135417:136731, ack 0, win 501, options [nop,nop,TS val 3246729577 ecr 1984525821], length 1314
21:22:53.524723 IP 52.223.226.58.1935 > 10.8.1.8.51028: Flags [.], ack 125121, win 126, options [nop,nop,TS val 1984525913 ecr 3246729147], length 0
21:22:53.531243 IP 10.8.1.8.51028 > 52.223.226.58.1935: Flags [.], seq 136731:138045, ack 0, win 501, options [nop,nop,TS val 3246729613 ecr 1984525913], length 1314
21:22:53.565173 IP 10.8.1.8.51028 > 52.223.226.58.1935: Flags [.], seq 138045:139359, ack 0, win 501, options [nop,nop,TS val 3246729647 ecr 1984525913], length 1314
21:22:53.619539 IP 52.223.226.58.1935 > 10.8.1.8.51028: Flags [.], ack 127533, win 126, options [nop,nop,TS val 1984526008 ecr 3246729214], length 0
21:22:53.619569 IP 10.8.1.8.51028 > 52.223.226.58.1935: Flags [P.], seq 139359:140439, ack 0, win 501, options [nop,nop,TS val 3246729701 ecr 1984526008], length 1080
21:22:53.663009 IP 10.8.1.8.51028 > 52.223.226.58.1935: Flags [.], seq 140439:141753, ack 0, win 501, options [nop,nop,TS val 3246729745 ecr 1984526008], length 1314
21:22:53.690888 IP 52.223.226.58.1935 > 10.8.1.8.51028: Flags [.], ack 130161, win 126, options [nop,nop,TS val 1984526080 ecr 3246729311], length 0
21:22:53.697852 IP 10.8.1.8.51028 > 52.223.226.58.1935: Flags [.], seq 141753:143067, ack 0, win 501, options [nop,nop,TS val 3246729780 ecr 1984526080], length 1314
21:22:53.731497 IP 10.8.1.8.51028 > 52.223.226.58.1935: Flags [.], seq 143067:144381, ack 0, win 501, options [nop,nop,TS val 3246729813 ecr 1984526080], length 1314
21:22:53.790726 IP 52.223.226.58.1935 > 10.8.1.8.51028: Flags [.], ack 132789, win 126, options [nop,nop,TS val 1984526179 ecr 3246729384], length 0
21:22:53.797219 IP 10.8.1.8.51028 > 52.223.226.58.1935: Flags [.], seq 144381:145695, ack 0, win 501, options [nop,nop,TS val 3246729879 ecr 1984526179], length 1314
21:22:53.830840 IP 10.8.1.8.51028 > 52.223.226.58.1935: Flags [.], seq 145695:147009, ack 0, win 501, options [nop,nop,TS val 3246729913 ecr 1984526179], length 1314
21:22:53.860745 IP 52.223.226.58.1935 > 10.8.1.8.51028: Flags [.], ack 135417, win 126, options [nop,nop,TS val 1984526249 ecr 3246729479], length 0
21:22:53.862211 IP 10.8.1.8.51028 > 52.223.226.58.1935: Flags [.], seq 147009:148323, ack 0, win 501, options [nop,nop,TS val 3246729944 ecr 1984526249], length 1314
21:22:53.932174 IP 10.8.1.8.51028 > 52.223.226.58.1935: Flags [.], seq 148323:149637, ack 0, win 501, options [nop,nop,TS val 3246730014 ecr 1984526249], length 1314
21:22:53.960392 IP 52.223.226.58.1935 > 10.8.1.8.51028: Flags [.], ack 138045, win 126, options [nop,nop,TS val 1984526349 ecr 3246729577], length 0
21:22:53.965234 IP 10.8.1.8.51028 > 52.223.226.58.1935: Flags [.], seq 149637:150951, ack 0, win 501, options [nop,nop,TS val 3246730047 ecr 1984526349], length 1314
21:22:53.995252 IP 10.8.1.8.51028 > 52.223.226.58.1935: Flags [.], seq 150951:152265, ack 0, win 501, options [nop,nop,TS val 3246730077 ecr 1984526349], length 1314
21:22:54.048300 IP 52.223.226.58.1935 > 10.8.1.8.51028: Flags [.], ack 140439, win 126, options [nop,nop,TS val 1984526437 ecr 3246729647], length 0
21:22:54.048324 IP 10.8.1.8.51028 > 52.223.226.58.1935: Flags [P.], seq 152265:153352, ack 0, win 501, options [nop,nop,TS val 3246730130 ecr 1984526437], length 1087
21:22:54.098579 IP 10.8.1.8.51028 > 52.223.226.58.1935: Flags [.], seq 153352:154666, ack 0, win 501, options [nop,nop,TS val 3246730180 ecr 1984526437], length 1314
21:22:54.126741 IP 52.223.226.58.1935 > 10.8.1.8.51028: Flags [.], ack 143067, win 126, options [nop,nop,TS val 1984526515 ecr 3246729745], length 0
21:22:54.131476 IP 10.8.1.8.51028 > 52.223.226.58.1935: Flags [.], seq 154666:155980, ack 0, win 501, options [nop,nop,TS val 3246730213 ecr 1984526515], length 1314
21:22:54.163433 IP 10.8.1.8.51028 > 52.223.226.58.1935: Flags [.], seq 155980:157294, ack 0, win 501, options [nop,nop,TS val 3246730245 ecr 1984526515], length 1314
21:22:54.226373 IP 52.223.226.58.1935 > 10.8.1.8.51028: Flags [.], ack 145695, win 126, options [nop,nop,TS val 1984526615 ecr 3246729813], length 0
21:22:54.231835 IP 10.8.1.8.51028 > 52.223.226.58.1935: Flags [.], seq 157294:158608, ack 0, win 501, options [nop,nop,TS val 3246730314 ecr 1984526615], length 1314
21:22:54.264859 IP 10.8.1.8.51028 > 52.223.226.58.1935: Flags [.], seq 158608:159922, ack 0, win 501, options [nop,nop,TS val 3246730347 ecr 1984526615], length 1314
21:22:54.291175 IP 52.223.226.58.1935 > 10.8.1.8.51028: Flags [.], ack 148323, win 126, options [nop,nop,TS val 1984526680 ecr 3246729913], length 0
21:22:54.297743 IP 10.8.1.8.51028 > 52.223.226.58.1935: Flags [.], seq 159922:161236, ack 0, win 501, options [nop,nop,TS val 3246730379 ecr 1984526680], length 1314
21:22:54.364621 IP 10.8.1.8.51028 > 52.223.226.58.1935: Flags [.], seq 161236:162550, ack 0, win 501, options [nop,nop,TS val 3246730446 ecr 1984526680], length 1314
21:22:54.394291 IP 52.223.226.58.1935 > 10.8.1.8.51028: Flags [.], ack 150951, win 126, options [nop,nop,TS val 1984526783 ecr 3246730014], length 0
21:22:54.397641 IP 10.8.1.8.51028 > 52.223.226.58.1935: Flags [.], seq 162550:163864, ack 0, win 501, options [nop,nop,TS val 3246730479 ecr 1984526783], length 1314
21:22:54.431119 IP 10.8.1.8.51028 > 52.223.226.58.1935: Flags [.], seq 163864:165178, ack 0, win 501, options [nop,nop,TS val 3246730513 ecr 1984526783], length 1314
21:22:54.477286 IP 52.223.226.58.1935 > 10.8.1.8.51028: Flags [.], ack 153352, win 126, options [nop,nop,TS val 1984526866 ecr 3246730077], length 0
21:22:54.477308 IP 10.8.1.8.51028 > 52.223.226.58.1935: Flags [P.], seq 165178:166263, ack 0, win 501, options [nop,nop,TS val 3246730559 ecr 1984526866], length 1085
21:22:54.528964 IP 10.8.1.8.51028 > 52.223.226.58.1935: Flags [.], seq 166263:167577, ack 0, win 501, options [nop,nop,TS val 3246730611 ecr 1984526866], length 1314
21:22:54.560691 IP 52.223.226.58.1935 > 10.8.1.8.51028: Flags [.], ack 155980, win 126, options [nop,nop,TS val 1984526949 ecr 3246730180], length 0
21:22:54.564560 IP 10.8.1.8.51028 > 52.223.226.58.1935: Flags [.], seq 167577:168891, ack 0, win 501, options [nop,nop,TS val 3246730646 ecr 1984526949], length 1314
21:22:54.598110 IP 10.8.1.8.51028 > 52.223.226.58.1935: Flags [.], seq 168891:170205, ack 0, win 501, options [nop,nop,TS val 3246730680 ecr 1984526949], length 1314
21:22:54.660907 IP 52.223.226.58.1935 > 10.8.1.8.51028: Flags [.], ack 158608, win 126, options [nop,nop,TS val 1984527049 ecr 3246730245], length 0
21:22:54.663309 IP 10.8.1.8.51028 > 52.223.226.58.1935: Flags [.], seq 170205:171519, ack 0, win 501, options [nop,nop,TS val 3246730745 ecr 1984527049], length 1314
21:22:54.696584 IP 10.8.1.8.51028 > 52.223.226.58.1935: Flags [.], seq 171519:172833, ack 0, win 501, options [nop,nop,TS val 3246730778 ecr 1984527049], length 1314
21:22:54.727895 IP 52.223.226.58.1935 > 10.8.1.8.51028: Flags [.], ack 161236, win 126, options [nop,nop,TS val 1984527116 ecr 3246730347], length 0
21:22:54.729980 IP 10.8.1.8.51028 > 52.223.226.58.1935: Flags [.], seq 172833:174147, ack 0, win 501, options [nop,nop,TS val 3246730812 ecr 1984527116], length 1314
21:22:54.799419 IP 10.8.1.8.51028 > 52.223.226.58.1935: Flags [.], seq 174147:175461, ack 0, win 501, options [nop,nop,TS val 3246730881 ecr 1984527116], length 1314
21:22:54.826703 IP 52.223.226.58.1935 > 10.8.1.8.51028: Flags [.], ack 163864, win 126, options [nop,nop,TS val 1984527215 ecr 3246730446], length 0
21:22:54.831001 IP 10.8.1.8.51028 > 52.223.226.58.1935: Flags [.], seq 175461:176775, ack 0, win 501, options [nop,nop,TS val 3246730913 ecr 1984527215], length 1314
21:22:54.863398 IP 10.8.1.8.51028 > 52.223.226.58.1935: Flags [.], seq 176775:178089, ack 0, win 501, options [nop,nop,TS val 3246730945 ecr 1984527215], length 1314
21:22:54.906123 IP 52.223.226.58.1935 > 10.8.1.8.51028: Flags [.], ack 166263, win 126, options [nop,nop,TS val 1984527295 ecr 3246730513], length 0
21:22:54.906178 IP 10.8.1.8.51028 > 52.223.226.58.1935: Flags [P.], seq 178089:179177, ack 0, win 501, options [nop,nop,TS val 3246730988 ecr 1984527295], length 1088
21:22:54.965054 IP 10.8.1.8.51028 > 52.223.226.58.1935: Flags [.], seq 179177:180491, ack 0, win 501, options [nop,nop,TS val 3246731047 ecr 1984527295], length 1314
21:22:54.996290 IP 52.223.226.58.1935 > 10.8.1.8.51028: Flags [.], ack 168891, win 126, options [nop,nop,TS val 1984527382 ecr 3246730611], length 0
21:22:54.996832 IP 10.8.1.8.51028 > 52.223.226.58.1935: Flags [.], seq 180491:181805, ack 0, win 501, options [nop,nop,TS val 3246731079 ecr 1984527382], length 1314
21:22:55.034583 IP 10.8.1.8.51028 > 52.223.226.58.1935: Flags [.], seq 181805:183119, ack 0, win 501, options [nop,nop,TS val 3246731116 ecr 1984527382], length 1314
21:22:55.092085 IP 52.223.226.58.1935 > 10.8.1.8.51028: Flags [.], ack 171519, win 126, options [nop,nop,TS val 1984527481 ecr 3246730680], length 0
21:22:55.098219 IP 10.8.1.8.51028 > 52.223.226.58.1935: Flags [.], seq 183119:184433, ack 0, win 501, options [nop,nop,TS val 3246731180 ecr 1984527481], length 1314
21:22:55.130231 IP 10.8.1.8.51028 > 52.223.226.58.1935: Flags [.], seq 184433:185747, ack 0, win 501, options [nop,nop,TS val 3246731212 ecr 1984527481], length 1314
21:22:55.158811 IP 52.223.226.58.1935 > 10.8.1.8.51028: Flags [.], ack 174147, win 126, options [nop,nop,TS val 1984527547 ecr 3246730778], length 0
21:22:55.164952 IP 10.8.1.8.51028 > 52.223.226.58.1935: Flags [.], seq 185747:187061, ack 0, win 501, options [nop,nop,TS val 3246731247 ecr 1984527547], length 1314
21:22:55.229121 IP 10.8.1.8.51028 > 52.223.226.58.1935: Flags [.], seq 187061:188375, ack 0, win 501, options [nop,nop,TS val 3246731311 ecr 1984527547], length 1314
21:22:55.259736 IP 52.223.226.58.1935 > 10.8.1.8.51028: Flags [.], ack 176775, win 126, options [nop,nop,TS val 1984527648 ecr 3246730881], length 0
21:22:55.262382 IP 10.8.1.8.51028 > 52.223.226.58.1935: Flags [.], seq 188375:189689, ack 0, win 501, options [nop,nop,TS val 3246731344 ecr 1984527648], length 1314
21:22:55.296431 IP 10.8.1.8.51028 > 52.223.226.58.1935: Flags [.], seq 189689:191003, ack 0, win 501, options [nop,nop,TS val 3246731378 ecr 1984527648], length 1314
21:22:55.335324 IP 52.223.226.58.1935 > 10.8.1.8.51028: Flags [.], ack 179177, win 126, options [nop,nop,TS val 1984527724 ecr 3246730945], length 0
21:22:55.335351 IP 10.8.1.8.51028 > 52.223.226.58.1935: Flags [P.], seq 191003:192187, ack 0, win 501, options [nop,nop,TS val 3246731417 ecr 1984527724], length 1184
21:22:55.397299 IP 10.8.1.8.51028 > 52.223.226.58.1935: Flags [.], seq 192187:193501, ack 0, win 501, options [nop,nop,TS val 3246731479 ecr 1984527724], length 1314
21:22:55.427483 IP 52.223.226.58.1935 > 10.8.1.8.51028: Flags [.], ack 181805, win 126, options [nop,nop,TS val 1984527816 ecr 3246731047], length 0
21:22:55.429469 IP 10.8.1.8.51028 > 52.223.226.58.1935: Flags [.], seq 193501:194815, ack 0, win 501, options [nop,nop,TS val 3246731511 ecr 1984527816], length 1314
21:22:55.461094 IP 10.8.1.8.51028 > 52.223.226.58.1935: Flags [.], seq 194815:196129, ack 0, win 501, options [nop,nop,TS val 3246731543 ecr 1984527816], length 1314
21:22:55.529934 IP 52.223.226.58.1935 > 10.8.1.8.51028: Flags [.], ack 184433, win 126, options [nop,nop,TS val 1984527918 ecr 3246731116], length 0
21:22:55.531266 IP 10.8.1.8.51028 > 52.223.226.58.1935: Flags [.], seq 196129:197443, ack 0, win 501, options [nop,nop,TS val 3246731613 ecr 1984527918], length 1314
21:22:55.567985 IP 10.8.1.8.51028 > 52.223.226.58.1935: Flags [.], seq 197443:198757, ack 0, win 501, options [nop,nop,TS val 3246731650 ecr 1984527918], length 1314
21:22:55.594235 IP 52.223.226.58.1935 > 10.8.1.8.51028: Flags [.], ack 187061, win 126, options [nop,nop,TS val 1984527983 ecr 3246731212], length 0
21:22:55.598115 IP 10.8.1.8.51028 > 52.223.226.58.1935: Flags [.], seq 198757:200071, ack 0, win 501, options [nop,nop,TS val 3246731680 ecr 1984527983], length 1314
21:22:55.663248 IP 10.8.1.8.51028 > 52.223.226.58.1935: Flags [.], seq 200071:201385, ack 0, win 501, options [nop,nop,TS val 3246731745 ecr 1984527983], length 1314
21:22:55.691136 IP 52.223.226.58.1935 > 10.8.1.8.51028: Flags [.], ack 189689, win 126, options [nop,nop,TS val 1984528080 ecr 3246731311], length 0
21:22:55.697267 IP 10.8.1.8.51028 > 52.223.226.58.1935: Flags [.], seq 201385:202699, ack 0, win 501, options [nop,nop,TS val 3246731779 ecr 1984528080], length 1314
21:22:55.730578 IP 10.8.1.8.51028 > 52.223.226.58.1935: Flags [.], seq 202699:204013, ack 0, win 501, options [nop,nop,TS val 3246731812 ecr 1984528080], length 1314
21:22:55.766595 IP 52.223.226.58.1935 > 10.8.1.8.51028: Flags [.], ack 192187, win 126, options [nop,nop,TS val 1984528153 ecr 3246731378], length 0
21:22:55.766625 IP 10.8.1.8.51028 > 52.223.226.58.1935: Flags [P.], seq 204013:205093, ack 0, win 501, options [nop,nop,TS val 3246731848 ecr 1984528153], length 1080
21:22:55.830062 IP 10.8.1.8.51028 > 52.223.226.58.1935: Flags [.], seq 205093:206407, ack 0, win 501, options [nop,nop,TS val 3246731912 ecr 1984528153], length 1314
21:22:55.861380 IP 52.223.226.58.1935 > 10.8.1.8.51028: Flags [.], ack 194815, win 126, options [nop,nop,TS val 1984528247 ecr 3246731479], length 0
21:22:55.867000 IP 10.8.1.8.51028 > 52.223.226.58.1935: Flags [.], seq 206407:207721, ack 0, win 501, options [nop,nop,TS val 3246731949 ecr 1984528247], length 1314
21:22:55.896313 IP 10.8.1.8.51028 > 52.223.226.58.1935: Flags [.], seq 207721:209035, ack 0, win 501, options [nop,nop,TS val 3246731978 ecr 1984528247], length 1314
21:22:55.960283 IP 52.223.226.58.1935 > 10.8.1.8.51028: Flags [.], ack 197443, win 126, options [nop,nop,TS val 1984528349 ecr 3246731543], length 0
21:22:55.962499 IP 10.8.1.8.51028 > 52.223.226.58.1935: Flags [.], seq 209035:210349, ack 0, win 501, options [nop,nop,TS val 3246732044 ecr 1984528349], length 1314
21:22:55.994431 IP 10.8.1.8.51028 > 52.223.226.58.1935: Flags [.], seq 210349:211663, ack 0, win 501, options [nop,nop,TS val 3246732076 ecr 1984528349], length 1314
21:22:56.026897 IP 52.223.226.58.1935 > 10.8.1.8.51028: Flags [.], ack 200071, win 126, options [nop,nop,TS val 1984528416 ecr 3246731650], length 0
21:22:56.029069 IP 10.8.1.8.51028 > 52.223.226.58.1935: Flags [.], seq 211663:212977, ack 0, win 501, options [nop,nop,TS val 3246732111 ecr 1984528416], length 1314
21:22:56.101470 IP 10.8.1.8.51028 > 52.223.226.58.1935: Flags [.], seq 212977:214291, ack 0, win 501, options [nop,nop,TS val 3246732183 ecr 1984528416], length 1314
21:22:56.125974 IP 52.223.226.58.1935 > 10.8.1.8.51028: Flags [.], ack 202699, win 126, options [nop,nop,TS val 1984528515 ecr 3246731745], length 0
21:22:56.132035 IP 10.8.1.8.51028 > 52.223.226.58.1935: Flags [.], seq 214291:215605, ack 0, win 501, options [nop,nop,TS val 3246732214 ecr 1984528515], length 1314
21:22:56.165487 IP 10.8.1.8.51028 > 52.223.226.58.1935: Flags [.], seq 215605:216919, ack 0, win 501, options [nop,nop,TS val 3246732247 ecr 1984528515], length 1314
21:22:56.196658 IP 52.223.226.58.1935 > 10.8.1.8.51028: Flags [.], ack 205093, win 126, options [nop,nop,TS val 1984528585 ecr 3246731812], length 0
21:22:56.196675 IP 10.8.1.8.51028 > 52.223.226.58.1935: Flags [P.], seq 216919:218011, ack 0, win 501, options [nop,nop,TS val 3246732278 ecr 1984528585], length 1092
21:22:56.265195 IP 10.8.1.8.51028 > 52.223.226.58.1935: Flags [.], seq 218011:219325, ack 0, win 501, options [nop,nop,TS val 3246732347 ecr 1984528585], length 1314
21:22:56.298508 IP 10.8.1.8.51028 > 52.223.226.58.1935: Flags [.], seq 219325:220639, ack 0, win 501, options [nop,nop,TS val 3246732380 ecr 1984528585], length 1314
21:22:56.298537 IP 52.223.226.58.1935 > 10.8.1.8.51028: Flags [.], ack 207721, win 126, options [nop,nop,TS val 1984528687 ecr 3246731912], length 0
21:22:56.331834 IP 10.8.1.8.51028 > 52.223.226.58.1935: Flags [.], seq 220639:221953, ack 0, win 501, options [nop,nop,TS val 3246732414 ecr 1984528687], length 1314
21:22:56.391322 IP 52.223.226.58.1935 > 10.8.1.8.51028: Flags [.], ack 210349, win 126, options [nop,nop,TS val 1984528780 ecr 3246731978], length 0
21:22:56.401295 IP 10.8.1.8.51028 > 52.223.226.58.1935: Flags [.], seq 221953:223267, ack 0, win 501, options [nop,nop,TS val 3246732483 ecr 1984528780], length 1314
21:22:56.430805 IP 10.8.1.8.51028 > 52.223.226.58.1935: Flags [.], seq 223267:224581, ack 0, win 501, options [nop,nop,TS val 3246732512 ecr 1984528780], length 1314
21:22:56.457881 IP 52.223.226.58.1935 > 10.8.1.8.51028: Flags [.], ack 212977, win 126, options [nop,nop,TS val 1984528846 ecr 3246732076], length 0
