15:25:46.344923 IP 99.181.90.189.1935 > 10.8.2.2.58818: Flags [.], ack 3707430189, win 126, options [nop,nop,TS val 3412624313 ecr 1090034244], length 0
15:25:46.348130 IP 10.8.2.2.58818 > 99.181.90.189.1935: Flags [.], seq 9613:10927, ack 0, win 501, options [nop,nop,TS val 1090034645 ecr 3412624313], length 1314
15:25:46.381779 IP 10.8.2.2.58818 > 99.181.90.189.1935: Flags [.], seq 10927:12241, ack 0, win 501, options [nop,nop,TS val 1090034678 ecr 3412624313], length 1314
15:25:46.445762 IP 99.181.90.189.1935 > 10.8.2.2.58818: Flags [.], ack 2629, win 126, options [nop,nop,TS val 3412624412 ecr 1090034315], length 0
15:25:46.446338 IP 10.8.2.2.58818 > 99.181.90.189.1935: Flags [.], seq 12241:13555, ack 0, win 501, options [nop,nop,TS val 1090034743 ecr 3412624412], length 1314
15:25:46.481412 IP 10.8.2.2.58818 > 99.181.90.189.1935: Flags [.], seq 13555:14869, ack 0, win 501, options [nop,nop,TS val 1090034778 ecr 3412624412], length 1314
15:25:46.509779 IP 99.181.90.189.1935 > 10.8.2.2.58818: Flags [.], ack 5257, win 126, options [nop,nop,TS val 3412624478 ecr 1090034407], length 0
15:25:46.514649 IP 10.8.2.2.58818 > 99.181.90.189.1935: Flags [.], seq 14869:16183, ack 0, win 501, options [nop,nop,TS val 1090034811 ecr 3412624478], length 1314
15:25:46.581097 IP 10.8.2.2.58818 > 99.181.90.189.1935: Flags [.], seq 16183:17497, ack 0, win 501, options [nop,nop,TS val 1090034878 ecr 3412624478], length 1314
15:25:46.611723 IP 99.181.90.189.1935 > 10.8.2.2.58818: Flags [.], ack 7885, win 126, options [nop,nop,TS val 3412624580 ecr 1090034511], length 0
15:25:46.615651 IP 10.8.2.2.58818 > 99.181.90.189.1935: Flags [.], seq 17497:18811, ack 0, win 501, options [nop,nop,TS val 1090034912 ecr 3412624580], length 1314
15:25:46.623171 IP 99.181.90.189.1935 > 10.8.2.2.58818: Flags [.], ack 8299, win 126, options [nop,nop,TS val 3412624592 ecr 1090034556], length 0
15:25:46.623206 IP 10.8.2.2.58818 > 99.181.90.189.1935: Flags [P.], seq 18811:19239, ack 0, win 501, options [nop,nop,TS val 1090034920 ecr 3412624592], length 428
15:25:46.678732 IP 10.8.2.2.58818 > 99.181.90.189.1935: Flags [.], seq 19239:20553, ack 0, win 501, options [nop,nop,TS val 1090034975 ecr 3412624592], length 1314
15:25:46.712096 IP 99.181.90.189.1935 > 10.8.2.2.58818: Flags [.], ack 10927, win 126, options [nop,nop,TS val 3412624681 ecr 1090034611], length 0
15:25:46.713063 IP 10.8.2.2.58818 > 99.181.90.189.1935: Flags [.], seq 20553:21867, ack 0, win 501, options [nop,nop,TS val 1090035010 ecr 3412624681], length 1314
15:25:46.747079 IP 10.8.2.2.58818 > 99.181.90.189.1935: Flags [.], seq 21867:23181, ack 0, win 501, options [nop,nop,TS val 1090035044 ecr 3412624681], length 1314
15:25:46.810461 IP 99.181.90.189.1935 > 10.8.2.2.58818: Flags [.], ack 13555, win 126, options [nop,nop,TS val 3412624779 ecr 1090034678], length 0
15:25:46.810929 IP 10.8.2.2.58818 > 99.181.90.189.1935: Flags [.], seq 23181:24495, ack 0, win 501, options [nop,nop,TS val 1090035108 ecr 3412624779], length 1314
15:25:46.844335 IP 10.8.2.2.58818 > 99.181.90.189.1935: Flags [.], seq 24495:25809, ack 0, win 501, options [nop,nop,TS val 1090035141 ecr 3412624779], length 1314
15:25:46.877698 IP 10.8.2.2.58818 > 99.181.90.189.1935: Flags [.], seq 25809:27123, ack 0, win 501, options [nop,nop,TS val 1090035174 ecr 3412624779], length 1314
15:25:46.878704 IP 99.181.90.189.1935 > 10.8.2.2.58818: Flags [.], ack 16183, win 126, options [nop,nop,TS val 3412624847 ecr 1090034778], length 0
15:25:46.943899 IP 10.8.2.2.58818 > 99.181.90.189.1935: Flags [.], seq 27123:28437, ack 0, win 501, options [nop,nop,TS val 1090035241 ecr 3412624847], length 1314
15:25:46.978408 IP 10.8.2.2.58818 > 99.181.90.189.1935: Flags [.], seq 28437:29751, ack 0, win 501, options [nop,nop,TS val 1090035275 ecr 3412624847], length 1314
15:25:46.979426 IP 99.181.90.189.1935 > 10.8.2.2.58818: Flags [.], ack 18811, win 126, options [nop,nop,TS val 3412624948 ecr 1090034878], length 0
15:25:46.987391 IP 99.181.90.189.1935 > 10.8.2.2.58818: Flags [.], ack 19239, win 126, options [nop,nop,TS val 3412624956 ecr 1090034920], length 0
15:25:46.987402 IP 10.8.2.2.58818 > 99.181.90.189.1935: Flags [P.], seq 29751:30166, ack 0, win 501, options [nop,nop,TS val 1090035284 ecr 3412624956], length 415
15:25:47.045942 IP 10.8.2.2.58818 > 99.181.90.189.1935: Flags [.], seq 30166:31480, ack 0, win 501, options [nop,nop,TS val 1090035343 ecr 3412624956], length 1314
15:25:47.077062 IP 99.181.90.189.1935 > 10.8.2.2.58818: Flags [.], ack 21867, win 126, options [nop,nop,TS val 3412625046 ecr 1090034975], length 0
15:25:47.079243 IP 10.8.2.2.58818 > 99.181.90.189.1935: Flags [.], seq 31480:32794, ack 0, win 501, options [nop,nop,TS val 1090035376 ecr 3412625046], length 1314
15:25:47.113918 IP 10.8.2.2.58818 > 99.181.90.189.1935: Flags [.], seq 32794:34108, ack 0, win 501, options [nop,nop,TS val 1090035411 ecr 3412625046], length 1314
15:25:47.174830 IP 99.181.90.189.1935 > 10.8.2.2.58818: Flags [.], ack 24495, win 126, options [nop,nop,TS val 3412625143 ecr 1090035044], length 0
15:25:47.182105 IP 10.8.2.2.58818 > 99.181.90.189.1935: Flags [.], seq 34108:35422, ack 0, win 501, options [nop,nop,TS val 1090035479 ecr 3412625143], length 1314
15:25:47.213734 IP 10.8.2.2.58818 > 99.181.90.189.1935: Flags [.], seq 35422:36736, ack 0, win 501, options [nop,nop,TS val 1090035510 ecr 3412625143], length 1314
15:25:47.241906 IP 99.181.90.189.1935 > 10.8.2.2.58818: Flags [.], ack 27123, win 126, options [nop,nop,TS val 3412625210 ecr 1090035141], length 0
15:25:47.246322 IP 10.8.2.2.58818 > 99.181.90.189.1935: Flags [.], seq 36736:38050, ack 0, win 501, options [nop,nop,TS val 1090035543 ecr 3412625210], length 1314
15:25:47.314213 IP 10.8.2.2.58818 > 99.181.90.189.1935: Flags [.], seq 38050:39364, ack 0, win 501, options [nop,nop,TS val 1090035611 ecr 3412625210], length 1314
15:25:47.342694 IP 99.181.90.189.1935 > 10.8.2.2.58818: Flags [.], ack 29751, win 126, options [nop,nop,TS val 3412625311 ecr 1090035241], length 0
15:25:47.348939 IP 10.8.2.2.58818 > 99.181.90.189.1935: Flags [.], seq 39364:40678, ack 0, win 501, options [nop,nop,TS val 1090035646 ecr 3412625311], length 1314
15:25:47.351201 IP 99.181.90.189.1935 > 10.8.2.2.58818: Flags [.], ack 30166, win 126, options [nop,nop,TS val 3412625320 ecr 1090035284], length 0
15:25:47.351230 IP 10.8.2.2.58818 > 99.181.90.189.1935: Flags [P.], seq 40678:41104, ack 0, win 501, options [nop,nop,TS val 1090035648 ecr 3412625320], length 426
15:25:47.415306 IP 10.8.2.2.58818 > 99.181.90.189.1935: Flags [.], seq 41104:42418, ack 0, win 501, options [nop,nop,TS val 1090035712 ecr 3412625320], length 1314
15:25:47.443213 IP 99.181.90.189.1935 > 10.8.2.2.58818: Flags [.], ack 32794, win 126, options [nop,nop,TS val 3412625412 ecr 1090035343], length 0
15:25:47.447235 IP 10.8.2.2.58818 > 99.181.90.189.1935: Flags [.], seq 42418:43732, ack 0, win 501, options [nop,nop,TS val 1090035744 ecr 3412625412], length 1314
15:25:47.479743 IP 10.8.2.2.58818 > 99.181.90.189.1935: Flags [.], seq 43732:45046, ack 0, win 501, options [nop,nop,TS val 1090035776 ecr 3412625412], length 1314
15:25:47.543627 IP 99.181.90.189.1935 > 10.8.2.2.58818: Flags [.], ack 34108, win 126, options [nop,nop,TS val 3412625512 ecr 1090035411], length 0
15:25:47.546980 IP 10.8.2.2.58818 > 99.181.90.189.1935: Flags [.], seq 45046:46360, ack 0, win 501, options [nop,nop,TS val 1090035844 ecr 3412625512], length 1314
15:25:47.577827 IP 99.181.90.189.1935 > 10.8.2.2.58818: Flags [.], ack 36736, win 126, options [nop,nop,TS val 3412625546 ecr 1090035479], length 0
15:25:47.579212 IP 10.8.2.2.58818 > 99.181.90.189.1935: Flags [.], seq 46360:47674, ack 0, win 501, options [nop,nop,TS val 1090035876 ecr 3412625546], length 1314
15:25:47.612456 IP 10.8.2.2.58818 > 99.181.90.189.1935: Flags [.], seq 47674:48988, ack 0, win 501, options [nop,nop,TS val 1090035909 ecr 3412625546], length 1314
15:25:47.678475 IP 99.181.90.189.1935 > 10.8.2.2.58818: Flags [.], ack 39364, win 126, options [nop,nop,TS val 3412625647 ecr 1090035543], length 0
15:25:47.679904 IP 10.8.2.2.58818 > 99.181.90.189.1935: Flags [.], seq 48988:50302, ack 0, win 501, options [nop,nop,TS val 1090035977 ecr 3412625647], length 1314
15:25:47.712472 IP 10.8.2.2.58818 > 99.181.90.189.1935: Flags [.], seq 50302:51616, ack 0, win 501, options [nop,nop,TS val 1090036009 ecr 3412625647], length 1314
15:25:47.714924 IP 99.181.90.189.1935 > 10.8.2.2.58818: Flags [.], ack 41104, win 126, options [nop,nop,TS val 3412625684 ecr 1090035646], length 0
15:25:47.714934 IP 10.8.2.2.58818 > 99.181.90.189.1935: Flags [P.], seq 51616:52032, ack 0, win 501, options [nop,nop,TS val 1090036012 ecr 3412625684], length 416
15:25:47.779620 IP 10.8.2.2.58818 > 99.181.90.189.1935: Flags [.], seq 52032:53346, ack 0, win 501, options [nop,nop,TS val 1090036076 ecr 3412625684], length 1314
15:25:47.811204 IP 99.181.90.189.1935 > 10.8.2.2.58818: Flags [.], ack 43732, win 126, options [nop,nop,TS val 3412625780 ecr 1090035712], length 0
15:25:47.813014 IP 10.8.2.2.58818 > 99.181.90.189.1935: Flags [.], seq 53346:54660, ack 0, win 501, options [nop,nop,TS val 1090036110 ecr 3412625780], length 1314
15:25:47.845580 IP 10.8.2.2.58818 > 99.181.90.189.1935: Flags [.], seq 54660:55974, ack 0, win 501, options [nop,nop,TS val 1090036142 ecr 3412625780], length 1314
15:25:47.910989 IP 99.181.90.189.1935 > 10.8.2.2.58818: Flags [.], ack 46360, win 126, options [nop,nop,TS val 3412625880 ecr 1090035776], length 0
15:25:47.914597 IP 10.8.2.2.58818 > 99.181.90.189.1935: Flags [.], seq 55974:57288, ack 0, win 501, options [nop,nop,TS val 1090036211 ecr 3412625880], length 1314
15:25:47.945696 IP 10.8.2.2.58818 > 99.181.90.189.1935: Flags [.], seq 57288:58602, ack 0, win 501, options [nop,nop,TS val 1090036242 ecr 3412625880], length 1314
15:25:47.976493 IP 99.181.90.189.1935 > 10.8.2.2.58818: Flags [.], ack 48988, win 126, options [nop,nop,TS val 3412625945 ecr 1090035876], length 0
15:25:47.979360 IP 10.8.2.2.58818 > 99.181.90.189.1935: Flags [.], seq 58602:59916, ack 0, win 501, options [nop,nop,TS val 1090036276 ecr 3412625945], length 1314
15:25:48.046650 IP 10.8.2.2.58818 > 99.181.90.189.1935: Flags [.], seq 59916:61230, ack 0, win 501, options [nop,nop,TS val 1090036343 ecr 3412625945], length 1314
15:25:48.076539 IP 99.181.90.189.1935 > 10.8.2.2.58818: Flags [.], ack 51616, win 126, options [nop,nop,TS val 3412626045 ecr 1090035977], length 0
15:25:48.078855 IP 99.181.90.189.1935 > 10.8.2.2.58818: Flags [.], ack 52032, win 126, options [nop,nop,TS val 3412626048 ecr 1090036012], length 0
15:25:48.078903 IP 10.8.2.2.58818 > 99.181.90.189.1935: Flags [P.], seq 61230:62123, ack 0, win 501, options [nop,nop,TS val 1090036376 ecr 3412626048], length 893
15:25:48.115168 IP 10.8.2.2.58818 > 99.181.90.189.1935: Flags [.], seq 62123:63437, ack 0, win 501, options [nop,nop,TS val 1090036412 ecr 3412626048], length 1314
15:25:48.146582 IP 10.8.2.2.58818 > 99.181.90.189.1935: Flags [.], seq 63437:64751, ack 0, win 501, options [nop,nop,TS val 1090036443 ecr 3412626048], length 1314
15:25:48.176894 IP 99.181.90.189.1935 > 10.8.2.2.58818: Flags [.], ack 54660, win 126, options [nop,nop,TS val 3412626145 ecr 1090036076], length 0
15:25:48.195781 IP 10.8.2.2.58818 > 99.181.90.189.1935: Flags [.], seq 64751:66065, ack 0, win 501, options [nop,nop,TS val 1090036492 ecr 3412626145], length 1314
15:25:48.244854 IP 10.8.2.2.58818 > 99.181.90.189.1935: Flags [.], seq 66065:67379, ack 0, win 501, options [nop,nop,TS val 1090036542 ecr 3412626145], length 1314
15:25:48.271685 IP 99.181.90.189.1935 > 10.8.2.2.58818: Flags [.], ack 55974, win 126, options [nop,nop,TS val 3412626240 ecr 1090036142], length 0
15:25:48.277286 IP 10.8.2.2.58818 > 99.181.90.189.1935: Flags [.], seq 67379:68693, ack 0, win 501, options [nop,nop,TS val 1090036574 ecr 3412626240], length 1314
15:25:48.309801 IP 99.181.90.189.1935 > 10.8.2.2.58818: Flags [.], ack 58602, win 126, options [nop,nop,TS val 3412626278 ecr 1090036211], length 0
15:25:48.323263 IP 10.8.2.2.58818 > 99.181.90.189.1935: Flags [.], seq 68693:70007, ack 0, win 501, options [nop,nop,TS val 1090036620 ecr 3412626278], length 1314
15:25:48.377066 IP 10.8.2.2.58818 > 99.181.90.189.1935: Flags [.], seq 70007:71321, ack 0, win 501, options [nop,nop,TS val 1090036674 ecr 3412626278], length 1314
15:25:48.410574 IP 99.181.90.189.1935 > 10.8.2.2.58818: Flags [.], ack 61230, win 126, options [nop,nop,TS val 3412626379 ecr 1090036276], length 0
15:25:48.410953 IP 10.8.2.2.58818 > 99.181.90.189.1935: Flags [.], seq 71321:72635, ack 0, win 501, options [nop,nop,TS val 1090036708 ecr 3412626379], length 1314
15:25:48.443627 IP 99.181.90.189.1935 > 10.8.2.2.58818: Flags [.], ack 62123, win 126, options [nop,nop,TS val 3412626412 ecr 1090036376], length 0
15:25:48.443658 IP 10.8.2.2.58818 > 99.181.90.189.1935: Flags [P.], seq 72635:73056, ack 0, win 501, options [nop,nop,TS val 1090036740 ecr 3412626412], length 421
15:25:48.481611 IP 10.8.2.2.58818 > 99.181.90.189.1935: Flags [.], seq 73056:74370, ack 0, win 501, options [nop,nop,TS val 1090036778 ecr 3412626412], length 1314
15:25:48.510668 IP 99.181.90.189.1935 > 10.8.2.2.58818: Flags [.], ack 64751, win 126, options [nop,nop,TS val 3412626479 ecr 1090036412], length 0
15:25:48.514623 IP 10.8.2.2.58818 > 99.181.90.189.1935: Flags [.], seq 74370:75684, ack 0, win 501, options [nop,nop,TS val 1090036811 ecr 3412626479], length 1314
15:25:48.557775 IP 10.8.2.2.58818 > 99.181.90.189.1935: Flags [.], seq 75684:76998, ack 0, win 501, options [nop,nop,TS val 1090036854 ecr 3412626479], length 1314
15:25:48.608849 IP 99.181.90.189.1935 > 10.8.2.2.58818: Flags [.], ack 67379, win 126, options [nop,nop,TS val 3412626578 ecr 1090036492], length 0
15:25:48.612368 IP 10.8.2.2.58818 > 99.181.90.189.1935: Flags [.], seq 76998:78312, ack 0, win 501, options [nop,nop,TS val 1090036909 ecr 3412626578], length 1314
15:25:48.647609 IP 10.8.2.2.58818 > 99.181.90.189.1935: Flags [.], seq 78312:79626, ack 0, win 501, options [nop,nop,TS val 1090036944 ecr 3412626578], length 1314
15:25:48.685707 IP 10.8.2.2.58818 > 99.181.90.189.1935: Flags [.], seq 79626:80940, ack 0, win 501, options [nop,nop,TS val 1090036982 ecr 3412626578], length 1314
15:25:48.687395 IP 99.181.90.189.1935 > 10.8.2.2.58818: Flags [.], ack 70007, win 126, options [nop,nop,TS val 3412626656 ecr 1090036574], length 0
15:25:48.746164 IP 10.8.2.2.58818 > 99.181.90.189.1935: Flags [.], seq 80940:82254, ack 0, win 501, options [nop,nop,TS val 1090037043 ecr 3412626656], length 1314
15:25:48.775249 IP 99.181.90.189.1935 > 10.8.2.2.58818: Flags [.], ack 72635, win 126, options [nop,nop,TS val 3412626744 ecr 1090036674], length 0
15:25:48.777155 IP 10.8.2.2.58818 > 99.181.90.189.1935: Flags [.], seq 82254:83568, ack 0, win 501, options [nop,nop,TS val 1090037074 ecr 3412626744], length 1314
15:25:48.807858 IP 99.181.90.189.1935 > 10.8.2.2.58818: Flags [.], ack 73056, win 126, options [nop,nop,TS val 3412626777 ecr 1090036740], length 0
15:25:48.807881 IP 10.8.2.2.58818 > 99.181.90.189.1935: Flags [P.], seq 83568:83986, ack 0, win 501, options [nop,nop,TS val 1090037105 ecr 3412626777], length 418
15:25:48.846863 IP 10.8.2.2.58818 > 99.181.90.189.1935: Flags [.], seq 83986:85300, ack 0, win 501, options [nop,nop,TS val 1090037144 ecr 3412626777], length 1314
15:25:48.878488 IP 99.181.90.189.1935 > 10.8.2.2.58818: Flags [.], ack 75684, win 126, options [nop,nop,TS val 3412626847 ecr 1090036778], length 0
15:25:48.881651 IP 10.8.2.2.58818 > 99.181.90.189.1935: Flags [.], seq 85300:86614, ack 0, win 501, options [nop,nop,TS val 1090037178 ecr 3412626847], length 1314
15:25:48.920447 IP 10.8.2.2.58818 > 99.181.90.189.1935: Flags [.], seq 86614:87928, ack 0, win 501, options [nop,nop,TS val 1090037217 ecr 3412626847], length 1314
15:25:48.976477 IP 99.181.90.189.1935 > 10.8.2.2.58818: Flags [.], ack 78312, win 126, options [nop,nop,TS val 3412626945 ecr 1090036854], length 0
15:25:48.980021 IP 10.8.2.2.58818 > 99.181.90.189.1935: Flags [.], seq 87928:89242, ack 0, win 501, options [nop,nop,TS val 1090037277 ecr 3412626945], length 1314
15:25:49.013536 IP 10.8.2.2.58818 > 99.181.90.189.1935: Flags [.], seq 89242:90556, ack 0, win 501, options [nop,nop,TS val 1090037310 ecr 3412626945], length 1314
15:25:49.048061 IP 10.8.2.2.58818 > 99.181.90.189.1935: Flags [.], seq 90556:91870, ack 0, win 501, options [nop,nop,TS val 1090037345 ecr 3412626945], length 1314
15:25:49.049477 IP 99.181.90.189.1935 > 10.8.2.2.58818: Flags [.], ack 80940, win 126, options [nop,nop,TS val 3412627018 ecr 1090036944], length 0
15:25:49.112370 IP 10.8.2.2.58818 > 99.181.90.189.1935: Flags [.], seq 91870:93184, ack 0, win 501, options [nop,nop,TS val 1090037409 ecr 3412627018], length 1314
15:25:49.141080 IP 99.181.90.189.1935 > 10.8.2.2.58818: Flags [.], ack 83568, win 126, options [nop,nop,TS val 3412627110 ecr 1090037043], length 0
15:25:49.148099 IP 10.8.2.2.58818 > 99.181.90.189.1935: Flags [.], seq 93184:94498, ack 0, win 501, options [nop,nop,TS val 1090037445 ecr 3412627110], length 1314
15:25:49.172002 IP 99.181.90.189.1935 > 10.8.2.2.58818: Flags [.], ack 83986, win 126, options [nop,nop,TS val 3412627141 ecr 1090037105], length 0
15:25:49.172031 IP 10.8.2.2.58818 > 99.181.90.189.1935: Flags [P.], seq 94498:94928, ack 0, win 501, options [nop,nop,TS val 1090037469 ecr 3412627141], length 430
15:25:49.210708 IP 10.8.2.2.58818 > 99.181.90.189.1935: Flags [.], seq 94928:96242, ack 0, win 501, options [nop,nop,TS val 1090037507 ecr 3412627141], length 1314
15:25:49.245011 IP 10.8.2.2.58818 > 99.181.90.189.1935: Flags [.], seq 96242:97556, ack 0, win 501, options [nop,nop,TS val 1090037542 ecr 3412627141], length 1314
15:25:49.245749 IP 99.181.90.189.1935 > 10.8.2.2.58818: Flags [.], ack 86614, win 126, options [nop,nop,TS val 3412627214 ecr 1090037144], length 0
15:25:49.282995 IP 10.8.2.2.58818 > 99.181.90.189.1935: Flags [.], seq 97556:98870, ack 0, win 501, options [nop,nop,TS val 1090037580 ecr 3412627214], length 1314
15:25:49.345801 IP 10.8.2.2.58818 > 99.181.90.189.1935: Flags [.], seq 98870:100184, ack 0, win 501, options [nop,nop,TS val 1090037642 ecr 3412627214], length 1314
15:25:49.349470 IP 99.181.90.189.1935 > 10.8.2.2.58818: Flags [.], ack 89242, win 126, options [nop,nop,TS val 3412627313 ecr 1090037217], length 0
15:25:49.377800 IP 10.8.2.2.58818 > 99.181.90.189.1935: Flags [.], seq 100184:101498, ack 0, win 501, options [nop,nop,TS val 1090037674 ecr 3412627313], length 1314
15:25:49.412060 IP 99.181.90.189.1935 > 10.8.2.2.58818: Flags [.], ack 91870, win 126, options [nop,nop,TS val 3412627381 ecr 1090037310], length 0
15:25:49.412985 IP 10.8.2.2.58818 > 99.181.90.189.1935: Flags [.], seq 101498:102812, ack 0, win 501, options [nop,nop,TS val 1090037710 ecr 3412627381], length 1314
15:25:49.477440 IP 10.8.2.2.58818 > 99.181.90.189.1935: Flags [.], seq 102812:104126, ack 0, win 501, options [nop,nop,TS val 1090037774 ecr 3412627381], length 1314
15:25:49.512003 IP 99.181.90.189.1935 > 10.8.2.2.58818: Flags [.], ack 94498, win 126, options [nop,nop,TS val 3412627481 ecr 1090037409], length 0
15:25:49.512406 IP 10.8.2.2.58818 > 99.181.90.189.1935: Flags [.], seq 104126:105440, ack 0, win 501, options [nop,nop,TS val 1090037809 ecr 3412627481], length 1314
15:25:49.536042 IP 99.181.90.189.1935 > 10.8.2.2.58818: Flags [.], ack 94928, win 126, options [nop,nop,TS val 3412627505 ecr 1090037469], length 0
15:25:49.536067 IP 10.8.2.2.58818 > 99.181.90.189.1935: Flags [P.], seq 105440:105853, ack 0, win 501, options [nop,nop,TS val 1090037833 ecr 3412627505], length 413
15:25:49.579430 IP 10.8.2.2.58818 > 99.181.90.189.1935: Flags [.], seq 105853:107167, ack 0, win 501, options [nop,nop,TS val 1090037876 ecr 3412627505], length 1314
15:25:49.609056 IP 99.181.90.189.1935 > 10.8.2.2.58818: Flags [.], ack 97556, win 126, options [nop,nop,TS val 3412627578 ecr 1090037507], length 0
15:25:49.612676 IP 10.8.2.2.58818 > 99.181.90.189.1935: Flags [.], seq 107167:108481, ack 0, win 501, options [nop,nop,TS val 1090037909 ecr 3412627578], length 1314
15:25:49.648095 IP 10.8.2.2.58818 > 99.181.90.189.1935: Flags [.], seq 108481:109795, ack 0, win 501, options [nop,nop,TS val 1090037945 ecr 3412627578], length 1314
15:25:49.710474 IP 10.8.2.2.58818 > 99.181.90.189.1935: Flags [.], seq 109795:111109, ack 0, win 501, options [nop,nop,TS val 1090038007 ecr 3412627578], length 1314
15:25:49.712611 IP 99.181.90.189.1935 > 10.8.2.2.58818: Flags [.], ack 100184, win 126, options [nop,nop,TS val 3412627681 ecr 1090037580], length 0
15:25:49.744064 IP 10.8.2.2.58818 > 99.181.90.189.1935: Flags [.], seq 111109:112423, ack 0, win 501, options [nop,nop,TS val 1090038041 ecr 3412627681], length 1314
15:25:49.778327 IP 99.181.90.189.1935 > 10.8.2.2.58818: Flags [.], ack 102812, win 126, options [nop,nop,TS val 3412627747 ecr 1090037674], length 0
15:25:49.779987 IP 10.8.2.2.58818 > 99.181.90.189.1935: Flags [.], seq 112423:113737, ack 0, win 501, options [nop,nop,TS val 1090038077 ecr 3412627747], length 1314
15:25:49.843837 IP 10.8.2.2.58818 > 99.181.90.189.1935: Flags [.], seq 113737:115051, ack 0, win 501, options [nop,nop,TS val 1090038141 ecr 3412627747], length 1314
15:25:49.876656 IP 99.181.90.189.1935 > 10.8.2.2.58818: Flags [.], ack 105440, win 126, options [nop,nop,TS val 3412627845 ecr 1090037774], length 0
15:25:49.879031 IP 10.8.2.2.58818 > 99.181.90.189.1935: Flags [.], seq 115051:116365, ack 0, win 501, options [nop,nop,TS val 1090038176 ecr 3412627845], length 1314
15:25:49.900058 IP 99.181.90.189.1935 > 10.8.2.2.58818: Flags [.], ack 105853, win 126, options [nop,nop,TS val 3412627869 ecr 1090037833], length 0
15:25:49.900088 IP 10.8.2.2.58818 > 99.181.90.189.1935: Flags [P.], seq 116365:116794, ack 0, win 501, options [nop,nop,TS val 1090038197 ecr 3412627869], length 429
15:25:49.948237 IP 10.8.2.2.58818 > 99.181.90.189.1935: Flags [.], seq 116794:118108, ack 0, win 501, options [nop,nop,TS val 1090038245 ecr 3412627869], length 1314
15:25:49.976713 IP 99.181.90.189.1935 > 10.8.2.2.58818: Flags [.], ack 108481, win 126, options [nop,nop,TS val 3412627945 ecr 1090037876], length 0
15:25:49.978695 IP 10.8.2.2.58818 > 99.181.90.189.1935: Flags [.], seq 118108:119422, ack 0, win 501, options [nop,nop,TS val 1090038275 ecr 3412627945], length 1314
15:25:50.012004 IP 10.8.2.2.58818 > 99.181.90.189.1935: Flags [.], seq 119422:120736, ack 0, win 501, options [nop,nop,TS val 1090038309 ecr 3412627945], length 1314
15:25:50.076649 IP 99.181.90.189.1935 > 10.8.2.2.58818: Flags [.], ack 111109, win 126, options [nop,nop,TS val 3412628043 ecr 1090037945], length 0
15:25:50.079463 IP 10.8.2.2.58818 > 99.181.90.189.1935: Flags [.], seq 120736:122050, ack 0, win 501, options [nop,nop,TS val 1090038376 ecr 3412628043], length 1314
15:25:50.110397 IP 10.8.2.2.58818 > 99.181.90.189.1935: Flags [.], seq 122050:123364, ack 0, win 501, options [nop,nop,TS val 1090038407 ecr 3412628043], length 1314
15:25:50.144109 IP 10.8.2.2.58818 > 99.181.90.189.1935: Flags [.], seq 123364:124678, ack 0, win 501, options [nop,nop,TS val 1090038441 ecr 3412628043], length 1314
15:25:50.146768 IP 99.181.90.189.1935 > 10.8.2.2.58818: Flags [.], ack 113737, win 126, options [nop,nop,TS val 3412628113 ecr 1090038041], length 0
15:25:50.210712 IP 10.8.2.2.58818 > 99.181.90.189.1935: Flags [.], seq 124678:125992, ack 0, win 501, options [nop,nop,TS val 1090038507 ecr 3412628113], length 1314
15:25:50.242956 IP 99.181.90.189.1935 > 10.8.2.2.58818: Flags [.], ack 116365, win 126, options [nop,nop,TS val 3412628212 ecr 1090038141], length 0
15:25:50.248202 IP 10.8.2.2.58818 > 99.181.90.189.1935: Flags [.], seq 125992:127306, ack 0, win 501, options [nop,nop,TS val 1090038545 ecr 3412628212], length 1314
15:25:50.264040 IP 99.181.90.189.1935 > 10.8.2.2.58818: Flags [.], ack 116794, win 126, options [nop,nop,TS val 3412628233 ecr 1090038197], length 0
15:25:50.264076 IP 10.8.2.2.58818 > 99.181.90.189.1935: Flags [P.], seq 127306:127716, ack 0, win 501, options [nop,nop,TS val 1090038561 ecr 3412628233], length 410
15:25:50.311877 IP 10.8.2.2.58818 > 99.181.90.189.1935: Flags [.], seq 127716:129030, ack 0, win 501, options [nop,nop,TS val 1090038609 ecr 3412628233], length 1314
15:25:50.343099 IP 99.181.90.189.1935 > 10.8.2.2.58818: Flags [.], ack 119422, win 126, options [nop,nop,TS val 3412628312 ecr 1090038245], length 0
15:25:50.345774 IP 10.8.2.2.58818 > 99.181.90.189.1935: Flags [.], seq 129030:130344, ack 0, win 501, options [nop,nop,TS val 1090038642 ecr 3412628312], length 1314
15:25:50.381365 IP 10.8.2.2.58818 > 99.181.90.189.1935: Flags [.], seq 130344:131658, ack 0, win 501, options [nop,nop,TS val 1090038678 ecr 3412628312], length 1314
15:25:50.443843 IP 99.181.90.189.1935 > 10.8.2.2.58818: Flags [.], ack 122050, win 126, options [nop,nop,TS val 3412628412 ecr 1090038309], length 0
15:25:50.445216 IP 10.8.2.2.58818 > 99.181.90.189.1935: Flags [.], seq 131658:132972, ack 0, win 501, options [nop,nop,TS val 1090038742 ecr 3412628412], length 1314
15:25:50.478631 IP 10.8.2.2.58818 > 99.181.90.189.1935: Flags [.], seq 132972:134286, ack 0, win 501, options [nop,nop,TS val 1090038775 ecr 3412628412], length 1314
15:25:50.510252 IP 10.8.2.2.58818 > 99.181.90.189.1935: Flags [.], seq 134286:135600, ack 0, win 501, options [nop,nop,TS val 1090038807 ecr 3412628412], length 1314
15:25:50.510293 IP 99.181.90.189.1935 > 10.8.2.2.58818: Flags [.], ack 124678, win 126, options [nop,nop,TS val 3412628479 ecr 1090038407], length 0
15:25:50.578385 IP 10.8.2.2.58818 > 99.181.90.189.1935: Flags [.], seq 135600:136914, ack 0, win 501, options [nop,nop,TS val 1090038875 ecr 3412628479], length 1314
15:25:50.612123 IP 99.181.90.189.1935 > 10.8.2.2.58818: Flags [.], ack 127306, win 126, options [nop,nop,TS val 3412628581 ecr 1090038507], length 0
15:25:50.614866 IP 10.8.2.2.58818 > 99.181.90.189.1935: Flags [.], seq 136914:138228, ack 0, win 501, options [nop,nop,TS val 1090038912 ecr 3412628581], length 1314
15:25:50.627869 IP 99.181.90.189.1935 > 10.8.2.2.58818: Flags [.], ack 127716, win 126, options [nop,nop,TS val 3412628597 ecr 1090038561], length 0
15:25:50.627908 IP 10.8.2.2.58818 > 99.181.90.189.1935: Flags [P.], seq 138228:138752, ack 0, win 501, options [nop,nop,TS val 1090038925 ecr 3412628597], length 524
15:25:50.681418 IP 10.8.2.2.58818 > 99.181.90.189.1935: Flags [.], seq 138752:140066, ack 0, win 501, options [nop,nop,TS val 1090038978 ecr 3412628597], length 1314
15:25:50.709805 IP 99.181.90.189.1935 > 10.8.2.2.58818: Flags [.], ack 130344, win 126, options [nop,nop,TS val 3412628678 ecr 1090038609], length 0
15:25:50.712953 IP 10.8.2.2.58818 > 99.181.90.189.1935: Flags [.], seq 140066:141380, ack 0, win 501, options [nop,nop,TS val 1090039010 ecr 3412628678], length 1314
15:25:50.755801 IP 10.8.2.2.58818 > 99.181.90.189.1935: Flags [.], seq 141380:142694, ack 0, win 501, options [nop,nop,TS val 1090039052 ecr 3412628678], length 1314
15:25:50.809276 IP 99.181.90.189.1935 > 10.8.2.2.58818: Flags [.], ack 132972, win 126, options [nop,nop,TS val 3412628778 ecr 1090038678], length 0
15:25:50.812430 IP 10.8.2.2.58818 > 99.181.90.189.1935: Flags [.], seq 142694:144008, ack 0, win 501, options [nop,nop,TS val 1090039109 ecr 3412628778], length 1314
15:25:50.847674 IP 10.8.2.2.58818 > 99.181.90.189.1935: Flags [.], seq 144008:145322, ack 0, win 501, options [nop,nop,TS val 1090039144 ecr 3412628778], length 1314
15:25:50.874264 IP 99.181.90.189.1935 > 10.8.2.2.58818: Flags [.], ack 135600, win 126, options [nop,nop,TS val 3412628843 ecr 1090038775], length 0
15:25:50.884371 IP 10.8.2.2.58818 > 99.181.90.189.1935: Flags [.], seq 145322:146636, ack 0, win 501, options [nop,nop,TS val 1090039181 ecr 3412628843], length 1314
15:25:50.947009 IP 10.8.2.2.58818 > 99.181.90.189.1935: Flags [.], seq 146636:147950, ack 0, win 501, options [nop,nop,TS val 1090039244 ecr 3412628843], length 1314
15:25:50.978754 IP 99.181.90.189.1935 > 10.8.2.2.58818: Flags [.], ack 138228, win 126, options [nop,nop,TS val 3412628948 ecr 1090038875], length 0
15:25:50.980074 IP 10.8.2.2.58818 > 99.181.90.189.1935: Flags [.], seq 147950:149264, ack 0, win 501, options [nop,nop,TS val 1090039277 ecr 3412628948], length 1314
15:25:50.991957 IP 99.181.90.189.1935 > 10.8.2.2.58818: Flags [.], ack 138752, win 126, options [nop,nop,TS val 3412628961 ecr 1090038925], length 0
15:25:50.991987 IP 10.8.2.2.58818 > 99.181.90.189.1935: Flags [P.], seq 149264:149679, ack 0, win 501, options [nop,nop,TS val 1090039289 ecr 3412628961], length 415
15:25:51.047452 IP 10.8.2.2.58818 > 99.181.90.189.1935: Flags [.], seq 149679:150993, ack 0, win 501, options [nop,nop,TS val 1090039344 ecr 3412628961], length 1314
15:25:51.076923 IP 99.181.90.189.1935 > 10.8.2.2.58818: Flags [.], ack 141380, win 126, options [nop,nop,TS val 3412629045 ecr 1090038978], length 0
15:25:51.080961 IP 10.8.2.2.58818 > 99.181.90.189.1935: Flags [.], seq 150993:152307, ack 0, win 501, options [nop,nop,TS val 1090039378 ecr 3412629045], length 1314
15:25:51.120213 IP 10.8.2.2.58818 > 99.181.90.189.1935: Flags [.], seq 152307:153621, ack 0, win 501, options [nop,nop,TS val 1090039417 ecr 3412629045], length 1314
15:25:51.176602 IP 99.181.90.189.1935 > 10.8.2.2.58818: Flags [.], ack 144008, win 126, options [nop,nop,TS val 3412629145 ecr 1090039052], length 0
15:25:51.180928 IP 10.8.2.2.58818 > 99.181.90.189.1935: Flags [.], seq 153621:154935, ack 0, win 501, options [nop,nop,TS val 1090039478 ecr 3412629145], length 1314
15:25:51.213825 IP 10.8.2.2.58818 > 99.181.90.189.1935: Flags [.], seq 154935:156249, ack 0, win 501, options [nop,nop,TS val 1090039511 ecr 3412629145], length 1314
15:25:51.248607 IP 99.181.90.189.1935 > 10.8.2.2.58818: Flags [.], ack 146636, win 126, options [nop,nop,TS val 3412629217 ecr 1090039144], length 0
15:25:51.248679 IP 10.8.2.2.58818 > 99.181.90.189.1935: Flags [.], seq 156249:157563, ack 0, win 501, options [nop,nop,TS val 1090039545 ecr 3412629217], length 1314
15:25:51.313876 IP 10.8.2.2.58818 > 99.181.90.189.1935: Flags [.], seq 157563:158877, ack 0, win 501, options [nop,nop,TS val 1090039611 ecr 3412629217], length 1314
15:25:51.346774 IP 99.181.90.189.1935 > 10.8.2.2.58818: Flags [.], ack 149264, win 126, options [nop,nop,TS val 3412629313 ecr 1090039244], length 0
15:25:51.347448 IP 10.8.2.2.58818 > 99.181.90.189.1935: Flags [.], seq 158877:160191, ack 0, win 501, options [nop,nop,TS val 1090039644 ecr 3412629313], length 1314
15:25:51.356072 IP 99.181.90.189.1935 > 10.8.2.2.58818: Flags [.], ack 149679, win 126, options [nop,nop,TS val 3412629325 ecr 1090039289], length 0
15:25:51.356099 IP 10.8.2.2.58818 > 99.181.90.189.1935: Flags [P.], seq 160191:160620, ack 0, win 501, options [nop,nop,TS val 1090039653 ecr 3412629325], length 429
15:25:51.414776 IP 10.8.2.2.58818 > 99.181.90.189.1935: Flags [.], seq 160620:161934, ack 0, win 501, options [nop,nop,TS val 1090039711 ecr 3412629325], length 1314
15:25:51.444915 IP 99.181.90.189.1935 > 10.8.2.2.58818: Flags [.], ack 152307, win 126, options [nop,nop,TS val 3412629414 ecr 1090039344], length 0
15:25:51.449328 IP 10.8.2.2.58818 > 99.181.90.189.1935: Flags [.], seq 161934:163248, ack 0, win 501, options [nop,nop,TS val 1090039746 ecr 3412629414], length 1314
15:25:51.484561 IP 10.8.2.2.58818 > 99.181.90.189.1935: Flags [.], seq 163248:164562, ack 0, win 501, options [nop,nop,TS val 1090039781 ecr 3412629414], length 1314
15:25:51.544900 IP 99.181.90.189.1935 > 10.8.2.2.58818: Flags [.], ack 154935, win 126, options [nop,nop,TS val 3412629514 ecr 1090039417], length 0
15:25:51.548569 IP 10.8.2.2.58818 > 99.181.90.189.1935: Flags [.], seq 164562:165876, ack 0, win 501, options [nop,nop,TS val 1090039845 ecr 3412629514], length 1314
15:25:51.581330 IP 10.8.2.2.58818 > 99.181.90.189.1935: Flags [.], seq 165876:167190, ack 0, win 501, options [nop,nop,TS val 1090039878 ecr 3412629514], length 1314
15:25:51.612689 IP 99.181.90.189.1935 > 10.8.2.2.58818: Flags [.], ack 157563, win 126, options [nop,nop,TS val 3412629581 ecr 1090039511], length 0
15:25:51.613051 IP 10.8.2.2.58818 > 99.181.90.189.1935: Flags [.], seq 167190:168504, ack 0, win 501, options [nop,nop,TS val 1090039910 ecr 3412629581], length 1314
15:25:51.677016 IP 10.8.2.2.58818 > 99.181.90.189.1935: Flags [.], seq 168504:169818, ack 0, win 501, options [nop,nop,TS val 1090039974 ecr 3412629581], length 1314
15:25:51.710270 IP 10.8.2.2.58818 > 99.181.90.189.1935: Flags [.], seq 169818:171132, ack 0, win 501, options [nop,nop,TS val 1090040007 ecr 3412629581], length 1314
15:25:51.711467 IP 99.181.90.189.1935 > 10.8.2.2.58818: Flags [.], ack 160191, win 126, options [nop,nop,TS val 3412629680 ecr 1090039611], length 0
15:25:51.719899 IP 99.181.90.189.1935 > 10.8.2.2.58818: Flags [.], ack 160620, win 126, options [nop,nop,TS val 3412629689 ecr 1090039653], length 0
15:25:51.719910 IP 10.8.2.2.58818 > 99.181.90.189.1935: Flags [P.], seq 171132:171549, ack 0, win 501, options [nop,nop,TS val 1090040017 ecr 3412629689], length 417
15:25:51.781367 IP 10.8.2.2.58818 > 99.181.90.189.1935: Flags [.], seq 171549:172863, ack 0, win 501, options [nop,nop,TS val 1090040078 ecr 3412629689], length 1314
15:25:51.813374 IP 99.181.90.189.1935 > 10.8.2.2.58818: Flags [.], ack 163248, win 126, options [nop,nop,TS val 3412629782 ecr 1090039711], length 0
15:25:51.815015 IP 10.8.2.2.58818 > 99.181.90.189.1935: Flags [.], seq 172863:174177, ack 0, win 501, options [nop,nop,TS val 1090040112 ecr 3412629782], length 1314
15:25:51.847871 IP 10.8.2.2.58818 > 99.181.90.189.1935: Flags [.], seq 174177:175491, ack 0, win 501, options [nop,nop,TS val 1090040145 ecr 3412629782], length 1314
15:25:51.912629 IP 99.181.90.189.1935 > 10.8.2.2.58818: Flags [.], ack 165876, win 126, options [nop,nop,TS val 3412629881 ecr 1090039781], length 0
15:25:51.914375 IP 10.8.2.2.58818 > 99.181.90.189.1935: Flags [.], seq 175491:176805, ack 0, win 501, options [nop,nop,TS val 1090040211 ecr 3412629881], length 1314
15:25:51.946406 IP 10.8.2.2.58818 > 99.181.90.189.1935: Flags [.], seq 176805:178119, ack 0, win 501, options [nop,nop,TS val 1090040243 ecr 3412629881], length 1314
15:25:51.977120 IP 99.181.90.189.1935 > 10.8.2.2.58818: Flags [.], ack 168504, win 126, options [nop,nop,TS val 3412629946 ecr 1090039878], length 0
15:25:51.981392 IP 10.8.2.2.58818 > 99.181.90.189.1935: Flags [.], seq 178119:179433, ack 0, win 501, options [nop,nop,TS val 1090040278 ecr 3412629946], length 1314
15:25:52.047179 IP 10.8.2.2.58818 > 99.181.90.189.1935: Flags [.], seq 179433:180747, ack 0, win 501, options [nop,nop,TS val 1090040344 ecr 3412629946], length 1314
15:25:52.074096 IP 99.181.90.189.1935 > 10.8.2.2.58818: Flags [.], ack 171132, win 126, options [nop,nop,TS val 3412630043 ecr 1090039974], length 0
15:25:52.083094 IP 10.8.2.2.58818 > 99.181.90.189.1935: Flags [.], seq 180747:182061, ack 0, win 501, options [nop,nop,TS val 1090040380 ecr 3412630043], length 1314
15:25:52.083854 IP 99.181.90.189.1935 > 10.8.2.2.58818: Flags [.], ack 171549, win 126, options [nop,nop,TS val 3412630053 ecr 1090040017], length 0
15:25:52.083869 IP 10.8.2.2.58818 > 99.181.90.189.1935: Flags [P.], seq 182061:182483, ack 0, win 501, options [nop,nop,TS val 1090040381 ecr 3412630053], length 422
15:25:52.146624 IP 10.8.2.2.58818 > 99.181.90.189.1935: Flags [.], seq 182483:183797, ack 0, win 501, options [nop,nop,TS val 1090040443 ecr 3412630053], length 1314
15:25:52.179450 IP 99.181.90.189.1935 > 10.8.2.2.58818: Flags [.], ack 174177, win 126, options [nop,nop,TS val 3412630148 ecr 1090040078], length 0
15:25:52.181021 IP 10.8.2.2.58818 > 99.181.90.189.1935: Flags [.], seq 183797:185111, ack 0, win 501, options [nop,nop,TS val 1090040478 ecr 3412630148], length 1314
15:25:52.214821 IP 10.8.2.2.58818 > 99.181.90.189.1935: Flags [.], seq 185111:186425, ack 0, win 501, options [nop,nop,TS val 1090040511 ecr 3412630148], length 1314
15:25:52.278687 IP 99.181.90.189.1935 > 10.8.2.2.58818: Flags [.], ack 176805, win 126, options [nop,nop,TS val 3412630247 ecr 1090040145], length 0
15:25:52.279723 IP 10.8.2.2.58818 > 99.181.90.189.1935: Flags [.], seq 186425:187739, ack 0, win 501, options [nop,nop,TS val 1090040576 ecr 3412630247], length 1314
15:25:52.314568 IP 10.8.2.2.58818 > 99.181.90.189.1935: Flags [.], seq 187739:189053, ack 0, win 501, options [nop,nop,TS val 1090040611 ecr 3412630247], length 1314
15:25:52.345716 IP 99.181.90.189.1935 > 10.8.2.2.58818: Flags [.], ack 179433, win 126, options [nop,nop,TS val 3412630314 ecr 1090040243], length 0
15:25:52.347616 IP 10.8.2.2.58818 > 99.181.90.189.1935: Flags [.], seq 189053:190367, ack 0, win 501, options [nop,nop,TS val 1090040644 ecr 3412630314], length 1314
15:25:52.412985 IP 10.8.2.2.58818 > 99.181.90.189.1935: Flags [.], seq 190367:191681, ack 0, win 501, options [nop,nop,TS val 1090040710 ecr 3412630314], length 1314
15:25:52.447164 IP 99.181.90.189.1935 > 10.8.2.2.58818: Flags [.], ack 182061, win 126, options [nop,nop,TS val 3412630416 ecr 1090040344], length 0
15:25:52.447586 IP 10.8.2.2.58818 > 99.181.90.189.1935: Flags [.], seq 191681:192995, ack 0, win 501, options [nop,nop,TS val 1090040744 ecr 3412630416], length 1314
15:25:52.447680 IP 99.181.90.189.1935 > 10.8.2.2.58818: Flags [.], ack 182483, win 126, options [nop,nop,TS val 3412630416 ecr 1090040381], length 0
15:25:52.447707 IP 10.8.2.2.58818 > 99.181.90.189.1935: Flags [P.], seq 192995:193416, ack 0, win 501, options [nop,nop,TS val 1090040744 ecr 3412630416], length 421
15:25:52.514806 IP 10.8.2.2.58818 > 99.181.90.189.1935: Flags [.], seq 193416:194730, ack 0, win 501, options [nop,nop,TS val 1090040811 ecr 3412630416], length 1314
15:25:52.544796 IP 10.8.2.2.58818 > 99.181.90.189.1935: Flags [.], seq 194730:196044, ack 0, win 501, options [nop,nop,TS val 1090040841 ecr 3412630416], length 1314
15:25:52.545182 IP 99.181.90.189.1935 > 10.8.2.2.58818: Flags [.], ack 185111, win 126, options [nop,nop,TS val 3412630514 ecr 1090040443], length 0
15:25:52.579845 IP 10.8.2.2.58818 > 99.181.90.189.1935: Flags [.], seq 196044:197358, ack 0, win 501, options [nop,nop,TS val 1090040877 ecr 3412630514], length 1314
15:25:52.643689 IP 99.181.90.189.1935 > 10.8.2.2.58818: Flags [.], ack 186425, win 126, options [nop,nop,TS val 3412630612 ecr 1090040511], length 0
15:25:52.647791 IP 10.8.2.2.58818 > 99.181.90.189.1935: Flags [.], seq 197358:198672, ack 0, win 501, options [nop,nop,TS val 1090040944 ecr 3412630612], length 1314
15:25:52.679582 IP 99.181.90.189.1935 > 10.8.2.2.58818: Flags [.], ack 189053, win 126, options [nop,nop,TS val 3412630648 ecr 1090040576], length 0
15:25:52.681904 IP 10.8.2.2.58818 > 99.181.90.189.1935: Flags [.], seq 198672:199986, ack 0, win 501, options [nop,nop,TS val 1090040979 ecr 3412630648], length 1314
15:25:52.712622 IP 10.8.2.2.58818 > 99.181.90.189.1935: Flags [.], seq 199986:201300, ack 0, win 501, options [nop,nop,TS val 1090041009 ecr 3412630648], length 1314
15:25:52.777848 IP 99.181.90.189.1935 > 10.8.2.2.58818: Flags [.], ack 191681, win 126, options [nop,nop,TS val 3412630746 ecr 1090040644], length 0
15:25:52.780328 IP 10.8.2.2.58818 > 99.181.90.189.1935: Flags [.], seq 201300:202614, ack 0, win 501, options [nop,nop,TS val 1090041077 ecr 3412630746], length 1314
15:25:52.811724 IP 99.181.90.189.1935 > 10.8.2.2.58818: Flags [.], ack 193416, win 126, options [nop,nop,TS val 3412630780 ecr 1090040744], length 0
15:25:52.811749 IP 10.8.2.2.58818 > 99.181.90.189.1935: Flags [P.], seq 202614:203503, ack 0, win 501, options [nop,nop,TS val 1090041108 ecr 3412630780], length 889
15:25:52.845679 IP 10.8.2.2.58818 > 99.181.90.189.1935: Flags [.], seq 203503:204817, ack 0, win 501, options [nop,nop,TS val 1090041142 ecr 3412630780], length 1314
15:25:52.880938 IP 10.8.2.2.58818 > 99.181.90.189.1935: Flags [.], seq 204817:206131, ack 0, win 501, options [nop,nop,TS val 1090041178 ecr 3412630780], length 1314
