16:20:01.346271 IP 52.223.227.8.1935 > 10.8.1.3.40112: Flags [.], ack 3873048303, win 126, options [nop,nop,TS val 3662639399 ecr 1525241555], length 0
16:20:01.368306 IP 10.8.1.3.40112 > 52.223.227.8.1935: Flags [.], seq 9533:10847, ack 0, win 501, options [nop,nop,TS val 1525241961 ecr 3662639399], length 1314
16:20:01.404948 IP 10.8.1.3.40112 > 52.223.227.8.1935: Flags [.], seq 10847:12161, ack 0, win 501, options [nop,nop,TS val 1525241997 ecr 3662639399], length 1314
16:20:01.450003 IP 52.223.227.8.1935 > 10.8.1.3.40112: Flags [.], ack 2629, win 126, options [nop,nop,TS val 3662639503 ecr 1525241640], length 0
16:20:01.469361 IP 10.8.1.3.40112 > 52.223.227.8.1935: Flags [.], seq 12161:13475, ack 0, win 501, options [nop,nop,TS val 1525242062 ecr 3662639503], length 1314
16:20:01.496313 IP 10.8.1.3.40112 > 52.223.227.8.1935: Flags [.], seq 13475:14789, ack 0, win 501, options [nop,nop,TS val 1525242089 ecr 3662639503], length 1314
16:20:01.520483 IP 52.223.227.8.1935 > 10.8.1.3.40112: Flags [.], ack 5257, win 126, options [nop,nop,TS val 3662639574 ecr 1525241726], length 0
16:20:01.534683 IP 10.8.1.3.40112 > 52.223.227.8.1935: Flags [.], seq 14789:16103, ack 0, win 501, options [nop,nop,TS val 1525242127 ecr 3662639574], length 1314
16:20:01.602845 IP 10.8.1.3.40112 > 52.223.227.8.1935: Flags [.], seq 16103:17417, ack 0, win 501, options [nop,nop,TS val 1525242195 ecr 3662639574], length 1314
16:20:01.605760 IP 52.223.227.8.1935 > 10.8.1.3.40112: Flags [.], ack 7885, win 126, options [nop,nop,TS val 3662639659 ecr 1525241829], length 0
16:20:01.615428 IP 52.223.227.8.1935 > 10.8.1.3.40112: Flags [.], ack 8219, win 126, options [nop,nop,TS val 3662639668 ecr 1525241864], length 0
16:20:01.615461 IP 10.8.1.3.40112 > 52.223.227.8.1935: Flags [P.], seq 17417:18202, ack 0, win 501, options [nop,nop,TS val 1525242208 ecr 3662639668], length 785
16:20:01.666952 IP 10.8.1.3.40112 > 52.223.227.8.1935: Flags [.], seq 18202:19516, ack 0, win 501, options [nop,nop,TS val 1525242259 ecr 3662639668], length 1314
16:20:01.702616 IP 10.8.1.3.40112 > 52.223.227.8.1935: Flags [.], seq 19516:20830, ack 0, win 501, options [nop,nop,TS val 1525242295 ecr 3662639668], length 1314
16:20:01.712759 IP 52.223.227.8.1935 > 10.8.1.3.40112: Flags [.], ack 10847, win 126, options [nop,nop,TS val 3662639766 ecr 1525241918], length 0
16:20:01.738057 IP 10.8.1.3.40112 > 52.223.227.8.1935: Flags [.], seq 20830:22144, ack 0, win 501, options [nop,nop,TS val 1525242330 ecr 3662639766], length 1314
16:20:01.795042 IP 10.8.1.3.40112 > 52.223.227.8.1935: Flags [.], seq 22144:23458, ack 0, win 501, options [nop,nop,TS val 1525242387 ecr 3662639766], length 1314
16:20:01.814178 IP 52.223.227.8.1935 > 10.8.1.3.40112: Flags [.], ack 13475, win 126, options [nop,nop,TS val 3662639867 ecr 1525241997], length 0
16:20:01.837945 IP 10.8.1.3.40112 > 52.223.227.8.1935: Flags [.], seq 23458:24772, ack 0, win 501, options [nop,nop,TS val 1525242430 ecr 3662639867], length 1314
16:20:01.868934 IP 10.8.1.3.40112 > 52.223.227.8.1935: Flags [.], seq 24772:26086, ack 0, win 501, options [nop,nop,TS val 1525242461 ecr 3662639867], length 1314
16:20:01.879103 IP 52.223.227.8.1935 > 10.8.1.3.40112: Flags [.], ack 16103, win 126, options [nop,nop,TS val 3662639932 ecr 1525242089], length 0
16:20:01.934544 IP 10.8.1.3.40112 > 52.223.227.8.1935: Flags [.], seq 26086:27400, ack 0, win 501, options [nop,nop,TS val 1525242527 ecr 3662639932], length 1314
16:20:01.959828 IP 52.223.227.8.1935 > 10.8.1.3.40112: Flags [.], ack 18202, win 126, options [nop,nop,TS val 3662640013 ecr 1525242195], length 0
16:20:01.959841 IP 10.8.1.3.40112 > 52.223.227.8.1935: Flags [P.], seq 27400:28200, ack 0, win 501, options [nop,nop,TS val 1525242552 ecr 3662640013], length 800
16:20:02.001993 IP 10.8.1.3.40112 > 52.223.227.8.1935: Flags [.], seq 28200:29514, ack 0, win 501, options [nop,nop,TS val 1525242594 ecr 3662640013], length 1314
16:20:02.029654 IP 10.8.1.3.40112 > 52.223.227.8.1935: Flags [.], seq 29514:30828, ack 0, win 501, options [nop,nop,TS val 1525242622 ecr 3662640013], length 1314
16:20:02.047144 IP 52.223.227.8.1935 > 10.8.1.3.40112: Flags [.], ack 20830, win 126, options [nop,nop,TS val 3662640100 ecr 1525242259], length 0
16:20:02.072673 IP 10.8.1.3.40112 > 52.223.227.8.1935: Flags [.], seq 30828:32142, ack 0, win 501, options [nop,nop,TS val 1525242665 ecr 3662640100], length 1314
16:20:02.135474 IP 10.8.1.3.40112 > 52.223.227.8.1935: Flags [.], seq 32142:33456, ack 0, win 501, options [nop,nop,TS val 1525242728 ecr 3662640100], length 1314
16:20:02.139492 IP 52.223.227.8.1935 > 10.8.1.3.40112: Flags [.], ack 23458, win 126, options [nop,nop,TS val 3662640193 ecr 1525242330], length 0
16:20:02.169896 IP 10.8.1.3.40112 > 52.223.227.8.1935: Flags [.], seq 33456:34770, ack 0, win 501, options [nop,nop,TS val 1525242762 ecr 3662640193], length 1314
16:20:02.205549 IP 10.8.1.3.40112 > 52.223.227.8.1935: Flags [.], seq 34770:36084, ack 0, win 501, options [nop,nop,TS val 1525242798 ecr 3662640193], length 1314
16:20:02.223542 IP 52.223.227.8.1935 > 10.8.1.3.40112: Flags [.], ack 26086, win 126, options [nop,nop,TS val 3662640268 ecr 1525242430], length 0
16:20:02.264770 IP 10.8.1.3.40112 > 52.223.227.8.1935: Flags [.], seq 36084:37398, ack 0, win 501, options [nop,nop,TS val 1525242857 ecr 3662640268], length 1314
16:20:02.302629 IP 10.8.1.3.40112 > 52.223.227.8.1935: Flags [.], seq 37398:38712, ack 0, win 501, options [nop,nop,TS val 1525242895 ecr 3662640268], length 1314
16:20:02.305520 IP 52.223.227.8.1935 > 10.8.1.3.40112: Flags [.], ack 28200, win 126, options [nop,nop,TS val 3662640359 ecr 1525242527], length 0
16:20:02.305543 IP 10.8.1.3.40112 > 52.223.227.8.1935: Flags [P.], seq 38712:39034, ack 0, win 501, options [nop,nop,TS val 1525242898 ecr 3662640359], length 322
16:20:02.369396 IP 10.8.1.3.40112 > 52.223.227.8.1935: Flags [.], seq 39034:40348, ack 0, win 501, options [nop,nop,TS val 1525242962 ecr 3662640359], length 1314
16:20:02.374085 IP 52.223.227.8.1935 > 10.8.1.3.40112: Flags [.], ack 30828, win 126, options [nop,nop,TS val 3662640427 ecr 1525242594], length 0
16:20:02.392449 IP 10.8.1.3.40112 > 52.223.227.8.1935: Flags [.], seq 40348:41662, ack 0, win 501, options [nop,nop,TS val 1525242985 ecr 3662640427], length 1314
16:20:02.435447 IP 10.8.1.3.40112 > 52.223.227.8.1935: Flags [.], seq 41662:42976, ack 0, win 501, options [nop,nop,TS val 1525243028 ecr 3662640427], length 1314
16:20:02.480162 IP 52.223.227.8.1935 > 10.8.1.3.40112: Flags [.], ack 33456, win 126, options [nop,nop,TS val 3662640533 ecr 1525242665], length 0
16:20:02.499780 IP 10.8.1.3.40112 > 52.223.227.8.1935: Flags [.], seq 42976:44290, ack 0, win 501, options [nop,nop,TS val 1525243092 ecr 3662640533], length 1314
16:20:02.534864 IP 10.8.1.3.40112 > 52.223.227.8.1935: Flags [.], seq 44290:45604, ack 0, win 501, options [nop,nop,TS val 1525243127 ecr 3662640533], length 1314
16:20:02.550082 IP 52.223.227.8.1935 > 10.8.1.3.40112: Flags [.], ack 36084, win 126, options [nop,nop,TS val 3662640603 ecr 1525242762], length 0
16:20:02.563652 IP 10.8.1.3.40112 > 52.223.227.8.1935: Flags [.], seq 45604:46918, ack 0, win 501, options [nop,nop,TS val 1525243156 ecr 3662640603], length 1314
16:20:02.627234 IP 10.8.1.3.40112 > 52.223.227.8.1935: Flags [.], seq 46918:48232, ack 0, win 501, options [nop,nop,TS val 1525243220 ecr 3662640603], length 1314
16:20:02.647143 IP 52.223.227.8.1935 > 10.8.1.3.40112: Flags [.], ack 38712, win 126, options [nop,nop,TS val 3662640700 ecr 1525242857], length 0
16:20:02.649708 IP 52.223.227.8.1935 > 10.8.1.3.40112: Flags [.], ack 39034, win 126, options [nop,nop,TS val 3662640703 ecr 1525242898], length 0
16:20:02.649727 IP 10.8.1.3.40112 > 52.223.227.8.1935: Flags [P.], seq 48232:49121, ack 0, win 501, options [nop,nop,TS val 1525243242 ecr 3662640703], length 889
16:20:02.706228 IP 10.8.1.3.40112 > 52.223.227.8.1935: Flags [.], seq 49121:50435, ack 0, win 501, options [nop,nop,TS val 1525243299 ecr 3662640703], length 1314
16:20:02.734230 IP 10.8.1.3.40112 > 52.223.227.8.1935: Flags [.], seq 50435:51749, ack 0, win 501, options [nop,nop,TS val 1525243327 ecr 3662640703], length 1314
16:20:02.736912 IP 52.223.227.8.1935 > 10.8.1.3.40112: Flags [.], ack 41662, win 126, options [nop,nop,TS val 3662640790 ecr 1525242962], length 0
16:20:02.776831 IP 10.8.1.3.40112 > 52.223.227.8.1935: Flags [.], seq 51749:53063, ack 0, win 501, options [nop,nop,TS val 1525243369 ecr 3662640790], length 1314
16:20:02.837042 IP 10.8.1.3.40112 > 52.223.227.8.1935: Flags [.], seq 53063:54377, ack 0, win 501, options [nop,nop,TS val 1525243429 ecr 3662640790], length 1314
16:20:02.844611 IP 52.223.227.8.1935 > 10.8.1.3.40112: Flags [.], ack 44290, win 126, options [nop,nop,TS val 3662640897 ecr 1525243028], length 0
16:20:02.862020 IP 10.8.1.3.40112 > 52.223.227.8.1935: Flags [.], seq 54377:55691, ack 0, win 501, options [nop,nop,TS val 1525243454 ecr 3662640897], length 1314
16:20:02.904472 IP 10.8.1.3.40112 > 52.223.227.8.1935: Flags [.], seq 55691:57005, ack 0, win 501, options [nop,nop,TS val 1525243497 ecr 3662640897], length 1314
16:20:02.907845 IP 52.223.227.8.1935 > 10.8.1.3.40112: Flags [.], ack 46918, win 126, options [nop,nop,TS val 3662640961 ecr 1525243127], length 0
16:20:02.968517 IP 10.8.1.3.40112 > 52.223.227.8.1935: Flags [.], seq 57005:58319, ack 0, win 501, options [nop,nop,TS val 1525243561 ecr 3662640961], length 1314
16:20:02.994103 IP 52.223.227.8.1935 > 10.8.1.3.40112: Flags [.], ack 49121, win 126, options [nop,nop,TS val 3662641047 ecr 1525243220], length 0
16:20:02.994117 IP 10.8.1.3.40112 > 52.223.227.8.1935: Flags [P.], seq 58319:59116, ack 0, win 501, options [nop,nop,TS val 1525243586 ecr 3662641047], length 797
16:20:03.032030 IP 10.8.1.3.40112 > 52.223.227.8.1935: Flags [.], seq 59116:60430, ack 0, win 501, options [nop,nop,TS val 1525243624 ecr 3662641047], length 1314
16:20:03.068656 IP 10.8.1.3.40112 > 52.223.227.8.1935: Flags [.], seq 60430:61744, ack 0, win 501, options [nop,nop,TS val 1525243661 ecr 3662641047], length 1314
16:20:03.078586 IP 52.223.227.8.1935 > 10.8.1.3.40112: Flags [.], ack 51749, win 126, options [nop,nop,TS val 3662641132 ecr 1525243299], length 0
16:20:03.117218 IP 10.8.1.3.40112 > 52.223.227.8.1935: Flags [.], seq 61744:63058, ack 0, win 501, options [nop,nop,TS val 1525243710 ecr 3662641132], length 1314
16:20:03.159720 IP 10.8.1.3.40112 > 52.223.227.8.1935: Flags [.], seq 63058:64372, ack 0, win 501, options [nop,nop,TS val 1525243752 ecr 3662641132], length 1314
16:20:03.181345 IP 52.223.227.8.1935 > 10.8.1.3.40112: Flags [.], ack 54377, win 126, options [nop,nop,TS val 3662641234 ecr 1525243369], length 0
16:20:03.202656 IP 10.8.1.3.40112 > 52.223.227.8.1935: Flags [.], seq 64372:65686, ack 0, win 501, options [nop,nop,TS val 1525243795 ecr 3662641234], length 1314
16:20:03.245788 IP 10.8.1.3.40112 > 52.223.227.8.1935: Flags [.], seq 65686:67000, ack 0, win 501, options [nop,nop,TS val 1525243838 ecr 3662641234], length 1314
16:20:03.248932 IP 52.223.227.8.1935 > 10.8.1.3.40112: Flags [.], ack 57005, win 126, options [nop,nop,TS val 3662641302 ecr 1525243454], length 0
16:20:03.303843 IP 10.8.1.3.40112 > 52.223.227.8.1935: Flags [.], seq 67000:68314, ack 0, win 501, options [nop,nop,TS val 1525243896 ecr 3662641302], length 1314
16:20:03.331399 IP 10.8.1.3.40112 > 52.223.227.8.1935: Flags [.], seq 68314:69628, ack 0, win 501, options [nop,nop,TS val 1525243924 ecr 3662641302], length 1314
16:20:03.338173 IP 52.223.227.8.1935 > 10.8.1.3.40112: Flags [.], ack 59116, win 126, options [nop,nop,TS val 3662641391 ecr 1525243561], length 0
16:20:03.338192 IP 10.8.1.3.40112 > 52.223.227.8.1935: Flags [P.], seq 69628:69950, ack 0, win 501, options [nop,nop,TS val 1525243931 ecr 3662641391], length 322
16:20:03.395415 IP 10.8.1.3.40112 > 52.223.227.8.1935: Flags [.], seq 69950:71264, ack 0, win 501, options [nop,nop,TS val 1525243988 ecr 3662641391], length 1314
16:20:03.412937 IP 52.223.227.8.1935 > 10.8.1.3.40112: Flags [.], ack 61744, win 126, options [nop,nop,TS val 3662641466 ecr 1525243624], length 0
16:20:03.437689 IP 10.8.1.3.40112 > 52.223.227.8.1935: Flags [.], seq 71264:72578, ack 0, win 501, options [nop,nop,TS val 1525244030 ecr 3662641466], length 1314
16:20:03.472262 IP 10.8.1.3.40112 > 52.223.227.8.1935: Flags [.], seq 72578:73892, ack 0, win 501, options [nop,nop,TS val 1525244065 ecr 3662641466], length 1314
16:20:03.504168 IP 52.223.227.8.1935 > 10.8.1.3.40112: Flags [.], ack 64372, win 126, options [nop,nop,TS val 3662641557 ecr 1525243710], length 0
16:20:03.539033 IP 10.8.1.3.40112 > 52.223.227.8.1935: Flags [.], seq 73892:75206, ack 0, win 501, options [nop,nop,TS val 1525244131 ecr 3662641557], length 1314
16:20:03.566903 IP 10.8.1.3.40112 > 52.223.227.8.1935: Flags [.], seq 75206:76520, ack 0, win 501, options [nop,nop,TS val 1525244159 ecr 3662641557], length 1314
16:20:03.590561 IP 52.223.227.8.1935 > 10.8.1.3.40112: Flags [.], ack 67000, win 126, options [nop,nop,TS val 3662641643 ecr 1525243795], length 0
16:20:03.602567 IP 10.8.1.3.40112 > 52.223.227.8.1935: Flags [.], seq 76520:77834, ack 0, win 501, options [nop,nop,TS val 1525244195 ecr 3662641643], length 1314
16:20:03.668123 IP 10.8.1.3.40112 > 52.223.227.8.1935: Flags [.], seq 77834:79148, ack 0, win 501, options [nop,nop,TS val 1525244260 ecr 3662641643], length 1314
16:20:03.675674 IP 52.223.227.8.1935 > 10.8.1.3.40112: Flags [.], ack 69628, win 126, options [nop,nop,TS val 3662641729 ecr 1525243896], length 0
16:20:03.682355 IP 52.223.227.8.1935 > 10.8.1.3.40112: Flags [.], ack 69950, win 126, options [nop,nop,TS val 3662641735 ecr 1525243931], length 0
16:20:03.682365 IP 10.8.1.3.40112 > 52.223.227.8.1935: Flags [P.], seq 79148:79949, ack 0, win 501, options [nop,nop,TS val 1525244275 ecr 3662641735], length 801
16:20:03.737420 IP 10.8.1.3.40112 > 52.223.227.8.1935: Flags [.], seq 79949:81263, ack 0, win 501, options [nop,nop,TS val 1525244330 ecr 3662641735], length 1314
16:20:03.772387 IP 10.8.1.3.40112 > 52.223.227.8.1935: Flags [.], seq 81263:82577, ack 0, win 501, options [nop,nop,TS val 1525244365 ecr 3662641735], length 1314
16:20:03.782212 IP 52.223.227.8.1935 > 10.8.1.3.40112: Flags [.], ack 72578, win 126, options [nop,nop,TS val 3662641835 ecr 1525243988], length 0
16:20:03.805601 IP 10.8.1.3.40112 > 52.223.227.8.1935: Flags [.], seq 82577:83891, ack 0, win 501, options [nop,nop,TS val 1525244398 ecr 3662641835], length 1314
16:20:03.865915 IP 10.8.1.3.40112 > 52.223.227.8.1935: Flags [.], seq 83891:85205, ack 0, win 501, options [nop,nop,TS val 1525244458 ecr 3662641835], length 1314
16:20:03.883763 IP 52.223.227.8.1935 > 10.8.1.3.40112: Flags [.], ack 75206, win 126, options [nop,nop,TS val 3662641937 ecr 1525244065], length 0
16:20:03.902707 IP 10.8.1.3.40112 > 52.223.227.8.1935: Flags [.], seq 85205:86519, ack 0, win 501, options [nop,nop,TS val 1525244495 ecr 3662641937], length 1314
16:20:03.934762 IP 10.8.1.3.40112 > 52.223.227.8.1935: Flags [.], seq 86519:87833, ack 0, win 501, options [nop,nop,TS val 1525244527 ecr 3662641937], length 1314
16:20:03.947175 IP 52.223.227.8.1935 > 10.8.1.3.40112: Flags [.], ack 77834, win 126, options [nop,nop,TS val 3662642000 ecr 1525244159], length 0
16:20:03.993712 IP 10.8.1.3.40112 > 52.223.227.8.1935: Flags [.], seq 87833:89147, ack 0, win 501, options [nop,nop,TS val 1525244586 ecr 3662642000], length 1314
16:20:04.026859 IP 52.223.227.8.1935 > 10.8.1.3.40112: Flags [.], ack 79949, win 126, options [nop,nop,TS val 3662642080 ecr 1525244260], length 0
16:20:04.026899 IP 10.8.1.3.40112 > 52.223.227.8.1935: Flags [P.], seq 89147:89927, ack 0, win 501, options [nop,nop,TS val 1525244619 ecr 3662642080], length 780
16:20:04.072005 IP 10.8.1.3.40112 > 52.223.227.8.1935: Flags [.], seq 89927:91241, ack 0, win 501, options [nop,nop,TS val 1525244664 ecr 3662642080], length 1314
16:20:04.101043 IP 10.8.1.3.40112 > 52.223.227.8.1935: Flags [.], seq 91241:92555, ack 0, win 501, options [nop,nop,TS val 1525244693 ecr 3662642080], length 1314
16:20:04.116987 IP 52.223.227.8.1935 > 10.8.1.3.40112: Flags [.], ack 82577, win 126, options [nop,nop,TS val 3662642170 ecr 1525244330], length 0
16:20:04.143865 IP 10.8.1.3.40112 > 52.223.227.8.1935: Flags [.], seq 92555:93869, ack 0, win 501, options [nop,nop,TS val 1525244736 ecr 3662642170], length 1314
16:20:04.205177 IP 10.8.1.3.40112 > 52.223.227.8.1935: Flags [.], seq 93869:95183, ack 0, win 501, options [nop,nop,TS val 1525244797 ecr 3662642170], length 1314
16:20:04.210640 IP 52.223.227.8.1935 > 10.8.1.3.40112: Flags [.], ack 85205, win 126, options [nop,nop,TS val 3662642264 ecr 1525244398], length 0
16:20:04.229549 IP 10.8.1.3.40112 > 52.223.227.8.1935: Flags [.], seq 95183:96497, ack 0, win 501, options [nop,nop,TS val 1525244822 ecr 3662642264], length 1314
16:20:04.272001 IP 10.8.1.3.40112 > 52.223.227.8.1935: Flags [.], seq 96497:97811, ack 0, win 501, options [nop,nop,TS val 1525244864 ecr 3662642264], length 1314
16:20:04.279174 IP 52.223.227.8.1935 > 10.8.1.3.40112: Flags [.], ack 87833, win 126, options [nop,nop,TS val 3662642332 ecr 1525244495], length 0
16:20:04.334811 IP 10.8.1.3.40112 > 52.223.227.8.1935: Flags [.], seq 97811:99125, ack 0, win 501, options [nop,nop,TS val 1525244927 ecr 3662642332], length 1314
16:20:04.369608 IP 10.8.1.3.40112 > 52.223.227.8.1935: Flags [.], seq 99125:100439, ack 0, win 501, options [nop,nop,TS val 1525244962 ecr 3662642332], length 1314
16:20:04.371352 IP 52.223.227.8.1935 > 10.8.1.3.40112: Flags [.], ack 89927, win 126, options [nop,nop,TS val 3662642424 ecr 1525244586], length 0
16:20:04.371373 IP 10.8.1.3.40112 > 52.223.227.8.1935: Flags [P.], seq 100439:100774, ack 0, win 501, options [nop,nop,TS val 1525244964 ecr 3662642424], length 335
16:20:04.438932 IP 10.8.1.3.40112 > 52.223.227.8.1935: Flags [.], seq 100774:102088, ack 0, win 501, options [nop,nop,TS val 1525245031 ecr 3662642424], length 1314
16:20:04.445115 IP 52.223.227.8.1935 > 10.8.1.3.40112: Flags [.], ack 92555, win 126, options [nop,nop,TS val 3662642498 ecr 1525244664], length 0
16:20:04.463872 IP 10.8.1.3.40112 > 52.223.227.8.1935: Flags [.], seq 102088:103402, ack 0, win 501, options [nop,nop,TS val 1525245056 ecr 3662642498], length 1314
16:20:04.502116 IP 10.8.1.3.40112 > 52.223.227.8.1935: Flags [.], seq 103402:104716, ack 0, win 501, options [nop,nop,TS val 1525245094 ecr 3662642498], length 1314
16:20:04.549562 IP 52.223.227.8.1935 > 10.8.1.3.40112: Flags [.], ack 95183, win 126, options [nop,nop,TS val 3662642603 ecr 1525244736], length 0
16:20:04.570977 IP 10.8.1.3.40112 > 52.223.227.8.1935: Flags [.], seq 104716:106030, ack 0, win 501, options [nop,nop,TS val 1525245163 ecr 3662642603], length 1314
16:20:04.605443 IP 10.8.1.3.40112 > 52.223.227.8.1935: Flags [.], seq 106030:107344, ack 0, win 501, options [nop,nop,TS val 1525245198 ecr 3662642603], length 1314
16:20:04.616585 IP 52.223.227.8.1935 > 10.8.1.3.40112: Flags [.], ack 97811, win 126, options [nop,nop,TS val 3662642669 ecr 1525244822], length 0
16:20:04.635359 IP 10.8.1.3.40112 > 52.223.227.8.1935: Flags [.], seq 107344:108658, ack 0, win 501, options [nop,nop,TS val 1525245228 ecr 3662642669], length 1314
16:20:04.699345 IP 10.8.1.3.40112 > 52.223.227.8.1935: Flags [.], seq 108658:109972, ack 0, win 501, options [nop,nop,TS val 1525245292 ecr 3662642669], length 1314
16:20:04.714381 IP 52.223.227.8.1935 > 10.8.1.3.40112: Flags [.], ack 100439, win 126, options [nop,nop,TS val 3662642767 ecr 1525244927], length 0
16:20:04.715539 IP 52.223.227.8.1935 > 10.8.1.3.40112: Flags [.], ack 100774, win 126, options [nop,nop,TS val 3662642769 ecr 1525244964], length 0
16:20:04.715566 IP 10.8.1.3.40112 > 52.223.227.8.1935: Flags [P.], seq 109972:110765, ack 0, win 501, options [nop,nop,TS val 1525245308 ecr 3662642769], length 793
16:20:04.763388 IP 10.8.1.3.40112 > 52.223.227.8.1935: Flags [.], seq 110765:112079, ack 0, win 501, options [nop,nop,TS val 1525245356 ecr 3662642769], length 1314
16:20:04.803871 IP 10.8.1.3.40112 > 52.223.227.8.1935: Flags [.], seq 112079:113393, ack 0, win 501, options [nop,nop,TS val 1525245396 ecr 3662642769], length 1314
16:20:04.808162 IP 52.223.227.8.1935 > 10.8.1.3.40112: Flags [.], ack 103402, win 126, options [nop,nop,TS val 3662642861 ecr 1525245031], length 0
16:20:04.837405 IP 10.8.1.3.40112 > 52.223.227.8.1935: Flags [.], seq 113393:114707, ack 0, win 501, options [nop,nop,TS val 1525245430 ecr 3662642861], length 1314
16:20:04.901743 IP 10.8.1.3.40112 > 52.223.227.8.1935: Flags [.], seq 114707:116021, ack 0, win 501, options [nop,nop,TS val 1525245494 ecr 3662642861], length 1314
16:20:04.912623 IP 52.223.227.8.1935 > 10.8.1.3.40112: Flags [.], ack 104716, win 126, options [nop,nop,TS val 3662642966 ecr 1525245094], length 0
16:20:04.933761 IP 10.8.1.3.40112 > 52.223.227.8.1935: Flags [.], seq 116021:117335, ack 0, win 501, options [nop,nop,TS val 1525245526 ecr 3662642966], length 1314
16:20:04.949827 IP 52.223.227.8.1935 > 10.8.1.3.40112: Flags [.], ack 107344, win 126, options [nop,nop,TS val 3662643003 ecr 1525245163], length 0
16:20:04.972370 IP 10.8.1.3.40112 > 52.223.227.8.1935: Flags [.], seq 117335:118649, ack 0, win 501, options [nop,nop,TS val 1525245565 ecr 3662643003], length 1314
16:20:05.036190 IP 10.8.1.3.40112 > 52.223.227.8.1935: Flags [.], seq 118649:119963, ack 0, win 501, options [nop,nop,TS val 1525245629 ecr 3662643003], length 1314
16:20:05.047175 IP 52.223.227.8.1935 > 10.8.1.3.40112: Flags [.], ack 109972, win 126, options [nop,nop,TS val 3662643097 ecr 1525245228], length 0
16:20:05.059804 IP 52.223.227.8.1935 > 10.8.1.3.40112: Flags [.], ack 110765, win 126, options [nop,nop,TS val 3662643113 ecr 1525245308], length 0
16:20:05.059827 IP 10.8.1.3.40112 > 52.223.227.8.1935: Flags [P.], seq 119963:120755, ack 0, win 501, options [nop,nop,TS val 1525245652 ecr 3662643113], length 792
16:20:05.105446 IP 10.8.1.3.40112 > 52.223.227.8.1935: Flags [.], seq 120755:122069, ack 0, win 501, options [nop,nop,TS val 1525245698 ecr 3662643113], length 1314
16:20:05.139044 IP 10.8.1.3.40112 > 52.223.227.8.1935: Flags [.], seq 122069:123383, ack 0, win 501, options [nop,nop,TS val 1525245731 ecr 3662643113], length 1314
16:20:05.148463 IP 52.223.227.8.1935 > 10.8.1.3.40112: Flags [.], ack 113393, win 126, options [nop,nop,TS val 3662643201 ecr 1525245356], length 0
16:20:05.169679 IP 10.8.1.3.40112 > 52.223.227.8.1935: Flags [.], seq 123383:124697, ack 0, win 501, options [nop,nop,TS val 1525245762 ecr 3662643201], length 1314
16:20:05.233950 IP 10.8.1.3.40112 > 52.223.227.8.1935: Flags [.], seq 124697:126011, ack 0, win 501, options [nop,nop,TS val 1525245826 ecr 3662643201], length 1314
16:20:05.246029 IP 52.223.227.8.1935 > 10.8.1.3.40112: Flags [.], ack 116021, win 126, options [nop,nop,TS val 3662643299 ecr 1525245430], length 0
16:20:05.272276 IP 10.8.1.3.40112 > 52.223.227.8.1935: Flags [.], seq 126011:127325, ack 0, win 501, options [nop,nop,TS val 1525245865 ecr 3662643299], length 1314
16:20:05.303012 IP 10.8.1.3.40112 > 52.223.227.8.1935: Flags [.], seq 127325:128639, ack 0, win 501, options [nop,nop,TS val 1525245895 ecr 3662643299], length 1314
16:20:05.316831 IP 52.223.227.8.1935 > 10.8.1.3.40112: Flags [.], ack 118649, win 126, options [nop,nop,TS val 3662643370 ecr 1525245526], length 0
16:20:05.369570 IP 10.8.1.3.40112 > 52.223.227.8.1935: Flags [.], seq 128639:129953, ack 0, win 501, options [nop,nop,TS val 1525245962 ecr 3662643370], length 1314
16:20:05.401516 IP 10.8.1.3.40112 > 52.223.227.8.1935: Flags [.], seq 129953:131267, ack 0, win 501, options [nop,nop,TS val 1525245994 ecr 3662643370], length 1314
16:20:05.404090 IP 52.223.227.8.1935 > 10.8.1.3.40112: Flags [.], ack 120755, win 126, options [nop,nop,TS val 3662643457 ecr 1525245629], length 0
16:20:05.404104 IP 10.8.1.3.40112 > 52.223.227.8.1935: Flags [P.], seq 131267:131598, ack 0, win 501, options [nop,nop,TS val 1525245996 ecr 3662643457], length 331
16:20:05.468570 IP 10.8.1.3.40112 > 52.223.227.8.1935: Flags [.], seq 131598:132912, ack 0, win 501, options [nop,nop,TS val 1525246061 ecr 3662643457], length 1314
16:20:05.483664 IP 52.223.227.8.1935 > 10.8.1.3.40112: Flags [.], ack 123383, win 126, options [nop,nop,TS val 3662643537 ecr 1525245698], length 0
16:20:05.505836 IP 10.8.1.3.40112 > 52.223.227.8.1935: Flags [.], seq 132912:134226, ack 0, win 501, options [nop,nop,TS val 1525246098 ecr 3662643537], length 1314
16:20:05.533079 IP 10.8.1.3.40112 > 52.223.227.8.1935: Flags [.], seq 134226:135540, ack 0, win 501, options [nop,nop,TS val 1525246125 ecr 3662643537], length 1314
16:20:05.578498 IP 52.223.227.8.1935 > 10.8.1.3.40112: Flags [.], ack 126011, win 126, options [nop,nop,TS val 3662643632 ecr 1525245762], length 0
16:20:05.597157 IP 10.8.1.3.40112 > 52.223.227.8.1935: Flags [.], seq 135540:136854, ack 0, win 501, options [nop,nop,TS val 1525246189 ecr 3662643632], length 1314
16:20:05.638613 IP 10.8.1.3.40112 > 52.223.227.8.1935: Flags [.], seq 136854:138168, ack 0, win 501, options [nop,nop,TS val 1525246231 ecr 3662643632], length 1314
16:20:05.647493 IP 52.223.227.8.1935 > 10.8.1.3.40112: Flags [.], ack 128639, win 126, options [nop,nop,TS val 3662643701 ecr 1525245865], length 0
16:20:05.671767 IP 10.8.1.3.40112 > 52.223.227.8.1935: Flags [.], seq 138168:139482, ack 0, win 501, options [nop,nop,TS val 1525246264 ecr 3662643701], length 1314
16:20:05.736197 IP 10.8.1.3.40112 > 52.223.227.8.1935: Flags [.], seq 139482:140796, ack 0, win 501, options [nop,nop,TS val 1525246329 ecr 3662643701], length 1314
16:20:05.745572 IP 52.223.227.8.1935 > 10.8.1.3.40112: Flags [.], ack 131267, win 126, options [nop,nop,TS val 3662643799 ecr 1525245962], length 0
16:20:05.748336 IP 52.223.227.8.1935 > 10.8.1.3.40112: Flags [.], ack 131598, win 126, options [nop,nop,TS val 3662643802 ecr 1525245996], length 0
16:20:05.748354 IP 10.8.1.3.40112 > 52.223.227.8.1935: Flags [P.], seq 140796:141675, ack 0, win 501, options [nop,nop,TS val 1525246341 ecr 3662643802], length 879
16:20:05.805754 IP 10.8.1.3.40112 > 52.223.227.8.1935: Flags [.], seq 141675:142989, ack 0, win 501, options [nop,nop,TS val 1525246398 ecr 3662643802], length 1314
16:20:05.832502 IP 10.8.1.3.40112 > 52.223.227.8.1935: Flags [.], seq 142989:144303, ack 0, win 501, options [nop,nop,TS val 1525246425 ecr 3662643802], length 1314
16:20:05.850235 IP 52.223.227.8.1935 > 10.8.1.3.40112: Flags [.], ack 134226, win 126, options [nop,nop,TS val 3662643903 ecr 1525246061], length 0
16:20:05.875470 IP 10.8.1.3.40112 > 52.223.227.8.1935: Flags [.], seq 144303:145617, ack 0, win 501, options [nop,nop,TS val 1525246468 ecr 3662643903], length 1314
16:20:05.934688 IP 10.8.1.3.40112 > 52.223.227.8.1935: Flags [.], seq 145617:146931, ack 0, win 501, options [nop,nop,TS val 1525246527 ecr 3662643903], length 1314
16:20:05.940647 IP 52.223.227.8.1935 > 10.8.1.3.40112: Flags [.], ack 135540, win 126, options [nop,nop,TS val 3662643994 ecr 1525246125], length 0
16:20:05.968223 IP 10.8.1.3.40112 > 52.223.227.8.1935: Flags [.], seq 146931:148245, ack 0, win 501, options [nop,nop,TS val 1525246561 ecr 3662643994], length 1314
16:20:05.982997 IP 52.223.227.8.1935 > 10.8.1.3.40112: Flags [.], ack 138168, win 126, options [nop,nop,TS val 3662644036 ecr 1525246189], length 0
16:20:06.003517 IP 10.8.1.3.40112 > 52.223.227.8.1935: Flags [.], seq 148245:149559, ack 0, win 501, options [nop,nop,TS val 1525246596 ecr 3662644036], length 1314
16:20:06.067040 IP 10.8.1.3.40112 > 52.223.227.8.1935: Flags [.], seq 149559:150873, ack 0, win 501, options [nop,nop,TS val 1525246659 ecr 3662644036], length 1314
16:20:06.080636 IP 52.223.227.8.1935 > 10.8.1.3.40112: Flags [.], ack 140796, win 126, options [nop,nop,TS val 3662644134 ecr 1525246264], length 0
16:20:06.092649 IP 52.223.227.8.1935 > 10.8.1.3.40112: Flags [.], ack 141675, win 126, options [nop,nop,TS val 3662644146 ecr 1525246341], length 0
16:20:06.092683 IP 10.8.1.3.40112 > 52.223.227.8.1935: Flags [P.], seq 150873:151675, ack 0, win 501, options [nop,nop,TS val 1525246685 ecr 3662644146], length 802
16:20:06.131596 IP 10.8.1.3.40112 > 52.223.227.8.1935: Flags [.], seq 151675:152989, ack 0, win 501, options [nop,nop,TS val 1525246724 ecr 3662644146], length 1314
16:20:06.172413 IP 10.8.1.3.40112 > 52.223.227.8.1935: Flags [.], seq 152989:154303, ack 0, win 501, options [nop,nop,TS val 1525246765 ecr 3662644146], length 1314
16:20:06.176980 IP 52.223.227.8.1935 > 10.8.1.3.40112: Flags [.], ack 144303, win 126, options [nop,nop,TS val 3662644230 ecr 1525246398], length 0
16:20:06.217812 IP 10.8.1.3.40112 > 52.223.227.8.1935: Flags [.], seq 154303:155617, ack 0, win 501, options [nop,nop,TS val 1525246810 ecr 3662644230], length 1314
16:20:06.271092 IP 10.8.1.3.40112 > 52.223.227.8.1935: Flags [.], seq 155617:156931, ack 0, win 501, options [nop,nop,TS val 1525246863 ecr 3662644230], length 1314
16:20:06.278979 IP 52.223.227.8.1935 > 10.8.1.3.40112: Flags [.], ack 146931, win 126, options [nop,nop,TS val 3662644332 ecr 1525246468], length 0
16:20:06.303499 IP 10.8.1.3.40112 > 52.223.227.8.1935: Flags [.], seq 156931:158245, ack 0, win 501, options [nop,nop,TS val 1525246896 ecr 3662644332], length 1314
16:20:06.345896 IP 10.8.1.3.40112 > 52.223.227.8.1935: Flags [.], seq 158245:159559, ack 0, win 501, options [nop,nop,TS val 1525246938 ecr 3662644332], length 1314
16:20:06.348213 IP 52.223.227.8.1935 > 10.8.1.3.40112: Flags [.], ack 149559, win 126, options [nop,nop,TS val 3662644401 ecr 1525246561], length 0
16:20:06.404224 IP 10.8.1.3.40112 > 52.223.227.8.1935: Flags [.], seq 159559:160873, ack 0, win 501, options [nop,nop,TS val 1525246997 ecr 3662644401], length 1314
16:20:06.436937 IP 52.223.227.8.1935 > 10.8.1.3.40112: Flags [.], ack 151675, win 126, options [nop,nop,TS val 3662644490 ecr 1525246659], length 0
16:20:06.437003 IP 10.8.1.3.40112 > 52.223.227.8.1935: Flags [P.], seq 160873:161657, ack 0, win 501, options [nop,nop,TS val 1525247029 ecr 3662644490], length 784
16:20:06.472379 IP 10.8.1.3.40112 > 52.223.227.8.1935: Flags [.], seq 161657:162971, ack 0, win 501, options [nop,nop,TS val 1525247065 ecr 3662644490], length 1314
16:20:06.505245 IP 10.8.1.3.40112 > 52.223.227.8.1935: Flags [.], seq 162971:164285, ack 0, win 501, options [nop,nop,TS val 1525247098 ecr 3662644490], length 1314
16:20:06.516966 IP 52.223.227.8.1935 > 10.8.1.3.40112: Flags [.], ack 154303, win 126, options [nop,nop,TS val 3662644570 ecr 1525246724], length 0
16:20:06.560641 IP 10.8.1.3.40112 > 52.223.227.8.1935: Flags [.], seq 164285:165599, ack 0, win 501, options [nop,nop,TS val 1525247153 ecr 3662644570], length 1314
16:20:06.603838 IP 10.8.1.3.40112 > 52.223.227.8.1935: Flags [.], seq 165599:166913, ack 0, win 501, options [nop,nop,TS val 1525247196 ecr 3662644570], length 1314
16:20:06.615528 IP 52.223.227.8.1935 > 10.8.1.3.40112: Flags [.], ack 156931, win 126, options [nop,nop,TS val 3662644669 ecr 1525246810], length 0
16:20:06.636192 IP 10.8.1.3.40112 > 52.223.227.8.1935: Flags [.], seq 166913:168227, ack 0, win 501, options [nop,nop,TS val 1525247229 ecr 3662644669], length 1314
16:20:06.689046 IP 10.8.1.3.40112 > 52.223.227.8.1935: Flags [.], seq 168227:169541, ack 0, win 501, options [nop,nop,TS val 1525247281 ecr 3662644669], length 1314
16:20:06.689991 IP 52.223.227.8.1935 > 10.8.1.3.40112: Flags [.], ack 159559, win 126, options [nop,nop,TS val 3662644743 ecr 1525246896], length 0
16:20:06.734828 IP 10.8.1.3.40112 > 52.223.227.8.1935: Flags [.], seq 169541:170855, ack 0, win 501, options [nop,nop,TS val 1525247327 ecr 3662644743], length 1314
16:20:06.769556 IP 10.8.1.3.40112 > 52.223.227.8.1935: Flags [.], seq 170855:172169, ack 0, win 501, options [nop,nop,TS val 1525247362 ecr 3662644743], length 1314
16:20:06.781505 IP 52.223.227.8.1935 > 10.8.1.3.40112: Flags [.], ack 161657, win 126, options [nop,nop,TS val 3662644834 ecr 1525246997], length 0
16:20:06.781541 IP 10.8.1.3.40112 > 52.223.227.8.1935: Flags [P.], seq 172169:172504, ack 0, win 501, options [nop,nop,TS val 1525247374 ecr 3662644834], length 335
16:20:06.838580 IP 10.8.1.3.40112 > 52.223.227.8.1935: Flags [.], seq 172504:173818, ack 0, win 501, options [nop,nop,TS val 1525247431 ecr 3662644834], length 1314
16:20:06.849789 IP 52.223.227.8.1935 > 10.8.1.3.40112: Flags [.], ack 164285, win 126, options [nop,nop,TS val 3662644903 ecr 1525247065], length 0
16:20:06.872316 IP 10.8.1.3.40112 > 52.223.227.8.1935: Flags [.], seq 173818:175132, ack 0, win 501, options [nop,nop,TS val 1525247465 ecr 3662644903], length 1314
16:20:06.903809 IP 10.8.1.3.40112 > 52.223.227.8.1935: Flags [.], seq 175132:176446, ack 0, win 501, options [nop,nop,TS val 1525247496 ecr 3662644903], length 1314
16:20:06.948535 IP 52.223.227.8.1935 > 10.8.1.3.40112: Flags [.], ack 166913, win 126, options [nop,nop,TS val 3662645001 ecr 1525247153], length 0
16:20:06.971734 IP 10.8.1.3.40112 > 52.223.227.8.1935: Flags [.], seq 176446:177760, ack 0, win 501, options [nop,nop,TS val 1525247564 ecr 3662645001], length 1314
16:20:07.003568 IP 10.8.1.3.40112 > 52.223.227.8.1935: Flags [.], seq 177760:179074, ack 0, win 501, options [nop,nop,TS val 1525247596 ecr 3662645001], length 1314
16:20:07.034427 IP 52.223.227.8.1935 > 10.8.1.3.40112: Flags [.], ack 169541, win 126, options [nop,nop,TS val 3662645087 ecr 1525247229], length 0
16:20:07.036800 IP 10.8.1.3.40112 > 52.223.227.8.1935: Flags [.], seq 179074:180388, ack 0, win 501, options [nop,nop,TS val 1525247629 ecr 3662645087], length 1314
16:20:07.103555 IP 10.8.1.3.40112 > 52.223.227.8.1935: Flags [.], seq 180388:181702, ack 0, win 501, options [nop,nop,TS val 1525247696 ecr 3662645087], length 1314
16:20:07.114524 IP 52.223.227.8.1935 > 10.8.1.3.40112: Flags [.], ack 172169, win 126, options [nop,nop,TS val 3662645168 ecr 1525247327], length 0
16:20:07.125586 IP 52.223.227.8.1935 > 10.8.1.3.40112: Flags [.], ack 172504, win 126, options [nop,nop,TS val 3662645179 ecr 1525247374], length 0
16:20:07.125594 IP 10.8.1.3.40112 > 52.223.227.8.1935: Flags [P.], seq 181702:182491, ack 0, win 501, options [nop,nop,TS val 1525247718 ecr 3662645179], length 789
16:20:07.168623 IP 10.8.1.3.40112 > 52.223.227.8.1935: Flags [.], seq 182491:183805, ack 0, win 501, options [nop,nop,TS val 1525247761 ecr 3662645179], length 1314
16:20:07.201251 IP 10.8.1.3.40112 > 52.223.227.8.1935: Flags [.], seq 183805:185119, ack 0, win 501, options [nop,nop,TS val 1525247794 ecr 3662645179], length 1314
16:20:07.216736 IP 52.223.227.8.1935 > 10.8.1.3.40112: Flags [.], ack 175132, win 126, options [nop,nop,TS val 3662645270 ecr 1525247431], length 0
16:20:07.244247 IP 10.8.1.3.40112 > 52.223.227.8.1935: Flags [.], seq 185119:186433, ack 0, win 501, options [nop,nop,TS val 1525247837 ecr 3662645270], length 1314
16:20:07.303841 IP 10.8.1.3.40112 > 52.223.227.8.1935: Flags [.], seq 186433:187747, ack 0, win 501, options [nop,nop,TS val 1525247896 ecr 3662645270], length 1314
16:20:07.312572 IP 52.223.227.8.1935 > 10.8.1.3.40112: Flags [.], ack 176446, win 126, options [nop,nop,TS val 3662645366 ecr 1525247496], length 0
16:20:07.337242 IP 10.8.1.3.40112 > 52.223.227.8.1935: Flags [.], seq 187747:189061, ack 0, win 501, options [nop,nop,TS val 1525247930 ecr 3662645366], length 1314
16:20:07.348169 IP 52.223.227.8.1935 > 10.8.1.3.40112: Flags [.], ack 179074, win 126, options [nop,nop,TS val 3662645401 ecr 1525247564], length 0
16:20:07.372417 IP 10.8.1.3.40112 > 52.223.227.8.1935: Flags [.], seq 189061:190375, ack 0, win 501, options [nop,nop,TS val 1525247965 ecr 3662645401], length 1314
16:20:07.436574 IP 10.8.1.3.40112 > 52.223.227.8.1935: Flags [.], seq 190375:191689, ack 0, win 501, options [nop,nop,TS val 1525248029 ecr 3662645401], length 1314
16:20:07.448127 IP 52.223.227.8.1935 > 10.8.1.3.40112: Flags [.], ack 181702, win 126, options [nop,nop,TS val 3662645501 ecr 1525247629], length 0
16:20:07.469184 IP 10.8.1.3.40112 > 52.223.227.8.1935: Flags [.], seq 191689:193003, ack 0, win 501, options [nop,nop,TS val 1525248061 ecr 3662645501], length 1314
16:20:07.472132 IP 52.223.227.8.1935 > 10.8.1.3.40112: Flags [.], ack 182491, win 126, options [nop,nop,TS val 3662645525 ecr 1525247718], length 0
16:20:07.472147 IP 10.8.1.3.40112 > 52.223.227.8.1935: Flags [P.], seq 193003:193329, ack 0, win 501, options [nop,nop,TS val 1525248064 ecr 3662645525], length 326
16:20:07.534717 IP 10.8.1.3.40112 > 52.223.227.8.1935: Flags [.], seq 193329:194643, ack 0, win 501, options [nop,nop,TS val 1525248127 ecr 3662645525], length 1314
16:20:07.545582 IP 52.223.227.8.1935 > 10.8.1.3.40112: Flags [.], ack 185119, win 126, options [nop,nop,TS val 3662645599 ecr 1525247761], length 0
16:20:07.569527 IP 10.8.1.3.40112 > 52.223.227.8.1935: Flags [.], seq 194643:195957, ack 0, win 501, options [nop,nop,TS val 1525248162 ecr 3662645599], length 1314
16:20:07.605339 IP 10.8.1.3.40112 > 52.223.227.8.1935: Flags [.], seq 195957:197271, ack 0, win 501, options [nop,nop,TS val 1525248198 ecr 3662645599], length 1314
16:20:07.648198 IP 52.223.227.8.1935 > 10.8.1.3.40112: Flags [.], ack 187747, win 126, options [nop,nop,TS val 3662645701 ecr 1525247837], length 0
16:20:07.671154 IP 10.8.1.3.40112 > 52.223.227.8.1935: Flags [.], seq 197271:198585, ack 0, win 501, options [nop,nop,TS val 1525248263 ecr 3662645701], length 1314
16:20:07.703787 IP 10.8.1.3.40112 > 52.223.227.8.1935: Flags [.], seq 198585:199899, ack 0, win 501, options [nop,nop,TS val 1525248296 ecr 3662645701], length 1314
16:20:07.717191 IP 52.223.227.8.1935 > 10.8.1.3.40112: Flags [.], ack 190375, win 126, options [nop,nop,TS val 3662645770 ecr 1525247930], length 0
16:20:07.735254 IP 10.8.1.3.40112 > 52.223.227.8.1935: Flags [.], seq 199899:201213, ack 0, win 501, options [nop,nop,TS val 1525248328 ecr 3662645770], length 1314
16:20:07.805545 IP 10.8.1.3.40112 > 52.223.227.8.1935: Flags [.], seq 201213:202527, ack 0, win 501, options [nop,nop,TS val 1525248398 ecr 3662645770], length 1314
16:20:07.813417 IP 52.223.227.8.1935 > 10.8.1.3.40112: Flags [.], ack 193003, win 126, options [nop,nop,TS val 3662645867 ecr 1525248029], length 0
16:20:07.816179 IP 52.223.227.8.1935 > 10.8.1.3.40112: Flags [.], ack 193329, win 126, options [nop,nop,TS val 3662645869 ecr 1525248064], length 0
16:20:07.816209 IP 10.8.1.3.40112 > 52.223.227.8.1935: Flags [P.], seq 202527:203323, ack 0, win 501, options [nop,nop,TS val 1525248409 ecr 3662645869], length 796
16:20:07.871809 IP 10.8.1.3.40112 > 52.223.227.8.1935: Flags [.], seq 203323:204637, ack 0, win 501, options [nop,nop,TS val 1525248464 ecr 3662645869], length 1314
16:20:07.902215 IP 10.8.1.3.40112 > 52.223.227.8.1935: Flags [.], seq 204637:205951, ack 0, win 501, options [nop,nop,TS val 1525248495 ecr 3662645869], length 1314
16:20:07.913731 IP 52.223.227.8.1935 > 10.8.1.3.40112: Flags [.], ack 195957, win 126, options [nop,nop,TS val 3662645967 ecr 1525248127], length 0
16:20:07.934659 IP 10.8.1.3.40112 > 52.223.227.8.1935: Flags [.], seq 205951:207265, ack 0, win 501, options [nop,nop,TS val 1525248527 ecr 3662645967], length 1314
16:20:08.004111 IP 10.8.1.3.40112 > 52.223.227.8.1935: Flags [.], seq 207265:208579, ack 0, win 501, options [nop,nop,TS val 1525248596 ecr 3662645967], length 1314
16:20:08.015688 IP 52.223.227.8.1935 > 10.8.1.3.40112: Flags [.], ack 198585, win 126, options [nop,nop,TS val 3662646069 ecr 1525248198], length 0
16:20:08.039076 IP 10.8.1.3.40112 > 52.223.227.8.1935: Flags [.], seq 208579:209893, ack 0, win 501, options [nop,nop,TS val 1525248631 ecr 3662646069], length 1314
16:20:08.068036 IP 10.8.1.3.40112 > 52.223.227.8.1935: Flags [.], seq 209893:211207, ack 0, win 501, options [nop,nop,TS val 1525248660 ecr 3662646069], length 1314
16:20:08.079839 IP 52.223.227.8.1935 > 10.8.1.3.40112: Flags [.], ack 201213, win 126, options [nop,nop,TS val 3662646133 ecr 1525248296], length 0
