21:38:26.682285 IP 10.8.1.8.47776 > 52.223.208.167.1935: Flags [.], seq 3647761917:3647763231, ack 3370630024, win 501, options [nop,nop,TS val 1338887482 ecr 1078442778], length 1314
21:38:26.697714 IP 52.223.208.167.1935 > 10.8.1.8.47776: Flags [.], ack 4294953616, win 134, options [nop,nop,TS val 1078442884 ecr 1338886926], length 0
21:38:26.724929 IP 10.8.1.8.47776 > 52.223.208.167.1935: Flags [.], seq 1314:2628, ack 1, win 501, options [nop,nop,TS val 1338887525 ecr 1078442884], length 1314
21:38:26.747523 IP 52.223.208.167.1935 > 10.8.1.8.47776: Flags [.], ack 4294955470, win 134, options [nop,nop,TS val 1078442934 ecr 1338887027], length 0
21:38:26.747558 IP 10.8.1.8.47776 > 52.223.208.167.1935: Flags [P.], seq 2628:3156, ack 1, win 501, options [nop,nop,TS val 1338887547 ecr 1078442934], length 528
21:38:26.789250 IP 10.8.1.8.47776 > 52.223.208.167.1935: Flags [.], seq 3156:4470, ack 1, win 501, options [nop,nop,TS val 1338887589 ecr 1078442934], length 1314
21:38:26.826104 IP 10.8.1.8.47776 > 52.223.208.167.1935: Flags [.], seq 4470:5784, ack 1, win 501, options [nop,nop,TS val 1338887626 ecr 1078442934], length 1314
21:38:26.826383 IP 52.223.208.167.1935 > 10.8.1.8.47776: Flags [.], ack 4294958098, win 134, options [nop,nop,TS val 1078443013 ecr 1338887093], length 0
21:38:26.874790 IP 10.8.1.8.47776 > 52.223.208.167.1935: Flags [.], seq 5784:7098, ack 1, win 501, options [nop,nop,TS val 1338887674 ecr 1078443013], length 1314
21:38:26.917754 IP 10.8.1.8.47776 > 52.223.208.167.1935: Flags [.], seq 7098:8412, ack 1, win 501, options [nop,nop,TS val 1338887717 ecr 1078443013], length 1314
21:38:26.933039 IP 52.223.208.167.1935 > 10.8.1.8.47776: Flags [.], ack 4294960726, win 134, options [nop,nop,TS val 1078443120 ecr 1338887161], length 0
21:38:26.959419 IP 10.8.1.8.47776 > 52.223.208.167.1935: Flags [.], seq 8412:9726, ack 1, win 501, options [nop,nop,TS val 1338887759 ecr 1078443120], length 1314
21:38:27.002566 IP 52.223.208.167.1935 > 10.8.1.8.47776: Flags [.], ack 4294963354, win 134, options [nop,nop,TS val 1078443189 ecr 1338887247], length 0
21:38:27.003298 IP 10.8.1.8.47776 > 52.223.208.167.1935: Flags [.], seq 9726:11040, ack 1, win 501, options [nop,nop,TS val 1338887803 ecr 1078443189], length 1314
21:38:27.060478 IP 10.8.1.8.47776 > 52.223.208.167.1935: Flags [.], seq 11040:12354, ack 1, win 501, options [nop,nop,TS val 1338887860 ecr 1078443189], length 1314
21:38:27.089126 IP 10.8.1.8.47776 > 52.223.208.167.1935: Flags [.], seq 12354:13668, ack 1, win 501, options [nop,nop,TS val 1338887889 ecr 1078443189], length 1314
21:38:27.105954 IP 52.223.208.167.1935 > 10.8.1.8.47776: Flags [.], ack 4294965982, win 134, options [nop,nop,TS val 1078443292 ecr 1338887353], length 0
21:38:27.131704 IP 10.8.1.8.47776 > 52.223.208.167.1935: Flags [.], seq 13668:14982, ack 1, win 501, options [nop,nop,TS val 1338887931 ecr 1078443292], length 1314
21:38:27.190221 IP 52.223.208.167.1935 > 10.8.1.8.47776: Flags [.], ack 1314, win 134, options [nop,nop,TS val 1078443377 ecr 1338887428], length 0
21:38:27.190574 IP 10.8.1.8.47776 > 52.223.208.167.1935: Flags [.], seq 14982:16296, ack 1, win 501, options [nop,nop,TS val 1338887990 ecr 1078443377], length 1314
21:38:27.216402 IP 10.8.1.8.47776 > 52.223.208.167.1935: Flags [.], seq 16296:17610, ack 1, win 501, options [nop,nop,TS val 1338888016 ecr 1078443377], length 1314
21:38:27.255484 IP 52.223.208.167.1935 > 10.8.1.8.47776: Flags [.], ack 3156, win 134, options [nop,nop,TS val 1078443442 ecr 1338887525], length 0
21:38:27.255505 IP 10.8.1.8.47776 > 52.223.208.167.1935: Flags [P.], seq 17610:18042, ack 1, win 501, options [nop,nop,TS val 1338888055 ecr 1078443442], length 432
21:38:27.290728 IP 10.8.1.8.47776 > 52.223.208.167.1935: Flags [.], seq 18042:19356, ack 1, win 501, options [nop,nop,TS val 1338888090 ecr 1078443442], length 1314
21:38:27.322242 IP 10.8.1.8.47776 > 52.223.208.167.1935: Flags [.], seq 19356:20670, ack 1, win 501, options [nop,nop,TS val 1338888122 ecr 1078443442], length 1314
21:38:27.339545 IP 52.223.208.167.1935 > 10.8.1.8.47776: Flags [.], ack 5784, win 134, options [nop,nop,TS val 1078443520 ecr 1338887589], length 0
21:38:27.364535 IP 10.8.1.8.47776 > 52.223.208.167.1935: Flags [.], seq 20670:21984, ack 1, win 501, options [nop,nop,TS val 1338888164 ecr 1078443520], length 1314
21:38:27.425655 IP 52.223.208.167.1935 > 10.8.1.8.47776: Flags [.], ack 8412, win 134, options [nop,nop,TS val 1078443612 ecr 1338887674], length 0
21:38:27.426323 IP 10.8.1.8.47776 > 52.223.208.167.1935: Flags [.], seq 21984:23298, ack 1, win 501, options [nop,nop,TS val 1338888226 ecr 1078443612], length 1314
21:38:27.449418 IP 10.8.1.8.47776 > 52.223.208.167.1935: Flags [.], seq 23298:24612, ack 1, win 501, options [nop,nop,TS val 1338888249 ecr 1078443612], length 1314
21:38:27.491984 IP 10.8.1.8.47776 > 52.223.208.167.1935: Flags [.], seq 24612:25926, ack 1, win 501, options [nop,nop,TS val 1338888292 ecr 1078443612], length 1314
21:38:27.510996 IP 52.223.208.167.1935 > 10.8.1.8.47776: Flags [.], ack 11040, win 134, options [nop,nop,TS val 1078443698 ecr 1338887759], length 0
21:38:27.556457 IP 10.8.1.8.47776 > 52.223.208.167.1935: Flags [.], seq 25926:27240, ack 1, win 501, options [nop,nop,TS val 1338888356 ecr 1078443698], length 1314
21:38:27.594103 IP 10.8.1.8.47776 > 52.223.208.167.1935: Flags [.], seq 27240:28554, ack 1, win 501, options [nop,nop,TS val 1338888394 ecr 1078443698], length 1314
21:38:27.609439 IP 52.223.208.167.1935 > 10.8.1.8.47776: Flags [.], ack 13668, win 134, options [nop,nop,TS val 1078443796 ecr 1338887860], length 0
21:38:27.625041 IP 10.8.1.8.47776 > 52.223.208.167.1935: Flags [.], seq 28554:29868, ack 1, win 501, options [nop,nop,TS val 1338888425 ecr 1078443796], length 1314
21:38:27.684692 IP 10.8.1.8.47776 > 52.223.208.167.1935: Flags [.], seq 29868:31182, ack 1, win 501, options [nop,nop,TS val 1338888484 ecr 1078443796], length 1314
21:38:27.698011 IP 52.223.208.167.1935 > 10.8.1.8.47776: Flags [.], ack 16296, win 134, options [nop,nop,TS val 1078443885 ecr 1338887931], length 0
21:38:27.726845 IP 10.8.1.8.47776 > 52.223.208.167.1935: Flags [.], seq 31182:32496, ack 1, win 501, options [nop,nop,TS val 1338888527 ecr 1078443885], length 1314
21:38:27.760088 IP 10.8.1.8.47776 > 52.223.208.167.1935: Flags [.], seq 32496:33810, ack 1, win 501, options [nop,nop,TS val 1338888560 ecr 1078443885], length 1314
21:38:27.763213 IP 52.223.208.167.1935 > 10.8.1.8.47776: Flags [.], ack 18042, win 134, options [nop,nop,TS val 1078443950 ecr 1338888016], length 0
21:38:27.763242 IP 10.8.1.8.47776 > 52.223.208.167.1935: Flags [P.], seq 33810:33888, ack 1, win 501, options [nop,nop,TS val 1338888563 ecr 1078443950], length 78
21:38:27.827046 IP 10.8.1.8.47776 > 52.223.208.167.1935: Flags [.], seq 33888:35202, ack 1, win 501, options [nop,nop,TS val 1338888627 ecr 1078443950], length 1314
21:38:27.829957 IP 52.223.208.167.1935 > 10.8.1.8.47776: Flags [.], ack 20670, win 134, options [nop,nop,TS val 1078444017 ecr 1338888090], length 0
21:38:27.855886 IP 10.8.1.8.47776 > 52.223.208.167.1935: Flags [.], seq 35202:36516, ack 1, win 501, options [nop,nop,TS val 1338888656 ecr 1078444017], length 1314
21:38:27.890467 IP 10.8.1.8.47776 > 52.223.208.167.1935: Flags [.], seq 36516:37830, ack 1, win 501, options [nop,nop,TS val 1338888690 ecr 1078444017], length 1314
21:38:27.933817 IP 52.223.208.167.1935 > 10.8.1.8.47776: Flags [.], ack 23298, win 134, options [nop,nop,TS val 1078444121 ecr 1338888164], length 0
21:38:27.961754 IP 10.8.1.8.47776 > 52.223.208.167.1935: Flags [.], seq 37830:39144, ack 1, win 501, options [nop,nop,TS val 1338888761 ecr 1078444121], length 1314
21:38:27.983846 IP 10.8.1.8.47776 > 52.223.208.167.1935: Flags [.], seq 39144:40458, ack 1, win 501, options [nop,nop,TS val 1338888784 ecr 1078444121], length 1314
21:38:27.999911 IP 52.223.208.167.1935 > 10.8.1.8.47776: Flags [.], ack 25926, win 134, options [nop,nop,TS val 1078444186 ecr 1338888249], length 0
21:38:28.026627 IP 10.8.1.8.47776 > 52.223.208.167.1935: Flags [.], seq 40458:41772, ack 1, win 501, options [nop,nop,TS val 1338888826 ecr 1078444186], length 1314
21:38:28.090925 IP 10.8.1.8.47776 > 52.223.208.167.1935: Flags [.], seq 41772:43086, ack 1, win 501, options [nop,nop,TS val 1338888891 ecr 1078444186], length 1314
21:38:28.101836 IP 52.223.208.167.1935 > 10.8.1.8.47776: Flags [.], ack 28554, win 134, options [nop,nop,TS val 1078444288 ecr 1338888356], length 0
21:38:28.127546 IP 10.8.1.8.47776 > 52.223.208.167.1935: Flags [.], seq 43086:44400, ack 1, win 501, options [nop,nop,TS val 1338888927 ecr 1078444288], length 1314
21:38:28.154941 IP 10.8.1.8.47776 > 52.223.208.167.1935: Flags [.], seq 44400:45714, ack 1, win 501, options [nop,nop,TS val 1338888955 ecr 1078444288], length 1314
21:38:28.193020 IP 52.223.208.167.1935 > 10.8.1.8.47776: Flags [.], ack 31182, win 134, options [nop,nop,TS val 1078444380 ecr 1338888425], length 0
21:38:28.218976 IP 10.8.1.8.47776 > 52.223.208.167.1935: Flags [.], seq 45714:47028, ack 1, win 501, options [nop,nop,TS val 1338889019 ecr 1078444380], length 1314
21:38:28.257450 IP 10.8.1.8.47776 > 52.223.208.167.1935: Flags [.], seq 47028:48342, ack 1, win 501, options [nop,nop,TS val 1338889057 ecr 1078444380], length 1314
21:38:28.268013 IP 52.223.208.167.1935 > 10.8.1.8.47776: Flags [.], ack 33810, win 134, options [nop,nop,TS val 1078444455 ecr 1338888527], length 0
21:38:28.270309 IP 52.223.208.167.1935 > 10.8.1.8.47776: Flags [.], ack 33888, win 134, options [nop,nop,TS val 1078444457 ecr 1338888563], length 0
21:38:28.270330 IP 10.8.1.8.47776 > 52.223.208.167.1935: Flags [P.], seq 48342:48866, ack 1, win 501, options [nop,nop,TS val 1338889070 ecr 1078444457], length 524
21:38:28.325223 IP 10.8.1.8.47776 > 52.223.208.167.1935: Flags [.], seq 48866:50180, ack 1, win 501, options [nop,nop,TS val 1338889125 ecr 1078444457], length 1314
21:38:28.361833 IP 10.8.1.8.47776 > 52.223.208.167.1935: Flags [.], seq 50180:51494, ack 1, win 501, options [nop,nop,TS val 1338889162 ecr 1078444457], length 1314
21:38:28.363642 IP 52.223.208.167.1935 > 10.8.1.8.47776: Flags [.], ack 36516, win 134, options [nop,nop,TS val 1078444550 ecr 1338888627], length 0
21:38:28.395376 IP 10.8.1.8.47776 > 52.223.208.167.1935: Flags [.], seq 51494:52808, ack 1, win 501, options [nop,nop,TS val 1338889195 ecr 1078444550], length 1314
21:38:28.453665 IP 10.8.1.8.47776 > 52.223.208.167.1935: Flags [.], seq 52808:54122, ack 1, win 501, options [nop,nop,TS val 1338889253 ecr 1078444550], length 1314
21:38:28.462975 IP 52.223.208.167.1935 > 10.8.1.8.47776: Flags [.], ack 37830, win 134, options [nop,nop,TS val 1078444649 ecr 1338888690], length 0
21:38:28.492535 IP 52.223.208.167.1935 > 10.8.1.8.47776: Flags [.], ack 40458, win 134, options [nop,nop,TS val 1078444679 ecr 1338888761], length 0
21:38:28.493574 IP 10.8.1.8.47776 > 52.223.208.167.1935: Flags [.], seq 54122:55436, ack 1, win 501, options [nop,nop,TS val 1338889293 ecr 1078444679], length 1314
21:38:28.524057 IP 10.8.1.8.47776 > 52.223.208.167.1935: Flags [.], seq 55436:56750, ack 1, win 501, options [nop,nop,TS val 1338889324 ecr 1078444679], length 1314
21:38:28.581230 IP 10.8.1.8.47776 > 52.223.208.167.1935: Flags [.], seq 56750:58064, ack 1, win 501, options [nop,nop,TS val 1338889381 ecr 1078444679], length 1314
21:38:28.598684 IP 52.223.208.167.1935 > 10.8.1.8.47776: Flags [.], ack 43086, win 134, options [nop,nop,TS val 1078444785 ecr 1338888826], length 0
21:38:28.624325 IP 10.8.1.8.47776 > 52.223.208.167.1935: Flags [.], seq 58064:59378, ack 1, win 501, options [nop,nop,TS val 1338889424 ecr 1078444785], length 1314
21:38:28.660919 IP 10.8.1.8.47776 > 52.223.208.167.1935: Flags [.], seq 59378:60692, ack 1, win 501, options [nop,nop,TS val 1338889461 ecr 1078444785], length 1314
21:38:28.663462 IP 52.223.208.167.1935 > 10.8.1.8.47776: Flags [.], ack 45714, win 134, options [nop,nop,TS val 1078444850 ecr 1338888927], length 0
21:38:28.726872 IP 10.8.1.8.47776 > 52.223.208.167.1935: Flags [.], seq 60692:62006, ack 1, win 501, options [nop,nop,TS val 1338889527 ecr 1078444850], length 1314
21:38:28.752630 IP 10.8.1.8.47776 > 52.223.208.167.1935: Flags [.], seq 62006:63320, ack 1, win 501, options [nop,nop,TS val 1338889552 ecr 1078444850], length 1314
21:38:28.765791 IP 52.223.208.167.1935 > 10.8.1.8.47776: Flags [.], ack 48342, win 134, options [nop,nop,TS val 1078444952 ecr 1338889019], length 0
21:38:28.790154 IP 10.8.1.8.47776 > 52.223.208.167.1935: Flags [.], seq 63320:64634, ack 1, win 501, options [nop,nop,TS val 1338889590 ecr 1078444952], length 1314
21:38:28.858896 IP 10.8.1.8.47776 > 52.223.208.167.1935: Flags [.], seq 64634:65948, ack 1, win 501, options [nop,nop,TS val 1338889659 ecr 1078444952], length 1314
21:38:28.869798 IP 52.223.208.167.1935 > 10.8.1.8.47776: Flags [.], ack 51494, win 134, options [nop,nop,TS val 1078445056 ecr 1338889125], length 0
21:38:28.869832 IP 10.8.1.8.47776 > 52.223.208.167.1935: Flags [P.], seq 65948:66772, ack 1, win 501, options [nop,nop,TS val 1338889670 ecr 1078445056], length 824
21:38:28.923187 IP 10.8.1.8.47776 > 52.223.208.167.1935: Flags [.], seq 66772:68086, ack 1, win 501, options [nop,nop,TS val 1338889723 ecr 1078445056], length 1314
21:38:28.960052 IP 10.8.1.8.47776 > 52.223.208.167.1935: Flags [.], seq 68086:69400, ack 1, win 501, options [nop,nop,TS val 1338889760 ecr 1078445056], length 1314
21:38:28.961625 IP 52.223.208.167.1935 > 10.8.1.8.47776: Flags [.], ack 54122, win 134, options [nop,nop,TS val 1078445148 ecr 1338889195], length 0
21:38:28.992802 IP 10.8.1.8.47776 > 52.223.208.167.1935: Flags [.], seq 69400:70714, ack 1, win 501, options [nop,nop,TS val 1338889792 ecr 1078445148], length 1314
21:38:29.031758 IP 52.223.208.167.1935 > 10.8.1.8.47776: Flags [.], ack 56750, win 134, options [nop,nop,TS val 1078445218 ecr 1338889293], length 0
21:38:29.051411 IP 10.8.1.8.47776 > 52.223.208.167.1935: Flags [.], seq 70714:72028, ack 1, win 501, options [nop,nop,TS val 1338889851 ecr 1078445218], length 1314
21:38:29.092347 IP 10.8.1.8.47776 > 52.223.208.167.1935: Flags [.], seq 72028:73342, ack 1, win 501, options [nop,nop,TS val 1338889892 ecr 1078445218], length 1314
21:38:29.126625 IP 10.8.1.8.47776 > 52.223.208.167.1935: Flags [.], seq 73342:74656, ack 1, win 501, options [nop,nop,TS val 1338889926 ecr 1078445218], length 1314
21:38:29.132540 IP 52.223.208.167.1935 > 10.8.1.8.47776: Flags [.], ack 59378, win 134, options [nop,nop,TS val 1078445319 ecr 1338889381], length 0
21:38:29.190153 IP 10.8.1.8.47776 > 52.223.208.167.1935: Flags [.], seq 74656:75970, ack 1, win 501, options [nop,nop,TS val 1338889990 ecr 1078445319], length 1314
21:38:29.221809 IP 10.8.1.8.47776 > 52.223.208.167.1935: Flags [.], seq 75970:77284, ack 1, win 501, options [nop,nop,TS val 1338890022 ecr 1078445319], length 1314
21:38:29.234795 IP 52.223.208.167.1935 > 10.8.1.8.47776: Flags [.], ack 62006, win 134, options [nop,nop,TS val 1078445421 ecr 1338889461], length 0
21:38:29.260849 IP 10.8.1.8.47776 > 52.223.208.167.1935: Flags [.], seq 77284:78598, ack 1, win 501, options [nop,nop,TS val 1338890061 ecr 1078445421], length 1314
21:38:29.297748 IP 52.223.208.167.1935 > 10.8.1.8.47776: Flags [.], ack 64634, win 134, options [nop,nop,TS val 1078445484 ecr 1338889552], length 0
21:38:29.327391 IP 10.8.1.8.47776 > 52.223.208.167.1935: Flags [.], seq 78598:79912, ack 1, win 501, options [nop,nop,TS val 1338890127 ecr 1078445484], length 1314
21:38:29.350458 IP 10.8.1.8.47776 > 52.223.208.167.1935: Flags [.], seq 79912:81226, ack 1, win 501, options [nop,nop,TS val 1338890150 ecr 1078445484], length 1314
21:38:29.389807 IP 52.223.208.167.1935 > 10.8.1.8.47776: Flags [.], ack 66772, win 134, options [nop,nop,TS val 1078445564 ecr 1338889659], length 0
21:38:29.389833 IP 10.8.1.8.47776 > 52.223.208.167.1935: Flags [P.], seq 81226:81770, ack 1, win 501, options [nop,nop,TS val 1338890190 ecr 1078445564], length 544
21:38:29.427569 IP 10.8.1.8.47776 > 52.223.208.167.1935: Flags [.], seq 81770:83084, ack 1, win 501, options [nop,nop,TS val 1338890227 ecr 1078445564], length 1314
21:38:29.457402 IP 10.8.1.8.47776 > 52.223.208.167.1935: Flags [.], seq 83084:84398, ack 1, win 501, options [nop,nop,TS val 1338890257 ecr 1078445564], length 1314
21:38:29.470844 IP 52.223.208.167.1935 > 10.8.1.8.47776: Flags [.], ack 69400, win 134, options [nop,nop,TS val 1078445654 ecr 1338889723], length 0
21:38:29.500097 IP 10.8.1.8.47776 > 52.223.208.167.1935: Flags [.], seq 84398:85712, ack 1, win 501, options [nop,nop,TS val 1338890300 ecr 1078445654], length 1314
21:38:29.559533 IP 10.8.1.8.47776 > 52.223.208.167.1935: Flags [.], seq 85712:87026, ack 1, win 501, options [nop,nop,TS val 1338890359 ecr 1078445654], length 1314
21:38:29.560182 IP 52.223.208.167.1935 > 10.8.1.8.47776: Flags [.], ack 72028, win 134, options [nop,nop,TS val 1078445746 ecr 1338889792], length 0
21:38:29.585295 IP 10.8.1.8.47776 > 52.223.208.167.1935: Flags [.], seq 87026:88340, ack 1, win 501, options [nop,nop,TS val 1338890385 ecr 1078445746], length 1314
21:38:29.627797 IP 10.8.1.8.47776 > 52.223.208.167.1935: Flags [.], seq 88340:89654, ack 1, win 501, options [nop,nop,TS val 1338890427 ecr 1078445746], length 1314
21:38:29.652469 IP 52.223.208.167.1935 > 10.8.1.8.47776: Flags [.], ack 74656, win 134, options [nop,nop,TS val 1078445839 ecr 1338889892], length 0
21:38:29.692387 IP 10.8.1.8.47776 > 52.223.208.167.1935: Flags [.], seq 89654:90968, ack 1, win 501, options [nop,nop,TS val 1338890492 ecr 1078445839], length 1314
21:38:29.713860 IP 10.8.1.8.47776 > 52.223.208.167.1935: Flags [.], seq 90968:92282, ack 1, win 501, options [nop,nop,TS val 1338890514 ecr 1078445839], length 1314
21:38:29.729984 IP 52.223.208.167.1935 > 10.8.1.8.47776: Flags [.], ack 77284, win 134, options [nop,nop,TS val 1078445917 ecr 1338889990], length 0
21:38:29.759462 IP 10.8.1.8.47776 > 52.223.208.167.1935: Flags [.], seq 92282:93596, ack 1, win 501, options [nop,nop,TS val 1338890559 ecr 1078445917], length 1314
21:38:29.820847 IP 10.8.1.8.47776 > 52.223.208.167.1935: Flags [.], seq 93596:94910, ack 1, win 501, options [nop,nop,TS val 1338890621 ecr 1078445917], length 1314
21:38:29.836081 IP 52.223.208.167.1935 > 10.8.1.8.47776: Flags [.], ack 79912, win 134, options [nop,nop,TS val 1078446023 ecr 1338890061], length 0
21:38:29.859774 IP 10.8.1.8.47776 > 52.223.208.167.1935: Flags [.], seq 94910:96224, ack 1, win 501, options [nop,nop,TS val 1338890659 ecr 1078446023], length 1314
21:38:29.892795 IP 10.8.1.8.47776 > 52.223.208.167.1935: Flags [.], seq 96224:97538, ack 1, win 501, options [nop,nop,TS val 1338890692 ecr 1078446023], length 1314
21:38:29.899781 IP 52.223.208.167.1935 > 10.8.1.8.47776: Flags [.], ack 81770, win 134, options [nop,nop,TS val 1078446084 ecr 1338890150], length 0
21:38:29.899809 IP 10.8.1.8.47776 > 52.223.208.167.1935: Flags [P.], seq 97538:97596, ack 1, win 501, options [nop,nop,TS val 1338890700 ecr 1078446084], length 58
21:38:29.961029 IP 10.8.1.8.47776 > 52.223.208.167.1935: Flags [.], seq 97596:98910, ack 1, win 501, options [nop,nop,TS val 1338890761 ecr 1078446084], length 1314
21:38:29.965266 IP 52.223.208.167.1935 > 10.8.1.8.47776: Flags [.], ack 84398, win 134, options [nop,nop,TS val 1078446152 ecr 1338890227], length 0
21:38:29.992405 IP 10.8.1.8.47776 > 52.223.208.167.1935: Flags [.], seq 98910:100224, ack 1, win 501, options [nop,nop,TS val 1338890792 ecr 1078446152], length 1314
21:38:30.026166 IP 10.8.1.8.47776 > 52.223.208.167.1935: Flags [.], seq 100224:101538, ack 1, win 501, options [nop,nop,TS val 1338890826 ecr 1078446152], length 1314
21:38:30.067240 IP 52.223.208.167.1935 > 10.8.1.8.47776: Flags [.], ack 87026, win 134, options [nop,nop,TS val 1078446254 ecr 1338890300], length 0
21:38:30.093884 IP 10.8.1.8.47776 > 52.223.208.167.1935: Flags [.], seq 101538:102852, ack 1, win 501, options [nop,nop,TS val 1338890894 ecr 1078446254], length 1314
21:38:30.120622 IP 10.8.1.8.47776 > 52.223.208.167.1935: Flags [.], seq 102852:104166, ack 1, win 501, options [nop,nop,TS val 1338890920 ecr 1078446254], length 1314
21:38:30.137634 IP 52.223.208.167.1935 > 10.8.1.8.47776: Flags [.], ack 89654, win 134, options [nop,nop,TS val 1078446324 ecr 1338890385], length 0
21:38:30.159624 IP 10.8.1.8.47776 > 52.223.208.167.1935: Flags [.], seq 104166:105480, ack 1, win 501, options [nop,nop,TS val 1338890959 ecr 1078446324], length 1314
21:38:30.221451 IP 52.223.208.167.1935 > 10.8.1.8.47776: Flags [.], ack 92282, win 134, options [nop,nop,TS val 1078446408 ecr 1338890492], length 0
21:38:30.226213 IP 10.8.1.8.47776 > 52.223.208.167.1935: Flags [.], seq 105480:106794, ack 1, win 501, options [nop,nop,TS val 1338891026 ecr 1078446408], length 1314
21:38:30.259686 IP 10.8.1.8.47776 > 52.223.208.167.1935: Flags [.], seq 106794:108108, ack 1, win 501, options [nop,nop,TS val 1338891059 ecr 1078446408], length 1314
21:38:30.291564 IP 10.8.1.8.47776 > 52.223.208.167.1935: Flags [.], seq 108108:109422, ack 1, win 501, options [nop,nop,TS val 1338891091 ecr 1078446408], length 1314
21:38:30.328618 IP 52.223.208.167.1935 > 10.8.1.8.47776: Flags [.], ack 94910, win 134, options [nop,nop,TS val 1078446515 ecr 1338890559], length 0
21:38:30.355961 IP 10.8.1.8.47776 > 52.223.208.167.1935: Flags [.], seq 109422:110736, ack 1, win 501, options [nop,nop,TS val 1338891156 ecr 1078446515], length 1314
21:38:30.393574 IP 10.8.1.8.47776 > 52.223.208.167.1935: Flags [.], seq 110736:112050, ack 1, win 501, options [nop,nop,TS val 1338891193 ecr 1078446515], length 1314
21:38:30.400663 IP 52.223.208.167.1935 > 10.8.1.8.47776: Flags [.], ack 97538, win 134, options [nop,nop,TS val 1078446587 ecr 1338890659], length 0
21:38:30.407320 IP 52.223.208.167.1935 > 10.8.1.8.47776: Flags [.], ack 97596, win 134, options [nop,nop,TS val 1078446594 ecr 1338890700], length 0
21:38:30.407358 IP 10.8.1.8.47776 > 52.223.208.167.1935: Flags [P.], seq 112050:112582, ack 1, win 501, options [nop,nop,TS val 1338891207 ecr 1078446594], length 532
21:38:30.457917 IP 10.8.1.8.47776 > 52.223.208.167.1935: Flags [.], seq 112582:113896, ack 1, win 501, options [nop,nop,TS val 1338891258 ecr 1078446594], length 1314
21:38:30.494227 IP 10.8.1.8.47776 > 52.223.208.167.1935: Flags [.], seq 113896:115210, ack 1, win 501, options [nop,nop,TS val 1338891294 ecr 1078446594], length 1314
21:38:30.500057 IP 52.223.208.167.1935 > 10.8.1.8.47776: Flags [.], ack 100224, win 134, options [nop,nop,TS val 1078446687 ecr 1338890761], length 0
21:38:30.527690 IP 10.8.1.8.47776 > 52.223.208.167.1935: Flags [.], seq 115210:116524, ack 1, win 501, options [nop,nop,TS val 1338891327 ecr 1078446687], length 1314
21:38:30.591262 IP 10.8.1.8.47776 > 52.223.208.167.1935: Flags [.], seq 116524:117838, ack 1, win 501, options [nop,nop,TS val 1338891391 ecr 1078446687], length 1314
21:38:30.594241 IP 52.223.208.167.1935 > 10.8.1.8.47776: Flags [.], ack 101538, win 134, options [nop,nop,TS val 1078446781 ecr 1338890826], length 0
21:38:30.627846 IP 10.8.1.8.47776 > 52.223.208.167.1935: Flags [.], seq 117838:119152, ack 1, win 501, options [nop,nop,TS val 1338891428 ecr 1078446781], length 1314
21:38:30.628412 IP 52.223.208.167.1935 > 10.8.1.8.47776: Flags [.], ack 104166, win 134, options [nop,nop,TS val 1078446815 ecr 1338890894], length 0
21:38:30.660941 IP 10.8.1.8.47776 > 52.223.208.167.1935: Flags [.], seq 119152:120466, ack 1, win 501, options [nop,nop,TS val 1338891461 ecr 1078446815], length 1314
21:38:30.719789 IP 10.8.1.8.47776 > 52.223.208.167.1935: Flags [.], seq 120466:121780, ack 1, win 501, options [nop,nop,TS val 1338891519 ecr 1078446815], length 1314
21:38:30.733870 IP 52.223.208.167.1935 > 10.8.1.8.47776: Flags [.], ack 106794, win 134, options [nop,nop,TS val 1078446921 ecr 1338890959], length 0
21:38:30.759931 IP 10.8.1.8.47776 > 52.223.208.167.1935: Flags [.], seq 121780:123094, ack 1, win 501, options [nop,nop,TS val 1338891560 ecr 1078446921], length 1314
21:38:30.793991 IP 10.8.1.8.47776 > 52.223.208.167.1935: Flags [.], seq 123094:124408, ack 1, win 501, options [nop,nop,TS val 1338891594 ecr 1078446921], length 1314
21:38:30.799339 IP 52.223.208.167.1935 > 10.8.1.8.47776: Flags [.], ack 109422, win 134, options [nop,nop,TS val 1078446986 ecr 1338891059], length 0
21:38:30.859518 IP 10.8.1.8.47776 > 52.223.208.167.1935: Flags [.], seq 124408:125722, ack 1, win 501, options [nop,nop,TS val 1338891659 ecr 1078446986], length 1314
21:38:30.890948 IP 10.8.1.8.47776 > 52.223.208.167.1935: Flags [.], seq 125722:127036, ack 1, win 501, options [nop,nop,TS val 1338891691 ecr 1078446986], length 1314
21:38:30.901376 IP 52.223.208.167.1935 > 10.8.1.8.47776: Flags [.], ack 112050, win 134, options [nop,nop,TS val 1078447088 ecr 1338891156], length 0
21:38:30.915025 IP 52.223.208.167.1935 > 10.8.1.8.47776: Flags [.], ack 112582, win 134, options [nop,nop,TS val 1078447102 ecr 1338891207], length 0
21:38:30.915035 IP 10.8.1.8.47776 > 52.223.208.167.1935: Flags [P.], seq 127036:127576, ack 1, win 501, options [nop,nop,TS val 1338891715 ecr 1078447102], length 540
21:38:30.954621 IP 10.8.1.8.47776 > 52.223.208.167.1935: Flags [.], seq 127576:128890, ack 1, win 501, options [nop,nop,TS val 1338891754 ecr 1078447102], length 1314
21:38:30.994398 IP 10.8.1.8.47776 > 52.223.208.167.1935: Flags [.], seq 128890:130204, ack 1, win 501, options [nop,nop,TS val 1338891794 ecr 1078447102], length 1314
21:38:31.002275 IP 52.223.208.167.1935 > 10.8.1.8.47776: Flags [.], ack 115210, win 134, options [nop,nop,TS val 1078447189 ecr 1338891258], length 0
21:38:31.040261 IP 10.8.1.8.47776 > 52.223.208.167.1935: Flags [.], seq 130204:131518, ack 1, win 501, options [nop,nop,TS val 1338891840 ecr 1078447189], length 1314
21:38:31.092664 IP 10.8.1.8.47776 > 52.223.208.167.1935: Flags [.], seq 131518:132832, ack 1, win 501, options [nop,nop,TS val 1338891892 ecr 1078447189], length 1314
21:38:31.098971 IP 52.223.208.167.1935 > 10.8.1.8.47776: Flags [.], ack 117838, win 134, options [nop,nop,TS val 1078447286 ecr 1338891327], length 0
21:38:31.126531 IP 10.8.1.8.47776 > 52.223.208.167.1935: Flags [.], seq 132832:134146, ack 1, win 501, options [nop,nop,TS val 1338891926 ecr 1078447286], length 1314
21:38:31.168695 IP 52.223.208.167.1935 > 10.8.1.8.47776: Flags [.], ack 120466, win 134, options [nop,nop,TS val 1078447356 ecr 1338891428], length 0
21:38:31.169076 IP 10.8.1.8.47776 > 52.223.208.167.1935: Flags [.], seq 134146:135460, ack 1, win 501, options [nop,nop,TS val 1338891969 ecr 1078447356], length 1314
21:38:31.223908 IP 10.8.1.8.47776 > 52.223.208.167.1935: Flags [.], seq 135460:136774, ack 1, win 501, options [nop,nop,TS val 1338892024 ecr 1078447356], length 1314
21:38:31.254292 IP 10.8.1.8.47776 > 52.223.208.167.1935: Flags [.], seq 136774:138088, ack 1, win 501, options [nop,nop,TS val 1338892054 ecr 1078447356], length 1314
21:38:31.267533 IP 52.223.208.167.1935 > 10.8.1.8.47776: Flags [.], ack 123094, win 134, options [nop,nop,TS val 1078447454 ecr 1338891519], length 0
21:38:31.297394 IP 10.8.1.8.47776 > 52.223.208.167.1935: Flags [.], seq 138088:139402, ack 1, win 501, options [nop,nop,TS val 1338892097 ecr 1078447454], length 1314
21:38:31.356987 IP 10.8.1.8.47776 > 52.223.208.167.1935: Flags [.], seq 139402:140716, ack 1, win 501, options [nop,nop,TS val 1338892157 ecr 1078447454], length 1314
21:38:31.367256 IP 52.223.208.167.1935 > 10.8.1.8.47776: Flags [.], ack 125722, win 134, options [nop,nop,TS val 1078447554 ecr 1338891594], length 0
21:38:31.391905 IP 10.8.1.8.47776 > 52.223.208.167.1935: Flags [.], seq 140716:142030, ack 1, win 501, options [nop,nop,TS val 1338892192 ecr 1078447554], length 1314
21:38:31.422295 IP 52.223.208.167.1935 > 10.8.1.8.47776: Flags [.], ack 127576, win 134, options [nop,nop,TS val 1078447609 ecr 1338891691], length 0
21:38:31.422344 IP 10.8.1.8.47776 > 52.223.208.167.1935: Flags [P.], seq 142030:142458, ack 1, win 501, options [nop,nop,TS val 1338892222 ecr 1078447609], length 428
21:38:31.456767 IP 10.8.1.8.47776 > 52.223.208.167.1935: Flags [.], seq 142458:143772, ack 1, win 501, options [nop,nop,TS val 1338892256 ecr 1078447609], length 1314
21:38:31.488920 IP 10.8.1.8.47776 > 52.223.208.167.1935: Flags [.], seq 143772:145086, ack 1, win 501, options [nop,nop,TS val 1338892289 ecr 1078447609], length 1314
21:38:31.503678 IP 52.223.208.167.1935 > 10.8.1.8.47776: Flags [.], ack 130204, win 134, options [nop,nop,TS val 1078447690 ecr 1338891754], length 0
21:38:31.531758 IP 10.8.1.8.47776 > 52.223.208.167.1935: Flags [.], seq 145086:146400, ack 1, win 501, options [nop,nop,TS val 1338892331 ecr 1078447690], length 1314
21:38:31.594094 IP 10.8.1.8.47776 > 52.223.208.167.1935: Flags [.], seq 146400:147714, ack 1, win 501, options [nop,nop,TS val 1338892394 ecr 1078447690], length 1314
21:38:31.600490 IP 52.223.208.167.1935 > 10.8.1.8.47776: Flags [.], ack 132832, win 134, options [nop,nop,TS val 1078447787 ecr 1338891840], length 0
21:38:31.625137 IP 10.8.1.8.47776 > 52.223.208.167.1935: Flags [.], seq 147714:149028, ack 1, win 501, options [nop,nop,TS val 1338892425 ecr 1078447787], length 1314
21:38:31.659958 IP 10.8.1.8.47776 > 52.223.208.167.1935: Flags [.], seq 149028:150342, ack 1, win 501, options [nop,nop,TS val 1338892460 ecr 1078447787], length 1314
21:38:31.676605 IP 52.223.208.167.1935 > 10.8.1.8.47776: Flags [.], ack 135460, win 134, options [nop,nop,TS val 1078447863 ecr 1338891926], length 0
21:38:31.724488 IP 10.8.1.8.47776 > 52.223.208.167.1935: Flags [.], seq 150342:151656, ack 1, win 501, options [nop,nop,TS val 1338892524 ecr 1078447863], length 1314
21:38:31.758417 IP 10.8.1.8.47776 > 52.223.208.167.1935: Flags [.], seq 151656:152970, ack 1, win 501, options [nop,nop,TS val 1338892558 ecr 1078447863], length 1314
21:38:31.762005 IP 52.223.208.167.1935 > 10.8.1.8.47776: Flags [.], ack 138088, win 134, options [nop,nop,TS val 1078447949 ecr 1338892024], length 0
21:38:31.794064 IP 10.8.1.8.47776 > 52.223.208.167.1935: Flags [.], seq 152970:154284, ack 1, win 501, options [nop,nop,TS val 1338892594 ecr 1078447949], length 1314
21:38:31.861032 IP 10.8.1.8.47776 > 52.223.208.167.1935: Flags [.], seq 154284:155598, ack 1, win 501, options [nop,nop,TS val 1338892661 ecr 1078447949], length 1314
21:38:31.865065 IP 52.223.208.167.1935 > 10.8.1.8.47776: Flags [.], ack 140716, win 134, options [nop,nop,TS val 1078448052 ecr 1338892097], length 0
21:38:31.891612 IP 10.8.1.8.47776 > 52.223.208.167.1935: Flags [.], seq 155598:156912, ack 1, win 501, options [nop,nop,TS val 1338892691 ecr 1078448052], length 1314
21:38:31.927490 IP 10.8.1.8.47776 > 52.223.208.167.1935: Flags [.], seq 156912:158226, ack 1, win 501, options [nop,nop,TS val 1338892727 ecr 1078448052], length 1314
21:38:31.930067 IP 52.223.208.167.1935 > 10.8.1.8.47776: Flags [.], ack 142458, win 134, options [nop,nop,TS val 1078448117 ecr 1338892192], length 0
21:38:31.930105 IP 10.8.1.8.47776 > 52.223.208.167.1935: Flags [P.], seq 158226:158297, ack 1, win 501, options [nop,nop,TS val 1338892730 ecr 1078448117], length 71
21:38:31.993936 IP 10.8.1.8.47776 > 52.223.208.167.1935: Flags [.], seq 158297:159611, ack 1, win 501, options [nop,nop,TS val 1338892794 ecr 1078448117], length 1314
21:38:31.996670 IP 52.223.208.167.1935 > 10.8.1.8.47776: Flags [.], ack 145086, win 134, options [nop,nop,TS val 1078448183 ecr 1338892256], length 0
21:38:32.024747 IP 10.8.1.8.47776 > 52.223.208.167.1935: Flags [.], seq 159611:160925, ack 1, win 501, options [nop,nop,TS val 1338892824 ecr 1078448183], length 1314
21:38:32.059419 IP 10.8.1.8.47776 > 52.223.208.167.1935: Flags [.], seq 160925:162239, ack 1, win 501, options [nop,nop,TS val 1338892859 ecr 1078448183], length 1314
21:38:32.104086 IP 52.223.208.167.1935 > 10.8.1.8.47776: Flags [.], ack 147714, win 134, options [nop,nop,TS val 1078448289 ecr 1338892331], length 0
21:38:32.127542 IP 10.8.1.8.47776 > 52.223.208.167.1935: Flags [.], seq 162239:163553, ack 1, win 501, options [nop,nop,TS val 1338892927 ecr 1078448289], length 1314
21:38:32.159471 IP 10.8.1.8.47776 > 52.223.208.167.1935: Flags [.], seq 163553:164867, ack 1, win 501, options [nop,nop,TS val 1338892959 ecr 1078448289], length 1314
21:38:32.167451 IP 52.223.208.167.1935 > 10.8.1.8.47776: Flags [.], ack 150342, win 134, options [nop,nop,TS val 1078448354 ecr 1338892425], length 0
21:38:32.193535 IP 10.8.1.8.47776 > 52.223.208.167.1935: Flags [.], seq 164867:166181, ack 1, win 501, options [nop,nop,TS val 1338892993 ecr 1078448354], length 1314
21:38:32.260516 IP 10.8.1.8.47776 > 52.223.208.167.1935: Flags [.], seq 166181:167495, ack 1, win 501, options [nop,nop,TS val 1338893060 ecr 1078448354], length 1314
21:38:32.266665 IP 52.223.208.167.1935 > 10.8.1.8.47776: Flags [.], ack 152970, win 134, options [nop,nop,TS val 1078448453 ecr 1338892524], length 0
21:38:32.294374 IP 10.8.1.8.47776 > 52.223.208.167.1935: Flags [.], seq 167495:168809, ack 1, win 501, options [nop,nop,TS val 1338893094 ecr 1078448453], length 1314
21:38:32.324892 IP 10.8.1.8.47776 > 52.223.208.167.1935: Flags [.], seq 168809:170123, ack 1, win 501, options [nop,nop,TS val 1338893125 ecr 1078448453], length 1314
21:38:32.368892 IP 52.223.208.167.1935 > 10.8.1.8.47776: Flags [.], ack 155598, win 134, options [nop,nop,TS val 1078448556 ecr 1338892594], length 0
21:38:32.390142 IP 10.8.1.8.47776 > 52.223.208.167.1935: Flags [.], seq 170123:171437, ack 1, win 501, options [nop,nop,TS val 1338893190 ecr 1078448556], length 1314
21:38:32.423985 IP 10.8.1.8.47776 > 52.223.208.167.1935: Flags [.], seq 171437:172751, ack 1, win 501, options [nop,nop,TS val 1338893224 ecr 1078448556], length 1314
21:38:32.435463 IP 52.223.208.167.1935 > 10.8.1.8.47776: Flags [.], ack 158226, win 134, options [nop,nop,TS val 1078448622 ecr 1338892691], length 0
21:38:32.437796 IP 52.223.208.167.1935 > 10.8.1.8.47776: Flags [.], ack 158297, win 134, options [nop,nop,TS val 1078448624 ecr 1338892730], length 0
21:38:32.437814 IP 10.8.1.8.47776 > 52.223.208.167.1935: Flags [P.], seq 172751:173287, ack 1, win 501, options [nop,nop,TS val 1338893238 ecr 1078448624], length 536
21:38:32.494445 IP 10.8.1.8.47776 > 52.223.208.167.1935: Flags [.], seq 173287:174601, ack 1, win 501, options [nop,nop,TS val 1338893294 ecr 1078448624], length 1314
21:38:32.527800 IP 10.8.1.8.47776 > 52.223.208.167.1935: Flags [.], seq 174601:175915, ack 1, win 501, options [nop,nop,TS val 1338893327 ecr 1078448624], length 1314
21:38:32.532698 IP 52.223.208.167.1935 > 10.8.1.8.47776: Flags [.], ack 160925, win 134, options [nop,nop,TS val 1078448719 ecr 1338892794], length 0
21:38:32.559902 IP 10.8.1.8.47776 > 52.223.208.167.1935: Flags [.], seq 175915:177229, ack 1, win 501, options [nop,nop,TS val 1338893360 ecr 1078448719], length 1314
21:38:32.627672 IP 10.8.1.8.47776 > 52.223.208.167.1935: Flags [.], seq 177229:178543, ack 1, win 501, options [nop,nop,TS val 1338893427 ecr 1078448719], length 1314
21:38:32.635652 IP 52.223.208.167.1935 > 10.8.1.8.47776: Flags [.], ack 163553, win 134, options [nop,nop,TS val 1078448822 ecr 1338892859], length 0
21:38:32.660933 IP 10.8.1.8.47776 > 52.223.208.167.1935: Flags [.], seq 178543:179857, ack 1, win 501, options [nop,nop,TS val 1338893461 ecr 1078448822], length 1314
21:38:32.691763 IP 10.8.1.8.47776 > 52.223.208.167.1935: Flags [.], seq 179857:181171, ack 1, win 501, options [nop,nop,TS val 1338893491 ecr 1078448822], length 1314
21:38:32.701288 IP 52.223.208.167.1935 > 10.8.1.8.47776: Flags [.], ack 166181, win 134, options [nop,nop,TS val 1078448888 ecr 1338892959], length 0
21:38:32.760987 IP 10.8.1.8.47776 > 52.223.208.167.1935: Flags [.], seq 181171:182485, ack 1, win 501, options [nop,nop,TS val 1338893561 ecr 1078448888], length 1314
21:38:32.794141 IP 10.8.1.8.47776 > 52.223.208.167.1935: Flags [.], seq 182485:183799, ack 1, win 501, options [nop,nop,TS val 1338893594 ecr 1078448888], length 1314
21:38:32.802333 IP 52.223.208.167.1935 > 10.8.1.8.47776: Flags [.], ack 168809, win 134, options [nop,nop,TS val 1078448989 ecr 1338893060], length 0
21:38:32.828028 IP 10.8.1.8.47776 > 52.223.208.167.1935: Flags [.], seq 183799:185113, ack 1, win 501, options [nop,nop,TS val 1338893628 ecr 1078448989], length 1314
21:38:32.891637 IP 10.8.1.8.47776 > 52.223.208.167.1935: Flags [.], seq 185113:186427, ack 1, win 501, options [nop,nop,TS val 1338893691 ecr 1078448989], length 1314
21:38:32.897647 IP 52.223.208.167.1935 > 10.8.1.8.47776: Flags [.], ack 171437, win 134, options [nop,nop,TS val 1078449084 ecr 1338893125], length 0
21:38:32.923481 IP 10.8.1.8.47776 > 52.223.208.167.1935: Flags [.], seq 186427:187741, ack 1, win 501, options [nop,nop,TS val 1338893723 ecr 1078449084], length 1314
21:38:32.945857 IP 52.223.208.167.1935 > 10.8.1.8.47776: Flags [.], ack 173287, win 134, options [nop,nop,TS val 1078449133 ecr 1338893224], length 0
21:38:32.945878 IP 10.8.1.8.47776 > 52.223.208.167.1935: Flags [P.], seq 187741:188265, ack 1, win 501, options [nop,nop,TS val 1338893746 ecr 1078449133], length 524
21:38:32.993947 IP 10.8.1.8.47776 > 52.223.208.167.1935: Flags [.], seq 188265:189579, ack 1, win 501, options [nop,nop,TS val 1338893794 ecr 1078449133], length 1314
21:38:33.027464 IP 10.8.1.8.47776 > 52.223.208.167.1935: Flags [.], seq 189579:190893, ack 1, win 501, options [nop,nop,TS val 1338893827 ecr 1078449133], length 1314
21:38:33.035631 IP 52.223.208.167.1935 > 10.8.1.8.47776: Flags [.], ack 175915, win 134, options [nop,nop,TS val 1078449222 ecr 1338893294], length 0
21:38:33.073182 IP 10.8.1.8.47776 > 52.223.208.167.1935: Flags [.], seq 190893:192207, ack 1, win 501, options [nop,nop,TS val 1338893873 ecr 1078449222], length 1314
21:38:33.125086 IP 10.8.1.8.47776 > 52.223.208.167.1935: Flags [.], seq 192207:193521, ack 1, win 501, options [nop,nop,TS val 1338893925 ecr 1078449222], length 1314
21:38:33.130276 IP 52.223.208.167.1935 > 10.8.1.8.47776: Flags [.], ack 177229, win 134, options [nop,nop,TS val 1078449317 ecr 1338893360], length 0
21:38:33.158588 IP 10.8.1.8.47776 > 52.223.208.167.1935: Flags [.], seq 193521:194835, ack 1, win 501, options [nop,nop,TS val 1338893958 ecr 1078449317], length 1314
21:38:33.168568 IP 52.223.208.167.1935 > 10.8.1.8.47776: Flags [.], ack 179857, win 134, options [nop,nop,TS val 1078449356 ecr 1338893427], length 0
21:38:33.200749 IP 10.8.1.8.47776 > 52.223.208.167.1935: Flags [.], seq 194835:196149, ack 1, win 501, options [nop,nop,TS val 1338894000 ecr 1078449356], length 1314
21:38:33.260718 IP 10.8.1.8.47776 > 52.223.208.167.1935: Flags [.], seq 196149:197463, ack 1, win 501, options [nop,nop,TS val 1338894060 ecr 1078449356], length 1314
21:38:33.269018 IP 52.223.208.167.1935 > 10.8.1.8.47776: Flags [.], ack 182485, win 134, options [nop,nop,TS val 1078449456 ecr 1338893491], length 0
21:38:33.294311 IP 10.8.1.8.47776 > 52.223.208.167.1935: Flags [.], seq 197463:198777, ack 1, win 501, options [nop,nop,TS val 1338894094 ecr 1078449456], length 1314
21:38:33.328654 IP 10.8.1.8.47776 > 52.223.208.167.1935: Flags [.], seq 198777:200091, ack 1, win 501, options [nop,nop,TS val 1338894128 ecr 1078449456], length 1314
21:38:33.336080 IP 52.223.208.167.1935 > 10.8.1.8.47776: Flags [.], ack 185113, win 134, options [nop,nop,TS val 1078449523 ecr 1338893594], length 0
21:38:33.392169 IP 10.8.1.8.47776 > 52.223.208.167.1935: Flags [.], seq 200091:201405, ack 1, win 501, options [nop,nop,TS val 1338894192 ecr 1078449523], length 1314
21:38:33.427846 IP 10.8.1.8.47776 > 52.223.208.167.1935: Flags [.], seq 201405:202719, ack 1, win 501, options [nop,nop,TS val 1338894228 ecr 1078449523], length 1314
21:38:33.432339 IP 52.223.208.167.1935 > 10.8.1.8.47776: Flags [.], ack 187741, win 134, options [nop,nop,TS val 1078449618 ecr 1338893691], length 0
21:38:33.453622 IP 52.223.208.167.1935 > 10.8.1.8.47776: Flags [.], ack 188265, win 134, options [nop,nop,TS val 1078449640 ecr 1338893746], length 0
