06:07:27.042570 IP 99.181.100.101.1935 > 10.8.2.6.54052: Flags [.], ack 3021266646, win 311, options [nop,nop,TS val 3762172043 ecr 178987103], length 0
06:07:27.062200 IP 10.8.2.6.54052 > 99.181.100.101.1935: Flags [.], seq 8574:9888, ack 0, win 501, options [nop,nop,TS val 178987438 ecr 3762172043], length 1314
06:07:27.083185 IP 99.181.100.101.1935 > 10.8.2.6.54052: Flags [.], ack 1315, win 317, options [nop,nop,TS val 3762172083 ecr 178987144], length 0
06:07:27.095739 IP 10.8.2.6.54052 > 99.181.100.101.1935: Flags [.], seq 9888:11202, ack 0, win 501, options [nop,nop,TS val 178987472 ecr 3762172083], length 1314
06:07:27.142839 IP 99.181.100.101.1935 > 10.8.2.6.54052: Flags [.], ack 2629, win 323, options [nop,nop,TS val 3762172143 ecr 178987204], length 0
06:07:27.162021 IP 10.8.2.6.54052 > 99.181.100.101.1935: Flags [.], seq 11202:12516, ack 0, win 501, options [nop,nop,TS val 178987538 ecr 3762172143], length 1314
06:07:27.176193 IP 99.181.100.101.1935 > 10.8.2.6.54052: Flags [.], ack 3943, win 328, options [nop,nop,TS val 3762172177 ecr 178987237], length 0
06:07:27.195328 IP 10.8.2.6.54052 > 99.181.100.101.1935: Flags [.], seq 12516:13830, ack 0, win 501, options [nop,nop,TS val 178987572 ecr 3762172177], length 1314
06:07:27.211858 IP 99.181.100.101.1935 > 10.8.2.6.54052: Flags [.], ack 5257, win 334, options [nop,nop,TS val 3762172212 ecr 178987272], length 0
06:07:27.226891 IP 10.8.2.6.54052 > 99.181.100.101.1935: Flags [.], seq 13830:15144, ack 0, win 501, options [nop,nop,TS val 178987603 ecr 3762172212], length 1314
06:07:27.276221 IP 99.181.100.101.1935 > 10.8.2.6.54052: Flags [.], ack 6571, win 340, options [nop,nop,TS val 3762172276 ecr 178987337], length 0
06:07:27.286474 IP 99.181.100.101.1935 > 10.8.2.6.54052: Flags [.], ack 7260, win 345, options [nop,nop,TS val 3762172287 ecr 178987347], length 0
06:07:27.286486 IP 10.8.2.6.54052 > 99.181.100.101.1935: Flags [P.], seq 15144:16316, ack 0, win 501, options [nop,nop,TS val 178987663 ecr 3762172287], length 1172
06:07:27.328430 IP 10.8.2.6.54052 > 99.181.100.101.1935: Flags [.], seq 16316:17630, ack 0, win 501, options [nop,nop,TS val 178987705 ecr 3762172287], length 1314
06:07:27.341051 IP 99.181.100.101.1935 > 10.8.2.6.54052: Flags [.], ack 8574, win 350, options [nop,nop,TS val 3762172341 ecr 178987402], length 0
06:07:27.362318 IP 10.8.2.6.54052 > 99.181.100.101.1935: Flags [.], seq 17630:18944, ack 0, win 501, options [nop,nop,TS val 178987739 ecr 3762172341], length 1314
06:07:27.377783 IP 99.181.100.101.1935 > 10.8.2.6.54052: Flags [.], ack 9888, win 356, options [nop,nop,TS val 3762172378 ecr 178987438], length 0
06:07:27.408840 IP 10.8.2.6.54052 > 99.181.100.101.1935: Flags [.], seq 18944:20258, ack 0, win 501, options [nop,nop,TS val 178987785 ecr 3762172378], length 1314
06:07:27.411318 IP 99.181.100.101.1935 > 10.8.2.6.54052: Flags [.], ack 11202, win 362, options [nop,nop,TS val 3762172412 ecr 178987472], length 0
06:07:27.460880 IP 10.8.2.6.54052 > 99.181.100.101.1935: Flags [.], seq 20258:21572, ack 0, win 501, options [nop,nop,TS val 178987837 ecr 3762172412], length 1314
06:07:27.477599 IP 99.181.100.101.1935 > 10.8.2.6.54052: Flags [.], ack 12516, win 367, options [nop,nop,TS val 3762172478 ecr 178987538], length 0
06:07:27.495185 IP 10.8.2.6.54052 > 99.181.100.101.1935: Flags [.], seq 21572:22886, ack 0, win 501, options [nop,nop,TS val 178987871 ecr 3762172478], length 1314
06:07:27.510987 IP 99.181.100.101.1935 > 10.8.2.6.54052: Flags [.], ack 13830, win 373, options [nop,nop,TS val 3762172511 ecr 178987572], length 0
06:07:27.536859 IP 10.8.2.6.54052 > 99.181.100.101.1935: Flags [.], seq 22886:24200, ack 0, win 501, options [nop,nop,TS val 178987913 ecr 3762172511], length 1314
06:07:27.542507 IP 99.181.100.101.1935 > 10.8.2.6.54052: Flags [.], ack 15144, win 379, options [nop,nop,TS val 3762172543 ecr 178987603], length 0
06:07:27.591355 IP 10.8.2.6.54052 > 99.181.100.101.1935: Flags [.], seq 24200:25514, ack 0, win 501, options [nop,nop,TS val 178987968 ecr 3762172543], length 1314
06:07:27.601872 IP 99.181.100.101.1935 > 10.8.2.6.54052: Flags [.], ack 16316, win 384, options [nop,nop,TS val 3762172602 ecr 178987663], length 0
06:07:27.601889 IP 10.8.2.6.54052 > 99.181.100.101.1935: Flags [P.], seq 25514:26212, ack 0, win 501, options [nop,nop,TS val 178987978 ecr 3762172602], length 698
06:07:27.644207 IP 99.181.100.101.1935 > 10.8.2.6.54052: Flags [.], ack 17630, win 390, options [nop,nop,TS val 3762172645 ecr 178987705], length 0
06:07:27.659847 IP 10.8.2.6.54052 > 99.181.100.101.1935: Flags [.], seq 26212:27526, ack 0, win 501, options [nop,nop,TS val 178988036 ecr 3762172645], length 1314
06:07:27.677984 IP 99.181.100.101.1935 > 10.8.2.6.54052: Flags [.], ack 18944, win 396, options [nop,nop,TS val 3762172678 ecr 178987739], length 0
06:07:27.694012 IP 10.8.2.6.54052 > 99.181.100.101.1935: Flags [.], seq 27526:28840, ack 0, win 501, options [nop,nop,TS val 178988070 ecr 3762172678], length 1314
06:07:27.724547 IP 99.181.100.101.1935 > 10.8.2.6.54052: Flags [.], ack 20258, win 401, options [nop,nop,TS val 3762172725 ecr 178987785], length 0
06:07:27.728279 IP 10.8.2.6.54052 > 99.181.100.101.1935: Flags [.], seq 28840:30154, ack 0, win 501, options [nop,nop,TS val 178988105 ecr 3762172725], length 1314
06:07:27.776511 IP 99.181.100.101.1935 > 10.8.2.6.54052: Flags [.], ack 21572, win 407, options [nop,nop,TS val 3762172777 ecr 178987837], length 0
06:07:27.794467 IP 10.8.2.6.54052 > 99.181.100.101.1935: Flags [.], seq 30154:31468, ack 0, win 501, options [nop,nop,TS val 178988171 ecr 3762172777], length 1314
06:07:27.810745 IP 99.181.100.101.1935 > 10.8.2.6.54052: Flags [.], ack 22886, win 413, options [nop,nop,TS val 3762172811 ecr 178987871], length 0
06:07:27.827857 IP 10.8.2.6.54052 > 99.181.100.101.1935: Flags [.], seq 31468:32782, ack 0, win 501, options [nop,nop,TS val 178988204 ecr 3762172811], length 1314
06:07:27.852401 IP 99.181.100.101.1935 > 10.8.2.6.54052: Flags [.], ack 24200, win 418, options [nop,nop,TS val 3762172853 ecr 178987913], length 0
06:07:27.861308 IP 10.8.2.6.54052 > 99.181.100.101.1935: Flags [.], seq 32782:34096, ack 0, win 501, options [nop,nop,TS val 178988238 ecr 3762172853], length 1314
06:07:27.906816 IP 99.181.100.101.1935 > 10.8.2.6.54052: Flags [.], ack 25514, win 424, options [nop,nop,TS val 3762172907 ecr 178987968], length 0
06:07:27.917381 IP 99.181.100.101.1935 > 10.8.2.6.54052: Flags [.], ack 26212, win 429, options [nop,nop,TS val 3762172918 ecr 178987978], length 0
06:07:27.917390 IP 10.8.2.6.54052 > 99.181.100.101.1935: Flags [P.], seq 34096:35162, ack 0, win 501, options [nop,nop,TS val 178988294 ecr 3762172918], length 1066
06:07:27.958196 IP 10.8.2.6.54052 > 99.181.100.101.1935: Flags [.], seq 35162:36476, ack 0, win 501, options [nop,nop,TS val 178988335 ecr 3762172918], length 1314
06:07:27.975585 IP 99.181.100.101.1935 > 10.8.2.6.54052: Flags [.], ack 27526, win 435, options [nop,nop,TS val 3762172976 ecr 178988036], length 0
06:07:27.995268 IP 10.8.2.6.54052 > 99.181.100.101.1935: Flags [.], seq 36476:37790, ack 0, win 501, options [nop,nop,TS val 178988372 ecr 3762172976], length 1314
06:07:28.009611 IP 99.181.100.101.1935 > 10.8.2.6.54052: Flags [.], ack 28840, win 440, options [nop,nop,TS val 3762173010 ecr 178988070], length 0
06:07:28.028927 IP 10.8.2.6.54052 > 99.181.100.101.1935: Flags [.], seq 37790:39104, ack 0, win 501, options [nop,nop,TS val 178988405 ecr 3762173010], length 1314
06:07:28.043809 IP 99.181.100.101.1935 > 10.8.2.6.54052: Flags [.], ack 30154, win 446, options [nop,nop,TS val 3762173044 ecr 178988105], length 0
06:07:28.091527 IP 10.8.2.6.54052 > 99.181.100.101.1935: Flags [.], seq 39104:40418, ack 0, win 501, options [nop,nop,TS val 178988468 ecr 3762173044], length 1314
06:07:28.110031 IP 99.181.100.101.1935 > 10.8.2.6.54052: Flags [.], ack 31468, win 452, options [nop,nop,TS val 3762173111 ecr 178988171], length 0
06:07:28.129091 IP 10.8.2.6.54052 > 99.181.100.101.1935: Flags [.], seq 40418:41732, ack 0, win 501, options [nop,nop,TS val 178988505 ecr 3762173111], length 1314
06:07:28.143564 IP 99.181.100.101.1935 > 10.8.2.6.54052: Flags [.], ack 32782, win 457, options [nop,nop,TS val 3762173144 ecr 178988204], length 0
06:07:28.163835 IP 10.8.2.6.54052 > 99.181.100.101.1935: Flags [.], seq 41732:43046, ack 0, win 501, options [nop,nop,TS val 178988540 ecr 3762173144], length 1314
06:07:28.176971 IP 99.181.100.101.1935 > 10.8.2.6.54052: Flags [.], ack 34096, win 463, options [nop,nop,TS val 3762173177 ecr 178988238], length 0
06:07:28.227390 IP 10.8.2.6.54052 > 99.181.100.101.1935: Flags [.], seq 43046:44360, ack 0, win 501, options [nop,nop,TS val 178988604 ecr 3762173177], length 1314
06:07:28.232768 IP 99.181.100.101.1935 > 10.8.2.6.54052: Flags [.], ack 35162, win 469, options [nop,nop,TS val 3762173233 ecr 178988294], length 0
06:07:28.232787 IP 10.8.2.6.54052 > 99.181.100.101.1935: Flags [P.], seq 44360:45065, ack 0, win 501, options [nop,nop,TS val 178988609 ecr 3762173233], length 705
06:07:28.273810 IP 99.181.100.101.1935 > 10.8.2.6.54052: Flags [.], ack 36476, win 474, options [nop,nop,TS val 3762173274 ecr 178988335], length 0
06:07:28.294996 IP 10.8.2.6.54052 > 99.181.100.101.1935: Flags [.], seq 45065:46379, ack 0, win 501, options [nop,nop,TS val 178988671 ecr 3762173274], length 1314
06:07:28.310944 IP 99.181.100.101.1935 > 10.8.2.6.54052: Flags [.], ack 37790, win 480, options [nop,nop,TS val 3762173311 ecr 178988372], length 0
06:07:28.326046 IP 10.8.2.6.54052 > 99.181.100.101.1935: Flags [.], seq 46379:47693, ack 0, win 501, options [nop,nop,TS val 178988702 ecr 3762173311], length 1314
06:07:28.344621 IP 99.181.100.101.1935 > 10.8.2.6.54052: Flags [.], ack 39104, win 486, options [nop,nop,TS val 3762173345 ecr 178988405], length 0
06:07:28.359840 IP 10.8.2.6.54052 > 99.181.100.101.1935: Flags [.], seq 47693:49007, ack 0, win 501, options [nop,nop,TS val 178988736 ecr 3762173345], length 1314
06:07:28.407054 IP 99.181.100.101.1935 > 10.8.2.6.54052: Flags [.], ack 40418, win 491, options [nop,nop,TS val 3762173407 ecr 178988468], length 0
06:07:28.430066 IP 10.8.2.6.54052 > 99.181.100.101.1935: Flags [.], seq 49007:50321, ack 0, win 501, options [nop,nop,TS val 178988806 ecr 3762173407], length 1314
06:07:28.444980 IP 99.181.100.101.1935 > 10.8.2.6.54052: Flags [.], ack 41732, win 497, options [nop,nop,TS val 3762173445 ecr 178988505], length 0
06:07:28.461446 IP 10.8.2.6.54052 > 99.181.100.101.1935: Flags [.], seq 50321:51635, ack 0, win 501, options [nop,nop,TS val 178988838 ecr 3762173445], length 1314
06:07:28.479790 IP 99.181.100.101.1935 > 10.8.2.6.54052: Flags [.], ack 43046, win 503, options [nop,nop,TS val 3762173480 ecr 178988540], length 0
06:07:28.494289 IP 10.8.2.6.54052 > 99.181.100.101.1935: Flags [.], seq 51635:52949, ack 0, win 501, options [nop,nop,TS val 178988871 ecr 3762173480], length 1314
06:07:28.543003 IP 99.181.100.101.1935 > 10.8.2.6.54052: Flags [.], ack 44360, win 508, options [nop,nop,TS val 3762173543 ecr 178988604], length 0
06:07:28.548106 IP 99.181.100.101.1935 > 10.8.2.6.54052: Flags [.], ack 45065, win 513, options [nop,nop,TS val 3762173549 ecr 178988609], length 0
06:07:28.548141 IP 10.8.2.6.54052 > 99.181.100.101.1935: Flags [P.], seq 52949:54105, ack 0, win 501, options [nop,nop,TS val 178988924 ecr 3762173549], length 1156
06:07:28.595071 IP 10.8.2.6.54052 > 99.181.100.101.1935: Flags [.], seq 54105:55419, ack 0, win 501, options [nop,nop,TS val 178988971 ecr 3762173549], length 1314
06:07:28.610794 IP 99.181.100.101.1935 > 10.8.2.6.54052: Flags [.], ack 46379, win 519, options [nop,nop,TS val 3762173611 ecr 178988671], length 0
06:07:28.628567 IP 10.8.2.6.54052 > 99.181.100.101.1935: Flags [.], seq 55419:56733, ack 0, win 501, options [nop,nop,TS val 178989005 ecr 3762173611], length 1314
06:07:28.641495 IP 99.181.100.101.1935 > 10.8.2.6.54052: Flags [.], ack 47693, win 525, options [nop,nop,TS val 3762173642 ecr 178988702], length 0
06:07:28.667980 IP 10.8.2.6.54052 > 99.181.100.101.1935: Flags [.], seq 56733:58047, ack 0, win 501, options [nop,nop,TS val 178989044 ecr 3762173642], length 1314
06:07:28.675389 IP 99.181.100.101.1935 > 10.8.2.6.54052: Flags [.], ack 49007, win 530, options [nop,nop,TS val 3762173676 ecr 178988736], length 0
06:07:28.725729 IP 10.8.2.6.54052 > 99.181.100.101.1935: Flags [.], seq 58047:59361, ack 0, win 501, options [nop,nop,TS val 178989102 ecr 3762173676], length 1314
06:07:28.745610 IP 99.181.100.101.1935 > 10.8.2.6.54052: Flags [.], ack 50321, win 536, options [nop,nop,TS val 3762173746 ecr 178988806], length 0
06:07:28.759285 IP 10.8.2.6.54052 > 99.181.100.101.1935: Flags [.], seq 59361:60675, ack 0, win 501, options [nop,nop,TS val 178989136 ecr 3762173746], length 1314
06:07:28.777145 IP 99.181.100.101.1935 > 10.8.2.6.54052: Flags [.], ack 51635, win 542, options [nop,nop,TS val 3762173778 ecr 178988838], length 0
06:07:28.795779 IP 10.8.2.6.54052 > 99.181.100.101.1935: Flags [.], seq 60675:61989, ack 0, win 501, options [nop,nop,TS val 178989172 ecr 3762173778], length 1314
06:07:28.810048 IP 99.181.100.101.1935 > 10.8.2.6.54052: Flags [.], ack 52949, win 547, options [nop,nop,TS val 3762173810 ecr 178988871], length 0
06:07:28.859883 IP 10.8.2.6.54052 > 99.181.100.101.1935: Flags [.], seq 61989:63303, ack 0, win 501, options [nop,nop,TS val 178989236 ecr 3762173810], length 1314
06:07:28.863500 IP 99.181.100.101.1935 > 10.8.2.6.54052: Flags [.], ack 54105, win 553, options [nop,nop,TS val 3762173864 ecr 178988924], length 0
06:07:28.863514 IP 10.8.2.6.54052 > 99.181.100.101.1935: Flags [P.], seq 63303:64008, ack 0, win 501, options [nop,nop,TS val 178989240 ecr 3762173864], length 705
06:07:28.910846 IP 99.181.100.101.1935 > 10.8.2.6.54052: Flags [.], ack 55419, win 559, options [nop,nop,TS val 3762173911 ecr 178988971], length 0
06:07:28.925979 IP 10.8.2.6.54052 > 99.181.100.101.1935: Flags [.], seq 64008:65322, ack 0, win 501, options [nop,nop,TS val 178989302 ecr 3762173911], length 1314
06:07:28.944151 IP 99.181.100.101.1935 > 10.8.2.6.54052: Flags [.], ack 56733, win 564, options [nop,nop,TS val 3762173945 ecr 178989005], length 0
06:07:28.962348 IP 10.8.2.6.54052 > 99.181.100.101.1935: Flags [.], seq 65322:66636, ack 0, win 501, options [nop,nop,TS val 178989339 ecr 3762173945], length 1314
06:07:28.983854 IP 99.181.100.101.1935 > 10.8.2.6.54052: Flags [.], ack 58047, win 570, options [nop,nop,TS val 3762173984 ecr 178989044], length 0
06:07:28.995570 IP 10.8.2.6.54052 > 99.181.100.101.1935: Flags [.], seq 66636:67950, ack 0, win 501, options [nop,nop,TS val 178989372 ecr 3762173984], length 1314
06:07:29.041212 IP 99.181.100.101.1935 > 10.8.2.6.54052: Flags [.], ack 59361, win 576, options [nop,nop,TS val 3762174042 ecr 178989102], length 0
06:07:29.061207 IP 10.8.2.6.54052 > 99.181.100.101.1935: Flags [.], seq 67950:69264, ack 0, win 501, options [nop,nop,TS val 178989438 ecr 3762174042], length 1314
06:07:29.074839 IP 99.181.100.101.1935 > 10.8.2.6.54052: Flags [.], ack 60675, win 581, options [nop,nop,TS val 3762174075 ecr 178989136], length 0
06:07:29.094975 IP 10.8.2.6.54052 > 99.181.100.101.1935: Flags [.], seq 69264:70578, ack 0, win 501, options [nop,nop,TS val 178989471 ecr 3762174075], length 1314
06:07:29.111610 IP 99.181.100.101.1935 > 10.8.2.6.54052: Flags [.], ack 61989, win 587, options [nop,nop,TS val 3762174112 ecr 178989172], length 0
06:07:29.125935 IP 10.8.2.6.54052 > 99.181.100.101.1935: Flags [.], seq 70578:71892, ack 0, win 501, options [nop,nop,TS val 178989502 ecr 3762174112], length 1314
06:07:29.175318 IP 99.181.100.101.1935 > 10.8.2.6.54052: Flags [.], ack 63303, win 592, options [nop,nop,TS val 3762174176 ecr 178989236], length 0
06:07:29.179017 IP 99.181.100.101.1935 > 10.8.2.6.54052: Flags [.], ack 64008, win 598, options [nop,nop,TS val 3762174179 ecr 178989240], length 0
06:07:29.179052 IP 10.8.2.6.54052 > 99.181.100.101.1935: Flags [P.], seq 71892:72960, ack 0, win 501, options [nop,nop,TS val 178989555 ecr 3762174179], length 1068
06:07:29.228783 IP 10.8.2.6.54052 > 99.181.100.101.1935: Flags [.], seq 72960:74274, ack 0, win 501, options [nop,nop,TS val 178989605 ecr 3762174179], length 1314
06:07:29.241486 IP 99.181.100.101.1935 > 10.8.2.6.54052: Flags [.], ack 65322, win 603, options [nop,nop,TS val 3762174242 ecr 178989302], length 0
06:07:29.257896 IP 10.8.2.6.54052 > 99.181.100.101.1935: Flags [.], seq 74274:75588, ack 0, win 501, options [nop,nop,TS val 178989634 ecr 3762174242], length 1314
06:07:29.278136 IP 99.181.100.101.1935 > 10.8.2.6.54052: Flags [.], ack 66636, win 609, options [nop,nop,TS val 3762174278 ecr 178989339], length 0
06:07:29.291625 IP 10.8.2.6.54052 > 99.181.100.101.1935: Flags [.], seq 75588:76902, ack 0, win 501, options [nop,nop,TS val 178989668 ecr 3762174278], length 1314
06:07:29.311187 IP 99.181.100.101.1935 > 10.8.2.6.54052: Flags [.], ack 67950, win 615, options [nop,nop,TS val 3762174312 ecr 178989372], length 0
06:07:29.362206 IP 10.8.2.6.54052 > 99.181.100.101.1935: Flags [.], seq 76902:78216, ack 0, win 501, options [nop,nop,TS val 178989739 ecr 3762174312], length 1314
06:07:29.376814 IP 99.181.100.101.1935 > 10.8.2.6.54052: Flags [.], ack 69264, win 620, options [nop,nop,TS val 3762174377 ecr 178989438], length 0
06:07:29.395703 IP 10.8.2.6.54052 > 99.181.100.101.1935: Flags [.], seq 78216:79530, ack 0, win 501, options [nop,nop,TS val 178989772 ecr 3762174377], length 1314
06:07:29.410634 IP 99.181.100.101.1935 > 10.8.2.6.54052: Flags [.], ack 70578, win 626, options [nop,nop,TS val 3762174411 ecr 178989471], length 0
06:07:29.427404 IP 10.8.2.6.54052 > 99.181.100.101.1935: Flags [.], seq 79530:80844, ack 0, win 501, options [nop,nop,TS val 178989804 ecr 3762174411], length 1314
06:07:29.441840 IP 99.181.100.101.1935 > 10.8.2.6.54052: Flags [.], ack 71892, win 632, options [nop,nop,TS val 3762174442 ecr 178989502], length 0
06:07:29.494668 IP 99.181.100.101.1935 > 10.8.2.6.54052: Flags [.], ack 72960, win 637, options [nop,nop,TS val 3762174495 ecr 178989555], length 0
06:07:29.494707 IP 10.8.2.6.54052 > 99.181.100.101.1935: Flags [P.], seq 80844:82004, ack 0, win 501, options [nop,nop,TS val 178989871 ecr 3762174495], length 1160
06:07:29.524510 IP 10.8.2.6.54052 > 99.181.100.101.1935: Flags [.], seq 82004:83318, ack 0, win 501, options [nop,nop,TS val 178989901 ecr 3762174495], length 1314
06:07:29.544197 IP 99.181.100.101.1935 > 10.8.2.6.54052: Flags [.], ack 74274, win 643, options [nop,nop,TS val 3762174545 ecr 178989605], length 0
06:07:29.557982 IP 10.8.2.6.54052 > 99.181.100.101.1935: Flags [.], seq 83318:84632, ack 0, win 501, options [nop,nop,TS val 178989934 ecr 3762174545], length 1314
06:07:29.573407 IP 99.181.100.101.1935 > 10.8.2.6.54052: Flags [.], ack 75588, win 649, options [nop,nop,TS val 3762174574 ecr 178989634], length 0
06:07:29.607228 IP 99.181.100.101.1935 > 10.8.2.6.54052: Flags [.], ack 76902, win 654, options [nop,nop,TS val 3762174608 ecr 178989668], length 0
06:07:29.608137 IP 10.8.2.6.54052 > 99.181.100.101.1935: Flags [.], seq 84632:85946, ack 0, win 501, options [nop,nop,TS val 178989984 ecr 3762174608], length 1314
06:07:29.662065 IP 10.8.2.6.54052 > 99.181.100.101.1935: Flags [.], seq 85946:87260, ack 0, win 501, options [nop,nop,TS val 178990038 ecr 3762174608], length 1314
06:07:29.677875 IP 99.181.100.101.1935 > 10.8.2.6.54052: Flags [.], ack 78216, win 660, options [nop,nop,TS val 3762174678 ecr 178989739], length 0
06:07:29.693956 IP 10.8.2.6.54052 > 99.181.100.101.1935: Flags [.], seq 87260:88574, ack 0, win 501, options [nop,nop,TS val 178990070 ecr 3762174678], length 1314
06:07:29.711385 IP 99.181.100.101.1935 > 10.8.2.6.54052: Flags [.], ack 79530, win 666, options [nop,nop,TS val 3762174712 ecr 178989772], length 0
06:07:29.736741 IP 10.8.2.6.54052 > 99.181.100.101.1935: Flags [.], seq 88574:89888, ack 0, win 501, options [nop,nop,TS val 178990113 ecr 3762174712], length 1314
06:07:29.742985 IP 99.181.100.101.1935 > 10.8.2.6.54052: Flags [.], ack 80844, win 671, options [nop,nop,TS val 3762174743 ecr 178989804], length 0
06:07:29.791070 IP 10.8.2.6.54052 > 99.181.100.101.1935: Flags [.], seq 89888:91202, ack 0, win 501, options [nop,nop,TS val 178990167 ecr 3762174743], length 1314
06:07:29.810394 IP 99.181.100.101.1935 > 10.8.2.6.54052: Flags [.], ack 82004, win 677, options [nop,nop,TS val 3762174811 ecr 178989871], length 0
06:07:29.810405 IP 10.8.2.6.54052 > 99.181.100.101.1935: Flags [P.], seq 91202:91909, ack 0, win 501, options [nop,nop,TS val 178990187 ecr 3762174811], length 707
06:07:29.840161 IP 99.181.100.101.1935 > 10.8.2.6.54052: Flags [.], ack 83318, win 682, options [nop,nop,TS val 3762174840 ecr 178989901], length 0
06:07:29.860096 IP 10.8.2.6.54052 > 99.181.100.101.1935: Flags [.], seq 91909:93223, ack 0, win 501, options [nop,nop,TS val 178990236 ecr 3762174840], length 1314
06:07:29.873529 IP 99.181.100.101.1935 > 10.8.2.6.54052: Flags [.], ack 84632, win 688, options [nop,nop,TS val 3762174874 ecr 178989934], length 0
06:07:29.895692 IP 10.8.2.6.54052 > 99.181.100.101.1935: Flags [.], seq 93223:94537, ack 0, win 501, options [nop,nop,TS val 178990272 ecr 3762174874], length 1314
06:07:29.924052 IP 99.181.100.101.1935 > 10.8.2.6.54052: Flags [.], ack 85946, win 694, options [nop,nop,TS val 3762174924 ecr 178989984], length 0
06:07:29.928904 IP 10.8.2.6.54052 > 99.181.100.101.1935: Flags [.], seq 94537:95851, ack 0, win 501, options [nop,nop,TS val 178990305 ecr 3762174924], length 1314
06:07:29.977666 IP 99.181.100.101.1935 > 10.8.2.6.54052: Flags [.], ack 87260, win 699, options [nop,nop,TS val 3762174978 ecr 178990038], length 0
06:07:29.995117 IP 10.8.2.6.54052 > 99.181.100.101.1935: Flags [.], seq 95851:97165, ack 0, win 501, options [nop,nop,TS val 178990371 ecr 3762174978], length 1314
06:07:30.009631 IP 99.181.100.101.1935 > 10.8.2.6.54052: Flags [.], ack 88574, win 705, options [nop,nop,TS val 3762175010 ecr 178990070], length 0
06:07:30.029076 IP 10.8.2.6.54052 > 99.181.100.101.1935: Flags [.], seq 97165:98479, ack 0, win 501, options [nop,nop,TS val 178990405 ecr 3762175010], length 1314
06:07:30.052428 IP 99.181.100.101.1935 > 10.8.2.6.54052: Flags [.], ack 89888, win 711, options [nop,nop,TS val 3762175053 ecr 178990113], length 0
06:07:30.059101 IP 10.8.2.6.54052 > 99.181.100.101.1935: Flags [.], seq 98479:99793, ack 0, win 501, options [nop,nop,TS val 178990435 ecr 3762175053], length 1314
06:07:30.106709 IP 99.181.100.101.1935 > 10.8.2.6.54052: Flags [.], ack 91202, win 716, options [nop,nop,TS val 3762175107 ecr 178990167], length 0
06:07:30.125849 IP 99.181.100.101.1935 > 10.8.2.6.54052: Flags [.], ack 91909, win 722, options [nop,nop,TS val 3762175126 ecr 178990187], length 0
06:07:30.125881 IP 10.8.2.6.54052 > 99.181.100.101.1935: Flags [P.], seq 99793:100949, ack 0, win 501, options [nop,nop,TS val 178990502 ecr 3762175126], length 1156
06:07:30.165150 IP 10.8.2.6.54052 > 99.181.100.101.1935: Flags [.], seq 100949:102263, ack 0, win 501, options [nop,nop,TS val 178990541 ecr 3762175126], length 1314
06:07:30.175605 IP 99.181.100.101.1935 > 10.8.2.6.54052: Flags [.], ack 93223, win 727, options [nop,nop,TS val 3762175176 ecr 178990236], length 0
06:07:30.195434 IP 10.8.2.6.54052 > 99.181.100.101.1935: Flags [.], seq 102263:103577, ack 0, win 501, options [nop,nop,TS val 178990572 ecr 3762175176], length 1314
06:07:30.211473 IP 99.181.100.101.1935 > 10.8.2.6.54052: Flags [.], ack 94537, win 733, options [nop,nop,TS val 3762175212 ecr 178990272], length 0
06:07:30.244640 IP 99.181.100.101.1935 > 10.8.2.6.54052: Flags [.], ack 95851, win 739, options [nop,nop,TS val 3762175245 ecr 178990305], length 0
06:07:30.250879 IP 10.8.2.6.54052 > 99.181.100.101.1935: Flags [.], seq 103577:104891, ack 0, win 501, options [nop,nop,TS val 178990627 ecr 3762175245], length 1314
06:07:30.295042 IP 10.8.2.6.54052 > 99.181.100.101.1935: Flags [.], seq 104891:106205, ack 0, win 501, options [nop,nop,TS val 178990671 ecr 3762175245], length 1314
06:07:30.310650 IP 99.181.100.101.1935 > 10.8.2.6.54052: Flags [.], ack 97165, win 744, options [nop,nop,TS val 3762175311 ecr 178990371], length 0
06:07:30.328836 IP 10.8.2.6.54052 > 99.181.100.101.1935: Flags [.], seq 106205:107519, ack 0, win 501, options [nop,nop,TS val 178990705 ecr 3762175311], length 1314
06:07:30.344873 IP 99.181.100.101.1935 > 10.8.2.6.54052: Flags [.], ack 98479, win 750, options [nop,nop,TS val 3762175345 ecr 178990405], length 0
06:07:30.374689 IP 99.181.100.101.1935 > 10.8.2.6.54052: Flags [.], ack 99793, win 755, options [nop,nop,TS val 3762175375 ecr 178990435], length 0
06:07:30.379259 IP 10.8.2.6.54052 > 99.181.100.101.1935: Flags [.], seq 107519:108833, ack 0, win 501, options [nop,nop,TS val 178990756 ecr 3762175375], length 1314
06:07:30.429001 IP 10.8.2.6.54052 > 99.181.100.101.1935: Flags [.], seq 108833:110147, ack 0, win 501, options [nop,nop,TS val 178990805 ecr 3762175375], length 1314
06:07:30.441449 IP 99.181.100.101.1935 > 10.8.2.6.54052: Flags [.], ack 100949, win 761, options [nop,nop,TS val 3762175442 ecr 178990502], length 0
06:07:30.441489 IP 10.8.2.6.54052 > 99.181.100.101.1935: Flags [P.], seq 110147:110757, ack 0, win 501, options [nop,nop,TS val 178990818 ecr 3762175442], length 610
06:07:30.481097 IP 99.181.100.101.1935 > 10.8.2.6.54052: Flags [.], ack 102263, win 767, options [nop,nop,TS val 3762175481 ecr 178990541], length 0
06:07:30.492296 IP 10.8.2.6.54052 > 99.181.100.101.1935: Flags [.], seq 110757:112071, ack 0, win 501, options [nop,nop,TS val 178990869 ecr 3762175481], length 1314
06:07:30.511005 IP 99.181.100.101.1935 > 10.8.2.6.54052: Flags [.], ack 103577, win 772, options [nop,nop,TS val 3762175511 ecr 178990572], length 0
06:07:30.528778 IP 10.8.2.6.54052 > 99.181.100.101.1935: Flags [.], seq 112071:113385, ack 0, win 501, options [nop,nop,TS val 178990905 ecr 3762175511], length 1314
06:07:30.561980 IP 10.8.2.6.54052 > 99.181.100.101.1935: Flags [.], seq 113385:114699, ack 0, win 501, options [nop,nop,TS val 178990938 ecr 3762175511], length 1314
06:07:30.566636 IP 99.181.100.101.1935 > 10.8.2.6.54052: Flags [.], ack 104891, win 778, options [nop,nop,TS val 3762175567 ecr 178990627], length 0
06:07:30.610634 IP 99.181.100.101.1935 > 10.8.2.6.54052: Flags [.], ack 106205, win 784, options [nop,nop,TS val 3762175611 ecr 178990671], length 0
06:07:30.626231 IP 10.8.2.6.54052 > 99.181.100.101.1935: Flags [.], seq 114699:116013, ack 0, win 501, options [nop,nop,TS val 178991003 ecr 3762175611], length 1314
06:07:30.644605 IP 99.181.100.101.1935 > 10.8.2.6.54052: Flags [.], ack 107519, win 789, options [nop,nop,TS val 3762175645 ecr 178990705], length 0
06:07:30.660294 IP 10.8.2.6.54052 > 99.181.100.101.1935: Flags [.], seq 116013:117327, ack 0, win 501, options [nop,nop,TS val 178991037 ecr 3762175645], length 1314
06:07:30.694819 IP 99.181.100.101.1935 > 10.8.2.6.54052: Flags [.], ack 108833, win 795, options [nop,nop,TS val 3762175695 ecr 178990756], length 0
06:07:30.700638 IP 10.8.2.6.54052 > 99.181.100.101.1935: Flags [.], seq 117327:118641, ack 0, win 501, options [nop,nop,TS val 178991077 ecr 3762175695], length 1314
06:07:30.744641 IP 99.181.100.101.1935 > 10.8.2.6.54052: Flags [.], ack 110147, win 801, options [nop,nop,TS val 3762175745 ecr 178990805], length 0
06:07:30.757080 IP 99.181.100.101.1935 > 10.8.2.6.54052: Flags [.], ack 110757, win 806, options [nop,nop,TS val 3762175757 ecr 178990818], length 0
06:07:30.757118 IP 10.8.2.6.54052 > 99.181.100.101.1935: Flags [P.], seq 118641:119809, ack 0, win 501, options [nop,nop,TS val 178991133 ecr 3762175757], length 1168
06:07:30.794761 IP 10.8.2.6.54052 > 99.181.100.101.1935: Flags [.], seq 119809:121123, ack 0, win 501, options [nop,nop,TS val 178991171 ecr 3762175757], length 1314
06:07:30.807845 IP 99.181.100.101.1935 > 10.8.2.6.54052: Flags [.], ack 112071, win 812, options [nop,nop,TS val 3762175808 ecr 178990869], length 0
06:07:30.829226 IP 10.8.2.6.54052 > 99.181.100.101.1935: Flags [.], seq 121123:122437, ack 0, win 501, options [nop,nop,TS val 178991206 ecr 3762175808], length 1314
06:07:30.844216 IP 99.181.100.101.1935 > 10.8.2.6.54052: Flags [.], ack 113385, win 817, options [nop,nop,TS val 3762175845 ecr 178990905], length 0
06:07:30.872287 IP 10.8.2.6.54052 > 99.181.100.101.1935: Flags [.], seq 122437:123751, ack 0, win 501, options [nop,nop,TS val 178991249 ecr 3762175845], length 1314
06:07:30.877649 IP 99.181.100.101.1935 > 10.8.2.6.54052: Flags [.], ack 114699, win 823, options [nop,nop,TS val 3762175878 ecr 178990938], length 0
06:07:30.927313 IP 10.8.2.6.54052 > 99.181.100.101.1935: Flags [.], seq 123751:125065, ack 0, win 501, options [nop,nop,TS val 178991304 ecr 3762175878], length 1314
06:07:30.942035 IP 99.181.100.101.1935 > 10.8.2.6.54052: Flags [.], ack 116013, win 828, options [nop,nop,TS val 3762175942 ecr 178991003], length 0
06:07:30.960554 IP 10.8.2.6.54052 > 99.181.100.101.1935: Flags [.], seq 125065:126379, ack 0, win 501, options [nop,nop,TS val 178991337 ecr 3762175942], length 1314
06:07:30.975908 IP 99.181.100.101.1935 > 10.8.2.6.54052: Flags [.], ack 117327, win 834, options [nop,nop,TS val 3762175976 ecr 178991037], length 0
06:07:31.000454 IP 10.8.2.6.54052 > 99.181.100.101.1935: Flags [.], seq 126379:127693, ack 0, win 501, options [nop,nop,TS val 178991377 ecr 3762175976], length 1314
06:07:31.016302 IP 99.181.100.101.1935 > 10.8.2.6.54052: Flags [.], ack 118641, win 840, options [nop,nop,TS val 3762176017 ecr 178991077], length 0
06:07:31.064769 IP 10.8.2.6.54052 > 99.181.100.101.1935: Flags [.], seq 127693:129007, ack 0, win 501, options [nop,nop,TS val 178991441 ecr 3762176017], length 1314
06:07:31.072676 IP 99.181.100.101.1935 > 10.8.2.6.54052: Flags [.], ack 119809, win 845, options [nop,nop,TS val 3762176073 ecr 178991133], length 0
06:07:31.072715 IP 10.8.2.6.54052 > 99.181.100.101.1935: Flags [P.], seq 129007:129696, ack 0, win 501, options [nop,nop,TS val 178991449 ecr 3762176073], length 689
06:07:31.110461 IP 99.181.100.101.1935 > 10.8.2.6.54052: Flags [.], ack 121123, win 851, options [nop,nop,TS val 3762176111 ecr 178991171], length 0
06:07:31.129120 IP 10.8.2.6.54052 > 99.181.100.101.1935: Flags [.], seq 129696:131010, ack 0, win 501, options [nop,nop,TS val 178991505 ecr 3762176111], length 1314
06:07:31.144994 IP 99.181.100.101.1935 > 10.8.2.6.54052: Flags [.], ack 122437, win 857, options [nop,nop,TS val 3762176145 ecr 178991206], length 0
06:07:31.160116 IP 10.8.2.6.54052 > 99.181.100.101.1935: Flags [.], seq 131010:132324, ack 0, win 501, options [nop,nop,TS val 178991536 ecr 3762176145], length 1314
06:07:31.188088 IP 99.181.100.101.1935 > 10.8.2.6.54052: Flags [.], ack 123751, win 862, options [nop,nop,TS val 3762176188 ecr 178991249], length 0
06:07:31.195298 IP 10.8.2.6.54052 > 99.181.100.101.1935: Flags [.], seq 132324:133638, ack 0, win 501, options [nop,nop,TS val 178991572 ecr 3762176188], length 1314
06:07:31.243009 IP 99.181.100.101.1935 > 10.8.2.6.54052: Flags [.], ack 125065, win 868, options [nop,nop,TS val 3762176243 ecr 178991304], length 0
06:07:31.257878 IP 10.8.2.6.54052 > 99.181.100.101.1935: Flags [.], seq 133638:134952, ack 0, win 501, options [nop,nop,TS val 178991634 ecr 3762176243], length 1314
06:07:31.276221 IP 99.181.100.101.1935 > 10.8.2.6.54052: Flags [.], ack 126379, win 874, options [nop,nop,TS val 3762176277 ecr 178991337], length 0
06:07:31.300108 IP 10.8.2.6.54052 > 99.181.100.101.1935: Flags [.], seq 134952:136266, ack 0, win 501, options [nop,nop,TS val 178991676 ecr 3762176277], length 1314
06:07:31.319889 IP 99.181.100.101.1935 > 10.8.2.6.54052: Flags [.], ack 127693, win 879, options [nop,nop,TS val 3762176320 ecr 178991377], length 0
06:07:31.328756 IP 10.8.2.6.54052 > 99.181.100.101.1935: Flags [.], seq 136266:137580, ack 0, win 501, options [nop,nop,TS val 178991705 ecr 3762176320], length 1314
06:07:31.380423 IP 99.181.100.101.1935 > 10.8.2.6.54052: Flags [.], ack 129007, win 885, options [nop,nop,TS val 3762176381 ecr 178991441], length 0
06:07:31.388241 IP 99.181.100.101.1935 > 10.8.2.6.54052: Flags [.], ack 129696, win 890, options [nop,nop,TS val 3762176389 ecr 178991449], length 0
06:07:31.388277 IP 10.8.2.6.54052 > 99.181.100.101.1935: Flags [P.], seq 137580:138752, ack 0, win 501, options [nop,nop,TS val 178991765 ecr 3762176389], length 1172
06:07:31.428640 IP 10.8.2.6.54052 > 99.181.100.101.1935: Flags [.], seq 138752:140066, ack 0, win 501, options [nop,nop,TS val 178991805 ecr 3762176389], length 1314
06:07:31.445065 IP 99.181.100.101.1935 > 10.8.2.6.54052: Flags [.], ack 131010, win 896, options [nop,nop,TS val 3762176445 ecr 178991505], length 0
06:07:31.461517 IP 10.8.2.6.54052 > 99.181.100.101.1935: Flags [.], seq 140066:141380, ack 0, win 501, options [nop,nop,TS val 178991838 ecr 3762176445], length 1314
06:07:31.475937 IP 99.181.100.101.1935 > 10.8.2.6.54052: Flags [.], ack 132324, win 901, options [nop,nop,TS val 3762176476 ecr 178991536], length 0
06:07:31.510893 IP 99.181.100.101.1935 > 10.8.2.6.54052: Flags [.], ack 133638, win 907, options [nop,nop,TS val 3762176511 ecr 178991572], length 0
06:07:31.514524 IP 10.8.2.6.54052 > 99.181.100.101.1935: Flags [.], seq 141380:142694, ack 0, win 501, options [nop,nop,TS val 178991891 ecr 3762176511], length 1314
06:07:31.559398 IP 10.8.2.6.54052 > 99.181.100.101.1935: Flags [.], seq 142694:144008, ack 0, win 501, options [nop,nop,TS val 178991936 ecr 3762176511], length 1314
06:07:31.573415 IP 99.181.100.101.1935 > 10.8.2.6.54052: Flags [.], ack 134952, win 913, options [nop,nop,TS val 3762176574 ecr 178991634], length 0
06:07:31.600070 IP 10.8.2.6.54052 > 99.181.100.101.1935: Flags [.], seq 144008:145322, ack 0, win 501, options [nop,nop,TS val 178991976 ecr 3762176574], length 1314
06:07:31.615708 IP 99.181.100.101.1935 > 10.8.2.6.54052: Flags [.], ack 136266, win 918, options [nop,nop,TS val 3762176616 ecr 178991676], length 0
06:07:31.642931 IP 10.8.2.6.54052 > 99.181.100.101.1935: Flags [.], seq 145322:146636, ack 0, win 501, options [nop,nop,TS val 178992019 ecr 3762176616], length 1314
06:07:31.644435 IP 99.181.100.101.1935 > 10.8.2.6.54052: Flags [.], ack 137580, win 924, options [nop,nop,TS val 3762176645 ecr 178991705], length 0
06:07:31.693819 IP 10.8.2.6.54052 > 99.181.100.101.1935: Flags [.], seq 146636:147950, ack 0, win 501, options [nop,nop,TS val 178992070 ecr 3762176645], length 1314
06:07:31.703865 IP 99.181.100.101.1935 > 10.8.2.6.54052: Flags [.], ack 138752, win 930, options [nop,nop,TS val 3762176704 ecr 178991765], length 0
06:07:31.703894 IP 10.8.2.6.54052 > 99.181.100.101.1935: Flags [P.], seq 147950:148549, ack 0, win 501, options [nop,nop,TS val 178992080 ecr 3762176704], length 599
06:07:31.744341 IP 99.181.100.101.1935 > 10.8.2.6.54052: Flags [.], ack 140066, win 935, options [nop,nop,TS val 3762176745 ecr 178991805], length 0
06:07:31.771276 IP 10.8.2.6.54052 > 99.181.100.101.1935: Flags [.], seq 148549:149863, ack 0, win 501, options [nop,nop,TS val 178992148 ecr 3762176745], length 1314
06:07:31.777222 IP 99.181.100.101.1935 > 10.8.2.6.54052: Flags [.], ack 141380, win 941, options [nop,nop,TS val 3762176777 ecr 178991838], length 0
06:07:31.794998 IP 10.8.2.6.54052 > 99.181.100.101.1935: Flags [.], seq 149863:151177, ack 0, win 501, options [nop,nop,TS val 178992171 ecr 3762176777], length 1314
06:07:31.830098 IP 99.181.100.101.1935 > 10.8.2.6.54052: Flags [.], ack 142694, win 947, options [nop,nop,TS val 3762176830 ecr 178991891], length 0
06:07:31.835658 IP 10.8.2.6.54052 > 99.181.100.101.1935: Flags [.], seq 151177:152491, ack 0, win 501, options [nop,nop,TS val 178992212 ecr 3762176830], length 1314
06:07:31.875198 IP 99.181.100.101.1935 > 10.8.2.6.54052: Flags [.], ack 144008, win 952, options [nop,nop,TS val 3762176875 ecr 178991936], length 0
06:07:31.900015 IP 10.8.2.6.54052 > 99.181.100.101.1935: Flags [.], seq 152491:153805, ack 0, win 501, options [nop,nop,TS val 178992276 ecr 3762176875], length 1314
06:07:31.928218 IP 10.8.2.6.54052 > 99.181.100.101.1935: Flags [.], seq 153805:155119, ack 0, win 501, options [nop,nop,TS val 178992305 ecr 3762176875], length 1314
06:07:31.964128 IP 10.8.2.6.54052 > 99.181.100.101.1935: Flags [.], seq 155119:156433, ack 0, win 501, options [nop,nop,TS val 178992340 ecr 3762176875], length 1314
06:07:32.027968 IP 10.8.2.6.54052 > 99.181.100.101.1935: Flags [.], seq 156433:157747, ack 0, win 501, options [nop,nop,TS val 178992404 ecr 3762176875], length 1314
06:07:32.070380 IP 10.8.2.6.54052 > 99.181.100.101.1935: Flags [.], seq 157747:159061, ack 0, win 501, options [nop,nop,TS val 178992447 ecr 3762176875], length 1314
06:07:32.094742 IP 10.8.2.6.54052 > 99.181.100.101.1935: Flags [.], seq 159061:160375, ack 0, win 501, options [nop,nop,TS val 178992471 ecr 3762176875], length 1314
06:07:32.134165 IP 10.8.2.6.54052 > 99.181.100.101.1935: Flags [P.], seq 160375:160716, ack 0, win 501, options [nop,nop,TS val 178992510 ecr 3762176875], length 341
06:07:32.162137 IP 10.8.2.6.54052 > 99.181.100.101.1935: Flags [.], seq 160716:162030, ack 0, win 501, options [nop,nop,TS val 178992538 ecr 3762176875], length 1314
06:07:32.199087 IP 10.8.2.6.54052 > 99.181.100.101.1935: Flags [.], seq 162030:163344, ack 0, win 501, options [nop,nop,TS val 178992575 ecr 3762176875], length 1314
06:07:32.259040 IP 10.8.2.6.54052 > 99.181.100.101.1935: Flags [.], seq 163344:164658, ack 0, win 501, options [nop,nop,TS val 178992635 ecr 3762176875], length 1314
06:07:32.305752 IP 10.8.2.6.54052 > 99.181.100.101.1935: Flags [.], seq 164658:165972, ack 0, win 501, options [nop,nop,TS val 178992682 ecr 3762176875], length 1314
06:07:32.328984 IP 10.8.2.6.54052 > 99.181.100.101.1935: Flags [.], seq 165972:167286, ack 0, win 501, options [nop,nop,TS val 178992705 ecr 3762176875], length 1314
06:07:32.391457 IP 10.8.2.6.54052 > 99.181.100.101.1935: Flags [.], seq 167286:168600, ack 0, win 501, options [nop,nop,TS val 178992768 ecr 3762176875], length 1314
06:07:32.433942 IP 10.8.2.6.54052 > 99.181.100.101.1935: Flags [.], seq 168600:169914, ack 0, win 501, options [nop,nop,TS val 178992810 ecr 3762176875], length 1314
06:07:32.457934 IP 10.8.2.6.54052 > 99.181.100.101.1935: Flags [.], seq 169914:171228, ack 0, win 501, options [nop,nop,TS val 178992834 ecr 3762176875], length 1314
06:07:32.519088 IP 10.8.2.6.54052 > 99.181.100.101.1935: Flags [.], seq 171228:172542, ack 0, win 501, options [nop,nop,TS val 178992895 ecr 3762176875], length 1314
06:07:32.562260 IP 10.8.2.6.54052 > 99.181.100.101.1935: Flags [.], seq 172542:173856, ack 0, win 501, options [nop,nop,TS val 178992939 ecr 3762176875], length 1314
06:07:32.604956 IP 10.8.2.6.54052 > 99.181.100.101.1935: Flags [.], seq 173856:175170, ack 0, win 501, options [nop,nop,TS val 178992981 ecr 3762176875], length 1314
06:07:32.647787 IP 10.8.2.6.54052 > 99.181.100.101.1935: Flags [.], seq 175170:176484, ack 0, win 501, options [nop,nop,TS val 178993024 ecr 3762176875], length 1314
06:07:32.695577 IP 10.8.2.6.54052 > 99.181.100.101.1935: Flags [.], seq 176484:177798, ack 0, win 501, options [nop,nop,TS val 178993072 ecr 3762176875], length 1314
06:07:32.733605 IP 10.8.2.6.54052 > 99.181.100.101.1935: Flags [.], seq 177798:179112, ack 0, win 501, options [nop,nop,TS val 178993110 ecr 3762176875], length 1314
06:07:32.776158 IP 10.8.2.6.54052 > 99.181.100.101.1935: Flags [.], seq 179112:180426, ack 0, win 501, options [nop,nop,TS val 178993152 ecr 3762176875], length 1314
06:07:32.840603 IP 10.8.2.6.54052 > 99.181.100.101.1935: Flags [.], seq 180426:181740, ack 0, win 501, options [nop,nop,TS val 178993217 ecr 3762176875], length 1314
06:07:32.862391 IP 10.8.2.6.54052 > 99.181.100.101.1935: Flags [.], seq 181740:183054, ack 0, win 501, options [nop,nop,TS val 178993239 ecr 3762176875], length 1314
06:07:32.905133 IP 10.8.2.6.54052 > 99.181.100.101.1935: Flags [.], seq 183054:184368, ack 0, win 501, options [nop,nop,TS val 178993281 ecr 3762176875], length 1314
