01:36:09.733335 IP 10.8.1.3.34268 > 52.223.208.7.1935: Flags [.], seq 3251125428:3251126742, ack 3992092625, win 501, options [nop,nop,TS val 2690106679 ecr 2824004984], length 1314
01:36:09.756442 IP 52.223.208.7.1935 > 10.8.1.3.34268: Flags [.], ack 4294960021, win 126, options [nop,nop,TS val 2824005065 ecr 2690106343], length 0
01:36:09.766631 IP 10.8.1.3.34268 > 52.223.208.7.1935: Flags [.], seq 1314:2628, ack 1, win 501, options [nop,nop,TS val 2690106712 ecr 2824005065], length 1314
01:36:09.800157 IP 10.8.1.3.34268 > 52.223.208.7.1935: Flags [.], seq 2628:3942, ack 1, win 501, options [nop,nop,TS val 2690106745 ecr 2824005065], length 1314
01:36:09.852244 IP 52.223.208.7.1935 > 10.8.1.3.34268: Flags [.], ack 4294962649, win 126, options [nop,nop,TS val 2824005161 ecr 2690106412], length 0
01:36:09.864237 IP 10.8.1.3.34268 > 52.223.208.7.1935: Flags [.], seq 3942:5256, ack 1, win 501, options [nop,nop,TS val 2690106810 ecr 2824005161], length 1314
01:36:09.896251 IP 10.8.1.3.34268 > 52.223.208.7.1935: Flags [.], seq 5256:6570, ack 1, win 501, options [nop,nop,TS val 2690106842 ecr 2824005161], length 1314
01:36:09.925358 IP 52.223.208.7.1935 > 10.8.1.3.34268: Flags [.], ack 4294965277, win 126, options [nop,nop,TS val 2824005234 ecr 2690106512], length 0
01:36:09.930314 IP 10.8.1.3.34268 > 52.223.208.7.1935: Flags [.], seq 6570:7884, ack 1, win 501, options [nop,nop,TS val 2690106876 ecr 2824005234], length 1314
01:36:09.997208 IP 52.223.208.7.1935 > 10.8.1.3.34268: Flags [.], ack 0, win 126, options [nop,nop,TS val 2824005306 ecr 2690106610], length 0
01:36:09.997304 IP 10.8.1.3.34268 > 52.223.208.7.1935: Flags [P.], seq 7884:9040, ack 1, win 501, options [nop,nop,TS val 2690106943 ecr 2824005306], length 1156
01:36:10.031021 IP 10.8.1.3.34268 > 52.223.208.7.1935: Flags [.], seq 9040:10354, ack 1, win 501, options [nop,nop,TS val 2690106976 ecr 2824005306], length 1314
01:36:10.063703 IP 10.8.1.3.34268 > 52.223.208.7.1935: Flags [.], seq 10354:11668, ack 1, win 501, options [nop,nop,TS val 2690107009 ecr 2824005306], length 1314
01:36:10.089532 IP 52.223.208.7.1935 > 10.8.1.3.34268: Flags [.], ack 2628, win 126, options [nop,nop,TS val 2824005398 ecr 2690106679], length 0
01:36:10.104664 IP 10.8.1.3.34268 > 52.223.208.7.1935: Flags [.], seq 11668:12982, ack 1, win 501, options [nop,nop,TS val 2690107050 ecr 2824005398], length 1314
01:36:10.166629 IP 10.8.1.3.34268 > 52.223.208.7.1935: Flags [.], seq 12982:14296, ack 1, win 501, options [nop,nop,TS val 2690107112 ecr 2824005398], length 1314
01:36:10.183227 IP 52.223.208.7.1935 > 10.8.1.3.34268: Flags [.], ack 5256, win 126, options [nop,nop,TS val 2824005492 ecr 2690106745], length 0
01:36:10.198673 IP 10.8.1.3.34268 > 52.223.208.7.1935: Flags [.], seq 14296:15610, ack 1, win 501, options [nop,nop,TS val 2690107144 ecr 2824005492], length 1314
01:36:10.232903 IP 10.8.1.3.34268 > 52.223.208.7.1935: Flags [.], seq 15610:16924, ack 1, win 501, options [nop,nop,TS val 2690107178 ecr 2824005492], length 1314
01:36:10.248778 IP 52.223.208.7.1935 > 10.8.1.3.34268: Flags [.], ack 7884, win 126, options [nop,nop,TS val 2824005557 ecr 2690106842], length 0
01:36:10.296495 IP 10.8.1.3.34268 > 52.223.208.7.1935: Flags [.], seq 16924:18238, ack 1, win 501, options [nop,nop,TS val 2690107242 ecr 2824005557], length 1314
01:36:10.319793 IP 52.223.208.7.1935 > 10.8.1.3.34268: Flags [.], ack 9040, win 126, options [nop,nop,TS val 2824005628 ecr 2690106943], length 0
01:36:10.319804 IP 10.8.1.3.34268 > 52.223.208.7.1935: Flags [P.], seq 18238:19038, ack 1, win 501, options [nop,nop,TS val 2690107265 ecr 2824005628], length 800
01:36:10.365903 IP 10.8.1.3.34268 > 52.223.208.7.1935: Flags [.], seq 19038:20352, ack 1, win 501, options [nop,nop,TS val 2690107311 ecr 2824005628], length 1314
01:36:10.385054 IP 52.223.208.7.1935 > 10.8.1.3.34268: Flags [.], ack 11668, win 126, options [nop,nop,TS val 2824005694 ecr 2690106976], length 0
01:36:10.398630 IP 10.8.1.3.34268 > 52.223.208.7.1935: Flags [.], seq 20352:21666, ack 1, win 501, options [nop,nop,TS val 2690107344 ecr 2824005694], length 1314
01:36:10.445146 IP 10.8.1.3.34268 > 52.223.208.7.1935: Flags [.], seq 21666:22980, ack 1, win 501, options [nop,nop,TS val 2690107390 ecr 2824005694], length 1314
01:36:10.487494 IP 52.223.208.7.1935 > 10.8.1.3.34268: Flags [.], ack 14296, win 126, options [nop,nop,TS val 2824005796 ecr 2690107050], length 0
01:36:10.499034 IP 10.8.1.3.34268 > 52.223.208.7.1935: Flags [.], seq 22980:24294, ack 1, win 501, options [nop,nop,TS val 2690107444 ecr 2824005796], length 1314
01:36:10.533688 IP 10.8.1.3.34268 > 52.223.208.7.1935: Flags [.], seq 24294:25608, ack 1, win 501, options [nop,nop,TS val 2690107479 ecr 2824005796], length 1314
01:36:10.550164 IP 52.223.208.7.1935 > 10.8.1.3.34268: Flags [.], ack 16924, win 126, options [nop,nop,TS val 2824005859 ecr 2690107144], length 0
01:36:10.573697 IP 10.8.1.3.34268 > 52.223.208.7.1935: Flags [.], seq 25608:26922, ack 1, win 501, options [nop,nop,TS val 2690107519 ecr 2824005859], length 1314
01:36:10.629670 IP 10.8.1.3.34268 > 52.223.208.7.1935: Flags [.], seq 26922:28236, ack 1, win 501, options [nop,nop,TS val 2690107575 ecr 2824005859], length 1314
01:36:10.636942 IP 52.223.208.7.1935 > 10.8.1.3.34268: Flags [.], ack 19038, win 126, options [nop,nop,TS val 2824005946 ecr 2690107242], length 0
01:36:10.636955 IP 10.8.1.3.34268 > 52.223.208.7.1935: Flags [P.], seq 28236:28839, ack 1, win 501, options [nop,nop,TS val 2690107582 ecr 2824005946], length 603
01:36:10.696211 IP 10.8.1.3.34268 > 52.223.208.7.1935: Flags [.], seq 28839:30153, ack 1, win 501, options [nop,nop,TS val 2690107642 ecr 2824005946], length 1314
01:36:10.717191 IP 52.223.208.7.1935 > 10.8.1.3.34268: Flags [.], ack 21666, win 126, options [nop,nop,TS val 2824006026 ecr 2690107311], length 0
01:36:10.730791 IP 10.8.1.3.34268 > 52.223.208.7.1935: Flags [.], seq 30153:31467, ack 1, win 501, options [nop,nop,TS val 2690107676 ecr 2824006026], length 1314
01:36:10.765033 IP 10.8.1.3.34268 > 52.223.208.7.1935: Flags [.], seq 31467:32781, ack 1, win 501, options [nop,nop,TS val 2690107710 ecr 2824006026], length 1314
01:36:10.817339 IP 52.223.208.7.1935 > 10.8.1.3.34268: Flags [.], ack 24294, win 126, options [nop,nop,TS val 2824006126 ecr 2690107390], length 0
01:36:10.832886 IP 10.8.1.3.34268 > 52.223.208.7.1935: Flags [.], seq 32781:34095, ack 1, win 501, options [nop,nop,TS val 2690107778 ecr 2824006126], length 1314
01:36:10.865821 IP 10.8.1.3.34268 > 52.223.208.7.1935: Flags [.], seq 34095:35409, ack 1, win 501, options [nop,nop,TS val 2690107811 ecr 2824006126], length 1314
01:36:10.891800 IP 52.223.208.7.1935 > 10.8.1.3.34268: Flags [.], ack 26922, win 126, options [nop,nop,TS val 2824006200 ecr 2690107479], length 0
01:36:10.900120 IP 10.8.1.3.34268 > 52.223.208.7.1935: Flags [.], seq 35409:36723, ack 1, win 501, options [nop,nop,TS val 2690107845 ecr 2824006200], length 1314
01:36:10.954257 IP 52.223.208.7.1935 > 10.8.1.3.34268: Flags [.], ack 28839, win 126, options [nop,nop,TS val 2824006263 ecr 2690107575], length 0
01:36:10.954293 IP 10.8.1.3.34268 > 52.223.208.7.1935: Flags [P.], seq 36723:37884, ack 1, win 501, options [nop,nop,TS val 2690107900 ecr 2824006263], length 1161
01:36:11.000155 IP 10.8.1.3.34268 > 52.223.208.7.1935: Flags [.], seq 37884:39198, ack 1, win 501, options [nop,nop,TS val 2690107945 ecr 2824006263], length 1314
01:36:11.033599 IP 10.8.1.3.34268 > 52.223.208.7.1935: Flags [.], seq 39198:40512, ack 1, win 501, options [nop,nop,TS val 2690107979 ecr 2824006263], length 1314
01:36:11.050807 IP 52.223.208.7.1935 > 10.8.1.3.34268: Flags [.], ack 31467, win 126, options [nop,nop,TS val 2824006359 ecr 2690107642], length 0
01:36:11.067087 IP 10.8.1.3.34268 > 52.223.208.7.1935: Flags [.], seq 40512:41826, ack 1, win 501, options [nop,nop,TS val 2690108012 ecr 2824006359], length 1314
01:36:11.134040 IP 10.8.1.3.34268 > 52.223.208.7.1935: Flags [.], seq 41826:43140, ack 1, win 501, options [nop,nop,TS val 2690108079 ecr 2824006359], length 1314
01:36:11.154005 IP 52.223.208.7.1935 > 10.8.1.3.34268: Flags [.], ack 34095, win 126, options [nop,nop,TS val 2824006460 ecr 2690107710], length 0
01:36:11.167462 IP 10.8.1.3.34268 > 52.223.208.7.1935: Flags [.], seq 43140:44454, ack 1, win 501, options [nop,nop,TS val 2690108113 ecr 2824006460], length 1314
01:36:11.201004 IP 10.8.1.3.34268 > 52.223.208.7.1935: Flags [.], seq 44454:45768, ack 1, win 501, options [nop,nop,TS val 2690108146 ecr 2824006460], length 1314
01:36:11.227870 IP 52.223.208.7.1935 > 10.8.1.3.34268: Flags [.], ack 36723, win 126, options [nop,nop,TS val 2824006532 ecr 2690107811], length 0
01:36:11.267481 IP 10.8.1.3.34268 > 52.223.208.7.1935: Flags [.], seq 45768:47082, ack 1, win 501, options [nop,nop,TS val 2690108213 ecr 2824006532], length 1314
01:36:11.280786 IP 52.223.208.7.1935 > 10.8.1.3.34268: Flags [.], ack 37884, win 126, options [nop,nop,TS val 2824006584 ecr 2690107900], length 0
01:36:11.280811 IP 10.8.1.3.34268 > 52.223.208.7.1935: Flags [P.], seq 47082:47882, ack 1, win 501, options [nop,nop,TS val 2690108226 ecr 2824006584], length 800
01:36:11.334371 IP 10.8.1.3.34268 > 52.223.208.7.1935: Flags [.], seq 47882:49196, ack 1, win 501, options [nop,nop,TS val 2690108280 ecr 2824006584], length 1314
01:36:11.351569 IP 52.223.208.7.1935 > 10.8.1.3.34268: Flags [.], ack 40512, win 126, options [nop,nop,TS val 2824006659 ecr 2690107945], length 0
01:36:11.366058 IP 10.8.1.3.34268 > 52.223.208.7.1935: Flags [.], seq 49196:50510, ack 1, win 501, options [nop,nop,TS val 2690108311 ecr 2824006659], length 1314
01:36:11.406317 IP 10.8.1.3.34268 > 52.223.208.7.1935: Flags [.], seq 50510:51824, ack 1, win 501, options [nop,nop,TS val 2690108352 ecr 2824006659], length 1314
01:36:11.455850 IP 52.223.208.7.1935 > 10.8.1.3.34268: Flags [.], ack 41826, win 126, options [nop,nop,TS val 2824006762 ecr 2690108012], length 0
01:36:11.468178 IP 10.8.1.3.34268 > 52.223.208.7.1935: Flags [.], seq 51824:53138, ack 1, win 501, options [nop,nop,TS val 2690108413 ecr 2824006762], length 1314
01:36:11.488618 IP 52.223.208.7.1935 > 10.8.1.3.34268: Flags [.], ack 44454, win 126, options [nop,nop,TS val 2824006797 ecr 2690108079], length 0
01:36:11.500969 IP 10.8.1.3.34268 > 52.223.208.7.1935: Flags [.], seq 53138:54452, ack 1, win 501, options [nop,nop,TS val 2690108446 ecr 2824006797], length 1314
01:36:11.534790 IP 10.8.1.3.34268 > 52.223.208.7.1935: Flags [.], seq 54452:55766, ack 1, win 501, options [nop,nop,TS val 2690108480 ecr 2824006797], length 1314
01:36:11.588192 IP 52.223.208.7.1935 > 10.8.1.3.34268: Flags [.], ack 47082, win 126, options [nop,nop,TS val 2824006897 ecr 2690108146], length 0
01:36:11.598620 IP 10.8.1.3.34268 > 52.223.208.7.1935: Flags [.], seq 55766:57080, ack 1, win 501, options [nop,nop,TS val 2690108544 ecr 2824006897], length 1314
01:36:11.600788 IP 52.223.208.7.1935 > 10.8.1.3.34268: Flags [.], ack 47882, win 126, options [nop,nop,TS val 2824006909 ecr 2690108226], length 0
01:36:11.600804 IP 10.8.1.3.34268 > 52.223.208.7.1935: Flags [P.], seq 57080:57769, ack 1, win 501, options [nop,nop,TS val 2690108546 ecr 2824006909], length 689
01:36:11.664510 IP 10.8.1.3.34268 > 52.223.208.7.1935: Flags [.], seq 57769:59083, ack 1, win 501, options [nop,nop,TS val 2690108610 ecr 2824006909], length 1314
01:36:11.684036 IP 52.223.208.7.1935 > 10.8.1.3.34268: Flags [.], ack 50510, win 126, options [nop,nop,TS val 2824006993 ecr 2690108280], length 0
01:36:11.700290 IP 10.8.1.3.34268 > 52.223.208.7.1935: Flags [.], seq 59083:60397, ack 1, win 501, options [nop,nop,TS val 2690108646 ecr 2824006993], length 1314
01:36:11.733584 IP 10.8.1.3.34268 > 52.223.208.7.1935: Flags [.], seq 60397:61711, ack 1, win 501, options [nop,nop,TS val 2690108679 ecr 2824006993], length 1314
01:36:11.793580 IP 52.223.208.7.1935 > 10.8.1.3.34268: Flags [.], ack 53138, win 126, options [nop,nop,TS val 2824007102 ecr 2690108352], length 0
01:36:11.796617 IP 10.8.1.3.34268 > 52.223.208.7.1935: Flags [.], seq 61711:63025, ack 1, win 501, options [nop,nop,TS val 2690108742 ecr 2824007102], length 1314
01:36:11.833384 IP 10.8.1.3.34268 > 52.223.208.7.1935: Flags [.], seq 63025:64339, ack 1, win 501, options [nop,nop,TS val 2690108779 ecr 2824007102], length 1314
01:36:11.864068 IP 52.223.208.7.1935 > 10.8.1.3.34268: Flags [.], ack 55766, win 126, options [nop,nop,TS val 2824007172 ecr 2690108446], length 0
01:36:11.867240 IP 10.8.1.3.34268 > 52.223.208.7.1935: Flags [.], seq 64339:65653, ack 1, win 501, options [nop,nop,TS val 2690108813 ecr 2824007172], length 1314
01:36:11.931061 IP 10.8.1.3.34268 > 52.223.208.7.1935: Flags [.], seq 65653:66967, ack 1, win 501, options [nop,nop,TS val 2690108876 ecr 2824007172], length 1314
01:36:11.931200 IP 52.223.208.7.1935 > 10.8.1.3.34268: Flags [.], ack 57769, win 126, options [nop,nop,TS val 2824007240 ecr 2690108544], length 0
01:36:11.931217 IP 10.8.1.3.34268 > 52.223.208.7.1935: Flags [P.], seq 66967:67673, ack 1, win 501, options [nop,nop,TS val 2690108877 ecr 2824007240], length 706
01:36:12.000622 IP 10.8.1.3.34268 > 52.223.208.7.1935: Flags [.], seq 67673:68987, ack 1, win 501, options [nop,nop,TS val 2690108946 ecr 2824007240], length 1314
01:36:12.031831 IP 52.223.208.7.1935 > 10.8.1.3.34268: Flags [.], ack 60397, win 126, options [nop,nop,TS val 2824007340 ecr 2690108610], length 0
01:36:12.033470 IP 10.8.1.3.34268 > 52.223.208.7.1935: Flags [.], seq 68987:70301, ack 1, win 501, options [nop,nop,TS val 2690108979 ecr 2824007340], length 1314
01:36:12.064111 IP 10.8.1.3.34268 > 52.223.208.7.1935: Flags [.], seq 70301:71615, ack 1, win 501, options [nop,nop,TS val 2690109009 ecr 2824007340], length 1314
01:36:12.127201 IP 52.223.208.7.1935 > 10.8.1.3.34268: Flags [.], ack 63025, win 126, options [nop,nop,TS val 2824007436 ecr 2690108679], length 0
01:36:12.133808 IP 10.8.1.3.34268 > 52.223.208.7.1935: Flags [.], seq 71615:72929, ack 1, win 501, options [nop,nop,TS val 2690109079 ecr 2824007436], length 1314
01:36:12.164233 IP 10.8.1.3.34268 > 52.223.208.7.1935: Flags [.], seq 72929:74243, ack 1, win 501, options [nop,nop,TS val 2690109110 ecr 2824007436], length 1314
01:36:12.192814 IP 52.223.208.7.1935 > 10.8.1.3.34268: Flags [.], ack 65653, win 126, options [nop,nop,TS val 2824007501 ecr 2690108779], length 0
01:36:12.197648 IP 10.8.1.3.34268 > 52.223.208.7.1935: Flags [.], seq 74243:75557, ack 1, win 501, options [nop,nop,TS val 2690109143 ecr 2824007501], length 1314
01:36:12.257078 IP 52.223.208.7.1935 > 10.8.1.3.34268: Flags [.], ack 67673, win 126, options [nop,nop,TS val 2824007566 ecr 2690108876], length 0
01:36:12.257108 IP 10.8.1.3.34268 > 52.223.208.7.1935: Flags [P.], seq 75557:76721, ack 1, win 501, options [nop,nop,TS val 2690109202 ecr 2824007566], length 1164
01:36:12.296063 IP 10.8.1.3.34268 > 52.223.208.7.1935: Flags [.], seq 76721:78035, ack 1, win 501, options [nop,nop,TS val 2690109241 ecr 2824007566], length 1314
01:36:12.330049 IP 10.8.1.3.34268 > 52.223.208.7.1935: Flags [.], seq 78035:79349, ack 1, win 501, options [nop,nop,TS val 2690109275 ecr 2824007566], length 1314
01:36:12.352424 IP 52.223.208.7.1935 > 10.8.1.3.34268: Flags [.], ack 70301, win 126, options [nop,nop,TS val 2824007661 ecr 2690108946], length 0
01:36:12.367572 IP 10.8.1.3.34268 > 52.223.208.7.1935: Flags [.], seq 79349:80663, ack 1, win 501, options [nop,nop,TS val 2690109313 ecr 2824007661], length 1314
01:36:12.433575 IP 10.8.1.3.34268 > 52.223.208.7.1935: Flags [.], seq 80663:81977, ack 1, win 501, options [nop,nop,TS val 2690109379 ecr 2824007661], length 1314
01:36:12.445455 IP 52.223.208.7.1935 > 10.8.1.3.34268: Flags [.], ack 71615, win 126, options [nop,nop,TS val 2824007754 ecr 2690109009], length 0
01:36:12.464103 IP 10.8.1.3.34268 > 52.223.208.7.1935: Flags [.], seq 81977:83291, ack 1, win 501, options [nop,nop,TS val 2690109409 ecr 2824007754], length 1314
01:36:12.483413 IP 52.223.208.7.1935 > 10.8.1.3.34268: Flags [.], ack 74243, win 126, options [nop,nop,TS val 2824007792 ecr 2690109079], length 0
01:36:12.498217 IP 10.8.1.3.34268 > 52.223.208.7.1935: Flags [.], seq 83291:84605, ack 1, win 501, options [nop,nop,TS val 2690109444 ecr 2824007792], length 1314
01:36:12.560736 IP 10.8.1.3.34268 > 52.223.208.7.1935: Flags [.], seq 84605:85919, ack 1, win 501, options [nop,nop,TS val 2690109506 ecr 2824007792], length 1314
01:36:12.576034 IP 52.223.208.7.1935 > 10.8.1.3.34268: Flags [.], ack 76721, win 126, options [nop,nop,TS val 2824007884 ecr 2690109143], length 0
01:36:12.576074 IP 10.8.1.3.34268 > 52.223.208.7.1935: Flags [P.], seq 85919:86707, ack 1, win 501, options [nop,nop,TS val 2690109521 ecr 2824007884], length 788
01:36:12.625293 IP 10.8.1.3.34268 > 52.223.208.7.1935: Flags [.], seq 86707:88021, ack 1, win 501, options [nop,nop,TS val 2690109571 ecr 2824007884], length 1314
01:36:12.650458 IP 52.223.208.7.1935 > 10.8.1.3.34268: Flags [.], ack 79349, win 126, options [nop,nop,TS val 2824007959 ecr 2690109241], length 0
01:36:12.666935 IP 10.8.1.3.34268 > 52.223.208.7.1935: Flags [.], seq 88021:89335, ack 1, win 501, options [nop,nop,TS val 2690109612 ecr 2824007959], length 1314
01:36:12.700279 IP 10.8.1.3.34268 > 52.223.208.7.1935: Flags [.], seq 89335:90649, ack 1, win 501, options [nop,nop,TS val 2690109646 ecr 2824007959], length 1314
01:36:12.753761 IP 10.8.1.3.34268 > 52.223.208.7.1935: Flags [.], seq 90649:91963, ack 1, win 501, options [nop,nop,TS val 2690109699 ecr 2824007959], length 1314
01:36:12.758841 IP 52.223.208.7.1935 > 10.8.1.3.34268: Flags [.], ack 81977, win 126, options [nop,nop,TS val 2824008067 ecr 2690109313], length 0
01:36:12.796732 IP 10.8.1.3.34268 > 52.223.208.7.1935: Flags [.], seq 91963:93277, ack 1, win 501, options [nop,nop,TS val 2690109742 ecr 2824008067], length 1314
01:36:12.822913 IP 52.223.208.7.1935 > 10.8.1.3.34268: Flags [.], ack 84605, win 126, options [nop,nop,TS val 2824008131 ecr 2690109409], length 0
01:36:12.833568 IP 10.8.1.3.34268 > 52.223.208.7.1935: Flags [.], seq 93277:94591, ack 1, win 501, options [nop,nop,TS val 2690109779 ecr 2824008131], length 1314
01:36:12.882595 IP 10.8.1.3.34268 > 52.223.208.7.1935: Flags [.], seq 94591:95905, ack 1, win 501, options [nop,nop,TS val 2690109828 ecr 2824008131], length 1314
01:36:12.910302 IP 52.223.208.7.1935 > 10.8.1.3.34268: Flags [.], ack 86707, win 126, options [nop,nop,TS val 2824008219 ecr 2690109506], length 0
01:36:12.910343 IP 10.8.1.3.34268 > 52.223.208.7.1935: Flags [P.], seq 95905:96707, ack 1, win 501, options [nop,nop,TS val 2690109856 ecr 2824008219], length 802
01:36:12.966698 IP 10.8.1.3.34268 > 52.223.208.7.1935: Flags [.], seq 96707:98021, ack 1, win 501, options [nop,nop,TS val 2690109912 ecr 2824008219], length 1314
01:36:12.989917 IP 10.8.1.3.34268 > 52.223.208.7.1935: Flags [.], seq 98021:99335, ack 1, win 501, options [nop,nop,TS val 2690109935 ecr 2824008219], length 1314
01:36:13.003042 IP 52.223.208.7.1935 > 10.8.1.3.34268: Flags [.], ack 89335, win 126, options [nop,nop,TS val 2824008311 ecr 2690109571], length 0
01:36:13.032590 IP 10.8.1.3.34268 > 52.223.208.7.1935: Flags [.], seq 99335:100649, ack 1, win 501, options [nop,nop,TS val 2690109978 ecr 2824008311], length 1314
01:36:13.088926 IP 52.223.208.7.1935 > 10.8.1.3.34268: Flags [.], ack 91963, win 126, options [nop,nop,TS val 2824008397 ecr 2690109646], length 0
01:36:13.097053 IP 10.8.1.3.34268 > 52.223.208.7.1935: Flags [.], seq 100649:101963, ack 1, win 501, options [nop,nop,TS val 2690110042 ecr 2824008397], length 1314
01:36:13.118558 IP 10.8.1.3.34268 > 52.223.208.7.1935: Flags [.], seq 101963:103277, ack 1, win 501, options [nop,nop,TS val 2690110064 ecr 2824008397], length 1314
01:36:13.156489 IP 52.223.208.7.1935 > 10.8.1.3.34268: Flags [.], ack 94591, win 126, options [nop,nop,TS val 2824008465 ecr 2690109742], length 0
01:36:13.165985 IP 10.8.1.3.34268 > 52.223.208.7.1935: Flags [.], seq 103277:104591, ack 1, win 501, options [nop,nop,TS val 2690110111 ecr 2824008465], length 1314
01:36:13.225541 IP 10.8.1.3.34268 > 52.223.208.7.1935: Flags [.], seq 104591:105905, ack 1, win 501, options [nop,nop,TS val 2690110171 ecr 2824008465], length 1314
01:36:13.227720 IP 52.223.208.7.1935 > 10.8.1.3.34268: Flags [.], ack 96707, win 126, options [nop,nop,TS val 2824008536 ecr 2690109828], length 0
01:36:13.227760 IP 10.8.1.3.34268 > 52.223.208.7.1935: Flags [P.], seq 105905:106499, ack 1, win 501, options [nop,nop,TS val 2690110173 ecr 2824008536], length 594
01:36:13.289820 IP 10.8.1.3.34268 > 52.223.208.7.1935: Flags [.], seq 106499:107813, ack 1, win 501, options [nop,nop,TS val 2690110235 ecr 2824008536], length 1314
01:36:13.307240 IP 52.223.208.7.1935 > 10.8.1.3.34268: Flags [.], ack 99335, win 126, options [nop,nop,TS val 2824008616 ecr 2690109912], length 0
01:36:13.332900 IP 10.8.1.3.34268 > 52.223.208.7.1935: Flags [.], seq 107813:109127, ack 1, win 501, options [nop,nop,TS val 2690110278 ecr 2824008616], length 1314
01:36:13.354380 IP 10.8.1.3.34268 > 52.223.208.7.1935: Flags [.], seq 109127:110441, ack 1, win 501, options [nop,nop,TS val 2690110300 ecr 2824008616], length 1314
01:36:13.415911 IP 52.223.208.7.1935 > 10.8.1.3.34268: Flags [.], ack 101963, win 126, options [nop,nop,TS val 2824008724 ecr 2690109978], length 0
01:36:13.418748 IP 10.8.1.3.34268 > 52.223.208.7.1935: Flags [.], seq 110441:111755, ack 1, win 501, options [nop,nop,TS val 2690110364 ecr 2824008724], length 1314
01:36:13.461588 IP 10.8.1.3.34268 > 52.223.208.7.1935: Flags [.], seq 111755:113069, ack 1, win 501, options [nop,nop,TS val 2690110407 ecr 2824008724], length 1314
01:36:13.485701 IP 52.223.208.7.1935 > 10.8.1.3.34268: Flags [.], ack 104591, win 126, options [nop,nop,TS val 2824008794 ecr 2690110064], length 0
01:36:13.500258 IP 10.8.1.3.34268 > 52.223.208.7.1935: Flags [.], seq 113069:114383, ack 1, win 501, options [nop,nop,TS val 2690110446 ecr 2824008794], length 1314
01:36:13.546610 IP 52.223.208.7.1935 > 10.8.1.3.34268: Flags [.], ack 106499, win 126, options [nop,nop,TS val 2824008855 ecr 2690110171], length 0
01:36:13.546631 IP 10.8.1.3.34268 > 52.223.208.7.1935: Flags [P.], seq 114383:115555, ack 1, win 501, options [nop,nop,TS val 2690110492 ecr 2824008855], length 1172
01:36:13.589930 IP 10.8.1.3.34268 > 52.223.208.7.1935: Flags [.], seq 115555:116869, ack 1, win 501, options [nop,nop,TS val 2690110535 ecr 2824008855], length 1314
01:36:13.632359 IP 10.8.1.3.34268 > 52.223.208.7.1935: Flags [.], seq 116869:118183, ack 1, win 501, options [nop,nop,TS val 2690110578 ecr 2824008855], length 1314
01:36:13.654450 IP 52.223.208.7.1935 > 10.8.1.3.34268: Flags [.], ack 109127, win 126, options [nop,nop,TS val 2824008963 ecr 2690110235], length 0
01:36:13.665626 IP 10.8.1.3.34268 > 52.223.208.7.1935: Flags [.], seq 118183:119497, ack 1, win 501, options [nop,nop,TS val 2690110611 ecr 2824008963], length 1314
01:36:13.733662 IP 10.8.1.3.34268 > 52.223.208.7.1935: Flags [.], seq 119497:120811, ack 1, win 501, options [nop,nop,TS val 2690110679 ecr 2824008963], length 1314
01:36:13.740087 IP 52.223.208.7.1935 > 10.8.1.3.34268: Flags [.], ack 111755, win 126, options [nop,nop,TS val 2824009049 ecr 2690110300], length 0
01:36:13.761353 IP 10.8.1.3.34268 > 52.223.208.7.1935: Flags [.], seq 120811:122125, ack 1, win 501, options [nop,nop,TS val 2690110707 ecr 2824009049], length 1314
01:36:13.797739 IP 10.8.1.3.34268 > 52.223.208.7.1935: Flags [.], seq 122125:123439, ack 1, win 501, options [nop,nop,TS val 2690110743 ecr 2824009049], length 1314
01:36:13.820644 IP 52.223.208.7.1935 > 10.8.1.3.34268: Flags [.], ack 114383, win 126, options [nop,nop,TS val 2824009129 ecr 2690110407], length 0
01:36:13.864155 IP 52.223.208.7.1935 > 10.8.1.3.34268: Flags [.], ack 115555, win 126, options [nop,nop,TS val 2824009173 ecr 2690110492], length 0
01:36:13.864187 IP 10.8.1.3.34268 > 52.223.208.7.1935: Flags [P.], seq 123439:124599, ack 1, win 501, options [nop,nop,TS val 2690110810 ecr 2824009173], length 1160
01:36:13.889838 IP 10.8.1.3.34268 > 52.223.208.7.1935: Flags [.], seq 124599:125913, ack 1, win 501, options [nop,nop,TS val 2690110835 ecr 2824009173], length 1314
01:36:13.932824 IP 10.8.1.3.34268 > 52.223.208.7.1935: Flags [.], seq 125913:127227, ack 1, win 501, options [nop,nop,TS val 2690110878 ecr 2824009173], length 1314
01:36:13.952161 IP 52.223.208.7.1935 > 10.8.1.3.34268: Flags [.], ack 118183, win 126, options [nop,nop,TS val 2824009260 ecr 2690110535], length 0
01:36:13.975751 IP 10.8.1.3.34268 > 52.223.208.7.1935: Flags [.], seq 127227:128541, ack 1, win 501, options [nop,nop,TS val 2690110921 ecr 2824009260], length 1314
01:36:14.033288 IP 10.8.1.3.34268 > 52.223.208.7.1935: Flags [.], seq 128541:129855, ack 1, win 501, options [nop,nop,TS val 2690110979 ecr 2824009260], length 1314
01:36:14.052314 IP 52.223.208.7.1935 > 10.8.1.3.34268: Flags [.], ack 120811, win 126, options [nop,nop,TS val 2824009361 ecr 2690110611], length 0
01:36:14.061778 IP 10.8.1.3.34268 > 52.223.208.7.1935: Flags [.], seq 129855:131169, ack 1, win 501, options [nop,nop,TS val 2690111007 ecr 2824009361], length 1314
01:36:14.104660 IP 10.8.1.3.34268 > 52.223.208.7.1935: Flags [.], seq 131169:132483, ack 1, win 501, options [nop,nop,TS val 2690111050 ecr 2824009361], length 1314
01:36:14.119677 IP 52.223.208.7.1935 > 10.8.1.3.34268: Flags [.], ack 123439, win 126, options [nop,nop,TS val 2824009428 ecr 2690110707], length 0
01:36:14.166320 IP 10.8.1.3.34268 > 52.223.208.7.1935: Flags [.], seq 132483:133797, ack 1, win 501, options [nop,nop,TS val 2690111112 ecr 2824009428], length 1314
01:36:14.183096 IP 52.223.208.7.1935 > 10.8.1.3.34268: Flags [.], ack 124599, win 126, options [nop,nop,TS val 2824009492 ecr 2690110810], length 0
01:36:14.183130 IP 10.8.1.3.34268 > 52.223.208.7.1935: Flags [P.], seq 133797:134494, ack 1, win 501, options [nop,nop,TS val 2690111128 ecr 2824009492], length 697
01:36:14.229814 IP 10.8.1.3.34268 > 52.223.208.7.1935: Flags [.], seq 134494:135808, ack 1, win 501, options [nop,nop,TS val 2690111175 ecr 2824009492], length 1314
01:36:14.250860 IP 52.223.208.7.1935 > 10.8.1.3.34268: Flags [.], ack 127227, win 126, options [nop,nop,TS val 2824009559 ecr 2690110835], length 0
01:36:14.263215 IP 10.8.1.3.34268 > 52.223.208.7.1935: Flags [.], seq 135808:137122, ack 1, win 501, options [nop,nop,TS val 2690111209 ecr 2824009559], length 1314
01:36:14.300204 IP 10.8.1.3.34268 > 52.223.208.7.1935: Flags [.], seq 137122:138436, ack 1, win 501, options [nop,nop,TS val 2690111245 ecr 2824009559], length 1314
01:36:14.350643 IP 52.223.208.7.1935 > 10.8.1.3.34268: Flags [.], ack 129855, win 126, options [nop,nop,TS val 2824009659 ecr 2690110921], length 0
01:36:14.360299 IP 10.8.1.3.34268 > 52.223.208.7.1935: Flags [.], seq 138436:139750, ack 1, win 501, options [nop,nop,TS val 2690111306 ecr 2824009659], length 1314
01:36:14.400280 IP 10.8.1.3.34268 > 52.223.208.7.1935: Flags [.], seq 139750:141064, ack 1, win 501, options [nop,nop,TS val 2690111346 ecr 2824009659], length 1314
01:36:14.422046 IP 52.223.208.7.1935 > 10.8.1.3.34268: Flags [.], ack 132483, win 126, options [nop,nop,TS val 2824009731 ecr 2690111007], length 0
01:36:14.429246 IP 10.8.1.3.34268 > 52.223.208.7.1935: Flags [.], seq 141064:142378, ack 1, win 501, options [nop,nop,TS val 2690111375 ecr 2824009731], length 1314
01:36:14.488833 IP 10.8.1.3.34268 > 52.223.208.7.1935: Flags [.], seq 142378:143692, ack 1, win 501, options [nop,nop,TS val 2690111434 ecr 2824009731], length 1314
01:36:14.500245 IP 52.223.208.7.1935 > 10.8.1.3.34268: Flags [.], ack 134494, win 126, options [nop,nop,TS val 2824009809 ecr 2690111112], length 0
01:36:14.500277 IP 10.8.1.3.34268 > 52.223.208.7.1935: Flags [P.], seq 143692:144302, ack 1, win 501, options [nop,nop,TS val 2690111446 ecr 2824009809], length 610
01:36:14.562372 IP 10.8.1.3.34268 > 52.223.208.7.1935: Flags [.], seq 144302:145616, ack 1, win 501, options [nop,nop,TS val 2690111508 ecr 2824009809], length 1314
01:36:14.581244 IP 52.223.208.7.1935 > 10.8.1.3.34268: Flags [.], ack 137122, win 126, options [nop,nop,TS val 2824009890 ecr 2690111175], length 0
01:36:14.595764 IP 10.8.1.3.34268 > 52.223.208.7.1935: Flags [.], seq 145616:146930, ack 1, win 501, options [nop,nop,TS val 2690111541 ecr 2824009890], length 1314
01:36:14.633328 IP 10.8.1.3.34268 > 52.223.208.7.1935: Flags [.], seq 146930:148244, ack 1, win 501, options [nop,nop,TS val 2690111579 ecr 2824009890], length 1314
01:36:14.680444 IP 52.223.208.7.1935 > 10.8.1.3.34268: Flags [.], ack 139750, win 126, options [nop,nop,TS val 2824009989 ecr 2690111245], length 0
01:36:14.700385 IP 10.8.1.3.34268 > 52.223.208.7.1935: Flags [.], seq 148244:149558, ack 1, win 501, options [nop,nop,TS val 2690111646 ecr 2824009989], length 1314
01:36:14.724169 IP 10.8.1.3.34268 > 52.223.208.7.1935: Flags [.], seq 149558:150872, ack 1, win 501, options [nop,nop,TS val 2690111669 ecr 2824009989], length 1314
01:36:14.754431 IP 52.223.208.7.1935 > 10.8.1.3.34268: Flags [.], ack 142378, win 126, options [nop,nop,TS val 2824010063 ecr 2690111346], length 0
01:36:14.765558 IP 10.8.1.3.34268 > 52.223.208.7.1935: Flags [.], seq 150872:152186, ack 1, win 501, options [nop,nop,TS val 2690111711 ecr 2824010063], length 1314
01:36:14.821209 IP 52.223.208.7.1935 > 10.8.1.3.34268: Flags [.], ack 144302, win 126, options [nop,nop,TS val 2824010130 ecr 2690111434], length 0
01:36:14.821238 IP 10.8.1.3.34268 > 52.223.208.7.1935: Flags [P.], seq 152186:153437, ack 1, win 501, options [nop,nop,TS val 2690111767 ecr 2824010130], length 1251
01:36:14.865311 IP 10.8.1.3.34268 > 52.223.208.7.1935: Flags [.], seq 153437:154751, ack 1, win 501, options [nop,nop,TS val 2690111811 ecr 2824010130], length 1314
01:36:14.895576 IP 10.8.1.3.34268 > 52.223.208.7.1935: Flags [.], seq 154751:156065, ack 1, win 501, options [nop,nop,TS val 2690111841 ecr 2824010130], length 1314
01:36:14.915074 IP 52.223.208.7.1935 > 10.8.1.3.34268: Flags [.], ack 146930, win 126, options [nop,nop,TS val 2824010224 ecr 2690111508], length 0
01:36:14.938622 IP 10.8.1.3.34268 > 52.223.208.7.1935: Flags [.], seq 156065:157379, ack 1, win 501, options [nop,nop,TS val 2690111884 ecr 2824010224], length 1314
01:36:14.997570 IP 10.8.1.3.34268 > 52.223.208.7.1935: Flags [.], seq 157379:158693, ack 1, win 501, options [nop,nop,TS val 2690111943 ecr 2824010224], length 1314
01:36:15.017915 IP 52.223.208.7.1935 > 10.8.1.3.34268: Flags [.], ack 149558, win 126, options [nop,nop,TS val 2824010326 ecr 2690111579], length 0
01:36:15.024233 IP 10.8.1.3.34268 > 52.223.208.7.1935: Flags [.], seq 158693:160007, ack 1, win 501, options [nop,nop,TS val 2690111970 ecr 2824010326], length 1314
01:36:15.067073 IP 10.8.1.3.34268 > 52.223.208.7.1935: Flags [.], seq 160007:161321, ack 1, win 501, options [nop,nop,TS val 2690112012 ecr 2824010326], length 1314
01:36:15.086058 IP 52.223.208.7.1935 > 10.8.1.3.34268: Flags [.], ack 152186, win 126, options [nop,nop,TS val 2824010395 ecr 2690111669], length 0
01:36:15.131337 IP 10.8.1.3.34268 > 52.223.208.7.1935: Flags [.], seq 161321:162635, ack 1, win 501, options [nop,nop,TS val 2690112077 ecr 2824010395], length 1314
01:36:15.143685 IP 52.223.208.7.1935 > 10.8.1.3.34268: Flags [.], ack 153437, win 126, options [nop,nop,TS val 2824010452 ecr 2690111767], length 0
01:36:15.143715 IP 10.8.1.3.34268 > 52.223.208.7.1935: Flags [P.], seq 162635:163342, ack 1, win 501, options [nop,nop,TS val 2690112089 ecr 2824010452], length 707
01:36:15.195399 IP 10.8.1.3.34268 > 52.223.208.7.1935: Flags [.], seq 163342:164656, ack 1, win 501, options [nop,nop,TS val 2690112141 ecr 2824010452], length 1314
01:36:15.218900 IP 52.223.208.7.1935 > 10.8.1.3.34268: Flags [.], ack 156065, win 126, options [nop,nop,TS val 2824010527 ecr 2690111811], length 0
01:36:15.229369 IP 10.8.1.3.34268 > 52.223.208.7.1935: Flags [.], seq 164656:165970, ack 1, win 501, options [nop,nop,TS val 2690112175 ecr 2824010527], length 1314
01:36:15.263780 IP 10.8.1.3.34268 > 52.223.208.7.1935: Flags [.], seq 165970:167284, ack 1, win 501, options [nop,nop,TS val 2690112209 ecr 2824010527], length 1314
01:36:15.327323 IP 52.223.208.7.1935 > 10.8.1.3.34268: Flags [.], ack 158693, win 126, options [nop,nop,TS val 2824010635 ecr 2690111884], length 0
01:36:15.333542 IP 10.8.1.3.34268 > 52.223.208.7.1935: Flags [.], seq 167284:168598, ack 1, win 501, options [nop,nop,TS val 2690112279 ecr 2824010635], length 1314
01:36:15.362624 IP 10.8.1.3.34268 > 52.223.208.7.1935: Flags [.], seq 168598:169912, ack 1, win 501, options [nop,nop,TS val 2690112308 ecr 2824010635], length 1314
01:36:15.388663 IP 52.223.208.7.1935 > 10.8.1.3.34268: Flags [.], ack 161321, win 126, options [nop,nop,TS val 2824010697 ecr 2690111970], length 0
01:36:15.396628 IP 10.8.1.3.34268 > 52.223.208.7.1935: Flags [.], seq 169912:171226, ack 1, win 501, options [nop,nop,TS val 2690112342 ecr 2824010697], length 1314
01:36:15.465005 IP 10.8.1.3.34268 > 52.223.208.7.1935: Flags [.], seq 171226:172540, ack 1, win 501, options [nop,nop,TS val 2690112410 ecr 2824010697], length 1314
01:36:15.473251 IP 52.223.208.7.1935 > 10.8.1.3.34268: Flags [.], ack 163342, win 126, options [nop,nop,TS val 2824010782 ecr 2690112077], length 0
01:36:15.473287 IP 10.8.1.3.34268 > 52.223.208.7.1935: Flags [P.], seq 172540:173329, ack 1, win 501, options [nop,nop,TS val 2690112419 ecr 2824010782], length 789
01:36:15.529441 IP 10.8.1.3.34268 > 52.223.208.7.1935: Flags [.], seq 173329:174643, ack 1, win 501, options [nop,nop,TS val 2690112475 ecr 2824010782], length 1314
01:36:15.552510 IP 52.223.208.7.1935 > 10.8.1.3.34268: Flags [.], ack 165970, win 126, options [nop,nop,TS val 2824010861 ecr 2690112141], length 0
01:36:15.557275 IP 10.8.1.3.34268 > 52.223.208.7.1935: Flags [.], seq 174643:175957, ack 1, win 501, options [nop,nop,TS val 2690112503 ecr 2824010861], length 1314
01:36:15.600320 IP 10.8.1.3.34268 > 52.223.208.7.1935: Flags [.], seq 175957:177271, ack 1, win 501, options [nop,nop,TS val 2690112546 ecr 2824010861], length 1314
01:36:15.653477 IP 52.223.208.7.1935 > 10.8.1.3.34268: Flags [.], ack 167284, win 126, options [nop,nop,TS val 2824010962 ecr 2690112209], length 0
01:36:15.663997 IP 10.8.1.3.34268 > 52.223.208.7.1935: Flags [.], seq 177271:178585, ack 1, win 501, options [nop,nop,TS val 2690112609 ecr 2824010962], length 1314
01:36:15.681254 IP 52.223.208.7.1935 > 10.8.1.3.34268: Flags [.], ack 169912, win 126, options [nop,nop,TS val 2824010990 ecr 2690112279], length 0
01:36:15.699638 IP 10.8.1.3.34268 > 52.223.208.7.1935: Flags [.], seq 178585:179899, ack 1, win 501, options [nop,nop,TS val 2690112645 ecr 2824010990], length 1314
01:36:15.733278 IP 10.8.1.3.34268 > 52.223.208.7.1935: Flags [.], seq 179899:181213, ack 1, win 501, options [nop,nop,TS val 2690112679 ecr 2824010990], length 1314
01:36:15.783530 IP 52.223.208.7.1935 > 10.8.1.3.34268: Flags [.], ack 172540, win 126, options [nop,nop,TS val 2824011092 ecr 2690112342], length 0
01:36:15.792119 IP 52.223.208.7.1935 > 10.8.1.3.34268: Flags [.], ack 173329, win 126, options [nop,nop,TS val 2824011101 ecr 2690112419], length 0
01:36:15.792153 IP 10.8.1.3.34268 > 52.223.208.7.1935: Flags [P.], seq 181213:182281, ack 1, win 501, options [nop,nop,TS val 2690112737 ecr 2824011101], length 1068
01:36:15.833238 IP 10.8.1.3.34268 > 52.223.208.7.1935: Flags [.], seq 182281:183595, ack 1, win 501, options [nop,nop,TS val 2690112779 ecr 2824011101], length 1314
01:36:15.866712 IP 10.8.1.3.34268 > 52.223.208.7.1935: Flags [.], seq 183595:184909, ack 1, win 501, options [nop,nop,TS val 2690112812 ecr 2824011101], length 1314
01:36:15.879720 IP 52.223.208.7.1935 > 10.8.1.3.34268: Flags [.], ack 175957, win 126, options [nop,nop,TS val 2824011188 ecr 2690112475], length 0
01:36:15.900541 IP 10.8.1.3.34268 > 52.223.208.7.1935: Flags [.], seq 184909:186223, ack 1, win 501, options [nop,nop,TS val 2690112846 ecr 2824011188], length 1314
01:36:15.963134 IP 10.8.1.3.34268 > 52.223.208.7.1935: Flags [.], seq 186223:187537, ack 1, win 501, options [nop,nop,TS val 2690112908 ecr 2824011188], length 1314
01:36:15.986704 IP 52.223.208.7.1935 > 10.8.1.3.34268: Flags [.], ack 178585, win 126, options [nop,nop,TS val 2824011295 ecr 2690112546], length 0
01:36:15.997269 IP 10.8.1.3.34268 > 52.223.208.7.1935: Flags [.], seq 187537:188851, ack 1, win 501, options [nop,nop,TS val 2690112943 ecr 2824011295], length 1314
01:36:16.033424 IP 10.8.1.3.34268 > 52.223.208.7.1935: Flags [.], seq 188851:190165, ack 1, win 501, options [nop,nop,TS val 2690112979 ecr 2824011295], length 1314
01:36:16.052953 IP 52.223.208.7.1935 > 10.8.1.3.34268: Flags [.], ack 181213, win 126, options [nop,nop,TS val 2824011362 ecr 2690112645], length 0
01:36:16.092839 IP 10.8.1.3.34268 > 52.223.208.7.1935: Flags [.], seq 190165:191479, ack 1, win 501, options [nop,nop,TS val 2690113038 ecr 2824011362], length 1314
01:36:16.109647 IP 52.223.208.7.1935 > 10.8.1.3.34268: Flags [.], ack 182281, win 126, options [nop,nop,TS val 2824011418 ecr 2690112737], length 0
01:36:16.109660 IP 10.8.1.3.34268 > 52.223.208.7.1935: Flags [P.], seq 191479:192184, ack 1, win 501, options [nop,nop,TS val 2690113055 ecr 2824011418], length 705
01:36:16.164093 IP 10.8.1.3.34268 > 52.223.208.7.1935: Flags [.], seq 192184:193498, ack 1, win 501, options [nop,nop,TS val 2690113109 ecr 2824011418], length 1314
01:36:16.187946 IP 52.223.208.7.1935 > 10.8.1.3.34268: Flags [.], ack 184909, win 126, options [nop,nop,TS val 2824011496 ecr 2690112779], length 0
01:36:16.198765 IP 10.8.1.3.34268 > 52.223.208.7.1935: Flags [.], seq 193498:194812, ack 1, win 501, options [nop,nop,TS val 2690113144 ecr 2824011496], length 1314
01:36:16.233071 IP 10.8.1.3.34268 > 52.223.208.7.1935: Flags [.], seq 194812:196126, ack 1, win 501, options [nop,nop,TS val 2690113178 ecr 2824011496], length 1314
01:36:16.283914 IP 52.223.208.7.1935 > 10.8.1.3.34268: Flags [.], ack 187537, win 126, options [nop,nop,TS val 2824011592 ecr 2690112846], length 0
01:36:16.295908 IP 10.8.1.3.34268 > 52.223.208.7.1935: Flags [.], seq 196126:197440, ack 1, win 501, options [nop,nop,TS val 2690113241 ecr 2824011592], length 1314
01:36:16.327279 IP 10.8.1.3.34268 > 52.223.208.7.1935: Flags [.], seq 197440:198754, ack 1, win 501, options [nop,nop,TS val 2690113273 ecr 2824011592], length 1314
01:36:16.355699 IP 52.223.208.7.1935 > 10.8.1.3.34268: Flags [.], ack 190165, win 126, options [nop,nop,TS val 2824011664 ecr 2690112943], length 0
01:36:16.364853 IP 10.8.1.3.34268 > 52.223.208.7.1935: Flags [.], seq 198754:200068, ack 1, win 501, options [nop,nop,TS val 2690113310 ecr 2824011664], length 1314
01:36:16.431592 IP 10.8.1.3.34268 > 52.223.208.7.1935: Flags [.], seq 200068:201382, ack 1, win 501, options [nop,nop,TS val 2690113377 ecr 2824011664], length 1314
01:36:16.436307 IP 52.223.208.7.1935 > 10.8.1.3.34268: Flags [.], ack 192184, win 126, options [nop,nop,TS val 2824011745 ecr 2690113038], length 0
01:36:16.436332 IP 10.8.1.3.34268 > 52.223.208.7.1935: Flags [P.], seq 201382:202168, ack 1, win 501, options [nop,nop,TS val 2690113382 ecr 2824011745], length 786
01:36:16.497160 IP 10.8.1.3.34268 > 52.223.208.7.1935: Flags [.], seq 202168:203482, ack 1, win 501, options [nop,nop,TS val 2690113442 ecr 2824011745], length 1314
01:36:16.527362 IP 52.223.208.7.1935 > 10.8.1.3.34268: Flags [.], ack 194812, win 126, options [nop,nop,TS val 2824011836 ecr 2690113109], length 0
01:36:16.530823 IP 10.8.1.3.34268 > 52.223.208.7.1935: Flags [.], seq 203482:204796, ack 1, win 501, options [nop,nop,TS val 2690113476 ecr 2824011836], length 1314
01:36:16.562718 IP 10.8.1.3.34268 > 52.223.208.7.1935: Flags [.], seq 204796:206110, ack 1, win 501, options [nop,nop,TS val 2690113508 ecr 2824011836], length 1314
01:36:16.622163 IP 52.223.208.7.1935 > 10.8.1.3.34268: Flags [.], ack 197440, win 126, options [nop,nop,TS val 2824011931 ecr 2690113178], length 0
