12:44:54.879232 IP 52.223.218.180.1935 > 10.8.3.5.51956: Flags [.], ack 1823311288, win 152, options [nop,nop,TS val 1451489026 ecr 2028657863], length 0
12:44:54.911850 IP 10.8.3.5.51956 > 52.223.218.180.1935: Flags [.], seq 17915:19229, ack 0, win 501, options [nop,nop,TS val 2028658559 ecr 1451489026], length 1314
12:44:54.948213 IP 10.8.3.5.51956 > 52.223.218.180.1935: Flags [.], seq 19229:20543, ack 0, win 501, options [nop,nop,TS val 2028658596 ecr 1451489026], length 1314
12:44:54.949154 IP 52.223.218.180.1935 > 10.8.3.5.51956: Flags [.], ack 2629, win 152, options [nop,nop,TS val 1451489095 ecr 2028657963], length 0
12:44:55.011494 IP 10.8.3.5.51956 > 52.223.218.180.1935: Flags [.], seq 20543:21857, ack 0, win 501, options [nop,nop,TS val 2028658659 ecr 1451489095], length 1314
12:44:55.045052 IP 10.8.3.5.51956 > 52.223.218.180.1935: Flags [.], seq 21857:23171, ack 0, win 501, options [nop,nop,TS val 2028658692 ecr 1451489095], length 1314
12:44:55.046278 IP 52.223.218.180.1935 > 10.8.3.5.51956: Flags [.], ack 5257, win 152, options [nop,nop,TS val 1451489193 ecr 2028658055], length 0
12:44:55.081252 IP 10.8.3.5.51956 > 52.223.218.180.1935: Flags [.], seq 23171:24485, ack 0, win 501, options [nop,nop,TS val 2028658729 ecr 1451489193], length 1314
12:44:55.148725 IP 52.223.218.180.1935 > 10.8.3.5.51956: Flags [.], ack 7885, win 152, options [nop,nop,TS val 1451489295 ecr 2028658130], length 0
12:44:55.149106 IP 10.8.3.5.51956 > 52.223.218.180.1935: Flags [.], seq 24485:25799, ack 0, win 501, options [nop,nop,TS val 2028658796 ecr 1451489295], length 1314
12:44:55.160300 IP 52.223.218.180.1935 > 10.8.3.5.51956: Flags [.], ack 8717, win 153, options [nop,nop,TS val 1451489307 ecr 2028658208], length 0
12:44:55.160333 IP 10.8.3.5.51956 > 52.223.218.180.1935: Flags [P.], seq 25799:26631, ack 0, win 501, options [nop,nop,TS val 2028658808 ecr 1451489307], length 832
12:44:55.215509 IP 10.8.3.5.51956 > 52.223.218.180.1935: Flags [.], seq 26631:27945, ack 0, win 501, options [nop,nop,TS val 2028658863 ecr 1451489307], length 1314
12:44:55.243550 IP 52.223.218.180.1935 > 10.8.3.5.51956: Flags [.], ack 11345, win 152, options [nop,nop,TS val 1451489390 ecr 2028658262], length 0
12:44:55.249160 IP 10.8.3.5.51956 > 52.223.218.180.1935: Flags [.], seq 27945:29259, ack 0, win 501, options [nop,nop,TS val 2028658896 ecr 1451489390], length 1314
12:44:55.283535 IP 10.8.3.5.51956 > 52.223.218.180.1935: Flags [.], seq 29259:30573, ack 0, win 501, options [nop,nop,TS val 2028658931 ecr 1451489390], length 1314
12:44:55.346268 IP 10.8.3.5.51956 > 52.223.218.180.1935: Flags [.], seq 30573:31887, ack 0, win 501, options [nop,nop,TS val 2028658994 ecr 1451489390], length 1314
12:44:55.348249 IP 52.223.218.180.1935 > 10.8.3.5.51956: Flags [.], ack 13973, win 152, options [nop,nop,TS val 1451489495 ecr 2028658333], length 0
12:44:55.381280 IP 10.8.3.5.51956 > 52.223.218.180.1935: Flags [.], seq 31887:33201, ack 0, win 501, options [nop,nop,TS val 2028659029 ecr 1451489495], length 1314
12:44:55.413952 IP 52.223.218.180.1935 > 10.8.3.5.51956: Flags [.], ack 16601, win 152, options [nop,nop,TS val 1451489560 ecr 2028658429], length 0
12:44:55.415875 IP 10.8.3.5.51956 > 52.223.218.180.1935: Flags [.], seq 33201:34515, ack 0, win 501, options [nop,nop,TS val 2028659063 ecr 1451489560], length 1314
12:44:55.476104 IP 10.8.3.5.51956 > 52.223.218.180.1935: Flags [.], seq 34515:35829, ack 0, win 501, options [nop,nop,TS val 2028659123 ecr 1451489560], length 1314
12:44:55.511696 IP 52.223.218.180.1935 > 10.8.3.5.51956: Flags [.], ack 19229, win 152, options [nop,nop,TS val 1451489658 ecr 2028658525], length 0
12:44:55.512542 IP 10.8.3.5.51956 > 52.223.218.180.1935: Flags [.], seq 35829:37143, ack 0, win 501, options [nop,nop,TS val 2028659160 ecr 1451489658], length 1314
12:44:55.544932 IP 10.8.3.5.51956 > 52.223.218.180.1935: Flags [.], seq 37143:38457, ack 0, win 501, options [nop,nop,TS val 2028659192 ecr 1451489658], length 1314
12:44:55.611228 IP 52.223.218.180.1935 > 10.8.3.5.51956: Flags [.], ack 21857, win 152, options [nop,nop,TS val 1451489758 ecr 2028658596], length 0
12:44:55.615408 IP 10.8.3.5.51956 > 52.223.218.180.1935: Flags [.], seq 38457:39771, ack 0, win 501, options [nop,nop,TS val 2028659263 ecr 1451489758], length 1314
12:44:55.646921 IP 10.8.3.5.51956 > 52.223.218.180.1935: Flags [.], seq 39771:41085, ack 0, win 501, options [nop,nop,TS val 2028659294 ecr 1451489758], length 1314
12:44:55.678222 IP 10.8.3.5.51956 > 52.223.218.180.1935: Flags [.], seq 41085:42399, ack 0, win 501, options [nop,nop,TS val 2028659326 ecr 1451489758], length 1314
12:44:55.681043 IP 52.223.218.180.1935 > 10.8.3.5.51956: Flags [.], ack 24485, win 152, options [nop,nop,TS val 1451489828 ecr 2028658692], length 0
12:44:55.747114 IP 10.8.3.5.51956 > 52.223.218.180.1935: Flags [.], seq 42399:43713, ack 0, win 501, options [nop,nop,TS val 2028659394 ecr 1451489828], length 1314
12:44:55.760398 IP 52.223.218.180.1935 > 10.8.3.5.51956: Flags [.], ack 26631, win 153, options [nop,nop,TS val 1451489907 ecr 2028658796], length 0
12:44:55.760430 IP 10.8.3.5.51956 > 52.223.218.180.1935: Flags [P.], seq 43713:44532, ack 0, win 501, options [nop,nop,TS val 2028659408 ecr 1451489907], length 819
12:44:55.811496 IP 10.8.3.5.51956 > 52.223.218.180.1935: Flags [.], seq 44532:45846, ack 0, win 501, options [nop,nop,TS val 2028659459 ecr 1451489907], length 1314
12:44:55.845888 IP 10.8.3.5.51956 > 52.223.218.180.1935: Flags [.], seq 45846:47160, ack 0, win 501, options [nop,nop,TS val 2028659493 ecr 1451489907], length 1314
12:44:55.848955 IP 52.223.218.180.1935 > 10.8.3.5.51956: Flags [.], ack 29259, win 153, options [nop,nop,TS val 1451489995 ecr 2028658863], length 0
12:44:55.880905 IP 10.8.3.5.51956 > 52.223.218.180.1935: Flags [.], seq 47160:48474, ack 0, win 501, options [nop,nop,TS val 2028659528 ecr 1451489995], length 1314
12:44:55.944637 IP 10.8.3.5.51956 > 52.223.218.180.1935: Flags [.], seq 48474:49788, ack 0, win 501, options [nop,nop,TS val 2028659592 ecr 1451489995], length 1314
12:44:55.946280 IP 52.223.218.180.1935 > 10.8.3.5.51956: Flags [.], ack 31887, win 152, options [nop,nop,TS val 1451490092 ecr 2028658931], length 0
12:44:55.977850 IP 10.8.3.5.51956 > 52.223.218.180.1935: Flags [.], seq 49788:51102, ack 0, win 501, options [nop,nop,TS val 2028659625 ecr 1451490092], length 1314
12:44:56.011883 IP 10.8.3.5.51956 > 52.223.218.180.1935: Flags [.], seq 51102:52416, ack 0, win 501, options [nop,nop,TS val 2028659659 ecr 1451490092], length 1314
12:44:56.015877 IP 52.223.218.180.1935 > 10.8.3.5.51956: Flags [.], ack 34515, win 152, options [nop,nop,TS val 1451490162 ecr 2028659029], length 0
12:44:56.081643 IP 10.8.3.5.51956 > 52.223.218.180.1935: Flags [.], seq 52416:53730, ack 0, win 501, options [nop,nop,TS val 2028659729 ecr 1451490162], length 1314
12:44:56.112829 IP 52.223.218.180.1935 > 10.8.3.5.51956: Flags [.], ack 37143, win 152, options [nop,nop,TS val 1451490259 ecr 2028659123], length 0
12:44:56.115042 IP 10.8.3.5.51956 > 52.223.218.180.1935: Flags [.], seq 53730:55044, ack 0, win 501, options [nop,nop,TS val 2028659762 ecr 1451490259], length 1314
12:44:56.148820 IP 10.8.3.5.51956 > 52.223.218.180.1935: Flags [.], seq 55044:56358, ack 0, win 501, options [nop,nop,TS val 2028659796 ecr 1451490259], length 1314
12:44:56.211603 IP 10.8.3.5.51956 > 52.223.218.180.1935: Flags [.], seq 56358:57672, ack 0, win 501, options [nop,nop,TS val 2028659859 ecr 1451490259], length 1314
12:44:56.215294 IP 52.223.218.180.1935 > 10.8.3.5.51956: Flags [.], ack 39771, win 152, options [nop,nop,TS val 1451490362 ecr 2028659192], length 0
12:44:56.242966 IP 10.8.3.5.51956 > 52.223.218.180.1935: Flags [.], seq 57672:58986, ack 0, win 501, options [nop,nop,TS val 2028659890 ecr 1451490362], length 1314
12:44:56.278346 IP 52.223.218.180.1935 > 10.8.3.5.51956: Flags [.], ack 42399, win 152, options [nop,nop,TS val 1451490425 ecr 2028659294], length 0
12:44:56.281232 IP 10.8.3.5.51956 > 52.223.218.180.1935: Flags [.], seq 58986:60300, ack 0, win 501, options [nop,nop,TS val 2028659929 ecr 1451490425], length 1314
12:44:56.344954 IP 10.8.3.5.51956 > 52.223.218.180.1935: Flags [.], seq 60300:61614, ack 0, win 501, options [nop,nop,TS val 2028659992 ecr 1451490425], length 1314
12:44:56.360936 IP 52.223.218.180.1935 > 10.8.3.5.51956: Flags [.], ack 44532, win 153, options [nop,nop,TS val 1451490507 ecr 2028659394], length 0
12:44:56.360950 IP 10.8.3.5.51956 > 52.223.218.180.1935: Flags [P.], seq 61614:62438, ack 0, win 501, options [nop,nop,TS val 2028660008 ecr 1451490507], length 824
12:44:56.413782 IP 10.8.3.5.51956 > 52.223.218.180.1935: Flags [.], seq 62438:63752, ack 0, win 501, options [nop,nop,TS val 2028660061 ecr 1451490507], length 1314
12:44:56.445611 IP 52.223.218.180.1935 > 10.8.3.5.51956: Flags [.], ack 47160, win 152, options [nop,nop,TS val 1451490592 ecr 2028659459], length 0
12:44:56.449389 IP 10.8.3.5.51956 > 52.223.218.180.1935: Flags [.], seq 63752:65066, ack 0, win 501, options [nop,nop,TS val 2028660097 ecr 1451490592], length 1314
12:44:56.480494 IP 10.8.3.5.51956 > 52.223.218.180.1935: Flags [.], seq 65066:66380, ack 0, win 501, options [nop,nop,TS val 2028660128 ecr 1451490592], length 1314
12:44:56.541053 IP 52.223.218.180.1935 > 10.8.3.5.51956: Flags [.], ack 48474, win 153, options [nop,nop,TS val 1451490687 ecr 2028659528], length 0
12:44:56.542158 IP 10.8.3.5.51956 > 52.223.218.180.1935: Flags [.], seq 66380:67694, ack 0, win 501, options [nop,nop,TS val 2028660189 ecr 1451490687], length 1314
12:44:56.577690 IP 52.223.218.180.1935 > 10.8.3.5.51956: Flags [.], ack 51102, win 153, options [nop,nop,TS val 1451490724 ecr 2028659592], length 0
12:44:56.581023 IP 10.8.3.5.51956 > 52.223.218.180.1935: Flags [.], seq 67694:69008, ack 0, win 501, options [nop,nop,TS val 2028660228 ecr 1451490724], length 1314
12:44:56.611444 IP 10.8.3.5.51956 > 52.223.218.180.1935: Flags [.], seq 69008:70322, ack 0, win 501, options [nop,nop,TS val 2028660259 ecr 1451490724], length 1314
12:44:56.681487 IP 52.223.218.180.1935 > 10.8.3.5.51956: Flags [.], ack 53730, win 152, options [nop,nop,TS val 1451490828 ecr 2028659659], length 0
12:44:56.683925 IP 10.8.3.5.51956 > 52.223.218.180.1935: Flags [.], seq 70322:71636, ack 0, win 501, options [nop,nop,TS val 2028660331 ecr 1451490828], length 1314
12:44:56.713056 IP 10.8.3.5.51956 > 52.223.218.180.1935: Flags [.], seq 71636:72950, ack 0, win 501, options [nop,nop,TS val 2028660360 ecr 1451490828], length 1314
12:44:56.744820 IP 10.8.3.5.51956 > 52.223.218.180.1935: Flags [.], seq 72950:74264, ack 0, win 501, options [nop,nop,TS val 2028660392 ecr 1451490828], length 1314
12:44:56.749098 IP 52.223.218.180.1935 > 10.8.3.5.51956: Flags [.], ack 56358, win 152, options [nop,nop,TS val 1451490895 ecr 2028659762], length 0
12:44:56.813811 IP 10.8.3.5.51956 > 52.223.218.180.1935: Flags [.], seq 74264:75578, ack 0, win 501, options [nop,nop,TS val 2028660461 ecr 1451490895], length 1314
12:44:56.842973 IP 52.223.218.180.1935 > 10.8.3.5.51956: Flags [.], ack 58986, win 152, options [nop,nop,TS val 1451490989 ecr 2028659859], length 0
12:44:56.848661 IP 10.8.3.5.51956 > 52.223.218.180.1935: Flags [.], seq 75578:76892, ack 0, win 501, options [nop,nop,TS val 2028660496 ecr 1451490989], length 1314
12:44:56.878678 IP 10.8.3.5.51956 > 52.223.218.180.1935: Flags [.], seq 76892:78206, ack 0, win 501, options [nop,nop,TS val 2028660526 ecr 1451490989], length 1314
12:44:56.944983 IP 52.223.218.180.1935 > 10.8.3.5.51956: Flags [.], ack 61614, win 152, options [nop,nop,TS val 1451491091 ecr 2028659929], length 0
12:44:56.947368 IP 10.8.3.5.51956 > 52.223.218.180.1935: Flags [.], seq 78206:79520, ack 0, win 501, options [nop,nop,TS val 2028660595 ecr 1451491091], length 1314
12:44:56.960753 IP 52.223.218.180.1935 > 10.8.3.5.51956: Flags [.], ack 62438, win 153, options [nop,nop,TS val 1451491107 ecr 2028660008], length 0
12:44:56.960782 IP 10.8.3.5.51956 > 52.223.218.180.1935: Flags [P.], seq 79520:80352, ack 0, win 501, options [nop,nop,TS val 2028660608 ecr 1451491107], length 832
12:44:57.012462 IP 10.8.3.5.51956 > 52.223.218.180.1935: Flags [.], seq 80352:81666, ack 0, win 501, options [nop,nop,TS val 2028660660 ecr 1451491107], length 1314
12:44:57.045969 IP 10.8.3.5.51956 > 52.223.218.180.1935: Flags [.], seq 81666:82980, ack 0, win 501, options [nop,nop,TS val 2028660693 ecr 1451491107], length 1314
12:44:57.049292 IP 52.223.218.180.1935 > 10.8.3.5.51956: Flags [.], ack 65066, win 153, options [nop,nop,TS val 1451491196 ecr 2028660061], length 0
12:44:57.081927 IP 10.8.3.5.51956 > 52.223.218.180.1935: Flags [.], seq 82980:84294, ack 0, win 501, options [nop,nop,TS val 2028660729 ecr 1451491196], length 1314
12:44:57.142239 IP 52.223.218.180.1935 > 10.8.3.5.51956: Flags [.], ack 67694, win 152, options [nop,nop,TS val 1451491289 ecr 2028660128], length 0
12:44:57.147296 IP 10.8.3.5.51956 > 52.223.218.180.1935: Flags [.], seq 84294:85608, ack 0, win 501, options [nop,nop,TS val 2028660795 ecr 1451491289], length 1314
12:44:57.178990 IP 10.8.3.5.51956 > 52.223.218.180.1935: Flags [.], seq 85608:86922, ack 0, win 501, options [nop,nop,TS val 2028660826 ecr 1451491289], length 1314
12:44:57.211393 IP 52.223.218.180.1935 > 10.8.3.5.51956: Flags [.], ack 70322, win 152, options [nop,nop,TS val 1451491358 ecr 2028660228], length 0
12:44:57.213139 IP 10.8.3.5.51956 > 52.223.218.180.1935: Flags [.], seq 86922:88236, ack 0, win 501, options [nop,nop,TS val 2028660860 ecr 1451491358], length 1314
12:44:57.284371 IP 10.8.3.5.51956 > 52.223.218.180.1935: Flags [.], seq 88236:89550, ack 0, win 501, options [nop,nop,TS val 2028660932 ecr 1451491358], length 1314
12:44:57.311871 IP 10.8.3.5.51956 > 52.223.218.180.1935: Flags [.], seq 89550:90864, ack 0, win 501, options [nop,nop,TS val 2028660959 ecr 1451491358], length 1314
12:44:57.313363 IP 52.223.218.180.1935 > 10.8.3.5.51956: Flags [.], ack 72950, win 152, options [nop,nop,TS val 1451491460 ecr 2028660331], length 0
12:44:57.345550 IP 10.8.3.5.51956 > 52.223.218.180.1935: Flags [.], seq 90864:92178, ack 0, win 501, options [nop,nop,TS val 2028660993 ecr 1451491460], length 1314
12:44:57.405046 IP 52.223.218.180.1935 > 10.8.3.5.51956: Flags [.], ack 74264, win 153, options [nop,nop,TS val 1451491551 ecr 2028660392], length 0
12:44:57.415798 IP 10.8.3.5.51956 > 52.223.218.180.1935: Flags [.], seq 92178:93492, ack 0, win 501, options [nop,nop,TS val 2028661063 ecr 1451491551], length 1314
12:44:57.448821 IP 52.223.218.180.1935 > 10.8.3.5.51956: Flags [.], ack 76892, win 153, options [nop,nop,TS val 1451491595 ecr 2028660461], length 0
12:44:57.449477 IP 10.8.3.5.51956 > 52.223.218.180.1935: Flags [.], seq 93492:94806, ack 0, win 501, options [nop,nop,TS val 2028661097 ecr 1451491595], length 1314
12:44:57.482502 IP 10.8.3.5.51956 > 52.223.218.180.1935: Flags [.], seq 94806:96120, ack 0, win 501, options [nop,nop,TS val 2028661130 ecr 1451491595], length 1314
12:44:57.544950 IP 10.8.3.5.51956 > 52.223.218.180.1935: Flags [.], seq 96120:97434, ack 0, win 501, options [nop,nop,TS val 2028661192 ecr 1451491595], length 1314
12:44:57.546929 IP 52.223.218.180.1935 > 10.8.3.5.51956: Flags [.], ack 79520, win 152, options [nop,nop,TS val 1451491694 ecr 2028660526], length 0
12:44:57.560774 IP 52.223.218.180.1935 > 10.8.3.5.51956: Flags [.], ack 80352, win 153, options [nop,nop,TS val 1451491707 ecr 2028660608], length 0
12:44:57.560785 IP 10.8.3.5.51956 > 52.223.218.180.1935: Flags [P.], seq 97434:98261, ack 0, win 501, options [nop,nop,TS val 2028661208 ecr 1451491707], length 827
12:44:57.610627 IP 10.8.3.5.51956 > 52.223.218.180.1935: Flags [.], seq 98261:99575, ack 0, win 501, options [nop,nop,TS val 2028661258 ecr 1451491707], length 1314
12:44:57.646254 IP 52.223.218.180.1935 > 10.8.3.5.51956: Flags [.], ack 82980, win 153, options [nop,nop,TS val 1451491792 ecr 2028660660], length 0
12:44:57.650208 IP 10.8.3.5.51956 > 52.223.218.180.1935: Flags [.], seq 99575:100889, ack 0, win 501, options [nop,nop,TS val 2028661298 ecr 1451491792], length 1314
12:44:57.682060 IP 10.8.3.5.51956 > 52.223.218.180.1935: Flags [.], seq 100889:102203, ack 0, win 501, options [nop,nop,TS val 2028661329 ecr 1451491792], length 1314
12:44:57.747050 IP 52.223.218.180.1935 > 10.8.3.5.51956: Flags [.], ack 85608, win 152, options [nop,nop,TS val 1451491894 ecr 2028660729], length 0
12:44:57.748607 IP 10.8.3.5.51956 > 52.223.218.180.1935: Flags [.], seq 102203:103517, ack 0, win 501, options [nop,nop,TS val 2028661396 ecr 1451491894], length 1314
12:44:57.782035 IP 10.8.3.5.51956 > 52.223.218.180.1935: Flags [.], seq 103517:104831, ack 0, win 501, options [nop,nop,TS val 2028661429 ecr 1451491894], length 1314
12:44:57.813578 IP 52.223.218.180.1935 > 10.8.3.5.51956: Flags [.], ack 88236, win 152, options [nop,nop,TS val 1451491960 ecr 2028660826], length 0
12:44:57.815948 IP 10.8.3.5.51956 > 52.223.218.180.1935: Flags [.], seq 104831:106145, ack 0, win 501, options [nop,nop,TS val 2028661463 ecr 1451491960], length 1314
12:44:57.878845 IP 10.8.3.5.51956 > 52.223.218.180.1935: Flags [.], seq 106145:107459, ack 0, win 501, options [nop,nop,TS val 2028661526 ecr 1451491960], length 1314
12:44:57.911768 IP 52.223.218.180.1935 > 10.8.3.5.51956: Flags [.], ack 90864, win 152, options [nop,nop,TS val 1451492058 ecr 2028660932], length 0
12:44:57.914904 IP 10.8.3.5.51956 > 52.223.218.180.1935: Flags [.], seq 107459:108773, ack 0, win 501, options [nop,nop,TS val 2028661562 ecr 1451492058], length 1314
12:44:57.949094 IP 10.8.3.5.51956 > 52.223.218.180.1935: Flags [.], seq 108773:110087, ack 0, win 501, options [nop,nop,TS val 2028661596 ecr 1451492058], length 1314
12:44:58.015965 IP 52.223.218.180.1935 > 10.8.3.5.51956: Flags [.], ack 93492, win 152, options [nop,nop,TS val 1451492162 ecr 2028660993], length 0
12:44:58.016098 IP 10.8.3.5.51956 > 52.223.218.180.1935: Flags [.], seq 110087:111401, ack 0, win 501, options [nop,nop,TS val 2028661663 ecr 1451492162], length 1314
12:44:58.046100 IP 10.8.3.5.51956 > 52.223.218.180.1935: Flags [.], seq 111401:112715, ack 0, win 501, options [nop,nop,TS val 2028661693 ecr 1451492162], length 1314
12:44:58.080165 IP 10.8.3.5.51956 > 52.223.218.180.1935: Flags [.], seq 112715:114029, ack 0, win 501, options [nop,nop,TS val 2028661727 ecr 1451492162], length 1314
12:44:58.082654 IP 52.223.218.180.1935 > 10.8.3.5.51956: Flags [.], ack 96120, win 152, options [nop,nop,TS val 1451492229 ecr 2028661097], length 0
12:44:58.145998 IP 10.8.3.5.51956 > 52.223.218.180.1935: Flags [.], seq 114029:115343, ack 0, win 501, options [nop,nop,TS val 2028661793 ecr 1451492229], length 1314
12:44:58.160847 IP 52.223.218.180.1935 > 10.8.3.5.51956: Flags [.], ack 98261, win 153, options [nop,nop,TS val 1451492307 ecr 2028661192], length 0
12:44:58.160886 IP 10.8.3.5.51956 > 52.223.218.180.1935: Flags [P.], seq 115343:116167, ack 0, win 501, options [nop,nop,TS val 2028661808 ecr 1451492307], length 824
12:44:58.211790 IP 10.8.3.5.51956 > 52.223.218.180.1935: Flags [.], seq 116167:117481, ack 0, win 501, options [nop,nop,TS val 2028661859 ecr 1451492307], length 1314
12:44:58.245439 IP 10.8.3.5.51956 > 52.223.218.180.1935: Flags [.], seq 117481:118795, ack 0, win 501, options [nop,nop,TS val 2028661893 ecr 1451492307], length 1314
12:44:58.250344 IP 52.223.218.180.1935 > 10.8.3.5.51956: Flags [.], ack 100889, win 153, options [nop,nop,TS val 1451492397 ecr 2028661258], length 0
12:44:58.282650 IP 10.8.3.5.51956 > 52.223.218.180.1935: Flags [.], seq 118795:120109, ack 0, win 501, options [nop,nop,TS val 2028661930 ecr 1451492397], length 1314
12:44:58.348287 IP 52.223.218.180.1935 > 10.8.3.5.51956: Flags [.], ack 103517, win 152, options [nop,nop,TS val 1451492495 ecr 2028661329], length 0
12:44:58.349189 IP 10.8.3.5.51956 > 52.223.218.180.1935: Flags [.], seq 120109:121423, ack 0, win 501, options [nop,nop,TS val 2028661996 ecr 1451492495], length 1314
12:44:58.380388 IP 10.8.3.5.51956 > 52.223.218.180.1935: Flags [.], seq 121423:122737, ack 0, win 501, options [nop,nop,TS val 2028662028 ecr 1451492495], length 1314
12:44:58.415554 IP 10.8.3.5.51956 > 52.223.218.180.1935: Flags [.], seq 122737:124051, ack 0, win 501, options [nop,nop,TS val 2028662063 ecr 1451492495], length 1314
12:44:58.416388 IP 52.223.218.180.1935 > 10.8.3.5.51956: Flags [.], ack 106145, win 152, options [nop,nop,TS val 1451492562 ecr 2028661429], length 0
12:44:58.482155 IP 10.8.3.5.51956 > 52.223.218.180.1935: Flags [.], seq 124051:125365, ack 0, win 501, options [nop,nop,TS val 2028662129 ecr 1451492562], length 1314
12:44:58.514553 IP 10.8.3.5.51956 > 52.223.218.180.1935: Flags [.], seq 125365:126679, ack 0, win 501, options [nop,nop,TS val 2028662162 ecr 1451492562], length 1314
12:44:58.515150 IP 52.223.218.180.1935 > 10.8.3.5.51956: Flags [.], ack 108773, win 152, options [nop,nop,TS val 1451492661 ecr 2028661526], length 0
12:44:58.547565 IP 10.8.3.5.51956 > 52.223.218.180.1935: Flags [.], seq 126679:127993, ack 0, win 501, options [nop,nop,TS val 2028662195 ecr 1451492661], length 1314
12:44:58.614238 IP 10.8.3.5.51956 > 52.223.218.180.1935: Flags [.], seq 127993:129307, ack 0, win 501, options [nop,nop,TS val 2028662262 ecr 1451492661], length 1314
12:44:58.615800 IP 52.223.218.180.1935 > 10.8.3.5.51956: Flags [.], ack 111401, win 152, options [nop,nop,TS val 1451492762 ecr 2028661596], length 0
12:44:58.647544 IP 10.8.3.5.51956 > 52.223.218.180.1935: Flags [.], seq 129307:130621, ack 0, win 501, options [nop,nop,TS val 2028662295 ecr 1451492762], length 1314
12:44:58.680193 IP 10.8.3.5.51956 > 52.223.218.180.1935: Flags [.], seq 130621:131935, ack 0, win 501, options [nop,nop,TS val 2028662328 ecr 1451492762], length 1314
12:44:58.680386 IP 52.223.218.180.1935 > 10.8.3.5.51956: Flags [.], ack 114029, win 152, options [nop,nop,TS val 1451492826 ecr 2028661693], length 0
12:44:58.744955 IP 10.8.3.5.51956 > 52.223.218.180.1935: Flags [.], seq 131935:133249, ack 0, win 501, options [nop,nop,TS val 2028662392 ecr 1451492826], length 1314
12:44:58.761771 IP 52.223.218.180.1935 > 10.8.3.5.51956: Flags [.], ack 116167, win 153, options [nop,nop,TS val 1451492907 ecr 2028661793], length 0
12:44:58.761822 IP 10.8.3.5.51956 > 52.223.218.180.1935: Flags [P.], seq 133249:134164, ack 0, win 501, options [nop,nop,TS val 2028662409 ecr 1451492907], length 915
12:44:58.809402 IP 10.8.3.5.51956 > 52.223.218.180.1935: Flags [.], seq 134164:135478, ack 0, win 501, options [nop,nop,TS val 2028662457 ecr 1451492907], length 1314
12:44:58.830849 IP 10.8.3.5.51956 > 52.223.218.180.1935: Flags [.], seq 135478:136792, ack 0, win 501, options [nop,nop,TS val 2028662478 ecr 1451492907], length 1314
12:44:58.845550 IP 52.223.218.180.1935 > 10.8.3.5.51956: Flags [.], ack 118795, win 153, options [nop,nop,TS val 1451492992 ecr 2028661859], length 0
12:44:58.878290 IP 10.8.3.5.51956 > 52.223.218.180.1935: Flags [.], seq 136792:138106, ack 0, win 501, options [nop,nop,TS val 2028662526 ecr 1451492992], length 1314
12:44:58.936862 IP 10.8.3.5.51956 > 52.223.218.180.1935: Flags [.], seq 138106:139420, ack 0, win 501, options [nop,nop,TS val 2028662584 ecr 1451492992], length 1314
12:44:58.948939 IP 52.223.218.180.1935 > 10.8.3.5.51956: Flags [.], ack 121423, win 152, options [nop,nop,TS val 1451493095 ecr 2028661930], length 0
12:44:58.979491 IP 10.8.3.5.51956 > 52.223.218.180.1935: Flags [.], seq 139420:140734, ack 0, win 501, options [nop,nop,TS val 2028662627 ecr 1451493095], length 1314
12:44:59.015589 IP 52.223.218.180.1935 > 10.8.3.5.51956: Flags [.], ack 124051, win 152, options [nop,nop,TS val 1451493162 ecr 2028662028], length 0
12:44:59.015916 IP 10.8.3.5.51956 > 52.223.218.180.1935: Flags [.], seq 140734:142048, ack 0, win 501, options [nop,nop,TS val 2028662663 ecr 1451493162], length 1314
12:44:59.065297 IP 10.8.3.5.51956 > 52.223.218.180.1935: Flags [.], seq 142048:143362, ack 0, win 501, options [nop,nop,TS val 2028662713 ecr 1451493162], length 1314
12:44:59.108352 IP 10.8.3.5.51956 > 52.223.218.180.1935: Flags [.], seq 143362:144676, ack 0, win 501, options [nop,nop,TS val 2028662756 ecr 1451493162], length 1314
12:44:59.114479 IP 52.223.218.180.1935 > 10.8.3.5.51956: Flags [.], ack 126679, win 152, options [nop,nop,TS val 1451493261 ecr 2028662129], length 0
12:44:59.146408 IP 10.8.3.5.51956 > 52.223.218.180.1935: Flags [.], seq 144676:145990, ack 0, win 501, options [nop,nop,TS val 2028662794 ecr 1451493261], length 1314
12:44:59.193873 IP 10.8.3.5.51956 > 52.223.218.180.1935: Flags [.], seq 145990:147304, ack 0, win 501, options [nop,nop,TS val 2028662841 ecr 1451493261], length 1314
12:44:59.214265 IP 52.223.218.180.1935 > 10.8.3.5.51956: Flags [.], ack 129307, win 152, options [nop,nop,TS val 1451493361 ecr 2028662195], length 0
12:44:59.249321 IP 10.8.3.5.51956 > 52.223.218.180.1935: Flags [.], seq 147304:148618, ack 0, win 501, options [nop,nop,TS val 2028662897 ecr 1451493361], length 1314
12:44:59.280574 IP 52.223.218.180.1935 > 10.8.3.5.51956: Flags [.], ack 131935, win 152, options [nop,nop,TS val 1451493427 ecr 2028662295], length 0
12:44:59.282684 IP 10.8.3.5.51956 > 52.223.218.180.1935: Flags [.], seq 148618:149932, ack 0, win 501, options [nop,nop,TS val 2028662930 ecr 1451493427], length 1314
12:44:59.348742 IP 10.8.3.5.51956 > 52.223.218.180.1935: Flags [.], seq 149932:151246, ack 0, win 501, options [nop,nop,TS val 2028662996 ecr 1451493427], length 1314
12:44:59.361797 IP 52.223.218.180.1935 > 10.8.3.5.51956: Flags [.], ack 134164, win 152, options [nop,nop,TS val 1451493508 ecr 2028662392], length 0
12:44:59.361826 IP 10.8.3.5.51956 > 52.223.218.180.1935: Flags [P.], seq 151246:151982, ack 0, win 501, options [nop,nop,TS val 2028663009 ecr 1451493508], length 736
12:44:59.415846 IP 10.8.3.5.51956 > 52.223.218.180.1935: Flags [.], seq 151982:153296, ack 0, win 501, options [nop,nop,TS val 2028663063 ecr 1451493508], length 1314
12:44:59.430812 IP 52.223.218.180.1935 > 10.8.3.5.51956: Flags [.], ack 136792, win 152, options [nop,nop,TS val 1451493577 ecr 2028662457], length 0
12:44:59.446644 IP 10.8.3.5.51956 > 52.223.218.180.1935: Flags [.], seq 153296:154610, ack 0, win 501, options [nop,nop,TS val 2028663094 ecr 1451493577], length 1314
12:44:59.480555 IP 10.8.3.5.51956 > 52.223.218.180.1935: Flags [.], seq 154610:155924, ack 0, win 501, options [nop,nop,TS val 2028663128 ecr 1451493577], length 1314
12:44:59.537408 IP 52.223.218.180.1935 > 10.8.3.5.51956: Flags [.], ack 139420, win 152, options [nop,nop,TS val 1451493684 ecr 2028662526], length 0
12:44:59.548013 IP 10.8.3.5.51956 > 52.223.218.180.1935: Flags [.], seq 155924:157238, ack 0, win 501, options [nop,nop,TS val 2028663195 ecr 1451493684], length 1314
12:44:59.581531 IP 10.8.3.5.51956 > 52.223.218.180.1935: Flags [.], seq 157238:158552, ack 0, win 501, options [nop,nop,TS val 2028663229 ecr 1451493684], length 1314
12:44:59.614967 IP 10.8.3.5.51956 > 52.223.218.180.1935: Flags [.], seq 158552:159866, ack 0, win 501, options [nop,nop,TS val 2028663262 ecr 1451493684], length 1314
12:44:59.615797 IP 52.223.218.180.1935 > 10.8.3.5.51956: Flags [.], ack 142048, win 152, options [nop,nop,TS val 1451493762 ecr 2028662627], length 0
12:44:59.681580 IP 10.8.3.5.51956 > 52.223.218.180.1935: Flags [.], seq 159866:161180, ack 0, win 501, options [nop,nop,TS val 2028663329 ecr 1451493762], length 1314
12:44:59.708228 IP 52.223.218.180.1935 > 10.8.3.5.51956: Flags [.], ack 144676, win 152, options [nop,nop,TS val 1451493855 ecr 2028662713], length 0
12:44:59.714887 IP 10.8.3.5.51956 > 52.223.218.180.1935: Flags [.], seq 161180:162494, ack 0, win 501, options [nop,nop,TS val 2028663362 ecr 1451493855], length 1314
12:44:59.748239 IP 10.8.3.5.51956 > 52.223.218.180.1935: Flags [.], seq 162494:163808, ack 0, win 501, options [nop,nop,TS val 2028663396 ecr 1451493855], length 1314
12:44:59.793776 IP 52.223.218.180.1935 > 10.8.3.5.51956: Flags [.], ack 147304, win 152, options [nop,nop,TS val 1451493940 ecr 2028662794], length 0
12:44:59.814659 IP 10.8.3.5.51956 > 52.223.218.180.1935: Flags [.], seq 163808:165122, ack 0, win 501, options [nop,nop,TS val 2028663462 ecr 1451493940], length 1314
12:44:59.848189 IP 10.8.3.5.51956 > 52.223.218.180.1935: Flags [.], seq 165122:166436, ack 0, win 501, options [nop,nop,TS val 2028663495 ecr 1451493940], length 1314
12:44:59.881618 IP 10.8.3.5.51956 > 52.223.218.180.1935: Flags [.], seq 166436:167750, ack 0, win 501, options [nop,nop,TS val 2028663529 ecr 1451493940], length 1314
12:44:59.882604 IP 52.223.218.180.1935 > 10.8.3.5.51956: Flags [.], ack 149932, win 152, options [nop,nop,TS val 1451494029 ecr 2028662897], length 0
12:44:59.948260 IP 10.8.3.5.51956 > 52.223.218.180.1935: Flags [.], seq 167750:169064, ack 0, win 501, options [nop,nop,TS val 2028663596 ecr 1451494029], length 1314
12:44:59.961648 IP 52.223.218.180.1935 > 10.8.3.5.51956: Flags [.], ack 151982, win 153, options [nop,nop,TS val 1451494108 ecr 2028662996], length 0
12:44:59.961684 IP 10.8.3.5.51956 > 52.223.218.180.1935: Flags [P.], seq 169064:169896, ack 0, win 501, options [nop,nop,TS val 2028663609 ecr 1451494108], length 832
12:45:00.015181 IP 10.8.3.5.51956 > 52.223.218.180.1935: Flags [.], seq 169896:171210, ack 0, win 501, options [nop,nop,TS val 2028663662 ecr 1451494108], length 1314
12:45:00.047795 IP 52.223.218.180.1935 > 10.8.3.5.51956: Flags [.], ack 154610, win 152, options [nop,nop,TS val 1451494193 ecr 2028663063], length 0
12:45:00.049917 IP 10.8.3.5.51956 > 52.223.218.180.1935: Flags [.], seq 171210:172524, ack 0, win 501, options [nop,nop,TS val 2028663697 ecr 1451494193], length 1314
12:45:00.082128 IP 10.8.3.5.51956 > 52.223.218.180.1935: Flags [.], seq 172524:173838, ack 0, win 501, options [nop,nop,TS val 2028663729 ecr 1451494193], length 1314
12:45:00.137180 IP 52.223.218.180.1935 > 10.8.3.5.51956: Flags [.], ack 155924, win 153, options [nop,nop,TS val 1451494283 ecr 2028663128], length 0
12:45:00.148912 IP 10.8.3.5.51956 > 52.223.218.180.1935: Flags [.], seq 173838:175152, ack 0, win 501, options [nop,nop,TS val 2028663796 ecr 1451494283], length 1314
12:45:00.181089 IP 10.8.3.5.51956 > 52.223.218.180.1935: Flags [.], seq 175152:176466, ack 0, win 501, options [nop,nop,TS val 2028663828 ecr 1451494283], length 1314
12:45:00.181340 IP 52.223.218.180.1935 > 10.8.3.5.51956: Flags [.], ack 158552, win 153, options [nop,nop,TS val 1451494328 ecr 2028663195], length 0
12:45:00.211548 IP 10.8.3.5.51956 > 52.223.218.180.1935: Flags [.], seq 176466:177780, ack 0, win 501, options [nop,nop,TS val 2028663859 ecr 1451494328], length 1314
12:45:00.281653 IP 52.223.218.180.1935 > 10.8.3.5.51956: Flags [.], ack 161180, win 152, options [nop,nop,TS val 1451494428 ecr 2028663262], length 0
12:45:00.282516 IP 10.8.3.5.51956 > 52.223.218.180.1935: Flags [.], seq 177780:179094, ack 0, win 501, options [nop,nop,TS val 2028663930 ecr 1451494428], length 1314
12:45:00.315959 IP 10.8.3.5.51956 > 52.223.218.180.1935: Flags [.], seq 179094:180408, ack 0, win 501, options [nop,nop,TS val 2028663963 ecr 1451494428], length 1314
12:45:00.348001 IP 52.223.218.180.1935 > 10.8.3.5.51956: Flags [.], ack 163808, win 152, options [nop,nop,TS val 1451494495 ecr 2028663362], length 0
12:45:00.349745 IP 10.8.3.5.51956 > 52.223.218.180.1935: Flags [.], seq 180408:181722, ack 0, win 501, options [nop,nop,TS val 2028663997 ecr 1451494495], length 1314
12:45:00.414750 IP 10.8.3.5.51956 > 52.223.218.180.1935: Flags [.], seq 181722:183036, ack 0, win 501, options [nop,nop,TS val 2028664062 ecr 1451494495], length 1314
12:45:00.447861 IP 52.223.218.180.1935 > 10.8.3.5.51956: Flags [.], ack 166436, win 152, options [nop,nop,TS val 1451494594 ecr 2028663462], length 0
12:45:00.448722 IP 10.8.3.5.51956 > 52.223.218.180.1935: Flags [.], seq 183036:184350, ack 0, win 501, options [nop,nop,TS val 2028664096 ecr 1451494594], length 1314
12:45:00.482053 IP 10.8.3.5.51956 > 52.223.218.180.1935: Flags [.], seq 184350:185664, ack 0, win 501, options [nop,nop,TS val 2028664129 ecr 1451494594], length 1314
12:45:00.548252 IP 52.223.218.180.1935 > 10.8.3.5.51956: Flags [.], ack 169064, win 152, options [nop,nop,TS val 1451494694 ecr 2028663529], length 0
12:45:00.548474 IP 10.8.3.5.51956 > 52.223.218.180.1935: Flags [.], seq 185664:186978, ack 0, win 501, options [nop,nop,TS val 2028664196 ecr 1451494694], length 1314
12:45:00.561529 IP 52.223.218.180.1935 > 10.8.3.5.51956: Flags [.], ack 169896, win 153, options [nop,nop,TS val 1451494708 ecr 2028663609], length 0
12:45:00.561562 IP 10.8.3.5.51956 > 52.223.218.180.1935: Flags [P.], seq 186978:187797, ack 0, win 501, options [nop,nop,TS val 2028664209 ecr 1451494708], length 819
12:45:00.615448 IP 10.8.3.5.51956 > 52.223.218.180.1935: Flags [.], seq 187797:189111, ack 0, win 501, options [nop,nop,TS val 2028664263 ecr 1451494708], length 1314
12:45:00.649734 IP 10.8.3.5.51956 > 52.223.218.180.1935: Flags [.], seq 189111:190425, ack 0, win 501, options [nop,nop,TS val 2028664297 ecr 1451494708], length 1314
12:45:00.649948 IP 52.223.218.180.1935 > 10.8.3.5.51956: Flags [.], ack 172524, win 153, options [nop,nop,TS val 1451494796 ecr 2028663662], length 0
12:45:00.681855 IP 10.8.3.5.51956 > 52.223.218.180.1935: Flags [.], seq 190425:191739, ack 0, win 501, options [nop,nop,TS val 2028664329 ecr 1451494796], length 1314
12:45:00.748638 IP 52.223.218.180.1935 > 10.8.3.5.51956: Flags [.], ack 175152, win 152, options [nop,nop,TS val 1451494895 ecr 2028663729], length 0
12:45:00.749166 IP 10.8.3.5.51956 > 52.223.218.180.1935: Flags [.], seq 191739:193053, ack 0, win 501, options [nop,nop,TS val 2028664396 ecr 1451494895], length 1314
12:45:00.779899 IP 10.8.3.5.51956 > 52.223.218.180.1935: Flags [.], seq 193053:194367, ack 0, win 501, options [nop,nop,TS val 2028664427 ecr 1451494895], length 1314
12:45:00.811278 IP 52.223.218.180.1935 > 10.8.3.5.51956: Flags [.], ack 177780, win 152, options [nop,nop,TS val 1451494958 ecr 2028663828], length 0
12:45:00.815485 IP 10.8.3.5.51956 > 52.223.218.180.1935: Flags [.], seq 194367:195681, ack 0, win 501, options [nop,nop,TS val 2028664463 ecr 1451494958], length 1314
12:45:00.885832 IP 10.8.3.5.51956 > 52.223.218.180.1935: Flags [.], seq 195681:196995, ack 0, win 501, options [nop,nop,TS val 2028664533 ecr 1451494958], length 1314
12:45:00.914379 IP 10.8.3.5.51956 > 52.223.218.180.1935: Flags [.], seq 196995:198309, ack 0, win 501, options [nop,nop,TS val 2028664562 ecr 1451494958], length 1314
12:45:00.915855 IP 52.223.218.180.1935 > 10.8.3.5.51956: Flags [.], ack 180408, win 152, options [nop,nop,TS val 1451495062 ecr 2028663930], length 0
12:45:00.949909 IP 10.8.3.5.51956 > 52.223.218.180.1935: Flags [.], seq 198309:199623, ack 0, win 501, options [nop,nop,TS val 2028664597 ecr 1451495062], length 1314
12:45:01.014323 IP 10.8.3.5.51956 > 52.223.218.180.1935: Flags [.], seq 199623:200937, ack 0, win 501, options [nop,nop,TS val 2028664662 ecr 1451495062], length 1314
12:45:01.014687 IP 52.223.218.180.1935 > 10.8.3.5.51956: Flags [.], ack 183036, win 152, options [nop,nop,TS val 1451495161 ecr 2028663997], length 0
12:45:01.047928 IP 10.8.3.5.51956 > 52.223.218.180.1935: Flags [.], seq 200937:202251, ack 0, win 501, options [nop,nop,TS val 2028664695 ecr 1451495161], length 1314
12:45:01.081929 IP 52.223.218.180.1935 > 10.8.3.5.51956: Flags [.], ack 185664, win 152, options [nop,nop,TS val 1451495228 ecr 2028664096], length 0
12:45:01.082001 IP 10.8.3.5.51956 > 52.223.218.180.1935: Flags [.], seq 202251:203565, ack 0, win 501, options [nop,nop,TS val 2028664729 ecr 1451495228], length 1314
12:45:01.148840 IP 10.8.3.5.51956 > 52.223.218.180.1935: Flags [.], seq 203565:204879, ack 0, win 501, options [nop,nop,TS val 2028664796 ecr 1451495228], length 1314
12:45:01.161712 IP 52.223.218.180.1935 > 10.8.3.5.51956: Flags [.], ack 187797, win 153, options [nop,nop,TS val 1451495308 ecr 2028664196], length 0
12:45:01.161749 IP 10.8.3.5.51956 > 52.223.218.180.1935: Flags [P.], seq 204879:205703, ack 0, win 501, options [nop,nop,TS val 2028664809 ecr 1451495308], length 824
12:45:01.215414 IP 10.8.3.5.51956 > 52.223.218.180.1935: Flags [.], seq 205703:207017, ack 0, win 501, options [nop,nop,TS val 2028664863 ecr 1451495308], length 1314
12:45:01.249663 IP 52.223.218.180.1935 > 10.8.3.5.51956: Flags [.], ack 190425, win 153, options [nop,nop,TS val 1451495396 ecr 2028664263], length 0
12:45:01.249782 IP 10.8.3.5.51956 > 52.223.218.180.1935: Flags [.], seq 207017:208331, ack 0, win 501, options [nop,nop,TS val 2028664897 ecr 1451495396], length 1314
12:45:01.281797 IP 10.8.3.5.51956 > 52.223.218.180.1935: Flags [.], seq 208331:209645, ack 0, win 501, options [nop,nop,TS val 2028664929 ecr 1451495396], length 1314
12:45:01.348728 IP 10.8.3.5.51956 > 52.223.218.180.1935: Flags [.], seq 209645:210959, ack 0, win 501, options [nop,nop,TS val 2028664996 ecr 1451495396], length 1314
12:45:01.349216 IP 52.223.218.180.1935 > 10.8.3.5.51956: Flags [.], ack 193053, win 152, options [nop,nop,TS val 1451495496 ecr 2028664329], length 0
12:45:01.382131 IP 10.8.3.5.51956 > 52.223.218.180.1935: Flags [.], seq 210959:212273, ack 0, win 501, options [nop,nop,TS val 2028665029 ecr 1451495496], length 1314
12:45:01.415418 IP 52.223.218.180.1935 > 10.8.3.5.51956: Flags [.], ack 195681, win 152, options [nop,nop,TS val 1451495562 ecr 2028664427], length 0
12:45:01.421298 IP 10.8.3.5.51956 > 52.223.218.180.1935: Flags [.], seq 212273:213587, ack 0, win 501, options [nop,nop,TS val 2028665069 ecr 1451495562], length 1314
12:45:01.485756 IP 10.8.3.5.51956 > 52.223.218.180.1935: Flags [.], seq 213587:214901, ack 0, win 501, options [nop,nop,TS val 2028665133 ecr 1451495562], length 1314
12:45:01.514286 IP 52.223.218.180.1935 > 10.8.3.5.51956: Flags [.], ack 198309, win 152, options [nop,nop,TS val 1451495661 ecr 2028664533], length 0
12:45:01.515200 IP 10.8.3.5.51956 > 52.223.218.180.1935: Flags [.], seq 214901:216215, ack 0, win 501, options [nop,nop,TS val 2028665163 ecr 1451495661], length 1314
12:45:01.549910 IP 10.8.3.5.51956 > 52.223.218.180.1935: Flags [.], seq 216215:217529, ack 0, win 501, options [nop,nop,TS val 2028665197 ecr 1451495661], length 1314
12:45:01.614258 IP 52.223.218.180.1935 > 10.8.3.5.51956: Flags [.], ack 200937, win 152, options [nop,nop,TS val 1451495761 ecr 2028664597], length 0
12:45:01.615590 IP 10.8.3.5.51956 > 52.223.218.180.1935: Flags [.], seq 217529:218843, ack 0, win 501, options [nop,nop,TS val 2028665263 ecr 1451495761], length 1314
12:45:01.657131 IP 10.8.3.5.51956 > 52.223.218.180.1935: Flags [.], seq 218843:220157, ack 0, win 501, options [nop,nop,TS val 2028665304 ecr 1451495761], length 1314
12:45:01.681847 IP 52.223.218.180.1935 > 10.8.3.5.51956: Flags [.], ack 203565, win 152, options [nop,nop,TS val 1451495828 ecr 2028664695], length 0
12:45:01.682463 IP 10.8.3.5.51956 > 52.223.218.180.1935: Flags [.], seq 220157:221471, ack 0, win 501, options [nop,nop,TS val 2028665330 ecr 1451495828], length 1314
12:45:01.748596 IP 10.8.3.5.51956 > 52.223.218.180.1935: Flags [.], seq 221471:222785, ack 0, win 501, options [nop,nop,TS val 2028665396 ecr 1451495828], length 1314
12:45:01.761678 IP 52.223.218.180.1935 > 10.8.3.5.51956: Flags [.], ack 205703, win 153, options [nop,nop,TS val 1451495908 ecr 2028664796], length 0
12:45:01.761714 IP 10.8.3.5.51956 > 52.223.218.180.1935: Flags [P.], seq 222785:223617, ack 0, win 501, options [nop,nop,TS val 2028665409 ecr 1451495908], length 832
12:45:01.815724 IP 10.8.3.5.51956 > 52.223.218.180.1935: Flags [.], seq 223617:224931, ack 0, win 501, options [nop,nop,TS val 2028665463 ecr 1451495908], length 1314
12:45:01.849916 IP 52.223.218.180.1935 > 10.8.3.5.51956: Flags [.], ack 208331, win 153, options [nop,nop,TS val 1451495996 ecr 2028664863], length 0
12:45:01.850228 IP 10.8.3.5.51956 > 52.223.218.180.1935: Flags [.], seq 224931:226245, ack 0, win 501, options [nop,nop,TS val 2028665498 ecr 1451495996], length 1314
