12:19:31.327646 IP 10.8.0.4.58582 > 52.223.226.41.1935: Flags [.], seq 219714338:219715652, ack 604066057, win 501, options [nop,nop,TS val 3510289505 ecr 1340982753], length 1314
12:19:31.363195 IP 52.223.226.41.1935 > 10.8.0.4.58582: Flags [.], ack 4294959929, win 126, options [nop,nop,TS val 1340982852 ecr 3510289171], length 0
12:19:31.363208 IP 10.8.0.4.58582 > 52.223.226.41.1935: Flags [.], seq 1314:2628, ack 1, win 501, options [nop,nop,TS val 3510289541 ecr 1340982753], length 1314
12:19:31.396919 IP 10.8.0.4.58582 > 52.223.226.41.1935: Flags [.], seq 2628:3942, ack 1, win 501, options [nop,nop,TS val 3510289574 ecr 1340982852], length 1314
12:19:31.460224 IP 10.8.0.4.58582 > 52.223.226.41.1935: Flags [.], seq 3942:5256, ack 1, win 501, options [nop,nop,TS val 3510289638 ecr 1340982852], length 1314
12:19:31.462899 IP 52.223.226.41.1935 > 10.8.0.4.58582: Flags [.], ack 4294961243, win 126, options [nop,nop,TS val 1340982952 ecr 3510289239], length 0
12:19:31.495406 IP 10.8.0.4.58582 > 52.223.226.41.1935: Flags [.], seq 5256:6570, ack 1, win 501, options [nop,nop,TS val 3510289673 ecr 1340982952], length 1314
12:19:31.496563 IP 52.223.226.41.1935 > 10.8.0.4.58582: Flags [.], ack 4294963871, win 126, options [nop,nop,TS val 1340982985 ecr 3510289307], length 0
12:19:31.529251 IP 10.8.0.4.58582 > 52.223.226.41.1935: Flags [.], seq 6570:7884, ack 1, win 501, options [nop,nop,TS val 3510289707 ecr 1340982985], length 1314
12:19:31.593604 IP 10.8.0.4.58582 > 52.223.226.41.1935: Flags [.], seq 7884:9198, ack 1, win 501, options [nop,nop,TS val 3510289771 ecr 1340982985], length 1314
12:19:31.597108 IP 52.223.226.41.1935 > 10.8.0.4.58582: Flags [.], ack 4294966499, win 126, options [nop,nop,TS val 1340983086 ecr 3510289373], length 0
12:19:31.597129 IP 52.223.226.41.1935 > 10.8.0.4.58582: Flags [.], ack 0, win 126, options [nop,nop,TS val 1340983086 ecr 3510289441], length 0
12:19:31.597137 IP 10.8.0.4.58582 > 52.223.226.41.1935: Flags [P.], seq 9198:9899, ack 1, win 501, options [nop,nop,TS val 3510289774 ecr 1340983086], length 701
12:19:31.663786 IP 10.8.0.4.58582 > 52.223.226.41.1935: Flags [.], seq 9899:11213, ack 1, win 501, options [nop,nop,TS val 3510289841 ecr 1340983086], length 1314
12:19:31.693032 IP 10.8.0.4.58582 > 52.223.226.41.1935: Flags [.], seq 11213:12527, ack 1, win 501, options [nop,nop,TS val 3510289870 ecr 1340983086], length 1314
12:19:31.696122 IP 52.223.226.41.1935 > 10.8.0.4.58582: Flags [.], ack 2628, win 126, options [nop,nop,TS val 1340983185 ecr 3510289505], length 0
12:19:31.727162 IP 10.8.0.4.58582 > 52.223.226.41.1935: Flags [.], seq 12527:13841, ack 1, win 501, options [nop,nop,TS val 3510289904 ecr 1340983185], length 1314
12:19:31.793386 IP 52.223.226.41.1935 > 10.8.0.4.58582: Flags [.], ack 5256, win 126, options [nop,nop,TS val 1340983282 ecr 3510289574], length 0
12:19:31.797054 IP 10.8.0.4.58582 > 52.223.226.41.1935: Flags [.], seq 13841:15155, ack 1, win 501, options [nop,nop,TS val 3510289974 ecr 1340983282], length 1314
12:19:31.827802 IP 10.8.0.4.58582 > 52.223.226.41.1935: Flags [.], seq 15155:16469, ack 1, win 501, options [nop,nop,TS val 3510290005 ecr 1340983282], length 1314
12:19:31.860684 IP 10.8.0.4.58582 > 52.223.226.41.1935: Flags [.], seq 16469:17783, ack 1, win 501, options [nop,nop,TS val 3510290038 ecr 1340983282], length 1314
12:19:31.862343 IP 52.223.226.41.1935 > 10.8.0.4.58582: Flags [.], ack 7884, win 126, options [nop,nop,TS val 1340983351 ecr 3510289673], length 0
12:19:31.926382 IP 10.8.0.4.58582 > 52.223.226.41.1935: Flags [.], seq 17783:19097, ack 1, win 501, options [nop,nop,TS val 3510290104 ecr 1340983351], length 1314
12:19:31.929655 IP 52.223.226.41.1935 > 10.8.0.4.58582: Flags [.], ack 9899, win 126, options [nop,nop,TS val 1340983418 ecr 3510289771], length 0
12:19:31.929673 IP 10.8.0.4.58582 > 52.223.226.41.1935: Flags [P.], seq 19097:19886, ack 1, win 501, options [nop,nop,TS val 3510290107 ecr 1340983418], length 789
12:19:31.994804 IP 10.8.0.4.58582 > 52.223.226.41.1935: Flags [.], seq 19886:21200, ack 1, win 501, options [nop,nop,TS val 3510290172 ecr 1340983418], length 1314
12:19:32.026042 IP 52.223.226.41.1935 > 10.8.0.4.58582: Flags [.], ack 12527, win 126, options [nop,nop,TS val 1340983515 ecr 3510289841], length 0
12:19:32.030900 IP 10.8.0.4.58582 > 52.223.226.41.1935: Flags [.], seq 21200:22514, ack 1, win 501, options [nop,nop,TS val 3510290208 ecr 1340983515], length 1314
12:19:32.062777 IP 10.8.0.4.58582 > 52.223.226.41.1935: Flags [.], seq 22514:23828, ack 1, win 501, options [nop,nop,TS val 3510290240 ecr 1340983515], length 1314
12:19:32.126642 IP 10.8.0.4.58582 > 52.223.226.41.1935: Flags [.], seq 23828:25142, ack 1, win 501, options [nop,nop,TS val 3510290304 ecr 1340983515], length 1314
12:19:32.126939 IP 52.223.226.41.1935 > 10.8.0.4.58582: Flags [.], ack 13841, win 126, options [nop,nop,TS val 1340983616 ecr 3510289904], length 0
12:19:32.160694 IP 52.223.226.41.1935 > 10.8.0.4.58582: Flags [.], ack 16469, win 126, options [nop,nop,TS val 1340983649 ecr 3510289974], length 0
12:19:32.163532 IP 10.8.0.4.58582 > 52.223.226.41.1935: Flags [.], seq 25142:26456, ack 1, win 501, options [nop,nop,TS val 3510290341 ecr 1340983649], length 1314
12:19:32.197350 IP 10.8.0.4.58582 > 52.223.226.41.1935: Flags [.], seq 26456:27770, ack 1, win 501, options [nop,nop,TS val 3510290375 ecr 1340983649], length 1314
12:19:32.259571 IP 52.223.226.41.1935 > 10.8.0.4.58582: Flags [.], ack 19097, win 126, options [nop,nop,TS val 1340983748 ecr 3510290038], length 0
12:19:32.262722 IP 52.223.226.41.1935 > 10.8.0.4.58582: Flags [.], ack 19886, win 126, options [nop,nop,TS val 1340983751 ecr 3510290107], length 0
12:19:32.262754 IP 10.8.0.4.58582 > 52.223.226.41.1935: Flags [P.], seq 27770:28942, ack 1, win 501, options [nop,nop,TS val 3510290440 ecr 1340983751], length 1172
12:19:32.297174 IP 10.8.0.4.58582 > 52.223.226.41.1935: Flags [.], seq 28942:30256, ack 1, win 501, options [nop,nop,TS val 3510290474 ecr 1340983751], length 1314
12:19:32.330870 IP 10.8.0.4.58582 > 52.223.226.41.1935: Flags [.], seq 30256:31570, ack 1, win 501, options [nop,nop,TS val 3510290508 ecr 1340983751], length 1314
12:19:32.366021 IP 52.223.226.41.1935 > 10.8.0.4.58582: Flags [.], ack 22514, win 126, options [nop,nop,TS val 1340983853 ecr 3510290172], length 0
12:19:32.373174 IP 10.8.0.4.58582 > 52.223.226.41.1935: Flags [.], seq 31570:32884, ack 1, win 501, options [nop,nop,TS val 3510290550 ecr 1340983853], length 1314
12:19:32.429576 IP 10.8.0.4.58582 > 52.223.226.41.1935: Flags [.], seq 32884:34198, ack 1, win 501, options [nop,nop,TS val 3510290607 ecr 1340983853], length 1314
12:19:32.460463 IP 52.223.226.41.1935 > 10.8.0.4.58582: Flags [.], ack 25142, win 126, options [nop,nop,TS val 1340983948 ecr 3510290240], length 0
12:19:32.463527 IP 10.8.0.4.58582 > 52.223.226.41.1935: Flags [.], seq 34198:35512, ack 1, win 501, options [nop,nop,TS val 3510290641 ecr 1340983948], length 1314
12:19:32.501065 IP 10.8.0.4.58582 > 52.223.226.41.1935: Flags [.], seq 35512:36826, ack 1, win 501, options [nop,nop,TS val 3510290678 ecr 1340983948], length 1314
12:19:32.530157 IP 52.223.226.41.1935 > 10.8.0.4.58582: Flags [.], ack 27770, win 126, options [nop,nop,TS val 1340984019 ecr 3510290341], length 0
12:19:32.560636 IP 10.8.0.4.58582 > 52.223.226.41.1935: Flags [.], seq 36826:38140, ack 1, win 501, options [nop,nop,TS val 3510290738 ecr 1340984019], length 1314
12:19:32.598196 IP 52.223.226.41.1935 > 10.8.0.4.58582: Flags [.], ack 28942, win 126, options [nop,nop,TS val 1340984084 ecr 3510290440], length 0
12:19:32.598224 IP 10.8.0.4.58582 > 52.223.226.41.1935: Flags [.], seq 38140:39454, ack 1, win 501, options [nop,nop,TS val 3510290776 ecr 1340984019], length 1314
12:19:32.598258 IP 10.8.0.4.58582 > 52.223.226.41.1935: Flags [P.], seq 39454:39767, ack 1, win 501, options [nop,nop,TS val 3510290776 ecr 1340984084], length 313
12:19:32.663824 IP 52.223.226.41.1935 > 10.8.0.4.58582: Flags [.], ack 31570, win 126, options [nop,nop,TS val 1340984153 ecr 3510290474], length 0
12:19:32.664010 IP 10.8.0.4.58582 > 52.223.226.41.1935: Flags [.], seq 39767:41081, ack 1, win 501, options [nop,nop,TS val 3510290841 ecr 1340984153], length 1314
12:19:32.695454 IP 10.8.0.4.58582 > 52.223.226.41.1935: Flags [.], seq 41081:42395, ack 1, win 501, options [nop,nop,TS val 3510290873 ecr 1340984153], length 1314
12:19:32.729500 IP 10.8.0.4.58582 > 52.223.226.41.1935: Flags [.], seq 42395:43709, ack 1, win 501, options [nop,nop,TS val 3510290907 ecr 1340984153], length 1314
12:19:32.763237 IP 52.223.226.41.1935 > 10.8.0.4.58582: Flags [.], ack 34198, win 126, options [nop,nop,TS val 1340984251 ecr 3510290550], length 0
12:19:32.792972 IP 10.8.0.4.58582 > 52.223.226.41.1935: Flags [.], seq 43709:45023, ack 1, win 501, options [nop,nop,TS val 3510290970 ecr 1340984251], length 1314
12:19:32.829609 IP 10.8.0.4.58582 > 52.223.226.41.1935: Flags [.], seq 45023:46337, ack 1, win 501, options [nop,nop,TS val 3510291007 ecr 1340984251], length 1314
12:19:32.834270 IP 52.223.226.41.1935 > 10.8.0.4.58582: Flags [.], ack 36826, win 126, options [nop,nop,TS val 1340984323 ecr 3510290641], length 0
12:19:32.864540 IP 10.8.0.4.58582 > 52.223.226.41.1935: Flags [.], seq 46337:47651, ack 1, win 501, options [nop,nop,TS val 3510291042 ecr 1340984323], length 1314
12:19:32.927944 IP 10.8.0.4.58582 > 52.223.226.41.1935: Flags [.], seq 47651:48965, ack 1, win 501, options [nop,nop,TS val 3510291105 ecr 1340984323], length 1314
12:19:32.931468 IP 52.223.226.41.1935 > 10.8.0.4.58582: Flags [.], ack 39454, win 126, options [nop,nop,TS val 1340984420 ecr 3510290738], length 0
12:19:32.931497 IP 52.223.226.41.1935 > 10.8.0.4.58582: Flags [.], ack 39767, win 126, options [nop,nop,TS val 1340984420 ecr 3510290776], length 0
12:19:32.931508 IP 10.8.0.4.58582 > 52.223.226.41.1935: Flags [P.], seq 48965:49768, ack 1, win 501, options [nop,nop,TS val 3510291109 ecr 1340984420], length 803
12:19:32.997137 IP 10.8.0.4.58582 > 52.223.226.41.1935: Flags [.], seq 49768:51082, ack 1, win 501, options [nop,nop,TS val 3510291174 ecr 1340984420], length 1314
12:19:33.025990 IP 10.8.0.4.58582 > 52.223.226.41.1935: Flags [.], seq 51082:52396, ack 1, win 501, options [nop,nop,TS val 3510291203 ecr 1340984420], length 1314
12:19:33.028806 IP 52.223.226.41.1935 > 10.8.0.4.58582: Flags [.], ack 42395, win 126, options [nop,nop,TS val 1340984517 ecr 3510290841], length 0
12:19:33.059430 IP 10.8.0.4.58582 > 52.223.226.41.1935: Flags [.], seq 52396:53710, ack 1, win 501, options [nop,nop,TS val 3510291237 ecr 1340984517], length 1314
12:19:33.126141 IP 52.223.226.41.1935 > 10.8.0.4.58582: Flags [.], ack 45023, win 126, options [nop,nop,TS val 1340984614 ecr 3510290907], length 0
12:19:33.133376 IP 10.8.0.4.58582 > 52.223.226.41.1935: Flags [.], seq 53710:55024, ack 1, win 501, options [nop,nop,TS val 3510291311 ecr 1340984614], length 1314
12:19:33.167052 IP 10.8.0.4.58582 > 52.223.226.41.1935: Flags [.], seq 55024:56338, ack 1, win 501, options [nop,nop,TS val 3510291344 ecr 1340984614], length 1314
12:19:33.196860 IP 10.8.0.4.58582 > 52.223.226.41.1935: Flags [.], seq 56338:57652, ack 1, win 501, options [nop,nop,TS val 3510291374 ecr 1340984614], length 1314
12:19:33.197634 IP 52.223.226.41.1935 > 10.8.0.4.58582: Flags [.], ack 47651, win 126, options [nop,nop,TS val 1340984686 ecr 3510291007], length 0
12:19:33.261602 IP 10.8.0.4.58582 > 52.223.226.41.1935: Flags [.], seq 57652:58966, ack 1, win 501, options [nop,nop,TS val 3510291439 ecr 1340984686], length 1314
12:19:33.264205 IP 52.223.226.41.1935 > 10.8.0.4.58582: Flags [.], ack 49768, win 126, options [nop,nop,TS val 1340984753 ecr 3510291105], length 0
12:19:33.264230 IP 10.8.0.4.58582 > 52.223.226.41.1935: Flags [P.], seq 58966:59663, ack 1, win 501, options [nop,nop,TS val 3510291442 ecr 1340984753], length 697
12:19:33.327187 IP 10.8.0.4.58582 > 52.223.226.41.1935: Flags [.], seq 59663:60977, ack 1, win 501, options [nop,nop,TS val 3510291504 ecr 1340984753], length 1314
12:19:33.359146 IP 52.223.226.41.1935 > 10.8.0.4.58582: Flags [.], ack 52396, win 126, options [nop,nop,TS val 1340984848 ecr 3510291174], length 0
12:19:33.363709 IP 10.8.0.4.58582 > 52.223.226.41.1935: Flags [.], seq 60977:62291, ack 1, win 501, options [nop,nop,TS val 3510291541 ecr 1340984848], length 1314
12:19:33.397857 IP 10.8.0.4.58582 > 52.223.226.41.1935: Flags [.], seq 62291:63605, ack 1, win 501, options [nop,nop,TS val 3510291575 ecr 1340984848], length 1314
12:19:33.454921 IP 52.223.226.41.1935 > 10.8.0.4.58582: Flags [.], ack 53710, win 126, options [nop,nop,TS val 1340984944 ecr 3510291237], length 0
12:19:33.463761 IP 10.8.0.4.58582 > 52.223.226.41.1935: Flags [.], seq 63605:64919, ack 1, win 501, options [nop,nop,TS val 3510291641 ecr 1340984944], length 1314
12:19:33.497120 IP 10.8.0.4.58582 > 52.223.226.41.1935: Flags [.], seq 64919:66233, ack 1, win 501, options [nop,nop,TS val 3510291674 ecr 1340984944], length 1314
12:19:33.500523 IP 52.223.226.41.1935 > 10.8.0.4.58582: Flags [.], ack 56338, win 126, options [nop,nop,TS val 1340984989 ecr 3510291311], length 0
12:19:33.527341 IP 10.8.0.4.58582 > 52.223.226.41.1935: Flags [.], seq 66233:67547, ack 1, win 501, options [nop,nop,TS val 3510291705 ecr 1340984989], length 1314
12:19:33.594047 IP 10.8.0.4.58582 > 52.223.226.41.1935: Flags [.], seq 67547:68861, ack 1, win 501, options [nop,nop,TS val 3510291771 ecr 1340984989], length 1314
12:19:33.594591 IP 52.223.226.41.1935 > 10.8.0.4.58582: Flags [.], ack 58966, win 126, options [nop,nop,TS val 1340985083 ecr 3510291374], length 0
12:19:33.597188 IP 52.223.226.41.1935 > 10.8.0.4.58582: Flags [.], ack 59663, win 126, options [nop,nop,TS val 1340985086 ecr 3510291442], length 0
12:19:33.597206 IP 10.8.0.4.58582 > 52.223.226.41.1935: Flags [P.], seq 68861:69653, ack 1, win 501, options [nop,nop,TS val 3510291775 ecr 1340985086], length 792
12:19:33.664177 IP 10.8.0.4.58582 > 52.223.226.41.1935: Flags [.], seq 69653:70967, ack 1, win 501, options [nop,nop,TS val 3510291841 ecr 1340985086], length 1314
12:19:33.696977 IP 52.223.226.41.1935 > 10.8.0.4.58582: Flags [.], ack 62291, win 126, options [nop,nop,TS val 1340985186 ecr 3510291504], length 0
12:19:33.697481 IP 10.8.0.4.58582 > 52.223.226.41.1935: Flags [.], seq 70967:72281, ack 1, win 501, options [nop,nop,TS val 3510291875 ecr 1340985186], length 1314
12:19:33.727731 IP 10.8.0.4.58582 > 52.223.226.41.1935: Flags [.], seq 72281:73595, ack 1, win 501, options [nop,nop,TS val 3510291905 ecr 1340985186], length 1314
12:19:33.796990 IP 52.223.226.41.1935 > 10.8.0.4.58582: Flags [.], ack 64919, win 126, options [nop,nop,TS val 1340985285 ecr 3510291575], length 0
12:19:33.797164 IP 10.8.0.4.58582 > 52.223.226.41.1935: Flags [.], seq 73595:74909, ack 1, win 501, options [nop,nop,TS val 3510291974 ecr 1340985285], length 1314
12:19:33.830343 IP 10.8.0.4.58582 > 52.223.226.41.1935: Flags [.], seq 74909:76223, ack 1, win 501, options [nop,nop,TS val 3510292008 ecr 1340985285], length 1314
12:19:33.860482 IP 52.223.226.41.1935 > 10.8.0.4.58582: Flags [.], ack 67547, win 126, options [nop,nop,TS val 1340985349 ecr 3510291674], length 0
12:19:33.863175 IP 10.8.0.4.58582 > 52.223.226.41.1935: Flags [.], seq 76223:77537, ack 1, win 501, options [nop,nop,TS val 3510292040 ecr 1340985349], length 1314
12:19:33.930109 IP 52.223.226.41.1935 > 10.8.0.4.58582: Flags [.], ack 69653, win 126, options [nop,nop,TS val 1340985419 ecr 3510291771], length 0
12:19:33.930162 IP 10.8.0.4.58582 > 52.223.226.41.1935: Flags [P.], seq 77537:78800, ack 1, win 501, options [nop,nop,TS val 3510292107 ecr 1340985419], length 1263
12:19:33.963750 IP 10.8.0.4.58582 > 52.223.226.41.1935: Flags [.], seq 78800:80114, ack 1, win 501, options [nop,nop,TS val 3510292141 ecr 1340985419], length 1314
12:19:33.997227 IP 10.8.0.4.58582 > 52.223.226.41.1935: Flags [.], seq 80114:81428, ack 1, win 501, options [nop,nop,TS val 3510292175 ecr 1340985419], length 1314
12:19:34.030355 IP 52.223.226.41.1935 > 10.8.0.4.58582: Flags [.], ack 72281, win 126, options [nop,nop,TS val 1340985519 ecr 3510291841], length 0
12:19:34.061221 IP 10.8.0.4.58582 > 52.223.226.41.1935: Flags [.], seq 81428:82742, ack 1, win 501, options [nop,nop,TS val 3510292238 ecr 1340985519], length 1314
12:19:34.093983 IP 10.8.0.4.58582 > 52.223.226.41.1935: Flags [.], seq 82742:84056, ack 1, win 501, options [nop,nop,TS val 3510292271 ecr 1340985519], length 1314
12:19:34.129376 IP 10.8.0.4.58582 > 52.223.226.41.1935: Flags [.], seq 84056:85370, ack 1, win 501, options [nop,nop,TS val 3510292307 ecr 1340985519], length 1314
12:19:34.130073 IP 52.223.226.41.1935 > 10.8.0.4.58582: Flags [.], ack 74909, win 126, options [nop,nop,TS val 1340985619 ecr 3510291905], length 0
12:19:34.189536 IP 10.8.0.4.58582 > 52.223.226.41.1935: Flags [.], seq 85370:86684, ack 1, win 501, options [nop,nop,TS val 3510292367 ecr 1340985619], length 1314
12:19:34.196025 IP 52.223.226.41.1935 > 10.8.0.4.58582: Flags [.], ack 77537, win 126, options [nop,nop,TS val 1340985685 ecr 3510292008], length 0
12:19:34.232479 IP 10.8.0.4.58582 > 52.223.226.41.1935: Flags [.], seq 86684:87998, ack 1, win 501, options [nop,nop,TS val 3510292410 ecr 1340985685], length 1314
12:19:34.261259 IP 10.8.0.4.58582 > 52.223.226.41.1935: Flags [.], seq 87998:89312, ack 1, win 501, options [nop,nop,TS val 3510292439 ecr 1340985685], length 1314
12:19:34.263420 IP 52.223.226.41.1935 > 10.8.0.4.58582: Flags [.], ack 78800, win 126, options [nop,nop,TS val 1340985752 ecr 3510292107], length 0
12:19:34.263438 IP 10.8.0.4.58582 > 52.223.226.41.1935: Flags [P.], seq 89312:89535, ack 1, win 501, options [nop,nop,TS val 3510292441 ecr 1340985752], length 223
12:19:34.328073 IP 10.8.0.4.58582 > 52.223.226.41.1935: Flags [.], seq 89535:90849, ack 1, win 501, options [nop,nop,TS val 3510292505 ecr 1340985752], length 1314
12:19:34.330259 IP 52.223.226.41.1935 > 10.8.0.4.58582: Flags [.], ack 81428, win 126, options [nop,nop,TS val 1340985819 ecr 3510292141], length 0
12:19:34.363603 IP 10.8.0.4.58582 > 52.223.226.41.1935: Flags [.], seq 90849:92163, ack 1, win 501, options [nop,nop,TS val 3510292541 ecr 1340985819], length 1314
12:19:34.397276 IP 10.8.0.4.58582 > 52.223.226.41.1935: Flags [.], seq 92163:93477, ack 1, win 501, options [nop,nop,TS val 3510292575 ecr 1340985819], length 1314
12:19:34.426892 IP 52.223.226.41.1935 > 10.8.0.4.58582: Flags [.], ack 84056, win 126, options [nop,nop,TS val 1340985916 ecr 3510292238], length 0
12:19:34.464041 IP 10.8.0.4.58582 > 52.223.226.41.1935: Flags [.], seq 93477:94791, ack 1, win 501, options [nop,nop,TS val 3510292641 ecr 1340985916], length 1314
12:19:34.489783 IP 10.8.0.4.58582 > 52.223.226.41.1935: Flags [.], seq 94791:96105, ack 1, win 501, options [nop,nop,TS val 3510292667 ecr 1340985916], length 1314
12:19:34.522486 IP 52.223.226.41.1935 > 10.8.0.4.58582: Flags [.], ack 86684, win 126, options [nop,nop,TS val 1340986011 ecr 3510292307], length 0
12:19:34.527819 IP 10.8.0.4.58582 > 52.223.226.41.1935: Flags [.], seq 96105:97419, ack 1, win 501, options [nop,nop,TS val 3510292705 ecr 1340986011], length 1314
12:19:34.594294 IP 52.223.226.41.1935 > 10.8.0.4.58582: Flags [.], ack 89312, win 126, options [nop,nop,TS val 1340986083 ecr 3510292410], length 0
12:19:34.594392 IP 10.8.0.4.58582 > 52.223.226.41.1935: Flags [.], seq 97419:98733, ack 1, win 501, options [nop,nop,TS val 3510292772 ecr 1340986083], length 1314
12:19:34.596037 IP 52.223.226.41.1935 > 10.8.0.4.58582: Flags [.], ack 89535, win 126, options [nop,nop,TS val 1340986085 ecr 3510292441], length 0
12:19:34.596059 IP 10.8.0.4.58582 > 52.223.226.41.1935: Flags [P.], seq 98733:99534, ack 1, win 501, options [nop,nop,TS val 3510292773 ecr 1340986085], length 801
12:19:34.660504 IP 10.8.0.4.58582 > 52.223.226.41.1935: Flags [.], seq 99534:100848, ack 1, win 501, options [nop,nop,TS val 3510292838 ecr 1340986085], length 1314
12:19:34.681728 IP 10.8.0.4.58582 > 52.223.226.41.1935: Flags [.], seq 100848:102162, ack 1, win 501, options [nop,nop,TS val 3510292859 ecr 1340986085], length 1314
12:19:34.696489 IP 52.223.226.41.1935 > 10.8.0.4.58582: Flags [.], ack 92163, win 126, options [nop,nop,TS val 1340986185 ecr 3510292505], length 0
12:19:34.724431 IP 10.8.0.4.58582 > 52.223.226.41.1935: Flags [.], seq 102162:103476, ack 1, win 501, options [nop,nop,TS val 3510292902 ecr 1340986185], length 1314
12:19:34.788622 IP 10.8.0.4.58582 > 52.223.226.41.1935: Flags [.], seq 103476:104790, ack 1, win 501, options [nop,nop,TS val 3510292966 ecr 1340986185], length 1314
12:19:34.797514 IP 52.223.226.41.1935 > 10.8.0.4.58582: Flags [.], ack 94791, win 126, options [nop,nop,TS val 1340986286 ecr 3510292575], length 0
12:19:34.827406 IP 10.8.0.4.58582 > 52.223.226.41.1935: Flags [.], seq 104790:106104, ack 1, win 501, options [nop,nop,TS val 3510293005 ecr 1340986286], length 1314
12:19:34.852271 IP 10.8.0.4.58582 > 52.223.226.41.1935: Flags [.], seq 106104:107418, ack 1, win 501, options [nop,nop,TS val 3510293030 ecr 1340986286], length 1314
12:19:34.860738 IP 52.223.226.41.1935 > 10.8.0.4.58582: Flags [.], ack 97419, win 126, options [nop,nop,TS val 1340986349 ecr 3510292667], length 0
12:19:34.915773 IP 10.8.0.4.58582 > 52.223.226.41.1935: Flags [.], seq 107418:108732, ack 1, win 501, options [nop,nop,TS val 3510293093 ecr 1340986349], length 1314
12:19:34.928940 IP 52.223.226.41.1935 > 10.8.0.4.58582: Flags [.], ack 99534, win 126, options [nop,nop,TS val 1340986417 ecr 3510292772], length 0
12:19:34.928959 IP 10.8.0.4.58582 > 52.223.226.41.1935: Flags [P.], seq 108732:109522, ack 1, win 501, options [nop,nop,TS val 3510293106 ecr 1340986417], length 790
12:19:34.997140 IP 10.8.0.4.58582 > 52.223.226.41.1935: Flags [.], seq 109522:110836, ack 1, win 501, options [nop,nop,TS val 3510293174 ecr 1340986417], length 1314
12:19:35.014929 IP 52.223.226.41.1935 > 10.8.0.4.58582: Flags [.], ack 102162, win 126, options [nop,nop,TS val 1340986503 ecr 3510292838], length 0
12:19:35.022837 IP 10.8.0.4.58582 > 52.223.226.41.1935: Flags [.], seq 110836:112150, ack 1, win 501, options [nop,nop,TS val 3510293200 ecr 1340986503], length 1314
12:19:35.061131 IP 10.8.0.4.58582 > 52.223.226.41.1935: Flags [.], seq 112150:113464, ack 1, win 501, options [nop,nop,TS val 3510293238 ecr 1340986503], length 1314
12:19:35.103116 IP 52.223.226.41.1935 > 10.8.0.4.58582: Flags [.], ack 103476, win 126, options [nop,nop,TS val 1340986592 ecr 3510292902], length 0
12:19:35.129514 IP 10.8.0.4.58582 > 52.223.226.41.1935: Flags [.], seq 113464:114778, ack 1, win 501, options [nop,nop,TS val 3510293307 ecr 1340986592], length 1314
12:19:35.151011 IP 10.8.0.4.58582 > 52.223.226.41.1935: Flags [.], seq 114778:116092, ack 1, win 501, options [nop,nop,TS val 3510293328 ecr 1340986592], length 1314
12:19:35.160503 IP 52.223.226.41.1935 > 10.8.0.4.58582: Flags [.], ack 106104, win 126, options [nop,nop,TS val 1340986649 ecr 3510292966], length 0
12:19:35.193662 IP 10.8.0.4.58582 > 52.223.226.41.1935: Flags [.], seq 116092:117406, ack 1, win 501, options [nop,nop,TS val 3510293371 ecr 1340986649], length 1314
12:19:35.248812 IP 52.223.226.41.1935 > 10.8.0.4.58582: Flags [.], ack 108732, win 126, options [nop,nop,TS val 1340986737 ecr 3510293030], length 0
12:19:35.257721 IP 10.8.0.4.58582 > 52.223.226.41.1935: Flags [.], seq 117406:118720, ack 1, win 501, options [nop,nop,TS val 3510293435 ecr 1340986737], length 1314
12:19:35.261862 IP 52.223.226.41.1935 > 10.8.0.4.58582: Flags [.], ack 109522, win 126, options [nop,nop,TS val 1340986750 ecr 3510293106], length 0
12:19:35.261904 IP 10.8.0.4.58582 > 52.223.226.41.1935: Flags [P.], seq 118720:119421, ack 1, win 501, options [nop,nop,TS val 3510293439 ecr 1340986750], length 701
12:19:35.322017 IP 10.8.0.4.58582 > 52.223.226.41.1935: Flags [.], seq 119421:120735, ack 1, win 501, options [nop,nop,TS val 3510293499 ecr 1340986750], length 1314
12:19:35.356044 IP 52.223.226.41.1935 > 10.8.0.4.58582: Flags [.], ack 112150, win 126, options [nop,nop,TS val 1340986844 ecr 3510293174], length 0
12:19:35.363860 IP 10.8.0.4.58582 > 52.223.226.41.1935: Flags [.], seq 120735:122049, ack 1, win 501, options [nop,nop,TS val 3510293541 ecr 1340986844], length 1314
12:19:35.386454 IP 10.8.0.4.58582 > 52.223.226.41.1935: Flags [.], seq 122049:123363, ack 1, win 501, options [nop,nop,TS val 3510293564 ecr 1340986844], length 1314
12:19:35.450684 IP 10.8.0.4.58582 > 52.223.226.41.1935: Flags [.], seq 123363:124677, ack 1, win 501, options [nop,nop,TS val 3510293628 ecr 1340986844], length 1314
12:19:35.462549 IP 52.223.226.41.1935 > 10.8.0.4.58582: Flags [.], ack 114778, win 126, options [nop,nop,TS val 1340986951 ecr 3510293238], length 0
12:19:35.493305 IP 10.8.0.4.58582 > 52.223.226.41.1935: Flags [.], seq 124677:125991, ack 1, win 501, options [nop,nop,TS val 3510293671 ecr 1340986951], length 1314
12:19:35.526976 IP 52.223.226.41.1935 > 10.8.0.4.58582: Flags [.], ack 117406, win 126, options [nop,nop,TS val 1340987015 ecr 3510293328], length 0
12:19:35.530487 IP 10.8.0.4.58582 > 52.223.226.41.1935: Flags [.], seq 125991:127305, ack 1, win 501, options [nop,nop,TS val 3510293708 ecr 1340987015], length 1314
12:19:35.594790 IP 52.223.226.41.1935 > 10.8.0.4.58582: Flags [.], ack 119421, win 126, options [nop,nop,TS val 1340987083 ecr 3510293435], length 0
12:19:35.594817 IP 10.8.0.4.58582 > 52.223.226.41.1935: Flags [P.], seq 127305:128564, ack 1, win 501, options [nop,nop,TS val 3510293772 ecr 1340987083], length 1259
12:19:35.621537 IP 10.8.0.4.58582 > 52.223.226.41.1935: Flags [.], seq 128564:129878, ack 1, win 501, options [nop,nop,TS val 3510293799 ecr 1340987083], length 1314
12:19:35.662590 IP 10.8.0.4.58582 > 52.223.226.41.1935: Flags [.], seq 129878:131192, ack 1, win 501, options [nop,nop,TS val 3510293840 ecr 1340987083], length 1314
12:19:35.697070 IP 52.223.226.41.1935 > 10.8.0.4.58582: Flags [.], ack 122049, win 126, options [nop,nop,TS val 1340987185 ecr 3510293499], length 0
12:19:35.707106 IP 10.8.0.4.58582 > 52.223.226.41.1935: Flags [.], seq 131192:132506, ack 1, win 501, options [nop,nop,TS val 3510293884 ecr 1340987185], length 1314
12:19:35.749936 IP 10.8.0.4.58582 > 52.223.226.41.1935: Flags [.], seq 132506:133820, ack 1, win 501, options [nop,nop,TS val 3510293927 ecr 1340987185], length 1314
12:19:35.784264 IP 52.223.226.41.1935 > 10.8.0.4.58582: Flags [.], ack 124677, win 126, options [nop,nop,TS val 1340987272 ecr 3510293564], length 0
12:19:35.793153 IP 10.8.0.4.58582 > 52.223.226.41.1935: Flags [.], seq 133820:135134, ack 1, win 501, options [nop,nop,TS val 3510293970 ecr 1340987272], length 1314
12:19:35.836189 IP 10.8.0.4.58582 > 52.223.226.41.1935: Flags [.], seq 135134:136448, ack 1, win 501, options [nop,nop,TS val 3510294013 ecr 1340987272], length 1314
12:19:35.863405 IP 52.223.226.41.1935 > 10.8.0.4.58582: Flags [.], ack 127305, win 126, options [nop,nop,TS val 1340987352 ecr 3510293671], length 0
12:19:35.896285 IP 10.8.0.4.58582 > 52.223.226.41.1935: Flags [.], seq 136448:137762, ack 1, win 501, options [nop,nop,TS val 3510294074 ecr 1340987352], length 1314
12:19:35.921631 IP 10.8.0.4.58582 > 52.223.226.41.1935: Flags [.], seq 137762:139076, ack 1, win 501, options [nop,nop,TS val 3510294099 ecr 1340987352], length 1314
12:19:35.927824 IP 52.223.226.41.1935 > 10.8.0.4.58582: Flags [.], ack 128564, win 126, options [nop,nop,TS val 1340987416 ecr 3510293772], length 0
12:19:35.927848 IP 10.8.0.4.58582 > 52.223.226.41.1935: Flags [P.], seq 139076:139303, ack 1, win 501, options [nop,nop,TS val 3510294105 ecr 1340987416], length 227
12:19:35.985514 IP 10.8.0.4.58582 > 52.223.226.41.1935: Flags [.], seq 139303:140617, ack 1, win 501, options [nop,nop,TS val 3510294163 ecr 1340987416], length 1314
12:19:35.995585 IP 52.223.226.41.1935 > 10.8.0.4.58582: Flags [.], ack 131192, win 126, options [nop,nop,TS val 1340987484 ecr 3510293799], length 0
12:19:36.028645 IP 10.8.0.4.58582 > 52.223.226.41.1935: Flags [.], seq 140617:141931, ack 1, win 501, options [nop,nop,TS val 3510294206 ecr 1340987484], length 1314
12:19:36.063936 IP 10.8.0.4.58582 > 52.223.226.41.1935: Flags [.], seq 141931:143245, ack 1, win 501, options [nop,nop,TS val 3510294241 ecr 1340987484], length 1314
12:19:36.083020 IP 52.223.226.41.1935 > 10.8.0.4.58582: Flags [.], ack 133820, win 126, options [nop,nop,TS val 1340987571 ecr 3510293884], length 0
12:19:36.126748 IP 10.8.0.4.58582 > 52.223.226.41.1935: Flags [.], seq 143245:144559, ack 1, win 501, options [nop,nop,TS val 3510294304 ecr 1340987571], length 1314
12:19:36.156368 IP 10.8.0.4.58582 > 52.223.226.41.1935: Flags [.], seq 144559:145873, ack 1, win 501, options [nop,nop,TS val 3510294334 ecr 1340987571], length 1314
12:19:36.169237 IP 52.223.226.41.1935 > 10.8.0.4.58582: Flags [.], ack 136448, win 126, options [nop,nop,TS val 1340987658 ecr 3510293970], length 0
12:19:36.197378 IP 10.8.0.4.58582 > 52.223.226.41.1935: Flags [.], seq 145873:147187, ack 1, win 501, options [nop,nop,TS val 3510294375 ecr 1340987658], length 1314
12:19:36.254971 IP 52.223.226.41.1935 > 10.8.0.4.58582: Flags [.], ack 139076, win 126, options [nop,nop,TS val 1340987743 ecr 3510294074], length 0
12:19:36.259802 IP 10.8.0.4.58582 > 52.223.226.41.1935: Flags [.], seq 147187:148501, ack 1, win 501, options [nop,nop,TS val 3510294437 ecr 1340987743], length 1314
12:19:36.261113 IP 52.223.226.41.1935 > 10.8.0.4.58582: Flags [.], ack 139303, win 126, options [nop,nop,TS val 1340987749 ecr 3510294105], length 0
12:19:36.261125 IP 10.8.0.4.58582 > 52.223.226.41.1935: Flags [P.], seq 148501:149302, ack 1, win 501, options [nop,nop,TS val 3510294438 ecr 1340987749], length 801
12:19:36.327170 IP 10.8.0.4.58582 > 52.223.226.41.1935: Flags [.], seq 149302:150616, ack 1, win 501, options [nop,nop,TS val 3510294504 ecr 1340987749], length 1314
12:19:36.361837 IP 52.223.226.41.1935 > 10.8.0.4.58582: Flags [.], ack 141931, win 126, options [nop,nop,TS val 1340987850 ecr 3510294163], length 0
12:19:36.362149 IP 10.8.0.4.58582 > 52.223.226.41.1935: Flags [.], seq 150616:151930, ack 1, win 501, options [nop,nop,TS val 3510294539 ecr 1340987850], length 1314
12:19:36.391342 IP 10.8.0.4.58582 > 52.223.226.41.1935: Flags [.], seq 151930:153244, ack 1, win 501, options [nop,nop,TS val 3510294569 ecr 1340987850], length 1314
12:19:36.455425 IP 10.8.0.4.58582 > 52.223.226.41.1935: Flags [.], seq 153244:154558, ack 1, win 501, options [nop,nop,TS val 3510294633 ecr 1340987850], length 1314
12:19:36.459879 IP 52.223.226.41.1935 > 10.8.0.4.58582: Flags [.], ack 144559, win 126, options [nop,nop,TS val 1340987948 ecr 3510294241], length 0
12:19:36.495545 IP 10.8.0.4.58582 > 52.223.226.41.1935: Flags [.], seq 154558:155872, ack 1, win 501, options [nop,nop,TS val 3510294673 ecr 1340987948], length 1314
12:19:36.519530 IP 10.8.0.4.58582 > 52.223.226.41.1935: Flags [.], seq 155872:157186, ack 1, win 501, options [nop,nop,TS val 3510294697 ecr 1340987948], length 1314
12:19:36.530452 IP 52.223.226.41.1935 > 10.8.0.4.58582: Flags [.], ack 147187, win 126, options [nop,nop,TS val 1340988019 ecr 3510294334], length 0
12:19:36.594174 IP 52.223.226.41.1935 > 10.8.0.4.58582: Flags [.], ack 149302, win 126, options [nop,nop,TS val 1340988083 ecr 3510294437], length 0
12:19:36.594220 IP 10.8.0.4.58582 > 52.223.226.41.1935: Flags [P.], seq 157186:158437, ack 1, win 501, options [nop,nop,TS val 3510294772 ecr 1340988083], length 1251
12:19:36.626775 IP 10.8.0.4.58582 > 52.223.226.41.1935: Flags [.], seq 158437:159751, ack 1, win 501, options [nop,nop,TS val 3510294804 ecr 1340988083], length 1314
12:19:36.661164 IP 10.8.0.4.58582 > 52.223.226.41.1935: Flags [.], seq 159751:161065, ack 1, win 501, options [nop,nop,TS val 3510294838 ecr 1340988083], length 1314
12:19:36.699888 IP 52.223.226.41.1935 > 10.8.0.4.58582: Flags [.], ack 151930, win 126, options [nop,nop,TS val 1340988184 ecr 3510294504], length 0
12:19:36.712453 IP 10.8.0.4.58582 > 52.223.226.41.1935: Flags [.], seq 161065:162379, ack 1, win 501, options [nop,nop,TS val 3510294890 ecr 1340988184], length 1314
12:19:36.755414 IP 10.8.0.4.58582 > 52.223.226.41.1935: Flags [.], seq 162379:163693, ack 1, win 501, options [nop,nop,TS val 3510294933 ecr 1340988184], length 1314
12:19:36.788321 IP 52.223.226.41.1935 > 10.8.0.4.58582: Flags [.], ack 154558, win 126, options [nop,nop,TS val 1340988277 ecr 3510294569], length 0
12:19:36.795361 IP 10.8.0.4.58582 > 52.223.226.41.1935: Flags [.], seq 163693:165007, ack 1, win 501, options [nop,nop,TS val 3510294973 ecr 1340988277], length 1314
12:19:36.840793 IP 10.8.0.4.58582 > 52.223.226.41.1935: Flags [.], seq 165007:166321, ack 1, win 501, options [nop,nop,TS val 3510295018 ecr 1340988277], length 1314
12:19:36.853013 IP 52.223.226.41.1935 > 10.8.0.4.58582: Flags [.], ack 157186, win 126, options [nop,nop,TS val 1340988341 ecr 3510294673], length 0
12:19:36.896967 IP 10.8.0.4.58582 > 52.223.226.41.1935: Flags [.], seq 166321:167635, ack 1, win 501, options [nop,nop,TS val 3510295074 ecr 1340988341], length 1314
12:19:36.926739 IP 10.8.0.4.58582 > 52.223.226.41.1935: Flags [.], seq 167635:168949, ack 1, win 501, options [nop,nop,TS val 3510295104 ecr 1340988341], length 1314
12:19:36.927167 IP 52.223.226.41.1935 > 10.8.0.4.58582: Flags [.], ack 158437, win 126, options [nop,nop,TS val 1340988416 ecr 3510294772], length 0
12:19:36.927186 IP 10.8.0.4.58582 > 52.223.226.41.1935: Flags [P.], seq 168949:169189, ack 1, win 501, options [nop,nop,TS val 3510295105 ecr 1340988416], length 240
12:19:36.990771 IP 10.8.0.4.58582 > 52.223.226.41.1935: Flags [.], seq 169189:170503, ack 1, win 501, options [nop,nop,TS val 3510295168 ecr 1340988416], length 1314
12:19:36.994969 IP 52.223.226.41.1935 > 10.8.0.4.58582: Flags [.], ack 161065, win 126, options [nop,nop,TS val 1340988483 ecr 3510294804], length 0
12:19:37.030583 IP 10.8.0.4.58582 > 52.223.226.41.1935: Flags [.], seq 170503:171817, ack 1, win 501, options [nop,nop,TS val 3510295208 ecr 1340988483], length 1314
12:19:37.054998 IP 10.8.0.4.58582 > 52.223.226.41.1935: Flags [.], seq 171817:173131, ack 1, win 501, options [nop,nop,TS val 3510295232 ecr 1340988483], length 1314
12:19:37.089896 IP 52.223.226.41.1935 > 10.8.0.4.58582: Flags [.], ack 163693, win 126, options [nop,nop,TS val 1340988577 ecr 3510294890], length 0
12:19:37.130685 IP 10.8.0.4.58582 > 52.223.226.41.1935: Flags [.], seq 173131:174445, ack 1, win 501, options [nop,nop,TS val 3510295308 ecr 1340988577], length 1314
12:19:37.162390 IP 10.8.0.4.58582 > 52.223.226.41.1935: Flags [.], seq 174445:175759, ack 1, win 501, options [nop,nop,TS val 3510295340 ecr 1340988577], length 1314
12:19:37.173956 IP 52.223.226.41.1935 > 10.8.0.4.58582: Flags [.], ack 166321, win 126, options [nop,nop,TS val 1340988662 ecr 3510294973], length 0
12:19:37.194562 IP 10.8.0.4.58582 > 52.223.226.41.1935: Flags [.], seq 175759:177073, ack 1, win 501, options [nop,nop,TS val 3510295372 ecr 1340988662], length 1314
12:19:37.259793 IP 52.223.226.41.1935 > 10.8.0.4.58582: Flags [.], ack 168949, win 126, options [nop,nop,TS val 1340988748 ecr 3510295074], length 0
12:19:37.260263 IP 52.223.226.41.1935 > 10.8.0.4.58582: Flags [.], ack 169189, win 126, options [nop,nop,TS val 1340988748 ecr 3510295105], length 0
12:19:37.260316 IP 10.8.0.4.58582 > 52.223.226.41.1935: Flags [P.], seq 177073:178328, ack 1, win 501, options [nop,nop,TS val 3510295438 ecr 1340988748], length 1255
12:19:37.290135 IP 10.8.0.4.58582 > 52.223.226.41.1935: Flags [.], seq 178328:179642, ack 1, win 501, options [nop,nop,TS val 3510295467 ecr 1340988748], length 1314
12:19:37.326688 IP 10.8.0.4.58582 > 52.223.226.41.1935: Flags [.], seq 179642:180956, ack 1, win 501, options [nop,nop,TS val 3510295504 ecr 1340988748], length 1314
12:19:37.364098 IP 52.223.226.41.1935 > 10.8.0.4.58582: Flags [.], ack 171817, win 126, options [nop,nop,TS val 1340988852 ecr 3510295168], length 0
12:19:37.375448 IP 10.8.0.4.58582 > 52.223.226.41.1935: Flags [.], seq 180956:182270, ack 1, win 501, options [nop,nop,TS val 3510295553 ecr 1340988852], length 1314
12:19:37.430362 IP 10.8.0.4.58582 > 52.223.226.41.1935: Flags [.], seq 182270:183584, ack 1, win 501, options [nop,nop,TS val 3510295608 ecr 1340988852], length 1314
12:19:37.451028 IP 52.223.226.41.1935 > 10.8.0.4.58582: Flags [.], ack 173131, win 126, options [nop,nop,TS val 1340988940 ecr 3510295232], length 0
12:19:37.461573 IP 10.8.0.4.58582 > 52.223.226.41.1935: Flags [.], seq 183584:184898, ack 1, win 501, options [nop,nop,TS val 3510295639 ecr 1340988940], length 1314
12:19:37.495712 IP 52.223.226.41.1935 > 10.8.0.4.58582: Flags [.], ack 175759, win 126, options [nop,nop,TS val 1340988984 ecr 3510295308], length 0
12:19:37.504262 IP 10.8.0.4.58582 > 52.223.226.41.1935: Flags [.], seq 184898:186212, ack 1, win 501, options [nop,nop,TS val 3510295682 ecr 1340988984], length 1314
12:19:37.559646 IP 10.8.0.4.58582 > 52.223.226.41.1935: Flags [.], seq 186212:187526, ack 1, win 501, options [nop,nop,TS val 3510295737 ecr 1340988984], length 1314
12:19:37.589426 IP 10.8.0.4.58582 > 52.223.226.41.1935: Flags [.], seq 187526:188840, ack 1, win 501, options [nop,nop,TS val 3510295767 ecr 1340988984], length 1314
12:19:37.593534 IP 52.223.226.41.1935 > 10.8.0.4.58582: Flags [.], ack 178328, win 126, options [nop,nop,TS val 1340989082 ecr 3510295372], length 0
12:19:37.593555 IP 10.8.0.4.58582 > 52.223.226.41.1935: Flags [P.], seq 188840:189070, ack 1, win 501, options [nop,nop,TS val 3510295771 ecr 1340989082], length 230
12:19:37.663099 IP 52.223.226.41.1935 > 10.8.0.4.58582: Flags [.], ack 180956, win 126, options [nop,nop,TS val 1340989148 ecr 3510295467], length 0
12:19:37.663932 IP 10.8.0.4.58582 > 52.223.226.41.1935: Flags [.], seq 189070:190384, ack 1, win 501, options [nop,nop,TS val 3510295841 ecr 1340989148], length 1314
12:19:37.696562 IP 10.8.0.4.58582 > 52.223.226.41.1935: Flags [.], seq 190384:191698, ack 1, win 501, options [nop,nop,TS val 3510295874 ecr 1340989148], length 1314
12:19:37.728599 IP 10.8.0.4.58582 > 52.223.226.41.1935: Flags [.], seq 191698:193012, ack 1, win 501, options [nop,nop,TS val 3510295906 ecr 1340989148], length 1314
12:19:37.767734 IP 52.223.226.41.1935 > 10.8.0.4.58582: Flags [.], ack 183584, win 126, options [nop,nop,TS val 1340989252 ecr 3510295553], length 0
12:19:37.795511 IP 10.8.0.4.58582 > 52.223.226.41.1935: Flags [.], seq 193012:194326, ack 1, win 501, options [nop,nop,TS val 3510295973 ecr 1340989252], length 1314
12:19:37.824652 IP 10.8.0.4.58582 > 52.223.226.41.1935: Flags [.], seq 194326:195640, ack 1, win 501, options [nop,nop,TS val 3510296002 ecr 1340989252], length 1314
12:19:37.837186 IP 52.223.226.41.1935 > 10.8.0.4.58582: Flags [.], ack 186212, win 126, options [nop,nop,TS val 1340989326 ecr 3510295639], length 0
12:19:37.860928 IP 10.8.0.4.58582 > 52.223.226.41.1935: Flags [.], seq 195640:196954, ack 1, win 501, options [nop,nop,TS val 3510296038 ecr 1340989326], length 1314
12:19:37.923085 IP 52.223.226.41.1935 > 10.8.0.4.58582: Flags [.], ack 188840, win 126, options [nop,nop,TS val 1340989411 ecr 3510295737], length 0
12:19:37.927296 IP 52.223.226.41.1935 > 10.8.0.4.58582: Flags [.], ack 189070, win 126, options [nop,nop,TS val 1340989415 ecr 3510295771], length 0
12:19:37.927332 IP 10.8.0.4.58582 > 52.223.226.41.1935: Flags [P.], seq 196954:198222, ack 1, win 501, options [nop,nop,TS val 3510296105 ecr 1340989415], length 1268
12:19:37.963851 IP 10.8.0.4.58582 > 52.223.226.41.1935: Flags [.], seq 198222:199536, ack 1, win 501, options [nop,nop,TS val 3510296141 ecr 1340989415], length 1314
12:19:37.995527 IP 10.8.0.4.58582 > 52.223.226.41.1935: Flags [.], seq 199536:200850, ack 1, win 501, options [nop,nop,TS val 3510296173 ecr 1340989415], length 1314
12:19:38.033750 IP 52.223.226.41.1935 > 10.8.0.4.58582: Flags [.], ack 191698, win 126, options [nop,nop,TS val 1340989518 ecr 3510295841], length 0
