12:06:30.436681 IP 10.8.0.4.39552 > 99.181.68.50.1935: Flags [P.], seq 3689817232:3689817248, ack 2716622772, win 501, options [nop,nop,TS val 2716809723 ecr 3531607691], length 16
12:06:30.436747 IP 10.8.0.4.39552 > 99.181.68.50.1935: Flags [.], seq 16:1330, ack 1, win 501, options [nop,nop,TS val 2716809723 ecr 3531607691], length 1314
12:06:30.579100 IP 10.8.0.4.39552 > 99.181.68.50.1935: Flags [.], seq 1330:2644, ack 1, win 501, options [nop,nop,TS val 2716809865 ecr 3531607691], length 1314
12:06:30.629488 IP 10.8.0.4.39552 > 99.181.68.50.1935: Flags [.], seq 2644:3958, ack 1, win 501, options [nop,nop,TS val 2716809916 ecr 3531607691], length 1314
12:06:30.685079 IP 10.8.0.4.39552 > 99.181.68.50.1935: Flags [.], seq 3958:5272, ack 1, win 501, options [nop,nop,TS val 2716809971 ecr 3531607691], length 1314
12:06:30.727510 IP 10.8.0.4.39552 > 99.181.68.50.1935: Flags [.], seq 5272:6586, ack 1, win 501, options [nop,nop,TS val 2716810014 ecr 3531607691], length 1314
12:06:30.762449 IP 10.8.0.4.39552 > 99.181.68.50.1935: Flags [.], seq 6586:7900, ack 1, win 501, options [nop,nop,TS val 2716810049 ecr 3531607691], length 1314
12:06:30.771910 IP 99.181.68.50.1935 > 10.8.0.4.39552: Flags [.], ack 16, win 126, options [nop,nop,TS val 3531608787 ecr 2716809723], length 0
12:06:30.771931 IP 10.8.0.4.39552 > 99.181.68.50.1935: Flags [P.], seq 7900:8033, ack 1, win 501, options [nop,nop,TS val 2716810058 ecr 3531608787], length 133
12:06:30.772095 IP 99.181.68.50.1935 > 10.8.0.4.39552: Flags [.], ack 1330, win 126, options [nop,nop,TS val 3531608787 ecr 2716809723], length 0
12:06:30.832142 IP 10.8.0.4.39552 > 99.181.68.50.1935: Flags [.], seq 8033:9347, ack 1, win 501, options [nop,nop,TS val 2716810118 ecr 3531608787], length 1314
12:06:30.855944 IP 10.8.0.4.39552 > 99.181.68.50.1935: Flags [.], seq 9347:10661, ack 1, win 501, options [nop,nop,TS val 2716810142 ecr 3531608787], length 1314
12:06:30.898608 IP 10.8.0.4.39552 > 99.181.68.50.1935: Flags [.], seq 10661:11975, ack 1, win 501, options [nop,nop,TS val 2716810185 ecr 3531608787], length 1314
12:06:30.914551 IP 99.181.68.50.1935 > 10.8.0.4.39552: Flags [.], ack 2644, win 126, options [nop,nop,TS val 3531608930 ecr 2716809865], length 0
12:06:30.963088 IP 10.8.0.4.39552 > 99.181.68.50.1935: Flags [.], seq 11975:13289, ack 1, win 501, options [nop,nop,TS val 2716810249 ecr 3531608930], length 1314
12:06:30.964879 IP 99.181.68.50.1935 > 10.8.0.4.39552: Flags [.], ack 3958, win 126, options [nop,nop,TS val 3531608980 ecr 2716809916], length 0
12:06:30.984470 IP 10.8.0.4.39552 > 99.181.68.50.1935: Flags [.], seq 13289:14603, ack 1, win 501, options [nop,nop,TS val 2716810271 ecr 3531608980], length 1314
12:06:31.020649 IP 99.181.68.50.1935 > 10.8.0.4.39552: Flags [.], ack 5272, win 126, options [nop,nop,TS val 3531609036 ecr 2716809971], length 0
12:06:31.031574 IP 10.8.0.4.39552 > 99.181.68.50.1935: Flags [.], seq 14603:15917, ack 1, win 501, options [nop,nop,TS val 2716810318 ecr 3531609036], length 1314
12:06:31.063376 IP 99.181.68.50.1935 > 10.8.0.4.39552: Flags [.], ack 6586, win 126, options [nop,nop,TS val 3531609078 ecr 2716810014], length 0
12:06:31.091841 IP 10.8.0.4.39552 > 99.181.68.50.1935: Flags [.], seq 15917:17231, ack 1, win 501, options [nop,nop,TS val 2716810378 ecr 3531609078], length 1314
12:06:31.098028 IP 99.181.68.50.1935 > 10.8.0.4.39552: Flags [.], ack 7900, win 126, options [nop,nop,TS val 3531609113 ecr 2716810049], length 0
12:06:31.107164 IP 99.181.68.50.1935 > 10.8.0.4.39552: Flags [.], ack 8033, win 126, options [nop,nop,TS val 3531609122 ecr 2716810058], length 0
12:06:31.107213 IP 10.8.0.4.39552 > 99.181.68.50.1935: Flags [P.], seq 17231:17936, ack 1, win 501, options [nop,nop,TS val 2716810394 ecr 3531609122], length 705
12:06:31.156106 IP 10.8.0.4.39552 > 99.181.68.50.1935: Flags [.], seq 17936:19250, ack 1, win 501, options [nop,nop,TS val 2716810442 ecr 3531609122], length 1314
12:06:31.167531 IP 99.181.68.50.1935 > 10.8.0.4.39552: Flags [.], ack 9347, win 126, options [nop,nop,TS val 3531609183 ecr 2716810118], length 0
12:06:31.191593 IP 99.181.68.50.1935 > 10.8.0.4.39552: Flags [.], ack 10661, win 126, options [nop,nop,TS val 3531609207 ecr 2716810142], length 0
12:06:31.194772 IP 10.8.0.4.39552 > 99.181.68.50.1935: Flags [.], seq 19250:20564, ack 1, win 501, options [nop,nop,TS val 2716810481 ecr 3531609207], length 1314
12:06:31.230482 IP 10.8.0.4.39552 > 99.181.68.50.1935: Flags [.], seq 20564:21878, ack 1, win 501, options [nop,nop,TS val 2716810517 ecr 3531609207], length 1314
12:06:31.234074 IP 99.181.68.50.1935 > 10.8.0.4.39552: Flags [.], ack 11975, win 126, options [nop,nop,TS val 3531609249 ecr 2716810185], length 0
12:06:31.284195 IP 10.8.0.4.39552 > 99.181.68.50.1935: Flags [.], seq 21878:23192, ack 1, win 501, options [nop,nop,TS val 2716810570 ecr 3531609249], length 1314
12:06:31.299055 IP 99.181.68.50.1935 > 10.8.0.4.39552: Flags [.], ack 13289, win 126, options [nop,nop,TS val 3531609314 ecr 2716810249], length 0
12:06:31.324391 IP 99.181.68.50.1935 > 10.8.0.4.39552: Flags [.], ack 14603, win 126, options [nop,nop,TS val 3531609335 ecr 2716810271], length 0
12:06:31.326827 IP 10.8.0.4.39552 > 99.181.68.50.1935: Flags [.], seq 23192:24506, ack 1, win 501, options [nop,nop,TS val 2716810613 ecr 3531609335], length 1314
12:06:31.363447 IP 10.8.0.4.39552 > 99.181.68.50.1935: Flags [.], seq 24506:25820, ack 1, win 501, options [nop,nop,TS val 2716810650 ecr 3531609335], length 1314
12:06:31.367175 IP 99.181.68.50.1935 > 10.8.0.4.39552: Flags [.], ack 15917, win 126, options [nop,nop,TS val 3531609382 ecr 2716810318], length 0
12:06:31.427382 IP 99.181.68.50.1935 > 10.8.0.4.39552: Flags [.], ack 17231, win 126, options [nop,nop,TS val 3531609443 ecr 2716810378], length 0
12:06:31.429254 IP 10.8.0.4.39552 > 99.181.68.50.1935: Flags [.], seq 25820:27134, ack 1, win 501, options [nop,nop,TS val 2716810716 ecr 3531609443], length 1314
12:06:31.442782 IP 99.181.68.50.1935 > 10.8.0.4.39552: Flags [.], ack 17936, win 126, options [nop,nop,TS val 3531609458 ecr 2716810394], length 0
12:06:31.442807 IP 10.8.0.4.39552 > 99.181.68.50.1935: Flags [P.], seq 27134:27927, ack 1, win 501, options [nop,nop,TS val 2716810729 ecr 3531609458], length 793
12:06:31.497519 IP 10.8.0.4.39552 > 99.181.68.50.1935: Flags [.], seq 27927:29241, ack 1, win 501, options [nop,nop,TS val 2716810784 ecr 3531609458], length 1314
12:06:31.519030 IP 10.8.0.4.39552 > 99.181.68.50.1935: Flags [.], seq 29241:30555, ack 1, win 501, options [nop,nop,TS val 2716810805 ecr 3531609458], length 1314
12:06:31.530293 IP 99.181.68.50.1935 > 10.8.0.4.39552: Flags [.], ack 20564, win 126, options [nop,nop,TS val 3531609545 ecr 2716810442], length 0
12:06:31.563152 IP 10.8.0.4.39552 > 99.181.68.50.1935: Flags [.], seq 30555:31869, ack 1, win 501, options [nop,nop,TS val 2716810849 ecr 3531609545], length 1314
12:06:31.619984 IP 99.181.68.50.1935 > 10.8.0.4.39552: Flags [.], ack 23192, win 126, options [nop,nop,TS val 3531609635 ecr 2716810517], length 0
12:06:31.626116 IP 10.8.0.4.39552 > 99.181.68.50.1935: Flags [.], seq 31869:33183, ack 1, win 501, options [nop,nop,TS val 2716810912 ecr 3531609635], length 1314
12:06:31.661387 IP 10.8.0.4.39552 > 99.181.68.50.1935: Flags [.], seq 33183:34497, ack 1, win 501, options [nop,nop,TS val 2716810948 ecr 3531609635], length 1314
12:06:31.694637 IP 10.8.0.4.39552 > 99.181.68.50.1935: Flags [.], seq 34497:35811, ack 1, win 501, options [nop,nop,TS val 2716810981 ecr 3531609635], length 1314
12:06:31.699062 IP 99.181.68.50.1935 > 10.8.0.4.39552: Flags [.], ack 25820, win 126, options [nop,nop,TS val 3531609714 ecr 2716810613], length 0
12:06:31.753631 IP 10.8.0.4.39552 > 99.181.68.50.1935: Flags [.], seq 35811:37125, ack 1, win 501, options [nop,nop,TS val 2716811040 ecr 3531609714], length 1314
12:06:31.778109 IP 99.181.68.50.1935 > 10.8.0.4.39552: Flags [.], ack 27927, win 126, options [nop,nop,TS val 3531609793 ecr 2716810716], length 0
12:06:31.778146 IP 10.8.0.4.39552 > 99.181.68.50.1935: Flags [P.], seq 37125:37914, ack 1, win 501, options [nop,nop,TS val 2716811064 ecr 3531609793], length 789
12:06:31.818222 IP 10.8.0.4.39552 > 99.181.68.50.1935: Flags [.], seq 37914:39228, ack 1, win 501, options [nop,nop,TS val 2716811105 ecr 3531609793], length 1314
12:06:31.854523 IP 99.181.68.50.1935 > 10.8.0.4.39552: Flags [.], ack 30555, win 126, options [nop,nop,TS val 3531609870 ecr 2716810784], length 0
12:06:31.861230 IP 10.8.0.4.39552 > 99.181.68.50.1935: Flags [.], seq 39228:40542, ack 1, win 501, options [nop,nop,TS val 2716811148 ecr 3531609870], length 1314
12:06:31.903793 IP 10.8.0.4.39552 > 99.181.68.50.1935: Flags [.], seq 40542:41856, ack 1, win 501, options [nop,nop,TS val 2716811190 ecr 3531609870], length 1314
12:06:31.944108 IP 99.181.68.50.1935 > 10.8.0.4.39552: Flags [.], ack 31869, win 126, options [nop,nop,TS val 3531609959 ecr 2716810849], length 0
12:06:31.961540 IP 10.8.0.4.39552 > 99.181.68.50.1935: Flags [.], seq 41856:43170, ack 1, win 501, options [nop,nop,TS val 2716811248 ecr 3531609959], length 1314
12:06:31.988684 IP 10.8.0.4.39552 > 99.181.68.50.1935: Flags [.], seq 43170:44484, ack 1, win 501, options [nop,nop,TS val 2716811275 ecr 3531609959], length 1314
12:06:31.996848 IP 99.181.68.50.1935 > 10.8.0.4.39552: Flags [.], ack 34497, win 126, options [nop,nop,TS val 3531610012 ecr 2716810912], length 0
12:06:32.032220 IP 10.8.0.4.39552 > 99.181.68.50.1935: Flags [.], seq 44484:45798, ack 1, win 501, options [nop,nop,TS val 2716811319 ecr 3531610012], length 1314
12:06:32.089262 IP 99.181.68.50.1935 > 10.8.0.4.39552: Flags [.], ack 37125, win 126, options [nop,nop,TS val 3531610104 ecr 2716810981], length 0
12:06:32.096240 IP 10.8.0.4.39552 > 99.181.68.50.1935: Flags [.], seq 45798:47112, ack 1, win 501, options [nop,nop,TS val 2716811383 ecr 3531610104], length 1314
12:06:32.113755 IP 99.181.68.50.1935 > 10.8.0.4.39552: Flags [.], ack 37914, win 126, options [nop,nop,TS val 3531610129 ecr 2716811064], length 0
12:06:32.113772 IP 10.8.0.4.39552 > 99.181.68.50.1935: Flags [P.], seq 47112:47817, ack 1, win 501, options [nop,nop,TS val 2716811400 ecr 3531610129], length 705
12:06:32.159994 IP 10.8.0.4.39552 > 99.181.68.50.1935: Flags [.], seq 47817:49131, ack 1, win 501, options [nop,nop,TS val 2716811446 ecr 3531610129], length 1314
12:06:32.194708 IP 10.8.0.4.39552 > 99.181.68.50.1935: Flags [.], seq 49131:50445, ack 1, win 501, options [nop,nop,TS val 2716811481 ecr 3531610129], length 1314
12:06:32.196602 IP 99.181.68.50.1935 > 10.8.0.4.39552: Flags [.], ack 40542, win 126, options [nop,nop,TS val 3531610212 ecr 2716811105], length 0
12:06:32.228439 IP 10.8.0.4.39552 > 99.181.68.50.1935: Flags [.], seq 50445:51759, ack 1, win 501, options [nop,nop,TS val 2716811515 ecr 3531610212], length 1314
12:06:32.287724 IP 10.8.0.4.39552 > 99.181.68.50.1935: Flags [.], seq 51759:53073, ack 1, win 501, options [nop,nop,TS val 2716811574 ecr 3531610212], length 1314
12:06:32.297147 IP 99.181.68.50.1935 > 10.8.0.4.39552: Flags [.], ack 43170, win 126, options [nop,nop,TS val 3531610312 ecr 2716811190], length 0
12:06:32.330564 IP 10.8.0.4.39552 > 99.181.68.50.1935: Flags [.], seq 53073:54387, ack 1, win 501, options [nop,nop,TS val 2716811617 ecr 3531610312], length 1314
12:06:32.365705 IP 10.8.0.4.39552 > 99.181.68.50.1935: Flags [.], seq 54387:55701, ack 1, win 501, options [nop,nop,TS val 2716811652 ecr 3531610312], length 1314
12:06:32.367931 IP 99.181.68.50.1935 > 10.8.0.4.39552: Flags [.], ack 45798, win 126, options [nop,nop,TS val 3531610383 ecr 2716811275], length 0
12:06:32.429724 IP 10.8.0.4.39552 > 99.181.68.50.1935: Flags [.], seq 55701:57015, ack 1, win 501, options [nop,nop,TS val 2716811716 ecr 3531610383], length 1314
12:06:32.449052 IP 99.181.68.50.1935 > 10.8.0.4.39552: Flags [.], ack 47817, win 126, options [nop,nop,TS val 3531610464 ecr 2716811383], length 0
12:06:32.449062 IP 10.8.0.4.39552 > 99.181.68.50.1935: Flags [P.], seq 57015:57799, ack 1, win 501, options [nop,nop,TS val 2716811735 ecr 3531610464], length 784
12:06:32.495162 IP 10.8.0.4.39552 > 99.181.68.50.1935: Flags [.], seq 57799:59113, ack 1, win 501, options [nop,nop,TS val 2716811781 ecr 3531610464], length 1314
12:06:32.522529 IP 10.8.0.4.39552 > 99.181.68.50.1935: Flags [.], seq 59113:60427, ack 1, win 501, options [nop,nop,TS val 2716811809 ecr 3531610464], length 1314
12:06:32.530095 IP 99.181.68.50.1935 > 10.8.0.4.39552: Flags [.], ack 50445, win 126, options [nop,nop,TS val 3531610545 ecr 2716811446], length 0
12:06:32.565780 IP 10.8.0.4.39552 > 99.181.68.50.1935: Flags [.], seq 60427:61741, ack 1, win 501, options [nop,nop,TS val 2716811852 ecr 3531610545], length 1314
12:06:32.624408 IP 99.181.68.50.1935 > 10.8.0.4.39552: Flags [.], ack 53073, win 126, options [nop,nop,TS val 3531610639 ecr 2716811515], length 0
12:06:32.629767 IP 10.8.0.4.39552 > 99.181.68.50.1935: Flags [.], seq 61741:63055, ack 1, win 501, options [nop,nop,TS val 2716811916 ecr 3531610639], length 1314
12:06:32.651185 IP 10.8.0.4.39552 > 99.181.68.50.1935: Flags [.], seq 63055:64369, ack 1, win 501, options [nop,nop,TS val 2716811938 ecr 3531610639], length 1314
12:06:32.696127 IP 10.8.0.4.39552 > 99.181.68.50.1935: Flags [.], seq 64369:65683, ack 1, win 501, options [nop,nop,TS val 2716811982 ecr 3531610639], length 1314
12:06:32.701966 IP 99.181.68.50.1935 > 10.8.0.4.39552: Flags [.], ack 55701, win 126, options [nop,nop,TS val 3531610716 ecr 2716811617], length 0
12:06:32.758103 IP 10.8.0.4.39552 > 99.181.68.50.1935: Flags [.], seq 65683:66997, ack 1, win 501, options [nop,nop,TS val 2716812044 ecr 3531610716], length 1314
12:06:32.784388 IP 99.181.68.50.1935 > 10.8.0.4.39552: Flags [.], ack 57799, win 126, options [nop,nop,TS val 3531610799 ecr 2716811716], length 0
12:06:32.784423 IP 10.8.0.4.39552 > 99.181.68.50.1935: Flags [P.], seq 66997:67800, ack 1, win 501, options [nop,nop,TS val 2716812071 ecr 3531610799], length 803
12:06:32.822538 IP 10.8.0.4.39552 > 99.181.68.50.1935: Flags [.], seq 67800:69114, ack 1, win 501, options [nop,nop,TS val 2716812109 ecr 3531610799], length 1314
12:06:32.858014 IP 99.181.68.50.1935 > 10.8.0.4.39552: Flags [.], ack 60427, win 126, options [nop,nop,TS val 3531610873 ecr 2716811781], length 0
12:06:32.865513 IP 10.8.0.4.39552 > 99.181.68.50.1935: Flags [.], seq 69114:70428, ack 1, win 501, options [nop,nop,TS val 2716812152 ecr 3531610873], length 1314
12:06:32.908070 IP 10.8.0.4.39552 > 99.181.68.50.1935: Flags [.], seq 70428:71742, ack 1, win 501, options [nop,nop,TS val 2716812194 ecr 3531610873], length 1314
12:06:32.963666 IP 10.8.0.4.39552 > 99.181.68.50.1935: Flags [.], seq 71742:73056, ack 1, win 501, options [nop,nop,TS val 2716812250 ecr 3531610873], length 1314
12:06:32.965200 IP 99.181.68.50.1935 > 10.8.0.4.39552: Flags [.], ack 63055, win 126, options [nop,nop,TS val 3531610980 ecr 2716811852], length 0
12:06:32.993833 IP 10.8.0.4.39552 > 99.181.68.50.1935: Flags [.], seq 73056:74370, ack 1, win 501, options [nop,nop,TS val 2716812280 ecr 3531610980], length 1314
12:06:33.031765 IP 99.181.68.50.1935 > 10.8.0.4.39552: Flags [.], ack 65683, win 126, options [nop,nop,TS val 3531611047 ecr 2716811938], length 0
12:06:33.036548 IP 10.8.0.4.39552 > 99.181.68.50.1935: Flags [.], seq 74370:75684, ack 1, win 501, options [nop,nop,TS val 2716812323 ecr 3531611047], length 1314
12:06:33.098592 IP 10.8.0.4.39552 > 99.181.68.50.1935: Flags [.], seq 75684:76998, ack 1, win 501, options [nop,nop,TS val 2716812385 ecr 3531611047], length 1314
12:06:33.119844 IP 99.181.68.50.1935 > 10.8.0.4.39552: Flags [.], ack 67800, win 126, options [nop,nop,TS val 3531611135 ecr 2716812044], length 0
12:06:33.119881 IP 10.8.0.4.39552 > 99.181.68.50.1935: Flags [P.], seq 76998:77691, ack 1, win 501, options [nop,nop,TS val 2716812406 ecr 3531611135], length 693
12:06:33.163466 IP 10.8.0.4.39552 > 99.181.68.50.1935: Flags [.], seq 77691:79005, ack 1, win 501, options [nop,nop,TS val 2716812450 ecr 3531611135], length 1314
12:06:33.186238 IP 10.8.0.4.39552 > 99.181.68.50.1935: Flags [.], seq 79005:80319, ack 1, win 501, options [nop,nop,TS val 2716812473 ecr 3531611135], length 1314
12:06:33.200987 IP 99.181.68.50.1935 > 10.8.0.4.39552: Flags [.], ack 70428, win 126, options [nop,nop,TS val 3531611216 ecr 2716812109], length 0
12:06:33.229920 IP 10.8.0.4.39552 > 99.181.68.50.1935: Flags [.], seq 80319:81633, ack 1, win 501, options [nop,nop,TS val 2716812516 ecr 3531611216], length 1314
12:06:33.292606 IP 10.8.0.4.39552 > 99.181.68.50.1935: Flags [.], seq 81633:82947, ack 1, win 501, options [nop,nop,TS val 2716812579 ecr 3531611216], length 1314
12:06:33.299153 IP 99.181.68.50.1935 > 10.8.0.4.39552: Flags [.], ack 73056, win 126, options [nop,nop,TS val 3531611314 ecr 2716812194], length 0
12:06:33.331973 IP 10.8.0.4.39552 > 99.181.68.50.1935: Flags [.], seq 82947:84261, ack 1, win 501, options [nop,nop,TS val 2716812618 ecr 3531611314], length 1314
12:06:33.365692 IP 10.8.0.4.39552 > 99.181.68.50.1935: Flags [.], seq 84261:85575, ack 1, win 501, options [nop,nop,TS val 2716812652 ecr 3531611314], length 1314
12:06:33.372072 IP 99.181.68.50.1935 > 10.8.0.4.39552: Flags [.], ack 75684, win 126, options [nop,nop,TS val 3531611387 ecr 2716812280], length 0
12:06:33.421213 IP 10.8.0.4.39552 > 99.181.68.50.1935: Flags [.], seq 85575:86889, ack 1, win 501, options [nop,nop,TS val 2716812708 ecr 3531611387], length 1314
12:06:33.455507 IP 99.181.68.50.1935 > 10.8.0.4.39552: Flags [.], ack 77691, win 126, options [nop,nop,TS val 3531611470 ecr 2716812385], length 0
12:06:33.455536 IP 10.8.0.4.39552 > 99.181.68.50.1935: Flags [P.], seq 86889:87681, ack 1, win 501, options [nop,nop,TS val 2716812742 ecr 3531611470], length 792
12:06:33.499204 IP 10.8.0.4.39552 > 99.181.68.50.1935: Flags [.], seq 87681:88995, ack 1, win 501, options [nop,nop,TS val 2716812786 ecr 3531611470], length 1314
12:06:33.521680 IP 99.181.68.50.1935 > 10.8.0.4.39552: Flags [.], ack 80319, win 126, options [nop,nop,TS val 3531611537 ecr 2716812450], length 0
12:06:33.528360 IP 10.8.0.4.39552 > 99.181.68.50.1935: Flags [.], seq 88995:90309, ack 1, win 501, options [nop,nop,TS val 2716812815 ecr 3531611537], length 1314
12:06:33.571261 IP 10.8.0.4.39552 > 99.181.68.50.1935: Flags [.], seq 90309:91623, ack 1, win 501, options [nop,nop,TS val 2716812858 ecr 3531611537], length 1314
12:06:33.628285 IP 99.181.68.50.1935 > 10.8.0.4.39552: Flags [.], ack 82947, win 126, options [nop,nop,TS val 3531611643 ecr 2716812516], length 0
12:06:33.630530 IP 10.8.0.4.39552 > 99.181.68.50.1935: Flags [.], seq 91623:92937, ack 1, win 501, options [nop,nop,TS val 2716812917 ecr 3531611643], length 1314
12:06:33.656768 IP 10.8.0.4.39552 > 99.181.68.50.1935: Flags [.], seq 92937:94251, ack 1, win 501, options [nop,nop,TS val 2716812943 ecr 3531611643], length 1314
12:06:33.699623 IP 10.8.0.4.39552 > 99.181.68.50.1935: Flags [.], seq 94251:95565, ack 1, win 501, options [nop,nop,TS val 2716812986 ecr 3531611643], length 1314
12:06:33.701181 IP 99.181.68.50.1935 > 10.8.0.4.39552: Flags [.], ack 85575, win 126, options [nop,nop,TS val 3531611716 ecr 2716812618], length 0
12:06:33.763863 IP 10.8.0.4.39552 > 99.181.68.50.1935: Flags [.], seq 95565:96879, ack 1, win 501, options [nop,nop,TS val 2716813050 ecr 3531611716], length 1314
12:06:33.791393 IP 99.181.68.50.1935 > 10.8.0.4.39552: Flags [.], ack 87681, win 126, options [nop,nop,TS val 3531611806 ecr 2716812708], length 0
12:06:33.791421 IP 10.8.0.4.39552 > 99.181.68.50.1935: Flags [P.], seq 96879:97676, ack 1, win 501, options [nop,nop,TS val 2716813078 ecr 3531611806], length 797
12:06:33.828089 IP 10.8.0.4.39552 > 99.181.68.50.1935: Flags [.], seq 97676:98990, ack 1, win 501, options [nop,nop,TS val 2716813114 ecr 3531611806], length 1314
12:06:33.863348 IP 10.8.0.4.39552 > 99.181.68.50.1935: Flags [.], seq 98990:100304, ack 1, win 501, options [nop,nop,TS val 2716813150 ecr 3531611806], length 1314
12:06:33.863801 IP 99.181.68.50.1935 > 10.8.0.4.39552: Flags [.], ack 90309, win 126, options [nop,nop,TS val 3531611879 ecr 2716812786], length 0
12:06:33.913140 IP 10.8.0.4.39552 > 99.181.68.50.1935: Flags [.], seq 100304:101618, ack 1, win 501, options [nop,nop,TS val 2716813199 ecr 3531611879], length 1314
12:06:33.955479 IP 10.8.0.4.39552 > 99.181.68.50.1935: Flags [.], seq 101618:102932, ack 1, win 501, options [nop,nop,TS val 2716813242 ecr 3531611879], length 1314
12:06:33.966181 IP 99.181.68.50.1935 > 10.8.0.4.39552: Flags [.], ack 92937, win 126, options [nop,nop,TS val 3531611981 ecr 2716812858], length 0
12:06:33.998036 IP 10.8.0.4.39552 > 99.181.68.50.1935: Flags [.], seq 102932:104246, ack 1, win 501, options [nop,nop,TS val 2716813284 ecr 3531611981], length 1314
12:06:34.035171 IP 99.181.68.50.1935 > 10.8.0.4.39552: Flags [.], ack 95565, win 126, options [nop,nop,TS val 3531612050 ecr 2716812943], length 0
12:06:34.041059 IP 10.8.0.4.39552 > 99.181.68.50.1935: Flags [.], seq 104246:105560, ack 1, win 501, options [nop,nop,TS val 2716813327 ecr 3531612050], length 1314
12:06:34.095719 IP 10.8.0.4.39552 > 99.181.68.50.1935: Flags [.], seq 105560:106874, ack 1, win 501, options [nop,nop,TS val 2716813382 ecr 3531612050], length 1314
12:06:34.126217 IP 10.8.0.4.39552 > 99.181.68.50.1935: Flags [.], seq 106874:108188, ack 1, win 501, options [nop,nop,TS val 2716813413 ecr 3531612050], length 1314
12:06:34.126895 IP 99.181.68.50.1935 > 10.8.0.4.39552: Flags [.], ack 97676, win 126, options [nop,nop,TS val 3531612142 ecr 2716813050], length 0
12:06:34.126930 IP 10.8.0.4.39552 > 99.181.68.50.1935: Flags [P.], seq 108188:108414, ack 1, win 501, options [nop,nop,TS val 2716813413 ecr 3531612142], length 226
12:06:34.190602 IP 10.8.0.4.39552 > 99.181.68.50.1935: Flags [.], seq 108414:109728, ack 1, win 501, options [nop,nop,TS val 2716813477 ecr 3531612142], length 1314
12:06:34.198861 IP 99.181.68.50.1935 > 10.8.0.4.39552: Flags [.], ack 100304, win 126, options [nop,nop,TS val 3531612214 ecr 2716813114], length 0
12:06:34.229705 IP 10.8.0.4.39552 > 99.181.68.50.1935: Flags [.], seq 109728:111042, ack 1, win 501, options [nop,nop,TS val 2716813516 ecr 3531612214], length 1314
12:06:34.254530 IP 10.8.0.4.39552 > 99.181.68.50.1935: Flags [.], seq 111042:112356, ack 1, win 501, options [nop,nop,TS val 2716813541 ecr 3531612214], length 1314
12:06:34.290990 IP 99.181.68.50.1935 > 10.8.0.4.39552: Flags [.], ack 102932, win 126, options [nop,nop,TS val 3531612306 ecr 2716813199], length 0
12:06:34.332114 IP 10.8.0.4.39552 > 99.181.68.50.1935: Flags [.], seq 112356:113670, ack 1, win 501, options [nop,nop,TS val 2716813618 ecr 3531612306], length 1314
12:06:34.361211 IP 10.8.0.4.39552 > 99.181.68.50.1935: Flags [.], seq 113670:114984, ack 1, win 501, options [nop,nop,TS val 2716813648 ecr 3531612306], length 1314
12:06:34.376579 IP 99.181.68.50.1935 > 10.8.0.4.39552: Flags [.], ack 105560, win 126, options [nop,nop,TS val 3531612392 ecr 2716813284], length 0
12:06:34.395835 IP 10.8.0.4.39552 > 99.181.68.50.1935: Flags [.], seq 114984:116298, ack 1, win 501, options [nop,nop,TS val 2716813682 ecr 3531612392], length 1314
12:06:34.461532 IP 10.8.0.4.39552 > 99.181.68.50.1935: Flags [.], seq 116298:117612, ack 1, win 501, options [nop,nop,TS val 2716813748 ecr 3531612392], length 1314
12:06:34.461701 IP 99.181.68.50.1935 > 10.8.0.4.39552: Flags [.], ack 108188, win 126, options [nop,nop,TS val 3531612477 ecr 2716813382], length 0
12:06:34.462313 IP 99.181.68.50.1935 > 10.8.0.4.39552: Flags [.], ack 108414, win 126, options [nop,nop,TS val 3531612477 ecr 2716813413], length 0
12:06:34.462322 IP 10.8.0.4.39552 > 99.181.68.50.1935: Flags [P.], seq 117612:118415, ack 1, win 501, options [nop,nop,TS val 2716813749 ecr 3531612477], length 803
12:06:34.531463 IP 10.8.0.4.39552 > 99.181.68.50.1935: Flags [.], seq 118415:119729, ack 1, win 501, options [nop,nop,TS val 2716813818 ecr 3531612477], length 1314
12:06:34.565256 IP 99.181.68.50.1935 > 10.8.0.4.39552: Flags [.], ack 111042, win 126, options [nop,nop,TS val 3531612580 ecr 2716813477], length 0
12:06:34.565830 IP 10.8.0.4.39552 > 99.181.68.50.1935: Flags [.], seq 119729:121043, ack 1, win 501, options [nop,nop,TS val 2716813852 ecr 3531612580], length 1314
12:06:34.596038 IP 10.8.0.4.39552 > 99.181.68.50.1935: Flags [.], seq 121043:122357, ack 1, win 501, options [nop,nop,TS val 2716813882 ecr 3531612580], length 1314
12:06:34.648455 IP 99.181.68.50.1935 > 10.8.0.4.39552: Flags [.], ack 112356, win 126, options [nop,nop,TS val 3531612663 ecr 2716813541], length 0
12:06:34.660381 IP 10.8.0.4.39552 > 99.181.68.50.1935: Flags [.], seq 122357:123671, ack 1, win 501, options [nop,nop,TS val 2716813947 ecr 3531612663], length 1314
12:06:34.696366 IP 10.8.0.4.39552 > 99.181.68.50.1935: Flags [.], seq 123671:124985, ack 1, win 501, options [nop,nop,TS val 2716813983 ecr 3531612663], length 1314
12:06:34.699861 IP 99.181.68.50.1935 > 10.8.0.4.39552: Flags [.], ack 114984, win 126, options [nop,nop,TS val 3531612712 ecr 2716813618], length 0
12:06:34.724182 IP 10.8.0.4.39552 > 99.181.68.50.1935: Flags [.], seq 124985:126299, ack 1, win 501, options [nop,nop,TS val 2716814010 ecr 3531612712], length 1314
12:06:34.788028 IP 10.8.0.4.39552 > 99.181.68.50.1935: Flags [.], seq 126299:127613, ack 1, win 501, options [nop,nop,TS val 2716814074 ecr 3531612712], length 1314
12:06:34.797211 IP 99.181.68.50.1935 > 10.8.0.4.39552: Flags [.], ack 117612, win 126, options [nop,nop,TS val 3531612812 ecr 2716813682], length 0
12:06:34.797688 IP 99.181.68.50.1935 > 10.8.0.4.39552: Flags [.], ack 118415, win 126, options [nop,nop,TS val 3531612813 ecr 2716813749], length 0
12:06:34.797720 IP 10.8.0.4.39552 > 99.181.68.50.1935: Flags [P.], seq 127613:128302, ack 1, win 501, options [nop,nop,TS val 2716814084 ecr 3531612813], length 689
12:06:34.865709 IP 10.8.0.4.39552 > 99.181.68.50.1935: Flags [.], seq 128302:129616, ack 1, win 501, options [nop,nop,TS val 2716814152 ecr 3531612813], length 1314
12:06:34.895432 IP 10.8.0.4.39552 > 99.181.68.50.1935: Flags [.], seq 129616:130930, ack 1, win 501, options [nop,nop,TS val 2716814182 ecr 3531612813], length 1314
12:06:34.901453 IP 99.181.68.50.1935 > 10.8.0.4.39552: Flags [.], ack 121043, win 126, options [nop,nop,TS val 3531612916 ecr 2716813818], length 0
12:06:34.928793 IP 10.8.0.4.39552 > 99.181.68.50.1935: Flags [.], seq 130930:132244, ack 1, win 501, options [nop,nop,TS val 2716814215 ecr 3531612916], length 1314
12:06:34.996168 IP 99.181.68.50.1935 > 10.8.0.4.39552: Flags [.], ack 123671, win 126, options [nop,nop,TS val 3531613011 ecr 2716813882], length 0
12:06:34.998974 IP 10.8.0.4.39552 > 99.181.68.50.1935: Flags [.], seq 132244:133558, ack 1, win 501, options [nop,nop,TS val 2716814285 ecr 3531613011], length 1314
12:06:35.023427 IP 10.8.0.4.39552 > 99.181.68.50.1935: Flags [.], seq 133558:134872, ack 1, win 501, options [nop,nop,TS val 2716814310 ecr 3531613011], length 1314
12:06:35.061279 IP 99.181.68.50.1935 > 10.8.0.4.39552: Flags [.], ack 126299, win 126, options [nop,nop,TS val 3531613075 ecr 2716813983], length 0
12:06:35.062739 IP 10.8.0.4.39552 > 99.181.68.50.1935: Flags [.], seq 134872:136186, ack 1, win 501, options [nop,nop,TS val 2716814349 ecr 3531613075], length 1314
12:06:35.128165 IP 10.8.0.4.39552 > 99.181.68.50.1935: Flags [.], seq 136186:137500, ack 1, win 501, options [nop,nop,TS val 2716814414 ecr 3531613075], length 1314
12:06:35.133348 IP 99.181.68.50.1935 > 10.8.0.4.39552: Flags [.], ack 128302, win 126, options [nop,nop,TS val 3531613148 ecr 2716814074], length 0
12:06:35.133361 IP 10.8.0.4.39552 > 99.181.68.50.1935: Flags [P.], seq 137500:138391, ack 1, win 501, options [nop,nop,TS val 2716814420 ecr 3531613148], length 891
12:06:35.193486 IP 10.8.0.4.39552 > 99.181.68.50.1935: Flags [.], seq 138391:139705, ack 1, win 501, options [nop,nop,TS val 2716814480 ecr 3531613148], length 1314
12:06:35.230788 IP 99.181.68.50.1935 > 10.8.0.4.39552: Flags [.], ack 130930, win 126, options [nop,nop,TS val 3531613246 ecr 2716814152], length 0
12:06:35.232475 IP 10.8.0.4.39552 > 99.181.68.50.1935: Flags [.], seq 139705:141019, ack 1, win 501, options [nop,nop,TS val 2716814519 ecr 3531613246], length 1314
12:06:35.261413 IP 10.8.0.4.39552 > 99.181.68.50.1935: Flags [.], seq 141019:142333, ack 1, win 501, options [nop,nop,TS val 2716814548 ecr 3531613246], length 1314
12:06:35.321599 IP 10.8.0.4.39552 > 99.181.68.50.1935: Flags [.], seq 142333:143647, ack 1, win 501, options [nop,nop,TS val 2716814608 ecr 3531613246], length 1314
12:06:35.332122 IP 99.181.68.50.1935 > 10.8.0.4.39552: Flags [.], ack 132244, win 126, options [nop,nop,TS val 3531613347 ecr 2716814215], length 0
12:06:35.359044 IP 99.181.68.50.1935 > 10.8.0.4.39552: Flags [.], ack 134872, win 126, options [nop,nop,TS val 3531613374 ecr 2716814285], length 0
12:06:35.364531 IP 10.8.0.4.39552 > 99.181.68.50.1935: Flags [.], seq 143647:144961, ack 1, win 501, options [nop,nop,TS val 2716814651 ecr 3531613374], length 1314
12:06:35.399101 IP 10.8.0.4.39552 > 99.181.68.50.1935: Flags [.], seq 144961:146275, ack 1, win 501, options [nop,nop,TS val 2716814685 ecr 3531613374], length 1314
12:06:35.463875 IP 99.181.68.50.1935 > 10.8.0.4.39552: Flags [.], ack 137500, win 126, options [nop,nop,TS val 3531613479 ecr 2716814349], length 0
12:06:35.464978 IP 10.8.0.4.39552 > 99.181.68.50.1935: Flags [.], seq 146275:147589, ack 1, win 501, options [nop,nop,TS val 2716814751 ecr 3531613479], length 1314
12:06:35.468758 IP 99.181.68.50.1935 > 10.8.0.4.39552: Flags [.], ack 138391, win 126, options [nop,nop,TS val 3531613484 ecr 2716814420], length 0
12:06:35.468789 IP 10.8.0.4.39552 > 99.181.68.50.1935: Flags [P.], seq 147589:148287, ack 1, win 501, options [nop,nop,TS val 2716814755 ecr 3531613484], length 698
12:06:35.530760 IP 10.8.0.4.39552 > 99.181.68.50.1935: Flags [.], seq 148287:149601, ack 1, win 501, options [nop,nop,TS val 2716814817 ecr 3531613484], length 1314
12:06:35.557461 IP 10.8.0.4.39552 > 99.181.68.50.1935: Flags [.], seq 149601:150915, ack 1, win 501, options [nop,nop,TS val 2716814844 ecr 3531613484], length 1314
12:06:35.568670 IP 99.181.68.50.1935 > 10.8.0.4.39552: Flags [.], ack 141019, win 126, options [nop,nop,TS val 3531613583 ecr 2716814480], length 0
12:06:35.597284 IP 10.8.0.4.39552 > 99.181.68.50.1935: Flags [.], seq 150915:152229, ack 1, win 501, options [nop,nop,TS val 2716814884 ecr 3531613583], length 1314
12:06:35.657364 IP 99.181.68.50.1935 > 10.8.0.4.39552: Flags [.], ack 143647, win 126, options [nop,nop,TS val 3531613672 ecr 2716814548], length 0
12:06:35.664355 IP 10.8.0.4.39552 > 99.181.68.50.1935: Flags [.], seq 152229:153543, ack 1, win 501, options [nop,nop,TS val 2716814951 ecr 3531613672], length 1314
12:06:35.698406 IP 10.8.0.4.39552 > 99.181.68.50.1935: Flags [.], seq 153543:154857, ack 1, win 501, options [nop,nop,TS val 2716814985 ecr 3531613672], length 1314
12:06:35.728699 IP 10.8.0.4.39552 > 99.181.68.50.1935: Flags [.], seq 154857:156171, ack 1, win 501, options [nop,nop,TS val 2716815015 ecr 3531613672], length 1314
12:06:35.734621 IP 99.181.68.50.1935 > 10.8.0.4.39552: Flags [.], ack 146275, win 126, options [nop,nop,TS val 3531613750 ecr 2716814651], length 0
12:06:35.792637 IP 10.8.0.4.39552 > 99.181.68.50.1935: Flags [.], seq 156171:157485, ack 1, win 501, options [nop,nop,TS val 2716815079 ecr 3531613750], length 1314
12:06:35.804204 IP 99.181.68.50.1935 > 10.8.0.4.39552: Flags [.], ack 148287, win 126, options [nop,nop,TS val 3531613819 ecr 2716814751], length 0
12:06:35.804243 IP 10.8.0.4.39552 > 99.181.68.50.1935: Flags [P.], seq 157485:158278, ack 1, win 501, options [nop,nop,TS val 2716815091 ecr 3531613819], length 793
12:06:35.856698 IP 10.8.0.4.39552 > 99.181.68.50.1935: Flags [.], seq 158278:159592, ack 1, win 501, options [nop,nop,TS val 2716815143 ecr 3531613819], length 1314
12:06:35.893028 IP 99.181.68.50.1935 > 10.8.0.4.39552: Flags [.], ack 150915, win 126, options [nop,nop,TS val 3531613908 ecr 2716814817], length 0
12:06:35.896735 IP 10.8.0.4.39552 > 99.181.68.50.1935: Flags [.], seq 159592:160906, ack 1, win 501, options [nop,nop,TS val 2716815183 ecr 3531613908], length 1314
12:06:35.928114 IP 10.8.0.4.39552 > 99.181.68.50.1935: Flags [.], seq 160906:162220, ack 1, win 501, options [nop,nop,TS val 2716815214 ecr 3531613908], length 1314
12:06:35.999176 IP 10.8.0.4.39552 > 99.181.68.50.1935: Flags [.], seq 162220:163534, ack 1, win 501, options [nop,nop,TS val 2716815285 ecr 3531613908], length 1314
12:06:35.999880 IP 99.181.68.50.1935 > 10.8.0.4.39552: Flags [.], ack 153543, win 126, options [nop,nop,TS val 3531614015 ecr 2716814884], length 0
12:06:36.027507 IP 10.8.0.4.39552 > 99.181.68.50.1935: Flags [.], seq 163534:164848, ack 1, win 501, options [nop,nop,TS val 2716815314 ecr 3531614015], length 1314
12:06:36.064264 IP 99.181.68.50.1935 > 10.8.0.4.39552: Flags [.], ack 156171, win 126, options [nop,nop,TS val 3531614079 ecr 2716814985], length 0
12:06:36.065384 IP 10.8.0.4.39552 > 99.181.68.50.1935: Flags [.], seq 164848:166162, ack 1, win 501, options [nop,nop,TS val 2716815352 ecr 3531614079], length 1314
12:06:36.130598 IP 10.8.0.4.39552 > 99.181.68.50.1935: Flags [.], seq 166162:167476, ack 1, win 501, options [nop,nop,TS val 2716815417 ecr 3531614079], length 1314
12:06:36.139648 IP 99.181.68.50.1935 > 10.8.0.4.39552: Flags [.], ack 158278, win 126, options [nop,nop,TS val 3531614155 ecr 2716815079], length 0
12:06:36.139677 IP 10.8.0.4.39552 > 99.181.68.50.1935: Flags [P.], seq 167476:168276, ack 1, win 501, options [nop,nop,TS val 2716815426 ecr 3531614155], length 800
12:06:36.198363 IP 10.8.0.4.39552 > 99.181.68.50.1935: Flags [.], seq 168276:169590, ack 1, win 501, options [nop,nop,TS val 2716815485 ecr 3531614155], length 1314
12:06:36.230352 IP 10.8.0.4.39552 > 99.181.68.50.1935: Flags [.], seq 169590:170904, ack 1, win 501, options [nop,nop,TS val 2716815517 ecr 3531614155], length 1314
12:06:36.232479 IP 99.181.68.50.1935 > 10.8.0.4.39552: Flags [.], ack 160906, win 126, options [nop,nop,TS val 3531614247 ecr 2716815143], length 0
12:06:36.265261 IP 10.8.0.4.39552 > 99.181.68.50.1935: Flags [.], seq 170904:172218, ack 1, win 501, options [nop,nop,TS val 2716815552 ecr 3531614247], length 1314
12:06:36.327676 IP 10.8.0.4.39552 > 99.181.68.50.1935: Flags [.], seq 172218:173532, ack 1, win 501, options [nop,nop,TS val 2716815614 ecr 3531614247], length 1314
12:06:36.334852 IP 99.181.68.50.1935 > 10.8.0.4.39552: Flags [.], ack 163534, win 126, options [nop,nop,TS val 3531614350 ecr 2716815214], length 0
12:06:36.361851 IP 10.8.0.4.39552 > 99.181.68.50.1935: Flags [.], seq 173532:174846, ack 1, win 501, options [nop,nop,TS val 2716815648 ecr 3531614350], length 1314
12:06:36.396722 IP 10.8.0.4.39552 > 99.181.68.50.1935: Flags [.], seq 174846:176160, ack 1, win 501, options [nop,nop,TS val 2716815683 ecr 3531614350], length 1314
12:06:36.401273 IP 99.181.68.50.1935 > 10.8.0.4.39552: Flags [.], ack 166162, win 126, options [nop,nop,TS val 3531614416 ecr 2716815314], length 0
12:06:36.465556 IP 10.8.0.4.39552 > 99.181.68.50.1935: Flags [.], seq 176160:177474, ack 1, win 501, options [nop,nop,TS val 2716815752 ecr 3531614416], length 1314
12:06:36.475232 IP 99.181.68.50.1935 > 10.8.0.4.39552: Flags [.], ack 168276, win 126, options [nop,nop,TS val 3531614490 ecr 2716815417], length 0
12:06:36.475264 IP 10.8.0.4.39552 > 99.181.68.50.1935: Flags [P.], seq 177474:178161, ack 1, win 501, options [nop,nop,TS val 2716815762 ecr 3531614490], length 687
12:06:36.528585 IP 10.8.0.4.39552 > 99.181.68.50.1935: Flags [.], seq 178161:179475, ack 1, win 501, options [nop,nop,TS val 2716815815 ecr 3531614490], length 1314
12:06:36.562758 IP 10.8.0.4.39552 > 99.181.68.50.1935: Flags [.], seq 179475:180789, ack 1, win 501, options [nop,nop,TS val 2716815849 ecr 3531614490], length 1314
12:06:36.565614 IP 99.181.68.50.1935 > 10.8.0.4.39552: Flags [.], ack 170904, win 126, options [nop,nop,TS val 3531614581 ecr 2716815485], length 0
12:06:36.598975 IP 10.8.0.4.39552 > 99.181.68.50.1935: Flags [.], seq 180789:182103, ack 1, win 501, options [nop,nop,TS val 2716815885 ecr 3531614581], length 1314
12:06:36.662526 IP 10.8.0.4.39552 > 99.181.68.50.1935: Flags [.], seq 182103:183417, ack 1, win 501, options [nop,nop,TS val 2716815949 ecr 3531614581], length 1314
12:06:36.663014 IP 99.181.68.50.1935 > 10.8.0.4.39552: Flags [.], ack 173532, win 126, options [nop,nop,TS val 3531614678 ecr 2716815552], length 0
12:06:36.696244 IP 10.8.0.4.39552 > 99.181.68.50.1935: Flags [.], seq 183417:184731, ack 1, win 501, options [nop,nop,TS val 2716815983 ecr 3531614678], length 1314
12:06:36.728294 IP 10.8.0.4.39552 > 99.181.68.50.1935: Flags [.], seq 184731:186045, ack 1, win 501, options [nop,nop,TS val 2716816015 ecr 3531614678], length 1314
12:06:36.732380 IP 99.181.68.50.1935 > 10.8.0.4.39552: Flags [.], ack 176160, win 126, options [nop,nop,TS val 3531614747 ecr 2716815648], length 0
12:06:36.795144 IP 10.8.0.4.39552 > 99.181.68.50.1935: Flags [.], seq 186045:187359, ack 1, win 501, options [nop,nop,TS val 2716816081 ecr 3531614747], length 1314
12:06:36.810652 IP 99.181.68.50.1935 > 10.8.0.4.39552: Flags [.], ack 178161, win 126, options [nop,nop,TS val 3531614826 ecr 2716815752], length 0
12:06:36.810671 IP 10.8.0.4.39552 > 99.181.68.50.1935: Flags [P.], seq 187359:188159, ack 1, win 501, options [nop,nop,TS val 2716816097 ecr 3531614826], length 800
12:06:36.861245 IP 10.8.0.4.39552 > 99.181.68.50.1935: Flags [.], seq 188159:189473, ack 1, win 501, options [nop,nop,TS val 2716816148 ecr 3531614826], length 1314
12:06:36.898362 IP 99.181.68.50.1935 > 10.8.0.4.39552: Flags [.], ack 180789, win 126, options [nop,nop,TS val 3531614913 ecr 2716815815], length 0
12:06:36.898903 IP 10.8.0.4.39552 > 99.181.68.50.1935: Flags [.], seq 189473:190787, ack 1, win 501, options [nop,nop,TS val 2716816185 ecr 3531614913], length 1314
12:06:36.929343 IP 10.8.0.4.39552 > 99.181.68.50.1935: Flags [.], seq 190787:192101, ack 1, win 501, options [nop,nop,TS val 2716816216 ecr 3531614913], length 1314
12:06:36.997921 IP 99.181.68.50.1935 > 10.8.0.4.39552: Flags [.], ack 183417, win 126, options [nop,nop,TS val 3531615013 ecr 2716815885], length 0
12:06:36.998756 IP 10.8.0.4.39552 > 99.181.68.50.1935: Flags [.], seq 192101:193415, ack 1, win 501, options [nop,nop,TS val 2716816285 ecr 3531615013], length 1314
12:06:37.030638 IP 10.8.0.4.39552 > 99.181.68.50.1935: Flags [.], seq 193415:194729, ack 1, win 501, options [nop,nop,TS val 2716816317 ecr 3531615013], length 1314
12:06:37.062557 IP 10.8.0.4.39552 > 99.181.68.50.1935: Flags [.], seq 194729:196043, ack 1, win 501, options [nop,nop,TS val 2716816349 ecr 3531615013], length 1314
12:06:37.063808 IP 99.181.68.50.1935 > 10.8.0.4.39552: Flags [.], ack 186045, win 126, options [nop,nop,TS val 3531615079 ecr 2716815983], length 0
12:06:37.132192 IP 10.8.0.4.39552 > 99.181.68.50.1935: Flags [.], seq 196043:197357, ack 1, win 501, options [nop,nop,TS val 2716816418 ecr 3531615079], length 1314
12:06:37.139838 IP 10.8.0.4.39552 > 99.181.68.50.1935: Flags [.], seq 197357:198671, ack 1, win 501, options [nop,nop,TS val 2716816426 ecr 3531615079], length 1314
12:06:37.145867 IP 99.181.68.50.1935 > 10.8.0.4.39552: Flags [.], ack 188159, win 126, options [nop,nop,TS val 3531615161 ecr 2716816081], length 0
12:06:37.145900 IP 10.8.0.4.39552 > 99.181.68.50.1935: Flags [P.], seq 198671:198994, ack 1, win 501, options [nop,nop,TS val 2716816432 ecr 3531615161], length 323
12:06:37.230009 IP 10.8.0.4.39552 > 99.181.68.50.1935: Flags [.], seq 198994:200308, ack 1, win 501, options [nop,nop,TS val 2716816516 ecr 3531615161], length 1314
12:06:37.240865 IP 99.181.68.50.1935 > 10.8.0.4.39552: Flags [.], ack 190787, win 126, options [nop,nop,TS val 3531615249 ecr 2716816148], length 0
