15:30:43.982245 IP 10.8.3.2.57718 > 52.223.243.160.1935: Flags [.], seq 2278933763:2278935077, ack 3739032612, win 501, options [nop,nop,TS val 2981465296 ecr 3174357066], length 1314
15:30:44.034684 IP 52.223.243.160.1935 > 10.8.3.2.57718: Flags [.], ack 4294964077, win 126, options [nop,nop,TS val 3174357162 ecr 2981465098], length 0
15:30:44.038940 IP 52.223.243.160.1935 > 10.8.3.2.57718: Flags [.], ack 4294964668, win 126, options [nop,nop,TS val 3174357166 ecr 2981465162], length 0
15:30:44.038973 IP 10.8.3.2.57718 > 52.223.243.160.1935: Flags [P.], seq 1314:2563, ack 1, win 501, options [nop,nop,TS val 2981465352 ecr 3174357166], length 1249
15:30:44.080829 IP 10.8.3.2.57718 > 52.223.243.160.1935: Flags [.], seq 2563:3877, ack 1, win 501, options [nop,nop,TS val 2981465394 ecr 3174357166], length 1314
15:30:44.115469 IP 10.8.3.2.57718 > 52.223.243.160.1935: Flags [.], seq 3877:5191, ack 1, win 501, options [nop,nop,TS val 2981465429 ecr 3174357166], length 1314
15:30:44.140067 IP 52.223.243.160.1935 > 10.8.3.2.57718: Flags [.], ack 0, win 126, options [nop,nop,TS val 3174357267 ecr 2981465231], length 0
15:30:44.166055 IP 10.8.3.2.57718 > 52.223.243.160.1935: Flags [.], seq 5191:6505, ack 1, win 501, options [nop,nop,TS val 2981465479 ecr 3174357267], length 1314
15:30:44.218926 IP 10.8.3.2.57718 > 52.223.243.160.1935: Flags [.], seq 6505:7819, ack 1, win 501, options [nop,nop,TS val 2981465532 ecr 3174357267], length 1314
15:30:44.227033 IP 52.223.243.160.1935 > 10.8.3.2.57718: Flags [.], ack 2563, win 126, options [nop,nop,TS val 3174357354 ecr 2981465296], length 0
15:30:44.227066 IP 10.8.3.2.57718 > 52.223.243.160.1935: Flags [P.], seq 7819:8405, ack 1, win 501, options [nop,nop,TS val 2981465540 ecr 3174357354], length 586
15:30:44.284608 IP 10.8.3.2.57718 > 52.223.243.160.1935: Flags [.], seq 8405:9719, ack 1, win 501, options [nop,nop,TS val 2981465598 ecr 3174357354], length 1314
15:30:44.307532 IP 52.223.243.160.1935 > 10.8.3.2.57718: Flags [.], ack 5191, win 126, options [nop,nop,TS val 3174357434 ecr 2981465394], length 0
15:30:44.316458 IP 10.8.3.2.57718 > 52.223.243.160.1935: Flags [.], seq 9719:11033, ack 1, win 501, options [nop,nop,TS val 2981465630 ecr 3174357434], length 1314
15:30:44.351940 IP 10.8.3.2.57718 > 52.223.243.160.1935: Flags [.], seq 11033:12347, ack 1, win 501, options [nop,nop,TS val 2981465665 ecr 3174357434], length 1314
15:30:44.406649 IP 52.223.243.160.1935 > 10.8.3.2.57718: Flags [.], ack 7819, win 126, options [nop,nop,TS val 3174357534 ecr 2981465479], length 0
15:30:44.414816 IP 52.223.243.160.1935 > 10.8.3.2.57718: Flags [.], ack 8405, win 126, options [nop,nop,TS val 3174357542 ecr 2981465540], length 0
15:30:44.414881 IP 10.8.3.2.57718 > 52.223.243.160.1935: Flags [P.], seq 12347:13488, ack 1, win 501, options [nop,nop,TS val 2981465728 ecr 3174357542], length 1141
15:30:44.452425 IP 10.8.3.2.57718 > 52.223.243.160.1935: Flags [.], seq 13488:14802, ack 1, win 501, options [nop,nop,TS val 2981465766 ecr 3174357542], length 1314
15:30:44.485756 IP 10.8.3.2.57718 > 52.223.243.160.1935: Flags [.], seq 14802:16116, ack 1, win 501, options [nop,nop,TS val 2981465799 ecr 3174357542], length 1314
15:30:44.504430 IP 52.223.243.160.1935 > 10.8.3.2.57718: Flags [.], ack 11033, win 126, options [nop,nop,TS val 3174357631 ecr 2981465598], length 0
15:30:44.530073 IP 10.8.3.2.57718 > 52.223.243.160.1935: Flags [.], seq 16116:17430, ack 1, win 501, options [nop,nop,TS val 2981465843 ecr 3174357631], length 1314
15:30:44.581246 IP 10.8.3.2.57718 > 52.223.243.160.1935: Flags [.], seq 17430:18744, ack 1, win 501, options [nop,nop,TS val 2981465895 ecr 3174357631], length 1314
15:30:44.602585 IP 52.223.243.160.1935 > 10.8.3.2.57718: Flags [.], ack 13488, win 126, options [nop,nop,TS val 3174357730 ecr 2981465665], length 0
15:30:44.602597 IP 10.8.3.2.57718 > 52.223.243.160.1935: Flags [P.], seq 18744:19430, ack 1, win 501, options [nop,nop,TS val 2981465916 ecr 3174357730], length 686
15:30:44.649864 IP 10.8.3.2.57718 > 52.223.243.160.1935: Flags [.], seq 19430:20744, ack 1, win 501, options [nop,nop,TS val 2981465963 ecr 3174357730], length 1314
15:30:44.673944 IP 52.223.243.160.1935 > 10.8.3.2.57718: Flags [.], ack 16116, win 126, options [nop,nop,TS val 3174357801 ecr 2981465766], length 0
15:30:44.679051 IP 10.8.3.2.57718 > 52.223.243.160.1935: Flags [.], seq 20744:22058, ack 1, win 501, options [nop,nop,TS val 2981465992 ecr 3174357801], length 1314
15:30:44.722135 IP 10.8.3.2.57718 > 52.223.243.160.1935: Flags [.], seq 22058:23372, ack 1, win 501, options [nop,nop,TS val 2981466035 ecr 3174357801], length 1314
15:30:44.768993 IP 52.223.243.160.1935 > 10.8.3.2.57718: Flags [.], ack 18744, win 126, options [nop,nop,TS val 3174357896 ecr 2981465843], length 0
15:30:44.784127 IP 10.8.3.2.57718 > 52.223.243.160.1935: Flags [.], seq 23372:24686, ack 1, win 501, options [nop,nop,TS val 2981466097 ecr 3174357896], length 1314
15:30:44.790063 IP 52.223.243.160.1935 > 10.8.3.2.57718: Flags [.], ack 19430, win 126, options [nop,nop,TS val 3174357917 ecr 2981465916], length 0
15:30:44.790088 IP 10.8.3.2.57718 > 52.223.243.160.1935: Flags [P.], seq 24686:25372, ack 1, win 501, options [nop,nop,TS val 2981466103 ecr 3174357917], length 686
15:30:44.850407 IP 10.8.3.2.57718 > 52.223.243.160.1935: Flags [.], seq 25372:26686, ack 1, win 501, options [nop,nop,TS val 2981466164 ecr 3174357917], length 1314
15:30:44.867094 IP 52.223.243.160.1935 > 10.8.3.2.57718: Flags [.], ack 22058, win 126, options [nop,nop,TS val 3174357994 ecr 2981465963], length 0
15:30:44.883861 IP 10.8.3.2.57718 > 52.223.243.160.1935: Flags [.], seq 26686:28000, ack 1, win 501, options [nop,nop,TS val 2981466197 ecr 3174357994], length 1314
15:30:44.917166 IP 10.8.3.2.57718 > 52.223.243.160.1935: Flags [.], seq 28000:29314, ack 1, win 501, options [nop,nop,TS val 2981466231 ecr 3174357994], length 1314
15:30:44.971713 IP 52.223.243.160.1935 > 10.8.3.2.57718: Flags [.], ack 24686, win 126, options [nop,nop,TS val 3174358099 ecr 2981466035], length 0
15:30:44.977886 IP 52.223.243.160.1935 > 10.8.3.2.57718: Flags [.], ack 25372, win 126, options [nop,nop,TS val 3174358105 ecr 2981466103], length 0
15:30:44.977911 IP 10.8.3.2.57718 > 52.223.243.160.1935: Flags [P.], seq 29314:30371, ack 1, win 501, options [nop,nop,TS val 2981466291 ecr 3174358105], length 1057
15:30:45.017724 IP 10.8.3.2.57718 > 52.223.243.160.1935: Flags [.], seq 30371:31685, ack 1, win 501, options [nop,nop,TS val 2981466331 ecr 3174358105], length 1314
15:30:45.051952 IP 10.8.3.2.57718 > 52.223.243.160.1935: Flags [.], seq 31685:32999, ack 1, win 501, options [nop,nop,TS val 2981466365 ecr 3174358105], length 1314
15:30:45.071702 IP 52.223.243.160.1935 > 10.8.3.2.57718: Flags [.], ack 28000, win 126, options [nop,nop,TS val 3174358199 ecr 2981466164], length 0
15:30:45.085316 IP 10.8.3.2.57718 > 52.223.243.160.1935: Flags [.], seq 32999:34313, ack 1, win 501, options [nop,nop,TS val 2981466399 ecr 3174358199], length 1314
15:30:45.149428 IP 10.8.3.2.57718 > 52.223.243.160.1935: Flags [.], seq 34313:35627, ack 1, win 501, options [nop,nop,TS val 2981466463 ecr 3174358199], length 1314
15:30:45.165722 IP 52.223.243.160.1935 > 10.8.3.2.57718: Flags [.], ack 30371, win 126, options [nop,nop,TS val 3174358293 ecr 2981466231], length 0
15:30:45.165759 IP 10.8.3.2.57718 > 52.223.243.160.1935: Flags [P.], seq 35627:36301, ack 1, win 501, options [nop,nop,TS val 2981466479 ecr 3174358293], length 674
15:30:45.213573 IP 10.8.3.2.57718 > 52.223.243.160.1935: Flags [.], seq 36301:37615, ack 1, win 501, options [nop,nop,TS val 2981466527 ecr 3174358293], length 1314
15:30:45.239846 IP 52.223.243.160.1935 > 10.8.3.2.57718: Flags [.], ack 32999, win 126, options [nop,nop,TS val 3174358367 ecr 2981466331], length 0
15:30:45.250836 IP 10.8.3.2.57718 > 52.223.243.160.1935: Flags [.], seq 37615:38929, ack 1, win 501, options [nop,nop,TS val 2981466564 ecr 3174358367], length 1314
15:30:45.284256 IP 10.8.3.2.57718 > 52.223.243.160.1935: Flags [.], seq 38929:40243, ack 1, win 501, options [nop,nop,TS val 2981466598 ecr 3174358367], length 1314
15:30:45.337472 IP 52.223.243.160.1935 > 10.8.3.2.57718: Flags [.], ack 35627, win 126, options [nop,nop,TS val 3174358464 ecr 2981466399], length 0
15:30:45.351903 IP 10.8.3.2.57718 > 52.223.243.160.1935: Flags [.], seq 40243:41557, ack 1, win 501, options [nop,nop,TS val 2981466665 ecr 3174358464], length 1314
15:30:45.353349 IP 52.223.243.160.1935 > 10.8.3.2.57718: Flags [.], ack 36301, win 126, options [nop,nop,TS val 3174358480 ecr 2981466479], length 0
15:30:45.353382 IP 10.8.3.2.57718 > 52.223.243.160.1935: Flags [P.], seq 41557:42235, ack 1, win 501, options [nop,nop,TS val 2981466667 ecr 3174358480], length 678
15:30:45.419066 IP 10.8.3.2.57718 > 52.223.243.160.1935: Flags [.], seq 42235:43549, ack 1, win 501, options [nop,nop,TS val 2981466732 ecr 3174358480], length 1314
15:30:45.438777 IP 52.223.243.160.1935 > 10.8.3.2.57718: Flags [.], ack 38929, win 126, options [nop,nop,TS val 3174358566 ecr 2981466527], length 0
15:30:45.449388 IP 10.8.3.2.57718 > 52.223.243.160.1935: Flags [.], seq 43549:44863, ack 1, win 501, options [nop,nop,TS val 2981466763 ecr 3174358566], length 1314
15:30:45.483743 IP 10.8.3.2.57718 > 52.223.243.160.1935: Flags [.], seq 44863:46177, ack 1, win 501, options [nop,nop,TS val 2981466797 ecr 3174358566], length 1314
15:30:45.540062 IP 52.223.243.160.1935 > 10.8.3.2.57718: Flags [.], ack 41557, win 126, options [nop,nop,TS val 3174358667 ecr 2981466598], length 0
15:30:45.541325 IP 52.223.243.160.1935 > 10.8.3.2.57718: Flags [.], ack 42235, win 126, options [nop,nop,TS val 3174358668 ecr 2981466667], length 0
15:30:45.541334 IP 10.8.3.2.57718 > 52.223.243.160.1935: Flags [P.], seq 46177:47330, ack 1, win 501, options [nop,nop,TS val 2981466855 ecr 3174358668], length 1153
15:30:45.581526 IP 10.8.3.2.57718 > 52.223.243.160.1935: Flags [.], seq 47330:48644, ack 1, win 501, options [nop,nop,TS val 2981466895 ecr 3174358668], length 1314
15:30:45.618803 IP 10.8.3.2.57718 > 52.223.243.160.1935: Flags [.], seq 48644:49958, ack 1, win 501, options [nop,nop,TS val 2981466932 ecr 3174358668], length 1314
15:30:45.637238 IP 52.223.243.160.1935 > 10.8.3.2.57718: Flags [.], ack 44863, win 126, options [nop,nop,TS val 3174358764 ecr 2981466732], length 0
15:30:45.662668 IP 10.8.3.2.57718 > 52.223.243.160.1935: Flags [.], seq 49958:51272, ack 1, win 501, options [nop,nop,TS val 2981466976 ecr 3174358764], length 1314
15:30:45.717142 IP 10.8.3.2.57718 > 52.223.243.160.1935: Flags [.], seq 51272:52586, ack 1, win 501, options [nop,nop,TS val 2981467030 ecr 3174358764], length 1314
15:30:45.728944 IP 52.223.243.160.1935 > 10.8.3.2.57718: Flags [.], ack 47330, win 126, options [nop,nop,TS val 3174358856 ecr 2981466797], length 0
15:30:45.728975 IP 10.8.3.2.57718 > 52.223.243.160.1935: Flags [P.], seq 52586:53273, ack 1, win 501, options [nop,nop,TS val 2981467042 ecr 3174358856], length 687
15:30:45.784559 IP 10.8.3.2.57718 > 52.223.243.160.1935: Flags [.], seq 53273:54587, ack 1, win 501, options [nop,nop,TS val 2981467098 ecr 3174358856], length 1314
15:30:45.806762 IP 52.223.243.160.1935 > 10.8.3.2.57718: Flags [.], ack 49958, win 126, options [nop,nop,TS val 3174358934 ecr 2981466895], length 0
15:30:45.817745 IP 10.8.3.2.57718 > 52.223.243.160.1935: Flags [.], seq 54587:55901, ack 1, win 501, options [nop,nop,TS val 2981467131 ecr 3174358934], length 1314
15:30:45.855069 IP 10.8.3.2.57718 > 52.223.243.160.1935: Flags [.], seq 55901:57215, ack 1, win 501, options [nop,nop,TS val 2981467168 ecr 3174358934], length 1314
15:30:45.905491 IP 52.223.243.160.1935 > 10.8.3.2.57718: Flags [.], ack 52586, win 126, options [nop,nop,TS val 3174359032 ecr 2981466976], length 0
15:30:45.916724 IP 52.223.243.160.1935 > 10.8.3.2.57718: Flags [.], ack 53273, win 126, options [nop,nop,TS val 3174359044 ecr 2981467042], length 0
15:30:45.916758 IP 10.8.3.2.57718 > 52.223.243.160.1935: Flags [P.], seq 57215:58265, ack 1, win 501, options [nop,nop,TS val 2981467230 ecr 3174359044], length 1050
15:30:45.951990 IP 10.8.3.2.57718 > 52.223.243.160.1935: Flags [.], seq 58265:59579, ack 1, win 501, options [nop,nop,TS val 2981467265 ecr 3174359044], length 1314
15:30:45.982234 IP 10.8.3.2.57718 > 52.223.243.160.1935: Flags [.], seq 59579:60893, ack 1, win 501, options [nop,nop,TS val 2981467296 ecr 3174359044], length 1314
15:30:46.005588 IP 52.223.243.160.1935 > 10.8.3.2.57718: Flags [.], ack 55901, win 126, options [nop,nop,TS val 3174359133 ecr 2981467098], length 0
15:30:46.026083 IP 10.8.3.2.57718 > 52.223.243.160.1935: Flags [.], seq 60893:62207, ack 1, win 501, options [nop,nop,TS val 2981467339 ecr 3174359133], length 1314
15:30:46.081142 IP 10.8.3.2.57718 > 52.223.243.160.1935: Flags [.], seq 62207:63521, ack 1, win 501, options [nop,nop,TS val 2981467394 ecr 3174359133], length 1314
15:30:46.104533 IP 52.223.243.160.1935 > 10.8.3.2.57718: Flags [.], ack 58265, win 126, options [nop,nop,TS val 3174359232 ecr 2981467168], length 0
15:30:46.104546 IP 10.8.3.2.57718 > 52.223.243.160.1935: Flags [P.], seq 63521:64199, ack 1, win 501, options [nop,nop,TS val 2981467418 ecr 3174359232], length 678
15:30:46.149884 IP 10.8.3.2.57718 > 52.223.243.160.1935: Flags [.], seq 64199:65513, ack 1, win 501, options [nop,nop,TS val 2981467463 ecr 3174359232], length 1314
15:30:46.170162 IP 52.223.243.160.1935 > 10.8.3.2.57718: Flags [.], ack 60893, win 126, options [nop,nop,TS val 3174359297 ecr 2981467265], length 0
15:30:46.185574 IP 10.8.3.2.57718 > 52.223.243.160.1935: Flags [.], seq 65513:66827, ack 1, win 501, options [nop,nop,TS val 2981467499 ecr 3174359297], length 1314
15:30:46.217395 IP 10.8.3.2.57718 > 52.223.243.160.1935: Flags [.], seq 66827:68141, ack 1, win 501, options [nop,nop,TS val 2981467531 ecr 3174359297], length 1314
15:30:46.268862 IP 52.223.243.160.1935 > 10.8.3.2.57718: Flags [.], ack 63521, win 126, options [nop,nop,TS val 3174359396 ecr 2981467339], length 0
15:30:46.281268 IP 10.8.3.2.57718 > 52.223.243.160.1935: Flags [.], seq 68141:69455, ack 1, win 501, options [nop,nop,TS val 2981467595 ecr 3174359396], length 1314
15:30:46.292108 IP 52.223.243.160.1935 > 10.8.3.2.57718: Flags [.], ack 64199, win 126, options [nop,nop,TS val 3174359419 ecr 2981467418], length 0
15:30:46.292138 IP 10.8.3.2.57718 > 52.223.243.160.1935: Flags [P.], seq 69455:70141, ack 1, win 501, options [nop,nop,TS val 2981467606 ecr 3174359419], length 686
15:30:46.347970 IP 10.8.3.2.57718 > 52.223.243.160.1935: Flags [.], seq 70141:71455, ack 1, win 501, options [nop,nop,TS val 2981467661 ecr 3174359419], length 1314
15:30:46.373458 IP 52.223.243.160.1935 > 10.8.3.2.57718: Flags [.], ack 66827, win 126, options [nop,nop,TS val 3174359500 ecr 2981467463], length 0
15:30:46.383043 IP 10.8.3.2.57718 > 52.223.243.160.1935: Flags [.], seq 71455:72769, ack 1, win 501, options [nop,nop,TS val 2981467696 ecr 3174359500], length 1314
15:30:46.418089 IP 10.8.3.2.57718 > 52.223.243.160.1935: Flags [.], seq 72769:74083, ack 1, win 501, options [nop,nop,TS val 2981467731 ecr 3174359500], length 1314
15:30:46.468946 IP 52.223.243.160.1935 > 10.8.3.2.57718: Flags [.], ack 69455, win 126, options [nop,nop,TS val 3174359596 ecr 2981467531], length 0
15:30:46.479912 IP 52.223.243.160.1935 > 10.8.3.2.57718: Flags [.], ack 70141, win 126, options [nop,nop,TS val 3174359607 ecr 2981467606], length 0
15:30:46.479927 IP 10.8.3.2.57718 > 52.223.243.160.1935: Flags [P.], seq 74083:75235, ack 1, win 501, options [nop,nop,TS val 2981467793 ecr 3174359607], length 1152
15:30:46.514757 IP 10.8.3.2.57718 > 52.223.243.160.1935: Flags [.], seq 75235:76549, ack 1, win 501, options [nop,nop,TS val 2981467828 ecr 3174359607], length 1314
15:30:46.549900 IP 10.8.3.2.57718 > 52.223.243.160.1935: Flags [.], seq 76549:77863, ack 1, win 501, options [nop,nop,TS val 2981467863 ecr 3174359607], length 1314
15:30:46.571001 IP 52.223.243.160.1935 > 10.8.3.2.57718: Flags [.], ack 72769, win 126, options [nop,nop,TS val 3174359698 ecr 2981467661], length 0
15:30:46.601619 IP 10.8.3.2.57718 > 52.223.243.160.1935: Flags [.], seq 77863:79177, ack 1, win 501, options [nop,nop,TS val 2981467915 ecr 3174359698], length 1314
15:30:46.649037 IP 10.8.3.2.57718 > 52.223.243.160.1935: Flags [.], seq 79177:80491, ack 1, win 501, options [nop,nop,TS val 2981467962 ecr 3174359698], length 1314
15:30:46.667723 IP 52.223.243.160.1935 > 10.8.3.2.57718: Flags [.], ack 75235, win 126, options [nop,nop,TS val 3174359794 ecr 2981467731], length 0
15:30:46.667742 IP 10.8.3.2.57718 > 52.223.243.160.1935: Flags [P.], seq 80491:81169, ack 1, win 501, options [nop,nop,TS val 2981467981 ecr 3174359794], length 678
15:30:46.718888 IP 10.8.3.2.57718 > 52.223.243.160.1935: Flags [.], seq 81169:82483, ack 1, win 501, options [nop,nop,TS val 2981468032 ecr 3174359794], length 1314
15:30:46.737646 IP 52.223.243.160.1935 > 10.8.3.2.57718: Flags [.], ack 77863, win 126, options [nop,nop,TS val 3174359865 ecr 2981467828], length 0
15:30:46.749502 IP 10.8.3.2.57718 > 52.223.243.160.1935: Flags [.], seq 82483:83797, ack 1, win 501, options [nop,nop,TS val 2981468063 ecr 3174359865], length 1314
15:30:46.793837 IP 10.8.3.2.57718 > 52.223.243.160.1935: Flags [.], seq 83797:85111, ack 1, win 501, options [nop,nop,TS val 2981468107 ecr 3174359865], length 1314
15:30:46.836737 IP 52.223.243.160.1935 > 10.8.3.2.57718: Flags [.], ack 80491, win 126, options [nop,nop,TS val 3174359964 ecr 2981467915], length 0
15:30:46.851114 IP 10.8.3.2.57718 > 52.223.243.160.1935: Flags [.], seq 85111:86425, ack 1, win 501, options [nop,nop,TS val 2981468164 ecr 3174359964], length 1314
15:30:46.855600 IP 52.223.243.160.1935 > 10.8.3.2.57718: Flags [.], ack 81169, win 126, options [nop,nop,TS val 3174359982 ecr 2981467981], length 0
15:30:46.855636 IP 10.8.3.2.57718 > 52.223.243.160.1935: Flags [P.], seq 86425:87003, ack 1, win 501, options [nop,nop,TS val 2981468169 ecr 3174359982], length 578
15:30:46.917706 IP 10.8.3.2.57718 > 52.223.243.160.1935: Flags [.], seq 87003:88317, ack 1, win 501, options [nop,nop,TS val 2981468231 ecr 3174359982], length 1314
15:30:46.937350 IP 52.223.243.160.1935 > 10.8.3.2.57718: Flags [.], ack 83797, win 126, options [nop,nop,TS val 3174360064 ecr 2981468032], length 0
15:30:46.950909 IP 10.8.3.2.57718 > 52.223.243.160.1935: Flags [.], seq 88317:89631, ack 1, win 501, options [nop,nop,TS val 2981468264 ecr 3174360064], length 1314
15:30:46.984612 IP 10.8.3.2.57718 > 52.223.243.160.1935: Flags [.], seq 89631:90945, ack 1, win 501, options [nop,nop,TS val 2981468298 ecr 3174360064], length 1314
15:30:47.039069 IP 52.223.243.160.1935 > 10.8.3.2.57718: Flags [.], ack 86425, win 126, options [nop,nop,TS val 3174360166 ecr 2981468107], length 0
15:30:47.043330 IP 52.223.243.160.1935 > 10.8.3.2.57718: Flags [.], ack 87003, win 126, options [nop,nop,TS val 3174360170 ecr 2981468169], length 0
15:30:47.043358 IP 10.8.3.2.57718 > 52.223.243.160.1935: Flags [P.], seq 90945:92098, ack 1, win 501, options [nop,nop,TS val 2981468357 ecr 3174360170], length 1153
15:30:47.084424 IP 10.8.3.2.57718 > 52.223.243.160.1935: Flags [.], seq 92098:93412, ack 1, win 501, options [nop,nop,TS val 2981468398 ecr 3174360170], length 1314
15:30:47.115776 IP 10.8.3.2.57718 > 52.223.243.160.1935: Flags [.], seq 93412:94726, ack 1, win 501, options [nop,nop,TS val 2981468429 ecr 3174360170], length 1314
15:30:47.138726 IP 52.223.243.160.1935 > 10.8.3.2.57718: Flags [.], ack 89631, win 126, options [nop,nop,TS val 3174360266 ecr 2981468231], length 0
15:30:47.157268 IP 10.8.3.2.57718 > 52.223.243.160.1935: Flags [.], seq 94726:96040, ack 1, win 501, options [nop,nop,TS val 2981468471 ecr 3174360266], length 1314
15:30:47.218928 IP 10.8.3.2.57718 > 52.223.243.160.1935: Flags [.], seq 96040:97354, ack 1, win 501, options [nop,nop,TS val 2981468532 ecr 3174360266], length 1314
15:30:47.231179 IP 52.223.243.160.1935 > 10.8.3.2.57718: Flags [.], ack 92098, win 126, options [nop,nop,TS val 3174360358 ecr 2981468298], length 0
15:30:47.231221 IP 10.8.3.2.57718 > 52.223.243.160.1935: Flags [P.], seq 97354:98040, ack 1, win 501, options [nop,nop,TS val 2981468545 ecr 3174360358], length 686
15:30:47.281156 IP 10.8.3.2.57718 > 52.223.243.160.1935: Flags [.], seq 98040:99354, ack 1, win 501, options [nop,nop,TS val 2981468595 ecr 3174360358], length 1314
15:30:47.303495 IP 52.223.243.160.1935 > 10.8.3.2.57718: Flags [.], ack 94726, win 126, options [nop,nop,TS val 3174360430 ecr 2981468398], length 0
15:30:47.316176 IP 10.8.3.2.57718 > 52.223.243.160.1935: Flags [.], seq 99354:100668, ack 1, win 501, options [nop,nop,TS val 2981468630 ecr 3174360430], length 1314
15:30:47.352061 IP 10.8.3.2.57718 > 52.223.243.160.1935: Flags [.], seq 100668:101982, ack 1, win 501, options [nop,nop,TS val 2981468665 ecr 3174360430], length 1314
15:30:47.406827 IP 52.223.243.160.1935 > 10.8.3.2.57718: Flags [.], ack 97354, win 126, options [nop,nop,TS val 3174360534 ecr 2981468471], length 0
15:30:47.418953 IP 10.8.3.2.57718 > 52.223.243.160.1935: Flags [.], seq 101982:103296, ack 1, win 501, options [nop,nop,TS val 2981468732 ecr 3174360534], length 1314
15:30:47.418962 IP 52.223.243.160.1935 > 10.8.3.2.57718: Flags [.], ack 98040, win 126, options [nop,nop,TS val 3174360546 ecr 2981468545], length 0
15:30:47.419001 IP 10.8.3.2.57718 > 52.223.243.160.1935: Flags [P.], seq 103296:103978, ack 1, win 501, options [nop,nop,TS val 2981468732 ecr 3174360546], length 682
15:30:47.483510 IP 10.8.3.2.57718 > 52.223.243.160.1935: Flags [.], seq 103978:105292, ack 1, win 501, options [nop,nop,TS val 2981468797 ecr 3174360546], length 1314
15:30:47.504172 IP 52.223.243.160.1935 > 10.8.3.2.57718: Flags [.], ack 100668, win 126, options [nop,nop,TS val 3174360631 ecr 2981468595], length 0
15:30:47.517425 IP 10.8.3.2.57718 > 52.223.243.160.1935: Flags [.], seq 105292:106606, ack 1, win 501, options [nop,nop,TS val 2981468831 ecr 3174360631], length 1314
15:30:47.551983 IP 10.8.3.2.57718 > 52.223.243.160.1935: Flags [.], seq 106606:107920, ack 1, win 501, options [nop,nop,TS val 2981468865 ecr 3174360631], length 1314
15:30:47.606799 IP 52.223.243.160.1935 > 10.8.3.2.57718: Flags [.], ack 103296, win 126, options [nop,nop,TS val 3174360734 ecr 2981468665], length 0
15:30:47.606953 IP 52.223.243.160.1935 > 10.8.3.2.57718: Flags [.], ack 103978, win 126, options [nop,nop,TS val 3174360734 ecr 2981468732], length 0
15:30:47.606977 IP 10.8.3.2.57718 > 52.223.243.160.1935: Flags [P.], seq 107920:109061, ack 1, win 501, options [nop,nop,TS val 2981468920 ecr 3174360734], length 1141
15:30:47.652295 IP 10.8.3.2.57718 > 52.223.243.160.1935: Flags [.], seq 109061:110375, ack 1, win 501, options [nop,nop,TS val 2981468966 ecr 3174360734], length 1314
15:30:47.685818 IP 10.8.3.2.57718 > 52.223.243.160.1935: Flags [.], seq 110375:111689, ack 1, win 501, options [nop,nop,TS val 2981468999 ecr 3174360734], length 1314
15:30:47.705432 IP 52.223.243.160.1935 > 10.8.3.2.57718: Flags [.], ack 106606, win 126, options [nop,nop,TS val 3174360832 ecr 2981468797], length 0
15:30:47.734294 IP 10.8.3.2.57718 > 52.223.243.160.1935: Flags [.], seq 111689:113003, ack 1, win 501, options [nop,nop,TS val 2981469048 ecr 3174360832], length 1314
15:30:47.785760 IP 10.8.3.2.57718 > 52.223.243.160.1935: Flags [.], seq 113003:114317, ack 1, win 501, options [nop,nop,TS val 2981469099 ecr 3174360832], length 1314
15:30:47.794934 IP 52.223.243.160.1935 > 10.8.3.2.57718: Flags [.], ack 109061, win 126, options [nop,nop,TS val 3174360922 ecr 2981468865], length 0
15:30:47.794971 IP 10.8.3.2.57718 > 52.223.243.160.1935: Flags [P.], seq 114317:114909, ack 1, win 501, options [nop,nop,TS val 2981469108 ecr 3174360922], length 592
15:30:47.851998 IP 10.8.3.2.57718 > 52.223.243.160.1935: Flags [.], seq 114909:116223, ack 1, win 501, options [nop,nop,TS val 2981469165 ecr 3174360922], length 1314
15:30:47.873828 IP 52.223.243.160.1935 > 10.8.3.2.57718: Flags [.], ack 111689, win 126, options [nop,nop,TS val 3174361001 ecr 2981468966], length 0
15:30:47.884664 IP 10.8.3.2.57718 > 52.223.243.160.1935: Flags [.], seq 116223:117537, ack 1, win 501, options [nop,nop,TS val 2981469198 ecr 3174361001], length 1314
15:30:47.918935 IP 10.8.3.2.57718 > 52.223.243.160.1935: Flags [.], seq 117537:118851, ack 1, win 501, options [nop,nop,TS val 2981469232 ecr 3174361001], length 1314
15:30:47.973603 IP 52.223.243.160.1935 > 10.8.3.2.57718: Flags [.], ack 114317, win 126, options [nop,nop,TS val 3174361101 ecr 2981469048], length 0
15:30:47.982626 IP 52.223.243.160.1935 > 10.8.3.2.57718: Flags [.], ack 114909, win 126, options [nop,nop,TS val 3174361109 ecr 2981469108], length 0
15:30:47.982661 IP 10.8.3.2.57718 > 52.223.243.160.1935: Flags [P.], seq 118851:120003, ack 1, win 501, options [nop,nop,TS val 2981469296 ecr 3174361109], length 1152
15:30:48.018645 IP 10.8.3.2.57718 > 52.223.243.160.1935: Flags [.], seq 120003:121317, ack 1, win 501, options [nop,nop,TS val 2981469332 ecr 3174361109], length 1314
15:30:48.052032 IP 10.8.3.2.57718 > 52.223.243.160.1935: Flags [.], seq 121317:122631, ack 1, win 501, options [nop,nop,TS val 2981469365 ecr 3174361109], length 1314
15:30:48.072732 IP 52.223.243.160.1935 > 10.8.3.2.57718: Flags [.], ack 117537, win 126, options [nop,nop,TS val 3174361199 ecr 2981469165], length 0
15:30:48.098981 IP 10.8.3.2.57718 > 52.223.243.160.1935: Flags [.], seq 122631:123945, ack 1, win 501, options [nop,nop,TS val 2981469412 ecr 3174361199], length 1314
15:30:48.151174 IP 10.8.3.2.57718 > 52.223.243.160.1935: Flags [.], seq 123945:125259, ack 1, win 501, options [nop,nop,TS val 2981469465 ecr 3174361199], length 1314
15:30:48.170468 IP 52.223.243.160.1935 > 10.8.3.2.57718: Flags [.], ack 120003, win 126, options [nop,nop,TS val 3174361297 ecr 2981469232], length 0
15:30:48.170500 IP 10.8.3.2.57718 > 52.223.243.160.1935: Flags [P.], seq 125259:125945, ack 1, win 501, options [nop,nop,TS val 2981469484 ecr 3174361297], length 686
15:30:48.217841 IP 10.8.3.2.57718 > 52.223.243.160.1935: Flags [.], seq 125945:127259, ack 1, win 501, options [nop,nop,TS val 2981469531 ecr 3174361297], length 1314
15:30:48.240022 IP 52.223.243.160.1935 > 10.8.3.2.57718: Flags [.], ack 122631, win 126, options [nop,nop,TS val 3174361367 ecr 2981469332], length 0
15:30:48.251238 IP 10.8.3.2.57718 > 52.223.243.160.1935: Flags [.], seq 127259:128573, ack 1, win 501, options [nop,nop,TS val 2981469565 ecr 3174361367], length 1314
15:30:48.291881 IP 10.8.3.2.57718 > 52.223.243.160.1935: Flags [.], seq 128573:129887, ack 1, win 501, options [nop,nop,TS val 2981469605 ecr 3174361367], length 1314
15:30:48.339060 IP 52.223.243.160.1935 > 10.8.3.2.57718: Flags [.], ack 125259, win 126, options [nop,nop,TS val 3174361466 ecr 2981469412], length 0
15:30:48.351677 IP 10.8.3.2.57718 > 52.223.243.160.1935: Flags [.], seq 129887:131201, ack 1, win 501, options [nop,nop,TS val 2981469665 ecr 3174361466], length 1314
15:30:48.358582 IP 52.223.243.160.1935 > 10.8.3.2.57718: Flags [.], ack 125945, win 126, options [nop,nop,TS val 3174361485 ecr 2981469484], length 0
15:30:48.358610 IP 10.8.3.2.57718 > 52.223.243.160.1935: Flags [P.], seq 131201:131875, ack 1, win 501, options [nop,nop,TS val 2981469672 ecr 3174361485], length 674
15:30:48.418861 IP 10.8.3.2.57718 > 52.223.243.160.1935: Flags [.], seq 131875:133189, ack 1, win 501, options [nop,nop,TS val 2981469732 ecr 3174361485], length 1314
15:30:48.439039 IP 52.223.243.160.1935 > 10.8.3.2.57718: Flags [.], ack 128573, win 126, options [nop,nop,TS val 3174361566 ecr 2981469531], length 0
15:30:48.452020 IP 10.8.3.2.57718 > 52.223.243.160.1935: Flags [.], seq 133189:134503, ack 1, win 501, options [nop,nop,TS val 2981469765 ecr 3174361566], length 1314
15:30:48.485051 IP 10.8.3.2.57718 > 52.223.243.160.1935: Flags [.], seq 134503:135817, ack 1, win 501, options [nop,nop,TS val 2981469798 ecr 3174361566], length 1314
15:30:48.539569 IP 52.223.243.160.1935 > 10.8.3.2.57718: Flags [.], ack 131201, win 126, options [nop,nop,TS val 3174361667 ecr 2981469605], length 0
15:30:48.546285 IP 52.223.243.160.1935 > 10.8.3.2.57718: Flags [.], ack 131875, win 126, options [nop,nop,TS val 3174361673 ecr 2981469672], length 0
15:30:48.546320 IP 10.8.3.2.57718 > 52.223.243.160.1935: Flags [P.], seq 135817:136867, ack 1, win 501, options [nop,nop,TS val 2981469860 ecr 3174361673], length 1050
15:30:48.585642 IP 10.8.3.2.57718 > 52.223.243.160.1935: Flags [.], seq 136867:138181, ack 1, win 501, options [nop,nop,TS val 2981469899 ecr 3174361673], length 1314
15:30:48.618923 IP 10.8.3.2.57718 > 52.223.243.160.1935: Flags [.], seq 138181:139495, ack 1, win 501, options [nop,nop,TS val 2981469932 ecr 3174361673], length 1314
15:30:48.640310 IP 52.223.243.160.1935 > 10.8.3.2.57718: Flags [.], ack 134503, win 126, options [nop,nop,TS val 3174361767 ecr 2981469732], length 0
15:30:48.656773 IP 10.8.3.2.57718 > 52.223.243.160.1935: Flags [.], seq 139495:140809, ack 1, win 501, options [nop,nop,TS val 2981469970 ecr 3174361767], length 1314
15:30:48.720734 IP 10.8.3.2.57718 > 52.223.243.160.1935: Flags [.], seq 140809:142123, ack 1, win 501, options [nop,nop,TS val 2981470034 ecr 3174361767], length 1314
15:30:48.734027 IP 52.223.243.160.1935 > 10.8.3.2.57718: Flags [.], ack 136867, win 126, options [nop,nop,TS val 3174361861 ecr 2981469798], length 0
15:30:48.734065 IP 10.8.3.2.57718 > 52.223.243.160.1935: Flags [P.], seq 142123:142809, ack 1, win 501, options [nop,nop,TS val 2981470047 ecr 3174361861], length 686
15:30:48.784969 IP 10.8.3.2.57718 > 52.223.243.160.1935: Flags [.], seq 142809:144123, ack 1, win 501, options [nop,nop,TS val 2981470098 ecr 3174361861], length 1314
15:30:48.807102 IP 52.223.243.160.1935 > 10.8.3.2.57718: Flags [.], ack 139495, win 126, options [nop,nop,TS val 3174361934 ecr 2981469899], length 0
15:30:48.815067 IP 10.8.3.2.57718 > 52.223.243.160.1935: Flags [.], seq 144123:145437, ack 1, win 501, options [nop,nop,TS val 2981470128 ecr 3174361934], length 1314
15:30:48.851114 IP 10.8.3.2.57718 > 52.223.243.160.1935: Flags [.], seq 145437:146751, ack 1, win 501, options [nop,nop,TS val 2981470164 ecr 3174361934], length 1314
15:30:48.908423 IP 52.223.243.160.1935 > 10.8.3.2.57718: Flags [.], ack 142123, win 126, options [nop,nop,TS val 3174362035 ecr 2981469970], length 0
15:30:48.917137 IP 10.8.3.2.57718 > 52.223.243.160.1935: Flags [.], seq 146751:148065, ack 1, win 501, options [nop,nop,TS val 2981470230 ecr 3174362035], length 1314
15:30:48.921777 IP 52.223.243.160.1935 > 10.8.3.2.57718: Flags [.], ack 142809, win 126, options [nop,nop,TS val 3174362049 ecr 2981470047], length 0
15:30:48.921801 IP 10.8.3.2.57718 > 52.223.243.160.1935: Flags [P.], seq 148065:148751, ack 1, win 501, options [nop,nop,TS val 2981470235 ecr 3174362049], length 686
15:30:48.985334 IP 10.8.3.2.57718 > 52.223.243.160.1935: Flags [.], seq 148751:150065, ack 1, win 501, options [nop,nop,TS val 2981470299 ecr 3174362049], length 1314
15:30:49.003059 IP 52.223.243.160.1935 > 10.8.3.2.57718: Flags [.], ack 145437, win 126, options [nop,nop,TS val 3174362130 ecr 2981470098], length 0
15:30:49.020101 IP 10.8.3.2.57718 > 52.223.243.160.1935: Flags [.], seq 150065:151379, ack 1, win 501, options [nop,nop,TS val 2981470333 ecr 3174362130], length 1314
15:30:49.050533 IP 10.8.3.2.57718 > 52.223.243.160.1935: Flags [.], seq 151379:152693, ack 1, win 501, options [nop,nop,TS val 2981470364 ecr 3174362130], length 1314
15:30:49.105219 IP 52.223.243.160.1935 > 10.8.3.2.57718: Flags [.], ack 148065, win 126, options [nop,nop,TS val 3174362232 ecr 2981470164], length 0
15:30:49.109727 IP 52.223.243.160.1935 > 10.8.3.2.57718: Flags [.], ack 148751, win 126, options [nop,nop,TS val 3174362236 ecr 2981470235], length 0
15:30:49.109756 IP 10.8.3.2.57718 > 52.223.243.160.1935: Flags [P.], seq 152693:153838, ack 1, win 501, options [nop,nop,TS val 2981470423 ecr 3174362236], length 1145
15:30:49.147861 IP 10.8.3.2.57718 > 52.223.243.160.1935: Flags [.], seq 153838:155152, ack 1, win 501, options [nop,nop,TS val 2981470461 ecr 3174362236], length 1314
15:30:49.181345 IP 10.8.3.2.57718 > 52.223.243.160.1935: Flags [.], seq 155152:156466, ack 1, win 501, options [nop,nop,TS val 2981470495 ecr 3174362236], length 1314
15:30:49.207988 IP 52.223.243.160.1935 > 10.8.3.2.57718: Flags [.], ack 151379, win 126, options [nop,nop,TS val 3174362335 ecr 2981470299], length 0
15:30:49.232924 IP 10.8.3.2.57718 > 52.223.243.160.1935: Flags [.], seq 156466:157780, ack 1, win 501, options [nop,nop,TS val 2981470546 ecr 3174362335], length 1314
15:30:49.286389 IP 10.8.3.2.57718 > 52.223.243.160.1935: Flags [.], seq 157780:159094, ack 1, win 501, options [nop,nop,TS val 2981470600 ecr 3174362335], length 1314
15:30:49.297806 IP 52.223.243.160.1935 > 10.8.3.2.57718: Flags [.], ack 153838, win 126, options [nop,nop,TS val 3174362425 ecr 2981470364], length 0
15:30:49.297841 IP 10.8.3.2.57718 > 52.223.243.160.1935: Flags [P.], seq 159094:159772, ack 1, win 501, options [nop,nop,TS val 2981470611 ecr 3174362425], length 678
15:30:49.352693 IP 10.8.3.2.57718 > 52.223.243.160.1935: Flags [.], seq 159772:161086, ack 1, win 501, options [nop,nop,TS val 2981470666 ecr 3174362425], length 1314
15:30:49.369427 IP 52.223.243.160.1935 > 10.8.3.2.57718: Flags [.], ack 156466, win 126, options [nop,nop,TS val 3174362496 ecr 2981470461], length 0
15:30:49.386772 IP 10.8.3.2.57718 > 52.223.243.160.1935: Flags [.], seq 161086:162400, ack 1, win 501, options [nop,nop,TS val 2981470700 ecr 3174362496], length 1314
15:30:49.425628 IP 10.8.3.2.57718 > 52.223.243.160.1935: Flags [.], seq 162400:163714, ack 1, win 501, options [nop,nop,TS val 2981470739 ecr 3174362496], length 1314
15:30:49.474371 IP 52.223.243.160.1935 > 10.8.3.2.57718: Flags [.], ack 159094, win 126, options [nop,nop,TS val 3174362601 ecr 2981470546], length 0
15:30:49.483972 IP 10.8.3.2.57718 > 52.223.243.160.1935: Flags [.], seq 163714:165028, ack 1, win 501, options [nop,nop,TS val 2981470797 ecr 3174362601], length 1314
15:30:49.485596 IP 52.223.243.160.1935 > 10.8.3.2.57718: Flags [.], ack 159772, win 126, options [nop,nop,TS val 3174362612 ecr 2981470611], length 0
15:30:49.485622 IP 10.8.3.2.57718 > 52.223.243.160.1935: Flags [P.], seq 165028:165618, ack 1, win 501, options [nop,nop,TS val 2981470799 ecr 3174362612], length 590
15:30:49.554230 IP 10.8.3.2.57718 > 52.223.243.160.1935: Flags [.], seq 165618:166932, ack 1, win 501, options [nop,nop,TS val 2981470868 ecr 3174362612], length 1314
15:30:49.574564 IP 52.223.243.160.1935 > 10.8.3.2.57718: Flags [.], ack 162400, win 126, options [nop,nop,TS val 3174362702 ecr 2981470666], length 0
15:30:49.582357 IP 10.8.3.2.57718 > 52.223.243.160.1935: Flags [.], seq 166932:168246, ack 1, win 501, options [nop,nop,TS val 2981470896 ecr 3174362702], length 1314
15:30:49.618024 IP 10.8.3.2.57718 > 52.223.243.160.1935: Flags [.], seq 168246:169560, ack 1, win 501, options [nop,nop,TS val 2981470931 ecr 3174362702], length 1314
15:30:49.671838 IP 52.223.243.160.1935 > 10.8.3.2.57718: Flags [.], ack 165028, win 126, options [nop,nop,TS val 3174362799 ecr 2981470739], length 0
15:30:49.673454 IP 52.223.243.160.1935 > 10.8.3.2.57718: Flags [.], ack 165618, win 126, options [nop,nop,TS val 3174362800 ecr 2981470799], length 0
15:30:49.673487 IP 10.8.3.2.57718 > 52.223.243.160.1935: Flags [P.], seq 169560:170712, ack 1, win 501, options [nop,nop,TS val 2981470987 ecr 3174362800], length 1152
15:30:49.718509 IP 10.8.3.2.57718 > 52.223.243.160.1935: Flags [.], seq 170712:172026, ack 1, win 501, options [nop,nop,TS val 2981471032 ecr 3174362800], length 1314
15:30:49.752031 IP 10.8.3.2.57718 > 52.223.243.160.1935: Flags [.], seq 172026:173340, ack 1, win 501, options [nop,nop,TS val 2981471065 ecr 3174362800], length 1314
15:30:49.770283 IP 52.223.243.160.1935 > 10.8.3.2.57718: Flags [.], ack 168246, win 126, options [nop,nop,TS val 3174362897 ecr 2981470868], length 0
15:30:49.790046 IP 10.8.3.2.57718 > 52.223.243.160.1935: Flags [.], seq 173340:174654, ack 1, win 501, options [nop,nop,TS val 2981471103 ecr 3174362897], length 1314
15:30:49.849469 IP 10.8.3.2.57718 > 52.223.243.160.1935: Flags [.], seq 174654:175968, ack 1, win 501, options [nop,nop,TS val 2981471163 ecr 3174362897], length 1314
15:30:49.861205 IP 52.223.243.160.1935 > 10.8.3.2.57718: Flags [.], ack 170712, win 126, options [nop,nop,TS val 3174362988 ecr 2981470931], length 0
15:30:49.861232 IP 10.8.3.2.57718 > 52.223.243.160.1935: Flags [P.], seq 175968:176743, ack 1, win 501, options [nop,nop,TS val 2981471175 ecr 3174362988], length 775
15:30:49.918634 IP 10.8.3.2.57718 > 52.223.243.160.1935: Flags [.], seq 176743:178057, ack 1, win 501, options [nop,nop,TS val 2981471232 ecr 3174362988], length 1314
15:30:49.940021 IP 52.223.243.160.1935 > 10.8.3.2.57718: Flags [.], ack 173340, win 126, options [nop,nop,TS val 3174363067 ecr 2981471032], length 0
15:30:49.940205 IP 10.8.3.2.57718 > 52.223.243.160.1935: Flags [.], seq 178057:179371, ack 1, win 501, options [nop,nop,TS val 2981471254 ecr 3174363067], length 1314
15:30:49.982945 IP 10.8.3.2.57718 > 52.223.243.160.1935: Flags [.], seq 179371:180685, ack 1, win 501, options [nop,nop,TS val 2981471296 ecr 3174363067], length 1314
15:30:50.037322 IP 52.223.243.160.1935 > 10.8.3.2.57718: Flags [.], ack 175968, win 126, options [nop,nop,TS val 3174363164 ecr 2981471103], length 0
15:30:50.047409 IP 10.8.3.2.57718 > 52.223.243.160.1935: Flags [.], seq 180685:181999, ack 1, win 501, options [nop,nop,TS val 2981471361 ecr 3174363164], length 1314
15:30:50.049081 IP 52.223.243.160.1935 > 10.8.3.2.57718: Flags [.], ack 176743, win 126, options [nop,nop,TS val 3174363176 ecr 2981471175], length 0
15:30:50.049125 IP 10.8.3.2.57718 > 52.223.243.160.1935: Flags [P.], seq 181999:182577, ack 1, win 501, options [nop,nop,TS val 2981471362 ecr 3174363176], length 578
15:30:50.111579 IP 10.8.3.2.57718 > 52.223.243.160.1935: Flags [.], seq 182577:183891, ack 1, win 501, options [nop,nop,TS val 2981471425 ecr 3174363176], length 1314
15:30:50.127920 IP 52.223.243.160.1935 > 10.8.3.2.57718: Flags [.], ack 179371, win 126, options [nop,nop,TS val 3174363255 ecr 2981471232], length 0
15:30:50.151313 IP 10.8.3.2.57718 > 52.223.243.160.1935: Flags [.], seq 183891:185205, ack 1, win 501, options [nop,nop,TS val 2981471465 ecr 3174363255], length 1314
15:30:50.175738 IP 10.8.3.2.57718 > 52.223.243.160.1935: Flags [.], seq 185205:186519, ack 1, win 501, options [nop,nop,TS val 2981471489 ecr 3174363255], length 1314
15:30:50.235184 IP 52.223.243.160.1935 > 10.8.3.2.57718: Flags [.], ack 181999, win 126, options [nop,nop,TS val 3174363362 ecr 2981471296], length 0
15:30:50.236766 IP 52.223.243.160.1935 > 10.8.3.2.57718: Flags [.], ack 182577, win 126, options [nop,nop,TS val 3174363364 ecr 2981471362], length 0
15:30:50.236778 IP 10.8.3.2.57718 > 52.223.243.160.1935: Flags [P.], seq 186519:187672, ack 1, win 501, options [nop,nop,TS val 2981471550 ecr 3174363364], length 1153
15:30:50.282249 IP 10.8.3.2.57718 > 52.223.243.160.1935: Flags [.], seq 187672:188986, ack 1, win 501, options [nop,nop,TS val 2981471596 ecr 3174363364], length 1314
15:30:50.319022 IP 10.8.3.2.57718 > 52.223.243.160.1935: Flags [.], seq 188986:190300, ack 1, win 501, options [nop,nop,TS val 2981471632 ecr 3174363364], length 1314
15:30:50.339282 IP 52.223.243.160.1935 > 10.8.3.2.57718: Flags [.], ack 185205, win 126, options [nop,nop,TS val 3174363466 ecr 2981471425], length 0
15:30:50.352143 IP 10.8.3.2.57718 > 52.223.243.160.1935: Flags [.], seq 190300:191614, ack 1, win 501, options [nop,nop,TS val 2981471665 ecr 3174363466], length 1314
15:30:50.410776 IP 10.8.3.2.57718 > 52.223.243.160.1935: Flags [.], seq 191614:192928, ack 1, win 501, options [nop,nop,TS val 2981471724 ecr 3174363466], length 1314
