17:28:56.074234 IP 10.8.1.3.54542 > 52.223.200.141.1935: Flags [.], seq 3148207803:3148209117, ack 2360463798, win 501, options [nop,nop,TS val 3090927910 ecr 55034578], length 1314
17:28:56.105248 IP 52.223.200.141.1935 > 10.8.1.3.54542: Flags [.], ack 4294962943, win 126, options [nop,nop,TS val 55034660 ecr 3090927676], length 0
17:28:56.105967 IP 10.8.1.3.54542 > 52.223.200.141.1935: Flags [.], seq 1314:2628, ack 1, win 501, options [nop,nop,TS val 3090927941 ecr 55034660], length 1314
17:28:56.142812 IP 10.8.1.3.54542 > 52.223.200.141.1935: Flags [.], seq 2628:3942, ack 1, win 501, options [nop,nop,TS val 3090927978 ecr 55034660], length 1314
17:28:56.205696 IP 10.8.1.3.54542 > 52.223.200.141.1935: Flags [.], seq 3942:5256, ack 1, win 501, options [nop,nop,TS val 3090928041 ecr 55034660], length 1314
17:28:56.208454 IP 52.223.200.141.1935 > 10.8.1.3.54542: Flags [.], ack 4294965571, win 126, options [nop,nop,TS val 55034763 ecr 3090927743], length 0
17:28:56.239714 IP 10.8.1.3.54542 > 52.223.200.141.1935: Flags [.], seq 5256:6570, ack 1, win 501, options [nop,nop,TS val 3090928075 ecr 55034763], length 1314
17:28:56.255530 IP 52.223.200.141.1935 > 10.8.1.3.54542: Flags [.], ack 0, win 126, options [nop,nop,TS val 55034810 ecr 3090927845], length 0
17:28:56.255549 IP 10.8.1.3.54542 > 52.223.200.141.1935: Flags [P.], seq 6570:6979, ack 1, win 501, options [nop,nop,TS val 3090928091 ecr 55034810], length 409
17:28:56.309694 IP 10.8.1.3.54542 > 52.223.200.141.1935: Flags [.], seq 6979:8293, ack 1, win 501, options [nop,nop,TS val 3090928145 ecr 55034810], length 1314
17:28:56.338681 IP 52.223.200.141.1935 > 10.8.1.3.54542: Flags [.], ack 2628, win 126, options [nop,nop,TS val 55034893 ecr 3090927910], length 0
17:28:56.343033 IP 10.8.1.3.54542 > 52.223.200.141.1935: Flags [.], seq 8293:9607, ack 1, win 501, options [nop,nop,TS val 3090928178 ecr 55034893], length 1314
17:28:56.373424 IP 10.8.1.3.54542 > 52.223.200.141.1935: Flags [.], seq 9607:10921, ack 1, win 501, options [nop,nop,TS val 3090928209 ecr 55034893], length 1314
17:28:56.438055 IP 52.223.200.141.1935 > 10.8.1.3.54542: Flags [.], ack 5256, win 126, options [nop,nop,TS val 55034993 ecr 3090927978], length 0
17:28:56.443050 IP 10.8.1.3.54542 > 52.223.200.141.1935: Flags [.], seq 10921:12235, ack 1, win 501, options [nop,nop,TS val 3090928278 ecr 55034993], length 1314
17:28:56.476363 IP 10.8.1.3.54542 > 52.223.200.141.1935: Flags [.], seq 12235:13549, ack 1, win 501, options [nop,nop,TS val 3090928312 ecr 55034993], length 1314
17:28:56.487569 IP 52.223.200.141.1935 > 10.8.1.3.54542: Flags [.], ack 6979, win 126, options [nop,nop,TS val 55035042 ecr 3090928075], length 0
17:28:56.487605 IP 10.8.1.3.54542 > 52.223.200.141.1935: Flags [P.], seq 13549:13947, ack 1, win 501, options [nop,nop,TS val 3090928323 ecr 55035042], length 398
17:28:56.540246 IP 10.8.1.3.54542 > 52.223.200.141.1935: Flags [.], seq 13947:15261, ack 1, win 501, options [nop,nop,TS val 3090928376 ecr 55035042], length 1314
17:28:56.572741 IP 10.8.1.3.54542 > 52.223.200.141.1935: Flags [.], seq 15261:16575, ack 1, win 501, options [nop,nop,TS val 3090928408 ecr 55035042], length 1314
17:28:56.575455 IP 52.223.200.141.1935 > 10.8.1.3.54542: Flags [.], ack 9607, win 126, options [nop,nop,TS val 55035130 ecr 3090928145], length 0
17:28:56.607758 IP 10.8.1.3.54542 > 52.223.200.141.1935: Flags [.], seq 16575:17889, ack 1, win 501, options [nop,nop,TS val 3090928443 ecr 55035130], length 1314
17:28:56.661794 IP 52.223.200.141.1935 > 10.8.1.3.54542: Flags [.], ack 10921, win 126, options [nop,nop,TS val 55035216 ecr 3090928209], length 0
17:28:56.675381 IP 10.8.1.3.54542 > 52.223.200.141.1935: Flags [.], seq 17889:19203, ack 1, win 501, options [nop,nop,TS val 3090928511 ecr 55035216], length 1314
17:28:56.707916 IP 10.8.1.3.54542 > 52.223.200.141.1935: Flags [.], seq 19203:20517, ack 1, win 501, options [nop,nop,TS val 3090928543 ecr 55035216], length 1314
17:28:56.708551 IP 52.223.200.141.1935 > 10.8.1.3.54542: Flags [.], ack 13549, win 126, options [nop,nop,TS val 55035263 ecr 3090928278], length 0
17:28:56.719754 IP 52.223.200.141.1935 > 10.8.1.3.54542: Flags [.], ack 13947, win 126, options [nop,nop,TS val 55035274 ecr 3090928323], length 0
17:28:56.719782 IP 10.8.1.3.54542 > 52.223.200.141.1935: Flags [P.], seq 20517:20921, ack 1, win 501, options [nop,nop,TS val 3090928555 ecr 55035274], length 404
17:28:56.773641 IP 10.8.1.3.54542 > 52.223.200.141.1935: Flags [.], seq 20921:22235, ack 1, win 501, options [nop,nop,TS val 3090928609 ecr 55035274], length 1314
17:28:56.805403 IP 52.223.200.141.1935 > 10.8.1.3.54542: Flags [.], ack 16575, win 126, options [nop,nop,TS val 55035360 ecr 3090928376], length 0
17:28:56.809946 IP 10.8.1.3.54542 > 52.223.200.141.1935: Flags [.], seq 22235:23549, ack 1, win 501, options [nop,nop,TS val 3090928645 ecr 55035360], length 1314
17:28:56.843463 IP 10.8.1.3.54542 > 52.223.200.141.1935: Flags [.], seq 23549:24863, ack 1, win 501, options [nop,nop,TS val 3090928679 ecr 55035360], length 1314
17:28:56.907605 IP 52.223.200.141.1935 > 10.8.1.3.54542: Flags [.], ack 19203, win 126, options [nop,nop,TS val 55035462 ecr 3090928443], length 0
17:28:56.908394 IP 10.8.1.3.54542 > 52.223.200.141.1935: Flags [.], seq 24863:26177, ack 1, win 501, options [nop,nop,TS val 3090928744 ecr 55035462], length 1314
17:28:56.940227 IP 10.8.1.3.54542 > 52.223.200.141.1935: Flags [.], seq 26177:27491, ack 1, win 501, options [nop,nop,TS val 3090928776 ecr 55035462], length 1314
17:28:56.951742 IP 52.223.200.141.1935 > 10.8.1.3.54542: Flags [.], ack 20921, win 126, options [nop,nop,TS val 55035506 ecr 3090928543], length 0
17:28:56.951759 IP 10.8.1.3.54542 > 52.223.200.141.1935: Flags [P.], seq 27491:27900, ack 1, win 501, options [nop,nop,TS val 3090928787 ecr 55035506], length 409
17:28:57.009900 IP 10.8.1.3.54542 > 52.223.200.141.1935: Flags [.], seq 27900:29214, ack 1, win 501, options [nop,nop,TS val 3090928845 ecr 55035506], length 1314
17:28:57.042233 IP 52.223.200.141.1935 > 10.8.1.3.54542: Flags [.], ack 23549, win 126, options [nop,nop,TS val 55035597 ecr 3090928609], length 0
17:28:57.043351 IP 10.8.1.3.54542 > 52.223.200.141.1935: Flags [.], seq 29214:30528, ack 1, win 501, options [nop,nop,TS val 3090928879 ecr 55035597], length 1314
17:28:57.077421 IP 10.8.1.3.54542 > 52.223.200.141.1935: Flags [.], seq 30528:31842, ack 1, win 501, options [nop,nop,TS val 3090928913 ecr 55035597], length 1314
17:28:57.140815 IP 52.223.200.141.1935 > 10.8.1.3.54542: Flags [.], ack 26177, win 126, options [nop,nop,TS val 55035695 ecr 3090928679], length 0
17:28:57.141939 IP 10.8.1.3.54542 > 52.223.200.141.1935: Flags [.], seq 31842:33156, ack 1, win 501, options [nop,nop,TS val 3090928977 ecr 55035695], length 1314
17:28:57.175330 IP 10.8.1.3.54542 > 52.223.200.141.1935: Flags [.], seq 33156:34470, ack 1, win 501, options [nop,nop,TS val 3090929011 ecr 55035695], length 1314
17:28:57.183733 IP 52.223.200.141.1935 > 10.8.1.3.54542: Flags [.], ack 27900, win 126, options [nop,nop,TS val 55035738 ecr 3090928776], length 0
17:28:57.183758 IP 10.8.1.3.54542 > 52.223.200.141.1935: Flags [P.], seq 34470:34781, ack 1, win 501, options [nop,nop,TS val 3090929019 ecr 55035738], length 311
17:28:57.244290 IP 10.8.1.3.54542 > 52.223.200.141.1935: Flags [.], seq 34781:36095, ack 1, win 501, options [nop,nop,TS val 3090929080 ecr 55035738], length 1314
17:28:57.275533 IP 52.223.200.141.1935 > 10.8.1.3.54542: Flags [.], ack 30528, win 126, options [nop,nop,TS val 55035830 ecr 3090928845], length 0
17:28:57.277830 IP 10.8.1.3.54542 > 52.223.200.141.1935: Flags [.], seq 36095:37409, ack 1, win 501, options [nop,nop,TS val 3090929113 ecr 55035830], length 1314
17:28:57.309087 IP 10.8.1.3.54542 > 52.223.200.141.1935: Flags [.], seq 37409:38723, ack 1, win 501, options [nop,nop,TS val 3090929144 ecr 55035830], length 1314
17:28:57.369917 IP 52.223.200.141.1935 > 10.8.1.3.54542: Flags [.], ack 31842, win 126, options [nop,nop,TS val 55035924 ecr 3090928913], length 0
17:28:57.377080 IP 10.8.1.3.54542 > 52.223.200.141.1935: Flags [.], seq 38723:40037, ack 1, win 501, options [nop,nop,TS val 3090929212 ecr 55035924], length 1314
17:28:57.407730 IP 52.223.200.141.1935 > 10.8.1.3.54542: Flags [.], ack 34470, win 126, options [nop,nop,TS val 55035962 ecr 3090928977], length 0
17:28:57.410845 IP 10.8.1.3.54542 > 52.223.200.141.1935: Flags [.], seq 40037:41351, ack 1, win 501, options [nop,nop,TS val 3090929246 ecr 55035962], length 1314
17:28:57.415634 IP 52.223.200.141.1935 > 10.8.1.3.54542: Flags [.], ack 34781, win 126, options [nop,nop,TS val 55035970 ecr 3090929019], length 0
17:28:57.415669 IP 10.8.1.3.54542 > 52.223.200.141.1935: Flags [P.], seq 41351:41749, ack 1, win 501, options [nop,nop,TS val 3090929251 ecr 55035970], length 398
17:28:57.475092 IP 10.8.1.3.54542 > 52.223.200.141.1935: Flags [.], seq 41749:43063, ack 1, win 501, options [nop,nop,TS val 3090929310 ecr 55035970], length 1314
17:28:57.509156 IP 10.8.1.3.54542 > 52.223.200.141.1935: Flags [.], seq 43063:44377, ack 1, win 501, options [nop,nop,TS val 3090929344 ecr 55035970], length 1314
17:28:57.510198 IP 52.223.200.141.1935 > 10.8.1.3.54542: Flags [.], ack 37409, win 126, options [nop,nop,TS val 55036065 ecr 3090929080], length 0
17:28:57.540903 IP 10.8.1.3.54542 > 52.223.200.141.1935: Flags [.], seq 44377:45691, ack 1, win 501, options [nop,nop,TS val 3090929376 ecr 55036065], length 1314
17:28:57.608412 IP 10.8.1.3.54542 > 52.223.200.141.1935: Flags [.], seq 45691:47005, ack 1, win 501, options [nop,nop,TS val 3090929444 ecr 55036065], length 1314
17:28:57.609610 IP 52.223.200.141.1935 > 10.8.1.3.54542: Flags [.], ack 40037, win 126, options [nop,nop,TS val 55036164 ecr 3090929144], length 0
17:28:57.642407 IP 10.8.1.3.54542 > 52.223.200.141.1935: Flags [.], seq 47005:48319, ack 1, win 501, options [nop,nop,TS val 3090929478 ecr 55036164], length 1314
17:28:57.647796 IP 52.223.200.141.1935 > 10.8.1.3.54542: Flags [.], ack 41749, win 126, options [nop,nop,TS val 55036202 ecr 3090929246], length 0
17:28:57.647825 IP 10.8.1.3.54542 > 52.223.200.141.1935: Flags [P.], seq 48319:48729, ack 1, win 501, options [nop,nop,TS val 3090929483 ecr 55036202], length 410
17:28:57.707637 IP 10.8.1.3.54542 > 52.223.200.141.1935: Flags [.], seq 48729:50043, ack 1, win 501, options [nop,nop,TS val 3090929543 ecr 55036202], length 1314
17:28:57.741433 IP 52.223.200.141.1935 > 10.8.1.3.54542: Flags [.], ack 44377, win 126, options [nop,nop,TS val 55036296 ecr 3090929310], length 0
17:28:57.741959 IP 10.8.1.3.54542 > 52.223.200.141.1935: Flags [.], seq 50043:51357, ack 1, win 501, options [nop,nop,TS val 3090929577 ecr 55036296], length 1314
17:28:57.776055 IP 10.8.1.3.54542 > 52.223.200.141.1935: Flags [.], seq 51357:52671, ack 1, win 501, options [nop,nop,TS val 3090929611 ecr 55036296], length 1314
17:28:57.834249 IP 52.223.200.141.1935 > 10.8.1.3.54542: Flags [.], ack 45691, win 126, options [nop,nop,TS val 55036388 ecr 3090929376], length 0
17:28:57.841101 IP 10.8.1.3.54542 > 52.223.200.141.1935: Flags [.], seq 52671:53985, ack 1, win 501, options [nop,nop,TS val 3090929676 ecr 55036388], length 1314
17:28:57.874741 IP 52.223.200.141.1935 > 10.8.1.3.54542: Flags [.], ack 48319, win 126, options [nop,nop,TS val 55036429 ecr 3090929444], length 0
17:28:57.875779 IP 10.8.1.3.54542 > 52.223.200.141.1935: Flags [.], seq 53985:55299, ack 1, win 501, options [nop,nop,TS val 3090929711 ecr 55036429], length 1314
17:28:57.879739 IP 52.223.200.141.1935 > 10.8.1.3.54542: Flags [.], ack 48729, win 126, options [nop,nop,TS val 55036434 ecr 3090929483], length 0
17:28:57.879765 IP 10.8.1.3.54542 > 52.223.200.141.1935: Flags [P.], seq 55299:55709, ack 1, win 501, options [nop,nop,TS val 3090929715 ecr 55036434], length 410
17:28:57.940497 IP 10.8.1.3.54542 > 52.223.200.141.1935: Flags [.], seq 55709:57023, ack 1, win 501, options [nop,nop,TS val 3090929776 ecr 55036434], length 1314
17:28:57.973786 IP 10.8.1.3.54542 > 52.223.200.141.1935: Flags [.], seq 57023:58337, ack 1, win 501, options [nop,nop,TS val 3090929809 ecr 55036434], length 1314
17:28:57.974067 IP 52.223.200.141.1935 > 10.8.1.3.54542: Flags [.], ack 51357, win 126, options [nop,nop,TS val 55036529 ecr 3090929543], length 0
17:28:58.007799 IP 10.8.1.3.54542 > 52.223.200.141.1935: Flags [.], seq 58337:59651, ack 1, win 501, options [nop,nop,TS val 3090929843 ecr 55036529], length 1314
17:28:58.073226 IP 52.223.200.141.1935 > 10.8.1.3.54542: Flags [.], ack 53985, win 126, options [nop,nop,TS val 55036628 ecr 3090929611], length 0
17:28:58.076511 IP 10.8.1.3.54542 > 52.223.200.141.1935: Flags [.], seq 59651:60965, ack 1, win 501, options [nop,nop,TS val 3090929912 ecr 55036628], length 1314
17:28:58.108213 IP 10.8.1.3.54542 > 52.223.200.141.1935: Flags [.], seq 60965:62279, ack 1, win 501, options [nop,nop,TS val 3090929944 ecr 55036628], length 1314
17:28:58.111807 IP 52.223.200.141.1935 > 10.8.1.3.54542: Flags [.], ack 55709, win 126, options [nop,nop,TS val 55036666 ecr 3090929711], length 0
17:28:58.111834 IP 10.8.1.3.54542 > 52.223.200.141.1935: Flags [P.], seq 62279:62673, ack 1, win 501, options [nop,nop,TS val 3090929947 ecr 55036666], length 394
17:28:58.176722 IP 10.8.1.3.54542 > 52.223.200.141.1935: Flags [.], seq 62673:63987, ack 1, win 501, options [nop,nop,TS val 3090930012 ecr 55036666], length 1314
17:28:58.206574 IP 52.223.200.141.1935 > 10.8.1.3.54542: Flags [.], ack 58337, win 126, options [nop,nop,TS val 55036761 ecr 3090929776], length 0
17:28:58.209865 IP 10.8.1.3.54542 > 52.223.200.141.1935: Flags [.], seq 63987:65301, ack 1, win 501, options [nop,nop,TS val 3090930045 ecr 55036761], length 1314
17:28:58.240686 IP 10.8.1.3.54542 > 52.223.200.141.1935: Flags [.], seq 65301:66615, ack 1, win 501, options [nop,nop,TS val 3090930076 ecr 55036761], length 1314
17:28:58.306183 IP 52.223.200.141.1935 > 10.8.1.3.54542: Flags [.], ack 59651, win 126, options [nop,nop,TS val 55036860 ecr 3090929843], length 0
17:28:58.309141 IP 10.8.1.3.54542 > 52.223.200.141.1935: Flags [.], seq 66615:67929, ack 1, win 501, options [nop,nop,TS val 3090930144 ecr 55036860], length 1314
17:28:58.340503 IP 52.223.200.141.1935 > 10.8.1.3.54542: Flags [.], ack 62279, win 126, options [nop,nop,TS val 55036895 ecr 3090929912], length 0
17:28:58.342019 IP 10.8.1.3.54542 > 52.223.200.141.1935: Flags [.], seq 67929:69243, ack 1, win 501, options [nop,nop,TS val 3090930177 ecr 55036895], length 1314
17:28:58.343943 IP 52.223.200.141.1935 > 10.8.1.3.54542: Flags [.], ack 62673, win 126, options [nop,nop,TS val 55036899 ecr 3090929947], length 0
17:28:58.343973 IP 10.8.1.3.54542 > 52.223.200.141.1935: Flags [P.], seq 69243:69649, ack 1, win 501, options [nop,nop,TS val 3090930179 ecr 55036899], length 406
17:28:58.409767 IP 10.8.1.3.54542 > 52.223.200.141.1935: Flags [.], seq 69649:70963, ack 1, win 501, options [nop,nop,TS val 3090930245 ecr 55036899], length 1314
17:28:58.442035 IP 52.223.200.141.1935 > 10.8.1.3.54542: Flags [.], ack 65301, win 126, options [nop,nop,TS val 55036997 ecr 3090930012], length 0
17:28:58.444028 IP 10.8.1.3.54542 > 52.223.200.141.1935: Flags [.], seq 70963:72277, ack 1, win 501, options [nop,nop,TS val 3090930279 ecr 55036997], length 1314
17:28:58.476259 IP 10.8.1.3.54542 > 52.223.200.141.1935: Flags [.], seq 72277:73591, ack 1, win 501, options [nop,nop,TS val 3090930312 ecr 55036997], length 1314
17:28:58.541607 IP 52.223.200.141.1935 > 10.8.1.3.54542: Flags [.], ack 67929, win 126, options [nop,nop,TS val 55037096 ecr 3090930076], length 0
17:28:58.543116 IP 10.8.1.3.54542 > 52.223.200.141.1935: Flags [.], seq 73591:74905, ack 1, win 501, options [nop,nop,TS val 3090930378 ecr 55037096], length 1314
17:28:58.574197 IP 10.8.1.3.54542 > 52.223.200.141.1935: Flags [.], seq 74905:76219, ack 1, win 501, options [nop,nop,TS val 3090930409 ecr 55037096], length 1314
17:28:58.575744 IP 52.223.200.141.1935 > 10.8.1.3.54542: Flags [.], ack 69649, win 126, options [nop,nop,TS val 55037130 ecr 3090930177], length 0
17:28:58.575764 IP 10.8.1.3.54542 > 52.223.200.141.1935: Flags [P.], seq 76219:76629, ack 1, win 501, options [nop,nop,TS val 3090930411 ecr 55037130], length 410
17:28:58.638978 IP 10.8.1.3.54542 > 52.223.200.141.1935: Flags [.], seq 76629:77943, ack 1, win 501, options [nop,nop,TS val 3090930474 ecr 55037130], length 1314
17:28:58.674040 IP 10.8.1.3.54542 > 52.223.200.141.1935: Flags [.], seq 77943:79257, ack 1, win 501, options [nop,nop,TS val 3090930509 ecr 55037130], length 1314
17:28:58.676180 IP 52.223.200.141.1935 > 10.8.1.3.54542: Flags [.], ack 72277, win 126, options [nop,nop,TS val 55037231 ecr 3090930245], length 0
17:28:58.710015 IP 10.8.1.3.54542 > 52.223.200.141.1935: Flags [.], seq 79257:80571, ack 1, win 501, options [nop,nop,TS val 3090930545 ecr 55037231], length 1314
17:28:58.769861 IP 52.223.200.141.1935 > 10.8.1.3.54542: Flags [.], ack 73591, win 126, options [nop,nop,TS val 55037324 ecr 3090930312], length 0
17:28:58.776497 IP 10.8.1.3.54542 > 52.223.200.141.1935: Flags [.], seq 80571:81885, ack 1, win 501, options [nop,nop,TS val 3090930612 ecr 55037324], length 1314
17:28:58.806420 IP 52.223.200.141.1935 > 10.8.1.3.54542: Flags [.], ack 76219, win 126, options [nop,nop,TS val 55037361 ecr 3090930378], length 0
17:28:58.807905 IP 52.223.200.141.1935 > 10.8.1.3.54542: Flags [.], ack 76629, win 126, options [nop,nop,TS val 55037362 ecr 3090930411], length 0
17:28:58.807958 IP 10.8.1.3.54542 > 52.223.200.141.1935: Flags [P.], seq 81885:82663, ack 1, win 501, options [nop,nop,TS val 3090930643 ecr 55037362], length 778
17:28:58.843386 IP 10.8.1.3.54542 > 52.223.200.141.1935: Flags [.], seq 82663:83977, ack 1, win 501, options [nop,nop,TS val 3090930679 ecr 55037362], length 1314
17:28:58.876501 IP 10.8.1.3.54542 > 52.223.200.141.1935: Flags [.], seq 83977:85291, ack 1, win 501, options [nop,nop,TS val 3090930712 ecr 55037362], length 1314
17:28:58.906299 IP 52.223.200.141.1935 > 10.8.1.3.54542: Flags [.], ack 79257, win 126, options [nop,nop,TS val 55037461 ecr 3090930474], length 0
17:28:58.915715 IP 10.8.1.3.54542 > 52.223.200.141.1935: Flags [.], seq 85291:86605, ack 1, win 501, options [nop,nop,TS val 3090930751 ecr 55037461], length 1314
17:28:58.979991 IP 10.8.1.3.54542 > 52.223.200.141.1935: Flags [.], seq 86605:87919, ack 1, win 501, options [nop,nop,TS val 3090930815 ecr 55037461], length 1314
17:28:59.009664 IP 52.223.200.141.1935 > 10.8.1.3.54542: Flags [.], ack 81885, win 126, options [nop,nop,TS val 55037563 ecr 3090930545], length 0
17:28:59.010482 IP 10.8.1.3.54542 > 52.223.200.141.1935: Flags [.], seq 87919:89233, ack 1, win 501, options [nop,nop,TS val 3090930846 ecr 55037563], length 1314
17:28:59.040031 IP 52.223.200.141.1935 > 10.8.1.3.54542: Flags [.], ack 82663, win 126, options [nop,nop,TS val 55037595 ecr 3090930643], length 0
17:28:59.040062 IP 10.8.1.3.54542 > 52.223.200.141.1935: Flags [P.], seq 89233:89632, ack 1, win 501, options [nop,nop,TS val 3090930875 ecr 55037595], length 399
17:28:59.076715 IP 10.8.1.3.54542 > 52.223.200.141.1935: Flags [.], seq 89632:90946, ack 1, win 501, options [nop,nop,TS val 3090930912 ecr 55037595], length 1314
17:28:59.109639 IP 52.223.200.141.1935 > 10.8.1.3.54542: Flags [.], ack 85291, win 126, options [nop,nop,TS val 55037663 ecr 3090930679], length 0
17:28:59.110705 IP 10.8.1.3.54542 > 52.223.200.141.1935: Flags [.], seq 90946:92260, ack 1, win 501, options [nop,nop,TS val 3090930946 ecr 55037663], length 1314
17:28:59.151564 IP 10.8.1.3.54542 > 52.223.200.141.1935: Flags [.], seq 92260:93574, ack 1, win 501, options [nop,nop,TS val 3090930987 ecr 55037663], length 1314
17:28:59.208518 IP 10.8.1.3.54542 > 52.223.200.141.1935: Flags [.], seq 93574:94888, ack 1, win 501, options [nop,nop,TS val 3090931044 ecr 55037663], length 1314
17:28:59.212263 IP 52.223.200.141.1935 > 10.8.1.3.54542: Flags [.], ack 87919, win 126, options [nop,nop,TS val 55037767 ecr 3090930751], length 0
17:28:59.241928 IP 10.8.1.3.54542 > 52.223.200.141.1935: Flags [.], seq 94888:96202, ack 1, win 501, options [nop,nop,TS val 3090931077 ecr 55037767], length 1314
17:28:59.272433 IP 52.223.200.141.1935 > 10.8.1.3.54542: Flags [.], ack 89632, win 126, options [nop,nop,TS val 55037827 ecr 3090930846], length 0
17:28:59.272467 IP 10.8.1.3.54542 > 52.223.200.141.1935: Flags [P.], seq 96202:96611, ack 1, win 501, options [nop,nop,TS val 3090931108 ecr 55037827], length 409
17:28:59.307996 IP 10.8.1.3.54542 > 52.223.200.141.1935: Flags [.], seq 96611:97925, ack 1, win 501, options [nop,nop,TS val 3090931143 ecr 55037827], length 1314
17:28:59.342881 IP 52.223.200.141.1935 > 10.8.1.3.54542: Flags [.], ack 92260, win 126, options [nop,nop,TS val 55037897 ecr 3090930912], length 0
17:28:59.343793 IP 10.8.1.3.54542 > 52.223.200.141.1935: Flags [.], seq 97925:99239, ack 1, win 501, options [nop,nop,TS val 3090931179 ecr 55037897], length 1314
17:28:59.386583 IP 10.8.1.3.54542 > 52.223.200.141.1935: Flags [.], seq 99239:100553, ack 1, win 501, options [nop,nop,TS val 3090931222 ecr 55037897], length 1314
17:28:59.440683 IP 52.223.200.141.1935 > 10.8.1.3.54542: Flags [.], ack 94888, win 126, options [nop,nop,TS val 55037995 ecr 3090930987], length 0
17:28:59.441598 IP 10.8.1.3.54542 > 52.223.200.141.1935: Flags [.], seq 100553:101867, ack 1, win 501, options [nop,nop,TS val 3090931277 ecr 55037995], length 1314
17:28:59.474982 IP 10.8.1.3.54542 > 52.223.200.141.1935: Flags [.], seq 101867:103181, ack 1, win 501, options [nop,nop,TS val 3090931310 ecr 55037995], length 1314
17:28:59.505419 IP 52.223.200.141.1935 > 10.8.1.3.54542: Flags [.], ack 96611, win 126, options [nop,nop,TS val 55038059 ecr 3090931077], length 0
17:28:59.505449 IP 10.8.1.3.54542 > 52.223.200.141.1935: Flags [P.], seq 103181:103591, ack 1, win 501, options [nop,nop,TS val 3090931341 ecr 55038059], length 410
17:28:59.539010 IP 10.8.1.3.54542 > 52.223.200.141.1935: Flags [.], seq 103591:104905, ack 1, win 501, options [nop,nop,TS val 3090931374 ecr 55038059], length 1314
17:28:59.575971 IP 52.223.200.141.1935 > 10.8.1.3.54542: Flags [.], ack 99239, win 126, options [nop,nop,TS val 55038131 ecr 3090931143], length 0
17:28:59.578751 IP 10.8.1.3.54542 > 52.223.200.141.1935: Flags [.], seq 104905:106219, ack 1, win 501, options [nop,nop,TS val 3090931414 ecr 55038131], length 1314
17:28:59.621704 IP 10.8.1.3.54542 > 52.223.200.141.1935: Flags [.], seq 106219:107533, ack 1, win 501, options [nop,nop,TS val 3090931457 ecr 55038131], length 1314
17:28:59.673793 IP 52.223.200.141.1935 > 10.8.1.3.54542: Flags [.], ack 101867, win 126, options [nop,nop,TS val 55038228 ecr 3090931222], length 0
17:28:59.673934 IP 10.8.1.3.54542 > 52.223.200.141.1935: Flags [.], seq 107533:108847, ack 1, win 501, options [nop,nop,TS val 3090931509 ecr 55038228], length 1314
17:28:59.708083 IP 10.8.1.3.54542 > 52.223.200.141.1935: Flags [.], seq 108847:110161, ack 1, win 501, options [nop,nop,TS val 3090931543 ecr 55038228], length 1314
17:28:59.749917 IP 10.8.1.3.54542 > 52.223.200.141.1935: Flags [.], seq 110161:111475, ack 1, win 501, options [nop,nop,TS val 3090931585 ecr 55038228], length 1314
17:28:59.750606 IP 52.223.200.141.1935 > 10.8.1.3.54542: Flags [.], ack 103591, win 126, options [nop,nop,TS val 55038292 ecr 3090931310], length 0
17:28:59.750635 IP 10.8.1.3.54542 > 52.223.200.141.1935: Flags [P.], seq 111475:111498, ack 1, win 501, options [nop,nop,TS val 3090931586 ecr 55038292], length 23
17:28:59.810797 IP 52.223.200.141.1935 > 10.8.1.3.54542: Flags [.], ack 106219, win 126, options [nop,nop,TS val 55038366 ecr 3090931374], length 0
17:28:59.813813 IP 10.8.1.3.54542 > 52.223.200.141.1935: Flags [.], seq 111498:112812, ack 1, win 501, options [nop,nop,TS val 3090931649 ecr 55038366], length 1314
17:28:59.839412 IP 10.8.1.3.54542 > 52.223.200.141.1935: Flags [.], seq 112812:114126, ack 1, win 501, options [nop,nop,TS val 3090931675 ecr 55038366], length 1314
17:28:59.877752 IP 10.8.1.3.54542 > 52.223.200.141.1935: Flags [.], seq 114126:115440, ack 1, win 501, options [nop,nop,TS val 3090931713 ecr 55038366], length 1314
17:28:59.906289 IP 52.223.200.141.1935 > 10.8.1.3.54542: Flags [.], ack 108847, win 126, options [nop,nop,TS val 55038461 ecr 3090931457], length 0
17:28:59.943161 IP 10.8.1.3.54542 > 52.223.200.141.1935: Flags [.], seq 115440:116754, ack 1, win 501, options [nop,nop,TS val 3090931778 ecr 55038461], length 1314
17:28:59.974646 IP 10.8.1.3.54542 > 52.223.200.141.1935: Flags [.], seq 116754:118068, ack 1, win 501, options [nop,nop,TS val 3090931810 ecr 55038461], length 1314
17:28:59.983828 IP 52.223.200.141.1935 > 10.8.1.3.54542: Flags [.], ack 111475, win 126, options [nop,nop,TS val 55038538 ecr 3090931543], length 0
17:28:59.983855 IP 52.223.200.141.1935 > 10.8.1.3.54542: Flags [.], ack 111498, win 126, options [nop,nop,TS val 55038538 ecr 3090931586], length 0
17:28:59.983866 IP 10.8.1.3.54542 > 52.223.200.141.1935: Flags [P.], seq 118068:118378, ack 1, win 501, options [nop,nop,TS val 3090931819 ecr 55038538], length 310
17:29:00.049267 IP 10.8.1.3.54542 > 52.223.200.141.1935: Flags [.], seq 118378:119692, ack 1, win 501, options [nop,nop,TS val 3090931885 ecr 55038538], length 1314
17:29:00.071919 IP 52.223.200.141.1935 > 10.8.1.3.54542: Flags [.], ack 114126, win 126, options [nop,nop,TS val 55038626 ecr 3090931649], length 0
17:29:00.072387 IP 10.8.1.3.54542 > 52.223.200.141.1935: Flags [.], seq 119692:121006, ack 1, win 501, options [nop,nop,TS val 3090931908 ecr 55038626], length 1314
17:29:00.113005 IP 10.8.1.3.54542 > 52.223.200.141.1935: Flags [.], seq 121006:122320, ack 1, win 501, options [nop,nop,TS val 3090931948 ecr 55038626], length 1314
17:29:00.175504 IP 52.223.200.141.1935 > 10.8.1.3.54542: Flags [.], ack 116754, win 126, options [nop,nop,TS val 55038730 ecr 3090931713], length 0
17:29:00.177581 IP 10.8.1.3.54542 > 52.223.200.141.1935: Flags [.], seq 122320:123634, ack 1, win 501, options [nop,nop,TS val 3090932013 ecr 55038730], length 1314
17:29:00.209749 IP 10.8.1.3.54542 > 52.223.200.141.1935: Flags [.], seq 123634:124948, ack 1, win 501, options [nop,nop,TS val 3090932045 ecr 55038730], length 1314
17:29:00.215850 IP 52.223.200.141.1935 > 10.8.1.3.54542: Flags [.], ack 118378, win 126, options [nop,nop,TS val 55038771 ecr 3090931810], length 0
17:29:00.215884 IP 10.8.1.3.54542 > 52.223.200.141.1935: Flags [P.], seq 124948:125359, ack 1, win 501, options [nop,nop,TS val 3090932051 ecr 55038771], length 411
17:29:00.272637 IP 10.8.1.3.54542 > 52.223.200.141.1935: Flags [.], seq 125359:126673, ack 1, win 501, options [nop,nop,TS val 3090932108 ecr 55038771], length 1314
17:29:00.304445 IP 52.223.200.141.1935 > 10.8.1.3.54542: Flags [.], ack 121006, win 126, options [nop,nop,TS val 55038859 ecr 3090931885], length 0
17:29:00.306486 IP 10.8.1.3.54542 > 52.223.200.141.1935: Flags [.], seq 126673:127987, ack 1, win 501, options [nop,nop,TS val 3090932142 ecr 55038859], length 1314
17:29:00.348151 IP 10.8.1.3.54542 > 52.223.200.141.1935: Flags [.], seq 127987:129301, ack 1, win 501, options [nop,nop,TS val 3090932183 ecr 55038859], length 1314
17:29:00.405925 IP 52.223.200.141.1935 > 10.8.1.3.54542: Flags [.], ack 122320, win 126, options [nop,nop,TS val 55038960 ecr 3090931948], length 0
17:29:00.412431 IP 10.8.1.3.54542 > 52.223.200.141.1935: Flags [.], seq 129301:130615, ack 1, win 501, options [nop,nop,TS val 3090932248 ecr 55038960], length 1314
17:29:00.442112 IP 52.223.200.141.1935 > 10.8.1.3.54542: Flags [.], ack 124948, win 126, options [nop,nop,TS val 55038997 ecr 3090932013], length 0
17:29:00.443177 IP 10.8.1.3.54542 > 52.223.200.141.1935: Flags [.], seq 130615:131929, ack 1, win 501, options [nop,nop,TS val 3090932278 ecr 55038997], length 1314
17:29:00.448010 IP 52.223.200.141.1935 > 10.8.1.3.54542: Flags [.], ack 125359, win 126, options [nop,nop,TS val 55039003 ecr 3090932051], length 0
17:29:00.448042 IP 10.8.1.3.54542 > 52.223.200.141.1935: Flags [P.], seq 131929:132331, ack 1, win 501, options [nop,nop,TS val 3090932283 ecr 55039003], length 402
17:29:00.507367 IP 10.8.1.3.54542 > 52.223.200.141.1935: Flags [.], seq 132331:133645, ack 1, win 501, options [nop,nop,TS val 3090932343 ecr 55039003], length 1314
17:29:00.538681 IP 52.223.200.141.1935 > 10.8.1.3.54542: Flags [.], ack 127987, win 126, options [nop,nop,TS val 55039093 ecr 3090932108], length 0
17:29:00.542070 IP 10.8.1.3.54542 > 52.223.200.141.1935: Flags [.], seq 133645:134959, ack 1, win 501, options [nop,nop,TS val 3090932377 ecr 55039093], length 1314
17:29:00.584002 IP 10.8.1.3.54542 > 52.223.200.141.1935: Flags [.], seq 134959:136273, ack 1, win 501, options [nop,nop,TS val 3090932419 ecr 55039093], length 1314
17:29:00.644708 IP 52.223.200.141.1935 > 10.8.1.3.54542: Flags [.], ack 130615, win 126, options [nop,nop,TS val 55039199 ecr 3090932183], length 0
17:29:00.648311 IP 10.8.1.3.54542 > 52.223.200.141.1935: Flags [.], seq 136273:137587, ack 1, win 501, options [nop,nop,TS val 3090932484 ecr 55039199], length 1314
17:29:00.675819 IP 10.8.1.3.54542 > 52.223.200.141.1935: Flags [.], seq 137587:138901, ack 1, win 501, options [nop,nop,TS val 3090932511 ecr 55039199], length 1314
17:29:00.680063 IP 52.223.200.141.1935 > 10.8.1.3.54542: Flags [.], ack 132331, win 126, options [nop,nop,TS val 55039235 ecr 3090932278], length 0
17:29:00.680095 IP 10.8.1.3.54542 > 52.223.200.141.1935: Flags [P.], seq 138901:139303, ack 1, win 501, options [nop,nop,TS val 3090932515 ecr 55039235], length 402
17:29:00.742791 IP 10.8.1.3.54542 > 52.223.200.141.1935: Flags [.], seq 139303:140617, ack 1, win 501, options [nop,nop,TS val 3090932578 ecr 55039235], length 1314
17:29:00.774583 IP 52.223.200.141.1935 > 10.8.1.3.54542: Flags [.], ack 134959, win 126, options [nop,nop,TS val 55039329 ecr 3090932343], length 0
17:29:00.776779 IP 10.8.1.3.54542 > 52.223.200.141.1935: Flags [.], seq 140617:141931, ack 1, win 501, options [nop,nop,TS val 3090932612 ecr 55039329], length 1314
17:29:00.809362 IP 10.8.1.3.54542 > 52.223.200.141.1935: Flags [.], seq 141931:143245, ack 1, win 501, options [nop,nop,TS val 3090932645 ecr 55039329], length 1314
17:29:00.880704 IP 52.223.200.141.1935 > 10.8.1.3.54542: Flags [.], ack 137587, win 126, options [nop,nop,TS val 55039435 ecr 3090932419], length 0
17:29:00.884191 IP 10.8.1.3.54542 > 52.223.200.141.1935: Flags [.], seq 143245:144559, ack 1, win 501, options [nop,nop,TS val 3090932719 ecr 55039435], length 1314
17:29:00.909871 IP 10.8.1.3.54542 > 52.223.200.141.1935: Flags [.], seq 144559:145873, ack 1, win 501, options [nop,nop,TS val 3090932745 ecr 55039435], length 1314
17:29:00.912504 IP 52.223.200.141.1935 > 10.8.1.3.54542: Flags [.], ack 139303, win 126, options [nop,nop,TS val 55039467 ecr 3090932511], length 0
17:29:00.912538 IP 10.8.1.3.54542 > 52.223.200.141.1935: Flags [P.], seq 145873:146284, ack 1, win 501, options [nop,nop,TS val 3090932748 ecr 55039467], length 411
17:29:00.974095 IP 10.8.1.3.54542 > 52.223.200.141.1935: Flags [.], seq 146284:147598, ack 1, win 501, options [nop,nop,TS val 3090932809 ecr 55039467], length 1314
17:29:01.009311 IP 52.223.200.141.1935 > 10.8.1.3.54542: Flags [.], ack 141931, win 126, options [nop,nop,TS val 55039564 ecr 3090932578], length 0
17:29:01.012235 IP 10.8.1.3.54542 > 52.223.200.141.1935: Flags [.], seq 147598:148912, ack 1, win 501, options [nop,nop,TS val 3090932848 ecr 55039564], length 1314
17:29:01.042315 IP 10.8.1.3.54542 > 52.223.200.141.1935: Flags [.], seq 148912:150226, ack 1, win 501, options [nop,nop,TS val 3090932878 ecr 55039564], length 1314
17:29:01.101992 IP 52.223.200.141.1935 > 10.8.1.3.54542: Flags [.], ack 143245, win 126, options [nop,nop,TS val 55039656 ecr 3090932645], length 0
17:29:01.119537 IP 10.8.1.3.54542 > 52.223.200.141.1935: Flags [.], seq 150226:151540, ack 1, win 501, options [nop,nop,TS val 3090932955 ecr 55039656], length 1314
17:29:01.142344 IP 52.223.200.141.1935 > 10.8.1.3.54542: Flags [.], ack 145873, win 126, options [nop,nop,TS val 55039697 ecr 3090932719], length 0
17:29:01.143198 IP 10.8.1.3.54542 > 52.223.200.141.1935: Flags [.], seq 151540:152854, ack 1, win 501, options [nop,nop,TS val 3090932979 ecr 55039697], length 1314
17:29:01.145035 IP 52.223.200.141.1935 > 10.8.1.3.54542: Flags [.], ack 146284, win 126, options [nop,nop,TS val 55039699 ecr 3090932748], length 0
17:29:01.145062 IP 10.8.1.3.54542 > 52.223.200.141.1935: Flags [P.], seq 152854:153260, ack 1, win 501, options [nop,nop,TS val 3090932980 ecr 55039699], length 406
17:29:01.208152 IP 10.8.1.3.54542 > 52.223.200.141.1935: Flags [.], seq 153260:154574, ack 1, win 501, options [nop,nop,TS val 3090933043 ecr 55039699], length 1314
17:29:01.244655 IP 52.223.200.141.1935 > 10.8.1.3.54542: Flags [.], ack 148912, win 126, options [nop,nop,TS val 55039799 ecr 3090932809], length 0
17:29:01.248281 IP 10.8.1.3.54542 > 52.223.200.141.1935: Flags [.], seq 154574:155888, ack 1, win 501, options [nop,nop,TS val 3090933084 ecr 55039799], length 1314
17:29:01.275682 IP 10.8.1.3.54542 > 52.223.200.141.1935: Flags [.], seq 155888:157202, ack 1, win 501, options [nop,nop,TS val 3090933111 ecr 55039799], length 1314
17:29:01.342105 IP 10.8.1.3.54542 > 52.223.200.141.1935: Flags [.], seq 157202:158516, ack 1, win 501, options [nop,nop,TS val 3090933177 ecr 55039799], length 1314
17:29:01.352126 IP 52.223.200.141.1935 > 10.8.1.3.54542: Flags [.], ack 151540, win 126, options [nop,nop,TS val 55039907 ecr 3090932878], length 0
17:29:01.376783 IP 10.8.1.3.54542 > 52.223.200.141.1935: Flags [.], seq 158516:159830, ack 1, win 501, options [nop,nop,TS val 3090933212 ecr 55039907], length 1314
17:29:01.377195 IP 52.223.200.141.1935 > 10.8.1.3.54542: Flags [.], ack 153260, win 126, options [nop,nop,TS val 55039932 ecr 3090932979], length 0
17:29:01.377237 IP 10.8.1.3.54542 > 52.223.200.141.1935: Flags [P.], seq 159830:160223, ack 1, win 501, options [nop,nop,TS val 3090933213 ecr 55039932], length 393
17:29:01.440455 IP 10.8.1.3.54542 > 52.223.200.141.1935: Flags [.], seq 160223:161537, ack 1, win 501, options [nop,nop,TS val 3090933276 ecr 55039932], length 1314
17:29:01.480523 IP 52.223.200.141.1935 > 10.8.1.3.54542: Flags [.], ack 155888, win 126, options [nop,nop,TS val 55040035 ecr 3090933043], length 0
17:29:01.483328 IP 10.8.1.3.54542 > 52.223.200.141.1935: Flags [.], seq 161537:162851, ack 1, win 501, options [nop,nop,TS val 3090933319 ecr 55040035], length 1314
17:29:01.510169 IP 10.8.1.3.54542 > 52.223.200.141.1935: Flags [.], seq 162851:164165, ack 1, win 501, options [nop,nop,TS val 3090933345 ecr 55040035], length 1314
17:29:01.569841 IP 52.223.200.141.1935 > 10.8.1.3.54542: Flags [.], ack 157202, win 126, options [nop,nop,TS val 55040124 ecr 3090933111], length 0
17:29:01.573885 IP 10.8.1.3.54542 > 52.223.200.141.1935: Flags [.], seq 164165:165479, ack 1, win 501, options [nop,nop,TS val 3090933409 ecr 55040124], length 1314
17:29:01.609211 IP 52.223.200.141.1935 > 10.8.1.3.54542: Flags [.], ack 159830, win 126, options [nop,nop,TS val 55040164 ecr 3090933177], length 0
17:29:01.609234 IP 52.223.200.141.1935 > 10.8.1.3.54542: Flags [.], ack 160223, win 126, options [nop,nop,TS val 55040164 ecr 3090933213], length 0
17:29:01.609244 IP 10.8.1.3.54542 > 52.223.200.141.1935: Flags [P.], seq 165479:166356, ack 1, win 501, options [nop,nop,TS val 3090933445 ecr 55040164], length 877
17:29:01.654593 IP 10.8.1.3.54542 > 52.223.200.141.1935: Flags [.], seq 166356:167670, ack 1, win 501, options [nop,nop,TS val 3090933490 ecr 55040164], length 1314
17:29:01.675862 IP 10.8.1.3.54542 > 52.223.200.141.1935: Flags [.], seq 167670:168984, ack 1, win 501, options [nop,nop,TS val 3090933511 ecr 55040164], length 1314
17:29:01.715611 IP 52.223.200.141.1935 > 10.8.1.3.54542: Flags [.], ack 162851, win 126, options [nop,nop,TS val 55040270 ecr 3090933276], length 0
17:29:01.740095 IP 10.8.1.3.54542 > 52.223.200.141.1935: Flags [.], seq 168984:170298, ack 1, win 501, options [nop,nop,TS val 3090933575 ecr 55040270], length 1314
17:29:01.783095 IP 10.8.1.3.54542 > 52.223.200.141.1935: Flags [.], seq 170298:171612, ack 1, win 501, options [nop,nop,TS val 3090933618 ecr 55040270], length 1314
17:29:01.804876 IP 10.8.1.3.54542 > 52.223.200.141.1935: Flags [.], seq 171612:172926, ack 1, win 501, options [nop,nop,TS val 3090933640 ecr 55040270], length 1314
17:29:01.806125 IP 52.223.200.141.1935 > 10.8.1.3.54542: Flags [.], ack 165479, win 126, options [nop,nop,TS val 55040361 ecr 3090933345], length 0
17:29:01.841258 IP 52.223.200.141.1935 > 10.8.1.3.54542: Flags [.], ack 166356, win 126, options [nop,nop,TS val 55040396 ecr 3090933445], length 0
17:29:01.841283 IP 10.8.1.3.54542 > 52.223.200.141.1935: Flags [P.], seq 172926:173337, ack 1, win 501, options [nop,nop,TS val 3090933677 ecr 55040396], length 411
17:29:01.868794 IP 10.8.1.3.54542 > 52.223.200.141.1935: Flags [.], seq 173337:174651, ack 1, win 501, options [nop,nop,TS val 3090933704 ecr 55040396], length 1314
17:29:01.907349 IP 10.8.1.3.54542 > 52.223.200.141.1935: Flags [.], seq 174651:175965, ack 1, win 501, options [nop,nop,TS val 3090933743 ecr 55040396], length 1314
17:29:01.908238 IP 52.223.200.141.1935 > 10.8.1.3.54542: Flags [.], ack 168984, win 126, options [nop,nop,TS val 55040463 ecr 3090933490], length 0
17:29:01.954340 IP 10.8.1.3.54542 > 52.223.200.141.1935: Flags [.], seq 175965:177279, ack 1, win 501, options [nop,nop,TS val 3090933790 ecr 55040463], length 1314
17:29:02.007170 IP 10.8.1.3.54542 > 52.223.200.141.1935: Flags [.], seq 177279:178593, ack 1, win 501, options [nop,nop,TS val 3090933842 ecr 55040463], length 1314
17:29:02.015244 IP 52.223.200.141.1935 > 10.8.1.3.54542: Flags [.], ack 171612, win 126, options [nop,nop,TS val 55040570 ecr 3090933575], length 0
17:29:02.039625 IP 10.8.1.3.54542 > 52.223.200.141.1935: Flags [.], seq 178593:179907, ack 1, win 501, options [nop,nop,TS val 3090933875 ecr 55040570], length 1314
17:29:02.073192 IP 52.223.200.141.1935 > 10.8.1.3.54542: Flags [.], ack 173337, win 126, options [nop,nop,TS val 55040628 ecr 3090933640], length 0
17:29:02.073207 IP 10.8.1.3.54542 > 52.223.200.141.1935: Flags [P.], seq 179907:181151, ack 1, win 501, options [nop,nop,TS val 3090933909 ecr 55040628], length 1244
17:29:02.140615 IP 52.223.200.141.1935 > 10.8.1.3.54542: Flags [.], ack 175965, win 126, options [nop,nop,TS val 55040695 ecr 3090933704], length 0
17:29:02.143036 IP 10.8.1.3.54542 > 52.223.200.141.1935: Flags [.], seq 181151:182465, ack 1, win 501, options [nop,nop,TS val 3090933978 ecr 55040695], length 1314
17:29:02.176753 IP 10.8.1.3.54542 > 52.223.200.141.1935: Flags [.], seq 182465:183779, ack 1, win 501, options [nop,nop,TS val 3090934012 ecr 55040695], length 1314
17:29:02.210041 IP 10.8.1.3.54542 > 52.223.200.141.1935: Flags [.], seq 183779:185093, ack 1, win 501, options [nop,nop,TS val 3090934045 ecr 55040695], length 1314
17:29:02.239523 IP 52.223.200.141.1935 > 10.8.1.3.54542: Flags [.], ack 178593, win 126, options [nop,nop,TS val 55040794 ecr 3090933790], length 0
17:29:02.275062 IP 10.8.1.3.54542 > 52.223.200.141.1935: Flags [.], seq 185093:186407, ack 1, win 501, options [nop,nop,TS val 3090934110 ecr 55040794], length 1314
17:29:02.305311 IP 52.223.200.141.1935 > 10.8.1.3.54542: Flags [.], ack 181151, win 126, options [nop,nop,TS val 55040860 ecr 3090933875], length 0
17:29:02.305353 IP 10.8.1.3.54542 > 52.223.200.141.1935: Flags [P.], seq 186407:187280, ack 1, win 501, options [nop,nop,TS val 3090934141 ecr 55040860], length 873
17:29:02.339460 IP 10.8.1.3.54542 > 52.223.200.141.1935: Flags [.], seq 187280:188594, ack 1, win 501, options [nop,nop,TS val 3090934175 ecr 55040860], length 1314
17:29:02.373512 IP 10.8.1.3.54542 > 52.223.200.141.1935: Flags [.], seq 188594:189908, ack 1, win 501, options [nop,nop,TS val 3090934209 ecr 55040860], length 1314
17:29:02.408915 IP 52.223.200.141.1935 > 10.8.1.3.54542: Flags [.], ack 183779, win 126, options [nop,nop,TS val 55040963 ecr 3090933978], length 0
