17:51:14.182498 IP 52.223.200.211.1935 > 10.8.3.3.47998: Flags [.], ack 2648587128, win 126, options [nop,nop,TS val 3581489263 ecr 3845450045], length 0
17:51:14.189737 IP 52.223.200.211.1935 > 10.8.3.3.47998: Flags [.], ack 2036, win 126, options [nop,nop,TS val 3581489271 ecr 3845450115], length 0
17:51:14.189761 IP 10.8.3.3.47998 > 52.223.200.211.1935: Flags [P.], seq 13862:15132, ack 0, win 501, options [nop,nop,TS val 3845450578 ecr 3581489271], length 1270
17:51:14.227803 IP 10.8.3.3.47998 > 52.223.200.211.1935: Flags [.], seq 15132:16446, ack 0, win 501, options [nop,nop,TS val 3845450616 ecr 3581489271], length 1314
17:51:14.257605 IP 10.8.3.3.47998 > 52.223.200.211.1935: Flags [.], seq 16446:17760, ack 0, win 501, options [nop,nop,TS val 3845450646 ecr 3581489271], length 1314
17:51:14.288191 IP 52.223.200.211.1935 > 10.8.3.3.47998: Flags [.], ack 4664, win 126, options [nop,nop,TS val 3581489369 ecr 3845450182], length 0
17:51:14.313208 IP 10.8.3.3.47998 > 52.223.200.211.1935: Flags [.], seq 17760:19074, ack 0, win 501, options [nop,nop,TS val 3845450702 ecr 3581489369], length 1314
17:51:14.360340 IP 10.8.3.3.47998 > 52.223.200.211.1935: Flags [.], seq 19074:20388, ack 0, win 501, options [nop,nop,TS val 3845450749 ecr 3581489369], length 1314
17:51:14.390328 IP 52.223.200.211.1935 > 10.8.3.3.47998: Flags [.], ack 7292, win 126, options [nop,nop,TS val 3581489471 ecr 3845450253], length 0
17:51:14.398414 IP 10.8.3.3.47998 > 52.223.200.211.1935: Flags [.], seq 20388:21702, ack 0, win 501, options [nop,nop,TS val 3845450787 ecr 3581489471], length 1314
17:51:14.440918 IP 10.8.3.3.47998 > 52.223.200.211.1935: Flags [.], seq 21702:23016, ack 0, win 501, options [nop,nop,TS val 3845450829 ecr 3581489471], length 1314
17:51:14.453980 IP 52.223.200.211.1935 > 10.8.3.3.47998: Flags [.], ack 9920, win 126, options [nop,nop,TS val 3581489535 ecr 3845450346], length 0
17:51:14.493295 IP 10.8.3.3.47998 > 52.223.200.211.1935: Flags [.], seq 23016:24330, ack 0, win 501, options [nop,nop,TS val 3845450882 ecr 3581489535], length 1314
17:51:14.526566 IP 10.8.3.3.47998 > 52.223.200.211.1935: Flags [.], seq 24330:25644, ack 0, win 501, options [nop,nop,TS val 3845450915 ecr 3581489535], length 1314
17:51:14.561141 IP 52.223.200.211.1935 > 10.8.3.3.47998: Flags [.], ack 12548, win 126, options [nop,nop,TS val 3581489642 ecr 3845450448], length 0
17:51:14.569172 IP 10.8.3.3.47998 > 52.223.200.211.1935: Flags [.], seq 25644:26958, ack 0, win 501, options [nop,nop,TS val 3845450958 ecr 3581489642], length 1314
17:51:14.633034 IP 10.8.3.3.47998 > 52.223.200.211.1935: Flags [.], seq 26958:28272, ack 0, win 501, options [nop,nop,TS val 3845451021 ecr 3581489642], length 1314
17:51:14.650979 IP 52.223.200.211.1935 > 10.8.3.3.47998: Flags [.], ack 15132, win 126, options [nop,nop,TS val 3581489732 ecr 3845450511], length 0
17:51:14.650987 IP 10.8.3.3.47998 > 52.223.200.211.1935: Flags [P.], seq 28272:28994, ack 0, win 501, options [nop,nop,TS val 3845451039 ecr 3581489732], length 722
17:51:14.696886 IP 10.8.3.3.47998 > 52.223.200.211.1935: Flags [.], seq 28994:30308, ack 0, win 501, options [nop,nop,TS val 3845451085 ecr 3581489732], length 1314
17:51:14.718952 IP 52.223.200.211.1935 > 10.8.3.3.47998: Flags [.], ack 17760, win 126, options [nop,nop,TS val 3581489800 ecr 3845450616], length 0
17:51:14.725987 IP 10.8.3.3.47998 > 52.223.200.211.1935: Flags [.], seq 30308:31622, ack 0, win 501, options [nop,nop,TS val 3845451114 ecr 3581489800], length 1314
17:51:14.761168 IP 10.8.3.3.47998 > 52.223.200.211.1935: Flags [.], seq 31622:32936, ack 0, win 501, options [nop,nop,TS val 3845451150 ecr 3581489800], length 1314
17:51:14.821885 IP 52.223.200.211.1935 > 10.8.3.3.47998: Flags [.], ack 20388, win 126, options [nop,nop,TS val 3581489903 ecr 3845450702], length 0
17:51:14.824798 IP 10.8.3.3.47998 > 52.223.200.211.1935: Flags [.], seq 32936:34250, ack 0, win 501, options [nop,nop,TS val 3845451213 ecr 3581489903], length 1314
17:51:14.858608 IP 10.8.3.3.47998 > 52.223.200.211.1935: Flags [.], seq 34250:35564, ack 0, win 501, options [nop,nop,TS val 3845451247 ecr 3581489903], length 1314
17:51:14.893310 IP 10.8.3.3.47998 > 52.223.200.211.1935: Flags [.], seq 35564:36878, ack 0, win 501, options [nop,nop,TS val 3845451282 ecr 3581489903], length 1314
17:51:14.902543 IP 52.223.200.211.1935 > 10.8.3.3.47998: Flags [.], ack 23016, win 126, options [nop,nop,TS val 3581489983 ecr 3845450787], length 0
17:51:14.958042 IP 10.8.3.3.47998 > 52.223.200.211.1935: Flags [.], seq 36878:38192, ack 0, win 501, options [nop,nop,TS val 3845451346 ecr 3581489983], length 1314
17:51:14.987930 IP 52.223.200.211.1935 > 10.8.3.3.47998: Flags [.], ack 25644, win 126, options [nop,nop,TS val 3581490069 ecr 3845450882], length 0
17:51:14.996143 IP 10.8.3.3.47998 > 52.223.200.211.1935: Flags [.], seq 38192:39506, ack 0, win 501, options [nop,nop,TS val 3845451385 ecr 3581490069], length 1314
17:51:15.024728 IP 10.8.3.3.47998 > 52.223.200.211.1935: Flags [.], seq 39506:40820, ack 0, win 501, options [nop,nop,TS val 3845451413 ecr 3581490069], length 1314
17:51:15.089307 IP 10.8.3.3.47998 > 52.223.200.211.1935: Flags [.], seq 40820:42134, ack 0, win 501, options [nop,nop,TS val 3845451478 ecr 3581490069], length 1314
17:51:15.094366 IP 52.223.200.211.1935 > 10.8.3.3.47998: Flags [.], ack 28272, win 126, options [nop,nop,TS val 3581490175 ecr 3845450958], length 0
17:51:15.112008 IP 52.223.200.211.1935 > 10.8.3.3.47998: Flags [.], ack 28994, win 126, options [nop,nop,TS val 3581490193 ecr 3845451039], length 0
17:51:15.112022 IP 10.8.3.3.47998 > 52.223.200.211.1935: Flags [P.], seq 42134:42938, ack 0, win 501, options [nop,nop,TS val 3845451500 ecr 3581490193], length 804
17:51:15.166141 IP 10.8.3.3.47998 > 52.223.200.211.1935: Flags [.], seq 42938:44252, ack 0, win 501, options [nop,nop,TS val 3845451555 ecr 3581490193], length 1314
17:51:15.187273 IP 52.223.200.211.1935 > 10.8.3.3.47998: Flags [.], ack 31622, win 126, options [nop,nop,TS val 3581490268 ecr 3845451085], length 0
17:51:15.189207 IP 10.8.3.3.47998 > 52.223.200.211.1935: Flags [.], seq 44252:45566, ack 0, win 501, options [nop,nop,TS val 3845451578 ecr 3581490268], length 1314
17:51:15.230031 IP 10.8.3.3.47998 > 52.223.200.211.1935: Flags [.], seq 45566:46880, ack 0, win 501, options [nop,nop,TS val 3845451618 ecr 3581490268], length 1314
17:51:15.285999 IP 52.223.200.211.1935 > 10.8.3.3.47998: Flags [.], ack 34250, win 126, options [nop,nop,TS val 3581490367 ecr 3845451150], length 0
17:51:15.294278 IP 10.8.3.3.47998 > 52.223.200.211.1935: Flags [.], seq 46880:48194, ack 0, win 501, options [nop,nop,TS val 3845451683 ecr 3581490367], length 1314
17:51:15.326633 IP 10.8.3.3.47998 > 52.223.200.211.1935: Flags [.], seq 48194:49508, ack 0, win 501, options [nop,nop,TS val 3845451715 ecr 3581490367], length 1314
17:51:15.354794 IP 52.223.200.211.1935 > 10.8.3.3.47998: Flags [.], ack 36878, win 126, options [nop,nop,TS val 3581490436 ecr 3845451247], length 0
17:51:15.359995 IP 10.8.3.3.47998 > 52.223.200.211.1935: Flags [.], seq 49508:50822, ack 0, win 501, options [nop,nop,TS val 3845451748 ecr 3581490436], length 1314
17:51:15.423970 IP 10.8.3.3.47998 > 52.223.200.211.1935: Flags [.], seq 50822:52136, ack 0, win 501, options [nop,nop,TS val 3845451812 ecr 3581490436], length 1314
17:51:15.457468 IP 52.223.200.211.1935 > 10.8.3.3.47998: Flags [.], ack 39506, win 126, options [nop,nop,TS val 3581490538 ecr 3845451346], length 0
17:51:15.465379 IP 10.8.3.3.47998 > 52.223.200.211.1935: Flags [.], seq 52136:53450, ack 0, win 501, options [nop,nop,TS val 3845451854 ecr 3581490538], length 1314
17:51:15.489673 IP 10.8.3.3.47998 > 52.223.200.211.1935: Flags [.], seq 53450:54764, ack 0, win 501, options [nop,nop,TS val 3845451878 ecr 3581490538], length 1314
17:51:15.550747 IP 52.223.200.211.1935 > 10.8.3.3.47998: Flags [.], ack 42134, win 126, options [nop,nop,TS val 3581490631 ecr 3845451413], length 0
17:51:15.560432 IP 10.8.3.3.47998 > 52.223.200.211.1935: Flags [.], seq 54764:56078, ack 0, win 501, options [nop,nop,TS val 3845451949 ecr 3581490631], length 1314
17:51:15.573322 IP 52.223.200.211.1935 > 10.8.3.3.47998: Flags [.], ack 42938, win 126, options [nop,nop,TS val 3581490654 ecr 3845451500], length 0
17:51:15.573333 IP 10.8.3.3.47998 > 52.223.200.211.1935: Flags [P.], seq 56078:56890, ack 0, win 501, options [nop,nop,TS val 3845451962 ecr 3581490654], length 812
17:51:15.622978 IP 10.8.3.3.47998 > 52.223.200.211.1935: Flags [.], seq 56890:58204, ack 0, win 501, options [nop,nop,TS val 3845452011 ecr 3581490654], length 1314
17:51:15.650574 IP 52.223.200.211.1935 > 10.8.3.3.47998: Flags [.], ack 45566, win 126, options [nop,nop,TS val 3581490731 ecr 3845451555], length 0
17:51:15.659869 IP 10.8.3.3.47998 > 52.223.200.211.1935: Flags [.], seq 58204:59518, ack 0, win 501, options [nop,nop,TS val 3845452048 ecr 3581490731], length 1314
17:51:15.700111 IP 10.8.3.3.47998 > 52.223.200.211.1935: Flags [.], seq 59518:60832, ack 0, win 501, options [nop,nop,TS val 3845452088 ecr 3581490731], length 1314
17:51:15.738697 IP 52.223.200.211.1935 > 10.8.3.3.47998: Flags [.], ack 46880, win 126, options [nop,nop,TS val 3581490819 ecr 3845451618], length 0
17:51:15.764333 IP 10.8.3.3.47998 > 52.223.200.211.1935: Flags [.], seq 60832:62146, ack 0, win 501, options [nop,nop,TS val 3845452153 ecr 3581490819], length 1314
17:51:15.788150 IP 52.223.200.211.1935 > 10.8.3.3.47998: Flags [.], ack 49508, win 126, options [nop,nop,TS val 3581490869 ecr 3845451683], length 0
17:51:15.789763 IP 10.8.3.3.47998 > 52.223.200.211.1935: Flags [.], seq 62146:63460, ack 0, win 501, options [nop,nop,TS val 3845452178 ecr 3581490869], length 1314
17:51:15.827944 IP 10.8.3.3.47998 > 52.223.200.211.1935: Flags [.], seq 63460:64774, ack 0, win 501, options [nop,nop,TS val 3845452216 ecr 3581490869], length 1314
17:51:15.885267 IP 52.223.200.211.1935 > 10.8.3.3.47998: Flags [.], ack 52136, win 126, options [nop,nop,TS val 3581490966 ecr 3845451748], length 0
17:51:15.893288 IP 10.8.3.3.47998 > 52.223.200.211.1935: Flags [.], seq 64774:66088, ack 0, win 501, options [nop,nop,TS val 3845452282 ecr 3581490966], length 1314
17:51:15.926573 IP 10.8.3.3.47998 > 52.223.200.211.1935: Flags [.], seq 66088:67402, ack 0, win 501, options [nop,nop,TS val 3845452315 ecr 3581490966], length 1314
17:51:15.950942 IP 52.223.200.211.1935 > 10.8.3.3.47998: Flags [.], ack 54764, win 126, options [nop,nop,TS val 3581491032 ecr 3845451854], length 0
17:51:15.958308 IP 10.8.3.3.47998 > 52.223.200.211.1935: Flags [.], seq 67402:68716, ack 0, win 501, options [nop,nop,TS val 3845452347 ecr 3581491032], length 1314
17:51:16.022670 IP 10.8.3.3.47998 > 52.223.200.211.1935: Flags [.], seq 68716:70030, ack 0, win 501, options [nop,nop,TS val 3845452411 ecr 3581491032], length 1314
17:51:16.034332 IP 52.223.200.211.1935 > 10.8.3.3.47998: Flags [.], ack 56890, win 126, options [nop,nop,TS val 3581491115 ecr 3845451949], length 0
17:51:16.034348 IP 10.8.3.3.47998 > 52.223.200.211.1935: Flags [P.], seq 70030:70747, ack 0, win 501, options [nop,nop,TS val 3845452423 ecr 3581491115], length 717
17:51:16.093293 IP 10.8.3.3.47998 > 52.223.200.211.1935: Flags [.], seq 70747:72061, ack 0, win 501, options [nop,nop,TS val 3845452482 ecr 3581491115], length 1314
17:51:16.121286 IP 52.223.200.211.1935 > 10.8.3.3.47998: Flags [.], ack 59518, win 126, options [nop,nop,TS val 3581491202 ecr 3845452011], length 0
17:51:16.127521 IP 10.8.3.3.47998 > 52.223.200.211.1935: Flags [.], seq 72061:73375, ack 0, win 501, options [nop,nop,TS val 3845452516 ecr 3581491202], length 1314
17:51:16.159895 IP 10.8.3.3.47998 > 52.223.200.211.1935: Flags [.], seq 73375:74689, ack 0, win 501, options [nop,nop,TS val 3845452548 ecr 3581491202], length 1314
17:51:16.225731 IP 52.223.200.211.1935 > 10.8.3.3.47998: Flags [.], ack 62146, win 126, options [nop,nop,TS val 3581491307 ecr 3845452088], length 0
17:51:16.234598 IP 10.8.3.3.47998 > 52.223.200.211.1935: Flags [.], seq 74689:76003, ack 0, win 501, options [nop,nop,TS val 3845452623 ecr 3581491307], length 1314
17:51:16.258767 IP 10.8.3.3.47998 > 52.223.200.211.1935: Flags [.], seq 76003:77317, ack 0, win 501, options [nop,nop,TS val 3845452647 ecr 3581491307], length 1314
17:51:16.289421 IP 52.223.200.211.1935 > 10.8.3.3.47998: Flags [.], ack 64774, win 126, options [nop,nop,TS val 3581491370 ecr 3845452178], length 0
17:51:16.298816 IP 10.8.3.3.47998 > 52.223.200.211.1935: Flags [.], seq 77317:78631, ack 0, win 501, options [nop,nop,TS val 3845452687 ecr 3581491370], length 1314
17:51:16.362814 IP 10.8.3.3.47998 > 52.223.200.211.1935: Flags [.], seq 78631:79945, ack 0, win 501, options [nop,nop,TS val 3845452751 ecr 3581491370], length 1314
17:51:16.387737 IP 52.223.200.211.1935 > 10.8.3.3.47998: Flags [.], ack 67402, win 126, options [nop,nop,TS val 3581491469 ecr 3845452282], length 0
17:51:16.389130 IP 10.8.3.3.47998 > 52.223.200.211.1935: Flags [.], seq 79945:81259, ack 0, win 501, options [nop,nop,TS val 3845452778 ecr 3581491469], length 1314
17:51:16.426477 IP 10.8.3.3.47998 > 52.223.200.211.1935: Flags [.], seq 81259:82573, ack 0, win 501, options [nop,nop,TS val 3845452815 ecr 3581491469], length 1314
17:51:16.484224 IP 52.223.200.211.1935 > 10.8.3.3.47998: Flags [.], ack 70030, win 126, options [nop,nop,TS val 3581491565 ecr 3845452347], length 0
17:51:16.493472 IP 10.8.3.3.47998 > 52.223.200.211.1935: Flags [.], seq 82573:83887, ack 0, win 501, options [nop,nop,TS val 3845452882 ecr 3581491565], length 1314
17:51:16.495377 IP 52.223.200.211.1935 > 10.8.3.3.47998: Flags [.], ack 70747, win 126, options [nop,nop,TS val 3581491576 ecr 3845452423], length 0
17:51:16.495411 IP 10.8.3.3.47998 > 52.223.200.211.1935: Flags [P.], seq 83887:84686, ack 0, win 501, options [nop,nop,TS val 3845452884 ecr 3581491576], length 799
17:51:16.555728 IP 10.8.3.3.47998 > 52.223.200.211.1935: Flags [.], seq 84686:86000, ack 0, win 501, options [nop,nop,TS val 3845452944 ecr 3581491576], length 1314
17:51:16.589087 IP 52.223.200.211.1935 > 10.8.3.3.47998: Flags [.], ack 73375, win 126, options [nop,nop,TS val 3581491670 ecr 3845452482], length 0
17:51:16.597374 IP 10.8.3.3.47998 > 52.223.200.211.1935: Flags [.], seq 86000:87314, ack 0, win 501, options [nop,nop,TS val 3845452986 ecr 3581491670], length 1314
17:51:16.625692 IP 10.8.3.3.47998 > 52.223.200.211.1935: Flags [.], seq 87314:88628, ack 0, win 501, options [nop,nop,TS val 3845453014 ecr 3581491670], length 1314
17:51:16.690564 IP 10.8.3.3.47998 > 52.223.200.211.1935: Flags [.], seq 88628:89942, ack 0, win 501, options [nop,nop,TS val 3845453079 ecr 3581491670], length 1314
17:51:16.694528 IP 52.223.200.211.1935 > 10.8.3.3.47998: Flags [.], ack 74689, win 126, options [nop,nop,TS val 3581491775 ecr 3845452548], length 0
17:51:16.720029 IP 52.223.200.211.1935 > 10.8.3.3.47998: Flags [.], ack 77317, win 126, options [nop,nop,TS val 3581491801 ecr 3845452623], length 0
17:51:16.725589 IP 10.8.3.3.47998 > 52.223.200.211.1935: Flags [.], seq 89942:91256, ack 0, win 501, options [nop,nop,TS val 3845453114 ecr 3581491801], length 1314
17:51:16.768152 IP 10.8.3.3.47998 > 52.223.200.211.1935: Flags [.], seq 91256:92570, ack 0, win 501, options [nop,nop,TS val 3845453157 ecr 3581491801], length 1314
17:51:16.824167 IP 52.223.200.211.1935 > 10.8.3.3.47998: Flags [.], ack 79945, win 126, options [nop,nop,TS val 3581491905 ecr 3845452687], length 0
17:51:16.831987 IP 10.8.3.3.47998 > 52.223.200.211.1935: Flags [.], seq 92570:93884, ack 0, win 501, options [nop,nop,TS val 3845453220 ecr 3581491905], length 1314
17:51:16.859874 IP 10.8.3.3.47998 > 52.223.200.211.1935: Flags [.], seq 93884:95198, ack 0, win 501, options [nop,nop,TS val 3845453248 ecr 3581491905], length 1314
17:51:16.888229 IP 52.223.200.211.1935 > 10.8.3.3.47998: Flags [.], ack 82573, win 126, options [nop,nop,TS val 3581491969 ecr 3845452778], length 0
17:51:16.896448 IP 10.8.3.3.47998 > 52.223.200.211.1935: Flags [.], seq 95198:96512, ack 0, win 501, options [nop,nop,TS val 3845453285 ecr 3581491969], length 1314
17:51:16.956974 IP 52.223.200.211.1935 > 10.8.3.3.47998: Flags [.], ack 84686, win 126, options [nop,nop,TS val 3581492038 ecr 3845452882], length 0
17:51:16.956999 IP 10.8.3.3.47998 > 52.223.200.211.1935: Flags [P.], seq 96512:97801, ack 0, win 501, options [nop,nop,TS val 3845453345 ecr 3581492038], length 1289
17:51:16.991466 IP 10.8.3.3.47998 > 52.223.200.211.1935: Flags [.], seq 97801:99115, ack 0, win 501, options [nop,nop,TS val 3845453380 ecr 3581492038], length 1314
17:51:17.025499 IP 10.8.3.3.47998 > 52.223.200.211.1935: Flags [.], seq 99115:100429, ack 0, win 501, options [nop,nop,TS val 3845453414 ecr 3581492038], length 1314
17:51:17.058704 IP 52.223.200.211.1935 > 10.8.3.3.47998: Flags [.], ack 87314, win 126, options [nop,nop,TS val 3581492140 ecr 3845452944], length 0
17:51:17.088942 IP 10.8.3.3.47998 > 52.223.200.211.1935: Flags [.], seq 100429:101743, ack 0, win 501, options [nop,nop,TS val 3845453477 ecr 3581492140], length 1314
17:51:17.131547 IP 10.8.3.3.47998 > 52.223.200.211.1935: Flags [.], seq 101743:103057, ack 0, win 501, options [nop,nop,TS val 3845453520 ecr 3581492140], length 1314
17:51:17.152127 IP 52.223.200.211.1935 > 10.8.3.3.47998: Flags [.], ack 89942, win 126, options [nop,nop,TS val 3581492233 ecr 3845453014], length 0
17:51:17.157691 IP 10.8.3.3.47998 > 52.223.200.211.1935: Flags [.], seq 103057:104371, ack 0, win 501, options [nop,nop,TS val 3845453546 ecr 3581492233], length 1314
17:51:17.216380 IP 10.8.3.3.47998 > 52.223.200.211.1935: Flags [.], seq 104371:105685, ack 0, win 501, options [nop,nop,TS val 3845453605 ecr 3581492233], length 1314
17:51:17.229530 IP 52.223.200.211.1935 > 10.8.3.3.47998: Flags [.], ack 92570, win 126, options [nop,nop,TS val 3581492310 ecr 3845453114], length 0
17:51:17.259856 IP 10.8.3.3.47998 > 52.223.200.211.1935: Flags [.], seq 105685:106999, ack 0, win 501, options [nop,nop,TS val 3845453648 ecr 3581492310], length 1314
17:51:17.302059 IP 10.8.3.3.47998 > 52.223.200.211.1935: Flags [.], seq 106999:108313, ack 0, win 501, options [nop,nop,TS val 3845453690 ecr 3581492310], length 1314
17:51:17.321485 IP 52.223.200.211.1935 > 10.8.3.3.47998: Flags [.], ack 95198, win 126, options [nop,nop,TS val 3581492402 ecr 3845453220], length 0
17:51:17.345198 IP 10.8.3.3.47998 > 52.223.200.211.1935: Flags [.], seq 108313:109627, ack 0, win 501, options [nop,nop,TS val 3845453734 ecr 3581492402], length 1314
17:51:17.391494 IP 10.8.3.3.47998 > 52.223.200.211.1935: Flags [.], seq 109627:110941, ack 0, win 501, options [nop,nop,TS val 3845453780 ecr 3581492402], length 1314
17:51:17.418453 IP 52.223.200.211.1935 > 10.8.3.3.47998: Flags [.], ack 97801, win 126, options [nop,nop,TS val 3581492499 ecr 3845453285], length 0
17:51:17.418475 IP 10.8.3.3.47998 > 52.223.200.211.1935: Flags [P.], seq 110941:111649, ack 0, win 501, options [nop,nop,TS val 3845453807 ecr 3581492499], length 708
17:51:17.455746 IP 10.8.3.3.47998 > 52.223.200.211.1935: Flags [.], seq 111649:112963, ack 0, win 501, options [nop,nop,TS val 3845453844 ecr 3581492499], length 1314
17:51:17.486737 IP 52.223.200.211.1935 > 10.8.3.3.47998: Flags [.], ack 100429, win 126, options [nop,nop,TS val 3581492568 ecr 3845453380], length 0
17:51:17.494138 IP 10.8.3.3.47998 > 52.223.200.211.1935: Flags [.], seq 112963:114277, ack 0, win 501, options [nop,nop,TS val 3845453883 ecr 3581492568], length 1314
17:51:17.537063 IP 10.8.3.3.47998 > 52.223.200.211.1935: Flags [.], seq 114277:115591, ack 0, win 501, options [nop,nop,TS val 3845453925 ecr 3581492568], length 1314
17:51:17.592590 IP 52.223.200.211.1935 > 10.8.3.3.47998: Flags [.], ack 103057, win 126, options [nop,nop,TS val 3581492674 ecr 3845453477], length 0
17:51:17.601453 IP 10.8.3.3.47998 > 52.223.200.211.1935: Flags [.], seq 115591:116905, ack 0, win 501, options [nop,nop,TS val 3845453990 ecr 3581492674], length 1314
17:51:17.624017 IP 10.8.3.3.47998 > 52.223.200.211.1935: Flags [.], seq 116905:118219, ack 0, win 501, options [nop,nop,TS val 3845454012 ecr 3581492674], length 1314
17:51:17.665418 IP 10.8.3.3.47998 > 52.223.200.211.1935: Flags [.], seq 118219:119533, ack 0, win 501, options [nop,nop,TS val 3845454054 ecr 3581492674], length 1314
17:51:17.677622 IP 52.223.200.211.1935 > 10.8.3.3.47998: Flags [.], ack 105685, win 126, options [nop,nop,TS val 3581492759 ecr 3845453546], length 0
17:51:17.729066 IP 10.8.3.3.47998 > 52.223.200.211.1935: Flags [.], seq 119533:120847, ack 0, win 501, options [nop,nop,TS val 3845454117 ecr 3581492759], length 1314
17:51:17.757044 IP 10.8.3.3.47998 > 52.223.200.211.1935: Flags [.], seq 120847:122161, ack 0, win 501, options [nop,nop,TS val 3845454145 ecr 3581492759], length 1314
17:51:17.763429 IP 52.223.200.211.1935 > 10.8.3.3.47998: Flags [.], ack 108313, win 126, options [nop,nop,TS val 3581492844 ecr 3845453648], length 0
17:51:17.793131 IP 10.8.3.3.47998 > 52.223.200.211.1935: Flags [.], seq 122161:123475, ack 0, win 501, options [nop,nop,TS val 3845454182 ecr 3581492844], length 1314
17:51:17.852840 IP 52.223.200.211.1935 > 10.8.3.3.47998: Flags [.], ack 110941, win 126, options [nop,nop,TS val 3581492934 ecr 3845453734], length 0
17:51:17.860007 IP 10.8.3.3.47998 > 52.223.200.211.1935: Flags [.], seq 123475:124789, ack 0, win 501, options [nop,nop,TS val 3845454248 ecr 3581492934], length 1314
17:51:17.879842 IP 52.223.200.211.1935 > 10.8.3.3.47998: Flags [.], ack 111649, win 126, options [nop,nop,TS val 3581492961 ecr 3845453807], length 0
17:51:17.879876 IP 10.8.3.3.47998 > 52.223.200.211.1935: Flags [P.], seq 124789:125605, ack 0, win 501, options [nop,nop,TS val 3845454268 ecr 3581492961], length 816
17:51:17.926149 IP 10.8.3.3.47998 > 52.223.200.211.1935: Flags [.], seq 125605:126919, ack 0, win 501, options [nop,nop,TS val 3845454315 ecr 3581492961], length 1314
17:51:17.955774 IP 52.223.200.211.1935 > 10.8.3.3.47998: Flags [.], ack 114277, win 126, options [nop,nop,TS val 3581493036 ecr 3845453844], length 0
17:51:17.964380 IP 10.8.3.3.47998 > 52.223.200.211.1935: Flags [.], seq 126919:128233, ack 0, win 501, options [nop,nop,TS val 3845454353 ecr 3581493036], length 1314
17:51:18.007488 IP 10.8.3.3.47998 > 52.223.200.211.1935: Flags [.], seq 128233:129547, ack 0, win 501, options [nop,nop,TS val 3845454396 ecr 3581493036], length 1314
17:51:18.057364 IP 10.8.3.3.47998 > 52.223.200.211.1935: Flags [.], seq 129547:130861, ack 0, win 501, options [nop,nop,TS val 3845454446 ecr 3581493036], length 1314
17:51:18.062755 IP 52.223.200.211.1935 > 10.8.3.3.47998: Flags [.], ack 116905, win 126, options [nop,nop,TS val 3581493144 ecr 3845453925], length 0
17:51:18.093460 IP 10.8.3.3.47998 > 52.223.200.211.1935: Flags [.], seq 130861:132175, ack 0, win 501, options [nop,nop,TS val 3845454482 ecr 3581493144], length 1314
17:51:18.126987 IP 52.223.200.211.1935 > 10.8.3.3.47998: Flags [.], ack 119533, win 126, options [nop,nop,TS val 3581493208 ecr 3845454012], length 0
17:51:18.135877 IP 10.8.3.3.47998 > 52.223.200.211.1935: Flags [.], seq 132175:133489, ack 0, win 501, options [nop,nop,TS val 3845454524 ecr 3581493208], length 1314
17:51:18.199632 IP 10.8.3.3.47998 > 52.223.200.211.1935: Flags [.], seq 133489:134803, ack 0, win 501, options [nop,nop,TS val 3845454588 ecr 3581493208], length 1314
17:51:18.218505 IP 52.223.200.211.1935 > 10.8.3.3.47998: Flags [.], ack 122161, win 126, options [nop,nop,TS val 3581493299 ecr 3845454117], length 0
17:51:18.224482 IP 10.8.3.3.47998 > 52.223.200.211.1935: Flags [.], seq 134803:136117, ack 0, win 501, options [nop,nop,TS val 3845454613 ecr 3581493299], length 1314
17:51:18.263317 IP 10.8.3.3.47998 > 52.223.200.211.1935: Flags [.], seq 136117:137431, ack 0, win 501, options [nop,nop,TS val 3845454652 ecr 3581493299], length 1314
17:51:18.321431 IP 52.223.200.211.1935 > 10.8.3.3.47998: Flags [.], ack 124789, win 126, options [nop,nop,TS val 3581493402 ecr 3845454182], length 0
17:51:18.327224 IP 10.8.3.3.47998 > 52.223.200.211.1935: Flags [.], seq 137431:138745, ack 0, win 501, options [nop,nop,TS val 3845454716 ecr 3581493402], length 1314
17:51:18.341059 IP 52.223.200.211.1935 > 10.8.3.3.47998: Flags [.], ack 125605, win 126, options [nop,nop,TS val 3581493422 ecr 3845454268], length 0
17:51:18.341091 IP 10.8.3.3.47998 > 52.223.200.211.1935: Flags [P.], seq 138745:139454, ack 0, win 501, options [nop,nop,TS val 3845454729 ecr 3581493422], length 709
17:51:18.393376 IP 10.8.3.3.47998 > 52.223.200.211.1935: Flags [.], seq 139454:140768, ack 0, win 501, options [nop,nop,TS val 3845454782 ecr 3581493422], length 1314
17:51:18.425395 IP 52.223.200.211.1935 > 10.8.3.3.47998: Flags [.], ack 128233, win 126, options [nop,nop,TS val 3581493506 ecr 3845454315], length 0
17:51:18.434419 IP 10.8.3.3.47998 > 52.223.200.211.1935: Flags [.], seq 140768:142082, ack 0, win 501, options [nop,nop,TS val 3845454823 ecr 3581493506], length 1314
17:51:18.459036 IP 10.8.3.3.47998 > 52.223.200.211.1935: Flags [.], seq 142082:143396, ack 0, win 501, options [nop,nop,TS val 3845454847 ecr 3581493506], length 1314
17:51:18.519086 IP 52.223.200.211.1935 > 10.8.3.3.47998: Flags [.], ack 130861, win 126, options [nop,nop,TS val 3581493600 ecr 3845454396], length 0
17:51:18.526575 IP 10.8.3.3.47998 > 52.223.200.211.1935: Flags [.], seq 143396:144710, ack 0, win 501, options [nop,nop,TS val 3845454915 ecr 3581493600], length 1314
17:51:18.562981 IP 10.8.3.3.47998 > 52.223.200.211.1935: Flags [.], seq 144710:146024, ack 0, win 501, options [nop,nop,TS val 3845454951 ecr 3581493600], length 1314
17:51:18.590593 IP 10.8.3.3.47998 > 52.223.200.211.1935: Flags [.], seq 146024:147338, ack 0, win 501, options [nop,nop,TS val 3845454979 ecr 3581493600], length 1314
17:51:18.597563 IP 52.223.200.211.1935 > 10.8.3.3.47998: Flags [.], ack 133489, win 126, options [nop,nop,TS val 3581493678 ecr 3845454482], length 0
17:51:18.669929 IP 10.8.3.3.47998 > 52.223.200.211.1935: Flags [.], seq 147338:148652, ack 0, win 501, options [nop,nop,TS val 3845455058 ecr 3581493678], length 1314
17:51:18.685780 IP 52.223.200.211.1935 > 10.8.3.3.47998: Flags [.], ack 136117, win 126, options [nop,nop,TS val 3581493767 ecr 3845454588], length 0
17:51:18.691169 IP 10.8.3.3.47998 > 52.223.200.211.1935: Flags [.], seq 148652:149966, ack 0, win 501, options [nop,nop,TS val 3845455080 ecr 3581493767], length 1314
17:51:18.733974 IP 10.8.3.3.47998 > 52.223.200.211.1935: Flags [.], seq 149966:151280, ack 0, win 501, options [nop,nop,TS val 3845455122 ecr 3581493767], length 1314
17:51:18.788865 IP 52.223.200.211.1935 > 10.8.3.3.47998: Flags [.], ack 138745, win 126, options [nop,nop,TS val 3581493870 ecr 3845454652], length 0
17:51:18.798306 IP 10.8.3.3.47998 > 52.223.200.211.1935: Flags [.], seq 151280:152594, ack 0, win 501, options [nop,nop,TS val 3845455187 ecr 3581493870], length 1314
17:51:18.802386 IP 52.223.200.211.1935 > 10.8.3.3.47998: Flags [.], ack 139454, win 126, options [nop,nop,TS val 3581493883 ecr 3845454729], length 0
17:51:18.802433 IP 10.8.3.3.47998 > 52.223.200.211.1935: Flags [P.], seq 152594:153402, ack 0, win 501, options [nop,nop,TS val 3845455191 ecr 3581493883], length 808
17:51:18.862502 IP 10.8.3.3.47998 > 52.223.200.211.1935: Flags [.], seq 153402:154716, ack 0, win 501, options [nop,nop,TS val 3845455251 ecr 3581493883], length 1314
17:51:18.895762 IP 52.223.200.211.1935 > 10.8.3.3.47998: Flags [.], ack 142082, win 126, options [nop,nop,TS val 3581493977 ecr 3845454782], length 0
17:51:18.905360 IP 10.8.3.3.47998 > 52.223.200.211.1935: Flags [.], seq 154716:156030, ack 0, win 501, options [nop,nop,TS val 3845455294 ecr 3581493977], length 1314
17:51:18.926825 IP 10.8.3.3.47998 > 52.223.200.211.1935: Flags [.], seq 156030:157344, ack 0, win 501, options [nop,nop,TS val 3845455315 ecr 3581493977], length 1314
17:51:18.986368 IP 52.223.200.211.1935 > 10.8.3.3.47998: Flags [.], ack 143396, win 126, options [nop,nop,TS val 3581494067 ecr 3845454847], length 0
17:51:18.990714 IP 10.8.3.3.47998 > 52.223.200.211.1935: Flags [.], seq 157344:158658, ack 0, win 501, options [nop,nop,TS val 3845455379 ecr 3581494067], length 1314
17:51:19.024513 IP 52.223.200.211.1935 > 10.8.3.3.47998: Flags [.], ack 146024, win 126, options [nop,nop,TS val 3581494105 ecr 3845454915], length 0
17:51:19.033525 IP 10.8.3.3.47998 > 52.223.200.211.1935: Flags [.], seq 158658:159972, ack 0, win 501, options [nop,nop,TS val 3845455422 ecr 3581494105], length 1314
17:51:19.060038 IP 10.8.3.3.47998 > 52.223.200.211.1935: Flags [.], seq 159972:161286, ack 0, win 501, options [nop,nop,TS val 3845455448 ecr 3581494105], length 1314
17:51:19.124851 IP 10.8.3.3.47998 > 52.223.200.211.1935: Flags [.], seq 161286:162600, ack 0, win 501, options [nop,nop,TS val 3845455513 ecr 3581494105], length 1314
17:51:19.130566 IP 52.223.200.211.1935 > 10.8.3.3.47998: Flags [.], ack 147338, win 126, options [nop,nop,TS val 3581494211 ecr 3845454979], length 0
17:51:19.152713 IP 52.223.200.211.1935 > 10.8.3.3.47998: Flags [.], ack 149966, win 126, options [nop,nop,TS val 3581494233 ecr 3845455058], length 0
17:51:19.161848 IP 10.8.3.3.47998 > 52.223.200.211.1935: Flags [.], seq 162600:163914, ack 0, win 501, options [nop,nop,TS val 3845455550 ecr 3581494233], length 1314
17:51:19.204092 IP 10.8.3.3.47998 > 52.223.200.211.1935: Flags [.], seq 163914:165228, ack 0, win 501, options [nop,nop,TS val 3845455592 ecr 3581494233], length 1314
17:51:19.259801 IP 52.223.200.211.1935 > 10.8.3.3.47998: Flags [.], ack 152594, win 126, options [nop,nop,TS val 3581494341 ecr 3845455122], length 0
17:51:19.263988 IP 52.223.200.211.1935 > 10.8.3.3.47998: Flags [.], ack 153402, win 126, options [nop,nop,TS val 3581494345 ecr 3845455191], length 0
17:51:19.264023 IP 10.8.3.3.47998 > 52.223.200.211.1935: Flags [P.], seq 165228:166512, ack 0, win 501, options [nop,nop,TS val 3845455652 ecr 3581494345], length 1284
17:51:19.293361 IP 10.8.3.3.47998 > 52.223.200.211.1935: Flags [.], seq 166512:167826, ack 0, win 501, options [nop,nop,TS val 3845455682 ecr 3581494345], length 1314
17:51:19.332458 IP 10.8.3.3.47998 > 52.223.200.211.1935: Flags [.], seq 167826:169140, ack 0, win 501, options [nop,nop,TS val 3845455721 ecr 3581494345], length 1314
17:51:19.366944 IP 52.223.200.211.1935 > 10.8.3.3.47998: Flags [.], ack 156030, win 126, options [nop,nop,TS val 3581494448 ecr 3845455251], length 0
17:51:19.389712 IP 10.8.3.3.47998 > 52.223.200.211.1935: Flags [.], seq 169140:170454, ack 0, win 501, options [nop,nop,TS val 3845455778 ecr 3581494448], length 1314
17:51:19.438528 IP 10.8.3.3.47998 > 52.223.200.211.1935: Flags [.], seq 170454:171768, ack 0, win 501, options [nop,nop,TS val 3845455827 ecr 3581494448], length 1314
17:51:19.452741 IP 52.223.200.211.1935 > 10.8.3.3.47998: Flags [.], ack 158658, win 126, options [nop,nop,TS val 3581494534 ecr 3845455315], length 0
17:51:19.459747 IP 10.8.3.3.47998 > 52.223.200.211.1935: Flags [.], seq 171768:173082, ack 0, win 501, options [nop,nop,TS val 3845455848 ecr 3581494534], length 1314
17:51:19.521483 IP 52.223.200.211.1935 > 10.8.3.3.47998: Flags [.], ack 161286, win 126, options [nop,nop,TS val 3581494602 ecr 3845455422], length 0
17:51:19.524195 IP 10.8.3.3.47998 > 52.223.200.211.1935: Flags [.], seq 173082:174396, ack 0, win 501, options [nop,nop,TS val 3845455913 ecr 3581494602], length 1314
17:51:19.566687 IP 10.8.3.3.47998 > 52.223.200.211.1935: Flags [.], seq 174396:175710, ack 0, win 501, options [nop,nop,TS val 3845455955 ecr 3581494602], length 1314
17:51:19.589140 IP 10.8.3.3.47998 > 52.223.200.211.1935: Flags [.], seq 175710:177024, ack 0, win 501, options [nop,nop,TS val 3845455978 ecr 3581494602], length 1314
17:51:19.623199 IP 52.223.200.211.1935 > 10.8.3.3.47998: Flags [.], ack 163914, win 126, options [nop,nop,TS val 3581494704 ecr 3845455513], length 0
17:51:19.652220 IP 10.8.3.3.47998 > 52.223.200.211.1935: Flags [.], seq 177024:178338, ack 0, win 501, options [nop,nop,TS val 3845456041 ecr 3581494704], length 1314
17:51:19.695221 IP 10.8.3.3.47998 > 52.223.200.211.1935: Flags [.], seq 178338:179652, ack 0, win 501, options [nop,nop,TS val 3845456084 ecr 3581494704], length 1314
17:51:19.725411 IP 52.223.200.211.1935 > 10.8.3.3.47998: Flags [.], ack 166512, win 126, options [nop,nop,TS val 3581494806 ecr 3845455592], length 0
17:51:19.725447 IP 10.8.3.3.47998 > 52.223.200.211.1935: Flags [P.], seq 179652:180356, ack 0, win 501, options [nop,nop,TS val 3845456114 ecr 3581494806], length 704
17:51:19.759612 IP 10.8.3.3.47998 > 52.223.200.211.1935: Flags [.], seq 180356:181670, ack 0, win 501, options [nop,nop,TS val 3845456148 ecr 3581494806], length 1314
17:51:19.793739 IP 52.223.200.211.1935 > 10.8.3.3.47998: Flags [.], ack 169140, win 126, options [nop,nop,TS val 3581494875 ecr 3845455682], length 0
17:51:19.802065 IP 10.8.3.3.47998 > 52.223.200.211.1935: Flags [.], seq 181670:182984, ack 0, win 501, options [nop,nop,TS val 3845456190 ecr 3581494875], length 1314
17:51:19.844935 IP 10.8.3.3.47998 > 52.223.200.211.1935: Flags [.], seq 182984:184298, ack 0, win 501, options [nop,nop,TS val 3845456233 ecr 3581494875], length 1314
17:51:19.892821 IP 10.8.3.3.47998 > 52.223.200.211.1935: Flags [.], seq 184298:185612, ack 0, win 501, options [nop,nop,TS val 3845456281 ecr 3581494875], length 1314
17:51:19.899611 IP 52.223.200.211.1935 > 10.8.3.3.47998: Flags [.], ack 171768, win 126, options [nop,nop,TS val 3581494981 ecr 3845455778], length 0
17:51:19.923760 IP 10.8.3.3.47998 > 52.223.200.211.1935: Flags [.], seq 185612:186926, ack 0, win 501, options [nop,nop,TS val 3845456312 ecr 3581494981], length 1314
17:51:19.956964 IP 10.8.3.3.47998 > 52.223.200.211.1935: Flags [.], seq 186926:188240, ack 0, win 501, options [nop,nop,TS val 3845456345 ecr 3581494981], length 1314
17:51:19.985607 IP 52.223.200.211.1935 > 10.8.3.3.47998: Flags [.], ack 174396, win 126, options [nop,nop,TS val 3581495067 ecr 3845455848], length 0
17:51:20.036640 IP 10.8.3.3.47998 > 52.223.200.211.1935: Flags [.], seq 188240:189554, ack 0, win 501, options [nop,nop,TS val 3845456425 ecr 3581495067], length 1314
17:51:20.050406 IP 52.223.200.211.1935 > 10.8.3.3.47998: Flags [.], ack 177024, win 126, options [nop,nop,TS val 3581495131 ecr 3845455955], length 0
17:51:20.059823 IP 10.8.3.3.47998 > 52.223.200.211.1935: Flags [.], seq 189554:190868, ack 0, win 501, options [nop,nop,TS val 3845456448 ecr 3581495131], length 1314
17:51:20.101175 IP 10.8.3.3.47998 > 52.223.200.211.1935: Flags [.], seq 190868:192182, ack 0, win 501, options [nop,nop,TS val 3845456490 ecr 3581495131], length 1314
17:51:20.156616 IP 52.223.200.211.1935 > 10.8.3.3.47998: Flags [.], ack 179652, win 126, options [nop,nop,TS val 3581495238 ecr 3845456041], length 0
17:51:20.157442 IP 10.8.3.3.47998 > 52.223.200.211.1935: Flags [.], seq 192182:193496, ack 0, win 501, options [nop,nop,TS val 3845456546 ecr 3581495238], length 1314
17:51:20.186620 IP 52.223.200.211.1935 > 10.8.3.3.47998: Flags [.], ack 180356, win 126, options [nop,nop,TS val 3581495268 ecr 3845456114], length 0
17:51:20.186647 IP 10.8.3.3.47998 > 52.223.200.211.1935: Flags [P.], seq 193496:194316, ack 0, win 501, options [nop,nop,TS val 3845456575 ecr 3581495268], length 820
17:51:20.226917 IP 10.8.3.3.47998 > 52.223.200.211.1935: Flags [.], seq 194316:195630, ack 0, win 501, options [nop,nop,TS val 3845456615 ecr 3581495268], length 1314
17:51:20.260056 IP 10.8.3.3.47998 > 52.223.200.211.1935: Flags [.], seq 195630:196944, ack 0, win 501, options [nop,nop,TS val 3845456648 ecr 3581495268], length 1314
17:51:20.263426 IP 52.223.200.211.1935 > 10.8.3.3.47998: Flags [.], ack 182984, win 126, options [nop,nop,TS val 3581495344 ecr 3845456148], length 0
17:51:20.293697 IP 10.8.3.3.47998 > 52.223.200.211.1935: Flags [.], seq 196944:198258, ack 0, win 501, options [nop,nop,TS val 3845456682 ecr 3581495344], length 1314
17:51:20.354581 IP 52.223.200.211.1935 > 10.8.3.3.47998: Flags [.], ack 185612, win 126, options [nop,nop,TS val 3581495435 ecr 3845456233], length 0
17:51:20.357880 IP 10.8.3.3.47998 > 52.223.200.211.1935: Flags [.], seq 198258:199572, ack 0, win 501, options [nop,nop,TS val 3845456746 ecr 3581495435], length 1314
17:51:20.392109 IP 10.8.3.3.47998 > 52.223.200.211.1935: Flags [.], seq 199572:200886, ack 0, win 501, options [nop,nop,TS val 3845456780 ecr 3581495435], length 1314
17:51:20.418670 IP 52.223.200.211.1935 > 10.8.3.3.47998: Flags [.], ack 188240, win 126, options [nop,nop,TS val 3581495499 ecr 3845456312], length 0
17:51:20.425450 IP 10.8.3.3.47998 > 52.223.200.211.1935: Flags [.], seq 200886:202200, ack 0, win 501, options [nop,nop,TS val 3845456814 ecr 3581495499], length 1314
17:51:20.492525 IP 10.8.3.3.47998 > 52.223.200.211.1935: Flags [.], seq 202200:203514, ack 0, win 501, options [nop,nop,TS val 3845456881 ecr 3581495499], length 1314
17:51:20.521135 IP 52.223.200.211.1935 > 10.8.3.3.47998: Flags [.], ack 190868, win 126, options [nop,nop,TS val 3581495602 ecr 3845456425], length 0
17:51:20.522602 IP 10.8.3.3.47998 > 52.223.200.211.1935: Flags [.], seq 203514:204828, ack 0, win 501, options [nop,nop,TS val 3845456911 ecr 3581495602], length 1314
17:51:20.557179 IP 10.8.3.3.47998 > 52.223.200.211.1935: Flags [.], seq 204828:206142, ack 0, win 501, options [nop,nop,TS val 3845456946 ecr 3581495602], length 1314
17:51:20.618958 IP 52.223.200.211.1935 > 10.8.3.3.47998: Flags [.], ack 193496, win 126, options [nop,nop,TS val 3581495700 ecr 3845456490], length 0
17:51:20.626944 IP 10.8.3.3.47998 > 52.223.200.211.1935: Flags [.], seq 206142:207456, ack 0, win 501, options [nop,nop,TS val 3845457015 ecr 3581495700], length 1314
17:51:20.647781 IP 52.223.200.211.1935 > 10.8.3.3.47998: Flags [.], ack 194316, win 126, options [nop,nop,TS val 3581495729 ecr 3845456575], length 0
17:51:20.647820 IP 10.8.3.3.47998 > 52.223.200.211.1935: Flags [P.], seq 207456:208261, ack 0, win 501, options [nop,nop,TS val 3845457036 ecr 3581495729], length 805
17:51:20.690756 IP 10.8.3.3.47998 > 52.223.200.211.1935: Flags [.], seq 208261:209575, ack 0, win 501, options [nop,nop,TS val 3845457079 ecr 3581495729], length 1314
17:51:20.721236 IP 10.8.3.3.47998 > 52.223.200.211.1935: Flags [.], seq 209575:210889, ack 0, win 501, options [nop,nop,TS val 3845457110 ecr 3581495729], length 1314
17:51:20.721706 IP 52.223.200.211.1935 > 10.8.3.3.47998: Flags [.], ack 196944, win 126, options [nop,nop,TS val 3581495802 ecr 3845456615], length 0
17:51:20.764059 IP 10.8.3.3.47998 > 52.223.200.211.1935: Flags [.], seq 210889:212203, ack 0, win 501, options [nop,nop,TS val 3845457152 ecr 3581495802], length 1314
17:51:20.819242 IP 52.223.200.211.1935 > 10.8.3.3.47998: Flags [.], ack 199572, win 126, options [nop,nop,TS val 3581495900 ecr 3845456682], length 0
17:51:20.823997 IP 10.8.3.3.47998 > 52.223.200.211.1935: Flags [.], seq 212203:213517, ack 0, win 501, options [nop,nop,TS val 3845457212 ecr 3581495900], length 1314
17:51:20.857865 IP 10.8.3.3.47998 > 52.223.200.211.1935: Flags [.], seq 213517:214831, ack 0, win 501, options [nop,nop,TS val 3845457246 ecr 3581495900], length 1314
17:51:20.887526 IP 52.223.200.211.1935 > 10.8.3.3.47998: Flags [.], ack 202200, win 126, options [nop,nop,TS val 3581495968 ecr 3845456780], length 0
17:51:20.893463 IP 10.8.3.3.47998 > 52.223.200.211.1935: Flags [.], seq 214831:216145, ack 0, win 501, options [nop,nop,TS val 3845457282 ecr 3581495968], length 1314
17:51:20.956590 IP 10.8.3.3.47998 > 52.223.200.211.1935: Flags [.], seq 216145:217459, ack 0, win 501, options [nop,nop,TS val 3845457345 ecr 3581495968], length 1314
17:51:20.983766 IP 52.223.200.211.1935 > 10.8.3.3.47998: Flags [.], ack 204828, win 126, options [nop,nop,TS val 3581496065 ecr 3845456881], length 0
17:51:20.990840 IP 10.8.3.3.47998 > 52.223.200.211.1935: Flags [.], seq 217459:218773, ack 0, win 501, options [nop,nop,TS val 3845457379 ecr 3581496065], length 1314
17:51:21.026183 IP 10.8.3.3.47998 > 52.223.200.211.1935: Flags [.], seq 218773:220087, ack 0, win 501, options [nop,nop,TS val 3845457415 ecr 3581496065], length 1314
17:51:21.088364 IP 52.223.200.211.1935 > 10.8.3.3.47998: Flags [.], ack 207456, win 126, options [nop,nop,TS val 3581496169 ecr 3845456946], length 0
17:51:21.090712 IP 10.8.3.3.47998 > 52.223.200.211.1935: Flags [.], seq 220087:221401, ack 0, win 501, options [nop,nop,TS val 3845457479 ecr 3581496169], length 1314
17:51:21.109066 IP 52.223.200.211.1935 > 10.8.3.3.47998: Flags [.], ack 208261, win 126, options [nop,nop,TS val 3581496190 ecr 3845457036], length 0
17:51:21.109082 IP 10.8.3.3.47998 > 52.223.200.211.1935: Flags [P.], seq 221401:222213, ack 0, win 501, options [nop,nop,TS val 3845457497 ecr 3581496190], length 812
17:51:21.160030 IP 10.8.3.3.47998 > 52.223.200.211.1935: Flags [.], seq 222213:223527, ack 0, win 501, options [nop,nop,TS val 3845457548 ecr 3581496190], length 1314
17:51:21.182609 IP 52.223.200.211.1935 > 10.8.3.3.47998: Flags [.], ack 210889, win 126, options [nop,nop,TS val 3581496263 ecr 3845457079], length 0
17:51:21.191278 IP 10.8.3.3.47998 > 52.223.200.211.1935: Flags [.], seq 223527:224841, ack 0, win 501, options [nop,nop,TS val 3845457580 ecr 3581496263], length 1314
17:51:21.233878 IP 10.8.3.3.47998 > 52.223.200.211.1935: Flags [.], seq 224841:226155, ack 0, win 501, options [nop,nop,TS val 3845457622 ecr 3581496263], length 1314
17:51:21.285507 IP 52.223.200.211.1935 > 10.8.3.3.47998: Flags [.], ack 213517, win 126, options [nop,nop,TS val 3581496366 ecr 3845457152], length 0
17:51:21.293705 IP 10.8.3.3.47998 > 52.223.200.211.1935: Flags [.], seq 226155:227469, ack 0, win 501, options [nop,nop,TS val 3845457682 ecr 3581496366], length 1314
17:51:21.326557 IP 10.8.3.3.47998 > 52.223.200.211.1935: Flags [.], seq 227469:228783, ack 0, win 501, options [nop,nop,TS val 3845457715 ecr 3581496366], length 1314
17:51:21.355050 IP 52.223.200.211.1935 > 10.8.3.3.47998: Flags [.], ack 216145, win 126, options [nop,nop,TS val 3581496436 ecr 3845457246], length 0
17:51:21.362659 IP 10.8.3.3.47998 > 52.223.200.211.1935: Flags [.], seq 228783:230097, ack 0, win 501, options [nop,nop,TS val 3845457751 ecr 3581496436], length 1314
17:51:21.427006 IP 10.8.3.3.47998 > 52.223.200.211.1935: Flags [.], seq 230097:231411, ack 0, win 501, options [nop,nop,TS val 3845457815 ecr 3581496436], length 1314
17:51:21.452041 IP 52.223.200.211.1935 > 10.8.3.3.47998: Flags [.], ack 218773, win 126, options [nop,nop,TS val 3581496533 ecr 3845457345], length 0
17:51:21.460165 IP 10.8.3.3.47998 > 52.223.200.211.1935: Flags [.], seq 231411:232725, ack 0, win 501, options [nop,nop,TS val 3845457849 ecr 3581496533], length 1314
17:51:21.491558 IP 10.8.3.3.47998 > 52.223.200.211.1935: Flags [.], seq 232725:234039, ack 0, win 501, options [nop,nop,TS val 3845457880 ecr 3581496533], length 1314
17:51:21.551846 IP 52.223.200.211.1935 > 10.8.3.3.47998: Flags [.], ack 221401, win 126, options [nop,nop,TS val 3581496633 ecr 3845457415], length 0
17:51:21.560293 IP 10.8.3.3.47998 > 52.223.200.211.1935: Flags [.], seq 234039:235353, ack 0, win 501, options [nop,nop,TS val 3845457949 ecr 3581496633], length 1314
17:51:21.570351 IP 52.223.200.211.1935 > 10.8.3.3.47998: Flags [.], ack 222213, win 126, options [nop,nop,TS val 3581496651 ecr 3845457497], length 0
17:51:21.570390 IP 10.8.3.3.47998 > 52.223.200.211.1935: Flags [P.], seq 235353:236066, ack 0, win 501, options [nop,nop,TS val 3845457959 ecr 3581496651], length 713
17:51:21.624873 IP 10.8.3.3.47998 > 52.223.200.211.1935: Flags [.], seq 236066:237380, ack 0, win 501, options [nop,nop,TS val 3845458013 ecr 3581496651], length 1314
17:51:21.652633 IP 52.223.200.211.1935 > 10.8.3.3.47998: Flags [.], ack 224841, win 126, options [nop,nop,TS val 3581496734 ecr 3845457548], length 0
17:51:21.659957 IP 10.8.3.3.47998 > 52.223.200.211.1935: Flags [.], seq 237380:238694, ack 0, win 501, options [nop,nop,TS val 3845458048 ecr 3581496734], length 1314
17:51:21.693692 IP 10.8.3.3.47998 > 52.223.200.211.1935: Flags [.], seq 238694:240008, ack 0, win 501, options [nop,nop,TS val 3845458082 ecr 3581496734], length 1314
17:51:21.755253 IP 52.223.200.211.1935 > 10.8.3.3.47998: Flags [.], ack 227469, win 126, options [nop,nop,TS val 3581496836 ecr 3845457622], length 0
17:51:21.758441 IP 10.8.3.3.47998 > 52.223.200.211.1935: Flags [.], seq 240008:241322, ack 0, win 501, options [nop,nop,TS val 3845458147 ecr 3581496836], length 1314
17:51:21.791527 IP 10.8.3.3.47998 > 52.223.200.211.1935: Flags [.], seq 241322:242636, ack 0, win 501, options [nop,nop,TS val 3845458180 ecr 3581496836], length 1314
17:51:21.824433 IP 52.223.200.211.1935 > 10.8.3.3.47998: Flags [.], ack 230097, win 126, options [nop,nop,TS val 3581496905 ecr 3845457715], length 0
17:51:21.826584 IP 10.8.3.3.47998 > 52.223.200.211.1935: Flags [.], seq 242636:243950, ack 0, win 501, options [nop,nop,TS val 3845458215 ecr 3581496905], length 1314
17:51:21.892554 IP 10.8.3.3.47998 > 52.223.200.211.1935: Flags [.], seq 243950:245264, ack 0, win 501, options [nop,nop,TS val 3845458281 ecr 3581496905], length 1314
17:51:21.922539 IP 52.223.200.211.1935 > 10.8.3.3.47998: Flags [.], ack 232725, win 126, options [nop,nop,TS val 3581497002 ecr 3845457815], length 0
17:51:21.923866 IP 10.8.3.3.47998 > 52.223.200.211.1935: Flags [.], seq 245264:246578, ack 0, win 501, options [nop,nop,TS val 3845458312 ecr 3581497002], length 1314
17:51:21.956965 IP 10.8.3.3.47998 > 52.223.200.211.1935: Flags [.], seq 246578:247892, ack 0, win 501, options [nop,nop,TS val 3845458345 ecr 3581497002], length 1314
17:51:22.022168 IP 52.223.200.211.1935 > 10.8.3.3.47998: Flags [.], ack 235353, win 126, options [nop,nop,TS val 3581497103 ecr 3845457880], length 0
17:51:22.023076 IP 10.8.3.3.47998 > 52.223.200.211.1935: Flags [.], seq 247892:249206, ack 0, win 501, options [nop,nop,TS val 3845458411 ecr 3581497103], length 1314
17:51:22.032220 IP 52.223.200.211.1935 > 10.8.3.3.47998: Flags [.], ack 236066, win 126, options [nop,nop,TS val 3581497113 ecr 3845457959], length 0
17:51:22.032247 IP 10.8.3.3.47998 > 52.223.200.211.1935: Flags [P.], seq 249206:250014, ack 0, win 501, options [nop,nop,TS val 3845458421 ecr 3581497113], length 808
17:51:22.089558 IP 10.8.3.3.47998 > 52.223.200.211.1935: Flags [.], seq 250014:251328, ack 0, win 501, options [nop,nop,TS val 3845458478 ecr 3581497113], length 1314
17:51:22.121568 IP 52.223.200.211.1935 > 10.8.3.3.47998: Flags [.], ack 238694, win 126, options [nop,nop,TS val 3581497202 ecr 3845458013], length 0
17:51:22.122640 IP 10.8.3.3.47998 > 52.223.200.211.1935: Flags [.], seq 251328:252642, ack 0, win 501, options [nop,nop,TS val 3845458511 ecr 3581497202], length 1314
17:51:22.158552 IP 10.8.3.3.47998 > 52.223.200.211.1935: Flags [.], seq 252642:253956, ack 0, win 501, options [nop,nop,TS val 3845458547 ecr 3581497202], length 1314
17:51:22.219982 IP 52.223.200.211.1935 > 10.8.3.3.47998: Flags [.], ack 241322, win 126, options [nop,nop,TS val 3581497301 ecr 3845458082], length 0
17:51:22.225169 IP 10.8.3.3.47998 > 52.223.200.211.1935: Flags [.], seq 253956:255270, ack 0, win 501, options [nop,nop,TS val 3845458614 ecr 3581497301], length 1314
17:51:22.255628 IP 10.8.3.3.47998 > 52.223.200.211.1935: Flags [.], seq 255270:256584, ack 0, win 501, options [nop,nop,TS val 3845458644 ecr 3581497301], length 1314
17:51:22.288333 IP 52.223.200.211.1935 > 10.8.3.3.47998: Flags [.], ack 243950, win 126, options [nop,nop,TS val 3581497369 ecr 3845458180], length 0
17:51:22.289300 IP 10.8.3.3.47998 > 52.223.200.211.1935: Flags [.], seq 256584:257898, ack 0, win 501, options [nop,nop,TS val 3845458678 ecr 3581497369], length 1314
17:51:22.360183 IP 10.8.3.3.47998 > 52.223.200.211.1935: Flags [.], seq 257898:259212, ack 0, win 501, options [nop,nop,TS val 3845458749 ecr 3581497369], length 1314
17:51:22.385235 IP 52.223.200.211.1935 > 10.8.3.3.47998: Flags [.], ack 246578, win 126, options [nop,nop,TS val 3581497466 ecr 3845458281], length 0
17:51:22.393448 IP 10.8.3.3.47998 > 52.223.200.211.1935: Flags [.], seq 259212:260526, ack 0, win 501, options [nop,nop,TS val 3845458782 ecr 3581497466], length 1314
17:51:22.426818 IP 10.8.3.3.47998 > 52.223.200.211.1935: Flags [.], seq 260526:261840, ack 0, win 501, options [nop,nop,TS val 3845458815 ecr 3581497466], length 1314
17:51:22.484272 IP 52.223.200.211.1935 > 10.8.3.3.47998: Flags [.], ack 249206, win 126, options [nop,nop,TS val 3581497565 ecr 3845458345], length 0
17:51:22.493371 IP 10.8.3.3.47998 > 52.223.200.211.1935: Flags [.], seq 261840:263154, ack 0, win 501, options [nop,nop,TS val 3845458882 ecr 3581497565], length 1314
17:51:22.493624 IP 52.223.200.211.1935 > 10.8.3.3.47998: Flags [.], ack 250014, win 126, options [nop,nop,TS val 3581497574 ecr 3845458421], length 0
17:51:22.493665 IP 10.8.3.3.47998 > 52.223.200.211.1935: Flags [P.], seq 263154:263874, ack 0, win 501, options [nop,nop,TS val 3845458882 ecr 3581497574], length 720
17:51:22.558492 IP 10.8.3.3.47998 > 52.223.200.211.1935: Flags [.], seq 263874:265188, ack 0, win 501, options [nop,nop,TS val 3845458947 ecr 3581497574], length 1314
17:51:22.583807 IP 52.223.200.211.1935 > 10.8.3.3.47998: Flags [.], ack 252642, win 126, options [nop,nop,TS val 3581497665 ecr 3845458478], length 0
17:51:22.592273 IP 10.8.3.3.47998 > 52.223.200.211.1935: Flags [.], seq 265188:266502, ack 0, win 501, options [nop,nop,TS val 3845458981 ecr 3581497665], length 1314
17:51:22.626216 IP 10.8.3.3.47998 > 52.223.200.211.1935: Flags [.], seq 266502:267816, ack 0, win 501, options [nop,nop,TS val 3845459015 ecr 3581497665], length 1314
17:51:22.686818 IP 52.223.200.211.1935 > 10.8.3.3.47998: Flags [.], ack 255270, win 126, options [nop,nop,TS val 3581497767 ecr 3845458547], length 0
17:51:22.691512 IP 10.8.3.3.47998 > 52.223.200.211.1935: Flags [.], seq 267816:269130, ack 0, win 501, options [nop,nop,TS val 3845459080 ecr 3581497767], length 1314
17:51:22.726700 IP 10.8.3.3.47998 > 52.223.200.211.1935: Flags [.], seq 269130:270444, ack 0, win 501, options [nop,nop,TS val 3845459115 ecr 3581497767], length 1314
17:51:22.750558 IP 52.223.200.211.1935 > 10.8.3.3.47998: Flags [.], ack 257898, win 126, options [nop,nop,TS val 3581497832 ecr 3845458644], length 0
17:51:22.760212 IP 10.8.3.3.47998 > 52.223.200.211.1935: Flags [.], seq 270444:271758, ack 0, win 501, options [nop,nop,TS val 3845459149 ecr 3581497832], length 1314
17:51:22.826876 IP 10.8.3.3.47998 > 52.223.200.211.1935: Flags [.], seq 271758:273072, ack 0, win 501, options [nop,nop,TS val 3845459215 ecr 3581497832], length 1314
17:51:22.854764 IP 52.223.200.211.1935 > 10.8.3.3.47998: Flags [.], ack 260526, win 126, options [nop,nop,TS val 3581497936 ecr 3845458749], length 0
17:51:22.859921 IP 10.8.3.3.47998 > 52.223.200.211.1935: Flags [.], seq 273072:274386, ack 0, win 501, options [nop,nop,TS val 3845459248 ecr 3581497936], length 1314
17:51:22.893278 IP 10.8.3.3.47998 > 52.223.200.211.1935: Flags [.], seq 274386:275700, ack 0, win 501, options [nop,nop,TS val 3845459282 ecr 3581497936], length 1314
17:51:22.954958 IP 52.223.200.211.1935 > 10.8.3.3.47998: Flags [.], ack 263154, win 126, options [nop,nop,TS val 3581498036 ecr 3845458815], length 0
17:51:22.955008 IP 52.223.200.211.1935 > 10.8.3.3.47998: Flags [.], ack 263874, win 126, options [nop,nop,TS val 3581498036 ecr 3845458882], length 0
17:51:22.955034 IP 10.8.3.3.47998 > 52.223.200.211.1935: Flags [P.], seq 275700:276968, ack 0, win 501, options [nop,nop,TS val 3845459343 ecr 3581498036], length 1268
17:51:22.991733 IP 10.8.3.3.47998 > 52.223.200.211.1935: Flags [.], seq 276968:278282, ack 0, win 501, options [nop,nop,TS val 3845459380 ecr 3581498036], length 1314
17:51:23.026920 IP 10.8.3.3.47998 > 52.223.200.211.1935: Flags [.], seq 278282:279596, ack 0, win 501, options [nop,nop,TS val 3845459415 ecr 3581498036], length 1314
17:51:23.053611 IP 52.223.200.211.1935 > 10.8.3.3.47998: Flags [.], ack 266502, win 126, options [nop,nop,TS val 3581498135 ecr 3845458947], length 0
17:51:23.074611 IP 10.8.3.3.47998 > 52.223.200.211.1935: Flags [.], seq 279596:280910, ack 0, win 501, options [nop,nop,TS val 3845459463 ecr 3581498135], length 1314
17:51:23.123481 IP 10.8.3.3.47998 > 52.223.200.211.1935: Flags [.], seq 280910:282224, ack 0, win 501, options [nop,nop,TS val 3845459512 ecr 3581498135], length 1314
17:51:23.152605 IP 52.223.200.211.1935 > 10.8.3.3.47998: Flags [.], ack 269130, win 126, options [nop,nop,TS val 3581498234 ecr 3845459015], length 0
17:51:23.160026 IP 10.8.3.3.47998 > 52.223.200.211.1935: Flags [.], seq 282224:283538, ack 0, win 501, options [nop,nop,TS val 3845459548 ecr 3581498234], length 1314
17:51:23.202917 IP 10.8.3.3.47998 > 52.223.200.211.1935: Flags [.], seq 283538:284852, ack 0, win 501, options [nop,nop,TS val 3845459591 ecr 3581498234], length 1314
17:51:23.221492 IP 52.223.200.211.1935 > 10.8.3.3.47998: Flags [.], ack 271758, win 126, options [nop,nop,TS val 3581498302 ecr 3845459115], length 0
17:51:23.256969 IP 10.8.3.3.47998 > 52.223.200.211.1935: Flags [.], seq 284852:286166, ack 0, win 501, options [nop,nop,TS val 3845459645 ecr 3581498302], length 1314
17:51:23.290892 IP 10.8.3.3.47998 > 52.223.200.211.1935: Flags [.], seq 286166:287480, ack 0, win 501, options [nop,nop,TS val 3845459679 ecr 3581498302], length 1314
