02:44:58.788663 IP 10.8.2.2.55694 > 99.181.69.125.1935: Flags [.], seq 1036267711:1036269025, ack 2578950797, win 501, options [nop,nop,TS val 1574862991 ecr 3376926848], length 1314
02:44:58.790186 IP 99.181.69.125.1935 > 10.8.2.2.55694: Flags [.], ack 4294956635, win 132, options [nop,nop,TS val 3376926946 ecr 1574862511], length 0
02:44:58.810694 IP 10.8.2.2.55694 > 99.181.69.125.1935: Flags [.], seq 1314:2628, ack 1, win 501, options [nop,nop,TS val 1574863013 ecr 3376926946], length 1314
02:44:58.843893 IP 10.8.2.2.55694 > 99.181.69.125.1935: Flags [.], seq 2628:3942, ack 1, win 501, options [nop,nop,TS val 1574863047 ecr 3376926946], length 1314
02:44:58.870882 IP 99.181.69.125.1935 > 10.8.2.2.55694: Flags [.], ack 4294959263, win 132, options [nop,nop,TS val 3376927021 ecr 1574862606], length 0
02:44:58.906548 IP 10.8.2.2.55694 > 99.181.69.125.1935: Flags [.], seq 3942:5256, ack 1, win 501, options [nop,nop,TS val 1574863109 ecr 3376927021], length 1314
02:44:58.938095 IP 10.8.2.2.55694 > 99.181.69.125.1935: Flags [.], seq 5256:6570, ack 1, win 501, options [nop,nop,TS val 1574863141 ecr 3376927021], length 1314
02:44:58.977504 IP 10.8.2.2.55694 > 99.181.69.125.1935: Flags [.], seq 6570:7884, ack 1, win 501, options [nop,nop,TS val 1574863180 ecr 3376927021], length 1314
02:44:58.991905 IP 99.181.69.125.1935 > 10.8.2.2.55694: Flags [.], ack 4294961891, win 132, options [nop,nop,TS val 3376927125 ecr 1574862713], length 0
02:44:59.044018 IP 10.8.2.2.55694 > 99.181.69.125.1935: Flags [.], seq 7884:9198, ack 1, win 501, options [nop,nop,TS val 1574863247 ecr 3376927125], length 1314
02:44:59.047796 IP 99.181.69.125.1935 > 10.8.2.2.55694: Flags [.], ack 4294963354, win 133, options [nop,nop,TS val 3376927178 ecr 1574862778], length 0
02:44:59.047834 IP 10.8.2.2.55694 > 99.181.69.125.1935: Flags [P.], seq 9198:10003, ack 1, win 501, options [nop,nop,TS val 1574863251 ecr 3376927178], length 805
02:44:59.108961 IP 10.8.2.2.55694 > 99.181.69.125.1935: Flags [.], seq 10003:11317, ack 1, win 501, options [nop,nop,TS val 1574863312 ecr 3376927178], length 1314
02:44:59.142530 IP 10.8.2.2.55694 > 99.181.69.125.1935: Flags [.], seq 11317:12631, ack 1, win 501, options [nop,nop,TS val 1574863345 ecr 3376927178], length 1314
02:44:59.173243 IP 10.8.2.2.55694 > 99.181.69.125.1935: Flags [.], seq 12631:13945, ack 1, win 501, options [nop,nop,TS val 1574863376 ecr 3376927178], length 1314
02:44:59.236881 IP 10.8.2.2.55694 > 99.181.69.125.1935: Flags [.], seq 13945:15259, ack 1, win 501, options [nop,nop,TS val 1574863440 ecr 3376927178], length 1314
02:44:59.256585 IP 99.181.69.125.1935 > 10.8.2.2.55694: Flags [.], ack 4294965982, win 133, options [nop,nop,TS val 3376927391 ecr 1574862842,nop,nop,sack 1 {0:1314}], length 0
02:44:59.277738 IP 10.8.2.2.55694 > 99.181.69.125.1935: Flags [.], seq 15259:16573, ack 1, win 501, options [nop,nop,TS val 1574863480 ecr 3376927391], length 1314
02:44:59.286135 IP 99.181.69.125.1935 > 10.8.2.2.55694: Flags [.], ack 4294965982, win 133, options [nop,nop,TS val 3376927419 ecr 1574862842,nop,nop,sack 1 {0:2628}], length 0
02:44:59.286187 IP 10.8.2.2.55694 > 99.181.69.125.1935: Flags [.], seq 4294965982:0, ack 1, win 501, options [nop,nop,TS val 1574863489 ecr 3376927419], length 1314
02:44:59.319933 IP 99.181.69.125.1935 > 10.8.2.2.55694: Flags [.], ack 4294965982, win 133, options [nop,nop,TS val 3376927457 ecr 1574862842,nop,nop,sack 1 {0:3942}], length 0
02:44:59.319950 IP 10.8.2.2.55694 > 99.181.69.125.1935: Flags [.], seq 16573:17887, ack 1, win 501, options [nop,nop,TS val 1574863523 ecr 3376927457], length 1314
02:44:59.400464 IP 99.181.69.125.1935 > 10.8.2.2.55694: Flags [.], ack 4294965982, win 133, options [nop,nop,TS val 3376927537 ecr 1574862842,nop,nop,sack 1 {0:5256}], length 0
02:44:59.400508 IP 10.8.2.2.55694 > 99.181.69.125.1935: Flags [.], seq 17887:19201, ack 1, win 501, options [nop,nop,TS val 1574863603 ecr 3376927537], length 1314
02:44:59.417903 IP 99.181.69.125.1935 > 10.8.2.2.55694: Flags [.], ack 4294965982, win 133, options [nop,nop,TS val 3376927567 ecr 1574862842,nop,nop,sack 1 {0:6570}], length 0
02:44:59.417925 IP 10.8.2.2.55694 > 99.181.69.125.1935: Flags [.], seq 19201:20515, ack 1, win 501, options [nop,nop,TS val 1574863621 ecr 3376927567], length 1314
02:44:59.454569 IP 99.181.69.125.1935 > 10.8.2.2.55694: Flags [.], ack 4294965982, win 133, options [nop,nop,TS val 3376927604 ecr 1574862842,nop,nop,sack 1 {0:7884}], length 0
02:44:59.454585 IP 10.8.2.2.55694 > 99.181.69.125.1935: Flags [.], seq 20515:21829, ack 1, win 501, options [nop,nop,TS val 1574863657 ecr 3376927604], length 1314
02:44:59.530612 IP 99.181.69.125.1935 > 10.8.2.2.55694: Flags [.], ack 4294965982, win 133, options [nop,nop,TS val 3376927668 ecr 1574862842,nop,nop,sack 1 {0:9198}], length 0
02:44:59.530659 IP 10.8.2.2.55694 > 99.181.69.125.1935: Flags [.], seq 21829:23143, ack 1, win 501, options [nop,nop,TS val 1574863733 ecr 3376927668], length 1314
02:44:59.530689 IP 99.181.69.125.1935 > 10.8.2.2.55694: Flags [.], ack 4294965982, win 133, options [nop,nop,TS val 3376927670 ecr 1574862842,nop,nop,sack 1 {0:10003}], length 0
02:44:59.544431 IP 10.8.2.2.55694 > 99.181.69.125.1935: Flags [.], seq 23143:24457, ack 1, win 501, options [nop,nop,TS val 1574863747 ecr 3376927670], length 1314
02:44:59.595811 IP 99.181.69.125.1935 > 10.8.2.2.55694: Flags [.], ack 4294965982, win 133, options [nop,nop,TS val 3376927741 ecr 1574862842,nop,nop,sack 1 {0:11317}], length 0
02:44:59.595847 IP 10.8.2.2.55694 > 99.181.69.125.1935: Flags [.], seq 24457:25771, ack 1, win 501, options [nop,nop,TS val 1574863799 ecr 3376927741], length 1314
02:44:59.629582 IP 99.181.69.125.1935 > 10.8.2.2.55694: Flags [.], ack 4294965982, win 133, options [nop,nop,TS val 3376927766 ecr 1574862842,nop,nop,sack 1 {0:12631}], length 0
02:44:59.642453 IP 10.8.2.2.55694 > 99.181.69.125.1935: Flags [.], seq 25771:27085, ack 1, win 501, options [nop,nop,TS val 1574863845 ecr 3376927766], length 1314
02:44:59.647995 IP 99.181.69.125.1935 > 10.8.2.2.55694: Flags [.], ack 4294965982, win 133, options [nop,nop,TS val 3376927785 ecr 1574862842,nop,nop,sack 1 {0:13945}], length 0
02:44:59.677492 IP 10.8.2.2.55694 > 99.181.69.125.1935: Flags [.], seq 27085:28399, ack 1, win 501, options [nop,nop,TS val 1574863880 ecr 3376927785], length 1314
02:44:59.733406 IP 99.181.69.125.1935 > 10.8.2.2.55694: Flags [.], ack 4294965982, win 133, options [nop,nop,TS val 3376927863 ecr 1574862842,nop,nop,sack 1 {0:15259}], length 0
02:44:59.733435 IP 10.8.2.2.55694 > 99.181.69.125.1935: Flags [.], seq 28399:29713, ack 1, win 501, options [nop,nop,TS val 1574863936 ecr 3376927863], length 1314
02:44:59.755736 IP 99.181.69.125.1935 > 10.8.2.2.55694: Flags [.], ack 4294965982, win 133, options [nop,nop,TS val 3376927909 ecr 1574862842,nop,nop,sack 1 {0:16573}], length 0
02:44:59.757116 IP 99.181.69.125.1935 > 10.8.2.2.55694: Flags [.], ack 16573, win 110, options [nop,nop,TS val 3376927912 ecr 1574863489], length 0
02:44:59.757130 IP 10.8.2.2.55694 > 99.181.69.125.1935: Flags [P.], seq 29713:30928, ack 1, win 501, options [nop,nop,TS val 1574863960 ecr 3376927912], length 1215
02:44:59.796342 IP 99.181.69.125.1935 > 10.8.2.2.55694: Flags [.], ack 17887, win 139, options [nop,nop,TS val 3376927942 ecr 1574863523], length 0
02:44:59.806994 IP 10.8.2.2.55694 > 99.181.69.125.1935: Flags [.], seq 30928:32242, ack 1, win 501, options [nop,nop,TS val 1574864010 ecr 3376927942], length 1314
02:44:59.840041 IP 10.8.2.2.55694 > 99.181.69.125.1935: Flags [.], seq 32242:33556, ack 1, win 501, options [nop,nop,TS val 1574864043 ecr 3376927942], length 1314
02:44:59.876696 IP 10.8.2.2.55694 > 99.181.69.125.1935: Flags [.], seq 33556:34870, ack 1, win 501, options [nop,nop,TS val 1574864079 ecr 3376927942], length 1314
02:44:59.878933 IP 99.181.69.125.1935 > 10.8.2.2.55694: Flags [.], ack 19201, win 145, options [nop,nop,TS val 3376928016 ecr 1574863603], length 0
02:44:59.898325 IP 99.181.69.125.1935 > 10.8.2.2.55694: Flags [.], ack 20515, win 151, options [nop,nop,TS val 3376928035 ecr 1574863621], length 0
02:44:59.940123 IP 10.8.2.2.55694 > 99.181.69.125.1935: Flags [.], seq 34870:36184, ack 1, win 501, options [nop,nop,TS val 1574864143 ecr 3376928035], length 1314
02:44:59.946268 IP 99.181.69.125.1935 > 10.8.2.2.55694: Flags [.], ack 21829, win 156, options [nop,nop,TS val 3376928079 ecr 1574863657], length 0
02:44:59.982448 IP 10.8.2.2.55694 > 99.181.69.125.1935: Flags [.], seq 36184:37498, ack 1, win 501, options [nop,nop,TS val 1574864185 ecr 3376928079], length 1314
02:45:00.019037 IP 99.181.69.125.1935 > 10.8.2.2.55694: Flags [.], ack 23143, win 162, options [nop,nop,TS val 3376928139 ecr 1574863733], length 0
02:45:00.024858 IP 10.8.2.2.55694 > 99.181.69.125.1935: Flags [.], seq 37498:38812, ack 1, win 501, options [nop,nop,TS val 1574864228 ecr 3376928139], length 1314
02:45:00.036131 IP 99.181.69.125.1935 > 10.8.2.2.55694: Flags [.], ack 24457, win 168, options [nop,nop,TS val 3376928158 ecr 1574863747], length 0
02:45:00.089178 IP 10.8.2.2.55694 > 99.181.69.125.1935: Flags [.], seq 38812:40126, ack 1, win 501, options [nop,nop,TS val 1574864292 ecr 3376928158], length 1314
02:45:00.096874 IP 99.181.69.125.1935 > 10.8.2.2.55694: Flags [.], ack 25771, win 173, options [nop,nop,TS val 3376928215 ecr 1574863799], length 0
02:45:00.110787 IP 10.8.2.2.55694 > 99.181.69.125.1935: Flags [.], seq 40126:41440, ack 1, win 501, options [nop,nop,TS val 1574864313 ecr 3376928215], length 1314
02:45:00.127037 IP 99.181.69.125.1935 > 10.8.2.2.55694: Flags [.], ack 27085, win 179, options [nop,nop,TS val 3376928262 ecr 1574863845], length 0
02:45:00.150041 IP 99.181.69.125.1935 > 10.8.2.2.55694: Flags [.], ack 28399, win 185, options [nop,nop,TS val 3376928284 ecr 1574863880], length 0
02:45:00.153845 IP 10.8.2.2.55694 > 99.181.69.125.1935: Flags [.], seq 41440:42754, ack 1, win 501, options [nop,nop,TS val 1574864357 ecr 3376928284], length 1314
02:45:00.218371 IP 10.8.2.2.55694 > 99.181.69.125.1935: Flags [.], seq 42754:44068, ack 1, win 501, options [nop,nop,TS val 1574864421 ecr 3376928284], length 1314
02:45:00.231409 IP 99.181.69.125.1935 > 10.8.2.2.55694: Flags [.], ack 29713, win 190, options [nop,nop,TS val 3376928345 ecr 1574863936], length 0
02:45:00.240120 IP 10.8.2.2.55694 > 99.181.69.125.1935: Flags [.], seq 44068:45382, ack 1, win 501, options [nop,nop,TS val 1574864443 ecr 3376928345], length 1314
02:45:00.268980 IP 99.181.69.125.1935 > 10.8.2.2.55694: Flags [.], ack 30928, win 196, options [nop,nop,TS val 3376928388 ecr 1574863960], length 0
02:45:00.269003 IP 10.8.2.2.55694 > 99.181.69.125.1935: Flags [P.], seq 45382:45922, ack 1, win 501, options [nop,nop,TS val 1574864472 ecr 3376928388], length 540
02:45:00.304195 IP 10.8.2.2.55694 > 99.181.69.125.1935: Flags [.], seq 45922:47236, ack 1, win 501, options [nop,nop,TS val 1574864507 ecr 3376928388], length 1314
02:45:00.312072 IP 99.181.69.125.1935 > 10.8.2.2.55694: Flags [.], ack 32242, win 202, options [nop,nop,TS val 3376928427 ecr 1574864010], length 0
02:45:00.344316 IP 10.8.2.2.55694 > 99.181.69.125.1935: Flags [.], seq 47236:48550, ack 1, win 501, options [nop,nop,TS val 1574864547 ecr 3376928427], length 1314
02:45:00.348955 IP 99.181.69.125.1935 > 10.8.2.2.55694: Flags [.], ack 33556, win 207, options [nop,nop,TS val 3376928469 ecr 1574864043], length 0
02:45:00.367624 IP 99.181.69.125.1935 > 10.8.2.2.55694: Flags [.], ack 34870, win 213, options [nop,nop,TS val 3376928498 ecr 1574864079], length 0
02:45:00.390138 IP 10.8.2.2.55694 > 99.181.69.125.1935: Flags [.], seq 48550:49864, ack 1, win 501, options [nop,nop,TS val 1574864593 ecr 3376928498], length 1314
02:45:00.436929 IP 99.181.69.125.1935 > 10.8.2.2.55694: Flags [.], ack 36184, win 219, options [nop,nop,TS val 3376928568 ecr 1574864143], length 0
02:45:00.441869 IP 10.8.2.2.55694 > 99.181.69.125.1935: Flags [.], seq 49864:51178, ack 1, win 501, options [nop,nop,TS val 1574864645 ecr 3376928568], length 1314
02:45:00.475503 IP 10.8.2.2.55694 > 99.181.69.125.1935: Flags [.], seq 51178:52492, ack 1, win 501, options [nop,nop,TS val 1574864678 ecr 3376928568], length 1314
02:45:00.488258 IP 99.181.69.125.1935 > 10.8.2.2.55694: Flags [.], ack 37498, win 224, options [nop,nop,TS val 3376928611 ecr 1574864185], length 0
02:45:00.518228 IP 10.8.2.2.55694 > 99.181.69.125.1935: Flags [.], seq 52492:53806, ack 1, win 501, options [nop,nop,TS val 1574864721 ecr 3376928611], length 1314
02:45:00.521652 IP 99.181.69.125.1935 > 10.8.2.2.55694: Flags [.], ack 38812, win 230, options [nop,nop,TS val 3376928655 ecr 1574864228], length 0
02:45:00.574326 IP 10.8.2.2.55694 > 99.181.69.125.1935: Flags [.], seq 53806:55120, ack 1, win 501, options [nop,nop,TS val 1574864777 ecr 3376928655], length 1314
02:45:00.578363 IP 99.181.69.125.1935 > 10.8.2.2.55694: Flags [.], ack 40126, win 236, options [nop,nop,TS val 3376928719 ecr 1574864292], length 0
02:45:00.608187 IP 10.8.2.2.55694 > 99.181.69.125.1935: Flags [.], seq 55120:56434, ack 1, win 501, options [nop,nop,TS val 1574864811 ecr 3376928719], length 1314
02:45:00.617779 IP 99.181.69.125.1935 > 10.8.2.2.55694: Flags [.], ack 41440, win 241, options [nop,nop,TS val 3376928757 ecr 1574864313], length 0
02:45:00.645855 IP 10.8.2.2.55694 > 99.181.69.125.1935: Flags [.], seq 56434:57748, ack 1, win 501, options [nop,nop,TS val 1574864849 ecr 3376928757], length 1314
02:45:00.655995 IP 99.181.69.125.1935 > 10.8.2.2.55694: Flags [.], ack 42754, win 247, options [nop,nop,TS val 3376928797 ecr 1574864357], length 0
02:45:00.700961 IP 99.181.69.125.1935 > 10.8.2.2.55694: Flags [.], ack 44068, win 253, options [nop,nop,TS val 3376928844 ecr 1574864421], length 0
02:45:00.709898 IP 10.8.2.2.55694 > 99.181.69.125.1935: Flags [.], seq 57748:59062, ack 1, win 501, options [nop,nop,TS val 1574864913 ecr 3376928844], length 1314
02:45:00.720974 IP 99.181.69.125.1935 > 10.8.2.2.55694: Flags [.], ack 45382, win 258, options [nop,nop,TS val 3376928877 ecr 1574864443], length 0
02:45:00.745364 IP 10.8.2.2.55694 > 99.181.69.125.1935: Flags [.], seq 59062:60376, ack 1, win 501, options [nop,nop,TS val 1574864948 ecr 3376928877], length 1314
02:45:00.745774 IP 99.181.69.125.1935 > 10.8.2.2.55694: Flags [.], ack 45922, win 263, options [nop,nop,TS val 3376928884 ecr 1574864472], length 0
02:45:00.745806 IP 10.8.2.2.55694 > 99.181.69.125.1935: Flags [P.], seq 60376:60713, ack 1, win 501, options [nop,nop,TS val 1574864949 ecr 3376928884], length 337
02:45:00.783593 IP 99.181.69.125.1935 > 10.8.2.2.55694: Flags [.], ack 47236, win 269, options [nop,nop,TS val 3376928922 ecr 1574864507], length 0
02:45:00.808344 IP 10.8.2.2.55694 > 99.181.69.125.1935: Flags [.], seq 60713:62027, ack 1, win 501, options [nop,nop,TS val 1574865011 ecr 3376928922], length 1314
02:45:00.814913 IP 99.181.69.125.1935 > 10.8.2.2.55694: Flags [.], ack 48550, win 275, options [nop,nop,TS val 3376928965 ecr 1574864547], length 0
02:45:00.838415 IP 10.8.2.2.55694 > 99.181.69.125.1935: Flags [.], seq 62027:63341, ack 1, win 501, options [nop,nop,TS val 1574865041 ecr 3376928965], length 1314
02:45:00.869828 IP 99.181.69.125.1935 > 10.8.2.2.55694: Flags [.], ack 49864, win 280, options [nop,nop,TS val 3376929024 ecr 1574864593], length 0
02:45:00.874752 IP 10.8.2.2.55694 > 99.181.69.125.1935: Flags [.], seq 63341:64655, ack 1, win 501, options [nop,nop,TS val 1574865077 ecr 3376929024], length 1314
02:45:00.907669 IP 99.181.69.125.1935 > 10.8.2.2.55694: Flags [.], ack 51178, win 286, options [nop,nop,TS val 3376929062 ecr 1574864645], length 0
02:45:00.939777 IP 10.8.2.2.55694 > 99.181.69.125.1935: Flags [.], seq 64655:65969, ack 1, win 501, options [nop,nop,TS val 1574865142 ecr 3376929062], length 1314
02:45:00.944727 IP 99.181.69.125.1935 > 10.8.2.2.55694: Flags [.], ack 52492, win 291, options [nop,nop,TS val 3376929087 ecr 1574864678], length 0
02:45:00.974713 IP 10.8.2.2.55694 > 99.181.69.125.1935: Flags [.], seq 65969:67283, ack 1, win 501, options [nop,nop,TS val 1574865177 ecr 3376929087], length 1314
02:45:01.008455 IP 10.8.2.2.55694 > 99.181.69.125.1935: Flags [.], seq 67283:68597, ack 1, win 501, options [nop,nop,TS val 1574865211 ecr 3376929087], length 1314
02:45:01.033901 IP 99.181.69.125.1935 > 10.8.2.2.55694: Flags [.], ack 53806, win 291, options [nop,nop,TS val 3376929170 ecr 1574864721], length 0
02:45:01.072401 IP 10.8.2.2.55694 > 99.181.69.125.1935: Flags [.], seq 68597:69911, ack 1, win 501, options [nop,nop,TS val 1574865275 ecr 3376929170], length 1314
02:45:01.086750 IP 99.181.69.125.1935 > 10.8.2.2.55694: Flags [.], ack 56434, win 291, options [nop,nop,TS val 3376929218 ecr 1574864777], length 0
02:45:01.107894 IP 10.8.2.2.55694 > 99.181.69.125.1935: Flags [.], seq 69911:71225, ack 1, win 501, options [nop,nop,TS val 1574865311 ecr 3376929218], length 1314
02:45:01.142809 IP 10.8.2.2.55694 > 99.181.69.125.1935: Flags [.], seq 71225:72539, ack 1, win 501, options [nop,nop,TS val 1574865345 ecr 3376929218], length 1314
02:45:01.166736 IP 99.181.69.125.1935 > 10.8.2.2.55694: Flags [.], ack 57748, win 291, options [nop,nop,TS val 3376929302 ecr 1574864849], length 0
02:45:01.206413 IP 10.8.2.2.55694 > 99.181.69.125.1935: Flags [.], seq 72539:73853, ack 1, win 501, options [nop,nop,TS val 1574865409 ecr 3376929302], length 1314
02:45:01.213905 IP 99.181.69.125.1935 > 10.8.2.2.55694: Flags [.], ack 60376, win 291, options [nop,nop,TS val 3376929355 ecr 1574864913], length 0
02:45:01.213926 IP 99.181.69.125.1935 > 10.8.2.2.55694: Flags [.], ack 60713, win 292, options [nop,nop,TS val 3376929355 ecr 1574864949], length 0
02:45:01.213936 IP 10.8.2.2.55694 > 99.181.69.125.1935: Flags [P.], seq 73853:74664, ack 1, win 501, options [nop,nop,TS val 1574865417 ecr 3376929355], length 811
02:45:01.234540 IP 99.181.69.125.1935 > 10.8.2.2.55694: Flags [.], ack 63341, win 292, options [nop,nop,TS val 3376929436 ecr 1574865011], length 0
02:45:01.277033 IP 10.8.2.2.55694 > 99.181.69.125.1935: Flags [.], seq 74664:75978, ack 1, win 501, options [nop,nop,TS val 1574865480 ecr 3376929436], length 1314
02:45:01.306580 IP 10.8.2.2.55694 > 99.181.69.125.1935: Flags [.], seq 75978:77292, ack 1, win 501, options [nop,nop,TS val 1574865509 ecr 3376929436], length 1314
02:45:01.308689 IP 99.181.69.125.1935 > 10.8.2.2.55694: Flags [.], ack 64655, win 292, options [nop,nop,TS val 3376929534 ecr 1574865077], length 0
02:45:01.339918 IP 10.8.2.2.55694 > 99.181.69.125.1935: Flags [.], seq 77292:78606, ack 1, win 501, options [nop,nop,TS val 1574865543 ecr 3376929534], length 1314
02:45:01.377197 IP 99.181.69.125.1935 > 10.8.2.2.55694: Flags [.], ack 67283, win 292, options [nop,nop,TS val 3376929602 ecr 1574865142], length 0
02:45:01.410800 IP 10.8.2.2.55694 > 99.181.69.125.1935: Flags [.], seq 78606:79920, ack 1, win 501, options [nop,nop,TS val 1574865613 ecr 3376929602], length 1314
02:45:01.444147 IP 10.8.2.2.55694 > 99.181.69.125.1935: Flags [.], seq 79920:81234, ack 1, win 501, options [nop,nop,TS val 1574865647 ecr 3376929602], length 1314
02:45:01.459644 IP 99.181.69.125.1935 > 10.8.2.2.55694: Flags [.], ack 69911, win 291, options [nop,nop,TS val 3376929685 ecr 1574865211], length 0
02:45:01.473893 IP 10.8.2.2.55694 > 99.181.69.125.1935: Flags [.], seq 81234:82548, ack 1, win 501, options [nop,nop,TS val 1574865677 ecr 3376929685], length 1314
02:45:01.527637 IP 99.181.69.125.1935 > 10.8.2.2.55694: Flags [.], ack 72539, win 291, options [nop,nop,TS val 3376929753 ecr 1574865311], length 0
02:45:01.538284 IP 99.181.69.125.1935 > 10.8.2.2.55694: Flags [.], ack 74664, win 292, options [nop,nop,TS val 3376929764 ecr 1574865409], length 0
02:45:01.538327 IP 10.8.2.2.55694 > 99.181.69.125.1935: Flags [P.], seq 82548:83709, ack 1, win 501, options [nop,nop,TS val 1574865741 ecr 3376929764], length 1161
02:45:01.577339 IP 10.8.2.2.55694 > 99.181.69.125.1935: Flags [.], seq 83709:85023, ack 1, win 501, options [nop,nop,TS val 1574865780 ecr 3376929764], length 1314
02:45:01.606233 IP 10.8.2.2.55694 > 99.181.69.125.1935: Flags [.], seq 85023:86337, ack 1, win 501, options [nop,nop,TS val 1574865809 ecr 3376929764], length 1314
02:45:01.610620 IP 99.181.69.125.1935 > 10.8.2.2.55694: Flags [.], ack 77292, win 292, options [nop,nop,TS val 3376929836 ecr 1574865480], length 0
02:45:01.648684 IP 10.8.2.2.55694 > 99.181.69.125.1935: Flags [.], seq 86337:87651, ack 1, win 501, options [nop,nop,TS val 1574865851 ecr 3376929836], length 1314
02:45:01.706643 IP 10.8.2.2.55694 > 99.181.69.125.1935: Flags [.], seq 87651:88965, ack 1, win 501, options [nop,nop,TS val 1574865909 ecr 3376929836], length 1314
02:45:01.741122 IP 10.8.2.2.55694 > 99.181.69.125.1935: Flags [.], seq 88965:90279, ack 1, win 501, options [nop,nop,TS val 1574865944 ecr 3376929836], length 1314
02:45:01.756006 IP 99.181.69.125.1935 > 10.8.2.2.55694: Flags [.], ack 78606, win 292, options [nop,nop,TS val 3376929930 ecr 1574865543], length 0
02:45:01.776967 IP 10.8.2.2.55694 > 99.181.69.125.1935: Flags [.], seq 90279:91593, ack 1, win 501, options [nop,nop,TS val 1574865980 ecr 3376929930], length 1314
02:45:01.820646 IP 99.181.69.125.1935 > 10.8.2.2.55694: Flags [.], ack 81234, win 292, options [nop,nop,TS val 3376929974 ecr 1574865613], length 0
02:45:01.840745 IP 10.8.2.2.55694 > 99.181.69.125.1935: Flags [.], seq 91593:92907, ack 1, win 501, options [nop,nop,TS val 1574866043 ecr 3376929974], length 1314
02:45:01.843031 IP 99.181.69.125.1935 > 10.8.2.2.55694: Flags [.], ack 83709, win 291, options [nop,nop,TS val 3376930068 ecr 1574865677], length 0
02:45:01.843068 IP 10.8.2.2.55694 > 99.181.69.125.1935: Flags [P.], seq 92907:93518, ack 1, win 501, options [nop,nop,TS val 1574866046 ecr 3376930068], length 611
02:45:01.904985 IP 10.8.2.2.55694 > 99.181.69.125.1935: Flags [.], seq 93518:94832, ack 1, win 501, options [nop,nop,TS val 1574866108 ecr 3376930068], length 1314
02:45:01.913362 IP 99.181.69.125.1935 > 10.8.2.2.55694: Flags [.], ack 86337, win 291, options [nop,nop,TS val 3376930136 ecr 1574865780], length 0
02:45:01.942860 IP 10.8.2.2.55694 > 99.181.69.125.1935: Flags [.], seq 94832:96146, ack 1, win 501, options [nop,nop,TS val 1574866146 ecr 3376930136], length 1314
02:45:01.976715 IP 10.8.2.2.55694 > 99.181.69.125.1935: Flags [.], seq 96146:97460, ack 1, win 501, options [nop,nop,TS val 1574866179 ecr 3376930136], length 1314
02:45:02.043126 IP 10.8.2.2.55694 > 99.181.69.125.1935: Flags [.], seq 97460:98774, ack 1, win 501, options [nop,nop,TS val 1574866246 ecr 3376930136], length 1314
02:45:02.076118 IP 10.8.2.2.55694 > 99.181.69.125.1935: Flags [.], seq 98774:100088, ack 1, win 501, options [nop,nop,TS val 1574866279 ecr 3376930136], length 1314
02:45:02.085583 IP 99.181.69.125.1935 > 10.8.2.2.55694: Flags [.], ack 88965, win 291, options [nop,nop,TS val 3376930295 ecr 1574865851], length 0
02:45:02.109757 IP 10.8.2.2.55694 > 99.181.69.125.1935: Flags [.], seq 100088:101402, ack 1, win 501, options [nop,nop,TS val 1574866312 ecr 3376930295], length 1314
02:45:02.142453 IP 99.181.69.125.1935 > 10.8.2.2.55694: Flags [.], ack 91593, win 291, options [nop,nop,TS val 3376930351 ecr 1574865944], length 0
02:45:02.169931 IP 99.181.69.125.1935 > 10.8.2.2.55694: Flags [.], ack 93518, win 292, options [nop,nop,TS val 3376930374 ecr 1574866043], length 0
02:45:02.169957 IP 10.8.2.2.55694 > 99.181.69.125.1935: Flags [P.], seq 101402:102653, ack 1, win 501, options [nop,nop,TS val 1574866373 ecr 3376930374], length 1251
02:45:02.208568 IP 10.8.2.2.55694 > 99.181.69.125.1935: Flags [.], seq 102653:103967, ack 1, win 501, options [nop,nop,TS val 1574866411 ecr 3376930374], length 1314
02:45:02.244086 IP 10.8.2.2.55694 > 99.181.69.125.1935: Flags [.], seq 103967:105281, ack 1, win 501, options [nop,nop,TS val 1574866447 ecr 3376930374], length 1314
02:45:02.253029 IP 99.181.69.125.1935 > 10.8.2.2.55694: Flags [.], ack 96146, win 291, options [nop,nop,TS val 3376930474 ecr 1574866108], length 0
02:45:02.289590 IP 10.8.2.2.55694 > 99.181.69.125.1935: Flags [.], seq 105281:106595, ack 1, win 501, options [nop,nop,TS val 1574866492 ecr 3376930474], length 1314
02:45:02.340258 IP 10.8.2.2.55694 > 99.181.69.125.1935: Flags [.], seq 106595:107909, ack 1, win 501, options [nop,nop,TS val 1574866543 ecr 3376930474], length 1314
02:45:02.362437 IP 99.181.69.125.1935 > 10.8.2.2.55694: Flags [.], ack 97460, win 292, options [nop,nop,TS val 3376930586 ecr 1574866179], length 0
02:45:02.373191 IP 10.8.2.2.55694 > 99.181.69.125.1935: Flags [.], seq 107909:109223, ack 1, win 501, options [nop,nop,TS val 1574866576 ecr 3376930586], length 1314
02:45:02.398046 IP 99.181.69.125.1935 > 10.8.2.2.55694: Flags [.], ack 100088, win 292, options [nop,nop,TS val 3376930620 ecr 1574866246], length 0
02:45:02.416905 IP 10.8.2.2.55694 > 99.181.69.125.1935: Flags [.], seq 109223:110537, ack 1, win 501, options [nop,nop,TS val 1574866620 ecr 3376930620], length 1314
02:45:02.477756 IP 10.8.2.2.55694 > 99.181.69.125.1935: Flags [.], seq 110537:111851, ack 1, win 501, options [nop,nop,TS val 1574866680 ecr 3376930620], length 1314
02:45:02.491359 IP 99.181.69.125.1935 > 10.8.2.2.55694: Flags [.], ack 102653, win 292, options [nop,nop,TS val 3376930715 ecr 1574866312], length 0
02:45:02.491371 IP 10.8.2.2.55694 > 99.181.69.125.1935: Flags [P.], seq 111851:112556, ack 1, win 501, options [nop,nop,TS val 1574866694 ecr 3376930715], length 705
02:45:02.540260 IP 10.8.2.2.55694 > 99.181.69.125.1935: Flags [.], seq 112556:113870, ack 1, win 501, options [nop,nop,TS val 1574866743 ecr 3376930715], length 1314
02:45:02.558023 IP 99.181.69.125.1935 > 10.8.2.2.55694: Flags [.], ack 105281, win 292, options [nop,nop,TS val 3376930778 ecr 1574866411], length 0
02:45:02.576985 IP 10.8.2.2.55694 > 99.181.69.125.1935: Flags [.], seq 113870:115184, ack 1, win 501, options [nop,nop,TS val 1574866780 ecr 3376930778], length 1314
02:45:02.610941 IP 10.8.2.2.55694 > 99.181.69.125.1935: Flags [.], seq 115184:116498, ack 1, win 501, options [nop,nop,TS val 1574866814 ecr 3376930778], length 1314
02:45:02.645882 IP 99.181.69.125.1935 > 10.8.2.2.55694: Flags [.], ack 107909, win 291, options [nop,nop,TS val 3376930871 ecr 1574866492], length 0
02:45:02.672991 IP 10.8.2.2.55694 > 99.181.69.125.1935: Flags [.], seq 116498:117812, ack 1, win 501, options [nop,nop,TS val 1574866876 ecr 3376930871], length 1314
02:45:02.710433 IP 10.8.2.2.55694 > 99.181.69.125.1935: Flags [.], seq 117812:119126, ack 1, win 501, options [nop,nop,TS val 1574866913 ecr 3376930871], length 1314
02:45:02.722748 IP 99.181.69.125.1935 > 10.8.2.2.55694: Flags [.], ack 110537, win 291, options [nop,nop,TS val 3376930948 ecr 1574866576], length 0
02:45:02.740108 IP 10.8.2.2.55694 > 99.181.69.125.1935: Flags [.], seq 119126:120440, ack 1, win 501, options [nop,nop,TS val 1574866943 ecr 3376930948], length 1314
02:45:02.795275 IP 99.181.69.125.1935 > 10.8.2.2.55694: Flags [.], ack 112556, win 292, options [nop,nop,TS val 3376931021 ecr 1574866680], length 0
02:45:02.795338 IP 10.8.2.2.55694 > 99.181.69.125.1935: Flags [P.], seq 120440:121513, ack 1, win 501, options [nop,nop,TS val 1574866998 ecr 3376931021], length 1073
02:45:02.841036 IP 10.8.2.2.55694 > 99.181.69.125.1935: Flags [.], seq 121513:122827, ack 1, win 501, options [nop,nop,TS val 1574867044 ecr 3376931021], length 1314
02:45:02.873609 IP 10.8.2.2.55694 > 99.181.69.125.1935: Flags [.], seq 122827:124141, ack 1, win 501, options [nop,nop,TS val 1574867076 ecr 3376931021], length 1314
02:45:02.881190 IP 99.181.69.125.1935 > 10.8.2.2.55694: Flags [.], ack 115184, win 292, options [nop,nop,TS val 3376931106 ecr 1574866743], length 0
02:45:02.907084 IP 10.8.2.2.55694 > 99.181.69.125.1935: Flags [.], seq 124141:125455, ack 1, win 501, options [nop,nop,TS val 1574867110 ecr 3376931106], length 1314
02:45:02.971047 IP 10.8.2.2.55694 > 99.181.69.125.1935: Flags [.], seq 125455:126769, ack 1, win 501, options [nop,nop,TS val 1574867174 ecr 3376931106], length 1314
02:45:02.977478 IP 99.181.69.125.1935 > 10.8.2.2.55694: Flags [.], ack 117812, win 291, options [nop,nop,TS val 3376931202 ecr 1574866814], length 0
02:45:03.010975 IP 10.8.2.2.55694 > 99.181.69.125.1935: Flags [.], seq 126769:128083, ack 1, win 501, options [nop,nop,TS val 1574867214 ecr 3376931202], length 1314
02:45:03.044178 IP 10.8.2.2.55694 > 99.181.69.125.1935: Flags [.], seq 128083:129397, ack 1, win 501, options [nop,nop,TS val 1574867247 ecr 3376931202], length 1314
02:45:03.044235 IP 99.181.69.125.1935 > 10.8.2.2.55694: Flags [.], ack 120440, win 291, options [nop,nop,TS val 3376931269 ecr 1574866913], length 0
02:45:03.099654 IP 99.181.69.125.1935 > 10.8.2.2.55694: Flags [.], ack 121513, win 292, options [nop,nop,TS val 3376931325 ecr 1574866998], length 0
02:45:03.099672 IP 10.8.2.2.55694 > 99.181.69.125.1935: Flags [P.], seq 129397:130553, ack 1, win 501, options [nop,nop,TS val 1574867302 ecr 3376931325], length 1156
02:45:03.142556 IP 10.8.2.2.55694 > 99.181.69.125.1935: Flags [.], seq 130553:131867, ack 1, win 501, options [nop,nop,TS val 1574867345 ecr 3376931325], length 1314
02:45:03.177485 IP 10.8.2.2.55694 > 99.181.69.125.1935: Flags [.], seq 131867:133181, ack 1, win 501, options [nop,nop,TS val 1574867380 ecr 3376931325], length 1314
02:45:03.178038 IP 99.181.69.125.1935 > 10.8.2.2.55694: Flags [.], ack 124141, win 292, options [nop,nop,TS val 3376931403 ecr 1574867044], length 0
02:45:03.228277 IP 10.8.2.2.55694 > 99.181.69.125.1935: Flags [.], seq 133181:134495, ack 1, win 501, options [nop,nop,TS val 1574867431 ecr 3376931403], length 1314
02:45:03.275304 IP 99.181.69.125.1935 > 10.8.2.2.55694: Flags [.], ack 126769, win 291, options [nop,nop,TS val 3376931501 ecr 1574867110], length 0
02:45:03.277101 IP 10.8.2.2.55694 > 99.181.69.125.1935: Flags [.], seq 134495:135809, ack 1, win 501, options [nop,nop,TS val 1574867480 ecr 3376931501], length 1314
02:45:03.309194 IP 10.8.2.2.55694 > 99.181.69.125.1935: Flags [.], seq 135809:137123, ack 1, win 501, options [nop,nop,TS val 1574867512 ecr 3376931501], length 1314
02:45:03.348450 IP 99.181.69.125.1935 > 10.8.2.2.55694: Flags [.], ack 129397, win 291, options [nop,nop,TS val 3376931574 ecr 1574867214], length 0
02:45:03.356356 IP 10.8.2.2.55694 > 99.181.69.125.1935: Flags [.], seq 137123:138437, ack 1, win 501, options [nop,nop,TS val 1574867559 ecr 3376931574], length 1314
02:45:03.403981 IP 99.181.69.125.1935 > 10.8.2.2.55694: Flags [.], ack 130553, win 292, options [nop,nop,TS val 3376931629 ecr 1574867302], length 0
02:45:03.404015 IP 10.8.2.2.55694 > 99.181.69.125.1935: Flags [P.], seq 138437:139514, ack 1, win 501, options [nop,nop,TS val 1574867607 ecr 3376931629], length 1077
02:45:03.440117 IP 10.8.2.2.55694 > 99.181.69.125.1935: Flags [.], seq 139514:140828, ack 1, win 501, options [nop,nop,TS val 1574867643 ecr 3376931629], length 1314
02:45:03.473657 IP 10.8.2.2.55694 > 99.181.69.125.1935: Flags [.], seq 140828:142142, ack 1, win 501, options [nop,nop,TS val 1574867676 ecr 3376931629], length 1314
02:45:03.481793 IP 99.181.69.125.1935 > 10.8.2.2.55694: Flags [.], ack 133181, win 292, options [nop,nop,TS val 3376931707 ecr 1574867345], length 0
02:45:03.526735 IP 10.8.2.2.55694 > 99.181.69.125.1935: Flags [.], seq 142142:143456, ack 1, win 501, options [nop,nop,TS val 1574867729 ecr 3376931707], length 1314
02:45:03.576525 IP 10.8.2.2.55694 > 99.181.69.125.1935: Flags [.], seq 143456:144770, ack 1, win 501, options [nop,nop,TS val 1574867779 ecr 3376931707], length 1314
02:45:03.582428 IP 99.181.69.125.1935 > 10.8.2.2.55694: Flags [.], ack 135809, win 292, options [nop,nop,TS val 3376931807 ecr 1574867431], length 0
02:45:03.608556 IP 10.8.2.2.55694 > 99.181.69.125.1935: Flags [.], seq 144770:146084, ack 1, win 501, options [nop,nop,TS val 1574867811 ecr 3376931807], length 1314
02:45:03.655009 IP 10.8.2.2.55694 > 99.181.69.125.1935: Flags [.], seq 146084:147398, ack 1, win 501, options [nop,nop,TS val 1574867858 ecr 3376931807], length 1314
02:45:03.660523 IP 99.181.69.125.1935 > 10.8.2.2.55694: Flags [.], ack 138437, win 292, options [nop,nop,TS val 3376931886 ecr 1574867512], length 0
02:45:03.708090 IP 10.8.2.2.55694 > 99.181.69.125.1935: Flags [.], seq 147398:148712, ack 1, win 501, options [nop,nop,TS val 1574867911 ecr 3376931886], length 1314
02:45:03.708167 IP 99.181.69.125.1935 > 10.8.2.2.55694: Flags [.], ack 139514, win 292, options [nop,nop,TS val 3376931933 ecr 1574867607], length 0
02:45:03.708184 IP 10.8.2.2.55694 > 99.181.69.125.1935: Flags [P.], seq 148712:149310, ack 1, win 501, options [nop,nop,TS val 1574867911 ecr 3376931933], length 598
02:45:03.776578 IP 10.8.2.2.55694 > 99.181.69.125.1935: Flags [.], seq 149310:150624, ack 1, win 501, options [nop,nop,TS val 1574867979 ecr 3376931933], length 1314
02:45:03.779314 IP 99.181.69.125.1935 > 10.8.2.2.55694: Flags [.], ack 142142, win 292, options [nop,nop,TS val 3376932004 ecr 1574867643], length 0
02:45:03.808580 IP 10.8.2.2.55694 > 99.181.69.125.1935: Flags [.], seq 150624:151938, ack 1, win 501, options [nop,nop,TS val 1574868011 ecr 3376932004], length 1314
02:45:03.839785 IP 10.8.2.2.55694 > 99.181.69.125.1935: Flags [.], seq 151938:153252, ack 1, win 501, options [nop,nop,TS val 1574868042 ecr 3376932004], length 1314
02:45:03.880433 IP 99.181.69.125.1935 > 10.8.2.2.55694: Flags [.], ack 144770, win 292, options [nop,nop,TS val 3376932106 ecr 1574867729], length 0
02:45:03.910818 IP 10.8.2.2.55694 > 99.181.69.125.1935: Flags [.], seq 153252:154566, ack 1, win 501, options [nop,nop,TS val 1574868113 ecr 3376932106], length 1314
02:45:03.944100 IP 10.8.2.2.55694 > 99.181.69.125.1935: Flags [.], seq 154566:155880, ack 1, win 501, options [nop,nop,TS val 1574868147 ecr 3376932106], length 1314
02:45:03.959641 IP 99.181.69.125.1935 > 10.8.2.2.55694: Flags [.], ack 147398, win 292, options [nop,nop,TS val 3376932185 ecr 1574867811], length 0
02:45:03.975638 IP 10.8.2.2.55694 > 99.181.69.125.1935: Flags [.], seq 155880:157194, ack 1, win 501, options [nop,nop,TS val 1574868178 ecr 3376932185], length 1314
02:45:04.012082 IP 99.181.69.125.1935 > 10.8.2.2.55694: Flags [.], ack 149310, win 292, options [nop,nop,TS val 3376932237 ecr 1574867911], length 0
02:45:04.012101 IP 10.8.2.2.55694 > 99.181.69.125.1935: Flags [P.], seq 157194:158267, ack 1, win 501, options [nop,nop,TS val 1574868215 ecr 3376932237], length 1073
02:45:04.074397 IP 10.8.2.2.55694 > 99.181.69.125.1935: Flags [.], seq 158267:159581, ack 1, win 501, options [nop,nop,TS val 1574868277 ecr 3376932237], length 1314
02:45:04.110909 IP 10.8.2.2.55694 > 99.181.69.125.1935: Flags [.], seq 159581:160895, ack 1, win 501, options [nop,nop,TS val 1574868314 ecr 3376932237], length 1314
02:45:04.112836 IP 99.181.69.125.1935 > 10.8.2.2.55694: Flags [.], ack 151938, win 292, options [nop,nop,TS val 3376932338 ecr 1574867979], length 0
02:45:04.142555 IP 10.8.2.2.55694 > 99.181.69.125.1935: Flags [.], seq 160895:162209, ack 1, win 501, options [nop,nop,TS val 1574868345 ecr 3376932338], length 1314
02:45:04.207935 IP 10.8.2.2.55694 > 99.181.69.125.1935: Flags [.], seq 162209:163523, ack 1, win 501, options [nop,nop,TS val 1574868411 ecr 3376932338], length 1314
02:45:04.214420 IP 99.181.69.125.1935 > 10.8.2.2.55694: Flags [.], ack 153252, win 292, options [nop,nop,TS val 3376932438 ecr 1574868042], length 0
02:45:04.239808 IP 10.8.2.2.55694 > 99.181.69.125.1935: Flags [.], seq 163523:164837, ack 1, win 501, options [nop,nop,TS val 1574868443 ecr 3376932438], length 1314
02:45:04.250451 IP 99.181.69.125.1935 > 10.8.2.2.55694: Flags [.], ack 155880, win 292, options [nop,nop,TS val 3376932474 ecr 1574868113], length 0
02:45:04.274192 IP 10.8.2.2.55694 > 99.181.69.125.1935: Flags [.], seq 164837:166151, ack 1, win 501, options [nop,nop,TS val 1574868477 ecr 3376932474], length 1314
02:45:04.316510 IP 99.181.69.125.1935 > 10.8.2.2.55694: Flags [.], ack 158267, win 292, options [nop,nop,TS val 3376932542 ecr 1574868178], length 0
02:45:04.316549 IP 10.8.2.2.55694 > 99.181.69.125.1935: Flags [P.], seq 166151:167228, ack 1, win 501, options [nop,nop,TS val 1574868519 ecr 3376932542], length 1077
02:45:04.374848 IP 10.8.2.2.55694 > 99.181.69.125.1935: Flags [.], seq 167228:168542, ack 1, win 501, options [nop,nop,TS val 1574868578 ecr 3376932542], length 1314
02:45:04.407699 IP 10.8.2.2.55694 > 99.181.69.125.1935: Flags [.], seq 168542:169856, ack 1, win 501, options [nop,nop,TS val 1574868610 ecr 3376932542], length 1314
02:45:04.415272 IP 99.181.69.125.1935 > 10.8.2.2.55694: Flags [.], ack 160895, win 292, options [nop,nop,TS val 3376932640 ecr 1574868277], length 0
02:45:04.441308 IP 10.8.2.2.55694 > 99.181.69.125.1935: Flags [.], seq 169856:171170, ack 1, win 501, options [nop,nop,TS val 1574868644 ecr 3376932640], length 1314
02:45:04.506459 IP 10.8.2.2.55694 > 99.181.69.125.1935: Flags [.], seq 171170:172484, ack 1, win 501, options [nop,nop,TS val 1574868709 ecr 3376932640], length 1314
02:45:04.513392 IP 99.181.69.125.1935 > 10.8.2.2.55694: Flags [.], ack 163523, win 291, options [nop,nop,TS val 3376932738 ecr 1574868345], length 0
02:45:04.540288 IP 10.8.2.2.55694 > 99.181.69.125.1935: Flags [.], seq 172484:173798, ack 1, win 501, options [nop,nop,TS val 1574868743 ecr 3376932738], length 1314
02:45:04.572689 IP 10.8.2.2.55694 > 99.181.69.125.1935: Flags [.], seq 173798:175112, ack 1, win 501, options [nop,nop,TS val 1574868775 ecr 3376932738], length 1314
02:45:04.578043 IP 99.181.69.125.1935 > 10.8.2.2.55694: Flags [.], ack 166151, win 291, options [nop,nop,TS val 3376932803 ecr 1574868443], length 0
02:45:04.620499 IP 99.181.69.125.1935 > 10.8.2.2.55694: Flags [.], ack 167228, win 292, options [nop,nop,TS val 3376932846 ecr 1574868519], length 0
02:45:04.620540 IP 10.8.2.2.55694 > 99.181.69.125.1935: Flags [P.], seq 175112:176264, ack 1, win 501, options [nop,nop,TS val 1574868823 ecr 3376932846], length 1152
02:45:04.674890 IP 10.8.2.2.55694 > 99.181.69.125.1935: Flags [.], seq 176264:177578, ack 1, win 501, options [nop,nop,TS val 1574868878 ecr 3376932846], length 1314
02:45:04.707163 IP 10.8.2.2.55694 > 99.181.69.125.1935: Flags [.], seq 177578:178892, ack 1, win 501, options [nop,nop,TS val 1574868910 ecr 3376932846], length 1314
02:45:04.711781 IP 99.181.69.125.1935 > 10.8.2.2.55694: Flags [.], ack 169856, win 292, options [nop,nop,TS val 3376932937 ecr 1574868578], length 0
02:45:04.743449 IP 10.8.2.2.55694 > 99.181.69.125.1935: Flags [.], seq 178892:180206, ack 1, win 501, options [nop,nop,TS val 1574868946 ecr 3376932937], length 1314
02:45:04.808008 IP 10.8.2.2.55694 > 99.181.69.125.1935: Flags [.], seq 180206:181520, ack 1, win 501, options [nop,nop,TS val 1574869011 ecr 3376932937], length 1314
02:45:04.810663 IP 99.181.69.125.1935 > 10.8.2.2.55694: Flags [.], ack 172484, win 291, options [nop,nop,TS val 3376933036 ecr 1574868644], length 0
02:45:04.840407 IP 10.8.2.2.55694 > 99.181.69.125.1935: Flags [.], seq 181520:182834, ack 1, win 501, options [nop,nop,TS val 1574869043 ecr 3376933036], length 1314
02:45:04.873619 IP 10.8.2.2.55694 > 99.181.69.125.1935: Flags [.], seq 182834:184148, ack 1, win 501, options [nop,nop,TS val 1574869076 ecr 3376933036], length 1314
02:45:04.877401 IP 99.181.69.125.1935 > 10.8.2.2.55694: Flags [.], ack 175112, win 291, options [nop,nop,TS val 3376933102 ecr 1574868743], length 0
02:45:04.924794 IP 99.181.69.125.1935 > 10.8.2.2.55694: Flags [.], ack 176264, win 292, options [nop,nop,TS val 3376933150 ecr 1574868823], length 0
02:45:04.924809 IP 10.8.2.2.55694 > 99.181.69.125.1935: Flags [P.], seq 184148:185224, ack 1, win 501, options [nop,nop,TS val 1574869128 ecr 3376933150], length 1076
02:45:04.976747 IP 10.8.2.2.55694 > 99.181.69.125.1935: Flags [.], seq 185224:186538, ack 1, win 501, options [nop,nop,TS val 1574869179 ecr 3376933150], length 1314
02:45:05.010860 IP 10.8.2.2.55694 > 99.181.69.125.1935: Flags [.], seq 186538:187852, ack 1, win 501, options [nop,nop,TS val 1574869214 ecr 3376933150], length 1314
