09:05:34.055292 IP 10.8.3.3.60412 > 52.223.203.236.1935: Flags [.], seq 2020912567:2020913881, ack 1539472249, win 501, options [nop,nop,TS val 1658591370 ecr 2794125345], length 1314
09:05:34.113620 IP 52.223.203.236.1935 > 10.8.3.3.60412: Flags [.], ack 4294960968, win 126, options [nop,nop,TS val 2794125441 ecr 1658591072], length 0
09:05:34.124304 IP 10.8.3.3.60412 > 52.223.203.236.1935: Flags [.], seq 1314:2628, ack 1, win 501, options [nop,nop,TS val 1658591439 ecr 2794125441], length 1314
09:05:34.157690 IP 10.8.3.3.60412 > 52.223.203.236.1935: Flags [.], seq 2628:3942, ack 1, win 501, options [nop,nop,TS val 1658591472 ecr 2794125441], length 1314
09:05:34.183881 IP 52.223.203.236.1935 > 10.8.3.3.60412: Flags [.], ack 4294963596, win 126, options [nop,nop,TS val 2794125512 ecr 1658591171], length 0
09:05:34.191208 IP 10.8.3.3.60412 > 52.223.203.236.1935: Flags [.], seq 3942:5256, ack 1, win 501, options [nop,nop,TS val 1658591505 ecr 2794125512], length 1314
09:05:34.227633 IP 52.223.203.236.1935 > 10.8.3.3.60412: Flags [.], ack 4294964668, win 126, options [nop,nop,TS val 2794125556 ecr 1658591249], length 0
09:05:34.227665 IP 10.8.3.3.60412 > 52.223.203.236.1935: Flags [P.], seq 5256:6321, ack 1, win 501, options [nop,nop,TS val 1658591542 ecr 2794125556], length 1065
09:05:34.289779 IP 10.8.3.3.60412 > 52.223.203.236.1935: Flags [.], seq 6321:7635, ack 1, win 501, options [nop,nop,TS val 1658591604 ecr 2794125556], length 1314
09:05:34.316802 IP 52.223.203.236.1935 > 10.8.3.3.60412: Flags [.], ack 0, win 126, options [nop,nop,TS val 2794125645 ecr 1658591307], length 0
09:05:34.324378 IP 10.8.3.3.60412 > 52.223.203.236.1935: Flags [.], seq 7635:8949, ack 1, win 501, options [nop,nop,TS val 1658591639 ecr 2794125645], length 1314
09:05:34.356068 IP 10.8.3.3.60412 > 52.223.203.236.1935: Flags [.], seq 8949:10263, ack 1, win 501, options [nop,nop,TS val 1658591670 ecr 2794125645], length 1314
09:05:34.416826 IP 52.223.203.236.1935 > 10.8.3.3.60412: Flags [.], ack 1314, win 126, options [nop,nop,TS val 2794125745 ecr 1658591370], length 0
09:05:34.423945 IP 10.8.3.3.60412 > 52.223.203.236.1935: Flags [.], seq 10263:11577, ack 1, win 501, options [nop,nop,TS val 1658591738 ecr 2794125745], length 1314
09:05:34.450211 IP 52.223.203.236.1935 > 10.8.3.3.60412: Flags [.], ack 3942, win 126, options [nop,nop,TS val 2794125778 ecr 1658591439], length 0
09:05:34.455879 IP 10.8.3.3.60412 > 52.223.203.236.1935: Flags [.], seq 11577:12891, ack 1, win 501, options [nop,nop,TS val 1658591770 ecr 2794125778], length 1314
09:05:34.490434 IP 10.8.3.3.60412 > 52.223.203.236.1935: Flags [.], seq 12891:14205, ack 1, win 501, options [nop,nop,TS val 1658591805 ecr 2794125778], length 1314
09:05:34.520399 IP 52.223.203.236.1935 > 10.8.3.3.60412: Flags [.], ack 6321, win 126, options [nop,nop,TS val 2794125848 ecr 1658591505], length 0
09:05:34.520428 IP 10.8.3.3.60412 > 52.223.203.236.1935: Flags [P.], seq 14205:14435, ack 1, win 501, options [nop,nop,TS val 1658591835 ecr 2794125848], length 230
09:05:34.553812 IP 10.8.3.3.60412 > 52.223.203.236.1935: Flags [.], seq 14435:15749, ack 1, win 501, options [nop,nop,TS val 1658591868 ecr 2794125848], length 1314
09:05:34.587693 IP 10.8.3.3.60412 > 52.223.203.236.1935: Flags [.], seq 15749:17063, ack 1, win 501, options [nop,nop,TS val 1658591902 ecr 2794125848], length 1314
09:05:34.617242 IP 52.223.203.236.1935 > 10.8.3.3.60412: Flags [.], ack 8949, win 126, options [nop,nop,TS val 2794125945 ecr 1658591604], length 0
09:05:34.647429 IP 10.8.3.3.60412 > 52.223.203.236.1935: Flags [.], seq 17063:18377, ack 1, win 501, options [nop,nop,TS val 1658591962 ecr 2794125945], length 1314
09:05:34.692253 IP 10.8.3.3.60412 > 52.223.203.236.1935: Flags [.], seq 18377:19691, ack 1, win 501, options [nop,nop,TS val 1658592007 ecr 2794125945], length 1314
09:05:34.716872 IP 52.223.203.236.1935 > 10.8.3.3.60412: Flags [.], ack 11577, win 126, options [nop,nop,TS val 2794126045 ecr 1658591670], length 0
09:05:34.724764 IP 10.8.3.3.60412 > 52.223.203.236.1935: Flags [.], seq 19691:21005, ack 1, win 501, options [nop,nop,TS val 1658592039 ecr 2794126045], length 1314
09:05:34.776005 IP 10.8.3.3.60412 > 52.223.203.236.1935: Flags [.], seq 21005:22319, ack 1, win 501, options [nop,nop,TS val 1658592090 ecr 2794126045], length 1314
09:05:34.783028 IP 52.223.203.236.1935 > 10.8.3.3.60412: Flags [.], ack 14205, win 126, options [nop,nop,TS val 2794126111 ecr 1658591770], length 0
09:05:34.813503 IP 52.223.203.236.1935 > 10.8.3.3.60412: Flags [.], ack 14435, win 126, options [nop,nop,TS val 2794126141 ecr 1658591835], length 0
09:05:34.813534 IP 10.8.3.3.60412 > 52.223.203.236.1935: Flags [P.], seq 22319:23292, ack 1, win 501, options [nop,nop,TS val 1658592128 ecr 2794126141], length 973
09:05:34.856512 IP 10.8.3.3.60412 > 52.223.203.236.1935: Flags [.], seq 23292:24606, ack 1, win 501, options [nop,nop,TS val 1658592171 ecr 2794126141], length 1314
09:05:34.880479 IP 52.223.203.236.1935 > 10.8.3.3.60412: Flags [.], ack 17063, win 126, options [nop,nop,TS val 2794126208 ecr 1658591868], length 0
09:05:34.889926 IP 10.8.3.3.60412 > 52.223.203.236.1935: Flags [.], seq 24606:25920, ack 1, win 501, options [nop,nop,TS val 1658592204 ecr 2794126208], length 1314
09:05:34.925748 IP 10.8.3.3.60412 > 52.223.203.236.1935: Flags [.], seq 25920:27234, ack 1, win 501, options [nop,nop,TS val 1658592240 ecr 2794126208], length 1314
09:05:34.985018 IP 52.223.203.236.1935 > 10.8.3.3.60412: Flags [.], ack 19691, win 126, options [nop,nop,TS val 2794126313 ecr 1658591962], length 0
09:05:34.992561 IP 10.8.3.3.60412 > 52.223.203.236.1935: Flags [.], seq 27234:28548, ack 1, win 501, options [nop,nop,TS val 1658592307 ecr 2794126313], length 1314
09:05:35.024844 IP 10.8.3.3.60412 > 52.223.203.236.1935: Flags [.], seq 28548:29862, ack 1, win 501, options [nop,nop,TS val 1658592339 ecr 2794126313], length 1314
09:05:35.056271 IP 10.8.3.3.60412 > 52.223.203.236.1935: Flags [.], seq 29862:31176, ack 1, win 501, options [nop,nop,TS val 1658592371 ecr 2794126313], length 1314
09:05:35.068831 IP 52.223.203.236.1935 > 10.8.3.3.60412: Flags [.], ack 22319, win 126, options [nop,nop,TS val 2794126397 ecr 1658592039], length 0
09:05:35.106055 IP 52.223.203.236.1935 > 10.8.3.3.60412: Flags [.], ack 23292, win 126, options [nop,nop,TS val 2794126434 ecr 1658592128], length 0
09:05:35.106120 IP 10.8.3.3.60412 > 52.223.203.236.1935: Flags [P.], seq 31176:32242, ack 1, win 501, options [nop,nop,TS val 1658592420 ecr 2794126434], length 1066
09:05:35.155871 IP 10.8.3.3.60412 > 52.223.203.236.1935: Flags [.], seq 32242:33556, ack 1, win 501, options [nop,nop,TS val 1658592470 ecr 2794126434], length 1314
09:05:35.182553 IP 52.223.203.236.1935 > 10.8.3.3.60412: Flags [.], ack 25920, win 126, options [nop,nop,TS val 2794126511 ecr 1658592171], length 0
09:05:35.188285 IP 10.8.3.3.60412 > 52.223.203.236.1935: Flags [.], seq 33556:34870, ack 1, win 501, options [nop,nop,TS val 1658592503 ecr 2794126511], length 1314
09:05:35.225400 IP 10.8.3.3.60412 > 52.223.203.236.1935: Flags [.], seq 34870:36184, ack 1, win 501, options [nop,nop,TS val 1658592540 ecr 2794126511], length 1314
09:05:35.285301 IP 52.223.203.236.1935 > 10.8.3.3.60412: Flags [.], ack 28548, win 126, options [nop,nop,TS val 2794126613 ecr 1658592240], length 0
09:05:35.289022 IP 10.8.3.3.60412 > 52.223.203.236.1935: Flags [.], seq 36184:37498, ack 1, win 501, options [nop,nop,TS val 1658592603 ecr 2794126613], length 1314
09:05:35.323772 IP 10.8.3.3.60412 > 52.223.203.236.1935: Flags [.], seq 37498:38812, ack 1, win 501, options [nop,nop,TS val 1658592638 ecr 2794126613], length 1314
09:05:35.349132 IP 52.223.203.236.1935 > 10.8.3.3.60412: Flags [.], ack 31176, win 126, options [nop,nop,TS val 2794126677 ecr 1658592339], length 0
09:05:35.358840 IP 10.8.3.3.60412 > 52.223.203.236.1935: Flags [.], seq 38812:40126, ack 1, win 501, options [nop,nop,TS val 1658592673 ecr 2794126677], length 1314
09:05:35.398603 IP 52.223.203.236.1935 > 10.8.3.3.60412: Flags [.], ack 32242, win 126, options [nop,nop,TS val 2794126727 ecr 1658592420], length 0
09:05:35.398631 IP 10.8.3.3.60412 > 52.223.203.236.1935: Flags [P.], seq 40126:41202, ack 1, win 501, options [nop,nop,TS val 1658592713 ecr 2794126727], length 1076
09:05:35.457309 IP 10.8.3.3.60412 > 52.223.203.236.1935: Flags [.], seq 41202:42516, ack 1, win 501, options [nop,nop,TS val 1658592772 ecr 2794126727], length 1314
09:05:35.480832 IP 52.223.203.236.1935 > 10.8.3.3.60412: Flags [.], ack 34870, win 126, options [nop,nop,TS val 2794126809 ecr 1658592470], length 0
09:05:35.492124 IP 10.8.3.3.60412 > 52.223.203.236.1935: Flags [.], seq 42516:43830, ack 1, win 501, options [nop,nop,TS val 1658592806 ecr 2794126809], length 1314
09:05:35.525729 IP 10.8.3.3.60412 > 52.223.203.236.1935: Flags [.], seq 43830:45144, ack 1, win 501, options [nop,nop,TS val 1658592840 ecr 2794126809], length 1314
09:05:35.581752 IP 52.223.203.236.1935 > 10.8.3.3.60412: Flags [.], ack 37498, win 126, options [nop,nop,TS val 2794126910 ecr 1658592540], length 0
09:05:35.588923 IP 10.8.3.3.60412 > 52.223.203.236.1935: Flags [.], seq 45144:46458, ack 1, win 501, options [nop,nop,TS val 1658592903 ecr 2794126910], length 1314
09:05:35.623850 IP 10.8.3.3.60412 > 52.223.203.236.1935: Flags [.], seq 46458:47772, ack 1, win 501, options [nop,nop,TS val 1658592938 ecr 2794126910], length 1314
09:05:35.651589 IP 52.223.203.236.1935 > 10.8.3.3.60412: Flags [.], ack 40126, win 126, options [nop,nop,TS val 2794126979 ecr 1658592638], length 0
09:05:35.658516 IP 10.8.3.3.60412 > 52.223.203.236.1935: Flags [.], seq 47772:49086, ack 1, win 501, options [nop,nop,TS val 1658592973 ecr 2794126979], length 1314
09:05:35.693455 IP 52.223.203.236.1935 > 10.8.3.3.60412: Flags [.], ack 41202, win 126, options [nop,nop,TS val 2794127019 ecr 1658592713], length 0
09:05:35.693486 IP 10.8.3.3.60412 > 52.223.203.236.1935: Flags [P.], seq 49086:50056, ack 1, win 501, options [nop,nop,TS val 1658593008 ecr 2794127019], length 970
09:05:35.760312 IP 10.8.3.3.60412 > 52.223.203.236.1935: Flags [.], seq 50056:51370, ack 1, win 501, options [nop,nop,TS val 1658593075 ecr 2794127019], length 1314
09:05:35.784765 IP 52.223.203.236.1935 > 10.8.3.3.60412: Flags [.], ack 43830, win 126, options [nop,nop,TS val 2794127113 ecr 1658592772], length 0
09:05:35.790878 IP 10.8.3.3.60412 > 52.223.203.236.1935: Flags [.], seq 51370:52684, ack 1, win 501, options [nop,nop,TS val 1658593105 ecr 2794127113], length 1314
09:05:35.824506 IP 10.8.3.3.60412 > 52.223.203.236.1935: Flags [.], seq 52684:53998, ack 1, win 501, options [nop,nop,TS val 1658593139 ecr 2794127113], length 1314
09:05:35.881663 IP 52.223.203.236.1935 > 10.8.3.3.60412: Flags [.], ack 46458, win 126, options [nop,nop,TS val 2794127209 ecr 1658592840], length 0
09:05:35.890318 IP 10.8.3.3.60412 > 52.223.203.236.1935: Flags [.], seq 53998:55312, ack 1, win 501, options [nop,nop,TS val 1658593205 ecr 2794127209], length 1314
09:05:35.924264 IP 10.8.3.3.60412 > 52.223.203.236.1935: Flags [.], seq 55312:56626, ack 1, win 501, options [nop,nop,TS val 1658593239 ecr 2794127209], length 1314
09:05:35.951476 IP 52.223.203.236.1935 > 10.8.3.3.60412: Flags [.], ack 49086, win 126, options [nop,nop,TS val 2794127279 ecr 1658592938], length 0
09:05:35.957269 IP 10.8.3.3.60412 > 52.223.203.236.1935: Flags [.], seq 56626:57940, ack 1, win 501, options [nop,nop,TS val 1658593272 ecr 2794127279], length 1314
09:05:35.986070 IP 52.223.203.236.1935 > 10.8.3.3.60412: Flags [.], ack 50056, win 126, options [nop,nop,TS val 2794127314 ecr 1658593008], length 0
09:05:35.986124 IP 10.8.3.3.60412 > 52.223.203.236.1935: Flags [P.], seq 57940:58164, ack 1, win 501, options [nop,nop,TS val 1658593300 ecr 2794127314], length 224
09:05:36.023750 IP 10.8.3.3.60412 > 52.223.203.236.1935: Flags [.], seq 58164:59478, ack 1, win 501, options [nop,nop,TS val 1658593338 ecr 2794127314], length 1314
09:05:36.059771 IP 10.8.3.3.60412 > 52.223.203.236.1935: Flags [.], seq 59478:60792, ack 1, win 501, options [nop,nop,TS val 1658593374 ecr 2794127314], length 1314
09:05:36.083386 IP 52.223.203.236.1935 > 10.8.3.3.60412: Flags [.], ack 52684, win 126, options [nop,nop,TS val 2794127411 ecr 1658593075], length 0
09:05:36.102290 IP 10.8.3.3.60412 > 52.223.203.236.1935: Flags [.], seq 60792:62106, ack 1, win 501, options [nop,nop,TS val 1658593417 ecr 2794127411], length 1314
09:05:36.157881 IP 10.8.3.3.60412 > 52.223.203.236.1935: Flags [.], seq 62106:63420, ack 1, win 501, options [nop,nop,TS val 1658593472 ecr 2794127411], length 1314
09:05:36.182851 IP 52.223.203.236.1935 > 10.8.3.3.60412: Flags [.], ack 55312, win 126, options [nop,nop,TS val 2794127511 ecr 1658593139], length 0
09:05:36.189585 IP 10.8.3.3.60412 > 52.223.203.236.1935: Flags [.], seq 63420:64734, ack 1, win 501, options [nop,nop,TS val 1658593504 ecr 2794127511], length 1314
09:05:36.231116 IP 10.8.3.3.60412 > 52.223.203.236.1935: Flags [.], seq 64734:66048, ack 1, win 501, options [nop,nop,TS val 1658593545 ecr 2794127511], length 1314
09:05:36.250106 IP 52.223.203.236.1935 > 10.8.3.3.60412: Flags [.], ack 57940, win 126, options [nop,nop,TS val 2794127578 ecr 1658593239], length 0
09:05:36.278900 IP 52.223.203.236.1935 > 10.8.3.3.60412: Flags [.], ack 58164, win 126, options [nop,nop,TS val 2794127607 ecr 1658593300], length 0
09:05:36.278936 IP 10.8.3.3.60412 > 52.223.203.236.1935: Flags [P.], seq 66048:67125, ack 1, win 501, options [nop,nop,TS val 1658593593 ecr 2794127607], length 1077
09:05:36.324075 IP 10.8.3.3.60412 > 52.223.203.236.1935: Flags [.], seq 67125:68439, ack 1, win 501, options [nop,nop,TS val 1658593638 ecr 2794127607], length 1314
09:05:36.352716 IP 52.223.203.236.1935 > 10.8.3.3.60412: Flags [.], ack 60792, win 126, options [nop,nop,TS val 2794127680 ecr 1658593338], length 0
09:05:36.360001 IP 10.8.3.3.60412 > 52.223.203.236.1935: Flags [.], seq 68439:69753, ack 1, win 501, options [nop,nop,TS val 1658593674 ecr 2794127680], length 1314
09:05:36.402848 IP 10.8.3.3.60412 > 52.223.203.236.1935: Flags [.], seq 69753:71067, ack 1, win 501, options [nop,nop,TS val 1658593717 ecr 2794127680], length 1314
09:05:36.450398 IP 52.223.203.236.1935 > 10.8.3.3.60412: Flags [.], ack 63420, win 126, options [nop,nop,TS val 2794127778 ecr 1658593417], length 0
09:05:36.453680 IP 10.8.3.3.60412 > 52.223.203.236.1935: Flags [.], seq 71067:72381, ack 1, win 501, options [nop,nop,TS val 1658593768 ecr 2794127778], length 1314
09:05:36.488101 IP 10.8.3.3.60412 > 52.223.203.236.1935: Flags [.], seq 72381:73695, ack 1, win 501, options [nop,nop,TS val 1658593802 ecr 2794127778], length 1314
09:05:36.523886 IP 52.223.203.236.1935 > 10.8.3.3.60412: Flags [.], ack 66048, win 126, options [nop,nop,TS val 2794127852 ecr 1658593504], length 0
09:05:36.530591 IP 10.8.3.3.60412 > 52.223.203.236.1935: Flags [.], seq 73695:75009, ack 1, win 501, options [nop,nop,TS val 1658593845 ecr 2794127852], length 1314
09:05:36.571667 IP 52.223.203.236.1935 > 10.8.3.3.60412: Flags [.], ack 67125, win 126, options [nop,nop,TS val 2794127899 ecr 1658593593], length 0
09:05:36.571708 IP 10.8.3.3.60412 > 52.223.203.236.1935: Flags [P.], seq 75009:75970, ack 1, win 501, options [nop,nop,TS val 1658593886 ecr 2794127899], length 961
09:05:36.621934 IP 10.8.3.3.60412 > 52.223.203.236.1935: Flags [.], seq 75970:77284, ack 1, win 501, options [nop,nop,TS val 1658593936 ecr 2794127899], length 1314
09:05:36.652839 IP 52.223.203.236.1935 > 10.8.3.3.60412: Flags [.], ack 69753, win 126, options [nop,nop,TS val 2794127981 ecr 1658593638], length 0
09:05:36.659082 IP 10.8.3.3.60412 > 52.223.203.236.1935: Flags [.], seq 77284:78598, ack 1, win 501, options [nop,nop,TS val 1658593973 ecr 2794127981], length 1314
09:05:36.691343 IP 10.8.3.3.60412 > 52.223.203.236.1935: Flags [.], seq 78598:79912, ack 1, win 501, options [nop,nop,TS val 1658594006 ecr 2794127981], length 1314
09:05:36.746335 IP 52.223.203.236.1935 > 10.8.3.3.60412: Flags [.], ack 72381, win 126, options [nop,nop,TS val 2794128074 ecr 1658593717], length 0
09:05:36.756283 IP 10.8.3.3.60412 > 52.223.203.236.1935: Flags [.], seq 79912:81226, ack 1, win 501, options [nop,nop,TS val 1658594071 ecr 2794128074], length 1314
09:05:36.790588 IP 10.8.3.3.60412 > 52.223.203.236.1935: Flags [.], seq 81226:82540, ack 1, win 501, options [nop,nop,TS val 1658594105 ecr 2794128074], length 1314
09:05:36.823522 IP 52.223.203.236.1935 > 10.8.3.3.60412: Flags [.], ack 75009, win 126, options [nop,nop,TS val 2794128151 ecr 1658593802], length 0
09:05:36.830692 IP 10.8.3.3.60412 > 52.223.203.236.1935: Flags [.], seq 82540:83854, ack 1, win 501, options [nop,nop,TS val 1658594145 ecr 2794128151], length 1314
09:05:36.864462 IP 52.223.203.236.1935 > 10.8.3.3.60412: Flags [.], ack 75970, win 126, options [nop,nop,TS val 2794128192 ecr 1658593886], length 0
09:05:36.864475 IP 10.8.3.3.60412 > 52.223.203.236.1935: Flags [P.], seq 83854:84931, ack 1, win 501, options [nop,nop,TS val 1658594179 ecr 2794128192], length 1077
09:05:36.921618 IP 10.8.3.3.60412 > 52.223.203.236.1935: Flags [.], seq 84931:86245, ack 1, win 501, options [nop,nop,TS val 1658594236 ecr 2794128192], length 1314
09:05:36.951753 IP 52.223.203.236.1935 > 10.8.3.3.60412: Flags [.], ack 78598, win 126, options [nop,nop,TS val 2794128280 ecr 1658593936], length 0
09:05:36.958776 IP 10.8.3.3.60412 > 52.223.203.236.1935: Flags [.], seq 86245:87559, ack 1, win 501, options [nop,nop,TS val 1658594273 ecr 2794128280], length 1314
09:05:36.991030 IP 10.8.3.3.60412 > 52.223.203.236.1935: Flags [.], seq 87559:88873, ack 1, win 501, options [nop,nop,TS val 1658594305 ecr 2794128280], length 1314
09:05:37.049114 IP 52.223.203.236.1935 > 10.8.3.3.60412: Flags [.], ack 81226, win 126, options [nop,nop,TS val 2794128377 ecr 1658594006], length 0
09:05:37.056155 IP 10.8.3.3.60412 > 52.223.203.236.1935: Flags [.], seq 88873:90187, ack 1, win 501, options [nop,nop,TS val 1658594370 ecr 2794128377], length 1314
09:05:37.091092 IP 10.8.3.3.60412 > 52.223.203.236.1935: Flags [.], seq 90187:91501, ack 1, win 501, options [nop,nop,TS val 1658594405 ecr 2794128377], length 1314
09:05:37.123283 IP 52.223.203.236.1935 > 10.8.3.3.60412: Flags [.], ack 83854, win 126, options [nop,nop,TS val 2794128451 ecr 1658594105], length 0
09:05:37.130542 IP 10.8.3.3.60412 > 52.223.203.236.1935: Flags [.], seq 91501:92815, ack 1, win 501, options [nop,nop,TS val 1658594445 ecr 2794128451], length 1314
09:05:37.157045 IP 52.223.203.236.1935 > 10.8.3.3.60412: Flags [.], ack 84931, win 126, options [nop,nop,TS val 2794128485 ecr 1658594179], length 0
09:05:37.157067 IP 10.8.3.3.60412 > 52.223.203.236.1935: Flags [P.], seq 92815:93889, ack 1, win 501, options [nop,nop,TS val 1658594471 ecr 2794128485], length 1074
09:05:37.222759 IP 10.8.3.3.60412 > 52.223.203.236.1935: Flags [.], seq 93889:95203, ack 1, win 501, options [nop,nop,TS val 1658594537 ecr 2794128485], length 1314
09:05:37.251428 IP 52.223.203.236.1935 > 10.8.3.3.60412: Flags [.], ack 87559, win 126, options [nop,nop,TS val 2794128579 ecr 1658594236], length 0
09:05:37.258169 IP 10.8.3.3.60412 > 52.223.203.236.1935: Flags [.], seq 95203:96517, ack 1, win 501, options [nop,nop,TS val 1658594572 ecr 2794128579], length 1314
09:05:37.288811 IP 10.8.3.3.60412 > 52.223.203.236.1935: Flags [.], seq 96517:97831, ack 1, win 501, options [nop,nop,TS val 1658594603 ecr 2794128579], length 1314
09:05:37.348811 IP 52.223.203.236.1935 > 10.8.3.3.60412: Flags [.], ack 90187, win 126, options [nop,nop,TS val 2794128677 ecr 1658594305], length 0
09:05:37.365429 IP 10.8.3.3.60412 > 52.223.203.236.1935: Flags [.], seq 97831:99145, ack 1, win 501, options [nop,nop,TS val 1658594680 ecr 2794128677], length 1314
09:05:37.391319 IP 10.8.3.3.60412 > 52.223.203.236.1935: Flags [.], seq 99145:100459, ack 1, win 501, options [nop,nop,TS val 1658594706 ecr 2794128677], length 1314
09:05:37.423659 IP 52.223.203.236.1935 > 10.8.3.3.60412: Flags [.], ack 92815, win 126, options [nop,nop,TS val 2794128752 ecr 1658594405], length 0
09:05:37.429676 IP 10.8.3.3.60412 > 52.223.203.236.1935: Flags [.], seq 100459:101773, ack 1, win 501, options [nop,nop,TS val 1658594744 ecr 2794128752], length 1314
09:05:37.449606 IP 52.223.203.236.1935 > 10.8.3.3.60412: Flags [.], ack 93889, win 126, options [nop,nop,TS val 2794128778 ecr 1658594471], length 0
09:05:37.449633 IP 10.8.3.3.60412 > 52.223.203.236.1935: Flags [P.], seq 101773:101895, ack 1, win 501, options [nop,nop,TS val 1658594764 ecr 2794128778], length 122
09:05:37.494062 IP 10.8.3.3.60412 > 52.223.203.236.1935: Flags [.], seq 101895:103209, ack 1, win 501, options [nop,nop,TS val 1658594808 ecr 2794128778], length 1314
09:05:37.520407 IP 10.8.3.3.60412 > 52.223.203.236.1935: Flags [.], seq 103209:104523, ack 1, win 501, options [nop,nop,TS val 1658594835 ecr 2794128778], length 1314
09:05:37.550884 IP 52.223.203.236.1935 > 10.8.3.3.60412: Flags [.], ack 96517, win 126, options [nop,nop,TS val 2794128879 ecr 1658594537], length 0
09:05:37.557794 IP 10.8.3.3.60412 > 52.223.203.236.1935: Flags [.], seq 104523:105837, ack 1, win 501, options [nop,nop,TS val 1658594872 ecr 2794128879], length 1314
09:05:37.624536 IP 10.8.3.3.60412 > 52.223.203.236.1935: Flags [.], seq 105837:107151, ack 1, win 501, options [nop,nop,TS val 1658594939 ecr 2794128879], length 1314
09:05:37.658054 IP 52.223.203.236.1935 > 10.8.3.3.60412: Flags [.], ack 99145, win 126, options [nop,nop,TS val 2794128986 ecr 1658594603], length 0
09:05:37.665207 IP 10.8.3.3.60412 > 52.223.203.236.1935: Flags [.], seq 107151:108465, ack 1, win 501, options [nop,nop,TS val 1658594980 ecr 2794128986], length 1314
09:05:37.691150 IP 10.8.3.3.60412 > 52.223.203.236.1935: Flags [.], seq 108465:109779, ack 1, win 501, options [nop,nop,TS val 1658595005 ecr 2794128986], length 1314
09:05:37.722463 IP 52.223.203.236.1935 > 10.8.3.3.60412: Flags [.], ack 101773, win 126, options [nop,nop,TS val 2794129050 ecr 1658594706], length 0
09:05:37.742167 IP 52.223.203.236.1935 > 10.8.3.3.60412: Flags [.], ack 101895, win 126, options [nop,nop,TS val 2794129070 ecr 1658594764], length 0
09:05:37.742202 IP 10.8.3.3.60412 > 52.223.203.236.1935: Flags [P.], seq 109779:110856, ack 1, win 501, options [nop,nop,TS val 1658595057 ecr 2794129070], length 1077
09:05:37.794003 IP 10.8.3.3.60412 > 52.223.203.236.1935: Flags [.], seq 110856:112170, ack 1, win 501, options [nop,nop,TS val 1658595108 ecr 2794129070], length 1314
09:05:37.812860 IP 52.223.203.236.1935 > 10.8.3.3.60412: Flags [.], ack 104523, win 126, options [nop,nop,TS val 2794129141 ecr 1658594808], length 0
09:05:37.824528 IP 10.8.3.3.60412 > 52.223.203.236.1935: Flags [.], seq 112170:113484, ack 1, win 501, options [nop,nop,TS val 1658595139 ecr 2794129141], length 1314
09:05:37.858491 IP 10.8.3.3.60412 > 52.223.203.236.1935: Flags [.], seq 113484:114798, ack 1, win 501, options [nop,nop,TS val 1658595173 ecr 2794129141], length 1314
09:05:37.916979 IP 52.223.203.236.1935 > 10.8.3.3.60412: Flags [.], ack 105837, win 126, options [nop,nop,TS val 2794129245 ecr 1658594872], length 0
09:05:37.924814 IP 10.8.3.3.60412 > 52.223.203.236.1935: Flags [.], seq 114798:116112, ack 1, win 501, options [nop,nop,TS val 1658595239 ecr 2794129245], length 1314
09:05:37.957843 IP 52.223.203.236.1935 > 10.8.3.3.60412: Flags [.], ack 108465, win 126, options [nop,nop,TS val 2794129286 ecr 1658594939], length 0
09:05:37.965668 IP 10.8.3.3.60412 > 52.223.203.236.1935: Flags [.], seq 116112:117426, ack 1, win 501, options [nop,nop,TS val 1658595280 ecr 2794129286], length 1314
09:05:37.987696 IP 10.8.3.3.60412 > 52.223.203.236.1935: Flags [.], seq 117426:118740, ack 1, win 501, options [nop,nop,TS val 1658595302 ecr 2794129286], length 1314
09:05:38.034840 IP 52.223.203.236.1935 > 10.8.3.3.60412: Flags [.], ack 110856, win 126, options [nop,nop,TS val 2794129363 ecr 1658595005], length 0
09:05:38.034884 IP 10.8.3.3.60412 > 52.223.203.236.1935: Flags [P.], seq 118740:119804, ack 1, win 501, options [nop,nop,TS val 1658595349 ecr 2794129363], length 1064
09:05:38.094344 IP 10.8.3.3.60412 > 52.223.203.236.1935: Flags [.], seq 119804:121118, ack 1, win 501, options [nop,nop,TS val 1658595409 ecr 2794129363], length 1314
09:05:38.117359 IP 52.223.203.236.1935 > 10.8.3.3.60412: Flags [.], ack 113484, win 126, options [nop,nop,TS val 2794129445 ecr 1658595108], length 0
09:05:38.121899 IP 10.8.3.3.60412 > 52.223.203.236.1935: Flags [.], seq 121118:122432, ack 1, win 501, options [nop,nop,TS val 1658595436 ecr 2794129445], length 1314
09:05:38.158918 IP 10.8.3.3.60412 > 52.223.203.236.1935: Flags [.], seq 122432:123746, ack 1, win 501, options [nop,nop,TS val 1658595473 ecr 2794129445], length 1314
09:05:38.217401 IP 52.223.203.236.1935 > 10.8.3.3.60412: Flags [.], ack 116112, win 126, options [nop,nop,TS val 2794129545 ecr 1658595173], length 0
09:05:38.225123 IP 10.8.3.3.60412 > 52.223.203.236.1935: Flags [.], seq 123746:125060, ack 1, win 501, options [nop,nop,TS val 1658595539 ecr 2794129545], length 1314
09:05:38.266248 IP 10.8.3.3.60412 > 52.223.203.236.1935: Flags [.], seq 125060:126374, ack 1, win 501, options [nop,nop,TS val 1658595581 ecr 2794129545], length 1314
09:05:38.280311 IP 52.223.203.236.1935 > 10.8.3.3.60412: Flags [.], ack 118740, win 126, options [nop,nop,TS val 2794129608 ecr 1658595280], length 0
09:05:38.291829 IP 10.8.3.3.60412 > 52.223.203.236.1935: Flags [.], seq 126374:127688, ack 1, win 501, options [nop,nop,TS val 1658595606 ecr 2794129608], length 1314
09:05:38.327897 IP 52.223.203.236.1935 > 10.8.3.3.60412: Flags [.], ack 119804, win 126, options [nop,nop,TS val 2794129656 ecr 1658595349], length 0
09:05:38.327929 IP 10.8.3.3.60412 > 52.223.203.236.1935: Flags [P.], seq 127688:127910, ack 1, win 501, options [nop,nop,TS val 1658595642 ecr 2794129656], length 222
09:05:38.358766 IP 10.8.3.3.60412 > 52.223.203.236.1935: Flags [.], seq 127910:129224, ack 1, win 501, options [nop,nop,TS val 1658595673 ecr 2794129656], length 1314
09:05:38.395144 IP 10.8.3.3.60412 > 52.223.203.236.1935: Flags [.], seq 129224:130538, ack 1, win 501, options [nop,nop,TS val 1658595709 ecr 2794129656], length 1314
09:05:38.414313 IP 52.223.203.236.1935 > 10.8.3.3.60412: Flags [.], ack 122432, win 126, options [nop,nop,TS val 2794129742 ecr 1658595409], length 0
09:05:38.453701 IP 10.8.3.3.60412 > 52.223.203.236.1935: Flags [.], seq 130538:131852, ack 1, win 501, options [nop,nop,TS val 1658595768 ecr 2794129742], length 1314
09:05:38.501363 IP 10.8.3.3.60412 > 52.223.203.236.1935: Flags [.], seq 131852:133166, ack 1, win 501, options [nop,nop,TS val 1658595816 ecr 2794129742], length 1314
09:05:38.517848 IP 52.223.203.236.1935 > 10.8.3.3.60412: Flags [.], ack 125060, win 126, options [nop,nop,TS val 2794129846 ecr 1658595473], length 0
09:05:38.524643 IP 10.8.3.3.60412 > 52.223.203.236.1935: Flags [.], seq 133166:134480, ack 1, win 501, options [nop,nop,TS val 1658595839 ecr 2794129846], length 1314
09:05:38.584796 IP 52.223.203.236.1935 > 10.8.3.3.60412: Flags [.], ack 127688, win 126, options [nop,nop,TS val 2794129912 ecr 1658595581], length 0
09:05:38.587367 IP 10.8.3.3.60412 > 52.223.203.236.1935: Flags [.], seq 134480:135794, ack 1, win 501, options [nop,nop,TS val 1658595902 ecr 2794129912], length 1314
09:05:38.620314 IP 52.223.203.236.1935 > 10.8.3.3.60412: Flags [.], ack 127910, win 126, options [nop,nop,TS val 2794129948 ecr 1658595642], length 0
09:05:38.620342 IP 10.8.3.3.60412 > 52.223.203.236.1935: Flags [P.], seq 135794:136775, ack 1, win 501, options [nop,nop,TS val 1658595935 ecr 2794129948], length 981
09:05:38.657043 IP 10.8.3.3.60412 > 52.223.203.236.1935: Flags [.], seq 136775:138089, ack 1, win 501, options [nop,nop,TS val 1658595971 ecr 2794129948], length 1314
09:05:38.687775 IP 52.223.203.236.1935 > 10.8.3.3.60412: Flags [.], ack 130538, win 126, options [nop,nop,TS val 2794130016 ecr 1658595673], length 0
09:05:38.694585 IP 10.8.3.3.60412 > 52.223.203.236.1935: Flags [.], seq 138089:139403, ack 1, win 501, options [nop,nop,TS val 1658596009 ecr 2794130016], length 1314
09:05:38.737462 IP 10.8.3.3.60412 > 52.223.203.236.1935: Flags [.], seq 139403:140717, ack 1, win 501, options [nop,nop,TS val 1658596052 ecr 2794130016], length 1314
09:05:38.793943 IP 52.223.203.236.1935 > 10.8.3.3.60412: Flags [.], ack 133166, win 126, options [nop,nop,TS val 2794130122 ecr 1658595768], length 0
09:05:38.801501 IP 10.8.3.3.60412 > 52.223.203.236.1935: Flags [.], seq 140717:142031, ack 1, win 501, options [nop,nop,TS val 1658596116 ecr 2794130122], length 1314
09:05:38.823298 IP 10.8.3.3.60412 > 52.223.203.236.1935: Flags [.], seq 142031:143345, ack 1, win 501, options [nop,nop,TS val 1658596138 ecr 2794130122], length 1314
09:05:38.865720 IP 10.8.3.3.60412 > 52.223.203.236.1935: Flags [.], seq 143345:144659, ack 1, win 501, options [nop,nop,TS val 1658596180 ecr 2794130122], length 1314
09:05:38.880166 IP 52.223.203.236.1935 > 10.8.3.3.60412: Flags [.], ack 135794, win 126, options [nop,nop,TS val 2794130208 ecr 1658595839], length 0
09:05:38.912866 IP 52.223.203.236.1935 > 10.8.3.3.60412: Flags [.], ack 136775, win 126, options [nop,nop,TS val 2794130241 ecr 1658595935], length 0
09:05:38.912885 IP 10.8.3.3.60412 > 52.223.203.236.1935: Flags [P.], seq 144659:145724, ack 1, win 501, options [nop,nop,TS val 1658596227 ecr 2794130241], length 1065
09:05:38.972055 IP 10.8.3.3.60412 > 52.223.203.236.1935: Flags [.], seq 145724:147038, ack 1, win 501, options [nop,nop,TS val 1658596286 ecr 2794130241], length 1314
09:05:38.987349 IP 52.223.203.236.1935 > 10.8.3.3.60412: Flags [.], ack 139403, win 126, options [nop,nop,TS val 2794130315 ecr 1658595971], length 0
09:05:38.993534 IP 10.8.3.3.60412 > 52.223.203.236.1935: Flags [.], seq 147038:148352, ack 1, win 501, options [nop,nop,TS val 1658596308 ecr 2794130315], length 1314
09:05:39.036528 IP 10.8.3.3.60412 > 52.223.203.236.1935: Flags [.], seq 148352:149666, ack 1, win 501, options [nop,nop,TS val 1658596351 ecr 2794130315], length 1314
09:05:39.094298 IP 52.223.203.236.1935 > 10.8.3.3.60412: Flags [.], ack 142031, win 126, options [nop,nop,TS val 2794130422 ecr 1658596052], length 0
09:05:39.100879 IP 10.8.3.3.60412 > 52.223.203.236.1935: Flags [.], seq 149666:150980, ack 1, win 501, options [nop,nop,TS val 1658596415 ecr 2794130422], length 1314
09:05:39.124535 IP 10.8.3.3.60412 > 52.223.203.236.1935: Flags [.], seq 150980:152294, ack 1, win 501, options [nop,nop,TS val 1658596439 ecr 2794130422], length 1314
09:05:39.158473 IP 52.223.203.236.1935 > 10.8.3.3.60412: Flags [.], ack 144659, win 126, options [nop,nop,TS val 2794130486 ecr 1658596138], length 0
09:05:39.165189 IP 10.8.3.3.60412 > 52.223.203.236.1935: Flags [.], seq 152294:153608, ack 1, win 501, options [nop,nop,TS val 1658596480 ecr 2794130486], length 1314
09:05:39.205672 IP 52.223.203.236.1935 > 10.8.3.3.60412: Flags [.], ack 145724, win 126, options [nop,nop,TS val 2794130533 ecr 1658596227], length 0
09:05:39.205697 IP 10.8.3.3.60412 > 52.223.203.236.1935: Flags [P.], seq 153608:154586, ack 1, win 501, options [nop,nop,TS val 1658596520 ecr 2794130533], length 978
09:05:39.272147 IP 10.8.3.3.60412 > 52.223.203.236.1935: Flags [.], seq 154586:155900, ack 1, win 501, options [nop,nop,TS val 1658596586 ecr 2794130533], length 1314
09:05:39.286201 IP 52.223.203.236.1935 > 10.8.3.3.60412: Flags [.], ack 148352, win 126, options [nop,nop,TS val 2794130614 ecr 1658596286], length 0
09:05:39.293633 IP 10.8.3.3.60412 > 52.223.203.236.1935: Flags [.], seq 155900:157214, ack 1, win 501, options [nop,nop,TS val 1658596608 ecr 2794130614], length 1314
09:05:39.336461 IP 10.8.3.3.60412 > 52.223.203.236.1935: Flags [.], seq 157214:158528, ack 1, win 501, options [nop,nop,TS val 1658596651 ecr 2794130614], length 1314
09:05:39.393830 IP 52.223.203.236.1935 > 10.8.3.3.60412: Flags [.], ack 150980, win 126, options [nop,nop,TS val 2794130722 ecr 1658596351], length 0
09:05:39.400236 IP 10.8.3.3.60412 > 52.223.203.236.1935: Flags [.], seq 158528:159842, ack 1, win 501, options [nop,nop,TS val 1658596715 ecr 2794130722], length 1314
09:05:39.421450 IP 10.8.3.3.60412 > 52.223.203.236.1935: Flags [.], seq 159842:161156, ack 1, win 501, options [nop,nop,TS val 1658596736 ecr 2794130722], length 1314
09:05:39.457819 IP 52.223.203.236.1935 > 10.8.3.3.60412: Flags [.], ack 153608, win 126, options [nop,nop,TS val 2794130786 ecr 1658596439], length 0
09:05:39.463999 IP 10.8.3.3.60412 > 52.223.203.236.1935: Flags [.], seq 161156:162470, ack 1, win 501, options [nop,nop,TS val 1658596778 ecr 2794130786], length 1314
09:05:39.498344 IP 52.223.203.236.1935 > 10.8.3.3.60412: Flags [.], ack 154586, win 126, options [nop,nop,TS val 2794130826 ecr 1658596520], length 0
09:05:39.498396 IP 10.8.3.3.60412 > 52.223.203.236.1935: Flags [P.], seq 162470:162790, ack 1, win 501, options [nop,nop,TS val 1658596813 ecr 2794130826], length 320
09:05:39.528478 IP 10.8.3.3.60412 > 52.223.203.236.1935: Flags [.], seq 162790:164104, ack 1, win 501, options [nop,nop,TS val 1658596843 ecr 2794130826], length 1314
09:05:39.571440 IP 10.8.3.3.60412 > 52.223.203.236.1935: Flags [.], seq 164104:165418, ack 1, win 501, options [nop,nop,TS val 1658596886 ecr 2794130826], length 1314
09:05:39.586435 IP 52.223.203.236.1935 > 10.8.3.3.60412: Flags [.], ack 157214, win 126, options [nop,nop,TS val 2794130914 ecr 1658596586], length 0
09:05:39.614621 IP 10.8.3.3.60412 > 52.223.203.236.1935: Flags [.], seq 165418:166732, ack 1, win 501, options [nop,nop,TS val 1658596929 ecr 2794130914], length 1314
09:05:39.655318 IP 10.8.3.3.60412 > 52.223.203.236.1935: Flags [.], seq 166732:168046, ack 1, win 501, options [nop,nop,TS val 1658596970 ecr 2794130914], length 1314
09:05:39.688064 IP 10.8.3.3.60412 > 52.223.203.236.1935: Flags [.], seq 168046:169360, ack 1, win 501, options [nop,nop,TS val 1658597002 ecr 2794130914], length 1314
09:05:39.692707 IP 52.223.203.236.1935 > 10.8.3.3.60412: Flags [.], ack 159842, win 126, options [nop,nop,TS val 2794131021 ecr 1658596651], length 0
09:05:39.742538 IP 10.8.3.3.60412 > 52.223.203.236.1935: Flags [.], seq 169360:170674, ack 1, win 501, options [nop,nop,TS val 1658597057 ecr 2794131021], length 1314
09:05:39.756552 IP 52.223.203.236.1935 > 10.8.3.3.60412: Flags [.], ack 162470, win 126, options [nop,nop,TS val 2794131084 ecr 1658596736], length 0
09:05:39.787044 IP 10.8.3.3.60412 > 52.223.203.236.1935: Flags [.], seq 170674:171988, ack 1, win 501, options [nop,nop,TS val 1658597101 ecr 2794131084], length 1314
09:05:39.790863 IP 52.223.203.236.1935 > 10.8.3.3.60412: Flags [.], ack 162790, win 126, options [nop,nop,TS val 2794131119 ecr 1658596813], length 0
09:05:39.790875 IP 10.8.3.3.60412 > 52.223.203.236.1935: Flags [P.], seq 171988:172583, ack 1, win 501, options [nop,nop,TS val 1658597105 ecr 2794131119], length 595
09:05:39.857653 IP 10.8.3.3.60412 > 52.223.203.236.1935: Flags [.], seq 172583:173897, ack 1, win 501, options [nop,nop,TS val 1658597172 ecr 2794131119], length 1314
09:05:39.864408 IP 52.223.203.236.1935 > 10.8.3.3.60412: Flags [.], ack 165418, win 126, options [nop,nop,TS val 2794131192 ecr 1658596843], length 0
09:05:39.891201 IP 10.8.3.3.60412 > 52.223.203.236.1935: Flags [.], seq 173897:175211, ack 1, win 501, options [nop,nop,TS val 1658597206 ecr 2794131192], length 1314
09:05:39.924110 IP 10.8.3.3.60412 > 52.223.203.236.1935: Flags [.], seq 175211:176525, ack 1, win 501, options [nop,nop,TS val 1658597238 ecr 2794131192], length 1314
09:05:39.948104 IP 52.223.203.236.1935 > 10.8.3.3.60412: Flags [.], ack 168046, win 126, options [nop,nop,TS val 2794131276 ecr 1658596929], length 0
09:05:39.989873 IP 10.8.3.3.60412 > 52.223.203.236.1935: Flags [.], seq 176525:177839, ack 1, win 501, options [nop,nop,TS val 1658597304 ecr 2794131276], length 1314
09:05:40.024499 IP 10.8.3.3.60412 > 52.223.203.236.1935: Flags [.], seq 177839:179153, ack 1, win 501, options [nop,nop,TS val 1658597339 ecr 2794131276], length 1314
09:05:40.035333 IP 52.223.203.236.1935 > 10.8.3.3.60412: Flags [.], ack 170674, win 126, options [nop,nop,TS val 2794131363 ecr 1658597002], length 0
09:05:40.057701 IP 10.8.3.3.60412 > 52.223.203.236.1935: Flags [.], seq 179153:180467, ack 1, win 501, options [nop,nop,TS val 1658597372 ecr 2794131363], length 1314
09:05:40.084703 IP 52.223.203.236.1935 > 10.8.3.3.60412: Flags [.], ack 172583, win 126, options [nop,nop,TS val 2794131412 ecr 1658597101], length 0
09:05:40.084728 IP 10.8.3.3.60412 > 52.223.203.236.1935: Flags [P.], seq 180467:180696, ack 1, win 501, options [nop,nop,TS val 1658597399 ecr 2794131412], length 229
09:05:40.121544 IP 10.8.3.3.60412 > 52.223.203.236.1935: Flags [.], seq 180696:182010, ack 1, win 501, options [nop,nop,TS val 1658597436 ecr 2794131412], length 1314
09:05:40.155802 IP 10.8.3.3.60412 > 52.223.203.236.1935: Flags [.], seq 182010:183324, ack 1, win 501, options [nop,nop,TS val 1658597470 ecr 2794131412], length 1314
09:05:40.185402 IP 52.223.203.236.1935 > 10.8.3.3.60412: Flags [.], ack 175211, win 126, options [nop,nop,TS val 2794131513 ecr 1658597172], length 0
09:05:40.212955 IP 10.8.3.3.60412 > 52.223.203.236.1935: Flags [.], seq 183324:184638, ack 1, win 501, options [nop,nop,TS val 1658597527 ecr 2794131513], length 1314
09:05:40.256109 IP 10.8.3.3.60412 > 52.223.203.236.1935: Flags [.], seq 184638:185952, ack 1, win 501, options [nop,nop,TS val 1658597570 ecr 2794131513], length 1314
09:05:40.282424 IP 52.223.203.236.1935 > 10.8.3.3.60412: Flags [.], ack 177839, win 126, options [nop,nop,TS val 2794131610 ecr 1658597238], length 0
09:05:40.291460 IP 10.8.3.3.60412 > 52.223.203.236.1935: Flags [.], seq 185952:187266, ack 1, win 501, options [nop,nop,TS val 1658597606 ecr 2794131610], length 1314
09:05:40.341756 IP 10.8.3.3.60412 > 52.223.203.236.1935: Flags [.], seq 187266:188580, ack 1, win 501, options [nop,nop,TS val 1658597656 ecr 2794131610], length 1314
09:05:40.350723 IP 52.223.203.236.1935 > 10.8.3.3.60412: Flags [.], ack 180467, win 126, options [nop,nop,TS val 2794131679 ecr 1658597339], length 0
09:05:40.378180 IP 52.223.203.236.1935 > 10.8.3.3.60412: Flags [.], ack 180696, win 126, options [nop,nop,TS val 2794131705 ecr 1658597399], length 0
09:05:40.378207 IP 10.8.3.3.60412 > 52.223.203.236.1935: Flags [P.], seq 188580:189557, ack 1, win 501, options [nop,nop,TS val 1658597693 ecr 2794131705], length 977
09:05:40.423673 IP 10.8.3.3.60412 > 52.223.203.236.1935: Flags [.], seq 189557:190871, ack 1, win 501, options [nop,nop,TS val 1658597738 ecr 2794131705], length 1314
09:05:40.448333 IP 52.223.203.236.1935 > 10.8.3.3.60412: Flags [.], ack 183324, win 126, options [nop,nop,TS val 2794131776 ecr 1658597436], length 0
09:05:40.453638 IP 10.8.3.3.60412 > 52.223.203.236.1935: Flags [.], seq 190871:192185, ack 1, win 501, options [nop,nop,TS val 1658597768 ecr 2794131776], length 1314
09:05:40.490874 IP 10.8.3.3.60412 > 52.223.203.236.1935: Flags [.], seq 192185:193499, ack 1, win 501, options [nop,nop,TS val 1658597805 ecr 2794131776], length 1314
09:05:40.548828 IP 52.223.203.236.1935 > 10.8.3.3.60412: Flags [.], ack 185952, win 126, options [nop,nop,TS val 2794131877 ecr 1658597527], length 0
09:05:40.557920 IP 10.8.3.3.60412 > 52.223.203.236.1935: Flags [.], seq 193499:194813, ack 1, win 501, options [nop,nop,TS val 1658597872 ecr 2794131877], length 1314
09:05:40.589622 IP 10.8.3.3.60412 > 52.223.203.236.1935: Flags [.], seq 194813:196127, ack 1, win 501, options [nop,nop,TS val 1658597904 ecr 2794131877], length 1314
09:05:40.623076 IP 10.8.3.3.60412 > 52.223.203.236.1935: Flags [.], seq 196127:197441, ack 1, win 501, options [nop,nop,TS val 1658597937 ecr 2794131877], length 1314
09:05:40.634356 IP 52.223.203.236.1935 > 10.8.3.3.60412: Flags [.], ack 188580, win 126, options [nop,nop,TS val 2794131962 ecr 1658597606], length 0
