16:51:26.693625 IP 10.8.0.2.51886 > 52.223.202.245.1935: Flags [.], seq 1511329419:1511330733, ack 1639793836, win 501, options [nop,nop,TS val 1381904121 ecr 169789634], length 1314
16:51:26.706701 IP 52.223.202.245.1935 > 10.8.0.2.51886: Flags [.], ack 4294959554, win 126, options [nop,nop,TS val 169789730 ecr 1381903756], length 0
16:51:26.728180 IP 10.8.0.2.51886 > 52.223.202.245.1935: Flags [.], seq 1314:2628, ack 1, win 501, options [nop,nop,TS val 1381904155 ecr 169789730], length 1314
16:51:26.765189 IP 10.8.0.2.51886 > 52.223.202.245.1935: Flags [.], seq 2628:3942, ack 1, win 501, options [nop,nop,TS val 1381904192 ecr 169789730], length 1314
16:51:26.791473 IP 52.223.202.245.1935 > 10.8.0.2.51886: Flags [.], ack 4294962182, win 126, options [nop,nop,TS val 169789815 ecr 1381903855], length 0
16:51:26.829026 IP 10.8.0.2.51886 > 52.223.202.245.1935: Flags [.], seq 3942:5256, ack 1, win 501, options [nop,nop,TS val 1381904256 ecr 169789815], length 1314
16:51:26.838223 IP 52.223.202.245.1935 > 10.8.0.2.51886: Flags [.], ack 4294963354, win 126, options [nop,nop,TS val 169789862 ecr 1381903951], length 0
16:51:26.838238 IP 10.8.0.2.51886 > 52.223.202.245.1935: Flags [P.], seq 5256:5954, ack 1, win 501, options [nop,nop,TS val 1381904266 ecr 169789862], length 698
16:51:26.893891 IP 10.8.0.2.51886 > 52.223.202.245.1935: Flags [.], seq 5954:7268, ack 1, win 501, options [nop,nop,TS val 1381904321 ecr 169789862], length 1314
16:51:26.909240 IP 52.223.202.245.1935 > 10.8.0.2.51886: Flags [.], ack 4294965982, win 126, options [nop,nop,TS val 169789933 ecr 1381903987], length 0
16:51:26.927075 IP 10.8.0.2.51886 > 52.223.202.245.1935: Flags [.], seq 7268:8582, ack 1, win 501, options [nop,nop,TS val 1381904354 ecr 169789933], length 1314
16:51:26.960361 IP 10.8.0.2.51886 > 52.223.202.245.1935: Flags [.], seq 8582:9896, ack 1, win 501, options [nop,nop,TS val 1381904388 ecr 169789933], length 1314
16:51:27.008973 IP 52.223.202.245.1935 > 10.8.0.2.51886: Flags [.], ack 1314, win 126, options [nop,nop,TS val 169790032 ecr 1381904064], length 0
16:51:27.027617 IP 10.8.0.2.51886 > 52.223.202.245.1935: Flags [.], seq 9896:11210, ack 1, win 501, options [nop,nop,TS val 1381904455 ecr 169790032], length 1314
16:51:27.064246 IP 10.8.0.2.51886 > 52.223.202.245.1935: Flags [.], seq 11210:12524, ack 1, win 501, options [nop,nop,TS val 1381904492 ecr 169790032], length 1314
16:51:27.081581 IP 52.223.202.245.1935 > 10.8.0.2.51886: Flags [.], ack 3942, win 126, options [nop,nop,TS val 169790105 ecr 1381904155], length 0
16:51:27.093754 IP 10.8.0.2.51886 > 52.223.202.245.1935: Flags [.], seq 12524:13838, ack 1, win 501, options [nop,nop,TS val 1381904521 ecr 169790105], length 1314
16:51:27.153062 IP 52.223.202.245.1935 > 10.8.0.2.51886: Flags [.], ack 5954, win 126, options [nop,nop,TS val 169790177 ecr 1381904256], length 0
16:51:27.153098 IP 10.8.0.2.51886 > 52.223.202.245.1935: Flags [P.], seq 13838:15002, ack 1, win 501, options [nop,nop,TS val 1381904580 ecr 169790177], length 1164
16:51:27.192939 IP 10.8.0.2.51886 > 52.223.202.245.1935: Flags [.], seq 15002:16316, ack 1, win 501, options [nop,nop,TS val 1381904620 ecr 169790177], length 1314
16:51:27.225056 IP 10.8.0.2.51886 > 52.223.202.245.1935: Flags [.], seq 16316:17630, ack 1, win 501, options [nop,nop,TS val 1381904652 ecr 169790177], length 1314
16:51:27.242063 IP 52.223.202.245.1935 > 10.8.0.2.51886: Flags [.], ack 8582, win 126, options [nop,nop,TS val 169790266 ecr 1381904321], length 0
16:51:27.278070 IP 10.8.0.2.51886 > 52.223.202.245.1935: Flags [.], seq 17630:18944, ack 1, win 501, options [nop,nop,TS val 1381904705 ecr 169790266], length 1314
16:51:27.328037 IP 10.8.0.2.51886 > 52.223.202.245.1935: Flags [.], seq 18944:20258, ack 1, win 501, options [nop,nop,TS val 1381904755 ecr 169790266], length 1314
16:51:27.342574 IP 52.223.202.245.1935 > 10.8.0.2.51886: Flags [.], ack 11210, win 126, options [nop,nop,TS val 169790366 ecr 1381904388], length 0
16:51:27.363277 IP 10.8.0.2.51886 > 52.223.202.245.1935: Flags [.], seq 20258:21572, ack 1, win 501, options [nop,nop,TS val 1381904791 ecr 169790366], length 1314
16:51:27.406113 IP 10.8.0.2.51886 > 52.223.202.245.1935: Flags [.], seq 21572:22886, ack 1, win 501, options [nop,nop,TS val 1381904833 ecr 169790366], length 1314
16:51:27.408884 IP 52.223.202.245.1935 > 10.8.0.2.51886: Flags [.], ack 13838, win 126, options [nop,nop,TS val 169790432 ecr 1381904492], length 0
16:51:27.460141 IP 10.8.0.2.51886 > 52.223.202.245.1935: Flags [.], seq 22886:24200, ack 1, win 501, options [nop,nop,TS val 1381904887 ecr 169790432], length 1314
16:51:27.467883 IP 52.223.202.245.1935 > 10.8.0.2.51886: Flags [.], ack 15002, win 126, options [nop,nop,TS val 169790492 ecr 1381904580], length 0
16:51:27.467912 IP 10.8.0.2.51886 > 52.223.202.245.1935: Flags [P.], seq 24200:24810, ack 1, win 501, options [nop,nop,TS val 1381904895 ecr 169790492], length 610
16:51:27.534239 IP 10.8.0.2.51886 > 52.223.202.245.1935: Flags [.], seq 24810:26124, ack 1, win 501, options [nop,nop,TS val 1381904962 ecr 169790492], length 1314
16:51:27.539965 IP 52.223.202.245.1935 > 10.8.0.2.51886: Flags [.], ack 17630, win 126, options [nop,nop,TS val 169790564 ecr 1381904620], length 0
16:51:27.557688 IP 10.8.0.2.51886 > 52.223.202.245.1935: Flags [.], seq 26124:27438, ack 1, win 501, options [nop,nop,TS val 1381904985 ecr 169790564], length 1314
16:51:27.598232 IP 10.8.0.2.51886 > 52.223.202.245.1935: Flags [.], seq 27438:28752, ack 1, win 501, options [nop,nop,TS val 1381905026 ecr 169790564], length 1314
16:51:27.643119 IP 52.223.202.245.1935 > 10.8.0.2.51886: Flags [.], ack 20258, win 126, options [nop,nop,TS val 169790667 ecr 1381904705], length 0
16:51:27.662503 IP 10.8.0.2.51886 > 52.223.202.245.1935: Flags [.], seq 28752:30066, ack 1, win 501, options [nop,nop,TS val 1381905090 ecr 169790667], length 1314
16:51:27.693285 IP 10.8.0.2.51886 > 52.223.202.245.1935: Flags [.], seq 30066:31380, ack 1, win 501, options [nop,nop,TS val 1381905121 ecr 169790667], length 1314
16:51:27.721103 IP 52.223.202.245.1935 > 10.8.0.2.51886: Flags [.], ack 22886, win 126, options [nop,nop,TS val 169790745 ecr 1381904791], length 0
16:51:27.727364 IP 10.8.0.2.51886 > 52.223.202.245.1935: Flags [.], seq 31380:32694, ack 1, win 501, options [nop,nop,TS val 1381905155 ecr 169790745], length 1314
16:51:27.782733 IP 52.223.202.245.1935 > 10.8.0.2.51886: Flags [.], ack 24810, win 126, options [nop,nop,TS val 169790806 ecr 1381904887], length 0
16:51:27.782765 IP 10.8.0.2.51886 > 52.223.202.245.1935: Flags [P.], seq 32694:33850, ack 1, win 501, options [nop,nop,TS val 1381905210 ecr 169790806], length 1156
16:51:27.833003 IP 10.8.0.2.51886 > 52.223.202.245.1935: Flags [.], seq 33850:35164, ack 1, win 501, options [nop,nop,TS val 1381905260 ecr 169790806], length 1314
16:51:27.859802 IP 10.8.0.2.51886 > 52.223.202.245.1935: Flags [.], seq 35164:36478, ack 1, win 501, options [nop,nop,TS val 1381905287 ecr 169790806], length 1314
16:51:27.872671 IP 52.223.202.245.1935 > 10.8.0.2.51886: Flags [.], ack 27438, win 126, options [nop,nop,TS val 169790896 ecr 1381904962], length 0
16:51:27.896976 IP 10.8.0.2.51886 > 52.223.202.245.1935: Flags [.], seq 36478:37792, ack 1, win 501, options [nop,nop,TS val 1381905324 ecr 169790896], length 1314
16:51:27.963699 IP 10.8.0.2.51886 > 52.223.202.245.1935: Flags [.], seq 37792:39106, ack 1, win 501, options [nop,nop,TS val 1381905391 ecr 169790896], length 1314
16:51:27.977192 IP 52.223.202.245.1935 > 10.8.0.2.51886: Flags [.], ack 30066, win 126, options [nop,nop,TS val 169791001 ecr 1381905026], length 0
16:51:27.994706 IP 10.8.0.2.51886 > 52.223.202.245.1935: Flags [.], seq 39106:40420, ack 1, win 501, options [nop,nop,TS val 1381905422 ecr 169791001], length 1314
16:51:28.027333 IP 10.8.0.2.51886 > 52.223.202.245.1935: Flags [.], seq 40420:41734, ack 1, win 501, options [nop,nop,TS val 1381905455 ecr 169791001], length 1314
16:51:28.042463 IP 52.223.202.245.1935 > 10.8.0.2.51886: Flags [.], ack 32694, win 126, options [nop,nop,TS val 169791066 ecr 1381905121], length 0
16:51:28.093177 IP 10.8.0.2.51886 > 52.223.202.245.1935: Flags [.], seq 41734:43048, ack 1, win 501, options [nop,nop,TS val 1381905520 ecr 169791066], length 1314
16:51:28.097821 IP 52.223.202.245.1935 > 10.8.0.2.51886: Flags [.], ack 33850, win 126, options [nop,nop,TS val 169791121 ecr 1381905210], length 0
16:51:28.097834 IP 10.8.0.2.51886 > 52.223.202.245.1935: Flags [P.], seq 43048:43750, ack 1, win 501, options [nop,nop,TS val 1381905525 ecr 169791121], length 702
16:51:28.161903 IP 10.8.0.2.51886 > 52.223.202.245.1935: Flags [.], seq 43750:45064, ack 1, win 501, options [nop,nop,TS val 1381905589 ecr 169791121], length 1314
16:51:28.174659 IP 52.223.202.245.1935 > 10.8.0.2.51886: Flags [.], ack 36478, win 126, options [nop,nop,TS val 169791198 ecr 1381905260], length 0
16:51:28.195788 IP 10.8.0.2.51886 > 52.223.202.245.1935: Flags [.], seq 45064:46378, ack 1, win 501, options [nop,nop,TS val 1381905623 ecr 169791198], length 1314
16:51:28.226383 IP 10.8.0.2.51886 > 52.223.202.245.1935: Flags [.], seq 46378:47692, ack 1, win 501, options [nop,nop,TS val 1381905654 ecr 169791198], length 1314
16:51:28.278716 IP 52.223.202.245.1935 > 10.8.0.2.51886: Flags [.], ack 39106, win 126, options [nop,nop,TS val 169791302 ecr 1381905324], length 0
16:51:28.294756 IP 10.8.0.2.51886 > 52.223.202.245.1935: Flags [.], seq 47692:49006, ack 1, win 501, options [nop,nop,TS val 1381905722 ecr 169791302], length 1314
16:51:28.329009 IP 10.8.0.2.51886 > 52.223.202.245.1935: Flags [.], seq 49006:50320, ack 1, win 501, options [nop,nop,TS val 1381905756 ecr 169791302], length 1314
16:51:28.342173 IP 52.223.202.245.1935 > 10.8.0.2.51886: Flags [.], ack 41734, win 126, options [nop,nop,TS val 169791366 ecr 1381905422], length 0
16:51:28.366523 IP 10.8.0.2.51886 > 52.223.202.245.1935: Flags [.], seq 50320:51634, ack 1, win 501, options [nop,nop,TS val 1381905794 ecr 169791366], length 1314
16:51:28.412727 IP 52.223.202.245.1935 > 10.8.0.2.51886: Flags [.], ack 43750, win 126, options [nop,nop,TS val 169791436 ecr 1381905520], length 0
16:51:28.412768 IP 10.8.0.2.51886 > 52.223.202.245.1935: Flags [P.], seq 51634:52802, ack 1, win 501, options [nop,nop,TS val 1381905840 ecr 169791436], length 1168
16:51:28.460678 IP 10.8.0.2.51886 > 52.223.202.245.1935: Flags [.], seq 52802:54116, ack 1, win 501, options [nop,nop,TS val 1381905888 ecr 169791436], length 1314
16:51:28.494350 IP 10.8.0.2.51886 > 52.223.202.245.1935: Flags [.], seq 54116:55430, ack 1, win 501, options [nop,nop,TS val 1381905922 ecr 169791436], length 1314
16:51:28.511136 IP 52.223.202.245.1935 > 10.8.0.2.51886: Flags [.], ack 46378, win 126, options [nop,nop,TS val 169791535 ecr 1381905589], length 0
16:51:28.536989 IP 10.8.0.2.51886 > 52.223.202.245.1935: Flags [.], seq 55430:56744, ack 1, win 501, options [nop,nop,TS val 1381905964 ecr 169791535], length 1314
16:51:28.601473 IP 10.8.0.2.51886 > 52.223.202.245.1935: Flags [.], seq 56744:58058, ack 1, win 501, options [nop,nop,TS val 1381906029 ecr 169791535], length 1314
16:51:28.610570 IP 52.223.202.245.1935 > 10.8.0.2.51886: Flags [.], ack 49006, win 126, options [nop,nop,TS val 169791634 ecr 1381905654], length 0
16:51:28.628442 IP 10.8.0.2.51886 > 52.223.202.245.1935: Flags [.], seq 58058:59372, ack 1, win 501, options [nop,nop,TS val 1381906056 ecr 169791634], length 1314
16:51:28.665734 IP 10.8.0.2.51886 > 52.223.202.245.1935: Flags [.], seq 59372:60686, ack 1, win 501, options [nop,nop,TS val 1381906093 ecr 169791634], length 1314
16:51:28.684104 IP 52.223.202.245.1935 > 10.8.0.2.51886: Flags [.], ack 51634, win 126, options [nop,nop,TS val 169791706 ecr 1381905756], length 0
16:51:28.728114 IP 52.223.202.245.1935 > 10.8.0.2.51886: Flags [.], ack 52802, win 126, options [nop,nop,TS val 169791751 ecr 1381905840], length 0
16:51:28.728148 IP 10.8.0.2.51886 > 52.223.202.245.1935: Flags [P.], seq 60686:61751, ack 1, win 501, options [nop,nop,TS val 1381906155 ecr 169791751], length 1065
16:51:28.757634 IP 10.8.0.2.51886 > 52.223.202.245.1935: Flags [.], seq 61751:63065, ack 1, win 501, options [nop,nop,TS val 1381906185 ecr 169791751], length 1314
16:51:28.793615 IP 10.8.0.2.51886 > 52.223.202.245.1935: Flags [.], seq 63065:64379, ack 1, win 501, options [nop,nop,TS val 1381906221 ecr 169791751], length 1314
16:51:28.810173 IP 52.223.202.245.1935 > 10.8.0.2.51886: Flags [.], ack 55430, win 126, options [nop,nop,TS val 169791833 ecr 1381905888], length 0
16:51:28.836366 IP 10.8.0.2.51886 > 52.223.202.245.1935: Flags [.], seq 64379:65693, ack 1, win 501, options [nop,nop,TS val 1381906264 ecr 169791833], length 1314
16:51:28.900734 IP 10.8.0.2.51886 > 52.223.202.245.1935: Flags [.], seq 65693:67007, ack 1, win 501, options [nop,nop,TS val 1381906328 ecr 169791833], length 1314
16:51:28.916514 IP 52.223.202.245.1935 > 10.8.0.2.51886: Flags [.], ack 58058, win 126, options [nop,nop,TS val 169791940 ecr 1381905964], length 0
16:51:28.925984 IP 10.8.0.2.51886 > 52.223.202.245.1935: Flags [.], seq 67007:68321, ack 1, win 501, options [nop,nop,TS val 1381906353 ecr 169791940], length 1314
16:51:28.964495 IP 10.8.0.2.51886 > 52.223.202.245.1935: Flags [.], seq 68321:69635, ack 1, win 501, options [nop,nop,TS val 1381906392 ecr 169791940], length 1314
16:51:28.982115 IP 52.223.202.245.1935 > 10.8.0.2.51886: Flags [.], ack 60686, win 126, options [nop,nop,TS val 169792005 ecr 1381906056], length 0
16:51:29.028910 IP 10.8.0.2.51886 > 52.223.202.245.1935: Flags [.], seq 69635:70949, ack 1, win 501, options [nop,nop,TS val 1381906456 ecr 169792005], length 1314
16:51:29.043158 IP 52.223.202.245.1935 > 10.8.0.2.51886: Flags [.], ack 61751, win 126, options [nop,nop,TS val 169792067 ecr 1381906155], length 0
16:51:29.043192 IP 10.8.0.2.51886 > 52.223.202.245.1935: Flags [P.], seq 70949:71655, ack 1, win 501, options [nop,nop,TS val 1381906471 ecr 169792067], length 706
16:51:29.095144 IP 10.8.0.2.51886 > 52.223.202.245.1935: Flags [.], seq 71655:72969, ack 1, win 501, options [nop,nop,TS val 1381906522 ecr 169792067], length 1314
16:51:29.109729 IP 52.223.202.245.1935 > 10.8.0.2.51886: Flags [.], ack 64379, win 126, options [nop,nop,TS val 169792133 ecr 1381906185], length 0
16:51:29.136163 IP 10.8.0.2.51886 > 52.223.202.245.1935: Flags [.], seq 72969:74283, ack 1, win 501, options [nop,nop,TS val 1381906563 ecr 169792133], length 1314
16:51:29.161916 IP 10.8.0.2.51886 > 52.223.202.245.1935: Flags [.], seq 74283:75597, ack 1, win 501, options [nop,nop,TS val 1381906589 ecr 169792133], length 1314
16:51:29.215724 IP 52.223.202.245.1935 > 10.8.0.2.51886: Flags [.], ack 67007, win 126, options [nop,nop,TS val 169792239 ecr 1381906264], length 0
16:51:29.228426 IP 10.8.0.2.51886 > 52.223.202.245.1935: Flags [.], seq 75597:76911, ack 1, win 501, options [nop,nop,TS val 1381906656 ecr 169792239], length 1314
16:51:29.264735 IP 10.8.0.2.51886 > 52.223.202.245.1935: Flags [.], seq 76911:78225, ack 1, win 501, options [nop,nop,TS val 1381906692 ecr 169792239], length 1314
16:51:29.279671 IP 52.223.202.245.1935 > 10.8.0.2.51886: Flags [.], ack 69635, win 126, options [nop,nop,TS val 169792303 ecr 1381906353], length 0
16:51:29.290939 IP 10.8.0.2.51886 > 52.223.202.245.1935: Flags [.], seq 78225:79539, ack 1, win 501, options [nop,nop,TS val 1381906718 ecr 169792303], length 1314
16:51:29.358240 IP 52.223.202.245.1935 > 10.8.0.2.51886: Flags [.], ack 71655, win 126, options [nop,nop,TS val 169792382 ecr 1381906456], length 0
16:51:29.358283 IP 10.8.0.2.51886 > 52.223.202.245.1935: Flags [P.], seq 79539:80695, ack 1, win 501, options [nop,nop,TS val 1381906786 ecr 169792382], length 1156
16:51:29.395351 IP 10.8.0.2.51886 > 52.223.202.245.1935: Flags [.], seq 80695:82009, ack 1, win 501, options [nop,nop,TS val 1381906823 ecr 169792382], length 1314
16:51:29.436022 IP 10.8.0.2.51886 > 52.223.202.245.1935: Flags [.], seq 82009:83323, ack 1, win 501, options [nop,nop,TS val 1381906863 ecr 169792382], length 1314
16:51:29.451424 IP 52.223.202.245.1935 > 10.8.0.2.51886: Flags [.], ack 74283, win 126, options [nop,nop,TS val 169792475 ecr 1381906522], length 0
16:51:29.478561 IP 10.8.0.2.51886 > 52.223.202.245.1935: Flags [.], seq 83323:84637, ack 1, win 501, options [nop,nop,TS val 1381906906 ecr 169792475], length 1314
16:51:29.527598 IP 10.8.0.2.51886 > 52.223.202.245.1935: Flags [.], seq 84637:85951, ack 1, win 501, options [nop,nop,TS val 1381906955 ecr 169792475], length 1314
16:51:29.542517 IP 52.223.202.245.1935 > 10.8.0.2.51886: Flags [.], ack 75597, win 126, options [nop,nop,TS val 169792566 ecr 1381906589], length 0
16:51:29.564219 IP 10.8.0.2.51886 > 52.223.202.245.1935: Flags [.], seq 85951:87265, ack 1, win 501, options [nop,nop,TS val 1381906992 ecr 169792566], length 1314
16:51:29.579536 IP 52.223.202.245.1935 > 10.8.0.2.51886: Flags [.], ack 78225, win 126, options [nop,nop,TS val 169792603 ecr 1381906656], length 0
16:51:29.606959 IP 10.8.0.2.51886 > 52.223.202.245.1935: Flags [.], seq 87265:88579, ack 1, win 501, options [nop,nop,TS val 1381907034 ecr 169792603], length 1314
16:51:29.671305 IP 10.8.0.2.51886 > 52.223.202.245.1935: Flags [.], seq 88579:89893, ack 1, win 501, options [nop,nop,TS val 1381907099 ecr 169792603], length 1314
16:51:29.673950 IP 52.223.202.245.1935 > 10.8.0.2.51886: Flags [.], ack 80695, win 126, options [nop,nop,TS val 169792697 ecr 1381906718], length 0
16:51:29.673987 IP 10.8.0.2.51886 > 52.223.202.245.1935: Flags [P.], seq 89893:90594, ack 1, win 501, options [nop,nop,TS val 1381907101 ecr 169792697], length 701
16:51:29.727701 IP 10.8.0.2.51886 > 52.223.202.245.1935: Flags [.], seq 90594:91908, ack 1, win 501, options [nop,nop,TS val 1381907155 ecr 169792697], length 1314
16:51:29.750976 IP 52.223.202.245.1935 > 10.8.0.2.51886: Flags [.], ack 83323, win 126, options [nop,nop,TS val 169792775 ecr 1381906823], length 0
16:51:29.757399 IP 10.8.0.2.51886 > 52.223.202.245.1935: Flags [.], seq 91908:93222, ack 1, win 501, options [nop,nop,TS val 1381907185 ecr 169792775], length 1314
16:51:29.794616 IP 10.8.0.2.51886 > 52.223.202.245.1935: Flags [.], seq 93222:94536, ack 1, win 501, options [nop,nop,TS val 1381907222 ecr 169792775], length 1314
16:51:29.842514 IP 52.223.202.245.1935 > 10.8.0.2.51886: Flags [.], ack 85951, win 126, options [nop,nop,TS val 169792866 ecr 1381906906], length 0
16:51:29.861028 IP 10.8.0.2.51886 > 52.223.202.245.1935: Flags [.], seq 94536:95850, ack 1, win 501, options [nop,nop,TS val 1381907288 ecr 169792866], length 1314
16:51:29.885745 IP 10.8.0.2.51886 > 52.223.202.245.1935: Flags [.], seq 95850:97164, ack 1, win 501, options [nop,nop,TS val 1381907313 ecr 169792866], length 1314
16:51:29.922578 IP 52.223.202.245.1935 > 10.8.0.2.51886: Flags [.], ack 88579, win 126, options [nop,nop,TS val 169792946 ecr 1381906992], length 0
16:51:29.927666 IP 10.8.0.2.51886 > 52.223.202.245.1935: Flags [.], seq 97164:98478, ack 1, win 501, options [nop,nop,TS val 1381907355 ecr 169792946], length 1314
16:51:29.988737 IP 52.223.202.245.1935 > 10.8.0.2.51886: Flags [.], ack 90594, win 126, options [nop,nop,TS val 169793012 ecr 1381907099], length 0
16:51:29.988766 IP 10.8.0.2.51886 > 52.223.202.245.1935: Flags [P.], seq 98478:99647, ack 1, win 501, options [nop,nop,TS val 1381907416 ecr 169793012], length 1169
16:51:30.027749 IP 10.8.0.2.51886 > 52.223.202.245.1935: Flags [.], seq 99647:100961, ack 1, win 501, options [nop,nop,TS val 1381907455 ecr 169793012], length 1314
16:51:30.057334 IP 10.8.0.2.51886 > 52.223.202.245.1935: Flags [.], seq 100961:102275, ack 1, win 501, options [nop,nop,TS val 1381907485 ecr 169793012], length 1314
16:51:30.073386 IP 52.223.202.245.1935 > 10.8.0.2.51886: Flags [.], ack 93222, win 126, options [nop,nop,TS val 169793097 ecr 1381907155], length 0
16:51:30.100371 IP 10.8.0.2.51886 > 52.223.202.245.1935: Flags [.], seq 102275:103589, ack 1, win 501, options [nop,nop,TS val 1381907528 ecr 169793097], length 1314
16:51:30.161695 IP 10.8.0.2.51886 > 52.223.202.245.1935: Flags [.], seq 103589:104903, ack 1, win 501, options [nop,nop,TS val 1381907589 ecr 169793097], length 1314
16:51:30.176800 IP 52.223.202.245.1935 > 10.8.0.2.51886: Flags [.], ack 95850, win 126, options [nop,nop,TS val 169793200 ecr 1381907222], length 0
16:51:30.195169 IP 10.8.0.2.51886 > 52.223.202.245.1935: Flags [.], seq 104903:106217, ack 1, win 501, options [nop,nop,TS val 1381907622 ecr 169793200], length 1314
16:51:30.229024 IP 10.8.0.2.51886 > 52.223.202.245.1935: Flags [.], seq 106217:107531, ack 1, win 501, options [nop,nop,TS val 1381907656 ecr 169793200], length 1314
16:51:30.243588 IP 52.223.202.245.1935 > 10.8.0.2.51886: Flags [.], ack 98478, win 126, options [nop,nop,TS val 169793267 ecr 1381907313], length 0
16:51:30.291475 IP 10.8.0.2.51886 > 52.223.202.245.1935: Flags [.], seq 107531:108845, ack 1, win 501, options [nop,nop,TS val 1381907719 ecr 169793267], length 1314
16:51:30.303754 IP 52.223.202.245.1935 > 10.8.0.2.51886: Flags [.], ack 99647, win 126, options [nop,nop,TS val 169793327 ecr 1381907416], length 0
16:51:30.303770 IP 10.8.0.2.51886 > 52.223.202.245.1935: Flags [P.], seq 108845:109538, ack 1, win 501, options [nop,nop,TS val 1381907731 ecr 169793327], length 693
16:51:30.357042 IP 10.8.0.2.51886 > 52.223.202.245.1935: Flags [.], seq 109538:110852, ack 1, win 501, options [nop,nop,TS val 1381907784 ecr 169793327], length 1314
16:51:30.372392 IP 52.223.202.245.1935 > 10.8.0.2.51886: Flags [.], ack 102275, win 126, options [nop,nop,TS val 169793396 ecr 1381907455], length 0
16:51:30.393607 IP 10.8.0.2.51886 > 52.223.202.245.1935: Flags [.], seq 110852:112166, ack 1, win 501, options [nop,nop,TS val 1381907821 ecr 169793396], length 1314
16:51:30.427429 IP 10.8.0.2.51886 > 52.223.202.245.1935: Flags [.], seq 112166:113480, ack 1, win 501, options [nop,nop,TS val 1381907855 ecr 169793396], length 1314
16:51:30.477002 IP 52.223.202.245.1935 > 10.8.0.2.51886: Flags [.], ack 104903, win 126, options [nop,nop,TS val 169793500 ecr 1381907528], length 0
16:51:30.494996 IP 10.8.0.2.51886 > 52.223.202.245.1935: Flags [.], seq 113480:114794, ack 1, win 501, options [nop,nop,TS val 1381907922 ecr 169793500], length 1314
16:51:30.528388 IP 10.8.0.2.51886 > 52.223.202.245.1935: Flags [.], seq 114794:116108, ack 1, win 501, options [nop,nop,TS val 1381907956 ecr 169793500], length 1314
16:51:30.544032 IP 52.223.202.245.1935 > 10.8.0.2.51886: Flags [.], ack 107531, win 126, options [nop,nop,TS val 169793568 ecr 1381907622], length 0
16:51:30.561301 IP 10.8.0.2.51886 > 52.223.202.245.1935: Flags [.], seq 116108:117422, ack 1, win 501, options [nop,nop,TS val 1381907989 ecr 169793568], length 1314
16:51:30.618693 IP 52.223.202.245.1935 > 10.8.0.2.51886: Flags [.], ack 109538, win 126, options [nop,nop,TS val 169793642 ecr 1381907719], length 0
16:51:30.618728 IP 10.8.0.2.51886 > 52.223.202.245.1935: Flags [P.], seq 117422:118594, ack 1, win 501, options [nop,nop,TS val 1381908046 ecr 169793642], length 1172
16:51:30.657659 IP 10.8.0.2.51886 > 52.223.202.245.1935: Flags [.], seq 118594:119908, ack 1, win 501, options [nop,nop,TS val 1381908085 ecr 169793642], length 1314
16:51:30.694743 IP 10.8.0.2.51886 > 52.223.202.245.1935: Flags [.], seq 119908:121222, ack 1, win 501, options [nop,nop,TS val 1381908122 ecr 169793642], length 1314
16:51:30.708508 IP 52.223.202.245.1935 > 10.8.0.2.51886: Flags [.], ack 112166, win 126, options [nop,nop,TS val 169793732 ecr 1381907784], length 0
16:51:30.742952 IP 10.8.0.2.51886 > 52.223.202.245.1935: Flags [.], seq 121222:122536, ack 1, win 501, options [nop,nop,TS val 1381908170 ecr 169793732], length 1314
16:51:30.791582 IP 10.8.0.2.51886 > 52.223.202.245.1935: Flags [.], seq 122536:123850, ack 1, win 501, options [nop,nop,TS val 1381908219 ecr 169793732], length 1314
16:51:30.810291 IP 52.223.202.245.1935 > 10.8.0.2.51886: Flags [.], ack 114794, win 126, options [nop,nop,TS val 169793834 ecr 1381907855], length 0
16:51:30.827239 IP 10.8.0.2.51886 > 52.223.202.245.1935: Flags [.], seq 123850:125164, ack 1, win 501, options [nop,nop,TS val 1381908255 ecr 169793834], length 1314
16:51:30.870523 IP 10.8.0.2.51886 > 52.223.202.245.1935: Flags [.], seq 125164:126478, ack 1, win 501, options [nop,nop,TS val 1381908298 ecr 169793834], length 1314
16:51:30.876382 IP 52.223.202.245.1935 > 10.8.0.2.51886: Flags [.], ack 117422, win 126, options [nop,nop,TS val 169793900 ecr 1381907956], length 0
16:51:30.925170 IP 10.8.0.2.51886 > 52.223.202.245.1935: Flags [.], seq 126478:127792, ack 1, win 501, options [nop,nop,TS val 1381908352 ecr 169793900], length 1314
16:51:30.933603 IP 52.223.202.245.1935 > 10.8.0.2.51886: Flags [.], ack 118594, win 126, options [nop,nop,TS val 169793957 ecr 1381908046], length 0
16:51:30.933626 IP 10.8.0.2.51886 > 52.223.202.245.1935: Flags [P.], seq 127792:128386, ack 1, win 501, options [nop,nop,TS val 1381908361 ecr 169793957], length 594
16:51:30.995316 IP 10.8.0.2.51886 > 52.223.202.245.1935: Flags [.], seq 128386:129700, ack 1, win 501, options [nop,nop,TS val 1381908423 ecr 169793957], length 1314
16:51:31.009907 IP 52.223.202.245.1935 > 10.8.0.2.51886: Flags [.], ack 121222, win 126, options [nop,nop,TS val 169794033 ecr 1381908085], length 0
16:51:31.028655 IP 10.8.0.2.51886 > 52.223.202.245.1935: Flags [.], seq 129700:131014, ack 1, win 501, options [nop,nop,TS val 1381908456 ecr 169794033], length 1314
16:51:31.061851 IP 10.8.0.2.51886 > 52.223.202.245.1935: Flags [.], seq 131014:132328, ack 1, win 501, options [nop,nop,TS val 1381908489 ecr 169794033], length 1314
16:51:31.107074 IP 52.223.202.245.1935 > 10.8.0.2.51886: Flags [.], ack 123850, win 126, options [nop,nop,TS val 169794131 ecr 1381908170], length 0
16:51:31.127834 IP 10.8.0.2.51886 > 52.223.202.245.1935: Flags [.], seq 132328:133642, ack 1, win 501, options [nop,nop,TS val 1381908555 ecr 169794131], length 1314
16:51:31.161975 IP 10.8.0.2.51886 > 52.223.202.245.1935: Flags [.], seq 133642:134956, ack 1, win 501, options [nop,nop,TS val 1381908589 ecr 169794131], length 1314
16:51:31.186298 IP 52.223.202.245.1935 > 10.8.0.2.51886: Flags [.], ack 126478, win 126, options [nop,nop,TS val 169794210 ecr 1381908255], length 0
16:51:31.192368 IP 10.8.0.2.51886 > 52.223.202.245.1935: Flags [.], seq 134956:136270, ack 1, win 501, options [nop,nop,TS val 1381908620 ecr 169794210], length 1314
16:51:31.249103 IP 52.223.202.245.1935 > 10.8.0.2.51886: Flags [.], ack 128386, win 126, options [nop,nop,TS val 169794273 ecr 1381908352], length 0
16:51:31.249130 IP 10.8.0.2.51886 > 52.223.202.245.1935: Flags [P.], seq 136270:137438, ack 1, win 501, options [nop,nop,TS val 1381908676 ecr 169794273], length 1168
16:51:31.291216 IP 10.8.0.2.51886 > 52.223.202.245.1935: Flags [.], seq 137438:138752, ack 1, win 501, options [nop,nop,TS val 1381908719 ecr 169794273], length 1314
16:51:31.324464 IP 10.8.0.2.51886 > 52.223.202.245.1935: Flags [.], seq 138752:140066, ack 1, win 501, options [nop,nop,TS val 1381908752 ecr 169794273], length 1314
16:51:31.343371 IP 52.223.202.245.1935 > 10.8.0.2.51886: Flags [.], ack 131014, win 126, options [nop,nop,TS val 169794367 ecr 1381908423], length 0
16:51:31.362593 IP 10.8.0.2.51886 > 52.223.202.245.1935: Flags [.], seq 140066:141380, ack 1, win 501, options [nop,nop,TS val 1381908790 ecr 169794367], length 1314
16:51:31.426906 IP 10.8.0.2.51886 > 52.223.202.245.1935: Flags [.], seq 141380:142694, ack 1, win 501, options [nop,nop,TS val 1381908854 ecr 169794367], length 1314
16:51:31.442864 IP 52.223.202.245.1935 > 10.8.0.2.51886: Flags [.], ack 133642, win 126, options [nop,nop,TS val 169794466 ecr 1381908489], length 0
16:51:31.459479 IP 10.8.0.2.51886 > 52.223.202.245.1935: Flags [.], seq 142694:144008, ack 1, win 501, options [nop,nop,TS val 1381908887 ecr 169794466], length 1314
16:51:31.495030 IP 10.8.0.2.51886 > 52.223.202.245.1935: Flags [.], seq 144008:145322, ack 1, win 501, options [nop,nop,TS val 1381908922 ecr 169794466], length 1314
16:51:31.507080 IP 52.223.202.245.1935 > 10.8.0.2.51886: Flags [.], ack 136270, win 126, options [nop,nop,TS val 169794531 ecr 1381908589], length 0
16:51:31.561978 IP 10.8.0.2.51886 > 52.223.202.245.1935: Flags [.], seq 145322:146636, ack 1, win 501, options [nop,nop,TS val 1381908989 ecr 169794531], length 1314
16:51:31.563893 IP 52.223.202.245.1935 > 10.8.0.2.51886: Flags [.], ack 137438, win 126, options [nop,nop,TS val 169794588 ecr 1381908676], length 0
16:51:31.563923 IP 10.8.0.2.51886 > 52.223.202.245.1935: Flags [P.], seq 146636:147337, ack 1, win 501, options [nop,nop,TS val 1381908991 ecr 169794588], length 701
16:51:31.627485 IP 10.8.0.2.51886 > 52.223.202.245.1935: Flags [.], seq 147337:148651, ack 1, win 501, options [nop,nop,TS val 1381909055 ecr 169794588], length 1314
16:51:31.640115 IP 52.223.202.245.1935 > 10.8.0.2.51886: Flags [.], ack 140066, win 126, options [nop,nop,TS val 169794664 ecr 1381908719], length 0
16:51:31.662233 IP 10.8.0.2.51886 > 52.223.202.245.1935: Flags [.], seq 148651:149965, ack 1, win 501, options [nop,nop,TS val 1381909090 ecr 169794664], length 1314
16:51:31.695031 IP 10.8.0.2.51886 > 52.223.202.245.1935: Flags [.], seq 149965:151279, ack 1, win 501, options [nop,nop,TS val 1381909122 ecr 169794664], length 1314
16:51:31.742258 IP 52.223.202.245.1935 > 10.8.0.2.51886: Flags [.], ack 142694, win 126, options [nop,nop,TS val 169794766 ecr 1381908790], length 0
16:51:31.760841 IP 10.8.0.2.51886 > 52.223.202.245.1935: Flags [.], seq 151279:152593, ack 1, win 501, options [nop,nop,TS val 1381909188 ecr 169794766], length 1314
16:51:31.795057 IP 10.8.0.2.51886 > 52.223.202.245.1935: Flags [.], seq 152593:153907, ack 1, win 501, options [nop,nop,TS val 1381909222 ecr 169794766], length 1314
16:51:31.810095 IP 52.223.202.245.1935 > 10.8.0.2.51886: Flags [.], ack 145322, win 126, options [nop,nop,TS val 169794834 ecr 1381908887], length 0
16:51:31.828294 IP 10.8.0.2.51886 > 52.223.202.245.1935: Flags [.], seq 153907:155221, ack 1, win 501, options [nop,nop,TS val 1381909256 ecr 169794834], length 1314
16:51:31.879643 IP 52.223.202.245.1935 > 10.8.0.2.51886: Flags [.], ack 147337, win 126, options [nop,nop,TS val 169794903 ecr 1381908989], length 0
16:51:31.879680 IP 10.8.0.2.51886 > 52.223.202.245.1935: Flags [P.], seq 155221:156382, ack 1, win 501, options [nop,nop,TS val 1381909307 ecr 169794903], length 1161
16:51:31.928279 IP 10.8.0.2.51886 > 52.223.202.245.1935: Flags [.], seq 156382:157696, ack 1, win 501, options [nop,nop,TS val 1381909356 ecr 169794903], length 1314
16:51:31.961253 IP 10.8.0.2.51886 > 52.223.202.245.1935: Flags [.], seq 157696:159010, ack 1, win 501, options [nop,nop,TS val 1381909389 ecr 169794903], length 1314
16:51:31.977319 IP 52.223.202.245.1935 > 10.8.0.2.51886: Flags [.], ack 149965, win 126, options [nop,nop,TS val 169795001 ecr 1381909055], length 0
16:51:32.006048 IP 10.8.0.2.51886 > 52.223.202.245.1935: Flags [.], seq 159010:160324, ack 1, win 501, options [nop,nop,TS val 1381909433 ecr 169795001], length 1314
16:51:32.063412 IP 10.8.0.2.51886 > 52.223.202.245.1935: Flags [.], seq 160324:161638, ack 1, win 501, options [nop,nop,TS val 1381909491 ecr 169795001], length 1314
16:51:32.070166 IP 52.223.202.245.1935 > 10.8.0.2.51886: Flags [.], ack 151279, win 126, options [nop,nop,TS val 169795094 ecr 1381909122], length 0
16:51:32.092710 IP 10.8.0.2.51886 > 52.223.202.245.1935: Flags [.], seq 161638:162952, ack 1, win 501, options [nop,nop,TS val 1381909520 ecr 169795094], length 1314
16:51:32.110541 IP 52.223.202.245.1935 > 10.8.0.2.51886: Flags [.], ack 153907, win 126, options [nop,nop,TS val 169795134 ecr 1381909188], length 0
16:51:32.134482 IP 10.8.0.2.51886 > 52.223.202.245.1935: Flags [.], seq 162952:164266, ack 1, win 501, options [nop,nop,TS val 1381909562 ecr 169795134], length 1314
16:51:32.194647 IP 52.223.202.245.1935 > 10.8.0.2.51886: Flags [.], ack 156382, win 126, options [nop,nop,TS val 169795218 ecr 1381909256], length 0
16:51:32.194682 IP 10.8.0.2.51886 > 52.223.202.245.1935: Flags [P.], seq 164266:165343, ack 1, win 501, options [nop,nop,TS val 1381909622 ecr 169795218], length 1077
16:51:32.228602 IP 10.8.0.2.51886 > 52.223.202.245.1935: Flags [.], seq 165343:166657, ack 1, win 501, options [nop,nop,TS val 1381909656 ecr 169795218], length 1314
16:51:32.259278 IP 10.8.0.2.51886 > 52.223.202.245.1935: Flags [.], seq 166657:167971, ack 1, win 501, options [nop,nop,TS val 1381909687 ecr 169795218], length 1314
16:51:32.276428 IP 52.223.202.245.1935 > 10.8.0.2.51886: Flags [.], ack 159010, win 126, options [nop,nop,TS val 169795300 ecr 1381909356], length 0
16:51:32.305971 IP 10.8.0.2.51886 > 52.223.202.245.1935: Flags [.], seq 167971:169285, ack 1, win 501, options [nop,nop,TS val 1381909733 ecr 169795300], length 1314
16:51:32.360953 IP 10.8.0.2.51886 > 52.223.202.245.1935: Flags [.], seq 169285:170599, ack 1, win 501, options [nop,nop,TS val 1381909788 ecr 169795300], length 1314
16:51:32.378471 IP 52.223.202.245.1935 > 10.8.0.2.51886: Flags [.], ack 161638, win 126, options [nop,nop,TS val 169795402 ecr 1381909433], length 0
16:51:32.393050 IP 10.8.0.2.51886 > 52.223.202.245.1935: Flags [.], seq 170599:171913, ack 1, win 501, options [nop,nop,TS val 1381909820 ecr 169795402], length 1314
16:51:32.434460 IP 10.8.0.2.51886 > 52.223.202.245.1935: Flags [.], seq 171913:173227, ack 1, win 501, options [nop,nop,TS val 1381909862 ecr 169795402], length 1314
16:51:32.449931 IP 52.223.202.245.1935 > 10.8.0.2.51886: Flags [.], ack 164266, win 126, options [nop,nop,TS val 169795473 ecr 1381909520], length 0
16:51:32.491044 IP 10.8.0.2.51886 > 52.223.202.245.1935: Flags [.], seq 173227:174541, ack 1, win 501, options [nop,nop,TS val 1381909918 ecr 169795473], length 1314
16:51:32.509630 IP 52.223.202.245.1935 > 10.8.0.2.51886: Flags [.], ack 165343, win 126, options [nop,nop,TS val 169795533 ecr 1381909622], length 0
16:51:32.509646 IP 10.8.0.2.51886 > 52.223.202.245.1935: Flags [P.], seq 174541:175234, ack 1, win 501, options [nop,nop,TS val 1381909937 ecr 169795533], length 693
16:51:32.561877 IP 10.8.0.2.51886 > 52.223.202.245.1935: Flags [.], seq 175234:176548, ack 1, win 501, options [nop,nop,TS val 1381909989 ecr 169795533], length 1314
16:51:32.574314 IP 52.223.202.245.1935 > 10.8.0.2.51886: Flags [.], ack 167971, win 126, options [nop,nop,TS val 169795598 ecr 1381909656], length 0
16:51:32.595801 IP 10.8.0.2.51886 > 52.223.202.245.1935: Flags [.], seq 176548:177862, ack 1, win 501, options [nop,nop,TS val 1381910023 ecr 169795598], length 1314
16:51:32.626016 IP 10.8.0.2.51886 > 52.223.202.245.1935: Flags [.], seq 177862:179176, ack 1, win 501, options [nop,nop,TS val 1381910053 ecr 169795598], length 1314
16:51:32.677586 IP 52.223.202.245.1935 > 10.8.0.2.51886: Flags [.], ack 170599, win 126, options [nop,nop,TS val 169795701 ecr 1381909733], length 0
16:51:32.695315 IP 10.8.0.2.51886 > 52.223.202.245.1935: Flags [.], seq 179176:180490, ack 1, win 501, options [nop,nop,TS val 1381910123 ecr 169795701], length 1314
16:51:32.728910 IP 10.8.0.2.51886 > 52.223.202.245.1935: Flags [.], seq 180490:181804, ack 1, win 501, options [nop,nop,TS val 1381910156 ecr 169795701], length 1314
16:51:32.749446 IP 52.223.202.245.1935 > 10.8.0.2.51886: Flags [.], ack 173227, win 126, options [nop,nop,TS val 169795773 ecr 1381909820], length 0
16:51:32.758821 IP 10.8.0.2.51886 > 52.223.202.245.1935: Flags [.], seq 181804:183118, ack 1, win 501, options [nop,nop,TS val 1381910186 ecr 169795773], length 1314
16:51:32.824510 IP 52.223.202.245.1935 > 10.8.0.2.51886: Flags [.], ack 175234, win 126, options [nop,nop,TS val 169795848 ecr 1381909918], length 0
16:51:32.824555 IP 10.8.0.2.51886 > 52.223.202.245.1935: Flags [P.], seq 183118:184282, ack 1, win 501, options [nop,nop,TS val 1381910252 ecr 169795848], length 1164
16:51:32.861764 IP 10.8.0.2.51886 > 52.223.202.245.1935: Flags [.], seq 184282:185596, ack 1, win 501, options [nop,nop,TS val 1381910289 ecr 169795848], length 1314
16:51:32.893738 IP 10.8.0.2.51886 > 52.223.202.245.1935: Flags [.], seq 185596:186910, ack 1, win 501, options [nop,nop,TS val 1381910321 ecr 169795848], length 1314
16:51:32.910840 IP 52.223.202.245.1935 > 10.8.0.2.51886: Flags [.], ack 177862, win 126, options [nop,nop,TS val 169795934 ecr 1381909989], length 0
16:51:32.946911 IP 10.8.0.2.51886 > 52.223.202.245.1935: Flags [.], seq 186910:188224, ack 1, win 501, options [nop,nop,TS val 1381910374 ecr 169795934], length 1314
16:51:32.993689 IP 10.8.0.2.51886 > 52.223.202.245.1935: Flags [.], seq 188224:189538, ack 1, win 501, options [nop,nop,TS val 1381910421 ecr 169795934], length 1314
16:51:33.011253 IP 52.223.202.245.1935 > 10.8.0.2.51886: Flags [.], ack 179176, win 126, options [nop,nop,TS val 169796034 ecr 1381910053], length 0
16:51:33.027140 IP 10.8.0.2.51886 > 52.223.202.245.1935: Flags [.], seq 189538:190852, ack 1, win 501, options [nop,nop,TS val 1381910454 ecr 169796034], length 1314
16:51:33.043941 IP 52.223.202.245.1935 > 10.8.0.2.51886: Flags [.], ack 181804, win 126, options [nop,nop,TS val 169796067 ecr 1381910123], length 0
16:51:33.075020 IP 10.8.0.2.51886 > 52.223.202.245.1935: Flags [.], seq 190852:192166, ack 1, win 501, options [nop,nop,TS val 1381910502 ecr 169796067], length 1314
16:51:33.127385 IP 10.8.0.2.51886 > 52.223.202.245.1935: Flags [.], seq 192166:193480, ack 1, win 501, options [nop,nop,TS val 1381910555 ecr 169796067], length 1314
16:51:33.139549 IP 52.223.202.245.1935 > 10.8.0.2.51886: Flags [.], ack 184282, win 126, options [nop,nop,TS val 169796163 ecr 1381910186], length 0
16:51:33.139577 IP 10.8.0.2.51886 > 52.223.202.245.1935: Flags [P.], seq 193480:194186, ack 1, win 501, options [nop,nop,TS val 1381910567 ecr 169796163], length 706
16:51:33.195368 IP 10.8.0.2.51886 > 52.223.202.245.1935: Flags [.], seq 194186:195500, ack 1, win 501, options [nop,nop,TS val 1381910623 ecr 169796163], length 1314
16:51:33.208731 IP 52.223.202.245.1935 > 10.8.0.2.51886: Flags [.], ack 186910, win 126, options [nop,nop,TS val 169796232 ecr 1381910289], length 0
16:51:33.228393 IP 10.8.0.2.51886 > 52.223.202.245.1935: Flags [.], seq 195500:196814, ack 1, win 501, options [nop,nop,TS val 1381910656 ecr 169796232], length 1314
16:51:33.267547 IP 10.8.0.2.51886 > 52.223.202.245.1935: Flags [.], seq 196814:198128, ack 1, win 501, options [nop,nop,TS val 1381910695 ecr 169796232], length 1314
16:51:33.308672 IP 52.223.202.245.1935 > 10.8.0.2.51886: Flags [.], ack 189538, win 126, options [nop,nop,TS val 169796332 ecr 1381910374], length 0
16:51:33.326384 IP 10.8.0.2.51886 > 52.223.202.245.1935: Flags [.], seq 198128:199442, ack 1, win 501, options [nop,nop,TS val 1381910754 ecr 169796332], length 1314
16:51:33.360724 IP 10.8.0.2.51886 > 52.223.202.245.1935: Flags [.], seq 199442:200756, ack 1, win 501, options [nop,nop,TS val 1381910788 ecr 169796332], length 1314
16:51:33.390041 IP 52.223.202.245.1935 > 10.8.0.2.51886: Flags [.], ack 192166, win 126, options [nop,nop,TS val 169796413 ecr 1381910454], length 0
16:51:33.395881 IP 10.8.0.2.51886 > 52.223.202.245.1935: Flags [.], seq 200756:202070, ack 1, win 501, options [nop,nop,TS val 1381910823 ecr 169796413], length 1314
16:51:33.454930 IP 52.223.202.245.1935 > 10.8.0.2.51886: Flags [.], ack 194186, win 126, options [nop,nop,TS val 169796478 ecr 1381910555], length 0
16:51:33.454952 IP 10.8.0.2.51886 > 52.223.202.245.1935: Flags [P.], seq 202070:203131, ack 1, win 501, options [nop,nop,TS val 1381910882 ecr 169796478], length 1061
16:51:33.494523 IP 10.8.0.2.51886 > 52.223.202.245.1935: Flags [.], seq 203131:204445, ack 1, win 501, options [nop,nop,TS val 1381910922 ecr 169796478], length 1314
16:51:33.528578 IP 10.8.0.2.51886 > 52.223.202.245.1935: Flags [.], seq 204445:205759, ack 1, win 501, options [nop,nop,TS val 1381910956 ecr 169796478], length 1314
16:51:33.543388 IP 52.223.202.245.1935 > 10.8.0.2.51886: Flags [.], ack 196814, win 126, options [nop,nop,TS val 169796567 ecr 1381910623], length 0
