22:15:06.796279 IP 10.8.3.3.33996 > 99.181.96.179.1935: Flags [.], seq 1872261895:1872263209, ack 3968553415, win 501, options [nop,nop,TS val 3414587178 ecr 149861967], length 1314
22:15:06.824013 IP 10.8.3.3.33996 > 99.181.96.179.1935: Flags [.], seq 1314:2628, ack 1, win 501, options [nop,nop,TS val 3414587206 ecr 149861967], length 1314
22:15:06.865805 IP 99.181.96.179.1935 > 10.8.3.3.33996: Flags [.], ack 4294956447, win 126, options [nop,nop,TS val 149862067 ecr 3414586730], length 0
22:15:06.890765 IP 10.8.3.3.33996 > 99.181.96.179.1935: Flags [.], seq 2628:3942, ack 1, win 501, options [nop,nop,TS val 3414587272 ecr 149862067], length 1314
22:15:06.924790 IP 10.8.3.3.33996 > 99.181.96.179.1935: Flags [.], seq 3942:5256, ack 1, win 501, options [nop,nop,TS val 3414587306 ecr 149862067], length 1314
22:15:06.951447 IP 99.181.96.179.1935 > 10.8.3.3.33996: Flags [.], ack 4294959075, win 126, options [nop,nop,TS val 149862153 ecr 3414586802], length 0
22:15:06.957174 IP 10.8.3.3.33996 > 99.181.96.179.1935: Flags [.], seq 5256:6570, ack 1, win 501, options [nop,nop,TS val 3414587339 ecr 149862153], length 1314
22:15:07.032452 IP 10.8.3.3.33996 > 99.181.96.179.1935: Flags [.], seq 6570:7884, ack 1, win 501, options [nop,nop,TS val 3414587414 ecr 149862153], length 1314
22:15:07.036161 IP 99.181.96.179.1935 > 10.8.3.3.33996: Flags [.], ack 4294961703, win 126, options [nop,nop,TS val 149862238 ecr 3414586902], length 0
22:15:07.057395 IP 10.8.3.3.33996 > 99.181.96.179.1935: Flags [.], seq 7884:9198, ack 1, win 501, options [nop,nop,TS val 3414587439 ecr 149862238], length 1314
22:15:07.096587 IP 10.8.3.3.33996 > 99.181.96.179.1935: Flags [.], seq 9198:10512, ack 1, win 501, options [nop,nop,TS val 3414587478 ecr 149862238], length 1314
22:15:07.133369 IP 99.181.96.179.1935 > 10.8.3.3.33996: Flags [.], ack 4294964331, win 126, options [nop,nop,TS val 149862335 ecr 3414586985], length 0
22:15:07.160932 IP 10.8.3.3.33996 > 99.181.96.179.1935: Flags [.], seq 10512:11826, ack 1, win 501, options [nop,nop,TS val 3414587543 ecr 149862335], length 1314
22:15:07.172022 IP 99.181.96.179.1935 > 10.8.3.3.33996: Flags [.], ack 4294965982, win 126, options [nop,nop,TS val 149862374 ecr 3414587071], length 0
22:15:07.172059 IP 10.8.3.3.33996 > 99.181.96.179.1935: Flags [P.], seq 11826:12635, ack 1, win 501, options [nop,nop,TS val 3414587554 ecr 149862374], length 809
22:15:07.225140 IP 10.8.3.3.33996 > 99.181.96.179.1935: Flags [.], seq 12635:13949, ack 1, win 501, options [nop,nop,TS val 3414587607 ecr 149862374], length 1314
22:15:07.255121 IP 10.8.3.3.33996 > 99.181.96.179.1935: Flags [.], seq 13949:15263, ack 1, win 501, options [nop,nop,TS val 3414587637 ecr 149862374], length 1314
22:15:07.272026 IP 99.181.96.179.1935 > 10.8.3.3.33996: Flags [.], ack 1314, win 126, options [nop,nop,TS val 149862474 ecr 3414587140], length 0
22:15:07.289021 IP 10.8.3.3.33996 > 99.181.96.179.1935: Flags [.], seq 15263:16577, ack 1, win 501, options [nop,nop,TS val 3414587671 ecr 149862474], length 1314
22:15:07.353471 IP 10.8.3.3.33996 > 99.181.96.179.1935: Flags [.], seq 16577:17891, ack 1, win 501, options [nop,nop,TS val 3414587735 ecr 149862474], length 1314
22:15:07.361758 IP 99.181.96.179.1935 > 10.8.3.3.33996: Flags [.], ack 2628, win 126, options [nop,nop,TS val 149862563 ecr 3414587206], length 0
22:15:07.395157 IP 10.8.3.3.33996 > 99.181.96.179.1935: Flags [.], seq 17891:19205, ack 1, win 501, options [nop,nop,TS val 3414587777 ecr 149862563], length 1314
22:15:07.400490 IP 99.181.96.179.1935 > 10.8.3.3.33996: Flags [.], ack 5256, win 126, options [nop,nop,TS val 149862602 ecr 3414587272], length 0
22:15:07.421294 IP 10.8.3.3.33996 > 99.181.96.179.1935: Flags [.], seq 19205:20519, ack 1, win 501, options [nop,nop,TS val 3414587803 ecr 149862602], length 1314
22:15:07.486793 IP 10.8.3.3.33996 > 99.181.96.179.1935: Flags [.], seq 20519:21833, ack 1, win 501, options [nop,nop,TS val 3414587868 ecr 149862602], length 1314
22:15:07.508865 IP 99.181.96.179.1935 > 10.8.3.3.33996: Flags [.], ack 7884, win 126, options [nop,nop,TS val 149862710 ecr 3414587339], length 0
22:15:07.522305 IP 10.8.3.3.33996 > 99.181.96.179.1935: Flags [.], seq 21833:23147, ack 1, win 501, options [nop,nop,TS val 3414587904 ecr 149862710], length 1314
22:15:07.565161 IP 10.8.3.3.33996 > 99.181.96.179.1935: Flags [.], seq 23147:24461, ack 1, win 501, options [nop,nop,TS val 3414587947 ecr 149862710], length 1314
22:15:07.572322 IP 99.181.96.179.1935 > 10.8.3.3.33996: Flags [.], ack 10512, win 126, options [nop,nop,TS val 149862774 ecr 3414587439], length 0
22:15:07.629699 IP 10.8.3.3.33996 > 99.181.96.179.1935: Flags [.], seq 24461:25775, ack 1, win 501, options [nop,nop,TS val 3414588011 ecr 149862774], length 1314
22:15:07.647775 IP 99.181.96.179.1935 > 10.8.3.3.33996: Flags [.], ack 12635, win 126, options [nop,nop,TS val 149862849 ecr 3414587543], length 0
22:15:07.647810 IP 10.8.3.3.33996 > 99.181.96.179.1935: Flags [P.], seq 25775:26588, ack 1, win 501, options [nop,nop,TS val 3414588030 ecr 149862849], length 813
22:15:07.694182 IP 10.8.3.3.33996 > 99.181.96.179.1935: Flags [.], seq 26588:27902, ack 1, win 501, options [nop,nop,TS val 3414588076 ecr 149862849], length 1314
22:15:07.721386 IP 10.8.3.3.33996 > 99.181.96.179.1935: Flags [.], seq 27902:29216, ack 1, win 501, options [nop,nop,TS val 3414588103 ecr 149862849], length 1314
22:15:07.730870 IP 99.181.96.179.1935 > 10.8.3.3.33996: Flags [.], ack 15263, win 126, options [nop,nop,TS val 149862932 ecr 3414587607], length 0
22:15:07.758113 IP 10.8.3.3.33996 > 99.181.96.179.1935: Flags [.], seq 29216:30530, ack 1, win 501, options [nop,nop,TS val 3414588140 ecr 149862932], length 1314
22:15:07.824353 IP 10.8.3.3.33996 > 99.181.96.179.1935: Flags [.], seq 30530:31844, ack 1, win 501, options [nop,nop,TS val 3414588206 ecr 149862932], length 1314
22:15:07.829298 IP 99.181.96.179.1935 > 10.8.3.3.33996: Flags [.], ack 17891, win 126, options [nop,nop,TS val 149863031 ecr 3414587671], length 0
22:15:07.865387 IP 10.8.3.3.33996 > 99.181.96.179.1935: Flags [.], seq 31844:33158, ack 1, win 501, options [nop,nop,TS val 3414588247 ecr 149863031], length 1314
22:15:07.888078 IP 10.8.3.3.33996 > 99.181.96.179.1935: Flags [.], seq 33158:34472, ack 1, win 501, options [nop,nop,TS val 3414588270 ecr 149863031], length 1314
22:15:07.896851 IP 99.181.96.179.1935 > 10.8.3.3.33996: Flags [.], ack 20519, win 126, options [nop,nop,TS val 149863098 ecr 3414587777], length 0
22:15:07.957527 IP 10.8.3.3.33996 > 99.181.96.179.1935: Flags [.], seq 34472:35786, ack 1, win 501, options [nop,nop,TS val 3414588339 ecr 149863098], length 1314
22:15:07.994061 IP 10.8.3.3.33996 > 99.181.96.179.1935: Flags [.], seq 35786:37100, ack 1, win 501, options [nop,nop,TS val 3414588376 ecr 149863098], length 1314
22:15:08.001918 IP 99.181.96.179.1935 > 10.8.3.3.33996: Flags [.], ack 23147, win 126, options [nop,nop,TS val 149863199 ecr 3414587868], length 0
22:15:08.021971 IP 10.8.3.3.33996 > 99.181.96.179.1935: Flags [.], seq 37100:38414, ack 1, win 501, options [nop,nop,TS val 3414588404 ecr 149863199], length 1314
22:15:08.100833 IP 10.8.3.3.33996 > 99.181.96.179.1935: Flags [.], seq 38414:39728, ack 1, win 501, options [nop,nop,TS val 3414588483 ecr 149863199], length 1314
22:15:08.107488 IP 99.181.96.179.1935 > 10.8.3.3.33996: Flags [.], ack 25775, win 126, options [nop,nop,TS val 149863309 ecr 3414587947], length 0
22:15:08.123283 IP 99.181.96.179.1935 > 10.8.3.3.33996: Flags [.], ack 26588, win 126, options [nop,nop,TS val 149863325 ecr 3414588030], length 0
22:15:08.123309 IP 10.8.3.3.33996 > 99.181.96.179.1935: Flags [P.], seq 39728:40626, ack 1, win 501, options [nop,nop,TS val 3414588505 ecr 149863325], length 898
22:15:08.164892 IP 10.8.3.3.33996 > 99.181.96.179.1935: Flags [.], seq 40626:41940, ack 1, win 501, options [nop,nop,TS val 3414588547 ecr 149863325], length 1314
22:15:08.188690 IP 10.8.3.3.33996 > 99.181.96.179.1935: Flags [.], seq 41940:43254, ack 1, win 501, options [nop,nop,TS val 3414588570 ecr 149863325], length 1314
22:15:08.197263 IP 99.181.96.179.1935 > 10.8.3.3.33996: Flags [.], ack 29216, win 126, options [nop,nop,TS val 149863399 ecr 3414588076], length 0
22:15:08.249956 IP 10.8.3.3.33996 > 99.181.96.179.1935: Flags [.], seq 43254:44568, ack 1, win 501, options [nop,nop,TS val 3414588632 ecr 149863399], length 1314
22:15:08.292598 IP 10.8.3.3.33996 > 99.181.96.179.1935: Flags [.], seq 44568:45882, ack 1, win 501, options [nop,nop,TS val 3414588674 ecr 149863399], length 1314
22:15:08.299900 IP 99.181.96.179.1935 > 10.8.3.3.33996: Flags [.], ack 31844, win 126, options [nop,nop,TS val 149863501 ecr 3414588140], length 0
22:15:08.324224 IP 10.8.3.3.33996 > 99.181.96.179.1935: Flags [.], seq 45882:47196, ack 1, win 501, options [nop,nop,TS val 3414588706 ecr 149863501], length 1314
22:15:08.363875 IP 99.181.96.179.1935 > 10.8.3.3.33996: Flags [.], ack 34472, win 126, options [nop,nop,TS val 149863565 ecr 3414588247], length 0
22:15:08.377985 IP 10.8.3.3.33996 > 99.181.96.179.1935: Flags [.], seq 47196:48510, ack 1, win 501, options [nop,nop,TS val 3414588760 ecr 149863565], length 1314
22:15:08.420394 IP 10.8.3.3.33996 > 99.181.96.179.1935: Flags [.], seq 48510:49824, ack 1, win 501, options [nop,nop,TS val 3414588802 ecr 149863565], length 1314
22:15:08.463207 IP 10.8.3.3.33996 > 99.181.96.179.1935: Flags [.], seq 49824:51138, ack 1, win 501, options [nop,nop,TS val 3414588845 ecr 149863565], length 1314
22:15:08.473585 IP 99.181.96.179.1935 > 10.8.3.3.33996: Flags [.], ack 37100, win 126, options [nop,nop,TS val 149863675 ecr 3414588339], length 0
22:15:08.506364 IP 10.8.3.3.33996 > 99.181.96.179.1935: Flags [.], seq 51138:52452, ack 1, win 501, options [nop,nop,TS val 3414588888 ecr 149863675], length 1314
22:15:08.556685 IP 10.8.3.3.33996 > 99.181.96.179.1935: Flags [.], seq 52452:53766, ack 1, win 501, options [nop,nop,TS val 3414588938 ecr 149863675], length 1314
22:15:08.570242 IP 99.181.96.179.1935 > 10.8.3.3.33996: Flags [.], ack 38414, win 126, options [nop,nop,TS val 149863771 ecr 3414588404], length 0
22:15:08.591940 IP 10.8.3.3.33996 > 99.181.96.179.1935: Flags [.], seq 53766:55080, ack 1, win 501, options [nop,nop,TS val 3414588974 ecr 149863771], length 1314
22:15:08.599121 IP 99.181.96.179.1935 > 10.8.3.3.33996: Flags [.], ack 40626, win 126, options [nop,nop,TS val 149863800 ecr 3414588483], length 0
22:15:08.599154 IP 10.8.3.3.33996 > 99.181.96.179.1935: Flags [P.], seq 55080:55434, ack 1, win 501, options [nop,nop,TS val 3414588981 ecr 149863800], length 354
22:15:08.655905 IP 10.8.3.3.33996 > 99.181.96.179.1935: Flags [.], seq 55434:56748, ack 1, win 501, options [nop,nop,TS val 3414589038 ecr 149863800], length 1314
22:15:08.664358 IP 99.181.96.179.1935 > 10.8.3.3.33996: Flags [.], ack 43254, win 126, options [nop,nop,TS val 149863866 ecr 3414588547], length 0
22:15:08.698358 IP 10.8.3.3.33996 > 99.181.96.179.1935: Flags [.], seq 56748:58062, ack 1, win 501, options [nop,nop,TS val 3414589080 ecr 149863866], length 1314
22:15:08.722747 IP 10.8.3.3.33996 > 99.181.96.179.1935: Flags [.], seq 58062:59376, ack 1, win 501, options [nop,nop,TS val 3414589104 ecr 149863866], length 1314
22:15:08.768364 IP 99.181.96.179.1935 > 10.8.3.3.33996: Flags [.], ack 45882, win 126, options [nop,nop,TS val 149863970 ecr 3414588632], length 0
22:15:08.788848 IP 10.8.3.3.33996 > 99.181.96.179.1935: Flags [.], seq 59376:60690, ack 1, win 501, options [nop,nop,TS val 3414589171 ecr 149863970], length 1314
22:15:08.826798 IP 10.8.3.3.33996 > 99.181.96.179.1935: Flags [.], seq 60690:62004, ack 1, win 501, options [nop,nop,TS val 3414589208 ecr 149863970], length 1314
22:15:08.855687 IP 10.8.3.3.33996 > 99.181.96.179.1935: Flags [.], seq 62004:63318, ack 1, win 501, options [nop,nop,TS val 3414589237 ecr 149863970], length 1314
22:15:08.855693 IP 99.181.96.179.1935 > 10.8.3.3.33996: Flags [.], ack 48510, win 126, options [nop,nop,TS val 149864057 ecr 3414588706], length 0
22:15:08.933481 IP 10.8.3.3.33996 > 99.181.96.179.1935: Flags [.], seq 63318:64632, ack 1, win 501, options [nop,nop,TS val 3414589315 ecr 149864057], length 1314
22:15:08.939183 IP 99.181.96.179.1935 > 10.8.3.3.33996: Flags [.], ack 51138, win 126, options [nop,nop,TS val 149864141 ecr 3414588802], length 0
22:15:08.955597 IP 10.8.3.3.33996 > 99.181.96.179.1935: Flags [.], seq 64632:65946, ack 1, win 501, options [nop,nop,TS val 3414589337 ecr 149864141], length 1314
22:15:08.997684 IP 10.8.3.3.33996 > 99.181.96.179.1935: Flags [.], seq 65946:67260, ack 1, win 501, options [nop,nop,TS val 3414589379 ecr 149864141], length 1314
22:15:09.033443 IP 99.181.96.179.1935 > 10.8.3.3.33996: Flags [.], ack 53766, win 126, options [nop,nop,TS val 149864235 ecr 3414588888], length 0
22:15:09.062086 IP 10.8.3.3.33996 > 99.181.96.179.1935: Flags [.], seq 67260:68574, ack 1, win 501, options [nop,nop,TS val 3414589444 ecr 149864235], length 1314
22:15:09.074818 IP 99.181.96.179.1935 > 10.8.3.3.33996: Flags [.], ack 55434, win 126, options [nop,nop,TS val 149864276 ecr 3414588974], length 0
22:15:09.074852 IP 10.8.3.3.33996 > 99.181.96.179.1935: Flags [P.], seq 68574:69375, ack 1, win 501, options [nop,nop,TS val 3414589457 ecr 149864276], length 801
22:15:09.126511 IP 10.8.3.3.33996 > 99.181.96.179.1935: Flags [.], seq 69375:70689, ack 1, win 501, options [nop,nop,TS val 3414589508 ecr 149864276], length 1314
22:15:09.154609 IP 10.8.3.3.33996 > 99.181.96.179.1935: Flags [.], seq 70689:72003, ack 1, win 501, options [nop,nop,TS val 3414589536 ecr 149864276], length 1314
22:15:09.173789 IP 99.181.96.179.1935 > 10.8.3.3.33996: Flags [.], ack 58062, win 126, options [nop,nop,TS val 149864375 ecr 3414589038], length 0
22:15:09.186508 IP 10.8.3.3.33996 > 99.181.96.179.1935: Flags [.], seq 72003:73317, ack 1, win 501, options [nop,nop,TS val 3414589568 ecr 149864375], length 1314
22:15:09.257039 IP 10.8.3.3.33996 > 99.181.96.179.1935: Flags [.], seq 73317:74631, ack 1, win 501, options [nop,nop,TS val 3414589639 ecr 149864375], length 1314
22:15:09.264628 IP 99.181.96.179.1935 > 10.8.3.3.33996: Flags [.], ack 60690, win 126, options [nop,nop,TS val 149864466 ecr 3414589104], length 0
22:15:09.297021 IP 10.8.3.3.33996 > 99.181.96.179.1935: Flags [.], seq 74631:75945, ack 1, win 501, options [nop,nop,TS val 3414589679 ecr 149864466], length 1314
22:15:09.318842 IP 10.8.3.3.33996 > 99.181.96.179.1935: Flags [.], seq 75945:77259, ack 1, win 501, options [nop,nop,TS val 3414589701 ecr 149864466], length 1314
22:15:09.331414 IP 99.181.96.179.1935 > 10.8.3.3.33996: Flags [.], ack 63318, win 126, options [nop,nop,TS val 149864533 ecr 3414589208], length 0
22:15:09.382808 IP 10.8.3.3.33996 > 99.181.96.179.1935: Flags [.], seq 77259:78573, ack 1, win 501, options [nop,nop,TS val 3414589764 ecr 149864533], length 1314
22:15:09.422967 IP 10.8.3.3.33996 > 99.181.96.179.1935: Flags [.], seq 78573:79887, ack 1, win 501, options [nop,nop,TS val 3414589805 ecr 149864533], length 1314
22:15:09.431760 IP 99.181.96.179.1935 > 10.8.3.3.33996: Flags [.], ack 65946, win 126, options [nop,nop,TS val 149864633 ecr 3414589315], length 0
22:15:09.456055 IP 10.8.3.3.33996 > 99.181.96.179.1935: Flags [.], seq 79887:81201, ack 1, win 501, options [nop,nop,TS val 3414589838 ecr 149864633], length 1314
22:15:09.521345 IP 10.8.3.3.33996 > 99.181.96.179.1935: Flags [.], seq 81201:82515, ack 1, win 501, options [nop,nop,TS val 3414589903 ecr 149864633], length 1314
22:15:09.537867 IP 99.181.96.179.1935 > 10.8.3.3.33996: Flags [.], ack 68574, win 126, options [nop,nop,TS val 149864739 ecr 3414589379], length 0
22:15:09.550470 IP 99.181.96.179.1935 > 10.8.3.3.33996: Flags [.], ack 69375, win 126, options [nop,nop,TS val 149864752 ecr 3414589457], length 0
22:15:09.550500 IP 10.8.3.3.33996 > 99.181.96.179.1935: Flags [P.], seq 82515:83423, ack 1, win 501, options [nop,nop,TS val 3414589932 ecr 149864752], length 908
22:15:09.590459 IP 10.8.3.3.33996 > 99.181.96.179.1935: Flags [.], seq 83423:84737, ack 1, win 501, options [nop,nop,TS val 3414589972 ecr 149864752], length 1314
22:15:09.617844 IP 10.8.3.3.33996 > 99.181.96.179.1935: Flags [.], seq 84737:86051, ack 1, win 501, options [nop,nop,TS val 3414590000 ecr 149864752], length 1314
22:15:09.630281 IP 99.181.96.179.1935 > 10.8.3.3.33996: Flags [.], ack 72003, win 126, options [nop,nop,TS val 149864832 ecr 3414589508], length 0
22:15:09.660662 IP 10.8.3.3.33996 > 99.181.96.179.1935: Flags [.], seq 86051:87365, ack 1, win 501, options [nop,nop,TS val 3414590042 ecr 149864832], length 1314
22:15:09.723700 IP 10.8.3.3.33996 > 99.181.96.179.1935: Flags [.], seq 87365:88679, ack 1, win 501, options [nop,nop,TS val 3414590105 ecr 149864832], length 1314
22:15:09.729980 IP 99.181.96.179.1935 > 10.8.3.3.33996: Flags [.], ack 73317, win 126, options [nop,nop,TS val 149864931 ecr 3414589568], length 0
22:15:09.757013 IP 10.8.3.3.33996 > 99.181.96.179.1935: Flags [.], seq 88679:89993, ack 1, win 501, options [nop,nop,TS val 3414590139 ecr 149864931], length 1314
22:15:09.772836 IP 99.181.96.179.1935 > 10.8.3.3.33996: Flags [.], ack 75945, win 126, options [nop,nop,TS val 149864974 ecr 3414589639], length 0
22:15:09.790407 IP 10.8.3.3.33996 > 99.181.96.179.1935: Flags [.], seq 89993:91307, ack 1, win 501, options [nop,nop,TS val 3414590172 ecr 149864974], length 1314
22:15:09.853902 IP 10.8.3.3.33996 > 99.181.96.179.1935: Flags [.], seq 91307:92621, ack 1, win 501, options [nop,nop,TS val 3414590236 ecr 149864974], length 1314
22:15:09.858679 IP 99.181.96.179.1935 > 10.8.3.3.33996: Flags [.], ack 78573, win 126, options [nop,nop,TS val 149865060 ecr 3414589701], length 0
22:15:09.890499 IP 10.8.3.3.33996 > 99.181.96.179.1935: Flags [.], seq 92621:93935, ack 1, win 501, options [nop,nop,TS val 3414590272 ecr 149865060], length 1314
22:15:09.923838 IP 10.8.3.3.33996 > 99.181.96.179.1935: Flags [.], seq 93935:95249, ack 1, win 501, options [nop,nop,TS val 3414590306 ecr 149865060], length 1314
22:15:09.931661 IP 99.181.96.179.1935 > 10.8.3.3.33996: Flags [.], ack 81201, win 126, options [nop,nop,TS val 149865133 ecr 3414589805], length 0
22:15:09.990686 IP 10.8.3.3.33996 > 99.181.96.179.1935: Flags [.], seq 95249:96563, ack 1, win 501, options [nop,nop,TS val 3414590372 ecr 149865133], length 1314
22:15:10.022467 IP 10.8.3.3.33996 > 99.181.96.179.1935: Flags [.], seq 96563:97877, ack 1, win 501, options [nop,nop,TS val 3414590404 ecr 149865133], length 1314
22:15:10.025966 IP 99.181.96.179.1935 > 10.8.3.3.33996: Flags [.], ack 83423, win 126, options [nop,nop,TS val 149865227 ecr 3414589903], length 0
22:15:10.025987 IP 10.8.3.3.33996 > 99.181.96.179.1935: Flags [P.], seq 97877:98317, ack 1, win 501, options [nop,nop,TS val 3414590408 ecr 149865227], length 440
22:15:10.089451 IP 10.8.3.3.33996 > 99.181.96.179.1935: Flags [.], seq 98317:99631, ack 1, win 501, options [nop,nop,TS val 3414590471 ecr 149865227], length 1314
22:15:10.093658 IP 99.181.96.179.1935 > 10.8.3.3.33996: Flags [.], ack 86051, win 126, options [nop,nop,TS val 149865295 ecr 3414589972], length 0
22:15:10.121869 IP 10.8.3.3.33996 > 99.181.96.179.1935: Flags [.], seq 99631:100945, ack 1, win 501, options [nop,nop,TS val 3414590504 ecr 149865295], length 1314
22:15:10.155237 IP 10.8.3.3.33996 > 99.181.96.179.1935: Flags [.], seq 100945:102259, ack 1, win 501, options [nop,nop,TS val 3414590537 ecr 149865295], length 1314
22:15:10.199476 IP 99.181.96.179.1935 > 10.8.3.3.33996: Flags [.], ack 88679, win 126, options [nop,nop,TS val 149865401 ecr 3414590042], length 0
22:15:10.223727 IP 10.8.3.3.33996 > 99.181.96.179.1935: Flags [.], seq 102259:103573, ack 1, win 501, options [nop,nop,TS val 3414590605 ecr 149865401], length 1314
22:15:10.257281 IP 10.8.3.3.33996 > 99.181.96.179.1935: Flags [.], seq 103573:104887, ack 1, win 501, options [nop,nop,TS val 3414590639 ecr 149865401], length 1314
22:15:10.266061 IP 99.181.96.179.1935 > 10.8.3.3.33996: Flags [.], ack 91307, win 126, options [nop,nop,TS val 149865467 ecr 3414590139], length 0
22:15:10.288907 IP 10.8.3.3.33996 > 99.181.96.179.1935: Flags [.], seq 104887:106201, ack 1, win 501, options [nop,nop,TS val 3414590671 ecr 149865467], length 1314
22:15:10.355284 IP 10.8.3.3.33996 > 99.181.96.179.1935: Flags [.], seq 106201:107515, ack 1, win 501, options [nop,nop,TS val 3414590737 ecr 149865467], length 1314
22:15:10.366220 IP 99.181.96.179.1935 > 10.8.3.3.33996: Flags [.], ack 93935, win 126, options [nop,nop,TS val 149865568 ecr 3414590236], length 0
22:15:10.386529 IP 10.8.3.3.33996 > 99.181.96.179.1935: Flags [.], seq 107515:108829, ack 1, win 501, options [nop,nop,TS val 3414590768 ecr 149865568], length 1314
22:15:10.420348 IP 10.8.3.3.33996 > 99.181.96.179.1935: Flags [.], seq 108829:110143, ack 1, win 501, options [nop,nop,TS val 3414590802 ecr 149865568], length 1314
22:15:10.466525 IP 99.181.96.179.1935 > 10.8.3.3.33996: Flags [.], ack 96563, win 126, options [nop,nop,TS val 149865668 ecr 3414590306], length 0
22:15:10.490544 IP 10.8.3.3.33996 > 99.181.96.179.1935: Flags [.], seq 110143:111457, ack 1, win 501, options [nop,nop,TS val 3414590872 ecr 149865668], length 1314
22:15:10.501678 IP 99.181.96.179.1935 > 10.8.3.3.33996: Flags [.], ack 98317, win 126, options [nop,nop,TS val 149865703 ecr 3414590404], length 0
22:15:10.501692 IP 10.8.3.3.33996 > 99.181.96.179.1935: Flags [P.], seq 111457:112257, ack 1, win 501, options [nop,nop,TS val 3414590883 ecr 149865703], length 800
22:15:10.553811 IP 10.8.3.3.33996 > 99.181.96.179.1935: Flags [.], seq 112257:113571, ack 1, win 501, options [nop,nop,TS val 3414590936 ecr 149865703], length 1314
22:15:10.590621 IP 10.8.3.3.33996 > 99.181.96.179.1935: Flags [.], seq 113571:114885, ack 1, win 501, options [nop,nop,TS val 3414590972 ecr 149865703], length 1314
22:15:10.597480 IP 99.181.96.179.1935 > 10.8.3.3.33996: Flags [.], ack 100945, win 126, options [nop,nop,TS val 149865799 ecr 3414590471], length 0
22:15:10.624008 IP 10.8.3.3.33996 > 99.181.96.179.1935: Flags [.], seq 114885:116199, ack 1, win 501, options [nop,nop,TS val 3414591006 ecr 149865799], length 1314
22:15:10.687967 IP 10.8.3.3.33996 > 99.181.96.179.1935: Flags [.], seq 116199:117513, ack 1, win 501, options [nop,nop,TS val 3414591070 ecr 149865799], length 1314
22:15:10.698104 IP 99.181.96.179.1935 > 10.8.3.3.33996: Flags [.], ack 102259, win 126, options [nop,nop,TS val 149865899 ecr 3414590537], length 0
22:15:10.723555 IP 10.8.3.3.33996 > 99.181.96.179.1935: Flags [.], seq 117513:118827, ack 1, win 501, options [nop,nop,TS val 3414591105 ecr 149865899], length 1314
22:15:10.733097 IP 99.181.96.179.1935 > 10.8.3.3.33996: Flags [.], ack 104887, win 126, options [nop,nop,TS val 149865934 ecr 3414590605], length 0
22:15:10.757355 IP 10.8.3.3.33996 > 99.181.96.179.1935: Flags [.], seq 118827:120141, ack 1, win 501, options [nop,nop,TS val 3414591139 ecr 149865934], length 1314
22:15:10.823944 IP 10.8.3.3.33996 > 99.181.96.179.1935: Flags [.], seq 120141:121455, ack 1, win 501, options [nop,nop,TS val 3414591206 ecr 149865934], length 1314
22:15:10.831199 IP 99.181.96.179.1935 > 10.8.3.3.33996: Flags [.], ack 107515, win 126, options [nop,nop,TS val 149866032 ecr 3414590671], length 0
22:15:10.856870 IP 10.8.3.3.33996 > 99.181.96.179.1935: Flags [.], seq 121455:122769, ack 1, win 501, options [nop,nop,TS val 3414591239 ecr 149866032], length 1314
22:15:10.890599 IP 10.8.3.3.33996 > 99.181.96.179.1935: Flags [.], seq 122769:124083, ack 1, win 501, options [nop,nop,TS val 3414591272 ecr 149866032], length 1314
22:15:10.895975 IP 99.181.96.179.1935 > 10.8.3.3.33996: Flags [.], ack 110143, win 126, options [nop,nop,TS val 149866097 ecr 3414590768], length 0
22:15:10.955493 IP 10.8.3.3.33996 > 99.181.96.179.1935: Flags [.], seq 124083:125397, ack 1, win 501, options [nop,nop,TS val 3414591337 ecr 149866097], length 1314
22:15:10.977113 IP 99.181.96.179.1935 > 10.8.3.3.33996: Flags [.], ack 112257, win 126, options [nop,nop,TS val 149866178 ecr 3414590872], length 0
22:15:10.977135 IP 10.8.3.3.33996 > 99.181.96.179.1935: Flags [P.], seq 125397:126218, ack 1, win 501, options [nop,nop,TS val 3414591359 ecr 149866178], length 821
22:15:11.024601 IP 10.8.3.3.33996 > 99.181.96.179.1935: Flags [.], seq 126218:127532, ack 1, win 501, options [nop,nop,TS val 3414591406 ecr 149866178], length 1314
22:15:11.056959 IP 10.8.3.3.33996 > 99.181.96.179.1935: Flags [.], seq 127532:128846, ack 1, win 501, options [nop,nop,TS val 3414591439 ecr 149866178], length 1314
22:15:11.066403 IP 99.181.96.179.1935 > 10.8.3.3.33996: Flags [.], ack 114885, win 126, options [nop,nop,TS val 149866268 ecr 3414590936], length 0
22:15:11.095451 IP 10.8.3.3.33996 > 99.181.96.179.1935: Flags [.], seq 128846:130160, ack 1, win 501, options [nop,nop,TS val 3414591477 ecr 149866268], length 1314
22:15:11.155515 IP 10.8.3.3.33996 > 99.181.96.179.1935: Flags [.], seq 130160:131474, ack 1, win 501, options [nop,nop,TS val 3414591537 ecr 149866268], length 1314
22:15:11.163679 IP 99.181.96.179.1935 > 10.8.3.3.33996: Flags [.], ack 117513, win 126, options [nop,nop,TS val 149866365 ecr 3414591006], length 0
22:15:11.189295 IP 10.8.3.3.33996 > 99.181.96.179.1935: Flags [.], seq 131474:132788, ack 1, win 501, options [nop,nop,TS val 3414591571 ecr 149866365], length 1314
22:15:11.223859 IP 10.8.3.3.33996 > 99.181.96.179.1935: Flags [.], seq 132788:134102, ack 1, win 501, options [nop,nop,TS val 3414591606 ecr 149866365], length 1314
22:15:11.232980 IP 99.181.96.179.1935 > 10.8.3.3.33996: Flags [.], ack 120141, win 126, options [nop,nop,TS val 149866434 ecr 3414591105], length 0
22:15:11.290744 IP 10.8.3.3.33996 > 99.181.96.179.1935: Flags [.], seq 134102:135416, ack 1, win 501, options [nop,nop,TS val 3414591672 ecr 149866434], length 1314
22:15:11.323699 IP 10.8.3.3.33996 > 99.181.96.179.1935: Flags [.], seq 135416:136730, ack 1, win 501, options [nop,nop,TS val 3414591705 ecr 149866434], length 1314
22:15:11.332434 IP 99.181.96.179.1935 > 10.8.3.3.33996: Flags [.], ack 122769, win 126, options [nop,nop,TS val 149866534 ecr 3414591206], length 0
22:15:11.355644 IP 10.8.3.3.33996 > 99.181.96.179.1935: Flags [.], seq 136730:138044, ack 1, win 501, options [nop,nop,TS val 3414591737 ecr 149866534], length 1314
22:15:11.421853 IP 10.8.3.3.33996 > 99.181.96.179.1935: Flags [.], seq 138044:139358, ack 1, win 501, options [nop,nop,TS val 3414591804 ecr 149866534], length 1314
22:15:11.431071 IP 99.181.96.179.1935 > 10.8.3.3.33996: Flags [.], ack 125397, win 126, options [nop,nop,TS val 149866632 ecr 3414591272], length 0
22:15:11.452736 IP 99.181.96.179.1935 > 10.8.3.3.33996: Flags [.], ack 126218, win 126, options [nop,nop,TS val 149866654 ecr 3414591359], length 0
22:15:11.452769 IP 10.8.3.3.33996 > 99.181.96.179.1935: Flags [P.], seq 139358:140162, ack 1, win 501, options [nop,nop,TS val 3414591834 ecr 149866654], length 804
22:15:11.488255 IP 10.8.3.3.33996 > 99.181.96.179.1935: Flags [.], seq 140162:141476, ack 1, win 501, options [nop,nop,TS val 3414591870 ecr 149866654], length 1314
22:15:11.523003 IP 10.8.3.3.33996 > 99.181.96.179.1935: Flags [.], seq 141476:142790, ack 1, win 501, options [nop,nop,TS val 3414591905 ecr 149866654], length 1314
22:15:11.534978 IP 99.181.96.179.1935 > 10.8.3.3.33996: Flags [.], ack 128846, win 126, options [nop,nop,TS val 149866736 ecr 3414591406], length 0
22:15:11.565935 IP 10.8.3.3.33996 > 99.181.96.179.1935: Flags [.], seq 142790:144104, ack 1, win 501, options [nop,nop,TS val 3414591948 ecr 149866736], length 1314
22:15:11.622269 IP 10.8.3.3.33996 > 99.181.96.179.1935: Flags [.], seq 144104:145418, ack 1, win 501, options [nop,nop,TS val 3414592004 ecr 149866736], length 1314
22:15:11.631231 IP 99.181.96.179.1935 > 10.8.3.3.33996: Flags [.], ack 131474, win 126, options [nop,nop,TS val 149866832 ecr 3414591477], length 0
22:15:11.656892 IP 10.8.3.3.33996 > 99.181.96.179.1935: Flags [.], seq 145418:146732, ack 1, win 501, options [nop,nop,TS val 3414592039 ecr 149866832], length 1314
22:15:11.694870 IP 10.8.3.3.33996 > 99.181.96.179.1935: Flags [.], seq 146732:148046, ack 1, win 501, options [nop,nop,TS val 3414592077 ecr 149866832], length 1314
22:15:11.699571 IP 99.181.96.179.1935 > 10.8.3.3.33996: Flags [.], ack 134102, win 126, options [nop,nop,TS val 149866901 ecr 3414591571], length 0
22:15:11.755788 IP 10.8.3.3.33996 > 99.181.96.179.1935: Flags [.], seq 148046:149360, ack 1, win 501, options [nop,nop,TS val 3414592137 ecr 149866901], length 1314
22:15:11.789640 IP 10.8.3.3.33996 > 99.181.96.179.1935: Flags [.], seq 149360:150674, ack 1, win 501, options [nop,nop,TS val 3414592171 ecr 149866901], length 1314
22:15:11.799808 IP 99.181.96.179.1935 > 10.8.3.3.33996: Flags [.], ack 136730, win 126, options [nop,nop,TS val 149867001 ecr 3414591672], length 0
22:15:11.823417 IP 10.8.3.3.33996 > 99.181.96.179.1935: Flags [.], seq 150674:151988, ack 1, win 501, options [nop,nop,TS val 3414592205 ecr 149867001], length 1314
22:15:11.888658 IP 10.8.3.3.33996 > 99.181.96.179.1935: Flags [.], seq 151988:153302, ack 1, win 501, options [nop,nop,TS val 3414592270 ecr 149867001], length 1314
22:15:11.897812 IP 99.181.96.179.1935 > 10.8.3.3.33996: Flags [.], ack 139358, win 126, options [nop,nop,TS val 149867099 ecr 3414591737], length 0
22:15:11.923553 IP 10.8.3.3.33996 > 99.181.96.179.1935: Flags [.], seq 153302:154616, ack 1, win 501, options [nop,nop,TS val 3414592305 ecr 149867099], length 1314
22:15:11.928463 IP 99.181.96.179.1935 > 10.8.3.3.33996: Flags [.], ack 140162, win 126, options [nop,nop,TS val 149867130 ecr 3414591834], length 0
22:15:11.928495 IP 10.8.3.3.33996 > 99.181.96.179.1935: Flags [P.], seq 154616:154962, ack 1, win 501, options [nop,nop,TS val 3414592310 ecr 149867130], length 346
22:15:11.990562 IP 10.8.3.3.33996 > 99.181.96.179.1935: Flags [.], seq 154962:156276, ack 1, win 501, options [nop,nop,TS val 3414592372 ecr 149867130], length 1314
22:15:11.999244 IP 99.181.96.179.1935 > 10.8.3.3.33996: Flags [.], ack 142790, win 126, options [nop,nop,TS val 149867200 ecr 3414591870], length 0
22:15:12.021108 IP 10.8.3.3.33996 > 99.181.96.179.1935: Flags [.], seq 156276:157590, ack 1, win 501, options [nop,nop,TS val 3414592403 ecr 149867200], length 1314
22:15:12.055207 IP 10.8.3.3.33996 > 99.181.96.179.1935: Flags [.], seq 157590:158904, ack 1, win 501, options [nop,nop,TS val 3414592437 ecr 149867200], length 1314
22:15:12.098288 IP 99.181.96.179.1935 > 10.8.3.3.33996: Flags [.], ack 145418, win 126, options [nop,nop,TS val 149867299 ecr 3414591948], length 0
22:15:12.122714 IP 10.8.3.3.33996 > 99.181.96.179.1935: Flags [.], seq 158904:160218, ack 1, win 501, options [nop,nop,TS val 3414592504 ecr 149867299], length 1314
22:15:12.153219 IP 10.8.3.3.33996 > 99.181.96.179.1935: Flags [.], seq 160218:161532, ack 1, win 501, options [nop,nop,TS val 3414592535 ecr 149867299], length 1314
22:15:12.170629 IP 99.181.96.179.1935 > 10.8.3.3.33996: Flags [.], ack 148046, win 126, options [nop,nop,TS val 149867372 ecr 3414592039], length 0
22:15:12.188360 IP 10.8.3.3.33996 > 99.181.96.179.1935: Flags [.], seq 161532:162846, ack 1, win 501, options [nop,nop,TS val 3414592570 ecr 149867372], length 1314
22:15:12.255744 IP 10.8.3.3.33996 > 99.181.96.179.1935: Flags [.], seq 162846:164160, ack 1, win 501, options [nop,nop,TS val 3414592637 ecr 149867372], length 1314
22:15:12.265217 IP 99.181.96.179.1935 > 10.8.3.3.33996: Flags [.], ack 150674, win 126, options [nop,nop,TS val 149867466 ecr 3414592137], length 0
22:15:12.289151 IP 10.8.3.3.33996 > 99.181.96.179.1935: Flags [.], seq 164160:165474, ack 1, win 501, options [nop,nop,TS val 3414592671 ecr 149867466], length 1314
22:15:12.322409 IP 10.8.3.3.33996 > 99.181.96.179.1935: Flags [.], seq 165474:166788, ack 1, win 501, options [nop,nop,TS val 3414592704 ecr 149867466], length 1314
22:15:12.364258 IP 99.181.96.179.1935 > 10.8.3.3.33996: Flags [.], ack 153302, win 126, options [nop,nop,TS val 149867565 ecr 3414592205], length 0
22:15:12.389259 IP 10.8.3.3.33996 > 99.181.96.179.1935: Flags [.], seq 166788:168102, ack 1, win 501, options [nop,nop,TS val 3414592771 ecr 149867565], length 1314
22:15:12.404085 IP 99.181.96.179.1935 > 10.8.3.3.33996: Flags [.], ack 154962, win 126, options [nop,nop,TS val 149867605 ecr 3414592305], length 0
22:15:12.404116 IP 10.8.3.3.33996 > 99.181.96.179.1935: Flags [P.], seq 168102:169004, ack 1, win 501, options [nop,nop,TS val 3414592786 ecr 149867605], length 902
22:15:12.455890 IP 10.8.3.3.33996 > 99.181.96.179.1935: Flags [.], seq 169004:170318, ack 1, win 501, options [nop,nop,TS val 3414592838 ecr 149867605], length 1314
22:15:12.489360 IP 10.8.3.3.33996 > 99.181.96.179.1935: Flags [.], seq 170318:171632, ack 1, win 501, options [nop,nop,TS val 3414592871 ecr 149867605], length 1314
22:15:12.496847 IP 99.181.96.179.1935 > 10.8.3.3.33996: Flags [.], ack 157590, win 126, options [nop,nop,TS val 149867698 ecr 3414592372], length 0
22:15:12.528853 IP 10.8.3.3.33996 > 99.181.96.179.1935: Flags [.], seq 171632:172946, ack 1, win 501, options [nop,nop,TS val 3414592911 ecr 149867698], length 1314
22:15:12.590037 IP 10.8.3.3.33996 > 99.181.96.179.1935: Flags [.], seq 172946:174260, ack 1, win 501, options [nop,nop,TS val 3414592972 ecr 149867698], length 1314
22:15:12.598062 IP 99.181.96.179.1935 > 10.8.3.3.33996: Flags [.], ack 158904, win 126, options [nop,nop,TS val 149867799 ecr 3414592437], length 0
22:15:12.624120 IP 10.8.3.3.33996 > 99.181.96.179.1935: Flags [.], seq 174260:175574, ack 1, win 501, options [nop,nop,TS val 3414593006 ecr 149867799], length 1314
22:15:12.628682 IP 99.181.96.179.1935 > 10.8.3.3.33996: Flags [.], ack 161532, win 126, options [nop,nop,TS val 149867830 ecr 3414592504], length 0
22:15:12.656888 IP 10.8.3.3.33996 > 99.181.96.179.1935: Flags [.], seq 175574:176888, ack 1, win 501, options [nop,nop,TS val 3414593039 ecr 149867830], length 1314
22:15:12.723853 IP 10.8.3.3.33996 > 99.181.96.179.1935: Flags [.], seq 176888:178202, ack 1, win 501, options [nop,nop,TS val 3414593106 ecr 149867830], length 1314
22:15:12.731477 IP 99.181.96.179.1935 > 10.8.3.3.33996: Flags [.], ack 164160, win 126, options [nop,nop,TS val 149867933 ecr 3414592570], length 0
22:15:12.757339 IP 10.8.3.3.33996 > 99.181.96.179.1935: Flags [.], seq 178202:179516, ack 1, win 501, options [nop,nop,TS val 3414593139 ecr 149867933], length 1314
22:15:12.786411 IP 10.8.3.3.33996 > 99.181.96.179.1935: Flags [.], seq 179516:180830, ack 1, win 501, options [nop,nop,TS val 3414593168 ecr 149867933], length 1314
22:15:12.798246 IP 99.181.96.179.1935 > 10.8.3.3.33996: Flags [.], ack 166788, win 126, options [nop,nop,TS val 149867999 ecr 3414592671], length 0
22:15:12.854988 IP 10.8.3.3.33996 > 99.181.96.179.1935: Flags [.], seq 180830:182144, ack 1, win 501, options [nop,nop,TS val 3414593237 ecr 149867999], length 1314
22:15:12.879936 IP 99.181.96.179.1935 > 10.8.3.3.33996: Flags [.], ack 169004, win 126, options [nop,nop,TS val 149868081 ecr 3414592771], length 0
22:15:12.879968 IP 10.8.3.3.33996 > 99.181.96.179.1935: Flags [P.], seq 182144:182949, ack 1, win 501, options [nop,nop,TS val 3414593262 ecr 149868081], length 805
22:15:12.923767 IP 10.8.3.3.33996 > 99.181.96.179.1935: Flags [.], seq 182949:184263, ack 1, win 501, options [nop,nop,TS val 3414593305 ecr 149868081], length 1314
22:15:12.956117 IP 10.8.3.3.33996 > 99.181.96.179.1935: Flags [.], seq 184263:185577, ack 1, win 501, options [nop,nop,TS val 3414593338 ecr 149868081], length 1314
22:15:12.965009 IP 99.181.96.179.1935 > 10.8.3.3.33996: Flags [.], ack 171632, win 126, options [nop,nop,TS val 149868166 ecr 3414592838], length 0
22:15:12.998969 IP 10.8.3.3.33996 > 99.181.96.179.1935: Flags [.], seq 185577:186891, ack 1, win 501, options [nop,nop,TS val 3414593381 ecr 149868166], length 1314
22:15:13.056562 IP 10.8.3.3.33996 > 99.181.96.179.1935: Flags [.], seq 186891:188205, ack 1, win 501, options [nop,nop,TS val 3414593438 ecr 149868166], length 1314
22:15:13.065936 IP 99.181.96.179.1935 > 10.8.3.3.33996: Flags [.], ack 174260, win 126, options [nop,nop,TS val 149868267 ecr 3414592911], length 0
22:15:13.090082 IP 10.8.3.3.33996 > 99.181.96.179.1935: Flags [.], seq 188205:189519, ack 1, win 501, options [nop,nop,TS val 3414593472 ecr 149868267], length 1314
22:15:13.127255 IP 10.8.3.3.33996 > 99.181.96.179.1935: Flags [.], seq 189519:190833, ack 1, win 501, options [nop,nop,TS val 3414593509 ecr 149868267], length 1314
22:15:13.132518 IP 99.181.96.179.1935 > 10.8.3.3.33996: Flags [.], ack 176888, win 126, options [nop,nop,TS val 149868334 ecr 3414593006], length 0
22:15:13.191622 IP 10.8.3.3.33996 > 99.181.96.179.1935: Flags [.], seq 190833:192147, ack 1, win 501, options [nop,nop,TS val 3414593573 ecr 149868334], length 1314
22:15:13.221257 IP 10.8.3.3.33996 > 99.181.96.179.1935: Flags [.], seq 192147:193461, ack 1, win 501, options [nop,nop,TS val 3414593603 ecr 149868334], length 1314
22:15:13.233322 IP 99.181.96.179.1935 > 10.8.3.3.33996: Flags [.], ack 179516, win 126, options [nop,nop,TS val 149868434 ecr 3414593106], length 0
22:15:13.255600 IP 10.8.3.3.33996 > 99.181.96.179.1935: Flags [.], seq 193461:194775, ack 1, win 501, options [nop,nop,TS val 3414593637 ecr 149868434], length 1314
22:15:13.323689 IP 10.8.3.3.33996 > 99.181.96.179.1935: Flags [.], seq 194775:196089, ack 1, win 501, options [nop,nop,TS val 3414593705 ecr 149868434], length 1314
22:15:13.331108 IP 99.181.96.179.1935 > 10.8.3.3.33996: Flags [.], ack 182144, win 126, options [nop,nop,TS val 149868532 ecr 3414593168], length 0
22:15:13.354705 IP 10.8.3.3.33996 > 99.181.96.179.1935: Flags [.], seq 196089:197403, ack 1, win 501, options [nop,nop,TS val 3414593736 ecr 149868532], length 1314
22:15:13.355504 IP 99.181.96.179.1935 > 10.8.3.3.33996: Flags [.], ack 182949, win 126, options [nop,nop,TS val 149868557 ecr 3414593262], length 0
22:15:13.355521 IP 10.8.3.3.33996 > 99.181.96.179.1935: Flags [P.], seq 197403:197757, ack 1, win 501, options [nop,nop,TS val 3414593737 ecr 149868557], length 354
22:15:13.427103 IP 10.8.3.3.33996 > 99.181.96.179.1935: Flags [.], seq 197757:199071, ack 1, win 501, options [nop,nop,TS val 3414593809 ecr 149868557], length 1314
22:15:13.431719 IP 99.181.96.179.1935 > 10.8.3.3.33996: Flags [.], ack 185577, win 126, options [nop,nop,TS val 149868633 ecr 3414593305], length 0
22:15:13.457460 IP 10.8.3.3.33996 > 99.181.96.179.1935: Flags [.], seq 199071:200385, ack 1, win 501, options [nop,nop,TS val 3414593839 ecr 149868633], length 1314
22:15:13.491101 IP 10.8.3.3.33996 > 99.181.96.179.1935: Flags [.], seq 200385:201699, ack 1, win 501, options [nop,nop,TS val 3414593873 ecr 149868633], length 1314
22:15:13.532286 IP 99.181.96.179.1935 > 10.8.3.3.33996: Flags [.], ack 188205, win 126, options [nop,nop,TS val 149868733 ecr 3414593381], length 0
22:15:13.557168 IP 10.8.3.3.33996 > 99.181.96.179.1935: Flags [.], seq 201699:203013, ack 1, win 501, options [nop,nop,TS val 3414593939 ecr 149868733], length 1314
22:15:13.590396 IP 10.8.3.3.33996 > 99.181.96.179.1935: Flags [.], seq 203013:204327, ack 1, win 501, options [nop,nop,TS val 3414593972 ecr 149868733], length 1314
22:15:13.602964 IP 99.181.96.179.1935 > 10.8.3.3.33996: Flags [.], ack 190833, win 126, options [nop,nop,TS val 149868804 ecr 3414593472], length 0
22:15:13.622467 IP 10.8.3.3.33996 > 99.181.96.179.1935: Flags [.], seq 204327:205641, ack 1, win 501, options [nop,nop,TS val 3414594004 ecr 149868804], length 1314
22:15:13.690909 IP 10.8.3.3.33996 > 99.181.96.179.1935: Flags [.], seq 205641:206955, ack 1, win 501, options [nop,nop,TS val 3414594073 ecr 149868804], length 1314
22:15:13.696960 IP 99.181.96.179.1935 > 10.8.3.3.33996: Flags [.], ack 193461, win 126, options [nop,nop,TS val 149868898 ecr 3414593573], length 0
22:15:13.727099 IP 10.8.3.3.33996 > 99.181.96.179.1935: Flags [.], seq 206955:208269, ack 1, win 501, options [nop,nop,TS val 3414594109 ecr 149868898], length 1314
