01:42:33.726709 IP 10.8.0.2.57458 > 52.223.197.117.1935: Flags [.], seq 2872565330:2872566644, ack 1185146336, win 501, options [nop,nop,TS val 1301796726 ecr 694644847], length 1314
01:42:33.749122 IP 52.223.197.117.1935 > 10.8.0.2.57458: Flags [.], ack 4294958516, win 126, options [nop,nop,TS val 694644942 ecr 1301796355], length 0
01:42:33.772961 IP 10.8.0.2.57458 > 52.223.197.117.1935: Flags [.], seq 1314:2628, ack 1, win 501, options [nop,nop,TS val 1301796772 ecr 694644942], length 1314
01:42:33.825581 IP 10.8.0.2.57458 > 52.223.197.117.1935: Flags [.], seq 2628:3942, ack 1, win 501, options [nop,nop,TS val 1301796825 ecr 694644942], length 1314
01:42:33.850033 IP 52.223.197.117.1935 > 10.8.0.2.57458: Flags [.], ack 4294961144, win 126, options [nop,nop,TS val 694645043 ecr 1301796426], length 0
01:42:33.859592 IP 10.8.0.2.57458 > 52.223.197.117.1935: Flags [.], seq 3942:5256, ack 1, win 501, options [nop,nop,TS val 1301796859 ecr 694645043], length 1314
01:42:33.901392 IP 10.8.0.2.57458 > 52.223.197.117.1935: Flags [.], seq 5256:6570, ack 1, win 501, options [nop,nop,TS val 1301796900 ecr 694645043], length 1314
01:42:33.914517 IP 52.223.197.117.1935 > 10.8.0.2.57458: Flags [.], ack 4294963772, win 126, options [nop,nop,TS val 694645108 ecr 1301796523], length 0
01:42:33.956551 IP 10.8.0.2.57458 > 52.223.197.117.1935: Flags [.], seq 6570:7884, ack 1, win 501, options [nop,nop,TS val 1301796956 ecr 694645108], length 1314
01:42:33.992914 IP 10.8.0.2.57458 > 52.223.197.117.1935: Flags [.], seq 7884:9198, ack 1, win 501, options [nop,nop,TS val 1301796992 ecr 694645108], length 1314
01:42:34.009779 IP 52.223.197.117.1935 > 10.8.0.2.57458: Flags [.], ack 4294965982, win 126, options [nop,nop,TS val 694645203 ecr 1301796626], length 0
01:42:34.009815 IP 10.8.0.2.57458 > 52.223.197.117.1935: Flags [P.], seq 9198:9617, ack 1, win 501, options [nop,nop,TS val 1301797009 ecr 694645203], length 419
01:42:34.056493 IP 10.8.0.2.57458 > 52.223.197.117.1935: Flags [.], seq 9617:10931, ack 1, win 501, options [nop,nop,TS val 1301797055 ecr 694645203], length 1314
01:42:34.083611 IP 52.223.197.117.1935 > 10.8.0.2.57458: Flags [.], ack 1314, win 126, options [nop,nop,TS val 694645277 ecr 1301796691], length 0
01:42:34.090994 IP 10.8.0.2.57458 > 52.223.197.117.1935: Flags [.], seq 10931:12245, ack 1, win 501, options [nop,nop,TS val 1301797090 ecr 694645277], length 1314
01:42:34.136421 IP 10.8.0.2.57458 > 52.223.197.117.1935: Flags [.], seq 12245:13559, ack 1, win 501, options [nop,nop,TS val 1301797135 ecr 694645277], length 1314
01:42:34.182465 IP 52.223.197.117.1935 > 10.8.0.2.57458: Flags [.], ack 3942, win 126, options [nop,nop,TS val 694645376 ecr 1301796772], length 0
01:42:34.190241 IP 10.8.0.2.57458 > 52.223.197.117.1935: Flags [.], seq 13559:14873, ack 1, win 501, options [nop,nop,TS val 1301797189 ecr 694645376], length 1314
01:42:34.224020 IP 10.8.0.2.57458 > 52.223.197.117.1935: Flags [.], seq 14873:16187, ack 1, win 501, options [nop,nop,TS val 1301797223 ecr 694645376], length 1314
01:42:34.258155 IP 52.223.197.117.1935 > 10.8.0.2.57458: Flags [.], ack 6570, win 126, options [nop,nop,TS val 694645452 ecr 1301796859], length 0
01:42:34.264951 IP 10.8.0.2.57458 > 52.223.197.117.1935: Flags [.], seq 16187:17501, ack 1, win 501, options [nop,nop,TS val 1301797264 ecr 694645452], length 1314
01:42:34.324847 IP 10.8.0.2.57458 > 52.223.197.117.1935: Flags [.], seq 17501:18815, ack 1, win 501, options [nop,nop,TS val 1301797324 ecr 694645452], length 1314
01:42:34.349666 IP 52.223.197.117.1935 > 10.8.0.2.57458: Flags [.], ack 9198, win 126, options [nop,nop,TS val 694645543 ecr 1301796956], length 0
01:42:34.359695 IP 10.8.0.2.57458 > 52.223.197.117.1935: Flags [.], seq 18815:20129, ack 1, win 501, options [nop,nop,TS val 1301797359 ecr 694645543], length 1314
01:42:34.366339 IP 52.223.197.117.1935 > 10.8.0.2.57458: Flags [.], ack 9617, win 126, options [nop,nop,TS val 694645560 ecr 1301797009], length 0
01:42:34.366370 IP 10.8.0.2.57458 > 52.223.197.117.1935: Flags [P.], seq 20129:20455, ack 1, win 501, options [nop,nop,TS val 1301797365 ecr 694645560], length 326
01:42:34.426809 IP 10.8.0.2.57458 > 52.223.197.117.1935: Flags [.], seq 20455:21769, ack 1, win 501, options [nop,nop,TS val 1301797426 ecr 694645560], length 1314
01:42:34.447666 IP 52.223.197.117.1935 > 10.8.0.2.57458: Flags [.], ack 12245, win 126, options [nop,nop,TS val 694645641 ecr 1301797055], length 0
01:42:34.457704 IP 10.8.0.2.57458 > 52.223.197.117.1935: Flags [.], seq 21769:23083, ack 1, win 501, options [nop,nop,TS val 1301797457 ecr 694645641], length 1314
01:42:34.492469 IP 10.8.0.2.57458 > 52.223.197.117.1935: Flags [.], seq 23083:24397, ack 1, win 501, options [nop,nop,TS val 1301797491 ecr 694645641], length 1314
01:42:34.547058 IP 52.223.197.117.1935 > 10.8.0.2.57458: Flags [.], ack 14873, win 126, options [nop,nop,TS val 694645740 ecr 1301797135], length 0
01:42:34.558089 IP 10.8.0.2.57458 > 52.223.197.117.1935: Flags [.], seq 24397:25711, ack 1, win 501, options [nop,nop,TS val 1301797557 ecr 694645740], length 1314
01:42:34.590662 IP 10.8.0.2.57458 > 52.223.197.117.1935: Flags [.], seq 25711:27025, ack 1, win 501, options [nop,nop,TS val 1301797590 ecr 694645740], length 1314
01:42:34.621729 IP 52.223.197.117.1935 > 10.8.0.2.57458: Flags [.], ack 17501, win 126, options [nop,nop,TS val 694645815 ecr 1301797223], length 0
01:42:34.625222 IP 10.8.0.2.57458 > 52.223.197.117.1935: Flags [.], seq 27025:28339, ack 1, win 501, options [nop,nop,TS val 1301797624 ecr 694645815], length 1314
01:42:34.693225 IP 10.8.0.2.57458 > 52.223.197.117.1935: Flags [.], seq 28339:29653, ack 1, win 501, options [nop,nop,TS val 1301797692 ecr 694645815], length 1314
01:42:34.716447 IP 52.223.197.117.1935 > 10.8.0.2.57458: Flags [.], ack 20129, win 126, options [nop,nop,TS val 694645910 ecr 1301797324], length 0
01:42:34.723171 IP 52.223.197.117.1935 > 10.8.0.2.57458: Flags [.], ack 20455, win 126, options [nop,nop,TS val 694645916 ecr 1301797365], length 0
01:42:34.723233 IP 10.8.0.2.57458 > 52.223.197.117.1935: Flags [P.], seq 29653:30545, ack 1, win 501, options [nop,nop,TS val 1301797722 ecr 694645916], length 892
01:42:34.759792 IP 10.8.0.2.57458 > 52.223.197.117.1935: Flags [.], seq 30545:31859, ack 1, win 501, options [nop,nop,TS val 1301797759 ecr 694645916], length 1314
01:42:34.793624 IP 10.8.0.2.57458 > 52.223.197.117.1935: Flags [.], seq 31859:33173, ack 1, win 501, options [nop,nop,TS val 1301797793 ecr 694645916], length 1314
01:42:34.814437 IP 52.223.197.117.1935 > 10.8.0.2.57458: Flags [.], ack 23083, win 126, options [nop,nop,TS val 694646008 ecr 1301797426], length 0
01:42:34.843123 IP 10.8.0.2.57458 > 52.223.197.117.1935: Flags [.], seq 33173:34487, ack 1, win 501, options [nop,nop,TS val 1301797842 ecr 694646008], length 1314
01:42:34.891830 IP 10.8.0.2.57458 > 52.223.197.117.1935: Flags [.], seq 34487:35801, ack 1, win 501, options [nop,nop,TS val 1301797891 ecr 694646008], length 1314
01:42:34.915576 IP 52.223.197.117.1935 > 10.8.0.2.57458: Flags [.], ack 25711, win 126, options [nop,nop,TS val 694646109 ecr 1301797491], length 0
01:42:34.928621 IP 10.8.0.2.57458 > 52.223.197.117.1935: Flags [.], seq 35801:37115, ack 1, win 501, options [nop,nop,TS val 1301797928 ecr 694646109], length 1314
01:42:34.971604 IP 10.8.0.2.57458 > 52.223.197.117.1935: Flags [.], seq 37115:38429, ack 1, win 501, options [nop,nop,TS val 1301797971 ecr 694646109], length 1314
01:42:34.981982 IP 52.223.197.117.1935 > 10.8.0.2.57458: Flags [.], ack 28339, win 126, options [nop,nop,TS val 694646176 ecr 1301797590], length 0
01:42:35.025425 IP 10.8.0.2.57458 > 52.223.197.117.1935: Flags [.], seq 38429:39743, ack 1, win 501, options [nop,nop,TS val 1301798024 ecr 694646176], length 1314
01:42:35.059744 IP 10.8.0.2.57458 > 52.223.197.117.1935: Flags [.], seq 39743:41057, ack 1, win 501, options [nop,nop,TS val 1301798059 ecr 694646176], length 1314
01:42:35.079747 IP 52.223.197.117.1935 > 10.8.0.2.57458: Flags [.], ack 30545, win 126, options [nop,nop,TS val 694646273 ecr 1301797692], length 0
01:42:35.079782 IP 10.8.0.2.57458 > 52.223.197.117.1935: Flags [P.], seq 41057:41474, ack 1, win 501, options [nop,nop,TS val 1301798079 ecr 694646273], length 417
01:42:35.126503 IP 10.8.0.2.57458 > 52.223.197.117.1935: Flags [.], seq 41474:42788, ack 1, win 501, options [nop,nop,TS val 1301798125 ecr 694646273], length 1314
01:42:35.151559 IP 52.223.197.117.1935 > 10.8.0.2.57458: Flags [.], ack 33173, win 126, options [nop,nop,TS val 694646344 ecr 1301797759], length 0
01:42:35.159720 IP 10.8.0.2.57458 > 52.223.197.117.1935: Flags [.], seq 42788:44102, ack 1, win 501, options [nop,nop,TS val 1301798159 ecr 694646344], length 1314
01:42:35.207438 IP 10.8.0.2.57458 > 52.223.197.117.1935: Flags [.], seq 44102:45416, ack 1, win 501, options [nop,nop,TS val 1301798206 ecr 694646344], length 1314
01:42:35.248912 IP 52.223.197.117.1935 > 10.8.0.2.57458: Flags [.], ack 35801, win 126, options [nop,nop,TS val 694646442 ecr 1301797842], length 0
01:42:35.255774 IP 10.8.0.2.57458 > 52.223.197.117.1935: Flags [.], seq 45416:46730, ack 1, win 501, options [nop,nop,TS val 1301798255 ecr 694646442], length 1314
01:42:35.292287 IP 10.8.0.2.57458 > 52.223.197.117.1935: Flags [.], seq 46730:48044, ack 1, win 501, options [nop,nop,TS val 1301798291 ecr 694646442], length 1314
01:42:35.328529 IP 52.223.197.117.1935 > 10.8.0.2.57458: Flags [.], ack 38429, win 126, options [nop,nop,TS val 694646522 ecr 1301797928], length 0
01:42:35.334910 IP 10.8.0.2.57458 > 52.223.197.117.1935: Flags [.], seq 48044:49358, ack 1, win 501, options [nop,nop,TS val 1301798334 ecr 694646522], length 1314
01:42:35.390420 IP 10.8.0.2.57458 > 52.223.197.117.1935: Flags [.], seq 49358:50672, ack 1, win 501, options [nop,nop,TS val 1301798389 ecr 694646522], length 1314
01:42:35.416732 IP 52.223.197.117.1935 > 10.8.0.2.57458: Flags [.], ack 41057, win 126, options [nop,nop,TS val 694646610 ecr 1301798024], length 0
01:42:35.426157 IP 10.8.0.2.57458 > 52.223.197.117.1935: Flags [.], seq 50672:51986, ack 1, win 501, options [nop,nop,TS val 1301798425 ecr 694646610], length 1314
01:42:35.436323 IP 52.223.197.117.1935 > 10.8.0.2.57458: Flags [.], ack 41474, win 126, options [nop,nop,TS val 694646630 ecr 1301798079], length 0
01:42:35.436356 IP 10.8.0.2.57458 > 52.223.197.117.1935: Flags [P.], seq 51986:52320, ack 1, win 501, options [nop,nop,TS val 1301798435 ecr 694646630], length 334
01:42:35.488741 IP 10.8.0.2.57458 > 52.223.197.117.1935: Flags [.], seq 52320:53634, ack 1, win 501, options [nop,nop,TS val 1301798488 ecr 694646630], length 1314
01:42:35.516447 IP 52.223.197.117.1935 > 10.8.0.2.57458: Flags [.], ack 44102, win 126, options [nop,nop,TS val 694646710 ecr 1301798125], length 0
01:42:35.526576 IP 10.8.0.2.57458 > 52.223.197.117.1935: Flags [.], seq 53634:54948, ack 1, win 501, options [nop,nop,TS val 1301798526 ecr 694646710], length 1314
01:42:35.559184 IP 10.8.0.2.57458 > 52.223.197.117.1935: Flags [.], seq 54948:56262, ack 1, win 501, options [nop,nop,TS val 1301798558 ecr 694646710], length 1314
01:42:35.615241 IP 52.223.197.117.1935 > 10.8.0.2.57458: Flags [.], ack 46730, win 126, options [nop,nop,TS val 694646809 ecr 1301798206], length 0
01:42:35.622576 IP 10.8.0.2.57458 > 52.223.197.117.1935: Flags [.], seq 56262:57576, ack 1, win 501, options [nop,nop,TS val 1301798622 ecr 694646809], length 1314
01:42:35.659127 IP 10.8.0.2.57458 > 52.223.197.117.1935: Flags [.], seq 57576:58890, ack 1, win 501, options [nop,nop,TS val 1301798658 ecr 694646809], length 1314
01:42:35.692368 IP 52.223.197.117.1935 > 10.8.0.2.57458: Flags [.], ack 49358, win 126, options [nop,nop,TS val 694646885 ecr 1301798291], length 0
01:42:35.693346 IP 10.8.0.2.57458 > 52.223.197.117.1935: Flags [.], seq 58890:60204, ack 1, win 501, options [nop,nop,TS val 1301798692 ecr 694646885], length 1314
01:42:35.760893 IP 10.8.0.2.57458 > 52.223.197.117.1935: Flags [.], seq 60204:61518, ack 1, win 501, options [nop,nop,TS val 1301798760 ecr 694646885], length 1314
01:42:35.783129 IP 52.223.197.117.1935 > 10.8.0.2.57458: Flags [.], ack 51986, win 126, options [nop,nop,TS val 694646977 ecr 1301798389], length 0
01:42:35.790654 IP 10.8.0.2.57458 > 52.223.197.117.1935: Flags [.], seq 61518:62832, ack 1, win 501, options [nop,nop,TS val 1301798790 ecr 694646977], length 1314
01:42:35.793108 IP 52.223.197.117.1935 > 10.8.0.2.57458: Flags [.], ack 52320, win 126, options [nop,nop,TS val 694646986 ecr 1301798435], length 0
01:42:35.793125 IP 10.8.0.2.57458 > 52.223.197.117.1935: Flags [P.], seq 62832:63242, ack 1, win 501, options [nop,nop,TS val 1301798792 ecr 694646986], length 410
01:42:35.859969 IP 10.8.0.2.57458 > 52.223.197.117.1935: Flags [.], seq 63242:64556, ack 1, win 501, options [nop,nop,TS val 1301798859 ecr 694646986], length 1314
01:42:35.883482 IP 52.223.197.117.1935 > 10.8.0.2.57458: Flags [.], ack 54948, win 126, options [nop,nop,TS val 694647077 ecr 1301798488], length 0
01:42:35.889213 IP 10.8.0.2.57458 > 52.223.197.117.1935: Flags [.], seq 64556:65870, ack 1, win 501, options [nop,nop,TS val 1301798888 ecr 694647077], length 1314
01:42:35.922898 IP 10.8.0.2.57458 > 52.223.197.117.1935: Flags [.], seq 65870:67184, ack 1, win 501, options [nop,nop,TS val 1301798922 ecr 694647077], length 1314
01:42:35.979404 IP 52.223.197.117.1935 > 10.8.0.2.57458: Flags [.], ack 57576, win 126, options [nop,nop,TS val 694647173 ecr 1301798558], length 0
01:42:35.996070 IP 10.8.0.2.57458 > 52.223.197.117.1935: Flags [.], seq 67184:68498, ack 1, win 501, options [nop,nop,TS val 1301798995 ecr 694647173], length 1314
01:42:36.027364 IP 10.8.0.2.57458 > 52.223.197.117.1935: Flags [.], seq 68498:69812, ack 1, win 501, options [nop,nop,TS val 1301799026 ecr 694647173], length 1314
01:42:36.050308 IP 52.223.197.117.1935 > 10.8.0.2.57458: Flags [.], ack 60204, win 126, options [nop,nop,TS val 694647244 ecr 1301798658], length 0
01:42:36.060299 IP 10.8.0.2.57458 > 52.223.197.117.1935: Flags [.], seq 69812:71126, ack 1, win 501, options [nop,nop,TS val 1301799059 ecr 694647244], length 1314
01:42:36.126918 IP 10.8.0.2.57458 > 52.223.197.117.1935: Flags [.], seq 71126:72440, ack 1, win 501, options [nop,nop,TS val 1301799126 ecr 694647244], length 1314
01:42:36.147615 IP 52.223.197.117.1935 > 10.8.0.2.57458: Flags [.], ack 62832, win 126, options [nop,nop,TS val 694647341 ecr 1301798760], length 0
01:42:36.149939 IP 52.223.197.117.1935 > 10.8.0.2.57458: Flags [.], ack 63242, win 126, options [nop,nop,TS val 694647343 ecr 1301798792], length 0
01:42:36.149972 IP 10.8.0.2.57458 > 52.223.197.117.1935: Flags [P.], seq 72440:73336, ack 1, win 501, options [nop,nop,TS val 1301799149 ecr 694647343], length 896
01:42:36.193242 IP 10.8.0.2.57458 > 52.223.197.117.1935: Flags [.], seq 73336:74650, ack 1, win 501, options [nop,nop,TS val 1301799192 ecr 694647343], length 1314
01:42:36.226791 IP 10.8.0.2.57458 > 52.223.197.117.1935: Flags [.], seq 74650:75964, ack 1, win 501, options [nop,nop,TS val 1301799226 ecr 694647343], length 1314
01:42:36.245949 IP 52.223.197.117.1935 > 10.8.0.2.57458: Flags [.], ack 65870, win 126, options [nop,nop,TS val 694647439 ecr 1301798859], length 0
01:42:36.274928 IP 10.8.0.2.57458 > 52.223.197.117.1935: Flags [.], seq 75964:77278, ack 1, win 501, options [nop,nop,TS val 1301799274 ecr 694647439], length 1314
01:42:36.324843 IP 10.8.0.2.57458 > 52.223.197.117.1935: Flags [.], seq 77278:78592, ack 1, win 501, options [nop,nop,TS val 1301799324 ecr 694647439], length 1314
01:42:36.341240 IP 52.223.197.117.1935 > 10.8.0.2.57458: Flags [.], ack 67184, win 126, options [nop,nop,TS val 694647534 ecr 1301798922], length 0
01:42:36.360430 IP 10.8.0.2.57458 > 52.223.197.117.1935: Flags [.], seq 78592:79906, ack 1, win 501, options [nop,nop,TS val 1301799359 ecr 694647534], length 1314
01:42:36.384410 IP 52.223.197.117.1935 > 10.8.0.2.57458: Flags [.], ack 69812, win 126, options [nop,nop,TS val 694647578 ecr 1301798995], length 0
01:42:36.403461 IP 10.8.0.2.57458 > 52.223.197.117.1935: Flags [.], seq 79906:81220, ack 1, win 501, options [nop,nop,TS val 1301799402 ecr 694647578], length 1314
01:42:36.459849 IP 10.8.0.2.57458 > 52.223.197.117.1935: Flags [.], seq 81220:82534, ack 1, win 501, options [nop,nop,TS val 1301799459 ecr 694647578], length 1314
01:42:36.483947 IP 52.223.197.117.1935 > 10.8.0.2.57458: Flags [.], ack 72440, win 126, options [nop,nop,TS val 694647677 ecr 1301799059], length 0
01:42:36.493083 IP 10.8.0.2.57458 > 52.223.197.117.1935: Flags [.], seq 82534:83848, ack 1, win 501, options [nop,nop,TS val 1301799492 ecr 694647677], length 1314
01:42:36.506780 IP 52.223.197.117.1935 > 10.8.0.2.57458: Flags [.], ack 73336, win 126, options [nop,nop,TS val 694647700 ecr 1301799149], length 0
01:42:36.506812 IP 10.8.0.2.57458 > 52.223.197.117.1935: Flags [P.], seq 83848:84166, ack 1, win 501, options [nop,nop,TS val 1301799506 ecr 694647700], length 318
01:42:36.560104 IP 10.8.0.2.57458 > 52.223.197.117.1935: Flags [.], seq 84166:85480, ack 1, win 501, options [nop,nop,TS val 1301799559 ecr 694647700], length 1314
01:42:36.583748 IP 52.223.197.117.1935 > 10.8.0.2.57458: Flags [.], ack 75964, win 126, options [nop,nop,TS val 694647777 ecr 1301799192], length 0
01:42:36.591448 IP 10.8.0.2.57458 > 52.223.197.117.1935: Flags [.], seq 85480:86794, ack 1, win 501, options [nop,nop,TS val 1301799590 ecr 694647777], length 1314
01:42:36.618187 IP 10.8.0.2.57458 > 52.223.197.117.1935: Flags [.], seq 86794:88108, ack 1, win 501, options [nop,nop,TS val 1301799617 ecr 694647777], length 1314
01:42:36.681917 IP 52.223.197.117.1935 > 10.8.0.2.57458: Flags [.], ack 78592, win 126, options [nop,nop,TS val 694647875 ecr 1301799274], length 0
01:42:36.681967 IP 10.8.0.2.57458 > 52.223.197.117.1935: Flags [.], seq 88108:89422, ack 1, win 501, options [nop,nop,TS val 1301799681 ecr 694647875], length 1314
01:42:36.722845 IP 10.8.0.2.57458 > 52.223.197.117.1935: Flags [.], seq 89422:90736, ack 1, win 501, options [nop,nop,TS val 1301799722 ecr 694647875], length 1314
01:42:36.745876 IP 10.8.0.2.57458 > 52.223.197.117.1935: Flags [.], seq 90736:92050, ack 1, win 501, options [nop,nop,TS val 1301799745 ecr 694647875], length 1314
01:42:36.760357 IP 52.223.197.117.1935 > 10.8.0.2.57458: Flags [.], ack 81220, win 126, options [nop,nop,TS val 694647954 ecr 1301799359], length 0
01:42:36.826596 IP 10.8.0.2.57458 > 52.223.197.117.1935: Flags [.], seq 92050:93364, ack 1, win 501, options [nop,nop,TS val 1301799826 ecr 694647954], length 1314
01:42:36.849952 IP 52.223.197.117.1935 > 10.8.0.2.57458: Flags [.], ack 83848, win 126, options [nop,nop,TS val 694648043 ecr 1301799459], length 0
01:42:36.853291 IP 10.8.0.2.57458 > 52.223.197.117.1935: Flags [.], seq 93364:94678, ack 1, win 501, options [nop,nop,TS val 1301799852 ecr 694648043], length 1314
01:42:36.863772 IP 52.223.197.117.1935 > 10.8.0.2.57458: Flags [.], ack 84166, win 126, options [nop,nop,TS val 694648057 ecr 1301799506], length 0
01:42:36.863795 IP 10.8.0.2.57458 > 52.223.197.117.1935: Flags [P.], seq 94678:95203, ack 1, win 501, options [nop,nop,TS val 1301799863 ecr 694648057], length 525
01:42:36.917529 IP 10.8.0.2.57458 > 52.223.197.117.1935: Flags [.], seq 95203:96517, ack 1, win 501, options [nop,nop,TS val 1301799916 ecr 694648057], length 1314
01:42:36.948398 IP 52.223.197.117.1935 > 10.8.0.2.57458: Flags [.], ack 86794, win 126, options [nop,nop,TS val 694648142 ecr 1301799559], length 0
01:42:36.959489 IP 10.8.0.2.57458 > 52.223.197.117.1935: Flags [.], seq 96517:97831, ack 1, win 501, options [nop,nop,TS val 1301799958 ecr 694648142], length 1314
01:42:36.991515 IP 10.8.0.2.57458 > 52.223.197.117.1935: Flags [.], seq 97831:99145, ack 1, win 501, options [nop,nop,TS val 1301799990 ecr 694648142], length 1314
01:42:37.039135 IP 52.223.197.117.1935 > 10.8.0.2.57458: Flags [.], ack 89422, win 126, options [nop,nop,TS val 694648232 ecr 1301799617], length 0
01:42:37.059915 IP 10.8.0.2.57458 > 52.223.197.117.1935: Flags [.], seq 99145:100459, ack 1, win 501, options [nop,nop,TS val 1301800059 ecr 694648232], length 1314
01:42:37.088999 IP 10.8.0.2.57458 > 52.223.197.117.1935: Flags [.], seq 100459:101773, ack 1, win 501, options [nop,nop,TS val 1301800088 ecr 694648232], length 1314
01:42:37.102983 IP 52.223.197.117.1935 > 10.8.0.2.57458: Flags [.], ack 92050, win 126, options [nop,nop,TS val 694648296 ecr 1301799722], length 0
01:42:37.124226 IP 10.8.0.2.57458 > 52.223.197.117.1935: Flags [.], seq 101773:103087, ack 1, win 501, options [nop,nop,TS val 1301800123 ecr 694648296], length 1314
01:42:37.192663 IP 10.8.0.2.57458 > 52.223.197.117.1935: Flags [.], seq 103087:104401, ack 1, win 501, options [nop,nop,TS val 1301800192 ecr 694648296], length 1314
01:42:37.209811 IP 52.223.197.117.1935 > 10.8.0.2.57458: Flags [.], ack 94678, win 126, options [nop,nop,TS val 694648403 ecr 1301799826], length 0
01:42:37.217055 IP 10.8.0.2.57458 > 52.223.197.117.1935: Flags [.], seq 104401:105715, ack 1, win 501, options [nop,nop,TS val 1301800216 ecr 694648403], length 1314
01:42:37.220361 IP 52.223.197.117.1935 > 10.8.0.2.57458: Flags [.], ack 95203, win 126, options [nop,nop,TS val 694648414 ecr 1301799863], length 0
01:42:37.220377 IP 10.8.0.2.57458 > 52.223.197.117.1935: Flags [P.], seq 105715:106037, ack 1, win 501, options [nop,nop,TS val 1301800219 ecr 694648414], length 322
01:42:37.280799 IP 10.8.0.2.57458 > 52.223.197.117.1935: Flags [.], seq 106037:107351, ack 1, win 501, options [nop,nop,TS val 1301800280 ecr 694648414], length 1314
01:42:37.316628 IP 52.223.197.117.1935 > 10.8.0.2.57458: Flags [.], ack 97831, win 126, options [nop,nop,TS val 694648510 ecr 1301799916], length 0
01:42:37.323841 IP 10.8.0.2.57458 > 52.223.197.117.1935: Flags [.], seq 107351:108665, ack 1, win 501, options [nop,nop,TS val 1301800323 ecr 694648510], length 1314
01:42:37.359836 IP 10.8.0.2.57458 > 52.223.197.117.1935: Flags [.], seq 108665:109979, ack 1, win 501, options [nop,nop,TS val 1301800359 ecr 694648510], length 1314
01:42:37.413167 IP 52.223.197.117.1935 > 10.8.0.2.57458: Flags [.], ack 99145, win 126, options [nop,nop,TS val 694648606 ecr 1301799990], length 0
01:42:37.425574 IP 10.8.0.2.57458 > 52.223.197.117.1935: Flags [.], seq 109979:111293, ack 1, win 501, options [nop,nop,TS val 1301800425 ecr 694648606], length 1314
01:42:37.445830 IP 52.223.197.117.1935 > 10.8.0.2.57458: Flags [.], ack 101773, win 126, options [nop,nop,TS val 694648639 ecr 1301800059], length 0
01:42:37.452265 IP 10.8.0.2.57458 > 52.223.197.117.1935: Flags [.], seq 111293:112607, ack 1, win 501, options [nop,nop,TS val 1301800451 ecr 694648639], length 1314
01:42:37.492588 IP 10.8.0.2.57458 > 52.223.197.117.1935: Flags [.], seq 112607:113921, ack 1, win 501, options [nop,nop,TS val 1301800492 ecr 694648639], length 1314
01:42:37.549372 IP 52.223.197.117.1935 > 10.8.0.2.57458: Flags [.], ack 104401, win 126, options [nop,nop,TS val 694648743 ecr 1301800123], length 0
01:42:37.559187 IP 10.8.0.2.57458 > 52.223.197.117.1935: Flags [.], seq 113921:115235, ack 1, win 501, options [nop,nop,TS val 1301800558 ecr 694648743], length 1314
01:42:37.577005 IP 52.223.197.117.1935 > 10.8.0.2.57458: Flags [.], ack 106037, win 126, options [nop,nop,TS val 694648770 ecr 1301800216], length 0
01:42:37.577038 IP 10.8.0.2.57458 > 52.223.197.117.1935: Flags [P.], seq 115235:116123, ack 1, win 501, options [nop,nop,TS val 1301800576 ecr 694648770], length 888
01:42:37.623747 IP 10.8.0.2.57458 > 52.223.197.117.1935: Flags [.], seq 116123:117437, ack 1, win 501, options [nop,nop,TS val 1301800623 ecr 694648770], length 1314
01:42:37.657371 IP 10.8.0.2.57458 > 52.223.197.117.1935: Flags [.], seq 117437:118751, ack 1, win 501, options [nop,nop,TS val 1301800656 ecr 694648770], length 1314
01:42:37.680748 IP 52.223.197.117.1935 > 10.8.0.2.57458: Flags [.], ack 108665, win 126, options [nop,nop,TS val 694648874 ecr 1301800280], length 0
01:42:37.692446 IP 10.8.0.2.57458 > 52.223.197.117.1935: Flags [.], seq 118751:120065, ack 1, win 501, options [nop,nop,TS val 1301800691 ecr 694648874], length 1314
01:42:37.752430 IP 10.8.0.2.57458 > 52.223.197.117.1935: Flags [.], seq 120065:121379, ack 1, win 501, options [nop,nop,TS val 1301800751 ecr 694648874], length 1314
01:42:37.782410 IP 52.223.197.117.1935 > 10.8.0.2.57458: Flags [.], ack 111293, win 126, options [nop,nop,TS val 694648976 ecr 1301800359], length 0
01:42:37.793433 IP 10.8.0.2.57458 > 52.223.197.117.1935: Flags [.], seq 121379:122693, ack 1, win 501, options [nop,nop,TS val 1301800792 ecr 694648976], length 1314
01:42:37.826902 IP 10.8.0.2.57458 > 52.223.197.117.1935: Flags [.], seq 122693:124007, ack 1, win 501, options [nop,nop,TS val 1301800826 ecr 694648976], length 1314
01:42:37.850374 IP 52.223.197.117.1935 > 10.8.0.2.57458: Flags [.], ack 113921, win 126, options [nop,nop,TS val 694649044 ecr 1301800451], length 0
01:42:37.893943 IP 10.8.0.2.57458 > 52.223.197.117.1935: Flags [.], seq 124007:125321, ack 1, win 501, options [nop,nop,TS val 1301800893 ecr 694649044], length 1314
01:42:37.923614 IP 10.8.0.2.57458 > 52.223.197.117.1935: Flags [.], seq 125321:126635, ack 1, win 501, options [nop,nop,TS val 1301800923 ecr 694649044], length 1314
01:42:37.934915 IP 52.223.197.117.1935 > 10.8.0.2.57458: Flags [.], ack 116123, win 126, options [nop,nop,TS val 694649128 ecr 1301800558], length 0
01:42:37.934930 IP 10.8.0.2.57458 > 52.223.197.117.1935: Flags [P.], seq 126635:127061, ack 1, win 501, options [nop,nop,TS val 1301800934 ecr 694649128], length 426
01:42:37.988357 IP 10.8.0.2.57458 > 52.223.197.117.1935: Flags [.], seq 127061:128375, ack 1, win 501, options [nop,nop,TS val 1301800987 ecr 694649128], length 1314
01:42:38.014816 IP 52.223.197.117.1935 > 10.8.0.2.57458: Flags [.], ack 118751, win 126, options [nop,nop,TS val 694649208 ecr 1301800623], length 0
01:42:38.026914 IP 10.8.0.2.57458 > 52.223.197.117.1935: Flags [.], seq 128375:129689, ack 1, win 501, options [nop,nop,TS val 1301801026 ecr 694649208], length 1314
01:42:38.057545 IP 10.8.0.2.57458 > 52.223.197.117.1935: Flags [.], seq 129689:131003, ack 1, win 501, options [nop,nop,TS val 1301801056 ecr 694649208], length 1314
01:42:38.109393 IP 52.223.197.117.1935 > 10.8.0.2.57458: Flags [.], ack 121379, win 126, options [nop,nop,TS val 694649303 ecr 1301800691], length 0
01:42:38.126902 IP 10.8.0.2.57458 > 52.223.197.117.1935: Flags [.], seq 131003:132317, ack 1, win 501, options [nop,nop,TS val 1301801126 ecr 694649303], length 1314
01:42:38.159787 IP 10.8.0.2.57458 > 52.223.197.117.1935: Flags [.], seq 132317:133631, ack 1, win 501, options [nop,nop,TS val 1301801159 ecr 694649303], length 1314
01:42:38.184000 IP 52.223.197.117.1935 > 10.8.0.2.57458: Flags [.], ack 124007, win 126, options [nop,nop,TS val 694649377 ecr 1301800792], length 0
01:42:38.191631 IP 10.8.0.2.57458 > 52.223.197.117.1935: Flags [.], seq 133631:134945, ack 1, win 501, options [nop,nop,TS val 1301801191 ecr 694649377], length 1314
01:42:38.260036 IP 10.8.0.2.57458 > 52.223.197.117.1935: Flags [.], seq 134945:136259, ack 1, win 501, options [nop,nop,TS val 1301801259 ecr 694649377], length 1314
01:42:38.282434 IP 52.223.197.117.1935 > 10.8.0.2.57458: Flags [.], ack 126635, win 126, options [nop,nop,TS val 694649476 ecr 1301800893], length 0
01:42:38.288531 IP 10.8.0.2.57458 > 52.223.197.117.1935: Flags [.], seq 136259:137573, ack 1, win 501, options [nop,nop,TS val 1301801287 ecr 694649476], length 1314
01:42:38.291639 IP 52.223.197.117.1935 > 10.8.0.2.57458: Flags [.], ack 127061, win 126, options [nop,nop,TS val 694649485 ecr 1301800934], length 0
01:42:38.291679 IP 10.8.0.2.57458 > 52.223.197.117.1935: Flags [P.], seq 137573:137895, ack 1, win 501, options [nop,nop,TS val 1301801291 ecr 694649485], length 322
01:42:38.352592 IP 10.8.0.2.57458 > 52.223.197.117.1935: Flags [.], seq 137895:139209, ack 1, win 501, options [nop,nop,TS val 1301801352 ecr 694649485], length 1314
01:42:38.383862 IP 52.223.197.117.1935 > 10.8.0.2.57458: Flags [.], ack 129689, win 126, options [nop,nop,TS val 694649577 ecr 1301800987], length 0
01:42:38.393442 IP 10.8.0.2.57458 > 52.223.197.117.1935: Flags [.], seq 139209:140523, ack 1, win 501, options [nop,nop,TS val 1301801392 ecr 694649577], length 1314
01:42:38.426892 IP 10.8.0.2.57458 > 52.223.197.117.1935: Flags [.], seq 140523:141837, ack 1, win 501, options [nop,nop,TS val 1301801426 ecr 694649577], length 1314
01:42:38.484022 IP 52.223.197.117.1935 > 10.8.0.2.57458: Flags [.], ack 132317, win 126, options [nop,nop,TS val 694649677 ecr 1301801056], length 0
01:42:38.493266 IP 10.8.0.2.57458 > 52.223.197.117.1935: Flags [.], seq 141837:143151, ack 1, win 501, options [nop,nop,TS val 1301801492 ecr 694649677], length 1314
01:42:38.524195 IP 10.8.0.2.57458 > 52.223.197.117.1935: Flags [.], seq 143151:144465, ack 1, win 501, options [nop,nop,TS val 1301801523 ecr 694649677], length 1314
01:42:38.548312 IP 52.223.197.117.1935 > 10.8.0.2.57458: Flags [.], ack 134945, win 126, options [nop,nop,TS val 694649742 ecr 1301801159], length 0
01:42:38.557480 IP 10.8.0.2.57458 > 52.223.197.117.1935: Flags [.], seq 144465:145779, ack 1, win 501, options [nop,nop,TS val 1301801556 ecr 694649742], length 1314
01:42:38.626889 IP 10.8.0.2.57458 > 52.223.197.117.1935: Flags [.], seq 145779:147093, ack 1, win 501, options [nop,nop,TS val 1301801626 ecr 694649742], length 1314
01:42:38.645482 IP 52.223.197.117.1935 > 10.8.0.2.57458: Flags [.], ack 137573, win 126, options [nop,nop,TS val 694649839 ecr 1301801259], length 0
01:42:38.648406 IP 52.223.197.117.1935 > 10.8.0.2.57458: Flags [.], ack 137895, win 126, options [nop,nop,TS val 694649842 ecr 1301801291], length 0
01:42:38.648435 IP 10.8.0.2.57458 > 52.223.197.117.1935: Flags [P.], seq 147093:147989, ack 1, win 501, options [nop,nop,TS val 1301801647 ecr 694649842], length 896
01:42:38.693585 IP 10.8.0.2.57458 > 52.223.197.117.1935: Flags [.], seq 147989:149303, ack 1, win 501, options [nop,nop,TS val 1301801693 ecr 694649842], length 1314
01:42:38.724049 IP 10.8.0.2.57458 > 52.223.197.117.1935: Flags [.], seq 149303:150617, ack 1, win 501, options [nop,nop,TS val 1301801723 ecr 694649842], length 1314
01:42:38.750624 IP 52.223.197.117.1935 > 10.8.0.2.57458: Flags [.], ack 140523, win 126, options [nop,nop,TS val 694649944 ecr 1301801352], length 0
01:42:38.759979 IP 10.8.0.2.57458 > 52.223.197.117.1935: Flags [.], seq 150617:151931, ack 1, win 501, options [nop,nop,TS val 1301801759 ecr 694649944], length 1314
01:42:38.823939 IP 10.8.0.2.57458 > 52.223.197.117.1935: Flags [.], seq 151931:153245, ack 1, win 501, options [nop,nop,TS val 1301801823 ecr 694649944], length 1314
01:42:38.849219 IP 52.223.197.117.1935 > 10.8.0.2.57458: Flags [.], ack 141837, win 126, options [nop,nop,TS val 694650042 ecr 1301801426], length 0
01:42:38.857483 IP 10.8.0.2.57458 > 52.223.197.117.1935: Flags [.], seq 153245:154559, ack 1, win 501, options [nop,nop,TS val 1301801856 ecr 694650042], length 1314
01:42:38.880845 IP 52.223.197.117.1935 > 10.8.0.2.57458: Flags [.], ack 144465, win 126, options [nop,nop,TS val 694650074 ecr 1301801492], length 0
01:42:38.892263 IP 10.8.0.2.57458 > 52.223.197.117.1935: Flags [.], seq 154559:155873, ack 1, win 501, options [nop,nop,TS val 1301801891 ecr 694650074], length 1314
01:42:38.959876 IP 10.8.0.2.57458 > 52.223.197.117.1935: Flags [.], seq 155873:157187, ack 1, win 501, options [nop,nop,TS val 1301801959 ecr 694650074], length 1314
01:42:38.984027 IP 52.223.197.117.1935 > 10.8.0.2.57458: Flags [.], ack 147093, win 126, options [nop,nop,TS val 694650177 ecr 1301801556], length 0
01:42:38.992589 IP 10.8.0.2.57458 > 52.223.197.117.1935: Flags [.], seq 157187:158501, ack 1, win 501, options [nop,nop,TS val 1301801992 ecr 694650177], length 1314
01:42:39.005233 IP 52.223.197.117.1935 > 10.8.0.2.57458: Flags [.], ack 147989, win 126, options [nop,nop,TS val 694650199 ecr 1301801647], length 0
01:42:39.005264 IP 10.8.0.2.57458 > 52.223.197.117.1935: Flags [P.], seq 158501:158911, ack 1, win 501, options [nop,nop,TS val 1301802004 ecr 694650199], length 410
01:42:39.059397 IP 10.8.0.2.57458 > 52.223.197.117.1935: Flags [.], seq 158911:160225, ack 1, win 501, options [nop,nop,TS val 1301802058 ecr 694650199], length 1314
01:42:39.081035 IP 52.223.197.117.1935 > 10.8.0.2.57458: Flags [.], ack 150617, win 126, options [nop,nop,TS val 694650274 ecr 1301801693], length 0
01:42:39.092342 IP 10.8.0.2.57458 > 52.223.197.117.1935: Flags [.], seq 160225:161539, ack 1, win 501, options [nop,nop,TS val 1301802091 ecr 694650274], length 1314
01:42:39.123831 IP 10.8.0.2.57458 > 52.223.197.117.1935: Flags [.], seq 161539:162853, ack 1, win 501, options [nop,nop,TS val 1301802123 ecr 694650274], length 1314
01:42:39.180854 IP 52.223.197.117.1935 > 10.8.0.2.57458: Flags [.], ack 153245, win 126, options [nop,nop,TS val 694650374 ecr 1301801759], length 0
01:42:39.190820 IP 10.8.0.2.57458 > 52.223.197.117.1935: Flags [.], seq 162853:164167, ack 1, win 501, options [nop,nop,TS val 1301802190 ecr 694650374], length 1314
01:42:39.222533 IP 10.8.0.2.57458 > 52.223.197.117.1935: Flags [.], seq 164167:165481, ack 1, win 501, options [nop,nop,TS val 1301802221 ecr 694650374], length 1314
01:42:39.248981 IP 52.223.197.117.1935 > 10.8.0.2.57458: Flags [.], ack 155873, win 126, options [nop,nop,TS val 694650442 ecr 1301801856], length 0
01:42:39.255837 IP 10.8.0.2.57458 > 52.223.197.117.1935: Flags [.], seq 165481:166795, ack 1, win 501, options [nop,nop,TS val 1301802255 ecr 694650442], length 1314
01:42:39.326616 IP 10.8.0.2.57458 > 52.223.197.117.1935: Flags [.], seq 166795:168109, ack 1, win 501, options [nop,nop,TS val 1301802326 ecr 694650442], length 1314
01:42:39.349424 IP 52.223.197.117.1935 > 10.8.0.2.57458: Flags [.], ack 158501, win 126, options [nop,nop,TS val 694650543 ecr 1301801959], length 0
01:42:39.355933 IP 10.8.0.2.57458 > 52.223.197.117.1935: Flags [.], seq 168109:169423, ack 1, win 501, options [nop,nop,TS val 1301802355 ecr 694650543], length 1314
01:42:39.361954 IP 52.223.197.117.1935 > 10.8.0.2.57458: Flags [.], ack 158911, win 126, options [nop,nop,TS val 694650555 ecr 1301802004], length 0
01:42:39.361968 IP 10.8.0.2.57458 > 52.223.197.117.1935: Flags [P.], seq 169423:169852, ack 1, win 501, options [nop,nop,TS val 1301802361 ecr 694650555], length 429
01:42:39.421636 IP 10.8.0.2.57458 > 52.223.197.117.1935: Flags [.], seq 169852:171166, ack 1, win 501, options [nop,nop,TS val 1301802421 ecr 694650555], length 1314
01:42:39.449744 IP 52.223.197.117.1935 > 10.8.0.2.57458: Flags [.], ack 161539, win 126, options [nop,nop,TS val 694650643 ecr 1301802058], length 0
01:42:39.456121 IP 10.8.0.2.57458 > 52.223.197.117.1935: Flags [.], seq 171166:172480, ack 1, win 501, options [nop,nop,TS val 1301802455 ecr 694650643], length 1314
01:42:39.493430 IP 10.8.0.2.57458 > 52.223.197.117.1935: Flags [.], seq 172480:173794, ack 1, win 501, options [nop,nop,TS val 1301802492 ecr 694650643], length 1314
01:42:39.545206 IP 52.223.197.117.1935 > 10.8.0.2.57458: Flags [.], ack 162853, win 126, options [nop,nop,TS val 694650738 ecr 1301802123], length 0
01:42:39.559500 IP 10.8.0.2.57458 > 52.223.197.117.1935: Flags [.], seq 173794:175108, ack 1, win 501, options [nop,nop,TS val 1301802558 ecr 694650738], length 1314
01:42:39.579392 IP 52.223.197.117.1935 > 10.8.0.2.57458: Flags [.], ack 165481, win 126, options [nop,nop,TS val 694650773 ecr 1301802190], length 0
01:42:39.592049 IP 10.8.0.2.57458 > 52.223.197.117.1935: Flags [.], seq 175108:176422, ack 1, win 501, options [nop,nop,TS val 1301802591 ecr 694650773], length 1314
01:42:39.627245 IP 10.8.0.2.57458 > 52.223.197.117.1935: Flags [.], seq 176422:177736, ack 1, win 501, options [nop,nop,TS val 1301802626 ecr 694650773], length 1314
01:42:39.683849 IP 52.223.197.117.1935 > 10.8.0.2.57458: Flags [.], ack 168109, win 126, options [nop,nop,TS val 694650877 ecr 1301802255], length 0
01:42:39.693592 IP 10.8.0.2.57458 > 52.223.197.117.1935: Flags [.], seq 177736:179050, ack 1, win 501, options [nop,nop,TS val 1301802693 ecr 694650877], length 1314
01:42:39.718555 IP 52.223.197.117.1935 > 10.8.0.2.57458: Flags [.], ack 169852, win 126, options [nop,nop,TS val 694650912 ecr 1301802355], length 0
01:42:39.718577 IP 10.8.0.2.57458 > 52.223.197.117.1935: Flags [P.], seq 179050:179835, ack 1, win 501, options [nop,nop,TS val 1301802718 ecr 694650912], length 785
01:42:39.757519 IP 10.8.0.2.57458 > 52.223.197.117.1935: Flags [.], seq 179835:181149, ack 1, win 501, options [nop,nop,TS val 1301802756 ecr 694650912], length 1314
01:42:39.792675 IP 10.8.0.2.57458 > 52.223.197.117.1935: Flags [.], seq 181149:182463, ack 1, win 501, options [nop,nop,TS val 1301802792 ecr 694650912], length 1314
01:42:39.813246 IP 52.223.197.117.1935 > 10.8.0.2.57458: Flags [.], ack 172480, win 126, options [nop,nop,TS val 694651007 ecr 1301802421], length 0
01:42:39.827723 IP 10.8.0.2.57458 > 52.223.197.117.1935: Flags [.], seq 182463:183777, ack 1, win 501, options [nop,nop,TS val 1301802827 ecr 694651007], length 1314
01:42:39.891773 IP 10.8.0.2.57458 > 52.223.197.117.1935: Flags [.], seq 183777:185091, ack 1, win 501, options [nop,nop,TS val 1301802891 ecr 694651007], length 1314
01:42:39.916623 IP 52.223.197.117.1935 > 10.8.0.2.57458: Flags [.], ack 175108, win 126, options [nop,nop,TS val 694651110 ecr 1301802492], length 0
01:42:39.924022 IP 10.8.0.2.57458 > 52.223.197.117.1935: Flags [.], seq 185091:186405, ack 1, win 501, options [nop,nop,TS val 1301802923 ecr 694651110], length 1314
01:42:39.960115 IP 10.8.0.2.57458 > 52.223.197.117.1935: Flags [.], seq 186405:187719, ack 1, win 501, options [nop,nop,TS val 1301802959 ecr 694651110], length 1314
01:42:39.984286 IP 52.223.197.117.1935 > 10.8.0.2.57458: Flags [.], ack 177736, win 126, options [nop,nop,TS val 694651177 ecr 1301802591], length 0
01:42:40.027638 IP 10.8.0.2.57458 > 52.223.197.117.1935: Flags [.], seq 187719:189033, ack 1, win 501, options [nop,nop,TS val 1301803027 ecr 694651177], length 1314
01:42:40.060114 IP 10.8.0.2.57458 > 52.223.197.117.1935: Flags [.], seq 189033:190347, ack 1, win 501, options [nop,nop,TS val 1301803059 ecr 694651177], length 1314
01:42:40.075081 IP 52.223.197.117.1935 > 10.8.0.2.57458: Flags [.], ack 179835, win 126, options [nop,nop,TS val 694651269 ecr 1301802693], length 0
01:42:40.075118 IP 10.8.0.2.57458 > 52.223.197.117.1935: Flags [P.], seq 190347:190777, ack 1, win 501, options [nop,nop,TS val 1301803074 ecr 694651269], length 430
01:42:40.126990 IP 10.8.0.2.57458 > 52.223.197.117.1935: Flags [.], seq 190777:192091, ack 1, win 501, options [nop,nop,TS val 1301803126 ecr 694651269], length 1314
01:42:40.149739 IP 52.223.197.117.1935 > 10.8.0.2.57458: Flags [.], ack 182463, win 126, options [nop,nop,TS val 694651343 ecr 1301802756], length 0
01:42:40.160142 IP 10.8.0.2.57458 > 52.223.197.117.1935: Flags [.], seq 192091:193405, ack 1, win 501, options [nop,nop,TS val 1301803159 ecr 694651343], length 1314
01:42:40.193543 IP 10.8.0.2.57458 > 52.223.197.117.1935: Flags [.], seq 193405:194719, ack 1, win 501, options [nop,nop,TS val 1301803192 ecr 694651343], length 1314
01:42:40.248511 IP 52.223.197.117.1935 > 10.8.0.2.57458: Flags [.], ack 185091, win 126, options [nop,nop,TS val 694651442 ecr 1301802827], length 0
01:42:40.260181 IP 10.8.0.2.57458 > 52.223.197.117.1935: Flags [.], seq 194719:196033, ack 1, win 501, options [nop,nop,TS val 1301803259 ecr 694651442], length 1314
01:42:40.293550 IP 10.8.0.2.57458 > 52.223.197.117.1935: Flags [.], seq 196033:197347, ack 1, win 501, options [nop,nop,TS val 1301803292 ecr 694651442], length 1314
01:42:40.316843 IP 52.223.197.117.1935 > 10.8.0.2.57458: Flags [.], ack 187719, win 126, options [nop,nop,TS val 694651510 ecr 1301802923], length 0
01:42:40.324092 IP 10.8.0.2.57458 > 52.223.197.117.1935: Flags [.], seq 197347:198661, ack 1, win 501, options [nop,nop,TS val 1301803323 ecr 694651510], length 1314
