01:52:36.622585 IP 52.223.244.73.1935 > 10.8.1.18.33960: Flags [.], ack 2890519976, win 126, options [nop,nop,TS val 1023324097 ecr 2280639047], length 0
01:52:36.638044 IP 10.8.1.18.33960 > 52.223.244.73.1935: Flags [.], seq 4534:5848, ack 0, win 501, options [nop,nop,TS val 2280639282 ecr 1023324097], length 1314
01:52:36.671458 IP 10.8.1.18.33960 > 52.223.244.73.1935: Flags [.], seq 5848:7162, ack 0, win 501, options [nop,nop,TS val 2280639315 ecr 1023324097], length 1314
01:52:36.724580 IP 52.223.244.73.1935 > 10.8.1.18.33960: Flags [.], ack 2629, win 126, options [nop,nop,TS val 1023324199 ecr 2280639126], length 0
01:52:36.729716 IP 52.223.244.73.1935 > 10.8.1.18.33960: Flags [.], ack 3220, win 126, options [nop,nop,TS val 1023324204 ecr 2280639188], length 0
01:52:36.729739 IP 10.8.1.18.33960 > 52.223.244.73.1935: Flags [P.], seq 7162:8315, ack 0, win 501, options [nop,nop,TS val 2280639374 ecr 1023324204], length 1153
01:52:36.769909 IP 10.8.1.18.33960 > 52.223.244.73.1935: Flags [.], seq 8315:9629, ack 0, win 501, options [nop,nop,TS val 2280639414 ecr 1023324204], length 1314
01:52:36.800488 IP 10.8.1.18.33960 > 52.223.244.73.1935: Flags [.], seq 9629:10943, ack 0, win 501, options [nop,nop,TS val 2280639444 ecr 1023324204], length 1314
01:52:36.824132 IP 52.223.244.73.1935 > 10.8.1.18.33960: Flags [.], ack 5848, win 126, options [nop,nop,TS val 1023324298 ecr 2280639245], length 0
01:52:36.845300 IP 10.8.1.18.33960 > 52.223.244.73.1935: Flags [.], seq 10943:12257, ack 0, win 501, options [nop,nop,TS val 2280639489 ecr 1023324298], length 1314
01:52:36.904704 IP 10.8.1.18.33960 > 52.223.244.73.1935: Flags [.], seq 12257:13571, ack 0, win 501, options [nop,nop,TS val 2280639549 ecr 1023324298], length 1314
01:52:36.915744 IP 52.223.244.73.1935 > 10.8.1.18.33960: Flags [.], ack 8315, win 126, options [nop,nop,TS val 1023324390 ecr 2280639315], length 0
01:52:36.915789 IP 10.8.1.18.33960 > 52.223.244.73.1935: Flags [P.], seq 13571:14257, ack 0, win 501, options [nop,nop,TS val 2280639560 ecr 1023324390], length 686
01:52:36.968354 IP 10.8.1.18.33960 > 52.223.244.73.1935: Flags [.], seq 14257:15571, ack 0, win 501, options [nop,nop,TS val 2280639612 ecr 1023324390], length 1314
01:52:36.986359 IP 52.223.244.73.1935 > 10.8.1.18.33960: Flags [.], ack 10943, win 126, options [nop,nop,TS val 1023324461 ecr 2280639414], length 0
01:52:37.001589 IP 10.8.1.18.33960 > 52.223.244.73.1935: Flags [.], seq 15571:16885, ack 0, win 501, options [nop,nop,TS val 2280639645 ecr 1023324461], length 1314
01:52:37.037525 IP 10.8.1.18.33960 > 52.223.244.73.1935: Flags [.], seq 16885:18199, ack 0, win 501, options [nop,nop,TS val 2280639681 ecr 1023324461], length 1314
01:52:37.090674 IP 52.223.244.73.1935 > 10.8.1.18.33960: Flags [.], ack 13571, win 126, options [nop,nop,TS val 1023324565 ecr 2280639489], length 0
01:52:37.101443 IP 10.8.1.18.33960 > 52.223.244.73.1935: Flags [.], seq 18199:19513, ack 0, win 501, options [nop,nop,TS val 2280639745 ecr 1023324565], length 1314
01:52:37.101583 IP 52.223.244.73.1935 > 10.8.1.18.33960: Flags [.], ack 14257, win 126, options [nop,nop,TS val 1023324576 ecr 2280639560], length 0
01:52:37.101597 IP 10.8.1.18.33960 > 52.223.244.73.1935: Flags [P.], seq 19513:20092, ack 0, win 501, options [nop,nop,TS val 2280639745 ecr 1023324576], length 579
01:52:37.167395 IP 10.8.1.18.33960 > 52.223.244.73.1935: Flags [.], seq 20092:21406, ack 0, win 501, options [nop,nop,TS val 2280639811 ecr 1023324576], length 1314
01:52:37.187532 IP 52.223.244.73.1935 > 10.8.1.18.33960: Flags [.], ack 16885, win 126, options [nop,nop,TS val 1023324662 ecr 2280639612], length 0
01:52:37.200348 IP 10.8.1.18.33960 > 52.223.244.73.1935: Flags [.], seq 21406:22720, ack 0, win 501, options [nop,nop,TS val 2280639844 ecr 1023324662], length 1314
01:52:37.233857 IP 10.8.1.18.33960 > 52.223.244.73.1935: Flags [.], seq 22720:24034, ack 0, win 501, options [nop,nop,TS val 2280639878 ecr 1023324662], length 1314
01:52:37.287436 IP 52.223.244.73.1935 > 10.8.1.18.33960: Flags [.], ack 19513, win 126, options [nop,nop,TS val 1023324762 ecr 2280639681], length 0
01:52:37.287716 IP 52.223.244.73.1935 > 10.8.1.18.33960: Flags [.], ack 20092, win 126, options [nop,nop,TS val 1023324762 ecr 2280639745], length 0
01:52:37.287749 IP 10.8.1.18.33960 > 52.223.244.73.1935: Flags [P.], seq 24034:25182, ack 0, win 501, options [nop,nop,TS val 2280639932 ecr 1023324762], length 1148
01:52:37.335246 IP 10.8.1.18.33960 > 52.223.244.73.1935: Flags [.], seq 25182:26496, ack 0, win 501, options [nop,nop,TS val 2280639979 ecr 1023324762], length 1314
01:52:37.367276 IP 10.8.1.18.33960 > 52.223.244.73.1935: Flags [.], seq 26496:27810, ack 0, win 501, options [nop,nop,TS val 2280640011 ecr 1023324762], length 1314
01:52:37.386331 IP 52.223.244.73.1935 > 10.8.1.18.33960: Flags [.], ack 22720, win 126, options [nop,nop,TS val 1023324861 ecr 2280639811], length 0
01:52:37.400702 IP 10.8.1.18.33960 > 52.223.244.73.1935: Flags [.], seq 27810:29124, ack 0, win 501, options [nop,nop,TS val 2280640045 ecr 1023324861], length 1314
01:52:37.471574 IP 10.8.1.18.33960 > 52.223.244.73.1935: Flags [.], seq 29124:30438, ack 0, win 501, options [nop,nop,TS val 2280640115 ecr 1023324861], length 1314
01:52:37.473389 IP 52.223.244.73.1935 > 10.8.1.18.33960: Flags [.], ack 25182, win 126, options [nop,nop,TS val 1023324948 ecr 2280639878], length 0
01:52:37.473431 IP 10.8.1.18.33960 > 52.223.244.73.1935: Flags [P.], seq 30438:31124, ack 0, win 501, options [nop,nop,TS val 2280640117 ecr 1023324948], length 686
01:52:37.536399 IP 10.8.1.18.33960 > 52.223.244.73.1935: Flags [.], seq 31124:32438, ack 0, win 501, options [nop,nop,TS val 2280640180 ecr 1023324948], length 1314
01:52:37.553183 IP 52.223.244.73.1935 > 10.8.1.18.33960: Flags [.], ack 27810, win 126, options [nop,nop,TS val 1023325027 ecr 2280639979], length 0
01:52:37.569672 IP 10.8.1.18.33960 > 52.223.244.73.1935: Flags [.], seq 32438:33752, ack 0, win 501, options [nop,nop,TS val 2280640213 ecr 1023325027], length 1314
01:52:37.603089 IP 10.8.1.18.33960 > 52.223.244.73.1935: Flags [.], seq 33752:35066, ack 0, win 501, options [nop,nop,TS val 2280640247 ecr 1023325027], length 1314
01:52:37.657509 IP 52.223.244.73.1935 > 10.8.1.18.33960: Flags [.], ack 30438, win 126, options [nop,nop,TS val 1023325132 ecr 2280640045], length 0
01:52:37.659346 IP 52.223.244.73.1935 > 10.8.1.18.33960: Flags [.], ack 31124, win 126, options [nop,nop,TS val 1023325134 ecr 2280640117], length 0
01:52:37.659363 IP 10.8.1.18.33960 > 52.223.244.73.1935: Flags [P.], seq 35066:36220, ack 0, win 501, options [nop,nop,TS val 2280640303 ecr 1023325134], length 1154
01:52:37.701875 IP 10.8.1.18.33960 > 52.223.244.73.1935: Flags [.], seq 36220:37534, ack 0, win 501, options [nop,nop,TS val 2280640346 ecr 1023325134], length 1314
01:52:37.733696 IP 10.8.1.18.33960 > 52.223.244.73.1935: Flags [.], seq 37534:38848, ack 0, win 501, options [nop,nop,TS val 2280640378 ecr 1023325134], length 1314
01:52:37.755725 IP 52.223.244.73.1935 > 10.8.1.18.33960: Flags [.], ack 33752, win 126, options [nop,nop,TS val 1023325230 ecr 2280640180], length 0
01:52:37.783894 IP 10.8.1.18.33960 > 52.223.244.73.1935: Flags [.], seq 38848:40162, ack 0, win 501, options [nop,nop,TS val 2280640428 ecr 1023325230], length 1314
01:52:37.837251 IP 10.8.1.18.33960 > 52.223.244.73.1935: Flags [.], seq 40162:41476, ack 0, win 501, options [nop,nop,TS val 2280640481 ecr 1023325230], length 1314
01:52:37.845140 IP 52.223.244.73.1935 > 10.8.1.18.33960: Flags [.], ack 36220, win 126, options [nop,nop,TS val 1023325319 ecr 2280640247], length 0
01:52:37.845175 IP 10.8.1.18.33960 > 52.223.244.73.1935: Flags [P.], seq 41476:42054, ack 0, win 501, options [nop,nop,TS val 2280640489 ecr 1023325319], length 578
01:52:37.900382 IP 10.8.1.18.33960 > 52.223.244.73.1935: Flags [.], seq 42054:43368, ack 0, win 501, options [nop,nop,TS val 2280640544 ecr 1023325319], length 1314
01:52:37.919747 IP 52.223.244.73.1935 > 10.8.1.18.33960: Flags [.], ack 38848, win 126, options [nop,nop,TS val 1023325394 ecr 2280640346], length 0
01:52:37.932941 IP 10.8.1.18.33960 > 52.223.244.73.1935: Flags [.], seq 43368:44682, ack 0, win 501, options [nop,nop,TS val 2280640577 ecr 1023325394], length 1314
01:52:37.971976 IP 10.8.1.18.33960 > 52.223.244.73.1935: Flags [.], seq 44682:45996, ack 0, win 501, options [nop,nop,TS val 2280640616 ecr 1023325394], length 1314
01:52:38.023377 IP 52.223.244.73.1935 > 10.8.1.18.33960: Flags [.], ack 41476, win 126, options [nop,nop,TS val 1023325498 ecr 2280640428], length 0
01:52:38.030963 IP 52.223.244.73.1935 > 10.8.1.18.33960: Flags [.], ack 42054, win 126, options [nop,nop,TS val 1023325505 ecr 2280640489], length 0
01:52:38.030983 IP 10.8.1.18.33960 > 52.223.244.73.1935: Flags [P.], seq 45996:47141, ack 0, win 501, options [nop,nop,TS val 2280640675 ecr 1023325505], length 1145
01:52:38.067834 IP 10.8.1.18.33960 > 52.223.244.73.1935: Flags [.], seq 47141:48455, ack 0, win 501, options [nop,nop,TS val 2280640712 ecr 1023325505], length 1314
01:52:38.103622 IP 10.8.1.18.33960 > 52.223.244.73.1935: Flags [.], seq 48455:49769, ack 0, win 501, options [nop,nop,TS val 2280640747 ecr 1023325505], length 1314
01:52:38.119186 IP 52.223.244.73.1935 > 10.8.1.18.33960: Flags [.], ack 44682, win 126, options [nop,nop,TS val 1023325593 ecr 2280640544], length 0
01:52:38.146863 IP 10.8.1.18.33960 > 52.223.244.73.1935: Flags [.], seq 49769:51083, ack 0, win 501, options [nop,nop,TS val 2280640791 ecr 1023325593], length 1314
01:52:38.201126 IP 10.8.1.18.33960 > 52.223.244.73.1935: Flags [.], seq 51083:52397, ack 0, win 501, options [nop,nop,TS val 2280640845 ecr 1023325593], length 1314
01:52:38.217391 IP 52.223.244.73.1935 > 10.8.1.18.33960: Flags [.], ack 47141, win 126, options [nop,nop,TS val 1023325692 ecr 2280640616], length 0
01:52:38.217408 IP 10.8.1.18.33960 > 52.223.244.73.1935: Flags [P.], seq 52397:53083, ack 0, win 501, options [nop,nop,TS val 2280640861 ecr 1023325692], length 686
01:52:38.267241 IP 10.8.1.18.33960 > 52.223.244.73.1935: Flags [.], seq 53083:54397, ack 0, win 501, options [nop,nop,TS val 2280640911 ecr 1023325692], length 1314
01:52:38.289662 IP 52.223.244.73.1935 > 10.8.1.18.33960: Flags [.], ack 49769, win 126, options [nop,nop,TS val 1023325764 ecr 2280640712], length 0
01:52:38.301545 IP 10.8.1.18.33960 > 52.223.244.73.1935: Flags [.], seq 54397:55711, ack 0, win 501, options [nop,nop,TS val 2280640945 ecr 1023325764], length 1314
01:52:38.338162 IP 10.8.1.18.33960 > 52.223.244.73.1935: Flags [.], seq 55711:57025, ack 0, win 501, options [nop,nop,TS val 2280640982 ecr 1023325764], length 1314
01:52:38.386836 IP 52.223.244.73.1935 > 10.8.1.18.33960: Flags [.], ack 52397, win 126, options [nop,nop,TS val 1023325861 ecr 2280640791], length 0
01:52:38.400372 IP 10.8.1.18.33960 > 52.223.244.73.1935: Flags [.], seq 57025:58339, ack 0, win 501, options [nop,nop,TS val 2280641044 ecr 1023325861], length 1314
01:52:38.403441 IP 52.223.244.73.1935 > 10.8.1.18.33960: Flags [.], ack 53083, win 126, options [nop,nop,TS val 1023325878 ecr 2280640861], length 0
01:52:38.403480 IP 10.8.1.18.33960 > 52.223.244.73.1935: Flags [P.], seq 58339:59025, ack 0, win 501, options [nop,nop,TS val 2280641047 ecr 1023325878], length 686
01:52:38.465705 IP 10.8.1.18.33960 > 52.223.244.73.1935: Flags [.], seq 59025:60339, ack 0, win 501, options [nop,nop,TS val 2280641110 ecr 1023325878], length 1314
01:52:38.487566 IP 52.223.244.73.1935 > 10.8.1.18.33960: Flags [.], ack 55711, win 126, options [nop,nop,TS val 1023325962 ecr 2280640911], length 0
01:52:38.504882 IP 10.8.1.18.33960 > 52.223.244.73.1935: Flags [.], seq 60339:61653, ack 0, win 501, options [nop,nop,TS val 2280641149 ecr 1023325962], length 1314
01:52:38.538235 IP 10.8.1.18.33960 > 52.223.244.73.1935: Flags [.], seq 61653:62967, ack 0, win 501, options [nop,nop,TS val 2280641182 ecr 1023325962], length 1314
01:52:38.586363 IP 52.223.244.73.1935 > 10.8.1.18.33960: Flags [.], ack 58339, win 126, options [nop,nop,TS val 1023326061 ecr 2280640982], length 0
01:52:38.589320 IP 52.223.244.73.1935 > 10.8.1.18.33960: Flags [.], ack 59025, win 126, options [nop,nop,TS val 1023326064 ecr 2280641047], length 0
01:52:38.589335 IP 10.8.1.18.33960 > 52.223.244.73.1935: Flags [P.], seq 62967:64020, ack 0, win 501, options [nop,nop,TS val 2280641233 ecr 1023326064], length 1053
01:52:38.635657 IP 10.8.1.18.33960 > 52.223.244.73.1935: Flags [.], seq 64020:65334, ack 0, win 501, options [nop,nop,TS val 2280641279 ecr 1023326064], length 1314
01:52:38.670639 IP 10.8.1.18.33960 > 52.223.244.73.1935: Flags [.], seq 65334:66648, ack 0, win 501, options [nop,nop,TS val 2280641314 ecr 1023326064], length 1314
01:52:38.691007 IP 52.223.244.73.1935 > 10.8.1.18.33960: Flags [.], ack 61653, win 126, options [nop,nop,TS val 1023326165 ecr 2280641110], length 0
01:52:38.703016 IP 10.8.1.18.33960 > 52.223.244.73.1935: Flags [.], seq 66648:67962, ack 0, win 501, options [nop,nop,TS val 2280641347 ecr 1023326165], length 1314
01:52:38.771339 IP 10.8.1.18.33960 > 52.223.244.73.1935: Flags [.], seq 67962:69276, ack 0, win 501, options [nop,nop,TS val 2280641415 ecr 1023326165], length 1314
01:52:38.775199 IP 52.223.244.73.1935 > 10.8.1.18.33960: Flags [.], ack 64020, win 126, options [nop,nop,TS val 1023326249 ecr 2280641182], length 0
01:52:38.775235 IP 10.8.1.18.33960 > 52.223.244.73.1935: Flags [P.], seq 69276:69950, ack 0, win 501, options [nop,nop,TS val 2280641419 ecr 1023326249], length 674
01:52:38.835454 IP 10.8.1.18.33960 > 52.223.244.73.1935: Flags [.], seq 69950:71264, ack 0, win 501, options [nop,nop,TS val 2280641479 ecr 1023326249], length 1314
01:52:38.856710 IP 52.223.244.73.1935 > 10.8.1.18.33960: Flags [.], ack 66648, win 126, options [nop,nop,TS val 1023326331 ecr 2280641279], length 0
01:52:38.867888 IP 10.8.1.18.33960 > 52.223.244.73.1935: Flags [.], seq 71264:72578, ack 0, win 501, options [nop,nop,TS val 2280641512 ecr 1023326331], length 1314
01:52:38.900725 IP 10.8.1.18.33960 > 52.223.244.73.1935: Flags [.], seq 72578:73892, ack 0, win 501, options [nop,nop,TS val 2280641545 ecr 1023326331], length 1314
01:52:38.957380 IP 52.223.244.73.1935 > 10.8.1.18.33960: Flags [.], ack 69276, win 126, options [nop,nop,TS val 1023326432 ecr 2280641347], length 0
01:52:38.961182 IP 52.223.244.73.1935 > 10.8.1.18.33960: Flags [.], ack 69950, win 126, options [nop,nop,TS val 1023326435 ecr 2280641419], length 0
01:52:38.961211 IP 10.8.1.18.33960 > 52.223.244.73.1935: Flags [P.], seq 73892:75045, ack 0, win 501, options [nop,nop,TS val 2280641605 ecr 1023326435], length 1153
01:52:39.000351 IP 10.8.1.18.33960 > 52.223.244.73.1935: Flags [.], seq 75045:76359, ack 0, win 501, options [nop,nop,TS val 2280641644 ecr 1023326435], length 1314
01:52:39.034436 IP 10.8.1.18.33960 > 52.223.244.73.1935: Flags [.], seq 76359:77673, ack 0, win 501, options [nop,nop,TS val 2280641678 ecr 1023326435], length 1314
01:52:39.053782 IP 52.223.244.73.1935 > 10.8.1.18.33960: Flags [.], ack 72578, win 126, options [nop,nop,TS val 1023326528 ecr 2280641479], length 0
01:52:39.084950 IP 10.8.1.18.33960 > 52.223.244.73.1935: Flags [.], seq 77673:78987, ack 0, win 501, options [nop,nop,TS val 2280641729 ecr 1023326528], length 1314
01:52:39.137902 IP 10.8.1.18.33960 > 52.223.244.73.1935: Flags [.], seq 78987:80301, ack 0, win 501, options [nop,nop,TS val 2280641782 ecr 1023326528], length 1314
01:52:39.147188 IP 52.223.244.73.1935 > 10.8.1.18.33960: Flags [.], ack 75045, win 126, options [nop,nop,TS val 1023326621 ecr 2280641545], length 0
01:52:39.147200 IP 10.8.1.18.33960 > 52.223.244.73.1935: Flags [P.], seq 80301:80892, ack 0, win 501, options [nop,nop,TS val 2280641791 ecr 1023326621], length 591
01:52:39.200634 IP 10.8.1.18.33960 > 52.223.244.73.1935: Flags [.], seq 80892:82206, ack 0, win 501, options [nop,nop,TS val 2280641844 ecr 1023326621], length 1314
01:52:39.220400 IP 52.223.244.73.1935 > 10.8.1.18.33960: Flags [.], ack 77673, win 126, options [nop,nop,TS val 1023326695 ecr 2280641644], length 0
01:52:39.233821 IP 10.8.1.18.33960 > 52.223.244.73.1935: Flags [.], seq 82206:83520, ack 0, win 501, options [nop,nop,TS val 2280641878 ecr 1023326695], length 1314
01:52:39.271421 IP 10.8.1.18.33960 > 52.223.244.73.1935: Flags [.], seq 83520:84834, ack 0, win 501, options [nop,nop,TS val 2280641915 ecr 1023326695], length 1314
01:52:39.323841 IP 52.223.244.73.1935 > 10.8.1.18.33960: Flags [.], ack 80301, win 126, options [nop,nop,TS val 1023326798 ecr 2280641729], length 0
01:52:39.333264 IP 52.223.244.73.1935 > 10.8.1.18.33960: Flags [.], ack 80892, win 126, options [nop,nop,TS val 1023326807 ecr 2280641791], length 0
01:52:39.333298 IP 10.8.1.18.33960 > 52.223.244.73.1935: Flags [P.], seq 84834:85983, ack 0, win 501, options [nop,nop,TS val 2280641977 ecr 1023326807], length 1149
01:52:39.369779 IP 10.8.1.18.33960 > 52.223.244.73.1935: Flags [.], seq 85983:87297, ack 0, win 501, options [nop,nop,TS val 2280642014 ecr 1023326807], length 1314
01:52:39.403330 IP 10.8.1.18.33960 > 52.223.244.73.1935: Flags [.], seq 87297:88611, ack 0, win 501, options [nop,nop,TS val 2280642047 ecr 1023326807], length 1314
01:52:39.419777 IP 52.223.244.73.1935 > 10.8.1.18.33960: Flags [.], ack 83520, win 126, options [nop,nop,TS val 1023326894 ecr 2280641844], length 0
01:52:39.447381 IP 10.8.1.18.33960 > 52.223.244.73.1935: Flags [.], seq 88611:89925, ack 0, win 501, options [nop,nop,TS val 2280642091 ecr 1023326894], length 1314
01:52:39.501620 IP 10.8.1.18.33960 > 52.223.244.73.1935: Flags [.], seq 89925:91239, ack 0, win 501, options [nop,nop,TS val 2280642145 ecr 1023326894], length 1314
01:52:39.519217 IP 52.223.244.73.1935 > 10.8.1.18.33960: Flags [.], ack 85983, win 126, options [nop,nop,TS val 1023326994 ecr 2280641915], length 0
01:52:39.519236 IP 10.8.1.18.33960 > 52.223.244.73.1935: Flags [P.], seq 91239:91913, ack 0, win 501, options [nop,nop,TS val 2280642163 ecr 1023326994], length 674
01:52:39.571382 IP 10.8.1.18.33960 > 52.223.244.73.1935: Flags [.], seq 91913:93227, ack 0, win 501, options [nop,nop,TS val 2280642215 ecr 1023326994], length 1314
01:52:39.589452 IP 52.223.244.73.1935 > 10.8.1.18.33960: Flags [.], ack 88611, win 126, options [nop,nop,TS val 1023327064 ecr 2280642014], length 0
01:52:39.604602 IP 10.8.1.18.33960 > 52.223.244.73.1935: Flags [.], seq 93227:94541, ack 0, win 501, options [nop,nop,TS val 2280642248 ecr 1023327064], length 1314
01:52:39.639913 IP 10.8.1.18.33960 > 52.223.244.73.1935: Flags [.], seq 94541:95855, ack 0, win 501, options [nop,nop,TS val 2280642284 ecr 1023327064], length 1314
01:52:39.687529 IP 52.223.244.73.1935 > 10.8.1.18.33960: Flags [.], ack 91239, win 126, options [nop,nop,TS val 1023327162 ecr 2280642091], length 0
01:52:39.702232 IP 10.8.1.18.33960 > 52.223.244.73.1935: Flags [.], seq 95855:97169, ack 0, win 501, options [nop,nop,TS val 2280642346 ecr 1023327162], length 1314
01:52:39.705132 IP 52.223.244.73.1935 > 10.8.1.18.33960: Flags [.], ack 91913, win 126, options [nop,nop,TS val 1023327179 ecr 2280642163], length 0
01:52:39.705156 IP 10.8.1.18.33960 > 52.223.244.73.1935: Flags [P.], seq 97169:97852, ack 0, win 501, options [nop,nop,TS val 2280642349 ecr 1023327179], length 683
01:52:39.767757 IP 10.8.1.18.33960 > 52.223.244.73.1935: Flags [.], seq 97852:99166, ack 0, win 501, options [nop,nop,TS val 2280642412 ecr 1023327179], length 1314
01:52:39.790793 IP 52.223.244.73.1935 > 10.8.1.18.33960: Flags [.], ack 94541, win 126, options [nop,nop,TS val 1023327265 ecr 2280642215], length 0
01:52:39.803829 IP 10.8.1.18.33960 > 52.223.244.73.1935: Flags [.], seq 99166:100480, ack 0, win 501, options [nop,nop,TS val 2280642448 ecr 1023327265], length 1314
01:52:39.837293 IP 10.8.1.18.33960 > 52.223.244.73.1935: Flags [.], seq 100480:101794, ack 0, win 501, options [nop,nop,TS val 2280642481 ecr 1023327265], length 1314
01:52:39.888571 IP 52.223.244.73.1935 > 10.8.1.18.33960: Flags [.], ack 97169, win 126, options [nop,nop,TS val 1023327363 ecr 2280642284], length 0
01:52:39.891174 IP 52.223.244.73.1935 > 10.8.1.18.33960: Flags [.], ack 97852, win 126, options [nop,nop,TS val 1023327366 ecr 2280642349], length 0
01:52:39.891194 IP 10.8.1.18.33960 > 52.223.244.73.1935: Flags [P.], seq 101794:102850, ack 0, win 501, options [nop,nop,TS val 2280642535 ecr 1023327366], length 1056
01:52:39.934858 IP 10.8.1.18.33960 > 52.223.244.73.1935: Flags [.], seq 102850:104164, ack 0, win 501, options [nop,nop,TS val 2280642579 ecr 1023327366], length 1314
01:52:39.971382 IP 10.8.1.18.33960 > 52.223.244.73.1935: Flags [.], seq 104164:105478, ack 0, win 501, options [nop,nop,TS val 2280642615 ecr 1023327366], length 1314
01:52:39.994862 IP 52.223.244.73.1935 > 10.8.1.18.33960: Flags [.], ack 100480, win 126, options [nop,nop,TS val 1023327465 ecr 2280642412], length 0
01:52:40.004797 IP 10.8.1.18.33960 > 52.223.244.73.1935: Flags [.], seq 105478:106792, ack 0, win 501, options [nop,nop,TS val 2280642649 ecr 1023327465], length 1314
01:52:40.067355 IP 10.8.1.18.33960 > 52.223.244.73.1935: Flags [.], seq 106792:108106, ack 0, win 501, options [nop,nop,TS val 2280642711 ecr 1023327465], length 1314
01:52:40.077225 IP 52.223.244.73.1935 > 10.8.1.18.33960: Flags [.], ack 102850, win 126, options [nop,nop,TS val 1023327551 ecr 2280642481], length 0
01:52:40.077244 IP 10.8.1.18.33960 > 52.223.244.73.1935: Flags [P.], seq 108106:108792, ack 0, win 501, options [nop,nop,TS val 2280642721 ecr 1023327551], length 686
01:52:40.133979 IP 10.8.1.18.33960 > 52.223.244.73.1935: Flags [.], seq 108792:110106, ack 0, win 501, options [nop,nop,TS val 2280642778 ecr 1023327551], length 1314
01:52:40.157423 IP 52.223.244.73.1935 > 10.8.1.18.33960: Flags [.], ack 105478, win 126, options [nop,nop,TS val 1023327632 ecr 2280642579], length 0
01:52:40.170925 IP 10.8.1.18.33960 > 52.223.244.73.1935: Flags [.], seq 110106:111420, ack 0, win 501, options [nop,nop,TS val 2280642815 ecr 1023327632], length 1314
01:52:40.204946 IP 10.8.1.18.33960 > 52.223.244.73.1935: Flags [.], seq 111420:112734, ack 0, win 501, options [nop,nop,TS val 2280642849 ecr 1023327632], length 1314
01:52:40.253408 IP 52.223.244.73.1935 > 10.8.1.18.33960: Flags [.], ack 108106, win 126, options [nop,nop,TS val 1023327728 ecr 2280642649], length 0
01:52:40.263053 IP 52.223.244.73.1935 > 10.8.1.18.33960: Flags [.], ack 108792, win 126, options [nop,nop,TS val 1023327737 ecr 2280642721], length 0
01:52:40.263085 IP 10.8.1.18.33960 > 52.223.244.73.1935: Flags [P.], seq 112734:113875, ack 0, win 501, options [nop,nop,TS val 2280642907 ecr 1023327737], length 1141
01:52:40.303060 IP 10.8.1.18.33960 > 52.223.244.73.1935: Flags [.], seq 113875:115189, ack 0, win 501, options [nop,nop,TS val 2280642947 ecr 1023327737], length 1314
01:52:40.337884 IP 10.8.1.18.33960 > 52.223.244.73.1935: Flags [.], seq 115189:116503, ack 0, win 501, options [nop,nop,TS val 2280642982 ecr 1023327737], length 1314
01:52:40.357083 IP 52.223.244.73.1935 > 10.8.1.18.33960: Flags [.], ack 111420, win 126, options [nop,nop,TS val 1023327831 ecr 2280642778], length 0
01:52:40.388802 IP 10.8.1.18.33960 > 52.223.244.73.1935: Flags [.], seq 116503:117817, ack 0, win 501, options [nop,nop,TS val 2280643033 ecr 1023327831], length 1314
01:52:40.438358 IP 10.8.1.18.33960 > 52.223.244.73.1935: Flags [.], seq 117817:119131, ack 0, win 501, options [nop,nop,TS val 2280643082 ecr 1023327831], length 1314
01:52:40.449023 IP 52.223.244.73.1935 > 10.8.1.18.33960: Flags [.], ack 113875, win 126, options [nop,nop,TS val 1023327923 ecr 2280642849], length 0
01:52:40.449059 IP 10.8.1.18.33960 > 52.223.244.73.1935: Flags [P.], seq 119131:119718, ack 0, win 501, options [nop,nop,TS val 2280643093 ecr 1023327923], length 587
01:52:40.502250 IP 10.8.1.18.33960 > 52.223.244.73.1935: Flags [.], seq 119718:121032, ack 0, win 501, options [nop,nop,TS val 2280643146 ecr 1023327923], length 1314
01:52:40.523936 IP 52.223.244.73.1935 > 10.8.1.18.33960: Flags [.], ack 116503, win 126, options [nop,nop,TS val 1023327998 ecr 2280642947], length 0
01:52:40.533716 IP 10.8.1.18.33960 > 52.223.244.73.1935: Flags [.], seq 121032:122346, ack 0, win 501, options [nop,nop,TS val 2280643178 ecr 1023327998], length 1314
01:52:40.568669 IP 10.8.1.18.33960 > 52.223.244.73.1935: Flags [.], seq 122346:123660, ack 0, win 501, options [nop,nop,TS val 2280643212 ecr 1023327998], length 1314
01:52:40.624406 IP 52.223.244.73.1935 > 10.8.1.18.33960: Flags [.], ack 119131, win 126, options [nop,nop,TS val 1023328099 ecr 2280643033], length 0
01:52:40.635017 IP 52.223.244.73.1935 > 10.8.1.18.33960: Flags [.], ack 119718, win 126, options [nop,nop,TS val 1023328109 ecr 2280643093], length 0
01:52:40.635050 IP 10.8.1.18.33960 > 52.223.244.73.1935: Flags [P.], seq 123660:124813, ack 0, win 501, options [nop,nop,TS val 2280643279 ecr 1023328109], length 1153
01:52:40.668787 IP 10.8.1.18.33960 > 52.223.244.73.1935: Flags [.], seq 124813:126127, ack 0, win 501, options [nop,nop,TS val 2280643313 ecr 1023328109], length 1314
01:52:40.702139 IP 10.8.1.18.33960 > 52.223.244.73.1935: Flags [.], seq 126127:127441, ack 0, win 501, options [nop,nop,TS val 2280643346 ecr 1023328109], length 1314
01:52:40.719724 IP 52.223.244.73.1935 > 10.8.1.18.33960: Flags [.], ack 122346, win 126, options [nop,nop,TS val 1023328194 ecr 2280643146], length 0
01:52:40.751698 IP 10.8.1.18.33960 > 52.223.244.73.1935: Flags [.], seq 127441:128755, ack 0, win 501, options [nop,nop,TS val 2280643396 ecr 1023328194], length 1314
01:52:40.800476 IP 10.8.1.18.33960 > 52.223.244.73.1935: Flags [.], seq 128755:130069, ack 0, win 501, options [nop,nop,TS val 2280643444 ecr 1023328194], length 1314
01:52:40.820968 IP 52.223.244.73.1935 > 10.8.1.18.33960: Flags [.], ack 124813, win 126, options [nop,nop,TS val 1023328295 ecr 2280643212], length 0
01:52:40.820981 IP 10.8.1.18.33960 > 52.223.244.73.1935: Flags [P.], seq 130069:130755, ack 0, win 501, options [nop,nop,TS val 2280643465 ecr 1023328295], length 686
01:52:40.870721 IP 10.8.1.18.33960 > 52.223.244.73.1935: Flags [.], seq 130755:132069, ack 0, win 501, options [nop,nop,TS val 2280643515 ecr 1023328295], length 1314
01:52:40.888210 IP 52.223.244.73.1935 > 10.8.1.18.33960: Flags [.], ack 127441, win 126, options [nop,nop,TS val 1023328362 ecr 2280643313], length 0
01:52:40.904829 IP 10.8.1.18.33960 > 52.223.244.73.1935: Flags [.], seq 132069:133383, ack 0, win 501, options [nop,nop,TS val 2280643549 ecr 1023328362], length 1314
01:52:40.944017 IP 10.8.1.18.33960 > 52.223.244.73.1935: Flags [.], seq 133383:134697, ack 0, win 501, options [nop,nop,TS val 2280643588 ecr 1023328362], length 1314
01:52:40.986427 IP 52.223.244.73.1935 > 10.8.1.18.33960: Flags [.], ack 130069, win 126, options [nop,nop,TS val 1023328461 ecr 2280643396], length 0
01:52:41.004547 IP 10.8.1.18.33960 > 52.223.244.73.1935: Flags [.], seq 134697:136011, ack 0, win 501, options [nop,nop,TS val 2280643648 ecr 1023328461], length 1314
01:52:41.006811 IP 52.223.244.73.1935 > 10.8.1.18.33960: Flags [.], ack 130755, win 126, options [nop,nop,TS val 1023328481 ecr 2280643465], length 0
01:52:41.006850 IP 10.8.1.18.33960 > 52.223.244.73.1935: Flags [P.], seq 136011:136594, ack 0, win 501, options [nop,nop,TS val 2280643651 ecr 1023328481], length 583
01:52:41.071587 IP 10.8.1.18.33960 > 52.223.244.73.1935: Flags [.], seq 136594:137908, ack 0, win 501, options [nop,nop,TS val 2280643715 ecr 1023328481], length 1314
01:52:41.090763 IP 52.223.244.73.1935 > 10.8.1.18.33960: Flags [.], ack 133383, win 126, options [nop,nop,TS val 1023328565 ecr 2280643515], length 0
01:52:41.103145 IP 10.8.1.18.33960 > 52.223.244.73.1935: Flags [.], seq 137908:139222, ack 0, win 501, options [nop,nop,TS val 2280643747 ecr 1023328565], length 1314
01:52:41.136712 IP 10.8.1.18.33960 > 52.223.244.73.1935: Flags [.], seq 139222:140536, ack 0, win 501, options [nop,nop,TS val 2280643781 ecr 1023328565], length 1314
01:52:41.190677 IP 52.223.244.73.1935 > 10.8.1.18.33960: Flags [.], ack 136011, win 126, options [nop,nop,TS val 1023328665 ecr 2280643588], length 0
01:52:41.192772 IP 52.223.244.73.1935 > 10.8.1.18.33960: Flags [.], ack 136594, win 126, options [nop,nop,TS val 1023328667 ecr 2280643651], length 0
01:52:41.192810 IP 10.8.1.18.33960 > 52.223.244.73.1935: Flags [P.], seq 140536:141676, ack 0, win 501, options [nop,nop,TS val 2280643837 ecr 1023328667], length 1140
01:52:41.235450 IP 10.8.1.18.33960 > 52.223.244.73.1935: Flags [.], seq 141676:142990, ack 0, win 501, options [nop,nop,TS val 2280643879 ecr 1023328667], length 1314
01:52:41.267759 IP 10.8.1.18.33960 > 52.223.244.73.1935: Flags [.], seq 142990:144304, ack 0, win 501, options [nop,nop,TS val 2280643912 ecr 1023328667], length 1314
01:52:41.289185 IP 52.223.244.73.1935 > 10.8.1.18.33960: Flags [.], ack 139222, win 126, options [nop,nop,TS val 1023328764 ecr 2280643715], length 0
01:52:41.307518 IP 10.8.1.18.33960 > 52.223.244.73.1935: Flags [.], seq 144304:145618, ack 0, win 501, options [nop,nop,TS val 2280643951 ecr 1023328764], length 1314
01:52:41.368760 IP 10.8.1.18.33960 > 52.223.244.73.1935: Flags [.], seq 145618:146932, ack 0, win 501, options [nop,nop,TS val 2280644013 ecr 1023328764], length 1314
01:52:41.378783 IP 52.223.244.73.1935 > 10.8.1.18.33960: Flags [.], ack 141676, win 126, options [nop,nop,TS val 1023328853 ecr 2280643781], length 0
01:52:41.378810 IP 10.8.1.18.33960 > 52.223.244.73.1935: Flags [P.], seq 146932:147618, ack 0, win 501, options [nop,nop,TS val 2280644023 ecr 1023328853], length 686
01:52:41.438029 IP 10.8.1.18.33960 > 52.223.244.73.1935: Flags [.], seq 147618:148932, ack 0, win 501, options [nop,nop,TS val 2280644082 ecr 1023328853], length 1314
01:52:41.453688 IP 52.223.244.73.1935 > 10.8.1.18.33960: Flags [.], ack 144304, win 126, options [nop,nop,TS val 1023328928 ecr 2280643879], length 0
01:52:41.471434 IP 10.8.1.18.33960 > 52.223.244.73.1935: Flags [.], seq 148932:150246, ack 0, win 501, options [nop,nop,TS val 2280644115 ecr 1023328928], length 1314
01:52:41.503126 IP 10.8.1.18.33960 > 52.223.244.73.1935: Flags [.], seq 150246:151560, ack 0, win 501, options [nop,nop,TS val 2280644147 ecr 1023328928], length 1314
01:52:41.554817 IP 52.223.244.73.1935 > 10.8.1.18.33960: Flags [.], ack 146932, win 126, options [nop,nop,TS val 1023329029 ecr 2280643951], length 0
01:52:41.564612 IP 52.223.244.73.1935 > 10.8.1.18.33960: Flags [.], ack 147618, win 126, options [nop,nop,TS val 1023329039 ecr 2280644023], length 0
01:52:41.564631 IP 10.8.1.18.33960 > 52.223.244.73.1935: Flags [P.], seq 151560:152713, ack 0, win 501, options [nop,nop,TS val 2280644208 ecr 1023329039], length 1153
01:52:41.600557 IP 10.8.1.18.33960 > 52.223.244.73.1935: Flags [.], seq 152713:154027, ack 0, win 501, options [nop,nop,TS val 2280644244 ecr 1023329039], length 1314
01:52:41.635835 IP 10.8.1.18.33960 > 52.223.244.73.1935: Flags [.], seq 154027:155341, ack 0, win 501, options [nop,nop,TS val 2280644280 ecr 1023329039], length 1314
01:52:41.657795 IP 52.223.244.73.1935 > 10.8.1.18.33960: Flags [.], ack 150246, win 126, options [nop,nop,TS val 1023329132 ecr 2280644082], length 0
01:52:41.691513 IP 10.8.1.18.33960 > 52.223.244.73.1935: Flags [.], seq 155341:156655, ack 0, win 501, options [nop,nop,TS val 2280644335 ecr 1023329132], length 1314
01:52:41.733962 IP 10.8.1.18.33960 > 52.223.244.73.1935: Flags [.], seq 156655:157969, ack 0, win 501, options [nop,nop,TS val 2280644378 ecr 1023329132], length 1314
01:52:41.750598 IP 52.223.244.73.1935 > 10.8.1.18.33960: Flags [.], ack 152713, win 126, options [nop,nop,TS val 1023329225 ecr 2280644147], length 0
01:52:41.750611 IP 10.8.1.18.33960 > 52.223.244.73.1935: Flags [P.], seq 157969:158556, ack 0, win 501, options [nop,nop,TS val 2280644394 ecr 1023329225], length 587
01:52:41.802515 IP 10.8.1.18.33960 > 52.223.244.73.1935: Flags [.], seq 158556:159870, ack 0, win 501, options [nop,nop,TS val 2280644446 ecr 1023329225], length 1314
01:52:41.821812 IP 52.223.244.73.1935 > 10.8.1.18.33960: Flags [.], ack 155341, win 126, options [nop,nop,TS val 1023329296 ecr 2280644244], length 0
01:52:41.838131 IP 10.8.1.18.33960 > 52.223.244.73.1935: Flags [.], seq 159870:161184, ack 0, win 501, options [nop,nop,TS val 2280644482 ecr 1023329296], length 1314
01:52:41.871419 IP 10.8.1.18.33960 > 52.223.244.73.1935: Flags [.], seq 161184:162498, ack 0, win 501, options [nop,nop,TS val 2280644515 ecr 1023329296], length 1314
01:52:41.919796 IP 52.223.244.73.1935 > 10.8.1.18.33960: Flags [.], ack 157969, win 126, options [nop,nop,TS val 1023329394 ecr 2280644335], length 0
01:52:41.934434 IP 10.8.1.18.33960 > 52.223.244.73.1935: Flags [.], seq 162498:163812, ack 0, win 501, options [nop,nop,TS val 2280644578 ecr 1023329394], length 1314
01:52:41.936380 IP 52.223.244.73.1935 > 10.8.1.18.33960: Flags [.], ack 158556, win 126, options [nop,nop,TS val 1023329411 ecr 2280644394], length 0
01:52:41.936392 IP 10.8.1.18.33960 > 52.223.244.73.1935: Flags [P.], seq 163812:164486, ack 0, win 501, options [nop,nop,TS val 2280644580 ecr 1023329411], length 674
01:52:42.000489 IP 10.8.1.18.33960 > 52.223.244.73.1935: Flags [.], seq 164486:165800, ack 0, win 501, options [nop,nop,TS val 2280644644 ecr 1023329411], length 1314
01:52:42.024221 IP 52.223.244.73.1935 > 10.8.1.18.33960: Flags [.], ack 161184, win 126, options [nop,nop,TS val 1023329499 ecr 2280644446], length 0
01:52:42.035154 IP 10.8.1.18.33960 > 52.223.244.73.1935: Flags [.], seq 165800:167114, ack 0, win 501, options [nop,nop,TS val 2280644679 ecr 1023329499], length 1314
01:52:42.067413 IP 10.8.1.18.33960 > 52.223.244.73.1935: Flags [.], seq 167114:168428, ack 0, win 501, options [nop,nop,TS val 2280644711 ecr 1023329499], length 1314
01:52:42.120493 IP 52.223.244.73.1935 > 10.8.1.18.33960: Flags [.], ack 163812, win 126, options [nop,nop,TS val 1023329595 ecr 2280644515], length 0
01:52:42.122276 IP 52.223.244.73.1935 > 10.8.1.18.33960: Flags [.], ack 164486, win 126, options [nop,nop,TS val 1023329597 ecr 2280644580], length 0
01:52:42.122310 IP 10.8.1.18.33960 > 52.223.244.73.1935: Flags [P.], seq 168428:169581, ack 0, win 501, options [nop,nop,TS val 2280644766 ecr 1023329597], length 1153
01:52:42.169686 IP 10.8.1.18.33960 > 52.223.244.73.1935: Flags [.], seq 169581:170895, ack 0, win 501, options [nop,nop,TS val 2280644814 ecr 1023329597], length 1314
01:52:42.203189 IP 10.8.1.18.33960 > 52.223.244.73.1935: Flags [.], seq 170895:172209, ack 0, win 501, options [nop,nop,TS val 2280644847 ecr 1023329597], length 1314
01:52:42.221307 IP 52.223.244.73.1935 > 10.8.1.18.33960: Flags [.], ack 167114, win 126, options [nop,nop,TS val 1023329695 ecr 2280644644], length 0
01:52:42.246224 IP 10.8.1.18.33960 > 52.223.244.73.1935: Flags [.], seq 172209:173523, ack 0, win 501, options [nop,nop,TS val 2280644890 ecr 1023329695], length 1314
01:52:42.303111 IP 10.8.1.18.33960 > 52.223.244.73.1935: Flags [.], seq 173523:174837, ack 0, win 501, options [nop,nop,TS val 2280644947 ecr 1023329695], length 1314
01:52:42.308411 IP 52.223.244.73.1935 > 10.8.1.18.33960: Flags [.], ack 169581, win 126, options [nop,nop,TS val 1023329783 ecr 2280644711], length 0
01:52:42.308433 IP 10.8.1.18.33960 > 52.223.244.73.1935: Flags [P.], seq 174837:175428, ack 0, win 501, options [nop,nop,TS val 2280644952 ecr 1023329783], length 591
01:52:42.371400 IP 10.8.1.18.33960 > 52.223.244.73.1935: Flags [.], seq 175428:176742, ack 0, win 501, options [nop,nop,TS val 2280645015 ecr 1023329783], length 1314
01:52:42.389275 IP 52.223.244.73.1935 > 10.8.1.18.33960: Flags [.], ack 172209, win 126, options [nop,nop,TS val 1023329864 ecr 2280644814], length 0
01:52:42.404558 IP 10.8.1.18.33960 > 52.223.244.73.1935: Flags [.], seq 176742:178056, ack 0, win 501, options [nop,nop,TS val 2280645048 ecr 1023329864], length 1314
01:52:42.435399 IP 10.8.1.18.33960 > 52.223.244.73.1935: Flags [.], seq 178056:179370, ack 0, win 501, options [nop,nop,TS val 2280645079 ecr 1023329864], length 1314
01:52:42.489087 IP 52.223.244.73.1935 > 10.8.1.18.33960: Flags [.], ack 174837, win 126, options [nop,nop,TS val 1023329963 ecr 2280644890], length 0
01:52:42.494234 IP 52.223.244.73.1935 > 10.8.1.18.33960: Flags [.], ack 175428, win 126, options [nop,nop,TS val 1023329969 ecr 2280644952], length 0
01:52:42.494252 IP 10.8.1.18.33960 > 52.223.244.73.1935: Flags [P.], seq 179370:180522, ack 0, win 501, options [nop,nop,TS val 2280645138 ecr 1023329969], length 1152
01:52:42.538155 IP 10.8.1.18.33960 > 52.223.244.73.1935: Flags [.], seq 180522:181836, ack 0, win 501, options [nop,nop,TS val 2280645182 ecr 1023329969], length 1314
01:52:42.571393 IP 10.8.1.18.33960 > 52.223.244.73.1935: Flags [.], seq 181836:183150, ack 0, win 501, options [nop,nop,TS val 2280645215 ecr 1023329969], length 1314
01:52:42.590661 IP 52.223.244.73.1935 > 10.8.1.18.33960: Flags [.], ack 178056, win 126, options [nop,nop,TS val 1023330065 ecr 2280645015], length 0
01:52:42.610101 IP 10.8.1.18.33960 > 52.223.244.73.1935: Flags [.], seq 183150:184464, ack 0, win 501, options [nop,nop,TS val 2280645254 ecr 1023330065], length 1314
01:52:42.671261 IP 10.8.1.18.33960 > 52.223.244.73.1935: Flags [.], seq 184464:185778, ack 0, win 501, options [nop,nop,TS val 2280645315 ecr 1023330065], length 1314
01:52:42.680028 IP 52.223.244.73.1935 > 10.8.1.18.33960: Flags [.], ack 180522, win 126, options [nop,nop,TS val 1023330154 ecr 2280645079], length 0
01:52:42.680072 IP 10.8.1.18.33960 > 52.223.244.73.1935: Flags [P.], seq 185778:186452, ack 0, win 501, options [nop,nop,TS val 2280645324 ecr 1023330154], length 674
01:52:42.734182 IP 10.8.1.18.33960 > 52.223.244.73.1935: Flags [.], seq 186452:187766, ack 0, win 501, options [nop,nop,TS val 2280645378 ecr 1023330154], length 1314
01:52:42.757482 IP 52.223.244.73.1935 > 10.8.1.18.33960: Flags [.], ack 183150, win 126, options [nop,nop,TS val 1023330232 ecr 2280645182], length 0
01:52:42.770171 IP 10.8.1.18.33960 > 52.223.244.73.1935: Flags [.], seq 187766:189080, ack 0, win 501, options [nop,nop,TS val 2280645414 ecr 1023330232], length 1314
01:52:42.802060 IP 10.8.1.18.33960 > 52.223.244.73.1935: Flags [.], seq 189080:190394, ack 0, win 501, options [nop,nop,TS val 2280645446 ecr 1023330232], length 1314
01:52:42.857327 IP 52.223.244.73.1935 > 10.8.1.18.33960: Flags [.], ack 185778, win 126, options [nop,nop,TS val 1023330332 ecr 2280645254], length 0
01:52:42.866043 IP 52.223.244.73.1935 > 10.8.1.18.33960: Flags [.], ack 186452, win 126, options [nop,nop,TS val 1023330340 ecr 2280645324], length 0
01:52:42.866077 IP 10.8.1.18.33960 > 52.223.244.73.1935: Flags [P.], seq 190394:191539, ack 0, win 501, options [nop,nop,TS val 2280645510 ecr 1023330340], length 1145
01:52:42.904524 IP 10.8.1.18.33960 > 52.223.244.73.1935: Flags [.], seq 191539:192853, ack 0, win 501, options [nop,nop,TS val 2280645548 ecr 1023330340], length 1314
01:52:42.937908 IP 10.8.1.18.33960 > 52.223.244.73.1935: Flags [.], seq 192853:194167, ack 0, win 501, options [nop,nop,TS val 2280645582 ecr 1023330340], length 1314
01:52:42.956320 IP 52.223.244.73.1935 > 10.8.1.18.33960: Flags [.], ack 189080, win 126, options [nop,nop,TS val 1023330431 ecr 2280645378], length 0
01:52:42.994314 IP 10.8.1.18.33960 > 52.223.244.73.1935: Flags [.], seq 194167:195481, ack 0, win 501, options [nop,nop,TS val 2280645638 ecr 1023330431], length 1314
01:52:43.036826 IP 10.8.1.18.33960 > 52.223.244.73.1935: Flags [.], seq 195481:196795, ack 0, win 501, options [nop,nop,TS val 2280645681 ecr 1023330431], length 1314
01:52:43.052051 IP 52.223.244.73.1935 > 10.8.1.18.33960: Flags [.], ack 191539, win 126, options [nop,nop,TS val 1023330526 ecr 2280645446], length 0
01:52:43.052063 IP 10.8.1.18.33960 > 52.223.244.73.1935: Flags [P.], seq 196795:197386, ack 0, win 501, options [nop,nop,TS val 2280645696 ecr 1023330526], length 591
