21:01:08.015376 IP 10.8.3.2.36682 > 99.181.80.6.1935: Flags [.], seq 1611647714:1611649028, ack 750513667, win 501, options [nop,nop,TS val 862452909 ecr 1773609388], length 1314
21:01:08.049637 IP 10.8.3.2.36682 > 99.181.80.6.1935: Flags [.], seq 1314:2628, ack 1, win 501, options [nop,nop,TS val 862452943 ecr 1773609388], length 1314
21:01:08.053973 IP 99.181.80.6.1935 > 10.8.3.2.36682: Flags [.], ack 4294960972, win 126, options [nop,nop,TS val 1773609460 ecr 862452609], length 0
21:01:08.088616 IP 10.8.3.2.36682 > 99.181.80.6.1935: Flags [.], seq 2628:3942, ack 1, win 501, options [nop,nop,TS val 862452982 ecr 1773609460], length 1314
21:01:08.149550 IP 10.8.3.2.36682 > 99.181.80.6.1935: Flags [.], seq 3942:5256, ack 1, win 501, options [nop,nop,TS val 862453043 ecr 1773609460], length 1314
21:01:08.155780 IP 99.181.80.6.1935 > 10.8.3.2.36682: Flags [.], ack 4294963600, win 126, options [nop,nop,TS val 1773609563 ecr 862452683], length 0
21:01:08.184111 IP 10.8.3.2.36682 > 99.181.80.6.1935: Flags [.], seq 5256:6570, ack 1, win 501, options [nop,nop,TS val 862453077 ecr 1773609563], length 1314
21:01:08.219070 IP 10.8.3.2.36682 > 99.181.80.6.1935: Flags [.], seq 6570:7884, ack 1, win 501, options [nop,nop,TS val 862453112 ecr 1773609563], length 1314
21:01:08.225257 IP 99.181.80.6.1935 > 10.8.3.2.36682: Flags [.], ack 4294966228, win 126, options [nop,nop,TS val 1773609632 ecr 862452776], length 0
21:01:08.281299 IP 10.8.3.2.36682 > 99.181.80.6.1935: Flags [.], seq 7884:9198, ack 1, win 501, options [nop,nop,TS val 862453175 ecr 1773609632], length 1314
21:01:08.288129 IP 99.181.80.6.1935 > 10.8.3.2.36682: Flags [.], ack 0, win 126, options [nop,nop,TS val 1773609695 ecr 862452875], length 0
21:01:08.288145 IP 10.8.3.2.36682 > 99.181.80.6.1935: Flags [P.], seq 9198:9903, ack 1, win 501, options [nop,nop,TS val 862453181 ecr 1773609695], length 705
21:01:08.348672 IP 10.8.3.2.36682 > 99.181.80.6.1935: Flags [.], seq 9903:11217, ack 1, win 501, options [nop,nop,TS val 862453242 ecr 1773609695], length 1314
21:01:08.355730 IP 99.181.80.6.1935 > 10.8.3.2.36682: Flags [.], ack 2628, win 126, options [nop,nop,TS val 1773609763 ecr 862452909], length 0
21:01:08.382424 IP 10.8.3.2.36682 > 99.181.80.6.1935: Flags [.], seq 11217:12531, ack 1, win 501, options [nop,nop,TS val 862453276 ecr 1773609763], length 1314
21:01:08.418538 IP 10.8.3.2.36682 > 99.181.80.6.1935: Flags [.], seq 12531:13845, ack 1, win 501, options [nop,nop,TS val 862453312 ecr 1773609763], length 1314
21:01:08.456549 IP 99.181.80.6.1935 > 10.8.3.2.36682: Flags [.], ack 5256, win 126, options [nop,nop,TS val 1773609864 ecr 862452982], length 0
21:01:08.481852 IP 10.8.3.2.36682 > 99.181.80.6.1935: Flags [.], seq 13845:15159, ack 1, win 501, options [nop,nop,TS val 862453375 ecr 1773609864], length 1314
21:01:08.514845 IP 10.8.3.2.36682 > 99.181.80.6.1935: Flags [.], seq 15159:16473, ack 1, win 501, options [nop,nop,TS val 862453408 ecr 1773609864], length 1314
21:01:08.525197 IP 99.181.80.6.1935 > 10.8.3.2.36682: Flags [.], ack 7884, win 126, options [nop,nop,TS val 1773609932 ecr 862453077], length 0
21:01:08.548276 IP 10.8.3.2.36682 > 99.181.80.6.1935: Flags [.], seq 16473:17787, ack 1, win 501, options [nop,nop,TS val 862453442 ecr 1773609932], length 1314
21:01:08.593941 IP 99.181.80.6.1935 > 10.8.3.2.36682: Flags [.], ack 9903, win 126, options [nop,nop,TS val 1773610001 ecr 862453175], length 0
21:01:08.593967 IP 10.8.3.2.36682 > 99.181.80.6.1935: Flags [P.], seq 17787:18848, ack 1, win 501, options [nop,nop,TS val 862453487 ecr 1773610001], length 1061
21:01:08.649610 IP 10.8.3.2.36682 > 99.181.80.6.1935: Flags [.], seq 18848:20162, ack 1, win 501, options [nop,nop,TS val 862453543 ecr 1773610001], length 1314
21:01:08.684243 IP 10.8.3.2.36682 > 99.181.80.6.1935: Flags [.], seq 20162:21476, ack 1, win 501, options [nop,nop,TS val 862453578 ecr 1773610001], length 1314
21:01:08.688835 IP 99.181.80.6.1935 > 10.8.3.2.36682: Flags [.], ack 12531, win 126, options [nop,nop,TS val 1773610096 ecr 862453242], length 0
21:01:08.719114 IP 10.8.3.2.36682 > 99.181.80.6.1935: Flags [.], seq 21476:22790, ack 1, win 501, options [nop,nop,TS val 862453612 ecr 1773610096], length 1314
21:01:08.784041 IP 10.8.3.2.36682 > 99.181.80.6.1935: Flags [.], seq 22790:24104, ack 1, win 501, options [nop,nop,TS val 862453677 ecr 1773610096], length 1314
21:01:08.789014 IP 99.181.80.6.1935 > 10.8.3.2.36682: Flags [.], ack 15159, win 126, options [nop,nop,TS val 1773610195 ecr 862453312], length 0
21:01:08.813617 IP 10.8.3.2.36682 > 99.181.80.6.1935: Flags [.], seq 24104:25418, ack 1, win 501, options [nop,nop,TS val 862453707 ecr 1773610195], length 1314
21:01:08.848904 IP 10.8.3.2.36682 > 99.181.80.6.1935: Flags [.], seq 25418:26732, ack 1, win 501, options [nop,nop,TS val 862453742 ecr 1773610195], length 1314
21:01:08.855521 IP 99.181.80.6.1935 > 10.8.3.2.36682: Flags [.], ack 17787, win 126, options [nop,nop,TS val 1773610261 ecr 862453408], length 0
21:01:08.901141 IP 99.181.80.6.1935 > 10.8.3.2.36682: Flags [.], ack 18848, win 126, options [nop,nop,TS val 1773610307 ecr 862453487], length 0
21:01:08.901155 IP 10.8.3.2.36682 > 99.181.80.6.1935: Flags [P.], seq 26732:27904, ack 1, win 501, options [nop,nop,TS val 862453794 ecr 1773610307], length 1172
21:01:08.952458 IP 10.8.3.2.36682 > 99.181.80.6.1935: Flags [.], seq 27904:29218, ack 1, win 501, options [nop,nop,TS val 862453846 ecr 1773610307], length 1314
21:01:08.984142 IP 10.8.3.2.36682 > 99.181.80.6.1935: Flags [.], seq 29218:30532, ack 1, win 501, options [nop,nop,TS val 862453877 ecr 1773610307], length 1314
21:01:08.990312 IP 99.181.80.6.1935 > 10.8.3.2.36682: Flags [.], ack 21476, win 126, options [nop,nop,TS val 1773610397 ecr 862453543], length 0
21:01:09.026827 IP 10.8.3.2.36682 > 99.181.80.6.1935: Flags [.], seq 30532:31846, ack 1, win 501, options [nop,nop,TS val 862453920 ecr 1773610397], length 1314
21:01:09.086853 IP 10.8.3.2.36682 > 99.181.80.6.1935: Flags [.], seq 31846:33160, ack 1, win 501, options [nop,nop,TS val 862453980 ecr 1773610397], length 1314
21:01:09.090321 IP 99.181.80.6.1935 > 10.8.3.2.36682: Flags [.], ack 24104, win 126, options [nop,nop,TS val 1773610497 ecr 862453612], length 0
21:01:09.118446 IP 10.8.3.2.36682 > 99.181.80.6.1935: Flags [.], seq 33160:34474, ack 1, win 501, options [nop,nop,TS val 862454012 ecr 1773610497], length 1314
21:01:09.154569 IP 10.8.3.2.36682 > 99.181.80.6.1935: Flags [.], seq 34474:35788, ack 1, win 501, options [nop,nop,TS val 862454048 ecr 1773610497], length 1314
21:01:09.154929 IP 99.181.80.6.1935 > 10.8.3.2.36682: Flags [.], ack 26732, win 126, options [nop,nop,TS val 1773610562 ecr 862453707], length 0
21:01:09.207262 IP 99.181.80.6.1935 > 10.8.3.2.36682: Flags [.], ack 27904, win 126, options [nop,nop,TS val 1773610614 ecr 862453794], length 0
21:01:09.207292 IP 10.8.3.2.36682 > 99.181.80.6.1935: Flags [P.], seq 35788:36857, ack 1, win 501, options [nop,nop,TS val 862454101 ecr 1773610614], length 1069
21:01:09.255840 IP 10.8.3.2.36682 > 99.181.80.6.1935: Flags [.], seq 36857:38171, ack 1, win 501, options [nop,nop,TS val 862454149 ecr 1773610614], length 1314
21:01:09.282977 IP 10.8.3.2.36682 > 99.181.80.6.1935: Flags [.], seq 38171:39485, ack 1, win 501, options [nop,nop,TS val 862454176 ecr 1773610614], length 1314
21:01:09.290252 IP 99.181.80.6.1935 > 10.8.3.2.36682: Flags [.], ack 30532, win 126, options [nop,nop,TS val 1773610697 ecr 862453846], length 0
21:01:09.325782 IP 10.8.3.2.36682 > 99.181.80.6.1935: Flags [.], seq 39485:40799, ack 1, win 501, options [nop,nop,TS val 862454219 ecr 1773610697], length 1314
21:01:09.386364 IP 10.8.3.2.36682 > 99.181.80.6.1935: Flags [.], seq 40799:42113, ack 1, win 501, options [nop,nop,TS val 862454280 ecr 1773610697], length 1314
21:01:09.392923 IP 99.181.80.6.1935 > 10.8.3.2.36682: Flags [.], ack 33160, win 126, options [nop,nop,TS val 1773610800 ecr 862453920], length 0
21:01:09.416392 IP 10.8.3.2.36682 > 99.181.80.6.1935: Flags [.], seq 42113:43427, ack 1, win 501, options [nop,nop,TS val 862454310 ecr 1773610800], length 1314
21:01:09.453520 IP 10.8.3.2.36682 > 99.181.80.6.1935: Flags [.], seq 43427:44741, ack 1, win 501, options [nop,nop,TS val 862454347 ecr 1773610800], length 1314
21:01:09.460423 IP 99.181.80.6.1935 > 10.8.3.2.36682: Flags [.], ack 35788, win 126, options [nop,nop,TS val 1773610868 ecr 862454012], length 0
21:01:09.513597 IP 99.181.80.6.1935 > 10.8.3.2.36682: Flags [.], ack 36857, win 126, options [nop,nop,TS val 1773610920 ecr 862454101], length 0
21:01:09.513662 IP 10.8.3.2.36682 > 99.181.80.6.1935: Flags [P.], seq 44741:45806, ack 1, win 501, options [nop,nop,TS val 862454407 ecr 1773610920], length 1065
21:01:09.552066 IP 10.8.3.2.36682 > 99.181.80.6.1935: Flags [.], seq 45806:47120, ack 1, win 501, options [nop,nop,TS val 862454445 ecr 1773610920], length 1314
21:01:09.582483 IP 10.8.3.2.36682 > 99.181.80.6.1935: Flags [.], seq 47120:48434, ack 1, win 501, options [nop,nop,TS val 862454476 ecr 1773610920], length 1314
21:01:09.590123 IP 99.181.80.6.1935 > 10.8.3.2.36682: Flags [.], ack 39485, win 126, options [nop,nop,TS val 1773610996 ecr 862454149], length 0
21:01:09.625174 IP 10.8.3.2.36682 > 99.181.80.6.1935: Flags [.], seq 48434:49748, ack 1, win 501, options [nop,nop,TS val 862454518 ecr 1773610996], length 1314
21:01:09.686518 IP 10.8.3.2.36682 > 99.181.80.6.1935: Flags [.], seq 49748:51062, ack 1, win 501, options [nop,nop,TS val 862454580 ecr 1773610996], length 1314
21:01:09.693598 IP 99.181.80.6.1935 > 10.8.3.2.36682: Flags [.], ack 42113, win 126, options [nop,nop,TS val 1773611099 ecr 862454219], length 0
21:01:09.718916 IP 10.8.3.2.36682 > 99.181.80.6.1935: Flags [.], seq 51062:52376, ack 1, win 501, options [nop,nop,TS val 862454612 ecr 1773611099], length 1314
21:01:09.753396 IP 10.8.3.2.36682 > 99.181.80.6.1935: Flags [.], seq 52376:53690, ack 1, win 501, options [nop,nop,TS val 862454647 ecr 1773611099], length 1314
21:01:09.760807 IP 99.181.80.6.1935 > 10.8.3.2.36682: Flags [.], ack 44741, win 126, options [nop,nop,TS val 1773611167 ecr 862454310], length 0
21:01:09.817119 IP 10.8.3.2.36682 > 99.181.80.6.1935: Flags [.], seq 53690:55004, ack 1, win 501, options [nop,nop,TS val 862454710 ecr 1773611167], length 1314
21:01:09.819510 IP 99.181.80.6.1935 > 10.8.3.2.36682: Flags [.], ack 45806, win 126, options [nop,nop,TS val 1773611227 ecr 862454407], length 0
21:01:09.819522 IP 10.8.3.2.36682 > 99.181.80.6.1935: Flags [P.], seq 55004:55710, ack 1, win 501, options [nop,nop,TS val 862454713 ecr 1773611227], length 706
21:01:09.881178 IP 10.8.3.2.36682 > 99.181.80.6.1935: Flags [.], seq 55710:57024, ack 1, win 501, options [nop,nop,TS val 862454774 ecr 1773611227], length 1314
21:01:09.888723 IP 99.181.80.6.1935 > 10.8.3.2.36682: Flags [.], ack 48434, win 126, options [nop,nop,TS val 1773611296 ecr 862454445], length 0
21:01:09.919354 IP 10.8.3.2.36682 > 99.181.80.6.1935: Flags [.], seq 57024:58338, ack 1, win 501, options [nop,nop,TS val 862454813 ecr 1773611296], length 1314
21:01:09.952430 IP 10.8.3.2.36682 > 99.181.80.6.1935: Flags [.], seq 58338:59652, ack 1, win 501, options [nop,nop,TS val 862454846 ecr 1773611296], length 1314
21:01:09.995598 IP 99.181.80.6.1935 > 10.8.3.2.36682: Flags [.], ack 51062, win 126, options [nop,nop,TS val 1773611400 ecr 862454518], length 0
21:01:10.016059 IP 10.8.3.2.36682 > 99.181.80.6.1935: Flags [.], seq 59652:60966, ack 1, win 501, options [nop,nop,TS val 862454909 ecr 1773611400], length 1314
21:01:10.052355 IP 10.8.3.2.36682 > 99.181.80.6.1935: Flags [.], seq 60966:62280, ack 1, win 501, options [nop,nop,TS val 862454946 ecr 1773611400], length 1314
21:01:10.059858 IP 99.181.80.6.1935 > 10.8.3.2.36682: Flags [.], ack 53690, win 126, options [nop,nop,TS val 1773611467 ecr 862454612], length 0
21:01:10.085744 IP 10.8.3.2.36682 > 99.181.80.6.1935: Flags [.], seq 62280:63594, ack 1, win 501, options [nop,nop,TS val 862454979 ecr 1773611467], length 1314
21:01:10.125524 IP 99.181.80.6.1935 > 10.8.3.2.36682: Flags [.], ack 55710, win 126, options [nop,nop,TS val 1773611532 ecr 862454710], length 0
21:01:10.125563 IP 10.8.3.2.36682 > 99.181.80.6.1935: Flags [P.], seq 63594:64659, ack 1, win 501, options [nop,nop,TS val 862455019 ecr 1773611532], length 1065
21:01:10.184161 IP 10.8.3.2.36682 > 99.181.80.6.1935: Flags [.], seq 64659:65973, ack 1, win 501, options [nop,nop,TS val 862455077 ecr 1773611532], length 1314
21:01:10.215007 IP 10.8.3.2.36682 > 99.181.80.6.1935: Flags [.], seq 65973:67287, ack 1, win 501, options [nop,nop,TS val 862455108 ecr 1773611532], length 1314
21:01:10.225831 IP 99.181.80.6.1935 > 10.8.3.2.36682: Flags [.], ack 58338, win 126, options [nop,nop,TS val 1773611633 ecr 862454774], length 0
21:01:10.249809 IP 10.8.3.2.36682 > 99.181.80.6.1935: Flags [.], seq 67287:68601, ack 1, win 501, options [nop,nop,TS val 862455143 ecr 1773611633], length 1314
21:01:10.319437 IP 10.8.3.2.36682 > 99.181.80.6.1935: Flags [.], seq 68601:69915, ack 1, win 501, options [nop,nop,TS val 862455213 ecr 1773611633], length 1314
21:01:10.322446 IP 99.181.80.6.1935 > 10.8.3.2.36682: Flags [.], ack 60966, win 126, options [nop,nop,TS val 1773611730 ecr 862454846], length 0
21:01:10.352346 IP 10.8.3.2.36682 > 99.181.80.6.1935: Flags [.], seq 69915:71229, ack 1, win 501, options [nop,nop,TS val 862455246 ecr 1773611730], length 1314
21:01:10.385819 IP 10.8.3.2.36682 > 99.181.80.6.1935: Flags [.], seq 71229:72543, ack 1, win 501, options [nop,nop,TS val 862455279 ecr 1773611730], length 1314
21:01:10.391887 IP 99.181.80.6.1935 > 10.8.3.2.36682: Flags [.], ack 63594, win 126, options [nop,nop,TS val 1773611799 ecr 862454946], length 0
21:01:10.431863 IP 99.181.80.6.1935 > 10.8.3.2.36682: Flags [.], ack 64659, win 126, options [nop,nop,TS val 1773611839 ecr 862455019], length 0
21:01:10.431901 IP 10.8.3.2.36682 > 99.181.80.6.1935: Flags [P.], seq 72543:73616, ack 1, win 501, options [nop,nop,TS val 862455325 ecr 1773611839], length 1073
21:01:10.481689 IP 10.8.3.2.36682 > 99.181.80.6.1935: Flags [.], seq 73616:74930, ack 1, win 501, options [nop,nop,TS val 862455375 ecr 1773611839], length 1314
21:01:10.515155 IP 10.8.3.2.36682 > 99.181.80.6.1935: Flags [.], seq 74930:76244, ack 1, win 501, options [nop,nop,TS val 862455408 ecr 1773611839], length 1314
21:01:10.523552 IP 99.181.80.6.1935 > 10.8.3.2.36682: Flags [.], ack 67287, win 126, options [nop,nop,TS val 1773611928 ecr 862455077], length 0
21:01:10.551555 IP 10.8.3.2.36682 > 99.181.80.6.1935: Flags [.], seq 76244:77558, ack 1, win 501, options [nop,nop,TS val 862455445 ecr 1773611928], length 1314
21:01:10.619020 IP 10.8.3.2.36682 > 99.181.80.6.1935: Flags [.], seq 77558:78872, ack 1, win 501, options [nop,nop,TS val 862455512 ecr 1773611928], length 1314
21:01:10.626638 IP 99.181.80.6.1935 > 10.8.3.2.36682: Flags [.], ack 69915, win 126, options [nop,nop,TS val 1773612033 ecr 862455143], length 0
21:01:10.649482 IP 10.8.3.2.36682 > 99.181.80.6.1935: Flags [.], seq 78872:80186, ack 1, win 501, options [nop,nop,TS val 862455543 ecr 1773612033], length 1314
21:01:10.684449 IP 10.8.3.2.36682 > 99.181.80.6.1935: Flags [.], seq 80186:81500, ack 1, win 501, options [nop,nop,TS val 862455578 ecr 1773612033], length 1314
21:01:10.692636 IP 99.181.80.6.1935 > 10.8.3.2.36682: Flags [.], ack 72543, win 126, options [nop,nop,TS val 1773612099 ecr 862455246], length 0
21:01:10.738241 IP 99.181.80.6.1935 > 10.8.3.2.36682: Flags [.], ack 73616, win 126, options [nop,nop,TS val 1773612145 ecr 862455325], length 0
21:01:10.738272 IP 10.8.3.2.36682 > 99.181.80.6.1935: Flags [P.], seq 81500:82668, ack 1, win 501, options [nop,nop,TS val 862455632 ecr 1773612145], length 1168
21:01:10.783897 IP 10.8.3.2.36682 > 99.181.80.6.1935: Flags [.], seq 82668:83982, ack 1, win 501, options [nop,nop,TS val 862455677 ecr 1773612145], length 1314
21:01:10.817809 IP 10.8.3.2.36682 > 99.181.80.6.1935: Flags [.], seq 83982:85296, ack 1, win 501, options [nop,nop,TS val 862455711 ecr 1773612145], length 1314
21:01:10.821062 IP 99.181.80.6.1935 > 10.8.3.2.36682: Flags [.], ack 76244, win 126, options [nop,nop,TS val 1773612228 ecr 862455375], length 0
21:01:10.866126 IP 10.8.3.2.36682 > 99.181.80.6.1935: Flags [.], seq 85296:86610, ack 1, win 501, options [nop,nop,TS val 862455759 ecr 1773612228], length 1314
21:01:10.917227 IP 10.8.3.2.36682 > 99.181.80.6.1935: Flags [.], seq 86610:87924, ack 1, win 501, options [nop,nop,TS val 862455811 ecr 1773612228], length 1314
21:01:10.925044 IP 99.181.80.6.1935 > 10.8.3.2.36682: Flags [.], ack 78872, win 126, options [nop,nop,TS val 1773612332 ecr 862455445], length 0
21:01:10.951622 IP 10.8.3.2.36682 > 99.181.80.6.1935: Flags [.], seq 87924:89238, ack 1, win 501, options [nop,nop,TS val 862455845 ecr 1773612332], length 1314
21:01:10.990501 IP 99.181.80.6.1935 > 10.8.3.2.36682: Flags [.], ack 81500, win 126, options [nop,nop,TS val 1773612398 ecr 862455543], length 0
21:01:10.994597 IP 10.8.3.2.36682 > 99.181.80.6.1935: Flags [.], seq 89238:90552, ack 1, win 501, options [nop,nop,TS val 862455888 ecr 1773612398], length 1314
21:01:11.045238 IP 99.181.80.6.1935 > 10.8.3.2.36682: Flags [.], ack 82668, win 126, options [nop,nop,TS val 1773612452 ecr 862455632], length 0
21:01:11.045257 IP 10.8.3.2.36682 > 99.181.80.6.1935: Flags [P.], seq 90552:91612, ack 1, win 501, options [nop,nop,TS val 862455939 ecr 1773612452], length 1060
21:01:11.084359 IP 10.8.3.2.36682 > 99.181.80.6.1935: Flags [.], seq 91612:92926, ack 1, win 501, options [nop,nop,TS val 862455978 ecr 1773612452], length 1314
21:01:11.119250 IP 10.8.3.2.36682 > 99.181.80.6.1935: Flags [.], seq 92926:94240, ack 1, win 501, options [nop,nop,TS val 862456013 ecr 1773612452], length 1314
21:01:11.125068 IP 99.181.80.6.1935 > 10.8.3.2.36682: Flags [.], ack 85296, win 126, options [nop,nop,TS val 1773612531 ecr 862455677], length 0
21:01:11.166023 IP 10.8.3.2.36682 > 99.181.80.6.1935: Flags [.], seq 94240:95554, ack 1, win 501, options [nop,nop,TS val 862456059 ecr 1773612531], length 1314
21:01:11.208731 IP 10.8.3.2.36682 > 99.181.80.6.1935: Flags [.], seq 95554:96868, ack 1, win 501, options [nop,nop,TS val 862456102 ecr 1773612531], length 1314
21:01:11.224695 IP 99.181.80.6.1935 > 10.8.3.2.36682: Flags [.], ack 87924, win 126, options [nop,nop,TS val 1773612630 ecr 862455759], length 0
21:01:11.251667 IP 10.8.3.2.36682 > 99.181.80.6.1935: Flags [.], seq 96868:98182, ack 1, win 501, options [nop,nop,TS val 862456145 ecr 1773612630], length 1314
21:01:11.286816 IP 10.8.3.2.36682 > 99.181.80.6.1935: Flags [.], seq 98182:99496, ack 1, win 501, options [nop,nop,TS val 862456180 ecr 1773612630], length 1314
21:01:11.301140 IP 99.181.80.6.1935 > 10.8.3.2.36682: Flags [.], ack 90552, win 126, options [nop,nop,TS val 1773612708 ecr 862455845], length 0
21:01:11.337557 IP 10.8.3.2.36682 > 99.181.80.6.1935: Flags [.], seq 99496:100810, ack 1, win 501, options [nop,nop,TS val 862456231 ecr 1773612708], length 1314
21:01:11.351261 IP 99.181.80.6.1935 > 10.8.3.2.36682: Flags [.], ack 91612, win 126, options [nop,nop,TS val 1773612758 ecr 862455939], length 0
21:01:11.351296 IP 10.8.3.2.36682 > 99.181.80.6.1935: Flags [P.], seq 100810:101420, ack 1, win 501, options [nop,nop,TS val 862456245 ecr 1773612758], length 610
21:01:11.401611 IP 10.8.3.2.36682 > 99.181.80.6.1935: Flags [.], seq 101420:102734, ack 1, win 501, options [nop,nop,TS val 862456295 ecr 1773612758], length 1314
21:01:11.425693 IP 99.181.80.6.1935 > 10.8.3.2.36682: Flags [.], ack 94240, win 126, options [nop,nop,TS val 1773612833 ecr 862455978], length 0
21:01:11.444400 IP 10.8.3.2.36682 > 99.181.80.6.1935: Flags [.], seq 102734:104048, ack 1, win 501, options [nop,nop,TS val 862456338 ecr 1773612833], length 1314
21:01:11.465844 IP 10.8.3.2.36682 > 99.181.80.6.1935: Flags [.], seq 104048:105362, ack 1, win 501, options [nop,nop,TS val 862456359 ecr 1773612833], length 1314
21:01:11.514918 IP 99.181.80.6.1935 > 10.8.3.2.36682: Flags [.], ack 96868, win 126, options [nop,nop,TS val 1773612922 ecr 862456059], length 0
21:01:11.551575 IP 10.8.3.2.36682 > 99.181.80.6.1935: Flags [.], seq 105362:106676, ack 1, win 501, options [nop,nop,TS val 862456445 ecr 1773612922], length 1314
21:01:11.573020 IP 10.8.3.2.36682 > 99.181.80.6.1935: Flags [.], seq 106676:107990, ack 1, win 501, options [nop,nop,TS val 862456466 ecr 1773612922], length 1314
21:01:11.592939 IP 99.181.80.6.1935 > 10.8.3.2.36682: Flags [.], ack 99496, win 126, options [nop,nop,TS val 1773613000 ecr 862456145], length 0
21:01:11.615804 IP 10.8.3.2.36682 > 99.181.80.6.1935: Flags [.], seq 107990:109304, ack 1, win 501, options [nop,nop,TS val 862456509 ecr 1773613000], length 1314
21:01:11.657329 IP 99.181.80.6.1935 > 10.8.3.2.36682: Flags [.], ack 101420, win 126, options [nop,nop,TS val 1773613064 ecr 862456231], length 0
21:01:11.657366 IP 10.8.3.2.36682 > 99.181.80.6.1935: Flags [P.], seq 109304:110469, ack 1, win 501, options [nop,nop,TS val 862456551 ecr 1773613064], length 1165
21:01:11.701496 IP 10.8.3.2.36682 > 99.181.80.6.1935: Flags [.], seq 110469:111783, ack 1, win 501, options [nop,nop,TS val 862456595 ecr 1773613064], length 1314
21:01:11.744260 IP 10.8.3.2.36682 > 99.181.80.6.1935: Flags [.], seq 111783:113097, ack 1, win 501, options [nop,nop,TS val 862456638 ecr 1773613064], length 1314
21:01:11.751708 IP 99.181.80.6.1935 > 10.8.3.2.36682: Flags [.], ack 104048, win 126, options [nop,nop,TS val 1773613158 ecr 862456295], length 0
21:01:11.785857 IP 10.8.3.2.36682 > 99.181.80.6.1935: Flags [.], seq 113097:114411, ack 1, win 501, options [nop,nop,TS val 862456679 ecr 1773613158], length 1314
21:01:11.833723 IP 99.181.80.6.1935 > 10.8.3.2.36682: Flags [.], ack 105362, win 126, options [nop,nop,TS val 1773613239 ecr 862456359], length 0
21:01:11.851204 IP 10.8.3.2.36682 > 99.181.80.6.1935: Flags [.], seq 114411:115725, ack 1, win 501, options [nop,nop,TS val 862456745 ecr 1773613239], length 1314
21:01:11.872755 IP 10.8.3.2.36682 > 99.181.80.6.1935: Flags [.], seq 115725:117039, ack 1, win 501, options [nop,nop,TS val 862456766 ecr 1773613239], length 1314
21:01:11.880016 IP 99.181.80.6.1935 > 10.8.3.2.36682: Flags [.], ack 107990, win 126, options [nop,nop,TS val 1773613286 ecr 862456445], length 0
21:01:11.915564 IP 10.8.3.2.36682 > 99.181.80.6.1935: Flags [.], seq 117039:118353, ack 1, win 501, options [nop,nop,TS val 862456809 ecr 1773613286], length 1314
21:01:11.963897 IP 99.181.80.6.1935 > 10.8.3.2.36682: Flags [.], ack 110469, win 126, options [nop,nop,TS val 1773613370 ecr 862456509], length 0
21:01:11.963938 IP 10.8.3.2.36682 > 99.181.80.6.1935: Flags [P.], seq 118353:119517, ack 1, win 501, options [nop,nop,TS val 862456857 ecr 1773613370], length 1164
21:01:12.001028 IP 10.8.3.2.36682 > 99.181.80.6.1935: Flags [.], seq 119517:120831, ack 1, win 501, options [nop,nop,TS val 862456894 ecr 1773613370], length 1314
21:01:12.043709 IP 10.8.3.2.36682 > 99.181.80.6.1935: Flags [.], seq 120831:122145, ack 1, win 501, options [nop,nop,TS val 862456937 ecr 1773613370], length 1314
21:01:12.050647 IP 99.181.80.6.1935 > 10.8.3.2.36682: Flags [.], ack 113097, win 126, options [nop,nop,TS val 1773613458 ecr 862456595], length 0
21:01:12.086516 IP 10.8.3.2.36682 > 99.181.80.6.1935: Flags [.], seq 122145:123459, ack 1, win 501, options [nop,nop,TS val 862456980 ecr 1773613458], length 1314
21:01:12.151111 IP 10.8.3.2.36682 > 99.181.80.6.1935: Flags [.], seq 123459:124773, ack 1, win 501, options [nop,nop,TS val 862457044 ecr 1773613458], length 1314
21:01:12.157244 IP 99.181.80.6.1935 > 10.8.3.2.36682: Flags [.], ack 115725, win 126, options [nop,nop,TS val 1773613564 ecr 862456679], length 0
21:01:12.172610 IP 10.8.3.2.36682 > 99.181.80.6.1935: Flags [.], seq 124773:126087, ack 1, win 501, options [nop,nop,TS val 862457066 ecr 1773613564], length 1314
21:01:12.216649 IP 10.8.3.2.36682 > 99.181.80.6.1935: Flags [.], seq 126087:127401, ack 1, win 501, options [nop,nop,TS val 862457110 ecr 1773613564], length 1314
21:01:12.222635 IP 99.181.80.6.1935 > 10.8.3.2.36682: Flags [.], ack 118353, win 126, options [nop,nop,TS val 1773613629 ecr 862456766], length 0
21:01:12.271528 IP 99.181.80.6.1935 > 10.8.3.2.36682: Flags [.], ack 119517, win 126, options [nop,nop,TS val 1773613677 ecr 862456857], length 0
21:01:12.271563 IP 10.8.3.2.36682 > 99.181.80.6.1935: Flags [P.], seq 127401:128478, ack 1, win 501, options [nop,nop,TS val 862457165 ecr 1773613677], length 1077
21:01:12.319384 IP 10.8.3.2.36682 > 99.181.80.6.1935: Flags [.], seq 128478:129792, ack 1, win 501, options [nop,nop,TS val 862457213 ecr 1773613677], length 1314
21:01:12.344593 IP 10.8.3.2.36682 > 99.181.80.6.1935: Flags [.], seq 129792:131106, ack 1, win 501, options [nop,nop,TS val 862457238 ecr 1773613677], length 1314
21:01:12.350714 IP 99.181.80.6.1935 > 10.8.3.2.36682: Flags [.], ack 122145, win 126, options [nop,nop,TS val 1773613757 ecr 862456894], length 0
21:01:12.387420 IP 10.8.3.2.36682 > 99.181.80.6.1935: Flags [.], seq 131106:132420, ack 1, win 501, options [nop,nop,TS val 862457281 ecr 1773613757], length 1314
21:01:12.451811 IP 10.8.3.2.36682 > 99.181.80.6.1935: Flags [.], seq 132420:133734, ack 1, win 501, options [nop,nop,TS val 862457345 ecr 1773613757], length 1314
21:01:12.457022 IP 99.181.80.6.1935 > 10.8.3.2.36682: Flags [.], ack 124773, win 126, options [nop,nop,TS val 1773613864 ecr 862456980], length 0
21:01:12.473237 IP 10.8.3.2.36682 > 99.181.80.6.1935: Flags [.], seq 133734:135048, ack 1, win 501, options [nop,nop,TS val 862457367 ecr 1773613864], length 1314
21:01:12.516638 IP 10.8.3.2.36682 > 99.181.80.6.1935: Flags [.], seq 135048:136362, ack 1, win 501, options [nop,nop,TS val 862457410 ecr 1773613864], length 1314
21:01:12.522470 IP 99.181.80.6.1935 > 10.8.3.2.36682: Flags [.], ack 127401, win 126, options [nop,nop,TS val 1773613930 ecr 862457066], length 0
21:01:12.577638 IP 99.181.80.6.1935 > 10.8.3.2.36682: Flags [.], ack 128478, win 126, options [nop,nop,TS val 1773613985 ecr 862457165], length 0
21:01:12.577678 IP 10.8.3.2.36682 > 99.181.80.6.1935: Flags [P.], seq 136362:137418, ack 1, win 501, options [nop,nop,TS val 862457471 ecr 1773613985], length 1056
21:01:12.615095 IP 10.8.3.2.36682 > 99.181.80.6.1935: Flags [.], seq 137418:138732, ack 1, win 501, options [nop,nop,TS val 862457508 ecr 1773613985], length 1314
21:01:12.643521 IP 10.8.3.2.36682 > 99.181.80.6.1935: Flags [.], seq 138732:140046, ack 1, win 501, options [nop,nop,TS val 862457537 ecr 1773613985], length 1314
21:01:12.650524 IP 99.181.80.6.1935 > 10.8.3.2.36682: Flags [.], ack 131106, win 126, options [nop,nop,TS val 1773614058 ecr 862457213], length 0
21:01:12.686634 IP 10.8.3.2.36682 > 99.181.80.6.1935: Flags [.], seq 140046:141360, ack 1, win 501, options [nop,nop,TS val 862457580 ecr 1773614058], length 1314
21:01:12.750985 IP 10.8.3.2.36682 > 99.181.80.6.1935: Flags [.], seq 141360:142674, ack 1, win 501, options [nop,nop,TS val 862457644 ecr 1773614058], length 1314
21:01:12.758230 IP 99.181.80.6.1935 > 10.8.3.2.36682: Flags [.], ack 133734, win 126, options [nop,nop,TS val 1773614165 ecr 862457281], length 0
21:01:12.772358 IP 10.8.3.2.36682 > 99.181.80.6.1935: Flags [.], seq 142674:143988, ack 1, win 501, options [nop,nop,TS val 862457666 ecr 1773614165], length 1314
21:01:12.818865 IP 10.8.3.2.36682 > 99.181.80.6.1935: Flags [.], seq 143988:145302, ack 1, win 501, options [nop,nop,TS val 862457712 ecr 1773614165], length 1314
21:01:12.823255 IP 99.181.80.6.1935 > 10.8.3.2.36682: Flags [.], ack 136362, win 126, options [nop,nop,TS val 1773614230 ecr 862457367], length 0
21:01:12.879132 IP 10.8.3.2.36682 > 99.181.80.6.1935: Flags [.], seq 145302:146616, ack 1, win 501, options [nop,nop,TS val 862457772 ecr 1773614230], length 1314
21:01:12.884277 IP 99.181.80.6.1935 > 10.8.3.2.36682: Flags [.], ack 137418, win 126, options [nop,nop,TS val 1773614291 ecr 862457471], length 0
21:01:12.884290 IP 10.8.3.2.36682 > 99.181.80.6.1935: Flags [P.], seq 146616:147321, ack 1, win 501, options [nop,nop,TS val 862457778 ecr 1773614291], length 705
21:01:12.942923 IP 10.8.3.2.36682 > 99.181.80.6.1935: Flags [.], seq 147321:148635, ack 1, win 501, options [nop,nop,TS val 862457836 ecr 1773614291], length 1314
21:01:12.950200 IP 99.181.80.6.1935 > 10.8.3.2.36682: Flags [.], ack 140046, win 126, options [nop,nop,TS val 1773614357 ecr 862457508], length 0
21:01:12.986164 IP 10.8.3.2.36682 > 99.181.80.6.1935: Flags [.], seq 148635:149949, ack 1, win 501, options [nop,nop,TS val 862457879 ecr 1773614357], length 1314
21:01:13.019174 IP 10.8.3.2.36682 > 99.181.80.6.1935: Flags [.], seq 149949:151263, ack 1, win 501, options [nop,nop,TS val 862457912 ecr 1773614357], length 1314
21:01:13.058383 IP 99.181.80.6.1935 > 10.8.3.2.36682: Flags [.], ack 142674, win 126, options [nop,nop,TS val 1773614464 ecr 862457580], length 0
21:01:13.072479 IP 10.8.3.2.36682 > 99.181.80.6.1935: Flags [.], seq 151263:152577, ack 1, win 501, options [nop,nop,TS val 862457966 ecr 1773614464], length 1314
21:01:13.115483 IP 10.8.3.2.36682 > 99.181.80.6.1935: Flags [.], seq 152577:153891, ack 1, win 501, options [nop,nop,TS val 862458009 ecr 1773614464], length 1314
21:01:13.125023 IP 99.181.80.6.1935 > 10.8.3.2.36682: Flags [.], ack 145302, win 126, options [nop,nop,TS val 1773614532 ecr 862457666], length 0
21:01:13.150187 IP 10.8.3.2.36682 > 99.181.80.6.1935: Flags [.], seq 153891:155205, ack 1, win 501, options [nop,nop,TS val 862458043 ecr 1773614532], length 1314
21:01:13.190499 IP 99.181.80.6.1935 > 10.8.3.2.36682: Flags [.], ack 147321, win 126, options [nop,nop,TS val 1773614598 ecr 862457772], length 0
21:01:13.190532 IP 10.8.3.2.36682 > 99.181.80.6.1935: Flags [P.], seq 155205:156278, ack 1, win 501, options [nop,nop,TS val 862458084 ecr 1773614598], length 1073
21:01:13.244096 IP 10.8.3.2.36682 > 99.181.80.6.1935: Flags [.], seq 156278:157592, ack 1, win 501, options [nop,nop,TS val 862458137 ecr 1773614598], length 1314
21:01:13.284275 IP 10.8.3.2.36682 > 99.181.80.6.1935: Flags [.], seq 157592:158906, ack 1, win 501, options [nop,nop,TS val 862458178 ecr 1773614598], length 1314
21:01:13.292294 IP 99.181.80.6.1935 > 10.8.3.2.36682: Flags [.], ack 149949, win 126, options [nop,nop,TS val 1773614700 ecr 862457836], length 0
21:01:13.317614 IP 10.8.3.2.36682 > 99.181.80.6.1935: Flags [.], seq 158906:160220, ack 1, win 501, options [nop,nop,TS val 862458211 ecr 1773614700], length 1314
21:01:13.378714 IP 99.181.80.6.1935 > 10.8.3.2.36682: Flags [.], ack 152577, win 126, options [nop,nop,TS val 1773614786 ecr 862457912], length 0
21:01:13.385839 IP 10.8.3.2.36682 > 99.181.80.6.1935: Flags [.], seq 160220:161534, ack 1, win 501, options [nop,nop,TS val 862458279 ecr 1773614786], length 1314
21:01:13.415342 IP 10.8.3.2.36682 > 99.181.80.6.1935: Flags [.], seq 161534:162848, ack 1, win 501, options [nop,nop,TS val 862458309 ecr 1773614786], length 1314
21:01:13.452584 IP 10.8.3.2.36682 > 99.181.80.6.1935: Flags [.], seq 162848:164162, ack 1, win 501, options [nop,nop,TS val 862458346 ecr 1773614786], length 1314
21:01:13.456224 IP 99.181.80.6.1935 > 10.8.3.2.36682: Flags [.], ack 155205, win 126, options [nop,nop,TS val 1773614863 ecr 862458009], length 0
21:01:13.496527 IP 99.181.80.6.1935 > 10.8.3.2.36682: Flags [.], ack 156278, win 126, options [nop,nop,TS val 1773614904 ecr 862458084], length 0
21:01:13.496572 IP 10.8.3.2.36682 > 99.181.80.6.1935: Flags [P.], seq 164162:165228, ack 1, win 501, options [nop,nop,TS val 862458390 ecr 1773614904], length 1066
21:01:13.544370 IP 10.8.3.2.36682 > 99.181.80.6.1935: Flags [.], seq 165228:166542, ack 1, win 501, options [nop,nop,TS val 862458438 ecr 1773614904], length 1314
21:01:13.584318 IP 10.8.3.2.36682 > 99.181.80.6.1935: Flags [.], seq 166542:167856, ack 1, win 501, options [nop,nop,TS val 862458478 ecr 1773614904], length 1314
21:01:13.590695 IP 99.181.80.6.1935 > 10.8.3.2.36682: Flags [.], ack 158906, win 126, options [nop,nop,TS val 1773614998 ecr 862458137], length 0
21:01:13.618128 IP 10.8.3.2.36682 > 99.181.80.6.1935: Flags [.], seq 167856:169170, ack 1, win 501, options [nop,nop,TS val 862458511 ecr 1773614998], length 1314
21:01:13.685952 IP 10.8.3.2.36682 > 99.181.80.6.1935: Flags [.], seq 169170:170484, ack 1, win 501, options [nop,nop,TS val 862458579 ecr 1773614998], length 1314
21:01:13.692882 IP 99.181.80.6.1935 > 10.8.3.2.36682: Flags [.], ack 161534, win 126, options [nop,nop,TS val 1773615099 ecr 862458211], length 0
21:01:13.715883 IP 10.8.3.2.36682 > 99.181.80.6.1935: Flags [.], seq 170484:171798, ack 1, win 501, options [nop,nop,TS val 862458609 ecr 1773615099], length 1314
21:01:13.752562 IP 10.8.3.2.36682 > 99.181.80.6.1935: Flags [.], seq 171798:173112, ack 1, win 501, options [nop,nop,TS val 862458646 ecr 1773615099], length 1314
21:01:13.758703 IP 99.181.80.6.1935 > 10.8.3.2.36682: Flags [.], ack 164162, win 126, options [nop,nop,TS val 1773615166 ecr 862458309], length 0
21:01:13.802535 IP 99.181.80.6.1935 > 10.8.3.2.36682: Flags [.], ack 165228, win 126, options [nop,nop,TS val 1773615210 ecr 862458390], length 0
21:01:13.802574 IP 10.8.3.2.36682 > 99.181.80.6.1935: Flags [P.], seq 173112:174284, ack 1, win 501, options [nop,nop,TS val 862458696 ecr 1773615210], length 1172
21:01:13.844639 IP 10.8.3.2.36682 > 99.181.80.6.1935: Flags [.], seq 174284:175598, ack 1, win 501, options [nop,nop,TS val 862458738 ecr 1773615210], length 1314
21:01:13.885190 IP 10.8.3.2.36682 > 99.181.80.6.1935: Flags [.], seq 175598:176912, ack 1, win 501, options [nop,nop,TS val 862458778 ecr 1773615210], length 1314
21:01:13.890318 IP 99.181.80.6.1935 > 10.8.3.2.36682: Flags [.], ack 167856, win 126, options [nop,nop,TS val 1773615297 ecr 862458438], length 0
21:01:13.930414 IP 10.8.3.2.36682 > 99.181.80.6.1935: Flags [.], seq 176912:178226, ack 1, win 501, options [nop,nop,TS val 862458824 ecr 1773615297], length 1314
21:01:13.985912 IP 10.8.3.2.36682 > 99.181.80.6.1935: Flags [.], seq 178226:179540, ack 1, win 501, options [nop,nop,TS val 862458879 ecr 1773615297], length 1314
21:01:13.995340 IP 99.181.80.6.1935 > 10.8.3.2.36682: Flags [.], ack 170484, win 126, options [nop,nop,TS val 1773615399 ecr 862458511], length 0
21:01:14.016241 IP 10.8.3.2.36682 > 99.181.80.6.1935: Flags [.], seq 179540:180854, ack 1, win 501, options [nop,nop,TS val 862458910 ecr 1773615399], length 1314
21:01:14.058935 IP 99.181.80.6.1935 > 10.8.3.2.36682: Flags [.], ack 173112, win 126, options [nop,nop,TS val 1773615466 ecr 862458609], length 0
21:01:14.059320 IP 10.8.3.2.36682 > 99.181.80.6.1935: Flags [.], seq 180854:182168, ack 1, win 501, options [nop,nop,TS val 862458953 ecr 1773615466], length 1314
21:01:14.109322 IP 99.181.80.6.1935 > 10.8.3.2.36682: Flags [.], ack 174284, win 126, options [nop,nop,TS val 1773615516 ecr 862458696], length 0
21:01:14.109351 IP 10.8.3.2.36682 > 99.181.80.6.1935: Flags [P.], seq 182168:183228, ack 1, win 501, options [nop,nop,TS val 862459003 ecr 1773615516], length 1060
21:01:14.144966 IP 10.8.3.2.36682 > 99.181.80.6.1935: Flags [.], seq 183228:184542, ack 1, win 501, options [nop,nop,TS val 862459038 ecr 1773615516], length 1314
21:01:14.184227 IP 10.8.3.2.36682 > 99.181.80.6.1935: Flags [.], seq 184542:185856, ack 1, win 501, options [nop,nop,TS val 862459078 ecr 1773615516], length 1314
21:01:14.192337 IP 99.181.80.6.1935 > 10.8.3.2.36682: Flags [.], ack 176912, win 126, options [nop,nop,TS val 1773615598 ecr 862458738], length 0
21:01:14.230518 IP 10.8.3.2.36682 > 99.181.80.6.1935: Flags [.], seq 185856:187170, ack 1, win 501, options [nop,nop,TS val 862459124 ecr 1773615598], length 1314
21:01:14.285576 IP 10.8.3.2.36682 > 99.181.80.6.1935: Flags [.], seq 187170:188484, ack 1, win 501, options [nop,nop,TS val 862459179 ecr 1773615598], length 1314
21:01:14.291985 IP 99.181.80.6.1935 > 10.8.3.2.36682: Flags [.], ack 179540, win 126, options [nop,nop,TS val 1773615699 ecr 862458824], length 0
21:01:14.316172 IP 10.8.3.2.36682 > 99.181.80.6.1935: Flags [.], seq 188484:189798, ack 1, win 501, options [nop,nop,TS val 862459209 ecr 1773615699], length 1314
21:01:14.358499 IP 10.8.3.2.36682 > 99.181.80.6.1935: Flags [.], seq 189798:191112, ack 1, win 501, options [nop,nop,TS val 862459252 ecr 1773615699], length 1314
21:01:14.365690 IP 99.181.80.6.1935 > 10.8.3.2.36682: Flags [.], ack 182168, win 126, options [nop,nop,TS val 1773615773 ecr 862458910], length 0
21:01:14.415392 IP 99.181.80.6.1935 > 10.8.3.2.36682: Flags [.], ack 183228, win 126, options [nop,nop,TS val 1773615822 ecr 862459003], length 0
21:01:14.415426 IP 10.8.3.2.36682 > 99.181.80.6.1935: Flags [P.], seq 191112:192185, ack 1, win 501, options [nop,nop,TS val 862459309 ecr 1773615822], length 1073
21:01:14.452695 IP 10.8.3.2.36682 > 99.181.80.6.1935: Flags [.], seq 192185:193499, ack 1, win 501, options [nop,nop,TS val 862459346 ecr 1773615822], length 1314
21:01:14.485759 IP 10.8.3.2.36682 > 99.181.80.6.1935: Flags [.], seq 193499:194813, ack 1, win 501, options [nop,nop,TS val 862459379 ecr 1773615822], length 1314
21:01:14.490257 IP 99.181.80.6.1935 > 10.8.3.2.36682: Flags [.], ack 185856, win 126, options [nop,nop,TS val 1773615897 ecr 862459038], length 0
21:01:14.529677 IP 10.8.3.2.36682 > 99.181.80.6.1935: Flags [.], seq 194813:196127, ack 1, win 501, options [nop,nop,TS val 862459423 ecr 1773615897], length 1314
21:01:14.585783 IP 10.8.3.2.36682 > 99.181.80.6.1935: Flags [.], seq 196127:197441, ack 1, win 501, options [nop,nop,TS val 862459479 ecr 1773615897], length 1314
21:01:14.591991 IP 99.181.80.6.1935 > 10.8.3.2.36682: Flags [.], ack 188484, win 126, options [nop,nop,TS val 1773615999 ecr 862459124], length 0
21:01:14.615502 IP 10.8.3.2.36682 > 99.181.80.6.1935: Flags [.], seq 197441:198755, ack 1, win 501, options [nop,nop,TS val 862459509 ecr 1773615999], length 1314
21:01:14.658299 IP 10.8.3.2.36682 > 99.181.80.6.1935: Flags [.], seq 198755:200069, ack 1, win 501, options [nop,nop,TS val 862459552 ecr 1773615999], length 1314
21:01:14.665667 IP 99.181.80.6.1935 > 10.8.3.2.36682: Flags [.], ack 191112, win 126, options [nop,nop,TS val 1773616072 ecr 862459209], length 0
21:01:14.718878 IP 10.8.3.2.36682 > 99.181.80.6.1935: Flags [.], seq 200069:201383, ack 1, win 501, options [nop,nop,TS val 862459612 ecr 1773616072], length 1314
21:01:14.721329 IP 99.181.80.6.1935 > 10.8.3.2.36682: Flags [.], ack 192185, win 126, options [nop,nop,TS val 1773616128 ecr 862459309], length 0
21:01:14.721361 IP 10.8.3.2.36682 > 99.181.80.6.1935: Flags [P.], seq 201383:201994, ack 1, win 501, options [nop,nop,TS val 862459615 ecr 1773616128], length 611
21:01:14.785402 IP 10.8.3.2.36682 > 99.181.80.6.1935: Flags [.], seq 201994:203308, ack 1, win 501, options [nop,nop,TS val 862459679 ecr 1773616128], length 1314
21:01:14.792306 IP 99.181.80.6.1935 > 10.8.3.2.36682: Flags [.], ack 194813, win 126, options [nop,nop,TS val 1773616199 ecr 862459346], length 0
21:01:14.818661 IP 10.8.3.2.36682 > 99.181.80.6.1935: Flags [.], seq 203308:204622, ack 1, win 501, options [nop,nop,TS val 862459712 ecr 1773616199], length 1314
21:01:14.851069 IP 10.8.3.2.36682 > 99.181.80.6.1935: Flags [.], seq 204622:205936, ack 1, win 501, options [nop,nop,TS val 862459744 ecr 1773616199], length 1314
21:01:14.891996 IP 99.181.80.6.1935 > 10.8.3.2.36682: Flags [.], ack 197441, win 126, options [nop,nop,TS val 1773616299 ecr 862459423], length 0
21:01:14.915646 IP 10.8.3.2.36682 > 99.181.80.6.1935: Flags [.], seq 205936:207250, ack 1, win 501, options [nop,nop,TS val 862459809 ecr 1773616299], length 1314
21:01:14.952479 IP 10.8.3.2.36682 > 99.181.80.6.1935: Flags [.], seq 207250:208564, ack 1, win 501, options [nop,nop,TS val 862459846 ecr 1773616299], length 1314
21:01:14.964561 IP 99.181.80.6.1935 > 10.8.3.2.36682: Flags [.], ack 200069, win 126, options [nop,nop,TS val 1773616371 ecr 862459509], length 0
