12:34:18.523311 IP 103.53.48.87.1935 > 10.8.1.4.40384: Flags [.], ack 970420451, win 126, options [nop,nop,TS val 3392729487 ecr 3083152351], length 0
12:34:18.523369 IP 103.53.48.87.1935 > 10.8.1.4.40384: Flags [.], ack 1315, win 126, options [nop,nop,TS val 3392729523 ecr 3083152387], length 0
12:34:18.523391 IP 103.53.48.87.1935 > 10.8.1.4.40384: Flags [.], ack 3943, win 126, options [nop,nop,TS val 3392729589 ecr 3083152419], length 0
12:34:18.523415 IP 103.53.48.87.1935 > 10.8.1.4.40384: Flags [.], ack 6571, win 126, options [nop,nop,TS val 3392729691 ecr 3083152514], length 0
12:34:18.523433 IP 103.53.48.87.1935 > 10.8.1.4.40384: Flags [.], ack 7885, win 126, options [nop,nop,TS val 3392729800 ecr 3083152589], length 0
12:34:18.523467 IP 10.8.1.4.40384 > 103.53.48.87.1935: Flags [.], seq 26882:28196, ack 0, win 501, options [nop,nop,TS val 3083154850 ecr 3392729800], length 1314
12:34:18.523503 IP 10.8.1.4.40384 > 103.53.48.87.1935: Flags [.], seq 28196:29510, ack 0, win 501, options [nop,nop,TS val 3083154850 ecr 3392729800], length 1314
12:34:18.523545 IP 10.8.1.4.40384 > 103.53.48.87.1935: Flags [.], seq 29510:30824, ack 0, win 501, options [nop,nop,TS val 3083154850 ecr 3392729800], length 1314
12:34:18.523593 IP 10.8.1.4.40384 > 103.53.48.87.1935: Flags [.], seq 30824:32138, ack 0, win 501, options [nop,nop,TS val 3083154850 ecr 3392729800], length 1314
12:34:18.523646 IP 10.8.1.4.40384 > 103.53.48.87.1935: Flags [.], seq 32138:33452, ack 0, win 501, options [nop,nop,TS val 3083154850 ecr 3392729800], length 1314
12:34:18.523693 IP 10.8.1.4.40384 > 103.53.48.87.1935: Flags [.], seq 33452:34766, ack 0, win 501, options [nop,nop,TS val 3083154850 ecr 3392729800], length 1314
12:34:18.795158 IP 10.8.1.4.40384 > 103.53.48.87.1935: Flags [.], seq 34766:36080, ack 0, win 501, options [nop,nop,TS val 3083155121 ecr 3392729800], length 1314
12:34:18.834735 IP 103.53.48.87.1935 > 10.8.1.4.40384: Flags [.], ack 9199, win 126, options [nop,nop,TS val 3392731756 ecr 3083152654], length 0
12:34:18.834751 IP 103.53.48.87.1935 > 10.8.1.4.40384: Flags [.], ack 10513, win 125, options [nop,nop,TS val 3392731756 ecr 3083152686], length 0
12:34:18.834757 IP 103.53.48.87.1935 > 10.8.1.4.40384: Flags [.], ack 11827, win 126, options [nop,nop,TS val 3392731756 ecr 3083152720], length 0
12:34:18.834762 IP 103.53.48.87.1935 > 10.8.1.4.40384: Flags [.], ack 11988, win 126, options [nop,nop,TS val 3392731756 ecr 3083152738], length 0
12:34:18.834767 IP 103.53.48.87.1935 > 10.8.1.4.40384: Flags [.], ack 13302, win 126, options [nop,nop,TS val 3392731756 ecr 3083152788], length 0
12:34:18.834772 IP 103.53.48.87.1935 > 10.8.1.4.40384: Flags [.], ack 14616, win 126, options [nop,nop,TS val 3392731756 ecr 3083152814], length 0
12:34:18.834777 IP 103.53.48.87.1935 > 10.8.1.4.40384: Flags [.], ack 15930, win 125, options [nop,nop,TS val 3392731756 ecr 3083152857], length 0
12:34:18.834783 IP 103.53.48.87.1935 > 10.8.1.4.40384: Flags [.], ack 17244, win 126, options [nop,nop,TS val 3392731756 ecr 3083152918], length 0
12:34:18.834788 IP 103.53.48.87.1935 > 10.8.1.4.40384: Flags [.], ack 18558, win 124, options [nop,nop,TS val 3392731756 ecr 3083152954], length 0
12:34:18.834793 IP 103.53.48.87.1935 > 10.8.1.4.40384: Flags [.], ack 19872, win 122, options [nop,nop,TS val 3392731756 ecr 3083152985], length 0
12:34:18.834798 IP 103.53.48.87.1935 > 10.8.1.4.40384: Flags [.], ack 21186, win 120, options [nop,nop,TS val 3392731756 ecr 3083153049], length 0
12:34:18.834803 IP 103.53.48.87.1935 > 10.8.1.4.40384: Flags [.], ack 22500, win 118, options [nop,nop,TS val 3392731756 ecr 3083153089], length 0
12:34:18.834808 IP 103.53.48.87.1935 > 10.8.1.4.40384: Flags [.], ack 23814, win 116, options [nop,nop,TS val 3392731756 ecr 3083153120], length 0
12:34:18.834812 IP 103.53.48.87.1935 > 10.8.1.4.40384: Flags [.], ack 25128, win 126, options [nop,nop,TS val 3392731756 ecr 3083153185], length 0
12:34:18.834818 IP 103.53.48.87.1935 > 10.8.1.4.40384: Flags [.], ack 26442, win 125, options [nop,nop,TS val 3392731756 ecr 3083153220], length 0
12:34:18.834823 IP 103.53.48.87.1935 > 10.8.1.4.40384: Flags [.], ack 26882, win 126, options [nop,nop,TS val 3392731756 ecr 3083153228], length 0
12:34:18.834830 IP 10.8.1.4.40384 > 103.53.48.87.1935: Flags [P.], seq 36080:36191, ack 0, win 501, options [nop,nop,TS val 3083155161 ecr 3392731756], length 111
12:34:18.834838 IP 103.53.48.87.1935 > 10.8.1.4.40384: Flags [.], ack 26882, win 126, options [nop,nop,TS val 3392731756 ecr 3083153228,nop,nop,sack 1 {4294965983:1}], length 0
12:34:19.064229 IP 103.53.48.87.1935 > 10.8.1.4.40384: Flags [.], ack 28196, win 126, options [nop,nop,TS val 3392731986 ecr 3083154850], length 0
12:34:19.064288 IP 103.53.48.87.1935 > 10.8.1.4.40384: Flags [.], ack 29510, win 126, options [nop,nop,TS val 3392731986 ecr 3083154850], length 0
12:34:19.064309 IP 103.53.48.87.1935 > 10.8.1.4.40384: Flags [.], ack 32138, win 125, options [nop,nop,TS val 3392731986 ecr 3083154850], length 0
12:34:19.064335 IP 103.53.48.87.1935 > 10.8.1.4.40384: Flags [.], ack 33452, win 126, options [nop,nop,TS val 3392731986 ecr 3083154850], length 0
12:34:19.064525 IP 103.53.48.87.1935 > 10.8.1.4.40384: Flags [.], ack 34766, win 126, options [nop,nop,TS val 3392731986 ecr 3083154850], length 0
12:34:19.115918 IP 10.8.1.4.40384 > 103.53.48.87.1935: Flags [.], seq 36191:37505, ack 0, win 501, options [nop,nop,TS val 3083155442 ecr 3392731986], length 1314
12:34:19.336014 IP 103.53.48.87.1935 > 10.8.1.4.40384: Flags [.], ack 36080, win 126, options [nop,nop,TS val 3392732257 ecr 3083155121], length 0
12:34:19.359795 IP 10.8.1.4.40384 > 103.53.48.87.1935: Flags [.], seq 37505:38819, ack 0, win 501, options [nop,nop,TS val 3083155686 ecr 3392732257], length 1314
12:34:19.375370 IP 103.53.48.87.1935 > 10.8.1.4.40384: Flags [.], ack 36191, win 126, options [nop,nop,TS val 3392732297 ecr 3083155161], length 0
12:34:19.375391 IP 10.8.1.4.40384 > 103.53.48.87.1935: Flags [P.], seq 38819:39487, ack 0, win 501, options [nop,nop,TS val 3083155702 ecr 3392732297], length 668
12:34:19.426675 IP 10.8.1.4.40384 > 103.53.48.87.1935: Flags [.], seq 39487:40801, ack 0, win 501, options [nop,nop,TS val 3083155753 ecr 3392732297], length 1314
12:34:19.460345 IP 10.8.1.4.40384 > 103.53.48.87.1935: Flags [.], seq 40801:42115, ack 0, win 501, options [nop,nop,TS val 3083155787 ecr 3392732297], length 1314
12:34:19.499183 IP 10.8.1.4.40384 > 103.53.48.87.1935: Flags [.], seq 42115:43429, ack 0, win 501, options [nop,nop,TS val 3083155826 ecr 3392732297], length 1314
12:34:19.560150 IP 10.8.1.4.40384 > 103.53.48.87.1935: Flags [.], seq 43429:44743, ack 0, win 501, options [nop,nop,TS val 3083155886 ecr 3392732297], length 1314
12:34:19.595892 IP 10.8.1.4.40384 > 103.53.48.87.1935: Flags [.], seq 44743:46057, ack 0, win 501, options [nop,nop,TS val 3083155922 ecr 3392732297], length 1314
12:34:19.628842 IP 10.8.1.4.40384 > 103.53.48.87.1935: Flags [.], seq 46057:47371, ack 0, win 501, options [nop,nop,TS val 3083155955 ecr 3392732297], length 1314
12:34:19.656821 IP 103.53.48.87.1935 > 10.8.1.4.40384: Flags [.], ack 37505, win 126, options [nop,nop,TS val 3392732578 ecr 3083155442], length 0
12:34:19.692135 IP 10.8.1.4.40384 > 103.53.48.87.1935: Flags [.], seq 47371:48685, ack 0, win 501, options [nop,nop,TS val 3083156018 ecr 3392732578], length 1314
12:34:19.729682 IP 10.8.1.4.40384 > 103.53.48.87.1935: Flags [.], seq 48685:49999, ack 0, win 501, options [nop,nop,TS val 3083156056 ecr 3392732578], length 1314
12:34:19.758195 IP 10.8.1.4.40384 > 103.53.48.87.1935: Flags [.], seq 49999:51313, ack 0, win 501, options [nop,nop,TS val 3083156085 ecr 3392732578], length 1314
12:34:19.825707 IP 10.8.1.4.40384 > 103.53.48.87.1935: Flags [.], seq 51313:52627, ack 0, win 501, options [nop,nop,TS val 3083156152 ecr 3392732578], length 1314
12:34:19.860353 IP 10.8.1.4.40384 > 103.53.48.87.1935: Flags [.], seq 52627:53941, ack 0, win 501, options [nop,nop,TS val 3083156187 ecr 3392732578], length 1314
12:34:19.891110 IP 10.8.1.4.40384 > 103.53.48.87.1935: Flags [.], seq 53941:55255, ack 0, win 501, options [nop,nop,TS val 3083156217 ecr 3392732578], length 1314
12:34:19.900941 IP 103.53.48.87.1935 > 10.8.1.4.40384: Flags [.], ack 38819, win 126, options [nop,nop,TS val 3392732823 ecr 3083155686], length 0
12:34:19.918497 IP 103.53.48.87.1935 > 10.8.1.4.40384: Flags [.], ack 39487, win 126, options [nop,nop,TS val 3392732838 ecr 3083155702], length 0
12:34:19.918511 IP 10.8.1.4.40384 > 103.53.48.87.1935: Flags [P.], seq 55255:55407, ack 0, win 501, options [nop,nop,TS val 3083156245 ecr 3392732838], length 152
12:34:19.959657 IP 10.8.1.4.40384 > 103.53.48.87.1935: Flags [.], seq 55407:56721, ack 0, win 501, options [nop,nop,TS val 3083156286 ecr 3392732838], length 1314
12:34:19.967527 IP 103.53.48.87.1935 > 10.8.1.4.40384: Flags [.], ack 40801, win 126, options [nop,nop,TS val 3392732889 ecr 3083155753], length 0
12:34:19.995931 IP 10.8.1.4.40384 > 103.53.48.87.1935: Flags [.], seq 56721:58035, ack 0, win 501, options [nop,nop,TS val 3083156322 ecr 3392732889], length 1314
12:34:20.007992 IP 103.53.48.87.1935 > 10.8.1.4.40384: Flags [.], ack 42115, win 126, options [nop,nop,TS val 3392732923 ecr 3083155787], length 0
12:34:20.033800 IP 10.8.1.4.40384 > 103.53.48.87.1935: Flags [.], seq 58035:59349, ack 0, win 501, options [nop,nop,TS val 3083156360 ecr 3392732923], length 1314
12:34:20.040191 IP 103.53.48.87.1935 > 10.8.1.4.40384: Flags [.], ack 43429, win 126, options [nop,nop,TS val 3392732962 ecr 3083155826], length 0
12:34:20.091551 IP 10.8.1.4.40384 > 103.53.48.87.1935: Flags [.], seq 59349:60663, ack 0, win 501, options [nop,nop,TS val 3083156418 ecr 3392732962], length 1314
12:34:20.100878 IP 103.53.48.87.1935 > 10.8.1.4.40384: Flags [.], ack 44743, win 126, options [nop,nop,TS val 3392733022 ecr 3083155886], length 0
12:34:20.125323 IP 10.8.1.4.40384 > 103.53.48.87.1935: Flags [.], seq 60663:61977, ack 0, win 501, options [nop,nop,TS val 3083156452 ecr 3392733022], length 1314
12:34:20.136943 IP 103.53.48.87.1935 > 10.8.1.4.40384: Flags [.], ack 46057, win 131, options [nop,nop,TS val 3392733058 ecr 3083155922], length 0
12:34:20.161092 IP 10.8.1.4.40384 > 103.53.48.87.1935: Flags [.], seq 61977:63291, ack 0, win 501, options [nop,nop,TS val 3083156487 ecr 3392733058], length 1314
12:34:20.169606 IP 103.53.48.87.1935 > 10.8.1.4.40384: Flags [.], ack 47371, win 137, options [nop,nop,TS val 3392733091 ecr 3083155955], length 0
12:34:20.225204 IP 10.8.1.4.40384 > 103.53.48.87.1935: Flags [.], seq 63291:64605, ack 0, win 501, options [nop,nop,TS val 3083156552 ecr 3392733091], length 1314
12:34:20.233212 IP 103.53.48.87.1935 > 10.8.1.4.40384: Flags [.], ack 48685, win 143, options [nop,nop,TS val 3392733154 ecr 3083156018], length 0
12:34:20.263235 IP 10.8.1.4.40384 > 103.53.48.87.1935: Flags [.], seq 64605:65919, ack 0, win 501, options [nop,nop,TS val 3083156590 ecr 3392733154], length 1314
12:34:20.270596 IP 103.53.48.87.1935 > 10.8.1.4.40384: Flags [.], ack 49999, win 148, options [nop,nop,TS val 3392733192 ecr 3083156056], length 0
12:34:20.296076 IP 10.8.1.4.40384 > 103.53.48.87.1935: Flags [.], seq 65919:67233, ack 0, win 501, options [nop,nop,TS val 3083156622 ecr 3392733192], length 1314
12:34:20.298836 IP 103.53.48.87.1935 > 10.8.1.4.40384: Flags [.], ack 51313, win 154, options [nop,nop,TS val 3392733220 ecr 3083156085], length 0
12:34:20.359119 IP 10.8.1.4.40384 > 103.53.48.87.1935: Flags [.], seq 67233:68547, ack 0, win 501, options [nop,nop,TS val 3083156685 ecr 3392733220], length 1314
12:34:20.366662 IP 103.53.48.87.1935 > 10.8.1.4.40384: Flags [.], ack 52627, win 160, options [nop,nop,TS val 3392733288 ecr 3083156152], length 0
12:34:20.393891 IP 10.8.1.4.40384 > 103.53.48.87.1935: Flags [.], seq 68547:69861, ack 0, win 501, options [nop,nop,TS val 3083156720 ecr 3392733288], length 1314
12:34:20.401152 IP 103.53.48.87.1935 > 10.8.1.4.40384: Flags [.], ack 53941, win 165, options [nop,nop,TS val 3392733323 ecr 3083156187], length 0
12:34:20.424959 IP 10.8.1.4.40384 > 103.53.48.87.1935: Flags [.], seq 69861:71175, ack 0, win 501, options [nop,nop,TS val 3083156751 ecr 3392733323], length 1314
12:34:20.431934 IP 103.53.48.87.1935 > 10.8.1.4.40384: Flags [.], ack 55255, win 171, options [nop,nop,TS val 3392733353 ecr 3083156217], length 0
12:34:20.459339 IP 103.53.48.87.1935 > 10.8.1.4.40384: Flags [.], ack 55407, win 176, options [nop,nop,TS val 3392733381 ecr 3083156245], length 0
12:34:20.459354 IP 10.8.1.4.40384 > 103.53.48.87.1935: Flags [P.], seq 71175:72184, ack 0, win 501, options [nop,nop,TS val 3083156786 ecr 3392733381], length 1009
12:34:20.500619 IP 103.53.48.87.1935 > 10.8.1.4.40384: Flags [.], ack 56721, win 182, options [nop,nop,TS val 3392733422 ecr 3083156286], length 0
12:34:20.528677 IP 10.8.1.4.40384 > 103.53.48.87.1935: Flags [.], seq 72184:73498, ack 0, win 501, options [nop,nop,TS val 3083156855 ecr 3392733422], length 1314
12:34:20.547175 IP 103.53.48.87.1935 > 10.8.1.4.40384: Flags [.], ack 58035, win 187, options [nop,nop,TS val 3392733468 ecr 3083156322], length 0
12:34:20.562017 IP 10.8.1.4.40384 > 103.53.48.87.1935: Flags [.], seq 73498:74812, ack 0, win 501, options [nop,nop,TS val 3083156888 ecr 3392733468], length 1314
12:34:20.574771 IP 103.53.48.87.1935 > 10.8.1.4.40384: Flags [.], ack 59349, win 193, options [nop,nop,TS val 3392733496 ecr 3083156360], length 0
12:34:20.593853 IP 10.8.1.4.40384 > 103.53.48.87.1935: Flags [.], seq 74812:76126, ack 0, win 501, options [nop,nop,TS val 3083156920 ecr 3392733496], length 1314
12:34:20.632561 IP 103.53.48.87.1935 > 10.8.1.4.40384: Flags [.], ack 60663, win 199, options [nop,nop,TS val 3392733554 ecr 3083156418], length 0
12:34:20.661763 IP 10.8.1.4.40384 > 103.53.48.87.1935: Flags [.], seq 76126:77440, ack 0, win 501, options [nop,nop,TS val 3083156988 ecr 3392733554], length 1314
12:34:20.666449 IP 103.53.48.87.1935 > 10.8.1.4.40384: Flags [.], ack 61977, win 204, options [nop,nop,TS val 3392733588 ecr 3083156452], length 0
12:34:20.694700 IP 10.8.1.4.40384 > 103.53.48.87.1935: Flags [.], seq 77440:78754, ack 0, win 501, options [nop,nop,TS val 3083157021 ecr 3392733588], length 1314
12:34:20.701867 IP 103.53.48.87.1935 > 10.8.1.4.40384: Flags [.], ack 63291, win 210, options [nop,nop,TS val 3392733623 ecr 3083156487], length 0
12:34:20.728879 IP 10.8.1.4.40384 > 103.53.48.87.1935: Flags [.], seq 78754:80068, ack 0, win 501, options [nop,nop,TS val 3083157055 ecr 3392733623], length 1314
12:34:20.766233 IP 103.53.48.87.1935 > 10.8.1.4.40384: Flags [.], ack 64605, win 216, options [nop,nop,TS val 3392733688 ecr 3083156552], length 0
12:34:20.794253 IP 10.8.1.4.40384 > 103.53.48.87.1935: Flags [.], seq 80068:81382, ack 0, win 501, options [nop,nop,TS val 3083157121 ecr 3392733688], length 1314
12:34:20.804083 IP 103.53.48.87.1935 > 10.8.1.4.40384: Flags [.], ack 65919, win 221, options [nop,nop,TS val 3392733726 ecr 3083156590], length 0
12:34:20.824856 IP 10.8.1.4.40384 > 103.53.48.87.1935: Flags [.], seq 81382:82696, ack 0, win 501, options [nop,nop,TS val 3083157151 ecr 3392733726], length 1314
12:34:20.837081 IP 103.53.48.87.1935 > 10.8.1.4.40384: Flags [.], ack 67233, win 227, options [nop,nop,TS val 3392733759 ecr 3083156622], length 0
12:34:20.858601 IP 10.8.1.4.40384 > 103.53.48.87.1935: Flags [.], seq 82696:84010, ack 0, win 501, options [nop,nop,TS val 3083157185 ecr 3392733759], length 1314
12:34:20.900297 IP 103.53.48.87.1935 > 10.8.1.4.40384: Flags [.], ack 68547, win 233, options [nop,nop,TS val 3392733821 ecr 3083156685], length 0
12:34:20.929047 IP 10.8.1.4.40384 > 103.53.48.87.1935: Flags [.], seq 84010:85324, ack 0, win 501, options [nop,nop,TS val 3083157255 ecr 3392733821], length 1314
12:34:20.934813 IP 103.53.48.87.1935 > 10.8.1.4.40384: Flags [.], ack 69861, win 238, options [nop,nop,TS val 3392733856 ecr 3083156720], length 0
12:34:20.960337 IP 10.8.1.4.40384 > 103.53.48.87.1935: Flags [.], seq 85324:86638, ack 0, win 501, options [nop,nop,TS val 3083157287 ecr 3392733856], length 1314
12:34:20.965693 IP 103.53.48.87.1935 > 10.8.1.4.40384: Flags [.], ack 71175, win 244, options [nop,nop,TS val 3392733887 ecr 3083156751], length 0
12:34:20.992980 IP 10.8.1.4.40384 > 103.53.48.87.1935: Flags [.], seq 86638:87952, ack 0, win 501, options [nop,nop,TS val 3083157319 ecr 3392733887], length 1314
12:34:20.999998 IP 103.53.48.87.1935 > 10.8.1.4.40384: Flags [.], ack 72184, win 250, options [nop,nop,TS val 3392733922 ecr 3083156786], length 0
12:34:21.000020 IP 10.8.1.4.40384 > 103.53.48.87.1935: Flags [P.], seq 87952:88215, ack 0, win 501, options [nop,nop,TS val 3083157326 ecr 3392733922], length 263
12:34:21.062457 IP 10.8.1.4.40384 > 103.53.48.87.1935: Flags [.], seq 88215:89529, ack 0, win 501, options [nop,nop,TS val 3083157389 ecr 3392733922], length 1314
12:34:21.070807 IP 103.53.48.87.1935 > 10.8.1.4.40384: Flags [.], ack 73498, win 255, options [nop,nop,TS val 3392733992 ecr 3083156855], length 0
12:34:21.095672 IP 10.8.1.4.40384 > 103.53.48.87.1935: Flags [.], seq 89529:90843, ack 0, win 501, options [nop,nop,TS val 3083157422 ecr 3392733992], length 1314
12:34:21.102811 IP 103.53.48.87.1935 > 10.8.1.4.40384: Flags [.], ack 74812, win 261, options [nop,nop,TS val 3392734024 ecr 3083156888], length 0
12:34:21.126336 IP 10.8.1.4.40384 > 103.53.48.87.1935: Flags [.], seq 90843:92157, ack 0, win 501, options [nop,nop,TS val 3083157453 ecr 3392734024], length 1314
12:34:21.134622 IP 103.53.48.87.1935 > 10.8.1.4.40384: Flags [.], ack 76126, win 267, options [nop,nop,TS val 3392734056 ecr 3083156920], length 0
12:34:21.195883 IP 10.8.1.4.40384 > 103.53.48.87.1935: Flags [.], seq 92157:93471, ack 0, win 501, options [nop,nop,TS val 3083157522 ecr 3392734056], length 1314
12:34:21.202679 IP 103.53.48.87.1935 > 10.8.1.4.40384: Flags [.], ack 77440, win 272, options [nop,nop,TS val 3392734124 ecr 3083156988], length 0
12:34:21.228840 IP 10.8.1.4.40384 > 103.53.48.87.1935: Flags [.], seq 93471:94785, ack 0, win 501, options [nop,nop,TS val 3083157555 ecr 3392734124], length 1314
12:34:21.235570 IP 103.53.48.87.1935 > 10.8.1.4.40384: Flags [.], ack 78754, win 278, options [nop,nop,TS val 3392734157 ecr 3083157021], length 0
12:34:21.260511 IP 10.8.1.4.40384 > 103.53.48.87.1935: Flags [.], seq 94785:96099, ack 0, win 501, options [nop,nop,TS val 3083157587 ecr 3392734157], length 1314
12:34:21.269995 IP 103.53.48.87.1935 > 10.8.1.4.40384: Flags [.], ack 80068, win 283, options [nop,nop,TS val 3392734191 ecr 3083157055], length 0
12:34:21.326519 IP 10.8.1.4.40384 > 103.53.48.87.1935: Flags [.], seq 96099:97413, ack 0, win 501, options [nop,nop,TS val 3083157653 ecr 3392734191], length 1314
12:34:21.335004 IP 103.53.48.87.1935 > 10.8.1.4.40384: Flags [.], ack 81382, win 289, options [nop,nop,TS val 3392734256 ecr 3083157121], length 0
12:34:21.358147 IP 10.8.1.4.40384 > 103.53.48.87.1935: Flags [.], seq 97413:98727, ack 0, win 501, options [nop,nop,TS val 3083157684 ecr 3392734256], length 1314
12:34:21.365526 IP 103.53.48.87.1935 > 10.8.1.4.40384: Flags [.], ack 82696, win 295, options [nop,nop,TS val 3392734287 ecr 3083157151], length 0
12:34:21.392389 IP 10.8.1.4.40384 > 103.53.48.87.1935: Flags [.], seq 98727:100041, ack 0, win 501, options [nop,nop,TS val 3083157719 ecr 3392734287], length 1314
12:34:21.399606 IP 103.53.48.87.1935 > 10.8.1.4.40384: Flags [.], ack 84010, win 300, options [nop,nop,TS val 3392734321 ecr 3083157185], length 0
12:34:21.462296 IP 10.8.1.4.40384 > 103.53.48.87.1935: Flags [.], seq 100041:101355, ack 0, win 501, options [nop,nop,TS val 3083157789 ecr 3392734321], length 1314
12:34:21.470040 IP 103.53.48.87.1935 > 10.8.1.4.40384: Flags [.], ack 85324, win 306, options [nop,nop,TS val 3392734391 ecr 3083157255], length 0
12:34:21.491532 IP 10.8.1.4.40384 > 103.53.48.87.1935: Flags [.], seq 101355:102669, ack 0, win 501, options [nop,nop,TS val 3083157818 ecr 3392734391], length 1314
12:34:21.501356 IP 103.53.48.87.1935 > 10.8.1.4.40384: Flags [.], ack 86638, win 312, options [nop,nop,TS val 3392734423 ecr 3083157287], length 0
12:34:21.525020 IP 10.8.1.4.40384 > 103.53.48.87.1935: Flags [.], seq 102669:103983, ack 0, win 501, options [nop,nop,TS val 3083157851 ecr 3392734423], length 1314
12:34:21.534025 IP 103.53.48.87.1935 > 10.8.1.4.40384: Flags [.], ack 87952, win 317, options [nop,nop,TS val 3392734455 ecr 3083157319], length 0
12:34:21.540808 IP 103.53.48.87.1935 > 10.8.1.4.40384: Flags [.], ack 88215, win 323, options [nop,nop,TS val 3392734462 ecr 3083157326], length 0
12:34:21.540819 IP 10.8.1.4.40384 > 103.53.48.87.1935: Flags [P.], seq 103983:104137, ack 0, win 501, options [nop,nop,TS val 3083157867 ecr 3392734462], length 154
12:34:21.595586 IP 10.8.1.4.40384 > 103.53.48.87.1935: Flags [.], seq 104137:105451, ack 0, win 501, options [nop,nop,TS val 3083157922 ecr 3392734462], length 1314
12:34:21.603397 IP 103.53.48.87.1935 > 10.8.1.4.40384: Flags [.], ack 89529, win 328, options [nop,nop,TS val 3392734525 ecr 3083157389], length 0
12:34:21.624887 IP 10.8.1.4.40384 > 103.53.48.87.1935: Flags [.], seq 105451:106765, ack 0, win 501, options [nop,nop,TS val 3083157951 ecr 3392734525], length 1314
12:34:21.636774 IP 103.53.48.87.1935 > 10.8.1.4.40384: Flags [.], ack 90843, win 334, options [nop,nop,TS val 3392734558 ecr 3083157422], length 0
12:34:21.659170 IP 10.8.1.4.40384 > 103.53.48.87.1935: Flags [.], seq 106765:108079, ack 0, win 501, options [nop,nop,TS val 3083157985 ecr 3392734558], length 1314
12:34:21.667198 IP 103.53.48.87.1935 > 10.8.1.4.40384: Flags [.], ack 92157, win 340, options [nop,nop,TS val 3392734589 ecr 3083157453], length 0
12:34:21.728940 IP 10.8.1.4.40384 > 103.53.48.87.1935: Flags [.], seq 108079:109393, ack 0, win 501, options [nop,nop,TS val 3083158055 ecr 3392734589], length 1314
12:34:21.736764 IP 103.53.48.87.1935 > 10.8.1.4.40384: Flags [.], ack 93471, win 345, options [nop,nop,TS val 3392734658 ecr 3083157522], length 0
12:34:21.762312 IP 10.8.1.4.40384 > 103.53.48.87.1935: Flags [.], seq 109393:110707, ack 0, win 501, options [nop,nop,TS val 3083158089 ecr 3392734658], length 1314
12:34:21.769990 IP 103.53.48.87.1935 > 10.8.1.4.40384: Flags [.], ack 94785, win 351, options [nop,nop,TS val 3392734691 ecr 3083157555], length 0
12:34:21.795418 IP 10.8.1.4.40384 > 103.53.48.87.1935: Flags [.], seq 110707:112021, ack 0, win 501, options [nop,nop,TS val 3083158122 ecr 3392734691], length 1314
12:34:21.801258 IP 103.53.48.87.1935 > 10.8.1.4.40384: Flags [.], ack 96099, win 357, options [nop,nop,TS val 3392734723 ecr 3083157587], length 0
12:34:21.862407 IP 10.8.1.4.40384 > 103.53.48.87.1935: Flags [.], seq 112021:113335, ack 0, win 501, options [nop,nop,TS val 3083158189 ecr 3392734723], length 1314
12:34:21.867394 IP 103.53.48.87.1935 > 10.8.1.4.40384: Flags [.], ack 97413, win 362, options [nop,nop,TS val 3392734789 ecr 3083157653], length 0
12:34:21.895627 IP 10.8.1.4.40384 > 103.53.48.87.1935: Flags [.], seq 113335:114649, ack 0, win 501, options [nop,nop,TS val 3083158222 ecr 3392734789], length 1314
12:34:21.898800 IP 103.53.48.87.1935 > 10.8.1.4.40384: Flags [.], ack 98727, win 368, options [nop,nop,TS val 3392734820 ecr 3083157684], length 0
12:34:21.926563 IP 10.8.1.4.40384 > 103.53.48.87.1935: Flags [.], seq 114649:115963, ack 0, win 501, options [nop,nop,TS val 3083158253 ecr 3392734820], length 1314
12:34:21.933163 IP 103.53.48.87.1935 > 10.8.1.4.40384: Flags [.], ack 100041, win 373, options [nop,nop,TS val 3392734855 ecr 3083157719], length 0
12:34:21.995840 IP 10.8.1.4.40384 > 103.53.48.87.1935: Flags [.], seq 115963:117277, ack 0, win 501, options [nop,nop,TS val 3083158322 ecr 3392734855], length 1314
12:34:22.006633 IP 103.53.48.87.1935 > 10.8.1.4.40384: Flags [.], ack 101355, win 379, options [nop,nop,TS val 3392734925 ecr 3083157789], length 0
12:34:22.026411 IP 10.8.1.4.40384 > 103.53.48.87.1935: Flags [.], seq 117277:118591, ack 0, win 501, options [nop,nop,TS val 3083158353 ecr 3392734925], length 1314
12:34:22.032384 IP 103.53.48.87.1935 > 10.8.1.4.40384: Flags [.], ack 102669, win 385, options [nop,nop,TS val 3392734954 ecr 3083157818], length 0
12:34:22.059784 IP 10.8.1.4.40384 > 103.53.48.87.1935: Flags [.], seq 118591:119905, ack 0, win 501, options [nop,nop,TS val 3083158386 ecr 3392734954], length 1314
12:34:22.065669 IP 103.53.48.87.1935 > 10.8.1.4.40384: Flags [.], ack 103983, win 390, options [nop,nop,TS val 3392734987 ecr 3083157851], length 0
12:34:22.081229 IP 103.53.48.87.1935 > 10.8.1.4.40384: Flags [.], ack 104137, win 396, options [nop,nop,TS val 3392735003 ecr 3083157867], length 0
12:34:22.081248 IP 10.8.1.4.40384 > 103.53.48.87.1935: Flags [P.], seq 119905:120066, ack 0, win 501, options [nop,nop,TS val 3083158408 ecr 3392735003], length 161
12:34:22.128894 IP 10.8.1.4.40384 > 103.53.48.87.1935: Flags [.], seq 120066:121380, ack 0, win 501, options [nop,nop,TS val 3083158455 ecr 3392735003], length 1314
12:34:22.136391 IP 103.53.48.87.1935 > 10.8.1.4.40384: Flags [.], ack 105451, win 401, options [nop,nop,TS val 3392735058 ecr 3083157922], length 0
12:34:22.160718 IP 10.8.1.4.40384 > 103.53.48.87.1935: Flags [.], seq 121380:122694, ack 0, win 501, options [nop,nop,TS val 3083158487 ecr 3392735058], length 1314
12:34:22.165586 IP 103.53.48.87.1935 > 10.8.1.4.40384: Flags [.], ack 106765, win 407, options [nop,nop,TS val 3392735087 ecr 3083157951], length 0
12:34:22.191575 IP 10.8.1.4.40384 > 103.53.48.87.1935: Flags [.], seq 122694:124008, ack 0, win 501, options [nop,nop,TS val 3083158518 ecr 3392735087], length 1314
12:34:22.200203 IP 103.53.48.87.1935 > 10.8.1.4.40384: Flags [.], ack 108079, win 413, options [nop,nop,TS val 3392735122 ecr 3083157985], length 0
12:34:22.255629 IP 10.8.1.4.40384 > 103.53.48.87.1935: Flags [.], seq 124008:125322, ack 0, win 501, options [nop,nop,TS val 3083158582 ecr 3392735122], length 1314
12:34:22.269699 IP 103.53.48.87.1935 > 10.8.1.4.40384: Flags [.], ack 109393, win 418, options [nop,nop,TS val 3392735191 ecr 3083158055], length 0
12:34:22.276775 IP 10.8.1.4.40384 > 103.53.48.87.1935: Flags [.], seq 125322:126636, ack 0, win 501, options [nop,nop,TS val 3083158603 ecr 3392735191], length 1314
12:34:22.303174 IP 103.53.48.87.1935 > 10.8.1.4.40384: Flags [.], ack 110707, win 424, options [nop,nop,TS val 3392735225 ecr 3083158089], length 0
12:34:22.319174 IP 10.8.1.4.40384 > 103.53.48.87.1935: Flags [.], seq 126636:127950, ack 0, win 501, options [nop,nop,TS val 3083158645 ecr 3392735225], length 1314
12:34:22.336354 IP 103.53.48.87.1935 > 10.8.1.4.40384: Flags [.], ack 112021, win 430, options [nop,nop,TS val 3392735258 ecr 3083158122], length 0
12:34:22.395827 IP 10.8.1.4.40384 > 103.53.48.87.1935: Flags [.], seq 127950:129264, ack 0, win 501, options [nop,nop,TS val 3083158722 ecr 3392735258], length 1314
12:34:22.403370 IP 103.53.48.87.1935 > 10.8.1.4.40384: Flags [.], ack 113335, win 435, options [nop,nop,TS val 3392735325 ecr 3083158189], length 0
12:34:22.426555 IP 10.8.1.4.40384 > 103.53.48.87.1935: Flags [.], seq 129264:130578, ack 0, win 501, options [nop,nop,TS val 3083158753 ecr 3392735325], length 1314
12:34:22.436770 IP 103.53.48.87.1935 > 10.8.1.4.40384: Flags [.], ack 114649, win 441, options [nop,nop,TS val 3392735358 ecr 3083158222], length 0
12:34:22.448009 IP 10.8.1.4.40384 > 103.53.48.87.1935: Flags [.], seq 130578:131892, ack 0, win 501, options [nop,nop,TS val 3083158774 ecr 3392735358], length 1314
12:34:22.467232 IP 103.53.48.87.1935 > 10.8.1.4.40384: Flags [.], ack 115963, win 446, options [nop,nop,TS val 3392735389 ecr 3083158253], length 0
12:34:22.512209 IP 10.8.1.4.40384 > 103.53.48.87.1935: Flags [.], seq 131892:133206, ack 0, win 501, options [nop,nop,TS val 3083158839 ecr 3392735389], length 1314
12:34:22.537082 IP 103.53.48.87.1935 > 10.8.1.4.40384: Flags [.], ack 117277, win 452, options [nop,nop,TS val 3392735459 ecr 3083158322], length 0
12:34:22.555208 IP 10.8.1.4.40384 > 103.53.48.87.1935: Flags [.], seq 133206:134520, ack 0, win 501, options [nop,nop,TS val 3083158882 ecr 3392735459], length 1314
12:34:22.567279 IP 103.53.48.87.1935 > 10.8.1.4.40384: Flags [.], ack 118591, win 458, options [nop,nop,TS val 3392735489 ecr 3083158353], length 0
12:34:22.576709 IP 10.8.1.4.40384 > 103.53.48.87.1935: Flags [.], seq 134520:135834, ack 0, win 501, options [nop,nop,TS val 3083158903 ecr 3392735489], length 1314
12:34:22.600911 IP 103.53.48.87.1935 > 10.8.1.4.40384: Flags [.], ack 119905, win 463, options [nop,nop,TS val 3392735522 ecr 3083158386], length 0
12:34:22.621866 IP 103.53.48.87.1935 > 10.8.1.4.40384: Flags [.], ack 120066, win 469, options [nop,nop,TS val 3392735543 ecr 3083158408], length 0
12:34:22.621904 IP 10.8.1.4.40384 > 103.53.48.87.1935: Flags [P.], seq 135834:136945, ack 0, win 501, options [nop,nop,TS val 3083158948 ecr 3392735543], length 1111
12:34:22.669840 IP 103.53.48.87.1935 > 10.8.1.4.40384: Flags [.], ack 121380, win 474, options [nop,nop,TS val 3392735591 ecr 3083158455], length 0
12:34:22.684072 IP 10.8.1.4.40384 > 103.53.48.87.1935: Flags [.], seq 136945:138259, ack 0, win 501, options [nop,nop,TS val 3083159010 ecr 3392735591], length 1314
12:34:22.701467 IP 103.53.48.87.1935 > 10.8.1.4.40384: Flags [.], ack 122694, win 480, options [nop,nop,TS val 3392735623 ecr 3083158487], length 0
12:34:22.726726 IP 10.8.1.4.40384 > 103.53.48.87.1935: Flags [.], seq 138259:139573, ack 0, win 501, options [nop,nop,TS val 3083159053 ecr 3392735623], length 1314
12:34:22.732626 IP 103.53.48.87.1935 > 10.8.1.4.40384: Flags [.], ack 124008, win 486, options [nop,nop,TS val 3392735654 ecr 3083158518], length 0
12:34:22.748089 IP 10.8.1.4.40384 > 103.53.48.87.1935: Flags [.], seq 139573:140887, ack 0, win 501, options [nop,nop,TS val 3083159074 ecr 3392735654], length 1314
12:34:22.796353 IP 103.53.48.87.1935 > 10.8.1.4.40384: Flags [.], ack 125322, win 491, options [nop,nop,TS val 3392735718 ecr 3083158582], length 0
12:34:22.812047 IP 10.8.1.4.40384 > 103.53.48.87.1935: Flags [.], seq 140887:142201, ack 0, win 501, options [nop,nop,TS val 3083159138 ecr 3392735718], length 1314
12:34:22.817408 IP 103.53.48.87.1935 > 10.8.1.4.40384: Flags [.], ack 126636, win 497, options [nop,nop,TS val 3392735739 ecr 3083158603], length 0
12:34:22.854436 IP 10.8.1.4.40384 > 103.53.48.87.1935: Flags [.], seq 142201:143515, ack 0, win 501, options [nop,nop,TS val 3083159181 ecr 3392735739], length 1314
12:34:22.860044 IP 103.53.48.87.1935 > 10.8.1.4.40384: Flags [.], ack 127950, win 503, options [nop,nop,TS val 3392735782 ecr 3083158645], length 0
12:34:22.875683 IP 10.8.1.4.40384 > 103.53.48.87.1935: Flags [.], seq 143515:144829, ack 0, win 501, options [nop,nop,TS val 3083159202 ecr 3392735782], length 1314
12:34:22.936665 IP 103.53.48.87.1935 > 10.8.1.4.40384: Flags [.], ack 129264, win 508, options [nop,nop,TS val 3392735858 ecr 3083158722], length 0
12:34:22.958212 IP 10.8.1.4.40384 > 103.53.48.87.1935: Flags [.], seq 144829:146143, ack 0, win 501, options [nop,nop,TS val 3083159285 ecr 3392735858], length 1314
12:34:22.967605 IP 103.53.48.87.1935 > 10.8.1.4.40384: Flags [.], ack 130578, win 514, options [nop,nop,TS val 3392735889 ecr 3083158753], length 0
12:34:22.982094 IP 10.8.1.4.40384 > 103.53.48.87.1935: Flags [.], seq 146143:147457, ack 0, win 501, options [nop,nop,TS val 3083159308 ecr 3392735889], length 1314
12:34:22.989232 IP 103.53.48.87.1935 > 10.8.1.4.40384: Flags [.], ack 131892, win 519, options [nop,nop,TS val 3392735910 ecr 3083158774], length 0
12:34:23.024669 IP 10.8.1.4.40384 > 103.53.48.87.1935: Flags [.], seq 147457:148771, ack 0, win 501, options [nop,nop,TS val 3083159351 ecr 3392735910], length 1314
12:34:23.053111 IP 103.53.48.87.1935 > 10.8.1.4.40384: Flags [.], ack 133206, win 525, options [nop,nop,TS val 3392735974 ecr 3083158839], length 0
12:34:23.088990 IP 10.8.1.4.40384 > 103.53.48.87.1935: Flags [.], seq 148771:150085, ack 0, win 501, options [nop,nop,TS val 3083159415 ecr 3392735974], length 1314
12:34:23.110578 IP 10.8.1.4.40384 > 103.53.48.87.1935: Flags [.], seq 150085:151399, ack 0, win 501, options [nop,nop,TS val 3083159437 ecr 3392735974], length 1314
12:34:23.153258 IP 10.8.1.4.40384 > 103.53.48.87.1935: Flags [.], seq 151399:152713, ack 0, win 501, options [nop,nop,TS val 3083159480 ecr 3392735974], length 1314
12:34:23.216972 IP 10.8.1.4.40384 > 103.53.48.87.1935: Flags [.], seq 152713:154027, ack 0, win 501, options [nop,nop,TS val 3083159543 ecr 3392735974], length 1314
12:34:23.259524 IP 10.8.1.4.40384 > 103.53.48.87.1935: Flags [.], seq 154027:155341, ack 0, win 501, options [nop,nop,TS val 3083159586 ecr 3392735974], length 1314
12:34:23.280910 IP 10.8.1.4.40384 > 103.53.48.87.1935: Flags [.], seq 155341:156655, ack 0, win 501, options [nop,nop,TS val 3083159607 ecr 3392735974], length 1314
12:34:23.345394 IP 10.8.1.4.40384 > 103.53.48.87.1935: Flags [.], seq 156655:157969, ack 0, win 501, options [nop,nop,TS val 3083159672 ecr 3392735974], length 1314
12:34:23.388245 IP 10.8.1.4.40384 > 103.53.48.87.1935: Flags [.], seq 157969:159283, ack 0, win 501, options [nop,nop,TS val 3083159715 ecr 3392735974], length 1314
12:34:23.409618 IP 10.8.1.4.40384 > 103.53.48.87.1935: Flags [.], seq 159283:160597, ack 0, win 501, options [nop,nop,TS val 3083159736 ecr 3392735974], length 1314
12:34:23.460820 IP 10.8.1.4.40384 > 103.53.48.87.1935: Flags [.], seq 160597:161911, ack 0, win 501, options [nop,nop,TS val 3083159787 ecr 3392735974], length 1314
12:34:23.515786 IP 10.8.1.4.40384 > 103.53.48.87.1935: Flags [.], seq 161911:163225, ack 0, win 501, options [nop,nop,TS val 3083159842 ecr 3392735974], length 1314
12:34:23.558600 IP 10.8.1.4.40384 > 103.53.48.87.1935: Flags [.], seq 163225:164539, ack 0, win 501, options [nop,nop,TS val 3083159885 ecr 3392735974], length 1314
12:34:23.591922 IP 10.8.1.4.40384 > 103.53.48.87.1935: Flags [.], seq 164539:165853, ack 0, win 501, options [nop,nop,TS val 3083159918 ecr 3392735974], length 1314
12:34:23.643366 IP 10.8.1.4.40384 > 103.53.48.87.1935: Flags [.], seq 165853:167167, ack 0, win 501, options [nop,nop,TS val 3083159970 ecr 3392735974], length 1314
12:34:23.686396 IP 10.8.1.4.40384 > 103.53.48.87.1935: Flags [.], seq 167167:168481, ack 0, win 501, options [nop,nop,TS val 3083160013 ecr 3392735974], length 1314
12:34:23.729347 IP 10.8.1.4.40384 > 103.53.48.87.1935: Flags [.], seq 168481:169795, ack 0, win 501, options [nop,nop,TS val 3083160056 ecr 3392735974], length 1314
12:34:23.793193 IP 10.8.1.4.40384 > 103.53.48.87.1935: Flags [.], seq 169795:171109, ack 0, win 501, options [nop,nop,TS val 3083160120 ecr 3392735974], length 1314
12:34:23.814745 IP 10.8.1.4.40384 > 103.53.48.87.1935: Flags [.], seq 171109:172423, ack 0, win 501, options [nop,nop,TS val 3083160141 ecr 3392735974], length 1314
12:34:23.857626 IP 10.8.1.4.40384 > 103.53.48.87.1935: Flags [.], seq 172423:173737, ack 0, win 501, options [nop,nop,TS val 3083160184 ecr 3392735974], length 1314
12:34:23.921850 IP 10.8.1.4.40384 > 103.53.48.87.1935: Flags [.], seq 173737:175051, ack 0, win 501, options [nop,nop,TS val 3083160248 ecr 3392735974], length 1314
12:34:23.943226 IP 10.8.1.4.40384 > 103.53.48.87.1935: Flags [.], seq 175051:176365, ack 0, win 501, options [nop,nop,TS val 3083160270 ecr 3392735974], length 1314
12:34:23.986037 IP 10.8.1.4.40384 > 103.53.48.87.1935: Flags [.], seq 176365:177679, ack 0, win 501, options [nop,nop,TS val 3083160312 ecr 3392735974], length 1314
12:34:24.049709 IP 10.8.1.4.40384 > 103.53.48.87.1935: Flags [.], seq 177679:178993, ack 0, win 501, options [nop,nop,TS val 3083160376 ecr 3392735974], length 1314
12:34:24.092393 IP 10.8.1.4.40384 > 103.53.48.87.1935: Flags [.], seq 178993:180307, ack 0, win 501, options [nop,nop,TS val 3083160419 ecr 3392735974], length 1314
12:34:24.113819 IP 10.8.1.4.40384 > 103.53.48.87.1935: Flags [.], seq 180307:181621, ack 0, win 501, options [nop,nop,TS val 3083160440 ecr 3392735974], length 1314
12:34:24.146118 IP 10.8.1.4.40384 > 103.53.48.87.1935: Flags [P.], seq 181621:181904, ack 0, win 501, options [nop,nop,TS val 3083160472 ecr 3392735974], length 283
12:34:24.178457 IP 10.8.1.4.40384 > 103.53.48.87.1935: Flags [.], seq 181904:183218, ack 0, win 501, options [nop,nop,TS val 3083160505 ecr 3392735974], length 1314
12:34:24.221440 IP 10.8.1.4.40384 > 103.53.48.87.1935: Flags [.], seq 183218:184532, ack 0, win 501, options [nop,nop,TS val 3083160548 ecr 3392735974], length 1314
12:34:24.264085 IP 10.8.1.4.40384 > 103.53.48.87.1935: Flags [.], seq 184532:185846, ack 0, win 501, options [nop,nop,TS val 3083160590 ecr 3392735974], length 1314
12:34:24.325351 IP 10.8.1.4.40384 > 103.53.48.87.1935: Flags [.], seq 185846:187160, ack 0, win 501, options [nop,nop,TS val 3083160652 ecr 3392735974], length 1314
12:34:24.349087 IP 10.8.1.4.40384 > 103.53.48.87.1935: Flags [.], seq 187160:188474, ack 0, win 501, options [nop,nop,TS val 3083160675 ecr 3392735974], length 1314
12:34:24.395701 IP 10.8.1.4.40384 > 103.53.48.87.1935: Flags [.], seq 188474:189788, ack 0, win 501, options [nop,nop,TS val 3083160722 ecr 3392735974], length 1314
12:34:24.456314 IP 10.8.1.4.40384 > 103.53.48.87.1935: Flags [.], seq 189788:191102, ack 0, win 501, options [nop,nop,TS val 3083160783 ecr 3392735974], length 1314
12:34:24.477596 IP 10.8.1.4.40384 > 103.53.48.87.1935: Flags [.], seq 191102:192416, ack 0, win 501, options [nop,nop,TS val 3083160804 ecr 3392735974], length 1314
12:34:25.081473 IP 103.53.48.87.1935 > 10.8.1.4.40384: Flags [.], ack 134520, win 531, options [nop,nop,TS val 3392736018 ecr 3083158882], length 0
12:34:25.081488 IP 10.8.1.4.40384 > 103.53.48.87.1935: Flags [.], seq 192416:193730, ack 0, win 501, options [nop,nop,TS val 3083161408 ecr 3392736018], length 1314
12:34:25.081489 IP 10.8.1.4.40384 > 103.53.48.87.1935: Flags [P.], seq 193730:195044, ack 0, win 501, options [nop,nop,TS val 3083161408 ecr 3392736018], length 1314
12:34:25.081496 IP 103.53.48.87.1935 > 10.8.1.4.40384: Flags [.], ack 135834, win 536, options [nop,nop,TS val 3392736039 ecr 3083158903], length 0
12:34:25.081499 IP 10.8.1.4.40384 > 103.53.48.87.1935: Flags [.], seq 195044:196358, ack 0, win 501, options [nop,nop,TS val 3083161408 ecr 3392736039], length 1314
12:34:25.081500 IP 10.8.1.4.40384 > 103.53.48.87.1935: Flags [P.], seq 196358:197672, ack 0, win 501, options [nop,nop,TS val 3083161408 ecr 3392736039], length 1314
12:34:25.081503 IP 103.53.48.87.1935 > 10.8.1.4.40384: Flags [.], ack 136945, win 542, options [nop,nop,TS val 3392736084 ecr 3083158948], length 0
12:34:25.081506 IP 10.8.1.4.40384 > 103.53.48.87.1935: Flags [.], seq 197672:198986, ack 0, win 501, options [nop,nop,TS val 3083161408 ecr 3392736084], length 1314
12:34:25.081507 IP 10.8.1.4.40384 > 103.53.48.87.1935: Flags [P.], seq 198986:200300, ack 0, win 501, options [nop,nop,TS val 3083161408 ecr 3392736084], length 1314
12:34:25.081511 IP 103.53.48.87.1935 > 10.8.1.4.40384: Flags [.], ack 138259, win 548, options [nop,nop,TS val 3392736147 ecr 3083159010], length 0
12:34:25.081513 IP 10.8.1.4.40384 > 103.53.48.87.1935: Flags [.], seq 200300:201614, ack 0, win 501, options [nop,nop,TS val 3083161408 ecr 3392736147], length 1314
12:34:25.081514 IP 10.8.1.4.40384 > 103.53.48.87.1935: Flags [P.], seq 201614:202928, ack 0, win 501, options [nop,nop,TS val 3083161408 ecr 3392736147], length 1314
12:34:25.081517 IP 103.53.48.87.1935 > 10.8.1.4.40384: Flags [.], ack 139573, win 553, options [nop,nop,TS val 3392736189 ecr 3083159053], length 0
12:34:25.081521 IP 10.8.1.4.40384 > 103.53.48.87.1935: Flags [.], seq 202928:204242, ack 0, win 501, options [nop,nop,TS val 3083161408 ecr 3392736189], length 1314
12:34:25.081521 IP 10.8.1.4.40384 > 103.53.48.87.1935: Flags [P.], seq 204242:205556, ack 0, win 501, options [nop,nop,TS val 3083161408 ecr 3392736189], length 1314
12:34:25.081524 IP 103.53.48.87.1935 > 10.8.1.4.40384: Flags [.], ack 140887, win 559, options [nop,nop,TS val 3392736210 ecr 3083159074], length 0
