12:41:11.480181 IP 10.8.0.4.42452 > 99.181.90.254.1935: Flags [.], seq 58495316:58496630, ack 1633181639, win 501, options [nop,nop,TS val 3881070446 ecr 3896129405], length 1314
12:41:11.484245 IP 99.181.90.254.1935 > 10.8.0.4.42452: Flags [.], ack 4294960591, win 126, options [nop,nop,TS val 3896129477 ecr 3881070131], length 0
12:41:11.511152 IP 99.181.90.254.1935 > 10.8.0.4.42452: Flags [.], ack 4294960726, win 126, options [nop,nop,TS val 3896129503 ecr 3881070196], length 0
12:41:11.511164 IP 10.8.0.4.42452 > 99.181.90.254.1935: Flags [P.], seq 1314:2287, ack 1, win 501, options [nop,nop,TS val 3881070477 ecr 3896129503], length 973
12:41:11.565078 IP 10.8.0.4.42452 > 99.181.90.254.1935: Flags [.], seq 2287:3601, ack 1, win 501, options [nop,nop,TS val 3881070531 ecr 3896129503], length 1314
12:41:11.577404 IP 99.181.90.254.1935 > 10.8.0.4.42452: Flags [.], ack 4294963354, win 126, options [nop,nop,TS val 3896129570 ecr 3881070228], length 0
12:41:11.600200 IP 10.8.0.4.42452 > 99.181.90.254.1935: Flags [.], seq 3601:4915, ack 1, win 501, options [nop,nop,TS val 3881070566 ecr 3896129570], length 1314
12:41:11.633654 IP 10.8.0.4.42452 > 99.181.90.254.1935: Flags [.], seq 4915:6229, ack 1, win 501, options [nop,nop,TS val 3881070599 ecr 3896129570], length 1314
12:41:11.681700 IP 99.181.90.254.1935 > 10.8.0.4.42452: Flags [.], ack 4294965982, win 126, options [nop,nop,TS val 3896129674 ecr 3881070318], length 0
12:41:11.696578 IP 10.8.0.4.42452 > 99.181.90.254.1935: Flags [.], seq 6229:7543, ack 1, win 501, options [nop,nop,TS val 3881070662 ecr 3896129674], length 1314
12:41:11.732936 IP 10.8.0.4.42452 > 99.181.90.254.1935: Flags [.], seq 7543:8857, ack 1, win 501, options [nop,nop,TS val 3881070699 ecr 3896129674], length 1314
12:41:11.761190 IP 99.181.90.254.1935 > 10.8.0.4.42452: Flags [.], ack 1314, win 126, options [nop,nop,TS val 3896129754 ecr 3881070396], length 0
12:41:11.766895 IP 10.8.0.4.42452 > 99.181.90.254.1935: Flags [.], seq 8857:10171, ack 1, win 501, options [nop,nop,TS val 3881070733 ecr 3896129754], length 1314
12:41:11.792408 IP 99.181.90.254.1935 > 10.8.0.4.42452: Flags [.], ack 2287, win 126, options [nop,nop,TS val 3896129785 ecr 3881070477], length 0
12:41:11.792441 IP 10.8.0.4.42452 > 99.181.90.254.1935: Flags [P.], seq 10171:10297, ack 1, win 501, options [nop,nop,TS val 3881070758 ecr 3896129785], length 126
12:41:11.833468 IP 10.8.0.4.42452 > 99.181.90.254.1935: Flags [.], seq 10297:11611, ack 1, win 501, options [nop,nop,TS val 3881070799 ecr 3896129785], length 1314
12:41:11.865257 IP 10.8.0.4.42452 > 99.181.90.254.1935: Flags [.], seq 11611:12925, ack 1, win 501, options [nop,nop,TS val 3881070831 ecr 3896129785], length 1314
12:41:11.881587 IP 99.181.90.254.1935 > 10.8.0.4.42452: Flags [.], ack 4915, win 126, options [nop,nop,TS val 3896129874 ecr 3881070531], length 0
12:41:11.908008 IP 10.8.0.4.42452 > 99.181.90.254.1935: Flags [.], seq 12925:14239, ack 1, win 501, options [nop,nop,TS val 3881070874 ecr 3896129874], length 1314
12:41:11.962779 IP 10.8.0.4.42452 > 99.181.90.254.1935: Flags [.], seq 14239:15553, ack 1, win 501, options [nop,nop,TS val 3881070928 ecr 3896129874], length 1314
12:41:11.977756 IP 99.181.90.254.1935 > 10.8.0.4.42452: Flags [.], ack 7543, win 126, options [nop,nop,TS val 3896129970 ecr 3881070599], length 0
12:41:11.996228 IP 10.8.0.4.42452 > 99.181.90.254.1935: Flags [.], seq 15553:16867, ack 1, win 501, options [nop,nop,TS val 3881070962 ecr 3896129970], length 1314
12:41:12.035079 IP 10.8.0.4.42452 > 99.181.90.254.1935: Flags [.], seq 16867:18181, ack 1, win 501, options [nop,nop,TS val 3881071001 ecr 3896129970], length 1314
12:41:12.047911 IP 99.181.90.254.1935 > 10.8.0.4.42452: Flags [.], ack 10171, win 126, options [nop,nop,TS val 3896130041 ecr 3881070699], length 0
12:41:12.073778 IP 99.181.90.254.1935 > 10.8.0.4.42452: Flags [.], ack 10297, win 126, options [nop,nop,TS val 3896130066 ecr 3881070758], length 0
12:41:12.073791 IP 10.8.0.4.42452 > 99.181.90.254.1935: Flags [P.], seq 18181:19163, ack 1, win 501, options [nop,nop,TS val 3881071039 ecr 3896130066], length 982
12:41:12.129234 IP 10.8.0.4.42452 > 99.181.90.254.1935: Flags [.], seq 19163:20477, ack 1, win 501, options [nop,nop,TS val 3881071095 ecr 3896130066], length 1314
12:41:12.146291 IP 99.181.90.254.1935 > 10.8.0.4.42452: Flags [.], ack 12925, win 126, options [nop,nop,TS val 3896130139 ecr 3881070799], length 0
12:41:12.166485 IP 10.8.0.4.42452 > 99.181.90.254.1935: Flags [.], seq 20477:21791, ack 1, win 501, options [nop,nop,TS val 3881071132 ecr 3896130139], length 1314
12:41:12.199858 IP 10.8.0.4.42452 > 99.181.90.254.1935: Flags [.], seq 21791:23105, ack 1, win 501, options [nop,nop,TS val 3881071166 ecr 3896130139], length 1314
12:41:12.244122 IP 99.181.90.254.1935 > 10.8.0.4.42452: Flags [.], ack 15553, win 126, options [nop,nop,TS val 3896130236 ecr 3881070874], length 0
12:41:12.264019 IP 10.8.0.4.42452 > 99.181.90.254.1935: Flags [.], seq 23105:24419, ack 1, win 501, options [nop,nop,TS val 3881071230 ecr 3896130236], length 1314
12:41:12.299617 IP 10.8.0.4.42452 > 99.181.90.254.1935: Flags [.], seq 24419:25733, ack 1, win 501, options [nop,nop,TS val 3881071265 ecr 3896130236], length 1314
12:41:12.316293 IP 99.181.90.254.1935 > 10.8.0.4.42452: Flags [.], ack 18181, win 126, options [nop,nop,TS val 3896130309 ecr 3881070962], length 0
12:41:12.333888 IP 10.8.0.4.42452 > 99.181.90.254.1935: Flags [.], seq 25733:27047, ack 1, win 501, options [nop,nop,TS val 3881071300 ecr 3896130309], length 1314
12:41:12.354781 IP 99.181.90.254.1935 > 10.8.0.4.42452: Flags [.], ack 19163, win 126, options [nop,nop,TS val 3896130347 ecr 3881071039], length 0
12:41:12.354818 IP 10.8.0.4.42452 > 99.181.90.254.1935: Flags [P.], seq 27047:27168, ack 1, win 501, options [nop,nop,TS val 3881071321 ecr 3896130347], length 121
12:41:12.398574 IP 10.8.0.4.42452 > 99.181.90.254.1935: Flags [.], seq 27168:28482, ack 1, win 501, options [nop,nop,TS val 3881071364 ecr 3896130347], length 1314
12:41:12.433562 IP 10.8.0.4.42452 > 99.181.90.254.1935: Flags [.], seq 28482:29796, ack 1, win 501, options [nop,nop,TS val 3881071399 ecr 3896130347], length 1314
12:41:12.447965 IP 99.181.90.254.1935 > 10.8.0.4.42452: Flags [.], ack 21791, win 126, options [nop,nop,TS val 3896130440 ecr 3881071095], length 0
12:41:12.466744 IP 10.8.0.4.42452 > 99.181.90.254.1935: Flags [.], seq 29796:31110, ack 1, win 501, options [nop,nop,TS val 3881071432 ecr 3896130440], length 1314
12:41:12.529968 IP 10.8.0.4.42452 > 99.181.90.254.1935: Flags [.], seq 31110:32424, ack 1, win 501, options [nop,nop,TS val 3881071496 ecr 3896130440], length 1314
12:41:12.545506 IP 99.181.90.254.1935 > 10.8.0.4.42452: Flags [.], ack 24419, win 126, options [nop,nop,TS val 3896130538 ecr 3881071166], length 0
12:41:12.564836 IP 10.8.0.4.42452 > 99.181.90.254.1935: Flags [.], seq 32424:33738, ack 1, win 501, options [nop,nop,TS val 3881071531 ecr 3896130538], length 1314
12:41:12.600291 IP 10.8.0.4.42452 > 99.181.90.254.1935: Flags [.], seq 33738:35052, ack 1, win 501, options [nop,nop,TS val 3881071566 ecr 3896130538], length 1314
12:41:12.615248 IP 99.181.90.254.1935 > 10.8.0.4.42452: Flags [.], ack 27047, win 126, options [nop,nop,TS val 3896130608 ecr 3881071265], length 0
12:41:12.636013 IP 99.181.90.254.1935 > 10.8.0.4.42452: Flags [.], ack 27168, win 126, options [nop,nop,TS val 3896130629 ecr 3881071321], length 0
12:41:12.636053 IP 10.8.0.4.42452 > 99.181.90.254.1935: Flags [P.], seq 35052:36122, ack 1, win 501, options [nop,nop,TS val 3881071602 ecr 3896130629], length 1070
12:41:12.700403 IP 10.8.0.4.42452 > 99.181.90.254.1935: Flags [.], seq 36122:37436, ack 1, win 501, options [nop,nop,TS val 3881071666 ecr 3896130629], length 1314
12:41:12.714793 IP 99.181.90.254.1935 > 10.8.0.4.42452: Flags [.], ack 29796, win 126, options [nop,nop,TS val 3896130707 ecr 3881071364], length 0
12:41:12.733401 IP 10.8.0.4.42452 > 99.181.90.254.1935: Flags [.], seq 37436:38750, ack 1, win 501, options [nop,nop,TS val 3881071699 ecr 3896130707], length 1314
12:41:12.767033 IP 10.8.0.4.42452 > 99.181.90.254.1935: Flags [.], seq 38750:40064, ack 1, win 501, options [nop,nop,TS val 3881071733 ecr 3896130707], length 1314
12:41:12.811065 IP 99.181.90.254.1935 > 10.8.0.4.42452: Flags [.], ack 32424, win 126, options [nop,nop,TS val 3896130804 ecr 3881071432], length 0
12:41:12.833554 IP 10.8.0.4.42452 > 99.181.90.254.1935: Flags [.], seq 40064:41378, ack 1, win 501, options [nop,nop,TS val 3881071799 ecr 3896130804], length 1314
12:41:12.866378 IP 10.8.0.4.42452 > 99.181.90.254.1935: Flags [.], seq 41378:42692, ack 1, win 501, options [nop,nop,TS val 3881071832 ecr 3896130804], length 1314
12:41:12.882006 IP 99.181.90.254.1935 > 10.8.0.4.42452: Flags [.], ack 35052, win 126, options [nop,nop,TS val 3896130874 ecr 3881071531], length 0
12:41:12.900816 IP 10.8.0.4.42452 > 99.181.90.254.1935: Flags [.], seq 42692:44006, ack 1, win 501, options [nop,nop,TS val 3881071867 ecr 3896130874], length 1314
12:41:12.917385 IP 99.181.90.254.1935 > 10.8.0.4.42452: Flags [.], ack 36122, win 126, options [nop,nop,TS val 3896130910 ecr 3881071602], length 0
12:41:12.917418 IP 10.8.0.4.42452 > 99.181.90.254.1935: Flags [P.], seq 44006:44140, ack 1, win 501, options [nop,nop,TS val 3881071883 ecr 3896130910], length 134
12:41:12.966924 IP 10.8.0.4.42452 > 99.181.90.254.1935: Flags [.], seq 44140:45454, ack 1, win 501, options [nop,nop,TS val 3881071933 ecr 3896130910], length 1314
12:41:12.998172 IP 10.8.0.4.42452 > 99.181.90.254.1935: Flags [.], seq 45454:46768, ack 1, win 501, options [nop,nop,TS val 3881071964 ecr 3896130910], length 1314
12:41:13.016324 IP 99.181.90.254.1935 > 10.8.0.4.42452: Flags [.], ack 38750, win 126, options [nop,nop,TS val 3896131007 ecr 3881071666], length 0
12:41:13.040680 IP 10.8.0.4.42452 > 99.181.90.254.1935: Flags [.], seq 46768:48082, ack 1, win 501, options [nop,nop,TS val 3881072006 ecr 3896131007], length 1314
12:41:13.100985 IP 10.8.0.4.42452 > 99.181.90.254.1935: Flags [.], seq 48082:49396, ack 1, win 501, options [nop,nop,TS val 3881072067 ecr 3896131007], length 1314
12:41:13.115048 IP 99.181.90.254.1935 > 10.8.0.4.42452: Flags [.], ack 41378, win 126, options [nop,nop,TS val 3896131107 ecr 3881071733], length 0
12:41:13.133999 IP 10.8.0.4.42452 > 99.181.90.254.1935: Flags [.], seq 49396:50710, ack 1, win 501, options [nop,nop,TS val 3881072100 ecr 3896131107], length 1314
12:41:13.169067 IP 10.8.0.4.42452 > 99.181.90.254.1935: Flags [.], seq 50710:52024, ack 1, win 501, options [nop,nop,TS val 3881072135 ecr 3896131107], length 1314
12:41:13.181767 IP 99.181.90.254.1935 > 10.8.0.4.42452: Flags [.], ack 44006, win 126, options [nop,nop,TS val 3896131174 ecr 3881071832], length 0
12:41:13.199735 IP 99.181.90.254.1935 > 10.8.0.4.42452: Flags [.], ack 44140, win 126, options [nop,nop,TS val 3896131191 ecr 3881071883], length 0
12:41:13.199759 IP 10.8.0.4.42452 > 99.181.90.254.1935: Flags [P.], seq 52024:52989, ack 1, win 501, options [nop,nop,TS val 3881072165 ecr 3896131191], length 965
12:41:13.262514 IP 10.8.0.4.42452 > 99.181.90.254.1935: Flags [.], seq 52989:54303, ack 1, win 501, options [nop,nop,TS val 3881072228 ecr 3896131191], length 1314
12:41:13.279368 IP 99.181.90.254.1935 > 10.8.0.4.42452: Flags [.], ack 46768, win 126, options [nop,nop,TS val 3896131272 ecr 3881071933], length 0
12:41:13.296563 IP 10.8.0.4.42452 > 99.181.90.254.1935: Flags [.], seq 54303:55617, ack 1, win 501, options [nop,nop,TS val 3881072262 ecr 3896131272], length 1314
12:41:13.333500 IP 10.8.0.4.42452 > 99.181.90.254.1935: Flags [.], seq 55617:56931, ack 1, win 501, options [nop,nop,TS val 3881072299 ecr 3896131272], length 1314
12:41:13.382339 IP 99.181.90.254.1935 > 10.8.0.4.42452: Flags [.], ack 49396, win 126, options [nop,nop,TS val 3896131375 ecr 3881072006], length 0
12:41:13.399831 IP 10.8.0.4.42452 > 99.181.90.254.1935: Flags [.], seq 56931:58245, ack 1, win 501, options [nop,nop,TS val 3881072366 ecr 3896131375], length 1314
12:41:13.431896 IP 10.8.0.4.42452 > 99.181.90.254.1935: Flags [.], seq 58245:59559, ack 1, win 501, options [nop,nop,TS val 3881072398 ecr 3896131375], length 1314
12:41:13.450449 IP 99.181.90.254.1935 > 10.8.0.4.42452: Flags [.], ack 52024, win 126, options [nop,nop,TS val 3896131443 ecr 3881072100], length 0
12:41:13.465169 IP 10.8.0.4.42452 > 99.181.90.254.1935: Flags [.], seq 59559:60873, ack 1, win 501, options [nop,nop,TS val 3881072431 ecr 3896131443], length 1314
12:41:13.480772 IP 99.181.90.254.1935 > 10.8.0.4.42452: Flags [.], ack 52989, win 126, options [nop,nop,TS val 3896131473 ecr 3881072165], length 0
12:41:13.480796 IP 10.8.0.4.42452 > 99.181.90.254.1935: Flags [P.], seq 60873:61008, ack 1, win 501, options [nop,nop,TS val 3881072446 ecr 3896131473], length 135
12:41:13.531998 IP 10.8.0.4.42452 > 99.181.90.254.1935: Flags [.], seq 61008:62322, ack 1, win 501, options [nop,nop,TS val 3881072498 ecr 3896131473], length 1314
12:41:13.565218 IP 10.8.0.4.42452 > 99.181.90.254.1935: Flags [.], seq 62322:63636, ack 1, win 501, options [nop,nop,TS val 3881072531 ecr 3896131473], length 1314
12:41:13.577841 IP 99.181.90.254.1935 > 10.8.0.4.42452: Flags [.], ack 55617, win 126, options [nop,nop,TS val 3896131570 ecr 3881072228], length 0
12:41:13.599838 IP 10.8.0.4.42452 > 99.181.90.254.1935: Flags [.], seq 63636:64950, ack 1, win 501, options [nop,nop,TS val 3881072566 ecr 3896131570], length 1314
12:41:13.667006 IP 10.8.0.4.42452 > 99.181.90.254.1935: Flags [.], seq 64950:66264, ack 1, win 501, options [nop,nop,TS val 3881072633 ecr 3896131570], length 1314
12:41:13.682110 IP 99.181.90.254.1935 > 10.8.0.4.42452: Flags [.], ack 58245, win 126, options [nop,nop,TS val 3896131674 ecr 3881072299], length 0
12:41:13.697610 IP 10.8.0.4.42452 > 99.181.90.254.1935: Flags [.], seq 66264:67578, ack 1, win 501, options [nop,nop,TS val 3881072663 ecr 3896131674], length 1314
12:41:13.732840 IP 10.8.0.4.42452 > 99.181.90.254.1935: Flags [.], seq 67578:68892, ack 1, win 501, options [nop,nop,TS val 3881072699 ecr 3896131674], length 1314
12:41:13.746383 IP 99.181.90.254.1935 > 10.8.0.4.42452: Flags [.], ack 60873, win 126, options [nop,nop,TS val 3896131739 ecr 3881072398], length 0
12:41:13.762001 IP 99.181.90.254.1935 > 10.8.0.4.42452: Flags [.], ack 61008, win 126, options [nop,nop,TS val 3896131754 ecr 3881072446], length 0
12:41:13.762039 IP 10.8.0.4.42452 > 99.181.90.254.1935: Flags [P.], seq 68892:69025, ack 1, win 501, options [nop,nop,TS val 3881072728 ecr 3896131754], length 133
12:41:13.800165 IP 10.8.0.4.42452 > 99.181.90.254.1935: Flags [.], seq 69025:70339, ack 1, win 501, options [nop,nop,TS val 3881072766 ecr 3896131754], length 1314
12:41:13.833538 IP 10.8.0.4.42452 > 99.181.90.254.1935: Flags [.], seq 70339:71653, ack 1, win 501, options [nop,nop,TS val 3881072799 ecr 3896131754], length 1314
12:41:13.846386 IP 99.181.90.254.1935 > 10.8.0.4.42452: Flags [.], ack 63636, win 126, options [nop,nop,TS val 3896131839 ecr 3881072498], length 0
12:41:13.875040 IP 10.8.0.4.42452 > 99.181.90.254.1935: Flags [.], seq 71653:72967, ack 1, win 501, options [nop,nop,TS val 3881072841 ecr 3896131839], length 1314
12:41:13.929280 IP 10.8.0.4.42452 > 99.181.90.254.1935: Flags [.], seq 72967:74281, ack 1, win 501, options [nop,nop,TS val 3881072895 ecr 3896131839], length 1314
12:41:13.948558 IP 99.181.90.254.1935 > 10.8.0.4.42452: Flags [.], ack 66264, win 126, options [nop,nop,TS val 3896131941 ecr 3881072566], length 0
12:41:13.962809 IP 10.8.0.4.42452 > 99.181.90.254.1935: Flags [.], seq 74281:75595, ack 1, win 501, options [nop,nop,TS val 3881072929 ecr 3896131941], length 1314
12:41:14.002804 IP 10.8.0.4.42452 > 99.181.90.254.1935: Flags [.], seq 75595:76909, ack 1, win 501, options [nop,nop,TS val 3881072968 ecr 3896131941], length 1314
12:41:14.015792 IP 99.181.90.254.1935 > 10.8.0.4.42452: Flags [.], ack 68892, win 126, options [nop,nop,TS val 3896132006 ecr 3881072663], length 0
12:41:14.043194 IP 99.181.90.254.1935 > 10.8.0.4.42452: Flags [.], ack 69025, win 126, options [nop,nop,TS val 3896132036 ecr 3881072728], length 0
12:41:14.043232 IP 10.8.0.4.42452 > 99.181.90.254.1935: Flags [P.], seq 76909:77870, ack 1, win 501, options [nop,nop,TS val 3881073009 ecr 3896132036], length 961
12:41:14.098923 IP 10.8.0.4.42452 > 99.181.90.254.1935: Flags [.], seq 77870:79184, ack 1, win 501, options [nop,nop,TS val 3881073065 ecr 3896132036], length 1314
12:41:14.116228 IP 99.181.90.254.1935 > 10.8.0.4.42452: Flags [.], ack 71653, win 126, options [nop,nop,TS val 3896132107 ecr 3881072766], length 0
12:41:14.132270 IP 10.8.0.4.42452 > 99.181.90.254.1935: Flags [.], seq 79184:80498, ack 1, win 501, options [nop,nop,TS val 3881073098 ecr 3896132107], length 1314
12:41:14.165773 IP 10.8.0.4.42452 > 99.181.90.254.1935: Flags [.], seq 80498:81812, ack 1, win 501, options [nop,nop,TS val 3881073131 ecr 3896132107], length 1314
12:41:14.210667 IP 99.181.90.254.1935 > 10.8.0.4.42452: Flags [.], ack 74281, win 126, options [nop,nop,TS val 3896132203 ecr 3881072841], length 0
12:41:14.231117 IP 10.8.0.4.42452 > 99.181.90.254.1935: Flags [.], seq 81812:83126, ack 1, win 501, options [nop,nop,TS val 3881073197 ecr 3896132203], length 1314
12:41:14.264382 IP 10.8.0.4.42452 > 99.181.90.254.1935: Flags [.], seq 83126:84440, ack 1, win 501, options [nop,nop,TS val 3881073230 ecr 3896132203], length 1314
12:41:14.284009 IP 99.181.90.254.1935 > 10.8.0.4.42452: Flags [.], ack 76909, win 126, options [nop,nop,TS val 3896132276 ecr 3881072929], length 0
12:41:14.302165 IP 10.8.0.4.42452 > 99.181.90.254.1935: Flags [.], seq 84440:85754, ack 1, win 501, options [nop,nop,TS val 3881073268 ecr 3896132276], length 1314
12:41:14.324466 IP 99.181.90.254.1935 > 10.8.0.4.42452: Flags [.], ack 77870, win 126, options [nop,nop,TS val 3896132317 ecr 3881073009], length 0
12:41:14.324499 IP 10.8.0.4.42452 > 99.181.90.254.1935: Flags [P.], seq 85754:85984, ack 1, win 501, options [nop,nop,TS val 3881073290 ecr 3896132317], length 230
12:41:14.366529 IP 10.8.0.4.42452 > 99.181.90.254.1935: Flags [.], seq 85984:87298, ack 1, win 501, options [nop,nop,TS val 3881073332 ecr 3896132317], length 1314
12:41:14.399701 IP 10.8.0.4.42452 > 99.181.90.254.1935: Flags [.], seq 87298:88612, ack 1, win 501, options [nop,nop,TS val 3881073365 ecr 3896132317], length 1314
12:41:14.414058 IP 99.181.90.254.1935 > 10.8.0.4.42452: Flags [.], ack 80498, win 126, options [nop,nop,TS val 3896132406 ecr 3881073065], length 0
12:41:14.452088 IP 10.8.0.4.42452 > 99.181.90.254.1935: Flags [.], seq 88612:89926, ack 1, win 501, options [nop,nop,TS val 3881073418 ecr 3896132406], length 1314
12:41:14.500229 IP 10.8.0.4.42452 > 99.181.90.254.1935: Flags [.], seq 89926:91240, ack 1, win 501, options [nop,nop,TS val 3881073466 ecr 3896132406], length 1314
12:41:14.512236 IP 99.181.90.254.1935 > 10.8.0.4.42452: Flags [.], ack 83126, win 126, options [nop,nop,TS val 3896132505 ecr 3881073131], length 0
12:41:14.532679 IP 10.8.0.4.42452 > 99.181.90.254.1935: Flags [.], seq 91240:92554, ack 1, win 501, options [nop,nop,TS val 3881073498 ecr 3896132505], length 1314
12:41:14.580645 IP 10.8.0.4.42452 > 99.181.90.254.1935: Flags [.], seq 92554:93868, ack 1, win 501, options [nop,nop,TS val 3881073546 ecr 3896132505], length 1314
12:41:14.583405 IP 99.181.90.254.1935 > 10.8.0.4.42452: Flags [.], ack 85754, win 126, options [nop,nop,TS val 3896132576 ecr 3881073230], length 0
12:41:14.605802 IP 99.181.90.254.1935 > 10.8.0.4.42452: Flags [.], ack 85984, win 126, options [nop,nop,TS val 3896132598 ecr 3881073290], length 0
12:41:14.605837 IP 10.8.0.4.42452 > 99.181.90.254.1935: Flags [P.], seq 93868:94846, ack 1, win 501, options [nop,nop,TS val 3881073572 ecr 3896132598], length 978
12:41:14.665997 IP 10.8.0.4.42452 > 99.181.90.254.1935: Flags [.], seq 94846:96160, ack 1, win 501, options [nop,nop,TS val 3881073632 ecr 3896132598], length 1314
12:41:14.680839 IP 99.181.90.254.1935 > 10.8.0.4.42452: Flags [.], ack 88612, win 126, options [nop,nop,TS val 3896132673 ecr 3881073332], length 0
12:41:14.700325 IP 10.8.0.4.42452 > 99.181.90.254.1935: Flags [.], seq 96160:97474, ack 1, win 501, options [nop,nop,TS val 3881073666 ecr 3896132673], length 1314
12:41:14.733633 IP 10.8.0.4.42452 > 99.181.90.254.1935: Flags [.], seq 97474:98788, ack 1, win 501, options [nop,nop,TS val 3881073699 ecr 3896132673], length 1314
12:41:14.781871 IP 99.181.90.254.1935 > 10.8.0.4.42452: Flags [.], ack 91240, win 126, options [nop,nop,TS val 3896132774 ecr 3881073418], length 0
12:41:14.799460 IP 10.8.0.4.42452 > 99.181.90.254.1935: Flags [.], seq 98788:100102, ack 1, win 501, options [nop,nop,TS val 3881073765 ecr 3896132774], length 1314
12:41:14.837497 IP 10.8.0.4.42452 > 99.181.90.254.1935: Flags [.], seq 100102:101416, ack 1, win 501, options [nop,nop,TS val 3881073803 ecr 3896132774], length 1314
12:41:14.862273 IP 99.181.90.254.1935 > 10.8.0.4.42452: Flags [.], ack 93868, win 126, options [nop,nop,TS val 3896132854 ecr 3881073498], length 0
12:41:14.866014 IP 10.8.0.4.42452 > 99.181.90.254.1935: Flags [.], seq 101416:102730, ack 1, win 501, options [nop,nop,TS val 3881073832 ecr 3896132854], length 1314
12:41:14.887289 IP 99.181.90.254.1935 > 10.8.0.4.42452: Flags [.], ack 94846, win 126, options [nop,nop,TS val 3896132880 ecr 3881073572], length 0
12:41:14.887321 IP 10.8.0.4.42452 > 99.181.90.254.1935: Flags [P.], seq 102730:102853, ack 1, win 501, options [nop,nop,TS val 3881073853 ecr 3896132880], length 123
12:41:14.932610 IP 10.8.0.4.42452 > 99.181.90.254.1935: Flags [.], seq 102853:104167, ack 1, win 501, options [nop,nop,TS val 3881073898 ecr 3896132880], length 1314
12:41:14.966795 IP 10.8.0.4.42452 > 99.181.90.254.1935: Flags [.], seq 104167:105481, ack 1, win 501, options [nop,nop,TS val 3881073932 ecr 3896132880], length 1314
12:41:14.981411 IP 99.181.90.254.1935 > 10.8.0.4.42452: Flags [.], ack 97474, win 126, options [nop,nop,TS val 3896132974 ecr 3881073632], length 0
12:41:15.009137 IP 10.8.0.4.42452 > 99.181.90.254.1935: Flags [.], seq 105481:106795, ack 1, win 501, options [nop,nop,TS val 3881073975 ecr 3896132974], length 1314
12:41:15.064213 IP 10.8.0.4.42452 > 99.181.90.254.1935: Flags [.], seq 106795:108109, ack 1, win 501, options [nop,nop,TS val 3881074030 ecr 3896132974], length 1314
12:41:15.080827 IP 99.181.90.254.1935 > 10.8.0.4.42452: Flags [.], ack 100102, win 126, options [nop,nop,TS val 3896133073 ecr 3881073699], length 0
12:41:15.099937 IP 10.8.0.4.42452 > 99.181.90.254.1935: Flags [.], seq 108109:109423, ack 1, win 501, options [nop,nop,TS val 3881074066 ecr 3896133073], length 1314
12:41:15.137705 IP 10.8.0.4.42452 > 99.181.90.254.1935: Flags [.], seq 109423:110737, ack 1, win 501, options [nop,nop,TS val 3881074103 ecr 3896133073], length 1314
12:41:15.147195 IP 99.181.90.254.1935 > 10.8.0.4.42452: Flags [.], ack 102730, win 126, options [nop,nop,TS val 3896133140 ecr 3881073803], length 0
12:41:15.168271 IP 99.181.90.254.1935 > 10.8.0.4.42452: Flags [.], ack 102853, win 126, options [nop,nop,TS val 3896133161 ecr 3881073853], length 0
12:41:15.168294 IP 10.8.0.4.42452 > 99.181.90.254.1935: Flags [P.], seq 110737:111718, ack 1, win 501, options [nop,nop,TS val 3881074134 ecr 3896133161], length 981
12:41:15.233667 IP 10.8.0.4.42452 > 99.181.90.254.1935: Flags [.], seq 111718:113032, ack 1, win 501, options [nop,nop,TS val 3881074199 ecr 3896133161], length 1314
12:41:15.248050 IP 99.181.90.254.1935 > 10.8.0.4.42452: Flags [.], ack 105481, win 126, options [nop,nop,TS val 3896133240 ecr 3881073898], length 0
12:41:15.266842 IP 10.8.0.4.42452 > 99.181.90.254.1935: Flags [.], seq 113032:114346, ack 1, win 501, options [nop,nop,TS val 3881074233 ecr 3896133240], length 1314
12:41:15.297599 IP 10.8.0.4.42452 > 99.181.90.254.1935: Flags [.], seq 114346:115660, ack 1, win 501, options [nop,nop,TS val 3881074263 ecr 3896133240], length 1314
12:41:15.345454 IP 99.181.90.254.1935 > 10.8.0.4.42452: Flags [.], ack 108109, win 126, options [nop,nop,TS val 3896133338 ecr 3881073975], length 0
12:41:15.372620 IP 10.8.0.4.42452 > 99.181.90.254.1935: Flags [.], seq 115660:116974, ack 1, win 501, options [nop,nop,TS val 3881074338 ecr 3896133338], length 1314
12:41:15.400117 IP 10.8.0.4.42452 > 99.181.90.254.1935: Flags [.], seq 116974:118288, ack 1, win 501, options [nop,nop,TS val 3881074366 ecr 3896133338], length 1314
12:41:15.419093 IP 99.181.90.254.1935 > 10.8.0.4.42452: Flags [.], ack 110737, win 126, options [nop,nop,TS val 3896133411 ecr 3881074066], length 0
12:41:15.437266 IP 10.8.0.4.42452 > 99.181.90.254.1935: Flags [.], seq 118288:119602, ack 1, win 501, options [nop,nop,TS val 3881074403 ecr 3896133411], length 1314
12:41:15.449401 IP 99.181.90.254.1935 > 10.8.0.4.42452: Flags [.], ack 111718, win 126, options [nop,nop,TS val 3896133442 ecr 3881074134], length 0
12:41:15.449437 IP 10.8.0.4.42452 > 99.181.90.254.1935: Flags [P.], seq 119602:119727, ack 1, win 501, options [nop,nop,TS val 3881074415 ecr 3896133442], length 125
12:41:15.501461 IP 10.8.0.4.42452 > 99.181.90.254.1935: Flags [.], seq 119727:121041, ack 1, win 501, options [nop,nop,TS val 3881074467 ecr 3896133442], length 1314
12:41:15.529317 IP 10.8.0.4.42452 > 99.181.90.254.1935: Flags [.], seq 121041:122355, ack 1, win 501, options [nop,nop,TS val 3881074495 ecr 3896133442], length 1314
12:41:15.548227 IP 99.181.90.254.1935 > 10.8.0.4.42452: Flags [.], ack 114346, win 126, options [nop,nop,TS val 3896133540 ecr 3881074199], length 0
12:41:15.565044 IP 10.8.0.4.42452 > 99.181.90.254.1935: Flags [.], seq 122355:123669, ack 1, win 501, options [nop,nop,TS val 3881074531 ecr 3896133540], length 1314
12:41:15.633828 IP 10.8.0.4.42452 > 99.181.90.254.1935: Flags [.], seq 123669:124983, ack 1, win 501, options [nop,nop,TS val 3881074600 ecr 3896133540], length 1314
12:41:15.647672 IP 99.181.90.254.1935 > 10.8.0.4.42452: Flags [.], ack 115660, win 126, options [nop,nop,TS val 3896133638 ecr 3881074263], length 0
12:41:15.672204 IP 10.8.0.4.42452 > 99.181.90.254.1935: Flags [.], seq 124983:126297, ack 1, win 501, options [nop,nop,TS val 3881074638 ecr 3896133638], length 1314
12:41:15.681668 IP 99.181.90.254.1935 > 10.8.0.4.42452: Flags [.], ack 118288, win 126, options [nop,nop,TS val 3896133674 ecr 3881074338], length 0
12:41:15.698496 IP 10.8.0.4.42452 > 99.181.90.254.1935: Flags [.], seq 126297:127611, ack 1, win 501, options [nop,nop,TS val 3881074664 ecr 3896133674], length 1314
12:41:15.730626 IP 99.181.90.254.1935 > 10.8.0.4.42452: Flags [.], ack 119727, win 126, options [nop,nop,TS val 3896133723 ecr 3881074403], length 0
12:41:15.730646 IP 10.8.0.4.42452 > 99.181.90.254.1935: Flags [P.], seq 127611:127829, ack 1, win 501, options [nop,nop,TS val 3881074696 ecr 3896133723], length 218
12:41:15.762708 IP 10.8.0.4.42452 > 99.181.90.254.1935: Flags [.], seq 127829:129143, ack 1, win 501, options [nop,nop,TS val 3881074728 ecr 3896133723], length 1314
12:41:15.799897 IP 10.8.0.4.42452 > 99.181.90.254.1935: Flags [.], seq 129143:130457, ack 1, win 501, options [nop,nop,TS val 3881074766 ecr 3896133723], length 1314
12:41:15.811102 IP 99.181.90.254.1935 > 10.8.0.4.42452: Flags [.], ack 122355, win 126, options [nop,nop,TS val 3896133803 ecr 3881074467], length 0
12:41:15.864239 IP 10.8.0.4.42452 > 99.181.90.254.1935: Flags [.], seq 130457:131771, ack 1, win 501, options [nop,nop,TS val 3881074830 ecr 3896133803], length 1314
12:41:15.906938 IP 10.8.0.4.42452 > 99.181.90.254.1935: Flags [.], seq 131771:133085, ack 1, win 501, options [nop,nop,TS val 3881074873 ecr 3896133803], length 1314
12:41:15.920804 IP 99.181.90.254.1935 > 10.8.0.4.42452: Flags [.], ack 124983, win 126, options [nop,nop,TS val 3896133907 ecr 3881074531], length 0
12:41:15.929336 IP 10.8.0.4.42452 > 99.181.90.254.1935: Flags [.], seq 133085:134399, ack 1, win 501, options [nop,nop,TS val 3881074895 ecr 3896133907], length 1314
12:41:15.979628 IP 99.181.90.254.1935 > 10.8.0.4.42452: Flags [.], ack 127611, win 126, options [nop,nop,TS val 3896133972 ecr 3881074638], length 0
12:41:15.992026 IP 10.8.0.4.42452 > 99.181.90.254.1935: Flags [.], seq 134399:135713, ack 1, win 501, options [nop,nop,TS val 3881074958 ecr 3896133972], length 1314
12:41:16.016083 IP 99.181.90.254.1935 > 10.8.0.4.42452: Flags [.], ack 127829, win 126, options [nop,nop,TS val 3896134004 ecr 3881074696], length 0
12:41:16.016118 IP 10.8.0.4.42452 > 99.181.90.254.1935: Flags [P.], seq 135713:136694, ack 1, win 501, options [nop,nop,TS val 3881074982 ecr 3896134004], length 981
12:41:16.062589 IP 10.8.0.4.42452 > 99.181.90.254.1935: Flags [.], seq 136694:138008, ack 1, win 501, options [nop,nop,TS val 3881075028 ecr 3896134004], length 1314
12:41:16.081825 IP 99.181.90.254.1935 > 10.8.0.4.42452: Flags [.], ack 130457, win 126, options [nop,nop,TS val 3896134073 ecr 3881074728], length 0
12:41:16.098662 IP 10.8.0.4.42452 > 99.181.90.254.1935: Flags [.], seq 138008:139322, ack 1, win 501, options [nop,nop,TS val 3881075064 ecr 3896134073], length 1314
12:41:16.141455 IP 10.8.0.4.42452 > 99.181.90.254.1935: Flags [.], seq 139322:140636, ack 1, win 501, options [nop,nop,TS val 3881075107 ecr 3896134073], length 1314
12:41:16.188085 IP 99.181.90.254.1935 > 10.8.0.4.42452: Flags [.], ack 133085, win 126, options [nop,nop,TS val 3896134180 ecr 3881074830], length 0
12:41:16.205934 IP 10.8.0.4.42452 > 99.181.90.254.1935: Flags [.], seq 140636:141950, ack 1, win 501, options [nop,nop,TS val 3881075172 ecr 3896134180], length 1314
12:41:16.233449 IP 10.8.0.4.42452 > 99.181.90.254.1935: Flags [.], seq 141950:143264, ack 1, win 501, options [nop,nop,TS val 3881075199 ecr 3896134180], length 1314
12:41:16.269979 IP 10.8.0.4.42452 > 99.181.90.254.1935: Flags [.], seq 143264:144578, ack 1, win 501, options [nop,nop,TS val 3881075236 ecr 3896134180], length 1314
12:41:16.273392 IP 99.181.90.254.1935 > 10.8.0.4.42452: Flags [.], ack 135713, win 126, options [nop,nop,TS val 3896134266 ecr 3881074895], length 0
12:41:16.298504 IP 99.181.90.254.1935 > 10.8.0.4.42452: Flags [.], ack 136694, win 126, options [nop,nop,TS val 3896134290 ecr 3881074982], length 0
12:41:16.298534 IP 10.8.0.4.42452 > 99.181.90.254.1935: Flags [P.], seq 144578:144705, ack 1, win 501, options [nop,nop,TS val 3881075264 ecr 3896134290], length 127
12:41:16.334411 IP 10.8.0.4.42452 > 99.181.90.254.1935: Flags [.], seq 144705:146019, ack 1, win 501, options [nop,nop,TS val 3881075300 ecr 3896134290], length 1314
12:41:16.366903 IP 10.8.0.4.42452 > 99.181.90.254.1935: Flags [.], seq 146019:147333, ack 1, win 501, options [nop,nop,TS val 3881075333 ecr 3896134290], length 1314
12:41:16.380284 IP 99.181.90.254.1935 > 10.8.0.4.42452: Flags [.], ack 139322, win 126, options [nop,nop,TS val 3896134372 ecr 3881075028], length 0
12:41:16.419924 IP 10.8.0.4.42452 > 99.181.90.254.1935: Flags [.], seq 147333:148647, ack 1, win 501, options [nop,nop,TS val 3881075386 ecr 3896134372], length 1314
12:41:16.466936 IP 10.8.0.4.42452 > 99.181.90.254.1935: Flags [.], seq 148647:149961, ack 1, win 501, options [nop,nop,TS val 3881075433 ecr 3896134372], length 1314
12:41:16.487268 IP 99.181.90.254.1935 > 10.8.0.4.42452: Flags [.], ack 141950, win 126, options [nop,nop,TS val 3896134480 ecr 3881075107], length 0
12:41:16.505505 IP 10.8.0.4.42452 > 99.181.90.254.1935: Flags [.], seq 149961:151275, ack 1, win 501, options [nop,nop,TS val 3881075471 ecr 3896134480], length 1314
12:41:16.548137 IP 10.8.0.4.42452 > 99.181.90.254.1935: Flags [.], seq 151275:152589, ack 1, win 501, options [nop,nop,TS val 3881075514 ecr 3896134480], length 1314
12:41:16.551268 IP 99.181.90.254.1935 > 10.8.0.4.42452: Flags [.], ack 144578, win 126, options [nop,nop,TS val 3896134544 ecr 3881075199], length 0
12:41:16.580387 IP 99.181.90.254.1935 > 10.8.0.4.42452: Flags [.], ack 144705, win 126, options [nop,nop,TS val 3896134572 ecr 3881075264], length 0
12:41:16.580422 IP 10.8.0.4.42452 > 99.181.90.254.1935: Flags [P.], seq 152589:153563, ack 1, win 501, options [nop,nop,TS val 3881075546 ecr 3896134572], length 974
12:41:16.633895 IP 10.8.0.4.42452 > 99.181.90.254.1935: Flags [.], seq 153563:154877, ack 1, win 501, options [nop,nop,TS val 3881075600 ecr 3896134572], length 1314
12:41:16.649966 IP 99.181.90.254.1935 > 10.8.0.4.42452: Flags [.], ack 147333, win 126, options [nop,nop,TS val 3896134640 ecr 3881075300], length 0
12:41:16.666955 IP 10.8.0.4.42452 > 99.181.90.254.1935: Flags [.], seq 154877:156191, ack 1, win 501, options [nop,nop,TS val 3881075633 ecr 3896134640], length 1314
12:41:16.700313 IP 10.8.0.4.42452 > 99.181.90.254.1935: Flags [.], seq 156191:157505, ack 1, win 501, options [nop,nop,TS val 3881075666 ecr 3896134640], length 1314
12:41:16.748690 IP 99.181.90.254.1935 > 10.8.0.4.42452: Flags [.], ack 149961, win 126, options [nop,nop,TS val 3896134741 ecr 3881075386], length 0
12:41:16.766822 IP 10.8.0.4.42452 > 99.181.90.254.1935: Flags [.], seq 157505:158819, ack 1, win 501, options [nop,nop,TS val 3881075733 ecr 3896134741], length 1314
12:41:16.805981 IP 10.8.0.4.42452 > 99.181.90.254.1935: Flags [.], seq 158819:160133, ack 1, win 501, options [nop,nop,TS val 3881075772 ecr 3896134741], length 1314
12:41:16.829302 IP 99.181.90.254.1935 > 10.8.0.4.42452: Flags [.], ack 152589, win 126, options [nop,nop,TS val 3896134822 ecr 3881075471], length 0
12:41:16.833738 IP 10.8.0.4.42452 > 99.181.90.254.1935: Flags [.], seq 160133:161447, ack 1, win 501, options [nop,nop,TS val 3881075799 ecr 3896134822], length 1314
12:41:16.861714 IP 99.181.90.254.1935 > 10.8.0.4.42452: Flags [.], ack 153563, win 126, options [nop,nop,TS val 3896134854 ecr 3881075546], length 0
12:41:16.861753 IP 10.8.0.4.42452 > 99.181.90.254.1935: Flags [P.], seq 161447:161580, ack 1, win 501, options [nop,nop,TS val 3881075827 ecr 3896134854], length 133
12:41:16.897558 IP 10.8.0.4.42452 > 99.181.90.254.1935: Flags [.], seq 161580:162894, ack 1, win 501, options [nop,nop,TS val 3881075863 ecr 3896134854], length 1314
12:41:16.934140 IP 10.8.0.4.42452 > 99.181.90.254.1935: Flags [.], seq 162894:164208, ack 1, win 501, options [nop,nop,TS val 3881075900 ecr 3896134854], length 1314
12:41:16.948245 IP 99.181.90.254.1935 > 10.8.0.4.42452: Flags [.], ack 156191, win 126, options [nop,nop,TS val 3896134941 ecr 3881075600], length 0
12:41:16.976517 IP 10.8.0.4.42452 > 99.181.90.254.1935: Flags [.], seq 164208:165522, ack 1, win 501, options [nop,nop,TS val 3881075942 ecr 3896134941], length 1314
12:41:17.040168 IP 10.8.0.4.42452 > 99.181.90.254.1935: Flags [.], seq 165522:166836, ack 1, win 501, options [nop,nop,TS val 3881076006 ecr 3896134941], length 1314
12:41:17.048037 IP 99.181.90.254.1935 > 10.8.0.4.42452: Flags [.], ack 158819, win 126, options [nop,nop,TS val 3896135040 ecr 3881075666], length 0
12:41:17.066475 IP 10.8.0.4.42452 > 99.181.90.254.1935: Flags [.], seq 166836:168150, ack 1, win 501, options [nop,nop,TS val 3881076032 ecr 3896135040], length 1314
12:41:17.104351 IP 10.8.0.4.42452 > 99.181.90.254.1935: Flags [.], seq 168150:169464, ack 1, win 501, options [nop,nop,TS val 3881076070 ecr 3896135040], length 1314
12:41:17.114786 IP 99.181.90.254.1935 > 10.8.0.4.42452: Flags [.], ack 161447, win 126, options [nop,nop,TS val 3896135107 ecr 3881075772], length 0
12:41:17.142797 IP 99.181.90.254.1935 > 10.8.0.4.42452: Flags [.], ack 161580, win 126, options [nop,nop,TS val 3896135135 ecr 3881075827], length 0
12:41:17.142809 IP 10.8.0.4.42452 > 99.181.90.254.1935: Flags [P.], seq 169464:170434, ack 1, win 501, options [nop,nop,TS val 3881076109 ecr 3896135135], length 970
12:41:17.198069 IP 10.8.0.4.42452 > 99.181.90.254.1935: Flags [.], seq 170434:171748, ack 1, win 501, options [nop,nop,TS val 3881076164 ecr 3896135135], length 1314
12:41:17.215240 IP 99.181.90.254.1935 > 10.8.0.4.42452: Flags [.], ack 164208, win 126, options [nop,nop,TS val 3896135208 ecr 3881075863], length 0
12:41:17.233545 IP 10.8.0.4.42452 > 99.181.90.254.1935: Flags [.], seq 171748:173062, ack 1, win 501, options [nop,nop,TS val 3881076199 ecr 3896135208], length 1314
12:41:17.275035 IP 10.8.0.4.42452 > 99.181.90.254.1935: Flags [.], seq 173062:174376, ack 1, win 501, options [nop,nop,TS val 3881076241 ecr 3896135208], length 1314
12:41:17.321486 IP 99.181.90.254.1935 > 10.8.0.4.42452: Flags [.], ack 166836, win 126, options [nop,nop,TS val 3896135314 ecr 3881075942], length 0
12:41:17.339176 IP 10.8.0.4.42452 > 99.181.90.254.1935: Flags [.], seq 174376:175690, ack 1, win 501, options [nop,nop,TS val 3881076305 ecr 3896135314], length 1314
12:41:17.365943 IP 10.8.0.4.42452 > 99.181.90.254.1935: Flags [.], seq 175690:177004, ack 1, win 501, options [nop,nop,TS val 3881076332 ecr 3896135314], length 1314
12:41:17.385729 IP 99.181.90.254.1935 > 10.8.0.4.42452: Flags [.], ack 169464, win 126, options [nop,nop,TS val 3896135378 ecr 3881076032], length 0
12:41:17.403349 IP 10.8.0.4.42452 > 99.181.90.254.1935: Flags [.], seq 177004:178318, ack 1, win 501, options [nop,nop,TS val 3881076369 ecr 3896135378], length 1314
12:41:17.423943 IP 99.181.90.254.1935 > 10.8.0.4.42452: Flags [.], ack 170434, win 126, options [nop,nop,TS val 3896135416 ecr 3881076109], length 0
12:41:17.423974 IP 10.8.0.4.42452 > 99.181.90.254.1935: Flags [P.], seq 178318:178444, ack 1, win 501, options [nop,nop,TS val 3881076390 ecr 3896135416], length 126
12:41:17.467598 IP 10.8.0.4.42452 > 99.181.90.254.1935: Flags [.], seq 178444:179758, ack 1, win 501, options [nop,nop,TS val 3881076433 ecr 3896135416], length 1314
12:41:17.510506 IP 10.8.0.4.42452 > 99.181.90.254.1935: Flags [.], seq 179758:181072, ack 1, win 501, options [nop,nop,TS val 3881076476 ecr 3896135416], length 1314
12:41:17.514824 IP 99.181.90.254.1935 > 10.8.0.4.42452: Flags [.], ack 173062, win 126, options [nop,nop,TS val 3896135507 ecr 3881076164], length 0
12:41:17.532775 IP 10.8.0.4.42452 > 99.181.90.254.1935: Flags [.], seq 181072:182386, ack 1, win 501, options [nop,nop,TS val 3881076498 ecr 3896135507], length 1314
12:41:17.599662 IP 10.8.0.4.42452 > 99.181.90.254.1935: Flags [.], seq 182386:183700, ack 1, win 501, options [nop,nop,TS val 3881076565 ecr 3896135507], length 1314
12:41:17.620340 IP 99.181.90.254.1935 > 10.8.0.4.42452: Flags [.], ack 175690, win 126, options [nop,nop,TS val 3896135613 ecr 3881076241], length 0
12:41:17.638925 IP 10.8.0.4.42452 > 99.181.90.254.1935: Flags [.], seq 183700:185014, ack 1, win 501, options [nop,nop,TS val 3881076605 ecr 3896135613], length 1314
12:41:17.663831 IP 10.8.0.4.42452 > 99.181.90.254.1935: Flags [.], seq 185014:186328, ack 1, win 501, options [nop,nop,TS val 3881076630 ecr 3896135613], length 1314
12:41:17.684864 IP 99.181.90.254.1935 > 10.8.0.4.42452: Flags [.], ack 178318, win 126, options [nop,nop,TS val 3896135677 ecr 3881076332], length 0
12:41:17.705083 IP 99.181.90.254.1935 > 10.8.0.4.42452: Flags [.], ack 178444, win 126, options [nop,nop,TS val 3896135697 ecr 3881076390], length 0
12:41:17.705126 IP 10.8.0.4.42452 > 99.181.90.254.1935: Flags [P.], seq 186328:187405, ack 1, win 501, options [nop,nop,TS val 3881076671 ecr 3896135697], length 1077
12:41:17.766790 IP 10.8.0.4.42452 > 99.181.90.254.1935: Flags [.], seq 187405:188719, ack 1, win 501, options [nop,nop,TS val 3881076732 ecr 3896135697], length 1314
12:41:17.791727 IP 99.181.90.254.1935 > 10.8.0.4.42452: Flags [.], ack 181072, win 126, options [nop,nop,TS val 3896135784 ecr 3881076433], length 0
12:41:17.809572 IP 10.8.0.4.42452 > 99.181.90.254.1935: Flags [.], seq 188719:190033, ack 1, win 501, options [nop,nop,TS val 3881076775 ecr 3896135784], length 1314
12:41:17.832107 IP 10.8.0.4.42452 > 99.181.90.254.1935: Flags [.], seq 190033:191347, ack 1, win 501, options [nop,nop,TS val 3881076798 ecr 3896135784], length 1314
12:41:17.874062 IP 99.181.90.254.1935 > 10.8.0.4.42452: Flags [.], ack 182386, win 126, options [nop,nop,TS val 3896135866 ecr 3881076498], length 0
