09:00:57.689447 IP 10.8.1.4.60534 > 45.113.128.222.1935: Flags [.], seq 931252530:931253844, ack 2892181346, win 501, options [nop,nop,TS val 3453534192 ecr 2851075843], length 1314
09:00:57.738625 IP 45.113.128.222.1935 > 10.8.1.4.60534: Flags [.], ack 4294956072, win 126, options [nop,nop,TS val 2851075946 ecr 3453533734], length 0
09:00:57.753296 IP 10.8.1.4.60534 > 45.113.128.222.1935: Flags [.], seq 1314:2628, ack 1, win 501, options [nop,nop,TS val 3453534256 ecr 2851075946], length 1314
09:00:57.785623 IP 10.8.1.4.60534 > 45.113.128.222.1935: Flags [.], seq 2628:3942, ack 1, win 501, options [nop,nop,TS val 3453534288 ecr 2851075946], length 1314
09:00:57.808727 IP 45.113.128.222.1935 > 10.8.1.4.60534: Flags [.], ack 4294958700, win 126, options [nop,nop,TS val 2851076017 ecr 3453533819], length 0
09:00:57.820813 IP 10.8.1.4.60534 > 45.113.128.222.1935: Flags [.], seq 3942:5256, ack 1, win 501, options [nop,nop,TS val 3453534324 ecr 2851076017], length 1314
09:00:57.887748 IP 10.8.1.4.60534 > 45.113.128.222.1935: Flags [.], seq 5256:6570, ack 1, win 501, options [nop,nop,TS val 3453534390 ecr 2851076017], length 1314
09:00:57.901907 IP 45.113.128.222.1935 > 10.8.1.4.60534: Flags [.], ack 4294961328, win 126, options [nop,nop,TS val 2851076110 ecr 3453533921], length 0
09:00:57.921623 IP 10.8.1.4.60534 > 45.113.128.222.1935: Flags [.], seq 6570:7884, ack 1, win 501, options [nop,nop,TS val 3453534424 ecr 2851076110], length 1314
09:00:57.955469 IP 10.8.1.4.60534 > 45.113.128.222.1935: Flags [.], seq 7884:9198, ack 1, win 501, options [nop,nop,TS val 3453534458 ecr 2851076110], length 1314
09:00:58.000266 IP 45.113.128.222.1935 > 10.8.1.4.60534: Flags [.], ack 4294963956, win 126, options [nop,nop,TS val 2851076208 ecr 3453533989], length 0
09:00:58.002886 IP 45.113.128.222.1935 > 10.8.1.4.60534: Flags [.], ack 4294964668, win 126, options [nop,nop,TS val 2851076211 ecr 3453534056], length 0
09:00:58.002913 IP 10.8.1.4.60534 > 45.113.128.222.1935: Flags [P.], seq 9198:10382, ack 1, win 501, options [nop,nop,TS val 3453534506 ecr 2851076211], length 1184
09:00:58.055224 IP 10.8.1.4.60534 > 45.113.128.222.1935: Flags [.], seq 10382:11696, ack 1, win 501, options [nop,nop,TS val 3453534558 ecr 2851076211], length 1314
09:00:58.085490 IP 10.8.1.4.60534 > 45.113.128.222.1935: Flags [.], seq 11696:13010, ack 1, win 501, options [nop,nop,TS val 3453534588 ecr 2851076211], length 1314
09:00:58.105170 IP 45.113.128.222.1935 > 10.8.1.4.60534: Flags [.], ack 0, win 126, options [nop,nop,TS val 2851076313 ecr 3453534117], length 0
09:00:58.128427 IP 10.8.1.4.60534 > 45.113.128.222.1935: Flags [.], seq 13010:14324, ack 1, win 501, options [nop,nop,TS val 3453534631 ecr 2851076313], length 1314
09:00:58.184776 IP 10.8.1.4.60534 > 45.113.128.222.1935: Flags [.], seq 14324:15638, ack 1, win 501, options [nop,nop,TS val 3453534687 ecr 2851076313], length 1314
09:00:58.202609 IP 45.113.128.222.1935 > 10.8.1.4.60534: Flags [.], ack 2628, win 126, options [nop,nop,TS val 2851076411 ecr 3453534192], length 0
09:00:58.218109 IP 10.8.1.4.60534 > 45.113.128.222.1935: Flags [.], seq 15638:16952, ack 1, win 501, options [nop,nop,TS val 3453534721 ecr 2851076411], length 1314
09:00:58.255456 IP 10.8.1.4.60534 > 45.113.128.222.1935: Flags [.], seq 16952:18266, ack 1, win 501, options [nop,nop,TS val 3453534758 ecr 2851076411], length 1314
09:00:58.270651 IP 45.113.128.222.1935 > 10.8.1.4.60534: Flags [.], ack 5256, win 126, options [nop,nop,TS val 2851076479 ecr 3453534288], length 0
09:00:58.318441 IP 10.8.1.4.60534 > 45.113.128.222.1935: Flags [.], seq 18266:19580, ack 1, win 501, options [nop,nop,TS val 3453534821 ecr 2851076479], length 1314
09:00:58.351765 IP 10.8.1.4.60534 > 45.113.128.222.1935: Flags [.], seq 19580:20894, ack 1, win 501, options [nop,nop,TS val 3453534854 ecr 2851076479], length 1314
09:00:58.371682 IP 45.113.128.222.1935 > 10.8.1.4.60534: Flags [.], ack 7884, win 126, options [nop,nop,TS val 2851076579 ecr 3453534390], length 0
09:00:58.387168 IP 10.8.1.4.60534 > 45.113.128.222.1935: Flags [.], seq 20894:22208, ack 1, win 501, options [nop,nop,TS val 3453534890 ecr 2851076579], length 1314
09:00:58.455923 IP 10.8.1.4.60534 > 45.113.128.222.1935: Flags [.], seq 22208:23522, ack 1, win 501, options [nop,nop,TS val 3453534959 ecr 2851076579], length 1314
09:00:58.456155 IP 45.113.128.222.1935 > 10.8.1.4.60534: Flags [.], ack 10382, win 126, options [nop,nop,TS val 2851076660 ecr 3453534458], length 0
09:00:58.456187 IP 10.8.1.4.60534 > 45.113.128.222.1935: Flags [P.], seq 23522:24230, ack 1, win 501, options [nop,nop,TS val 3453534959 ecr 2851076660], length 708
09:00:58.520493 IP 10.8.1.4.60534 > 45.113.128.222.1935: Flags [.], seq 24230:25544, ack 1, win 501, options [nop,nop,TS val 3453535023 ecr 2851076660], length 1314
09:00:58.548346 IP 45.113.128.222.1935 > 10.8.1.4.60534: Flags [.], ack 13010, win 126, options [nop,nop,TS val 2851076743 ecr 3453534558], length 0
09:00:58.554860 IP 10.8.1.4.60534 > 45.113.128.222.1935: Flags [.], seq 25544:26858, ack 1, win 501, options [nop,nop,TS val 3453535058 ecr 2851076743], length 1314
09:00:58.588923 IP 10.8.1.4.60534 > 45.113.128.222.1935: Flags [.], seq 26858:28172, ack 1, win 501, options [nop,nop,TS val 3453535092 ecr 2851076743], length 1314
09:00:58.633949 IP 45.113.128.222.1935 > 10.8.1.4.60534: Flags [.], ack 15638, win 126, options [nop,nop,TS val 2851076842 ecr 3453534631], length 0
09:00:58.652465 IP 10.8.1.4.60534 > 45.113.128.222.1935: Flags [.], seq 28172:29486, ack 1, win 501, options [nop,nop,TS val 3453535155 ecr 2851076842], length 1314
09:00:58.683336 IP 10.8.1.4.60534 > 45.113.128.222.1935: Flags [.], seq 29486:30800, ack 1, win 501, options [nop,nop,TS val 3453535186 ecr 2851076842], length 1314
09:00:58.721082 IP 10.8.1.4.60534 > 45.113.128.222.1935: Flags [.], seq 30800:32114, ack 1, win 501, options [nop,nop,TS val 3453535224 ecr 2851076842], length 1314
09:00:58.725494 IP 45.113.128.222.1935 > 10.8.1.4.60534: Flags [.], ack 18266, win 126, options [nop,nop,TS val 2851076934 ecr 3453534721], length 0
09:00:58.788063 IP 10.8.1.4.60534 > 45.113.128.222.1935: Flags [.], seq 32114:33428, ack 1, win 501, options [nop,nop,TS val 3453535291 ecr 2851076934], length 1314
09:00:58.802167 IP 45.113.128.222.1935 > 10.8.1.4.60534: Flags [.], ack 20894, win 126, options [nop,nop,TS val 2851077010 ecr 3453534821], length 0
09:00:58.821477 IP 10.8.1.4.60534 > 45.113.128.222.1935: Flags [.], seq 33428:34742, ack 1, win 501, options [nop,nop,TS val 3453535324 ecr 2851077010], length 1314
09:00:58.854419 IP 10.8.1.4.60534 > 45.113.128.222.1935: Flags [.], seq 34742:36056, ack 1, win 501, options [nop,nop,TS val 3453535357 ecr 2851077010], length 1314
09:00:58.905478 IP 45.113.128.222.1935 > 10.8.1.4.60534: Flags [.], ack 23522, win 126, options [nop,nop,TS val 2851077113 ecr 3453534890], length 0
09:00:58.905873 IP 45.113.128.222.1935 > 10.8.1.4.60534: Flags [.], ack 24230, win 126, options [nop,nop,TS val 2851077114 ecr 3453534959], length 0
09:00:58.905888 IP 10.8.1.4.60534 > 45.113.128.222.1935: Flags [P.], seq 36056:37249, ack 1, win 501, options [nop,nop,TS val 3453535409 ecr 2851077114], length 1193
09:00:58.955239 IP 10.8.1.4.60534 > 45.113.128.222.1935: Flags [.], seq 37249:38563, ack 1, win 501, options [nop,nop,TS val 3453535458 ecr 2851077114], length 1314
09:00:58.989916 IP 10.8.1.4.60534 > 45.113.128.222.1935: Flags [.], seq 38563:39877, ack 1, win 501, options [nop,nop,TS val 3453535493 ecr 2851077114], length 1314
09:00:59.003965 IP 45.113.128.222.1935 > 10.8.1.4.60534: Flags [.], ack 26858, win 126, options [nop,nop,TS val 2851077212 ecr 3453535023], length 0
09:00:59.025391 IP 10.8.1.4.60534 > 45.113.128.222.1935: Flags [.], seq 39877:41191, ack 1, win 501, options [nop,nop,TS val 3453535528 ecr 2851077212], length 1314
09:00:59.086923 IP 10.8.1.4.60534 > 45.113.128.222.1935: Flags [.], seq 41191:42505, ack 1, win 501, options [nop,nop,TS val 3453535590 ecr 2851077212], length 1314
09:00:59.102508 IP 45.113.128.222.1935 > 10.8.1.4.60534: Flags [.], ack 29486, win 126, options [nop,nop,TS val 2851077310 ecr 3453535092], length 0
09:00:59.123157 IP 10.8.1.4.60534 > 45.113.128.222.1935: Flags [.], seq 42505:43819, ack 1, win 501, options [nop,nop,TS val 3453535626 ecr 2851077310], length 1314
09:00:59.154595 IP 10.8.1.4.60534 > 45.113.128.222.1935: Flags [.], seq 43819:45133, ack 1, win 501, options [nop,nop,TS val 3453535657 ecr 2851077310], length 1314
09:00:59.170701 IP 45.113.128.222.1935 > 10.8.1.4.60534: Flags [.], ack 32114, win 126, options [nop,nop,TS val 2851077379 ecr 3453535186], length 0
09:00:59.217385 IP 10.8.1.4.60534 > 45.113.128.222.1935: Flags [.], seq 45133:46447, ack 1, win 501, options [nop,nop,TS val 3453535720 ecr 2851077379], length 1314
09:00:59.255579 IP 10.8.1.4.60534 > 45.113.128.222.1935: Flags [.], seq 46447:47761, ack 1, win 501, options [nop,nop,TS val 3453535758 ecr 2851077379], length 1314
09:00:59.273240 IP 45.113.128.222.1935 > 10.8.1.4.60534: Flags [.], ack 34742, win 126, options [nop,nop,TS val 2851077480 ecr 3453535291], length 0
09:00:59.289154 IP 10.8.1.4.60534 > 45.113.128.222.1935: Flags [.], seq 47761:49075, ack 1, win 501, options [nop,nop,TS val 3453535792 ecr 2851077480], length 1314
09:00:59.354693 IP 10.8.1.4.60534 > 45.113.128.222.1935: Flags [.], seq 49075:50389, ack 1, win 501, options [nop,nop,TS val 3453535857 ecr 2851077480], length 1314
09:00:59.355668 IP 45.113.128.222.1935 > 10.8.1.4.60534: Flags [.], ack 37249, win 126, options [nop,nop,TS val 2851077563 ecr 3453535357], length 0
09:00:59.355700 IP 10.8.1.4.60534 > 45.113.128.222.1935: Flags [P.], seq 50389:51093, ack 1, win 501, options [nop,nop,TS val 3453535858 ecr 2851077563], length 704
09:00:59.421693 IP 10.8.1.4.60534 > 45.113.128.222.1935: Flags [.], seq 51093:52407, ack 1, win 501, options [nop,nop,TS val 3453535924 ecr 2851077563], length 1314
09:00:59.439343 IP 45.113.128.222.1935 > 10.8.1.4.60534: Flags [.], ack 39877, win 126, options [nop,nop,TS val 2851077648 ecr 3453535458], length 0
09:00:59.452789 IP 10.8.1.4.60534 > 45.113.128.222.1935: Flags [.], seq 52407:53721, ack 1, win 501, options [nop,nop,TS val 3453535955 ecr 2851077648], length 1314
09:00:59.487475 IP 10.8.1.4.60534 > 45.113.128.222.1935: Flags [.], seq 53721:55035, ack 1, win 501, options [nop,nop,TS val 3453535990 ecr 2851077648], length 1314
09:00:59.537053 IP 45.113.128.222.1935 > 10.8.1.4.60534: Flags [.], ack 42505, win 126, options [nop,nop,TS val 2851077745 ecr 3453535528], length 0
09:00:59.551022 IP 10.8.1.4.60534 > 45.113.128.222.1935: Flags [.], seq 55035:56349, ack 1, win 501, options [nop,nop,TS val 3453536054 ecr 2851077745], length 1314
09:00:59.584907 IP 10.8.1.4.60534 > 45.113.128.222.1935: Flags [.], seq 56349:57663, ack 1, win 501, options [nop,nop,TS val 3453536088 ecr 2851077745], length 1314
09:00:59.604124 IP 45.113.128.222.1935 > 10.8.1.4.60534: Flags [.], ack 45133, win 126, options [nop,nop,TS val 2851077812 ecr 3453535626], length 0
09:00:59.621806 IP 10.8.1.4.60534 > 45.113.128.222.1935: Flags [.], seq 57663:58977, ack 1, win 501, options [nop,nop,TS val 3453536124 ecr 2851077812], length 1314
09:00:59.687545 IP 10.8.1.4.60534 > 45.113.128.222.1935: Flags [.], seq 58977:60291, ack 1, win 501, options [nop,nop,TS val 3453536190 ecr 2851077812], length 1314
09:00:59.705589 IP 45.113.128.222.1935 > 10.8.1.4.60534: Flags [.], ack 47761, win 126, options [nop,nop,TS val 2851077913 ecr 3453535720], length 0
09:00:59.719459 IP 10.8.1.4.60534 > 45.113.128.222.1935: Flags [.], seq 60291:61605, ack 1, win 501, options [nop,nop,TS val 3453536222 ecr 2851077913], length 1314
09:00:59.751487 IP 10.8.1.4.60534 > 45.113.128.222.1935: Flags [.], seq 61605:62919, ack 1, win 501, options [nop,nop,TS val 3453536254 ecr 2851077913], length 1314
09:00:59.809980 IP 45.113.128.222.1935 > 10.8.1.4.60534: Flags [.], ack 51093, win 126, options [nop,nop,TS val 2851078013 ecr 3453535858], length 0
09:00:59.810026 IP 10.8.1.4.60534 > 45.113.128.222.1935: Flags [P.], seq 62919:64111, ack 1, win 501, options [nop,nop,TS val 3453536313 ecr 2851078013], length 1192
09:00:59.810056 IP 45.113.128.222.1935 > 10.8.1.4.60534: Flags [.], ack 50389, win 126, options [nop,nop,TS val 2851078012 ecr 3453535792], length 0
09:00:59.855568 IP 10.8.1.4.60534 > 45.113.128.222.1935: Flags [.], seq 64111:65425, ack 1, win 501, options [nop,nop,TS val 3453536358 ecr 2851078013], length 1314
09:00:59.888696 IP 10.8.1.4.60534 > 45.113.128.222.1935: Flags [.], seq 65425:66739, ack 1, win 501, options [nop,nop,TS val 3453536391 ecr 2851078013], length 1314
09:00:59.923174 IP 10.8.1.4.60534 > 45.113.128.222.1935: Flags [.], seq 66739:68053, ack 1, win 501, options [nop,nop,TS val 3453536426 ecr 2851078013], length 1314
09:00:59.985653 IP 10.8.1.4.60534 > 45.113.128.222.1935: Flags [.], seq 68053:69367, ack 1, win 501, options [nop,nop,TS val 3453536488 ecr 2851078013], length 1314
09:01:00.018943 IP 10.8.1.4.60534 > 45.113.128.222.1935: Flags [.], seq 69367:70681, ack 1, win 501, options [nop,nop,TS val 3453536522 ecr 2851078013], length 1314
09:01:00.054445 IP 10.8.1.4.60534 > 45.113.128.222.1935: Flags [.], seq 70681:71995, ack 1, win 501, options [nop,nop,TS val 3453536557 ecr 2851078013], length 1314
09:01:00.119280 IP 10.8.1.4.60534 > 45.113.128.222.1935: Flags [.], seq 71995:73309, ack 1, win 501, options [nop,nop,TS val 3453536622 ecr 2851078013], length 1314
09:01:00.152682 IP 10.8.1.4.60534 > 45.113.128.222.1935: Flags [.], seq 73309:74623, ack 1, win 501, options [nop,nop,TS val 3453536655 ecr 2851078013], length 1314
09:01:00.188766 IP 10.8.1.4.60534 > 45.113.128.222.1935: Flags [.], seq 74623:75937, ack 1, win 501, options [nop,nop,TS val 3453536691 ecr 2851078013], length 1314
09:01:00.255374 IP 10.8.1.4.60534 > 45.113.128.222.1935: Flags [.], seq 75937:77251, ack 1, win 501, options [nop,nop,TS val 3453536758 ecr 2851078013], length 1314
09:01:00.287164 IP 10.8.1.4.60534 > 45.113.128.222.1935: Flags [.], seq 77251:78565, ack 1, win 501, options [nop,nop,TS val 3453536790 ecr 2851078013], length 1314
09:01:00.321025 IP 10.8.1.4.60534 > 45.113.128.222.1935: Flags [.], seq 78565:79879, ack 1, win 501, options [nop,nop,TS val 3453536824 ecr 2851078013], length 1314
09:01:00.385082 IP 10.8.1.4.60534 > 45.113.128.222.1935: Flags [.], seq 79879:81193, ack 1, win 501, options [nop,nop,TS val 3453536888 ecr 2851078013], length 1314
09:01:00.421686 IP 10.8.1.4.60534 > 45.113.128.222.1935: Flags [.], seq 81193:82507, ack 1, win 501, options [nop,nop,TS val 3453536924 ecr 2851078013], length 1314
09:01:00.455637 IP 10.8.1.4.60534 > 45.113.128.222.1935: Flags [.], seq 82507:83821, ack 1, win 501, options [nop,nop,TS val 3453536958 ecr 2851078013], length 1314
09:01:00.520473 IP 10.8.1.4.60534 > 45.113.128.222.1935: Flags [.], seq 83821:85135, ack 1, win 501, options [nop,nop,TS val 3453537023 ecr 2851078013], length 1314
09:01:01.538215 IP 10.8.1.4.60534 > 45.113.128.222.1935: Flags [.], seq 85135:86449, ack 1, win 501, options [nop,nop,TS val 3453538041 ecr 2851078013], length 1314
09:01:01.904405 IP 45.113.128.222.1935 > 10.8.1.4.60534: Flags [.], ack 53721, win 126, options [nop,nop,TS val 2851078110 ecr 3453535924], length 0
09:01:01.904454 IP 10.8.1.4.60534 > 45.113.128.222.1935: Flags [.], seq 86449:87763, ack 1, win 501, options [nop,nop,TS val 3453538407 ecr 2851078110], length 1314
09:01:01.904457 IP 10.8.1.4.60534 > 45.113.128.222.1935: Flags [P.], seq 87763:89077, ack 1, win 501, options [nop,nop,TS val 3453538407 ecr 2851078110], length 1314
09:01:01.904487 IP 45.113.128.222.1935 > 10.8.1.4.60534: Flags [.], ack 55035, win 126, options [nop,nop,TS val 2851078223 ecr 3453535990], length 0
09:01:01.904504 IP 10.8.1.4.60534 > 45.113.128.222.1935: Flags [.], seq 89077:90391, ack 1, win 501, options [nop,nop,TS val 3453538407 ecr 2851078223], length 1314
09:01:01.904505 IP 10.8.1.4.60534 > 45.113.128.222.1935: Flags [P.], seq 90391:91705, ack 1, win 501, options [nop,nop,TS val 3453538407 ecr 2851078223], length 1314
09:01:01.904524 IP 45.113.128.222.1935 > 10.8.1.4.60534: Flags [.], ack 55035, win 126, options [nop,nop,TS val 2851078242 ecr 3453535990,nop,nop,sack 1 {56349:57663}], length 0
09:01:01.904544 IP 10.8.1.4.60534 > 45.113.128.222.1935: Flags [.], seq 91705:93019, ack 1, win 501, options [nop,nop,TS val 3453538407 ecr 2851078242], length 1314
09:01:01.904545 IP 10.8.1.4.60534 > 45.113.128.222.1935: Flags [P.], seq 93019:94333, ack 1, win 501, options [nop,nop,TS val 3453538407 ecr 2851078242], length 1314
09:01:01.904563 IP 45.113.128.222.1935 > 10.8.1.4.60534: Flags [.], ack 55035, win 126, options [nop,nop,TS val 2851078279 ecr 3453535990,nop,nop,sack 1 {56349:58977}], length 0
09:01:01.962265 IP 10.8.1.4.60534 > 45.113.128.222.1935: Flags [.], seq 55035:56349, ack 1, win 501, options [nop,nop,TS val 3453538465 ecr 2851078279], length 1314
09:01:02.078280 IP 45.113.128.222.1935 > 10.8.1.4.60534: Flags [.], ack 55035, win 126, options [nop,nop,TS val 2851080286 ecr 3453535990,nop,nop,sack 1 {56349:60291}], length 0
09:01:02.078321 IP 10.8.1.4.60534 > 45.113.128.222.1935: Flags [.], seq 94333:95647, ack 1, win 501, options [nop,nop,TS val 3453538581 ecr 2851080286], length 1314
09:01:02.078999 IP 45.113.128.222.1935 > 10.8.1.4.60534: Flags [.], ack 55035, win 126, options [nop,nop,TS val 2851080287 ecr 3453535990,nop,nop,sack 1 {56349:81193}], length 0
09:01:02.079050 IP 10.8.1.4.60534 > 45.113.128.222.1935: Flags [.], seq 95647:96961, ack 1, win 501, options [nop,nop,TS val 3453538582 ecr 2851080287], length 1314
09:01:02.079052 IP 10.8.1.4.60534 > 45.113.128.222.1935: Flags [P.], seq 96961:98275, ack 1, win 501, options [nop,nop,TS val 3453538582 ecr 2851080287], length 1314
09:01:02.079061 IP 10.8.1.4.60534 > 45.113.128.222.1935: Flags [.], seq 98275:99589, ack 1, win 501, options [nop,nop,TS val 3453538582 ecr 2851080287], length 1314
09:01:02.079062 IP 10.8.1.4.60534 > 45.113.128.222.1935: Flags [P.], seq 99589:100903, ack 1, win 501, options [nop,nop,TS val 3453538582 ecr 2851080287], length 1314
09:01:02.079069 IP 10.8.1.4.60534 > 45.113.128.222.1935: Flags [.], seq 100903:102217, ack 1, win 501, options [nop,nop,TS val 3453538582 ecr 2851080287], length 1314
09:01:02.079070 IP 10.8.1.4.60534 > 45.113.128.222.1935: Flags [P.], seq 102217:103531, ack 1, win 501, options [nop,nop,TS val 3453538582 ecr 2851080287], length 1314
09:01:02.079076 IP 10.8.1.4.60534 > 45.113.128.222.1935: Flags [.], seq 103531:104845, ack 1, win 501, options [nop,nop,TS val 3453538582 ecr 2851080287], length 1314
09:01:02.079077 IP 10.8.1.4.60534 > 45.113.128.222.1935: Flags [P.], seq 104845:106159, ack 1, win 501, options [nop,nop,TS val 3453538582 ecr 2851080287], length 1314
09:01:02.080229 IP 45.113.128.222.1935 > 10.8.1.4.60534: Flags [.], ack 55035, win 126, options [nop,nop,TS val 2851080287 ecr 3453535990,nop,nop,sack 1 {56349:86449}], length 0
09:01:02.080269 IP 10.8.1.4.60534 > 45.113.128.222.1935: Flags [.], seq 106159:107473, ack 1, win 501, options [nop,nop,TS val 3453538583 ecr 2851080287], length 1314
09:01:02.080271 IP 10.8.1.4.60534 > 45.113.128.222.1935: Flags [P.], seq 107473:108787, ack 1, win 501, options [nop,nop,TS val 3453538583 ecr 2851080287], length 1314
09:01:02.080279 IP 10.8.1.4.60534 > 45.113.128.222.1935: Flags [.], seq 108787:110101, ack 1, win 501, options [nop,nop,TS val 3453538583 ecr 2851080287], length 1314
09:01:02.080280 IP 10.8.1.4.60534 > 45.113.128.222.1935: Flags [P.], seq 110101:111415, ack 1, win 501, options [nop,nop,TS val 3453538583 ecr 2851080287], length 1314
09:01:02.355102 IP 45.113.128.222.1935 > 10.8.1.4.60534: Flags [.], ack 55035, win 126, options [nop,nop,TS val 2851080562 ecr 3453535990,nop,nop,sack 1 {56349:94333}], length 0
09:01:02.355120 IP 10.8.1.4.60534 > 45.113.128.222.1935: Flags [.], seq 111415:112729, ack 1, win 501, options [nop,nop,TS val 3453538858 ecr 2851080562], length 1314
09:01:02.355122 IP 10.8.1.4.60534 > 45.113.128.222.1935: Flags [P.], seq 112729:114043, ack 1, win 501, options [nop,nop,TS val 3453538858 ecr 2851080562], length 1314
09:01:02.355125 IP 10.8.1.4.60534 > 45.113.128.222.1935: Flags [.], seq 114043:115357, ack 1, win 501, options [nop,nop,TS val 3453538858 ecr 2851080562], length 1314
09:01:02.355125 IP 10.8.1.4.60534 > 45.113.128.222.1935: Flags [P.], seq 115357:116671, ack 1, win 501, options [nop,nop,TS val 3453538858 ecr 2851080562], length 1314
09:01:02.355127 IP 10.8.1.4.60534 > 45.113.128.222.1935: Flags [.], seq 116671:117985, ack 1, win 501, options [nop,nop,TS val 3453538858 ecr 2851080562], length 1314
09:01:02.355127 IP 10.8.1.4.60534 > 45.113.128.222.1935: Flags [P.], seq 117985:119299, ack 1, win 501, options [nop,nop,TS val 3453538858 ecr 2851080562], length 1314
09:01:02.412545 IP 45.113.128.222.1935 > 10.8.1.4.60534: Flags [.], ack 94333, win 75, options [nop,nop,TS val 2851080620 ecr 3453538465], length 0
09:01:02.412573 IP 10.8.1.4.60534 > 45.113.128.222.1935: Flags [.], seq 119299:120613, ack 1, win 501, options [nop,nop,TS val 3453538915 ecr 2851080620], length 1314
09:01:02.527804 IP 45.113.128.222.1935 > 10.8.1.4.60534: Flags [.], ack 95647, win 131, options [nop,nop,TS val 2851080736 ecr 3453538581], length 0
09:01:02.527840 IP 10.8.1.4.60534 > 45.113.128.222.1935: Flags [.], seq 120613:121927, ack 1, win 501, options [nop,nop,TS val 3453539031 ecr 2851080736], length 1314
09:01:02.528745 IP 45.113.128.222.1935 > 10.8.1.4.60534: Flags [.], ack 96961, win 137, options [nop,nop,TS val 2851080737 ecr 3453538582], length 0
09:01:02.528770 IP 10.8.1.4.60534 > 45.113.128.222.1935: Flags [.], seq 121927:123241, ack 1, win 501, options [nop,nop,TS val 3453539031 ecr 2851080737], length 1314
09:01:02.528794 IP 45.113.128.222.1935 > 10.8.1.4.60534: Flags [.], ack 98275, win 143, options [nop,nop,TS val 2851080737 ecr 3453538582], length 0
09:01:02.528816 IP 10.8.1.4.60534 > 45.113.128.222.1935: Flags [.], seq 123241:124555, ack 1, win 501, options [nop,nop,TS val 3453539032 ecr 2851080737], length 1314
09:01:02.528818 IP 10.8.1.4.60534 > 45.113.128.222.1935: Flags [P.], seq 124555:125869, ack 1, win 501, options [nop,nop,TS val 3453539032 ecr 2851080737], length 1314
09:01:02.528837 IP 45.113.128.222.1935 > 10.8.1.4.60534: Flags [.], ack 99589, win 148, options [nop,nop,TS val 2851080737 ecr 3453538582], length 0
09:01:02.528850 IP 10.8.1.4.60534 > 45.113.128.222.1935: Flags [.], seq 125869:127183, ack 1, win 501, options [nop,nop,TS val 3453539032 ecr 2851080737], length 1314
09:01:02.528871 IP 45.113.128.222.1935 > 10.8.1.4.60534: Flags [.], ack 100903, win 154, options [nop,nop,TS val 2851080737 ecr 3453538582], length 0
09:01:02.528895 IP 45.113.128.222.1935 > 10.8.1.4.60534: Flags [.], ack 102217, win 160, options [nop,nop,TS val 2851080737 ecr 3453538582], length 0
09:01:02.528913 IP 10.8.1.4.60534 > 45.113.128.222.1935: Flags [.], seq 127183:128497, ack 1, win 501, options [nop,nop,TS val 3453539032 ecr 2851080737], length 1314
09:01:02.528915 IP 10.8.1.4.60534 > 45.113.128.222.1935: Flags [P.], seq 128497:129811, ack 1, win 501, options [nop,nop,TS val 3453539032 ecr 2851080737], length 1314
09:01:02.528934 IP 45.113.128.222.1935 > 10.8.1.4.60534: Flags [.], ack 103531, win 165, options [nop,nop,TS val 2851080737 ecr 3453538582], length 0
09:01:02.528952 IP 10.8.1.4.60534 > 45.113.128.222.1935: Flags [.], seq 129811:131125, ack 1, win 501, options [nop,nop,TS val 3453539032 ecr 2851080737], length 1314
09:01:02.528953 IP 10.8.1.4.60534 > 45.113.128.222.1935: Flags [P.], seq 131125:132439, ack 1, win 501, options [nop,nop,TS val 3453539032 ecr 2851080737], length 1314
09:01:02.528974 IP 45.113.128.222.1935 > 10.8.1.4.60534: Flags [.], ack 104845, win 171, options [nop,nop,TS val 2851080737 ecr 3453538582], length 0
09:01:02.529304 IP 45.113.128.222.1935 > 10.8.1.4.60534: Flags [.], ack 106159, win 177, options [nop,nop,TS val 2851080737 ecr 3453538582], length 0
09:01:02.529324 IP 10.8.1.4.60534 > 45.113.128.222.1935: Flags [.], seq 132439:133753, ack 1, win 501, options [nop,nop,TS val 3453539032 ecr 2851080737], length 1314
09:01:02.529326 IP 10.8.1.4.60534 > 45.113.128.222.1935: Flags [P.], seq 133753:135067, ack 1, win 501, options [nop,nop,TS val 3453539032 ecr 2851080737], length 1314
09:01:02.529572 IP 45.113.128.222.1935 > 10.8.1.4.60534: Flags [.], ack 107473, win 182, options [nop,nop,TS val 2851080738 ecr 3453538583], length 0
09:01:02.529598 IP 45.113.128.222.1935 > 10.8.1.4.60534: Flags [.], ack 110101, win 194, options [nop,nop,TS val 2851080738 ecr 3453538583], length 0
09:01:02.529617 IP 10.8.1.4.60534 > 45.113.128.222.1935: Flags [.], seq 135067:136381, ack 1, win 501, options [nop,nop,TS val 3453539032 ecr 2851080738], length 1314
09:01:02.529618 IP 10.8.1.4.60534 > 45.113.128.222.1935: Flags [P.], seq 136381:137695, ack 1, win 501, options [nop,nop,TS val 3453539032 ecr 2851080738], length 1314
09:01:02.529629 IP 10.8.1.4.60534 > 45.113.128.222.1935: Flags [.], seq 137695:139009, ack 1, win 501, options [nop,nop,TS val 3453539032 ecr 2851080738], length 1314
09:01:02.529631 IP 10.8.1.4.60534 > 45.113.128.222.1935: Flags [P.], seq 139009:140323, ack 1, win 501, options [nop,nop,TS val 3453539032 ecr 2851080738], length 1314
09:01:02.529652 IP 45.113.128.222.1935 > 10.8.1.4.60534: Flags [.], ack 108787, win 188, options [nop,nop,TS val 2851080738 ecr 3453538583], length 0
09:01:02.529672 IP 45.113.128.222.1935 > 10.8.1.4.60534: Flags [.], ack 111415, win 199, options [nop,nop,TS val 2851080738 ecr 3453538583], length 0
09:01:02.529684 IP 10.8.1.4.60534 > 45.113.128.222.1935: Flags [.], seq 140323:141637, ack 1, win 501, options [nop,nop,TS val 3453539032 ecr 2851080738], length 1314
09:01:02.804314 IP 45.113.128.222.1935 > 10.8.1.4.60534: Flags [.], ack 112729, win 205, options [nop,nop,TS val 2851081013 ecr 3453538858], length 0
09:01:02.804348 IP 10.8.1.4.60534 > 45.113.128.222.1935: Flags [.], seq 141637:142951, ack 1, win 501, options [nop,nop,TS val 3453539307 ecr 2851081013], length 1314
09:01:02.804634 IP 45.113.128.222.1935 > 10.8.1.4.60534: Flags [.], ack 114043, win 210, options [nop,nop,TS val 2851081013 ecr 3453538858], length 0
09:01:02.804666 IP 45.113.128.222.1935 > 10.8.1.4.60534: Flags [.], ack 115357, win 216, options [nop,nop,TS val 2851081013 ecr 3453538858], length 0
09:01:02.804689 IP 10.8.1.4.60534 > 45.113.128.222.1935: Flags [.], seq 142951:144265, ack 1, win 501, options [nop,nop,TS val 3453539307 ecr 2851081013], length 1314
09:01:02.804691 IP 10.8.1.4.60534 > 45.113.128.222.1935: Flags [P.], seq 144265:145579, ack 1, win 501, options [nop,nop,TS val 3453539307 ecr 2851081013], length 1314
09:01:02.804709 IP 45.113.128.222.1935 > 10.8.1.4.60534: Flags [.], ack 116671, win 222, options [nop,nop,TS val 2851081013 ecr 3453538858], length 0
09:01:02.804724 IP 45.113.128.222.1935 > 10.8.1.4.60534: Flags [.], ack 117985, win 227, options [nop,nop,TS val 2851081013 ecr 3453538858], length 0
09:01:02.804734 IP 10.8.1.4.60534 > 45.113.128.222.1935: Flags [.], seq 145579:146893, ack 1, win 501, options [nop,nop,TS val 3453539307 ecr 2851081013], length 1314
09:01:02.804736 IP 10.8.1.4.60534 > 45.113.128.222.1935: Flags [P.], seq 146893:148207, ack 1, win 501, options [nop,nop,TS val 3453539307 ecr 2851081013], length 1314
09:01:02.804749 IP 45.113.128.222.1935 > 10.8.1.4.60534: Flags [.], ack 119299, win 233, options [nop,nop,TS val 2851081013 ecr 3453538858], length 0
09:01:02.804761 IP 10.8.1.4.60534 > 45.113.128.222.1935: Flags [.], seq 148207:149521, ack 1, win 501, options [nop,nop,TS val 3453539307 ecr 2851081013], length 1314
09:01:02.804762 IP 10.8.1.4.60534 > 45.113.128.222.1935: Flags [P.], seq 149521:150835, ack 1, win 501, options [nop,nop,TS val 3453539307 ecr 2851081013], length 1314
09:01:02.862354 IP 45.113.128.222.1935 > 10.8.1.4.60534: Flags [.], ack 120613, win 239, options [nop,nop,TS val 2851081071 ecr 3453538915], length 0
09:01:02.862397 IP 10.8.1.4.60534 > 45.113.128.222.1935: Flags [.], seq 150835:152149, ack 1, win 501, options [nop,nop,TS val 3453539365 ecr 2851081071], length 1314
09:01:02.979402 IP 45.113.128.222.1935 > 10.8.1.4.60534: Flags [.], ack 121927, win 244, options [nop,nop,TS val 2851081187 ecr 3453539031], length 0
09:01:02.979426 IP 10.8.1.4.60534 > 45.113.128.222.1935: Flags [.], seq 152149:153463, ack 1, win 501, options [nop,nop,TS val 3453539482 ecr 2851081187], length 1314
09:01:02.979443 IP 45.113.128.222.1935 > 10.8.1.4.60534: Flags [.], ack 123241, win 250, options [nop,nop,TS val 2851081188 ecr 3453539031], length 0
09:01:02.979507 IP 45.113.128.222.1935 > 10.8.1.4.60534: Flags [.], ack 124555, win 256, options [nop,nop,TS val 2851081188 ecr 3453539032], length 0
09:01:02.979519 IP 10.8.1.4.60534 > 45.113.128.222.1935: Flags [.], seq 153463:154777, ack 1, win 501, options [nop,nop,TS val 3453539482 ecr 2851081188], length 1314
09:01:02.979520 IP 10.8.1.4.60534 > 45.113.128.222.1935: Flags [P.], seq 154777:156091, ack 1, win 501, options [nop,nop,TS val 3453539482 ecr 2851081188], length 1314
09:01:02.979753 IP 45.113.128.222.1935 > 10.8.1.4.60534: Flags [.], ack 127183, win 267, options [nop,nop,TS val 2851081188 ecr 3453539032], length 0
09:01:02.979773 IP 10.8.1.4.60534 > 45.113.128.222.1935: Flags [.], seq 156091:157405, ack 1, win 501, options [nop,nop,TS val 3453539482 ecr 2851081188], length 1314
09:01:02.979774 IP 10.8.1.4.60534 > 45.113.128.222.1935: Flags [P.], seq 157405:158646, ack 1, win 501, options [nop,nop,TS val 3453539482 ecr 2851081188], length 1241
09:01:02.979790 IP 45.113.128.222.1935 > 10.8.1.4.60534: Flags [.], ack 125869, win 261, options [nop,nop,TS val 2851081188 ecr 3453539032], length 0
09:01:02.979966 IP 45.113.128.222.1935 > 10.8.1.4.60534: Flags [.], ack 128497, win 273, options [nop,nop,TS val 2851081188 ecr 3453539032], length 0
09:01:02.979985 IP 45.113.128.222.1935 > 10.8.1.4.60534: Flags [.], ack 129811, win 278, options [nop,nop,TS val 2851081188 ecr 3453539032], length 0
09:01:02.979995 IP 45.113.128.222.1935 > 10.8.1.4.60534: Flags [.], ack 131125, win 284, options [nop,nop,TS val 2851081188 ecr 3453539032], length 0
09:01:02.980004 IP 45.113.128.222.1935 > 10.8.1.4.60534: Flags [.], ack 132439, win 290, options [nop,nop,TS val 2851081188 ecr 3453539032], length 0
09:01:02.980012 IP 45.113.128.222.1935 > 10.8.1.4.60534: Flags [.], ack 133753, win 295, options [nop,nop,TS val 2851081188 ecr 3453539032], length 0
09:01:02.980021 IP 45.113.128.222.1935 > 10.8.1.4.60534: Flags [.], ack 135067, win 301, options [nop,nop,TS val 2851081188 ecr 3453539032], length 0
09:01:02.980029 IP 45.113.128.222.1935 > 10.8.1.4.60534: Flags [.], ack 136381, win 307, options [nop,nop,TS val 2851081188 ecr 3453539032], length 0
09:01:02.980038 IP 45.113.128.222.1935 > 10.8.1.4.60534: Flags [.], ack 137695, win 312, options [nop,nop,TS val 2851081188 ecr 3453539032], length 0
09:01:02.980318 IP 45.113.128.222.1935 > 10.8.1.4.60534: Flags [.], ack 139009, win 318, options [nop,nop,TS val 2851081188 ecr 3453539032], length 0
09:01:02.980335 IP 45.113.128.222.1935 > 10.8.1.4.60534: Flags [.], ack 140323, win 324, options [nop,nop,TS val 2851081189 ecr 3453539032], length 0
09:01:02.980480 IP 45.113.128.222.1935 > 10.8.1.4.60534: Flags [.], ack 141637, win 329, options [nop,nop,TS val 2851081189 ecr 3453539032], length 0
09:01:03.026049 IP 10.8.1.4.60534 > 45.113.128.222.1935: Flags [.], seq 158646:159960, ack 1, win 501, options [nop,nop,TS val 3453539529 ecr 2851081189], length 1314
09:01:03.052853 IP 10.8.1.4.60534 > 45.113.128.222.1935: Flags [.], seq 159960:161274, ack 1, win 501, options [nop,nop,TS val 3453539556 ecr 2851081189], length 1314
09:01:03.090156 IP 10.8.1.4.60534 > 45.113.128.222.1935: Flags [.], seq 161274:162588, ack 1, win 501, options [nop,nop,TS val 3453539593 ecr 2851081189], length 1314
09:01:03.153619 IP 10.8.1.4.60534 > 45.113.128.222.1935: Flags [.], seq 162588:163902, ack 1, win 501, options [nop,nop,TS val 3453539656 ecr 2851081189], length 1314
09:01:03.184793 IP 10.8.1.4.60534 > 45.113.128.222.1935: Flags [.], seq 163902:165216, ack 1, win 501, options [nop,nop,TS val 3453539687 ecr 2851081189], length 1314
09:01:03.221458 IP 10.8.1.4.60534 > 45.113.128.222.1935: Flags [.], seq 165216:166530, ack 1, win 501, options [nop,nop,TS val 3453539724 ecr 2851081189], length 1314
09:01:03.254000 IP 45.113.128.222.1935 > 10.8.1.4.60534: Flags [.], ack 142951, win 335, options [nop,nop,TS val 2851081462 ecr 3453539307], length 0
09:01:03.254768 IP 45.113.128.222.1935 > 10.8.1.4.60534: Flags [.], ack 144265, win 341, options [nop,nop,TS val 2851081462 ecr 3453539307], length 0
09:01:03.254799 IP 45.113.128.222.1935 > 10.8.1.4.60534: Flags [.], ack 145579, win 346, options [nop,nop,TS val 2851081462 ecr 3453539307], length 0
09:01:03.254817 IP 45.113.128.222.1935 > 10.8.1.4.60534: Flags [.], ack 146893, win 352, options [nop,nop,TS val 2851081462 ecr 3453539307], length 0
09:01:03.254834 IP 45.113.128.222.1935 > 10.8.1.4.60534: Flags [.], ack 149521, win 363, options [nop,nop,TS val 2851081462 ecr 3453539307], length 0
09:01:03.254853 IP 45.113.128.222.1935 > 10.8.1.4.60534: Flags [.], ack 148207, win 358, options [nop,nop,TS val 2851081462 ecr 3453539307], length 0
09:01:03.254868 IP 45.113.128.222.1935 > 10.8.1.4.60534: Flags [.], ack 150835, win 369, options [nop,nop,TS val 2851081462 ecr 3453539307], length 0
09:01:03.288760 IP 10.8.1.4.60534 > 45.113.128.222.1935: Flags [.], seq 166530:167844, ack 1, win 501, options [nop,nop,TS val 3453539791 ecr 2851081462], length 1314
09:01:03.312158 IP 45.113.128.222.1935 > 10.8.1.4.60534: Flags [.], ack 152149, win 375, options [nop,nop,TS val 2851081520 ecr 3453539365], length 0
09:01:03.324720 IP 10.8.1.4.60534 > 45.113.128.222.1935: Flags [.], seq 167844:169158, ack 1, win 501, options [nop,nop,TS val 3453539827 ecr 2851081520], length 1314
09:01:03.351591 IP 10.8.1.4.60534 > 45.113.128.222.1935: Flags [.], seq 169158:170472, ack 1, win 501, options [nop,nop,TS val 3453539854 ecr 2851081520], length 1314
09:01:03.417950 IP 10.8.1.4.60534 > 45.113.128.222.1935: Flags [.], seq 170472:171786, ack 1, win 501, options [nop,nop,TS val 3453539921 ecr 2851081520], length 1314
09:01:03.431023 IP 45.113.128.222.1935 > 10.8.1.4.60534: Flags [.], ack 156091, win 391, options [nop,nop,TS val 2851081638 ecr 3453539482], length 0
09:01:03.431134 IP 45.113.128.222.1935 > 10.8.1.4.60534: Flags [.], ack 157405, win 397, options [nop,nop,TS val 2851081638 ecr 3453539482], length 0
09:01:03.431363 IP 45.113.128.222.1935 > 10.8.1.4.60534: Flags [.], ack 153463, win 380, options [nop,nop,TS val 2851081638 ecr 3453539482], length 0
09:01:03.431374 IP 45.113.128.222.1935 > 10.8.1.4.60534: Flags [.], ack 154777, win 386, options [nop,nop,TS val 2851081638 ecr 3453539482], length 0
09:01:03.431540 IP 45.113.128.222.1935 > 10.8.1.4.60534: Flags [.], ack 158646, win 403, options [nop,nop,TS val 2851081638 ecr 3453539482], length 0
09:01:03.431551 IP 10.8.1.4.60534 > 45.113.128.222.1935: Flags [P.], seq 171786:172591, ack 1, win 501, options [nop,nop,TS val 3453539934 ecr 2851081638], length 805
09:01:03.475590 IP 45.113.128.222.1935 > 10.8.1.4.60534: Flags [.], ack 159960, win 408, options [nop,nop,TS val 2851081684 ecr 3453539529], length 0
09:01:03.488563 IP 10.8.1.4.60534 > 45.113.128.222.1935: Flags [.], seq 172591:173905, ack 1, win 501, options [nop,nop,TS val 3453539991 ecr 2851081684], length 1314
09:01:03.502374 IP 45.113.128.222.1935 > 10.8.1.4.60534: Flags [.], ack 161274, win 414, options [nop,nop,TS val 2851081710 ecr 3453539556], length 0
09:01:03.521978 IP 10.8.1.4.60534 > 45.113.128.222.1935: Flags [.], seq 173905:175219, ack 1, win 501, options [nop,nop,TS val 3453540025 ecr 2851081710], length 1314
09:01:03.539664 IP 45.113.128.222.1935 > 10.8.1.4.60534: Flags [.], ack 162588, win 420, options [nop,nop,TS val 2851081748 ecr 3453539593], length 0
09:01:03.559454 IP 10.8.1.4.60534 > 45.113.128.222.1935: Flags [.], seq 175219:176533, ack 1, win 501, options [nop,nop,TS val 3453540062 ecr 2851081748], length 1314
09:01:03.604010 IP 45.113.128.222.1935 > 10.8.1.4.60534: Flags [.], ack 163902, win 425, options [nop,nop,TS val 2851081812 ecr 3453539656], length 0
09:01:03.623176 IP 10.8.1.4.60534 > 45.113.128.222.1935: Flags [.], seq 176533:177847, ack 1, win 501, options [nop,nop,TS val 3453540126 ecr 2851081812], length 1314
09:01:03.634363 IP 45.113.128.222.1935 > 10.8.1.4.60534: Flags [.], ack 165216, win 431, options [nop,nop,TS val 2851081842 ecr 3453539687], length 0
09:01:03.653927 IP 10.8.1.4.60534 > 45.113.128.222.1935: Flags [.], seq 177847:179161, ack 1, win 501, options [nop,nop,TS val 3453540157 ecr 2851081842], length 1314
09:01:03.671235 IP 45.113.128.222.1935 > 10.8.1.4.60534: Flags [.], ack 166530, win 437, options [nop,nop,TS val 2851081879 ecr 3453539724], length 0
09:01:03.688297 IP 10.8.1.4.60534 > 45.113.128.222.1935: Flags [.], seq 179161:180475, ack 1, win 501, options [nop,nop,TS val 3453540191 ecr 2851081879], length 1314
09:01:03.738807 IP 45.113.128.222.1935 > 10.8.1.4.60534: Flags [.], ack 167844, win 442, options [nop,nop,TS val 2851081946 ecr 3453539791], length 0
09:01:03.752150 IP 10.8.1.4.60534 > 45.113.128.222.1935: Flags [.], seq 180475:181789, ack 1, win 501, options [nop,nop,TS val 3453540255 ecr 2851081946], length 1314
09:01:03.774097 IP 45.113.128.222.1935 > 10.8.1.4.60534: Flags [.], ack 169158, win 448, options [nop,nop,TS val 2851081982 ecr 3453539827], length 0
09:01:03.793754 IP 10.8.1.4.60534 > 45.113.128.222.1935: Flags [.], seq 181789:183103, ack 1, win 501, options [nop,nop,TS val 3453540296 ecr 2851081982], length 1314
09:01:03.800729 IP 45.113.128.222.1935 > 10.8.1.4.60534: Flags [.], ack 170472, win 454, options [nop,nop,TS val 2851082009 ecr 3453539854], length 0
09:01:03.817945 IP 10.8.1.4.60534 > 45.113.128.222.1935: Flags [.], seq 183103:184417, ack 1, win 501, options [nop,nop,TS val 3453540321 ecr 2851082009], length 1314
09:01:03.867495 IP 45.113.128.222.1935 > 10.8.1.4.60534: Flags [.], ack 171786, win 459, options [nop,nop,TS val 2851082076 ecr 3453539921], length 0
09:01:03.880851 IP 45.113.128.222.1935 > 10.8.1.4.60534: Flags [.], ack 172591, win 465, options [nop,nop,TS val 2851082089 ecr 3453539934], length 0
09:01:03.880901 IP 10.8.1.4.60534 > 45.113.128.222.1935: Flags [P.], seq 184417:185600, ack 1, win 501, options [nop,nop,TS val 3453540384 ecr 2851082089], length 1183
09:01:03.922090 IP 10.8.1.4.60534 > 45.113.128.222.1935: Flags [.], seq 185600:186914, ack 1, win 501, options [nop,nop,TS val 3453540425 ecr 2851082089], length 1314
09:01:03.938345 IP 45.113.128.222.1935 > 10.8.1.4.60534: Flags [.], ack 173905, win 471, options [nop,nop,TS val 2851082146 ecr 3453539991], length 0
09:01:03.951183 IP 10.8.1.4.60534 > 45.113.128.222.1935: Flags [.], seq 186914:188228, ack 1, win 501, options [nop,nop,TS val 3453540454 ecr 2851082146], length 1314
09:01:03.971132 IP 45.113.128.222.1935 > 10.8.1.4.60534: Flags [.], ack 175219, win 476, options [nop,nop,TS val 2851082179 ecr 3453540025], length 0
09:01:04.007232 IP 10.8.1.4.60534 > 45.113.128.222.1935: Flags [.], seq 188228:189542, ack 1, win 501, options [nop,nop,TS val 3453540510 ecr 2851082179], length 1314
09:01:04.009004 IP 45.113.128.222.1935 > 10.8.1.4.60534: Flags [.], ack 176533, win 482, options [nop,nop,TS val 2851082217 ecr 3453540062], length 0
09:01:04.055803 IP 10.8.1.4.60534 > 45.113.128.222.1935: Flags [.], seq 189542:190856, ack 1, win 501, options [nop,nop,TS val 3453540558 ecr 2851082217], length 1314
09:01:04.072477 IP 45.113.128.222.1935 > 10.8.1.4.60534: Flags [.], ack 177847, win 488, options [nop,nop,TS val 2851082281 ecr 3453540126], length 0
09:01:04.093103 IP 10.8.1.4.60534 > 45.113.128.222.1935: Flags [.], seq 190856:192170, ack 1, win 501, options [nop,nop,TS val 3453540596 ecr 2851082281], length 1314
