05:01:13.026664 IP 52.223.243.219.1935 > 10.8.2.3.41318: Flags [.], ack 2978581849, win 275, options [nop,nop,TS val 761603175 ecr 77000751,nop,nop,sack 1 {1315:11827}], length 0
05:01:13.026707 IP 10.8.2.3.41318 > 52.223.243.219.1935: Flags [.], seq 22535:23849, ack 0, win 501, options [nop,nop,TS val 77001499 ecr 761603175], length 1314
05:01:13.040163 IP 10.8.2.3.41318 > 52.223.243.219.1935: Flags [.], seq 23849:25163, ack 0, win 501, options [nop,nop,TS val 77001512 ecr 761603175], length 1314
05:01:13.085021 IP 52.223.243.219.1935 > 10.8.2.3.41318: Flags [.], ack 1, win 275, options [nop,nop,TS val 761603239 ecr 77000751,nop,nop,sack 1 {1315:13141}], length 0
05:01:13.085066 IP 10.8.2.3.41318 > 52.223.243.219.1935: Flags [.], seq 25163:26477, ack 0, win 501, options [nop,nop,TS val 77001557 ecr 761603239], length 1314
05:01:13.139842 IP 52.223.243.219.1935 > 10.8.2.3.41318: Flags [.], ack 13141, win 261, options [nop,nop,TS val 761603293 ecr 77001173], length 0
05:01:13.139892 IP 10.8.2.3.41318 > 52.223.243.219.1935: Flags [.], seq 26477:27791, ack 0, win 501, options [nop,nop,TS val 77001612 ecr 761603293], length 1314
05:01:13.157844 IP 52.223.243.219.1935 > 10.8.2.3.41318: Flags [.], ack 14455, win 279, options [nop,nop,TS val 761603310 ecr 77001188], length 0
05:01:13.157972 IP 52.223.243.219.1935 > 10.8.2.3.41318: Flags [.], ack 15965, win 279, options [nop,nop,TS val 761603310 ecr 77001188], length 0
05:01:13.158005 IP 10.8.2.3.41318 > 52.223.243.219.1935: Flags [P.], seq 27791:28882, ack 0, win 501, options [nop,nop,TS val 77001630 ecr 761603310], length 1091
05:01:13.205936 IP 10.8.2.3.41318 > 52.223.243.219.1935: Flags [.], seq 28882:30196, ack 0, win 501, options [nop,nop,TS val 77001678 ecr 761603310], length 1314
05:01:13.240058 IP 10.8.2.3.41318 > 52.223.243.219.1935: Flags [.], seq 30196:31510, ack 0, win 501, options [nop,nop,TS val 77001712 ecr 761603310], length 1314
05:01:13.258235 IP 52.223.243.219.1935 > 10.8.2.3.41318: Flags [.], ack 17279, win 279, options [nop,nop,TS val 761603409 ecr 77001245], length 0
05:01:13.273369 IP 10.8.2.3.41318 > 52.223.243.219.1935: Flags [.], seq 31510:32824, ack 0, win 501, options [nop,nop,TS val 77001745 ecr 761603409], length 1314
05:01:13.299248 IP 52.223.243.219.1935 > 10.8.2.3.41318: Flags [.], ack 19907, win 279, options [nop,nop,TS val 761603450 ecr 77001297], length 0
05:01:13.340384 IP 10.8.2.3.41318 > 52.223.243.219.1935: Flags [.], seq 32824:34138, ack 0, win 501, options [nop,nop,TS val 77001812 ecr 761603450], length 1314
05:01:13.371214 IP 10.8.2.3.41318 > 52.223.243.219.1935: Flags [.], seq 34138:35452, ack 0, win 501, options [nop,nop,TS val 77001843 ecr 761603450], length 1314
05:01:13.403885 IP 10.8.2.3.41318 > 52.223.243.219.1935: Flags [.], seq 35452:36766, ack 0, win 501, options [nop,nop,TS val 77001876 ecr 761603450], length 1314
05:01:13.429218 IP 52.223.243.219.1935 > 10.8.2.3.41318: Flags [.], ack 21221, win 279, options [nop,nop,TS val 761603589 ecr 77001378], length 0
05:01:13.459081 IP 52.223.243.219.1935 > 10.8.2.3.41318: Flags [.], ack 21221, win 279, options [nop,nop,TS val 761603617 ecr 77001378,nop,nop,sack 1 {22535:23849}], length 0
05:01:13.473341 IP 10.8.2.3.41318 > 52.223.243.219.1935: Flags [.], seq 36766:38080, ack 0, win 501, options [nop,nop,TS val 77001945 ecr 761603617], length 1314
05:01:13.475813 IP 52.223.243.219.1935 > 10.8.2.3.41318: Flags [.], ack 21221, win 279, options [nop,nop,TS val 761603633 ecr 77001378,nop,nop,sack 1 {22535:25163}], length 0
05:01:13.504846 IP 10.8.2.3.41318 > 52.223.243.219.1935: Flags [.], seq 38080:39394, ack 0, win 501, options [nop,nop,TS val 77001977 ecr 761603633], length 1314
05:01:13.514970 IP 10.8.2.3.41318 > 52.223.243.219.1935: Flags [.], seq 21221:22535, ack 0, win 501, options [nop,nop,TS val 77001987 ecr 761603633], length 1314
05:01:13.515290 IP 52.223.243.219.1935 > 10.8.2.3.41318: Flags [.], ack 21221, win 279, options [nop,nop,TS val 761603673 ecr 77001378,nop,nop,sack 1 {22535:26477}], length 0
05:01:13.539464 IP 10.8.2.3.41318 > 52.223.243.219.1935: Flags [.], seq 39394:40708, ack 0, win 501, options [nop,nop,TS val 77002011 ecr 761603673], length 1314
05:01:13.571688 IP 52.223.243.219.1935 > 10.8.2.3.41318: Flags [.], ack 21221, win 279, options [nop,nop,TS val 761603728 ecr 77001378,nop,nop,sack 1 {22535:27791}], length 0
05:01:13.590615 IP 52.223.243.219.1935 > 10.8.2.3.41318: Flags [.], ack 21221, win 279, options [nop,nop,TS val 761603747 ecr 77001378,nop,nop,sack 1 {22535:28882}], length 0
05:01:13.643258 IP 52.223.243.219.1935 > 10.8.2.3.41318: Flags [.], ack 21221, win 279, options [nop,nop,TS val 761603798 ecr 77001378,nop,nop,sack 1 {22535:30196}], length 0
05:01:13.643301 IP 10.8.2.3.41318 > 52.223.243.219.1935: Flags [.], seq 40708:42022, ack 0, win 501, options [nop,nop,TS val 77002115 ecr 761603798], length 1314
05:01:13.675189 IP 52.223.243.219.1935 > 10.8.2.3.41318: Flags [.], ack 21221, win 279, options [nop,nop,TS val 761603832 ecr 77001378,nop,nop,sack 1 {22535:31510}], length 0
05:01:13.675216 IP 10.8.2.3.41318 > 52.223.243.219.1935: Flags [.], seq 42022:43336, ack 0, win 501, options [nop,nop,TS val 77002147 ecr 761603832], length 1314
05:01:13.706055 IP 52.223.243.219.1935 > 10.8.2.3.41318: Flags [.], ack 21221, win 279, options [nop,nop,TS val 761603864 ecr 77001378,nop,nop,sack 1 {22535:32824}], length 0
05:01:13.706083 IP 10.8.2.3.41318 > 52.223.243.219.1935: Flags [.], seq 43336:44650, ack 0, win 501, options [nop,nop,TS val 77002178 ecr 761603864], length 1314
05:01:13.776024 IP 52.223.243.219.1935 > 10.8.2.3.41318: Flags [.], ack 21221, win 279, options [nop,nop,TS val 761603932 ecr 77001378,nop,nop,sack 1 {22535:34138}], length 0
05:01:13.776075 IP 10.8.2.3.41318 > 52.223.243.219.1935: Flags [.], seq 44650:45964, ack 0, win 501, options [nop,nop,TS val 77002248 ecr 761603932], length 1314
05:01:13.803662 IP 52.223.243.219.1935 > 10.8.2.3.41318: Flags [.], ack 21221, win 279, options [nop,nop,TS val 761603963 ecr 77001378,nop,nop,sack 1 {22535:35452}], length 0
05:01:13.803738 IP 10.8.2.3.41318 > 52.223.243.219.1935: Flags [.], seq 45964:47278, ack 0, win 501, options [nop,nop,TS val 77002276 ecr 761603963], length 1314
05:01:13.835488 IP 52.223.243.219.1935 > 10.8.2.3.41318: Flags [.], ack 21221, win 279, options [nop,nop,TS val 761603995 ecr 77001378,nop,nop,sack 1 {22535:36766}], length 0
05:01:13.835564 IP 10.8.2.3.41318 > 52.223.243.219.1935: Flags [.], seq 47278:48592, ack 0, win 501, options [nop,nop,TS val 77002307 ecr 761603995], length 1314
05:01:13.909909 IP 52.223.243.219.1935 > 10.8.2.3.41318: Flags [.], ack 21221, win 279, options [nop,nop,TS val 761604064 ecr 77001378,nop,nop,sack 1 {22535:38080}], length 0
05:01:13.909952 IP 10.8.2.3.41318 > 52.223.243.219.1935: Flags [.], seq 48592:49906, ack 0, win 501, options [nop,nop,TS val 77002382 ecr 761604064], length 1314
05:01:13.937712 IP 52.223.243.219.1935 > 10.8.2.3.41318: Flags [.], ack 21221, win 279, options [nop,nop,TS val 761604094 ecr 77001378,nop,nop,sack 1 {22535:39394}], length 0
05:01:13.937748 IP 10.8.2.3.41318 > 52.223.243.219.1935: Flags [.], seq 49906:51220, ack 0, win 501, options [nop,nop,TS val 77002410 ecr 761604094], length 1314
05:01:13.950857 IP 52.223.243.219.1935 > 10.8.2.3.41318: Flags [.], ack 39394, win 253, options [nop,nop,TS val 761604104 ecr 77001987], length 0
05:01:13.950903 IP 10.8.2.3.41318 > 52.223.243.219.1935: Flags [.], seq 51220:52534, ack 0, win 501, options [nop,nop,TS val 77002423 ecr 761604104], length 1314
05:01:14.019669 IP 52.223.243.219.1935 > 10.8.2.3.41318: Flags [.], ack 40708, win 282, options [nop,nop,TS val 761604173 ecr 77002011], length 0
05:01:14.019706 IP 10.8.2.3.41318 > 52.223.243.219.1935: Flags [.], seq 52534:53848, ack 0, win 501, options [nop,nop,TS val 77002492 ecr 761604173], length 1314
05:01:14.148484 IP 52.223.243.219.1935 > 10.8.2.3.41318: Flags [.], ack 42022, win 280, options [nop,nop,TS val 761604301 ecr 77002115,nop,nop,sack 1 {43336:44650}], length 0
05:01:14.148500 IP 10.8.2.3.41318 > 52.223.243.219.1935: Flags [.], seq 53848:55162, ack 0, win 501, options [nop,nop,TS val 77002620 ecr 761604301], length 1314
05:01:14.148501 IP 10.8.2.3.41318 > 52.223.243.219.1935: Flags [P.], seq 55162:56476, ack 0, win 501, options [nop,nop,TS val 77002620 ecr 761604301], length 1314
05:01:14.205657 IP 52.223.243.219.1935 > 10.8.2.3.41318: Flags [.], ack 42022, win 280, options [nop,nop,TS val 761604366 ecr 77002115,nop,nop,sack 1 {43336:45964}], length 0
05:01:14.205693 IP 10.8.2.3.41318 > 52.223.243.219.1935: Flags [.], seq 56476:57790, ack 0, win 501, options [nop,nop,TS val 77002678 ecr 761604366], length 1314
05:01:14.222959 IP 10.8.2.3.41318 > 52.223.243.219.1935: Flags [.], seq 42022:43336, ack 0, win 501, options [nop,nop,TS val 77002695 ecr 761604366], length 1314
05:01:14.232462 IP 52.223.243.219.1935 > 10.8.2.3.41318: Flags [.], ack 42022, win 280, options [nop,nop,TS val 761604393 ecr 77002115,nop,nop,sack 1 {43336:47278}], length 0
05:01:14.232493 IP 10.8.2.3.41318 > 52.223.243.219.1935: Flags [.], seq 57790:59104, ack 0, win 501, options [nop,nop,TS val 77002704 ecr 761604393], length 1314
05:01:14.281049 IP 52.223.243.219.1935 > 10.8.2.3.41318: Flags [.], ack 42022, win 280, options [nop,nop,TS val 761604433 ecr 77002115,nop,nop,sack 1 {43336:48592}], length 0
05:01:14.281064 IP 10.8.2.3.41318 > 52.223.243.219.1935: Flags [.], seq 59104:60418, ack 0, win 501, options [nop,nop,TS val 77002753 ecr 761604433], length 1314
05:01:14.346944 IP 52.223.243.219.1935 > 10.8.2.3.41318: Flags [.], ack 42022, win 280, options [nop,nop,TS val 761604498 ecr 77002115,nop,nop,sack 1 {43336:49906}], length 0
05:01:14.373713 IP 52.223.243.219.1935 > 10.8.2.3.41318: Flags [.], ack 42022, win 280, options [nop,nop,TS val 761604526 ecr 77002115,nop,nop,sack 1 {43336:51220}], length 0
05:01:14.373767 IP 10.8.2.3.41318 > 52.223.243.219.1935: Flags [.], seq 60418:61732, ack 0, win 501, options [nop,nop,TS val 77002846 ecr 761604526], length 1314
05:01:14.385924 IP 52.223.243.219.1935 > 10.8.2.3.41318: Flags [.], ack 42022, win 280, options [nop,nop,TS val 761604539 ecr 77002115,nop,nop,sack 1 {43336:52534}], length 0
05:01:14.385968 IP 10.8.2.3.41318 > 52.223.243.219.1935: Flags [.], seq 61732:63046, ack 0, win 501, options [nop,nop,TS val 77002858 ecr 761604539], length 1314
05:01:14.471275 IP 52.223.243.219.1935 > 10.8.2.3.41318: Flags [.], ack 42022, win 280, options [nop,nop,TS val 761604617 ecr 77002115,nop,nop,sack 1 {43336:53848}], length 0
05:01:14.584112 IP 52.223.243.219.1935 > 10.8.2.3.41318: Flags [.], ack 42022, win 280, options [nop,nop,TS val 761604744 ecr 77002115,nop,nop,sack 1 {43336:56476}], length 0
05:01:14.584135 IP 10.8.2.3.41318 > 52.223.243.219.1935: Flags [.], seq 63046:64360, ack 0, win 501, options [nop,nop,TS val 77003056 ecr 761604744], length 1314
05:01:14.648639 IP 52.223.243.219.1935 > 10.8.2.3.41318: Flags [.], ack 42022, win 280, options [nop,nop,TS val 761604809 ecr 77002115,nop,nop,sack 1 {43336:57790}], length 0
05:01:14.648654 IP 10.8.2.3.41318 > 52.223.243.219.1935: Flags [.], seq 64360:65674, ack 0, win 501, options [nop,nop,TS val 77003120 ecr 761604809], length 1314
05:01:14.659061 IP 52.223.243.219.1935 > 10.8.2.3.41318: Flags [.], ack 57790, win 257, options [nop,nop,TS val 761604820 ecr 77002695], length 0
05:01:14.659070 IP 10.8.2.3.41318 > 52.223.243.219.1935: Flags [.], seq 65674:66988, ack 0, win 501, options [nop,nop,TS val 77003131 ecr 761604820], length 1314
05:01:14.707723 IP 52.223.243.219.1935 > 10.8.2.3.41318: Flags [.], ack 60418, win 279, options [nop,nop,TS val 761604868 ecr 77002704], length 0
05:01:14.707763 IP 10.8.2.3.41318 > 52.223.243.219.1935: Flags [.], seq 66988:68302, ack 0, win 501, options [nop,nop,TS val 77003180 ecr 761604868], length 1314
05:01:14.707765 IP 10.8.2.3.41318 > 52.223.243.219.1935: Flags [P.], seq 68302:69616, ack 0, win 501, options [nop,nop,TS val 77003180 ecr 761604868], length 1314
05:01:14.812557 IP 52.223.243.219.1935 > 10.8.2.3.41318: Flags [.], ack 63046, win 279, options [nop,nop,TS val 761604973 ecr 77002846], length 0
05:01:14.812597 IP 10.8.2.3.41318 > 52.223.243.219.1935: Flags [.], seq 69616:70930, ack 0, win 501, options [nop,nop,TS val 77003284 ecr 761604973], length 1314
05:01:14.812599 IP 10.8.2.3.41318 > 52.223.243.219.1935: Flags [P.], seq 70930:72244, ack 0, win 501, options [nop,nop,TS val 77003284 ecr 761604973], length 1314
05:01:15.083538 IP 52.223.243.219.1935 > 10.8.2.3.41318: Flags [.], ack 64360, win 282, options [nop,nop,TS val 761605233 ecr 77003056], length 0
05:01:15.083554 IP 10.8.2.3.41318 > 52.223.243.219.1935: Flags [.], seq 72244:73558, ack 0, win 501, options [nop,nop,TS val 77003555 ecr 761605233], length 1314
05:01:15.096894 IP 52.223.243.219.1935 > 10.8.2.3.41318: Flags [.], ack 66988, win 282, options [nop,nop,TS val 761605246 ecr 77003120], length 0
05:01:15.096908 IP 10.8.2.3.41318 > 52.223.243.219.1935: Flags [.], seq 73558:74872, ack 0, win 501, options [nop,nop,TS val 77003569 ecr 761605246], length 1314
05:01:15.096909 IP 10.8.2.3.41318 > 52.223.243.219.1935: Flags [P.], seq 74872:76186, ack 0, win 501, options [nop,nop,TS val 77003569 ecr 761605246], length 1314
05:01:15.103576 IP 10.8.2.3.41318 > 52.223.243.219.1935: Flags [.], seq 76186:77500, ack 0, win 501, options [nop,nop,TS val 77003575 ecr 761605246], length 1314
05:01:15.134787 IP 52.223.243.219.1935 > 10.8.2.3.41318: Flags [.], ack 69616, win 282, options [nop,nop,TS val 761605295 ecr 77003180], length 0
05:01:15.134837 IP 10.8.2.3.41318 > 52.223.243.219.1935: Flags [.], seq 77500:78814, ack 0, win 501, options [nop,nop,TS val 77003607 ecr 761605295], length 1314
05:01:15.134840 IP 10.8.2.3.41318 > 52.223.243.219.1935: Flags [P.], seq 78814:80128, ack 0, win 501, options [nop,nop,TS val 77003607 ecr 761605295], length 1314
05:01:15.249130 IP 52.223.243.219.1935 > 10.8.2.3.41318: Flags [.], ack 72244, win 282, options [nop,nop,TS val 761605410 ecr 77003284], length 0
05:01:15.249152 IP 10.8.2.3.41318 > 52.223.243.219.1935: Flags [.], seq 80128:81442, ack 0, win 501, options [nop,nop,TS val 77003721 ecr 761605410], length 1314
05:01:15.249154 IP 10.8.2.3.41318 > 52.223.243.219.1935: Flags [P.], seq 81442:82756, ack 0, win 501, options [nop,nop,TS val 77003721 ecr 761605410], length 1314
05:01:15.530442 IP 52.223.243.219.1935 > 10.8.2.3.41318: Flags [.], ack 74872, win 282, options [nop,nop,TS val 761605684 ecr 77003555], length 0
05:01:15.530484 IP 10.8.2.3.41318 > 52.223.243.219.1935: Flags [.], seq 82756:84070, ack 0, win 501, options [nop,nop,TS val 77004002 ecr 761605684], length 1314
05:01:15.530487 IP 10.8.2.3.41318 > 52.223.243.219.1935: Flags [P.], seq 84070:85384, ack 0, win 501, options [nop,nop,TS val 77004002 ecr 761605684], length 1314
05:01:15.536801 IP 52.223.243.219.1935 > 10.8.2.3.41318: Flags [.], ack 77500, win 282, options [nop,nop,TS val 761605691 ecr 77003569], length 0
05:01:15.536848 IP 10.8.2.3.41318 > 52.223.243.219.1935: Flags [.], seq 85384:86698, ack 0, win 501, options [nop,nop,TS val 77004009 ecr 761605691], length 1314
05:01:15.536851 IP 10.8.2.3.41318 > 52.223.243.219.1935: Flags [P.], seq 86698:88012, ack 0, win 501, options [nop,nop,TS val 77004009 ecr 761605691], length 1314
05:01:15.561772 IP 52.223.243.219.1935 > 10.8.2.3.41318: Flags [.], ack 80128, win 282, options [nop,nop,TS val 761605722 ecr 77003607], length 0
05:01:15.561815 IP 10.8.2.3.41318 > 52.223.243.219.1935: Flags [.], seq 88012:89326, ack 0, win 501, options [nop,nop,TS val 77004034 ecr 761605722], length 1314
05:01:15.561818 IP 10.8.2.3.41318 > 52.223.243.219.1935: Flags [P.], seq 89326:90640, ack 0, win 501, options [nop,nop,TS val 77004034 ecr 761605722], length 1314
05:01:15.690202 IP 52.223.243.219.1935 > 10.8.2.3.41318: Flags [.], ack 82756, win 282, options [nop,nop,TS val 761605840 ecr 77003721], length 0
05:01:15.690244 IP 10.8.2.3.41318 > 52.223.243.219.1935: Flags [.], seq 90640:91954, ack 0, win 501, options [nop,nop,TS val 77004162 ecr 761605840], length 1314
05:01:15.690248 IP 10.8.2.3.41318 > 52.223.243.219.1935: Flags [P.], seq 91954:93268, ack 0, win 501, options [nop,nop,TS val 77004162 ecr 761605840], length 1314
05:01:15.957601 IP 52.223.243.219.1935 > 10.8.2.3.41318: Flags [.], ack 85384, win 282, options [nop,nop,TS val 761606118 ecr 77004002], length 0
05:01:15.957623 IP 10.8.2.3.41318 > 52.223.243.219.1935: Flags [.], seq 93268:94582, ack 0, win 501, options [nop,nop,TS val 77004429 ecr 761606118], length 1314
05:01:15.957624 IP 10.8.2.3.41318 > 52.223.243.219.1935: Flags [P.], seq 94582:95896, ack 0, win 501, options [nop,nop,TS val 77004429 ecr 761606118], length 1314
05:01:15.964148 IP 52.223.243.219.1935 > 10.8.2.3.41318: Flags [.], ack 88012, win 282, options [nop,nop,TS val 761606124 ecr 77004009], length 0
05:01:15.964167 IP 10.8.2.3.41318 > 52.223.243.219.1935: Flags [.], seq 95896:97210, ack 0, win 501, options [nop,nop,TS val 77004436 ecr 761606124], length 1314
05:01:15.964168 IP 10.8.2.3.41318 > 52.223.243.219.1935: Flags [P.], seq 97210:98524, ack 0, win 501, options [nop,nop,TS val 77004436 ecr 761606124], length 1314
05:01:15.988586 IP 52.223.243.219.1935 > 10.8.2.3.41318: Flags [.], ack 90640, win 282, options [nop,nop,TS val 761606149 ecr 77004034], length 0
05:01:15.988600 IP 10.8.2.3.41318 > 52.223.243.219.1935: Flags [.], seq 98524:99838, ack 0, win 501, options [nop,nop,TS val 77004460 ecr 761606149], length 1314
05:01:15.988601 IP 10.8.2.3.41318 > 52.223.243.219.1935: Flags [P.], seq 99838:101152, ack 0, win 501, options [nop,nop,TS val 77004460 ecr 761606149], length 1314
05:01:16.117032 IP 52.223.243.219.1935 > 10.8.2.3.41318: Flags [.], ack 93268, win 282, options [nop,nop,TS val 761606278 ecr 77004162], length 0
05:01:16.117077 IP 10.8.2.3.41318 > 52.223.243.219.1935: Flags [.], seq 101152:102466, ack 0, win 501, options [nop,nop,TS val 77004589 ecr 761606278], length 1314
05:01:16.117080 IP 10.8.2.3.41318 > 52.223.243.219.1935: Flags [P.], seq 102466:103780, ack 0, win 501, options [nop,nop,TS val 77004589 ecr 761606278], length 1314
05:01:16.386251 IP 52.223.243.219.1935 > 10.8.2.3.41318: Flags [.], ack 95896, win 282, options [nop,nop,TS val 761606545 ecr 77004429], length 0
05:01:16.386297 IP 10.8.2.3.41318 > 52.223.243.219.1935: Flags [.], seq 103780:105094, ack 0, win 501, options [nop,nop,TS val 77004858 ecr 761606545], length 1314
05:01:16.386299 IP 10.8.2.3.41318 > 52.223.243.219.1935: Flags [P.], seq 105094:106408, ack 0, win 501, options [nop,nop,TS val 77004858 ecr 761606545], length 1314
05:01:16.391836 IP 52.223.243.219.1935 > 10.8.2.3.41318: Flags [.], ack 98524, win 282, options [nop,nop,TS val 761606552 ecr 77004436], length 0
05:01:16.391880 IP 10.8.2.3.41318 > 52.223.243.219.1935: Flags [.], seq 106408:107722, ack 0, win 501, options [nop,nop,TS val 77004864 ecr 761606552], length 1314
05:01:16.391884 IP 10.8.2.3.41318 > 52.223.243.219.1935: Flags [P.], seq 107722:109036, ack 0, win 501, options [nop,nop,TS val 77004864 ecr 761606552], length 1314
05:01:16.417072 IP 52.223.243.219.1935 > 10.8.2.3.41318: Flags [.], ack 101152, win 282, options [nop,nop,TS val 761606577 ecr 77004460], length 0
05:01:16.417106 IP 10.8.2.3.41318 > 52.223.243.219.1935: Flags [.], seq 109036:110350, ack 0, win 501, options [nop,nop,TS val 77004889 ecr 761606577], length 1314
05:01:16.417108 IP 10.8.2.3.41318 > 52.223.243.219.1935: Flags [P.], seq 110350:111664, ack 0, win 501, options [nop,nop,TS val 77004889 ecr 761606577], length 1314
05:01:16.436676 IP 10.8.2.3.41318 > 52.223.243.219.1935: Flags [.], seq 111664:112978, ack 0, win 501, options [nop,nop,TS val 77004908 ecr 761606577], length 1314
05:01:16.548314 IP 52.223.243.219.1935 > 10.8.2.3.41318: Flags [.], ack 103780, win 282, options [nop,nop,TS val 761606705 ecr 77004589], length 0
05:01:16.548358 IP 10.8.2.3.41318 > 52.223.243.219.1935: Flags [.], seq 112978:114292, ack 0, win 501, options [nop,nop,TS val 77005020 ecr 761606705], length 1314
05:01:16.548361 IP 10.8.2.3.41318 > 52.223.243.219.1935: Flags [P.], seq 114292:115606, ack 0, win 501, options [nop,nop,TS val 77005020 ecr 761606705], length 1314
05:01:16.822333 IP 52.223.243.219.1935 > 10.8.2.3.41318: Flags [.], ack 106408, win 282, options [nop,nop,TS val 761606978 ecr 77004858], length 0
05:01:16.822388 IP 10.8.2.3.41318 > 52.223.243.219.1935: Flags [.], seq 115606:116920, ack 0, win 501, options [nop,nop,TS val 77005294 ecr 761606978], length 1314
05:01:16.822391 IP 10.8.2.3.41318 > 52.223.243.219.1935: Flags [P.], seq 116920:118234, ack 0, win 501, options [nop,nop,TS val 77005294 ecr 761606978], length 1314
05:01:16.827308 IP 52.223.243.219.1935 > 10.8.2.3.41318: Flags [.], ack 109036, win 282, options [nop,nop,TS val 761606983 ecr 77004864], length 0
05:01:16.827344 IP 10.8.2.3.41318 > 52.223.243.219.1935: Flags [.], seq 118234:119548, ack 0, win 501, options [nop,nop,TS val 77005299 ecr 761606983], length 1314
05:01:16.827346 IP 10.8.2.3.41318 > 52.223.243.219.1935: Flags [P.], seq 119548:120862, ack 0, win 501, options [nop,nop,TS val 77005299 ecr 761606983], length 1314
05:01:16.854237 IP 52.223.243.219.1935 > 10.8.2.3.41318: Flags [.], ack 111664, win 282, options [nop,nop,TS val 761607010 ecr 77004889], length 0
05:01:16.854272 IP 10.8.2.3.41318 > 52.223.243.219.1935: Flags [.], seq 120862:122176, ack 0, win 501, options [nop,nop,TS val 77005326 ecr 761607010], length 1314
05:01:16.854274 IP 10.8.2.3.41318 > 52.223.243.219.1935: Flags [P.], seq 122176:123490, ack 0, win 501, options [nop,nop,TS val 77005326 ecr 761607010], length 1314
05:01:16.917772 IP 52.223.243.219.1935 > 10.8.2.3.41318: Flags [.], ack 112978, win 282, options [nop,nop,TS val 761607073 ecr 77004908], length 0
05:01:16.917812 IP 10.8.2.3.41318 > 52.223.243.219.1935: Flags [.], seq 123490:124804, ack 0, win 501, options [nop,nop,TS val 77005390 ecr 761607073], length 1314
05:01:16.985716 IP 52.223.243.219.1935 > 10.8.2.3.41318: Flags [.], ack 115606, win 282, options [nop,nop,TS val 761607141 ecr 77005020], length 0
05:01:16.985759 IP 10.8.2.3.41318 > 52.223.243.219.1935: Flags [.], seq 124804:126118, ack 0, win 501, options [nop,nop,TS val 77005458 ecr 761607141], length 1314
05:01:16.985761 IP 10.8.2.3.41318 > 52.223.243.219.1935: Flags [P.], seq 126118:127432, ack 0, win 501, options [nop,nop,TS val 77005458 ecr 761607141], length 1314
05:01:17.258504 IP 52.223.243.219.1935 > 10.8.2.3.41318: Flags [.], ack 118234, win 282, options [nop,nop,TS val 761607414 ecr 77005294], length 0
05:01:17.258538 IP 10.8.2.3.41318 > 52.223.243.219.1935: Flags [.], seq 127432:128746, ack 0, win 501, options [nop,nop,TS val 77005730 ecr 761607414], length 1314
05:01:17.258540 IP 10.8.2.3.41318 > 52.223.243.219.1935: Flags [P.], seq 128746:130060, ack 0, win 501, options [nop,nop,TS val 77005730 ecr 761607414], length 1314
05:01:17.263503 IP 52.223.243.219.1935 > 10.8.2.3.41318: Flags [.], ack 120862, win 282, options [nop,nop,TS val 761607419 ecr 77005299], length 0
05:01:17.263529 IP 10.8.2.3.41318 > 52.223.243.219.1935: Flags [.], seq 130060:131374, ack 0, win 501, options [nop,nop,TS val 77005735 ecr 761607419], length 1314
05:01:17.263531 IP 10.8.2.3.41318 > 52.223.243.219.1935: Flags [P.], seq 131374:132688, ack 0, win 501, options [nop,nop,TS val 77005735 ecr 761607419], length 1314
05:01:17.270725 IP 10.8.2.3.41318 > 52.223.243.219.1935: Flags [.], seq 132688:134002, ack 0, win 501, options [nop,nop,TS val 77005743 ecr 761607419], length 1314
05:01:17.288937 IP 52.223.243.219.1935 > 10.8.2.3.41318: Flags [.], ack 123490, win 282, options [nop,nop,TS val 761607446 ecr 77005326], length 0
05:01:17.288972 IP 10.8.2.3.41318 > 52.223.243.219.1935: Flags [.], seq 134002:135316, ack 0, win 501, options [nop,nop,TS val 77005761 ecr 761607446], length 1314
05:01:17.288974 IP 10.8.2.3.41318 > 52.223.243.219.1935: Flags [P.], seq 135316:136630, ack 0, win 501, options [nop,nop,TS val 77005761 ecr 761607446], length 1314
05:01:17.402211 IP 52.223.243.219.1935 > 10.8.2.3.41318: Flags [.], ack 124804, win 282, options [nop,nop,TS val 761607557 ecr 77005390], length 0
05:01:17.402255 IP 10.8.2.3.41318 > 52.223.243.219.1935: Flags [.], seq 136630:137944, ack 0, win 501, options [nop,nop,TS val 77005874 ecr 761607557], length 1314
05:01:17.423114 IP 52.223.243.219.1935 > 10.8.2.3.41318: Flags [.], ack 127432, win 282, options [nop,nop,TS val 761607578 ecr 77005458], length 0
05:01:17.423152 IP 10.8.2.3.41318 > 52.223.243.219.1935: Flags [.], seq 137944:139258, ack 0, win 501, options [nop,nop,TS val 77005895 ecr 761607578], length 1314
05:01:17.423154 IP 10.8.2.3.41318 > 52.223.243.219.1935: Flags [P.], seq 139258:140572, ack 0, win 501, options [nop,nop,TS val 77005895 ecr 761607578], length 1314
05:01:17.716878 IP 52.223.243.219.1935 > 10.8.2.3.41318: Flags [.], ack 130060, win 282, options [nop,nop,TS val 761607862 ecr 77005730], length 0
05:01:17.716913 IP 10.8.2.3.41318 > 52.223.243.219.1935: Flags [.], seq 140572:141886, ack 0, win 501, options [nop,nop,TS val 77006189 ecr 761607862], length 1314
05:01:17.716916 IP 10.8.2.3.41318 > 52.223.243.219.1935: Flags [P.], seq 141886:143200, ack 0, win 501, options [nop,nop,TS val 77006189 ecr 761607862], length 1314
05:01:17.719367 IP 10.8.2.3.41318 > 52.223.243.219.1935: Flags [.], seq 143200:144514, ack 0, win 501, options [nop,nop,TS val 77006191 ecr 761607862], length 1314
05:01:17.722424 IP 52.223.243.219.1935 > 10.8.2.3.41318: Flags [.], ack 132688, win 282, options [nop,nop,TS val 761607867 ecr 77005735], length 0
05:01:17.722454 IP 10.8.2.3.41318 > 52.223.243.219.1935: Flags [.], seq 144514:145828, ack 0, win 501, options [nop,nop,TS val 77006194 ecr 761607867], length 1314
05:01:17.722456 IP 10.8.2.3.41318 > 52.223.243.219.1935: Flags [P.], seq 145828:147142, ack 0, win 501, options [nop,nop,TS val 77006194 ecr 761607867], length 1314
05:01:17.922967 IP 10.8.2.3.41318 > 52.223.243.219.1935: Flags [.], seq 147142:148456, ack 0, win 501, options [nop,nop,TS val 77006395 ecr 761607867], length 1314
05:01:18.168210 IP 52.223.243.219.1935 > 10.8.2.3.41318: Flags [.], ack 132688, win 282, options [nop,nop,TS val 761608308 ecr 77005735,nop,nop,sack 1 {140572:141886}], length 0
05:01:18.168254 IP 10.8.2.3.41318 > 52.223.243.219.1935: Flags [.], seq 132688:134002, ack 0, win 501, options [nop,nop,TS val 77006640 ecr 761608308], length 1314
05:01:18.168286 IP 52.223.243.219.1935 > 10.8.2.3.41318: Flags [.], ack 132688, win 282, options [nop,nop,TS val 761608308 ecr 77005735,nop,nop,sack 1 {140572:143200}], length 0
05:01:18.168301 IP 10.8.2.3.41318 > 52.223.243.219.1935: Flags [.], seq 134002:135316, ack 0, win 501, options [nop,nop,TS val 77006640 ecr 761608308], length 1314
05:01:18.173337 IP 52.223.243.219.1935 > 10.8.2.3.41318: Flags [.], ack 132688, win 282, options [nop,nop,TS val 761608313 ecr 77005735,nop,nop,sack 2 {144514:145828}{140572:143200}], length 0
05:01:18.173369 IP 10.8.2.3.41318 > 52.223.243.219.1935: Flags [.], seq 135316:136630, ack 0, win 501, options [nop,nop,TS val 77006645 ecr 761608313], length 1314
05:01:18.360856 IP 52.223.243.219.1935 > 10.8.2.3.41318: Flags [.], ack 132688, win 282, options [nop,nop,TS val 761608520 ecr 77005735,nop,nop,sack 2 {144514:148456}{140572:143200}], length 0
05:01:18.360878 IP 10.8.2.3.41318 > 52.223.243.219.1935: Flags [.], seq 136630:137944, ack 0, win 501, options [nop,nop,TS val 77006833 ecr 761608520], length 1314
05:01:18.360883 IP 10.8.2.3.41318 > 52.223.243.219.1935: Flags [.], seq 137944:139258, ack 0, win 501, options [nop,nop,TS val 77006833 ecr 761608520], length 1314
05:01:18.610698 IP 52.223.243.219.1935 > 10.8.2.3.41318: Flags [.], ack 134002, win 280, options [nop,nop,TS val 761608768 ecr 77006640,nop,nop,sack 2 {144514:148456}{140572:143200}], length 0
05:01:18.610737 IP 10.8.2.3.41318 > 52.223.243.219.1935: Flags [.], seq 139258:140572, ack 0, win 501, options [nop,nop,TS val 77007083 ecr 761608768], length 1314
05:01:18.610746 IP 10.8.2.3.41318 > 52.223.243.219.1935: Flags [.], seq 143200:144514, ack 0, win 501, options [nop,nop,TS val 77007083 ecr 761608768], length 1314
05:01:18.610775 IP 52.223.243.219.1935 > 10.8.2.3.41318: Flags [.], ack 135316, win 278, options [nop,nop,TS val 761608768 ecr 77006640,nop,nop,sack 2 {144514:148456}{140572:143200}], length 0
05:01:18.610797 IP 10.8.2.3.41318 > 52.223.243.219.1935: Flags [.], seq 148456:149770, ack 0, win 501, options [nop,nop,TS val 77007083 ecr 761608768], length 1314
05:01:18.610798 IP 10.8.2.3.41318 > 52.223.243.219.1935: Flags [P.], seq 149770:151084, ack 0, win 501, options [nop,nop,TS val 77007083 ecr 761608768], length 1314
05:01:18.788243 IP 52.223.243.219.1935 > 10.8.2.3.41318: Flags [.], ack 135316, win 278, options [nop,nop,TS val 761608949 ecr 77006640,nop,nop,sack 3 {136630:137944}{144514:148456}{140572:143200}], length 0
05:01:18.788285 IP 10.8.2.3.41318 > 52.223.243.219.1935: Flags [.], seq 135316:136630, ack 0, win 501, options [nop,nop,TS val 77007260 ecr 761608949], length 1314
05:01:18.788318 IP 52.223.243.219.1935 > 10.8.2.3.41318: Flags [.], ack 135316, win 278, options [nop,nop,TS val 761608949 ecr 77006640,nop,nop,sack 3 {136630:139258}{144514:148456}{140572:143200}], length 0
05:01:18.788336 IP 10.8.2.3.41318 > 52.223.243.219.1935: Flags [.], seq 151084:152398, ack 0, win 501, options [nop,nop,TS val 77007260 ecr 761608949], length 1314
05:01:19.051402 IP 52.223.243.219.1935 > 10.8.2.3.41318: Flags [.], ack 135316, win 278, options [nop,nop,TS val 761609204 ecr 77006640,nop,nop,sack 1 {136630:148456}], length 0
05:01:19.051473 IP 10.8.2.3.41318 > 52.223.243.219.1935: Flags [.], seq 152398:153712, ack 0, win 501, options [nop,nop,TS val 77007523 ecr 761609204], length 1314
05:01:19.051477 IP 10.8.2.3.41318 > 52.223.243.219.1935: Flags [P.], seq 153712:155026, ack 0, win 501, options [nop,nop,TS val 77007523 ecr 761609204], length 1314
05:01:19.051514 IP 52.223.243.219.1935 > 10.8.2.3.41318: Flags [.], ack 135316, win 278, options [nop,nop,TS val 761609205 ecr 77006640,nop,nop,sack 1 {136630:151084}], length 0
05:01:19.051541 IP 10.8.2.3.41318 > 52.223.243.219.1935: Flags [.], seq 155026:156340, ack 0, win 501, options [nop,nop,TS val 77007523 ecr 761609205], length 1314
05:01:19.051543 IP 10.8.2.3.41318 > 52.223.243.219.1935: Flags [P.], seq 156340:157654, ack 0, win 501, options [nop,nop,TS val 77007523 ecr 761609205], length 1314
05:01:19.222501 IP 52.223.243.219.1935 > 10.8.2.3.41318: Flags [.], ack 151084, win 257, options [nop,nop,TS val 761609382 ecr 77007260], length 0
05:01:19.222552 IP 10.8.2.3.41318 > 52.223.243.219.1935: Flags [.], seq 157654:158968, ack 0, win 501, options [nop,nop,TS val 77007694 ecr 761609382], length 1314
05:01:19.222555 IP 10.8.2.3.41318 > 52.223.243.219.1935: Flags [P.], seq 158968:160282, ack 0, win 501, options [nop,nop,TS val 77007694 ecr 761609382], length 1314
05:01:19.269399 IP 52.223.243.219.1935 > 10.8.2.3.41318: Flags [.], ack 152398, win 282, options [nop,nop,TS val 761609429 ecr 77007260], length 0
05:01:19.269483 IP 10.8.2.3.41318 > 52.223.243.219.1935: Flags [.], seq 160282:161596, ack 0, win 501, options [nop,nop,TS val 77007741 ecr 761609429], length 1314
05:01:19.269488 IP 10.8.2.3.41318 > 52.223.243.219.1935: Flags [P.], seq 161596:162910, ack 0, win 501, options [nop,nop,TS val 77007741 ecr 761609429], length 1314
05:01:19.478879 IP 52.223.243.219.1935 > 10.8.2.3.41318: Flags [.], ack 155026, win 282, options [nop,nop,TS val 761609639 ecr 77007523], length 0
05:01:19.478903 IP 10.8.2.3.41318 > 52.223.243.219.1935: Flags [.], seq 162910:164224, ack 0, win 501, options [nop,nop,TS val 77007951 ecr 761609639], length 1314
05:01:19.478904 IP 10.8.2.3.41318 > 52.223.243.219.1935: Flags [P.], seq 164224:165538, ack 0, win 501, options [nop,nop,TS val 77007951 ecr 761609639], length 1314
05:01:19.479219 IP 52.223.243.219.1935 > 10.8.2.3.41318: Flags [.], ack 157654, win 282, options [nop,nop,TS val 761609640 ecr 77007523], length 0
05:01:19.479229 IP 10.8.2.3.41318 > 52.223.243.219.1935: Flags [.], seq 165538:166852, ack 0, win 501, options [nop,nop,TS val 77007951 ecr 761609640], length 1314
05:01:19.479230 IP 10.8.2.3.41318 > 52.223.243.219.1935: Flags [P.], seq 166852:168166, ack 0, win 501, options [nop,nop,TS val 77007951 ecr 761609640], length 1314
05:01:19.493620 IP 10.8.2.3.41318 > 52.223.243.219.1935: Flags [.], seq 168166:169480, ack 0, win 501, options [nop,nop,TS val 77007965 ecr 761609640], length 1314
05:01:19.654828 IP 52.223.243.219.1935 > 10.8.2.3.41318: Flags [.], ack 160282, win 282, options [nop,nop,TS val 761609814 ecr 77007694], length 0
05:01:19.654866 IP 10.8.2.3.41318 > 52.223.243.219.1935: Flags [.], seq 169480:170794, ack 0, win 501, options [nop,nop,TS val 77008127 ecr 761609814], length 1314
05:01:19.654868 IP 10.8.2.3.41318 > 52.223.243.219.1935: Flags [P.], seq 170794:172108, ack 0, win 501, options [nop,nop,TS val 77008127 ecr 761609814], length 1314
05:01:19.701084 IP 52.223.243.219.1935 > 10.8.2.3.41318: Flags [.], ack 162910, win 282, options [nop,nop,TS val 761609858 ecr 77007741], length 0
05:01:19.701126 IP 10.8.2.3.41318 > 52.223.243.219.1935: Flags [.], seq 172108:173422, ack 0, win 501, options [nop,nop,TS val 77008173 ecr 761609858], length 1314
05:01:19.701128 IP 10.8.2.3.41318 > 52.223.243.219.1935: Flags [P.], seq 173422:174736, ack 0, win 501, options [nop,nop,TS val 77008173 ecr 761609858], length 1314
05:01:19.701136 IP 10.8.2.3.41318 > 52.223.243.219.1935: Flags [.], seq 174736:176050, ack 0, win 501, options [nop,nop,TS val 77008173 ecr 761609858], length 1314
05:01:19.920827 IP 52.223.243.219.1935 > 10.8.2.3.41318: Flags [.], ack 165538, win 282, options [nop,nop,TS val 761610080 ecr 77007951], length 0
05:01:19.920848 IP 10.8.2.3.41318 > 52.223.243.219.1935: Flags [.], seq 176050:177364, ack 0, win 501, options [nop,nop,TS val 77008393 ecr 761610080], length 1314
05:01:19.920850 IP 10.8.2.3.41318 > 52.223.243.219.1935: Flags [P.], seq 177364:178678, ack 0, win 501, options [nop,nop,TS val 77008393 ecr 761610080], length 1314
05:01:19.921572 IP 52.223.243.219.1935 > 10.8.2.3.41318: Flags [.], ack 168166, win 282, options [nop,nop,TS val 761610081 ecr 77007951], length 0
05:01:19.921586 IP 10.8.2.3.41318 > 52.223.243.219.1935: Flags [.], seq 178678:179992, ack 0, win 501, options [nop,nop,TS val 77008393 ecr 761610081], length 1314
05:01:19.921587 IP 10.8.2.3.41318 > 52.223.243.219.1935: Flags [P.], seq 179992:181306, ack 0, win 501, options [nop,nop,TS val 77008393 ecr 761610081], length 1314
05:01:19.984307 IP 52.223.243.219.1935 > 10.8.2.3.41318: Flags [.], ack 169480, win 282, options [nop,nop,TS val 761610137 ecr 77007965], length 0
05:01:19.984346 IP 10.8.2.3.41318 > 52.223.243.219.1935: Flags [.], seq 181306:182620, ack 0, win 501, options [nop,nop,TS val 77008456 ecr 761610137], length 1314
05:01:20.088846 IP 52.223.243.219.1935 > 10.8.2.3.41318: Flags [.], ack 172108, win 282, options [nop,nop,TS val 761610249 ecr 77008127], length 0
05:01:20.088890 IP 10.8.2.3.41318 > 52.223.243.219.1935: Flags [.], seq 182620:183934, ack 0, win 501, options [nop,nop,TS val 77008561 ecr 761610249], length 1314
05:01:20.088893 IP 10.8.2.3.41318 > 52.223.243.219.1935: Flags [P.], seq 183934:185248, ack 0, win 501, options [nop,nop,TS val 77008561 ecr 761610249], length 1314
05:01:20.132929 IP 52.223.243.219.1935 > 10.8.2.3.41318: Flags [.], ack 174736, win 282, options [nop,nop,TS val 761610292 ecr 77008173], length 0
05:01:20.132977 IP 10.8.2.3.41318 > 52.223.243.219.1935: Flags [.], seq 185248:186562, ack 0, win 501, options [nop,nop,TS val 77008605 ecr 761610292], length 1314
05:01:20.132980 IP 10.8.2.3.41318 > 52.223.243.219.1935: Flags [P.], seq 186562:187876, ack 0, win 501, options [nop,nop,TS val 77008605 ecr 761610292], length 1314
05:01:20.192265 IP 52.223.243.219.1935 > 10.8.2.3.41318: Flags [.], ack 176050, win 282, options [nop,nop,TS val 761610345 ecr 77008173], length 0
05:01:20.192287 IP 10.8.2.3.41318 > 52.223.243.219.1935: Flags [.], seq 187876:189190, ack 0, win 501, options [nop,nop,TS val 77008664 ecr 761610345], length 1314
05:01:20.192288 IP 10.8.2.3.41318 > 52.223.243.219.1935: Flags [P.], seq 189190:190504, ack 0, win 501, options [nop,nop,TS val 77008664 ecr 761610345], length 1314
05:01:20.348299 IP 52.223.243.219.1935 > 10.8.2.3.41318: Flags [.], ack 178678, win 282, options [nop,nop,TS val 761610508 ecr 77008393], length 0
05:01:20.348321 IP 10.8.2.3.41318 > 52.223.243.219.1935: Flags [.], seq 190504:191818, ack 0, win 501, options [nop,nop,TS val 77008820 ecr 761610508], length 1314
05:01:20.348322 IP 10.8.2.3.41318 > 52.223.243.219.1935: Flags [P.], seq 191818:193132, ack 0, win 501, options [nop,nop,TS val 77008820 ecr 761610508], length 1314
05:01:20.348334 IP 52.223.243.219.1935 > 10.8.2.3.41318: Flags [.], ack 181306, win 282, options [nop,nop,TS val 761610509 ecr 77008393], length 0
05:01:20.348341 IP 10.8.2.3.41318 > 52.223.243.219.1935: Flags [.], seq 193132:194446, ack 0, win 501, options [nop,nop,TS val 77008820 ecr 761610509], length 1314
05:01:20.348342 IP 10.8.2.3.41318 > 52.223.243.219.1935: Flags [P.], seq 194446:195760, ack 0, win 501, options [nop,nop,TS val 77008820 ecr 761610509], length 1314
05:01:20.456940 IP 52.223.243.219.1935 > 10.8.2.3.41318: Flags [.], ack 182620, win 282, options [nop,nop,TS val 761610617 ecr 77008456], length 0
05:01:20.456978 IP 10.8.2.3.41318 > 52.223.243.219.1935: Flags [.], seq 195760:197074, ack 0, win 501, options [nop,nop,TS val 77008929 ecr 761610617], length 1314
05:01:20.518550 IP 52.223.243.219.1935 > 10.8.2.3.41318: Flags [.], ack 185248, win 282, options [nop,nop,TS val 761610677 ecr 77008561], length 0
05:01:20.518593 IP 10.8.2.3.41318 > 52.223.243.219.1935: Flags [.], seq 197074:198388, ack 0, win 501, options [nop,nop,TS val 77008990 ecr 761610677], length 1314
05:01:20.518596 IP 10.8.2.3.41318 > 52.223.243.219.1935: Flags [P.], seq 198388:199702, ack 0, win 501, options [nop,nop,TS val 77008990 ecr 761610677], length 1314
05:01:20.560746 IP 52.223.243.219.1935 > 10.8.2.3.41318: Flags [.], ack 187876, win 282, options [nop,nop,TS val 761610720 ecr 77008605], length 0
05:01:20.560792 IP 10.8.2.3.41318 > 52.223.243.219.1935: Flags [.], seq 199702:201016, ack 0, win 501, options [nop,nop,TS val 77009033 ecr 761610720], length 1314
05:01:20.560795 IP 10.8.2.3.41318 > 52.223.243.219.1935: Flags [P.], seq 201016:202330, ack 0, win 501, options [nop,nop,TS val 77009033 ecr 761610720], length 1314
05:01:20.620295 IP 52.223.243.219.1935 > 10.8.2.3.41318: Flags [.], ack 190504, win 282, options [nop,nop,TS val 761610779 ecr 77008664], length 0
05:01:20.620313 IP 10.8.2.3.41318 > 52.223.243.219.1935: Flags [.], seq 202330:203644, ack 0, win 501, options [nop,nop,TS val 77009092 ecr 761610779], length 1314
05:01:20.620314 IP 10.8.2.3.41318 > 52.223.243.219.1935: Flags [P.], seq 203644:204958, ack 0, win 501, options [nop,nop,TS val 77009092 ecr 761610779], length 1314
05:01:20.779763 IP 52.223.243.219.1935 > 10.8.2.3.41318: Flags [.], ack 193132, win 282, options [nop,nop,TS val 761610936 ecr 77008820], length 0
05:01:20.779806 IP 10.8.2.3.41318 > 52.223.243.219.1935: Flags [.], seq 204958:206272, ack 0, win 501, options [nop,nop,TS val 77009252 ecr 761610936], length 1314
05:01:20.779809 IP 10.8.2.3.41318 > 52.223.243.219.1935: Flags [P.], seq 206272:207586, ack 0, win 501, options [nop,nop,TS val 77009252 ecr 761610936], length 1314
05:01:20.819438 IP 52.223.243.219.1935 > 10.8.2.3.41318: Flags [.], ack 194446, win 282, options [nop,nop,TS val 761610977 ecr 77008820], length 0
05:01:20.819484 IP 10.8.2.3.41318 > 52.223.243.219.1935: Flags [.], seq 207586:208900, ack 0, win 501, options [nop,nop,TS val 77009291 ecr 761610977], length 1314
05:01:20.887745 IP 52.223.243.219.1935 > 10.8.2.3.41318: Flags [.], ack 194446, win 282, options [nop,nop,TS val 761611046 ecr 77008820,nop,nop,sack 1 {195760:197074}], length 0
