07:03:13.029141 IP 10.8.1.11.56466 > 99.181.100.114.1935: Flags [.], seq 1283031112:1283032426, ack 1914070356, win 501, options [nop,nop,TS val 312585078 ecr 3745112800], length 1314
07:03:13.063136 IP 10.8.1.11.56466 > 99.181.100.114.1935: Flags [.], seq 1314:2628, ack 1, win 501, options [nop,nop,TS val 312585112 ecr 3745112800], length 1314
07:03:13.083051 IP 99.181.100.114.1935 > 10.8.1.11.56466: Flags [.], ack 4294956922, win 126, options [nop,nop,TS val 3745112897 ecr 312584642], length 0
07:03:13.098504 IP 10.8.1.11.56466 > 99.181.100.114.1935: Flags [.], seq 2628:3942, ack 1, win 501, options [nop,nop,TS val 312585148 ecr 3745112897], length 1314
07:03:13.158608 IP 10.8.1.11.56466 > 99.181.100.114.1935: Flags [.], seq 3942:5256, ack 1, win 501, options [nop,nop,TS val 312585208 ecr 3745112897], length 1314
07:03:13.177069 IP 99.181.100.114.1935 > 10.8.1.11.56466: Flags [.], ack 4294958236, win 126, options [nop,nop,TS val 3745112991 ecr 312584710], length 0
07:03:13.192336 IP 10.8.1.11.56466 > 99.181.100.114.1935: Flags [.], seq 5256:6570, ack 1, win 501, options [nop,nop,TS val 312585242 ecr 3745112991], length 1314
07:03:13.215686 IP 99.181.100.114.1935 > 10.8.1.11.56466: Flags [.], ack 4294960864, win 126, options [nop,nop,TS val 3745113030 ecr 312584776], length 0
07:03:13.225632 IP 10.8.1.11.56466 > 99.181.100.114.1935: Flags [.], seq 6570:7884, ack 1, win 501, options [nop,nop,TS val 312585275 ecr 3745113030], length 1314
07:03:13.294663 IP 10.8.1.11.56466 > 99.181.100.114.1935: Flags [.], seq 7884:9198, ack 1, win 501, options [nop,nop,TS val 312585344 ecr 3745113030], length 1314
07:03:13.314496 IP 99.181.100.114.1935 > 10.8.1.11.56466: Flags [.], ack 4294963492, win 126, options [nop,nop,TS val 3745113129 ecr 312584843], length 0
07:03:13.328199 IP 10.8.1.11.56466 > 99.181.100.114.1935: Flags [.], seq 9198:10512, ack 1, win 501, options [nop,nop,TS val 312585378 ecr 3745113129], length 1314
07:03:13.358268 IP 10.8.1.11.56466 > 99.181.100.114.1935: Flags [.], seq 10512:11826, ack 1, win 501, options [nop,nop,TS val 312585408 ecr 3745113129], length 1314
07:03:13.383262 IP 99.181.100.114.1935 > 10.8.1.11.56466: Flags [.], ack 4294966120, win 126, options [nop,nop,TS val 3745113197 ecr 312584943], length 0
07:03:13.428819 IP 10.8.1.11.56466 > 99.181.100.114.1935: Flags [.], seq 11826:13140, ack 1, win 501, options [nop,nop,TS val 312585478 ecr 3745113197], length 1314
07:03:13.443362 IP 99.181.100.114.1935 > 10.8.1.11.56466: Flags [.], ack 0, win 126, options [nop,nop,TS val 3745113257 ecr 312585035], length 0
07:03:13.443399 IP 10.8.1.11.56466 > 99.181.100.114.1935: Flags [P.], seq 13140:13960, ack 1, win 501, options [nop,nop,TS val 312585493 ecr 3745113257], length 820
07:03:13.494510 IP 10.8.1.11.56466 > 99.181.100.114.1935: Flags [.], seq 13960:15274, ack 1, win 501, options [nop,nop,TS val 312585544 ecr 3745113257], length 1314
07:03:13.519254 IP 99.181.100.114.1935 > 10.8.1.11.56466: Flags [.], ack 2628, win 126, options [nop,nop,TS val 3745113334 ecr 312585078], length 0
07:03:13.526286 IP 10.8.1.11.56466 > 99.181.100.114.1935: Flags [.], seq 15274:16588, ack 1, win 501, options [nop,nop,TS val 312585576 ecr 3745113334], length 1314
07:03:13.566603 IP 10.8.1.11.56466 > 99.181.100.114.1935: Flags [.], seq 16588:17902, ack 1, win 501, options [nop,nop,TS val 312585616 ecr 3745113334], length 1314
07:03:13.614630 IP 99.181.100.114.1935 > 10.8.1.11.56466: Flags [.], ack 5256, win 126, options [nop,nop,TS val 3745113429 ecr 312585148], length 0
07:03:13.625122 IP 10.8.1.11.56466 > 99.181.100.114.1935: Flags [.], seq 17902:19216, ack 1, win 501, options [nop,nop,TS val 312585674 ecr 3745113429], length 1314
07:03:13.658066 IP 10.8.1.11.56466 > 99.181.100.114.1935: Flags [.], seq 19216:20530, ack 1, win 501, options [nop,nop,TS val 312585707 ecr 3745113429], length 1314
07:03:13.681264 IP 99.181.100.114.1935 > 10.8.1.11.56466: Flags [.], ack 7884, win 126, options [nop,nop,TS val 3745113496 ecr 312585242], length 0
07:03:13.693768 IP 10.8.1.11.56466 > 99.181.100.114.1935: Flags [.], seq 20530:21844, ack 1, win 501, options [nop,nop,TS val 312585743 ecr 3745113496], length 1314
07:03:13.763736 IP 10.8.1.11.56466 > 99.181.100.114.1935: Flags [.], seq 21844:23158, ack 1, win 501, options [nop,nop,TS val 312585813 ecr 3745113496], length 1314
07:03:13.784100 IP 99.181.100.114.1935 > 10.8.1.11.56466: Flags [.], ack 10512, win 126, options [nop,nop,TS val 3745113598 ecr 312585344], length 0
07:03:13.793419 IP 10.8.1.11.56466 > 99.181.100.114.1935: Flags [.], seq 23158:24472, ack 1, win 501, options [nop,nop,TS val 312585843 ecr 3745113598], length 1314
07:03:13.825651 IP 10.8.1.11.56466 > 99.181.100.114.1935: Flags [.], seq 24472:25786, ack 1, win 501, options [nop,nop,TS val 312585875 ecr 3745113598], length 1314
07:03:13.884815 IP 99.181.100.114.1935 > 10.8.1.11.56466: Flags [.], ack 13140, win 126, options [nop,nop,TS val 3745113699 ecr 312585408], length 0
07:03:13.891819 IP 10.8.1.11.56466 > 99.181.100.114.1935: Flags [.], seq 25786:27100, ack 1, win 501, options [nop,nop,TS val 312585941 ecr 3745113699], length 1314
07:03:13.899077 IP 99.181.100.114.1935 > 10.8.1.11.56466: Flags [.], ack 13960, win 126, options [nop,nop,TS val 3745113713 ecr 312585493], length 0
07:03:13.899090 IP 10.8.1.11.56466 > 99.181.100.114.1935: Flags [P.], seq 27100:27805, ack 1, win 501, options [nop,nop,TS val 312585948 ecr 3745113713], length 705
07:03:13.962785 IP 10.8.1.11.56466 > 99.181.100.114.1935: Flags [.], seq 27805:29119, ack 1, win 501, options [nop,nop,TS val 312586012 ecr 3745113713], length 1314
07:03:13.982539 IP 99.181.100.114.1935 > 10.8.1.11.56466: Flags [.], ack 16588, win 126, options [nop,nop,TS val 3745113797 ecr 312585544], length 0
07:03:13.996366 IP 10.8.1.11.56466 > 99.181.100.114.1935: Flags [.], seq 29119:30433, ack 1, win 501, options [nop,nop,TS val 312586046 ecr 3745113797], length 1314
07:03:14.029253 IP 10.8.1.11.56466 > 99.181.100.114.1935: Flags [.], seq 30433:31747, ack 1, win 501, options [nop,nop,TS val 312586079 ecr 3745113797], length 1314
07:03:14.080848 IP 99.181.100.114.1935 > 10.8.1.11.56466: Flags [.], ack 19216, win 126, options [nop,nop,TS val 3745113895 ecr 312585616], length 0
07:03:14.092186 IP 10.8.1.11.56466 > 99.181.100.114.1935: Flags [.], seq 31747:33061, ack 1, win 501, options [nop,nop,TS val 312586141 ecr 3745113895], length 1314
07:03:14.126604 IP 10.8.1.11.56466 > 99.181.100.114.1935: Flags [.], seq 33061:34375, ack 1, win 501, options [nop,nop,TS val 312586176 ecr 3745113895], length 1314
07:03:14.149662 IP 99.181.100.114.1935 > 10.8.1.11.56466: Flags [.], ack 21844, win 126, options [nop,nop,TS val 3745113964 ecr 312585707], length 0
07:03:14.158675 IP 10.8.1.11.56466 > 99.181.100.114.1935: Flags [.], seq 34375:35689, ack 1, win 501, options [nop,nop,TS val 312586208 ecr 3745113964], length 1314
07:03:14.227521 IP 10.8.1.11.56466 > 99.181.100.114.1935: Flags [.], seq 35689:37003, ack 1, win 501, options [nop,nop,TS val 312586277 ecr 3745113964], length 1314
07:03:14.249110 IP 99.181.100.114.1935 > 10.8.1.11.56466: Flags [.], ack 24472, win 126, options [nop,nop,TS val 3745114063 ecr 312585813], length 0
07:03:14.265300 IP 10.8.1.11.56466 > 99.181.100.114.1935: Flags [.], seq 37003:38317, ack 1, win 501, options [nop,nop,TS val 312586315 ecr 3745114063], length 1314
07:03:14.295792 IP 10.8.1.11.56466 > 99.181.100.114.1935: Flags [.], seq 38317:39631, ack 1, win 501, options [nop,nop,TS val 312586345 ecr 3745114063], length 1314
07:03:14.347839 IP 99.181.100.114.1935 > 10.8.1.11.56466: Flags [.], ack 27100, win 126, options [nop,nop,TS val 3745114162 ecr 312585875], length 0
07:03:14.354870 IP 99.181.100.114.1935 > 10.8.1.11.56466: Flags [.], ack 27805, win 126, options [nop,nop,TS val 3745114169 ecr 312585948], length 0
07:03:14.354904 IP 10.8.1.11.56466 > 99.181.100.114.1935: Flags [P.], seq 39631:40818, ack 1, win 501, options [nop,nop,TS val 312586404 ecr 3745114169], length 1187
07:03:14.395040 IP 10.8.1.11.56466 > 99.181.100.114.1935: Flags [.], seq 40818:42132, ack 1, win 501, options [nop,nop,TS val 312586444 ecr 3745114169], length 1314
07:03:14.430144 IP 10.8.1.11.56466 > 99.181.100.114.1935: Flags [.], seq 42132:43446, ack 1, win 501, options [nop,nop,TS val 312586479 ecr 3745114169], length 1314
07:03:14.452650 IP 99.181.100.114.1935 > 10.8.1.11.56466: Flags [.], ack 30433, win 126, options [nop,nop,TS val 3745114267 ecr 312586012], length 0
07:03:14.463311 IP 10.8.1.11.56466 > 99.181.100.114.1935: Flags [.], seq 43446:44760, ack 1, win 501, options [nop,nop,TS val 312586513 ecr 3745114267], length 1314
07:03:14.529634 IP 10.8.1.11.56466 > 99.181.100.114.1935: Flags [.], seq 44760:46074, ack 1, win 501, options [nop,nop,TS val 312586579 ecr 3745114267], length 1314
07:03:14.547702 IP 99.181.100.114.1935 > 10.8.1.11.56466: Flags [.], ack 33061, win 126, options [nop,nop,TS val 3745114362 ecr 312586079], length 0
07:03:14.558721 IP 10.8.1.11.56466 > 99.181.100.114.1935: Flags [.], seq 46074:47388, ack 1, win 501, options [nop,nop,TS val 312586608 ecr 3745114362], length 1314
07:03:14.592244 IP 10.8.1.11.56466 > 99.181.100.114.1935: Flags [.], seq 47388:48702, ack 1, win 501, options [nop,nop,TS val 312586642 ecr 3745114362], length 1314
07:03:14.615909 IP 99.181.100.114.1935 > 10.8.1.11.56466: Flags [.], ack 35689, win 126, options [nop,nop,TS val 3745114430 ecr 312586176], length 0
07:03:14.661993 IP 10.8.1.11.56466 > 99.181.100.114.1935: Flags [.], seq 48702:50016, ack 1, win 501, options [nop,nop,TS val 312586711 ecr 3745114430], length 1314
07:03:14.696159 IP 10.8.1.11.56466 > 99.181.100.114.1935: Flags [.], seq 50016:51330, ack 1, win 501, options [nop,nop,TS val 312586745 ecr 3745114430], length 1314
07:03:14.721499 IP 99.181.100.114.1935 > 10.8.1.11.56466: Flags [.], ack 38317, win 126, options [nop,nop,TS val 3745114536 ecr 312586277], length 0
07:03:14.729603 IP 10.8.1.11.56466 > 99.181.100.114.1935: Flags [.], seq 51330:52644, ack 1, win 501, options [nop,nop,TS val 312586779 ecr 3745114536], length 1314
07:03:14.793816 IP 10.8.1.11.56466 > 99.181.100.114.1935: Flags [.], seq 52644:53958, ack 1, win 501, options [nop,nop,TS val 312586843 ecr 3745114536], length 1314
07:03:14.811440 IP 99.181.100.114.1935 > 10.8.1.11.56466: Flags [.], ack 40818, win 126, options [nop,nop,TS val 3745114626 ecr 312586345], length 0
07:03:14.811452 IP 10.8.1.11.56466 > 99.181.100.114.1935: Flags [P.], seq 53958:54766, ack 1, win 501, options [nop,nop,TS val 312586861 ecr 3745114626], length 808
07:03:14.859543 IP 10.8.1.11.56466 > 99.181.100.114.1935: Flags [.], seq 54766:56080, ack 1, win 501, options [nop,nop,TS val 312586909 ecr 3745114626], length 1314
07:03:14.885671 IP 99.181.100.114.1935 > 10.8.1.11.56466: Flags [.], ack 43446, win 126, options [nop,nop,TS val 3745114700 ecr 312586444], length 0
07:03:14.894953 IP 10.8.1.11.56466 > 99.181.100.114.1935: Flags [.], seq 56080:57394, ack 1, win 501, options [nop,nop,TS val 312586944 ecr 3745114700], length 1314
07:03:14.932102 IP 10.8.1.11.56466 > 99.181.100.114.1935: Flags [.], seq 57394:58708, ack 1, win 501, options [nop,nop,TS val 312586981 ecr 3745114700], length 1314
07:03:14.994568 IP 10.8.1.11.56466 > 99.181.100.114.1935: Flags [.], seq 58708:60022, ack 1, win 501, options [nop,nop,TS val 312587044 ecr 3745114700], length 1314
07:03:15.026236 IP 10.8.1.11.56466 > 99.181.100.114.1935: Flags [.], seq 60022:61336, ack 1, win 501, options [nop,nop,TS val 312587076 ecr 3745114700], length 1314
07:03:15.047838 IP 99.181.100.114.1935 > 10.8.1.11.56466: Flags [.], ack 48702, win 126, options [nop,nop,TS val 3745114862 ecr 312586608], length 0
07:03:15.062219 IP 10.8.1.11.56466 > 99.181.100.114.1935: Flags [.], seq 61336:62650, ack 1, win 501, options [nop,nop,TS val 312587112 ecr 3745114862], length 1314
07:03:15.127722 IP 10.8.1.11.56466 > 99.181.100.114.1935: Flags [.], seq 62650:63964, ack 1, win 501, options [nop,nop,TS val 312587177 ecr 3745114862], length 1314
07:03:15.152043 IP 99.181.100.114.1935 > 10.8.1.11.56466: Flags [.], ack 51330, win 126, options [nop,nop,TS val 3745114966 ecr 312586711], length 0
07:03:15.161324 IP 10.8.1.11.56466 > 99.181.100.114.1935: Flags [.], seq 63964:65278, ack 1, win 501, options [nop,nop,TS val 312587211 ecr 3745114966], length 1314
07:03:15.195682 IP 10.8.1.11.56466 > 99.181.100.114.1935: Flags [.], seq 65278:66592, ack 1, win 501, options [nop,nop,TS val 312587245 ecr 3745114966], length 1314
07:03:15.249448 IP 99.181.100.114.1935 > 10.8.1.11.56466: Flags [.], ack 53958, win 126, options [nop,nop,TS val 3745115064 ecr 312586779], length 0
07:03:15.259670 IP 10.8.1.11.56466 > 99.181.100.114.1935: Flags [.], seq 66592:67906, ack 1, win 501, options [nop,nop,TS val 312587309 ecr 3745115064], length 1314
07:03:15.267045 IP 99.181.100.114.1935 > 10.8.1.11.56466: Flags [.], ack 54766, win 126, options [nop,nop,TS val 3745115081 ecr 312586861], length 0
07:03:15.267064 IP 10.8.1.11.56466 > 99.181.100.114.1935: Flags [P.], seq 67906:68615, ack 1, win 501, options [nop,nop,TS val 312587316 ecr 3745115081], length 709
07:03:15.329437 IP 10.8.1.11.56466 > 99.181.100.114.1935: Flags [.], seq 68615:69929, ack 1, win 501, options [nop,nop,TS val 312587379 ecr 3745115081], length 1314
07:03:15.350910 IP 99.181.100.114.1935 > 10.8.1.11.56466: Flags [.], ack 57394, win 126, options [nop,nop,TS val 3745115165 ecr 312586909], length 0
07:03:15.362614 IP 10.8.1.11.56466 > 99.181.100.114.1935: Flags [.], seq 69929:71243, ack 1, win 501, options [nop,nop,TS val 312587412 ecr 3745115165], length 1314
07:03:15.392855 IP 10.8.1.11.56466 > 99.181.100.114.1935: Flags [.], seq 71243:72557, ack 1, win 501, options [nop,nop,TS val 312587442 ecr 3745115165], length 1314
07:03:15.450724 IP 99.181.100.114.1935 > 10.8.1.11.56466: Flags [.], ack 60022, win 126, options [nop,nop,TS val 3745115265 ecr 312586981], length 0
07:03:15.462046 IP 10.8.1.11.56466 > 99.181.100.114.1935: Flags [.], seq 72557:73871, ack 1, win 501, options [nop,nop,TS val 312587511 ecr 3745115265], length 1314
07:03:15.495872 IP 10.8.1.11.56466 > 99.181.100.114.1935: Flags [.], seq 73871:75185, ack 1, win 501, options [nop,nop,TS val 312587545 ecr 3745115265], length 1314
07:03:15.518310 IP 99.181.100.114.1935 > 10.8.1.11.56466: Flags [.], ack 62650, win 126, options [nop,nop,TS val 3745115333 ecr 312587076], length 0
07:03:15.526710 IP 10.8.1.11.56466 > 99.181.100.114.1935: Flags [.], seq 75185:76499, ack 1, win 501, options [nop,nop,TS val 312587576 ecr 3745115333], length 1314
07:03:15.595187 IP 10.8.1.11.56466 > 99.181.100.114.1935: Flags [.], seq 76499:77813, ack 1, win 501, options [nop,nop,TS val 312587644 ecr 3745115333], length 1314
07:03:15.617503 IP 99.181.100.114.1935 > 10.8.1.11.56466: Flags [.], ack 65278, win 126, options [nop,nop,TS val 3745115432 ecr 312587177], length 0
07:03:15.627804 IP 10.8.1.11.56466 > 99.181.100.114.1935: Flags [.], seq 77813:79127, ack 1, win 501, options [nop,nop,TS val 312587677 ecr 3745115432], length 1314
07:03:15.660898 IP 10.8.1.11.56466 > 99.181.100.114.1935: Flags [.], seq 79127:80441, ack 1, win 501, options [nop,nop,TS val 312587710 ecr 3745115432], length 1314
07:03:15.715823 IP 99.181.100.114.1935 > 10.8.1.11.56466: Flags [.], ack 67906, win 126, options [nop,nop,TS val 3745115530 ecr 312587245], length 0
07:03:15.722937 IP 99.181.100.114.1935 > 10.8.1.11.56466: Flags [.], ack 68615, win 126, options [nop,nop,TS val 3745115537 ecr 312587316], length 0
07:03:15.722969 IP 10.8.1.11.56466 > 99.181.100.114.1935: Flags [P.], seq 80441:81629, ack 1, win 501, options [nop,nop,TS val 312587772 ecr 3745115537], length 1188
07:03:15.762864 IP 10.8.1.11.56466 > 99.181.100.114.1935: Flags [.], seq 81629:82943, ack 1, win 501, options [nop,nop,TS val 312587812 ecr 3745115537], length 1314
07:03:15.792850 IP 10.8.1.11.56466 > 99.181.100.114.1935: Flags [.], seq 82943:84257, ack 1, win 501, options [nop,nop,TS val 312587842 ecr 3745115537], length 1314
07:03:15.818931 IP 99.181.100.114.1935 > 10.8.1.11.56466: Flags [.], ack 71243, win 126, options [nop,nop,TS val 3745115633 ecr 312587379], length 0
07:03:15.830792 IP 10.8.1.11.56466 > 99.181.100.114.1935: Flags [.], seq 84257:85571, ack 1, win 501, options [nop,nop,TS val 312587880 ecr 3745115633], length 1314
07:03:15.894776 IP 10.8.1.11.56466 > 99.181.100.114.1935: Flags [.], seq 85571:86885, ack 1, win 501, options [nop,nop,TS val 312587944 ecr 3745115633], length 1314
07:03:15.918288 IP 99.181.100.114.1935 > 10.8.1.11.56466: Flags [.], ack 73871, win 126, options [nop,nop,TS val 3745115732 ecr 312587442], length 0
07:03:15.925191 IP 10.8.1.11.56466 > 99.181.100.114.1935: Flags [.], seq 86885:88199, ack 1, win 501, options [nop,nop,TS val 312587975 ecr 3745115732], length 1314
07:03:15.959827 IP 10.8.1.11.56466 > 99.181.100.114.1935: Flags [.], seq 88199:89513, ack 1, win 501, options [nop,nop,TS val 312588009 ecr 3745115732], length 1314
07:03:15.982814 IP 99.181.100.114.1935 > 10.8.1.11.56466: Flags [.], ack 76499, win 126, options [nop,nop,TS val 3745115797 ecr 312587545], length 0
07:03:16.025082 IP 10.8.1.11.56466 > 99.181.100.114.1935: Flags [.], seq 89513:90827, ack 1, win 501, options [nop,nop,TS val 312588074 ecr 3745115797], length 1314
07:03:16.058690 IP 10.8.1.11.56466 > 99.181.100.114.1935: Flags [.], seq 90827:92141, ack 1, win 501, options [nop,nop,TS val 312588108 ecr 3745115797], length 1314
07:03:16.083687 IP 99.181.100.114.1935 > 10.8.1.11.56466: Flags [.], ack 79127, win 126, options [nop,nop,TS val 3745115898 ecr 312587644], length 0
07:03:16.093755 IP 10.8.1.11.56466 > 99.181.100.114.1935: Flags [.], seq 92141:93455, ack 1, win 501, options [nop,nop,TS val 312588143 ecr 3745115898], length 1314
07:03:16.162354 IP 10.8.1.11.56466 > 99.181.100.114.1935: Flags [.], seq 93455:94769, ack 1, win 501, options [nop,nop,TS val 312588212 ecr 3745115898], length 1314
07:03:16.179190 IP 99.181.100.114.1935 > 10.8.1.11.56466: Flags [.], ack 81629, win 126, options [nop,nop,TS val 3745115993 ecr 312587710], length 0
07:03:16.179226 IP 10.8.1.11.56466 > 99.181.100.114.1935: Flags [P.], seq 94769:95574, ack 1, win 501, options [nop,nop,TS val 312588229 ecr 3745115993], length 805
07:03:16.227647 IP 10.8.1.11.56466 > 99.181.100.114.1935: Flags [.], seq 95574:96888, ack 1, win 501, options [nop,nop,TS val 312588277 ecr 3745115993], length 1314
07:03:16.248895 IP 99.181.100.114.1935 > 10.8.1.11.56466: Flags [.], ack 84257, win 126, options [nop,nop,TS val 3745116063 ecr 312587812], length 0
07:03:16.259629 IP 10.8.1.11.56466 > 99.181.100.114.1935: Flags [.], seq 96888:98202, ack 1, win 501, options [nop,nop,TS val 312588309 ecr 3745116063], length 1314
07:03:16.299923 IP 10.8.1.11.56466 > 99.181.100.114.1935: Flags [.], seq 98202:99516, ack 1, win 501, options [nop,nop,TS val 312588349 ecr 3745116063], length 1314
07:03:16.350931 IP 99.181.100.114.1935 > 10.8.1.11.56466: Flags [.], ack 86885, win 126, options [nop,nop,TS val 3745116165 ecr 312587880], length 0
07:03:16.361360 IP 10.8.1.11.56466 > 99.181.100.114.1935: Flags [.], seq 99516:100830, ack 1, win 501, options [nop,nop,TS val 312588411 ecr 3745116165], length 1314
07:03:16.394855 IP 10.8.1.11.56466 > 99.181.100.114.1935: Flags [.], seq 100830:102144, ack 1, win 501, options [nop,nop,TS val 312588444 ecr 3745116165], length 1314
07:03:16.416446 IP 99.181.100.114.1935 > 10.8.1.11.56466: Flags [.], ack 89513, win 126, options [nop,nop,TS val 3745116231 ecr 312587975], length 0
07:03:16.428031 IP 10.8.1.11.56466 > 99.181.100.114.1935: Flags [.], seq 102144:103458, ack 1, win 501, options [nop,nop,TS val 312588477 ecr 3745116231], length 1314
07:03:16.494576 IP 10.8.1.11.56466 > 99.181.100.114.1935: Flags [.], seq 103458:104772, ack 1, win 501, options [nop,nop,TS val 312588544 ecr 3745116231], length 1314
07:03:16.514737 IP 99.181.100.114.1935 > 10.8.1.11.56466: Flags [.], ack 92141, win 126, options [nop,nop,TS val 3745116329 ecr 312588074], length 0
07:03:16.526977 IP 10.8.1.11.56466 > 99.181.100.114.1935: Flags [.], seq 104772:106086, ack 1, win 501, options [nop,nop,TS val 312588576 ecr 3745116329], length 1314
07:03:16.560942 IP 10.8.1.11.56466 > 99.181.100.114.1935: Flags [.], seq 106086:107400, ack 1, win 501, options [nop,nop,TS val 312588610 ecr 3745116329], length 1314
07:03:16.618131 IP 99.181.100.114.1935 > 10.8.1.11.56466: Flags [.], ack 94769, win 126, options [nop,nop,TS val 3745116432 ecr 312588143], length 0
07:03:16.626345 IP 10.8.1.11.56466 > 99.181.100.114.1935: Flags [.], seq 107400:108714, ack 1, win 501, options [nop,nop,TS val 312588676 ecr 3745116432], length 1314
07:03:16.635079 IP 99.181.100.114.1935 > 10.8.1.11.56466: Flags [.], ack 95574, win 126, options [nop,nop,TS val 3745116449 ecr 312588229], length 0
07:03:16.635101 IP 10.8.1.11.56466 > 99.181.100.114.1935: Flags [P.], seq 108714:109438, ack 1, win 501, options [nop,nop,TS val 312588684 ecr 3745116449], length 724
07:03:16.695965 IP 10.8.1.11.56466 > 99.181.100.114.1935: Flags [.], seq 109438:110752, ack 1, win 501, options [nop,nop,TS val 312588745 ecr 3745116449], length 1314
07:03:16.715562 IP 99.181.100.114.1935 > 10.8.1.11.56466: Flags [.], ack 98202, win 126, options [nop,nop,TS val 3745116530 ecr 312588277], length 0
07:03:16.726592 IP 10.8.1.11.56466 > 99.181.100.114.1935: Flags [.], seq 110752:112066, ack 1, win 501, options [nop,nop,TS val 312588776 ecr 3745116530], length 1314
07:03:16.760196 IP 10.8.1.11.56466 > 99.181.100.114.1935: Flags [.], seq 112066:113380, ack 1, win 501, options [nop,nop,TS val 312588810 ecr 3745116530], length 1314
07:03:16.817387 IP 99.181.100.114.1935 > 10.8.1.11.56466: Flags [.], ack 100830, win 126, options [nop,nop,TS val 3745116631 ecr 312588349], length 0
07:03:16.828058 IP 10.8.1.11.56466 > 99.181.100.114.1935: Flags [.], seq 113380:114694, ack 1, win 501, options [nop,nop,TS val 312588877 ecr 3745116631], length 1314
07:03:16.860075 IP 10.8.1.11.56466 > 99.181.100.114.1935: Flags [.], seq 114694:116008, ack 1, win 501, options [nop,nop,TS val 312588909 ecr 3745116631], length 1314
07:03:16.883787 IP 99.181.100.114.1935 > 10.8.1.11.56466: Flags [.], ack 103458, win 126, options [nop,nop,TS val 3745116698 ecr 312588444], length 0
07:03:16.896070 IP 10.8.1.11.56466 > 99.181.100.114.1935: Flags [.], seq 116008:117322, ack 1, win 501, options [nop,nop,TS val 312588945 ecr 3745116698], length 1314
07:03:16.961124 IP 10.8.1.11.56466 > 99.181.100.114.1935: Flags [.], seq 117322:118636, ack 1, win 501, options [nop,nop,TS val 312589010 ecr 3745116698], length 1314
07:03:16.982928 IP 99.181.100.114.1935 > 10.8.1.11.56466: Flags [.], ack 106086, win 126, options [nop,nop,TS val 3745116797 ecr 312588544], length 0
07:03:16.992088 IP 10.8.1.11.56466 > 99.181.100.114.1935: Flags [.], seq 118636:119950, ack 1, win 501, options [nop,nop,TS val 312589041 ecr 3745116797], length 1314
07:03:17.026269 IP 10.8.1.11.56466 > 99.181.100.114.1935: Flags [.], seq 119950:121264, ack 1, win 501, options [nop,nop,TS val 312589076 ecr 3745116797], length 1314
07:03:17.082231 IP 99.181.100.114.1935 > 10.8.1.11.56466: Flags [.], ack 108714, win 126, options [nop,nop,TS val 3745116896 ecr 312588610], length 0
07:03:17.090851 IP 99.181.100.114.1935 > 10.8.1.11.56466: Flags [.], ack 109438, win 126, options [nop,nop,TS val 3745116905 ecr 312588684], length 0
07:03:17.090916 IP 10.8.1.11.56466 > 99.181.100.114.1935: Flags [P.], seq 121264:122531, ack 1, win 501, options [nop,nop,TS val 312589140 ecr 3745116905], length 1267
07:03:17.129396 IP 10.8.1.11.56466 > 99.181.100.114.1935: Flags [.], seq 122531:123845, ack 1, win 501, options [nop,nop,TS val 312589179 ecr 3745116905], length 1314
07:03:17.159886 IP 10.8.1.11.56466 > 99.181.100.114.1935: Flags [.], seq 123845:125159, ack 1, win 501, options [nop,nop,TS val 312589209 ecr 3745116905], length 1314
07:03:17.182558 IP 99.181.100.114.1935 > 10.8.1.11.56466: Flags [.], ack 112066, win 126, options [nop,nop,TS val 3745116997 ecr 312588745], length 0
07:03:17.217986 IP 10.8.1.11.56466 > 99.181.100.114.1935: Flags [.], seq 125159:126473, ack 1, win 501, options [nop,nop,TS val 312589267 ecr 3745116997], length 1314
07:03:17.261812 IP 10.8.1.11.56466 > 99.181.100.114.1935: Flags [.], seq 126473:127787, ack 1, win 501, options [nop,nop,TS val 312589311 ecr 3745116997], length 1314
07:03:17.284215 IP 99.181.100.114.1935 > 10.8.1.11.56466: Flags [.], ack 114694, win 126, options [nop,nop,TS val 3745117098 ecr 312588810], length 0
07:03:17.295016 IP 10.8.1.11.56466 > 99.181.100.114.1935: Flags [.], seq 127787:129101, ack 1, win 501, options [nop,nop,TS val 312589344 ecr 3745117098], length 1314
07:03:17.346664 IP 10.8.1.11.56466 > 99.181.100.114.1935: Flags [.], seq 129101:130415, ack 1, win 501, options [nop,nop,TS val 312589396 ecr 3745117098], length 1314
07:03:17.351979 IP 99.181.100.114.1935 > 10.8.1.11.56466: Flags [.], ack 117322, win 126, options [nop,nop,TS val 3745117166 ecr 312588909], length 0
07:03:17.394967 IP 10.8.1.11.56466 > 99.181.100.114.1935: Flags [.], seq 130415:131729, ack 1, win 501, options [nop,nop,TS val 312589444 ecr 3745117166], length 1314
07:03:17.428481 IP 10.8.1.11.56466 > 99.181.100.114.1935: Flags [.], seq 131729:133043, ack 1, win 501, options [nop,nop,TS val 312589478 ecr 3745117166], length 1314
07:03:17.448158 IP 99.181.100.114.1935 > 10.8.1.11.56466: Flags [.], ack 119950, win 126, options [nop,nop,TS val 3745117262 ecr 312589010], length 0
07:03:17.475036 IP 10.8.1.11.56466 > 99.181.100.114.1935: Flags [.], seq 133043:134357, ack 1, win 501, options [nop,nop,TS val 312589524 ecr 3745117262], length 1314
07:03:17.525374 IP 10.8.1.11.56466 > 99.181.100.114.1935: Flags [.], seq 134357:135671, ack 1, win 501, options [nop,nop,TS val 312589575 ecr 3745117262], length 1314
07:03:17.546880 IP 99.181.100.114.1935 > 10.8.1.11.56466: Flags [.], ack 122531, win 126, options [nop,nop,TS val 3745117361 ecr 312589076], length 0
07:03:17.546904 IP 10.8.1.11.56466 > 99.181.100.114.1935: Flags [P.], seq 135671:136392, ack 1, win 501, options [nop,nop,TS val 312589596 ecr 3745117361], length 721
07:03:17.595869 IP 10.8.1.11.56466 > 99.181.100.114.1935: Flags [.], seq 136392:137706, ack 1, win 501, options [nop,nop,TS val 312589645 ecr 3745117361], length 1314
07:03:17.615764 IP 99.181.100.114.1935 > 10.8.1.11.56466: Flags [.], ack 125159, win 126, options [nop,nop,TS val 3745117430 ecr 312589179], length 0
07:03:17.627708 IP 10.8.1.11.56466 > 99.181.100.114.1935: Flags [.], seq 137706:139020, ack 1, win 501, options [nop,nop,TS val 312589677 ecr 3745117430], length 1314
07:03:17.667235 IP 10.8.1.11.56466 > 99.181.100.114.1935: Flags [.], seq 139020:140334, ack 1, win 501, options [nop,nop,TS val 312589717 ecr 3745117430], length 1314
07:03:17.717719 IP 99.181.100.114.1935 > 10.8.1.11.56466: Flags [.], ack 127787, win 126, options [nop,nop,TS val 3745117532 ecr 312589267], length 0
07:03:17.731538 IP 10.8.1.11.56466 > 99.181.100.114.1935: Flags [.], seq 140334:141648, ack 1, win 501, options [nop,nop,TS val 312589781 ecr 3745117532], length 1314
07:03:17.762696 IP 10.8.1.11.56466 > 99.181.100.114.1935: Flags [.], seq 141648:142962, ack 1, win 501, options [nop,nop,TS val 312589812 ecr 3745117532], length 1314
07:03:17.795819 IP 10.8.1.11.56466 > 99.181.100.114.1935: Flags [.], seq 142962:144276, ack 1, win 501, options [nop,nop,TS val 312589845 ecr 3745117532], length 1314
07:03:17.802743 IP 99.181.100.114.1935 > 10.8.1.11.56466: Flags [.], ack 130415, win 126, options [nop,nop,TS val 3745117617 ecr 312589344], length 0
07:03:17.862590 IP 10.8.1.11.56466 > 99.181.100.114.1935: Flags [.], seq 144276:145590, ack 1, win 501, options [nop,nop,TS val 312589912 ecr 3745117617], length 1314
07:03:17.895643 IP 10.8.1.11.56466 > 99.181.100.114.1935: Flags [.], seq 145590:146904, ack 1, win 501, options [nop,nop,TS val 312589945 ecr 3745117617], length 1314
07:03:17.926808 IP 10.8.1.11.56466 > 99.181.100.114.1935: Flags [.], seq 146904:148218, ack 1, win 501, options [nop,nop,TS val 312589976 ecr 3745117617], length 1314
07:03:17.981436 IP 99.181.100.114.1935 > 10.8.1.11.56466: Flags [.], ack 135671, win 126, options [nop,nop,TS val 3745117796 ecr 312589524], length 0
07:03:17.996348 IP 10.8.1.11.56466 > 99.181.100.114.1935: Flags [.], seq 148218:149532, ack 1, win 501, options [nop,nop,TS val 312590046 ecr 3745117796], length 1314
07:03:18.005930 IP 99.181.100.114.1935 > 10.8.1.11.56466: Flags [.], ack 136392, win 126, options [nop,nop,TS val 3745117820 ecr 312589596], length 0
07:03:18.005965 IP 10.8.1.11.56466 > 99.181.100.114.1935: Flags [P.], seq 149532:150245, ack 1, win 501, options [nop,nop,TS val 312590055 ecr 3745117820], length 713
07:03:18.062686 IP 10.8.1.11.56466 > 99.181.100.114.1935: Flags [.], seq 150245:151559, ack 1, win 501, options [nop,nop,TS val 312590112 ecr 3745117820], length 1314
07:03:18.086052 IP 99.181.100.114.1935 > 10.8.1.11.56466: Flags [.], ack 139020, win 126, options [nop,nop,TS val 3745117900 ecr 312589645], length 0
07:03:18.095908 IP 10.8.1.11.56466 > 99.181.100.114.1935: Flags [.], seq 151559:152873, ack 1, win 501, options [nop,nop,TS val 312590145 ecr 3745117900], length 1314
07:03:18.129560 IP 10.8.1.11.56466 > 99.181.100.114.1935: Flags [.], seq 152873:154187, ack 1, win 501, options [nop,nop,TS val 312590179 ecr 3745117900], length 1314
07:03:18.188582 IP 99.181.100.114.1935 > 10.8.1.11.56466: Flags [.], ack 141648, win 126, options [nop,nop,TS val 3745118003 ecr 312589717], length 0
07:03:18.194000 IP 10.8.1.11.56466 > 99.181.100.114.1935: Flags [.], seq 154187:155501, ack 1, win 501, options [nop,nop,TS val 312590243 ecr 3745118003], length 1314
07:03:18.229202 IP 10.8.1.11.56466 > 99.181.100.114.1935: Flags [.], seq 155501:156815, ack 1, win 501, options [nop,nop,TS val 312590278 ecr 3745118003], length 1314
07:03:18.252614 IP 99.181.100.114.1935 > 10.8.1.11.56466: Flags [.], ack 144276, win 126, options [nop,nop,TS val 3745118066 ecr 312589812], length 0
07:03:18.267485 IP 10.8.1.11.56466 > 99.181.100.114.1935: Flags [.], seq 156815:158129, ack 1, win 501, options [nop,nop,TS val 312590317 ecr 3745118066], length 1314
07:03:18.331709 IP 10.8.1.11.56466 > 99.181.100.114.1935: Flags [.], seq 158129:159443, ack 1, win 501, options [nop,nop,TS val 312590381 ecr 3745118066], length 1314
07:03:18.351340 IP 99.181.100.114.1935 > 10.8.1.11.56466: Flags [.], ack 146904, win 126, options [nop,nop,TS val 3745118166 ecr 312589912], length 0
07:03:18.360604 IP 10.8.1.11.56466 > 99.181.100.114.1935: Flags [.], seq 159443:160757, ack 1, win 501, options [nop,nop,TS val 312590410 ecr 3745118166], length 1314
07:03:18.396047 IP 10.8.1.11.56466 > 99.181.100.114.1935: Flags [.], seq 160757:162071, ack 1, win 501, options [nop,nop,TS val 312590445 ecr 3745118166], length 1314
07:03:18.452245 IP 99.181.100.114.1935 > 10.8.1.11.56466: Flags [.], ack 149532, win 126, options [nop,nop,TS val 3745118267 ecr 312589976], length 0
07:03:18.460219 IP 10.8.1.11.56466 > 99.181.100.114.1935: Flags [.], seq 162071:163385, ack 1, win 501, options [nop,nop,TS val 312590510 ecr 3745118267], length 1314
07:03:18.462888 IP 99.181.100.114.1935 > 10.8.1.11.56466: Flags [.], ack 150245, win 126, options [nop,nop,TS val 3745118276 ecr 312590055], length 0
07:03:18.462908 IP 10.8.1.11.56466 > 99.181.100.114.1935: Flags [P.], seq 163385:164189, ack 1, win 501, options [nop,nop,TS val 312590512 ecr 3745118276], length 804
07:03:18.529531 IP 10.8.1.11.56466 > 99.181.100.114.1935: Flags [.], seq 164189:165503, ack 1, win 501, options [nop,nop,TS val 312590579 ecr 3745118276], length 1314
07:03:18.552079 IP 99.181.100.114.1935 > 10.8.1.11.56466: Flags [.], ack 152873, win 126, options [nop,nop,TS val 3745118366 ecr 312590112], length 0
07:03:18.567446 IP 10.8.1.11.56466 > 99.181.100.114.1935: Flags [.], seq 165503:166817, ack 1, win 501, options [nop,nop,TS val 312590617 ecr 3745118366], length 1314
07:03:18.595917 IP 10.8.1.11.56466 > 99.181.100.114.1935: Flags [.], seq 166817:168131, ack 1, win 501, options [nop,nop,TS val 312590645 ecr 3745118366], length 1314
07:03:18.649784 IP 99.181.100.114.1935 > 10.8.1.11.56466: Flags [.], ack 155501, win 126, options [nop,nop,TS val 3745118464 ecr 312590179], length 0
07:03:18.663153 IP 10.8.1.11.56466 > 99.181.100.114.1935: Flags [.], seq 168131:169445, ack 1, win 501, options [nop,nop,TS val 312590712 ecr 3745118464], length 1314
07:03:18.696391 IP 10.8.1.11.56466 > 99.181.100.114.1935: Flags [.], seq 169445:170759, ack 1, win 501, options [nop,nop,TS val 312590746 ecr 3745118464], length 1314
07:03:18.723255 IP 99.181.100.114.1935 > 10.8.1.11.56466: Flags [.], ack 158129, win 126, options [nop,nop,TS val 3745118537 ecr 312590278], length 0
07:03:18.729208 IP 10.8.1.11.56466 > 99.181.100.114.1935: Flags [.], seq 170759:172073, ack 1, win 501, options [nop,nop,TS val 312590779 ecr 3745118537], length 1314
07:03:18.803674 IP 10.8.1.11.56466 > 99.181.100.114.1935: Flags [.], seq 172073:173387, ack 1, win 501, options [nop,nop,TS val 312590853 ecr 3745118537], length 1314
07:03:18.816288 IP 99.181.100.114.1935 > 10.8.1.11.56466: Flags [.], ack 160757, win 126, options [nop,nop,TS val 3745118631 ecr 312590381], length 0
07:03:18.824976 IP 10.8.1.11.56466 > 99.181.100.114.1935: Flags [.], seq 173387:174701, ack 1, win 501, options [nop,nop,TS val 312590874 ecr 3745118631], length 1314
07:03:18.867323 IP 10.8.1.11.56466 > 99.181.100.114.1935: Flags [.], seq 174701:176015, ack 1, win 501, options [nop,nop,TS val 312590917 ecr 3745118631], length 1314
07:03:18.916201 IP 99.181.100.114.1935 > 10.8.1.11.56466: Flags [.], ack 163385, win 126, options [nop,nop,TS val 3745118730 ecr 312590445], length 0
07:03:18.919195 IP 99.181.100.114.1935 > 10.8.1.11.56466: Flags [.], ack 164189, win 126, options [nop,nop,TS val 3745118733 ecr 312590512], length 0
07:03:18.919228 IP 10.8.1.11.56466 > 99.181.100.114.1935: Flags [P.], seq 176015:177202, ack 1, win 501, options [nop,nop,TS val 312590969 ecr 3745118733], length 1187
07:03:18.962753 IP 10.8.1.11.56466 > 99.181.100.114.1935: Flags [.], seq 177202:178516, ack 1, win 501, options [nop,nop,TS val 312591012 ecr 3745118733], length 1314
07:03:18.996067 IP 10.8.1.11.56466 > 99.181.100.114.1935: Flags [.], seq 178516:179830, ack 1, win 501, options [nop,nop,TS val 312591045 ecr 3745118733], length 1314
07:03:19.023480 IP 99.181.100.114.1935 > 10.8.1.11.56466: Flags [.], ack 166817, win 126, options [nop,nop,TS val 3745118838 ecr 312590579], length 0
07:03:19.038824 IP 10.8.1.11.56466 > 99.181.100.114.1935: Flags [.], seq 179830:181144, ack 1, win 501, options [nop,nop,TS val 312591088 ecr 3745118838], length 1314
07:03:19.102932 IP 10.8.1.11.56466 > 99.181.100.114.1935: Flags [.], seq 181144:182458, ack 1, win 501, options [nop,nop,TS val 312591152 ecr 3745118838], length 1314
07:03:19.112954 IP 99.181.100.114.1935 > 10.8.1.11.56466: Flags [.], ack 168131, win 126, options [nop,nop,TS val 3745118927 ecr 312590645], length 0
07:03:19.127782 IP 10.8.1.11.56466 > 99.181.100.114.1935: Flags [.], seq 182458:183772, ack 1, win 501, options [nop,nop,TS val 312591177 ecr 3745118927], length 1314
07:03:19.152416 IP 99.181.100.114.1935 > 10.8.1.11.56466: Flags [.], ack 170759, win 126, options [nop,nop,TS val 3745118967 ecr 312590712], length 0
07:03:19.167312 IP 10.8.1.11.56466 > 99.181.100.114.1935: Flags [.], seq 183772:185086, ack 1, win 501, options [nop,nop,TS val 312591217 ecr 3745118967], length 1314
07:03:19.231885 IP 10.8.1.11.56466 > 99.181.100.114.1935: Flags [.], seq 185086:186400, ack 1, win 501, options [nop,nop,TS val 312591281 ecr 3745118967], length 1314
07:03:19.259387 IP 99.181.100.114.1935 > 10.8.1.11.56466: Flags [.], ack 173387, win 126, options [nop,nop,TS val 3745119074 ecr 312590779], length 0
07:03:19.260003 IP 10.8.1.11.56466 > 99.181.100.114.1935: Flags [.], seq 186400:187714, ack 1, win 501, options [nop,nop,TS val 312591309 ecr 3745119074], length 1314
07:03:19.295933 IP 10.8.1.11.56466 > 99.181.100.114.1935: Flags [.], seq 187714:189028, ack 1, win 501, options [nop,nop,TS val 312591345 ecr 3745119074], length 1314
07:03:19.323299 IP 99.181.100.114.1935 > 10.8.1.11.56466: Flags [.], ack 176015, win 126, options [nop,nop,TS val 3745119138 ecr 312590874], length 0
07:03:19.362745 IP 10.8.1.11.56466 > 99.181.100.114.1935: Flags [.], seq 189028:190342, ack 1, win 501, options [nop,nop,TS val 312591412 ecr 3745119138], length 1314
07:03:19.378640 IP 99.181.100.114.1935 > 10.8.1.11.56466: Flags [.], ack 177202, win 126, options [nop,nop,TS val 3745119193 ecr 312590969], length 0
07:03:19.378678 IP 10.8.1.11.56466 > 99.181.100.114.1935: Flags [P.], seq 190342:191052, ack 1, win 501, options [nop,nop,TS val 312591428 ecr 3745119193], length 710
07:03:19.428512 IP 10.8.1.11.56466 > 99.181.100.114.1935: Flags [.], seq 191052:192366, ack 1, win 501, options [nop,nop,TS val 312591478 ecr 3745119193], length 1314
07:03:19.452024 IP 99.181.100.114.1935 > 10.8.1.11.56466: Flags [.], ack 179830, win 126, options [nop,nop,TS val 3745119266 ecr 312591012], length 0
07:03:19.467853 IP 10.8.1.11.56466 > 99.181.100.114.1935: Flags [.], seq 192366:193680, ack 1, win 501, options [nop,nop,TS val 312591517 ecr 3745119266], length 1314
07:03:19.495492 IP 10.8.1.11.56466 > 99.181.100.114.1935: Flags [.], seq 193680:194994, ack 1, win 501, options [nop,nop,TS val 312591545 ecr 3745119266], length 1314
07:03:19.559069 IP 99.181.100.114.1935 > 10.8.1.11.56466: Flags [.], ack 182458, win 126, options [nop,nop,TS val 3745119373 ecr 312591088], length 0
07:03:19.562065 IP 10.8.1.11.56466 > 99.181.100.114.1935: Flags [.], seq 194994:196308, ack 1, win 501, options [nop,nop,TS val 312591611 ecr 3745119373], length 1314
07:03:19.596387 IP 10.8.1.11.56466 > 99.181.100.114.1935: Flags [.], seq 196308:197622, ack 1, win 501, options [nop,nop,TS val 312591646 ecr 3745119373], length 1314
07:03:19.623486 IP 99.181.100.114.1935 > 10.8.1.11.56466: Flags [.], ack 185086, win 126, options [nop,nop,TS val 3745119437 ecr 312591177], length 0
07:03:19.639336 IP 10.8.1.11.56466 > 99.181.100.114.1935: Flags [.], seq 197622:198936, ack 1, win 501, options [nop,nop,TS val 312591689 ecr 3745119437], length 1314
07:03:19.703449 IP 10.8.1.11.56466 > 99.181.100.114.1935: Flags [.], seq 198936:200250, ack 1, win 501, options [nop,nop,TS val 312591753 ecr 3745119437], length 1314
07:03:19.716485 IP 99.181.100.114.1935 > 10.8.1.11.56466: Flags [.], ack 187714, win 126, options [nop,nop,TS val 3745119531 ecr 312591281], length 0
07:03:19.729242 IP 10.8.1.11.56466 > 99.181.100.114.1935: Flags [.], seq 200250:201564, ack 1, win 501, options [nop,nop,TS val 312591779 ecr 3745119531], length 1314
07:03:19.767842 IP 10.8.1.11.56466 > 99.181.100.114.1935: Flags [.], seq 201564:202878, ack 1, win 501, options [nop,nop,TS val 312591817 ecr 3745119531], length 1314
07:03:19.818785 IP 99.181.100.114.1935 > 10.8.1.11.56466: Flags [.], ack 190342, win 126, options [nop,nop,TS val 3745119633 ecr 312591345], length 0
07:03:19.831518 IP 10.8.1.11.56466 > 99.181.100.114.1935: Flags [.], seq 202878:204192, ack 1, win 501, options [nop,nop,TS val 312591881 ecr 3745119633], length 1314
07:03:19.834386 IP 99.181.100.114.1935 > 10.8.1.11.56466: Flags [.], ack 191052, win 126, options [nop,nop,TS val 3745119649 ecr 312591428], length 0
07:03:19.834417 IP 10.8.1.11.56466 > 99.181.100.114.1935: Flags [P.], seq 204192:205012, ack 1, win 501, options [nop,nop,TS val 312591884 ecr 3745119649], length 820
07:03:19.895831 IP 10.8.1.11.56466 > 99.181.100.114.1935: Flags [.], seq 205012:206326, ack 1, win 501, options [nop,nop,TS val 312591945 ecr 3745119649], length 1314
07:03:19.923882 IP 99.181.100.114.1935 > 10.8.1.11.56466: Flags [.], ack 193680, win 126, options [nop,nop,TS val 3745119738 ecr 312591478], length 0
07:03:19.938623 IP 10.8.1.11.56466 > 99.181.100.114.1935: Flags [.], seq 206326:207640, ack 1, win 501, options [nop,nop,TS val 312591988 ecr 3745119738], length 1314
