14:30:21.481416 IP 45.113.130.149.1935 > 10.8.0.7.54708: Flags [.], ack 3690544780, win 126, options [nop,nop,TS val 3721783986 ecr 2943363286], length 0
14:30:21.504453 IP 10.8.0.7.54708 > 45.113.130.149.1935: Flags [.], seq 9996:11310, ack 0, win 501, options [nop,nop,TS val 2943363709 ecr 3721783986], length 1314
14:30:21.551287 IP 10.8.0.7.54708 > 45.113.130.149.1935: Flags [.], seq 11310:12624, ack 0, win 501, options [nop,nop,TS val 2943363756 ecr 3721783986], length 1314
14:30:21.553218 IP 45.113.130.149.1935 > 10.8.0.7.54708: Flags [.], ack 2629, win 126, options [nop,nop,TS val 3721784058 ecr 2943363371], length 0
14:30:21.606902 IP 10.8.0.7.54708 > 45.113.130.149.1935: Flags [.], seq 12624:13938, ack 0, win 501, options [nop,nop,TS val 2943363811 ecr 3721784058], length 1314
14:30:21.637165 IP 10.8.0.7.54708 > 45.113.130.149.1935: Flags [.], seq 13938:15252, ack 0, win 501, options [nop,nop,TS val 2943363841 ecr 3721784058], length 1314
14:30:21.650190 IP 45.113.130.149.1935 > 10.8.0.7.54708: Flags [.], ack 4740, win 126, options [nop,nop,TS val 3721784154 ecr 2943363478], length 0
14:30:21.650213 IP 10.8.0.7.54708 > 45.113.130.149.1935: Flags [P.], seq 15252:15571, ack 0, win 501, options [nop,nop,TS val 2943363855 ecr 3721784154], length 319
14:30:21.701421 IP 10.8.0.7.54708 > 45.113.130.149.1935: Flags [.], seq 15571:16885, ack 0, win 501, options [nop,nop,TS val 2943363906 ecr 3721784154], length 1314
14:30:21.717459 IP 45.113.130.149.1935 > 10.8.0.7.54708: Flags [.], ack 7368, win 126, options [nop,nop,TS val 3721784221 ecr 2943363542], length 0
14:30:21.739243 IP 10.8.0.7.54708 > 45.113.130.149.1935: Flags [.], seq 16885:18199, ack 0, win 501, options [nop,nop,TS val 2943363944 ecr 3721784221], length 1314
14:30:21.770357 IP 10.8.0.7.54708 > 45.113.130.149.1935: Flags [.], seq 18199:19513, ack 0, win 501, options [nop,nop,TS val 2943363975 ecr 3721784221], length 1314
14:30:21.811205 IP 45.113.130.149.1935 > 10.8.0.7.54708: Flags [.], ack 9996, win 126, options [nop,nop,TS val 3721784316 ecr 2943363628], length 0
14:30:21.838229 IP 10.8.0.7.54708 > 45.113.130.149.1935: Flags [.], seq 19513:20827, ack 0, win 501, options [nop,nop,TS val 2943364043 ecr 3721784316], length 1314
14:30:21.869253 IP 10.8.0.7.54708 > 45.113.130.149.1935: Flags [.], seq 20827:22141, ack 0, win 501, options [nop,nop,TS val 2943364074 ecr 3721784316], length 1314
14:30:21.897012 IP 45.113.130.149.1935 > 10.8.0.7.54708: Flags [.], ack 12624, win 126, options [nop,nop,TS val 3721784402 ecr 2943363709], length 0
14:30:21.903074 IP 10.8.0.7.54708 > 45.113.130.149.1935: Flags [.], seq 22141:23455, ack 0, win 501, options [nop,nop,TS val 2943364107 ecr 3721784402], length 1314
14:30:21.973674 IP 10.8.0.7.54708 > 45.113.130.149.1935: Flags [.], seq 23455:24769, ack 0, win 501, options [nop,nop,TS val 2943364178 ecr 3721784402], length 1314
14:30:21.981188 IP 45.113.130.149.1935 > 10.8.0.7.54708: Flags [.], ack 15252, win 126, options [nop,nop,TS val 3721784486 ecr 2943363811], length 0
14:30:21.993925 IP 45.113.130.149.1935 > 10.8.0.7.54708: Flags [.], ack 15571, win 126, options [nop,nop,TS val 3721784499 ecr 2943363855], length 0
14:30:21.993963 IP 10.8.0.7.54708 > 45.113.130.149.1935: Flags [P.], seq 24769:25569, ack 0, win 501, options [nop,nop,TS val 2943364198 ecr 3721784499], length 800
14:30:22.036070 IP 10.8.0.7.54708 > 45.113.130.149.1935: Flags [.], seq 25569:26883, ack 0, win 501, options [nop,nop,TS val 2943364240 ecr 3721784499], length 1314
14:30:22.063423 IP 10.8.0.7.54708 > 45.113.130.149.1935: Flags [.], seq 26883:28197, ack 0, win 501, options [nop,nop,TS val 2943364268 ecr 3721784499], length 1314
14:30:22.083385 IP 45.113.130.149.1935 > 10.8.0.7.54708: Flags [.], ack 18199, win 126, options [nop,nop,TS val 3721784588 ecr 2943363906], length 0
14:30:22.105793 IP 10.8.0.7.54708 > 45.113.130.149.1935: Flags [.], seq 28197:29511, ack 0, win 501, options [nop,nop,TS val 2943364310 ecr 3721784588], length 1314
14:30:22.169790 IP 10.8.0.7.54708 > 45.113.130.149.1935: Flags [.], seq 29511:30825, ack 0, win 501, options [nop,nop,TS val 2943364374 ecr 3721784588], length 1314
14:30:22.182506 IP 45.113.130.149.1935 > 10.8.0.7.54708: Flags [.], ack 20827, win 126, options [nop,nop,TS val 3721784687 ecr 2943363975], length 0
14:30:22.207557 IP 10.8.0.7.54708 > 45.113.130.149.1935: Flags [.], seq 30825:32139, ack 0, win 501, options [nop,nop,TS val 2943364412 ecr 3721784687], length 1314
14:30:22.240247 IP 10.8.0.7.54708 > 45.113.130.149.1935: Flags [.], seq 32139:33453, ack 0, win 501, options [nop,nop,TS val 2943364445 ecr 3721784687], length 1314
14:30:22.247217 IP 45.113.130.149.1935 > 10.8.0.7.54708: Flags [.], ack 23455, win 126, options [nop,nop,TS val 3721784752 ecr 2943364074], length 0
14:30:22.298600 IP 10.8.0.7.54708 > 45.113.130.149.1935: Flags [.], seq 33453:34767, ack 0, win 501, options [nop,nop,TS val 2943364503 ecr 3721784752], length 1314
14:30:22.338022 IP 45.113.130.149.1935 > 10.8.0.7.54708: Flags [.], ack 25569, win 126, options [nop,nop,TS val 3721784843 ecr 2943364178], length 0
14:30:22.338058 IP 10.8.0.7.54708 > 45.113.130.149.1935: Flags [P.], seq 34767:35552, ack 0, win 501, options [nop,nop,TS val 2943364542 ecr 3721784843], length 785
14:30:22.372973 IP 10.8.0.7.54708 > 45.113.130.149.1935: Flags [.], seq 35552:36866, ack 0, win 501, options [nop,nop,TS val 2943364577 ecr 3721784843], length 1314
14:30:22.405633 IP 10.8.0.7.54708 > 45.113.130.149.1935: Flags [.], seq 36866:38180, ack 0, win 501, options [nop,nop,TS val 2943364610 ecr 3721784843], length 1314
14:30:22.407672 IP 45.113.130.149.1935 > 10.8.0.7.54708: Flags [.], ack 28197, win 126, options [nop,nop,TS val 3721784913 ecr 2943364240], length 0
14:30:22.448544 IP 10.8.0.7.54708 > 45.113.130.149.1935: Flags [.], seq 38180:39494, ack 0, win 501, options [nop,nop,TS val 2943364653 ecr 3721784913], length 1314
14:30:22.506434 IP 10.8.0.7.54708 > 45.113.130.149.1935: Flags [.], seq 39494:40808, ack 0, win 501, options [nop,nop,TS val 2943364711 ecr 3721784913], length 1314
14:30:22.513861 IP 45.113.130.149.1935 > 10.8.0.7.54708: Flags [.], ack 30825, win 126, options [nop,nop,TS val 3721785019 ecr 2943364310], length 0
14:30:22.534207 IP 10.8.0.7.54708 > 45.113.130.149.1935: Flags [.], seq 40808:42122, ack 0, win 501, options [nop,nop,TS val 2943364739 ecr 3721785019], length 1314
14:30:22.576985 IP 10.8.0.7.54708 > 45.113.130.149.1935: Flags [.], seq 42122:43436, ack 0, win 501, options [nop,nop,TS val 2943364781 ecr 3721785019], length 1314
14:30:22.584267 IP 45.113.130.149.1935 > 10.8.0.7.54708: Flags [.], ack 33453, win 126, options [nop,nop,TS val 3721785089 ecr 2943364412], length 0
14:30:22.641359 IP 10.8.0.7.54708 > 45.113.130.149.1935: Flags [.], seq 43436:44750, ack 0, win 501, options [nop,nop,TS val 2943364846 ecr 3721785089], length 1314
14:30:22.670500 IP 10.8.0.7.54708 > 45.113.130.149.1935: Flags [.], seq 44750:46064, ack 0, win 501, options [nop,nop,TS val 2943364875 ecr 3721785089], length 1314
14:30:22.681995 IP 45.113.130.149.1935 > 10.8.0.7.54708: Flags [.], ack 35552, win 126, options [nop,nop,TS val 3721785187 ecr 2943364503], length 0
14:30:22.682025 IP 10.8.0.7.54708 > 45.113.130.149.1935: Flags [P.], seq 46064:46398, ack 0, win 501, options [nop,nop,TS val 2943364886 ecr 3721785187], length 334
14:30:22.737569 IP 10.8.0.7.54708 > 45.113.130.149.1935: Flags [.], seq 46398:47712, ack 0, win 501, options [nop,nop,TS val 2943364942 ecr 3721785187], length 1314
14:30:22.749674 IP 45.113.130.149.1935 > 10.8.0.7.54708: Flags [.], ack 38180, win 126, options [nop,nop,TS val 3721785254 ecr 2943364577], length 0
14:30:22.769112 IP 10.8.0.7.54708 > 45.113.130.149.1935: Flags [.], seq 47712:49026, ack 0, win 501, options [nop,nop,TS val 2943364973 ecr 3721785254], length 1314
14:30:22.808023 IP 10.8.0.7.54708 > 45.113.130.149.1935: Flags [.], seq 49026:50340, ack 0, win 501, options [nop,nop,TS val 2943365012 ecr 3721785254], length 1314
14:30:22.850422 IP 45.113.130.149.1935 > 10.8.0.7.54708: Flags [.], ack 40808, win 126, options [nop,nop,TS val 3721785355 ecr 2943364653], length 0
14:30:22.871306 IP 10.8.0.7.54708 > 45.113.130.149.1935: Flags [.], seq 50340:51654, ack 0, win 501, options [nop,nop,TS val 2943365076 ecr 3721785355], length 1314
14:30:22.906763 IP 10.8.0.7.54708 > 45.113.130.149.1935: Flags [.], seq 51654:52968, ack 0, win 501, options [nop,nop,TS val 2943365111 ecr 3721785355], length 1314
14:30:22.920989 IP 45.113.130.149.1935 > 10.8.0.7.54708: Flags [.], ack 43436, win 126, options [nop,nop,TS val 3721785426 ecr 2943364739], length 0
14:30:22.937194 IP 10.8.0.7.54708 > 45.113.130.149.1935: Flags [.], seq 52968:54282, ack 0, win 501, options [nop,nop,TS val 2943365141 ecr 3721785426], length 1314
14:30:23.003763 IP 10.8.0.7.54708 > 45.113.130.149.1935: Flags [.], seq 54282:55596, ack 0, win 501, options [nop,nop,TS val 2943365208 ecr 3721785426], length 1314
14:30:23.021818 IP 45.113.130.149.1935 > 10.8.0.7.54708: Flags [.], ack 46064, win 126, options [nop,nop,TS val 3721785519 ecr 2943364846], length 0
14:30:23.025843 IP 45.113.130.149.1935 > 10.8.0.7.54708: Flags [.], ack 46398, win 126, options [nop,nop,TS val 3721785531 ecr 2943364886], length 0
14:30:23.025860 IP 10.8.0.7.54708 > 45.113.130.149.1935: Flags [P.], seq 55596:56480, ack 0, win 501, options [nop,nop,TS val 2943365230 ecr 3721785531], length 884
14:30:23.068161 IP 10.8.0.7.54708 > 45.113.130.149.1935: Flags [.], seq 56480:57794, ack 0, win 501, options [nop,nop,TS val 2943365272 ecr 3721785531], length 1314
14:30:23.105735 IP 10.8.0.7.54708 > 45.113.130.149.1935: Flags [.], seq 57794:59108, ack 0, win 501, options [nop,nop,TS val 2943365310 ecr 3721785531], length 1314
14:30:23.113648 IP 45.113.130.149.1935 > 10.8.0.7.54708: Flags [.], ack 49026, win 126, options [nop,nop,TS val 3721785618 ecr 2943364942], length 0
14:30:23.153535 IP 10.8.0.7.54708 > 45.113.130.149.1935: Flags [.], seq 59108:60422, ack 0, win 501, options [nop,nop,TS val 2943365358 ecr 3721785618], length 1314
14:30:23.203374 IP 10.8.0.7.54708 > 45.113.130.149.1935: Flags [.], seq 60422:61736, ack 0, win 501, options [nop,nop,TS val 2943365408 ecr 3721785618], length 1314
14:30:23.215438 IP 45.113.130.149.1935 > 10.8.0.7.54708: Flags [.], ack 51654, win 126, options [nop,nop,TS val 3721785720 ecr 2943365012], length 0
14:30:23.237007 IP 10.8.0.7.54708 > 45.113.130.149.1935: Flags [.], seq 61736:63050, ack 0, win 501, options [nop,nop,TS val 2943365441 ecr 3721785720], length 1314
14:30:23.281034 IP 10.8.0.7.54708 > 45.113.130.149.1935: Flags [.], seq 63050:64364, ack 0, win 501, options [nop,nop,TS val 2943365485 ecr 3721785720], length 1314
14:30:23.281275 IP 45.113.130.149.1935 > 10.8.0.7.54708: Flags [.], ack 54282, win 126, options [nop,nop,TS val 3721785786 ecr 2943365111], length 0
14:30:23.338148 IP 10.8.0.7.54708 > 45.113.130.149.1935: Flags [.], seq 64364:65678, ack 0, win 501, options [nop,nop,TS val 2943365542 ecr 3721785786], length 1314
14:30:23.365985 IP 10.8.0.7.54708 > 45.113.130.149.1935: Flags [.], seq 65678:66992, ack 0, win 501, options [nop,nop,TS val 2943365570 ecr 3721785786], length 1314
14:30:23.370021 IP 45.113.130.149.1935 > 10.8.0.7.54708: Flags [.], ack 56480, win 126, options [nop,nop,TS val 3721785875 ecr 2943365208], length 0
14:30:23.370064 IP 10.8.0.7.54708 > 45.113.130.149.1935: Flags [P.], seq 66992:67223, ack 0, win 501, options [nop,nop,TS val 2943365574 ecr 3721785875], length 231
14:30:23.439850 IP 10.8.0.7.54708 > 45.113.130.149.1935: Flags [.], seq 67223:68537, ack 0, win 501, options [nop,nop,TS val 2943365644 ecr 3721785875], length 1314
14:30:23.449854 IP 45.113.130.149.1935 > 10.8.0.7.54708: Flags [.], ack 59108, win 126, options [nop,nop,TS val 3721785955 ecr 2943365272], length 0
14:30:23.473001 IP 10.8.0.7.54708 > 45.113.130.149.1935: Flags [.], seq 68537:69851, ack 0, win 501, options [nop,nop,TS val 2943365677 ecr 3721785955], length 1314
14:30:23.504511 IP 10.8.0.7.54708 > 45.113.130.149.1935: Flags [.], seq 69851:71165, ack 0, win 501, options [nop,nop,TS val 2943365709 ecr 3721785955], length 1314
14:30:23.547506 IP 45.113.130.149.1935 > 10.8.0.7.54708: Flags [.], ack 61736, win 126, options [nop,nop,TS val 3721786052 ecr 2943365358], length 0
14:30:23.573540 IP 10.8.0.7.54708 > 45.113.130.149.1935: Flags [.], seq 71165:72479, ack 0, win 501, options [nop,nop,TS val 2943365778 ecr 3721786052], length 1314
14:30:23.601130 IP 10.8.0.7.54708 > 45.113.130.149.1935: Flags [.], seq 72479:73793, ack 0, win 501, options [nop,nop,TS val 2943365805 ecr 3721786052], length 1314
14:30:23.625516 IP 45.113.130.149.1935 > 10.8.0.7.54708: Flags [.], ack 64364, win 126, options [nop,nop,TS val 3721786130 ecr 2943365441], length 0
14:30:23.638654 IP 10.8.0.7.54708 > 45.113.130.149.1935: Flags [.], seq 73793:75107, ack 0, win 501, options [nop,nop,TS val 2943365843 ecr 3721786130], length 1314
14:30:23.706958 IP 10.8.0.7.54708 > 45.113.130.149.1935: Flags [.], seq 75107:76421, ack 0, win 501, options [nop,nop,TS val 2943365911 ecr 3721786130], length 1314
14:30:23.710501 IP 45.113.130.149.1935 > 10.8.0.7.54708: Flags [.], ack 66992, win 126, options [nop,nop,TS val 3721786215 ecr 2943365542], length 0
14:30:23.714176 IP 45.113.130.149.1935 > 10.8.0.7.54708: Flags [.], ack 67223, win 126, options [nop,nop,TS val 3721786219 ecr 2943365574], length 0
14:30:23.714205 IP 10.8.0.7.54708 > 45.113.130.149.1935: Flags [P.], seq 76421:77318, ack 0, win 501, options [nop,nop,TS val 2943365919 ecr 3721786219], length 897
14:30:23.770647 IP 10.8.0.7.54708 > 45.113.130.149.1935: Flags [.], seq 77318:78632, ack 0, win 501, options [nop,nop,TS val 2943365975 ecr 3721786219], length 1314
14:30:23.804557 IP 10.8.0.7.54708 > 45.113.130.149.1935: Flags [.], seq 78632:79946, ack 0, win 501, options [nop,nop,TS val 2943366009 ecr 3721786219], length 1314
14:30:23.817293 IP 45.113.130.149.1935 > 10.8.0.7.54708: Flags [.], ack 69851, win 126, options [nop,nop,TS val 3721786322 ecr 2943365644], length 0
14:30:23.840438 IP 10.8.0.7.54708 > 45.113.130.149.1935: Flags [.], seq 79946:81260, ack 0, win 501, options [nop,nop,TS val 2943366045 ecr 3721786322], length 1314
14:30:23.901173 IP 10.8.0.7.54708 > 45.113.130.149.1935: Flags [.], seq 81260:82574, ack 0, win 501, options [nop,nop,TS val 2943366105 ecr 3721786322], length 1314
14:30:23.915531 IP 45.113.130.149.1935 > 10.8.0.7.54708: Flags [.], ack 71165, win 126, options [nop,nop,TS val 3721786420 ecr 2943365709], length 0
14:30:23.940259 IP 10.8.0.7.54708 > 45.113.130.149.1935: Flags [.], seq 82574:83888, ack 0, win 501, options [nop,nop,TS val 2943366145 ecr 3721786420], length 1314
14:30:23.946089 IP 45.113.130.149.1935 > 10.8.0.7.54708: Flags [.], ack 73793, win 126, options [nop,nop,TS val 3721786450 ecr 2943365778], length 0
14:30:23.973502 IP 10.8.0.7.54708 > 45.113.130.149.1935: Flags [.], seq 83888:85202, ack 0, win 501, options [nop,nop,TS val 2943366178 ecr 3721786450], length 1314
14:30:24.040855 IP 10.8.0.7.54708 > 45.113.130.149.1935: Flags [.], seq 85202:86516, ack 0, win 501, options [nop,nop,TS val 2943366245 ecr 3721786450], length 1314
14:30:24.051206 IP 45.113.130.149.1935 > 10.8.0.7.54708: Flags [.], ack 76421, win 126, options [nop,nop,TS val 3721786556 ecr 2943365843], length 0
14:30:24.058482 IP 45.113.130.149.1935 > 10.8.0.7.54708: Flags [.], ack 77318, win 126, options [nop,nop,TS val 3721786563 ecr 2943365919], length 0
14:30:24.058512 IP 10.8.0.7.54708 > 45.113.130.149.1935: Flags [P.], seq 86516:87300, ack 0, win 501, options [nop,nop,TS val 2943366263 ecr 3721786563], length 784
14:30:24.106910 IP 10.8.0.7.54708 > 45.113.130.149.1935: Flags [.], seq 87300:88614, ack 0, win 501, options [nop,nop,TS val 2943366311 ecr 3721786563], length 1314
14:30:24.137085 IP 10.8.0.7.54708 > 45.113.130.149.1935: Flags [.], seq 88614:89928, ack 0, win 501, options [nop,nop,TS val 2943366341 ecr 3721786563], length 1314
14:30:24.149643 IP 45.113.130.149.1935 > 10.8.0.7.54708: Flags [.], ack 79946, win 126, options [nop,nop,TS val 3721786653 ecr 2943365975], length 0
14:30:24.179847 IP 10.8.0.7.54708 > 45.113.130.149.1935: Flags [.], seq 89928:91242, ack 0, win 501, options [nop,nop,TS val 2943366384 ecr 3721786653], length 1314
14:30:24.240019 IP 10.8.0.7.54708 > 45.113.130.149.1935: Flags [.], seq 91242:92556, ack 0, win 501, options [nop,nop,TS val 2943366444 ecr 3721786653], length 1314
14:30:24.245458 IP 45.113.130.149.1935 > 10.8.0.7.54708: Flags [.], ack 82574, win 126, options [nop,nop,TS val 3721786750 ecr 2943366045], length 0
14:30:24.273559 IP 10.8.0.7.54708 > 45.113.130.149.1935: Flags [.], seq 92556:93870, ack 0, win 501, options [nop,nop,TS val 2943366478 ecr 3721786750], length 1314
14:30:24.308382 IP 10.8.0.7.54708 > 45.113.130.149.1935: Flags [.], seq 93870:95184, ack 0, win 501, options [nop,nop,TS val 2943366513 ecr 3721786750], length 1314
14:30:24.319083 IP 45.113.130.149.1935 > 10.8.0.7.54708: Flags [.], ack 85202, win 126, options [nop,nop,TS val 3721786823 ecr 2943366145], length 0
14:30:24.372326 IP 10.8.0.7.54708 > 45.113.130.149.1935: Flags [.], seq 95184:96498, ack 0, win 501, options [nop,nop,TS val 2943366577 ecr 3721786823], length 1314
14:30:24.402525 IP 45.113.130.149.1935 > 10.8.0.7.54708: Flags [.], ack 87300, win 126, options [nop,nop,TS val 3721786907 ecr 2943366245], length 0
14:30:24.402567 IP 10.8.0.7.54708 > 45.113.130.149.1935: Flags [P.], seq 96498:97299, ack 0, win 501, options [nop,nop,TS val 2943366607 ecr 3721786907], length 801
14:30:24.436716 IP 10.8.0.7.54708 > 45.113.130.149.1935: Flags [.], seq 97299:98613, ack 0, win 501, options [nop,nop,TS val 2943366641 ecr 3721786907], length 1314
14:30:24.470444 IP 10.8.0.7.54708 > 45.113.130.149.1935: Flags [.], seq 98613:99927, ack 0, win 501, options [nop,nop,TS val 2943366675 ecr 3721786907], length 1314
14:30:24.481799 IP 45.113.130.149.1935 > 10.8.0.7.54708: Flags [.], ack 89928, win 126, options [nop,nop,TS val 3721786986 ecr 2943366311], length 0
14:30:24.521579 IP 10.8.0.7.54708 > 45.113.130.149.1935: Flags [.], seq 99927:101241, ack 0, win 501, options [nop,nop,TS val 2943366726 ecr 3721786986], length 1314
14:30:24.573372 IP 10.8.0.7.54708 > 45.113.130.149.1935: Flags [.], seq 101241:102555, ack 0, win 501, options [nop,nop,TS val 2943366778 ecr 3721786986], length 1314
14:30:24.584954 IP 45.113.130.149.1935 > 10.8.0.7.54708: Flags [.], ack 92556, win 126, options [nop,nop,TS val 3721787089 ecr 2943366384], length 0
14:30:24.606556 IP 10.8.0.7.54708 > 45.113.130.149.1935: Flags [.], seq 102555:103869, ack 0, win 501, options [nop,nop,TS val 2943366811 ecr 3721787089], length 1314
14:30:24.649950 IP 10.8.0.7.54708 > 45.113.130.149.1935: Flags [.], seq 103869:105183, ack 0, win 501, options [nop,nop,TS val 2943366854 ecr 3721787089], length 1314
14:30:24.654174 IP 45.113.130.149.1935 > 10.8.0.7.54708: Flags [.], ack 95184, win 126, options [nop,nop,TS val 3721787158 ecr 2943366478], length 0
14:30:24.703084 IP 10.8.0.7.54708 > 45.113.130.149.1935: Flags [.], seq 105183:106497, ack 0, win 501, options [nop,nop,TS val 2943366907 ecr 3721787158], length 1314
14:30:24.735056 IP 10.8.0.7.54708 > 45.113.130.149.1935: Flags [.], seq 106497:107811, ack 0, win 501, options [nop,nop,TS val 2943366939 ecr 3721787158], length 1314
14:30:24.748055 IP 45.113.130.149.1935 > 10.8.0.7.54708: Flags [.], ack 97299, win 126, options [nop,nop,TS val 3721787252 ecr 2943366577], length 0
14:30:24.748094 IP 10.8.0.7.54708 > 45.113.130.149.1935: Flags [P.], seq 107811:108129, ack 0, win 501, options [nop,nop,TS val 2943366952 ecr 3721787252], length 318
14:30:24.802745 IP 10.8.0.7.54708 > 45.113.130.149.1935: Flags [.], seq 108129:109443, ack 0, win 501, options [nop,nop,TS val 2943367007 ecr 3721787252], length 1314
14:30:24.815232 IP 45.113.130.149.1935 > 10.8.0.7.54708: Flags [.], ack 99927, win 126, options [nop,nop,TS val 3721787320 ecr 2943366641], length 0
14:30:24.837707 IP 10.8.0.7.54708 > 45.113.130.149.1935: Flags [.], seq 109443:110757, ack 0, win 501, options [nop,nop,TS val 2943367042 ecr 3721787320], length 1314
14:30:24.873564 IP 10.8.0.7.54708 > 45.113.130.149.1935: Flags [.], seq 110757:112071, ack 0, win 501, options [nop,nop,TS val 2943367078 ecr 3721787320], length 1314
14:30:24.918813 IP 45.113.130.149.1935 > 10.8.0.7.54708: Flags [.], ack 102555, win 126, options [nop,nop,TS val 3721787423 ecr 2943366726], length 0
14:30:24.940028 IP 10.8.0.7.54708 > 45.113.130.149.1935: Flags [.], seq 112071:113385, ack 0, win 501, options [nop,nop,TS val 2943367144 ecr 3721787423], length 1314
14:30:24.970269 IP 10.8.0.7.54708 > 45.113.130.149.1935: Flags [.], seq 113385:114699, ack 0, win 501, options [nop,nop,TS val 2943367175 ecr 3721787423], length 1314
14:30:24.993806 IP 45.113.130.149.1935 > 10.8.0.7.54708: Flags [.], ack 105183, win 126, options [nop,nop,TS val 3721787499 ecr 2943366811], length 0
14:30:25.004522 IP 10.8.0.7.54708 > 45.113.130.149.1935: Flags [.], seq 114699:116013, ack 0, win 501, options [nop,nop,TS val 2943367209 ecr 3721787499], length 1314
14:30:25.073533 IP 10.8.0.7.54708 > 45.113.130.149.1935: Flags [.], seq 116013:117327, ack 0, win 501, options [nop,nop,TS val 2943367278 ecr 3721787499], length 1314
14:30:25.079080 IP 45.113.130.149.1935 > 10.8.0.7.54708: Flags [.], ack 107811, win 126, options [nop,nop,TS val 3721787584 ecr 2943366907], length 0
14:30:25.091854 IP 45.113.130.149.1935 > 10.8.0.7.54708: Flags [.], ack 108129, win 126, options [nop,nop,TS val 3721787597 ecr 2943366952], length 0
14:30:25.091870 IP 10.8.0.7.54708 > 45.113.130.149.1935: Flags [P.], seq 117327:118123, ack 0, win 501, options [nop,nop,TS val 2943367296 ecr 3721787597], length 796
14:30:25.138334 IP 10.8.0.7.54708 > 45.113.130.149.1935: Flags [.], seq 118123:119437, ack 0, win 501, options [nop,nop,TS val 2943367343 ecr 3721787597], length 1314
14:30:25.172477 IP 10.8.0.7.54708 > 45.113.130.149.1935: Flags [.], seq 119437:120751, ack 0, win 501, options [nop,nop,TS val 2943367377 ecr 3721787597], length 1314
14:30:25.181662 IP 45.113.130.149.1935 > 10.8.0.7.54708: Flags [.], ack 110757, win 126, options [nop,nop,TS val 3721787686 ecr 2943367007], length 0
14:30:25.205028 IP 10.8.0.7.54708 > 45.113.130.149.1935: Flags [.], seq 120751:122065, ack 0, win 501, options [nop,nop,TS val 2943367409 ecr 3721787686], length 1314
14:30:25.269032 IP 10.8.0.7.54708 > 45.113.130.149.1935: Flags [.], seq 122065:123379, ack 0, win 501, options [nop,nop,TS val 2943367473 ecr 3721787686], length 1314
14:30:25.284655 IP 45.113.130.149.1935 > 10.8.0.7.54708: Flags [.], ack 113385, win 126, options [nop,nop,TS val 3721787789 ecr 2943367078], length 0
14:30:25.306968 IP 10.8.0.7.54708 > 45.113.130.149.1935: Flags [.], seq 123379:124693, ack 0, win 501, options [nop,nop,TS val 2943367511 ecr 3721787789], length 1314
14:30:25.337699 IP 10.8.0.7.54708 > 45.113.130.149.1935: Flags [.], seq 124693:126007, ack 0, win 501, options [nop,nop,TS val 2943367542 ecr 3721787789], length 1314
14:30:25.348890 IP 45.113.130.149.1935 > 10.8.0.7.54708: Flags [.], ack 116013, win 126, options [nop,nop,TS val 3721787854 ecr 2943367175], length 0
14:30:25.405811 IP 10.8.0.7.54708 > 45.113.130.149.1935: Flags [.], seq 126007:127321, ack 0, win 501, options [nop,nop,TS val 2943367610 ecr 3721787854], length 1314
14:30:25.436122 IP 45.113.130.149.1935 > 10.8.0.7.54708: Flags [.], ack 118123, win 126, options [nop,nop,TS val 3721787941 ecr 2943367278], length 0
14:30:25.436160 IP 10.8.0.7.54708 > 45.113.130.149.1935: Flags [P.], seq 127321:128116, ack 0, win 501, options [nop,nop,TS val 2943367640 ecr 3721787941], length 795
14:30:25.469436 IP 10.8.0.7.54708 > 45.113.130.149.1935: Flags [.], seq 128116:129430, ack 0, win 501, options [nop,nop,TS val 2943367674 ecr 3721787941], length 1314
14:30:25.503386 IP 10.8.0.7.54708 > 45.113.130.149.1935: Flags [.], seq 129430:130744, ack 0, win 501, options [nop,nop,TS val 2943367708 ecr 3721787941], length 1314
14:30:25.517695 IP 45.113.130.149.1935 > 10.8.0.7.54708: Flags [.], ack 120751, win 126, options [nop,nop,TS val 3721788021 ecr 2943367343], length 0
14:30:25.547163 IP 10.8.0.7.54708 > 45.113.130.149.1935: Flags [.], seq 130744:132058, ack 0, win 501, options [nop,nop,TS val 2943367751 ecr 3721788021], length 1314
14:30:25.602712 IP 10.8.0.7.54708 > 45.113.130.149.1935: Flags [.], seq 132058:133372, ack 0, win 501, options [nop,nop,TS val 2943367807 ecr 3721788021], length 1314
14:30:25.613899 IP 45.113.130.149.1935 > 10.8.0.7.54708: Flags [.], ack 123379, win 126, options [nop,nop,TS val 3721788118 ecr 2943367409], length 0
14:30:25.636530 IP 10.8.0.7.54708 > 45.113.130.149.1935: Flags [.], seq 133372:134686, ack 0, win 501, options [nop,nop,TS val 2943367841 ecr 3721788118], length 1314
14:30:25.675097 IP 10.8.0.7.54708 > 45.113.130.149.1935: Flags [.], seq 134686:136000, ack 0, win 501, options [nop,nop,TS val 2943367879 ecr 3721788118], length 1314
14:30:25.682890 IP 45.113.130.149.1935 > 10.8.0.7.54708: Flags [.], ack 126007, win 126, options [nop,nop,TS val 3721788187 ecr 2943367511], length 0
14:30:25.736055 IP 10.8.0.7.54708 > 45.113.130.149.1935: Flags [.], seq 136000:137314, ack 0, win 501, options [nop,nop,TS val 2943367940 ecr 3721788187], length 1314
14:30:25.769770 IP 10.8.0.7.54708 > 45.113.130.149.1935: Flags [.], seq 137314:138628, ack 0, win 501, options [nop,nop,TS val 2943367974 ecr 3721788187], length 1314
14:30:25.780915 IP 45.113.130.149.1935 > 10.8.0.7.54708: Flags [.], ack 128116, win 126, options [nop,nop,TS val 3721788286 ecr 2943367610], length 0
14:30:25.780931 IP 10.8.0.7.54708 > 45.113.130.149.1935: Flags [P.], seq 138628:138953, ack 0, win 501, options [nop,nop,TS val 2943367985 ecr 3721788286], length 325
14:30:25.840160 IP 10.8.0.7.54708 > 45.113.130.149.1935: Flags [.], seq 138953:140267, ack 0, win 501, options [nop,nop,TS val 2943368044 ecr 3721788286], length 1314
14:30:25.848094 IP 45.113.130.149.1935 > 10.8.0.7.54708: Flags [.], ack 130744, win 126, options [nop,nop,TS val 3721788353 ecr 2943367674], length 0
14:30:25.871728 IP 10.8.0.7.54708 > 45.113.130.149.1935: Flags [.], seq 140267:141581, ack 0, win 501, options [nop,nop,TS val 2943368076 ecr 3721788353], length 1314
14:30:25.905320 IP 10.8.0.7.54708 > 45.113.130.149.1935: Flags [.], seq 141581:142895, ack 0, win 501, options [nop,nop,TS val 2943368110 ecr 3721788353], length 1314
14:30:25.946965 IP 45.113.130.149.1935 > 10.8.0.7.54708: Flags [.], ack 133372, win 126, options [nop,nop,TS val 3721788452 ecr 2943367751], length 0
14:30:25.973595 IP 10.8.0.7.54708 > 45.113.130.149.1935: Flags [.], seq 142895:144209, ack 0, win 501, options [nop,nop,TS val 2943368178 ecr 3721788452], length 1314
14:30:26.006578 IP 10.8.0.7.54708 > 45.113.130.149.1935: Flags [.], seq 144209:145523, ack 0, win 501, options [nop,nop,TS val 2943368211 ecr 3721788452], length 1314
14:30:26.019252 IP 45.113.130.149.1935 > 10.8.0.7.54708: Flags [.], ack 136000, win 126, options [nop,nop,TS val 3721788524 ecr 2943367841], length 0
14:30:26.037509 IP 10.8.0.7.54708 > 45.113.130.149.1935: Flags [.], seq 145523:146837, ack 0, win 501, options [nop,nop,TS val 2943368242 ecr 3721788524], length 1314
14:30:26.105852 IP 10.8.0.7.54708 > 45.113.130.149.1935: Flags [.], seq 146837:148151, ack 0, win 501, options [nop,nop,TS val 2943368310 ecr 3721788524], length 1314
14:30:26.114049 IP 45.113.130.149.1935 > 10.8.0.7.54708: Flags [.], ack 138628, win 126, options [nop,nop,TS val 3721788619 ecr 2943367940], length 0
14:30:26.125662 IP 45.113.130.149.1935 > 10.8.0.7.54708: Flags [.], ack 138953, win 126, options [nop,nop,TS val 3721788630 ecr 2943367985], length 0
14:30:26.125689 IP 10.8.0.7.54708 > 45.113.130.149.1935: Flags [P.], seq 148151:149044, ack 0, win 501, options [nop,nop,TS val 2943368330 ecr 3721788630], length 893
14:30:26.171952 IP 10.8.0.7.54708 > 45.113.130.149.1935: Flags [.], seq 149044:150358, ack 0, win 501, options [nop,nop,TS val 2943368376 ecr 3721788630], length 1314
14:30:26.205883 IP 10.8.0.7.54708 > 45.113.130.149.1935: Flags [.], seq 150358:151672, ack 0, win 501, options [nop,nop,TS val 2943368410 ecr 3721788630], length 1314
14:30:26.217332 IP 45.113.130.149.1935 > 10.8.0.7.54708: Flags [.], ack 141581, win 126, options [nop,nop,TS val 3721788721 ecr 2943368044], length 0
14:30:26.253056 IP 10.8.0.7.54708 > 45.113.130.149.1935: Flags [.], seq 151672:152986, ack 0, win 501, options [nop,nop,TS val 2943368457 ecr 3721788721], length 1314
14:30:26.304224 IP 10.8.0.7.54708 > 45.113.130.149.1935: Flags [.], seq 152986:154300, ack 0, win 501, options [nop,nop,TS val 2943368509 ecr 3721788721], length 1314
14:30:26.315340 IP 45.113.130.149.1935 > 10.8.0.7.54708: Flags [.], ack 142895, win 126, options [nop,nop,TS val 3721788820 ecr 2943368110], length 0
14:30:26.338484 IP 10.8.0.7.54708 > 45.113.130.149.1935: Flags [.], seq 154300:155614, ack 0, win 501, options [nop,nop,TS val 2943368543 ecr 3721788820], length 1314
14:30:26.351558 IP 45.113.130.149.1935 > 10.8.0.7.54708: Flags [.], ack 145523, win 126, options [nop,nop,TS val 3721788856 ecr 2943368178], length 0
14:30:26.381098 IP 10.8.0.7.54708 > 45.113.130.149.1935: Flags [.], seq 155614:156928, ack 0, win 501, options [nop,nop,TS val 2943368585 ecr 3721788856], length 1314
14:30:26.436802 IP 10.8.0.7.54708 > 45.113.130.149.1935: Flags [.], seq 156928:158242, ack 0, win 501, options [nop,nop,TS val 2943368641 ecr 3721788856], length 1314
14:30:26.449877 IP 45.113.130.149.1935 > 10.8.0.7.54708: Flags [.], ack 148151, win 126, options [nop,nop,TS val 3721788955 ecr 2943368242], length 0
14:30:26.469724 IP 45.113.130.149.1935 > 10.8.0.7.54708: Flags [.], ack 149044, win 126, options [nop,nop,TS val 3721788975 ecr 2943368330], length 0
14:30:26.469762 IP 10.8.0.7.54708 > 45.113.130.149.1935: Flags [P.], seq 158242:159026, ack 0, win 501, options [nop,nop,TS val 2943368674 ecr 3721788975], length 784
14:30:26.507009 IP 10.8.0.7.54708 > 45.113.130.149.1935: Flags [.], seq 159026:160340, ack 0, win 501, options [nop,nop,TS val 2943368711 ecr 3721788975], length 1314
14:30:26.540344 IP 10.8.0.7.54708 > 45.113.130.149.1935: Flags [.], seq 160340:161654, ack 0, win 501, options [nop,nop,TS val 2943368745 ecr 3721788975], length 1314
14:30:26.550117 IP 45.113.130.149.1935 > 10.8.0.7.54708: Flags [.], ack 151672, win 126, options [nop,nop,TS val 3721789055 ecr 2943368376], length 0
14:30:26.595287 IP 10.8.0.7.54708 > 45.113.130.149.1935: Flags [.], seq 161654:162968, ack 0, win 501, options [nop,nop,TS val 2943368800 ecr 3721789055], length 1314
14:30:26.638506 IP 10.8.0.7.54708 > 45.113.130.149.1935: Flags [.], seq 162968:164282, ack 0, win 501, options [nop,nop,TS val 2943368843 ecr 3721789055], length 1314
14:30:26.648570 IP 45.113.130.149.1935 > 10.8.0.7.54708: Flags [.], ack 154300, win 126, options [nop,nop,TS val 3721789153 ecr 2943368457], length 0
14:30:26.659697 IP 10.8.0.7.54708 > 45.113.130.149.1935: Flags [.], seq 164282:165596, ack 0, win 501, options [nop,nop,TS val 2943368864 ecr 3721789153], length 1314
14:30:26.703297 IP 10.8.0.7.54708 > 45.113.130.149.1935: Flags [.], seq 165596:166910, ack 0, win 501, options [nop,nop,TS val 2943368908 ecr 3721789153], length 1314
14:30:26.725563 IP 45.113.130.149.1935 > 10.8.0.7.54708: Flags [.], ack 156928, win 126, options [nop,nop,TS val 3721789230 ecr 2943368543], length 0
14:30:26.766680 IP 10.8.0.7.54708 > 45.113.130.149.1935: Flags [.], seq 166910:168224, ack 0, win 501, options [nop,nop,TS val 2943368971 ecr 3721789230], length 1314
14:30:26.788127 IP 10.8.0.7.54708 > 45.113.130.149.1935: Flags [.], seq 168224:169538, ack 0, win 501, options [nop,nop,TS val 2943368992 ecr 3721789230], length 1314
14:30:26.813699 IP 45.113.130.149.1935 > 10.8.0.7.54708: Flags [.], ack 159026, win 126, options [nop,nop,TS val 3721789318 ecr 2943368641], length 0
14:30:26.813739 IP 10.8.0.7.54708 > 45.113.130.149.1935: Flags [P.], seq 169538:169968, ack 0, win 501, options [nop,nop,TS val 2943369018 ecr 3721789318], length 430
14:30:26.852437 IP 10.8.0.7.54708 > 45.113.130.149.1935: Flags [.], seq 169968:171282, ack 0, win 501, options [nop,nop,TS val 2943369057 ecr 3721789318], length 1314
14:30:26.885977 IP 45.113.130.149.1935 > 10.8.0.7.54708: Flags [.], ack 161654, win 126, options [nop,nop,TS val 3721789389 ecr 2943368711], length 0
14:30:26.895335 IP 10.8.0.7.54708 > 45.113.130.149.1935: Flags [.], seq 171282:172596, ack 0, win 501, options [nop,nop,TS val 2943369100 ecr 3721789389], length 1314
14:30:26.941447 IP 10.8.0.7.54708 > 45.113.130.149.1935: Flags [.], seq 172596:173910, ack 0, win 501, options [nop,nop,TS val 2943369146 ecr 3721789389], length 1314
14:30:26.983410 IP 45.113.130.149.1935 > 10.8.0.7.54708: Flags [.], ack 164282, win 126, options [nop,nop,TS val 3721789487 ecr 2943368800], length 0
14:30:27.002834 IP 10.8.0.7.54708 > 45.113.130.149.1935: Flags [.], seq 173910:175224, ack 0, win 501, options [nop,nop,TS val 2943369207 ecr 3721789487], length 1314
14:30:27.024310 IP 10.8.0.7.54708 > 45.113.130.149.1935: Flags [.], seq 175224:176538, ack 0, win 501, options [nop,nop,TS val 2943369229 ecr 3721789487], length 1314
14:30:27.048518 IP 45.113.130.149.1935 > 10.8.0.7.54708: Flags [.], ack 166910, win 126, options [nop,nop,TS val 3721789553 ecr 2943368864], length 0
14:30:27.071871 IP 10.8.0.7.54708 > 45.113.130.149.1935: Flags [.], seq 176538:177852, ack 0, win 501, options [nop,nop,TS val 2943369276 ecr 3721789553], length 1314
14:30:27.131091 IP 10.8.0.7.54708 > 45.113.130.149.1935: Flags [.], seq 177852:179166, ack 0, win 501, options [nop,nop,TS val 2943369335 ecr 3721789553], length 1314
14:30:27.133112 IP 45.113.130.149.1935 > 10.8.0.7.54708: Flags [.], ack 169538, win 126, options [nop,nop,TS val 3721789637 ecr 2943368971], length 0
14:30:27.158393 IP 45.113.130.149.1935 > 10.8.0.7.54708: Flags [.], ack 169968, win 126, options [nop,nop,TS val 3721789663 ecr 2943369018], length 0
14:30:27.158429 IP 10.8.0.7.54708 > 45.113.130.149.1935: Flags [P.], seq 179166:179950, ack 0, win 501, options [nop,nop,TS val 2943369363 ecr 3721789663], length 784
14:30:27.195505 IP 10.8.0.7.54708 > 45.113.130.149.1935: Flags [.], seq 179950:181264, ack 0, win 501, options [nop,nop,TS val 2943369400 ecr 3721789663], length 1314
14:30:27.238455 IP 10.8.0.7.54708 > 45.113.130.149.1935: Flags [.], seq 181264:182578, ack 0, win 501, options [nop,nop,TS val 2943369443 ecr 3721789663], length 1314
14:30:27.240560 IP 45.113.130.149.1935 > 10.8.0.7.54708: Flags [.], ack 172596, win 126, options [nop,nop,TS val 3721789745 ecr 2943369057], length 0
14:30:27.281344 IP 10.8.0.7.54708 > 45.113.130.149.1935: Flags [.], seq 182578:183892, ack 0, win 501, options [nop,nop,TS val 2943369486 ecr 3721789745], length 1314
14:30:27.324160 IP 10.8.0.7.54708 > 45.113.130.149.1935: Flags [.], seq 183892:185206, ack 0, win 501, options [nop,nop,TS val 2943369528 ecr 3721789745], length 1314
14:30:27.348060 IP 45.113.130.149.1935 > 10.8.0.7.54708: Flags [.], ack 175224, win 126, options [nop,nop,TS val 3721789853 ecr 2943369146], length 0
14:30:27.366766 IP 10.8.0.7.54708 > 45.113.130.149.1935: Flags [.], seq 185206:186520, ack 0, win 501, options [nop,nop,TS val 2943369571 ecr 3721789853], length 1314
14:30:27.409538 IP 10.8.0.7.54708 > 45.113.130.149.1935: Flags [.], seq 186520:187834, ack 0, win 501, options [nop,nop,TS val 2943369614 ecr 3721789853], length 1314
14:30:27.415923 IP 45.113.130.149.1935 > 10.8.0.7.54708: Flags [.], ack 177852, win 126, options [nop,nop,TS val 3721789921 ecr 2943369229], length 0
14:30:27.474124 IP 10.8.0.7.54708 > 45.113.130.149.1935: Flags [.], seq 187834:189148, ack 0, win 501, options [nop,nop,TS val 2943369678 ecr 3721789921], length 1314
14:30:27.495583 IP 10.8.0.7.54708 > 45.113.130.149.1935: Flags [.], seq 189148:190462, ack 0, win 501, options [nop,nop,TS val 2943369700 ecr 3721789921], length 1314
14:30:27.502441 IP 45.113.130.149.1935 > 10.8.0.7.54708: Flags [.], ack 179950, win 126, options [nop,nop,TS val 3721790007 ecr 2943369335], length 0
14:30:27.502488 IP 10.8.0.7.54708 > 45.113.130.149.1935: Flags [P.], seq 190462:190702, ack 0, win 501, options [nop,nop,TS val 2943369707 ecr 3721790007], length 240
14:30:27.559443 IP 10.8.0.7.54708 > 45.113.130.149.1935: Flags [.], seq 190702:192016, ack 0, win 501, options [nop,nop,TS val 2943369764 ecr 3721790007], length 1314
14:30:27.582630 IP 45.113.130.149.1935 > 10.8.0.7.54708: Flags [.], ack 182578, win 126, options [nop,nop,TS val 3721790087 ecr 2943369400], length 0
14:30:27.602623 IP 10.8.0.7.54708 > 45.113.130.149.1935: Flags [.], seq 192016:193330, ack 0, win 501, options [nop,nop,TS val 2943369807 ecr 3721790087], length 1314
14:30:27.624087 IP 10.8.0.7.54708 > 45.113.130.149.1935: Flags [.], seq 193330:194644, ack 0, win 501, options [nop,nop,TS val 2943369828 ecr 3721790087], length 1314
14:30:27.668141 IP 45.113.130.149.1935 > 10.8.0.7.54708: Flags [.], ack 185206, win 126, options [nop,nop,TS val 3721790173 ecr 2943369486], length 0
14:30:27.706849 IP 10.8.0.7.54708 > 45.113.130.149.1935: Flags [.], seq 194644:195958, ack 0, win 501, options [nop,nop,TS val 2943369911 ecr 3721790173], length 1314
14:30:27.730725 IP 10.8.0.7.54708 > 45.113.130.149.1935: Flags [.], seq 195958:197272, ack 0, win 501, options [nop,nop,TS val 2943369935 ecr 3721790173], length 1314
14:30:27.753768 IP 45.113.130.149.1935 > 10.8.0.7.54708: Flags [.], ack 187834, win 126, options [nop,nop,TS val 3721790259 ecr 2943369571], length 0
14:30:27.770022 IP 10.8.0.7.54708 > 45.113.130.149.1935: Flags [.], seq 197272:198586, ack 0, win 501, options [nop,nop,TS val 2943369974 ecr 3721790259], length 1314
14:30:27.837566 IP 10.8.0.7.54708 > 45.113.130.149.1935: Flags [.], seq 198586:199900, ack 0, win 501, options [nop,nop,TS val 2943370042 ecr 3721790259], length 1314
14:30:27.839868 IP 45.113.130.149.1935 > 10.8.0.7.54708: Flags [.], ack 190462, win 126, options [nop,nop,TS val 3721790345 ecr 2943369678], length 0
14:30:27.846462 IP 45.113.130.149.1935 > 10.8.0.7.54708: Flags [.], ack 190702, win 126, options [nop,nop,TS val 3721790351 ecr 2943369707], length 0
14:30:27.846497 IP 10.8.0.7.54708 > 45.113.130.149.1935: Flags [P.], seq 199900:200784, ack 0, win 501, options [nop,nop,TS val 2943370051 ecr 3721790351], length 884
14:30:27.901886 IP 10.8.0.7.54708 > 45.113.130.149.1935: Flags [.], seq 200784:202098, ack 0, win 501, options [nop,nop,TS val 2943370106 ecr 3721790351], length 1314
14:30:27.923133 IP 10.8.0.7.54708 > 45.113.130.149.1935: Flags [.], seq 202098:203412, ack 0, win 501, options [nop,nop,TS val 2943370127 ecr 3721790351], length 1314
14:30:27.947300 IP 45.113.130.149.1935 > 10.8.0.7.54708: Flags [.], ack 193330, win 126, options [nop,nop,TS val 3721790452 ecr 2943369764], length 0
14:30:27.973519 IP 10.8.0.7.54708 > 45.113.130.149.1935: Flags [.], seq 203412:204726, ack 0, win 501, options [nop,nop,TS val 2943370178 ecr 3721790452], length 1314
14:30:28.030137 IP 10.8.0.7.54708 > 45.113.130.149.1935: Flags [.], seq 204726:206040, ack 0, win 501, options [nop,nop,TS val 2943370234 ecr 3721790452], length 1314
14:30:28.031161 IP 45.113.130.149.1935 > 10.8.0.7.54708: Flags [.], ack 194644, win 126, options [nop,nop,TS val 3721790532 ecr 2943369828], length 0
14:30:28.072845 IP 10.8.0.7.54708 > 45.113.130.149.1935: Flags [.], seq 206040:207354, ack 0, win 501, options [nop,nop,TS val 2943370277 ecr 3721790532], length 1314
14:30:28.075398 IP 45.113.130.149.1935 > 10.8.0.7.54708: Flags [.], ack 197272, win 126, options [nop,nop,TS val 3721790580 ecr 2943369911], length 0
14:30:28.106920 IP 10.8.0.7.54708 > 45.113.130.149.1935: Flags [.], seq 207354:208668, ack 0, win 501, options [nop,nop,TS val 2943370311 ecr 3721790580], length 1314
14:30:28.159072 IP 10.8.0.7.54708 > 45.113.130.149.1935: Flags [.], seq 208668:209982, ack 0, win 501, options [nop,nop,TS val 2943370363 ecr 3721790580], length 1314
