22:20:19.254743 IP 10.8.3.3.42138 > 52.223.248.110.1935: Flags [.], seq 3688099682:3688100996, ack 769494946, win 501, options [nop,nop,TS val 1193313757 ecr 2768272216], length 1314
22:20:19.257423 IP 52.223.248.110.1935 > 10.8.3.3.42138: Flags [.], ack 4294954665, win 129, options [nop,nop,TS val 2768272284 ecr 1193313253], length 0
22:20:19.319673 IP 10.8.3.3.42138 > 52.223.248.110.1935: Flags [.], seq 1314:2628, ack 1, win 501, options [nop,nop,TS val 1193313822 ecr 2768272284], length 1314
22:20:19.355897 IP 10.8.3.3.42138 > 52.223.248.110.1935: Flags [.], seq 2628:3942, ack 1, win 501, options [nop,nop,TS val 1193313859 ecr 2768272284], length 1314
22:20:19.359917 IP 52.223.248.110.1935 > 10.8.3.3.42138: Flags [.], ack 4294957293, win 129, options [nop,nop,TS val 2768272387 ecr 1193313357], length 0
22:20:19.384005 IP 10.8.3.3.42138 > 52.223.248.110.1935: Flags [.], seq 3942:5256, ack 1, win 501, options [nop,nop,TS val 1193313887 ecr 2768272387], length 1314
22:20:19.454861 IP 10.8.3.3.42138 > 52.223.248.110.1935: Flags [.], seq 5256:6570, ack 1, win 501, options [nop,nop,TS val 1193313958 ecr 2768272387], length 1314
22:20:19.458996 IP 52.223.248.110.1935 > 10.8.3.3.42138: Flags [.], ack 4294958607, win 129, options [nop,nop,TS val 2768272485 ecr 1193313424], length 0
22:20:19.467558 IP 52.223.248.110.1935 > 10.8.3.3.42138: Flags [.], ack 4294960726, win 129, options [nop,nop,TS val 2768272494 ecr 1193313491], length 0
22:20:19.467595 IP 10.8.3.3.42138 > 52.223.248.110.1935: Flags [P.], seq 6570:7383, ack 1, win 501, options [nop,nop,TS val 1193313970 ecr 2768272494], length 813
22:20:19.517063 IP 10.8.3.3.42138 > 52.223.248.110.1935: Flags [.], seq 7383:8697, ack 1, win 501, options [nop,nop,TS val 1193314020 ecr 2768272494], length 1314
22:20:19.551321 IP 10.8.3.3.42138 > 52.223.248.110.1935: Flags [.], seq 8697:10011, ack 1, win 501, options [nop,nop,TS val 1193314054 ecr 2768272494], length 1314
22:20:19.557349 IP 52.223.248.110.1935 > 10.8.3.3.42138: Flags [.], ack 4294963354, win 129, options [nop,nop,TS val 2768272584 ecr 1193313554], length 0
22:20:19.590163 IP 10.8.3.3.42138 > 52.223.248.110.1935: Flags [.], seq 10011:11325, ack 1, win 501, options [nop,nop,TS val 1193314093 ecr 2768272584], length 1314
22:20:19.653711 IP 10.8.3.3.42138 > 52.223.248.110.1935: Flags [.], seq 11325:12639, ack 1, win 501, options [nop,nop,TS val 1193314156 ecr 2768272584], length 1314
22:20:19.658882 IP 52.223.248.110.1935 > 10.8.3.3.42138: Flags [.], ack 4294965982, win 129, options [nop,nop,TS val 2768272686 ecr 1193313623], length 0
22:20:19.685226 IP 10.8.3.3.42138 > 52.223.248.110.1935: Flags [.], seq 12639:13953, ack 1, win 501, options [nop,nop,TS val 1193314188 ecr 2768272686], length 1314
22:20:19.719232 IP 10.8.3.3.42138 > 52.223.248.110.1935: Flags [.], seq 13953:15267, ack 1, win 501, options [nop,nop,TS val 1193314222 ecr 2768272686], length 1314
22:20:19.726770 IP 52.223.248.110.1935 > 10.8.3.3.42138: Flags [.], ack 1314, win 129, options [nop,nop,TS val 2768272753 ecr 1193313724], length 0
22:20:19.784469 IP 10.8.3.3.42138 > 52.223.248.110.1935: Flags [.], seq 15267:16581, ack 1, win 501, options [nop,nop,TS val 1193314287 ecr 2768272753], length 1314
22:20:19.817288 IP 10.8.3.3.42138 > 52.223.248.110.1935: Flags [.], seq 16581:17895, ack 1, win 501, options [nop,nop,TS val 1193314320 ecr 2768272753], length 1314
22:20:19.827738 IP 52.223.248.110.1935 > 10.8.3.3.42138: Flags [.], ack 3942, win 129, options [nop,nop,TS val 2768272854 ecr 1193313822], length 0
22:20:19.850730 IP 10.8.3.3.42138 > 52.223.248.110.1935: Flags [.], seq 17895:19209, ack 1, win 501, options [nop,nop,TS val 1193314353 ecr 2768272854], length 1314
22:20:19.917473 IP 10.8.3.3.42138 > 52.223.248.110.1935: Flags [.], seq 19209:20523, ack 1, win 501, options [nop,nop,TS val 1193314420 ecr 2768272854], length 1314
22:20:19.926797 IP 52.223.248.110.1935 > 10.8.3.3.42138: Flags [.], ack 6570, win 129, options [nop,nop,TS val 2768272953 ecr 1193313887], length 0
22:20:19.939133 IP 52.223.248.110.1935 > 10.8.3.3.42138: Flags [.], ack 7383, win 129, options [nop,nop,TS val 2768272966 ecr 1193313970], length 0
22:20:19.939142 IP 10.8.3.3.42138 > 52.223.248.110.1935: Flags [P.], seq 20523:21330, ack 1, win 501, options [nop,nop,TS val 1193314442 ecr 2768272966], length 807
22:20:19.983858 IP 10.8.3.3.42138 > 52.223.248.110.1935: Flags [.], seq 21330:22644, ack 1, win 501, options [nop,nop,TS val 1193314487 ecr 2768272966], length 1314
22:20:20.018021 IP 10.8.3.3.42138 > 52.223.248.110.1935: Flags [.], seq 22644:23958, ack 1, win 501, options [nop,nop,TS val 1193314521 ecr 2768272966], length 1314
22:20:20.023933 IP 52.223.248.110.1935 > 10.8.3.3.42138: Flags [.], ack 10011, win 129, options [nop,nop,TS val 2768273050 ecr 1193314020], length 0
22:20:20.056935 IP 10.8.3.3.42138 > 52.223.248.110.1935: Flags [.], seq 23958:25272, ack 1, win 501, options [nop,nop,TS val 1193314560 ecr 2768273050], length 1314
22:20:20.120554 IP 10.8.3.3.42138 > 52.223.248.110.1935: Flags [.], seq 25272:26586, ack 1, win 501, options [nop,nop,TS val 1193314623 ecr 2768273050], length 1314
22:20:20.125607 IP 52.223.248.110.1935 > 10.8.3.3.42138: Flags [.], ack 12639, win 129, options [nop,nop,TS val 2768273152 ecr 1193314093], length 0
22:20:20.155282 IP 10.8.3.3.42138 > 52.223.248.110.1935: Flags [.], seq 26586:27900, ack 1, win 501, options [nop,nop,TS val 1193314658 ecr 2768273152], length 1314
22:20:20.188366 IP 10.8.3.3.42138 > 52.223.248.110.1935: Flags [.], seq 27900:29214, ack 1, win 501, options [nop,nop,TS val 1193314691 ecr 2768273152], length 1314
22:20:20.190997 IP 52.223.248.110.1935 > 10.8.3.3.42138: Flags [.], ack 15267, win 129, options [nop,nop,TS val 2768273218 ecr 1193314188], length 0
22:20:20.254887 IP 10.8.3.3.42138 > 52.223.248.110.1935: Flags [.], seq 29214:30528, ack 1, win 501, options [nop,nop,TS val 1193314758 ecr 2768273218], length 1314
22:20:20.285675 IP 10.8.3.3.42138 > 52.223.248.110.1935: Flags [.], seq 30528:31842, ack 1, win 501, options [nop,nop,TS val 1193314788 ecr 2768273218], length 1314
22:20:20.288990 IP 52.223.248.110.1935 > 10.8.3.3.42138: Flags [.], ack 17895, win 129, options [nop,nop,TS val 2768273316 ecr 1193314287], length 0
22:20:20.317271 IP 10.8.3.3.42138 > 52.223.248.110.1935: Flags [.], seq 31842:33156, ack 1, win 501, options [nop,nop,TS val 1193314820 ecr 2768273316], length 1314
22:20:20.385630 IP 10.8.3.3.42138 > 52.223.248.110.1935: Flags [.], seq 33156:34470, ack 1, win 501, options [nop,nop,TS val 1193314888 ecr 2768273316], length 1314
22:20:20.389278 IP 52.223.248.110.1935 > 10.8.3.3.42138: Flags [.], ack 20523, win 129, options [nop,nop,TS val 2768273416 ecr 1193314353], length 0
22:20:20.410815 IP 52.223.248.110.1935 > 10.8.3.3.42138: Flags [.], ack 21330, win 129, options [nop,nop,TS val 2768273437 ecr 1193314442], length 0
22:20:20.410849 IP 10.8.3.3.42138 > 52.223.248.110.1935: Flags [P.], seq 34470:35275, ack 1, win 501, options [nop,nop,TS val 1193314914 ecr 2768273437], length 805
22:20:20.450437 IP 10.8.3.3.42138 > 52.223.248.110.1935: Flags [.], seq 35275:36589, ack 1, win 501, options [nop,nop,TS val 1193314953 ecr 2768273437], length 1314
22:20:20.483619 IP 10.8.3.3.42138 > 52.223.248.110.1935: Flags [.], seq 36589:37903, ack 1, win 501, options [nop,nop,TS val 1193314986 ecr 2768273437], length 1314
22:20:20.494155 IP 52.223.248.110.1935 > 10.8.3.3.42138: Flags [.], ack 23958, win 129, options [nop,nop,TS val 2768273521 ecr 1193314487], length 0
22:20:20.526253 IP 10.8.3.3.42138 > 52.223.248.110.1935: Flags [.], seq 37903:39217, ack 1, win 501, options [nop,nop,TS val 1193315029 ecr 2768273521], length 1314
22:20:20.587158 IP 10.8.3.3.42138 > 52.223.248.110.1935: Flags [.], seq 39217:40531, ack 1, win 501, options [nop,nop,TS val 1193315090 ecr 2768273521], length 1314
22:20:20.592250 IP 52.223.248.110.1935 > 10.8.3.3.42138: Flags [.], ack 26586, win 129, options [nop,nop,TS val 2768273619 ecr 1193314560], length 0
22:20:20.619985 IP 10.8.3.3.42138 > 52.223.248.110.1935: Flags [.], seq 40531:41845, ack 1, win 501, options [nop,nop,TS val 1193315123 ecr 2768273619], length 1314
22:20:20.654439 IP 10.8.3.3.42138 > 52.223.248.110.1935: Flags [.], seq 41845:43159, ack 1, win 501, options [nop,nop,TS val 1193315157 ecr 2768273619], length 1314
22:20:20.660382 IP 52.223.248.110.1935 > 10.8.3.3.42138: Flags [.], ack 29214, win 129, options [nop,nop,TS val 2768273687 ecr 1193314658], length 0
22:20:20.717990 IP 10.8.3.3.42138 > 52.223.248.110.1935: Flags [.], seq 43159:44473, ack 1, win 501, options [nop,nop,TS val 1193315221 ecr 2768273687], length 1314
22:20:20.750955 IP 10.8.3.3.42138 > 52.223.248.110.1935: Flags [.], seq 44473:45787, ack 1, win 501, options [nop,nop,TS val 1193315254 ecr 2768273687], length 1314
22:20:20.757373 IP 52.223.248.110.1935 > 10.8.3.3.42138: Flags [.], ack 31842, win 129, options [nop,nop,TS val 2768273784 ecr 1193314758], length 0
22:20:20.785132 IP 10.8.3.3.42138 > 52.223.248.110.1935: Flags [.], seq 45787:47101, ack 1, win 501, options [nop,nop,TS val 1193315288 ecr 2768273784], length 1314
22:20:20.850504 IP 10.8.3.3.42138 > 52.223.248.110.1935: Flags [.], seq 47101:48415, ack 1, win 501, options [nop,nop,TS val 1193315353 ecr 2768273784], length 1314
22:20:20.857619 IP 52.223.248.110.1935 > 10.8.3.3.42138: Flags [.], ack 34470, win 129, options [nop,nop,TS val 2768273884 ecr 1193314820], length 0
22:20:20.882800 IP 52.223.248.110.1935 > 10.8.3.3.42138: Flags [.], ack 35275, win 129, options [nop,nop,TS val 2768273909 ecr 1193314914], length 0
22:20:20.882821 IP 10.8.3.3.42138 > 52.223.248.110.1935: Flags [P.], seq 48415:49235, ack 1, win 501, options [nop,nop,TS val 1193315386 ecr 2768273909], length 820
22:20:20.921421 IP 10.8.3.3.42138 > 52.223.248.110.1935: Flags [.], seq 49235:50549, ack 1, win 501, options [nop,nop,TS val 1193315424 ecr 2768273909], length 1314
22:20:20.956053 IP 52.223.248.110.1935 > 10.8.3.3.42138: Flags [.], ack 37903, win 129, options [nop,nop,TS val 2768273982 ecr 1193314953], length 0
22:20:20.956129 IP 10.8.3.3.42138 > 52.223.248.110.1935: Flags [.], seq 50549:51863, ack 1, win 501, options [nop,nop,TS val 1193315459 ecr 2768273982], length 1314
22:20:20.995206 IP 10.8.3.3.42138 > 52.223.248.110.1935: Flags [.], seq 51863:53177, ack 1, win 501, options [nop,nop,TS val 1193315498 ecr 2768273982], length 1314
22:20:21.052232 IP 10.8.3.3.42138 > 52.223.248.110.1935: Flags [.], seq 53177:54491, ack 1, win 501, options [nop,nop,TS val 1193315555 ecr 2768273982], length 1314
22:20:21.058776 IP 52.223.248.110.1935 > 10.8.3.3.42138: Flags [.], ack 40531, win 129, options [nop,nop,TS val 2768274085 ecr 1193315029], length 0
22:20:21.086279 IP 10.8.3.3.42138 > 52.223.248.110.1935: Flags [.], seq 54491:55805, ack 1, win 501, options [nop,nop,TS val 1193315589 ecr 2768274085], length 1314
22:20:21.123312 IP 10.8.3.3.42138 > 52.223.248.110.1935: Flags [.], seq 55805:57119, ack 1, win 501, options [nop,nop,TS val 1193315626 ecr 2768274085], length 1314
22:20:21.126141 IP 52.223.248.110.1935 > 10.8.3.3.42138: Flags [.], ack 43159, win 129, options [nop,nop,TS val 2768274153 ecr 1193315123], length 0
22:20:21.184516 IP 10.8.3.3.42138 > 52.223.248.110.1935: Flags [.], seq 57119:58433, ack 1, win 501, options [nop,nop,TS val 1193315687 ecr 2768274153], length 1314
22:20:21.221532 IP 10.8.3.3.42138 > 52.223.248.110.1935: Flags [.], seq 58433:59747, ack 1, win 501, options [nop,nop,TS val 1193315724 ecr 2768274153], length 1314
22:20:21.222682 IP 52.223.248.110.1935 > 10.8.3.3.42138: Flags [.], ack 45787, win 129, options [nop,nop,TS val 2768274249 ecr 1193315221], length 0
22:20:21.254848 IP 10.8.3.3.42138 > 52.223.248.110.1935: Flags [.], seq 59747:61061, ack 1, win 501, options [nop,nop,TS val 1193315758 ecr 2768274249], length 1314
22:20:21.317859 IP 10.8.3.3.42138 > 52.223.248.110.1935: Flags [.], seq 61061:62375, ack 1, win 501, options [nop,nop,TS val 1193315821 ecr 2768274249], length 1314
22:20:21.322179 IP 52.223.248.110.1935 > 10.8.3.3.42138: Flags [.], ack 48415, win 129, options [nop,nop,TS val 2768274349 ecr 1193315288], length 0
22:20:21.351678 IP 10.8.3.3.42138 > 52.223.248.110.1935: Flags [.], seq 62375:63689, ack 1, win 501, options [nop,nop,TS val 1193315854 ecr 2768274349], length 1314
22:20:21.354419 IP 52.223.248.110.1935 > 10.8.3.3.42138: Flags [.], ack 49235, win 129, options [nop,nop,TS val 2768274381 ecr 1193315386], length 0
22:20:21.354441 IP 10.8.3.3.42138 > 52.223.248.110.1935: Flags [P.], seq 63689:64023, ack 1, win 501, options [nop,nop,TS val 1193315857 ecr 2768274381], length 334
22:20:21.419167 IP 10.8.3.3.42138 > 52.223.248.110.1935: Flags [.], seq 64023:65337, ack 1, win 501, options [nop,nop,TS val 1193315922 ecr 2768274381], length 1314
22:20:21.428119 IP 52.223.248.110.1935 > 10.8.3.3.42138: Flags [.], ack 51863, win 129, options [nop,nop,TS val 2768274454 ecr 1193315424], length 0
22:20:21.453525 IP 10.8.3.3.42138 > 52.223.248.110.1935: Flags [.], seq 65337:66651, ack 1, win 501, options [nop,nop,TS val 1193315956 ecr 2768274454], length 1314
22:20:21.486980 IP 10.8.3.3.42138 > 52.223.248.110.1935: Flags [.], seq 66651:67965, ack 1, win 501, options [nop,nop,TS val 1193315990 ecr 2768274454], length 1314
22:20:21.524789 IP 52.223.248.110.1935 > 10.8.3.3.42138: Flags [.], ack 54491, win 129, options [nop,nop,TS val 2768274551 ecr 1193315498], length 0
22:20:21.553528 IP 10.8.3.3.42138 > 52.223.248.110.1935: Flags [.], seq 67965:69279, ack 1, win 501, options [nop,nop,TS val 1193316056 ecr 2768274551], length 1314
22:20:21.585713 IP 10.8.3.3.42138 > 52.223.248.110.1935: Flags [.], seq 69279:70593, ack 1, win 501, options [nop,nop,TS val 1193316088 ecr 2768274551], length 1314
22:20:21.595099 IP 52.223.248.110.1935 > 10.8.3.3.42138: Flags [.], ack 57119, win 129, options [nop,nop,TS val 2768274622 ecr 1193315589], length 0
22:20:21.619084 IP 10.8.3.3.42138 > 52.223.248.110.1935: Flags [.], seq 70593:71907, ack 1, win 501, options [nop,nop,TS val 1193316122 ecr 2768274622], length 1314
22:20:21.684426 IP 10.8.3.3.42138 > 52.223.248.110.1935: Flags [.], seq 71907:73221, ack 1, win 501, options [nop,nop,TS val 1193316187 ecr 2768274622], length 1314
22:20:21.693890 IP 52.223.248.110.1935 > 10.8.3.3.42138: Flags [.], ack 59747, win 129, options [nop,nop,TS val 2768274720 ecr 1193315687], length 0
22:20:21.720596 IP 10.8.3.3.42138 > 52.223.248.110.1935: Flags [.], seq 73221:74535, ack 1, win 501, options [nop,nop,TS val 1193316223 ecr 2768274720], length 1314
22:20:21.755077 IP 10.8.3.3.42138 > 52.223.248.110.1935: Flags [.], seq 74535:75849, ack 1, win 501, options [nop,nop,TS val 1193316258 ecr 2768274720], length 1314
22:20:21.790084 IP 52.223.248.110.1935 > 10.8.3.3.42138: Flags [.], ack 62375, win 129, options [nop,nop,TS val 2768274816 ecr 1193315758], length 0
22:20:21.821439 IP 10.8.3.3.42138 > 52.223.248.110.1935: Flags [.], seq 75849:77163, ack 1, win 501, options [nop,nop,TS val 1193316324 ecr 2768274816], length 1314
22:20:21.825891 IP 52.223.248.110.1935 > 10.8.3.3.42138: Flags [.], ack 64023, win 129, options [nop,nop,TS val 2768274852 ecr 1193315854], length 0
22:20:21.825916 IP 10.8.3.3.42138 > 52.223.248.110.1935: Flags [P.], seq 77163:77979, ack 1, win 501, options [nop,nop,TS val 1193316329 ecr 2768274852], length 816
22:20:21.886821 IP 10.8.3.3.42138 > 52.223.248.110.1935: Flags [.], seq 77979:79293, ack 1, win 501, options [nop,nop,TS val 1193316390 ecr 2768274852], length 1314
22:20:21.920566 IP 10.8.3.3.42138 > 52.223.248.110.1935: Flags [.], seq 79293:80607, ack 1, win 501, options [nop,nop,TS val 1193316423 ecr 2768274852], length 1314
22:20:21.925271 IP 52.223.248.110.1935 > 10.8.3.3.42138: Flags [.], ack 66651, win 129, options [nop,nop,TS val 2768274952 ecr 1193315922], length 0
22:20:21.953783 IP 10.8.3.3.42138 > 52.223.248.110.1935: Flags [.], seq 80607:81921, ack 1, win 501, options [nop,nop,TS val 1193316456 ecr 2768274952], length 1314
22:20:22.019134 IP 52.223.248.110.1935 > 10.8.3.3.42138: Flags [.], ack 67965, win 129, options [nop,nop,TS val 2768275046 ecr 1193315990], length 0
22:20:22.020659 IP 10.8.3.3.42138 > 52.223.248.110.1935: Flags [.], seq 81921:83235, ack 1, win 501, options [nop,nop,TS val 1193316523 ecr 2768275046], length 1314
22:20:22.053646 IP 10.8.3.3.42138 > 52.223.248.110.1935: Flags [.], seq 83235:84549, ack 1, win 501, options [nop,nop,TS val 1193316556 ecr 2768275046], length 1314
22:20:22.057569 IP 52.223.248.110.1935 > 10.8.3.3.42138: Flags [.], ack 70593, win 129, options [nop,nop,TS val 2768275084 ecr 1193316056], length 0
22:20:22.085955 IP 10.8.3.3.42138 > 52.223.248.110.1935: Flags [.], seq 84549:85863, ack 1, win 501, options [nop,nop,TS val 1193316589 ecr 2768275084], length 1314
22:20:22.155104 IP 10.8.3.3.42138 > 52.223.248.110.1935: Flags [.], seq 85863:87177, ack 1, win 501, options [nop,nop,TS val 1193316658 ecr 2768275084], length 1314
22:20:22.156104 IP 52.223.248.110.1935 > 10.8.3.3.42138: Flags [.], ack 73221, win 129, options [nop,nop,TS val 2768275183 ecr 1193316122], length 0
22:20:22.187927 IP 10.8.3.3.42138 > 52.223.248.110.1935: Flags [.], seq 87177:88491, ack 1, win 501, options [nop,nop,TS val 1193316691 ecr 2768275183], length 1314
22:20:22.219791 IP 10.8.3.3.42138 > 52.223.248.110.1935: Flags [.], seq 88491:89805, ack 1, win 501, options [nop,nop,TS val 1193316722 ecr 2768275183], length 1314
22:20:22.227891 IP 52.223.248.110.1935 > 10.8.3.3.42138: Flags [.], ack 75849, win 129, options [nop,nop,TS val 2768275253 ecr 1193316223], length 0
22:20:22.287717 IP 10.8.3.3.42138 > 52.223.248.110.1935: Flags [.], seq 89805:91119, ack 1, win 501, options [nop,nop,TS val 1193316790 ecr 2768275253], length 1314
22:20:22.297715 IP 52.223.248.110.1935 > 10.8.3.3.42138: Flags [.], ack 77979, win 129, options [nop,nop,TS val 2768275324 ecr 1193316324], length 0
22:20:22.297754 IP 10.8.3.3.42138 > 52.223.248.110.1935: Flags [P.], seq 91119:91927, ack 1, win 501, options [nop,nop,TS val 1193316800 ecr 2768275324], length 808
22:20:22.351953 IP 10.8.3.3.42138 > 52.223.248.110.1935: Flags [.], seq 91927:93241, ack 1, win 501, options [nop,nop,TS val 1193316855 ecr 2768275324], length 1314
22:20:22.385025 IP 10.8.3.3.42138 > 52.223.248.110.1935: Flags [.], seq 93241:94555, ack 1, win 501, options [nop,nop,TS val 1193316888 ecr 2768275324], length 1314
22:20:22.392310 IP 52.223.248.110.1935 > 10.8.3.3.42138: Flags [.], ack 80607, win 129, options [nop,nop,TS val 2768275419 ecr 1193316390], length 0
22:20:22.419085 IP 10.8.3.3.42138 > 52.223.248.110.1935: Flags [.], seq 94555:95869, ack 1, win 501, options [nop,nop,TS val 1193316922 ecr 2768275419], length 1314
22:20:22.486103 IP 10.8.3.3.42138 > 52.223.248.110.1935: Flags [.], seq 95869:97183, ack 1, win 501, options [nop,nop,TS val 1193316989 ecr 2768275419], length 1314
22:20:22.492597 IP 52.223.248.110.1935 > 10.8.3.3.42138: Flags [.], ack 83235, win 129, options [nop,nop,TS val 2768275519 ecr 1193316456], length 0
22:20:22.518588 IP 10.8.3.3.42138 > 52.223.248.110.1935: Flags [.], seq 97183:98497, ack 1, win 501, options [nop,nop,TS val 1193317021 ecr 2768275519], length 1314
22:20:22.555820 IP 10.8.3.3.42138 > 52.223.248.110.1935: Flags [.], seq 98497:99811, ack 1, win 501, options [nop,nop,TS val 1193317059 ecr 2768275519], length 1314
22:20:22.557804 IP 52.223.248.110.1935 > 10.8.3.3.42138: Flags [.], ack 85863, win 129, options [nop,nop,TS val 2768275584 ecr 1193316556], length 0
22:20:22.621443 IP 10.8.3.3.42138 > 52.223.248.110.1935: Flags [.], seq 99811:101125, ack 1, win 501, options [nop,nop,TS val 1193317124 ecr 2768275584], length 1314
22:20:22.651570 IP 10.8.3.3.42138 > 52.223.248.110.1935: Flags [.], seq 101125:102439, ack 1, win 501, options [nop,nop,TS val 1193317154 ecr 2768275584], length 1314
22:20:22.660112 IP 52.223.248.110.1935 > 10.8.3.3.42138: Flags [.], ack 88491, win 129, options [nop,nop,TS val 2768275687 ecr 1193316658], length 0
22:20:22.684552 IP 10.8.3.3.42138 > 52.223.248.110.1935: Flags [.], seq 102439:103753, ack 1, win 501, options [nop,nop,TS val 1193317187 ecr 2768275687], length 1314
22:20:22.751433 IP 10.8.3.3.42138 > 52.223.248.110.1935: Flags [.], seq 103753:105067, ack 1, win 501, options [nop,nop,TS val 1193317254 ecr 2768275687], length 1314
22:20:22.759520 IP 52.223.248.110.1935 > 10.8.3.3.42138: Flags [.], ack 91119, win 129, options [nop,nop,TS val 2768275786 ecr 1193316722], length 0
22:20:22.769938 IP 52.223.248.110.1935 > 10.8.3.3.42138: Flags [.], ack 91927, win 129, options [nop,nop,TS val 2768275796 ecr 1193316800], length 0
22:20:22.769954 IP 10.8.3.3.42138 > 52.223.248.110.1935: Flags [P.], seq 105067:105967, ack 1, win 501, options [nop,nop,TS val 1193317273 ecr 2768275796], length 900
22:20:22.821431 IP 10.8.3.3.42138 > 52.223.248.110.1935: Flags [.], seq 105967:107281, ack 1, win 501, options [nop,nop,TS val 1193317324 ecr 2768275796], length 1314
22:20:22.854786 IP 10.8.3.3.42138 > 52.223.248.110.1935: Flags [.], seq 107281:108595, ack 1, win 501, options [nop,nop,TS val 1193317357 ecr 2768275796], length 1314
22:20:22.856727 IP 52.223.248.110.1935 > 10.8.3.3.42138: Flags [.], ack 94555, win 129, options [nop,nop,TS val 2768275883 ecr 1193316855], length 0
22:20:22.897161 IP 10.8.3.3.42138 > 52.223.248.110.1935: Flags [.], seq 108595:109909, ack 1, win 501, options [nop,nop,TS val 1193317400 ecr 2768275883], length 1314
22:20:22.953446 IP 10.8.3.3.42138 > 52.223.248.110.1935: Flags [.], seq 109909:111223, ack 1, win 501, options [nop,nop,TS val 1193317456 ecr 2768275883], length 1314
22:20:22.958202 IP 52.223.248.110.1935 > 10.8.3.3.42138: Flags [.], ack 97183, win 129, options [nop,nop,TS val 2768275984 ecr 1193316922], length 0
22:20:22.983956 IP 10.8.3.3.42138 > 52.223.248.110.1935: Flags [.], seq 111223:112537, ack 1, win 501, options [nop,nop,TS val 1193317487 ecr 2768275984], length 1314
22:20:23.024801 IP 10.8.3.3.42138 > 52.223.248.110.1935: Flags [.], seq 112537:113851, ack 1, win 501, options [nop,nop,TS val 1193317527 ecr 2768275984], length 1314
22:20:23.027606 IP 52.223.248.110.1935 > 10.8.3.3.42138: Flags [.], ack 99811, win 129, options [nop,nop,TS val 2768276054 ecr 1193317021], length 0
22:20:23.089243 IP 10.8.3.3.42138 > 52.223.248.110.1935: Flags [.], seq 113851:115165, ack 1, win 501, options [nop,nop,TS val 1193317592 ecr 2768276054], length 1314
22:20:23.119534 IP 10.8.3.3.42138 > 52.223.248.110.1935: Flags [.], seq 115165:116479, ack 1, win 501, options [nop,nop,TS val 1193317622 ecr 2768276054], length 1314
22:20:23.123368 IP 52.223.248.110.1935 > 10.8.3.3.42138: Flags [.], ack 102439, win 129, options [nop,nop,TS val 2768276150 ecr 1193317124], length 0
22:20:23.153139 IP 10.8.3.3.42138 > 52.223.248.110.1935: Flags [.], seq 116479:117793, ack 1, win 501, options [nop,nop,TS val 1193317656 ecr 2768276150], length 1314
22:20:23.221109 IP 10.8.3.3.42138 > 52.223.248.110.1935: Flags [.], seq 117793:119107, ack 1, win 501, options [nop,nop,TS val 1193317724 ecr 2768276150], length 1314
22:20:23.223219 IP 52.223.248.110.1935 > 10.8.3.3.42138: Flags [.], ack 105067, win 129, options [nop,nop,TS val 2768276250 ecr 1193317187], length 0
22:20:23.242019 IP 52.223.248.110.1935 > 10.8.3.3.42138: Flags [.], ack 105967, win 129, options [nop,nop,TS val 2768276268 ecr 1193317273], length 0
22:20:23.242056 IP 10.8.3.3.42138 > 52.223.248.110.1935: Flags [P.], seq 119107:119922, ack 1, win 501, options [nop,nop,TS val 1193317745 ecr 2768276268], length 815
22:20:23.286329 IP 10.8.3.3.42138 > 52.223.248.110.1935: Flags [.], seq 119922:121236, ack 1, win 501, options [nop,nop,TS val 1193317789 ecr 2768276268], length 1314
22:20:23.320809 IP 10.8.3.3.42138 > 52.223.248.110.1935: Flags [.], seq 121236:122550, ack 1, win 501, options [nop,nop,TS val 1193317823 ecr 2768276268], length 1314
22:20:23.326409 IP 52.223.248.110.1935 > 10.8.3.3.42138: Flags [.], ack 108595, win 129, options [nop,nop,TS val 2768276353 ecr 1193317324], length 0
22:20:23.367490 IP 10.8.3.3.42138 > 52.223.248.110.1935: Flags [.], seq 122550:123864, ack 1, win 501, options [nop,nop,TS val 1193317870 ecr 2768276353], length 1314
22:20:23.419535 IP 10.8.3.3.42138 > 52.223.248.110.1935: Flags [.], seq 123864:125178, ack 1, win 501, options [nop,nop,TS val 1193317922 ecr 2768276353], length 1314
22:20:23.425395 IP 52.223.248.110.1935 > 10.8.3.3.42138: Flags [.], ack 111223, win 129, options [nop,nop,TS val 2768276452 ecr 1193317400], length 0
22:20:23.452715 IP 10.8.3.3.42138 > 52.223.248.110.1935: Flags [.], seq 125178:126492, ack 1, win 501, options [nop,nop,TS val 1193317955 ecr 2768276452], length 1314
22:20:23.495155 IP 10.8.3.3.42138 > 52.223.248.110.1935: Flags [.], seq 126492:127806, ack 1, win 501, options [nop,nop,TS val 1193317998 ecr 2768276452], length 1314
22:20:23.496831 IP 52.223.248.110.1935 > 10.8.3.3.42138: Flags [.], ack 113851, win 129, options [nop,nop,TS val 2768276523 ecr 1193317487], length 0
22:20:23.553305 IP 10.8.3.3.42138 > 52.223.248.110.1935: Flags [.], seq 127806:129120, ack 1, win 501, options [nop,nop,TS val 1193318056 ecr 2768276523], length 1314
22:20:23.587804 IP 10.8.3.3.42138 > 52.223.248.110.1935: Flags [.], seq 129120:130434, ack 1, win 501, options [nop,nop,TS val 1193318090 ecr 2768276523], length 1314
22:20:23.591242 IP 52.223.248.110.1935 > 10.8.3.3.42138: Flags [.], ack 116479, win 129, options [nop,nop,TS val 2768276618 ecr 1193317592], length 0
22:20:23.623922 IP 10.8.3.3.42138 > 52.223.248.110.1935: Flags [.], seq 130434:131748, ack 1, win 501, options [nop,nop,TS val 1193318127 ecr 2768276618], length 1314
22:20:23.687942 IP 10.8.3.3.42138 > 52.223.248.110.1935: Flags [.], seq 131748:133062, ack 1, win 501, options [nop,nop,TS val 1193318191 ecr 2768276618], length 1314
22:20:23.693019 IP 52.223.248.110.1935 > 10.8.3.3.42138: Flags [.], ack 119107, win 129, options [nop,nop,TS val 2768276719 ecr 1193317656], length 0
22:20:23.713815 IP 52.223.248.110.1935 > 10.8.3.3.42138: Flags [.], ack 119922, win 129, options [nop,nop,TS val 2768276740 ecr 1193317745], length 0
22:20:23.713841 IP 10.8.3.3.42138 > 52.223.248.110.1935: Flags [P.], seq 133062:133867, ack 1, win 501, options [nop,nop,TS val 1193318217 ecr 2768276740], length 805
22:20:23.752970 IP 10.8.3.3.42138 > 52.223.248.110.1935: Flags [.], seq 133867:135181, ack 1, win 501, options [nop,nop,TS val 1193318256 ecr 2768276740], length 1314
22:20:23.783807 IP 10.8.3.3.42138 > 52.223.248.110.1935: Flags [.], seq 135181:136495, ack 1, win 501, options [nop,nop,TS val 1193318287 ecr 2768276740], length 1314
22:20:23.792790 IP 52.223.248.110.1935 > 10.8.3.3.42138: Flags [.], ack 122550, win 129, options [nop,nop,TS val 2768276819 ecr 1193317789], length 0
22:20:23.836744 IP 10.8.3.3.42138 > 52.223.248.110.1935: Flags [.], seq 136495:137809, ack 1, win 501, options [nop,nop,TS val 1193318339 ecr 2768276819], length 1314
22:20:23.887924 IP 10.8.3.3.42138 > 52.223.248.110.1935: Flags [.], seq 137809:139123, ack 1, win 501, options [nop,nop,TS val 1193318391 ecr 2768276819], length 1314
22:20:23.891373 IP 52.223.248.110.1935 > 10.8.3.3.42138: Flags [.], ack 125178, win 129, options [nop,nop,TS val 2768276918 ecr 1193317870], length 0
22:20:23.922339 IP 10.8.3.3.42138 > 52.223.248.110.1935: Flags [.], seq 139123:140437, ack 1, win 501, options [nop,nop,TS val 1193318425 ecr 2768276918], length 1314
22:20:23.964945 IP 10.8.3.3.42138 > 52.223.248.110.1935: Flags [.], seq 140437:141751, ack 1, win 501, options [nop,nop,TS val 1193318468 ecr 2768276918], length 1314
22:20:23.967014 IP 52.223.248.110.1935 > 10.8.3.3.42138: Flags [.], ack 127806, win 129, options [nop,nop,TS val 2768276993 ecr 1193317955], length 0
22:20:24.021230 IP 10.8.3.3.42138 > 52.223.248.110.1935: Flags [.], seq 141751:143065, ack 1, win 501, options [nop,nop,TS val 1193318524 ecr 2768276993], length 1314
22:20:24.050535 IP 10.8.3.3.42138 > 52.223.248.110.1935: Flags [.], seq 143065:144379, ack 1, win 501, options [nop,nop,TS val 1193318553 ecr 2768276993], length 1314
22:20:24.059995 IP 52.223.248.110.1935 > 10.8.3.3.42138: Flags [.], ack 130434, win 129, options [nop,nop,TS val 2768277086 ecr 1193318056], length 0
22:20:24.092941 IP 10.8.3.3.42138 > 52.223.248.110.1935: Flags [.], seq 144379:145693, ack 1, win 501, options [nop,nop,TS val 1193318596 ecr 2768277086], length 1314
22:20:24.157030 IP 10.8.3.3.42138 > 52.223.248.110.1935: Flags [.], seq 145693:147007, ack 1, win 501, options [nop,nop,TS val 1193318660 ecr 2768277086], length 1314
22:20:24.159774 IP 52.223.248.110.1935 > 10.8.3.3.42138: Flags [.], ack 133062, win 129, options [nop,nop,TS val 2768277186 ecr 1193318127], length 0
22:20:24.183894 IP 10.8.3.3.42138 > 52.223.248.110.1935: Flags [.], seq 147007:148321, ack 1, win 501, options [nop,nop,TS val 1193318687 ecr 2768277186], length 1314
22:20:24.185654 IP 52.223.248.110.1935 > 10.8.3.3.42138: Flags [.], ack 133867, win 129, options [nop,nop,TS val 2768277212 ecr 1193318217], length 0
22:20:24.185666 IP 10.8.3.3.42138 > 52.223.248.110.1935: Flags [P.], seq 148321:148671, ack 1, win 501, options [nop,nop,TS val 1193318688 ecr 2768277212], length 350
22:20:24.254790 IP 10.8.3.3.42138 > 52.223.248.110.1935: Flags [.], seq 148671:149985, ack 1, win 501, options [nop,nop,TS val 1193318757 ecr 2768277212], length 1314
22:20:24.255475 IP 52.223.248.110.1935 > 10.8.3.3.42138: Flags [.], ack 136495, win 129, options [nop,nop,TS val 2768277282 ecr 1193318256], length 0
22:20:24.287774 IP 10.8.3.3.42138 > 52.223.248.110.1935: Flags [.], seq 149985:151299, ack 1, win 501, options [nop,nop,TS val 1193318790 ecr 2768277282], length 1314
22:20:24.317166 IP 10.8.3.3.42138 > 52.223.248.110.1935: Flags [.], seq 151299:152613, ack 1, win 501, options [nop,nop,TS val 1193318820 ecr 2768277282], length 1314
22:20:24.360075 IP 52.223.248.110.1935 > 10.8.3.3.42138: Flags [.], ack 139123, win 129, options [nop,nop,TS val 2768277387 ecr 1193318339], length 0
22:20:24.387386 IP 10.8.3.3.42138 > 52.223.248.110.1935: Flags [.], seq 152613:153927, ack 1, win 501, options [nop,nop,TS val 1193318890 ecr 2768277387], length 1314
22:20:24.421085 IP 10.8.3.3.42138 > 52.223.248.110.1935: Flags [.], seq 153927:155241, ack 1, win 501, options [nop,nop,TS val 1193318924 ecr 2768277387], length 1314
22:20:24.436627 IP 52.223.248.110.1935 > 10.8.3.3.42138: Flags [.], ack 141751, win 129, options [nop,nop,TS val 2768277463 ecr 1193318425], length 0
22:20:24.455592 IP 10.8.3.3.42138 > 52.223.248.110.1935: Flags [.], seq 155241:156555, ack 1, win 501, options [nop,nop,TS val 1193318958 ecr 2768277463], length 1314
22:20:24.519457 IP 10.8.3.3.42138 > 52.223.248.110.1935: Flags [.], seq 156555:157869, ack 1, win 501, options [nop,nop,TS val 1193319022 ecr 2768277463], length 1314
22:20:24.522196 IP 52.223.248.110.1935 > 10.8.3.3.42138: Flags [.], ack 144379, win 129, options [nop,nop,TS val 2768277549 ecr 1193318524], length 0
22:20:24.553296 IP 10.8.3.3.42138 > 52.223.248.110.1935: Flags [.], seq 157869:159183, ack 1, win 501, options [nop,nop,TS val 1193319056 ecr 2768277549], length 1314
22:20:24.587388 IP 10.8.3.3.42138 > 52.223.248.110.1935: Flags [.], seq 159183:160497, ack 1, win 501, options [nop,nop,TS val 1193319090 ecr 2768277549], length 1314
22:20:24.628864 IP 52.223.248.110.1935 > 10.8.3.3.42138: Flags [.], ack 147007, win 129, options [nop,nop,TS val 2768277655 ecr 1193318596], length 0
22:20:24.654299 IP 10.8.3.3.42138 > 52.223.248.110.1935: Flags [.], seq 160497:161811, ack 1, win 501, options [nop,nop,TS val 1193319157 ecr 2768277655], length 1314
22:20:24.657485 IP 52.223.248.110.1935 > 10.8.3.3.42138: Flags [.], ack 148671, win 129, options [nop,nop,TS val 2768277684 ecr 1193318687], length 0
22:20:24.657520 IP 10.8.3.3.42138 > 52.223.248.110.1935: Flags [P.], seq 161811:162615, ack 1, win 501, options [nop,nop,TS val 1193319160 ecr 2768277684], length 804
22:20:24.717171 IP 10.8.3.3.42138 > 52.223.248.110.1935: Flags [.], seq 162615:163929, ack 1, win 501, options [nop,nop,TS val 1193319220 ecr 2768277684], length 1314
22:20:24.754510 IP 10.8.3.3.42138 > 52.223.248.110.1935: Flags [.], seq 163929:165243, ack 1, win 501, options [nop,nop,TS val 1193319257 ecr 2768277684], length 1314
22:20:24.759650 IP 52.223.248.110.1935 > 10.8.3.3.42138: Flags [.], ack 151299, win 129, options [nop,nop,TS val 2768277786 ecr 1193318757], length 0
22:20:24.787688 IP 10.8.3.3.42138 > 52.223.248.110.1935: Flags [.], seq 165243:166557, ack 1, win 501, options [nop,nop,TS val 1193319290 ecr 2768277786], length 1314
22:20:24.850311 IP 10.8.3.3.42138 > 52.223.248.110.1935: Flags [.], seq 166557:167871, ack 1, win 501, options [nop,nop,TS val 1193319353 ecr 2768277786], length 1314
22:20:24.851132 IP 52.223.248.110.1935 > 10.8.3.3.42138: Flags [.], ack 152613, win 129, options [nop,nop,TS val 2768277878 ecr 1193318820], length 0
22:20:24.883790 IP 10.8.3.3.42138 > 52.223.248.110.1935: Flags [.], seq 167871:169185, ack 1, win 501, options [nop,nop,TS val 1193319386 ecr 2768277878], length 1314
22:20:24.892778 IP 52.223.248.110.1935 > 10.8.3.3.42138: Flags [.], ack 155241, win 129, options [nop,nop,TS val 2768277919 ecr 1193318890], length 0
22:20:24.917323 IP 10.8.3.3.42138 > 52.223.248.110.1935: Flags [.], seq 169185:170499, ack 1, win 501, options [nop,nop,TS val 1193319420 ecr 2768277919], length 1314
22:20:24.989546 IP 10.8.3.3.42138 > 52.223.248.110.1935: Flags [.], seq 170499:171813, ack 1, win 501, options [nop,nop,TS val 1193319492 ecr 2768277919], length 1314
22:20:24.991259 IP 52.223.248.110.1935 > 10.8.3.3.42138: Flags [.], ack 157869, win 129, options [nop,nop,TS val 2768278018 ecr 1193318958], length 0
22:20:25.021300 IP 10.8.3.3.42138 > 52.223.248.110.1935: Flags [.], seq 171813:173127, ack 1, win 501, options [nop,nop,TS val 1193319524 ecr 2768278018], length 1314
22:20:25.054865 IP 10.8.3.3.42138 > 52.223.248.110.1935: Flags [.], seq 173127:174441, ack 1, win 501, options [nop,nop,TS val 1193319558 ecr 2768278018], length 1314
22:20:25.059295 IP 52.223.248.110.1935 > 10.8.3.3.42138: Flags [.], ack 160497, win 129, options [nop,nop,TS val 2768278086 ecr 1193319056], length 0
22:20:25.117971 IP 10.8.3.3.42138 > 52.223.248.110.1935: Flags [.], seq 174441:175755, ack 1, win 501, options [nop,nop,TS val 1193319621 ecr 2768278086], length 1314
22:20:25.129398 IP 52.223.248.110.1935 > 10.8.3.3.42138: Flags [.], ack 162615, win 129, options [nop,nop,TS val 2768278156 ecr 1193319157], length 0
22:20:25.129409 IP 10.8.3.3.42138 > 52.223.248.110.1935: Flags [P.], seq 175755:176562, ack 1, win 501, options [nop,nop,TS val 1193319632 ecr 2768278156], length 807
22:20:25.187638 IP 10.8.3.3.42138 > 52.223.248.110.1935: Flags [.], seq 176562:177876, ack 1, win 501, options [nop,nop,TS val 1193319690 ecr 2768278156], length 1314
22:20:25.224877 IP 10.8.3.3.42138 > 52.223.248.110.1935: Flags [.], seq 177876:179190, ack 1, win 501, options [nop,nop,TS val 1193319728 ecr 2768278156], length 1314
22:20:25.226334 IP 52.223.248.110.1935 > 10.8.3.3.42138: Flags [.], ack 165243, win 129, options [nop,nop,TS val 2768278253 ecr 1193319220], length 0
22:20:25.250523 IP 10.8.3.3.42138 > 52.223.248.110.1935: Flags [.], seq 179190:180504, ack 1, win 501, options [nop,nop,TS val 1193319753 ecr 2768278253], length 1314
22:20:25.319403 IP 10.8.3.3.42138 > 52.223.248.110.1935: Flags [.], seq 180504:181818, ack 1, win 501, options [nop,nop,TS val 1193319822 ecr 2768278253], length 1314
22:20:25.322189 IP 52.223.248.110.1935 > 10.8.3.3.42138: Flags [.], ack 167871, win 129, options [nop,nop,TS val 2768278348 ecr 1193319290], length 0
22:20:25.354615 IP 10.8.3.3.42138 > 52.223.248.110.1935: Flags [.], seq 181818:183132, ack 1, win 501, options [nop,nop,TS val 1193319857 ecr 2768278348], length 1314
22:20:25.388073 IP 10.8.3.3.42138 > 52.223.248.110.1935: Flags [.], seq 183132:184446, ack 1, win 501, options [nop,nop,TS val 1193319891 ecr 2768278348], length 1314
22:20:25.389147 IP 52.223.248.110.1935 > 10.8.3.3.42138: Flags [.], ack 170499, win 129, options [nop,nop,TS val 2768278416 ecr 1193319386], length 0
22:20:25.451093 IP 10.8.3.3.42138 > 52.223.248.110.1935: Flags [.], seq 184446:185760, ack 1, win 501, options [nop,nop,TS val 1193319954 ecr 2768278416], length 1314
22:20:25.485462 IP 10.8.3.3.42138 > 52.223.248.110.1935: Flags [.], seq 185760:187074, ack 1, win 501, options [nop,nop,TS val 1193319988 ecr 2768278416], length 1314
22:20:25.493385 IP 52.223.248.110.1935 > 10.8.3.3.42138: Flags [.], ack 173127, win 129, options [nop,nop,TS val 2768278520 ecr 1193319492], length 0
22:20:25.523754 IP 10.8.3.3.42138 > 52.223.248.110.1935: Flags [.], seq 187074:188388, ack 1, win 501, options [nop,nop,TS val 1193320026 ecr 2768278520], length 1314
22:20:25.587610 IP 10.8.3.3.42138 > 52.223.248.110.1935: Flags [.], seq 188388:189702, ack 1, win 501, options [nop,nop,TS val 1193320090 ecr 2768278520], length 1314
22:20:25.591332 IP 52.223.248.110.1935 > 10.8.3.3.42138: Flags [.], ack 174441, win 129, options [nop,nop,TS val 2768278617 ecr 1193319558], length 0
22:20:25.606520 IP 52.223.248.110.1935 > 10.8.3.3.42138: Flags [.], ack 176562, win 129, options [nop,nop,TS val 2768278633 ecr 1193319621], length 0
22:20:25.606534 IP 10.8.3.3.42138 > 52.223.248.110.1935: Flags [P.], seq 189702:190520, ack 1, win 501, options [nop,nop,TS val 1193320109 ecr 2768278633], length 818
22:20:25.651177 IP 10.8.3.3.42138 > 52.223.248.110.1935: Flags [.], seq 190520:191834, ack 1, win 501, options [nop,nop,TS val 1193320154 ecr 2768278633], length 1314
22:20:25.685635 IP 10.8.3.3.42138 > 52.223.248.110.1935: Flags [.], seq 191834:193148, ack 1, win 501, options [nop,nop,TS val 1193320188 ecr 2768278633], length 1314
22:20:25.696841 IP 52.223.248.110.1935 > 10.8.3.3.42138: Flags [.], ack 179190, win 129, options [nop,nop,TS val 2768278723 ecr 1193319690], length 0
22:20:25.721377 IP 10.8.3.3.42138 > 52.223.248.110.1935: Flags [.], seq 193148:194462, ack 1, win 501, options [nop,nop,TS val 1193320224 ecr 2768278723], length 1314
22:20:25.787126 IP 52.223.248.110.1935 > 10.8.3.3.42138: Flags [.], ack 180504, win 129, options [nop,nop,TS val 2768278813 ecr 1193319753], length 0
22:20:25.788276 IP 10.8.3.3.42138 > 52.223.248.110.1935: Flags [.], seq 194462:195776, ack 1, win 501, options [nop,nop,TS val 1193320291 ecr 2768278813], length 1314
22:20:25.822634 IP 10.8.3.3.42138 > 52.223.248.110.1935: Flags [.], seq 195776:197090, ack 1, win 501, options [nop,nop,TS val 1193320325 ecr 2768278813], length 1314
22:20:25.826391 IP 52.223.248.110.1935 > 10.8.3.3.42138: Flags [.], ack 183132, win 129, options [nop,nop,TS val 2768278853 ecr 1193319822], length 0
22:20:25.853824 IP 10.8.3.3.42138 > 52.223.248.110.1935: Flags [.], seq 197090:198404, ack 1, win 501, options [nop,nop,TS val 1193320357 ecr 2768278853], length 1314
22:20:25.921677 IP 10.8.3.3.42138 > 52.223.248.110.1935: Flags [.], seq 198404:199718, ack 1, win 501, options [nop,nop,TS val 1193320424 ecr 2768278853], length 1314
22:20:25.923961 IP 52.223.248.110.1935 > 10.8.3.3.42138: Flags [.], ack 185760, win 129, options [nop,nop,TS val 2768278950 ecr 1193319891], length 0
22:20:25.951156 IP 10.8.3.3.42138 > 52.223.248.110.1935: Flags [.], seq 199718:201032, ack 1, win 501, options [nop,nop,TS val 1193320454 ecr 2768278950], length 1314
22:20:25.986006 IP 10.8.3.3.42138 > 52.223.248.110.1935: Flags [.], seq 201032:202346, ack 1, win 501, options [nop,nop,TS val 1193320489 ecr 2768278950], length 1314
22:20:25.995550 IP 52.223.248.110.1935 > 10.8.3.3.42138: Flags [.], ack 188388, win 129, options [nop,nop,TS val 2768279022 ecr 1193319988], length 0
22:20:26.058129 IP 10.8.3.3.42138 > 52.223.248.110.1935: Flags [.], seq 202346:203660, ack 1, win 501, options [nop,nop,TS val 1193320561 ecr 2768279022], length 1314
22:20:26.078220 IP 52.223.248.110.1935 > 10.8.3.3.42138: Flags [.], ack 190520, win 129, options [nop,nop,TS val 2768279104 ecr 1193320090], length 0
