23:47:09.183141 IP 10.8.0.7.44082 > 99.181.89.228.1935: Flags [.], seq 3060633256:3060634570, ack 3392887627, win 501, options [nop,nop,TS val 3944034679 ecr 3255243658], length 1314
23:47:09.190589 IP 99.181.89.228.1935 > 10.8.0.7.44082: Flags [.], ack 4294952589, win 155, options [nop,nop,TS val 3255243754 ecr 3944034115], length 0
23:47:09.219976 IP 10.8.0.7.44082 > 99.181.89.228.1935: Flags [.], seq 1314:2628, ack 1, win 501, options [nop,nop,TS val 3944034716 ecr 3255243754], length 1314
23:47:09.286736 IP 10.8.0.7.44082 > 99.181.89.228.1935: Flags [.], seq 2628:3942, ack 1, win 501, options [nop,nop,TS val 3944034783 ecr 3255243754], length 1314
23:47:09.295054 IP 99.181.89.228.1935 > 10.8.0.7.44082: Flags [.], ack 4294955217, win 155, options [nop,nop,TS val 3255243858 ecr 3944034180], length 0
23:47:09.319910 IP 10.8.0.7.44082 > 99.181.89.228.1935: Flags [.], seq 3942:5256, ack 1, win 501, options [nop,nop,TS val 3944034816 ecr 3255243858], length 1314
23:47:09.353683 IP 10.8.0.7.44082 > 99.181.89.228.1935: Flags [.], seq 5256:6570, ack 1, win 501, options [nop,nop,TS val 3944034850 ecr 3255243858], length 1314
23:47:09.361867 IP 99.181.89.228.1935 > 10.8.0.7.44082: Flags [.], ack 4294957845, win 155, options [nop,nop,TS val 3255243925 ecr 3944034282], length 0
23:47:09.416581 IP 10.8.0.7.44082 > 99.181.89.228.1935: Flags [.], seq 6570:7884, ack 1, win 501, options [nop,nop,TS val 3944034913 ecr 3255243925], length 1314
23:47:09.449621 IP 10.8.0.7.44082 > 99.181.89.228.1935: Flags [.], seq 7884:9198, ack 1, win 501, options [nop,nop,TS val 3944034946 ecr 3255243925], length 1314
23:47:09.462134 IP 99.181.89.228.1935 > 10.8.0.7.44082: Flags [.], ack 4294960473, win 155, options [nop,nop,TS val 3255244025 ecr 3944034380], length 0
23:47:09.481660 IP 10.8.0.7.44082 > 99.181.89.228.1935: Flags [.], seq 9198:10512, ack 1, win 501, options [nop,nop,TS val 3944034978 ecr 3255244025], length 1314
23:47:09.498128 IP 99.181.89.228.1935 > 10.8.0.7.44082: Flags [.], ack 4294962040, win 156, options [nop,nop,TS val 3255244061 ecr 3944034445], length 0
23:47:09.498143 IP 10.8.0.7.44082 > 99.181.89.228.1935: Flags [P.], seq 10512:10672, ack 1, win 501, options [nop,nop,TS val 3944034994 ecr 3255244061], length 160
23:47:09.546454 IP 10.8.0.7.44082 > 99.181.89.228.1935: Flags [.], seq 10672:11986, ack 1, win 501, options [nop,nop,TS val 3944035043 ecr 3255244061], length 1314
23:47:09.585755 IP 10.8.0.7.44082 > 99.181.89.228.1935: Flags [.], seq 11986:13300, ack 1, win 501, options [nop,nop,TS val 3944035082 ecr 3255244061], length 1314
23:47:09.591557 IP 99.181.89.228.1935 > 10.8.0.7.44082: Flags [.], ack 4294964668, win 155, options [nop,nop,TS val 3255244155 ecr 3944034508], length 0
23:47:09.619142 IP 10.8.0.7.44082 > 99.181.89.228.1935: Flags [.], seq 13300:14614, ack 1, win 501, options [nop,nop,TS val 3944035115 ecr 3255244155], length 1314
23:47:09.684250 IP 10.8.0.7.44082 > 99.181.89.228.1935: Flags [.], seq 14614:15928, ack 1, win 501, options [nop,nop,TS val 3944035181 ecr 3255244155], length 1314
23:47:09.691941 IP 99.181.89.228.1935 > 10.8.0.7.44082: Flags [.], ack 4294965982, win 156, options [nop,nop,TS val 3255244255 ecr 3944034578], length 0
23:47:09.715501 IP 10.8.0.7.44082 > 99.181.89.228.1935: Flags [.], seq 15928:17242, ack 1, win 501, options [nop,nop,TS val 3944035212 ecr 3255244255], length 1314
23:47:09.726094 IP 99.181.89.228.1935 > 10.8.0.7.44082: Flags [.], ack 1314, win 156, options [nop,nop,TS val 3255244289 ecr 3944034651], length 0
23:47:09.748584 IP 10.8.0.7.44082 > 99.181.89.228.1935: Flags [.], seq 17242:18556, ack 1, win 501, options [nop,nop,TS val 3944035245 ecr 3255244289], length 1314
23:47:09.817345 IP 10.8.0.7.44082 > 99.181.89.228.1935: Flags [.], seq 18556:19870, ack 1, win 501, options [nop,nop,TS val 3944035314 ecr 3255244289], length 1314
23:47:09.829125 IP 99.181.89.228.1935 > 10.8.0.7.44082: Flags [.], ack 3942, win 155, options [nop,nop,TS val 3255244392 ecr 3944034716], length 0
23:47:09.850982 IP 10.8.0.7.44082 > 99.181.89.228.1935: Flags [.], seq 19870:21184, ack 1, win 501, options [nop,nop,TS val 3944035347 ecr 3255244392], length 1314
23:47:09.883917 IP 10.8.0.7.44082 > 99.181.89.228.1935: Flags [.], seq 21184:22498, ack 1, win 501, options [nop,nop,TS val 3944035380 ecr 3255244392], length 1314
23:47:09.896279 IP 99.181.89.228.1935 > 10.8.0.7.44082: Flags [.], ack 6570, win 155, options [nop,nop,TS val 3255244460 ecr 3944034816], length 0
23:47:09.951227 IP 10.8.0.7.44082 > 99.181.89.228.1935: Flags [.], seq 22498:23812, ack 1, win 501, options [nop,nop,TS val 3944035448 ecr 3255244460], length 1314
23:47:09.986261 IP 10.8.0.7.44082 > 99.181.89.228.1935: Flags [.], seq 23812:25126, ack 1, win 501, options [nop,nop,TS val 3944035483 ecr 3255244460], length 1314
23:47:09.991888 IP 99.181.89.228.1935 > 10.8.0.7.44082: Flags [.], ack 9198, win 155, options [nop,nop,TS val 3255244555 ecr 3944034913], length 0
23:47:10.015809 IP 10.8.0.7.44082 > 99.181.89.228.1935: Flags [.], seq 25126:26440, ack 1, win 501, options [nop,nop,TS val 3944035512 ecr 3255244555], length 1314
23:47:10.040262 IP 99.181.89.228.1935 > 10.8.0.7.44082: Flags [.], ack 10672, win 156, options [nop,nop,TS val 3255244604 ecr 3944034978], length 0
23:47:10.040290 IP 10.8.0.7.44082 > 99.181.89.228.1935: Flags [P.], seq 26440:26701, ack 1, win 501, options [nop,nop,TS val 3944035537 ecr 3255244604], length 261
23:47:10.079961 IP 10.8.0.7.44082 > 99.181.89.228.1935: Flags [.], seq 26701:28015, ack 1, win 501, options [nop,nop,TS val 3944035576 ecr 3255244604], length 1314
23:47:10.118927 IP 10.8.0.7.44082 > 99.181.89.228.1935: Flags [.], seq 28015:29329, ack 1, win 501, options [nop,nop,TS val 3944035615 ecr 3255244604], length 1314
23:47:10.165444 IP 10.8.0.7.44082 > 99.181.89.228.1935: Flags [.], seq 29329:30643, ack 1, win 501, options [nop,nop,TS val 3944035662 ecr 3255244604], length 1314
23:47:10.219274 IP 10.8.0.7.44082 > 99.181.89.228.1935: Flags [.], seq 30643:31957, ack 1, win 501, options [nop,nop,TS val 3944035716 ecr 3255244604], length 1314
23:47:10.250835 IP 10.8.0.7.44082 > 99.181.89.228.1935: Flags [.], seq 31957:33271, ack 1, win 501, options [nop,nop,TS val 3944035747 ecr 3255244604], length 1314
23:47:10.293246 IP 10.8.0.7.44082 > 99.181.89.228.1935: Flags [.], seq 33271:34585, ack 1, win 501, options [nop,nop,TS val 3944035790 ecr 3255244604], length 1314
23:47:10.353019 IP 10.8.0.7.44082 > 99.181.89.228.1935: Flags [.], seq 34585:35899, ack 1, win 501, options [nop,nop,TS val 3944035849 ecr 3255244604], length 1314
23:47:10.386178 IP 10.8.0.7.44082 > 99.181.89.228.1935: Flags [P.], seq 35899:36683, ack 1, win 501, options [nop,nop,TS val 3944035882 ecr 3255244604], length 784
23:47:11.218160 IP 10.8.0.7.44082 > 99.181.89.228.1935: Flags [.], seq 10672:11986, ack 1, win 501, options [nop,nop,TS val 3944036714 ecr 3255244604], length 1314
23:47:12.082622 IP 99.181.89.228.1935 > 10.8.0.7.44082: Flags [.], ack 13300, win 155, options [nop,nop,TS val 3255244691 ecr 3944035043], length 0
23:47:12.082739 IP 99.181.89.228.1935 > 10.8.0.7.44082: Flags [.], ack 14614, win 156, options [nop,nop,TS val 3255244779 ecr 3944035115], length 0
23:47:12.082763 IP 99.181.89.228.1935 > 10.8.0.7.44082: Flags [.], ack 17242, win 156, options [nop,nop,TS val 3255244821 ecr 3944035181], length 0
23:47:12.082875 IP 10.8.0.7.44082 > 99.181.89.228.1935: Flags [.], seq 36683:37997, ack 1, win 501, options [nop,nop,TS val 3944037579 ecr 3255244821], length 1314
23:47:12.082933 IP 99.181.89.228.1935 > 10.8.0.7.44082: Flags [.], ack 19870, win 155, options [nop,nop,TS val 3255244923 ecr 3944035245], length 0
23:47:12.083003 IP 10.8.0.7.44082 > 99.181.89.228.1935: Flags [.], seq 37997:39311, ack 1, win 501, options [nop,nop,TS val 3944037579 ecr 3255244923], length 1314
23:47:12.083066 IP 10.8.0.7.44082 > 99.181.89.228.1935: Flags [.], seq 39311:40625, ack 1, win 501, options [nop,nop,TS val 3944037579 ecr 3255244923], length 1314
23:47:12.083165 IP 10.8.0.7.44082 > 99.181.89.228.1935: Flags [.], seq 40625:41939, ack 1, win 501, options [nop,nop,TS val 3944037579 ecr 3255244923], length 1314
23:47:12.083276 IP 10.8.0.7.44082 > 99.181.89.228.1935: Flags [.], seq 41939:43253, ack 1, win 501, options [nop,nop,TS val 3944037580 ecr 3255244923], length 1314
23:47:12.083374 IP 10.8.0.7.44082 > 99.181.89.228.1935: Flags [.], seq 43253:44567, ack 1, win 501, options [nop,nop,TS val 3944037580 ecr 3255244923], length 1314
23:47:12.086873 IP 10.8.0.7.44082 > 99.181.89.228.1935: Flags [.], seq 44567:45881, ack 1, win 501, options [nop,nop,TS val 3944037583 ecr 3255244923], length 1314
23:47:12.386673 IP 10.8.0.7.44082 > 99.181.89.228.1935: Flags [.], seq 45881:47195, ack 1, win 501, options [nop,nop,TS val 3944037883 ecr 3255244923], length 1314
23:47:12.389006 IP 99.181.89.228.1935 > 10.8.0.7.44082: Flags [.], ack 21184, win 155, options [nop,nop,TS val 3255246952 ecr 3944035347], length 0
23:47:12.389322 IP 99.181.89.228.1935 > 10.8.0.7.44082: Flags [.], ack 22498, win 155, options [nop,nop,TS val 3255246953 ecr 3944035380], length 0
23:47:12.390251 IP 99.181.89.228.1935 > 10.8.0.7.44082: Flags [.], ack 23812, win 155, options [nop,nop,TS val 3255246953 ecr 3944035448], length 0
23:47:12.390288 IP 99.181.89.228.1935 > 10.8.0.7.44082: Flags [.], ack 25126, win 153, options [nop,nop,TS val 3255246953 ecr 3944035483], length 0
23:47:12.390345 IP 99.181.89.228.1935 > 10.8.0.7.44082: Flags [.], ack 26440, win 152, options [nop,nop,TS val 3255246954 ecr 3944035512], length 0
23:47:12.390387 IP 99.181.89.228.1935 > 10.8.0.7.44082: Flags [.], ack 26701, win 152, options [nop,nop,TS val 3255246954 ecr 3944035537], length 0
23:47:12.390405 IP 99.181.89.228.1935 > 10.8.0.7.44082: Flags [.], ack 28015, win 150, options [nop,nop,TS val 3255246954 ecr 3944035576], length 0
23:47:12.390421 IP 99.181.89.228.1935 > 10.8.0.7.44082: Flags [.], ack 29329, win 148, options [nop,nop,TS val 3255246954 ecr 3944035615], length 0
23:47:12.390438 IP 99.181.89.228.1935 > 10.8.0.7.44082: Flags [.], ack 30643, win 146, options [nop,nop,TS val 3255246954 ecr 3944035662], length 0
23:47:12.390457 IP 99.181.89.228.1935 > 10.8.0.7.44082: Flags [.], ack 31957, win 144, options [nop,nop,TS val 3255246954 ecr 3944035716], length 0
23:47:12.390474 IP 99.181.89.228.1935 > 10.8.0.7.44082: Flags [.], ack 33271, win 142, options [nop,nop,TS val 3255246954 ecr 3944035747], length 0
23:47:12.390492 IP 99.181.89.228.1935 > 10.8.0.7.44082: Flags [.], ack 34585, win 140, options [nop,nop,TS val 3255246954 ecr 3944035790], length 0
23:47:12.390832 IP 99.181.89.228.1935 > 10.8.0.7.44082: Flags [.], ack 35899, win 155, options [nop,nop,TS val 3255246954 ecr 3944035849], length 0
23:47:12.390872 IP 99.181.89.228.1935 > 10.8.0.7.44082: Flags [.], ack 36683, win 156, options [nop,nop,TS val 3255246954 ecr 3944035882], length 0
23:47:12.390888 IP 10.8.0.7.44082 > 99.181.89.228.1935: Flags [P.], seq 47195:47216, ack 1, win 501, options [nop,nop,TS val 3944037887 ecr 3255246954], length 21
23:47:12.390951 IP 99.181.89.228.1935 > 10.8.0.7.44082: Flags [.], ack 36683, win 156, options [nop,nop,TS val 3255246954 ecr 3944035882,nop,nop,sack 1 {10672:11986}], length 0
23:47:12.625456 IP 99.181.89.228.1935 > 10.8.0.7.44082: Flags [.], ack 37997, win 155, options [nop,nop,TS val 3255247189 ecr 3944037579], length 0
23:47:12.625511 IP 99.181.89.228.1935 > 10.8.0.7.44082: Flags [.], ack 39311, win 153, options [nop,nop,TS val 3255247189 ecr 3944037579], length 0
23:47:12.625529 IP 99.181.89.228.1935 > 10.8.0.7.44082: Flags [.], ack 40625, win 155, options [nop,nop,TS val 3255247189 ecr 3944037579], length 0
23:47:12.625545 IP 99.181.89.228.1935 > 10.8.0.7.44082: Flags [.], ack 41939, win 155, options [nop,nop,TS val 3255247189 ecr 3944037579], length 0
23:47:12.625560 IP 99.181.89.228.1935 > 10.8.0.7.44082: Flags [.], ack 43253, win 155, options [nop,nop,TS val 3255247189 ecr 3944037580], length 0
23:47:12.625898 IP 99.181.89.228.1935 > 10.8.0.7.44082: Flags [.], ack 44567, win 155, options [nop,nop,TS val 3255247189 ecr 3944037580], length 0
23:47:12.629412 IP 99.181.89.228.1935 > 10.8.0.7.44082: Flags [.], ack 45881, win 155, options [nop,nop,TS val 3255247193 ecr 3944037583], length 0
23:47:12.686316 IP 10.8.0.7.44082 > 99.181.89.228.1935: Flags [.], seq 47216:48530, ack 1, win 501, options [nop,nop,TS val 3944038183 ecr 3255247193], length 1314
23:47:12.818722 IP 10.8.0.7.44082 > 99.181.89.228.1935: Flags [.], seq 48530:49844, ack 1, win 501, options [nop,nop,TS val 3944038315 ecr 3255247193], length 1314
23:47:12.885429 IP 10.8.0.7.44082 > 99.181.89.228.1935: Flags [.], seq 49844:51158, ack 1, win 501, options [nop,nop,TS val 3944038382 ecr 3255247193], length 1314
23:47:12.918682 IP 10.8.0.7.44082 > 99.181.89.228.1935: Flags [.], seq 51158:52472, ack 1, win 501, options [nop,nop,TS val 3944038415 ecr 3255247193], length 1314
23:47:12.928907 IP 99.181.89.228.1935 > 10.8.0.7.44082: Flags [.], ack 47195, win 155, options [nop,nop,TS val 3255247492 ecr 3944037883], length 0
23:47:12.932998 IP 99.181.89.228.1935 > 10.8.0.7.44082: Flags [.], ack 47216, win 156, options [nop,nop,TS val 3255247496 ecr 3944037887], length 0
23:47:12.933030 IP 10.8.0.7.44082 > 99.181.89.228.1935: Flags [P.], seq 52472:52967, ack 1, win 501, options [nop,nop,TS val 3944038429 ecr 3255247496], length 495
23:47:12.983920 IP 10.8.0.7.44082 > 99.181.89.228.1935: Flags [.], seq 52967:54281, ack 1, win 501, options [nop,nop,TS val 3944038480 ecr 3255247496], length 1314
23:47:13.019065 IP 10.8.0.7.44082 > 99.181.89.228.1935: Flags [.], seq 54281:55595, ack 1, win 501, options [nop,nop,TS val 3944038515 ecr 3255247496], length 1314
23:47:13.052603 IP 10.8.0.7.44082 > 99.181.89.228.1935: Flags [.], seq 55595:56909, ack 1, win 501, options [nop,nop,TS val 3944038549 ecr 3255247496], length 1314
23:47:13.117609 IP 10.8.0.7.44082 > 99.181.89.228.1935: Flags [.], seq 56909:58223, ack 1, win 501, options [nop,nop,TS val 3944038614 ecr 3255247496], length 1314
23:47:13.152321 IP 10.8.0.7.44082 > 99.181.89.228.1935: Flags [.], seq 58223:59537, ack 1, win 501, options [nop,nop,TS val 3944038649 ecr 3255247496], length 1314
23:47:13.185875 IP 10.8.0.7.44082 > 99.181.89.228.1935: Flags [.], seq 59537:60851, ack 1, win 501, options [nop,nop,TS val 3944038682 ecr 3255247496], length 1314
23:47:13.228705 IP 99.181.89.228.1935 > 10.8.0.7.44082: Flags [.], ack 48530, win 155, options [nop,nop,TS val 3255247792 ecr 3944038183], length 0
23:47:13.251091 IP 10.8.0.7.44082 > 99.181.89.228.1935: Flags [.], seq 60851:62165, ack 1, win 501, options [nop,nop,TS val 3944038747 ecr 3255247792], length 1314
23:47:13.285348 IP 10.8.0.7.44082 > 99.181.89.228.1935: Flags [.], seq 62165:63479, ack 1, win 501, options [nop,nop,TS val 3944038782 ecr 3255247792], length 1314
23:47:13.318787 IP 10.8.0.7.44082 > 99.181.89.228.1935: Flags [.], seq 63479:64793, ack 1, win 501, options [nop,nop,TS val 3944038815 ecr 3255247792], length 1314
23:47:13.361237 IP 99.181.89.228.1935 > 10.8.0.7.44082: Flags [.], ack 49844, win 155, options [nop,nop,TS val 3255247924 ecr 3944038315], length 0
23:47:13.383885 IP 10.8.0.7.44082 > 99.181.89.228.1935: Flags [.], seq 64793:66107, ack 1, win 501, options [nop,nop,TS val 3944038880 ecr 3255247924], length 1314
23:47:13.417401 IP 10.8.0.7.44082 > 99.181.89.228.1935: Flags [.], seq 66107:67421, ack 1, win 501, options [nop,nop,TS val 3944038914 ecr 3255247924], length 1314
23:47:13.427803 IP 99.181.89.228.1935 > 10.8.0.7.44082: Flags [.], ack 51158, win 155, options [nop,nop,TS val 3255247991 ecr 3944038382], length 0
23:47:13.452155 IP 10.8.0.7.44082 > 99.181.89.228.1935: Flags [.], seq 67421:68735, ack 1, win 501, options [nop,nop,TS val 3944038948 ecr 3255247991], length 1314
23:47:13.461010 IP 99.181.89.228.1935 > 10.8.0.7.44082: Flags [.], ack 52472, win 155, options [nop,nop,TS val 3255248024 ecr 3944038415], length 0
23:47:13.475353 IP 99.181.89.228.1935 > 10.8.0.7.44082: Flags [.], ack 52967, win 156, options [nop,nop,TS val 3255248038 ecr 3944038429], length 0
23:47:13.475389 IP 10.8.0.7.44082 > 99.181.89.228.1935: Flags [P.], seq 68735:68899, ack 1, win 501, options [nop,nop,TS val 3944038972 ecr 3255248038], length 164
23:47:13.517559 IP 10.8.0.7.44082 > 99.181.89.228.1935: Flags [.], seq 68899:70213, ack 1, win 501, options [nop,nop,TS val 3944039014 ecr 3255248038], length 1314
23:47:13.526618 IP 99.181.89.228.1935 > 10.8.0.7.44082: Flags [.], ack 54281, win 155, options [nop,nop,TS val 3255248090 ecr 3944038480], length 0
23:47:13.549503 IP 10.8.0.7.44082 > 99.181.89.228.1935: Flags [.], seq 70213:71527, ack 1, win 501, options [nop,nop,TS val 3944039046 ecr 3255248090], length 1314
23:47:13.585700 IP 10.8.0.7.44082 > 99.181.89.228.1935: Flags [.], seq 71527:72841, ack 1, win 501, options [nop,nop,TS val 3944039082 ecr 3255248090], length 1314
23:47:13.595050 IP 99.181.89.228.1935 > 10.8.0.7.44082: Flags [.], ack 56909, win 155, options [nop,nop,TS val 3255248158 ecr 3944038515], length 0
23:47:13.649707 IP 10.8.0.7.44082 > 99.181.89.228.1935: Flags [.], seq 72841:74155, ack 1, win 501, options [nop,nop,TS val 3944039146 ecr 3255248158], length 1314
23:47:13.685108 IP 10.8.0.7.44082 > 99.181.89.228.1935: Flags [.], seq 74155:75469, ack 1, win 501, options [nop,nop,TS val 3944039181 ecr 3255248158], length 1314
23:47:13.694685 IP 99.181.89.228.1935 > 10.8.0.7.44082: Flags [.], ack 59537, win 155, options [nop,nop,TS val 3255248258 ecr 3944038614], length 0
23:47:13.719406 IP 10.8.0.7.44082 > 99.181.89.228.1935: Flags [.], seq 75469:76783, ack 1, win 501, options [nop,nop,TS val 3944039216 ecr 3255248258], length 1314
23:47:13.784020 IP 10.8.0.7.44082 > 99.181.89.228.1935: Flags [.], seq 76783:78097, ack 1, win 501, options [nop,nop,TS val 3944039280 ecr 3255248258], length 1314
23:47:13.793426 IP 99.181.89.228.1935 > 10.8.0.7.44082: Flags [.], ack 62165, win 155, options [nop,nop,TS val 3255248357 ecr 3944038682], length 0
23:47:13.818301 IP 10.8.0.7.44082 > 99.181.89.228.1935: Flags [.], seq 78097:79411, ack 1, win 501, options [nop,nop,TS val 3944039315 ecr 3255248357], length 1314
23:47:13.827865 IP 99.181.89.228.1935 > 10.8.0.7.44082: Flags [.], ack 63479, win 162, options [nop,nop,TS val 3255248391 ecr 3944038782], length 0
23:47:13.852055 IP 10.8.0.7.44082 > 99.181.89.228.1935: Flags [.], seq 79411:80725, ack 1, win 501, options [nop,nop,TS val 3944039348 ecr 3255248391], length 1314
23:47:13.860928 IP 99.181.89.228.1935 > 10.8.0.7.44082: Flags [.], ack 64793, win 167, options [nop,nop,TS val 3255248424 ecr 3944038815], length 0
23:47:13.918733 IP 10.8.0.7.44082 > 99.181.89.228.1935: Flags [.], seq 80725:82039, ack 1, win 501, options [nop,nop,TS val 3944039415 ecr 3255248424], length 1314
23:47:13.926453 IP 99.181.89.228.1935 > 10.8.0.7.44082: Flags [.], ack 66107, win 173, options [nop,nop,TS val 3255248490 ecr 3944038880], length 0
23:47:13.952090 IP 10.8.0.7.44082 > 99.181.89.228.1935: Flags [.], seq 82039:83353, ack 1, win 501, options [nop,nop,TS val 3944039448 ecr 3255248490], length 1314
23:47:13.959862 IP 99.181.89.228.1935 > 10.8.0.7.44082: Flags [.], ack 67421, win 179, options [nop,nop,TS val 3255248523 ecr 3944038914], length 0
23:47:13.985450 IP 10.8.0.7.44082 > 99.181.89.228.1935: Flags [.], seq 83353:84667, ack 1, win 501, options [nop,nop,TS val 3944039482 ecr 3255248523], length 1314
23:47:13.994665 IP 99.181.89.228.1935 > 10.8.0.7.44082: Flags [.], ack 68735, win 184, options [nop,nop,TS val 3255248558 ecr 3944038948], length 0
23:47:14.017640 IP 99.181.89.228.1935 > 10.8.0.7.44082: Flags [.], ack 68899, win 190, options [nop,nop,TS val 3255248581 ecr 3944038972], length 0
23:47:14.017680 IP 10.8.0.7.44082 > 99.181.89.228.1935: Flags [P.], seq 84667:84927, ack 1, win 501, options [nop,nop,TS val 3944039514 ecr 3255248581], length 260
23:47:14.050838 IP 10.8.0.7.44082 > 99.181.89.228.1935: Flags [.], seq 84927:86241, ack 1, win 501, options [nop,nop,TS val 3944039547 ecr 3255248581], length 1314
23:47:14.059940 IP 99.181.89.228.1935 > 10.8.0.7.44082: Flags [.], ack 70213, win 195, options [nop,nop,TS val 3255248623 ecr 3944039014], length 0
23:47:14.082662 IP 10.8.0.7.44082 > 99.181.89.228.1935: Flags [.], seq 86241:87555, ack 1, win 501, options [nop,nop,TS val 3944039579 ecr 3255248623], length 1314
23:47:14.091838 IP 99.181.89.228.1935 > 10.8.0.7.44082: Flags [.], ack 71527, win 201, options [nop,nop,TS val 3255248655 ecr 3944039046], length 0
23:47:14.128026 IP 99.181.89.228.1935 > 10.8.0.7.44082: Flags [.], ack 72841, win 207, options [nop,nop,TS val 3255248691 ecr 3944039082], length 0
23:47:14.141833 IP 10.8.0.7.44082 > 99.181.89.228.1935: Flags [.], seq 87555:88869, ack 1, win 501, options [nop,nop,TS val 3944039638 ecr 3255248691], length 1314
23:47:14.184545 IP 10.8.0.7.44082 > 99.181.89.228.1935: Flags [.], seq 88869:90183, ack 1, win 501, options [nop,nop,TS val 3944039681 ecr 3255248691], length 1314
23:47:14.191993 IP 99.181.89.228.1935 > 10.8.0.7.44082: Flags [.], ack 74155, win 212, options [nop,nop,TS val 3255248755 ecr 3944039146], length 0
23:47:14.216390 IP 10.8.0.7.44082 > 99.181.89.228.1935: Flags [.], seq 90183:91497, ack 1, win 501, options [nop,nop,TS val 3944039713 ecr 3255248755], length 1314
23:47:14.227544 IP 99.181.89.228.1935 > 10.8.0.7.44082: Flags [.], ack 75469, win 218, options [nop,nop,TS val 3255248791 ecr 3944039181], length 0
23:47:14.261779 IP 99.181.89.228.1935 > 10.8.0.7.44082: Flags [.], ack 76783, win 223, options [nop,nop,TS val 3255248825 ecr 3944039216], length 0
23:47:14.269742 IP 10.8.0.7.44082 > 99.181.89.228.1935: Flags [.], seq 91497:92811, ack 1, win 501, options [nop,nop,TS val 3944039766 ecr 3255248825], length 1314
23:47:14.316363 IP 10.8.0.7.44082 > 99.181.89.228.1935: Flags [.], seq 92811:94125, ack 1, win 501, options [nop,nop,TS val 3944039813 ecr 3255248825], length 1314
23:47:14.327255 IP 99.181.89.228.1935 > 10.8.0.7.44082: Flags [.], ack 78097, win 229, options [nop,nop,TS val 3255248891 ecr 3944039280], length 0
23:47:14.352561 IP 10.8.0.7.44082 > 99.181.89.228.1935: Flags [.], seq 94125:95439, ack 1, win 501, options [nop,nop,TS val 3944039849 ecr 3255248891], length 1314
23:47:14.361241 IP 99.181.89.228.1935 > 10.8.0.7.44082: Flags [.], ack 79411, win 235, options [nop,nop,TS val 3255248924 ecr 3944039315], length 0
23:47:14.394424 IP 99.181.89.228.1935 > 10.8.0.7.44082: Flags [.], ack 80725, win 240, options [nop,nop,TS val 3255248958 ecr 3944039348], length 0
23:47:14.397306 IP 10.8.0.7.44082 > 99.181.89.228.1935: Flags [.], seq 95439:96753, ack 1, win 501, options [nop,nop,TS val 3944039894 ecr 3255248958], length 1314
23:47:14.451964 IP 10.8.0.7.44082 > 99.181.89.228.1935: Flags [.], seq 96753:98067, ack 1, win 501, options [nop,nop,TS val 3944039948 ecr 3255248958], length 1314
23:47:14.461431 IP 99.181.89.228.1935 > 10.8.0.7.44082: Flags [.], ack 82039, win 246, options [nop,nop,TS val 3255249025 ecr 3944039415], length 0
23:47:14.485930 IP 10.8.0.7.44082 > 99.181.89.228.1935: Flags [.], seq 98067:99381, ack 1, win 501, options [nop,nop,TS val 3944039982 ecr 3255249025], length 1314
23:47:14.494429 IP 99.181.89.228.1935 > 10.8.0.7.44082: Flags [.], ack 83353, win 252, options [nop,nop,TS val 3255249058 ecr 3944039448], length 0
23:47:14.525163 IP 10.8.0.7.44082 > 99.181.89.228.1935: Flags [.], seq 99381:100695, ack 1, win 501, options [nop,nop,TS val 3944040021 ecr 3255249058], length 1314
23:47:14.527800 IP 99.181.89.228.1935 > 10.8.0.7.44082: Flags [.], ack 84667, win 257, options [nop,nop,TS val 3255249091 ecr 3944039482], length 0
23:47:14.559831 IP 99.181.89.228.1935 > 10.8.0.7.44082: Flags [.], ack 84927, win 263, options [nop,nop,TS val 3255249123 ecr 3944039514], length 0
23:47:14.559848 IP 10.8.0.7.44082 > 99.181.89.228.1935: Flags [P.], seq 100695:101695, ack 1, win 501, options [nop,nop,TS val 3944040056 ecr 3255249123], length 1000
23:47:14.593352 IP 99.181.89.228.1935 > 10.8.0.7.44082: Flags [.], ack 86241, win 268, options [nop,nop,TS val 3255249156 ecr 3944039547], length 0
23:47:14.619202 IP 10.8.0.7.44082 > 99.181.89.228.1935: Flags [.], seq 101695:103009, ack 1, win 501, options [nop,nop,TS val 3944040116 ecr 3255249156], length 1314
23:47:14.625114 IP 99.181.89.228.1935 > 10.8.0.7.44082: Flags [.], ack 87555, win 274, options [nop,nop,TS val 3255249188 ecr 3944039579], length 0
23:47:14.653438 IP 10.8.0.7.44082 > 99.181.89.228.1935: Flags [.], seq 103009:104323, ack 1, win 501, options [nop,nop,TS val 3944040150 ecr 3255249188], length 1314
23:47:14.684056 IP 99.181.89.228.1935 > 10.8.0.7.44082: Flags [.], ack 88869, win 280, options [nop,nop,TS val 3255249247 ecr 3944039638], length 0
23:47:14.684268 IP 10.8.0.7.44082 > 99.181.89.228.1935: Flags [.], seq 104323:105637, ack 1, win 501, options [nop,nop,TS val 3944040181 ecr 3255249247], length 1314
23:47:14.726676 IP 99.181.89.228.1935 > 10.8.0.7.44082: Flags [.], ack 90183, win 285, options [nop,nop,TS val 3255249290 ecr 3944039681], length 0
23:47:14.751179 IP 10.8.0.7.44082 > 99.181.89.228.1935: Flags [.], seq 105637:106951, ack 1, win 501, options [nop,nop,TS val 3944040247 ecr 3255249290], length 1314
23:47:14.758736 IP 99.181.89.228.1935 > 10.8.0.7.44082: Flags [.], ack 91497, win 291, options [nop,nop,TS val 3255249322 ecr 3944039713], length 0
23:47:14.785669 IP 10.8.0.7.44082 > 99.181.89.228.1935: Flags [.], seq 106951:108265, ack 1, win 501, options [nop,nop,TS val 3944040282 ecr 3255249322], length 1314
23:47:14.812116 IP 99.181.89.228.1935 > 10.8.0.7.44082: Flags [.], ack 92811, win 296, options [nop,nop,TS val 3255249375 ecr 3944039766], length 0
23:47:14.819196 IP 10.8.0.7.44082 > 99.181.89.228.1935: Flags [.], seq 108265:109579, ack 1, win 501, options [nop,nop,TS val 3944040316 ecr 3255249375], length 1314
23:47:14.858897 IP 99.181.89.228.1935 > 10.8.0.7.44082: Flags [.], ack 94125, win 302, options [nop,nop,TS val 3255249422 ecr 3944039813], length 0
23:47:14.885837 IP 10.8.0.7.44082 > 99.181.89.228.1935: Flags [.], seq 109579:110893, ack 1, win 501, options [nop,nop,TS val 3944040382 ecr 3255249422], length 1314
23:47:14.895058 IP 99.181.89.228.1935 > 10.8.0.7.44082: Flags [.], ack 95439, win 308, options [nop,nop,TS val 3255249458 ecr 3944039849], length 0
23:47:14.919540 IP 10.8.0.7.44082 > 99.181.89.228.1935: Flags [.], seq 110893:112207, ack 1, win 501, options [nop,nop,TS val 3944040416 ecr 3255249458], length 1314
23:47:14.939484 IP 99.181.89.228.1935 > 10.8.0.7.44082: Flags [.], ack 96753, win 313, options [nop,nop,TS val 3255249503 ecr 3944039894], length 0
23:47:14.953300 IP 10.8.0.7.44082 > 99.181.89.228.1935: Flags [.], seq 112207:113521, ack 1, win 501, options [nop,nop,TS val 3944040450 ecr 3255249503], length 1314
23:47:14.994294 IP 99.181.89.228.1935 > 10.8.0.7.44082: Flags [.], ack 98067, win 319, options [nop,nop,TS val 3255249558 ecr 3944039948], length 0
23:47:15.017139 IP 10.8.0.7.44082 > 99.181.89.228.1935: Flags [.], seq 113521:114835, ack 1, win 501, options [nop,nop,TS val 3944040513 ecr 3255249558], length 1314
23:47:15.028279 IP 99.181.89.228.1935 > 10.8.0.7.44082: Flags [.], ack 99381, win 325, options [nop,nop,TS val 3255249592 ecr 3944039982], length 0
23:47:15.050719 IP 10.8.0.7.44082 > 99.181.89.228.1935: Flags [.], seq 114835:116149, ack 1, win 501, options [nop,nop,TS val 3944040547 ecr 3255249592], length 1314
23:47:15.067262 IP 99.181.89.228.1935 > 10.8.0.7.44082: Flags [.], ack 100695, win 330, options [nop,nop,TS val 3255249631 ecr 3944040021], length 0
23:47:15.081894 IP 10.8.0.7.44082 > 99.181.89.228.1935: Flags [.], seq 116149:117463, ack 1, win 501, options [nop,nop,TS val 3944040578 ecr 3255249631], length 1314
23:47:15.101995 IP 99.181.89.228.1935 > 10.8.0.7.44082: Flags [.], ack 101695, win 336, options [nop,nop,TS val 3255249665 ecr 3944040056], length 0
23:47:15.102010 IP 10.8.0.7.44082 > 99.181.89.228.1935: Flags [P.], seq 117463:117624, ack 1, win 501, options [nop,nop,TS val 3944040598 ecr 3255249665], length 161
23:47:15.152564 IP 10.8.0.7.44082 > 99.181.89.228.1935: Flags [.], seq 117624:118938, ack 1, win 501, options [nop,nop,TS val 3944040649 ecr 3255249665], length 1314
23:47:15.161718 IP 99.181.89.228.1935 > 10.8.0.7.44082: Flags [.], ack 103009, win 342, options [nop,nop,TS val 3255249725 ecr 3944040116], length 0
23:47:15.188163 IP 10.8.0.7.44082 > 99.181.89.228.1935: Flags [.], seq 118938:120252, ack 1, win 501, options [nop,nop,TS val 3944040684 ecr 3255249725], length 1314
23:47:15.195928 IP 99.181.89.228.1935 > 10.8.0.7.44082: Flags [.], ack 104323, win 347, options [nop,nop,TS val 3255249759 ecr 3944040150], length 0
23:47:15.219259 IP 10.8.0.7.44082 > 99.181.89.228.1935: Flags [.], seq 120252:121566, ack 1, win 501, options [nop,nop,TS val 3944040716 ecr 3255249759], length 1314
23:47:15.226723 IP 99.181.89.228.1935 > 10.8.0.7.44082: Flags [.], ack 105637, win 353, options [nop,nop,TS val 3255249790 ecr 3944040181], length 0
23:47:15.282299 IP 10.8.0.7.44082 > 99.181.89.228.1935: Flags [.], seq 121566:122880, ack 1, win 501, options [nop,nop,TS val 3944040779 ecr 3255249790], length 1314
23:47:15.293631 IP 99.181.89.228.1935 > 10.8.0.7.44082: Flags [.], ack 106951, win 359, options [nop,nop,TS val 3255249857 ecr 3944040247], length 0
23:47:15.318399 IP 10.8.0.7.44082 > 99.181.89.228.1935: Flags [.], seq 122880:124194, ack 1, win 501, options [nop,nop,TS val 3944040815 ecr 3255249857], length 1314
23:47:15.328104 IP 99.181.89.228.1935 > 10.8.0.7.44082: Flags [.], ack 108265, win 364, options [nop,nop,TS val 3255249891 ecr 3944040282], length 0
23:47:15.352658 IP 10.8.0.7.44082 > 99.181.89.228.1935: Flags [.], seq 124194:125508, ack 1, win 501, options [nop,nop,TS val 3944040849 ecr 3255249891], length 1314
23:47:15.363896 IP 99.181.89.228.1935 > 10.8.0.7.44082: Flags [.], ack 109579, win 370, options [nop,nop,TS val 3255249925 ecr 3944040316], length 0
23:47:15.416488 IP 10.8.0.7.44082 > 99.181.89.228.1935: Flags [.], seq 125508:126822, ack 1, win 501, options [nop,nop,TS val 3944040913 ecr 3255249925], length 1314
23:47:15.428277 IP 99.181.89.228.1935 > 10.8.0.7.44082: Flags [.], ack 110893, win 376, options [nop,nop,TS val 3255249991 ecr 3944040382], length 0
23:47:15.452252 IP 10.8.0.7.44082 > 99.181.89.228.1935: Flags [.], seq 126822:128136, ack 1, win 501, options [nop,nop,TS val 3944040949 ecr 3255249991], length 1314
23:47:15.462304 IP 99.181.89.228.1935 > 10.8.0.7.44082: Flags [.], ack 112207, win 381, options [nop,nop,TS val 3255250026 ecr 3944040416], length 0
23:47:15.487676 IP 10.8.0.7.44082 > 99.181.89.228.1935: Flags [.], seq 128136:129450, ack 1, win 501, options [nop,nop,TS val 3944040984 ecr 3255250026], length 1314
23:47:15.495483 IP 99.181.89.228.1935 > 10.8.0.7.44082: Flags [.], ack 113521, win 387, options [nop,nop,TS val 3255250059 ecr 3944040450], length 0
23:47:15.552551 IP 10.8.0.7.44082 > 99.181.89.228.1935: Flags [.], seq 129450:130764, ack 1, win 501, options [nop,nop,TS val 3944041049 ecr 3255250059], length 1314
23:47:15.559500 IP 99.181.89.228.1935 > 10.8.0.7.44082: Flags [.], ack 114835, win 393, options [nop,nop,TS val 3255250123 ecr 3944040513], length 0
23:47:15.586191 IP 10.8.0.7.44082 > 99.181.89.228.1935: Flags [.], seq 130764:132078, ack 1, win 501, options [nop,nop,TS val 3944041082 ecr 3255250123], length 1314
23:47:15.593003 IP 99.181.89.228.1935 > 10.8.0.7.44082: Flags [.], ack 116149, win 398, options [nop,nop,TS val 3255250156 ecr 3944040547], length 0
23:47:15.619322 IP 10.8.0.7.44082 > 99.181.89.228.1935: Flags [.], seq 132078:133392, ack 1, win 501, options [nop,nop,TS val 3944041116 ecr 3255250156], length 1314
23:47:15.624290 IP 99.181.89.228.1935 > 10.8.0.7.44082: Flags [.], ack 117463, win 404, options [nop,nop,TS val 3255250188 ecr 3944040578], length 0
23:47:15.644301 IP 99.181.89.228.1935 > 10.8.0.7.44082: Flags [.], ack 117624, win 409, options [nop,nop,TS val 3255250208 ecr 3944040598], length 0
23:47:15.644336 IP 10.8.0.7.44082 > 99.181.89.228.1935: Flags [P.], seq 133392:133657, ack 1, win 501, options [nop,nop,TS val 3944041141 ecr 3255250208], length 265
23:47:15.685857 IP 10.8.0.7.44082 > 99.181.89.228.1935: Flags [.], seq 133657:134971, ack 1, win 501, options [nop,nop,TS val 3944041182 ecr 3255250208], length 1314
23:47:15.695079 IP 99.181.89.228.1935 > 10.8.0.7.44082: Flags [.], ack 118938, win 415, options [nop,nop,TS val 3255250258 ecr 3944040649], length 0
23:47:15.724034 IP 10.8.0.7.44082 > 99.181.89.228.1935: Flags [.], seq 134971:136285, ack 1, win 501, options [nop,nop,TS val 3944041220 ecr 3255250258], length 1314
23:47:15.730684 IP 99.181.89.228.1935 > 10.8.0.7.44082: Flags [.], ack 120252, win 420, options [nop,nop,TS val 3255250294 ecr 3944040684], length 0
23:47:15.761646 IP 99.181.89.228.1935 > 10.8.0.7.44082: Flags [.], ack 121566, win 426, options [nop,nop,TS val 3255250325 ecr 3944040716], length 0
23:47:15.766941 IP 10.8.0.7.44082 > 99.181.89.228.1935: Flags [.], seq 136285:137599, ack 1, win 501, options [nop,nop,TS val 3944041263 ecr 3255250325], length 1314
23:47:15.817623 IP 10.8.0.7.44082 > 99.181.89.228.1935: Flags [.], seq 137599:138913, ack 1, win 501, options [nop,nop,TS val 3944041314 ecr 3255250325], length 1314
23:47:15.824672 IP 99.181.89.228.1935 > 10.8.0.7.44082: Flags [.], ack 122880, win 432, options [nop,nop,TS val 3255250388 ecr 3944040779], length 0
23:47:15.852309 IP 10.8.0.7.44082 > 99.181.89.228.1935: Flags [.], seq 138913:140227, ack 1, win 501, options [nop,nop,TS val 3944041349 ecr 3255250388], length 1314
23:47:15.861095 IP 99.181.89.228.1935 > 10.8.0.7.44082: Flags [.], ack 124194, win 437, options [nop,nop,TS val 3255250424 ecr 3944040815], length 0
23:47:15.895022 IP 99.181.89.228.1935 > 10.8.0.7.44082: Flags [.], ack 125508, win 443, options [nop,nop,TS val 3255250458 ecr 3944040849], length 0
23:47:15.895095 IP 10.8.0.7.44082 > 99.181.89.228.1935: Flags [.], seq 140227:141541, ack 1, win 501, options [nop,nop,TS val 3944041391 ecr 3255250458], length 1314
23:47:15.950837 IP 10.8.0.7.44082 > 99.181.89.228.1935: Flags [.], seq 141541:142855, ack 1, win 501, options [nop,nop,TS val 3944041447 ecr 3255250458], length 1314
23:47:15.958846 IP 99.181.89.228.1935 > 10.8.0.7.44082: Flags [.], ack 126822, win 449, options [nop,nop,TS val 3255250522 ecr 3944040913], length 0
23:47:15.984299 IP 10.8.0.7.44082 > 99.181.89.228.1935: Flags [.], seq 142855:144169, ack 1, win 501, options [nop,nop,TS val 3944041481 ecr 3255250522], length 1314
23:47:15.994897 IP 99.181.89.228.1935 > 10.8.0.7.44082: Flags [.], ack 128136, win 454, options [nop,nop,TS val 3255250558 ecr 3944040949], length 0
23:47:16.023118 IP 10.8.0.7.44082 > 99.181.89.228.1935: Flags [.], seq 144169:145483, ack 1, win 501, options [nop,nop,TS val 3944041519 ecr 3255250558], length 1314
23:47:16.030023 IP 99.181.89.228.1935 > 10.8.0.7.44082: Flags [.], ack 129450, win 460, options [nop,nop,TS val 3255250593 ecr 3944040984], length 0
23:47:16.087265 IP 10.8.0.7.44082 > 99.181.89.228.1935: Flags [.], seq 145483:146797, ack 1, win 501, options [nop,nop,TS val 3944041584 ecr 3255250593], length 1314
23:47:16.095115 IP 99.181.89.228.1935 > 10.8.0.7.44082: Flags [.], ack 130764, win 466, options [nop,nop,TS val 3255250658 ecr 3944041049], length 0
23:47:16.117479 IP 10.8.0.7.44082 > 99.181.89.228.1935: Flags [.], seq 146797:148111, ack 1, win 501, options [nop,nop,TS val 3944041614 ecr 3255250658], length 1314
23:47:16.128866 IP 99.181.89.228.1935 > 10.8.0.7.44082: Flags [.], ack 132078, win 471, options [nop,nop,TS val 3255250692 ecr 3944041082], length 0
23:47:16.152086 IP 10.8.0.7.44082 > 99.181.89.228.1935: Flags [.], seq 148111:149425, ack 1, win 501, options [nop,nop,TS val 3944041648 ecr 3255250692], length 1314
23:47:16.161828 IP 99.181.89.228.1935 > 10.8.0.7.44082: Flags [.], ack 133392, win 477, options [nop,nop,TS val 3255250725 ecr 3944041116], length 0
23:47:16.186723 IP 99.181.89.228.1935 > 10.8.0.7.44082: Flags [.], ack 133657, win 482, options [nop,nop,TS val 3255250750 ecr 3944041141], length 0
23:47:16.186762 IP 10.8.0.7.44082 > 99.181.89.228.1935: Flags [P.], seq 149425:150424, ack 1, win 501, options [nop,nop,TS val 3944041683 ecr 3255250750], length 999
23:47:16.228538 IP 99.181.89.228.1935 > 10.8.0.7.44082: Flags [.], ack 134971, win 488, options [nop,nop,TS val 3255250792 ecr 3944041182], length 0
23:47:16.258461 IP 10.8.0.7.44082 > 99.181.89.228.1935: Flags [.], seq 150424:151738, ack 1, win 501, options [nop,nop,TS val 3944041755 ecr 3255250792], length 1314
23:47:16.266367 IP 99.181.89.228.1935 > 10.8.0.7.44082: Flags [.], ack 136285, win 493, options [nop,nop,TS val 3255250830 ecr 3944041220], length 0
23:47:16.281716 IP 10.8.0.7.44082 > 99.181.89.228.1935: Flags [.], seq 151738:153052, ack 1, win 501, options [nop,nop,TS val 3944041778 ecr 3255250830], length 1314
23:47:16.309485 IP 99.181.89.228.1935 > 10.8.0.7.44082: Flags [.], ack 137599, win 499, options [nop,nop,TS val 3255250873 ecr 3944041263], length 0
23:47:16.322161 IP 10.8.0.7.44082 > 99.181.89.228.1935: Flags [.], seq 153052:154366, ack 1, win 501, options [nop,nop,TS val 3944041818 ecr 3255250873], length 1314
23:47:16.360139 IP 99.181.89.228.1935 > 10.8.0.7.44082: Flags [.], ack 138913, win 505, options [nop,nop,TS val 3255250923 ecr 3944041314], length 0
23:47:16.386541 IP 10.8.0.7.44082 > 99.181.89.228.1935: Flags [.], seq 154366:155680, ack 1, win 501, options [nop,nop,TS val 3944041883 ecr 3255250923], length 1314
23:47:16.394900 IP 99.181.89.228.1935 > 10.8.0.7.44082: Flags [.], ack 140227, win 510, options [nop,nop,TS val 3255250958 ecr 3944041349], length 0
23:47:16.418915 IP 10.8.0.7.44082 > 99.181.89.228.1935: Flags [.], seq 155680:156994, ack 1, win 501, options [nop,nop,TS val 3944041915 ecr 3255250958], length 1314
23:47:16.437519 IP 99.181.89.228.1935 > 10.8.0.7.44082: Flags [.], ack 141541, win 516, options [nop,nop,TS val 3255251001 ecr 3944041391], length 0
23:47:16.451052 IP 10.8.0.7.44082 > 99.181.89.228.1935: Flags [.], seq 156994:158308, ack 1, win 501, options [nop,nop,TS val 3944041947 ecr 3255251001], length 1314
23:47:16.493053 IP 99.181.89.228.1935 > 10.8.0.7.44082: Flags [.], ack 142855, win 522, options [nop,nop,TS val 3255251056 ecr 3944041447], length 0
23:47:16.517676 IP 10.8.0.7.44082 > 99.181.89.228.1935: Flags [.], seq 158308:159622, ack 1, win 501, options [nop,nop,TS val 3944042014 ecr 3255251056], length 1314
23:47:16.527251 IP 99.181.89.228.1935 > 10.8.0.7.44082: Flags [.], ack 144169, win 527, options [nop,nop,TS val 3255251090 ecr 3944041481], length 0
23:47:16.557638 IP 10.8.0.7.44082 > 99.181.89.228.1935: Flags [.], seq 159622:160936, ack 1, win 501, options [nop,nop,TS val 3944042054 ecr 3255251090], length 1314
23:47:16.565458 IP 99.181.89.228.1935 > 10.8.0.7.44082: Flags [.], ack 145483, win 533, options [nop,nop,TS val 3255251129 ecr 3944041519], length 0
23:47:16.584238 IP 10.8.0.7.44082 > 99.181.89.228.1935: Flags [.], seq 160936:162250, ack 1, win 501, options [nop,nop,TS val 3944042081 ecr 3255251129], length 1314
23:47:16.629684 IP 99.181.89.228.1935 > 10.8.0.7.44082: Flags [.], ack 146797, win 539, options [nop,nop,TS val 3255251193 ecr 3944041584], length 0
23:47:16.651474 IP 10.8.0.7.44082 > 99.181.89.228.1935: Flags [.], seq 162250:163564, ack 1, win 501, options [nop,nop,TS val 3944042148 ecr 3255251193], length 1314
23:47:16.659693 IP 99.181.89.228.1935 > 10.8.0.7.44082: Flags [.], ack 148111, win 544, options [nop,nop,TS val 3255251223 ecr 3944041614], length 0
23:47:16.685827 IP 10.8.0.7.44082 > 99.181.89.228.1935: Flags [.], seq 163564:164878, ack 1, win 501, options [nop,nop,TS val 3944042182 ecr 3255251223], length 1314
23:47:16.694523 IP 99.181.89.228.1935 > 10.8.0.7.44082: Flags [.], ack 149425, win 550, options [nop,nop,TS val 3255251258 ecr 3944041648], length 0
23:47:16.717068 IP 10.8.0.7.44082 > 99.181.89.228.1935: Flags [.], seq 164878:166192, ack 1, win 501, options [nop,nop,TS val 3944042213 ecr 3255251258], length 1314
