11:03:51.078813 IP 10.8.3.8.50586 > 185.42.204.235.1935: Flags [.], seq 1395120474:1395121788, ack 1848821847, win 501, options [nop,nop,TS val 4162321182 ecr 1304990892], length 1314
11:03:51.109861 IP 185.42.204.235.1935 > 10.8.3.8.50586: Flags [.], ack 4294958628, win 126, options [nop,nop,TS val 1304990984 ecr 4162320778], length 0
11:03:51.110955 IP 10.8.3.8.50586 > 185.42.204.235.1935: Flags [.], seq 1314:2628, ack 1, win 501, options [nop,nop,TS val 4162321214 ecr 1304990984], length 1314
11:03:51.144856 IP 10.8.3.8.50586 > 185.42.204.235.1935: Flags [.], seq 2628:3942, ack 1, win 501, options [nop,nop,TS val 4162321248 ecr 1304990984], length 1314
11:03:51.172366 IP 185.42.204.235.1935 > 10.8.3.8.50586: Flags [.], ack 4294961256, win 126, options [nop,nop,TS val 1304991048 ecr 4162320881], length 0
11:03:51.211997 IP 10.8.3.8.50586 > 185.42.204.235.1935: Flags [.], seq 3942:5256, ack 1, win 501, options [nop,nop,TS val 4162321315 ecr 1304991048], length 1314
11:03:51.212899 IP 185.42.204.235.1935 > 10.8.3.8.50586: Flags [.], ack 4294963354, win 126, options [nop,nop,TS val 1304991119 ecr 4162320979], length 0
11:03:51.212931 IP 10.8.3.8.50586 > 185.42.204.235.1935: Flags [P.], seq 5256:5957, ack 1, win 501, options [nop,nop,TS val 4162321316 ecr 1304991119], length 701
11:03:51.276266 IP 10.8.3.8.50586 > 185.42.204.235.1935: Flags [.], seq 5957:7271, ack 1, win 501, options [nop,nop,TS val 4162321380 ecr 1304991119], length 1314
11:03:51.308950 IP 185.42.204.235.1935 > 10.8.3.8.50586: Flags [.], ack 4294965982, win 126, options [nop,nop,TS val 1304991215 ecr 4162321049], length 0
11:03:51.310164 IP 10.8.3.8.50586 > 185.42.204.235.1935: Flags [.], seq 7271:8585, ack 1, win 501, options [nop,nop,TS val 4162321413 ecr 1304991215], length 1314
11:03:51.341648 IP 10.8.3.8.50586 > 185.42.204.235.1935: Flags [.], seq 8585:9899, ack 1, win 501, options [nop,nop,TS val 4162321445 ecr 1304991215], length 1314
11:03:51.409650 IP 10.8.3.8.50586 > 185.42.204.235.1935: Flags [.], seq 9899:11213, ack 1, win 501, options [nop,nop,TS val 4162321513 ecr 1304991215], length 1314
11:03:51.426978 IP 185.42.204.235.1935 > 10.8.3.8.50586: Flags [.], ack 0, win 126, options [nop,nop,TS val 1304991313 ecr 4162321112], length 0
11:03:51.446722 IP 10.8.3.8.50586 > 185.42.204.235.1935: Flags [.], seq 11213:12527, ack 1, win 501, options [nop,nop,TS val 4162321550 ecr 1304991313], length 1314
11:03:51.476411 IP 10.8.3.8.50586 > 185.42.204.235.1935: Flags [.], seq 12527:13841, ack 1, win 501, options [nop,nop,TS val 4162321580 ecr 1304991313], length 1314
11:03:51.478310 IP 185.42.204.235.1935 > 10.8.3.8.50586: Flags [.], ack 2628, win 126, options [nop,nop,TS val 1304991385 ecr 4162321182], length 0
11:03:51.543199 IP 10.8.3.8.50586 > 185.42.204.235.1935: Flags [.], seq 13841:15155, ack 1, win 501, options [nop,nop,TS val 4162321647 ecr 1304991385], length 1314
11:03:51.545710 IP 185.42.204.235.1935 > 10.8.3.8.50586: Flags [.], ack 5256, win 126, options [nop,nop,TS val 1304991452 ecr 4162321248], length 0
11:03:51.546943 IP 185.42.204.235.1935 > 10.8.3.8.50586: Flags [.], ack 5957, win 126, options [nop,nop,TS val 1304991453 ecr 4162321316], length 0
11:03:51.546962 IP 10.8.3.8.50586 > 185.42.204.235.1935: Flags [P.], seq 15155:15948, ack 1, win 501, options [nop,nop,TS val 4162321650 ecr 1304991453], length 793
11:03:51.608412 IP 10.8.3.8.50586 > 185.42.204.235.1935: Flags [.], seq 15948:17262, ack 1, win 501, options [nop,nop,TS val 4162321712 ecr 1304991453], length 1314
11:03:51.641367 IP 10.8.3.8.50586 > 185.42.204.235.1935: Flags [.], seq 17262:18576, ack 1, win 501, options [nop,nop,TS val 4162321745 ecr 1304991453], length 1314
11:03:51.672536 IP 185.42.204.235.1935 > 10.8.3.8.50586: Flags [.], ack 8585, win 126, options [nop,nop,TS val 1304991553 ecr 4162321380], length 0
11:03:51.675710 IP 10.8.3.8.50586 > 185.42.204.235.1935: Flags [.], seq 18576:19890, ack 1, win 501, options [nop,nop,TS val 4162321779 ecr 1304991553], length 1314
11:03:51.738334 IP 185.42.204.235.1935 > 10.8.3.8.50586: Flags [.], ack 9899, win 126, options [nop,nop,TS val 1304991645 ecr 4162321445], length 0
11:03:51.742595 IP 10.8.3.8.50586 > 185.42.204.235.1935: Flags [.], seq 19890:21204, ack 1, win 501, options [nop,nop,TS val 4162321846 ecr 1304991645], length 1314
11:03:51.774781 IP 10.8.3.8.50586 > 185.42.204.235.1935: Flags [.], seq 21204:22518, ack 1, win 501, options [nop,nop,TS val 4162321878 ecr 1304991645], length 1314
11:03:51.781680 IP 185.42.204.235.1935 > 10.8.3.8.50586: Flags [.], ack 12527, win 126, options [nop,nop,TS val 1304991687 ecr 4162321513], length 0
11:03:51.809626 IP 10.8.3.8.50586 > 185.42.204.235.1935: Flags [.], seq 22518:23832, ack 1, win 501, options [nop,nop,TS val 4162321913 ecr 1304991687], length 1314
11:03:51.877204 IP 185.42.204.235.1935 > 10.8.3.8.50586: Flags [.], ack 15155, win 126, options [nop,nop,TS val 1304991783 ecr 4162321580], length 0
11:03:51.878636 IP 10.8.3.8.50586 > 185.42.204.235.1935: Flags [.], seq 23832:25146, ack 1, win 501, options [nop,nop,TS val 4162321982 ecr 1304991783], length 1314
11:03:51.881736 IP 185.42.204.235.1935 > 10.8.3.8.50586: Flags [.], ack 15948, win 126, options [nop,nop,TS val 1304991788 ecr 4162321650], length 0
11:03:51.881770 IP 10.8.3.8.50586 > 185.42.204.235.1935: Flags [P.], seq 25146:25939, ack 1, win 501, options [nop,nop,TS val 4162321985 ecr 1304991788], length 793
11:03:51.943323 IP 10.8.3.8.50586 > 185.42.204.235.1935: Flags [.], seq 25939:27253, ack 1, win 501, options [nop,nop,TS val 4162322047 ecr 1304991788], length 1314
11:03:51.977068 IP 10.8.3.8.50586 > 185.42.204.235.1935: Flags [.], seq 27253:28567, ack 1, win 501, options [nop,nop,TS val 4162322080 ecr 1304991788], length 1314
11:03:51.996707 IP 185.42.204.235.1935 > 10.8.3.8.50586: Flags [.], ack 18576, win 126, options [nop,nop,TS val 1304991901 ecr 4162321712], length 0
11:03:52.008259 IP 10.8.3.8.50586 > 185.42.204.235.1935: Flags [.], seq 28567:29881, ack 1, win 501, options [nop,nop,TS val 4162322112 ecr 1304991901], length 1314
11:03:52.078100 IP 10.8.3.8.50586 > 185.42.204.235.1935: Flags [.], seq 29881:31195, ack 1, win 501, options [nop,nop,TS val 4162322181 ecr 1304991901], length 1314
11:03:52.079635 IP 185.42.204.235.1935 > 10.8.3.8.50586: Flags [.], ack 21204, win 126, options [nop,nop,TS val 1304991986 ecr 4162321779], length 0
11:03:52.112352 IP 10.8.3.8.50586 > 185.42.204.235.1935: Flags [.], seq 31195:32509, ack 1, win 501, options [nop,nop,TS val 4162322216 ecr 1304991986], length 1314
11:03:52.141858 IP 10.8.3.8.50586 > 185.42.204.235.1935: Flags [.], seq 32509:33823, ack 1, win 501, options [nop,nop,TS val 4162322245 ecr 1304991986], length 1314
11:03:52.149077 IP 185.42.204.235.1935 > 10.8.3.8.50586: Flags [.], ack 23832, win 126, options [nop,nop,TS val 1304992053 ecr 4162321878], length 0
11:03:52.210989 IP 10.8.3.8.50586 > 185.42.204.235.1935: Flags [.], seq 33823:35137, ack 1, win 501, options [nop,nop,TS val 4162322314 ecr 1304992053], length 1314
11:03:52.219178 IP 185.42.204.235.1935 > 10.8.3.8.50586: Flags [.], ack 25939, win 126, options [nop,nop,TS val 1304992122 ecr 4162321982], length 0
11:03:52.219204 IP 10.8.3.8.50586 > 185.42.204.235.1935: Flags [P.], seq 35137:35842, ack 1, win 501, options [nop,nop,TS val 4162322323 ecr 1304992122], length 705
11:03:52.276527 IP 10.8.3.8.50586 > 185.42.204.235.1935: Flags [.], seq 35842:37156, ack 1, win 501, options [nop,nop,TS val 4162322380 ecr 1304992122], length 1314
11:03:52.309750 IP 10.8.3.8.50586 > 185.42.204.235.1935: Flags [.], seq 37156:38470, ack 1, win 501, options [nop,nop,TS val 4162322413 ecr 1304992122], length 1314
11:03:52.311085 IP 185.42.204.235.1935 > 10.8.3.8.50586: Flags [.], ack 28567, win 126, options [nop,nop,TS val 1304992217 ecr 4162322047], length 0
11:03:52.344897 IP 10.8.3.8.50586 > 185.42.204.235.1935: Flags [.], seq 38470:39784, ack 1, win 501, options [nop,nop,TS val 4162322448 ecr 1304992217], length 1314
11:03:52.411797 IP 10.8.3.8.50586 > 185.42.204.235.1935: Flags [.], seq 39784:41098, ack 1, win 501, options [nop,nop,TS val 4162322515 ecr 1304992217], length 1314
11:03:52.430195 IP 185.42.204.235.1935 > 10.8.3.8.50586: Flags [.], ack 31195, win 126, options [nop,nop,TS val 1304992318 ecr 4162322112], length 0
11:03:52.445624 IP 10.8.3.8.50586 > 185.42.204.235.1935: Flags [.], seq 41098:42412, ack 1, win 501, options [nop,nop,TS val 4162322549 ecr 1304992318], length 1314
11:03:52.476890 IP 10.8.3.8.50586 > 185.42.204.235.1935: Flags [.], seq 42412:43726, ack 1, win 501, options [nop,nop,TS val 4162322580 ecr 1304992318], length 1314
11:03:52.479968 IP 185.42.204.235.1935 > 10.8.3.8.50586: Flags [.], ack 33823, win 126, options [nop,nop,TS val 1304992386 ecr 4162322216], length 0
11:03:52.543008 IP 10.8.3.8.50586 > 185.42.204.235.1935: Flags [.], seq 43726:45040, ack 1, win 501, options [nop,nop,TS val 4162322646 ecr 1304992386], length 1314
11:03:52.553657 IP 185.42.204.235.1935 > 10.8.3.8.50586: Flags [.], ack 35842, win 126, options [nop,nop,TS val 1304992459 ecr 4162322314], length 0
11:03:52.553687 IP 10.8.3.8.50586 > 185.42.204.235.1935: Flags [P.], seq 45040:45822, ack 1, win 501, options [nop,nop,TS val 4162322657 ecr 1304992459], length 782
11:03:52.612199 IP 10.8.3.8.50586 > 185.42.204.235.1935: Flags [.], seq 45822:47136, ack 1, win 501, options [nop,nop,TS val 4162322716 ecr 1304992459], length 1314
11:03:52.647083 IP 10.8.3.8.50586 > 185.42.204.235.1935: Flags [.], seq 47136:48450, ack 1, win 501, options [nop,nop,TS val 4162322750 ecr 1304992459], length 1314
11:03:52.647974 IP 185.42.204.235.1935 > 10.8.3.8.50586: Flags [.], ack 38470, win 126, options [nop,nop,TS val 1304992550 ecr 4162322380], length 0
11:03:52.680732 IP 10.8.3.8.50586 > 185.42.204.235.1935: Flags [.], seq 48450:49764, ack 1, win 501, options [nop,nop,TS val 4162322784 ecr 1304992550], length 1314
11:03:52.745073 IP 10.8.3.8.50586 > 185.42.204.235.1935: Flags [.], seq 49764:51078, ack 1, win 501, options [nop,nop,TS val 4162322848 ecr 1304992550], length 1314
11:03:52.756744 IP 185.42.204.235.1935 > 10.8.3.8.50586: Flags [.], ack 39784, win 126, options [nop,nop,TS val 1304992661 ecr 4162322448], length 0
11:03:52.779991 IP 10.8.3.8.50586 > 185.42.204.235.1935: Flags [.], seq 51078:52392, ack 1, win 501, options [nop,nop,TS val 4162322883 ecr 1304992661], length 1314
11:03:52.780893 IP 185.42.204.235.1935 > 10.8.3.8.50586: Flags [.], ack 42412, win 126, options [nop,nop,TS val 1304992688 ecr 4162322515], length 0
11:03:52.815016 IP 10.8.3.8.50586 > 185.42.204.235.1935: Flags [.], seq 52392:53706, ack 1, win 501, options [nop,nop,TS val 4162322918 ecr 1304992688], length 1314
11:03:52.877326 IP 185.42.204.235.1935 > 10.8.3.8.50586: Flags [.], ack 45040, win 126, options [nop,nop,TS val 1304992783 ecr 4162322580], length 0
11:03:52.877497 IP 10.8.3.8.50586 > 185.42.204.235.1935: Flags [.], seq 53706:55020, ack 1, win 501, options [nop,nop,TS val 4162322981 ecr 1304992783], length 1314
11:03:52.889547 IP 185.42.204.235.1935 > 10.8.3.8.50586: Flags [.], ack 45822, win 126, options [nop,nop,TS val 1304992796 ecr 4162322657], length 0
11:03:52.889568 IP 10.8.3.8.50586 > 185.42.204.235.1935: Flags [P.], seq 55020:55820, ack 1, win 501, options [nop,nop,TS val 4162322993 ecr 1304992796], length 800
11:03:52.942751 IP 10.8.3.8.50586 > 185.42.204.235.1935: Flags [.], seq 55820:57134, ack 1, win 501, options [nop,nop,TS val 4162323046 ecr 1304992796], length 1314
11:03:52.975169 IP 10.8.3.8.50586 > 185.42.204.235.1935: Flags [.], seq 57134:58448, ack 1, win 501, options [nop,nop,TS val 4162323078 ecr 1304992796], length 1314
11:03:52.987110 IP 185.42.204.235.1935 > 10.8.3.8.50586: Flags [.], ack 48450, win 126, options [nop,nop,TS val 1304992893 ecr 4162322716], length 0
11:03:53.009694 IP 10.8.3.8.50586 > 185.42.204.235.1935: Flags [.], seq 58448:59762, ack 1, win 501, options [nop,nop,TS val 4162323113 ecr 1304992893], length 1314
11:03:53.078030 IP 10.8.3.8.50586 > 185.42.204.235.1935: Flags [.], seq 59762:61076, ack 1, win 501, options [nop,nop,TS val 4162323181 ecr 1304992893], length 1314
11:03:53.083070 IP 185.42.204.235.1935 > 10.8.3.8.50586: Flags [.], ack 51078, win 126, options [nop,nop,TS val 1304992986 ecr 4162322784], length 0
11:03:53.110826 IP 10.8.3.8.50586 > 185.42.204.235.1935: Flags [.], seq 61076:62390, ack 1, win 501, options [nop,nop,TS val 4162323214 ecr 1304992986], length 1314
11:03:53.143979 IP 10.8.3.8.50586 > 185.42.204.235.1935: Flags [.], seq 62390:63704, ack 1, win 501, options [nop,nop,TS val 4162323247 ecr 1304992986], length 1314
11:03:53.154617 IP 185.42.204.235.1935 > 10.8.3.8.50586: Flags [.], ack 53706, win 126, options [nop,nop,TS val 1304993057 ecr 4162322883], length 0
11:03:53.208281 IP 10.8.3.8.50586 > 185.42.204.235.1935: Flags [.], seq 63704:65018, ack 1, win 501, options [nop,nop,TS val 4162323312 ecr 1304993057], length 1314
11:03:53.223555 IP 185.42.204.235.1935 > 10.8.3.8.50586: Flags [.], ack 55820, win 126, options [nop,nop,TS val 1304993130 ecr 4162322981], length 0
11:03:53.223567 IP 10.8.3.8.50586 > 185.42.204.235.1935: Flags [P.], seq 65018:65807, ack 1, win 501, options [nop,nop,TS val 4162323327 ecr 1304993130], length 789
11:03:53.279154 IP 10.8.3.8.50586 > 185.42.204.235.1935: Flags [.], seq 65807:67121, ack 1, win 501, options [nop,nop,TS val 4162323382 ecr 1304993130], length 1314
11:03:53.309392 IP 185.42.204.235.1935 > 10.8.3.8.50586: Flags [.], ack 58448, win 126, options [nop,nop,TS val 1304993216 ecr 4162323046], length 0
11:03:53.312416 IP 10.8.3.8.50586 > 185.42.204.235.1935: Flags [.], seq 67121:68435, ack 1, win 501, options [nop,nop,TS val 4162323416 ecr 1304993216], length 1314
11:03:53.350813 IP 10.8.3.8.50586 > 185.42.204.235.1935: Flags [.], seq 68435:69749, ack 1, win 501, options [nop,nop,TS val 4162323454 ecr 1304993216], length 1314
11:03:53.412409 IP 10.8.3.8.50586 > 185.42.204.235.1935: Flags [.], seq 69749:71063, ack 1, win 501, options [nop,nop,TS val 4162323516 ecr 1304993216], length 1314
11:03:53.416187 IP 185.42.204.235.1935 > 10.8.3.8.50586: Flags [.], ack 61076, win 126, options [nop,nop,TS val 1304993323 ecr 4162323113], length 0
11:03:53.445768 IP 10.8.3.8.50586 > 185.42.204.235.1935: Flags [.], seq 71063:72377, ack 1, win 501, options [nop,nop,TS val 4162323549 ecr 1304993323], length 1314
11:03:53.478681 IP 10.8.3.8.50586 > 185.42.204.235.1935: Flags [.], seq 72377:73691, ack 1, win 501, options [nop,nop,TS val 4162323582 ecr 1304993323], length 1314
11:03:53.485888 IP 185.42.204.235.1935 > 10.8.3.8.50586: Flags [.], ack 63704, win 126, options [nop,nop,TS val 1304993392 ecr 4162323214], length 0
11:03:53.542794 IP 10.8.3.8.50586 > 185.42.204.235.1935: Flags [.], seq 73691:75005, ack 1, win 501, options [nop,nop,TS val 4162323646 ecr 1304993392], length 1314
11:03:53.558592 IP 185.42.204.235.1935 > 10.8.3.8.50586: Flags [.], ack 65807, win 126, options [nop,nop,TS val 1304993465 ecr 4162323312], length 0
11:03:53.558636 IP 10.8.3.8.50586 > 185.42.204.235.1935: Flags [P.], seq 75005:75707, ack 1, win 501, options [nop,nop,TS val 4162323662 ecr 1304993465], length 702
11:03:53.612170 IP 10.8.3.8.50586 > 185.42.204.235.1935: Flags [.], seq 75707:77021, ack 1, win 501, options [nop,nop,TS val 4162323715 ecr 1304993465], length 1314
11:03:53.643046 IP 10.8.3.8.50586 > 185.42.204.235.1935: Flags [.], seq 77021:78335, ack 1, win 501, options [nop,nop,TS val 4162323746 ecr 1304993465], length 1314
11:03:53.646311 IP 185.42.204.235.1935 > 10.8.3.8.50586: Flags [.], ack 68435, win 126, options [nop,nop,TS val 1304993553 ecr 4162323382], length 0
11:03:53.675387 IP 10.8.3.8.50586 > 185.42.204.235.1935: Flags [.], seq 78335:79649, ack 1, win 501, options [nop,nop,TS val 4162323779 ecr 1304993553], length 1314
11:03:53.741663 IP 10.8.3.8.50586 > 185.42.204.235.1935: Flags [.], seq 79649:80963, ack 1, win 501, options [nop,nop,TS val 4162323845 ecr 1304993553], length 1314
11:03:53.746313 IP 185.42.204.235.1935 > 10.8.3.8.50586: Flags [.], ack 71063, win 126, options [nop,nop,TS val 1304993653 ecr 4162323454], length 0
11:03:53.777037 IP 10.8.3.8.50586 > 185.42.204.235.1935: Flags [.], seq 80963:82277, ack 1, win 501, options [nop,nop,TS val 4162323880 ecr 1304993653], length 1314
11:03:53.812426 IP 185.42.204.235.1935 > 10.8.3.8.50586: Flags [.], ack 73691, win 126, options [nop,nop,TS val 1304993719 ecr 4162323549], length 0
11:03:53.812488 IP 10.8.3.8.50586 > 185.42.204.235.1935: Flags [.], seq 82277:83591, ack 1, win 501, options [nop,nop,TS val 4162323916 ecr 1304993719], length 1314
11:03:53.876191 IP 10.8.3.8.50586 > 185.42.204.235.1935: Flags [.], seq 83591:84905, ack 1, win 501, options [nop,nop,TS val 4162323980 ecr 1304993719], length 1314
11:03:53.892627 IP 185.42.204.235.1935 > 10.8.3.8.50586: Flags [.], ack 75707, win 126, options [nop,nop,TS val 1304993799 ecr 4162323646], length 0
11:03:53.892649 IP 10.8.3.8.50586 > 185.42.204.235.1935: Flags [P.], seq 84905:85701, ack 1, win 501, options [nop,nop,TS val 4162323996 ecr 1304993799], length 796
11:03:53.941617 IP 10.8.3.8.50586 > 185.42.204.235.1935: Flags [.], seq 85701:87015, ack 1, win 501, options [nop,nop,TS val 4162324045 ecr 1304993799], length 1314
11:03:53.974964 IP 10.8.3.8.50586 > 185.42.204.235.1935: Flags [.], seq 87015:88329, ack 1, win 501, options [nop,nop,TS val 4162324078 ecr 1304993799], length 1314
11:03:53.978790 IP 185.42.204.235.1935 > 10.8.3.8.50586: Flags [.], ack 78335, win 126, options [nop,nop,TS val 1304993885 ecr 4162323715], length 0
11:03:54.011441 IP 10.8.3.8.50586 > 185.42.204.235.1935: Flags [.], seq 88329:89643, ack 1, win 501, options [nop,nop,TS val 4162324115 ecr 1304993885], length 1314
11:03:54.075421 IP 185.42.204.235.1935 > 10.8.3.8.50586: Flags [.], ack 80963, win 126, options [nop,nop,TS val 1304993982 ecr 4162323779], length 0
11:03:54.075784 IP 10.8.3.8.50586 > 185.42.204.235.1935: Flags [.], seq 89643:90957, ack 1, win 501, options [nop,nop,TS val 4162324179 ecr 1304993982], length 1314
11:03:54.112368 IP 10.8.3.8.50586 > 185.42.204.235.1935: Flags [.], seq 90957:92271, ack 1, win 501, options [nop,nop,TS val 4162324216 ecr 1304993982], length 1314
11:03:54.144102 IP 10.8.3.8.50586 > 185.42.204.235.1935: Flags [.], seq 92271:93585, ack 1, win 501, options [nop,nop,TS val 4162324247 ecr 1304993982], length 1314
11:03:54.146386 IP 185.42.204.235.1935 > 10.8.3.8.50586: Flags [.], ack 83591, win 126, options [nop,nop,TS val 1304994053 ecr 4162323880], length 0
11:03:54.210679 IP 10.8.3.8.50586 > 185.42.204.235.1935: Flags [.], seq 93585:94899, ack 1, win 501, options [nop,nop,TS val 4162324314 ecr 1304994053], length 1314
11:03:54.226573 IP 185.42.204.235.1935 > 10.8.3.8.50586: Flags [.], ack 85701, win 126, options [nop,nop,TS val 1304994133 ecr 4162323980], length 0
11:03:54.226602 IP 10.8.3.8.50586 > 185.42.204.235.1935: Flags [P.], seq 94899:95683, ack 1, win 501, options [nop,nop,TS val 4162324330 ecr 1304994133], length 784
11:03:54.279015 IP 10.8.3.8.50586 > 185.42.204.235.1935: Flags [.], seq 95683:96997, ack 1, win 501, options [nop,nop,TS val 4162324382 ecr 1304994133], length 1314
11:03:54.308997 IP 185.42.204.235.1935 > 10.8.3.8.50586: Flags [.], ack 88329, win 126, options [nop,nop,TS val 1304994215 ecr 4162324045], length 0
11:03:54.309345 IP 10.8.3.8.50586 > 185.42.204.235.1935: Flags [.], seq 96997:98311, ack 1, win 501, options [nop,nop,TS val 4162324413 ecr 1304994215], length 1314
11:03:54.354112 IP 10.8.3.8.50586 > 185.42.204.235.1935: Flags [.], seq 98311:99625, ack 1, win 501, options [nop,nop,TS val 4162324457 ecr 1304994215], length 1314
11:03:54.408472 IP 10.8.3.8.50586 > 185.42.204.235.1935: Flags [.], seq 99625:100939, ack 1, win 501, options [nop,nop,TS val 4162324512 ecr 1304994215], length 1314
11:03:54.409309 IP 185.42.204.235.1935 > 10.8.3.8.50586: Flags [.], ack 90957, win 126, options [nop,nop,TS val 1304994316 ecr 4162324115], length 0
11:03:54.443551 IP 10.8.3.8.50586 > 185.42.204.235.1935: Flags [.], seq 100939:102253, ack 1, win 501, options [nop,nop,TS val 4162324547 ecr 1304994316], length 1314
11:03:54.477804 IP 185.42.204.235.1935 > 10.8.3.8.50586: Flags [.], ack 93585, win 126, options [nop,nop,TS val 1304994384 ecr 4162324216], length 0
11:03:54.482115 IP 10.8.3.8.50586 > 185.42.204.235.1935: Flags [.], seq 102253:103567, ack 1, win 501, options [nop,nop,TS val 4162324585 ecr 1304994384], length 1314
11:03:54.542787 IP 10.8.3.8.50586 > 185.42.204.235.1935: Flags [.], seq 103567:104881, ack 1, win 501, options [nop,nop,TS val 4162324646 ecr 1304994384], length 1314
11:03:54.560366 IP 185.42.204.235.1935 > 10.8.3.8.50586: Flags [.], ack 95683, win 126, options [nop,nop,TS val 1304994467 ecr 4162324314], length 0
11:03:54.560385 IP 10.8.3.8.50586 > 185.42.204.235.1935: Flags [P.], seq 104881:105588, ack 1, win 501, options [nop,nop,TS val 4162324664 ecr 1304994467], length 707
11:03:54.610659 IP 10.8.3.8.50586 > 185.42.204.235.1935: Flags [.], seq 105588:106902, ack 1, win 501, options [nop,nop,TS val 4162324714 ecr 1304994467], length 1314
11:03:54.643278 IP 185.42.204.235.1935 > 10.8.3.8.50586: Flags [.], ack 98311, win 126, options [nop,nop,TS val 1304994550 ecr 4162324382], length 0
11:03:54.645724 IP 10.8.3.8.50586 > 185.42.204.235.1935: Flags [.], seq 106902:108216, ack 1, win 501, options [nop,nop,TS val 4162324749 ecr 1304994550], length 1314
11:03:54.676446 IP 10.8.3.8.50586 > 185.42.204.235.1935: Flags [.], seq 108216:109530, ack 1, win 501, options [nop,nop,TS val 4162324780 ecr 1304994550], length 1314
11:03:54.742566 IP 185.42.204.235.1935 > 10.8.3.8.50586: Flags [.], ack 100939, win 126, options [nop,nop,TS val 1304994649 ecr 4162324457], length 0
11:03:54.744496 IP 10.8.3.8.50586 > 185.42.204.235.1935: Flags [.], seq 109530:110844, ack 1, win 501, options [nop,nop,TS val 4162324848 ecr 1304994649], length 1314
11:03:54.778996 IP 10.8.3.8.50586 > 185.42.204.235.1935: Flags [.], seq 110844:112158, ack 1, win 501, options [nop,nop,TS val 4162324882 ecr 1304994649], length 1314
11:03:54.812044 IP 10.8.3.8.50586 > 185.42.204.235.1935: Flags [.], seq 112158:113472, ack 1, win 501, options [nop,nop,TS val 4162324915 ecr 1304994649], length 1314
11:03:54.816636 IP 185.42.204.235.1935 > 10.8.3.8.50586: Flags [.], ack 103567, win 126, options [nop,nop,TS val 1304994722 ecr 4162324547], length 0
11:03:54.877480 IP 10.8.3.8.50586 > 185.42.204.235.1935: Flags [.], seq 113472:114786, ack 1, win 501, options [nop,nop,TS val 4162324981 ecr 1304994722], length 1314
11:03:54.895612 IP 185.42.204.235.1935 > 10.8.3.8.50586: Flags [.], ack 105588, win 126, options [nop,nop,TS val 1304994800 ecr 4162324646], length 0
11:03:54.895636 IP 10.8.3.8.50586 > 185.42.204.235.1935: Flags [P.], seq 114786:115571, ack 1, win 501, options [nop,nop,TS val 4162324999 ecr 1304994800], length 785
11:03:54.944089 IP 10.8.3.8.50586 > 185.42.204.235.1935: Flags [.], seq 115571:116885, ack 1, win 501, options [nop,nop,TS val 4162325047 ecr 1304994800], length 1314
11:03:54.977306 IP 10.8.3.8.50586 > 185.42.204.235.1935: Flags [.], seq 116885:118199, ack 1, win 501, options [nop,nop,TS val 4162325081 ecr 1304994800], length 1314
11:03:54.980267 IP 185.42.204.235.1935 > 10.8.3.8.50586: Flags [.], ack 108216, win 126, options [nop,nop,TS val 1304994886 ecr 4162324714], length 0
11:03:55.017366 IP 10.8.3.8.50586 > 185.42.204.235.1935: Flags [.], seq 118199:119513, ack 1, win 501, options [nop,nop,TS val 4162325121 ecr 1304994886], length 1314
11:03:55.074677 IP 185.42.204.235.1935 > 10.8.3.8.50586: Flags [.], ack 109530, win 126, options [nop,nop,TS val 1304994981 ecr 4162324780], length 0
11:03:55.079734 IP 10.8.3.8.50586 > 185.42.204.235.1935: Flags [.], seq 119513:120827, ack 1, win 501, options [nop,nop,TS val 4162325183 ecr 1304994981], length 1314
11:03:55.109834 IP 10.8.3.8.50586 > 185.42.204.235.1935: Flags [.], seq 120827:122141, ack 1, win 501, options [nop,nop,TS val 4162325213 ecr 1304994981], length 1314
11:03:55.117810 IP 185.42.204.235.1935 > 10.8.3.8.50586: Flags [.], ack 112158, win 126, options [nop,nop,TS val 1304995019 ecr 4162324848], length 0
11:03:55.145743 IP 10.8.3.8.50586 > 185.42.204.235.1935: Flags [.], seq 122141:123455, ack 1, win 501, options [nop,nop,TS val 4162325249 ecr 1304995019], length 1314
11:03:55.211439 IP 185.42.204.235.1935 > 10.8.3.8.50586: Flags [.], ack 114786, win 126, options [nop,nop,TS val 1304995118 ecr 4162324915], length 0
11:03:55.212391 IP 10.8.3.8.50586 > 185.42.204.235.1935: Flags [.], seq 123455:124769, ack 1, win 501, options [nop,nop,TS val 4162325316 ecr 1304995118], length 1314
11:03:55.229589 IP 185.42.204.235.1935 > 10.8.3.8.50586: Flags [.], ack 115571, win 126, options [nop,nop,TS val 1304995136 ecr 4162324999], length 0
11:03:55.229616 IP 10.8.3.8.50586 > 185.42.204.235.1935: Flags [P.], seq 124769:125474, ack 1, win 501, options [nop,nop,TS val 4162325333 ecr 1304995136], length 705
11:03:55.277527 IP 10.8.3.8.50586 > 185.42.204.235.1935: Flags [.], seq 125474:126788, ack 1, win 501, options [nop,nop,TS val 4162325381 ecr 1304995136], length 1314
11:03:55.311255 IP 185.42.204.235.1935 > 10.8.3.8.50586: Flags [.], ack 118199, win 126, options [nop,nop,TS val 1304995218 ecr 4162325047], length 0
11:03:55.311326 IP 10.8.3.8.50586 > 185.42.204.235.1935: Flags [.], seq 126788:128102, ack 1, win 501, options [nop,nop,TS val 4162325415 ecr 1304995218], length 1314
11:03:55.341462 IP 10.8.3.8.50586 > 185.42.204.235.1935: Flags [.], seq 128102:129416, ack 1, win 501, options [nop,nop,TS val 4162325445 ecr 1304995218], length 1314
11:03:55.411250 IP 10.8.3.8.50586 > 185.42.204.235.1935: Flags [.], seq 129416:130730, ack 1, win 501, options [nop,nop,TS val 4162325515 ecr 1304995218], length 1314
11:03:55.413497 IP 185.42.204.235.1935 > 10.8.3.8.50586: Flags [.], ack 120827, win 126, options [nop,nop,TS val 1304995320 ecr 4162325121], length 0
11:03:55.446863 IP 10.8.3.8.50586 > 185.42.204.235.1935: Flags [.], seq 130730:132044, ack 1, win 501, options [nop,nop,TS val 4162325550 ecr 1304995320], length 1314
11:03:55.479387 IP 185.42.204.235.1935 > 10.8.3.8.50586: Flags [.], ack 123455, win 126, options [nop,nop,TS val 1304995386 ecr 4162325213], length 0
11:03:55.479807 IP 10.8.3.8.50586 > 185.42.204.235.1935: Flags [.], seq 132044:133358, ack 1, win 501, options [nop,nop,TS val 4162325583 ecr 1304995386], length 1314
11:03:55.544047 IP 10.8.3.8.50586 > 185.42.204.235.1935: Flags [.], seq 133358:134672, ack 1, win 501, options [nop,nop,TS val 4162325647 ecr 1304995386], length 1314
11:03:55.570683 IP 185.42.204.235.1935 > 10.8.3.8.50586: Flags [.], ack 125474, win 126, options [nop,nop,TS val 1304995469 ecr 4162325316], length 0
11:03:55.570710 IP 10.8.3.8.50586 > 185.42.204.235.1935: Flags [P.], seq 134672:135465, ack 1, win 501, options [nop,nop,TS val 4162325674 ecr 1304995469], length 793
11:03:55.608179 IP 10.8.3.8.50586 > 185.42.204.235.1935: Flags [.], seq 135465:136779, ack 1, win 501, options [nop,nop,TS val 4162325711 ecr 1304995469], length 1314
11:03:55.641826 IP 10.8.3.8.50586 > 185.42.204.235.1935: Flags [.], seq 136779:138093, ack 1, win 501, options [nop,nop,TS val 4162325745 ecr 1304995469], length 1314
11:03:55.644926 IP 185.42.204.235.1935 > 10.8.3.8.50586: Flags [.], ack 128102, win 126, options [nop,nop,TS val 1304995551 ecr 4162325381], length 0
11:03:55.679821 IP 10.8.3.8.50586 > 185.42.204.235.1935: Flags [.], seq 138093:139407, ack 1, win 501, options [nop,nop,TS val 4162325783 ecr 1304995551], length 1314
11:03:55.745433 IP 185.42.204.235.1935 > 10.8.3.8.50586: Flags [.], ack 130730, win 126, options [nop,nop,TS val 1304995652 ecr 4162325445], length 0
11:03:55.745685 IP 10.8.3.8.50586 > 185.42.204.235.1935: Flags [.], seq 139407:140721, ack 1, win 501, options [nop,nop,TS val 4162325849 ecr 1304995652], length 1314
11:03:55.779112 IP 10.8.3.8.50586 > 185.42.204.235.1935: Flags [.], seq 140721:142035, ack 1, win 501, options [nop,nop,TS val 4162325882 ecr 1304995652], length 1314
11:03:55.809453 IP 10.8.3.8.50586 > 185.42.204.235.1935: Flags [.], seq 142035:143349, ack 1, win 501, options [nop,nop,TS val 4162325913 ecr 1304995652], length 1314
11:03:55.822832 IP 185.42.204.235.1935 > 10.8.3.8.50586: Flags [.], ack 133358, win 126, options [nop,nop,TS val 1304995722 ecr 4162325550], length 0
11:03:55.879273 IP 10.8.3.8.50586 > 185.42.204.235.1935: Flags [.], seq 143349:144663, ack 1, win 501, options [nop,nop,TS val 4162325983 ecr 1304995722], length 1314
11:03:55.912337 IP 10.8.3.8.50586 > 185.42.204.235.1935: Flags [.], seq 144663:145977, ack 1, win 501, options [nop,nop,TS val 4162326016 ecr 1304995722], length 1314
11:03:55.922268 IP 185.42.204.235.1935 > 10.8.3.8.50586: Flags [.], ack 135465, win 126, options [nop,nop,TS val 1304995828 ecr 4162325647], length 0
11:03:55.922301 IP 10.8.3.8.50586 > 185.42.204.235.1935: Flags [P.], seq 145977:146394, ack 1, win 501, options [nop,nop,TS val 4162326026 ecr 1304995828], length 417
11:03:55.975749 IP 185.42.204.235.1935 > 10.8.3.8.50586: Flags [.], ack 138093, win 126, options [nop,nop,TS val 1304995882 ecr 4162325711], length 0
11:03:55.980121 IP 10.8.3.8.50586 > 185.42.204.235.1935: Flags [.], seq 146394:147708, ack 1, win 501, options [nop,nop,TS val 4162326083 ecr 1304995882], length 1314
11:03:56.008150 IP 10.8.3.8.50586 > 185.42.204.235.1935: Flags [.], seq 147708:149022, ack 1, win 501, options [nop,nop,TS val 4162326111 ecr 1304995882], length 1314
11:03:56.043700 IP 10.8.3.8.50586 > 185.42.204.235.1935: Flags [.], seq 149022:150336, ack 1, win 501, options [nop,nop,TS val 4162326147 ecr 1304995882], length 1314
11:03:56.079426 IP 185.42.204.235.1935 > 10.8.3.8.50586: Flags [.], ack 140721, win 126, options [nop,nop,TS val 1304995986 ecr 4162325783], length 0
11:03:56.112334 IP 10.8.3.8.50586 > 185.42.204.235.1935: Flags [.], seq 150336:151650, ack 1, win 501, options [nop,nop,TS val 4162326216 ecr 1304995986], length 1314
11:03:56.145913 IP 10.8.3.8.50586 > 185.42.204.235.1935: Flags [.], seq 151650:152964, ack 1, win 501, options [nop,nop,TS val 4162326249 ecr 1304995986], length 1314
11:03:56.155276 IP 185.42.204.235.1935 > 10.8.3.8.50586: Flags [.], ack 143349, win 126, options [nop,nop,TS val 1304996061 ecr 4162325882], length 0
11:03:56.179011 IP 10.8.3.8.50586 > 185.42.204.235.1935: Flags [.], seq 152964:154278, ack 1, win 501, options [nop,nop,TS val 4162326282 ecr 1304996061], length 1314
11:03:56.245687 IP 10.8.3.8.50586 > 185.42.204.235.1935: Flags [.], seq 154278:155592, ack 1, win 501, options [nop,nop,TS val 4162326349 ecr 1304996061], length 1314
11:03:56.246419 IP 185.42.204.235.1935 > 10.8.3.8.50586: Flags [.], ack 145977, win 126, options [nop,nop,TS val 1304996153 ecr 4162325983], length 0
11:03:56.257646 IP 185.42.204.235.1935 > 10.8.3.8.50586: Flags [.], ack 146394, win 126, options [nop,nop,TS val 1304996164 ecr 4162326026], length 0
11:03:56.257679 IP 10.8.3.8.50586 > 185.42.204.235.1935: Flags [P.], seq 155592:156298, ack 1, win 501, options [nop,nop,TS val 4162326361 ecr 1304996164], length 706
11:03:56.312526 IP 10.8.3.8.50586 > 185.42.204.235.1935: Flags [.], seq 156298:157612, ack 1, win 501, options [nop,nop,TS val 4162326416 ecr 1304996164], length 1314
11:03:56.341887 IP 185.42.204.235.1935 > 10.8.3.8.50586: Flags [.], ack 149022, win 126, options [nop,nop,TS val 1304996248 ecr 4162326083], length 0
11:03:56.345675 IP 10.8.3.8.50586 > 185.42.204.235.1935: Flags [.], seq 157612:158926, ack 1, win 501, options [nop,nop,TS val 4162326449 ecr 1304996248], length 1314
11:03:56.379077 IP 10.8.3.8.50586 > 185.42.204.235.1935: Flags [.], seq 158926:160240, ack 1, win 501, options [nop,nop,TS val 4162326482 ecr 1304996248], length 1314
11:03:56.445653 IP 10.8.3.8.50586 > 185.42.204.235.1935: Flags [.], seq 160240:161554, ack 1, win 501, options [nop,nop,TS val 4162326549 ecr 1304996248], length 1314
11:03:56.446199 IP 185.42.204.235.1935 > 10.8.3.8.50586: Flags [.], ack 151650, win 126, options [nop,nop,TS val 1304996353 ecr 4162326147], length 0
11:03:56.478964 IP 10.8.3.8.50586 > 185.42.204.235.1935: Flags [.], seq 161554:162868, ack 1, win 501, options [nop,nop,TS val 4162326582 ecr 1304996353], length 1314
11:03:56.516354 IP 10.8.3.8.50586 > 185.42.204.235.1935: Flags [.], seq 162868:164182, ack 1, win 501, options [nop,nop,TS val 4162326620 ecr 1304996353], length 1314
11:03:56.516393 IP 185.42.204.235.1935 > 10.8.3.8.50586: Flags [.], ack 154278, win 126, options [nop,nop,TS val 1304996419 ecr 4162326249], length 0
11:03:56.580547 IP 10.8.3.8.50586 > 185.42.204.235.1935: Flags [.], seq 164182:165496, ack 1, win 501, options [nop,nop,TS val 4162326684 ecr 1304996419], length 1314
11:03:56.591513 IP 185.42.204.235.1935 > 10.8.3.8.50586: Flags [.], ack 156298, win 126, options [nop,nop,TS val 1304996498 ecr 4162326349], length 0
11:03:56.591540 IP 10.8.3.8.50586 > 185.42.204.235.1935: Flags [P.], seq 165496:166281, ack 1, win 501, options [nop,nop,TS val 4162326695 ecr 1304996498], length 785
11:03:56.645526 IP 10.8.3.8.50586 > 185.42.204.235.1935: Flags [.], seq 166281:167595, ack 1, win 501, options [nop,nop,TS val 4162326749 ecr 1304996498], length 1314
11:03:56.678492 IP 10.8.3.8.50586 > 185.42.204.235.1935: Flags [.], seq 167595:168909, ack 1, win 501, options [nop,nop,TS val 4162326782 ecr 1304996498], length 1314
11:03:56.680450 IP 185.42.204.235.1935 > 10.8.3.8.50586: Flags [.], ack 158926, win 126, options [nop,nop,TS val 1304996586 ecr 4162326416], length 0
11:03:56.711976 IP 10.8.3.8.50586 > 185.42.204.235.1935: Flags [.], seq 168909:170223, ack 1, win 501, options [nop,nop,TS val 4162326815 ecr 1304996586], length 1314
11:03:56.774480 IP 185.42.204.235.1935 > 10.8.3.8.50586: Flags [.], ack 160240, win 126, options [nop,nop,TS val 1304996681 ecr 4162326482], length 0
11:03:56.778739 IP 10.8.3.8.50586 > 185.42.204.235.1935: Flags [.], seq 170223:171537, ack 1, win 501, options [nop,nop,TS val 4162326882 ecr 1304996681], length 1314
11:03:56.812719 IP 185.42.204.235.1935 > 10.8.3.8.50586: Flags [.], ack 162868, win 126, options [nop,nop,TS val 1304996719 ecr 4162326549], length 0
11:03:56.816067 IP 10.8.3.8.50586 > 185.42.204.235.1935: Flags [.], seq 171537:172851, ack 1, win 501, options [nop,nop,TS val 4162326919 ecr 1304996719], length 1314
11:03:56.843222 IP 10.8.3.8.50586 > 185.42.204.235.1935: Flags [.], seq 172851:174165, ack 1, win 501, options [nop,nop,TS val 4162326947 ecr 1304996719], length 1314
11:03:56.912377 IP 10.8.3.8.50586 > 185.42.204.235.1935: Flags [.], seq 174165:175479, ack 1, win 501, options [nop,nop,TS val 4162327016 ecr 1304996719], length 1314
11:03:56.914550 IP 185.42.204.235.1935 > 10.8.3.8.50586: Flags [.], ack 165496, win 126, options [nop,nop,TS val 1304996821 ecr 4162326620], length 0
11:03:56.926330 IP 185.42.204.235.1935 > 10.8.3.8.50586: Flags [.], ack 166281, win 126, options [nop,nop,TS val 1304996833 ecr 4162326695], length 0
11:03:56.926364 IP 10.8.3.8.50586 > 185.42.204.235.1935: Flags [P.], seq 175479:176279, ack 1, win 501, options [nop,nop,TS val 4162327030 ecr 1304996833], length 800
11:03:56.978459 IP 10.8.3.8.50586 > 185.42.204.235.1935: Flags [.], seq 176279:177593, ack 1, win 501, options [nop,nop,TS val 4162327082 ecr 1304996833], length 1314
11:03:57.010594 IP 10.8.3.8.50586 > 185.42.204.235.1935: Flags [.], seq 177593:178907, ack 1, win 501, options [nop,nop,TS val 4162327114 ecr 1304996833], length 1314
11:03:57.013076 IP 185.42.204.235.1935 > 10.8.3.8.50586: Flags [.], ack 168909, win 126, options [nop,nop,TS val 1304996919 ecr 4162326749], length 0
11:03:57.051162 IP 10.8.3.8.50586 > 185.42.204.235.1935: Flags [.], seq 178907:180221, ack 1, win 501, options [nop,nop,TS val 4162327154 ecr 1304996919], length 1314
11:03:57.112487 IP 185.42.204.235.1935 > 10.8.3.8.50586: Flags [.], ack 171537, win 126, options [nop,nop,TS val 1304997019 ecr 4162326815], length 0
11:03:57.115390 IP 10.8.3.8.50586 > 185.42.204.235.1935: Flags [.], seq 180221:181535, ack 1, win 501, options [nop,nop,TS val 4162327219 ecr 1304997019], length 1314
11:03:57.144896 IP 10.8.3.8.50586 > 185.42.204.235.1935: Flags [.], seq 181535:182849, ack 1, win 501, options [nop,nop,TS val 4162327248 ecr 1304997019], length 1314
11:03:57.179069 IP 185.42.204.235.1935 > 10.8.3.8.50586: Flags [.], ack 174165, win 126, options [nop,nop,TS val 1304997083 ecr 4162326919], length 0
11:03:57.179564 IP 10.8.3.8.50586 > 185.42.204.235.1935: Flags [.], seq 182849:184163, ack 1, win 501, options [nop,nop,TS val 4162327283 ecr 1304997083], length 1314
11:03:57.244819 IP 10.8.3.8.50586 > 185.42.204.235.1935: Flags [.], seq 184163:185477, ack 1, win 501, options [nop,nop,TS val 4162327348 ecr 1304997083], length 1314
11:03:57.260113 IP 185.42.204.235.1935 > 10.8.3.8.50586: Flags [.], ack 176279, win 126, options [nop,nop,TS val 1304997166 ecr 4162327016], length 0
11:03:57.260147 IP 10.8.3.8.50586 > 185.42.204.235.1935: Flags [P.], seq 185477:186167, ack 1, win 501, options [nop,nop,TS val 4162327363 ecr 1304997166], length 690
11:03:57.311665 IP 10.8.3.8.50586 > 185.42.204.235.1935: Flags [.], seq 186167:187481, ack 1, win 501, options [nop,nop,TS val 4162327415 ecr 1304997166], length 1314
11:03:57.344680 IP 185.42.204.235.1935 > 10.8.3.8.50586: Flags [.], ack 178907, win 126, options [nop,nop,TS val 1304997251 ecr 4162327082], length 0
11:03:57.351140 IP 10.8.3.8.50586 > 185.42.204.235.1935: Flags [.], seq 187481:188795, ack 1, win 501, options [nop,nop,TS val 4162327454 ecr 1304997251], length 1314
11:03:57.378093 IP 10.8.3.8.50586 > 185.42.204.235.1935: Flags [.], seq 188795:190109, ack 1, win 501, options [nop,nop,TS val 4162327481 ecr 1304997251], length 1314
11:03:57.445564 IP 10.8.3.8.50586 > 185.42.204.235.1935: Flags [.], seq 190109:191423, ack 1, win 501, options [nop,nop,TS val 4162327549 ecr 1304997251], length 1314
11:03:57.449031 IP 185.42.204.235.1935 > 10.8.3.8.50586: Flags [.], ack 181535, win 126, options [nop,nop,TS val 1304997355 ecr 4162327154], length 0
11:03:57.479786 IP 10.8.3.8.50586 > 185.42.204.235.1935: Flags [.], seq 191423:192737, ack 1, win 501, options [nop,nop,TS val 4162327583 ecr 1304997355], length 1314
11:03:57.510906 IP 10.8.3.8.50586 > 185.42.204.235.1935: Flags [.], seq 192737:194051, ack 1, win 501, options [nop,nop,TS val 4162327614 ecr 1304997355], length 1314
11:03:57.524439 IP 185.42.204.235.1935 > 10.8.3.8.50586: Flags [.], ack 184163, win 126, options [nop,nop,TS val 1304997426 ecr 4162327248], length 0
11:03:57.586555 IP 10.8.3.8.50586 > 185.42.204.235.1935: Flags [.], seq 194051:195365, ack 1, win 501, options [nop,nop,TS val 4162327690 ecr 1304997426], length 1314
11:03:57.593777 IP 185.42.204.235.1935 > 10.8.3.8.50586: Flags [.], ack 186167, win 126, options [nop,nop,TS val 1304997500 ecr 4162327348], length 0
11:03:57.593805 IP 10.8.3.8.50586 > 185.42.204.235.1935: Flags [P.], seq 195365:196162, ack 1, win 501, options [nop,nop,TS val 4162327697 ecr 1304997500], length 797
11:03:57.650899 IP 10.8.3.8.50586 > 185.42.204.235.1935: Flags [.], seq 196162:197476, ack 1, win 501, options [nop,nop,TS val 4162327754 ecr 1304997500], length 1314
11:03:57.678910 IP 10.8.3.8.50586 > 185.42.204.235.1935: Flags [.], seq 197476:198790, ack 1, win 501, options [nop,nop,TS val 4162327782 ecr 1304997500], length 1314
11:03:57.685112 IP 185.42.204.235.1935 > 10.8.3.8.50586: Flags [.], ack 188795, win 126, options [nop,nop,TS val 1304997591 ecr 4162327415], length 0
11:03:57.715471 IP 10.8.3.8.50586 > 185.42.204.235.1935: Flags [.], seq 198790:200104, ack 1, win 501, options [nop,nop,TS val 4162327819 ecr 1304997591], length 1314
11:03:57.779666 IP 10.8.3.8.50586 > 185.42.204.235.1935: Flags [.], seq 200104:201418, ack 1, win 501, options [nop,nop,TS val 4162327883 ecr 1304997591], length 1314
11:03:57.779841 IP 185.42.204.235.1935 > 10.8.3.8.50586: Flags [.], ack 191423, win 126, options [nop,nop,TS val 1304997686 ecr 4162327481], length 0
