03:22:01.515579 IP 10.8.2.5.52648 > 185.42.205.35.1935: Flags [.], seq 2401075576:2401076890, ack 3337792918, win 501, options [nop,nop,TS val 279428109 ecr 197012734], length 1314
03:22:01.547486 IP 185.42.205.35.1935 > 10.8.2.5.52648: Flags [.], ack 4294953528, win 172, options [nop,nop,TS val 197012802 ecr 279427569], length 0
03:22:01.571861 IP 10.8.2.5.52648 > 185.42.205.35.1935: Flags [.], seq 1314:2628, ack 1, win 501, options [nop,nop,TS val 279428165 ecr 197012802], length 1314
03:22:01.608897 IP 10.8.2.5.52648 > 185.42.205.35.1935: Flags [.], seq 2628:3942, ack 1, win 501, options [nop,nop,TS val 279428202 ecr 197012802], length 1314
03:22:01.643848 IP 10.8.2.5.52648 > 185.42.205.35.1935: Flags [.], seq 3942:5256, ack 1, win 501, options [nop,nop,TS val 279428237 ecr 197012802], length 1314
03:22:01.646220 IP 185.42.205.35.1935 > 10.8.2.5.52648: Flags [.], ack 4294956156, win 172, options [nop,nop,TS val 197012901 ecr 279427667], length 0
03:22:01.708098 IP 10.8.2.5.52648 > 185.42.205.35.1935: Flags [.], seq 5256:6570, ack 1, win 501, options [nop,nop,TS val 279428301 ecr 197012901], length 1314
03:22:01.739954 IP 10.8.2.5.52648 > 185.42.205.35.1935: Flags [.], seq 6570:7884, ack 1, win 501, options [nop,nop,TS val 279428333 ecr 197012901], length 1314
03:22:01.743271 IP 185.42.205.35.1935 > 10.8.2.5.52648: Flags [.], ack 4294958784, win 172, options [nop,nop,TS val 197012998 ecr 279427736], length 0
03:22:01.775793 IP 10.8.2.5.52648 > 185.42.205.35.1935: Flags [.], seq 7884:9198, ack 1, win 501, options [nop,nop,TS val 279428369 ecr 197012998], length 1314
03:22:01.802670 IP 185.42.205.35.1935 > 10.8.2.5.52648: Flags [.], ack 4294960726, win 172, options [nop,nop,TS val 197013058 ecr 279427835], length 0
03:22:01.802704 IP 10.8.2.5.52648 > 185.42.205.35.1935: Flags [P.], seq 9198:9362, ack 1, win 501, options [nop,nop,TS val 279428396 ecr 197013058], length 164
03:22:01.839734 IP 10.8.2.5.52648 > 185.42.205.35.1935: Flags [.], seq 9362:10676, ack 1, win 501, options [nop,nop,TS val 279428433 ecr 197013058], length 1314
03:22:01.873650 IP 10.8.2.5.52648 > 185.42.205.35.1935: Flags [.], seq 10676:11990, ack 1, win 501, options [nop,nop,TS val 279428467 ecr 197013058], length 1314
03:22:01.878764 IP 185.42.205.35.1935 > 10.8.2.5.52648: Flags [.], ack 4294963354, win 172, options [nop,nop,TS val 197013134 ecr 279427901], length 0
03:22:01.921232 IP 10.8.2.5.52648 > 185.42.205.35.1935: Flags [.], seq 11990:13304, ack 1, win 501, options [nop,nop,TS val 279428514 ecr 197013134], length 1314
03:22:01.975963 IP 10.8.2.5.52648 > 185.42.205.35.1935: Flags [.], seq 13304:14618, ack 1, win 501, options [nop,nop,TS val 279428569 ecr 197013134], length 1314
03:22:01.978276 IP 185.42.205.35.1935 > 10.8.2.5.52648: Flags [.], ack 4294965982, win 172, options [nop,nop,TS val 197013233 ecr 279427980], length 0
03:22:02.008439 IP 10.8.2.5.52648 > 185.42.205.35.1935: Flags [.], seq 14618:15932, ack 1, win 501, options [nop,nop,TS val 279428601 ecr 197013233], length 1314
03:22:02.049049 IP 10.8.2.5.52648 > 185.42.205.35.1935: Flags [.], seq 15932:17246, ack 1, win 501, options [nop,nop,TS val 279428642 ecr 197013233], length 1314
03:22:02.052606 IP 185.42.205.35.1935 > 10.8.2.5.52648: Flags [.], ack 1314, win 172, options [nop,nop,TS val 197013307 ecr 279428067], length 0
03:22:02.107974 IP 10.8.2.5.52648 > 185.42.205.35.1935: Flags [.], seq 17246:18560, ack 1, win 501, options [nop,nop,TS val 279428701 ecr 197013307], length 1314
03:22:02.143001 IP 10.8.2.5.52648 > 185.42.205.35.1935: Flags [.], seq 18560:19874, ack 1, win 501, options [nop,nop,TS val 279428736 ecr 197013307], length 1314
03:22:02.146060 IP 185.42.205.35.1935 > 10.8.2.5.52648: Flags [.], ack 3942, win 172, options [nop,nop,TS val 197013401 ecr 279428165], length 0
03:22:02.177233 IP 10.8.2.5.52648 > 185.42.205.35.1935: Flags [.], seq 19874:21188, ack 1, win 501, options [nop,nop,TS val 279428770 ecr 197013401], length 1314
03:22:02.241528 IP 10.8.2.5.52648 > 185.42.205.35.1935: Flags [.], seq 21188:22502, ack 1, win 501, options [nop,nop,TS val 279428834 ecr 197013401], length 1314
03:22:02.244827 IP 185.42.205.35.1935 > 10.8.2.5.52648: Flags [.], ack 6570, win 172, options [nop,nop,TS val 197013500 ecr 279428237], length 0
03:22:02.275192 IP 10.8.2.5.52648 > 185.42.205.35.1935: Flags [.], seq 22502:23816, ack 1, win 501, options [nop,nop,TS val 279428868 ecr 197013500], length 1314
03:22:02.308620 IP 10.8.2.5.52648 > 185.42.205.35.1935: Flags [.], seq 23816:25130, ack 1, win 501, options [nop,nop,TS val 279428902 ecr 197013500], length 1314
03:22:02.312867 IP 185.42.205.35.1935 > 10.8.2.5.52648: Flags [.], ack 9198, win 172, options [nop,nop,TS val 197013568 ecr 279428333], length 0
03:22:02.339529 IP 185.42.205.35.1935 > 10.8.2.5.52648: Flags [.], ack 9362, win 172, options [nop,nop,TS val 197013595 ecr 279428396], length 0
03:22:02.339558 IP 10.8.2.5.52648 > 185.42.205.35.1935: Flags [P.], seq 25130:25287, ack 1, win 501, options [nop,nop,TS val 279428933 ecr 197013595], length 157
03:22:02.375285 IP 10.8.2.5.52648 > 185.42.205.35.1935: Flags [.], seq 25287:26601, ack 1, win 501, options [nop,nop,TS val 279428968 ecr 197013595], length 1314
03:22:02.408673 IP 10.8.2.5.52648 > 185.42.205.35.1935: Flags [.], seq 26601:27915, ack 1, win 501, options [nop,nop,TS val 279429002 ecr 197013595], length 1314
03:22:02.411077 IP 185.42.205.35.1935 > 10.8.2.5.52648: Flags [.], ack 11990, win 172, options [nop,nop,TS val 197013666 ecr 279428433], length 0
03:22:02.455893 IP 10.8.2.5.52648 > 185.42.205.35.1935: Flags [.], seq 27915:29229, ack 1, win 501, options [nop,nop,TS val 279429049 ecr 197013666], length 1314
03:22:02.507495 IP 10.8.2.5.52648 > 185.42.205.35.1935: Flags [.], seq 29229:30543, ack 1, win 501, options [nop,nop,TS val 279429100 ecr 197013666], length 1314
03:22:02.513105 IP 185.42.205.35.1935 > 10.8.2.5.52648: Flags [.], ack 14618, win 172, options [nop,nop,TS val 197013768 ecr 279428514], length 0
03:22:02.543155 IP 10.8.2.5.52648 > 185.42.205.35.1935: Flags [.], seq 30543:31857, ack 1, win 501, options [nop,nop,TS val 279429136 ecr 197013768], length 1314
03:22:02.584681 IP 10.8.2.5.52648 > 185.42.205.35.1935: Flags [.], seq 31857:33171, ack 1, win 501, options [nop,nop,TS val 279429178 ecr 197013768], length 1314
03:22:02.586313 IP 185.42.205.35.1935 > 10.8.2.5.52648: Flags [.], ack 17246, win 172, options [nop,nop,TS val 197013841 ecr 279428601], length 0
03:22:02.641970 IP 10.8.2.5.52648 > 185.42.205.35.1935: Flags [.], seq 33171:34485, ack 1, win 501, options [nop,nop,TS val 279429235 ecr 197013841], length 1314
03:22:02.674965 IP 10.8.2.5.52648 > 185.42.205.35.1935: Flags [.], seq 34485:35799, ack 1, win 501, options [nop,nop,TS val 279429268 ecr 197013841], length 1314
03:22:02.679819 IP 185.42.205.35.1935 > 10.8.2.5.52648: Flags [.], ack 19874, win 172, options [nop,nop,TS val 197013935 ecr 279428701], length 0
03:22:02.713133 IP 10.8.2.5.52648 > 185.42.205.35.1935: Flags [.], seq 35799:37113, ack 1, win 501, options [nop,nop,TS val 279429306 ecr 197013935], length 1314
03:22:02.776994 IP 10.8.2.5.52648 > 185.42.205.35.1935: Flags [.], seq 37113:38427, ack 1, win 501, options [nop,nop,TS val 279429370 ecr 197013935], length 1314
03:22:02.778557 IP 185.42.205.35.1935 > 10.8.2.5.52648: Flags [.], ack 22502, win 172, options [nop,nop,TS val 197014034 ecr 279428770], length 0
03:22:02.807529 IP 10.8.2.5.52648 > 185.42.205.35.1935: Flags [.], seq 38427:39741, ack 1, win 501, options [nop,nop,TS val 279429400 ecr 197014034], length 1314
03:22:02.842466 IP 10.8.2.5.52648 > 185.42.205.35.1935: Flags [.], seq 39741:41055, ack 1, win 501, options [nop,nop,TS val 279429435 ecr 197014034], length 1314
03:22:02.845485 IP 185.42.205.35.1935 > 10.8.2.5.52648: Flags [.], ack 25130, win 172, options [nop,nop,TS val 197014101 ecr 279428868], length 0
03:22:02.876774 IP 185.42.205.35.1935 > 10.8.2.5.52648: Flags [.], ack 25287, win 172, options [nop,nop,TS val 197014132 ecr 279428933], length 0
03:22:02.876787 IP 10.8.2.5.52648 > 185.42.205.35.1935: Flags [P.], seq 41055:42064, ack 1, win 501, options [nop,nop,TS val 279429470 ecr 197014132], length 1009
03:22:02.943328 IP 10.8.2.5.52648 > 185.42.205.35.1935: Flags [.], seq 42064:43378, ack 1, win 501, options [nop,nop,TS val 279429536 ecr 197014132], length 1314
03:22:02.945391 IP 185.42.205.35.1935 > 10.8.2.5.52648: Flags [.], ack 27915, win 172, options [nop,nop,TS val 197014200 ecr 279428968], length 0
03:22:02.976589 IP 10.8.2.5.52648 > 185.42.205.35.1935: Flags [.], seq 43378:44692, ack 1, win 501, options [nop,nop,TS val 279429570 ecr 197014200], length 1314
03:22:03.011500 IP 10.8.2.5.52648 > 185.42.205.35.1935: Flags [.], seq 44692:46006, ack 1, win 501, options [nop,nop,TS val 279429604 ecr 197014200], length 1314
03:22:03.044457 IP 185.42.205.35.1935 > 10.8.2.5.52648: Flags [.], ack 30543, win 172, options [nop,nop,TS val 197014299 ecr 279429049], length 0
03:22:03.075643 IP 10.8.2.5.52648 > 185.42.205.35.1935: Flags [.], seq 46006:47320, ack 1, win 501, options [nop,nop,TS val 279429669 ecr 197014299], length 1314
03:22:03.110834 IP 10.8.2.5.52648 > 185.42.205.35.1935: Flags [.], seq 47320:48634, ack 1, win 501, options [nop,nop,TS val 279429704 ecr 197014299], length 1314
03:22:03.121508 IP 185.42.205.35.1935 > 10.8.2.5.52648: Flags [.], ack 33171, win 172, options [nop,nop,TS val 197014377 ecr 279429136], length 0
03:22:03.144199 IP 10.8.2.5.52648 > 185.42.205.35.1935: Flags [.], seq 48634:49948, ack 1, win 501, options [nop,nop,TS val 279429737 ecr 197014377], length 1314
03:22:03.208312 IP 10.8.2.5.52648 > 185.42.205.35.1935: Flags [.], seq 49948:51262, ack 1, win 501, options [nop,nop,TS val 279429801 ecr 197014377], length 1314
03:22:03.211651 IP 185.42.205.35.1935 > 10.8.2.5.52648: Flags [.], ack 35799, win 172, options [nop,nop,TS val 197014467 ecr 279429235], length 0
03:22:03.246564 IP 10.8.2.5.52648 > 185.42.205.35.1935: Flags [.], seq 51262:52576, ack 1, win 501, options [nop,nop,TS val 279429840 ecr 197014467], length 1314
03:22:03.272841 IP 10.8.2.5.52648 > 185.42.205.35.1935: Flags [.], seq 52576:53890, ack 1, win 501, options [nop,nop,TS val 279429866 ecr 197014467], length 1314
03:22:03.314080 IP 185.42.205.35.1935 > 10.8.2.5.52648: Flags [.], ack 38427, win 172, options [nop,nop,TS val 197014569 ecr 279429306], length 0
03:22:03.342995 IP 10.8.2.5.52648 > 185.42.205.35.1935: Flags [.], seq 53890:55204, ack 1, win 501, options [nop,nop,TS val 279429936 ecr 197014569], length 1314
03:22:03.375739 IP 10.8.2.5.52648 > 185.42.205.35.1935: Flags [.], seq 55204:56518, ack 1, win 501, options [nop,nop,TS val 279429969 ecr 197014569], length 1314
03:22:03.379301 IP 185.42.205.35.1935 > 10.8.2.5.52648: Flags [.], ack 41055, win 172, options [nop,nop,TS val 197014635 ecr 279429400], length 0
03:22:03.409221 IP 10.8.2.5.52648 > 185.42.205.35.1935: Flags [.], seq 56518:57832, ack 1, win 501, options [nop,nop,TS val 279430002 ecr 197014635], length 1314
03:22:03.413541 IP 185.42.205.35.1935 > 10.8.2.5.52648: Flags [.], ack 42064, win 172, options [nop,nop,TS val 197014669 ecr 279429470], length 0
03:22:03.413575 IP 10.8.2.5.52648 > 185.42.205.35.1935: Flags [P.], seq 57832:57997, ack 1, win 501, options [nop,nop,TS val 279430007 ecr 197014669], length 165
03:22:03.475144 IP 10.8.2.5.52648 > 185.42.205.35.1935: Flags [.], seq 57997:59311, ack 1, win 501, options [nop,nop,TS val 279430068 ecr 197014669], length 1314
03:22:03.508999 IP 10.8.2.5.52648 > 185.42.205.35.1935: Flags [.], seq 59311:60625, ack 1, win 501, options [nop,nop,TS val 279430102 ecr 197014669], length 1314
03:22:03.513652 IP 185.42.205.35.1935 > 10.8.2.5.52648: Flags [.], ack 44692, win 172, options [nop,nop,TS val 197014769 ecr 279429536], length 0
03:22:03.546272 IP 10.8.2.5.52648 > 185.42.205.35.1935: Flags [.], seq 60625:61939, ack 1, win 501, options [nop,nop,TS val 279430139 ecr 197014769], length 1314
03:22:03.610731 IP 10.8.2.5.52648 > 185.42.205.35.1935: Flags [.], seq 61939:63253, ack 1, win 501, options [nop,nop,TS val 279430204 ecr 197014769], length 1314
03:22:03.612721 IP 185.42.205.35.1935 > 10.8.2.5.52648: Flags [.], ack 47320, win 172, options [nop,nop,TS val 197014868 ecr 279429604], length 0
03:22:03.642018 IP 10.8.2.5.52648 > 185.42.205.35.1935: Flags [.], seq 63253:64567, ack 1, win 501, options [nop,nop,TS val 279430235 ecr 197014868], length 1314
03:22:03.675289 IP 10.8.2.5.52648 > 185.42.205.35.1935: Flags [.], seq 64567:65881, ack 1, win 501, options [nop,nop,TS val 279430268 ecr 197014868], length 1314
03:22:03.681175 IP 185.42.205.35.1935 > 10.8.2.5.52648: Flags [.], ack 49948, win 172, options [nop,nop,TS val 197014936 ecr 279429704], length 0
03:22:03.741765 IP 10.8.2.5.52648 > 185.42.205.35.1935: Flags [.], seq 65881:67195, ack 1, win 501, options [nop,nop,TS val 279430335 ecr 197014936], length 1314
03:22:03.781963 IP 10.8.2.5.52648 > 185.42.205.35.1935: Flags [.], seq 67195:68509, ack 1, win 501, options [nop,nop,TS val 279430375 ecr 197014936], length 1314
03:22:03.783480 IP 185.42.205.35.1935 > 10.8.2.5.52648: Flags [.], ack 52576, win 172, options [nop,nop,TS val 197015038 ecr 279429801], length 0
03:22:03.809485 IP 10.8.2.5.52648 > 185.42.205.35.1935: Flags [.], seq 68509:69823, ack 1, win 501, options [nop,nop,TS val 279430402 ecr 197015038], length 1314
03:22:03.874776 IP 10.8.2.5.52648 > 185.42.205.35.1935: Flags [.], seq 69823:71137, ack 1, win 501, options [nop,nop,TS val 279430468 ecr 197015038], length 1314
03:22:03.880140 IP 185.42.205.35.1935 > 10.8.2.5.52648: Flags [.], ack 55204, win 172, options [nop,nop,TS val 197015135 ecr 279429866], length 0
03:22:03.910653 IP 10.8.2.5.52648 > 185.42.205.35.1935: Flags [.], seq 71137:72451, ack 1, win 501, options [nop,nop,TS val 279430504 ecr 197015135], length 1314
03:22:03.941651 IP 10.8.2.5.52648 > 185.42.205.35.1935: Flags [.], seq 72451:73765, ack 1, win 501, options [nop,nop,TS val 279430535 ecr 197015135], length 1314
03:22:03.946082 IP 185.42.205.35.1935 > 10.8.2.5.52648: Flags [.], ack 57832, win 172, options [nop,nop,TS val 197015201 ecr 279429969], length 0
03:22:03.950483 IP 185.42.205.35.1935 > 10.8.2.5.52648: Flags [.], ack 57997, win 172, options [nop,nop,TS val 197015205 ecr 279430007], length 0
03:22:03.950504 IP 10.8.2.5.52648 > 185.42.205.35.1935: Flags [P.], seq 73765:73921, ack 1, win 501, options [nop,nop,TS val 279430543 ecr 197015205], length 156
03:22:04.008738 IP 10.8.2.5.52648 > 185.42.205.35.1935: Flags [.], seq 73921:75235, ack 1, win 501, options [nop,nop,TS val 279430602 ecr 197015205], length 1314
03:22:04.041656 IP 10.8.2.5.52648 > 185.42.205.35.1935: Flags [.], seq 75235:76549, ack 1, win 501, options [nop,nop,TS val 279430635 ecr 197015205], length 1314
03:22:04.046018 IP 185.42.205.35.1935 > 10.8.2.5.52648: Flags [.], ack 60625, win 172, options [nop,nop,TS val 197015301 ecr 279430068], length 0
03:22:04.081859 IP 10.8.2.5.52648 > 185.42.205.35.1935: Flags [.], seq 76549:77863, ack 1, win 501, options [nop,nop,TS val 279430675 ecr 197015301], length 1314
03:22:04.145873 IP 10.8.2.5.52648 > 185.42.205.35.1935: Flags [.], seq 77863:79177, ack 1, win 501, options [nop,nop,TS val 279430739 ecr 197015301], length 1314
03:22:04.147684 IP 185.42.205.35.1935 > 10.8.2.5.52648: Flags [.], ack 63253, win 172, options [nop,nop,TS val 197015403 ecr 279430139], length 0
03:22:04.176228 IP 10.8.2.5.52648 > 185.42.205.35.1935: Flags [.], seq 79177:80491, ack 1, win 501, options [nop,nop,TS val 279430769 ecr 197015403], length 1314
03:22:04.210221 IP 10.8.2.5.52648 > 185.42.205.35.1935: Flags [.], seq 80491:81805, ack 1, win 501, options [nop,nop,TS val 279430803 ecr 197015403], length 1314
03:22:04.212118 IP 185.42.205.35.1935 > 10.8.2.5.52648: Flags [.], ack 65881, win 172, options [nop,nop,TS val 197015467 ecr 279430235], length 0
03:22:04.275892 IP 10.8.2.5.52648 > 185.42.205.35.1935: Flags [.], seq 81805:83119, ack 1, win 501, options [nop,nop,TS val 279430869 ecr 197015467], length 1314
03:22:04.317547 IP 10.8.2.5.52648 > 185.42.205.35.1935: Flags [.], seq 83119:84433, ack 1, win 501, options [nop,nop,TS val 279430910 ecr 197015467], length 1314
03:22:04.318900 IP 185.42.205.35.1935 > 10.8.2.5.52648: Flags [.], ack 68509, win 172, options [nop,nop,TS val 197015574 ecr 279430335], length 0
03:22:04.342523 IP 10.8.2.5.52648 > 185.42.205.35.1935: Flags [.], seq 84433:85747, ack 1, win 501, options [nop,nop,TS val 279430935 ecr 197015574], length 1314
03:22:04.407323 IP 10.8.2.5.52648 > 185.42.205.35.1935: Flags [.], seq 85747:87061, ack 1, win 501, options [nop,nop,TS val 279431000 ecr 197015574], length 1314
03:22:04.411751 IP 185.42.205.35.1935 > 10.8.2.5.52648: Flags [.], ack 71137, win 172, options [nop,nop,TS val 197015667 ecr 279430402], length 0
03:22:04.446061 IP 10.8.2.5.52648 > 185.42.205.35.1935: Flags [.], seq 87061:88375, ack 1, win 501, options [nop,nop,TS val 279431039 ecr 197015667], length 1314
03:22:04.475809 IP 10.8.2.5.52648 > 185.42.205.35.1935: Flags [.], seq 88375:89689, ack 1, win 501, options [nop,nop,TS val 279431069 ecr 197015667], length 1314
03:22:04.478560 IP 185.42.205.35.1935 > 10.8.2.5.52648: Flags [.], ack 73765, win 172, options [nop,nop,TS val 197015734 ecr 279430504], length 0
03:22:04.487106 IP 185.42.205.35.1935 > 10.8.2.5.52648: Flags [.], ack 73921, win 172, options [nop,nop,TS val 197015742 ecr 279430543], length 0
03:22:04.487138 IP 10.8.2.5.52648 > 185.42.205.35.1935: Flags [P.], seq 89689:89850, ack 1, win 501, options [nop,nop,TS val 279431080 ecr 197015742], length 161
03:22:04.540616 IP 10.8.2.5.52648 > 185.42.205.35.1935: Flags [.], seq 89850:91164, ack 1, win 501, options [nop,nop,TS val 279431134 ecr 197015742], length 1314
03:22:04.576014 IP 10.8.2.5.52648 > 185.42.205.35.1935: Flags [.], seq 91164:92478, ack 1, win 501, options [nop,nop,TS val 279431169 ecr 197015742], length 1314
03:22:04.578532 IP 185.42.205.35.1935 > 10.8.2.5.52648: Flags [.], ack 76549, win 172, options [nop,nop,TS val 197015833 ecr 279430602], length 0
03:22:04.617297 IP 10.8.2.5.52648 > 185.42.205.35.1935: Flags [.], seq 92478:93792, ack 1, win 501, options [nop,nop,TS val 279431210 ecr 197015833], length 1314
03:22:04.681531 IP 10.8.2.5.52648 > 185.42.205.35.1935: Flags [.], seq 93792:95106, ack 1, win 501, options [nop,nop,TS val 279431274 ecr 197015833], length 1314
03:22:04.682742 IP 185.42.205.35.1935 > 10.8.2.5.52648: Flags [.], ack 79177, win 172, options [nop,nop,TS val 197015938 ecr 279430675], length 0
03:22:04.708708 IP 10.8.2.5.52648 > 185.42.205.35.1935: Flags [.], seq 95106:96420, ack 1, win 501, options [nop,nop,TS val 279431302 ecr 197015938], length 1314
03:22:04.745917 IP 10.8.2.5.52648 > 185.42.205.35.1935: Flags [.], seq 96420:97734, ack 1, win 501, options [nop,nop,TS val 279431339 ecr 197015938], length 1314
03:22:04.747368 IP 185.42.205.35.1935 > 10.8.2.5.52648: Flags [.], ack 81805, win 172, options [nop,nop,TS val 197016002 ecr 279430769], length 0
03:22:04.810353 IP 10.8.2.5.52648 > 185.42.205.35.1935: Flags [.], seq 97734:99048, ack 1, win 501, options [nop,nop,TS val 279431403 ecr 197016002], length 1314
03:22:04.853246 IP 10.8.2.5.52648 > 185.42.205.35.1935: Flags [.], seq 99048:100362, ack 1, win 501, options [nop,nop,TS val 279431446 ecr 197016002], length 1314
03:22:04.854619 IP 185.42.205.35.1935 > 10.8.2.5.52648: Flags [.], ack 84433, win 172, options [nop,nop,TS val 197016110 ecr 279430869], length 0
03:22:04.875475 IP 10.8.2.5.52648 > 185.42.205.35.1935: Flags [.], seq 100362:101676, ack 1, win 501, options [nop,nop,TS val 279431468 ecr 197016110], length 1314
03:22:04.941971 IP 10.8.2.5.52648 > 185.42.205.35.1935: Flags [.], seq 101676:102990, ack 1, win 501, options [nop,nop,TS val 279431535 ecr 197016110], length 1314
03:22:04.944140 IP 185.42.205.35.1935 > 10.8.2.5.52648: Flags [.], ack 87061, win 172, options [nop,nop,TS val 197016199 ecr 279430935], length 0
03:22:04.982167 IP 10.8.2.5.52648 > 185.42.205.35.1935: Flags [.], seq 102990:104304, ack 1, win 501, options [nop,nop,TS val 279431575 ecr 197016199], length 1314
03:22:05.008682 IP 10.8.2.5.52648 > 185.42.205.35.1935: Flags [.], seq 104304:105618, ack 1, win 501, options [nop,nop,TS val 279431602 ecr 197016199], length 1314
03:22:05.021557 IP 185.42.205.35.1935 > 10.8.2.5.52648: Flags [.], ack 89689, win 172, options [nop,nop,TS val 197016268 ecr 279431039], length 0
03:22:05.024369 IP 185.42.205.35.1935 > 10.8.2.5.52648: Flags [.], ack 89850, win 172, options [nop,nop,TS val 197016279 ecr 279431080], length 0
03:22:05.024396 IP 10.8.2.5.52648 > 185.42.205.35.1935: Flags [P.], seq 105618:105784, ack 1, win 501, options [nop,nop,TS val 279431617 ecr 197016279], length 166
03:22:05.075516 IP 10.8.2.5.52648 > 185.42.205.35.1935: Flags [.], seq 105784:107098, ack 1, win 501, options [nop,nop,TS val 279431668 ecr 197016279], length 1314
03:22:05.110847 IP 10.8.2.5.52648 > 185.42.205.35.1935: Flags [.], seq 107098:108412, ack 1, win 501, options [nop,nop,TS val 279431704 ecr 197016279], length 1314
03:22:05.112913 IP 185.42.205.35.1935 > 10.8.2.5.52648: Flags [.], ack 92478, win 172, options [nop,nop,TS val 197016368 ecr 279431134], length 0
03:22:05.153768 IP 10.8.2.5.52648 > 185.42.205.35.1935: Flags [.], seq 108412:109726, ack 1, win 501, options [nop,nop,TS val 279431747 ecr 197016368], length 1314
03:22:05.217993 IP 10.8.2.5.52648 > 185.42.205.35.1935: Flags [.], seq 109726:111040, ack 1, win 501, options [nop,nop,TS val 279431811 ecr 197016368], length 1314
03:22:05.218541 IP 185.42.205.35.1935 > 10.8.2.5.52648: Flags [.], ack 95106, win 172, options [nop,nop,TS val 197016473 ecr 279431210], length 0
03:22:05.242041 IP 10.8.2.5.52648 > 185.42.205.35.1935: Flags [.], seq 111040:112354, ack 1, win 501, options [nop,nop,TS val 279431835 ecr 197016473], length 1314
03:22:05.282433 IP 10.8.2.5.52648 > 185.42.205.35.1935: Flags [.], seq 112354:113668, ack 1, win 501, options [nop,nop,TS val 279431875 ecr 197016473], length 1314
03:22:05.282883 IP 185.42.205.35.1935 > 10.8.2.5.52648: Flags [.], ack 95106, win 172, options [nop,nop,TS val 197016538 ecr 279431210,nop,nop,sack 1 {96420:97734}], length 0
03:22:05.346905 IP 10.8.2.5.52648 > 185.42.205.35.1935: Flags [.], seq 113668:114982, ack 1, win 501, options [nop,nop,TS val 279431940 ecr 197016538], length 1314
03:22:05.347347 IP 185.42.205.35.1935 > 10.8.2.5.52648: Flags [.], ack 95106, win 172, options [nop,nop,TS val 197016602 ecr 279431210,nop,nop,sack 1 {96420:99048}], length 0
03:22:05.389911 IP 10.8.2.5.52648 > 185.42.205.35.1935: Flags [.], seq 114982:116296, ack 1, win 501, options [nop,nop,TS val 279431983 ecr 197016602], length 1314
03:22:05.390146 IP 185.42.205.35.1935 > 10.8.2.5.52648: Flags [.], ack 95106, win 172, options [nop,nop,TS val 197016645 ecr 279431210,nop,nop,sack 1 {96420:100362}], length 0
03:22:05.390179 IP 10.8.2.5.52648 > 185.42.205.35.1935: Flags [.], seq 95106:96420, ack 1, win 501, options [nop,nop,TS val 279431983 ecr 197016645], length 1314
03:22:05.412187 IP 185.42.205.35.1935 > 10.8.2.5.52648: Flags [.], ack 95106, win 172, options [nop,nop,TS val 197016667 ecr 279431210,nop,nop,sack 1 {96420:101676}], length 0
03:22:05.412229 IP 10.8.2.5.52648 > 185.42.205.35.1935: Flags [.], seq 116296:117610, ack 1, win 501, options [nop,nop,TS val 279432005 ecr 197016667], length 1314
03:22:05.479785 IP 185.42.205.35.1935 > 10.8.2.5.52648: Flags [.], ack 95106, win 172, options [nop,nop,TS val 197016734 ecr 279431210,nop,nop,sack 1 {96420:102990}], length 0
03:22:05.479830 IP 10.8.2.5.52648 > 185.42.205.35.1935: Flags [.], seq 117610:118924, ack 1, win 501, options [nop,nop,TS val 279432073 ecr 197016734], length 1314
03:22:05.520391 IP 185.42.205.35.1935 > 10.8.2.5.52648: Flags [.], ack 95106, win 172, options [nop,nop,TS val 197016774 ecr 279431210,nop,nop,sack 1 {96420:104304}], length 0
03:22:05.520438 IP 10.8.2.5.52648 > 185.42.205.35.1935: Flags [.], seq 118924:120238, ack 1, win 501, options [nop,nop,TS val 279432113 ecr 197016774], length 1314
03:22:05.546554 IP 185.42.205.35.1935 > 10.8.2.5.52648: Flags [.], ack 95106, win 172, options [nop,nop,TS val 197016801 ecr 279431210,nop,nop,sack 1 {96420:105618}], length 0
03:22:05.546615 IP 10.8.2.5.52648 > 185.42.205.35.1935: Flags [.], seq 120238:121552, ack 1, win 501, options [nop,nop,TS val 279432140 ecr 197016801], length 1314
03:22:05.561970 IP 185.42.205.35.1935 > 10.8.2.5.52648: Flags [.], ack 95106, win 172, options [nop,nop,TS val 197016816 ecr 279431210,nop,nop,sack 1 {96420:105784}], length 0
03:22:05.609296 IP 10.8.2.5.52648 > 185.42.205.35.1935: Flags [.], seq 121552:122866, ack 1, win 501, options [nop,nop,TS val 279432202 ecr 197016816], length 1314
03:22:05.613393 IP 185.42.205.35.1935 > 10.8.2.5.52648: Flags [.], ack 95106, win 172, options [nop,nop,TS val 197016867 ecr 279431210,nop,nop,sack 1 {96420:107098}], length 0
03:22:05.648068 IP 10.8.2.5.52648 > 185.42.205.35.1935: Flags [.], seq 122866:124180, ack 1, win 501, options [nop,nop,TS val 279432241 ecr 197016867], length 1314
03:22:05.648916 IP 185.42.205.35.1935 > 10.8.2.5.52648: Flags [.], ack 95106, win 172, options [nop,nop,TS val 197016903 ecr 279431210,nop,nop,sack 1 {96420:108412}], length 0
03:22:05.690732 IP 10.8.2.5.52648 > 185.42.205.35.1935: Flags [.], seq 124180:125494, ack 1, win 501, options [nop,nop,TS val 279432284 ecr 197016903], length 1314
03:22:05.691509 IP 185.42.205.35.1935 > 10.8.2.5.52648: Flags [.], ack 95106, win 172, options [nop,nop,TS val 197016946 ecr 279431210,nop,nop,sack 1 {96420:109726}], length 0
03:22:05.741871 IP 10.8.2.5.52648 > 185.42.205.35.1935: Flags [.], seq 125494:126808, ack 1, win 501, options [nop,nop,TS val 279432335 ecr 197016946], length 1314
03:22:05.755930 IP 185.42.205.35.1935 > 10.8.2.5.52648: Flags [.], ack 95106, win 172, options [nop,nop,TS val 197017010 ecr 279431210,nop,nop,sack 1 {96420:111040}], length 0
03:22:05.776367 IP 10.8.2.5.52648 > 185.42.205.35.1935: Flags [.], seq 126808:128122, ack 1, win 501, options [nop,nop,TS val 279432369 ecr 197017010], length 1314
03:22:05.779927 IP 185.42.205.35.1935 > 10.8.2.5.52648: Flags [.], ack 95106, win 172, options [nop,nop,TS val 197017034 ecr 279431210,nop,nop,sack 1 {96420:112354}], length 0
03:22:05.819195 IP 10.8.2.5.52648 > 185.42.205.35.1935: Flags [.], seq 128122:129436, ack 1, win 501, options [nop,nop,TS val 279432412 ecr 197017034], length 1314
03:22:05.820330 IP 185.42.205.35.1935 > 10.8.2.5.52648: Flags [.], ack 95106, win 172, options [nop,nop,TS val 197017074 ecr 279431210,nop,nop,sack 1 {96420:113668}], length 0
03:22:05.861756 IP 10.8.2.5.52648 > 185.42.205.35.1935: Flags [.], seq 129436:130750, ack 1, win 501, options [nop,nop,TS val 279432455 ecr 197017074], length 1314
03:22:05.884719 IP 185.42.205.35.1935 > 10.8.2.5.52648: Flags [.], ack 95106, win 172, options [nop,nop,TS val 197017139 ecr 279431210,nop,nop,sack 1 {96420:114982}], length 0
03:22:05.926293 IP 10.8.2.5.52648 > 185.42.205.35.1935: Flags [.], seq 130750:132064, ack 1, win 501, options [nop,nop,TS val 279432519 ecr 197017139], length 1314
03:22:05.926916 IP 185.42.205.35.1935 > 10.8.2.5.52648: Flags [.], ack 116296, win 140, options [nop,nop,TS val 197017182 ecr 279431983], length 0
03:22:05.926970 IP 10.8.2.5.52648 > 185.42.205.35.1935: Flags [P.], seq 132064:132741, ack 1, win 501, options [nop,nop,TS val 279432520 ecr 197017182], length 677
03:22:05.949197 IP 185.42.205.35.1935 > 10.8.2.5.52648: Flags [.], ack 117610, win 180, options [nop,nop,TS val 197017204 ecr 279432005], length 0
03:22:05.990395 IP 10.8.2.5.52648 > 185.42.205.35.1935: Flags [.], seq 132741:134055, ack 1, win 501, options [nop,nop,TS val 279432583 ecr 197017204], length 1314
03:22:06.011911 IP 10.8.2.5.52648 > 185.42.205.35.1935: Flags [.], seq 134055:135369, ack 1, win 501, options [nop,nop,TS val 279432605 ecr 197017204], length 1314
03:22:06.016942 IP 185.42.205.35.1935 > 10.8.2.5.52648: Flags [.], ack 118924, win 186, options [nop,nop,TS val 197017272 ecr 279432073], length 0
03:22:06.054460 IP 10.8.2.5.52648 > 185.42.205.35.1935: Flags [.], seq 135369:136683, ack 1, win 501, options [nop,nop,TS val 279432647 ecr 197017272], length 1314
03:22:06.057118 IP 185.42.205.35.1935 > 10.8.2.5.52648: Flags [.], ack 120238, win 191, options [nop,nop,TS val 197017312 ecr 279432113], length 0
03:22:06.083653 IP 185.42.205.35.1935 > 10.8.2.5.52648: Flags [.], ack 121552, win 197, options [nop,nop,TS val 197017339 ecr 279432140], length 0
03:22:06.118110 IP 10.8.2.5.52648 > 185.42.205.35.1935: Flags [.], seq 136683:137997, ack 1, win 501, options [nop,nop,TS val 279432711 ecr 197017339], length 1314
03:22:06.141334 IP 10.8.2.5.52648 > 185.42.205.35.1935: Flags [.], seq 137997:139311, ack 1, win 501, options [nop,nop,TS val 279432734 ecr 197017339], length 1314
03:22:06.146365 IP 185.42.205.35.1935 > 10.8.2.5.52648: Flags [.], ack 122866, win 203, options [nop,nop,TS val 197017401 ecr 279432202], length 0
03:22:06.182535 IP 10.8.2.5.52648 > 185.42.205.35.1935: Flags [.], seq 139311:140625, ack 1, win 501, options [nop,nop,TS val 279432775 ecr 197017401], length 1314
03:22:06.185086 IP 185.42.205.35.1935 > 10.8.2.5.52648: Flags [.], ack 124180, win 208, options [nop,nop,TS val 197017440 ecr 279432241], length 0
03:22:06.228412 IP 185.42.205.35.1935 > 10.8.2.5.52648: Flags [.], ack 125494, win 214, options [nop,nop,TS val 197017483 ecr 279432284], length 0
03:22:06.246250 IP 10.8.2.5.52648 > 185.42.205.35.1935: Flags [.], seq 140625:141939, ack 1, win 501, options [nop,nop,TS val 279432839 ecr 197017483], length 1314
03:22:06.278728 IP 185.42.205.35.1935 > 10.8.2.5.52648: Flags [.], ack 126808, win 220, options [nop,nop,TS val 197017534 ecr 279432335], length 0
03:22:06.289053 IP 10.8.2.5.52648 > 185.42.205.35.1935: Flags [.], seq 141939:143253, ack 1, win 501, options [nop,nop,TS val 279432882 ecr 197017534], length 1314
03:22:06.310538 IP 10.8.2.5.52648 > 185.42.205.35.1935: Flags [.], seq 143253:144567, ack 1, win 501, options [nop,nop,TS val 279432903 ecr 197017534], length 1314
03:22:06.313177 IP 185.42.205.35.1935 > 10.8.2.5.52648: Flags [.], ack 128122, win 225, options [nop,nop,TS val 197017568 ecr 279432369], length 0
03:22:06.356013 IP 185.42.205.35.1935 > 10.8.2.5.52648: Flags [.], ack 129436, win 231, options [nop,nop,TS val 197017611 ecr 279432412], length 0
03:22:06.374739 IP 10.8.2.5.52648 > 185.42.205.35.1935: Flags [.], seq 144567:145881, ack 1, win 501, options [nop,nop,TS val 279432968 ecr 197017611], length 1314
03:22:06.398727 IP 185.42.205.35.1935 > 10.8.2.5.52648: Flags [.], ack 130750, win 237, options [nop,nop,TS val 197017654 ecr 279432455], length 0
03:22:06.417171 IP 10.8.2.5.52648 > 185.42.205.35.1935: Flags [.], seq 145881:147195, ack 1, win 501, options [nop,nop,TS val 279433010 ecr 197017654], length 1314
03:22:06.460165 IP 10.8.2.5.52648 > 185.42.205.35.1935: Flags [.], seq 147195:148509, ack 1, win 501, options [nop,nop,TS val 279433053 ecr 197017654], length 1314
03:22:06.463186 IP 185.42.205.35.1935 > 10.8.2.5.52648: Flags [.], ack 132064, win 242, options [nop,nop,TS val 197017718 ecr 279432519], length 0
03:22:06.463925 IP 185.42.205.35.1935 > 10.8.2.5.52648: Flags [.], ack 132741, win 247, options [nop,nop,TS val 197017719 ecr 279432520], length 0
03:22:06.463951 IP 10.8.2.5.52648 > 185.42.205.35.1935: Flags [P.], seq 148509:148666, ack 1, win 501, options [nop,nop,TS val 279433057 ecr 197017719], length 157
03:22:06.523840 IP 10.8.2.5.52648 > 185.42.205.35.1935: Flags [.], seq 148666:149980, ack 1, win 501, options [nop,nop,TS val 279433117 ecr 197017719], length 1314
03:22:06.527152 IP 185.42.205.35.1935 > 10.8.2.5.52648: Flags [.], ack 134055, win 250, options [nop,nop,TS val 197017782 ecr 279432583], length 0
03:22:06.545372 IP 10.8.2.5.52648 > 185.42.205.35.1935: Flags [.], seq 149980:151294, ack 1, win 501, options [nop,nop,TS val 279433138 ecr 197017782], length 1314
03:22:06.588274 IP 10.8.2.5.52648 > 185.42.205.35.1935: Flags [.], seq 151294:152608, ack 1, win 501, options [nop,nop,TS val 279433181 ecr 197017782], length 1314
03:22:06.590949 IP 185.42.205.35.1935 > 10.8.2.5.52648: Flags [.], ack 135369, win 250, options [nop,nop,TS val 197017846 ecr 279432605], length 0
03:22:06.651834 IP 10.8.2.5.52648 > 185.42.205.35.1935: Flags [.], seq 152608:153922, ack 1, win 501, options [nop,nop,TS val 279433245 ecr 197017846], length 1314
03:22:06.654880 IP 185.42.205.35.1935 > 10.8.2.5.52648: Flags [.], ack 137997, win 250, options [nop,nop,TS val 197017910 ecr 279432647], length 0
03:22:06.673054 IP 10.8.2.5.52648 > 185.42.205.35.1935: Flags [.], seq 153922:155236, ack 1, win 501, options [nop,nop,TS val 279433266 ecr 197017910], length 1314
03:22:06.715857 IP 10.8.2.5.52648 > 185.42.205.35.1935: Flags [.], seq 155236:156550, ack 1, win 501, options [nop,nop,TS val 279433309 ecr 197017910], length 1314
03:22:06.719363 IP 185.42.205.35.1935 > 10.8.2.5.52648: Flags [.], ack 140625, win 250, options [nop,nop,TS val 197017974 ecr 279432734], length 0
03:22:06.779918 IP 10.8.2.5.52648 > 185.42.205.35.1935: Flags [.], seq 156550:157864, ack 1, win 501, options [nop,nop,TS val 279433373 ecr 197017974], length 1314
03:22:06.822773 IP 10.8.2.5.52648 > 185.42.205.35.1935: Flags [.], seq 157864:159178, ack 1, win 501, options [nop,nop,TS val 279433416 ecr 197017974], length 1314
03:22:06.825999 IP 185.42.205.35.1935 > 10.8.2.5.52648: Flags [.], ack 143253, win 250, options [nop,nop,TS val 197018081 ecr 279432839], length 0
03:22:06.844304 IP 10.8.2.5.52648 > 185.42.205.35.1935: Flags [.], seq 159178:160492, ack 1, win 501, options [nop,nop,TS val 279433437 ecr 197018081], length 1314
03:22:06.909014 IP 10.8.2.5.52648 > 185.42.205.35.1935: Flags [.], seq 160492:161806, ack 1, win 501, options [nop,nop,TS val 279433502 ecr 197018081], length 1314
03:22:06.911775 IP 185.42.205.35.1935 > 10.8.2.5.52648: Flags [.], ack 145881, win 250, options [nop,nop,TS val 197018167 ecr 279432903], length 0
03:22:06.942560 IP 10.8.2.5.52648 > 185.42.205.35.1935: Flags [.], seq 161806:163120, ack 1, win 501, options [nop,nop,TS val 279433535 ecr 197018167], length 1314
03:22:06.973457 IP 10.8.2.5.52648 > 185.42.205.35.1935: Flags [.], seq 163120:164434, ack 1, win 501, options [nop,nop,TS val 279433566 ecr 197018167], length 1314
03:22:06.996975 IP 185.42.205.35.1935 > 10.8.2.5.52648: Flags [.], ack 148509, win 250, options [nop,nop,TS val 197018252 ecr 279433010], length 0
03:22:07.000509 IP 185.42.205.35.1935 > 10.8.2.5.52648: Flags [.], ack 148666, win 250, options [nop,nop,TS val 197018256 ecr 279433057], length 0
03:22:07.000519 IP 10.8.2.5.52648 > 185.42.205.35.1935: Flags [P.], seq 164434:164686, ack 1, win 501, options [nop,nop,TS val 279433593 ecr 197018256], length 252
03:22:07.038783 IP 10.8.2.5.52648 > 185.42.205.35.1935: Flags [.], seq 164686:166000, ack 1, win 501, options [nop,nop,TS val 279433632 ecr 197018256], length 1314
03:22:07.075703 IP 10.8.2.5.52648 > 185.42.205.35.1935: Flags [.], seq 166000:167314, ack 1, win 501, options [nop,nop,TS val 279433669 ecr 197018256], length 1314
03:22:07.082200 IP 185.42.205.35.1935 > 10.8.2.5.52648: Flags [.], ack 151294, win 250, options [nop,nop,TS val 197018337 ecr 279433117], length 0
03:22:07.122726 IP 10.8.2.5.52648 > 185.42.205.35.1935: Flags [.], seq 167314:168628, ack 1, win 501, options [nop,nop,TS val 279433716 ecr 197018337], length 1314
03:22:07.172752 IP 10.8.2.5.52648 > 185.42.205.35.1935: Flags [.], seq 168628:169942, ack 1, win 501, options [nop,nop,TS val 279433766 ecr 197018337], length 1314
03:22:07.188747 IP 185.42.205.35.1935 > 10.8.2.5.52648: Flags [.], ack 153922, win 250, options [nop,nop,TS val 197018444 ecr 279433181], length 0
03:22:07.205402 IP 10.8.2.5.52648 > 185.42.205.35.1935: Flags [.], seq 169942:171256, ack 1, win 501, options [nop,nop,TS val 279433798 ecr 197018444], length 1314
03:22:07.250681 IP 10.8.2.5.52648 > 185.42.205.35.1935: Flags [.], seq 171256:172570, ack 1, win 501, options [nop,nop,TS val 279433844 ecr 197018444], length 1314
03:22:07.252939 IP 185.42.205.35.1935 > 10.8.2.5.52648: Flags [.], ack 156550, win 250, options [nop,nop,TS val 197018508 ecr 279433266], length 0
03:22:07.307775 IP 10.8.2.5.52648 > 185.42.205.35.1935: Flags [.], seq 172570:173884, ack 1, win 501, options [nop,nop,TS val 279433901 ecr 197018508], length 1314
03:22:07.342155 IP 10.8.2.5.52648 > 185.42.205.35.1935: Flags [.], seq 173884:175198, ack 1, win 501, options [nop,nop,TS val 279433935 ecr 197018508], length 1314
03:22:07.359827 IP 185.42.205.35.1935 > 10.8.2.5.52648: Flags [.], ack 159178, win 250, options [nop,nop,TS val 197018615 ecr 279433373], length 0
03:22:07.379504 IP 10.8.2.5.52648 > 185.42.205.35.1935: Flags [.], seq 175198:176512, ack 1, win 501, options [nop,nop,TS val 279433972 ecr 197018615], length 1314
03:22:07.440879 IP 10.8.2.5.52648 > 185.42.205.35.1935: Flags [.], seq 176512:177826, ack 1, win 501, options [nop,nop,TS val 279434034 ecr 197018615], length 1314
03:22:07.445899 IP 185.42.205.35.1935 > 10.8.2.5.52648: Flags [.], ack 161806, win 250, options [nop,nop,TS val 197018701 ecr 279433437], length 0
03:22:07.474747 IP 10.8.2.5.52648 > 185.42.205.35.1935: Flags [.], seq 177826:179140, ack 1, win 501, options [nop,nop,TS val 279434068 ecr 197018701], length 1314
03:22:07.509033 IP 10.8.2.5.52648 > 185.42.205.35.1935: Flags [.], seq 179140:180454, ack 1, win 501, options [nop,nop,TS val 279434102 ecr 197018701], length 1314
03:22:07.510151 IP 185.42.205.35.1935 > 10.8.2.5.52648: Flags [.], ack 164434, win 250, options [nop,nop,TS val 197018765 ecr 279433535], length 0
03:22:07.538045 IP 185.42.205.35.1935 > 10.8.2.5.52648: Flags [.], ack 164686, win 250, options [nop,nop,TS val 197018793 ecr 279433593], length 0
03:22:07.538096 IP 10.8.2.5.52648 > 185.42.205.35.1935: Flags [P.], seq 180454:180624, ack 1, win 501, options [nop,nop,TS val 279434131 ecr 197018793], length 170
03:22:07.575103 IP 10.8.2.5.52648 > 185.42.205.35.1935: Flags [.], seq 180624:181938, ack 1, win 501, options [nop,nop,TS val 279434168 ecr 197018793], length 1314
03:22:07.608501 IP 10.8.2.5.52648 > 185.42.205.35.1935: Flags [.], seq 181938:183252, ack 1, win 501, options [nop,nop,TS val 279434201 ecr 197018793], length 1314
03:22:07.612781 IP 185.42.205.35.1935 > 10.8.2.5.52648: Flags [.], ack 167314, win 250, options [nop,nop,TS val 197018867 ecr 279433632], length 0
03:22:07.657707 IP 10.8.2.5.52648 > 185.42.205.35.1935: Flags [.], seq 183252:184566, ack 1, win 501, options [nop,nop,TS val 279434251 ecr 197018867], length 1314
03:22:07.708345 IP 10.8.2.5.52648 > 185.42.205.35.1935: Flags [.], seq 184566:185880, ack 1, win 501, options [nop,nop,TS val 279434301 ecr 197018867], length 1314
03:22:07.710013 IP 185.42.205.35.1935 > 10.8.2.5.52648: Flags [.], ack 169942, win 250, options [nop,nop,TS val 197018965 ecr 279433716], length 0
03:22:07.742497 IP 10.8.2.5.52648 > 185.42.205.35.1935: Flags [.], seq 185880:187194, ack 1, win 501, options [nop,nop,TS val 279434335 ecr 197018965], length 1314
03:22:07.786330 IP 10.8.2.5.52648 > 185.42.205.35.1935: Flags [.], seq 187194:188508, ack 1, win 501, options [nop,nop,TS val 279434379 ecr 197018965], length 1314
03:22:07.787741 IP 185.42.205.35.1935 > 10.8.2.5.52648: Flags [.], ack 172570, win 250, options [nop,nop,TS val 197019043 ecr 279433798], length 0
03:22:07.842578 IP 10.8.2.5.52648 > 185.42.205.35.1935: Flags [.], seq 188508:189822, ack 1, win 501, options [nop,nop,TS val 279434436 ecr 197019043], length 1314
03:22:07.875895 IP 10.8.2.5.52648 > 185.42.205.35.1935: Flags [.], seq 189822:191136, ack 1, win 501, options [nop,nop,TS val 279434469 ecr 197019043], length 1314
03:22:07.878972 IP 185.42.205.35.1935 > 10.8.2.5.52648: Flags [.], ack 175198, win 250, options [nop,nop,TS val 197019134 ecr 279433901], length 0
03:22:07.915173 IP 10.8.2.5.52648 > 185.42.205.35.1935: Flags [.], seq 191136:192450, ack 1, win 501, options [nop,nop,TS val 279434508 ecr 197019134], length 1314
