05:34:01.808292 IP 99.181.65.119.1935 > 10.8.3.3.50932: Flags [.], ack 1233340761, win 126, options [nop,nop,TS val 4261294059 ecr 2919483173], length 0
05:34:01.808331 IP 10.8.3.3.50932 > 99.181.65.119.1935: Flags [P.], seq 5257:6026, ack 0, win 501, options [nop,nop,TS val 2919483388 ecr 4261294059], length 769
05:34:01.860752 IP 10.8.3.3.50932 > 99.181.65.119.1935: Flags [.], seq 6026:7340, ack 0, win 501, options [nop,nop,TS val 2919483440 ecr 4261294059], length 1314
05:34:01.892096 IP 10.8.3.3.50932 > 99.181.65.119.1935: Flags [.], seq 7340:8654, ack 0, win 501, options [nop,nop,TS val 2919483471 ecr 4261294059], length 1314
05:34:01.908148 IP 99.181.65.119.1935 > 10.8.3.3.50932: Flags [.], ack 2629, win 126, options [nop,nop,TS val 4261294158 ecr 2919483240], length 0
05:34:01.925474 IP 10.8.3.3.50932 > 99.181.65.119.1935: Flags [.], seq 8654:9968, ack 0, win 501, options [nop,nop,TS val 2919483505 ecr 4261294158], length 1314
05:34:01.989765 IP 10.8.3.3.50932 > 99.181.65.119.1935: Flags [.], seq 9968:11282, ack 0, win 501, options [nop,nop,TS val 2919483569 ecr 4261294158], length 1314
05:34:02.004830 IP 99.181.65.119.1935 > 10.8.3.3.50932: Flags [.], ack 5257, win 126, options [nop,nop,TS val 4261294253 ecr 2919483304], length 0
05:34:02.021801 IP 99.181.65.119.1935 > 10.8.3.3.50932: Flags [.], ack 6026, win 126, options [nop,nop,TS val 4261294272 ecr 2919483388], length 0
05:34:02.021837 IP 10.8.3.3.50932 > 99.181.65.119.1935: Flags [P.], seq 11282:12060, ack 0, win 501, options [nop,nop,TS val 2919483601 ecr 4261294272], length 778
05:34:02.060217 IP 10.8.3.3.50932 > 99.181.65.119.1935: Flags [.], seq 12060:13374, ack 0, win 501, options [nop,nop,TS val 2919483640 ecr 4261294272], length 1314
05:34:02.094468 IP 10.8.3.3.50932 > 99.181.65.119.1935: Flags [.], seq 13374:14688, ack 0, win 501, options [nop,nop,TS val 2919483674 ecr 4261294272], length 1314
05:34:02.105679 IP 99.181.65.119.1935 > 10.8.3.3.50932: Flags [.], ack 8654, win 126, options [nop,nop,TS val 4261294356 ecr 2919483440], length 0
05:34:02.131734 IP 10.8.3.3.50932 > 99.181.65.119.1935: Flags [.], seq 14688:16002, ack 0, win 501, options [nop,nop,TS val 2919483711 ecr 4261294356], length 1314
05:34:02.190344 IP 10.8.3.3.50932 > 99.181.65.119.1935: Flags [.], seq 16002:17316, ack 0, win 501, options [nop,nop,TS val 2919483770 ecr 4261294356], length 1314
05:34:02.200092 IP 99.181.65.119.1935 > 10.8.3.3.50932: Flags [.], ack 9968, win 126, options [nop,nop,TS val 4261294451 ecr 2919483505], length 0
05:34:02.224471 IP 10.8.3.3.50932 > 99.181.65.119.1935: Flags [.], seq 17316:18630, ack 0, win 501, options [nop,nop,TS val 2919483804 ecr 4261294451], length 1314
05:34:02.235266 IP 99.181.65.119.1935 > 10.8.3.3.50932: Flags [.], ack 12060, win 126, options [nop,nop,TS val 4261294486 ecr 2919483569], length 0
05:34:02.235300 IP 10.8.3.3.50932 > 99.181.65.119.1935: Flags [P.], seq 18630:18945, ack 0, win 501, options [nop,nop,TS val 2919483815 ecr 4261294486], length 315
05:34:02.293819 IP 10.8.3.3.50932 > 99.181.65.119.1935: Flags [.], seq 18945:20259, ack 0, win 501, options [nop,nop,TS val 2919483873 ecr 4261294486], length 1314
05:34:02.308012 IP 99.181.65.119.1935 > 10.8.3.3.50932: Flags [.], ack 14688, win 126, options [nop,nop,TS val 4261294558 ecr 2919483640], length 0
05:34:02.323867 IP 10.8.3.3.50932 > 99.181.65.119.1935: Flags [.], seq 20259:21573, ack 0, win 501, options [nop,nop,TS val 2919483903 ecr 4261294558], length 1314
05:34:02.356395 IP 10.8.3.3.50932 > 99.181.65.119.1935: Flags [.], seq 21573:22887, ack 0, win 501, options [nop,nop,TS val 2919483936 ecr 4261294558], length 1314
05:34:02.403877 IP 99.181.65.119.1935 > 10.8.3.3.50932: Flags [.], ack 17316, win 126, options [nop,nop,TS val 4261294654 ecr 2919483711], length 0
05:34:02.423973 IP 10.8.3.3.50932 > 99.181.65.119.1935: Flags [.], seq 22887:24201, ack 0, win 501, options [nop,nop,TS val 2919484003 ecr 4261294654], length 1314
05:34:02.448679 IP 99.181.65.119.1935 > 10.8.3.3.50932: Flags [.], ack 18945, win 126, options [nop,nop,TS val 4261294699 ecr 2919483804], length 0
05:34:02.448713 IP 10.8.3.3.50932 > 99.181.65.119.1935: Flags [P.], seq 24201:24978, ack 0, win 501, options [nop,nop,TS val 2919484028 ecr 4261294699], length 777
05:34:02.494067 IP 10.8.3.3.50932 > 99.181.65.119.1935: Flags [.], seq 24978:26292, ack 0, win 501, options [nop,nop,TS val 2919484073 ecr 4261294699], length 1314
05:34:02.522983 IP 10.8.3.3.50932 > 99.181.65.119.1935: Flags [.], seq 26292:27606, ack 0, win 501, options [nop,nop,TS val 2919484102 ecr 4261294699], length 1314
05:34:02.537414 IP 99.181.65.119.1935 > 10.8.3.3.50932: Flags [.], ack 21573, win 126, options [nop,nop,TS val 4261294788 ecr 2919483873], length 0
05:34:02.557677 IP 10.8.3.3.50932 > 99.181.65.119.1935: Flags [.], seq 27606:28920, ack 0, win 501, options [nop,nop,TS val 2919484137 ecr 4261294788], length 1314
05:34:02.627258 IP 10.8.3.3.50932 > 99.181.65.119.1935: Flags [.], seq 28920:30234, ack 0, win 501, options [nop,nop,TS val 2919484207 ecr 4261294788], length 1314
05:34:02.637900 IP 99.181.65.119.1935 > 10.8.3.3.50932: Flags [.], ack 24201, win 126, options [nop,nop,TS val 4261294888 ecr 2919483936], length 0
05:34:02.660579 IP 10.8.3.3.50932 > 99.181.65.119.1935: Flags [.], seq 30234:31548, ack 0, win 501, options [nop,nop,TS val 2919484240 ecr 4261294888], length 1314
05:34:02.662309 IP 99.181.65.119.1935 > 10.8.3.3.50932: Flags [.], ack 24978, win 126, options [nop,nop,TS val 4261294913 ecr 2919484028], length 0
05:34:02.662343 IP 10.8.3.3.50932 > 99.181.65.119.1935: Flags [P.], seq 31548:31851, ack 0, win 501, options [nop,nop,TS val 2919484242 ecr 4261294913], length 303
05:34:02.724092 IP 10.8.3.3.50932 > 99.181.65.119.1935: Flags [.], seq 31851:33165, ack 0, win 501, options [nop,nop,TS val 2919484303 ecr 4261294913], length 1314
05:34:02.736619 IP 99.181.65.119.1935 > 10.8.3.3.50932: Flags [.], ack 27606, win 126, options [nop,nop,TS val 4261294987 ecr 2919484073], length 0
05:34:02.758392 IP 10.8.3.3.50932 > 99.181.65.119.1935: Flags [.], seq 33165:34479, ack 0, win 501, options [nop,nop,TS val 2919484338 ecr 4261294987], length 1314
05:34:02.789771 IP 10.8.3.3.50932 > 99.181.65.119.1935: Flags [.], seq 34479:35793, ack 0, win 501, options [nop,nop,TS val 2919484369 ecr 4261294987], length 1314
05:34:02.836263 IP 99.181.65.119.1935 > 10.8.3.3.50932: Flags [.], ack 28920, win 126, options [nop,nop,TS val 4261295087 ecr 2919484137], length 0
05:34:02.856568 IP 10.8.3.3.50932 > 99.181.65.119.1935: Flags [.], seq 35793:37107, ack 0, win 501, options [nop,nop,TS val 2919484436 ecr 4261295087], length 1314
05:34:02.875717 IP 99.181.65.119.1935 > 10.8.3.3.50932: Flags [.], ack 31851, win 126, options [nop,nop,TS val 4261295126 ecr 2919484242], length 0
05:34:02.875761 IP 10.8.3.3.50932 > 99.181.65.119.1935: Flags [P.], seq 37107:37889, ack 0, win 501, options [nop,nop,TS val 2919484455 ecr 4261295126], length 782
05:34:02.928012 IP 10.8.3.3.50932 > 99.181.65.119.1935: Flags [.], seq 37889:39203, ack 0, win 501, options [nop,nop,TS val 2919484507 ecr 4261295126], length 1314
05:34:02.957793 IP 10.8.3.3.50932 > 99.181.65.119.1935: Flags [.], seq 39203:40517, ack 0, win 501, options [nop,nop,TS val 2919484537 ecr 4261295126], length 1314
05:34:02.971720 IP 99.181.65.119.1935 > 10.8.3.3.50932: Flags [.], ack 34479, win 126, options [nop,nop,TS val 4261295222 ecr 2919484303], length 0
05:34:02.992059 IP 10.8.3.3.50932 > 99.181.65.119.1935: Flags [.], seq 40517:41831, ack 0, win 501, options [nop,nop,TS val 2919484571 ecr 4261295222], length 1314
05:34:03.056377 IP 10.8.3.3.50932 > 99.181.65.119.1935: Flags [.], seq 41831:43145, ack 0, win 501, options [nop,nop,TS val 2919484636 ecr 4261295222], length 1314
05:34:03.070211 IP 99.181.65.119.1935 > 10.8.3.3.50932: Flags [.], ack 37107, win 126, options [nop,nop,TS val 4261295321 ecr 2919484369], length 0
05:34:03.089386 IP 99.181.65.119.1935 > 10.8.3.3.50932: Flags [.], ack 37889, win 126, options [nop,nop,TS val 4261295340 ecr 2919484455], length 0
05:34:03.089423 IP 10.8.3.3.50932 > 99.181.65.119.1935: Flags [P.], seq 43145:43926, ack 0, win 501, options [nop,nop,TS val 2919484669 ecr 4261295340], length 781
05:34:03.128043 IP 10.8.3.3.50932 > 99.181.65.119.1935: Flags [.], seq 43926:45240, ack 0, win 501, options [nop,nop,TS val 2919484707 ecr 4261295340], length 1314
05:34:03.159230 IP 10.8.3.3.50932 > 99.181.65.119.1935: Flags [.], seq 45240:46554, ack 0, win 501, options [nop,nop,TS val 2919484739 ecr 4261295340], length 1314
05:34:03.171275 IP 99.181.65.119.1935 > 10.8.3.3.50932: Flags [.], ack 40517, win 126, options [nop,nop,TS val 4261295422 ecr 2919484507], length 0
05:34:03.198393 IP 10.8.3.3.50932 > 99.181.65.119.1935: Flags [.], seq 46554:47868, ack 0, win 501, options [nop,nop,TS val 2919484778 ecr 4261295422], length 1314
05:34:03.257815 IP 10.8.3.3.50932 > 99.181.65.119.1935: Flags [.], seq 47868:49182, ack 0, win 501, options [nop,nop,TS val 2919484837 ecr 4261295422], length 1314
05:34:03.269827 IP 99.181.65.119.1935 > 10.8.3.3.50932: Flags [.], ack 43145, win 126, options [nop,nop,TS val 4261295520 ecr 2919484571], length 0
05:34:03.291428 IP 10.8.3.3.50932 > 99.181.65.119.1935: Flags [.], seq 49182:50496, ack 0, win 501, options [nop,nop,TS val 2919484871 ecr 4261295520], length 1314
05:34:03.302776 IP 99.181.65.119.1935 > 10.8.3.3.50932: Flags [.], ack 43926, win 126, options [nop,nop,TS val 4261295553 ecr 2919484669], length 0
05:34:03.302788 IP 10.8.3.3.50932 > 99.181.65.119.1935: Flags [P.], seq 50496:50798, ack 0, win 501, options [nop,nop,TS val 2919484882 ecr 4261295553], length 302
05:34:03.356380 IP 10.8.3.3.50932 > 99.181.65.119.1935: Flags [.], seq 50798:52112, ack 0, win 501, options [nop,nop,TS val 2919484936 ecr 4261295553], length 1314
05:34:03.373087 IP 99.181.65.119.1935 > 10.8.3.3.50932: Flags [.], ack 46554, win 126, options [nop,nop,TS val 4261295623 ecr 2919484707], length 0
05:34:03.389863 IP 10.8.3.3.50932 > 99.181.65.119.1935: Flags [.], seq 52112:53426, ack 0, win 501, options [nop,nop,TS val 2919484969 ecr 4261295623], length 1314
05:34:03.425462 IP 10.8.3.3.50932 > 99.181.65.119.1935: Flags [.], seq 53426:54740, ack 0, win 501, options [nop,nop,TS val 2919485005 ecr 4261295623], length 1314
05:34:03.471523 IP 99.181.65.119.1935 > 10.8.3.3.50932: Flags [.], ack 49182, win 126, options [nop,nop,TS val 4261295722 ecr 2919484778], length 0
05:34:03.490169 IP 10.8.3.3.50932 > 99.181.65.119.1935: Flags [.], seq 54740:56054, ack 0, win 501, options [nop,nop,TS val 2919485069 ecr 4261295722], length 1314
05:34:03.516326 IP 99.181.65.119.1935 > 10.8.3.3.50932: Flags [.], ack 50798, win 126, options [nop,nop,TS val 4261295767 ecr 2919484871], length 0
05:34:03.516363 IP 10.8.3.3.50932 > 99.181.65.119.1935: Flags [P.], seq 56054:56828, ack 0, win 501, options [nop,nop,TS val 2919485096 ecr 4261295767], length 774
05:34:03.560431 IP 10.8.3.3.50932 > 99.181.65.119.1935: Flags [.], seq 56828:58142, ack 0, win 501, options [nop,nop,TS val 2919485140 ecr 4261295767], length 1314
05:34:03.597033 IP 10.8.3.3.50932 > 99.181.65.119.1935: Flags [.], seq 58142:59456, ack 0, win 501, options [nop,nop,TS val 2919485176 ecr 4261295767], length 1314
05:34:03.603633 IP 99.181.65.119.1935 > 10.8.3.3.50932: Flags [.], ack 53426, win 126, options [nop,nop,TS val 4261295854 ecr 2919484936], length 0
05:34:03.625740 IP 10.8.3.3.50932 > 99.181.65.119.1935: Flags [.], seq 59456:60770, ack 0, win 501, options [nop,nop,TS val 2919485205 ecr 4261295854], length 1314
05:34:03.692222 IP 10.8.3.3.50932 > 99.181.65.119.1935: Flags [.], seq 60770:62084, ack 0, win 501, options [nop,nop,TS val 2919485272 ecr 4261295854], length 1314
05:34:03.703771 IP 99.181.65.119.1935 > 10.8.3.3.50932: Flags [.], ack 56054, win 126, options [nop,nop,TS val 4261295954 ecr 2919485005], length 0
05:34:03.725949 IP 10.8.3.3.50932 > 99.181.65.119.1935: Flags [.], seq 62084:63398, ack 0, win 501, options [nop,nop,TS val 2919485305 ecr 4261295954], length 1314
05:34:03.729620 IP 99.181.65.119.1935 > 10.8.3.3.50932: Flags [.], ack 56828, win 126, options [nop,nop,TS val 4261295980 ecr 2919485096], length 0
05:34:03.729646 IP 10.8.3.3.50932 > 99.181.65.119.1935: Flags [P.], seq 63398:63712, ack 0, win 501, options [nop,nop,TS val 2919485309 ecr 4261295980], length 314
05:34:03.791474 IP 10.8.3.3.50932 > 99.181.65.119.1935: Flags [.], seq 63712:65026, ack 0, win 501, options [nop,nop,TS val 2919485371 ecr 4261295980], length 1314
05:34:03.810494 IP 99.181.65.119.1935 > 10.8.3.3.50932: Flags [.], ack 59456, win 126, options [nop,nop,TS val 4261296061 ecr 2919485140], length 0
05:34:03.824828 IP 10.8.3.3.50932 > 99.181.65.119.1935: Flags [.], seq 65026:66340, ack 0, win 501, options [nop,nop,TS val 2919485404 ecr 4261296061], length 1314
05:34:03.856623 IP 10.8.3.3.50932 > 99.181.65.119.1935: Flags [.], seq 66340:67654, ack 0, win 501, options [nop,nop,TS val 2919485436 ecr 4261296061], length 1314
05:34:03.904095 IP 99.181.65.119.1935 > 10.8.3.3.50932: Flags [.], ack 60770, win 126, options [nop,nop,TS val 4261296155 ecr 2919485205], length 0
05:34:03.923267 IP 10.8.3.3.50932 > 99.181.65.119.1935: Flags [.], seq 67654:68968, ack 0, win 501, options [nop,nop,TS val 2919485503 ecr 4261296155], length 1314
05:34:03.939483 IP 99.181.65.119.1935 > 10.8.3.3.50932: Flags [.], ack 63398, win 126, options [nop,nop,TS val 4261296190 ecr 2919485272], length 0
05:34:03.942941 IP 99.181.65.119.1935 > 10.8.3.3.50932: Flags [.], ack 63712, win 126, options [nop,nop,TS val 4261296194 ecr 2919485309], length 0
05:34:03.942952 IP 10.8.3.3.50932 > 99.181.65.119.1935: Flags [P.], seq 68968:69750, ack 0, win 501, options [nop,nop,TS val 2919485522 ecr 4261296194], length 782
05:34:03.990228 IP 10.8.3.3.50932 > 99.181.65.119.1935: Flags [.], seq 69750:71064, ack 0, win 501, options [nop,nop,TS val 2919485570 ecr 4261296194], length 1314
05:34:04.025142 IP 10.8.3.3.50932 > 99.181.65.119.1935: Flags [.], seq 71064:72378, ack 0, win 501, options [nop,nop,TS val 2919485604 ecr 4261296194], length 1314
05:34:04.038269 IP 99.181.65.119.1935 > 10.8.3.3.50932: Flags [.], ack 66340, win 126, options [nop,nop,TS val 4261296289 ecr 2919485371], length 0
05:34:04.059396 IP 10.8.3.3.50932 > 99.181.65.119.1935: Flags [.], seq 72378:73692, ack 0, win 501, options [nop,nop,TS val 2919485639 ecr 4261296289], length 1314
05:34:04.125984 IP 10.8.3.3.50932 > 99.181.65.119.1935: Flags [.], seq 73692:75006, ack 0, win 501, options [nop,nop,TS val 2919485705 ecr 4261296289], length 1314
05:34:04.136827 IP 99.181.65.119.1935 > 10.8.3.3.50932: Flags [.], ack 68968, win 126, options [nop,nop,TS val 4261296387 ecr 2919485436], length 0
05:34:04.156426 IP 99.181.65.119.1935 > 10.8.3.3.50932: Flags [.], ack 69750, win 126, options [nop,nop,TS val 4261296407 ecr 2919485522], length 0
05:34:04.156448 IP 10.8.3.3.50932 > 99.181.65.119.1935: Flags [P.], seq 75006:75776, ack 0, win 501, options [nop,nop,TS val 2919485736 ecr 4261296407], length 770
05:34:04.193773 IP 10.8.3.3.50932 > 99.181.65.119.1935: Flags [.], seq 75776:77090, ack 0, win 501, options [nop,nop,TS val 2919485773 ecr 4261296407], length 1314
05:34:04.227520 IP 10.8.3.3.50932 > 99.181.65.119.1935: Flags [.], seq 77090:78404, ack 0, win 501, options [nop,nop,TS val 2919485807 ecr 4261296407], length 1314
05:34:04.238868 IP 99.181.65.119.1935 > 10.8.3.3.50932: Flags [.], ack 72378, win 126, options [nop,nop,TS val 4261296489 ecr 2919485570], length 0
05:34:04.265013 IP 10.8.3.3.50932 > 99.181.65.119.1935: Flags [.], seq 78404:79718, ack 0, win 501, options [nop,nop,TS val 2919485844 ecr 4261296489], length 1314
05:34:04.324083 IP 10.8.3.3.50932 > 99.181.65.119.1935: Flags [.], seq 79718:81032, ack 0, win 501, options [nop,nop,TS val 2919485903 ecr 4261296489], length 1314
05:34:04.339430 IP 99.181.65.119.1935 > 10.8.3.3.50932: Flags [.], ack 75006, win 126, options [nop,nop,TS val 4261296590 ecr 2919485639], length 0
05:34:04.358464 IP 10.8.3.3.50932 > 99.181.65.119.1935: Flags [.], seq 81032:82346, ack 0, win 501, options [nop,nop,TS val 2919485938 ecr 4261296590], length 1314
05:34:04.369621 IP 99.181.65.119.1935 > 10.8.3.3.50932: Flags [.], ack 75776, win 126, options [nop,nop,TS val 4261296620 ecr 2919485736], length 0
05:34:04.369634 IP 10.8.3.3.50932 > 99.181.65.119.1935: Flags [P.], seq 82346:82657, ack 0, win 501, options [nop,nop,TS val 2919485949 ecr 4261296620], length 311
05:34:04.424524 IP 10.8.3.3.50932 > 99.181.65.119.1935: Flags [.], seq 82657:83971, ack 0, win 501, options [nop,nop,TS val 2919486004 ecr 4261296620], length 1314
05:34:04.441056 IP 99.181.65.119.1935 > 10.8.3.3.50932: Flags [.], ack 78404, win 126, options [nop,nop,TS val 4261296691 ecr 2919485773], length 0
05:34:04.456732 IP 10.8.3.3.50932 > 99.181.65.119.1935: Flags [.], seq 83971:85285, ack 0, win 501, options [nop,nop,TS val 2919486036 ecr 4261296691], length 1314
05:34:04.493992 IP 10.8.3.3.50932 > 99.181.65.119.1935: Flags [.], seq 85285:86599, ack 0, win 501, options [nop,nop,TS val 2919486073 ecr 4261296691], length 1314
05:34:04.537792 IP 99.181.65.119.1935 > 10.8.3.3.50932: Flags [.], ack 81032, win 126, options [nop,nop,TS val 4261296788 ecr 2919485844], length 0
05:34:04.557095 IP 10.8.3.3.50932 > 99.181.65.119.1935: Flags [.], seq 86599:87913, ack 0, win 501, options [nop,nop,TS val 2919486136 ecr 4261296788], length 1314
05:34:04.582888 IP 99.181.65.119.1935 > 10.8.3.3.50932: Flags [.], ack 82657, win 126, options [nop,nop,TS val 4261296833 ecr 2919485938], length 0
05:34:04.582915 IP 10.8.3.3.50932 > 99.181.65.119.1935: Flags [P.], seq 87913:88694, ack 0, win 501, options [nop,nop,TS val 2919486162 ecr 4261296833], length 781
05:34:04.627467 IP 10.8.3.3.50932 > 99.181.65.119.1935: Flags [.], seq 88694:90008, ack 0, win 501, options [nop,nop,TS val 2919486207 ecr 4261296833], length 1314
05:34:04.660524 IP 10.8.3.3.50932 > 99.181.65.119.1935: Flags [.], seq 90008:91322, ack 0, win 501, options [nop,nop,TS val 2919486240 ecr 4261296833], length 1314
05:34:04.670654 IP 99.181.65.119.1935 > 10.8.3.3.50932: Flags [.], ack 85285, win 126, options [nop,nop,TS val 4261296921 ecr 2919486004], length 0
05:34:04.692252 IP 10.8.3.3.50932 > 99.181.65.119.1935: Flags [.], seq 91322:92636, ack 0, win 501, options [nop,nop,TS val 2919486272 ecr 4261296921], length 1314
05:34:04.757883 IP 10.8.3.3.50932 > 99.181.65.119.1935: Flags [.], seq 92636:93950, ack 0, win 501, options [nop,nop,TS val 2919486337 ecr 4261296921], length 1314
05:34:04.770596 IP 99.181.65.119.1935 > 10.8.3.3.50932: Flags [.], ack 87913, win 126, options [nop,nop,TS val 4261297021 ecr 2919486073], length 0
05:34:04.789694 IP 10.8.3.3.50932 > 99.181.65.119.1935: Flags [.], seq 93950:95264, ack 0, win 501, options [nop,nop,TS val 2919486369 ecr 4261297021], length 1314
05:34:04.796168 IP 99.181.65.119.1935 > 10.8.3.3.50932: Flags [.], ack 88694, win 126, options [nop,nop,TS val 4261297047 ecr 2919486162], length 0
05:34:04.796181 IP 10.8.3.3.50932 > 99.181.65.119.1935: Flags [P.], seq 95264:95575, ack 0, win 501, options [nop,nop,TS val 2919486376 ecr 4261297047], length 311
05:34:04.860357 IP 10.8.3.3.50932 > 99.181.65.119.1935: Flags [.], seq 95575:96889, ack 0, win 501, options [nop,nop,TS val 2919486440 ecr 4261297047], length 1314
05:34:04.874111 IP 99.181.65.119.1935 > 10.8.3.3.50932: Flags [.], ack 91322, win 126, options [nop,nop,TS val 4261297125 ecr 2919486207], length 0
05:34:04.893891 IP 10.8.3.3.50932 > 99.181.65.119.1935: Flags [.], seq 96889:98203, ack 0, win 501, options [nop,nop,TS val 2919486473 ecr 4261297125], length 1314
05:34:04.925514 IP 10.8.3.3.50932 > 99.181.65.119.1935: Flags [.], seq 98203:99517, ack 0, win 501, options [nop,nop,TS val 2919486505 ecr 4261297125], length 1314
05:34:04.971617 IP 99.181.65.119.1935 > 10.8.3.3.50932: Flags [.], ack 93950, win 126, options [nop,nop,TS val 4261297222 ecr 2919486272], length 0
05:34:04.990585 IP 10.8.3.3.50932 > 99.181.65.119.1935: Flags [.], seq 99517:100831, ack 0, win 501, options [nop,nop,TS val 2919486570 ecr 4261297222], length 1314
05:34:05.009706 IP 99.181.65.119.1935 > 10.8.3.3.50932: Flags [.], ack 95575, win 126, options [nop,nop,TS val 4261297260 ecr 2919486369], length 0
05:34:05.009733 IP 10.8.3.3.50932 > 99.181.65.119.1935: Flags [P.], seq 100831:101600, ack 0, win 501, options [nop,nop,TS val 2919486589 ecr 4261297260], length 769
05:34:05.056519 IP 10.8.3.3.50932 > 99.181.65.119.1935: Flags [.], seq 101600:102914, ack 0, win 501, options [nop,nop,TS val 2919486636 ecr 4261297260], length 1314
05:34:05.090374 IP 10.8.3.3.50932 > 99.181.65.119.1935: Flags [.], seq 102914:104228, ack 0, win 501, options [nop,nop,TS val 2919486670 ecr 4261297260], length 1314
05:34:05.107430 IP 99.181.65.119.1935 > 10.8.3.3.50932: Flags [.], ack 98203, win 126, options [nop,nop,TS val 4261297358 ecr 2919486440], length 0
05:34:05.126266 IP 10.8.3.3.50932 > 99.181.65.119.1935: Flags [.], seq 104228:105542, ack 0, win 501, options [nop,nop,TS val 2919486706 ecr 4261297358], length 1314
05:34:05.193891 IP 10.8.3.3.50932 > 99.181.65.119.1935: Flags [.], seq 105542:106856, ack 0, win 501, options [nop,nop,TS val 2919486773 ecr 4261297358], length 1314
05:34:05.204329 IP 99.181.65.119.1935 > 10.8.3.3.50932: Flags [.], ack 99517, win 126, options [nop,nop,TS val 4261297455 ecr 2919486505], length 0
05:34:05.223103 IP 99.181.65.119.1935 > 10.8.3.3.50932: Flags [.], ack 101600, win 126, options [nop,nop,TS val 4261297474 ecr 2919486570], length 0
05:34:05.223139 IP 10.8.3.3.50932 > 99.181.65.119.1935: Flags [P.], seq 106856:107633, ack 0, win 501, options [nop,nop,TS val 2919486802 ecr 4261297474], length 777
05:34:05.256879 IP 10.8.3.3.50932 > 99.181.65.119.1935: Flags [.], seq 107633:108947, ack 0, win 501, options [nop,nop,TS val 2919486836 ecr 4261297474], length 1314
05:34:05.290323 IP 10.8.3.3.50932 > 99.181.65.119.1935: Flags [.], seq 108947:110261, ack 0, win 501, options [nop,nop,TS val 2919486870 ecr 4261297474], length 1314
05:34:05.304009 IP 99.181.65.119.1935 > 10.8.3.3.50932: Flags [.], ack 104228, win 126, options [nop,nop,TS val 4261297555 ecr 2919486636], length 0
05:34:05.331794 IP 10.8.3.3.50932 > 99.181.65.119.1935: Flags [.], seq 110261:111575, ack 0, win 501, options [nop,nop,TS val 2919486911 ecr 4261297555], length 1314
05:34:05.393396 IP 10.8.3.3.50932 > 99.181.65.119.1935: Flags [.], seq 111575:112889, ack 0, win 501, options [nop,nop,TS val 2919486973 ecr 4261297555], length 1314
05:34:05.407707 IP 99.181.65.119.1935 > 10.8.3.3.50932: Flags [.], ack 106856, win 126, options [nop,nop,TS val 4261297658 ecr 2919486706], length 0
05:34:05.427172 IP 10.8.3.3.50932 > 99.181.65.119.1935: Flags [.], seq 112889:114203, ack 0, win 501, options [nop,nop,TS val 2919487006 ecr 4261297658], length 1314
05:34:05.436652 IP 99.181.65.119.1935 > 10.8.3.3.50932: Flags [.], ack 107633, win 126, options [nop,nop,TS val 4261297687 ecr 2919486802], length 0
05:34:05.436696 IP 10.8.3.3.50932 > 99.181.65.119.1935: Flags [P.], seq 114203:114518, ack 0, win 501, options [nop,nop,TS val 2919487016 ecr 4261297687], length 315
05:34:05.492174 IP 10.8.3.3.50932 > 99.181.65.119.1935: Flags [.], seq 114518:115832, ack 0, win 501, options [nop,nop,TS val 2919487071 ecr 4261297687], length 1314
05:34:05.503734 IP 99.181.65.119.1935 > 10.8.3.3.50932: Flags [.], ack 110261, win 126, options [nop,nop,TS val 4261297754 ecr 2919486836], length 0
05:34:05.524326 IP 10.8.3.3.50932 > 99.181.65.119.1935: Flags [.], seq 115832:117146, ack 0, win 501, options [nop,nop,TS val 2919487104 ecr 4261297754], length 1314
05:34:05.558697 IP 10.8.3.3.50932 > 99.181.65.119.1935: Flags [.], seq 117146:118460, ack 0, win 501, options [nop,nop,TS val 2919487138 ecr 4261297754], length 1314
05:34:05.606856 IP 99.181.65.119.1935 > 10.8.3.3.50932: Flags [.], ack 112889, win 126, options [nop,nop,TS val 4261297857 ecr 2919486911], length 0
05:34:05.623493 IP 10.8.3.3.50932 > 99.181.65.119.1935: Flags [.], seq 118460:119774, ack 0, win 501, options [nop,nop,TS val 2919487203 ecr 4261297857], length 1314
05:34:05.649879 IP 99.181.65.119.1935 > 10.8.3.3.50932: Flags [.], ack 114518, win 126, options [nop,nop,TS val 4261297900 ecr 2919487006], length 0
05:34:05.649904 IP 10.8.3.3.50932 > 99.181.65.119.1935: Flags [P.], seq 119774:120551, ack 0, win 501, options [nop,nop,TS val 2919487229 ecr 4261297900], length 777
05:34:05.693795 IP 10.8.3.3.50932 > 99.181.65.119.1935: Flags [.], seq 120551:121865, ack 0, win 501, options [nop,nop,TS val 2919487273 ecr 4261297900], length 1314
05:34:05.727578 IP 10.8.3.3.50932 > 99.181.65.119.1935: Flags [.], seq 121865:123179, ack 0, win 501, options [nop,nop,TS val 2919487307 ecr 4261297900], length 1314
05:34:05.737840 IP 99.181.65.119.1935 > 10.8.3.3.50932: Flags [.], ack 117146, win 126, options [nop,nop,TS val 4261297988 ecr 2919487071], length 0
05:34:05.759288 IP 10.8.3.3.50932 > 99.181.65.119.1935: Flags [.], seq 123179:124493, ack 0, win 501, options [nop,nop,TS val 2919487339 ecr 4261297988], length 1314
05:34:05.825310 IP 10.8.3.3.50932 > 99.181.65.119.1935: Flags [.], seq 124493:125807, ack 0, win 501, options [nop,nop,TS val 2919487405 ecr 4261297988], length 1314
05:34:05.836809 IP 99.181.65.119.1935 > 10.8.3.3.50932: Flags [.], ack 119774, win 126, options [nop,nop,TS val 4261298088 ecr 2919487138], length 0
05:34:05.858998 IP 10.8.3.3.50932 > 99.181.65.119.1935: Flags [.], seq 125807:127121, ack 0, win 501, options [nop,nop,TS val 2919487438 ecr 4261298088], length 1314
05:34:05.863316 IP 99.181.65.119.1935 > 10.8.3.3.50932: Flags [.], ack 120551, win 126, options [nop,nop,TS val 4261298114 ecr 2919487229], length 0
05:34:05.863343 IP 10.8.3.3.50932 > 99.181.65.119.1935: Flags [P.], seq 127121:127425, ack 0, win 501, options [nop,nop,TS val 2919487443 ecr 4261298114], length 304
05:34:05.927628 IP 10.8.3.3.50932 > 99.181.65.119.1935: Flags [.], seq 127425:128739, ack 0, win 501, options [nop,nop,TS val 2919487507 ecr 4261298114], length 1314
05:34:05.941282 IP 99.181.65.119.1935 > 10.8.3.3.50932: Flags [.], ack 123179, win 126, options [nop,nop,TS val 4261298192 ecr 2919487273], length 0
05:34:05.960737 IP 10.8.3.3.50932 > 99.181.65.119.1935: Flags [.], seq 128739:130053, ack 0, win 501, options [nop,nop,TS val 2919487540 ecr 4261298192], length 1314
05:34:05.993670 IP 10.8.3.3.50932 > 99.181.65.119.1935: Flags [.], seq 130053:131367, ack 0, win 501, options [nop,nop,TS val 2919487573 ecr 4261298192], length 1314
05:34:06.038913 IP 99.181.65.119.1935 > 10.8.3.3.50932: Flags [.], ack 125807, win 126, options [nop,nop,TS val 4261298289 ecr 2919487339], length 0
05:34:06.058792 IP 10.8.3.3.50932 > 99.181.65.119.1935: Flags [.], seq 131367:132681, ack 0, win 501, options [nop,nop,TS val 2919487638 ecr 4261298289], length 1314
05:34:06.076653 IP 99.181.65.119.1935 > 10.8.3.3.50932: Flags [.], ack 127425, win 126, options [nop,nop,TS val 4261298327 ecr 2919487438], length 0
05:34:06.076687 IP 10.8.3.3.50932 > 99.181.65.119.1935: Flags [P.], seq 132681:133463, ack 0, win 501, options [nop,nop,TS val 2919487656 ecr 4261298327], length 782
05:34:06.126581 IP 10.8.3.3.50932 > 99.181.65.119.1935: Flags [.], seq 133463:134777, ack 0, win 501, options [nop,nop,TS val 2919487706 ecr 4261298327], length 1314
05:34:06.160227 IP 10.8.3.3.50932 > 99.181.65.119.1935: Flags [.], seq 134777:136091, ack 0, win 501, options [nop,nop,TS val 2919487740 ecr 4261298327], length 1314
05:34:06.174388 IP 99.181.65.119.1935 > 10.8.3.3.50932: Flags [.], ack 130053, win 126, options [nop,nop,TS val 4261298425 ecr 2919487507], length 0
05:34:06.191022 IP 10.8.3.3.50932 > 99.181.65.119.1935: Flags [.], seq 136091:137405, ack 0, win 501, options [nop,nop,TS val 2919487770 ecr 4261298425], length 1314
05:34:06.256527 IP 10.8.3.3.50932 > 99.181.65.119.1935: Flags [.], seq 137405:138719, ack 0, win 501, options [nop,nop,TS val 2919487836 ecr 4261298425], length 1314
05:34:06.272082 IP 99.181.65.119.1935 > 10.8.3.3.50932: Flags [.], ack 131367, win 126, options [nop,nop,TS val 4261298523 ecr 2919487573], length 0
05:34:06.290095 IP 99.181.65.119.1935 > 10.8.3.3.50932: Flags [.], ack 133463, win 126, options [nop,nop,TS val 4261298541 ecr 2919487638], length 0
05:34:06.290121 IP 10.8.3.3.50932 > 99.181.65.119.1935: Flags [P.], seq 138719:139500, ack 0, win 501, options [nop,nop,TS val 2919487869 ecr 4261298541], length 781
05:34:06.326370 IP 10.8.3.3.50932 > 99.181.65.119.1935: Flags [.], seq 139500:140814, ack 0, win 501, options [nop,nop,TS val 2919487906 ecr 4261298541], length 1314
05:34:06.360868 IP 10.8.3.3.50932 > 99.181.65.119.1935: Flags [.], seq 140814:142128, ack 0, win 501, options [nop,nop,TS val 2919487940 ecr 4261298541], length 1314
05:34:06.373863 IP 99.181.65.119.1935 > 10.8.3.3.50932: Flags [.], ack 136091, win 126, options [nop,nop,TS val 4261298624 ecr 2919487706], length 0
05:34:06.400659 IP 10.8.3.3.50932 > 99.181.65.119.1935: Flags [.], seq 142128:143442, ack 0, win 501, options [nop,nop,TS val 2919487980 ecr 4261298624], length 1314
05:34:06.460707 IP 10.8.3.3.50932 > 99.181.65.119.1935: Flags [.], seq 143442:144756, ack 0, win 501, options [nop,nop,TS val 2919488040 ecr 4261298624], length 1314
05:34:06.470099 IP 99.181.65.119.1935 > 10.8.3.3.50932: Flags [.], ack 138719, win 126, options [nop,nop,TS val 4261298721 ecr 2919487770], length 0
05:34:06.494022 IP 10.8.3.3.50932 > 99.181.65.119.1935: Flags [.], seq 144756:146070, ack 0, win 501, options [nop,nop,TS val 2919488073 ecr 4261298721], length 1314
05:34:06.503712 IP 99.181.65.119.1935 > 10.8.3.3.50932: Flags [.], ack 139500, win 126, options [nop,nop,TS val 4261298754 ecr 2919487869], length 0
05:34:06.503743 IP 10.8.3.3.50932 > 99.181.65.119.1935: Flags [P.], seq 146070:146372, ack 0, win 501, options [nop,nop,TS val 2919488083 ecr 4261298754], length 302
05:34:06.557964 IP 10.8.3.3.50932 > 99.181.65.119.1935: Flags [.], seq 146372:147686, ack 0, win 501, options [nop,nop,TS val 2919488137 ecr 4261298754], length 1314
05:34:06.574636 IP 99.181.65.119.1935 > 10.8.3.3.50932: Flags [.], ack 142128, win 126, options [nop,nop,TS val 4261298825 ecr 2919487906], length 0
05:34:06.592358 IP 10.8.3.3.50932 > 99.181.65.119.1935: Flags [.], seq 147686:149000, ack 0, win 501, options [nop,nop,TS val 2919488172 ecr 4261298825], length 1314
05:34:06.626601 IP 10.8.3.3.50932 > 99.181.65.119.1935: Flags [.], seq 149000:150314, ack 0, win 501, options [nop,nop,TS val 2919488206 ecr 4261298825], length 1314
05:34:06.674575 IP 99.181.65.119.1935 > 10.8.3.3.50932: Flags [.], ack 144756, win 126, options [nop,nop,TS val 4261298925 ecr 2919487980], length 0
05:34:06.692919 IP 10.8.3.3.50932 > 99.181.65.119.1935: Flags [.], seq 150314:151628, ack 0, win 501, options [nop,nop,TS val 2919488272 ecr 4261298925], length 1314
05:34:06.717241 IP 99.181.65.119.1935 > 10.8.3.3.50932: Flags [.], ack 146372, win 126, options [nop,nop,TS val 4261298968 ecr 2919488073], length 0
05:34:06.717272 IP 10.8.3.3.50932 > 99.181.65.119.1935: Flags [P.], seq 151628:152402, ack 0, win 501, options [nop,nop,TS val 2919488297 ecr 4261298968], length 774
05:34:06.759934 IP 10.8.3.3.50932 > 99.181.65.119.1935: Flags [.], seq 152402:153716, ack 0, win 501, options [nop,nop,TS val 2919488339 ecr 4261298968], length 1314
05:34:06.793050 IP 10.8.3.3.50932 > 99.181.65.119.1935: Flags [.], seq 153716:155030, ack 0, win 501, options [nop,nop,TS val 2919488372 ecr 4261298968], length 1314
05:34:06.806072 IP 99.181.65.119.1935 > 10.8.3.3.50932: Flags [.], ack 149000, win 126, options [nop,nop,TS val 4261299056 ecr 2919488137], length 0
05:34:06.828955 IP 10.8.3.3.50932 > 99.181.65.119.1935: Flags [.], seq 155030:156344, ack 0, win 501, options [nop,nop,TS val 2919488408 ecr 4261299056], length 1314
05:34:06.893263 IP 10.8.3.3.50932 > 99.181.65.119.1935: Flags [.], seq 156344:157658, ack 0, win 501, options [nop,nop,TS val 2919488473 ecr 4261299056], length 1314
05:34:06.906843 IP 99.181.65.119.1935 > 10.8.3.3.50932: Flags [.], ack 151628, win 126, options [nop,nop,TS val 4261299157 ecr 2919488206], length 0
05:34:06.926512 IP 10.8.3.3.50932 > 99.181.65.119.1935: Flags [.], seq 157658:158972, ack 0, win 501, options [nop,nop,TS val 2919488506 ecr 4261299157], length 1314
05:34:06.930899 IP 99.181.65.119.1935 > 10.8.3.3.50932: Flags [.], ack 152402, win 126, options [nop,nop,TS val 4261299181 ecr 2919488297], length 0
05:34:06.930928 IP 10.8.3.3.50932 > 99.181.65.119.1935: Flags [P.], seq 158972:159286, ack 0, win 501, options [nop,nop,TS val 2919488510 ecr 4261299181], length 314
05:34:06.990287 IP 10.8.3.3.50932 > 99.181.65.119.1935: Flags [.], seq 159286:160600, ack 0, win 501, options [nop,nop,TS val 2919488570 ecr 4261299181], length 1314
05:34:07.006622 IP 99.181.65.119.1935 > 10.8.3.3.50932: Flags [.], ack 155030, win 126, options [nop,nop,TS val 4261299257 ecr 2919488339], length 0
05:34:07.024485 IP 10.8.3.3.50932 > 99.181.65.119.1935: Flags [.], seq 160600:161914, ack 0, win 501, options [nop,nop,TS val 2919488604 ecr 4261299257], length 1314
05:34:07.059177 IP 10.8.3.3.50932 > 99.181.65.119.1935: Flags [.], seq 161914:163228, ack 0, win 501, options [nop,nop,TS val 2919488638 ecr 4261299257], length 1314
05:34:07.106883 IP 99.181.65.119.1935 > 10.8.3.3.50932: Flags [.], ack 157658, win 126, options [nop,nop,TS val 4261299357 ecr 2919488408], length 0
05:34:07.125690 IP 10.8.3.3.50932 > 99.181.65.119.1935: Flags [.], seq 163228:164542, ack 0, win 501, options [nop,nop,TS val 2919488705 ecr 4261299357], length 1314
05:34:07.145253 IP 99.181.65.119.1935 > 10.8.3.3.50932: Flags [.], ack 159286, win 126, options [nop,nop,TS val 4261299396 ecr 2919488506], length 0
05:34:07.145285 IP 10.8.3.3.50932 > 99.181.65.119.1935: Flags [P.], seq 164542:165323, ack 0, win 501, options [nop,nop,TS val 2919488725 ecr 4261299396], length 781
05:34:07.192328 IP 10.8.3.3.50932 > 99.181.65.119.1935: Flags [.], seq 165323:166637, ack 0, win 501, options [nop,nop,TS val 2919488772 ecr 4261299396], length 1314
05:34:07.225603 IP 10.8.3.3.50932 > 99.181.65.119.1935: Flags [.], seq 166637:167951, ack 0, win 501, options [nop,nop,TS val 2919488805 ecr 4261299396], length 1314
05:34:07.237819 IP 99.181.65.119.1935 > 10.8.3.3.50932: Flags [.], ack 161914, win 126, options [nop,nop,TS val 4261299489 ecr 2919488570], length 0
05:34:07.258942 IP 10.8.3.3.50932 > 99.181.65.119.1935: Flags [.], seq 167951:169265, ack 0, win 501, options [nop,nop,TS val 2919488838 ecr 4261299489], length 1314
05:34:07.322979 IP 10.8.3.3.50932 > 99.181.65.119.1935: Flags [.], seq 169265:170579, ack 0, win 501, options [nop,nop,TS val 2919488902 ecr 4261299489], length 1314
05:34:07.339196 IP 99.181.65.119.1935 > 10.8.3.3.50932: Flags [.], ack 164542, win 126, options [nop,nop,TS val 4261299590 ecr 2919488638], length 0
05:34:07.356744 IP 10.8.3.3.50932 > 99.181.65.119.1935: Flags [.], seq 170579:171893, ack 0, win 501, options [nop,nop,TS val 2919488936 ecr 4261299590], length 1314
05:34:07.358725 IP 99.181.65.119.1935 > 10.8.3.3.50932: Flags [.], ack 165323, win 126, options [nop,nop,TS val 4261299609 ecr 2919488725], length 0
05:34:07.358736 IP 10.8.3.3.50932 > 99.181.65.119.1935: Flags [P.], seq 171893:172197, ack 0, win 501, options [nop,nop,TS val 2919488938 ecr 4261299609], length 304
05:34:07.427230 IP 10.8.3.3.50932 > 99.181.65.119.1935: Flags [.], seq 172197:173511, ack 0, win 501, options [nop,nop,TS val 2919489007 ecr 4261299609], length 1314
05:34:07.439243 IP 99.181.65.119.1935 > 10.8.3.3.50932: Flags [.], ack 167951, win 126, options [nop,nop,TS val 4261299690 ecr 2919488772], length 0
05:34:07.460695 IP 10.8.3.3.50932 > 99.181.65.119.1935: Flags [.], seq 173511:174825, ack 0, win 501, options [nop,nop,TS val 2919489040 ecr 4261299690], length 1314
05:34:07.491591 IP 10.8.3.3.50932 > 99.181.65.119.1935: Flags [.], seq 174825:176139, ack 0, win 501, options [nop,nop,TS val 2919489071 ecr 4261299690], length 1314
05:34:07.536562 IP 99.181.65.119.1935 > 10.8.3.3.50932: Flags [.], ack 170579, win 126, options [nop,nop,TS val 4261299787 ecr 2919488838], length 0
05:34:07.557647 IP 10.8.3.3.50932 > 99.181.65.119.1935: Flags [.], seq 176139:177453, ack 0, win 501, options [nop,nop,TS val 2919489137 ecr 4261299787], length 1314
05:34:07.572228 IP 99.181.65.119.1935 > 10.8.3.3.50932: Flags [.], ack 172197, win 126, options [nop,nop,TS val 4261299823 ecr 2919488936], length 0
05:34:07.572260 IP 10.8.3.3.50932 > 99.181.65.119.1935: Flags [P.], seq 177453:178230, ack 0, win 501, options [nop,nop,TS val 2919489152 ecr 4261299823], length 777
05:34:07.627132 IP 10.8.3.3.50932 > 99.181.65.119.1935: Flags [.], seq 178230:179544, ack 0, win 501, options [nop,nop,TS val 2919489206 ecr 4261299823], length 1314
05:34:07.657568 IP 10.8.3.3.50932 > 99.181.65.119.1935: Flags [.], seq 179544:180858, ack 0, win 501, options [nop,nop,TS val 2919489237 ecr 4261299823], length 1314
05:34:07.674185 IP 99.181.65.119.1935 > 10.8.3.3.50932: Flags [.], ack 174825, win 126, options [nop,nop,TS val 4261299925 ecr 2919489007], length 0
05:34:07.693624 IP 10.8.3.3.50932 > 99.181.65.119.1935: Flags [.], seq 180858:182172, ack 0, win 501, options [nop,nop,TS val 2919489273 ecr 4261299925], length 1314
05:34:07.757786 IP 10.8.3.3.50932 > 99.181.65.119.1935: Flags [.], seq 182172:183486, ack 0, win 501, options [nop,nop,TS val 2919489337 ecr 4261299925], length 1314
05:34:07.771055 IP 99.181.65.119.1935 > 10.8.3.3.50932: Flags [.], ack 177453, win 126, options [nop,nop,TS val 4261300022 ecr 2919489071], length 0
05:34:07.786056 IP 99.181.65.119.1935 > 10.8.3.3.50932: Flags [.], ack 178230, win 126, options [nop,nop,TS val 4261300037 ecr 2919489152], length 0
05:34:07.786132 IP 10.8.3.3.50932 > 99.181.65.119.1935: Flags [P.], seq 183486:184267, ack 0, win 501, options [nop,nop,TS val 2919489365 ecr 4261300037], length 781
05:34:07.827246 IP 10.8.3.3.50932 > 99.181.65.119.1935: Flags [.], seq 184267:185581, ack 0, win 501, options [nop,nop,TS val 2919489407 ecr 4261300037], length 1314
05:34:07.860599 IP 10.8.3.3.50932 > 99.181.65.119.1935: Flags [.], seq 185581:186895, ack 0, win 501, options [nop,nop,TS val 2919489440 ecr 4261300037], length 1314
05:34:07.871048 IP 99.181.65.119.1935 > 10.8.3.3.50932: Flags [.], ack 180858, win 126, options [nop,nop,TS val 4261300122 ecr 2919489206], length 0
05:34:07.896158 IP 10.8.3.3.50932 > 99.181.65.119.1935: Flags [.], seq 186895:188209, ack 0, win 501, options [nop,nop,TS val 2919489475 ecr 4261300122], length 1314
05:34:07.960208 IP 10.8.3.3.50932 > 99.181.65.119.1935: Flags [.], seq 188209:189523, ack 0, win 501, options [nop,nop,TS val 2919489540 ecr 4261300122], length 1314
05:34:07.967991 IP 99.181.65.119.1935 > 10.8.3.3.50932: Flags [.], ack 182172, win 126, options [nop,nop,TS val 4261300219 ecr 2919489273], length 0
05:34:07.989711 IP 10.8.3.3.50932 > 99.181.65.119.1935: Flags [.], seq 189523:190837, ack 0, win 501, options [nop,nop,TS val 2919489569 ecr 4261300219], length 1314
05:34:07.999807 IP 99.181.65.119.1935 > 10.8.3.3.50932: Flags [.], ack 184267, win 126, options [nop,nop,TS val 4261300250 ecr 2919489337], length 0
05:34:07.999820 IP 10.8.3.3.50932 > 99.181.65.119.1935: Flags [P.], seq 190837:191149, ack 0, win 501, options [nop,nop,TS val 2919489579 ecr 4261300250], length 312
05:34:08.057868 IP 10.8.3.3.50932 > 99.181.65.119.1935: Flags [.], seq 191149:192463, ack 0, win 501, options [nop,nop,TS val 2919489637 ecr 4261300250], length 1314
05:34:08.074667 IP 99.181.65.119.1935 > 10.8.3.3.50932: Flags [.], ack 186895, win 126, options [nop,nop,TS val 4261300325 ecr 2919489407], length 0
05:34:08.093906 IP 10.8.3.3.50932 > 99.181.65.119.1935: Flags [.], seq 192463:193777, ack 0, win 501, options [nop,nop,TS val 2919489673 ecr 4261300325], length 1314
05:34:08.127002 IP 10.8.3.3.50932 > 99.181.65.119.1935: Flags [.], seq 193777:195091, ack 0, win 501, options [nop,nop,TS val 2919489706 ecr 4261300325], length 1314
