05:25:51.955272 IP 10.8.2.16.37364 > 103.53.48.70.1935: Flags [.], seq 1662824236:1662825550, ack 1345799977, win 501, options [nop,nop,TS val 1037258116 ecr 3516151853], length 1314
05:25:51.970387 IP 103.53.48.70.1935 > 10.8.2.16.37364: Flags [.], ack 4294952589, win 172, options [nop,nop,TS val 3516151941 ecr 1037257519], length 0
05:25:51.997705 IP 10.8.2.16.37364 > 103.53.48.70.1935: Flags [.], seq 1314:2628, ack 1, win 501, options [nop,nop,TS val 1037258158 ecr 3516151941], length 1314
05:25:52.033609 IP 10.8.2.16.37364 > 103.53.48.70.1935: Flags [.], seq 2628:3942, ack 1, win 501, options [nop,nop,TS val 1037258194 ecr 3516151941], length 1314
05:25:52.034704 IP 103.53.48.70.1935 > 10.8.2.16.37364: Flags [.], ack 4294955217, win 172, options [nop,nop,TS val 3516152005 ecr 1037257626], length 0
05:25:52.101558 IP 10.8.2.16.37364 > 103.53.48.70.1935: Flags [.], seq 3942:5256, ack 1, win 501, options [nop,nop,TS val 1037258262 ecr 3516152005], length 1314
05:25:52.126112 IP 10.8.2.16.37364 > 103.53.48.70.1935: Flags [.], seq 5256:6570, ack 1, win 501, options [nop,nop,TS val 1037258287 ecr 3516152005], length 1314
05:25:52.141860 IP 103.53.48.70.1935 > 10.8.2.16.37364: Flags [.], ack 4294957845, win 172, options [nop,nop,TS val 3516152113 ecr 1037257729], length 0
05:25:52.164806 IP 10.8.2.16.37364 > 103.53.48.70.1935: Flags [.], seq 6570:7884, ack 1, win 501, options [nop,nop,TS val 1037258326 ecr 3516152113], length 1314
05:25:52.233145 IP 10.8.2.16.37364 > 103.53.48.70.1935: Flags [.], seq 7884:9198, ack 1, win 501, options [nop,nop,TS val 1037258394 ecr 3516152113], length 1314
05:25:52.245488 IP 103.53.48.70.1935 > 10.8.2.16.37364: Flags [.], ack 4294960473, win 172, options [nop,nop,TS val 3516152216 ecr 1037257793], length 0
05:25:52.254628 IP 10.8.2.16.37364 > 103.53.48.70.1935: Flags [.], seq 9198:10512, ack 1, win 501, options [nop,nop,TS val 1037258415 ecr 3516152216], length 1314
05:25:52.297449 IP 10.8.2.16.37364 > 103.53.48.70.1935: Flags [.], seq 10512:11826, ack 1, win 501, options [nop,nop,TS val 1037258458 ecr 3516152216], length 1314
05:25:52.311695 IP 103.53.48.70.1935 > 10.8.2.16.37364: Flags [.], ack 4294963101, win 172, options [nop,nop,TS val 3516152283 ecr 1037257882], length 0
05:25:52.326062 IP 103.53.48.70.1935 > 10.8.2.16.37364: Flags [.], ack 4294963354, win 173, options [nop,nop,TS val 3516152297 ecr 1037257939], length 0
05:25:52.326079 IP 10.8.2.16.37364 > 103.53.48.70.1935: Flags [P.], seq 11826:12841, ack 1, win 501, options [nop,nop,TS val 1037258487 ecr 3516152297], length 1015
05:25:52.401151 IP 10.8.2.16.37364 > 103.53.48.70.1935: Flags [.], seq 12841:14155, ack 1, win 501, options [nop,nop,TS val 1037258562 ecr 3516152297], length 1314
05:25:52.412321 IP 103.53.48.70.1935 > 10.8.2.16.37364: Flags [.], ack 4294965982, win 172, options [nop,nop,TS val 3516152383 ecr 1037257989], length 0
05:25:52.425296 IP 10.8.2.16.37364 > 103.53.48.70.1935: Flags [.], seq 14155:15469, ack 1, win 501, options [nop,nop,TS val 1037258586 ecr 3516152383], length 1314
05:25:52.464166 IP 10.8.2.16.37364 > 103.53.48.70.1935: Flags [.], seq 15469:16783, ack 1, win 501, options [nop,nop,TS val 1037258625 ecr 3516152383], length 1314
05:25:52.503370 IP 103.53.48.70.1935 > 10.8.2.16.37364: Flags [.], ack 1314, win 172, options [nop,nop,TS val 3516152474 ecr 1037258059], length 0
05:25:52.531242 IP 10.8.2.16.37364 > 103.53.48.70.1935: Flags [.], seq 16783:18097, ack 1, win 501, options [nop,nop,TS val 1037258692 ecr 3516152474], length 1314
05:25:52.552437 IP 10.8.2.16.37364 > 103.53.48.70.1935: Flags [.], seq 18097:19411, ack 1, win 501, options [nop,nop,TS val 1037258713 ecr 3516152474], length 1314
05:25:52.581798 IP 103.53.48.70.1935 > 10.8.2.16.37364: Flags [.], ack 3942, win 172, options [nop,nop,TS val 3516152552 ecr 1037258158], length 0
05:25:52.594883 IP 10.8.2.16.37364 > 103.53.48.70.1935: Flags [.], seq 19411:20725, ack 1, win 501, options [nop,nop,TS val 1037258756 ecr 3516152552], length 1314
05:25:52.658587 IP 10.8.2.16.37364 > 103.53.48.70.1935: Flags [.], seq 20725:22039, ack 1, win 501, options [nop,nop,TS val 1037258819 ecr 3516152552], length 1314
05:25:52.674309 IP 103.53.48.70.1935 > 10.8.2.16.37364: Flags [.], ack 6570, win 172, options [nop,nop,TS val 3516152645 ecr 1037258262], length 0
05:25:52.698113 IP 10.8.2.16.37364 > 103.53.48.70.1935: Flags [.], seq 22039:23353, ack 1, win 501, options [nop,nop,TS val 1037258859 ecr 3516152645], length 1314
05:25:52.722515 IP 10.8.2.16.37364 > 103.53.48.70.1935: Flags [.], seq 23353:24667, ack 1, win 501, options [nop,nop,TS val 1037258883 ecr 3516152645], length 1314
05:25:52.781722 IP 103.53.48.70.1935 > 10.8.2.16.37364: Flags [.], ack 9198, win 172, options [nop,nop,TS val 3516152752 ecr 1037258326], length 0
05:25:52.787017 IP 10.8.2.16.37364 > 103.53.48.70.1935: Flags [.], seq 24667:25981, ack 1, win 501, options [nop,nop,TS val 1037258948 ecr 3516152752], length 1314
05:25:52.829932 IP 10.8.2.16.37364 > 103.53.48.70.1935: Flags [.], seq 25981:27295, ack 1, win 501, options [nop,nop,TS val 1037258991 ecr 3516152752], length 1314
05:25:52.845780 IP 103.53.48.70.1935 > 10.8.2.16.37364: Flags [.], ack 11826, win 172, options [nop,nop,TS val 3516152816 ecr 1037258415], length 0
05:25:52.851250 IP 10.8.2.16.37364 > 103.53.48.70.1935: Flags [.], seq 27295:28609, ack 1, win 501, options [nop,nop,TS val 1037259012 ecr 3516152816], length 1314
05:25:52.874134 IP 103.53.48.70.1935 > 10.8.2.16.37364: Flags [.], ack 12841, win 173, options [nop,nop,TS val 3516152845 ecr 1037258487], length 0
05:25:52.874181 IP 10.8.2.16.37364 > 103.53.48.70.1935: Flags [P.], seq 28609:28957, ack 1, win 501, options [nop,nop,TS val 1037259035 ecr 3516152845], length 348
05:25:52.934473 IP 10.8.2.16.37364 > 103.53.48.70.1935: Flags [.], seq 28957:30271, ack 1, win 501, options [nop,nop,TS val 1037259095 ecr 3516152845], length 1314
05:25:52.958307 IP 10.8.2.16.37364 > 103.53.48.70.1935: Flags [.], seq 30271:31585, ack 1, win 501, options [nop,nop,TS val 1037259119 ecr 3516152845], length 1314
05:25:52.973527 IP 103.53.48.70.1935 > 10.8.2.16.37364: Flags [.], ack 15469, win 173, options [nop,nop,TS val 3516152944 ecr 1037258562], length 0
05:25:53.000835 IP 10.8.2.16.37364 > 103.53.48.70.1935: Flags [.], seq 31585:32899, ack 1, win 501, options [nop,nop,TS val 1037259162 ecr 3516152944], length 1314
05:25:53.065480 IP 10.8.2.16.37364 > 103.53.48.70.1935: Flags [.], seq 32899:34213, ack 1, win 501, options [nop,nop,TS val 1037259226 ecr 3516152944], length 1314
05:25:53.079361 IP 103.53.48.70.1935 > 10.8.2.16.37364: Flags [.], ack 18097, win 172, options [nop,nop,TS val 3516153050 ecr 1037258625], length 0
05:25:53.086902 IP 10.8.2.16.37364 > 103.53.48.70.1935: Flags [.], seq 34213:35527, ack 1, win 501, options [nop,nop,TS val 1037259248 ecr 3516153050], length 1314
05:25:53.133906 IP 10.8.2.16.37364 > 103.53.48.70.1935: Flags [.], seq 35527:36841, ack 1, win 501, options [nop,nop,TS val 1037259295 ecr 3516153050], length 1314
05:25:53.142878 IP 103.53.48.70.1935 > 10.8.2.16.37364: Flags [.], ack 20725, win 172, options [nop,nop,TS val 3516153114 ecr 1037258713], length 0
05:25:53.193579 IP 10.8.2.16.37364 > 103.53.48.70.1935: Flags [.], seq 36841:38155, ack 1, win 501, options [nop,nop,TS val 1037259354 ecr 3516153114], length 1314
05:25:53.230742 IP 10.8.2.16.37364 > 103.53.48.70.1935: Flags [.], seq 38155:39469, ack 1, win 501, options [nop,nop,TS val 1037259391 ecr 3516153114], length 1314
05:25:53.246498 IP 103.53.48.70.1935 > 10.8.2.16.37364: Flags [.], ack 23353, win 172, options [nop,nop,TS val 3516153217 ecr 1037258819], length 0
05:25:53.266131 IP 10.8.2.16.37364 > 103.53.48.70.1935: Flags [.], seq 39469:40783, ack 1, win 501, options [nop,nop,TS val 1037259427 ecr 3516153217], length 1314
05:25:53.321617 IP 10.8.2.16.37364 > 103.53.48.70.1935: Flags [.], seq 40783:42097, ack 1, win 501, options [nop,nop,TS val 1037259482 ecr 3516153217], length 1314
05:25:53.335347 IP 103.53.48.70.1935 > 10.8.2.16.37364: Flags [.], ack 25981, win 172, options [nop,nop,TS val 3516153306 ecr 1037258883], length 0
05:25:53.364550 IP 10.8.2.16.37364 > 103.53.48.70.1935: Flags [.], seq 42097:43411, ack 1, win 501, options [nop,nop,TS val 1037259525 ecr 3516153306], length 1314
05:25:53.399619 IP 103.53.48.70.1935 > 10.8.2.16.37364: Flags [.], ack 28609, win 172, options [nop,nop,TS val 3516153370 ecr 1037258991], length 0
05:25:53.400702 IP 10.8.2.16.37364 > 103.53.48.70.1935: Flags [.], seq 43411:44725, ack 1, win 501, options [nop,nop,TS val 1037259561 ecr 3516153370], length 1314
05:25:53.422375 IP 103.53.48.70.1935 > 10.8.2.16.37364: Flags [.], ack 28957, win 173, options [nop,nop,TS val 3516153393 ecr 1037259035], length 0
05:25:53.422414 IP 10.8.2.16.37364 > 103.53.48.70.1935: Flags [P.], seq 44725:44878, ack 1, win 501, options [nop,nop,TS val 1037259583 ecr 3516153393], length 153
05:25:53.468133 IP 10.8.2.16.37364 > 103.53.48.70.1935: Flags [.], seq 44878:46192, ack 1, win 501, options [nop,nop,TS val 1037259629 ecr 3516153393], length 1314
05:25:53.492684 IP 10.8.2.16.37364 > 103.53.48.70.1935: Flags [.], seq 46192:47506, ack 1, win 501, options [nop,nop,TS val 1037259653 ecr 3516153393], length 1314
05:25:53.506563 IP 103.53.48.70.1935 > 10.8.2.16.37364: Flags [.], ack 31585, win 173, options [nop,nop,TS val 3516153477 ecr 1037259095], length 0
05:25:53.535307 IP 10.8.2.16.37364 > 103.53.48.70.1935: Flags [.], seq 47506:48820, ack 1, win 501, options [nop,nop,TS val 1037259696 ecr 3516153477], length 1314
05:25:53.600007 IP 10.8.2.16.37364 > 103.53.48.70.1935: Flags [.], seq 48820:50134, ack 1, win 501, options [nop,nop,TS val 1037259761 ecr 3516153477], length 1314
05:25:53.613952 IP 103.53.48.70.1935 > 10.8.2.16.37364: Flags [.], ack 34213, win 172, options [nop,nop,TS val 3516153584 ecr 1037259162], length 0
05:25:53.621420 IP 10.8.2.16.37364 > 103.53.48.70.1935: Flags [.], seq 50134:51448, ack 1, win 501, options [nop,nop,TS val 1037259782 ecr 3516153584], length 1314
05:25:53.666472 IP 10.8.2.16.37364 > 103.53.48.70.1935: Flags [.], seq 51448:52762, ack 1, win 501, options [nop,nop,TS val 1037259827 ecr 3516153584], length 1314
05:25:53.682332 IP 103.53.48.70.1935 > 10.8.2.16.37364: Flags [.], ack 36841, win 172, options [nop,nop,TS val 3516153653 ecr 1037259248], length 0
05:25:53.728635 IP 10.8.2.16.37364 > 103.53.48.70.1935: Flags [.], seq 52762:54076, ack 1, win 501, options [nop,nop,TS val 1037259889 ecr 3516153653], length 1314
05:25:53.766737 IP 10.8.2.16.37364 > 103.53.48.70.1935: Flags [.], seq 54076:55390, ack 1, win 501, options [nop,nop,TS val 1037259927 ecr 3516153653], length 1314
05:25:53.778723 IP 103.53.48.70.1935 > 10.8.2.16.37364: Flags [.], ack 39469, win 172, options [nop,nop,TS val 3516153750 ecr 1037259354], length 0
05:25:53.797858 IP 10.8.2.16.37364 > 103.53.48.70.1935: Flags [.], seq 55390:56704, ack 1, win 501, options [nop,nop,TS val 1037259959 ecr 3516153750], length 1314
05:25:53.857055 IP 10.8.2.16.37364 > 103.53.48.70.1935: Flags [.], seq 56704:58018, ack 1, win 501, options [nop,nop,TS val 1037260018 ecr 3516153750], length 1314
05:25:53.870414 IP 103.53.48.70.1935 > 10.8.2.16.37364: Flags [.], ack 42097, win 172, options [nop,nop,TS val 3516153841 ecr 1037259427], length 0
05:25:53.899806 IP 10.8.2.16.37364 > 103.53.48.70.1935: Flags [.], seq 58018:59332, ack 1, win 501, options [nop,nop,TS val 1037260061 ecr 3516153841], length 1314
05:25:53.934002 IP 10.8.2.16.37364 > 103.53.48.70.1935: Flags [.], seq 59332:60646, ack 1, win 501, options [nop,nop,TS val 1037260095 ecr 3516153841], length 1314
05:25:53.948858 IP 103.53.48.70.1935 > 10.8.2.16.37364: Flags [.], ack 44725, win 172, options [nop,nop,TS val 3516153920 ecr 1037259525], length 0
05:25:53.970418 IP 103.53.48.70.1935 > 10.8.2.16.37364: Flags [.], ack 44878, win 174, options [nop,nop,TS val 3516153941 ecr 1037259583], length 0
05:25:53.970458 IP 10.8.2.16.37364 > 103.53.48.70.1935: Flags [P.], seq 60646:61762, ack 1, win 501, options [nop,nop,TS val 1037260131 ecr 3516153941], length 1116
05:25:54.028574 IP 10.8.2.16.37364 > 103.53.48.70.1935: Flags [.], seq 61762:63076, ack 1, win 501, options [nop,nop,TS val 1037260189 ecr 3516153941], length 1314
05:25:54.040975 IP 103.53.48.70.1935 > 10.8.2.16.37364: Flags [.], ack 47506, win 174, options [nop,nop,TS val 3516154012 ecr 1037259629], length 0
05:25:54.066469 IP 10.8.2.16.37364 > 103.53.48.70.1935: Flags [.], seq 63076:64390, ack 1, win 501, options [nop,nop,TS val 1037260227 ecr 3516154012], length 1314
05:25:54.101296 IP 10.8.2.16.37364 > 103.53.48.70.1935: Flags [.], seq 64390:65704, ack 1, win 501, options [nop,nop,TS val 1037260262 ecr 3516154012], length 1314
05:25:54.130591 IP 103.53.48.70.1935 > 10.8.2.16.37364: Flags [.], ack 48820, win 174, options [nop,nop,TS val 3516154101 ecr 1037259696], length 0
05:25:54.156834 IP 10.8.2.16.37364 > 103.53.48.70.1935: Flags [.], seq 65704:67018, ack 1, win 501, options [nop,nop,TS val 1037260318 ecr 3516154101], length 1314
05:25:54.169811 IP 103.53.48.70.1935 > 10.8.2.16.37364: Flags [.], ack 51448, win 174, options [nop,nop,TS val 3516154140 ecr 1037259761], length 0
05:25:54.199624 IP 10.8.2.16.37364 > 103.53.48.70.1935: Flags [.], seq 67018:68332, ack 1, win 501, options [nop,nop,TS val 1037260360 ecr 3516154140], length 1314
05:25:54.235052 IP 10.8.2.16.37364 > 103.53.48.70.1935: Flags [.], seq 68332:69646, ack 1, win 501, options [nop,nop,TS val 1037260396 ecr 3516154140], length 1314
05:25:54.276777 IP 103.53.48.70.1935 > 10.8.2.16.37364: Flags [.], ack 54076, win 172, options [nop,nop,TS val 3516154248 ecr 1037259827], length 0
05:25:54.301252 IP 10.8.2.16.37364 > 103.53.48.70.1935: Flags [.], seq 69646:70960, ack 1, win 501, options [nop,nop,TS val 1037260462 ecr 3516154248], length 1314
05:25:54.328619 IP 10.8.2.16.37364 > 103.53.48.70.1935: Flags [.], seq 70960:72274, ack 1, win 501, options [nop,nop,TS val 1037260489 ecr 3516154248], length 1314
05:25:54.346193 IP 103.53.48.70.1935 > 10.8.2.16.37364: Flags [.], ack 56704, win 172, options [nop,nop,TS val 3516154317 ecr 1037259927], length 0
05:25:54.368170 IP 10.8.2.16.37364 > 103.53.48.70.1935: Flags [.], seq 72274:73588, ack 1, win 501, options [nop,nop,TS val 1037260529 ecr 3516154317], length 1314
05:25:54.434847 IP 10.8.2.16.37364 > 103.53.48.70.1935: Flags [.], seq 73588:74902, ack 1, win 501, options [nop,nop,TS val 1037260596 ecr 3516154317], length 1314
05:25:54.447985 IP 103.53.48.70.1935 > 10.8.2.16.37364: Flags [.], ack 59332, win 172, options [nop,nop,TS val 3516154419 ecr 1037260018], length 0
05:25:54.457540 IP 10.8.2.16.37364 > 103.53.48.70.1935: Flags [.], seq 74902:76216, ack 1, win 501, options [nop,nop,TS val 1037260618 ecr 3516154419], length 1314
05:25:54.499371 IP 10.8.2.16.37364 > 103.53.48.70.1935: Flags [.], seq 76216:77530, ack 1, win 501, options [nop,nop,TS val 1037260660 ecr 3516154419], length 1314
05:25:54.518766 IP 103.53.48.70.1935 > 10.8.2.16.37364: Flags [.], ack 61762, win 173, options [nop,nop,TS val 3516154489 ecr 1037260095], length 0
05:25:54.518779 IP 10.8.2.16.37364 > 103.53.48.70.1935: Flags [P.], seq 77530:77686, ack 1, win 501, options [nop,nop,TS val 1037260679 ecr 3516154489], length 156
05:25:54.564042 IP 10.8.2.16.37364 > 103.53.48.70.1935: Flags [.], seq 77686:79000, ack 1, win 501, options [nop,nop,TS val 1037260725 ecr 3516154489], length 1314
05:25:54.599507 IP 10.8.2.16.37364 > 103.53.48.70.1935: Flags [.], seq 79000:80314, ack 1, win 501, options [nop,nop,TS val 1037260760 ecr 3516154489], length 1314
05:25:54.614683 IP 103.53.48.70.1935 > 10.8.2.16.37364: Flags [.], ack 64390, win 174, options [nop,nop,TS val 3516154585 ecr 1037260189], length 0
05:25:54.635088 IP 10.8.2.16.37364 > 103.53.48.70.1935: Flags [.], seq 80314:81628, ack 1, win 501, options [nop,nop,TS val 1037260796 ecr 3516154585], length 1314
05:25:54.691771 IP 10.8.2.16.37364 > 103.53.48.70.1935: Flags [.], seq 81628:82942, ack 1, win 501, options [nop,nop,TS val 1037260852 ecr 3516154585], length 1314
05:25:54.704915 IP 103.53.48.70.1935 > 10.8.2.16.37364: Flags [.], ack 67018, win 172, options [nop,nop,TS val 3516154676 ecr 1037260262], length 0
05:25:54.734674 IP 10.8.2.16.37364 > 103.53.48.70.1935: Flags [.], seq 82942:84256, ack 1, win 501, options [nop,nop,TS val 1037260895 ecr 3516154676], length 1314
05:25:54.768603 IP 10.8.2.16.37364 > 103.53.48.70.1935: Flags [.], seq 84256:85570, ack 1, win 501, options [nop,nop,TS val 1037260929 ecr 3516154676], length 1314
05:25:54.783381 IP 103.53.48.70.1935 > 10.8.2.16.37364: Flags [.], ack 69646, win 172, options [nop,nop,TS val 3516154754 ecr 1037260360], length 0
05:25:54.834932 IP 10.8.2.16.37364 > 103.53.48.70.1935: Flags [.], seq 85570:86884, ack 1, win 501, options [nop,nop,TS val 1037260996 ecr 3516154754], length 1314
05:25:54.863703 IP 10.8.2.16.37364 > 103.53.48.70.1935: Flags [.], seq 86884:88198, ack 1, win 501, options [nop,nop,TS val 1037261024 ecr 3516154754], length 1314
05:25:54.876868 IP 103.53.48.70.1935 > 10.8.2.16.37364: Flags [.], ack 72274, win 172, options [nop,nop,TS val 3516154847 ecr 1037260462], length 0
05:25:54.901850 IP 10.8.2.16.37364 > 103.53.48.70.1935: Flags [.], seq 88198:89512, ack 1, win 501, options [nop,nop,TS val 1037261063 ecr 3516154847], length 1314
05:25:54.966623 IP 10.8.2.16.37364 > 103.53.48.70.1935: Flags [.], seq 89512:90826, ack 1, win 501, options [nop,nop,TS val 1037261127 ecr 3516154847], length 1314
05:25:54.983258 IP 103.53.48.70.1935 > 10.8.2.16.37364: Flags [.], ack 74902, win 172, options [nop,nop,TS val 3516154954 ecr 1037260529], length 0
05:25:54.992241 IP 10.8.2.16.37364 > 103.53.48.70.1935: Flags [.], seq 90826:92140, ack 1, win 501, options [nop,nop,TS val 1037261153 ecr 3516154954], length 1314
05:25:55.034585 IP 10.8.2.16.37364 > 103.53.48.70.1935: Flags [.], seq 92140:93454, ack 1, win 501, options [nop,nop,TS val 1037261195 ecr 3516154954], length 1314
05:25:55.047563 IP 103.53.48.70.1935 > 10.8.2.16.37364: Flags [.], ack 77530, win 172, options [nop,nop,TS val 3516155018 ecr 1037260618], length 0
05:25:55.067127 IP 103.53.48.70.1935 > 10.8.2.16.37364: Flags [.], ack 77686, win 174, options [nop,nop,TS val 3516155038 ecr 1037260679], length 0
05:25:55.067144 IP 10.8.2.16.37364 > 103.53.48.70.1935: Flags [P.], seq 93454:94551, ack 1, win 501, options [nop,nop,TS val 1037261228 ecr 3516155038], length 1097
05:25:55.132644 IP 10.8.2.16.37364 > 103.53.48.70.1935: Flags [.], seq 94551:95865, ack 1, win 501, options [nop,nop,TS val 1037261293 ecr 3516155038], length 1314
05:25:55.147870 IP 103.53.48.70.1935 > 10.8.2.16.37364: Flags [.], ack 80314, win 174, options [nop,nop,TS val 3516155118 ecr 1037260725], length 0
05:25:55.162737 IP 10.8.2.16.37364 > 103.53.48.70.1935: Flags [.], seq 95865:97179, ack 1, win 501, options [nop,nop,TS val 1037261323 ecr 3516155118], length 1314
05:25:55.201651 IP 10.8.2.16.37364 > 103.53.48.70.1935: Flags [.], seq 97179:98493, ack 1, win 501, options [nop,nop,TS val 1037261362 ecr 3516155118], length 1314
05:25:55.240240 IP 103.53.48.70.1935 > 10.8.2.16.37364: Flags [.], ack 82942, win 172, options [nop,nop,TS val 3516155211 ecr 1037260796], length 0
05:25:55.268170 IP 10.8.2.16.37364 > 103.53.48.70.1935: Flags [.], seq 98493:99807, ack 1, win 501, options [nop,nop,TS val 1037261429 ecr 3516155211], length 1314
05:25:55.299151 IP 10.8.2.16.37364 > 103.53.48.70.1935: Flags [.], seq 99807:101121, ack 1, win 501, options [nop,nop,TS val 1037261460 ecr 3516155211], length 1314
05:25:55.317034 IP 103.53.48.70.1935 > 10.8.2.16.37364: Flags [.], ack 85570, win 172, options [nop,nop,TS val 3516155288 ecr 1037260895], length 0
05:25:55.330721 IP 10.8.2.16.37364 > 103.53.48.70.1935: Flags [.], seq 101121:102435, ack 1, win 501, options [nop,nop,TS val 1037261491 ecr 3516155288], length 1314
05:25:55.397806 IP 10.8.2.16.37364 > 103.53.48.70.1935: Flags [.], seq 102435:103749, ack 1, win 501, options [nop,nop,TS val 1037261558 ecr 3516155288], length 1314
05:25:55.411845 IP 103.53.48.70.1935 > 10.8.2.16.37364: Flags [.], ack 88198, win 172, options [nop,nop,TS val 3516155383 ecr 1037260996], length 0
05:25:55.436019 IP 10.8.2.16.37364 > 103.53.48.70.1935: Flags [.], seq 103749:105063, ack 1, win 501, options [nop,nop,TS val 1037261597 ecr 3516155383], length 1314
05:25:55.462200 IP 10.8.2.16.37364 > 103.53.48.70.1935: Flags [.], seq 105063:106377, ack 1, win 501, options [nop,nop,TS val 1037261623 ecr 3516155383], length 1314
05:25:55.514830 IP 103.53.48.70.1935 > 10.8.2.16.37364: Flags [.], ack 90826, win 172, options [nop,nop,TS val 3516155485 ecr 1037261063], length 0
05:25:55.526007 IP 10.8.2.16.37364 > 103.53.48.70.1935: Flags [.], seq 106377:107691, ack 1, win 501, options [nop,nop,TS val 1037261687 ecr 3516155485], length 1314
05:25:55.567457 IP 10.8.2.16.37364 > 103.53.48.70.1935: Flags [.], seq 107691:109005, ack 1, win 501, options [nop,nop,TS val 1037261728 ecr 3516155485], length 1314
05:25:55.583214 IP 103.53.48.70.1935 > 10.8.2.16.37364: Flags [.], ack 93454, win 172, options [nop,nop,TS val 3516155554 ecr 1037261153], length 0
05:25:55.601298 IP 10.8.2.16.37364 > 103.53.48.70.1935: Flags [.], seq 109005:110319, ack 1, win 501, options [nop,nop,TS val 1037261762 ecr 3516155554], length 1314
05:25:55.615431 IP 103.53.48.70.1935 > 10.8.2.16.37364: Flags [.], ack 94551, win 174, options [nop,nop,TS val 3516155586 ecr 1037261228], length 0
05:25:55.615473 IP 10.8.2.16.37364 > 103.53.48.70.1935: Flags [P.], seq 110319:110583, ack 1, win 501, options [nop,nop,TS val 1037261776 ecr 3516155586], length 264
05:25:55.666640 IP 10.8.2.16.37364 > 103.53.48.70.1935: Flags [.], seq 110583:111897, ack 1, win 501, options [nop,nop,TS val 1037261827 ecr 3516155586], length 1314
05:25:55.697340 IP 10.8.2.16.37364 > 103.53.48.70.1935: Flags [.], seq 111897:113211, ack 1, win 501, options [nop,nop,TS val 1037261858 ecr 3516155586], length 1314
05:25:55.710982 IP 103.53.48.70.1935 > 10.8.2.16.37364: Flags [.], ack 97179, win 174, options [nop,nop,TS val 3516155682 ecr 1037261293], length 0
05:25:55.739667 IP 10.8.2.16.37364 > 103.53.48.70.1935: Flags [.], seq 113211:114525, ack 1, win 501, options [nop,nop,TS val 1037261900 ecr 3516155682], length 1314
05:25:55.801164 IP 10.8.2.16.37364 > 103.53.48.70.1935: Flags [.], seq 114525:115839, ack 1, win 501, options [nop,nop,TS val 1037261962 ecr 3516155682], length 1314
05:25:55.816870 IP 103.53.48.70.1935 > 10.8.2.16.37364: Flags [.], ack 99807, win 172, options [nop,nop,TS val 3516155788 ecr 1037261362], length 0
05:25:55.835003 IP 10.8.2.16.37364 > 103.53.48.70.1935: Flags [.], seq 115839:117153, ack 1, win 501, options [nop,nop,TS val 1037261996 ecr 3516155788], length 1314
05:25:55.868246 IP 10.8.2.16.37364 > 103.53.48.70.1935: Flags [.], seq 117153:118467, ack 1, win 501, options [nop,nop,TS val 1037262029 ecr 3516155788], length 1314
05:25:55.879067 IP 103.53.48.70.1935 > 10.8.2.16.37364: Flags [.], ack 102435, win 172, options [nop,nop,TS val 3516155850 ecr 1037261460], length 0
05:25:55.930692 IP 10.8.2.16.37364 > 103.53.48.70.1935: Flags [.], seq 118467:119781, ack 1, win 501, options [nop,nop,TS val 1037262091 ecr 3516155850], length 1314
05:25:55.963987 IP 10.8.2.16.37364 > 103.53.48.70.1935: Flags [.], seq 119781:121095, ack 1, win 501, options [nop,nop,TS val 1037262125 ecr 3516155850], length 1314
05:25:55.984561 IP 103.53.48.70.1935 > 10.8.2.16.37364: Flags [.], ack 105063, win 172, options [nop,nop,TS val 3516155955 ecr 1037261558], length 0
05:25:55.997634 IP 10.8.2.16.37364 > 103.53.48.70.1935: Flags [.], seq 121095:122409, ack 1, win 501, options [nop,nop,TS val 1037262158 ecr 3516155955], length 1314
05:25:56.059183 IP 10.8.2.16.37364 > 103.53.48.70.1935: Flags [.], seq 122409:123723, ack 1, win 501, options [nop,nop,TS val 1037262220 ecr 3516155955], length 1314
05:25:56.074010 IP 103.53.48.70.1935 > 10.8.2.16.37364: Flags [.], ack 107691, win 172, options [nop,nop,TS val 3516156045 ecr 1037261623], length 0
05:25:56.097360 IP 10.8.2.16.37364 > 103.53.48.70.1935: Flags [.], seq 123723:125037, ack 1, win 501, options [nop,nop,TS val 1037262258 ecr 3516156045], length 1314
05:25:56.130643 IP 10.8.2.16.37364 > 103.53.48.70.1935: Flags [.], seq 125037:126351, ack 1, win 501, options [nop,nop,TS val 1037262291 ecr 3516156045], length 1314
05:25:56.149617 IP 103.53.48.70.1935 > 10.8.2.16.37364: Flags [.], ack 110319, win 172, options [nop,nop,TS val 3516156120 ecr 1037261728], length 0
05:25:56.163677 IP 103.53.48.70.1935 > 10.8.2.16.37364: Flags [.], ack 110583, win 174, options [nop,nop,TS val 3516156134 ecr 1037261776], length 0
05:25:56.163695 IP 10.8.2.16.37364 > 103.53.48.70.1935: Flags [P.], seq 126351:126511, ack 1, win 501, options [nop,nop,TS val 1037262324 ecr 3516156134], length 160
05:25:56.197707 IP 10.8.2.16.37364 > 103.53.48.70.1935: Flags [.], seq 126511:127825, ack 1, win 501, options [nop,nop,TS val 1037262358 ecr 3516156134], length 1314
05:25:56.228692 IP 10.8.2.16.37364 > 103.53.48.70.1935: Flags [.], seq 127825:129139, ack 1, win 501, options [nop,nop,TS val 1037262389 ecr 3516156134], length 1314
05:25:56.245627 IP 103.53.48.70.1935 > 10.8.2.16.37364: Flags [.], ack 113211, win 174, options [nop,nop,TS val 3516156216 ecr 1037261827], length 0
05:25:56.271186 IP 10.8.2.16.37364 > 103.53.48.70.1935: Flags [.], seq 129139:130453, ack 1, win 501, options [nop,nop,TS val 1037262432 ecr 3516156216], length 1314
05:25:56.333454 IP 10.8.2.16.37364 > 103.53.48.70.1935: Flags [.], seq 130453:131767, ack 1, win 501, options [nop,nop,TS val 1037262494 ecr 3516156216], length 1314
05:25:56.349369 IP 103.53.48.70.1935 > 10.8.2.16.37364: Flags [.], ack 115839, win 172, options [nop,nop,TS val 3516156320 ecr 1037261900], length 0
05:25:56.367105 IP 10.8.2.16.37364 > 103.53.48.70.1935: Flags [.], seq 131767:133081, ack 1, win 501, options [nop,nop,TS val 1037262528 ecr 3516156320], length 1314
05:25:56.400389 IP 10.8.2.16.37364 > 103.53.48.70.1935: Flags [.], seq 133081:134395, ack 1, win 501, options [nop,nop,TS val 1037262561 ecr 3516156320], length 1314
05:25:56.416462 IP 103.53.48.70.1935 > 10.8.2.16.37364: Flags [.], ack 118467, win 172, options [nop,nop,TS val 3516156387 ecr 1037261996], length 0
05:25:56.463325 IP 10.8.2.16.37364 > 103.53.48.70.1935: Flags [.], seq 134395:135709, ack 1, win 501, options [nop,nop,TS val 1037262624 ecr 3516156387], length 1314
05:25:56.498527 IP 10.8.2.16.37364 > 103.53.48.70.1935: Flags [.], seq 135709:137023, ack 1, win 501, options [nop,nop,TS val 1037262659 ecr 3516156387], length 1314
05:25:56.512031 IP 103.53.48.70.1935 > 10.8.2.16.37364: Flags [.], ack 121095, win 172, options [nop,nop,TS val 3516156483 ecr 1037262091], length 0
05:25:56.530763 IP 10.8.2.16.37364 > 103.53.48.70.1935: Flags [.], seq 137023:138337, ack 1, win 501, options [nop,nop,TS val 1037262691 ecr 3516156483], length 1314
05:25:56.590606 IP 10.8.2.16.37364 > 103.53.48.70.1935: Flags [.], seq 138337:139651, ack 1, win 501, options [nop,nop,TS val 1037262751 ecr 3516156483], length 1314
05:25:56.607463 IP 103.53.48.70.1935 > 10.8.2.16.37364: Flags [.], ack 123723, win 172, options [nop,nop,TS val 3516156578 ecr 1037262158], length 0
05:25:56.633465 IP 10.8.2.16.37364 > 103.53.48.70.1935: Flags [.], seq 139651:140965, ack 1, win 501, options [nop,nop,TS val 1037262794 ecr 3516156578], length 1314
05:25:56.666995 IP 10.8.2.16.37364 > 103.53.48.70.1935: Flags [.], seq 140965:142279, ack 1, win 501, options [nop,nop,TS val 1037262828 ecr 3516156578], length 1314
05:25:56.679125 IP 103.53.48.70.1935 > 10.8.2.16.37364: Flags [.], ack 126351, win 172, options [nop,nop,TS val 3516156650 ecr 1037262258], length 0
05:25:56.711922 IP 103.53.48.70.1935 > 10.8.2.16.37364: Flags [.], ack 126511, win 174, options [nop,nop,TS val 3516156682 ecr 1037262324], length 0
05:25:56.711953 IP 10.8.2.16.37364 > 103.53.48.70.1935: Flags [P.], seq 142279:143375, ack 1, win 501, options [nop,nop,TS val 1037262873 ecr 3516156682], length 1096
05:25:56.761531 IP 10.8.2.16.37364 > 103.53.48.70.1935: Flags [.], seq 143375:144689, ack 1, win 501, options [nop,nop,TS val 1037262922 ecr 3516156682], length 1314
05:25:56.776971 IP 103.53.48.70.1935 > 10.8.2.16.37364: Flags [.], ack 129139, win 174, options [nop,nop,TS val 3516156748 ecr 1037262358], length 0
05:25:56.797349 IP 10.8.2.16.37364 > 103.53.48.70.1935: Flags [.], seq 144689:146003, ack 1, win 501, options [nop,nop,TS val 1037262958 ecr 3516156748], length 1314
05:25:56.830603 IP 10.8.2.16.37364 > 103.53.48.70.1935: Flags [.], seq 146003:147317, ack 1, win 501, options [nop,nop,TS val 1037262991 ecr 3516156748], length 1314
05:25:56.881886 IP 103.53.48.70.1935 > 10.8.2.16.37364: Flags [.], ack 131767, win 172, options [nop,nop,TS val 3516156852 ecr 1037262432], length 0
05:25:56.901651 IP 10.8.2.16.37364 > 103.53.48.70.1935: Flags [.], seq 147317:148631, ack 1, win 501, options [nop,nop,TS val 1037263062 ecr 3516156852], length 1314
05:25:56.932147 IP 10.8.2.16.37364 > 103.53.48.70.1935: Flags [.], seq 148631:149945, ack 1, win 501, options [nop,nop,TS val 1037263093 ecr 3516156852], length 1314
05:25:56.948704 IP 103.53.48.70.1935 > 10.8.2.16.37364: Flags [.], ack 134395, win 172, options [nop,nop,TS val 3516156919 ecr 1037262528], length 0
05:25:56.964249 IP 10.8.2.16.37364 > 103.53.48.70.1935: Flags [.], seq 149945:151259, ack 1, win 501, options [nop,nop,TS val 1037263125 ecr 3516156919], length 1314
05:25:57.034878 IP 10.8.2.16.37364 > 103.53.48.70.1935: Flags [.], seq 151259:152573, ack 1, win 501, options [nop,nop,TS val 1037263196 ecr 3516156919], length 1314
05:25:57.046641 IP 103.53.48.70.1935 > 10.8.2.16.37364: Flags [.], ack 137023, win 172, options [nop,nop,TS val 3516157017 ecr 1037262624], length 0
05:25:57.060211 IP 10.8.2.16.37364 > 103.53.48.70.1935: Flags [.], seq 152573:153887, ack 1, win 501, options [nop,nop,TS val 1037263221 ecr 3516157017], length 1314
05:25:57.098079 IP 10.8.2.16.37364 > 103.53.48.70.1935: Flags [.], seq 153887:155201, ack 1, win 501, options [nop,nop,TS val 1037263259 ecr 3516157017], length 1314
05:25:57.138704 IP 103.53.48.70.1935 > 10.8.2.16.37364: Flags [.], ack 139651, win 172, options [nop,nop,TS val 3516157109 ecr 1037262691], length 0
05:25:57.166904 IP 10.8.2.16.37364 > 103.53.48.70.1935: Flags [.], seq 155201:156515, ack 1, win 501, options [nop,nop,TS val 1037263328 ecr 3516157109], length 1314
05:25:57.200102 IP 10.8.2.16.37364 > 103.53.48.70.1935: Flags [.], seq 156515:157829, ack 1, win 501, options [nop,nop,TS val 1037263361 ecr 3516157109], length 1314
05:25:57.215576 IP 103.53.48.70.1935 > 10.8.2.16.37364: Flags [.], ack 142279, win 172, options [nop,nop,TS val 3516157186 ecr 1037262794], length 0
05:25:57.231259 IP 10.8.2.16.37364 > 103.53.48.70.1935: Flags [.], seq 157829:159143, ack 1, win 501, options [nop,nop,TS val 1037263392 ecr 3516157186], length 1314
05:25:57.260122 IP 103.53.48.70.1935 > 10.8.2.16.37364: Flags [.], ack 143375, win 174, options [nop,nop,TS val 3516157231 ecr 1037262873], length 0
05:25:57.260155 IP 10.8.2.16.37364 > 103.53.48.70.1935: Flags [P.], seq 159143:159403, ack 1, win 501, options [nop,nop,TS val 1037263421 ecr 3516157231], length 260
05:25:57.295378 IP 10.8.2.16.37364 > 103.53.48.70.1935: Flags [.], seq 159403:160717, ack 1, win 501, options [nop,nop,TS val 1037263456 ecr 3516157231], length 1314
05:25:57.333281 IP 10.8.2.16.37364 > 103.53.48.70.1935: Flags [.], seq 160717:162031, ack 1, win 501, options [nop,nop,TS val 1037263494 ecr 3516157231], length 1314
05:25:57.345777 IP 103.53.48.70.1935 > 10.8.2.16.37364: Flags [.], ack 146003, win 174, options [nop,nop,TS val 3516157316 ecr 1037262922], length 0
05:25:57.380791 IP 10.8.2.16.37364 > 103.53.48.70.1935: Flags [.], seq 162031:163345, ack 1, win 501, options [nop,nop,TS val 1037263541 ecr 3516157316], length 1314
05:25:57.435494 IP 10.8.2.16.37364 > 103.53.48.70.1935: Flags [.], seq 163345:164659, ack 1, win 501, options [nop,nop,TS val 1037263596 ecr 3516157316], length 1314
05:25:57.450060 IP 103.53.48.70.1935 > 10.8.2.16.37364: Flags [.], ack 148631, win 172, options [nop,nop,TS val 3516157421 ecr 1037262991], length 0
05:25:57.463745 IP 10.8.2.16.37364 > 103.53.48.70.1935: Flags [.], seq 164659:165973, ack 1, win 501, options [nop,nop,TS val 1037263624 ecr 3516157421], length 1314
05:25:57.508730 IP 10.8.2.16.37364 > 103.53.48.70.1935: Flags [.], seq 165973:167287, ack 1, win 501, options [nop,nop,TS val 1037263669 ecr 3516157421], length 1314
05:25:57.512276 IP 103.53.48.70.1935 > 10.8.2.16.37364: Flags [.], ack 151259, win 172, options [nop,nop,TS val 3516157483 ecr 1037263093], length 0
05:25:57.568507 IP 10.8.2.16.37364 > 103.53.48.70.1935: Flags [.], seq 167287:168601, ack 1, win 501, options [nop,nop,TS val 1037263729 ecr 3516157483], length 1314
05:25:57.594760 IP 10.8.2.16.37364 > 103.53.48.70.1935: Flags [.], seq 168601:169915, ack 1, win 501, options [nop,nop,TS val 1037263755 ecr 3516157483], length 1314
05:25:57.608339 IP 103.53.48.70.1935 > 10.8.2.16.37364: Flags [.], ack 153887, win 172, options [nop,nop,TS val 3516157579 ecr 1037263196], length 0
05:25:57.637389 IP 10.8.2.16.37364 > 103.53.48.70.1935: Flags [.], seq 169915:171229, ack 1, win 501, options [nop,nop,TS val 1037263798 ecr 3516157579], length 1314
05:25:57.700029 IP 10.8.2.16.37364 > 103.53.48.70.1935: Flags [.], seq 171229:172543, ack 1, win 501, options [nop,nop,TS val 1037263861 ecr 3516157579], length 1314
05:25:57.710761 IP 103.53.48.70.1935 > 10.8.2.16.37364: Flags [.], ack 155201, win 174, options [nop,nop,TS val 3516157681 ecr 1037263259], length 0
05:25:57.733968 IP 10.8.2.16.37364 > 103.53.48.70.1935: Flags [.], seq 172543:173857, ack 1, win 501, options [nop,nop,TS val 1037263895 ecr 3516157681], length 1314
05:25:57.748439 IP 103.53.48.70.1935 > 10.8.2.16.37364: Flags [.], ack 157829, win 174, options [nop,nop,TS val 3516157719 ecr 1037263328], length 0
05:25:57.766108 IP 10.8.2.16.37364 > 103.53.48.70.1935: Flags [.], seq 173857:175171, ack 1, win 501, options [nop,nop,TS val 1037263927 ecr 3516157719], length 1314
05:25:57.808092 IP 103.53.48.70.1935 > 10.8.2.16.37364: Flags [.], ack 159403, win 174, options [nop,nop,TS val 3516157779 ecr 1037263392], length 0
05:25:57.808114 IP 10.8.2.16.37364 > 103.53.48.70.1935: Flags [P.], seq 175171:176279, ack 1, win 501, options [nop,nop,TS val 1037263969 ecr 3516157779], length 1108
05:25:57.864077 IP 10.8.2.16.37364 > 103.53.48.70.1935: Flags [.], seq 176279:177593, ack 1, win 501, options [nop,nop,TS val 1037264025 ecr 3516157779], length 1314
05:25:57.881481 IP 103.53.48.70.1935 > 10.8.2.16.37364: Flags [.], ack 162031, win 174, options [nop,nop,TS val 3516157852 ecr 1037263456], length 0
05:25:57.893004 IP 10.8.2.16.37364 > 103.53.48.70.1935: Flags [.], seq 177593:178907, ack 1, win 501, options [nop,nop,TS val 1037264054 ecr 3516157852], length 1314
05:25:57.935880 IP 10.8.2.16.37364 > 103.53.48.70.1935: Flags [.], seq 178907:180221, ack 1, win 501, options [nop,nop,TS val 1037264097 ecr 3516157852], length 1314
05:25:57.983734 IP 103.53.48.70.1935 > 10.8.2.16.37364: Flags [.], ack 164659, win 172, options [nop,nop,TS val 3516157954 ecr 1037263541], length 0
05:25:57.997720 IP 10.8.2.16.37364 > 103.53.48.70.1935: Flags [.], seq 180221:181535, ack 1, win 501, options [nop,nop,TS val 1037264158 ecr 3516157954], length 1314
05:25:58.031428 IP 10.8.2.16.37364 > 103.53.48.70.1935: Flags [.], seq 181535:182849, ack 1, win 501, options [nop,nop,TS val 1037264192 ecr 3516157954], length 1314
05:25:58.057104 IP 103.53.48.70.1935 > 10.8.2.16.37364: Flags [.], ack 167287, win 172, options [nop,nop,TS val 3516158028 ecr 1037263624], length 0
05:25:58.067789 IP 10.8.2.16.37364 > 103.53.48.70.1935: Flags [.], seq 182849:184163, ack 1, win 501, options [nop,nop,TS val 1037264228 ecr 3516158028], length 1314
05:25:58.128217 IP 10.8.2.16.37364 > 103.53.48.70.1935: Flags [.], seq 184163:185477, ack 1, win 501, options [nop,nop,TS val 1037264289 ecr 3516158028], length 1314
05:25:58.142960 IP 103.53.48.70.1935 > 10.8.2.16.37364: Flags [.], ack 169915, win 172, options [nop,nop,TS val 3516158114 ecr 1037263729], length 0
05:25:58.165215 IP 10.8.2.16.37364 > 103.53.48.70.1935: Flags [.], seq 185477:186791, ack 1, win 501, options [nop,nop,TS val 1037264326 ecr 3516158114], length 1314
05:25:58.197947 IP 10.8.2.16.37364 > 103.53.48.70.1935: Flags [.], seq 186791:188105, ack 1, win 501, options [nop,nop,TS val 1037264359 ecr 3516158114], length 1314
05:25:58.248570 IP 103.53.48.70.1935 > 10.8.2.16.37364: Flags [.], ack 172543, win 172, options [nop,nop,TS val 3516158219 ecr 1037263798], length 0
05:25:58.264238 IP 10.8.2.16.37364 > 103.53.48.70.1935: Flags [.], seq 188105:189419, ack 1, win 501, options [nop,nop,TS val 1037264425 ecr 3516158219], length 1314
05:25:58.298461 IP 10.8.2.16.37364 > 103.53.48.70.1935: Flags [.], seq 189419:190733, ack 1, win 501, options [nop,nop,TS val 1037264459 ecr 3516158219], length 1314
05:25:58.314575 IP 103.53.48.70.1935 > 10.8.2.16.37364: Flags [.], ack 175171, win 172, options [nop,nop,TS val 3516158285 ecr 1037263895], length 0
05:25:58.333542 IP 10.8.2.16.37364 > 103.53.48.70.1935: Flags [.], seq 190733:192047, ack 1, win 501, options [nop,nop,TS val 1037264494 ecr 3516158285], length 1314
05:25:58.356586 IP 103.53.48.70.1935 > 10.8.2.16.37364: Flags [.], ack 176279, win 174, options [nop,nop,TS val 3516158327 ecr 1037263969], length 0
05:25:58.356624 IP 10.8.2.16.37364 > 103.53.48.70.1935: Flags [P.], seq 192047:192199, ack 1, win 501, options [nop,nop,TS val 1037264517 ecr 3516158327], length 152
05:25:58.401504 IP 10.8.2.16.37364 > 103.53.48.70.1935: Flags [.], seq 192199:193513, ack 1, win 501, options [nop,nop,TS val 1037264562 ecr 3516158327], length 1314
05:25:58.426930 IP 10.8.2.16.37364 > 103.53.48.70.1935: Flags [.], seq 193513:194827, ack 1, win 501, options [nop,nop,TS val 1037264588 ecr 3516158327], length 1314
05:25:58.441492 IP 103.53.48.70.1935 > 10.8.2.16.37364: Flags [.], ack 178907, win 174, options [nop,nop,TS val 3516158412 ecr 1037264025], length 0
05:25:58.469382 IP 10.8.2.16.37364 > 103.53.48.70.1935: Flags [.], seq 194827:196141, ack 1, win 501, options [nop,nop,TS val 1037264630 ecr 3516158412], length 1314
05:25:58.530641 IP 10.8.2.16.37364 > 103.53.48.70.1935: Flags [.], seq 196141:197455, ack 1, win 501, options [nop,nop,TS val 1037264691 ecr 3516158412], length 1314
05:25:58.547828 IP 103.53.48.70.1935 > 10.8.2.16.37364: Flags [.], ack 181535, win 172, options [nop,nop,TS val 3516158518 ecr 1037264097], length 0
05:25:58.564242 IP 10.8.2.16.37364 > 103.53.48.70.1935: Flags [.], seq 197455:198769, ack 1, win 501, options [nop,nop,TS val 1037264725 ecr 3516158518], length 1314
05:25:58.598960 IP 10.8.2.16.37364 > 103.53.48.70.1935: Flags [.], seq 198769:200083, ack 1, win 501, options [nop,nop,TS val 1037264760 ecr 3516158518], length 1314
05:25:58.616054 IP 103.53.48.70.1935 > 10.8.2.16.37364: Flags [.], ack 184163, win 172, options [nop,nop,TS val 3516158587 ecr 1037264192], length 0
05:25:58.661415 IP 10.8.2.16.37364 > 103.53.48.70.1935: Flags [.], seq 200083:201397, ack 1, win 501, options [nop,nop,TS val 1037264822 ecr 3516158587], length 1314
05:25:58.698654 IP 10.8.2.16.37364 > 103.53.48.70.1935: Flags [.], seq 201397:202711, ack 1, win 501, options [nop,nop,TS val 1037264859 ecr 3516158587], length 1314
05:25:58.713548 IP 103.53.48.70.1935 > 10.8.2.16.37364: Flags [.], ack 186791, win 172, options [nop,nop,TS val 3516158684 ecr 1037264289], length 0
05:25:58.733297 IP 10.8.2.16.37364 > 103.53.48.70.1935: Flags [.], seq 202711:204025, ack 1, win 501, options [nop,nop,TS val 1037264894 ecr 3516158684], length 1314
05:25:58.799807 IP 10.8.2.16.37364 > 103.53.48.70.1935: Flags [.], seq 204025:205339, ack 1, win 501, options [nop,nop,TS val 1037264960 ecr 3516158684], length 1314
