23:52:56.740131 IP 52.223.209.40.1935 > 10.8.1.4.33150: Flags [.], ack 607340510, win 126, options [nop,nop,TS val 3251627143 ecr 1629483183], length 0
23:52:56.742374 IP 10.8.1.4.33150 > 52.223.209.40.1935: Flags [.], seq 11606:12920, ack 0, win 501, options [nop,nop,TS val 1629483652 ecr 3251627143], length 1314
23:52:56.785353 IP 10.8.1.4.33150 > 52.223.209.40.1935: Flags [.], seq 12920:14234, ack 0, win 501, options [nop,nop,TS val 1629483695 ecr 3251627143], length 1314
23:52:56.840698 IP 52.223.209.40.1935 > 10.8.1.4.33150: Flags [.], ack 2629, win 126, options [nop,nop,TS val 3251627243 ecr 1629483268], length 0
23:52:56.845890 IP 10.8.1.4.33150 > 52.223.209.40.1935: Flags [.], seq 14234:15548, ack 0, win 501, options [nop,nop,TS val 1629483756 ecr 3251627243], length 1314
23:52:56.870853 IP 10.8.1.4.33150 > 52.223.209.40.1935: Flags [.], seq 15548:16862, ack 0, win 501, options [nop,nop,TS val 1629483781 ecr 3251627243], length 1314
23:52:56.911908 IP 52.223.209.40.1935 > 10.8.1.4.33150: Flags [.], ack 5257, win 126, options [nop,nop,TS val 3251627315 ecr 1629483354], length 0
23:52:56.913427 IP 10.8.1.4.33150 > 52.223.209.40.1935: Flags [.], seq 16862:18176, ack 0, win 501, options [nop,nop,TS val 1629483823 ecr 3251627315], length 1314
23:52:56.977432 IP 10.8.1.4.33150 > 52.223.209.40.1935: Flags [.], seq 18176:19490, ack 0, win 501, options [nop,nop,TS val 1629483887 ecr 3251627315], length 1314
23:52:56.999280 IP 52.223.209.40.1935 > 10.8.1.4.33150: Flags [.], ack 7885, win 126, options [nop,nop,TS val 3251627402 ecr 1629483459], length 0
23:52:57.014571 IP 10.8.1.4.33150 > 52.223.209.40.1935: Flags [.], seq 19490:20804, ack 0, win 501, options [nop,nop,TS val 1629483924 ecr 3251627402], length 1314
23:52:57.048723 IP 10.8.1.4.33150 > 52.223.209.40.1935: Flags [.], seq 20804:22118, ack 0, win 501, options [nop,nop,TS val 1629483959 ecr 3251627402], length 1314
23:52:57.089640 IP 52.223.209.40.1935 > 10.8.1.4.33150: Flags [.], ack 10292, win 126, options [nop,nop,TS val 3251627493 ecr 1629483525], length 0
23:52:57.089680 IP 10.8.1.4.33150 > 52.223.209.40.1935: Flags [P.], seq 22118:23197, ack 0, win 501, options [nop,nop,TS val 1629484000 ecr 3251627493], length 1079
23:52:57.146755 IP 10.8.1.4.33150 > 52.223.209.40.1935: Flags [.], seq 23197:24511, ack 0, win 501, options [nop,nop,TS val 1629484057 ecr 3251627493], length 1314
23:52:57.168113 IP 52.223.209.40.1935 > 10.8.1.4.33150: Flags [.], ack 12920, win 126, options [nop,nop,TS val 3251627571 ecr 1629483622], length 0
23:52:57.180277 IP 10.8.1.4.33150 > 52.223.209.40.1935: Flags [.], seq 24511:25825, ack 0, win 501, options [nop,nop,TS val 1629484090 ecr 3251627571], length 1314
23:52:57.215357 IP 10.8.1.4.33150 > 52.223.209.40.1935: Flags [.], seq 25825:27139, ack 0, win 501, options [nop,nop,TS val 1629484125 ecr 3251627571], length 1314
23:52:57.272016 IP 52.223.209.40.1935 > 10.8.1.4.33150: Flags [.], ack 15548, win 126, options [nop,nop,TS val 3251627674 ecr 1629483695], length 0
23:52:57.278076 IP 10.8.1.4.33150 > 52.223.209.40.1935: Flags [.], seq 27139:28453, ack 0, win 501, options [nop,nop,TS val 1629484188 ecr 3251627674], length 1314
23:52:57.312568 IP 10.8.1.4.33150 > 52.223.209.40.1935: Flags [.], seq 28453:29767, ack 0, win 501, options [nop,nop,TS val 1629484222 ecr 3251627674], length 1314
23:52:57.339018 IP 52.223.209.40.1935 > 10.8.1.4.33150: Flags [.], ack 18176, win 126, options [nop,nop,TS val 3251627742 ecr 1629483781], length 0
23:52:57.344209 IP 10.8.1.4.33150 > 52.223.209.40.1935: Flags [.], seq 29767:31081, ack 0, win 501, options [nop,nop,TS val 1629484254 ecr 3251627742], length 1314
23:52:57.405474 IP 10.8.1.4.33150 > 52.223.209.40.1935: Flags [.], seq 31081:32395, ack 0, win 501, options [nop,nop,TS val 1629484315 ecr 3251627742], length 1314
23:52:57.440191 IP 52.223.209.40.1935 > 10.8.1.4.33150: Flags [.], ack 20804, win 126, options [nop,nop,TS val 3251627843 ecr 1629483887], length 0
23:52:57.448431 IP 10.8.1.4.33150 > 52.223.209.40.1935: Flags [.], seq 32395:33709, ack 0, win 501, options [nop,nop,TS val 1629484358 ecr 3251627843], length 1314
23:52:57.480289 IP 10.8.1.4.33150 > 52.223.209.40.1935: Flags [.], seq 33709:35023, ack 0, win 501, options [nop,nop,TS val 1629484390 ecr 3251627843], length 1314
23:52:57.516123 IP 52.223.209.40.1935 > 10.8.1.4.33150: Flags [.], ack 23197, win 126, options [nop,nop,TS val 3251627919 ecr 1629483959], length 0
23:52:57.516143 IP 10.8.1.4.33150 > 52.223.209.40.1935: Flags [P.], seq 35023:36115, ack 0, win 501, options [nop,nop,TS val 1629484426 ecr 3251627919], length 1092
23:52:57.576239 IP 10.8.1.4.33150 > 52.223.209.40.1935: Flags [.], seq 36115:37429, ack 0, win 501, options [nop,nop,TS val 1629484486 ecr 3251627919], length 1314
23:52:57.606338 IP 52.223.209.40.1935 > 10.8.1.4.33150: Flags [.], ack 25825, win 126, options [nop,nop,TS val 3251628009 ecr 1629484057], length 0
23:52:57.614023 IP 10.8.1.4.33150 > 52.223.209.40.1935: Flags [.], seq 37429:38743, ack 0, win 501, options [nop,nop,TS val 1629484524 ecr 3251628009], length 1314
23:52:57.647335 IP 10.8.1.4.33150 > 52.223.209.40.1935: Flags [.], seq 38743:40057, ack 0, win 501, options [nop,nop,TS val 1629484557 ecr 3251628009], length 1314
23:52:57.703614 IP 52.223.209.40.1935 > 10.8.1.4.33150: Flags [.], ack 28453, win 126, options [nop,nop,TS val 3251628106 ecr 1629484125], length 0
23:52:57.715173 IP 10.8.1.4.33150 > 52.223.209.40.1935: Flags [.], seq 40057:41371, ack 0, win 501, options [nop,nop,TS val 1629484625 ecr 3251628106], length 1314
23:52:57.747139 IP 10.8.1.4.33150 > 52.223.209.40.1935: Flags [.], seq 41371:42685, ack 0, win 501, options [nop,nop,TS val 1629484657 ecr 3251628106], length 1314
23:52:57.770609 IP 52.223.209.40.1935 > 10.8.1.4.33150: Flags [.], ack 31081, win 126, options [nop,nop,TS val 3251628172 ecr 1629484222], length 0
23:52:57.782068 IP 10.8.1.4.33150 > 52.223.209.40.1935: Flags [.], seq 42685:43999, ack 0, win 501, options [nop,nop,TS val 1629484692 ecr 3251628172], length 1314
23:52:57.848698 IP 10.8.1.4.33150 > 52.223.209.40.1935: Flags [.], seq 43999:45313, ack 0, win 501, options [nop,nop,TS val 1629484759 ecr 3251628172], length 1314
23:52:57.875405 IP 52.223.209.40.1935 > 10.8.1.4.33150: Flags [.], ack 33709, win 126, options [nop,nop,TS val 3251628278 ecr 1629484315], length 0
23:52:57.876076 IP 10.8.1.4.33150 > 52.223.209.40.1935: Flags [.], seq 45313:46627, ack 0, win 501, options [nop,nop,TS val 1629484786 ecr 3251628278], length 1314
23:52:57.912560 IP 10.8.1.4.33150 > 52.223.209.40.1935: Flags [.], seq 46627:47941, ack 0, win 501, options [nop,nop,TS val 1629484822 ecr 3251628278], length 1314
23:52:57.944948 IP 52.223.209.40.1935 > 10.8.1.4.33150: Flags [.], ack 36115, win 126, options [nop,nop,TS val 3251628346 ecr 1629484390], length 0
23:52:57.944965 IP 10.8.1.4.33150 > 52.223.209.40.1935: Flags [P.], seq 47941:49027, ack 0, win 501, options [nop,nop,TS val 1629484855 ecr 3251628346], length 1086
23:52:58.011279 IP 10.8.1.4.33150 > 52.223.209.40.1935: Flags [.], seq 49027:50341, ack 0, win 501, options [nop,nop,TS val 1629484921 ecr 3251628346], length 1314
23:52:58.039356 IP 52.223.209.40.1935 > 10.8.1.4.33150: Flags [.], ack 38743, win 126, options [nop,nop,TS val 3251628442 ecr 1629484486], length 0
23:52:58.046424 IP 10.8.1.4.33150 > 52.223.209.40.1935: Flags [.], seq 50341:51655, ack 0, win 501, options [nop,nop,TS val 1629484956 ecr 3251628442], length 1314
23:52:58.081856 IP 10.8.1.4.33150 > 52.223.209.40.1935: Flags [.], seq 51655:52969, ack 0, win 501, options [nop,nop,TS val 1629484992 ecr 3251628442], length 1314
23:52:58.140859 IP 52.223.209.40.1935 > 10.8.1.4.33150: Flags [.], ack 41371, win 126, options [nop,nop,TS val 3251628544 ecr 1629484557], length 0
23:52:58.144324 IP 10.8.1.4.33150 > 52.223.209.40.1935: Flags [.], seq 52969:54283, ack 0, win 501, options [nop,nop,TS val 1629485054 ecr 3251628544], length 1314
23:52:58.174356 IP 10.8.1.4.33150 > 52.223.209.40.1935: Flags [.], seq 54283:55597, ack 0, win 501, options [nop,nop,TS val 1629485084 ecr 3251628544], length 1314
23:52:58.207753 IP 52.223.209.40.1935 > 10.8.1.4.33150: Flags [.], ack 43999, win 126, options [nop,nop,TS val 3251628610 ecr 1629484657], length 0
23:52:58.212391 IP 10.8.1.4.33150 > 52.223.209.40.1935: Flags [.], seq 55597:56911, ack 0, win 501, options [nop,nop,TS val 1629485122 ecr 3251628610], length 1314
23:52:58.277790 IP 10.8.1.4.33150 > 52.223.209.40.1935: Flags [.], seq 56911:58225, ack 0, win 501, options [nop,nop,TS val 1629485188 ecr 3251628610], length 1314
23:52:58.305555 IP 52.223.209.40.1935 > 10.8.1.4.33150: Flags [.], ack 46627, win 126, options [nop,nop,TS val 3251628708 ecr 1629484759], length 0
23:52:58.312956 IP 10.8.1.4.33150 > 52.223.209.40.1935: Flags [.], seq 58225:59539, ack 0, win 501, options [nop,nop,TS val 1629485223 ecr 3251628708], length 1314
23:52:58.344963 IP 10.8.1.4.33150 > 52.223.209.40.1935: Flags [.], seq 59539:60853, ack 0, win 501, options [nop,nop,TS val 1629485255 ecr 3251628708], length 1314
23:52:58.369972 IP 52.223.209.40.1935 > 10.8.1.4.33150: Flags [.], ack 49027, win 126, options [nop,nop,TS val 3251628773 ecr 1629484822], length 0
23:52:58.370000 IP 10.8.1.4.33150 > 52.223.209.40.1935: Flags [P.], seq 60853:61089, ack 0, win 501, options [nop,nop,TS val 1629485280 ecr 3251628773], length 236
23:52:58.409023 IP 10.8.1.4.33150 > 52.223.209.40.1935: Flags [.], seq 61089:62403, ack 0, win 501, options [nop,nop,TS val 1629485319 ecr 3251628773], length 1314
23:52:58.448480 IP 10.8.1.4.33150 > 52.223.209.40.1935: Flags [.], seq 62403:63717, ack 0, win 501, options [nop,nop,TS val 1629485358 ecr 3251628773], length 1314
23:52:58.471765 IP 52.223.209.40.1935 > 10.8.1.4.33150: Flags [.], ack 51655, win 126, options [nop,nop,TS val 3251628874 ecr 1629484921], length 0
23:52:58.494599 IP 10.8.1.4.33150 > 52.223.209.40.1935: Flags [.], seq 63717:65031, ack 0, win 501, options [nop,nop,TS val 1629485404 ecr 3251628874], length 1314
23:52:58.548558 IP 10.8.1.4.33150 > 52.223.209.40.1935: Flags [.], seq 65031:66345, ack 0, win 501, options [nop,nop,TS val 1629485458 ecr 3251628874], length 1314
23:52:58.569812 IP 52.223.209.40.1935 > 10.8.1.4.33150: Flags [.], ack 54283, win 126, options [nop,nop,TS val 3251628973 ecr 1629484992], length 0
23:52:58.580296 IP 10.8.1.4.33150 > 52.223.209.40.1935: Flags [.], seq 66345:67659, ack 0, win 501, options [nop,nop,TS val 1629485490 ecr 3251628973], length 1314
23:52:58.623185 IP 10.8.1.4.33150 > 52.223.209.40.1935: Flags [.], seq 67659:68973, ack 0, win 501, options [nop,nop,TS val 1629485533 ecr 3251628973], length 1314
23:52:58.639147 IP 52.223.209.40.1935 > 10.8.1.4.33150: Flags [.], ack 56911, win 126, options [nop,nop,TS val 3251629042 ecr 1629485084], length 0
23:52:58.681424 IP 10.8.1.4.33150 > 52.223.209.40.1935: Flags [.], seq 68973:70287, ack 0, win 501, options [nop,nop,TS val 1629485591 ecr 3251629042], length 1314
23:52:58.708873 IP 10.8.1.4.33150 > 52.223.209.40.1935: Flags [.], seq 70287:71601, ack 0, win 501, options [nop,nop,TS val 1629485619 ecr 3251629042], length 1314
23:52:58.742805 IP 52.223.209.40.1935 > 10.8.1.4.33150: Flags [.], ack 59539, win 126, options [nop,nop,TS val 3251629141 ecr 1629485188], length 0
23:52:58.751596 IP 10.8.1.4.33150 > 52.223.209.40.1935: Flags [.], seq 71601:72915, ack 0, win 501, options [nop,nop,TS val 1629485661 ecr 3251629141], length 1314
23:52:58.804553 IP 52.223.209.40.1935 > 10.8.1.4.33150: Flags [.], ack 61089, win 126, options [nop,nop,TS val 3251629207 ecr 1629485255], length 0
23:52:58.804564 IP 10.8.1.4.33150 > 52.223.209.40.1935: Flags [P.], seq 72915:74003, ack 0, win 501, options [nop,nop,TS val 1629485714 ecr 3251629207], length 1088
23:52:58.844570 IP 10.8.1.4.33150 > 52.223.209.40.1935: Flags [.], seq 74003:75317, ack 0, win 501, options [nop,nop,TS val 1629485754 ecr 3251629207], length 1314
23:52:58.873996 IP 52.223.209.40.1935 > 10.8.1.4.33150: Flags [.], ack 63717, win 126, options [nop,nop,TS val 3251629277 ecr 1629485319], length 0
23:52:58.879790 IP 10.8.1.4.33150 > 52.223.209.40.1935: Flags [.], seq 75317:76631, ack 0, win 501, options [nop,nop,TS val 1629485790 ecr 3251629277], length 1314
23:52:58.922678 IP 10.8.1.4.33150 > 52.223.209.40.1935: Flags [.], seq 76631:77945, ack 0, win 501, options [nop,nop,TS val 1629485832 ecr 3251629277], length 1314
23:52:58.975181 IP 52.223.209.40.1935 > 10.8.1.4.33150: Flags [.], ack 66345, win 126, options [nop,nop,TS val 3251629378 ecr 1629485404], length 0
23:52:58.980234 IP 10.8.1.4.33150 > 52.223.209.40.1935: Flags [.], seq 77945:79259, ack 0, win 501, options [nop,nop,TS val 1629485890 ecr 3251629378], length 1314
23:52:59.008311 IP 10.8.1.4.33150 > 52.223.209.40.1935: Flags [.], seq 79259:80573, ack 0, win 501, options [nop,nop,TS val 1629485918 ecr 3251629378], length 1314
23:52:59.048365 IP 52.223.209.40.1935 > 10.8.1.4.33150: Flags [.], ack 68973, win 126, options [nop,nop,TS val 3251629451 ecr 1629485490], length 0
23:52:59.050668 IP 10.8.1.4.33150 > 52.223.209.40.1935: Flags [.], seq 80573:81887, ack 0, win 501, options [nop,nop,TS val 1629485961 ecr 3251629451], length 1314
23:52:59.114930 IP 10.8.1.4.33150 > 52.223.209.40.1935: Flags [.], seq 81887:83201, ack 0, win 501, options [nop,nop,TS val 1629486025 ecr 3251629451], length 1314
23:52:59.134999 IP 52.223.209.40.1935 > 10.8.1.4.33150: Flags [.], ack 71601, win 126, options [nop,nop,TS val 3251629537 ecr 1629485591], length 0
23:52:59.148371 IP 10.8.1.4.33150 > 52.223.209.40.1935: Flags [.], seq 83201:84515, ack 0, win 501, options [nop,nop,TS val 1629486058 ecr 3251629537], length 1314
23:52:59.179036 IP 10.8.1.4.33150 > 52.223.209.40.1935: Flags [.], seq 84515:85829, ack 0, win 501, options [nop,nop,TS val 1629486089 ecr 3251629537], length 1314
23:52:59.230174 IP 52.223.209.40.1935 > 10.8.1.4.33150: Flags [.], ack 74003, win 126, options [nop,nop,TS val 3251629633 ecr 1629485661], length 0
23:52:59.230188 IP 10.8.1.4.33150 > 52.223.209.40.1935: Flags [P.], seq 85829:86913, ack 0, win 501, options [nop,nop,TS val 1629486140 ecr 3251629633], length 1084
23:52:59.281221 IP 10.8.1.4.33150 > 52.223.209.40.1935: Flags [.], seq 86913:88227, ack 0, win 501, options [nop,nop,TS val 1629486191 ecr 3251629633], length 1314
23:52:59.305239 IP 52.223.209.40.1935 > 10.8.1.4.33150: Flags [.], ack 76631, win 126, options [nop,nop,TS val 3251629708 ecr 1629485754], length 0
23:52:59.315063 IP 10.8.1.4.33150 > 52.223.209.40.1935: Flags [.], seq 88227:89541, ack 0, win 501, options [nop,nop,TS val 1629486225 ecr 3251629708], length 1314
23:52:59.349378 IP 10.8.1.4.33150 > 52.223.209.40.1935: Flags [.], seq 89541:90855, ack 0, win 501, options [nop,nop,TS val 1629486259 ecr 3251629708], length 1314
23:52:59.405828 IP 52.223.209.40.1935 > 10.8.1.4.33150: Flags [.], ack 79259, win 126, options [nop,nop,TS val 3251629809 ecr 1629485832], length 0
23:52:59.412282 IP 10.8.1.4.33150 > 52.223.209.40.1935: Flags [.], seq 90855:92169, ack 0, win 501, options [nop,nop,TS val 1629486322 ecr 3251629809], length 1314
23:52:59.448024 IP 10.8.1.4.33150 > 52.223.209.40.1935: Flags [.], seq 92169:93483, ack 0, win 501, options [nop,nop,TS val 1629486358 ecr 3251629809], length 1314
23:52:59.478809 IP 52.223.209.40.1935 > 10.8.1.4.33150: Flags [.], ack 81887, win 126, options [nop,nop,TS val 3251629879 ecr 1629485918], length 0
23:52:59.481790 IP 10.8.1.4.33150 > 52.223.209.40.1935: Flags [.], seq 93483:94797, ack 0, win 501, options [nop,nop,TS val 1629486392 ecr 3251629879], length 1314
23:52:59.541166 IP 10.8.1.4.33150 > 52.223.209.40.1935: Flags [.], seq 94797:96111, ack 0, win 501, options [nop,nop,TS val 1629486451 ecr 3251629879], length 1314
23:52:59.573941 IP 52.223.209.40.1935 > 10.8.1.4.33150: Flags [.], ack 84515, win 126, options [nop,nop,TS val 3251629977 ecr 1629486025], length 0
23:52:59.581657 IP 10.8.1.4.33150 > 52.223.209.40.1935: Flags [.], seq 96111:97425, ack 0, win 501, options [nop,nop,TS val 1629486491 ecr 3251629977], length 1314
23:52:59.615157 IP 10.8.1.4.33150 > 52.223.209.40.1935: Flags [.], seq 97425:98739, ack 0, win 501, options [nop,nop,TS val 1629486525 ecr 3251629977], length 1314
23:52:59.655199 IP 52.223.209.40.1935 > 10.8.1.4.33150: Flags [.], ack 86913, win 126, options [nop,nop,TS val 3251630058 ecr 1629486089], length 0
23:52:59.655219 IP 10.8.1.4.33150 > 52.223.209.40.1935: Flags [P.], seq 98739:99831, ack 0, win 501, options [nop,nop,TS val 1629486565 ecr 3251630058], length 1092
23:52:59.712200 IP 10.8.1.4.33150 > 52.223.209.40.1935: Flags [.], seq 99831:101145, ack 0, win 501, options [nop,nop,TS val 1629486622 ecr 3251630058], length 1314
23:52:59.740356 IP 52.223.209.40.1935 > 10.8.1.4.33150: Flags [.], ack 89541, win 126, options [nop,nop,TS val 3251630143 ecr 1629486191], length 0
23:52:59.747961 IP 10.8.1.4.33150 > 52.223.209.40.1935: Flags [.], seq 101145:102459, ack 0, win 501, options [nop,nop,TS val 1629486658 ecr 3251630143], length 1314
23:52:59.780168 IP 10.8.1.4.33150 > 52.223.209.40.1935: Flags [.], seq 102459:103773, ack 0, win 501, options [nop,nop,TS val 1629486690 ecr 3251630143], length 1314
23:52:59.837742 IP 52.223.209.40.1935 > 10.8.1.4.33150: Flags [.], ack 92169, win 126, options [nop,nop,TS val 3251630240 ecr 1629486259], length 0
23:52:59.845634 IP 10.8.1.4.33150 > 52.223.209.40.1935: Flags [.], seq 103773:105087, ack 0, win 501, options [nop,nop,TS val 1629486755 ecr 3251630240], length 1314
23:52:59.877792 IP 10.8.1.4.33150 > 52.223.209.40.1935: Flags [.], seq 105087:106401, ack 0, win 501, options [nop,nop,TS val 1629486788 ecr 3251630240], length 1314
23:52:59.909003 IP 52.223.209.40.1935 > 10.8.1.4.33150: Flags [.], ack 94797, win 126, options [nop,nop,TS val 3251630310 ecr 1629486358], length 0
23:52:59.913962 IP 10.8.1.4.33150 > 52.223.209.40.1935: Flags [.], seq 106401:107715, ack 0, win 501, options [nop,nop,TS val 1629486824 ecr 3251630310], length 1314
23:52:59.981921 IP 10.8.1.4.33150 > 52.223.209.40.1935: Flags [.], seq 107715:109029, ack 0, win 501, options [nop,nop,TS val 1629486892 ecr 3251630310], length 1314
23:53:00.007261 IP 52.223.209.40.1935 > 10.8.1.4.33150: Flags [.], ack 97425, win 126, options [nop,nop,TS val 3251630410 ecr 1629486451], length 0
23:53:00.011275 IP 10.8.1.4.33150 > 52.223.209.40.1935: Flags [.], seq 109029:110343, ack 0, win 501, options [nop,nop,TS val 1629486921 ecr 3251630410], length 1314
23:53:00.046707 IP 10.8.1.4.33150 > 52.223.209.40.1935: Flags [.], seq 110343:111657, ack 0, win 501, options [nop,nop,TS val 1629486957 ecr 3251630410], length 1314
23:53:00.083352 IP 52.223.209.40.1935 > 10.8.1.4.33150: Flags [.], ack 99831, win 126, options [nop,nop,TS val 3251630483 ecr 1629486525], length 0
23:53:00.083382 IP 10.8.1.4.33150 > 52.223.209.40.1935: Flags [P.], seq 111657:112738, ack 0, win 501, options [nop,nop,TS val 1629486993 ecr 3251630483], length 1081
23:53:00.147914 IP 10.8.1.4.33150 > 52.223.209.40.1935: Flags [.], seq 112738:114052, ack 0, win 501, options [nop,nop,TS val 1629487058 ecr 3251630483], length 1314
23:53:00.175940 IP 52.223.209.40.1935 > 10.8.1.4.33150: Flags [.], ack 102459, win 126, options [nop,nop,TS val 3251630576 ecr 1629486622], length 0
23:53:00.179117 IP 10.8.1.4.33150 > 52.223.209.40.1935: Flags [.], seq 114052:115366, ack 0, win 501, options [nop,nop,TS val 1629487089 ecr 3251630576], length 1314
23:53:00.213983 IP 10.8.1.4.33150 > 52.223.209.40.1935: Flags [.], seq 115366:116680, ack 0, win 501, options [nop,nop,TS val 1629487124 ecr 3251630576], length 1314
23:53:00.272978 IP 52.223.209.40.1935 > 10.8.1.4.33150: Flags [.], ack 105087, win 126, options [nop,nop,TS val 3251630674 ecr 1629486690], length 0
23:53:00.281678 IP 10.8.1.4.33150 > 52.223.209.40.1935: Flags [.], seq 116680:117994, ack 0, win 501, options [nop,nop,TS val 1629487191 ecr 3251630674], length 1314
23:53:00.311314 IP 10.8.1.4.33150 > 52.223.209.40.1935: Flags [.], seq 117994:119308, ack 0, win 501, options [nop,nop,TS val 1629487221 ecr 3251630674], length 1314
23:53:00.339771 IP 52.223.209.40.1935 > 10.8.1.4.33150: Flags [.], ack 107715, win 126, options [nop,nop,TS val 3251630742 ecr 1629486788], length 0
23:53:00.344749 IP 10.8.1.4.33150 > 52.223.209.40.1935: Flags [.], seq 119308:120622, ack 0, win 501, options [nop,nop,TS val 1629487255 ecr 3251630742], length 1314
23:53:00.415011 IP 10.8.1.4.33150 > 52.223.209.40.1935: Flags [.], seq 120622:121936, ack 0, win 501, options [nop,nop,TS val 1629487325 ecr 3251630742], length 1314
23:53:00.437772 IP 52.223.209.40.1935 > 10.8.1.4.33150: Flags [.], ack 110343, win 126, options [nop,nop,TS val 3251630840 ecr 1629486892], length 0
23:53:00.446999 IP 10.8.1.4.33150 > 52.223.209.40.1935: Flags [.], seq 121936:123250, ack 0, win 501, options [nop,nop,TS val 1629487357 ecr 3251630840], length 1314
23:53:00.478708 IP 10.8.1.4.33150 > 52.223.209.40.1935: Flags [.], seq 123250:124564, ack 0, win 501, options [nop,nop,TS val 1629487389 ecr 3251630840], length 1314
23:53:00.510917 IP 52.223.209.40.1935 > 10.8.1.4.33150: Flags [.], ack 112738, win 126, options [nop,nop,TS val 3251630914 ecr 1629486957], length 0
23:53:00.510983 IP 10.8.1.4.33150 > 52.223.209.40.1935: Flags [P.], seq 124564:124809, ack 0, win 501, options [nop,nop,TS val 1629487421 ecr 3251630914], length 245
23:53:00.544275 IP 10.8.1.4.33150 > 52.223.209.40.1935: Flags [.], seq 124809:126123, ack 0, win 501, options [nop,nop,TS val 1629487454 ecr 3251630914], length 1314
23:53:00.578062 IP 10.8.1.4.33150 > 52.223.209.40.1935: Flags [.], seq 126123:127437, ack 0, win 501, options [nop,nop,TS val 1629487488 ecr 3251630914], length 1314
23:53:00.606599 IP 52.223.209.40.1935 > 10.8.1.4.33150: Flags [.], ack 115366, win 126, options [nop,nop,TS val 3251631009 ecr 1629487058], length 0
23:53:00.631164 IP 10.8.1.4.33150 > 52.223.209.40.1935: Flags [.], seq 127437:128751, ack 0, win 501, options [nop,nop,TS val 1629487541 ecr 3251631009], length 1314
23:53:00.681885 IP 10.8.1.4.33150 > 52.223.209.40.1935: Flags [.], seq 128751:130065, ack 0, win 501, options [nop,nop,TS val 1629487592 ecr 3251631009], length 1314
23:53:00.707229 IP 52.223.209.40.1935 > 10.8.1.4.33150: Flags [.], ack 117994, win 126, options [nop,nop,TS val 3251631110 ecr 1629487124], length 0
23:53:00.713361 IP 10.8.1.4.33150 > 52.223.209.40.1935: Flags [.], seq 130065:131379, ack 0, win 501, options [nop,nop,TS val 1629487623 ecr 3251631110], length 1314
23:53:00.759287 IP 10.8.1.4.33150 > 52.223.209.40.1935: Flags [.], seq 131379:132693, ack 0, win 501, options [nop,nop,TS val 1629487669 ecr 3251631110], length 1314
23:53:00.772186 IP 52.223.209.40.1935 > 10.8.1.4.33150: Flags [.], ack 120622, win 126, options [nop,nop,TS val 3251631175 ecr 1629487221], length 0
23:53:00.811187 IP 10.8.1.4.33150 > 52.223.209.40.1935: Flags [.], seq 132693:134007, ack 0, win 501, options [nop,nop,TS val 1629487721 ecr 3251631175], length 1314
23:53:00.844772 IP 10.8.1.4.33150 > 52.223.209.40.1935: Flags [.], seq 134007:135321, ack 0, win 501, options [nop,nop,TS val 1629487755 ecr 3251631175], length 1314
23:53:00.872375 IP 52.223.209.40.1935 > 10.8.1.4.33150: Flags [.], ack 123250, win 126, options [nop,nop,TS val 3251631275 ecr 1629487325], length 0
23:53:00.887487 IP 10.8.1.4.33150 > 52.223.209.40.1935: Flags [.], seq 135321:136635, ack 0, win 501, options [nop,nop,TS val 1629487797 ecr 3251631275], length 1314
23:53:00.936840 IP 52.223.209.40.1935 > 10.8.1.4.33150: Flags [.], ack 124809, win 126, options [nop,nop,TS val 3251631340 ecr 1629487389], length 0
23:53:00.936877 IP 10.8.1.4.33150 > 52.223.209.40.1935: Flags [P.], seq 136635:137714, ack 0, win 501, options [nop,nop,TS val 1629487847 ecr 3251631340], length 1079
23:53:00.979161 IP 10.8.1.4.33150 > 52.223.209.40.1935: Flags [.], seq 137714:139028, ack 0, win 501, options [nop,nop,TS val 1629487889 ecr 3251631340], length 1314
23:53:01.011814 IP 52.223.209.40.1935 > 10.8.1.4.33150: Flags [.], ack 127437, win 126, options [nop,nop,TS val 3251631407 ecr 1629487454], length 0
23:53:01.012932 IP 10.8.1.4.33150 > 52.223.209.40.1935: Flags [.], seq 139028:140342, ack 0, win 501, options [nop,nop,TS val 1629487923 ecr 3251631407], length 1314
23:53:01.058266 IP 10.8.1.4.33150 > 52.223.209.40.1935: Flags [.], seq 140342:141656, ack 0, win 501, options [nop,nop,TS val 1629487968 ecr 3251631407], length 1314
23:53:01.111378 IP 52.223.209.40.1935 > 10.8.1.4.33150: Flags [.], ack 130065, win 126, options [nop,nop,TS val 3251631510 ecr 1629487541], length 0
23:53:01.114931 IP 10.8.1.4.33150 > 52.223.209.40.1935: Flags [.], seq 141656:142970, ack 0, win 501, options [nop,nop,TS val 1629488025 ecr 3251631510], length 1314
23:53:01.144062 IP 10.8.1.4.33150 > 52.223.209.40.1935: Flags [.], seq 142970:144284, ack 0, win 501, options [nop,nop,TS val 1629488054 ecr 3251631510], length 1314
23:53:01.186472 IP 10.8.1.4.33150 > 52.223.209.40.1935: Flags [.], seq 144284:145598, ack 0, win 501, options [nop,nop,TS val 1629488096 ecr 3251631510], length 1314
23:53:01.195101 IP 52.223.209.40.1935 > 10.8.1.4.33150: Flags [.], ack 132693, win 126, options [nop,nop,TS val 3251631588 ecr 1629487623], length 0
23:53:01.245764 IP 10.8.1.4.33150 > 52.223.209.40.1935: Flags [.], seq 145598:146912, ack 0, win 501, options [nop,nop,TS val 1629488156 ecr 3251631588], length 1314
23:53:01.270219 IP 52.223.209.40.1935 > 10.8.1.4.33150: Flags [.], ack 135321, win 126, options [nop,nop,TS val 3251631673 ecr 1629487721], length 0
23:53:01.281254 IP 10.8.1.4.33150 > 52.223.209.40.1935: Flags [.], seq 146912:148226, ack 0, win 501, options [nop,nop,TS val 1629488191 ecr 3251631673], length 1314
23:53:01.314582 IP 10.8.1.4.33150 > 52.223.209.40.1935: Flags [.], seq 148226:149540, ack 0, win 501, options [nop,nop,TS val 1629488224 ecr 3251631673], length 1314
23:53:01.361875 IP 52.223.209.40.1935 > 10.8.1.4.33150: Flags [.], ack 137714, win 126, options [nop,nop,TS val 3251631765 ecr 1629487797], length 0
23:53:01.361913 IP 10.8.1.4.33150 > 52.223.209.40.1935: Flags [P.], seq 149540:150637, ack 0, win 501, options [nop,nop,TS val 1629488272 ecr 3251631765], length 1097
23:53:01.414617 IP 10.8.1.4.33150 > 52.223.209.40.1935: Flags [.], seq 150637:151951, ack 0, win 501, options [nop,nop,TS val 1629488324 ecr 3251631765], length 1314
23:53:01.440855 IP 52.223.209.40.1935 > 10.8.1.4.33150: Flags [.], ack 140342, win 126, options [nop,nop,TS val 3251631844 ecr 1629487889], length 0
23:53:01.448126 IP 10.8.1.4.33150 > 52.223.209.40.1935: Flags [.], seq 151951:153265, ack 0, win 501, options [nop,nop,TS val 1629488358 ecr 3251631844], length 1314
23:53:01.486092 IP 10.8.1.4.33150 > 52.223.209.40.1935: Flags [.], seq 153265:154579, ack 0, win 501, options [nop,nop,TS val 1629488396 ecr 3251631844], length 1314
23:53:01.545573 IP 10.8.1.4.33150 > 52.223.209.40.1935: Flags [.], seq 154579:155893, ack 0, win 501, options [nop,nop,TS val 1629488455 ecr 3251631844], length 1314
23:53:01.547349 IP 52.223.209.40.1935 > 10.8.1.4.33150: Flags [.], ack 142970, win 126, options [nop,nop,TS val 3251631950 ecr 1629487968], length 0
23:53:01.579228 IP 10.8.1.4.33150 > 52.223.209.40.1935: Flags [.], seq 155893:157207, ack 0, win 501, options [nop,nop,TS val 1629488489 ecr 3251631950], length 1314
23:53:01.613097 IP 52.223.209.40.1935 > 10.8.1.4.33150: Flags [.], ack 145598, win 126, options [nop,nop,TS val 3251632015 ecr 1629488054], length 0
23:53:01.614912 IP 10.8.1.4.33150 > 52.223.209.40.1935: Flags [.], seq 157207:158521, ack 0, win 501, options [nop,nop,TS val 1629488525 ecr 3251632015], length 1314
23:53:01.678228 IP 10.8.1.4.33150 > 52.223.209.40.1935: Flags [.], seq 158521:159835, ack 0, win 501, options [nop,nop,TS val 1629488588 ecr 3251632015], length 1314
23:53:01.706683 IP 52.223.209.40.1935 > 10.8.1.4.33150: Flags [.], ack 148226, win 126, options [nop,nop,TS val 3251632109 ecr 1629488156], length 0
23:53:01.713520 IP 10.8.1.4.33150 > 52.223.209.40.1935: Flags [.], seq 159835:161149, ack 0, win 501, options [nop,nop,TS val 1629488623 ecr 3251632109], length 1314
23:53:01.747557 IP 10.8.1.4.33150 > 52.223.209.40.1935: Flags [.], seq 161149:162463, ack 0, win 501, options [nop,nop,TS val 1629488657 ecr 3251632109], length 1314
23:53:01.787119 IP 52.223.209.40.1935 > 10.8.1.4.33150: Flags [.], ack 150637, win 126, options [nop,nop,TS val 3251632190 ecr 1629488224], length 0
23:53:01.787155 IP 10.8.1.4.33150 > 52.223.209.40.1935: Flags [P.], seq 162463:163540, ack 0, win 501, options [nop,nop,TS val 1629488697 ecr 3251632190], length 1077
23:53:01.848322 IP 10.8.1.4.33150 > 52.223.209.40.1935: Flags [.], seq 163540:164854, ack 0, win 501, options [nop,nop,TS val 1629488758 ecr 3251632190], length 1314
23:53:01.873429 IP 52.223.209.40.1935 > 10.8.1.4.33150: Flags [.], ack 153265, win 126, options [nop,nop,TS val 3251632276 ecr 1629488324], length 0
23:53:01.880390 IP 10.8.1.4.33150 > 52.223.209.40.1935: Flags [.], seq 164854:166168, ack 0, win 501, options [nop,nop,TS val 1629488790 ecr 3251632276], length 1314
23:53:01.913706 IP 10.8.1.4.33150 > 52.223.209.40.1935: Flags [.], seq 166168:167482, ack 0, win 501, options [nop,nop,TS val 1629488824 ecr 3251632276], length 1314
23:53:01.971217 IP 52.223.209.40.1935 > 10.8.1.4.33150: Flags [.], ack 155893, win 126, options [nop,nop,TS val 3251632374 ecr 1629488396], length 0
23:53:01.981759 IP 10.8.1.4.33150 > 52.223.209.40.1935: Flags [.], seq 167482:168796, ack 0, win 501, options [nop,nop,TS val 1629488892 ecr 3251632374], length 1314
23:53:02.014914 IP 10.8.1.4.33150 > 52.223.209.40.1935: Flags [.], seq 168796:170110, ack 0, win 501, options [nop,nop,TS val 1629488925 ecr 3251632374], length 1314
23:53:02.042688 IP 52.223.209.40.1935 > 10.8.1.4.33150: Flags [.], ack 158521, win 126, options [nop,nop,TS val 3251632443 ecr 1629488489], length 0
23:53:02.046109 IP 10.8.1.4.33150 > 52.223.209.40.1935: Flags [.], seq 170110:171424, ack 0, win 501, options [nop,nop,TS val 1629488956 ecr 3251632443], length 1314
23:53:02.114097 IP 10.8.1.4.33150 > 52.223.209.40.1935: Flags [.], seq 171424:172738, ack 0, win 501, options [nop,nop,TS val 1629489024 ecr 3251632443], length 1314
23:53:02.141875 IP 52.223.209.40.1935 > 10.8.1.4.33150: Flags [.], ack 161149, win 126, options [nop,nop,TS val 3251632544 ecr 1629488588], length 0
23:53:02.147489 IP 10.8.1.4.33150 > 52.223.209.40.1935: Flags [.], seq 172738:174052, ack 0, win 501, options [nop,nop,TS val 1629489057 ecr 3251632544], length 1314
23:53:02.180778 IP 10.8.1.4.33150 > 52.223.209.40.1935: Flags [.], seq 174052:175366, ack 0, win 501, options [nop,nop,TS val 1629489091 ecr 3251632544], length 1314
23:53:02.215625 IP 52.223.209.40.1935 > 10.8.1.4.33150: Flags [.], ack 163540, win 126, options [nop,nop,TS val 3251632618 ecr 1629488657], length 0
23:53:02.215653 IP 10.8.1.4.33150 > 52.223.209.40.1935: Flags [P.], seq 175366:176461, ack 0, win 501, options [nop,nop,TS val 1629489125 ecr 3251632618], length 1095
23:53:02.277863 IP 10.8.1.4.33150 > 52.223.209.40.1935: Flags [.], seq 176461:177775, ack 0, win 501, options [nop,nop,TS val 1629489188 ecr 3251632618], length 1314
23:53:02.305648 IP 52.223.209.40.1935 > 10.8.1.4.33150: Flags [.], ack 166168, win 126, options [nop,nop,TS val 3251632709 ecr 1629488758], length 0
23:53:02.312304 IP 10.8.1.4.33150 > 52.223.209.40.1935: Flags [.], seq 177775:179089, ack 0, win 501, options [nop,nop,TS val 1629489222 ecr 3251632709], length 1314
23:53:02.348024 IP 10.8.1.4.33150 > 52.223.209.40.1935: Flags [.], seq 179089:180403, ack 0, win 501, options [nop,nop,TS val 1629489258 ecr 3251632709], length 1314
23:53:02.411291 IP 52.223.209.40.1935 > 10.8.1.4.33150: Flags [.], ack 167482, win 126, options [nop,nop,TS val 3251632814 ecr 1629488824], length 0
23:53:02.413644 IP 10.8.1.4.33150 > 52.223.209.40.1935: Flags [.], seq 180403:181717, ack 0, win 501, options [nop,nop,TS val 1629489323 ecr 3251632814], length 1314
23:53:02.441464 IP 52.223.209.40.1935 > 10.8.1.4.33150: Flags [.], ack 170110, win 126, options [nop,nop,TS val 3251632844 ecr 1629488892], length 0
23:53:02.447287 IP 10.8.1.4.33150 > 52.223.209.40.1935: Flags [.], seq 181717:183031, ack 0, win 501, options [nop,nop,TS val 1629489357 ecr 3251632844], length 1314
23:53:02.479294 IP 10.8.1.4.33150 > 52.223.209.40.1935: Flags [.], seq 183031:184345, ack 0, win 501, options [nop,nop,TS val 1629489389 ecr 3251632844], length 1314
23:53:02.539350 IP 52.223.209.40.1935 > 10.8.1.4.33150: Flags [.], ack 172738, win 126, options [nop,nop,TS val 3251632942 ecr 1629488956], length 0
23:53:02.544139 IP 10.8.1.4.33150 > 52.223.209.40.1935: Flags [.], seq 184345:185659, ack 0, win 501, options [nop,nop,TS val 1629489454 ecr 3251632942], length 1314
23:53:02.578040 IP 10.8.1.4.33150 > 52.223.209.40.1935: Flags [.], seq 185659:186973, ack 0, win 501, options [nop,nop,TS val 1629489488 ecr 3251632942], length 1314
23:53:02.609329 IP 52.223.209.40.1935 > 10.8.1.4.33150: Flags [.], ack 175366, win 126, options [nop,nop,TS val 3251633012 ecr 1629489057], length 0
23:53:02.615242 IP 10.8.1.4.33150 > 52.223.209.40.1935: Flags [.], seq 186973:188287, ack 0, win 501, options [nop,nop,TS val 1629489525 ecr 3251633012], length 1314
23:53:02.641074 IP 52.223.209.40.1935 > 10.8.1.4.33150: Flags [.], ack 176461, win 126, options [nop,nop,TS val 3251633044 ecr 1629489125], length 0
23:53:02.641108 IP 10.8.1.4.33150 > 52.223.209.40.1935: Flags [P.], seq 188287:188520, ack 0, win 501, options [nop,nop,TS val 1629489551 ecr 3251633044], length 233
23:53:02.679825 IP 10.8.1.4.33150 > 52.223.209.40.1935: Flags [.], seq 188520:189834, ack 0, win 501, options [nop,nop,TS val 1629489590 ecr 3251633044], length 1314
23:53:02.711321 IP 10.8.1.4.33150 > 52.223.209.40.1935: Flags [.], seq 189834:191148, ack 0, win 501, options [nop,nop,TS val 1629489621 ecr 3251633044], length 1314
23:53:02.737492 IP 52.223.209.40.1935 > 10.8.1.4.33150: Flags [.], ack 179089, win 126, options [nop,nop,TS val 3251633141 ecr 1629489188], length 0
23:53:02.768176 IP 10.8.1.4.33150 > 52.223.209.40.1935: Flags [.], seq 191148:192462, ack 0, win 501, options [nop,nop,TS val 1629489678 ecr 3251633141], length 1314
23:53:02.815314 IP 10.8.1.4.33150 > 52.223.209.40.1935: Flags [.], seq 192462:193776, ack 0, win 501, options [nop,nop,TS val 1629489725 ecr 3251633141], length 1314
23:53:02.838927 IP 52.223.209.40.1935 > 10.8.1.4.33150: Flags [.], ack 181717, win 126, options [nop,nop,TS val 3251633242 ecr 1629489258], length 0
23:53:02.845980 IP 10.8.1.4.33150 > 52.223.209.40.1935: Flags [.], seq 193776:195090, ack 0, win 501, options [nop,nop,TS val 1629489756 ecr 3251633242], length 1314
23:53:02.897127 IP 10.8.1.4.33150 > 52.223.209.40.1935: Flags [.], seq 195090:196404, ack 0, win 501, options [nop,nop,TS val 1629489807 ecr 3251633242], length 1314
23:53:02.905701 IP 52.223.209.40.1935 > 10.8.1.4.33150: Flags [.], ack 184345, win 126, options [nop,nop,TS val 3251633308 ecr 1629489357], length 0
23:53:02.946842 IP 10.8.1.4.33150 > 52.223.209.40.1935: Flags [.], seq 196404:197718, ack 0, win 501, options [nop,nop,TS val 1629489857 ecr 3251633308], length 1314
23:53:02.980316 IP 10.8.1.4.33150 > 52.223.209.40.1935: Flags [.], seq 197718:199032, ack 0, win 501, options [nop,nop,TS val 1629489890 ecr 3251633308], length 1314
23:53:03.003961 IP 52.223.209.40.1935 > 10.8.1.4.33150: Flags [.], ack 186973, win 126, options [nop,nop,TS val 3251633406 ecr 1629489454], length 0
23:53:03.025286 IP 10.8.1.4.33150 > 52.223.209.40.1935: Flags [.], seq 199032:200346, ack 0, win 501, options [nop,nop,TS val 1629489935 ecr 3251633406], length 1314
23:53:03.066968 IP 52.223.209.40.1935 > 10.8.1.4.33150: Flags [.], ack 188520, win 126, options [nop,nop,TS val 3251633469 ecr 1629489525], length 0
23:53:03.067005 IP 10.8.1.4.33150 > 52.223.209.40.1935: Flags [P.], seq 200346:201343, ack 0, win 501, options [nop,nop,TS val 1629489977 ecr 3251633469], length 997
23:53:03.115347 IP 10.8.1.4.33150 > 52.223.209.40.1935: Flags [.], seq 201343:202657, ack 0, win 501, options [nop,nop,TS val 1629490025 ecr 3251633469], length 1314
23:53:03.136927 IP 52.223.209.40.1935 > 10.8.1.4.33150: Flags [.], ack 191148, win 126, options [nop,nop,TS val 3251633539 ecr 1629489590], length 0
23:53:03.148572 IP 10.8.1.4.33150 > 52.223.209.40.1935: Flags [.], seq 202657:203971, ack 0, win 501, options [nop,nop,TS val 1629490058 ecr 3251633539], length 1314
23:53:03.180357 IP 10.8.1.4.33150 > 52.223.209.40.1935: Flags [.], seq 203971:205285, ack 0, win 501, options [nop,nop,TS val 1629490090 ecr 3251633539], length 1314
23:53:03.240851 IP 52.223.209.40.1935 > 10.8.1.4.33150: Flags [.], ack 193776, win 126, options [nop,nop,TS val 3251633644 ecr 1629489678], length 0
23:53:03.244300 IP 10.8.1.4.33150 > 52.223.209.40.1935: Flags [.], seq 205285:206599, ack 0, win 501, options [nop,nop,TS val 1629490154 ecr 3251633644], length 1314
23:53:03.280212 IP 10.8.1.4.33150 > 52.223.209.40.1935: Flags [.], seq 206599:207913, ack 0, win 501, options [nop,nop,TS val 1629490190 ecr 3251633644], length 1314
23:53:03.315186 IP 10.8.1.4.33150 > 52.223.209.40.1935: Flags [.], seq 207913:209227, ack 0, win 501, options [nop,nop,TS val 1629490225 ecr 3251633644], length 1314
23:53:03.322652 IP 52.223.209.40.1935 > 10.8.1.4.33150: Flags [.], ack 196404, win 126, options [nop,nop,TS val 3251633725 ecr 1629489756], length 0
23:53:03.380297 IP 10.8.1.4.33150 > 52.223.209.40.1935: Flags [.], seq 209227:210541, ack 0, win 501, options [nop,nop,TS val 1629490290 ecr 3251633725], length 1314
23:53:03.405930 IP 52.223.209.40.1935 > 10.8.1.4.33150: Flags [.], ack 199032, win 126, options [nop,nop,TS val 3251633809 ecr 1629489857], length 0
23:53:03.413615 IP 10.8.1.4.33150 > 52.223.209.40.1935: Flags [.], seq 210541:211855, ack 0, win 501, options [nop,nop,TS val 1629490323 ecr 3251633809], length 1314
23:53:03.448203 IP 10.8.1.4.33150 > 52.223.209.40.1935: Flags [.], seq 211855:213169, ack 0, win 501, options [nop,nop,TS val 1629490358 ecr 3251633809], length 1314
23:53:03.492446 IP 52.223.209.40.1935 > 10.8.1.4.33150: Flags [.], ack 201343, win 126, options [nop,nop,TS val 3251633895 ecr 1629489935], length 0
23:53:03.492484 IP 10.8.1.4.33150 > 52.223.209.40.1935: Flags [P.], seq 213169:214249, ack 0, win 501, options [nop,nop,TS val 1629490402 ecr 3251633895], length 1080
23:53:03.548087 IP 10.8.1.4.33150 > 52.223.209.40.1935: Flags [.], seq 214249:215563, ack 0, win 501, options [nop,nop,TS val 1629490458 ecr 3251633895], length 1314
23:53:03.575533 IP 52.223.209.40.1935 > 10.8.1.4.33150: Flags [.], ack 203971, win 126, options [nop,nop,TS val 3251633978 ecr 1629490025], length 0
23:53:03.581991 IP 10.8.1.4.33150 > 52.223.209.40.1935: Flags [.], seq 215563:216877, ack 0, win 501, options [nop,nop,TS val 1629490492 ecr 3251633978], length 1314
23:53:03.610996 IP 10.8.1.4.33150 > 52.223.209.40.1935: Flags [.], seq 216877:218191, ack 0, win 501, options [nop,nop,TS val 1629490521 ecr 3251633978], length 1314
23:53:03.669733 IP 52.223.209.40.1935 > 10.8.1.4.33150: Flags [.], ack 206599, win 126, options [nop,nop,TS val 3251634073 ecr 1629490090], length 0
23:53:03.681827 IP 10.8.1.4.33150 > 52.223.209.40.1935: Flags [.], seq 218191:219505, ack 0, win 501, options [nop,nop,TS val 1629490592 ecr 3251634073], length 1314
23:53:03.715465 IP 10.8.1.4.33150 > 52.223.209.40.1935: Flags [.], seq 219505:220819, ack 0, win 501, options [nop,nop,TS val 1629490625 ecr 3251634073], length 1314
23:53:03.741559 IP 52.223.209.40.1935 > 10.8.1.4.33150: Flags [.], ack 209227, win 126, options [nop,nop,TS val 3251634144 ecr 1629490190], length 0
23:53:03.748734 IP 10.8.1.4.33150 > 52.223.209.40.1935: Flags [.], seq 220819:222133, ack 0, win 501, options [nop,nop,TS val 1629490659 ecr 3251634144], length 1314
23:53:03.811962 IP 10.8.1.4.33150 > 52.223.209.40.1935: Flags [.], seq 222133:223447, ack 0, win 501, options [nop,nop,TS val 1629490722 ecr 3251634144], length 1314
