08:23:29.059254 IP 185.42.204.250.1935 > 10.8.3.4.47646: Flags [.], ack 1392397072, win 126, options [nop,nop,TS val 944540236 ecr 3813833042], length 0
08:23:29.059292 IP 10.8.3.4.47646 > 185.42.204.250.1935: Flags [P.], seq 13141:13850, ack 0, win 501, options [nop,nop,TS val 3813833550 ecr 944540236], length 709
08:23:29.115119 IP 10.8.3.4.47646 > 185.42.204.250.1935: Flags [.], seq 13850:15164, ack 0, win 501, options [nop,nop,TS val 3813833605 ecr 944540236], length 1314
08:23:29.127464 IP 185.42.204.250.1935 > 10.8.3.4.47646: Flags [.], ack 2629, win 126, options [nop,nop,TS val 944540305 ecr 3813833137], length 0
08:23:29.152029 IP 10.8.3.4.47646 > 185.42.204.250.1935: Flags [.], seq 15164:16478, ack 0, win 501, options [nop,nop,TS val 3813833642 ecr 944540305], length 1314
08:23:29.180847 IP 10.8.3.4.47646 > 185.42.204.250.1935: Flags [.], seq 16478:17792, ack 0, win 501, options [nop,nop,TS val 3813833671 ecr 944540305], length 1314
08:23:29.227477 IP 185.42.204.250.1935 > 10.8.3.4.47646: Flags [.], ack 5257, win 126, options [nop,nop,TS val 944540405 ecr 3813833214], length 0
08:23:29.248728 IP 10.8.3.4.47646 > 185.42.204.250.1935: Flags [.], seq 17792:19106, ack 0, win 501, options [nop,nop,TS val 3813833739 ecr 944540405], length 1314
08:23:29.280790 IP 10.8.3.4.47646 > 185.42.204.250.1935: Flags [.], seq 19106:20420, ack 0, win 501, options [nop,nop,TS val 3813833771 ecr 944540405], length 1314
08:23:29.299236 IP 185.42.204.250.1935 > 10.8.3.4.47646: Flags [.], ack 7885, win 126, options [nop,nop,TS val 944540476 ecr 3813833305], length 0
08:23:29.313071 IP 10.8.3.4.47646 > 185.42.204.250.1935: Flags [.], seq 20420:21734, ack 0, win 501, options [nop,nop,TS val 3813833803 ecr 944540476], length 1314
08:23:29.387891 IP 10.8.3.4.47646 > 185.42.204.250.1935: Flags [.], seq 21734:23048, ack 0, win 501, options [nop,nop,TS val 3813833878 ecr 944540476], length 1314
08:23:29.394273 IP 185.42.204.250.1935 > 10.8.3.4.47646: Flags [.], ack 10513, win 126, options [nop,nop,TS val 944540571 ecr 3813833407], length 0
08:23:29.413422 IP 10.8.3.4.47646 > 185.42.204.250.1935: Flags [.], seq 23048:24362, ack 0, win 501, options [nop,nop,TS val 3813833904 ecr 944540571], length 1314
08:23:29.452132 IP 10.8.3.4.47646 > 185.42.204.250.1935: Flags [.], seq 24362:25676, ack 0, win 501, options [nop,nop,TS val 3813833942 ecr 944540571], length 1314
08:23:29.494245 IP 185.42.204.250.1935 > 10.8.3.4.47646: Flags [.], ack 13141, win 126, options [nop,nop,TS val 944540671 ecr 3813833471], length 0
08:23:29.506248 IP 185.42.204.250.1935 > 10.8.3.4.47646: Flags [.], ack 13850, win 126, options [nop,nop,TS val 944540683 ecr 3813833550], length 0
08:23:29.506283 IP 10.8.3.4.47646 > 185.42.204.250.1935: Flags [P.], seq 25676:26867, ack 0, win 501, options [nop,nop,TS val 3813833997 ecr 944540683], length 1191
08:23:29.546770 IP 10.8.3.4.47646 > 185.42.204.250.1935: Flags [.], seq 26867:28181, ack 0, win 501, options [nop,nop,TS val 3813834037 ecr 944540683], length 1314
08:23:29.580343 IP 10.8.3.4.47646 > 185.42.204.250.1935: Flags [.], seq 28181:29495, ack 0, win 501, options [nop,nop,TS val 3813834071 ecr 944540683], length 1314
08:23:29.598846 IP 185.42.204.250.1935 > 10.8.3.4.47646: Flags [.], ack 16478, win 126, options [nop,nop,TS val 944540776 ecr 3813833605], length 0
08:23:29.622665 IP 10.8.3.4.47646 > 185.42.204.250.1935: Flags [.], seq 29495:30809, ack 0, win 501, options [nop,nop,TS val 3813834113 ecr 944540776], length 1314
08:23:29.686453 IP 10.8.3.4.47646 > 185.42.204.250.1935: Flags [.], seq 30809:32123, ack 0, win 501, options [nop,nop,TS val 3813834177 ecr 944540776], length 1314
08:23:29.695665 IP 185.42.204.250.1935 > 10.8.3.4.47646: Flags [.], ack 19106, win 126, options [nop,nop,TS val 944540873 ecr 3813833671], length 0
08:23:29.711352 IP 10.8.3.4.47646 > 185.42.204.250.1935: Flags [.], seq 32123:33437, ack 0, win 501, options [nop,nop,TS val 3813834202 ecr 944540873], length 1314
08:23:29.750440 IP 10.8.3.4.47646 > 185.42.204.250.1935: Flags [.], seq 33437:34751, ack 0, win 501, options [nop,nop,TS val 3813834241 ecr 944540873], length 1314
08:23:29.760120 IP 185.42.204.250.1935 > 10.8.3.4.47646: Flags [.], ack 21734, win 126, options [nop,nop,TS val 944540937 ecr 3813833771], length 0
08:23:29.814158 IP 10.8.3.4.47646 > 185.42.204.250.1935: Flags [.], seq 34751:36065, ack 0, win 501, options [nop,nop,TS val 3813834304 ecr 944540937], length 1314
08:23:29.844469 IP 10.8.3.4.47646 > 185.42.204.250.1935: Flags [.], seq 36065:37379, ack 0, win 501, options [nop,nop,TS val 3813834335 ecr 944540937], length 1314
08:23:29.868076 IP 185.42.204.250.1935 > 10.8.3.4.47646: Flags [.], ack 24362, win 126, options [nop,nop,TS val 944541037 ecr 3813833878], length 0
08:23:29.879685 IP 10.8.3.4.47646 > 185.42.204.250.1935: Flags [.], seq 37379:38693, ack 0, win 501, options [nop,nop,TS val 3813834370 ecr 944541037], length 1314
08:23:29.948482 IP 10.8.3.4.47646 > 185.42.204.250.1935: Flags [.], seq 38693:40007, ack 0, win 501, options [nop,nop,TS val 3813834439 ecr 944541037], length 1314
08:23:29.953226 IP 185.42.204.250.1935 > 10.8.3.4.47646: Flags [.], ack 26867, win 126, options [nop,nop,TS val 944541130 ecr 3813833942], length 0
08:23:29.953262 IP 10.8.3.4.47646 > 185.42.204.250.1935: Flags [P.], seq 40007:40713, ack 0, win 501, options [nop,nop,TS val 3813834444 ecr 944541130], length 706
08:23:30.012909 IP 10.8.3.4.47646 > 185.42.204.250.1935: Flags [.], seq 40713:42027, ack 0, win 501, options [nop,nop,TS val 3813834503 ecr 944541130], length 1314
08:23:30.027131 IP 185.42.204.250.1935 > 10.8.3.4.47646: Flags [.], ack 29495, win 126, options [nop,nop,TS val 944541204 ecr 3813834037], length 0
08:23:30.049589 IP 10.8.3.4.47646 > 185.42.204.250.1935: Flags [.], seq 42027:43341, ack 0, win 501, options [nop,nop,TS val 3813834540 ecr 944541204], length 1314
08:23:30.079017 IP 10.8.3.4.47646 > 185.42.204.250.1935: Flags [.], seq 43341:44655, ack 0, win 501, options [nop,nop,TS val 3813834569 ecr 944541204], length 1314
08:23:30.133268 IP 185.42.204.250.1935 > 10.8.3.4.47646: Flags [.], ack 32123, win 126, options [nop,nop,TS val 944541310 ecr 3813834113], length 0
08:23:30.155720 IP 10.8.3.4.47646 > 185.42.204.250.1935: Flags [.], seq 44655:45969, ack 0, win 501, options [nop,nop,TS val 3813834646 ecr 944541310], length 1314
08:23:30.177357 IP 10.8.3.4.47646 > 185.42.204.250.1935: Flags [.], seq 45969:47283, ack 0, win 501, options [nop,nop,TS val 3813834668 ecr 944541310], length 1314
08:23:30.197317 IP 185.42.204.250.1935 > 10.8.3.4.47646: Flags [.], ack 34751, win 126, options [nop,nop,TS val 944541374 ecr 3813834202], length 0
08:23:30.219467 IP 10.8.3.4.47646 > 185.42.204.250.1935: Flags [.], seq 47283:48597, ack 0, win 501, options [nop,nop,TS val 3813834710 ecr 944541374], length 1314
08:23:30.283445 IP 10.8.3.4.47646 > 185.42.204.250.1935: Flags [.], seq 48597:49911, ack 0, win 501, options [nop,nop,TS val 3813834774 ecr 944541374], length 1314
08:23:30.291631 IP 185.42.204.250.1935 > 10.8.3.4.47646: Flags [.], ack 37379, win 126, options [nop,nop,TS val 944541468 ecr 3813834304], length 0
08:23:30.310675 IP 10.8.3.4.47646 > 185.42.204.250.1935: Flags [.], seq 49911:51225, ack 0, win 501, options [nop,nop,TS val 3813834801 ecr 944541468], length 1314
08:23:30.347001 IP 10.8.3.4.47646 > 185.42.204.250.1935: Flags [.], seq 51225:52539, ack 0, win 501, options [nop,nop,TS val 3813834837 ecr 944541468], length 1314
08:23:30.395563 IP 185.42.204.250.1935 > 10.8.3.4.47646: Flags [.], ack 40007, win 126, options [nop,nop,TS val 944541573 ecr 3813834370], length 0
08:23:30.399992 IP 185.42.204.250.1935 > 10.8.3.4.47646: Flags [.], ack 40713, win 126, options [nop,nop,TS val 944541577 ecr 3813834444], length 0
08:23:30.400029 IP 10.8.3.4.47646 > 185.42.204.250.1935: Flags [P.], seq 52539:53730, ack 0, win 501, options [nop,nop,TS val 3813834890 ecr 944541577], length 1191
08:23:30.454316 IP 10.8.3.4.47646 > 185.42.204.250.1935: Flags [.], seq 53730:55044, ack 0, win 501, options [nop,nop,TS val 3813834945 ecr 944541577], length 1314
08:23:30.478838 IP 10.8.3.4.47646 > 185.42.204.250.1935: Flags [.], seq 55044:56358, ack 0, win 501, options [nop,nop,TS val 3813834969 ecr 944541577], length 1314
08:23:30.496763 IP 185.42.204.250.1935 > 10.8.3.4.47646: Flags [.], ack 43341, win 126, options [nop,nop,TS val 944541674 ecr 3813834503], length 0
08:23:30.518027 IP 10.8.3.4.47646 > 185.42.204.250.1935: Flags [.], seq 56358:57672, ack 0, win 501, options [nop,nop,TS val 3813835008 ecr 944541674], length 1314
08:23:30.581893 IP 10.8.3.4.47646 > 185.42.204.250.1935: Flags [.], seq 57672:58986, ack 0, win 501, options [nop,nop,TS val 3813835072 ecr 944541674], length 1314
08:23:30.587037 IP 185.42.204.250.1935 > 10.8.3.4.47646: Flags [.], ack 44655, win 126, options [nop,nop,TS val 944541764 ecr 3813834569], length 0
08:23:30.611133 IP 10.8.3.4.47646 > 185.42.204.250.1935: Flags [.], seq 58986:60300, ack 0, win 501, options [nop,nop,TS val 3813835101 ecr 944541764], length 1314
08:23:30.624280 IP 185.42.204.250.1935 > 10.8.3.4.47646: Flags [.], ack 47283, win 126, options [nop,nop,TS val 944541801 ecr 3813834646], length 0
08:23:30.645761 IP 10.8.3.4.47646 > 185.42.204.250.1935: Flags [.], seq 60300:61614, ack 0, win 501, options [nop,nop,TS val 3813835136 ecr 944541801], length 1314
08:23:30.714959 IP 10.8.3.4.47646 > 185.42.204.250.1935: Flags [.], seq 61614:62928, ack 0, win 501, options [nop,nop,TS val 3813835205 ecr 944541801], length 1314
08:23:30.730482 IP 185.42.204.250.1935 > 10.8.3.4.47646: Flags [.], ack 49911, win 126, options [nop,nop,TS val 944541907 ecr 3813834710], length 0
08:23:30.752344 IP 10.8.3.4.47646 > 185.42.204.250.1935: Flags [.], seq 62928:64242, ack 0, win 501, options [nop,nop,TS val 3813835243 ecr 944541907], length 1314
08:23:30.778826 IP 10.8.3.4.47646 > 185.42.204.250.1935: Flags [.], seq 64242:65556, ack 0, win 501, options [nop,nop,TS val 3813835269 ecr 944541907], length 1314
08:23:30.793749 IP 185.42.204.250.1935 > 10.8.3.4.47646: Flags [.], ack 52539, win 126, options [nop,nop,TS val 944541971 ecr 3813834801], length 0
08:23:30.845666 IP 10.8.3.4.47646 > 185.42.204.250.1935: Flags [.], seq 65556:66870, ack 0, win 501, options [nop,nop,TS val 3813835336 ecr 944541971], length 1314
08:23:30.847043 IP 185.42.204.250.1935 > 10.8.3.4.47646: Flags [.], ack 53730, win 126, options [nop,nop,TS val 944542024 ecr 3813834890], length 0
08:23:30.847066 IP 10.8.3.4.47646 > 185.42.204.250.1935: Flags [P.], seq 66870:67579, ack 0, win 501, options [nop,nop,TS val 3813835337 ecr 944542024], length 709
08:23:30.912633 IP 10.8.3.4.47646 > 185.42.204.250.1935: Flags [.], seq 67579:68893, ack 0, win 501, options [nop,nop,TS val 3813835403 ecr 944542024], length 1314
08:23:30.925559 IP 185.42.204.250.1935 > 10.8.3.4.47646: Flags [.], ack 56358, win 126, options [nop,nop,TS val 944542103 ecr 3813834945], length 0
08:23:30.947586 IP 10.8.3.4.47646 > 185.42.204.250.1935: Flags [.], seq 68893:70207, ack 0, win 501, options [nop,nop,TS val 3813835438 ecr 944542103], length 1314
08:23:30.986336 IP 10.8.3.4.47646 > 185.42.204.250.1935: Flags [.], seq 70207:71521, ack 0, win 501, options [nop,nop,TS val 3813835477 ecr 944542103], length 1314
08:23:31.028924 IP 185.42.204.250.1935 > 10.8.3.4.47646: Flags [.], ack 58986, win 126, options [nop,nop,TS val 944542206 ecr 3813835008], length 0
08:23:31.050121 IP 10.8.3.4.47646 > 185.42.204.250.1935: Flags [.], seq 71521:72835, ack 0, win 501, options [nop,nop,TS val 3813835540 ecr 944542206], length 1314
08:23:31.080800 IP 10.8.3.4.47646 > 185.42.204.250.1935: Flags [.], seq 72835:74149, ack 0, win 501, options [nop,nop,TS val 3813835571 ecr 944542206], length 1314
08:23:31.092872 IP 185.42.204.250.1935 > 10.8.3.4.47646: Flags [.], ack 61614, win 126, options [nop,nop,TS val 944542270 ecr 3813835101], length 0
08:23:31.114528 IP 10.8.3.4.47646 > 185.42.204.250.1935: Flags [.], seq 74149:75463, ack 0, win 501, options [nop,nop,TS val 3813835605 ecr 944542270], length 1314
08:23:31.179266 IP 10.8.3.4.47646 > 185.42.204.250.1935: Flags [.], seq 75463:76777, ack 0, win 501, options [nop,nop,TS val 3813835670 ecr 944542270], length 1314
08:23:31.199230 IP 185.42.204.250.1935 > 10.8.3.4.47646: Flags [.], ack 64242, win 126, options [nop,nop,TS val 944542376 ecr 3813835205], length 0
08:23:31.221282 IP 10.8.3.4.47646 > 185.42.204.250.1935: Flags [.], seq 76777:78091, ack 0, win 501, options [nop,nop,TS val 3813835712 ecr 944542376], length 1314
08:23:31.243415 IP 10.8.3.4.47646 > 185.42.204.250.1935: Flags [.], seq 78091:79405, ack 0, win 501, options [nop,nop,TS val 3813835734 ecr 944542376], length 1314
08:23:31.292668 IP 185.42.204.250.1935 > 10.8.3.4.47646: Flags [.], ack 66870, win 126, options [nop,nop,TS val 944542470 ecr 3813835269], length 0
08:23:31.293655 IP 185.42.204.250.1935 > 10.8.3.4.47646: Flags [.], ack 67579, win 126, options [nop,nop,TS val 944542471 ecr 3813835337], length 0
08:23:31.293674 IP 10.8.3.4.47646 > 185.42.204.250.1935: Flags [P.], seq 79405:80588, ack 0, win 501, options [nop,nop,TS val 3813835784 ecr 944542471], length 1183
08:23:31.349563 IP 10.8.3.4.47646 > 185.42.204.250.1935: Flags [.], seq 80588:81902, ack 0, win 501, options [nop,nop,TS val 3813835840 ecr 944542471], length 1314
08:23:31.378294 IP 10.8.3.4.47646 > 185.42.204.250.1935: Flags [.], seq 81902:83216, ack 0, win 501, options [nop,nop,TS val 3813835869 ecr 944542471], length 1314
08:23:31.394663 IP 185.42.204.250.1935 > 10.8.3.4.47646: Flags [.], ack 70207, win 126, options [nop,nop,TS val 944542572 ecr 3813835403], length 0
08:23:31.413282 IP 10.8.3.4.47646 > 185.42.204.250.1935: Flags [.], seq 83216:84530, ack 0, win 501, options [nop,nop,TS val 3813835904 ecr 944542572], length 1314
08:23:31.479901 IP 10.8.3.4.47646 > 185.42.204.250.1935: Flags [.], seq 84530:85844, ack 0, win 501, options [nop,nop,TS val 3813835970 ecr 944542572], length 1314
08:23:31.497276 IP 185.42.204.250.1935 > 10.8.3.4.47646: Flags [.], ack 72835, win 126, options [nop,nop,TS val 944542674 ecr 3813835477], length 0
08:23:31.519975 IP 10.8.3.4.47646 > 185.42.204.250.1935: Flags [.], seq 85844:87158, ack 0, win 501, options [nop,nop,TS val 3813836010 ecr 944542674], length 1314
08:23:31.544605 IP 10.8.3.4.47646 > 185.42.204.250.1935: Flags [.], seq 87158:88472, ack 0, win 501, options [nop,nop,TS val 3813836035 ecr 944542674], length 1314
08:23:31.566633 IP 185.42.204.250.1935 > 10.8.3.4.47646: Flags [.], ack 75463, win 126, options [nop,nop,TS val 944542739 ecr 3813835571], length 0
08:23:31.611692 IP 10.8.3.4.47646 > 185.42.204.250.1935: Flags [.], seq 88472:89786, ack 0, win 501, options [nop,nop,TS val 3813836102 ecr 944542739], length 1314
08:23:31.647263 IP 10.8.3.4.47646 > 185.42.204.250.1935: Flags [.], seq 89786:91100, ack 0, win 501, options [nop,nop,TS val 3813836138 ecr 944542739], length 1314
08:23:31.668085 IP 185.42.204.250.1935 > 10.8.3.4.47646: Flags [.], ack 78091, win 126, options [nop,nop,TS val 944542845 ecr 3813835670], length 0
08:23:31.677479 IP 10.8.3.4.47646 > 185.42.204.250.1935: Flags [.], seq 91100:92414, ack 0, win 501, options [nop,nop,TS val 3813836168 ecr 944542845], length 1314
08:23:31.740777 IP 185.42.204.250.1935 > 10.8.3.4.47646: Flags [.], ack 80588, win 126, options [nop,nop,TS val 944542918 ecr 3813835734], length 0
08:23:31.740813 IP 10.8.3.4.47646 > 185.42.204.250.1935: Flags [P.], seq 92414:93595, ack 0, win 501, options [nop,nop,TS val 3813836231 ecr 944542918], length 1181
08:23:31.780950 IP 10.8.3.4.47646 > 185.42.204.250.1935: Flags [.], seq 93595:94909, ack 0, win 501, options [nop,nop,TS val 3813836271 ecr 944542918], length 1314
08:23:31.818502 IP 10.8.3.4.47646 > 185.42.204.250.1935: Flags [.], seq 94909:96223, ack 0, win 501, options [nop,nop,TS val 3813836309 ecr 944542918], length 1314
08:23:31.825292 IP 185.42.204.250.1935 > 10.8.3.4.47646: Flags [.], ack 83216, win 126, options [nop,nop,TS val 944543002 ecr 3813835840], length 0
08:23:31.860990 IP 10.8.3.4.47646 > 185.42.204.250.1935: Flags [.], seq 96223:97537, ack 0, win 501, options [nop,nop,TS val 3813836351 ecr 944543002], length 1314
08:23:31.914022 IP 10.8.3.4.47646 > 185.42.204.250.1935: Flags [.], seq 97537:98851, ack 0, win 501, options [nop,nop,TS val 3813836404 ecr 944543002], length 1314
08:23:31.926768 IP 185.42.204.250.1935 > 10.8.3.4.47646: Flags [.], ack 85844, win 126, options [nop,nop,TS val 944543104 ecr 3813835904], length 0
08:23:31.947804 IP 10.8.3.4.47646 > 185.42.204.250.1935: Flags [.], seq 98851:100165, ack 0, win 501, options [nop,nop,TS val 3813836438 ecr 944543104], length 1314
08:23:31.989913 IP 10.8.3.4.47646 > 185.42.204.250.1935: Flags [.], seq 100165:101479, ack 0, win 501, options [nop,nop,TS val 3813836480 ecr 944543104], length 1314
08:23:31.991383 IP 185.42.204.250.1935 > 10.8.3.4.47646: Flags [.], ack 88472, win 126, options [nop,nop,TS val 944543168 ecr 3813836010], length 0
08:23:32.054213 IP 10.8.3.4.47646 > 185.42.204.250.1935: Flags [.], seq 101479:102793, ack 0, win 501, options [nop,nop,TS val 3813836545 ecr 944543168], length 1314
08:23:32.079334 IP 10.8.3.4.47646 > 185.42.204.250.1935: Flags [.], seq 102793:104107, ack 0, win 501, options [nop,nop,TS val 3813836570 ecr 944543168], length 1314
08:23:32.099014 IP 185.42.204.250.1935 > 10.8.3.4.47646: Flags [.], ack 91100, win 126, options [nop,nop,TS val 944543271 ecr 3813836102], length 0
08:23:32.118339 IP 10.8.3.4.47646 > 185.42.204.250.1935: Flags [.], seq 104107:105421, ack 0, win 501, options [nop,nop,TS val 3813836609 ecr 944543271], length 1314
08:23:32.182387 IP 10.8.3.4.47646 > 185.42.204.250.1935: Flags [.], seq 105421:106735, ack 0, win 501, options [nop,nop,TS val 3813836673 ecr 944543271], length 1314
08:23:32.187510 IP 185.42.204.250.1935 > 10.8.3.4.47646: Flags [.], ack 93595, win 126, options [nop,nop,TS val 944543365 ecr 3813836168], length 0
08:23:32.187535 IP 10.8.3.4.47646 > 185.42.204.250.1935: Flags [P.], seq 106735:107447, ack 0, win 501, options [nop,nop,TS val 3813836678 ecr 944543365], length 712
08:23:32.246440 IP 10.8.3.4.47646 > 185.42.204.250.1935: Flags [.], seq 107447:108761, ack 0, win 501, options [nop,nop,TS val 3813836737 ecr 944543365], length 1314
08:23:32.265775 IP 185.42.204.250.1935 > 10.8.3.4.47646: Flags [.], ack 96223, win 126, options [nop,nop,TS val 944543443 ecr 3813836271], length 0
08:23:32.289082 IP 10.8.3.4.47646 > 185.42.204.250.1935: Flags [.], seq 108761:110075, ack 0, win 501, options [nop,nop,TS val 3813836779 ecr 944543443], length 1314
08:23:32.311628 IP 10.8.3.4.47646 > 185.42.204.250.1935: Flags [.], seq 110075:111389, ack 0, win 501, options [nop,nop,TS val 3813836802 ecr 944543443], length 1314
08:23:32.361131 IP 185.42.204.250.1935 > 10.8.3.4.47646: Flags [.], ack 98851, win 126, options [nop,nop,TS val 944543538 ecr 3813836351], length 0
08:23:32.378992 IP 10.8.3.4.47646 > 185.42.204.250.1935: Flags [.], seq 111389:112703, ack 0, win 501, options [nop,nop,TS val 3813836869 ecr 944543538], length 1314
08:23:32.417778 IP 10.8.3.4.47646 > 185.42.204.250.1935: Flags [.], seq 112703:114017, ack 0, win 501, options [nop,nop,TS val 3813836908 ecr 944543538], length 1314
08:23:32.436909 IP 185.42.204.250.1935 > 10.8.3.4.47646: Flags [.], ack 101479, win 126, options [nop,nop,TS val 944543614 ecr 3813836438], length 0
08:23:32.443281 IP 10.8.3.4.47646 > 185.42.204.250.1935: Flags [.], seq 114017:115331, ack 0, win 501, options [nop,nop,TS val 3813836934 ecr 944543614], length 1314
08:23:32.513564 IP 10.8.3.4.47646 > 185.42.204.250.1935: Flags [.], seq 115331:116645, ack 0, win 501, options [nop,nop,TS val 3813837004 ecr 944543614], length 1314
08:23:32.526491 IP 185.42.204.250.1935 > 10.8.3.4.47646: Flags [.], ack 104107, win 126, options [nop,nop,TS val 944543703 ecr 3813836545], length 0
08:23:32.548083 IP 10.8.3.4.47646 > 185.42.204.250.1935: Flags [.], seq 116645:117959, ack 0, win 501, options [nop,nop,TS val 3813837038 ecr 944543703], length 1314
08:23:32.588465 IP 10.8.3.4.47646 > 185.42.204.250.1935: Flags [.], seq 117959:119273, ack 0, win 501, options [nop,nop,TS val 3813837079 ecr 944543703], length 1314
08:23:32.629575 IP 185.42.204.250.1935 > 10.8.3.4.47646: Flags [.], ack 106735, win 126, options [nop,nop,TS val 944543806 ecr 3813836609], length 0
08:23:32.634530 IP 185.42.204.250.1935 > 10.8.3.4.47646: Flags [.], ack 107447, win 126, options [nop,nop,TS val 944543812 ecr 3813836678], length 0
08:23:32.634551 IP 10.8.3.4.47646 > 185.42.204.250.1935: Flags [P.], seq 119273:120461, ack 0, win 501, options [nop,nop,TS val 3813837125 ecr 944543812], length 1188
08:23:32.677474 IP 10.8.3.4.47646 > 185.42.204.250.1935: Flags [.], seq 120461:121775, ack 0, win 501, options [nop,nop,TS val 3813837168 ecr 944543812], length 1314
08:23:32.716051 IP 10.8.3.4.47646 > 185.42.204.250.1935: Flags [.], seq 121775:123089, ack 0, win 501, options [nop,nop,TS val 3813837206 ecr 944543812], length 1314
08:23:32.735961 IP 185.42.204.250.1935 > 10.8.3.4.47646: Flags [.], ack 110075, win 126, options [nop,nop,TS val 944543913 ecr 3813836737], length 0
08:23:32.758903 IP 10.8.3.4.47646 > 185.42.204.250.1935: Flags [.], seq 123089:124403, ack 0, win 501, options [nop,nop,TS val 3813837249 ecr 944543913], length 1314
08:23:32.822877 IP 10.8.3.4.47646 > 185.42.204.250.1935: Flags [.], seq 124403:125717, ack 0, win 501, options [nop,nop,TS val 3813837313 ecr 944543913], length 1314
08:23:32.823109 IP 185.42.204.250.1935 > 10.8.3.4.47646: Flags [.], ack 111389, win 126, options [nop,nop,TS val 944544000 ecr 3813836802], length 0
08:23:32.844798 IP 10.8.3.4.47646 > 185.42.204.250.1935: Flags [.], seq 125717:127031, ack 0, win 501, options [nop,nop,TS val 3813837335 ecr 944544000], length 1314
08:23:32.864500 IP 185.42.204.250.1935 > 10.8.3.4.47646: Flags [.], ack 114017, win 126, options [nop,nop,TS val 944544042 ecr 3813836869], length 0
08:23:32.886832 IP 10.8.3.4.47646 > 185.42.204.250.1935: Flags [.], seq 127031:128345, ack 0, win 501, options [nop,nop,TS val 3813837377 ecr 944544042], length 1314
08:23:32.950942 IP 10.8.3.4.47646 > 185.42.204.250.1935: Flags [.], seq 128345:129659, ack 0, win 501, options [nop,nop,TS val 3813837441 ecr 944544042], length 1314
08:23:32.960681 IP 185.42.204.250.1935 > 10.8.3.4.47646: Flags [.], ack 116645, win 126, options [nop,nop,TS val 944544138 ecr 3813836934], length 0
08:23:32.976533 IP 10.8.3.4.47646 > 185.42.204.250.1935: Flags [.], seq 129659:130973, ack 0, win 501, options [nop,nop,TS val 3813837467 ecr 944544138], length 1314
08:23:33.014621 IP 10.8.3.4.47646 > 185.42.204.250.1935: Flags [.], seq 130973:132287, ack 0, win 501, options [nop,nop,TS val 3813837505 ecr 944544138], length 1314
08:23:33.035545 IP 185.42.204.250.1935 > 10.8.3.4.47646: Flags [.], ack 119273, win 126, options [nop,nop,TS val 944544212 ecr 3813837038], length 0
08:23:33.081216 IP 10.8.3.4.47646 > 185.42.204.250.1935: Flags [.], seq 132287:133601, ack 0, win 501, options [nop,nop,TS val 3813837572 ecr 944544212], length 1314
08:23:33.081271 IP 185.42.204.250.1935 > 10.8.3.4.47646: Flags [.], ack 120461, win 126, options [nop,nop,TS val 944544258 ecr 3813837125], length 0
08:23:33.081315 IP 10.8.3.4.47646 > 185.42.204.250.1935: Flags [P.], seq 133601:134305, ack 0, win 501, options [nop,nop,TS val 3813837572 ecr 944544258], length 704
08:23:33.143736 IP 10.8.3.4.47646 > 185.42.204.250.1935: Flags [.], seq 134305:135619, ack 0, win 501, options [nop,nop,TS val 3813837634 ecr 944544258], length 1314
08:23:33.162963 IP 185.42.204.250.1935 > 10.8.3.4.47646: Flags [.], ack 123089, win 126, options [nop,nop,TS val 944544340 ecr 3813837168], length 0
08:23:33.185702 IP 10.8.3.4.47646 > 185.42.204.250.1935: Flags [.], seq 135619:136933, ack 0, win 501, options [nop,nop,TS val 3813837676 ecr 944544340], length 1314
08:23:33.214517 IP 10.8.3.4.47646 > 185.42.204.250.1935: Flags [.], seq 136933:138247, ack 0, win 501, options [nop,nop,TS val 3813837705 ecr 944544340], length 1314
08:23:33.269935 IP 185.42.204.250.1935 > 10.8.3.4.47646: Flags [.], ack 125717, win 126, options [nop,nop,TS val 944544447 ecr 3813837249], length 0
08:23:33.278438 IP 10.8.3.4.47646 > 185.42.204.250.1935: Flags [.], seq 138247:139561, ack 0, win 501, options [nop,nop,TS val 3813837769 ecr 944544447], length 1314
08:23:33.313789 IP 10.8.3.4.47646 > 185.42.204.250.1935: Flags [.], seq 139561:140875, ack 0, win 501, options [nop,nop,TS val 3813837804 ecr 944544447], length 1314
08:23:33.333693 IP 185.42.204.250.1935 > 10.8.3.4.47646: Flags [.], ack 128345, win 126, options [nop,nop,TS val 944544511 ecr 3813837335], length 0
08:23:33.356562 IP 10.8.3.4.47646 > 185.42.204.250.1935: Flags [.], seq 140875:142189, ack 0, win 501, options [nop,nop,TS val 3813837847 ecr 944544511], length 1314
08:23:33.420888 IP 10.8.3.4.47646 > 185.42.204.250.1935: Flags [.], seq 142189:143503, ack 0, win 501, options [nop,nop,TS val 3813837911 ecr 944544511], length 1314
08:23:33.423616 IP 185.42.204.250.1935 > 10.8.3.4.47646: Flags [.], ack 130973, win 126, options [nop,nop,TS val 944544600 ecr 3813837441], length 0
08:23:33.444561 IP 10.8.3.4.47646 > 185.42.204.250.1935: Flags [.], seq 143503:144817, ack 0, win 501, options [nop,nop,TS val 3813837935 ecr 944544600], length 1314
08:23:33.484598 IP 10.8.3.4.47646 > 185.42.204.250.1935: Flags [.], seq 144817:146131, ack 0, win 501, options [nop,nop,TS val 3813837975 ecr 944544600], length 1314
08:23:33.528321 IP 185.42.204.250.1935 > 10.8.3.4.47646: Flags [.], ack 133601, win 126, options [nop,nop,TS val 944544705 ecr 3813837505], length 0
08:23:33.528338 IP 185.42.204.250.1935 > 10.8.3.4.47646: Flags [.], ack 134305, win 126, options [nop,nop,TS val 944544705 ecr 3813837572], length 0
08:23:33.528346 IP 10.8.3.4.47646 > 185.42.204.250.1935: Flags [P.], seq 146131:147324, ack 0, win 501, options [nop,nop,TS val 3813838019 ecr 944544705], length 1193
08:23:33.580467 IP 10.8.3.4.47646 > 185.42.204.250.1935: Flags [.], seq 147324:148638, ack 0, win 501, options [nop,nop,TS val 3813838071 ecr 944544705], length 1314
08:23:33.612070 IP 10.8.3.4.47646 > 185.42.204.250.1935: Flags [.], seq 148638:149952, ack 0, win 501, options [nop,nop,TS val 3813838102 ecr 944544705], length 1314
08:23:33.632733 IP 185.42.204.250.1935 > 10.8.3.4.47646: Flags [.], ack 136933, win 126, options [nop,nop,TS val 944544810 ecr 3813837634], length 0
08:23:33.654491 IP 10.8.3.4.47646 > 185.42.204.250.1935: Flags [.], seq 149952:151266, ack 0, win 501, options [nop,nop,TS val 3813838145 ecr 944544810], length 1314
08:23:33.718982 IP 10.8.3.4.47646 > 185.42.204.250.1935: Flags [.], seq 151266:152580, ack 0, win 501, options [nop,nop,TS val 3813838209 ecr 944544810], length 1314
08:23:33.725607 IP 185.42.204.250.1935 > 10.8.3.4.47646: Flags [.], ack 139561, win 126, options [nop,nop,TS val 944544902 ecr 3813837705], length 0
08:23:33.747890 IP 10.8.3.4.47646 > 185.42.204.250.1935: Flags [.], seq 152580:153894, ack 0, win 501, options [nop,nop,TS val 3813838238 ecr 944544902], length 1314
08:23:33.783491 IP 10.8.3.4.47646 > 185.42.204.250.1935: Flags [.], seq 153894:155208, ack 0, win 501, options [nop,nop,TS val 3813838274 ecr 944544902], length 1314
08:23:33.803957 IP 185.42.204.250.1935 > 10.8.3.4.47646: Flags [.], ack 142189, win 126, options [nop,nop,TS val 944544981 ecr 3813837804], length 0
08:23:33.847521 IP 10.8.3.4.47646 > 185.42.204.250.1935: Flags [.], seq 155208:156522, ack 0, win 501, options [nop,nop,TS val 3813838338 ecr 944544981], length 1314
08:23:33.890482 IP 10.8.3.4.47646 > 185.42.204.250.1935: Flags [.], seq 156522:157836, ack 0, win 501, options [nop,nop,TS val 3813838381 ecr 944544981], length 1314
08:23:33.891573 IP 185.42.204.250.1935 > 10.8.3.4.47646: Flags [.], ack 144817, win 126, options [nop,nop,TS val 944545069 ecr 3813837911], length 0
08:23:33.914419 IP 10.8.3.4.47646 > 185.42.204.250.1935: Flags [.], seq 157836:159150, ack 0, win 501, options [nop,nop,TS val 3813838405 ecr 944545069], length 1314
08:23:33.975761 IP 185.42.204.250.1935 > 10.8.3.4.47646: Flags [.], ack 147324, win 126, options [nop,nop,TS val 944545152 ecr 3813837975], length 0
08:23:33.975788 IP 10.8.3.4.47646 > 185.42.204.250.1935: Flags [P.], seq 159150:160230, ack 0, win 501, options [nop,nop,TS val 3813838466 ecr 944545152], length 1080
08:23:34.018520 IP 10.8.3.4.47646 > 185.42.204.250.1935: Flags [.], seq 160230:161544, ack 0, win 501, options [nop,nop,TS val 3813838509 ecr 944545152], length 1314
08:23:34.043371 IP 10.8.3.4.47646 > 185.42.204.250.1935: Flags [.], seq 161544:162858, ack 0, win 501, options [nop,nop,TS val 3813838534 ecr 944545152], length 1314
08:23:34.059340 IP 185.42.204.250.1935 > 10.8.3.4.47646: Flags [.], ack 149952, win 126, options [nop,nop,TS val 944545236 ecr 3813838071], length 0
08:23:34.082246 IP 10.8.3.4.47646 > 185.42.204.250.1935: Flags [.], seq 162858:164172, ack 0, win 501, options [nop,nop,TS val 3813838573 ecr 944545236], length 1314
08:23:34.147702 IP 10.8.3.4.47646 > 185.42.204.250.1935: Flags [.], seq 164172:165486, ack 0, win 501, options [nop,nop,TS val 3813838638 ecr 944545236], length 1314
08:23:34.166121 IP 185.42.204.250.1935 > 10.8.3.4.47646: Flags [.], ack 152580, win 126, options [nop,nop,TS val 944545343 ecr 3813838145], length 0
08:23:34.188981 IP 10.8.3.4.47646 > 185.42.204.250.1935: Flags [.], seq 165486:166800, ack 0, win 501, options [nop,nop,TS val 3813838679 ecr 944545343], length 1314
08:23:34.212068 IP 10.8.3.4.47646 > 185.42.204.250.1935: Flags [.], seq 166800:168114, ack 0, win 501, options [nop,nop,TS val 3813838702 ecr 944545343], length 1314
08:23:34.230971 IP 185.42.204.250.1935 > 10.8.3.4.47646: Flags [.], ack 155208, win 126, options [nop,nop,TS val 944545408 ecr 3813838238], length 0
08:23:34.280902 IP 10.8.3.4.47646 > 185.42.204.250.1935: Flags [.], seq 168114:169428, ack 0, win 501, options [nop,nop,TS val 3813838771 ecr 944545408], length 1314
08:23:34.317954 IP 10.8.3.4.47646 > 185.42.204.250.1935: Flags [.], seq 169428:170742, ack 0, win 501, options [nop,nop,TS val 3813838808 ecr 944545408], length 1314
08:23:34.337983 IP 185.42.204.250.1935 > 10.8.3.4.47646: Flags [.], ack 157836, win 126, options [nop,nop,TS val 944545515 ecr 3813838338], length 0
08:23:34.339499 IP 10.8.3.4.47646 > 185.42.204.250.1935: Flags [.], seq 170742:172056, ack 0, win 501, options [nop,nop,TS val 3813838830 ecr 944545515], length 1314
08:23:34.413781 IP 10.8.3.4.47646 > 185.42.204.250.1935: Flags [.], seq 172056:173370, ack 0, win 501, options [nop,nop,TS val 3813838904 ecr 944545515], length 1314
08:23:34.422953 IP 185.42.204.250.1935 > 10.8.3.4.47646: Flags [.], ack 160230, win 126, options [nop,nop,TS val 944545600 ecr 3813838405], length 0
08:23:34.422998 IP 10.8.3.4.47646 > 185.42.204.250.1935: Flags [P.], seq 173370:174186, ack 0, win 501, options [nop,nop,TS val 3813838913 ecr 944545600], length 816
08:23:34.478374 IP 10.8.3.4.47646 > 185.42.204.250.1935: Flags [.], seq 174186:175500, ack 0, win 501, options [nop,nop,TS val 3813838969 ecr 944545600], length 1314
08:23:34.490343 IP 185.42.204.250.1935 > 10.8.3.4.47646: Flags [.], ack 162858, win 126, options [nop,nop,TS val 944545667 ecr 3813838509], length 0
08:23:34.510544 IP 10.8.3.4.47646 > 185.42.204.250.1935: Flags [.], seq 175500:176814, ack 0, win 501, options [nop,nop,TS val 3813839001 ecr 944545667], length 1314
08:23:34.547787 IP 10.8.3.4.47646 > 185.42.204.250.1935: Flags [.], seq 176814:178128, ack 0, win 501, options [nop,nop,TS val 3813839038 ecr 944545667], length 1314
08:23:34.594943 IP 185.42.204.250.1935 > 10.8.3.4.47646: Flags [.], ack 165486, win 126, options [nop,nop,TS val 944545772 ecr 3813838573], length 0
08:23:34.612553 IP 10.8.3.4.47646 > 185.42.204.250.1935: Flags [.], seq 178128:179442, ack 0, win 501, options [nop,nop,TS val 3813839103 ecr 944545772], length 1314
08:23:34.639004 IP 10.8.3.4.47646 > 185.42.204.250.1935: Flags [.], seq 179442:180756, ack 0, win 501, options [nop,nop,TS val 3813839129 ecr 944545772], length 1314
08:23:34.659148 IP 185.42.204.250.1935 > 10.8.3.4.47646: Flags [.], ack 168114, win 126, options [nop,nop,TS val 944545836 ecr 3813838679], length 0
08:23:34.680052 IP 10.8.3.4.47646 > 185.42.204.250.1935: Flags [.], seq 180756:182070, ack 0, win 501, options [nop,nop,TS val 3813839170 ecr 944545836], length 1314
08:23:34.746005 IP 10.8.3.4.47646 > 185.42.204.250.1935: Flags [.], seq 182070:183384, ack 0, win 501, options [nop,nop,TS val 3813839236 ecr 944545836], length 1314
08:23:34.764976 IP 185.42.204.250.1935 > 10.8.3.4.47646: Flags [.], ack 170742, win 126, options [nop,nop,TS val 944545942 ecr 3813838771], length 0
08:23:34.778838 IP 10.8.3.4.47646 > 185.42.204.250.1935: Flags [.], seq 183384:184698, ack 0, win 501, options [nop,nop,TS val 3813839269 ecr 944545942], length 1314
08:23:34.810009 IP 10.8.3.4.47646 > 185.42.204.250.1935: Flags [.], seq 184698:186012, ack 0, win 501, options [nop,nop,TS val 3813839300 ecr 944545942], length 1314
08:23:34.839383 IP 185.42.204.250.1935 > 10.8.3.4.47646: Flags [.], ack 172056, win 126, options [nop,nop,TS val 944546016 ecr 3813838830], length 0
08:23:34.870041 IP 185.42.204.250.1935 > 10.8.3.4.47646: Flags [.], ack 174186, win 126, options [nop,nop,TS val 944546047 ecr 3813838904], length 0
08:23:34.870098 IP 10.8.3.4.47646 > 185.42.204.250.1935: Flags [P.], seq 186012:187187, ack 0, win 501, options [nop,nop,TS val 3813839360 ecr 944546047], length 1175
08:23:34.913977 IP 10.8.3.4.47646 > 185.42.204.250.1935: Flags [.], seq 187187:188501, ack 0, win 501, options [nop,nop,TS val 3813839404 ecr 944546047], length 1314
08:23:34.945727 IP 10.8.3.4.47646 > 185.42.204.250.1935: Flags [.], seq 188501:189815, ack 0, win 501, options [nop,nop,TS val 3813839436 ecr 944546047], length 1314
08:23:34.957318 IP 185.42.204.250.1935 > 10.8.3.4.47646: Flags [.], ack 176814, win 126, options [nop,nop,TS val 944546134 ecr 3813838969], length 0
08:23:34.981360 IP 10.8.3.4.47646 > 185.42.204.250.1935: Flags [.], seq 189815:191129, ack 0, win 501, options [nop,nop,TS val 3813839472 ecr 944546134], length 1314
08:23:35.044559 IP 10.8.3.4.47646 > 185.42.204.250.1935: Flags [.], seq 191129:192443, ack 0, win 501, options [nop,nop,TS val 3813839535 ecr 944546134], length 1314
08:23:35.059592 IP 185.42.204.250.1935 > 10.8.3.4.47646: Flags [.], ack 179442, win 126, options [nop,nop,TS val 944546237 ecr 3813839038], length 0
08:23:35.078067 IP 10.8.3.4.47646 > 185.42.204.250.1935: Flags [.], seq 192443:193757, ack 0, win 501, options [nop,nop,TS val 3813839568 ecr 944546237], length 1314
08:23:35.110213 IP 10.8.3.4.47646 > 185.42.204.250.1935: Flags [.], seq 193757:195071, ack 0, win 501, options [nop,nop,TS val 3813839601 ecr 944546237], length 1314
08:23:35.126785 IP 185.42.204.250.1935 > 10.8.3.4.47646: Flags [.], ack 182070, win 126, options [nop,nop,TS val 944546304 ecr 3813839129], length 0
08:23:35.173056 IP 10.8.3.4.47646 > 185.42.204.250.1935: Flags [.], seq 195071:196385, ack 0, win 501, options [nop,nop,TS val 3813839663 ecr 944546304], length 1314
08:23:35.214207 IP 10.8.3.4.47646 > 185.42.204.250.1935: Flags [.], seq 196385:197699, ack 0, win 501, options [nop,nop,TS val 3813839705 ecr 944546304], length 1314
08:23:35.225766 IP 185.42.204.250.1935 > 10.8.3.4.47646: Flags [.], ack 184698, win 126, options [nop,nop,TS val 944546403 ecr 3813839236], length 0
08:23:35.247292 IP 10.8.3.4.47646 > 185.42.204.250.1935: Flags [.], seq 197699:199013, ack 0, win 501, options [nop,nop,TS val 3813839738 ecr 944546403], length 1314
08:23:35.310622 IP 10.8.3.4.47646 > 185.42.204.250.1935: Flags [.], seq 199013:200327, ack 0, win 501, options [nop,nop,TS val 3813839801 ecr 944546403], length 1314
08:23:35.316955 IP 185.42.204.250.1935 > 10.8.3.4.47646: Flags [.], ack 187187, win 126, options [nop,nop,TS val 944546494 ecr 3813839300], length 0
08:23:35.316989 IP 10.8.3.4.47646 > 185.42.204.250.1935: Flags [P.], seq 200327:201044, ack 0, win 501, options [nop,nop,TS val 3813839807 ecr 944546494], length 717
08:23:35.376805 IP 10.8.3.4.47646 > 185.42.204.250.1935: Flags [.], seq 201044:202358, ack 0, win 501, options [nop,nop,TS val 3813839867 ecr 944546494], length 1314
08:23:35.392765 IP 185.42.204.250.1935 > 10.8.3.4.47646: Flags [.], ack 189815, win 126, options [nop,nop,TS val 944546570 ecr 3813839404], length 0
08:23:35.407706 IP 10.8.3.4.47646 > 185.42.204.250.1935: Flags [.], seq 202358:203672, ack 0, win 501, options [nop,nop,TS val 3813839898 ecr 944546570], length 1314
08:23:35.447664 IP 10.8.3.4.47646 > 185.42.204.250.1935: Flags [.], seq 203672:204986, ack 0, win 501, options [nop,nop,TS val 3813839938 ecr 944546570], length 1314
08:23:35.491647 IP 185.42.204.250.1935 > 10.8.3.4.47646: Flags [.], ack 192443, win 126, options [nop,nop,TS val 944546669 ecr 3813839472], length 0
08:23:35.511568 IP 10.8.3.4.47646 > 185.42.204.250.1935: Flags [.], seq 204986:206300, ack 0, win 501, options [nop,nop,TS val 3813840002 ecr 944546669], length 1314
08:23:35.543842 IP 10.8.3.4.47646 > 185.42.204.250.1935: Flags [.], seq 206300:207614, ack 0, win 501, options [nop,nop,TS val 3813840034 ecr 944546669], length 1314
08:23:35.557364 IP 185.42.204.250.1935 > 10.8.3.4.47646: Flags [.], ack 195071, win 126, options [nop,nop,TS val 944546734 ecr 3813839568], length 0
08:23:35.577908 IP 10.8.3.4.47646 > 185.42.204.250.1935: Flags [.], seq 207614:208928, ack 0, win 501, options [nop,nop,TS val 3813840068 ecr 944546734], length 1314
08:23:35.642630 IP 10.8.3.4.47646 > 185.42.204.250.1935: Flags [.], seq 208928:210242, ack 0, win 501, options [nop,nop,TS val 3813840133 ecr 944546734], length 1314
08:23:35.661369 IP 185.42.204.250.1935 > 10.8.3.4.47646: Flags [.], ack 197699, win 126, options [nop,nop,TS val 944546838 ecr 3813839663], length 0
08:23:35.678558 IP 10.8.3.4.47646 > 185.42.204.250.1935: Flags [.], seq 210242:211556, ack 0, win 501, options [nop,nop,TS val 3813840169 ecr 944546838], length 1314
08:23:35.706653 IP 10.8.3.4.47646 > 185.42.204.250.1935: Flags [.], seq 211556:212870, ack 0, win 501, options [nop,nop,TS val 3813840197 ecr 944546838], length 1314
08:23:35.757782 IP 185.42.204.250.1935 > 10.8.3.4.47646: Flags [.], ack 200327, win 126, options [nop,nop,TS val 944546935 ecr 3813839738], length 0
08:23:35.764996 IP 185.42.204.250.1935 > 10.8.3.4.47646: Flags [.], ack 201044, win 126, options [nop,nop,TS val 944546942 ecr 3813839807], length 0
08:23:35.765033 IP 10.8.3.4.47646 > 185.42.204.250.1935: Flags [P.], seq 212870:214054, ack 0, win 501, options [nop,nop,TS val 3813840255 ecr 944546942], length 1184
08:23:35.814053 IP 10.8.3.4.47646 > 185.42.204.250.1935: Flags [.], seq 214054:215368, ack 0, win 501, options [nop,nop,TS val 3813840304 ecr 944546942], length 1314
08:23:35.847727 IP 10.8.3.4.47646 > 185.42.204.250.1935: Flags [.], seq 215368:216682, ack 0, win 501, options [nop,nop,TS val 3813840338 ecr 944546942], length 1314
08:23:35.855019 IP 185.42.204.250.1935 > 10.8.3.4.47646: Flags [.], ack 203672, win 126, options [nop,nop,TS val 944547032 ecr 3813839867], length 0
08:23:35.880994 IP 10.8.3.4.47646 > 185.42.204.250.1935: Flags [.], seq 216682:217996, ack 0, win 501, options [nop,nop,TS val 3813840371 ecr 944547032], length 1314
08:23:35.942819 IP 10.8.3.4.47646 > 185.42.204.250.1935: Flags [.], seq 217996:219310, ack 0, win 501, options [nop,nop,TS val 3813840433 ecr 944547032], length 1314
08:23:35.958440 IP 185.42.204.250.1935 > 10.8.3.4.47646: Flags [.], ack 206300, win 126, options [nop,nop,TS val 944547136 ecr 3813839938], length 0
08:23:35.977280 IP 10.8.3.4.47646 > 185.42.204.250.1935: Flags [.], seq 219310:220624, ack 0, win 501, options [nop,nop,TS val 3813840468 ecr 944547136], length 1314
08:23:36.011685 IP 10.8.3.4.47646 > 185.42.204.250.1935: Flags [.], seq 220624:221938, ack 0, win 501, options [nop,nop,TS val 3813840502 ecr 944547136], length 1314
