12:54:15.775043 IP 10.8.1.4.57718 > 99.181.96.150.1935: Flags [.], seq 1116494910:1116496224, ack 1085459527, win 501, options [nop,nop,TS val 315862448 ecr 874306997], length 1314
12:54:15.816338 IP 99.181.96.150.1935 > 10.8.1.4.57718: Flags [.], ack 4294957853, win 352, options [nop,nop,TS val 874307061 ecr 315862049], length 0
12:54:15.839376 IP 10.8.1.4.57718 > 99.181.96.150.1935: Flags [.], seq 1314:2628, ack 1, win 501, options [nop,nop,TS val 315862513 ecr 874307061], length 1314
12:54:15.881990 IP 10.8.1.4.57718 > 99.181.96.150.1935: Flags [.], seq 2628:3942, ack 1, win 501, options [nop,nop,TS val 315862555 ecr 874307061], length 1314
12:54:15.908993 IP 10.8.1.4.57718 > 99.181.96.150.1935: Flags [.], seq 3942:5256, ack 1, win 501, options [nop,nop,TS val 315862582 ecr 874307061], length 1314
12:54:15.916020 IP 99.181.96.150.1935 > 10.8.1.4.57718: Flags [.], ack 4294960481, win 352, options [nop,nop,TS val 874307161 ecr 315862152], length 0
12:54:15.967231 IP 10.8.1.4.57718 > 99.181.96.150.1935: Flags [.], seq 5256:6570, ack 1, win 501, options [nop,nop,TS val 315862641 ecr 874307161], length 1314
12:54:15.982368 IP 99.181.96.150.1935 > 10.8.1.4.57718: Flags [.], ack 4294962040, win 353, options [nop,nop,TS val 874307227 ecr 315862217], length 0
12:54:15.982396 IP 10.8.1.4.57718 > 99.181.96.150.1935: Flags [P.], seq 6570:7460, ack 1, win 501, options [nop,nop,TS val 315862656 ecr 874307227], length 890
12:54:16.041512 IP 10.8.1.4.57718 > 99.181.96.150.1935: Flags [.], seq 7460:8774, ack 1, win 501, options [nop,nop,TS val 315862715 ecr 874307227], length 1314
12:54:16.051243 IP 99.181.96.150.1935 > 10.8.1.4.57718: Flags [.], ack 4294964668, win 353, options [nop,nop,TS val 874307296 ecr 315862281], length 0
12:54:16.076553 IP 10.8.1.4.57718 > 99.181.96.150.1935: Flags [.], seq 8774:10088, ack 1, win 501, options [nop,nop,TS val 315862750 ecr 874307296], length 1314
12:54:16.116303 IP 10.8.1.4.57718 > 99.181.96.150.1935: Flags [.], seq 10088:11402, ack 1, win 501, options [nop,nop,TS val 315862790 ecr 874307296], length 1314
12:54:16.145309 IP 99.181.96.150.1935 > 10.8.1.4.57718: Flags [.], ack 0, win 353, options [nop,nop,TS val 874307390 ecr 315862385], length 0
12:54:16.180751 IP 10.8.1.4.57718 > 99.181.96.150.1935: Flags [.], seq 11402:12716, ack 1, win 501, options [nop,nop,TS val 315862854 ecr 874307390], length 1314
12:54:16.211439 IP 10.8.1.4.57718 > 99.181.96.150.1935: Flags [.], seq 12716:14030, ack 1, win 501, options [nop,nop,TS val 315862885 ecr 874307390], length 1314
12:54:16.243469 IP 99.181.96.150.1935 > 10.8.1.4.57718: Flags [.], ack 2628, win 352, options [nop,nop,TS val 874307489 ecr 315862448], length 0
12:54:16.245367 IP 10.8.1.4.57718 > 99.181.96.150.1935: Flags [.], seq 14030:15344, ack 1, win 501, options [nop,nop,TS val 315862919 ecr 874307489], length 1314
12:54:16.309079 IP 10.8.1.4.57718 > 99.181.96.150.1935: Flags [.], seq 15344:16658, ack 1, win 501, options [nop,nop,TS val 315862982 ecr 874307489], length 1314
12:54:16.314038 IP 99.181.96.150.1935 > 10.8.1.4.57718: Flags [.], ack 5256, win 352, options [nop,nop,TS val 874307558 ecr 315862555], length 0
12:54:16.342105 IP 10.8.1.4.57718 > 99.181.96.150.1935: Flags [.], seq 16658:17972, ack 1, win 501, options [nop,nop,TS val 315863015 ecr 874307558], length 1314
12:54:16.375765 IP 10.8.1.4.57718 > 99.181.96.150.1935: Flags [.], seq 17972:19286, ack 1, win 501, options [nop,nop,TS val 315863049 ecr 874307558], length 1314
12:54:16.386462 IP 99.181.96.150.1935 > 10.8.1.4.57718: Flags [.], ack 7460, win 353, options [nop,nop,TS val 874307632 ecr 315862641], length 0
12:54:16.386478 IP 10.8.1.4.57718 > 99.181.96.150.1935: Flags [P.], seq 19286:19440, ack 1, win 501, options [nop,nop,TS val 315863060 ecr 874307632], length 154
12:54:16.444089 IP 10.8.1.4.57718 > 99.181.96.150.1935: Flags [.], seq 19440:20754, ack 1, win 501, options [nop,nop,TS val 315863117 ecr 874307632], length 1314
12:54:16.479481 IP 10.8.1.4.57718 > 99.181.96.150.1935: Flags [.], seq 20754:22068, ack 1, win 501, options [nop,nop,TS val 315863153 ecr 874307632], length 1314
12:54:16.480733 IP 99.181.96.150.1935 > 10.8.1.4.57718: Flags [.], ack 10088, win 353, options [nop,nop,TS val 874307726 ecr 315862715], length 0
12:54:16.511457 IP 10.8.1.4.57718 > 99.181.96.150.1935: Flags [.], seq 22068:23382, ack 1, win 501, options [nop,nop,TS val 315863185 ecr 874307726], length 1314
12:54:16.577725 IP 10.8.1.4.57718 > 99.181.96.150.1935: Flags [.], seq 23382:24696, ack 1, win 501, options [nop,nop,TS val 315863251 ecr 874307726], length 1314
12:54:16.584711 IP 99.181.96.150.1935 > 10.8.1.4.57718: Flags [.], ack 12716, win 352, options [nop,nop,TS val 874307830 ecr 315862790], length 0
12:54:16.611058 IP 10.8.1.4.57718 > 99.181.96.150.1935: Flags [.], seq 24696:26010, ack 1, win 501, options [nop,nop,TS val 315863284 ecr 874307830], length 1314
12:54:16.649522 IP 99.181.96.150.1935 > 10.8.1.4.57718: Flags [.], ack 15344, win 352, options [nop,nop,TS val 874307895 ecr 315862885], length 0
12:54:16.650990 IP 10.8.1.4.57718 > 99.181.96.150.1935: Flags [.], seq 26010:27324, ack 1, win 501, options [nop,nop,TS val 315863324 ecr 874307895], length 1314
12:54:16.715121 IP 10.8.1.4.57718 > 99.181.96.150.1935: Flags [.], seq 27324:28638, ack 1, win 501, options [nop,nop,TS val 315863388 ecr 874307895], length 1314
12:54:16.744781 IP 10.8.1.4.57718 > 99.181.96.150.1935: Flags [.], seq 28638:29952, ack 1, win 501, options [nop,nop,TS val 315863418 ecr 874307895], length 1314
12:54:16.746304 IP 99.181.96.150.1935 > 10.8.1.4.57718: Flags [.], ack 17972, win 352, options [nop,nop,TS val 874307991 ecr 315862982], length 0
12:54:16.779354 IP 10.8.1.4.57718 > 99.181.96.150.1935: Flags [.], seq 29952:31266, ack 1, win 501, options [nop,nop,TS val 315863453 ecr 874307991], length 1314
12:54:16.790362 IP 99.181.96.150.1935 > 10.8.1.4.57718: Flags [.], ack 19440, win 353, options [nop,nop,TS val 874308035 ecr 315863049], length 0
12:54:16.790396 IP 10.8.1.4.57718 > 99.181.96.150.1935: Flags [P.], seq 31266:31403, ack 1, win 501, options [nop,nop,TS val 315863464 ecr 874308035], length 137
12:54:16.844089 IP 10.8.1.4.57718 > 99.181.96.150.1935: Flags [.], seq 31403:32717, ack 1, win 501, options [nop,nop,TS val 315863517 ecr 874308035], length 1314
12:54:16.877260 IP 10.8.1.4.57718 > 99.181.96.150.1935: Flags [.], seq 32717:34031, ack 1, win 501, options [nop,nop,TS val 315863551 ecr 874308035], length 1314
12:54:16.883531 IP 99.181.96.150.1935 > 10.8.1.4.57718: Flags [.], ack 22068, win 353, options [nop,nop,TS val 874308129 ecr 315863117], length 0
12:54:16.910921 IP 10.8.1.4.57718 > 99.181.96.150.1935: Flags [.], seq 34031:35345, ack 1, win 501, options [nop,nop,TS val 315863584 ecr 874308129], length 1314
12:54:16.975777 IP 10.8.1.4.57718 > 99.181.96.150.1935: Flags [.], seq 35345:36659, ack 1, win 501, options [nop,nop,TS val 315863649 ecr 874308129], length 1314
12:54:16.982004 IP 99.181.96.150.1935 > 10.8.1.4.57718: Flags [.], ack 24696, win 352, options [nop,nop,TS val 874308227 ecr 315863185], length 0
12:54:17.014051 IP 10.8.1.4.57718 > 99.181.96.150.1935: Flags [.], seq 36659:37973, ack 1, win 501, options [nop,nop,TS val 315863687 ecr 874308227], length 1314
12:54:17.047428 IP 10.8.1.4.57718 > 99.181.96.150.1935: Flags [.], seq 37973:39287, ack 1, win 501, options [nop,nop,TS val 315863721 ecr 874308227], length 1314
12:54:17.055076 IP 99.181.96.150.1935 > 10.8.1.4.57718: Flags [.], ack 27324, win 352, options [nop,nop,TS val 874308300 ecr 315863284], length 0
12:54:17.109083 IP 10.8.1.4.57718 > 99.181.96.150.1935: Flags [.], seq 39287:40601, ack 1, win 501, options [nop,nop,TS val 315863782 ecr 874308300], length 1314
12:54:17.143945 IP 10.8.1.4.57718 > 99.181.96.150.1935: Flags [.], seq 40601:41915, ack 1, win 501, options [nop,nop,TS val 315863817 ecr 874308300], length 1314
12:54:17.149772 IP 99.181.96.150.1935 > 10.8.1.4.57718: Flags [.], ack 29952, win 352, options [nop,nop,TS val 874308394 ecr 315863388], length 0
12:54:17.185307 IP 10.8.1.4.57718 > 99.181.96.150.1935: Flags [.], seq 41915:43229, ack 1, win 501, options [nop,nop,TS val 315863859 ecr 874308394], length 1314
12:54:17.195280 IP 99.181.96.150.1935 > 10.8.1.4.57718: Flags [.], ack 31403, win 353, options [nop,nop,TS val 874308440 ecr 315863453], length 0
12:54:17.195308 IP 10.8.1.4.57718 > 99.181.96.150.1935: Flags [P.], seq 43229:43378, ack 1, win 501, options [nop,nop,TS val 315863869 ecr 874308440], length 149
12:54:17.249269 IP 10.8.1.4.57718 > 99.181.96.150.1935: Flags [.], seq 43378:44692, ack 1, win 501, options [nop,nop,TS val 315863923 ecr 874308440], length 1314
12:54:17.277925 IP 10.8.1.4.57718 > 99.181.96.150.1935: Flags [.], seq 44692:46006, ack 1, win 501, options [nop,nop,TS val 315863951 ecr 874308440], length 1314
12:54:17.281521 IP 99.181.96.150.1935 > 10.8.1.4.57718: Flags [.], ack 34031, win 353, options [nop,nop,TS val 874308527 ecr 315863517], length 0
12:54:17.313431 IP 10.8.1.4.57718 > 99.181.96.150.1935: Flags [.], seq 46006:47320, ack 1, win 501, options [nop,nop,TS val 315863987 ecr 874308527], length 1314
12:54:17.376973 IP 10.8.1.4.57718 > 99.181.96.150.1935: Flags [.], seq 47320:48634, ack 1, win 501, options [nop,nop,TS val 315864050 ecr 874308527], length 1314
12:54:17.379868 IP 99.181.96.150.1935 > 10.8.1.4.57718: Flags [.], ack 36659, win 352, options [nop,nop,TS val 874308625 ecr 315863584], length 0
12:54:17.412137 IP 10.8.1.4.57718 > 99.181.96.150.1935: Flags [.], seq 48634:49948, ack 1, win 501, options [nop,nop,TS val 315864085 ecr 874308625], length 1314
12:54:17.446178 IP 10.8.1.4.57718 > 99.181.96.150.1935: Flags [.], seq 49948:51262, ack 1, win 501, options [nop,nop,TS val 315864119 ecr 874308625], length 1314
12:54:17.452117 IP 99.181.96.150.1935 > 10.8.1.4.57718: Flags [.], ack 39287, win 352, options [nop,nop,TS val 874308697 ecr 315863687], length 0
12:54:17.508397 IP 10.8.1.4.57718 > 99.181.96.150.1935: Flags [.], seq 51262:52576, ack 1, win 501, options [nop,nop,TS val 315864182 ecr 874308697], length 1314
12:54:17.547401 IP 10.8.1.4.57718 > 99.181.96.150.1935: Flags [.], seq 52576:53890, ack 1, win 501, options [nop,nop,TS val 315864221 ecr 874308697], length 1314
12:54:17.548463 IP 99.181.96.150.1935 > 10.8.1.4.57718: Flags [.], ack 41915, win 352, options [nop,nop,TS val 874308794 ecr 315863782], length 0
12:54:17.578958 IP 10.8.1.4.57718 > 99.181.96.150.1935: Flags [.], seq 53890:55204, ack 1, win 501, options [nop,nop,TS val 315864252 ecr 874308794], length 1314
12:54:17.599205 IP 99.181.96.150.1935 > 10.8.1.4.57718: Flags [.], ack 43378, win 353, options [nop,nop,TS val 874308844 ecr 315863859], length 0
12:54:17.599220 IP 10.8.1.4.57718 > 99.181.96.150.1935: Flags [P.], seq 55204:55343, ack 1, win 501, options [nop,nop,TS val 315864273 ecr 874308844], length 139
12:54:17.641598 IP 10.8.1.4.57718 > 99.181.96.150.1935: Flags [.], seq 55343:56657, ack 1, win 501, options [nop,nop,TS val 315864315 ecr 874308844], length 1314
12:54:17.675178 IP 10.8.1.4.57718 > 99.181.96.150.1935: Flags [.], seq 56657:57971, ack 1, win 501, options [nop,nop,TS val 315864348 ecr 874308844], length 1314
12:54:17.682034 IP 99.181.96.150.1935 > 10.8.1.4.57718: Flags [.], ack 46006, win 353, options [nop,nop,TS val 874308927 ecr 315863923], length 0
12:54:17.717974 IP 10.8.1.4.57718 > 99.181.96.150.1935: Flags [.], seq 57971:59285, ack 1, win 501, options [nop,nop,TS val 315864391 ecr 874308927], length 1314
12:54:17.780911 IP 99.181.96.150.1935 > 10.8.1.4.57718: Flags [.], ack 48634, win 352, options [nop,nop,TS val 874309026 ecr 315863987], length 0
12:54:17.782344 IP 10.8.1.4.57718 > 99.181.96.150.1935: Flags [.], seq 59285:60599, ack 1, win 501, options [nop,nop,TS val 315864456 ecr 874309026], length 1314
12:54:17.812362 IP 10.8.1.4.57718 > 99.181.96.150.1935: Flags [.], seq 60599:61913, ack 1, win 501, options [nop,nop,TS val 315864486 ecr 874309026], length 1314
12:54:17.846767 IP 10.8.1.4.57718 > 99.181.96.150.1935: Flags [.], seq 61913:63227, ack 1, win 501, options [nop,nop,TS val 315864520 ecr 874309026], length 1314
12:54:17.850328 IP 99.181.96.150.1935 > 10.8.1.4.57718: Flags [.], ack 51262, win 352, options [nop,nop,TS val 874309096 ecr 315864085], length 0
12:54:17.911003 IP 10.8.1.4.57718 > 99.181.96.150.1935: Flags [.], seq 63227:64541, ack 1, win 501, options [nop,nop,TS val 315864584 ecr 874309096], length 1314
12:54:17.943664 IP 10.8.1.4.57718 > 99.181.96.150.1935: Flags [.], seq 64541:65855, ack 1, win 501, options [nop,nop,TS val 315864617 ecr 874309096], length 1314
12:54:17.951522 IP 99.181.96.150.1935 > 10.8.1.4.57718: Flags [.], ack 53890, win 352, options [nop,nop,TS val 874309197 ecr 315864182], length 0
12:54:17.978841 IP 10.8.1.4.57718 > 99.181.96.150.1935: Flags [.], seq 65855:67169, ack 1, win 501, options [nop,nop,TS val 315864652 ecr 874309197], length 1314
12:54:18.003118 IP 99.181.96.150.1935 > 10.8.1.4.57718: Flags [.], ack 55343, win 353, options [nop,nop,TS val 874309248 ecr 315864252], length 0
12:54:18.003157 IP 10.8.1.4.57718 > 99.181.96.150.1935: Flags [P.], seq 67169:67322, ack 1, win 501, options [nop,nop,TS val 315864676 ecr 874309248], length 153
12:54:18.043739 IP 10.8.1.4.57718 > 99.181.96.150.1935: Flags [.], seq 67322:68636, ack 1, win 501, options [nop,nop,TS val 315864717 ecr 874309248], length 1314
12:54:18.079475 IP 99.181.96.150.1935 > 10.8.1.4.57718: Flags [.], ack 57971, win 353, options [nop,nop,TS val 874309325 ecr 315864315], length 0
12:54:18.082274 IP 10.8.1.4.57718 > 99.181.96.150.1935: Flags [.], seq 68636:69950, ack 1, win 501, options [nop,nop,TS val 315864756 ecr 874309325], length 1314
12:54:18.125156 IP 10.8.1.4.57718 > 99.181.96.150.1935: Flags [.], seq 69950:71264, ack 1, win 501, options [nop,nop,TS val 315864798 ecr 874309325], length 1314
12:54:18.178124 IP 10.8.1.4.57718 > 99.181.96.150.1935: Flags [.], seq 71264:72578, ack 1, win 501, options [nop,nop,TS val 315864851 ecr 874309325], length 1314
12:54:18.186517 IP 99.181.96.150.1935 > 10.8.1.4.57718: Flags [.], ack 60599, win 352, options [nop,nop,TS val 874309432 ecr 315864391], length 0
12:54:18.211369 IP 10.8.1.4.57718 > 99.181.96.150.1935: Flags [.], seq 72578:73892, ack 1, win 501, options [nop,nop,TS val 315864885 ecr 874309432], length 1314
12:54:18.250835 IP 99.181.96.150.1935 > 10.8.1.4.57718: Flags [.], ack 63227, win 352, options [nop,nop,TS val 874309496 ecr 315864486], length 0
12:54:18.253887 IP 10.8.1.4.57718 > 99.181.96.150.1935: Flags [.], seq 73892:75206, ack 1, win 501, options [nop,nop,TS val 315864927 ecr 874309496], length 1314
12:54:18.318142 IP 10.8.1.4.57718 > 99.181.96.150.1935: Flags [.], seq 75206:76520, ack 1, win 501, options [nop,nop,TS val 315864991 ecr 874309496], length 1314
12:54:18.343223 IP 10.8.1.4.57718 > 99.181.96.150.1935: Flags [.], seq 76520:77834, ack 1, win 501, options [nop,nop,TS val 315865017 ecr 874309496], length 1314
12:54:18.347922 IP 99.181.96.150.1935 > 10.8.1.4.57718: Flags [.], ack 65855, win 352, options [nop,nop,TS val 874309593 ecr 315864584], length 0
12:54:18.382306 IP 10.8.1.4.57718 > 99.181.96.150.1935: Flags [.], seq 77834:79148, ack 1, win 501, options [nop,nop,TS val 315865056 ecr 874309593], length 1314
12:54:18.407180 IP 99.181.96.150.1935 > 10.8.1.4.57718: Flags [.], ack 67322, win 353, options [nop,nop,TS val 874309652 ecr 315864652], length 0
12:54:18.407226 IP 10.8.1.4.57718 > 99.181.96.150.1935: Flags [P.], seq 79148:79285, ack 1, win 501, options [nop,nop,TS val 315865081 ecr 874309652], length 137
12:54:18.446714 IP 10.8.1.4.57718 > 99.181.96.150.1935: Flags [.], seq 79285:80599, ack 1, win 501, options [nop,nop,TS val 315865120 ecr 874309652], length 1314
12:54:18.468224 IP 10.8.1.4.57718 > 99.181.96.150.1935: Flags [.], seq 80599:81913, ack 1, win 501, options [nop,nop,TS val 315865142 ecr 874309652], length 1314
12:54:18.486280 IP 99.181.96.150.1935 > 10.8.1.4.57718: Flags [.], ack 69950, win 353, options [nop,nop,TS val 874309731 ecr 315864717], length 0
12:54:18.510942 IP 10.8.1.4.57718 > 99.181.96.150.1935: Flags [.], seq 81913:83227, ack 1, win 501, options [nop,nop,TS val 315865184 ecr 874309731], length 1314
12:54:18.574634 IP 10.8.1.4.57718 > 99.181.96.150.1935: Flags [.], seq 83227:84541, ack 1, win 501, options [nop,nop,TS val 315865248 ecr 874309731], length 1314
12:54:18.582244 IP 99.181.96.150.1935 > 10.8.1.4.57718: Flags [.], ack 72578, win 353, options [nop,nop,TS val 874309827 ecr 315864798], length 0
12:54:18.611921 IP 10.8.1.4.57718 > 99.181.96.150.1935: Flags [.], seq 84541:85855, ack 1, win 501, options [nop,nop,TS val 315865285 ecr 874309827], length 1314
12:54:18.645219 IP 10.8.1.4.57718 > 99.181.96.150.1935: Flags [.], seq 85855:87169, ack 1, win 501, options [nop,nop,TS val 315865319 ecr 874309827], length 1314
12:54:18.658054 IP 99.181.96.150.1935 > 10.8.1.4.57718: Flags [.], ack 75206, win 353, options [nop,nop,TS val 874309903 ecr 315864885], length 0
12:54:18.703594 IP 10.8.1.4.57718 > 99.181.96.150.1935: Flags [.], seq 87169:88483, ack 1, win 501, options [nop,nop,TS val 315865377 ecr 874309903], length 1314
12:54:18.745414 IP 10.8.1.4.57718 > 99.181.96.150.1935: Flags [.], seq 88483:89797, ack 1, win 501, options [nop,nop,TS val 315865419 ecr 874309903], length 1314
12:54:18.747519 IP 99.181.96.150.1935 > 10.8.1.4.57718: Flags [.], ack 77834, win 353, options [nop,nop,TS val 874309993 ecr 315864991], length 0
12:54:18.778762 IP 10.8.1.4.57718 > 99.181.96.150.1935: Flags [.], seq 89797:91111, ack 1, win 501, options [nop,nop,TS val 315865452 ecr 874309993], length 1314
12:54:18.811187 IP 99.181.96.150.1935 > 10.8.1.4.57718: Flags [.], ack 79285, win 353, options [nop,nop,TS val 874310056 ecr 315865056], length 0
12:54:18.811221 IP 10.8.1.4.57718 > 99.181.96.150.1935: Flags [P.], seq 91111:92108, ack 1, win 501, options [nop,nop,TS val 315865485 ecr 874310056], length 997
12:54:18.872885 IP 99.181.96.150.1935 > 10.8.1.4.57718: Flags [.], ack 81913, win 353, options [nop,nop,TS val 874310118 ecr 315865120], length 0
12:54:18.875501 IP 10.8.1.4.57718 > 99.181.96.150.1935: Flags [.], seq 92108:93422, ack 1, win 501, options [nop,nop,TS val 315865549 ecr 874310118], length 1314
12:54:18.911565 IP 10.8.1.4.57718 > 99.181.96.150.1935: Flags [.], seq 93422:94736, ack 1, win 501, options [nop,nop,TS val 315865585 ecr 874310118], length 1314
12:54:18.939381 IP 10.8.1.4.57718 > 99.181.96.150.1935: Flags [.], seq 94736:96050, ack 1, win 501, options [nop,nop,TS val 315865613 ecr 874310118], length 1314
12:54:18.978604 IP 99.181.96.150.1935 > 10.8.1.4.57718: Flags [.], ack 84541, win 352, options [nop,nop,TS val 874310224 ecr 315865184], length 0
12:54:19.003336 IP 10.8.1.4.57718 > 99.181.96.150.1935: Flags [.], seq 96050:97364, ack 1, win 501, options [nop,nop,TS val 315865677 ecr 874310224], length 1314
12:54:19.045192 IP 10.8.1.4.57718 > 99.181.96.150.1935: Flags [.], seq 97364:98678, ack 1, win 501, options [nop,nop,TS val 315865718 ecr 874310224], length 1314
12:54:19.049265 IP 99.181.96.150.1935 > 10.8.1.4.57718: Flags [.], ack 87169, win 352, options [nop,nop,TS val 874310295 ecr 315865285], length 0
12:54:19.074405 IP 10.8.1.4.57718 > 99.181.96.150.1935: Flags [.], seq 98678:99992, ack 1, win 501, options [nop,nop,TS val 315865748 ecr 874310295], length 1314
12:54:19.143717 IP 10.8.1.4.57718 > 99.181.96.150.1935: Flags [.], seq 99992:101306, ack 1, win 501, options [nop,nop,TS val 315865817 ecr 874310295], length 1314
12:54:19.149728 IP 99.181.96.150.1935 > 10.8.1.4.57718: Flags [.], ack 89797, win 352, options [nop,nop,TS val 874310395 ecr 315865377], length 0
12:54:19.174433 IP 10.8.1.4.57718 > 99.181.96.150.1935: Flags [.], seq 101306:102620, ack 1, win 501, options [nop,nop,TS val 315865848 ecr 874310395], length 1314
12:54:19.211977 IP 10.8.1.4.57718 > 99.181.96.150.1935: Flags [.], seq 102620:103934, ack 1, win 501, options [nop,nop,TS val 315865885 ecr 874310395], length 1314
12:54:19.215141 IP 99.181.96.150.1935 > 10.8.1.4.57718: Flags [.], ack 92108, win 352, options [nop,nop,TS val 874310460 ecr 315865452], length 0
12:54:19.215170 IP 10.8.1.4.57718 > 99.181.96.150.1935: Flags [P.], seq 103934:104071, ack 1, win 501, options [nop,nop,TS val 315865888 ecr 874310460], length 137
12:54:19.275006 IP 10.8.1.4.57718 > 99.181.96.150.1935: Flags [.], seq 104071:105385, ack 1, win 501, options [nop,nop,TS val 315865948 ecr 874310460], length 1314
12:54:19.311532 IP 10.8.1.4.57718 > 99.181.96.150.1935: Flags [.], seq 105385:106699, ack 1, win 501, options [nop,nop,TS val 315865985 ecr 874310460], length 1314
12:54:19.315870 IP 99.181.96.150.1935 > 10.8.1.4.57718: Flags [.], ack 94736, win 352, options [nop,nop,TS val 874310561 ecr 315865549], length 0
12:54:19.345314 IP 10.8.1.4.57718 > 99.181.96.150.1935: Flags [.], seq 106699:108013, ack 1, win 501, options [nop,nop,TS val 315866019 ecr 874310561], length 1314
12:54:19.407251 IP 99.181.96.150.1935 > 10.8.1.4.57718: Flags [.], ack 97364, win 352, options [nop,nop,TS val 874310652 ecr 315865613], length 0
12:54:19.408893 IP 10.8.1.4.57718 > 99.181.96.150.1935: Flags [.], seq 108013:109327, ack 1, win 501, options [nop,nop,TS val 315866082 ecr 874310652], length 1314
12:54:19.444935 IP 10.8.1.4.57718 > 99.181.96.150.1935: Flags [.], seq 109327:110641, ack 1, win 501, options [nop,nop,TS val 315866118 ecr 874310652], length 1314
12:54:19.473517 IP 10.8.1.4.57718 > 99.181.96.150.1935: Flags [.], seq 110641:111955, ack 1, win 501, options [nop,nop,TS val 315866147 ecr 874310652], length 1314
12:54:19.478501 IP 99.181.96.150.1935 > 10.8.1.4.57718: Flags [.], ack 99992, win 352, options [nop,nop,TS val 874310724 ecr 315865718], length 0
12:54:19.537881 IP 10.8.1.4.57718 > 99.181.96.150.1935: Flags [.], seq 111955:113269, ack 1, win 501, options [nop,nop,TS val 315866211 ecr 874310724], length 1314
12:54:19.575914 IP 10.8.1.4.57718 > 99.181.96.150.1935: Flags [.], seq 113269:114583, ack 1, win 501, options [nop,nop,TS val 315866249 ecr 874310724], length 1314
12:54:19.578339 IP 99.181.96.150.1935 > 10.8.1.4.57718: Flags [.], ack 102620, win 352, options [nop,nop,TS val 874310824 ecr 315865817], length 0
12:54:19.607770 IP 10.8.1.4.57718 > 99.181.96.150.1935: Flags [.], seq 114583:115897, ack 1, win 501, options [nop,nop,TS val 315866281 ecr 874310824], length 1314
12:54:19.619019 IP 99.181.96.150.1935 > 10.8.1.4.57718: Flags [.], ack 104071, win 353, options [nop,nop,TS val 874310864 ecr 315865885], length 0
12:54:19.619033 IP 10.8.1.4.57718 > 99.181.96.150.1935: Flags [P.], seq 115897:116047, ack 1, win 501, options [nop,nop,TS val 315866292 ecr 874310864], length 150
12:54:19.678715 IP 10.8.1.4.57718 > 99.181.96.150.1935: Flags [.], seq 116047:117361, ack 1, win 501, options [nop,nop,TS val 315866352 ecr 874310864], length 1314
12:54:19.708756 IP 10.8.1.4.57718 > 99.181.96.150.1935: Flags [.], seq 117361:118675, ack 1, win 501, options [nop,nop,TS val 315866382 ecr 874310864], length 1314
12:54:19.716132 IP 99.181.96.150.1935 > 10.8.1.4.57718: Flags [.], ack 106699, win 352, options [nop,nop,TS val 874310961 ecr 315865948], length 0
12:54:19.745344 IP 10.8.1.4.57718 > 99.181.96.150.1935: Flags [.], seq 118675:119989, ack 1, win 501, options [nop,nop,TS val 315866419 ecr 874310961], length 1314
12:54:19.809937 IP 10.8.1.4.57718 > 99.181.96.150.1935: Flags [.], seq 119989:121303, ack 1, win 501, options [nop,nop,TS val 315866483 ecr 874310961], length 1314
12:54:19.813015 IP 99.181.96.150.1935 > 10.8.1.4.57718: Flags [.], ack 109327, win 352, options [nop,nop,TS val 874311058 ecr 315866019], length 0
12:54:19.843409 IP 10.8.1.4.57718 > 99.181.96.150.1935: Flags [.], seq 121303:122617, ack 1, win 501, options [nop,nop,TS val 315866517 ecr 874311058], length 1314
12:54:19.874484 IP 10.8.1.4.57718 > 99.181.96.150.1935: Flags [.], seq 122617:123931, ack 1, win 501, options [nop,nop,TS val 315866548 ecr 874311058], length 1314
12:54:19.878172 IP 99.181.96.150.1935 > 10.8.1.4.57718: Flags [.], ack 111955, win 352, options [nop,nop,TS val 874311123 ecr 315866118], length 0
12:54:19.943103 IP 10.8.1.4.57718 > 99.181.96.150.1935: Flags [.], seq 123931:125245, ack 1, win 501, options [nop,nop,TS val 315866616 ecr 874311123], length 1314
12:54:19.977804 IP 10.8.1.4.57718 > 99.181.96.150.1935: Flags [.], seq 125245:126559, ack 1, win 501, options [nop,nop,TS val 315866651 ecr 874311123], length 1314
12:54:19.979780 IP 99.181.96.150.1935 > 10.8.1.4.57718: Flags [.], ack 114583, win 352, options [nop,nop,TS val 874311225 ecr 315866211], length 0
12:54:20.007208 IP 10.8.1.4.57718 > 99.181.96.150.1935: Flags [.], seq 126559:127873, ack 1, win 501, options [nop,nop,TS val 315866681 ecr 874311225], length 1314
12:54:20.023076 IP 99.181.96.150.1935 > 10.8.1.4.57718: Flags [.], ack 116047, win 353, options [nop,nop,TS val 874311268 ecr 315866281], length 0
12:54:20.023090 IP 10.8.1.4.57718 > 99.181.96.150.1935: Flags [P.], seq 127873:128015, ack 1, win 501, options [nop,nop,TS val 315866696 ecr 874311268], length 142
12:54:20.070809 IP 10.8.1.4.57718 > 99.181.96.150.1935: Flags [.], seq 128015:129329, ack 1, win 501, options [nop,nop,TS val 315866744 ecr 874311268], length 1314
12:54:20.111809 IP 10.8.1.4.57718 > 99.181.96.150.1935: Flags [.], seq 129329:130643, ack 1, win 501, options [nop,nop,TS val 315866785 ecr 874311268], length 1314
12:54:20.113054 IP 99.181.96.150.1935 > 10.8.1.4.57718: Flags [.], ack 118675, win 353, options [nop,nop,TS val 874311358 ecr 315866352], length 0
12:54:20.140966 IP 10.8.1.4.57718 > 99.181.96.150.1935: Flags [.], seq 130643:131957, ack 1, win 501, options [nop,nop,TS val 315866814 ecr 874311358], length 1314
12:54:20.211056 IP 10.8.1.4.57718 > 99.181.96.150.1935: Flags [.], seq 131957:133271, ack 1, win 501, options [nop,nop,TS val 315866884 ecr 874311358], length 1314
12:54:20.214231 IP 99.181.96.150.1935 > 10.8.1.4.57718: Flags [.], ack 121303, win 352, options [nop,nop,TS val 874311459 ecr 315866419], length 0
12:54:20.241653 IP 10.8.1.4.57718 > 99.181.96.150.1935: Flags [.], seq 133271:134585, ack 1, win 501, options [nop,nop,TS val 315866915 ecr 874311459], length 1314
12:54:20.274399 IP 10.8.1.4.57718 > 99.181.96.150.1935: Flags [.], seq 134585:135899, ack 1, win 501, options [nop,nop,TS val 315866948 ecr 874311459], length 1314
12:54:20.278645 IP 99.181.96.150.1935 > 10.8.1.4.57718: Flags [.], ack 123931, win 352, options [nop,nop,TS val 874311524 ecr 315866517], length 0
12:54:20.343895 IP 10.8.1.4.57718 > 99.181.96.150.1935: Flags [.], seq 135899:137213, ack 1, win 501, options [nop,nop,TS val 315867017 ecr 874311524], length 1314
12:54:20.379090 IP 10.8.1.4.57718 > 99.181.96.150.1935: Flags [.], seq 137213:138527, ack 1, win 501, options [nop,nop,TS val 315867052 ecr 874311524], length 1314
12:54:20.381927 IP 99.181.96.150.1935 > 10.8.1.4.57718: Flags [.], ack 126559, win 352, options [nop,nop,TS val 874311627 ecr 315866616], length 0
12:54:20.407647 IP 10.8.1.4.57718 > 99.181.96.150.1935: Flags [.], seq 138527:139841, ack 1, win 501, options [nop,nop,TS val 315867081 ecr 874311627], length 1314
12:54:20.427035 IP 99.181.96.150.1935 > 10.8.1.4.57718: Flags [.], ack 128015, win 353, options [nop,nop,TS val 874311672 ecr 315866681], length 0
12:54:20.427046 IP 10.8.1.4.57718 > 99.181.96.150.1935: Flags [P.], seq 139841:139990, ack 1, win 501, options [nop,nop,TS val 315867100 ecr 874311672], length 149
12:54:20.475490 IP 10.8.1.4.57718 > 99.181.96.150.1935: Flags [.], seq 139990:141304, ack 1, win 501, options [nop,nop,TS val 315867149 ecr 874311672], length 1314
12:54:20.511423 IP 10.8.1.4.57718 > 99.181.96.150.1935: Flags [.], seq 141304:142618, ack 1, win 501, options [nop,nop,TS val 315867185 ecr 874311672], length 1314
12:54:20.516006 IP 99.181.96.150.1935 > 10.8.1.4.57718: Flags [.], ack 130643, win 353, options [nop,nop,TS val 874311761 ecr 315866744], length 0
12:54:20.541191 IP 10.8.1.4.57718 > 99.181.96.150.1935: Flags [.], seq 142618:143932, ack 1, win 501, options [nop,nop,TS val 315867214 ecr 874311761], length 1314
12:54:20.603221 IP 10.8.1.4.57718 > 99.181.96.150.1935: Flags [.], seq 143932:145246, ack 1, win 501, options [nop,nop,TS val 315867277 ecr 874311761], length 1314
12:54:20.615247 IP 99.181.96.150.1935 > 10.8.1.4.57718: Flags [.], ack 133271, win 352, options [nop,nop,TS val 874311861 ecr 315866814], length 0
12:54:20.644173 IP 10.8.1.4.57718 > 99.181.96.150.1935: Flags [.], seq 145246:146560, ack 1, win 501, options [nop,nop,TS val 315867317 ecr 874311861], length 1314
12:54:20.674332 IP 10.8.1.4.57718 > 99.181.96.150.1935: Flags [.], seq 146560:147874, ack 1, win 501, options [nop,nop,TS val 315867348 ecr 874311861], length 1314
12:54:20.678397 IP 99.181.96.150.1935 > 10.8.1.4.57718: Flags [.], ack 135899, win 352, options [nop,nop,TS val 874311924 ecr 315866915], length 0
12:54:20.742406 IP 10.8.1.4.57718 > 99.181.96.150.1935: Flags [.], seq 147874:149188, ack 1, win 501, options [nop,nop,TS val 315867416 ecr 874311924], length 1314
12:54:20.773628 IP 10.8.1.4.57718 > 99.181.96.150.1935: Flags [.], seq 149188:150502, ack 1, win 501, options [nop,nop,TS val 315867447 ecr 874311924], length 1314
12:54:20.783428 IP 99.181.96.150.1935 > 10.8.1.4.57718: Flags [.], ack 138527, win 352, options [nop,nop,TS val 874312028 ecr 315867017], length 0
12:54:20.812077 IP 10.8.1.4.57718 > 99.181.96.150.1935: Flags [.], seq 150502:151816, ack 1, win 501, options [nop,nop,TS val 315867485 ecr 874312028], length 1314
12:54:20.831018 IP 99.181.96.150.1935 > 10.8.1.4.57718: Flags [.], ack 139990, win 353, options [nop,nop,TS val 874312076 ecr 315867081], length 0
12:54:20.831056 IP 10.8.1.4.57718 > 99.181.96.150.1935: Flags [P.], seq 151816:151953, ack 1, win 501, options [nop,nop,TS val 315867504 ecr 874312076], length 137
12:54:20.876907 IP 10.8.1.4.57718 > 99.181.96.150.1935: Flags [.], seq 151953:153267, ack 1, win 501, options [nop,nop,TS val 315867550 ecr 874312076], length 1314
12:54:20.910515 IP 10.8.1.4.57718 > 99.181.96.150.1935: Flags [.], seq 153267:154581, ack 1, win 501, options [nop,nop,TS val 315867584 ecr 874312076], length 1314
12:54:20.915423 IP 99.181.96.150.1935 > 10.8.1.4.57718: Flags [.], ack 142618, win 352, options [nop,nop,TS val 874312161 ecr 315867149], length 0
12:54:20.944237 IP 10.8.1.4.57718 > 99.181.96.150.1935: Flags [.], seq 154581:155895, ack 1, win 501, options [nop,nop,TS val 315867618 ecr 874312161], length 1314
12:54:21.007125 IP 99.181.96.150.1935 > 10.8.1.4.57718: Flags [.], ack 143932, win 353, options [nop,nop,TS val 874312252 ecr 315867214], length 0
12:54:21.008170 IP 10.8.1.4.57718 > 99.181.96.150.1935: Flags [.], seq 155895:157209, ack 1, win 501, options [nop,nop,TS val 315867681 ecr 874312252], length 1314
12:54:21.045278 IP 10.8.1.4.57718 > 99.181.96.150.1935: Flags [.], seq 157209:158523, ack 1, win 501, options [nop,nop,TS val 315867719 ecr 874312252], length 1314
12:54:21.048250 IP 99.181.96.150.1935 > 10.8.1.4.57718: Flags [.], ack 146560, win 353, options [nop,nop,TS val 874312293 ecr 315867277], length 0
12:54:21.078606 IP 10.8.1.4.57718 > 99.181.96.150.1935: Flags [.], seq 158523:159837, ack 1, win 501, options [nop,nop,TS val 315867752 ecr 874312293], length 1314
12:54:21.136615 IP 10.8.1.4.57718 > 99.181.96.150.1935: Flags [.], seq 159837:161151, ack 1, win 501, options [nop,nop,TS val 315867810 ecr 874312293], length 1314
12:54:21.146443 IP 99.181.96.150.1935 > 10.8.1.4.57718: Flags [.], ack 149188, win 352, options [nop,nop,TS val 874312392 ecr 315867348], length 0
12:54:21.177123 IP 10.8.1.4.57718 > 99.181.96.150.1935: Flags [.], seq 161151:162465, ack 1, win 501, options [nop,nop,TS val 315867850 ecr 874312392], length 1314
12:54:21.207646 IP 10.8.1.4.57718 > 99.181.96.150.1935: Flags [.], seq 162465:163779, ack 1, win 501, options [nop,nop,TS val 315867881 ecr 874312392], length 1314
12:54:21.216443 IP 99.181.96.150.1935 > 10.8.1.4.57718: Flags [.], ack 151816, win 352, options [nop,nop,TS val 874312462 ecr 315867447], length 0
12:54:21.235033 IP 99.181.96.150.1935 > 10.8.1.4.57718: Flags [.], ack 151953, win 353, options [nop,nop,TS val 874312480 ecr 315867504], length 0
12:54:21.235043 IP 10.8.1.4.57718 > 99.181.96.150.1935: Flags [P.], seq 163779:163929, ack 1, win 501, options [nop,nop,TS val 315867908 ecr 874312480], length 150
12:54:21.276613 IP 10.8.1.4.57718 > 99.181.96.150.1935: Flags [.], seq 163929:165243, ack 1, win 501, options [nop,nop,TS val 315867950 ecr 874312480], length 1314
12:54:21.306858 IP 10.8.1.4.57718 > 99.181.96.150.1935: Flags [.], seq 165243:166557, ack 1, win 501, options [nop,nop,TS val 315867980 ecr 874312480], length 1314
12:54:21.314732 IP 99.181.96.150.1935 > 10.8.1.4.57718: Flags [.], ack 154581, win 353, options [nop,nop,TS val 874312560 ecr 315867550], length 0
12:54:21.349668 IP 10.8.1.4.57718 > 99.181.96.150.1935: Flags [.], seq 166557:167871, ack 1, win 501, options [nop,nop,TS val 315868023 ecr 874312560], length 1314
12:54:21.408994 IP 10.8.1.4.57718 > 99.181.96.150.1935: Flags [.], seq 167871:169185, ack 1, win 501, options [nop,nop,TS val 315868082 ecr 874312560], length 1314
12:54:21.412005 IP 99.181.96.150.1935 > 10.8.1.4.57718: Flags [.], ack 157209, win 352, options [nop,nop,TS val 874312657 ecr 315867618], length 0
12:54:21.442390 IP 10.8.1.4.57718 > 99.181.96.150.1935: Flags [.], seq 169185:170499, ack 1, win 501, options [nop,nop,TS val 315868116 ecr 874312657], length 1314
12:54:21.477117 IP 10.8.1.4.57718 > 99.181.96.150.1935: Flags [.], seq 170499:171813, ack 1, win 501, options [nop,nop,TS val 315868150 ecr 874312657], length 1314
12:54:21.493001 IP 99.181.96.150.1935 > 10.8.1.4.57718: Flags [.], ack 159837, win 352, options [nop,nop,TS val 874312738 ecr 315867719], length 0
12:54:21.541226 IP 10.8.1.4.57718 > 99.181.96.150.1935: Flags [.], seq 171813:173127, ack 1, win 501, options [nop,nop,TS val 315868215 ecr 874312738], length 1314
12:54:21.578787 IP 10.8.1.4.57718 > 99.181.96.150.1935: Flags [.], seq 173127:174441, ack 1, win 501, options [nop,nop,TS val 315868252 ecr 874312738], length 1314
12:54:21.581197 IP 99.181.96.150.1935 > 10.8.1.4.57718: Flags [.], ack 162465, win 352, options [nop,nop,TS val 874312826 ecr 315867810], length 0
12:54:21.607754 IP 10.8.1.4.57718 > 99.181.96.150.1935: Flags [.], seq 174441:175755, ack 1, win 501, options [nop,nop,TS val 315868281 ecr 874312826], length 1314
12:54:21.638813 IP 99.181.96.150.1935 > 10.8.1.4.57718: Flags [.], ack 163929, win 353, options [nop,nop,TS val 874312884 ecr 315867881], length 0
12:54:21.638836 IP 10.8.1.4.57718 > 99.181.96.150.1935: Flags [P.], seq 175755:175897, ack 1, win 501, options [nop,nop,TS val 315868312 ecr 874312884], length 142
12:54:21.668643 IP 10.8.1.4.57718 > 99.181.96.150.1935: Flags [.], seq 175897:177211, ack 1, win 501, options [nop,nop,TS val 315868342 ecr 874312884], length 1314
12:54:21.711086 IP 99.181.96.150.1935 > 10.8.1.4.57718: Flags [.], ack 166557, win 353, options [nop,nop,TS val 874312956 ecr 315867950], length 0
12:54:21.711593 IP 10.8.1.4.57718 > 99.181.96.150.1935: Flags [.], seq 177211:178525, ack 1, win 501, options [nop,nop,TS val 315868385 ecr 874312956], length 1314
12:54:21.753920 IP 10.8.1.4.57718 > 99.181.96.150.1935: Flags [.], seq 178525:179839, ack 1, win 501, options [nop,nop,TS val 315868427 ecr 874312956], length 1314
12:54:21.809196 IP 10.8.1.4.57718 > 99.181.96.150.1935: Flags [.], seq 179839:181153, ack 1, win 501, options [nop,nop,TS val 315868483 ecr 874312956], length 1314
12:54:21.812911 IP 99.181.96.150.1935 > 10.8.1.4.57718: Flags [.], ack 169185, win 352, options [nop,nop,TS val 874313058 ecr 315868023], length 0
12:54:21.839132 IP 10.8.1.4.57718 > 99.181.96.150.1935: Flags [.], seq 181153:182467, ack 1, win 501, options [nop,nop,TS val 315868512 ecr 874313058], length 1314
12:54:21.882048 IP 10.8.1.4.57718 > 99.181.96.150.1935: Flags [.], seq 182467:183781, ack 1, win 501, options [nop,nop,TS val 315868555 ecr 874313058], length 1314
12:54:21.882052 IP 99.181.96.150.1935 > 10.8.1.4.57718: Flags [.], ack 171813, win 352, options [nop,nop,TS val 874313127 ecr 315868116], length 0
12:54:21.941453 IP 10.8.1.4.57718 > 99.181.96.150.1935: Flags [.], seq 183781:185095, ack 1, win 501, options [nop,nop,TS val 315868615 ecr 874313127], length 1314
12:54:21.975177 IP 10.8.1.4.57718 > 99.181.96.150.1935: Flags [.], seq 185095:186409, ack 1, win 501, options [nop,nop,TS val 315868648 ecr 874313127], length 1314
12:54:21.982806 IP 99.181.96.150.1935 > 10.8.1.4.57718: Flags [.], ack 174441, win 352, options [nop,nop,TS val 874313228 ecr 315868215], length 0
12:54:22.009241 IP 10.8.1.4.57718 > 99.181.96.150.1935: Flags [.], seq 186409:187723, ack 1, win 501, options [nop,nop,TS val 315868683 ecr 874313228], length 1314
12:54:22.042654 IP 99.181.96.150.1935 > 10.8.1.4.57718: Flags [.], ack 175897, win 353, options [nop,nop,TS val 874313288 ecr 315868281], length 0
12:54:22.042678 IP 10.8.1.4.57718 > 99.181.96.150.1935: Flags [P.], seq 187723:187868, ack 1, win 501, options [nop,nop,TS val 315868716 ecr 874313288], length 145
12:54:22.076377 IP 10.8.1.4.57718 > 99.181.96.150.1935: Flags [.], seq 187868:189182, ack 1, win 501, options [nop,nop,TS val 315868750 ecr 874313288], length 1314
12:54:22.115476 IP 99.181.96.150.1935 > 10.8.1.4.57718: Flags [.], ack 178525, win 353, options [nop,nop,TS val 874313361 ecr 315868342], length 0
12:54:22.115588 IP 10.8.1.4.57718 > 99.181.96.150.1935: Flags [.], seq 189182:190496, ack 1, win 501, options [nop,nop,TS val 315868789 ecr 874313361], length 1314
12:54:22.175083 IP 10.8.1.4.57718 > 99.181.96.150.1935: Flags [.], seq 190496:191810, ack 1, win 501, options [nop,nop,TS val 315868848 ecr 874313361], length 1314
12:54:22.209770 IP 10.8.1.4.57718 > 99.181.96.150.1935: Flags [.], seq 191810:193124, ack 1, win 501, options [nop,nop,TS val 315868883 ecr 874313361], length 1314
12:54:22.213149 IP 99.181.96.150.1935 > 10.8.1.4.57718: Flags [.], ack 181153, win 352, options [nop,nop,TS val 874313458 ecr 315868427], length 0
12:54:22.245457 IP 10.8.1.4.57718 > 99.181.96.150.1935: Flags [.], seq 193124:194438, ack 1, win 501, options [nop,nop,TS val 315868919 ecr 874313458], length 1314
12:54:22.286194 IP 99.181.96.150.1935 > 10.8.1.4.57718: Flags [.], ack 183781, win 352, options [nop,nop,TS val 874313532 ecr 315868512], length 0
12:54:22.307778 IP 10.8.1.4.57718 > 99.181.96.150.1935: Flags [.], seq 194438:195752, ack 1, win 501, options [nop,nop,TS val 315868981 ecr 874313532], length 1314
12:54:22.350368 IP 10.8.1.4.57718 > 99.181.96.150.1935: Flags [.], seq 195752:197066, ack 1, win 501, options [nop,nop,TS val 315869024 ecr 874313532], length 1314
12:54:22.376041 IP 10.8.1.4.57718 > 99.181.96.150.1935: Flags [.], seq 197066:198380, ack 1, win 501, options [nop,nop,TS val 315869049 ecr 874313532], length 1314
12:54:22.379182 IP 99.181.96.150.1935 > 10.8.1.4.57718: Flags [.], ack 186409, win 352, options [nop,nop,TS val 874313624 ecr 315868615], length 0
12:54:22.435233 IP 10.8.1.4.57718 > 99.181.96.150.1935: Flags [.], seq 198380:199694, ack 1, win 501, options [nop,nop,TS val 315869109 ecr 874313624], length 1314
12:54:22.446602 IP 99.181.96.150.1935 > 10.8.1.4.57718: Flags [.], ack 187868, win 353, options [nop,nop,TS val 874313692 ecr 315868683], length 0
12:54:22.446629 IP 10.8.1.4.57718 > 99.181.96.150.1935: Flags [P.], seq 199694:200587, ack 1, win 501, options [nop,nop,TS val 315869120 ecr 874313692], length 893
12:54:22.519485 IP 99.181.96.150.1935 > 10.8.1.4.57718: Flags [.], ack 190496, win 353, options [nop,nop,TS val 874313765 ecr 315868750], length 0
12:54:22.520806 IP 10.8.1.4.57718 > 99.181.96.150.1935: Flags [.], seq 200587:201901, ack 1, win 501, options [nop,nop,TS val 315869194 ecr 874313765], length 1314
12:54:22.541972 IP 10.8.1.4.57718 > 99.181.96.150.1935: Flags [.], seq 201901:203215, ack 1, win 501, options [nop,nop,TS val 315869215 ecr 874313765], length 1314
