07:56:35.667817 IP 10.8.3.4.39240 > 185.42.205.35.1935: Flags [.], seq 3751918543:3751919857, ack 3877739705, win 501, options [nop,nop,TS val 3430064058 ecr 213487150], length 1314
07:56:35.699274 IP 10.8.3.4.39240 > 185.42.205.35.1935: Flags [.], seq 1314:2628, ack 1, win 501, options [nop,nop,TS val 3430064089 ecr 213487150], length 1314
07:56:35.713907 IP 185.42.205.35.1935 > 10.8.3.4.39240: Flags [.], ack 4294960888, win 126, options [nop,nop,TS val 213487242 ecr 3430063758], length 0
07:56:35.747765 IP 10.8.3.4.39240 > 185.42.205.35.1935: Flags [.], seq 2628:3942, ack 1, win 501, options [nop,nop,TS val 3430064138 ecr 213487242], length 1314
07:56:35.801009 IP 10.8.3.4.39240 > 185.42.205.35.1935: Flags [.], seq 3942:5256, ack 1, win 501, options [nop,nop,TS val 3430064191 ecr 213487242], length 1314
07:56:35.813898 IP 185.42.205.35.1935 > 10.8.3.4.39240: Flags [.], ack 4294962202, win 126, options [nop,nop,TS val 213487342 ecr 3430063822], length 0
07:56:35.831328 IP 10.8.3.4.39240 > 185.42.205.35.1935: Flags [.], seq 5256:6570, ack 1, win 501, options [nop,nop,TS val 3430064221 ecr 213487342], length 1314
07:56:35.845677 IP 185.42.205.35.1935 > 10.8.3.4.39240: Flags [.], ack 4294964830, win 126, options [nop,nop,TS val 213487374 ecr 3430063891], length 0
07:56:35.876019 IP 10.8.3.4.39240 > 185.42.205.35.1935: Flags [.], seq 6570:7884, ack 1, win 501, options [nop,nop,TS val 3430064266 ecr 213487374], length 1314
07:56:35.932998 IP 10.8.3.4.39240 > 185.42.205.35.1935: Flags [.], seq 7884:9198, ack 1, win 501, options [nop,nop,TS val 3430064323 ecr 213487374], length 1314
07:56:35.934139 IP 185.42.205.35.1935 > 10.8.3.4.39240: Flags [.], ack 0, win 126, options [nop,nop,TS val 213487463 ecr 3430063957], length 0
07:56:35.934186 IP 10.8.3.4.39240 > 185.42.205.35.1935: Flags [P.], seq 9198:9808, ack 1, win 501, options [nop,nop,TS val 3430064324 ecr 213487463], length 610
07:56:35.997453 IP 10.8.3.4.39240 > 185.42.205.35.1935: Flags [.], seq 9808:11122, ack 1, win 501, options [nop,nop,TS val 3430064387 ecr 213487463], length 1314
07:56:36.017505 IP 185.42.205.35.1935 > 10.8.3.4.39240: Flags [.], ack 2628, win 126, options [nop,nop,TS val 213487541 ecr 3430064058], length 0
07:56:36.031860 IP 10.8.3.4.39240 > 185.42.205.35.1935: Flags [.], seq 11122:12436, ack 1, win 501, options [nop,nop,TS val 3430064422 ecr 213487541], length 1314
07:56:36.067852 IP 10.8.3.4.39240 > 185.42.205.35.1935: Flags [.], seq 12436:13750, ack 1, win 501, options [nop,nop,TS val 3430064458 ecr 213487541], length 1314
07:56:36.114523 IP 185.42.205.35.1935 > 10.8.3.4.39240: Flags [.], ack 5256, win 126, options [nop,nop,TS val 213487643 ecr 3430064138], length 0
07:56:36.132257 IP 10.8.3.4.39240 > 185.42.205.35.1935: Flags [.], seq 13750:15064, ack 1, win 501, options [nop,nop,TS val 3430064522 ecr 213487643], length 1314
07:56:36.163898 IP 10.8.3.4.39240 > 185.42.205.35.1935: Flags [.], seq 15064:16378, ack 1, win 501, options [nop,nop,TS val 3430064554 ecr 213487643], length 1314
07:56:36.189134 IP 185.42.205.35.1935 > 10.8.3.4.39240: Flags [.], ack 7884, win 126, options [nop,nop,TS val 213487717 ecr 3430064221], length 0
07:56:36.197863 IP 10.8.3.4.39240 > 185.42.205.35.1935: Flags [.], seq 16378:17692, ack 1, win 501, options [nop,nop,TS val 3430064588 ecr 213487717], length 1314
07:56:36.247176 IP 185.42.205.35.1935 > 10.8.3.4.39240: Flags [.], ack 9808, win 126, options [nop,nop,TS val 213487775 ecr 3430064323], length 0
07:56:36.247210 IP 10.8.3.4.39240 > 185.42.205.35.1935: Flags [P.], seq 17692:18860, ack 1, win 501, options [nop,nop,TS val 3430064637 ecr 213487775], length 1168
07:56:36.299903 IP 10.8.3.4.39240 > 185.42.205.35.1935: Flags [.], seq 18860:20174, ack 1, win 501, options [nop,nop,TS val 3430064690 ecr 213487775], length 1314
07:56:36.330036 IP 10.8.3.4.39240 > 185.42.205.35.1935: Flags [.], seq 20174:21488, ack 1, win 501, options [nop,nop,TS val 3430064720 ecr 213487775], length 1314
07:56:36.346522 IP 185.42.205.35.1935 > 10.8.3.4.39240: Flags [.], ack 12436, win 126, options [nop,nop,TS val 213487875 ecr 3430064387], length 0
07:56:36.366187 IP 10.8.3.4.39240 > 185.42.205.35.1935: Flags [.], seq 21488:22802, ack 1, win 501, options [nop,nop,TS val 3430064756 ecr 213487875], length 1314
07:56:36.434028 IP 10.8.3.4.39240 > 185.42.205.35.1935: Flags [.], seq 22802:24116, ack 1, win 501, options [nop,nop,TS val 3430064824 ecr 213487875], length 1314
07:56:36.441722 IP 185.42.205.35.1935 > 10.8.3.4.39240: Flags [.], ack 13750, win 126, options [nop,nop,TS val 213487970 ecr 3430064458], length 0
07:56:36.467950 IP 10.8.3.4.39240 > 185.42.205.35.1935: Flags [.], seq 24116:25430, ack 1, win 501, options [nop,nop,TS val 3430064858 ecr 213487970], length 1314
07:56:36.476781 IP 185.42.205.35.1935 > 10.8.3.4.39240: Flags [.], ack 16378, win 126, options [nop,nop,TS val 213488005 ecr 3430064522], length 0
07:56:36.499441 IP 10.8.3.4.39240 > 185.42.205.35.1935: Flags [.], seq 25430:26744, ack 1, win 501, options [nop,nop,TS val 3430064889 ecr 213488005], length 1314
07:56:36.560008 IP 185.42.205.35.1935 > 10.8.3.4.39240: Flags [.], ack 18860, win 126, options [nop,nop,TS val 213488088 ecr 3430064588], length 0
07:56:36.560035 IP 10.8.3.4.39240 > 185.42.205.35.1935: Flags [P.], seq 26744:27904, ack 1, win 501, options [nop,nop,TS val 3430064950 ecr 213488088], length 1160
07:56:36.599457 IP 10.8.3.4.39240 > 185.42.205.35.1935: Flags [.], seq 27904:29218, ack 1, win 501, options [nop,nop,TS val 3430064989 ecr 213488088], length 1314
07:56:36.632801 IP 10.8.3.4.39240 > 185.42.205.35.1935: Flags [.], seq 29218:30532, ack 1, win 501, options [nop,nop,TS val 3430065023 ecr 213488088], length 1314
07:56:36.642738 IP 185.42.205.35.1935 > 10.8.3.4.39240: Flags [.], ack 21488, win 126, options [nop,nop,TS val 213488171 ecr 3430064690], length 0
07:56:36.687281 IP 10.8.3.4.39240 > 185.42.205.35.1935: Flags [.], seq 30532:31846, ack 1, win 501, options [nop,nop,TS val 3430065077 ecr 213488171], length 1314
07:56:36.731085 IP 10.8.3.4.39240 > 185.42.205.35.1935: Flags [.], seq 31846:33160, ack 1, win 501, options [nop,nop,TS val 3430065121 ecr 213488171], length 1314
07:56:36.747312 IP 185.42.205.35.1935 > 10.8.3.4.39240: Flags [.], ack 24116, win 126, options [nop,nop,TS val 213488276 ecr 3430064756], length 0
07:56:36.764607 IP 10.8.3.4.39240 > 185.42.205.35.1935: Flags [.], seq 33160:34474, ack 1, win 501, options [nop,nop,TS val 3430065155 ecr 213488276], length 1314
07:56:36.814505 IP 185.42.205.35.1935 > 10.8.3.4.39240: Flags [.], ack 26744, win 126, options [nop,nop,TS val 213488341 ecr 3430064858], length 0
07:56:36.814990 IP 10.8.3.4.39240 > 185.42.205.35.1935: Flags [.], seq 34474:35788, ack 1, win 501, options [nop,nop,TS val 3430065205 ecr 213488341], length 1314
07:56:36.864371 IP 10.8.3.4.39240 > 185.42.205.35.1935: Flags [.], seq 35788:37102, ack 1, win 501, options [nop,nop,TS val 3430065254 ecr 213488341], length 1314
07:56:36.873130 IP 185.42.205.35.1935 > 10.8.3.4.39240: Flags [.], ack 27904, win 126, options [nop,nop,TS val 213488401 ecr 3430064950], length 0
07:56:36.873142 IP 10.8.3.4.39240 > 185.42.205.35.1935: Flags [P.], seq 37102:37713, ack 1, win 501, options [nop,nop,TS val 3430065263 ecr 213488401], length 611
07:56:36.934545 IP 10.8.3.4.39240 > 185.42.205.35.1935: Flags [.], seq 37713:39027, ack 1, win 501, options [nop,nop,TS val 3430065324 ecr 213488401], length 1314
07:56:36.945744 IP 185.42.205.35.1935 > 10.8.3.4.39240: Flags [.], ack 30532, win 126, options [nop,nop,TS val 213488474 ecr 3430064989], length 0
07:56:36.968436 IP 10.8.3.4.39240 > 185.42.205.35.1935: Flags [.], seq 39027:40341, ack 1, win 501, options [nop,nop,TS val 3430065358 ecr 213488474], length 1314
07:56:36.997804 IP 10.8.3.4.39240 > 185.42.205.35.1935: Flags [.], seq 40341:41655, ack 1, win 501, options [nop,nop,TS val 3430065388 ecr 213488474], length 1314
07:56:37.048567 IP 185.42.205.35.1935 > 10.8.3.4.39240: Flags [.], ack 33160, win 126, options [nop,nop,TS val 213488576 ecr 3430065077], length 0
07:56:37.068286 IP 10.8.3.4.39240 > 185.42.205.35.1935: Flags [.], seq 41655:42969, ack 1, win 501, options [nop,nop,TS val 3430065458 ecr 213488576], length 1314
07:56:37.100813 IP 10.8.3.4.39240 > 185.42.205.35.1935: Flags [.], seq 42969:44283, ack 1, win 501, options [nop,nop,TS val 3430065491 ecr 213488576], length 1314
07:56:37.128134 IP 185.42.205.35.1935 > 10.8.3.4.39240: Flags [.], ack 35788, win 126, options [nop,nop,TS val 213488656 ecr 3430065155], length 0
07:56:37.134873 IP 10.8.3.4.39240 > 185.42.205.35.1935: Flags [.], seq 44283:45597, ack 1, win 501, options [nop,nop,TS val 3430065525 ecr 213488656], length 1314
07:56:37.186158 IP 185.42.205.35.1935 > 10.8.3.4.39240: Flags [.], ack 37713, win 126, options [nop,nop,TS val 213488714 ecr 3430065254], length 0
07:56:37.186181 IP 10.8.3.4.39240 > 185.42.205.35.1935: Flags [P.], seq 45597:46753, ack 1, win 501, options [nop,nop,TS val 3430065576 ecr 213488714], length 1156
07:56:37.234201 IP 10.8.3.4.39240 > 185.42.205.35.1935: Flags [.], seq 46753:48067, ack 1, win 501, options [nop,nop,TS val 3430065624 ecr 213488714], length 1314
07:56:37.267869 IP 10.8.3.4.39240 > 185.42.205.35.1935: Flags [.], seq 48067:49381, ack 1, win 501, options [nop,nop,TS val 3430065658 ecr 213488714], length 1314
07:56:37.281562 IP 185.42.205.35.1935 > 10.8.3.4.39240: Flags [.], ack 40341, win 126, options [nop,nop,TS val 213488810 ecr 3430065324], length 0
07:56:37.306346 IP 10.8.3.4.39240 > 185.42.205.35.1935: Flags [.], seq 49381:50695, ack 1, win 501, options [nop,nop,TS val 3430065696 ecr 213488810], length 1314
07:56:37.368205 IP 10.8.3.4.39240 > 185.42.205.35.1935: Flags [.], seq 50695:52009, ack 1, win 501, options [nop,nop,TS val 3430065758 ecr 213488810], length 1314
07:56:37.381536 IP 185.42.205.35.1935 > 10.8.3.4.39240: Flags [.], ack 42969, win 126, options [nop,nop,TS val 213488910 ecr 3430065388], length 0
07:56:37.397691 IP 10.8.3.4.39240 > 185.42.205.35.1935: Flags [.], seq 52009:53323, ack 1, win 501, options [nop,nop,TS val 3430065788 ecr 213488910], length 1314
07:56:37.434296 IP 10.8.3.4.39240 > 185.42.205.35.1935: Flags [.], seq 53323:54637, ack 1, win 501, options [nop,nop,TS val 3430065824 ecr 213488910], length 1314
07:56:37.447893 IP 185.42.205.35.1935 > 10.8.3.4.39240: Flags [.], ack 45597, win 126, options [nop,nop,TS val 213488976 ecr 3430065491], length 0
07:56:37.499953 IP 185.42.205.35.1935 > 10.8.3.4.39240: Flags [.], ack 46753, win 126, options [nop,nop,TS val 213489028 ecr 3430065576], length 0
07:56:37.499997 IP 10.8.3.4.39240 > 185.42.205.35.1935: Flags [P.], seq 54637:55806, ack 1, win 501, options [nop,nop,TS val 3430065890 ecr 213489028], length 1169
07:56:37.532676 IP 10.8.3.4.39240 > 185.42.205.35.1935: Flags [.], seq 55806:57120, ack 1, win 501, options [nop,nop,TS val 3430065923 ecr 213489028], length 1314
07:56:37.565870 IP 10.8.3.4.39240 > 185.42.205.35.1935: Flags [.], seq 57120:58434, ack 1, win 501, options [nop,nop,TS val 3430065956 ecr 213489028], length 1314
07:56:37.581214 IP 185.42.205.35.1935 > 10.8.3.4.39240: Flags [.], ack 49381, win 126, options [nop,nop,TS val 213489110 ecr 3430065624], length 0
07:56:37.627206 IP 10.8.3.4.39240 > 185.42.205.35.1935: Flags [.], seq 58434:59748, ack 1, win 501, options [nop,nop,TS val 3430066017 ecr 213489110], length 1314
07:56:37.667205 IP 10.8.3.4.39240 > 185.42.205.35.1935: Flags [.], seq 59748:61062, ack 1, win 501, options [nop,nop,TS val 3430066057 ecr 213489110], length 1314
07:56:37.681193 IP 185.42.205.35.1935 > 10.8.3.4.39240: Flags [.], ack 52009, win 126, options [nop,nop,TS val 213489210 ecr 3430065696], length 0
07:56:37.700428 IP 10.8.3.4.39240 > 185.42.205.35.1935: Flags [.], seq 61062:62376, ack 1, win 501, options [nop,nop,TS val 3430066090 ecr 213489210], length 1314
07:56:37.747412 IP 185.42.205.35.1935 > 10.8.3.4.39240: Flags [.], ack 54637, win 126, options [nop,nop,TS val 213489275 ecr 3430065788], length 0
07:56:37.755654 IP 10.8.3.4.39240 > 185.42.205.35.1935: Flags [.], seq 62376:63690, ack 1, win 501, options [nop,nop,TS val 3430066146 ecr 213489275], length 1314
07:56:37.799113 IP 10.8.3.4.39240 > 185.42.205.35.1935: Flags [.], seq 63690:65004, ack 1, win 501, options [nop,nop,TS val 3430066189 ecr 213489275], length 1314
07:56:37.814612 IP 185.42.205.35.1935 > 10.8.3.4.39240: Flags [.], ack 55806, win 126, options [nop,nop,TS val 213489342 ecr 3430065890], length 0
07:56:37.814643 IP 10.8.3.4.39240 > 185.42.205.35.1935: Flags [P.], seq 65004:65609, ack 1, win 501, options [nop,nop,TS val 3430066205 ecr 213489342], length 605
07:56:37.866786 IP 10.8.3.4.39240 > 185.42.205.35.1935: Flags [.], seq 65609:66923, ack 1, win 501, options [nop,nop,TS val 3430066257 ecr 213489342], length 1314
07:56:37.878621 IP 185.42.205.35.1935 > 10.8.3.4.39240: Flags [.], ack 58434, win 126, options [nop,nop,TS val 213489407 ecr 3430065923], length 0
07:56:37.901128 IP 10.8.3.4.39240 > 185.42.205.35.1935: Flags [.], seq 66923:68237, ack 1, win 501, options [nop,nop,TS val 3430066291 ecr 213489407], length 1314
07:56:37.934476 IP 10.8.3.4.39240 > 185.42.205.35.1935: Flags [.], seq 68237:69551, ack 1, win 501, options [nop,nop,TS val 3430066324 ecr 213489407], length 1314
07:56:37.980191 IP 185.42.205.35.1935 > 10.8.3.4.39240: Flags [.], ack 61062, win 126, options [nop,nop,TS val 213489509 ecr 3430066017], length 0
07:56:37.999471 IP 10.8.3.4.39240 > 185.42.205.35.1935: Flags [.], seq 69551:70865, ack 1, win 501, options [nop,nop,TS val 3430066389 ecr 213489509], length 1314
07:56:38.034179 IP 10.8.3.4.39240 > 185.42.205.35.1935: Flags [.], seq 70865:72179, ack 1, win 501, options [nop,nop,TS val 3430066424 ecr 213489509], length 1314
07:56:38.065802 IP 10.8.3.4.39240 > 185.42.205.35.1935: Flags [.], seq 72179:73493, ack 1, win 501, options [nop,nop,TS val 3430066456 ecr 213489509], length 1314
07:56:38.069730 IP 185.42.205.35.1935 > 10.8.3.4.39240: Flags [.], ack 63690, win 126, options [nop,nop,TS val 213489598 ecr 3430066090], length 0
07:56:38.127762 IP 185.42.205.35.1935 > 10.8.3.4.39240: Flags [.], ack 65609, win 126, options [nop,nop,TS val 213489656 ecr 3430066189], length 0
07:56:38.127789 IP 10.8.3.4.39240 > 185.42.205.35.1935: Flags [P.], seq 73493:74653, ack 1, win 501, options [nop,nop,TS val 3430066518 ecr 213489656], length 1160
07:56:38.167280 IP 10.8.3.4.39240 > 185.42.205.35.1935: Flags [.], seq 74653:75967, ack 1, win 501, options [nop,nop,TS val 3430066557 ecr 213489656], length 1314
07:56:38.200416 IP 10.8.3.4.39240 > 185.42.205.35.1935: Flags [.], seq 75967:77281, ack 1, win 501, options [nop,nop,TS val 3430066590 ecr 213489656], length 1314
07:56:38.214946 IP 185.42.205.35.1935 > 10.8.3.4.39240: Flags [.], ack 68237, win 126, options [nop,nop,TS val 213489743 ecr 3430066257], length 0
07:56:38.248302 IP 10.8.3.4.39240 > 185.42.205.35.1935: Flags [.], seq 77281:78595, ack 1, win 501, options [nop,nop,TS val 3430066638 ecr 213489743], length 1314
07:56:38.300719 IP 10.8.3.4.39240 > 185.42.205.35.1935: Flags [.], seq 78595:79909, ack 1, win 501, options [nop,nop,TS val 3430066691 ecr 213489743], length 1314
07:56:38.312193 IP 185.42.205.35.1935 > 10.8.3.4.39240: Flags [.], ack 70865, win 126, options [nop,nop,TS val 213489840 ecr 3430066324], length 0
07:56:38.333937 IP 10.8.3.4.39240 > 185.42.205.35.1935: Flags [.], seq 79909:81223, ack 1, win 501, options [nop,nop,TS val 3430066724 ecr 213489840], length 1314
07:56:38.376913 IP 10.8.3.4.39240 > 185.42.205.35.1935: Flags [.], seq 81223:82537, ack 1, win 501, options [nop,nop,TS val 3430066767 ecr 213489840], length 1314
07:56:38.379049 IP 185.42.205.35.1935 > 10.8.3.4.39240: Flags [.], ack 73493, win 126, options [nop,nop,TS val 213489907 ecr 3430066424], length 0
07:56:38.433782 IP 10.8.3.4.39240 > 185.42.205.35.1935: Flags [.], seq 82537:83851, ack 1, win 501, options [nop,nop,TS val 3430066824 ecr 213489907], length 1314
07:56:38.440774 IP 185.42.205.35.1935 > 10.8.3.4.39240: Flags [.], ack 74653, win 126, options [nop,nop,TS val 213489969 ecr 3430066518], length 0
07:56:38.440811 IP 10.8.3.4.39240 > 185.42.205.35.1935: Flags [P.], seq 83851:84461, ack 1, win 501, options [nop,nop,TS val 3430066831 ecr 213489969], length 610
07:56:38.500398 IP 10.8.3.4.39240 > 185.42.205.35.1935: Flags [.], seq 84461:85775, ack 1, win 501, options [nop,nop,TS val 3430066890 ecr 213489969], length 1314
07:56:38.513176 IP 185.42.205.35.1935 > 10.8.3.4.39240: Flags [.], ack 77281, win 126, options [nop,nop,TS val 213490041 ecr 3430066557], length 0
07:56:38.533757 IP 10.8.3.4.39240 > 185.42.205.35.1935: Flags [.], seq 85775:87089, ack 1, win 501, options [nop,nop,TS val 3430066924 ecr 213490041], length 1314
07:56:38.570121 IP 10.8.3.4.39240 > 185.42.205.35.1935: Flags [.], seq 87089:88403, ack 1, win 501, options [nop,nop,TS val 3430066960 ecr 213490041], length 1314
07:56:38.614018 IP 185.42.205.35.1935 > 10.8.3.4.39240: Flags [.], ack 79909, win 126, options [nop,nop,TS val 213490142 ecr 3430066638], length 0
07:56:38.634289 IP 10.8.3.4.39240 > 185.42.205.35.1935: Flags [.], seq 88403:89717, ack 1, win 501, options [nop,nop,TS val 3430067024 ecr 213490142], length 1314
07:56:38.667656 IP 10.8.3.4.39240 > 185.42.205.35.1935: Flags [.], seq 89717:91031, ack 1, win 501, options [nop,nop,TS val 3430067058 ecr 213490142], length 1314
07:56:38.689974 IP 185.42.205.35.1935 > 10.8.3.4.39240: Flags [.], ack 82537, win 126, options [nop,nop,TS val 213490218 ecr 3430066724], length 0
07:56:38.699630 IP 10.8.3.4.39240 > 185.42.205.35.1935: Flags [.], seq 91031:92345, ack 1, win 501, options [nop,nop,TS val 3430067090 ecr 213490218], length 1314
07:56:38.753554 IP 185.42.205.35.1935 > 10.8.3.4.39240: Flags [.], ack 84461, win 126, options [nop,nop,TS val 213490282 ecr 3430066824], length 0
07:56:38.753571 IP 10.8.3.4.39240 > 185.42.205.35.1935: Flags [P.], seq 92345:93505, ack 1, win 501, options [nop,nop,TS val 3430067144 ecr 213490282], length 1160
07:56:38.800876 IP 10.8.3.4.39240 > 185.42.205.35.1935: Flags [.], seq 93505:94819, ack 1, win 501, options [nop,nop,TS val 3430067191 ecr 213490282], length 1314
07:56:38.834551 IP 10.8.3.4.39240 > 185.42.205.35.1935: Flags [.], seq 94819:96133, ack 1, win 501, options [nop,nop,TS val 3430067224 ecr 213490282], length 1314
07:56:38.846753 IP 185.42.205.35.1935 > 10.8.3.4.39240: Flags [.], ack 87089, win 126, options [nop,nop,TS val 213490375 ecr 3430066890], length 0
07:56:38.869761 IP 10.8.3.4.39240 > 185.42.205.35.1935: Flags [.], seq 96133:97447, ack 1, win 501, options [nop,nop,TS val 3430067260 ecr 213490375], length 1314
07:56:38.933873 IP 10.8.3.4.39240 > 185.42.205.35.1935: Flags [.], seq 97447:98761, ack 1, win 501, options [nop,nop,TS val 3430067324 ecr 213490375], length 1314
07:56:38.947232 IP 185.42.205.35.1935 > 10.8.3.4.39240: Flags [.], ack 89717, win 126, options [nop,nop,TS val 213490476 ecr 3430066960], length 0
07:56:38.967546 IP 10.8.3.4.39240 > 185.42.205.35.1935: Flags [.], seq 98761:100075, ack 1, win 501, options [nop,nop,TS val 3430067357 ecr 213490476], length 1314
07:56:39.000499 IP 10.8.3.4.39240 > 185.42.205.35.1935: Flags [.], seq 100075:101389, ack 1, win 501, options [nop,nop,TS val 3430067390 ecr 213490476], length 1314
07:56:39.012433 IP 185.42.205.35.1935 > 10.8.3.4.39240: Flags [.], ack 92345, win 126, options [nop,nop,TS val 213490541 ecr 3430067058], length 0
07:56:39.066058 IP 10.8.3.4.39240 > 185.42.205.35.1935: Flags [.], seq 101389:102703, ack 1, win 501, options [nop,nop,TS val 3430067456 ecr 213490541], length 1314
07:56:39.066196 IP 185.42.205.35.1935 > 10.8.3.4.39240: Flags [.], ack 93505, win 126, options [nop,nop,TS val 213490595 ecr 3430067144], length 0
07:56:39.066214 IP 10.8.3.4.39240 > 185.42.205.35.1935: Flags [P.], seq 102703:103401, ack 1, win 501, options [nop,nop,TS val 3430067456 ecr 213490595], length 698
07:56:39.130220 IP 10.8.3.4.39240 > 185.42.205.35.1935: Flags [.], seq 103401:104715, ack 1, win 501, options [nop,nop,TS val 3430067520 ecr 213490595], length 1314
07:56:39.147303 IP 185.42.205.35.1935 > 10.8.3.4.39240: Flags [.], ack 96133, win 126, options [nop,nop,TS val 213490676 ecr 3430067191], length 0
07:56:39.168824 IP 10.8.3.4.39240 > 185.42.205.35.1935: Flags [.], seq 104715:106029, ack 1, win 501, options [nop,nop,TS val 3430067559 ecr 213490676], length 1314
07:56:39.199248 IP 10.8.3.4.39240 > 185.42.205.35.1935: Flags [.], seq 106029:107343, ack 1, win 501, options [nop,nop,TS val 3430067589 ecr 213490676], length 1314
07:56:39.246754 IP 185.42.205.35.1935 > 10.8.3.4.39240: Flags [.], ack 98761, win 126, options [nop,nop,TS val 213490775 ecr 3430067260], length 0
07:56:39.266773 IP 10.8.3.4.39240 > 185.42.205.35.1935: Flags [.], seq 107343:108657, ack 1, win 501, options [nop,nop,TS val 3430067657 ecr 213490775], length 1314
07:56:39.298921 IP 10.8.3.4.39240 > 185.42.205.35.1935: Flags [.], seq 108657:109971, ack 1, win 501, options [nop,nop,TS val 3430067689 ecr 213490775], length 1314
07:56:39.313480 IP 185.42.205.35.1935 > 10.8.3.4.39240: Flags [.], ack 101389, win 126, options [nop,nop,TS val 213490842 ecr 3430067357], length 0
07:56:39.331415 IP 10.8.3.4.39240 > 185.42.205.35.1935: Flags [.], seq 109971:111285, ack 1, win 501, options [nop,nop,TS val 3430067721 ecr 213490842], length 1314
07:56:39.380945 IP 185.42.205.35.1935 > 10.8.3.4.39240: Flags [.], ack 103401, win 126, options [nop,nop,TS val 213490908 ecr 3430067456], length 0
07:56:39.380983 IP 10.8.3.4.39240 > 185.42.205.35.1935: Flags [P.], seq 111285:112363, ack 1, win 501, options [nop,nop,TS val 3430067771 ecr 213490908], length 1078
07:56:39.434329 IP 10.8.3.4.39240 > 185.42.205.35.1935: Flags [.], seq 112363:113677, ack 1, win 501, options [nop,nop,TS val 3430067824 ecr 213490908], length 1314
07:56:39.468336 IP 10.8.3.4.39240 > 185.42.205.35.1935: Flags [.], seq 113677:114991, ack 1, win 501, options [nop,nop,TS val 3430067858 ecr 213490908], length 1314
07:56:39.481583 IP 185.42.205.35.1935 > 10.8.3.4.39240: Flags [.], ack 106029, win 126, options [nop,nop,TS val 213491010 ecr 3430067520], length 0
07:56:39.501046 IP 10.8.3.4.39240 > 185.42.205.35.1935: Flags [.], seq 114991:116305, ack 1, win 501, options [nop,nop,TS val 3430067891 ecr 213491010], length 1314
07:56:39.567879 IP 10.8.3.4.39240 > 185.42.205.35.1935: Flags [.], seq 116305:117619, ack 1, win 501, options [nop,nop,TS val 3430067958 ecr 213491010], length 1314
07:56:39.579628 IP 185.42.205.35.1935 > 10.8.3.4.39240: Flags [.], ack 108657, win 126, options [nop,nop,TS val 213491108 ecr 3430067589], length 0
07:56:39.601095 IP 10.8.3.4.39240 > 185.42.205.35.1935: Flags [.], seq 117619:118933, ack 1, win 501, options [nop,nop,TS val 3430067991 ecr 213491108], length 1314
07:56:39.640621 IP 10.8.3.4.39240 > 185.42.205.35.1935: Flags [.], seq 118933:120247, ack 1, win 501, options [nop,nop,TS val 3430068031 ecr 213491108], length 1314
07:56:39.644389 IP 185.42.205.35.1935 > 10.8.3.4.39240: Flags [.], ack 111285, win 126, options [nop,nop,TS val 213491173 ecr 3430067689], length 0
07:56:39.693977 IP 185.42.205.35.1935 > 10.8.3.4.39240: Flags [.], ack 112363, win 126, options [nop,nop,TS val 213491222 ecr 3430067771], length 0
07:56:39.694002 IP 10.8.3.4.39240 > 185.42.205.35.1935: Flags [P.], seq 120247:121403, ack 1, win 501, options [nop,nop,TS val 3430068084 ecr 213491222], length 1156
07:56:39.732652 IP 10.8.3.4.39240 > 185.42.205.35.1935: Flags [.], seq 121403:122717, ack 1, win 501, options [nop,nop,TS val 3430068123 ecr 213491222], length 1314
07:56:39.769080 IP 10.8.3.4.39240 > 185.42.205.35.1935: Flags [.], seq 122717:124031, ack 1, win 501, options [nop,nop,TS val 3430068159 ecr 213491222], length 1314
07:56:39.781186 IP 185.42.205.35.1935 > 10.8.3.4.39240: Flags [.], ack 114991, win 126, options [nop,nop,TS val 213491309 ecr 3430067824], length 0
07:56:39.811985 IP 10.8.3.4.39240 > 185.42.205.35.1935: Flags [.], seq 124031:125345, ack 1, win 501, options [nop,nop,TS val 3430068202 ecr 213491309], length 1314
07:56:39.867577 IP 10.8.3.4.39240 > 185.42.205.35.1935: Flags [.], seq 125345:126659, ack 1, win 501, options [nop,nop,TS val 3430068258 ecr 213491309], length 1314
07:56:39.881402 IP 185.42.205.35.1935 > 10.8.3.4.39240: Flags [.], ack 117619, win 126, options [nop,nop,TS val 213491410 ecr 3430067891], length 0
07:56:39.901305 IP 10.8.3.4.39240 > 185.42.205.35.1935: Flags [.], seq 126659:127973, ack 1, win 501, options [nop,nop,TS val 3430068291 ecr 213491410], length 1314
07:56:39.941087 IP 10.8.3.4.39240 > 185.42.205.35.1935: Flags [.], seq 127973:129287, ack 1, win 501, options [nop,nop,TS val 3430068331 ecr 213491410], length 1314
07:56:39.955020 IP 185.42.205.35.1935 > 10.8.3.4.39240: Flags [.], ack 120247, win 126, options [nop,nop,TS val 213491482 ecr 3430067991], length 0
07:56:40.005039 IP 10.8.3.4.39240 > 185.42.205.35.1935: Flags [.], seq 129287:130601, ack 1, win 501, options [nop,nop,TS val 3430068395 ecr 213491482], length 1314
07:56:40.012172 IP 185.42.205.35.1935 > 10.8.3.4.39240: Flags [.], ack 121403, win 126, options [nop,nop,TS val 213491535 ecr 3430068084], length 0
07:56:40.012189 IP 10.8.3.4.39240 > 185.42.205.35.1935: Flags [P.], seq 130601:131306, ack 1, win 501, options [nop,nop,TS val 3430068402 ecr 213491535], length 705
07:56:40.069165 IP 10.8.3.4.39240 > 185.42.205.35.1935: Flags [.], seq 131306:132620, ack 1, win 501, options [nop,nop,TS val 3430068459 ecr 213491535], length 1314
07:56:40.082054 IP 185.42.205.35.1935 > 10.8.3.4.39240: Flags [.], ack 124031, win 126, options [nop,nop,TS val 213491610 ecr 3430068123], length 0
07:56:40.100980 IP 10.8.3.4.39240 > 185.42.205.35.1935: Flags [.], seq 132620:133934, ack 1, win 501, options [nop,nop,TS val 3430068491 ecr 213491610], length 1314
07:56:40.133215 IP 10.8.3.4.39240 > 185.42.205.35.1935: Flags [.], seq 133934:135248, ack 1, win 501, options [nop,nop,TS val 3430068523 ecr 213491610], length 1314
07:56:40.182017 IP 185.42.205.35.1935 > 10.8.3.4.39240: Flags [.], ack 126659, win 126, options [nop,nop,TS val 213491710 ecr 3430068202], length 0
07:56:40.196787 IP 10.8.3.4.39240 > 185.42.205.35.1935: Flags [.], seq 135248:136562, ack 1, win 501, options [nop,nop,TS val 3430068587 ecr 213491710], length 1314
07:56:40.239424 IP 10.8.3.4.39240 > 185.42.205.35.1935: Flags [.], seq 136562:137876, ack 1, win 501, options [nop,nop,TS val 3430068629 ecr 213491710], length 1314
07:56:40.254038 IP 185.42.205.35.1935 > 10.8.3.4.39240: Flags [.], ack 129287, win 126, options [nop,nop,TS val 213491782 ecr 3430068291], length 0
07:56:40.267583 IP 10.8.3.4.39240 > 185.42.205.35.1935: Flags [.], seq 137876:139190, ack 1, win 501, options [nop,nop,TS val 3430068658 ecr 213491782], length 1314
07:56:40.327802 IP 185.42.205.35.1935 > 10.8.3.4.39240: Flags [.], ack 131306, win 126, options [nop,nop,TS val 213491856 ecr 3430068395], length 0
07:56:40.327838 IP 10.8.3.4.39240 > 185.42.205.35.1935: Flags [P.], seq 139190:140350, ack 1, win 501, options [nop,nop,TS val 3430068718 ecr 213491856], length 1160
07:56:40.368248 IP 10.8.3.4.39240 > 185.42.205.35.1935: Flags [.], seq 140350:141664, ack 1, win 501, options [nop,nop,TS val 3430068758 ecr 213491856], length 1314
07:56:40.400802 IP 10.8.3.4.39240 > 185.42.205.35.1935: Flags [.], seq 141664:142978, ack 1, win 501, options [nop,nop,TS val 3430068791 ecr 213491856], length 1314
07:56:40.413763 IP 185.42.205.35.1935 > 10.8.3.4.39240: Flags [.], ack 133934, win 126, options [nop,nop,TS val 213491942 ecr 3430068459], length 0
07:56:40.453626 IP 10.8.3.4.39240 > 185.42.205.35.1935: Flags [.], seq 142978:144292, ack 1, win 501, options [nop,nop,TS val 3430068844 ecr 213491942], length 1314
07:56:40.497705 IP 10.8.3.4.39240 > 185.42.205.35.1935: Flags [.], seq 144292:145606, ack 1, win 501, options [nop,nop,TS val 3430068888 ecr 213491942], length 1314
07:56:40.509869 IP 185.42.205.35.1935 > 10.8.3.4.39240: Flags [.], ack 136562, win 126, options [nop,nop,TS val 213492038 ecr 3430068523], length 0
07:56:40.538912 IP 10.8.3.4.39240 > 185.42.205.35.1935: Flags [.], seq 145606:146920, ack 1, win 501, options [nop,nop,TS val 3430068929 ecr 213492038], length 1314
07:56:40.580477 IP 185.42.205.35.1935 > 10.8.3.4.39240: Flags [.], ack 139190, win 126, options [nop,nop,TS val 213492109 ecr 3430068629], length 0
07:56:40.581893 IP 10.8.3.4.39240 > 185.42.205.35.1935: Flags [.], seq 146920:148234, ack 1, win 501, options [nop,nop,TS val 3430068972 ecr 213492109], length 1314
07:56:40.632714 IP 10.8.3.4.39240 > 185.42.205.35.1935: Flags [.], seq 148234:149548, ack 1, win 501, options [nop,nop,TS val 3430069023 ecr 213492109], length 1314
07:56:40.642001 IP 185.42.205.35.1935 > 10.8.3.4.39240: Flags [.], ack 140350, win 126, options [nop,nop,TS val 213492169 ecr 3430068718], length 0
07:56:40.642030 IP 10.8.3.4.39240 > 185.42.205.35.1935: Flags [P.], seq 149548:150149, ack 1, win 501, options [nop,nop,TS val 3430069032 ecr 213492169], length 601
07:56:40.709928 IP 10.8.3.4.39240 > 185.42.205.35.1935: Flags [.], seq 150149:151463, ack 1, win 501, options [nop,nop,TS val 3430069100 ecr 213492169], length 1314
07:56:40.713888 IP 185.42.205.35.1935 > 10.8.3.4.39240: Flags [.], ack 142978, win 126, options [nop,nop,TS val 213492242 ecr 3430068758], length 0
07:56:40.731059 IP 10.8.3.4.39240 > 185.42.205.35.1935: Flags [.], seq 151463:152777, ack 1, win 501, options [nop,nop,TS val 3430069121 ecr 213492242], length 1314
07:56:40.773598 IP 10.8.3.4.39240 > 185.42.205.35.1935: Flags [.], seq 152777:154091, ack 1, win 501, options [nop,nop,TS val 3430069164 ecr 213492242], length 1314
07:56:40.810506 IP 185.42.205.35.1935 > 10.8.3.4.39240: Flags [.], ack 145606, win 126, options [nop,nop,TS val 213492339 ecr 3430068844], length 0
07:56:40.837999 IP 10.8.3.4.39240 > 185.42.205.35.1935: Flags [.], seq 154091:155405, ack 1, win 501, options [nop,nop,TS val 3430069228 ecr 213492339], length 1314
07:56:40.863453 IP 10.8.3.4.39240 > 185.42.205.35.1935: Flags [.], seq 155405:156719, ack 1, win 501, options [nop,nop,TS val 3430069253 ecr 213492339], length 1314
07:56:40.894619 IP 185.42.205.35.1935 > 10.8.3.4.39240: Flags [.], ack 148234, win 126, options [nop,nop,TS val 213492423 ecr 3430068929], length 0
07:56:40.901661 IP 10.8.3.4.39240 > 185.42.205.35.1935: Flags [.], seq 156719:158033, ack 1, win 501, options [nop,nop,TS val 3430069292 ecr 213492423], length 1314
07:56:40.955045 IP 185.42.205.35.1935 > 10.8.3.4.39240: Flags [.], ack 150149, win 126, options [nop,nop,TS val 213492483 ecr 3430069023], length 0
07:56:40.955083 IP 10.8.3.4.39240 > 185.42.205.35.1935: Flags [P.], seq 158033:159205, ack 1, win 501, options [nop,nop,TS val 3430069345 ecr 213492483], length 1172
07:56:41.008933 IP 10.8.3.4.39240 > 185.42.205.35.1935: Flags [.], seq 159205:160519, ack 1, win 501, options [nop,nop,TS val 3430069399 ecr 213492483], length 1314
07:56:41.031817 IP 10.8.3.4.39240 > 185.42.205.35.1935: Flags [.], seq 160519:161833, ack 1, win 501, options [nop,nop,TS val 3430069422 ecr 213492483], length 1314
07:56:41.044262 IP 185.42.205.35.1935 > 10.8.3.4.39240: Flags [.], ack 152777, win 126, options [nop,nop,TS val 213492573 ecr 3430069100], length 0
07:56:41.073311 IP 10.8.3.4.39240 > 185.42.205.35.1935: Flags [.], seq 161833:163147, ack 1, win 501, options [nop,nop,TS val 3430069463 ecr 213492573], length 1314
07:56:41.137674 IP 10.8.3.4.39240 > 185.42.205.35.1935: Flags [.], seq 163147:164461, ack 1, win 501, options [nop,nop,TS val 3430069528 ecr 213492573], length 1314
07:56:41.150991 IP 185.42.205.35.1935 > 10.8.3.4.39240: Flags [.], ack 155405, win 126, options [nop,nop,TS val 213492679 ecr 3430069164], length 0
07:56:41.166169 IP 10.8.3.4.39240 > 185.42.205.35.1935: Flags [.], seq 164461:165775, ack 1, win 501, options [nop,nop,TS val 3430069556 ecr 213492679], length 1314
07:56:41.201732 IP 10.8.3.4.39240 > 185.42.205.35.1935: Flags [.], seq 165775:167089, ack 1, win 501, options [nop,nop,TS val 3430069592 ecr 213492679], length 1314
07:56:41.216261 IP 185.42.205.35.1935 > 10.8.3.4.39240: Flags [.], ack 158033, win 126, options [nop,nop,TS val 213492743 ecr 3430069253], length 0
07:56:41.268151 IP 10.8.3.4.39240 > 185.42.205.35.1935: Flags [.], seq 167089:168403, ack 1, win 501, options [nop,nop,TS val 3430069658 ecr 213492743], length 1314
07:56:41.270592 IP 185.42.205.35.1935 > 10.8.3.4.39240: Flags [.], ack 159205, win 126, options [nop,nop,TS val 213492796 ecr 3430069345], length 0
07:56:41.270624 IP 10.8.3.4.39240 > 185.42.205.35.1935: Flags [P.], seq 168403:169094, ack 1, win 501, options [nop,nop,TS val 3430069661 ecr 213492796], length 691
07:56:41.331305 IP 10.8.3.4.39240 > 185.42.205.35.1935: Flags [.], seq 169094:170408, ack 1, win 501, options [nop,nop,TS val 3430069721 ecr 213492796], length 1314
07:56:41.344789 IP 185.42.205.35.1935 > 10.8.3.4.39240: Flags [.], ack 161833, win 126, options [nop,nop,TS val 213492873 ecr 3430069399], length 0
07:56:41.373267 IP 10.8.3.4.39240 > 185.42.205.35.1935: Flags [.], seq 170408:171722, ack 1, win 501, options [nop,nop,TS val 3430069763 ecr 213492873], length 1314
07:56:41.400965 IP 10.8.3.4.39240 > 185.42.205.35.1935: Flags [.], seq 171722:173036, ack 1, win 501, options [nop,nop,TS val 3430069791 ecr 213492873], length 1314
07:56:41.451035 IP 185.42.205.35.1935 > 10.8.3.4.39240: Flags [.], ack 164461, win 126, options [nop,nop,TS val 213492979 ecr 3430069463], length 0
07:56:41.467633 IP 10.8.3.4.39240 > 185.42.205.35.1935: Flags [.], seq 173036:174350, ack 1, win 501, options [nop,nop,TS val 3430069858 ecr 213492979], length 1314
07:56:41.501244 IP 10.8.3.4.39240 > 185.42.205.35.1935: Flags [.], seq 174350:175664, ack 1, win 501, options [nop,nop,TS val 3430069891 ecr 213492979], length 1314
07:56:41.514991 IP 185.42.205.35.1935 > 10.8.3.4.39240: Flags [.], ack 167089, win 126, options [nop,nop,TS val 213493043 ecr 3430069556], length 0
07:56:41.534570 IP 10.8.3.4.39240 > 185.42.205.35.1935: Flags [.], seq 175664:176978, ack 1, win 501, options [nop,nop,TS val 3430069925 ecr 213493043], length 1314
07:56:41.583624 IP 185.42.205.35.1935 > 10.8.3.4.39240: Flags [.], ack 169094, win 126, options [nop,nop,TS val 213493112 ecr 3430069658], length 0
07:56:41.583647 IP 10.8.3.4.39240 > 185.42.205.35.1935: Flags [P.], seq 176978:178150, ack 1, win 501, options [nop,nop,TS val 3430069974 ecr 213493112], length 1172
07:56:41.630642 IP 10.8.3.4.39240 > 185.42.205.35.1935: Flags [.], seq 178150:179464, ack 1, win 501, options [nop,nop,TS val 3430070021 ecr 213493112], length 1314
07:56:41.666795 IP 10.8.3.4.39240 > 185.42.205.35.1935: Flags [.], seq 179464:180778, ack 1, win 501, options [nop,nop,TS val 3430070057 ecr 213493112], length 1314
07:56:41.686445 IP 185.42.205.35.1935 > 10.8.3.4.39240: Flags [.], ack 171722, win 126, options [nop,nop,TS val 213493215 ecr 3430069721], length 0
07:56:41.700100 IP 10.8.3.4.39240 > 185.42.205.35.1935: Flags [.], seq 180778:182092, ack 1, win 501, options [nop,nop,TS val 3430070090 ecr 213493215], length 1314
07:56:41.767223 IP 10.8.3.4.39240 > 185.42.205.35.1935: Flags [.], seq 182092:183406, ack 1, win 501, options [nop,nop,TS val 3430070157 ecr 213493215], length 1314
07:56:41.780608 IP 185.42.205.35.1935 > 10.8.3.4.39240: Flags [.], ack 174350, win 126, options [nop,nop,TS val 213493309 ecr 3430069791], length 0
07:56:41.800976 IP 10.8.3.4.39240 > 185.42.205.35.1935: Flags [.], seq 183406:184720, ack 1, win 501, options [nop,nop,TS val 3430070191 ecr 213493309], length 1314
07:56:41.831328 IP 10.8.3.4.39240 > 185.42.205.35.1935: Flags [.], seq 184720:186034, ack 1, win 501, options [nop,nop,TS val 3430070221 ecr 213493309], length 1314
07:56:41.847628 IP 185.42.205.35.1935 > 10.8.3.4.39240: Flags [.], ack 176978, win 126, options [nop,nop,TS val 213493376 ecr 3430069891], length 0
07:56:41.896273 IP 185.42.205.35.1935 > 10.8.3.4.39240: Flags [.], ack 178150, win 126, options [nop,nop,TS val 213493425 ecr 3430069974], length 0
07:56:41.896310 IP 10.8.3.4.39240 > 185.42.205.35.1935: Flags [P.], seq 186034:187194, ack 1, win 501, options [nop,nop,TS val 3430070286 ecr 213493425], length 1160
07:56:41.930399 IP 10.8.3.4.39240 > 185.42.205.35.1935: Flags [.], seq 187194:188508, ack 1, win 501, options [nop,nop,TS val 3430070320 ecr 213493425], length 1314
07:56:41.966473 IP 10.8.3.4.39240 > 185.42.205.35.1935: Flags [.], seq 188508:189822, ack 1, win 501, options [nop,nop,TS val 3430070356 ecr 213493425], length 1314
07:56:41.979665 IP 185.42.205.35.1935 > 10.8.3.4.39240: Flags [.], ack 180778, win 126, options [nop,nop,TS val 213493508 ecr 3430070021], length 0
07:56:42.015821 IP 10.8.3.4.39240 > 185.42.205.35.1935: Flags [.], seq 189822:191136, ack 1, win 501, options [nop,nop,TS val 3430070406 ecr 213493508], length 1314
07:56:42.064955 IP 10.8.3.4.39240 > 185.42.205.35.1935: Flags [.], seq 191136:192450, ack 1, win 501, options [nop,nop,TS val 3430070455 ecr 213493508], length 1314
07:56:42.080229 IP 185.42.205.35.1935 > 10.8.3.4.39240: Flags [.], ack 183406, win 126, options [nop,nop,TS val 213493609 ecr 3430070090], length 0
07:56:42.098664 IP 10.8.3.4.39240 > 185.42.205.35.1935: Flags [.], seq 192450:193764, ack 1, win 501, options [nop,nop,TS val 3430070489 ecr 213493609], length 1314
07:56:42.143670 IP 10.8.3.4.39240 > 185.42.205.35.1935: Flags [.], seq 193764:195078, ack 1, win 501, options [nop,nop,TS val 3430070534 ecr 213493609], length 1314
07:56:42.144492 IP 185.42.205.35.1935 > 10.8.3.4.39240: Flags [.], ack 186034, win 126, options [nop,nop,TS val 213493672 ecr 3430070191], length 0
07:56:42.196722 IP 10.8.3.4.39240 > 185.42.205.35.1935: Flags [.], seq 195078:196392, ack 1, win 501, options [nop,nop,TS val 3430070587 ecr 213493672], length 1314
07:56:42.208939 IP 185.42.205.35.1935 > 10.8.3.4.39240: Flags [.], ack 187194, win 126, options [nop,nop,TS val 213493737 ecr 3430070286], length 0
07:56:42.208953 IP 10.8.3.4.39240 > 185.42.205.35.1935: Flags [P.], seq 196392:197089, ack 1, win 501, options [nop,nop,TS val 3430070599 ecr 213493737], length 697
07:56:42.267848 IP 10.8.3.4.39240 > 185.42.205.35.1935: Flags [.], seq 197089:198403, ack 1, win 501, options [nop,nop,TS val 3430070658 ecr 213493737], length 1314
07:56:42.279244 IP 185.42.205.35.1935 > 10.8.3.4.39240: Flags [.], ack 189822, win 126, options [nop,nop,TS val 213493808 ecr 3430070320], length 0
07:56:42.297031 IP 10.8.3.4.39240 > 185.42.205.35.1935: Flags [.], seq 198403:199717, ack 1, win 501, options [nop,nop,TS val 3430070687 ecr 213493808], length 1314
07:56:42.335149 IP 10.8.3.4.39240 > 185.42.205.35.1935: Flags [.], seq 199717:201031, ack 1, win 501, options [nop,nop,TS val 3430070725 ecr 213493808], length 1314
07:56:42.378035 IP 185.42.205.35.1935 > 10.8.3.4.39240: Flags [.], ack 192450, win 126, options [nop,nop,TS val 213493906 ecr 3430070406], length 0
07:56:42.399421 IP 10.8.3.4.39240 > 185.42.205.35.1935: Flags [.], seq 201031:202345, ack 1, win 501, options [nop,nop,TS val 3430070789 ecr 213493906], length 1314
07:56:42.434048 IP 10.8.3.4.39240 > 185.42.205.35.1935: Flags [.], seq 202345:203659, ack 1, win 501, options [nop,nop,TS val 3430070824 ecr 213493906], length 1314
07:56:42.456878 IP 185.42.205.35.1935 > 10.8.3.4.39240: Flags [.], ack 195078, win 126, options [nop,nop,TS val 213493985 ecr 3430070489], length 0
07:56:42.467797 IP 10.8.3.4.39240 > 185.42.205.35.1935: Flags [.], seq 203659:204973, ack 1, win 501, options [nop,nop,TS val 3430070858 ecr 213493985], length 1314
07:56:42.521734 IP 185.42.205.35.1935 > 10.8.3.4.39240: Flags [.], ack 197089, win 126, options [nop,nop,TS val 213494050 ecr 3430070587], length 0
07:56:42.521757 IP 10.8.3.4.39240 > 185.42.205.35.1935: Flags [P.], seq 204973:206050, ack 1, win 501, options [nop,nop,TS val 3430070912 ecr 213494050], length 1077
07:56:42.567579 IP 10.8.3.4.39240 > 185.42.205.35.1935: Flags [.], seq 206050:207364, ack 1, win 501, options [nop,nop,TS val 3430070958 ecr 213494050], length 1314
