09:32:15.121586 IP 10.8.3.3.58490 > 99.181.96.136.1935: Flags [.], seq 3011444217:3011445531, ack 1007090818, win 501, options [nop,nop,TS val 1016207656 ecr 3468495025], length 1314
09:32:15.146492 IP 10.8.3.3.58490 > 99.181.96.136.1935: Flags [.], seq 1314:2628, ack 1, win 501, options [nop,nop,TS val 1016207681 ecr 3468495025], length 1314
09:32:15.152003 IP 99.181.96.136.1935 > 10.8.3.3.58490: Flags [.], ack 4294964928, win 126, options [nop,nop,TS val 3468495099 ecr 1016207487], length 0
09:32:15.189456 IP 10.8.3.3.58490 > 99.181.96.136.1935: Flags [.], seq 2628:3942, ack 1, win 501, options [nop,nop,TS val 1016207724 ecr 3468495099], length 1314
09:32:15.253735 IP 10.8.3.3.58490 > 99.181.96.136.1935: Flags [.], seq 3942:5256, ack 1, win 501, options [nop,nop,TS val 1016207788 ecr 3468495099], length 1314
09:32:15.254340 IP 99.181.96.136.1935 > 10.8.3.3.58490: Flags [.], ack 0, win 126, options [nop,nop,TS val 3468495202 ecr 1016207557], length 0
09:32:15.254368 IP 10.8.3.3.58490 > 99.181.96.136.1935: Flags [P.], seq 5256:5834, ack 1, win 501, options [nop,nop,TS val 1016207789 ecr 3468495202], length 578
09:32:15.318159 IP 10.8.3.3.58490 > 99.181.96.136.1935: Flags [.], seq 5834:7148, ack 1, win 501, options [nop,nop,TS val 1016207852 ecr 3468495202], length 1314
09:32:15.323750 IP 99.181.96.136.1935 > 10.8.3.3.58490: Flags [.], ack 2628, win 126, options [nop,nop,TS val 3468495271 ecr 1016207656], length 0
09:32:15.355072 IP 10.8.3.3.58490 > 99.181.96.136.1935: Flags [.], seq 7148:8462, ack 1, win 501, options [nop,nop,TS val 1016207889 ecr 3468495271], length 1314
09:32:15.382388 IP 10.8.3.3.58490 > 99.181.96.136.1935: Flags [.], seq 8462:9776, ack 1, win 501, options [nop,nop,TS val 1016207917 ecr 3468495271], length 1314
09:32:15.430591 IP 99.181.96.136.1935 > 10.8.3.3.58490: Flags [.], ack 5256, win 126, options [nop,nop,TS val 3468495378 ecr 1016207724], length 0
09:32:15.431234 IP 99.181.96.136.1935 > 10.8.3.3.58490: Flags [.], ack 5834, win 126, options [nop,nop,TS val 3468495378 ecr 1016207789], length 0
09:32:15.431268 IP 10.8.3.3.58490 > 99.181.96.136.1935: Flags [P.], seq 9776:10929, ack 1, win 501, options [nop,nop,TS val 1016207966 ecr 3468495378], length 1153
09:32:15.487672 IP 10.8.3.3.58490 > 99.181.96.136.1935: Flags [.], seq 10929:12243, ack 1, win 501, options [nop,nop,TS val 1016208022 ecr 3468495378], length 1314
09:32:15.511131 IP 10.8.3.3.58490 > 99.181.96.136.1935: Flags [.], seq 12243:13557, ack 1, win 501, options [nop,nop,TS val 1016208045 ecr 3468495378], length 1314
09:32:15.531839 IP 99.181.96.136.1935 > 10.8.3.3.58490: Flags [.], ack 8462, win 126, options [nop,nop,TS val 3468495479 ecr 1016207852], length 0
09:32:15.555877 IP 10.8.3.3.58490 > 99.181.96.136.1935: Flags [.], seq 13557:14871, ack 1, win 501, options [nop,nop,TS val 1016208090 ecr 3468495479], length 1314
09:32:15.607933 IP 99.181.96.136.1935 > 10.8.3.3.58490: Flags [.], ack 10929, win 126, options [nop,nop,TS val 3468495555 ecr 1016207917], length 0
09:32:15.607958 IP 10.8.3.3.58490 > 99.181.96.136.1935: Flags [P.], seq 14871:15928, ack 1, win 501, options [nop,nop,TS val 1016208142 ecr 3468495555], length 1057
09:32:15.651785 IP 10.8.3.3.58490 > 99.181.96.136.1935: Flags [.], seq 15928:17242, ack 1, win 501, options [nop,nop,TS val 1016208186 ecr 3468495555], length 1314
09:32:15.682132 IP 10.8.3.3.58490 > 99.181.96.136.1935: Flags [.], seq 17242:18556, ack 1, win 501, options [nop,nop,TS val 1016208216 ecr 3468495555], length 1314
09:32:15.688100 IP 99.181.96.136.1935 > 10.8.3.3.58490: Flags [.], ack 13557, win 126, options [nop,nop,TS val 3468495635 ecr 1016208022], length 0
09:32:15.724470 IP 10.8.3.3.58490 > 99.181.96.136.1935: Flags [.], seq 18556:19870, ack 1, win 501, options [nop,nop,TS val 1016208259 ecr 3468495635], length 1314
09:32:15.784931 IP 99.181.96.136.1935 > 10.8.3.3.58490: Flags [.], ack 15928, win 126, options [nop,nop,TS val 3468495732 ecr 1016208090], length 0
09:32:15.784968 IP 10.8.3.3.58490 > 99.181.96.136.1935: Flags [P.], seq 19870:20928, ack 1, win 501, options [nop,nop,TS val 1016208319 ecr 3468495732], length 1058
09:32:15.820453 IP 10.8.3.3.58490 > 99.181.96.136.1935: Flags [.], seq 20928:22242, ack 1, win 501, options [nop,nop,TS val 1016208355 ecr 3468495732], length 1314
09:32:15.852076 IP 10.8.3.3.58490 > 99.181.96.136.1935: Flags [.], seq 22242:23556, ack 1, win 501, options [nop,nop,TS val 1016208386 ecr 3468495732], length 1314
09:32:15.859402 IP 99.181.96.136.1935 > 10.8.3.3.58490: Flags [.], ack 18556, win 126, options [nop,nop,TS val 3468495806 ecr 1016208186], length 0
09:32:15.894842 IP 10.8.3.3.58490 > 99.181.96.136.1935: Flags [.], seq 23556:24870, ack 1, win 501, options [nop,nop,TS val 1016208429 ecr 3468495806], length 1314
09:32:15.954059 IP 10.8.3.3.58490 > 99.181.96.136.1935: Flags [.], seq 24870:26184, ack 1, win 501, options [nop,nop,TS val 1016208488 ecr 3468495806], length 1314
09:32:15.961702 IP 99.181.96.136.1935 > 10.8.3.3.58490: Flags [.], ack 20928, win 126, options [nop,nop,TS val 3468495909 ecr 1016208259], length 0
09:32:15.961716 IP 10.8.3.3.58490 > 99.181.96.136.1935: Flags [P.], seq 26184:26858, ack 1, win 501, options [nop,nop,TS val 1016208496 ecr 3468495909], length 674
09:32:16.018888 IP 10.8.3.3.58490 > 99.181.96.136.1935: Flags [.], seq 26858:28172, ack 1, win 501, options [nop,nop,TS val 1016208553 ecr 3468495909], length 1314
09:32:16.028955 IP 99.181.96.136.1935 > 10.8.3.3.58490: Flags [.], ack 23556, win 126, options [nop,nop,TS val 3468495976 ecr 1016208355], length 0
09:32:16.044070 IP 10.8.3.3.58490 > 99.181.96.136.1935: Flags [.], seq 28172:29486, ack 1, win 501, options [nop,nop,TS val 1016208578 ecr 3468495976], length 1314
09:32:16.089375 IP 10.8.3.3.58490 > 99.181.96.136.1935: Flags [.], seq 29486:30800, ack 1, win 501, options [nop,nop,TS val 1016208624 ecr 3468495976], length 1314
09:32:16.131164 IP 99.181.96.136.1935 > 10.8.3.3.58490: Flags [.], ack 26184, win 126, options [nop,nop,TS val 3468496078 ecr 1016208429], length 0
09:32:16.138634 IP 99.181.96.136.1935 > 10.8.3.3.58490: Flags [.], ack 26858, win 126, options [nop,nop,TS val 3468496086 ecr 1016208496], length 0
09:32:16.138669 IP 10.8.3.3.58490 > 99.181.96.136.1935: Flags [P.], seq 30800:31849, ack 1, win 501, options [nop,nop,TS val 1016208673 ecr 3468496086], length 1049
09:32:16.187743 IP 10.8.3.3.58490 > 99.181.96.136.1935: Flags [.], seq 31849:33163, ack 1, win 501, options [nop,nop,TS val 1016208722 ecr 3468496086], length 1314
09:32:16.215795 IP 10.8.3.3.58490 > 99.181.96.136.1935: Flags [.], seq 33163:34477, ack 1, win 501, options [nop,nop,TS val 1016208750 ecr 3468496086], length 1314
09:32:16.221195 IP 99.181.96.136.1935 > 10.8.3.3.58490: Flags [.], ack 29486, win 126, options [nop,nop,TS val 3468496168 ecr 1016208553], length 0
09:32:16.258050 IP 10.8.3.3.58490 > 99.181.96.136.1935: Flags [.], seq 34477:35791, ack 1, win 501, options [nop,nop,TS val 1016208792 ecr 3468496168], length 1314
09:32:16.315492 IP 99.181.96.136.1935 > 10.8.3.3.58490: Flags [.], ack 31849, win 126, options [nop,nop,TS val 3468496263 ecr 1016208624], length 0
09:32:16.315546 IP 10.8.3.3.58490 > 99.181.96.136.1935: Flags [P.], seq 35791:36848, ack 1, win 501, options [nop,nop,TS val 1016208850 ecr 3468496263], length 1057
09:32:16.355157 IP 10.8.3.3.58490 > 99.181.96.136.1935: Flags [.], seq 36848:38162, ack 1, win 501, options [nop,nop,TS val 1016208889 ecr 3468496263], length 1314
09:32:16.385727 IP 10.8.3.3.58490 > 99.181.96.136.1935: Flags [.], seq 38162:39476, ack 1, win 501, options [nop,nop,TS val 1016208920 ecr 3468496263], length 1314
09:32:16.392598 IP 99.181.96.136.1935 > 10.8.3.3.58490: Flags [.], ack 34477, win 126, options [nop,nop,TS val 3468496340 ecr 1016208722], length 0
09:32:16.428187 IP 10.8.3.3.58490 > 99.181.96.136.1935: Flags [.], seq 39476:40790, ack 1, win 501, options [nop,nop,TS val 1016208963 ecr 3468496340], length 1314
09:32:16.490685 IP 10.8.3.3.58490 > 99.181.96.136.1935: Flags [.], seq 40790:42104, ack 1, win 501, options [nop,nop,TS val 1016209025 ecr 3468496340], length 1314
09:32:16.492343 IP 99.181.96.136.1935 > 10.8.3.3.58490: Flags [.], ack 36848, win 126, options [nop,nop,TS val 3468496440 ecr 1016208792], length 0
09:32:16.492383 IP 10.8.3.3.58490 > 99.181.96.136.1935: Flags [P.], seq 42104:42695, ack 1, win 501, options [nop,nop,TS val 1016209027 ecr 3468496440], length 591
09:32:16.555382 IP 10.8.3.3.58490 > 99.181.96.136.1935: Flags [.], seq 42695:44009, ack 1, win 501, options [nop,nop,TS val 1016209090 ecr 3468496440], length 1314
09:32:16.562332 IP 99.181.96.136.1935 > 10.8.3.3.58490: Flags [.], ack 39476, win 126, options [nop,nop,TS val 3468496510 ecr 1016208889], length 0
09:32:16.578269 IP 10.8.3.3.58490 > 99.181.96.136.1935: Flags [.], seq 44009:45323, ack 1, win 501, options [nop,nop,TS val 1016209113 ecr 3468496510], length 1314
09:32:16.621262 IP 10.8.3.3.58490 > 99.181.96.136.1935: Flags [.], seq 45323:46637, ack 1, win 501, options [nop,nop,TS val 1016209156 ecr 3468496510], length 1314
09:32:16.668545 IP 99.181.96.136.1935 > 10.8.3.3.58490: Flags [.], ack 42104, win 126, options [nop,nop,TS val 3468496615 ecr 1016208963], length 0
09:32:16.669271 IP 99.181.96.136.1935 > 10.8.3.3.58490: Flags [.], ack 42695, win 126, options [nop,nop,TS val 3468496616 ecr 1016209027], length 0
09:32:16.669280 IP 10.8.3.3.58490 > 99.181.96.136.1935: Flags [P.], seq 46637:47787, ack 1, win 501, options [nop,nop,TS val 1016209204 ecr 3468496616], length 1150
09:32:16.724392 IP 10.8.3.3.58490 > 99.181.96.136.1935: Flags [.], seq 47787:49101, ack 1, win 501, options [nop,nop,TS val 1016209259 ecr 3468496616], length 1314
09:32:16.749370 IP 10.8.3.3.58490 > 99.181.96.136.1935: Flags [.], seq 49101:50415, ack 1, win 501, options [nop,nop,TS val 1016209284 ecr 3468496616], length 1314
09:32:16.755143 IP 99.181.96.136.1935 > 10.8.3.3.58490: Flags [.], ack 45323, win 126, options [nop,nop,TS val 3468496703 ecr 1016209090], length 0
09:32:16.792261 IP 10.8.3.3.58490 > 99.181.96.136.1935: Flags [.], seq 50415:51729, ack 1, win 501, options [nop,nop,TS val 1016209327 ecr 3468496703], length 1314
09:32:16.846017 IP 99.181.96.136.1935 > 10.8.3.3.58490: Flags [.], ack 47787, win 126, options [nop,nop,TS val 3468496793 ecr 1016209156], length 0
09:32:16.846049 IP 10.8.3.3.58490 > 99.181.96.136.1935: Flags [P.], seq 51729:52774, ack 1, win 501, options [nop,nop,TS val 1016209380 ecr 3468496793], length 1045
09:32:16.889183 IP 10.8.3.3.58490 > 99.181.96.136.1935: Flags [.], seq 52774:54088, ack 1, win 501, options [nop,nop,TS val 1016209423 ecr 3468496793], length 1314
09:32:16.920364 IP 10.8.3.3.58490 > 99.181.96.136.1935: Flags [.], seq 54088:55402, ack 1, win 501, options [nop,nop,TS val 1016209455 ecr 3468496793], length 1314
09:32:16.929938 IP 99.181.96.136.1935 > 10.8.3.3.58490: Flags [.], ack 50415, win 126, options [nop,nop,TS val 3468496874 ecr 1016209259], length 0
09:32:16.962684 IP 10.8.3.3.58490 > 99.181.96.136.1935: Flags [.], seq 55402:56716, ack 1, win 501, options [nop,nop,TS val 1016209497 ecr 3468496874], length 1314
09:32:17.022215 IP 10.8.3.3.58490 > 99.181.96.136.1935: Flags [.], seq 56716:58030, ack 1, win 501, options [nop,nop,TS val 1016209557 ecr 3468496874], length 1314
09:32:17.022794 IP 99.181.96.136.1935 > 10.8.3.3.58490: Flags [.], ack 52774, win 126, options [nop,nop,TS val 3468496970 ecr 1016209327], length 0
09:32:17.022834 IP 10.8.3.3.58490 > 99.181.96.136.1935: Flags [P.], seq 58030:58621, ack 1, win 501, options [nop,nop,TS val 1016209557 ecr 3468496970], length 591
09:32:17.086782 IP 10.8.3.3.58490 > 99.181.96.136.1935: Flags [.], seq 58621:59935, ack 1, win 501, options [nop,nop,TS val 1016209621 ecr 3468496970], length 1314
09:32:17.099567 IP 99.181.96.136.1935 > 10.8.3.3.58490: Flags [.], ack 55402, win 126, options [nop,nop,TS val 3468497047 ecr 1016209423], length 0
09:32:17.112311 IP 10.8.3.3.58490 > 99.181.96.136.1935: Flags [.], seq 59935:61249, ack 1, win 501, options [nop,nop,TS val 1016209647 ecr 3468497047], length 1314
09:32:17.155248 IP 10.8.3.3.58490 > 99.181.96.136.1935: Flags [.], seq 61249:62563, ack 1, win 501, options [nop,nop,TS val 1016209690 ecr 3468497047], length 1314
09:32:17.199064 IP 99.181.96.136.1935 > 10.8.3.3.58490: Flags [.], ack 58030, win 126, options [nop,nop,TS val 3468497146 ecr 1016209497], length 0
09:32:17.199825 IP 99.181.96.136.1935 > 10.8.3.3.58490: Flags [.], ack 58621, win 126, options [nop,nop,TS val 3468497147 ecr 1016209557], length 0
09:32:17.199859 IP 10.8.3.3.58490 > 99.181.96.136.1935: Flags [P.], seq 62563:63715, ack 1, win 501, options [nop,nop,TS val 1016209734 ecr 3468497147], length 1152
09:32:17.254381 IP 10.8.3.3.58490 > 99.181.96.136.1935: Flags [.], seq 63715:65029, ack 1, win 501, options [nop,nop,TS val 1016209789 ecr 3468497147], length 1314
09:32:17.283973 IP 10.8.3.3.58490 > 99.181.96.136.1935: Flags [.], seq 65029:66343, ack 1, win 501, options [nop,nop,TS val 1016209818 ecr 3468497147], length 1314
09:32:17.289610 IP 99.181.96.136.1935 > 10.8.3.3.58490: Flags [.], ack 61249, win 126, options [nop,nop,TS val 3468497237 ecr 1016209621], length 0
09:32:17.326814 IP 10.8.3.3.58490 > 99.181.96.136.1935: Flags [.], seq 66343:67657, ack 1, win 501, options [nop,nop,TS val 1016209861 ecr 3468497237], length 1314
09:32:17.377098 IP 99.181.96.136.1935 > 10.8.3.3.58490: Flags [.], ack 63715, win 126, options [nop,nop,TS val 3468497324 ecr 1016209690], length 0
09:32:17.377134 IP 10.8.3.3.58490 > 99.181.96.136.1935: Flags [P.], seq 67657:68715, ack 1, win 501, options [nop,nop,TS val 1016209911 ecr 3468497324], length 1058
09:32:17.421149 IP 10.8.3.3.58490 > 99.181.96.136.1935: Flags [.], seq 68715:70029, ack 1, win 501, options [nop,nop,TS val 1016209955 ecr 3468497324], length 1314
09:32:17.454153 IP 10.8.3.3.58490 > 99.181.96.136.1935: Flags [.], seq 70029:71343, ack 1, win 501, options [nop,nop,TS val 1016209988 ecr 3468497324], length 1314
09:32:17.460791 IP 99.181.96.136.1935 > 10.8.3.3.58490: Flags [.], ack 66343, win 126, options [nop,nop,TS val 3468497408 ecr 1016209789], length 0
09:32:17.497817 IP 10.8.3.3.58490 > 99.181.96.136.1935: Flags [.], seq 71343:72657, ack 1, win 501, options [nop,nop,TS val 1016210032 ecr 3468497408], length 1314
09:32:17.553925 IP 99.181.96.136.1935 > 10.8.3.3.58490: Flags [.], ack 68715, win 126, options [nop,nop,TS val 3468497501 ecr 1016209861], length 0
09:32:17.553981 IP 10.8.3.3.58490 > 99.181.96.136.1935: Flags [P.], seq 72657:73702, ack 1, win 501, options [nop,nop,TS val 1016210088 ecr 3468497501], length 1045
09:32:17.583997 IP 10.8.3.3.58490 > 99.181.96.136.1935: Flags [.], seq 73702:75016, ack 1, win 501, options [nop,nop,TS val 1016210118 ecr 3468497501], length 1314
09:32:17.619791 IP 10.8.3.3.58490 > 99.181.96.136.1935: Flags [.], seq 75016:76330, ack 1, win 501, options [nop,nop,TS val 1016210154 ecr 3468497501], length 1314
09:32:17.631055 IP 99.181.96.136.1935 > 10.8.3.3.58490: Flags [.], ack 71343, win 126, options [nop,nop,TS val 3468497578 ecr 1016209955], length 0
09:32:17.669618 IP 10.8.3.3.58490 > 99.181.96.136.1935: Flags [.], seq 76330:77644, ack 1, win 501, options [nop,nop,TS val 1016210204 ecr 3468497578], length 1314
09:32:17.722279 IP 10.8.3.3.58490 > 99.181.96.136.1935: Flags [.], seq 77644:78958, ack 1, win 501, options [nop,nop,TS val 1016210257 ecr 3468497578], length 1314
09:32:17.730811 IP 99.181.96.136.1935 > 10.8.3.3.58490: Flags [.], ack 73702, win 126, options [nop,nop,TS val 3468497678 ecr 1016210032], length 0
09:32:17.730844 IP 10.8.3.3.58490 > 99.181.96.136.1935: Flags [P.], seq 78958:79541, ack 1, win 501, options [nop,nop,TS val 1016210265 ecr 3468497678], length 583
09:32:17.787538 IP 10.8.3.3.58490 > 99.181.96.136.1935: Flags [.], seq 79541:80855, ack 1, win 501, options [nop,nop,TS val 1016210322 ecr 3468497678], length 1314
09:32:17.796928 IP 99.181.96.136.1935 > 10.8.3.3.58490: Flags [.], ack 76330, win 126, options [nop,nop,TS val 3468497744 ecr 1016210118], length 0
09:32:17.818310 IP 10.8.3.3.58490 > 99.181.96.136.1935: Flags [.], seq 80855:82169, ack 1, win 501, options [nop,nop,TS val 1016210353 ecr 3468497744], length 1314
09:32:17.854638 IP 10.8.3.3.58490 > 99.181.96.136.1935: Flags [.], seq 82169:83483, ack 1, win 501, options [nop,nop,TS val 1016210389 ecr 3468497744], length 1314
09:32:17.899236 IP 99.181.96.136.1935 > 10.8.3.3.58490: Flags [.], ack 78958, win 126, options [nop,nop,TS val 3468497847 ecr 1016210204], length 0
09:32:17.907462 IP 99.181.96.136.1935 > 10.8.3.3.58490: Flags [.], ack 79541, win 126, options [nop,nop,TS val 3468497855 ecr 1016210265], length 0
09:32:17.907494 IP 10.8.3.3.58490 > 99.181.96.136.1935: Flags [P.], seq 83483:84635, ack 1, win 501, options [nop,nop,TS val 1016210442 ecr 3468497855], length 1152
09:32:17.955751 IP 10.8.3.3.58490 > 99.181.96.136.1935: Flags [.], seq 84635:85949, ack 1, win 501, options [nop,nop,TS val 1016210490 ecr 3468497855], length 1314
09:32:17.984940 IP 10.8.3.3.58490 > 99.181.96.136.1935: Flags [.], seq 85949:87263, ack 1, win 501, options [nop,nop,TS val 1016210519 ecr 3468497855], length 1314
09:32:17.997643 IP 99.181.96.136.1935 > 10.8.3.3.58490: Flags [.], ack 82169, win 126, options [nop,nop,TS val 3468497942 ecr 1016210322], length 0
09:32:18.032314 IP 10.8.3.3.58490 > 99.181.96.136.1935: Flags [.], seq 87263:88577, ack 1, win 501, options [nop,nop,TS val 1016210567 ecr 3468497942], length 1314
09:32:18.088694 IP 99.181.96.136.1935 > 10.8.3.3.58490: Flags [.], ack 84635, win 126, options [nop,nop,TS val 3468498032 ecr 1016210389], length 0
09:32:18.088736 IP 10.8.3.3.58490 > 99.181.96.136.1935: Flags [P.], seq 88577:89635, ack 1, win 501, options [nop,nop,TS val 1016210623 ecr 3468498032], length 1058
09:32:18.118328 IP 10.8.3.3.58490 > 99.181.96.136.1935: Flags [.], seq 89635:90949, ack 1, win 501, options [nop,nop,TS val 1016210653 ecr 3468498032], length 1314
09:32:18.153279 IP 10.8.3.3.58490 > 99.181.96.136.1935: Flags [.], seq 90949:92263, ack 1, win 501, options [nop,nop,TS val 1016210688 ecr 3468498032], length 1314
09:32:18.161546 IP 99.181.96.136.1935 > 10.8.3.3.58490: Flags [.], ack 87263, win 126, options [nop,nop,TS val 3468498109 ecr 1016210490], length 0
09:32:18.203941 IP 10.8.3.3.58490 > 99.181.96.136.1935: Flags [.], seq 92263:93577, ack 1, win 501, options [nop,nop,TS val 1016210738 ecr 3468498109], length 1314
09:32:18.253166 IP 10.8.3.3.58490 > 99.181.96.136.1935: Flags [.], seq 93577:94891, ack 1, win 501, options [nop,nop,TS val 1016210787 ecr 3468498109], length 1314
09:32:18.266375 IP 99.181.96.136.1935 > 10.8.3.3.58490: Flags [.], ack 89635, win 126, options [nop,nop,TS val 3468498214 ecr 1016210567], length 0
09:32:18.266397 IP 10.8.3.3.58490 > 99.181.96.136.1935: Flags [P.], seq 94891:95477, ack 1, win 501, options [nop,nop,TS val 1016210801 ecr 3468498214], length 586
09:32:18.322492 IP 10.8.3.3.58490 > 99.181.96.136.1935: Flags [.], seq 95477:96791, ack 1, win 501, options [nop,nop,TS val 1016210857 ecr 3468498214], length 1314
09:32:18.330033 IP 99.181.96.136.1935 > 10.8.3.3.58490: Flags [.], ack 92263, win 126, options [nop,nop,TS val 3468498278 ecr 1016210653], length 0
09:32:18.353920 IP 10.8.3.3.58490 > 99.181.96.136.1935: Flags [.], seq 96791:98105, ack 1, win 501, options [nop,nop,TS val 1016210888 ecr 3468498278], length 1314
09:32:18.387608 IP 10.8.3.3.58490 > 99.181.96.136.1935: Flags [.], seq 98105:99419, ack 1, win 501, options [nop,nop,TS val 1016210922 ecr 3468498278], length 1314
09:32:18.429840 IP 99.181.96.136.1935 > 10.8.3.3.58490: Flags [.], ack 94891, win 126, options [nop,nop,TS val 3468498377 ecr 1016210738], length 0
09:32:18.443154 IP 99.181.96.136.1935 > 10.8.3.3.58490: Flags [.], ack 95477, win 126, options [nop,nop,TS val 3468498390 ecr 1016210801], length 0
09:32:18.443178 IP 10.8.3.3.58490 > 99.181.96.136.1935: Flags [P.], seq 99419:100560, ack 1, win 501, options [nop,nop,TS val 1016210977 ecr 3468498390], length 1141
09:32:18.489356 IP 10.8.3.3.58490 > 99.181.96.136.1935: Flags [.], seq 100560:101874, ack 1, win 501, options [nop,nop,TS val 1016211024 ecr 3468498390], length 1314
09:32:18.522615 IP 10.8.3.3.58490 > 99.181.96.136.1935: Flags [.], seq 101874:103188, ack 1, win 501, options [nop,nop,TS val 1016211057 ecr 3468498390], length 1314
09:32:18.531053 IP 99.181.96.136.1935 > 10.8.3.3.58490: Flags [.], ack 98105, win 126, options [nop,nop,TS val 3468498478 ecr 1016210857], length 0
09:32:18.568005 IP 10.8.3.3.58490 > 99.181.96.136.1935: Flags [.], seq 103188:104502, ack 1, win 501, options [nop,nop,TS val 1016211102 ecr 3468498478], length 1314
09:32:18.620354 IP 99.181.96.136.1935 > 10.8.3.3.58490: Flags [.], ack 100560, win 126, options [nop,nop,TS val 3468498567 ecr 1016210922], length 0
09:32:18.620415 IP 10.8.3.3.58490 > 99.181.96.136.1935: Flags [P.], seq 104502:105560, ack 1, win 501, options [nop,nop,TS val 1016211155 ecr 3468498567], length 1058
09:32:18.654383 IP 10.8.3.3.58490 > 99.181.96.136.1935: Flags [.], seq 105560:106874, ack 1, win 501, options [nop,nop,TS val 1016211189 ecr 3468498567], length 1314
09:32:18.685541 IP 10.8.3.3.58490 > 99.181.96.136.1935: Flags [.], seq 106874:108188, ack 1, win 501, options [nop,nop,TS val 1016211220 ecr 3468498567], length 1314
09:32:18.699409 IP 99.181.96.136.1935 > 10.8.3.3.58490: Flags [.], ack 103188, win 126, options [nop,nop,TS val 3468498647 ecr 1016211024], length 0
09:32:18.739655 IP 10.8.3.3.58490 > 99.181.96.136.1935: Flags [.], seq 108188:109502, ack 1, win 501, options [nop,nop,TS val 1016211274 ecr 3468498647], length 1314
09:32:18.789107 IP 10.8.3.3.58490 > 99.181.96.136.1935: Flags [.], seq 109502:110816, ack 1, win 501, options [nop,nop,TS val 1016211323 ecr 3468498647], length 1314
09:32:18.797486 IP 99.181.96.136.1935 > 10.8.3.3.58490: Flags [.], ack 105560, win 126, options [nop,nop,TS val 3468498745 ecr 1016211102], length 0
09:32:18.797522 IP 10.8.3.3.58490 > 99.181.96.136.1935: Flags [P.], seq 110816:111407, ack 1, win 501, options [nop,nop,TS val 1016211332 ecr 3468498745], length 591
09:32:18.855770 IP 10.8.3.3.58490 > 99.181.96.136.1935: Flags [.], seq 111407:112721, ack 1, win 501, options [nop,nop,TS val 1016211390 ecr 3468498745], length 1314
09:32:18.862277 IP 99.181.96.136.1935 > 10.8.3.3.58490: Flags [.], ack 108188, win 126, options [nop,nop,TS val 3468498810 ecr 1016211189], length 0
09:32:18.889584 IP 10.8.3.3.58490 > 99.181.96.136.1935: Flags [.], seq 112721:114035, ack 1, win 501, options [nop,nop,TS val 1016211424 ecr 3468498810], length 1314
09:32:18.922732 IP 10.8.3.3.58490 > 99.181.96.136.1935: Flags [.], seq 114035:115349, ack 1, win 501, options [nop,nop,TS val 1016211457 ecr 3468498810], length 1314
09:32:18.966385 IP 99.181.96.136.1935 > 10.8.3.3.58490: Flags [.], ack 110816, win 126, options [nop,nop,TS val 3468498914 ecr 1016211274], length 0
09:32:18.974579 IP 99.181.96.136.1935 > 10.8.3.3.58490: Flags [.], ack 111407, win 126, options [nop,nop,TS val 3468498922 ecr 1016211332], length 0
09:32:18.974603 IP 10.8.3.3.58490 > 99.181.96.136.1935: Flags [P.], seq 115349:116406, ack 1, win 501, options [nop,nop,TS val 1016211509 ecr 3468498922], length 1057
09:32:19.022481 IP 10.8.3.3.58490 > 99.181.96.136.1935: Flags [.], seq 116406:117720, ack 1, win 501, options [nop,nop,TS val 1016211557 ecr 3468498922], length 1314
09:32:19.051466 IP 10.8.3.3.58490 > 99.181.96.136.1935: Flags [.], seq 117720:119034, ack 1, win 501, options [nop,nop,TS val 1016211586 ecr 3468498922], length 1314
09:32:19.066419 IP 99.181.96.136.1935 > 10.8.3.3.58490: Flags [.], ack 114035, win 126, options [nop,nop,TS val 3468499014 ecr 1016211390], length 0
09:32:19.085317 IP 10.8.3.3.58490 > 99.181.96.136.1935: Flags [.], seq 119034:120348, ack 1, win 501, options [nop,nop,TS val 1016211620 ecr 3468499014], length 1314
09:32:19.156005 IP 10.8.3.3.58490 > 99.181.96.136.1935: Flags [.], seq 120348:121662, ack 1, win 501, options [nop,nop,TS val 1016211690 ecr 3468499014], length 1314
09:32:19.156453 IP 99.181.96.136.1935 > 10.8.3.3.58490: Flags [.], ack 116406, win 126, options [nop,nop,TS val 3468499099 ecr 1016211457], length 0
09:32:19.156488 IP 10.8.3.3.58490 > 99.181.96.136.1935: Flags [P.], seq 121662:122336, ack 1, win 501, options [nop,nop,TS val 1016211691 ecr 3468499099], length 674
09:32:19.220936 IP 10.8.3.3.58490 > 99.181.96.136.1935: Flags [.], seq 122336:123650, ack 1, win 501, options [nop,nop,TS val 1016211755 ecr 3468499099], length 1314
09:32:19.228639 IP 99.181.96.136.1935 > 10.8.3.3.58490: Flags [.], ack 119034, win 126, options [nop,nop,TS val 3468499176 ecr 1016211557], length 0
09:32:19.253264 IP 10.8.3.3.58490 > 99.181.96.136.1935: Flags [.], seq 123650:124964, ack 1, win 501, options [nop,nop,TS val 1016211788 ecr 3468499176], length 1314
09:32:19.288816 IP 10.8.3.3.58490 > 99.181.96.136.1935: Flags [.], seq 124964:126278, ack 1, win 501, options [nop,nop,TS val 1016211823 ecr 3468499176], length 1314
09:32:19.332838 IP 99.181.96.136.1935 > 10.8.3.3.58490: Flags [.], ack 121662, win 126, options [nop,nop,TS val 3468499280 ecr 1016211620], length 0
09:32:19.333360 IP 99.181.96.136.1935 > 10.8.3.3.58490: Flags [.], ack 122336, win 126, options [nop,nop,TS val 3468499281 ecr 1016211691], length 0
09:32:19.333392 IP 10.8.3.3.58490 > 99.181.96.136.1935: Flags [P.], seq 126278:127328, ack 1, win 501, options [nop,nop,TS val 1016211868 ecr 3468499281], length 1050
09:32:19.388647 IP 10.8.3.3.58490 > 99.181.96.136.1935: Flags [.], seq 127328:128642, ack 1, win 501, options [nop,nop,TS val 1016211923 ecr 3468499281], length 1314
09:32:19.421786 IP 10.8.3.3.58490 > 99.181.96.136.1935: Flags [.], seq 128642:129956, ack 1, win 501, options [nop,nop,TS val 1016211956 ecr 3468499281], length 1314
09:32:19.430187 IP 99.181.96.136.1935 > 10.8.3.3.58490: Flags [.], ack 124964, win 126, options [nop,nop,TS val 3468499378 ecr 1016211755], length 0
09:32:19.455769 IP 10.8.3.3.58490 > 99.181.96.136.1935: Flags [.], seq 129956:131270, ack 1, win 501, options [nop,nop,TS val 1016211990 ecr 3468499378], length 1314
09:32:19.510252 IP 99.181.96.136.1935 > 10.8.3.3.58490: Flags [.], ack 127328, win 126, options [nop,nop,TS val 3468499458 ecr 1016211823], length 0
09:32:19.510275 IP 10.8.3.3.58490 > 99.181.96.136.1935: Flags [P.], seq 131270:132422, ack 1, win 501, options [nop,nop,TS val 1016212045 ecr 3468499458], length 1152
09:32:19.555929 IP 10.8.3.3.58490 > 99.181.96.136.1935: Flags [.], seq 132422:133736, ack 1, win 501, options [nop,nop,TS val 1016212090 ecr 3468499458], length 1314
09:32:19.589230 IP 10.8.3.3.58490 > 99.181.96.136.1935: Flags [.], seq 133736:135050, ack 1, win 501, options [nop,nop,TS val 1016212124 ecr 3468499458], length 1314
09:32:19.598667 IP 99.181.96.136.1935 > 10.8.3.3.58490: Flags [.], ack 129956, win 126, options [nop,nop,TS val 3468499546 ecr 1016211923], length 0
09:32:19.638682 IP 10.8.3.3.58490 > 99.181.96.136.1935: Flags [.], seq 135050:136364, ack 1, win 501, options [nop,nop,TS val 1016212173 ecr 3468499546], length 1314
09:32:19.687273 IP 99.181.96.136.1935 > 10.8.3.3.58490: Flags [.], ack 132422, win 126, options [nop,nop,TS val 3468499635 ecr 1016211990], length 0
09:32:19.687308 IP 10.8.3.3.58490 > 99.181.96.136.1935: Flags [P.], seq 136364:137422, ack 1, win 501, options [nop,nop,TS val 1016212222 ecr 3468499635], length 1058
09:32:19.722764 IP 10.8.3.3.58490 > 99.181.96.136.1935: Flags [.], seq 137422:138736, ack 1, win 501, options [nop,nop,TS val 1016212257 ecr 3468499635], length 1314
09:32:19.753309 IP 10.8.3.3.58490 > 99.181.96.136.1935: Flags [.], seq 138736:140050, ack 1, win 501, options [nop,nop,TS val 1016212288 ecr 3468499635], length 1314
09:32:19.766206 IP 99.181.96.136.1935 > 10.8.3.3.58490: Flags [.], ack 135050, win 126, options [nop,nop,TS val 3468499714 ecr 1016212090], length 0
09:32:19.809815 IP 10.8.3.3.58490 > 99.181.96.136.1935: Flags [.], seq 140050:141364, ack 1, win 501, options [nop,nop,TS val 1016212344 ecr 3468499714], length 1314
09:32:19.854414 IP 10.8.3.3.58490 > 99.181.96.136.1935: Flags [.], seq 141364:142678, ack 1, win 501, options [nop,nop,TS val 1016212389 ecr 3468499714], length 1314
09:32:19.864187 IP 99.181.96.136.1935 > 10.8.3.3.58490: Flags [.], ack 137422, win 126, options [nop,nop,TS val 3468499812 ecr 1016212173], length 0
09:32:19.864213 IP 10.8.3.3.58490 > 99.181.96.136.1935: Flags [P.], seq 142678:143264, ack 1, win 501, options [nop,nop,TS val 1016212399 ecr 3468499812], length 586
09:32:19.920894 IP 10.8.3.3.58490 > 99.181.96.136.1935: Flags [.], seq 143264:144578, ack 1, win 501, options [nop,nop,TS val 1016212455 ecr 3468499812], length 1314
09:32:19.930065 IP 99.181.96.136.1935 > 10.8.3.3.58490: Flags [.], ack 140050, win 126, options [nop,nop,TS val 3468499877 ecr 1016212257], length 0
09:32:19.954505 IP 10.8.3.3.58490 > 99.181.96.136.1935: Flags [.], seq 144578:145892, ack 1, win 501, options [nop,nop,TS val 1016212489 ecr 3468499877], length 1314
09:32:19.984762 IP 10.8.3.3.58490 > 99.181.96.136.1935: Flags [.], seq 145892:147206, ack 1, win 501, options [nop,nop,TS val 1016212519 ecr 3468499877], length 1314
09:32:20.031685 IP 99.181.96.136.1935 > 10.8.3.3.58490: Flags [.], ack 142678, win 126, options [nop,nop,TS val 3468499979 ecr 1016212344], length 0
09:32:20.040860 IP 99.181.96.136.1935 > 10.8.3.3.58490: Flags [.], ack 143264, win 126, options [nop,nop,TS val 3468499988 ecr 1016212399], length 0
09:32:20.040888 IP 10.8.3.3.58490 > 99.181.96.136.1935: Flags [P.], seq 147206:148256, ack 1, win 501, options [nop,nop,TS val 1016212575 ecr 3468499988], length 1050
09:32:20.089113 IP 10.8.3.3.58490 > 99.181.96.136.1935: Flags [.], seq 148256:149570, ack 1, win 501, options [nop,nop,TS val 1016212623 ecr 3468499988], length 1314
09:32:20.122812 IP 10.8.3.3.58490 > 99.181.96.136.1935: Flags [.], seq 149570:150884, ack 1, win 501, options [nop,nop,TS val 1016212657 ecr 3468499988], length 1314
09:32:20.131351 IP 99.181.96.136.1935 > 10.8.3.3.58490: Flags [.], ack 145892, win 126, options [nop,nop,TS val 3468500079 ecr 1016212455], length 0
09:32:20.153300 IP 10.8.3.3.58490 > 99.181.96.136.1935: Flags [.], seq 150884:152198, ack 1, win 501, options [nop,nop,TS val 1016212688 ecr 3468500079], length 1314
09:32:20.217920 IP 99.181.96.136.1935 > 10.8.3.3.58490: Flags [.], ack 148256, win 126, options [nop,nop,TS val 3468500165 ecr 1016212519], length 0
09:32:20.217964 IP 10.8.3.3.58490 > 99.181.96.136.1935: Flags [P.], seq 152198:153346, ack 1, win 501, options [nop,nop,TS val 1016212752 ecr 3468500165], length 1148
09:32:20.255885 IP 10.8.3.3.58490 > 99.181.96.136.1935: Flags [.], seq 153346:154660, ack 1, win 501, options [nop,nop,TS val 1016212790 ecr 3468500165], length 1314
09:32:20.287342 IP 10.8.3.3.58490 > 99.181.96.136.1935: Flags [.], seq 154660:155974, ack 1, win 501, options [nop,nop,TS val 1016212822 ecr 3468500165], length 1314
09:32:20.299869 IP 99.181.96.136.1935 > 10.8.3.3.58490: Flags [.], ack 150884, win 126, options [nop,nop,TS val 3468500247 ecr 1016212623], length 0
09:32:20.344145 IP 10.8.3.3.58490 > 99.181.96.136.1935: Flags [.], seq 155974:157288, ack 1, win 501, options [nop,nop,TS val 1016212878 ecr 3468500247], length 1314
09:32:20.386477 IP 10.8.3.3.58490 > 99.181.96.136.1935: Flags [.], seq 157288:158602, ack 1, win 501, options [nop,nop,TS val 1016212921 ecr 3468500247], length 1314
09:32:20.394702 IP 99.181.96.136.1935 > 10.8.3.3.58490: Flags [.], ack 153346, win 126, options [nop,nop,TS val 3468500342 ecr 1016212688], length 0
09:32:20.394715 IP 10.8.3.3.58490 > 99.181.96.136.1935: Flags [P.], seq 158602:159193, ack 1, win 501, options [nop,nop,TS val 1016212929 ecr 3468500342], length 591
09:32:20.455210 IP 10.8.3.3.58490 > 99.181.96.136.1935: Flags [.], seq 159193:160507, ack 1, win 501, options [nop,nop,TS val 1016212990 ecr 3468500342], length 1314
09:32:20.464240 IP 99.181.96.136.1935 > 10.8.3.3.58490: Flags [.], ack 155974, win 126, options [nop,nop,TS val 3468500412 ecr 1016212790], length 0
09:32:20.489180 IP 10.8.3.3.58490 > 99.181.96.136.1935: Flags [.], seq 160507:161821, ack 1, win 501, options [nop,nop,TS val 1016213023 ecr 3468500412], length 1314
09:32:20.518305 IP 10.8.3.3.58490 > 99.181.96.136.1935: Flags [.], seq 161821:163135, ack 1, win 501, options [nop,nop,TS val 1016213053 ecr 3468500412], length 1314
09:32:20.563614 IP 99.181.96.136.1935 > 10.8.3.3.58490: Flags [.], ack 158602, win 126, options [nop,nop,TS val 3468500511 ecr 1016212878], length 0
09:32:20.571229 IP 99.181.96.136.1935 > 10.8.3.3.58490: Flags [.], ack 159193, win 126, options [nop,nop,TS val 3468500519 ecr 1016212929], length 0
09:32:20.571244 IP 10.8.3.3.58490 > 99.181.96.136.1935: Flags [P.], seq 163135:164193, ack 1, win 501, options [nop,nop,TS val 1016213106 ecr 3468500519], length 1058
09:32:20.622178 IP 10.8.3.3.58490 > 99.181.96.136.1935: Flags [.], seq 164193:165507, ack 1, win 501, options [nop,nop,TS val 1016213156 ecr 3468500519], length 1314
09:32:20.655554 IP 10.8.3.3.58490 > 99.181.96.136.1935: Flags [.], seq 165507:166821, ack 1, win 501, options [nop,nop,TS val 1016213190 ecr 3468500519], length 1314
09:32:20.666135 IP 99.181.96.136.1935 > 10.8.3.3.58490: Flags [.], ack 161821, win 126, options [nop,nop,TS val 3468500614 ecr 1016212990], length 0
09:32:20.687412 IP 10.8.3.3.58490 > 99.181.96.136.1935: Flags [.], seq 166821:168135, ack 1, win 501, options [nop,nop,TS val 1016213222 ecr 3468500614], length 1314
09:32:20.747842 IP 99.181.96.136.1935 > 10.8.3.3.58490: Flags [.], ack 164193, win 126, options [nop,nop,TS val 3468500695 ecr 1016213053], length 0
09:32:20.747864 IP 10.8.3.3.58490 > 99.181.96.136.1935: Flags [P.], seq 168135:169185, ack 1, win 501, options [nop,nop,TS val 1016213282 ecr 3468500695], length 1050
09:32:20.785008 IP 10.8.3.3.58490 > 99.181.96.136.1935: Flags [.], seq 169185:170499, ack 1, win 501, options [nop,nop,TS val 1016213319 ecr 3468500695], length 1314
09:32:20.820225 IP 10.8.3.3.58490 > 99.181.96.136.1935: Flags [.], seq 170499:171813, ack 1, win 501, options [nop,nop,TS val 1016213355 ecr 3468500695], length 1314
09:32:20.832951 IP 99.181.96.136.1935 > 10.8.3.3.58490: Flags [.], ack 166821, win 126, options [nop,nop,TS val 3468500780 ecr 1016213156], length 0
09:32:20.856025 IP 10.8.3.3.58490 > 99.181.96.136.1935: Flags [.], seq 171813:173127, ack 1, win 501, options [nop,nop,TS val 1016213390 ecr 3468500780], length 1314
09:32:20.922129 IP 10.8.3.3.58490 > 99.181.96.136.1935: Flags [.], seq 173127:174441, ack 1, win 501, options [nop,nop,TS val 1016213456 ecr 3468500780], length 1314
09:32:20.924505 IP 99.181.96.136.1935 > 10.8.3.3.58490: Flags [.], ack 169185, win 126, options [nop,nop,TS val 3468500872 ecr 1016213222], length 0
09:32:20.924537 IP 10.8.3.3.58490 > 99.181.96.136.1935: Flags [P.], seq 174441:175115, ack 1, win 501, options [nop,nop,TS val 1016213459 ecr 3468500872], length 674
09:32:20.985759 IP 10.8.3.3.58490 > 99.181.96.136.1935: Flags [.], seq 175115:176429, ack 1, win 501, options [nop,nop,TS val 1016213520 ecr 3468500872], length 1314
09:32:20.998260 IP 99.181.96.136.1935 > 10.8.3.3.58490: Flags [.], ack 171813, win 126, options [nop,nop,TS val 3468500945 ecr 1016213319], length 0
09:32:21.022068 IP 10.8.3.3.58490 > 99.181.96.136.1935: Flags [.], seq 176429:177743, ack 1, win 501, options [nop,nop,TS val 1016213556 ecr 3468500945], length 1314
09:32:21.053974 IP 10.8.3.3.58490 > 99.181.96.136.1935: Flags [.], seq 177743:179057, ack 1, win 501, options [nop,nop,TS val 1016213588 ecr 3468500945], length 1314
09:32:21.099302 IP 99.181.96.136.1935 > 10.8.3.3.58490: Flags [.], ack 174441, win 126, options [nop,nop,TS val 3468501046 ecr 1016213390], length 0
09:32:21.101320 IP 99.181.96.136.1935 > 10.8.3.3.58490: Flags [.], ack 175115, win 126, options [nop,nop,TS val 3468501049 ecr 1016213459], length 0
09:32:21.101344 IP 10.8.3.3.58490 > 99.181.96.136.1935: Flags [P.], seq 179057:180114, ack 1, win 501, options [nop,nop,TS val 1016213636 ecr 3468501049], length 1057
09:32:21.155596 IP 10.8.3.3.58490 > 99.181.96.136.1935: Flags [.], seq 180114:181428, ack 1, win 501, options [nop,nop,TS val 1016213690 ecr 3468501049], length 1314
09:32:21.187374 IP 10.8.3.3.58490 > 99.181.96.136.1935: Flags [.], seq 181428:182742, ack 1, win 501, options [nop,nop,TS val 1016213722 ecr 3468501049], length 1314
09:32:21.199075 IP 99.181.96.136.1935 > 10.8.3.3.58490: Flags [.], ack 177743, win 126, options [nop,nop,TS val 3468501146 ecr 1016213520], length 0
09:32:21.220544 IP 10.8.3.3.58490 > 99.181.96.136.1935: Flags [.], seq 182742:184056, ack 1, win 501, options [nop,nop,TS val 1016213755 ecr 3468501146], length 1314
09:32:21.278281 IP 99.181.96.136.1935 > 10.8.3.3.58490: Flags [.], ack 180114, win 126, options [nop,nop,TS val 3468501226 ecr 1016213588], length 0
09:32:21.278310 IP 10.8.3.3.58490 > 99.181.96.136.1935: Flags [P.], seq 184056:185113, ack 1, win 501, options [nop,nop,TS val 1016213813 ecr 3468501226], length 1057
09:32:21.318150 IP 10.8.3.3.58490 > 99.181.96.136.1935: Flags [.], seq 185113:186427, ack 1, win 501, options [nop,nop,TS val 1016213852 ecr 3468501226], length 1314
09:32:21.352733 IP 10.8.3.3.58490 > 99.181.96.136.1935: Flags [.], seq 186427:187741, ack 1, win 501, options [nop,nop,TS val 1016213887 ecr 3468501226], length 1314
09:32:21.364077 IP 99.181.96.136.1935 > 10.8.3.3.58490: Flags [.], ack 182742, win 126, options [nop,nop,TS val 3468501312 ecr 1016213690], length 0
09:32:21.390214 IP 10.8.3.3.58490 > 99.181.96.136.1935: Flags [.], seq 187741:189055, ack 1, win 501, options [nop,nop,TS val 1016213925 ecr 3468501312], length 1314
09:32:21.454441 IP 10.8.3.3.58490 > 99.181.96.136.1935: Flags [.], seq 189055:190369, ack 1, win 501, options [nop,nop,TS val 1016213989 ecr 3468501312], length 1314
09:32:21.454784 IP 99.181.96.136.1935 > 10.8.3.3.58490: Flags [.], ack 185113, win 126, options [nop,nop,TS val 3468501402 ecr 1016213755], length 0
09:32:21.454803 IP 10.8.3.3.58490 > 99.181.96.136.1935: Flags [P.], seq 190369:191051, ack 1, win 501, options [nop,nop,TS val 1016213989 ecr 3468501402], length 682
09:32:21.521361 IP 10.8.3.3.58490 > 99.181.96.136.1935: Flags [.], seq 191051:192365, ack 1, win 501, options [nop,nop,TS val 1016214056 ecr 3468501402], length 1314
09:32:21.529472 IP 99.181.96.136.1935 > 10.8.3.3.58490: Flags [.], ack 187741, win 126, options [nop,nop,TS val 3468501477 ecr 1016213852], length 0
09:32:21.553398 IP 10.8.3.3.58490 > 99.181.96.136.1935: Flags [.], seq 192365:193679, ack 1, win 501, options [nop,nop,TS val 1016214088 ecr 3468501477], length 1314
09:32:21.584909 IP 10.8.3.3.58490 > 99.181.96.136.1935: Flags [.], seq 193679:194993, ack 1, win 501, options [nop,nop,TS val 1016214119 ecr 3468501477], length 1314
09:32:21.631654 IP 99.181.96.136.1935 > 10.8.3.3.58490: Flags [.], ack 190369, win 126, options [nop,nop,TS val 3468501579 ecr 1016213925], length 0
09:32:21.631829 IP 99.181.96.136.1935 > 10.8.3.3.58490: Flags [.], ack 191051, win 126, options [nop,nop,TS val 3468501579 ecr 1016213989], length 0
09:32:21.631845 IP 10.8.3.3.58490 > 99.181.96.136.1935: Flags [P.], seq 194993:196043, ack 1, win 501, options [nop,nop,TS val 1016214166 ecr 3468501579], length 1050
09:32:21.689466 IP 10.8.3.3.58490 > 99.181.96.136.1935: Flags [.], seq 196043:197357, ack 1, win 501, options [nop,nop,TS val 1016214224 ecr 3468501579], length 1314
09:32:21.720624 IP 10.8.3.3.58490 > 99.181.96.136.1935: Flags [.], seq 197357:198671, ack 1, win 501, options [nop,nop,TS val 1016214255 ecr 3468501579], length 1314
09:32:21.732018 IP 99.181.96.136.1935 > 10.8.3.3.58490: Flags [.], ack 193679, win 126, options [nop,nop,TS val 3468501678 ecr 1016214056], length 0
09:32:21.753924 IP 10.8.3.3.58490 > 99.181.96.136.1935: Flags [.], seq 198671:199985, ack 1, win 501, options [nop,nop,TS val 1016214288 ecr 3468501678], length 1314
09:32:21.810141 IP 99.181.96.136.1935 > 10.8.3.3.58490: Flags [.], ack 196043, win 126, options [nop,nop,TS val 3468501756 ecr 1016214119], length 0
