17:25:27.675951 IP 103.53.48.70.1935 > 10.8.1.3.49086: Flags [.], ack 1702683839, win 133, options [nop,nop,TS val 3472927677 ecr 3442830522], length 0
17:25:27.676088 IP 10.8.1.3.49086 > 103.53.48.70.1935: Flags [.], seq 13570:14884, ack 0, win 501, options [nop,nop,TS val 3442831054 ecr 3472927677], length 1314
17:25:27.708223 IP 10.8.1.3.49086 > 103.53.48.70.1935: Flags [.], seq 14884:16198, ack 0, win 501, options [nop,nop,TS val 3442831087 ecr 3472927677], length 1314
17:25:27.776533 IP 103.53.48.70.1935 > 10.8.1.3.49086: Flags [.], ack 2629, win 132, options [nop,nop,TS val 3472927777 ecr 3442830589], length 0
17:25:27.776665 IP 10.8.1.3.49086 > 103.53.48.70.1935: Flags [.], seq 16198:17512, ack 0, win 501, options [nop,nop,TS val 3442831155 ecr 3472927777], length 1314
17:25:27.809599 IP 10.8.1.3.49086 > 103.53.48.70.1935: Flags [.], seq 17512:18826, ack 0, win 501, options [nop,nop,TS val 3442831188 ecr 3472927777], length 1314
17:25:27.843674 IP 10.8.1.3.49086 > 103.53.48.70.1935: Flags [.], seq 18826:20140, ack 0, win 501, options [nop,nop,TS val 3442831222 ecr 3472927777], length 1314
17:25:27.844962 IP 103.53.48.70.1935 > 10.8.1.3.49086: Flags [.], ack 5257, win 132, options [nop,nop,TS val 3472927846 ecr 3442830689], length 0
17:25:27.906417 IP 10.8.1.3.49086 > 103.53.48.70.1935: Flags [.], seq 20140:21454, ack 0, win 501, options [nop,nop,TS val 3442831285 ecr 3472927846], length 1314
17:25:27.939899 IP 10.8.1.3.49086 > 103.53.48.70.1935: Flags [.], seq 21454:22768, ack 0, win 501, options [nop,nop,TS val 3442831318 ecr 3472927846], length 1314
17:25:27.941649 IP 103.53.48.70.1935 > 10.8.1.3.49086: Flags [.], ack 7885, win 132, options [nop,nop,TS val 3472927943 ecr 3442830784], length 0
17:25:27.977513 IP 10.8.1.3.49086 > 103.53.48.70.1935: Flags [.], seq 22768:24082, ack 0, win 501, options [nop,nop,TS val 3442831356 ecr 3472927943], length 1314
17:25:28.043052 IP 10.8.1.3.49086 > 103.53.48.70.1935: Flags [.], seq 24082:25396, ack 0, win 501, options [nop,nop,TS val 3442831421 ecr 3472927943], length 1314
17:25:28.045128 IP 103.53.48.70.1935 > 10.8.1.3.49086: Flags [.], ack 10513, win 132, options [nop,nop,TS val 3472928046 ecr 3442830855], length 0
17:25:28.072628 IP 10.8.1.3.49086 > 103.53.48.70.1935: Flags [.], seq 25396:26710, ack 0, win 501, options [nop,nop,TS val 3442831451 ecr 3472928046], length 1314
17:25:28.086692 IP 103.53.48.70.1935 > 10.8.1.3.49086: Flags [.], ack 12256, win 133, options [nop,nop,TS val 3472928088 ecr 3442830953], length 0
17:25:28.086704 IP 10.8.1.3.49086 > 103.53.48.70.1935: Flags [P.], seq 26710:27146, ack 0, win 501, options [nop,nop,TS val 3442831465 ecr 3472928088], length 436
17:25:28.142563 IP 10.8.1.3.49086 > 103.53.48.70.1935: Flags [.], seq 27146:28460, ack 0, win 501, options [nop,nop,TS val 3442831521 ecr 3472928088], length 1314
17:25:28.176905 IP 10.8.1.3.49086 > 103.53.48.70.1935: Flags [.], seq 28460:29774, ack 0, win 501, options [nop,nop,TS val 3442831555 ecr 3472928088], length 1314
17:25:28.177497 IP 103.53.48.70.1935 > 10.8.1.3.49086: Flags [.], ack 14884, win 133, options [nop,nop,TS val 3472928178 ecr 3442831020], length 0
17:25:28.206883 IP 10.8.1.3.49086 > 103.53.48.70.1935: Flags [.], seq 29774:31088, ack 0, win 501, options [nop,nop,TS val 3442831585 ecr 3472928178], length 1314
17:25:28.271276 IP 103.53.48.70.1935 > 10.8.1.3.49086: Flags [.], ack 16198, win 133, options [nop,nop,TS val 3472928272 ecr 3442831087], length 0
17:25:28.273015 IP 10.8.1.3.49086 > 103.53.48.70.1935: Flags [.], seq 31088:32402, ack 0, win 501, options [nop,nop,TS val 3442831651 ecr 3472928272], length 1314
17:25:28.306343 IP 10.8.1.3.49086 > 103.53.48.70.1935: Flags [.], seq 32402:33716, ack 0, win 501, options [nop,nop,TS val 3442831685 ecr 3472928272], length 1314
17:25:28.311041 IP 103.53.48.70.1935 > 10.8.1.3.49086: Flags [.], ack 18826, win 133, options [nop,nop,TS val 3472928312 ecr 3442831155], length 0
17:25:28.341554 IP 10.8.1.3.49086 > 103.53.48.70.1935: Flags [.], seq 33716:35030, ack 0, win 501, options [nop,nop,TS val 3442831720 ecr 3472928312], length 1314
17:25:28.406013 IP 10.8.1.3.49086 > 103.53.48.70.1935: Flags [.], seq 35030:36344, ack 0, win 501, options [nop,nop,TS val 3442831784 ecr 3472928312], length 1314
17:25:28.408428 IP 103.53.48.70.1935 > 10.8.1.3.49086: Flags [.], ack 21454, win 132, options [nop,nop,TS val 3472928409 ecr 3442831222], length 0
17:25:28.442503 IP 10.8.1.3.49086 > 103.53.48.70.1935: Flags [.], seq 36344:37658, ack 0, win 501, options [nop,nop,TS val 3442831821 ecr 3472928409], length 1314
17:25:28.472653 IP 10.8.1.3.49086 > 103.53.48.70.1935: Flags [.], seq 37658:38972, ack 0, win 501, options [nop,nop,TS val 3442831851 ecr 3472928409], length 1314
17:25:28.479291 IP 103.53.48.70.1935 > 10.8.1.3.49086: Flags [.], ack 24082, win 132, options [nop,nop,TS val 3472928480 ecr 3442831318], length 0
17:25:28.542600 IP 10.8.1.3.49086 > 103.53.48.70.1935: Flags [.], seq 38972:40286, ack 0, win 501, options [nop,nop,TS val 3442831921 ecr 3472928480], length 1314
17:25:28.574562 IP 103.53.48.70.1935 > 10.8.1.3.49086: Flags [.], ack 26710, win 132, options [nop,nop,TS val 3472928575 ecr 3442831421], length 0
17:25:28.576711 IP 10.8.1.3.49086 > 103.53.48.70.1935: Flags [.], seq 40286:41600, ack 0, win 501, options [nop,nop,TS val 3442831955 ecr 3472928575], length 1314
17:25:28.588505 IP 103.53.48.70.1935 > 10.8.1.3.49086: Flags [.], ack 27146, win 133, options [nop,nop,TS val 3472928589 ecr 3442831465], length 0
17:25:28.588546 IP 10.8.1.3.49086 > 103.53.48.70.1935: Flags [P.], seq 41600:42140, ack 0, win 501, options [nop,nop,TS val 3442831967 ecr 3472928589], length 540
17:25:28.641101 IP 10.8.1.3.49086 > 103.53.48.70.1935: Flags [.], seq 42140:43454, ack 0, win 501, options [nop,nop,TS val 3442832019 ecr 3472928589], length 1314
17:25:28.673820 IP 10.8.1.3.49086 > 103.53.48.70.1935: Flags [.], seq 43454:44768, ack 0, win 501, options [nop,nop,TS val 3442832052 ecr 3472928589], length 1314
17:25:28.678321 IP 103.53.48.70.1935 > 10.8.1.3.49086: Flags [.], ack 29774, win 133, options [nop,nop,TS val 3472928679 ecr 3442831521], length 0
17:25:28.707400 IP 10.8.1.3.49086 > 103.53.48.70.1935: Flags [.], seq 44768:46082, ack 0, win 501, options [nop,nop,TS val 3442832086 ecr 3472928679], length 1314
17:25:28.774569 IP 103.53.48.70.1935 > 10.8.1.3.49086: Flags [.], ack 32402, win 132, options [nop,nop,TS val 3472928775 ecr 3442831585], length 0
17:25:28.775365 IP 10.8.1.3.49086 > 103.53.48.70.1935: Flags [.], seq 46082:47396, ack 0, win 501, options [nop,nop,TS val 3442832154 ecr 3472928775], length 1314
17:25:28.811129 IP 10.8.1.3.49086 > 103.53.48.70.1935: Flags [.], seq 47396:48710, ack 0, win 501, options [nop,nop,TS val 3442832189 ecr 3472928775], length 1314
17:25:28.843002 IP 103.53.48.70.1935 > 10.8.1.3.49086: Flags [.], ack 35030, win 132, options [nop,nop,TS val 3472928844 ecr 3442831685], length 0
17:25:28.844403 IP 10.8.1.3.49086 > 103.53.48.70.1935: Flags [.], seq 48710:50024, ack 0, win 501, options [nop,nop,TS val 3442832223 ecr 3472928844], length 1314
17:25:28.908790 IP 10.8.1.3.49086 > 103.53.48.70.1935: Flags [.], seq 50024:51338, ack 0, win 501, options [nop,nop,TS val 3442832287 ecr 3472928844], length 1314
17:25:28.939878 IP 10.8.1.3.49086 > 103.53.48.70.1935: Flags [.], seq 51338:52652, ack 0, win 501, options [nop,nop,TS val 3442832318 ecr 3472928844], length 1314
17:25:28.944100 IP 103.53.48.70.1935 > 10.8.1.3.49086: Flags [.], ack 37658, win 132, options [nop,nop,TS val 3472928945 ecr 3442831784], length 0
17:25:28.975920 IP 10.8.1.3.49086 > 103.53.48.70.1935: Flags [.], seq 52652:53966, ack 0, win 501, options [nop,nop,TS val 3442832354 ecr 3472928945], length 1314
17:25:29.041510 IP 10.8.1.3.49086 > 103.53.48.70.1935: Flags [.], seq 53966:55280, ack 0, win 501, options [nop,nop,TS val 3442832420 ecr 3472928945], length 1314
17:25:29.044536 IP 103.53.48.70.1935 > 10.8.1.3.49086: Flags [.], ack 40286, win 132, options [nop,nop,TS val 3472929045 ecr 3442831851], length 0
17:25:29.077536 IP 10.8.1.3.49086 > 103.53.48.70.1935: Flags [.], seq 55280:56594, ack 0, win 501, options [nop,nop,TS val 3442832456 ecr 3472929045], length 1314
17:25:29.090443 IP 103.53.48.70.1935 > 10.8.1.3.49086: Flags [.], ack 42140, win 133, options [nop,nop,TS val 3472929091 ecr 3442831955], length 0
17:25:29.090487 IP 10.8.1.3.49086 > 103.53.48.70.1935: Flags [P.], seq 56594:57119, ack 0, win 501, options [nop,nop,TS val 3442832469 ecr 3472929091], length 525
17:25:29.142949 IP 10.8.1.3.49086 > 103.53.48.70.1935: Flags [.], seq 57119:58433, ack 0, win 501, options [nop,nop,TS val 3442832521 ecr 3472929091], length 1314
17:25:29.174918 IP 10.8.1.3.49086 > 103.53.48.70.1935: Flags [.], seq 58433:59747, ack 0, win 501, options [nop,nop,TS val 3442832553 ecr 3472929091], length 1314
17:25:29.175331 IP 103.53.48.70.1935 > 10.8.1.3.49086: Flags [.], ack 44768, win 133, options [nop,nop,TS val 3472929176 ecr 3442832019], length 0
17:25:29.217710 IP 10.8.1.3.49086 > 103.53.48.70.1935: Flags [.], seq 59747:61061, ack 0, win 501, options [nop,nop,TS val 3442832596 ecr 3472929176], length 1314
17:25:29.275149 IP 10.8.1.3.49086 > 103.53.48.70.1935: Flags [.], seq 61061:62375, ack 0, win 501, options [nop,nop,TS val 3442832653 ecr 3472929176], length 1314
17:25:29.275294 IP 103.53.48.70.1935 > 10.8.1.3.49086: Flags [.], ack 46082, win 133, options [nop,nop,TS val 3472929276 ecr 3442832086], length 0
17:25:29.308172 IP 10.8.1.3.49086 > 103.53.48.70.1935: Flags [.], seq 62375:63689, ack 0, win 501, options [nop,nop,TS val 3442832686 ecr 3472929276], length 1314
17:25:29.312723 IP 103.53.48.70.1935 > 10.8.1.3.49086: Flags [.], ack 48710, win 133, options [nop,nop,TS val 3472929314 ecr 3442832154], length 0
17:25:29.345428 IP 10.8.1.3.49086 > 103.53.48.70.1935: Flags [.], seq 63689:65003, ack 0, win 501, options [nop,nop,TS val 3442832724 ecr 3472929314], length 1314
17:25:29.408252 IP 10.8.1.3.49086 > 103.53.48.70.1935: Flags [.], seq 65003:66317, ack 0, win 501, options [nop,nop,TS val 3442832787 ecr 3472929314], length 1314
17:25:29.410313 IP 103.53.48.70.1935 > 10.8.1.3.49086: Flags [.], ack 51338, win 132, options [nop,nop,TS val 3472929411 ecr 3442832223], length 0
17:25:29.441825 IP 10.8.1.3.49086 > 103.53.48.70.1935: Flags [.], seq 66317:67631, ack 0, win 501, options [nop,nop,TS val 3442832820 ecr 3472929411], length 1314
17:25:29.477209 IP 103.53.48.70.1935 > 10.8.1.3.49086: Flags [.], ack 53966, win 132, options [nop,nop,TS val 3472929478 ecr 3442832318], length 0
17:25:29.477411 IP 10.8.1.3.49086 > 103.53.48.70.1935: Flags [.], seq 67631:68945, ack 0, win 501, options [nop,nop,TS val 3442832856 ecr 3472929478], length 1314
17:25:29.544267 IP 10.8.1.3.49086 > 103.53.48.70.1935: Flags [.], seq 68945:70259, ack 0, win 501, options [nop,nop,TS val 3442832923 ecr 3472929478], length 1314
17:25:29.575411 IP 10.8.1.3.49086 > 103.53.48.70.1935: Flags [.], seq 70259:71573, ack 0, win 501, options [nop,nop,TS val 3442832954 ecr 3472929478], length 1314
17:25:29.579130 IP 103.53.48.70.1935 > 10.8.1.3.49086: Flags [.], ack 56594, win 132, options [nop,nop,TS val 3472929580 ecr 3442832420], length 0
17:25:29.591859 IP 103.53.48.70.1935 > 10.8.1.3.49086: Flags [.], ack 57119, win 133, options [nop,nop,TS val 3472929593 ecr 3442832469], length 0
17:25:29.591877 IP 10.8.1.3.49086 > 103.53.48.70.1935: Flags [P.], seq 71573:72018, ack 0, win 501, options [nop,nop,TS val 3442832970 ecr 3472929593], length 445
17:25:29.641029 IP 10.8.1.3.49086 > 103.53.48.70.1935: Flags [.], seq 72018:73332, ack 0, win 501, options [nop,nop,TS val 3442833019 ecr 3472929593], length 1314
17:25:29.672498 IP 10.8.1.3.49086 > 103.53.48.70.1935: Flags [.], seq 73332:74646, ack 0, win 501, options [nop,nop,TS val 3442833051 ecr 3472929593], length 1314
17:25:29.676347 IP 103.53.48.70.1935 > 10.8.1.3.49086: Flags [.], ack 59747, win 133, options [nop,nop,TS val 3472929677 ecr 3442832521], length 0
17:25:29.707947 IP 10.8.1.3.49086 > 103.53.48.70.1935: Flags [.], seq 74646:75960, ack 0, win 501, options [nop,nop,TS val 3442833086 ecr 3472929677], length 1314
17:25:29.776782 IP 103.53.48.70.1935 > 10.8.1.3.49086: Flags [.], ack 62375, win 132, options [nop,nop,TS val 3472929778 ecr 3442832596], length 0
17:25:29.777180 IP 10.8.1.3.49086 > 103.53.48.70.1935: Flags [.], seq 75960:77274, ack 0, win 501, options [nop,nop,TS val 3442833155 ecr 3472929778], length 1314
17:25:29.810455 IP 10.8.1.3.49086 > 103.53.48.70.1935: Flags [.], seq 77274:78588, ack 0, win 501, options [nop,nop,TS val 3442833189 ecr 3472929778], length 1314
17:25:29.840827 IP 10.8.1.3.49086 > 103.53.48.70.1935: Flags [.], seq 78588:79902, ack 0, win 501, options [nop,nop,TS val 3442833219 ecr 3472929778], length 1314
17:25:29.846906 IP 103.53.48.70.1935 > 10.8.1.3.49086: Flags [.], ack 65003, win 132, options [nop,nop,TS val 3472929848 ecr 3442832686], length 0
17:25:29.909455 IP 10.8.1.3.49086 > 103.53.48.70.1935: Flags [.], seq 79902:81216, ack 0, win 501, options [nop,nop,TS val 3442833288 ecr 3472929848], length 1314
17:25:29.943212 IP 103.53.48.70.1935 > 10.8.1.3.49086: Flags [.], ack 67631, win 132, options [nop,nop,TS val 3472929944 ecr 3442832787], length 0
17:25:29.943215 IP 10.8.1.3.49086 > 103.53.48.70.1935: Flags [.], seq 81216:82530, ack 0, win 501, options [nop,nop,TS val 3442833322 ecr 3472929848], length 1314
17:25:29.974060 IP 10.8.1.3.49086 > 103.53.48.70.1935: Flags [.], seq 82530:83844, ack 0, win 501, options [nop,nop,TS val 3442833352 ecr 3472929944], length 1314
17:25:30.040814 IP 10.8.1.3.49086 > 103.53.48.70.1935: Flags [.], seq 83844:85158, ack 0, win 501, options [nop,nop,TS val 3442833419 ecr 3472929944], length 1314
17:25:30.045930 IP 103.53.48.70.1935 > 10.8.1.3.49086: Flags [.], ack 70259, win 132, options [nop,nop,TS val 3472930047 ecr 3442832856], length 0
17:25:30.072642 IP 10.8.1.3.49086 > 103.53.48.70.1935: Flags [.], seq 85158:86472, ack 0, win 501, options [nop,nop,TS val 3442833451 ecr 3472930047], length 1314
17:25:30.093361 IP 103.53.48.70.1935 > 10.8.1.3.49086: Flags [.], ack 72018, win 133, options [nop,nop,TS val 3472930094 ecr 3442832954], length 0
17:25:30.093377 IP 10.8.1.3.49086 > 103.53.48.70.1935: Flags [P.], seq 86472:87004, ack 0, win 501, options [nop,nop,TS val 3442833472 ecr 3472930094], length 532
17:25:30.142344 IP 10.8.1.3.49086 > 103.53.48.70.1935: Flags [.], seq 87004:88318, ack 0, win 501, options [nop,nop,TS val 3442833521 ecr 3472930094], length 1314
17:25:30.174035 IP 103.53.48.70.1935 > 10.8.1.3.49086: Flags [.], ack 74646, win 133, options [nop,nop,TS val 3472930175 ecr 3442833019], length 0
17:25:30.176914 IP 10.8.1.3.49086 > 103.53.48.70.1935: Flags [.], seq 88318:89632, ack 0, win 501, options [nop,nop,TS val 3442833555 ecr 3472930175], length 1314
17:25:30.220443 IP 10.8.1.3.49086 > 103.53.48.70.1935: Flags [.], seq 89632:90946, ack 0, win 501, options [nop,nop,TS val 3442833599 ecr 3472930175], length 1314
17:25:30.275332 IP 10.8.1.3.49086 > 103.53.48.70.1935: Flags [.], seq 90946:92260, ack 0, win 501, options [nop,nop,TS val 3442833654 ecr 3472930175], length 1314
17:25:30.278766 IP 103.53.48.70.1935 > 10.8.1.3.49086: Flags [.], ack 77274, win 132, options [nop,nop,TS val 3472930280 ecr 3442833086], length 0
17:25:30.309595 IP 10.8.1.3.49086 > 103.53.48.70.1935: Flags [.], seq 92260:93574, ack 0, win 501, options [nop,nop,TS val 3442833688 ecr 3472930280], length 1314
17:25:30.342213 IP 103.53.48.70.1935 > 10.8.1.3.49086: Flags [.], ack 79902, win 132, options [nop,nop,TS val 3472930343 ecr 3442833189], length 0
17:25:30.349270 IP 10.8.1.3.49086 > 103.53.48.70.1935: Flags [.], seq 93574:94888, ack 0, win 501, options [nop,nop,TS val 3442833728 ecr 3472930343], length 1314
17:25:30.407766 IP 10.8.1.3.49086 > 103.53.48.70.1935: Flags [.], seq 94888:96202, ack 0, win 501, options [nop,nop,TS val 3442833786 ecr 3472930343], length 1314
17:25:30.441039 IP 10.8.1.3.49086 > 103.53.48.70.1935: Flags [.], seq 96202:97516, ack 0, win 501, options [nop,nop,TS val 3442833819 ecr 3472930343], length 1314
17:25:30.444621 IP 103.53.48.70.1935 > 10.8.1.3.49086: Flags [.], ack 82530, win 132, options [nop,nop,TS val 3472930446 ecr 3442833288], length 0
17:25:30.476628 IP 10.8.1.3.49086 > 103.53.48.70.1935: Flags [.], seq 97516:98830, ack 0, win 501, options [nop,nop,TS val 3442833855 ecr 3472930446], length 1314
17:25:30.540914 IP 10.8.1.3.49086 > 103.53.48.70.1935: Flags [.], seq 98830:100144, ack 0, win 501, options [nop,nop,TS val 3442833919 ecr 3472930446], length 1314
17:25:30.542512 IP 103.53.48.70.1935 > 10.8.1.3.49086: Flags [.], ack 85158, win 132, options [nop,nop,TS val 3472930543 ecr 3442833352], length 0
17:25:30.576844 IP 10.8.1.3.49086 > 103.53.48.70.1935: Flags [.], seq 100144:101458, ack 0, win 501, options [nop,nop,TS val 3442833955 ecr 3472930543], length 1314
17:25:30.594725 IP 103.53.48.70.1935 > 10.8.1.3.49086: Flags [.], ack 87004, win 133, options [nop,nop,TS val 3472930595 ecr 3442833451], length 0
17:25:30.594766 IP 10.8.1.3.49086 > 103.53.48.70.1935: Flags [P.], seq 101458:101887, ack 0, win 501, options [nop,nop,TS val 3442833973 ecr 3472930595], length 429
17:25:30.643487 IP 10.8.1.3.49086 > 103.53.48.70.1935: Flags [.], seq 101887:103201, ack 0, win 501, options [nop,nop,TS val 3442834022 ecr 3472930595], length 1314
17:25:30.675338 IP 10.8.1.3.49086 > 103.53.48.70.1935: Flags [.], seq 103201:104515, ack 0, win 501, options [nop,nop,TS val 3442834054 ecr 3472930595], length 1314
17:25:30.678568 IP 103.53.48.70.1935 > 10.8.1.3.49086: Flags [.], ack 89632, win 133, options [nop,nop,TS val 3472930680 ecr 3442833521], length 0
17:25:30.712047 IP 10.8.1.3.49086 > 103.53.48.70.1935: Flags [.], seq 104515:105829, ack 0, win 501, options [nop,nop,TS val 3442834090 ecr 3472930680], length 1314
17:25:30.773646 IP 10.8.1.3.49086 > 103.53.48.70.1935: Flags [.], seq 105829:107143, ack 0, win 501, options [nop,nop,TS val 3442834152 ecr 3472930680], length 1314
17:25:30.777181 IP 103.53.48.70.1935 > 10.8.1.3.49086: Flags [.], ack 92260, win 132, options [nop,nop,TS val 3472930778 ecr 3442833599], length 0
17:25:30.807721 IP 10.8.1.3.49086 > 103.53.48.70.1935: Flags [.], seq 107143:108457, ack 0, win 501, options [nop,nop,TS val 3442834186 ecr 3472930778], length 1314
17:25:30.843537 IP 10.8.1.3.49086 > 103.53.48.70.1935: Flags [.], seq 108457:109771, ack 0, win 501, options [nop,nop,TS val 3442834222 ecr 3472930778], length 1314
17:25:30.850788 IP 103.53.48.70.1935 > 10.8.1.3.49086: Flags [.], ack 94888, win 132, options [nop,nop,TS val 3472930852 ecr 3442833688], length 0
17:25:30.906538 IP 10.8.1.3.49086 > 103.53.48.70.1935: Flags [.], seq 109771:111085, ack 0, win 501, options [nop,nop,TS val 3442834285 ecr 3472930852], length 1314
17:25:30.940672 IP 10.8.1.3.49086 > 103.53.48.70.1935: Flags [.], seq 111085:112399, ack 0, win 501, options [nop,nop,TS val 3442834319 ecr 3472930852], length 1314
17:25:30.942342 IP 103.53.48.70.1935 > 10.8.1.3.49086: Flags [.], ack 97516, win 132, options [nop,nop,TS val 3472930943 ecr 3442833786], length 0
17:25:30.974574 IP 10.8.1.3.49086 > 103.53.48.70.1935: Flags [.], seq 112399:113713, ack 0, win 501, options [nop,nop,TS val 3442834353 ecr 3472930943], length 1314
17:25:31.041033 IP 10.8.1.3.49086 > 103.53.48.70.1935: Flags [.], seq 113713:115027, ack 0, win 501, options [nop,nop,TS val 3442834419 ecr 3472930943], length 1314
17:25:31.042808 IP 103.53.48.70.1935 > 10.8.1.3.49086: Flags [.], ack 100144, win 132, options [nop,nop,TS val 3472931043 ecr 3442833855], length 0
17:25:31.074527 IP 10.8.1.3.49086 > 103.53.48.70.1935: Flags [.], seq 115027:116341, ack 0, win 501, options [nop,nop,TS val 3442834453 ecr 3472931043], length 1314
17:25:31.096061 IP 103.53.48.70.1935 > 10.8.1.3.49086: Flags [.], ack 101887, win 133, options [nop,nop,TS val 3472931097 ecr 3442833955], length 0
17:25:31.096093 IP 10.8.1.3.49086 > 103.53.48.70.1935: Flags [P.], seq 116341:116886, ack 0, win 501, options [nop,nop,TS val 3442834474 ecr 3472931097], length 545
17:25:31.142498 IP 10.8.1.3.49086 > 103.53.48.70.1935: Flags [.], seq 116886:118200, ack 0, win 501, options [nop,nop,TS val 3442834521 ecr 3472931097], length 1314
17:25:31.175802 IP 10.8.1.3.49086 > 103.53.48.70.1935: Flags [.], seq 118200:119514, ack 0, win 501, options [nop,nop,TS val 3442834554 ecr 3472931097], length 1314
17:25:31.176807 IP 103.53.48.70.1935 > 10.8.1.3.49086: Flags [.], ack 104515, win 133, options [nop,nop,TS val 3472931178 ecr 3442834022], length 0
17:25:31.224311 IP 10.8.1.3.49086 > 103.53.48.70.1935: Flags [.], seq 119514:120828, ack 0, win 501, options [nop,nop,TS val 3442834603 ecr 3472931178], length 1314
17:25:31.275175 IP 103.53.48.70.1935 > 10.8.1.3.49086: Flags [.], ack 107143, win 132, options [nop,nop,TS val 3472931276 ecr 3442834090], length 0
17:25:31.275344 IP 10.8.1.3.49086 > 103.53.48.70.1935: Flags [.], seq 120828:122142, ack 0, win 501, options [nop,nop,TS val 3442834654 ecr 3472931276], length 1314
17:25:31.308369 IP 10.8.1.3.49086 > 103.53.48.70.1935: Flags [.], seq 122142:123456, ack 0, win 501, options [nop,nop,TS val 3442834687 ecr 3472931276], length 1314
17:25:31.345358 IP 103.53.48.70.1935 > 10.8.1.3.49086: Flags [.], ack 109771, win 132, options [nop,nop,TS val 3472931346 ecr 3442834186], length 0
17:25:31.352564 IP 10.8.1.3.49086 > 103.53.48.70.1935: Flags [.], seq 123456:124770, ack 0, win 501, options [nop,nop,TS val 3442834731 ecr 3472931346], length 1314
17:25:31.408590 IP 10.8.1.3.49086 > 103.53.48.70.1935: Flags [.], seq 124770:126084, ack 0, win 501, options [nop,nop,TS val 3442834787 ecr 3472931346], length 1314
17:25:31.441951 IP 10.8.1.3.49086 > 103.53.48.70.1935: Flags [.], seq 126084:127398, ack 0, win 501, options [nop,nop,TS val 3442834820 ecr 3472931346], length 1314
17:25:31.442236 IP 103.53.48.70.1935 > 10.8.1.3.49086: Flags [.], ack 112399, win 132, options [nop,nop,TS val 3472931443 ecr 3442834285], length 0
17:25:31.480893 IP 10.8.1.3.49086 > 103.53.48.70.1935: Flags [.], seq 127398:128712, ack 0, win 501, options [nop,nop,TS val 3442834859 ecr 3472931443], length 1314
17:25:31.542594 IP 103.53.48.70.1935 > 10.8.1.3.49086: Flags [.], ack 115027, win 132, options [nop,nop,TS val 3472931543 ecr 3442834353], length 0
17:25:31.543747 IP 10.8.1.3.49086 > 103.53.48.70.1935: Flags [.], seq 128712:130026, ack 0, win 501, options [nop,nop,TS val 3442834922 ecr 3472931543], length 1314
17:25:31.573810 IP 10.8.1.3.49086 > 103.53.48.70.1935: Flags [.], seq 130026:131340, ack 0, win 501, options [nop,nop,TS val 3442834952 ecr 3472931543], length 1314
17:25:31.597418 IP 103.53.48.70.1935 > 10.8.1.3.49086: Flags [.], ack 116886, win 133, options [nop,nop,TS val 3472931598 ecr 3442834453], length 0
17:25:31.597432 IP 10.8.1.3.49086 > 103.53.48.70.1935: Flags [P.], seq 131340:131772, ack 0, win 501, options [nop,nop,TS val 3442834976 ecr 3472931598], length 432
17:25:31.641482 IP 10.8.1.3.49086 > 103.53.48.70.1935: Flags [.], seq 131772:133086, ack 0, win 501, options [nop,nop,TS val 3442835020 ecr 3472931598], length 1314
17:25:31.672838 IP 10.8.1.3.49086 > 103.53.48.70.1935: Flags [.], seq 133086:134400, ack 0, win 501, options [nop,nop,TS val 3442835051 ecr 3472931598], length 1314
17:25:31.677349 IP 103.53.48.70.1935 > 10.8.1.3.49086: Flags [.], ack 119514, win 133, options [nop,nop,TS val 3472931678 ecr 3442834521], length 0
17:25:31.715295 IP 10.8.1.3.49086 > 103.53.48.70.1935: Flags [.], seq 134400:135714, ack 0, win 501, options [nop,nop,TS val 3442835094 ecr 3472931678], length 1314
17:25:31.777005 IP 10.8.1.3.49086 > 103.53.48.70.1935: Flags [.], seq 135714:137028, ack 0, win 501, options [nop,nop,TS val 3442835155 ecr 3472931678], length 1314
17:25:31.777556 IP 103.53.48.70.1935 > 10.8.1.3.49086: Flags [.], ack 122142, win 133, options [nop,nop,TS val 3472931778 ecr 3442834603], length 0
17:25:31.810444 IP 10.8.1.3.49086 > 103.53.48.70.1935: Flags [.], seq 137028:138342, ack 0, win 501, options [nop,nop,TS val 3442835189 ecr 3472931778], length 1314
17:25:31.843591 IP 10.8.1.3.49086 > 103.53.48.70.1935: Flags [.], seq 138342:139656, ack 0, win 501, options [nop,nop,TS val 3442835222 ecr 3472931778], length 1314
17:25:31.854187 IP 103.53.48.70.1935 > 10.8.1.3.49086: Flags [.], ack 124770, win 133, options [nop,nop,TS val 3472931855 ecr 3442834687], length 0
17:25:31.909191 IP 10.8.1.3.49086 > 103.53.48.70.1935: Flags [.], seq 139656:140970, ack 0, win 501, options [nop,nop,TS val 3442835287 ecr 3472931855], length 1314
17:25:31.943407 IP 10.8.1.3.49086 > 103.53.48.70.1935: Flags [.], seq 140970:142284, ack 0, win 501, options [nop,nop,TS val 3442835322 ecr 3472931855], length 1314
17:25:31.943470 IP 103.53.48.70.1935 > 10.8.1.3.49086: Flags [.], ack 127398, win 133, options [nop,nop,TS val 3472931944 ecr 3442834787], length 0
17:25:31.975372 IP 10.8.1.3.49086 > 103.53.48.70.1935: Flags [.], seq 142284:143598, ack 0, win 501, options [nop,nop,TS val 3442835354 ecr 3472931944], length 1314
17:25:32.041972 IP 10.8.1.3.49086 > 103.53.48.70.1935: Flags [.], seq 143598:144912, ack 0, win 501, options [nop,nop,TS val 3442835420 ecr 3472931944], length 1314
17:25:32.045481 IP 103.53.48.70.1935 > 10.8.1.3.49086: Flags [.], ack 130026, win 132, options [nop,nop,TS val 3472932046 ecr 3442834859], length 0
17:25:32.075985 IP 10.8.1.3.49086 > 103.53.48.70.1935: Flags [.], seq 144912:146226, ack 0, win 501, options [nop,nop,TS val 3442835454 ecr 3472932046], length 1314
17:25:32.098686 IP 103.53.48.70.1935 > 10.8.1.3.49086: Flags [.], ack 131772, win 133, options [nop,nop,TS val 3472932100 ecr 3442834952], length 0
17:25:32.098722 IP 10.8.1.3.49086 > 103.53.48.70.1935: Flags [P.], seq 146226:146663, ack 0, win 501, options [nop,nop,TS val 3442835477 ecr 3472932100], length 437
17:25:32.143167 IP 10.8.1.3.49086 > 103.53.48.70.1935: Flags [.], seq 146663:147977, ack 0, win 501, options [nop,nop,TS val 3442835521 ecr 3472932100], length 1314
17:25:32.174766 IP 103.53.48.70.1935 > 10.8.1.3.49086: Flags [.], ack 134400, win 133, options [nop,nop,TS val 3472932175 ecr 3442835020], length 0
17:25:32.176447 IP 10.8.1.3.49086 > 103.53.48.70.1935: Flags [.], seq 147977:149291, ack 0, win 501, options [nop,nop,TS val 3442835555 ecr 3472932175], length 1314
17:25:32.209840 IP 10.8.1.3.49086 > 103.53.48.70.1935: Flags [.], seq 149291:150605, ack 0, win 501, options [nop,nop,TS val 3442835588 ecr 3472932175], length 1314
17:25:32.276644 IP 10.8.1.3.49086 > 103.53.48.70.1935: Flags [.], seq 150605:151919, ack 0, win 501, options [nop,nop,TS val 3442835655 ecr 3472932175], length 1314
17:25:32.278464 IP 103.53.48.70.1935 > 10.8.1.3.49086: Flags [.], ack 137028, win 132, options [nop,nop,TS val 3472932279 ecr 3442835094], length 0
17:25:32.310472 IP 10.8.1.3.49086 > 103.53.48.70.1935: Flags [.], seq 151919:153233, ack 0, win 501, options [nop,nop,TS val 3442835689 ecr 3472932279], length 1314
17:25:32.339201 IP 10.8.1.3.49086 > 103.53.48.70.1935: Flags [.], seq 153233:154547, ack 0, win 501, options [nop,nop,TS val 3442835718 ecr 3472932279], length 1314
17:25:32.345041 IP 103.53.48.70.1935 > 10.8.1.3.49086: Flags [.], ack 139656, win 132, options [nop,nop,TS val 3472932346 ecr 3442835189], length 0
17:25:32.408202 IP 10.8.1.3.49086 > 103.53.48.70.1935: Flags [.], seq 154547:155861, ack 0, win 501, options [nop,nop,TS val 3442835787 ecr 3472932346], length 1314
17:25:32.442568 IP 10.8.1.3.49086 > 103.53.48.70.1935: Flags [.], seq 155861:157175, ack 0, win 501, options [nop,nop,TS val 3442835821 ecr 3472932346], length 1314
17:25:32.445050 IP 103.53.48.70.1935 > 10.8.1.3.49086: Flags [.], ack 142284, win 132, options [nop,nop,TS val 3472932446 ecr 3442835287], length 0
17:25:32.472592 IP 10.8.1.3.49086 > 103.53.48.70.1935: Flags [.], seq 157175:158489, ack 0, win 501, options [nop,nop,TS val 3442835851 ecr 3472932446], length 1314
17:25:32.543474 IP 103.53.48.70.1935 > 10.8.1.3.49086: Flags [.], ack 144912, win 132, options [nop,nop,TS val 3472932544 ecr 3442835354], length 0
17:25:32.543703 IP 10.8.1.3.49086 > 103.53.48.70.1935: Flags [.], seq 158489:159803, ack 0, win 501, options [nop,nop,TS val 3442835922 ecr 3472932544], length 1314
17:25:32.577051 IP 10.8.1.3.49086 > 103.53.48.70.1935: Flags [.], seq 159803:161117, ack 0, win 501, options [nop,nop,TS val 3442835955 ecr 3472932544], length 1314
17:25:32.600222 IP 103.53.48.70.1935 > 10.8.1.3.49086: Flags [.], ack 146663, win 133, options [nop,nop,TS val 3472932601 ecr 3442835454], length 0
17:25:32.600253 IP 10.8.1.3.49086 > 103.53.48.70.1935: Flags [P.], seq 161117:161653, ack 0, win 501, options [nop,nop,TS val 3442835979 ecr 3472932601], length 536
17:25:32.639726 IP 10.8.1.3.49086 > 103.53.48.70.1935: Flags [.], seq 161653:162967, ack 0, win 501, options [nop,nop,TS val 3442836018 ecr 3472932601], length 1314
17:25:32.674995 IP 10.8.1.3.49086 > 103.53.48.70.1935: Flags [.], seq 162967:164281, ack 0, win 501, options [nop,nop,TS val 3442836053 ecr 3472932601], length 1314
17:25:32.678023 IP 103.53.48.70.1935 > 10.8.1.3.49086: Flags [.], ack 149291, win 133, options [nop,nop,TS val 3472932679 ecr 3442835521], length 0
17:25:32.719161 IP 10.8.1.3.49086 > 103.53.48.70.1935: Flags [.], seq 164281:165595, ack 0, win 501, options [nop,nop,TS val 3442836097 ecr 3472932679], length 1314
17:25:32.775334 IP 10.8.1.3.49086 > 103.53.48.70.1935: Flags [.], seq 165595:166909, ack 0, win 501, options [nop,nop,TS val 3442836154 ecr 3472932679], length 1314
17:25:32.775375 IP 103.53.48.70.1935 > 10.8.1.3.49086: Flags [.], ack 150605, win 133, options [nop,nop,TS val 3472932776 ecr 3442835588], length 0
17:25:32.808646 IP 10.8.1.3.49086 > 103.53.48.70.1935: Flags [.], seq 166909:168223, ack 0, win 501, options [nop,nop,TS val 3442836187 ecr 3472932776], length 1314
17:25:32.812101 IP 103.53.48.70.1935 > 10.8.1.3.49086: Flags [.], ack 153233, win 133, options [nop,nop,TS val 3472932813 ecr 3442835655], length 0
17:25:32.847747 IP 10.8.1.3.49086 > 103.53.48.70.1935: Flags [.], seq 168223:169537, ack 0, win 501, options [nop,nop,TS val 3442836226 ecr 3472932813], length 1314
17:25:32.909142 IP 10.8.1.3.49086 > 103.53.48.70.1935: Flags [.], seq 169537:170851, ack 0, win 501, options [nop,nop,TS val 3442836287 ecr 3472932813], length 1314
17:25:32.909547 IP 103.53.48.70.1935 > 10.8.1.3.49086: Flags [.], ack 155861, win 132, options [nop,nop,TS val 3472932911 ecr 3442835718], length 0
17:25:32.941940 IP 10.8.1.3.49086 > 103.53.48.70.1935: Flags [.], seq 170851:172165, ack 0, win 501, options [nop,nop,TS val 3442836320 ecr 3472932911], length 1314
17:25:32.975170 IP 103.53.48.70.1935 > 10.8.1.3.49086: Flags [.], ack 158489, win 132, options [nop,nop,TS val 3472932975 ecr 3442835821], length 0
17:25:32.975967 IP 10.8.1.3.49086 > 103.53.48.70.1935: Flags [.], seq 172165:173479, ack 0, win 501, options [nop,nop,TS val 3442836354 ecr 3472932975], length 1314
17:25:33.039622 IP 10.8.1.3.49086 > 103.53.48.70.1935: Flags [.], seq 173479:174793, ack 0, win 501, options [nop,nop,TS val 3442836418 ecr 3472932975], length 1314
17:25:33.075350 IP 10.8.1.3.49086 > 103.53.48.70.1935: Flags [.], seq 174793:176107, ack 0, win 501, options [nop,nop,TS val 3442836454 ecr 3472932975], length 1314
17:25:33.078453 IP 103.53.48.70.1935 > 10.8.1.3.49086: Flags [.], ack 161117, win 132, options [nop,nop,TS val 3472933079 ecr 3442835922], length 0
17:25:33.102822 IP 103.53.48.70.1935 > 10.8.1.3.49086: Flags [.], ack 161653, win 133, options [nop,nop,TS val 3472933103 ecr 3442835979], length 0
17:25:33.102860 IP 10.8.1.3.49086 > 103.53.48.70.1935: Flags [P.], seq 176107:176541, ack 0, win 501, options [nop,nop,TS val 3442836481 ecr 3472933103], length 434
17:25:33.143387 IP 10.8.1.3.49086 > 103.53.48.70.1935: Flags [.], seq 176541:177855, ack 0, win 501, options [nop,nop,TS val 3442836522 ecr 3472933103], length 1314
17:25:33.175350 IP 10.8.1.3.49086 > 103.53.48.70.1935: Flags [.], seq 177855:179169, ack 0, win 501, options [nop,nop,TS val 3442836554 ecr 3472933103], length 1314
17:25:33.176629 IP 103.53.48.70.1935 > 10.8.1.3.49086: Flags [.], ack 164281, win 133, options [nop,nop,TS val 3472933177 ecr 3442836018], length 0
17:25:33.210772 IP 10.8.1.3.49086 > 103.53.48.70.1935: Flags [.], seq 179169:180483, ack 0, win 501, options [nop,nop,TS val 3442836589 ecr 3472933177], length 1314
17:25:33.276658 IP 103.53.48.70.1935 > 10.8.1.3.49086: Flags [.], ack 166909, win 132, options [nop,nop,TS val 3472933278 ecr 3442836097], length 0
17:25:33.276903 IP 10.8.1.3.49086 > 103.53.48.70.1935: Flags [.], seq 180483:181797, ack 0, win 501, options [nop,nop,TS val 3442836655 ecr 3472933278], length 1314
17:25:33.311898 IP 10.8.1.3.49086 > 103.53.48.70.1935: Flags [.], seq 181797:183111, ack 0, win 501, options [nop,nop,TS val 3442836690 ecr 3472933278], length 1314
17:25:33.341027 IP 10.8.1.3.49086 > 103.53.48.70.1935: Flags [.], seq 183111:184425, ack 0, win 501, options [nop,nop,TS val 3442836719 ecr 3472933278], length 1314
17:25:33.349635 IP 103.53.48.70.1935 > 10.8.1.3.49086: Flags [.], ack 169537, win 132, options [nop,nop,TS val 3472933351 ecr 3442836187], length 0
17:25:33.410327 IP 10.8.1.3.49086 > 103.53.48.70.1935: Flags [.], seq 184425:185739, ack 0, win 501, options [nop,nop,TS val 3442836789 ecr 3472933351], length 1314
17:25:33.443472 IP 10.8.1.3.49086 > 103.53.48.70.1935: Flags [.], seq 185739:187053, ack 0, win 501, options [nop,nop,TS val 3442836822 ecr 3472933351], length 1314
17:25:33.443862 IP 103.53.48.70.1935 > 10.8.1.3.49086: Flags [.], ack 172165, win 132, options [nop,nop,TS val 3472933445 ecr 3442836287], length 0
17:25:33.476899 IP 10.8.1.3.49086 > 103.53.48.70.1935: Flags [.], seq 187053:188367, ack 0, win 501, options [nop,nop,TS val 3442836855 ecr 3472933445], length 1314
17:25:33.539227 IP 10.8.1.3.49086 > 103.53.48.70.1935: Flags [.], seq 188367:189681, ack 0, win 501, options [nop,nop,TS val 3442836918 ecr 3472933445], length 1314
17:25:33.541056 IP 103.53.48.70.1935 > 10.8.1.3.49086: Flags [.], ack 174793, win 132, options [nop,nop,TS val 3472933542 ecr 3442836354], length 0
17:25:33.575438 IP 10.8.1.3.49086 > 103.53.48.70.1935: Flags [.], seq 189681:190995, ack 0, win 501, options [nop,nop,TS val 3442836954 ecr 3472933542], length 1314
17:25:33.604508 IP 103.53.48.70.1935 > 10.8.1.3.49086: Flags [.], ack 176541, win 133, options [nop,nop,TS val 3472933605 ecr 3442836454], length 0
17:25:33.604549 IP 10.8.1.3.49086 > 103.53.48.70.1935: Flags [P.], seq 190995:191531, ack 0, win 501, options [nop,nop,TS val 3442836983 ecr 3472933605], length 536
17:25:33.643900 IP 10.8.1.3.49086 > 103.53.48.70.1935: Flags [.], seq 191531:192845, ack 0, win 501, options [nop,nop,TS val 3442837022 ecr 3472933605], length 1314
17:25:33.676840 IP 10.8.1.3.49086 > 103.53.48.70.1935: Flags [.], seq 192845:194159, ack 0, win 501, options [nop,nop,TS val 3442837055 ecr 3472933605], length 1314
17:25:33.677315 IP 103.53.48.70.1935 > 10.8.1.3.49086: Flags [.], ack 179169, win 133, options [nop,nop,TS val 3472933678 ecr 3442836522], length 0
17:25:33.725290 IP 10.8.1.3.49086 > 103.53.48.70.1935: Flags [.], seq 194159:195473, ack 0, win 501, options [nop,nop,TS val 3442837104 ecr 3472933678], length 1314
17:25:33.776147 IP 10.8.1.3.49086 > 103.53.48.70.1935: Flags [.], seq 195473:196787, ack 0, win 501, options [nop,nop,TS val 3442837154 ecr 3472933678], length 1314
17:25:33.778595 IP 103.53.48.70.1935 > 10.8.1.3.49086: Flags [.], ack 181797, win 132, options [nop,nop,TS val 3472933779 ecr 3442836589], length 0
17:25:33.810768 IP 10.8.1.3.49086 > 103.53.48.70.1935: Flags [.], seq 196787:198101, ack 0, win 501, options [nop,nop,TS val 3442837189 ecr 3472933779], length 1314
17:25:33.842546 IP 103.53.48.70.1935 > 10.8.1.3.49086: Flags [.], ack 184425, win 132, options [nop,nop,TS val 3472933843 ecr 3442836690], length 0
17:25:33.853550 IP 10.8.1.3.49086 > 103.53.48.70.1935: Flags [.], seq 198101:199415, ack 0, win 501, options [nop,nop,TS val 3442837232 ecr 3472933843], length 1314
17:25:33.910671 IP 10.8.1.3.49086 > 103.53.48.70.1935: Flags [.], seq 199415:200729, ack 0, win 501, options [nop,nop,TS val 3442837289 ecr 3472933843], length 1314
17:25:33.943804 IP 10.8.1.3.49086 > 103.53.48.70.1935: Flags [.], seq 200729:202043, ack 0, win 501, options [nop,nop,TS val 3442837322 ecr 3472933843], length 1314
17:25:33.944918 IP 103.53.48.70.1935 > 10.8.1.3.49086: Flags [.], ack 187053, win 132, options [nop,nop,TS val 3472933946 ecr 3442836789], length 0
17:25:33.982290 IP 10.8.1.3.49086 > 103.53.48.70.1935: Flags [.], seq 202043:203357, ack 0, win 501, options [nop,nop,TS val 3442837361 ecr 3472933946], length 1314
17:25:34.041770 IP 103.53.48.70.1935 > 10.8.1.3.49086: Flags [.], ack 189681, win 132, options [nop,nop,TS val 3472934043 ecr 3442836855], length 0
17:25:34.046325 IP 10.8.1.3.49086 > 103.53.48.70.1935: Flags [.], seq 203357:204671, ack 0, win 501, options [nop,nop,TS val 3442837425 ecr 3472934043], length 1314
17:25:34.072578 IP 10.8.1.3.49086 > 103.53.48.70.1935: Flags [.], seq 204671:205985, ack 0, win 501, options [nop,nop,TS val 3442837451 ecr 3472934043], length 1314
17:25:34.106408 IP 103.53.48.70.1935 > 10.8.1.3.49086: Flags [.], ack 191531, win 133, options [nop,nop,TS val 3472934107 ecr 3442836954], length 0
17:25:34.106425 IP 10.8.1.3.49086 > 103.53.48.70.1935: Flags [P.], seq 205985:206517, ack 0, win 501, options [nop,nop,TS val 3442837485 ecr 3472934107], length 532
17:25:34.142504 IP 10.8.1.3.49086 > 103.53.48.70.1935: Flags [.], seq 206517:207831, ack 0, win 501, options [nop,nop,TS val 3442837521 ecr 3472934107], length 1314
17:25:34.176912 IP 10.8.1.3.49086 > 103.53.48.70.1935: Flags [.], seq 207831:209145, ack 0, win 501, options [nop,nop,TS val 3442837555 ecr 3472934107], length 1314
17:25:34.178693 IP 103.53.48.70.1935 > 10.8.1.3.49086: Flags [.], ack 194159, win 133, options [nop,nop,TS val 3472934180 ecr 3442837022], length 0
17:25:34.238765 IP 10.8.1.3.49086 > 103.53.48.70.1935: Flags [.], seq 209145:210459, ack 0, win 501, options [nop,nop,TS val 3442837617 ecr 3472934180], length 1314
17:25:34.276857 IP 10.8.1.3.49086 > 103.53.48.70.1935: Flags [.], seq 210459:211773, ack 0, win 501, options [nop,nop,TS val 3442837655 ecr 3472934180], length 1314
17:25:34.277811 IP 103.53.48.70.1935 > 10.8.1.3.49086: Flags [.], ack 196787, win 133, options [nop,nop,TS val 3472934279 ecr 3442837104], length 0
17:25:34.310185 IP 10.8.1.3.49086 > 103.53.48.70.1935: Flags [.], seq 211773:213087, ack 0, win 501, options [nop,nop,TS val 3442837688 ecr 3472934279], length 1314
17:25:34.355136 IP 103.53.48.70.1935 > 10.8.1.3.49086: Flags [.], ack 199415, win 133, options [nop,nop,TS val 3472934356 ecr 3442837189], length 0
17:25:34.367646 IP 10.8.1.3.49086 > 103.53.48.70.1935: Flags [.], seq 213087:214401, ack 0, win 501, options [nop,nop,TS val 3442837746 ecr 3472934356], length 1314
17:25:34.410295 IP 10.8.1.3.49086 > 103.53.48.70.1935: Flags [.], seq 214401:215715, ack 0, win 501, options [nop,nop,TS val 3442837789 ecr 3472934356], length 1314
17:25:34.443823 IP 10.8.1.3.49086 > 103.53.48.70.1935: Flags [.], seq 215715:217029, ack 0, win 501, options [nop,nop,TS val 3442837822 ecr 3472934356], length 1314
17:25:34.445885 IP 103.53.48.70.1935 > 10.8.1.3.49086: Flags [.], ack 202043, win 133, options [nop,nop,TS val 3472934447 ecr 3442837289], length 0
17:25:34.496256 IP 10.8.1.3.49086 > 103.53.48.70.1935: Flags [.], seq 217029:218343, ack 0, win 501, options [nop,nop,TS val 3442837875 ecr 3472934447], length 1314
17:25:34.539762 IP 10.8.1.3.49086 > 103.53.48.70.1935: Flags [.], seq 218343:219657, ack 0, win 501, options [nop,nop,TS val 3442837918 ecr 3472934447], length 1314
17:25:34.547805 IP 103.53.48.70.1935 > 10.8.1.3.49086: Flags [.], ack 204671, win 132, options [nop,nop,TS val 3472934549 ecr 3442837361], length 0
17:25:34.581462 IP 10.8.1.3.49086 > 103.53.48.70.1935: Flags [.], seq 219657:220971, ack 0, win 501, options [nop,nop,TS val 3442837960 ecr 3472934549], length 1314
