00:13:31.665684 IP 10.8.3.7.54622 > 99.181.68.7.1935: Flags [.], seq 1582074799:1582076113, ack 2990440937, win 501, options [nop,nop,TS val 3824319025 ecr 2585826590], length 1314
00:13:31.688955 IP 99.181.68.7.1935 > 10.8.3.7.54622: Flags [.], ack 4294960609, win 126, options [nop,nop,TS val 2585826684 ecr 3824318722], length 0
00:13:31.708521 IP 10.8.3.7.54622 > 99.181.68.7.1935: Flags [.], seq 1314:2628, ack 1, win 501, options [nop,nop,TS val 3824319068 ecr 2585826684], length 1314
00:13:31.766541 IP 10.8.3.7.54622 > 99.181.68.7.1935: Flags [.], seq 2628:3942, ack 1, win 501, options [nop,nop,TS val 3824319126 ecr 2585826684], length 1314
00:13:31.785157 IP 99.181.68.7.1935 > 10.8.3.7.54622: Flags [.], ack 4294963237, win 126, options [nop,nop,TS val 2585826780 ecr 3824318793], length 0
00:13:31.794499 IP 10.8.3.7.54622 > 99.181.68.7.1935: Flags [.], seq 3942:5256, ack 1, win 501, options [nop,nop,TS val 3824319154 ecr 2585826780], length 1314
00:13:31.837229 IP 10.8.3.7.54622 > 99.181.68.7.1935: Flags [.], seq 5256:6570, ack 1, win 501, options [nop,nop,TS val 3824319197 ecr 2585826780], length 1314
00:13:31.856706 IP 99.181.68.7.1935 > 10.8.3.7.54622: Flags [.], ack 4294965865, win 126, options [nop,nop,TS val 2585826852 ecr 3824318889], length 0
00:13:31.885694 IP 99.181.68.7.1935 > 10.8.3.7.54622: Flags [.], ack 4294965982, win 126, options [nop,nop,TS val 2585826881 ecr 3824318955], length 0
00:13:31.885707 IP 10.8.3.7.54622 > 99.181.68.7.1935: Flags [P.], seq 6570:7647, ack 1, win 501, options [nop,nop,TS val 3824319245 ecr 2585826881], length 1077
00:13:31.930770 IP 10.8.3.7.54622 > 99.181.68.7.1935: Flags [.], seq 7647:8961, ack 1, win 501, options [nop,nop,TS val 3824319290 ecr 2585826881], length 1314
00:13:31.956107 IP 99.181.68.7.1935 > 10.8.3.7.54622: Flags [.], ack 1314, win 126, options [nop,nop,TS val 2585826951 ecr 3824318993], length 0
00:13:31.965049 IP 10.8.3.7.54622 > 99.181.68.7.1935: Flags [.], seq 8961:10275, ack 1, win 501, options [nop,nop,TS val 3824319324 ecr 2585826951], length 1314
00:13:32.007212 IP 10.8.3.7.54622 > 99.181.68.7.1935: Flags [.], seq 10275:11589, ack 1, win 501, options [nop,nop,TS val 3824319367 ecr 2585826951], length 1314
00:13:32.057214 IP 99.181.68.7.1935 > 10.8.3.7.54622: Flags [.], ack 3942, win 126, options [nop,nop,TS val 2585827052 ecr 3824319068], length 0
00:13:32.064964 IP 10.8.3.7.54622 > 99.181.68.7.1935: Flags [.], seq 11589:12903, ack 1, win 501, options [nop,nop,TS val 3824319424 ecr 2585827052], length 1314
00:13:32.099859 IP 10.8.3.7.54622 > 99.181.68.7.1935: Flags [.], seq 12903:14217, ack 1, win 501, options [nop,nop,TS val 3824319459 ecr 2585827052], length 1314
00:13:32.127791 IP 99.181.68.7.1935 > 10.8.3.7.54622: Flags [.], ack 6570, win 126, options [nop,nop,TS val 2585827123 ecr 3824319154], length 0
00:13:32.136237 IP 10.8.3.7.54622 > 99.181.68.7.1935: Flags [.], seq 14217:15531, ack 1, win 501, options [nop,nop,TS val 3824319496 ecr 2585827123], length 1314
00:13:32.175925 IP 99.181.68.7.1935 > 10.8.3.7.54622: Flags [.], ack 7647, win 126, options [nop,nop,TS val 2585827171 ecr 3824319245], length 0
00:13:32.175956 IP 10.8.3.7.54622 > 99.181.68.7.1935: Flags [P.], seq 15531:16504, ack 1, win 501, options [nop,nop,TS val 3824319535 ecr 2585827171], length 973
00:13:32.232347 IP 10.8.3.7.54622 > 99.181.68.7.1935: Flags [.], seq 16504:17818, ack 1, win 501, options [nop,nop,TS val 3824319592 ecr 2585827171], length 1314
00:13:32.255699 IP 99.181.68.7.1935 > 10.8.3.7.54622: Flags [.], ack 10275, win 126, options [nop,nop,TS val 2585827251 ecr 3824319290], length 0
00:13:32.262350 IP 10.8.3.7.54622 > 99.181.68.7.1935: Flags [.], seq 17818:19132, ack 1, win 501, options [nop,nop,TS val 3824319622 ecr 2585827251], length 1314
00:13:32.295697 IP 10.8.3.7.54622 > 99.181.68.7.1935: Flags [.], seq 19132:20446, ack 1, win 501, options [nop,nop,TS val 3824319655 ecr 2585827251], length 1314
00:13:32.355951 IP 99.181.68.7.1935 > 10.8.3.7.54622: Flags [.], ack 12903, win 126, options [nop,nop,TS val 2585827351 ecr 3824319367], length 0
00:13:32.366837 IP 10.8.3.7.54622 > 99.181.68.7.1935: Flags [.], seq 20446:21760, ack 1, win 501, options [nop,nop,TS val 3824319726 ecr 2585827351], length 1314
00:13:32.395872 IP 10.8.3.7.54622 > 99.181.68.7.1935: Flags [.], seq 21760:23074, ack 1, win 501, options [nop,nop,TS val 3824319755 ecr 2585827351], length 1314
00:13:32.426670 IP 99.181.68.7.1935 > 10.8.3.7.54622: Flags [.], ack 15531, win 126, options [nop,nop,TS val 2585827422 ecr 3824319459], length 0
00:13:32.429424 IP 10.8.3.7.54622 > 99.181.68.7.1935: Flags [.], seq 23074:24388, ack 1, win 501, options [nop,nop,TS val 3824319789 ecr 2585827422], length 1314
00:13:32.466604 IP 99.181.68.7.1935 > 10.8.3.7.54622: Flags [.], ack 16504, win 126, options [nop,nop,TS val 2585827461 ecr 3824319535], length 0
00:13:32.466646 IP 10.8.3.7.54622 > 99.181.68.7.1935: Flags [P.], seq 24388:25454, ack 1, win 501, options [nop,nop,TS val 3824319826 ecr 2585827461], length 1066
00:13:32.533531 IP 10.8.3.7.54622 > 99.181.68.7.1935: Flags [.], seq 25454:26768, ack 1, win 501, options [nop,nop,TS val 3824319893 ecr 2585827461], length 1314
00:13:32.552939 IP 99.181.68.7.1935 > 10.8.3.7.54622: Flags [.], ack 19132, win 126, options [nop,nop,TS val 2585827548 ecr 3824319592], length 0
00:13:32.562939 IP 10.8.3.7.54622 > 99.181.68.7.1935: Flags [.], seq 26768:28082, ack 1, win 501, options [nop,nop,TS val 3824319922 ecr 2585827548], length 1314
00:13:32.600098 IP 10.8.3.7.54622 > 99.181.68.7.1935: Flags [.], seq 28082:29396, ack 1, win 501, options [nop,nop,TS val 3824319959 ecr 2585827548], length 1314
00:13:32.657562 IP 99.181.68.7.1935 > 10.8.3.7.54622: Flags [.], ack 21760, win 126, options [nop,nop,TS val 2585827652 ecr 3824319655], length 0
00:13:32.664985 IP 10.8.3.7.54622 > 99.181.68.7.1935: Flags [.], seq 29396:30710, ack 1, win 501, options [nop,nop,TS val 3824320024 ecr 2585827652], length 1314
00:13:32.697651 IP 10.8.3.7.54622 > 99.181.68.7.1935: Flags [.], seq 30710:32024, ack 1, win 501, options [nop,nop,TS val 3824320057 ecr 2585827652], length 1314
00:13:32.719717 IP 99.181.68.7.1935 > 10.8.3.7.54622: Flags [.], ack 24388, win 126, options [nop,nop,TS val 2585827715 ecr 3824319755], length 0
00:13:32.731338 IP 10.8.3.7.54622 > 99.181.68.7.1935: Flags [.], seq 32024:33338, ack 1, win 501, options [nop,nop,TS val 3824320091 ecr 2585827715], length 1314
00:13:32.756890 IP 99.181.68.7.1935 > 10.8.3.7.54622: Flags [.], ack 25454, win 126, options [nop,nop,TS val 2585827752 ecr 3824319826], length 0
00:13:32.756919 IP 10.8.3.7.54622 > 99.181.68.7.1935: Flags [P.], seq 33338:33568, ack 1, win 501, options [nop,nop,TS val 3824320116 ecr 2585827752], length 230
00:13:32.798293 IP 10.8.3.7.54622 > 99.181.68.7.1935: Flags [.], seq 33568:34882, ack 1, win 501, options [nop,nop,TS val 3824320158 ecr 2585827752], length 1314
00:13:32.834247 IP 10.8.3.7.54622 > 99.181.68.7.1935: Flags [.], seq 34882:36196, ack 1, win 501, options [nop,nop,TS val 3824320194 ecr 2585827752], length 1314
00:13:32.853545 IP 99.181.68.7.1935 > 10.8.3.7.54622: Flags [.], ack 28082, win 126, options [nop,nop,TS val 2585827848 ecr 3824319893], length 0
00:13:32.884586 IP 10.8.3.7.54622 > 99.181.68.7.1935: Flags [.], seq 36196:37510, ack 1, win 501, options [nop,nop,TS val 3824320244 ecr 2585827848], length 1314
00:13:32.931191 IP 10.8.3.7.54622 > 99.181.68.7.1935: Flags [.], seq 37510:38824, ack 1, win 501, options [nop,nop,TS val 3824320291 ecr 2585827848], length 1314
00:13:32.955119 IP 99.181.68.7.1935 > 10.8.3.7.54622: Flags [.], ack 30710, win 126, options [nop,nop,TS val 2585827950 ecr 3824319959], length 0
00:13:32.962605 IP 10.8.3.7.54622 > 99.181.68.7.1935: Flags [.], seq 38824:40138, ack 1, win 501, options [nop,nop,TS val 3824320322 ecr 2585827950], length 1314
00:13:33.012414 IP 10.8.3.7.54622 > 99.181.68.7.1935: Flags [.], seq 40138:41452, ack 1, win 501, options [nop,nop,TS val 3824320372 ecr 2585827950], length 1314
00:13:33.021745 IP 99.181.68.7.1935 > 10.8.3.7.54622: Flags [.], ack 33338, win 126, options [nop,nop,TS val 2585828017 ecr 3824320057], length 0
00:13:33.047158 IP 99.181.68.7.1935 > 10.8.3.7.54622: Flags [.], ack 33568, win 126, options [nop,nop,TS val 2585828042 ecr 3824320116], length 0
00:13:33.047209 IP 10.8.3.7.54622 > 99.181.68.7.1935: Flags [P.], seq 41452:42425, ack 1, win 501, options [nop,nop,TS val 3824320407 ecr 2585828042], length 973
00:13:33.098433 IP 10.8.3.7.54622 > 99.181.68.7.1935: Flags [.], seq 42425:43739, ack 1, win 501, options [nop,nop,TS val 3824320458 ecr 2585828042], length 1314
00:13:33.124803 IP 99.181.68.7.1935 > 10.8.3.7.54622: Flags [.], ack 36196, win 126, options [nop,nop,TS val 2585828120 ecr 3824320158], length 0
00:13:33.130196 IP 10.8.3.7.54622 > 99.181.68.7.1935: Flags [.], seq 43739:45053, ack 1, win 501, options [nop,nop,TS val 3824320490 ecr 2585828120], length 1314
00:13:33.166955 IP 10.8.3.7.54622 > 99.181.68.7.1935: Flags [.], seq 45053:46367, ack 1, win 501, options [nop,nop,TS val 3824320526 ecr 2585828120], length 1314
00:13:33.221980 IP 99.181.68.7.1935 > 10.8.3.7.54622: Flags [.], ack 38824, win 126, options [nop,nop,TS val 2585828217 ecr 3824320244], length 0
00:13:33.234360 IP 10.8.3.7.54622 > 99.181.68.7.1935: Flags [.], seq 46367:47681, ack 1, win 501, options [nop,nop,TS val 3824320594 ecr 2585828217], length 1314
00:13:33.267925 IP 10.8.3.7.54622 > 99.181.68.7.1935: Flags [.], seq 47681:48995, ack 1, win 501, options [nop,nop,TS val 3824320627 ecr 2585828217], length 1314
00:13:33.301341 IP 10.8.3.7.54622 > 99.181.68.7.1935: Flags [.], seq 48995:50309, ack 1, win 501, options [nop,nop,TS val 3824320661 ecr 2585828217], length 1314
00:13:33.303131 IP 99.181.68.7.1935 > 10.8.3.7.54622: Flags [.], ack 41452, win 126, options [nop,nop,TS val 2585828298 ecr 3824320322], length 0
00:13:33.337529 IP 99.181.68.7.1935 > 10.8.3.7.54622: Flags [.], ack 42425, win 126, options [nop,nop,TS val 2585828333 ecr 3824320407], length 0
00:13:33.337543 IP 10.8.3.7.54622 > 99.181.68.7.1935: Flags [P.], seq 50309:51378, ack 1, win 501, options [nop,nop,TS val 3824320697 ecr 2585828333], length 1069
00:13:33.396749 IP 10.8.3.7.54622 > 99.181.68.7.1935: Flags [.], seq 51378:52692, ack 1, win 501, options [nop,nop,TS val 3824320756 ecr 2585828333], length 1314
00:13:33.420665 IP 99.181.68.7.1935 > 10.8.3.7.54622: Flags [.], ack 45053, win 126, options [nop,nop,TS val 2585828416 ecr 3824320458], length 0
00:13:33.436477 IP 10.8.3.7.54622 > 99.181.68.7.1935: Flags [.], seq 52692:54006, ack 1, win 501, options [nop,nop,TS val 3824320796 ecr 2585828416], length 1314
00:13:33.469707 IP 10.8.3.7.54622 > 99.181.68.7.1935: Flags [.], seq 54006:55320, ack 1, win 501, options [nop,nop,TS val 3824320829 ecr 2585828416], length 1314
00:13:33.524683 IP 99.181.68.7.1935 > 10.8.3.7.54622: Flags [.], ack 47681, win 126, options [nop,nop,TS val 2585828520 ecr 3824320526], length 0
00:13:33.532556 IP 10.8.3.7.54622 > 99.181.68.7.1935: Flags [.], seq 55320:56634, ack 1, win 501, options [nop,nop,TS val 3824320892 ecr 2585828520], length 1314
00:13:33.564703 IP 10.8.3.7.54622 > 99.181.68.7.1935: Flags [.], seq 56634:57948, ack 1, win 501, options [nop,nop,TS val 3824320924 ecr 2585828520], length 1314
00:13:33.591684 IP 99.181.68.7.1935 > 10.8.3.7.54622: Flags [.], ack 50309, win 126, options [nop,nop,TS val 2585828587 ecr 3824320627], length 0
00:13:33.595977 IP 10.8.3.7.54622 > 99.181.68.7.1935: Flags [.], seq 57948:59262, ack 1, win 501, options [nop,nop,TS val 3824320955 ecr 2585828587], length 1314
00:13:33.628310 IP 99.181.68.7.1935 > 10.8.3.7.54622: Flags [.], ack 51378, win 126, options [nop,nop,TS val 2585828623 ecr 3824320697], length 0
00:13:33.628330 IP 10.8.3.7.54622 > 99.181.68.7.1935: Flags [P.], seq 59262:59396, ack 1, win 501, options [nop,nop,TS val 3824320988 ecr 2585828623], length 134
00:13:33.666942 IP 10.8.3.7.54622 > 99.181.68.7.1935: Flags [.], seq 59396:60710, ack 1, win 501, options [nop,nop,TS val 3824321026 ecr 2585828623], length 1314
00:13:33.698656 IP 10.8.3.7.54622 > 99.181.68.7.1935: Flags [.], seq 60710:62024, ack 1, win 501, options [nop,nop,TS val 3824321058 ecr 2585828623], length 1314
00:13:33.726959 IP 99.181.68.7.1935 > 10.8.3.7.54622: Flags [.], ack 54006, win 126, options [nop,nop,TS val 2585828722 ecr 3824320756], length 0
00:13:33.738642 IP 10.8.3.7.54622 > 99.181.68.7.1935: Flags [.], seq 62024:63338, ack 1, win 501, options [nop,nop,TS val 3824321098 ecr 2585828722], length 1314
00:13:33.797076 IP 10.8.3.7.54622 > 99.181.68.7.1935: Flags [.], seq 63338:64652, ack 1, win 501, options [nop,nop,TS val 3824321156 ecr 2585828722], length 1314
00:13:33.823060 IP 99.181.68.7.1935 > 10.8.3.7.54622: Flags [.], ack 56634, win 126, options [nop,nop,TS val 2585828818 ecr 3824320829], length 0
00:13:33.830483 IP 10.8.3.7.54622 > 99.181.68.7.1935: Flags [.], seq 64652:65966, ack 1, win 501, options [nop,nop,TS val 3824321190 ecr 2585828818], length 1314
00:13:33.866072 IP 10.8.3.7.54622 > 99.181.68.7.1935: Flags [.], seq 65966:67280, ack 1, win 501, options [nop,nop,TS val 3824321225 ecr 2585828818], length 1314
00:13:33.886318 IP 99.181.68.7.1935 > 10.8.3.7.54622: Flags [.], ack 59262, win 126, options [nop,nop,TS val 2585828881 ecr 3824320924], length 0
00:13:33.918389 IP 99.181.68.7.1935 > 10.8.3.7.54622: Flags [.], ack 59396, win 126, options [nop,nop,TS val 2585828913 ecr 3824320988], length 0
00:13:33.918410 IP 10.8.3.7.54622 > 99.181.68.7.1935: Flags [P.], seq 67280:68341, ack 1, win 501, options [nop,nop,TS val 3824321278 ecr 2585828913], length 1061
00:13:33.966898 IP 10.8.3.7.54622 > 99.181.68.7.1935: Flags [.], seq 68341:69655, ack 1, win 501, options [nop,nop,TS val 3824321326 ecr 2585828913], length 1314
00:13:33.989090 IP 99.181.68.7.1935 > 10.8.3.7.54622: Flags [.], ack 62024, win 126, options [nop,nop,TS val 2585828984 ecr 3824321026], length 0
00:13:33.996066 IP 10.8.3.7.54622 > 99.181.68.7.1935: Flags [.], seq 69655:70969, ack 1, win 501, options [nop,nop,TS val 3824321355 ecr 2585828984], length 1314
00:13:34.036533 IP 10.8.3.7.54622 > 99.181.68.7.1935: Flags [.], seq 70969:72283, ack 1, win 501, options [nop,nop,TS val 3824321396 ecr 2585828984], length 1314
00:13:34.087667 IP 99.181.68.7.1935 > 10.8.3.7.54622: Flags [.], ack 64652, win 126, options [nop,nop,TS val 2585829083 ecr 3824321098], length 0
00:13:34.100215 IP 10.8.3.7.54622 > 99.181.68.7.1935: Flags [.], seq 72283:73597, ack 1, win 501, options [nop,nop,TS val 3824321460 ecr 2585829083], length 1314
00:13:34.129476 IP 10.8.3.7.54622 > 99.181.68.7.1935: Flags [.], seq 73597:74911, ack 1, win 501, options [nop,nop,TS val 3824321489 ecr 2585829083], length 1314
00:13:34.156636 IP 99.181.68.7.1935 > 10.8.3.7.54622: Flags [.], ack 67280, win 126, options [nop,nop,TS val 2585829151 ecr 3824321190], length 0
00:13:34.164194 IP 10.8.3.7.54622 > 99.181.68.7.1935: Flags [.], seq 74911:76225, ack 1, win 501, options [nop,nop,TS val 3824321524 ecr 2585829151], length 1314
00:13:34.209112 IP 99.181.68.7.1935 > 10.8.3.7.54622: Flags [.], ack 68341, win 126, options [nop,nop,TS val 2585829204 ecr 3824321278], length 0
00:13:34.209152 IP 10.8.3.7.54622 > 99.181.68.7.1935: Flags [P.], seq 76225:77297, ack 1, win 501, options [nop,nop,TS val 3824321568 ecr 2585829204], length 1072
00:13:34.266941 IP 10.8.3.7.54622 > 99.181.68.7.1935: Flags [.], seq 77297:78611, ack 1, win 501, options [nop,nop,TS val 3824321626 ecr 2585829204], length 1314
00:13:34.286365 IP 99.181.68.7.1935 > 10.8.3.7.54622: Flags [.], ack 70969, win 126, options [nop,nop,TS val 2585829281 ecr 3824321326], length 0
00:13:34.297633 IP 10.8.3.7.54622 > 99.181.68.7.1935: Flags [.], seq 78611:79925, ack 1, win 501, options [nop,nop,TS val 3824321657 ecr 2585829281], length 1314
00:13:34.335490 IP 10.8.3.7.54622 > 99.181.68.7.1935: Flags [.], seq 79925:81239, ack 1, win 501, options [nop,nop,TS val 3824321695 ecr 2585829281], length 1314
00:13:34.390790 IP 99.181.68.7.1935 > 10.8.3.7.54622: Flags [.], ack 73597, win 126, options [nop,nop,TS val 2585829386 ecr 3824321396], length 0
00:13:34.399936 IP 10.8.3.7.54622 > 99.181.68.7.1935: Flags [.], seq 81239:82553, ack 1, win 501, options [nop,nop,TS val 3824321759 ecr 2585829386], length 1314
00:13:34.430950 IP 10.8.3.7.54622 > 99.181.68.7.1935: Flags [.], seq 82553:83867, ack 1, win 501, options [nop,nop,TS val 3824321790 ecr 2585829386], length 1314
00:13:34.454504 IP 99.181.68.7.1935 > 10.8.3.7.54622: Flags [.], ack 76225, win 126, options [nop,nop,TS val 2585829450 ecr 3824321489], length 0
00:13:34.463604 IP 10.8.3.7.54622 > 99.181.68.7.1935: Flags [.], seq 83867:85181, ack 1, win 501, options [nop,nop,TS val 3824321823 ecr 2585829450], length 1314
00:13:34.499904 IP 99.181.68.7.1935 > 10.8.3.7.54622: Flags [.], ack 77297, win 126, options [nop,nop,TS val 2585829495 ecr 3824321568], length 0
00:13:34.499929 IP 10.8.3.7.54622 > 99.181.68.7.1935: Flags [P.], seq 85181:86164, ack 1, win 501, options [nop,nop,TS val 3824321859 ecr 2585829495], length 983
00:13:34.565210 IP 10.8.3.7.54622 > 99.181.68.7.1935: Flags [.], seq 86164:87478, ack 1, win 501, options [nop,nop,TS val 3824321925 ecr 2585829495], length 1314
00:13:34.587892 IP 99.181.68.7.1935 > 10.8.3.7.54622: Flags [.], ack 79925, win 126, options [nop,nop,TS val 2585829583 ecr 3824321626], length 0
00:13:34.597220 IP 10.8.3.7.54622 > 99.181.68.7.1935: Flags [.], seq 87478:88792, ack 1, win 501, options [nop,nop,TS val 3824321957 ecr 2585829583], length 1314
00:13:34.633362 IP 10.8.3.7.54622 > 99.181.68.7.1935: Flags [.], seq 88792:90106, ack 1, win 501, options [nop,nop,TS val 3824321993 ecr 2585829583], length 1314
00:13:34.690318 IP 99.181.68.7.1935 > 10.8.3.7.54622: Flags [.], ack 82553, win 126, options [nop,nop,TS val 2585829685 ecr 3824321695], length 0
00:13:34.697158 IP 10.8.3.7.54622 > 99.181.68.7.1935: Flags [.], seq 90106:91420, ack 1, win 501, options [nop,nop,TS val 3824322056 ecr 2585829685], length 1314
00:13:34.729989 IP 10.8.3.7.54622 > 99.181.68.7.1935: Flags [.], seq 91420:92734, ack 1, win 501, options [nop,nop,TS val 3824322089 ecr 2585829685], length 1314
00:13:34.753958 IP 99.181.68.7.1935 > 10.8.3.7.54622: Flags [.], ack 85181, win 126, options [nop,nop,TS val 2585829749 ecr 3824321790], length 0
00:13:34.766649 IP 10.8.3.7.54622 > 99.181.68.7.1935: Flags [.], seq 92734:94048, ack 1, win 501, options [nop,nop,TS val 3824322126 ecr 2585829749], length 1314
00:13:34.790211 IP 99.181.68.7.1935 > 10.8.3.7.54622: Flags [.], ack 86164, win 126, options [nop,nop,TS val 2585829785 ecr 3824321859], length 0
00:13:34.790249 IP 10.8.3.7.54622 > 99.181.68.7.1935: Flags [P.], seq 94048:94260, ack 1, win 501, options [nop,nop,TS val 3824322150 ecr 2585829785], length 212
00:13:34.831861 IP 10.8.3.7.54622 > 99.181.68.7.1935: Flags [.], seq 94260:95574, ack 1, win 501, options [nop,nop,TS val 3824322191 ecr 2585829785], length 1314
00:13:34.863690 IP 10.8.3.7.54622 > 99.181.68.7.1935: Flags [.], seq 95574:96888, ack 1, win 501, options [nop,nop,TS val 3824322223 ecr 2585829785], length 1314
00:13:34.887554 IP 99.181.68.7.1935 > 10.8.3.7.54622: Flags [.], ack 88792, win 126, options [nop,nop,TS val 2585829883 ecr 3824321925], length 0
00:13:34.912583 IP 10.8.3.7.54622 > 99.181.68.7.1935: Flags [.], seq 96888:98202, ack 1, win 501, options [nop,nop,TS val 3824322272 ecr 2585829883], length 1314
00:13:34.965316 IP 10.8.3.7.54622 > 99.181.68.7.1935: Flags [.], seq 98202:99516, ack 1, win 501, options [nop,nop,TS val 3824322325 ecr 2585829883], length 1314
00:13:34.987550 IP 99.181.68.7.1935 > 10.8.3.7.54622: Flags [.], ack 91420, win 126, options [nop,nop,TS val 2585829983 ecr 3824321993], length 0
00:13:34.997209 IP 10.8.3.7.54622 > 99.181.68.7.1935: Flags [.], seq 99516:100830, ack 1, win 501, options [nop,nop,TS val 3824322357 ecr 2585829983], length 1314
00:13:35.041026 IP 10.8.3.7.54622 > 99.181.68.7.1935: Flags [.], seq 100830:102144, ack 1, win 501, options [nop,nop,TS val 3824322400 ecr 2585829983], length 1314
00:13:35.057261 IP 99.181.68.7.1935 > 10.8.3.7.54622: Flags [.], ack 94048, win 126, options [nop,nop,TS val 2585830052 ecr 3824322089], length 0
00:13:35.080427 IP 99.181.68.7.1935 > 10.8.3.7.54622: Flags [.], ack 94260, win 126, options [nop,nop,TS val 2585830075 ecr 3824322150], length 0
00:13:35.080482 IP 10.8.3.7.54622 > 99.181.68.7.1935: Flags [P.], seq 102144:103126, ack 1, win 501, options [nop,nop,TS val 3824322440 ecr 2585830075], length 982
00:13:35.130549 IP 10.8.3.7.54622 > 99.181.68.7.1935: Flags [.], seq 103126:104440, ack 1, win 501, options [nop,nop,TS val 3824322490 ecr 2585830075], length 1314
00:13:35.154135 IP 99.181.68.7.1935 > 10.8.3.7.54622: Flags [.], ack 96888, win 126, options [nop,nop,TS val 2585830149 ecr 3824322191], length 0
00:13:35.165483 IP 10.8.3.7.54622 > 99.181.68.7.1935: Flags [.], seq 104440:105754, ack 1, win 501, options [nop,nop,TS val 3824322525 ecr 2585830149], length 1314
00:13:35.200226 IP 10.8.3.7.54622 > 99.181.68.7.1935: Flags [.], seq 105754:107068, ack 1, win 501, options [nop,nop,TS val 3824322560 ecr 2585830149], length 1314
00:13:35.255755 IP 99.181.68.7.1935 > 10.8.3.7.54622: Flags [.], ack 99516, win 126, options [nop,nop,TS val 2585830251 ecr 3824322272], length 0
00:13:35.264355 IP 10.8.3.7.54622 > 99.181.68.7.1935: Flags [.], seq 107068:108382, ack 1, win 501, options [nop,nop,TS val 3824322624 ecr 2585830251], length 1314
00:13:35.298793 IP 10.8.3.7.54622 > 99.181.68.7.1935: Flags [.], seq 108382:109696, ack 1, win 501, options [nop,nop,TS val 3824322658 ecr 2585830251], length 1314
00:13:35.331768 IP 99.181.68.7.1935 > 10.8.3.7.54622: Flags [.], ack 102144, win 126, options [nop,nop,TS val 2585830327 ecr 3824322357], length 0
00:13:35.333554 IP 10.8.3.7.54622 > 99.181.68.7.1935: Flags [.], seq 109696:111010, ack 1, win 501, options [nop,nop,TS val 3824322693 ecr 2585830327], length 1314
00:13:35.370750 IP 99.181.68.7.1935 > 10.8.3.7.54622: Flags [.], ack 103126, win 126, options [nop,nop,TS val 2585830366 ecr 3824322440], length 0
00:13:35.370771 IP 10.8.3.7.54622 > 99.181.68.7.1935: Flags [P.], seq 111010:112078, ack 1, win 501, options [nop,nop,TS val 3824322730 ecr 2585830366], length 1068
00:13:35.433697 IP 10.8.3.7.54622 > 99.181.68.7.1935: Flags [.], seq 112078:113392, ack 1, win 501, options [nop,nop,TS val 3824322793 ecr 2585830366], length 1314
00:13:35.456081 IP 99.181.68.7.1935 > 10.8.3.7.54622: Flags [.], ack 105754, win 126, options [nop,nop,TS val 2585830451 ecr 3824322490], length 0
00:13:35.466749 IP 10.8.3.7.54622 > 99.181.68.7.1935: Flags [.], seq 113392:114706, ack 1, win 501, options [nop,nop,TS val 3824322826 ecr 2585830451], length 1314
00:13:35.500634 IP 10.8.3.7.54622 > 99.181.68.7.1935: Flags [.], seq 114706:116020, ack 1, win 501, options [nop,nop,TS val 3824322860 ecr 2585830451], length 1314
00:13:35.554990 IP 99.181.68.7.1935 > 10.8.3.7.54622: Flags [.], ack 108382, win 126, options [nop,nop,TS val 2585830550 ecr 3824322560], length 0
00:13:35.564607 IP 10.8.3.7.54622 > 99.181.68.7.1935: Flags [.], seq 116020:117334, ack 1, win 501, options [nop,nop,TS val 3824322924 ecr 2585830550], length 1314
00:13:35.596552 IP 10.8.3.7.54622 > 99.181.68.7.1935: Flags [.], seq 117334:118648, ack 1, win 501, options [nop,nop,TS val 3824322956 ecr 2585830550], length 1314
00:13:35.623957 IP 99.181.68.7.1935 > 10.8.3.7.54622: Flags [.], ack 111010, win 126, options [nop,nop,TS val 2585830619 ecr 3824322658], length 0
00:13:35.629973 IP 10.8.3.7.54622 > 99.181.68.7.1935: Flags [.], seq 118648:119962, ack 1, win 501, options [nop,nop,TS val 3824322989 ecr 2585830619], length 1314
00:13:35.661238 IP 99.181.68.7.1935 > 10.8.3.7.54622: Flags [.], ack 112078, win 126, options [nop,nop,TS val 2585830656 ecr 3824322730], length 0
00:13:35.661272 IP 10.8.3.7.54622 > 99.181.68.7.1935: Flags [P.], seq 119962:120180, ack 1, win 501, options [nop,nop,TS val 3824323021 ecr 2585830656], length 218
00:13:35.700194 IP 10.8.3.7.54622 > 99.181.68.7.1935: Flags [.], seq 120180:121494, ack 1, win 501, options [nop,nop,TS val 3824323059 ecr 2585830656], length 1314
00:13:35.733487 IP 10.8.3.7.54622 > 99.181.68.7.1935: Flags [.], seq 121494:122808, ack 1, win 501, options [nop,nop,TS val 3824323093 ecr 2585830656], length 1314
00:13:35.757230 IP 99.181.68.7.1935 > 10.8.3.7.54622: Flags [.], ack 114706, win 126, options [nop,nop,TS val 2585830752 ecr 3824322793], length 0
00:13:35.788961 IP 10.8.3.7.54622 > 99.181.68.7.1935: Flags [.], seq 122808:124122, ack 1, win 501, options [nop,nop,TS val 3824323148 ecr 2585830752], length 1314
00:13:35.831506 IP 10.8.3.7.54622 > 99.181.68.7.1935: Flags [.], seq 124122:125436, ack 1, win 501, options [nop,nop,TS val 3824323191 ecr 2585830752], length 1314
00:13:35.854949 IP 99.181.68.7.1935 > 10.8.3.7.54622: Flags [.], ack 117334, win 126, options [nop,nop,TS val 2585830850 ecr 3824322860], length 0
00:13:35.862714 IP 10.8.3.7.54622 > 99.181.68.7.1935: Flags [.], seq 125436:126750, ack 1, win 501, options [nop,nop,TS val 3824323222 ecr 2585830850], length 1314
00:13:35.916643 IP 10.8.3.7.54622 > 99.181.68.7.1935: Flags [.], seq 126750:128064, ack 1, win 501, options [nop,nop,TS val 3824323276 ecr 2585830850], length 1314
00:13:35.920194 IP 99.181.68.7.1935 > 10.8.3.7.54622: Flags [.], ack 119962, win 126, options [nop,nop,TS val 2585830915 ecr 3824322956], length 0
00:13:35.951453 IP 99.181.68.7.1935 > 10.8.3.7.54622: Flags [.], ack 120180, win 126, options [nop,nop,TS val 2585830947 ecr 3824323021], length 0
00:13:35.951490 IP 10.8.3.7.54622 > 99.181.68.7.1935: Flags [P.], seq 128064:129045, ack 1, win 501, options [nop,nop,TS val 3824323311 ecr 2585830947], length 981
00:13:36.000104 IP 10.8.3.7.54622 > 99.181.68.7.1935: Flags [.], seq 129045:130359, ack 1, win 501, options [nop,nop,TS val 3824323359 ecr 2585830947], length 1314
00:13:36.023958 IP 99.181.68.7.1935 > 10.8.3.7.54622: Flags [.], ack 122808, win 126, options [nop,nop,TS val 2585831019 ecr 3824323059], length 0
00:13:36.030468 IP 10.8.3.7.54622 > 99.181.68.7.1935: Flags [.], seq 130359:131673, ack 1, win 501, options [nop,nop,TS val 3824323390 ecr 2585831019], length 1314
00:13:36.066358 IP 10.8.3.7.54622 > 99.181.68.7.1935: Flags [.], seq 131673:132987, ack 1, win 501, options [nop,nop,TS val 3824323426 ecr 2585831019], length 1314
00:13:36.121929 IP 99.181.68.7.1935 > 10.8.3.7.54622: Flags [.], ack 125436, win 126, options [nop,nop,TS val 2585831117 ecr 3824323148], length 0
00:13:36.133634 IP 10.8.3.7.54622 > 99.181.68.7.1935: Flags [.], seq 132987:134301, ack 1, win 501, options [nop,nop,TS val 3824323493 ecr 2585831117], length 1314
00:13:36.164152 IP 10.8.3.7.54622 > 99.181.68.7.1935: Flags [.], seq 134301:135615, ack 1, win 501, options [nop,nop,TS val 3824323523 ecr 2585831117], length 1314
00:13:36.199980 IP 10.8.3.7.54622 > 99.181.68.7.1935: Flags [.], seq 135615:136929, ack 1, win 501, options [nop,nop,TS val 3824323559 ecr 2585831117], length 1314
00:13:36.207008 IP 99.181.68.7.1935 > 10.8.3.7.54622: Flags [.], ack 128064, win 126, options [nop,nop,TS val 2585831202 ecr 3824323222], length 0
00:13:36.242040 IP 99.181.68.7.1935 > 10.8.3.7.54622: Flags [.], ack 129045, win 126, options [nop,nop,TS val 2585831237 ecr 3824323311], length 0
00:13:36.242093 IP 10.8.3.7.54622 > 99.181.68.7.1935: Flags [P.], seq 136929:137998, ack 1, win 501, options [nop,nop,TS val 3824323601 ecr 2585831237], length 1069
00:13:36.300232 IP 10.8.3.7.54622 > 99.181.68.7.1935: Flags [.], seq 137998:139312, ack 1, win 501, options [nop,nop,TS val 3824323660 ecr 2585831237], length 1314
00:13:36.320871 IP 99.181.68.7.1935 > 10.8.3.7.54622: Flags [.], ack 131673, win 126, options [nop,nop,TS val 2585831316 ecr 3824323359], length 0
00:13:36.333488 IP 10.8.3.7.54622 > 99.181.68.7.1935: Flags [.], seq 139312:140626, ack 1, win 501, options [nop,nop,TS val 3824323693 ecr 2585831316], length 1314
00:13:36.367042 IP 10.8.3.7.54622 > 99.181.68.7.1935: Flags [.], seq 140626:141940, ack 1, win 501, options [nop,nop,TS val 3824323726 ecr 2585831316], length 1314
00:13:36.424172 IP 99.181.68.7.1935 > 10.8.3.7.54622: Flags [.], ack 134301, win 126, options [nop,nop,TS val 2585831419 ecr 3824323426], length 0
00:13:36.431847 IP 10.8.3.7.54622 > 99.181.68.7.1935: Flags [.], seq 141940:143254, ack 1, win 501, options [nop,nop,TS val 3824323791 ecr 2585831419], length 1314
00:13:36.466110 IP 10.8.3.7.54622 > 99.181.68.7.1935: Flags [.], seq 143254:144568, ack 1, win 501, options [nop,nop,TS val 3824323825 ecr 2585831419], length 1314
00:13:36.490444 IP 99.181.68.7.1935 > 10.8.3.7.54622: Flags [.], ack 136929, win 126, options [nop,nop,TS val 2585831485 ecr 3824323523], length 0
00:13:36.499965 IP 10.8.3.7.54622 > 99.181.68.7.1935: Flags [.], seq 144568:145882, ack 1, win 501, options [nop,nop,TS val 3824323859 ecr 2585831485], length 1314
00:13:36.532407 IP 99.181.68.7.1935 > 10.8.3.7.54622: Flags [.], ack 137998, win 126, options [nop,nop,TS val 2585831527 ecr 3824323601], length 0
00:13:36.532436 IP 10.8.3.7.54622 > 99.181.68.7.1935: Flags [P.], seq 145882:146009, ack 1, win 501, options [nop,nop,TS val 3824323892 ecr 2585831527], length 127
00:13:36.566215 IP 10.8.3.7.54622 > 99.181.68.7.1935: Flags [.], seq 146009:147323, ack 1, win 501, options [nop,nop,TS val 3824323926 ecr 2585831527], length 1314
00:13:36.599575 IP 10.8.3.7.54622 > 99.181.68.7.1935: Flags [.], seq 147323:148637, ack 1, win 501, options [nop,nop,TS val 3824323959 ecr 2585831527], length 1314
00:13:36.624040 IP 99.181.68.7.1935 > 10.8.3.7.54622: Flags [.], ack 140626, win 126, options [nop,nop,TS val 2585831619 ecr 3824323660], length 0
00:13:36.645432 IP 10.8.3.7.54622 > 99.181.68.7.1935: Flags [.], seq 148637:149951, ack 1, win 501, options [nop,nop,TS val 3824324005 ecr 2585831619], length 1314
00:13:36.697525 IP 10.8.3.7.54622 > 99.181.68.7.1935: Flags [.], seq 149951:151265, ack 1, win 501, options [nop,nop,TS val 3824324057 ecr 2585831619], length 1314
00:13:36.722252 IP 99.181.68.7.1935 > 10.8.3.7.54622: Flags [.], ack 143254, win 126, options [nop,nop,TS val 2585831717 ecr 3824323726], length 0
00:13:36.733669 IP 10.8.3.7.54622 > 99.181.68.7.1935: Flags [.], seq 151265:152579, ack 1, win 501, options [nop,nop,TS val 3824324093 ecr 2585831717], length 1314
00:13:36.773632 IP 10.8.3.7.54622 > 99.181.68.7.1935: Flags [.], seq 152579:153893, ack 1, win 501, options [nop,nop,TS val 3824324133 ecr 2585831717], length 1314
00:13:36.790272 IP 99.181.68.7.1935 > 10.8.3.7.54622: Flags [.], ack 145882, win 126, options [nop,nop,TS val 2585831785 ecr 3824323825], length 0
00:13:36.822596 IP 99.181.68.7.1935 > 10.8.3.7.54622: Flags [.], ack 146009, win 126, options [nop,nop,TS val 2585831818 ecr 3824323892], length 0
00:13:36.822619 IP 10.8.3.7.54622 > 99.181.68.7.1935: Flags [P.], seq 153893:154970, ack 1, win 501, options [nop,nop,TS val 3824324182 ecr 2585831818], length 1077
00:13:36.865835 IP 10.8.3.7.54622 > 99.181.68.7.1935: Flags [.], seq 154970:156284, ack 1, win 501, options [nop,nop,TS val 3824324225 ecr 2585831818], length 1314
00:13:36.889979 IP 99.181.68.7.1935 > 10.8.3.7.54622: Flags [.], ack 148637, win 126, options [nop,nop,TS val 2585831885 ecr 3824323926], length 0
00:13:36.902527 IP 10.8.3.7.54622 > 99.181.68.7.1935: Flags [.], seq 156284:157598, ack 1, win 501, options [nop,nop,TS val 3824324262 ecr 2585831885], length 1314
00:13:36.945604 IP 10.8.3.7.54622 > 99.181.68.7.1935: Flags [.], seq 157598:158912, ack 1, win 501, options [nop,nop,TS val 3824324305 ecr 2585831885], length 1314
00:13:36.987932 IP 99.181.68.7.1935 > 10.8.3.7.54622: Flags [.], ack 151265, win 126, options [nop,nop,TS val 2585831983 ecr 3824324005], length 0
00:13:36.997666 IP 10.8.3.7.54622 > 99.181.68.7.1935: Flags [.], seq 158912:160226, ack 1, win 501, options [nop,nop,TS val 3824324357 ecr 2585831983], length 1314
00:13:37.032871 IP 10.8.3.7.54622 > 99.181.68.7.1935: Flags [.], seq 160226:161540, ack 1, win 501, options [nop,nop,TS val 3824324392 ecr 2585831983], length 1314
00:13:37.064031 IP 99.181.68.7.1935 > 10.8.3.7.54622: Flags [.], ack 153893, win 126, options [nop,nop,TS val 2585832059 ecr 3824324093], length 0
00:13:37.074014 IP 10.8.3.7.54622 > 99.181.68.7.1935: Flags [.], seq 161540:162854, ack 1, win 501, options [nop,nop,TS val 3824324433 ecr 2585832059], length 1314
00:13:37.112980 IP 99.181.68.7.1935 > 10.8.3.7.54622: Flags [.], ack 154970, win 126, options [nop,nop,TS val 2585832108 ecr 3824324182], length 0
00:13:37.112999 IP 10.8.3.7.54622 > 99.181.68.7.1935: Flags [P.], seq 162854:163819, ack 1, win 501, options [nop,nop,TS val 3824324472 ecr 2585832108], length 965
00:13:37.165797 IP 10.8.3.7.54622 > 99.181.68.7.1935: Flags [.], seq 163819:165133, ack 1, win 501, options [nop,nop,TS val 3824324525 ecr 2585832108], length 1314
00:13:37.193049 IP 99.181.68.7.1935 > 10.8.3.7.54622: Flags [.], ack 157598, win 126, options [nop,nop,TS val 2585832188 ecr 3824324225], length 0
00:13:37.202313 IP 10.8.3.7.54622 > 99.181.68.7.1935: Flags [.], seq 165133:166447, ack 1, win 501, options [nop,nop,TS val 3824324562 ecr 2585832188], length 1314
00:13:37.233563 IP 10.8.3.7.54622 > 99.181.68.7.1935: Flags [.], seq 166447:167761, ack 1, win 501, options [nop,nop,TS val 3824324593 ecr 2585832188], length 1314
00:13:37.288006 IP 99.181.68.7.1935 > 10.8.3.7.54622: Flags [.], ack 160226, win 126, options [nop,nop,TS val 2585832283 ecr 3824324305], length 0
00:13:37.300298 IP 10.8.3.7.54622 > 99.181.68.7.1935: Flags [.], seq 167761:169075, ack 1, win 501, options [nop,nop,TS val 3824324660 ecr 2585832283], length 1314
00:13:37.333466 IP 10.8.3.7.54622 > 99.181.68.7.1935: Flags [.], seq 169075:170389, ack 1, win 501, options [nop,nop,TS val 3824324693 ecr 2585832283], length 1314
00:13:37.364117 IP 10.8.3.7.54622 > 99.181.68.7.1935: Flags [.], seq 170389:171703, ack 1, win 501, options [nop,nop,TS val 3824324723 ecr 2585832283], length 1314
00:13:37.364732 IP 99.181.68.7.1935 > 10.8.3.7.54622: Flags [.], ack 162854, win 126, options [nop,nop,TS val 2585832360 ecr 3824324392], length 0
00:13:37.403306 IP 99.181.68.7.1935 > 10.8.3.7.54622: Flags [.], ack 163819, win 126, options [nop,nop,TS val 2585832398 ecr 3824324472], length 0
00:13:37.403342 IP 10.8.3.7.54622 > 99.181.68.7.1935: Flags [P.], seq 171703:172776, ack 1, win 501, options [nop,nop,TS val 3824324763 ecr 2585832398], length 1073
00:13:37.466698 IP 10.8.3.7.54622 > 99.181.68.7.1935: Flags [.], seq 172776:174090, ack 1, win 501, options [nop,nop,TS val 3824324826 ecr 2585832398], length 1314
00:13:37.492819 IP 99.181.68.7.1935 > 10.8.3.7.54622: Flags [.], ack 166447, win 126, options [nop,nop,TS val 2585832488 ecr 3824324525], length 0
00:13:37.503192 IP 10.8.3.7.54622 > 99.181.68.7.1935: Flags [.], seq 174090:175404, ack 1, win 501, options [nop,nop,TS val 3824324862 ecr 2585832488], length 1314
00:13:37.533260 IP 10.8.3.7.54622 > 99.181.68.7.1935: Flags [.], seq 175404:176718, ack 1, win 501, options [nop,nop,TS val 3824324893 ecr 2585832488], length 1314
00:13:37.590651 IP 99.181.68.7.1935 > 10.8.3.7.54622: Flags [.], ack 169075, win 126, options [nop,nop,TS val 2585832586 ecr 3824324593], length 0
00:13:37.600128 IP 10.8.3.7.54622 > 99.181.68.7.1935: Flags [.], seq 176718:178032, ack 1, win 501, options [nop,nop,TS val 3824324959 ecr 2585832586], length 1314
00:13:37.631721 IP 10.8.3.7.54622 > 99.181.68.7.1935: Flags [.], seq 178032:179346, ack 1, win 501, options [nop,nop,TS val 3824324991 ecr 2585832586], length 1314
00:13:37.654400 IP 99.181.68.7.1935 > 10.8.3.7.54622: Flags [.], ack 171703, win 126, options [nop,nop,TS val 2585832649 ecr 3824324693], length 0
00:13:37.665869 IP 10.8.3.7.54622 > 99.181.68.7.1935: Flags [.], seq 179346:180660, ack 1, win 501, options [nop,nop,TS val 3824325025 ecr 2585832649], length 1314
00:13:37.693803 IP 99.181.68.7.1935 > 10.8.3.7.54622: Flags [.], ack 172776, win 126, options [nop,nop,TS val 2585832689 ecr 3824324763], length 0
00:13:37.693828 IP 10.8.3.7.54622 > 99.181.68.7.1935: Flags [P.], seq 180660:180793, ack 1, win 501, options [nop,nop,TS val 3824325053 ecr 2585832689], length 133
00:13:37.738761 IP 10.8.3.7.54622 > 99.181.68.7.1935: Flags [.], seq 180793:182107, ack 1, win 501, options [nop,nop,TS val 3824325098 ecr 2585832689], length 1314
00:13:37.766678 IP 10.8.3.7.54622 > 99.181.68.7.1935: Flags [.], seq 182107:183421, ack 1, win 501, options [nop,nop,TS val 3824325126 ecr 2585832689], length 1314
00:13:37.793663 IP 99.181.68.7.1935 > 10.8.3.7.54622: Flags [.], ack 175404, win 126, options [nop,nop,TS val 2585832789 ecr 3824324826], length 0
00:13:37.803065 IP 10.8.3.7.54622 > 99.181.68.7.1935: Flags [.], seq 183421:184735, ack 1, win 501, options [nop,nop,TS val 3824325162 ecr 2585832789], length 1314
00:13:37.866781 IP 10.8.3.7.54622 > 99.181.68.7.1935: Flags [.], seq 184735:186049, ack 1, win 501, options [nop,nop,TS val 3824325226 ecr 2585832789], length 1314
00:13:37.890571 IP 99.181.68.7.1935 > 10.8.3.7.54622: Flags [.], ack 178032, win 126, options [nop,nop,TS val 2585832886 ecr 3824324893], length 0
00:13:37.896316 IP 10.8.3.7.54622 > 99.181.68.7.1935: Flags [.], seq 186049:187363, ack 1, win 501, options [nop,nop,TS val 3824325256 ecr 2585832886], length 1314
00:13:37.933460 IP 10.8.3.7.54622 > 99.181.68.7.1935: Flags [.], seq 187363:188677, ack 1, win 501, options [nop,nop,TS val 3824325293 ecr 2585832886], length 1314
00:13:37.956532 IP 99.181.68.7.1935 > 10.8.3.7.54622: Flags [.], ack 180660, win 126, options [nop,nop,TS val 2585832951 ecr 3824324991], length 0
00:13:37.984005 IP 99.181.68.7.1935 > 10.8.3.7.54622: Flags [.], ack 180793, win 126, options [nop,nop,TS val 2585832979 ecr 3824325053], length 0
00:13:37.984037 IP 10.8.3.7.54622 > 99.181.68.7.1935: Flags [P.], seq 188677:189738, ack 1, win 501, options [nop,nop,TS val 3824325343 ecr 2585832979], length 1061
00:13:38.037577 IP 10.8.3.7.54622 > 99.181.68.7.1935: Flags [.], seq 189738:191052, ack 1, win 501, options [nop,nop,TS val 3824325397 ecr 2585832979], length 1314
00:13:38.057101 IP 99.181.68.7.1935 > 10.8.3.7.54622: Flags [.], ack 183421, win 126, options [nop,nop,TS val 2585833052 ecr 3824325098], length 0
00:13:38.066940 IP 10.8.3.7.54622 > 99.181.68.7.1935: Flags [.], seq 191052:192366, ack 1, win 501, options [nop,nop,TS val 3824325426 ecr 2585833052], length 1314
00:13:38.101915 IP 10.8.3.7.54622 > 99.181.68.7.1935: Flags [.], seq 192366:193680, ack 1, win 501, options [nop,nop,TS val 3824325461 ecr 2585833052], length 1314
00:13:38.157501 IP 99.181.68.7.1935 > 10.8.3.7.54622: Flags [.], ack 186049, win 126, options [nop,nop,TS val 2585833152 ecr 3824325162], length 0
00:13:38.166087 IP 10.8.3.7.54622 > 99.181.68.7.1935: Flags [.], seq 193680:194994, ack 1, win 501, options [nop,nop,TS val 3824325525 ecr 2585833152], length 1314
00:13:38.198381 IP 10.8.3.7.54622 > 99.181.68.7.1935: Flags [.], seq 194994:196308, ack 1, win 501, options [nop,nop,TS val 3824325558 ecr 2585833152], length 1314
00:13:38.223991 IP 99.181.68.7.1935 > 10.8.3.7.54622: Flags [.], ack 188677, win 126, options [nop,nop,TS val 2585833219 ecr 3824325256], length 0
00:13:38.232962 IP 10.8.3.7.54622 > 99.181.68.7.1935: Flags [.], seq 196308:197622, ack 1, win 501, options [nop,nop,TS val 3824325592 ecr 2585833219], length 1314
00:13:38.274498 IP 99.181.68.7.1935 > 10.8.3.7.54622: Flags [.], ack 189738, win 126, options [nop,nop,TS val 2585833269 ecr 3824325343], length 0
00:13:38.274533 IP 10.8.3.7.54622 > 99.181.68.7.1935: Flags [P.], seq 197622:198699, ack 1, win 501, options [nop,nop,TS val 3824325634 ecr 2585833269], length 1077
00:13:38.337075 IP 10.8.3.7.54622 > 99.181.68.7.1935: Flags [.], seq 198699:200013, ack 1, win 501, options [nop,nop,TS val 3824325696 ecr 2585833269], length 1314
00:13:38.362245 IP 99.181.68.7.1935 > 10.8.3.7.54622: Flags [.], ack 192366, win 126, options [nop,nop,TS val 2585833352 ecr 3824325397], length 0
