17:40:43.023739 IP 45.113.130.70.1935 > 10.8.3.3.59236: Flags [.], ack 2722298454, win 135, options [nop,nop,TS val 3560418280 ecr 2944732184], length 0
17:40:43.029757 IP 10.8.3.3.59236 > 45.113.130.70.1935: Flags [.], seq 14037:15351, ack 0, win 501, options [nop,nop,TS val 2944732748 ecr 3560418280], length 1314
17:40:43.053278 IP 45.113.130.70.1935 > 10.8.3.3.59236: Flags [.], ack 897, win 136, options [nop,nop,TS val 3560418309 ecr 2944732279], length 0
17:40:43.053293 IP 10.8.3.3.59236 > 45.113.130.70.1935: Flags [P.], seq 15351:15792, ack 0, win 501, options [nop,nop,TS val 2944732772 ecr 3560418309], length 441
17:40:43.096188 IP 10.8.3.3.59236 > 45.113.130.70.1935: Flags [.], seq 15792:17106, ack 0, win 501, options [nop,nop,TS val 2944732815 ecr 3560418309], length 1314
17:40:43.126335 IP 45.113.130.70.1935 > 10.8.3.3.59236: Flags [.], ack 3525, win 136, options [nop,nop,TS val 3560418382 ecr 2944732314], length 0
17:40:43.129754 IP 10.8.3.3.59236 > 45.113.130.70.1935: Flags [.], seq 17106:18420, ack 0, win 501, options [nop,nop,TS val 2944732848 ecr 3560418382], length 1314
17:40:43.172680 IP 10.8.3.3.59236 > 45.113.130.70.1935: Flags [.], seq 18420:19734, ack 0, win 501, options [nop,nop,TS val 2944732891 ecr 3560418382], length 1314
17:40:43.226153 IP 45.113.130.70.1935 > 10.8.3.3.59236: Flags [.], ack 6153, win 136, options [nop,nop,TS val 3560418482 ecr 2944732399], length 0
17:40:43.233522 IP 10.8.3.3.59236 > 45.113.130.70.1935: Flags [.], seq 19734:21048, ack 0, win 501, options [nop,nop,TS val 2944732952 ecr 3560418482], length 1314
17:40:43.265698 IP 10.8.3.3.59236 > 45.113.130.70.1935: Flags [.], seq 21048:22362, ack 0, win 501, options [nop,nop,TS val 2944732984 ecr 3560418482], length 1314
17:40:43.301321 IP 10.8.3.3.59236 > 45.113.130.70.1935: Flags [.], seq 22362:23676, ack 0, win 501, options [nop,nop,TS val 2944733020 ecr 3560418482], length 1314
17:40:43.302674 IP 45.113.130.70.1935 > 10.8.3.3.59236: Flags [.], ack 8781, win 136, options [nop,nop,TS val 3560418559 ecr 2944732485], length 0
17:40:43.365041 IP 10.8.3.3.59236 > 45.113.130.70.1935: Flags [.], seq 23676:24990, ack 0, win 501, options [nop,nop,TS val 2944733083 ecr 3560418559], length 1314
17:40:43.388727 IP 45.113.130.70.1935 > 10.8.3.3.59236: Flags [.], ack 11409, win 136, options [nop,nop,TS val 3560418645 ecr 2944732585], length 0
17:40:43.398700 IP 10.8.3.3.59236 > 45.113.130.70.1935: Flags [.], seq 24990:26304, ack 0, win 501, options [nop,nop,TS val 2944733117 ecr 3560418645], length 1314
17:40:43.432021 IP 10.8.3.3.59236 > 45.113.130.70.1935: Flags [.], seq 26304:27618, ack 0, win 501, options [nop,nop,TS val 2944733150 ecr 3560418645], length 1314
17:40:43.489021 IP 45.113.130.70.1935 > 10.8.3.3.59236: Flags [.], ack 14037, win 135, options [nop,nop,TS val 3560418745 ecr 2944732657], length 0
17:40:43.496451 IP 10.8.3.3.59236 > 45.113.130.70.1935: Flags [.], seq 27618:28932, ack 0, win 501, options [nop,nop,TS val 2944733215 ecr 3560418745], length 1314
17:40:43.529344 IP 10.8.3.3.59236 > 45.113.130.70.1935: Flags [.], seq 28932:30246, ack 0, win 501, options [nop,nop,TS val 2944733248 ecr 3560418745], length 1314
17:40:43.545913 IP 45.113.130.70.1935 > 10.8.3.3.59236: Flags [.], ack 15792, win 136, options [nop,nop,TS val 3560418802 ecr 2944732748], length 0
17:40:43.545925 IP 10.8.3.3.59236 > 45.113.130.70.1935: Flags [P.], seq 30246:30686, ack 0, win 501, options [nop,nop,TS val 2944733264 ecr 3560418802], length 440
17:40:43.598668 IP 10.8.3.3.59236 > 45.113.130.70.1935: Flags [.], seq 30686:32000, ack 0, win 501, options [nop,nop,TS val 2944733317 ecr 3560418802], length 1314
17:40:43.622723 IP 45.113.130.70.1935 > 10.8.3.3.59236: Flags [.], ack 18420, win 136, options [nop,nop,TS val 3560418879 ecr 2944732815], length 0
17:40:43.633555 IP 10.8.3.3.59236 > 45.113.130.70.1935: Flags [.], seq 32000:33314, ack 0, win 501, options [nop,nop,TS val 2944733352 ecr 3560418879], length 1314
17:40:43.665235 IP 10.8.3.3.59236 > 45.113.130.70.1935: Flags [.], seq 33314:34628, ack 0, win 501, options [nop,nop,TS val 2944733384 ecr 3560418879], length 1314
17:40:43.726604 IP 45.113.130.70.1935 > 10.8.3.3.59236: Flags [.], ack 21048, win 135, options [nop,nop,TS val 3560418983 ecr 2944732891], length 0
17:40:43.732152 IP 10.8.3.3.59236 > 45.113.130.70.1935: Flags [.], seq 34628:35942, ack 0, win 501, options [nop,nop,TS val 2944733451 ecr 3560418983], length 1314
17:40:43.762640 IP 10.8.3.3.59236 > 45.113.130.70.1935: Flags [.], seq 35942:37256, ack 0, win 501, options [nop,nop,TS val 2944733481 ecr 3560418983], length 1314
17:40:43.794473 IP 45.113.130.70.1935 > 10.8.3.3.59236: Flags [.], ack 23676, win 135, options [nop,nop,TS val 3560419051 ecr 2944732984], length 0
17:40:43.796206 IP 10.8.3.3.59236 > 45.113.130.70.1935: Flags [.], seq 37256:38570, ack 0, win 501, options [nop,nop,TS val 2944733515 ecr 3560419051], length 1314
17:40:43.867247 IP 10.8.3.3.59236 > 45.113.130.70.1935: Flags [.], seq 38570:39884, ack 0, win 501, options [nop,nop,TS val 2944733586 ecr 3560419051], length 1314
17:40:43.891774 IP 45.113.130.70.1935 > 10.8.3.3.59236: Flags [.], ack 26304, win 135, options [nop,nop,TS val 3560419148 ecr 2944733083], length 0
17:40:43.899266 IP 10.8.3.3.59236 > 45.113.130.70.1935: Flags [.], seq 39884:41198, ack 0, win 501, options [nop,nop,TS val 2944733618 ecr 3560419148], length 1314
17:40:43.933593 IP 10.8.3.3.59236 > 45.113.130.70.1935: Flags [.], seq 41198:42512, ack 0, win 501, options [nop,nop,TS val 2944733652 ecr 3560419148], length 1314
17:40:43.989467 IP 45.113.130.70.1935 > 10.8.3.3.59236: Flags [.], ack 28932, win 135, options [nop,nop,TS val 3560419246 ecr 2944733150], length 0
17:40:43.997740 IP 10.8.3.3.59236 > 45.113.130.70.1935: Flags [.], seq 42512:43826, ack 0, win 501, options [nop,nop,TS val 2944733716 ecr 3560419246], length 1314
17:40:44.029407 IP 10.8.3.3.59236 > 45.113.130.70.1935: Flags [.], seq 43826:45140, ack 0, win 501, options [nop,nop,TS val 2944733748 ecr 3560419246], length 1314
17:40:44.038655 IP 45.113.130.70.1935 > 10.8.3.3.59236: Flags [.], ack 30686, win 136, options [nop,nop,TS val 3560419295 ecr 2944733248], length 0
17:40:44.038669 IP 10.8.3.3.59236 > 45.113.130.70.1935: Flags [P.], seq 45140:45570, ack 0, win 501, options [nop,nop,TS val 2944733757 ecr 3560419295], length 430
17:40:44.098149 IP 10.8.3.3.59236 > 45.113.130.70.1935: Flags [.], seq 45570:46884, ack 0, win 501, options [nop,nop,TS val 2944733817 ecr 3560419295], length 1314
17:40:44.126722 IP 45.113.130.70.1935 > 10.8.3.3.59236: Flags [.], ack 33314, win 136, options [nop,nop,TS val 3560419383 ecr 2944733317], length 0
17:40:44.132454 IP 10.8.3.3.59236 > 45.113.130.70.1935: Flags [.], seq 46884:48198, ack 0, win 501, options [nop,nop,TS val 2944733851 ecr 3560419383], length 1314
17:40:44.162598 IP 10.8.3.3.59236 > 45.113.130.70.1935: Flags [.], seq 48198:49512, ack 0, win 501, options [nop,nop,TS val 2944733881 ecr 3560419383], length 1314
17:40:44.225085 IP 45.113.130.70.1935 > 10.8.3.3.59236: Flags [.], ack 35942, win 135, options [nop,nop,TS val 3560419481 ecr 2944733384], length 0
17:40:44.230590 IP 10.8.3.3.59236 > 45.113.130.70.1935: Flags [.], seq 49512:50826, ack 0, win 501, options [nop,nop,TS val 2944733949 ecr 3560419481], length 1314
17:40:44.266346 IP 10.8.3.3.59236 > 45.113.130.70.1935: Flags [.], seq 50826:52140, ack 0, win 501, options [nop,nop,TS val 2944733985 ecr 3560419481], length 1314
17:40:44.289097 IP 45.113.130.70.1935 > 10.8.3.3.59236: Flags [.], ack 38570, win 135, options [nop,nop,TS val 3560419545 ecr 2944733481], length 0
17:40:44.296091 IP 10.8.3.3.59236 > 45.113.130.70.1935: Flags [.], seq 52140:53454, ack 0, win 501, options [nop,nop,TS val 2944734014 ecr 3560419545], length 1314
17:40:44.366758 IP 10.8.3.3.59236 > 45.113.130.70.1935: Flags [.], seq 53454:54768, ack 0, win 501, options [nop,nop,TS val 2944734085 ecr 3560419545], length 1314
17:40:44.392401 IP 45.113.130.70.1935 > 10.8.3.3.59236: Flags [.], ack 41198, win 135, options [nop,nop,TS val 3560419648 ecr 2944733586], length 0
17:40:44.400312 IP 10.8.3.3.59236 > 45.113.130.70.1935: Flags [.], seq 54768:56082, ack 0, win 501, options [nop,nop,TS val 2944734119 ecr 3560419648], length 1314
17:40:44.432509 IP 10.8.3.3.59236 > 45.113.130.70.1935: Flags [.], seq 56082:57396, ack 0, win 501, options [nop,nop,TS val 2944734151 ecr 3560419648], length 1314
17:40:44.490896 IP 45.113.130.70.1935 > 10.8.3.3.59236: Flags [.], ack 43826, win 135, options [nop,nop,TS val 3560419747 ecr 2944733652], length 0
17:40:44.496753 IP 10.8.3.3.59236 > 45.113.130.70.1935: Flags [.], seq 57396:58710, ack 0, win 501, options [nop,nop,TS val 2944734215 ecr 3560419747], length 1314
17:40:44.531918 IP 45.113.130.70.1935 > 10.8.3.3.59236: Flags [.], ack 45570, win 136, options [nop,nop,TS val 3560419788 ecr 2944733748], length 0
17:40:44.531951 IP 10.8.3.3.59236 > 45.113.130.70.1935: Flags [P.], seq 58710:59625, ack 0, win 501, options [nop,nop,TS val 2944734250 ecr 3560419788], length 915
17:40:44.564273 IP 10.8.3.3.59236 > 45.113.130.70.1935: Flags [.], seq 59625:60939, ack 0, win 501, options [nop,nop,TS val 2944734283 ecr 3560419788], length 1314
17:40:44.597218 IP 10.8.3.3.59236 > 45.113.130.70.1935: Flags [.], seq 60939:62253, ack 0, win 501, options [nop,nop,TS val 2944734316 ecr 3560419788], length 1314
17:40:44.625500 IP 45.113.130.70.1935 > 10.8.3.3.59236: Flags [.], ack 48198, win 136, options [nop,nop,TS val 3560419882 ecr 2944733817], length 0
17:40:44.646130 IP 10.8.3.3.59236 > 45.113.130.70.1935: Flags [.], seq 62253:63567, ack 0, win 501, options [nop,nop,TS val 2944734365 ecr 3560419882], length 1314
17:40:44.700306 IP 10.8.3.3.59236 > 45.113.130.70.1935: Flags [.], seq 63567:64881, ack 0, win 501, options [nop,nop,TS val 2944734419 ecr 3560419882], length 1314
17:40:44.716557 IP 45.113.130.70.1935 > 10.8.3.3.59236: Flags [.], ack 49512, win 136, options [nop,nop,TS val 3560419972 ecr 2944733881], length 0
17:40:44.732061 IP 10.8.3.3.59236 > 45.113.130.70.1935: Flags [.], seq 64881:66195, ack 0, win 501, options [nop,nop,TS val 2944734450 ecr 3560419972], length 1314
17:40:44.759848 IP 45.113.130.70.1935 > 10.8.3.3.59236: Flags [.], ack 52140, win 136, options [nop,nop,TS val 3560420016 ecr 2944733949], length 0
17:40:44.774719 IP 10.8.3.3.59236 > 45.113.130.70.1935: Flags [.], seq 66195:67509, ack 0, win 501, options [nop,nop,TS val 2944734493 ecr 3560420016], length 1314
17:40:44.829332 IP 10.8.3.3.59236 > 45.113.130.70.1935: Flags [.], seq 67509:68823, ack 0, win 501, options [nop,nop,TS val 2944734548 ecr 3560420016], length 1314
17:40:44.862802 IP 10.8.3.3.59236 > 45.113.130.70.1935: Flags [.], seq 68823:70137, ack 0, win 501, options [nop,nop,TS val 2944734581 ecr 3560420016], length 1314
17:40:44.864397 IP 45.113.130.70.1935 > 10.8.3.3.59236: Flags [.], ack 54768, win 135, options [nop,nop,TS val 3560420116 ecr 2944734014], length 0
17:40:44.902413 IP 10.8.3.3.59236 > 45.113.130.70.1935: Flags [.], seq 70137:71451, ack 0, win 501, options [nop,nop,TS val 2944734621 ecr 3560420116], length 1314
17:40:44.938333 IP 45.113.130.70.1935 > 10.8.3.3.59236: Flags [.], ack 57396, win 135, options [nop,nop,TS val 3560420182 ecr 2944734119], length 0
17:40:44.966781 IP 10.8.3.3.59236 > 45.113.130.70.1935: Flags [.], seq 71451:72765, ack 0, win 501, options [nop,nop,TS val 2944734685 ecr 3560420182], length 1314
17:40:45.000536 IP 10.8.3.3.59236 > 45.113.130.70.1935: Flags [.], seq 72765:74079, ack 0, win 501, options [nop,nop,TS val 2944734719 ecr 3560420182], length 1314
17:40:45.025068 IP 45.113.130.70.1935 > 10.8.3.3.59236: Flags [.], ack 59625, win 135, options [nop,nop,TS val 3560420281 ecr 2944734215], length 0
17:40:45.025105 IP 10.8.3.3.59236 > 45.113.130.70.1935: Flags [P.], seq 74079:74511, ack 0, win 501, options [nop,nop,TS val 2944734744 ecr 3560420281], length 432
17:40:45.066145 IP 10.8.3.3.59236 > 45.113.130.70.1935: Flags [.], seq 74511:75825, ack 0, win 501, options [nop,nop,TS val 2944734785 ecr 3560420281], length 1314
17:40:45.090255 IP 45.113.130.70.1935 > 10.8.3.3.59236: Flags [.], ack 62253, win 135, options [nop,nop,TS val 3560420347 ecr 2944734283], length 0
17:40:45.096017 IP 10.8.3.3.59236 > 45.113.130.70.1935: Flags [.], seq 75825:77139, ack 0, win 501, options [nop,nop,TS val 2944734814 ecr 3560420347], length 1314
17:40:45.138105 IP 10.8.3.3.59236 > 45.113.130.70.1935: Flags [.], seq 77139:78453, ack 0, win 501, options [nop,nop,TS val 2944734856 ecr 3560420347], length 1314
17:40:45.193506 IP 45.113.130.70.1935 > 10.8.3.3.59236: Flags [.], ack 64881, win 135, options [nop,nop,TS val 3560420450 ecr 2944734365], length 0
17:40:45.200522 IP 10.8.3.3.59236 > 45.113.130.70.1935: Flags [.], seq 78453:79767, ack 0, win 501, options [nop,nop,TS val 2944734919 ecr 3560420450], length 1314
17:40:45.231762 IP 10.8.3.3.59236 > 45.113.130.70.1935: Flags [.], seq 79767:81081, ack 0, win 501, options [nop,nop,TS val 2944734950 ecr 3560420450], length 1314
17:40:45.266466 IP 10.8.3.3.59236 > 45.113.130.70.1935: Flags [.], seq 81081:82395, ack 0, win 501, options [nop,nop,TS val 2944734985 ecr 3560420450], length 1314
17:40:45.267648 IP 45.113.130.70.1935 > 10.8.3.3.59236: Flags [.], ack 67509, win 135, options [nop,nop,TS val 3560420524 ecr 2944734450], length 0
17:40:45.333667 IP 10.8.3.3.59236 > 45.113.130.70.1935: Flags [.], seq 82395:83709, ack 0, win 501, options [nop,nop,TS val 2944735052 ecr 3560420524], length 1314
17:40:45.355901 IP 45.113.130.70.1935 > 10.8.3.3.59236: Flags [.], ack 70137, win 135, options [nop,nop,TS val 3560420612 ecr 2944734548], length 0
17:40:45.366862 IP 10.8.3.3.59236 > 45.113.130.70.1935: Flags [.], seq 83709:85023, ack 0, win 501, options [nop,nop,TS val 2944735085 ecr 3560420612], length 1314
17:40:45.400353 IP 10.8.3.3.59236 > 45.113.130.70.1935: Flags [.], seq 85023:86337, ack 0, win 501, options [nop,nop,TS val 2944735119 ecr 3560420612], length 1314
17:40:45.459897 IP 45.113.130.70.1935 > 10.8.3.3.59236: Flags [.], ack 72765, win 135, options [nop,nop,TS val 3560420716 ecr 2944734621], length 0
17:40:45.467366 IP 10.8.3.3.59236 > 45.113.130.70.1935: Flags [.], seq 86337:87651, ack 0, win 501, options [nop,nop,TS val 2944735186 ecr 3560420716], length 1314
17:40:45.498740 IP 10.8.3.3.59236 > 45.113.130.70.1935: Flags [.], seq 87651:88965, ack 0, win 501, options [nop,nop,TS val 2944735217 ecr 3560420716], length 1314
17:40:45.518061 IP 45.113.130.70.1935 > 10.8.3.3.59236: Flags [.], ack 74511, win 136, options [nop,nop,TS val 3560420774 ecr 2944734719], length 0
17:40:45.518086 IP 10.8.3.3.59236 > 45.113.130.70.1935: Flags [P.], seq 88965:89402, ack 0, win 501, options [nop,nop,TS val 2944735236 ecr 3560420774], length 437
17:40:45.566513 IP 10.8.3.3.59236 > 45.113.130.70.1935: Flags [.], seq 89402:90716, ack 0, win 501, options [nop,nop,TS val 2944735285 ecr 3560420774], length 1314
17:40:45.588963 IP 45.113.130.70.1935 > 10.8.3.3.59236: Flags [.], ack 77139, win 136, options [nop,nop,TS val 3560420845 ecr 2944734785], length 0
17:40:45.600496 IP 10.8.3.3.59236 > 45.113.130.70.1935: Flags [.], seq 90716:92030, ack 0, win 501, options [nop,nop,TS val 2944735319 ecr 3560420845], length 1314
17:40:45.633605 IP 10.8.3.3.59236 > 45.113.130.70.1935: Flags [.], seq 92030:93344, ack 0, win 501, options [nop,nop,TS val 2944735352 ecr 3560420845], length 1314
17:40:45.693534 IP 45.113.130.70.1935 > 10.8.3.3.59236: Flags [.], ack 79767, win 135, options [nop,nop,TS val 3560420950 ecr 2944734856], length 0
17:40:45.700217 IP 10.8.3.3.59236 > 45.113.130.70.1935: Flags [.], seq 93344:94658, ack 0, win 501, options [nop,nop,TS val 2944735419 ecr 3560420950], length 1314
17:40:45.733760 IP 10.8.3.3.59236 > 45.113.130.70.1935: Flags [.], seq 94658:95972, ack 0, win 501, options [nop,nop,TS val 2944735452 ecr 3560420950], length 1314
17:40:45.759752 IP 45.113.130.70.1935 > 10.8.3.3.59236: Flags [.], ack 82395, win 135, options [nop,nop,TS val 3560421016 ecr 2944734950], length 0
17:40:45.767105 IP 10.8.3.3.59236 > 45.113.130.70.1935: Flags [.], seq 95972:97286, ack 0, win 501, options [nop,nop,TS val 2944735485 ecr 3560421016], length 1314
17:40:45.833630 IP 10.8.3.3.59236 > 45.113.130.70.1935: Flags [.], seq 97286:98600, ack 0, win 501, options [nop,nop,TS val 2944735552 ecr 3560421016], length 1314
17:40:45.859963 IP 45.113.130.70.1935 > 10.8.3.3.59236: Flags [.], ack 85023, win 135, options [nop,nop,TS val 3560421116 ecr 2944735052], length 0
17:40:45.867515 IP 10.8.3.3.59236 > 45.113.130.70.1935: Flags [.], seq 98600:99914, ack 0, win 501, options [nop,nop,TS val 2944735586 ecr 3560421116], length 1314
17:40:45.900019 IP 10.8.3.3.59236 > 45.113.130.70.1935: Flags [.], seq 99914:101228, ack 0, win 501, options [nop,nop,TS val 2944735618 ecr 3560421116], length 1314
17:40:45.963341 IP 45.113.130.70.1935 > 10.8.3.3.59236: Flags [.], ack 87651, win 135, options [nop,nop,TS val 3560421217 ecr 2944735119], length 0
17:40:45.966535 IP 10.8.3.3.59236 > 45.113.130.70.1935: Flags [.], seq 101228:102542, ack 0, win 501, options [nop,nop,TS val 2944735685 ecr 3560421217], length 1314
17:40:46.000418 IP 10.8.3.3.59236 > 45.113.130.70.1935: Flags [.], seq 102542:103856, ack 0, win 501, options [nop,nop,TS val 2944735719 ecr 3560421217], length 1314
17:40:46.011080 IP 45.113.130.70.1935 > 10.8.3.3.59236: Flags [.], ack 89402, win 136, options [nop,nop,TS val 3560421267 ecr 2944735217], length 0
17:40:46.011123 IP 10.8.3.3.59236 > 45.113.130.70.1935: Flags [P.], seq 103856:104298, ack 0, win 501, options [nop,nop,TS val 2944735730 ecr 3560421267], length 442
17:40:46.067045 IP 10.8.3.3.59236 > 45.113.130.70.1935: Flags [.], seq 104298:105612, ack 0, win 501, options [nop,nop,TS val 2944735785 ecr 3560421267], length 1314
17:40:46.093496 IP 45.113.130.70.1935 > 10.8.3.3.59236: Flags [.], ack 92030, win 136, options [nop,nop,TS val 3560421350 ecr 2944735285], length 0
17:40:46.100197 IP 10.8.3.3.59236 > 45.113.130.70.1935: Flags [.], seq 105612:106926, ack 0, win 501, options [nop,nop,TS val 2944735819 ecr 3560421350], length 1314
17:40:46.133730 IP 10.8.3.3.59236 > 45.113.130.70.1935: Flags [.], seq 106926:108240, ack 0, win 501, options [nop,nop,TS val 2944735852 ecr 3560421350], length 1314
17:40:46.193325 IP 45.113.130.70.1935 > 10.8.3.3.59236: Flags [.], ack 94658, win 135, options [nop,nop,TS val 3560421449 ecr 2944735352], length 0
17:40:46.200219 IP 10.8.3.3.59236 > 45.113.130.70.1935: Flags [.], seq 108240:109554, ack 0, win 501, options [nop,nop,TS val 2944735919 ecr 3560421449], length 1314
17:40:46.232748 IP 10.8.3.3.59236 > 45.113.130.70.1935: Flags [.], seq 109554:110868, ack 0, win 501, options [nop,nop,TS val 2944735951 ecr 3560421449], length 1314
17:40:46.254224 IP 10.8.3.3.59236 > 45.113.130.70.1935: Flags [.], seq 110868:112182, ack 0, win 501, options [nop,nop,TS val 2944735973 ecr 3560421449], length 1314
17:40:46.259999 IP 45.113.130.70.1935 > 10.8.3.3.59236: Flags [.], ack 97286, win 135, options [nop,nop,TS val 3560421516 ecr 2944735452], length 0
17:40:46.318627 IP 10.8.3.3.59236 > 45.113.130.70.1935: Flags [.], seq 112182:113496, ack 0, win 501, options [nop,nop,TS val 2944736037 ecr 3560421516], length 1314
17:40:46.360452 IP 45.113.130.70.1935 > 10.8.3.3.59236: Flags [.], ack 99914, win 135, options [nop,nop,TS val 3560421617 ecr 2944735552], length 0
17:40:46.361370 IP 10.8.3.3.59236 > 45.113.130.70.1935: Flags [.], seq 113496:114810, ack 0, win 501, options [nop,nop,TS val 2944736080 ecr 3560421617], length 1314
17:40:46.398860 IP 10.8.3.3.59236 > 45.113.130.70.1935: Flags [.], seq 114810:116124, ack 0, win 501, options [nop,nop,TS val 2944736117 ecr 3560421617], length 1314
17:40:46.459453 IP 45.113.130.70.1935 > 10.8.3.3.59236: Flags [.], ack 102542, win 135, options [nop,nop,TS val 3560421716 ecr 2944735618], length 0
17:40:46.463025 IP 10.8.3.3.59236 > 45.113.130.70.1935: Flags [.], seq 116124:117438, ack 0, win 501, options [nop,nop,TS val 2944736181 ecr 3560421716], length 1314
17:40:46.489141 IP 10.8.3.3.59236 > 45.113.130.70.1935: Flags [.], seq 117438:118752, ack 0, win 501, options [nop,nop,TS val 2944736208 ecr 3560421716], length 1314
17:40:46.504251 IP 45.113.130.70.1935 > 10.8.3.3.59236: Flags [.], ack 104298, win 136, options [nop,nop,TS val 3560421760 ecr 2944735719], length 0
17:40:46.504286 IP 10.8.3.3.59236 > 45.113.130.70.1935: Flags [P.], seq 118752:119280, ack 0, win 501, options [nop,nop,TS val 2944736223 ecr 3560421760], length 528
17:40:46.553631 IP 10.8.3.3.59236 > 45.113.130.70.1935: Flags [.], seq 119280:120594, ack 0, win 501, options [nop,nop,TS val 2944736272 ecr 3560421760], length 1314
17:40:46.593515 IP 45.113.130.70.1935 > 10.8.3.3.59236: Flags [.], ack 106926, win 136, options [nop,nop,TS val 3560421850 ecr 2944735785], length 0
17:40:46.596406 IP 10.8.3.3.59236 > 45.113.130.70.1935: Flags [.], seq 120594:121908, ack 0, win 501, options [nop,nop,TS val 2944736315 ecr 3560421850], length 1314
17:40:46.630559 IP 10.8.3.3.59236 > 45.113.130.70.1935: Flags [.], seq 121908:123222, ack 0, win 501, options [nop,nop,TS val 2944736349 ecr 3560421850], length 1314
17:40:46.692264 IP 45.113.130.70.1935 > 10.8.3.3.59236: Flags [.], ack 108240, win 136, options [nop,nop,TS val 3560421948 ecr 2944735852], length 0
17:40:46.696205 IP 10.8.3.3.59236 > 45.113.130.70.1935: Flags [.], seq 123222:124536, ack 0, win 501, options [nop,nop,TS val 2944736415 ecr 3560421948], length 1314
17:40:46.723879 IP 10.8.3.3.59236 > 45.113.130.70.1935: Flags [.], seq 124536:125850, ack 0, win 501, options [nop,nop,TS val 2944736442 ecr 3560421948], length 1314
17:40:46.726064 IP 45.113.130.70.1935 > 10.8.3.3.59236: Flags [.], ack 110868, win 136, options [nop,nop,TS val 3560421982 ecr 2944735919], length 0
17:40:46.766631 IP 10.8.3.3.59236 > 45.113.130.70.1935: Flags [.], seq 125850:127164, ack 0, win 501, options [nop,nop,TS val 2944736485 ecr 3560421982], length 1314
17:40:46.811850 IP 45.113.130.70.1935 > 10.8.3.3.59236: Flags [.], ack 113496, win 135, options [nop,nop,TS val 3560422068 ecr 2944735973], length 0
17:40:46.831467 IP 10.8.3.3.59236 > 45.113.130.70.1935: Flags [.], seq 127164:128478, ack 0, win 501, options [nop,nop,TS val 2944736550 ecr 3560422068], length 1314
17:40:46.852943 IP 10.8.3.3.59236 > 45.113.130.70.1935: Flags [.], seq 128478:129792, ack 0, win 501, options [nop,nop,TS val 2944736571 ecr 3560422068], length 1314
17:40:46.892301 IP 45.113.130.70.1935 > 10.8.3.3.59236: Flags [.], ack 116124, win 135, options [nop,nop,TS val 3560422148 ecr 2944736080], length 0
17:40:46.895589 IP 10.8.3.3.59236 > 45.113.130.70.1935: Flags [.], seq 129792:131106, ack 0, win 501, options [nop,nop,TS val 2944736614 ecr 3560422148], length 1314
17:40:46.959723 IP 10.8.3.3.59236 > 45.113.130.70.1935: Flags [.], seq 131106:132420, ack 0, win 501, options [nop,nop,TS val 2944736678 ecr 3560422148], length 1314
17:40:46.982235 IP 45.113.130.70.1935 > 10.8.3.3.59236: Flags [.], ack 118752, win 135, options [nop,nop,TS val 3560422238 ecr 2944736181], length 0
17:40:46.999334 IP 10.8.3.3.59236 > 45.113.130.70.1935: Flags [.], seq 132420:133734, ack 0, win 501, options [nop,nop,TS val 2944736718 ecr 3560422238], length 1314
17:40:47.001623 IP 45.113.130.70.1935 > 10.8.3.3.59236: Flags [.], ack 119280, win 136, options [nop,nop,TS val 3560422253 ecr 2944736223], length 0
17:40:47.001648 IP 10.8.3.3.59236 > 45.113.130.70.1935: Flags [P.], seq 133734:134174, ack 0, win 501, options [nop,nop,TS val 2944736720 ecr 3560422253], length 440
17:40:47.063483 IP 10.8.3.3.59236 > 45.113.130.70.1935: Flags [.], seq 134174:135488, ack 0, win 501, options [nop,nop,TS val 2944736782 ecr 3560422253], length 1314
17:40:47.087627 IP 10.8.3.3.59236 > 45.113.130.70.1935: Flags [.], seq 135488:136802, ack 0, win 501, options [nop,nop,TS val 2944736806 ecr 3560422253], length 1314
17:40:47.089726 IP 45.113.130.70.1935 > 10.8.3.3.59236: Flags [.], ack 121908, win 136, options [nop,nop,TS val 3560422346 ecr 2944736272], length 0
17:40:47.130020 IP 10.8.3.3.59236 > 45.113.130.70.1935: Flags [.], seq 136802:138116, ack 0, win 501, options [nop,nop,TS val 2944736848 ecr 3560422346], length 1314
17:40:47.189136 IP 45.113.130.70.1935 > 10.8.3.3.59236: Flags [.], ack 124536, win 135, options [nop,nop,TS val 3560422445 ecr 2944736349], length 0
17:40:47.194413 IP 10.8.3.3.59236 > 45.113.130.70.1935: Flags [.], seq 138116:139430, ack 0, win 501, options [nop,nop,TS val 2944736913 ecr 3560422445], length 1314
17:40:47.229460 IP 10.8.3.3.59236 > 45.113.130.70.1935: Flags [.], seq 139430:140744, ack 0, win 501, options [nop,nop,TS val 2944736948 ecr 3560422445], length 1314
17:40:47.258015 IP 10.8.3.3.59236 > 45.113.130.70.1935: Flags [.], seq 140744:142058, ack 0, win 501, options [nop,nop,TS val 2944736976 ecr 3560422445], length 1314
17:40:47.259652 IP 45.113.130.70.1935 > 10.8.3.3.59236: Flags [.], ack 127164, win 135, options [nop,nop,TS val 3560422516 ecr 2944736442], length 0
17:40:47.322345 IP 10.8.3.3.59236 > 45.113.130.70.1935: Flags [.], seq 142058:143372, ack 0, win 501, options [nop,nop,TS val 2944737041 ecr 3560422516], length 1314
17:40:47.345912 IP 45.113.130.70.1935 > 10.8.3.3.59236: Flags [.], ack 129792, win 135, options [nop,nop,TS val 3560422602 ecr 2944736550], length 0
17:40:47.362638 IP 10.8.3.3.59236 > 45.113.130.70.1935: Flags [.], seq 143372:144686, ack 0, win 501, options [nop,nop,TS val 2944737081 ecr 3560422602], length 1314
17:40:47.385855 IP 10.8.3.3.59236 > 45.113.130.70.1935: Flags [.], seq 144686:146000, ack 0, win 501, options [nop,nop,TS val 2944737104 ecr 3560422602], length 1314
17:40:47.453086 IP 45.113.130.70.1935 > 10.8.3.3.59236: Flags [.], ack 132420, win 135, options [nop,nop,TS val 3560422709 ecr 2944736614], length 0
17:40:47.467330 IP 10.8.3.3.59236 > 45.113.130.70.1935: Flags [.], seq 146000:147314, ack 0, win 501, options [nop,nop,TS val 2944737186 ecr 3560422709], length 1314
17:40:47.492995 IP 10.8.3.3.59236 > 45.113.130.70.1935: Flags [.], seq 147314:148628, ack 0, win 501, options [nop,nop,TS val 2944737211 ecr 3560422709], length 1314
17:40:47.494201 IP 45.113.130.70.1935 > 10.8.3.3.59236: Flags [.], ack 134174, win 136, options [nop,nop,TS val 3560422751 ecr 2944736718], length 0
17:40:47.494223 IP 10.8.3.3.59236 > 45.113.130.70.1935: Flags [P.], seq 148628:149065, ack 0, win 501, options [nop,nop,TS val 2944737213 ecr 3560422751], length 437
17:40:47.557096 IP 10.8.3.3.59236 > 45.113.130.70.1935: Flags [.], seq 149065:150379, ack 0, win 501, options [nop,nop,TS val 2944737275 ecr 3560422751], length 1314
17:40:47.580659 IP 45.113.130.70.1935 > 10.8.3.3.59236: Flags [.], ack 136802, win 136, options [nop,nop,TS val 3560422837 ecr 2944736782], length 0
17:40:47.598911 IP 10.8.3.3.59236 > 45.113.130.70.1935: Flags [.], seq 150379:151693, ack 0, win 501, options [nop,nop,TS val 2944737317 ecr 3560422837], length 1314
17:40:47.621022 IP 10.8.3.3.59236 > 45.113.130.70.1935: Flags [.], seq 151693:153007, ack 0, win 501, options [nop,nop,TS val 2944737339 ecr 3560422837], length 1314
17:40:47.684897 IP 10.8.3.3.59236 > 45.113.130.70.1935: Flags [.], seq 153007:154321, ack 0, win 501, options [nop,nop,TS val 2944737403 ecr 3560422837], length 1314
17:40:47.687619 IP 45.113.130.70.1935 > 10.8.3.3.59236: Flags [.], ack 139430, win 135, options [nop,nop,TS val 3560422944 ecr 2944736848], length 0
17:40:47.727989 IP 10.8.3.3.59236 > 45.113.130.70.1935: Flags [.], seq 154321:155635, ack 0, win 501, options [nop,nop,TS val 2944737446 ecr 3560422944], length 1314
17:40:47.751048 IP 45.113.130.70.1935 > 10.8.3.3.59236: Flags [.], ack 142058, win 135, options [nop,nop,TS val 3560423007 ecr 2944736948], length 0
17:40:47.766939 IP 10.8.3.3.59236 > 45.113.130.70.1935: Flags [.], seq 155635:156949, ack 0, win 501, options [nop,nop,TS val 2944737485 ecr 3560423007], length 1314
17:40:47.833525 IP 10.8.3.3.59236 > 45.113.130.70.1935: Flags [.], seq 156949:158263, ack 0, win 501, options [nop,nop,TS val 2944737552 ecr 3560423007], length 1314
17:40:47.855938 IP 45.113.130.70.1935 > 10.8.3.3.59236: Flags [.], ack 144686, win 135, options [nop,nop,TS val 3560423112 ecr 2944737041], length 0
17:40:47.857022 IP 10.8.3.3.59236 > 45.113.130.70.1935: Flags [.], seq 158263:159577, ack 0, win 501, options [nop,nop,TS val 2944737575 ecr 3560423112], length 1314
17:40:47.898568 IP 10.8.3.3.59236 > 45.113.130.70.1935: Flags [.], seq 159577:160891, ack 0, win 501, options [nop,nop,TS val 2944737617 ecr 3560423112], length 1314
17:40:47.948357 IP 45.113.130.70.1935 > 10.8.3.3.59236: Flags [.], ack 146000, win 136, options [nop,nop,TS val 3560423204 ecr 2944737104], length 0
17:40:47.964461 IP 10.8.3.3.59236 > 45.113.130.70.1935: Flags [.], seq 160891:162205, ack 0, win 501, options [nop,nop,TS val 2944737683 ecr 3560423204], length 1314
17:40:47.986506 IP 45.113.130.70.1935 > 10.8.3.3.59236: Flags [.], ack 148628, win 136, options [nop,nop,TS val 3560423242 ecr 2944737186], length 0
17:40:47.987263 IP 45.113.130.70.1935 > 10.8.3.3.59236: Flags [.], ack 149065, win 136, options [nop,nop,TS val 3560423243 ecr 2944737213], length 0
17:40:47.987293 IP 10.8.3.3.59236 > 45.113.130.70.1935: Flags [P.], seq 162205:163201, ack 0, win 501, options [nop,nop,TS val 2944737706 ecr 3560423243], length 996
17:40:48.028825 IP 10.8.3.3.59236 > 45.113.130.70.1935: Flags [.], seq 163201:164515, ack 0, win 501, options [nop,nop,TS val 2944737747 ecr 3560423243], length 1314
17:40:48.065238 IP 10.8.3.3.59236 > 45.113.130.70.1935: Flags [.], seq 164515:165829, ack 0, win 501, options [nop,nop,TS val 2944737784 ecr 3560423243], length 1314
17:40:48.092104 IP 45.113.130.70.1935 > 10.8.3.3.59236: Flags [.], ack 151693, win 136, options [nop,nop,TS val 3560423348 ecr 2944737275], length 0
17:40:48.114395 IP 10.8.3.3.59236 > 45.113.130.70.1935: Flags [.], seq 165829:167143, ack 0, win 501, options [nop,nop,TS val 2944737833 ecr 3560423348], length 1314
17:40:48.157257 IP 10.8.3.3.59236 > 45.113.130.70.1935: Flags [.], seq 167143:168457, ack 0, win 501, options [nop,nop,TS val 2944737876 ecr 3560423348], length 1314
17:40:48.178034 IP 45.113.130.70.1935 > 10.8.3.3.59236: Flags [.], ack 154321, win 135, options [nop,nop,TS val 3560423434 ecr 2944737339], length 0
17:40:48.198654 IP 10.8.3.3.59236 > 45.113.130.70.1935: Flags [.], seq 168457:169771, ack 0, win 501, options [nop,nop,TS val 2944737917 ecr 3560423434], length 1314
17:40:48.242841 IP 10.8.3.3.59236 > 45.113.130.70.1935: Flags [.], seq 169771:171085, ack 0, win 501, options [nop,nop,TS val 2944737961 ecr 3560423434], length 1314
17:40:48.260355 IP 45.113.130.70.1935 > 10.8.3.3.59236: Flags [.], ack 156949, win 135, options [nop,nop,TS val 3560423516 ecr 2944737446], length 0
17:40:48.296078 IP 10.8.3.3.59236 > 45.113.130.70.1935: Flags [.], seq 171085:172399, ack 0, win 501, options [nop,nop,TS val 2944738014 ecr 3560423516], length 1314
17:40:48.327968 IP 10.8.3.3.59236 > 45.113.130.70.1935: Flags [.], seq 172399:173713, ack 0, win 501, options [nop,nop,TS val 2944738046 ecr 3560423516], length 1314
17:40:48.350299 IP 45.113.130.70.1935 > 10.8.3.3.59236: Flags [.], ack 159577, win 135, options [nop,nop,TS val 3560423606 ecr 2944737552], length 0
17:40:48.370786 IP 10.8.3.3.59236 > 45.113.130.70.1935: Flags [.], seq 173713:175027, ack 0, win 501, options [nop,nop,TS val 2944738089 ecr 3560423606], length 1314
17:40:48.433286 IP 10.8.3.3.59236 > 45.113.130.70.1935: Flags [.], seq 175027:176341, ack 0, win 501, options [nop,nop,TS val 2944738152 ecr 3560423606], length 1314
17:40:48.456518 IP 10.8.3.3.59236 > 45.113.130.70.1935: Flags [.], seq 176341:177655, ack 0, win 501, options [nop,nop,TS val 2944738175 ecr 3560423606], length 1314
17:40:48.457641 IP 45.113.130.70.1935 > 10.8.3.3.59236: Flags [.], ack 162205, win 135, options [nop,nop,TS val 3560423714 ecr 2944737617], length 0
17:40:48.480268 IP 45.113.130.70.1935 > 10.8.3.3.59236: Flags [.], ack 163201, win 136, options [nop,nop,TS val 3560423736 ecr 2944737706], length 0
17:40:48.480288 IP 10.8.3.3.59236 > 45.113.130.70.1935: Flags [P.], seq 177655:178104, ack 0, win 501, options [nop,nop,TS val 2944738199 ecr 3560423736], length 449
17:40:48.531375 IP 10.8.3.3.59236 > 45.113.130.70.1935: Flags [.], seq 178104:179418, ack 0, win 501, options [nop,nop,TS val 2944738250 ecr 3560423736], length 1314
17:40:48.558389 IP 45.113.130.70.1935 > 10.8.3.3.59236: Flags [.], ack 165829, win 136, options [nop,nop,TS val 3560423815 ecr 2944737747], length 0
17:40:48.562621 IP 10.8.3.3.59236 > 45.113.130.70.1935: Flags [.], seq 179418:180732, ack 0, win 501, options [nop,nop,TS val 2944738281 ecr 3560423815], length 1314
17:40:48.605301 IP 10.8.3.3.59236 > 45.113.130.70.1935: Flags [.], seq 180732:182046, ack 0, win 501, options [nop,nop,TS val 2944738324 ecr 3560423815], length 1314
17:40:48.650316 IP 45.113.130.70.1935 > 10.8.3.3.59236: Flags [.], ack 168457, win 136, options [nop,nop,TS val 3560423906 ecr 2944737833], length 0
17:40:48.667246 IP 10.8.3.3.59236 > 45.113.130.70.1935: Flags [.], seq 182046:183360, ack 0, win 501, options [nop,nop,TS val 2944738386 ecr 3560423906], length 1314
17:40:48.691173 IP 10.8.3.3.59236 > 45.113.130.70.1935: Flags [.], seq 183360:184674, ack 0, win 501, options [nop,nop,TS val 2944738410 ecr 3560423906], length 1314
17:40:48.733894 IP 10.8.3.3.59236 > 45.113.130.70.1935: Flags [.], seq 184674:185988, ack 0, win 501, options [nop,nop,TS val 2944738452 ecr 3560423906], length 1314
17:40:48.735822 IP 45.113.130.70.1935 > 10.8.3.3.59236: Flags [.], ack 171085, win 136, options [nop,nop,TS val 3560423992 ecr 2944737917], length 0
17:40:48.798203 IP 10.8.3.3.59236 > 45.113.130.70.1935: Flags [.], seq 185988:187302, ack 0, win 501, options [nop,nop,TS val 2944738517 ecr 3560423992], length 1314
17:40:48.821090 IP 45.113.130.70.1935 > 10.8.3.3.59236: Flags [.], ack 173713, win 136, options [nop,nop,TS val 3560424077 ecr 2944738014], length 0
17:40:48.832668 IP 10.8.3.3.59236 > 45.113.130.70.1935: Flags [.], seq 187302:188616, ack 0, win 501, options [nop,nop,TS val 2944738551 ecr 3560424077], length 1314
17:40:48.864735 IP 10.8.3.3.59236 > 45.113.130.70.1935: Flags [.], seq 188616:189930, ack 0, win 501, options [nop,nop,TS val 2944738583 ecr 3560424077], length 1314
17:40:48.926339 IP 10.8.3.3.59236 > 45.113.130.70.1935: Flags [.], seq 189930:191244, ack 0, win 501, options [nop,nop,TS val 2944738645 ecr 3560424077], length 1314
17:40:48.926565 IP 45.113.130.70.1935 > 10.8.3.3.59236: Flags [.], ack 176341, win 135, options [nop,nop,TS val 3560424183 ecr 2944738089], length 0
17:40:48.966949 IP 10.8.3.3.59236 > 45.113.130.70.1935: Flags [.], seq 191244:192558, ack 0, win 501, options [nop,nop,TS val 2944738685 ecr 3560424183], length 1314
17:40:48.973130 IP 45.113.130.70.1935 > 10.8.3.3.59236: Flags [.], ack 178104, win 136, options [nop,nop,TS val 3560424229 ecr 2944738175], length 0
17:40:48.973158 IP 10.8.3.3.59236 > 45.113.130.70.1935: Flags [P.], seq 192558:192986, ack 0, win 501, options [nop,nop,TS val 2944738692 ecr 3560424229], length 428
17:40:49.029907 IP 10.8.3.3.59236 > 45.113.130.70.1935: Flags [.], seq 192986:194300, ack 0, win 501, options [nop,nop,TS val 2944738748 ecr 3560424229], length 1314
17:40:49.055959 IP 45.113.130.70.1935 > 10.8.3.3.59236: Flags [.], ack 180732, win 136, options [nop,nop,TS val 3560424312 ecr 2944738250], length 0
17:40:49.065006 IP 10.8.3.3.59236 > 45.113.130.70.1935: Flags [.], seq 194300:195614, ack 0, win 501, options [nop,nop,TS val 2944738783 ecr 3560424312], length 1314
17:40:49.099832 IP 10.8.3.3.59236 > 45.113.130.70.1935: Flags [.], seq 195614:196928, ack 0, win 501, options [nop,nop,TS val 2944738818 ecr 3560424312], length 1314
17:40:49.160398 IP 45.113.130.70.1935 > 10.8.3.3.59236: Flags [.], ack 183360, win 135, options [nop,nop,TS val 3560424416 ecr 2944738324], length 0
17:40:49.160797 IP 10.8.3.3.59236 > 45.113.130.70.1935: Flags [.], seq 196928:198242, ack 0, win 501, options [nop,nop,TS val 2944738879 ecr 3560424416], length 1314
17:40:49.198735 IP 10.8.3.3.59236 > 45.113.130.70.1935: Flags [.], seq 198242:199556, ack 0, win 501, options [nop,nop,TS val 2944738917 ecr 3560424416], length 1314
17:40:49.226809 IP 45.113.130.70.1935 > 10.8.3.3.59236: Flags [.], ack 185988, win 135, options [nop,nop,TS val 3560424483 ecr 2944738410], length 0
17:40:49.232591 IP 10.8.3.3.59236 > 45.113.130.70.1935: Flags [.], seq 199556:200870, ack 0, win 501, options [nop,nop,TS val 2944738951 ecr 3560424483], length 1314
17:40:49.288857 IP 10.8.3.3.59236 > 45.113.130.70.1935: Flags [.], seq 200870:202184, ack 0, win 501, options [nop,nop,TS val 2944739007 ecr 3560424483], length 1314
17:40:49.325540 IP 45.113.130.70.1935 > 10.8.3.3.59236: Flags [.], ack 188616, win 135, options [nop,nop,TS val 3560424582 ecr 2944738517], length 0
17:40:49.330368 IP 10.8.3.3.59236 > 45.113.130.70.1935: Flags [.], seq 202184:203498, ack 0, win 501, options [nop,nop,TS val 2944739049 ecr 3560424582], length 1314
17:40:49.363006 IP 10.8.3.3.59236 > 45.113.130.70.1935: Flags [.], seq 203498:204812, ack 0, win 501, options [nop,nop,TS val 2944739081 ecr 3560424582], length 1314
17:40:49.419429 IP 45.113.130.70.1935 > 10.8.3.3.59236: Flags [.], ack 191244, win 135, options [nop,nop,TS val 3560424676 ecr 2944738583], length 0
17:40:49.431357 IP 10.8.3.3.59236 > 45.113.130.70.1935: Flags [.], seq 204812:206126, ack 0, win 501, options [nop,nop,TS val 2944739150 ecr 3560424676], length 1314
17:40:49.459128 IP 10.8.3.3.59236 > 45.113.130.70.1935: Flags [.], seq 206126:207440, ack 0, win 501, options [nop,nop,TS val 2944739178 ecr 3560424676], length 1314
17:40:49.465987 IP 45.113.130.70.1935 > 10.8.3.3.59236: Flags [.], ack 192986, win 136, options [nop,nop,TS val 3560424722 ecr 2944738685], length 0
17:40:49.466019 IP 10.8.3.3.59236 > 45.113.130.70.1935: Flags [P.], seq 207440:207881, ack 0, win 501, options [nop,nop,TS val 2944739184 ecr 3560424722], length 441
17:40:49.523181 IP 10.8.3.3.59236 > 45.113.130.70.1935: Flags [.], seq 207881:209195, ack 0, win 501, options [nop,nop,TS val 2944739242 ecr 3560424722], length 1314
17:40:49.558259 IP 45.113.130.70.1935 > 10.8.3.3.59236: Flags [.], ack 195614, win 136, options [nop,nop,TS val 3560424814 ecr 2944738748], length 0
17:40:49.562947 IP 10.8.3.3.59236 > 45.113.130.70.1935: Flags [.], seq 209195:210509, ack 0, win 501, options [nop,nop,TS val 2944739281 ecr 3560424814], length 1314
17:40:49.596811 IP 10.8.3.3.59236 > 45.113.130.70.1935: Flags [.], seq 210509:211823, ack 0, win 501, options [nop,nop,TS val 2944739315 ecr 3560424814], length 1314
17:40:49.653978 IP 45.113.130.70.1935 > 10.8.3.3.59236: Flags [.], ack 198242, win 135, options [nop,nop,TS val 3560424910 ecr 2944738818], length 0
17:40:49.664232 IP 10.8.3.3.59236 > 45.113.130.70.1935: Flags [.], seq 211823:213137, ack 0, win 501, options [nop,nop,TS val 2944739383 ecr 3560424910], length 1314
17:40:49.693249 IP 10.8.3.3.59236 > 45.113.130.70.1935: Flags [.], seq 213137:214451, ack 0, win 501, options [nop,nop,TS val 2944739412 ecr 3560424910], length 1314
17:40:49.725569 IP 45.113.130.70.1935 > 10.8.3.3.59236: Flags [.], ack 200870, win 135, options [nop,nop,TS val 3560424982 ecr 2944738917], length 0
17:40:49.730070 IP 10.8.3.3.59236 > 45.113.130.70.1935: Flags [.], seq 214451:215765, ack 0, win 501, options [nop,nop,TS val 2944739448 ecr 3560424982], length 1314
17:40:49.797272 IP 10.8.3.3.59236 > 45.113.130.70.1935: Flags [.], seq 215765:217079, ack 0, win 501, options [nop,nop,TS val 2944739516 ecr 3560424982], length 1314
17:40:49.820678 IP 10.8.3.3.59236 > 45.113.130.70.1935: Flags [.], seq 217079:218393, ack 0, win 501, options [nop,nop,TS val 2944739539 ecr 3560424982], length 1314
17:40:49.823426 IP 45.113.130.70.1935 > 10.8.3.3.59236: Flags [.], ack 203498, win 135, options [nop,nop,TS val 3560425080 ecr 2944739007], length 0
17:40:49.863527 IP 10.8.3.3.59236 > 45.113.130.70.1935: Flags [.], seq 218393:219707, ack 0, win 501, options [nop,nop,TS val 2944739582 ecr 3560425080], length 1314
17:40:49.924439 IP 45.113.130.70.1935 > 10.8.3.3.59236: Flags [.], ack 206126, win 135, options [nop,nop,TS val 3560425181 ecr 2944739081], length 0
17:40:49.927547 IP 10.8.3.3.59236 > 45.113.130.70.1935: Flags [.], seq 219707:221021, ack 0, win 501, options [nop,nop,TS val 2944739646 ecr 3560425181], length 1314
17:40:49.958963 IP 45.113.130.70.1935 > 10.8.3.3.59236: Flags [.], ack 207881, win 136, options [nop,nop,TS val 3560425215 ecr 2944739178], length 0
17:40:49.958985 IP 10.8.3.3.59236 > 45.113.130.70.1935: Flags [P.], seq 221021:221930, ack 0, win 501, options [nop,nop,TS val 2944739677 ecr 3560425215], length 909
17:40:49.991283 IP 10.8.3.3.59236 > 45.113.130.70.1935: Flags [.], seq 221930:223244, ack 0, win 501, options [nop,nop,TS val 2944739710 ecr 3560425215], length 1314
17:40:50.029450 IP 10.8.3.3.59236 > 45.113.130.70.1935: Flags [.], seq 223244:224558, ack 0, win 501, options [nop,nop,TS val 2944739748 ecr 3560425215], length 1314
17:40:50.056375 IP 45.113.130.70.1935 > 10.8.3.3.59236: Flags [.], ack 210509, win 135, options [nop,nop,TS val 3560425312 ecr 2944739242], length 0
17:40:50.076130 IP 10.8.3.3.59236 > 45.113.130.70.1935: Flags [.], seq 224558:225872, ack 0, win 501, options [nop,nop,TS val 2944739795 ecr 3560425312], length 1314
17:40:50.131571 IP 10.8.3.3.59236 > 45.113.130.70.1935: Flags [.], seq 225872:227186, ack 0, win 501, options [nop,nop,TS val 2944739850 ecr 3560425312], length 1314
17:40:50.157172 IP 45.113.130.70.1935 > 10.8.3.3.59236: Flags [.], ack 213137, win 135, options [nop,nop,TS val 3560425414 ecr 2944739315], length 0
17:40:50.161286 IP 10.8.3.3.59236 > 45.113.130.70.1935: Flags [.], seq 227186:228500, ack 0, win 501, options [nop,nop,TS val 2944739880 ecr 3560425414], length 1314
17:40:50.203621 IP 10.8.3.3.59236 > 45.113.130.70.1935: Flags [.], seq 228500:229814, ack 0, win 501, options [nop,nop,TS val 2944739922 ecr 3560425414], length 1314
17:40:50.223402 IP 45.113.130.70.1935 > 10.8.3.3.59236: Flags [.], ack 215765, win 135, options [nop,nop,TS val 3560425479 ecr 2944739412], length 0
17:40:50.264572 IP 10.8.3.3.59236 > 45.113.130.70.1935: Flags [.], seq 229814:231128, ack 0, win 501, options [nop,nop,TS val 2944739983 ecr 3560425479], length 1314
17:40:50.288793 IP 10.8.3.3.59236 > 45.113.130.70.1935: Flags [.], seq 231128:232442, ack 0, win 501, options [nop,nop,TS val 2944740007 ecr 3560425479], length 1314
17:40:50.313792 IP 45.113.130.70.1935 > 10.8.3.3.59236: Flags [.], ack 218393, win 135, options [nop,nop,TS val 3560425570 ecr 2944739516], length 0
17:40:50.331248 IP 10.8.3.3.59236 > 45.113.130.70.1935: Flags [.], seq 232442:233756, ack 0, win 501, options [nop,nop,TS val 2944740050 ecr 3560425570], length 1314
17:40:50.395751 IP 10.8.3.3.59236 > 45.113.130.70.1935: Flags [.], seq 233756:235070, ack 0, win 501, options [nop,nop,TS val 2944740114 ecr 3560425570], length 1314
17:40:50.420436 IP 45.113.130.70.1935 > 10.8.3.3.59236: Flags [.], ack 221021, win 135, options [nop,nop,TS val 3560425677 ecr 2944739582], length 0
17:40:50.429325 IP 10.8.3.3.59236 > 45.113.130.70.1935: Flags [.], seq 235070:236384, ack 0, win 501, options [nop,nop,TS val 2944740148 ecr 3560425677], length 1314
17:40:50.452095 IP 45.113.130.70.1935 > 10.8.3.3.59236: Flags [.], ack 221930, win 136, options [nop,nop,TS val 3560425708 ecr 2944739677], length 0
17:40:50.452107 IP 10.8.3.3.59236 > 45.113.130.70.1935: Flags [P.], seq 236384:236812, ack 0, win 501, options [nop,nop,TS val 2944740171 ecr 3560425708], length 428
17:40:50.497213 IP 10.8.3.3.59236 > 45.113.130.70.1935: Flags [.], seq 236812:238126, ack 0, win 501, options [nop,nop,TS val 2944740216 ecr 3560425708], length 1314
17:40:50.522815 IP 45.113.130.70.1935 > 10.8.3.3.59236: Flags [.], ack 224558, win 136, options [nop,nop,TS val 3560425779 ecr 2944739710], length 0
17:40:50.523147 IP 10.8.3.3.59236 > 45.113.130.70.1935: Flags [.], seq 238126:239440, ack 0, win 501, options [nop,nop,TS val 2944740242 ecr 3560425779], length 1314
17:40:50.565418 IP 10.8.3.3.59236 > 45.113.130.70.1935: Flags [.], seq 239440:240754, ack 0, win 501, options [nop,nop,TS val 2944740284 ecr 3560425779], length 1314
17:40:50.624754 IP 45.113.130.70.1935 > 10.8.3.3.59236: Flags [.], ack 227186, win 136, options [nop,nop,TS val 3560425881 ecr 2944739795], length 0
17:40:50.629255 IP 10.8.3.3.59236 > 45.113.130.70.1935: Flags [.], seq 240754:242068, ack 0, win 501, options [nop,nop,TS val 2944740348 ecr 3560425881], length 1314
17:40:50.664812 IP 10.8.3.3.59236 > 45.113.130.70.1935: Flags [.], seq 242068:243382, ack 0, win 501, options [nop,nop,TS val 2944740383 ecr 3560425881], length 1314
17:40:50.696146 IP 10.8.3.3.59236 > 45.113.130.70.1935: Flags [.], seq 243382:244696, ack 0, win 501, options [nop,nop,TS val 2944740415 ecr 3560425881], length 1314
17:40:50.696875 IP 45.113.130.70.1935 > 10.8.3.3.59236: Flags [.], ack 229814, win 136, options [nop,nop,TS val 3560425953 ecr 2944739880], length 0
17:40:50.756711 IP 10.8.3.3.59236 > 45.113.130.70.1935: Flags [.], seq 244696:246010, ack 0, win 501, options [nop,nop,TS val 2944740475 ecr 3560425953], length 1314
17:40:50.782259 IP 45.113.130.70.1935 > 10.8.3.3.59236: Flags [.], ack 232442, win 136, options [nop,nop,TS val 3560426038 ecr 2944739983], length 0
17:40:50.799189 IP 10.8.3.3.59236 > 45.113.130.70.1935: Flags [.], seq 246010:247324, ack 0, win 501, options [nop,nop,TS val 2944740518 ecr 3560426038], length 1314
17:40:50.829282 IP 10.8.3.3.59236 > 45.113.130.70.1935: Flags [.], seq 247324:248638, ack 0, win 501, options [nop,nop,TS val 2944740548 ecr 3560426038], length 1314
17:40:50.884420 IP 10.8.3.3.59236 > 45.113.130.70.1935: Flags [.], seq 248638:249952, ack 0, win 501, options [nop,nop,TS val 2944740603 ecr 3560426038], length 1314
17:40:50.888954 IP 45.113.130.70.1935 > 10.8.3.3.59236: Flags [.], ack 235070, win 135, options [nop,nop,TS val 3560426145 ecr 2944740050], length 0
17:40:50.927100 IP 10.8.3.3.59236 > 45.113.130.70.1935: Flags [.], seq 249952:251266, ack 0, win 501, options [nop,nop,TS val 2944740645 ecr 3560426145], length 1314
17:40:50.945002 IP 45.113.130.70.1935 > 10.8.3.3.59236: Flags [.], ack 236812, win 136, options [nop,nop,TS val 3560426201 ecr 2944740148], length 0
17:40:50.945040 IP 10.8.3.3.59236 > 45.113.130.70.1935: Flags [P.], seq 251266:251715, ack 0, win 501, options [nop,nop,TS val 2944740663 ecr 3560426201], length 449
17:40:50.991150 IP 10.8.3.3.59236 > 45.113.130.70.1935: Flags [.], seq 251715:253029, ack 0, win 501, options [nop,nop,TS val 2944740710 ecr 3560426201], length 1314
17:40:51.016217 IP 45.113.130.70.1935 > 10.8.3.3.59236: Flags [.], ack 239440, win 136, options [nop,nop,TS val 3560426272 ecr 2944740216], length 0
17:40:51.031308 IP 10.8.3.3.59236 > 45.113.130.70.1935: Flags [.], seq 253029:254343, ack 0, win 501, options [nop,nop,TS val 2944740750 ecr 3560426272], length 1314
17:40:51.064127 IP 10.8.3.3.59236 > 45.113.130.70.1935: Flags [.], seq 254343:255657, ack 0, win 501, options [nop,nop,TS val 2944740783 ecr 3560426272], length 1314
17:40:51.118493 IP 10.8.3.3.59236 > 45.113.130.70.1935: Flags [.], seq 255657:256971, ack 0, win 501, options [nop,nop,TS val 2944740837 ecr 3560426272], length 1314
17:40:51.122146 IP 45.113.130.70.1935 > 10.8.3.3.59236: Flags [.], ack 242068, win 135, options [nop,nop,TS val 3560426379 ecr 2944740284], length 0
17:40:51.161103 IP 10.8.3.3.59236 > 45.113.130.70.1935: Flags [.], seq 256971:258285, ack 0, win 501, options [nop,nop,TS val 2944740879 ecr 3560426379], length 1314
17:40:51.189222 IP 45.113.130.70.1935 > 10.8.3.3.59236: Flags [.], ack 244696, win 135, options [nop,nop,TS val 3560426445 ecr 2944740383], length 0
17:40:51.200535 IP 10.8.3.3.59236 > 45.113.130.70.1935: Flags [.], seq 258285:259599, ack 0, win 501, options [nop,nop,TS val 2944740919 ecr 3560426445], length 1314
17:40:51.262642 IP 10.8.3.3.59236 > 45.113.130.70.1935: Flags [.], seq 259599:260913, ack 0, win 501, options [nop,nop,TS val 2944740981 ecr 3560426445], length 1314
17:40:51.288806 IP 10.8.3.3.59236 > 45.113.130.70.1935: Flags [.], seq 260913:262227, ack 0, win 501, options [nop,nop,TS val 2944741007 ecr 3560426445], length 1314
17:40:51.292267 IP 45.113.130.70.1935 > 10.8.3.3.59236: Flags [.], ack 247324, win 135, options [nop,nop,TS val 3560426549 ecr 2944740475], length 0
17:40:51.331625 IP 10.8.3.3.59236 > 45.113.130.70.1935: Flags [.], seq 262227:263541, ack 0, win 501, options [nop,nop,TS val 2944741050 ecr 3560426549], length 1314
17:40:51.377609 IP 45.113.130.70.1935 > 10.8.3.3.59236: Flags [.], ack 249952, win 135, options [nop,nop,TS val 3560426634 ecr 2944740548], length 0
17:40:51.395690 IP 10.8.3.3.59236 > 45.113.130.70.1935: Flags [.], seq 263541:264855, ack 0, win 501, options [nop,nop,TS val 2944741114 ecr 3560426634], length 1314
17:40:51.416948 IP 10.8.3.3.59236 > 45.113.130.70.1935: Flags [.], seq 264855:266169, ack 0, win 501, options [nop,nop,TS val 2944741135 ecr 3560426634], length 1314
17:40:51.437928 IP 45.113.130.70.1935 > 10.8.3.3.59236: Flags [.], ack 251715, win 136, options [nop,nop,TS val 3560426694 ecr 2944740645], length 0
17:40:51.437953 IP 10.8.3.3.59236 > 45.113.130.70.1935: Flags [P.], seq 266169:266602, ack 0, win 501, options [nop,nop,TS val 2944741156 ecr 3560426694], length 433
17:40:51.495658 IP 10.8.3.3.59236 > 45.113.130.70.1935: Flags [.], seq 266602:267916, ack 0, win 501, options [nop,nop,TS val 2944741214 ecr 3560426694], length 1314
17:40:51.523055 IP 10.8.3.3.59236 > 45.113.130.70.1935: Flags [.], seq 267916:269230, ack 0, win 501, options [nop,nop,TS val 2944741241 ecr 3560426694], length 1314
17:40:51.524326 IP 45.113.130.70.1935 > 10.8.3.3.59236: Flags [.], ack 254343, win 136, options [nop,nop,TS val 3560426781 ecr 2944740710], length 0
17:40:51.565838 IP 10.8.3.3.59236 > 45.113.130.70.1935: Flags [.], seq 269230:270544, ack 0, win 501, options [nop,nop,TS val 2944741284 ecr 3560426781], length 1314
17:40:51.611479 IP 45.113.130.70.1935 > 10.8.3.3.59236: Flags [.], ack 256971, win 135, options [nop,nop,TS val 3560426868 ecr 2944740783], length 0
17:40:51.630038 IP 10.8.3.3.59236 > 45.113.130.70.1935: Flags [.], seq 270544:271858, ack 0, win 501, options [nop,nop,TS val 2944741348 ecr 3560426868], length 1314
17:40:51.651287 IP 10.8.3.3.59236 > 45.113.130.70.1935: Flags [.], seq 271858:273172, ack 0, win 501, options [nop,nop,TS val 2944741370 ecr 3560426868], length 1314
17:40:51.693765 IP 45.113.130.70.1935 > 10.8.3.3.59236: Flags [.], ack 259599, win 135, options [nop,nop,TS val 3560426950 ecr 2944740879], length 0
17:40:51.693964 IP 10.8.3.3.59236 > 45.113.130.70.1935: Flags [.], seq 273172:274486, ack 0, win 501, options [nop,nop,TS val 2944741412 ecr 3560426950], length 1314
17:40:51.758410 IP 10.8.3.3.59236 > 45.113.130.70.1935: Flags [.], seq 274486:275800, ack 0, win 501, options [nop,nop,TS val 2944741477 ecr 3560426950], length 1314
17:40:51.781796 IP 45.113.130.70.1935 > 10.8.3.3.59236: Flags [.], ack 262227, win 135, options [nop,nop,TS val 3560427038 ecr 2944740981], length 0
17:40:51.799966 IP 10.8.3.3.59236 > 45.113.130.70.1935: Flags [.], seq 275800:277114, ack 0, win 501, options [nop,nop,TS val 2944741518 ecr 3560427038], length 1314
17:40:51.822778 IP 10.8.3.3.59236 > 45.113.130.70.1935: Flags [.], seq 277114:278428, ack 0, win 501, options [nop,nop,TS val 2944741541 ecr 3560427038], length 1314
17:40:51.886648 IP 10.8.3.3.59236 > 45.113.130.70.1935: Flags [.], seq 278428:279742, ack 0, win 501, options [nop,nop,TS val 2944741605 ecr 3560427038], length 1314
17:40:51.889185 IP 45.113.130.70.1935 > 10.8.3.3.59236: Flags [.], ack 264855, win 135, options [nop,nop,TS val 3560427145 ecr 2944741050], length 0
17:40:51.929290 IP 10.8.3.3.59236 > 45.113.130.70.1935: Flags [.], seq 279742:281056, ack 0, win 501, options [nop,nop,TS val 2944741648 ecr 3560427145], length 1314
17:40:51.930703 IP 45.113.130.70.1935 > 10.8.3.3.59236: Flags [.], ack 266602, win 136, options [nop,nop,TS val 3560427187 ecr 2944741135], length 0
17:40:51.930716 IP 10.8.3.3.59236 > 45.113.130.70.1935: Flags [P.], seq 281056:281585, ack 0, win 501, options [nop,nop,TS val 2944741649 ecr 3560427187], length 529
17:40:51.993511 IP 10.8.3.3.59236 > 45.113.130.70.1935: Flags [.], seq 281585:282899, ack 0, win 501, options [nop,nop,TS val 2944741712 ecr 3560427187], length 1314
17:40:52.015994 IP 45.113.130.70.1935 > 10.8.3.3.59236: Flags [.], ack 269230, win 136, options [nop,nop,TS val 3560427272 ecr 2944741214], length 0
17:40:52.033388 IP 10.8.3.3.59236 > 45.113.130.70.1935: Flags [.], seq 282899:284213, ack 0, win 501, options [nop,nop,TS val 2944741752 ecr 3560427272], length 1314
17:40:52.063719 IP 10.8.3.3.59236 > 45.113.130.70.1935: Flags [.], seq 284213:285527, ack 0, win 501, options [nop,nop,TS val 2944741782 ecr 3560427272], length 1314
17:40:52.121324 IP 10.8.3.3.59236 > 45.113.130.70.1935: Flags [.], seq 285527:286841, ack 0, win 501, options [nop,nop,TS val 2944741840 ecr 3560427272], length 1314
17:40:52.123368 IP 45.113.130.70.1935 > 10.8.3.3.59236: Flags [.], ack 271858, win 135, options [nop,nop,TS val 3560427380 ecr 2944741284], length 0
17:40:52.162655 IP 10.8.3.3.59236 > 45.113.130.70.1935: Flags [.], seq 286841:288155, ack 0, win 501, options [nop,nop,TS val 2944741881 ecr 3560427380], length 1314
