06:32:50.188260 IP 10.8.1.11.44458 > 99.181.68.229.1935: Flags [.], seq 214649481:214650795, ack 1208866643, win 501, options [nop,nop,TS val 2573293692 ecr 3641660117], length 1314
06:32:50.194843 IP 99.181.68.229.1935 > 10.8.1.11.44458: Flags [.], ack 4294959649, win 126, options [nop,nop,TS val 3641660209 ecr 2573293334], length 0
06:32:50.231286 IP 10.8.1.11.44458 > 99.181.68.229.1935: Flags [.], seq 1314:2628, ack 1, win 501, options [nop,nop,TS val 2573293735 ecr 3641660209], length 1314
06:32:50.264686 IP 10.8.1.11.44458 > 99.181.68.229.1935: Flags [.], seq 2628:3942, ack 1, win 501, options [nop,nop,TS val 2573293768 ecr 3641660209], length 1314
06:32:50.269318 IP 99.181.68.229.1935 > 10.8.1.11.44458: Flags [.], ack 4294962277, win 126, options [nop,nop,TS val 3641660284 ecr 2573293435], length 0
06:32:50.318667 IP 99.181.68.229.1935 > 10.8.1.11.44458: Flags [.], ack 4294963354, win 126, options [nop,nop,TS val 3641660333 ecr 2573293518], length 0
06:32:50.318701 IP 10.8.1.11.44458 > 99.181.68.229.1935: Flags [P.], seq 3942:5098, ack 1, win 501, options [nop,nop,TS val 2573293822 ecr 3641660333], length 1156
06:32:50.360307 IP 10.8.1.11.44458 > 99.181.68.229.1935: Flags [.], seq 5098:6412, ack 1, win 501, options [nop,nop,TS val 2573293864 ecr 3641660333], length 1314
06:32:50.398009 IP 10.8.1.11.44458 > 99.181.68.229.1935: Flags [.], seq 6412:7726, ack 1, win 501, options [nop,nop,TS val 2573293901 ecr 3641660333], length 1314
06:32:50.402910 IP 99.181.68.229.1935 > 10.8.1.11.44458: Flags [.], ack 4294965982, win 126, options [nop,nop,TS val 3641660417 ecr 2573293563], length 0
06:32:50.445651 IP 10.8.1.11.44458 > 99.181.68.229.1935: Flags [.], seq 7726:9040, ack 1, win 501, options [nop,nop,TS val 2573293949 ecr 3641660417], length 1314
06:32:50.487946 IP 10.8.1.11.44458 > 99.181.68.229.1935: Flags [.], seq 9040:10354, ack 1, win 501, options [nop,nop,TS val 2573293991 ecr 3641660417], length 1314
06:32:50.492658 IP 99.181.68.229.1935 > 10.8.1.11.44458: Flags [.], ack 1314, win 126, options [nop,nop,TS val 3641660507 ecr 2573293632], length 0
06:32:50.527641 IP 10.8.1.11.44458 > 99.181.68.229.1935: Flags [.], seq 10354:11668, ack 1, win 501, options [nop,nop,TS val 2573294031 ecr 3641660507], length 1314
06:32:50.569318 IP 99.181.68.229.1935 > 10.8.1.11.44458: Flags [.], ack 3942, win 126, options [nop,nop,TS val 3641660583 ecr 2573293735], length 0
06:32:50.573517 IP 10.8.1.11.44458 > 99.181.68.229.1935: Flags [.], seq 11668:12982, ack 1, win 501, options [nop,nop,TS val 2573294077 ecr 3641660583], length 1314
06:32:50.623629 IP 99.181.68.229.1935 > 10.8.1.11.44458: Flags [.], ack 5098, win 126, options [nop,nop,TS val 3641660637 ecr 2573293822], length 0
06:32:50.623649 IP 10.8.1.11.44458 > 99.181.68.229.1935: Flags [P.], seq 12982:14059, ack 1, win 501, options [nop,nop,TS val 2573294127 ecr 3641660637], length 1077
06:32:50.659067 IP 10.8.1.11.44458 > 99.181.68.229.1935: Flags [.], seq 14059:15373, ack 1, win 501, options [nop,nop,TS val 2573294162 ecr 3641660637], length 1314
06:32:50.696000 IP 10.8.1.11.44458 > 99.181.68.229.1935: Flags [.], seq 15373:16687, ack 1, win 501, options [nop,nop,TS val 2573294199 ecr 3641660637], length 1314
06:32:50.702615 IP 99.181.68.229.1935 > 10.8.1.11.44458: Flags [.], ack 7726, win 126, options [nop,nop,TS val 3641660717 ecr 2573293864], length 0
06:32:50.744122 IP 10.8.1.11.44458 > 99.181.68.229.1935: Flags [.], seq 16687:18001, ack 1, win 501, options [nop,nop,TS val 2573294247 ecr 3641660717], length 1314
06:32:50.786449 IP 10.8.1.11.44458 > 99.181.68.229.1935: Flags [.], seq 18001:19315, ack 1, win 501, options [nop,nop,TS val 2573294290 ecr 3641660717], length 1314
06:32:50.792427 IP 99.181.68.229.1935 > 10.8.1.11.44458: Flags [.], ack 10354, win 126, options [nop,nop,TS val 3641660807 ecr 2573293949], length 0
06:32:50.828983 IP 10.8.1.11.44458 > 99.181.68.229.1935: Flags [.], seq 19315:20629, ack 1, win 501, options [nop,nop,TS val 2573294332 ecr 3641660807], length 1314
06:32:50.872057 IP 10.8.1.11.44458 > 99.181.68.229.1935: Flags [.], seq 20629:21943, ack 1, win 501, options [nop,nop,TS val 2573294375 ecr 3641660807], length 1314
06:32:50.879083 IP 99.181.68.229.1935 > 10.8.1.11.44458: Flags [.], ack 12982, win 126, options [nop,nop,TS val 3641660893 ecr 2573294031], length 0
06:32:50.929625 IP 10.8.1.11.44458 > 99.181.68.229.1935: Flags [.], seq 21943:23257, ack 1, win 501, options [nop,nop,TS val 2573294433 ecr 3641660893], length 1314
06:32:50.933522 IP 99.181.68.229.1935 > 10.8.1.11.44458: Flags [.], ack 14059, win 126, options [nop,nop,TS val 3641660943 ecr 2573294127], length 0
06:32:50.933548 IP 10.8.1.11.44458 > 99.181.68.229.1935: Flags [P.], seq 23257:23858, ack 1, win 501, options [nop,nop,TS val 2573294437 ecr 3641660943], length 601
06:32:50.997253 IP 10.8.1.11.44458 > 99.181.68.229.1935: Flags [.], seq 23858:25172, ack 1, win 501, options [nop,nop,TS val 2573294501 ecr 3641660943], length 1314
06:32:51.000313 IP 99.181.68.229.1935 > 10.8.1.11.44458: Flags [.], ack 16687, win 126, options [nop,nop,TS val 3641661015 ecr 2573294162], length 0
06:32:51.022120 IP 10.8.1.11.44458 > 99.181.68.229.1935: Flags [.], seq 25172:26486, ack 1, win 501, options [nop,nop,TS val 2573294525 ecr 3641661015], length 1314
06:32:51.062756 IP 10.8.1.11.44458 > 99.181.68.229.1935: Flags [.], seq 26486:27800, ack 1, win 501, options [nop,nop,TS val 2573294566 ecr 3641661015], length 1314
06:32:51.090996 IP 99.181.68.229.1935 > 10.8.1.11.44458: Flags [.], ack 19315, win 126, options [nop,nop,TS val 3641661105 ecr 2573294247], length 0
06:32:51.129700 IP 10.8.1.11.44458 > 99.181.68.229.1935: Flags [.], seq 27800:29114, ack 1, win 501, options [nop,nop,TS val 2573294633 ecr 3641661105], length 1314
06:32:51.164609 IP 10.8.1.11.44458 > 99.181.68.229.1935: Flags [.], seq 29114:30428, ack 1, win 501, options [nop,nop,TS val 2573294668 ecr 3641661105], length 1314
06:32:51.178328 IP 99.181.68.229.1935 > 10.8.1.11.44458: Flags [.], ack 21943, win 126, options [nop,nop,TS val 3641661193 ecr 2573294332], length 0
06:32:51.194155 IP 10.8.1.11.44458 > 99.181.68.229.1935: Flags [.], seq 30428:31742, ack 1, win 501, options [nop,nop,TS val 2573294697 ecr 3641661193], length 1314
06:32:51.237852 IP 99.181.68.229.1935 > 10.8.1.11.44458: Flags [.], ack 23858, win 126, options [nop,nop,TS val 3641661252 ecr 2573294433], length 0
06:32:51.237868 IP 10.8.1.11.44458 > 99.181.68.229.1935: Flags [P.], seq 31742:32903, ack 1, win 501, options [nop,nop,TS val 2573294741 ecr 3641661252], length 1161
06:32:51.297157 IP 10.8.1.11.44458 > 99.181.68.229.1935: Flags [.], seq 32903:34217, ack 1, win 501, options [nop,nop,TS val 2573294800 ecr 3641661252], length 1314
06:32:51.321998 IP 10.8.1.11.44458 > 99.181.68.229.1935: Flags [.], seq 34217:35531, ack 1, win 501, options [nop,nop,TS val 2573294825 ecr 3641661252], length 1314
06:32:51.326634 IP 99.181.68.229.1935 > 10.8.1.11.44458: Flags [.], ack 26486, win 126, options [nop,nop,TS val 3641661341 ecr 2573294501], length 0
06:32:51.364857 IP 10.8.1.11.44458 > 99.181.68.229.1935: Flags [.], seq 35531:36845, ack 1, win 501, options [nop,nop,TS val 2573294868 ecr 3641661341], length 1314
06:32:51.427735 IP 10.8.1.11.44458 > 99.181.68.229.1935: Flags [.], seq 36845:38159, ack 1, win 501, options [nop,nop,TS val 2573294931 ecr 3641661341], length 1314
06:32:51.434073 IP 99.181.68.229.1935 > 10.8.1.11.44458: Flags [.], ack 29114, win 126, options [nop,nop,TS val 3641661448 ecr 2573294566], length 0
06:32:51.460871 IP 10.8.1.11.44458 > 99.181.68.229.1935: Flags [.], seq 38159:39473, ack 1, win 501, options [nop,nop,TS val 2573294964 ecr 3641661448], length 1314
06:32:51.494686 IP 10.8.1.11.44458 > 99.181.68.229.1935: Flags [.], seq 39473:40787, ack 1, win 501, options [nop,nop,TS val 2573294998 ecr 3641661448], length 1314
06:32:51.498488 IP 99.181.68.229.1935 > 10.8.1.11.44458: Flags [.], ack 31742, win 126, options [nop,nop,TS val 3641661513 ecr 2573294668], length 0
06:32:51.542546 IP 99.181.68.229.1935 > 10.8.1.11.44458: Flags [.], ack 32903, win 126, options [nop,nop,TS val 3641661557 ecr 2573294741], length 0
06:32:51.542582 IP 10.8.1.11.44458 > 99.181.68.229.1935: Flags [P.], seq 40787:41864, ack 1, win 501, options [nop,nop,TS val 2573295046 ecr 3641661557], length 1077
06:32:51.596285 IP 10.8.1.11.44458 > 99.181.68.229.1935: Flags [.], seq 41864:43178, ack 1, win 501, options [nop,nop,TS val 2573295100 ecr 3641661557], length 1314
06:32:51.620905 IP 10.8.1.11.44458 > 99.181.68.229.1935: Flags [.], seq 43178:44492, ack 1, win 501, options [nop,nop,TS val 2573295124 ecr 3641661557], length 1314
06:32:51.626278 IP 99.181.68.229.1935 > 10.8.1.11.44458: Flags [.], ack 35531, win 126, options [nop,nop,TS val 3641661641 ecr 2573294800], length 0
06:32:51.665548 IP 10.8.1.11.44458 > 99.181.68.229.1935: Flags [.], seq 44492:45806, ack 1, win 501, options [nop,nop,TS val 2573295169 ecr 3641661641], length 1314
06:32:51.728459 IP 10.8.1.11.44458 > 99.181.68.229.1935: Flags [.], seq 45806:47120, ack 1, win 501, options [nop,nop,TS val 2573295232 ecr 3641661641], length 1314
06:32:51.731697 IP 99.181.68.229.1935 > 10.8.1.11.44458: Flags [.], ack 38159, win 126, options [nop,nop,TS val 3641661746 ecr 2573294868], length 0
06:32:51.764415 IP 10.8.1.11.44458 > 99.181.68.229.1935: Flags [.], seq 47120:48434, ack 1, win 501, options [nop,nop,TS val 2573295268 ecr 3641661746], length 1314
06:32:51.796960 IP 10.8.1.11.44458 > 99.181.68.229.1935: Flags [.], seq 48434:49748, ack 1, win 501, options [nop,nop,TS val 2573295300 ecr 3641661746], length 1314
06:32:51.798831 IP 99.181.68.229.1935 > 10.8.1.11.44458: Flags [.], ack 40787, win 126, options [nop,nop,TS val 3641661813 ecr 2573294964], length 0
06:32:51.846895 IP 99.181.68.229.1935 > 10.8.1.11.44458: Flags [.], ack 41864, win 126, options [nop,nop,TS val 3641661861 ecr 2573295046], length 0
06:32:51.846913 IP 10.8.1.11.44458 > 99.181.68.229.1935: Flags [P.], seq 49748:50813, ack 1, win 501, options [nop,nop,TS val 2573295350 ecr 3641661861], length 1065
06:32:51.898976 IP 10.8.1.11.44458 > 99.181.68.229.1935: Flags [.], seq 50813:52127, ack 1, win 501, options [nop,nop,TS val 2573295402 ecr 3641661861], length 1314
06:32:51.925368 IP 99.181.68.229.1935 > 10.8.1.11.44458: Flags [.], ack 44492, win 126, options [nop,nop,TS val 3641661940 ecr 2573295100], length 0
06:32:51.932202 IP 10.8.1.11.44458 > 99.181.68.229.1935: Flags [.], seq 52127:53441, ack 1, win 501, options [nop,nop,TS val 2573295436 ecr 3641661940], length 1314
06:32:51.963042 IP 10.8.1.11.44458 > 99.181.68.229.1935: Flags [.], seq 53441:54755, ack 1, win 501, options [nop,nop,TS val 2573295466 ecr 3641661940], length 1314
06:32:52.027098 IP 10.8.1.11.44458 > 99.181.68.229.1935: Flags [.], seq 54755:56069, ack 1, win 501, options [nop,nop,TS val 2573295530 ecr 3641661940], length 1314
06:32:52.033288 IP 99.181.68.229.1935 > 10.8.1.11.44458: Flags [.], ack 47120, win 126, options [nop,nop,TS val 3641662047 ecr 2573295169], length 0
06:32:52.066966 IP 10.8.1.11.44458 > 99.181.68.229.1935: Flags [.], seq 56069:57383, ack 1, win 501, options [nop,nop,TS val 2573295570 ecr 3641662047], length 1314
06:32:52.098937 IP 10.8.1.11.44458 > 99.181.68.229.1935: Flags [.], seq 57383:58697, ack 1, win 501, options [nop,nop,TS val 2573295602 ecr 3641662047], length 1314
06:32:52.101378 IP 99.181.68.229.1935 > 10.8.1.11.44458: Flags [.], ack 49748, win 126, options [nop,nop,TS val 3641662116 ecr 2573295268], length 0
06:32:52.151113 IP 99.181.68.229.1935 > 10.8.1.11.44458: Flags [.], ack 50813, win 126, options [nop,nop,TS val 3641662165 ecr 2573295350], length 0
06:32:52.151130 IP 10.8.1.11.44458 > 99.181.68.229.1935: Flags [P.], seq 58697:59769, ack 1, win 501, options [nop,nop,TS val 2573295654 ecr 3641662165], length 1072
06:32:52.197058 IP 10.8.1.11.44458 > 99.181.68.229.1935: Flags [.], seq 59769:61083, ack 1, win 501, options [nop,nop,TS val 2573295700 ecr 3641662165], length 1314
06:32:52.231681 IP 10.8.1.11.44458 > 99.181.68.229.1935: Flags [.], seq 61083:62397, ack 1, win 501, options [nop,nop,TS val 2573295735 ecr 3641662165], length 1314
06:32:52.236936 IP 99.181.68.229.1935 > 10.8.1.11.44458: Flags [.], ack 53441, win 126, options [nop,nop,TS val 3641662251 ecr 2573295402], length 0
06:32:52.262712 IP 10.8.1.11.44458 > 99.181.68.229.1935: Flags [.], seq 62397:63711, ack 1, win 501, options [nop,nop,TS val 2573295766 ecr 3641662251], length 1314
06:32:52.326797 IP 10.8.1.11.44458 > 99.181.68.229.1935: Flags [.], seq 63711:65025, ack 1, win 501, options [nop,nop,TS val 2573295830 ecr 3641662251], length 1314
06:32:52.331993 IP 99.181.68.229.1935 > 10.8.1.11.44458: Flags [.], ack 56069, win 126, options [nop,nop,TS val 3641662346 ecr 2573295466], length 0
06:32:52.363636 IP 10.8.1.11.44458 > 99.181.68.229.1935: Flags [.], seq 65025:66339, ack 1, win 501, options [nop,nop,TS val 2573295867 ecr 3641662346], length 1314
06:32:52.396784 IP 10.8.1.11.44458 > 99.181.68.229.1935: Flags [.], seq 66339:67653, ack 1, win 501, options [nop,nop,TS val 2573295900 ecr 3641662346], length 1314
06:32:52.403580 IP 99.181.68.229.1935 > 10.8.1.11.44458: Flags [.], ack 58697, win 126, options [nop,nop,TS val 3641662418 ecr 2573295570], length 0
06:32:52.455365 IP 99.181.68.229.1935 > 10.8.1.11.44458: Flags [.], ack 59769, win 126, options [nop,nop,TS val 3641662470 ecr 2573295654], length 0
06:32:52.455395 IP 10.8.1.11.44458 > 99.181.68.229.1935: Flags [P.], seq 67653:68821, ack 1, win 501, options [nop,nop,TS val 2573295959 ecr 3641662470], length 1168
06:32:52.497232 IP 10.8.1.11.44458 > 99.181.68.229.1935: Flags [.], seq 68821:70135, ack 1, win 501, options [nop,nop,TS val 2573296001 ecr 3641662470], length 1314
06:32:52.529833 IP 10.8.1.11.44458 > 99.181.68.229.1935: Flags [.], seq 70135:71449, ack 1, win 501, options [nop,nop,TS val 2573296033 ecr 3641662470], length 1314
06:32:52.537329 IP 99.181.68.229.1935 > 10.8.1.11.44458: Flags [.], ack 62397, win 126, options [nop,nop,TS val 3641662550 ecr 2573295700], length 0
06:32:52.583151 IP 10.8.1.11.44458 > 99.181.68.229.1935: Flags [.], seq 71449:72763, ack 1, win 501, options [nop,nop,TS val 2573296086 ecr 3641662550], length 1314
06:32:52.626352 IP 10.8.1.11.44458 > 99.181.68.229.1935: Flags [.], seq 72763:74077, ack 1, win 501, options [nop,nop,TS val 2573296130 ecr 3641662550], length 1314
06:32:52.632000 IP 99.181.68.229.1935 > 10.8.1.11.44458: Flags [.], ack 65025, win 126, options [nop,nop,TS val 3641662646 ecr 2573295766], length 0
06:32:52.664781 IP 10.8.1.11.44458 > 99.181.68.229.1935: Flags [.], seq 74077:75391, ack 1, win 501, options [nop,nop,TS val 2573296168 ecr 3641662646], length 1314
06:32:52.701601 IP 99.181.68.229.1935 > 10.8.1.11.44458: Flags [.], ack 67653, win 126, options [nop,nop,TS val 3641662716 ecr 2573295867], length 0
06:32:52.712416 IP 10.8.1.11.44458 > 99.181.68.229.1935: Flags [.], seq 75391:76705, ack 1, win 501, options [nop,nop,TS val 2573296216 ecr 3641662716], length 1314
06:32:52.760594 IP 10.8.1.11.44458 > 99.181.68.229.1935: Flags [.], seq 76705:78019, ack 1, win 501, options [nop,nop,TS val 2573296264 ecr 3641662716], length 1314
06:32:52.760695 IP 99.181.68.229.1935 > 10.8.1.11.44458: Flags [.], ack 68821, win 126, options [nop,nop,TS val 3641662774 ecr 2573295959], length 0
06:32:52.760703 IP 10.8.1.11.44458 > 99.181.68.229.1935: Flags [P.], seq 78019:78614, ack 1, win 501, options [nop,nop,TS val 2573296264 ecr 3641662774], length 595
06:32:52.831335 IP 10.8.1.11.44458 > 99.181.68.229.1935: Flags [.], seq 78614:79928, ack 1, win 501, options [nop,nop,TS val 2573296335 ecr 3641662774], length 1314
06:32:52.834314 IP 99.181.68.229.1935 > 10.8.1.11.44458: Flags [.], ack 71449, win 126, options [nop,nop,TS val 3641662849 ecr 2573296001], length 0
06:32:52.862169 IP 10.8.1.11.44458 > 99.181.68.229.1935: Flags [.], seq 79928:81242, ack 1, win 501, options [nop,nop,TS val 2573296365 ecr 3641662849], length 1314
06:32:52.898153 IP 10.8.1.11.44458 > 99.181.68.229.1935: Flags [.], seq 81242:82556, ack 1, win 501, options [nop,nop,TS val 2573296401 ecr 3641662849], length 1314
06:32:52.930722 IP 99.181.68.229.1935 > 10.8.1.11.44458: Flags [.], ack 74077, win 126, options [nop,nop,TS val 3641662945 ecr 2573296086], length 0
06:32:52.960995 IP 10.8.1.11.44458 > 99.181.68.229.1935: Flags [.], seq 82556:83870, ack 1, win 501, options [nop,nop,TS val 2573296464 ecr 3641662945], length 1314
06:32:52.995746 IP 10.8.1.11.44458 > 99.181.68.229.1935: Flags [.], seq 83870:85184, ack 1, win 501, options [nop,nop,TS val 2573296499 ecr 3641662945], length 1314
06:32:53.017589 IP 99.181.68.229.1935 > 10.8.1.11.44458: Flags [.], ack 76705, win 126, options [nop,nop,TS val 3641663032 ecr 2573296168], length 0
06:32:53.027295 IP 10.8.1.11.44458 > 99.181.68.229.1935: Flags [.], seq 85184:86498, ack 1, win 501, options [nop,nop,TS val 2573296531 ecr 3641663032], length 1314
06:32:53.065134 IP 99.181.68.229.1935 > 10.8.1.11.44458: Flags [.], ack 78614, win 126, options [nop,nop,TS val 3641663079 ecr 2573296264], length 0
06:32:53.065161 IP 10.8.1.11.44458 > 99.181.68.229.1935: Flags [P.], seq 86498:87575, ack 1, win 501, options [nop,nop,TS val 2573296568 ecr 3641663079], length 1077
06:32:53.131731 IP 10.8.1.11.44458 > 99.181.68.229.1935: Flags [.], seq 87575:88889, ack 1, win 501, options [nop,nop,TS val 2573296635 ecr 3641663079], length 1314
06:32:53.161195 IP 10.8.1.11.44458 > 99.181.68.229.1935: Flags [.], seq 88889:90203, ack 1, win 501, options [nop,nop,TS val 2573296664 ecr 3641663079], length 1314
06:32:53.166953 IP 99.181.68.229.1935 > 10.8.1.11.44458: Flags [.], ack 81242, win 126, options [nop,nop,TS val 3641663181 ecr 2573296335], length 0
06:32:53.198112 IP 10.8.1.11.44458 > 99.181.68.229.1935: Flags [.], seq 90203:91517, ack 1, win 501, options [nop,nop,TS val 2573296701 ecr 3641663181], length 1314
06:32:53.265061 IP 10.8.1.11.44458 > 99.181.68.229.1935: Flags [.], seq 91517:92831, ack 1, win 501, options [nop,nop,TS val 2573296768 ecr 3641663181], length 1314
06:32:53.265902 IP 99.181.68.229.1935 > 10.8.1.11.44458: Flags [.], ack 83870, win 126, options [nop,nop,TS val 3641663280 ecr 2573296401], length 0
06:32:53.297986 IP 10.8.1.11.44458 > 99.181.68.229.1935: Flags [.], seq 92831:94145, ack 1, win 501, options [nop,nop,TS val 2573296801 ecr 3641663280], length 1314
06:32:53.329862 IP 10.8.1.11.44458 > 99.181.68.229.1935: Flags [.], seq 94145:95459, ack 1, win 501, options [nop,nop,TS val 2573296833 ecr 3641663280], length 1314
06:32:53.331753 IP 99.181.68.229.1935 > 10.8.1.11.44458: Flags [.], ack 86498, win 126, options [nop,nop,TS val 3641663346 ecr 2573296499], length 0
06:32:53.369893 IP 99.181.68.229.1935 > 10.8.1.11.44458: Flags [.], ack 87575, win 126, options [nop,nop,TS val 3641663384 ecr 2573296568], length 0
06:32:53.369931 IP 10.8.1.11.44458 > 99.181.68.229.1935: Flags [P.], seq 95459:96528, ack 1, win 501, options [nop,nop,TS val 2573296873 ecr 3641663384], length 1069
06:32:53.429826 IP 10.8.1.11.44458 > 99.181.68.229.1935: Flags [.], seq 96528:97842, ack 1, win 501, options [nop,nop,TS val 2573296933 ecr 3641663384], length 1314
06:32:53.461069 IP 10.8.1.11.44458 > 99.181.68.229.1935: Flags [.], seq 97842:99156, ack 1, win 501, options [nop,nop,TS val 2573296964 ecr 3641663384], length 1314
06:32:53.465971 IP 99.181.68.229.1935 > 10.8.1.11.44458: Flags [.], ack 90203, win 126, options [nop,nop,TS val 3641663480 ecr 2573296635], length 0
06:32:53.496299 IP 10.8.1.11.44458 > 99.181.68.229.1935: Flags [.], seq 99156:100470, ack 1, win 501, options [nop,nop,TS val 2573297000 ecr 3641663480], length 1314
06:32:53.560751 IP 10.8.1.11.44458 > 99.181.68.229.1935: Flags [.], seq 100470:101784, ack 1, win 501, options [nop,nop,TS val 2573297064 ecr 3641663480], length 1314
06:32:53.567299 IP 99.181.68.229.1935 > 10.8.1.11.44458: Flags [.], ack 91517, win 126, options [nop,nop,TS val 3641663582 ecr 2573296701], length 0
06:32:53.595257 IP 10.8.1.11.44458 > 99.181.68.229.1935: Flags [.], seq 101784:103098, ack 1, win 501, options [nop,nop,TS val 2573297099 ecr 3641663582], length 1314
06:32:53.602195 IP 99.181.68.229.1935 > 10.8.1.11.44458: Flags [.], ack 94145, win 126, options [nop,nop,TS val 3641663617 ecr 2573296768], length 0
06:32:53.631055 IP 10.8.1.11.44458 > 99.181.68.229.1935: Flags [.], seq 103098:104412, ack 1, win 501, options [nop,nop,TS val 2573297134 ecr 3641663617], length 1314
06:32:53.674619 IP 99.181.68.229.1935 > 10.8.1.11.44458: Flags [.], ack 96528, win 126, options [nop,nop,TS val 3641663688 ecr 2573296833], length 0
06:32:53.674668 IP 10.8.1.11.44458 > 99.181.68.229.1935: Flags [P.], seq 104412:105576, ack 1, win 501, options [nop,nop,TS val 2573297178 ecr 3641663688], length 1164
06:32:53.729834 IP 10.8.1.11.44458 > 99.181.68.229.1935: Flags [.], seq 105576:106890, ack 1, win 501, options [nop,nop,TS val 2573297233 ecr 3641663688], length 1314
06:32:53.760524 IP 10.8.1.11.44458 > 99.181.68.229.1935: Flags [.], seq 106890:108204, ack 1, win 501, options [nop,nop,TS val 2573297264 ecr 3641663688], length 1314
06:32:53.765435 IP 99.181.68.229.1935 > 10.8.1.11.44458: Flags [.], ack 99156, win 126, options [nop,nop,TS val 3641663780 ecr 2573296933], length 0
06:32:53.803316 IP 10.8.1.11.44458 > 99.181.68.229.1935: Flags [.], seq 108204:109518, ack 1, win 501, options [nop,nop,TS val 2573297307 ecr 3641663780], length 1314
06:32:53.863024 IP 10.8.1.11.44458 > 99.181.68.229.1935: Flags [.], seq 109518:110832, ack 1, win 501, options [nop,nop,TS val 2573297366 ecr 3641663780], length 1314
06:32:53.865136 IP 99.181.68.229.1935 > 10.8.1.11.44458: Flags [.], ack 101784, win 126, options [nop,nop,TS val 3641663879 ecr 2573297000], length 0
06:32:53.897316 IP 10.8.1.11.44458 > 99.181.68.229.1935: Flags [.], seq 110832:112146, ack 1, win 501, options [nop,nop,TS val 2573297401 ecr 3641663879], length 1314
06:32:53.931755 IP 10.8.1.11.44458 > 99.181.68.229.1935: Flags [.], seq 112146:113460, ack 1, win 501, options [nop,nop,TS val 2573297435 ecr 3641663879], length 1314
06:32:53.935662 IP 99.181.68.229.1935 > 10.8.1.11.44458: Flags [.], ack 104412, win 126, options [nop,nop,TS val 3641663950 ecr 2573297099], length 0
06:32:53.978932 IP 99.181.68.229.1935 > 10.8.1.11.44458: Flags [.], ack 105576, win 126, options [nop,nop,TS val 3641663993 ecr 2573297178], length 0
06:32:53.978978 IP 10.8.1.11.44458 > 99.181.68.229.1935: Flags [P.], seq 113460:114537, ack 1, win 501, options [nop,nop,TS val 2573297482 ecr 3641663993], length 1077
06:32:54.027175 IP 10.8.1.11.44458 > 99.181.68.229.1935: Flags [.], seq 114537:115851, ack 1, win 501, options [nop,nop,TS val 2573297530 ecr 3641663993], length 1314
06:32:54.061316 IP 10.8.1.11.44458 > 99.181.68.229.1935: Flags [.], seq 115851:117165, ack 1, win 501, options [nop,nop,TS val 2573297565 ecr 3641663993], length 1314
06:32:54.064949 IP 99.181.68.229.1935 > 10.8.1.11.44458: Flags [.], ack 108204, win 126, options [nop,nop,TS val 3641664079 ecr 2573297233], length 0
06:32:54.102024 IP 10.8.1.11.44458 > 99.181.68.229.1935: Flags [.], seq 117165:118479, ack 1, win 501, options [nop,nop,TS val 2573297605 ecr 3641664079], length 1314
06:32:54.160855 IP 10.8.1.11.44458 > 99.181.68.229.1935: Flags [.], seq 118479:119793, ack 1, win 501, options [nop,nop,TS val 2573297664 ecr 3641664079], length 1314
06:32:54.167405 IP 99.181.68.229.1935 > 10.8.1.11.44458: Flags [.], ack 110832, win 126, options [nop,nop,TS val 3641664182 ecr 2573297307], length 0
06:32:54.197958 IP 10.8.1.11.44458 > 99.181.68.229.1935: Flags [.], seq 119793:121107, ack 1, win 501, options [nop,nop,TS val 2573297701 ecr 3641664182], length 1314
06:32:54.231384 IP 10.8.1.11.44458 > 99.181.68.229.1935: Flags [.], seq 121107:122421, ack 1, win 501, options [nop,nop,TS val 2573297735 ecr 3641664182], length 1314
06:32:54.236248 IP 99.181.68.229.1935 > 10.8.1.11.44458: Flags [.], ack 113460, win 126, options [nop,nop,TS val 3641664250 ecr 2573297401], length 0
06:32:54.283389 IP 99.181.68.229.1935 > 10.8.1.11.44458: Flags [.], ack 114537, win 126, options [nop,nop,TS val 3641664298 ecr 2573297482], length 0
06:32:54.283408 IP 10.8.1.11.44458 > 99.181.68.229.1935: Flags [P.], seq 122421:123482, ack 1, win 501, options [nop,nop,TS val 2573297787 ecr 3641664298], length 1061
06:32:54.331400 IP 10.8.1.11.44458 > 99.181.68.229.1935: Flags [.], seq 123482:124796, ack 1, win 501, options [nop,nop,TS val 2573297835 ecr 3641664298], length 1314
06:32:54.360665 IP 10.8.1.11.44458 > 99.181.68.229.1935: Flags [.], seq 124796:126110, ack 1, win 501, options [nop,nop,TS val 2573297864 ecr 3641664298], length 1314
06:32:54.365922 IP 99.181.68.229.1935 > 10.8.1.11.44458: Flags [.], ack 117165, win 126, options [nop,nop,TS val 3641664380 ecr 2573297530], length 0
06:32:54.400579 IP 10.8.1.11.44458 > 99.181.68.229.1935: Flags [.], seq 126110:127424, ack 1, win 501, options [nop,nop,TS val 2573297904 ecr 3641664380], length 1314
06:32:54.464673 IP 10.8.1.11.44458 > 99.181.68.229.1935: Flags [.], seq 127424:128738, ack 1, win 501, options [nop,nop,TS val 2573297968 ecr 3641664380], length 1314
06:32:54.465419 IP 99.181.68.229.1935 > 10.8.1.11.44458: Flags [.], ack 119793, win 126, options [nop,nop,TS val 3641664479 ecr 2573297605], length 0
06:32:54.498104 IP 10.8.1.11.44458 > 99.181.68.229.1935: Flags [.], seq 128738:130052, ack 1, win 501, options [nop,nop,TS val 2573298001 ecr 3641664479], length 1314
06:32:54.529288 IP 10.8.1.11.44458 > 99.181.68.229.1935: Flags [.], seq 130052:131366, ack 1, win 501, options [nop,nop,TS val 2573298033 ecr 3641664479], length 1314
06:32:54.536168 IP 99.181.68.229.1935 > 10.8.1.11.44458: Flags [.], ack 122421, win 126, options [nop,nop,TS val 3641664550 ecr 2573297701], length 0
06:32:54.587674 IP 99.181.68.229.1935 > 10.8.1.11.44458: Flags [.], ack 123482, win 126, options [nop,nop,TS val 3641664602 ecr 2573297787], length 0
06:32:54.587720 IP 10.8.1.11.44458 > 99.181.68.229.1935: Flags [P.], seq 131366:132438, ack 1, win 501, options [nop,nop,TS val 2573298091 ecr 3641664602], length 1072
06:32:54.627089 IP 10.8.1.11.44458 > 99.181.68.229.1935: Flags [.], seq 132438:133752, ack 1, win 501, options [nop,nop,TS val 2573298130 ecr 3641664602], length 1314
06:32:54.660869 IP 10.8.1.11.44458 > 99.181.68.229.1935: Flags [.], seq 133752:135066, ack 1, win 501, options [nop,nop,TS val 2573298164 ecr 3641664602], length 1314
06:32:54.664967 IP 99.181.68.229.1935 > 10.8.1.11.44458: Flags [.], ack 126110, win 126, options [nop,nop,TS val 3641664679 ecr 2573297835], length 0
06:32:54.699785 IP 10.8.1.11.44458 > 99.181.68.229.1935: Flags [.], seq 135066:136380, ack 1, win 501, options [nop,nop,TS val 2573298203 ecr 3641664679], length 1314
06:32:54.763176 IP 10.8.1.11.44458 > 99.181.68.229.1935: Flags [.], seq 136380:137694, ack 1, win 501, options [nop,nop,TS val 2573298266 ecr 3641664679], length 1314
06:32:54.769414 IP 99.181.68.229.1935 > 10.8.1.11.44458: Flags [.], ack 128738, win 126, options [nop,nop,TS val 3641664784 ecr 2573297904], length 0
06:32:54.794960 IP 10.8.1.11.44458 > 99.181.68.229.1935: Flags [.], seq 137694:139008, ack 1, win 501, options [nop,nop,TS val 2573298298 ecr 3641664784], length 1314
06:32:54.828463 IP 10.8.1.11.44458 > 99.181.68.229.1935: Flags [.], seq 139008:140322, ack 1, win 501, options [nop,nop,TS val 2573298332 ecr 3641664784], length 1314
06:32:54.833650 IP 99.181.68.229.1935 > 10.8.1.11.44458: Flags [.], ack 131366, win 126, options [nop,nop,TS val 3641664848 ecr 2573298001], length 0
06:32:54.892184 IP 99.181.68.229.1935 > 10.8.1.11.44458: Flags [.], ack 132438, win 126, options [nop,nop,TS val 3641664906 ecr 2573298091], length 0
06:32:54.892198 IP 10.8.1.11.44458 > 99.181.68.229.1935: Flags [P.], seq 140322:141490, ack 1, win 501, options [nop,nop,TS val 2573298396 ecr 3641664906], length 1168
06:32:54.927550 IP 10.8.1.11.44458 > 99.181.68.229.1935: Flags [.], seq 141490:142804, ack 1, win 501, options [nop,nop,TS val 2573298431 ecr 3641664906], length 1314
06:32:54.962150 IP 10.8.1.11.44458 > 99.181.68.229.1935: Flags [.], seq 142804:144118, ack 1, win 501, options [nop,nop,TS val 2573298465 ecr 3641664906], length 1314
06:32:54.965329 IP 99.181.68.229.1935 > 10.8.1.11.44458: Flags [.], ack 135066, win 126, options [nop,nop,TS val 3641664980 ecr 2573298130], length 0
06:32:55.020057 IP 10.8.1.11.44458 > 99.181.68.229.1935: Flags [.], seq 144118:145432, ack 1, win 501, options [nop,nop,TS val 2573298523 ecr 3641664980], length 1314
06:32:55.062087 IP 10.8.1.11.44458 > 99.181.68.229.1935: Flags [.], seq 145432:146746, ack 1, win 501, options [nop,nop,TS val 2573298565 ecr 3641664980], length 1314
06:32:55.067653 IP 99.181.68.229.1935 > 10.8.1.11.44458: Flags [.], ack 137694, win 126, options [nop,nop,TS val 3641665082 ecr 2573298203], length 0
06:32:55.097058 IP 10.8.1.11.44458 > 99.181.68.229.1935: Flags [.], seq 146746:148060, ack 1, win 501, options [nop,nop,TS val 2573298600 ecr 3641665082], length 1314
06:32:55.133242 IP 99.181.68.229.1935 > 10.8.1.11.44458: Flags [.], ack 140322, win 126, options [nop,nop,TS val 3641665147 ecr 2573298298], length 0
06:32:55.148505 IP 10.8.1.11.44458 > 99.181.68.229.1935: Flags [.], seq 148060:149374, ack 1, win 501, options [nop,nop,TS val 2573298652 ecr 3641665147], length 1314
06:32:55.197352 IP 99.181.68.229.1935 > 10.8.1.11.44458: Flags [.], ack 141490, win 126, options [nop,nop,TS val 3641665211 ecr 2573298396], length 0
06:32:55.197387 IP 10.8.1.11.44458 > 99.181.68.229.1935: Flags [P.], seq 149374:150440, ack 1, win 501, options [nop,nop,TS val 2573298701 ecr 3641665211], length 1066
06:32:55.231461 IP 10.8.1.11.44458 > 99.181.68.229.1935: Flags [.], seq 150440:151754, ack 1, win 501, options [nop,nop,TS val 2573298735 ecr 3641665211], length 1314
06:32:55.265086 IP 10.8.1.11.44458 > 99.181.68.229.1935: Flags [.], seq 151754:153068, ack 1, win 501, options [nop,nop,TS val 2573298768 ecr 3641665211], length 1314
06:32:55.266653 IP 99.181.68.229.1935 > 10.8.1.11.44458: Flags [.], ack 144118, win 126, options [nop,nop,TS val 3641665281 ecr 2573298431], length 0
06:32:55.320068 IP 10.8.1.11.44458 > 99.181.68.229.1935: Flags [.], seq 153068:154382, ack 1, win 501, options [nop,nop,TS val 2573298823 ecr 3641665281], length 1314
06:32:55.361584 IP 10.8.1.11.44458 > 99.181.68.229.1935: Flags [.], seq 154382:155696, ack 1, win 501, options [nop,nop,TS val 2573298865 ecr 3641665281], length 1314
06:32:55.368064 IP 99.181.68.229.1935 > 10.8.1.11.44458: Flags [.], ack 146746, win 126, options [nop,nop,TS val 3641665382 ecr 2573298523], length 0
06:32:55.395745 IP 10.8.1.11.44458 > 99.181.68.229.1935: Flags [.], seq 155696:157010, ack 1, win 501, options [nop,nop,TS val 2573298899 ecr 3641665382], length 1314
06:32:55.448250 IP 10.8.1.11.44458 > 99.181.68.229.1935: Flags [.], seq 157010:158324, ack 1, win 501, options [nop,nop,TS val 2573298952 ecr 3641665382], length 1314
06:32:55.453083 IP 99.181.68.229.1935 > 10.8.1.11.44458: Flags [.], ack 149374, win 126, options [nop,nop,TS val 3641665467 ecr 2573298600], length 0
06:32:55.491350 IP 10.8.1.11.44458 > 99.181.68.229.1935: Flags [.], seq 158324:159638, ack 1, win 501, options [nop,nop,TS val 2573298995 ecr 3641665467], length 1314
06:32:55.501959 IP 99.181.68.229.1935 > 10.8.1.11.44458: Flags [.], ack 150440, win 126, options [nop,nop,TS val 3641665516 ecr 2573298701], length 0
06:32:55.501991 IP 10.8.1.11.44458 > 99.181.68.229.1935: Flags [P.], seq 159638:160343, ack 1, win 501, options [nop,nop,TS val 2573299005 ecr 3641665516], length 705
06:32:55.555124 IP 10.8.1.11.44458 > 99.181.68.229.1935: Flags [.], seq 160343:161657, ack 1, win 501, options [nop,nop,TS val 2573299058 ecr 3641665516], length 1314
06:32:55.569306 IP 99.181.68.229.1935 > 10.8.1.11.44458: Flags [.], ack 153068, win 126, options [nop,nop,TS val 3641665584 ecr 2573298735], length 0
06:32:55.576344 IP 10.8.1.11.44458 > 99.181.68.229.1935: Flags [.], seq 161657:162971, ack 1, win 501, options [nop,nop,TS val 2573299080 ecr 3641665584], length 1314
06:32:55.628968 IP 10.8.1.11.44458 > 99.181.68.229.1935: Flags [.], seq 162971:164285, ack 1, win 501, options [nop,nop,TS val 2573299132 ecr 3641665584], length 1314
06:32:55.666069 IP 99.181.68.229.1935 > 10.8.1.11.44458: Flags [.], ack 155696, win 126, options [nop,nop,TS val 3641665680 ecr 2573298823], length 0
06:32:55.683062 IP 10.8.1.11.44458 > 99.181.68.229.1935: Flags [.], seq 164285:165599, ack 1, win 501, options [nop,nop,TS val 2573299186 ecr 3641665680], length 1314
06:32:55.725731 IP 10.8.1.11.44458 > 99.181.68.229.1935: Flags [.], seq 165599:166913, ack 1, win 501, options [nop,nop,TS val 2573299229 ecr 3641665680], length 1314
06:32:55.752892 IP 99.181.68.229.1935 > 10.8.1.11.44458: Flags [.], ack 158324, win 126, options [nop,nop,TS val 3641665767 ecr 2573298899], length 0
06:32:55.762614 IP 10.8.1.11.44458 > 99.181.68.229.1935: Flags [.], seq 166913:168227, ack 1, win 501, options [nop,nop,TS val 2573299266 ecr 3641665767], length 1314
06:32:55.806202 IP 99.181.68.229.1935 > 10.8.1.11.44458: Flags [.], ack 160343, win 126, options [nop,nop,TS val 3641665821 ecr 2573298995], length 0
06:32:55.806215 IP 10.8.1.11.44458 > 99.181.68.229.1935: Flags [P.], seq 168227:169292, ack 1, win 501, options [nop,nop,TS val 2573299310 ecr 3641665821], length 1065
06:32:55.860554 IP 10.8.1.11.44458 > 99.181.68.229.1935: Flags [.], seq 169292:170606, ack 1, win 501, options [nop,nop,TS val 2573299364 ecr 3641665821], length 1314
06:32:55.880649 IP 99.181.68.229.1935 > 10.8.1.11.44458: Flags [.], ack 162971, win 126, options [nop,nop,TS val 3641665895 ecr 2573299058], length 0
06:32:55.894822 IP 10.8.1.11.44458 > 99.181.68.229.1935: Flags [.], seq 170606:171920, ack 1, win 501, options [nop,nop,TS val 2573299398 ecr 3641665895], length 1314
06:32:55.937950 IP 10.8.1.11.44458 > 99.181.68.229.1935: Flags [.], seq 171920:173234, ack 1, win 501, options [nop,nop,TS val 2573299441 ecr 3641665895], length 1314
06:32:55.987416 IP 99.181.68.229.1935 > 10.8.1.11.44458: Flags [.], ack 165599, win 126, options [nop,nop,TS val 3641666002 ecr 2573299132], length 0
06:32:55.994712 IP 10.8.1.11.44458 > 99.181.68.229.1935: Flags [.], seq 173234:174548, ack 1, win 501, options [nop,nop,TS val 2573299498 ecr 3641666002], length 1314
06:32:56.029772 IP 10.8.1.11.44458 > 99.181.68.229.1935: Flags [.], seq 174548:175862, ack 1, win 501, options [nop,nop,TS val 2573299533 ecr 3641666002], length 1314
06:32:56.065707 IP 10.8.1.11.44458 > 99.181.68.229.1935: Flags [.], seq 175862:177176, ack 1, win 501, options [nop,nop,TS val 2573299569 ecr 3641666002], length 1314
06:32:56.067391 IP 99.181.68.229.1935 > 10.8.1.11.44458: Flags [.], ack 168227, win 126, options [nop,nop,TS val 3641666081 ecr 2573299229], length 0
06:32:56.111119 IP 99.181.68.229.1935 > 10.8.1.11.44458: Flags [.], ack 169292, win 126, options [nop,nop,TS val 3641666125 ecr 2573299310], length 0
06:32:56.111132 IP 10.8.1.11.44458 > 99.181.68.229.1935: Flags [P.], seq 177176:178244, ack 1, win 501, options [nop,nop,TS val 2573299614 ecr 3641666125], length 1068
06:32:56.164188 IP 10.8.1.11.44458 > 99.181.68.229.1935: Flags [.], seq 178244:179558, ack 1, win 501, options [nop,nop,TS val 2573299667 ecr 3641666125], length 1314
06:32:56.198057 IP 10.8.1.11.44458 > 99.181.68.229.1935: Flags [.], seq 179558:180872, ack 1, win 501, options [nop,nop,TS val 2573299701 ecr 3641666125], length 1314
06:32:56.200982 IP 99.181.68.229.1935 > 10.8.1.11.44458: Flags [.], ack 171920, win 126, options [nop,nop,TS val 3641666213 ecr 2573299364], length 0
06:32:56.236471 IP 10.8.1.11.44458 > 99.181.68.229.1935: Flags [.], seq 180872:182186, ack 1, win 501, options [nop,nop,TS val 2573299740 ecr 3641666213], length 1314
06:32:56.294907 IP 10.8.1.11.44458 > 99.181.68.229.1935: Flags [.], seq 182186:183500, ack 1, win 501, options [nop,nop,TS val 2573299798 ecr 3641666213], length 1314
06:32:56.299045 IP 99.181.68.229.1935 > 10.8.1.11.44458: Flags [.], ack 174548, win 126, options [nop,nop,TS val 3641666313 ecr 2573299441], length 0
06:32:56.328654 IP 10.8.1.11.44458 > 99.181.68.229.1935: Flags [.], seq 183500:184814, ack 1, win 501, options [nop,nop,TS val 2573299832 ecr 3641666313], length 1314
06:32:56.363883 IP 10.8.1.11.44458 > 99.181.68.229.1935: Flags [.], seq 184814:186128, ack 1, win 501, options [nop,nop,TS val 2573299867 ecr 3641666313], length 1314
06:32:56.370032 IP 99.181.68.229.1935 > 10.8.1.11.44458: Flags [.], ack 177176, win 126, options [nop,nop,TS val 3641666384 ecr 2573299533], length 0
06:32:56.415439 IP 99.181.68.229.1935 > 10.8.1.11.44458: Flags [.], ack 178244, win 126, options [nop,nop,TS val 3641666429 ecr 2573299614], length 0
06:32:56.415461 IP 10.8.1.11.44458 > 99.181.68.229.1935: Flags [P.], seq 186128:187205, ack 1, win 501, options [nop,nop,TS val 2573299919 ecr 3641666429], length 1077
06:32:56.464777 IP 10.8.1.11.44458 > 99.181.68.229.1935: Flags [.], seq 187205:188519, ack 1, win 501, options [nop,nop,TS val 2573299968 ecr 3641666429], length 1314
06:32:56.497958 IP 10.8.1.11.44458 > 99.181.68.229.1935: Flags [.], seq 188519:189833, ack 1, win 501, options [nop,nop,TS val 2573300001 ecr 3641666429], length 1314
06:32:56.505783 IP 99.181.68.229.1935 > 10.8.1.11.44458: Flags [.], ack 180872, win 126, options [nop,nop,TS val 3641666520 ecr 2573299667], length 0
06:32:56.535189 IP 10.8.1.11.44458 > 99.181.68.229.1935: Flags [.], seq 189833:191147, ack 1, win 501, options [nop,nop,TS val 2573300038 ecr 3641666520], length 1314
06:32:56.594827 IP 10.8.1.11.44458 > 99.181.68.229.1935: Flags [.], seq 191147:192461, ack 1, win 501, options [nop,nop,TS val 2573300098 ecr 3641666520], length 1314
06:32:56.599187 IP 99.181.68.229.1935 > 10.8.1.11.44458: Flags [.], ack 183500, win 126, options [nop,nop,TS val 3641666613 ecr 2573299740], length 0
06:32:56.627271 IP 10.8.1.11.44458 > 99.181.68.229.1935: Flags [.], seq 192461:193775, ack 1, win 501, options [nop,nop,TS val 2573300131 ecr 3641666613], length 1314
06:32:56.662886 IP 10.8.1.11.44458 > 99.181.68.229.1935: Flags [.], seq 193775:195089, ack 1, win 501, options [nop,nop,TS val 2573300166 ecr 3641666613], length 1314
06:32:56.668250 IP 99.181.68.229.1935 > 10.8.1.11.44458: Flags [.], ack 186128, win 126, options [nop,nop,TS val 3641666682 ecr 2573299832], length 0
06:32:56.719928 IP 99.181.68.229.1935 > 10.8.1.11.44458: Flags [.], ack 187205, win 126, options [nop,nop,TS val 3641666734 ecr 2573299919], length 0
06:32:56.719964 IP 10.8.1.11.44458 > 99.181.68.229.1935: Flags [P.], seq 195089:196150, ack 1, win 501, options [nop,nop,TS val 2573300223 ecr 3641666734], length 1061
06:32:56.764589 IP 10.8.1.11.44458 > 99.181.68.229.1935: Flags [.], seq 196150:197464, ack 1, win 501, options [nop,nop,TS val 2573300268 ecr 3641666734], length 1314
06:32:56.795514 IP 10.8.1.11.44458 > 99.181.68.229.1935: Flags [.], seq 197464:198778, ack 1, win 501, options [nop,nop,TS val 2573300299 ecr 3641666734], length 1314
06:32:56.803414 IP 99.181.68.229.1935 > 10.8.1.11.44458: Flags [.], ack 189833, win 126, options [nop,nop,TS val 3641666817 ecr 2573299968], length 0
06:32:56.833950 IP 10.8.1.11.44458 > 99.181.68.229.1935: Flags [.], seq 198778:200092, ack 1, win 501, options [nop,nop,TS val 2573300337 ecr 3641666817], length 1314
06:32:56.897920 IP 10.8.1.11.44458 > 99.181.68.229.1935: Flags [.], seq 200092:201406, ack 1, win 501, options [nop,nop,TS val 2573300401 ecr 3641666817], length 1314
06:32:56.899509 IP 99.181.68.229.1935 > 10.8.1.11.44458: Flags [.], ack 192461, win 126, options [nop,nop,TS val 3641666914 ecr 2573300038], length 0
06:32:56.929872 IP 10.8.1.11.44458 > 99.181.68.229.1935: Flags [.], seq 201406:202720, ack 1, win 501, options [nop,nop,TS val 2573300433 ecr 3641666914], length 1314
06:32:56.964737 IP 10.8.1.11.44458 > 99.181.68.229.1935: Flags [.], seq 202720:204034, ack 1, win 501, options [nop,nop,TS val 2573300468 ecr 3641666914], length 1314
