15:59:37.286734 IP 10.8.2.2.34924 > 52.223.243.196.1935: Flags [.], seq 1998465782:1998467096, ack 3022205018, win 501, options [nop,nop,TS val 1436463792 ecr 3213068651], length 1314
15:59:37.294098 IP 52.223.243.196.1935 > 10.8.2.2.34924: Flags [.], ack 4294957669, win 126, options [nop,nop,TS val 3213068727 ecr 1436463388], length 0
15:59:37.346614 IP 10.8.2.2.34924 > 52.223.243.196.1935: Flags [.], seq 1314:2628, ack 1, win 501, options [nop,nop,TS val 1436463852 ecr 3213068727], length 1314
15:59:37.382272 IP 10.8.2.2.34924 > 52.223.243.196.1935: Flags [.], seq 2628:3942, ack 1, win 501, options [nop,nop,TS val 1436463888 ecr 3213068727], length 1314
15:59:37.386871 IP 52.223.243.196.1935 > 10.8.2.2.34924: Flags [.], ack 4294960297, win 126, options [nop,nop,TS val 3213068819 ecr 1436463489], length 0
15:59:37.411258 IP 52.223.243.196.1935 > 10.8.2.2.34924: Flags [.], ack 4294960726, win 126, options [nop,nop,TS val 3213068844 ecr 1436463547], length 0
15:59:37.411288 IP 10.8.2.2.34924 > 52.223.243.196.1935: Flags [P.], seq 3942:4356, ack 1, win 501, options [nop,nop,TS val 1436463917 ecr 3213068844], length 414
15:59:37.449782 IP 10.8.2.2.34924 > 52.223.243.196.1935: Flags [.], seq 4356:5670, ack 1, win 501, options [nop,nop,TS val 1436463955 ecr 3213068844], length 1314
15:59:37.481308 IP 10.8.2.2.34924 > 52.223.243.196.1935: Flags [.], seq 5670:6984, ack 1, win 501, options [nop,nop,TS val 1436463987 ecr 3213068844], length 1314
15:59:37.487808 IP 52.223.243.196.1935 > 10.8.2.2.34924: Flags [.], ack 4294963354, win 126, options [nop,nop,TS val 3213068920 ecr 1436463589], length 0
15:59:37.520960 IP 10.8.2.2.34924 > 52.223.243.196.1935: Flags [.], seq 6984:8298, ack 1, win 501, options [nop,nop,TS val 1436464027 ecr 3213068920], length 1314
15:59:37.581579 IP 10.8.2.2.34924 > 52.223.243.196.1935: Flags [.], seq 8298:9612, ack 1, win 501, options [nop,nop,TS val 1436464087 ecr 3213068920], length 1314
15:59:37.584650 IP 52.223.243.196.1935 > 10.8.2.2.34924: Flags [.], ack 4294965982, win 126, options [nop,nop,TS val 3213069017 ecr 1436463665], length 0
15:59:37.615521 IP 10.8.2.2.34924 > 52.223.243.196.1935: Flags [.], seq 9612:10926, ack 1, win 501, options [nop,nop,TS val 1436464121 ecr 3213069017], length 1314
15:59:37.648737 IP 10.8.2.2.34924 > 52.223.243.196.1935: Flags [.], seq 10926:12240, ack 1, win 501, options [nop,nop,TS val 1436464154 ecr 3213069017], length 1314
15:59:37.658249 IP 52.223.243.196.1935 > 10.8.2.2.34924: Flags [.], ack 1314, win 126, options [nop,nop,TS val 3213069089 ecr 1436463755], length 0
15:59:37.713231 IP 10.8.2.2.34924 > 52.223.243.196.1935: Flags [.], seq 12240:13554, ack 1, win 501, options [nop,nop,TS val 1436464219 ecr 3213069089], length 1314
15:59:37.746619 IP 10.8.2.2.34924 > 52.223.243.196.1935: Flags [.], seq 13554:14868, ack 1, win 501, options [nop,nop,TS val 1436464252 ecr 3213069089], length 1314
15:59:37.752629 IP 52.223.243.196.1935 > 10.8.2.2.34924: Flags [.], ack 3942, win 126, options [nop,nop,TS val 3213069185 ecr 1436463852], length 0
15:59:37.780133 IP 10.8.2.2.34924 > 52.223.243.196.1935: Flags [.], seq 14868:16182, ack 1, win 501, options [nop,nop,TS val 1436464286 ecr 3213069185], length 1314
15:59:37.780960 IP 52.223.243.196.1935 > 10.8.2.2.34924: Flags [.], ack 4356, win 126, options [nop,nop,TS val 3213069214 ecr 1436463917], length 0
15:59:37.780969 IP 10.8.2.2.34924 > 52.223.243.196.1935: Flags [P.], seq 16182:16240, ack 1, win 501, options [nop,nop,TS val 1436464287 ecr 3213069214], length 58
15:59:37.848623 IP 10.8.2.2.34924 > 52.223.243.196.1935: Flags [.], seq 16240:17554, ack 1, win 501, options [nop,nop,TS val 1436464354 ecr 3213069214], length 1314
15:59:37.851178 IP 52.223.243.196.1935 > 10.8.2.2.34924: Flags [.], ack 6984, win 126, options [nop,nop,TS val 3213069284 ecr 1436463955], length 0
15:59:37.880748 IP 10.8.2.2.34924 > 52.223.243.196.1935: Flags [.], seq 17554:18868, ack 1, win 501, options [nop,nop,TS val 1436464386 ecr 3213069284], length 1314
15:59:37.914595 IP 10.8.2.2.34924 > 52.223.243.196.1935: Flags [.], seq 18868:20182, ack 1, win 501, options [nop,nop,TS val 1436464420 ecr 3213069284], length 1314
15:59:37.951870 IP 52.223.243.196.1935 > 10.8.2.2.34924: Flags [.], ack 9612, win 126, options [nop,nop,TS val 3213069384 ecr 1436464027], length 0
15:59:37.980969 IP 10.8.2.2.34924 > 52.223.243.196.1935: Flags [.], seq 20182:21496, ack 1, win 501, options [nop,nop,TS val 1436464487 ecr 3213069384], length 1314
15:59:38.014934 IP 10.8.2.2.34924 > 52.223.243.196.1935: Flags [.], seq 21496:22810, ack 1, win 501, options [nop,nop,TS val 1436464521 ecr 3213069384], length 1314
15:59:38.018673 IP 52.223.243.196.1935 > 10.8.2.2.34924: Flags [.], ack 12240, win 126, options [nop,nop,TS val 3213069451 ecr 1436464121], length 0
15:59:38.048901 IP 10.8.2.2.34924 > 52.223.243.196.1935: Flags [.], seq 22810:24124, ack 1, win 501, options [nop,nop,TS val 1436464555 ecr 3213069451], length 1314
15:59:38.116626 IP 10.8.2.2.34924 > 52.223.243.196.1935: Flags [.], seq 24124:25438, ack 1, win 501, options [nop,nop,TS val 1436464622 ecr 3213069451], length 1314
15:59:38.116992 IP 52.223.243.196.1935 > 10.8.2.2.34924: Flags [.], ack 14868, win 126, options [nop,nop,TS val 3213069549 ecr 1436464219], length 0
15:59:38.148088 IP 10.8.2.2.34924 > 52.223.243.196.1935: Flags [.], seq 25438:26752, ack 1, win 501, options [nop,nop,TS val 1436464654 ecr 3213069549], length 1314
15:59:38.150628 IP 52.223.243.196.1935 > 10.8.2.2.34924: Flags [.], ack 16240, win 126, options [nop,nop,TS val 3213069583 ecr 1436464286], length 0
15:59:38.150649 IP 10.8.2.2.34924 > 52.223.243.196.1935: Flags [P.], seq 26752:27165, ack 1, win 501, options [nop,nop,TS val 1436464656 ecr 3213069583], length 413
15:59:38.217529 IP 10.8.2.2.34924 > 52.223.243.196.1935: Flags [.], seq 27165:28479, ack 1, win 501, options [nop,nop,TS val 1436464723 ecr 3213069583], length 1314
15:59:38.250763 IP 10.8.2.2.34924 > 52.223.243.196.1935: Flags [.], seq 28479:29793, ack 1, win 501, options [nop,nop,TS val 1436464756 ecr 3213069583], length 1314
15:59:38.251010 IP 52.223.243.196.1935 > 10.8.2.2.34924: Flags [.], ack 18868, win 126, options [nop,nop,TS val 3213069684 ecr 1436464354], length 0
15:59:38.282470 IP 10.8.2.2.34924 > 52.223.243.196.1935: Flags [.], seq 29793:31107, ack 1, win 501, options [nop,nop,TS val 1436464788 ecr 3213069684], length 1314
15:59:38.345661 IP 52.223.243.196.1935 > 10.8.2.2.34924: Flags [.], ack 20182, win 126, options [nop,nop,TS val 3213069778 ecr 1436464420], length 0
15:59:38.348189 IP 10.8.2.2.34924 > 52.223.243.196.1935: Flags [.], seq 31107:32421, ack 1, win 501, options [nop,nop,TS val 1436464854 ecr 3213069778], length 1314
15:59:38.384855 IP 52.223.243.196.1935 > 10.8.2.2.34924: Flags [.], ack 22810, win 126, options [nop,nop,TS val 3213069817 ecr 1436464487], length 0
15:59:38.386767 IP 10.8.2.2.34924 > 52.223.243.196.1935: Flags [.], seq 32421:33735, ack 1, win 501, options [nop,nop,TS val 1436464892 ecr 3213069817], length 1314
15:59:38.415935 IP 10.8.2.2.34924 > 52.223.243.196.1935: Flags [.], seq 33735:35049, ack 1, win 501, options [nop,nop,TS val 1436464922 ecr 3213069817], length 1314
15:59:38.484253 IP 10.8.2.2.34924 > 52.223.243.196.1935: Flags [.], seq 35049:36363, ack 1, win 501, options [nop,nop,TS val 1436464990 ecr 3213069817], length 1314
15:59:38.487103 IP 52.223.243.196.1935 > 10.8.2.2.34924: Flags [.], ack 25438, win 126, options [nop,nop,TS val 3213069920 ecr 1436464555], length 0
15:59:38.517734 IP 10.8.2.2.34924 > 52.223.243.196.1935: Flags [.], seq 36363:37677, ack 1, win 501, options [nop,nop,TS val 1436465023 ecr 3213069920], length 1314
15:59:38.520375 IP 52.223.243.196.1935 > 10.8.2.2.34924: Flags [.], ack 27165, win 126, options [nop,nop,TS val 3213069953 ecr 1436464654], length 0
15:59:38.520406 IP 10.8.2.2.34924 > 52.223.243.196.1935: Flags [P.], seq 37677:38103, ack 1, win 501, options [nop,nop,TS val 1436465026 ecr 3213069953], length 426
15:59:38.583795 IP 10.8.2.2.34924 > 52.223.243.196.1935: Flags [.], seq 38103:39417, ack 1, win 501, options [nop,nop,TS val 1436465089 ecr 3213069953], length 1314
15:59:38.616987 IP 10.8.2.2.34924 > 52.223.243.196.1935: Flags [.], seq 39417:40731, ack 1, win 501, options [nop,nop,TS val 1436465123 ecr 3213069953], length 1314
15:59:38.620845 IP 52.223.243.196.1935 > 10.8.2.2.34924: Flags [.], ack 29793, win 126, options [nop,nop,TS val 3213070054 ecr 1436464723], length 0
15:59:38.649399 IP 10.8.2.2.34924 > 52.223.243.196.1935: Flags [.], seq 40731:42045, ack 1, win 501, options [nop,nop,TS val 1436465155 ecr 3213070054], length 1314
15:59:38.713857 IP 52.223.243.196.1935 > 10.8.2.2.34924: Flags [.], ack 31107, win 126, options [nop,nop,TS val 3213070146 ecr 1436464788], length 0
15:59:38.714517 IP 10.8.2.2.34924 > 52.223.243.196.1935: Flags [.], seq 42045:43359, ack 1, win 501, options [nop,nop,TS val 1436465220 ecr 3213070146], length 1314
15:59:38.751757 IP 10.8.2.2.34924 > 52.223.243.196.1935: Flags [.], seq 43359:44673, ack 1, win 501, options [nop,nop,TS val 1436465257 ecr 3213070146], length 1314
15:59:38.757138 IP 52.223.243.196.1935 > 10.8.2.2.34924: Flags [.], ack 33735, win 126, options [nop,nop,TS val 3213070190 ecr 1436464854], length 0
15:59:38.782622 IP 10.8.2.2.34924 > 52.223.243.196.1935: Flags [.], seq 44673:45987, ack 1, win 501, options [nop,nop,TS val 1436465288 ecr 3213070190], length 1314
15:59:38.849268 IP 10.8.2.2.34924 > 52.223.243.196.1935: Flags [.], seq 45987:47301, ack 1, win 501, options [nop,nop,TS val 1436465355 ecr 3213070190], length 1314
15:59:38.854217 IP 52.223.243.196.1935 > 10.8.2.2.34924: Flags [.], ack 36363, win 126, options [nop,nop,TS val 3213070287 ecr 1436464922], length 0
15:59:38.884048 IP 10.8.2.2.34924 > 52.223.243.196.1935: Flags [.], seq 47301:48615, ack 1, win 501, options [nop,nop,TS val 1436465390 ecr 3213070287], length 1314
15:59:38.890315 IP 52.223.243.196.1935 > 10.8.2.2.34924: Flags [.], ack 38103, win 126, options [nop,nop,TS val 3213070323 ecr 1436465023], length 0
15:59:38.890337 IP 10.8.2.2.34924 > 52.223.243.196.1935: Flags [P.], seq 48615:49132, ack 1, win 501, options [nop,nop,TS val 1436465396 ecr 3213070323], length 517
15:59:38.948972 IP 10.8.2.2.34924 > 52.223.243.196.1935: Flags [.], seq 49132:50446, ack 1, win 501, options [nop,nop,TS val 1436465455 ecr 3213070323], length 1314
15:59:38.984919 IP 10.8.2.2.34924 > 52.223.243.196.1935: Flags [.], seq 50446:51760, ack 1, win 501, options [nop,nop,TS val 1436465491 ecr 3213070323], length 1314
15:59:38.987143 IP 52.223.243.196.1935 > 10.8.2.2.34924: Flags [.], ack 40731, win 126, options [nop,nop,TS val 3213070420 ecr 1436465089], length 0
15:59:39.018469 IP 10.8.2.2.34924 > 52.223.243.196.1935: Flags [.], seq 51760:53074, ack 1, win 501, options [nop,nop,TS val 1436465524 ecr 3213070420], length 1314
15:59:39.081675 IP 52.223.243.196.1935 > 10.8.2.2.34924: Flags [.], ack 42045, win 126, options [nop,nop,TS val 3213070514 ecr 1436465155], length 0
15:59:39.081812 IP 10.8.2.2.34924 > 52.223.243.196.1935: Flags [.], seq 53074:54388, ack 1, win 501, options [nop,nop,TS val 1436465588 ecr 3213070514], length 1314
15:59:39.115584 IP 10.8.2.2.34924 > 52.223.243.196.1935: Flags [.], seq 54388:55702, ack 1, win 501, options [nop,nop,TS val 1436465621 ecr 3213070514], length 1314
15:59:39.122508 IP 52.223.243.196.1935 > 10.8.2.2.34924: Flags [.], ack 44673, win 126, options [nop,nop,TS val 3213070555 ecr 1436465220], length 0
15:59:39.149520 IP 10.8.2.2.34924 > 52.223.243.196.1935: Flags [.], seq 55702:57016, ack 1, win 501, options [nop,nop,TS val 1436465655 ecr 3213070555], length 1314
15:59:39.216503 IP 10.8.2.2.34924 > 52.223.243.196.1935: Flags [.], seq 57016:58330, ack 1, win 501, options [nop,nop,TS val 1436465722 ecr 3213070555], length 1314
15:59:39.219507 IP 52.223.243.196.1935 > 10.8.2.2.34924: Flags [.], ack 47301, win 126, options [nop,nop,TS val 3213070652 ecr 1436465288], length 0
15:59:39.248996 IP 10.8.2.2.34924 > 52.223.243.196.1935: Flags [.], seq 58330:59644, ack 1, win 501, options [nop,nop,TS val 1436465755 ecr 3213070652], length 1314
15:59:39.260302 IP 52.223.243.196.1935 > 10.8.2.2.34924: Flags [.], ack 49132, win 126, options [nop,nop,TS val 3213070693 ecr 1436465390], length 0
15:59:39.260341 IP 10.8.2.2.34924 > 52.223.243.196.1935: Flags [P.], seq 59644:60066, ack 1, win 501, options [nop,nop,TS val 1436465766 ecr 3213070693], length 422
15:59:39.314781 IP 10.8.2.2.34924 > 52.223.243.196.1935: Flags [.], seq 60066:61380, ack 1, win 501, options [nop,nop,TS val 1436465820 ecr 3213070693], length 1314
15:59:39.348350 IP 10.8.2.2.34924 > 52.223.243.196.1935: Flags [.], seq 61380:62694, ack 1, win 501, options [nop,nop,TS val 1436465854 ecr 3213070693], length 1314
15:59:39.355115 IP 52.223.243.196.1935 > 10.8.2.2.34924: Flags [.], ack 51760, win 126, options [nop,nop,TS val 3213070788 ecr 1436465455], length 0
15:59:39.383358 IP 10.8.2.2.34924 > 52.223.243.196.1935: Flags [.], seq 62694:64008, ack 1, win 501, options [nop,nop,TS val 1436465889 ecr 3213070788], length 1314
15:59:39.450975 IP 10.8.2.2.34924 > 52.223.243.196.1935: Flags [.], seq 64008:65322, ack 1, win 501, options [nop,nop,TS val 1436465957 ecr 3213070788], length 1314
15:59:39.451800 IP 52.223.243.196.1935 > 10.8.2.2.34924: Flags [.], ack 54388, win 126, options [nop,nop,TS val 3213070884 ecr 1436465524], length 0
15:59:39.482198 IP 10.8.2.2.34924 > 52.223.243.196.1935: Flags [.], seq 65322:66636, ack 1, win 501, options [nop,nop,TS val 1436465988 ecr 3213070884], length 1314
15:59:39.516427 IP 10.8.2.2.34924 > 52.223.243.196.1935: Flags [.], seq 66636:67950, ack 1, win 501, options [nop,nop,TS val 1436466022 ecr 3213070884], length 1314
15:59:39.519662 IP 52.223.243.196.1935 > 10.8.2.2.34924: Flags [.], ack 57016, win 126, options [nop,nop,TS val 3213070952 ecr 1436465621], length 0
15:59:39.584185 IP 10.8.2.2.34924 > 52.223.243.196.1935: Flags [.], seq 67950:69264, ack 1, win 501, options [nop,nop,TS val 1436466090 ecr 3213070952], length 1314
15:59:39.615845 IP 10.8.2.2.34924 > 52.223.243.196.1935: Flags [.], seq 69264:70578, ack 1, win 501, options [nop,nop,TS val 1436466122 ecr 3213070952], length 1314
15:59:39.618910 IP 52.223.243.196.1935 > 10.8.2.2.34924: Flags [.], ack 59644, win 126, options [nop,nop,TS val 3213071052 ecr 1436465722], length 0
15:59:39.630307 IP 52.223.243.196.1935 > 10.8.2.2.34924: Flags [.], ack 60066, win 126, options [nop,nop,TS val 3213071063 ecr 1436465766], length 0
15:59:39.630329 IP 10.8.2.2.34924 > 52.223.243.196.1935: Flags [P.], seq 70578:70998, ack 1, win 501, options [nop,nop,TS val 1436466136 ecr 3213071063], length 420
15:59:39.683303 IP 10.8.2.2.34924 > 52.223.243.196.1935: Flags [.], seq 70998:72312, ack 1, win 501, options [nop,nop,TS val 1436466189 ecr 3213071063], length 1314
15:59:39.713234 IP 10.8.2.2.34924 > 52.223.243.196.1935: Flags [.], seq 72312:73626, ack 1, win 501, options [nop,nop,TS val 1436466219 ecr 3213071063], length 1314
15:59:39.718272 IP 52.223.243.196.1935 > 10.8.2.2.34924: Flags [.], ack 62694, win 126, options [nop,nop,TS val 3213071151 ecr 1436465820], length 0
15:59:39.747218 IP 10.8.2.2.34924 > 52.223.243.196.1935: Flags [.], seq 73626:74940, ack 1, win 501, options [nop,nop,TS val 1436466253 ecr 3213071151], length 1314
15:59:39.817314 IP 10.8.2.2.34924 > 52.223.243.196.1935: Flags [.], seq 74940:76254, ack 1, win 501, options [nop,nop,TS val 1436466323 ecr 3213071151], length 1314
15:59:39.821369 IP 52.223.243.196.1935 > 10.8.2.2.34924: Flags [.], ack 65322, win 126, options [nop,nop,TS val 3213071254 ecr 1436465889], length 0
15:59:39.850752 IP 10.8.2.2.34924 > 52.223.243.196.1935: Flags [.], seq 76254:77568, ack 1, win 501, options [nop,nop,TS val 1436466356 ecr 3213071254], length 1314
15:59:39.881682 IP 10.8.2.2.34924 > 52.223.243.196.1935: Flags [.], seq 77568:78882, ack 1, win 501, options [nop,nop,TS val 1436466387 ecr 3213071254], length 1314
15:59:39.886636 IP 52.223.243.196.1935 > 10.8.2.2.34924: Flags [.], ack 67950, win 126, options [nop,nop,TS val 3213071319 ecr 1436465988], length 0
15:59:39.950798 IP 10.8.2.2.34924 > 52.223.243.196.1935: Flags [.], seq 78882:80196, ack 1, win 501, options [nop,nop,TS val 1436466456 ecr 3213071319], length 1314
15:59:39.983913 IP 10.8.2.2.34924 > 52.223.243.196.1935: Flags [.], seq 80196:81510, ack 1, win 501, options [nop,nop,TS val 1436466490 ecr 3213071319], length 1314
15:59:39.985708 IP 52.223.243.196.1935 > 10.8.2.2.34924: Flags [.], ack 70578, win 126, options [nop,nop,TS val 3213071418 ecr 1436466090], length 0
15:59:40.000958 IP 52.223.243.196.1935 > 10.8.2.2.34924: Flags [.], ack 70998, win 126, options [nop,nop,TS val 3213071434 ecr 1436466136], length 0
15:59:40.000991 IP 10.8.2.2.34924 > 52.223.243.196.1935: Flags [P.], seq 81510:82023, ack 1, win 501, options [nop,nop,TS val 1436466507 ecr 3213071434], length 513
15:59:40.047003 IP 10.8.2.2.34924 > 52.223.243.196.1935: Flags [.], seq 82023:83337, ack 1, win 501, options [nop,nop,TS val 1436466553 ecr 3213071434], length 1314
15:59:40.083297 IP 52.223.243.196.1935 > 10.8.2.2.34924: Flags [.], ack 73626, win 126, options [nop,nop,TS val 3213071516 ecr 1436466189], length 0
15:59:40.083357 IP 10.8.2.2.34924 > 52.223.243.196.1935: Flags [.], seq 83337:84651, ack 1, win 501, options [nop,nop,TS val 1436466589 ecr 3213071434], length 1314
15:59:40.126243 IP 10.8.2.2.34924 > 52.223.243.196.1935: Flags [.], seq 84651:85965, ack 1, win 501, options [nop,nop,TS val 1436466632 ecr 3213071516], length 1314
15:59:40.181931 IP 52.223.243.196.1935 > 10.8.2.2.34924: Flags [.], ack 74940, win 126, options [nop,nop,TS val 3213071614 ecr 1436466253], length 0
15:59:40.183933 IP 10.8.2.2.34924 > 52.223.243.196.1935: Flags [.], seq 85965:87279, ack 1, win 501, options [nop,nop,TS val 1436466690 ecr 3213071614], length 1314
15:59:40.217391 IP 10.8.2.2.34924 > 52.223.243.196.1935: Flags [.], seq 87279:88593, ack 1, win 501, options [nop,nop,TS val 1436466723 ecr 3213071614], length 1314
15:59:40.220684 IP 52.223.243.196.1935 > 10.8.2.2.34924: Flags [.], ack 77568, win 126, options [nop,nop,TS val 3213071653 ecr 1436466323], length 0
15:59:40.254882 IP 10.8.2.2.34924 > 52.223.243.196.1935: Flags [.], seq 88593:89907, ack 1, win 501, options [nop,nop,TS val 1436466761 ecr 3213071653], length 1314
15:59:40.313786 IP 10.8.2.2.34924 > 52.223.243.196.1935: Flags [.], seq 89907:91221, ack 1, win 501, options [nop,nop,TS val 1436466819 ecr 3213071653], length 1314
15:59:40.321036 IP 52.223.243.196.1935 > 10.8.2.2.34924: Flags [.], ack 80196, win 126, options [nop,nop,TS val 3213071754 ecr 1436466387], length 0
15:59:40.347541 IP 10.8.2.2.34924 > 52.223.243.196.1935: Flags [.], seq 91221:92535, ack 1, win 501, options [nop,nop,TS val 1436466853 ecr 3213071754], length 1314
15:59:40.370921 IP 52.223.243.196.1935 > 10.8.2.2.34924: Flags [.], ack 82023, win 126, options [nop,nop,TS val 3213071803 ecr 1436466490], length 0
15:59:40.370932 IP 10.8.2.2.34924 > 52.223.243.196.1935: Flags [P.], seq 92535:92966, ack 1, win 501, options [nop,nop,TS val 1436466877 ecr 3213071803], length 431
15:59:40.413988 IP 10.8.2.2.34924 > 52.223.243.196.1935: Flags [.], seq 92966:94280, ack 1, win 501, options [nop,nop,TS val 1436466920 ecr 3213071803], length 1314
15:59:40.450729 IP 10.8.2.2.34924 > 52.223.243.196.1935: Flags [.], seq 94280:95594, ack 1, win 501, options [nop,nop,TS val 1436466956 ecr 3213071803], length 1314
15:59:40.453354 IP 52.223.243.196.1935 > 10.8.2.2.34924: Flags [.], ack 84651, win 126, options [nop,nop,TS val 3213071886 ecr 1436466553], length 0
15:59:40.489439 IP 10.8.2.2.34924 > 52.223.243.196.1935: Flags [.], seq 95594:96908, ack 1, win 501, options [nop,nop,TS val 1436466995 ecr 3213071886], length 1314
15:59:40.549050 IP 10.8.2.2.34924 > 52.223.243.196.1935: Flags [.], seq 96908:98222, ack 1, win 501, options [nop,nop,TS val 1436467055 ecr 3213071886], length 1314
15:59:40.554269 IP 52.223.243.196.1935 > 10.8.2.2.34924: Flags [.], ack 87279, win 126, options [nop,nop,TS val 3213071987 ecr 1436466632], length 0
15:59:40.582429 IP 10.8.2.2.34924 > 52.223.243.196.1935: Flags [.], seq 98222:99536, ack 1, win 501, options [nop,nop,TS val 1436467088 ecr 3213071987], length 1314
15:59:40.617726 IP 10.8.2.2.34924 > 52.223.243.196.1935: Flags [.], seq 99536:100850, ack 1, win 501, options [nop,nop,TS val 1436467123 ecr 3213071987], length 1314
15:59:40.624809 IP 52.223.243.196.1935 > 10.8.2.2.34924: Flags [.], ack 89907, win 126, options [nop,nop,TS val 3213072058 ecr 1436466723], length 0
15:59:40.681486 IP 10.8.2.2.34924 > 52.223.243.196.1935: Flags [.], seq 100850:102164, ack 1, win 501, options [nop,nop,TS val 1436467187 ecr 3213072058], length 1314
15:59:40.717186 IP 10.8.2.2.34924 > 52.223.243.196.1935: Flags [.], seq 102164:103478, ack 1, win 501, options [nop,nop,TS val 1436467223 ecr 3213072058], length 1314
15:59:40.717897 IP 52.223.243.196.1935 > 10.8.2.2.34924: Flags [.], ack 92535, win 126, options [nop,nop,TS val 3213072151 ecr 1436466819], length 0
15:59:40.740753 IP 52.223.243.196.1935 > 10.8.2.2.34924: Flags [.], ack 92966, win 126, options [nop,nop,TS val 3213072173 ecr 1436466877], length 0
15:59:40.740786 IP 10.8.2.2.34924 > 52.223.243.196.1935: Flags [P.], seq 103478:103891, ack 1, win 501, options [nop,nop,TS val 1436467246 ecr 3213072173], length 413
15:59:40.779852 IP 10.8.2.2.34924 > 52.223.243.196.1935: Flags [.], seq 103891:105205, ack 1, win 501, options [nop,nop,TS val 1436467286 ecr 3213072173], length 1314
15:59:40.813729 IP 10.8.2.2.34924 > 52.223.243.196.1935: Flags [.], seq 105205:106519, ack 1, win 501, options [nop,nop,TS val 1436467319 ecr 3213072173], length 1314
15:59:40.820856 IP 52.223.243.196.1935 > 10.8.2.2.34924: Flags [.], ack 95594, win 126, options [nop,nop,TS val 3213072254 ecr 1436466920], length 0
15:59:40.852007 IP 10.8.2.2.34924 > 52.223.243.196.1935: Flags [.], seq 106519:107833, ack 1, win 501, options [nop,nop,TS val 1436467358 ecr 3213072254], length 1314
15:59:40.915778 IP 10.8.2.2.34924 > 52.223.243.196.1935: Flags [.], seq 107833:109147, ack 1, win 501, options [nop,nop,TS val 1436467421 ecr 3213072254], length 1314
15:59:40.919877 IP 52.223.243.196.1935 > 10.8.2.2.34924: Flags [.], ack 98222, win 126, options [nop,nop,TS val 3213072352 ecr 1436466995], length 0
15:59:40.948017 IP 10.8.2.2.34924 > 52.223.243.196.1935: Flags [.], seq 109147:110461, ack 1, win 501, options [nop,nop,TS val 1436467454 ecr 3213072352], length 1314
15:59:40.982873 IP 10.8.2.2.34924 > 52.223.243.196.1935: Flags [.], seq 110461:111775, ack 1, win 501, options [nop,nop,TS val 1436467489 ecr 3213072352], length 1314
15:59:40.987740 IP 52.223.243.196.1935 > 10.8.2.2.34924: Flags [.], ack 100850, win 126, options [nop,nop,TS val 3213072420 ecr 1436467088], length 0
15:59:41.046579 IP 10.8.2.2.34924 > 52.223.243.196.1935: Flags [.], seq 111775:113089, ack 1, win 501, options [nop,nop,TS val 1436467552 ecr 3213072420], length 1314
15:59:41.081026 IP 10.8.2.2.34924 > 52.223.243.196.1935: Flags [.], seq 113089:114403, ack 1, win 501, options [nop,nop,TS val 1436467587 ecr 3213072420], length 1314
15:59:41.087110 IP 52.223.243.196.1935 > 10.8.2.2.34924: Flags [.], ack 103478, win 126, options [nop,nop,TS val 3213072520 ecr 1436467187], length 0
15:59:41.110561 IP 52.223.243.196.1935 > 10.8.2.2.34924: Flags [.], ack 103891, win 126, options [nop,nop,TS val 3213072543 ecr 1436467246], length 0
15:59:41.110589 IP 10.8.2.2.34924 > 52.223.243.196.1935: Flags [P.], seq 114403:114928, ack 1, win 501, options [nop,nop,TS val 1436467616 ecr 3213072543], length 525
15:59:41.150880 IP 10.8.2.2.34924 > 52.223.243.196.1935: Flags [.], seq 114928:116242, ack 1, win 501, options [nop,nop,TS val 1436467657 ecr 3213072543], length 1314
15:59:41.183746 IP 52.223.243.196.1935 > 10.8.2.2.34924: Flags [.], ack 106519, win 126, options [nop,nop,TS val 3213072616 ecr 1436467286], length 0
15:59:41.183771 IP 10.8.2.2.34924 > 52.223.243.196.1935: Flags [.], seq 116242:117556, ack 1, win 501, options [nop,nop,TS val 1436467689 ecr 3213072543], length 1314
15:59:41.236171 IP 10.8.2.2.34924 > 52.223.243.196.1935: Flags [.], seq 117556:118870, ack 1, win 501, options [nop,nop,TS val 1436467742 ecr 3213072616], length 1314
15:59:41.283134 IP 10.8.2.2.34924 > 52.223.243.196.1935: Flags [.], seq 118870:120184, ack 1, win 501, options [nop,nop,TS val 1436467789 ecr 3213072616], length 1314
15:59:41.285504 IP 52.223.243.196.1935 > 10.8.2.2.34924: Flags [.], ack 109147, win 126, options [nop,nop,TS val 3213072718 ecr 1436467358], length 0
15:59:41.316484 IP 10.8.2.2.34924 > 52.223.243.196.1935: Flags [.], seq 120184:121498, ack 1, win 501, options [nop,nop,TS val 1436467822 ecr 3213072718], length 1314
15:59:41.353593 IP 52.223.243.196.1935 > 10.8.2.2.34924: Flags [.], ack 111775, win 126, options [nop,nop,TS val 3213072786 ecr 1436467454], length 0
15:59:41.364693 IP 10.8.2.2.34924 > 52.223.243.196.1935: Flags [.], seq 121498:122812, ack 1, win 501, options [nop,nop,TS val 1436467870 ecr 3213072786], length 1314
15:59:41.417470 IP 10.8.2.2.34924 > 52.223.243.196.1935: Flags [.], seq 122812:124126, ack 1, win 501, options [nop,nop,TS val 1436467923 ecr 3213072786], length 1314
15:59:41.450837 IP 10.8.2.2.34924 > 52.223.243.196.1935: Flags [.], seq 124126:125440, ack 1, win 501, options [nop,nop,TS val 1436467957 ecr 3213072786], length 1314
15:59:41.452380 IP 52.223.243.196.1935 > 10.8.2.2.34924: Flags [.], ack 114403, win 126, options [nop,nop,TS val 3213072884 ecr 1436467552], length 0
15:59:41.480756 IP 52.223.243.196.1935 > 10.8.2.2.34924: Flags [.], ack 114928, win 126, options [nop,nop,TS val 3213072913 ecr 1436467616], length 0
15:59:41.480799 IP 10.8.2.2.34924 > 52.223.243.196.1935: Flags [P.], seq 125440:125849, ack 1, win 501, options [nop,nop,TS val 1436467986 ecr 3213072913], length 409
15:59:41.517258 IP 10.8.2.2.34924 > 52.223.243.196.1935: Flags [.], seq 125849:127163, ack 1, win 501, options [nop,nop,TS val 1436468023 ecr 3213072913], length 1314
15:59:41.547936 IP 10.8.2.2.34924 > 52.223.243.196.1935: Flags [.], seq 127163:128477, ack 1, win 501, options [nop,nop,TS val 1436468054 ecr 3213072913], length 1314
15:59:41.554274 IP 52.223.243.196.1935 > 10.8.2.2.34924: Flags [.], ack 117556, win 126, options [nop,nop,TS val 3213072986 ecr 1436467657], length 0
15:59:41.600809 IP 10.8.2.2.34924 > 52.223.243.196.1935: Flags [.], seq 128477:129791, ack 1, win 501, options [nop,nop,TS val 1436468106 ecr 3213072986], length 1314
15:59:41.650094 IP 10.8.2.2.34924 > 52.223.243.196.1935: Flags [.], seq 129791:131105, ack 1, win 501, options [nop,nop,TS val 1436468156 ecr 3213072986], length 1314
15:59:41.653139 IP 52.223.243.196.1935 > 10.8.2.2.34924: Flags [.], ack 120184, win 126, options [nop,nop,TS val 3213073086 ecr 1436467742], length 0
15:59:41.686219 IP 10.8.2.2.34924 > 52.223.243.196.1935: Flags [.], seq 131105:132419, ack 1, win 501, options [nop,nop,TS val 1436468192 ecr 3213073086], length 1314
15:59:41.728713 IP 10.8.2.2.34924 > 52.223.243.196.1935: Flags [.], seq 132419:133733, ack 1, win 501, options [nop,nop,TS val 1436468234 ecr 3213073086], length 1314
15:59:41.734932 IP 52.223.243.196.1935 > 10.8.2.2.34924: Flags [.], ack 122812, win 126, options [nop,nop,TS val 3213073168 ecr 1436467822], length 0
15:59:41.782700 IP 10.8.2.2.34924 > 52.223.243.196.1935: Flags [.], seq 133733:135047, ack 1, win 501, options [nop,nop,TS val 1436468288 ecr 3213073168], length 1314
15:59:41.816997 IP 10.8.2.2.34924 > 52.223.243.196.1935: Flags [.], seq 135047:136361, ack 1, win 501, options [nop,nop,TS val 1436468323 ecr 3213073168], length 1314
15:59:41.821536 IP 52.223.243.196.1935 > 10.8.2.2.34924: Flags [.], ack 125440, win 126, options [nop,nop,TS val 3213073254 ecr 1436467923], length 0
15:59:41.853685 IP 52.223.243.196.1935 > 10.8.2.2.34924: Flags [.], ack 125849, win 126, options [nop,nop,TS val 3213073284 ecr 1436467986], length 0
15:59:41.853698 IP 10.8.2.2.34924 > 52.223.243.196.1935: Flags [P.], seq 136361:137638, ack 1, win 501, options [nop,nop,TS val 1436468359 ecr 3213073284], length 1277
15:59:41.917217 IP 10.8.2.2.34924 > 52.223.243.196.1935: Flags [.], seq 137638:138952, ack 1, win 501, options [nop,nop,TS val 1436468423 ecr 3213073284], length 1314
15:59:41.917924 IP 52.223.243.196.1935 > 10.8.2.2.34924: Flags [.], ack 128477, win 126, options [nop,nop,TS val 3213073351 ecr 1436468023], length 0
15:59:41.950608 IP 10.8.2.2.34924 > 52.223.243.196.1935: Flags [.], seq 138952:140266, ack 1, win 501, options [nop,nop,TS val 1436468456 ecr 3213073351], length 1314
15:59:41.985297 IP 10.8.2.2.34924 > 52.223.243.196.1935: Flags [.], seq 140266:141580, ack 1, win 501, options [nop,nop,TS val 1436468491 ecr 3213073351], length 1314
15:59:42.020048 IP 52.223.243.196.1935 > 10.8.2.2.34924: Flags [.], ack 131105, win 126, options [nop,nop,TS val 3213073453 ecr 1436468106], length 0
15:59:42.050592 IP 10.8.2.2.34924 > 52.223.243.196.1935: Flags [.], seq 141580:142894, ack 1, win 501, options [nop,nop,TS val 1436468556 ecr 3213073453], length 1314
15:59:42.083985 IP 10.8.2.2.34924 > 52.223.243.196.1935: Flags [.], seq 142894:144208, ack 1, win 501, options [nop,nop,TS val 1436468590 ecr 3213073453], length 1314
15:59:42.098963 IP 52.223.243.196.1935 > 10.8.2.2.34924: Flags [.], ack 133733, win 126, options [nop,nop,TS val 3213073532 ecr 1436468192], length 0
15:59:42.117422 IP 10.8.2.2.34924 > 52.223.243.196.1935: Flags [.], seq 144208:145522, ack 1, win 501, options [nop,nop,TS val 1436468623 ecr 3213073532], length 1314
15:59:42.183713 IP 10.8.2.2.34924 > 52.223.243.196.1935: Flags [.], seq 145522:146836, ack 1, win 501, options [nop,nop,TS val 1436468689 ecr 3213073532], length 1314
15:59:42.187198 IP 52.223.243.196.1935 > 10.8.2.2.34924: Flags [.], ack 136361, win 126, options [nop,nop,TS val 3213073620 ecr 1436468288], length 0
15:59:42.221347 IP 10.8.2.2.34924 > 52.223.243.196.1935: Flags [.], seq 146836:148150, ack 1, win 501, options [nop,nop,TS val 1436468727 ecr 3213073620], length 1314
15:59:42.230424 IP 52.223.243.196.1935 > 10.8.2.2.34924: Flags [.], ack 137638, win 126, options [nop,nop,TS val 3213073662 ecr 1436468359], length 0
15:59:42.230459 IP 10.8.2.2.34924 > 52.223.243.196.1935: Flags [P.], seq 148150:148658, ack 1, win 501, options [nop,nop,TS val 1436468736 ecr 3213073662], length 508
15:59:42.285098 IP 10.8.2.2.34924 > 52.223.243.196.1935: Flags [.], seq 148658:149972, ack 1, win 501, options [nop,nop,TS val 1436468791 ecr 3213073662], length 1314
15:59:42.314575 IP 10.8.2.2.34924 > 52.223.243.196.1935: Flags [.], seq 149972:151286, ack 1, win 501, options [nop,nop,TS val 1436468820 ecr 3213073662], length 1314
15:59:42.320334 IP 52.223.243.196.1935 > 10.8.2.2.34924: Flags [.], ack 140266, win 126, options [nop,nop,TS val 3213073753 ecr 1436468423], length 0
15:59:42.349023 IP 10.8.2.2.34924 > 52.223.243.196.1935: Flags [.], seq 151286:152600, ack 1, win 501, options [nop,nop,TS val 1436468855 ecr 3213073753], length 1314
15:59:42.415788 IP 10.8.2.2.34924 > 52.223.243.196.1935: Flags [.], seq 152600:153914, ack 1, win 501, options [nop,nop,TS val 1436468921 ecr 3213073753], length 1314
15:59:42.420530 IP 52.223.243.196.1935 > 10.8.2.2.34924: Flags [.], ack 142894, win 126, options [nop,nop,TS val 3213073853 ecr 1436468491], length 0
15:59:42.450666 IP 10.8.2.2.34924 > 52.223.243.196.1935: Flags [.], seq 153914:155228, ack 1, win 501, options [nop,nop,TS val 1436468956 ecr 3213073853], length 1314
15:59:42.484178 IP 10.8.2.2.34924 > 52.223.243.196.1935: Flags [.], seq 155228:156542, ack 1, win 501, options [nop,nop,TS val 1436468990 ecr 3213073853], length 1314
15:59:42.487397 IP 52.223.243.196.1935 > 10.8.2.2.34924: Flags [.], ack 145522, win 126, options [nop,nop,TS val 3213073920 ecr 1436468590], length 0
15:59:42.547489 IP 10.8.2.2.34924 > 52.223.243.196.1935: Flags [.], seq 156542:157856, ack 1, win 501, options [nop,nop,TS val 1436469053 ecr 3213073920], length 1314
15:59:42.584269 IP 10.8.2.2.34924 > 52.223.243.196.1935: Flags [.], seq 157856:159170, ack 1, win 501, options [nop,nop,TS val 1436469090 ecr 3213073920], length 1314
15:59:42.591577 IP 52.223.243.196.1935 > 10.8.2.2.34924: Flags [.], ack 148150, win 126, options [nop,nop,TS val 3213074024 ecr 1436468689], length 0
15:59:42.600951 IP 52.223.243.196.1935 > 10.8.2.2.34924: Flags [.], ack 148658, win 126, options [nop,nop,TS val 3213074033 ecr 1436468736], length 0
15:59:42.600967 IP 10.8.2.2.34924 > 52.223.243.196.1935: Flags [P.], seq 159170:159601, ack 1, win 501, options [nop,nop,TS val 1436469107 ecr 3213074033], length 431
15:59:42.650614 IP 10.8.2.2.34924 > 52.223.243.196.1935: Flags [.], seq 159601:160915, ack 1, win 501, options [nop,nop,TS val 1436469156 ecr 3213074033], length 1314
15:59:42.683850 IP 10.8.2.2.34924 > 52.223.243.196.1935: Flags [.], seq 160915:162229, ack 1, win 501, options [nop,nop,TS val 1436469190 ecr 3213074033], length 1314
15:59:42.684566 IP 52.223.243.196.1935 > 10.8.2.2.34924: Flags [.], ack 151286, win 126, options [nop,nop,TS val 3213074117 ecr 1436468791], length 0
15:59:42.714231 IP 10.8.2.2.34924 > 52.223.243.196.1935: Flags [.], seq 162229:163543, ack 1, win 501, options [nop,nop,TS val 1436469220 ecr 3213074117], length 1314
15:59:42.777970 IP 10.8.2.2.34924 > 52.223.243.196.1935: Flags [.], seq 163543:164857, ack 1, win 501, options [nop,nop,TS val 1436469284 ecr 3213074117], length 1314
15:59:42.785880 IP 52.223.243.196.1935 > 10.8.2.2.34924: Flags [.], ack 153914, win 126, options [nop,nop,TS val 3213074219 ecr 1436468855], length 0
15:59:42.814927 IP 10.8.2.2.34924 > 52.223.243.196.1935: Flags [.], seq 164857:166171, ack 1, win 501, options [nop,nop,TS val 1436469321 ecr 3213074219], length 1314
15:59:42.841973 IP 10.8.2.2.34924 > 52.223.243.196.1935: Flags [.], seq 166171:167485, ack 1, win 501, options [nop,nop,TS val 1436469348 ecr 3213074219], length 1314
15:59:42.855754 IP 52.223.243.196.1935 > 10.8.2.2.34924: Flags [.], ack 156542, win 126, options [nop,nop,TS val 3213074288 ecr 1436468956], length 0
15:59:42.906140 IP 10.8.2.2.34924 > 52.223.243.196.1935: Flags [.], seq 167485:168799, ack 1, win 501, options [nop,nop,TS val 1436469412 ecr 3213074288], length 1314
15:59:42.948898 IP 10.8.2.2.34924 > 52.223.243.196.1935: Flags [.], seq 168799:170113, ack 1, win 501, options [nop,nop,TS val 1436469455 ecr 3213074288], length 1314
15:59:42.954131 IP 52.223.243.196.1935 > 10.8.2.2.34924: Flags [.], ack 159170, win 126, options [nop,nop,TS val 3213074387 ecr 1436469053], length 0
15:59:42.970502 IP 10.8.2.2.34924 > 52.223.243.196.1935: Flags [.], seq 170113:171427, ack 1, win 501, options [nop,nop,TS val 1436469476 ecr 3213074387], length 1314
15:59:42.970803 IP 52.223.243.196.1935 > 10.8.2.2.34924: Flags [.], ack 159601, win 126, options [nop,nop,TS val 3213074403 ecr 1436469107], length 0
15:59:42.970825 IP 10.8.2.2.34924 > 52.223.243.196.1935: Flags [P.], seq 171427:171469, ack 1, win 501, options [nop,nop,TS val 1436469477 ecr 3213074403], length 42
15:59:43.050725 IP 10.8.2.2.34924 > 52.223.243.196.1935: Flags [.], seq 171469:172783, ack 1, win 501, options [nop,nop,TS val 1436469556 ecr 3213074403], length 1314
15:59:43.059818 IP 52.223.243.196.1935 > 10.8.2.2.34924: Flags [.], ack 162229, win 126, options [nop,nop,TS val 3213074486 ecr 1436469156], length 0
15:59:43.077928 IP 10.8.2.2.34924 > 52.223.243.196.1935: Flags [.], seq 172783:174097, ack 1, win 501, options [nop,nop,TS val 1436469584 ecr 3213074486], length 1314
15:59:43.113705 IP 10.8.2.2.34924 > 52.223.243.196.1935: Flags [.], seq 174097:175411, ack 1, win 501, options [nop,nop,TS val 1436469619 ecr 3213074486], length 1314
15:59:43.148178 IP 52.223.243.196.1935 > 10.8.2.2.34924: Flags [.], ack 164857, win 126, options [nop,nop,TS val 3213074581 ecr 1436469220], length 0
15:59:43.184212 IP 10.8.2.2.34924 > 52.223.243.196.1935: Flags [.], seq 175411:176725, ack 1, win 501, options [nop,nop,TS val 1436469690 ecr 3213074581], length 1314
15:59:43.205894 IP 10.8.2.2.34924 > 52.223.243.196.1935: Flags [.], seq 176725:178039, ack 1, win 501, options [nop,nop,TS val 1436469712 ecr 3213074581], length 1314
15:59:43.212287 IP 52.223.243.196.1935 > 10.8.2.2.34924: Flags [.], ack 167485, win 126, options [nop,nop,TS val 3213074645 ecr 1436469321], length 0
15:59:43.247022 IP 10.8.2.2.34924 > 52.223.243.196.1935: Flags [.], seq 178039:179353, ack 1, win 501, options [nop,nop,TS val 1436469753 ecr 3213074645], length 1314
15:59:43.312356 IP 10.8.2.2.34924 > 52.223.243.196.1935: Flags [.], seq 179353:180667, ack 1, win 501, options [nop,nop,TS val 1436469818 ecr 3213074645], length 1314
15:59:43.318842 IP 52.223.243.196.1935 > 10.8.2.2.34924: Flags [.], ack 170113, win 126, options [nop,nop,TS val 3213074752 ecr 1436469412], length 0
15:59:43.341327 IP 52.223.243.196.1935 > 10.8.2.2.34924: Flags [.], ack 171469, win 126, options [nop,nop,TS val 3213074774 ecr 1436469476], length 0
15:59:43.341349 IP 10.8.2.2.34924 > 52.223.243.196.1935: Flags [P.], seq 180667:181654, ack 1, win 501, options [nop,nop,TS val 1436469847 ecr 3213074774], length 987
15:59:43.376580 IP 10.8.2.2.34924 > 52.223.243.196.1935: Flags [.], seq 181654:182968, ack 1, win 501, options [nop,nop,TS val 1436469882 ecr 3213074774], length 1314
15:59:43.417192 IP 10.8.2.2.34924 > 52.223.243.196.1935: Flags [.], seq 182968:184282, ack 1, win 501, options [nop,nop,TS val 1436469923 ecr 3213074774], length 1314
15:59:43.447930 IP 52.223.243.196.1935 > 10.8.2.2.34924: Flags [.], ack 174097, win 126, options [nop,nop,TS val 3213074881 ecr 1436469556], length 0
15:59:43.462424 IP 10.8.2.2.34924 > 52.223.243.196.1935: Flags [.], seq 184282:185596, ack 1, win 501, options [nop,nop,TS val 1436469968 ecr 3213074881], length 1314
15:59:43.504997 IP 10.8.2.2.34924 > 52.223.243.196.1935: Flags [.], seq 185596:186910, ack 1, win 501, options [nop,nop,TS val 1436470011 ecr 3213074881], length 1314
15:59:43.545870 IP 52.223.243.196.1935 > 10.8.2.2.34924: Flags [.], ack 175411, win 126, options [nop,nop,TS val 3213074978 ecr 1436469619], length 0
15:59:43.548071 IP 10.8.2.2.34924 > 52.223.243.196.1935: Flags [.], seq 186910:188224, ack 1, win 501, options [nop,nop,TS val 1436470054 ecr 3213074978], length 1314
15:59:43.576289 IP 52.223.243.196.1935 > 10.8.2.2.34924: Flags [.], ack 178039, win 126, options [nop,nop,TS val 3213075009 ecr 1436469690], length 0
15:59:43.590923 IP 10.8.2.2.34924 > 52.223.243.196.1935: Flags [.], seq 188224:189538, ack 1, win 501, options [nop,nop,TS val 1436470097 ecr 3213075009], length 1314
15:59:43.650401 IP 10.8.2.2.34924 > 52.223.243.196.1935: Flags [.], seq 189538:190852, ack 1, win 501, options [nop,nop,TS val 1436470156 ecr 3213075009], length 1314
15:59:43.676342 IP 10.8.2.2.34924 > 52.223.243.196.1935: Flags [.], seq 190852:192166, ack 1, win 501, options [nop,nop,TS val 1436470182 ecr 3213075009], length 1314
15:59:43.682330 IP 52.223.243.196.1935 > 10.8.2.2.34924: Flags [.], ack 180667, win 126, options [nop,nop,TS val 3213075115 ecr 1436469753], length 0
15:59:43.714107 IP 52.223.243.196.1935 > 10.8.2.2.34924: Flags [.], ack 181654, win 126, options [nop,nop,TS val 3213075144 ecr 1436469847], length 0
15:59:43.714119 IP 10.8.2.2.34924 > 52.223.243.196.1935: Flags [P.], seq 192166:193430, ack 1, win 501, options [nop,nop,TS val 1436470220 ecr 3213075144], length 1264
15:59:43.781962 IP 10.8.2.2.34924 > 52.223.243.196.1935: Flags [.], seq 193430:194744, ack 1, win 501, options [nop,nop,TS val 1436470288 ecr 3213075144], length 1314
15:59:43.787323 IP 52.223.243.196.1935 > 10.8.2.2.34924: Flags [.], ack 184282, win 126, options [nop,nop,TS val 3213075220 ecr 1436469882], length 0
15:59:43.817326 IP 10.8.2.2.34924 > 52.223.243.196.1935: Flags [.], seq 194744:196058, ack 1, win 501, options [nop,nop,TS val 1436470323 ecr 3213075220], length 1314
