18:46:54.708396 IP 10.8.0.5.44506 > 99.181.97.43.1935: Flags [.], seq 1544521839:1544523153, ack 2907341328, win 501, options [nop,nop,TS val 4031759303 ecr 1849657396], length 1314
18:46:54.748163 IP 99.181.97.43.1935 > 10.8.0.5.44506: Flags [.], ack 4294959004, win 303, options [nop,nop,TS val 1849657466 ecr 4031758939], length 0
18:46:54.751133 IP 10.8.0.5.44506 > 99.181.97.43.1935: Flags [.], seq 1314:2628, ack 1, win 501, options [nop,nop,TS val 4031759345 ecr 1849657466], length 1314
18:46:54.815228 IP 10.8.0.5.44506 > 99.181.97.43.1935: Flags [.], seq 2628:3942, ack 1, win 501, options [nop,nop,TS val 4031759409 ecr 1849657466], length 1314
18:46:54.840233 IP 10.8.0.5.44506 > 99.181.97.43.1935: Flags [.], seq 3942:5256, ack 1, win 501, options [nop,nop,TS val 4031759434 ecr 1849657466], length 1314
18:46:54.846913 IP 99.181.97.43.1935 > 10.8.0.5.44506: Flags [.], ack 4294961632, win 303, options [nop,nop,TS val 1849657564 ecr 4031759035], length 0
18:46:54.865465 IP 99.181.97.43.1935 > 10.8.0.5.44506: Flags [.], ack 4294962040, win 305, options [nop,nop,TS val 1849657583 ecr 4031759087], length 0
18:46:54.865478 IP 10.8.0.5.44506 > 99.181.97.43.1935: Flags [P.], seq 5256:5781, ack 1, win 501, options [nop,nop,TS val 4031759460 ecr 1849657583], length 525
18:46:54.905298 IP 10.8.0.5.44506 > 99.181.97.43.1935: Flags [.], seq 5781:7095, ack 1, win 501, options [nop,nop,TS val 4031759499 ecr 1849657583], length 1314
18:46:54.942465 IP 10.8.0.5.44506 > 99.181.97.43.1935: Flags [.], seq 7095:8409, ack 1, win 501, options [nop,nop,TS val 4031759537 ecr 1849657583], length 1314
18:46:54.953273 IP 99.181.97.43.1935 > 10.8.0.5.44506: Flags [.], ack 4294964668, win 305, options [nop,nop,TS val 1849657671 ecr 4031759136], length 0
18:46:54.985012 IP 10.8.0.5.44506 > 99.181.97.43.1935: Flags [.], seq 8409:9723, ack 1, win 501, options [nop,nop,TS val 4031759579 ecr 1849657671], length 1314
18:46:55.045481 IP 99.181.97.43.1935 > 10.8.0.5.44506: Flags [.], ack 0, win 303, options [nop,nop,TS val 1849657763 ecr 4031759203], length 0
18:46:55.048684 IP 10.8.0.5.44506 > 99.181.97.43.1935: Flags [.], seq 9723:11037, ack 1, win 501, options [nop,nop,TS val 4031759643 ecr 1849657763], length 1314
18:46:55.072764 IP 10.8.0.5.44506 > 99.181.97.43.1935: Flags [.], seq 11037:12351, ack 1, win 501, options [nop,nop,TS val 4031759667 ecr 1849657763], length 1314
18:46:55.112674 IP 10.8.0.5.44506 > 99.181.97.43.1935: Flags [.], seq 12351:13665, ack 1, win 501, options [nop,nop,TS val 4031759707 ecr 1849657763], length 1314
18:46:55.124120 IP 99.181.97.43.1935 > 10.8.0.5.44506: Flags [.], ack 2628, win 303, options [nop,nop,TS val 1849657841 ecr 4031759303], length 0
18:46:55.176712 IP 10.8.0.5.44506 > 99.181.97.43.1935: Flags [.], seq 13665:14979, ack 1, win 501, options [nop,nop,TS val 4031759771 ecr 1849657841], length 1314
18:46:55.206417 IP 10.8.0.5.44506 > 99.181.97.43.1935: Flags [.], seq 14979:16293, ack 1, win 501, options [nop,nop,TS val 4031759801 ecr 1849657841], length 1314
18:46:55.212873 IP 99.181.97.43.1935 > 10.8.0.5.44506: Flags [.], ack 5256, win 303, options [nop,nop,TS val 1849657930 ecr 4031759409], length 0
18:46:55.238223 IP 99.181.97.43.1935 > 10.8.0.5.44506: Flags [.], ack 5781, win 305, options [nop,nop,TS val 1849657956 ecr 4031759460], length 0
18:46:55.238296 IP 10.8.0.5.44506 > 99.181.97.43.1935: Flags [P.], seq 16293:16711, ack 1, win 501, options [nop,nop,TS val 4031759832 ecr 1849657956], length 418
18:46:55.282902 IP 10.8.0.5.44506 > 99.181.97.43.1935: Flags [.], seq 16711:18025, ack 1, win 501, options [nop,nop,TS val 4031759877 ecr 1849657956], length 1314
18:46:55.305565 IP 10.8.0.5.44506 > 99.181.97.43.1935: Flags [.], seq 18025:19339, ack 1, win 501, options [nop,nop,TS val 4031759900 ecr 1849657956], length 1314
18:46:55.315287 IP 99.181.97.43.1935 > 10.8.0.5.44506: Flags [.], ack 8409, win 305, options [nop,nop,TS val 1849658033 ecr 4031759499], length 0
18:46:55.346741 IP 10.8.0.5.44506 > 99.181.97.43.1935: Flags [.], seq 19339:20653, ack 1, win 501, options [nop,nop,TS val 4031759941 ecr 1849658033], length 1314
18:46:55.410791 IP 10.8.0.5.44506 > 99.181.97.43.1935: Flags [.], seq 20653:21967, ack 1, win 501, options [nop,nop,TS val 4031760005 ecr 1849658033], length 1314
18:46:55.422049 IP 99.181.97.43.1935 > 10.8.0.5.44506: Flags [.], ack 11037, win 303, options [nop,nop,TS val 1849658139 ecr 4031759579], length 0
18:46:55.438134 IP 10.8.0.5.44506 > 99.181.97.43.1935: Flags [.], seq 21967:23281, ack 1, win 501, options [nop,nop,TS val 4031760032 ecr 1849658139], length 1314
18:46:55.474261 IP 10.8.0.5.44506 > 99.181.97.43.1935: Flags [.], seq 23281:24595, ack 1, win 501, options [nop,nop,TS val 4031760068 ecr 1849658139], length 1314
18:46:55.487085 IP 99.181.97.43.1935 > 10.8.0.5.44506: Flags [.], ack 13665, win 303, options [nop,nop,TS val 1849658204 ecr 4031759667], length 0
18:46:55.540508 IP 10.8.0.5.44506 > 99.181.97.43.1935: Flags [.], seq 24595:25909, ack 1, win 501, options [nop,nop,TS val 4031760135 ecr 1849658204], length 1314
18:46:55.579324 IP 99.181.97.43.1935 > 10.8.0.5.44506: Flags [.], ack 16293, win 303, options [nop,nop,TS val 1849658297 ecr 4031759771], length 0
18:46:55.580638 IP 10.8.0.5.44506 > 99.181.97.43.1935: Flags [.], seq 25909:27223, ack 1, win 501, options [nop,nop,TS val 4031760175 ecr 1849658297], length 1314
18:46:55.605843 IP 10.8.0.5.44506 > 99.181.97.43.1935: Flags [.], seq 27223:28537, ack 1, win 501, options [nop,nop,TS val 4031760200 ecr 1849658297], length 1314
18:46:55.611538 IP 99.181.97.43.1935 > 10.8.0.5.44506: Flags [.], ack 16711, win 305, options [nop,nop,TS val 1849658328 ecr 4031759832], length 0
18:46:55.611553 IP 10.8.0.5.44506 > 99.181.97.43.1935: Flags [P.], seq 28537:28592, ack 1, win 501, options [nop,nop,TS val 4031760206 ecr 1849658328], length 55
18:46:55.677089 IP 10.8.0.5.44506 > 99.181.97.43.1935: Flags [.], seq 28592:29906, ack 1, win 501, options [nop,nop,TS val 4031760271 ecr 1849658328], length 1314
18:46:55.678341 IP 99.181.97.43.1935 > 10.8.0.5.44506: Flags [.], ack 19339, win 305, options [nop,nop,TS val 1849658396 ecr 4031759877], length 0
18:46:55.708586 IP 10.8.0.5.44506 > 99.181.97.43.1935: Flags [.], seq 29906:31220, ack 1, win 501, options [nop,nop,TS val 4031760303 ecr 1849658396], length 1314
18:46:55.738562 IP 10.8.0.5.44506 > 99.181.97.43.1935: Flags [.], seq 31220:32534, ack 1, win 501, options [nop,nop,TS val 4031760333 ecr 1849658396], length 1314
18:46:55.783560 IP 99.181.97.43.1935 > 10.8.0.5.44506: Flags [.], ack 21967, win 303, options [nop,nop,TS val 1849658501 ecr 4031759941], length 0
18:46:55.814980 IP 10.8.0.5.44506 > 99.181.97.43.1935: Flags [.], seq 32534:33848, ack 1, win 501, options [nop,nop,TS val 4031760409 ecr 1849658501], length 1314
18:46:55.841737 IP 10.8.0.5.44506 > 99.181.97.43.1935: Flags [.], seq 33848:35162, ack 1, win 501, options [nop,nop,TS val 4031760436 ecr 1849658501], length 1314
18:46:55.847999 IP 99.181.97.43.1935 > 10.8.0.5.44506: Flags [.], ack 24595, win 303, options [nop,nop,TS val 1849658565 ecr 4031760032], length 0
18:46:55.879195 IP 10.8.0.5.44506 > 99.181.97.43.1935: Flags [.], seq 35162:36476, ack 1, win 501, options [nop,nop,TS val 4031760473 ecr 1849658565], length 1314
18:46:55.943123 IP 10.8.0.5.44506 > 99.181.97.43.1935: Flags [.], seq 36476:37790, ack 1, win 501, options [nop,nop,TS val 4031760537 ecr 1849658565], length 1314
18:46:55.953856 IP 99.181.97.43.1935 > 10.8.0.5.44506: Flags [.], ack 27223, win 303, options [nop,nop,TS val 1849658671 ecr 4031760135], length 0
18:46:55.972021 IP 10.8.0.5.44506 > 99.181.97.43.1935: Flags [.], seq 37790:39104, ack 1, win 501, options [nop,nop,TS val 4031760566 ecr 1849658671], length 1314
18:46:55.984127 IP 99.181.97.43.1935 > 10.8.0.5.44506: Flags [.], ack 28592, win 303, options [nop,nop,TS val 1849658702 ecr 4031760200], length 0
18:46:55.984143 IP 10.8.0.5.44506 > 99.181.97.43.1935: Flags [P.], seq 39104:39521, ack 1, win 501, options [nop,nop,TS val 4031760578 ecr 1849658702], length 417
18:46:56.041691 IP 10.8.0.5.44506 > 99.181.97.43.1935: Flags [.], seq 39521:40835, ack 1, win 501, options [nop,nop,TS val 4031760636 ecr 1849658702], length 1314
18:46:56.075979 IP 10.8.0.5.44506 > 99.181.97.43.1935: Flags [.], seq 40835:42149, ack 1, win 501, options [nop,nop,TS val 4031760670 ecr 1849658702], length 1314
18:46:56.081660 IP 99.181.97.43.1935 > 10.8.0.5.44506: Flags [.], ack 31220, win 303, options [nop,nop,TS val 1849658799 ecr 4031760271], length 0
18:46:56.113708 IP 10.8.0.5.44506 > 99.181.97.43.1935: Flags [.], seq 42149:43463, ack 1, win 501, options [nop,nop,TS val 4031760708 ecr 1849658799], length 1314
18:46:56.174967 IP 99.181.97.43.1935 > 10.8.0.5.44506: Flags [.], ack 32534, win 305, options [nop,nop,TS val 1849658892 ecr 4031760333], length 0
18:46:56.177843 IP 10.8.0.5.44506 > 99.181.97.43.1935: Flags [.], seq 43463:44777, ack 1, win 501, options [nop,nop,TS val 4031760772 ecr 1849658892], length 1314
18:46:56.209468 IP 10.8.0.5.44506 > 99.181.97.43.1935: Flags [.], seq 44777:46091, ack 1, win 501, options [nop,nop,TS val 4031760804 ecr 1849658892], length 1314
18:46:56.214936 IP 99.181.97.43.1935 > 10.8.0.5.44506: Flags [.], ack 35162, win 305, options [nop,nop,TS val 1849658932 ecr 4031760409], length 0
18:46:56.241856 IP 10.8.0.5.44506 > 99.181.97.43.1935: Flags [.], seq 46091:47405, ack 1, win 501, options [nop,nop,TS val 4031760836 ecr 1849658932], length 1314
18:46:56.305942 IP 10.8.0.5.44506 > 99.181.97.43.1935: Flags [.], seq 47405:48719, ack 1, win 501, options [nop,nop,TS val 4031760900 ecr 1849658932], length 1314
18:46:56.315971 IP 99.181.97.43.1935 > 10.8.0.5.44506: Flags [.], ack 37790, win 303, options [nop,nop,TS val 1849659033 ecr 4031760473], length 0
18:46:56.348643 IP 10.8.0.5.44506 > 99.181.97.43.1935: Flags [.], seq 48719:50033, ack 1, win 501, options [nop,nop,TS val 4031760943 ecr 1849659033], length 1314
18:46:56.356930 IP 99.181.97.43.1935 > 10.8.0.5.44506: Flags [.], ack 39521, win 303, options [nop,nop,TS val 1849659074 ecr 4031760566], length 0
18:46:56.356981 IP 10.8.0.5.44506 > 99.181.97.43.1935: Flags [P.], seq 50033:50550, ack 1, win 501, options [nop,nop,TS val 4031760951 ecr 1849659074], length 517
18:46:56.412796 IP 10.8.0.5.44506 > 99.181.97.43.1935: Flags [.], seq 50550:51864, ack 1, win 501, options [nop,nop,TS val 4031761007 ecr 1849659074], length 1314
18:46:56.440339 IP 10.8.0.5.44506 > 99.181.97.43.1935: Flags [.], seq 51864:53178, ack 1, win 501, options [nop,nop,TS val 4031761034 ecr 1849659074], length 1314
18:46:56.449088 IP 99.181.97.43.1935 > 10.8.0.5.44506: Flags [.], ack 42149, win 303, options [nop,nop,TS val 1849659166 ecr 4031760636], length 0
18:46:56.476717 IP 10.8.0.5.44506 > 99.181.97.43.1935: Flags [.], seq 53178:54492, ack 1, win 501, options [nop,nop,TS val 4031761071 ecr 1849659166], length 1314
18:46:56.540858 IP 10.8.0.5.44506 > 99.181.97.43.1935: Flags [.], seq 54492:55806, ack 1, win 501, options [nop,nop,TS val 4031761135 ecr 1849659166], length 1314
18:46:56.550919 IP 99.181.97.43.1935 > 10.8.0.5.44506: Flags [.], ack 44777, win 303, options [nop,nop,TS val 1849659268 ecr 4031760708], length 0
18:46:56.576439 IP 10.8.0.5.44506 > 99.181.97.43.1935: Flags [.], seq 55806:57120, ack 1, win 501, options [nop,nop,TS val 4031761171 ecr 1849659268], length 1314
18:46:56.611406 IP 10.8.0.5.44506 > 99.181.97.43.1935: Flags [.], seq 57120:58434, ack 1, win 501, options [nop,nop,TS val 4031761206 ecr 1849659268], length 1314
18:46:56.614967 IP 99.181.97.43.1935 > 10.8.0.5.44506: Flags [.], ack 47405, win 303, options [nop,nop,TS val 1849659332 ecr 4031760804], length 0
18:46:56.674505 IP 10.8.0.5.44506 > 99.181.97.43.1935: Flags [.], seq 58434:59748, ack 1, win 501, options [nop,nop,TS val 4031761269 ecr 1849659332], length 1314
18:46:56.711958 IP 10.8.0.5.44506 > 99.181.97.43.1935: Flags [.], seq 59748:61062, ack 1, win 501, options [nop,nop,TS val 4031761306 ecr 1849659332], length 1314
18:46:56.721933 IP 99.181.97.43.1935 > 10.8.0.5.44506: Flags [.], ack 50033, win 303, options [nop,nop,TS val 1849659439 ecr 4031760900], length 0
18:46:56.730140 IP 99.181.97.43.1935 > 10.8.0.5.44506: Flags [.], ack 50550, win 305, options [nop,nop,TS val 1849659448 ecr 4031760951], length 0
18:46:56.730160 IP 10.8.0.5.44506 > 99.181.97.43.1935: Flags [P.], seq 61062:61483, ack 1, win 501, options [nop,nop,TS val 4031761324 ecr 1849659448], length 421
18:46:56.775557 IP 10.8.0.5.44506 > 99.181.97.43.1935: Flags [.], seq 61483:62797, ack 1, win 501, options [nop,nop,TS val 4031761370 ecr 1849659448], length 1314
18:46:56.806849 IP 10.8.0.5.44506 > 99.181.97.43.1935: Flags [.], seq 62797:64111, ack 1, win 501, options [nop,nop,TS val 4031761401 ecr 1849659448], length 1314
18:46:56.813077 IP 99.181.97.43.1935 > 10.8.0.5.44506: Flags [.], ack 53178, win 305, options [nop,nop,TS val 1849659530 ecr 4031761007], length 0
18:46:56.842713 IP 10.8.0.5.44506 > 99.181.97.43.1935: Flags [.], seq 64111:65425, ack 1, win 501, options [nop,nop,TS val 4031761437 ecr 1849659530], length 1314
18:46:56.889021 IP 99.181.97.43.1935 > 10.8.0.5.44506: Flags [P.], seq 1:17, ack 54492, win 305, options [nop,nop,TS val 1849659606 ecr 4031761071], length 16
18:46:56.911228 IP 10.8.0.5.44506 > 99.181.97.43.1935: Flags [.], seq 65425:66739, ack 17, win 501, options [nop,nop,TS val 4031761505 ecr 1849659606], length 1314
18:46:56.946702 IP 10.8.0.5.44506 > 99.181.97.43.1935: Flags [.], seq 66739:68053, ack 17, win 501, options [nop,nop,TS val 4031761541 ecr 1849659606], length 1314
18:46:56.949528 IP 99.181.97.43.1935 > 10.8.0.5.44506: Flags [.], ack 57120, win 305, options [nop,nop,TS val 1849659667 ecr 4031761135], length 0
18:46:56.972775 IP 10.8.0.5.44506 > 99.181.97.43.1935: Flags [.], seq 68053:69367, ack 17, win 501, options [nop,nop,TS val 4031761567 ecr 1849659667], length 1314
18:46:57.039329 IP 10.8.0.5.44506 > 99.181.97.43.1935: Flags [.], seq 69367:70681, ack 17, win 501, options [nop,nop,TS val 4031761633 ecr 1849659667], length 1314
18:46:57.047537 IP 99.181.97.43.1935 > 10.8.0.5.44506: Flags [.], ack 59748, win 303, options [nop,nop,TS val 1849659765 ecr 4031761206], length 0
18:46:57.074299 IP 10.8.0.5.44506 > 99.181.97.43.1935: Flags [.], seq 70681:71995, ack 17, win 501, options [nop,nop,TS val 4031761668 ecr 1849659765], length 1314
18:46:57.102984 IP 99.181.97.43.1935 > 10.8.0.5.44506: Flags [.], ack 61483, win 303, options [nop,nop,TS val 1849659820 ecr 4031761306], length 0
18:46:57.103019 IP 10.8.0.5.44506 > 99.181.97.43.1935: Flags [P.], seq 71995:72511, ack 17, win 501, options [nop,nop,TS val 4031761697 ecr 1849659820], length 516
18:46:57.142806 IP 10.8.0.5.44506 > 99.181.97.43.1935: Flags [.], seq 72511:73825, ack 17, win 501, options [nop,nop,TS val 4031761737 ecr 1849659820], length 1314
18:46:57.180400 IP 99.181.97.43.1935 > 10.8.0.5.44506: Flags [.], ack 64111, win 303, options [nop,nop,TS val 1849659898 ecr 4031761370], length 0
18:46:57.181669 IP 10.8.0.5.44506 > 99.181.97.43.1935: Flags [.], seq 73825:75139, ack 17, win 501, options [nop,nop,TS val 4031761776 ecr 1849659898], length 1314
18:46:57.224263 IP 10.8.0.5.44506 > 99.181.97.43.1935: Flags [.], seq 75139:76453, ack 17, win 501, options [nop,nop,TS val 4031761818 ecr 1849659898], length 1314
18:46:57.276278 IP 10.8.0.5.44506 > 99.181.97.43.1935: Flags [.], seq 76453:77767, ack 17, win 501, options [nop,nop,TS val 4031761870 ecr 1849659898], length 1314
18:46:57.284396 IP 99.181.97.43.1935 > 10.8.0.5.44506: Flags [.], ack 66739, win 303, options [nop,nop,TS val 1849660002 ecr 4031761437], length 0
18:46:57.310078 IP 10.8.0.5.44506 > 99.181.97.43.1935: Flags [.], seq 77767:79081, ack 17, win 501, options [nop,nop,TS val 4031761904 ecr 1849660002], length 1314
18:46:57.346325 IP 99.181.97.43.1935 > 10.8.0.5.44506: Flags [.], ack 69367, win 303, options [nop,nop,TS val 1849660063 ecr 4031761541], length 0
18:46:57.352569 IP 10.8.0.5.44506 > 99.181.97.43.1935: Flags [.], seq 79081:80395, ack 17, win 501, options [nop,nop,TS val 4031761947 ecr 1849660063], length 1314
18:46:57.416799 IP 10.8.0.5.44506 > 99.181.97.43.1935: Flags [.], seq 80395:81709, ack 17, win 501, options [nop,nop,TS val 4031762011 ecr 1849660063], length 1314
18:46:57.442661 IP 10.8.0.5.44506 > 99.181.97.43.1935: Flags [.], seq 81709:83023, ack 17, win 501, options [nop,nop,TS val 4031762037 ecr 1849660063], length 1314
18:46:57.447631 IP 99.181.97.43.1935 > 10.8.0.5.44506: Flags [.], ack 71995, win 303, options [nop,nop,TS val 1849660165 ecr 4031761633], length 0
18:46:57.475567 IP 99.181.97.43.1935 > 10.8.0.5.44506: Flags [.], ack 72511, win 305, options [nop,nop,TS val 1849660193 ecr 4031761697], length 0
18:46:57.475591 IP 10.8.0.5.44506 > 99.181.97.43.1935: Flags [P.], seq 83023:83541, ack 17, win 501, options [nop,nop,TS val 4031762070 ecr 1849660193], length 518
18:46:57.507529 IP 10.8.0.5.44506 > 99.181.97.43.1935: Flags [.], seq 83541:84855, ack 17, win 501, options [nop,nop,TS val 4031762102 ecr 1849660193], length 1314
18:46:57.545321 IP 10.8.0.5.44506 > 99.181.97.43.1935: Flags [.], seq 84855:86169, ack 17, win 501, options [nop,nop,TS val 4031762139 ecr 1849660193], length 1314
18:46:57.554444 IP 99.181.97.43.1935 > 10.8.0.5.44506: Flags [.], ack 75139, win 305, options [nop,nop,TS val 1849660272 ecr 4031761737], length 0
18:46:57.607560 IP 10.8.0.5.44506 > 99.181.97.43.1935: Flags [.], seq 86169:87483, ack 17, win 501, options [nop,nop,TS val 4031762202 ecr 1849660272], length 1314
18:46:57.642063 IP 10.8.0.5.44506 > 99.181.97.43.1935: Flags [.], seq 87483:88797, ack 17, win 501, options [nop,nop,TS val 4031762236 ecr 1849660272], length 1314
18:46:57.649427 IP 99.181.97.43.1935 > 10.8.0.5.44506: Flags [.], ack 77767, win 305, options [nop,nop,TS val 1849660367 ecr 4031761818], length 0
18:46:57.675462 IP 10.8.0.5.44506 > 99.181.97.43.1935: Flags [.], seq 88797:90111, ack 17, win 501, options [nop,nop,TS val 4031762270 ecr 1849660367], length 1314
18:46:57.725603 IP 99.181.97.43.1935 > 10.8.0.5.44506: Flags [.], ack 80395, win 305, options [nop,nop,TS val 1849660443 ecr 4031761904], length 0
18:46:57.738290 IP 10.8.0.5.44506 > 99.181.97.43.1935: Flags [.], seq 90111:91425, ack 17, win 501, options [nop,nop,TS val 4031762332 ecr 1849660443], length 1314
18:46:57.780855 IP 10.8.0.5.44506 > 99.181.97.43.1935: Flags [.], seq 91425:92739, ack 17, win 501, options [nop,nop,TS val 4031762375 ecr 1849660443], length 1314
18:46:57.806945 IP 10.8.0.5.44506 > 99.181.97.43.1935: Flags [.], seq 92739:94053, ack 17, win 501, options [nop,nop,TS val 4031762401 ecr 1849660443], length 1314
18:46:57.848228 IP 99.181.97.43.1935 > 10.8.0.5.44506: Flags [.], ack 83541, win 305, options [nop,nop,TS val 1849660566 ecr 4031762070], length 0
18:46:57.848243 IP 10.8.0.5.44506 > 99.181.97.43.1935: Flags [P.], seq 94053:95318, ack 17, win 501, options [nop,nop,TS val 4031762442 ecr 1849660566], length 1265
18:46:57.909086 IP 10.8.0.5.44506 > 99.181.97.43.1935: Flags [.], seq 95318:96632, ack 17, win 501, options [nop,nop,TS val 4031762503 ecr 1849660566], length 1314
18:46:57.918245 IP 99.181.97.43.1935 > 10.8.0.5.44506: Flags [.], ack 86169, win 305, options [nop,nop,TS val 1849660636 ecr 4031762102], length 0
18:46:57.951980 IP 10.8.0.5.44506 > 99.181.97.43.1935: Flags [.], seq 96632:97946, ack 17, win 501, options [nop,nop,TS val 4031762546 ecr 1849660636], length 1314
18:46:57.976120 IP 10.8.0.5.44506 > 99.181.97.43.1935: Flags [.], seq 97946:99260, ack 17, win 501, options [nop,nop,TS val 4031762570 ecr 1849660636], length 1314
18:46:58.014820 IP 99.181.97.43.1935 > 10.8.0.5.44506: Flags [.], ack 88797, win 305, options [nop,nop,TS val 1849660732 ecr 4031762202], length 0
18:46:58.038554 IP 10.8.0.5.44506 > 99.181.97.43.1935: Flags [.], seq 99260:100574, ack 17, win 501, options [nop,nop,TS val 4031762633 ecr 1849660732], length 1314
18:46:58.080097 IP 10.8.0.5.44506 > 99.181.97.43.1935: Flags [.], seq 100574:101888, ack 17, win 501, options [nop,nop,TS val 4031762674 ecr 1849660732], length 1314
18:46:58.105590 IP 10.8.0.5.44506 > 99.181.97.43.1935: Flags [.], seq 101888:103202, ack 17, win 501, options [nop,nop,TS val 4031762700 ecr 1849660732], length 1314
18:46:58.111592 IP 99.181.97.43.1935 > 10.8.0.5.44506: Flags [.], ack 91425, win 303, options [nop,nop,TS val 1849660829 ecr 4031762270], length 0
18:46:58.175788 IP 10.8.0.5.44506 > 99.181.97.43.1935: Flags [.], seq 103202:104516, ack 17, win 501, options [nop,nop,TS val 4031762770 ecr 1849660829], length 1314
18:46:58.179583 IP 99.181.97.43.1935 > 10.8.0.5.44506: Flags [.], ack 94053, win 303, options [nop,nop,TS val 1849660897 ecr 4031762375], length 0
18:46:58.209120 IP 10.8.0.5.44506 > 99.181.97.43.1935: Flags [.], seq 104516:105830, ack 17, win 501, options [nop,nop,TS val 4031762803 ecr 1849660897], length 1314
18:46:58.221036 IP 99.181.97.43.1935 > 10.8.0.5.44506: Flags [.], ack 95318, win 305, options [nop,nop,TS val 1849660938 ecr 4031762442], length 0
18:46:58.221083 IP 10.8.0.5.44506 > 99.181.97.43.1935: Flags [P.], seq 105830:106260, ack 17, win 501, options [nop,nop,TS val 4031762815 ecr 1849660938], length 430
18:46:58.273352 IP 10.8.0.5.44506 > 99.181.97.43.1935: Flags [.], seq 106260:107574, ack 17, win 501, options [nop,nop,TS val 4031762867 ecr 1849660938], length 1314
18:46:58.315275 IP 10.8.0.5.44506 > 99.181.97.43.1935: Flags [.], seq 107574:108888, ack 17, win 501, options [nop,nop,TS val 4031762909 ecr 1849660938], length 1314
18:46:58.324857 IP 99.181.97.43.1935 > 10.8.0.5.44506: Flags [.], ack 97946, win 305, options [nop,nop,TS val 1849661042 ecr 4031762503], length 0
18:46:58.342863 IP 10.8.0.5.44506 > 99.181.97.43.1935: Flags [.], seq 108888:110202, ack 17, win 501, options [nop,nop,TS val 4031762937 ecr 1849661042], length 1314
18:46:58.405435 IP 10.8.0.5.44506 > 99.181.97.43.1935: Flags [.], seq 110202:111516, ack 17, win 501, options [nop,nop,TS val 4031763000 ecr 1849661042], length 1314
18:46:58.411563 IP 99.181.97.43.1935 > 10.8.0.5.44506: Flags [.], ack 100574, win 303, options [nop,nop,TS val 1849661129 ecr 4031762570], length 0
18:46:58.442993 IP 10.8.0.5.44506 > 99.181.97.43.1935: Flags [.], seq 111516:112830, ack 17, win 501, options [nop,nop,TS val 4031763037 ecr 1849661129], length 1314
18:46:58.478623 IP 99.181.97.43.1935 > 10.8.0.5.44506: Flags [.], ack 103202, win 303, options [nop,nop,TS val 1849661196 ecr 4031762674], length 0
18:46:58.485978 IP 10.8.0.5.44506 > 99.181.97.43.1935: Flags [.], seq 112830:114144, ack 17, win 501, options [nop,nop,TS val 4031763080 ecr 1849661196], length 1314
18:46:58.549975 IP 10.8.0.5.44506 > 99.181.97.43.1935: Flags [.], seq 114144:115458, ack 17, win 501, options [nop,nop,TS val 4031763144 ecr 1849661196], length 1314
18:46:58.573534 IP 10.8.0.5.44506 > 99.181.97.43.1935: Flags [.], seq 115458:116772, ack 17, win 501, options [nop,nop,TS val 4031763168 ecr 1849661196], length 1314
18:46:58.581786 IP 99.181.97.43.1935 > 10.8.0.5.44506: Flags [.], ack 105830, win 303, options [nop,nop,TS val 1849661299 ecr 4031762770], length 0
18:46:58.593648 IP 99.181.97.43.1935 > 10.8.0.5.44506: Flags [.], ack 106260, win 305, options [nop,nop,TS val 1849661311 ecr 4031762815], length 0
18:46:58.593659 IP 10.8.0.5.44506 > 99.181.97.43.1935: Flags [P.], seq 116772:117280, ack 17, win 501, options [nop,nop,TS val 4031763188 ecr 1849661311], length 508
18:46:58.640207 IP 10.8.0.5.44506 > 99.181.97.43.1935: Flags [.], seq 117280:118594, ack 17, win 501, options [nop,nop,TS val 4031763234 ecr 1849661311], length 1314
18:46:58.677348 IP 10.8.0.5.44506 > 99.181.97.43.1935: Flags [.], seq 118594:119908, ack 17, win 501, options [nop,nop,TS val 4031763271 ecr 1849661311], length 1314
18:46:58.688375 IP 99.181.97.43.1935 > 10.8.0.5.44506: Flags [.], ack 108888, win 303, options [nop,nop,TS val 1849661406 ecr 4031762867], length 0
18:46:58.720149 IP 10.8.0.5.44506 > 99.181.97.43.1935: Flags [.], seq 119908:121222, ack 17, win 501, options [nop,nop,TS val 4031763314 ecr 1849661406], length 1314
18:46:58.778068 IP 99.181.97.43.1935 > 10.8.0.5.44506: Flags [.], ack 111516, win 303, options [nop,nop,TS val 1849661495 ecr 4031762937], length 0
18:46:58.784409 IP 10.8.0.5.44506 > 99.181.97.43.1935: Flags [.], seq 121222:122536, ack 17, win 501, options [nop,nop,TS val 4031763379 ecr 1849661495], length 1314
18:46:58.806795 IP 10.8.0.5.44506 > 99.181.97.43.1935: Flags [.], seq 122536:123850, ack 17, win 501, options [nop,nop,TS val 4031763401 ecr 1849661495], length 1314
18:46:58.848754 IP 10.8.0.5.44506 > 99.181.97.43.1935: Flags [.], seq 123850:125164, ack 17, win 501, options [nop,nop,TS val 4031763443 ecr 1849661495], length 1314
18:46:58.858666 IP 99.181.97.43.1935 > 10.8.0.5.44506: Flags [.], ack 114144, win 303, options [nop,nop,TS val 1849661576 ecr 4031763037], length 0
18:46:58.913383 IP 10.8.0.5.44506 > 99.181.97.43.1935: Flags [.], seq 125164:126478, ack 17, win 501, options [nop,nop,TS val 4031763507 ecr 1849661576], length 1314
18:46:58.940730 IP 10.8.0.5.44506 > 99.181.97.43.1935: Flags [.], seq 126478:127792, ack 17, win 501, options [nop,nop,TS val 4031763535 ecr 1849661576], length 1314
18:46:58.946203 IP 99.181.97.43.1935 > 10.8.0.5.44506: Flags [.], ack 116772, win 303, options [nop,nop,TS val 1849661664 ecr 4031763144], length 0
18:46:58.966007 IP 99.181.97.43.1935 > 10.8.0.5.44506: Flags [.], ack 117280, win 305, options [nop,nop,TS val 1849661684 ecr 4031763188], length 0
18:46:58.966028 IP 10.8.0.5.44506 > 99.181.97.43.1935: Flags [P.], seq 127792:128221, ack 17, win 501, options [nop,nop,TS val 4031763560 ecr 1849661684], length 429
18:46:59.020015 IP 10.8.0.5.44506 > 99.181.97.43.1935: Flags [.], seq 128221:129535, ack 17, win 501, options [nop,nop,TS val 4031763614 ecr 1849661684], length 1314
18:46:59.041987 IP 10.8.0.5.44506 > 99.181.97.43.1935: Flags [.], seq 129535:130849, ack 17, win 501, options [nop,nop,TS val 4031763636 ecr 1849661684], length 1314
18:46:59.050214 IP 99.181.97.43.1935 > 10.8.0.5.44506: Flags [.], ack 119908, win 305, options [nop,nop,TS val 1849661768 ecr 4031763234], length 0
18:46:59.084218 IP 10.8.0.5.44506 > 99.181.97.43.1935: Flags [.], seq 130849:132163, ack 17, win 501, options [nop,nop,TS val 4031763678 ecr 1849661768], length 1314
18:46:59.148224 IP 10.8.0.5.44506 > 99.181.97.43.1935: Flags [.], seq 132163:133477, ack 17, win 501, options [nop,nop,TS val 4031763742 ecr 1849661768], length 1314
18:46:59.157201 IP 99.181.97.43.1935 > 10.8.0.5.44506: Flags [.], ack 122536, win 303, options [nop,nop,TS val 1849661875 ecr 4031763314], length 0
18:46:59.172097 IP 10.8.0.5.44506 > 99.181.97.43.1935: Flags [.], seq 133477:134791, ack 17, win 501, options [nop,nop,TS val 4031763766 ecr 1849661875], length 1314
18:46:59.212130 IP 10.8.0.5.44506 > 99.181.97.43.1935: Flags [.], seq 134791:136105, ack 17, win 501, options [nop,nop,TS val 4031763806 ecr 1849661875], length 1314
18:46:59.221478 IP 99.181.97.43.1935 > 10.8.0.5.44506: Flags [.], ack 125164, win 303, options [nop,nop,TS val 1849661939 ecr 4031763401], length 0
18:46:59.276524 IP 10.8.0.5.44506 > 99.181.97.43.1935: Flags [.], seq 136105:137419, ack 17, win 501, options [nop,nop,TS val 4031763871 ecr 1849661939], length 1314
18:46:59.313622 IP 99.181.97.43.1935 > 10.8.0.5.44506: Flags [.], ack 127792, win 303, options [nop,nop,TS val 1849662031 ecr 4031763507], length 0
18:46:59.319127 IP 10.8.0.5.44506 > 99.181.97.43.1935: Flags [.], seq 137419:138733, ack 17, win 501, options [nop,nop,TS val 4031763913 ecr 1849662031], length 1314
18:46:59.338814 IP 99.181.97.43.1935 > 10.8.0.5.44506: Flags [.], ack 128221, win 305, options [nop,nop,TS val 1849662056 ecr 4031763560], length 0
18:46:59.338849 IP 10.8.0.5.44506 > 99.181.97.43.1935: Flags [P.], seq 138733:139144, ack 17, win 501, options [nop,nop,TS val 4031763933 ecr 1849662056], length 411
18:46:59.383055 IP 10.8.0.5.44506 > 99.181.97.43.1935: Flags [.], seq 139144:140458, ack 17, win 501, options [nop,nop,TS val 4031763977 ecr 1849662056], length 1314
18:46:59.409396 IP 10.8.0.5.44506 > 99.181.97.43.1935: Flags [.], seq 140458:141772, ack 17, win 501, options [nop,nop,TS val 4031764003 ecr 1849662056], length 1314
18:46:59.415054 IP 99.181.97.43.1935 > 10.8.0.5.44506: Flags [.], ack 130849, win 305, options [nop,nop,TS val 1849662132 ecr 4031763614], length 0
18:46:59.446915 IP 10.8.0.5.44506 > 99.181.97.43.1935: Flags [.], seq 141772:143086, ack 17, win 501, options [nop,nop,TS val 4031764041 ecr 1849662132], length 1314
18:46:59.510842 IP 10.8.0.5.44506 > 99.181.97.43.1935: Flags [.], seq 143086:144400, ack 17, win 501, options [nop,nop,TS val 4031764105 ecr 1849662132], length 1314
18:46:59.520909 IP 99.181.97.43.1935 > 10.8.0.5.44506: Flags [.], ack 133477, win 303, options [nop,nop,TS val 1849662238 ecr 4031763678], length 0
18:46:59.554111 IP 10.8.0.5.44506 > 99.181.97.43.1935: Flags [.], seq 144400:145714, ack 17, win 501, options [nop,nop,TS val 4031764148 ecr 1849662238], length 1314
18:46:59.575255 IP 10.8.0.5.44506 > 99.181.97.43.1935: Flags [.], seq 145714:147028, ack 17, win 501, options [nop,nop,TS val 4031764169 ecr 1849662238], length 1314
18:46:59.584796 IP 99.181.97.43.1935 > 10.8.0.5.44506: Flags [.], ack 136105, win 303, options [nop,nop,TS val 1849662302 ecr 4031763766], length 0
18:46:59.638765 IP 10.8.0.5.44506 > 99.181.97.43.1935: Flags [.], seq 147028:148342, ack 17, win 501, options [nop,nop,TS val 4031764233 ecr 1849662302], length 1314
18:46:59.681049 IP 10.8.0.5.44506 > 99.181.97.43.1935: Flags [.], seq 148342:149656, ack 17, win 501, options [nop,nop,TS val 4031764275 ecr 1849662302], length 1314
18:46:59.691793 IP 99.181.97.43.1935 > 10.8.0.5.44506: Flags [.], ack 138733, win 303, options [nop,nop,TS val 1849662409 ecr 4031763871], length 0
18:46:59.706108 IP 10.8.0.5.44506 > 99.181.97.43.1935: Flags [.], seq 149656:150970, ack 17, win 501, options [nop,nop,TS val 4031764300 ecr 1849662409], length 1314
18:46:59.711440 IP 99.181.97.43.1935 > 10.8.0.5.44506: Flags [.], ack 139144, win 305, options [nop,nop,TS val 1849662429 ecr 4031763933], length 0
18:46:59.711466 IP 10.8.0.5.44506 > 99.181.97.43.1935: Flags [P.], seq 150970:151028, ack 17, win 501, options [nop,nop,TS val 4031764306 ecr 1849662429], length 58
18:46:59.772795 IP 10.8.0.5.44506 > 99.181.97.43.1935: Flags [.], seq 151028:152342, ack 17, win 501, options [nop,nop,TS val 4031764367 ecr 1849662429], length 1314
18:46:59.782981 IP 99.181.97.43.1935 > 10.8.0.5.44506: Flags [.], ack 141772, win 305, options [nop,nop,TS val 1849662500 ecr 4031763977], length 0
18:46:59.808184 IP 10.8.0.5.44506 > 99.181.97.43.1935: Flags [.], seq 152342:153656, ack 17, win 501, options [nop,nop,TS val 4031764402 ecr 1849662500], length 1314
18:46:59.850613 IP 10.8.0.5.44506 > 99.181.97.43.1935: Flags [.], seq 153656:154970, ack 17, win 501, options [nop,nop,TS val 4031764445 ecr 1849662500], length 1314
18:46:59.883567 IP 99.181.97.43.1935 > 10.8.0.5.44506: Flags [.], ack 144400, win 303, options [nop,nop,TS val 1849662601 ecr 4031764041], length 0
18:46:59.914919 IP 10.8.0.5.44506 > 99.181.97.43.1935: Flags [.], seq 154970:156284, ack 17, win 501, options [nop,nop,TS val 4031764509 ecr 1849662601], length 1314
18:46:59.941755 IP 10.8.0.5.44506 > 99.181.97.43.1935: Flags [.], seq 156284:157598, ack 17, win 501, options [nop,nop,TS val 4031764536 ecr 1849662601], length 1314
18:46:59.948315 IP 99.181.97.43.1935 > 10.8.0.5.44506: Flags [.], ack 147028, win 303, options [nop,nop,TS val 1849662666 ecr 4031764148], length 0
18:46:59.978498 IP 10.8.0.5.44506 > 99.181.97.43.1935: Flags [.], seq 157598:158912, ack 17, win 501, options [nop,nop,TS val 4031764573 ecr 1849662666], length 1314
18:47:00.042271 IP 10.8.0.5.44506 > 99.181.97.43.1935: Flags [.], seq 158912:160226, ack 17, win 501, options [nop,nop,TS val 4031764636 ecr 1849662666], length 1314
18:47:00.053640 IP 99.181.97.43.1935 > 10.8.0.5.44506: Flags [.], ack 149656, win 303, options [nop,nop,TS val 1849662771 ecr 4031764233], length 0
18:47:00.084176 IP 99.181.97.43.1935 > 10.8.0.5.44506: Flags [.], ack 151028, win 303, options [nop,nop,TS val 1849662801 ecr 4031764300], length 0
18:47:00.084221 IP 10.8.0.5.44506 > 99.181.97.43.1935: Flags [P.], seq 160226:161201, ack 17, win 501, options [nop,nop,TS val 4031764678 ecr 1849662801], length 975
18:47:00.109224 IP 10.8.0.5.44506 > 99.181.97.43.1935: Flags [.], seq 161201:162515, ack 17, win 501, options [nop,nop,TS val 4031764703 ecr 1849662801], length 1314
18:47:00.149527 IP 10.8.0.5.44506 > 99.181.97.43.1935: Flags [.], seq 162515:163829, ack 17, win 501, options [nop,nop,TS val 4031764744 ecr 1849662801], length 1314
18:47:00.180828 IP 99.181.97.43.1935 > 10.8.0.5.44506: Flags [.], ack 153656, win 303, options [nop,nop,TS val 1849662898 ecr 4031764367], length 0
18:47:00.207892 IP 10.8.0.5.44506 > 99.181.97.43.1935: Flags [.], seq 163829:165143, ack 17, win 501, options [nop,nop,TS val 4031764802 ecr 1849662898], length 1314
18:47:00.242685 IP 10.8.0.5.44506 > 99.181.97.43.1935: Flags [.], seq 165143:166457, ack 17, win 501, options [nop,nop,TS val 4031764837 ecr 1849662898], length 1314
18:47:00.277904 IP 10.8.0.5.44506 > 99.181.97.43.1935: Flags [.], seq 166457:167771, ack 17, win 501, options [nop,nop,TS val 4031764872 ecr 1849662898], length 1314
18:47:00.287970 IP 99.181.97.43.1935 > 10.8.0.5.44506: Flags [.], ack 156284, win 303, options [nop,nop,TS val 1849663005 ecr 4031764445], length 0
18:47:00.342339 IP 10.8.0.5.44506 > 99.181.97.43.1935: Flags [.], seq 167771:169085, ack 17, win 501, options [nop,nop,TS val 4031764936 ecr 1849663005], length 1314
18:47:00.351189 IP 99.181.97.43.1935 > 10.8.0.5.44506: Flags [.], ack 158912, win 303, options [nop,nop,TS val 1849663069 ecr 4031764536], length 0
18:47:00.385227 IP 10.8.0.5.44506 > 99.181.97.43.1935: Flags [.], seq 169085:170399, ack 17, win 501, options [nop,nop,TS val 4031764979 ecr 1849663069], length 1314
18:47:00.407636 IP 10.8.0.5.44506 > 99.181.97.43.1935: Flags [.], seq 170399:171713, ack 17, win 501, options [nop,nop,TS val 4031765002 ecr 1849663069], length 1314
18:47:00.456965 IP 99.181.97.43.1935 > 10.8.0.5.44506: Flags [.], ack 161201, win 303, options [nop,nop,TS val 1849663175 ecr 4031764636], length 0
18:47:00.456995 IP 10.8.0.5.44506 > 99.181.97.43.1935: Flags [P.], seq 171713:172990, ack 17, win 501, options [nop,nop,TS val 4031765051 ecr 1849663175], length 1277
18:47:00.513823 IP 10.8.0.5.44506 > 99.181.97.43.1935: Flags [.], seq 172990:174304, ack 17, win 501, options [nop,nop,TS val 4031765108 ecr 1849663175], length 1314
18:47:00.522319 IP 99.181.97.43.1935 > 10.8.0.5.44506: Flags [.], ack 163829, win 303, options [nop,nop,TS val 1849663240 ecr 4031764703], length 0
18:47:00.541467 IP 10.8.0.5.44506 > 99.181.97.43.1935: Flags [.], seq 174304:175618, ack 17, win 501, options [nop,nop,TS val 4031765136 ecr 1849663240], length 1314
18:47:00.577877 IP 10.8.0.5.44506 > 99.181.97.43.1935: Flags [.], seq 175618:176932, ack 17, win 501, options [nop,nop,TS val 4031765172 ecr 1849663240], length 1314
18:47:00.615442 IP 99.181.97.43.1935 > 10.8.0.5.44506: Flags [.], ack 166457, win 303, options [nop,nop,TS val 1849663333 ecr 4031764802], length 0
18:47:00.641516 IP 10.8.0.5.44506 > 99.181.97.43.1935: Flags [.], seq 176932:178246, ack 17, win 501, options [nop,nop,TS val 4031765236 ecr 1849663333], length 1314
18:47:00.684197 IP 10.8.0.5.44506 > 99.181.97.43.1935: Flags [.], seq 178246:179560, ack 17, win 501, options [nop,nop,TS val 4031765278 ecr 1849663333], length 1314
18:47:00.709469 IP 10.8.0.5.44506 > 99.181.97.43.1935: Flags [.], seq 179560:180874, ack 17, win 501, options [nop,nop,TS val 4031765304 ecr 1849663333], length 1314
18:47:00.715299 IP 99.181.97.43.1935 > 10.8.0.5.44506: Flags [.], ack 169085, win 303, options [nop,nop,TS val 1849663433 ecr 4031764872], length 0
18:47:00.771994 IP 10.8.0.5.44506 > 99.181.97.43.1935: Flags [.], seq 180874:182188, ack 17, win 501, options [nop,nop,TS val 4031765366 ecr 1849663433], length 1314
18:47:00.780466 IP 99.181.97.43.1935 > 10.8.0.5.44506: Flags [.], ack 171713, win 303, options [nop,nop,TS val 1849663498 ecr 4031764979], length 0
18:47:00.812134 IP 10.8.0.5.44506 > 99.181.97.43.1935: Flags [.], seq 182188:183502, ack 17, win 501, options [nop,nop,TS val 4031765406 ecr 1849663498], length 1314
18:47:00.831814 IP 99.181.97.43.1935 > 10.8.0.5.44506: Flags [.], ack 172990, win 305, options [nop,nop,TS val 1849663548 ecr 4031765051], length 0
18:47:00.831835 IP 10.8.0.5.44506 > 99.181.97.43.1935: Flags [P.], seq 183502:183915, ack 17, win 501, options [nop,nop,TS val 4031765426 ecr 1849663548], length 413
18:47:00.876447 IP 10.8.0.5.44506 > 99.181.97.43.1935: Flags [.], seq 183915:185229, ack 17, win 501, options [nop,nop,TS val 4031765471 ecr 1849663548], length 1314
18:47:00.914429 IP 99.181.97.43.1935 > 10.8.0.5.44506: Flags [.], ack 175618, win 305, options [nop,nop,TS val 1849663632 ecr 4031765108], length 0
18:47:00.919284 IP 10.8.0.5.44506 > 99.181.97.43.1935: Flags [.], seq 185229:186543, ack 17, win 501, options [nop,nop,TS val 4031765513 ecr 1849663632], length 1314
18:47:00.940500 IP 10.8.0.5.44506 > 99.181.97.43.1935: Flags [.], seq 186543:187857, ack 17, win 501, options [nop,nop,TS val 4031765535 ecr 1849663632], length 1314
18:47:01.009462 IP 10.8.0.5.44506 > 99.181.97.43.1935: Flags [.], seq 187857:189171, ack 17, win 501, options [nop,nop,TS val 4031765604 ecr 1849663632], length 1314
18:47:01.014123 IP 99.181.97.43.1935 > 10.8.0.5.44506: Flags [.], ack 178246, win 303, options [nop,nop,TS val 1849663732 ecr 4031765172], length 0
18:47:01.047188 IP 10.8.0.5.44506 > 99.181.97.43.1935: Flags [.], seq 189171:190485, ack 17, win 501, options [nop,nop,TS val 4031765641 ecr 1849663732], length 1314
18:47:01.072423 IP 10.8.0.5.44506 > 99.181.97.43.1935: Flags [.], seq 190485:191799, ack 17, win 501, options [nop,nop,TS val 4031765667 ecr 1849663732], length 1314
18:47:01.082522 IP 99.181.97.43.1935 > 10.8.0.5.44506: Flags [.], ack 180874, win 303, options [nop,nop,TS val 1849663800 ecr 4031765278], length 0
18:47:01.153796 IP 10.8.0.5.44506 > 99.181.97.43.1935: Flags [.], seq 191799:193113, ack 17, win 501, options [nop,nop,TS val 4031765748 ecr 1849663800], length 1314
18:47:01.174955 IP 10.8.0.5.44506 > 99.181.97.43.1935: Flags [.], seq 193113:194427, ack 17, win 501, options [nop,nop,TS val 4031765769 ecr 1849663800], length 1314
18:47:01.184739 IP 99.181.97.43.1935 > 10.8.0.5.44506: Flags [.], ack 183502, win 303, options [nop,nop,TS val 1849663902 ecr 4031765366], length 0
18:47:01.204281 IP 99.181.97.43.1935 > 10.8.0.5.44506: Flags [.], ack 183915, win 305, options [nop,nop,TS val 1849663922 ecr 4031765426], length 0
18:47:01.204308 IP 10.8.0.5.44506 > 99.181.97.43.1935: Flags [P.], seq 194427:194947, ack 17, win 501, options [nop,nop,TS val 4031765798 ecr 1849663922], length 520
18:47:01.241243 IP 10.8.0.5.44506 > 99.181.97.43.1935: Flags [.], seq 194947:196261, ack 17, win 501, options [nop,nop,TS val 4031765835 ecr 1849663922], length 1314
18:47:01.281600 IP 10.8.0.5.44506 > 99.181.97.43.1935: Flags [.], seq 196261:197575, ack 17, win 501, options [nop,nop,TS val 4031765876 ecr 1849663922], length 1314
18:47:01.292525 IP 99.181.97.43.1935 > 10.8.0.5.44506: Flags [.], ack 186543, win 305, options [nop,nop,TS val 1849664010 ecr 4031765471], length 0
18:47:01.324494 IP 10.8.0.5.44506 > 99.181.97.43.1935: Flags [.], seq 197575:198889, ack 17, win 501, options [nop,nop,TS val 4031765919 ecr 1849664010], length 1314
18:47:01.374721 IP 99.181.97.43.1935 > 10.8.0.5.44506: Flags [.], ack 187857, win 305, options [nop,nop,TS val 1849664092 ecr 4031765535], length 0
18:47:01.375246 IP 10.8.0.5.44506 > 99.181.97.43.1935: Flags [.], seq 198889:200203, ack 17, win 501, options [nop,nop,TS val 4031765969 ecr 1849664092], length 1314
