00:08:51.120433 IP 10.8.0.7.38770 > 185.42.205.219.1935: Flags [.], seq 4135507847:4135509161, ack 3462958952, win 501, options [nop,nop,TS val 600699297 ecr 94518046], length 1314
00:08:51.126967 IP 185.42.205.219.1935 > 10.8.0.7.38770: Flags [.], ack 4294961638, win 126, options [nop,nop,TS val 94518130 ecr 600699028], length 0
00:08:51.157449 IP 10.8.0.7.38770 > 185.42.205.219.1935: Flags [.], seq 1314:2628, ack 1, win 501, options [nop,nop,TS val 600699334 ecr 94518130], length 1314
00:08:51.221183 IP 10.8.0.7.38770 > 185.42.205.219.1935: Flags [.], seq 2628:3942, ack 1, win 501, options [nop,nop,TS val 600699397 ecr 94518130], length 1314
00:08:51.228103 IP 185.42.205.219.1935 > 10.8.0.7.38770: Flags [.], ack 4294964266, win 126, options [nop,nop,TS val 94518231 ecr 600699099], length 0
00:08:51.250017 IP 10.8.0.7.38770 > 185.42.205.219.1935: Flags [.], seq 3942:5256, ack 1, win 501, options [nop,nop,TS val 600699426 ecr 94518231], length 1314
00:08:51.284995 IP 185.42.205.219.1935 > 10.8.0.7.38770: Flags [.], ack 4294965982, win 126, options [nop,nop,TS val 94518288 ecr 600699192], length 0
00:08:51.285028 IP 10.8.0.7.38770 > 185.42.205.219.1935: Flags [P.], seq 5256:5666, ack 1, win 501, options [nop,nop,TS val 600699461 ecr 94518288], length 410
00:08:51.320313 IP 10.8.0.7.38770 > 185.42.205.219.1935: Flags [.], seq 5666:6980, ack 1, win 501, options [nop,nop,TS val 600699497 ecr 94518288], length 1314
00:08:51.349656 IP 10.8.0.7.38770 > 185.42.205.219.1935: Flags [.], seq 6980:8294, ack 1, win 501, options [nop,nop,TS val 600699526 ecr 94518288], length 1314
00:08:51.362142 IP 185.42.205.219.1935 > 10.8.0.7.38770: Flags [.], ack 1314, win 126, options [nop,nop,TS val 94518365 ecr 600699263], length 0
00:08:51.391690 IP 10.8.0.7.38770 > 185.42.205.219.1935: Flags [.], seq 8294:9608, ack 1, win 501, options [nop,nop,TS val 600699568 ecr 94518365], length 1314
00:08:51.455391 IP 10.8.0.7.38770 > 185.42.205.219.1935: Flags [.], seq 9608:10922, ack 1, win 501, options [nop,nop,TS val 600699632 ecr 94518365], length 1314
00:08:51.463138 IP 185.42.205.219.1935 > 10.8.0.7.38770: Flags [.], ack 3942, win 126, options [nop,nop,TS val 94518466 ecr 600699334], length 0
00:08:51.482860 IP 10.8.0.7.38770 > 185.42.205.219.1935: Flags [.], seq 10922:12236, ack 1, win 501, options [nop,nop,TS val 600699659 ecr 94518466], length 1314
00:08:51.519289 IP 10.8.0.7.38770 > 185.42.205.219.1935: Flags [.], seq 12236:13550, ack 1, win 501, options [nop,nop,TS val 600699696 ecr 94518466], length 1314
00:08:51.526823 IP 185.42.205.219.1935 > 10.8.0.7.38770: Flags [.], ack 5666, win 126, options [nop,nop,TS val 94518529 ecr 600699426], length 0
00:08:51.526857 IP 10.8.0.7.38770 > 185.42.205.219.1935: Flags [P.], seq 13550:13580, ack 1, win 501, options [nop,nop,TS val 600699703 ecr 94518529], length 30
00:08:51.586824 IP 10.8.0.7.38770 > 185.42.205.219.1935: Flags [.], seq 13580:14894, ack 1, win 501, options [nop,nop,TS val 600699763 ecr 94518529], length 1314
00:08:51.591189 IP 185.42.205.219.1935 > 10.8.0.7.38770: Flags [.], ack 8294, win 126, options [nop,nop,TS val 94518594 ecr 600699497], length 0
00:08:51.617593 IP 10.8.0.7.38770 > 185.42.205.219.1935: Flags [.], seq 14894:16208, ack 1, win 501, options [nop,nop,TS val 600699794 ecr 94518594], length 1314
00:08:51.649752 IP 10.8.0.7.38770 > 185.42.205.219.1935: Flags [.], seq 16208:17522, ack 1, win 501, options [nop,nop,TS val 600699826 ecr 94518594], length 1314
00:08:51.697129 IP 185.42.205.219.1935 > 10.8.0.7.38770: Flags [.], ack 10922, win 126, options [nop,nop,TS val 94518700 ecr 600699568], length 0
00:08:51.716652 IP 10.8.0.7.38770 > 185.42.205.219.1935: Flags [.], seq 17522:18836, ack 1, win 501, options [nop,nop,TS val 600699893 ecr 94518700], length 1314
00:08:51.753511 IP 10.8.0.7.38770 > 185.42.205.219.1935: Flags [.], seq 18836:20150, ack 1, win 501, options [nop,nop,TS val 600699930 ecr 94518700], length 1314
00:08:51.761129 IP 185.42.205.219.1935 > 10.8.0.7.38770: Flags [.], ack 13550, win 126, options [nop,nop,TS val 94518764 ecr 600699659], length 0
00:08:51.768338 IP 185.42.205.219.1935 > 10.8.0.7.38770: Flags [.], ack 13580, win 126, options [nop,nop,TS val 94518771 ecr 600699703], length 0
00:08:51.768349 IP 10.8.0.7.38770 > 185.42.205.219.1935: Flags [P.], seq 20150:20550, ack 1, win 501, options [nop,nop,TS val 600699945 ecr 94518771], length 400
00:08:51.820705 IP 10.8.0.7.38770 > 185.42.205.219.1935: Flags [.], seq 20550:21864, ack 1, win 501, options [nop,nop,TS val 600699997 ecr 94518771], length 1314
00:08:51.853362 IP 10.8.0.7.38770 > 185.42.205.219.1935: Flags [.], seq 21864:23178, ack 1, win 501, options [nop,nop,TS val 600700030 ecr 94518771], length 1314
00:08:51.859381 IP 185.42.205.219.1935 > 10.8.0.7.38770: Flags [.], ack 16208, win 126, options [nop,nop,TS val 94518862 ecr 600699763], length 0
00:08:51.887012 IP 10.8.0.7.38770 > 185.42.205.219.1935: Flags [.], seq 23178:24492, ack 1, win 501, options [nop,nop,TS val 600700063 ecr 94518862], length 1314
00:08:51.951900 IP 10.8.0.7.38770 > 185.42.205.219.1935: Flags [.], seq 24492:25806, ack 1, win 501, options [nop,nop,TS val 600700128 ecr 94518862], length 1314
00:08:51.953759 IP 185.42.205.219.1935 > 10.8.0.7.38770: Flags [.], ack 17522, win 126, options [nop,nop,TS val 94518956 ecr 600699826], length 0
00:08:51.988773 IP 10.8.0.7.38770 > 185.42.205.219.1935: Flags [.], seq 25806:27120, ack 1, win 501, options [nop,nop,TS val 600700165 ecr 94518956], length 1314
00:08:51.997343 IP 185.42.205.219.1935 > 10.8.0.7.38770: Flags [.], ack 20150, win 126, options [nop,nop,TS val 94518998 ecr 600699893], length 0
00:08:52.010131 IP 185.42.205.219.1935 > 10.8.0.7.38770: Flags [.], ack 20550, win 126, options [nop,nop,TS val 94519013 ecr 600699945], length 0
00:08:52.010163 IP 10.8.0.7.38770 > 185.42.205.219.1935: Flags [P.], seq 27120:27530, ack 1, win 501, options [nop,nop,TS val 600700186 ecr 94519013], length 410
00:08:52.053080 IP 10.8.0.7.38770 > 185.42.205.219.1935: Flags [.], seq 27530:28844, ack 1, win 501, options [nop,nop,TS val 600700229 ecr 94519013], length 1314
00:08:52.085689 IP 10.8.0.7.38770 > 185.42.205.219.1935: Flags [.], seq 28844:30158, ack 1, win 501, options [nop,nop,TS val 600700262 ecr 94519013], length 1314
00:08:52.095204 IP 185.42.205.219.1935 > 10.8.0.7.38770: Flags [.], ack 23178, win 126, options [nop,nop,TS val 94519098 ecr 600699997], length 0
00:08:52.120221 IP 10.8.0.7.38770 > 185.42.205.219.1935: Flags [.], seq 30158:31472, ack 1, win 501, options [nop,nop,TS val 600700297 ecr 94519098], length 1314
00:08:52.185393 IP 10.8.0.7.38770 > 185.42.205.219.1935: Flags [.], seq 31472:32786, ack 1, win 501, options [nop,nop,TS val 600700362 ecr 94519098], length 1314
00:08:52.193594 IP 185.42.205.219.1935 > 10.8.0.7.38770: Flags [.], ack 25806, win 126, options [nop,nop,TS val 94519196 ecr 600700063], length 0
00:08:52.219288 IP 10.8.0.7.38770 > 185.42.205.219.1935: Flags [.], seq 32786:34100, ack 1, win 501, options [nop,nop,TS val 600700396 ecr 94519196], length 1314
00:08:52.252078 IP 185.42.205.219.1935 > 10.8.0.7.38770: Flags [.], ack 27530, win 126, options [nop,nop,TS val 94519255 ecr 600700165], length 0
00:08:52.252138 IP 10.8.0.7.38770 > 185.42.205.219.1935: Flags [P.], seq 34100:34605, ack 1, win 501, options [nop,nop,TS val 600700428 ecr 94519255], length 505
00:08:52.288137 IP 10.8.0.7.38770 > 185.42.205.219.1935: Flags [.], seq 34605:35919, ack 1, win 501, options [nop,nop,TS val 600700464 ecr 94519255], length 1314
00:08:52.318422 IP 10.8.0.7.38770 > 185.42.205.219.1935: Flags [.], seq 35919:37233, ack 1, win 501, options [nop,nop,TS val 600700495 ecr 94519255], length 1314
00:08:52.327548 IP 185.42.205.219.1935 > 10.8.0.7.38770: Flags [.], ack 30158, win 126, options [nop,nop,TS val 94519330 ecr 600700229], length 0
00:08:52.373259 IP 10.8.0.7.38770 > 185.42.205.219.1935: Flags [.], seq 37233:38547, ack 1, win 501, options [nop,nop,TS val 600700550 ecr 94519330], length 1314
00:08:52.421064 IP 10.8.0.7.38770 > 185.42.205.219.1935: Flags [.], seq 38547:39861, ack 1, win 501, options [nop,nop,TS val 600700597 ecr 94519330], length 1314
00:08:52.427175 IP 185.42.205.219.1935 > 10.8.0.7.38770: Flags [.], ack 32786, win 126, options [nop,nop,TS val 94519430 ecr 600700297], length 0
00:08:52.452583 IP 10.8.0.7.38770 > 185.42.205.219.1935: Flags [.], seq 39861:41175, ack 1, win 501, options [nop,nop,TS val 600700629 ecr 94519430], length 1314
00:08:52.494173 IP 185.42.205.219.1935 > 10.8.0.7.38770: Flags [.], ack 34605, win 126, options [nop,nop,TS val 94519497 ecr 600700396], length 0
00:08:52.494216 IP 10.8.0.7.38770 > 185.42.205.219.1935: Flags [P.], seq 41175:42416, ack 1, win 501, options [nop,nop,TS val 600700671 ecr 94519497], length 1241
00:08:52.551808 IP 10.8.0.7.38770 > 185.42.205.219.1935: Flags [.], seq 42416:43730, ack 1, win 501, options [nop,nop,TS val 600700728 ecr 94519497], length 1314
00:08:52.560165 IP 185.42.205.219.1935 > 10.8.0.7.38770: Flags [.], ack 37233, win 126, options [nop,nop,TS val 94519563 ecr 600700464], length 0
00:08:52.586394 IP 10.8.0.7.38770 > 185.42.205.219.1935: Flags [.], seq 43730:45044, ack 1, win 501, options [nop,nop,TS val 600700763 ecr 94519563], length 1314
00:08:52.619003 IP 10.8.0.7.38770 > 185.42.205.219.1935: Flags [.], seq 45044:46358, ack 1, win 501, options [nop,nop,TS val 600700795 ecr 94519563], length 1314
00:08:52.662890 IP 185.42.205.219.1935 > 10.8.0.7.38770: Flags [.], ack 39861, win 126, options [nop,nop,TS val 94519666 ecr 600700550], length 0
00:08:52.685157 IP 10.8.0.7.38770 > 185.42.205.219.1935: Flags [.], seq 46358:47672, ack 1, win 501, options [nop,nop,TS val 600700861 ecr 94519666], length 1314
00:08:52.718272 IP 10.8.0.7.38770 > 185.42.205.219.1935: Flags [.], seq 47672:48986, ack 1, win 501, options [nop,nop,TS val 600700895 ecr 94519666], length 1314
00:08:52.735954 IP 185.42.205.219.1935 > 10.8.0.7.38770: Flags [.], ack 42416, win 126, options [nop,nop,TS val 94519739 ecr 600700629], length 0
00:08:52.735972 IP 10.8.0.7.38770 > 185.42.205.219.1935: Flags [P.], seq 48986:49491, ack 1, win 501, options [nop,nop,TS val 600700912 ecr 94519739], length 505
00:08:52.786646 IP 10.8.0.7.38770 > 185.42.205.219.1935: Flags [.], seq 49491:50805, ack 1, win 501, options [nop,nop,TS val 600700963 ecr 94519739], length 1314
00:08:52.821096 IP 10.8.0.7.38770 > 185.42.205.219.1935: Flags [.], seq 50805:52119, ack 1, win 501, options [nop,nop,TS val 600700997 ecr 94519739], length 1314
00:08:52.828179 IP 185.42.205.219.1935 > 10.8.0.7.38770: Flags [.], ack 45044, win 126, options [nop,nop,TS val 94519831 ecr 600700728], length 0
00:08:52.863814 IP 10.8.0.7.38770 > 185.42.205.219.1935: Flags [.], seq 52119:53433, ack 1, win 501, options [nop,nop,TS val 600701040 ecr 94519831], length 1314
00:08:52.920446 IP 10.8.0.7.38770 > 185.42.205.219.1935: Flags [.], seq 53433:54747, ack 1, win 501, options [nop,nop,TS val 600701097 ecr 94519831], length 1314
00:08:52.927110 IP 185.42.205.219.1935 > 10.8.0.7.38770: Flags [.], ack 47672, win 126, options [nop,nop,TS val 94519930 ecr 600700795], length 0
00:08:52.952874 IP 10.8.0.7.38770 > 185.42.205.219.1935: Flags [.], seq 54747:56061, ack 1, win 501, options [nop,nop,TS val 600701129 ecr 94519930], length 1314
00:08:52.977321 IP 185.42.205.219.1935 > 10.8.0.7.38770: Flags [.], ack 49491, win 126, options [nop,nop,TS val 94519980 ecr 600700895], length 0
00:08:52.977345 IP 10.8.0.7.38770 > 185.42.205.219.1935: Flags [P.], seq 56061:56472, ack 1, win 501, options [nop,nop,TS val 600701154 ecr 94519980], length 411
00:08:53.019518 IP 10.8.0.7.38770 > 185.42.205.219.1935: Flags [.], seq 56472:57786, ack 1, win 501, options [nop,nop,TS val 600701196 ecr 94519980], length 1314
00:08:53.056340 IP 10.8.0.7.38770 > 185.42.205.219.1935: Flags [.], seq 57786:59100, ack 1, win 501, options [nop,nop,TS val 600701233 ecr 94519980], length 1314
00:08:53.062977 IP 185.42.205.219.1935 > 10.8.0.7.38770: Flags [.], ack 52119, win 126, options [nop,nop,TS val 94520066 ecr 600700963], length 0
00:08:53.099331 IP 10.8.0.7.38770 > 185.42.205.219.1935: Flags [.], seq 59100:60414, ack 1, win 501, options [nop,nop,TS val 600701276 ecr 94520066], length 1314
00:08:53.152800 IP 10.8.0.7.38770 > 185.42.205.219.1935: Flags [.], seq 60414:61728, ack 1, win 501, options [nop,nop,TS val 600701329 ecr 94520066], length 1314
00:08:53.162182 IP 185.42.205.219.1935 > 10.8.0.7.38770: Flags [.], ack 54747, win 126, options [nop,nop,TS val 94520165 ecr 600701040], length 0
00:08:53.184951 IP 10.8.0.7.38770 > 185.42.205.219.1935: Flags [.], seq 61728:63042, ack 1, win 501, options [nop,nop,TS val 600701361 ecr 94520165], length 1314
00:08:53.218746 IP 185.42.205.219.1935 > 10.8.0.7.38770: Flags [.], ack 56472, win 126, options [nop,nop,TS val 94520222 ecr 600701129], length 0
00:08:53.218763 IP 10.8.0.7.38770 > 185.42.205.219.1935: Flags [P.], seq 63042:64287, ack 1, win 501, options [nop,nop,TS val 600701395 ecr 94520222], length 1245
00:08:53.285265 IP 10.8.0.7.38770 > 185.42.205.219.1935: Flags [.], seq 64287:65601, ack 1, win 501, options [nop,nop,TS val 600701462 ecr 94520222], length 1314
00:08:53.298155 IP 185.42.205.219.1935 > 10.8.0.7.38770: Flags [.], ack 59100, win 126, options [nop,nop,TS val 94520301 ecr 600701196], length 0
00:08:53.320039 IP 10.8.0.7.38770 > 185.42.205.219.1935: Flags [.], seq 65601:66915, ack 1, win 501, options [nop,nop,TS val 600701496 ecr 94520301], length 1314
00:08:53.355935 IP 10.8.0.7.38770 > 185.42.205.219.1935: Flags [.], seq 66915:68229, ack 1, win 501, options [nop,nop,TS val 600701532 ecr 94520301], length 1314
00:08:53.394701 IP 185.42.205.219.1935 > 10.8.0.7.38770: Flags [.], ack 61728, win 126, options [nop,nop,TS val 94520398 ecr 600701276], length 0
00:08:53.420101 IP 10.8.0.7.38770 > 185.42.205.219.1935: Flags [.], seq 68229:69543, ack 1, win 501, options [nop,nop,TS val 600701596 ecr 94520398], length 1314
00:08:53.451895 IP 10.8.0.7.38770 > 185.42.205.219.1935: Flags [.], seq 69543:70857, ack 1, win 501, options [nop,nop,TS val 600701628 ecr 94520398], length 1314
00:08:53.460913 IP 185.42.205.219.1935 > 10.8.0.7.38770: Flags [.], ack 64287, win 126, options [nop,nop,TS val 94520463 ecr 600701361], length 0
00:08:53.460943 IP 10.8.0.7.38770 > 185.42.205.219.1935: Flags [P.], seq 70857:71259, ack 1, win 501, options [nop,nop,TS val 600701637 ecr 94520463], length 402
00:08:53.519769 IP 10.8.0.7.38770 > 185.42.205.219.1935: Flags [.], seq 71259:72573, ack 1, win 501, options [nop,nop,TS val 600701696 ecr 94520463], length 1314
00:08:53.552777 IP 10.8.0.7.38770 > 185.42.205.219.1935: Flags [.], seq 72573:73887, ack 1, win 501, options [nop,nop,TS val 600701729 ecr 94520463], length 1314
00:08:53.561949 IP 185.42.205.219.1935 > 10.8.0.7.38770: Flags [.], ack 66915, win 126, options [nop,nop,TS val 94520565 ecr 600701462], length 0
00:08:53.591624 IP 10.8.0.7.38770 > 185.42.205.219.1935: Flags [.], seq 73887:75201, ack 1, win 501, options [nop,nop,TS val 600701768 ecr 94520565], length 1314
00:08:53.655787 IP 10.8.0.7.38770 > 185.42.205.219.1935: Flags [.], seq 75201:76515, ack 1, win 501, options [nop,nop,TS val 600701832 ecr 94520565], length 1314
00:08:53.662044 IP 185.42.205.219.1935 > 10.8.0.7.38770: Flags [.], ack 69543, win 126, options [nop,nop,TS val 94520665 ecr 600701532], length 0
00:08:53.685449 IP 10.8.0.7.38770 > 185.42.205.219.1935: Flags [.], seq 76515:77829, ack 1, win 501, options [nop,nop,TS val 600701862 ecr 94520665], length 1314
00:08:53.702448 IP 185.42.205.219.1935 > 10.8.0.7.38770: Flags [.], ack 71259, win 126, options [nop,nop,TS val 94520705 ecr 600701628], length 0
00:08:53.702480 IP 10.8.0.7.38770 > 185.42.205.219.1935: Flags [P.], seq 77829:78334, ack 1, win 501, options [nop,nop,TS val 600701879 ecr 94520705], length 505
00:08:53.752378 IP 10.8.0.7.38770 > 185.42.205.219.1935: Flags [.], seq 78334:79648, ack 1, win 501, options [nop,nop,TS val 600701929 ecr 94520705], length 1314
00:08:53.785728 IP 10.8.0.7.38770 > 185.42.205.219.1935: Flags [.], seq 79648:80962, ack 1, win 501, options [nop,nop,TS val 600701962 ecr 94520705], length 1314
00:08:53.794571 IP 185.42.205.219.1935 > 10.8.0.7.38770: Flags [.], ack 73887, win 126, options [nop,nop,TS val 94520797 ecr 600701696], length 0
00:08:53.826999 IP 10.8.0.7.38770 > 185.42.205.219.1935: Flags [.], seq 80962:82276, ack 1, win 501, options [nop,nop,TS val 600702003 ecr 94520797], length 1314
00:08:53.891076 IP 10.8.0.7.38770 > 185.42.205.219.1935: Flags [.], seq 82276:83590, ack 1, win 501, options [nop,nop,TS val 600702067 ecr 94520797], length 1314
00:08:53.897527 IP 185.42.205.219.1935 > 10.8.0.7.38770: Flags [.], ack 76515, win 126, options [nop,nop,TS val 94520900 ecr 600701768], length 0
00:08:53.917134 IP 10.8.0.7.38770 > 185.42.205.219.1935: Flags [.], seq 83590:84904, ack 1, win 501, options [nop,nop,TS val 600702093 ecr 94520900], length 1314
00:08:53.943958 IP 185.42.205.219.1935 > 10.8.0.7.38770: Flags [.], ack 78334, win 126, options [nop,nop,TS val 94520947 ecr 600701862], length 0
00:08:53.943994 IP 10.8.0.7.38770 > 185.42.205.219.1935: Flags [P.], seq 84904:85311, ack 1, win 501, options [nop,nop,TS val 600702120 ecr 94520947], length 407
00:08:53.986738 IP 10.8.0.7.38770 > 185.42.205.219.1935: Flags [.], seq 85311:86625, ack 1, win 501, options [nop,nop,TS val 600702163 ecr 94520947], length 1314
00:08:54.020138 IP 10.8.0.7.38770 > 185.42.205.219.1935: Flags [.], seq 86625:87939, ack 1, win 501, options [nop,nop,TS val 600702196 ecr 94520947], length 1314
00:08:54.027696 IP 185.42.205.219.1935 > 10.8.0.7.38770: Flags [.], ack 80962, win 126, options [nop,nop,TS val 94521030 ecr 600701929], length 0
00:08:54.062091 IP 10.8.0.7.38770 > 185.42.205.219.1935: Flags [.], seq 87939:89253, ack 1, win 501, options [nop,nop,TS val 600702238 ecr 94521030], length 1314
00:08:54.126164 IP 10.8.0.7.38770 > 185.42.205.219.1935: Flags [.], seq 89253:90567, ack 1, win 501, options [nop,nop,TS val 600702302 ecr 94521030], length 1314
00:08:54.132902 IP 185.42.205.219.1935 > 10.8.0.7.38770: Flags [.], ack 83590, win 126, options [nop,nop,TS val 94521136 ecr 600702003], length 0
00:08:54.149464 IP 10.8.0.7.38770 > 185.42.205.219.1935: Flags [.], seq 90567:91881, ack 1, win 501, options [nop,nop,TS val 600702326 ecr 94521136], length 1314
00:08:54.185924 IP 185.42.205.219.1935 > 10.8.0.7.38770: Flags [.], ack 85311, win 126, options [nop,nop,TS val 94521189 ecr 600702093], length 0
00:08:54.185949 IP 10.8.0.7.38770 > 185.42.205.219.1935: Flags [P.], seq 91881:92375, ack 1, win 501, options [nop,nop,TS val 600702362 ecr 94521189], length 494
00:08:54.220001 IP 10.8.0.7.38770 > 185.42.205.219.1935: Flags [.], seq 92375:93689, ack 1, win 501, options [nop,nop,TS val 600702396 ecr 94521189], length 1314
00:08:54.254421 IP 10.8.0.7.38770 > 185.42.205.219.1935: Flags [.], seq 93689:95003, ack 1, win 501, options [nop,nop,TS val 600702431 ecr 94521189], length 1314
00:08:54.261862 IP 185.42.205.219.1935 > 10.8.0.7.38770: Flags [.], ack 87939, win 126, options [nop,nop,TS val 94521265 ecr 600702163], length 0
00:08:54.318588 IP 10.8.0.7.38770 > 185.42.205.219.1935: Flags [.], seq 95003:96317, ack 1, win 501, options [nop,nop,TS val 600702495 ecr 94521265], length 1314
00:08:54.352758 IP 10.8.0.7.38770 > 185.42.205.219.1935: Flags [.], seq 96317:97631, ack 1, win 501, options [nop,nop,TS val 600702529 ecr 94521265], length 1314
00:08:54.367793 IP 185.42.205.219.1935 > 10.8.0.7.38770: Flags [.], ack 90567, win 126, options [nop,nop,TS val 94521371 ecr 600702238], length 0
00:08:54.386612 IP 10.8.0.7.38770 > 185.42.205.219.1935: Flags [.], seq 97631:98945, ack 1, win 501, options [nop,nop,TS val 600702563 ecr 94521371], length 1314
00:08:54.427742 IP 185.42.205.219.1935 > 10.8.0.7.38770: Flags [.], ack 92375, win 126, options [nop,nop,TS val 94521431 ecr 600702326], length 0
00:08:54.427788 IP 10.8.0.7.38770 > 185.42.205.219.1935: Flags [P.], seq 98945:100202, ack 1, win 501, options [nop,nop,TS val 600702604 ecr 94521431], length 1257
00:08:54.490376 IP 10.8.0.7.38770 > 185.42.205.219.1935: Flags [.], seq 100202:101516, ack 1, win 501, options [nop,nop,TS val 600702667 ecr 94521431], length 1314
00:08:54.496149 IP 185.42.205.219.1935 > 10.8.0.7.38770: Flags [.], ack 95003, win 126, options [nop,nop,TS val 94521499 ecr 600702396], length 0
00:08:54.519651 IP 10.8.0.7.38770 > 185.42.205.219.1935: Flags [.], seq 101516:102830, ack 1, win 501, options [nop,nop,TS val 600702696 ecr 94521499], length 1314
00:08:54.554696 IP 10.8.0.7.38770 > 185.42.205.219.1935: Flags [.], seq 102830:104144, ack 1, win 501, options [nop,nop,TS val 600702731 ecr 94521499], length 1314
00:08:54.594368 IP 185.42.205.219.1935 > 10.8.0.7.38770: Flags [.], ack 97631, win 126, options [nop,nop,TS val 94521597 ecr 600702495], length 0
00:08:54.619815 IP 10.8.0.7.38770 > 185.42.205.219.1935: Flags [.], seq 104144:105458, ack 1, win 501, options [nop,nop,TS val 600702796 ecr 94521597], length 1314
00:08:54.661934 IP 10.8.0.7.38770 > 185.42.205.219.1935: Flags [.], seq 105458:106772, ack 1, win 501, options [nop,nop,TS val 600702838 ecr 94521597], length 1314
00:08:54.669733 IP 185.42.205.219.1935 > 10.8.0.7.38770: Flags [.], ack 100202, win 126, options [nop,nop,TS val 94521672 ecr 600702563], length 0
00:08:54.669764 IP 10.8.0.7.38770 > 185.42.205.219.1935: Flags [P.], seq 106772:107178, ack 1, win 501, options [nop,nop,TS val 600702846 ecr 94521672], length 406
00:08:54.726123 IP 10.8.0.7.38770 > 185.42.205.219.1935: Flags [.], seq 107178:108492, ack 1, win 501, options [nop,nop,TS val 600702902 ecr 94521672], length 1314
00:08:54.752630 IP 10.8.0.7.38770 > 185.42.205.219.1935: Flags [.], seq 108492:109806, ack 1, win 501, options [nop,nop,TS val 600702929 ecr 94521672], length 1314
00:08:54.761370 IP 185.42.205.219.1935 > 10.8.0.7.38770: Flags [.], ack 102830, win 126, options [nop,nop,TS val 94521764 ecr 600702667], length 0
00:08:54.790488 IP 10.8.0.7.38770 > 185.42.205.219.1935: Flags [.], seq 109806:111120, ack 1, win 501, options [nop,nop,TS val 600702967 ecr 94521764], length 1314
00:08:54.854689 IP 10.8.0.7.38770 > 185.42.205.219.1935: Flags [.], seq 111120:112434, ack 1, win 501, options [nop,nop,TS val 600703031 ecr 94521764], length 1314
00:08:54.861776 IP 185.42.205.219.1935 > 10.8.0.7.38770: Flags [.], ack 105458, win 126, options [nop,nop,TS val 94521865 ecr 600702731], length 0
00:08:54.886266 IP 10.8.0.7.38770 > 185.42.205.219.1935: Flags [.], seq 112434:113748, ack 1, win 501, options [nop,nop,TS val 600703063 ecr 94521865], length 1314
00:08:54.911407 IP 185.42.205.219.1935 > 10.8.0.7.38770: Flags [.], ack 107178, win 126, options [nop,nop,TS val 94521914 ecr 600702838], length 0
00:08:54.911439 IP 10.8.0.7.38770 > 185.42.205.219.1935: Flags [P.], seq 113748:114146, ack 1, win 501, options [nop,nop,TS val 600703088 ecr 94521914], length 398
00:08:54.961756 IP 10.8.0.7.38770 > 185.42.205.219.1935: Flags [.], seq 114146:115460, ack 1, win 501, options [nop,nop,TS val 600703138 ecr 94521914], length 1314
00:08:54.985898 IP 10.8.0.7.38770 > 185.42.205.219.1935: Flags [.], seq 115460:116774, ack 1, win 501, options [nop,nop,TS val 600703162 ecr 94521914], length 1314
00:08:54.996940 IP 185.42.205.219.1935 > 10.8.0.7.38770: Flags [.], ack 109806, win 126, options [nop,nop,TS val 94521997 ecr 600702902], length 0
00:08:55.025983 IP 10.8.0.7.38770 > 185.42.205.219.1935: Flags [.], seq 116774:118088, ack 1, win 501, options [nop,nop,TS val 600703202 ecr 94521997], length 1314
00:08:55.090241 IP 10.8.0.7.38770 > 185.42.205.219.1935: Flags [.], seq 118088:119402, ack 1, win 501, options [nop,nop,TS val 600703267 ecr 94521997], length 1314
00:08:55.096421 IP 185.42.205.219.1935 > 10.8.0.7.38770: Flags [.], ack 112434, win 126, options [nop,nop,TS val 94522099 ecr 600702967], length 0
00:08:55.119023 IP 10.8.0.7.38770 > 185.42.205.219.1935: Flags [.], seq 119402:120716, ack 1, win 501, options [nop,nop,TS val 600703295 ecr 94522099], length 1314
00:08:55.153566 IP 185.42.205.219.1935 > 10.8.0.7.38770: Flags [.], ack 114146, win 126, options [nop,nop,TS val 94522156 ecr 600703063], length 0
00:08:55.153602 IP 10.8.0.7.38770 > 185.42.205.219.1935: Flags [P.], seq 120716:121217, ack 1, win 501, options [nop,nop,TS val 600703330 ecr 94522156], length 501
00:08:55.196953 IP 10.8.0.7.38770 > 185.42.205.219.1935: Flags [.], seq 121217:122531, ack 1, win 501, options [nop,nop,TS val 600703373 ecr 94522156], length 1314
00:08:55.218189 IP 10.8.0.7.38770 > 185.42.205.219.1935: Flags [.], seq 122531:123845, ack 1, win 501, options [nop,nop,TS val 600703395 ecr 94522156], length 1314
00:08:55.227888 IP 185.42.205.219.1935 > 10.8.0.7.38770: Flags [.], ack 116774, win 126, options [nop,nop,TS val 94522231 ecr 600703138], length 0
00:08:55.282212 IP 10.8.0.7.38770 > 185.42.205.219.1935: Flags [.], seq 123845:125159, ack 1, win 501, options [nop,nop,TS val 600703459 ecr 94522231], length 1314
00:08:55.325099 IP 10.8.0.7.38770 > 185.42.205.219.1935: Flags [.], seq 125159:126473, ack 1, win 501, options [nop,nop,TS val 600703501 ecr 94522231], length 1314
00:08:55.332121 IP 185.42.205.219.1935 > 10.8.0.7.38770: Flags [.], ack 119402, win 126, options [nop,nop,TS val 94522335 ecr 600703202], length 0
00:08:55.354938 IP 10.8.0.7.38770 > 185.42.205.219.1935: Flags [.], seq 126473:127787, ack 1, win 501, options [nop,nop,TS val 600703531 ecr 94522335], length 1314
00:08:55.395171 IP 185.42.205.219.1935 > 10.8.0.7.38770: Flags [.], ack 121217, win 126, options [nop,nop,TS val 94522398 ecr 600703295], length 0
00:08:55.395210 IP 10.8.0.7.38770 > 185.42.205.219.1935: Flags [P.], seq 127787:129045, ack 1, win 501, options [nop,nop,TS val 600703572 ecr 94522398], length 1258
00:08:55.453970 IP 10.8.0.7.38770 > 185.42.205.219.1935: Flags [.], seq 129045:130359, ack 1, win 501, options [nop,nop,TS val 600703630 ecr 94522398], length 1314
00:08:55.460060 IP 185.42.205.219.1935 > 10.8.0.7.38770: Flags [.], ack 123845, win 126, options [nop,nop,TS val 94522463 ecr 600703373], length 0
00:08:55.496968 IP 10.8.0.7.38770 > 185.42.205.219.1935: Flags [.], seq 130359:131673, ack 1, win 501, options [nop,nop,TS val 600703673 ecr 94522463], length 1314
00:08:55.518123 IP 10.8.0.7.38770 > 185.42.205.219.1935: Flags [.], seq 131673:132987, ack 1, win 501, options [nop,nop,TS val 600703694 ecr 94522463], length 1314
00:08:55.567135 IP 185.42.205.219.1935 > 10.8.0.7.38770: Flags [.], ack 126473, win 126, options [nop,nop,TS val 94522570 ecr 600703459], length 0
00:08:55.586863 IP 10.8.0.7.38770 > 185.42.205.219.1935: Flags [.], seq 132987:134301, ack 1, win 501, options [nop,nop,TS val 600703763 ecr 94522570], length 1314
00:08:55.625277 IP 10.8.0.7.38770 > 185.42.205.219.1935: Flags [.], seq 134301:135615, ack 1, win 501, options [nop,nop,TS val 600703802 ecr 94522570], length 1314
00:08:55.636918 IP 185.42.205.219.1935 > 10.8.0.7.38770: Flags [.], ack 129045, win 126, options [nop,nop,TS val 94522640 ecr 600703531], length 0
00:08:55.636943 IP 10.8.0.7.38770 > 185.42.205.219.1935: Flags [P.], seq 135615:136012, ack 1, win 501, options [nop,nop,TS val 600703813 ecr 94522640], length 397
00:08:55.689320 IP 10.8.0.7.38770 > 185.42.205.219.1935: Flags [.], seq 136012:137326, ack 1, win 501, options [nop,nop,TS val 600703866 ecr 94522640], length 1314
00:08:55.732135 IP 10.8.0.7.38770 > 185.42.205.219.1935: Flags [.], seq 137326:138640, ack 1, win 501, options [nop,nop,TS val 600703908 ecr 94522640], length 1314
00:08:55.738938 IP 185.42.205.219.1935 > 10.8.0.7.38770: Flags [.], ack 131673, win 126, options [nop,nop,TS val 94522742 ecr 600703630], length 0
00:08:55.753478 IP 10.8.0.7.38770 > 185.42.205.219.1935: Flags [.], seq 138640:139954, ack 1, win 501, options [nop,nop,TS val 600703930 ecr 94522742], length 1314
00:08:55.819925 IP 10.8.0.7.38770 > 185.42.205.219.1935: Flags [.], seq 139954:141268, ack 1, win 501, options [nop,nop,TS val 600703996 ecr 94522742], length 1314
00:08:55.825789 IP 185.42.205.219.1935 > 10.8.0.7.38770: Flags [.], ack 132987, win 126, options [nop,nop,TS val 94522828 ecr 600703694], length 0
00:08:55.860903 IP 10.8.0.7.38770 > 185.42.205.219.1935: Flags [.], seq 141268:142582, ack 1, win 501, options [nop,nop,TS val 600704037 ecr 94522828], length 1314
00:08:55.867326 IP 185.42.205.219.1935 > 10.8.0.7.38770: Flags [.], ack 135615, win 126, options [nop,nop,TS val 94522870 ecr 600703763], length 0
00:08:55.879000 IP 185.42.205.219.1935 > 10.8.0.7.38770: Flags [.], ack 136012, win 126, options [nop,nop,TS val 94522882 ecr 600703813], length 0
00:08:55.879032 IP 10.8.0.7.38770 > 185.42.205.219.1935: Flags [P.], seq 142582:142990, ack 1, win 501, options [nop,nop,TS val 600704055 ecr 94522882], length 408
00:08:55.925095 IP 10.8.0.7.38770 > 185.42.205.219.1935: Flags [.], seq 142990:144304, ack 1, win 501, options [nop,nop,TS val 600704101 ecr 94522882], length 1314
00:08:55.952587 IP 10.8.0.7.38770 > 185.42.205.219.1935: Flags [.], seq 144304:145618, ack 1, win 501, options [nop,nop,TS val 600704129 ecr 94522882], length 1314
00:08:55.974065 IP 185.42.205.219.1935 > 10.8.0.7.38770: Flags [.], ack 138640, win 126, options [nop,nop,TS val 94522977 ecr 600703866], length 0
00:08:55.989514 IP 10.8.0.7.38770 > 185.42.205.219.1935: Flags [.], seq 145618:146932, ack 1, win 501, options [nop,nop,TS val 600704166 ecr 94522977], length 1314
00:08:56.053076 IP 10.8.0.7.38770 > 185.42.205.219.1935: Flags [.], seq 146932:148246, ack 1, win 501, options [nop,nop,TS val 600704229 ecr 94522977], length 1314
00:08:56.061895 IP 185.42.205.219.1935 > 10.8.0.7.38770: Flags [.], ack 141268, win 126, options [nop,nop,TS val 94523065 ecr 600703930], length 0
00:08:56.095823 IP 10.8.0.7.38770 > 185.42.205.219.1935: Flags [.], seq 148246:149560, ack 1, win 501, options [nop,nop,TS val 600704272 ecr 94523065], length 1314
00:08:56.120392 IP 10.8.0.7.38770 > 185.42.205.219.1935: Flags [.], seq 149560:150874, ack 1, win 501, options [nop,nop,TS val 600704297 ecr 94523065], length 1314
00:08:56.120638 IP 185.42.205.219.1935 > 10.8.0.7.38770: Flags [.], ack 142990, win 126, options [nop,nop,TS val 94523124 ecr 600704037], length 0
00:08:56.120676 IP 10.8.0.7.38770 > 185.42.205.219.1935: Flags [P.], seq 150874:150912, ack 1, win 501, options [nop,nop,TS val 600704297 ecr 94523124], length 38
00:08:56.185005 IP 10.8.0.7.38770 > 185.42.205.219.1935: Flags [.], seq 150912:152226, ack 1, win 501, options [nop,nop,TS val 600704361 ecr 94523124], length 1314
00:08:56.194558 IP 185.42.205.219.1935 > 10.8.0.7.38770: Flags [.], ack 145618, win 126, options [nop,nop,TS val 94523198 ecr 600704101], length 0
00:08:56.224350 IP 10.8.0.7.38770 > 185.42.205.219.1935: Flags [.], seq 152226:153540, ack 1, win 501, options [nop,nop,TS val 600704401 ecr 94523198], length 1314
00:08:56.267270 IP 10.8.0.7.38770 > 185.42.205.219.1935: Flags [.], seq 153540:154854, ack 1, win 501, options [nop,nop,TS val 600704444 ecr 94523198], length 1314
00:08:56.331447 IP 10.8.0.7.38770 > 185.42.205.219.1935: Flags [.], seq 154854:156168, ack 1, win 501, options [nop,nop,TS val 600704508 ecr 94523198], length 1314
00:08:56.352823 IP 10.8.0.7.38770 > 185.42.205.219.1935: Flags [.], seq 156168:157482, ack 1, win 501, options [nop,nop,TS val 600704529 ecr 94523198], length 1314
00:08:56.395758 IP 10.8.0.7.38770 > 185.42.205.219.1935: Flags [.], seq 157482:158796, ack 1, win 501, options [nop,nop,TS val 600704572 ecr 94523198], length 1314
00:08:56.459860 IP 10.8.0.7.38770 > 185.42.205.219.1935: Flags [.], seq 158796:160110, ack 1, win 501, options [nop,nop,TS val 600704636 ecr 94523198], length 1314
00:08:56.474142 IP 10.8.0.7.38770 > 185.42.205.219.1935: Flags [P.], seq 160110:160895, ack 1, win 501, options [nop,nop,TS val 600704650 ecr 94523198], length 785
00:08:56.524393 IP 10.8.0.7.38770 > 185.42.205.219.1935: Flags [.], seq 160895:162209, ack 1, win 501, options [nop,nop,TS val 600704701 ecr 94523198], length 1314
00:08:56.567377 IP 10.8.0.7.38770 > 185.42.205.219.1935: Flags [.], seq 162209:163523, ack 1, win 501, options [nop,nop,TS val 600704744 ecr 94523198], length 1314
00:08:56.588724 IP 10.8.0.7.38770 > 185.42.205.219.1935: Flags [.], seq 163523:164837, ack 1, win 501, options [nop,nop,TS val 600704765 ecr 94523198], length 1314
00:08:57.178126 IP 10.8.0.7.38770 > 185.42.205.219.1935: Flags [.], seq 145618:146932, ack 1, win 501, options [nop,nop,TS val 600705354 ecr 94523198], length 1314
00:08:58.162170 IP 10.8.0.7.38770 > 185.42.205.219.1935: Flags [.], seq 145618:146932, ack 1, win 501, options [nop,nop,TS val 600706338 ecr 94523198], length 1314
00:08:58.226152 IP 185.42.205.219.1935 > 10.8.0.7.38770: Flags [.], ack 146932, win 126, options [nop,nop,TS val 94525229 ecr 600704166], length 0
00:08:58.226218 IP 10.8.0.7.38770 > 185.42.205.219.1935: Flags [.], seq 164837:166151, ack 1, win 501, options [nop,nop,TS val 600706403 ecr 94525229], length 1314
00:08:58.226221 IP 10.8.0.7.38770 > 185.42.205.219.1935: Flags [P.], seq 166151:167465, ack 1, win 501, options [nop,nop,TS val 600706403 ecr 94525229], length 1314
00:08:58.226250 IP 185.42.205.219.1935 > 10.8.0.7.38770: Flags [.], ack 148246, win 126, options [nop,nop,TS val 94525229 ecr 600704229], length 0
00:08:58.226266 IP 10.8.0.7.38770 > 185.42.205.219.1935: Flags [.], seq 167465:168779, ack 1, win 501, options [nop,nop,TS val 600706403 ecr 94525229], length 1314
00:08:58.226268 IP 10.8.0.7.38770 > 185.42.205.219.1935: Flags [P.], seq 168779:170093, ack 1, win 501, options [nop,nop,TS val 600706403 ecr 94525229], length 1314
00:08:58.226285 IP 185.42.205.219.1935 > 10.8.0.7.38770: Flags [.], ack 149560, win 126, options [nop,nop,TS val 94525229 ecr 600704272], length 0
00:08:58.226300 IP 10.8.0.7.38770 > 185.42.205.219.1935: Flags [.], seq 170093:171407, ack 1, win 501, options [nop,nop,TS val 600706403 ecr 94525229], length 1314
00:08:58.226302 IP 10.8.0.7.38770 > 185.42.205.219.1935: Flags [P.], seq 171407:172721, ack 1, win 501, options [nop,nop,TS val 600706403 ecr 94525229], length 1314
00:08:58.226318 IP 185.42.205.219.1935 > 10.8.0.7.38770: Flags [.], ack 150874, win 124, options [nop,nop,TS val 94525229 ecr 600704297], length 0
00:08:58.226333 IP 10.8.0.7.38770 > 185.42.205.219.1935: Flags [.], seq 172721:174035, ack 1, win 501, options [nop,nop,TS val 600706403 ecr 94525229], length 1314
00:08:58.226334 IP 10.8.0.7.38770 > 185.42.205.219.1935: Flags [P.], seq 174035:175349, ack 1, win 501, options [nop,nop,TS val 600706403 ecr 94525229], length 1314
00:08:58.226350 IP 185.42.205.219.1935 > 10.8.0.7.38770: Flags [.], ack 150912, win 124, options [nop,nop,TS val 94525229 ecr 600704297], length 0
00:08:58.226364 IP 10.8.0.7.38770 > 185.42.205.219.1935: Flags [.], seq 175349:176663, ack 1, win 501, options [nop,nop,TS val 600706403 ecr 94525229], length 1314
00:08:58.226366 IP 10.8.0.7.38770 > 185.42.205.219.1935: Flags [P.], seq 176663:177977, ack 1, win 501, options [nop,nop,TS val 600706403 ecr 94525229], length 1314
00:08:58.226383 IP 185.42.205.219.1935 > 10.8.0.7.38770: Flags [.], ack 152226, win 122, options [nop,nop,TS val 94525229 ecr 600704361], length 0
00:08:58.226396 IP 10.8.0.7.38770 > 185.42.205.219.1935: Flags [.], seq 177977:179291, ack 1, win 501, options [nop,nop,TS val 600706403 ecr 94525229], length 1314
00:08:58.226397 IP 10.8.0.7.38770 > 185.42.205.219.1935: Flags [P.], seq 179291:180605, ack 1, win 501, options [nop,nop,TS val 600706403 ecr 94525229], length 1314
00:08:58.226427 IP 185.42.205.219.1935 > 10.8.0.7.38770: Flags [.], ack 153540, win 126, options [nop,nop,TS val 94525229 ecr 600704401], length 0
00:08:58.226445 IP 10.8.0.7.38770 > 185.42.205.219.1935: Flags [.], seq 180605:181919, ack 1, win 501, options [nop,nop,TS val 600706403 ecr 94525229], length 1314
00:08:58.226446 IP 10.8.0.7.38770 > 185.42.205.219.1935: Flags [P.], seq 181919:183233, ack 1, win 501, options [nop,nop,TS val 600706403 ecr 94525229], length 1314
00:08:58.226470 IP 185.42.205.219.1935 > 10.8.0.7.38770: Flags [.], ack 154854, win 126, options [nop,nop,TS val 94525229 ecr 600704444], length 0
00:08:58.226488 IP 10.8.0.7.38770 > 185.42.205.219.1935: Flags [.], seq 183233:184547, ack 1, win 501, options [nop,nop,TS val 600706403 ecr 94525229], length 1314
00:08:58.226490 IP 10.8.0.7.38770 > 185.42.205.219.1935: Flags [P.], seq 184547:185861, ack 1, win 501, options [nop,nop,TS val 600706403 ecr 94525229], length 1314
00:08:58.226511 IP 185.42.205.219.1935 > 10.8.0.7.38770: Flags [.], ack 156168, win 126, options [nop,nop,TS val 94525229 ecr 600704508], length 0
00:08:58.226548 IP 10.8.0.7.38770 > 185.42.205.219.1935: Flags [.], seq 185861:187175, ack 1, win 501, options [nop,nop,TS val 600706403 ecr 94525229], length 1314
00:08:58.226549 IP 10.8.0.7.38770 > 185.42.205.219.1935: Flags [P.], seq 187175:188489, ack 1, win 501, options [nop,nop,TS val 600706403 ecr 94525229], length 1314
00:08:58.226567 IP 185.42.205.219.1935 > 10.8.0.7.38770: Flags [.], ack 157482, win 126, options [nop,nop,TS val 94525229 ecr 600704529], length 0
00:08:58.226579 IP 10.8.0.7.38770 > 185.42.205.219.1935: Flags [.], seq 188489:189803, ack 1, win 501, options [nop,nop,TS val 600706403 ecr 94525229], length 1314
00:08:58.226580 IP 10.8.0.7.38770 > 185.42.205.219.1935: Flags [P.], seq 189803:191117, ack 1, win 501, options [nop,nop,TS val 600706403 ecr 94525229], length 1314
00:08:58.226596 IP 185.42.205.219.1935 > 10.8.0.7.38770: Flags [.], ack 158796, win 126, options [nop,nop,TS val 94525229 ecr 600704572], length 0
00:08:58.226609 IP 10.8.0.7.38770 > 185.42.205.219.1935: Flags [.], seq 191117:192431, ack 1, win 501, options [nop,nop,TS val 600706403 ecr 94525229], length 1314
00:08:58.226611 IP 10.8.0.7.38770 > 185.42.205.219.1935: Flags [P.], seq 192431:193745, ack 1, win 501, options [nop,nop,TS val 600706403 ecr 94525229], length 1314
00:08:58.226626 IP 185.42.205.219.1935 > 10.8.0.7.38770: Flags [.], ack 160110, win 126, options [nop,nop,TS val 94525230 ecr 600704636], length 0
00:08:58.226637 IP 10.8.0.7.38770 > 185.42.205.219.1935: Flags [.], seq 193745:195059, ack 1, win 501, options [nop,nop,TS val 600706403 ecr 94525230], length 1314
00:08:58.226639 IP 10.8.0.7.38770 > 185.42.205.219.1935: Flags [P.], seq 195059:196373, ack 1, win 501, options [nop,nop,TS val 600706403 ecr 94525230], length 1314
00:08:58.226654 IP 185.42.205.219.1935 > 10.8.0.7.38770: Flags [.], ack 160895, win 125, options [nop,nop,TS val 94525230 ecr 600704650], length 0
00:08:58.226682 IP 185.42.205.219.1935 > 10.8.0.7.38770: Flags [.], ack 162209, win 126, options [nop,nop,TS val 94525230 ecr 600704701], length 0
00:08:58.226697 IP 185.42.205.219.1935 > 10.8.0.7.38770: Flags [.], ack 163523, win 126, options [nop,nop,TS val 94525230 ecr 600704744], length 0
00:08:58.226763 IP 10.8.0.7.38770 > 185.42.205.219.1935: Flags [P.], seq 196373:196718, ack 1, win 501, options [nop,nop,TS val 600706403 ecr 94525230], length 345
00:08:58.226799 IP 185.42.205.219.1935 > 10.8.0.7.38770: Flags [.], ack 164837, win 126, options [nop,nop,TS val 94525230 ecr 600704765], length 0
00:08:58.226855 IP 10.8.0.7.38770 > 185.42.205.219.1935: Flags [.], seq 196718:198032, ack 1, win 501, options [nop,nop,TS val 600706403 ecr 94525230], length 1314
00:08:58.226879 IP 10.8.0.7.38770 > 185.42.205.219.1935: Flags [.], seq 198032:199346, ack 1, win 501, options [nop,nop,TS val 600706403 ecr 94525230], length 1314
00:08:58.226905 IP 10.8.0.7.38770 > 185.42.205.219.1935: Flags [.], seq 199346:200660, ack 1, win 501, options [nop,nop,TS val 600706403 ecr 94525230], length 1314
00:08:58.226960 IP 10.8.0.7.38770 > 185.42.205.219.1935: Flags [.], seq 200660:201974, ack 1, win 501, options [nop,nop,TS val 600706403 ecr 94525230], length 1314
00:08:58.226986 IP 185.42.205.219.1935 > 10.8.0.7.38770: Flags [.], ack 164837, win 126, options [nop,nop,TS val 94525230 ecr 600704765,nop,nop,sack 1 {145618:146932}], length 0
