15:58:19.385001 IP 10.8.1.3.49670 > 185.42.204.81.1935: Flags [.], seq 4243482654:4243483968, ack 1317529405, win 501, options [nop,nop,TS val 864871668 ecr 524924838], length 1314
15:58:19.419540 IP 185.42.204.81.1935 > 10.8.1.3.49670: Flags [.], ack 4294957010, win 126, options [nop,nop,TS val 524924939 ecr 864871240], length 0
15:58:19.423445 IP 10.8.1.3.49670 > 185.42.204.81.1935: Flags [.], seq 1314:2628, ack 1, win 501, options [nop,nop,TS val 864871707 ecr 524924939], length 1314
15:58:19.449018 IP 10.8.1.3.49670 > 185.42.204.81.1935: Flags [.], seq 2628:3942, ack 1, win 501, options [nop,nop,TS val 864871732 ecr 524924939], length 1314
15:58:19.488406 IP 185.42.204.81.1935 > 10.8.1.3.49670: Flags [.], ack 4294959412, win 126, options [nop,nop,TS val 524925008 ecr 864871305], length 0
15:58:19.488475 IP 10.8.1.3.49670 > 185.42.204.81.1935: Flags [P.], seq 3942:4183, ack 1, win 501, options [nop,nop,TS val 864871772 ecr 524925008], length 241
15:58:19.526798 IP 10.8.1.3.49670 > 185.42.204.81.1935: Flags [.], seq 4183:5497, ack 1, win 501, options [nop,nop,TS val 864871810 ecr 524925008], length 1314
15:58:19.556156 IP 10.8.1.3.49670 > 185.42.204.81.1935: Flags [.], seq 5497:6811, ack 1, win 501, options [nop,nop,TS val 864871839 ecr 524925008], length 1314
15:58:19.577683 IP 185.42.204.81.1935 > 10.8.1.3.49670: Flags [.], ack 4294962040, win 126, options [nop,nop,TS val 524925097 ecr 864871406], length 0
15:58:19.598559 IP 10.8.1.3.49670 > 185.42.204.81.1935: Flags [.], seq 6811:8125, ack 1, win 501, options [nop,nop,TS val 864871882 ecr 524925097], length 1314
15:58:19.660826 IP 10.8.1.3.49670 > 185.42.204.81.1935: Flags [.], seq 8125:9439, ack 1, win 501, options [nop,nop,TS val 864871944 ecr 524925097], length 1314
15:58:19.684227 IP 10.8.1.3.49670 > 185.42.204.81.1935: Flags [.], seq 9439:10753, ack 1, win 501, options [nop,nop,TS val 864871968 ecr 524925097], length 1314
15:58:19.684749 IP 185.42.204.81.1935 > 10.8.1.3.49670: Flags [.], ack 4294964668, win 126, options [nop,nop,TS val 524925204 ecr 864871476], length 0
15:58:19.726803 IP 10.8.1.3.49670 > 185.42.204.81.1935: Flags [.], seq 10753:12067, ack 1, win 501, options [nop,nop,TS val 864872010 ecr 524925204], length 1314
15:58:19.748953 IP 185.42.204.81.1935 > 10.8.1.3.49670: Flags [.], ack 0, win 126, options [nop,nop,TS val 524925268 ecr 864871575], length 0
15:58:19.791483 IP 10.8.1.3.49670 > 185.42.204.81.1935: Flags [.], seq 12067:13381, ack 1, win 501, options [nop,nop,TS val 864872075 ecr 524925268], length 1314
15:58:19.825426 IP 10.8.1.3.49670 > 185.42.204.81.1935: Flags [.], seq 13381:14695, ack 1, win 501, options [nop,nop,TS val 864872109 ecr 524925268], length 1314
15:58:19.851523 IP 185.42.204.81.1935 > 10.8.1.3.49670: Flags [.], ack 2628, win 126, options [nop,nop,TS val 524925371 ecr 864871668], length 0
15:58:19.857164 IP 10.8.1.3.49670 > 185.42.204.81.1935: Flags [.], seq 14695:16009, ack 1, win 501, options [nop,nop,TS val 864872140 ecr 524925371], length 1314
15:58:19.916032 IP 185.42.204.81.1935 > 10.8.1.3.49670: Flags [.], ack 4183, win 126, options [nop,nop,TS val 524925435 ecr 864871732], length 0
15:58:19.916096 IP 10.8.1.3.49670 > 185.42.204.81.1935: Flags [P.], seq 16009:17094, ack 1, win 501, options [nop,nop,TS val 864872199 ecr 524925435], length 1085
15:58:19.958189 IP 10.8.1.3.49670 > 185.42.204.81.1935: Flags [.], seq 17094:18408, ack 1, win 501, options [nop,nop,TS val 864872241 ecr 524925435], length 1314
15:58:19.983077 IP 10.8.1.3.49670 > 185.42.204.81.1935: Flags [.], seq 18408:19722, ack 1, win 501, options [nop,nop,TS val 864872266 ecr 524925435], length 1314
15:58:19.984023 IP 185.42.204.81.1935 > 10.8.1.3.49670: Flags [.], ack 6811, win 126, options [nop,nop,TS val 524925503 ecr 864871810], length 0
15:58:20.027842 IP 10.8.1.3.49670 > 185.42.204.81.1935: Flags [.], seq 19722:21036, ack 1, win 501, options [nop,nop,TS val 864872311 ecr 524925503], length 1314
15:58:20.088693 IP 185.42.204.81.1935 > 10.8.1.3.49670: Flags [.], ack 9439, win 126, options [nop,nop,TS val 524925608 ecr 864871882], length 0
15:58:20.089551 IP 10.8.1.3.49670 > 185.42.204.81.1935: Flags [.], seq 21036:22350, ack 1, win 501, options [nop,nop,TS val 864872373 ecr 524925608], length 1314
15:58:20.124247 IP 10.8.1.3.49670 > 185.42.204.81.1935: Flags [.], seq 22350:23664, ack 1, win 501, options [nop,nop,TS val 864872408 ecr 524925608], length 1314
15:58:20.154816 IP 185.42.204.81.1935 > 10.8.1.3.49670: Flags [.], ack 12067, win 126, options [nop,nop,TS val 524925674 ecr 864871968], length 0
15:58:20.160068 IP 10.8.1.3.49670 > 185.42.204.81.1935: Flags [.], seq 23664:24978, ack 1, win 501, options [nop,nop,TS val 864872443 ecr 524925674], length 1314
15:58:20.218329 IP 10.8.1.3.49670 > 185.42.204.81.1935: Flags [.], seq 24978:26292, ack 1, win 501, options [nop,nop,TS val 864872502 ecr 524925674], length 1314
15:58:20.253364 IP 185.42.204.81.1935 > 10.8.1.3.49670: Flags [.], ack 14695, win 126, options [nop,nop,TS val 524925773 ecr 864872075], length 0
15:58:20.257697 IP 10.8.1.3.49670 > 185.42.204.81.1935: Flags [.], seq 26292:27606, ack 1, win 501, options [nop,nop,TS val 864872541 ecr 524925773], length 1314
15:58:20.292500 IP 10.8.1.3.49670 > 185.42.204.81.1935: Flags [.], seq 27606:28920, ack 1, win 501, options [nop,nop,TS val 864872576 ecr 524925773], length 1314
15:58:20.343840 IP 185.42.204.81.1935 > 10.8.1.3.49670: Flags [.], ack 17094, win 126, options [nop,nop,TS val 524925863 ecr 864872140], length 0
15:58:20.343879 IP 10.8.1.3.49670 > 185.42.204.81.1935: Flags [P.], seq 28920:30007, ack 1, win 501, options [nop,nop,TS val 864872627 ecr 524925863], length 1087
15:58:20.389662 IP 10.8.1.3.49670 > 185.42.204.81.1935: Flags [.], seq 30007:31321, ack 1, win 501, options [nop,nop,TS val 864872673 ecr 524925863], length 1314
15:58:20.411246 IP 185.42.204.81.1935 > 10.8.1.3.49670: Flags [.], ack 19722, win 126, options [nop,nop,TS val 524925931 ecr 864872241], length 0
15:58:20.428202 IP 10.8.1.3.49670 > 185.42.204.81.1935: Flags [.], seq 31321:32635, ack 1, win 501, options [nop,nop,TS val 864872712 ecr 524925931], length 1314
15:58:20.457851 IP 10.8.1.3.49670 > 185.42.204.81.1935: Flags [.], seq 32635:33949, ack 1, win 501, options [nop,nop,TS val 864872741 ecr 524925931], length 1314
15:58:20.516957 IP 185.42.204.81.1935 > 10.8.1.3.49670: Flags [.], ack 22350, win 126, options [nop,nop,TS val 524926037 ecr 864872311], length 0
15:58:20.517705 IP 10.8.1.3.49670 > 185.42.204.81.1935: Flags [.], seq 33949:35263, ack 1, win 501, options [nop,nop,TS val 864872801 ecr 524926037], length 1314
15:58:20.560604 IP 10.8.1.3.49670 > 185.42.204.81.1935: Flags [.], seq 35263:36577, ack 1, win 501, options [nop,nop,TS val 864872844 ecr 524926037], length 1314
15:58:20.587989 IP 185.42.204.81.1935 > 10.8.1.3.49670: Flags [.], ack 24978, win 126, options [nop,nop,TS val 524926107 ecr 864872408], length 0
15:58:20.593479 IP 10.8.1.3.49670 > 185.42.204.81.1935: Flags [.], seq 36577:37891, ack 1, win 501, options [nop,nop,TS val 864872877 ecr 524926107], length 1314
15:58:20.658999 IP 10.8.1.3.49670 > 185.42.204.81.1935: Flags [.], seq 37891:39205, ack 1, win 501, options [nop,nop,TS val 864872942 ecr 524926107], length 1314
15:58:20.685397 IP 185.42.204.81.1935 > 10.8.1.3.49670: Flags [.], ack 27606, win 126, options [nop,nop,TS val 524926205 ecr 864872502], length 0
15:58:20.688960 IP 10.8.1.3.49670 > 185.42.204.81.1935: Flags [.], seq 39205:40519, ack 1, win 501, options [nop,nop,TS val 864872972 ecr 524926205], length 1314
15:58:20.724904 IP 10.8.1.3.49670 > 185.42.204.81.1935: Flags [.], seq 40519:41833, ack 1, win 501, options [nop,nop,TS val 864873008 ecr 524926205], length 1314
15:58:20.771796 IP 185.42.204.81.1935 > 10.8.1.3.49670: Flags [.], ack 30007, win 126, options [nop,nop,TS val 524926291 ecr 864872576], length 0
15:58:20.771830 IP 10.8.1.3.49670 > 185.42.204.81.1935: Flags [P.], seq 41833:42918, ack 1, win 501, options [nop,nop,TS val 864873055 ecr 524926291], length 1085
15:58:20.828650 IP 10.8.1.3.49670 > 185.42.204.81.1935: Flags [.], seq 42918:44232, ack 1, win 501, options [nop,nop,TS val 864873112 ecr 524926291], length 1314
15:58:20.855862 IP 185.42.204.81.1935 > 10.8.1.3.49670: Flags [.], ack 32635, win 126, options [nop,nop,TS val 524926375 ecr 864872673], length 0
15:58:20.860105 IP 10.8.1.3.49670 > 185.42.204.81.1935: Flags [.], seq 44232:45546, ack 1, win 501, options [nop,nop,TS val 864873143 ecr 524926375], length 1314
15:58:20.892925 IP 10.8.1.3.49670 > 185.42.204.81.1935: Flags [.], seq 45546:46860, ack 1, win 501, options [nop,nop,TS val 864873176 ecr 524926375], length 1314
15:58:20.945760 IP 185.42.204.81.1935 > 10.8.1.3.49670: Flags [.], ack 35263, win 126, options [nop,nop,TS val 524926465 ecr 864872741], length 0
15:58:20.957967 IP 10.8.1.3.49670 > 185.42.204.81.1935: Flags [.], seq 46860:48174, ack 1, win 501, options [nop,nop,TS val 864873241 ecr 524926465], length 1314
15:58:20.987952 IP 10.8.1.3.49670 > 185.42.204.81.1935: Flags [.], seq 48174:49488, ack 1, win 501, options [nop,nop,TS val 864873271 ecr 524926465], length 1314
15:58:21.021636 IP 185.42.204.81.1935 > 10.8.1.3.49670: Flags [.], ack 37891, win 126, options [nop,nop,TS val 524926541 ecr 864872844], length 0
15:58:21.026497 IP 10.8.1.3.49670 > 185.42.204.81.1935: Flags [.], seq 49488:50802, ack 1, win 501, options [nop,nop,TS val 864873310 ecr 524926541], length 1314
15:58:21.094530 IP 10.8.1.3.49670 > 185.42.204.81.1935: Flags [.], seq 50802:52116, ack 1, win 501, options [nop,nop,TS val 864873378 ecr 524926541], length 1314
15:58:21.116766 IP 185.42.204.81.1935 > 10.8.1.3.49670: Flags [.], ack 40519, win 126, options [nop,nop,TS val 524926636 ecr 864872942], length 0
15:58:21.124218 IP 10.8.1.3.49670 > 185.42.204.81.1935: Flags [.], seq 52116:53430, ack 1, win 501, options [nop,nop,TS val 864873408 ecr 524926636], length 1314
15:58:21.158441 IP 10.8.1.3.49670 > 185.42.204.81.1935: Flags [.], seq 53430:54744, ack 1, win 501, options [nop,nop,TS val 864873442 ecr 524926636], length 1314
15:58:21.209056 IP 185.42.204.81.1935 > 10.8.1.3.49670: Flags [.], ack 42918, win 126, options [nop,nop,TS val 524926719 ecr 864873008], length 0
15:58:21.209092 IP 10.8.1.3.49670 > 185.42.204.81.1935: Flags [P.], seq 54744:55931, ack 1, win 501, options [nop,nop,TS val 864873492 ecr 524926719], length 1187
15:58:21.259349 IP 10.8.1.3.49670 > 185.42.204.81.1935: Flags [.], seq 55931:57245, ack 1, win 501, options [nop,nop,TS val 864873543 ecr 524926719], length 1314
15:58:21.287078 IP 10.8.1.3.49670 > 185.42.204.81.1935: Flags [.], seq 57245:58559, ack 1, win 501, options [nop,nop,TS val 864873570 ecr 524926719], length 1314
15:58:21.287838 IP 185.42.204.81.1935 > 10.8.1.3.49670: Flags [.], ack 45546, win 126, options [nop,nop,TS val 524926807 ecr 864873112], length 0
15:58:21.329982 IP 10.8.1.3.49670 > 185.42.204.81.1935: Flags [.], seq 58559:59873, ack 1, win 501, options [nop,nop,TS val 864873613 ecr 524926807], length 1314
15:58:21.392859 IP 185.42.204.81.1935 > 10.8.1.3.49670: Flags [.], ack 48174, win 126, options [nop,nop,TS val 524926912 ecr 864873176], length 0
15:58:21.393735 IP 10.8.1.3.49670 > 185.42.204.81.1935: Flags [.], seq 59873:61187, ack 1, win 501, options [nop,nop,TS val 864873677 ecr 524926912], length 1314
15:58:21.424234 IP 10.8.1.3.49670 > 185.42.204.81.1935: Flags [.], seq 61187:62501, ack 1, win 501, options [nop,nop,TS val 864873708 ecr 524926912], length 1314
15:58:21.454267 IP 185.42.204.81.1935 > 10.8.1.3.49670: Flags [.], ack 50802, win 126, options [nop,nop,TS val 524926974 ecr 864873271], length 0
15:58:21.459897 IP 10.8.1.3.49670 > 185.42.204.81.1935: Flags [.], seq 62501:63815, ack 1, win 501, options [nop,nop,TS val 864873743 ecr 524926974], length 1314
15:58:21.523129 IP 10.8.1.3.49670 > 185.42.204.81.1935: Flags [.], seq 63815:65129, ack 1, win 501, options [nop,nop,TS val 864873806 ecr 524926974], length 1314
15:58:21.551828 IP 185.42.204.81.1935 > 10.8.1.3.49670: Flags [.], ack 53430, win 126, options [nop,nop,TS val 524927071 ecr 864873378], length 0
15:58:21.559327 IP 10.8.1.3.49670 > 185.42.204.81.1935: Flags [.], seq 65129:66443, ack 1, win 501, options [nop,nop,TS val 864873843 ecr 524927071], length 1314
15:58:21.590480 IP 10.8.1.3.49670 > 185.42.204.81.1935: Flags [.], seq 66443:67757, ack 1, win 501, options [nop,nop,TS val 864873874 ecr 524927071], length 1314
15:58:21.636820 IP 185.42.204.81.1935 > 10.8.1.3.49670: Flags [.], ack 55931, win 126, options [nop,nop,TS val 524927156 ecr 864873442], length 0
15:58:21.636865 IP 10.8.1.3.49670 > 185.42.204.81.1935: Flags [P.], seq 67757:68833, ack 1, win 501, options [nop,nop,TS val 864873920 ecr 524927156], length 1076
15:58:21.691076 IP 10.8.1.3.49670 > 185.42.204.81.1935: Flags [.], seq 68833:70147, ack 1, win 501, options [nop,nop,TS val 864873974 ecr 524927156], length 1314
15:58:21.714823 IP 185.42.204.81.1935 > 10.8.1.3.49670: Flags [.], ack 58559, win 126, options [nop,nop,TS val 524927234 ecr 864873543], length 0
15:58:21.726672 IP 10.8.1.3.49670 > 185.42.204.81.1935: Flags [.], seq 70147:71461, ack 1, win 501, options [nop,nop,TS val 864874010 ecr 524927234], length 1314
15:58:21.760162 IP 10.8.1.3.49670 > 185.42.204.81.1935: Flags [.], seq 71461:72775, ack 1, win 501, options [nop,nop,TS val 864874043 ecr 524927234], length 1314
15:58:21.821519 IP 185.42.204.81.1935 > 10.8.1.3.49670: Flags [.], ack 61187, win 126, options [nop,nop,TS val 524927341 ecr 864873613], length 0
15:58:21.822900 IP 10.8.1.3.49670 > 185.42.204.81.1935: Flags [.], seq 72775:74089, ack 1, win 501, options [nop,nop,TS val 864874106 ecr 524927341], length 1314
15:58:21.858070 IP 10.8.1.3.49670 > 185.42.204.81.1935: Flags [.], seq 74089:75403, ack 1, win 501, options [nop,nop,TS val 864874141 ecr 524927341], length 1314
15:58:21.889131 IP 185.42.204.81.1935 > 10.8.1.3.49670: Flags [.], ack 63815, win 126, options [nop,nop,TS val 524927407 ecr 864873708], length 0
15:58:21.893469 IP 10.8.1.3.49670 > 185.42.204.81.1935: Flags [.], seq 75403:76717, ack 1, win 501, options [nop,nop,TS val 864874177 ecr 524927407], length 1314
15:58:21.957331 IP 10.8.1.3.49670 > 185.42.204.81.1935: Flags [.], seq 76717:78031, ack 1, win 501, options [nop,nop,TS val 864874241 ecr 524927407], length 1314
15:58:21.987533 IP 185.42.204.81.1935 > 10.8.1.3.49670: Flags [.], ack 66443, win 126, options [nop,nop,TS val 524927507 ecr 864873806], length 0
15:58:21.989447 IP 10.8.1.3.49670 > 185.42.204.81.1935: Flags [.], seq 78031:79345, ack 1, win 501, options [nop,nop,TS val 864874273 ecr 524927507], length 1314
15:58:22.022850 IP 10.8.1.3.49670 > 185.42.204.81.1935: Flags [.], seq 79345:80659, ack 1, win 501, options [nop,nop,TS val 864874306 ecr 524927507], length 1314
15:58:22.064369 IP 185.42.204.81.1935 > 10.8.1.3.49670: Flags [.], ack 68833, win 126, options [nop,nop,TS val 524927584 ecr 864873874], length 0
15:58:22.064385 IP 10.8.1.3.49670 > 185.42.204.81.1935: Flags [P.], seq 80659:81756, ack 1, win 501, options [nop,nop,TS val 864874348 ecr 524927584], length 1097
15:58:22.121601 IP 10.8.1.3.49670 > 185.42.204.81.1935: Flags [.], seq 81756:83070, ack 1, win 501, options [nop,nop,TS val 864874405 ecr 524927584], length 1314
15:58:22.154665 IP 185.42.204.81.1935 > 10.8.1.3.49670: Flags [.], ack 71461, win 126, options [nop,nop,TS val 524927674 ecr 864873974], length 0
15:58:22.160262 IP 10.8.1.3.49670 > 185.42.204.81.1935: Flags [.], seq 83070:84384, ack 1, win 501, options [nop,nop,TS val 864874444 ecr 524927674], length 1314
15:58:22.193257 IP 10.8.1.3.49670 > 185.42.204.81.1935: Flags [.], seq 84384:85698, ack 1, win 501, options [nop,nop,TS val 864874477 ecr 524927674], length 1314
15:58:22.250436 IP 185.42.204.81.1935 > 10.8.1.3.49670: Flags [.], ack 74089, win 126, options [nop,nop,TS val 524927770 ecr 864874043], length 0
15:58:22.258709 IP 10.8.1.3.49670 > 185.42.204.81.1935: Flags [.], seq 85698:87012, ack 1, win 501, options [nop,nop,TS val 864874542 ecr 524927770], length 1314
15:58:22.291936 IP 10.8.1.3.49670 > 185.42.204.81.1935: Flags [.], seq 87012:88326, ack 1, win 501, options [nop,nop,TS val 864874575 ecr 524927770], length 1314
15:58:22.321758 IP 185.42.204.81.1935 > 10.8.1.3.49670: Flags [.], ack 76717, win 126, options [nop,nop,TS val 524927841 ecr 864874141], length 0
15:58:22.322689 IP 10.8.1.3.49670 > 185.42.204.81.1935: Flags [.], seq 88326:89640, ack 1, win 501, options [nop,nop,TS val 864874606 ecr 524927841], length 1314
15:58:22.393206 IP 10.8.1.3.49670 > 185.42.204.81.1935: Flags [.], seq 89640:90954, ack 1, win 501, options [nop,nop,TS val 864874677 ecr 524927841], length 1314
15:58:22.417108 IP 185.42.204.81.1935 > 10.8.1.3.49670: Flags [.], ack 79345, win 126, options [nop,nop,TS val 524927937 ecr 864874241], length 0
15:58:22.427140 IP 10.8.1.3.49670 > 185.42.204.81.1935: Flags [.], seq 90954:92268, ack 1, win 501, options [nop,nop,TS val 864874710 ecr 524927937], length 1314
15:58:22.459924 IP 10.8.1.3.49670 > 185.42.204.81.1935: Flags [.], seq 92268:93582, ack 1, win 501, options [nop,nop,TS val 864874743 ecr 524927937], length 1314
15:58:22.491751 IP 185.42.204.81.1935 > 10.8.1.3.49670: Flags [.], ack 81756, win 126, options [nop,nop,TS val 524928011 ecr 864874306], length 0
15:58:22.491773 IP 10.8.1.3.49670 > 185.42.204.81.1935: Flags [P.], seq 93582:94662, ack 1, win 501, options [nop,nop,TS val 864874775 ecr 524928011], length 1080
15:58:22.559969 IP 10.8.1.3.49670 > 185.42.204.81.1935: Flags [.], seq 94662:95976, ack 1, win 501, options [nop,nop,TS val 864874843 ecr 524928011], length 1314
15:58:22.588279 IP 185.42.204.81.1935 > 10.8.1.3.49670: Flags [.], ack 84384, win 126, options [nop,nop,TS val 524928107 ecr 864874405], length 0
15:58:22.592349 IP 10.8.1.3.49670 > 185.42.204.81.1935: Flags [.], seq 95976:97290, ack 1, win 501, options [nop,nop,TS val 864874876 ecr 524928107], length 1314
15:58:22.625299 IP 10.8.1.3.49670 > 185.42.204.81.1935: Flags [.], seq 97290:98604, ack 1, win 501, options [nop,nop,TS val 864874909 ecr 524928107], length 1314
15:58:22.686450 IP 185.42.204.81.1935 > 10.8.1.3.49670: Flags [.], ack 87012, win 126, options [nop,nop,TS val 524928206 ecr 864874477], length 0
15:58:22.692032 IP 10.8.1.3.49670 > 185.42.204.81.1935: Flags [.], seq 98604:99918, ack 1, win 501, options [nop,nop,TS val 864874975 ecr 524928206], length 1314
15:58:22.722756 IP 10.8.1.3.49670 > 185.42.204.81.1935: Flags [.], seq 99918:101232, ack 1, win 501, options [nop,nop,TS val 864875006 ecr 524928206], length 1314
15:58:22.750329 IP 185.42.204.81.1935 > 10.8.1.3.49670: Flags [.], ack 89640, win 126, options [nop,nop,TS val 524928270 ecr 864874575], length 0
15:58:22.756792 IP 10.8.1.3.49670 > 185.42.204.81.1935: Flags [.], seq 101232:102546, ack 1, win 501, options [nop,nop,TS val 864875040 ecr 524928270], length 1314
15:58:22.827283 IP 10.8.1.3.49670 > 185.42.204.81.1935: Flags [.], seq 102546:103860, ack 1, win 501, options [nop,nop,TS val 864875111 ecr 524928270], length 1314
15:58:22.855176 IP 185.42.204.81.1935 > 10.8.1.3.49670: Flags [.], ack 92268, win 126, options [nop,nop,TS val 524928374 ecr 864874677], length 0
15:58:22.860379 IP 10.8.1.3.49670 > 185.42.204.81.1935: Flags [.], seq 103860:105174, ack 1, win 501, options [nop,nop,TS val 864875144 ecr 524928374], length 1314
15:58:22.890542 IP 10.8.1.3.49670 > 185.42.204.81.1935: Flags [.], seq 105174:106488, ack 1, win 501, options [nop,nop,TS val 864875174 ecr 524928374], length 1314
15:58:22.919152 IP 185.42.204.81.1935 > 10.8.1.3.49670: Flags [.], ack 94662, win 126, options [nop,nop,TS val 524928439 ecr 864874743], length 0
15:58:22.919176 IP 10.8.1.3.49670 > 185.42.204.81.1935: Flags [P.], seq 106488:106737, ack 1, win 501, options [nop,nop,TS val 864875202 ecr 524928439], length 249
15:58:22.956081 IP 10.8.1.3.49670 > 185.42.204.81.1935: Flags [.], seq 106737:108051, ack 1, win 501, options [nop,nop,TS val 864875239 ecr 524928439], length 1314
15:58:22.990213 IP 10.8.1.3.49670 > 185.42.204.81.1935: Flags [.], seq 108051:109365, ack 1, win 501, options [nop,nop,TS val 864875274 ecr 524928439], length 1314
15:58:23.021087 IP 185.42.204.81.1935 > 10.8.1.3.49670: Flags [.], ack 97290, win 126, options [nop,nop,TS val 524928540 ecr 864874843], length 0
15:58:23.041173 IP 10.8.1.3.49670 > 185.42.204.81.1935: Flags [.], seq 109365:110679, ack 1, win 501, options [nop,nop,TS val 864875324 ecr 524928540], length 1314
15:58:23.092298 IP 10.8.1.3.49670 > 185.42.204.81.1935: Flags [.], seq 110679:111993, ack 1, win 501, options [nop,nop,TS val 864875376 ecr 524928540], length 1314
15:58:23.117541 IP 185.42.204.81.1935 > 10.8.1.3.49670: Flags [.], ack 98604, win 126, options [nop,nop,TS val 524928637 ecr 864874909], length 0
15:58:23.123650 IP 10.8.1.3.49670 > 185.42.204.81.1935: Flags [.], seq 111993:113307, ack 1, win 501, options [nop,nop,TS val 864875407 ecr 524928637], length 1314
15:58:23.150404 IP 185.42.204.81.1935 > 10.8.1.3.49670: Flags [.], ack 101232, win 126, options [nop,nop,TS val 524928670 ecr 864874975], length 0
15:58:23.169299 IP 10.8.1.3.49670 > 185.42.204.81.1935: Flags [.], seq 113307:114621, ack 1, win 501, options [nop,nop,TS val 864875453 ecr 524928670], length 1314
15:58:23.227713 IP 10.8.1.3.49670 > 185.42.204.81.1935: Flags [.], seq 114621:115935, ack 1, win 501, options [nop,nop,TS val 864875511 ecr 524928670], length 1314
15:58:23.255640 IP 185.42.204.81.1935 > 10.8.1.3.49670: Flags [.], ack 103860, win 126, options [nop,nop,TS val 524928775 ecr 864875040], length 0
15:58:23.261211 IP 10.8.1.3.49670 > 185.42.204.81.1935: Flags [.], seq 115935:117249, ack 1, win 501, options [nop,nop,TS val 864875545 ecr 524928775], length 1314
15:58:23.298171 IP 10.8.1.3.49670 > 185.42.204.81.1935: Flags [.], seq 117249:118563, ack 1, win 501, options [nop,nop,TS val 864875581 ecr 524928775], length 1314
15:58:23.318388 IP 185.42.204.81.1935 > 10.8.1.3.49670: Flags [.], ack 106488, win 126, options [nop,nop,TS val 524928838 ecr 864875144], length 0
15:58:23.347036 IP 185.42.204.81.1935 > 10.8.1.3.49670: Flags [.], ack 106737, win 126, options [nop,nop,TS val 524928866 ecr 864875202], length 0
15:58:23.347089 IP 10.8.1.3.49670 > 185.42.204.81.1935: Flags [P.], seq 118563:119638, ack 1, win 501, options [nop,nop,TS val 864875630 ecr 524928866], length 1075
15:58:23.393740 IP 10.8.1.3.49670 > 185.42.204.81.1935: Flags [.], seq 119638:120952, ack 1, win 501, options [nop,nop,TS val 864875677 ecr 524928866], length 1314
15:58:23.417778 IP 185.42.204.81.1935 > 10.8.1.3.49670: Flags [.], ack 109365, win 126, options [nop,nop,TS val 524928937 ecr 864875239], length 0
15:58:23.424329 IP 10.8.1.3.49670 > 185.42.204.81.1935: Flags [.], seq 120952:122266, ack 1, win 501, options [nop,nop,TS val 864875708 ecr 524928937], length 1314
15:58:23.469280 IP 10.8.1.3.49670 > 185.42.204.81.1935: Flags [.], seq 122266:123580, ack 1, win 501, options [nop,nop,TS val 864875753 ecr 524928937], length 1314
15:58:23.520365 IP 185.42.204.81.1935 > 10.8.1.3.49670: Flags [.], ack 111993, win 126, options [nop,nop,TS val 524929040 ecr 864875324], length 0
15:58:23.522583 IP 10.8.1.3.49670 > 185.42.204.81.1935: Flags [.], seq 123580:124894, ack 1, win 501, options [nop,nop,TS val 864875806 ecr 524929040], length 1314
15:58:23.556740 IP 10.8.1.3.49670 > 185.42.204.81.1935: Flags [.], seq 124894:126208, ack 1, win 501, options [nop,nop,TS val 864875840 ecr 524929040], length 1314
15:58:23.597235 IP 185.42.204.81.1935 > 10.8.1.3.49670: Flags [.], ack 114621, win 126, options [nop,nop,TS val 524929117 ecr 864875407], length 0
15:58:23.597291 IP 10.8.1.3.49670 > 185.42.204.81.1935: Flags [.], seq 126208:127522, ack 1, win 501, options [nop,nop,TS val 864875881 ecr 524929117], length 1314
15:58:23.660102 IP 10.8.1.3.49670 > 185.42.204.81.1935: Flags [.], seq 127522:128836, ack 1, win 501, options [nop,nop,TS val 864875943 ecr 524929117], length 1314
15:58:23.689261 IP 185.42.204.81.1935 > 10.8.1.3.49670: Flags [.], ack 117249, win 126, options [nop,nop,TS val 524929209 ecr 864875511], length 0
15:58:23.691767 IP 10.8.1.3.49670 > 185.42.204.81.1935: Flags [.], seq 128836:130150, ack 1, win 501, options [nop,nop,TS val 864875975 ecr 524929209], length 1314
15:58:23.726028 IP 10.8.1.3.49670 > 185.42.204.81.1935: Flags [.], seq 130150:131464, ack 1, win 501, options [nop,nop,TS val 864876009 ecr 524929209], length 1314
15:58:23.774836 IP 185.42.204.81.1935 > 10.8.1.3.49670: Flags [.], ack 119638, win 126, options [nop,nop,TS val 524929294 ecr 864875581], length 0
15:58:23.774873 IP 10.8.1.3.49670 > 185.42.204.81.1935: Flags [P.], seq 131464:132562, ack 1, win 501, options [nop,nop,TS val 864876058 ecr 524929294], length 1098
15:58:23.824801 IP 10.8.1.3.49670 > 185.42.204.81.1935: Flags [.], seq 132562:133876, ack 1, win 501, options [nop,nop,TS val 864876108 ecr 524929294], length 1314
15:58:23.852399 IP 185.42.204.81.1935 > 10.8.1.3.49670: Flags [.], ack 122266, win 126, options [nop,nop,TS val 524929372 ecr 864875677], length 0
15:58:23.860040 IP 10.8.1.3.49670 > 185.42.204.81.1935: Flags [.], seq 133876:135190, ack 1, win 501, options [nop,nop,TS val 864876143 ecr 524929372], length 1314
15:58:23.897900 IP 10.8.1.3.49670 > 185.42.204.81.1935: Flags [.], seq 135190:136504, ack 1, win 501, options [nop,nop,TS val 864876181 ecr 524929372], length 1314
15:58:23.950479 IP 185.42.204.81.1935 > 10.8.1.3.49670: Flags [.], ack 124894, win 126, options [nop,nop,TS val 524929470 ecr 864875753], length 0
15:58:23.958388 IP 10.8.1.3.49670 > 185.42.204.81.1935: Flags [.], seq 136504:137818, ack 1, win 501, options [nop,nop,TS val 864876242 ecr 524929470], length 1314
15:58:23.992585 IP 10.8.1.3.49670 > 185.42.204.81.1935: Flags [.], seq 137818:139132, ack 1, win 501, options [nop,nop,TS val 864876276 ecr 524929470], length 1314
15:58:24.025217 IP 185.42.204.81.1935 > 10.8.1.3.49670: Flags [.], ack 127522, win 126, options [nop,nop,TS val 524929545 ecr 864875840], length 0
15:58:24.026976 IP 10.8.1.3.49670 > 185.42.204.81.1935: Flags [.], seq 139132:140446, ack 1, win 501, options [nop,nop,TS val 864876310 ecr 524929545], length 1314
15:58:24.092187 IP 10.8.1.3.49670 > 185.42.204.81.1935: Flags [.], seq 140446:141760, ack 1, win 501, options [nop,nop,TS val 864876375 ecr 524929545], length 1314
15:58:24.119359 IP 185.42.204.81.1935 > 10.8.1.3.49670: Flags [.], ack 130150, win 126, options [nop,nop,TS val 524929639 ecr 864875943], length 0
15:58:24.125895 IP 10.8.1.3.49670 > 185.42.204.81.1935: Flags [.], seq 141760:143074, ack 1, win 501, options [nop,nop,TS val 864876409 ecr 524929639], length 1314
15:58:24.160001 IP 10.8.1.3.49670 > 185.42.204.81.1935: Flags [.], seq 143074:144388, ack 1, win 501, options [nop,nop,TS val 864876443 ecr 524929639], length 1314
15:58:24.202927 IP 185.42.204.81.1935 > 10.8.1.3.49670: Flags [.], ack 132562, win 126, options [nop,nop,TS val 524929722 ecr 864876009], length 0
15:58:24.202973 IP 10.8.1.3.49670 > 185.42.204.81.1935: Flags [P.], seq 144388:145468, ack 1, win 501, options [nop,nop,TS val 864876486 ecr 524929722], length 1080
15:58:24.260216 IP 10.8.1.3.49670 > 185.42.204.81.1935: Flags [.], seq 145468:146782, ack 1, win 501, options [nop,nop,TS val 864876544 ecr 524929722], length 1314
15:58:24.287695 IP 185.42.204.81.1935 > 10.8.1.3.49670: Flags [.], ack 135190, win 126, options [nop,nop,TS val 524929807 ecr 864876108], length 0
15:58:24.293827 IP 10.8.1.3.49670 > 185.42.204.81.1935: Flags [.], seq 146782:148096, ack 1, win 501, options [nop,nop,TS val 864876577 ecr 524929807], length 1314
15:58:24.326962 IP 10.8.1.3.49670 > 185.42.204.81.1935: Flags [.], seq 148096:149410, ack 1, win 501, options [nop,nop,TS val 864876610 ecr 524929807], length 1314
15:58:24.386114 IP 185.42.204.81.1935 > 10.8.1.3.49670: Flags [.], ack 137818, win 126, options [nop,nop,TS val 524929906 ecr 864876181], length 0
15:58:24.393614 IP 10.8.1.3.49670 > 185.42.204.81.1935: Flags [.], seq 149410:150724, ack 1, win 501, options [nop,nop,TS val 864876677 ecr 524929906], length 1314
15:58:24.427171 IP 10.8.1.3.49670 > 185.42.204.81.1935: Flags [.], seq 150724:152038, ack 1, win 501, options [nop,nop,TS val 864876710 ecr 524929906], length 1314
15:58:24.455171 IP 185.42.204.81.1935 > 10.8.1.3.49670: Flags [.], ack 140446, win 126, options [nop,nop,TS val 524929975 ecr 864876276], length 0
15:58:24.459951 IP 10.8.1.3.49670 > 185.42.204.81.1935: Flags [.], seq 152038:153352, ack 1, win 501, options [nop,nop,TS val 864876743 ecr 524929975], length 1314
15:58:24.525178 IP 10.8.1.3.49670 > 185.42.204.81.1935: Flags [.], seq 153352:154666, ack 1, win 501, options [nop,nop,TS val 864876808 ecr 524929975], length 1314
15:58:24.553435 IP 185.42.204.81.1935 > 10.8.1.3.49670: Flags [.], ack 143074, win 126, options [nop,nop,TS val 524930073 ecr 864876375], length 0
15:58:24.562643 IP 10.8.1.3.49670 > 185.42.204.81.1935: Flags [.], seq 154666:155980, ack 1, win 501, options [nop,nop,TS val 864876846 ecr 524930073], length 1314
15:58:24.592415 IP 10.8.1.3.49670 > 185.42.204.81.1935: Flags [.], seq 155980:157294, ack 1, win 501, options [nop,nop,TS val 864876876 ecr 524930073], length 1314
15:58:24.630758 IP 185.42.204.81.1935 > 10.8.1.3.49670: Flags [.], ack 145468, win 126, options [nop,nop,TS val 524930150 ecr 864876443], length 0
15:58:24.630808 IP 10.8.1.3.49670 > 185.42.204.81.1935: Flags [P.], seq 157294:158381, ack 1, win 501, options [nop,nop,TS val 864876914 ecr 524930150], length 1087
15:58:24.693817 IP 10.8.1.3.49670 > 185.42.204.81.1935: Flags [.], seq 158381:159695, ack 1, win 501, options [nop,nop,TS val 864876977 ecr 524930150], length 1314
15:58:24.721606 IP 185.42.204.81.1935 > 10.8.1.3.49670: Flags [.], ack 148096, win 126, options [nop,nop,TS val 524930241 ecr 864876544], length 0
15:58:24.722713 IP 10.8.1.3.49670 > 185.42.204.81.1935: Flags [.], seq 159695:161009, ack 1, win 501, options [nop,nop,TS val 864877006 ecr 524930241], length 1314
15:58:24.756275 IP 10.8.1.3.49670 > 185.42.204.81.1935: Flags [.], seq 161009:162323, ack 1, win 501, options [nop,nop,TS val 864877040 ecr 524930241], length 1314
15:58:24.821553 IP 185.42.204.81.1935 > 10.8.1.3.49670: Flags [.], ack 150724, win 126, options [nop,nop,TS val 524930341 ecr 864876610], length 0
15:58:24.828033 IP 10.8.1.3.49670 > 185.42.204.81.1935: Flags [.], seq 162323:163637, ack 1, win 501, options [nop,nop,TS val 864877111 ecr 524930341], length 1314
15:58:24.862503 IP 10.8.1.3.49670 > 185.42.204.81.1935: Flags [.], seq 163637:164951, ack 1, win 501, options [nop,nop,TS val 864877146 ecr 524930341], length 1314
15:58:24.888043 IP 185.42.204.81.1935 > 10.8.1.3.49670: Flags [.], ack 153352, win 126, options [nop,nop,TS val 524930407 ecr 864876710], length 0
15:58:24.892013 IP 10.8.1.3.49670 > 185.42.204.81.1935: Flags [.], seq 164951:166265, ack 1, win 501, options [nop,nop,TS val 864877175 ecr 524930407], length 1314
15:58:24.957777 IP 10.8.1.3.49670 > 185.42.204.81.1935: Flags [.], seq 166265:167579, ack 1, win 501, options [nop,nop,TS val 864877241 ecr 524930407], length 1314
15:58:24.990425 IP 185.42.204.81.1935 > 10.8.1.3.49670: Flags [.], ack 155980, win 126, options [nop,nop,TS val 524930510 ecr 864876808], length 0
15:58:24.991138 IP 10.8.1.3.49670 > 185.42.204.81.1935: Flags [.], seq 167579:168893, ack 1, win 501, options [nop,nop,TS val 864877274 ecr 524930510], length 1314
15:58:25.024363 IP 10.8.1.3.49670 > 185.42.204.81.1935: Flags [.], seq 168893:170207, ack 1, win 501, options [nop,nop,TS val 864877308 ecr 524930510], length 1314
15:58:25.058649 IP 185.42.204.81.1935 > 10.8.1.3.49670: Flags [.], ack 158381, win 126, options [nop,nop,TS val 524930578 ecr 864876876], length 0
15:58:25.058682 IP 10.8.1.3.49670 > 185.42.204.81.1935: Flags [P.], seq 170207:170444, ack 1, win 501, options [nop,nop,TS val 864877342 ecr 524930578], length 237
15:58:25.097338 IP 10.8.1.3.49670 > 185.42.204.81.1935: Flags [.], seq 170444:171758, ack 1, win 501, options [nop,nop,TS val 864877381 ecr 524930578], length 1314
15:58:25.122674 IP 10.8.1.3.49670 > 185.42.204.81.1935: Flags [.], seq 171758:173072, ack 1, win 501, options [nop,nop,TS val 864877406 ecr 524930578], length 1314
15:58:25.150643 IP 185.42.204.81.1935 > 10.8.1.3.49670: Flags [.], ack 161009, win 126, options [nop,nop,TS val 524930670 ecr 864876977], length 0
15:58:25.182461 IP 10.8.1.3.49670 > 185.42.204.81.1935: Flags [.], seq 173072:174386, ack 1, win 501, options [nop,nop,TS val 864877466 ecr 524930670], length 1314
15:58:25.226864 IP 10.8.1.3.49670 > 185.42.204.81.1935: Flags [.], seq 174386:175700, ack 1, win 501, options [nop,nop,TS val 864877510 ecr 524930670], length 1314
15:58:25.253592 IP 185.42.204.81.1935 > 10.8.1.3.49670: Flags [.], ack 162323, win 126, options [nop,nop,TS val 524930773 ecr 864877040], length 0
15:58:25.258758 IP 10.8.1.3.49670 > 185.42.204.81.1935: Flags [.], seq 175700:177014, ack 1, win 501, options [nop,nop,TS val 864877542 ecr 524930773], length 1314
15:58:25.290636 IP 185.42.204.81.1935 > 10.8.1.3.49670: Flags [.], ack 164951, win 126, options [nop,nop,TS val 524930810 ecr 864877111], length 0
15:58:25.310737 IP 10.8.1.3.49670 > 185.42.204.81.1935: Flags [.], seq 177014:178328, ack 1, win 501, options [nop,nop,TS val 864877594 ecr 524930810], length 1314
15:58:25.361451 IP 10.8.1.3.49670 > 185.42.204.81.1935: Flags [.], seq 178328:179642, ack 1, win 501, options [nop,nop,TS val 864877645 ecr 524930810], length 1314
15:58:25.385773 IP 185.42.204.81.1935 > 10.8.1.3.49670: Flags [.], ack 167579, win 126, options [nop,nop,TS val 524930905 ecr 864877175], length 0
15:58:25.396560 IP 10.8.1.3.49670 > 185.42.204.81.1935: Flags [.], seq 179642:180956, ack 1, win 501, options [nop,nop,TS val 864877680 ecr 524930905], length 1314
15:58:25.439098 IP 10.8.1.3.49670 > 185.42.204.81.1935: Flags [.], seq 180956:182270, ack 1, win 501, options [nop,nop,TS val 864877722 ecr 524930905], length 1314
15:58:25.452809 IP 185.42.204.81.1935 > 10.8.1.3.49670: Flags [.], ack 170207, win 126, options [nop,nop,TS val 524930972 ecr 864877274], length 0
15:58:25.486057 IP 185.42.204.81.1935 > 10.8.1.3.49670: Flags [.], ack 170444, win 126, options [nop,nop,TS val 524931006 ecr 864877342], length 0
15:58:25.486093 IP 10.8.1.3.49670 > 185.42.204.81.1935: Flags [P.], seq 182270:183359, ack 1, win 501, options [nop,nop,TS val 864877769 ecr 524931006], length 1089
15:58:25.524214 IP 10.8.1.3.49670 > 185.42.204.81.1935: Flags [.], seq 183359:184673, ack 1, win 501, options [nop,nop,TS val 864877808 ecr 524931006], length 1314
15:58:25.550378 IP 185.42.204.81.1935 > 10.8.1.3.49670: Flags [.], ack 173072, win 126, options [nop,nop,TS val 524931070 ecr 864877381], length 0
15:58:25.556589 IP 10.8.1.3.49670 > 185.42.204.81.1935: Flags [.], seq 184673:185987, ack 1, win 501, options [nop,nop,TS val 864877840 ecr 524931070], length 1314
15:58:25.609715 IP 10.8.1.3.49670 > 185.42.204.81.1935: Flags [.], seq 185987:187301, ack 1, win 501, options [nop,nop,TS val 864877893 ecr 524931070], length 1314
15:58:25.654516 IP 185.42.204.81.1935 > 10.8.1.3.49670: Flags [.], ack 175700, win 126, options [nop,nop,TS val 524931174 ecr 864877466], length 0
15:58:25.660349 IP 10.8.1.3.49670 > 185.42.204.81.1935: Flags [.], seq 187301:188615, ack 1, win 501, options [nop,nop,TS val 864877944 ecr 524931174], length 1314
15:58:25.695703 IP 10.8.1.3.49670 > 185.42.204.81.1935: Flags [.], seq 188615:189929, ack 1, win 501, options [nop,nop,TS val 864877979 ecr 524931174], length 1314
15:58:25.738146 IP 185.42.204.81.1935 > 10.8.1.3.49670: Flags [.], ack 178328, win 126, options [nop,nop,TS val 524931258 ecr 864877542], length 0
15:58:25.738636 IP 10.8.1.3.49670 > 185.42.204.81.1935: Flags [.], seq 189929:191243, ack 1, win 501, options [nop,nop,TS val 864878022 ecr 524931258], length 1314
15:58:25.789491 IP 10.8.1.3.49670 > 185.42.204.81.1935: Flags [.], seq 191243:192557, ack 1, win 501, options [nop,nop,TS val 864878073 ecr 524931258], length 1314
15:58:25.823718 IP 10.8.1.3.49670 > 185.42.204.81.1935: Flags [.], seq 192557:193871, ack 1, win 501, options [nop,nop,TS val 864878107 ecr 524931258], length 1314
15:58:25.824398 IP 185.42.204.81.1935 > 10.8.1.3.49670: Flags [.], ack 180956, win 126, options [nop,nop,TS val 524931344 ecr 864877645], length 0
15:58:25.866635 IP 10.8.1.3.49670 > 185.42.204.81.1935: Flags [.], seq 193871:195185, ack 1, win 501, options [nop,nop,TS val 864878150 ecr 524931344], length 1314
15:58:25.913713 IP 185.42.204.81.1935 > 10.8.1.3.49670: Flags [.], ack 183359, win 126, options [nop,nop,TS val 524931433 ecr 864877722], length 0
15:58:25.913725 IP 10.8.1.3.49670 > 185.42.204.81.1935: Flags [P.], seq 195185:196273, ack 1, win 501, options [nop,nop,TS val 864878197 ecr 524931433], length 1088
15:58:25.956512 IP 10.8.1.3.49670 > 185.42.204.81.1935: Flags [.], seq 196273:197587, ack 1, win 501, options [nop,nop,TS val 864878240 ecr 524931433], length 1314
15:58:25.984114 IP 185.42.204.81.1935 > 10.8.1.3.49670: Flags [.], ack 185987, win 126, options [nop,nop,TS val 524931504 ecr 864877808], length 0
15:58:25.994575 IP 10.8.1.3.49670 > 185.42.204.81.1935: Flags [.], seq 197587:198901, ack 1, win 501, options [nop,nop,TS val 864878278 ecr 524931504], length 1314
15:58:26.037605 IP 10.8.1.3.49670 > 185.42.204.81.1935: Flags [.], seq 198901:200215, ack 1, win 501, options [nop,nop,TS val 864878321 ecr 524931504], length 1314
15:58:26.088280 IP 185.42.204.81.1935 > 10.8.1.3.49670: Flags [.], ack 188615, win 126, options [nop,nop,TS val 524931608 ecr 864877893], length 0
15:58:26.090892 IP 10.8.1.3.49670 > 185.42.204.81.1935: Flags [.], seq 200215:201529, ack 1, win 501, options [nop,nop,TS val 864878374 ecr 524931608], length 1314
15:58:26.124876 IP 10.8.1.3.49670 > 185.42.204.81.1935: Flags [.], seq 201529:202843, ack 1, win 501, options [nop,nop,TS val 864878408 ecr 524931608], length 1314
15:58:26.159815 IP 10.8.1.3.49670 > 185.42.204.81.1935: Flags [.], seq 202843:204157, ack 1, win 501, options [nop,nop,TS val 864878443 ecr 524931608], length 1314
15:58:26.166386 IP 185.42.204.81.1935 > 10.8.1.3.49670: Flags [.], ack 191243, win 126, options [nop,nop,TS val 524931686 ecr 864877979], length 0
15:58:26.224171 IP 10.8.1.3.49670 > 185.42.204.81.1935: Flags [.], seq 204157:205471, ack 1, win 501, options [nop,nop,TS val 864878507 ecr 524931686], length 1314
15:58:26.251280 IP 10.8.1.3.49670 > 185.42.204.81.1935: Flags [.], seq 205471:206785, ack 1, win 501, options [nop,nop,TS val 864878535 ecr 524931686], length 1314
15:58:26.251331 IP 185.42.204.81.1935 > 10.8.1.3.49670: Flags [.], ack 193871, win 126, options [nop,nop,TS val 524931771 ecr 864878073], length 0
15:58:26.293545 IP 10.8.1.3.49670 > 185.42.204.81.1935: Flags [.], seq 206785:208099, ack 1, win 501, options [nop,nop,TS val 864878577 ecr 524931771], length 1314
15:58:26.341205 IP 185.42.204.81.1935 > 10.8.1.3.49670: Flags [.], ack 196273, win 126, options [nop,nop,TS val 524931861 ecr 864878150], length 0
15:58:26.341235 IP 10.8.1.3.49670 > 185.42.204.81.1935: Flags [P.], seq 208099:209274, ack 1, win 501, options [nop,nop,TS val 864878625 ecr 524931861], length 1175
15:58:26.379853 IP 10.8.1.3.49670 > 185.42.204.81.1935: Flags [.], seq 209274:210588, ack 1, win 501, options [nop,nop,TS val 864878663 ecr 524931861], length 1314
15:58:26.422982 IP 10.8.1.3.49670 > 185.42.204.81.1935: Flags [.], seq 210588:211902, ack 1, win 501, options [nop,nop,TS val 864878706 ecr 524931861], length 1314
15:58:26.425846 IP 185.42.204.81.1935 > 10.8.1.3.49670: Flags [.], ack 198901, win 126, options [nop,nop,TS val 524931945 ecr 864878240], length 0
15:58:26.465769 IP 10.8.1.3.49670 > 185.42.204.81.1935: Flags [.], seq 211902:213216, ack 1, win 501, options [nop,nop,TS val 864878749 ecr 524931945], length 1314
15:58:26.518668 IP 185.42.204.81.1935 > 10.8.1.3.49670: Flags [.], ack 201529, win 126, options [nop,nop,TS val 524932038 ecr 864878321], length 0
