23:46:17.137379 IP 99.181.89.55.1935 > 10.8.0.7.41142: Flags [.], ack 3128953065, win 126, options [nop,nop,TS val 2670300406 ecr 396741120], length 0
23:46:17.137462 IP 10.8.0.7.41142 > 99.181.89.55.1935: Flags [P.], seq 9199:10088, ack 0, win 501, options [nop,nop,TS val 396741486 ecr 2670300406], length 889
23:46:17.172277 IP 10.8.0.7.41142 > 99.181.89.55.1935: Flags [.], seq 10088:11402, ack 0, win 501, options [nop,nop,TS val 396741521 ecr 2670300406], length 1314
23:46:17.202693 IP 10.8.0.7.41142 > 99.181.89.55.1935: Flags [.], seq 11402:12716, ack 0, win 501, options [nop,nop,TS val 396741551 ecr 2670300406], length 1314
23:46:17.239173 IP 99.181.89.55.1935 > 10.8.0.7.41142: Flags [.], ack 2629, win 126, options [nop,nop,TS val 2670300508 ecr 396741188], length 0
23:46:17.245466 IP 10.8.0.7.41142 > 99.181.89.55.1935: Flags [.], seq 12716:14030, ack 0, win 501, options [nop,nop,TS val 396741594 ecr 2670300508], length 1314
23:46:17.302625 IP 10.8.0.7.41142 > 99.181.89.55.1935: Flags [.], seq 14030:15344, ack 0, win 501, options [nop,nop,TS val 396741651 ecr 2670300508], length 1314
23:46:17.336216 IP 10.8.0.7.41142 > 99.181.89.55.1935: Flags [.], seq 15344:16658, ack 0, win 501, options [nop,nop,TS val 396741685 ecr 2670300508], length 1314
23:46:17.372948 IP 10.8.0.7.41142 > 99.181.89.55.1935: Flags [.], seq 16658:17972, ack 0, win 501, options [nop,nop,TS val 396741721 ecr 2670300508], length 1314
23:46:17.436142 IP 10.8.0.7.41142 > 99.181.89.55.1935: Flags [.], seq 17972:19286, ack 0, win 501, options [nop,nop,TS val 396741784 ecr 2670300508], length 1314
23:46:17.470008 IP 10.8.0.7.41142 > 99.181.89.55.1935: Flags [.], seq 19286:20600, ack 0, win 501, options [nop,nop,TS val 396741818 ecr 2670300508], length 1314
23:46:17.505907 IP 10.8.0.7.41142 > 99.181.89.55.1935: Flags [.], seq 20600:21914, ack 0, win 501, options [nop,nop,TS val 396741854 ecr 2670300508], length 1314
23:46:17.538177 IP 10.8.0.7.41142 > 99.181.89.55.1935: Flags [P.], seq 21914:22060, ack 0, win 501, options [nop,nop,TS val 396741886 ecr 2670300508], length 146
23:46:17.573635 IP 10.8.0.7.41142 > 99.181.89.55.1935: Flags [.], seq 22060:23374, ack 0, win 501, options [nop,nop,TS val 396741922 ecr 2670300508], length 1314
23:46:17.605280 IP 10.8.0.7.41142 > 99.181.89.55.1935: Flags [.], seq 23374:24688, ack 0, win 501, options [nop,nop,TS val 396741954 ecr 2670300508], length 1314
23:46:17.650460 IP 10.8.0.7.41142 > 99.181.89.55.1935: Flags [.], seq 24688:26002, ack 0, win 501, options [nop,nop,TS val 396741999 ecr 2670300508], length 1314
23:46:17.704744 IP 10.8.0.7.41142 > 99.181.89.55.1935: Flags [.], seq 26002:27316, ack 0, win 501, options [nop,nop,TS val 396742053 ecr 2670300508], length 1314
23:46:17.735800 IP 10.8.0.7.41142 > 99.181.89.55.1935: Flags [.], seq 27316:28630, ack 0, win 501, options [nop,nop,TS val 396742084 ecr 2670300508], length 1314
23:46:17.778634 IP 10.8.0.7.41142 > 99.181.89.55.1935: Flags [.], seq 28630:29944, ack 0, win 501, options [nop,nop,TS val 396742127 ecr 2670300508], length 1314
23:46:18.622110 IP 10.8.0.7.41142 > 99.181.89.55.1935: Flags [.], seq 2629:3943, ack 0, win 501, options [nop,nop,TS val 396742970 ecr 2670300508], length 1314
23:46:19.260904 IP 99.181.89.55.1935 > 10.8.0.7.41142: Flags [.], ack 5257, win 126, options [nop,nop,TS val 2670300613 ecr 396741252], length 0
23:46:19.260935 IP 10.8.0.7.41142 > 99.181.89.55.1935: Flags [.], seq 29944:31258, ack 0, win 501, options [nop,nop,TS val 396743609 ecr 2670300613], length 1314
23:46:19.260937 IP 10.8.0.7.41142 > 99.181.89.55.1935: Flags [P.], seq 31258:32572, ack 0, win 501, options [nop,nop,TS val 396743609 ecr 2670300613], length 1314
23:46:19.260943 IP 10.8.0.7.41142 > 99.181.89.55.1935: Flags [.], seq 32572:33886, ack 0, win 501, options [nop,nop,TS val 396743609 ecr 2670300613], length 1314
23:46:19.260943 IP 10.8.0.7.41142 > 99.181.89.55.1935: Flags [P.], seq 33886:35200, ack 0, win 501, options [nop,nop,TS val 396743609 ecr 2670300613], length 1314
23:46:19.261000 IP 99.181.89.55.1935 > 10.8.0.7.41142: Flags [.], ack 6571, win 126, options [nop,nop,TS val 2670300741 ecr 396741352], length 0
23:46:19.261010 IP 10.8.0.7.41142 > 99.181.89.55.1935: Flags [.], seq 35200:36514, ack 0, win 501, options [nop,nop,TS val 396743609 ecr 2670300741], length 1314
23:46:19.261010 IP 10.8.0.7.41142 > 99.181.89.55.1935: Flags [P.], seq 36514:37828, ack 0, win 501, options [nop,nop,TS val 396743609 ecr 2670300741], length 1314
23:46:19.397041 IP 99.181.89.55.1935 > 10.8.0.7.41142: Flags [.], ack 7885, win 126, options [nop,nop,TS val 2670302666 ecr 396741385], length 0
23:46:19.397068 IP 10.8.0.7.41142 > 99.181.89.55.1935: Flags [.], seq 37828:39142, ack 0, win 501, options [nop,nop,TS val 396743745 ecr 2670302666], length 1314
23:46:19.397070 IP 10.8.0.7.41142 > 99.181.89.55.1935: Flags [P.], seq 39142:40456, ack 0, win 501, options [nop,nop,TS val 396743745 ecr 2670302666], length 1314
23:46:19.397792 IP 99.181.89.55.1935 > 10.8.0.7.41142: Flags [.], ack 9199, win 126, options [nop,nop,TS val 2670302667 ecr 396741454], length 0
23:46:19.397810 IP 10.8.0.7.41142 > 99.181.89.55.1935: Flags [.], seq 40456:41770, ack 0, win 501, options [nop,nop,TS val 396743746 ecr 2670302667], length 1314
23:46:19.397811 IP 10.8.0.7.41142 > 99.181.89.55.1935: Flags [P.], seq 41770:43084, ack 0, win 501, options [nop,nop,TS val 396743746 ecr 2670302667], length 1314
23:46:19.397825 IP 99.181.89.55.1935 > 10.8.0.7.41142: Flags [.], ack 10088, win 125, options [nop,nop,TS val 2670302667 ecr 396741486], length 0
23:46:19.397833 IP 10.8.0.7.41142 > 99.181.89.55.1935: Flags [.], seq 43084:44398, ack 0, win 501, options [nop,nop,TS val 396743746 ecr 2670302667], length 1314
23:46:19.397834 IP 10.8.0.7.41142 > 99.181.89.55.1935: Flags [P.], seq 44398:45712, ack 0, win 501, options [nop,nop,TS val 396743746 ecr 2670302667], length 1314
23:46:19.397842 IP 99.181.89.55.1935 > 10.8.0.7.41142: Flags [.], ack 11402, win 123, options [nop,nop,TS val 2670302667 ecr 396741521], length 0
23:46:19.397849 IP 10.8.0.7.41142 > 99.181.89.55.1935: Flags [.], seq 45712:47026, ack 0, win 501, options [nop,nop,TS val 396743746 ecr 2670302667], length 1314
23:46:19.397849 IP 10.8.0.7.41142 > 99.181.89.55.1935: Flags [P.], seq 47026:48340, ack 0, win 501, options [nop,nop,TS val 396743746 ecr 2670302667], length 1314
23:46:19.397858 IP 99.181.89.55.1935 > 10.8.0.7.41142: Flags [.], ack 12716, win 122, options [nop,nop,TS val 2670302667 ecr 396741551], length 0
23:46:19.397866 IP 10.8.0.7.41142 > 99.181.89.55.1935: Flags [.], seq 48340:49654, ack 0, win 501, options [nop,nop,TS val 396743746 ecr 2670302667], length 1314
23:46:19.397867 IP 10.8.0.7.41142 > 99.181.89.55.1935: Flags [P.], seq 49654:50968, ack 0, win 501, options [nop,nop,TS val 396743746 ecr 2670302667], length 1314
23:46:19.397875 IP 99.181.89.55.1935 > 10.8.0.7.41142: Flags [.], ack 14030, win 120, options [nop,nop,TS val 2670302667 ecr 396741594], length 0
23:46:19.397881 IP 10.8.0.7.41142 > 99.181.89.55.1935: Flags [.], seq 50968:52282, ack 0, win 501, options [nop,nop,TS val 396743746 ecr 2670302667], length 1314
23:46:19.397882 IP 10.8.0.7.41142 > 99.181.89.55.1935: Flags [P.], seq 52282:53596, ack 0, win 501, options [nop,nop,TS val 396743746 ecr 2670302667], length 1314
23:46:19.397890 IP 99.181.89.55.1935 > 10.8.0.7.41142: Flags [.], ack 15344, win 124, options [nop,nop,TS val 2670302667 ecr 396741651], length 0
23:46:19.397897 IP 10.8.0.7.41142 > 99.181.89.55.1935: Flags [.], seq 53596:54910, ack 0, win 501, options [nop,nop,TS val 396743746 ecr 2670302667], length 1314
23:46:19.397898 IP 10.8.0.7.41142 > 99.181.89.55.1935: Flags [P.], seq 54910:56224, ack 0, win 501, options [nop,nop,TS val 396743746 ecr 2670302667], length 1314
23:46:19.397906 IP 99.181.89.55.1935 > 10.8.0.7.41142: Flags [.], ack 16658, win 122, options [nop,nop,TS val 2670302667 ecr 396741685], length 0
23:46:19.397913 IP 10.8.0.7.41142 > 99.181.89.55.1935: Flags [.], seq 56224:57538, ack 0, win 501, options [nop,nop,TS val 396743746 ecr 2670302667], length 1314
23:46:19.397914 IP 10.8.0.7.41142 > 99.181.89.55.1935: Flags [P.], seq 57538:58852, ack 0, win 501, options [nop,nop,TS val 396743746 ecr 2670302667], length 1314
23:46:19.397921 IP 99.181.89.55.1935 > 10.8.0.7.41142: Flags [.], ack 17972, win 120, options [nop,nop,TS val 2670302667 ecr 396741721], length 0
23:46:19.397927 IP 10.8.0.7.41142 > 99.181.89.55.1935: Flags [.], seq 58852:60166, ack 0, win 501, options [nop,nop,TS val 396743746 ecr 2670302667], length 1314
23:46:19.397928 IP 10.8.0.7.41142 > 99.181.89.55.1935: Flags [P.], seq 60166:61480, ack 0, win 501, options [nop,nop,TS val 396743746 ecr 2670302667], length 1314
23:46:19.397936 IP 99.181.89.55.1935 > 10.8.0.7.41142: Flags [.], ack 19286, win 118, options [nop,nop,TS val 2670302667 ecr 396741784], length 0
23:46:19.397952 IP 99.181.89.55.1935 > 10.8.0.7.41142: Flags [.], ack 20600, win 119, options [nop,nop,TS val 2670302667 ecr 396741818], length 0
23:46:19.397960 IP 99.181.89.55.1935 > 10.8.0.7.41142: Flags [.], ack 21914, win 126, options [nop,nop,TS val 2670302667 ecr 396741854], length 0
23:46:19.397970 IP 99.181.89.55.1935 > 10.8.0.7.41142: Flags [.], ack 22060, win 126, options [nop,nop,TS val 2670302667 ecr 396741886], length 0
23:46:19.397978 IP 99.181.89.55.1935 > 10.8.0.7.41142: Flags [.], ack 23374, win 126, options [nop,nop,TS val 2670302667 ecr 396741922], length 0
23:46:19.398000 IP 10.8.0.7.41142 > 99.181.89.55.1935: Flags [P.], seq 61480:61732, ack 0, win 501, options [nop,nop,TS val 396743746 ecr 2670302667], length 252
23:46:19.398040 IP 10.8.0.7.41142 > 99.181.89.55.1935: Flags [.], seq 61732:63046, ack 0, win 501, options [nop,nop,TS val 396743746 ecr 2670302667], length 1314
23:46:19.398053 IP 10.8.0.7.41142 > 99.181.89.55.1935: Flags [.], seq 63046:64360, ack 0, win 501, options [nop,nop,TS val 396743746 ecr 2670302667], length 1314
23:46:19.398063 IP 10.8.0.7.41142 > 99.181.89.55.1935: Flags [.], seq 64360:65674, ack 0, win 501, options [nop,nop,TS val 396743746 ecr 2670302667], length 1314
23:46:19.398099 IP 10.8.0.7.41142 > 99.181.89.55.1935: Flags [.], seq 65674:66988, ack 0, win 501, options [nop,nop,TS val 396743746 ecr 2670302667], length 1314
23:46:19.398111 IP 10.8.0.7.41142 > 99.181.89.55.1935: Flags [.], seq 66988:68302, ack 0, win 501, options [nop,nop,TS val 396743746 ecr 2670302667], length 1314
23:46:19.398120 IP 10.8.0.7.41142 > 99.181.89.55.1935: Flags [.], seq 68302:69616, ack 0, win 501, options [nop,nop,TS val 396743746 ecr 2670302667], length 1314
23:46:19.398130 IP 99.181.89.55.1935 > 10.8.0.7.41142: Flags [.], ack 24688, win 125, options [nop,nop,TS val 2670302667 ecr 396741954], length 0
23:46:19.398141 IP 99.181.89.55.1935 > 10.8.0.7.41142: Flags [.], ack 26002, win 126, options [nop,nop,TS val 2670302667 ecr 396741999], length 0
23:46:19.398142 IP 10.8.0.7.41142 > 99.181.89.55.1935: Flags [.], seq 69616:70930, ack 0, win 501, options [nop,nop,TS val 396743746 ecr 2670302667], length 1314
23:46:19.398149 IP 99.181.89.55.1935 > 10.8.0.7.41142: Flags [.], ack 28630, win 126, options [nop,nop,TS val 2670302667 ecr 396742053], length 0
23:46:19.398159 IP 10.8.0.7.41142 > 99.181.89.55.1935: Flags [.], seq 70930:72244, ack 0, win 501, options [nop,nop,TS val 396743746 ecr 2670302667], length 1314
23:46:19.398171 IP 10.8.0.7.41142 > 99.181.89.55.1935: Flags [.], seq 72244:73558, ack 0, win 501, options [nop,nop,TS val 396743746 ecr 2670302667], length 1314
23:46:19.398187 IP 10.8.0.7.41142 > 99.181.89.55.1935: Flags [.], seq 73558:74872, ack 0, win 501, options [nop,nop,TS val 396743747 ecr 2670302667], length 1314
23:46:19.398197 IP 10.8.0.7.41142 > 99.181.89.55.1935: Flags [.], seq 74872:76186, ack 0, win 501, options [nop,nop,TS val 396743747 ecr 2670302667], length 1314
23:46:19.398208 IP 10.8.0.7.41142 > 99.181.89.55.1935: Flags [.], seq 76186:77500, ack 0, win 501, options [nop,nop,TS val 396743747 ecr 2670302667], length 1314
23:46:19.398574 IP 99.181.89.55.1935 > 10.8.0.7.41142: Flags [.], ack 29944, win 126, options [nop,nop,TS val 2670302668 ecr 396742127,nop,nop,sack 1 {2629:3943}], length 0
23:46:19.440329 IP 10.8.0.7.41142 > 99.181.89.55.1935: Flags [.], seq 77500:78814, ack 0, win 501, options [nop,nop,TS val 396743789 ecr 2670302668], length 1314
23:46:19.473749 IP 10.8.0.7.41142 > 99.181.89.55.1935: Flags [.], seq 78814:80128, ack 0, win 501, options [nop,nop,TS val 396743822 ecr 2670302668], length 1314
23:46:19.506919 IP 10.8.0.7.41142 > 99.181.89.55.1935: Flags [.], seq 80128:81442, ack 0, win 501, options [nop,nop,TS val 396743855 ecr 2670302668], length 1314
23:46:19.552083 IP 10.8.0.7.41142 > 99.181.89.55.1935: Flags [.], seq 81442:82756, ack 0, win 501, options [nop,nop,TS val 396743900 ecr 2670302668], length 1314
23:46:19.604229 IP 10.8.0.7.41142 > 99.181.89.55.1935: Flags [.], seq 82756:84070, ack 0, win 501, options [nop,nop,TS val 396743953 ecr 2670302668], length 1314
23:46:19.636601 IP 10.8.0.7.41142 > 99.181.89.55.1935: Flags [.], seq 84070:85384, ack 0, win 501, options [nop,nop,TS val 396743985 ecr 2670302668], length 1314
23:46:19.642615 IP 99.181.89.55.1935 > 10.8.0.7.41142: Flags [.], ack 31258, win 126, options [nop,nop,TS val 2670302911 ecr 396743609], length 0
23:46:19.642789 IP 99.181.89.55.1935 > 10.8.0.7.41142: Flags [.], ack 32572, win 126, options [nop,nop,TS val 2670302911 ecr 396743609], length 0
23:46:19.642980 IP 99.181.89.55.1935 > 10.8.0.7.41142: Flags [.], ack 33886, win 126, options [nop,nop,TS val 2670302911 ecr 396743609], length 0
23:46:19.642995 IP 99.181.89.55.1935 > 10.8.0.7.41142: Flags [.], ack 35200, win 126, options [nop,nop,TS val 2670302911 ecr 396743609], length 0
23:46:19.643001 IP 99.181.89.55.1935 > 10.8.0.7.41142: Flags [.], ack 36514, win 124, options [nop,nop,TS val 2670302911 ecr 396743609], length 0
23:46:19.643008 IP 99.181.89.55.1935 > 10.8.0.7.41142: Flags [.], ack 37828, win 125, options [nop,nop,TS val 2670302911 ecr 396743609], length 0
23:46:19.680025 IP 10.8.0.7.41142 > 99.181.89.55.1935: Flags [.], seq 85384:86698, ack 0, win 501, options [nop,nop,TS val 396744028 ecr 2670302911], length 1314
23:46:19.737687 IP 10.8.0.7.41142 > 99.181.89.55.1935: Flags [.], seq 86698:88012, ack 0, win 501, options [nop,nop,TS val 396744086 ecr 2670302911], length 1314
23:46:19.773295 IP 10.8.0.7.41142 > 99.181.89.55.1935: Flags [.], seq 88012:89326, ack 0, win 501, options [nop,nop,TS val 396744122 ecr 2670302911], length 1314
23:46:19.776498 IP 99.181.89.55.1935 > 10.8.0.7.41142: Flags [.], ack 40456, win 125, options [nop,nop,TS val 2670303045 ecr 396743745], length 0
23:46:19.776882 IP 99.181.89.55.1935 > 10.8.0.7.41142: Flags [.], ack 41770, win 126, options [nop,nop,TS val 2670303046 ecr 396743746], length 0
23:46:19.776918 IP 99.181.89.55.1935 > 10.8.0.7.41142: Flags [.], ack 43084, win 125, options [nop,nop,TS val 2670303046 ecr 396743746], length 0
23:46:19.776936 IP 99.181.89.55.1935 > 10.8.0.7.41142: Flags [.], ack 44398, win 123, options [nop,nop,TS val 2670303046 ecr 396743746], length 0
23:46:19.776953 IP 99.181.89.55.1935 > 10.8.0.7.41142: Flags [.], ack 45712, win 126, options [nop,nop,TS val 2670303046 ecr 396743746], length 0
23:46:19.777114 IP 99.181.89.55.1935 > 10.8.0.7.41142: Flags [.], ack 47026, win 126, options [nop,nop,TS val 2670303046 ecr 396743746], length 0
23:46:19.777148 IP 99.181.89.55.1935 > 10.8.0.7.41142: Flags [.], ack 48340, win 126, options [nop,nop,TS val 2670303046 ecr 396743746], length 0
23:46:19.777166 IP 99.181.89.55.1935 > 10.8.0.7.41142: Flags [.], ack 49654, win 126, options [nop,nop,TS val 2670303046 ecr 396743746], length 0
23:46:19.777204 IP 99.181.89.55.1935 > 10.8.0.7.41142: Flags [.], ack 50968, win 126, options [nop,nop,TS val 2670303046 ecr 396743746], length 0
23:46:19.777223 IP 99.181.89.55.1935 > 10.8.0.7.41142: Flags [.], ack 56224, win 126, options [nop,nop,TS val 2670303046 ecr 396743746], length 0
23:46:19.777243 IP 99.181.89.55.1935 > 10.8.0.7.41142: Flags [.], ack 58852, win 126, options [nop,nop,TS val 2670303046 ecr 396743746], length 0
23:46:19.777478 IP 99.181.89.55.1935 > 10.8.0.7.41142: Flags [.], ack 61480, win 126, options [nop,nop,TS val 2670303047 ecr 396743746], length 0
23:46:19.777513 IP 99.181.89.55.1935 > 10.8.0.7.41142: Flags [.], ack 61732, win 126, options [nop,nop,TS val 2670303047 ecr 396743746], length 0
23:46:19.777529 IP 10.8.0.7.41142 > 99.181.89.55.1935: Flags [P.], seq 89326:89633, ack 0, win 501, options [nop,nop,TS val 396744126 ecr 2670303047], length 307
23:46:19.777550 IP 99.181.89.55.1935 > 10.8.0.7.41142: Flags [.], ack 65674, win 126, options [nop,nop,TS val 2670303047 ecr 396743746], length 0
23:46:19.777570 IP 99.181.89.55.1935 > 10.8.0.7.41142: Flags [.], ack 68302, win 126, options [nop,nop,TS val 2670303047 ecr 396743746], length 0
23:46:19.777586 IP 99.181.89.55.1935 > 10.8.0.7.41142: Flags [.], ack 70930, win 126, options [nop,nop,TS val 2670303047 ecr 396743746], length 0
23:46:19.777603 IP 99.181.89.55.1935 > 10.8.0.7.41142: Flags [.], ack 74872, win 126, options [nop,nop,TS val 2670303047 ecr 396743746], length 0
23:46:19.777831 IP 99.181.89.55.1935 > 10.8.0.7.41142: Flags [.], ack 77500, win 126, options [nop,nop,TS val 2670303047 ecr 396743747], length 0
23:46:19.840570 IP 10.8.0.7.41142 > 99.181.89.55.1935: Flags [.], seq 89633:90947, ack 0, win 501, options [nop,nop,TS val 396744189 ecr 2670303047], length 1314
23:46:19.856531 IP 99.181.89.55.1935 > 10.8.0.7.41142: Flags [.], ack 80128, win 126, options [nop,nop,TS val 2670303125 ecr 396743789], length 0
23:46:19.871777 IP 10.8.0.7.41142 > 99.181.89.55.1935: Flags [.], seq 90947:92261, ack 0, win 501, options [nop,nop,TS val 396744220 ecr 2670303125], length 1314
23:46:19.905394 IP 10.8.0.7.41142 > 99.181.89.55.1935: Flags [.], seq 92261:93575, ack 0, win 501, options [nop,nop,TS val 396744254 ecr 2670303125], length 1314
23:46:19.937330 IP 99.181.89.55.1935 > 10.8.0.7.41142: Flags [.], ack 82756, win 131, options [nop,nop,TS val 2670303204 ecr 396743855], length 0
23:46:19.969320 IP 10.8.0.7.41142 > 99.181.89.55.1935: Flags [.], seq 93575:94889, ack 0, win 501, options [nop,nop,TS val 396744318 ecr 2670303204], length 1314
23:46:19.981829 IP 99.181.89.55.1935 > 10.8.0.7.41142: Flags [.], ack 84070, win 137, options [nop,nop,TS val 2670303251 ecr 396743953], length 0
23:46:20.002795 IP 10.8.0.7.41142 > 99.181.89.55.1935: Flags [.], seq 94889:96203, ack 0, win 501, options [nop,nop,TS val 396744351 ecr 2670303251], length 1314
23:46:20.011466 IP 99.181.89.55.1935 > 10.8.0.7.41142: Flags [.], ack 85384, win 143, options [nop,nop,TS val 2670303281 ecr 396743985], length 0
23:46:20.037527 IP 10.8.0.7.41142 > 99.181.89.55.1935: Flags [.], seq 96203:97517, ack 0, win 501, options [nop,nop,TS val 396744386 ecr 2670303281], length 1314
23:46:20.055260 IP 99.181.89.55.1935 > 10.8.0.7.41142: Flags [.], ack 86698, win 148, options [nop,nop,TS val 2670303324 ecr 396744028], length 0
23:46:20.106723 IP 10.8.0.7.41142 > 99.181.89.55.1935: Flags [.], seq 97517:98831, ack 0, win 501, options [nop,nop,TS val 396744455 ecr 2670303324], length 1314
23:46:20.113281 IP 99.181.89.55.1935 > 10.8.0.7.41142: Flags [.], ack 88012, win 154, options [nop,nop,TS val 2670303382 ecr 396744086], length 0
23:46:20.138630 IP 10.8.0.7.41142 > 99.181.89.55.1935: Flags [.], seq 98831:100145, ack 0, win 501, options [nop,nop,TS val 396744487 ecr 2670303382], length 1314
23:46:20.152076 IP 99.181.89.55.1935 > 10.8.0.7.41142: Flags [.], ack 89326, win 160, options [nop,nop,TS val 2670303421 ecr 396744122], length 0
23:46:20.156019 IP 99.181.89.55.1935 > 10.8.0.7.41142: Flags [.], ack 89633, win 165, options [nop,nop,TS val 2670303425 ecr 396744126], length 0
23:46:20.156034 IP 10.8.0.7.41142 > 99.181.89.55.1935: Flags [P.], seq 100145:100670, ack 0, win 501, options [nop,nop,TS val 396744504 ecr 2670303425], length 525
23:46:20.204034 IP 10.8.0.7.41142 > 99.181.89.55.1935: Flags [.], seq 100670:101984, ack 0, win 501, options [nop,nop,TS val 396744552 ecr 2670303425], length 1314
23:46:20.217406 IP 99.181.89.55.1935 > 10.8.0.7.41142: Flags [.], ack 90947, win 170, options [nop,nop,TS val 2670303487 ecr 396744189], length 0
23:46:20.236297 IP 10.8.0.7.41142 > 99.181.89.55.1935: Flags [.], seq 101984:103298, ack 0, win 501, options [nop,nop,TS val 396744585 ecr 2670303487], length 1314
23:46:20.249470 IP 99.181.89.55.1935 > 10.8.0.7.41142: Flags [.], ack 92261, win 176, options [nop,nop,TS val 2670303519 ecr 396744220], length 0
23:46:20.277355 IP 10.8.0.7.41142 > 99.181.89.55.1935: Flags [.], seq 103298:104612, ack 0, win 501, options [nop,nop,TS val 396744626 ecr 2670303519], length 1314
23:46:20.280677 IP 99.181.89.55.1935 > 10.8.0.7.41142: Flags [.], ack 93575, win 182, options [nop,nop,TS val 2670303550 ecr 396744254], length 0
23:46:20.340411 IP 10.8.0.7.41142 > 99.181.89.55.1935: Flags [.], seq 104612:105926, ack 0, win 501, options [nop,nop,TS val 396744689 ecr 2670303550], length 1314
23:46:20.344904 IP 99.181.89.55.1935 > 10.8.0.7.41142: Flags [.], ack 94889, win 187, options [nop,nop,TS val 2670303614 ecr 396744318], length 0
23:46:20.369418 IP 10.8.0.7.41142 > 99.181.89.55.1935: Flags [.], seq 105926:107240, ack 0, win 501, options [nop,nop,TS val 396744718 ecr 2670303614], length 1314
23:46:20.373939 IP 99.181.89.55.1935 > 10.8.0.7.41142: Flags [.], ack 96203, win 193, options [nop,nop,TS val 2670303643 ecr 396744351], length 0
23:46:20.405190 IP 10.8.0.7.41142 > 99.181.89.55.1935: Flags [.], seq 107240:108554, ack 0, win 501, options [nop,nop,TS val 396744754 ecr 2670303643], length 1314
23:46:20.409624 IP 99.181.89.55.1935 > 10.8.0.7.41142: Flags [.], ack 97517, win 199, options [nop,nop,TS val 2670303679 ecr 396744386], length 0
23:46:20.473755 IP 10.8.0.7.41142 > 99.181.89.55.1935: Flags [.], seq 108554:109868, ack 0, win 501, options [nop,nop,TS val 396744822 ecr 2670303679], length 1314
23:46:20.478005 IP 99.181.89.55.1935 > 10.8.0.7.41142: Flags [.], ack 98831, win 204, options [nop,nop,TS val 2670303747 ecr 396744455], length 0
23:46:20.506921 IP 10.8.0.7.41142 > 99.181.89.55.1935: Flags [.], seq 109868:111182, ack 0, win 501, options [nop,nop,TS val 396744855 ecr 2670303747], length 1314
23:46:20.538748 IP 10.8.0.7.41142 > 99.181.89.55.1935: Flags [.], seq 111182:112496, ack 0, win 501, options [nop,nop,TS val 396744887 ecr 2670303747], length 1314
23:46:20.604535 IP 10.8.0.7.41142 > 99.181.89.55.1935: Flags [.], seq 112496:113810, ack 0, win 501, options [nop,nop,TS val 396744953 ecr 2670303747], length 1314
23:46:20.640276 IP 10.8.0.7.41142 > 99.181.89.55.1935: Flags [.], seq 113810:115124, ack 0, win 501, options [nop,nop,TS val 396744989 ecr 2670303747], length 1314
23:46:20.671847 IP 10.8.0.7.41142 > 99.181.89.55.1935: Flags [.], seq 115124:116438, ack 0, win 501, options [nop,nop,TS val 396745020 ecr 2670303747], length 1314
23:46:20.737092 IP 10.8.0.7.41142 > 99.181.89.55.1935: Flags [.], seq 116438:117752, ack 0, win 501, options [nop,nop,TS val 396745085 ecr 2670303747], length 1314
23:46:20.769511 IP 10.8.0.7.41142 > 99.181.89.55.1935: Flags [.], seq 117752:119066, ack 0, win 501, options [nop,nop,TS val 396745118 ecr 2670303747], length 1314
23:46:20.804129 IP 10.8.0.7.41142 > 99.181.89.55.1935: Flags [.], seq 119066:120380, ack 0, win 501, options [nop,nop,TS val 396745152 ecr 2670303747], length 1314
23:46:20.873496 IP 10.8.0.7.41142 > 99.181.89.55.1935: Flags [.], seq 120380:121694, ack 0, win 501, options [nop,nop,TS val 396745222 ecr 2670303747], length 1314
23:46:20.902645 IP 10.8.0.7.41142 > 99.181.89.55.1935: Flags [.], seq 121694:123008, ack 0, win 501, options [nop,nop,TS val 396745251 ecr 2670303747], length 1314
23:46:20.936772 IP 10.8.0.7.41142 > 99.181.89.55.1935: Flags [.], seq 123008:124322, ack 0, win 501, options [nop,nop,TS val 396745285 ecr 2670303747], length 1314
23:46:21.003035 IP 10.8.0.7.41142 > 99.181.89.55.1935: Flags [.], seq 124322:125636, ack 0, win 501, options [nop,nop,TS val 396745351 ecr 2670303747], length 1314
23:46:21.040058 IP 10.8.0.7.41142 > 99.181.89.55.1935: Flags [.], seq 125636:126950, ack 0, win 501, options [nop,nop,TS val 396745388 ecr 2670303747], length 1314
23:46:21.073626 IP 10.8.0.7.41142 > 99.181.89.55.1935: Flags [.], seq 126950:128264, ack 0, win 501, options [nop,nop,TS val 396745422 ecr 2670303747], length 1314
23:46:21.131029 IP 10.8.0.7.41142 > 99.181.89.55.1935: Flags [.], seq 128264:129578, ack 0, win 501, options [nop,nop,TS val 396745479 ecr 2670303747], length 1314
23:46:21.169467 IP 10.8.0.7.41142 > 99.181.89.55.1935: Flags [.], seq 129578:130892, ack 0, win 501, options [nop,nop,TS val 396745518 ecr 2670303747], length 1314
23:46:21.203764 IP 10.8.0.7.41142 > 99.181.89.55.1935: Flags [.], seq 130892:132206, ack 0, win 501, options [nop,nop,TS val 396745552 ecr 2670303747], length 1314
23:46:21.258884 IP 10.8.0.7.41142 > 99.181.89.55.1935: Flags [.], seq 132206:133520, ack 0, win 501, options [nop,nop,TS val 396745607 ecr 2670303747], length 1314
23:46:21.302662 IP 10.8.0.7.41142 > 99.181.89.55.1935: Flags [.], seq 133520:134834, ack 0, win 501, options [nop,nop,TS val 396745651 ecr 2670303747], length 1314
23:46:21.336911 IP 10.8.0.7.41142 > 99.181.89.55.1935: Flags [.], seq 134834:136148, ack 0, win 501, options [nop,nop,TS val 396745685 ecr 2670303747], length 1314
23:46:21.386751 IP 10.8.0.7.41142 > 99.181.89.55.1935: Flags [.], seq 136148:137462, ack 0, win 501, options [nop,nop,TS val 396745735 ecr 2670303747], length 1314
23:46:21.440395 IP 10.8.0.7.41142 > 99.181.89.55.1935: Flags [.], seq 137462:138776, ack 0, win 501, options [nop,nop,TS val 396745789 ecr 2670303747], length 1314
23:46:21.470883 IP 10.8.0.7.41142 > 99.181.89.55.1935: Flags [.], seq 138776:140090, ack 0, win 501, options [nop,nop,TS val 396745819 ecr 2670303747], length 1314
23:46:21.515058 IP 10.8.0.7.41142 > 99.181.89.55.1935: Flags [.], seq 140090:141404, ack 0, win 501, options [nop,nop,TS val 396745863 ecr 2670303747], length 1314
23:46:21.573400 IP 10.8.0.7.41142 > 99.181.89.55.1935: Flags [.], seq 141404:142718, ack 0, win 501, options [nop,nop,TS val 396745922 ecr 2670303747], length 1314
23:46:21.605339 IP 10.8.0.7.41142 > 99.181.89.55.1935: Flags [.], seq 142718:144032, ack 0, win 501, options [nop,nop,TS val 396745954 ecr 2670303747], length 1314
23:46:21.643323 IP 10.8.0.7.41142 > 99.181.89.55.1935: Flags [.], seq 144032:145346, ack 0, win 501, options [nop,nop,TS val 396745992 ecr 2670303747], length 1314
23:46:21.702705 IP 10.8.0.7.41142 > 99.181.89.55.1935: Flags [.], seq 145346:146660, ack 0, win 501, options [nop,nop,TS val 396746051 ecr 2670303747], length 1314
23:46:21.736839 IP 10.8.0.7.41142 > 99.181.89.55.1935: Flags [.], seq 146660:147974, ack 0, win 501, options [nop,nop,TS val 396746085 ecr 2670303747], length 1314
23:46:21.771174 IP 10.8.0.7.41142 > 99.181.89.55.1935: Flags [.], seq 147974:149288, ack 0, win 501, options [nop,nop,TS val 396746119 ecr 2670303747], length 1314
23:46:21.836126 IP 10.8.0.7.41142 > 99.181.89.55.1935: Flags [.], seq 149288:150602, ack 0, win 501, options [nop,nop,TS val 396746184 ecr 2670303747], length 1314
23:46:21.869686 IP 10.8.0.7.41142 > 99.181.89.55.1935: Flags [.], seq 150602:151916, ack 0, win 501, options [nop,nop,TS val 396746218 ecr 2670303747], length 1314
23:46:21.904749 IP 10.8.0.7.41142 > 99.181.89.55.1935: Flags [.], seq 151916:153230, ack 0, win 501, options [nop,nop,TS val 396746253 ecr 2670303747], length 1314
23:46:21.969507 IP 10.8.0.7.41142 > 99.181.89.55.1935: Flags [.], seq 153230:154544, ack 0, win 501, options [nop,nop,TS val 396746318 ecr 2670303747], length 1314
23:46:22.003638 IP 10.8.0.7.41142 > 99.181.89.55.1935: Flags [.], seq 154544:155858, ack 0, win 501, options [nop,nop,TS val 396746352 ecr 2670303747], length 1314
23:46:22.040185 IP 10.8.0.7.41142 > 99.181.89.55.1935: Flags [.], seq 155858:157172, ack 0, win 501, options [nop,nop,TS val 396746388 ecr 2670303747], length 1314
23:46:22.103656 IP 10.8.0.7.41142 > 99.181.89.55.1935: Flags [.], seq 157172:158486, ack 0, win 501, options [nop,nop,TS val 396746452 ecr 2670303747], length 1314
23:46:22.138032 IP 10.8.0.7.41142 > 99.181.89.55.1935: Flags [.], seq 158486:159800, ack 0, win 501, options [nop,nop,TS val 396746486 ecr 2670303747], length 1314
23:46:22.173181 IP 10.8.0.7.41142 > 99.181.89.55.1935: Flags [.], seq 159800:161114, ack 0, win 501, options [nop,nop,TS val 396746521 ecr 2670303747], length 1314
23:46:22.236250 IP 10.8.0.7.41142 > 99.181.89.55.1935: Flags [.], seq 161114:162428, ack 0, win 501, options [nop,nop,TS val 396746585 ecr 2670303747], length 1314
23:46:22.271665 IP 10.8.0.7.41142 > 99.181.89.55.1935: Flags [.], seq 162428:163742, ack 0, win 501, options [nop,nop,TS val 396746620 ecr 2670303747], length 1314
23:46:22.304173 IP 10.8.0.7.41142 > 99.181.89.55.1935: Flags [.], seq 163742:165056, ack 0, win 501, options [nop,nop,TS val 396746652 ecr 2670303747], length 1314
23:46:22.368152 IP 10.8.0.7.41142 > 99.181.89.55.1935: Flags [.], seq 165056:166370, ack 0, win 501, options [nop,nop,TS val 396746716 ecr 2670303747], length 1314
23:46:22.405014 IP 10.8.0.7.41142 > 99.181.89.55.1935: Flags [.], seq 166370:167684, ack 0, win 501, options [nop,nop,TS val 396746753 ecr 2670303747], length 1314
23:46:22.438815 IP 10.8.0.7.41142 > 99.181.89.55.1935: Flags [.], seq 167684:168998, ack 0, win 501, options [nop,nop,TS val 396746787 ecr 2670303747], length 1314
23:46:22.475008 IP 10.8.0.7.41142 > 99.181.89.55.1935: Flags [.], seq 168998:170312, ack 0, win 501, options [nop,nop,TS val 396746823 ecr 2670303747], length 1314
23:46:22.493084 IP 99.181.89.55.1935 > 10.8.0.7.41142: Flags [.], ack 100145, win 210, options [nop,nop,TS val 2670303778 ecr 396744487], length 0
23:46:22.493131 IP 99.181.89.55.1935 > 10.8.0.7.41142: Flags [.], ack 100670, win 215, options [nop,nop,TS val 2670303794 ecr 396744504], length 0
23:46:22.493152 IP 10.8.0.7.41142 > 99.181.89.55.1935: Flags [P.], seq 170312:170323, ack 0, win 501, options [nop,nop,TS val 396746841 ecr 2670303794], length 11
23:46:22.493400 IP 99.181.89.55.1935 > 10.8.0.7.41142: Flags [.], ack 101984, win 221, options [nop,nop,TS val 2670303847 ecr 396744552], length 0
23:46:22.493579 IP 99.181.89.55.1935 > 10.8.0.7.41142: Flags [.], ack 103298, win 226, options [nop,nop,TS val 2670303884 ecr 396744585], length 0
23:46:22.539320 IP 10.8.0.7.41142 > 99.181.89.55.1935: Flags [.], seq 170323:171637, ack 0, win 501, options [nop,nop,TS val 396746888 ecr 2670303884], length 1314
23:46:22.573340 IP 10.8.0.7.41142 > 99.181.89.55.1935: Flags [.], seq 171637:172951, ack 0, win 501, options [nop,nop,TS val 396746922 ecr 2670303884], length 1314
23:46:22.606543 IP 10.8.0.7.41142 > 99.181.89.55.1935: Flags [.], seq 172951:174265, ack 0, win 501, options [nop,nop,TS val 396746955 ecr 2670303884], length 1314
23:46:22.631290 IP 99.181.89.55.1935 > 10.8.0.7.41142: Flags [.], ack 104612, win 232, options [nop,nop,TS val 2670305900 ecr 396744626], length 0
23:46:22.631328 IP 99.181.89.55.1935 > 10.8.0.7.41142: Flags [.], ack 105926, win 238, options [nop,nop,TS val 2670305900 ecr 396744689], length 0
23:46:22.631402 IP 99.181.89.55.1935 > 10.8.0.7.41142: Flags [.], ack 107240, win 243, options [nop,nop,TS val 2670305901 ecr 396744718], length 0
23:46:22.631420 IP 99.181.89.55.1935 > 10.8.0.7.41142: Flags [.], ack 108554, win 249, options [nop,nop,TS val 2670305901 ecr 396744754], length 0
23:46:22.631437 IP 99.181.89.55.1935 > 10.8.0.7.41142: Flags [.], ack 109868, win 255, options [nop,nop,TS val 2670305901 ecr 396744822], length 0
23:46:22.631453 IP 99.181.89.55.1935 > 10.8.0.7.41142: Flags [.], ack 111182, win 260, options [nop,nop,TS val 2670305901 ecr 396744855], length 0
23:46:22.631469 IP 99.181.89.55.1935 > 10.8.0.7.41142: Flags [.], ack 112496, win 266, options [nop,nop,TS val 2670305901 ecr 396744887], length 0
23:46:22.632103 IP 99.181.89.55.1935 > 10.8.0.7.41142: Flags [.], ack 113810, win 272, options [nop,nop,TS val 2670305901 ecr 396744953], length 0
23:46:22.632160 IP 99.181.89.55.1935 > 10.8.0.7.41142: Flags [.], ack 115124, win 277, options [nop,nop,TS val 2670305901 ecr 396744989], length 0
23:46:22.632182 IP 99.181.89.55.1935 > 10.8.0.7.41142: Flags [.], ack 116438, win 283, options [nop,nop,TS val 2670305901 ecr 396745020], length 0
23:46:22.632234 IP 99.181.89.55.1935 > 10.8.0.7.41142: Flags [.], ack 117752, win 289, options [nop,nop,TS val 2670305901 ecr 396745085], length 0
23:46:22.632256 IP 99.181.89.55.1935 > 10.8.0.7.41142: Flags [.], ack 119066, win 294, options [nop,nop,TS val 2670305901 ecr 396745118], length 0
23:46:22.632279 IP 99.181.89.55.1935 > 10.8.0.7.41142: Flags [.], ack 120380, win 300, options [nop,nop,TS val 2670305901 ecr 396745152], length 0
23:46:22.632300 IP 99.181.89.55.1935 > 10.8.0.7.41142: Flags [.], ack 121694, win 306, options [nop,nop,TS val 2670305901 ecr 396745222], length 0
23:46:22.632337 IP 99.181.89.55.1935 > 10.8.0.7.41142: Flags [.], ack 123008, win 311, options [nop,nop,TS val 2670305901 ecr 396745251], length 0
23:46:22.632353 IP 99.181.89.55.1935 > 10.8.0.7.41142: Flags [.], ack 124322, win 317, options [nop,nop,TS val 2670305901 ecr 396745285], length 0
23:46:22.632367 IP 99.181.89.55.1935 > 10.8.0.7.41142: Flags [.], ack 125636, win 323, options [nop,nop,TS val 2670305901 ecr 396745351], length 0
23:46:22.632383 IP 99.181.89.55.1935 > 10.8.0.7.41142: Flags [.], ack 126950, win 328, options [nop,nop,TS val 2670305901 ecr 396745388], length 0
23:46:22.632823 IP 99.181.89.55.1935 > 10.8.0.7.41142: Flags [.], ack 128264, win 334, options [nop,nop,TS val 2670305902 ecr 396745422], length 0
23:46:22.632845 IP 99.181.89.55.1935 > 10.8.0.7.41142: Flags [.], ack 129578, win 340, options [nop,nop,TS val 2670305902 ecr 396745479], length 0
23:46:22.632861 IP 99.181.89.55.1935 > 10.8.0.7.41142: Flags [.], ack 130892, win 345, options [nop,nop,TS val 2670305902 ecr 396745518], length 0
23:46:22.632875 IP 99.181.89.55.1935 > 10.8.0.7.41142: Flags [.], ack 132206, win 351, options [nop,nop,TS val 2670305902 ecr 396745552], length 0
23:46:22.632892 IP 99.181.89.55.1935 > 10.8.0.7.41142: Flags [.], ack 133520, win 357, options [nop,nop,TS val 2670305902 ecr 396745607], length 0
23:46:22.632907 IP 99.181.89.55.1935 > 10.8.0.7.41142: Flags [.], ack 134834, win 362, options [nop,nop,TS val 2670305902 ecr 396745651], length 0
23:46:22.632923 IP 99.181.89.55.1935 > 10.8.0.7.41142: Flags [.], ack 136148, win 368, options [nop,nop,TS val 2670305902 ecr 396745685], length 0
23:46:22.632939 IP 99.181.89.55.1935 > 10.8.0.7.41142: Flags [.], ack 137462, win 373, options [nop,nop,TS val 2670305902 ecr 396745735], length 0
23:46:22.632954 IP 99.181.89.55.1935 > 10.8.0.7.41142: Flags [.], ack 138776, win 379, options [nop,nop,TS val 2670305902 ecr 396745789], length 0
23:46:22.632970 IP 99.181.89.55.1935 > 10.8.0.7.41142: Flags [.], ack 140090, win 385, options [nop,nop,TS val 2670305902 ecr 396745819], length 0
23:46:22.632988 IP 99.181.89.55.1935 > 10.8.0.7.41142: Flags [.], ack 141404, win 390, options [nop,nop,TS val 2670305902 ecr 396745863], length 0
23:46:22.633184 IP 99.181.89.55.1935 > 10.8.0.7.41142: Flags [.], ack 142718, win 396, options [nop,nop,TS val 2670305902 ecr 396745922], length 0
23:46:22.633210 IP 99.181.89.55.1935 > 10.8.0.7.41142: Flags [.], ack 144032, win 402, options [nop,nop,TS val 2670305902 ecr 396745954], length 0
23:46:22.633233 IP 99.181.89.55.1935 > 10.8.0.7.41142: Flags [.], ack 145346, win 407, options [nop,nop,TS val 2670305902 ecr 396745992], length 0
23:46:22.633258 IP 99.181.89.55.1935 > 10.8.0.7.41142: Flags [.], ack 146660, win 413, options [nop,nop,TS val 2670305902 ecr 396746051], length 0
23:46:22.633283 IP 99.181.89.55.1935 > 10.8.0.7.41142: Flags [.], ack 147974, win 419, options [nop,nop,TS val 2670305902 ecr 396746085], length 0
23:46:22.633307 IP 99.181.89.55.1935 > 10.8.0.7.41142: Flags [.], ack 149288, win 424, options [nop,nop,TS val 2670305902 ecr 396746119], length 0
23:46:22.633331 IP 99.181.89.55.1935 > 10.8.0.7.41142: Flags [.], ack 150602, win 430, options [nop,nop,TS val 2670305902 ecr 396746184], length 0
23:46:22.633354 IP 99.181.89.55.1935 > 10.8.0.7.41142: Flags [.], ack 151916, win 436, options [nop,nop,TS val 2670305902 ecr 396746218], length 0
23:46:22.633377 IP 99.181.89.55.1935 > 10.8.0.7.41142: Flags [.], ack 153230, win 441, options [nop,nop,TS val 2670305902 ecr 396746253], length 0
23:46:22.633403 IP 99.181.89.55.1935 > 10.8.0.7.41142: Flags [.], ack 154544, win 447, options [nop,nop,TS val 2670305902 ecr 396746318], length 0
23:46:22.633428 IP 99.181.89.55.1935 > 10.8.0.7.41142: Flags [.], ack 155858, win 453, options [nop,nop,TS val 2670305902 ecr 396746352], length 0
23:46:22.633453 IP 99.181.89.55.1935 > 10.8.0.7.41142: Flags [.], ack 157172, win 458, options [nop,nop,TS val 2670305902 ecr 396746388], length 0
23:46:22.633596 IP 99.181.89.55.1935 > 10.8.0.7.41142: Flags [.], ack 158486, win 464, options [nop,nop,TS val 2670305903 ecr 396746452], length 0
23:46:22.633622 IP 99.181.89.55.1935 > 10.8.0.7.41142: Flags [.], ack 159800, win 470, options [nop,nop,TS val 2670305903 ecr 396746486], length 0
23:46:22.633646 IP 99.181.89.55.1935 > 10.8.0.7.41142: Flags [.], ack 161114, win 475, options [nop,nop,TS val 2670305903 ecr 396746521], length 0
23:46:22.646588 IP 99.181.89.55.1935 > 10.8.0.7.41142: Flags [.], ack 161114, win 481, options [nop,nop,TS val 2670305916 ecr 396746521,nop,nop,sack 1 {162428:163742}], length 0
23:46:22.672825 IP 10.8.0.7.41142 > 99.181.89.55.1935: Flags [.], seq 174265:175579, ack 0, win 501, options [nop,nop,TS val 396747021 ecr 2670305916], length 1314
23:46:22.681032 IP 99.181.89.55.1935 > 10.8.0.7.41142: Flags [.], ack 161114, win 487, options [nop,nop,TS val 2670305950 ecr 396746521,nop,nop,sack 1 {162428:165056}], length 0
23:46:22.703839 IP 10.8.0.7.41142 > 99.181.89.55.1935: Flags [.], seq 175579:176893, ack 0, win 501, options [nop,nop,TS val 396747052 ecr 2670305950], length 1314
23:46:22.737685 IP 10.8.0.7.41142 > 99.181.89.55.1935: Flags [.], seq 176893:178207, ack 0, win 501, options [nop,nop,TS val 396747086 ecr 2670305950], length 1314
23:46:22.742637 IP 99.181.89.55.1935 > 10.8.0.7.41142: Flags [.], ack 161114, win 492, options [nop,nop,TS val 2670306012 ecr 396746521,nop,nop,sack 1 {162428:166370}], length 0
23:46:22.742660 IP 10.8.0.7.41142 > 99.181.89.55.1935: Flags [.], seq 161114:162428, ack 0, win 501, options [nop,nop,TS val 396747091 ecr 2670306012], length 1314
23:46:22.778950 IP 99.181.89.55.1935 > 10.8.0.7.41142: Flags [.], ack 161114, win 498, options [nop,nop,TS val 2670306048 ecr 396746521,nop,nop,sack 1 {162428:167684}], length 0
23:46:22.803549 IP 10.8.0.7.41142 > 99.181.89.55.1935: Flags [.], seq 178207:179521, ack 0, win 501, options [nop,nop,TS val 396747152 ecr 2670306048], length 1314
23:46:22.811180 IP 99.181.89.55.1935 > 10.8.0.7.41142: Flags [.], ack 161114, win 504, options [nop,nop,TS val 2670306080 ecr 396746521,nop,nop,sack 1 {162428:168998}], length 0
23:46:22.838516 IP 10.8.0.7.41142 > 99.181.89.55.1935: Flags [.], seq 179521:180835, ack 0, win 501, options [nop,nop,TS val 396747187 ecr 2670306080], length 1314
23:46:22.847719 IP 99.181.89.55.1935 > 10.8.0.7.41142: Flags [.], ack 161114, win 509, options [nop,nop,TS val 2670306117 ecr 396746521,nop,nop,sack 1 {162428:170312}], length 0
23:46:22.864925 IP 99.181.89.55.1935 > 10.8.0.7.41142: Flags [.], ack 161114, win 509, options [nop,nop,TS val 2670306134 ecr 396746521,nop,nop,sack 1 {162428:170323}], length 0
23:46:22.873471 IP 10.8.0.7.41142 > 99.181.89.55.1935: Flags [.], seq 180835:182149, ack 0, win 501, options [nop,nop,TS val 396747222 ecr 2670306134], length 1314
23:46:22.913069 IP 99.181.89.55.1935 > 10.8.0.7.41142: Flags [.], ack 161114, win 515, options [nop,nop,TS val 2670306182 ecr 396746521,nop,nop,sack 1 {162428:171637}], length 0
