20:31:37.242359 IP 99.181.67.72.1935 > 10.8.3.2.55544: Flags [.], ack 18859621, win 126, options [nop,nop,TS val 3790901602 ecr 1814556126], length 0
20:31:37.250318 IP 10.8.3.2.55544 > 99.181.67.72.1935: Flags [.], seq 7548:8862, ack 0, win 501, options [nop,nop,TS val 1814556489 ecr 3790901602], length 1314
20:31:37.285694 IP 10.8.3.2.55544 > 99.181.67.72.1935: Flags [.], seq 8862:10176, ack 0, win 501, options [nop,nop,TS val 1814556524 ecr 3790901602], length 1314
20:31:37.309952 IP 99.181.67.72.1935 > 10.8.3.2.55544: Flags [.], ack 2629, win 126, options [nop,nop,TS val 3790901670 ecr 1814556211], length 0
20:31:37.314680 IP 10.8.3.2.55544 > 99.181.67.72.1935: Flags [.], seq 10176:11490, ack 0, win 501, options [nop,nop,TS val 1814556553 ecr 3790901670], length 1314
20:31:37.344756 IP 99.181.67.72.1935 > 10.8.3.2.55544: Flags [.], ack 3606, win 126, options [nop,nop,TS val 3790901705 ecr 1814556291], length 0
20:31:37.344778 IP 10.8.3.2.55544 > 99.181.67.72.1935: Flags [P.], seq 11490:11708, ack 0, win 501, options [nop,nop,TS val 1814556583 ecr 3790901705], length 218
20:31:37.378335 IP 10.8.3.2.55544 > 99.181.67.72.1935: Flags [.], seq 11708:13022, ack 0, win 501, options [nop,nop,TS val 1814556617 ecr 3790901705], length 1314
20:31:37.414516 IP 10.8.3.2.55544 > 99.181.67.72.1935: Flags [.], seq 13022:14336, ack 0, win 501, options [nop,nop,TS val 1814556653 ecr 3790901705], length 1314
20:31:37.436194 IP 99.181.67.72.1935 > 10.8.3.2.55544: Flags [.], ack 6234, win 126, options [nop,nop,TS val 3790901796 ecr 1814556357], length 0
20:31:37.463565 IP 10.8.3.2.55544 > 99.181.67.72.1935: Flags [.], seq 14336:15650, ack 0, win 501, options [nop,nop,TS val 1814556702 ecr 3790901796], length 1314
20:31:37.506534 IP 10.8.3.2.55544 > 99.181.67.72.1935: Flags [.], seq 15650:16964, ack 0, win 501, options [nop,nop,TS val 1814556745 ecr 3790901796], length 1314
20:31:37.543959 IP 99.181.67.72.1935 > 10.8.3.2.55544: Flags [.], ack 8862, win 126, options [nop,nop,TS val 3790901902 ecr 1814556420], length 0
20:31:37.549220 IP 10.8.3.2.55544 > 99.181.67.72.1935: Flags [.], seq 16964:18278, ack 0, win 501, options [nop,nop,TS val 1814556788 ecr 3790901902], length 1314
20:31:37.591642 IP 10.8.3.2.55544 > 99.181.67.72.1935: Flags [.], seq 18278:19592, ack 0, win 501, options [nop,nop,TS val 1814556830 ecr 3790901902], length 1314
20:31:37.608075 IP 99.181.67.72.1935 > 10.8.3.2.55544: Flags [.], ack 11490, win 126, options [nop,nop,TS val 3790901967 ecr 1814556524], length 0
20:31:37.638581 IP 99.181.67.72.1935 > 10.8.3.2.55544: Flags [.], ack 11708, win 126, options [nop,nop,TS val 3790901997 ecr 1814556583], length 0
20:31:37.638610 IP 10.8.3.2.55544 > 99.181.67.72.1935: Flags [P.], seq 19592:20669, ack 0, win 501, options [nop,nop,TS val 1814556877 ecr 3790901997], length 1077
20:31:37.677210 IP 10.8.3.2.55544 > 99.181.67.72.1935: Flags [.], seq 20669:21983, ack 0, win 501, options [nop,nop,TS val 1814556916 ecr 3790901997], length 1314
20:31:37.706496 IP 99.181.67.72.1935 > 10.8.3.2.55544: Flags [.], ack 14336, win 126, options [nop,nop,TS val 3790902066 ecr 1814556617], length 0
20:31:37.714878 IP 10.8.3.2.55544 > 99.181.67.72.1935: Flags [.], seq 21983:23297, ack 0, win 501, options [nop,nop,TS val 1814556953 ecr 3790902066], length 1314
20:31:37.761937 IP 10.8.3.2.55544 > 99.181.67.72.1935: Flags [.], seq 23297:24611, ack 0, win 501, options [nop,nop,TS val 1814557000 ecr 3790902066], length 1314
20:31:37.798677 IP 99.181.67.72.1935 > 10.8.3.2.55544: Flags [.], ack 16964, win 126, options [nop,nop,TS val 3790902158 ecr 1814556702], length 0
20:31:37.819018 IP 10.8.3.2.55544 > 99.181.67.72.1935: Flags [.], seq 24611:25925, ack 0, win 501, options [nop,nop,TS val 1814557057 ecr 3790902158], length 1314
20:31:37.847325 IP 10.8.3.2.55544 > 99.181.67.72.1935: Flags [.], seq 25925:27239, ack 0, win 501, options [nop,nop,TS val 1814557086 ecr 3790902158], length 1314
20:31:37.883540 IP 99.181.67.72.1935 > 10.8.3.2.55544: Flags [.], ack 19592, win 126, options [nop,nop,TS val 3790902243 ecr 1814556788], length 0
20:31:37.889676 IP 10.8.3.2.55544 > 99.181.67.72.1935: Flags [.], seq 27239:28553, ack 0, win 501, options [nop,nop,TS val 1814557128 ecr 3790902243], length 1314
20:31:37.930919 IP 99.181.67.72.1935 > 10.8.3.2.55544: Flags [.], ack 20669, win 126, options [nop,nop,TS val 3790902291 ecr 1814556877], length 0
20:31:37.930952 IP 10.8.3.2.55544 > 99.181.67.72.1935: Flags [P.], seq 28553:29526, ack 0, win 501, options [nop,nop,TS val 1814557169 ecr 3790902291], length 973
20:31:37.975540 IP 10.8.3.2.55544 > 99.181.67.72.1935: Flags [.], seq 29526:30840, ack 0, win 501, options [nop,nop,TS val 1814557214 ecr 3790902291], length 1314
20:31:38.007161 IP 99.181.67.72.1935 > 10.8.3.2.55544: Flags [.], ack 23297, win 126, options [nop,nop,TS val 3790902367 ecr 1814556916], length 0
20:31:38.016243 IP 10.8.3.2.55544 > 99.181.67.72.1935: Flags [.], seq 30840:32154, ack 0, win 501, options [nop,nop,TS val 1814557255 ecr 3790902367], length 1314
20:31:38.048497 IP 10.8.3.2.55544 > 99.181.67.72.1935: Flags [.], seq 32154:33468, ack 0, win 501, options [nop,nop,TS val 1814557287 ecr 3790902367], length 1314
20:31:38.111108 IP 99.181.67.72.1935 > 10.8.3.2.55544: Flags [.], ack 25925, win 126, options [nop,nop,TS val 3790902471 ecr 1814557000], length 0
20:31:38.118834 IP 10.8.3.2.55544 > 99.181.67.72.1935: Flags [.], seq 33468:34782, ack 0, win 501, options [nop,nop,TS val 1814557357 ecr 3790902471], length 1314
20:31:38.146578 IP 10.8.3.2.55544 > 99.181.67.72.1935: Flags [.], seq 34782:36096, ack 0, win 501, options [nop,nop,TS val 1814557385 ecr 3790902471], length 1314
20:31:38.182301 IP 99.181.67.72.1935 > 10.8.3.2.55544: Flags [.], ack 28553, win 126, options [nop,nop,TS val 3790902541 ecr 1814557086], length 0
20:31:38.184046 IP 10.8.3.2.55544 > 99.181.67.72.1935: Flags [.], seq 36096:37410, ack 0, win 501, options [nop,nop,TS val 1814557422 ecr 3790902541], length 1314
20:31:38.223169 IP 99.181.67.72.1935 > 10.8.3.2.55544: Flags [.], ack 29526, win 126, options [nop,nop,TS val 3790902583 ecr 1814557169], length 0
20:31:38.223202 IP 10.8.3.2.55544 > 99.181.67.72.1935: Flags [P.], seq 37410:38476, ack 0, win 501, options [nop,nop,TS val 1814557462 ecr 3790902583], length 1066
20:31:38.274240 IP 10.8.3.2.55544 > 99.181.67.72.1935: Flags [.], seq 38476:39790, ack 0, win 501, options [nop,nop,TS val 1814557513 ecr 3790902583], length 1314
20:31:38.308329 IP 99.181.67.72.1935 > 10.8.3.2.55544: Flags [.], ack 32154, win 126, options [nop,nop,TS val 3790902668 ecr 1814557214], length 0
20:31:38.316214 IP 10.8.3.2.55544 > 99.181.67.72.1935: Flags [.], seq 39790:41104, ack 0, win 501, options [nop,nop,TS val 1814557555 ecr 3790902668], length 1314
20:31:38.352033 IP 10.8.3.2.55544 > 99.181.67.72.1935: Flags [.], seq 41104:42418, ack 0, win 501, options [nop,nop,TS val 1814557590 ecr 3790902668], length 1314
20:31:38.410876 IP 99.181.67.72.1935 > 10.8.3.2.55544: Flags [.], ack 34782, win 126, options [nop,nop,TS val 3790902771 ecr 1814557287], length 0
20:31:38.416231 IP 10.8.3.2.55544 > 99.181.67.72.1935: Flags [.], seq 42418:43732, ack 0, win 501, options [nop,nop,TS val 1814557655 ecr 3790902771], length 1314
20:31:38.444320 IP 10.8.3.2.55544 > 99.181.67.72.1935: Flags [.], seq 43732:45046, ack 0, win 501, options [nop,nop,TS val 1814557683 ecr 3790902771], length 1314
20:31:38.475951 IP 99.181.67.72.1935 > 10.8.3.2.55544: Flags [.], ack 37410, win 126, options [nop,nop,TS val 3790902836 ecr 1814557385], length 0
20:31:38.486869 IP 10.8.3.2.55544 > 99.181.67.72.1935: Flags [.], seq 45046:46360, ack 0, win 501, options [nop,nop,TS val 1814557725 ecr 3790902836], length 1314
20:31:38.515470 IP 99.181.67.72.1935 > 10.8.3.2.55544: Flags [.], ack 38476, win 126, options [nop,nop,TS val 3790902875 ecr 1814557462], length 0
20:31:38.515511 IP 10.8.3.2.55544 > 99.181.67.72.1935: Flags [P.], seq 46360:47341, ack 0, win 501, options [nop,nop,TS val 1814557754 ecr 3790902875], length 981
20:31:38.572498 IP 10.8.3.2.55544 > 99.181.67.72.1935: Flags [.], seq 47341:48655, ack 0, win 501, options [nop,nop,TS val 1814557811 ecr 3790902875], length 1314
20:31:38.608170 IP 99.181.67.72.1935 > 10.8.3.2.55544: Flags [.], ack 41104, win 126, options [nop,nop,TS val 3790902968 ecr 1814557513], length 0
20:31:38.615198 IP 10.8.3.2.55544 > 99.181.67.72.1935: Flags [.], seq 48655:49969, ack 0, win 501, options [nop,nop,TS val 1814557854 ecr 3790902968], length 1314
20:31:38.649983 IP 10.8.3.2.55544 > 99.181.67.72.1935: Flags [.], seq 49969:51283, ack 0, win 501, options [nop,nop,TS val 1814557888 ecr 3790902968], length 1314
20:31:38.709620 IP 99.181.67.72.1935 > 10.8.3.2.55544: Flags [.], ack 43732, win 126, options [nop,nop,TS val 3790903068 ecr 1814557590], length 0
20:31:38.720327 IP 10.8.3.2.55544 > 99.181.67.72.1935: Flags [.], seq 51283:52597, ack 0, win 501, options [nop,nop,TS val 1814557959 ecr 3790903068], length 1314
20:31:38.743239 IP 10.8.3.2.55544 > 99.181.67.72.1935: Flags [.], seq 52597:53911, ack 0, win 501, options [nop,nop,TS val 1814557982 ecr 3790903068], length 1314
20:31:38.780130 IP 99.181.67.72.1935 > 10.8.3.2.55544: Flags [.], ack 46360, win 126, options [nop,nop,TS val 3790903139 ecr 1814557683], length 0
20:31:38.783216 IP 10.8.3.2.55544 > 99.181.67.72.1935: Flags [.], seq 53911:55225, ack 0, win 501, options [nop,nop,TS val 1814558022 ecr 3790903139], length 1314
20:31:38.808898 IP 99.181.67.72.1935 > 10.8.3.2.55544: Flags [.], ack 47341, win 126, options [nop,nop,TS val 3790903167 ecr 1814557754], length 0
20:31:38.808910 IP 10.8.3.2.55544 > 99.181.67.72.1935: Flags [P.], seq 55225:56290, ack 0, win 501, options [nop,nop,TS val 1814558047 ecr 3790903167], length 1065
20:31:38.886410 IP 10.8.3.2.55544 > 99.181.67.72.1935: Flags [.], seq 56290:57604, ack 0, win 501, options [nop,nop,TS val 1814558125 ecr 3790903167], length 1314
20:31:38.907460 IP 99.181.67.72.1935 > 10.8.3.2.55544: Flags [.], ack 49969, win 126, options [nop,nop,TS val 3790903267 ecr 1814557811], length 0
20:31:38.913604 IP 10.8.3.2.55544 > 99.181.67.72.1935: Flags [.], seq 57604:58918, ack 0, win 501, options [nop,nop,TS val 1814558152 ecr 3790903267], length 1314
20:31:38.951473 IP 10.8.3.2.55544 > 99.181.67.72.1935: Flags [.], seq 58918:60232, ack 0, win 501, options [nop,nop,TS val 1814558190 ecr 3790903267], length 1314
20:31:39.012616 IP 99.181.67.72.1935 > 10.8.3.2.55544: Flags [.], ack 52597, win 126, options [nop,nop,TS val 3790903372 ecr 1814557888], length 0
20:31:39.018251 IP 10.8.3.2.55544 > 99.181.67.72.1935: Flags [.], seq 60232:61546, ack 0, win 501, options [nop,nop,TS val 1814558257 ecr 3790903372], length 1314
20:31:39.041319 IP 10.8.3.2.55544 > 99.181.67.72.1935: Flags [.], seq 61546:62860, ack 0, win 501, options [nop,nop,TS val 1814558280 ecr 3790903372], length 1314
20:31:39.075727 IP 99.181.67.72.1935 > 10.8.3.2.55544: Flags [.], ack 55225, win 126, options [nop,nop,TS val 3790903435 ecr 1814557982], length 0
20:31:39.081629 IP 10.8.3.2.55544 > 99.181.67.72.1935: Flags [.], seq 62860:64174, ack 0, win 501, options [nop,nop,TS val 1814558320 ecr 3790903435], length 1314
20:31:39.101018 IP 99.181.67.72.1935 > 10.8.3.2.55544: Flags [.], ack 56290, win 126, options [nop,nop,TS val 3790903461 ecr 1814558047], length 0
20:31:39.101042 IP 10.8.3.2.55544 > 99.181.67.72.1935: Flags [P.], seq 64174:64398, ack 0, win 501, options [nop,nop,TS val 1814558339 ecr 3790903461], length 224
20:31:39.148191 IP 10.8.3.2.55544 > 99.181.67.72.1935: Flags [.], seq 64398:65712, ack 0, win 501, options [nop,nop,TS val 1814558386 ecr 3790903461], length 1314
20:31:39.185876 IP 10.8.3.2.55544 > 99.181.67.72.1935: Flags [.], seq 65712:67026, ack 0, win 501, options [nop,nop,TS val 1814558424 ecr 3790903461], length 1314
20:31:39.205572 IP 99.181.67.72.1935 > 10.8.3.2.55544: Flags [.], ack 58918, win 126, options [nop,nop,TS val 3790903565 ecr 1814558125], length 0
20:31:39.215585 IP 10.8.3.2.55544 > 99.181.67.72.1935: Flags [.], seq 67026:68340, ack 0, win 501, options [nop,nop,TS val 1814558454 ecr 3790903565], length 1314
20:31:39.276388 IP 10.8.3.2.55544 > 99.181.67.72.1935: Flags [.], seq 68340:69654, ack 0, win 501, options [nop,nop,TS val 1814558515 ecr 3790903565], length 1314
20:31:39.308855 IP 99.181.67.72.1935 > 10.8.3.2.55544: Flags [.], ack 60232, win 126, options [nop,nop,TS val 3790903669 ecr 1814558190], length 0
20:31:39.318738 IP 10.8.3.2.55544 > 99.181.67.72.1935: Flags [.], seq 69654:70968, ack 0, win 501, options [nop,nop,TS val 1814558557 ecr 3790903669], length 1314
20:31:39.333585 IP 99.181.67.72.1935 > 10.8.3.2.55544: Flags [.], ack 62860, win 126, options [nop,nop,TS val 3790903693 ecr 1814558257], length 0
20:31:39.350324 IP 10.8.3.2.55544 > 99.181.67.72.1935: Flags [.], seq 70968:72282, ack 0, win 501, options [nop,nop,TS val 1814558589 ecr 3790903693], length 1314
20:31:39.393563 IP 99.181.67.72.1935 > 10.8.3.2.55544: Flags [.], ack 64398, win 126, options [nop,nop,TS val 3790903753 ecr 1814558320], length 0
20:31:39.393582 IP 10.8.3.2.55544 > 99.181.67.72.1935: Flags [P.], seq 72282:73359, ack 0, win 501, options [nop,nop,TS val 1814558632 ecr 3790903753], length 1077
20:31:39.447481 IP 10.8.3.2.55544 > 99.181.67.72.1935: Flags [.], seq 73359:74673, ack 0, win 501, options [nop,nop,TS val 1814558686 ecr 3790903753], length 1314
20:31:39.478786 IP 99.181.67.72.1935 > 10.8.3.2.55544: Flags [.], ack 67026, win 126, options [nop,nop,TS val 3790903838 ecr 1814558386], length 0
20:31:39.485183 IP 10.8.3.2.55544 > 99.181.67.72.1935: Flags [.], seq 74673:75987, ack 0, win 501, options [nop,nop,TS val 1814558723 ecr 3790903838], length 1314
20:31:39.518478 IP 10.8.3.2.55544 > 99.181.67.72.1935: Flags [.], seq 75987:77301, ack 0, win 501, options [nop,nop,TS val 1814558757 ecr 3790903838], length 1314
20:31:39.568790 IP 99.181.67.72.1935 > 10.8.3.2.55544: Flags [.], ack 69654, win 126, options [nop,nop,TS val 3790903928 ecr 1814558454], length 0
20:31:39.575928 IP 10.8.3.2.55544 > 99.181.67.72.1935: Flags [.], seq 77301:78615, ack 0, win 501, options [nop,nop,TS val 1814558814 ecr 3790903928], length 1314
20:31:39.615026 IP 10.8.3.2.55544 > 99.181.67.72.1935: Flags [.], seq 78615:79929, ack 0, win 501, options [nop,nop,TS val 1814558853 ecr 3790903928], length 1314
20:31:39.642408 IP 99.181.67.72.1935 > 10.8.3.2.55544: Flags [.], ack 72282, win 126, options [nop,nop,TS val 3790904002 ecr 1814558557], length 0
20:31:39.650767 IP 10.8.3.2.55544 > 99.181.67.72.1935: Flags [.], seq 79929:81243, ack 0, win 501, options [nop,nop,TS val 1814558889 ecr 3790904002], length 1314
20:31:39.685619 IP 99.181.67.72.1935 > 10.8.3.2.55544: Flags [.], ack 73359, win 126, options [nop,nop,TS val 3790904045 ecr 1814558632], length 0
20:31:39.685661 IP 10.8.3.2.55544 > 99.181.67.72.1935: Flags [P.], seq 81243:82300, ack 0, win 501, options [nop,nop,TS val 1814558924 ecr 3790904045], length 1057
20:31:39.747163 IP 10.8.3.2.55544 > 99.181.67.72.1935: Flags [.], seq 82300:83614, ack 0, win 501, options [nop,nop,TS val 1814558985 ecr 3790904045], length 1314
20:31:39.777456 IP 99.181.67.72.1935 > 10.8.3.2.55544: Flags [.], ack 75987, win 126, options [nop,nop,TS val 3790904137 ecr 1814558686], length 0
20:31:39.783341 IP 10.8.3.2.55544 > 99.181.67.72.1935: Flags [.], seq 83614:84928, ack 0, win 501, options [nop,nop,TS val 1814559022 ecr 3790904137], length 1314
20:31:39.818733 IP 10.8.3.2.55544 > 99.181.67.72.1935: Flags [.], seq 84928:86242, ack 0, win 501, options [nop,nop,TS val 1814559057 ecr 3790904137], length 1314
20:31:39.868141 IP 99.181.67.72.1935 > 10.8.3.2.55544: Flags [.], ack 78615, win 126, options [nop,nop,TS val 3790904228 ecr 1814558757], length 0
20:31:39.875769 IP 10.8.3.2.55544 > 99.181.67.72.1935: Flags [.], seq 86242:87556, ack 0, win 501, options [nop,nop,TS val 1814559114 ecr 3790904228], length 1314
20:31:39.917990 IP 10.8.3.2.55544 > 99.181.67.72.1935: Flags [.], seq 87556:88870, ack 0, win 501, options [nop,nop,TS val 1814559156 ecr 3790904228], length 1314
20:31:39.943280 IP 99.181.67.72.1935 > 10.8.3.2.55544: Flags [.], ack 81243, win 126, options [nop,nop,TS val 3790904303 ecr 1814558853], length 0
20:31:39.951893 IP 10.8.3.2.55544 > 99.181.67.72.1935: Flags [.], seq 88870:90184, ack 0, win 501, options [nop,nop,TS val 1814559190 ecr 3790904303], length 1314
20:31:39.978196 IP 99.181.67.72.1935 > 10.8.3.2.55544: Flags [.], ack 82300, win 126, options [nop,nop,TS val 3790904337 ecr 1814558924], length 0
20:31:39.978215 IP 10.8.3.2.55544 > 99.181.67.72.1935: Flags [P.], seq 90184:90318, ack 0, win 501, options [nop,nop,TS val 1814559217 ecr 3790904337], length 134
20:31:40.014804 IP 10.8.3.2.55544 > 99.181.67.72.1935: Flags [.], seq 90318:91632, ack 0, win 501, options [nop,nop,TS val 1814559253 ecr 3790904337], length 1314
20:31:40.046541 IP 10.8.3.2.55544 > 99.181.67.72.1935: Flags [.], seq 91632:92946, ack 0, win 501, options [nop,nop,TS val 1814559285 ecr 3790904337], length 1314
20:31:40.075678 IP 99.181.67.72.1935 > 10.8.3.2.55544: Flags [.], ack 84928, win 126, options [nop,nop,TS val 3790904435 ecr 1814558985], length 0
20:31:40.089595 IP 10.8.3.2.55544 > 99.181.67.72.1935: Flags [.], seq 92946:94260, ack 0, win 501, options [nop,nop,TS val 1814559328 ecr 3790904435], length 1314
20:31:40.150429 IP 10.8.3.2.55544 > 99.181.67.72.1935: Flags [.], seq 94260:95574, ack 0, win 501, options [nop,nop,TS val 1814559389 ecr 3790904435], length 1314
20:31:40.167738 IP 99.181.67.72.1935 > 10.8.3.2.55544: Flags [.], ack 87556, win 126, options [nop,nop,TS val 3790904528 ecr 1814559057], length 0
20:31:40.175155 IP 10.8.3.2.55544 > 99.181.67.72.1935: Flags [.], seq 95574:96888, ack 0, win 501, options [nop,nop,TS val 1814559413 ecr 3790904528], length 1314
20:31:40.217890 IP 10.8.3.2.55544 > 99.181.67.72.1935: Flags [.], seq 96888:98202, ack 0, win 501, options [nop,nop,TS val 1814559456 ecr 3790904528], length 1314
20:31:40.244990 IP 99.181.67.72.1935 > 10.8.3.2.55544: Flags [.], ack 90184, win 126, options [nop,nop,TS val 3790904604 ecr 1814559156], length 0
20:31:40.271228 IP 99.181.67.72.1935 > 10.8.3.2.55544: Flags [.], ack 90318, win 126, options [nop,nop,TS val 3790904630 ecr 1814559217], length 0
20:31:40.271271 IP 10.8.3.2.55544 > 99.181.67.72.1935: Flags [P.], seq 98202:99276, ack 0, win 501, options [nop,nop,TS val 1814559510 ecr 3790904630], length 1074
20:31:40.318139 IP 10.8.3.2.55544 > 99.181.67.72.1935: Flags [.], seq 99276:100590, ack 0, win 501, options [nop,nop,TS val 1814559556 ecr 3790904630], length 1314
20:31:40.340045 IP 99.181.67.72.1935 > 10.8.3.2.55544: Flags [.], ack 92946, win 126, options [nop,nop,TS val 3790904698 ecr 1814559253], length 0
20:31:40.346679 IP 10.8.3.2.55544 > 99.181.67.72.1935: Flags [.], seq 100590:101904, ack 0, win 501, options [nop,nop,TS val 1814559585 ecr 3790904698], length 1314
20:31:40.389494 IP 10.8.3.2.55544 > 99.181.67.72.1935: Flags [.], seq 101904:103218, ack 0, win 501, options [nop,nop,TS val 1814559628 ecr 3790904698], length 1314
20:31:40.442557 IP 99.181.67.72.1935 > 10.8.3.2.55544: Flags [.], ack 95574, win 126, options [nop,nop,TS val 3790904802 ecr 1814559328], length 0
20:31:40.451841 IP 10.8.3.2.55544 > 99.181.67.72.1935: Flags [.], seq 103218:104532, ack 0, win 501, options [nop,nop,TS val 1814559690 ecr 3790904802], length 1314
20:31:40.485108 IP 10.8.3.2.55544 > 99.181.67.72.1935: Flags [.], seq 104532:105846, ack 0, win 501, options [nop,nop,TS val 1814559723 ecr 3790904802], length 1314
20:31:40.510055 IP 99.181.67.72.1935 > 10.8.3.2.55544: Flags [.], ack 98202, win 126, options [nop,nop,TS val 3790904870 ecr 1814559413], length 0
20:31:40.518577 IP 10.8.3.2.55544 > 99.181.67.72.1935: Flags [.], seq 105846:107160, ack 0, win 501, options [nop,nop,TS val 1814559757 ecr 3790904870], length 1314
20:31:40.563444 IP 99.181.67.72.1935 > 10.8.3.2.55544: Flags [.], ack 99276, win 126, options [nop,nop,TS val 3790904923 ecr 1814559510], length 0
20:31:40.563473 IP 10.8.3.2.55544 > 99.181.67.72.1935: Flags [P.], seq 107160:108224, ack 0, win 501, options [nop,nop,TS val 1814559802 ecr 3790904923], length 1064
20:31:40.618601 IP 10.8.3.2.55544 > 99.181.67.72.1935: Flags [.], seq 108224:109538, ack 0, win 501, options [nop,nop,TS val 1814559857 ecr 3790904923], length 1314
20:31:40.638975 IP 99.181.67.72.1935 > 10.8.3.2.55544: Flags [.], ack 101904, win 126, options [nop,nop,TS val 3790904999 ecr 1814559556], length 0
20:31:40.646646 IP 10.8.3.2.55544 > 99.181.67.72.1935: Flags [.], seq 109538:110852, ack 0, win 501, options [nop,nop,TS val 1814559885 ecr 3790904999], length 1314
20:31:40.689556 IP 10.8.3.2.55544 > 99.181.67.72.1935: Flags [.], seq 110852:112166, ack 0, win 501, options [nop,nop,TS val 1814559928 ecr 3790904999], length 1314
20:31:40.743931 IP 99.181.67.72.1935 > 10.8.3.2.55544: Flags [.], ack 104532, win 126, options [nop,nop,TS val 3790905104 ecr 1814559628], length 0
20:31:40.752093 IP 10.8.3.2.55544 > 99.181.67.72.1935: Flags [.], seq 112166:113480, ack 0, win 501, options [nop,nop,TS val 1814559990 ecr 3790905104], length 1314
20:31:40.783474 IP 10.8.3.2.55544 > 99.181.67.72.1935: Flags [.], seq 113480:114794, ack 0, win 501, options [nop,nop,TS val 1814560022 ecr 3790905104], length 1314
20:31:40.810949 IP 99.181.67.72.1935 > 10.8.3.2.55544: Flags [.], ack 107160, win 126, options [nop,nop,TS val 3790905171 ecr 1814559723], length 0
20:31:40.818052 IP 10.8.3.2.55544 > 99.181.67.72.1935: Flags [.], seq 114794:116108, ack 0, win 501, options [nop,nop,TS val 1814560056 ecr 3790905171], length 1314
20:31:40.856179 IP 99.181.67.72.1935 > 10.8.3.2.55544: Flags [.], ack 108224, win 126, options [nop,nop,TS val 3790905215 ecr 1814559802], length 0
20:31:40.856212 IP 10.8.3.2.55544 > 99.181.67.72.1935: Flags [P.], seq 116108:117090, ack 0, win 501, options [nop,nop,TS val 1814560095 ecr 3790905215], length 982
20:31:40.917889 IP 10.8.3.2.55544 > 99.181.67.72.1935: Flags [.], seq 117090:118404, ack 0, win 501, options [nop,nop,TS val 1814560156 ecr 3790905215], length 1314
20:31:40.940046 IP 99.181.67.72.1935 > 10.8.3.2.55544: Flags [.], ack 110852, win 126, options [nop,nop,TS val 3790905298 ecr 1814559857], length 0
20:31:40.946775 IP 10.8.3.2.55544 > 99.181.67.72.1935: Flags [.], seq 118404:119718, ack 0, win 501, options [nop,nop,TS val 1814560185 ecr 3790905298], length 1314
20:31:40.982528 IP 10.8.3.2.55544 > 99.181.67.72.1935: Flags [.], seq 119718:121032, ack 0, win 501, options [nop,nop,TS val 1814560221 ecr 3790905298], length 1314
20:31:41.044208 IP 99.181.67.72.1935 > 10.8.3.2.55544: Flags [.], ack 113480, win 126, options [nop,nop,TS val 3790905404 ecr 1814559928], length 0
20:31:41.050793 IP 10.8.3.2.55544 > 99.181.67.72.1935: Flags [.], seq 121032:122346, ack 0, win 501, options [nop,nop,TS val 1814560289 ecr 3790905404], length 1314
20:31:41.085128 IP 10.8.3.2.55544 > 99.181.67.72.1935: Flags [.], seq 122346:123660, ack 0, win 501, options [nop,nop,TS val 1814560323 ecr 3790905404], length 1314
20:31:41.110211 IP 99.181.67.72.1935 > 10.8.3.2.55544: Flags [.], ack 116108, win 126, options [nop,nop,TS val 3790905470 ecr 1814560022], length 0
20:31:41.117776 IP 10.8.3.2.55544 > 99.181.67.72.1935: Flags [.], seq 123660:124974, ack 0, win 501, options [nop,nop,TS val 1814560356 ecr 3790905470], length 1314
20:31:41.148432 IP 99.181.67.72.1935 > 10.8.3.2.55544: Flags [.], ack 117090, win 126, options [nop,nop,TS val 3790905508 ecr 1814560095], length 0
20:31:41.148475 IP 10.8.3.2.55544 > 99.181.67.72.1935: Flags [P.], seq 124974:125191, ack 0, win 501, options [nop,nop,TS val 1814560387 ecr 3790905508], length 217
20:31:41.182116 IP 10.8.3.2.55544 > 99.181.67.72.1935: Flags [.], seq 125191:126505, ack 0, win 501, options [nop,nop,TS val 1814560420 ecr 3790905508], length 1314
20:31:41.219038 IP 10.8.3.2.55544 > 99.181.67.72.1935: Flags [.], seq 126505:127819, ack 0, win 501, options [nop,nop,TS val 1814560457 ecr 3790905508], length 1314
20:31:41.239002 IP 99.181.67.72.1935 > 10.8.3.2.55544: Flags [.], ack 119718, win 126, options [nop,nop,TS val 3790905599 ecr 1814560156], length 0
20:31:41.267712 IP 10.8.3.2.55544 > 99.181.67.72.1935: Flags [.], seq 127819:129133, ack 0, win 501, options [nop,nop,TS val 1814560506 ecr 3790905599], length 1314
20:31:41.317436 IP 10.8.3.2.55544 > 99.181.67.72.1935: Flags [.], seq 129133:130447, ack 0, win 501, options [nop,nop,TS val 1814560556 ecr 3790905599], length 1314
20:31:41.343187 IP 99.181.67.72.1935 > 10.8.3.2.55544: Flags [.], ack 122346, win 126, options [nop,nop,TS val 3790905703 ecr 1814560221], length 0
20:31:41.351819 IP 10.8.3.2.55544 > 99.181.67.72.1935: Flags [.], seq 130447:131761, ack 0, win 501, options [nop,nop,TS val 1814560590 ecr 3790905703], length 1314
20:31:41.396100 IP 10.8.3.2.55544 > 99.181.67.72.1935: Flags [.], seq 131761:133075, ack 0, win 501, options [nop,nop,TS val 1814560634 ecr 3790905703], length 1314
20:31:41.410061 IP 99.181.67.72.1935 > 10.8.3.2.55544: Flags [.], ack 124974, win 126, options [nop,nop,TS val 3790905770 ecr 1814560323], length 0
20:31:41.440686 IP 99.181.67.72.1935 > 10.8.3.2.55544: Flags [.], ack 125191, win 126, options [nop,nop,TS val 3790905800 ecr 1814560387], length 0
20:31:41.440715 IP 10.8.3.2.55544 > 99.181.67.72.1935: Flags [P.], seq 133075:134144, ack 0, win 501, options [nop,nop,TS val 1814560679 ecr 3790905800], length 1069
20:31:41.481788 IP 10.8.3.2.55544 > 99.181.67.72.1935: Flags [.], seq 134144:135458, ack 0, win 501, options [nop,nop,TS val 1814560720 ecr 3790905800], length 1314
20:31:41.511556 IP 99.181.67.72.1935 > 10.8.3.2.55544: Flags [.], ack 127819, win 126, options [nop,nop,TS val 3790905871 ecr 1814560420], length 0
20:31:41.516102 IP 10.8.3.2.55544 > 99.181.67.72.1935: Flags [.], seq 135458:136772, ack 0, win 501, options [nop,nop,TS val 1814560754 ecr 3790905871], length 1314
20:31:41.566738 IP 10.8.3.2.55544 > 99.181.67.72.1935: Flags [.], seq 136772:138086, ack 0, win 501, options [nop,nop,TS val 1814560805 ecr 3790905871], length 1314
20:31:41.609548 IP 99.181.67.72.1935 > 10.8.3.2.55544: Flags [.], ack 130447, win 126, options [nop,nop,TS val 3790905969 ecr 1814560506], length 0
20:31:41.616848 IP 10.8.3.2.55544 > 99.181.67.72.1935: Flags [.], seq 138086:139400, ack 0, win 501, options [nop,nop,TS val 1814560855 ecr 3790905969], length 1314
20:31:41.652155 IP 10.8.3.2.55544 > 99.181.67.72.1935: Flags [.], seq 139400:140714, ack 0, win 501, options [nop,nop,TS val 1814560890 ecr 3790905969], length 1314
20:31:41.689168 IP 99.181.67.72.1935 > 10.8.3.2.55544: Flags [.], ack 133075, win 126, options [nop,nop,TS val 3790906048 ecr 1814560590], length 0
20:31:41.694854 IP 10.8.3.2.55544 > 99.181.67.72.1935: Flags [.], seq 140714:142028, ack 0, win 501, options [nop,nop,TS val 1814560933 ecr 3790906048], length 1314
20:31:41.733224 IP 99.181.67.72.1935 > 10.8.3.2.55544: Flags [.], ack 134144, win 126, options [nop,nop,TS val 3790906093 ecr 1814560679], length 0
20:31:41.733253 IP 10.8.3.2.55544 > 99.181.67.72.1935: Flags [P.], seq 142028:143009, ack 0, win 501, options [nop,nop,TS val 1814560972 ecr 3790906093], length 981
20:31:41.780713 IP 10.8.3.2.55544 > 99.181.67.72.1935: Flags [.], seq 143009:144323, ack 0, win 501, options [nop,nop,TS val 1814561019 ecr 3790906093], length 1314
20:31:41.809654 IP 99.181.67.72.1935 > 10.8.3.2.55544: Flags [.], ack 136772, win 126, options [nop,nop,TS val 3790906168 ecr 1814560720], length 0
20:31:41.819088 IP 10.8.3.2.55544 > 99.181.67.72.1935: Flags [.], seq 144323:145637, ack 0, win 501, options [nop,nop,TS val 1814561057 ecr 3790906168], length 1314
20:31:41.849685 IP 10.8.3.2.55544 > 99.181.67.72.1935: Flags [.], seq 145637:146951, ack 0, win 501, options [nop,nop,TS val 1814561088 ecr 3790906168], length 1314
20:31:41.909092 IP 99.181.67.72.1935 > 10.8.3.2.55544: Flags [.], ack 139400, win 126, options [nop,nop,TS val 3790906269 ecr 1814560805], length 0
20:31:41.918944 IP 10.8.3.2.55544 > 99.181.67.72.1935: Flags [.], seq 146951:148265, ack 0, win 501, options [nop,nop,TS val 1814561157 ecr 3790906269], length 1314
20:31:41.952076 IP 10.8.3.2.55544 > 99.181.67.72.1935: Flags [.], seq 148265:149579, ack 0, win 501, options [nop,nop,TS val 1814561190 ecr 3790906269], length 1314
20:31:41.985371 IP 10.8.3.2.55544 > 99.181.67.72.1935: Flags [.], seq 149579:150893, ack 0, win 501, options [nop,nop,TS val 1814561224 ecr 3790906269], length 1314
20:31:41.987019 IP 99.181.67.72.1935 > 10.8.3.2.55544: Flags [.], ack 142028, win 126, options [nop,nop,TS val 3790906347 ecr 1814560890], length 0
20:31:42.025151 IP 99.181.67.72.1935 > 10.8.3.2.55544: Flags [.], ack 143009, win 126, options [nop,nop,TS val 3790906385 ecr 1814560972], length 0
20:31:42.025175 IP 10.8.3.2.55544 > 99.181.67.72.1935: Flags [P.], seq 150893:151958, ack 0, win 501, options [nop,nop,TS val 1814561263 ecr 3790906385], length 1065
20:31:42.085722 IP 10.8.3.2.55544 > 99.181.67.72.1935: Flags [.], seq 151958:153272, ack 0, win 501, options [nop,nop,TS val 1814561324 ecr 3790906385], length 1314
20:31:42.111221 IP 99.181.67.72.1935 > 10.8.3.2.55544: Flags [.], ack 145637, win 126, options [nop,nop,TS val 3790906471 ecr 1814561019], length 0
20:31:42.118935 IP 10.8.3.2.55544 > 99.181.67.72.1935: Flags [.], seq 153272:154586, ack 0, win 501, options [nop,nop,TS val 1814561357 ecr 3790906471], length 1314
20:31:42.149653 IP 10.8.3.2.55544 > 99.181.67.72.1935: Flags [.], seq 154586:155900, ack 0, win 501, options [nop,nop,TS val 1814561388 ecr 3790906471], length 1314
20:31:42.211175 IP 99.181.67.72.1935 > 10.8.3.2.55544: Flags [.], ack 148265, win 126, options [nop,nop,TS val 3790906571 ecr 1814561088], length 0
20:31:42.218930 IP 10.8.3.2.55544 > 99.181.67.72.1935: Flags [.], seq 155900:157214, ack 0, win 501, options [nop,nop,TS val 1814561457 ecr 3790906571], length 1314
20:31:42.252058 IP 10.8.3.2.55544 > 99.181.67.72.1935: Flags [.], seq 157214:158528, ack 0, win 501, options [nop,nop,TS val 1814561490 ecr 3790906571], length 1314
20:31:42.277956 IP 99.181.67.72.1935 > 10.8.3.2.55544: Flags [.], ack 150893, win 126, options [nop,nop,TS val 3790906637 ecr 1814561190], length 0
20:31:42.283003 IP 10.8.3.2.55544 > 99.181.67.72.1935: Flags [.], seq 158528:159842, ack 0, win 501, options [nop,nop,TS val 1814561521 ecr 3790906637], length 1314
20:31:42.317552 IP 99.181.67.72.1935 > 10.8.3.2.55544: Flags [.], ack 151958, win 126, options [nop,nop,TS val 3790906677 ecr 1814561263], length 0
20:31:42.317582 IP 10.8.3.2.55544 > 99.181.67.72.1935: Flags [P.], seq 159842:160916, ack 0, win 501, options [nop,nop,TS val 1814561556 ecr 3790906677], length 1074
20:31:42.384015 IP 10.8.3.2.55544 > 99.181.67.72.1935: Flags [.], seq 160916:162230, ack 0, win 501, options [nop,nop,TS val 1814561622 ecr 3790906677], length 1314
20:31:42.411379 IP 99.181.67.72.1935 > 10.8.3.2.55544: Flags [.], ack 154586, win 126, options [nop,nop,TS val 3790906771 ecr 1814561324], length 0
20:31:42.417252 IP 10.8.3.2.55544 > 99.181.67.72.1935: Flags [.], seq 162230:163544, ack 0, win 501, options [nop,nop,TS val 1814561656 ecr 3790906771], length 1314
20:31:42.451545 IP 10.8.3.2.55544 > 99.181.67.72.1935: Flags [.], seq 163544:164858, ack 0, win 501, options [nop,nop,TS val 1814561690 ecr 3790906771], length 1314
20:31:42.512224 IP 99.181.67.72.1935 > 10.8.3.2.55544: Flags [.], ack 157214, win 126, options [nop,nop,TS val 3790906871 ecr 1814561388], length 0
20:31:42.518393 IP 10.8.3.2.55544 > 99.181.67.72.1935: Flags [.], seq 164858:166172, ack 0, win 501, options [nop,nop,TS val 1814561757 ecr 3790906871], length 1314
20:31:42.551625 IP 10.8.3.2.55544 > 99.181.67.72.1935: Flags [.], seq 166172:167486, ack 0, win 501, options [nop,nop,TS val 1814561790 ecr 3790906871], length 1314
20:31:42.575472 IP 99.181.67.72.1935 > 10.8.3.2.55544: Flags [.], ack 159842, win 126, options [nop,nop,TS val 3790906935 ecr 1814561490], length 0
20:31:42.584994 IP 10.8.3.2.55544 > 99.181.67.72.1935: Flags [.], seq 167486:168800, ack 0, win 501, options [nop,nop,TS val 1814561823 ecr 3790906935], length 1314
20:31:42.611028 IP 99.181.67.72.1935 > 10.8.3.2.55544: Flags [.], ack 160916, win 126, options [nop,nop,TS val 3790906970 ecr 1814561556], length 0
20:31:42.611059 IP 10.8.3.2.55544 > 99.181.67.72.1935: Flags [P.], seq 168800:168933, ack 0, win 501, options [nop,nop,TS val 1814561849 ecr 3790906970], length 133
20:31:42.651656 IP 10.8.3.2.55544 > 99.181.67.72.1935: Flags [.], seq 168933:170247, ack 0, win 501, options [nop,nop,TS val 1814561890 ecr 3790906970], length 1314
20:31:42.685038 IP 10.8.3.2.55544 > 99.181.67.72.1935: Flags [.], seq 170247:171561, ack 0, win 501, options [nop,nop,TS val 1814561923 ecr 3790906970], length 1314
20:31:42.709519 IP 99.181.67.72.1935 > 10.8.3.2.55544: Flags [.], ack 163544, win 126, options [nop,nop,TS val 3790907069 ecr 1814561622], length 0
20:31:42.723313 IP 10.8.3.2.55544 > 99.181.67.72.1935: Flags [.], seq 171561:172875, ack 0, win 501, options [nop,nop,TS val 1814561962 ecr 3790907069], length 1314
20:31:42.784959 IP 10.8.3.2.55544 > 99.181.67.72.1935: Flags [.], seq 172875:174189, ack 0, win 501, options [nop,nop,TS val 1814562023 ecr 3790907069], length 1314
20:31:42.810487 IP 99.181.67.72.1935 > 10.8.3.2.55544: Flags [.], ack 166172, win 126, options [nop,nop,TS val 3790907170 ecr 1814561690], length 0
20:31:42.818431 IP 10.8.3.2.55544 > 99.181.67.72.1935: Flags [.], seq 174189:175503, ack 0, win 501, options [nop,nop,TS val 1814562057 ecr 3790907170], length 1314
20:31:42.851850 IP 10.8.3.2.55544 > 99.181.67.72.1935: Flags [.], seq 175503:176817, ack 0, win 501, options [nop,nop,TS val 1814562090 ecr 3790907170], length 1314
20:31:42.877091 IP 99.181.67.72.1935 > 10.8.3.2.55544: Flags [.], ack 168800, win 126, options [nop,nop,TS val 3790907237 ecr 1814561790], length 0
20:31:42.903055 IP 99.181.67.72.1935 > 10.8.3.2.55544: Flags [.], ack 168933, win 126, options [nop,nop,TS val 3790907263 ecr 1814561849], length 0
20:31:42.903091 IP 10.8.3.2.55544 > 99.181.67.72.1935: Flags [P.], seq 176817:177874, ack 0, win 501, options [nop,nop,TS val 1814562141 ecr 3790907263], length 1057
20:31:42.937600 IP 10.8.3.2.55544 > 99.181.67.72.1935: Flags [.], seq 177874:179188, ack 0, win 501, options [nop,nop,TS val 1814562176 ecr 3790907263], length 1314
20:31:42.977979 IP 99.181.67.72.1935 > 10.8.3.2.55544: Flags [.], ack 171561, win 126, options [nop,nop,TS val 3790907337 ecr 1814561890], length 0
20:31:42.980321 IP 10.8.3.2.55544 > 99.181.67.72.1935: Flags [.], seq 179188:180502, ack 0, win 501, options [nop,nop,TS val 1814562219 ecr 3790907337], length 1314
20:31:43.017925 IP 10.8.3.2.55544 > 99.181.67.72.1935: Flags [.], seq 180502:181816, ack 0, win 501, options [nop,nop,TS val 1814562256 ecr 3790907337], length 1314
20:31:43.065900 IP 10.8.3.2.55544 > 99.181.67.72.1935: Flags [.], seq 181816:183130, ack 0, win 501, options [nop,nop,TS val 1814562304 ecr 3790907337], length 1314
20:31:43.078293 IP 99.181.67.72.1935 > 10.8.3.2.55544: Flags [.], ack 174189, win 126, options [nop,nop,TS val 3790907437 ecr 1814561962], length 0
20:31:43.108666 IP 10.8.3.2.55544 > 99.181.67.72.1935: Flags [.], seq 183130:184444, ack 0, win 501, options [nop,nop,TS val 1814562347 ecr 3790907437], length 1314
20:31:43.144295 IP 99.181.67.72.1935 > 10.8.3.2.55544: Flags [.], ack 176817, win 126, options [nop,nop,TS val 3790907504 ecr 1814562057], length 0
20:31:43.151438 IP 10.8.3.2.55544 > 99.181.67.72.1935: Flags [.], seq 184444:185758, ack 0, win 501, options [nop,nop,TS val 1814562390 ecr 3790907504], length 1314
20:31:43.195527 IP 99.181.67.72.1935 > 10.8.3.2.55544: Flags [.], ack 177874, win 126, options [nop,nop,TS val 3790907555 ecr 1814562141], length 0
20:31:43.195562 IP 10.8.3.2.55544 > 99.181.67.72.1935: Flags [P.], seq 185758:186930, ack 0, win 501, options [nop,nop,TS val 1814562434 ecr 3790907555], length 1172
20:31:43.237383 IP 10.8.3.2.55544 > 99.181.67.72.1935: Flags [.], seq 186930:188244, ack 0, win 501, options [nop,nop,TS val 1814562476 ecr 3790907555], length 1314
20:31:43.280309 IP 10.8.3.2.55544 > 99.181.67.72.1935: Flags [.], seq 188244:189558, ack 0, win 501, options [nop,nop,TS val 1814562519 ecr 3790907555], length 1314
20:31:43.322840 IP 10.8.3.2.55544 > 99.181.67.72.1935: Flags [.], seq 189558:190872, ack 0, win 501, options [nop,nop,TS val 1814562561 ecr 3790907555], length 1314
20:31:43.359212 IP 99.181.67.72.1935 > 10.8.3.2.55544: Flags [.], ack 183130, win 126, options [nop,nop,TS val 3790907718 ecr 1814562256], length 0
20:31:43.365490 IP 10.8.3.2.55544 > 99.181.67.72.1935: Flags [.], seq 190872:192186, ack 0, win 501, options [nop,nop,TS val 1814562604 ecr 3790907718], length 1314
20:31:43.408399 IP 10.8.3.2.55544 > 99.181.67.72.1935: Flags [.], seq 192186:193500, ack 0, win 501, options [nop,nop,TS val 1814562647 ecr 3790907718], length 1314
20:31:43.443545 IP 99.181.67.72.1935 > 10.8.3.2.55544: Flags [.], ack 185758, win 126, options [nop,nop,TS val 3790907803 ecr 1814562347], length 0
20:31:43.452290 IP 10.8.3.2.55544 > 99.181.67.72.1935: Flags [.], seq 193500:194814, ack 0, win 501, options [nop,nop,TS val 1814562691 ecr 3790907803], length 1314
20:31:43.487698 IP 99.181.67.72.1935 > 10.8.3.2.55544: Flags [.], ack 186930, win 126, options [nop,nop,TS val 3790907848 ecr 1814562434], length 0
20:31:43.487737 IP 10.8.3.2.55544 > 99.181.67.72.1935: Flags [P.], seq 194814:195791, ack 0, win 501, options [nop,nop,TS val 1814562726 ecr 3790907848], length 977
20:31:43.537236 IP 10.8.3.2.55544 > 99.181.67.72.1935: Flags [.], seq 195791:197105, ack 0, win 501, options [nop,nop,TS val 1814562776 ecr 3790907848], length 1314
20:31:43.572875 IP 99.181.67.72.1935 > 10.8.3.2.55544: Flags [.], ack 189558, win 126, options [nop,nop,TS val 3790907933 ecr 1814562476], length 0
20:31:43.579582 IP 10.8.3.2.55544 > 99.181.67.72.1935: Flags [.], seq 197105:198419, ack 0, win 501, options [nop,nop,TS val 1814562818 ecr 3790907933], length 1314
20:31:43.615331 IP 10.8.3.2.55544 > 99.181.67.72.1935: Flags [.], seq 198419:199733, ack 0, win 501, options [nop,nop,TS val 1814562854 ecr 3790907933], length 1314
20:31:43.657661 IP 99.181.67.72.1935 > 10.8.3.2.55544: Flags [.], ack 192186, win 126, options [nop,nop,TS val 3790908018 ecr 1814562561], length 0
20:31:43.685827 IP 10.8.3.2.55544 > 99.181.67.72.1935: Flags [.], seq 199733:201047, ack 0, win 501, options [nop,nop,TS val 1814562924 ecr 3790908018], length 1314
20:31:43.708041 IP 10.8.3.2.55544 > 99.181.67.72.1935: Flags [.], seq 201047:202361, ack 0, win 501, options [nop,nop,TS val 1814562946 ecr 3790908018], length 1314
20:31:43.744454 IP 99.181.67.72.1935 > 10.8.3.2.55544: Flags [.], ack 194814, win 126, options [nop,nop,TS val 3790908104 ecr 1814562647], length 0
20:31:43.750957 IP 10.8.3.2.55544 > 99.181.67.72.1935: Flags [.], seq 202361:203675, ack 0, win 501, options [nop,nop,TS val 1814562989 ecr 3790908104], length 1314
20:31:43.779966 IP 99.181.67.72.1935 > 10.8.3.2.55544: Flags [.], ack 195791, win 126, options [nop,nop,TS val 3790908140 ecr 1814562726], length 0
20:31:43.780004 IP 10.8.3.2.55544 > 99.181.67.72.1935: Flags [P.], seq 203675:204644, ack 0, win 501, options [nop,nop,TS val 1814563018 ecr 3790908140], length 969
20:31:43.836849 IP 10.8.3.2.55544 > 99.181.67.72.1935: Flags [.], seq 204644:205958, ack 0, win 501, options [nop,nop,TS val 1814563075 ecr 3790908140], length 1314
20:31:43.871857 IP 99.181.67.72.1935 > 10.8.3.2.55544: Flags [.], ack 198419, win 126, options [nop,nop,TS val 3790908232 ecr 1814562776], length 0
20:31:43.879651 IP 10.8.3.2.55544 > 99.181.67.72.1935: Flags [.], seq 205958:207272, ack 0, win 501, options [nop,nop,TS val 1814563118 ecr 3790908232], length 1314
20:31:43.901014 IP 10.8.3.2.55544 > 99.181.67.72.1935: Flags [.], seq 207272:208586, ack 0, win 501, options [nop,nop,TS val 1814563139 ecr 3790908232], length 1314
20:31:43.978125 IP 99.181.67.72.1935 > 10.8.3.2.55544: Flags [.], ack 201047, win 126, options [nop,nop,TS val 3790908338 ecr 1814562854], length 0
