02:03:27.789013 IP 10.8.0.3.37202 > 99.181.97.22.1935: Flags [.], seq 144551344:144552658, ack 1016886663, win 501, options [nop,nop,TS val 1578681129 ecr 3355358990], length 1314
02:03:27.827002 IP 10.8.0.3.37202 > 99.181.97.22.1935: Flags [.], seq 1314:2628, ack 1, win 501, options [nop,nop,TS val 1578681167 ecr 3355358990], length 1314
02:03:27.833059 IP 99.181.97.22.1935 > 10.8.0.3.37202: Flags [.], ack 4294963354, win 126, options [nop,nop,TS val 3355359055 ecr 1578680902], length 0
02:03:27.833081 IP 10.8.0.3.37202 > 99.181.97.22.1935: Flags [P.], seq 2628:3117, ack 1, win 501, options [nop,nop,TS val 1578681173 ecr 3355359055], length 489
02:03:27.893930 IP 10.8.0.3.37202 > 99.181.97.22.1935: Flags [.], seq 3117:4431, ack 1, win 501, options [nop,nop,TS val 1578681234 ecr 3355359055], length 1314
02:03:27.929904 IP 10.8.0.3.37202 > 99.181.97.22.1935: Flags [.], seq 4431:5745, ack 1, win 501, options [nop,nop,TS val 1578681270 ecr 3355359055], length 1314
02:03:27.936689 IP 99.181.97.22.1935 > 10.8.0.3.37202: Flags [.], ack 4294965982, win 126, options [nop,nop,TS val 3355359158 ecr 1578681000], length 0
02:03:27.963152 IP 10.8.0.3.37202 > 99.181.97.22.1935: Flags [.], seq 5745:7059, ack 1, win 501, options [nop,nop,TS val 1578681303 ecr 3355359158], length 1314
02:03:28.023348 IP 10.8.0.3.37202 > 99.181.97.22.1935: Flags [.], seq 7059:8373, ack 1, win 501, options [nop,nop,TS val 1578681364 ecr 3355359158], length 1314
02:03:28.031912 IP 99.181.97.22.1935 > 10.8.0.3.37202: Flags [.], ack 1314, win 126, options [nop,nop,TS val 3355359250 ecr 1578681065], length 0
02:03:28.059664 IP 10.8.0.3.37202 > 99.181.97.22.1935: Flags [.], seq 8373:9687, ack 1, win 501, options [nop,nop,TS val 1578681400 ecr 3355359250], length 1314
02:03:28.072647 IP 99.181.97.22.1935 > 10.8.0.3.37202: Flags [.], ack 3117, win 126, options [nop,nop,TS val 3355359294 ecr 1578681167], length 0
02:03:28.072670 IP 10.8.0.3.37202 > 99.181.97.22.1935: Flags [P.], seq 9687:10098, ack 1, win 501, options [nop,nop,TS val 1578681413 ecr 3355359294], length 411
02:03:28.129724 IP 10.8.0.3.37202 > 99.181.97.22.1935: Flags [.], seq 10098:11412, ack 1, win 501, options [nop,nop,TS val 1578681470 ecr 3355359294], length 1314
02:03:28.163506 IP 10.8.0.3.37202 > 99.181.97.22.1935: Flags [.], seq 11412:12726, ack 1, win 501, options [nop,nop,TS val 1578681504 ecr 3355359294], length 1314
02:03:28.169658 IP 99.181.97.22.1935 > 10.8.0.3.37202: Flags [.], ack 5745, win 126, options [nop,nop,TS val 3355359391 ecr 1578681234], length 0
02:03:28.196433 IP 10.8.0.3.37202 > 99.181.97.22.1935: Flags [.], seq 12726:14040, ack 1, win 501, options [nop,nop,TS val 1578681537 ecr 3355359391], length 1314
02:03:28.259407 IP 10.8.0.3.37202 > 99.181.97.22.1935: Flags [.], seq 14040:15354, ack 1, win 501, options [nop,nop,TS val 1578681600 ecr 3355359391], length 1314
02:03:28.263298 IP 99.181.97.22.1935 > 10.8.0.3.37202: Flags [.], ack 8373, win 126, options [nop,nop,TS val 3355359485 ecr 1578681303], length 0
02:03:28.293638 IP 10.8.0.3.37202 > 99.181.97.22.1935: Flags [.], seq 15354:16668, ack 1, win 501, options [nop,nop,TS val 1578681634 ecr 3355359485], length 1314
02:03:28.312434 IP 99.181.97.22.1935 > 10.8.0.3.37202: Flags [.], ack 10098, win 126, options [nop,nop,TS val 3355359534 ecr 1578681400], length 0
02:03:28.312447 IP 10.8.0.3.37202 > 99.181.97.22.1935: Flags [P.], seq 16668:17078, ack 1, win 501, options [nop,nop,TS val 1578681653 ecr 3355359534], length 410
02:03:28.360845 IP 10.8.0.3.37202 > 99.181.97.22.1935: Flags [.], seq 17078:18392, ack 1, win 501, options [nop,nop,TS val 1578681701 ecr 3355359534], length 1314
02:03:28.393596 IP 10.8.0.3.37202 > 99.181.97.22.1935: Flags [.], seq 18392:19706, ack 1, win 501, options [nop,nop,TS val 1578681734 ecr 3355359534], length 1314
02:03:28.403832 IP 99.181.97.22.1935 > 10.8.0.3.37202: Flags [.], ack 12726, win 126, options [nop,nop,TS val 3355359625 ecr 1578681470], length 0
02:03:28.429261 IP 10.8.0.3.37202 > 99.181.97.22.1935: Flags [.], seq 19706:21020, ack 1, win 501, options [nop,nop,TS val 1578681770 ecr 3355359625], length 1314
02:03:28.493530 IP 10.8.0.3.37202 > 99.181.97.22.1935: Flags [.], seq 21020:22334, ack 1, win 501, options [nop,nop,TS val 1578681834 ecr 3355359625], length 1314
02:03:28.500301 IP 99.181.97.22.1935 > 10.8.0.3.37202: Flags [.], ack 15354, win 126, options [nop,nop,TS val 3355359721 ecr 1578681537], length 0
02:03:28.529906 IP 10.8.0.3.37202 > 99.181.97.22.1935: Flags [.], seq 22334:23648, ack 1, win 501, options [nop,nop,TS val 1578681870 ecr 3355359721], length 1314
02:03:28.552457 IP 99.181.97.22.1935 > 10.8.0.3.37202: Flags [.], ack 17078, win 126, options [nop,nop,TS val 3355359774 ecr 1578681634], length 0
02:03:28.552492 IP 10.8.0.3.37202 > 99.181.97.22.1935: Flags [P.], seq 23648:24046, ack 1, win 501, options [nop,nop,TS val 1578681893 ecr 3355359774], length 398
02:03:28.596577 IP 10.8.0.3.37202 > 99.181.97.22.1935: Flags [.], seq 24046:25360, ack 1, win 501, options [nop,nop,TS val 1578681937 ecr 3355359774], length 1314
02:03:28.627397 IP 10.8.0.3.37202 > 99.181.97.22.1935: Flags [.], seq 25360:26674, ack 1, win 501, options [nop,nop,TS val 1578681968 ecr 3355359774], length 1314
02:03:28.634139 IP 99.181.97.22.1935 > 10.8.0.3.37202: Flags [.], ack 19706, win 126, options [nop,nop,TS val 3355359855 ecr 1578681701], length 0
02:03:28.664466 IP 10.8.0.3.37202 > 99.181.97.22.1935: Flags [.], seq 26674:27988, ack 1, win 501, options [nop,nop,TS val 1578682005 ecr 3355359855], length 1314
02:03:28.727934 IP 10.8.0.3.37202 > 99.181.97.22.1935: Flags [.], seq 27988:29302, ack 1, win 501, options [nop,nop,TS val 1578682068 ecr 3355359855], length 1314
02:03:28.733391 IP 99.181.97.22.1935 > 10.8.0.3.37202: Flags [.], ack 22334, win 126, options [nop,nop,TS val 3355359955 ecr 1578681770], length 0
02:03:28.763245 IP 10.8.0.3.37202 > 99.181.97.22.1935: Flags [.], seq 29302:30616, ack 1, win 501, options [nop,nop,TS val 1578682104 ecr 3355359955], length 1314
02:03:28.792581 IP 10.8.0.3.37202 > 99.181.97.22.1935: Flags [.], seq 30616:31930, ack 1, win 501, options [nop,nop,TS val 1578682133 ecr 3355359955], length 1314
02:03:28.796774 IP 99.181.97.22.1935 > 10.8.0.3.37202: Flags [.], ack 24046, win 126, options [nop,nop,TS val 3355360017 ecr 1578681870], length 0
02:03:28.796790 IP 10.8.0.3.37202 > 99.181.97.22.1935: Flags [P.], seq 31930:31965, ack 1, win 501, options [nop,nop,TS val 1578682137 ecr 3355360017], length 35
02:03:28.856303 IP 10.8.0.3.37202 > 99.181.97.22.1935: Flags [.], seq 31965:33279, ack 1, win 501, options [nop,nop,TS val 1578682197 ecr 3355360017], length 1314
02:03:28.867872 IP 99.181.97.22.1935 > 10.8.0.3.37202: Flags [.], ack 26674, win 126, options [nop,nop,TS val 3355360089 ecr 1578681937], length 0
02:03:28.895922 IP 10.8.0.3.37202 > 99.181.97.22.1935: Flags [.], seq 33279:34593, ack 1, win 501, options [nop,nop,TS val 1578682236 ecr 3355360089], length 1314
02:03:28.927219 IP 10.8.0.3.37202 > 99.181.97.22.1935: Flags [.], seq 34593:35907, ack 1, win 501, options [nop,nop,TS val 1578682268 ecr 3355360089], length 1314
02:03:28.967785 IP 99.181.97.22.1935 > 10.8.0.3.37202: Flags [.], ack 29302, win 126, options [nop,nop,TS val 3355360189 ecr 1578682005], length 0
02:03:28.997096 IP 10.8.0.3.37202 > 99.181.97.22.1935: Flags [.], seq 35907:37221, ack 1, win 501, options [nop,nop,TS val 1578682337 ecr 3355360189], length 1314
02:03:29.027020 IP 10.8.0.3.37202 > 99.181.97.22.1935: Flags [.], seq 37221:38535, ack 1, win 501, options [nop,nop,TS val 1578682367 ecr 3355360189], length 1314
02:03:29.035642 IP 99.181.97.22.1935 > 10.8.0.3.37202: Flags [.], ack 31930, win 126, options [nop,nop,TS val 3355360257 ecr 1578682104], length 0
02:03:29.036500 IP 99.181.97.22.1935 > 10.8.0.3.37202: Flags [.], ack 31965, win 126, options [nop,nop,TS val 3355360258 ecr 1578682137], length 0
02:03:29.036525 IP 10.8.0.3.37202 > 99.181.97.22.1935: Flags [P.], seq 38535:38944, ack 1, win 501, options [nop,nop,TS val 1578682377 ecr 3355360258], length 409
02:03:29.091179 IP 10.8.0.3.37202 > 99.181.97.22.1935: Flags [.], seq 38944:40258, ack 1, win 501, options [nop,nop,TS val 1578682431 ecr 3355360258], length 1314
02:03:29.129387 IP 10.8.0.3.37202 > 99.181.97.22.1935: Flags [.], seq 40258:41572, ack 1, win 501, options [nop,nop,TS val 1578682470 ecr 3355360258], length 1314
02:03:29.135639 IP 99.181.97.22.1935 > 10.8.0.3.37202: Flags [.], ack 34593, win 126, options [nop,nop,TS val 3355360357 ecr 1578682197], length 0
02:03:29.162931 IP 10.8.0.3.37202 > 99.181.97.22.1935: Flags [.], seq 41572:42886, ack 1, win 501, options [nop,nop,TS val 1578682503 ecr 3355360357], length 1314
02:03:29.229733 IP 10.8.0.3.37202 > 99.181.97.22.1935: Flags [.], seq 42886:44200, ack 1, win 501, options [nop,nop,TS val 1578682570 ecr 3355360357], length 1314
02:03:29.237390 IP 99.181.97.22.1935 > 10.8.0.3.37202: Flags [.], ack 37221, win 126, options [nop,nop,TS val 3355360458 ecr 1578682268], length 0
02:03:29.262743 IP 10.8.0.3.37202 > 99.181.97.22.1935: Flags [.], seq 44200:45514, ack 1, win 501, options [nop,nop,TS val 1578682603 ecr 3355360458], length 1314
02:03:29.276208 IP 99.181.97.22.1935 > 10.8.0.3.37202: Flags [.], ack 38944, win 126, options [nop,nop,TS val 3355360498 ecr 1578682367], length 0
02:03:29.276241 IP 10.8.0.3.37202 > 99.181.97.22.1935: Flags [P.], seq 45514:45917, ack 1, win 501, options [nop,nop,TS val 1578682617 ecr 3355360498], length 403
02:03:29.326559 IP 10.8.0.3.37202 > 99.181.97.22.1935: Flags [.], seq 45917:47231, ack 1, win 501, options [nop,nop,TS val 1578682667 ecr 3355360498], length 1314
02:03:29.360681 IP 10.8.0.3.37202 > 99.181.97.22.1935: Flags [.], seq 47231:48545, ack 1, win 501, options [nop,nop,TS val 1578682701 ecr 3355360498], length 1314
02:03:29.369618 IP 99.181.97.22.1935 > 10.8.0.3.37202: Flags [.], ack 41572, win 126, options [nop,nop,TS val 3355360591 ecr 1578682431], length 0
02:03:29.397107 IP 10.8.0.3.37202 > 99.181.97.22.1935: Flags [.], seq 48545:49859, ack 1, win 501, options [nop,nop,TS val 1578682737 ecr 3355360591], length 1314
02:03:29.463135 IP 10.8.0.3.37202 > 99.181.97.22.1935: Flags [.], seq 49859:51173, ack 1, win 501, options [nop,nop,TS val 1578682803 ecr 3355360591], length 1314
02:03:29.469568 IP 99.181.97.22.1935 > 10.8.0.3.37202: Flags [.], ack 44200, win 126, options [nop,nop,TS val 3355360691 ecr 1578682503], length 0
02:03:29.496275 IP 10.8.0.3.37202 > 99.181.97.22.1935: Flags [.], seq 51173:52487, ack 1, win 501, options [nop,nop,TS val 1578682837 ecr 3355360691], length 1314
02:03:29.516016 IP 99.181.97.22.1935 > 10.8.0.3.37202: Flags [.], ack 45917, win 126, options [nop,nop,TS val 3355360737 ecr 1578682603], length 0
02:03:29.516047 IP 10.8.0.3.37202 > 99.181.97.22.1935: Flags [P.], seq 52487:52885, ack 1, win 501, options [nop,nop,TS val 1578682856 ecr 3355360737], length 398
02:03:29.561962 IP 10.8.0.3.37202 > 99.181.97.22.1935: Flags [.], seq 52885:54199, ack 1, win 501, options [nop,nop,TS val 1578682902 ecr 3355360737], length 1314
02:03:29.597695 IP 10.8.0.3.37202 > 99.181.97.22.1935: Flags [.], seq 54199:55513, ack 1, win 501, options [nop,nop,TS val 1578682938 ecr 3355360737], length 1314
02:03:29.600581 IP 99.181.97.22.1935 > 10.8.0.3.37202: Flags [.], ack 48545, win 126, options [nop,nop,TS val 3355360822 ecr 1578682667], length 0
02:03:29.628682 IP 10.8.0.3.37202 > 99.181.97.22.1935: Flags [.], seq 55513:56827, ack 1, win 501, options [nop,nop,TS val 1578682969 ecr 3355360822], length 1314
02:03:29.696080 IP 10.8.0.3.37202 > 99.181.97.22.1935: Flags [.], seq 56827:58141, ack 1, win 501, options [nop,nop,TS val 1578683036 ecr 3355360822], length 1314
02:03:29.703299 IP 99.181.97.22.1935 > 10.8.0.3.37202: Flags [.], ack 51173, win 126, options [nop,nop,TS val 3355360925 ecr 1578682737], length 0
02:03:29.729433 IP 10.8.0.3.37202 > 99.181.97.22.1935: Flags [.], seq 58141:59455, ack 1, win 501, options [nop,nop,TS val 1578683070 ecr 3355360925], length 1314
02:03:29.755938 IP 99.181.97.22.1935 > 10.8.0.3.37202: Flags [.], ack 52885, win 126, options [nop,nop,TS val 3355360977 ecr 1578682837], length 0
02:03:29.755971 IP 10.8.0.3.37202 > 99.181.97.22.1935: Flags [P.], seq 59455:59960, ack 1, win 501, options [nop,nop,TS val 1578683096 ecr 3355360977], length 505
02:03:29.796151 IP 10.8.0.3.37202 > 99.181.97.22.1935: Flags [.], seq 59960:61274, ack 1, win 501, options [nop,nop,TS val 1578683136 ecr 3355360977], length 1314
02:03:29.829639 IP 10.8.0.3.37202 > 99.181.97.22.1935: Flags [.], seq 61274:62588, ack 1, win 501, options [nop,nop,TS val 1578683170 ecr 3355360977], length 1314
02:03:29.837631 IP 99.181.97.22.1935 > 10.8.0.3.37202: Flags [.], ack 55513, win 126, options [nop,nop,TS val 3355361059 ecr 1578682902], length 0
02:03:29.882714 IP 10.8.0.3.37202 > 99.181.97.22.1935: Flags [.], seq 62588:63902, ack 1, win 501, options [nop,nop,TS val 1578683223 ecr 3355361059], length 1314
02:03:29.925447 IP 10.8.0.3.37202 > 99.181.97.22.1935: Flags [.], seq 63902:65216, ack 1, win 501, options [nop,nop,TS val 1578683266 ecr 3355361059], length 1314
02:03:29.936009 IP 99.181.97.22.1935 > 10.8.0.3.37202: Flags [.], ack 58141, win 126, options [nop,nop,TS val 3355361158 ecr 1578682969], length 0
02:03:29.963345 IP 10.8.0.3.37202 > 99.181.97.22.1935: Flags [.], seq 65216:66530, ack 1, win 501, options [nop,nop,TS val 1578683304 ecr 3355361158], length 1314
02:03:29.995553 IP 99.181.97.22.1935 > 10.8.0.3.37202: Flags [.], ack 59960, win 126, options [nop,nop,TS val 3355361217 ecr 1578683070], length 0
02:03:29.995585 IP 10.8.0.3.37202 > 99.181.97.22.1935: Flags [P.], seq 66530:67784, ack 1, win 501, options [nop,nop,TS val 1578683336 ecr 3355361217], length 1254
02:03:30.061590 IP 10.8.0.3.37202 > 99.181.97.22.1935: Flags [.], seq 67784:69098, ack 1, win 501, options [nop,nop,TS val 1578683402 ecr 3355361217], length 1314
02:03:30.069639 IP 99.181.97.22.1935 > 10.8.0.3.37202: Flags [.], ack 62588, win 126, options [nop,nop,TS val 3355361291 ecr 1578683136], length 0
02:03:30.095920 IP 10.8.0.3.37202 > 99.181.97.22.1935: Flags [.], seq 69098:70412, ack 1, win 501, options [nop,nop,TS val 1578683436 ecr 3355361291], length 1314
02:03:30.129108 IP 10.8.0.3.37202 > 99.181.97.22.1935: Flags [.], seq 70412:71726, ack 1, win 501, options [nop,nop,TS val 1578683469 ecr 3355361291], length 1314
02:03:30.165778 IP 99.181.97.22.1935 > 10.8.0.3.37202: Flags [.], ack 65216, win 126, options [nop,nop,TS val 3355361387 ecr 1578683223], length 0
02:03:30.196665 IP 10.8.0.3.37202 > 99.181.97.22.1935: Flags [.], seq 71726:73040, ack 1, win 501, options [nop,nop,TS val 1578683537 ecr 3355361387], length 1314
02:03:30.230152 IP 10.8.0.3.37202 > 99.181.97.22.1935: Flags [.], seq 73040:74354, ack 1, win 501, options [nop,nop,TS val 1578683570 ecr 3355361387], length 1314
02:03:30.235542 IP 99.181.97.22.1935 > 10.8.0.3.37202: Flags [.], ack 67784, win 126, options [nop,nop,TS val 3355361457 ecr 1578683304], length 0
02:03:30.235586 IP 10.8.0.3.37202 > 99.181.97.22.1935: Flags [P.], seq 74354:74752, ack 1, win 501, options [nop,nop,TS val 1578683576 ecr 3355361457], length 398
02:03:30.294179 IP 10.8.0.3.37202 > 99.181.97.22.1935: Flags [.], seq 74752:76066, ack 1, win 501, options [nop,nop,TS val 1578683634 ecr 3355361457], length 1314
02:03:30.329499 IP 10.8.0.3.37202 > 99.181.97.22.1935: Flags [.], seq 76066:77380, ack 1, win 501, options [nop,nop,TS val 1578683670 ecr 3355361457], length 1314
02:03:30.335809 IP 99.181.97.22.1935 > 10.8.0.3.37202: Flags [.], ack 70412, win 126, options [nop,nop,TS val 3355361557 ecr 1578683402], length 0
02:03:30.363474 IP 10.8.0.3.37202 > 99.181.97.22.1935: Flags [.], seq 77380:78694, ack 1, win 501, options [nop,nop,TS val 1578683704 ecr 3355361557], length 1314
02:03:30.428357 IP 10.8.0.3.37202 > 99.181.97.22.1935: Flags [.], seq 78694:80008, ack 1, win 501, options [nop,nop,TS val 1578683769 ecr 3355361557], length 1314
02:03:30.436960 IP 99.181.97.22.1935 > 10.8.0.3.37202: Flags [.], ack 73040, win 126, options [nop,nop,TS val 3355361658 ecr 1578683469], length 0
02:03:30.461348 IP 10.8.0.3.37202 > 99.181.97.22.1935: Flags [.], seq 80008:81322, ack 1, win 501, options [nop,nop,TS val 1578683802 ecr 3355361658], length 1314
02:03:30.475288 IP 99.181.97.22.1935 > 10.8.0.3.37202: Flags [.], ack 74752, win 126, options [nop,nop,TS val 3355361697 ecr 1578683570], length 0
02:03:30.475324 IP 10.8.0.3.37202 > 99.181.97.22.1935: Flags [P.], seq 81322:81733, ack 1, win 501, options [nop,nop,TS val 1578683816 ecr 3355361697], length 411
02:03:30.529841 IP 10.8.0.3.37202 > 99.181.97.22.1935: Flags [.], seq 81733:83047, ack 1, win 501, options [nop,nop,TS val 1578683870 ecr 3355361697], length 1314
02:03:30.562855 IP 10.8.0.3.37202 > 99.181.97.22.1935: Flags [.], seq 83047:84361, ack 1, win 501, options [nop,nop,TS val 1578683903 ecr 3355361697], length 1314
02:03:30.569331 IP 99.181.97.22.1935 > 10.8.0.3.37202: Flags [.], ack 77380, win 126, options [nop,nop,TS val 3355361791 ecr 1578683634], length 0
02:03:30.595177 IP 10.8.0.3.37202 > 99.181.97.22.1935: Flags [.], seq 84361:85675, ack 1, win 501, options [nop,nop,TS val 1578683935 ecr 3355361791], length 1314
02:03:30.663044 IP 10.8.0.3.37202 > 99.181.97.22.1935: Flags [.], seq 85675:86989, ack 1, win 501, options [nop,nop,TS val 1578684003 ecr 3355361791], length 1314
02:03:30.668589 IP 99.181.97.22.1935 > 10.8.0.3.37202: Flags [.], ack 80008, win 126, options [nop,nop,TS val 3355361890 ecr 1578683704], length 0
02:03:30.694070 IP 10.8.0.3.37202 > 99.181.97.22.1935: Flags [.], seq 86989:88303, ack 1, win 501, options [nop,nop,TS val 1578684034 ecr 3355361890], length 1314
02:03:30.715290 IP 99.181.97.22.1935 > 10.8.0.3.37202: Flags [.], ack 81733, win 126, options [nop,nop,TS val 3355361937 ecr 1578683802], length 0
02:03:30.715306 IP 10.8.0.3.37202 > 99.181.97.22.1935: Flags [P.], seq 88303:88712, ack 1, win 501, options [nop,nop,TS val 1578684056 ecr 3355361937], length 409
02:03:30.763273 IP 10.8.0.3.37202 > 99.181.97.22.1935: Flags [.], seq 88712:90026, ack 1, win 501, options [nop,nop,TS val 1578684104 ecr 3355361937], length 1314
02:03:30.796590 IP 10.8.0.3.37202 > 99.181.97.22.1935: Flags [.], seq 90026:91340, ack 1, win 501, options [nop,nop,TS val 1578684137 ecr 3355361937], length 1314
02:03:30.802943 IP 99.181.97.22.1935 > 10.8.0.3.37202: Flags [.], ack 84361, win 126, options [nop,nop,TS val 3355362024 ecr 1578683870], length 0
02:03:30.828318 IP 10.8.0.3.37202 > 99.181.97.22.1935: Flags [.], seq 91340:92654, ack 1, win 501, options [nop,nop,TS val 1578684169 ecr 3355362024], length 1314
02:03:30.896108 IP 10.8.0.3.37202 > 99.181.97.22.1935: Flags [.], seq 92654:93968, ack 1, win 501, options [nop,nop,TS val 1578684236 ecr 3355362024], length 1314
02:03:30.903331 IP 99.181.97.22.1935 > 10.8.0.3.37202: Flags [.], ack 86989, win 126, options [nop,nop,TS val 3355362125 ecr 1578683935], length 0
02:03:30.929426 IP 10.8.0.3.37202 > 99.181.97.22.1935: Flags [.], seq 93968:95282, ack 1, win 501, options [nop,nop,TS val 1578684270 ecr 3355362125], length 1314
02:03:30.955123 IP 99.181.97.22.1935 > 10.8.0.3.37202: Flags [.], ack 88712, win 126, options [nop,nop,TS val 3355362177 ecr 1578684034], length 0
02:03:30.955169 IP 10.8.0.3.37202 > 99.181.97.22.1935: Flags [P.], seq 95282:95771, ack 1, win 501, options [nop,nop,TS val 1578684295 ecr 3355362177], length 489
02:03:30.975802 IP 10.8.0.3.37202 > 99.181.97.22.1935: Flags [.], seq 95771:97085, ack 1, win 501, options [nop,nop,TS val 1578684316 ecr 3355362177], length 1314
02:03:31.018422 IP 10.8.0.3.37202 > 99.181.97.22.1935: Flags [.], seq 97085:98399, ack 1, win 501, options [nop,nop,TS val 1578684359 ecr 3355362177], length 1314
02:03:31.037552 IP 99.181.97.22.1935 > 10.8.0.3.37202: Flags [.], ack 91340, win 126, options [nop,nop,TS val 3355362258 ecr 1578684104], length 0
02:03:31.062681 IP 10.8.0.3.37202 > 99.181.97.22.1935: Flags [.], seq 98399:99713, ack 1, win 501, options [nop,nop,TS val 1578684403 ecr 3355362258], length 1314
02:03:31.125784 IP 10.8.0.3.37202 > 99.181.97.22.1935: Flags [.], seq 99713:101027, ack 1, win 501, options [nop,nop,TS val 1578684466 ecr 3355362258], length 1314
02:03:31.137319 IP 99.181.97.22.1935 > 10.8.0.3.37202: Flags [.], ack 93968, win 126, options [nop,nop,TS val 3355362359 ecr 1578684169], length 0
02:03:31.147286 IP 10.8.0.3.37202 > 99.181.97.22.1935: Flags [.], seq 101027:102341, ack 1, win 501, options [nop,nop,TS val 1578684488 ecr 3355362359], length 1314
02:03:31.196096 IP 99.181.97.22.1935 > 10.8.0.3.37202: Flags [.], ack 95771, win 126, options [nop,nop,TS val 3355362417 ecr 1578684270], length 0
02:03:31.196128 IP 10.8.0.3.37202 > 99.181.97.22.1935: Flags [P.], seq 102341:103595, ack 1, win 501, options [nop,nop,TS val 1578684536 ecr 3355362417], length 1254
02:03:31.254358 IP 10.8.0.3.37202 > 99.181.97.22.1935: Flags [.], seq 103595:104909, ack 1, win 501, options [nop,nop,TS val 1578684595 ecr 3355362417], length 1314
02:03:31.258686 IP 99.181.97.22.1935 > 10.8.0.3.37202: Flags [.], ack 98399, win 126, options [nop,nop,TS val 3355362480 ecr 1578684316], length 0
02:03:31.295111 IP 10.8.0.3.37202 > 99.181.97.22.1935: Flags [.], seq 104909:106223, ack 1, win 501, options [nop,nop,TS val 1578684635 ecr 3355362480], length 1314
02:03:31.318233 IP 10.8.0.3.37202 > 99.181.97.22.1935: Flags [.], seq 106223:107537, ack 1, win 501, options [nop,nop,TS val 1578684659 ecr 3355362480], length 1314
02:03:31.366072 IP 99.181.97.22.1935 > 10.8.0.3.37202: Flags [.], ack 101027, win 126, options [nop,nop,TS val 3355362587 ecr 1578684403], length 0
02:03:31.381932 IP 10.8.0.3.37202 > 99.181.97.22.1935: Flags [.], seq 107537:108851, ack 1, win 501, options [nop,nop,TS val 1578684722 ecr 3355362587], length 1314
02:03:31.424783 IP 10.8.0.3.37202 > 99.181.97.22.1935: Flags [.], seq 108851:110165, ack 1, win 501, options [nop,nop,TS val 1578684765 ecr 3355362587], length 1314
02:03:31.437496 IP 99.181.97.22.1935 > 10.8.0.3.37202: Flags [.], ack 103595, win 126, options [nop,nop,TS val 3355362658 ecr 1578684488], length 0
02:03:31.437539 IP 10.8.0.3.37202 > 99.181.97.22.1935: Flags [P.], seq 110165:110670, ack 1, win 501, options [nop,nop,TS val 1578684778 ecr 3355362658], length 505
02:03:31.489239 IP 10.8.0.3.37202 > 99.181.97.22.1935: Flags [.], seq 110670:111984, ack 1, win 501, options [nop,nop,TS val 1578684830 ecr 3355362658], length 1314
02:03:31.510430 IP 10.8.0.3.37202 > 99.181.97.22.1935: Flags [.], seq 111984:113298, ack 1, win 501, options [nop,nop,TS val 1578684851 ecr 3355362658], length 1314
02:03:31.536061 IP 99.181.97.22.1935 > 10.8.0.3.37202: Flags [.], ack 106223, win 126, options [nop,nop,TS val 3355362757 ecr 1578684595], length 0
02:03:31.562539 IP 10.8.0.3.37202 > 99.181.97.22.1935: Flags [.], seq 113298:114612, ack 1, win 501, options [nop,nop,TS val 1578684903 ecr 3355362757], length 1314
02:03:31.617577 IP 10.8.0.3.37202 > 99.181.97.22.1935: Flags [.], seq 114612:115926, ack 1, win 501, options [nop,nop,TS val 1578684958 ecr 3355362757], length 1314
02:03:31.622129 IP 99.181.97.22.1935 > 10.8.0.3.37202: Flags [.], ack 108851, win 126, options [nop,nop,TS val 3355362843 ecr 1578684659], length 0
02:03:31.660799 IP 10.8.0.3.37202 > 99.181.97.22.1935: Flags [.], seq 115926:117240, ack 1, win 501, options [nop,nop,TS val 1578685001 ecr 3355362843], length 1314
02:03:31.677959 IP 99.181.97.22.1935 > 10.8.0.3.37202: Flags [.], ack 110670, win 126, options [nop,nop,TS val 3355362899 ecr 1578684765], length 0
02:03:31.678006 IP 10.8.0.3.37202 > 99.181.97.22.1935: Flags [P.], seq 117240:117643, ack 1, win 501, options [nop,nop,TS val 1578685018 ecr 3355362899], length 403
02:03:31.725196 IP 10.8.0.3.37202 > 99.181.97.22.1935: Flags [.], seq 117643:118957, ack 1, win 501, options [nop,nop,TS val 1578685065 ecr 3355362899], length 1314
02:03:31.746466 IP 10.8.0.3.37202 > 99.181.97.22.1935: Flags [.], seq 118957:120271, ack 1, win 501, options [nop,nop,TS val 1578685087 ecr 3355362899], length 1314
02:03:31.750845 IP 99.181.97.22.1935 > 10.8.0.3.37202: Flags [.], ack 113298, win 126, options [nop,nop,TS val 3355362972 ecr 1578684830], length 0
02:03:31.792992 IP 10.8.0.3.37202 > 99.181.97.22.1935: Flags [.], seq 120271:121585, ack 1, win 501, options [nop,nop,TS val 1578685133 ecr 3355362972], length 1314
02:03:31.853281 IP 10.8.0.3.37202 > 99.181.97.22.1935: Flags [.], seq 121585:122899, ack 1, win 501, options [nop,nop,TS val 1578685194 ecr 3355362972], length 1314
02:03:31.857852 IP 99.181.97.22.1935 > 10.8.0.3.37202: Flags [.], ack 115926, win 126, options [nop,nop,TS val 3355363079 ecr 1578684903], length 0
02:03:31.893568 IP 10.8.0.3.37202 > 99.181.97.22.1935: Flags [.], seq 122899:124213, ack 1, win 501, options [nop,nop,TS val 1578685234 ecr 3355363079], length 1314
02:03:31.918416 IP 99.181.97.22.1935 > 10.8.0.3.37202: Flags [.], ack 117643, win 126, options [nop,nop,TS val 3355363140 ecr 1578685001], length 0
02:03:31.918432 IP 10.8.0.3.37202 > 99.181.97.22.1935: Flags [P.], seq 124213:125462, ack 1, win 501, options [nop,nop,TS val 1578685259 ecr 3355363140], length 1249
02:03:31.980891 IP 10.8.0.3.37202 > 99.181.97.22.1935: Flags [.], seq 125462:126776, ack 1, win 501, options [nop,nop,TS val 1578685321 ecr 3355363140], length 1314
02:03:31.986351 IP 99.181.97.22.1935 > 10.8.0.3.37202: Flags [.], ack 120271, win 126, options [nop,nop,TS val 3355363208 ecr 1578685065], length 0
02:03:32.023377 IP 10.8.0.3.37202 > 99.181.97.22.1935: Flags [.], seq 126776:128090, ack 1, win 501, options [nop,nop,TS val 1578685364 ecr 3355363208], length 1314
02:03:32.044711 IP 10.8.0.3.37202 > 99.181.97.22.1935: Flags [.], seq 128090:129404, ack 1, win 501, options [nop,nop,TS val 1578685385 ecr 3355363208], length 1314
02:03:32.093292 IP 99.181.97.22.1935 > 10.8.0.3.37202: Flags [.], ack 122899, win 126, options [nop,nop,TS val 3355363315 ecr 1578685133], length 0
02:03:32.129928 IP 10.8.0.3.37202 > 99.181.97.22.1935: Flags [.], seq 129404:130718, ack 1, win 501, options [nop,nop,TS val 1578685470 ecr 3355363315], length 1314
02:03:32.151996 IP 10.8.0.3.37202 > 99.181.97.22.1935: Flags [.], seq 130718:132032, ack 1, win 501, options [nop,nop,TS val 1578685492 ecr 3355363315], length 1314
02:03:32.158278 IP 99.181.97.22.1935 > 10.8.0.3.37202: Flags [.], ack 125462, win 126, options [nop,nop,TS val 3355363380 ecr 1578685234], length 0
02:03:32.158319 IP 10.8.0.3.37202 > 99.181.97.22.1935: Flags [P.], seq 132032:132443, ack 1, win 501, options [nop,nop,TS val 1578685499 ecr 3355363380], length 411
02:03:32.216592 IP 10.8.0.3.37202 > 99.181.97.22.1935: Flags [.], seq 132443:133757, ack 1, win 501, options [nop,nop,TS val 1578685557 ecr 3355363380], length 1314
02:03:32.259656 IP 10.8.0.3.37202 > 99.181.97.22.1935: Flags [.], seq 133757:135071, ack 1, win 501, options [nop,nop,TS val 1578685600 ecr 3355363380], length 1314
02:03:32.270965 IP 99.181.97.22.1935 > 10.8.0.3.37202: Flags [.], ack 128090, win 126, options [nop,nop,TS val 3355363492 ecr 1578685321], length 0
02:03:32.281131 IP 10.8.0.3.37202 > 99.181.97.22.1935: Flags [.], seq 135071:136385, ack 1, win 501, options [nop,nop,TS val 1578685621 ecr 3355363492], length 1314
02:03:32.359041 IP 99.181.97.22.1935 > 10.8.0.3.37202: Flags [.], ack 129404, win 126, options [nop,nop,TS val 3355363581 ecr 1578685385], length 0
02:03:32.363111 IP 10.8.0.3.37202 > 99.181.97.22.1935: Flags [.], seq 136385:137699, ack 1, win 501, options [nop,nop,TS val 1578685703 ecr 3355363581], length 1314
02:03:32.388395 IP 10.8.0.3.37202 > 99.181.97.22.1935: Flags [.], seq 137699:139013, ack 1, win 501, options [nop,nop,TS val 1578685729 ecr 3355363581], length 1314
02:03:32.392214 IP 99.181.97.22.1935 > 10.8.0.3.37202: Flags [.], ack 132032, win 126, options [nop,nop,TS val 3355363614 ecr 1578685470], length 0
02:03:32.398229 IP 99.181.97.22.1935 > 10.8.0.3.37202: Flags [.], ack 132443, win 126, options [nop,nop,TS val 3355363620 ecr 1578685499], length 0
02:03:32.398249 IP 10.8.0.3.37202 > 99.181.97.22.1935: Flags [P.], seq 139013:139514, ack 1, win 501, options [nop,nop,TS val 1578685739 ecr 3355363620], length 501
02:03:32.452446 IP 10.8.0.3.37202 > 99.181.97.22.1935: Flags [.], seq 139514:140828, ack 1, win 501, options [nop,nop,TS val 1578685793 ecr 3355363620], length 1314
02:03:32.495234 IP 10.8.0.3.37202 > 99.181.97.22.1935: Flags [.], seq 140828:142142, ack 1, win 501, options [nop,nop,TS val 1578685836 ecr 3355363620], length 1314
02:03:32.499620 IP 99.181.97.22.1935 > 10.8.0.3.37202: Flags [.], ack 135071, win 126, options [nop,nop,TS val 3355363721 ecr 1578685557], length 0
02:03:32.527677 IP 10.8.0.3.37202 > 99.181.97.22.1935: Flags [.], seq 142142:143456, ack 1, win 501, options [nop,nop,TS val 1578685868 ecr 3355363721], length 1314
02:03:32.580555 IP 10.8.0.3.37202 > 99.181.97.22.1935: Flags [.], seq 143456:144770, ack 1, win 501, options [nop,nop,TS val 1578685921 ecr 3355363721], length 1314
02:03:32.591063 IP 99.181.97.22.1935 > 10.8.0.3.37202: Flags [.], ack 136385, win 126, options [nop,nop,TS val 3355363813 ecr 1578685621], length 0
02:03:32.623228 IP 10.8.0.3.37202 > 99.181.97.22.1935: Flags [.], seq 144770:146084, ack 1, win 501, options [nop,nop,TS val 1578685964 ecr 3355363813], length 1314
02:03:32.628208 IP 99.181.97.22.1935 > 10.8.0.3.37202: Flags [.], ack 139013, win 126, options [nop,nop,TS val 3355363850 ecr 1578685703], length 0
02:03:32.638389 IP 99.181.97.22.1935 > 10.8.0.3.37202: Flags [.], ack 139514, win 126, options [nop,nop,TS val 3355363860 ecr 1578685739], length 0
02:03:32.638433 IP 10.8.0.3.37202 > 99.181.97.22.1935: Flags [P.], seq 146084:146478, ack 1, win 501, options [nop,nop,TS val 1578685979 ecr 3355363860], length 394
02:03:32.686787 IP 10.8.0.3.37202 > 99.181.97.22.1935: Flags [.], seq 146478:147792, ack 1, win 501, options [nop,nop,TS val 1578686027 ecr 3355363860], length 1314
02:03:32.729447 IP 10.8.0.3.37202 > 99.181.97.22.1935: Flags [.], seq 147792:149106, ack 1, win 501, options [nop,nop,TS val 1578686070 ecr 3355363860], length 1314
02:03:32.735262 IP 99.181.97.22.1935 > 10.8.0.3.37202: Flags [.], ack 142142, win 126, options [nop,nop,TS val 3355363957 ecr 1578685793], length 0
02:03:32.763078 IP 10.8.0.3.37202 > 99.181.97.22.1935: Flags [.], seq 149106:150420, ack 1, win 501, options [nop,nop,TS val 1578686103 ecr 3355363957], length 1314
02:03:32.815045 IP 10.8.0.3.37202 > 99.181.97.22.1935: Flags [.], seq 150420:151734, ack 1, win 501, options [nop,nop,TS val 1578686155 ecr 3355363957], length 1314
02:03:32.820790 IP 99.181.97.22.1935 > 10.8.0.3.37202: Flags [.], ack 144770, win 126, options [nop,nop,TS val 3355364042 ecr 1578685868], length 0
02:03:32.857807 IP 10.8.0.3.37202 > 99.181.97.22.1935: Flags [.], seq 151734:153048, ack 1, win 501, options [nop,nop,TS val 1578686198 ecr 3355364042], length 1314
02:03:32.878523 IP 99.181.97.22.1935 > 10.8.0.3.37202: Flags [.], ack 146478, win 126, options [nop,nop,TS val 3355364100 ecr 1578685964], length 0
02:03:32.878565 IP 10.8.0.3.37202 > 99.181.97.22.1935: Flags [P.], seq 153048:153458, ack 1, win 501, options [nop,nop,TS val 1578686219 ecr 3355364100], length 410
02:03:32.922432 IP 10.8.0.3.37202 > 99.181.97.22.1935: Flags [.], seq 153458:154772, ack 1, win 501, options [nop,nop,TS val 1578686263 ecr 3355364100], length 1314
02:03:32.960825 IP 10.8.0.3.37202 > 99.181.97.22.1935: Flags [.], seq 154772:156086, ack 1, win 501, options [nop,nop,TS val 1578686301 ecr 3355364100], length 1314
02:03:32.969390 IP 99.181.97.22.1935 > 10.8.0.3.37202: Flags [.], ack 149106, win 126, options [nop,nop,TS val 3355364191 ecr 1578686027], length 0
02:03:32.993652 IP 10.8.0.3.37202 > 99.181.97.22.1935: Flags [.], seq 156086:157400, ack 1, win 501, options [nop,nop,TS val 1578686334 ecr 3355364191], length 1314
02:03:33.050148 IP 10.8.0.3.37202 > 99.181.97.22.1935: Flags [.], seq 157400:158714, ack 1, win 501, options [nop,nop,TS val 1578686390 ecr 3355364191], length 1314
02:03:33.054714 IP 99.181.97.22.1935 > 10.8.0.3.37202: Flags [.], ack 151734, win 126, options [nop,nop,TS val 3355364277 ecr 1578686103], length 0
02:03:33.092908 IP 10.8.0.3.37202 > 99.181.97.22.1935: Flags [.], seq 158714:160028, ack 1, win 501, options [nop,nop,TS val 1578686433 ecr 3355364277], length 1314
02:03:33.118325 IP 99.181.97.22.1935 > 10.8.0.3.37202: Flags [.], ack 153458, win 126, options [nop,nop,TS val 3355364340 ecr 1578686198], length 0
02:03:33.118364 IP 10.8.0.3.37202 > 99.181.97.22.1935: Flags [P.], seq 160028:161285, ack 1, win 501, options [nop,nop,TS val 1578686459 ecr 3355364340], length 1257
02:03:33.196387 IP 10.8.0.3.37202 > 99.181.97.22.1935: Flags [.], seq 161285:162599, ack 1, win 501, options [nop,nop,TS val 1578686537 ecr 3355364340], length 1314
02:03:33.200829 IP 99.181.97.22.1935 > 10.8.0.3.37202: Flags [.], ack 156086, win 126, options [nop,nop,TS val 3355364422 ecr 1578686263], length 0
02:03:33.221491 IP 10.8.0.3.37202 > 99.181.97.22.1935: Flags [.], seq 162599:163913, ack 1, win 501, options [nop,nop,TS val 1578686562 ecr 3355364422], length 1314
02:03:33.261887 IP 10.8.0.3.37202 > 99.181.97.22.1935: Flags [.], seq 163913:165227, ack 1, win 501, options [nop,nop,TS val 1578686602 ecr 3355364422], length 1314
02:03:33.290296 IP 99.181.97.22.1935 > 10.8.0.3.37202: Flags [.], ack 158714, win 126, options [nop,nop,TS val 3355364512 ecr 1578686334], length 0
02:03:33.325657 IP 10.8.0.3.37202 > 99.181.97.22.1935: Flags [.], seq 165227:166541, ack 1, win 501, options [nop,nop,TS val 1578686666 ecr 3355364512], length 1314
02:03:33.349127 IP 10.8.0.3.37202 > 99.181.97.22.1935: Flags [.], seq 166541:167855, ack 1, win 501, options [nop,nop,TS val 1578686689 ecr 3355364512], length 1314
02:03:33.358503 IP 99.181.97.22.1935 > 10.8.0.3.37202: Flags [.], ack 161285, win 126, options [nop,nop,TS val 3355364580 ecr 1578686433], length 0
02:03:33.358570 IP 10.8.0.3.37202 > 99.181.97.22.1935: Flags [P.], seq 167855:168254, ack 1, win 501, options [nop,nop,TS val 1578686699 ecr 3355364580], length 399
02:03:33.430267 IP 10.8.0.3.37202 > 99.181.97.22.1935: Flags [.], seq 168254:169568, ack 1, win 501, options [nop,nop,TS val 1578686771 ecr 3355364580], length 1314
02:03:33.456079 IP 10.8.0.3.37202 > 99.181.97.22.1935: Flags [.], seq 169568:170882, ack 1, win 501, options [nop,nop,TS val 1578686796 ecr 3355364580], length 1314
02:03:33.461540 IP 99.181.97.22.1935 > 10.8.0.3.37202: Flags [.], ack 163913, win 126, options [nop,nop,TS val 3355364683 ecr 1578686537], length 0
02:03:33.492436 IP 10.8.0.3.37202 > 99.181.97.22.1935: Flags [.], seq 170882:172196, ack 1, win 501, options [nop,nop,TS val 1578686833 ecr 3355364683], length 1314
02:03:33.562199 IP 10.8.0.3.37202 > 99.181.97.22.1935: Flags [.], seq 172196:173510, ack 1, win 501, options [nop,nop,TS val 1578686903 ecr 3355364683], length 1314
02:03:33.566347 IP 99.181.97.22.1935 > 10.8.0.3.37202: Flags [.], ack 166541, win 126, options [nop,nop,TS val 3355364787 ecr 1578686602], length 0
02:03:33.583613 IP 10.8.0.3.37202 > 99.181.97.22.1935: Flags [.], seq 173510:174824, ack 1, win 501, options [nop,nop,TS val 1578686924 ecr 3355364787], length 1314
02:03:33.598330 IP 99.181.97.22.1935 > 10.8.0.3.37202: Flags [.], ack 168254, win 126, options [nop,nop,TS val 3355364820 ecr 1578686689], length 0
02:03:33.598344 IP 10.8.0.3.37202 > 99.181.97.22.1935: Flags [P.], seq 174824:175325, ack 1, win 501, options [nop,nop,TS val 1578686939 ecr 3355364820], length 501
02:03:33.647465 IP 10.8.0.3.37202 > 99.181.97.22.1935: Flags [.], seq 175325:176639, ack 1, win 501, options [nop,nop,TS val 1578686988 ecr 3355364820], length 1314
02:03:33.690454 IP 10.8.0.3.37202 > 99.181.97.22.1935: Flags [.], seq 176639:177953, ack 1, win 501, options [nop,nop,TS val 1578687031 ecr 3355364820], length 1314
02:03:33.697193 IP 99.181.97.22.1935 > 10.8.0.3.37202: Flags [.], ack 170882, win 126, options [nop,nop,TS val 3355364918 ecr 1578686771], length 0
02:03:33.729887 IP 10.8.0.3.37202 > 99.181.97.22.1935: Flags [.], seq 177953:179267, ack 1, win 501, options [nop,nop,TS val 1578687070 ecr 3355364918], length 1314
02:03:33.792621 IP 10.8.0.3.37202 > 99.181.97.22.1935: Flags [.], seq 179267:180581, ack 1, win 501, options [nop,nop,TS val 1578687133 ecr 3355364918], length 1314
02:03:33.802073 IP 99.181.97.22.1935 > 10.8.0.3.37202: Flags [.], ack 173510, win 126, options [nop,nop,TS val 3355365024 ecr 1578686833], length 0
02:03:33.818374 IP 10.8.0.3.37202 > 99.181.97.22.1935: Flags [.], seq 180581:181895, ack 1, win 501, options [nop,nop,TS val 1578687159 ecr 3355365024], length 1314
02:03:33.838293 IP 99.181.97.22.1935 > 10.8.0.3.37202: Flags [.], ack 175325, win 126, options [nop,nop,TS val 3355365060 ecr 1578686924], length 0
02:03:33.838306 IP 10.8.0.3.37202 > 99.181.97.22.1935: Flags [P.], seq 181895:182304, ack 1, win 501, options [nop,nop,TS val 1578687179 ecr 3355365060], length 409
02:03:33.881991 IP 10.8.0.3.37202 > 99.181.97.22.1935: Flags [.], seq 182304:183618, ack 1, win 501, options [nop,nop,TS val 1578687222 ecr 3355365060], length 1314
02:03:33.924859 IP 10.8.0.3.37202 > 99.181.97.22.1935: Flags [.], seq 183618:184932, ack 1, win 501, options [nop,nop,TS val 1578687265 ecr 3355365060], length 1314
02:03:33.930749 IP 99.181.97.22.1935 > 10.8.0.3.37202: Flags [.], ack 177953, win 126, options [nop,nop,TS val 3355365152 ecr 1578686988], length 0
02:03:33.961469 IP 10.8.0.3.37202 > 99.181.97.22.1935: Flags [.], seq 184932:186246, ack 1, win 501, options [nop,nop,TS val 1578687302 ecr 3355365152], length 1314
02:03:34.026232 IP 10.8.0.3.37202 > 99.181.97.22.1935: Flags [.], seq 186246:187560, ack 1, win 501, options [nop,nop,TS val 1578687367 ecr 3355365152], length 1314
02:03:34.032575 IP 99.181.97.22.1935 > 10.8.0.3.37202: Flags [.], ack 180581, win 126, options [nop,nop,TS val 3355365254 ecr 1578687070], length 0
02:03:34.052353 IP 10.8.0.3.37202 > 99.181.97.22.1935: Flags [.], seq 187560:188874, ack 1, win 501, options [nop,nop,TS val 1578687393 ecr 3355365254], length 1314
02:03:34.078605 IP 99.181.97.22.1935 > 10.8.0.3.37202: Flags [.], ack 182304, win 126, options [nop,nop,TS val 3355365300 ecr 1578687159], length 0
02:03:34.078642 IP 10.8.0.3.37202 > 99.181.97.22.1935: Flags [P.], seq 188874:189369, ack 1, win 501, options [nop,nop,TS val 1578687419 ecr 3355365300], length 495
02:03:34.116859 IP 10.8.0.3.37202 > 99.181.97.22.1935: Flags [.], seq 189369:190683, ack 1, win 501, options [nop,nop,TS val 1578687457 ecr 3355365300], length 1314
02:03:34.159755 IP 10.8.0.3.37202 > 99.181.97.22.1935: Flags [.], seq 190683:191997, ack 1, win 501, options [nop,nop,TS val 1578687500 ecr 3355365300], length 1314
02:03:34.164711 IP 99.181.97.22.1935 > 10.8.0.3.37202: Flags [.], ack 184932, win 126, options [nop,nop,TS val 3355365387 ecr 1578687222], length 0
02:03:34.202614 IP 10.8.0.3.37202 > 99.181.97.22.1935: Flags [.], seq 191997:193311, ack 1, win 501, options [nop,nop,TS val 1578687543 ecr 3355365387], length 1314
02:03:34.262754 IP 10.8.0.3.37202 > 99.181.97.22.1935: Flags [.], seq 193311:194625, ack 1, win 501, options [nop,nop,TS val 1578687603 ecr 3355365387], length 1314
02:03:34.270387 IP 99.181.97.22.1935 > 10.8.0.3.37202: Flags [.], ack 187560, win 126, options [nop,nop,TS val 3355365492 ecr 1578687302], length 0
02:03:34.288602 IP 10.8.0.3.37202 > 99.181.97.22.1935: Flags [.], seq 194625:195939, ack 1, win 501, options [nop,nop,TS val 1578687629 ecr 3355365492], length 1314
02:03:34.318534 IP 99.181.97.22.1935 > 10.8.0.3.37202: Flags [.], ack 189369, win 126, options [nop,nop,TS val 3355365540 ecr 1578687393], length 0
02:03:34.318561 IP 10.8.0.3.37202 > 99.181.97.22.1935: Flags [P.], seq 195939:196341, ack 1, win 501, options [nop,nop,TS val 1578687659 ecr 3355365540], length 402
02:03:34.352742 IP 10.8.0.3.37202 > 99.181.97.22.1935: Flags [.], seq 196341:197655, ack 1, win 501, options [nop,nop,TS val 1578687693 ecr 3355365540], length 1314
