10:46:18.046830 IP 45.113.130.25.1935 > 10.8.3.2.42378: Flags [.], ack 1237228557, win 132, options [nop,nop,TS val 3794805236 ecr 1213916519], length 0
10:46:18.066410 IP 10.8.3.2.42378 > 45.113.130.25.1935: Flags [.], seq 15459:16773, ack 0, win 501, options [nop,nop,TS val 1213917140 ecr 3794805236], length 1314
10:46:18.101927 IP 10.8.3.2.42378 > 45.113.130.25.1935: Flags [.], seq 16773:18087, ack 0, win 501, options [nop,nop,TS val 1213917176 ecr 3794805236], length 1314
10:46:18.119829 IP 45.113.130.25.1935 > 10.8.3.2.42378: Flags [.], ack 2629, win 132, options [nop,nop,TS val 3794805309 ecr 1213916604], length 0
10:46:18.130856 IP 10.8.3.2.42378 > 45.113.130.25.1935: Flags [.], seq 18087:19401, ack 0, win 501, options [nop,nop,TS val 1213917205 ecr 3794805309], length 1314
10:46:18.202210 IP 10.8.3.2.42378 > 45.113.130.25.1935: Flags [.], seq 19401:20715, ack 0, win 501, options [nop,nop,TS val 1213917276 ecr 3794805309], length 1314
10:46:18.215765 IP 45.113.130.25.1935 > 10.8.3.2.42378: Flags [.], ack 5257, win 132, options [nop,nop,TS val 3794805405 ecr 1213916709], length 0
10:46:18.235312 IP 10.8.3.2.42378 > 45.113.130.25.1935: Flags [.], seq 20715:22029, ack 0, win 501, options [nop,nop,TS val 1213917309 ecr 3794805405], length 1314
10:46:18.260218 IP 10.8.3.2.42378 > 45.113.130.25.1935: Flags [.], seq 22029:23343, ack 0, win 501, options [nop,nop,TS val 1213917334 ecr 3794805405], length 1314
10:46:18.312903 IP 45.113.130.25.1935 > 10.8.3.2.42378: Flags [.], ack 7885, win 132, options [nop,nop,TS val 3794805502 ecr 1213916776], length 0
10:46:18.324757 IP 10.8.3.2.42378 > 45.113.130.25.1935: Flags [.], seq 23343:24657, ack 0, win 501, options [nop,nop,TS val 1213917398 ecr 3794805502], length 1314
10:46:18.346168 IP 10.8.3.2.42378 > 45.113.130.25.1935: Flags [.], seq 24657:25971, ack 0, win 501, options [nop,nop,TS val 1213917420 ecr 3794805502], length 1314
10:46:18.382593 IP 45.113.130.25.1935 > 10.8.3.2.42378: Flags [.], ack 10513, win 132, options [nop,nop,TS val 3794805572 ecr 1213916876], length 0
10:46:18.399667 IP 10.8.3.2.42378 > 45.113.130.25.1935: Flags [.], seq 25971:27285, ack 0, win 501, options [nop,nop,TS val 1213917473 ecr 3794805572], length 1314
10:46:18.419330 IP 45.113.130.25.1935 > 10.8.3.2.42378: Flags [.], ack 11517, win 133, options [nop,nop,TS val 3794805609 ecr 1213916946], length 0
10:46:18.419350 IP 10.8.3.2.42378 > 45.113.130.25.1935: Flags [P.], seq 27285:27549, ack 0, win 501, options [nop,nop,TS val 1213917493 ecr 3794805609], length 264
10:46:18.467780 IP 10.8.3.2.42378 > 45.113.130.25.1935: Flags [.], seq 27549:28863, ack 0, win 501, options [nop,nop,TS val 1213917541 ecr 3794805609], length 1314
10:46:18.501086 IP 10.8.3.2.42378 > 45.113.130.25.1935: Flags [.], seq 28863:30177, ack 0, win 501, options [nop,nop,TS val 1213917575 ecr 3794805609], length 1314
10:46:18.515969 IP 45.113.130.25.1935 > 10.8.3.2.42378: Flags [.], ack 14145, win 133, options [nop,nop,TS val 3794805705 ecr 1213917009], length 0
10:46:18.538705 IP 10.8.3.2.42378 > 45.113.130.25.1935: Flags [.], seq 30177:31491, ack 0, win 501, options [nop,nop,TS val 1213917612 ecr 3794805705], length 1314
10:46:18.598089 IP 10.8.3.2.42378 > 45.113.130.25.1935: Flags [.], seq 31491:32805, ack 0, win 501, options [nop,nop,TS val 1213917672 ecr 3794805705], length 1314
10:46:18.613279 IP 45.113.130.25.1935 > 10.8.3.2.42378: Flags [.], ack 16773, win 132, options [nop,nop,TS val 3794805803 ecr 1213917075], length 0
10:46:18.631292 IP 10.8.3.2.42378 > 45.113.130.25.1935: Flags [.], seq 32805:34119, ack 0, win 501, options [nop,nop,TS val 1213917705 ecr 3794805803], length 1314
10:46:18.666565 IP 10.8.3.2.42378 > 45.113.130.25.1935: Flags [.], seq 34119:35433, ack 0, win 501, options [nop,nop,TS val 1213917740 ecr 3794805803], length 1314
10:46:18.678717 IP 45.113.130.25.1935 > 10.8.3.2.42378: Flags [.], ack 19401, win 132, options [nop,nop,TS val 3794805868 ecr 1213917176], length 0
10:46:18.732133 IP 10.8.3.2.42378 > 45.113.130.25.1935: Flags [.], seq 35433:36747, ack 0, win 501, options [nop,nop,TS val 1213917806 ecr 3794805868], length 1314
10:46:18.769261 IP 10.8.3.2.42378 > 45.113.130.25.1935: Flags [.], seq 36747:38061, ack 0, win 501, options [nop,nop,TS val 1213917843 ecr 3794805868], length 1314
10:46:18.783485 IP 45.113.130.25.1935 > 10.8.3.2.42378: Flags [.], ack 22029, win 132, options [nop,nop,TS val 3794805971 ecr 1213917276], length 0
10:46:18.800844 IP 10.8.3.2.42378 > 45.113.130.25.1935: Flags [.], seq 38061:39375, ack 0, win 501, options [nop,nop,TS val 1213917875 ecr 3794805971], length 1314
10:46:18.868903 IP 10.8.3.2.42378 > 45.113.130.25.1935: Flags [.], seq 39375:40689, ack 0, win 501, options [nop,nop,TS val 1213917943 ecr 3794805971], length 1314
10:46:18.871826 IP 45.113.130.25.1935 > 10.8.3.2.42378: Flags [.], ack 24657, win 132, options [nop,nop,TS val 3794806061 ecr 1213917334], length 0
10:46:18.900786 IP 10.8.3.2.42378 > 45.113.130.25.1935: Flags [.], seq 40689:42003, ack 0, win 501, options [nop,nop,TS val 1213917974 ecr 3794806061], length 1314
10:46:18.932601 IP 10.8.3.2.42378 > 45.113.130.25.1935: Flags [.], seq 42003:43317, ack 0, win 501, options [nop,nop,TS val 1213918006 ecr 3794806061], length 1314
10:46:18.946589 IP 45.113.130.25.1935 > 10.8.3.2.42378: Flags [.], ack 27285, win 132, options [nop,nop,TS val 3794806136 ecr 1213917420], length 0
10:46:18.965994 IP 45.113.130.25.1935 > 10.8.3.2.42378: Flags [.], ack 27549, win 133, options [nop,nop,TS val 3794806155 ecr 1213917493], length 0
10:46:18.966011 IP 10.8.3.2.42378 > 45.113.130.25.1935: Flags [P.], seq 43317:44417, ack 0, win 501, options [nop,nop,TS val 1213918040 ecr 3794806155], length 1100
10:46:19.035615 IP 10.8.3.2.42378 > 45.113.130.25.1935: Flags [.], seq 44417:45731, ack 0, win 501, options [nop,nop,TS val 1213918109 ecr 3794806155], length 1314
10:46:19.048456 IP 45.113.130.25.1935 > 10.8.3.2.42378: Flags [.], ack 30177, win 133, options [nop,nop,TS val 3794806238 ecr 1213917541], length 0
10:46:19.067250 IP 10.8.3.2.42378 > 45.113.130.25.1935: Flags [.], seq 45731:47045, ack 0, win 501, options [nop,nop,TS val 1213918141 ecr 3794806238], length 1314
10:46:19.100466 IP 10.8.3.2.42378 > 45.113.130.25.1935: Flags [.], seq 47045:48359, ack 0, win 501, options [nop,nop,TS val 1213918174 ecr 3794806238], length 1314
10:46:19.146925 IP 45.113.130.25.1935 > 10.8.3.2.42378: Flags [.], ack 32805, win 132, options [nop,nop,TS val 3794806334 ecr 1213917612], length 0
10:46:19.169399 IP 10.8.3.2.42378 > 45.113.130.25.1935: Flags [.], seq 48359:49673, ack 0, win 501, options [nop,nop,TS val 1213918243 ecr 3794806334], length 1314
10:46:19.200323 IP 10.8.3.2.42378 > 45.113.130.25.1935: Flags [.], seq 49673:50987, ack 0, win 501, options [nop,nop,TS val 1213918274 ecr 3794806334], length 1314
10:46:19.214046 IP 45.113.130.25.1935 > 10.8.3.2.42378: Flags [.], ack 35433, win 132, options [nop,nop,TS val 3794806402 ecr 1213917705], length 0
10:46:19.235593 IP 10.8.3.2.42378 > 45.113.130.25.1935: Flags [.], seq 50987:52301, ack 0, win 501, options [nop,nop,TS val 1213918309 ecr 3794806402], length 1314
10:46:19.301920 IP 10.8.3.2.42378 > 45.113.130.25.1935: Flags [.], seq 52301:53615, ack 0, win 501, options [nop,nop,TS val 1213918376 ecr 3794806402], length 1314
10:46:19.316645 IP 45.113.130.25.1935 > 10.8.3.2.42378: Flags [.], ack 38061, win 132, options [nop,nop,TS val 3794806506 ecr 1213917806], length 0
10:46:19.334101 IP 10.8.3.2.42378 > 45.113.130.25.1935: Flags [.], seq 53615:54929, ack 0, win 501, options [nop,nop,TS val 1213918408 ecr 3794806506], length 1314
10:46:19.367673 IP 10.8.3.2.42378 > 45.113.130.25.1935: Flags [.], seq 54929:56243, ack 0, win 501, options [nop,nop,TS val 1213918441 ecr 3794806506], length 1314
10:46:19.415874 IP 45.113.130.25.1935 > 10.8.3.2.42378: Flags [.], ack 40689, win 132, options [nop,nop,TS val 3794806605 ecr 1213917875], length 0
10:46:19.431743 IP 10.8.3.2.42378 > 45.113.130.25.1935: Flags [.], seq 56243:57557, ack 0, win 501, options [nop,nop,TS val 1213918505 ecr 3794806605], length 1314
10:46:19.465351 IP 10.8.3.2.42378 > 45.113.130.25.1935: Flags [.], seq 57557:58871, ack 0, win 501, options [nop,nop,TS val 1213918539 ecr 3794806605], length 1314
10:46:19.479873 IP 45.113.130.25.1935 > 10.8.3.2.42378: Flags [.], ack 43317, win 132, options [nop,nop,TS val 3794806669 ecr 1213917974], length 0
10:46:19.499654 IP 10.8.3.2.42378 > 45.113.130.25.1935: Flags [.], seq 58871:60185, ack 0, win 501, options [nop,nop,TS val 1213918573 ecr 3794806669], length 1314
10:46:19.514453 IP 45.113.130.25.1935 > 10.8.3.2.42378: Flags [.], ack 44417, win 133, options [nop,nop,TS val 3794806703 ecr 1213918040], length 0
10:46:19.514504 IP 10.8.3.2.42378 > 45.113.130.25.1935: Flags [P.], seq 60185:60342, ack 0, win 501, options [nop,nop,TS val 1213918588 ecr 3794806703], length 157
10:46:19.570320 IP 10.8.3.2.42378 > 45.113.130.25.1935: Flags [.], seq 60342:61656, ack 0, win 501, options [nop,nop,TS val 1213918644 ecr 3794806703], length 1314
10:46:19.599722 IP 10.8.3.2.42378 > 45.113.130.25.1935: Flags [.], seq 61656:62970, ack 0, win 501, options [nop,nop,TS val 1213918673 ecr 3794806703], length 1314
10:46:19.613962 IP 45.113.130.25.1935 > 10.8.3.2.42378: Flags [.], ack 47045, win 133, options [nop,nop,TS val 3794806803 ecr 1213918109], length 0
10:46:19.633937 IP 10.8.3.2.42378 > 45.113.130.25.1935: Flags [.], seq 62970:64284, ack 0, win 501, options [nop,nop,TS val 1213918708 ecr 3794806803], length 1314
10:46:19.698662 IP 10.8.3.2.42378 > 45.113.130.25.1935: Flags [.], seq 64284:65598, ack 0, win 501, options [nop,nop,TS val 1213918772 ecr 3794806803], length 1314
10:46:19.716142 IP 45.113.130.25.1935 > 10.8.3.2.42378: Flags [.], ack 49673, win 132, options [nop,nop,TS val 3794806906 ecr 1213918174], length 0
10:46:19.732104 IP 10.8.3.2.42378 > 45.113.130.25.1935: Flags [.], seq 65598:66912, ack 0, win 501, options [nop,nop,TS val 1213918806 ecr 3794806906], length 1314
10:46:19.766179 IP 10.8.3.2.42378 > 45.113.130.25.1935: Flags [.], seq 66912:68226, ack 0, win 501, options [nop,nop,TS val 1213918840 ecr 3794806906], length 1314
10:46:19.782135 IP 45.113.130.25.1935 > 10.8.3.2.42378: Flags [.], ack 52301, win 132, options [nop,nop,TS val 3794806972 ecr 1213918274], length 0
10:46:19.835307 IP 10.8.3.2.42378 > 45.113.130.25.1935: Flags [.], seq 68226:69540, ack 0, win 501, options [nop,nop,TS val 1213918909 ecr 3794806972], length 1314
10:46:19.868713 IP 10.8.3.2.42378 > 45.113.130.25.1935: Flags [.], seq 69540:70854, ack 0, win 501, options [nop,nop,TS val 1213918942 ecr 3794806972], length 1314
10:46:19.881030 IP 45.113.130.25.1935 > 10.8.3.2.42378: Flags [.], ack 54929, win 132, options [nop,nop,TS val 3794807070 ecr 1213918376], length 0
10:46:19.901907 IP 10.8.3.2.42378 > 45.113.130.25.1935: Flags [.], seq 70854:72168, ack 0, win 501, options [nop,nop,TS val 1213918976 ecr 3794807070], length 1314
10:46:19.969128 IP 10.8.3.2.42378 > 45.113.130.25.1935: Flags [.], seq 72168:73482, ack 0, win 501, options [nop,nop,TS val 1213919043 ecr 3794807070], length 1314
10:46:19.978359 IP 45.113.130.25.1935 > 10.8.3.2.42378: Flags [.], ack 57557, win 132, options [nop,nop,TS val 3794807168 ecr 1213918441], length 0
10:46:20.001422 IP 10.8.3.2.42378 > 45.113.130.25.1935: Flags [.], seq 73482:74796, ack 0, win 501, options [nop,nop,TS val 1213919075 ecr 3794807168], length 1314
10:46:20.034036 IP 10.8.3.2.42378 > 45.113.130.25.1935: Flags [.], seq 74796:76110, ack 0, win 501, options [nop,nop,TS val 1213919108 ecr 3794807168], length 1314
10:46:20.048999 IP 45.113.130.25.1935 > 10.8.3.2.42378: Flags [.], ack 60185, win 132, options [nop,nop,TS val 3794807236 ecr 1213918539], length 0
10:46:20.062472 IP 45.113.130.25.1935 > 10.8.3.2.42378: Flags [.], ack 60342, win 133, options [nop,nop,TS val 3794807250 ecr 1213918588], length 0
10:46:20.062510 IP 10.8.3.2.42378 > 45.113.130.25.1935: Flags [P.], seq 76110:76374, ack 0, win 501, options [nop,nop,TS val 1213919136 ecr 3794807250], length 264
10:46:20.101666 IP 10.8.3.2.42378 > 45.113.130.25.1935: Flags [.], seq 76374:77688, ack 0, win 501, options [nop,nop,TS val 1213919175 ecr 3794807250], length 1314
10:46:20.135107 IP 10.8.3.2.42378 > 45.113.130.25.1935: Flags [.], seq 77688:79002, ack 0, win 501, options [nop,nop,TS val 1213919209 ecr 3794807250], length 1314
10:46:20.146599 IP 45.113.130.25.1935 > 10.8.3.2.42378: Flags [.], ack 62970, win 132, options [nop,nop,TS val 3794807336 ecr 1213918644], length 0
10:46:20.184072 IP 10.8.3.2.42378 > 45.113.130.25.1935: Flags [.], seq 79002:80316, ack 0, win 501, options [nop,nop,TS val 1213919258 ecr 3794807336], length 1314
10:46:20.235715 IP 10.8.3.2.42378 > 45.113.130.25.1935: Flags [.], seq 80316:81630, ack 0, win 501, options [nop,nop,TS val 1213919309 ecr 3794807336], length 1314
10:46:20.237889 IP 45.113.130.25.1935 > 10.8.3.2.42378: Flags [.], ack 64284, win 133, options [nop,nop,TS val 3794807427 ecr 1213918708], length 0
10:46:20.268650 IP 10.8.3.2.42378 > 45.113.130.25.1935: Flags [.], seq 81630:82944, ack 0, win 501, options [nop,nop,TS val 1213919342 ecr 3794807427], length 1314
10:46:20.281045 IP 45.113.130.25.1935 > 10.8.3.2.42378: Flags [.], ack 66912, win 133, options [nop,nop,TS val 3794807468 ecr 1213918772], length 0
10:46:20.312884 IP 10.8.3.2.42378 > 45.113.130.25.1935: Flags [.], seq 82944:84258, ack 0, win 501, options [nop,nop,TS val 1213919387 ecr 3794807468], length 1314
10:46:20.369635 IP 10.8.3.2.42378 > 45.113.130.25.1935: Flags [.], seq 84258:85572, ack 0, win 501, options [nop,nop,TS val 1213919443 ecr 3794807468], length 1314
10:46:20.382429 IP 45.113.130.25.1935 > 10.8.3.2.42378: Flags [.], ack 69540, win 132, options [nop,nop,TS val 3794807571 ecr 1213918840], length 0
10:46:20.400867 IP 10.8.3.2.42378 > 45.113.130.25.1935: Flags [.], seq 85572:86886, ack 0, win 501, options [nop,nop,TS val 1213919475 ecr 3794807571], length 1314
10:46:20.441034 IP 10.8.3.2.42378 > 45.113.130.25.1935: Flags [.], seq 86886:88200, ack 0, win 501, options [nop,nop,TS val 1213919515 ecr 3794807571], length 1314
10:46:20.451806 IP 45.113.130.25.1935 > 10.8.3.2.42378: Flags [.], ack 72168, win 132, options [nop,nop,TS val 3794807638 ecr 1213918942], length 0
10:46:20.499224 IP 10.8.3.2.42378 > 45.113.130.25.1935: Flags [.], seq 88200:89514, ack 0, win 501, options [nop,nop,TS val 1213919573 ecr 3794807638], length 1314
10:46:20.534120 IP 10.8.3.2.42378 > 45.113.130.25.1935: Flags [.], seq 89514:90828, ack 0, win 501, options [nop,nop,TS val 1213919608 ecr 3794807638], length 1314
10:46:20.551626 IP 45.113.130.25.1935 > 10.8.3.2.42378: Flags [.], ack 74796, win 132, options [nop,nop,TS val 3794807737 ecr 1213919043], length 0
10:46:20.569179 IP 10.8.3.2.42378 > 45.113.130.25.1935: Flags [.], seq 90828:92142, ack 0, win 501, options [nop,nop,TS val 1213919643 ecr 3794807737], length 1314
10:46:20.608971 IP 45.113.130.25.1935 > 10.8.3.2.42378: Flags [.], ack 76374, win 133, options [nop,nop,TS val 3794807798 ecr 1213919108], length 0
10:46:20.608984 IP 10.8.3.2.42378 > 45.113.130.25.1935: Flags [P.], seq 92142:93146, ack 0, win 501, options [nop,nop,TS val 1213919683 ecr 3794807798], length 1004
10:46:20.665173 IP 10.8.3.2.42378 > 45.113.130.25.1935: Flags [.], seq 93146:94460, ack 0, win 501, options [nop,nop,TS val 1213919739 ecr 3794807798], length 1314
10:46:20.683817 IP 45.113.130.25.1935 > 10.8.3.2.42378: Flags [.], ack 79002, win 133, options [nop,nop,TS val 3794807871 ecr 1213919175], length 0
10:46:20.701466 IP 10.8.3.2.42378 > 45.113.130.25.1935: Flags [.], seq 94460:95774, ack 0, win 501, options [nop,nop,TS val 1213919775 ecr 3794807871], length 1314
10:46:20.735668 IP 10.8.3.2.42378 > 45.113.130.25.1935: Flags [.], seq 95774:97088, ack 0, win 501, options [nop,nop,TS val 1213919809 ecr 3794807871], length 1314
10:46:20.783418 IP 45.113.130.25.1935 > 10.8.3.2.42378: Flags [.], ack 81630, win 133, options [nop,nop,TS val 3794807972 ecr 1213919258], length 0
10:46:20.799006 IP 10.8.3.2.42378 > 45.113.130.25.1935: Flags [.], seq 97088:98402, ack 0, win 501, options [nop,nop,TS val 1213919873 ecr 3794807972], length 1314
10:46:20.833060 IP 10.8.3.2.42378 > 45.113.130.25.1935: Flags [.], seq 98402:99716, ack 0, win 501, options [nop,nop,TS val 1213919907 ecr 3794807972], length 1314
10:46:20.862899 IP 45.113.130.25.1935 > 10.8.3.2.42378: Flags [.], ack 84258, win 133, options [nop,nop,TS val 3794808052 ecr 1213919342], length 0
10:46:20.868438 IP 10.8.3.2.42378 > 45.113.130.25.1935: Flags [.], seq 99716:101030, ack 0, win 501, options [nop,nop,TS val 1213919942 ecr 3794808052], length 1314
10:46:20.935595 IP 10.8.3.2.42378 > 45.113.130.25.1935: Flags [.], seq 101030:102344, ack 0, win 501, options [nop,nop,TS val 1213920009 ecr 3794808052], length 1314
10:46:20.948285 IP 45.113.130.25.1935 > 10.8.3.2.42378: Flags [.], ack 86886, win 133, options [nop,nop,TS val 3794808137 ecr 1213919443], length 0
10:46:20.968700 IP 10.8.3.2.42378 > 45.113.130.25.1935: Flags [.], seq 102344:103658, ack 0, win 501, options [nop,nop,TS val 1213920042 ecr 3794808137], length 1314
10:46:21.002400 IP 10.8.3.2.42378 > 45.113.130.25.1935: Flags [.], seq 103658:104972, ack 0, win 501, options [nop,nop,TS val 1213920076 ecr 3794808137], length 1314
10:46:21.045988 IP 45.113.130.25.1935 > 10.8.3.2.42378: Flags [.], ack 89514, win 132, options [nop,nop,TS val 3794808235 ecr 1213919515], length 0
10:46:21.067249 IP 10.8.3.2.42378 > 45.113.130.25.1935: Flags [.], seq 104972:106286, ack 0, win 501, options [nop,nop,TS val 1213920141 ecr 3794808235], length 1314
10:46:21.101671 IP 10.8.3.2.42378 > 45.113.130.25.1935: Flags [.], seq 106286:107600, ack 0, win 501, options [nop,nop,TS val 1213920175 ecr 3794808235], length 1314
10:46:21.116293 IP 45.113.130.25.1935 > 10.8.3.2.42378: Flags [.], ack 92142, win 132, options [nop,nop,TS val 3794808305 ecr 1213919608], length 0
10:46:21.135143 IP 10.8.3.2.42378 > 45.113.130.25.1935: Flags [.], seq 107600:108914, ack 0, win 501, options [nop,nop,TS val 1213920209 ecr 3794808305], length 1314
10:46:21.159724 IP 45.113.130.25.1935 > 10.8.3.2.42378: Flags [.], ack 93146, win 133, options [nop,nop,TS val 3794808349 ecr 1213919683], length 0
10:46:21.159759 IP 10.8.3.2.42378 > 45.113.130.25.1935: Flags [P.], seq 108914:109162, ack 0, win 501, options [nop,nop,TS val 1213920233 ecr 3794808349], length 248
10:46:21.200133 IP 10.8.3.2.42378 > 45.113.130.25.1935: Flags [.], seq 109162:110476, ack 0, win 501, options [nop,nop,TS val 1213920274 ecr 3794808349], length 1314
10:46:21.235437 IP 10.8.3.2.42378 > 45.113.130.25.1935: Flags [.], seq 110476:111790, ack 0, win 501, options [nop,nop,TS val 1213920309 ecr 3794808349], length 1314
10:46:21.249463 IP 45.113.130.25.1935 > 10.8.3.2.42378: Flags [.], ack 95774, win 133, options [nop,nop,TS val 3794808438 ecr 1213919739], length 0
10:46:21.275538 IP 10.8.3.2.42378 > 45.113.130.25.1935: Flags [.], seq 111790:113104, ack 0, win 501, options [nop,nop,TS val 1213920349 ecr 3794808438], length 1314
10:46:21.333813 IP 10.8.3.2.42378 > 45.113.130.25.1935: Flags [.], seq 113104:114418, ack 0, win 501, options [nop,nop,TS val 1213920408 ecr 3794808438], length 1314
10:46:21.345770 IP 45.113.130.25.1935 > 10.8.3.2.42378: Flags [.], ack 98402, win 132, options [nop,nop,TS val 3794808535 ecr 1213919809], length 0
10:46:21.367801 IP 10.8.3.2.42378 > 45.113.130.25.1935: Flags [.], seq 114418:115732, ack 0, win 501, options [nop,nop,TS val 1213920441 ecr 3794808535], length 1314
10:46:21.404142 IP 10.8.3.2.42378 > 45.113.130.25.1935: Flags [.], seq 115732:117046, ack 0, win 501, options [nop,nop,TS val 1213920478 ecr 3794808535], length 1314
10:46:21.415481 IP 45.113.130.25.1935 > 10.8.3.2.42378: Flags [.], ack 101030, win 132, options [nop,nop,TS val 3794808604 ecr 1213919907], length 0
10:46:21.468399 IP 10.8.3.2.42378 > 45.113.130.25.1935: Flags [.], seq 117046:118360, ack 0, win 501, options [nop,nop,TS val 1213920542 ecr 3794808604], length 1314
10:46:21.499454 IP 10.8.3.2.42378 > 45.113.130.25.1935: Flags [.], seq 118360:119674, ack 0, win 501, options [nop,nop,TS val 1213920573 ecr 3794808604], length 1314
10:46:21.515833 IP 45.113.130.25.1935 > 10.8.3.2.42378: Flags [.], ack 103658, win 132, options [nop,nop,TS val 3794808705 ecr 1213920009], length 0
10:46:21.533394 IP 10.8.3.2.42378 > 45.113.130.25.1935: Flags [.], seq 119674:120988, ack 0, win 501, options [nop,nop,TS val 1213920607 ecr 3794808705], length 1314
10:46:21.598023 IP 10.8.3.2.42378 > 45.113.130.25.1935: Flags [.], seq 120988:122302, ack 0, win 501, options [nop,nop,TS val 1213920672 ecr 3794808705], length 1314
10:46:21.613980 IP 45.113.130.25.1935 > 10.8.3.2.42378: Flags [.], ack 106286, win 132, options [nop,nop,TS val 3794808803 ecr 1213920076], length 0
10:46:21.633363 IP 10.8.3.2.42378 > 45.113.130.25.1935: Flags [.], seq 122302:123616, ack 0, win 501, options [nop,nop,TS val 1213920707 ecr 3794808803], length 1314
10:46:21.668706 IP 10.8.3.2.42378 > 45.113.130.25.1935: Flags [.], seq 123616:124930, ack 0, win 501, options [nop,nop,TS val 1213920742 ecr 3794808803], length 1314
10:46:21.682063 IP 45.113.130.25.1935 > 10.8.3.2.42378: Flags [.], ack 108914, win 132, options [nop,nop,TS val 3794808871 ecr 1213920175], length 0
10:46:21.706412 IP 45.113.130.25.1935 > 10.8.3.2.42378: Flags [.], ack 109162, win 133, options [nop,nop,TS val 3794808896 ecr 1213920233], length 0
10:46:21.706443 IP 10.8.3.2.42378 > 45.113.130.25.1935: Flags [P.], seq 124930:126042, ack 0, win 501, options [nop,nop,TS val 1213920780 ecr 3794808896], length 1112
10:46:21.768720 IP 10.8.3.2.42378 > 45.113.130.25.1935: Flags [.], seq 126042:127356, ack 0, win 501, options [nop,nop,TS val 1213920842 ecr 3794808896], length 1314
10:46:21.782436 IP 45.113.130.25.1935 > 10.8.3.2.42378: Flags [.], ack 111790, win 133, options [nop,nop,TS val 3794808972 ecr 1213920274], length 0
10:46:21.802341 IP 10.8.3.2.42378 > 45.113.130.25.1935: Flags [.], seq 127356:128670, ack 0, win 501, options [nop,nop,TS val 1213920876 ecr 3794808972], length 1314
10:46:21.835674 IP 10.8.3.2.42378 > 45.113.130.25.1935: Flags [.], seq 128670:129984, ack 0, win 501, options [nop,nop,TS val 1213920909 ecr 3794808972], length 1314
10:46:21.880808 IP 45.113.130.25.1935 > 10.8.3.2.42378: Flags [.], ack 114418, win 132, options [nop,nop,TS val 3794809070 ecr 1213920349], length 0
10:46:21.901578 IP 10.8.3.2.42378 > 45.113.130.25.1935: Flags [.], seq 129984:131298, ack 0, win 501, options [nop,nop,TS val 1213920975 ecr 3794809070], length 1314
10:46:21.939042 IP 10.8.3.2.42378 > 45.113.130.25.1935: Flags [.], seq 131298:132612, ack 0, win 501, options [nop,nop,TS val 1213921013 ecr 3794809070], length 1314
10:46:21.950822 IP 45.113.130.25.1935 > 10.8.3.2.42378: Flags [.], ack 117046, win 132, options [nop,nop,TS val 3794809140 ecr 1213920441], length 0
10:46:21.968767 IP 10.8.3.2.42378 > 45.113.130.25.1935: Flags [.], seq 132612:133926, ack 0, win 501, options [nop,nop,TS val 1213921042 ecr 3794809140], length 1314
10:46:22.035518 IP 10.8.3.2.42378 > 45.113.130.25.1935: Flags [.], seq 133926:135240, ack 0, win 501, options [nop,nop,TS val 1213921109 ecr 3794809140], length 1314
10:46:22.046692 IP 45.113.130.25.1935 > 10.8.3.2.42378: Flags [.], ack 119674, win 132, options [nop,nop,TS val 3794809236 ecr 1213920542], length 0
10:46:22.068844 IP 10.8.3.2.42378 > 45.113.130.25.1935: Flags [.], seq 135240:136554, ack 0, win 501, options [nop,nop,TS val 1213921143 ecr 3794809236], length 1314
10:46:22.102114 IP 10.8.3.2.42378 > 45.113.130.25.1935: Flags [.], seq 136554:137868, ack 0, win 501, options [nop,nop,TS val 1213921176 ecr 3794809236], length 1314
10:46:22.145253 IP 45.113.130.25.1935 > 10.8.3.2.42378: Flags [.], ack 122302, win 132, options [nop,nop,TS val 3794809334 ecr 1213920607], length 0
10:46:22.166843 IP 10.8.3.2.42378 > 45.113.130.25.1935: Flags [.], seq 137868:139182, ack 0, win 501, options [nop,nop,TS val 1213921241 ecr 3794809334], length 1314
10:46:22.202106 IP 10.8.3.2.42378 > 45.113.130.25.1935: Flags [.], seq 139182:140496, ack 0, win 501, options [nop,nop,TS val 1213921276 ecr 3794809334], length 1314
10:46:22.216055 IP 45.113.130.25.1935 > 10.8.3.2.42378: Flags [.], ack 124930, win 132, options [nop,nop,TS val 3794809405 ecr 1213920707], length 0
10:46:22.239424 IP 10.8.3.2.42378 > 45.113.130.25.1935: Flags [.], seq 140496:141810, ack 0, win 501, options [nop,nop,TS val 1213921313 ecr 3794809405], length 1314
10:46:22.253437 IP 45.113.130.25.1935 > 10.8.3.2.42378: Flags [.], ack 126042, win 133, options [nop,nop,TS val 3794809443 ecr 1213920780], length 0
10:46:22.253463 IP 10.8.3.2.42378 > 45.113.130.25.1935: Flags [P.], seq 141810:141971, ack 0, win 501, options [nop,nop,TS val 1213921327 ecr 3794809443], length 161
10:46:22.303246 IP 10.8.3.2.42378 > 45.113.130.25.1935: Flags [.], seq 141971:143285, ack 0, win 501, options [nop,nop,TS val 1213921377 ecr 3794809443], length 1314
10:46:22.333136 IP 10.8.3.2.42378 > 45.113.130.25.1935: Flags [.], seq 143285:144599, ack 0, win 501, options [nop,nop,TS val 1213921407 ecr 3794809443], length 1314
10:46:22.349146 IP 45.113.130.25.1935 > 10.8.3.2.42378: Flags [.], ack 128670, win 133, options [nop,nop,TS val 3794809538 ecr 1213920842], length 0
10:46:22.367031 IP 10.8.3.2.42378 > 45.113.130.25.1935: Flags [.], seq 144599:145913, ack 0, win 501, options [nop,nop,TS val 1213921441 ecr 3794809538], length 1314
10:46:22.435263 IP 10.8.3.2.42378 > 45.113.130.25.1935: Flags [.], seq 145913:147227, ack 0, win 501, options [nop,nop,TS val 1213921509 ecr 3794809538], length 1314
10:46:22.448525 IP 45.113.130.25.1935 > 10.8.3.2.42378: Flags [.], ack 131298, win 132, options [nop,nop,TS val 3794809638 ecr 1213920909], length 0
10:46:22.474196 IP 10.8.3.2.42378 > 45.113.130.25.1935: Flags [.], seq 147227:148541, ack 0, win 501, options [nop,nop,TS val 1213921548 ecr 3794809638], length 1314
10:46:22.501873 IP 10.8.3.2.42378 > 45.113.130.25.1935: Flags [.], seq 148541:149855, ack 0, win 501, options [nop,nop,TS val 1213921576 ecr 3794809638], length 1314
10:46:22.515698 IP 45.113.130.25.1935 > 10.8.3.2.42378: Flags [.], ack 133926, win 132, options [nop,nop,TS val 3794809705 ecr 1213921013], length 0
10:46:22.568218 IP 10.8.3.2.42378 > 45.113.130.25.1935: Flags [.], seq 149855:151169, ack 0, win 501, options [nop,nop,TS val 1213921642 ecr 3794809705], length 1314
10:46:22.602561 IP 10.8.3.2.42378 > 45.113.130.25.1935: Flags [.], seq 151169:152483, ack 0, win 501, options [nop,nop,TS val 1213921676 ecr 3794809705], length 1314
10:46:22.615632 IP 45.113.130.25.1935 > 10.8.3.2.42378: Flags [.], ack 136554, win 132, options [nop,nop,TS val 3794809805 ecr 1213921109], length 0
10:46:22.630978 IP 10.8.3.2.42378 > 45.113.130.25.1935: Flags [.], seq 152483:153797, ack 0, win 501, options [nop,nop,TS val 1213921705 ecr 3794809805], length 1314
10:46:22.701622 IP 10.8.3.2.42378 > 45.113.130.25.1935: Flags [.], seq 153797:155111, ack 0, win 501, options [nop,nop,TS val 1213921775 ecr 3794809805], length 1314
10:46:22.714108 IP 45.113.130.25.1935 > 10.8.3.2.42378: Flags [.], ack 139182, win 132, options [nop,nop,TS val 3794809903 ecr 1213921176], length 0
10:46:22.735225 IP 10.8.3.2.42378 > 45.113.130.25.1935: Flags [.], seq 155111:156425, ack 0, win 501, options [nop,nop,TS val 1213921809 ecr 3794809903], length 1314
10:46:22.773576 IP 10.8.3.2.42378 > 45.113.130.25.1935: Flags [.], seq 156425:157739, ack 0, win 501, options [nop,nop,TS val 1213921847 ecr 3794809903], length 1314
10:46:22.786133 IP 45.113.130.25.1935 > 10.8.3.2.42378: Flags [.], ack 141810, win 132, options [nop,nop,TS val 3794809976 ecr 1213921276], length 0
10:46:22.800301 IP 45.113.130.25.1935 > 10.8.3.2.42378: Flags [.], ack 141971, win 133, options [nop,nop,TS val 3794809990 ecr 1213921327], length 0
10:46:22.800334 IP 10.8.3.2.42378 > 45.113.130.25.1935: Flags [P.], seq 157739:157987, ack 0, win 501, options [nop,nop,TS val 1213921874 ecr 3794809990], length 248
10:46:22.837986 IP 10.8.3.2.42378 > 45.113.130.25.1935: Flags [.], seq 157987:159301, ack 0, win 501, options [nop,nop,TS val 1213921912 ecr 3794809990], length 1314
10:46:22.868490 IP 10.8.3.2.42378 > 45.113.130.25.1935: Flags [.], seq 159301:160615, ack 0, win 501, options [nop,nop,TS val 1213921942 ecr 3794809990], length 1314
10:46:22.880074 IP 45.113.130.25.1935 > 10.8.3.2.42378: Flags [.], ack 144599, win 133, options [nop,nop,TS val 3794810069 ecr 1213921377], length 0
10:46:22.923868 IP 10.8.3.2.42378 > 45.113.130.25.1935: Flags [.], seq 160615:161929, ack 0, win 501, options [nop,nop,TS val 1213921998 ecr 3794810069], length 1314
10:46:22.968413 IP 10.8.3.2.42378 > 45.113.130.25.1935: Flags [.], seq 161929:163243, ack 0, win 501, options [nop,nop,TS val 1213922042 ecr 3794810069], length 1314
10:46:22.982115 IP 45.113.130.25.1935 > 10.8.3.2.42378: Flags [.], ack 147227, win 132, options [nop,nop,TS val 3794810171 ecr 1213921441], length 0
10:46:23.009589 IP 10.8.3.2.42378 > 45.113.130.25.1935: Flags [.], seq 163243:164557, ack 0, win 501, options [nop,nop,TS val 1213922083 ecr 3794810171], length 1314
10:46:23.048508 IP 45.113.130.25.1935 > 10.8.3.2.42378: Flags [.], ack 149855, win 132, options [nop,nop,TS val 3794810238 ecr 1213921548], length 0
10:46:23.051919 IP 10.8.3.2.42378 > 45.113.130.25.1935: Flags [.], seq 164557:165871, ack 0, win 501, options [nop,nop,TS val 1213922126 ecr 3794810238], length 1314
10:46:23.100997 IP 10.8.3.2.42378 > 45.113.130.25.1935: Flags [.], seq 165871:167185, ack 0, win 501, options [nop,nop,TS val 1213922175 ecr 3794810238], length 1314
10:46:23.137586 IP 10.8.3.2.42378 > 45.113.130.25.1935: Flags [.], seq 167185:168499, ack 0, win 501, options [nop,nop,TS val 1213922211 ecr 3794810238], length 1314
10:46:23.149339 IP 45.113.130.25.1935 > 10.8.3.2.42378: Flags [.], ack 152483, win 132, options [nop,nop,TS val 3794810339 ecr 1213921642], length 0
10:46:23.179899 IP 10.8.3.2.42378 > 45.113.130.25.1935: Flags [.], seq 168499:169813, ack 0, win 501, options [nop,nop,TS val 1213922254 ecr 3794810339], length 1314
10:46:23.232351 IP 10.8.3.2.42378 > 45.113.130.25.1935: Flags [.], seq 169813:171127, ack 0, win 501, options [nop,nop,TS val 1213922306 ecr 3794810339], length 1314
10:46:23.233818 IP 45.113.130.25.1935 > 10.8.3.2.42378: Flags [.], ack 153797, win 133, options [nop,nop,TS val 3794810423 ecr 1213921705], length 0
10:46:23.268252 IP 10.8.3.2.42378 > 45.113.130.25.1935: Flags [.], seq 171127:172441, ack 0, win 501, options [nop,nop,TS val 1213922342 ecr 3794810423], length 1314
10:46:23.282234 IP 45.113.130.25.1935 > 10.8.3.2.42378: Flags [.], ack 156425, win 133, options [nop,nop,TS val 3794810471 ecr 1213921775], length 0
10:46:23.308167 IP 10.8.3.2.42378 > 45.113.130.25.1935: Flags [.], seq 172441:173755, ack 0, win 501, options [nop,nop,TS val 1213922382 ecr 3794810471], length 1314
10:46:23.346687 IP 45.113.130.25.1935 > 10.8.3.2.42378: Flags [.], ack 157987, win 133, options [nop,nop,TS val 3794810536 ecr 1213921847], length 0
10:46:23.346720 IP 10.8.3.2.42378 > 45.113.130.25.1935: Flags [P.], seq 173755:174772, ack 0, win 501, options [nop,nop,TS val 1213922420 ecr 3794810536], length 1017
10:46:23.400214 IP 10.8.3.2.42378 > 45.113.130.25.1935: Flags [.], seq 174772:176086, ack 0, win 501, options [nop,nop,TS val 1213922474 ecr 3794810536], length 1314
10:46:23.415220 IP 45.113.130.25.1935 > 10.8.3.2.42378: Flags [.], ack 160615, win 133, options [nop,nop,TS val 3794810604 ecr 1213921912], length 0
10:46:23.436163 IP 10.8.3.2.42378 > 45.113.130.25.1935: Flags [.], seq 176086:177400, ack 0, win 501, options [nop,nop,TS val 1213922510 ecr 3794810604], length 1314
10:46:23.464879 IP 10.8.3.2.42378 > 45.113.130.25.1935: Flags [.], seq 177400:178714, ack 0, win 501, options [nop,nop,TS val 1213922539 ecr 3794810604], length 1314
10:46:23.516503 IP 45.113.130.25.1935 > 10.8.3.2.42378: Flags [.], ack 163243, win 133, options [nop,nop,TS val 3794810706 ecr 1213921998], length 0
10:46:23.542908 IP 10.8.3.2.42378 > 45.113.130.25.1935: Flags [.], seq 178714:180028, ack 0, win 501, options [nop,nop,TS val 1213922617 ecr 3794810706], length 1314
10:46:23.565444 IP 10.8.3.2.42378 > 45.113.130.25.1935: Flags [.], seq 180028:181342, ack 0, win 501, options [nop,nop,TS val 1213922639 ecr 3794810706], length 1314
10:46:23.598796 IP 45.113.130.25.1935 > 10.8.3.2.42378: Flags [.], ack 165871, win 133, options [nop,nop,TS val 3794810788 ecr 1213922083], length 0
10:46:23.606990 IP 10.8.3.2.42378 > 45.113.130.25.1935: Flags [.], seq 181342:182656, ack 0, win 501, options [nop,nop,TS val 1213922681 ecr 3794810788], length 1314
10:46:23.671396 IP 10.8.3.2.42378 > 45.113.130.25.1935: Flags [.], seq 182656:183970, ack 0, win 501, options [nop,nop,TS val 1213922745 ecr 3794810788], length 1314
10:46:23.684881 IP 45.113.130.25.1935 > 10.8.3.2.42378: Flags [.], ack 168499, win 133, options [nop,nop,TS val 3794810874 ecr 1213922175], length 0
10:46:23.701932 IP 10.8.3.2.42378 > 45.113.130.25.1935: Flags [.], seq 183970:185284, ack 0, win 501, options [nop,nop,TS val 1213922776 ecr 3794810874], length 1314
10:46:23.735393 IP 10.8.3.2.42378 > 45.113.130.25.1935: Flags [.], seq 185284:186598, ack 0, win 501, options [nop,nop,TS val 1213922809 ecr 3794810874], length 1314
10:46:23.779429 IP 45.113.130.25.1935 > 10.8.3.2.42378: Flags [.], ack 171127, win 133, options [nop,nop,TS val 3794810969 ecr 1213922254], length 0
10:46:23.801777 IP 10.8.3.2.42378 > 45.113.130.25.1935: Flags [.], seq 186598:187912, ack 0, win 501, options [nop,nop,TS val 1213922875 ecr 3794810969], length 1314
10:46:23.842661 IP 10.8.3.2.42378 > 45.113.130.25.1935: Flags [.], seq 187912:189226, ack 0, win 501, options [nop,nop,TS val 1213922916 ecr 3794810969], length 1314
10:46:23.855171 IP 45.113.130.25.1935 > 10.8.3.2.42378: Flags [.], ack 173755, win 133, options [nop,nop,TS val 3794811044 ecr 1213922342], length 0
10:46:23.867142 IP 10.8.3.2.42378 > 45.113.130.25.1935: Flags [.], seq 189226:190540, ack 0, win 501, options [nop,nop,TS val 1213922941 ecr 3794811044], length 1314
10:46:23.893917 IP 45.113.130.25.1935 > 10.8.3.2.42378: Flags [.], ack 174772, win 133, options [nop,nop,TS val 3794811083 ecr 1213922420], length 0
10:46:23.893963 IP 10.8.3.2.42378 > 45.113.130.25.1935: Flags [P.], seq 190540:190796, ack 0, win 501, options [nop,nop,TS val 1213922968 ecr 3794811083], length 256
10:46:23.935383 IP 10.8.3.2.42378 > 45.113.130.25.1935: Flags [.], seq 190796:192110, ack 0, win 501, options [nop,nop,TS val 1213923009 ecr 3794811083], length 1314
10:46:23.971387 IP 10.8.3.2.42378 > 45.113.130.25.1935: Flags [.], seq 192110:193424, ack 0, win 501, options [nop,nop,TS val 1213923045 ecr 3794811083], length 1314
10:46:23.982858 IP 45.113.130.25.1935 > 10.8.3.2.42378: Flags [.], ack 177400, win 133, options [nop,nop,TS val 3794811172 ecr 1213922474], length 0
10:46:24.014026 IP 10.8.3.2.42378 > 45.113.130.25.1935: Flags [.], seq 193424:194738, ack 0, win 501, options [nop,nop,TS val 1213923088 ecr 3794811172], length 1314
10:46:24.077662 IP 10.8.3.2.42378 > 45.113.130.25.1935: Flags [.], seq 194738:196052, ack 0, win 501, options [nop,nop,TS val 1213923151 ecr 3794811172], length 1314
10:46:24.081414 IP 45.113.130.25.1935 > 10.8.3.2.42378: Flags [.], ack 178714, win 133, options [nop,nop,TS val 3794811271 ecr 1213922539], length 0
10:46:24.102111 IP 10.8.3.2.42378 > 45.113.130.25.1935: Flags [.], seq 196052:197366, ack 0, win 501, options [nop,nop,TS val 1213923176 ecr 3794811271], length 1314
10:46:24.112271 IP 45.113.130.25.1935 > 10.8.3.2.42378: Flags [.], ack 181342, win 133, options [nop,nop,TS val 3794811302 ecr 1213922617], length 0
10:46:24.142528 IP 10.8.3.2.42378 > 45.113.130.25.1935: Flags [.], seq 197366:198680, ack 0, win 501, options [nop,nop,TS val 1213923216 ecr 3794811302], length 1314
10:46:24.206845 IP 10.8.3.2.42378 > 45.113.130.25.1935: Flags [.], seq 198680:199994, ack 0, win 501, options [nop,nop,TS val 1213923281 ecr 3794811302], length 1314
10:46:24.218211 IP 45.113.130.25.1935 > 10.8.3.2.42378: Flags [.], ack 183970, win 132, options [nop,nop,TS val 3794811407 ecr 1213922681], length 0
10:46:24.230939 IP 10.8.3.2.42378 > 45.113.130.25.1935: Flags [.], seq 199994:201308, ack 0, win 501, options [nop,nop,TS val 1213923305 ecr 3794811407], length 1314
10:46:24.270346 IP 10.8.3.2.42378 > 45.113.130.25.1935: Flags [.], seq 201308:202622, ack 0, win 501, options [nop,nop,TS val 1213923344 ecr 3794811407], length 1314
10:46:24.282234 IP 45.113.130.25.1935 > 10.8.3.2.42378: Flags [.], ack 186598, win 132, options [nop,nop,TS val 3794811471 ecr 1213922776], length 0
10:46:24.335337 IP 10.8.3.2.42378 > 45.113.130.25.1935: Flags [.], seq 202622:203936, ack 0, win 501, options [nop,nop,TS val 1213923409 ecr 3794811471], length 1314
10:46:24.377266 IP 10.8.3.2.42378 > 45.113.130.25.1935: Flags [.], seq 203936:205250, ack 0, win 501, options [nop,nop,TS val 1213923451 ecr 3794811471], length 1314
10:46:24.389684 IP 45.113.130.25.1935 > 10.8.3.2.42378: Flags [.], ack 189226, win 132, options [nop,nop,TS val 3794811579 ecr 1213922875], length 0
10:46:24.399235 IP 10.8.3.2.42378 > 45.113.130.25.1935: Flags [.], seq 205250:206564, ack 0, win 501, options [nop,nop,TS val 1213923473 ecr 3794811579], length 1314
10:46:24.440438 IP 45.113.130.25.1935 > 10.8.3.2.42378: Flags [.], ack 190796, win 133, options [nop,nop,TS val 3794811630 ecr 1213922941], length 0
10:46:24.440457 IP 10.8.3.2.42378 > 45.113.130.25.1935: Flags [P.], seq 206564:206812, ack 0, win 501, options [nop,nop,TS val 1213923514 ecr 3794811630], length 248
10:46:24.466716 IP 10.8.3.2.42378 > 45.113.130.25.1935: Flags [.], seq 206812:208126, ack 0, win 501, options [nop,nop,TS val 1213923540 ecr 3794811630], length 1314
10:46:24.505426 IP 10.8.3.2.42378 > 45.113.130.25.1935: Flags [.], seq 208126:209440, ack 0, win 501, options [nop,nop,TS val 1213923579 ecr 3794811630], length 1314
10:46:24.518492 IP 45.113.130.25.1935 > 10.8.3.2.42378: Flags [.], ack 193424, win 133, options [nop,nop,TS val 3794811708 ecr 1213923009], length 0
10:46:24.565511 IP 10.8.3.2.42378 > 45.113.130.25.1935: Flags [.], seq 209440:210754, ack 0, win 501, options [nop,nop,TS val 1213923639 ecr 3794811708], length 1314
10:46:24.611845 IP 10.8.3.2.42378 > 45.113.130.25.1935: Flags [.], seq 210754:212068, ack 0, win 501, options [nop,nop,TS val 1213923686 ecr 3794811708], length 1314
10:46:24.624575 IP 45.113.130.25.1935 > 10.8.3.2.42378: Flags [.], ack 196052, win 132, options [nop,nop,TS val 3794811814 ecr 1213923088], length 0
10:46:24.635104 IP 10.8.3.2.42378 > 45.113.130.25.1935: Flags [.], seq 212068:213382, ack 0, win 501, options [nop,nop,TS val 1213923709 ecr 3794811814], length 1314
10:46:24.689526 IP 45.113.130.25.1935 > 10.8.3.2.42378: Flags [.], ack 198680, win 132, options [nop,nop,TS val 3794811879 ecr 1213923176], length 0
10:46:24.697862 IP 10.8.3.2.42378 > 45.113.130.25.1935: Flags [.], seq 213382:214696, ack 0, win 501, options [nop,nop,TS val 1213923772 ecr 3794811879], length 1314
10:46:24.740935 IP 10.8.3.2.42378 > 45.113.130.25.1935: Flags [.], seq 214696:216010, ack 0, win 501, options [nop,nop,TS val 1213923815 ecr 3794811879], length 1314
10:46:24.768462 IP 10.8.3.2.42378 > 45.113.130.25.1935: Flags [.], seq 216010:217324, ack 0, win 501, options [nop,nop,TS val 1213923842 ecr 3794811879], length 1314
10:46:24.780092 IP 45.113.130.25.1935 > 10.8.3.2.42378: Flags [.], ack 201308, win 132, options [nop,nop,TS val 3794811967 ecr 1213923281], length 0
10:46:24.826507 IP 10.8.3.2.42378 > 45.113.130.25.1935: Flags [.], seq 217324:218638, ack 0, win 501, options [nop,nop,TS val 1213923900 ecr 3794811967], length 1314
10:46:24.869462 IP 10.8.3.2.42378 > 45.113.130.25.1935: Flags [.], seq 218638:219952, ack 0, win 501, options [nop,nop,TS val 1213923943 ecr 3794811967], length 1314
10:46:24.882111 IP 45.113.130.25.1935 > 10.8.3.2.42378: Flags [.], ack 203936, win 132, options [nop,nop,TS val 3794812071 ecr 1213923344], length 0
