21:47:20.295594 IP 99.181.88.116.1935 > 10.8.3.3.55728: Flags [.], ack 2530502811, win 135, options [nop,nop,TS val 3765961981 ecr 2718296010], length 0
21:47:20.323871 IP 10.8.3.3.55728 > 99.181.88.116.1935: Flags [.], seq 17334:18648, ack 0, win 501, options [nop,nop,TS val 2718296643 ecr 3765961981], length 1314
21:47:20.334204 IP 99.181.88.116.1935 > 10.8.3.3.55728: Flags [.], ack 2629, win 135, options [nop,nop,TS val 3765962020 ecr 2718296076], length 0
21:47:20.361712 IP 10.8.3.3.55728 > 99.181.88.116.1935: Flags [.], seq 18648:19962, ack 0, win 501, options [nop,nop,TS val 2718296680 ecr 3765962020], length 1314
21:47:20.423900 IP 10.8.3.3.55728 > 99.181.88.116.1935: Flags [.], seq 19962:21276, ack 0, win 501, options [nop,nop,TS val 2718296743 ecr 3765962020], length 1314
21:47:20.436562 IP 99.181.88.116.1935 > 10.8.3.3.55728: Flags [.], ack 5257, win 135, options [nop,nop,TS val 3765962122 ecr 2718296139], length 0
21:47:20.457675 IP 10.8.3.3.55728 > 99.181.88.116.1935: Flags [.], seq 21276:22590, ack 0, win 501, options [nop,nop,TS val 2718296776 ecr 3765962122], length 1314
21:47:20.490750 IP 10.8.3.3.55728 > 99.181.88.116.1935: Flags [.], seq 22590:23904, ack 0, win 501, options [nop,nop,TS val 2718296809 ecr 3765962122], length 1314
21:47:20.501188 IP 99.181.88.116.1935 > 10.8.3.3.55728: Flags [.], ack 7885, win 135, options [nop,nop,TS val 3765962187 ecr 2718296243], length 0
21:47:20.536382 IP 99.181.88.116.1935 > 10.8.3.3.55728: Flags [.], ack 8136, win 136, options [nop,nop,TS val 3765962222 ecr 2718296305], length 0
21:47:20.536405 IP 10.8.3.3.55728 > 99.181.88.116.1935: Flags [P.], seq 23904:25016, ack 0, win 501, options [nop,nop,TS val 2718296855 ecr 3765962222], length 1112
21:47:20.590787 IP 10.8.3.3.55728 > 99.181.88.116.1935: Flags [.], seq 25016:26330, ack 0, win 501, options [nop,nop,TS val 2718296909 ecr 3765962222], length 1314
21:47:20.601600 IP 99.181.88.116.1935 > 10.8.3.3.55728: Flags [.], ack 10764, win 135, options [nop,nop,TS val 3765962287 ecr 2718296338], length 0
21:47:20.621610 IP 10.8.3.3.55728 > 99.181.88.116.1935: Flags [.], seq 26330:27644, ack 0, win 501, options [nop,nop,TS val 2718296940 ecr 3765962287], length 1314
21:47:20.662010 IP 10.8.3.3.55728 > 99.181.88.116.1935: Flags [.], seq 27644:28958, ack 0, win 501, options [nop,nop,TS val 2718296981 ecr 3765962287], length 1314
21:47:20.701451 IP 99.181.88.116.1935 > 10.8.3.3.55728: Flags [.], ack 13392, win 135, options [nop,nop,TS val 3765962387 ecr 2718296424], length 0
21:47:20.722547 IP 10.8.3.3.55728 > 99.181.88.116.1935: Flags [.], seq 28958:30272, ack 0, win 501, options [nop,nop,TS val 2718297041 ecr 3765962387], length 1314
21:47:20.753333 IP 10.8.3.3.55728 > 99.181.88.116.1935: Flags [.], seq 30272:31586, ack 0, win 501, options [nop,nop,TS val 2718297072 ecr 3765962387], length 1314
21:47:20.778755 IP 99.181.88.116.1935 > 10.8.3.3.55728: Flags [.], ack 16020, win 135, options [nop,nop,TS val 3765962464 ecr 2718296508], length 0
21:47:20.789661 IP 10.8.3.3.55728 > 99.181.88.116.1935: Flags [.], seq 31586:32900, ack 0, win 501, options [nop,nop,TS val 2718297108 ecr 3765962464], length 1314
21:47:20.855246 IP 10.8.3.3.55728 > 99.181.88.116.1935: Flags [.], seq 32900:34214, ack 0, win 501, options [nop,nop,TS val 2718297174 ecr 3765962464], length 1314
21:47:20.869718 IP 99.181.88.116.1935 > 10.8.3.3.55728: Flags [.], ack 18648, win 135, options [nop,nop,TS val 3765962555 ecr 2718296609], length 0
21:47:20.886830 IP 10.8.3.3.55728 > 99.181.88.116.1935: Flags [.], seq 34214:35528, ack 0, win 501, options [nop,nop,TS val 2718297206 ecr 3765962555], length 1314
21:47:20.921609 IP 10.8.3.3.55728 > 99.181.88.116.1935: Flags [.], seq 35528:36842, ack 0, win 501, options [nop,nop,TS val 2718297240 ecr 3765962555], length 1314
21:47:20.969903 IP 99.181.88.116.1935 > 10.8.3.3.55728: Flags [.], ack 21276, win 135, options [nop,nop,TS val 3765962655 ecr 2718296680], length 0
21:47:20.987837 IP 10.8.3.3.55728 > 99.181.88.116.1935: Flags [.], seq 36842:38156, ack 0, win 501, options [nop,nop,TS val 2718297307 ecr 3765962655], length 1314
21:47:21.020830 IP 10.8.3.3.55728 > 99.181.88.116.1935: Flags [.], seq 38156:39470, ack 0, win 501, options [nop,nop,TS val 2718297340 ecr 3765962655], length 1314
21:47:21.036787 IP 99.181.88.116.1935 > 10.8.3.3.55728: Flags [.], ack 23904, win 135, options [nop,nop,TS val 3765962722 ecr 2718296776], length 0
21:47:21.056081 IP 10.8.3.3.55728 > 99.181.88.116.1935: Flags [.], seq 39470:40784, ack 0, win 501, options [nop,nop,TS val 2718297375 ecr 3765962722], length 1314
21:47:21.082289 IP 99.181.88.116.1935 > 10.8.3.3.55728: Flags [.], ack 25016, win 136, options [nop,nop,TS val 3765962768 ecr 2718296855], length 0
21:47:21.082325 IP 10.8.3.3.55728 > 99.181.88.116.1935: Flags [P.], seq 40784:40940, ack 0, win 501, options [nop,nop,TS val 2718297401 ecr 3765962768], length 156
21:47:21.124094 IP 10.8.3.3.55728 > 99.181.88.116.1935: Flags [.], seq 40940:42254, ack 0, win 501, options [nop,nop,TS val 2718297443 ecr 3765962768], length 1314
21:47:21.158486 IP 10.8.3.3.55728 > 99.181.88.116.1935: Flags [.], seq 42254:43568, ack 0, win 501, options [nop,nop,TS val 2718297477 ecr 3765962768], length 1314
21:47:21.167449 IP 99.181.88.116.1935 > 10.8.3.3.55728: Flags [.], ack 27644, win 136, options [nop,nop,TS val 3765962853 ecr 2718296909], length 0
21:47:21.194638 IP 10.8.3.3.55728 > 99.181.88.116.1935: Flags [.], seq 43568:44882, ack 0, win 501, options [nop,nop,TS val 2718297513 ecr 3765962853], length 1314
21:47:21.257793 IP 10.8.3.3.55728 > 99.181.88.116.1935: Flags [.], seq 44882:46196, ack 0, win 501, options [nop,nop,TS val 2718297576 ecr 3765962853], length 1314
21:47:21.268429 IP 99.181.88.116.1935 > 10.8.3.3.55728: Flags [.], ack 30272, win 135, options [nop,nop,TS val 3765962954 ecr 2718296981], length 0
21:47:21.290702 IP 10.8.3.3.55728 > 99.181.88.116.1935: Flags [.], seq 46196:47510, ack 0, win 501, options [nop,nop,TS val 2718297609 ecr 3765962954], length 1314
21:47:21.324266 IP 10.8.3.3.55728 > 99.181.88.116.1935: Flags [.], seq 47510:48824, ack 0, win 501, options [nop,nop,TS val 2718297643 ecr 3765962954], length 1314
21:47:21.335629 IP 99.181.88.116.1935 > 10.8.3.3.55728: Flags [.], ack 32900, win 135, options [nop,nop,TS val 3765963021 ecr 2718297072], length 0
21:47:21.391046 IP 10.8.3.3.55728 > 99.181.88.116.1935: Flags [.], seq 48824:50138, ack 0, win 501, options [nop,nop,TS val 2718297710 ecr 3765963021], length 1314
21:47:21.424854 IP 10.8.3.3.55728 > 99.181.88.116.1935: Flags [.], seq 50138:51452, ack 0, win 501, options [nop,nop,TS val 2718297744 ecr 3765963021], length 1314
21:47:21.432611 IP 99.181.88.116.1935 > 10.8.3.3.55728: Flags [.], ack 35528, win 135, options [nop,nop,TS val 3765963118 ecr 2718297174], length 0
21:47:21.455709 IP 10.8.3.3.55728 > 99.181.88.116.1935: Flags [.], seq 51452:52766, ack 0, win 501, options [nop,nop,TS val 2718297774 ecr 3765963118], length 1314
21:47:21.522466 IP 10.8.3.3.55728 > 99.181.88.116.1935: Flags [.], seq 52766:54080, ack 0, win 501, options [nop,nop,TS val 2718297841 ecr 3765963118], length 1314
21:47:21.536694 IP 99.181.88.116.1935 > 10.8.3.3.55728: Flags [.], ack 38156, win 135, options [nop,nop,TS val 3765963222 ecr 2718297240], length 0
21:47:21.554312 IP 10.8.3.3.55728 > 99.181.88.116.1935: Flags [.], seq 54080:55394, ack 0, win 501, options [nop,nop,TS val 2718297873 ecr 3765963222], length 1314
21:47:21.588047 IP 10.8.3.3.55728 > 99.181.88.116.1935: Flags [.], seq 55394:56708, ack 0, win 501, options [nop,nop,TS val 2718297907 ecr 3765963222], length 1314
21:47:21.601774 IP 99.181.88.116.1935 > 10.8.3.3.55728: Flags [.], ack 40784, win 135, options [nop,nop,TS val 3765963287 ecr 2718297340], length 0
21:47:21.627865 IP 99.181.88.116.1935 > 10.8.3.3.55728: Flags [.], ack 40940, win 136, options [nop,nop,TS val 3765963313 ecr 2718297401], length 0
21:47:21.627905 IP 10.8.3.3.55728 > 99.181.88.116.1935: Flags [P.], seq 56708:57809, ack 0, win 501, options [nop,nop,TS val 2718297947 ecr 3765963313], length 1101
21:47:21.689276 IP 10.8.3.3.55728 > 99.181.88.116.1935: Flags [.], seq 57809:59123, ack 0, win 501, options [nop,nop,TS val 2718298008 ecr 3765963313], length 1314
21:47:21.704836 IP 99.181.88.116.1935 > 10.8.3.3.55728: Flags [.], ack 43568, win 135, options [nop,nop,TS val 3765963390 ecr 2718297443], length 0
21:47:21.722751 IP 10.8.3.3.55728 > 99.181.88.116.1935: Flags [.], seq 59123:60437, ack 0, win 501, options [nop,nop,TS val 2718298041 ecr 3765963390], length 1314
21:47:21.755890 IP 10.8.3.3.55728 > 99.181.88.116.1935: Flags [.], seq 60437:61751, ack 0, win 501, options [nop,nop,TS val 2718298075 ecr 3765963390], length 1314
21:47:21.804024 IP 99.181.88.116.1935 > 10.8.3.3.55728: Flags [.], ack 46196, win 135, options [nop,nop,TS val 3765963489 ecr 2718297513], length 0
21:47:21.823647 IP 10.8.3.3.55728 > 99.181.88.116.1935: Flags [.], seq 61751:63065, ack 0, win 501, options [nop,nop,TS val 2718298142 ecr 3765963489], length 1314
21:47:21.855241 IP 10.8.3.3.55728 > 99.181.88.116.1935: Flags [.], seq 63065:64379, ack 0, win 501, options [nop,nop,TS val 2718298174 ecr 3765963489], length 1314
21:47:21.870125 IP 99.181.88.116.1935 > 10.8.3.3.55728: Flags [.], ack 48824, win 135, options [nop,nop,TS val 3765963556 ecr 2718297609], length 0
21:47:21.888811 IP 10.8.3.3.55728 > 99.181.88.116.1935: Flags [.], seq 64379:65693, ack 0, win 501, options [nop,nop,TS val 2718298208 ecr 3765963556], length 1314
21:47:21.957708 IP 10.8.3.3.55728 > 99.181.88.116.1935: Flags [.], seq 65693:67007, ack 0, win 501, options [nop,nop,TS val 2718298276 ecr 3765963556], length 1314
21:47:21.971023 IP 99.181.88.116.1935 > 10.8.3.3.55728: Flags [.], ack 51452, win 135, options [nop,nop,TS val 3765963656 ecr 2718297710], length 0
21:47:21.991418 IP 10.8.3.3.55728 > 99.181.88.116.1935: Flags [.], seq 67007:68321, ack 0, win 501, options [nop,nop,TS val 2718298310 ecr 3765963656], length 1314
21:47:22.024458 IP 10.8.3.3.55728 > 99.181.88.116.1935: Flags [.], seq 68321:69635, ack 0, win 501, options [nop,nop,TS val 2718298343 ecr 3765963656], length 1314
21:47:22.067600 IP 99.181.88.116.1935 > 10.8.3.3.55728: Flags [.], ack 52766, win 136, options [nop,nop,TS val 3765963753 ecr 2718297774], length 0
21:47:22.089354 IP 10.8.3.3.55728 > 99.181.88.116.1935: Flags [.], seq 69635:70949, ack 0, win 501, options [nop,nop,TS val 2718298408 ecr 3765963753], length 1314
21:47:22.100048 IP 99.181.88.116.1935 > 10.8.3.3.55728: Flags [.], ack 55394, win 136, options [nop,nop,TS val 3765963785 ecr 2718297841], length 0
21:47:22.122552 IP 10.8.3.3.55728 > 99.181.88.116.1935: Flags [.], seq 70949:72263, ack 0, win 501, options [nop,nop,TS val 2718298441 ecr 3765963785], length 1314
21:47:22.155873 IP 10.8.3.3.55728 > 99.181.88.116.1935: Flags [.], seq 72263:73577, ack 0, win 501, options [nop,nop,TS val 2718298475 ecr 3765963785], length 1314
21:47:22.173709 IP 99.181.88.116.1935 > 10.8.3.3.55728: Flags [.], ack 57809, win 136, options [nop,nop,TS val 3765963859 ecr 2718297907], length 0
21:47:22.173740 IP 10.8.3.3.55728 > 99.181.88.116.1935: Flags [P.], seq 73577:73745, ack 0, win 501, options [nop,nop,TS val 2718298492 ecr 3765963859], length 168
21:47:22.223963 IP 10.8.3.3.55728 > 99.181.88.116.1935: Flags [.], seq 73745:75059, ack 0, win 501, options [nop,nop,TS val 2718298543 ecr 3765963859], length 1314
21:47:22.254684 IP 10.8.3.3.55728 > 99.181.88.116.1935: Flags [.], seq 75059:76373, ack 0, win 501, options [nop,nop,TS val 2718298573 ecr 3765963859], length 1314
21:47:22.268634 IP 99.181.88.116.1935 > 10.8.3.3.55728: Flags [.], ack 60437, win 136, options [nop,nop,TS val 3765963954 ecr 2718298008], length 0
21:47:22.288793 IP 10.8.3.3.55728 > 99.181.88.116.1935: Flags [.], seq 76373:77687, ack 0, win 501, options [nop,nop,TS val 2718298607 ecr 3765963954], length 1314
21:47:22.357742 IP 10.8.3.3.55728 > 99.181.88.116.1935: Flags [.], seq 77687:79001, ack 0, win 501, options [nop,nop,TS val 2718298676 ecr 3765963954], length 1314
21:47:22.369477 IP 99.181.88.116.1935 > 10.8.3.3.55728: Flags [.], ack 63065, win 135, options [nop,nop,TS val 3765964055 ecr 2718298075], length 0
21:47:22.391643 IP 10.8.3.3.55728 > 99.181.88.116.1935: Flags [.], seq 79001:80315, ack 0, win 501, options [nop,nop,TS val 2718298710 ecr 3765964055], length 1314
21:47:22.424871 IP 10.8.3.3.55728 > 99.181.88.116.1935: Flags [.], seq 80315:81629, ack 0, win 501, options [nop,nop,TS val 2718298744 ecr 3765964055], length 1314
21:47:22.434661 IP 99.181.88.116.1935 > 10.8.3.3.55728: Flags [.], ack 65693, win 135, options [nop,nop,TS val 3765964120 ecr 2718298174], length 0
21:47:22.488178 IP 10.8.3.3.55728 > 99.181.88.116.1935: Flags [.], seq 81629:82943, ack 0, win 501, options [nop,nop,TS val 2718298807 ecr 3765964120], length 1314
21:47:22.521894 IP 10.8.3.3.55728 > 99.181.88.116.1935: Flags [.], seq 82943:84257, ack 0, win 501, options [nop,nop,TS val 2718298841 ecr 3765964120], length 1314
21:47:22.540463 IP 99.181.88.116.1935 > 10.8.3.3.55728: Flags [.], ack 68321, win 135, options [nop,nop,TS val 3765964226 ecr 2718298276], length 0
21:47:22.557602 IP 10.8.3.3.55728 > 99.181.88.116.1935: Flags [.], seq 84257:85571, ack 0, win 501, options [nop,nop,TS val 2718298876 ecr 3765964226], length 1314
21:47:22.623988 IP 10.8.3.3.55728 > 99.181.88.116.1935: Flags [.], seq 85571:86885, ack 0, win 501, options [nop,nop,TS val 2718298943 ecr 3765964226], length 1314
21:47:22.635128 IP 99.181.88.116.1935 > 10.8.3.3.55728: Flags [.], ack 70949, win 135, options [nop,nop,TS val 3765964320 ecr 2718298343], length 0
21:47:22.655631 IP 10.8.3.3.55728 > 99.181.88.116.1935: Flags [.], seq 86885:88199, ack 0, win 501, options [nop,nop,TS val 2718298974 ecr 3765964320], length 1314
21:47:22.689389 IP 10.8.3.3.55728 > 99.181.88.116.1935: Flags [.], seq 88199:89513, ack 0, win 501, options [nop,nop,TS val 2718299008 ecr 3765964320], length 1314
21:47:22.701881 IP 99.181.88.116.1935 > 10.8.3.3.55728: Flags [.], ack 73577, win 135, options [nop,nop,TS val 3765964387 ecr 2718298441], length 0
21:47:22.722238 IP 99.181.88.116.1935 > 10.8.3.3.55728: Flags [.], ack 73745, win 136, options [nop,nop,TS val 3765964405 ecr 2718298492], length 0
21:47:22.722258 IP 10.8.3.3.55728 > 99.181.88.116.1935: Flags [P.], seq 89513:89766, ack 0, win 501, options [nop,nop,TS val 2718299041 ecr 3765964405], length 253
21:47:22.757054 IP 10.8.3.3.55728 > 99.181.88.116.1935: Flags [.], seq 89766:91080, ack 0, win 501, options [nop,nop,TS val 2718299076 ecr 3765964405], length 1314
21:47:22.787020 IP 10.8.3.3.55728 > 99.181.88.116.1935: Flags [.], seq 91080:92394, ack 0, win 501, options [nop,nop,TS val 2718299106 ecr 3765964405], length 1314
21:47:22.800463 IP 99.181.88.116.1935 > 10.8.3.3.55728: Flags [.], ack 76373, win 136, options [nop,nop,TS val 3765964486 ecr 2718298543], length 0
21:47:22.842498 IP 10.8.3.3.55728 > 99.181.88.116.1935: Flags [.], seq 92394:93708, ack 0, win 501, options [nop,nop,TS val 2718299161 ecr 3765964486], length 1314
21:47:22.888241 IP 10.8.3.3.55728 > 99.181.88.116.1935: Flags [.], seq 93708:95022, ack 0, win 501, options [nop,nop,TS val 2718299207 ecr 3765964486], length 1314
21:47:22.899580 IP 99.181.88.116.1935 > 10.8.3.3.55728: Flags [.], ack 77687, win 136, options [nop,nop,TS val 3765964585 ecr 2718298607], length 0
21:47:22.921746 IP 10.8.3.3.55728 > 99.181.88.116.1935: Flags [.], seq 95022:96336, ack 0, win 501, options [nop,nop,TS val 2718299240 ecr 3765964585], length 1314
21:47:22.937600 IP 99.181.88.116.1935 > 10.8.3.3.55728: Flags [.], ack 80315, win 136, options [nop,nop,TS val 3765964623 ecr 2718298676], length 0
21:47:22.970779 IP 10.8.3.3.55728 > 99.181.88.116.1935: Flags [.], seq 96336:97650, ack 0, win 501, options [nop,nop,TS val 2718299289 ecr 3765964623], length 1314
21:47:23.023757 IP 10.8.3.3.55728 > 99.181.88.116.1935: Flags [.], seq 97650:98964, ack 0, win 501, options [nop,nop,TS val 2718299342 ecr 3765964623], length 1314
21:47:23.034054 IP 99.181.88.116.1935 > 10.8.3.3.55728: Flags [.], ack 82943, win 135, options [nop,nop,TS val 3765964719 ecr 2718298744], length 0
21:47:23.056606 IP 10.8.3.3.55728 > 99.181.88.116.1935: Flags [.], seq 98964:100278, ack 0, win 501, options [nop,nop,TS val 2718299375 ecr 3765964719], length 1314
21:47:23.099245 IP 10.8.3.3.55728 > 99.181.88.116.1935: Flags [.], seq 100278:101592, ack 0, win 501, options [nop,nop,TS val 2718299418 ecr 3765964719], length 1314
21:47:23.103618 IP 99.181.88.116.1935 > 10.8.3.3.55728: Flags [.], ack 85571, win 135, options [nop,nop,TS val 3765964789 ecr 2718298841], length 0
21:47:23.156804 IP 10.8.3.3.55728 > 99.181.88.116.1935: Flags [.], seq 101592:102906, ack 0, win 501, options [nop,nop,TS val 2718299475 ecr 3765964789], length 1314
21:47:23.190802 IP 10.8.3.3.55728 > 99.181.88.116.1935: Flags [.], seq 102906:104220, ack 0, win 501, options [nop,nop,TS val 2718299509 ecr 3765964789], length 1314
21:47:23.201851 IP 99.181.88.116.1935 > 10.8.3.3.55728: Flags [.], ack 88199, win 135, options [nop,nop,TS val 3765964887 ecr 2718298943], length 0
21:47:23.228099 IP 10.8.3.3.55728 > 99.181.88.116.1935: Flags [.], seq 104220:105534, ack 0, win 501, options [nop,nop,TS val 2718299547 ecr 3765964887], length 1314
21:47:23.268094 IP 99.181.88.116.1935 > 10.8.3.3.55728: Flags [.], ack 89766, win 136, options [nop,nop,TS val 3765964953 ecr 2718299008], length 0
21:47:23.268135 IP 10.8.3.3.55728 > 99.181.88.116.1935: Flags [P.], seq 105534:106533, ack 0, win 501, options [nop,nop,TS val 2718299587 ecr 3765964953], length 999
21:47:23.322511 IP 10.8.3.3.55728 > 99.181.88.116.1935: Flags [.], seq 106533:107847, ack 0, win 501, options [nop,nop,TS val 2718299641 ecr 3765964953], length 1314
21:47:23.335008 IP 99.181.88.116.1935 > 10.8.3.3.55728: Flags [.], ack 92394, win 136, options [nop,nop,TS val 3765965018 ecr 2718299076], length 0
21:47:23.356427 IP 10.8.3.3.55728 > 99.181.88.116.1935: Flags [.], seq 107847:109161, ack 0, win 501, options [nop,nop,TS val 2718299675 ecr 3765965018], length 1314
21:47:23.388792 IP 10.8.3.3.55728 > 99.181.88.116.1935: Flags [.], seq 109161:110475, ack 0, win 501, options [nop,nop,TS val 2718299707 ecr 3765965018], length 1314
21:47:23.434448 IP 99.181.88.116.1935 > 10.8.3.3.55728: Flags [.], ack 95022, win 136, options [nop,nop,TS val 3765965120 ecr 2718299161], length 0
21:47:23.453711 IP 10.8.3.3.55728 > 99.181.88.116.1935: Flags [.], seq 110475:111789, ack 0, win 501, options [nop,nop,TS val 2718299772 ecr 3765965120], length 1314
21:47:23.490800 IP 10.8.3.3.55728 > 99.181.88.116.1935: Flags [.], seq 111789:113103, ack 0, win 501, options [nop,nop,TS val 2718299809 ecr 3765965120], length 1314
21:47:23.517832 IP 99.181.88.116.1935 > 10.8.3.3.55728: Flags [.], ack 97650, win 136, options [nop,nop,TS val 3765965202 ecr 2718299240], length 0
21:47:23.526988 IP 10.8.3.3.55728 > 99.181.88.116.1935: Flags [.], seq 113103:114417, ack 0, win 501, options [nop,nop,TS val 2718299846 ecr 3765965202], length 1314
21:47:23.591292 IP 10.8.3.3.55728 > 99.181.88.116.1935: Flags [.], seq 114417:115731, ack 0, win 501, options [nop,nop,TS val 2718299910 ecr 3765965202], length 1314
21:47:23.602263 IP 99.181.88.116.1935 > 10.8.3.3.55728: Flags [.], ack 100278, win 136, options [nop,nop,TS val 3765965288 ecr 2718299342], length 0
21:47:23.623310 IP 10.8.3.3.55728 > 99.181.88.116.1935: Flags [.], seq 115731:117045, ack 0, win 501, options [nop,nop,TS val 2718299942 ecr 3765965288], length 1314
21:47:23.657219 IP 10.8.3.3.55728 > 99.181.88.116.1935: Flags [.], seq 117045:118359, ack 0, win 501, options [nop,nop,TS val 2718299976 ecr 3765965288], length 1314
21:47:23.702772 IP 99.181.88.116.1935 > 10.8.3.3.55728: Flags [.], ack 102906, win 136, options [nop,nop,TS val 3765965388 ecr 2718299418], length 0
21:47:23.722664 IP 10.8.3.3.55728 > 99.181.88.116.1935: Flags [.], seq 118359:119673, ack 0, win 501, options [nop,nop,TS val 2718300041 ecr 3765965388], length 1314
21:47:23.756152 IP 10.8.3.3.55728 > 99.181.88.116.1935: Flags [.], seq 119673:120987, ack 0, win 501, options [nop,nop,TS val 2718300075 ecr 3765965388], length 1314
21:47:23.774070 IP 99.181.88.116.1935 > 10.8.3.3.55728: Flags [.], ack 105534, win 136, options [nop,nop,TS val 3765965459 ecr 2718299509], length 0
21:47:23.790410 IP 10.8.3.3.55728 > 99.181.88.116.1935: Flags [.], seq 120987:122301, ack 0, win 501, options [nop,nop,TS val 2718300109 ecr 3765965459], length 1314
21:47:23.815077 IP 99.181.88.116.1935 > 10.8.3.3.55728: Flags [.], ack 106533, win 136, options [nop,nop,TS val 3765965500 ecr 2718299587], length 0
21:47:23.815111 IP 10.8.3.3.55728 > 99.181.88.116.1935: Flags [P.], seq 122301:122571, ack 0, win 501, options [nop,nop,TS val 2718300134 ecr 3765965500], length 270
21:47:23.855538 IP 10.8.3.3.55728 > 99.181.88.116.1935: Flags [.], seq 122571:123885, ack 0, win 501, options [nop,nop,TS val 2718300174 ecr 3765965500], length 1314
21:47:23.890784 IP 10.8.3.3.55728 > 99.181.88.116.1935: Flags [.], seq 123885:125199, ack 0, win 501, options [nop,nop,TS val 2718300209 ecr 3765965500], length 1314
21:47:23.902248 IP 99.181.88.116.1935 > 10.8.3.3.55728: Flags [.], ack 109161, win 136, options [nop,nop,TS val 3765965588 ecr 2718299641], length 0
21:47:23.933552 IP 10.8.3.3.55728 > 99.181.88.116.1935: Flags [.], seq 125199:126513, ack 0, win 501, options [nop,nop,TS val 2718300252 ecr 3765965588], length 1314
21:47:23.989884 IP 10.8.3.3.55728 > 99.181.88.116.1935: Flags [.], seq 126513:127827, ack 0, win 501, options [nop,nop,TS val 2718300309 ecr 3765965588], length 1314
21:47:24.000513 IP 99.181.88.116.1935 > 10.8.3.3.55728: Flags [.], ack 111789, win 135, options [nop,nop,TS val 3765965685 ecr 2718299707], length 0
21:47:24.023237 IP 10.8.3.3.55728 > 99.181.88.116.1935: Flags [.], seq 127827:129141, ack 0, win 501, options [nop,nop,TS val 2718300342 ecr 3765965685], length 1314
21:47:24.062227 IP 10.8.3.3.55728 > 99.181.88.116.1935: Flags [.], seq 129141:130455, ack 0, win 501, options [nop,nop,TS val 2718300381 ecr 3765965685], length 1314
21:47:24.072878 IP 99.181.88.116.1935 > 10.8.3.3.55728: Flags [.], ack 114417, win 135, options [nop,nop,TS val 3765965758 ecr 2718299809], length 0
21:47:24.126620 IP 10.8.3.3.55728 > 99.181.88.116.1935: Flags [.], seq 130455:131769, ack 0, win 501, options [nop,nop,TS val 2718300445 ecr 3765965758], length 1314
21:47:24.156610 IP 10.8.3.3.55728 > 99.181.88.116.1935: Flags [.], seq 131769:133083, ack 0, win 501, options [nop,nop,TS val 2718300475 ecr 3765965758], length 1314
21:47:24.169272 IP 99.181.88.116.1935 > 10.8.3.3.55728: Flags [.], ack 117045, win 135, options [nop,nop,TS val 3765965855 ecr 2718299910], length 0
21:47:24.190799 IP 10.8.3.3.55728 > 99.181.88.116.1935: Flags [.], seq 133083:134397, ack 0, win 501, options [nop,nop,TS val 2718300509 ecr 3765965855], length 1314
21:47:24.256542 IP 10.8.3.3.55728 > 99.181.88.116.1935: Flags [.], seq 134397:135711, ack 0, win 501, options [nop,nop,TS val 2718300575 ecr 3765965855], length 1314
21:47:24.268637 IP 99.181.88.116.1935 > 10.8.3.3.55728: Flags [.], ack 119673, win 135, options [nop,nop,TS val 3765965954 ecr 2718299976], length 0
21:47:24.290393 IP 10.8.3.3.55728 > 99.181.88.116.1935: Flags [.], seq 135711:137025, ack 0, win 501, options [nop,nop,TS val 2718300609 ecr 3765965954], length 1314
21:47:24.324109 IP 10.8.3.3.55728 > 99.181.88.116.1935: Flags [.], seq 137025:138339, ack 0, win 501, options [nop,nop,TS val 2718300643 ecr 3765965954], length 1314
21:47:24.336345 IP 99.181.88.116.1935 > 10.8.3.3.55728: Flags [.], ack 122301, win 135, options [nop,nop,TS val 3765966022 ecr 2718300075], length 0
21:47:24.360730 IP 99.181.88.116.1935 > 10.8.3.3.55728: Flags [.], ack 122571, win 136, options [nop,nop,TS val 3765966046 ecr 2718300134], length 0
21:47:24.360779 IP 10.8.3.3.55728 > 99.181.88.116.1935: Flags [P.], seq 138339:138591, ack 0, win 501, options [nop,nop,TS val 2718300679 ecr 3765966046], length 252
21:47:24.388209 IP 10.8.3.3.55728 > 99.181.88.116.1935: Flags [.], seq 138591:139905, ack 0, win 501, options [nop,nop,TS val 2718300707 ecr 3765966046], length 1314
21:47:24.426232 IP 10.8.3.3.55728 > 99.181.88.116.1935: Flags [.], seq 139905:141219, ack 0, win 501, options [nop,nop,TS val 2718300745 ecr 3765966046], length 1314
21:47:24.436748 IP 99.181.88.116.1935 > 10.8.3.3.55728: Flags [.], ack 125199, win 136, options [nop,nop,TS val 3765966122 ecr 2718300174], length 0
21:47:24.490505 IP 10.8.3.3.55728 > 99.181.88.116.1935: Flags [.], seq 141219:142533, ack 0, win 501, options [nop,nop,TS val 2718300809 ecr 3765966122], length 1314
21:47:24.522611 IP 10.8.3.3.55728 > 99.181.88.116.1935: Flags [.], seq 142533:143847, ack 0, win 501, options [nop,nop,TS val 2718300841 ecr 3765966122], length 1314
21:47:24.537344 IP 99.181.88.116.1935 > 10.8.3.3.55728: Flags [.], ack 127827, win 135, options [nop,nop,TS val 3765966223 ecr 2718300252], length 0
21:47:24.557434 IP 10.8.3.3.55728 > 99.181.88.116.1935: Flags [.], seq 143847:145161, ack 0, win 501, options [nop,nop,TS val 2718300876 ecr 3765966223], length 1314
21:47:24.608333 IP 99.181.88.116.1935 > 10.8.3.3.55728: Flags [.], ack 130455, win 135, options [nop,nop,TS val 3765966294 ecr 2718300342], length 0
21:47:24.619496 IP 10.8.3.3.55728 > 99.181.88.116.1935: Flags [.], seq 145161:146475, ack 0, win 501, options [nop,nop,TS val 2718300938 ecr 3765966294], length 1314
21:47:24.662338 IP 10.8.3.3.55728 > 99.181.88.116.1935: Flags [.], seq 146475:147789, ack 0, win 501, options [nop,nop,TS val 2718300981 ecr 3765966294], length 1314
21:47:24.690155 IP 10.8.3.3.55728 > 99.181.88.116.1935: Flags [.], seq 147789:149103, ack 0, win 501, options [nop,nop,TS val 2718301009 ecr 3765966294], length 1314
21:47:24.702565 IP 99.181.88.116.1935 > 10.8.3.3.55728: Flags [.], ack 133083, win 135, options [nop,nop,TS val 3765966388 ecr 2718300445], length 0
21:47:24.747735 IP 10.8.3.3.55728 > 99.181.88.116.1935: Flags [.], seq 149103:150417, ack 0, win 501, options [nop,nop,TS val 2718301066 ecr 3765966388], length 1314
21:47:24.790135 IP 10.8.3.3.55728 > 99.181.88.116.1935: Flags [.], seq 150417:151731, ack 0, win 501, options [nop,nop,TS val 2718301109 ecr 3765966388], length 1314
21:47:24.802290 IP 99.181.88.116.1935 > 10.8.3.3.55728: Flags [.], ack 135711, win 135, options [nop,nop,TS val 3765966488 ecr 2718300509], length 0
21:47:24.823094 IP 10.8.3.3.55728 > 99.181.88.116.1935: Flags [.], seq 151731:153045, ack 0, win 501, options [nop,nop,TS val 2718301142 ecr 3765966488], length 1314
21:47:24.870157 IP 99.181.88.116.1935 > 10.8.3.3.55728: Flags [.], ack 138339, win 135, options [nop,nop,TS val 3765966556 ecr 2718300609], length 0
21:47:24.875842 IP 10.8.3.3.55728 > 99.181.88.116.1935: Flags [.], seq 153045:154359, ack 0, win 501, options [nop,nop,TS val 2718301195 ecr 3765966556], length 1314
21:47:24.906569 IP 99.181.88.116.1935 > 10.8.3.3.55728: Flags [.], ack 138591, win 136, options [nop,nop,TS val 3765966592 ecr 2718300679], length 0
21:47:24.906618 IP 10.8.3.3.55728 > 99.181.88.116.1935: Flags [P.], seq 154359:155359, ack 0, win 501, options [nop,nop,TS val 2718301225 ecr 3765966592], length 1000
21:47:24.961501 IP 10.8.3.3.55728 > 99.181.88.116.1935: Flags [.], seq 155359:156673, ack 0, win 501, options [nop,nop,TS val 2718301280 ecr 3765966592], length 1314
21:47:24.972122 IP 99.181.88.116.1935 > 10.8.3.3.55728: Flags [.], ack 141219, win 136, options [nop,nop,TS val 3765966657 ecr 2718300707], length 0
21:47:24.990879 IP 10.8.3.3.55728 > 99.181.88.116.1935: Flags [.], seq 156673:157987, ack 0, win 501, options [nop,nop,TS val 2718301310 ecr 3765966657], length 1314
21:47:25.025921 IP 10.8.3.3.55728 > 99.181.88.116.1935: Flags [.], seq 157987:159301, ack 0, win 501, options [nop,nop,TS val 2718301345 ecr 3765966657], length 1314
21:47:25.068693 IP 99.181.88.116.1935 > 10.8.3.3.55728: Flags [.], ack 143847, win 136, options [nop,nop,TS val 3765966754 ecr 2718300809], length 0
21:47:25.090401 IP 10.8.3.3.55728 > 99.181.88.116.1935: Flags [.], seq 159301:160615, ack 0, win 501, options [nop,nop,TS val 2718301409 ecr 3765966754], length 1314
21:47:25.132939 IP 10.8.3.3.55728 > 99.181.88.116.1935: Flags [.], seq 160615:161929, ack 0, win 501, options [nop,nop,TS val 2718301452 ecr 3765966754], length 1314
21:47:25.157296 IP 10.8.3.3.55728 > 99.181.88.116.1935: Flags [.], seq 161929:163243, ack 0, win 501, options [nop,nop,TS val 2718301476 ecr 3765966754], length 1314
21:47:25.166208 IP 99.181.88.116.1935 > 10.8.3.3.55728: Flags [.], ack 146475, win 135, options [nop,nop,TS val 3765966851 ecr 2718300876], length 0
21:47:25.224105 IP 10.8.3.3.55728 > 99.181.88.116.1935: Flags [.], seq 163243:164557, ack 0, win 501, options [nop,nop,TS val 2718301543 ecr 3765966851], length 1314
21:47:25.237104 IP 99.181.88.116.1935 > 10.8.3.3.55728: Flags [.], ack 149103, win 135, options [nop,nop,TS val 3765966922 ecr 2718300981], length 0
21:47:25.261517 IP 10.8.3.3.55728 > 99.181.88.116.1935: Flags [.], seq 164557:165871, ack 0, win 501, options [nop,nop,TS val 2718301580 ecr 3765966922], length 1314
21:47:25.291103 IP 10.8.3.3.55728 > 99.181.88.116.1935: Flags [.], seq 165871:167185, ack 0, win 501, options [nop,nop,TS val 2718301610 ecr 3765966922], length 1314
21:47:25.335966 IP 99.181.88.116.1935 > 10.8.3.3.55728: Flags [.], ack 151731, win 135, options [nop,nop,TS val 3765967021 ecr 2718301066], length 0
21:47:25.356556 IP 10.8.3.3.55728 > 99.181.88.116.1935: Flags [.], seq 167185:168499, ack 0, win 501, options [nop,nop,TS val 2718301675 ecr 3765967021], length 1314
21:47:25.390315 IP 10.8.3.3.55728 > 99.181.88.116.1935: Flags [.], seq 168499:169813, ack 0, win 501, options [nop,nop,TS val 2718301709 ecr 3765967021], length 1314
21:47:25.421891 IP 99.181.88.116.1935 > 10.8.3.3.55728: Flags [.], ack 154359, win 135, options [nop,nop,TS val 3765967107 ecr 2718301142], length 0
21:47:25.433014 IP 10.8.3.3.55728 > 99.181.88.116.1935: Flags [.], seq 169813:171127, ack 0, win 501, options [nop,nop,TS val 2718301752 ecr 3765967107], length 1314
21:47:25.452355 IP 99.181.88.116.1935 > 10.8.3.3.55728: Flags [.], ack 155359, win 136, options [nop,nop,TS val 3765967138 ecr 2718301225], length 0
21:47:25.452387 IP 10.8.3.3.55728 > 99.181.88.116.1935: Flags [P.], seq 171127:171296, ack 0, win 501, options [nop,nop,TS val 2718301771 ecr 3765967138], length 169
21:47:25.497322 IP 10.8.3.3.55728 > 99.181.88.116.1935: Flags [.], seq 171296:172610, ack 0, win 501, options [nop,nop,TS val 2718301816 ecr 3765967138], length 1314
21:47:25.524069 IP 10.8.3.3.55728 > 99.181.88.116.1935: Flags [.], seq 172610:173924, ack 0, win 501, options [nop,nop,TS val 2718301843 ecr 3765967138], length 1314
21:47:25.537732 IP 99.181.88.116.1935 > 10.8.3.3.55728: Flags [.], ack 157987, win 136, options [nop,nop,TS val 3765967223 ecr 2718301280], length 0
21:47:25.561579 IP 10.8.3.3.55728 > 99.181.88.116.1935: Flags [.], seq 173924:175238, ack 0, win 501, options [nop,nop,TS val 2718301880 ecr 3765967223], length 1314
21:47:25.625601 IP 10.8.3.3.55728 > 99.181.88.116.1935: Flags [.], seq 175238:176552, ack 0, win 501, options [nop,nop,TS val 2718301944 ecr 3765967223], length 1314
21:47:25.636534 IP 99.181.88.116.1935 > 10.8.3.3.55728: Flags [.], ack 160615, win 135, options [nop,nop,TS val 3765967322 ecr 2718301345], length 0
21:47:25.668501 IP 10.8.3.3.55728 > 99.181.88.116.1935: Flags [.], seq 176552:177866, ack 0, win 501, options [nop,nop,TS val 2718301987 ecr 3765967322], length 1314
21:47:25.690479 IP 10.8.3.3.55728 > 99.181.88.116.1935: Flags [.], seq 177866:179180, ack 0, win 501, options [nop,nop,TS val 2718302009 ecr 3765967322], length 1314
21:47:25.703126 IP 99.181.88.116.1935 > 10.8.3.3.55728: Flags [.], ack 163243, win 135, options [nop,nop,TS val 3765967389 ecr 2718301452], length 0
21:47:25.754993 IP 10.8.3.3.55728 > 99.181.88.116.1935: Flags [.], seq 179180:180494, ack 0, win 501, options [nop,nop,TS val 2718302074 ecr 3765967389], length 1314
21:47:25.791062 IP 10.8.3.3.55728 > 99.181.88.116.1935: Flags [.], seq 180494:181808, ack 0, win 501, options [nop,nop,TS val 2718302110 ecr 3765967389], length 1314
21:47:25.807546 IP 99.181.88.116.1935 > 10.8.3.3.55728: Flags [.], ack 165871, win 135, options [nop,nop,TS val 3765967493 ecr 2718301543], length 0
21:47:25.819422 IP 10.8.3.3.55728 > 99.181.88.116.1935: Flags [.], seq 181808:183122, ack 0, win 501, options [nop,nop,TS val 2718302138 ecr 3765967493], length 1314
21:47:25.883423 IP 10.8.3.3.55728 > 99.181.88.116.1935: Flags [.], seq 183122:184436, ack 0, win 501, options [nop,nop,TS val 2718302202 ecr 3765967493], length 1314
21:47:25.902385 IP 99.181.88.116.1935 > 10.8.3.3.55728: Flags [.], ack 168499, win 135, options [nop,nop,TS val 3765967588 ecr 2718301610], length 0
21:47:25.923786 IP 10.8.3.3.55728 > 99.181.88.116.1935: Flags [.], seq 184436:185750, ack 0, win 501, options [nop,nop,TS val 2718302242 ecr 3765967588], length 1314
21:47:25.956911 IP 10.8.3.3.55728 > 99.181.88.116.1935: Flags [.], seq 185750:187064, ack 0, win 501, options [nop,nop,TS val 2718302276 ecr 3765967588], length 1314
21:47:25.979016 IP 99.181.88.116.1935 > 10.8.3.3.55728: Flags [.], ack 171127, win 135, options [nop,nop,TS val 3765967664 ecr 2718301709], length 0
21:47:25.998120 IP 99.181.88.116.1935 > 10.8.3.3.55728: Flags [.], ack 171296, win 136, options [nop,nop,TS val 3765967683 ecr 2718301771], length 0
21:47:25.998157 IP 10.8.3.3.55728 > 99.181.88.116.1935: Flags [P.], seq 187064:188263, ack 0, win 501, options [nop,nop,TS val 2718302317 ecr 3765967683], length 1199
21:47:26.055012 IP 10.8.3.3.55728 > 99.181.88.116.1935: Flags [.], seq 188263:189577, ack 0, win 501, options [nop,nop,TS val 2718302374 ecr 3765967683], length 1314
21:47:26.070127 IP 99.181.88.116.1935 > 10.8.3.3.55728: Flags [.], ack 173924, win 136, options [nop,nop,TS val 3765967755 ecr 2718301816], length 0
21:47:26.090971 IP 10.8.3.3.55728 > 99.181.88.116.1935: Flags [.], seq 189577:190891, ack 0, win 501, options [nop,nop,TS val 2718302410 ecr 3765967755], length 1314
21:47:26.124029 IP 10.8.3.3.55728 > 99.181.88.116.1935: Flags [.], seq 190891:192205, ack 0, win 501, options [nop,nop,TS val 2718302443 ecr 3765967755], length 1314
21:47:26.172944 IP 99.181.88.116.1935 > 10.8.3.3.55728: Flags [.], ack 176552, win 135, options [nop,nop,TS val 3765967857 ecr 2718301880], length 0
21:47:26.191050 IP 10.8.3.3.55728 > 99.181.88.116.1935: Flags [.], seq 192205:193519, ack 0, win 501, options [nop,nop,TS val 2718302510 ecr 3765967857], length 1314
21:47:26.223986 IP 10.8.3.3.55728 > 99.181.88.116.1935: Flags [.], seq 193519:194833, ack 0, win 501, options [nop,nop,TS val 2718302543 ecr 3765967857], length 1314
21:47:26.236354 IP 99.181.88.116.1935 > 10.8.3.3.55728: Flags [.], ack 179180, win 135, options [nop,nop,TS val 3765967922 ecr 2718301987], length 0
21:47:26.257509 IP 10.8.3.3.55728 > 99.181.88.116.1935: Flags [.], seq 194833:196147, ack 0, win 501, options [nop,nop,TS val 2718302576 ecr 3765967922], length 1314
21:47:26.324295 IP 10.8.3.3.55728 > 99.181.88.116.1935: Flags [.], seq 196147:197461, ack 0, win 501, options [nop,nop,TS val 2718302643 ecr 3765967922], length 1314
21:47:26.336934 IP 99.181.88.116.1935 > 10.8.3.3.55728: Flags [.], ack 181808, win 135, options [nop,nop,TS val 3765968022 ecr 2718302074], length 0
21:47:26.355813 IP 10.8.3.3.55728 > 99.181.88.116.1935: Flags [.], seq 197461:198775, ack 0, win 501, options [nop,nop,TS val 2718302675 ecr 3765968022], length 1314
21:47:26.389292 IP 10.8.3.3.55728 > 99.181.88.116.1935: Flags [.], seq 198775:200089, ack 0, win 501, options [nop,nop,TS val 2718302708 ecr 3765968022], length 1314
21:47:26.429941 IP 99.181.88.116.1935 > 10.8.3.3.55728: Flags [.], ack 183122, win 136, options [nop,nop,TS val 3765968113 ecr 2718302138], length 0
21:47:26.457156 IP 10.8.3.3.55728 > 99.181.88.116.1935: Flags [.], seq 200089:201403, ack 0, win 501, options [nop,nop,TS val 2718302776 ecr 3765968113], length 1314
21:47:26.469771 IP 99.181.88.116.1935 > 10.8.3.3.55728: Flags [.], ack 185750, win 136, options [nop,nop,TS val 3765968155 ecr 2718302202], length 0
21:47:26.490206 IP 10.8.3.3.55728 > 99.181.88.116.1935: Flags [.], seq 201403:202717, ack 0, win 501, options [nop,nop,TS val 2718302809 ecr 3765968155], length 1314
21:47:26.521515 IP 10.8.3.3.55728 > 99.181.88.116.1935: Flags [.], seq 202717:204031, ack 0, win 501, options [nop,nop,TS val 2718302840 ecr 3765968155], length 1314
21:47:26.544093 IP 99.181.88.116.1935 > 10.8.3.3.55728: Flags [.], ack 188263, win 136, options [nop,nop,TS val 3765968230 ecr 2718302276], length 0
21:47:26.544108 IP 10.8.3.3.55728 > 99.181.88.116.1935: Flags [P.], seq 204031:204184, ack 0, win 501, options [nop,nop,TS val 2718302863 ecr 3765968230], length 153
21:47:26.586804 IP 10.8.3.3.55728 > 99.181.88.116.1935: Flags [.], seq 204184:205498, ack 0, win 501, options [nop,nop,TS val 2718302905 ecr 3765968230], length 1314
21:47:26.620543 IP 10.8.3.3.55728 > 99.181.88.116.1935: Flags [.], seq 205498:206812, ack 0, win 501, options [nop,nop,TS val 2718302939 ecr 3765968230], length 1314
21:47:26.636761 IP 99.181.88.116.1935 > 10.8.3.3.55728: Flags [.], ack 190891, win 136, options [nop,nop,TS val 3765968322 ecr 2718302374], length 0
21:47:26.655919 IP 10.8.3.3.55728 > 99.181.88.116.1935: Flags [.], seq 206812:208126, ack 0, win 501, options [nop,nop,TS val 2718302975 ecr 3765968322], length 1314
21:47:26.723837 IP 10.8.3.3.55728 > 99.181.88.116.1935: Flags [.], seq 208126:209440, ack 0, win 501, options [nop,nop,TS val 2718303043 ecr 3765968322], length 1314
21:47:26.736871 IP 99.181.88.116.1935 > 10.8.3.3.55728: Flags [.], ack 193519, win 135, options [nop,nop,TS val 3765968422 ecr 2718302443], length 0
21:47:26.753230 IP 10.8.3.3.55728 > 99.181.88.116.1935: Flags [.], seq 209440:210754, ack 0, win 501, options [nop,nop,TS val 2718303072 ecr 3765968422], length 1314
21:47:26.787270 IP 10.8.3.3.55728 > 99.181.88.116.1935: Flags [.], seq 210754:212068, ack 0, win 501, options [nop,nop,TS val 2718303106 ecr 3765968422], length 1314
21:47:26.803336 IP 99.181.88.116.1935 > 10.8.3.3.55728: Flags [.], ack 196147, win 135, options [nop,nop,TS val 3765968489 ecr 2718302543], length 0
21:47:26.857932 IP 10.8.3.3.55728 > 99.181.88.116.1935: Flags [.], seq 212068:213382, ack 0, win 501, options [nop,nop,TS val 2718303177 ecr 3765968489], length 1314
21:47:26.887746 IP 10.8.3.3.55728 > 99.181.88.116.1935: Flags [.], seq 213382:214696, ack 0, win 501, options [nop,nop,TS val 2718303206 ecr 3765968489], length 1314
21:47:26.901687 IP 99.181.88.116.1935 > 10.8.3.3.55728: Flags [.], ack 198775, win 135, options [nop,nop,TS val 3765968587 ecr 2718302643], length 0
21:47:26.921952 IP 10.8.3.3.55728 > 99.181.88.116.1935: Flags [.], seq 214696:216010, ack 0, win 501, options [nop,nop,TS val 2718303241 ecr 3765968587], length 1314
21:47:26.986894 IP 10.8.3.3.55728 > 99.181.88.116.1935: Flags [.], seq 216010:217324, ack 0, win 501, options [nop,nop,TS val 2718303306 ecr 3765968587], length 1314
21:47:27.004917 IP 99.181.88.116.1935 > 10.8.3.3.55728: Flags [.], ack 201403, win 135, options [nop,nop,TS val 3765968688 ecr 2718302708], length 0
21:47:27.019942 IP 10.8.3.3.55728 > 99.181.88.116.1935: Flags [.], seq 217324:218638, ack 0, win 501, options [nop,nop,TS val 2718303339 ecr 3765968688], length 1314
21:47:27.055842 IP 10.8.3.3.55728 > 99.181.88.116.1935: Flags [.], seq 218638:219952, ack 0, win 501, options [nop,nop,TS val 2718303375 ecr 3765968688], length 1314
21:47:27.067384 IP 99.181.88.116.1935 > 10.8.3.3.55728: Flags [.], ack 204031, win 135, options [nop,nop,TS val 3765968753 ecr 2718302809], length 0
21:47:27.089747 IP 99.181.88.116.1935 > 10.8.3.3.55728: Flags [.], ack 204184, win 136, options [nop,nop,TS val 3765968775 ecr 2718302863], length 0
21:47:27.089791 IP 10.8.3.3.55728 > 99.181.88.116.1935: Flags [P.], seq 219952:220211, ack 0, win 501, options [nop,nop,TS val 2718303408 ecr 3765968775], length 259
