03:43:49.680920 IP 10.8.2.11.37970 > 185.42.205.114.1935: Flags [P.], seq 527269444:527269460, ack 3204576777, win 501, options [nop,nop,TS val 4154548074 ecr 2741314774], length 16
03:43:49.680974 IP 10.8.2.11.37970 > 185.42.205.114.1935: Flags [.], seq 16:1330, ack 1, win 501, options [nop,nop,TS val 4154548074 ecr 2741314774], length 1314
03:43:49.841465 IP 10.8.2.11.37970 > 185.42.205.114.1935: Flags [.], seq 1330:2644, ack 1, win 501, options [nop,nop,TS val 4154548235 ecr 2741314774], length 1314
03:43:49.884220 IP 10.8.2.11.37970 > 185.42.205.114.1935: Flags [.], seq 2644:3958, ack 1, win 501, options [nop,nop,TS val 4154548278 ecr 2741314774], length 1314
03:43:49.944821 IP 10.8.2.11.37970 > 185.42.205.114.1935: Flags [.], seq 3958:5272, ack 1, win 501, options [nop,nop,TS val 4154548338 ecr 2741314774], length 1314
03:43:49.962630 IP 185.42.205.114.1935 > 10.8.2.11.37970: Flags [.], ack 16, win 126, options [nop,nop,TS val 2741315855 ecr 4154548074], length 0
03:43:49.962679 IP 10.8.2.11.37970 > 185.42.205.114.1935: Flags [P.], seq 5272:5965, ack 1, win 501, options [nop,nop,TS val 4154548356 ecr 2741315855], length 693
03:43:49.962716 IP 185.42.205.114.1935 > 10.8.2.11.37970: Flags [.], ack 1330, win 126, options [nop,nop,TS val 2741315855 ecr 4154548074], length 0
03:43:50.009585 IP 10.8.2.11.37970 > 185.42.205.114.1935: Flags [.], seq 5965:7279, ack 1, win 501, options [nop,nop,TS val 4154548403 ecr 2741315855], length 1314
03:43:50.040832 IP 10.8.2.11.37970 > 185.42.205.114.1935: Flags [.], seq 7279:8593, ack 1, win 501, options [nop,nop,TS val 4154548434 ecr 2741315855], length 1314
03:43:50.076270 IP 10.8.2.11.37970 > 185.42.205.114.1935: Flags [.], seq 8593:9907, ack 1, win 501, options [nop,nop,TS val 4154548470 ecr 2741315855], length 1314
03:43:50.124120 IP 185.42.205.114.1935 > 10.8.2.11.37970: Flags [.], ack 2644, win 126, options [nop,nop,TS val 2741316016 ecr 4154548235], length 0
03:43:50.143206 IP 10.8.2.11.37970 > 185.42.205.114.1935: Flags [.], seq 9907:11221, ack 1, win 501, options [nop,nop,TS val 4154548537 ecr 2741316016], length 1314
03:43:50.166265 IP 185.42.205.114.1935 > 10.8.2.11.37970: Flags [.], ack 3958, win 126, options [nop,nop,TS val 2741316058 ecr 4154548278], length 0
03:43:50.177016 IP 10.8.2.11.37970 > 185.42.205.114.1935: Flags [.], seq 11221:12535, ack 1, win 501, options [nop,nop,TS val 4154548570 ecr 2741316058], length 1314
03:43:50.210996 IP 10.8.2.11.37970 > 185.42.205.114.1935: Flags [.], seq 12535:13849, ack 1, win 501, options [nop,nop,TS val 4154548604 ecr 2741316058], length 1314
03:43:50.226635 IP 185.42.205.114.1935 > 10.8.2.11.37970: Flags [.], ack 5272, win 126, options [nop,nop,TS val 2741316119 ecr 4154548338], length 0
03:43:50.244706 IP 185.42.205.114.1935 > 10.8.2.11.37970: Flags [.], ack 5965, win 126, options [nop,nop,TS val 2741316137 ecr 4154548356], length 0
03:43:50.244738 IP 10.8.2.11.37970 > 185.42.205.114.1935: Flags [P.], seq 13849:14822, ack 1, win 501, options [nop,nop,TS val 4154548638 ecr 2741316137], length 973
03:43:50.291915 IP 185.42.205.114.1935 > 10.8.2.11.37970: Flags [.], ack 7279, win 126, options [nop,nop,TS val 2741316184 ecr 4154548403], length 0
03:43:50.310594 IP 10.8.2.11.37970 > 185.42.205.114.1935: Flags [.], seq 14822:16136, ack 1, win 501, options [nop,nop,TS val 4154548704 ecr 2741316184], length 1314
03:43:50.323064 IP 185.42.205.114.1935 > 10.8.2.11.37970: Flags [.], ack 8593, win 126, options [nop,nop,TS val 2741316215 ecr 4154548434], length 0
03:43:50.343865 IP 10.8.2.11.37970 > 185.42.205.114.1935: Flags [.], seq 16136:17450, ack 1, win 501, options [nop,nop,TS val 4154548737 ecr 2741316215], length 1314
03:43:50.358248 IP 185.42.205.114.1935 > 10.8.2.11.37970: Flags [.], ack 9907, win 126, options [nop,nop,TS val 2741316250 ecr 4154548470], length 0
03:43:50.376963 IP 10.8.2.11.37970 > 185.42.205.114.1935: Flags [.], seq 17450:18764, ack 1, win 501, options [nop,nop,TS val 4154548770 ecr 2741316250], length 1314
03:43:50.425377 IP 185.42.205.114.1935 > 10.8.2.11.37970: Flags [.], ack 11221, win 126, options [nop,nop,TS val 2741316317 ecr 4154548537], length 0
03:43:50.443763 IP 10.8.2.11.37970 > 185.42.205.114.1935: Flags [.], seq 18764:20078, ack 1, win 501, options [nop,nop,TS val 4154548837 ecr 2741316317], length 1314
03:43:50.459046 IP 185.42.205.114.1935 > 10.8.2.11.37970: Flags [.], ack 12535, win 126, options [nop,nop,TS val 2741316351 ecr 4154548570], length 0
03:43:50.477728 IP 10.8.2.11.37970 > 185.42.205.114.1935: Flags [.], seq 20078:21392, ack 1, win 501, options [nop,nop,TS val 4154548871 ecr 2741316351], length 1314
03:43:50.493406 IP 185.42.205.114.1935 > 10.8.2.11.37970: Flags [.], ack 13849, win 126, options [nop,nop,TS val 2741316385 ecr 4154548604], length 0
03:43:50.509631 IP 10.8.2.11.37970 > 185.42.205.114.1935: Flags [.], seq 21392:22706, ack 1, win 501, options [nop,nop,TS val 4154548903 ecr 2741316385], length 1314
03:43:50.526440 IP 185.42.205.114.1935 > 10.8.2.11.37970: Flags [.], ack 14822, win 126, options [nop,nop,TS val 2741316419 ecr 4154548638], length 0
03:43:50.526466 IP 10.8.2.11.37970 > 185.42.205.114.1935: Flags [P.], seq 22706:22936, ack 1, win 501, options [nop,nop,TS val 4154548920 ecr 2741316419], length 230
03:43:50.576621 IP 10.8.2.11.37970 > 185.42.205.114.1935: Flags [.], seq 22936:24250, ack 1, win 501, options [nop,nop,TS val 4154548970 ecr 2741316419], length 1314
03:43:50.592361 IP 185.42.205.114.1935 > 10.8.2.11.37970: Flags [.], ack 16136, win 126, options [nop,nop,TS val 2741316485 ecr 4154548704], length 0
03:43:50.611022 IP 10.8.2.11.37970 > 185.42.205.114.1935: Flags [.], seq 24250:25564, ack 1, win 501, options [nop,nop,TS val 4154549004 ecr 2741316485], length 1314
03:43:50.625800 IP 185.42.205.114.1935 > 10.8.2.11.37970: Flags [.], ack 17450, win 126, options [nop,nop,TS val 2741316518 ecr 4154548737], length 0
03:43:50.653094 IP 10.8.2.11.37970 > 185.42.205.114.1935: Flags [.], seq 25564:26878, ack 1, win 501, options [nop,nop,TS val 4154549046 ecr 2741316518], length 1314
03:43:50.659107 IP 185.42.205.114.1935 > 10.8.2.11.37970: Flags [.], ack 18764, win 126, options [nop,nop,TS val 2741316551 ecr 4154548770], length 0
03:43:50.709596 IP 10.8.2.11.37970 > 185.42.205.114.1935: Flags [.], seq 26878:28192, ack 1, win 501, options [nop,nop,TS val 4154549103 ecr 2741316551], length 1314
03:43:50.743568 IP 10.8.2.11.37970 > 185.42.205.114.1935: Flags [.], seq 28192:29506, ack 1, win 501, options [nop,nop,TS val 4154549137 ecr 2741316551], length 1314
03:43:50.759842 IP 185.42.205.114.1935 > 10.8.2.11.37970: Flags [.], ack 21392, win 126, options [nop,nop,TS val 2741316652 ecr 4154548837], length 0
03:43:50.780564 IP 10.8.2.11.37970 > 185.42.205.114.1935: Flags [.], seq 29506:30820, ack 1, win 501, options [nop,nop,TS val 4154549174 ecr 2741316652], length 1314
03:43:50.808037 IP 185.42.205.114.1935 > 10.8.2.11.37970: Flags [.], ack 22936, win 126, options [nop,nop,TS val 2741316700 ecr 4154548903], length 0
03:43:50.808078 IP 10.8.2.11.37970 > 185.42.205.114.1935: Flags [P.], seq 30820:30937, ack 1, win 501, options [nop,nop,TS val 4154549201 ecr 2741316700], length 117
03:43:50.844489 IP 10.8.2.11.37970 > 185.42.205.114.1935: Flags [.], seq 30937:32251, ack 1, win 501, options [nop,nop,TS val 4154549238 ecr 2741316700], length 1314
03:43:50.878795 IP 10.8.2.11.37970 > 185.42.205.114.1935: Flags [.], seq 32251:33565, ack 1, win 501, options [nop,nop,TS val 4154549272 ecr 2741316700], length 1314
03:43:50.893080 IP 185.42.205.114.1935 > 10.8.2.11.37970: Flags [.], ack 25564, win 126, options [nop,nop,TS val 2741316785 ecr 4154548970], length 0
03:43:50.930106 IP 10.8.2.11.37970 > 185.42.205.114.1935: Flags [.], seq 33565:34879, ack 1, win 501, options [nop,nop,TS val 4154549323 ecr 2741316785], length 1314
03:43:50.977120 IP 10.8.2.11.37970 > 185.42.205.114.1935: Flags [.], seq 34879:36193, ack 1, win 501, options [nop,nop,TS val 4154549370 ecr 2741316785], length 1314
03:43:50.995150 IP 185.42.205.114.1935 > 10.8.2.11.37970: Flags [.], ack 28192, win 126, options [nop,nop,TS val 2741316884 ecr 4154549046], length 0
03:43:51.009532 IP 10.8.2.11.37970 > 185.42.205.114.1935: Flags [.], seq 36193:37507, ack 1, win 501, options [nop,nop,TS val 4154549403 ecr 2741316884], length 1314
03:43:51.057933 IP 10.8.2.11.37970 > 185.42.205.114.1935: Flags [.], seq 37507:38821, ack 1, win 501, options [nop,nop,TS val 4154549451 ecr 2741316884], length 1314
03:43:51.063040 IP 185.42.205.114.1935 > 10.8.2.11.37970: Flags [.], ack 30820, win 126, options [nop,nop,TS val 2741316955 ecr 4154549137], length 0
03:43:51.089668 IP 185.42.205.114.1935 > 10.8.2.11.37970: Flags [.], ack 30937, win 126, options [nop,nop,TS val 2741316982 ecr 4154549201], length 0
03:43:51.089705 IP 10.8.2.11.37970 > 185.42.205.114.1935: Flags [P.], seq 38821:39799, ack 1, win 501, options [nop,nop,TS val 4154549483 ecr 2741316982], length 978
03:43:51.145675 IP 10.8.2.11.37970 > 185.42.205.114.1935: Flags [.], seq 39799:41113, ack 1, win 501, options [nop,nop,TS val 4154549539 ecr 2741316982], length 1314
03:43:51.160772 IP 185.42.205.114.1935 > 10.8.2.11.37970: Flags [.], ack 33565, win 126, options [nop,nop,TS val 2741317053 ecr 4154549238], length 0
03:43:51.176846 IP 10.8.2.11.37970 > 185.42.205.114.1935: Flags [.], seq 41113:42427, ack 1, win 501, options [nop,nop,TS val 4154549570 ecr 2741317053], length 1314
03:43:51.209746 IP 10.8.2.11.37970 > 185.42.205.114.1935: Flags [.], seq 42427:43741, ack 1, win 501, options [nop,nop,TS val 4154549603 ecr 2741317053], length 1314
03:43:51.259009 IP 185.42.205.114.1935 > 10.8.2.11.37970: Flags [.], ack 36193, win 126, options [nop,nop,TS val 2741317151 ecr 4154549323], length 0
03:43:51.277765 IP 10.8.2.11.37970 > 185.42.205.114.1935: Flags [.], seq 43741:45055, ack 1, win 501, options [nop,nop,TS val 4154549671 ecr 2741317151], length 1314
03:43:51.311818 IP 10.8.2.11.37970 > 185.42.205.114.1935: Flags [.], seq 45055:46369, ack 1, win 501, options [nop,nop,TS val 4154549705 ecr 2741317151], length 1314
03:43:51.339869 IP 185.42.205.114.1935 > 10.8.2.11.37970: Flags [.], ack 38821, win 126, options [nop,nop,TS val 2741317232 ecr 4154549403], length 0
03:43:51.344937 IP 10.8.2.11.37970 > 185.42.205.114.1935: Flags [.], seq 46369:47683, ack 1, win 501, options [nop,nop,TS val 4154549738 ecr 2741317232], length 1314
03:43:51.371622 IP 185.42.205.114.1935 > 10.8.2.11.37970: Flags [.], ack 39799, win 126, options [nop,nop,TS val 2741317264 ecr 4154549483], length 0
03:43:51.371655 IP 10.8.2.11.37970 > 185.42.205.114.1935: Flags [P.], seq 47683:47817, ack 1, win 501, options [nop,nop,TS val 4154549765 ecr 2741317264], length 134
03:43:51.410688 IP 10.8.2.11.37970 > 185.42.205.114.1935: Flags [.], seq 47817:49131, ack 1, win 501, options [nop,nop,TS val 4154549804 ecr 2741317264], length 1314
03:43:51.442519 IP 10.8.2.11.37970 > 185.42.205.114.1935: Flags [.], seq 49131:50445, ack 1, win 501, options [nop,nop,TS val 4154549836 ecr 2741317264], length 1314
03:43:51.458793 IP 185.42.205.114.1935 > 10.8.2.11.37970: Flags [.], ack 42427, win 126, options [nop,nop,TS val 2741317351 ecr 4154549539], length 0
03:43:51.485008 IP 10.8.2.11.37970 > 185.42.205.114.1935: Flags [.], seq 50445:51759, ack 1, win 501, options [nop,nop,TS val 4154549878 ecr 2741317351], length 1314
03:43:51.544820 IP 10.8.2.11.37970 > 185.42.205.114.1935: Flags [.], seq 51759:53073, ack 1, win 501, options [nop,nop,TS val 4154549938 ecr 2741317351], length 1314
03:43:51.559838 IP 185.42.205.114.1935 > 10.8.2.11.37970: Flags [.], ack 45055, win 126, options [nop,nop,TS val 2741317452 ecr 4154549603], length 0
03:43:51.577965 IP 10.8.2.11.37970 > 185.42.205.114.1935: Flags [.], seq 53073:54387, ack 1, win 501, options [nop,nop,TS val 4154549971 ecr 2741317452], length 1314
03:43:51.613948 IP 10.8.2.11.37970 > 185.42.205.114.1935: Flags [.], seq 54387:55701, ack 1, win 501, options [nop,nop,TS val 4154550007 ecr 2741317452], length 1314
03:43:51.627076 IP 185.42.205.114.1935 > 10.8.2.11.37970: Flags [.], ack 47683, win 126, options [nop,nop,TS val 2741317519 ecr 4154549705], length 0
03:43:51.653454 IP 185.42.205.114.1935 > 10.8.2.11.37970: Flags [.], ack 47817, win 126, options [nop,nop,TS val 2741317546 ecr 4154549765], length 0
03:43:51.653492 IP 10.8.2.11.37970 > 185.42.205.114.1935: Flags [P.], seq 55701:56666, ack 1, win 501, options [nop,nop,TS val 4154550047 ecr 2741317546], length 965
03:43:51.709782 IP 10.8.2.11.37970 > 185.42.205.114.1935: Flags [.], seq 56666:57980, ack 1, win 501, options [nop,nop,TS val 4154550103 ecr 2741317546], length 1314
03:43:51.724456 IP 185.42.205.114.1935 > 10.8.2.11.37970: Flags [.], ack 50445, win 126, options [nop,nop,TS val 2741317617 ecr 4154549804], length 0
03:43:51.743144 IP 10.8.2.11.37970 > 185.42.205.114.1935: Flags [.], seq 57980:59294, ack 1, win 501, options [nop,nop,TS val 4154550136 ecr 2741317617], length 1314
03:43:51.777008 IP 10.8.2.11.37970 > 185.42.205.114.1935: Flags [.], seq 59294:60608, ack 1, win 501, options [nop,nop,TS val 4154550170 ecr 2741317617], length 1314
03:43:51.826688 IP 185.42.205.114.1935 > 10.8.2.11.37970: Flags [.], ack 53073, win 126, options [nop,nop,TS val 2741317719 ecr 4154549878], length 0
03:43:51.844223 IP 10.8.2.11.37970 > 185.42.205.114.1935: Flags [.], seq 60608:61922, ack 1, win 501, options [nop,nop,TS val 4154550238 ecr 2741317719], length 1314
03:43:51.877501 IP 10.8.2.11.37970 > 185.42.205.114.1935: Flags [.], seq 61922:63236, ack 1, win 501, options [nop,nop,TS val 4154550271 ecr 2741317719], length 1314
03:43:51.895896 IP 185.42.205.114.1935 > 10.8.2.11.37970: Flags [.], ack 55701, win 126, options [nop,nop,TS val 2741317788 ecr 4154549971], length 0
03:43:51.910560 IP 10.8.2.11.37970 > 185.42.205.114.1935: Flags [.], seq 63236:64550, ack 1, win 501, options [nop,nop,TS val 4154550304 ecr 2741317788], length 1314
03:43:51.935308 IP 185.42.205.114.1935 > 10.8.2.11.37970: Flags [.], ack 56666, win 126, options [nop,nop,TS val 2741317828 ecr 4154550047], length 0
03:43:51.935340 IP 10.8.2.11.37970 > 185.42.205.114.1935: Flags [P.], seq 64550:64781, ack 1, win 501, options [nop,nop,TS val 4154550329 ecr 2741317828], length 231
03:43:51.978135 IP 10.8.2.11.37970 > 185.42.205.114.1935: Flags [.], seq 64781:66095, ack 1, win 501, options [nop,nop,TS val 4154550371 ecr 2741317828], length 1314
03:43:52.010829 IP 10.8.2.11.37970 > 185.42.205.114.1935: Flags [.], seq 66095:67409, ack 1, win 501, options [nop,nop,TS val 4154550404 ecr 2741317828], length 1314
03:43:52.025059 IP 185.42.205.114.1935 > 10.8.2.11.37970: Flags [.], ack 59294, win 126, options [nop,nop,TS val 2741317917 ecr 4154550103], length 0
03:43:52.064154 IP 10.8.2.11.37970 > 185.42.205.114.1935: Flags [.], seq 67409:68723, ack 1, win 501, options [nop,nop,TS val 4154550457 ecr 2741317917], length 1314
03:43:52.111009 IP 10.8.2.11.37970 > 185.42.205.114.1935: Flags [.], seq 68723:70037, ack 1, win 501, options [nop,nop,TS val 4154550504 ecr 2741317917], length 1314
03:43:52.126296 IP 185.42.205.114.1935 > 10.8.2.11.37970: Flags [.], ack 61922, win 126, options [nop,nop,TS val 2741318018 ecr 4154550170], length 0
03:43:52.144216 IP 10.8.2.11.37970 > 185.42.205.114.1935: Flags [.], seq 70037:71351, ack 1, win 501, options [nop,nop,TS val 4154550538 ecr 2741318018], length 1314
03:43:52.192473 IP 185.42.205.114.1935 > 10.8.2.11.37970: Flags [.], ack 64550, win 126, options [nop,nop,TS val 2741318085 ecr 4154550271], length 0
03:43:52.192843 IP 10.8.2.11.37970 > 185.42.205.114.1935: Flags [.], seq 71351:72665, ack 1, win 501, options [nop,nop,TS val 4154550586 ecr 2741318085], length 1314
03:43:52.217128 IP 185.42.205.114.1935 > 10.8.2.11.37970: Flags [.], ack 64781, win 126, options [nop,nop,TS val 2741318109 ecr 4154550329], length 0
03:43:52.217163 IP 10.8.2.11.37970 > 185.42.205.114.1935: Flags [P.], seq 72665:73642, ack 1, win 501, options [nop,nop,TS val 4154550610 ecr 2741318109], length 977
03:43:52.278606 IP 10.8.2.11.37970 > 185.42.205.114.1935: Flags [.], seq 73642:74956, ack 1, win 501, options [nop,nop,TS val 4154550672 ecr 2741318109], length 1314
03:43:52.292894 IP 185.42.205.114.1935 > 10.8.2.11.37970: Flags [.], ack 67409, win 126, options [nop,nop,TS val 2741318185 ecr 4154550371], length 0
03:43:52.310573 IP 10.8.2.11.37970 > 185.42.205.114.1935: Flags [.], seq 74956:76270, ack 1, win 501, options [nop,nop,TS val 4154550704 ecr 2741318185], length 1314
03:43:52.344561 IP 10.8.2.11.37970 > 185.42.205.114.1935: Flags [.], seq 76270:77584, ack 1, win 501, options [nop,nop,TS val 4154550738 ecr 2741318185], length 1314
03:43:52.392981 IP 185.42.205.114.1935 > 10.8.2.11.37970: Flags [.], ack 70037, win 126, options [nop,nop,TS val 2741318285 ecr 4154550457], length 0
03:43:52.408915 IP 10.8.2.11.37970 > 185.42.205.114.1935: Flags [.], seq 77584:78898, ack 1, win 501, options [nop,nop,TS val 4154550802 ecr 2741318285], length 1314
03:43:52.444572 IP 10.8.2.11.37970 > 185.42.205.114.1935: Flags [.], seq 78898:80212, ack 1, win 501, options [nop,nop,TS val 4154550838 ecr 2741318285], length 1314
03:43:52.474673 IP 185.42.205.114.1935 > 10.8.2.11.37970: Flags [.], ack 72665, win 126, options [nop,nop,TS val 2741318367 ecr 4154550538], length 0
03:43:52.478251 IP 10.8.2.11.37970 > 185.42.205.114.1935: Flags [.], seq 80212:81526, ack 1, win 501, options [nop,nop,TS val 4154550872 ecr 2741318367], length 1314
03:43:52.499166 IP 185.42.205.114.1935 > 10.8.2.11.37970: Flags [.], ack 73642, win 126, options [nop,nop,TS val 2741318391 ecr 4154550610], length 0
03:43:52.499205 IP 10.8.2.11.37970 > 185.42.205.114.1935: Flags [P.], seq 81526:81644, ack 1, win 501, options [nop,nop,TS val 4154550893 ecr 2741318391], length 118
03:43:52.543345 IP 10.8.2.11.37970 > 185.42.205.114.1935: Flags [.], seq 81644:82958, ack 1, win 501, options [nop,nop,TS val 4154550937 ecr 2741318391], length 1314
03:43:52.578760 IP 10.8.2.11.37970 > 185.42.205.114.1935: Flags [.], seq 82958:84272, ack 1, win 501, options [nop,nop,TS val 4154550972 ecr 2741318391], length 1314
03:43:52.592862 IP 185.42.205.114.1935 > 10.8.2.11.37970: Flags [.], ack 76270, win 126, options [nop,nop,TS val 2741318485 ecr 4154550672], length 0
03:43:52.621724 IP 10.8.2.11.37970 > 185.42.205.114.1935: Flags [.], seq 84272:85586, ack 1, win 501, options [nop,nop,TS val 4154551015 ecr 2741318485], length 1314
03:43:52.675877 IP 10.8.2.11.37970 > 185.42.205.114.1935: Flags [.], seq 85586:86900, ack 1, win 501, options [nop,nop,TS val 4154551069 ecr 2741318485], length 1314
03:43:52.690888 IP 185.42.205.114.1935 > 10.8.2.11.37970: Flags [.], ack 78898, win 126, options [nop,nop,TS val 2741318583 ecr 4154550738], length 0
03:43:52.710453 IP 10.8.2.11.37970 > 185.42.205.114.1935: Flags [.], seq 86900:88214, ack 1, win 501, options [nop,nop,TS val 4154551104 ecr 2741318583], length 1314
03:43:52.750444 IP 10.8.2.11.37970 > 185.42.205.114.1935: Flags [.], seq 88214:89528, ack 1, win 501, options [nop,nop,TS val 4154551144 ecr 2741318583], length 1314
03:43:52.760203 IP 185.42.205.114.1935 > 10.8.2.11.37970: Flags [.], ack 81526, win 126, options [nop,nop,TS val 2741318652 ecr 4154550838], length 0
03:43:52.781018 IP 185.42.205.114.1935 > 10.8.2.11.37970: Flags [.], ack 81644, win 126, options [nop,nop,TS val 2741318673 ecr 4154550893], length 0
03:43:52.781053 IP 10.8.2.11.37970 > 185.42.205.114.1935: Flags [P.], seq 89528:90509, ack 1, win 501, options [nop,nop,TS val 4154551174 ecr 2741318673], length 981
03:43:52.845679 IP 10.8.2.11.37970 > 185.42.205.114.1935: Flags [.], seq 90509:91823, ack 1, win 501, options [nop,nop,TS val 4154551239 ecr 2741318673], length 1314
03:43:52.860894 IP 185.42.205.114.1935 > 10.8.2.11.37970: Flags [.], ack 84272, win 126, options [nop,nop,TS val 2741318753 ecr 4154550937], length 0
03:43:52.879538 IP 10.8.2.11.37970 > 185.42.205.114.1935: Flags [.], seq 91823:93137, ack 1, win 501, options [nop,nop,TS val 4154551273 ecr 2741318753], length 1314
03:43:52.909688 IP 10.8.2.11.37970 > 185.42.205.114.1935: Flags [.], seq 93137:94451, ack 1, win 501, options [nop,nop,TS val 4154551303 ecr 2741318753], length 1314
03:43:52.957696 IP 185.42.205.114.1935 > 10.8.2.11.37970: Flags [.], ack 86900, win 126, options [nop,nop,TS val 2741318850 ecr 4154551015], length 0
03:43:52.977638 IP 10.8.2.11.37970 > 185.42.205.114.1935: Flags [.], seq 94451:95765, ack 1, win 501, options [nop,nop,TS val 4154551371 ecr 2741318850], length 1314
03:43:53.011420 IP 10.8.2.11.37970 > 185.42.205.114.1935: Flags [.], seq 95765:97079, ack 1, win 501, options [nop,nop,TS val 4154551405 ecr 2741318850], length 1314
03:43:53.032459 IP 185.42.205.114.1935 > 10.8.2.11.37970: Flags [.], ack 89528, win 126, options [nop,nop,TS val 2741318925 ecr 4154551104], length 0
03:43:53.051091 IP 10.8.2.11.37970 > 185.42.205.114.1935: Flags [.], seq 97079:98393, ack 1, win 501, options [nop,nop,TS val 4154551444 ecr 2741318925], length 1314
03:43:53.062694 IP 185.42.205.114.1935 > 10.8.2.11.37970: Flags [.], ack 90509, win 126, options [nop,nop,TS val 2741318955 ecr 4154551174], length 0
03:43:53.062734 IP 10.8.2.11.37970 > 185.42.205.114.1935: Flags [P.], seq 98393:98523, ack 1, win 501, options [nop,nop,TS val 4154551456 ecr 2741318955], length 130
03:43:53.114963 IP 10.8.2.11.37970 > 185.42.205.114.1935: Flags [.], seq 98523:99837, ack 1, win 501, options [nop,nop,TS val 4154551508 ecr 2741318955], length 1314
03:43:53.143110 IP 10.8.2.11.37970 > 185.42.205.114.1935: Flags [.], seq 99837:101151, ack 1, win 501, options [nop,nop,TS val 4154551536 ecr 2741318955], length 1314
03:43:53.161653 IP 185.42.205.114.1935 > 10.8.2.11.37970: Flags [.], ack 93137, win 126, options [nop,nop,TS val 2741319054 ecr 4154551239], length 0
03:43:53.178789 IP 10.8.2.11.37970 > 185.42.205.114.1935: Flags [.], seq 101151:102465, ack 1, win 501, options [nop,nop,TS val 4154551572 ecr 2741319054], length 1314
03:43:53.244813 IP 10.8.2.11.37970 > 185.42.205.114.1935: Flags [.], seq 102465:103779, ack 1, win 501, options [nop,nop,TS val 4154551638 ecr 2741319054], length 1314
03:43:53.258871 IP 185.42.205.114.1935 > 10.8.2.11.37970: Flags [.], ack 94451, win 126, options [nop,nop,TS val 2741319151 ecr 4154551303], length 0
03:43:53.286239 IP 10.8.2.11.37970 > 185.42.205.114.1935: Flags [.], seq 103779:105093, ack 1, win 501, options [nop,nop,TS val 4154551680 ecr 2741319151], length 1314
03:43:53.306892 IP 185.42.205.114.1935 > 10.8.2.11.37970: Flags [.], ack 97079, win 126, options [nop,nop,TS val 2741319199 ecr 4154551371], length 0
03:43:53.309677 IP 10.8.2.11.37970 > 185.42.205.114.1935: Flags [.], seq 105093:106407, ack 1, win 501, options [nop,nop,TS val 4154551703 ecr 2741319199], length 1314
03:43:53.344443 IP 185.42.205.114.1935 > 10.8.2.11.37970: Flags [.], ack 98523, win 126, options [nop,nop,TS val 2741319237 ecr 4154551444], length 0
03:43:53.344474 IP 10.8.2.11.37970 > 185.42.205.114.1935: Flags [P.], seq 106407:106625, ack 1, win 501, options [nop,nop,TS val 4154551738 ecr 2741319237], length 218
03:43:53.376353 IP 10.8.2.11.37970 > 185.42.205.114.1935: Flags [.], seq 106625:107939, ack 1, win 501, options [nop,nop,TS val 4154551770 ecr 2741319237], length 1314
03:43:53.414586 IP 10.8.2.11.37970 > 185.42.205.114.1935: Flags [.], seq 107939:109253, ack 1, win 501, options [nop,nop,TS val 4154551808 ecr 2741319237], length 1314
03:43:53.424986 IP 185.42.205.114.1935 > 10.8.2.11.37970: Flags [.], ack 101151, win 126, options [nop,nop,TS val 2741319317 ecr 4154551508], length 0
03:43:53.476359 IP 10.8.2.11.37970 > 185.42.205.114.1935: Flags [.], seq 109253:110567, ack 1, win 501, options [nop,nop,TS val 4154551870 ecr 2741319317], length 1314
03:43:53.509730 IP 10.8.2.11.37970 > 185.42.205.114.1935: Flags [.], seq 110567:111881, ack 1, win 501, options [nop,nop,TS val 4154551903 ecr 2741319317], length 1314
03:43:53.526622 IP 185.42.205.114.1935 > 10.8.2.11.37970: Flags [.], ack 103779, win 126, options [nop,nop,TS val 2741319419 ecr 4154551572], length 0
03:43:53.542749 IP 10.8.2.11.37970 > 185.42.205.114.1935: Flags [.], seq 111881:113195, ack 1, win 501, options [nop,nop,TS val 4154551936 ecr 2741319419], length 1314
03:43:53.591658 IP 185.42.205.114.1935 > 10.8.2.11.37970: Flags [.], ack 106407, win 126, options [nop,nop,TS val 2741319484 ecr 4154551680], length 0
03:43:53.607057 IP 10.8.2.11.37970 > 185.42.205.114.1935: Flags [.], seq 113195:114509, ack 1, win 501, options [nop,nop,TS val 4154552000 ecr 2741319484], length 1314
03:43:53.626328 IP 185.42.205.114.1935 > 10.8.2.11.37970: Flags [.], ack 106625, win 126, options [nop,nop,TS val 2741319519 ecr 4154551738], length 0
03:43:53.626366 IP 10.8.2.11.37970 > 185.42.205.114.1935: Flags [P.], seq 114509:115395, ack 1, win 501, options [nop,nop,TS val 4154552020 ecr 2741319519], length 886
03:43:53.678120 IP 10.8.2.11.37970 > 185.42.205.114.1935: Flags [.], seq 115395:116709, ack 1, win 501, options [nop,nop,TS val 4154552071 ecr 2741319519], length 1314
03:43:53.696655 IP 185.42.205.114.1935 > 10.8.2.11.37970: Flags [.], ack 109253, win 126, options [nop,nop,TS val 2741319589 ecr 4154551770], length 0
03:43:53.714491 IP 10.8.2.11.37970 > 185.42.205.114.1935: Flags [.], seq 116709:118023, ack 1, win 501, options [nop,nop,TS val 4154552108 ecr 2741319589], length 1314
03:43:53.743239 IP 10.8.2.11.37970 > 185.42.205.114.1935: Flags [.], seq 118023:119337, ack 1, win 501, options [nop,nop,TS val 4154552137 ecr 2741319589], length 1314
03:43:53.794427 IP 185.42.205.114.1935 > 10.8.2.11.37970: Flags [.], ack 111881, win 126, options [nop,nop,TS val 2741319687 ecr 4154551870], length 0
03:43:53.821576 IP 10.8.2.11.37970 > 185.42.205.114.1935: Flags [.], seq 119337:120651, ack 1, win 501, options [nop,nop,TS val 4154552215 ecr 2741319687], length 1314
03:43:53.842792 IP 10.8.2.11.37970 > 185.42.205.114.1935: Flags [.], seq 120651:121965, ack 1, win 501, options [nop,nop,TS val 4154552236 ecr 2741319687], length 1314
03:43:53.885486 IP 10.8.2.11.37970 > 185.42.205.114.1935: Flags [.], seq 121965:123279, ack 1, win 501, options [nop,nop,TS val 4154552279 ecr 2741319687], length 1314
03:43:53.889122 IP 185.42.205.114.1935 > 10.8.2.11.37970: Flags [.], ack 114509, win 126, options [nop,nop,TS val 2741319781 ecr 4154551936], length 0
03:43:53.908270 IP 185.42.205.114.1935 > 10.8.2.11.37970: Flags [.], ack 115395, win 126, options [nop,nop,TS val 2741319800 ecr 4154552020], length 0
03:43:53.908309 IP 10.8.2.11.37970 > 185.42.205.114.1935: Flags [P.], seq 123279:123501, ack 1, win 501, options [nop,nop,TS val 4154552302 ecr 2741319800], length 222
03:43:53.950113 IP 10.8.2.11.37970 > 185.42.205.114.1935: Flags [.], seq 123501:124815, ack 1, win 501, options [nop,nop,TS val 4154552343 ecr 2741319800], length 1314
03:43:53.972085 IP 10.8.2.11.37970 > 185.42.205.114.1935: Flags [.], seq 124815:126129, ack 1, win 501, options [nop,nop,TS val 4154552365 ecr 2741319800], length 1314
03:43:53.996490 IP 185.42.205.114.1935 > 10.8.2.11.37970: Flags [.], ack 118023, win 126, options [nop,nop,TS val 2741319889 ecr 4154552071], length 0
03:43:54.014978 IP 10.8.2.11.37970 > 185.42.205.114.1935: Flags [.], seq 126129:127443, ack 1, win 501, options [nop,nop,TS val 4154552408 ecr 2741319889], length 1314
03:43:54.077993 IP 10.8.2.11.37970 > 185.42.205.114.1935: Flags [.], seq 127443:128757, ack 1, win 501, options [nop,nop,TS val 4154552471 ecr 2741319889], length 1314
03:43:54.094904 IP 185.42.205.114.1935 > 10.8.2.11.37970: Flags [.], ack 119337, win 126, options [nop,nop,TS val 2741319987 ecr 4154552137], length 0
03:43:54.112686 IP 10.8.2.11.37970 > 185.42.205.114.1935: Flags [.], seq 128757:130071, ack 1, win 501, options [nop,nop,TS val 4154552506 ecr 2741319987], length 1314
03:43:54.124692 IP 185.42.205.114.1935 > 10.8.2.11.37970: Flags [.], ack 121965, win 126, options [nop,nop,TS val 2741320017 ecr 4154552215], length 0
03:43:54.144593 IP 10.8.2.11.37970 > 185.42.205.114.1935: Flags [.], seq 130071:131385, ack 1, win 501, options [nop,nop,TS val 4154552538 ecr 2741320017], length 1314
03:43:54.190425 IP 185.42.205.114.1935 > 10.8.2.11.37970: Flags [.], ack 123501, win 126, options [nop,nop,TS val 2741320083 ecr 4154552279], length 0
03:43:54.190462 IP 10.8.2.11.37970 > 185.42.205.114.1935: Flags [P.], seq 131385:132449, ack 1, win 501, options [nop,nop,TS val 4154552584 ecr 2741320083], length 1064
03:43:54.244555 IP 10.8.2.11.37970 > 185.42.205.114.1935: Flags [.], seq 132449:133763, ack 1, win 501, options [nop,nop,TS val 4154552638 ecr 2741320083], length 1314
03:43:54.254108 IP 185.42.205.114.1935 > 10.8.2.11.37970: Flags [.], ack 126129, win 126, options [nop,nop,TS val 2741320146 ecr 4154552343], length 0
03:43:54.272529 IP 10.8.2.11.37970 > 185.42.205.114.1935: Flags [.], seq 133763:135077, ack 1, win 501, options [nop,nop,TS val 4154552666 ecr 2741320146], length 1314
03:43:54.315310 IP 10.8.2.11.37970 > 185.42.205.114.1935: Flags [.], seq 135077:136391, ack 1, win 501, options [nop,nop,TS val 4154552709 ecr 2741320146], length 1314
03:43:54.360092 IP 185.42.205.114.1935 > 10.8.2.11.37970: Flags [.], ack 128757, win 126, options [nop,nop,TS val 2741320252 ecr 4154552408], length 0
03:43:54.377916 IP 10.8.2.11.37970 > 185.42.205.114.1935: Flags [.], seq 136391:137705, ack 1, win 501, options [nop,nop,TS val 4154552771 ecr 2741320252], length 1314
03:43:54.411292 IP 10.8.2.11.37970 > 185.42.205.114.1935: Flags [.], seq 137705:139019, ack 1, win 501, options [nop,nop,TS val 4154552805 ecr 2741320252], length 1314
03:43:54.426527 IP 185.42.205.114.1935 > 10.8.2.11.37970: Flags [.], ack 131385, win 126, options [nop,nop,TS val 2741320319 ecr 4154552506], length 0
03:43:54.444604 IP 10.8.2.11.37970 > 185.42.205.114.1935: Flags [.], seq 139019:140333, ack 1, win 501, options [nop,nop,TS val 4154552838 ecr 2741320319], length 1314
03:43:54.472528 IP 185.42.205.114.1935 > 10.8.2.11.37970: Flags [.], ack 132449, win 126, options [nop,nop,TS val 2741320365 ecr 4154552584], length 0
03:43:54.472568 IP 10.8.2.11.37970 > 185.42.205.114.1935: Flags [P.], seq 140333:140468, ack 1, win 501, options [nop,nop,TS val 4154552866 ecr 2741320365], length 135
03:43:54.508900 IP 10.8.2.11.37970 > 185.42.205.114.1935: Flags [.], seq 140468:141782, ack 1, win 501, options [nop,nop,TS val 4154552902 ecr 2741320365], length 1314
03:43:54.543152 IP 10.8.2.11.37970 > 185.42.205.114.1935: Flags [.], seq 141782:143096, ack 1, win 501, options [nop,nop,TS val 4154552936 ecr 2741320365], length 1314
03:43:54.554486 IP 185.42.205.114.1935 > 10.8.2.11.37970: Flags [.], ack 135077, win 126, options [nop,nop,TS val 2741320447 ecr 4154552638], length 0
03:43:54.594687 IP 10.8.2.11.37970 > 185.42.205.114.1935: Flags [.], seq 143096:144410, ack 1, win 501, options [nop,nop,TS val 4154552988 ecr 2741320447], length 1314
03:43:54.644274 IP 10.8.2.11.37970 > 185.42.205.114.1935: Flags [.], seq 144410:145724, ack 1, win 501, options [nop,nop,TS val 4154553038 ecr 2741320447], length 1314
03:43:54.660106 IP 185.42.205.114.1935 > 10.8.2.11.37970: Flags [.], ack 137705, win 126, options [nop,nop,TS val 2741320552 ecr 4154552709], length 0
03:43:54.676046 IP 10.8.2.11.37970 > 185.42.205.114.1935: Flags [.], seq 145724:147038, ack 1, win 501, options [nop,nop,TS val 4154553069 ecr 2741320552], length 1314
03:43:54.723347 IP 10.8.2.11.37970 > 185.42.205.114.1935: Flags [.], seq 147038:148352, ack 1, win 501, options [nop,nop,TS val 4154553117 ecr 2741320552], length 1314
03:43:54.726997 IP 185.42.205.114.1935 > 10.8.2.11.37970: Flags [.], ack 140333, win 126, options [nop,nop,TS val 2741320619 ecr 4154552805], length 0
03:43:54.754467 IP 185.42.205.114.1935 > 10.8.2.11.37970: Flags [.], ack 140468, win 126, options [nop,nop,TS val 2741320647 ecr 4154552866], length 0
03:43:54.754511 IP 10.8.2.11.37970 > 185.42.205.114.1935: Flags [P.], seq 148352:149325, ack 1, win 501, options [nop,nop,TS val 4154553148 ecr 2741320647], length 973
03:43:54.809714 IP 10.8.2.11.37970 > 185.42.205.114.1935: Flags [.], seq 149325:150639, ack 1, win 501, options [nop,nop,TS val 4154553203 ecr 2741320647], length 1314
03:43:54.825053 IP 185.42.205.114.1935 > 10.8.2.11.37970: Flags [.], ack 143096, win 126, options [nop,nop,TS val 2741320717 ecr 4154552902], length 0
03:43:54.844564 IP 10.8.2.11.37970 > 185.42.205.114.1935: Flags [.], seq 150639:151953, ack 1, win 501, options [nop,nop,TS val 4154553238 ecr 2741320717], length 1314
03:43:54.878206 IP 10.8.2.11.37970 > 185.42.205.114.1935: Flags [.], seq 151953:153267, ack 1, win 501, options [nop,nop,TS val 4154553272 ecr 2741320717], length 1314
03:43:54.926317 IP 185.42.205.114.1935 > 10.8.2.11.37970: Flags [.], ack 145724, win 126, options [nop,nop,TS val 2741320818 ecr 4154552988], length 0
03:43:54.942610 IP 10.8.2.11.37970 > 185.42.205.114.1935: Flags [.], seq 153267:154581, ack 1, win 501, options [nop,nop,TS val 4154553336 ecr 2741320818], length 1314
03:43:54.975516 IP 10.8.2.11.37970 > 185.42.205.114.1935: Flags [.], seq 154581:155895, ack 1, win 501, options [nop,nop,TS val 4154553369 ecr 2741320818], length 1314
03:43:55.005494 IP 185.42.205.114.1935 > 10.8.2.11.37970: Flags [.], ack 148352, win 126, options [nop,nop,TS val 2741320898 ecr 4154553069], length 0
03:43:55.009519 IP 10.8.2.11.37970 > 185.42.205.114.1935: Flags [.], seq 155895:157209, ack 1, win 501, options [nop,nop,TS val 4154553403 ecr 2741320898], length 1314
03:43:55.036433 IP 185.42.205.114.1935 > 10.8.2.11.37970: Flags [.], ack 149325, win 126, options [nop,nop,TS val 2741320929 ecr 4154553148], length 0
03:43:55.036459 IP 10.8.2.11.37970 > 185.42.205.114.1935: Flags [P.], seq 157209:157335, ack 1, win 501, options [nop,nop,TS val 4154553430 ecr 2741320929], length 126
03:43:55.077957 IP 10.8.2.11.37970 > 185.42.205.114.1935: Flags [.], seq 157335:158649, ack 1, win 501, options [nop,nop,TS val 4154553471 ecr 2741320929], length 1314
03:43:55.109629 IP 10.8.2.11.37970 > 185.42.205.114.1935: Flags [.], seq 158649:159963, ack 1, win 501, options [nop,nop,TS val 4154553503 ecr 2741320929], length 1314
03:43:55.126749 IP 185.42.205.114.1935 > 10.8.2.11.37970: Flags [.], ack 151953, win 126, options [nop,nop,TS val 2741321019 ecr 4154553203], length 0
03:43:55.152307 IP 10.8.2.11.37970 > 185.42.205.114.1935: Flags [.], seq 159963:161277, ack 1, win 501, options [nop,nop,TS val 4154553546 ecr 2741321019], length 1314
03:43:55.210480 IP 10.8.2.11.37970 > 185.42.205.114.1935: Flags [.], seq 161277:162591, ack 1, win 501, options [nop,nop,TS val 4154553604 ecr 2741321019], length 1314
03:43:55.224441 IP 185.42.205.114.1935 > 10.8.2.11.37970: Flags [.], ack 154581, win 126, options [nop,nop,TS val 2741321117 ecr 4154553272], length 0
03:43:55.244650 IP 10.8.2.11.37970 > 185.42.205.114.1935: Flags [.], seq 162591:163905, ack 1, win 501, options [nop,nop,TS val 4154553638 ecr 2741321117], length 1314
03:43:55.281089 IP 10.8.2.11.37970 > 185.42.205.114.1935: Flags [.], seq 163905:165219, ack 1, win 501, options [nop,nop,TS val 4154553674 ecr 2741321117], length 1314
03:43:55.291459 IP 185.42.205.114.1935 > 10.8.2.11.37970: Flags [.], ack 157209, win 126, options [nop,nop,TS val 2741321184 ecr 4154553369], length 0
03:43:55.318235 IP 185.42.205.114.1935 > 10.8.2.11.37970: Flags [.], ack 157335, win 126, options [nop,nop,TS val 2741321210 ecr 4154553430], length 0
03:43:55.318249 IP 10.8.2.11.37970 > 185.42.205.114.1935: Flags [P.], seq 165219:166201, ack 1, win 501, options [nop,nop,TS val 4154553712 ecr 2741321210], length 982
03:43:55.377935 IP 10.8.2.11.37970 > 185.42.205.114.1935: Flags [.], seq 166201:167515, ack 1, win 501, options [nop,nop,TS val 4154553771 ecr 2741321210], length 1314
03:43:55.391805 IP 185.42.205.114.1935 > 10.8.2.11.37970: Flags [.], ack 159963, win 126, options [nop,nop,TS val 2741321284 ecr 4154553471], length 0
03:43:55.411495 IP 10.8.2.11.37970 > 185.42.205.114.1935: Flags [.], seq 167515:168829, ack 1, win 501, options [nop,nop,TS val 4154553805 ecr 2741321284], length 1314
03:43:55.440519 IP 10.8.2.11.37970 > 185.42.205.114.1935: Flags [.], seq 168829:170143, ack 1, win 501, options [nop,nop,TS val 4154553834 ecr 2741321284], length 1314
03:43:55.492516 IP 185.42.205.114.1935 > 10.8.2.11.37970: Flags [.], ack 162591, win 126, options [nop,nop,TS val 2741321385 ecr 4154553546], length 0
03:43:55.511485 IP 10.8.2.11.37970 > 185.42.205.114.1935: Flags [.], seq 170143:171457, ack 1, win 501, options [nop,nop,TS val 4154553905 ecr 2741321385], length 1314
03:43:55.544621 IP 10.8.2.11.37970 > 185.42.205.114.1935: Flags [.], seq 171457:172771, ack 1, win 501, options [nop,nop,TS val 4154553938 ecr 2741321385], length 1314
03:43:55.563236 IP 185.42.205.114.1935 > 10.8.2.11.37970: Flags [.], ack 165219, win 126, options [nop,nop,TS val 2741321455 ecr 4154553638], length 0
03:43:55.577964 IP 10.8.2.11.37970 > 185.42.205.114.1935: Flags [.], seq 172771:174085, ack 1, win 501, options [nop,nop,TS val 4154553971 ecr 2741321455], length 1314
03:43:55.600032 IP 185.42.205.114.1935 > 10.8.2.11.37970: Flags [.], ack 166201, win 126, options [nop,nop,TS val 2741321492 ecr 4154553712], length 0
03:43:55.600071 IP 10.8.2.11.37970 > 185.42.205.114.1935: Flags [P.], seq 174085:174206, ack 1, win 501, options [nop,nop,TS val 4154553993 ecr 2741321492], length 121
03:43:55.644604 IP 10.8.2.11.37970 > 185.42.205.114.1935: Flags [.], seq 174206:175520, ack 1, win 501, options [nop,nop,TS val 4154554038 ecr 2741321492], length 1314
03:43:55.678160 IP 10.8.2.11.37970 > 185.42.205.114.1935: Flags [.], seq 175520:176834, ack 1, win 501, options [nop,nop,TS val 4154554071 ecr 2741321492], length 1314
03:43:55.693462 IP 185.42.205.114.1935 > 10.8.2.11.37970: Flags [.], ack 168829, win 126, options [nop,nop,TS val 2741321586 ecr 4154553771], length 0
03:43:55.709261 IP 10.8.2.11.37970 > 185.42.205.114.1935: Flags [.], seq 176834:178148, ack 1, win 501, options [nop,nop,TS val 4154554103 ecr 2741321586], length 1314
03:43:55.777900 IP 10.8.2.11.37970 > 185.42.205.114.1935: Flags [.], seq 178148:179462, ack 1, win 501, options [nop,nop,TS val 4154554171 ecr 2741321586], length 1314
03:43:55.793499 IP 185.42.205.114.1935 > 10.8.2.11.37970: Flags [.], ack 171457, win 126, options [nop,nop,TS val 2741321686 ecr 4154553834], length 0
03:43:55.811542 IP 10.8.2.11.37970 > 185.42.205.114.1935: Flags [.], seq 179462:180776, ack 1, win 501, options [nop,nop,TS val 4154554205 ecr 2741321686], length 1314
03:43:55.844930 IP 10.8.2.11.37970 > 185.42.205.114.1935: Flags [.], seq 180776:182090, ack 1, win 501, options [nop,nop,TS val 4154554238 ecr 2741321686], length 1314
03:43:55.859874 IP 185.42.205.114.1935 > 10.8.2.11.37970: Flags [.], ack 174085, win 126, options [nop,nop,TS val 2741321752 ecr 4154553938], length 0
03:43:55.881650 IP 185.42.205.114.1935 > 10.8.2.11.37970: Flags [.], ack 174206, win 126, options [nop,nop,TS val 2741321774 ecr 4154553993], length 0
03:43:55.881667 IP 10.8.2.11.37970 > 185.42.205.114.1935: Flags [P.], seq 182090:183160, ack 1, win 501, options [nop,nop,TS val 4154554275 ecr 2741321774], length 1070
03:43:55.944306 IP 10.8.2.11.37970 > 185.42.205.114.1935: Flags [.], seq 183160:184474, ack 1, win 501, options [nop,nop,TS val 4154554338 ecr 2741321774], length 1314
03:43:55.960272 IP 185.42.205.114.1935 > 10.8.2.11.37970: Flags [.], ack 176834, win 126, options [nop,nop,TS val 2741321852 ecr 4154554038], length 0
03:43:55.973928 IP 10.8.2.11.37970 > 185.42.205.114.1935: Flags [.], seq 184474:185788, ack 1, win 501, options [nop,nop,TS val 4154554367 ecr 2741321852], length 1314
03:43:56.008520 IP 10.8.2.11.37970 > 185.42.205.114.1935: Flags [.], seq 185788:187102, ack 1, win 501, options [nop,nop,TS val 4154554402 ecr 2741321852], length 1314
03:43:56.059901 IP 185.42.205.114.1935 > 10.8.2.11.37970: Flags [.], ack 179462, win 126, options [nop,nop,TS val 2741321952 ecr 4154554103], length 0
