13:22:51.015124 IP 10.8.0.4.51558 > 99.181.101.239.1935: Flags [.], seq 2877963575:2877964889, ack 4205959549, win 501, options [nop,nop,TS val 495476442 ecr 3839950208], length 1314
13:22:51.053609 IP 99.181.101.239.1935 > 10.8.0.4.51558: Flags [.], ack 4294963982, win 170, options [nop,nop,TS val 3839950252 ecr 495476291], length 0
13:22:51.058049 IP 10.8.0.4.51558 > 99.181.101.239.1935: Flags [.], seq 1314:2628, ack 1, win 501, options [nop,nop,TS val 495476485 ecr 3839950252], length 1314
13:22:51.103156 IP 99.181.101.239.1935 > 10.8.0.4.51558: Flags [.], ack 4294965296, win 176, options [nop,nop,TS val 3839950302 ecr 495476341], length 0
13:22:51.120735 IP 99.181.101.239.1935 > 10.8.0.4.51558: Flags [.], ack 4294965982, win 181, options [nop,nop,TS val 3839950319 ecr 495476359], length 0
13:22:51.120764 IP 10.8.0.4.51558 > 99.181.101.239.1935: Flags [P.], seq 2628:3772, ack 1, win 501, options [nop,nop,TS val 495476547 ecr 3839950319], length 1144
13:22:51.146881 IP 10.8.0.4.51558 > 99.181.101.239.1935: Flags [.], seq 3772:5086, ack 1, win 501, options [nop,nop,TS val 495476574 ecr 3839950319], length 1314
13:22:51.168593 IP 99.181.101.239.1935 > 10.8.0.4.51558: Flags [.], ack 0, win 187, options [nop,nop,TS val 3839950367 ecr 495476406], length 0
13:22:51.186069 IP 10.8.0.4.51558 > 99.181.101.239.1935: Flags [.], seq 5086:6400, ack 1, win 501, options [nop,nop,TS val 495476613 ecr 3839950367], length 1314
13:22:51.205525 IP 99.181.101.239.1935 > 10.8.0.4.51558: Flags [.], ack 1314, win 192, options [nop,nop,TS val 3839950402 ecr 495476442], length 0
13:22:51.246788 IP 99.181.101.239.1935 > 10.8.0.4.51558: Flags [.], ack 2628, win 198, options [nop,nop,TS val 3839950445 ecr 495476485], length 0
13:22:51.248071 IP 10.8.0.4.51558 > 99.181.101.239.1935: Flags [.], seq 6400:7714, ack 1, win 501, options [nop,nop,TS val 495476675 ecr 3839950445], length 1314
13:22:51.293145 IP 10.8.0.4.51558 > 99.181.101.239.1935: Flags [.], seq 7714:9028, ack 1, win 501, options [nop,nop,TS val 495476720 ecr 3839950445], length 1314
13:22:51.309800 IP 99.181.101.239.1935 > 10.8.0.4.51558: Flags [.], ack 3772, win 204, options [nop,nop,TS val 3839950508 ecr 495476547], length 0
13:22:51.309828 IP 10.8.0.4.51558 > 99.181.101.239.1935: Flags [P.], seq 9028:9611, ack 1, win 501, options [nop,nop,TS val 495476737 ecr 3839950508], length 583
13:22:51.335741 IP 99.181.101.239.1935 > 10.8.0.4.51558: Flags [.], ack 5086, win 209, options [nop,nop,TS val 3839950534 ecr 495476574], length 0
13:22:51.346622 IP 10.8.0.4.51558 > 99.181.101.239.1935: Flags [.], seq 9611:10925, ack 1, win 501, options [nop,nop,TS val 495476773 ecr 3839950534], length 1314
13:22:51.374824 IP 99.181.101.239.1935 > 10.8.0.4.51558: Flags [.], ack 6400, win 215, options [nop,nop,TS val 3839950573 ecr 495476613], length 0
13:22:51.378989 IP 10.8.0.4.51558 > 99.181.101.239.1935: Flags [.], seq 10925:12239, ack 1, win 501, options [nop,nop,TS val 495476806 ecr 3839950573], length 1314
13:22:51.415102 IP 10.8.0.4.51558 > 99.181.101.239.1935: Flags [.], seq 12239:13553, ack 1, win 501, options [nop,nop,TS val 495476842 ecr 3839950573], length 1314
13:22:51.437058 IP 99.181.101.239.1935 > 10.8.0.4.51558: Flags [.], ack 7714, win 221, options [nop,nop,TS val 3839950635 ecr 495476675], length 0
13:22:51.479015 IP 10.8.0.4.51558 > 99.181.101.239.1935: Flags [.], seq 13553:14867, ack 1, win 501, options [nop,nop,TS val 495476906 ecr 3839950635], length 1314
13:22:51.481936 IP 99.181.101.239.1935 > 10.8.0.4.51558: Flags [.], ack 9028, win 226, options [nop,nop,TS val 3839950680 ecr 495476720], length 0
13:22:51.498689 IP 99.181.101.239.1935 > 10.8.0.4.51558: Flags [.], ack 9611, win 232, options [nop,nop,TS val 3839950697 ecr 495476737], length 0
13:22:51.498711 IP 10.8.0.4.51558 > 99.181.101.239.1935: Flags [P.], seq 14867:15648, ack 1, win 501, options [nop,nop,TS val 495476925 ecr 3839950697], length 781
13:22:51.539701 IP 99.181.101.239.1935 > 10.8.0.4.51558: Flags [.], ack 10925, win 237, options [nop,nop,TS val 3839950734 ecr 495476773], length 0
13:22:51.544421 IP 10.8.0.4.51558 > 99.181.101.239.1935: Flags [.], seq 15648:16962, ack 1, win 501, options [nop,nop,TS val 495476971 ecr 3839950734], length 1314
13:22:51.568381 IP 99.181.101.239.1935 > 10.8.0.4.51558: Flags [.], ack 12239, win 243, options [nop,nop,TS val 3839950767 ecr 495476806], length 0
13:22:51.577512 IP 10.8.0.4.51558 > 99.181.101.239.1935: Flags [.], seq 16962:18276, ack 1, win 501, options [nop,nop,TS val 495477004 ecr 3839950767], length 1314
13:22:51.603825 IP 99.181.101.239.1935 > 10.8.0.4.51558: Flags [.], ack 13553, win 249, options [nop,nop,TS val 3839950802 ecr 495476842], length 0
13:22:51.613568 IP 10.8.0.4.51558 > 99.181.101.239.1935: Flags [.], seq 18276:19590, ack 1, win 501, options [nop,nop,TS val 495477040 ecr 3839950802], length 1314
13:22:51.667731 IP 99.181.101.239.1935 > 10.8.0.4.51558: Flags [.], ack 14867, win 254, options [nop,nop,TS val 3839950866 ecr 495476906], length 0
13:22:51.677223 IP 10.8.0.4.51558 > 99.181.101.239.1935: Flags [.], seq 19590:20904, ack 1, win 501, options [nop,nop,TS val 495477104 ecr 3839950866], length 1314
13:22:51.687367 IP 99.181.101.239.1935 > 10.8.0.4.51558: Flags [.], ack 15648, win 260, options [nop,nop,TS val 3839950886 ecr 495476925], length 0
13:22:51.687380 IP 10.8.0.4.51558 > 99.181.101.239.1935: Flags [P.], seq 20904:21590, ack 1, win 501, options [nop,nop,TS val 495477114 ecr 3839950886], length 686
13:22:51.733904 IP 99.181.101.239.1935 > 10.8.0.4.51558: Flags [.], ack 16962, win 265, options [nop,nop,TS val 3839950932 ecr 495476971], length 0
13:22:51.745269 IP 10.8.0.4.51558 > 99.181.101.239.1935: Flags [.], seq 21590:22904, ack 1, win 501, options [nop,nop,TS val 495477172 ecr 3839950932], length 1314
13:22:51.766229 IP 99.181.101.239.1935 > 10.8.0.4.51558: Flags [.], ack 18276, win 271, options [nop,nop,TS val 3839950965 ecr 495477004], length 0
13:22:51.783527 IP 10.8.0.4.51558 > 99.181.101.239.1935: Flags [.], seq 22904:24218, ack 1, win 501, options [nop,nop,TS val 495477210 ecr 3839950965], length 1314
13:22:51.802599 IP 99.181.101.239.1935 > 10.8.0.4.51558: Flags [.], ack 19590, win 277, options [nop,nop,TS val 3839951001 ecr 495477040], length 0
13:22:51.826638 IP 10.8.0.4.51558 > 99.181.101.239.1935: Flags [.], seq 24218:25532, ack 1, win 501, options [nop,nop,TS val 495477253 ecr 3839951001], length 1314
13:22:51.866155 IP 99.181.101.239.1935 > 10.8.0.4.51558: Flags [.], ack 20904, win 282, options [nop,nop,TS val 3839951064 ecr 495477104], length 0
13:22:51.876305 IP 99.181.101.239.1935 > 10.8.0.4.51558: Flags [.], ack 21590, win 288, options [nop,nop,TS val 3839951074 ecr 495477114], length 0
13:22:51.876347 IP 10.8.0.4.51558 > 99.181.101.239.1935: Flags [P.], seq 25532:26677, ack 1, win 501, options [nop,nop,TS val 495477303 ecr 3839951074], length 1145
13:22:51.913200 IP 10.8.0.4.51558 > 99.181.101.239.1935: Flags [.], seq 26677:27991, ack 1, win 501, options [nop,nop,TS val 495477340 ecr 3839951074], length 1314
13:22:51.934070 IP 99.181.101.239.1935 > 10.8.0.4.51558: Flags [.], ack 22904, win 293, options [nop,nop,TS val 3839951132 ecr 495477172], length 0
13:22:51.946540 IP 10.8.0.4.51558 > 99.181.101.239.1935: Flags [.], seq 27991:29305, ack 1, win 501, options [nop,nop,TS val 495477373 ecr 3839951132], length 1314
13:22:51.972420 IP 99.181.101.239.1935 > 10.8.0.4.51558: Flags [.], ack 24218, win 299, options [nop,nop,TS val 3839951171 ecr 495477210], length 0
13:22:51.998230 IP 10.8.0.4.51558 > 99.181.101.239.1935: Flags [.], seq 29305:30619, ack 1, win 501, options [nop,nop,TS val 495477425 ecr 3839951171], length 1314
13:22:52.015358 IP 99.181.101.239.1935 > 10.8.0.4.51558: Flags [.], ack 25532, win 305, options [nop,nop,TS val 3839951214 ecr 495477253], length 0
13:22:52.041053 IP 10.8.0.4.51558 > 99.181.101.239.1935: Flags [.], seq 30619:31933, ack 1, win 501, options [nop,nop,TS val 495477468 ecr 3839951214], length 1314
13:22:52.065301 IP 99.181.101.239.1935 > 10.8.0.4.51558: Flags [.], ack 26677, win 310, options [nop,nop,TS val 3839951264 ecr 495477303], length 0
13:22:52.065339 IP 10.8.0.4.51558 > 99.181.101.239.1935: Flags [P.], seq 31933:32607, ack 1, win 501, options [nop,nop,TS val 495477492 ecr 3839951264], length 674
13:22:52.102241 IP 99.181.101.239.1935 > 10.8.0.4.51558: Flags [.], ack 27991, win 316, options [nop,nop,TS val 3839951301 ecr 495477340], length 0
13:22:52.116169 IP 10.8.0.4.51558 > 99.181.101.239.1935: Flags [.], seq 32607:33921, ack 1, win 501, options [nop,nop,TS val 495477543 ecr 3839951301], length 1314
13:22:52.135848 IP 99.181.101.239.1935 > 10.8.0.4.51558: Flags [.], ack 29305, win 322, options [nop,nop,TS val 3839951334 ecr 495477373], length 0
13:22:52.146627 IP 10.8.0.4.51558 > 99.181.101.239.1935: Flags [.], seq 33921:35235, ack 1, win 501, options [nop,nop,TS val 495477573 ecr 3839951334], length 1314
13:22:52.187085 IP 99.181.101.239.1935 > 10.8.0.4.51558: Flags [.], ack 30619, win 327, options [nop,nop,TS val 3839951385 ecr 495477425], length 0
13:22:52.190967 IP 10.8.0.4.51558 > 99.181.101.239.1935: Flags [.], seq 35235:36549, ack 1, win 501, options [nop,nop,TS val 495477618 ecr 3839951385], length 1314
13:22:52.229962 IP 99.181.101.239.1935 > 10.8.0.4.51558: Flags [.], ack 31933, win 333, options [nop,nop,TS val 3839951428 ecr 495477468], length 0
13:22:52.249027 IP 10.8.0.4.51558 > 99.181.101.239.1935: Flags [.], seq 36549:37863, ack 1, win 501, options [nop,nop,TS val 495477676 ecr 3839951428], length 1314
13:22:52.254130 IP 99.181.101.239.1935 > 10.8.0.4.51558: Flags [.], ack 32607, win 338, options [nop,nop,TS val 3839951452 ecr 495477492], length 0
13:22:52.254177 IP 10.8.0.4.51558 > 99.181.101.239.1935: Flags [P.], seq 37863:38454, ack 1, win 501, options [nop,nop,TS val 495477681 ecr 3839951452], length 591
13:22:52.305049 IP 99.181.101.239.1935 > 10.8.0.4.51558: Flags [.], ack 33921, win 344, options [nop,nop,TS val 3839951503 ecr 495477543], length 0
13:22:52.315575 IP 10.8.0.4.51558 > 99.181.101.239.1935: Flags [.], seq 38454:39768, ack 1, win 501, options [nop,nop,TS val 495477742 ecr 3839951503], length 1314
13:22:52.335213 IP 99.181.101.239.1935 > 10.8.0.4.51558: Flags [.], ack 35235, win 349, options [nop,nop,TS val 3839951534 ecr 495477573], length 0
13:22:52.346314 IP 10.8.0.4.51558 > 99.181.101.239.1935: Flags [.], seq 39768:41082, ack 1, win 501, options [nop,nop,TS val 495477773 ecr 3839951534], length 1314
13:22:52.378900 IP 10.8.0.4.51558 > 99.181.101.239.1935: Flags [.], seq 41082:42396, ack 1, win 501, options [nop,nop,TS val 495477806 ecr 3839951534], length 1314
13:22:52.379697 IP 99.181.101.239.1935 > 10.8.0.4.51558: Flags [.], ack 36549, win 355, options [nop,nop,TS val 3839951578 ecr 495477618], length 0
13:22:52.437790 IP 99.181.101.239.1935 > 10.8.0.4.51558: Flags [.], ack 37863, win 361, options [nop,nop,TS val 3839951636 ecr 495477676], length 0
13:22:52.442825 IP 99.181.101.239.1935 > 10.8.0.4.51558: Flags [.], ack 38454, win 366, options [nop,nop,TS val 3839951641 ecr 495477681], length 0
13:22:52.442850 IP 10.8.0.4.51558 > 99.181.101.239.1935: Flags [P.], seq 42396:43549, ack 1, win 501, options [nop,nop,TS val 495477870 ecr 3839951641], length 1153
13:22:52.482540 IP 10.8.0.4.51558 > 99.181.101.239.1935: Flags [.], seq 43549:44863, ack 1, win 501, options [nop,nop,TS val 495477909 ecr 3839951641], length 1314
13:22:52.504416 IP 99.181.101.239.1935 > 10.8.0.4.51558: Flags [.], ack 39768, win 371, options [nop,nop,TS val 3839951703 ecr 495477742], length 0
13:22:52.511608 IP 10.8.0.4.51558 > 99.181.101.239.1935: Flags [.], seq 44863:46177, ack 1, win 501, options [nop,nop,TS val 495477938 ecr 3839951703], length 1314
13:22:52.535266 IP 99.181.101.239.1935 > 10.8.0.4.51558: Flags [.], ack 41082, win 377, options [nop,nop,TS val 3839951734 ecr 495477773], length 0
13:22:52.554067 IP 10.8.0.4.51558 > 99.181.101.239.1935: Flags [.], seq 46177:47491, ack 1, win 501, options [nop,nop,TS val 495477981 ecr 3839951734], length 1314
13:22:52.567623 IP 99.181.101.239.1935 > 10.8.0.4.51558: Flags [.], ack 42396, win 383, options [nop,nop,TS val 3839951766 ecr 495477806], length 0
13:22:52.613944 IP 10.8.0.4.51558 > 99.181.101.239.1935: Flags [.], seq 47491:48805, ack 1, win 501, options [nop,nop,TS val 495478041 ecr 3839951766], length 1314
13:22:52.631754 IP 99.181.101.239.1935 > 10.8.0.4.51558: Flags [.], ack 43549, win 388, options [nop,nop,TS val 3839951830 ecr 495477870], length 0
13:22:52.631766 IP 10.8.0.4.51558 > 99.181.101.239.1935: Flags [P.], seq 48805:49492, ack 1, win 501, options [nop,nop,TS val 495478058 ecr 3839951830], length 687
13:22:52.671422 IP 99.181.101.239.1935 > 10.8.0.4.51558: Flags [.], ack 44863, win 394, options [nop,nop,TS val 3839951870 ecr 495477909], length 0
13:22:52.679549 IP 10.8.0.4.51558 > 99.181.101.239.1935: Flags [.], seq 49492:50806, ack 1, win 501, options [nop,nop,TS val 495478106 ecr 3839951870], length 1314
13:22:52.700599 IP 99.181.101.239.1935 > 10.8.0.4.51558: Flags [.], ack 46177, win 400, options [nop,nop,TS val 3839951899 ecr 495477938], length 0
13:22:52.714072 IP 10.8.0.4.51558 > 99.181.101.239.1935: Flags [.], seq 50806:52120, ack 1, win 501, options [nop,nop,TS val 495478141 ecr 3839951899], length 1314
13:22:52.743050 IP 99.181.101.239.1935 > 10.8.0.4.51558: Flags [.], ack 47491, win 405, options [nop,nop,TS val 3839951941 ecr 495477981], length 0
13:22:52.749678 IP 10.8.0.4.51558 > 99.181.101.239.1935: Flags [.], seq 52120:53434, ack 1, win 501, options [nop,nop,TS val 495478176 ecr 3839951941], length 1314
13:22:52.802853 IP 99.181.101.239.1935 > 10.8.0.4.51558: Flags [.], ack 48805, win 411, options [nop,nop,TS val 3839952001 ecr 495478041], length 0
13:22:52.810687 IP 10.8.0.4.51558 > 99.181.101.239.1935: Flags [.], seq 53434:54748, ack 1, win 501, options [nop,nop,TS val 495478237 ecr 3839952001], length 1314
13:22:52.820646 IP 99.181.101.239.1935 > 10.8.0.4.51558: Flags [.], ack 49492, win 416, options [nop,nop,TS val 3839952019 ecr 495478058], length 0
13:22:52.820670 IP 10.8.0.4.51558 > 99.181.101.239.1935: Flags [P.], seq 54748:55422, ack 1, win 501, options [nop,nop,TS val 495478247 ecr 3839952019], length 674
13:22:52.868238 IP 99.181.101.239.1935 > 10.8.0.4.51558: Flags [.], ack 50806, win 422, options [nop,nop,TS val 3839952067 ecr 495478106], length 0
13:22:52.880011 IP 10.8.0.4.51558 > 99.181.101.239.1935: Flags [.], seq 55422:56736, ack 1, win 501, options [nop,nop,TS val 495478307 ecr 3839952067], length 1314
13:22:52.902961 IP 99.181.101.239.1935 > 10.8.0.4.51558: Flags [.], ack 52120, win 427, options [nop,nop,TS val 3839952101 ecr 495478141], length 0
13:22:52.911940 IP 10.8.0.4.51558 > 99.181.101.239.1935: Flags [.], seq 56736:58050, ack 1, win 501, options [nop,nop,TS val 495478339 ecr 3839952101], length 1314
13:22:52.938674 IP 99.181.101.239.1935 > 10.8.0.4.51558: Flags [.], ack 53434, win 433, options [nop,nop,TS val 3839952137 ecr 495478176], length 0
13:22:52.946361 IP 10.8.0.4.51558 > 99.181.101.239.1935: Flags [.], seq 58050:59364, ack 1, win 501, options [nop,nop,TS val 495478373 ecr 3839952137], length 1314
13:22:52.999564 IP 99.181.101.239.1935 > 10.8.0.4.51558: Flags [.], ack 54748, win 439, options [nop,nop,TS val 3839952198 ecr 495478237], length 0
13:22:53.009571 IP 99.181.101.239.1935 > 10.8.0.4.51558: Flags [.], ack 55422, win 444, options [nop,nop,TS val 3839952208 ecr 495478247], length 0
13:22:53.009603 IP 10.8.0.4.51558 > 99.181.101.239.1935: Flags [P.], seq 59364:60512, ack 1, win 501, options [nop,nop,TS val 495478436 ecr 3839952208], length 1148
13:22:53.043896 IP 10.8.0.4.51558 > 99.181.101.239.1935: Flags [.], seq 60512:61826, ack 1, win 501, options [nop,nop,TS val 495478471 ecr 3839952208], length 1314
13:22:53.068924 IP 99.181.101.239.1935 > 10.8.0.4.51558: Flags [.], ack 56736, win 450, options [nop,nop,TS val 3839952267 ecr 495478307], length 0
13:22:53.078357 IP 10.8.0.4.51558 > 99.181.101.239.1935: Flags [.], seq 61826:63140, ack 1, win 501, options [nop,nop,TS val 495478505 ecr 3839952267], length 1314
13:22:53.100796 IP 99.181.101.239.1935 > 10.8.0.4.51558: Flags [.], ack 58050, win 455, options [nop,nop,TS val 3839952299 ecr 495478339], length 0
13:22:53.129916 IP 10.8.0.4.51558 > 99.181.101.239.1935: Flags [.], seq 63140:64454, ack 1, win 501, options [nop,nop,TS val 495478557 ecr 3839952299], length 1314
13:22:53.135269 IP 99.181.101.239.1935 > 10.8.0.4.51558: Flags [.], ack 59364, win 461, options [nop,nop,TS val 3839952334 ecr 495478373], length 0
13:22:53.181713 IP 10.8.0.4.51558 > 99.181.101.239.1935: Flags [.], seq 64454:65768, ack 1, win 501, options [nop,nop,TS val 495478608 ecr 3839952334], length 1314
13:22:53.198428 IP 99.181.101.239.1935 > 10.8.0.4.51558: Flags [.], ack 60512, win 466, options [nop,nop,TS val 3839952397 ecr 495478436], length 0
13:22:53.198465 IP 10.8.0.4.51558 > 99.181.101.239.1935: Flags [P.], seq 65768:66454, ack 1, win 501, options [nop,nop,TS val 495478625 ecr 3839952397], length 686
13:22:53.232994 IP 99.181.101.239.1935 > 10.8.0.4.51558: Flags [.], ack 61826, win 472, options [nop,nop,TS val 3839952431 ecr 495478471], length 0
13:22:53.245559 IP 10.8.0.4.51558 > 99.181.101.239.1935: Flags [.], seq 66454:67768, ack 1, win 501, options [nop,nop,TS val 495478672 ecr 3839952431], length 1314
13:22:53.267233 IP 99.181.101.239.1935 > 10.8.0.4.51558: Flags [.], ack 63140, win 478, options [nop,nop,TS val 3839952466 ecr 495478505], length 0
13:22:53.279811 IP 10.8.0.4.51558 > 99.181.101.239.1935: Flags [.], seq 67768:69082, ack 1, win 501, options [nop,nop,TS val 495478706 ecr 3839952466], length 1314
13:22:53.319011 IP 99.181.101.239.1935 > 10.8.0.4.51558: Flags [.], ack 64454, win 483, options [nop,nop,TS val 3839952517 ecr 495478557], length 0
13:22:53.322705 IP 10.8.0.4.51558 > 99.181.101.239.1935: Flags [.], seq 69082:70396, ack 1, win 501, options [nop,nop,TS val 495478749 ecr 3839952517], length 1314
13:22:53.370801 IP 99.181.101.239.1935 > 10.8.0.4.51558: Flags [.], ack 65768, win 489, options [nop,nop,TS val 3839952569 ecr 495478608], length 0
13:22:53.379769 IP 10.8.0.4.51558 > 99.181.101.239.1935: Flags [.], seq 70396:71710, ack 1, win 501, options [nop,nop,TS val 495478806 ecr 3839952569], length 1314
13:22:53.387305 IP 99.181.101.239.1935 > 10.8.0.4.51558: Flags [.], ack 66454, win 494, options [nop,nop,TS val 3839952586 ecr 495478625], length 0
13:22:53.387328 IP 10.8.0.4.51558 > 99.181.101.239.1935: Flags [P.], seq 71710:72396, ack 1, win 501, options [nop,nop,TS val 495478814 ecr 3839952586], length 686
13:22:53.434264 IP 99.181.101.239.1935 > 10.8.0.4.51558: Flags [.], ack 67768, win 500, options [nop,nop,TS val 3839952633 ecr 495478672], length 0
13:22:53.446712 IP 10.8.0.4.51558 > 99.181.101.239.1935: Flags [.], seq 72396:73710, ack 1, win 501, options [nop,nop,TS val 495478873 ecr 3839952633], length 1314
13:22:53.468543 IP 99.181.101.239.1935 > 10.8.0.4.51558: Flags [.], ack 69082, win 506, options [nop,nop,TS val 3839952667 ecr 495478706], length 0
13:22:53.479942 IP 10.8.0.4.51558 > 99.181.101.239.1935: Flags [.], seq 73710:75024, ack 1, win 501, options [nop,nop,TS val 495478907 ecr 3839952667], length 1314
13:22:53.512244 IP 99.181.101.239.1935 > 10.8.0.4.51558: Flags [.], ack 70396, win 511, options [nop,nop,TS val 3839952710 ecr 495478749], length 0
13:22:53.514925 IP 10.8.0.4.51558 > 99.181.101.239.1935: Flags [.], seq 75024:76338, ack 1, win 501, options [nop,nop,TS val 495478942 ecr 3839952710], length 1314
13:22:53.568630 IP 99.181.101.239.1935 > 10.8.0.4.51558: Flags [.], ack 71710, win 517, options [nop,nop,TS val 3839952767 ecr 495478806], length 0
13:22:53.576301 IP 99.181.101.239.1935 > 10.8.0.4.51558: Flags [.], ack 72396, win 522, options [nop,nop,TS val 3839952775 ecr 495478814], length 0
13:22:53.576334 IP 10.8.0.4.51558 > 99.181.101.239.1935: Flags [P.], seq 76338:77384, ack 1, win 501, options [nop,nop,TS val 495479003 ecr 3839952775], length 1046
13:22:53.611758 IP 10.8.0.4.51558 > 99.181.101.239.1935: Flags [.], seq 77384:78698, ack 1, win 501, options [nop,nop,TS val 495479038 ecr 3839952775], length 1314
13:22:53.635760 IP 99.181.101.239.1935 > 10.8.0.4.51558: Flags [.], ack 73710, win 528, options [nop,nop,TS val 3839952834 ecr 495478873], length 0
13:22:53.642971 IP 10.8.0.4.51558 > 99.181.101.239.1935: Flags [.], seq 78698:80012, ack 1, win 501, options [nop,nop,TS val 495479070 ecr 3839952834], length 1314
13:22:53.668660 IP 99.181.101.239.1935 > 10.8.0.4.51558: Flags [.], ack 75024, win 533, options [nop,nop,TS val 3839952867 ecr 495478907], length 0
13:22:53.685907 IP 10.8.0.4.51558 > 99.181.101.239.1935: Flags [.], seq 80012:81326, ack 1, win 501, options [nop,nop,TS val 495479113 ecr 3839952867], length 1314
13:22:53.703849 IP 99.181.101.239.1935 > 10.8.0.4.51558: Flags [.], ack 76338, win 539, options [nop,nop,TS val 3839952902 ecr 495478942], length 0
13:22:53.748101 IP 10.8.0.4.51558 > 99.181.101.239.1935: Flags [.], seq 81326:82640, ack 1, win 501, options [nop,nop,TS val 495479175 ecr 3839952902], length 1314
13:22:53.765001 IP 99.181.101.239.1935 > 10.8.0.4.51558: Flags [.], ack 77384, win 545, options [nop,nop,TS val 3839952963 ecr 495479003], length 0
13:22:53.765034 IP 10.8.0.4.51558 > 99.181.101.239.1935: Flags [P.], seq 82640:83318, ack 1, win 501, options [nop,nop,TS val 495479192 ecr 3839952963], length 678
13:22:53.800665 IP 99.181.101.239.1935 > 10.8.0.4.51558: Flags [.], ack 78698, win 550, options [nop,nop,TS val 3839952999 ecr 495479038], length 0
13:22:53.814841 IP 10.8.0.4.51558 > 99.181.101.239.1935: Flags [.], seq 83318:84632, ack 1, win 501, options [nop,nop,TS val 495479242 ecr 3839952999], length 1314
13:22:53.839282 IP 99.181.101.239.1935 > 10.8.0.4.51558: Flags [.], ack 80012, win 556, options [nop,nop,TS val 3839953032 ecr 495479070], length 0
13:22:53.848062 IP 10.8.0.4.51558 > 99.181.101.239.1935: Flags [.], seq 84632:85946, ack 1, win 501, options [nop,nop,TS val 495479275 ecr 3839953032], length 1314
13:22:53.874870 IP 99.181.101.239.1935 > 10.8.0.4.51558: Flags [.], ack 81326, win 562, options [nop,nop,TS val 3839953073 ecr 495479113], length 0
13:22:53.881573 IP 10.8.0.4.51558 > 99.181.101.239.1935: Flags [.], seq 85946:87260, ack 1, win 501, options [nop,nop,TS val 495479308 ecr 3839953073], length 1314
13:22:53.936883 IP 99.181.101.239.1935 > 10.8.0.4.51558: Flags [.], ack 82640, win 567, options [nop,nop,TS val 3839953135 ecr 495479175], length 0
13:22:53.946715 IP 10.8.0.4.51558 > 99.181.101.239.1935: Flags [.], seq 87260:88574, ack 1, win 501, options [nop,nop,TS val 495479373 ecr 3839953135], length 1314
13:22:53.953934 IP 99.181.101.239.1935 > 10.8.0.4.51558: Flags [.], ack 83318, win 572, options [nop,nop,TS val 3839953152 ecr 495479192], length 0
13:22:53.953954 IP 10.8.0.4.51558 > 99.181.101.239.1935: Flags [P.], seq 88574:89260, ack 1, win 501, options [nop,nop,TS val 495479381 ecr 3839953152], length 686
13:22:54.003623 IP 99.181.101.239.1935 > 10.8.0.4.51558: Flags [.], ack 84632, win 578, options [nop,nop,TS val 3839953202 ecr 495479242], length 0
13:22:54.011302 IP 10.8.0.4.51558 > 99.181.101.239.1935: Flags [.], seq 89260:90574, ack 1, win 501, options [nop,nop,TS val 495479438 ecr 3839953202], length 1314
13:22:54.037036 IP 99.181.101.239.1935 > 10.8.0.4.51558: Flags [.], ack 85946, win 584, options [nop,nop,TS val 3839953235 ecr 495479275], length 0
13:22:54.048085 IP 10.8.0.4.51558 > 99.181.101.239.1935: Flags [.], seq 90574:91888, ack 1, win 501, options [nop,nop,TS val 495479475 ecr 3839953235], length 1314
13:22:54.070698 IP 99.181.101.239.1935 > 10.8.0.4.51558: Flags [.], ack 87260, win 589, options [nop,nop,TS val 3839953269 ecr 495479308], length 0
13:22:54.081620 IP 10.8.0.4.51558 > 99.181.101.239.1935: Flags [.], seq 91888:93202, ack 1, win 501, options [nop,nop,TS val 495479508 ecr 3839953269], length 1314
13:22:54.135596 IP 99.181.101.239.1935 > 10.8.0.4.51558: Flags [.], ack 88574, win 595, options [nop,nop,TS val 3839953334 ecr 495479373], length 0
13:22:54.142686 IP 99.181.101.239.1935 > 10.8.0.4.51558: Flags [.], ack 89260, win 600, options [nop,nop,TS val 3839953341 ecr 495479381], length 0
13:22:54.142713 IP 10.8.0.4.51558 > 99.181.101.239.1935: Flags [P.], seq 93202:94355, ack 1, win 501, options [nop,nop,TS val 495479569 ecr 3839953341], length 1153
13:22:54.178911 IP 10.8.0.4.51558 > 99.181.101.239.1935: Flags [.], seq 94355:95669, ack 1, win 501, options [nop,nop,TS val 495479606 ecr 3839953341], length 1314
13:22:54.200042 IP 99.181.101.239.1935 > 10.8.0.4.51558: Flags [.], ack 90574, win 606, options [nop,nop,TS val 3839953399 ecr 495479438], length 0
13:22:54.214121 IP 10.8.0.4.51558 > 99.181.101.239.1935: Flags [.], seq 95669:96983, ack 1, win 501, options [nop,nop,TS val 495479641 ecr 3839953399], length 1314
13:22:54.236820 IP 99.181.101.239.1935 > 10.8.0.4.51558: Flags [.], ack 91888, win 611, options [nop,nop,TS val 3839953435 ecr 495479475], length 0
13:22:54.264592 IP 10.8.0.4.51558 > 99.181.101.239.1935: Flags [.], seq 96983:98297, ack 1, win 501, options [nop,nop,TS val 495479691 ecr 3839953435], length 1314
13:22:54.270571 IP 99.181.101.239.1935 > 10.8.0.4.51558: Flags [.], ack 93202, win 617, options [nop,nop,TS val 3839953469 ecr 495479508], length 0
13:22:54.312590 IP 10.8.0.4.51558 > 99.181.101.239.1935: Flags [.], seq 98297:99611, ack 1, win 501, options [nop,nop,TS val 495479739 ecr 3839953469], length 1314
13:22:54.332034 IP 99.181.101.239.1935 > 10.8.0.4.51558: Flags [.], ack 94355, win 623, options [nop,nop,TS val 3839953530 ecr 495479569], length 0
13:22:54.332057 IP 10.8.0.4.51558 > 99.181.101.239.1935: Flags [P.], seq 99611:100289, ack 1, win 501, options [nop,nop,TS val 495479759 ecr 3839953530], length 678
13:22:54.368072 IP 99.181.101.239.1935 > 10.8.0.4.51558: Flags [.], ack 95669, win 628, options [nop,nop,TS val 3839953566 ecr 495479606], length 0
13:22:54.381381 IP 10.8.0.4.51558 > 99.181.101.239.1935: Flags [.], seq 100289:101603, ack 1, win 501, options [nop,nop,TS val 495479808 ecr 3839953566], length 1314
13:22:54.403132 IP 99.181.101.239.1935 > 10.8.0.4.51558: Flags [.], ack 96983, win 634, options [nop,nop,TS val 3839953601 ecr 495479641], length 0
13:22:54.413184 IP 10.8.0.4.51558 > 99.181.101.239.1935: Flags [.], seq 101603:102917, ack 1, win 501, options [nop,nop,TS val 495479840 ecr 3839953601], length 1314
13:22:54.453473 IP 99.181.101.239.1935 > 10.8.0.4.51558: Flags [.], ack 98297, win 640, options [nop,nop,TS val 3839953652 ecr 495479691], length 0
13:22:54.457222 IP 10.8.0.4.51558 > 99.181.101.239.1935: Flags [.], seq 102917:104231, ack 1, win 501, options [nop,nop,TS val 495479884 ecr 3839953652], length 1314
13:22:54.501621 IP 99.181.101.239.1935 > 10.8.0.4.51558: Flags [.], ack 99611, win 645, options [nop,nop,TS val 3839953700 ecr 495479739], length 0
13:22:54.513040 IP 10.8.0.4.51558 > 99.181.101.239.1935: Flags [.], seq 104231:105545, ack 1, win 501, options [nop,nop,TS val 495479940 ecr 3839953700], length 1314
13:22:54.521022 IP 99.181.101.239.1935 > 10.8.0.4.51558: Flags [.], ack 100289, win 651, options [nop,nop,TS val 3839953719 ecr 495479759], length 0
13:22:54.521048 IP 10.8.0.4.51558 > 99.181.101.239.1935: Flags [P.], seq 105545:106128, ack 1, win 501, options [nop,nop,TS val 495479948 ecr 3839953719], length 583
13:22:54.570169 IP 99.181.101.239.1935 > 10.8.0.4.51558: Flags [.], ack 101603, win 656, options [nop,nop,TS val 3839953769 ecr 495479808], length 0
13:22:54.580912 IP 10.8.0.4.51558 > 99.181.101.239.1935: Flags [.], seq 106128:107442, ack 1, win 501, options [nop,nop,TS val 495480008 ecr 3839953769], length 1314
13:22:54.602337 IP 99.181.101.239.1935 > 10.8.0.4.51558: Flags [.], ack 102917, win 662, options [nop,nop,TS val 3839953801 ecr 495479840], length 0
13:22:54.614317 IP 10.8.0.4.51558 > 99.181.101.239.1935: Flags [.], seq 107442:108756, ack 1, win 501, options [nop,nop,TS val 495480041 ecr 3839953801], length 1314
13:22:54.646117 IP 99.181.101.239.1935 > 10.8.0.4.51558: Flags [.], ack 104231, win 667, options [nop,nop,TS val 3839953844 ecr 495479884], length 0
13:22:54.647766 IP 10.8.0.4.51558 > 99.181.101.239.1935: Flags [.], seq 108756:110070, ack 1, win 501, options [nop,nop,TS val 495480074 ecr 3839953844], length 1314
13:22:54.702040 IP 99.181.101.239.1935 > 10.8.0.4.51558: Flags [.], ack 105545, win 673, options [nop,nop,TS val 3839953901 ecr 495479940], length 0
13:22:54.709900 IP 99.181.101.239.1935 > 10.8.0.4.51558: Flags [.], ack 106128, win 678, options [nop,nop,TS val 3839953908 ecr 495479948], length 0
13:22:54.709941 IP 10.8.0.4.51558 > 99.181.101.239.1935: Flags [P.], seq 110070:111222, ack 1, win 501, options [nop,nop,TS val 495480137 ecr 3839953908], length 1152
13:22:54.748255 IP 10.8.0.4.51558 > 99.181.101.239.1935: Flags [.], seq 111222:112536, ack 1, win 501, options [nop,nop,TS val 495480175 ecr 3839953908], length 1314
13:22:54.770114 IP 99.181.101.239.1935 > 10.8.0.4.51558: Flags [.], ack 107442, win 684, options [nop,nop,TS val 3839953968 ecr 495480008], length 0
13:22:54.781475 IP 10.8.0.4.51558 > 99.181.101.239.1935: Flags [.], seq 112536:113850, ack 1, win 501, options [nop,nop,TS val 495480208 ecr 3839953968], length 1314
13:22:54.803511 IP 99.181.101.239.1935 > 10.8.0.4.51558: Flags [.], ack 108756, win 690, options [nop,nop,TS val 3839954002 ecr 495480041], length 0
13:22:54.822317 IP 10.8.0.4.51558 > 99.181.101.239.1935: Flags [.], seq 113850:115164, ack 1, win 501, options [nop,nop,TS val 495480249 ecr 3839954002], length 1314
13:22:54.836676 IP 99.181.101.239.1935 > 10.8.0.4.51558: Flags [.], ack 110070, win 695, options [nop,nop,TS val 3839954035 ecr 495480074], length 0
13:22:54.881688 IP 10.8.0.4.51558 > 99.181.101.239.1935: Flags [.], seq 115164:116478, ack 1, win 501, options [nop,nop,TS val 495480308 ecr 3839954035], length 1314
13:22:54.898995 IP 99.181.101.239.1935 > 10.8.0.4.51558: Flags [.], ack 111222, win 701, options [nop,nop,TS val 3839954097 ecr 495480137], length 0
13:22:54.899031 IP 10.8.0.4.51558 > 99.181.101.239.1935: Flags [P.], seq 116478:117164, ack 1, win 501, options [nop,nop,TS val 495480326 ecr 3839954097], length 686
13:22:54.942862 IP 99.181.101.239.1935 > 10.8.0.4.51558: Flags [.], ack 112536, win 707, options [nop,nop,TS val 3839954141 ecr 495480175], length 0
13:22:54.946546 IP 10.8.0.4.51558 > 99.181.101.239.1935: Flags [.], seq 117164:118478, ack 1, win 501, options [nop,nop,TS val 495480373 ecr 3839954141], length 1314
13:22:54.970462 IP 99.181.101.239.1935 > 10.8.0.4.51558: Flags [.], ack 113850, win 712, options [nop,nop,TS val 3839954169 ecr 495480208], length 0
13:22:54.980660 IP 10.8.0.4.51558 > 99.181.101.239.1935: Flags [.], seq 118478:119792, ack 1, win 501, options [nop,nop,TS val 495480407 ecr 3839954169], length 1314
13:22:55.011526 IP 99.181.101.239.1935 > 10.8.0.4.51558: Flags [.], ack 115164, win 718, options [nop,nop,TS val 3839954210 ecr 495480249], length 0
13:22:55.015243 IP 10.8.0.4.51558 > 99.181.101.239.1935: Flags [.], seq 119792:121106, ack 1, win 501, options [nop,nop,TS val 495480442 ecr 3839954210], length 1314
13:22:55.070399 IP 99.181.101.239.1935 > 10.8.0.4.51558: Flags [.], ack 116478, win 724, options [nop,nop,TS val 3839954269 ecr 495480308], length 0
13:22:55.079421 IP 10.8.0.4.51558 > 99.181.101.239.1935: Flags [.], seq 121106:122420, ack 1, win 501, options [nop,nop,TS val 495480506 ecr 3839954269], length 1314
13:22:55.087978 IP 99.181.101.239.1935 > 10.8.0.4.51558: Flags [.], ack 117164, win 729, options [nop,nop,TS val 3839954286 ecr 495480326], length 0
13:22:55.087998 IP 10.8.0.4.51558 > 99.181.101.239.1935: Flags [P.], seq 122420:123098, ack 1, win 501, options [nop,nop,TS val 495480515 ecr 3839954286], length 678
13:22:55.136030 IP 99.181.101.239.1935 > 10.8.0.4.51558: Flags [.], ack 118478, win 734, options [nop,nop,TS val 3839954334 ecr 495480373], length 0
13:22:55.145449 IP 10.8.0.4.51558 > 99.181.101.239.1935: Flags [.], seq 123098:124412, ack 1, win 501, options [nop,nop,TS val 495480572 ecr 3839954334], length 1314
13:22:55.173022 IP 99.181.101.239.1935 > 10.8.0.4.51558: Flags [.], ack 119792, win 740, options [nop,nop,TS val 3839954371 ecr 495480407], length 0
13:22:55.177397 IP 10.8.0.4.51558 > 99.181.101.239.1935: Flags [.], seq 124412:125726, ack 1, win 501, options [nop,nop,TS val 495480604 ecr 3839954371], length 1314
13:22:55.204457 IP 99.181.101.239.1935 > 10.8.0.4.51558: Flags [.], ack 121106, win 746, options [nop,nop,TS val 3839954403 ecr 495480442], length 0
13:22:55.211713 IP 10.8.0.4.51558 > 99.181.101.239.1935: Flags [.], seq 125726:127040, ack 1, win 501, options [nop,nop,TS val 495480638 ecr 3839954403], length 1314
13:22:55.268344 IP 99.181.101.239.1935 > 10.8.0.4.51558: Flags [.], ack 122420, win 751, options [nop,nop,TS val 3839954467 ecr 495480506], length 0
13:22:55.276754 IP 99.181.101.239.1935 > 10.8.0.4.51558: Flags [.], ack 123098, win 756, options [nop,nop,TS val 3839954475 ecr 495480515], length 0
13:22:55.276796 IP 10.8.0.4.51558 > 99.181.101.239.1935: Flags [P.], seq 127040:128181, ack 1, win 501, options [nop,nop,TS val 495480703 ecr 3839954475], length 1141
13:22:55.314904 IP 10.8.0.4.51558 > 99.181.101.239.1935: Flags [.], seq 128181:129495, ack 1, win 501, options [nop,nop,TS val 495480742 ecr 3839954475], length 1314
13:22:55.334121 IP 99.181.101.239.1935 > 10.8.0.4.51558: Flags [.], ack 124412, win 762, options [nop,nop,TS val 3839954533 ecr 495480572], length 0
13:22:55.345709 IP 10.8.0.4.51558 > 99.181.101.239.1935: Flags [.], seq 129495:130809, ack 1, win 501, options [nop,nop,TS val 495480772 ecr 3839954533], length 1314
13:22:55.366046 IP 99.181.101.239.1935 > 10.8.0.4.51558: Flags [.], ack 125726, win 768, options [nop,nop,TS val 3839954565 ecr 495480604], length 0
13:22:55.399841 IP 10.8.0.4.51558 > 99.181.101.239.1935: Flags [.], seq 130809:132123, ack 1, win 501, options [nop,nop,TS val 495480827 ecr 3839954565], length 1314
13:22:55.400529 IP 99.181.101.239.1935 > 10.8.0.4.51558: Flags [.], ack 127040, win 773, options [nop,nop,TS val 3839954599 ecr 495480638], length 0
13:22:55.448236 IP 10.8.0.4.51558 > 99.181.101.239.1935: Flags [.], seq 132123:133437, ack 1, win 501, options [nop,nop,TS val 495480875 ecr 3839954599], length 1314
13:22:55.465866 IP 99.181.101.239.1935 > 10.8.0.4.51558: Flags [.], ack 128181, win 779, options [nop,nop,TS val 3839954664 ecr 495480703], length 0
13:22:55.465914 IP 10.8.0.4.51558 > 99.181.101.239.1935: Flags [P.], seq 133437:134123, ack 1, win 501, options [nop,nop,TS val 495480893 ecr 3839954664], length 686
13:22:55.503706 IP 99.181.101.239.1935 > 10.8.0.4.51558: Flags [.], ack 129495, win 785, options [nop,nop,TS val 3839954702 ecr 495480742], length 0
13:22:55.514900 IP 10.8.0.4.51558 > 99.181.101.239.1935: Flags [.], seq 134123:135437, ack 1, win 501, options [nop,nop,TS val 495480942 ecr 3839954702], length 1314
13:22:55.534902 IP 99.181.101.239.1935 > 10.8.0.4.51558: Flags [.], ack 130809, win 790, options [nop,nop,TS val 3839954733 ecr 495480772], length 0
13:22:55.550073 IP 10.8.0.4.51558 > 99.181.101.239.1935: Flags [.], seq 135437:136751, ack 1, win 501, options [nop,nop,TS val 495480977 ecr 3839954733], length 1314
13:22:55.589510 IP 99.181.101.239.1935 > 10.8.0.4.51558: Flags [.], ack 132123, win 796, options [nop,nop,TS val 3839954787 ecr 495480827], length 0
13:22:55.593078 IP 10.8.0.4.51558 > 99.181.101.239.1935: Flags [.], seq 136751:138065, ack 1, win 501, options [nop,nop,TS val 495481020 ecr 3839954787], length 1314
13:22:55.637310 IP 99.181.101.239.1935 > 10.8.0.4.51558: Flags [.], ack 133437, win 802, options [nop,nop,TS val 3839954836 ecr 495480875], length 0
13:22:55.646582 IP 10.8.0.4.51558 > 99.181.101.239.1935: Flags [.], seq 138065:139379, ack 1, win 501, options [nop,nop,TS val 495481073 ecr 3839954836], length 1314
13:22:55.654652 IP 99.181.101.239.1935 > 10.8.0.4.51558: Flags [.], ack 134123, win 807, options [nop,nop,TS val 3839954853 ecr 495480893], length 0
13:22:55.654681 IP 10.8.0.4.51558 > 99.181.101.239.1935: Flags [P.], seq 139379:139970, ack 1, win 501, options [nop,nop,TS val 495481081 ecr 3839954853], length 591
13:22:55.703615 IP 99.181.101.239.1935 > 10.8.0.4.51558: Flags [.], ack 135437, win 812, options [nop,nop,TS val 3839954902 ecr 495480942], length 0
13:22:55.710583 IP 10.8.0.4.51558 > 99.181.101.239.1935: Flags [.], seq 139970:141284, ack 1, win 501, options [nop,nop,TS val 495481137 ecr 3839954902], length 1314
13:22:55.742860 IP 99.181.101.239.1935 > 10.8.0.4.51558: Flags [.], ack 136751, win 818, options [nop,nop,TS val 3839954937 ecr 495480977], length 0
13:22:55.744496 IP 10.8.0.4.51558 > 99.181.101.239.1935: Flags [.], seq 141284:142598, ack 1, win 501, options [nop,nop,TS val 495481171 ecr 3839954937], length 1314
13:22:55.781226 IP 10.8.0.4.51558 > 99.181.101.239.1935: Flags [.], seq 142598:143912, ack 1, win 501, options [nop,nop,TS val 495481208 ecr 3839954937], length 1314
13:22:55.782025 IP 99.181.101.239.1935 > 10.8.0.4.51558: Flags [.], ack 138065, win 824, options [nop,nop,TS val 3839954980 ecr 495481020], length 0
13:22:55.835636 IP 99.181.101.239.1935 > 10.8.0.4.51558: Flags [.], ack 139379, win 829, options [nop,nop,TS val 3839955034 ecr 495481073], length 0
13:22:55.844261 IP 99.181.101.239.1935 > 10.8.0.4.51558: Flags [.], ack 139970, win 835, options [nop,nop,TS val 3839955042 ecr 495481081], length 0
13:22:55.844310 IP 10.8.0.4.51558 > 99.181.101.239.1935: Flags [P.], seq 143912:145065, ack 1, win 501, options [nop,nop,TS val 495481271 ecr 3839955042], length 1153
13:22:55.878400 IP 10.8.0.4.51558 > 99.181.101.239.1935: Flags [.], seq 145065:146379, ack 1, win 501, options [nop,nop,TS val 495481305 ecr 3839955042], length 1314
13:22:55.899462 IP 99.181.101.239.1935 > 10.8.0.4.51558: Flags [.], ack 141284, win 840, options [nop,nop,TS val 3839955098 ecr 495481137], length 0
13:22:55.913367 IP 10.8.0.4.51558 > 99.181.101.239.1935: Flags [.], seq 146379:147693, ack 1, win 501, options [nop,nop,TS val 495481340 ecr 3839955098], length 1314
13:22:55.933263 IP 99.181.101.239.1935 > 10.8.0.4.51558: Flags [.], ack 142598, win 846, options [nop,nop,TS val 3839955132 ecr 495481171], length 0
13:22:55.955706 IP 10.8.0.4.51558 > 99.181.101.239.1935: Flags [.], seq 147693:149007, ack 1, win 501, options [nop,nop,TS val 495481382 ecr 3839955132], length 1314
13:22:55.970271 IP 99.181.101.239.1935 > 10.8.0.4.51558: Flags [.], ack 143912, win 852, options [nop,nop,TS val 3839955169 ecr 495481208], length 0
13:22:56.011966 IP 10.8.0.4.51558 > 99.181.101.239.1935: Flags [.], seq 149007:150321, ack 1, win 501, options [nop,nop,TS val 495481439 ecr 3839955169], length 1314
13:22:56.033116 IP 99.181.101.239.1935 > 10.8.0.4.51558: Flags [.], ack 145065, win 857, options [nop,nop,TS val 3839955231 ecr 495481271], length 0
13:22:56.033147 IP 10.8.0.4.51558 > 99.181.101.239.1935: Flags [P.], seq 150321:150995, ack 1, win 501, options [nop,nop,TS val 495481460 ecr 3839955231], length 674
13:22:56.067329 IP 99.181.101.239.1935 > 10.8.0.4.51558: Flags [.], ack 146379, win 863, options [nop,nop,TS val 3839955266 ecr 495481305], length 0
13:22:56.084244 IP 10.8.0.4.51558 > 99.181.101.239.1935: Flags [.], seq 150995:152309, ack 1, win 501, options [nop,nop,TS val 495481511 ecr 3839955266], length 1314
13:22:56.102075 IP 99.181.101.239.1935 > 10.8.0.4.51558: Flags [.], ack 147693, win 869, options [nop,nop,TS val 3839955301 ecr 495481340], length 0
13:22:56.110642 IP 10.8.0.4.51558 > 99.181.101.239.1935: Flags [.], seq 152309:153623, ack 1, win 501, options [nop,nop,TS val 495481537 ecr 3839955301], length 1314
13:22:56.145621 IP 99.181.101.239.1935 > 10.8.0.4.51558: Flags [.], ack 149007, win 874, options [nop,nop,TS val 3839955343 ecr 495481382], length 0
13:22:56.147836 IP 10.8.0.4.51558 > 99.181.101.239.1935: Flags [.], seq 153623:154937, ack 1, win 501, options [nop,nop,TS val 495481575 ecr 3839955343], length 1314
