17:52:20.531681 IP 10.8.1.4.59116 > 99.181.69.252.1935: Flags [.], seq 1909587473:1909588787, ack 9642240, win 501, options [nop,nop,TS val 2730217410 ecr 3744817465], length 1314
17:52:20.579399 IP 99.181.69.252.1935 > 10.8.1.4.59116: Flags [.], ack 4294961067, win 126, options [nop,nop,TS val 3744817565 ecr 2730217120], length 0
17:52:20.595156 IP 10.8.1.4.59116 > 99.181.69.252.1935: Flags [.], seq 1314:2628, ack 1, win 501, options [nop,nop,TS val 2730217473 ecr 3744817565], length 1314
17:52:20.625827 IP 10.8.1.4.59116 > 99.181.69.252.1935: Flags [.], seq 2628:3942, ack 1, win 501, options [nop,nop,TS val 2730217504 ecr 3744817565], length 1314
17:52:20.652068 IP 99.181.69.252.1935 > 10.8.1.4.59116: Flags [.], ack 4294963695, win 126, options [nop,nop,TS val 3744817638 ecr 2730217205], length 0
17:52:20.666287 IP 10.8.1.4.59116 > 99.181.69.252.1935: Flags [.], seq 3942:5256, ack 1, win 501, options [nop,nop,TS val 2730217545 ecr 3744817638], length 1314
17:52:20.690441 IP 99.181.69.252.1935 > 10.8.1.4.59116: Flags [.], ack 4294964668, win 126, options [nop,nop,TS val 3744817676 ecr 2730217287], length 0
17:52:20.690471 IP 10.8.1.4.59116 > 99.181.69.252.1935: Flags [P.], seq 5256:6229, ack 1, win 501, options [nop,nop,TS val 2730217569 ecr 3744817676], length 973
17:52:20.754546 IP 10.8.1.4.59116 > 99.181.69.252.1935: Flags [.], seq 6229:7543, ack 1, win 501, options [nop,nop,TS val 2730217633 ecr 3744817676], length 1314
17:52:20.779705 IP 99.181.69.252.1935 > 10.8.1.4.59116: Flags [.], ack 0, win 126, options [nop,nop,TS val 3744817765 ecr 2730217334], length 0
17:52:20.797257 IP 10.8.1.4.59116 > 99.181.69.252.1935: Flags [.], seq 7543:8857, ack 1, win 501, options [nop,nop,TS val 2730217676 ecr 3744817765], length 1314
17:52:20.828549 IP 10.8.1.4.59116 > 99.181.69.252.1935: Flags [.], seq 8857:10171, ack 1, win 501, options [nop,nop,TS val 2730217707 ecr 3744817765], length 1314
17:52:20.877239 IP 99.181.69.252.1935 > 10.8.1.4.59116: Flags [.], ack 2628, win 126, options [nop,nop,TS val 3744817863 ecr 2730217410], length 0
17:52:20.899299 IP 10.8.1.4.59116 > 99.181.69.252.1935: Flags [.], seq 10171:11485, ack 1, win 501, options [nop,nop,TS val 2730217778 ecr 3744817863], length 1314
17:52:20.925221 IP 10.8.1.4.59116 > 99.181.69.252.1935: Flags [.], seq 11485:12799, ack 1, win 501, options [nop,nop,TS val 2730217804 ecr 3744817863], length 1314
17:52:20.948285 IP 99.181.69.252.1935 > 10.8.1.4.59116: Flags [.], ack 5256, win 126, options [nop,nop,TS val 3744817934 ecr 2730217504], length 0
17:52:20.961842 IP 10.8.1.4.59116 > 99.181.69.252.1935: Flags [.], seq 12799:14113, ack 1, win 501, options [nop,nop,TS val 2730217840 ecr 3744817934], length 1314
17:52:20.972423 IP 99.181.69.252.1935 > 10.8.1.4.59116: Flags [.], ack 6229, win 126, options [nop,nop,TS val 3744817958 ecr 2730217569], length 0
17:52:20.972434 IP 10.8.1.4.59116 > 99.181.69.252.1935: Flags [P.], seq 14113:14343, ack 1, win 501, options [nop,nop,TS val 2730217851 ecr 3744817958], length 230
17:52:21.031482 IP 10.8.1.4.59116 > 99.181.69.252.1935: Flags [.], seq 14343:15657, ack 1, win 501, options [nop,nop,TS val 2730217910 ecr 3744817958], length 1314
17:52:21.066139 IP 10.8.1.4.59116 > 99.181.69.252.1935: Flags [.], seq 15657:16971, ack 1, win 501, options [nop,nop,TS val 2730217944 ecr 3744817958], length 1314
17:52:21.079326 IP 99.181.69.252.1935 > 10.8.1.4.59116: Flags [.], ack 8857, win 126, options [nop,nop,TS val 3744818065 ecr 2730217633], length 0
17:52:21.099293 IP 10.8.1.4.59116 > 99.181.69.252.1935: Flags [.], seq 16971:18285, ack 1, win 501, options [nop,nop,TS val 2730217978 ecr 3744818065], length 1314
17:52:21.160173 IP 10.8.1.4.59116 > 99.181.69.252.1935: Flags [.], seq 18285:19599, ack 1, win 501, options [nop,nop,TS val 2730218038 ecr 3744818065], length 1314
17:52:21.175122 IP 99.181.69.252.1935 > 10.8.1.4.59116: Flags [.], ack 10171, win 126, options [nop,nop,TS val 3744818161 ecr 2730217707], length 0
17:52:21.198377 IP 10.8.1.4.59116 > 99.181.69.252.1935: Flags [.], seq 19599:20913, ack 1, win 501, options [nop,nop,TS val 2730218077 ecr 3744818161], length 1314
17:52:21.207278 IP 99.181.69.252.1935 > 10.8.1.4.59116: Flags [.], ack 12799, win 126, options [nop,nop,TS val 3744818193 ecr 2730217778], length 0
17:52:21.232020 IP 10.8.1.4.59116 > 99.181.69.252.1935: Flags [.], seq 20913:22227, ack 1, win 501, options [nop,nop,TS val 2730218110 ecr 3744818193], length 1314
17:52:21.254348 IP 99.181.69.252.1935 > 10.8.1.4.59116: Flags [.], ack 14343, win 126, options [nop,nop,TS val 3744818240 ecr 2730217840], length 0
17:52:21.254378 IP 10.8.1.4.59116 > 99.181.69.252.1935: Flags [P.], seq 22227:22344, ack 1, win 501, options [nop,nop,TS val 2730218133 ecr 3744818240], length 117
17:52:21.288595 IP 10.8.1.4.59116 > 99.181.69.252.1935: Flags [.], seq 22344:23658, ack 1, win 501, options [nop,nop,TS val 2730218167 ecr 3744818240], length 1314
17:52:21.331476 IP 10.8.1.4.59116 > 99.181.69.252.1935: Flags [.], seq 23658:24972, ack 1, win 501, options [nop,nop,TS val 2730218210 ecr 3744818240], length 1314
17:52:21.349541 IP 99.181.69.252.1935 > 10.8.1.4.59116: Flags [.], ack 16971, win 126, options [nop,nop,TS val 3744818335 ecr 2730217910], length 0
17:52:21.374365 IP 10.8.1.4.59116 > 99.181.69.252.1935: Flags [.], seq 24972:26286, ack 1, win 501, options [nop,nop,TS val 2730218253 ecr 3744818335], length 1314
17:52:21.432638 IP 10.8.1.4.59116 > 99.181.69.252.1935: Flags [.], seq 26286:27600, ack 1, win 501, options [nop,nop,TS val 2730218311 ecr 3744818335], length 1314
17:52:21.442379 IP 99.181.69.252.1935 > 10.8.1.4.59116: Flags [.], ack 19599, win 126, options [nop,nop,TS val 3744818428 ecr 2730217978], length 0
17:52:21.460281 IP 10.8.1.4.59116 > 99.181.69.252.1935: Flags [.], seq 27600:28914, ack 1, win 501, options [nop,nop,TS val 2730218339 ecr 3744818428], length 1314
17:52:21.503123 IP 10.8.1.4.59116 > 99.181.69.252.1935: Flags [.], seq 28914:30228, ack 1, win 501, options [nop,nop,TS val 2730218381 ecr 3744818428], length 1314
17:52:21.514049 IP 99.181.69.252.1935 > 10.8.1.4.59116: Flags [.], ack 22227, win 126, options [nop,nop,TS val 3744818500 ecr 2730218077], length 0
17:52:21.536336 IP 99.181.69.252.1935 > 10.8.1.4.59116: Flags [.], ack 22344, win 126, options [nop,nop,TS val 3744818522 ecr 2730218133], length 0
17:52:21.536363 IP 10.8.1.4.59116 > 99.181.69.252.1935: Flags [P.], seq 30228:31207, ack 1, win 501, options [nop,nop,TS val 2730218415 ecr 3744818522], length 979
17:52:21.588772 IP 10.8.1.4.59116 > 99.181.69.252.1935: Flags [.], seq 31207:32521, ack 1, win 501, options [nop,nop,TS val 2730218467 ecr 3744818522], length 1314
17:52:21.609856 IP 10.8.1.4.59116 > 99.181.69.252.1935: Flags [.], seq 32521:33835, ack 1, win 501, options [nop,nop,TS val 2730218488 ecr 3744818522], length 1314
17:52:21.613416 IP 99.181.69.252.1935 > 10.8.1.4.59116: Flags [.], ack 24972, win 126, options [nop,nop,TS val 3744818599 ecr 2730218167], length 0
17:52:21.662653 IP 10.8.1.4.59116 > 99.181.69.252.1935: Flags [.], seq 33835:35149, ack 1, win 501, options [nop,nop,TS val 2730218541 ecr 3744818599], length 1314
17:52:21.714726 IP 99.181.69.252.1935 > 10.8.1.4.59116: Flags [.], ack 27600, win 126, options [nop,nop,TS val 3744818700 ecr 2730218253], length 0
17:52:21.732883 IP 10.8.1.4.59116 > 99.181.69.252.1935: Flags [.], seq 35149:36463, ack 1, win 501, options [nop,nop,TS val 2730218611 ecr 3744818700], length 1314
17:52:21.737759 IP 10.8.1.4.59116 > 99.181.69.252.1935: Flags [.], seq 36463:37777, ack 1, win 501, options [nop,nop,TS val 2730218616 ecr 3744818700], length 1314
17:52:21.785036 IP 99.181.69.252.1935 > 10.8.1.4.59116: Flags [.], ack 30228, win 126, options [nop,nop,TS val 3744818771 ecr 2730218339], length 0
17:52:21.795558 IP 10.8.1.4.59116 > 99.181.69.252.1935: Flags [.], seq 37777:39091, ack 1, win 501, options [nop,nop,TS val 2730218674 ecr 3744818771], length 1314
17:52:21.818252 IP 99.181.69.252.1935 > 10.8.1.4.59116: Flags [.], ack 31207, win 126, options [nop,nop,TS val 3744818804 ecr 2730218415], length 0
17:52:21.818282 IP 10.8.1.4.59116 > 99.181.69.252.1935: Flags [P.], seq 39091:39225, ack 1, win 501, options [nop,nop,TS val 2730218697 ecr 3744818804], length 134
17:52:21.865986 IP 10.8.1.4.59116 > 99.181.69.252.1935: Flags [.], seq 39225:40539, ack 1, win 501, options [nop,nop,TS val 2730218744 ecr 3744818804], length 1314
17:52:21.887772 IP 10.8.1.4.59116 > 99.181.69.252.1935: Flags [.], seq 40539:41853, ack 1, win 501, options [nop,nop,TS val 2730218766 ecr 3744818804], length 1314
17:52:21.892303 IP 99.181.69.252.1935 > 10.8.1.4.59116: Flags [.], ack 33835, win 126, options [nop,nop,TS val 3744818878 ecr 2730218467], length 0
17:52:21.930221 IP 10.8.1.4.59116 > 99.181.69.252.1935: Flags [.], seq 41853:43167, ack 1, win 501, options [nop,nop,TS val 2730218809 ecr 3744818878], length 1314
17:52:21.973426 IP 10.8.1.4.59116 > 99.181.69.252.1935: Flags [.], seq 43167:44481, ack 1, win 501, options [nop,nop,TS val 2730218852 ecr 3744818878], length 1314
17:52:22.018576 IP 99.181.69.252.1935 > 10.8.1.4.59116: Flags [.], ack 36463, win 126, options [nop,nop,TS val 3744819000 ecr 2730218541], length 0
17:52:22.032504 IP 10.8.1.4.59116 > 99.181.69.252.1935: Flags [.], seq 44481:45795, ack 1, win 501, options [nop,nop,TS val 2730218911 ecr 3744819000], length 1314
17:52:22.062777 IP 10.8.1.4.59116 > 99.181.69.252.1935: Flags [.], seq 45795:47109, ack 1, win 501, options [nop,nop,TS val 2730218941 ecr 3744819000], length 1314
17:52:22.077620 IP 99.181.69.252.1935 > 10.8.1.4.59116: Flags [.], ack 39091, win 126, options [nop,nop,TS val 3744819063 ecr 2730218616], length 0
17:52:22.100067 IP 99.181.69.252.1935 > 10.8.1.4.59116: Flags [.], ack 39225, win 126, options [nop,nop,TS val 3744819086 ecr 2730218697], length 0
17:52:22.100095 IP 10.8.1.4.59116 > 99.181.69.252.1935: Flags [P.], seq 47109:48074, ack 1, win 501, options [nop,nop,TS val 2730218978 ecr 3744819086], length 965
17:52:22.164535 IP 10.8.1.4.59116 > 99.181.69.252.1935: Flags [.], seq 48074:49388, ack 1, win 501, options [nop,nop,TS val 2730219043 ecr 3744819086], length 1314
17:52:22.169930 IP 99.181.69.252.1935 > 10.8.1.4.59116: Flags [.], ack 41853, win 126, options [nop,nop,TS val 3744819155 ecr 2730218744], length 0
17:52:22.197832 IP 10.8.1.4.59116 > 99.181.69.252.1935: Flags [.], seq 49388:50702, ack 1, win 501, options [nop,nop,TS val 2730219076 ecr 3744819155], length 1314
17:52:22.230560 IP 10.8.1.4.59116 > 99.181.69.252.1935: Flags [.], seq 50702:52016, ack 1, win 501, options [nop,nop,TS val 2730219109 ecr 3744819155], length 1314
17:52:22.255461 IP 99.181.69.252.1935 > 10.8.1.4.59116: Flags [.], ack 44481, win 126, options [nop,nop,TS val 3744819241 ecr 2730218809], length 0
17:52:22.295201 IP 10.8.1.4.59116 > 99.181.69.252.1935: Flags [.], seq 52016:53330, ack 1, win 501, options [nop,nop,TS val 2730219173 ecr 3744819241], length 1314
17:52:22.330460 IP 10.8.1.4.59116 > 99.181.69.252.1935: Flags [.], seq 53330:54644, ack 1, win 501, options [nop,nop,TS val 2730219209 ecr 3744819241], length 1314
17:52:22.344735 IP 99.181.69.252.1935 > 10.8.1.4.59116: Flags [.], ack 47109, win 126, options [nop,nop,TS val 3744819330 ecr 2730218911], length 0
17:52:22.359191 IP 10.8.1.4.59116 > 99.181.69.252.1935: Flags [.], seq 54644:55958, ack 1, win 501, options [nop,nop,TS val 2730219238 ecr 3744819330], length 1314
17:52:22.382223 IP 99.181.69.252.1935 > 10.8.1.4.59116: Flags [.], ack 48074, win 126, options [nop,nop,TS val 3744819368 ecr 2730218978], length 0
17:52:22.382247 IP 10.8.1.4.59116 > 99.181.69.252.1935: Flags [P.], seq 55958:56188, ack 1, win 501, options [nop,nop,TS val 2730219261 ecr 3744819368], length 230
17:52:22.432754 IP 10.8.1.4.59116 > 99.181.69.252.1935: Flags [.], seq 56188:57502, ack 1, win 501, options [nop,nop,TS val 2730219311 ecr 3744819368], length 1314
17:52:22.464302 IP 10.8.1.4.59116 > 99.181.69.252.1935: Flags [.], seq 57502:58816, ack 1, win 501, options [nop,nop,TS val 2730219343 ecr 3744819368], length 1314
17:52:22.479938 IP 99.181.69.252.1935 > 10.8.1.4.59116: Flags [.], ack 50702, win 126, options [nop,nop,TS val 3744819465 ecr 2730219043], length 0
17:52:22.508952 IP 10.8.1.4.59116 > 99.181.69.252.1935: Flags [.], seq 58816:60130, ack 1, win 501, options [nop,nop,TS val 2730219387 ecr 3744819465], length 1314
17:52:22.565642 IP 10.8.1.4.59116 > 99.181.69.252.1935: Flags [.], seq 60130:61444, ack 1, win 501, options [nop,nop,TS val 2730219444 ecr 3744819465], length 1314
17:52:22.579119 IP 99.181.69.252.1935 > 10.8.1.4.59116: Flags [.], ack 53330, win 126, options [nop,nop,TS val 3744819565 ecr 2730219109], length 0
17:52:22.594980 IP 10.8.1.4.59116 > 99.181.69.252.1935: Flags [.], seq 61444:62758, ack 1, win 501, options [nop,nop,TS val 2730219473 ecr 3744819565], length 1314
17:52:22.637815 IP 10.8.1.4.59116 > 99.181.69.252.1935: Flags [.], seq 62758:64072, ack 1, win 501, options [nop,nop,TS val 2730219516 ecr 3744819565], length 1314
17:52:22.641339 IP 99.181.69.252.1935 > 10.8.1.4.59116: Flags [.], ack 55958, win 126, options [nop,nop,TS val 3744819627 ecr 2730219209], length 0
17:52:22.664360 IP 99.181.69.252.1935 > 10.8.1.4.59116: Flags [.], ack 56188, win 126, options [nop,nop,TS val 3744819650 ecr 2730219261], length 0
17:52:22.664391 IP 10.8.1.4.59116 > 99.181.69.252.1935: Flags [P.], seq 64072:64201, ack 1, win 501, options [nop,nop,TS val 2730219543 ecr 3744819650], length 129
17:52:22.698894 IP 10.8.1.4.59116 > 99.181.69.252.1935: Flags [.], seq 64201:65515, ack 1, win 501, options [nop,nop,TS val 2730219577 ecr 3744819650], length 1314
17:52:22.732238 IP 10.8.1.4.59116 > 99.181.69.252.1935: Flags [.], seq 65515:66829, ack 1, win 501, options [nop,nop,TS val 2730219611 ecr 3744819650], length 1314
17:52:22.746397 IP 99.181.69.252.1935 > 10.8.1.4.59116: Flags [.], ack 58816, win 126, options [nop,nop,TS val 3744819732 ecr 2730219311], length 0
17:52:22.788363 IP 10.8.1.4.59116 > 99.181.69.252.1935: Flags [.], seq 66829:68143, ack 1, win 501, options [nop,nop,TS val 2730219667 ecr 3744819732], length 1314
17:52:22.831095 IP 10.8.1.4.59116 > 99.181.69.252.1935: Flags [.], seq 68143:69457, ack 1, win 501, options [nop,nop,TS val 2730219709 ecr 3744819732], length 1314
17:52:22.847780 IP 99.181.69.252.1935 > 10.8.1.4.59116: Flags [.], ack 61444, win 126, options [nop,nop,TS val 3744819833 ecr 2730219387], length 0
17:52:22.865198 IP 10.8.1.4.59116 > 99.181.69.252.1935: Flags [.], seq 69457:70771, ack 1, win 501, options [nop,nop,TS val 2730219743 ecr 3744819833], length 1314
17:52:22.916686 IP 10.8.1.4.59116 > 99.181.69.252.1935: Flags [.], seq 70771:72085, ack 1, win 501, options [nop,nop,TS val 2730219795 ecr 3744819833], length 1314
17:52:22.920143 IP 99.181.69.252.1935 > 10.8.1.4.59116: Flags [.], ack 64072, win 126, options [nop,nop,TS val 3744819906 ecr 2730219473], length 0
17:52:22.946443 IP 99.181.69.252.1935 > 10.8.1.4.59116: Flags [.], ack 64201, win 126, options [nop,nop,TS val 3744819932 ecr 2730219543], length 0
17:52:22.946470 IP 10.8.1.4.59116 > 99.181.69.252.1935: Flags [P.], seq 72085:73051, ack 1, win 501, options [nop,nop,TS val 2730219825 ecr 3744819932], length 966
17:52:22.997292 IP 10.8.1.4.59116 > 99.181.69.252.1935: Flags [.], seq 73051:74365, ack 1, win 501, options [nop,nop,TS val 2730219876 ecr 3744819932], length 1314
17:52:23.018539 IP 99.181.69.252.1935 > 10.8.1.4.59116: Flags [.], ack 66829, win 126, options [nop,nop,TS val 3744820000 ecr 2730219577], length 0
17:52:23.030712 IP 10.8.1.4.59116 > 99.181.69.252.1935: Flags [.], seq 74365:75679, ack 1, win 501, options [nop,nop,TS val 2730219909 ecr 3744820000], length 1314
17:52:23.066033 IP 10.8.1.4.59116 > 99.181.69.252.1935: Flags [.], seq 75679:76993, ack 1, win 501, options [nop,nop,TS val 2730219944 ecr 3744820000], length 1314
17:52:23.113141 IP 99.181.69.252.1935 > 10.8.1.4.59116: Flags [.], ack 69457, win 126, options [nop,nop,TS val 3744820099 ecr 2730219667], length 0
17:52:23.130816 IP 10.8.1.4.59116 > 99.181.69.252.1935: Flags [.], seq 76993:78307, ack 1, win 501, options [nop,nop,TS val 2730220009 ecr 3744820099], length 1314
17:52:23.162941 IP 10.8.1.4.59116 > 99.181.69.252.1935: Flags [.], seq 78307:79621, ack 1, win 501, options [nop,nop,TS val 2730220041 ecr 3744820099], length 1314
17:52:23.198587 IP 10.8.1.4.59116 > 99.181.69.252.1935: Flags [.], seq 79621:80935, ack 1, win 501, options [nop,nop,TS val 2730220077 ecr 3744820099], length 1314
17:52:23.198676 IP 99.181.69.252.1935 > 10.8.1.4.59116: Flags [.], ack 72085, win 126, options [nop,nop,TS val 3744820184 ecr 2730219743], length 0
17:52:23.228535 IP 99.181.69.252.1935 > 10.8.1.4.59116: Flags [.], ack 73051, win 126, options [nop,nop,TS val 3744820214 ecr 2730219825], length 0
17:52:23.228577 IP 10.8.1.4.59116 > 99.181.69.252.1935: Flags [P.], seq 80935:81069, ack 1, win 501, options [nop,nop,TS val 2730220107 ecr 3744820214], length 134
17:52:23.265929 IP 10.8.1.4.59116 > 99.181.69.252.1935: Flags [.], seq 81069:82383, ack 1, win 501, options [nop,nop,TS val 2730220144 ecr 3744820214], length 1314
17:52:23.297582 IP 10.8.1.4.59116 > 99.181.69.252.1935: Flags [.], seq 82383:83697, ack 1, win 501, options [nop,nop,TS val 2730220176 ecr 3744820214], length 1314
17:52:23.313177 IP 99.181.69.252.1935 > 10.8.1.4.59116: Flags [.], ack 75679, win 126, options [nop,nop,TS val 3744820299 ecr 2730219876], length 0
17:52:23.345082 IP 10.8.1.4.59116 > 99.181.69.252.1935: Flags [.], seq 83697:85011, ack 1, win 501, options [nop,nop,TS val 2730220223 ecr 3744820299], length 1314
17:52:23.397271 IP 10.8.1.4.59116 > 99.181.69.252.1935: Flags [.], seq 85011:86325, ack 1, win 501, options [nop,nop,TS val 2730220276 ecr 3744820299], length 1314
17:52:23.412940 IP 99.181.69.252.1935 > 10.8.1.4.59116: Flags [.], ack 78307, win 126, options [nop,nop,TS val 3744820398 ecr 2730219944], length 0
17:52:23.430769 IP 10.8.1.4.59116 > 99.181.69.252.1935: Flags [.], seq 86325:87639, ack 1, win 501, options [nop,nop,TS val 2730220309 ecr 3744820398], length 1314
17:52:23.473890 IP 10.8.1.4.59116 > 99.181.69.252.1935: Flags [.], seq 87639:88953, ack 1, win 501, options [nop,nop,TS val 2730220352 ecr 3744820398], length 1314
17:52:23.480515 IP 99.181.69.252.1935 > 10.8.1.4.59116: Flags [.], ack 80935, win 126, options [nop,nop,TS val 3744820466 ecr 2730220041], length 0
17:52:23.510477 IP 99.181.69.252.1935 > 10.8.1.4.59116: Flags [.], ack 81069, win 126, options [nop,nop,TS val 3744820496 ecr 2730220107], length 0
17:52:23.510511 IP 10.8.1.4.59116 > 99.181.69.252.1935: Flags [P.], seq 88953:89931, ack 1, win 501, options [nop,nop,TS val 2730220389 ecr 3744820496], length 978
17:52:23.564222 IP 10.8.1.4.59116 > 99.181.69.252.1935: Flags [.], seq 89931:91245, ack 1, win 501, options [nop,nop,TS val 2730220443 ecr 3744820496], length 1314
17:52:23.579747 IP 99.181.69.252.1935 > 10.8.1.4.59116: Flags [.], ack 83697, win 126, options [nop,nop,TS val 3744820565 ecr 2730220144], length 0
17:52:23.598549 IP 10.8.1.4.59116 > 99.181.69.252.1935: Flags [.], seq 91245:92559, ack 1, win 501, options [nop,nop,TS val 2730220477 ecr 3744820565], length 1314
17:52:23.631636 IP 10.8.1.4.59116 > 99.181.69.252.1935: Flags [.], seq 92559:93873, ack 1, win 501, options [nop,nop,TS val 2730220510 ecr 3744820565], length 1314
17:52:23.679267 IP 99.181.69.252.1935 > 10.8.1.4.59116: Flags [.], ack 86325, win 126, options [nop,nop,TS val 3744820665 ecr 2730220223], length 0
17:52:23.699382 IP 10.8.1.4.59116 > 99.181.69.252.1935: Flags [.], seq 93873:95187, ack 1, win 501, options [nop,nop,TS val 2730220578 ecr 3744820665], length 1314
17:52:23.732815 IP 10.8.1.4.59116 > 99.181.69.252.1935: Flags [.], seq 95187:96501, ack 1, win 501, options [nop,nop,TS val 2730220611 ecr 3744820665], length 1314
17:52:23.756115 IP 99.181.69.252.1935 > 10.8.1.4.59116: Flags [.], ack 88953, win 126, options [nop,nop,TS val 3744820742 ecr 2730220309], length 0
17:52:23.764505 IP 10.8.1.4.59116 > 99.181.69.252.1935: Flags [.], seq 96501:97815, ack 1, win 501, options [nop,nop,TS val 2730220643 ecr 3744820742], length 1314
17:52:23.792587 IP 99.181.69.252.1935 > 10.8.1.4.59116: Flags [.], ack 89931, win 126, options [nop,nop,TS val 3744820778 ecr 2730220389], length 0
17:52:23.792613 IP 10.8.1.4.59116 > 99.181.69.252.1935: Flags [P.], seq 97815:97938, ack 1, win 501, options [nop,nop,TS val 2730220671 ecr 3744820778], length 123
17:52:23.832162 IP 10.8.1.4.59116 > 99.181.69.252.1935: Flags [.], seq 97938:99252, ack 1, win 501, options [nop,nop,TS val 2730220710 ecr 3744820778], length 1314
17:52:23.865871 IP 10.8.1.4.59116 > 99.181.69.252.1935: Flags [.], seq 99252:100566, ack 1, win 501, options [nop,nop,TS val 2730220744 ecr 3744820778], length 1314
17:52:23.880538 IP 99.181.69.252.1935 > 10.8.1.4.59116: Flags [.], ack 92559, win 126, options [nop,nop,TS val 3744820866 ecr 2730220443], length 0
17:52:23.902428 IP 10.8.1.4.59116 > 99.181.69.252.1935: Flags [.], seq 100566:101880, ack 1, win 501, options [nop,nop,TS val 2730220781 ecr 3744820866], length 1314
17:52:23.965706 IP 10.8.1.4.59116 > 99.181.69.252.1935: Flags [.], seq 101880:103194, ack 1, win 501, options [nop,nop,TS val 2730220844 ecr 3744820866], length 1314
17:52:23.981912 IP 99.181.69.252.1935 > 10.8.1.4.59116: Flags [.], ack 95187, win 126, options [nop,nop,TS val 3744820967 ecr 2730220510], length 0
17:52:23.999502 IP 10.8.1.4.59116 > 99.181.69.252.1935: Flags [.], seq 103194:104508, ack 1, win 501, options [nop,nop,TS val 2730220878 ecr 3744820967], length 1314
17:52:24.032490 IP 10.8.1.4.59116 > 99.181.69.252.1935: Flags [.], seq 104508:105822, ack 1, win 501, options [nop,nop,TS val 2730220911 ecr 3744820967], length 1314
17:52:24.046601 IP 99.181.69.252.1935 > 10.8.1.4.59116: Flags [.], ack 97815, win 126, options [nop,nop,TS val 3744821032 ecr 2730220611], length 0
17:52:24.074602 IP 99.181.69.252.1935 > 10.8.1.4.59116: Flags [.], ack 97938, win 126, options [nop,nop,TS val 3744821060 ecr 2730220671], length 0
17:52:24.074641 IP 10.8.1.4.59116 > 99.181.69.252.1935: Flags [P.], seq 105822:106898, ack 1, win 501, options [nop,nop,TS val 2730220953 ecr 3744821060], length 1076
17:52:24.132829 IP 10.8.1.4.59116 > 99.181.69.252.1935: Flags [.], seq 106898:108212, ack 1, win 501, options [nop,nop,TS val 2730221011 ecr 3744821060], length 1314
17:52:24.147983 IP 99.181.69.252.1935 > 10.8.1.4.59116: Flags [.], ack 100566, win 126, options [nop,nop,TS val 3744821133 ecr 2730220710], length 0
17:52:24.164469 IP 10.8.1.4.59116 > 99.181.69.252.1935: Flags [.], seq 108212:109526, ack 1, win 501, options [nop,nop,TS val 2730221043 ecr 3744821133], length 1314
17:52:24.202236 IP 10.8.1.4.59116 > 99.181.69.252.1935: Flags [.], seq 109526:110840, ack 1, win 501, options [nop,nop,TS val 2730221081 ecr 3744821133], length 1314
17:52:24.248017 IP 99.181.69.252.1935 > 10.8.1.4.59116: Flags [.], ack 103194, win 126, options [nop,nop,TS val 3744821233 ecr 2730220781], length 0
17:52:24.266754 IP 10.8.1.4.59116 > 99.181.69.252.1935: Flags [.], seq 110840:112154, ack 1, win 501, options [nop,nop,TS val 2730221145 ecr 3744821233], length 1314
17:52:24.299241 IP 10.8.1.4.59116 > 99.181.69.252.1935: Flags [.], seq 112154:113468, ack 1, win 501, options [nop,nop,TS val 2730221178 ecr 3744821233], length 1314
17:52:24.314578 IP 99.181.69.252.1935 > 10.8.1.4.59116: Flags [.], ack 105822, win 126, options [nop,nop,TS val 3744821300 ecr 2730220878], length 0
17:52:24.330950 IP 10.8.1.4.59116 > 99.181.69.252.1935: Flags [.], seq 113468:114782, ack 1, win 501, options [nop,nop,TS val 2730221209 ecr 3744821300], length 1314
17:52:24.356608 IP 99.181.69.252.1935 > 10.8.1.4.59116: Flags [.], ack 106898, win 126, options [nop,nop,TS val 3744821342 ecr 2730220953], length 0
17:52:24.356637 IP 10.8.1.4.59116 > 99.181.69.252.1935: Flags [P.], seq 114782:114908, ack 1, win 501, options [nop,nop,TS val 2730221235 ecr 3744821342], length 126
17:52:24.399627 IP 10.8.1.4.59116 > 99.181.69.252.1935: Flags [.], seq 114908:116222, ack 1, win 501, options [nop,nop,TS val 2730221278 ecr 3744821342], length 1314
17:52:24.432688 IP 10.8.1.4.59116 > 99.181.69.252.1935: Flags [.], seq 116222:117536, ack 1, win 501, options [nop,nop,TS val 2730221311 ecr 3744821342], length 1314
17:52:24.446640 IP 99.181.69.252.1935 > 10.8.1.4.59116: Flags [.], ack 109526, win 126, options [nop,nop,TS val 3744821432 ecr 2730221011], length 0
17:52:24.480904 IP 10.8.1.4.59116 > 99.181.69.252.1935: Flags [.], seq 117536:118850, ack 1, win 501, options [nop,nop,TS val 2730221359 ecr 3744821432], length 1314
17:52:24.532748 IP 10.8.1.4.59116 > 99.181.69.252.1935: Flags [.], seq 118850:120164, ack 1, win 501, options [nop,nop,TS val 2730221411 ecr 3744821432], length 1314
17:52:24.548784 IP 99.181.69.252.1935 > 10.8.1.4.59116: Flags [.], ack 112154, win 126, options [nop,nop,TS val 3744821534 ecr 2730221081], length 0
17:52:24.566814 IP 10.8.1.4.59116 > 99.181.69.252.1935: Flags [.], seq 120164:121478, ack 1, win 501, options [nop,nop,TS val 2730221445 ecr 3744821534], length 1314
17:52:24.609775 IP 10.8.1.4.59116 > 99.181.69.252.1935: Flags [.], seq 121478:122792, ack 1, win 501, options [nop,nop,TS val 2730221488 ecr 3744821534], length 1314
17:52:24.613178 IP 99.181.69.252.1935 > 10.8.1.4.59116: Flags [.], ack 114782, win 126, options [nop,nop,TS val 3744821599 ecr 2730221178], length 0
17:52:24.638552 IP 99.181.69.252.1935 > 10.8.1.4.59116: Flags [.], ack 114908, win 126, options [nop,nop,TS val 3744821624 ecr 2730221235], length 0
17:52:24.638596 IP 10.8.1.4.59116 > 99.181.69.252.1935: Flags [P.], seq 122792:123761, ack 1, win 501, options [nop,nop,TS val 2730221517 ecr 3744821624], length 969
17:52:24.699428 IP 10.8.1.4.59116 > 99.181.69.252.1935: Flags [.], seq 123761:125075, ack 1, win 501, options [nop,nop,TS val 2730221578 ecr 3744821624], length 1314
17:52:24.714840 IP 99.181.69.252.1935 > 10.8.1.4.59116: Flags [.], ack 117536, win 126, options [nop,nop,TS val 3744821700 ecr 2730221278], length 0
17:52:24.731484 IP 10.8.1.4.59116 > 99.181.69.252.1935: Flags [.], seq 125075:126389, ack 1, win 501, options [nop,nop,TS val 2730221610 ecr 3744821700], length 1314
17:52:24.764923 IP 10.8.1.4.59116 > 99.181.69.252.1935: Flags [.], seq 126389:127703, ack 1, win 501, options [nop,nop,TS val 2730221643 ecr 3744821700], length 1314
17:52:24.814741 IP 99.181.69.252.1935 > 10.8.1.4.59116: Flags [.], ack 120164, win 126, options [nop,nop,TS val 3744821800 ecr 2730221359], length 0
17:52:24.828334 IP 10.8.1.4.59116 > 99.181.69.252.1935: Flags [.], seq 127703:129017, ack 1, win 501, options [nop,nop,TS val 2730221707 ecr 3744821800], length 1314
17:52:24.866338 IP 10.8.1.4.59116 > 99.181.69.252.1935: Flags [.], seq 129017:130331, ack 1, win 501, options [nop,nop,TS val 2730221745 ecr 3744821800], length 1314
17:52:24.892178 IP 99.181.69.252.1935 > 10.8.1.4.59116: Flags [.], ack 122792, win 126, options [nop,nop,TS val 3744821878 ecr 2730221445], length 0
17:52:24.899349 IP 10.8.1.4.59116 > 99.181.69.252.1935: Flags [.], seq 130331:131645, ack 1, win 501, options [nop,nop,TS val 2730221778 ecr 3744821878], length 1314
17:52:24.920819 IP 99.181.69.252.1935 > 10.8.1.4.59116: Flags [.], ack 123761, win 126, options [nop,nop,TS val 3744821906 ecr 2730221517], length 0
17:52:24.920857 IP 10.8.1.4.59116 > 99.181.69.252.1935: Flags [P.], seq 131645:131779, ack 1, win 501, options [nop,nop,TS val 2730221799 ecr 3744821906], length 134
17:52:24.965703 IP 10.8.1.4.59116 > 99.181.69.252.1935: Flags [.], seq 131779:133093, ack 1, win 501, options [nop,nop,TS val 2730221844 ecr 3744821906], length 1314
17:52:24.995755 IP 10.8.1.4.59116 > 99.181.69.252.1935: Flags [.], seq 133093:134407, ack 1, win 501, options [nop,nop,TS val 2730221874 ecr 3744821906], length 1314
17:52:25.018523 IP 99.181.69.252.1935 > 10.8.1.4.59116: Flags [.], ack 126389, win 126, options [nop,nop,TS val 3744822000 ecr 2730221578], length 0
17:52:25.037466 IP 10.8.1.4.59116 > 99.181.69.252.1935: Flags [.], seq 134407:135721, ack 1, win 501, options [nop,nop,TS val 2730221916 ecr 3744822000], length 1314
17:52:25.101913 IP 10.8.1.4.59116 > 99.181.69.252.1935: Flags [.], seq 135721:137035, ack 1, win 501, options [nop,nop,TS val 2730221980 ecr 3744822000], length 1314
17:52:25.110627 IP 99.181.69.252.1935 > 10.8.1.4.59116: Flags [.], ack 129017, win 126, options [nop,nop,TS val 3744822096 ecr 2730221643], length 0
17:52:25.131193 IP 10.8.1.4.59116 > 99.181.69.252.1935: Flags [.], seq 137035:138349, ack 1, win 501, options [nop,nop,TS val 2730222009 ecr 3744822096], length 1314
17:52:25.166015 IP 10.8.1.4.59116 > 99.181.69.252.1935: Flags [.], seq 138349:139663, ack 1, win 501, options [nop,nop,TS val 2730222044 ecr 3744822096], length 1314
17:52:25.181624 IP 99.181.69.252.1935 > 10.8.1.4.59116: Flags [.], ack 131645, win 126, options [nop,nop,TS val 3744822167 ecr 2730221745], length 0
17:52:25.202938 IP 99.181.69.252.1935 > 10.8.1.4.59116: Flags [.], ack 131779, win 126, options [nop,nop,TS val 3744822188 ecr 2730221799], length 0
17:52:25.202983 IP 10.8.1.4.59116 > 99.181.69.252.1935: Flags [P.], seq 139663:140637, ack 1, win 501, options [nop,nop,TS val 2730222081 ecr 3744822188], length 974
17:52:25.265334 IP 10.8.1.4.59116 > 99.181.69.252.1935: Flags [.], seq 140637:141951, ack 1, win 501, options [nop,nop,TS val 2730222144 ecr 3744822188], length 1314
17:52:25.277993 IP 99.181.69.252.1935 > 10.8.1.4.59116: Flags [.], ack 134407, win 126, options [nop,nop,TS val 3744822263 ecr 2730221844], length 0
17:52:25.298755 IP 10.8.1.4.59116 > 99.181.69.252.1935: Flags [.], seq 141951:143265, ack 1, win 501, options [nop,nop,TS val 2730222177 ecr 3744822263], length 1314
17:52:25.337782 IP 10.8.1.4.59116 > 99.181.69.252.1935: Flags [.], seq 143265:144579, ack 1, win 501, options [nop,nop,TS val 2730222216 ecr 3744822263], length 1314
17:52:25.384013 IP 99.181.69.252.1935 > 10.8.1.4.59116: Flags [.], ack 137035, win 126, options [nop,nop,TS val 3744822369 ecr 2730221916], length 0
17:52:25.401945 IP 10.8.1.4.59116 > 99.181.69.252.1935: Flags [.], seq 144579:145893, ack 1, win 501, options [nop,nop,TS val 2730222280 ecr 3744822369], length 1314
17:52:25.429770 IP 10.8.1.4.59116 > 99.181.69.252.1935: Flags [.], seq 145893:147207, ack 1, win 501, options [nop,nop,TS val 2730222308 ecr 3744822369], length 1314
17:52:25.447932 IP 99.181.69.252.1935 > 10.8.1.4.59116: Flags [.], ack 139663, win 126, options [nop,nop,TS val 3744822434 ecr 2730222009], length 0
17:52:25.465726 IP 10.8.1.4.59116 > 99.181.69.252.1935: Flags [.], seq 147207:148521, ack 1, win 501, options [nop,nop,TS val 2730222344 ecr 3744822434], length 1314
17:52:25.484856 IP 99.181.69.252.1935 > 10.8.1.4.59116: Flags [.], ack 140637, win 126, options [nop,nop,TS val 3744822470 ecr 2730222081], length 0
17:52:25.484867 IP 10.8.1.4.59116 > 99.181.69.252.1935: Flags [P.], seq 148521:148648, ack 1, win 501, options [nop,nop,TS val 2730222363 ecr 3744822470], length 127
17:52:25.530341 IP 10.8.1.4.59116 > 99.181.69.252.1935: Flags [.], seq 148648:149962, ack 1, win 501, options [nop,nop,TS val 2730222409 ecr 3744822470], length 1314
17:52:25.564546 IP 10.8.1.4.59116 > 99.181.69.252.1935: Flags [.], seq 149962:151276, ack 1, win 501, options [nop,nop,TS val 2730222443 ecr 3744822470], length 1314
17:52:25.580729 IP 99.181.69.252.1935 > 10.8.1.4.59116: Flags [.], ack 143265, win 126, options [nop,nop,TS val 3744822566 ecr 2730222144], length 0
17:52:25.598001 IP 10.8.1.4.59116 > 99.181.69.252.1935: Flags [.], seq 151276:152590, ack 1, win 501, options [nop,nop,TS val 2730222476 ecr 3744822566], length 1314
17:52:25.662817 IP 10.8.1.4.59116 > 99.181.69.252.1935: Flags [.], seq 152590:153904, ack 1, win 501, options [nop,nop,TS val 2730222541 ecr 3744822566], length 1314
17:52:25.684236 IP 99.181.69.252.1935 > 10.8.1.4.59116: Flags [.], ack 145893, win 126, options [nop,nop,TS val 3744822669 ecr 2730222216], length 0
17:52:25.700372 IP 10.8.1.4.59116 > 99.181.69.252.1935: Flags [.], seq 153904:155218, ack 1, win 501, options [nop,nop,TS val 2730222579 ecr 3744822669], length 1314
17:52:25.732597 IP 10.8.1.4.59116 > 99.181.69.252.1935: Flags [.], seq 155218:156532, ack 1, win 501, options [nop,nop,TS val 2730222611 ecr 3744822669], length 1314
17:52:25.747493 IP 99.181.69.252.1935 > 10.8.1.4.59116: Flags [.], ack 148521, win 126, options [nop,nop,TS val 3744822733 ecr 2730222308], length 0
17:52:25.766796 IP 99.181.69.252.1935 > 10.8.1.4.59116: Flags [.], ack 148648, win 126, options [nop,nop,TS val 3744822752 ecr 2730222363], length 0
17:52:25.766830 IP 10.8.1.4.59116 > 99.181.69.252.1935: Flags [P.], seq 156532:157609, ack 1, win 501, options [nop,nop,TS val 2730222645 ecr 3744822752], length 1077
17:52:25.831642 IP 10.8.1.4.59116 > 99.181.69.252.1935: Flags [.], seq 157609:158923, ack 1, win 501, options [nop,nop,TS val 2730222710 ecr 3744822752], length 1314
17:52:25.846539 IP 99.181.69.252.1935 > 10.8.1.4.59116: Flags [.], ack 151276, win 126, options [nop,nop,TS val 3744822832 ecr 2730222409], length 0
17:52:25.871625 IP 10.8.1.4.59116 > 99.181.69.252.1935: Flags [.], seq 158923:160237, ack 1, win 501, options [nop,nop,TS val 2730222750 ecr 3744822832], length 1314
17:52:25.898324 IP 10.8.1.4.59116 > 99.181.69.252.1935: Flags [.], seq 160237:161551, ack 1, win 501, options [nop,nop,TS val 2730222777 ecr 3744822832], length 1314
17:52:25.944992 IP 99.181.69.252.1935 > 10.8.1.4.59116: Flags [.], ack 153904, win 126, options [nop,nop,TS val 3744822930 ecr 2730222476], length 0
17:52:25.965616 IP 10.8.1.4.59116 > 99.181.69.252.1935: Flags [.], seq 161551:162865, ack 1, win 501, options [nop,nop,TS val 2730222844 ecr 3744822930], length 1314
17:52:26.000039 IP 10.8.1.4.59116 > 99.181.69.252.1935: Flags [.], seq 162865:164179, ack 1, win 501, options [nop,nop,TS val 2730222878 ecr 3744822930], length 1314
17:52:26.018866 IP 99.181.69.252.1935 > 10.8.1.4.59116: Flags [.], ack 156532, win 126, options [nop,nop,TS val 3744823000 ecr 2730222579], length 0
17:52:26.032578 IP 10.8.1.4.59116 > 99.181.69.252.1935: Flags [.], seq 164179:165493, ack 1, win 501, options [nop,nop,TS val 2730222911 ecr 3744823000], length 1314
17:52:26.048843 IP 99.181.69.252.1935 > 10.8.1.4.59116: Flags [.], ack 157609, win 126, options [nop,nop,TS val 3744823034 ecr 2730222645], length 0
17:52:26.048879 IP 10.8.1.4.59116 > 99.181.69.252.1935: Flags [P.], seq 165493:165614, ack 1, win 501, options [nop,nop,TS val 2730222927 ecr 3744823034], length 121
17:52:26.098918 IP 10.8.1.4.59116 > 99.181.69.252.1935: Flags [.], seq 165614:166928, ack 1, win 501, options [nop,nop,TS val 2730222977 ecr 3744823034], length 1314
17:52:26.132618 IP 10.8.1.4.59116 > 99.181.69.252.1935: Flags [.], seq 166928:168242, ack 1, win 501, options [nop,nop,TS val 2730223011 ecr 3744823034], length 1314
17:52:26.153762 IP 99.181.69.252.1935 > 10.8.1.4.59116: Flags [.], ack 160237, win 126, options [nop,nop,TS val 3744823139 ecr 2730222710], length 0
17:52:26.171316 IP 10.8.1.4.59116 > 99.181.69.252.1935: Flags [.], seq 168242:169556, ack 1, win 501, options [nop,nop,TS val 2730223050 ecr 3744823139], length 1314
17:52:26.235366 IP 10.8.1.4.59116 > 99.181.69.252.1935: Flags [.], seq 169556:170870, ack 1, win 501, options [nop,nop,TS val 2730223114 ecr 3744823139], length 1314
17:52:26.247603 IP 99.181.69.252.1935 > 10.8.1.4.59116: Flags [.], ack 162865, win 126, options [nop,nop,TS val 3744823233 ecr 2730222777], length 0
17:52:26.266245 IP 10.8.1.4.59116 > 99.181.69.252.1935: Flags [.], seq 170870:172184, ack 1, win 501, options [nop,nop,TS val 2730223145 ecr 3744823233], length 1314
17:52:26.299900 IP 10.8.1.4.59116 > 99.181.69.252.1935: Flags [.], seq 172184:173498, ack 1, win 501, options [nop,nop,TS val 2730223178 ecr 3744823233], length 1314
17:52:26.314864 IP 99.181.69.252.1935 > 10.8.1.4.59116: Flags [.], ack 165493, win 126, options [nop,nop,TS val 3744823300 ecr 2730222878], length 0
17:52:26.330791 IP 99.181.69.252.1935 > 10.8.1.4.59116: Flags [.], ack 165614, win 126, options [nop,nop,TS val 3744823316 ecr 2730222927], length 0
17:52:26.330837 IP 10.8.1.4.59116 > 99.181.69.252.1935: Flags [P.], seq 173498:173624, ack 1, win 501, options [nop,nop,TS val 2730223209 ecr 3744823316], length 126
17:52:26.366009 IP 10.8.1.4.59116 > 99.181.69.252.1935: Flags [.], seq 173624:174938, ack 1, win 501, options [nop,nop,TS val 2730223244 ecr 3744823316], length 1314
17:52:26.407131 IP 10.8.1.4.59116 > 99.181.69.252.1935: Flags [.], seq 174938:176252, ack 1, win 501, options [nop,nop,TS val 2730223285 ecr 3744823316], length 1314
17:52:26.414496 IP 99.181.69.252.1935 > 10.8.1.4.59116: Flags [.], ack 168242, win 126, options [nop,nop,TS val 3744823400 ecr 2730222977], length 0
17:52:26.449477 IP 10.8.1.4.59116 > 99.181.69.252.1935: Flags [.], seq 176252:177566, ack 1, win 501, options [nop,nop,TS val 2730223328 ecr 3744823400], length 1314
17:52:26.495375 IP 10.8.1.4.59116 > 99.181.69.252.1935: Flags [.], seq 177566:178880, ack 1, win 501, options [nop,nop,TS val 2730223374 ecr 3744823400], length 1314
17:52:26.517585 IP 99.181.69.252.1935 > 10.8.1.4.59116: Flags [.], ack 170870, win 126, options [nop,nop,TS val 3744823503 ecr 2730223050], length 0
17:52:26.534610 IP 10.8.1.4.59116 > 99.181.69.252.1935: Flags [.], seq 178880:180194, ack 1, win 501, options [nop,nop,TS val 2730223413 ecr 3744823503], length 1314
17:52:26.577669 IP 10.8.1.4.59116 > 99.181.69.252.1935: Flags [.], seq 180194:181508, ack 1, win 501, options [nop,nop,TS val 2730223456 ecr 3744823503], length 1314
17:52:26.582175 IP 99.181.69.252.1935 > 10.8.1.4.59116: Flags [.], ack 173498, win 126, options [nop,nop,TS val 3744823568 ecr 2730223145], length 0
17:52:26.612823 IP 99.181.69.252.1935 > 10.8.1.4.59116: Flags [.], ack 173624, win 126, options [nop,nop,TS val 3744823598 ecr 2730223209], length 0
17:52:26.612870 IP 10.8.1.4.59116 > 99.181.69.252.1935: Flags [P.], seq 181508:182490, ack 1, win 501, options [nop,nop,TS val 2730223491 ecr 3744823598], length 982
17:52:26.663432 IP 10.8.1.4.59116 > 99.181.69.252.1935: Flags [.], seq 182490:183804, ack 1, win 501, options [nop,nop,TS val 2730223542 ecr 3744823598], length 1314
17:52:26.689253 IP 99.181.69.252.1935 > 10.8.1.4.59116: Flags [.], ack 176252, win 126, options [nop,nop,TS val 3744823675 ecr 2730223244], length 0
17:52:26.705875 IP 10.8.1.4.59116 > 99.181.69.252.1935: Flags [.], seq 183804:185118, ack 1, win 501, options [nop,nop,TS val 2730223584 ecr 3744823675], length 1314
17:52:26.730207 IP 10.8.1.4.59116 > 99.181.69.252.1935: Flags [.], seq 185118:186432, ack 1, win 501, options [nop,nop,TS val 2730223609 ecr 3744823675], length 1314
17:52:26.777587 IP 99.181.69.252.1935 > 10.8.1.4.59116: Flags [.], ack 178880, win 126, options [nop,nop,TS val 3744823763 ecr 2730223328], length 0
17:52:26.798390 IP 10.8.1.4.59116 > 99.181.69.252.1935: Flags [.], seq 186432:187746, ack 1, win 501, options [nop,nop,TS val 2730223677 ecr 3744823763], length 1314
17:52:26.833880 IP 10.8.1.4.59116 > 99.181.69.252.1935: Flags [.], seq 187746:189060, ack 1, win 501, options [nop,nop,TS val 2730223712 ecr 3744823763], length 1314
17:52:26.859791 IP 99.181.69.252.1935 > 10.8.1.4.59116: Flags [.], ack 181508, win 126, options [nop,nop,TS val 3744823845 ecr 2730223413], length 0
17:52:26.861789 IP 10.8.1.4.59116 > 99.181.69.252.1935: Flags [.], seq 189060:190374, ack 1, win 501, options [nop,nop,TS val 2730223740 ecr 3744823845], length 1314
17:52:26.894967 IP 99.181.69.252.1935 > 10.8.1.4.59116: Flags [.], ack 182490, win 126, options [nop,nop,TS val 3744823880 ecr 2730223491], length 0
17:52:26.894995 IP 10.8.1.4.59116 > 99.181.69.252.1935: Flags [P.], seq 190374:190496, ack 1, win 501, options [nop,nop,TS val 2730223773 ecr 3744823880], length 122
17:52:26.940759 IP 10.8.1.4.59116 > 99.181.69.252.1935: Flags [.], seq 190496:191810, ack 1, win 501, options [nop,nop,TS val 2730223819 ecr 3744823880], length 1314
