01:19:18.247494 IP 52.223.227.197.1935 > 10.8.0.4.33228: Flags [.], ack 164733584, win 230, options [nop,nop,TS val 3077082153 ecr 2039012536], length 0
01:19:18.250288 IP 10.8.0.4.33228 > 52.223.227.197.1935: Flags [.], seq 10667:11981, ack 0, win 501, options [nop,nop,TS val 2039012975 ecr 3077082153], length 1314
01:19:18.258654 IP 52.223.227.197.1935 > 10.8.0.4.33228: Flags [.], ack 155, win 230, options [nop,nop,TS val 3077082165 ecr 2039012582], length 0
01:19:18.258681 IP 10.8.0.4.33228 > 52.223.227.197.1935: Flags [P.], seq 11981:12114, ack 0, win 501, options [nop,nop,TS val 2039012984 ecr 3077082165], length 133
01:19:18.313970 IP 10.8.0.4.33228 > 52.223.227.197.1935: Flags [.], seq 12114:13428, ack 0, win 501, options [nop,nop,TS val 2039013039 ecr 3077082165], length 1314
01:19:18.341049 IP 10.8.0.4.33228 > 52.223.227.197.1935: Flags [.], seq 13428:14742, ack 0, win 501, options [nop,nop,TS val 2039013066 ecr 3077082165], length 1314
01:19:18.353222 IP 52.223.227.197.1935 > 10.8.0.4.33228: Flags [.], ack 2783, win 230, options [nop,nop,TS val 3077082259 ecr 2039012637], length 0
01:19:18.377728 IP 10.8.0.4.33228 > 52.223.227.197.1935: Flags [.], seq 14742:16056, ack 0, win 501, options [nop,nop,TS val 2039013103 ecr 3077082259], length 1314
01:19:18.435433 IP 52.223.227.197.1935 > 10.8.0.4.33228: Flags [.], ack 4097, win 230, options [nop,nop,TS val 3077082341 ecr 2039012701], length 0
01:19:18.441501 IP 10.8.0.4.33228 > 52.223.227.197.1935: Flags [.], seq 16056:17370, ack 0, win 501, options [nop,nop,TS val 2039013166 ecr 3077082341], length 1314
01:19:18.481383 IP 52.223.227.197.1935 > 10.8.0.4.33228: Flags [.], ack 6725, win 230, options [nop,nop,TS val 3077082387 ecr 2039012767], length 0
01:19:18.483883 IP 10.8.0.4.33228 > 52.223.227.197.1935: Flags [.], seq 17370:18684, ack 0, win 501, options [nop,nop,TS val 2039013209 ecr 3077082387], length 1314
01:19:18.507572 IP 10.8.0.4.33228 > 52.223.227.197.1935: Flags [.], seq 18684:19998, ack 0, win 501, options [nop,nop,TS val 2039013232 ecr 3077082387], length 1314
01:19:18.576903 IP 10.8.0.4.33228 > 52.223.227.197.1935: Flags [.], seq 19998:21312, ack 0, win 501, options [nop,nop,TS val 2039013302 ecr 3077082387], length 1314
01:19:18.580483 IP 52.223.227.197.1935 > 10.8.0.4.33228: Flags [.], ack 9353, win 230, options [nop,nop,TS val 3077082486 ecr 2039012832], length 0
01:19:18.612152 IP 10.8.0.4.33228 > 52.223.227.197.1935: Flags [.], seq 21312:22626, ack 0, win 501, options [nop,nop,TS val 2039013337 ecr 3077082486], length 1314
01:19:18.644960 IP 10.8.0.4.33228 > 52.223.227.197.1935: Flags [.], seq 22626:23940, ack 0, win 501, options [nop,nop,TS val 2039013370 ecr 3077082486], length 1314
01:19:18.652436 IP 52.223.227.197.1935 > 10.8.0.4.33228: Flags [.], ack 11981, win 230, options [nop,nop,TS val 3077082558 ecr 2039012937], length 0
01:19:18.660166 IP 52.223.227.197.1935 > 10.8.0.4.33228: Flags [.], ack 12114, win 230, options [nop,nop,TS val 3077082566 ecr 2039012984], length 0
01:19:18.660187 IP 10.8.0.4.33228 > 52.223.227.197.1935: Flags [P.], seq 23940:24093, ack 0, win 501, options [nop,nop,TS val 2039013385 ecr 3077082566], length 153
01:19:18.710370 IP 10.8.0.4.33228 > 52.223.227.197.1935: Flags [.], seq 24093:25407, ack 0, win 501, options [nop,nop,TS val 2039013435 ecr 3077082566], length 1314
01:19:18.742834 IP 52.223.227.197.1935 > 10.8.0.4.33228: Flags [.], ack 14742, win 230, options [nop,nop,TS val 3077082649 ecr 2039013039], length 0
01:19:18.743316 IP 10.8.0.4.33228 > 52.223.227.197.1935: Flags [.], seq 25407:26721, ack 0, win 501, options [nop,nop,TS val 2039013468 ecr 3077082649], length 1314
01:19:18.782785 IP 10.8.0.4.33228 > 52.223.227.197.1935: Flags [.], seq 26721:28035, ack 0, win 501, options [nop,nop,TS val 2039013508 ecr 3077082649], length 1314
01:19:18.843238 IP 52.223.227.197.1935 > 10.8.0.4.33228: Flags [.], ack 17370, win 230, options [nop,nop,TS val 3077082750 ecr 2039013103], length 0
01:19:18.846479 IP 10.8.0.4.33228 > 52.223.227.197.1935: Flags [.], seq 28035:29349, ack 0, win 501, options [nop,nop,TS val 2039013571 ecr 3077082750], length 1314
01:19:18.879025 IP 10.8.0.4.33228 > 52.223.227.197.1935: Flags [.], seq 29349:30663, ack 0, win 501, options [nop,nop,TS val 2039013604 ecr 3077082750], length 1314
01:19:18.913155 IP 10.8.0.4.33228 > 52.223.227.197.1935: Flags [.], seq 30663:31977, ack 0, win 501, options [nop,nop,TS val 2039013638 ecr 3077082750], length 1314
01:19:18.976739 IP 10.8.0.4.33228 > 52.223.227.197.1935: Flags [.], seq 31977:33291, ack 0, win 501, options [nop,nop,TS val 2039013702 ecr 3077082750], length 1314
01:19:19.014096 IP 52.223.227.197.1935 > 10.8.0.4.33228: Flags [.], ack 22626, win 230, options [nop,nop,TS val 3077082920 ecr 2039013302], length 0
01:19:19.018229 IP 10.8.0.4.33228 > 52.223.227.197.1935: Flags [.], seq 33291:34605, ack 0, win 501, options [nop,nop,TS val 2039013743 ecr 3077082920], length 1314
01:19:19.044502 IP 10.8.0.4.33228 > 52.223.227.197.1935: Flags [.], seq 34605:35919, ack 0, win 501, options [nop,nop,TS val 2039013769 ecr 3077082920], length 1314
01:19:19.062021 IP 52.223.227.197.1935 > 10.8.0.4.33228: Flags [.], ack 24093, win 230, options [nop,nop,TS val 3077082968 ecr 2039013370], length 0
01:19:19.062049 IP 10.8.0.4.33228 > 52.223.227.197.1935: Flags [P.], seq 35919:36058, ack 0, win 501, options [nop,nop,TS val 2039013787 ecr 3077082968], length 139
01:19:19.110471 IP 10.8.0.4.33228 > 52.223.227.197.1935: Flags [.], seq 36058:37372, ack 0, win 501, options [nop,nop,TS val 2039013835 ecr 3077082968], length 1314
01:19:19.145199 IP 52.223.227.197.1935 > 10.8.0.4.33228: Flags [.], ack 26721, win 230, options [nop,nop,TS val 3077083051 ecr 2039013435], length 0
01:19:19.146737 IP 10.8.0.4.33228 > 52.223.227.197.1935: Flags [.], seq 37372:38686, ack 0, win 501, options [nop,nop,TS val 2039013872 ecr 3077083051], length 1314
01:19:19.189678 IP 10.8.0.4.33228 > 52.223.227.197.1935: Flags [.], seq 38686:40000, ack 0, win 501, options [nop,nop,TS val 2039013914 ecr 3077083051], length 1314
01:19:19.243468 IP 10.8.0.4.33228 > 52.223.227.197.1935: Flags [.], seq 40000:41314, ack 0, win 501, options [nop,nop,TS val 2039013968 ecr 3077083051], length 1314
01:19:19.248711 IP 52.223.227.197.1935 > 10.8.0.4.33228: Flags [.], ack 29349, win 230, options [nop,nop,TS val 3077083155 ecr 2039013508], length 0
01:19:19.276972 IP 10.8.0.4.33228 > 52.223.227.197.1935: Flags [.], seq 41314:42628, ack 0, win 501, options [nop,nop,TS val 2039014002 ecr 3077083155], length 1314
01:19:19.315087 IP 52.223.227.197.1935 > 10.8.0.4.33228: Flags [.], ack 31977, win 230, options [nop,nop,TS val 3077083221 ecr 2039013604], length 0
01:19:19.317960 IP 10.8.0.4.33228 > 52.223.227.197.1935: Flags [.], seq 42628:43942, ack 0, win 501, options [nop,nop,TS val 2039014043 ecr 3077083221], length 1314
01:19:19.381868 IP 10.8.0.4.33228 > 52.223.227.197.1935: Flags [.], seq 43942:45256, ack 0, win 501, options [nop,nop,TS val 2039014107 ecr 3077083221], length 1314
01:19:19.410641 IP 10.8.0.4.33228 > 52.223.227.197.1935: Flags [.], seq 45256:46570, ack 0, win 501, options [nop,nop,TS val 2039014135 ecr 3077083221], length 1314
01:19:19.420046 IP 52.223.227.197.1935 > 10.8.0.4.33228: Flags [.], ack 34605, win 230, options [nop,nop,TS val 3077083326 ecr 2039013702], length 0
01:19:19.445725 IP 10.8.0.4.33228 > 52.223.227.197.1935: Flags [.], seq 46570:47884, ack 0, win 501, options [nop,nop,TS val 2039014171 ecr 3077083326], length 1314
01:19:19.463635 IP 52.223.227.197.1935 > 10.8.0.4.33228: Flags [.], ack 36058, win 230, options [nop,nop,TS val 3077083370 ecr 2039013769], length 0
01:19:19.463648 IP 10.8.0.4.33228 > 52.223.227.197.1935: Flags [P.], seq 47884:47942, ack 0, win 501, options [nop,nop,TS val 2039014188 ecr 3077083370], length 58
01:19:19.510169 IP 10.8.0.4.33228 > 52.223.227.197.1935: Flags [.], seq 47942:49256, ack 0, win 501, options [nop,nop,TS val 2039014235 ecr 3077083370], length 1314
01:19:19.548648 IP 52.223.227.197.1935 > 10.8.0.4.33228: Flags [.], ack 38686, win 230, options [nop,nop,TS val 3077083455 ecr 2039013835], length 0
01:19:19.552220 IP 10.8.0.4.33228 > 52.223.227.197.1935: Flags [.], seq 49256:50570, ack 0, win 501, options [nop,nop,TS val 2039014277 ecr 3077083455], length 1314
01:19:19.574935 IP 10.8.0.4.33228 > 52.223.227.197.1935: Flags [.], seq 50570:51884, ack 0, win 501, options [nop,nop,TS val 2039014300 ecr 3077083455], length 1314
01:19:19.643873 IP 10.8.0.4.33228 > 52.223.227.197.1935: Flags [.], seq 51884:53198, ack 0, win 501, options [nop,nop,TS val 2039014369 ecr 3077083455], length 1314
01:19:19.645603 IP 52.223.227.197.1935 > 10.8.0.4.33228: Flags [.], ack 41314, win 230, options [nop,nop,TS val 3077083552 ecr 2039013914], length 0
01:19:19.679968 IP 10.8.0.4.33228 > 52.223.227.197.1935: Flags [.], seq 53198:54512, ack 0, win 501, options [nop,nop,TS val 2039014405 ecr 3077083552], length 1314
01:19:19.708321 IP 10.8.0.4.33228 > 52.223.227.197.1935: Flags [.], seq 54512:55826, ack 0, win 501, options [nop,nop,TS val 2039014433 ecr 3077083552], length 1314
01:19:19.720055 IP 52.223.227.197.1935 > 10.8.0.4.33228: Flags [.], ack 43942, win 230, options [nop,nop,TS val 3077083626 ecr 2039014002], length 0
01:19:19.778082 IP 10.8.0.4.33228 > 52.223.227.197.1935: Flags [.], seq 55826:57140, ack 0, win 501, options [nop,nop,TS val 2039014503 ecr 3077083626], length 1314
01:19:19.812570 IP 10.8.0.4.33228 > 52.223.227.197.1935: Flags [.], seq 57140:58454, ack 0, win 501, options [nop,nop,TS val 2039014537 ecr 3077083626], length 1314
01:19:19.812773 IP 52.223.227.197.1935 > 10.8.0.4.33228: Flags [.], ack 46570, win 230, options [nop,nop,TS val 3077083719 ecr 2039014107], length 0
01:19:19.850756 IP 10.8.0.4.33228 > 52.223.227.197.1935: Flags [.], seq 58454:59768, ack 0, win 501, options [nop,nop,TS val 2039014576 ecr 3077083719], length 1314
01:19:19.865240 IP 52.223.227.197.1935 > 10.8.0.4.33228: Flags [.], ack 47942, win 230, options [nop,nop,TS val 3077083772 ecr 2039014171], length 0
01:19:19.865260 IP 10.8.0.4.33228 > 52.223.227.197.1935: Flags [P.], seq 59768:59901, ack 0, win 501, options [nop,nop,TS val 2039014590 ecr 3077083772], length 133
01:19:19.914627 IP 10.8.0.4.33228 > 52.223.227.197.1935: Flags [.], seq 59901:61215, ack 0, win 501, options [nop,nop,TS val 2039014639 ecr 3077083772], length 1314
01:19:19.943440 IP 10.8.0.4.33228 > 52.223.227.197.1935: Flags [.], seq 61215:62529, ack 0, win 501, options [nop,nop,TS val 2039014668 ecr 3077083772], length 1314
01:19:19.954144 IP 52.223.227.197.1935 > 10.8.0.4.33228: Flags [.], ack 50570, win 230, options [nop,nop,TS val 3077083861 ecr 2039014235], length 0
01:19:19.979384 IP 10.8.0.4.33228 > 52.223.227.197.1935: Flags [.], seq 62529:63843, ack 0, win 501, options [nop,nop,TS val 2039014704 ecr 3077083861], length 1314
01:19:20.039320 IP 52.223.227.197.1935 > 10.8.0.4.33228: Flags [.], ack 51884, win 230, options [nop,nop,TS val 3077083945 ecr 2039014300], length 0
01:19:20.042376 IP 10.8.0.4.33228 > 52.223.227.197.1935: Flags [.], seq 63843:65157, ack 0, win 501, options [nop,nop,TS val 2039014767 ecr 3077083945], length 1314
01:19:20.081643 IP 52.223.227.197.1935 > 10.8.0.4.33228: Flags [.], ack 54512, win 230, options [nop,nop,TS val 3077083988 ecr 2039014369], length 0
01:19:20.084714 IP 10.8.0.4.33228 > 52.223.227.197.1935: Flags [.], seq 65157:66471, ack 0, win 501, options [nop,nop,TS val 2039014810 ecr 3077083988], length 1314
01:19:20.108110 IP 10.8.0.4.33228 > 52.223.227.197.1935: Flags [.], seq 66471:67785, ack 0, win 501, options [nop,nop,TS val 2039014833 ecr 3077083988], length 1314
01:19:20.178335 IP 10.8.0.4.33228 > 52.223.227.197.1935: Flags [.], seq 67785:69099, ack 0, win 501, options [nop,nop,TS val 2039014903 ecr 3077083988], length 1314
01:19:20.180122 IP 52.223.227.197.1935 > 10.8.0.4.33228: Flags [.], ack 57140, win 230, options [nop,nop,TS val 3077084086 ecr 2039014433], length 0
01:19:20.212898 IP 10.8.0.4.33228 > 52.223.227.197.1935: Flags [.], seq 69099:70413, ack 0, win 501, options [nop,nop,TS val 2039014938 ecr 3077084086], length 1314
01:19:20.243354 IP 10.8.0.4.33228 > 52.223.227.197.1935: Flags [.], seq 70413:71727, ack 0, win 501, options [nop,nop,TS val 2039014968 ecr 3077084086], length 1314
01:19:20.252846 IP 52.223.227.197.1935 > 10.8.0.4.33228: Flags [.], ack 59768, win 230, options [nop,nop,TS val 3077084159 ecr 2039014537], length 0
01:19:20.267700 IP 52.223.227.197.1935 > 10.8.0.4.33228: Flags [.], ack 59901, win 230, options [nop,nop,TS val 3077084173 ecr 2039014590], length 0
01:19:20.267713 IP 10.8.0.4.33228 > 52.223.227.197.1935: Flags [P.], seq 71727:71880, ack 0, win 501, options [nop,nop,TS val 2039014993 ecr 3077084173], length 153
01:19:20.310044 IP 10.8.0.4.33228 > 52.223.227.197.1935: Flags [.], seq 71880:73194, ack 0, win 501, options [nop,nop,TS val 2039015035 ecr 3077084173], length 1314
01:19:20.344928 IP 10.8.0.4.33228 > 52.223.227.197.1935: Flags [.], seq 73194:74508, ack 0, win 501, options [nop,nop,TS val 2039015070 ecr 3077084173], length 1314
01:19:20.345539 IP 52.223.227.197.1935 > 10.8.0.4.33228: Flags [.], ack 62529, win 230, options [nop,nop,TS val 3077084252 ecr 2039014639], length 0
01:19:20.383915 IP 10.8.0.4.33228 > 52.223.227.197.1935: Flags [.], seq 74508:75822, ack 0, win 501, options [nop,nop,TS val 2039015109 ecr 3077084252], length 1314
01:19:20.444115 IP 52.223.227.197.1935 > 10.8.0.4.33228: Flags [.], ack 65157, win 230, options [nop,nop,TS val 3077084350 ecr 2039014704], length 0
01:19:20.448062 IP 10.8.0.4.33228 > 52.223.227.197.1935: Flags [.], seq 75822:77136, ack 0, win 501, options [nop,nop,TS val 2039015173 ecr 3077084350], length 1314
01:19:20.476520 IP 10.8.0.4.33228 > 52.223.227.197.1935: Flags [.], seq 77136:78450, ack 0, win 501, options [nop,nop,TS val 2039015201 ecr 3077084350], length 1314
01:19:20.510024 IP 52.223.227.197.1935 > 10.8.0.4.33228: Flags [.], ack 67785, win 230, options [nop,nop,TS val 3077084416 ecr 2039014810], length 0
01:19:20.511692 IP 10.8.0.4.33228 > 52.223.227.197.1935: Flags [.], seq 78450:79764, ack 0, win 501, options [nop,nop,TS val 2039015237 ecr 3077084416], length 1314
01:19:20.578086 IP 10.8.0.4.33228 > 52.223.227.197.1935: Flags [.], seq 79764:81078, ack 0, win 501, options [nop,nop,TS val 2039015303 ecr 3077084416], length 1314
01:19:20.614938 IP 52.223.227.197.1935 > 10.8.0.4.33228: Flags [.], ack 70413, win 230, options [nop,nop,TS val 3077084521 ecr 2039014903], length 0
01:19:20.618836 IP 10.8.0.4.33228 > 52.223.227.197.1935: Flags [.], seq 81078:82392, ack 0, win 501, options [nop,nop,TS val 2039015344 ecr 3077084521], length 1314
01:19:20.645160 IP 10.8.0.4.33228 > 52.223.227.197.1935: Flags [.], seq 82392:83706, ack 0, win 501, options [nop,nop,TS val 2039015370 ecr 3077084521], length 1314
01:19:20.669101 IP 52.223.227.197.1935 > 10.8.0.4.33228: Flags [.], ack 71880, win 230, options [nop,nop,TS val 3077084575 ecr 2039014968], length 0
01:19:20.669128 IP 10.8.0.4.33228 > 52.223.227.197.1935: Flags [P.], seq 83706:83844, ack 0, win 501, options [nop,nop,TS val 2039015394 ecr 3077084575], length 138
01:19:20.710613 IP 10.8.0.4.33228 > 52.223.227.197.1935: Flags [.], seq 83844:85158, ack 0, win 501, options [nop,nop,TS val 2039015435 ecr 3077084575], length 1314
01:19:20.746932 IP 52.223.227.197.1935 > 10.8.0.4.33228: Flags [.], ack 74508, win 230, options [nop,nop,TS val 3077084653 ecr 2039015035], length 0
01:19:20.747507 IP 10.8.0.4.33228 > 52.223.227.197.1935: Flags [.], seq 85158:86472, ack 0, win 501, options [nop,nop,TS val 2039015472 ecr 3077084653], length 1314
01:19:20.790062 IP 10.8.0.4.33228 > 52.223.227.197.1935: Flags [.], seq 86472:87786, ack 0, win 501, options [nop,nop,TS val 2039015515 ecr 3077084653], length 1314
01:19:20.844570 IP 10.8.0.4.33228 > 52.223.227.197.1935: Flags [.], seq 87786:89100, ack 0, win 501, options [nop,nop,TS val 2039015569 ecr 3077084653], length 1314
01:19:20.849953 IP 52.223.227.197.1935 > 10.8.0.4.33228: Flags [.], ack 77136, win 230, options [nop,nop,TS val 3077084756 ecr 2039015109], length 0
01:19:20.878413 IP 10.8.0.4.33228 > 52.223.227.197.1935: Flags [.], seq 89100:90414, ack 0, win 501, options [nop,nop,TS val 2039015603 ecr 3077084756], length 1314
01:19:20.913670 IP 52.223.227.197.1935 > 10.8.0.4.33228: Flags [.], ack 79764, win 230, options [nop,nop,TS val 3077084820 ecr 2039015201], length 0
01:19:20.918462 IP 10.8.0.4.33228 > 52.223.227.197.1935: Flags [.], seq 90414:91728, ack 0, win 501, options [nop,nop,TS val 2039015643 ecr 3077084820], length 1314
01:19:20.982524 IP 10.8.0.4.33228 > 52.223.227.197.1935: Flags [.], seq 91728:93042, ack 0, win 501, options [nop,nop,TS val 2039015707 ecr 3077084820], length 1314
01:19:21.010595 IP 10.8.0.4.33228 > 52.223.227.197.1935: Flags [.], seq 93042:94356, ack 0, win 501, options [nop,nop,TS val 2039015735 ecr 3077084820], length 1314
01:19:21.020708 IP 52.223.227.197.1935 > 10.8.0.4.33228: Flags [.], ack 82392, win 230, options [nop,nop,TS val 3077084927 ecr 2039015303], length 0
01:19:21.046276 IP 10.8.0.4.33228 > 52.223.227.197.1935: Flags [.], seq 94356:95670, ack 0, win 501, options [nop,nop,TS val 2039015771 ecr 3077084927], length 1314
01:19:21.070464 IP 52.223.227.197.1935 > 10.8.0.4.33228: Flags [.], ack 83844, win 230, options [nop,nop,TS val 3077084977 ecr 2039015370], length 0
01:19:21.070482 IP 10.8.0.4.33228 > 52.223.227.197.1935: Flags [P.], seq 95670:95824, ack 0, win 501, options [nop,nop,TS val 2039015795 ecr 3077084977], length 154
01:19:21.111516 IP 10.8.0.4.33228 > 52.223.227.197.1935: Flags [.], seq 95824:97138, ack 0, win 501, options [nop,nop,TS val 2039015836 ecr 3077084977], length 1314
01:19:21.149503 IP 52.223.227.197.1935 > 10.8.0.4.33228: Flags [.], ack 86472, win 230, options [nop,nop,TS val 3077085056 ecr 2039015435], length 0
01:19:21.153086 IP 10.8.0.4.33228 > 52.223.227.197.1935: Flags [.], seq 97138:98452, ack 0, win 501, options [nop,nop,TS val 2039015878 ecr 3077085056], length 1314
01:19:21.195833 IP 10.8.0.4.33228 > 52.223.227.197.1935: Flags [.], seq 98452:99766, ack 0, win 501, options [nop,nop,TS val 2039015921 ecr 3077085056], length 1314
01:19:21.244867 IP 10.8.0.4.33228 > 52.223.227.197.1935: Flags [.], seq 99766:101080, ack 0, win 501, options [nop,nop,TS val 2039015970 ecr 3077085056], length 1314
01:19:21.246544 IP 52.223.227.197.1935 > 10.8.0.4.33228: Flags [.], ack 89100, win 230, options [nop,nop,TS val 3077085153 ecr 2039015515], length 0
01:19:21.281673 IP 10.8.0.4.33228 > 52.223.227.197.1935: Flags [.], seq 101080:102394, ack 0, win 501, options [nop,nop,TS val 2039016006 ecr 3077085153], length 1314
01:19:21.320569 IP 52.223.227.197.1935 > 10.8.0.4.33228: Flags [.], ack 91728, win 230, options [nop,nop,TS val 3077085226 ecr 2039015603], length 0
01:19:21.324678 IP 10.8.0.4.33228 > 52.223.227.197.1935: Flags [.], seq 102394:103708, ack 0, win 501, options [nop,nop,TS val 2039016049 ecr 3077085226], length 1314
01:19:21.377469 IP 10.8.0.4.33228 > 52.223.227.197.1935: Flags [.], seq 103708:105022, ack 0, win 501, options [nop,nop,TS val 2039016102 ecr 3077085226], length 1314
01:19:21.410702 IP 10.8.0.4.33228 > 52.223.227.197.1935: Flags [.], seq 105022:106336, ack 0, win 501, options [nop,nop,TS val 2039016136 ecr 3077085226], length 1314
01:19:21.412216 IP 52.223.227.197.1935 > 10.8.0.4.33228: Flags [.], ack 94356, win 230, options [nop,nop,TS val 3077085319 ecr 2039015707], length 0
01:19:21.452715 IP 10.8.0.4.33228 > 52.223.227.197.1935: Flags [.], seq 106336:107650, ack 0, win 501, options [nop,nop,TS val 2039016178 ecr 3077085319], length 1314
01:19:21.471939 IP 52.223.227.197.1935 > 10.8.0.4.33228: Flags [.], ack 95824, win 230, options [nop,nop,TS val 3077085378 ecr 2039015771], length 0
01:19:21.471962 IP 10.8.0.4.33228 > 52.223.227.197.1935: Flags [P.], seq 107650:107688, ack 0, win 501, options [nop,nop,TS val 2039016197 ecr 3077085378], length 38
01:19:21.517039 IP 10.8.0.4.33228 > 52.223.227.197.1935: Flags [.], seq 107688:109002, ack 0, win 501, options [nop,nop,TS val 2039016242 ecr 3077085378], length 1314
01:19:21.544947 IP 10.8.0.4.33228 > 52.223.227.197.1935: Flags [.], seq 109002:110316, ack 0, win 501, options [nop,nop,TS val 2039016270 ecr 3077085378], length 1314
01:19:21.555300 IP 52.223.227.197.1935 > 10.8.0.4.33228: Flags [.], ack 98452, win 230, options [nop,nop,TS val 3077085461 ecr 2039015836], length 0
01:19:21.581302 IP 10.8.0.4.33228 > 52.223.227.197.1935: Flags [.], seq 110316:111630, ack 0, win 501, options [nop,nop,TS val 2039016306 ecr 3077085461], length 1314
01:19:21.645055 IP 10.8.0.4.33228 > 52.223.227.197.1935: Flags [.], seq 111630:112944, ack 0, win 501, options [nop,nop,TS val 2039016370 ecr 3077085461], length 1314
01:19:21.646434 IP 52.223.227.197.1935 > 10.8.0.4.33228: Flags [.], ack 101080, win 230, options [nop,nop,TS val 3077085553 ecr 2039015921], length 0
01:19:21.687426 IP 10.8.0.4.33228 > 52.223.227.197.1935: Flags [.], seq 112944:114258, ack 0, win 501, options [nop,nop,TS val 2039016412 ecr 3077085553], length 1314
01:19:21.708611 IP 10.8.0.4.33228 > 52.223.227.197.1935: Flags [.], seq 114258:115572, ack 0, win 501, options [nop,nop,TS val 2039016433 ecr 3077085553], length 1314
01:19:21.729080 IP 52.223.227.197.1935 > 10.8.0.4.33228: Flags [.], ack 103708, win 230, options [nop,nop,TS val 3077085633 ecr 2039016006], length 0
01:19:21.778393 IP 10.8.0.4.33228 > 52.223.227.197.1935: Flags [.], seq 115572:116886, ack 0, win 501, options [nop,nop,TS val 2039016503 ecr 3077085633], length 1314
01:19:21.812917 IP 52.223.227.197.1935 > 10.8.0.4.33228: Flags [.], ack 106336, win 230, options [nop,nop,TS val 3077085719 ecr 2039016102], length 0
01:19:21.815751 IP 10.8.0.4.33228 > 52.223.227.197.1935: Flags [.], seq 116886:118200, ack 0, win 501, options [nop,nop,TS val 2039016541 ecr 3077085719], length 1314
01:19:21.840794 IP 10.8.0.4.33228 > 52.223.227.197.1935: Flags [.], seq 118200:119514, ack 0, win 501, options [nop,nop,TS val 2039016566 ecr 3077085719], length 1314
01:19:21.873752 IP 52.223.227.197.1935 > 10.8.0.4.33228: Flags [.], ack 107688, win 230, options [nop,nop,TS val 3077085780 ecr 2039016178], length 0
01:19:21.873772 IP 10.8.0.4.33228 > 52.223.227.197.1935: Flags [P.], seq 119514:119667, ack 0, win 501, options [nop,nop,TS val 2039016599 ecr 3077085780], length 153
01:19:21.910114 IP 10.8.0.4.33228 > 52.223.227.197.1935: Flags [.], seq 119667:120981, ack 0, win 501, options [nop,nop,TS val 2039016635 ecr 3077085780], length 1314
01:19:21.945309 IP 10.8.0.4.33228 > 52.223.227.197.1935: Flags [.], seq 120981:122295, ack 0, win 501, options [nop,nop,TS val 2039016670 ecr 3077085780], length 1314
01:19:21.946871 IP 52.223.227.197.1935 > 10.8.0.4.33228: Flags [.], ack 110316, win 230, options [nop,nop,TS val 3077085853 ecr 2039016242], length 0
01:19:21.986311 IP 10.8.0.4.33228 > 52.223.227.197.1935: Flags [.], seq 122295:123609, ack 0, win 501, options [nop,nop,TS val 2039016711 ecr 3077085853], length 1314
01:19:22.047021 IP 52.223.227.197.1935 > 10.8.0.4.33228: Flags [.], ack 112944, win 230, options [nop,nop,TS val 3077085953 ecr 2039016306], length 0
01:19:22.050507 IP 10.8.0.4.33228 > 52.223.227.197.1935: Flags [.], seq 123609:124923, ack 0, win 501, options [nop,nop,TS val 2039016775 ecr 3077085953], length 1314
01:19:22.077854 IP 10.8.0.4.33228 > 52.223.227.197.1935: Flags [.], seq 124923:126237, ack 0, win 501, options [nop,nop,TS val 2039016803 ecr 3077085953], length 1314
01:19:22.110337 IP 52.223.227.197.1935 > 10.8.0.4.33228: Flags [.], ack 115572, win 230, options [nop,nop,TS val 3077086016 ecr 2039016412], length 0
01:19:22.114751 IP 10.8.0.4.33228 > 52.223.227.197.1935: Flags [.], seq 126237:127551, ack 0, win 501, options [nop,nop,TS val 2039016840 ecr 3077086016], length 1314
01:19:22.178940 IP 10.8.0.4.33228 > 52.223.227.197.1935: Flags [.], seq 127551:128865, ack 0, win 501, options [nop,nop,TS val 2039016904 ecr 3077086016], length 1314
01:19:22.217769 IP 52.223.227.197.1935 > 10.8.0.4.33228: Flags [.], ack 118200, win 230, options [nop,nop,TS val 3077086124 ecr 2039016503], length 0
01:19:22.221812 IP 10.8.0.4.33228 > 52.223.227.197.1935: Flags [.], seq 128865:130179, ack 0, win 501, options [nop,nop,TS val 2039016947 ecr 3077086124], length 1314
01:19:22.245030 IP 10.8.0.4.33228 > 52.223.227.197.1935: Flags [.], seq 130179:131493, ack 0, win 501, options [nop,nop,TS val 2039016970 ecr 3077086124], length 1314
01:19:22.275160 IP 52.223.227.197.1935 > 10.8.0.4.33228: Flags [.], ack 119667, win 230, options [nop,nop,TS val 3077086181 ecr 2039016566], length 0
01:19:22.275204 IP 10.8.0.4.33228 > 52.223.227.197.1935: Flags [P.], seq 131493:131631, ack 0, win 501, options [nop,nop,TS val 2039017000 ecr 3077086181], length 138
01:19:22.310593 IP 10.8.0.4.33228 > 52.223.227.197.1935: Flags [.], seq 131631:132945, ack 0, win 501, options [nop,nop,TS val 2039017035 ecr 3077086181], length 1314
01:19:22.347308 IP 52.223.227.197.1935 > 10.8.0.4.33228: Flags [.], ack 122295, win 230, options [nop,nop,TS val 3077086253 ecr 2039016635], length 0
01:19:22.350802 IP 10.8.0.4.33228 > 52.223.227.197.1935: Flags [.], seq 132945:134259, ack 0, win 501, options [nop,nop,TS val 2039017076 ecr 3077086253], length 1314
01:19:22.393682 IP 10.8.0.4.33228 > 52.223.227.197.1935: Flags [.], seq 134259:135573, ack 0, win 501, options [nop,nop,TS val 2039017119 ecr 3077086253], length 1314
01:19:22.444420 IP 10.8.0.4.33228 > 52.223.227.197.1935: Flags [.], seq 135573:136887, ack 0, win 501, options [nop,nop,TS val 2039017169 ecr 3077086253], length 1314
01:19:22.452721 IP 52.223.227.197.1935 > 10.8.0.4.33228: Flags [.], ack 124923, win 230, options [nop,nop,TS val 3077086359 ecr 2039016711], length 0
01:19:22.479213 IP 10.8.0.4.33228 > 52.223.227.197.1935: Flags [.], seq 136887:138201, ack 0, win 501, options [nop,nop,TS val 2039017204 ecr 3077086359], length 1314
01:19:22.516741 IP 52.223.227.197.1935 > 10.8.0.4.33228: Flags [.], ack 127551, win 230, options [nop,nop,TS val 3077086423 ecr 2039016803], length 0
01:19:22.521546 IP 10.8.0.4.33228 > 52.223.227.197.1935: Flags [.], seq 138201:139515, ack 0, win 501, options [nop,nop,TS val 2039017246 ecr 3077086423], length 1314
01:19:22.585348 IP 10.8.0.4.33228 > 52.223.227.197.1935: Flags [.], seq 139515:140829, ack 0, win 501, options [nop,nop,TS val 2039017310 ecr 3077086423], length 1314
01:19:22.611860 IP 10.8.0.4.33228 > 52.223.227.197.1935: Flags [.], seq 140829:142143, ack 0, win 501, options [nop,nop,TS val 2039017337 ecr 3077086423], length 1314
01:19:22.623920 IP 52.223.227.197.1935 > 10.8.0.4.33228: Flags [.], ack 130179, win 230, options [nop,nop,TS val 3077086530 ecr 2039016904], length 0
01:19:22.650153 IP 10.8.0.4.33228 > 52.223.227.197.1935: Flags [.], seq 142143:143457, ack 0, win 501, options [nop,nop,TS val 2039017375 ecr 3077086530], length 1314
01:19:22.676903 IP 52.223.227.197.1935 > 10.8.0.4.33228: Flags [.], ack 131631, win 230, options [nop,nop,TS val 3077086583 ecr 2039016970], length 0
01:19:22.676927 IP 10.8.0.4.33228 > 52.223.227.197.1935: Flags [P.], seq 143457:144457, ack 0, win 501, options [nop,nop,TS val 2039017402 ecr 3077086583], length 1000
01:19:22.753136 IP 52.223.227.197.1935 > 10.8.0.4.33228: Flags [.], ack 134259, win 230, options [nop,nop,TS val 3077086659 ecr 2039017035], length 0
01:19:22.757035 IP 10.8.0.4.33228 > 52.223.227.197.1935: Flags [.], seq 144457:145771, ack 0, win 501, options [nop,nop,TS val 2039017482 ecr 3077086659], length 1314
01:19:22.778540 IP 10.8.0.4.33228 > 52.223.227.197.1935: Flags [.], seq 145771:147085, ack 0, win 501, options [nop,nop,TS val 2039017503 ecr 3077086659], length 1314
01:19:22.821132 IP 10.8.0.4.33228 > 52.223.227.197.1935: Flags [.], seq 147085:148399, ack 0, win 501, options [nop,nop,TS val 2039017546 ecr 3077086659], length 1314
01:19:22.846832 IP 52.223.227.197.1935 > 10.8.0.4.33228: Flags [.], ack 136887, win 230, options [nop,nop,TS val 3077086753 ecr 2039017119], length 0
01:19:22.885598 IP 10.8.0.4.33228 > 52.223.227.197.1935: Flags [.], seq 148399:149713, ack 0, win 501, options [nop,nop,TS val 2039017610 ecr 3077086753], length 1314
01:19:22.911868 IP 10.8.0.4.33228 > 52.223.227.197.1935: Flags [.], seq 149713:151027, ack 0, win 501, options [nop,nop,TS val 2039017637 ecr 3077086753], length 1314
01:19:22.925134 IP 52.223.227.197.1935 > 10.8.0.4.33228: Flags [.], ack 139515, win 230, options [nop,nop,TS val 3077086831 ecr 2039017204], length 0
01:19:22.949884 IP 10.8.0.4.33228 > 52.223.227.197.1935: Flags [.], seq 151027:152341, ack 0, win 501, options [nop,nop,TS val 2039017675 ecr 3077086831], length 1314
01:19:23.013884 IP 52.223.227.197.1935 > 10.8.0.4.33228: Flags [.], ack 142143, win 230, options [nop,nop,TS val 3077086920 ecr 2039017310], length 0
01:19:23.013976 IP 10.8.0.4.33228 > 52.223.227.197.1935: Flags [.], seq 152341:153655, ack 0, win 501, options [nop,nop,TS val 2039017739 ecr 3077086920], length 1314
01:19:23.056854 IP 10.8.0.4.33228 > 52.223.227.197.1935: Flags [.], seq 153655:154969, ack 0, win 501, options [nop,nop,TS val 2039017782 ecr 3077086920], length 1314
01:19:23.078121 IP 10.8.0.4.33228 > 52.223.227.197.1935: Flags [.], seq 154969:156283, ack 0, win 501, options [nop,nop,TS val 2039017803 ecr 3077086920], length 1314
01:19:23.078854 IP 52.223.227.197.1935 > 10.8.0.4.33228: Flags [.], ack 144457, win 230, options [nop,nop,TS val 3077086985 ecr 2039017375], length 0
01:19:23.078874 IP 10.8.0.4.33228 > 52.223.227.197.1935: Flags [P.], seq 156283:156417, ack 0, win 501, options [nop,nop,TS val 2039017804 ecr 3077086985], length 134
01:19:23.144042 IP 10.8.0.4.33228 > 52.223.227.197.1935: Flags [.], seq 156417:157731, ack 0, win 501, options [nop,nop,TS val 2039017869 ecr 3077086985], length 1314
01:19:23.181147 IP 52.223.227.197.1935 > 10.8.0.4.33228: Flags [.], ack 147085, win 230, options [nop,nop,TS val 3077087087 ecr 2039017482], length 0
01:19:23.185129 IP 10.8.0.4.33228 > 52.223.227.197.1935: Flags [.], seq 157731:159045, ack 0, win 501, options [nop,nop,TS val 2039017910 ecr 3077087087], length 1314
01:19:23.211800 IP 10.8.0.4.33228 > 52.223.227.197.1935: Flags [.], seq 159045:160359, ack 0, win 501, options [nop,nop,TS val 2039017937 ecr 3077087087], length 1314
01:19:23.287247 IP 52.223.227.197.1935 > 10.8.0.4.33228: Flags [.], ack 148399, win 230, options [nop,nop,TS val 3077087193 ecr 2039017546], length 0
01:19:23.291982 IP 10.8.0.4.33228 > 52.223.227.197.1935: Flags [.], seq 160359:161673, ack 0, win 501, options [nop,nop,TS val 2039018017 ecr 3077087193], length 1314
01:19:23.313171 IP 10.8.0.4.33228 > 52.223.227.197.1935: Flags [.], seq 161673:162987, ack 0, win 501, options [nop,nop,TS val 2039018038 ecr 3077087193], length 1314
01:19:23.313982 IP 52.223.227.197.1935 > 10.8.0.4.33228: Flags [.], ack 151027, win 230, options [nop,nop,TS val 3077087220 ecr 2039017610], length 0
01:19:23.355644 IP 10.8.0.4.33228 > 52.223.227.197.1935: Flags [.], seq 162987:164301, ack 0, win 501, options [nop,nop,TS val 2039018080 ecr 3077087220], length 1314
01:19:23.416284 IP 52.223.227.197.1935 > 10.8.0.4.33228: Flags [.], ack 153655, win 230, options [nop,nop,TS val 3077087322 ecr 2039017675], length 0
01:19:23.419358 IP 10.8.0.4.33228 > 52.223.227.197.1935: Flags [.], seq 164301:165615, ack 0, win 501, options [nop,nop,TS val 2039018144 ecr 3077087322], length 1314
01:19:23.441047 IP 10.8.0.4.33228 > 52.223.227.197.1935: Flags [.], seq 165615:166929, ack 0, win 501, options [nop,nop,TS val 2039018166 ecr 3077087322], length 1314
01:19:23.479964 IP 52.223.227.197.1935 > 10.8.0.4.33228: Flags [.], ack 156283, win 230, options [nop,nop,TS val 3077087386 ecr 2039017782], length 0
01:19:23.480400 IP 52.223.227.197.1935 > 10.8.0.4.33228: Flags [.], ack 156417, win 230, options [nop,nop,TS val 3077087387 ecr 2039017804], length 0
01:19:23.480433 IP 10.8.0.4.33228 > 52.223.227.197.1935: Flags [P.], seq 166929:167550, ack 0, win 501, options [nop,nop,TS val 2039018205 ecr 3077087387], length 621
01:19:23.511573 IP 10.8.0.4.33228 > 52.223.227.197.1935: Flags [.], seq 167550:168864, ack 0, win 501, options [nop,nop,TS val 2039018236 ecr 3077087387], length 1314
01:19:23.548033 IP 10.8.0.4.33228 > 52.223.227.197.1935: Flags [.], seq 168864:170178, ack 0, win 501, options [nop,nop,TS val 2039018273 ecr 3077087387], length 1314
01:19:23.587136 IP 52.223.227.197.1935 > 10.8.0.4.33228: Flags [.], ack 159045, win 230, options [nop,nop,TS val 3077087493 ecr 2039017869], length 0
01:19:23.609026 IP 10.8.0.4.33228 > 52.223.227.197.1935: Flags [.], seq 170178:171492, ack 0, win 501, options [nop,nop,TS val 2039018334 ecr 3077087493], length 1314
01:19:23.655089 IP 10.8.0.4.33228 > 52.223.227.197.1935: Flags [.], seq 171492:172806, ack 0, win 501, options [nop,nop,TS val 2039018380 ecr 3077087493], length 1314
01:19:23.671422 IP 52.223.227.197.1935 > 10.8.0.4.33228: Flags [.], ack 160359, win 230, options [nop,nop,TS val 3077087577 ecr 2039017937], length 0
01:19:23.678435 IP 10.8.0.4.33228 > 52.223.227.197.1935: Flags [.], seq 172806:174120, ack 0, win 501, options [nop,nop,TS val 2039018403 ecr 3077087577], length 1314
01:19:23.715338 IP 52.223.227.197.1935 > 10.8.0.4.33228: Flags [.], ack 162987, win 230, options [nop,nop,TS val 3077087621 ecr 2039018017], length 0
01:19:23.740540 IP 10.8.0.4.33228 > 52.223.227.197.1935: Flags [.], seq 174120:175434, ack 0, win 501, options [nop,nop,TS val 2039018465 ecr 3077087621], length 1314
01:19:23.783403 IP 10.8.0.4.33228 > 52.223.227.197.1935: Flags [.], seq 175434:176748, ack 0, win 501, options [nop,nop,TS val 2039018508 ecr 3077087621], length 1314
01:19:23.821640 IP 52.223.227.197.1935 > 10.8.0.4.33228: Flags [.], ack 165615, win 230, options [nop,nop,TS val 3077087728 ecr 2039018080], length 0
01:19:23.826363 IP 10.8.0.4.33228 > 52.223.227.197.1935: Flags [.], seq 176748:178062, ack 0, win 501, options [nop,nop,TS val 2039018551 ecr 3077087728], length 1314
01:19:23.869288 IP 10.8.0.4.33228 > 52.223.227.197.1935: Flags [.], seq 178062:179376, ack 0, win 501, options [nop,nop,TS val 2039018594 ecr 3077087728], length 1314
01:19:23.882219 IP 52.223.227.197.1935 > 10.8.0.4.33228: Flags [.], ack 167550, win 230, options [nop,nop,TS val 3077087788 ecr 2039018166], length 0
01:19:23.882256 IP 10.8.0.4.33228 > 52.223.227.197.1935: Flags [P.], seq 179376:179513, ack 0, win 501, options [nop,nop,TS val 2039018607 ecr 3077087788], length 137
01:19:23.912347 IP 10.8.0.4.33228 > 52.223.227.197.1935: Flags [.], seq 179513:180827, ack 0, win 501, options [nop,nop,TS val 2039018637 ecr 3077087788], length 1314
01:19:23.949920 IP 52.223.227.197.1935 > 10.8.0.4.33228: Flags [.], ack 170178, win 230, options [nop,nop,TS val 3077087856 ecr 2039018236], length 0
01:19:23.954757 IP 10.8.0.4.33228 > 52.223.227.197.1935: Flags [.], seq 180827:182141, ack 0, win 501, options [nop,nop,TS val 2039018680 ecr 3077087856], length 1314
01:19:24.007598 IP 10.8.0.4.33228 > 52.223.227.197.1935: Flags [.], seq 182141:183455, ack 0, win 501, options [nop,nop,TS val 2039018732 ecr 3077087856], length 1314
01:19:24.042081 IP 10.8.0.4.33228 > 52.223.227.197.1935: Flags [.], seq 183455:184769, ack 0, win 501, options [nop,nop,TS val 2039018767 ecr 3077087856], length 1314
01:19:24.057375 IP 52.223.227.197.1935 > 10.8.0.4.33228: Flags [.], ack 172806, win 230, options [nop,nop,TS val 3077087963 ecr 2039018334], length 0
01:19:24.082627 IP 10.8.0.4.33228 > 52.223.227.197.1935: Flags [.], seq 184769:186083, ack 0, win 501, options [nop,nop,TS val 2039018807 ecr 3077087963], length 1314
01:19:24.142424 IP 10.8.0.4.33228 > 52.223.227.197.1935: Flags [.], seq 186083:187397, ack 0, win 501, options [nop,nop,TS val 2039018867 ecr 3077087963], length 1314
01:19:24.146092 IP 52.223.227.197.1935 > 10.8.0.4.33228: Flags [.], ack 175434, win 230, options [nop,nop,TS val 3077088049 ecr 2039018403], length 0
01:19:24.189573 IP 10.8.0.4.33228 > 52.223.227.197.1935: Flags [.], seq 187397:188711, ack 0, win 501, options [nop,nop,TS val 2039018914 ecr 3077088049], length 1314
01:19:24.211063 IP 10.8.0.4.33228 > 52.223.227.197.1935: Flags [.], seq 188711:190025, ack 0, win 501, options [nop,nop,TS val 2039018936 ecr 3077088049], length 1314
01:19:24.228757 IP 52.223.227.197.1935 > 10.8.0.4.33228: Flags [.], ack 178062, win 230, options [nop,nop,TS val 3077088135 ecr 2039018508], length 0
01:19:24.254144 IP 10.8.0.4.33228 > 52.223.227.197.1935: Flags [.], seq 190025:191339, ack 0, win 501, options [nop,nop,TS val 2039018979 ecr 3077088135], length 1314
01:19:24.284074 IP 52.223.227.197.1935 > 10.8.0.4.33228: Flags [.], ack 179513, win 230, options [nop,nop,TS val 3077088190 ecr 2039018594], length 0
01:19:24.284119 IP 10.8.0.4.33228 > 52.223.227.197.1935: Flags [P.], seq 191339:192339, ack 0, win 501, options [nop,nop,TS val 2039019009 ecr 3077088190], length 1000
01:19:24.344238 IP 10.8.0.4.33228 > 52.223.227.197.1935: Flags [.], seq 192339:193653, ack 0, win 501, options [nop,nop,TS val 2039019069 ecr 3077088190], length 1314
01:19:24.356785 IP 52.223.227.197.1935 > 10.8.0.4.33228: Flags [.], ack 182141, win 230, options [nop,nop,TS val 3077088263 ecr 2039018637], length 0
01:19:24.377482 IP 10.8.0.4.33228 > 52.223.227.197.1935: Flags [.], seq 193653:194967, ack 0, win 501, options [nop,nop,TS val 2039019102 ecr 3077088263], length 1314
01:19:24.409322 IP 10.8.0.4.33228 > 52.223.227.197.1935: Flags [.], seq 194967:196281, ack 0, win 501, options [nop,nop,TS val 2039019134 ecr 3077088263], length 1314
01:19:24.443772 IP 52.223.227.197.1935 > 10.8.0.4.33228: Flags [.], ack 184769, win 230, options [nop,nop,TS val 3077088350 ecr 2039018732], length 0
01:19:24.476471 IP 10.8.0.4.33228 > 52.223.227.197.1935: Flags [.], seq 196281:197595, ack 0, win 501, options [nop,nop,TS val 2039019201 ecr 3077088350], length 1314
01:19:24.507415 IP 10.8.0.4.33228 > 52.223.227.197.1935: Flags [.], seq 197595:198909, ack 0, win 501, options [nop,nop,TS val 2039019232 ecr 3077088350], length 1314
01:19:24.541665 IP 10.8.0.4.33228 > 52.223.227.197.1935: Flags [.], seq 198909:200223, ack 0, win 501, options [nop,nop,TS val 2039019266 ecr 3077088350], length 1314
01:19:24.547558 IP 52.223.227.197.1935 > 10.8.0.4.33228: Flags [.], ack 187397, win 230, options [nop,nop,TS val 3077088454 ecr 2039018807], length 0
01:19:24.611859 IP 10.8.0.4.33228 > 52.223.227.197.1935: Flags [.], seq 200223:201537, ack 0, win 501, options [nop,nop,TS val 2039019337 ecr 3077088454], length 1314
01:19:24.613139 IP 52.223.227.197.1935 > 10.8.0.4.33228: Flags [.], ack 190025, win 230, options [nop,nop,TS val 3077088519 ecr 2039018914], length 0
01:19:24.645299 IP 10.8.0.4.33228 > 52.223.227.197.1935: Flags [.], seq 201537:202851, ack 0, win 501, options [nop,nop,TS val 2039019370 ecr 3077088519], length 1314
01:19:24.676695 IP 10.8.0.4.33228 > 52.223.227.197.1935: Flags [.], seq 202851:204165, ack 0, win 501, options [nop,nop,TS val 2039019402 ecr 3077088519], length 1314
01:19:24.686181 IP 52.223.227.197.1935 > 10.8.0.4.33228: Flags [.], ack 192339, win 230, options [nop,nop,TS val 3077088592 ecr 2039018979], length 0
01:19:24.686207 IP 10.8.0.4.33228 > 52.223.227.197.1935: Flags [P.], seq 204165:204299, ack 0, win 501, options [nop,nop,TS val 2039019411 ecr 3077088592], length 134
01:19:24.745224 IP 10.8.0.4.33228 > 52.223.227.197.1935: Flags [.], seq 204299:205613, ack 0, win 501, options [nop,nop,TS val 2039019470 ecr 3077088592], length 1314
01:19:24.774190 IP 10.8.0.4.33228 > 52.223.227.197.1935: Flags [.], seq 205613:206927, ack 0, win 501, options [nop,nop,TS val 2039019499 ecr 3077088592], length 1314
01:19:24.779337 IP 52.223.227.197.1935 > 10.8.0.4.33228: Flags [.], ack 194967, win 230, options [nop,nop,TS val 3077088686 ecr 2039019069], length 0
01:19:24.810061 IP 10.8.0.4.33228 > 52.223.227.197.1935: Flags [.], seq 206927:208241, ack 0, win 501, options [nop,nop,TS val 2039019535 ecr 3077088686], length 1314
