04:25:32.180464 IP 185.42.207.254.1935 > 10.8.2.2.40916: Flags [.], ack 3161347518, win 126, options [nop,nop,TS val 3045301602 ecr 2865538009], length 0
04:25:32.180477 IP 10.8.2.2.40916 > 185.42.207.254.1935: Flags [P.], seq 9199:9900, ack 0, win 501, options [nop,nop,TS val 2865538358 ecr 3045301602], length 701
04:25:32.231277 IP 10.8.2.2.40916 > 185.42.207.254.1935: Flags [.], seq 9900:11214, ack 0, win 501, options [nop,nop,TS val 2865538409 ecr 3045301602], length 1314
04:25:32.267366 IP 10.8.2.2.40916 > 185.42.207.254.1935: Flags [.], seq 11214:12528, ack 0, win 501, options [nop,nop,TS val 2865538445 ecr 3045301602], length 1314
04:25:32.267715 IP 185.42.207.254.1935 > 10.8.2.2.40916: Flags [.], ack 2629, win 126, options [nop,nop,TS val 3045301690 ecr 2865538078], length 0
04:25:32.300531 IP 10.8.2.2.40916 > 185.42.207.254.1935: Flags [.], seq 12528:13842, ack 0, win 501, options [nop,nop,TS val 2865538478 ecr 3045301690], length 1314
04:25:32.367333 IP 10.8.2.2.40916 > 185.42.207.254.1935: Flags [.], seq 13842:15156, ack 0, win 501, options [nop,nop,TS val 2865538545 ecr 3045301690], length 1314
04:25:32.367936 IP 185.42.207.254.1935 > 10.8.2.2.40916: Flags [.], ack 5257, win 126, options [nop,nop,TS val 3045301790 ecr 2865538153], length 0
04:25:32.397616 IP 10.8.2.2.40916 > 185.42.207.254.1935: Flags [.], seq 15156:16470, ack 0, win 501, options [nop,nop,TS val 2865538576 ecr 3045301790], length 1314
04:25:32.431022 IP 10.8.2.2.40916 > 185.42.207.254.1935: Flags [.], seq 16470:17784, ack 0, win 501, options [nop,nop,TS val 2865538609 ecr 3045301790], length 1314
04:25:32.437474 IP 185.42.207.254.1935 > 10.8.2.2.40916: Flags [.], ack 7885, win 126, options [nop,nop,TS val 3045301860 ecr 2865538245], length 0
04:25:32.497216 IP 10.8.2.2.40916 > 185.42.207.254.1935: Flags [.], seq 17784:19098, ack 0, win 501, options [nop,nop,TS val 2865538675 ecr 3045301860], length 1314
04:25:32.514367 IP 185.42.207.254.1935 > 10.8.2.2.40916: Flags [.], ack 9900, win 126, options [nop,nop,TS val 3045301937 ecr 2865538346], length 0
04:25:32.514388 IP 10.8.2.2.40916 > 185.42.207.254.1935: Flags [P.], seq 19098:19894, ack 0, win 501, options [nop,nop,TS val 2865538692 ecr 3045301937], length 796
04:25:32.567702 IP 10.8.2.2.40916 > 185.42.207.254.1935: Flags [.], seq 19894:21208, ack 0, win 501, options [nop,nop,TS val 2865538746 ecr 3045301937], length 1314
04:25:32.596590 IP 10.8.2.2.40916 > 185.42.207.254.1935: Flags [.], seq 21208:22522, ack 0, win 501, options [nop,nop,TS val 2865538775 ecr 3045301937], length 1314
04:25:32.601109 IP 185.42.207.254.1935 > 10.8.2.2.40916: Flags [.], ack 12528, win 126, options [nop,nop,TS val 3045302023 ecr 2865538409], length 0
04:25:32.636966 IP 10.8.2.2.40916 > 185.42.207.254.1935: Flags [.], seq 22522:23836, ack 0, win 501, options [nop,nop,TS val 2865538815 ecr 3045302023], length 1314
04:25:32.700791 IP 10.8.2.2.40916 > 185.42.207.254.1935: Flags [.], seq 23836:25150, ack 0, win 501, options [nop,nop,TS val 2865538879 ecr 3045302023], length 1314
04:25:32.701063 IP 185.42.207.254.1935 > 10.8.2.2.40916: Flags [.], ack 15156, win 126, options [nop,nop,TS val 3045302123 ecr 2865538478], length 0
04:25:32.729857 IP 10.8.2.2.40916 > 185.42.207.254.1935: Flags [.], seq 25150:26464, ack 0, win 501, options [nop,nop,TS val 2865538908 ecr 3045302123], length 1314
04:25:32.764403 IP 10.8.2.2.40916 > 185.42.207.254.1935: Flags [.], seq 26464:27778, ack 0, win 501, options [nop,nop,TS val 2865538942 ecr 3045302123], length 1314
04:25:32.764853 IP 185.42.207.254.1935 > 10.8.2.2.40916: Flags [.], ack 17784, win 126, options [nop,nop,TS val 3045302187 ecr 2865538576], length 0
04:25:32.834178 IP 10.8.2.2.40916 > 185.42.207.254.1935: Flags [.], seq 27778:29092, ack 0, win 501, options [nop,nop,TS val 2865539012 ecr 3045302187], length 1314
04:25:32.847985 IP 185.42.207.254.1935 > 10.8.2.2.40916: Flags [.], ack 19894, win 126, options [nop,nop,TS val 3045302270 ecr 2865538675], length 0
04:25:32.848023 IP 10.8.2.2.40916 > 185.42.207.254.1935: Flags [P.], seq 29092:29786, ack 0, win 501, options [nop,nop,TS val 2865539026 ecr 3045302270], length 694
04:25:32.898302 IP 10.8.2.2.40916 > 185.42.207.254.1935: Flags [.], seq 29786:31100, ack 0, win 501, options [nop,nop,TS val 2865539076 ecr 3045302270], length 1314
04:25:32.930431 IP 185.42.207.254.1935 > 10.8.2.2.40916: Flags [.], ack 22522, win 126, options [nop,nop,TS val 3045302353 ecr 2865538746], length 0
04:25:32.932475 IP 10.8.2.2.40916 > 185.42.207.254.1935: Flags [.], seq 31100:32414, ack 0, win 501, options [nop,nop,TS val 2865539110 ecr 3045302353], length 1314
04:25:32.964288 IP 10.8.2.2.40916 > 185.42.207.254.1935: Flags [.], seq 32414:33728, ack 0, win 501, options [nop,nop,TS val 2865539142 ecr 3045302353], length 1314
04:25:33.029789 IP 10.8.2.2.40916 > 185.42.207.254.1935: Flags [.], seq 33728:35042, ack 0, win 501, options [nop,nop,TS val 2865539208 ecr 3045302353], length 1314
04:25:33.034926 IP 185.42.207.254.1935 > 10.8.2.2.40916: Flags [.], ack 25150, win 126, options [nop,nop,TS val 3045302457 ecr 2865538815], length 0
04:25:33.064837 IP 10.8.2.2.40916 > 185.42.207.254.1935: Flags [.], seq 35042:36356, ack 0, win 501, options [nop,nop,TS val 2865539243 ecr 3045302457], length 1314
04:25:33.098502 IP 185.42.207.254.1935 > 10.8.2.2.40916: Flags [.], ack 27778, win 126, options [nop,nop,TS val 3045302520 ecr 2865538908], length 0
04:25:33.100533 IP 10.8.2.2.40916 > 185.42.207.254.1935: Flags [.], seq 36356:37670, ack 0, win 501, options [nop,nop,TS val 2865539278 ecr 3045302520], length 1314
04:25:33.167382 IP 10.8.2.2.40916 > 185.42.207.254.1935: Flags [.], seq 37670:38984, ack 0, win 501, options [nop,nop,TS val 2865539345 ecr 3045302520], length 1314
04:25:33.181818 IP 185.42.207.254.1935 > 10.8.2.2.40916: Flags [.], ack 29786, win 126, options [nop,nop,TS val 3045302604 ecr 2865539012], length 0
04:25:33.181867 IP 10.8.2.2.40916 > 185.42.207.254.1935: Flags [P.], seq 38984:39784, ack 0, win 501, options [nop,nop,TS val 2865539360 ecr 3045302604], length 800
04:25:33.234211 IP 10.8.2.2.40916 > 185.42.207.254.1935: Flags [.], seq 39784:41098, ack 0, win 501, options [nop,nop,TS val 2865539412 ecr 3045302604], length 1314
04:25:33.256792 IP 10.8.2.2.40916 > 185.42.207.254.1935: Flags [.], seq 41098:42412, ack 0, win 501, options [nop,nop,TS val 2865539435 ecr 3045302604], length 1314
04:25:33.266174 IP 185.42.207.254.1935 > 10.8.2.2.40916: Flags [.], ack 32414, win 126, options [nop,nop,TS val 3045302689 ecr 2865539076], length 0
04:25:33.296283 IP 10.8.2.2.40916 > 185.42.207.254.1935: Flags [.], seq 42412:43726, ack 0, win 501, options [nop,nop,TS val 2865539474 ecr 3045302689], length 1314
04:25:33.363036 IP 185.42.207.254.1935 > 10.8.2.2.40916: Flags [.], ack 33728, win 126, options [nop,nop,TS val 3045302785 ecr 2865539142], length 0
04:25:33.363585 IP 10.8.2.2.40916 > 185.42.207.254.1935: Flags [.], seq 43726:45040, ack 0, win 501, options [nop,nop,TS val 2865539542 ecr 3045302785], length 1314
04:25:33.385134 IP 10.8.2.2.40916 > 185.42.207.254.1935: Flags [.], seq 45040:46354, ack 0, win 501, options [nop,nop,TS val 2865539563 ecr 3045302785], length 1314
04:25:33.398710 IP 185.42.207.254.1935 > 10.8.2.2.40916: Flags [.], ack 36356, win 126, options [nop,nop,TS val 3045302821 ecr 2865539208], length 0
04:25:33.427901 IP 10.8.2.2.40916 > 185.42.207.254.1935: Flags [.], seq 46354:47668, ack 0, win 501, options [nop,nop,TS val 2865539606 ecr 3045302821], length 1314
04:25:33.491562 IP 10.8.2.2.40916 > 185.42.207.254.1935: Flags [.], seq 47668:48982, ack 0, win 501, options [nop,nop,TS val 2865539670 ecr 3045302821], length 1314
04:25:33.501117 IP 185.42.207.254.1935 > 10.8.2.2.40916: Flags [.], ack 38984, win 126, options [nop,nop,TS val 3045302923 ecr 2865539278], length 0
04:25:33.516591 IP 185.42.207.254.1935 > 10.8.2.2.40916: Flags [.], ack 39784, win 126, options [nop,nop,TS val 3045302939 ecr 2865539360], length 0
04:25:33.516611 IP 10.8.2.2.40916 > 185.42.207.254.1935: Flags [P.], seq 48982:49858, ack 0, win 501, options [nop,nop,TS val 2865539695 ecr 3045302939], length 876
04:25:33.555214 IP 10.8.2.2.40916 > 185.42.207.254.1935: Flags [.], seq 49858:51172, ack 0, win 501, options [nop,nop,TS val 2865539733 ecr 3045302939], length 1314
04:25:33.590602 IP 185.42.207.254.1935 > 10.8.2.2.40916: Flags [.], ack 42412, win 126, options [nop,nop,TS val 3045303013 ecr 2865539412], length 0
04:25:33.598181 IP 10.8.2.2.40916 > 185.42.207.254.1935: Flags [.], seq 51172:52486, ack 0, win 501, options [nop,nop,TS val 2865539776 ecr 3045303013], length 1314
04:25:33.641184 IP 10.8.2.2.40916 > 185.42.207.254.1935: Flags [.], seq 52486:53800, ack 0, win 501, options [nop,nop,TS val 2865539819 ecr 3045303013], length 1314
04:25:33.683691 IP 10.8.2.2.40916 > 185.42.207.254.1935: Flags [.], seq 53800:55114, ack 0, win 501, options [nop,nop,TS val 2865539862 ecr 3045303013], length 1314
04:25:33.697699 IP 185.42.207.254.1935 > 10.8.2.2.40916: Flags [.], ack 45040, win 126, options [nop,nop,TS val 3045303120 ecr 2865539474], length 0
04:25:33.726208 IP 10.8.2.2.40916 > 185.42.207.254.1935: Flags [.], seq 55114:56428, ack 0, win 501, options [nop,nop,TS val 2865539904 ecr 3045303120], length 1314
04:25:33.761665 IP 185.42.207.254.1935 > 10.8.2.2.40916: Flags [.], ack 47668, win 126, options [nop,nop,TS val 3045303184 ecr 2865539563], length 0
04:25:33.769023 IP 10.8.2.2.40916 > 185.42.207.254.1935: Flags [.], seq 56428:57742, ack 0, win 501, options [nop,nop,TS val 2865539947 ecr 3045303184], length 1314
04:25:33.830928 IP 10.8.2.2.40916 > 185.42.207.254.1935: Flags [.], seq 57742:59056, ack 0, win 501, options [nop,nop,TS val 2865540009 ecr 3045303184], length 1314
04:25:33.849963 IP 185.42.207.254.1935 > 10.8.2.2.40916: Flags [.], ack 49858, win 126, options [nop,nop,TS val 3045303272 ecr 2865539670], length 0
04:25:33.849989 IP 10.8.2.2.40916 > 185.42.207.254.1935: Flags [P.], seq 59056:59763, ack 0, win 501, options [nop,nop,TS val 2865540028 ecr 3045303272], length 707
04:25:33.897259 IP 10.8.2.2.40916 > 185.42.207.254.1935: Flags [.], seq 59763:61077, ack 0, win 501, options [nop,nop,TS val 2865540075 ecr 3045303272], length 1314
04:25:33.918370 IP 10.8.2.2.40916 > 185.42.207.254.1935: Flags [.], seq 61077:62391, ack 0, win 501, options [nop,nop,TS val 2865540096 ecr 3045303272], length 1314
04:25:33.932133 IP 185.42.207.254.1935 > 10.8.2.2.40916: Flags [.], ack 52486, win 126, options [nop,nop,TS val 3045303354 ecr 2865539733], length 0
04:25:33.963244 IP 10.8.2.2.40916 > 185.42.207.254.1935: Flags [.], seq 62391:63705, ack 0, win 501, options [nop,nop,TS val 2865540141 ecr 3045303354], length 1314
04:25:34.017988 IP 185.42.207.254.1935 > 10.8.2.2.40916: Flags [.], ack 55114, win 126, options [nop,nop,TS val 3045303440 ecr 2865539819], length 0
04:25:34.025048 IP 10.8.2.2.40916 > 185.42.207.254.1935: Flags [.], seq 63705:65019, ack 0, win 501, options [nop,nop,TS val 2865540203 ecr 3045303440], length 1314
04:25:34.065660 IP 10.8.2.2.40916 > 185.42.207.254.1935: Flags [.], seq 65019:66333, ack 0, win 501, options [nop,nop,TS val 2865540244 ecr 3045303440], length 1314
04:25:34.099101 IP 10.8.2.2.40916 > 185.42.207.254.1935: Flags [.], seq 66333:67647, ack 0, win 501, options [nop,nop,TS val 2865540277 ecr 3045303440], length 1314
04:25:34.106202 IP 185.42.207.254.1935 > 10.8.2.2.40916: Flags [.], ack 57742, win 126, options [nop,nop,TS val 3045303527 ecr 2865539904], length 0
04:25:34.153510 IP 10.8.2.2.40916 > 185.42.207.254.1935: Flags [.], seq 67647:68961, ack 0, win 501, options [nop,nop,TS val 2865540331 ecr 3045303527], length 1314
04:25:34.183603 IP 185.42.207.254.1935 > 10.8.2.2.40916: Flags [.], ack 59763, win 126, options [nop,nop,TS val 3045303606 ecr 2865540009], length 0
04:25:34.183615 IP 10.8.2.2.40916 > 185.42.207.254.1935: Flags [P.], seq 68961:69749, ack 0, win 501, options [nop,nop,TS val 2865540362 ecr 3045303606], length 788
04:25:34.217132 IP 10.8.2.2.40916 > 185.42.207.254.1935: Flags [.], seq 69749:71063, ack 0, win 501, options [nop,nop,TS val 2865540395 ecr 3045303606], length 1314
04:25:34.252396 IP 185.42.207.254.1935 > 10.8.2.2.40916: Flags [.], ack 62391, win 126, options [nop,nop,TS val 3045303675 ecr 2865540075], length 0
04:25:34.259981 IP 10.8.2.2.40916 > 185.42.207.254.1935: Flags [.], seq 71063:72377, ack 0, win 501, options [nop,nop,TS val 2865540438 ecr 3045303675], length 1314
04:25:34.302928 IP 10.8.2.2.40916 > 185.42.207.254.1935: Flags [.], seq 72377:73691, ack 0, win 501, options [nop,nop,TS val 2865540481 ecr 3045303675], length 1314
04:25:34.358817 IP 185.42.207.254.1935 > 10.8.2.2.40916: Flags [.], ack 65019, win 126, options [nop,nop,TS val 3045303781 ecr 2865540141], length 0
04:25:34.364772 IP 10.8.2.2.40916 > 185.42.207.254.1935: Flags [.], seq 73691:75005, ack 0, win 501, options [nop,nop,TS val 2865540543 ecr 3045303781], length 1314
04:25:34.388032 IP 10.8.2.2.40916 > 185.42.207.254.1935: Flags [.], seq 75005:76319, ack 0, win 501, options [nop,nop,TS val 2865540566 ecr 3045303781], length 1314
04:25:34.433269 IP 185.42.207.254.1935 > 10.8.2.2.40916: Flags [.], ack 67647, win 126, options [nop,nop,TS val 3045303855 ecr 2865540244], length 0
04:25:34.434021 IP 10.8.2.2.40916 > 185.42.207.254.1935: Flags [.], seq 76319:77633, ack 0, win 501, options [nop,nop,TS val 2865540612 ecr 3045303855], length 1314
04:25:34.495481 IP 10.8.2.2.40916 > 185.42.207.254.1935: Flags [.], seq 77633:78947, ack 0, win 501, options [nop,nop,TS val 2865540673 ecr 3045303855], length 1314
04:25:34.516953 IP 10.8.2.2.40916 > 185.42.207.254.1935: Flags [.], seq 78947:80261, ack 0, win 501, options [nop,nop,TS val 2865540695 ecr 3045303855], length 1314
04:25:34.518638 IP 185.42.207.254.1935 > 10.8.2.2.40916: Flags [.], ack 69749, win 126, options [nop,nop,TS val 3045303939 ecr 2865540331], length 0
04:25:34.518674 IP 10.8.2.2.40916 > 185.42.207.254.1935: Flags [P.], seq 80261:80496, ack 0, win 501, options [nop,nop,TS val 2865540697 ecr 3045303939], length 235
04:25:34.593876 IP 185.42.207.254.1935 > 10.8.2.2.40916: Flags [.], ack 72377, win 126, options [nop,nop,TS val 3045304016 ecr 2865540395], length 0
04:25:34.600547 IP 10.8.2.2.40916 > 185.42.207.254.1935: Flags [.], seq 80496:81810, ack 0, win 501, options [nop,nop,TS val 2865540778 ecr 3045304016], length 1314
04:25:34.624727 IP 10.8.2.2.40916 > 185.42.207.254.1935: Flags [.], seq 81810:83124, ack 0, win 501, options [nop,nop,TS val 2865540803 ecr 3045304016], length 1314
04:25:34.667382 IP 10.8.2.2.40916 > 185.42.207.254.1935: Flags [.], seq 83124:84438, ack 0, win 501, options [nop,nop,TS val 2865540845 ecr 3045304016], length 1314
04:25:34.698739 IP 185.42.207.254.1935 > 10.8.2.2.40916: Flags [.], ack 75005, win 126, options [nop,nop,TS val 3045304121 ecr 2865540481], length 0
04:25:34.731783 IP 10.8.2.2.40916 > 185.42.207.254.1935: Flags [.], seq 84438:85752, ack 0, win 501, options [nop,nop,TS val 2865540910 ecr 3045304121], length 1314
04:25:34.753159 IP 10.8.2.2.40916 > 185.42.207.254.1935: Flags [.], seq 85752:87066, ack 0, win 501, options [nop,nop,TS val 2865540931 ecr 3045304121], length 1314
04:25:34.767681 IP 185.42.207.254.1935 > 10.8.2.2.40916: Flags [.], ack 77633, win 126, options [nop,nop,TS val 3045304190 ecr 2865540566], length 0
04:25:34.795994 IP 10.8.2.2.40916 > 185.42.207.254.1935: Flags [.], seq 87066:88380, ack 0, win 501, options [nop,nop,TS val 2865540974 ecr 3045304190], length 1314
04:25:34.850690 IP 185.42.207.254.1935 > 10.8.2.2.40916: Flags [.], ack 80261, win 126, options [nop,nop,TS val 3045304273 ecr 2865540673], length 0
04:25:34.852296 IP 185.42.207.254.1935 > 10.8.2.2.40916: Flags [.], ack 80496, win 126, options [nop,nop,TS val 3045304275 ecr 2865540697], length 0
04:25:34.852330 IP 10.8.2.2.40916 > 185.42.207.254.1935: Flags [P.], seq 88380:89644, ack 0, win 501, options [nop,nop,TS val 2865541030 ecr 3045304275], length 1264
04:25:34.900526 IP 10.8.2.2.40916 > 185.42.207.254.1935: Flags [.], seq 89644:90958, ack 0, win 501, options [nop,nop,TS val 2865541078 ecr 3045304275], length 1314
04:25:34.925098 IP 10.8.2.2.40916 > 185.42.207.254.1935: Flags [.], seq 90958:92272, ack 0, win 501, options [nop,nop,TS val 2865541103 ecr 3045304275], length 1314
04:25:34.958644 IP 185.42.207.254.1935 > 10.8.2.2.40916: Flags [.], ack 83124, win 126, options [nop,nop,TS val 3045304381 ecr 2865540778], length 0
04:25:34.967866 IP 10.8.2.2.40916 > 185.42.207.254.1935: Flags [.], seq 92272:93586, ack 0, win 501, options [nop,nop,TS val 2865541146 ecr 3045304381], length 1314
04:25:35.031120 IP 10.8.2.2.40916 > 185.42.207.254.1935: Flags [.], seq 93586:94900, ack 0, win 501, options [nop,nop,TS val 2865541209 ecr 3045304381], length 1314
04:25:35.052906 IP 10.8.2.2.40916 > 185.42.207.254.1935: Flags [.], seq 94900:96214, ack 0, win 501, options [nop,nop,TS val 2865541231 ecr 3045304381], length 1314
04:25:35.065623 IP 185.42.207.254.1935 > 10.8.2.2.40916: Flags [.], ack 85752, win 126, options [nop,nop,TS val 3045304488 ecr 2865540845], length 0
04:25:35.100139 IP 10.8.2.2.40916 > 185.42.207.254.1935: Flags [.], seq 96214:97528, ack 0, win 501, options [nop,nop,TS val 2865541278 ecr 3045304488], length 1314
04:25:35.130367 IP 185.42.207.254.1935 > 10.8.2.2.40916: Flags [.], ack 88380, win 126, options [nop,nop,TS val 3045304552 ecr 2865540931], length 0
04:25:35.159263 IP 10.8.2.2.40916 > 185.42.207.254.1935: Flags [.], seq 97528:98842, ack 0, win 501, options [nop,nop,TS val 2865541337 ecr 3045304552], length 1314
04:25:35.186001 IP 185.42.207.254.1935 > 10.8.2.2.40916: Flags [.], ack 89644, win 126, options [nop,nop,TS val 3045304608 ecr 2865541030], length 0
04:25:35.186022 IP 10.8.2.2.40916 > 185.42.207.254.1935: Flags [P.], seq 98842:99626, ack 0, win 501, options [nop,nop,TS val 2865541364 ecr 3045304608], length 784
04:25:35.223701 IP 10.8.2.2.40916 > 185.42.207.254.1935: Flags [.], seq 99626:100940, ack 0, win 501, options [nop,nop,TS val 2865541402 ecr 3045304608], length 1314
04:25:35.258891 IP 185.42.207.254.1935 > 10.8.2.2.40916: Flags [.], ack 92272, win 126, options [nop,nop,TS val 3045304681 ecr 2865541078], length 0
04:25:35.266622 IP 10.8.2.2.40916 > 185.42.207.254.1935: Flags [.], seq 100940:102254, ack 0, win 501, options [nop,nop,TS val 2865541445 ecr 3045304681], length 1314
04:25:35.309329 IP 10.8.2.2.40916 > 185.42.207.254.1935: Flags [.], seq 102254:103568, ack 0, win 501, options [nop,nop,TS val 2865541487 ecr 3045304681], length 1314
04:25:35.364736 IP 10.8.2.2.40916 > 185.42.207.254.1935: Flags [.], seq 103568:104882, ack 0, win 501, options [nop,nop,TS val 2865541543 ecr 3045304681], length 1314
04:25:35.365754 IP 185.42.207.254.1935 > 10.8.2.2.40916: Flags [.], ack 94900, win 126, options [nop,nop,TS val 3045304788 ecr 2865541146], length 0
04:25:35.394215 IP 10.8.2.2.40916 > 185.42.207.254.1935: Flags [.], seq 104882:106196, ack 0, win 501, options [nop,nop,TS val 2865541572 ecr 3045304788], length 1314
04:25:35.434435 IP 185.42.207.254.1935 > 10.8.2.2.40916: Flags [.], ack 97528, win 126, options [nop,nop,TS val 3045304857 ecr 2865541231], length 0
04:25:35.436754 IP 10.8.2.2.40916 > 185.42.207.254.1935: Flags [.], seq 106196:107510, ack 0, win 501, options [nop,nop,TS val 2865541615 ecr 3045304857], length 1314
04:25:35.500717 IP 10.8.2.2.40916 > 185.42.207.254.1935: Flags [.], seq 107510:108824, ack 0, win 501, options [nop,nop,TS val 2865541679 ecr 3045304857], length 1314
04:25:35.519690 IP 185.42.207.254.1935 > 10.8.2.2.40916: Flags [.], ack 99626, win 126, options [nop,nop,TS val 3045304942 ecr 2865541337], length 0
04:25:35.519720 IP 10.8.2.2.40916 > 185.42.207.254.1935: Flags [P.], seq 108824:109529, ack 0, win 501, options [nop,nop,TS val 2865541698 ecr 3045304942], length 705
04:25:35.564084 IP 10.8.2.2.40916 > 185.42.207.254.1935: Flags [.], seq 109529:110843, ack 0, win 501, options [nop,nop,TS val 2865541742 ecr 3045304942], length 1314
04:25:35.586301 IP 10.8.2.2.40916 > 185.42.207.254.1935: Flags [.], seq 110843:112157, ack 0, win 501, options [nop,nop,TS val 2865541764 ecr 3045304942], length 1314
04:25:35.600271 IP 185.42.207.254.1935 > 10.8.2.2.40916: Flags [.], ack 102254, win 126, options [nop,nop,TS val 3045305023 ecr 2865541402], length 0
04:25:35.632205 IP 10.8.2.2.40916 > 185.42.207.254.1935: Flags [.], seq 112157:113471, ack 0, win 501, options [nop,nop,TS val 2865541810 ecr 3045305023], length 1314
04:25:35.693362 IP 10.8.2.2.40916 > 185.42.207.254.1935: Flags [.], seq 113471:114785, ack 0, win 501, options [nop,nop,TS val 2865541871 ecr 3045305023], length 1314
04:25:35.698682 IP 185.42.207.254.1935 > 10.8.2.2.40916: Flags [.], ack 104882, win 126, options [nop,nop,TS val 3045305121 ecr 2865541487], length 0
04:25:35.730897 IP 10.8.2.2.40916 > 185.42.207.254.1935: Flags [.], seq 114785:116099, ack 0, win 501, options [nop,nop,TS val 2865541909 ecr 3045305121], length 1314
04:25:35.764044 IP 10.8.2.2.40916 > 185.42.207.254.1935: Flags [.], seq 116099:117413, ack 0, win 501, options [nop,nop,TS val 2865541942 ecr 3045305121], length 1314
04:25:35.770340 IP 185.42.207.254.1935 > 10.8.2.2.40916: Flags [.], ack 107510, win 126, options [nop,nop,TS val 3045305193 ecr 2865541572], length 0
04:25:35.820659 IP 10.8.2.2.40916 > 185.42.207.254.1935: Flags [.], seq 117413:118727, ack 0, win 501, options [nop,nop,TS val 2865541999 ecr 3045305193], length 1314
04:25:35.853229 IP 185.42.207.254.1935 > 10.8.2.2.40916: Flags [.], ack 109529, win 126, options [nop,nop,TS val 3045305275 ecr 2865541679], length 0
04:25:35.853248 IP 10.8.2.2.40916 > 185.42.207.254.1935: Flags [P.], seq 118727:119513, ack 0, win 501, options [nop,nop,TS val 2865542031 ecr 3045305275], length 786
04:25:35.899446 IP 10.8.2.2.40916 > 185.42.207.254.1935: Flags [.], seq 119513:120827, ack 0, win 501, options [nop,nop,TS val 2865542077 ecr 3045305275], length 1314
04:25:35.920320 IP 185.42.207.254.1935 > 10.8.2.2.40916: Flags [.], ack 112157, win 126, options [nop,nop,TS val 3045305343 ecr 2865541742], length 0
04:25:35.927497 IP 10.8.2.2.40916 > 185.42.207.254.1935: Flags [.], seq 120827:122141, ack 0, win 501, options [nop,nop,TS val 2865542105 ecr 3045305343], length 1314
04:25:35.970279 IP 10.8.2.2.40916 > 185.42.207.254.1935: Flags [.], seq 122141:123455, ack 0, win 501, options [nop,nop,TS val 2865542148 ecr 3045305343], length 1314
04:25:36.032709 IP 10.8.2.2.40916 > 185.42.207.254.1935: Flags [.], seq 123455:124769, ack 0, win 501, options [nop,nop,TS val 2865542211 ecr 3045305343], length 1314
04:25:36.039571 IP 185.42.207.254.1935 > 10.8.2.2.40916: Flags [.], ack 113471, win 126, options [nop,nop,TS val 3045305461 ecr 2865541810], length 0
04:25:36.055833 IP 10.8.2.2.40916 > 185.42.207.254.1935: Flags [.], seq 124769:126083, ack 0, win 501, options [nop,nop,TS val 2865542234 ecr 3045305461], length 1314
04:25:36.064938 IP 185.42.207.254.1935 > 10.8.2.2.40916: Flags [.], ack 113471, win 126, options [nop,nop,TS val 3045305487 ecr 2865541810,nop,nop,sack 1 {114785:116099}], length 0
04:25:36.098302 IP 185.42.207.254.1935 > 10.8.2.2.40916: Flags [.], ack 113471, win 126, options [nop,nop,TS val 3045305520 ecr 2865541810,nop,nop,sack 1 {114785:117413}], length 0
04:25:36.099039 IP 10.8.2.2.40916 > 185.42.207.254.1935: Flags [.], seq 126083:127397, ack 0, win 501, options [nop,nop,TS val 2865542277 ecr 3045305520], length 1314
04:25:36.126127 IP 10.8.2.2.40916 > 185.42.207.254.1935: Flags [.], seq 113471:114785, ack 0, win 501, options [nop,nop,TS val 2865542304 ecr 3045305520], length 1314
04:25:36.154465 IP 185.42.207.254.1935 > 10.8.2.2.40916: Flags [.], ack 113471, win 126, options [nop,nop,TS val 3045305577 ecr 2865541810,nop,nop,sack 1 {114785:118727}], length 0
04:25:36.162677 IP 10.8.2.2.40916 > 185.42.207.254.1935: Flags [.], seq 127397:128711, ack 0, win 501, options [nop,nop,TS val 2865542341 ecr 3045305577], length 1314
04:25:36.188044 IP 185.42.207.254.1935 > 10.8.2.2.40916: Flags [.], ack 113471, win 126, options [nop,nop,TS val 3045305609 ecr 2865541810,nop,nop,sack 1 {114785:119513}], length 0
04:25:36.200882 IP 10.8.2.2.40916 > 185.42.207.254.1935: Flags [.], seq 128711:130025, ack 0, win 501, options [nop,nop,TS val 2865542379 ecr 3045305609], length 1314
04:25:36.234015 IP 185.42.207.254.1935 > 10.8.2.2.40916: Flags [.], ack 113471, win 126, options [nop,nop,TS val 3045305655 ecr 2865541810,nop,nop,sack 1 {114785:120827}], length 0
04:25:36.234038 IP 10.8.2.2.40916 > 185.42.207.254.1935: Flags [.], seq 130025:131339, ack 0, win 501, options [nop,nop,TS val 2865542412 ecr 3045305655], length 1314
04:25:36.262040 IP 185.42.207.254.1935 > 10.8.2.2.40916: Flags [.], ack 113471, win 126, options [nop,nop,TS val 3045305683 ecr 2865541810,nop,nop,sack 1 {114785:122141}], length 0
04:25:36.290889 IP 10.8.2.2.40916 > 185.42.207.254.1935: Flags [.], seq 131339:132653, ack 0, win 501, options [nop,nop,TS val 2865542469 ecr 3045305683], length 1314
04:25:36.305034 IP 185.42.207.254.1935 > 10.8.2.2.40916: Flags [.], ack 113471, win 126, options [nop,nop,TS val 3045305726 ecr 2865541810,nop,nop,sack 1 {114785:123455}], length 0
04:25:36.329698 IP 10.8.2.2.40916 > 185.42.207.254.1935: Flags [.], seq 132653:133967, ack 0, win 501, options [nop,nop,TS val 2865542508 ecr 3045305726], length 1314
04:25:36.368478 IP 185.42.207.254.1935 > 10.8.2.2.40916: Flags [.], ack 113471, win 126, options [nop,nop,TS val 3045305790 ecr 2865541810,nop,nop,sack 1 {114785:124769}], length 0
04:25:36.368496 IP 10.8.2.2.40916 > 185.42.207.254.1935: Flags [.], seq 133967:135281, ack 0, win 501, options [nop,nop,TS val 2865542546 ecr 3045305790], length 1314
04:25:36.390815 IP 185.42.207.254.1935 > 10.8.2.2.40916: Flags [.], ack 113471, win 126, options [nop,nop,TS val 3045305812 ecr 2865541810,nop,nop,sack 1 {114785:126083}], length 0
04:25:36.433777 IP 10.8.2.2.40916 > 185.42.207.254.1935: Flags [.], seq 135281:136595, ack 0, win 501, options [nop,nop,TS val 2865542612 ecr 3045305812], length 1314
04:25:36.433798 IP 185.42.207.254.1935 > 10.8.2.2.40916: Flags [.], ack 113471, win 126, options [nop,nop,TS val 3045305855 ecr 2865541810,nop,nop,sack 1 {114785:127397}], length 0
04:25:36.460488 IP 185.42.207.254.1935 > 10.8.2.2.40916: Flags [.], ack 127397, win 106, options [nop,nop,TS val 3045305882 ecr 2865542304], length 0
04:25:36.460530 IP 10.8.2.2.40916 > 185.42.207.254.1935: Flags [P.], seq 136595:137431, ack 0, win 501, options [nop,nop,TS val 2865542638 ecr 3045305882], length 836
04:25:36.496295 IP 185.42.207.254.1935 > 10.8.2.2.40916: Flags [.], ack 128711, win 131, options [nop,nop,TS val 3045305919 ecr 2865542341], length 0
04:25:36.498908 IP 10.8.2.2.40916 > 185.42.207.254.1935: Flags [.], seq 137431:138745, ack 0, win 501, options [nop,nop,TS val 2865542677 ecr 3045305919], length 1314
04:25:36.525489 IP 10.8.2.2.40916 > 185.42.207.254.1935: Flags [.], seq 138745:140059, ack 0, win 501, options [nop,nop,TS val 2865542703 ecr 3045305919], length 1314
04:25:36.534847 IP 185.42.207.254.1935 > 10.8.2.2.40916: Flags [.], ack 130025, win 137, options [nop,nop,TS val 3045305957 ecr 2865542379], length 0
04:25:36.567874 IP 185.42.207.254.1935 > 10.8.2.2.40916: Flags [.], ack 131339, win 143, options [nop,nop,TS val 3045305990 ecr 2865542412], length 0
04:25:36.568159 IP 10.8.2.2.40916 > 185.42.207.254.1935: Flags [.], seq 140059:141373, ack 0, win 501, options [nop,nop,TS val 2865542746 ecr 3045305990], length 1314
04:25:36.624666 IP 185.42.207.254.1935 > 10.8.2.2.40916: Flags [.], ack 132653, win 148, options [nop,nop,TS val 3045306047 ecr 2865542469], length 0
04:25:36.632237 IP 10.8.2.2.40916 > 185.42.207.254.1935: Flags [.], seq 141373:142687, ack 0, win 501, options [nop,nop,TS val 2865542810 ecr 3045306047], length 1314
04:25:36.653884 IP 10.8.2.2.40916 > 185.42.207.254.1935: Flags [.], seq 142687:144001, ack 0, win 501, options [nop,nop,TS val 2865542832 ecr 3045306047], length 1314
04:25:36.663762 IP 185.42.207.254.1935 > 10.8.2.2.40916: Flags [.], ack 133967, win 154, options [nop,nop,TS val 3045306086 ecr 2865542508], length 0
04:25:36.700545 IP 10.8.2.2.40916 > 185.42.207.254.1935: Flags [.], seq 144001:145315, ack 0, win 501, options [nop,nop,TS val 2865542878 ecr 3045306086], length 1314
04:25:36.702418 IP 185.42.207.254.1935 > 10.8.2.2.40916: Flags [.], ack 135281, win 160, options [nop,nop,TS val 3045306124 ecr 2865542546], length 0
04:25:36.760664 IP 10.8.2.2.40916 > 185.42.207.254.1935: Flags [.], seq 145315:146629, ack 0, win 501, options [nop,nop,TS val 2865542939 ecr 3045306124], length 1314
04:25:36.767452 IP 185.42.207.254.1935 > 10.8.2.2.40916: Flags [.], ack 136595, win 165, options [nop,nop,TS val 3045306190 ecr 2865542612], length 0
04:25:36.794003 IP 185.42.207.254.1935 > 10.8.2.2.40916: Flags [.], ack 137431, win 170, options [nop,nop,TS val 3045306216 ecr 2865542638], length 0
04:25:36.794027 IP 10.8.2.2.40916 > 185.42.207.254.1935: Flags [P.], seq 146629:147413, ack 0, win 501, options [nop,nop,TS val 2865542972 ecr 3045306216], length 784
04:25:36.824462 IP 10.8.2.2.40916 > 185.42.207.254.1935: Flags [.], seq 147413:148727, ack 0, win 501, options [nop,nop,TS val 2865543002 ecr 3045306216], length 1314
04:25:36.832519 IP 185.42.207.254.1935 > 10.8.2.2.40916: Flags [.], ack 138745, win 176, options [nop,nop,TS val 3045306255 ecr 2865542677], length 0
04:25:36.859144 IP 185.42.207.254.1935 > 10.8.2.2.40916: Flags [.], ack 140059, win 182, options [nop,nop,TS val 3045306281 ecr 2865542703], length 0
04:25:36.866056 IP 10.8.2.2.40916 > 185.42.207.254.1935: Flags [.], seq 148727:150041, ack 0, win 501, options [nop,nop,TS val 2865543044 ecr 3045306281], length 1314
04:25:36.902021 IP 185.42.207.254.1935 > 10.8.2.2.40916: Flags [.], ack 141373, win 184, options [nop,nop,TS val 3045306324 ecr 2865542746], length 0
04:25:36.909999 IP 10.8.2.2.40916 > 185.42.207.254.1935: Flags [.], seq 150041:151355, ack 0, win 501, options [nop,nop,TS val 2865543088 ecr 3045306324], length 1314
04:25:36.963539 IP 10.8.2.2.40916 > 185.42.207.254.1935: Flags [.], seq 151355:152669, ack 0, win 501, options [nop,nop,TS val 2865543141 ecr 3045306324], length 1314
04:25:36.987463 IP 185.42.207.254.1935 > 10.8.2.2.40916: Flags [.], ack 144001, win 184, options [nop,nop,TS val 3045306410 ecr 2865542810], length 0
04:25:36.994793 IP 10.8.2.2.40916 > 185.42.207.254.1935: Flags [.], seq 152669:153983, ack 0, win 501, options [nop,nop,TS val 2865543173 ecr 3045306410], length 1314
04:25:37.037388 IP 10.8.2.2.40916 > 185.42.207.254.1935: Flags [.], seq 153983:155297, ack 0, win 501, options [nop,nop,TS val 2865543215 ecr 3045306410], length 1314
04:25:37.094561 IP 185.42.207.254.1935 > 10.8.2.2.40916: Flags [.], ack 144001, win 184, options [nop,nop,TS val 3045306517 ecr 2865542810,nop,nop,sack 1 {145315:146629}], length 0
04:25:37.100762 IP 10.8.2.2.40916 > 185.42.207.254.1935: Flags [.], seq 155297:156611, ack 0, win 501, options [nop,nop,TS val 2865543279 ecr 3045306517], length 1314
04:25:37.122738 IP 10.8.2.2.40916 > 185.42.207.254.1935: Flags [.], seq 156611:157925, ack 0, win 501, options [nop,nop,TS val 2865543301 ecr 3045306517], length 1314
04:25:37.127418 IP 185.42.207.254.1935 > 10.8.2.2.40916: Flags [.], ack 144001, win 184, options [nop,nop,TS val 3045306550 ecr 2865542810,nop,nop,sack 1 {145315:147413}], length 0
04:25:37.127439 IP 10.8.2.2.40916 > 185.42.207.254.1935: Flags [.], seq 144001:145315, ack 0, win 501, options [nop,nop,TS val 2865543305 ecr 3045306550], length 1314
04:25:37.158463 IP 185.42.207.254.1935 > 10.8.2.2.40916: Flags [.], ack 144001, win 184, options [nop,nop,TS val 3045306580 ecr 2865542810,nop,nop,sack 1 {145315:148727}], length 0
04:25:37.165151 IP 10.8.2.2.40916 > 185.42.207.254.1935: Flags [.], seq 157925:159239, ack 0, win 501, options [nop,nop,TS val 2865543343 ecr 3045306580], length 1314
04:25:37.199867 IP 185.42.207.254.1935 > 10.8.2.2.40916: Flags [.], ack 144001, win 184, options [nop,nop,TS val 3045306622 ecr 2865542810,nop,nop,sack 1 {145315:150041}], length 0
04:25:37.229340 IP 10.8.2.2.40916 > 185.42.207.254.1935: Flags [.], seq 159239:160553, ack 0, win 501, options [nop,nop,TS val 2865543407 ecr 3045306622], length 1314
04:25:37.244882 IP 185.42.207.254.1935 > 10.8.2.2.40916: Flags [.], ack 144001, win 184, options [nop,nop,TS val 3045306666 ecr 2865542810,nop,nop,sack 1 {145315:151355}], length 0
04:25:37.267508 IP 10.8.2.2.40916 > 185.42.207.254.1935: Flags [.], seq 160553:161867, ack 0, win 501, options [nop,nop,TS val 2865543445 ecr 3045306666], length 1314
04:25:37.298296 IP 185.42.207.254.1935 > 10.8.2.2.40916: Flags [.], ack 144001, win 184, options [nop,nop,TS val 3045306719 ecr 2865542810,nop,nop,sack 1 {145315:152669}], length 0
04:25:37.298324 IP 10.8.2.2.40916 > 185.42.207.254.1935: Flags [.], seq 161867:163181, ack 0, win 501, options [nop,nop,TS val 2865543476 ecr 3045306719], length 1314
04:25:37.372319 IP 185.42.207.254.1935 > 10.8.2.2.40916: Flags [.], ack 144001, win 184, options [nop,nop,TS val 3045306793 ecr 2865542810,nop,nop,sack 1 {145315:155297}], length 0
04:25:37.372366 IP 10.8.2.2.40916 > 185.42.207.254.1935: Flags [.], seq 163181:164495, ack 0, win 501, options [nop,nop,TS val 2865543550 ecr 3045306793], length 1314
04:25:37.396462 IP 10.8.2.2.40916 > 185.42.207.254.1935: Flags [.], seq 164495:165809, ack 0, win 501, options [nop,nop,TS val 2865543574 ecr 3045306793], length 1314
04:25:37.435640 IP 185.42.207.254.1935 > 10.8.2.2.40916: Flags [.], ack 144001, win 184, options [nop,nop,TS val 3045306857 ecr 2865542810,nop,nop,sack 1 {145315:156611}], length 0
04:25:37.435660 IP 10.8.2.2.40916 > 185.42.207.254.1935: Flags [.], seq 165809:167123, ack 0, win 501, options [nop,nop,TS val 2865543614 ecr 3045306857], length 1314
04:25:37.457451 IP 185.42.207.254.1935 > 10.8.2.2.40916: Flags [.], ack 144001, win 184, options [nop,nop,TS val 3045306879 ecr 2865542810,nop,nop,sack 1 {145315:157925}], length 0
04:25:37.460904 IP 185.42.207.254.1935 > 10.8.2.2.40916: Flags [.], ack 157925, win 164, options [nop,nop,TS val 3045306883 ecr 2865543305], length 0
04:25:37.460931 IP 10.8.2.2.40916 > 185.42.207.254.1935: Flags [P.], seq 167123:167299, ack 0, win 501, options [nop,nop,TS val 2865543639 ecr 3045306883], length 176
04:25:37.496186 IP 10.8.2.2.40916 > 185.42.207.254.1935: Flags [.], seq 167299:168613, ack 0, win 501, options [nop,nop,TS val 2865543674 ecr 3045306883], length 1314
04:25:37.527737 IP 10.8.2.2.40916 > 185.42.207.254.1935: Flags [.], seq 168613:169927, ack 0, win 501, options [nop,nop,TS val 2865543706 ecr 3045306883], length 1314
04:25:37.559382 IP 185.42.207.254.1935 > 10.8.2.2.40916: Flags [.], ack 159239, win 186, options [nop,nop,TS val 3045306981 ecr 2865543343], length 0
04:25:37.570492 IP 10.8.2.2.40916 > 185.42.207.254.1935: Flags [.], seq 169927:171241, ack 0, win 501, options [nop,nop,TS val 2865543748 ecr 3045306981], length 1314
04:25:37.601181 IP 185.42.207.254.1935 > 10.8.2.2.40916: Flags [.], ack 161867, win 186, options [nop,nop,TS val 3045307023 ecr 2865543407], length 0
04:25:37.634123 IP 10.8.2.2.40916 > 185.42.207.254.1935: Flags [.], seq 171241:172555, ack 0, win 501, options [nop,nop,TS val 2865543812 ecr 3045307023], length 1314
04:25:37.656366 IP 10.8.2.2.40916 > 185.42.207.254.1935: Flags [.], seq 172555:173869, ack 0, win 501, options [nop,nop,TS val 2865543834 ecr 3045307023], length 1314
04:25:37.699204 IP 10.8.2.2.40916 > 185.42.207.254.1935: Flags [.], seq 173869:175183, ack 0, win 501, options [nop,nop,TS val 2865543877 ecr 3045307023], length 1314
04:25:37.705895 IP 185.42.207.254.1935 > 10.8.2.2.40916: Flags [.], ack 164495, win 184, options [nop,nop,TS val 3045307128 ecr 2865543476], length 0
04:25:37.763652 IP 10.8.2.2.40916 > 185.42.207.254.1935: Flags [.], seq 175183:176497, ack 0, win 501, options [nop,nop,TS val 2865543942 ecr 3045307128], length 1314
04:25:37.769112 IP 185.42.207.254.1935 > 10.8.2.2.40916: Flags [.], ack 167123, win 184, options [nop,nop,TS val 3045307191 ecr 2865543574], length 0
04:25:37.794320 IP 185.42.207.254.1935 > 10.8.2.2.40916: Flags [.], ack 167299, win 186, options [nop,nop,TS val 3045307216 ecr 2865543639], length 0
04:25:37.794361 IP 10.8.2.2.40916 > 185.42.207.254.1935: Flags [P.], seq 176497:177299, ack 0, win 501, options [nop,nop,TS val 2865543972 ecr 3045307216], length 802
04:25:37.827925 IP 10.8.2.2.40916 > 185.42.207.254.1935: Flags [.], seq 177299:178613, ack 0, win 501, options [nop,nop,TS val 2865544006 ecr 3045307216], length 1314
04:25:37.861510 IP 185.42.207.254.1935 > 10.8.2.2.40916: Flags [.], ack 169927, win 186, options [nop,nop,TS val 3045307284 ecr 2865543674], length 0
04:25:37.865679 IP 10.8.2.2.40916 > 185.42.207.254.1935: Flags [.], seq 178613:179927, ack 0, win 501, options [nop,nop,TS val 2865544044 ecr 3045307284], length 1314
04:25:37.913308 IP 10.8.2.2.40916 > 185.42.207.254.1935: Flags [.], seq 179927:181241, ack 0, win 501, options [nop,nop,TS val 2865544091 ecr 3045307284], length 1314
04:25:37.956048 IP 10.8.2.2.40916 > 185.42.207.254.1935: Flags [.], seq 181241:182555, ack 0, win 501, options [nop,nop,TS val 2865544134 ecr 3045307284], length 1314
04:25:37.968035 IP 185.42.207.254.1935 > 10.8.2.2.40916: Flags [.], ack 172555, win 184, options [nop,nop,TS val 3045307390 ecr 2865543748], length 0
04:25:37.998921 IP 10.8.2.2.40916 > 185.42.207.254.1935: Flags [.], seq 182555:183869, ack 0, win 501, options [nop,nop,TS val 2865544177 ecr 3045307390], length 1314
04:25:38.033112 IP 185.42.207.254.1935 > 10.8.2.2.40916: Flags [.], ack 175183, win 184, options [nop,nop,TS val 3045307455 ecr 2865543834], length 0
04:25:38.041960 IP 10.8.2.2.40916 > 185.42.207.254.1935: Flags [.], seq 183869:185183, ack 0, win 501, options [nop,nop,TS val 2865544220 ecr 3045307455], length 1314
04:25:38.098164 IP 10.8.2.2.40916 > 185.42.207.254.1935: Flags [.], seq 185183:186497, ack 0, win 501, options [nop,nop,TS val 2865544276 ecr 3045307455], length 1314
04:25:38.127556 IP 10.8.2.2.40916 > 185.42.207.254.1935: Flags [.], seq 186497:187811, ack 0, win 501, options [nop,nop,TS val 2865544306 ecr 3045307455], length 1314
04:25:38.170271 IP 10.8.2.2.40916 > 185.42.207.254.1935: Flags [.], seq 187811:189125, ack 0, win 501, options [nop,nop,TS val 2865544348 ecr 3045307455], length 1314
04:25:38.199503 IP 185.42.207.254.1935 > 10.8.2.2.40916: Flags [.], ack 179927, win 184, options [nop,nop,TS val 3045307622 ecr 2865544006], length 0
04:25:38.199534 IP 10.8.2.2.40916 > 185.42.207.254.1935: Flags [P.], seq 189125:190018, ack 0, win 501, options [nop,nop,TS val 2865544377 ecr 3045307622], length 893
04:25:38.255946 IP 10.8.2.2.40916 > 185.42.207.254.1935: Flags [.], seq 190018:191332, ack 0, win 501, options [nop,nop,TS val 2865544434 ecr 3045307622], length 1314
04:25:38.289929 IP 185.42.207.254.1935 > 10.8.2.2.40916: Flags [.], ack 182555, win 184, options [nop,nop,TS val 3045307712 ecr 2865544091], length 0
04:25:38.298749 IP 10.8.2.2.40916 > 185.42.207.254.1935: Flags [.], seq 191332:192646, ack 0, win 501, options [nop,nop,TS val 2865544477 ecr 3045307712], length 1314
04:25:38.329782 IP 10.8.2.2.40916 > 185.42.207.254.1935: Flags [.], seq 192646:193960, ack 0, win 501, options [nop,nop,TS val 2865544508 ecr 3045307712], length 1314
04:25:38.375764 IP 185.42.207.254.1935 > 10.8.2.2.40916: Flags [.], ack 185183, win 184, options [nop,nop,TS val 3045307798 ecr 2865544177], length 0
04:25:38.400455 IP 10.8.2.2.40916 > 185.42.207.254.1935: Flags [.], seq 193960:195274, ack 0, win 501, options [nop,nop,TS val 2865544578 ecr 3045307798], length 1314
04:25:38.426703 IP 10.8.2.2.40916 > 185.42.207.254.1935: Flags [.], seq 195274:196588, ack 0, win 501, options [nop,nop,TS val 2865544605 ecr 3045307798], length 1314
04:25:38.461165 IP 185.42.207.254.1935 > 10.8.2.2.40916: Flags [.], ack 187811, win 184, options [nop,nop,TS val 3045307883 ecr 2865544276], length 0
