12:32:30.703183 IP 45.113.129.153.1935 > 10.8.0.4.59952: Flags [.], ack 2486041397, win 126, options [nop,nop,TS val 1264929279 ecr 974872373], length 0
12:32:30.703205 IP 10.8.0.4.59952 > 45.113.129.153.1935: Flags [P.], seq 1315:1981, ack 0, win 501, options [nop,nop,TS val 974872476 ecr 1264929279], length 666
12:32:30.738670 IP 10.8.0.4.59952 > 45.113.129.153.1935: Flags [.], seq 1981:3295, ack 0, win 501, options [nop,nop,TS val 974872511 ecr 1264929279], length 1314
12:32:30.770748 IP 10.8.0.4.59952 > 45.113.129.153.1935: Flags [.], seq 3295:4609, ack 0, win 501, options [nop,nop,TS val 974872543 ecr 1264929279], length 1314
12:32:30.782114 IP 45.113.129.153.1935 > 10.8.0.4.59952: Flags [.], ack 1981, win 126, options [nop,nop,TS val 1264929358 ecr 974872447], length 0
12:32:30.782169 IP 10.8.0.4.59952 > 45.113.129.153.1935: Flags [P.], seq 4609:4905, ack 0, win 501, options [nop,nop,TS val 974872555 ecr 1264929358], length 296
12:32:30.835155 IP 10.8.0.4.59952 > 45.113.129.153.1935: Flags [.], seq 4905:6219, ack 0, win 501, options [nop,nop,TS val 974872608 ecr 1264929358], length 1314
12:32:30.850703 IP 45.113.129.153.1935 > 10.8.0.4.59952: Flags [.], ack 4609, win 126, options [nop,nop,TS val 1264929427 ecr 974872511], length 0
12:32:30.861461 IP 45.113.129.153.1935 > 10.8.0.4.59952: Flags [.], ack 4905, win 126, options [nop,nop,TS val 1264929437 ecr 974872555], length 0
12:32:30.861495 IP 10.8.0.4.59952 > 45.113.129.153.1935: Flags [P.], seq 6219:6981, ack 0, win 501, options [nop,nop,TS val 974872634 ecr 1264929437], length 762
12:32:30.899403 IP 10.8.0.4.59952 > 45.113.129.153.1935: Flags [.], seq 6981:8295, ack 0, win 501, options [nop,nop,TS val 974872672 ecr 1264929437], length 1314
12:32:30.940576 IP 45.113.129.153.1935 > 10.8.0.4.59952: Flags [.], ack 6981, win 126, options [nop,nop,TS val 1264929517 ecr 974872608], length 0
12:32:30.940623 IP 10.8.0.4.59952 > 45.113.129.153.1935: Flags [P.], seq 8295:8962, ack 0, win 501, options [nop,nop,TS val 974872713 ecr 1264929517], length 667
12:32:30.975368 IP 10.8.0.4.59952 > 45.113.129.153.1935: Flags [.], seq 8962:10276, ack 0, win 501, options [nop,nop,TS val 974872748 ecr 1264929517], length 1314
12:32:31.006875 IP 10.8.0.4.59952 > 45.113.129.153.1935: Flags [.], seq 10276:11590, ack 0, win 501, options [nop,nop,TS val 974872780 ecr 1264929517], length 1314
12:32:31.022097 IP 45.113.129.153.1935 > 10.8.0.4.59952: Flags [.], ack 8962, win 126, options [nop,nop,TS val 1264929596 ecr 974872672], length 0
12:32:31.022132 IP 10.8.0.4.59952 > 45.113.129.153.1935: Flags [P.], seq 11590:11885, ack 0, win 501, options [nop,nop,TS val 974872795 ecr 1264929596], length 295
12:32:31.071227 IP 10.8.0.4.59952 > 45.113.129.153.1935: Flags [.], seq 11885:13199, ack 0, win 501, options [nop,nop,TS val 974872844 ecr 1264929596], length 1314
12:32:31.100285 IP 45.113.129.153.1935 > 10.8.0.4.59952: Flags [.], ack 11590, win 126, options [nop,nop,TS val 1264929666 ecr 974872748], length 0
12:32:31.108594 IP 10.8.0.4.59952 > 45.113.129.153.1935: Flags [.], seq 13199:14513, ack 0, win 501, options [nop,nop,TS val 974872881 ecr 1264929666], length 1314
12:32:31.109703 IP 45.113.129.153.1935 > 10.8.0.4.59952: Flags [.], ack 11885, win 126, options [nop,nop,TS val 1264929686 ecr 974872795], length 0
12:32:31.109732 IP 10.8.0.4.59952 > 45.113.129.153.1935: Flags [P.], seq 14513:14809, ack 0, win 501, options [nop,nop,TS val 974872882 ecr 1264929686], length 296
12:32:31.174354 IP 10.8.0.4.59952 > 45.113.129.153.1935: Flags [.], seq 14809:16123, ack 0, win 501, options [nop,nop,TS val 974872947 ecr 1264929686], length 1314
12:32:31.187798 IP 45.113.129.153.1935 > 10.8.0.4.59952: Flags [.], ack 14513, win 126, options [nop,nop,TS val 1264929764 ecr 974872844], length 0
12:32:31.188926 IP 45.113.129.153.1935 > 10.8.0.4.59952: Flags [.], ack 14809, win 126, options [nop,nop,TS val 1264929765 ecr 974872882], length 0
12:32:31.188939 IP 10.8.0.4.59952 > 45.113.129.153.1935: Flags [P.], seq 16123:16884, ack 0, win 501, options [nop,nop,TS val 974872962 ecr 1264929765], length 761
12:32:31.238358 IP 10.8.0.4.59952 > 45.113.129.153.1935: Flags [.], seq 16884:18198, ack 0, win 501, options [nop,nop,TS val 974873011 ecr 1264929765], length 1314
12:32:31.269256 IP 45.113.129.153.1935 > 10.8.0.4.59952: Flags [.], ack 16884, win 126, options [nop,nop,TS val 1264929844 ecr 974872947], length 0
12:32:31.269276 IP 10.8.0.4.59952 > 45.113.129.153.1935: Flags [P.], seq 18198:18952, ack 0, win 501, options [nop,nop,TS val 974873042 ecr 1264929844], length 754
12:32:31.305230 IP 10.8.0.4.59952 > 45.113.129.153.1935: Flags [.], seq 18952:20266, ack 0, win 501, options [nop,nop,TS val 974873078 ecr 1264929844], length 1314
12:32:31.338719 IP 10.8.0.4.59952 > 45.113.129.153.1935: Flags [.], seq 20266:21580, ack 0, win 501, options [nop,nop,TS val 974873111 ecr 1264929844], length 1314
12:32:31.348383 IP 45.113.129.153.1935 > 10.8.0.4.59952: Flags [.], ack 18952, win 126, options [nop,nop,TS val 1264929924 ecr 974873011], length 0
12:32:31.348395 IP 10.8.0.4.59952 > 45.113.129.153.1935: Flags [P.], seq 21580:21872, ack 0, win 501, options [nop,nop,TS val 974873121 ecr 1264929924], length 292
12:32:31.405445 IP 10.8.0.4.59952 > 45.113.129.153.1935: Flags [.], seq 21872:23186, ack 0, win 501, options [nop,nop,TS val 974873178 ecr 1264929924], length 1314
12:32:31.417649 IP 45.113.129.153.1935 > 10.8.0.4.59952: Flags [.], ack 21580, win 126, options [nop,nop,TS val 1264929994 ecr 974873078], length 0
12:32:31.427880 IP 45.113.129.153.1935 > 10.8.0.4.59952: Flags [.], ack 21872, win 126, options [nop,nop,TS val 1264930003 ecr 974873121], length 0
12:32:31.427900 IP 10.8.0.4.59952 > 45.113.129.153.1935: Flags [P.], seq 23186:23849, ack 0, win 501, options [nop,nop,TS val 974873201 ecr 1264930003], length 663
12:32:31.475266 IP 10.8.0.4.59952 > 45.113.129.153.1935: Flags [.], seq 23849:25163, ack 0, win 501, options [nop,nop,TS val 974873248 ecr 1264930003], length 1314
12:32:31.507193 IP 45.113.129.153.1935 > 10.8.0.4.59952: Flags [.], ack 23849, win 126, options [nop,nop,TS val 1264930083 ecr 974873178], length 0
12:32:31.507247 IP 10.8.0.4.59952 > 45.113.129.153.1935: Flags [P.], seq 25163:25920, ack 0, win 501, options [nop,nop,TS val 974873280 ecr 1264930083], length 757
12:32:31.539998 IP 10.8.0.4.59952 > 45.113.129.153.1935: Flags [.], seq 25920:27234, ack 0, win 501, options [nop,nop,TS val 974873313 ecr 1264930083], length 1314
12:32:31.575340 IP 10.8.0.4.59952 > 45.113.129.153.1935: Flags [.], seq 27234:28548, ack 0, win 501, options [nop,nop,TS val 974873348 ecr 1264930083], length 1314
12:32:31.587111 IP 45.113.129.153.1935 > 10.8.0.4.59952: Flags [.], ack 25920, win 126, options [nop,nop,TS val 1264930162 ecr 974873248], length 0
12:32:31.587152 IP 10.8.0.4.59952 > 45.113.129.153.1935: Flags [P.], seq 28548:28843, ack 0, win 501, options [nop,nop,TS val 974873360 ecr 1264930162], length 295
12:32:31.642507 IP 10.8.0.4.59952 > 45.113.129.153.1935: Flags [.], seq 28843:30157, ack 0, win 501, options [nop,nop,TS val 974873415 ecr 1264930162], length 1314
12:32:31.654607 IP 45.113.129.153.1935 > 10.8.0.4.59952: Flags [.], ack 28548, win 126, options [nop,nop,TS val 1264930231 ecr 974873313], length 0
12:32:31.667502 IP 45.113.129.153.1935 > 10.8.0.4.59952: Flags [.], ack 28843, win 126, options [nop,nop,TS val 1264930244 ecr 974873360], length 0
12:32:31.667536 IP 10.8.0.4.59952 > 45.113.129.153.1935: Flags [P.], seq 30157:30824, ack 0, win 501, options [nop,nop,TS val 974873440 ecr 1264930244], length 667
12:32:31.709270 IP 10.8.0.4.59952 > 45.113.129.153.1935: Flags [.], seq 30824:32138, ack 0, win 501, options [nop,nop,TS val 974873482 ecr 1264930244], length 1314
12:32:31.742798 IP 10.8.0.4.59952 > 45.113.129.153.1935: Flags [.], seq 32138:33452, ack 0, win 501, options [nop,nop,TS val 974873515 ecr 1264930244], length 1314
12:32:31.746638 IP 45.113.129.153.1935 > 10.8.0.4.59952: Flags [.], ack 30824, win 126, options [nop,nop,TS val 1264930323 ecr 974873415], length 0
12:32:31.746684 IP 10.8.0.4.59952 > 45.113.129.153.1935: Flags [P.], seq 33452:33748, ack 0, win 501, options [nop,nop,TS val 974873519 ecr 1264930323], length 296
12:32:31.807753 IP 10.8.0.4.59952 > 45.113.129.153.1935: Flags [.], seq 33748:35062, ack 0, win 501, options [nop,nop,TS val 974873580 ecr 1264930323], length 1314
12:32:31.823678 IP 45.113.129.153.1935 > 10.8.0.4.59952: Flags [.], ack 33452, win 126, options [nop,nop,TS val 1264930398 ecr 974873482], length 0
12:32:31.825651 IP 45.113.129.153.1935 > 10.8.0.4.59952: Flags [.], ack 33748, win 126, options [nop,nop,TS val 1264930402 ecr 974873519], length 0
12:32:31.825677 IP 10.8.0.4.59952 > 45.113.129.153.1935: Flags [P.], seq 35062:35824, ack 0, win 501, options [nop,nop,TS val 974873598 ecr 1264930402], length 762
12:32:31.874913 IP 10.8.0.4.59952 > 45.113.129.153.1935: Flags [.], seq 35824:37138, ack 0, win 501, options [nop,nop,TS val 974873648 ecr 1264930402], length 1314
12:32:31.904521 IP 10.8.0.4.59952 > 45.113.129.153.1935: Flags [.], seq 37138:38452, ack 0, win 501, options [nop,nop,TS val 974873677 ecr 1264930402], length 1314
12:32:31.904854 IP 45.113.129.153.1935 > 10.8.0.4.59952: Flags [.], ack 35824, win 126, options [nop,nop,TS val 1264930481 ecr 974873580], length 0
12:32:31.904876 IP 10.8.0.4.59952 > 45.113.129.153.1935: Flags [P.], seq 38452:38653, ack 0, win 501, options [nop,nop,TS val 974873678 ecr 1264930481], length 201
12:32:31.968232 IP 10.8.0.4.59952 > 45.113.129.153.1935: Flags [.], seq 38653:39967, ack 0, win 501, options [nop,nop,TS val 974873741 ecr 1264930481], length 1314
12:32:31.984896 IP 45.113.129.153.1935 > 10.8.0.4.59952: Flags [.], ack 38452, win 126, options [nop,nop,TS val 1264930560 ecr 974873648], length 0
12:32:31.985715 IP 45.113.129.153.1935 > 10.8.0.4.59952: Flags [.], ack 38653, win 126, options [nop,nop,TS val 1264930560 ecr 974873678], length 0
12:32:31.985749 IP 10.8.0.4.59952 > 45.113.129.153.1935: Flags [P.], seq 39967:40728, ack 0, win 501, options [nop,nop,TS val 974873758 ecr 1264930560], length 761
12:32:32.038665 IP 10.8.0.4.59952 > 45.113.129.153.1935: Flags [.], seq 40728:42042, ack 0, win 501, options [nop,nop,TS val 974873811 ecr 1264930560], length 1314
12:32:32.067087 IP 45.113.129.153.1935 > 10.8.0.4.59952: Flags [.], ack 40728, win 126, options [nop,nop,TS val 1264930642 ecr 974873741], length 0
12:32:32.067102 IP 10.8.0.4.59952 > 45.113.129.153.1935: Flags [P.], seq 42042:42801, ack 0, win 501, options [nop,nop,TS val 974873840 ecr 1264930642], length 759
12:32:32.106930 IP 10.8.0.4.59952 > 45.113.129.153.1935: Flags [.], seq 42801:44115, ack 0, win 501, options [nop,nop,TS val 974873880 ecr 1264930642], length 1314
12:32:32.139357 IP 10.8.0.4.59952 > 45.113.129.153.1935: Flags [.], seq 44115:45429, ack 0, win 501, options [nop,nop,TS val 974873912 ecr 1264930642], length 1314
12:32:32.146079 IP 45.113.129.153.1935 > 10.8.0.4.59952: Flags [.], ack 42801, win 126, options [nop,nop,TS val 1264930722 ecr 974873811], length 0
12:32:32.146131 IP 10.8.0.4.59952 > 45.113.129.153.1935: Flags [P.], seq 45429:45720, ack 0, win 501, options [nop,nop,TS val 974873919 ecr 1264930722], length 291
12:32:32.203600 IP 10.8.0.4.59952 > 45.113.129.153.1935: Flags [.], seq 45720:47034, ack 0, win 501, options [nop,nop,TS val 974873976 ecr 1264930722], length 1314
12:32:32.218743 IP 45.113.129.153.1935 > 10.8.0.4.59952: Flags [.], ack 45429, win 126, options [nop,nop,TS val 1264930795 ecr 974873880], length 0
12:32:32.225011 IP 45.113.129.153.1935 > 10.8.0.4.59952: Flags [.], ack 45720, win 126, options [nop,nop,TS val 1264930801 ecr 974873919], length 0
12:32:32.225034 IP 10.8.0.4.59952 > 45.113.129.153.1935: Flags [P.], seq 47034:47788, ack 0, win 501, options [nop,nop,TS val 974873998 ecr 1264930801], length 754
12:32:32.275097 IP 10.8.0.4.59952 > 45.113.129.153.1935: Flags [.], seq 47788:49102, ack 0, win 501, options [nop,nop,TS val 974874048 ecr 1264930801], length 1314
12:32:32.304174 IP 45.113.129.153.1935 > 10.8.0.4.59952: Flags [.], ack 47788, win 126, options [nop,nop,TS val 1264930880 ecr 974873976], length 0
12:32:32.304221 IP 10.8.0.4.59952 > 45.113.129.153.1935: Flags [P.], seq 49102:49768, ack 0, win 501, options [nop,nop,TS val 974874077 ecr 1264930880], length 666
12:32:32.339036 IP 10.8.0.4.59952 > 45.113.129.153.1935: Flags [.], seq 49768:51082, ack 0, win 501, options [nop,nop,TS val 974874112 ecr 1264930880], length 1314
12:32:32.374299 IP 10.8.0.4.59952 > 45.113.129.153.1935: Flags [.], seq 51082:52396, ack 0, win 501, options [nop,nop,TS val 974874147 ecr 1264930880], length 1314
12:32:32.383500 IP 45.113.129.153.1935 > 10.8.0.4.59952: Flags [.], ack 49768, win 126, options [nop,nop,TS val 1264930959 ecr 974874048], length 0
12:32:32.383534 IP 10.8.0.4.59952 > 45.113.129.153.1935: Flags [P.], seq 52396:52692, ack 0, win 501, options [nop,nop,TS val 974874156 ecr 1264930959], length 296
12:32:32.438427 IP 10.8.0.4.59952 > 45.113.129.153.1935: Flags [.], seq 52692:54006, ack 0, win 501, options [nop,nop,TS val 974874211 ecr 1264930959], length 1314
12:32:32.453493 IP 45.113.129.153.1935 > 10.8.0.4.59952: Flags [.], ack 52396, win 126, options [nop,nop,TS val 1264931029 ecr 974874112], length 0
12:32:32.462672 IP 45.113.129.153.1935 > 10.8.0.4.59952: Flags [.], ack 52692, win 126, options [nop,nop,TS val 1264931038 ecr 974874156], length 0
12:32:32.462684 IP 10.8.0.4.59952 > 45.113.129.153.1935: Flags [P.], seq 54006:54768, ack 0, win 501, options [nop,nop,TS val 974874235 ecr 1264931038], length 762
12:32:32.502210 IP 10.8.0.4.59952 > 45.113.129.153.1935: Flags [.], seq 54768:56082, ack 0, win 501, options [nop,nop,TS val 974874275 ecr 1264931038], length 1314
12:32:32.541942 IP 45.113.129.153.1935 > 10.8.0.4.59952: Flags [.], ack 54768, win 126, options [nop,nop,TS val 1264931118 ecr 974874211], length 0
12:32:32.541985 IP 10.8.0.4.59952 > 45.113.129.153.1935: Flags [P.], seq 56082:56749, ack 0, win 501, options [nop,nop,TS val 974874315 ecr 1264931118], length 667
12:32:32.576686 IP 10.8.0.4.59952 > 45.113.129.153.1935: Flags [.], seq 56749:58063, ack 0, win 501, options [nop,nop,TS val 974874349 ecr 1264931118], length 1314
12:32:32.608282 IP 10.8.0.4.59952 > 45.113.129.153.1935: Flags [.], seq 58063:59377, ack 0, win 501, options [nop,nop,TS val 974874381 ecr 1264931118], length 1314
12:32:32.621600 IP 45.113.129.153.1935 > 10.8.0.4.59952: Flags [.], ack 56749, win 126, options [nop,nop,TS val 1264931198 ecr 974874275], length 0
12:32:32.621619 IP 10.8.0.4.59952 > 45.113.129.153.1935: Flags [P.], seq 59377:59672, ack 0, win 501, options [nop,nop,TS val 974874394 ecr 1264931198], length 295
12:32:32.673420 IP 10.8.0.4.59952 > 45.113.129.153.1935: Flags [.], seq 59672:60986, ack 0, win 501, options [nop,nop,TS val 974874446 ecr 1264931198], length 1314
12:32:32.687345 IP 45.113.129.153.1935 > 10.8.0.4.59952: Flags [.], ack 59377, win 126, options [nop,nop,TS val 1264931263 ecr 974874349], length 0
12:32:32.700655 IP 45.113.129.153.1935 > 10.8.0.4.59952: Flags [.], ack 59672, win 126, options [nop,nop,TS val 1264931277 ecr 974874394], length 0
12:32:32.700661 IP 10.8.0.4.59952 > 45.113.129.153.1935: Flags [P.], seq 60986:61748, ack 0, win 501, options [nop,nop,TS val 974874473 ecr 1264931277], length 762
12:32:32.736998 IP 10.8.0.4.59952 > 45.113.129.153.1935: Flags [.], seq 61748:63062, ack 0, win 501, options [nop,nop,TS val 974874510 ecr 1264931277], length 1314
12:32:32.773747 IP 10.8.0.4.59952 > 45.113.129.153.1935: Flags [.], seq 63062:64376, ack 0, win 501, options [nop,nop,TS val 974874546 ecr 1264931277], length 1314
12:32:32.779573 IP 45.113.129.153.1935 > 10.8.0.4.59952: Flags [.], ack 61748, win 126, options [nop,nop,TS val 1264931356 ecr 974874446], length 0
12:32:32.779609 IP 10.8.0.4.59952 > 45.113.129.153.1935: Flags [P.], seq 64376:64576, ack 0, win 501, options [nop,nop,TS val 974874552 ecr 1264931356], length 200
12:32:32.841696 IP 10.8.0.4.59952 > 45.113.129.153.1935: Flags [.], seq 64576:65890, ack 0, win 501, options [nop,nop,TS val 974874614 ecr 1264931356], length 1314
12:32:32.852915 IP 45.113.129.153.1935 > 10.8.0.4.59952: Flags [.], ack 64376, win 126, options [nop,nop,TS val 1264931429 ecr 974874510], length 0
12:32:32.858472 IP 45.113.129.153.1935 > 10.8.0.4.59952: Flags [.], ack 64576, win 126, options [nop,nop,TS val 1264931435 ecr 974874552], length 0
12:32:32.858497 IP 10.8.0.4.59952 > 45.113.129.153.1935: Flags [P.], seq 65890:66648, ack 0, win 501, options [nop,nop,TS val 974874631 ecr 1264931435], length 758
12:32:32.907989 IP 10.8.0.4.59952 > 45.113.129.153.1935: Flags [.], seq 66648:67962, ack 0, win 501, options [nop,nop,TS val 974874681 ecr 1264931435], length 1314
12:32:32.937305 IP 45.113.129.153.1935 > 10.8.0.4.59952: Flags [.], ack 66648, win 126, options [nop,nop,TS val 1264931513 ecr 974874614], length 0
12:32:32.937347 IP 10.8.0.4.59952 > 45.113.129.153.1935: Flags [P.], seq 67962:68716, ack 0, win 501, options [nop,nop,TS val 974874710 ecr 1264931513], length 754
12:32:32.971479 IP 10.8.0.4.59952 > 45.113.129.153.1935: Flags [.], seq 68716:70030, ack 0, win 501, options [nop,nop,TS val 974874744 ecr 1264931513], length 1314
12:32:33.005051 IP 10.8.0.4.59952 > 45.113.129.153.1935: Flags [.], seq 70030:71344, ack 0, win 501, options [nop,nop,TS val 974874778 ecr 1264931513], length 1314
12:32:33.022035 IP 45.113.129.153.1935 > 10.8.0.4.59952: Flags [.], ack 68716, win 126, options [nop,nop,TS val 1264931593 ecr 974874681], length 0
12:32:33.022052 IP 10.8.0.4.59952 > 45.113.129.153.1935: Flags [P.], seq 71344:71636, ack 0, win 501, options [nop,nop,TS val 974874795 ecr 1264931593], length 292
12:32:33.075117 IP 10.8.0.4.59952 > 45.113.129.153.1935: Flags [.], seq 71636:72950, ack 0, win 501, options [nop,nop,TS val 974874848 ecr 1264931593], length 1314
12:32:33.084144 IP 45.113.129.153.1935 > 10.8.0.4.59952: Flags [.], ack 71344, win 126, options [nop,nop,TS val 1264931660 ecr 974874744], length 0
12:32:33.101560 IP 45.113.129.153.1935 > 10.8.0.4.59952: Flags [.], ack 71636, win 126, options [nop,nop,TS val 1264931677 ecr 974874795], length 0
12:32:33.101588 IP 10.8.0.4.59952 > 45.113.129.153.1935: Flags [P.], seq 72950:73707, ack 0, win 501, options [nop,nop,TS val 974874874 ecr 1264931677], length 757
12:32:33.141736 IP 10.8.0.4.59952 > 45.113.129.153.1935: Flags [.], seq 73707:75021, ack 0, win 501, options [nop,nop,TS val 974874914 ecr 1264931677], length 1314
12:32:33.175006 IP 10.8.0.4.59952 > 45.113.129.153.1935: Flags [.], seq 75021:76335, ack 0, win 501, options [nop,nop,TS val 974874948 ecr 1264931677], length 1314
12:32:33.180669 IP 45.113.129.153.1935 > 10.8.0.4.59952: Flags [.], ack 73707, win 126, options [nop,nop,TS val 1264931757 ecr 974874848], length 0
12:32:33.180699 IP 10.8.0.4.59952 > 45.113.129.153.1935: Flags [P.], seq 76335:76535, ack 0, win 501, options [nop,nop,TS val 974874953 ecr 1264931757], length 200
12:32:33.242306 IP 10.8.0.4.59952 > 45.113.129.153.1935: Flags [.], seq 76535:77849, ack 0, win 501, options [nop,nop,TS val 974875015 ecr 1264931757], length 1314
12:32:33.253952 IP 45.113.129.153.1935 > 10.8.0.4.59952: Flags [.], ack 76335, win 126, options [nop,nop,TS val 1264931830 ecr 974874914], length 0
12:32:33.263784 IP 45.113.129.153.1935 > 10.8.0.4.59952: Flags [.], ack 76535, win 126, options [nop,nop,TS val 1264931836 ecr 974874953], length 0
12:32:33.263818 IP 10.8.0.4.59952 > 45.113.129.153.1935: Flags [P.], seq 77849:78611, ack 0, win 501, options [nop,nop,TS val 974875037 ecr 1264931836], length 762
12:32:33.305984 IP 10.8.0.4.59952 > 45.113.129.153.1935: Flags [.], seq 78611:79925, ack 0, win 501, options [nop,nop,TS val 974875079 ecr 1264931836], length 1314
12:32:33.339772 IP 10.8.0.4.59952 > 45.113.129.153.1935: Flags [.], seq 79925:81239, ack 0, win 501, options [nop,nop,TS val 974875112 ecr 1264931836], length 1314
12:32:33.347184 IP 45.113.129.153.1935 > 10.8.0.4.59952: Flags [.], ack 78611, win 126, options [nop,nop,TS val 1264931923 ecr 974875015], length 0
12:32:33.347196 IP 10.8.0.4.59952 > 45.113.129.153.1935: Flags [P.], seq 81239:81535, ack 0, win 501, options [nop,nop,TS val 974875120 ecr 1264931923], length 296
12:32:33.406682 IP 10.8.0.4.59952 > 45.113.129.153.1935: Flags [.], seq 81535:82849, ack 0, win 501, options [nop,nop,TS val 974875179 ecr 1264931923], length 1314
12:32:33.419105 IP 45.113.129.153.1935 > 10.8.0.4.59952: Flags [.], ack 81239, win 126, options [nop,nop,TS val 1264931995 ecr 974875079], length 0
12:32:33.426091 IP 45.113.129.153.1935 > 10.8.0.4.59952: Flags [.], ack 81535, win 126, options [nop,nop,TS val 1264932002 ecr 974875120], length 0
12:32:33.426117 IP 10.8.0.4.59952 > 45.113.129.153.1935: Flags [P.], seq 82849:83611, ack 0, win 501, options [nop,nop,TS val 974875199 ecr 1264932002], length 762
12:32:33.476635 IP 10.8.0.4.59952 > 45.113.129.153.1935: Flags [.], seq 83611:84925, ack 0, win 501, options [nop,nop,TS val 974875249 ecr 1264932002], length 1314
12:32:33.505158 IP 45.113.129.153.1935 > 10.8.0.4.59952: Flags [.], ack 83611, win 126, options [nop,nop,TS val 1264932081 ecr 974875179], length 0
12:32:33.505201 IP 10.8.0.4.59952 > 45.113.129.153.1935: Flags [P.], seq 84925:85591, ack 0, win 501, options [nop,nop,TS val 974875278 ecr 1264932081], length 666
12:32:33.540837 IP 10.8.0.4.59952 > 45.113.129.153.1935: Flags [.], seq 85591:86905, ack 0, win 501, options [nop,nop,TS val 974875314 ecr 1264932081], length 1314
12:32:33.570920 IP 10.8.0.4.59952 > 45.113.129.153.1935: Flags [.], seq 86905:88219, ack 0, win 501, options [nop,nop,TS val 974875344 ecr 1264932081], length 1314
12:32:33.583956 IP 45.113.129.153.1935 > 10.8.0.4.59952: Flags [.], ack 85591, win 126, options [nop,nop,TS val 1264932160 ecr 974875249], length 0
12:32:33.583987 IP 10.8.0.4.59952 > 45.113.129.153.1935: Flags [P.], seq 88219:88514, ack 0, win 501, options [nop,nop,TS val 974875357 ecr 1264932160], length 295
12:32:33.638280 IP 10.8.0.4.59952 > 45.113.129.153.1935: Flags [.], seq 88514:89828, ack 0, win 501, options [nop,nop,TS val 974875411 ecr 1264932160], length 1314
12:32:33.654109 IP 45.113.129.153.1935 > 10.8.0.4.59952: Flags [.], ack 88219, win 126, options [nop,nop,TS val 1264932226 ecr 974875314], length 0
12:32:33.662895 IP 45.113.129.153.1935 > 10.8.0.4.59952: Flags [.], ack 88514, win 126, options [nop,nop,TS val 1264932239 ecr 974875357], length 0
12:32:33.662902 IP 10.8.0.4.59952 > 45.113.129.153.1935: Flags [P.], seq 89828:90587, ack 0, win 501, options [nop,nop,TS val 974875436 ecr 1264932239], length 759
12:32:33.707510 IP 10.8.0.4.59952 > 45.113.129.153.1935: Flags [.], seq 90587:91901, ack 0, win 501, options [nop,nop,TS val 974875480 ecr 1264932239], length 1314
12:32:33.741448 IP 10.8.0.4.59952 > 45.113.129.153.1935: Flags [.], seq 91901:93215, ack 0, win 501, options [nop,nop,TS val 974875514 ecr 1264932239], length 1314
12:32:33.741500 IP 45.113.129.153.1935 > 10.8.0.4.59952: Flags [.], ack 90587, win 126, options [nop,nop,TS val 1264932318 ecr 974875411], length 0
12:32:33.741537 IP 10.8.0.4.59952 > 45.113.129.153.1935: Flags [P.], seq 93215:93411, ack 0, win 501, options [nop,nop,TS val 974875514 ecr 1264932318], length 196
12:32:33.805805 IP 10.8.0.4.59952 > 45.113.129.153.1935: Flags [.], seq 93411:94725, ack 0, win 501, options [nop,nop,TS val 974875578 ecr 1264932318], length 1314
12:32:33.821948 IP 45.113.129.153.1935 > 10.8.0.4.59952: Flags [.], ack 93215, win 126, options [nop,nop,TS val 1264932397 ecr 974875480], length 0
12:32:33.821968 IP 45.113.129.153.1935 > 10.8.0.4.59952: Flags [.], ack 93411, win 126, options [nop,nop,TS val 1264932397 ecr 974875514], length 0
12:32:33.821978 IP 10.8.0.4.59952 > 45.113.129.153.1935: Flags [P.], seq 94725:95483, ack 0, win 501, options [nop,nop,TS val 974875595 ecr 1264932397], length 758
12:32:33.873140 IP 10.8.0.4.59952 > 45.113.129.153.1935: Flags [.], seq 95483:96797, ack 0, win 501, options [nop,nop,TS val 974875646 ecr 1264932397], length 1314
12:32:33.900847 IP 45.113.129.153.1935 > 10.8.0.4.59952: Flags [.], ack 95483, win 126, options [nop,nop,TS val 1264932477 ecr 974875578], length 0
12:32:33.900885 IP 10.8.0.4.59952 > 45.113.129.153.1935: Flags [P.], seq 96797:97554, ack 0, win 501, options [nop,nop,TS val 974875674 ecr 1264932477], length 757
12:32:33.942340 IP 10.8.0.4.59952 > 45.113.129.153.1935: Flags [.], seq 97554:98868, ack 0, win 501, options [nop,nop,TS val 974875715 ecr 1264932477], length 1314
12:32:33.975985 IP 10.8.0.4.59952 > 45.113.129.153.1935: Flags [.], seq 98868:100182, ack 0, win 501, options [nop,nop,TS val 974875749 ecr 1264932477], length 1314
12:32:33.980723 IP 45.113.129.153.1935 > 10.8.0.4.59952: Flags [.], ack 97554, win 126, options [nop,nop,TS val 1264932556 ecr 974875646], length 0
12:32:33.980758 IP 10.8.0.4.59952 > 45.113.129.153.1935: Flags [P.], seq 100182:100479, ack 0, win 501, options [nop,nop,TS val 974875753 ecr 1264932556], length 297
12:32:34.038338 IP 10.8.0.4.59952 > 45.113.129.153.1935: Flags [.], seq 100479:101793, ack 0, win 501, options [nop,nop,TS val 974875811 ecr 1264932556], length 1314
12:32:34.055521 IP 45.113.129.153.1935 > 10.8.0.4.59952: Flags [.], ack 100182, win 126, options [nop,nop,TS val 1264932632 ecr 974875715], length 0
12:32:34.059679 IP 45.113.129.153.1935 > 10.8.0.4.59952: Flags [.], ack 100479, win 126, options [nop,nop,TS val 1264932636 ecr 974875753], length 0
12:32:34.059689 IP 10.8.0.4.59952 > 45.113.129.153.1935: Flags [P.], seq 101793:102460, ack 0, win 501, options [nop,nop,TS val 974875832 ecr 1264932636], length 667
12:32:34.104855 IP 10.8.0.4.59952 > 45.113.129.153.1935: Flags [.], seq 102460:103774, ack 0, win 501, options [nop,nop,TS val 974875878 ecr 1264932636], length 1314
12:32:34.138742 IP 45.113.129.153.1935 > 10.8.0.4.59952: Flags [.], ack 102460, win 126, options [nop,nop,TS val 1264932715 ecr 974875811], length 0
12:32:34.138794 IP 10.8.0.4.59952 > 45.113.129.153.1935: Flags [P.], seq 103774:104536, ack 0, win 501, options [nop,nop,TS val 974875911 ecr 1264932715], length 762
12:32:34.175774 IP 10.8.0.4.59952 > 45.113.129.153.1935: Flags [.], seq 104536:105850, ack 0, win 501, options [nop,nop,TS val 974875948 ecr 1264932715], length 1314
12:32:34.207591 IP 10.8.0.4.59952 > 45.113.129.153.1935: Flags [.], seq 105850:107164, ack 0, win 501, options [nop,nop,TS val 974875980 ecr 1264932715], length 1314
12:32:34.218311 IP 45.113.129.153.1935 > 10.8.0.4.59952: Flags [.], ack 104536, win 126, options [nop,nop,TS val 1264932794 ecr 974875878], length 0
12:32:34.218338 IP 10.8.0.4.59952 > 45.113.129.153.1935: Flags [P.], seq 107164:107459, ack 0, win 501, options [nop,nop,TS val 974875991 ecr 1264932794], length 295
12:32:34.274271 IP 10.8.0.4.59952 > 45.113.129.153.1935: Flags [.], seq 107459:108773, ack 0, win 501, options [nop,nop,TS val 974876047 ecr 1264932794], length 1314
12:32:34.286323 IP 45.113.129.153.1935 > 10.8.0.4.59952: Flags [.], ack 107164, win 126, options [nop,nop,TS val 1264932863 ecr 974875948], length 0
12:32:34.297310 IP 45.113.129.153.1935 > 10.8.0.4.59952: Flags [.], ack 107459, win 126, options [nop,nop,TS val 1264932873 ecr 974875991], length 0
12:32:34.297335 IP 10.8.0.4.59952 > 45.113.129.153.1935: Flags [P.], seq 108773:109439, ack 0, win 501, options [nop,nop,TS val 974876070 ecr 1264932873], length 666
12:32:34.340360 IP 10.8.0.4.59952 > 45.113.129.153.1935: Flags [.], seq 109439:110753, ack 0, win 501, options [nop,nop,TS val 974876113 ecr 1264932873], length 1314
12:32:34.375925 IP 10.8.0.4.59952 > 45.113.129.153.1935: Flags [.], seq 110753:112067, ack 0, win 501, options [nop,nop,TS val 974876149 ecr 1264932873], length 1314
12:32:34.377931 IP 45.113.129.153.1935 > 10.8.0.4.59952: Flags [.], ack 109439, win 126, options [nop,nop,TS val 1264932952 ecr 974876047], length 0
12:32:34.377965 IP 10.8.0.4.59952 > 45.113.129.153.1935: Flags [P.], seq 112067:112363, ack 0, win 501, options [nop,nop,TS val 974876151 ecr 1264932952], length 296
12:32:34.438359 IP 10.8.0.4.59952 > 45.113.129.153.1935: Flags [.], seq 112363:113677, ack 0, win 501, options [nop,nop,TS val 974876211 ecr 1264932952], length 1314
12:32:34.462695 IP 45.113.129.153.1935 > 10.8.0.4.59952: Flags [.], ack 112067, win 126, options [nop,nop,TS val 1264933031 ecr 974876113], length 0
12:32:34.463708 IP 45.113.129.153.1935 > 10.8.0.4.59952: Flags [.], ack 112363, win 126, options [nop,nop,TS val 1264933033 ecr 974876151], length 0
12:32:34.463717 IP 10.8.0.4.59952 > 45.113.129.153.1935: Flags [P.], seq 113677:114435, ack 0, win 501, options [nop,nop,TS val 974876236 ecr 1264933033], length 758
12:32:34.506746 IP 10.8.0.4.59952 > 45.113.129.153.1935: Flags [.], seq 114435:115749, ack 0, win 501, options [nop,nop,TS val 974876279 ecr 1264933033], length 1314
12:32:34.542216 IP 10.8.0.4.59952 > 45.113.129.153.1935: Flags [.], seq 115749:117063, ack 0, win 501, options [nop,nop,TS val 974876315 ecr 1264933033], length 1314
12:32:34.545282 IP 45.113.129.153.1935 > 10.8.0.4.59952: Flags [.], ack 114435, win 126, options [nop,nop,TS val 1264933119 ecr 974876211], length 0
12:32:34.545324 IP 10.8.0.4.59952 > 45.113.129.153.1935: Flags [P.], seq 117063:117350, ack 0, win 501, options [nop,nop,TS val 974876318 ecr 1264933119], length 287
12:32:34.609196 IP 10.8.0.4.59952 > 45.113.129.153.1935: Flags [.], seq 117350:118664, ack 0, win 501, options [nop,nop,TS val 974876382 ecr 1264933119], length 1314
12:32:34.621922 IP 45.113.129.153.1935 > 10.8.0.4.59952: Flags [.], ack 117063, win 126, options [nop,nop,TS val 1264933197 ecr 974876279], length 0
12:32:34.624080 IP 45.113.129.153.1935 > 10.8.0.4.59952: Flags [.], ack 117350, win 126, options [nop,nop,TS val 1264933200 ecr 974876318], length 0
12:32:34.624112 IP 10.8.0.4.59952 > 45.113.129.153.1935: Flags [P.], seq 118664:119423, ack 0, win 501, options [nop,nop,TS val 974876397 ecr 1264933200], length 759
12:32:34.675755 IP 10.8.0.4.59952 > 45.113.129.153.1935: Flags [.], seq 119423:120737, ack 0, win 501, options [nop,nop,TS val 974876448 ecr 1264933200], length 1314
12:32:34.703206 IP 45.113.129.153.1935 > 10.8.0.4.59952: Flags [.], ack 119423, win 126, options [nop,nop,TS val 1264933279 ecr 974876382], length 0
12:32:34.703246 IP 10.8.0.4.59952 > 45.113.129.153.1935: Flags [P.], seq 120737:121399, ack 0, win 501, options [nop,nop,TS val 974876476 ecr 1264933279], length 662
12:32:34.739353 IP 10.8.0.4.59952 > 45.113.129.153.1935: Flags [.], seq 121399:122713, ack 0, win 501, options [nop,nop,TS val 974876512 ecr 1264933279], length 1314
12:32:34.772778 IP 10.8.0.4.59952 > 45.113.129.153.1935: Flags [.], seq 122713:124027, ack 0, win 501, options [nop,nop,TS val 974876545 ecr 1264933279], length 1314
12:32:34.811369 IP 10.8.0.4.59952 > 45.113.129.153.1935: Flags [.], seq 124027:125341, ack 0, win 501, options [nop,nop,TS val 974876584 ecr 1264933279], length 1314
12:32:34.875895 IP 10.8.0.4.59952 > 45.113.129.153.1935: Flags [.], seq 125341:126655, ack 0, win 501, options [nop,nop,TS val 974876649 ecr 1264933279], length 1314
12:32:34.909141 IP 10.8.0.4.59952 > 45.113.129.153.1935: Flags [.], seq 126655:127969, ack 0, win 501, options [nop,nop,TS val 974876682 ecr 1264933279], length 1314
12:32:34.942429 IP 10.8.0.4.59952 > 45.113.129.153.1935: Flags [.], seq 127969:129283, ack 0, win 501, options [nop,nop,TS val 974876715 ecr 1264933279], length 1314
12:32:34.986248 IP 10.8.0.4.59952 > 45.113.129.153.1935: Flags [P.], seq 129283:130359, ack 0, win 501, options [nop,nop,TS val 974876759 ecr 1264933279], length 1076
12:32:35.038897 IP 10.8.0.4.59952 > 45.113.129.153.1935: Flags [.], seq 130359:131673, ack 0, win 501, options [nop,nop,TS val 974876812 ecr 1264933279], length 1314
12:32:35.258183 IP 10.8.0.4.59952 > 45.113.129.153.1935: Flags [.], seq 119423:120737, ack 0, win 501, options [nop,nop,TS val 974877031 ecr 1264933279], length 1314
12:32:35.870246 IP 10.8.0.4.59952 > 45.113.129.153.1935: Flags [.], seq 119423:120737, ack 0, win 501, options [nop,nop,TS val 974877643 ecr 1264933279], length 1314
12:32:36.747821 IP 45.113.129.153.1935 > 10.8.0.4.59952: Flags [.], ack 121399, win 126, options [nop,nop,TS val 1264933358 ecr 974876448], length 0
12:32:36.747857 IP 10.8.0.4.59952 > 45.113.129.153.1935: Flags [.], seq 131673:132987, ack 0, win 501, options [nop,nop,TS val 974878521 ecr 1264933358], length 1314
12:32:36.747859 IP 10.8.0.4.59952 > 45.113.129.153.1935: Flags [P.], seq 132987:134301, ack 0, win 501, options [nop,nop,TS val 974878521 ecr 1264933358], length 1314
12:32:36.747868 IP 10.8.0.4.59952 > 45.113.129.153.1935: Flags [.], seq 134301:135615, ack 0, win 501, options [nop,nop,TS val 974878521 ecr 1264933358], length 1314
12:32:36.747870 IP 10.8.0.4.59952 > 45.113.129.153.1935: Flags [P.], seq 135615:136929, ack 0, win 501, options [nop,nop,TS val 974878521 ecr 1264933358], length 1314
12:32:36.794284 IP 45.113.129.153.1935 > 10.8.0.4.59952: Flags [.], ack 122713, win 126, options [nop,nop,TS val 1264935370 ecr 974876512], length 0
12:32:36.794324 IP 10.8.0.4.59952 > 45.113.129.153.1935: Flags [.], seq 136929:138243, ack 0, win 501, options [nop,nop,TS val 974878567 ecr 1264935370], length 1314
12:32:36.794326 IP 10.8.0.4.59952 > 45.113.129.153.1935: Flags [P.], seq 138243:139557, ack 0, win 501, options [nop,nop,TS val 974878567 ecr 1264935370], length 1314
12:32:36.794350 IP 45.113.129.153.1935 > 10.8.0.4.59952: Flags [.], ack 124027, win 125, options [nop,nop,TS val 1264935370 ecr 974876545], length 0
12:32:36.794364 IP 10.8.0.4.59952 > 45.113.129.153.1935: Flags [.], seq 139557:140871, ack 0, win 501, options [nop,nop,TS val 974878567 ecr 1264935370], length 1314
12:32:36.794365 IP 10.8.0.4.59952 > 45.113.129.153.1935: Flags [P.], seq 140871:142185, ack 0, win 501, options [nop,nop,TS val 974878567 ecr 1264935370], length 1314
12:32:36.794379 IP 45.113.129.153.1935 > 10.8.0.4.59952: Flags [.], ack 125341, win 126, options [nop,nop,TS val 1264935370 ecr 974876584], length 0
12:32:36.794389 IP 10.8.0.4.59952 > 45.113.129.153.1935: Flags [.], seq 142185:143499, ack 0, win 501, options [nop,nop,TS val 974878567 ecr 1264935370], length 1314
12:32:36.794390 IP 10.8.0.4.59952 > 45.113.129.153.1935: Flags [P.], seq 143499:144813, ack 0, win 501, options [nop,nop,TS val 974878567 ecr 1264935370], length 1314
12:32:36.794402 IP 45.113.129.153.1935 > 10.8.0.4.59952: Flags [.], ack 126655, win 126, options [nop,nop,TS val 1264935370 ecr 974876649], length 0
12:32:36.794414 IP 10.8.0.4.59952 > 45.113.129.153.1935: Flags [.], seq 144813:146127, ack 0, win 501, options [nop,nop,TS val 974878567 ecr 1264935370], length 1314
12:32:36.794415 IP 10.8.0.4.59952 > 45.113.129.153.1935: Flags [P.], seq 146127:147441, ack 0, win 501, options [nop,nop,TS val 974878567 ecr 1264935370], length 1314
12:32:36.794429 IP 45.113.129.153.1935 > 10.8.0.4.59952: Flags [.], ack 127969, win 125, options [nop,nop,TS val 1264935370 ecr 974876682], length 0
12:32:36.794439 IP 10.8.0.4.59952 > 45.113.129.153.1935: Flags [.], seq 147441:148755, ack 0, win 501, options [nop,nop,TS val 974878567 ecr 1264935370], length 1314
12:32:36.794440 IP 10.8.0.4.59952 > 45.113.129.153.1935: Flags [P.], seq 148755:150069, ack 0, win 501, options [nop,nop,TS val 974878567 ecr 1264935370], length 1314
12:32:36.794453 IP 45.113.129.153.1935 > 10.8.0.4.59952: Flags [.], ack 129283, win 124, options [nop,nop,TS val 1264935370 ecr 974876715], length 0
12:32:36.794465 IP 10.8.0.4.59952 > 45.113.129.153.1935: Flags [.], seq 150069:151383, ack 0, win 501, options [nop,nop,TS val 974878567 ecr 1264935370], length 1314
12:32:36.794466 IP 10.8.0.4.59952 > 45.113.129.153.1935: Flags [P.], seq 151383:152697, ack 0, win 501, options [nop,nop,TS val 974878567 ecr 1264935370], length 1314
12:32:36.794479 IP 45.113.129.153.1935 > 10.8.0.4.59952: Flags [.], ack 130359, win 122, options [nop,nop,TS val 1264935370 ecr 974876759], length 0
12:32:36.794490 IP 10.8.0.4.59952 > 45.113.129.153.1935: Flags [.], seq 152697:154011, ack 0, win 501, options [nop,nop,TS val 974878567 ecr 1264935370], length 1314
12:32:36.794492 IP 10.8.0.4.59952 > 45.113.129.153.1935: Flags [P.], seq 154011:155325, ack 0, win 501, options [nop,nop,TS val 974878567 ecr 1264935370], length 1314
12:32:36.794504 IP 45.113.129.153.1935 > 10.8.0.4.59952: Flags [.], ack 131673, win 120, options [nop,nop,TS val 1264935370 ecr 974876812], length 0
12:32:36.794514 IP 10.8.0.4.59952 > 45.113.129.153.1935: Flags [.], seq 155325:156639, ack 0, win 501, options [nop,nop,TS val 974878567 ecr 1264935370], length 1314
12:32:36.794515 IP 10.8.0.4.59952 > 45.113.129.153.1935: Flags [P.], seq 156639:157953, ack 0, win 501, options [nop,nop,TS val 974878567 ecr 1264935370], length 1314
12:32:36.794528 IP 45.113.129.153.1935 > 10.8.0.4.59952: Flags [.], ack 131673, win 120, options [nop,nop,TS val 1264935370 ecr 974876812,nop,nop,sack 1 {119423:120737}], length 0
12:32:36.794545 IP 45.113.129.153.1935 > 10.8.0.4.59952: Flags [.], ack 131673, win 123, options [nop,nop,TS val 1264935370 ecr 974876812,nop,nop,sack 1 {119423:120737}], length 0
12:32:36.828901 IP 45.113.129.153.1935 > 10.8.0.4.59952: Flags [.], ack 132987, win 126, options [nop,nop,TS val 1264935403 ecr 974878521], length 0
12:32:36.828940 IP 10.8.0.4.59952 > 45.113.129.153.1935: Flags [.], seq 157953:159267, ack 0, win 501, options [nop,nop,TS val 974878602 ecr 1264935403], length 1314
12:32:36.828942 IP 10.8.0.4.59952 > 45.113.129.153.1935: Flags [P.], seq 159267:160581, ack 0, win 501, options [nop,nop,TS val 974878602 ecr 1264935403], length 1314
12:32:36.828965 IP 45.113.129.153.1935 > 10.8.0.4.59952: Flags [.], ack 134301, win 126, options [nop,nop,TS val 1264935403 ecr 974878521], length 0
12:32:36.828978 IP 10.8.0.4.59952 > 45.113.129.153.1935: Flags [.], seq 160581:161895, ack 0, win 501, options [nop,nop,TS val 974878602 ecr 1264935403], length 1314
12:32:36.828979 IP 10.8.0.4.59952 > 45.113.129.153.1935: Flags [P.], seq 161895:163209, ack 0, win 501, options [nop,nop,TS val 974878602 ecr 1264935403], length 1314
12:32:36.828994 IP 45.113.129.153.1935 > 10.8.0.4.59952: Flags [.], ack 135615, win 126, options [nop,nop,TS val 1264935403 ecr 974878521], length 0
12:32:36.829018 IP 45.113.129.153.1935 > 10.8.0.4.59952: Flags [.], ack 136929, win 126, options [nop,nop,TS val 1264935403 ecr 974878521], length 0
12:32:36.829064 IP 10.8.0.4.59952 > 45.113.129.153.1935: Flags [P.], seq 163209:163256, ack 0, win 501, options [nop,nop,TS val 974878602 ecr 1264935403], length 47
12:32:36.829121 IP 10.8.0.4.59952 > 45.113.129.153.1935: Flags [.], seq 163256:164570, ack 0, win 501, options [nop,nop,TS val 974878602 ecr 1264935403], length 1314
12:32:36.829138 IP 10.8.0.4.59952 > 45.113.129.153.1935: Flags [.], seq 164570:165884, ack 0, win 501, options [nop,nop,TS val 974878602 ecr 1264935403], length 1314
12:32:36.829160 IP 10.8.0.4.59952 > 45.113.129.153.1935: Flags [.], seq 165884:167198, ack 0, win 501, options [nop,nop,TS val 974878602 ecr 1264935403], length 1314
12:32:36.875980 IP 45.113.129.153.1935 > 10.8.0.4.59952: Flags [.], ack 138243, win 126, options [nop,nop,TS val 1264935449 ecr 974878567], length 0
12:32:36.876010 IP 10.8.0.4.59952 > 45.113.129.153.1935: Flags [.], seq 167198:168512, ack 0, win 501, options [nop,nop,TS val 974878649 ecr 1264935449], length 1314
12:32:36.876011 IP 10.8.0.4.59952 > 45.113.129.153.1935: Flags [P.], seq 168512:169826, ack 0, win 501, options [nop,nop,TS val 974878649 ecr 1264935449], length 1314
12:32:36.876029 IP 45.113.129.153.1935 > 10.8.0.4.59952: Flags [.], ack 139557, win 125, options [nop,nop,TS val 1264935449 ecr 974878567], length 0
12:32:36.876039 IP 10.8.0.4.59952 > 45.113.129.153.1935: Flags [.], seq 169826:171140, ack 0, win 501, options [nop,nop,TS val 974878649 ecr 1264935449], length 1314
12:32:36.876040 IP 10.8.0.4.59952 > 45.113.129.153.1935: Flags [P.], seq 171140:172454, ack 0, win 501, options [nop,nop,TS val 974878649 ecr 1264935449], length 1314
