22:57:46.871085 IP 99.181.67.60.1935 > 10.8.3.2.53402: Flags [.], ack 2316755017, win 126, options [nop,nop,TS val 3249495259 ecr 1581017752], length 0
22:57:46.874888 IP 10.8.3.2.53402 > 99.181.67.60.1935: Flags [.], seq 7640:8954, ack 0, win 501, options [nop,nop,TS val 1581018095 ecr 3249495259], length 1314
22:57:46.923763 IP 99.181.67.60.1935 > 10.8.3.2.53402: Flags [.], ack 1070, win 126, options [nop,nop,TS val 3249495311 ecr 1581017847], length 0
22:57:46.923800 IP 10.8.3.2.53402 > 99.181.67.60.1935: Flags [P.], seq 8954:10022, ack 0, win 501, options [nop,nop,TS val 1581018143 ecr 3249495311], length 1068
22:57:46.966850 IP 10.8.3.2.53402 > 99.181.67.60.1935: Flags [.], seq 10022:11336, ack 0, win 501, options [nop,nop,TS val 1581018187 ecr 3249495311], length 1314
22:57:46.998815 IP 99.181.67.60.1935 > 10.8.3.2.53402: Flags [.], ack 3698, win 126, options [nop,nop,TS val 3249495386 ecr 1581017889], length 0
22:57:47.001534 IP 10.8.3.2.53402 > 99.181.67.60.1935: Flags [.], seq 11336:12650, ack 0, win 501, options [nop,nop,TS val 1581018221 ecr 3249495386], length 1314
22:57:47.045920 IP 10.8.3.2.53402 > 99.181.67.60.1935: Flags [.], seq 12650:13964, ack 0, win 501, options [nop,nop,TS val 1581018266 ecr 3249495386], length 1314
22:57:47.098248 IP 99.181.67.60.1935 > 10.8.3.2.53402: Flags [.], ack 6326, win 126, options [nop,nop,TS val 3249495485 ecr 1581017966], length 0
22:57:47.099395 IP 10.8.3.2.53402 > 99.181.67.60.1935: Flags [.], seq 13964:15278, ack 0, win 501, options [nop,nop,TS val 1581018319 ecr 3249495485], length 1314
22:57:47.136046 IP 10.8.3.2.53402 > 99.181.67.60.1935: Flags [.], seq 15278:16592, ack 0, win 501, options [nop,nop,TS val 1581018356 ecr 3249495485], length 1314
22:57:47.171107 IP 99.181.67.60.1935 > 10.8.3.2.53402: Flags [.], ack 8954, win 126, options [nop,nop,TS val 3249495559 ecr 1581018055], length 0
22:57:47.174043 IP 10.8.3.2.53402 > 99.181.67.60.1935: Flags [.], seq 16592:17906, ack 0, win 501, options [nop,nop,TS val 1581018394 ecr 3249495559], length 1314
22:57:47.220131 IP 99.181.67.60.1935 > 10.8.3.2.53402: Flags [.], ack 10022, win 126, options [nop,nop,TS val 3249495608 ecr 1581018143], length 0
22:57:47.220168 IP 10.8.3.2.53402 > 99.181.67.60.1935: Flags [P.], seq 17906:18983, ack 0, win 501, options [nop,nop,TS val 1581018440 ecr 3249495608], length 1077
22:57:47.268777 IP 10.8.3.2.53402 > 99.181.67.60.1935: Flags [.], seq 18983:20297, ack 0, win 501, options [nop,nop,TS val 1581018488 ecr 3249495608], length 1314
22:57:47.298248 IP 99.181.67.60.1935 > 10.8.3.2.53402: Flags [.], ack 12650, win 126, options [nop,nop,TS val 3249495685 ecr 1581018187], length 0
22:57:47.302626 IP 10.8.3.2.53402 > 99.181.67.60.1935: Flags [.], seq 20297:21611, ack 0, win 501, options [nop,nop,TS val 1581018522 ecr 3249495685], length 1314
22:57:47.345430 IP 10.8.3.2.53402 > 99.181.67.60.1935: Flags [.], seq 21611:22925, ack 0, win 501, options [nop,nop,TS val 1581018565 ecr 3249495685], length 1314
22:57:47.396116 IP 99.181.67.60.1935 > 10.8.3.2.53402: Flags [.], ack 15278, win 126, options [nop,nop,TS val 3249495784 ecr 1581018266], length 0
22:57:47.400597 IP 10.8.3.2.53402 > 99.181.67.60.1935: Flags [.], seq 22925:24239, ack 0, win 501, options [nop,nop,TS val 1581018620 ecr 3249495784], length 1314
22:57:47.432993 IP 10.8.3.2.53402 > 99.181.67.60.1935: Flags [.], seq 24239:25553, ack 0, win 501, options [nop,nop,TS val 1581018653 ecr 3249495784], length 1314
22:57:47.470437 IP 99.181.67.60.1935 > 10.8.3.2.53402: Flags [.], ack 17906, win 126, options [nop,nop,TS val 3249495858 ecr 1581018356], length 0
22:57:47.472728 IP 10.8.3.2.53402 > 99.181.67.60.1935: Flags [.], seq 25553:26867, ack 0, win 501, options [nop,nop,TS val 1581018692 ecr 3249495858], length 1314
22:57:47.516172 IP 99.181.67.60.1935 > 10.8.3.2.53402: Flags [.], ack 18983, win 126, options [nop,nop,TS val 3249495904 ecr 1581018440], length 0
22:57:47.516184 IP 10.8.3.2.53402 > 99.181.67.60.1935: Flags [P.], seq 26867:27928, ack 0, win 501, options [nop,nop,TS val 1581018736 ecr 3249495904], length 1061
22:57:47.567120 IP 10.8.3.2.53402 > 99.181.67.60.1935: Flags [.], seq 27928:29242, ack 0, win 501, options [nop,nop,TS val 1581018787 ecr 3249495904], length 1314
22:57:47.599109 IP 99.181.67.60.1935 > 10.8.3.2.53402: Flags [.], ack 21611, win 126, options [nop,nop,TS val 3249495987 ecr 1581018488], length 0
22:57:47.600023 IP 10.8.3.2.53402 > 99.181.67.60.1935: Flags [.], seq 29242:30556, ack 0, win 501, options [nop,nop,TS val 1581018820 ecr 3249495987], length 1314
22:57:47.642377 IP 10.8.3.2.53402 > 99.181.67.60.1935: Flags [.], seq 30556:31870, ack 0, win 501, options [nop,nop,TS val 1581018862 ecr 3249495987], length 1314
22:57:47.697067 IP 99.181.67.60.1935 > 10.8.3.2.53402: Flags [.], ack 24239, win 126, options [nop,nop,TS val 3249496084 ecr 1581018565], length 0
22:57:47.703340 IP 10.8.3.2.53402 > 99.181.67.60.1935: Flags [.], seq 31870:33184, ack 0, win 501, options [nop,nop,TS val 1581018923 ecr 3249496084], length 1314
22:57:47.736863 IP 10.8.3.2.53402 > 99.181.67.60.1935: Flags [.], seq 33184:34498, ack 0, win 501, options [nop,nop,TS val 1581018957 ecr 3249496084], length 1314
22:57:47.770430 IP 99.181.67.60.1935 > 10.8.3.2.53402: Flags [.], ack 26867, win 126, options [nop,nop,TS val 3249496158 ecr 1581018653], length 0
22:57:47.771251 IP 10.8.3.2.53402 > 99.181.67.60.1935: Flags [.], seq 34498:35812, ack 0, win 501, options [nop,nop,TS val 1581018991 ecr 3249496158], length 1314
22:57:47.812221 IP 99.181.67.60.1935 > 10.8.3.2.53402: Flags [.], ack 27928, win 126, options [nop,nop,TS val 3249496200 ecr 1581018736], length 0
22:57:47.812238 IP 10.8.3.2.53402 > 99.181.67.60.1935: Flags [P.], seq 35812:36790, ack 0, win 501, options [nop,nop,TS val 1581019032 ecr 3249496200], length 978
22:57:47.869903 IP 10.8.3.2.53402 > 99.181.67.60.1935: Flags [.], seq 36790:38104, ack 0, win 501, options [nop,nop,TS val 1581019090 ecr 3249496200], length 1314
22:57:47.896320 IP 99.181.67.60.1935 > 10.8.3.2.53402: Flags [.], ack 30556, win 126, options [nop,nop,TS val 3249496284 ecr 1581018787], length 0
22:57:47.903346 IP 10.8.3.2.53402 > 99.181.67.60.1935: Flags [.], seq 38104:39418, ack 0, win 501, options [nop,nop,TS val 1581019123 ecr 3249496284], length 1314
22:57:47.935197 IP 10.8.3.2.53402 > 99.181.67.60.1935: Flags [.], seq 39418:40732, ack 0, win 501, options [nop,nop,TS val 1581019155 ecr 3249496284], length 1314
22:57:48.002918 IP 10.8.3.2.53402 > 99.181.67.60.1935: Flags [.], seq 40732:42046, ack 0, win 501, options [nop,nop,TS val 1581019223 ecr 3249496284], length 1314
22:57:48.036080 IP 10.8.3.2.53402 > 99.181.67.60.1935: Flags [.], seq 42046:43360, ack 0, win 501, options [nop,nop,TS val 1581019256 ecr 3249496284], length 1314
22:57:48.068186 IP 99.181.67.60.1935 > 10.8.3.2.53402: Flags [.], ack 35812, win 126, options [nop,nop,TS val 3249496455 ecr 1581018957], length 0
22:57:48.069685 IP 10.8.3.2.53402 > 99.181.67.60.1935: Flags [.], seq 43360:44674, ack 0, win 501, options [nop,nop,TS val 1581019289 ecr 3249496455], length 1314
22:57:48.108291 IP 99.181.67.60.1935 > 10.8.3.2.53402: Flags [.], ack 36790, win 126, options [nop,nop,TS val 3249496496 ecr 1581019032], length 0
22:57:48.108327 IP 10.8.3.2.53402 > 99.181.67.60.1935: Flags [P.], seq 44674:45751, ack 0, win 501, options [nop,nop,TS val 1581019328 ecr 3249496496], length 1077
22:57:48.167812 IP 10.8.3.2.53402 > 99.181.67.60.1935: Flags [.], seq 45751:47065, ack 0, win 501, options [nop,nop,TS val 1581019388 ecr 3249496496], length 1314
22:57:48.199961 IP 99.181.67.60.1935 > 10.8.3.2.53402: Flags [.], ack 39418, win 126, options [nop,nop,TS val 3249496587 ecr 1581019090], length 0
22:57:48.200976 IP 10.8.3.2.53402 > 99.181.67.60.1935: Flags [.], seq 47065:48379, ack 0, win 501, options [nop,nop,TS val 1581019421 ecr 3249496587], length 1314
22:57:48.235676 IP 10.8.3.2.53402 > 99.181.67.60.1935: Flags [.], seq 48379:49693, ack 0, win 501, options [nop,nop,TS val 1581019455 ecr 3249496587], length 1314
22:57:48.299534 IP 99.181.67.60.1935 > 10.8.3.2.53402: Flags [.], ack 42046, win 126, options [nop,nop,TS val 3249496687 ecr 1581019155], length 0
22:57:48.301172 IP 10.8.3.2.53402 > 99.181.67.60.1935: Flags [.], seq 49693:51007, ack 0, win 501, options [nop,nop,TS val 1581019521 ecr 3249496687], length 1314
22:57:48.335053 IP 10.8.3.2.53402 > 99.181.67.60.1935: Flags [.], seq 51007:52321, ack 0, win 501, options [nop,nop,TS val 1581019555 ecr 3249496687], length 1314
22:57:48.367096 IP 99.181.67.60.1935 > 10.8.3.2.53402: Flags [.], ack 44674, win 126, options [nop,nop,TS val 3249496754 ecr 1581019256], length 0
22:57:48.370509 IP 10.8.3.2.53402 > 99.181.67.60.1935: Flags [.], seq 52321:53635, ack 0, win 501, options [nop,nop,TS val 1581019590 ecr 3249496754], length 1314
22:57:48.404398 IP 99.181.67.60.1935 > 10.8.3.2.53402: Flags [.], ack 45751, win 126, options [nop,nop,TS val 3249496792 ecr 1581019328], length 0
22:57:48.404412 IP 10.8.3.2.53402 > 99.181.67.60.1935: Flags [P.], seq 53635:54695, ack 0, win 501, options [nop,nop,TS val 1581019624 ecr 3249496792], length 1060
22:57:48.468148 IP 10.8.3.2.53402 > 99.181.67.60.1935: Flags [.], seq 54695:56009, ack 0, win 501, options [nop,nop,TS val 1581019688 ecr 3249496792], length 1314
22:57:48.496892 IP 99.181.67.60.1935 > 10.8.3.2.53402: Flags [.], ack 48379, win 126, options [nop,nop,TS val 3249496885 ecr 1581019388], length 0
22:57:48.505319 IP 10.8.3.2.53402 > 99.181.67.60.1935: Flags [.], seq 56009:57323, ack 0, win 501, options [nop,nop,TS val 1581019725 ecr 3249496885], length 1314
22:57:48.536882 IP 10.8.3.2.53402 > 99.181.67.60.1935: Flags [.], seq 57323:58637, ack 0, win 501, options [nop,nop,TS val 1581019757 ecr 3249496885], length 1314
22:57:48.597738 IP 99.181.67.60.1935 > 10.8.3.2.53402: Flags [.], ack 51007, win 126, options [nop,nop,TS val 3249496985 ecr 1581019455], length 0
22:57:48.601424 IP 10.8.3.2.53402 > 99.181.67.60.1935: Flags [.], seq 58637:59951, ack 0, win 501, options [nop,nop,TS val 1581019821 ecr 3249496985], length 1314
22:57:48.635670 IP 10.8.3.2.53402 > 99.181.67.60.1935: Flags [.], seq 59951:61265, ack 0, win 501, options [nop,nop,TS val 1581019855 ecr 3249496985], length 1314
22:57:48.666744 IP 99.181.67.60.1935 > 10.8.3.2.53402: Flags [.], ack 53635, win 126, options [nop,nop,TS val 3249497054 ecr 1581019555], length 0
22:57:48.669683 IP 10.8.3.2.53402 > 99.181.67.60.1935: Flags [.], seq 61265:62579, ack 0, win 501, options [nop,nop,TS val 1581019889 ecr 3249497054], length 1314
22:57:48.700711 IP 99.181.67.60.1935 > 10.8.3.2.53402: Flags [.], ack 54695, win 126, options [nop,nop,TS val 3249497088 ecr 1581019624], length 0
22:57:48.700751 IP 10.8.3.2.53402 > 99.181.67.60.1935: Flags [P.], seq 62579:62808, ack 0, win 501, options [nop,nop,TS val 1581019920 ecr 3249497088], length 229
22:57:48.736113 IP 10.8.3.2.53402 > 99.181.67.60.1935: Flags [.], seq 62808:64122, ack 0, win 501, options [nop,nop,TS val 1581019956 ecr 3249497088], length 1314
22:57:48.767968 IP 10.8.3.2.53402 > 99.181.67.60.1935: Flags [.], seq 64122:65436, ack 0, win 501, options [nop,nop,TS val 1581019988 ecr 3249497088], length 1314
22:57:48.802404 IP 99.181.67.60.1935 > 10.8.3.2.53402: Flags [.], ack 57323, win 126, options [nop,nop,TS val 3249497190 ecr 1581019688], length 0
22:57:48.818673 IP 10.8.3.2.53402 > 99.181.67.60.1935: Flags [.], seq 65436:66750, ack 0, win 501, options [nop,nop,TS val 1581020038 ecr 3249497190], length 1314
22:57:48.868302 IP 10.8.3.2.53402 > 99.181.67.60.1935: Flags [.], seq 66750:68064, ack 0, win 501, options [nop,nop,TS val 1581020088 ecr 3249497190], length 1314
22:57:48.898168 IP 99.181.67.60.1935 > 10.8.3.2.53402: Flags [.], ack 59951, win 126, options [nop,nop,TS val 3249497286 ecr 1581019757], length 0
22:57:48.903969 IP 10.8.3.2.53402 > 99.181.67.60.1935: Flags [.], seq 68064:69378, ack 0, win 501, options [nop,nop,TS val 1581020124 ecr 3249497286], length 1314
22:57:48.946788 IP 10.8.3.2.53402 > 99.181.67.60.1935: Flags [.], seq 69378:70692, ack 0, win 501, options [nop,nop,TS val 1581020166 ecr 3249497286], length 1314
22:57:48.965904 IP 99.181.67.60.1935 > 10.8.3.2.53402: Flags [.], ack 62579, win 126, options [nop,nop,TS val 3249497353 ecr 1581019855], length 0
22:57:48.997201 IP 99.181.67.60.1935 > 10.8.3.2.53402: Flags [.], ack 62808, win 126, options [nop,nop,TS val 3249497385 ecr 1581019920], length 0
22:57:48.997230 IP 10.8.3.2.53402 > 99.181.67.60.1935: Flags [P.], seq 70692:71761, ack 0, win 501, options [nop,nop,TS val 1581020217 ecr 3249497385], length 1069
22:57:49.033079 IP 10.8.3.2.53402 > 99.181.67.60.1935: Flags [.], seq 71761:73075, ack 0, win 501, options [nop,nop,TS val 1581020253 ecr 3249497385], length 1314
22:57:49.064394 IP 99.181.67.60.1935 > 10.8.3.2.53402: Flags [.], ack 65436, win 126, options [nop,nop,TS val 3249497452 ecr 1581019956], length 0
22:57:49.066102 IP 10.8.3.2.53402 > 99.181.67.60.1935: Flags [.], seq 73075:74389, ack 0, win 501, options [nop,nop,TS val 1581020286 ecr 3249497452], length 1314
22:57:49.117322 IP 10.8.3.2.53402 > 99.181.67.60.1935: Flags [.], seq 74389:75703, ack 0, win 501, options [nop,nop,TS val 1581020337 ecr 3249497452], length 1314
22:57:49.164520 IP 99.181.67.60.1935 > 10.8.3.2.53402: Flags [.], ack 68064, win 126, options [nop,nop,TS val 3249497552 ecr 1581020038], length 0
22:57:49.170248 IP 10.8.3.2.53402 > 99.181.67.60.1935: Flags [.], seq 75703:77017, ack 0, win 501, options [nop,nop,TS val 1581020390 ecr 3249497552], length 1314
22:57:49.202492 IP 10.8.3.2.53402 > 99.181.67.60.1935: Flags [.], seq 77017:78331, ack 0, win 501, options [nop,nop,TS val 1581020422 ecr 3249497552], length 1314
22:57:49.243093 IP 99.181.67.60.1935 > 10.8.3.2.53402: Flags [.], ack 70692, win 126, options [nop,nop,TS val 3249497631 ecr 1581020124], length 0
22:57:49.245171 IP 10.8.3.2.53402 > 99.181.67.60.1935: Flags [.], seq 78331:79645, ack 0, win 501, options [nop,nop,TS val 1581020465 ecr 3249497631], length 1314
22:57:49.293206 IP 99.181.67.60.1935 > 10.8.3.2.53402: Flags [.], ack 71761, win 126, options [nop,nop,TS val 3249497681 ecr 1581020217], length 0
22:57:49.293242 IP 10.8.3.2.53402 > 99.181.67.60.1935: Flags [P.], seq 79645:80709, ack 0, win 501, options [nop,nop,TS val 1581020513 ecr 3249497681], length 1064
22:57:49.332568 IP 10.8.3.2.53402 > 99.181.67.60.1935: Flags [.], seq 80709:82023, ack 0, win 501, options [nop,nop,TS val 1581020552 ecr 3249497681], length 1314
22:57:49.362653 IP 99.181.67.60.1935 > 10.8.3.2.53402: Flags [.], ack 74389, win 126, options [nop,nop,TS val 3249497750 ecr 1581020253], length 0
22:57:49.367017 IP 10.8.3.2.53402 > 99.181.67.60.1935: Flags [.], seq 82023:83337, ack 0, win 501, options [nop,nop,TS val 1581020587 ecr 3249497750], length 1314
22:57:49.415890 IP 10.8.3.2.53402 > 99.181.67.60.1935: Flags [.], seq 83337:84651, ack 0, win 501, options [nop,nop,TS val 1581020636 ecr 3249497750], length 1314
22:57:49.466827 IP 99.181.67.60.1935 > 10.8.3.2.53402: Flags [.], ack 77017, win 126, options [nop,nop,TS val 3249497854 ecr 1581020337], length 0
22:57:49.467256 IP 10.8.3.2.53402 > 99.181.67.60.1935: Flags [.], seq 84651:85965, ack 0, win 501, options [nop,nop,TS val 1581020687 ecr 3249497854], length 1314
22:57:49.501205 IP 10.8.3.2.53402 > 99.181.67.60.1935: Flags [.], seq 85965:87279, ack 0, win 501, options [nop,nop,TS val 1581020721 ecr 3249497854], length 1314
22:57:49.541447 IP 99.181.67.60.1935 > 10.8.3.2.53402: Flags [.], ack 79645, win 126, options [nop,nop,TS val 3249497929 ecr 1581020422], length 0
22:57:49.544253 IP 10.8.3.2.53402 > 99.181.67.60.1935: Flags [.], seq 87279:88593, ack 0, win 501, options [nop,nop,TS val 1581020764 ecr 3249497929], length 1314
22:57:49.590103 IP 99.181.67.60.1935 > 10.8.3.2.53402: Flags [.], ack 80709, win 126, options [nop,nop,TS val 3249497978 ecr 1581020513], length 0
22:57:49.590141 IP 10.8.3.2.53402 > 99.181.67.60.1935: Flags [P.], seq 88593:89670, ack 0, win 501, options [nop,nop,TS val 1581020810 ecr 3249497978], length 1077
22:57:49.636674 IP 10.8.3.2.53402 > 99.181.67.60.1935: Flags [.], seq 89670:90984, ack 0, win 501, options [nop,nop,TS val 1581020856 ecr 3249497978], length 1314
22:57:49.663292 IP 99.181.67.60.1935 > 10.8.3.2.53402: Flags [.], ack 83337, win 126, options [nop,nop,TS val 3249498051 ecr 1581020552], length 0
22:57:49.669819 IP 10.8.3.2.53402 > 99.181.67.60.1935: Flags [.], seq 90984:92298, ack 0, win 501, options [nop,nop,TS val 1581020890 ecr 3249498051], length 1314
22:57:49.716120 IP 10.8.3.2.53402 > 99.181.67.60.1935: Flags [.], seq 92298:93612, ack 0, win 501, options [nop,nop,TS val 1581020936 ecr 3249498051], length 1314
22:57:49.764698 IP 99.181.67.60.1935 > 10.8.3.2.53402: Flags [.], ack 85965, win 126, options [nop,nop,TS val 3249498151 ecr 1581020636], length 0
22:57:49.768376 IP 10.8.3.2.53402 > 99.181.67.60.1935: Flags [.], seq 93612:94926, ack 0, win 501, options [nop,nop,TS val 1581020988 ecr 3249498151], length 1314
22:57:49.803229 IP 10.8.3.2.53402 > 99.181.67.60.1935: Flags [.], seq 94926:96240, ack 0, win 501, options [nop,nop,TS val 1581021023 ecr 3249498151], length 1314
22:57:49.841663 IP 99.181.67.60.1935 > 10.8.3.2.53402: Flags [.], ack 88593, win 126, options [nop,nop,TS val 3249498228 ecr 1581020721], length 0
22:57:49.845165 IP 10.8.3.2.53402 > 99.181.67.60.1935: Flags [.], seq 96240:97554, ack 0, win 501, options [nop,nop,TS val 1581021065 ecr 3249498228], length 1314
22:57:49.886355 IP 99.181.67.60.1935 > 10.8.3.2.53402: Flags [.], ack 89670, win 126, options [nop,nop,TS val 3249498274 ecr 1581020810], length 0
22:57:49.886370 IP 10.8.3.2.53402 > 99.181.67.60.1935: Flags [P.], seq 97554:98524, ack 0, win 501, options [nop,nop,TS val 1581021106 ecr 3249498274], length 970
22:57:49.932738 IP 10.8.3.2.53402 > 99.181.67.60.1935: Flags [.], seq 98524:99838, ack 0, win 501, options [nop,nop,TS val 1581021152 ecr 3249498274], length 1314
22:57:49.966038 IP 99.181.67.60.1935 > 10.8.3.2.53402: Flags [.], ack 92298, win 126, options [nop,nop,TS val 3249498354 ecr 1581020856], length 0
22:57:49.972898 IP 10.8.3.2.53402 > 99.181.67.60.1935: Flags [.], seq 99838:101152, ack 0, win 501, options [nop,nop,TS val 1581021193 ecr 3249498354], length 1314
22:57:50.003473 IP 10.8.3.2.53402 > 99.181.67.60.1935: Flags [.], seq 101152:102466, ack 0, win 501, options [nop,nop,TS val 1581021223 ecr 3249498354], length 1314
22:57:50.064512 IP 99.181.67.60.1935 > 10.8.3.2.53402: Flags [.], ack 94926, win 126, options [nop,nop,TS val 3249498452 ecr 1581020936], length 0
22:57:50.069427 IP 10.8.3.2.53402 > 99.181.67.60.1935: Flags [.], seq 102466:103780, ack 0, win 501, options [nop,nop,TS val 1581021289 ecr 3249498452], length 1314
22:57:50.103951 IP 10.8.3.2.53402 > 99.181.67.60.1935: Flags [.], seq 103780:105094, ack 0, win 501, options [nop,nop,TS val 1581021324 ecr 3249498452], length 1314
22:57:50.136730 IP 10.8.3.2.53402 > 99.181.67.60.1935: Flags [.], seq 105094:106408, ack 0, win 501, options [nop,nop,TS val 1581021356 ecr 3249498452], length 1314
22:57:50.141486 IP 99.181.67.60.1935 > 10.8.3.2.53402: Flags [.], ack 97554, win 126, options [nop,nop,TS val 3249498529 ecr 1581021023], length 0
22:57:50.182680 IP 99.181.67.60.1935 > 10.8.3.2.53402: Flags [.], ack 98524, win 126, options [nop,nop,TS val 3249498570 ecr 1581021106], length 0
22:57:50.182709 IP 10.8.3.2.53402 > 99.181.67.60.1935: Flags [P.], seq 106408:107481, ack 0, win 501, options [nop,nop,TS val 1581021402 ecr 3249498570], length 1073
22:57:50.236746 IP 10.8.3.2.53402 > 99.181.67.60.1935: Flags [.], seq 107481:108795, ack 0, win 501, options [nop,nop,TS val 1581021456 ecr 3249498570], length 1314
22:57:50.269645 IP 99.181.67.60.1935 > 10.8.3.2.53402: Flags [.], ack 101152, win 126, options [nop,nop,TS val 3249498657 ecr 1581021152], length 0
22:57:50.273590 IP 10.8.3.2.53402 > 99.181.67.60.1935: Flags [.], seq 108795:110109, ack 0, win 501, options [nop,nop,TS val 1581021493 ecr 3249498657], length 1314
22:57:50.303327 IP 10.8.3.2.53402 > 99.181.67.60.1935: Flags [.], seq 110109:111423, ack 0, win 501, options [nop,nop,TS val 1581021523 ecr 3249498657], length 1314
22:57:50.365713 IP 99.181.67.60.1935 > 10.8.3.2.53402: Flags [.], ack 103780, win 126, options [nop,nop,TS val 3249498753 ecr 1581021223], length 0
22:57:50.370332 IP 10.8.3.2.53402 > 99.181.67.60.1935: Flags [.], seq 111423:112737, ack 0, win 501, options [nop,nop,TS val 1581021590 ecr 3249498753], length 1314
22:57:50.403509 IP 10.8.3.2.53402 > 99.181.67.60.1935: Flags [.], seq 112737:114051, ack 0, win 501, options [nop,nop,TS val 1581021623 ecr 3249498753], length 1314
22:57:50.433702 IP 10.8.3.2.53402 > 99.181.67.60.1935: Flags [.], seq 114051:115365, ack 0, win 501, options [nop,nop,TS val 1581021653 ecr 3249498753], length 1314
22:57:50.434222 IP 99.181.67.60.1935 > 10.8.3.2.53402: Flags [.], ack 106408, win 126, options [nop,nop,TS val 3249498821 ecr 1581021324], length 0
22:57:50.478794 IP 99.181.67.60.1935 > 10.8.3.2.53402: Flags [.], ack 107481, win 126, options [nop,nop,TS val 3249498867 ecr 1581021402], length 0
22:57:50.478827 IP 10.8.3.2.53402 > 99.181.67.60.1935: Flags [P.], seq 115365:116442, ack 0, win 501, options [nop,nop,TS val 1581021699 ecr 3249498867], length 1077
22:57:50.532334 IP 10.8.3.2.53402 > 99.181.67.60.1935: Flags [.], seq 116442:117756, ack 0, win 501, options [nop,nop,TS val 1581021752 ecr 3249498867], length 1314
22:57:50.570179 IP 99.181.67.60.1935 > 10.8.3.2.53402: Flags [.], ack 110109, win 126, options [nop,nop,TS val 3249498958 ecr 1581021456], length 0
22:57:50.572927 IP 10.8.3.2.53402 > 99.181.67.60.1935: Flags [.], seq 117756:119070, ack 0, win 501, options [nop,nop,TS val 1581021793 ecr 3249498958], length 1314
22:57:50.603407 IP 10.8.3.2.53402 > 99.181.67.60.1935: Flags [.], seq 119070:120384, ack 0, win 501, options [nop,nop,TS val 1581021823 ecr 3249498958], length 1314
22:57:50.666740 IP 99.181.67.60.1935 > 10.8.3.2.53402: Flags [.], ack 112737, win 126, options [nop,nop,TS val 3249499054 ecr 1581021523], length 0
22:57:50.670117 IP 10.8.3.2.53402 > 99.181.67.60.1935: Flags [.], seq 120384:121698, ack 0, win 501, options [nop,nop,TS val 1581021890 ecr 3249499054], length 1314
22:57:50.701687 IP 10.8.3.2.53402 > 99.181.67.60.1935: Flags [.], seq 121698:123012, ack 0, win 501, options [nop,nop,TS val 1581021921 ecr 3249499054], length 1314
22:57:50.731628 IP 99.181.67.60.1935 > 10.8.3.2.53402: Flags [.], ack 115365, win 126, options [nop,nop,TS val 3249499118 ecr 1581021623], length 0
22:57:50.735146 IP 10.8.3.2.53402 > 99.181.67.60.1935: Flags [.], seq 123012:124326, ack 0, win 501, options [nop,nop,TS val 1581021955 ecr 3249499118], length 1314
22:57:50.775614 IP 99.181.67.60.1935 > 10.8.3.2.53402: Flags [.], ack 116442, win 126, options [nop,nop,TS val 3249499163 ecr 1581021699], length 0
22:57:50.775653 IP 10.8.3.2.53402 > 99.181.67.60.1935: Flags [P.], seq 124326:125382, ack 0, win 501, options [nop,nop,TS val 1581021995 ecr 3249499163], length 1056
22:57:50.835270 IP 10.8.3.2.53402 > 99.181.67.60.1935: Flags [.], seq 125382:126696, ack 0, win 501, options [nop,nop,TS val 1581022055 ecr 3249499163], length 1314
22:57:50.869032 IP 99.181.67.60.1935 > 10.8.3.2.53402: Flags [.], ack 119070, win 126, options [nop,nop,TS val 3249499257 ecr 1581021752], length 0
22:57:50.872787 IP 10.8.3.2.53402 > 99.181.67.60.1935: Flags [.], seq 126696:128010, ack 0, win 501, options [nop,nop,TS val 1581022092 ecr 3249499257], length 1314
22:57:50.903315 IP 10.8.3.2.53402 > 99.181.67.60.1935: Flags [.], seq 128010:129324, ack 0, win 501, options [nop,nop,TS val 1581022123 ecr 3249499257], length 1314
22:57:50.966439 IP 99.181.67.60.1935 > 10.8.3.2.53402: Flags [.], ack 121698, win 126, options [nop,nop,TS val 3249499354 ecr 1581021823], length 0
22:57:50.969759 IP 10.8.3.2.53402 > 99.181.67.60.1935: Flags [.], seq 129324:130638, ack 0, win 501, options [nop,nop,TS val 1581022189 ecr 3249499354], length 1314
22:57:51.003153 IP 10.8.3.2.53402 > 99.181.67.60.1935: Flags [.], seq 130638:131952, ack 0, win 501, options [nop,nop,TS val 1581022223 ecr 3249499354], length 1314
22:57:51.041779 IP 99.181.67.60.1935 > 10.8.3.2.53402: Flags [.], ack 124326, win 126, options [nop,nop,TS val 3249499421 ecr 1581021921], length 0
22:57:51.044437 IP 10.8.3.2.53402 > 99.181.67.60.1935: Flags [.], seq 131952:133266, ack 0, win 501, options [nop,nop,TS val 1581022264 ecr 3249499421], length 1314
22:57:51.072361 IP 99.181.67.60.1935 > 10.8.3.2.53402: Flags [.], ack 125382, win 126, options [nop,nop,TS val 3249499460 ecr 1581021995], length 0
22:57:51.072374 IP 10.8.3.2.53402 > 99.181.67.60.1935: Flags [P.], seq 133266:134343, ack 0, win 501, options [nop,nop,TS val 1581022292 ecr 3249499460], length 1077
22:57:51.136431 IP 10.8.3.2.53402 > 99.181.67.60.1935: Flags [.], seq 134343:135657, ack 0, win 501, options [nop,nop,TS val 1581022356 ecr 3249499460], length 1314
22:57:51.169623 IP 99.181.67.60.1935 > 10.8.3.2.53402: Flags [.], ack 128010, win 126, options [nop,nop,TS val 3249499557 ecr 1581022055], length 0
22:57:51.172546 IP 10.8.3.2.53402 > 99.181.67.60.1935: Flags [.], seq 135657:136971, ack 0, win 501, options [nop,nop,TS val 1581022392 ecr 3249499557], length 1314
22:57:51.203573 IP 10.8.3.2.53402 > 99.181.67.60.1935: Flags [.], seq 136971:138285, ack 0, win 501, options [nop,nop,TS val 1581022423 ecr 3249499557], length 1314
22:57:51.266168 IP 99.181.67.60.1935 > 10.8.3.2.53402: Flags [.], ack 130638, win 126, options [nop,nop,TS val 3249499654 ecr 1581022123], length 0
22:57:51.269545 IP 10.8.3.2.53402 > 99.181.67.60.1935: Flags [.], seq 138285:139599, ack 0, win 501, options [nop,nop,TS val 1581022489 ecr 3249499654], length 1314
22:57:51.303477 IP 10.8.3.2.53402 > 99.181.67.60.1935: Flags [.], seq 139599:140913, ack 0, win 501, options [nop,nop,TS val 1581022523 ecr 3249499654], length 1314
22:57:51.344092 IP 10.8.3.2.53402 > 99.181.67.60.1935: Flags [.], seq 140913:142227, ack 0, win 501, options [nop,nop,TS val 1581022564 ecr 3249499654], length 1314
22:57:51.345688 IP 99.181.67.60.1935 > 10.8.3.2.53402: Flags [.], ack 133266, win 126, options [nop,nop,TS val 3249499733 ecr 1581022223], length 0
22:57:51.369243 IP 99.181.67.60.1935 > 10.8.3.2.53402: Flags [.], ack 134343, win 126, options [nop,nop,TS val 3249499757 ecr 1581022292], length 0
22:57:51.369265 IP 10.8.3.2.53402 > 99.181.67.60.1935: Flags [P.], seq 142227:143300, ack 0, win 501, options [nop,nop,TS val 1581022589 ecr 3249499757], length 1073
22:57:51.435870 IP 10.8.3.2.53402 > 99.181.67.60.1935: Flags [.], seq 143300:144614, ack 0, win 501, options [nop,nop,TS val 1581022656 ecr 3249499757], length 1314
22:57:51.469604 IP 99.181.67.60.1935 > 10.8.3.2.53402: Flags [.], ack 136971, win 126, options [nop,nop,TS val 3249499857 ecr 1581022356], length 0
22:57:51.471512 IP 10.8.3.2.53402 > 99.181.67.60.1935: Flags [.], seq 144614:145928, ack 0, win 501, options [nop,nop,TS val 1581022691 ecr 3249499857], length 1314
22:57:51.499586 IP 10.8.3.2.53402 > 99.181.67.60.1935: Flags [.], seq 145928:147242, ack 0, win 501, options [nop,nop,TS val 1581022719 ecr 3249499857], length 1314
22:57:51.566301 IP 99.181.67.60.1935 > 10.8.3.2.53402: Flags [.], ack 139599, win 126, options [nop,nop,TS val 3249499954 ecr 1581022423], length 0
22:57:51.578559 IP 10.8.3.2.53402 > 99.181.67.60.1935: Flags [.], seq 147242:148556, ack 0, win 501, options [nop,nop,TS val 1581022798 ecr 3249499954], length 1314
22:57:51.603462 IP 10.8.3.2.53402 > 99.181.67.60.1935: Flags [.], seq 148556:149870, ack 0, win 501, options [nop,nop,TS val 1581022823 ecr 3249499954], length 1314
22:57:51.640428 IP 99.181.67.60.1935 > 10.8.3.2.53402: Flags [.], ack 142227, win 126, options [nop,nop,TS val 3249500028 ecr 1581022523], length 0
22:57:51.642595 IP 10.8.3.2.53402 > 99.181.67.60.1935: Flags [.], seq 149870:151184, ack 0, win 501, options [nop,nop,TS val 1581022862 ecr 3249500028], length 1314
22:57:51.665617 IP 99.181.67.60.1935 > 10.8.3.2.53402: Flags [.], ack 143300, win 126, options [nop,nop,TS val 3249500053 ecr 1581022589], length 0
22:57:51.665668 IP 10.8.3.2.53402 > 99.181.67.60.1935: Flags [P.], seq 151184:151402, ack 0, win 501, options [nop,nop,TS val 1581022885 ecr 3249500053], length 218
22:57:51.706639 IP 10.8.3.2.53402 > 99.181.67.60.1935: Flags [.], seq 151402:152716, ack 0, win 501, options [nop,nop,TS val 1581022926 ecr 3249500053], length 1314
22:57:51.735804 IP 10.8.3.2.53402 > 99.181.67.60.1935: Flags [.], seq 152716:154030, ack 0, win 501, options [nop,nop,TS val 1581022955 ecr 3249500053], length 1314
22:57:51.767992 IP 99.181.67.60.1935 > 10.8.3.2.53402: Flags [.], ack 145928, win 126, options [nop,nop,TS val 3249500156 ecr 1581022656], length 0
22:57:51.792113 IP 10.8.3.2.53402 > 99.181.67.60.1935: Flags [.], seq 154030:155344, ack 0, win 501, options [nop,nop,TS val 1581023012 ecr 3249500156], length 1314
22:57:51.834766 IP 10.8.3.2.53402 > 99.181.67.60.1935: Flags [.], seq 155344:156658, ack 0, win 501, options [nop,nop,TS val 1581023054 ecr 3249500156], length 1314
22:57:51.860382 IP 99.181.67.60.1935 > 10.8.3.2.53402: Flags [.], ack 147242, win 126, options [nop,nop,TS val 3249500248 ecr 1581022719], length 0
22:57:51.877012 IP 10.8.3.2.53402 > 99.181.67.60.1935: Flags [.], seq 156658:157972, ack 0, win 501, options [nop,nop,TS val 1581023097 ecr 3249500248], length 1314
22:57:51.900033 IP 99.181.67.60.1935 > 10.8.3.2.53402: Flags [.], ack 149870, win 126, options [nop,nop,TS val 3249500288 ecr 1581022798], length 0
22:57:51.919797 IP 10.8.3.2.53402 > 99.181.67.60.1935: Flags [.], seq 157972:159286, ack 0, win 501, options [nop,nop,TS val 1581023139 ecr 3249500288], length 1314
22:57:51.961905 IP 99.181.67.60.1935 > 10.8.3.2.53402: Flags [.], ack 151402, win 126, options [nop,nop,TS val 3249500349 ecr 1581022862], length 0
22:57:51.961943 IP 10.8.3.2.53402 > 99.181.67.60.1935: Flags [P.], seq 159286:160268, ack 0, win 501, options [nop,nop,TS val 1581023182 ecr 3249500349], length 982
22:57:52.005657 IP 10.8.3.2.53402 > 99.181.67.60.1935: Flags [.], seq 160268:161582, ack 0, win 501, options [nop,nop,TS val 1581023225 ecr 3249500349], length 1314
22:57:52.032744 IP 99.181.67.60.1935 > 10.8.3.2.53402: Flags [.], ack 154030, win 126, options [nop,nop,TS val 3249500420 ecr 1581022926], length 0
22:57:52.037565 IP 10.8.3.2.53402 > 99.181.67.60.1935: Flags [.], seq 161582:162896, ack 0, win 501, options [nop,nop,TS val 1581023257 ecr 3249500420], length 1314
22:57:52.069958 IP 10.8.3.2.53402 > 99.181.67.60.1935: Flags [.], seq 162896:164210, ack 0, win 501, options [nop,nop,TS val 1581023290 ecr 3249500420], length 1314
22:57:52.130780 IP 99.181.67.60.1935 > 10.8.3.2.53402: Flags [.], ack 156658, win 126, options [nop,nop,TS val 3249500519 ecr 1581023012], length 0
22:57:52.133494 IP 10.8.3.2.53402 > 99.181.67.60.1935: Flags [.], seq 164210:165524, ack 0, win 501, options [nop,nop,TS val 1581023353 ecr 3249500519], length 1314
22:57:52.176295 IP 10.8.3.2.53402 > 99.181.67.60.1935: Flags [.], seq 165524:166838, ack 0, win 501, options [nop,nop,TS val 1581023396 ecr 3249500519], length 1314
22:57:52.204253 IP 10.8.3.2.53402 > 99.181.67.60.1935: Flags [.], seq 166838:168152, ack 0, win 501, options [nop,nop,TS val 1581023424 ecr 3249500519], length 1314
22:57:52.222762 IP 99.181.67.60.1935 > 10.8.3.2.53402: Flags [.], ack 159286, win 126, options [nop,nop,TS val 3249500608 ecr 1581023097], length 0
22:57:52.258201 IP 99.181.67.60.1935 > 10.8.3.2.53402: Flags [.], ack 160268, win 126, options [nop,nop,TS val 3249500646 ecr 1581023182], length 0
22:57:52.258213 IP 10.8.3.2.53402 > 99.181.67.60.1935: Flags [P.], seq 168152:169216, ack 0, win 501, options [nop,nop,TS val 1581023478 ecr 3249500646], length 1064
22:57:52.304055 IP 10.8.3.2.53402 > 99.181.67.60.1935: Flags [.], seq 169216:170530, ack 0, win 501, options [nop,nop,TS val 1581023524 ecr 3249500646], length 1314
22:57:52.333813 IP 99.181.67.60.1935 > 10.8.3.2.53402: Flags [.], ack 162896, win 126, options [nop,nop,TS val 3249500721 ecr 1581023225], length 0
22:57:52.336667 IP 10.8.3.2.53402 > 99.181.67.60.1935: Flags [.], seq 170530:171844, ack 0, win 501, options [nop,nop,TS val 1581023556 ecr 3249500721], length 1314
22:57:52.369945 IP 10.8.3.2.53402 > 99.181.67.60.1935: Flags [.], seq 171844:173158, ack 0, win 501, options [nop,nop,TS val 1581023590 ecr 3249500721], length 1314
22:57:52.429719 IP 99.181.67.60.1935 > 10.8.3.2.53402: Flags [.], ack 165524, win 126, options [nop,nop,TS val 3249500817 ecr 1581023290], length 0
22:57:52.437485 IP 10.8.3.2.53402 > 99.181.67.60.1935: Flags [.], seq 173158:174472, ack 0, win 501, options [nop,nop,TS val 1581023657 ecr 3249500817], length 1314
22:57:52.475708 IP 10.8.3.2.53402 > 99.181.67.60.1935: Flags [.], seq 174472:175786, ack 0, win 501, options [nop,nop,TS val 1581023695 ecr 3249500817], length 1314
22:57:52.501906 IP 99.181.67.60.1935 > 10.8.3.2.53402: Flags [.], ack 168152, win 126, options [nop,nop,TS val 3249500888 ecr 1581023396], length 0
22:57:52.503840 IP 10.8.3.2.53402 > 99.181.67.60.1935: Flags [.], seq 175786:177100, ack 0, win 501, options [nop,nop,TS val 1581023724 ecr 3249500888], length 1314
22:57:52.554639 IP 99.181.67.60.1935 > 10.8.3.2.53402: Flags [.], ack 169216, win 126, options [nop,nop,TS val 3249500942 ecr 1581023478], length 0
22:57:52.554658 IP 10.8.3.2.53402 > 99.181.67.60.1935: Flags [P.], seq 177100:178169, ack 0, win 501, options [nop,nop,TS val 1581023774 ecr 3249500942], length 1069
22:57:52.603757 IP 10.8.3.2.53402 > 99.181.67.60.1935: Flags [.], seq 178169:179483, ack 0, win 501, options [nop,nop,TS val 1581023823 ecr 3249500942], length 1314
22:57:52.633150 IP 99.181.67.60.1935 > 10.8.3.2.53402: Flags [.], ack 171844, win 126, options [nop,nop,TS val 3249501021 ecr 1581023524], length 0
22:57:52.646632 IP 10.8.3.2.53402 > 99.181.67.60.1935: Flags [.], seq 179483:180797, ack 0, win 501, options [nop,nop,TS val 1581023866 ecr 3249501021], length 1314
22:57:52.668390 IP 10.8.3.2.53402 > 99.181.67.60.1935: Flags [.], seq 180797:182111, ack 0, win 501, options [nop,nop,TS val 1581023888 ecr 3249501021], length 1314
22:57:52.734058 IP 99.181.67.60.1935 > 10.8.3.2.53402: Flags [.], ack 174472, win 126, options [nop,nop,TS val 3249501122 ecr 1581023590], length 0
22:57:52.735751 IP 10.8.3.2.53402 > 99.181.67.60.1935: Flags [.], seq 182111:183425, ack 0, win 501, options [nop,nop,TS val 1581023955 ecr 3249501122], length 1314
22:57:52.775070 IP 10.8.3.2.53402 > 99.181.67.60.1935: Flags [.], seq 183425:184739, ack 0, win 501, options [nop,nop,TS val 1581023995 ecr 3249501122], length 1314
22:57:52.800244 IP 99.181.67.60.1935 > 10.8.3.2.53402: Flags [.], ack 177100, win 126, options [nop,nop,TS val 3249501188 ecr 1581023695], length 0
22:57:52.801704 IP 10.8.3.2.53402 > 99.181.67.60.1935: Flags [.], seq 184739:186053, ack 0, win 501, options [nop,nop,TS val 1581024021 ecr 3249501188], length 1314
22:57:52.851082 IP 99.181.67.60.1935 > 10.8.3.2.53402: Flags [.], ack 178169, win 126, options [nop,nop,TS val 3249501239 ecr 1581023774], length 0
22:57:52.851103 IP 10.8.3.2.53402 > 99.181.67.60.1935: Flags [P.], seq 186053:187130, ack 0, win 501, options [nop,nop,TS val 1581024071 ecr 3249501239], length 1077
22:57:52.903583 IP 10.8.3.2.53402 > 99.181.67.60.1935: Flags [.], seq 187130:188444, ack 0, win 501, options [nop,nop,TS val 1581024123 ecr 3249501239], length 1314
22:57:52.942895 IP 99.181.67.60.1935 > 10.8.3.2.53402: Flags [.], ack 180797, win 126, options [nop,nop,TS val 3249501331 ecr 1581023823], length 0
22:57:52.946525 IP 10.8.3.2.53402 > 99.181.67.60.1935: Flags [.], seq 188444:189758, ack 0, win 501, options [nop,nop,TS val 1581024166 ecr 3249501331], length 1314
22:57:52.968142 IP 10.8.3.2.53402 > 99.181.67.60.1935: Flags [.], seq 189758:191072, ack 0, win 501, options [nop,nop,TS val 1581024188 ecr 3249501331], length 1314
22:57:53.033355 IP 99.181.67.60.1935 > 10.8.3.2.53402: Flags [.], ack 183425, win 126, options [nop,nop,TS val 3249501420 ecr 1581023888], length 0
22:57:53.033691 IP 10.8.3.2.53402 > 99.181.67.60.1935: Flags [.], seq 191072:192386, ack 0, win 501, options [nop,nop,TS val 1581024253 ecr 3249501420], length 1314
22:57:53.074243 IP 10.8.3.2.53402 > 99.181.67.60.1935: Flags [.], seq 192386:193700, ack 0, win 501, options [nop,nop,TS val 1581024294 ecr 3249501420], length 1314
22:57:53.098046 IP 99.181.67.60.1935 > 10.8.3.2.53402: Flags [.], ack 186053, win 126, options [nop,nop,TS val 3249501486 ecr 1581023995], length 0
22:57:53.100664 IP 10.8.3.2.53402 > 99.181.67.60.1935: Flags [.], seq 193700:195014, ack 0, win 501, options [nop,nop,TS val 1581024320 ecr 3249501486], length 1314
22:57:53.147676 IP 99.181.67.60.1935 > 10.8.3.2.53402: Flags [.], ack 187130, win 126, options [nop,nop,TS val 3249501535 ecr 1581024071], length 0
22:57:53.147716 IP 10.8.3.2.53402 > 99.181.67.60.1935: Flags [P.], seq 195014:196074, ack 0, win 501, options [nop,nop,TS val 1581024367 ecr 3249501535], length 1060
22:57:53.203561 IP 10.8.3.2.53402 > 99.181.67.60.1935: Flags [.], seq 196074:197388, ack 0, win 501, options [nop,nop,TS val 1581024423 ecr 3249501535], length 1314
22:57:53.244031 IP 99.181.67.60.1935 > 10.8.3.2.53402: Flags [.], ack 189758, win 126, options [nop,nop,TS val 3249501631 ecr 1581024123], length 0
22:57:53.245542 IP 10.8.3.2.53402 > 99.181.67.60.1935: Flags [.], seq 197388:198702, ack 0, win 501, options [nop,nop,TS val 1581024465 ecr 3249501631], length 1314
22:57:53.269396 IP 10.8.3.2.53402 > 99.181.67.60.1935: Flags [.], seq 198702:200016, ack 0, win 501, options [nop,nop,TS val 1581024489 ecr 3249501631], length 1314
22:57:53.332322 IP 99.181.67.60.1935 > 10.8.3.2.53402: Flags [.], ack 192386, win 126, options [nop,nop,TS val 3249501720 ecr 1581024188], length 0
22:57:53.336698 IP 10.8.3.2.53402 > 99.181.67.60.1935: Flags [.], seq 200016:201330, ack 0, win 501, options [nop,nop,TS val 1581024556 ecr 3249501720], length 1314
22:57:53.374692 IP 10.8.3.2.53402 > 99.181.67.60.1935: Flags [.], seq 201330:202644, ack 0, win 501, options [nop,nop,TS val 1581024594 ecr 3249501720], length 1314
22:57:53.397587 IP 99.181.67.60.1935 > 10.8.3.2.53402: Flags [.], ack 195014, win 126, options [nop,nop,TS val 3249501785 ecr 1581024294], length 0
22:57:53.403266 IP 10.8.3.2.53402 > 99.181.67.60.1935: Flags [.], seq 202644:203958, ack 0, win 501, options [nop,nop,TS val 1581024623 ecr 3249501785], length 1314
22:57:53.444074 IP 99.181.67.60.1935 > 10.8.3.2.53402: Flags [.], ack 196074, win 126, options [nop,nop,TS val 3249501831 ecr 1581024367], length 0
22:57:53.444123 IP 10.8.3.2.53402 > 99.181.67.60.1935: Flags [P.], seq 203958:205035, ack 0, win 501, options [nop,nop,TS val 1581024664 ecr 3249501831], length 1077
22:57:53.503058 IP 10.8.3.2.53402 > 99.181.67.60.1935: Flags [.], seq 205035:206349, ack 0, win 501, options [nop,nop,TS val 1581024723 ecr 3249501831], length 1314
22:57:53.541802 IP 99.181.67.60.1935 > 10.8.3.2.53402: Flags [.], ack 198702, win 126, options [nop,nop,TS val 3249501929 ecr 1581024423], length 0
22:57:53.545614 IP 10.8.3.2.53402 > 99.181.67.60.1935: Flags [.], seq 206349:207663, ack 0, win 501, options [nop,nop,TS val 1581024765 ecr 3249501929], length 1314
22:57:53.569496 IP 10.8.3.2.53402 > 99.181.67.60.1935: Flags [.], seq 207663:208977, ack 0, win 501, options [nop,nop,TS val 1581024789 ecr 3249501929], length 1314
22:57:53.633330 IP 99.181.67.60.1935 > 10.8.3.2.53402: Flags [.], ack 201330, win 126, options [nop,nop,TS val 3249502021 ecr 1581024489], length 0
22:57:53.634679 IP 10.8.3.2.53402 > 99.181.67.60.1935: Flags [.], seq 208977:210291, ack 0, win 501, options [nop,nop,TS val 1581024854 ecr 3249502021], length 1314
22:57:53.674578 IP 10.8.3.2.53402 > 99.181.67.60.1935: Flags [.], seq 210291:211605, ack 0, win 501, options [nop,nop,TS val 1581024894 ecr 3249502021], length 1314
