21:19:30.215928 IP 10.8.1.4.58920 > 185.42.204.162.1935: Flags [.], seq 1288830484:1288831798, ack 970609431, win 501, options [nop,nop,TS val 2133053579 ecr 2575526187], length 1314
21:19:30.240887 IP 10.8.1.4.58920 > 185.42.204.162.1935: Flags [.], seq 1314:2628, ack 1, win 501, options [nop,nop,TS val 2133053604 ecr 2575526187], length 1314
21:19:30.255417 IP 185.42.204.162.1935 > 10.8.1.4.58920: Flags [.], ack 4294960131, win 126, options [nop,nop,TS val 2575526284 ecr 2133053237], length 0
21:19:30.307226 IP 10.8.1.4.58920 > 185.42.204.162.1935: Flags [.], seq 2628:3942, ack 1, win 501, options [nop,nop,TS val 2133053671 ecr 2575526284], length 1314
21:19:30.312161 IP 185.42.204.162.1935 > 10.8.1.4.58920: Flags [.], ack 4294962040, win 126, options [nop,nop,TS val 2575526341 ecr 2133053343], length 0
21:19:30.312195 IP 10.8.1.4.58920 > 185.42.204.162.1935: Flags [P.], seq 3942:4647, ack 1, win 501, options [nop,nop,TS val 2133053676 ecr 2575526341], length 705
21:19:30.374037 IP 10.8.1.4.58920 > 185.42.204.162.1935: Flags [.], seq 4647:5961, ack 1, win 501, options [nop,nop,TS val 2133053737 ecr 2575526341], length 1314
21:19:30.394029 IP 185.42.204.162.1935 > 10.8.1.4.58920: Flags [.], ack 4294964668, win 126, options [nop,nop,TS val 2575526423 ecr 2133053407], length 0
21:19:30.409120 IP 10.8.1.4.58920 > 185.42.204.162.1935: Flags [.], seq 5961:7275, ack 1, win 501, options [nop,nop,TS val 2133053772 ecr 2575526423], length 1314
21:19:30.439953 IP 10.8.1.4.58920 > 185.42.204.162.1935: Flags [.], seq 7275:8589, ack 1, win 501, options [nop,nop,TS val 2133053803 ecr 2575526423], length 1314
21:19:30.492285 IP 185.42.204.162.1935 > 10.8.1.4.58920: Flags [.], ack 0, win 126, options [nop,nop,TS val 2575526521 ecr 2133053472], length 0
21:19:30.516296 IP 10.8.1.4.58920 > 185.42.204.162.1935: Flags [.], seq 8589:9903, ack 1, win 501, options [nop,nop,TS val 2133053880 ecr 2575526521], length 1314
21:19:30.539455 IP 10.8.1.4.58920 > 185.42.204.162.1935: Flags [.], seq 9903:11217, ack 1, win 501, options [nop,nop,TS val 2133053903 ecr 2575526521], length 1314
21:19:30.558924 IP 185.42.204.162.1935 > 10.8.1.4.58920: Flags [.], ack 2628, win 126, options [nop,nop,TS val 2575526588 ecr 2133053579], length 0
21:19:30.572746 IP 10.8.1.4.58920 > 185.42.204.162.1935: Flags [.], seq 11217:12531, ack 1, win 501, options [nop,nop,TS val 2133053936 ecr 2575526588], length 1314
21:19:30.629874 IP 185.42.204.162.1935 > 10.8.1.4.58920: Flags [.], ack 4647, win 126, options [nop,nop,TS val 2575526658 ecr 2133053671], length 0
21:19:30.629915 IP 10.8.1.4.58920 > 185.42.204.162.1935: Flags [P.], seq 12531:13786, ack 1, win 501, options [nop,nop,TS val 2133053993 ecr 2575526658], length 1255
21:19:30.666566 IP 10.8.1.4.58920 > 185.42.204.162.1935: Flags [.], seq 13786:15100, ack 1, win 501, options [nop,nop,TS val 2133054030 ecr 2575526658], length 1314
21:19:30.704897 IP 10.8.1.4.58920 > 185.42.204.162.1935: Flags [.], seq 15100:16414, ack 1, win 501, options [nop,nop,TS val 2133054068 ecr 2575526658], length 1314
21:19:30.726674 IP 185.42.204.162.1935 > 10.8.1.4.58920: Flags [.], ack 7275, win 126, options [nop,nop,TS val 2575526755 ecr 2133053737], length 0
21:19:30.751530 IP 10.8.1.4.58920 > 185.42.204.162.1935: Flags [.], seq 16414:17728, ack 1, win 501, options [nop,nop,TS val 2133054115 ecr 2575526755], length 1314
21:19:30.805676 IP 10.8.1.4.58920 > 185.42.204.162.1935: Flags [.], seq 17728:19042, ack 1, win 501, options [nop,nop,TS val 2133054169 ecr 2575526755], length 1314
21:19:30.825881 IP 185.42.204.162.1935 > 10.8.1.4.58920: Flags [.], ack 8589, win 126, options [nop,nop,TS val 2575526854 ecr 2133053803], length 0
21:19:30.836926 IP 10.8.1.4.58920 > 185.42.204.162.1935: Flags [.], seq 19042:20356, ack 1, win 501, options [nop,nop,TS val 2133054200 ecr 2575526854], length 1314
21:19:30.857289 IP 185.42.204.162.1935 > 10.8.1.4.58920: Flags [.], ack 11217, win 126, options [nop,nop,TS val 2575526886 ecr 2133053880], length 0
21:19:30.879530 IP 10.8.1.4.58920 > 185.42.204.162.1935: Flags [.], seq 20356:21670, ack 1, win 501, options [nop,nop,TS val 2133054243 ecr 2575526886], length 1314
21:19:30.939035 IP 10.8.1.4.58920 > 185.42.204.162.1935: Flags [.], seq 21670:22984, ack 1, win 501, options [nop,nop,TS val 2133054302 ecr 2575526886], length 1314
21:19:30.947775 IP 185.42.204.162.1935 > 10.8.1.4.58920: Flags [.], ack 13786, win 126, options [nop,nop,TS val 2575526976 ecr 2133053936], length 0
21:19:30.947797 IP 10.8.1.4.58920 > 185.42.204.162.1935: Flags [P.], seq 22984:23685, ack 1, win 501, options [nop,nop,TS val 2133054311 ecr 2575526976], length 701
21:19:31.005836 IP 10.8.1.4.58920 > 185.42.204.162.1935: Flags [.], seq 23685:24999, ack 1, win 501, options [nop,nop,TS val 2133054369 ecr 2575526976], length 1314
21:19:31.023585 IP 185.42.204.162.1935 > 10.8.1.4.58920: Flags [.], ack 16414, win 126, options [nop,nop,TS val 2575527051 ecr 2133054030], length 0
21:19:31.039311 IP 10.8.1.4.58920 > 185.42.204.162.1935: Flags [.], seq 24999:26313, ack 1, win 501, options [nop,nop,TS val 2133054403 ecr 2575527051], length 1314
21:19:31.072199 IP 10.8.1.4.58920 > 185.42.204.162.1935: Flags [.], seq 26313:27627, ack 1, win 501, options [nop,nop,TS val 2133054436 ecr 2575527051], length 1314
21:19:31.123386 IP 185.42.204.162.1935 > 10.8.1.4.58920: Flags [.], ack 19042, win 126, options [nop,nop,TS val 2575527152 ecr 2133054115], length 0
21:19:31.136198 IP 10.8.1.4.58920 > 185.42.204.162.1935: Flags [.], seq 27627:28941, ack 1, win 501, options [nop,nop,TS val 2133054499 ecr 2575527152], length 1314
21:19:31.174347 IP 10.8.1.4.58920 > 185.42.204.162.1935: Flags [.], seq 28941:30255, ack 1, win 501, options [nop,nop,TS val 2133054538 ecr 2575527152], length 1314
21:19:31.197361 IP 185.42.204.162.1935 > 10.8.1.4.58920: Flags [.], ack 21670, win 126, options [nop,nop,TS val 2575527226 ecr 2133054200], length 0
21:19:31.206022 IP 10.8.1.4.58920 > 185.42.204.162.1935: Flags [.], seq 30255:31569, ack 1, win 501, options [nop,nop,TS val 2133054569 ecr 2575527226], length 1314
21:19:31.265607 IP 185.42.204.162.1935 > 10.8.1.4.58920: Flags [.], ack 23685, win 126, options [nop,nop,TS val 2575527294 ecr 2133054302], length 0
21:19:31.265657 IP 10.8.1.4.58920 > 185.42.204.162.1935: Flags [P.], seq 31569:32737, ack 1, win 501, options [nop,nop,TS val 2133054629 ecr 2575527294], length 1168
21:19:31.307911 IP 10.8.1.4.58920 > 185.42.204.162.1935: Flags [.], seq 32737:34051, ack 1, win 501, options [nop,nop,TS val 2133054671 ecr 2575527294], length 1314
21:19:31.340638 IP 10.8.1.4.58920 > 185.42.204.162.1935: Flags [.], seq 34051:35365, ack 1, win 501, options [nop,nop,TS val 2133054704 ecr 2575527294], length 1314
21:19:31.357168 IP 185.42.204.162.1935 > 10.8.1.4.58920: Flags [.], ack 26313, win 126, options [nop,nop,TS val 2575527386 ecr 2133054369], length 0
21:19:31.393418 IP 10.8.1.4.58920 > 185.42.204.162.1935: Flags [.], seq 35365:36679, ack 1, win 501, options [nop,nop,TS val 2133054757 ecr 2575527386], length 1314
21:19:31.436037 IP 10.8.1.4.58920 > 185.42.204.162.1935: Flags [.], seq 36679:37993, ack 1, win 501, options [nop,nop,TS val 2133054799 ecr 2575527386], length 1314
21:19:31.453856 IP 185.42.204.162.1935 > 10.8.1.4.58920: Flags [.], ack 28941, win 126, options [nop,nop,TS val 2575527483 ecr 2133054436], length 0
21:19:31.472626 IP 10.8.1.4.58920 > 185.42.204.162.1935: Flags [.], seq 37993:39307, ack 1, win 501, options [nop,nop,TS val 2133054836 ecr 2575527483], length 1314
21:19:31.521073 IP 10.8.1.4.58920 > 185.42.204.162.1935: Flags [.], seq 39307:40621, ack 1, win 501, options [nop,nop,TS val 2133054884 ecr 2575527483], length 1314
21:19:31.523732 IP 185.42.204.162.1935 > 10.8.1.4.58920: Flags [.], ack 31569, win 126, options [nop,nop,TS val 2575527552 ecr 2133054538], length 0
21:19:31.574771 IP 10.8.1.4.58920 > 185.42.204.162.1935: Flags [.], seq 40621:41935, ack 1, win 501, options [nop,nop,TS val 2133054938 ecr 2575527552], length 1314
21:19:31.583498 IP 185.42.204.162.1935 > 10.8.1.4.58920: Flags [.], ack 32737, win 126, options [nop,nop,TS val 2575527612 ecr 2133054629], length 0
21:19:31.583529 IP 10.8.1.4.58920 > 185.42.204.162.1935: Flags [P.], seq 41935:42531, ack 1, win 501, options [nop,nop,TS val 2133054947 ecr 2575527612], length 596
21:19:31.640086 IP 10.8.1.4.58920 > 185.42.204.162.1935: Flags [.], seq 42531:43845, ack 1, win 501, options [nop,nop,TS val 2133055003 ecr 2575527612], length 1314
21:19:31.658590 IP 185.42.204.162.1935 > 10.8.1.4.58920: Flags [.], ack 35365, win 126, options [nop,nop,TS val 2575527687 ecr 2133054671], length 0
21:19:31.671157 IP 10.8.1.4.58920 > 185.42.204.162.1935: Flags [.], seq 43845:45159, ack 1, win 501, options [nop,nop,TS val 2133055034 ecr 2575527687], length 1314
21:19:31.708913 IP 10.8.1.4.58920 > 185.42.204.162.1935: Flags [.], seq 45159:46473, ack 1, win 501, options [nop,nop,TS val 2133055072 ecr 2575527687], length 1314
21:19:31.753743 IP 185.42.204.162.1935 > 10.8.1.4.58920: Flags [.], ack 37993, win 126, options [nop,nop,TS val 2575527782 ecr 2133054757], length 0
21:19:31.773520 IP 10.8.1.4.58920 > 185.42.204.162.1935: Flags [.], seq 46473:47787, ack 1, win 501, options [nop,nop,TS val 2133055137 ecr 2575527782], length 1314
21:19:31.807611 IP 10.8.1.4.58920 > 185.42.204.162.1935: Flags [.], seq 47787:49101, ack 1, win 501, options [nop,nop,TS val 2133055171 ecr 2575527782], length 1314
21:19:31.838851 IP 185.42.204.162.1935 > 10.8.1.4.58920: Flags [.], ack 40621, win 126, options [nop,nop,TS val 2575527867 ecr 2133054836], length 0
21:19:31.841541 IP 10.8.1.4.58920 > 185.42.204.162.1935: Flags [.], seq 49101:50415, ack 1, win 501, options [nop,nop,TS val 2133055205 ecr 2575527867], length 1314
21:19:31.901504 IP 185.42.204.162.1935 > 10.8.1.4.58920: Flags [.], ack 42531, win 126, options [nop,nop,TS val 2575527930 ecr 2133054938], length 0
21:19:31.901532 IP 10.8.1.4.58920 > 185.42.204.162.1935: Flags [P.], seq 50415:51587, ack 1, win 501, options [nop,nop,TS val 2133055265 ecr 2575527930], length 1172
21:19:31.941684 IP 10.8.1.4.58920 > 185.42.204.162.1935: Flags [.], seq 51587:52901, ack 1, win 501, options [nop,nop,TS val 2133055305 ecr 2575527930], length 1314
21:19:31.970690 IP 10.8.1.4.58920 > 185.42.204.162.1935: Flags [.], seq 52901:54215, ack 1, win 501, options [nop,nop,TS val 2133055334 ecr 2575527930], length 1314
21:19:31.988926 IP 185.42.204.162.1935 > 10.8.1.4.58920: Flags [.], ack 45159, win 126, options [nop,nop,TS val 2575528018 ecr 2133055003], length 0
21:19:32.013287 IP 10.8.1.4.58920 > 185.42.204.162.1935: Flags [.], seq 54215:55529, ack 1, win 501, options [nop,nop,TS val 2133055377 ecr 2575528018], length 1314
21:19:32.073957 IP 10.8.1.4.58920 > 185.42.204.162.1935: Flags [.], seq 55529:56843, ack 1, win 501, options [nop,nop,TS val 2133055437 ecr 2575528018], length 1314
21:19:32.091173 IP 185.42.204.162.1935 > 10.8.1.4.58920: Flags [.], ack 47787, win 126, options [nop,nop,TS val 2575528120 ecr 2133055072], length 0
21:19:32.107280 IP 10.8.1.4.58920 > 185.42.204.162.1935: Flags [.], seq 56843:58157, ack 1, win 501, options [nop,nop,TS val 2133055471 ecr 2575528120], length 1314
21:19:32.141565 IP 10.8.1.4.58920 > 185.42.204.162.1935: Flags [.], seq 58157:59471, ack 1, win 501, options [nop,nop,TS val 2133055505 ecr 2575528120], length 1314
21:19:32.159381 IP 185.42.204.162.1935 > 10.8.1.4.58920: Flags [.], ack 50415, win 126, options [nop,nop,TS val 2575528188 ecr 2133055171], length 0
21:19:32.206232 IP 10.8.1.4.58920 > 185.42.204.162.1935: Flags [.], seq 59471:60785, ack 1, win 501, options [nop,nop,TS val 2133055570 ecr 2575528188], length 1314
21:19:32.219179 IP 185.42.204.162.1935 > 10.8.1.4.58920: Flags [.], ack 51587, win 126, options [nop,nop,TS val 2575528248 ecr 2133055265], length 0
21:19:32.219224 IP 10.8.1.4.58920 > 185.42.204.162.1935: Flags [P.], seq 60785:61482, ack 1, win 501, options [nop,nop,TS val 2133055583 ecr 2575528248], length 697
21:19:32.270845 IP 10.8.1.4.58920 > 185.42.204.162.1935: Flags [.], seq 61482:62796, ack 1, win 501, options [nop,nop,TS val 2133055634 ecr 2575528248], length 1314
21:19:32.288434 IP 185.42.204.162.1935 > 10.8.1.4.58920: Flags [.], ack 54215, win 126, options [nop,nop,TS val 2575528317 ecr 2133055305], length 0
21:19:32.307847 IP 10.8.1.4.58920 > 185.42.204.162.1935: Flags [.], seq 62796:64110, ack 1, win 501, options [nop,nop,TS val 2133055671 ecr 2575528317], length 1314
21:19:32.341123 IP 10.8.1.4.58920 > 185.42.204.162.1935: Flags [.], seq 64110:65424, ack 1, win 501, options [nop,nop,TS val 2133055704 ecr 2575528317], length 1314
21:19:32.391600 IP 185.42.204.162.1935 > 10.8.1.4.58920: Flags [.], ack 56843, win 126, options [nop,nop,TS val 2575528420 ecr 2133055377], length 0
21:19:32.405102 IP 10.8.1.4.58920 > 185.42.204.162.1935: Flags [.], seq 65424:66738, ack 1, win 501, options [nop,nop,TS val 2133055768 ecr 2575528420], length 1314
21:19:32.440578 IP 10.8.1.4.58920 > 185.42.204.162.1935: Flags [.], seq 66738:68052, ack 1, win 501, options [nop,nop,TS val 2133055804 ecr 2575528420], length 1314
21:19:32.459350 IP 185.42.204.162.1935 > 10.8.1.4.58920: Flags [.], ack 59471, win 126, options [nop,nop,TS val 2575528488 ecr 2133055471], length 0
21:19:32.474445 IP 10.8.1.4.58920 > 185.42.204.162.1935: Flags [.], seq 68052:69366, ack 1, win 501, options [nop,nop,TS val 2133055838 ecr 2575528488], length 1314
21:19:32.537137 IP 185.42.204.162.1935 > 10.8.1.4.58920: Flags [.], ack 61482, win 126, options [nop,nop,TS val 2575528566 ecr 2133055570], length 0
21:19:32.537230 IP 10.8.1.4.58920 > 185.42.204.162.1935: Flags [P.], seq 69366:70530, ack 1, win 501, options [nop,nop,TS val 2133055901 ecr 2575528566], length 1164
21:19:32.570889 IP 10.8.1.4.58920 > 185.42.204.162.1935: Flags [.], seq 70530:71844, ack 1, win 501, options [nop,nop,TS val 2133055934 ecr 2575528566], length 1314
21:19:32.607766 IP 10.8.1.4.58920 > 185.42.204.162.1935: Flags [.], seq 71844:73158, ack 1, win 501, options [nop,nop,TS val 2133055971 ecr 2575528566], length 1314
21:19:32.625719 IP 185.42.204.162.1935 > 10.8.1.4.58920: Flags [.], ack 64110, win 126, options [nop,nop,TS val 2575528654 ecr 2133055634], length 0
21:19:32.656746 IP 10.8.1.4.58920 > 185.42.204.162.1935: Flags [.], seq 73158:74472, ack 1, win 501, options [nop,nop,TS val 2133056020 ecr 2575528654], length 1314
21:19:32.706754 IP 10.8.1.4.58920 > 185.42.204.162.1935: Flags [.], seq 74472:75786, ack 1, win 501, options [nop,nop,TS val 2133056070 ecr 2575528654], length 1314
21:19:32.723180 IP 185.42.204.162.1935 > 10.8.1.4.58920: Flags [.], ack 66738, win 126, options [nop,nop,TS val 2575528752 ecr 2133055704], length 0
21:19:32.741116 IP 10.8.1.4.58920 > 185.42.204.162.1935: Flags [.], seq 75786:77100, ack 1, win 501, options [nop,nop,TS val 2133056104 ecr 2575528752], length 1314
21:19:32.785397 IP 10.8.1.4.58920 > 185.42.204.162.1935: Flags [.], seq 77100:78414, ack 1, win 501, options [nop,nop,TS val 2133056149 ecr 2575528752], length 1314
21:19:32.792172 IP 185.42.204.162.1935 > 10.8.1.4.58920: Flags [.], ack 69366, win 126, options [nop,nop,TS val 2575528821 ecr 2133055804], length 0
21:19:32.840877 IP 10.8.1.4.58920 > 185.42.204.162.1935: Flags [.], seq 78414:79728, ack 1, win 501, options [nop,nop,TS val 2133056204 ecr 2575528821], length 1314
21:19:32.854988 IP 185.42.204.162.1935 > 10.8.1.4.58920: Flags [.], ack 70530, win 126, options [nop,nop,TS val 2575528884 ecr 2133055901], length 0
21:19:32.855021 IP 10.8.1.4.58920 > 185.42.204.162.1935: Flags [P.], seq 79728:80433, ack 1, win 501, options [nop,nop,TS val 2133056218 ecr 2575528884], length 705
21:19:32.907371 IP 10.8.1.4.58920 > 185.42.204.162.1935: Flags [.], seq 80433:81747, ack 1, win 501, options [nop,nop,TS val 2133056271 ecr 2575528884], length 1314
21:19:32.925587 IP 185.42.204.162.1935 > 10.8.1.4.58920: Flags [.], ack 73158, win 126, options [nop,nop,TS val 2575528954 ecr 2133055934], length 0
21:19:32.938894 IP 10.8.1.4.58920 > 185.42.204.162.1935: Flags [.], seq 81747:83061, ack 1, win 501, options [nop,nop,TS val 2133056302 ecr 2575528954], length 1314
21:19:32.977979 IP 10.8.1.4.58920 > 185.42.204.162.1935: Flags [.], seq 83061:84375, ack 1, win 501, options [nop,nop,TS val 2133056341 ecr 2575528954], length 1314
21:19:33.024602 IP 185.42.204.162.1935 > 10.8.1.4.58920: Flags [.], ack 75786, win 126, options [nop,nop,TS val 2575529053 ecr 2133056020], length 0
21:19:33.036698 IP 10.8.1.4.58920 > 185.42.204.162.1935: Flags [.], seq 84375:85689, ack 1, win 501, options [nop,nop,TS val 2133056400 ecr 2575529053], length 1314
21:19:33.070593 IP 10.8.1.4.58920 > 185.42.204.162.1935: Flags [.], seq 85689:87003, ack 1, win 501, options [nop,nop,TS val 2133056434 ecr 2575529053], length 1314
21:19:33.103265 IP 185.42.204.162.1935 > 10.8.1.4.58920: Flags [.], ack 78414, win 126, options [nop,nop,TS val 2575529132 ecr 2133056104], length 0
21:19:33.107830 IP 10.8.1.4.58920 > 185.42.204.162.1935: Flags [.], seq 87003:88317, ack 1, win 501, options [nop,nop,TS val 2133056471 ecr 2575529132], length 1314
21:19:33.172864 IP 185.42.204.162.1935 > 10.8.1.4.58920: Flags [.], ack 80433, win 126, options [nop,nop,TS val 2575529201 ecr 2133056204], length 0
21:19:33.172898 IP 10.8.1.4.58920 > 185.42.204.162.1935: Flags [P.], seq 88317:89469, ack 1, win 501, options [nop,nop,TS val 2133056536 ecr 2575529201], length 1152
21:19:33.207562 IP 10.8.1.4.58920 > 185.42.204.162.1935: Flags [.], seq 89469:90783, ack 1, win 501, options [nop,nop,TS val 2133056571 ecr 2575529201], length 1314
21:19:33.240922 IP 10.8.1.4.58920 > 185.42.204.162.1935: Flags [.], seq 90783:92097, ack 1, win 501, options [nop,nop,TS val 2133056604 ecr 2575529201], length 1314
21:19:33.256642 IP 185.42.204.162.1935 > 10.8.1.4.58920: Flags [.], ack 83061, win 126, options [nop,nop,TS val 2575529285 ecr 2133056271], length 0
21:19:33.299451 IP 10.8.1.4.58920 > 185.42.204.162.1935: Flags [.], seq 92097:93411, ack 1, win 501, options [nop,nop,TS val 2133056663 ecr 2575529285], length 1314
21:19:33.339437 IP 10.8.1.4.58920 > 185.42.204.162.1935: Flags [.], seq 93411:94725, ack 1, win 501, options [nop,nop,TS val 2133056703 ecr 2575529285], length 1314
21:19:33.354602 IP 185.42.204.162.1935 > 10.8.1.4.58920: Flags [.], ack 85689, win 126, options [nop,nop,TS val 2575529383 ecr 2133056341], length 0
21:19:33.373972 IP 10.8.1.4.58920 > 185.42.204.162.1935: Flags [.], seq 94725:96039, ack 1, win 501, options [nop,nop,TS val 2133056737 ecr 2575529383], length 1314
21:19:33.425582 IP 185.42.204.162.1935 > 10.8.1.4.58920: Flags [.], ack 88317, win 126, options [nop,nop,TS val 2575529454 ecr 2133056434], length 0
21:19:33.428033 IP 10.8.1.4.58920 > 185.42.204.162.1935: Flags [.], seq 96039:97353, ack 1, win 501, options [nop,nop,TS val 2133056791 ecr 2575529454], length 1314
21:19:33.474373 IP 10.8.1.4.58920 > 185.42.204.162.1935: Flags [.], seq 97353:98667, ack 1, win 501, options [nop,nop,TS val 2133056838 ecr 2575529454], length 1314
21:19:33.490619 IP 185.42.204.162.1935 > 10.8.1.4.58920: Flags [.], ack 89469, win 126, options [nop,nop,TS val 2575529519 ecr 2133056536], length 0
21:19:33.490654 IP 10.8.1.4.58920 > 185.42.204.162.1935: Flags [P.], seq 98667:99278, ack 1, win 501, options [nop,nop,TS val 2133056854 ecr 2575529519], length 611
21:19:33.540938 IP 10.8.1.4.58920 > 185.42.204.162.1935: Flags [.], seq 99278:100592, ack 1, win 501, options [nop,nop,TS val 2133056904 ecr 2575529519], length 1314
21:19:33.558848 IP 185.42.204.162.1935 > 10.8.1.4.58920: Flags [.], ack 92097, win 126, options [nop,nop,TS val 2575529587 ecr 2133056571], length 0
21:19:33.573999 IP 10.8.1.4.58920 > 185.42.204.162.1935: Flags [.], seq 100592:101906, ack 1, win 501, options [nop,nop,TS val 2133056937 ecr 2575529587], length 1314
21:19:33.607324 IP 10.8.1.4.58920 > 185.42.204.162.1935: Flags [.], seq 101906:103220, ack 1, win 501, options [nop,nop,TS val 2133056971 ecr 2575529587], length 1314
21:19:33.657503 IP 185.42.204.162.1935 > 10.8.1.4.58920: Flags [.], ack 94725, win 126, options [nop,nop,TS val 2575529686 ecr 2133056663], length 0
21:19:33.674114 IP 10.8.1.4.58920 > 185.42.204.162.1935: Flags [.], seq 103220:104534, ack 1, win 501, options [nop,nop,TS val 2133057037 ecr 2575529686], length 1314
21:19:33.707806 IP 10.8.1.4.58920 > 185.42.204.162.1935: Flags [.], seq 104534:105848, ack 1, win 501, options [nop,nop,TS val 2133057071 ecr 2575529686], length 1314
21:19:33.740882 IP 10.8.1.4.58920 > 185.42.204.162.1935: Flags [.], seq 105848:107162, ack 1, win 501, options [nop,nop,TS val 2133057104 ecr 2575529686], length 1314
21:19:33.745985 IP 185.42.204.162.1935 > 10.8.1.4.58920: Flags [.], ack 97353, win 126, options [nop,nop,TS val 2575529774 ecr 2133056737], length 0
21:19:33.807999 IP 10.8.1.4.58920 > 185.42.204.162.1935: Flags [.], seq 107162:108476, ack 1, win 501, options [nop,nop,TS val 2133057171 ecr 2575529774], length 1314
21:19:33.808502 IP 185.42.204.162.1935 > 10.8.1.4.58920: Flags [.], ack 99278, win 126, options [nop,nop,TS val 2575529837 ecr 2133056838], length 0
21:19:33.808542 IP 10.8.1.4.58920 > 185.42.204.162.1935: Flags [P.], seq 108476:109174, ack 1, win 501, options [nop,nop,TS val 2133057172 ecr 2575529837], length 698
21:19:33.871771 IP 10.8.1.4.58920 > 185.42.204.162.1935: Flags [.], seq 109174:110488, ack 1, win 501, options [nop,nop,TS val 2133057235 ecr 2575529837], length 1314
21:19:33.891846 IP 185.42.204.162.1935 > 10.8.1.4.58920: Flags [.], ack 101906, win 126, options [nop,nop,TS val 2575529920 ecr 2133056904], length 0
21:19:33.907122 IP 10.8.1.4.58920 > 185.42.204.162.1935: Flags [.], seq 110488:111802, ack 1, win 501, options [nop,nop,TS val 2133057270 ecr 2575529920], length 1314
21:19:33.943705 IP 10.8.1.4.58920 > 185.42.204.162.1935: Flags [.], seq 111802:113116, ack 1, win 501, options [nop,nop,TS val 2133057307 ecr 2575529920], length 1314
21:19:33.995154 IP 185.42.204.162.1935 > 10.8.1.4.58920: Flags [.], ack 104534, win 126, options [nop,nop,TS val 2575530021 ecr 2133056971], length 0
21:19:34.008091 IP 10.8.1.4.58920 > 185.42.204.162.1935: Flags [.], seq 113116:114430, ack 1, win 501, options [nop,nop,TS val 2133057371 ecr 2575530021], length 1314
21:19:34.040972 IP 10.8.1.4.58920 > 185.42.204.162.1935: Flags [.], seq 114430:115744, ack 1, win 501, options [nop,nop,TS val 2133057404 ecr 2575530021], length 1314
21:19:34.058825 IP 185.42.204.162.1935 > 10.8.1.4.58920: Flags [.], ack 107162, win 126, options [nop,nop,TS val 2575530087 ecr 2133057071], length 0
21:19:34.074618 IP 10.8.1.4.58920 > 185.42.204.162.1935: Flags [.], seq 115744:117058, ack 1, win 501, options [nop,nop,TS val 2133057438 ecr 2575530087], length 1314
21:19:34.126142 IP 185.42.204.162.1935 > 10.8.1.4.58920: Flags [.], ack 109174, win 126, options [nop,nop,TS val 2575530155 ecr 2133057171], length 0
21:19:34.126161 IP 10.8.1.4.58920 > 185.42.204.162.1935: Flags [P.], seq 117058:118222, ack 1, win 501, options [nop,nop,TS val 2133057489 ecr 2575530155], length 1164
21:19:34.172189 IP 10.8.1.4.58920 > 185.42.204.162.1935: Flags [.], seq 118222:119536, ack 1, win 501, options [nop,nop,TS val 2133057535 ecr 2575530155], length 1314
21:19:34.207864 IP 10.8.1.4.58920 > 185.42.204.162.1935: Flags [.], seq 119536:120850, ack 1, win 501, options [nop,nop,TS val 2133057571 ecr 2575530155], length 1314
21:19:34.224948 IP 185.42.204.162.1935 > 10.8.1.4.58920: Flags [.], ack 111802, win 126, options [nop,nop,TS val 2575530254 ecr 2133057235], length 0
21:19:34.244350 IP 10.8.1.4.58920 > 185.42.204.162.1935: Flags [.], seq 120850:122164, ack 1, win 501, options [nop,nop,TS val 2133057608 ecr 2575530254], length 1314
21:19:34.308694 IP 10.8.1.4.58920 > 185.42.204.162.1935: Flags [.], seq 122164:123478, ack 1, win 501, options [nop,nop,TS val 2133057672 ecr 2575530254], length 1314
21:19:34.326447 IP 185.42.204.162.1935 > 10.8.1.4.58920: Flags [.], ack 114430, win 126, options [nop,nop,TS val 2575530355 ecr 2133057307], length 0
21:19:34.341211 IP 10.8.1.4.58920 > 185.42.204.162.1935: Flags [.], seq 123478:124792, ack 1, win 501, options [nop,nop,TS val 2133057705 ecr 2575530355], length 1314
21:19:34.374466 IP 10.8.1.4.58920 > 185.42.204.162.1935: Flags [.], seq 124792:126106, ack 1, win 501, options [nop,nop,TS val 2133057738 ecr 2575530355], length 1314
21:19:34.392445 IP 185.42.204.162.1935 > 10.8.1.4.58920: Flags [.], ack 117058, win 126, options [nop,nop,TS val 2575530421 ecr 2133057404], length 0
21:19:34.440937 IP 10.8.1.4.58920 > 185.42.204.162.1935: Flags [.], seq 126106:127420, ack 1, win 501, options [nop,nop,TS val 2133057804 ecr 2575530421], length 1314
21:19:34.443817 IP 185.42.204.162.1935 > 10.8.1.4.58920: Flags [.], ack 118222, win 126, options [nop,nop,TS val 2575530472 ecr 2133057489], length 0
21:19:34.443847 IP 10.8.1.4.58920 > 185.42.204.162.1935: Flags [P.], seq 127420:128125, ack 1, win 501, options [nop,nop,TS val 2133057807 ecr 2575530472], length 705
21:19:34.503329 IP 10.8.1.4.58920 > 185.42.204.162.1935: Flags [.], seq 128125:129439, ack 1, win 501, options [nop,nop,TS val 2133057867 ecr 2575530472], length 1314
21:19:34.525704 IP 185.42.204.162.1935 > 10.8.1.4.58920: Flags [.], ack 120850, win 126, options [nop,nop,TS val 2575530554 ecr 2133057535], length 0
21:19:34.544335 IP 10.8.1.4.58920 > 185.42.204.162.1935: Flags [.], seq 129439:130753, ack 1, win 501, options [nop,nop,TS val 2133057908 ecr 2575530554], length 1314
21:19:34.573746 IP 10.8.1.4.58920 > 185.42.204.162.1935: Flags [.], seq 130753:132067, ack 1, win 501, options [nop,nop,TS val 2133057937 ecr 2575530554], length 1314
21:19:34.626540 IP 185.42.204.162.1935 > 10.8.1.4.58920: Flags [.], ack 123478, win 126, options [nop,nop,TS val 2575530655 ecr 2133057608], length 0
21:19:34.640734 IP 10.8.1.4.58920 > 185.42.204.162.1935: Flags [.], seq 132067:133381, ack 1, win 501, options [nop,nop,TS val 2133058004 ecr 2575530655], length 1314
21:19:34.672923 IP 10.8.1.4.58920 > 185.42.204.162.1935: Flags [.], seq 133381:134695, ack 1, win 501, options [nop,nop,TS val 2133058036 ecr 2575530655], length 1314
21:19:34.692411 IP 185.42.204.162.1935 > 10.8.1.4.58920: Flags [.], ack 126106, win 126, options [nop,nop,TS val 2575530721 ecr 2133057705], length 0
21:19:34.707020 IP 10.8.1.4.58920 > 185.42.204.162.1935: Flags [.], seq 134695:136009, ack 1, win 501, options [nop,nop,TS val 2133058070 ecr 2575530721], length 1314
21:19:34.761511 IP 185.42.204.162.1935 > 10.8.1.4.58920: Flags [.], ack 128125, win 126, options [nop,nop,TS val 2575530790 ecr 2133057804], length 0
21:19:34.761557 IP 10.8.1.4.58920 > 185.42.204.162.1935: Flags [P.], seq 136009:137161, ack 1, win 501, options [nop,nop,TS val 2133058125 ecr 2575530790], length 1152
21:19:34.807681 IP 10.8.1.4.58920 > 185.42.204.162.1935: Flags [.], seq 137161:138475, ack 1, win 501, options [nop,nop,TS val 2133058171 ecr 2575530790], length 1314
21:19:34.844809 IP 10.8.1.4.58920 > 185.42.204.162.1935: Flags [.], seq 138475:139789, ack 1, win 501, options [nop,nop,TS val 2133058208 ecr 2575530790], length 1314
21:19:34.862184 IP 185.42.204.162.1935 > 10.8.1.4.58920: Flags [.], ack 130753, win 126, options [nop,nop,TS val 2575530891 ecr 2133057867], length 0
21:19:34.887594 IP 10.8.1.4.58920 > 185.42.204.162.1935: Flags [.], seq 139789:141103, ack 1, win 501, options [nop,nop,TS val 2133058251 ecr 2575530891], length 1314
21:19:34.939753 IP 10.8.1.4.58920 > 185.42.204.162.1935: Flags [.], seq 141103:142417, ack 1, win 501, options [nop,nop,TS val 2133058303 ecr 2575530891], length 1314
21:19:34.958579 IP 185.42.204.162.1935 > 10.8.1.4.58920: Flags [.], ack 133381, win 126, options [nop,nop,TS val 2575530987 ecr 2133057937], length 0
21:19:34.973896 IP 10.8.1.4.58920 > 185.42.204.162.1935: Flags [.], seq 142417:143731, ack 1, win 501, options [nop,nop,TS val 2133058337 ecr 2575530987], length 1314
21:19:35.015788 IP 10.8.1.4.58920 > 185.42.204.162.1935: Flags [.], seq 143731:145045, ack 1, win 501, options [nop,nop,TS val 2133058379 ecr 2575530987], length 1314
21:19:35.024752 IP 185.42.204.162.1935 > 10.8.1.4.58920: Flags [.], ack 136009, win 126, options [nop,nop,TS val 2575531053 ecr 2133058036], length 0
21:19:35.079322 IP 185.42.204.162.1935 > 10.8.1.4.58920: Flags [.], ack 137161, win 126, options [nop,nop,TS val 2575531108 ecr 2133058125], length 0
21:19:35.079344 IP 10.8.1.4.58920 > 185.42.204.162.1935: Flags [P.], seq 145045:146217, ack 1, win 501, options [nop,nop,TS val 2133058443 ecr 2575531108], length 1172
21:19:35.107484 IP 10.8.1.4.58920 > 185.42.204.162.1935: Flags [.], seq 146217:147531, ack 1, win 501, options [nop,nop,TS val 2133058471 ecr 2575531108], length 1314
21:19:35.144037 IP 10.8.1.4.58920 > 185.42.204.162.1935: Flags [.], seq 147531:148845, ack 1, win 501, options [nop,nop,TS val 2133058507 ecr 2575531108], length 1314
21:19:35.162824 IP 185.42.204.162.1935 > 10.8.1.4.58920: Flags [.], ack 139789, win 126, options [nop,nop,TS val 2575531191 ecr 2133058171], length 0
21:19:35.206060 IP 10.8.1.4.58920 > 185.42.204.162.1935: Flags [.], seq 148845:150159, ack 1, win 501, options [nop,nop,TS val 2133058569 ecr 2575531191], length 1314
21:19:35.240111 IP 10.8.1.4.58920 > 185.42.204.162.1935: Flags [.], seq 150159:151473, ack 1, win 501, options [nop,nop,TS val 2133058603 ecr 2575531191], length 1314
21:19:35.257498 IP 185.42.204.162.1935 > 10.8.1.4.58920: Flags [.], ack 142417, win 126, options [nop,nop,TS val 2575531286 ecr 2133058251], length 0
21:19:35.273780 IP 10.8.1.4.58920 > 185.42.204.162.1935: Flags [.], seq 151473:152787, ack 1, win 501, options [nop,nop,TS val 2133058637 ecr 2575531286], length 1314
21:19:35.333667 IP 185.42.204.162.1935 > 10.8.1.4.58920: Flags [.], ack 145045, win 126, options [nop,nop,TS val 2575531362 ecr 2133058337], length 0
21:19:35.336830 IP 10.8.1.4.58920 > 185.42.204.162.1935: Flags [.], seq 152787:154101, ack 1, win 501, options [nop,nop,TS val 2133058700 ecr 2575531362], length 1314
21:19:35.379721 IP 10.8.1.4.58920 > 185.42.204.162.1935: Flags [.], seq 154101:155415, ack 1, win 501, options [nop,nop,TS val 2133058743 ecr 2575531362], length 1314
21:19:35.397216 IP 185.42.204.162.1935 > 10.8.1.4.58920: Flags [.], ack 146217, win 126, options [nop,nop,TS val 2575531426 ecr 2133058443], length 0
21:19:35.397247 IP 10.8.1.4.58920 > 185.42.204.162.1935: Flags [P.], seq 155415:156017, ack 1, win 501, options [nop,nop,TS val 2133058761 ecr 2575531426], length 602
21:19:35.443961 IP 10.8.1.4.58920 > 185.42.204.162.1935: Flags [.], seq 156017:157331, ack 1, win 501, options [nop,nop,TS val 2133058807 ecr 2575531426], length 1314
21:19:35.461616 IP 185.42.204.162.1935 > 10.8.1.4.58920: Flags [.], ack 148845, win 126, options [nop,nop,TS val 2575531490 ecr 2133058471], length 0
21:19:35.471515 IP 10.8.1.4.58920 > 185.42.204.162.1935: Flags [.], seq 157331:158645, ack 1, win 501, options [nop,nop,TS val 2133058835 ecr 2575531490], length 1314
21:19:35.507803 IP 10.8.1.4.58920 > 185.42.204.162.1935: Flags [.], seq 158645:159959, ack 1, win 501, options [nop,nop,TS val 2133058871 ecr 2575531490], length 1314
21:19:35.557805 IP 185.42.204.162.1935 > 10.8.1.4.58920: Flags [.], ack 151473, win 126, options [nop,nop,TS val 2575531586 ecr 2133058569], length 0
21:19:35.574178 IP 10.8.1.4.58920 > 185.42.204.162.1935: Flags [.], seq 159959:161273, ack 1, win 501, options [nop,nop,TS val 2133058937 ecr 2575531586], length 1314
21:19:35.607761 IP 10.8.1.4.58920 > 185.42.204.162.1935: Flags [.], seq 161273:162587, ack 1, win 501, options [nop,nop,TS val 2133058971 ecr 2575531586], length 1314
21:19:35.637247 IP 10.8.1.4.58920 > 185.42.204.162.1935: Flags [.], seq 162587:163901, ack 1, win 501, options [nop,nop,TS val 2133059001 ecr 2575531586], length 1314
21:19:35.654724 IP 185.42.204.162.1935 > 10.8.1.4.58920: Flags [.], ack 154101, win 126, options [nop,nop,TS val 2575531683 ecr 2133058637], length 0
21:19:35.701672 IP 10.8.1.4.58920 > 185.42.204.162.1935: Flags [.], seq 163901:165215, ack 1, win 501, options [nop,nop,TS val 2133059065 ecr 2575531683], length 1314
21:19:35.715308 IP 185.42.204.162.1935 > 10.8.1.4.58920: Flags [.], ack 156017, win 126, options [nop,nop,TS val 2575531744 ecr 2133058743], length 0
21:19:35.715347 IP 10.8.1.4.58920 > 185.42.204.162.1935: Flags [P.], seq 165215:166009, ack 1, win 501, options [nop,nop,TS val 2133059079 ecr 2575531744], length 794
21:19:35.765607 IP 10.8.1.4.58920 > 185.42.204.162.1935: Flags [.], seq 166009:167323, ack 1, win 501, options [nop,nop,TS val 2133059129 ecr 2575531744], length 1314
21:19:35.789261 IP 185.42.204.162.1935 > 10.8.1.4.58920: Flags [.], ack 158645, win 126, options [nop,nop,TS val 2575531818 ecr 2133058807], length 0
21:19:35.806616 IP 10.8.1.4.58920 > 185.42.204.162.1935: Flags [.], seq 167323:168637, ack 1, win 501, options [nop,nop,TS val 2133059170 ecr 2575531818], length 1314
21:19:35.840153 IP 10.8.1.4.58920 > 185.42.204.162.1935: Flags [.], seq 168637:169951, ack 1, win 501, options [nop,nop,TS val 2133059203 ecr 2575531818], length 1314
21:19:35.892111 IP 185.42.204.162.1935 > 10.8.1.4.58920: Flags [.], ack 161273, win 126, options [nop,nop,TS val 2575531921 ecr 2133058871], length 0
21:19:35.906783 IP 10.8.1.4.58920 > 185.42.204.162.1935: Flags [.], seq 169951:171265, ack 1, win 501, options [nop,nop,TS val 2133059270 ecr 2575531921], length 1314
21:19:35.936844 IP 10.8.1.4.58920 > 185.42.204.162.1935: Flags [.], seq 171265:172579, ack 1, win 501, options [nop,nop,TS val 2133059300 ecr 2575531921], length 1314
21:19:35.955080 IP 185.42.204.162.1935 > 10.8.1.4.58920: Flags [.], ack 163901, win 126, options [nop,nop,TS val 2575531984 ecr 2133058971], length 0
21:19:35.973180 IP 10.8.1.4.58920 > 185.42.204.162.1935: Flags [.], seq 172579:173893, ack 1, win 501, options [nop,nop,TS val 2133059336 ecr 2575531984], length 1314
21:19:36.033239 IP 185.42.204.162.1935 > 10.8.1.4.58920: Flags [.], ack 166009, win 126, options [nop,nop,TS val 2575532062 ecr 2133059065], length 0
21:19:36.033267 IP 10.8.1.4.58920 > 185.42.204.162.1935: Flags [P.], seq 173893:175065, ack 1, win 501, options [nop,nop,TS val 2133059397 ecr 2575532062], length 1172
21:19:36.073508 IP 10.8.1.4.58920 > 185.42.204.162.1935: Flags [.], seq 175065:176379, ack 1, win 501, options [nop,nop,TS val 2133059437 ecr 2575532062], length 1314
21:19:36.103277 IP 10.8.1.4.58920 > 185.42.204.162.1935: Flags [.], seq 176379:177693, ack 1, win 501, options [nop,nop,TS val 2133059467 ecr 2575532062], length 1314
21:19:36.124426 IP 185.42.204.162.1935 > 10.8.1.4.58920: Flags [.], ack 168637, win 126, options [nop,nop,TS val 2575532153 ecr 2133059129], length 0
21:19:36.150158 IP 10.8.1.4.58920 > 185.42.204.162.1935: Flags [.], seq 177693:179007, ack 1, win 501, options [nop,nop,TS val 2133059513 ecr 2575532153], length 1314
21:19:36.207562 IP 10.8.1.4.58920 > 185.42.204.162.1935: Flags [.], seq 179007:180321, ack 1, win 501, options [nop,nop,TS val 2133059571 ecr 2575532153], length 1314
21:19:36.224662 IP 185.42.204.162.1935 > 10.8.1.4.58920: Flags [.], ack 171265, win 126, options [nop,nop,TS val 2575532253 ecr 2133059203], length 0
21:19:36.236265 IP 10.8.1.4.58920 > 185.42.204.162.1935: Flags [.], seq 180321:181635, ack 1, win 501, options [nop,nop,TS val 2133059600 ecr 2575532253], length 1314
21:19:36.278928 IP 10.8.1.4.58920 > 185.42.204.162.1935: Flags [.], seq 181635:182949, ack 1, win 501, options [nop,nop,TS val 2133059642 ecr 2575532253], length 1314
21:19:36.290982 IP 185.42.204.162.1935 > 10.8.1.4.58920: Flags [.], ack 173893, win 126, options [nop,nop,TS val 2575532320 ecr 2133059300], length 0
21:19:36.340447 IP 10.8.1.4.58920 > 185.42.204.162.1935: Flags [.], seq 182949:184263, ack 1, win 501, options [nop,nop,TS val 2133059704 ecr 2575532320], length 1314
21:19:36.350976 IP 185.42.204.162.1935 > 10.8.1.4.58920: Flags [.], ack 175065, win 126, options [nop,nop,TS val 2575532380 ecr 2133059397], length 0
21:19:36.350988 IP 10.8.1.4.58920 > 185.42.204.162.1935: Flags [P.], seq 184263:184948, ack 1, win 501, options [nop,nop,TS val 2133059714 ecr 2575532380], length 685
21:19:36.403624 IP 10.8.1.4.58920 > 185.42.204.162.1935: Flags [.], seq 184948:186262, ack 1, win 501, options [nop,nop,TS val 2133059767 ecr 2575532380], length 1314
21:19:36.421844 IP 185.42.204.162.1935 > 10.8.1.4.58920: Flags [.], ack 177693, win 126, options [nop,nop,TS val 2575532451 ecr 2133059437], length 0
21:19:36.440507 IP 10.8.1.4.58920 > 185.42.204.162.1935: Flags [.], seq 186262:187576, ack 1, win 501, options [nop,nop,TS val 2133059804 ecr 2575532451], length 1314
21:19:36.474460 IP 10.8.1.4.58920 > 185.42.204.162.1935: Flags [.], seq 187576:188890, ack 1, win 501, options [nop,nop,TS val 2133059838 ecr 2575532451], length 1314
21:19:36.525565 IP 185.42.204.162.1935 > 10.8.1.4.58920: Flags [.], ack 180321, win 126, options [nop,nop,TS val 2575532554 ecr 2133059513], length 0
21:19:36.535186 IP 10.8.1.4.58920 > 185.42.204.162.1935: Flags [.], seq 188890:190204, ack 1, win 501, options [nop,nop,TS val 2133059898 ecr 2575532554], length 1314
21:19:36.570927 IP 10.8.1.4.58920 > 185.42.204.162.1935: Flags [.], seq 190204:191518, ack 1, win 501, options [nop,nop,TS val 2133059934 ecr 2575532554], length 1314
21:19:36.597004 IP 185.42.204.162.1935 > 10.8.1.4.58920: Flags [.], ack 182949, win 126, options [nop,nop,TS val 2575532626 ecr 2133059600], length 0
21:19:36.605348 IP 10.8.1.4.58920 > 185.42.204.162.1935: Flags [.], seq 191518:192832, ack 1, win 501, options [nop,nop,TS val 2133059969 ecr 2575532626], length 1314
21:19:36.668689 IP 185.42.204.162.1935 > 10.8.1.4.58920: Flags [.], ack 184948, win 126, options [nop,nop,TS val 2575532697 ecr 2133059704], length 0
21:19:36.668733 IP 10.8.1.4.58920 > 185.42.204.162.1935: Flags [P.], seq 192832:194004, ack 1, win 501, options [nop,nop,TS val 2133060032 ecr 2575532697], length 1172
21:19:36.706644 IP 10.8.1.4.58920 > 185.42.204.162.1935: Flags [.], seq 194004:195318, ack 1, win 501, options [nop,nop,TS val 2133060070 ecr 2575532697], length 1314
21:19:36.740877 IP 10.8.1.4.58920 > 185.42.204.162.1935: Flags [.], seq 195318:196632, ack 1, win 501, options [nop,nop,TS val 2133060104 ecr 2575532697], length 1314
21:19:36.758301 IP 185.42.204.162.1935 > 10.8.1.4.58920: Flags [.], ack 187576, win 126, options [nop,nop,TS val 2575532787 ecr 2133059767], length 0
21:19:36.792503 IP 10.8.1.4.58920 > 185.42.204.162.1935: Flags [.], seq 196632:197946, ack 1, win 501, options [nop,nop,TS val 2133060156 ecr 2575532787], length 1314
21:19:36.835110 IP 10.8.1.4.58920 > 185.42.204.162.1935: Flags [.], seq 197946:199260, ack 1, win 501, options [nop,nop,TS val 2133060198 ecr 2575532787], length 1314
21:19:36.853097 IP 185.42.204.162.1935 > 10.8.1.4.58920: Flags [.], ack 190204, win 126, options [nop,nop,TS val 2575532882 ecr 2133059838], length 0
21:19:36.873320 IP 10.8.1.4.58920 > 185.42.204.162.1935: Flags [.], seq 199260:200574, ack 1, win 501, options [nop,nop,TS val 2133060237 ecr 2575532882], length 1314
21:19:36.920781 IP 10.8.1.4.58920 > 185.42.204.162.1935: Flags [.], seq 200574:201888, ack 1, win 501, options [nop,nop,TS val 2133060284 ecr 2575532882], length 1314
21:19:36.923274 IP 185.42.204.162.1935 > 10.8.1.4.58920: Flags [.], ack 192832, win 126, options [nop,nop,TS val 2575532952 ecr 2133059934], length 0
21:19:36.973382 IP 10.8.1.4.58920 > 185.42.204.162.1935: Flags [.], seq 201888:203202, ack 1, win 501, options [nop,nop,TS val 2133060337 ecr 2575532952], length 1314
21:19:36.986470 IP 185.42.204.162.1935 > 10.8.1.4.58920: Flags [.], ack 194004, win 126, options [nop,nop,TS val 2575533015 ecr 2133060032], length 0
21:19:36.986496 IP 10.8.1.4.58920 > 185.42.204.162.1935: Flags [P.], seq 203202:203900, ack 1, win 501, options [nop,nop,TS val 2133060350 ecr 2575533015], length 698
21:19:37.036614 IP 10.8.1.4.58920 > 185.42.204.162.1935: Flags [.], seq 203900:205214, ack 1, win 501, options [nop,nop,TS val 2133060400 ecr 2575533015], length 1314
