04:33:39.113801 IP 185.42.204.162.1935 > 10.8.3.4.54036: Flags [.], ack 2711474374, win 126, options [nop,nop,TS val 2687975120 ecr 1022572813], length 0
04:33:39.113842 IP 10.8.3.4.54036 > 185.42.204.162.1935: Flags [P.], seq 7885:8961, ack 0, win 501, options [nop,nop,TS val 1022573111 ecr 2687975120], length 1076
04:33:39.171450 IP 10.8.3.4.54036 > 185.42.204.162.1935: Flags [.], seq 8961:10275, ack 0, win 501, options [nop,nop,TS val 1022573168 ecr 2687975120], length 1314
04:33:39.207597 IP 10.8.3.4.54036 > 185.42.204.162.1935: Flags [.], seq 10275:11589, ack 0, win 501, options [nop,nop,TS val 1022573204 ecr 2687975120], length 1314
04:33:39.209436 IP 185.42.204.162.1935 > 10.8.3.4.54036: Flags [.], ack 2629, win 126, options [nop,nop,TS val 2687975216 ecr 1022572870], length 0
04:33:39.244549 IP 10.8.3.4.54036 > 185.42.204.162.1935: Flags [.], seq 11589:12903, ack 0, win 501, options [nop,nop,TS val 1022573241 ecr 2687975216], length 1314
04:33:39.307055 IP 185.42.204.162.1935 > 10.8.3.4.54036: Flags [.], ack 5257, win 126, options [nop,nop,TS val 2687975313 ecr 1022572939], length 0
04:33:39.307228 IP 10.8.3.4.54036 > 185.42.204.162.1935: Flags [.], seq 12903:14217, ack 0, win 501, options [nop,nop,TS val 1022573304 ecr 2687975313], length 1314
04:33:39.341256 IP 10.8.3.4.54036 > 185.42.204.162.1935: Flags [.], seq 14217:15531, ack 0, win 501, options [nop,nop,TS val 1022573338 ecr 2687975313], length 1314
04:33:39.371930 IP 185.42.204.162.1935 > 10.8.3.4.54036: Flags [.], ack 7885, win 126, options [nop,nop,TS val 2687975378 ecr 1022573038], length 0
04:33:39.375864 IP 10.8.3.4.54036 > 185.42.204.162.1935: Flags [.], seq 15531:16845, ack 0, win 501, options [nop,nop,TS val 1022573373 ecr 2687975378], length 1314
04:33:39.411544 IP 185.42.204.162.1935 > 10.8.3.4.54036: Flags [.], ack 8961, win 126, options [nop,nop,TS val 2687975418 ecr 1022573111], length 0
04:33:39.411575 IP 10.8.3.4.54036 > 185.42.204.162.1935: Flags [P.], seq 16845:17914, ack 0, win 501, options [nop,nop,TS val 1022573408 ecr 2687975418], length 1069
04:33:39.469898 IP 10.8.3.4.54036 > 185.42.204.162.1935: Flags [.], seq 17914:19228, ack 0, win 501, options [nop,nop,TS val 1022573467 ecr 2687975418], length 1314
04:33:39.505518 IP 185.42.204.162.1935 > 10.8.3.4.54036: Flags [.], ack 11589, win 126, options [nop,nop,TS val 2687975512 ecr 1022573168], length 0
04:33:39.508318 IP 10.8.3.4.54036 > 185.42.204.162.1935: Flags [.], seq 19228:20542, ack 0, win 501, options [nop,nop,TS val 1022573505 ecr 2687975512], length 1314
04:33:39.544937 IP 10.8.3.4.54036 > 185.42.204.162.1935: Flags [.], seq 20542:21856, ack 0, win 501, options [nop,nop,TS val 1022573542 ecr 2687975512], length 1314
04:33:39.605114 IP 185.42.204.162.1935 > 10.8.3.4.54036: Flags [.], ack 14217, win 126, options [nop,nop,TS val 2687975611 ecr 1022573241], length 0
04:33:39.608389 IP 10.8.3.4.54036 > 185.42.204.162.1935: Flags [.], seq 21856:23170, ack 0, win 501, options [nop,nop,TS val 1022573605 ecr 2687975611], length 1314
04:33:39.640521 IP 10.8.3.4.54036 > 185.42.204.162.1935: Flags [.], seq 23170:24484, ack 0, win 501, options [nop,nop,TS val 1022573637 ecr 2687975611], length 1314
04:33:39.673827 IP 185.42.204.162.1935 > 10.8.3.4.54036: Flags [.], ack 16845, win 126, options [nop,nop,TS val 2687975680 ecr 1022573338], length 0
04:33:39.674238 IP 10.8.3.4.54036 > 185.42.204.162.1935: Flags [.], seq 24484:25798, ack 0, win 501, options [nop,nop,TS val 1022573671 ecr 2687975680], length 1314
04:33:39.709280 IP 185.42.204.162.1935 > 10.8.3.4.54036: Flags [.], ack 17914, win 126, options [nop,nop,TS val 2687975716 ecr 1022573408], length 0
04:33:39.709297 IP 10.8.3.4.54036 > 185.42.204.162.1935: Flags [P.], seq 25798:26867, ack 0, win 501, options [nop,nop,TS val 1022573706 ecr 2687975716], length 1069
04:33:39.767581 IP 10.8.3.4.54036 > 185.42.204.162.1935: Flags [.], seq 26867:28181, ack 0, win 501, options [nop,nop,TS val 1022573764 ecr 2687975716], length 1314
04:33:39.806121 IP 185.42.204.162.1935 > 10.8.3.4.54036: Flags [.], ack 20542, win 126, options [nop,nop,TS val 2687975812 ecr 1022573467], length 0
04:33:39.810034 IP 10.8.3.4.54036 > 185.42.204.162.1935: Flags [.], seq 28181:29495, ack 0, win 501, options [nop,nop,TS val 1022573807 ecr 2687975812], length 1314
04:33:39.842057 IP 10.8.3.4.54036 > 185.42.204.162.1935: Flags [.], seq 29495:30809, ack 0, win 501, options [nop,nop,TS val 1022573839 ecr 2687975812], length 1314
04:33:39.906231 IP 185.42.204.162.1935 > 10.8.3.4.54036: Flags [.], ack 23170, win 126, options [nop,nop,TS val 2687975912 ecr 1022573542], length 0
04:33:39.909847 IP 10.8.3.4.54036 > 185.42.204.162.1935: Flags [.], seq 30809:32123, ack 0, win 501, options [nop,nop,TS val 1022573907 ecr 2687975912], length 1314
04:33:39.937960 IP 10.8.3.4.54036 > 185.42.204.162.1935: Flags [.], seq 32123:33437, ack 0, win 501, options [nop,nop,TS val 1022573935 ecr 2687975912], length 1314
04:33:39.971927 IP 185.42.204.162.1935 > 10.8.3.4.54036: Flags [.], ack 25798, win 126, options [nop,nop,TS val 2687975978 ecr 1022573637], length 0
04:33:39.976878 IP 10.8.3.4.54036 > 185.42.204.162.1935: Flags [.], seq 33437:34751, ack 0, win 501, options [nop,nop,TS val 1022573974 ecr 2687975978], length 1314
04:33:40.007185 IP 185.42.204.162.1935 > 10.8.3.4.54036: Flags [.], ack 26867, win 126, options [nop,nop,TS val 2687976013 ecr 1022573706], length 0
04:33:40.007219 IP 10.8.3.4.54036 > 185.42.204.162.1935: Flags [P.], seq 34751:35732, ack 0, win 501, options [nop,nop,TS val 1022574004 ecr 2687976013], length 981
04:33:40.075268 IP 10.8.3.4.54036 > 185.42.204.162.1935: Flags [.], seq 35732:37046, ack 0, win 501, options [nop,nop,TS val 1022574072 ecr 2687976013], length 1314
04:33:40.107337 IP 10.8.3.4.54036 > 185.42.204.162.1935: Flags [.], seq 37046:38360, ack 0, win 501, options [nop,nop,TS val 1022574104 ecr 2687976013], length 1314
04:33:40.107851 IP 185.42.204.162.1935 > 10.8.3.4.54036: Flags [.], ack 29495, win 126, options [nop,nop,TS val 2687976114 ecr 1022573764], length 0
04:33:40.142341 IP 10.8.3.4.54036 > 185.42.204.162.1935: Flags [.], seq 38360:39674, ack 0, win 501, options [nop,nop,TS val 1022574139 ecr 2687976114], length 1314
04:33:40.207629 IP 185.42.204.162.1935 > 10.8.3.4.54036: Flags [.], ack 32123, win 126, options [nop,nop,TS val 2687976214 ecr 1022573839], length 0
04:33:40.210326 IP 10.8.3.4.54036 > 185.42.204.162.1935: Flags [.], seq 39674:40988, ack 0, win 501, options [nop,nop,TS val 1022574207 ecr 2687976214], length 1314
04:33:40.236052 IP 10.8.3.4.54036 > 185.42.204.162.1935: Flags [.], seq 40988:42302, ack 0, win 501, options [nop,nop,TS val 1022574233 ecr 2687976214], length 1314
04:33:40.274815 IP 185.42.204.162.1935 > 10.8.3.4.54036: Flags [.], ack 34751, win 126, options [nop,nop,TS val 2687976281 ecr 1022573935], length 0
04:33:40.278137 IP 10.8.3.4.54036 > 185.42.204.162.1935: Flags [.], seq 42302:43616, ack 0, win 501, options [nop,nop,TS val 1022574275 ecr 2687976281], length 1314
04:33:40.305133 IP 185.42.204.162.1935 > 10.8.3.4.54036: Flags [.], ack 35732, win 126, options [nop,nop,TS val 2687976311 ecr 1022574004], length 0
04:33:40.305165 IP 10.8.3.4.54036 > 185.42.204.162.1935: Flags [P.], seq 43616:44677, ack 0, win 501, options [nop,nop,TS val 1022574302 ecr 2687976311], length 1061
04:33:40.378916 IP 10.8.3.4.54036 > 185.42.204.162.1935: Flags [.], seq 44677:45991, ack 0, win 501, options [nop,nop,TS val 1022574376 ecr 2687976311], length 1314
04:33:40.405316 IP 185.42.204.162.1935 > 10.8.3.4.54036: Flags [.], ack 38360, win 126, options [nop,nop,TS val 2687976411 ecr 1022574072], length 0
04:33:40.407298 IP 10.8.3.4.54036 > 185.42.204.162.1935: Flags [.], seq 45991:47305, ack 0, win 501, options [nop,nop,TS val 1022574404 ecr 2687976411], length 1314
04:33:40.445354 IP 10.8.3.4.54036 > 185.42.204.162.1935: Flags [.], seq 47305:48619, ack 0, win 501, options [nop,nop,TS val 1022574442 ecr 2687976411], length 1314
04:33:40.508434 IP 185.42.204.162.1935 > 10.8.3.4.54036: Flags [.], ack 40988, win 126, options [nop,nop,TS val 2687976514 ecr 1022574139], length 0
04:33:40.512975 IP 10.8.3.4.54036 > 185.42.204.162.1935: Flags [.], seq 48619:49933, ack 0, win 501, options [nop,nop,TS val 1022574510 ecr 2687976514], length 1314
04:33:40.535446 IP 10.8.3.4.54036 > 185.42.204.162.1935: Flags [.], seq 49933:51247, ack 0, win 501, options [nop,nop,TS val 1022574532 ecr 2687976514], length 1314
04:33:40.576714 IP 185.42.204.162.1935 > 10.8.3.4.54036: Flags [.], ack 43616, win 126, options [nop,nop,TS val 2687976583 ecr 1022574233], length 0
04:33:40.577864 IP 10.8.3.4.54036 > 185.42.204.162.1935: Flags [.], seq 51247:52561, ack 0, win 501, options [nop,nop,TS val 1022574575 ecr 2687976583], length 1314
04:33:40.602923 IP 185.42.204.162.1935 > 10.8.3.4.54036: Flags [.], ack 44677, win 126, options [nop,nop,TS val 2687976609 ecr 1022574302], length 0
04:33:40.602951 IP 10.8.3.4.54036 > 185.42.204.162.1935: Flags [P.], seq 52561:52883, ack 0, win 501, options [nop,nop,TS val 1022574600 ecr 2687976609], length 322
04:33:40.642260 IP 10.8.3.4.54036 > 185.42.204.162.1935: Flags [.], seq 52883:54197, ack 0, win 501, options [nop,nop,TS val 1022574639 ecr 2687976609], length 1314
04:33:40.678682 IP 10.8.3.4.54036 > 185.42.204.162.1935: Flags [.], seq 54197:55511, ack 0, win 501, options [nop,nop,TS val 1022574675 ecr 2687976609], length 1314
04:33:40.705114 IP 185.42.204.162.1935 > 10.8.3.4.54036: Flags [.], ack 47305, win 126, options [nop,nop,TS val 2687976711 ecr 1022574376], length 0
04:33:40.727562 IP 10.8.3.4.54036 > 185.42.204.162.1935: Flags [.], seq 55511:56825, ack 0, win 501, options [nop,nop,TS val 1022574724 ecr 2687976711], length 1314
04:33:40.770081 IP 10.8.3.4.54036 > 185.42.204.162.1935: Flags [.], seq 56825:58139, ack 0, win 501, options [nop,nop,TS val 1022574767 ecr 2687976711], length 1314
04:33:40.810798 IP 10.8.3.4.54036 > 185.42.204.162.1935: Flags [.], seq 58139:59453, ack 0, win 501, options [nop,nop,TS val 1022574807 ecr 2687976711], length 1314
04:33:40.810868 IP 185.42.204.162.1935 > 10.8.3.4.54036: Flags [.], ack 49933, win 126, options [nop,nop,TS val 2687976817 ecr 1022574442], length 0
04:33:40.855236 IP 10.8.3.4.54036 > 185.42.204.162.1935: Flags [.], seq 59453:60767, ack 0, win 501, options [nop,nop,TS val 1022574852 ecr 2687976817], length 1314
04:33:40.876042 IP 185.42.204.162.1935 > 10.8.3.4.54036: Flags [.], ack 52561, win 126, options [nop,nop,TS val 2687976882 ecr 1022574532], length 0
04:33:40.900536 IP 185.42.204.162.1935 > 10.8.3.4.54036: Flags [.], ack 52883, win 126, options [nop,nop,TS val 2687976907 ecr 1022574600], length 0
04:33:40.900563 IP 10.8.3.4.54036 > 185.42.204.162.1935: Flags [P.], seq 60767:61839, ack 0, win 501, options [nop,nop,TS val 1022574897 ecr 2687976907], length 1072
04:33:40.940564 IP 10.8.3.4.54036 > 185.42.204.162.1935: Flags [.], seq 61839:63153, ack 0, win 501, options [nop,nop,TS val 1022574937 ecr 2687976907], length 1314
04:33:40.977013 IP 185.42.204.162.1935 > 10.8.3.4.54036: Flags [.], ack 55511, win 126, options [nop,nop,TS val 2687976983 ecr 1022574639], length 0
04:33:40.977091 IP 10.8.3.4.54036 > 185.42.204.162.1935: Flags [.], seq 63153:64467, ack 0, win 501, options [nop,nop,TS val 1022574974 ecr 2687976983], length 1314
04:33:41.026159 IP 10.8.3.4.54036 > 185.42.204.162.1935: Flags [.], seq 64467:65781, ack 0, win 501, options [nop,nop,TS val 1022575023 ecr 2687976983], length 1314
04:33:41.067975 IP 185.42.204.162.1935 > 10.8.3.4.54036: Flags [.], ack 58139, win 126, options [nop,nop,TS val 2687977074 ecr 1022574724], length 0
04:33:41.068963 IP 10.8.3.4.54036 > 185.42.204.162.1935: Flags [.], seq 65781:67095, ack 0, win 501, options [nop,nop,TS val 1022575066 ecr 2687977074], length 1314
04:33:41.110328 IP 10.8.3.4.54036 > 185.42.204.162.1935: Flags [.], seq 67095:68409, ack 0, win 501, options [nop,nop,TS val 1022575107 ecr 2687977074], length 1314
04:33:41.153141 IP 185.42.204.162.1935 > 10.8.3.4.54036: Flags [.], ack 60767, win 126, options [nop,nop,TS val 2687977160 ecr 1022574807], length 0
04:33:41.154686 IP 10.8.3.4.54036 > 185.42.204.162.1935: Flags [.], seq 68409:69723, ack 0, win 501, options [nop,nop,TS val 1022575151 ecr 2687977160], length 1314
04:33:41.198546 IP 185.42.204.162.1935 > 10.8.3.4.54036: Flags [.], ack 61839, win 126, options [nop,nop,TS val 2687977205 ecr 1022574897], length 0
04:33:41.198569 IP 10.8.3.4.54036 > 185.42.204.162.1935: Flags [P.], seq 69723:70788, ack 0, win 501, options [nop,nop,TS val 1022575195 ecr 2687977205], length 1065
04:33:41.240478 IP 10.8.3.4.54036 > 185.42.204.162.1935: Flags [.], seq 70788:72102, ack 0, win 501, options [nop,nop,TS val 1022575237 ecr 2687977205], length 1314
04:33:41.275451 IP 185.42.204.162.1935 > 10.8.3.4.54036: Flags [.], ack 64467, win 126, options [nop,nop,TS val 2687977281 ecr 1022574937], length 0
04:33:41.278489 IP 10.8.3.4.54036 > 185.42.204.162.1935: Flags [.], seq 72102:73416, ack 0, win 501, options [nop,nop,TS val 1022575275 ecr 2687977281], length 1314
04:33:41.326422 IP 10.8.3.4.54036 > 185.42.204.162.1935: Flags [.], seq 73416:74730, ack 0, win 501, options [nop,nop,TS val 1022575323 ecr 2687977281], length 1314
04:33:41.366817 IP 185.42.204.162.1935 > 10.8.3.4.54036: Flags [.], ack 67095, win 126, options [nop,nop,TS val 2687977373 ecr 1022575023], length 0
04:33:41.368948 IP 10.8.3.4.54036 > 185.42.204.162.1935: Flags [.], seq 74730:76044, ack 0, win 501, options [nop,nop,TS val 1022575366 ecr 2687977373], length 1314
04:33:41.411904 IP 10.8.3.4.54036 > 185.42.204.162.1935: Flags [.], seq 76044:77358, ack 0, win 501, options [nop,nop,TS val 1022575409 ecr 2687977373], length 1314
04:33:41.452378 IP 185.42.204.162.1935 > 10.8.3.4.54036: Flags [.], ack 69723, win 126, options [nop,nop,TS val 2687977459 ecr 1022575107], length 0
04:33:41.454900 IP 10.8.3.4.54036 > 185.42.204.162.1935: Flags [.], seq 77358:78672, ack 0, win 501, options [nop,nop,TS val 1022575452 ecr 2687977459], length 1314
04:33:41.496136 IP 185.42.204.162.1935 > 10.8.3.4.54036: Flags [.], ack 70788, win 126, options [nop,nop,TS val 2687977503 ecr 1022575195], length 0
04:33:41.496156 IP 10.8.3.4.54036 > 185.42.204.162.1935: Flags [P.], seq 78672:79653, ack 0, win 501, options [nop,nop,TS val 1022575493 ecr 2687977503], length 981
04:33:41.539919 IP 10.8.3.4.54036 > 185.42.204.162.1935: Flags [.], seq 79653:80967, ack 0, win 501, options [nop,nop,TS val 1022575537 ecr 2687977503], length 1314
04:33:41.576552 IP 185.42.204.162.1935 > 10.8.3.4.54036: Flags [.], ack 73416, win 126, options [nop,nop,TS val 2687977583 ecr 1022575237], length 0
04:33:41.577097 IP 10.8.3.4.54036 > 185.42.204.162.1935: Flags [.], seq 80967:82281, ack 0, win 501, options [nop,nop,TS val 1022575574 ecr 2687977583], length 1314
04:33:41.610502 IP 10.8.3.4.54036 > 185.42.204.162.1935: Flags [.], seq 82281:83595, ack 0, win 501, options [nop,nop,TS val 1022575607 ecr 2687977583], length 1314
04:33:41.666940 IP 185.42.204.162.1935 > 10.8.3.4.54036: Flags [.], ack 76044, win 126, options [nop,nop,TS val 2687977673 ecr 1022575323], length 0
04:33:41.677040 IP 10.8.3.4.54036 > 185.42.204.162.1935: Flags [.], seq 83595:84909, ack 0, win 501, options [nop,nop,TS val 1022575674 ecr 2687977673], length 1314
04:33:41.710389 IP 10.8.3.4.54036 > 185.42.204.162.1935: Flags [.], seq 84909:86223, ack 0, win 501, options [nop,nop,TS val 1022575707 ecr 2687977673], length 1314
04:33:41.744844 IP 10.8.3.4.54036 > 185.42.204.162.1935: Flags [.], seq 86223:87537, ack 0, win 501, options [nop,nop,TS val 1022575742 ecr 2687977673], length 1314
04:33:41.752965 IP 185.42.204.162.1935 > 10.8.3.4.54036: Flags [.], ack 78672, win 126, options [nop,nop,TS val 2687977759 ecr 1022575409], length 0
04:33:41.793986 IP 185.42.204.162.1935 > 10.8.3.4.54036: Flags [.], ack 79653, win 126, options [nop,nop,TS val 2687977800 ecr 1022575493], length 0
04:33:41.794026 IP 10.8.3.4.54036 > 185.42.204.162.1935: Flags [P.], seq 87537:88606, ack 0, win 501, options [nop,nop,TS val 1022575791 ecr 2687977800], length 1069
04:33:41.840067 IP 10.8.3.4.54036 > 185.42.204.162.1935: Flags [.], seq 88606:89920, ack 0, win 501, options [nop,nop,TS val 1022575837 ecr 2687977800], length 1314
04:33:41.874562 IP 10.8.3.4.54036 > 185.42.204.162.1935: Flags [.], seq 89920:91234, ack 0, win 501, options [nop,nop,TS val 1022575871 ecr 2687977800], length 1314
04:33:41.874892 IP 185.42.204.162.1935 > 10.8.3.4.54036: Flags [.], ack 82281, win 126, options [nop,nop,TS val 2687977881 ecr 1022575537], length 0
04:33:41.911246 IP 10.8.3.4.54036 > 185.42.204.162.1935: Flags [.], seq 91234:92548, ack 0, win 501, options [nop,nop,TS val 1022575908 ecr 2687977881], length 1314
04:33:41.974050 IP 10.8.3.4.54036 > 185.42.204.162.1935: Flags [.], seq 92548:93862, ack 0, win 501, options [nop,nop,TS val 1022575971 ecr 2687977881], length 1314
04:33:41.975132 IP 185.42.204.162.1935 > 10.8.3.4.54036: Flags [.], ack 84909, win 126, options [nop,nop,TS val 2687977981 ecr 1022575607], length 0
04:33:42.008745 IP 10.8.3.4.54036 > 185.42.204.162.1935: Flags [.], seq 93862:95176, ack 0, win 501, options [nop,nop,TS val 1022576005 ecr 2687977981], length 1314
04:33:42.043020 IP 185.42.204.162.1935 > 10.8.3.4.54036: Flags [.], ack 87537, win 126, options [nop,nop,TS val 2687978049 ecr 1022575707], length 0
04:33:42.044876 IP 10.8.3.4.54036 > 185.42.204.162.1935: Flags [.], seq 95176:96490, ack 0, win 501, options [nop,nop,TS val 1022576042 ecr 2687978049], length 1314
04:33:42.091922 IP 185.42.204.162.1935 > 10.8.3.4.54036: Flags [.], ack 88606, win 126, options [nop,nop,TS val 2687978098 ecr 1022575791], length 0
04:33:42.091959 IP 10.8.3.4.54036 > 185.42.204.162.1935: Flags [P.], seq 96490:97555, ack 0, win 501, options [nop,nop,TS val 1022576089 ecr 2687978098], length 1065
04:33:42.139299 IP 10.8.3.4.54036 > 185.42.204.162.1935: Flags [.], seq 97555:98869, ack 0, win 501, options [nop,nop,TS val 1022576136 ecr 2687978098], length 1314
04:33:42.172611 IP 185.42.204.162.1935 > 10.8.3.4.54036: Flags [.], ack 91234, win 126, options [nop,nop,TS val 2687978179 ecr 1022575837], length 0
04:33:42.178198 IP 10.8.3.4.54036 > 185.42.204.162.1935: Flags [.], seq 98869:100183, ack 0, win 501, options [nop,nop,TS val 1022576175 ecr 2687978179], length 1314
04:33:42.211728 IP 10.8.3.4.54036 > 185.42.204.162.1935: Flags [.], seq 100183:101497, ack 0, win 501, options [nop,nop,TS val 1022576208 ecr 2687978179], length 1314
04:33:42.271910 IP 185.42.204.162.1935 > 10.8.3.4.54036: Flags [.], ack 93862, win 126, options [nop,nop,TS val 2687978278 ecr 1022575908], length 0
04:33:42.276444 IP 10.8.3.4.54036 > 185.42.204.162.1935: Flags [.], seq 101497:102811, ack 0, win 501, options [nop,nop,TS val 1022576273 ecr 2687978278], length 1314
04:33:42.310698 IP 10.8.3.4.54036 > 185.42.204.162.1935: Flags [.], seq 102811:104125, ack 0, win 501, options [nop,nop,TS val 1022576307 ecr 2687978278], length 1314
04:33:42.342786 IP 185.42.204.162.1935 > 10.8.3.4.54036: Flags [.], ack 96490, win 126, options [nop,nop,TS val 2687978349 ecr 1022576005], length 0
04:33:42.345098 IP 10.8.3.4.54036 > 185.42.204.162.1935: Flags [.], seq 104125:105439, ack 0, win 501, options [nop,nop,TS val 1022576342 ecr 2687978349], length 1314
04:33:42.390044 IP 185.42.204.162.1935 > 10.8.3.4.54036: Flags [.], ack 97555, win 126, options [nop,nop,TS val 2687978396 ecr 1022576089], length 0
04:33:42.390083 IP 10.8.3.4.54036 > 185.42.204.162.1935: Flags [P.], seq 105439:106516, ack 0, win 501, options [nop,nop,TS val 1022576387 ecr 2687978396], length 1077
04:33:42.439298 IP 10.8.3.4.54036 > 185.42.204.162.1935: Flags [.], seq 106516:107830, ack 0, win 501, options [nop,nop,TS val 1022576436 ecr 2687978396], length 1314
04:33:42.476194 IP 185.42.204.162.1935 > 10.8.3.4.54036: Flags [.], ack 100183, win 126, options [nop,nop,TS val 2687978482 ecr 1022576136], length 0
04:33:42.478594 IP 10.8.3.4.54036 > 185.42.204.162.1935: Flags [.], seq 107830:109144, ack 0, win 501, options [nop,nop,TS val 1022576475 ecr 2687978482], length 1314
04:33:42.509712 IP 10.8.3.4.54036 > 185.42.204.162.1935: Flags [.], seq 109144:110458, ack 0, win 501, options [nop,nop,TS val 1022576506 ecr 2687978482], length 1314
04:33:42.574763 IP 185.42.204.162.1935 > 10.8.3.4.54036: Flags [.], ack 102811, win 126, options [nop,nop,TS val 2687978581 ecr 1022576208], length 0
04:33:42.576568 IP 10.8.3.4.54036 > 185.42.204.162.1935: Flags [.], seq 110458:111772, ack 0, win 501, options [nop,nop,TS val 1022576573 ecr 2687978581], length 1314
04:33:42.610402 IP 10.8.3.4.54036 > 185.42.204.162.1935: Flags [.], seq 111772:113086, ack 0, win 501, options [nop,nop,TS val 1022576607 ecr 2687978581], length 1314
04:33:42.643069 IP 185.42.204.162.1935 > 10.8.3.4.54036: Flags [.], ack 105439, win 126, options [nop,nop,TS val 2687978649 ecr 1022576307], length 0
04:33:42.644447 IP 10.8.3.4.54036 > 185.42.204.162.1935: Flags [.], seq 113086:114400, ack 0, win 501, options [nop,nop,TS val 1022576641 ecr 2687978649], length 1314
04:33:42.687794 IP 185.42.204.162.1935 > 10.8.3.4.54036: Flags [.], ack 106516, win 126, options [nop,nop,TS val 2687978694 ecr 1022576387], length 0
04:33:42.687817 IP 10.8.3.4.54036 > 185.42.204.162.1935: Flags [P.], seq 114400:115465, ack 0, win 501, options [nop,nop,TS val 1022576685 ecr 2687978694], length 1065
04:33:42.742428 IP 10.8.3.4.54036 > 185.42.204.162.1935: Flags [.], seq 115465:116779, ack 0, win 501, options [nop,nop,TS val 1022576739 ecr 2687978694], length 1314
04:33:42.774091 IP 10.8.3.4.54036 > 185.42.204.162.1935: Flags [.], seq 116779:118093, ack 0, win 501, options [nop,nop,TS val 1022576771 ecr 2687978694], length 1314
04:33:42.776700 IP 185.42.204.162.1935 > 10.8.3.4.54036: Flags [.], ack 109144, win 126, options [nop,nop,TS val 2687978783 ecr 1022576436], length 0
04:33:42.809369 IP 10.8.3.4.54036 > 185.42.204.162.1935: Flags [.], seq 118093:119407, ack 0, win 501, options [nop,nop,TS val 1022576806 ecr 2687978783], length 1314
04:33:42.874395 IP 185.42.204.162.1935 > 10.8.3.4.54036: Flags [.], ack 111772, win 126, options [nop,nop,TS val 2687978881 ecr 1022576506], length 0
04:33:42.878288 IP 10.8.3.4.54036 > 185.42.204.162.1935: Flags [.], seq 119407:120721, ack 0, win 501, options [nop,nop,TS val 1022576875 ecr 2687978881], length 1314
04:33:42.909488 IP 10.8.3.4.54036 > 185.42.204.162.1935: Flags [.], seq 120721:122035, ack 0, win 501, options [nop,nop,TS val 1022576906 ecr 2687978881], length 1314
04:33:42.942225 IP 185.42.204.162.1935 > 10.8.3.4.54036: Flags [.], ack 114400, win 126, options [nop,nop,TS val 2687978949 ecr 1022576607], length 0
04:33:42.943355 IP 10.8.3.4.54036 > 185.42.204.162.1935: Flags [.], seq 122035:123349, ack 0, win 501, options [nop,nop,TS val 1022576940 ecr 2687978949], length 1314
04:33:42.985785 IP 185.42.204.162.1935 > 10.8.3.4.54036: Flags [.], ack 115465, win 126, options [nop,nop,TS val 2687978992 ecr 1022576685], length 0
04:33:42.985815 IP 10.8.3.4.54036 > 185.42.204.162.1935: Flags [P.], seq 123349:124422, ack 0, win 501, options [nop,nop,TS val 1022576983 ecr 2687978992], length 1073
04:33:43.040754 IP 10.8.3.4.54036 > 185.42.204.162.1935: Flags [.], seq 124422:125736, ack 0, win 501, options [nop,nop,TS val 1022577037 ecr 2687978992], length 1314
04:33:43.071935 IP 185.42.204.162.1935 > 10.8.3.4.54036: Flags [.], ack 118093, win 126, options [nop,nop,TS val 2687979078 ecr 1022576739], length 0
04:33:43.075229 IP 10.8.3.4.54036 > 185.42.204.162.1935: Flags [.], seq 125736:127050, ack 0, win 501, options [nop,nop,TS val 1022577072 ecr 2687979078], length 1314
04:33:43.111234 IP 10.8.3.4.54036 > 185.42.204.162.1935: Flags [.], seq 127050:128364, ack 0, win 501, options [nop,nop,TS val 1022577108 ecr 2687979078], length 1314
04:33:43.174132 IP 10.8.3.4.54036 > 185.42.204.162.1935: Flags [.], seq 128364:129678, ack 0, win 501, options [nop,nop,TS val 1022577171 ecr 2687979078], length 1314
04:33:43.176141 IP 185.42.204.162.1935 > 10.8.3.4.54036: Flags [.], ack 120721, win 126, options [nop,nop,TS val 2687979183 ecr 1022576806], length 0
04:33:43.207879 IP 10.8.3.4.54036 > 185.42.204.162.1935: Flags [.], seq 129678:130992, ack 0, win 501, options [nop,nop,TS val 1022577205 ecr 2687979183], length 1314
04:33:43.241278 IP 185.42.204.162.1935 > 10.8.3.4.54036: Flags [.], ack 123349, win 126, options [nop,nop,TS val 2687979248 ecr 1022576906], length 0
04:33:43.244852 IP 10.8.3.4.54036 > 185.42.204.162.1935: Flags [.], seq 130992:132306, ack 0, win 501, options [nop,nop,TS val 1022577242 ecr 2687979248], length 1314
04:33:43.283847 IP 185.42.204.162.1935 > 10.8.3.4.54036: Flags [.], ack 124422, win 126, options [nop,nop,TS val 2687979290 ecr 1022576983], length 0
04:33:43.283883 IP 10.8.3.4.54036 > 185.42.204.162.1935: Flags [P.], seq 132306:133378, ack 0, win 501, options [nop,nop,TS val 1022577281 ecr 2687979290], length 1072
04:33:43.342318 IP 10.8.3.4.54036 > 185.42.204.162.1935: Flags [.], seq 133378:134692, ack 0, win 501, options [nop,nop,TS val 1022577339 ecr 2687979290], length 1314
04:33:43.373242 IP 185.42.204.162.1935 > 10.8.3.4.54036: Flags [.], ack 127050, win 126, options [nop,nop,TS val 2687979379 ecr 1022577037], length 0
04:33:43.377571 IP 10.8.3.4.54036 > 185.42.204.162.1935: Flags [.], seq 134692:136006, ack 0, win 501, options [nop,nop,TS val 1022577374 ecr 2687979379], length 1314
04:33:43.411636 IP 10.8.3.4.54036 > 185.42.204.162.1935: Flags [.], seq 136006:137320, ack 0, win 501, options [nop,nop,TS val 1022577408 ecr 2687979379], length 1314
04:33:43.471967 IP 185.42.204.162.1935 > 10.8.3.4.54036: Flags [.], ack 129678, win 126, options [nop,nop,TS val 2687979478 ecr 1022577108], length 0
04:33:43.475854 IP 10.8.3.4.54036 > 185.42.204.162.1935: Flags [.], seq 137320:138634, ack 0, win 501, options [nop,nop,TS val 1022577473 ecr 2687979478], length 1314
04:33:43.507545 IP 10.8.3.4.54036 > 185.42.204.162.1935: Flags [.], seq 138634:139948, ack 0, win 501, options [nop,nop,TS val 1022577504 ecr 2687979478], length 1314
04:33:43.542803 IP 185.42.204.162.1935 > 10.8.3.4.54036: Flags [.], ack 132306, win 126, options [nop,nop,TS val 2687979549 ecr 1022577205], length 0
04:33:43.544145 IP 10.8.3.4.54036 > 185.42.204.162.1935: Flags [.], seq 139948:141262, ack 0, win 501, options [nop,nop,TS val 1022577541 ecr 2687979549], length 1314
04:33:43.581634 IP 185.42.204.162.1935 > 10.8.3.4.54036: Flags [.], ack 133378, win 126, options [nop,nop,TS val 2687979588 ecr 1022577281], length 0
04:33:43.581669 IP 10.8.3.4.54036 > 185.42.204.162.1935: Flags [P.], seq 141262:142323, ack 0, win 501, options [nop,nop,TS val 1022577578 ecr 2687979588], length 1061
04:33:43.643992 IP 10.8.3.4.54036 > 185.42.204.162.1935: Flags [.], seq 142323:143637, ack 0, win 501, options [nop,nop,TS val 1022577641 ecr 2687979588], length 1314
04:33:43.675556 IP 185.42.204.162.1935 > 10.8.3.4.54036: Flags [.], ack 136006, win 126, options [nop,nop,TS val 2687979682 ecr 1022577339], length 0
04:33:43.677373 IP 10.8.3.4.54036 > 185.42.204.162.1935: Flags [.], seq 143637:144951, ack 0, win 501, options [nop,nop,TS val 1022577674 ecr 2687979682], length 1314
04:33:43.710970 IP 10.8.3.4.54036 > 185.42.204.162.1935: Flags [.], seq 144951:146265, ack 0, win 501, options [nop,nop,TS val 1022577708 ecr 2687979682], length 1314
04:33:43.773666 IP 185.42.204.162.1935 > 10.8.3.4.54036: Flags [.], ack 138634, win 126, options [nop,nop,TS val 2687979780 ecr 1022577408], length 0
04:33:43.777237 IP 10.8.3.4.54036 > 185.42.204.162.1935: Flags [.], seq 146265:147579, ack 0, win 501, options [nop,nop,TS val 1022577774 ecr 2687979780], length 1314
04:33:43.809850 IP 10.8.3.4.54036 > 185.42.204.162.1935: Flags [.], seq 147579:148893, ack 0, win 501, options [nop,nop,TS val 1022577807 ecr 2687979780], length 1314
04:33:43.841925 IP 185.42.204.162.1935 > 10.8.3.4.54036: Flags [.], ack 141262, win 126, options [nop,nop,TS val 2687979848 ecr 1022577504], length 0
04:33:43.842708 IP 10.8.3.4.54036 > 185.42.204.162.1935: Flags [.], seq 148893:150207, ack 0, win 501, options [nop,nop,TS val 1022577839 ecr 2687979848], length 1314
04:33:43.879836 IP 185.42.204.162.1935 > 10.8.3.4.54036: Flags [.], ack 142323, win 126, options [nop,nop,TS val 2687979886 ecr 1022577578], length 0
04:33:43.879866 IP 10.8.3.4.54036 > 185.42.204.162.1935: Flags [P.], seq 150207:151284, ack 0, win 501, options [nop,nop,TS val 1022577877 ecr 2687979886], length 1077
04:33:43.944394 IP 10.8.3.4.54036 > 185.42.204.162.1935: Flags [.], seq 151284:152598, ack 0, win 501, options [nop,nop,TS val 1022577941 ecr 2687979886], length 1314
04:33:43.975629 IP 185.42.204.162.1935 > 10.8.3.4.54036: Flags [.], ack 144951, win 126, options [nop,nop,TS val 2687979982 ecr 1022577641], length 0
04:33:43.977654 IP 10.8.3.4.54036 > 185.42.204.162.1935: Flags [.], seq 152598:153912, ack 0, win 501, options [nop,nop,TS val 1022577974 ecr 2687979982], length 1314
04:33:44.011156 IP 10.8.3.4.54036 > 185.42.204.162.1935: Flags [.], seq 153912:155226, ack 0, win 501, options [nop,nop,TS val 1022578008 ecr 2687979982], length 1314
04:33:44.075193 IP 185.42.204.162.1935 > 10.8.3.4.54036: Flags [.], ack 147579, win 126, options [nop,nop,TS val 2687980081 ecr 1022577708], length 0
04:33:44.077506 IP 10.8.3.4.54036 > 185.42.204.162.1935: Flags [.], seq 155226:156540, ack 0, win 501, options [nop,nop,TS val 1022578074 ecr 2687980081], length 1314
04:33:44.110736 IP 10.8.3.4.54036 > 185.42.204.162.1935: Flags [.], seq 156540:157854, ack 0, win 501, options [nop,nop,TS val 1022578107 ecr 2687980081], length 1314
04:33:44.140623 IP 185.42.204.162.1935 > 10.8.3.4.54036: Flags [.], ack 150207, win 126, options [nop,nop,TS val 2687980147 ecr 1022577807], length 0
04:33:44.144391 IP 10.8.3.4.54036 > 185.42.204.162.1935: Flags [.], seq 157854:159168, ack 0, win 501, options [nop,nop,TS val 1022578141 ecr 2687980147], length 1314
04:33:44.177915 IP 185.42.204.162.1935 > 10.8.3.4.54036: Flags [.], ack 151284, win 126, options [nop,nop,TS val 2687980184 ecr 1022577877], length 0
04:33:44.177943 IP 10.8.3.4.54036 > 185.42.204.162.1935: Flags [P.], seq 159168:160236, ack 0, win 501, options [nop,nop,TS val 1022578175 ecr 2687980184], length 1068
04:33:44.244353 IP 10.8.3.4.54036 > 185.42.204.162.1935: Flags [.], seq 160236:161550, ack 0, win 501, options [nop,nop,TS val 1022578241 ecr 2687980184], length 1314
04:33:44.275769 IP 185.42.204.162.1935 > 10.8.3.4.54036: Flags [.], ack 153912, win 126, options [nop,nop,TS val 2687980282 ecr 1022577941], length 0
04:33:44.277695 IP 10.8.3.4.54036 > 185.42.204.162.1935: Flags [.], seq 161550:162864, ack 0, win 501, options [nop,nop,TS val 1022578274 ecr 2687980282], length 1314
04:33:44.311019 IP 10.8.3.4.54036 > 185.42.204.162.1935: Flags [.], seq 162864:164178, ack 0, win 501, options [nop,nop,TS val 1022578308 ecr 2687980282], length 1314
04:33:44.375504 IP 185.42.204.162.1935 > 10.8.3.4.54036: Flags [.], ack 156540, win 126, options [nop,nop,TS val 2687980382 ecr 1022578008], length 0
04:33:44.377484 IP 10.8.3.4.54036 > 185.42.204.162.1935: Flags [.], seq 164178:165492, ack 0, win 501, options [nop,nop,TS val 1022578374 ecr 2687980382], length 1314
04:33:44.411271 IP 10.8.3.4.54036 > 185.42.204.162.1935: Flags [.], seq 165492:166806, ack 0, win 501, options [nop,nop,TS val 1022578408 ecr 2687980382], length 1314
04:33:44.442387 IP 185.42.204.162.1935 > 10.8.3.4.54036: Flags [.], ack 159168, win 126, options [nop,nop,TS val 2687980449 ecr 1022578107], length 0
04:33:44.444379 IP 10.8.3.4.54036 > 185.42.204.162.1935: Flags [.], seq 166806:168120, ack 0, win 501, options [nop,nop,TS val 1022578441 ecr 2687980449], length 1314
04:33:44.475916 IP 185.42.204.162.1935 > 10.8.3.4.54036: Flags [.], ack 160236, win 126, options [nop,nop,TS val 2687980482 ecr 1022578175], length 0
04:33:44.475953 IP 10.8.3.4.54036 > 185.42.204.162.1935: Flags [P.], seq 168120:168342, ack 0, win 501, options [nop,nop,TS val 1022578473 ecr 2687980482], length 222
04:33:44.511681 IP 10.8.3.4.54036 > 185.42.204.162.1935: Flags [.], seq 168342:169656, ack 0, win 501, options [nop,nop,TS val 1022578508 ecr 2687980482], length 1314
04:33:44.543026 IP 10.8.3.4.54036 > 185.42.204.162.1935: Flags [.], seq 169656:170970, ack 0, win 501, options [nop,nop,TS val 1022578540 ecr 2687980482], length 1314
04:33:44.575610 IP 185.42.204.162.1935 > 10.8.3.4.54036: Flags [.], ack 162864, win 126, options [nop,nop,TS val 2687980582 ecr 1022578241], length 0
04:33:44.600166 IP 10.8.3.4.54036 > 185.42.204.162.1935: Flags [.], seq 170970:172284, ack 0, win 501, options [nop,nop,TS val 1022578597 ecr 2687980582], length 1314
04:33:44.644887 IP 10.8.3.4.54036 > 185.42.204.162.1935: Flags [.], seq 172284:173598, ack 0, win 501, options [nop,nop,TS val 1022578642 ecr 2687980582], length 1314
04:33:44.675496 IP 185.42.204.162.1935 > 10.8.3.4.54036: Flags [.], ack 165492, win 126, options [nop,nop,TS val 2687980682 ecr 1022578308], length 0
04:33:44.678352 IP 10.8.3.4.54036 > 185.42.204.162.1935: Flags [.], seq 173598:174912, ack 0, win 501, options [nop,nop,TS val 1022578675 ecr 2687980682], length 1314
04:33:44.729044 IP 10.8.3.4.54036 > 185.42.204.162.1935: Flags [.], seq 174912:176226, ack 0, win 501, options [nop,nop,TS val 1022578726 ecr 2687980682], length 1314
04:33:44.742279 IP 185.42.204.162.1935 > 10.8.3.4.54036: Flags [.], ack 168120, win 126, options [nop,nop,TS val 2687980749 ecr 1022578408], length 0
04:33:44.773800 IP 185.42.204.162.1935 > 10.8.3.4.54036: Flags [.], ack 168342, win 126, options [nop,nop,TS val 2687980780 ecr 1022578473], length 0
04:33:44.773830 IP 10.8.3.4.54036 > 185.42.204.162.1935: Flags [P.], seq 176226:177303, ack 0, win 501, options [nop,nop,TS val 1022578771 ecr 2687980780], length 1077
04:33:44.809950 IP 10.8.3.4.54036 > 185.42.204.162.1935: Flags [.], seq 177303:178617, ack 0, win 501, options [nop,nop,TS val 1022578807 ecr 2687980780], length 1314
04:33:44.840896 IP 185.42.204.162.1935 > 10.8.3.4.54036: Flags [.], ack 170970, win 126, options [nop,nop,TS val 2687980847 ecr 1022578508], length 0
04:33:44.844631 IP 10.8.3.4.54036 > 185.42.204.162.1935: Flags [.], seq 178617:179931, ack 0, win 501, options [nop,nop,TS val 1022578841 ecr 2687980847], length 1314
04:33:44.900624 IP 10.8.3.4.54036 > 185.42.204.162.1935: Flags [.], seq 179931:181245, ack 0, win 501, options [nop,nop,TS val 1022578897 ecr 2687980847], length 1314
04:33:44.942966 IP 185.42.204.162.1935 > 10.8.3.4.54036: Flags [.], ack 173598, win 126, options [nop,nop,TS val 2687980949 ecr 1022578597], length 0
04:33:44.943327 IP 10.8.3.4.54036 > 185.42.204.162.1935: Flags [.], seq 181245:182559, ack 0, win 501, options [nop,nop,TS val 1022578940 ecr 2687980949], length 1314
04:33:44.976103 IP 10.8.3.4.54036 > 185.42.204.162.1935: Flags [.], seq 182559:183873, ack 0, win 501, options [nop,nop,TS val 1022578973 ecr 2687980949], length 1314
04:33:45.027025 IP 185.42.204.162.1935 > 10.8.3.4.54036: Flags [.], ack 176226, win 126, options [nop,nop,TS val 2687981033 ecr 1022578675], length 0
04:33:45.029009 IP 10.8.3.4.54036 > 185.42.204.162.1935: Flags [.], seq 183873:185187, ack 0, win 501, options [nop,nop,TS val 1022579026 ecr 2687981033], length 1314
04:33:45.071634 IP 185.42.204.162.1935 > 10.8.3.4.54036: Flags [.], ack 177303, win 126, options [nop,nop,TS val 2687981078 ecr 1022578771], length 0
04:33:45.071662 IP 10.8.3.4.54036 > 185.42.204.162.1935: Flags [P.], seq 185187:186156, ack 0, win 501, options [nop,nop,TS val 1022579068 ecr 2687981078], length 969
04:33:45.110771 IP 10.8.3.4.54036 > 185.42.204.162.1935: Flags [.], seq 186156:187470, ack 0, win 501, options [nop,nop,TS val 1022579107 ecr 2687981078], length 1314
04:33:45.142556 IP 185.42.204.162.1935 > 10.8.3.4.54036: Flags [.], ack 179931, win 126, options [nop,nop,TS val 2687981149 ecr 1022578807], length 0
04:33:45.144578 IP 10.8.3.4.54036 > 185.42.204.162.1935: Flags [.], seq 187470:188784, ack 0, win 501, options [nop,nop,TS val 1022579141 ecr 2687981149], length 1314
04:33:45.178970 IP 10.8.3.4.54036 > 185.42.204.162.1935: Flags [.], seq 188784:190098, ack 0, win 501, options [nop,nop,TS val 1022579176 ecr 2687981149], length 1314
04:33:45.241068 IP 185.42.204.162.1935 > 10.8.3.4.54036: Flags [.], ack 182559, win 126, options [nop,nop,TS val 2687981247 ecr 1022578897], length 0
04:33:45.244393 IP 10.8.3.4.54036 > 185.42.204.162.1935: Flags [.], seq 190098:191412, ack 0, win 501, options [nop,nop,TS val 1022579241 ecr 2687981247], length 1314
04:33:45.278027 IP 10.8.3.4.54036 > 185.42.204.162.1935: Flags [.], seq 191412:192726, ack 0, win 501, options [nop,nop,TS val 1022579275 ecr 2687981247], length 1314
04:33:45.310766 IP 10.8.3.4.54036 > 185.42.204.162.1935: Flags [.], seq 192726:194040, ack 0, win 501, options [nop,nop,TS val 1022579307 ecr 2687981247], length 1314
04:33:45.327283 IP 185.42.204.162.1935 > 10.8.3.4.54036: Flags [.], ack 185187, win 126, options [nop,nop,TS val 2687981333 ecr 1022578973], length 0
04:33:45.369696 IP 185.42.204.162.1935 > 10.8.3.4.54036: Flags [.], ack 186156, win 126, options [nop,nop,TS val 2687981376 ecr 1022579068], length 0
04:33:45.369732 IP 10.8.3.4.54036 > 185.42.204.162.1935: Flags [P.], seq 194040:195109, ack 0, win 501, options [nop,nop,TS val 1022579366 ecr 2687981376], length 1069
04:33:45.414677 IP 10.8.3.4.54036 > 185.42.204.162.1935: Flags [.], seq 195109:196423, ack 0, win 501, options [nop,nop,TS val 1022579411 ecr 2687981376], length 1314
04:33:45.442787 IP 185.42.204.162.1935 > 10.8.3.4.54036: Flags [.], ack 188784, win 126, options [nop,nop,TS val 2687981449 ecr 1022579107], length 0
04:33:45.445176 IP 10.8.3.4.54036 > 185.42.204.162.1935: Flags [.], seq 196423:197737, ack 0, win 501, options [nop,nop,TS val 1022579442 ecr 2687981449], length 1314
04:33:45.479097 IP 10.8.3.4.54036 > 185.42.204.162.1935: Flags [.], seq 197737:199051, ack 0, win 501, options [nop,nop,TS val 1022579476 ecr 2687981449], length 1314
04:33:45.542231 IP 185.42.204.162.1935 > 10.8.3.4.54036: Flags [.], ack 191412, win 126, options [nop,nop,TS val 2687981548 ecr 1022579176], length 0
04:33:45.543123 IP 10.8.3.4.54036 > 185.42.204.162.1935: Flags [.], seq 199051:200365, ack 0, win 501, options [nop,nop,TS val 1022579540 ecr 2687981548], length 1314
04:33:45.574070 IP 10.8.3.4.54036 > 185.42.204.162.1935: Flags [.], seq 200365:201679, ack 0, win 501, options [nop,nop,TS val 1022579571 ecr 2687981548], length 1314
04:33:45.608131 IP 10.8.3.4.54036 > 185.42.204.162.1935: Flags [.], seq 201679:202993, ack 0, win 501, options [nop,nop,TS val 1022579605 ecr 2687981548], length 1314
04:33:45.608777 IP 185.42.204.162.1935 > 10.8.3.4.54036: Flags [.], ack 194040, win 126, options [nop,nop,TS val 2687981615 ecr 1022579275], length 0
04:33:45.667688 IP 185.42.204.162.1935 > 10.8.3.4.54036: Flags [.], ack 195109, win 126, options [nop,nop,TS val 2687981674 ecr 1022579366], length 0
04:33:45.667726 IP 10.8.3.4.54036 > 185.42.204.162.1935: Flags [P.], seq 202993:204069, ack 0, win 501, options [nop,nop,TS val 1022579664 ecr 2687981674], length 1076
04:33:45.714036 IP 10.8.3.4.54036 > 185.42.204.162.1935: Flags [.], seq 204069:205383, ack 0, win 501, options [nop,nop,TS val 1022579711 ecr 2687981674], length 1314
04:33:45.741992 IP 10.8.3.4.54036 > 185.42.204.162.1935: Flags [.], seq 205383:206697, ack 0, win 501, options [nop,nop,TS val 1022579739 ecr 2687981674], length 1314
04:33:45.742950 IP 185.42.204.162.1935 > 10.8.3.4.54036: Flags [.], ack 197737, win 126, options [nop,nop,TS val 2687981749 ecr 1022579411], length 0
04:33:45.777802 IP 10.8.3.4.54036 > 185.42.204.162.1935: Flags [.], seq 206697:208011, ack 0, win 501, options [nop,nop,TS val 1022579774 ecr 2687981749], length 1314
04:33:45.841063 IP 185.42.204.162.1935 > 10.8.3.4.54036: Flags [.], ack 200365, win 126, options [nop,nop,TS val 2687981847 ecr 1022579476], length 0
