19:48:05.574297 IP 99.181.105.48.1935 > 10.8.3.4.33366: Flags [.], ack 665885814, win 126, options [nop,nop,TS val 2834684002 ecr 1656778952], length 0
19:48:05.577140 IP 10.8.3.4.33366 > 99.181.105.48.1935: Flags [.], seq 4617:5931, ack 0, win 501, options [nop,nop,TS val 1656779208 ecr 2834684002], length 1314
19:48:05.603877 IP 99.181.105.48.1935 > 10.8.3.4.33366: Flags [.], ack 675, win 126, options [nop,nop,TS val 2834684031 ecr 1656779035], length 0
19:48:05.603908 IP 10.8.3.4.33366 > 99.181.105.48.1935: Flags [P.], seq 5931:6709, ack 0, win 501, options [nop,nop,TS val 1656779235 ecr 2834684031], length 778
19:48:05.642698 IP 10.8.3.4.33366 > 99.181.105.48.1935: Flags [.], seq 6709:8023, ack 0, win 501, options [nop,nop,TS val 1656779274 ecr 2834684031], length 1314
19:48:05.674544 IP 99.181.105.48.1935 > 10.8.3.4.33366: Flags [.], ack 3303, win 126, options [nop,nop,TS val 2834684102 ecr 1656779080], length 0
19:48:05.684550 IP 10.8.3.4.33366 > 99.181.105.48.1935: Flags [.], seq 8023:9337, ack 0, win 501, options [nop,nop,TS val 1656779316 ecr 2834684102], length 1314
19:48:05.727545 IP 10.8.3.4.33366 > 99.181.105.48.1935: Flags [.], seq 9337:10651, ack 0, win 501, options [nop,nop,TS val 1656779359 ecr 2834684102], length 1314
19:48:05.774442 IP 10.8.3.4.33366 > 99.181.105.48.1935: Flags [.], seq 10651:11965, ack 0, win 501, options [nop,nop,TS val 1656779406 ecr 2834684102], length 1314
19:48:05.776864 IP 99.181.105.48.1935 > 10.8.3.4.33366: Flags [.], ack 5931, win 126, options [nop,nop,TS val 2834684204 ecr 1656779144], length 0
19:48:05.803533 IP 99.181.105.48.1935 > 10.8.3.4.33366: Flags [.], ack 6709, win 126, options [nop,nop,TS val 2834684231 ecr 1656779235], length 0
19:48:05.803571 IP 10.8.3.4.33366 > 99.181.105.48.1935: Flags [P.], seq 11965:12651, ack 0, win 501, options [nop,nop,TS val 1656779435 ecr 2834684231], length 686
19:48:05.842628 IP 10.8.3.4.33366 > 99.181.105.48.1935: Flags [.], seq 12651:13965, ack 0, win 501, options [nop,nop,TS val 1656779474 ecr 2834684231], length 1314
19:48:05.877520 IP 10.8.3.4.33366 > 99.181.105.48.1935: Flags [.], seq 13965:15279, ack 0, win 501, options [nop,nop,TS val 1656779509 ecr 2834684231], length 1314
19:48:05.884266 IP 99.181.105.48.1935 > 10.8.3.4.33366: Flags [.], ack 9337, win 126, options [nop,nop,TS val 2834684312 ecr 1656779274], length 0
19:48:05.920150 IP 10.8.3.4.33366 > 99.181.105.48.1935: Flags [.], seq 15279:16593, ack 0, win 501, options [nop,nop,TS val 1656779551 ecr 2834684312], length 1314
19:48:05.974125 IP 99.181.105.48.1935 > 10.8.3.4.33366: Flags [.], ack 11965, win 126, options [nop,nop,TS val 2834684402 ecr 1656779359], length 0
19:48:05.984324 IP 10.8.3.4.33366 > 99.181.105.48.1935: Flags [.], seq 16593:17907, ack 0, win 501, options [nop,nop,TS val 1656779616 ecr 2834684402], length 1314
19:48:06.004722 IP 99.181.105.48.1935 > 10.8.3.4.33366: Flags [.], ack 12651, win 126, options [nop,nop,TS val 2834684431 ecr 1656779435], length 0
19:48:06.004780 IP 10.8.3.4.33366 > 99.181.105.48.1935: Flags [P.], seq 17907:18589, ack 0, win 501, options [nop,nop,TS val 1656779636 ecr 2834684431], length 682
19:48:06.048321 IP 10.8.3.4.33366 > 99.181.105.48.1935: Flags [.], seq 18589:19903, ack 0, win 501, options [nop,nop,TS val 1656779680 ecr 2834684431], length 1314
19:48:06.072224 IP 10.8.3.4.33366 > 99.181.105.48.1935: Flags [.], seq 19903:21217, ack 0, win 501, options [nop,nop,TS val 1656779704 ecr 2834684431], length 1314
19:48:06.076995 IP 99.181.105.48.1935 > 10.8.3.4.33366: Flags [.], ack 15279, win 126, options [nop,nop,TS val 2834684505 ecr 1656779474], length 0
19:48:06.111888 IP 10.8.3.4.33366 > 99.181.105.48.1935: Flags [.], seq 21217:22531, ack 0, win 501, options [nop,nop,TS val 1656779743 ecr 2834684505], length 1314
19:48:06.175616 IP 10.8.3.4.33366 > 99.181.105.48.1935: Flags [.], seq 22531:23845, ack 0, win 501, options [nop,nop,TS val 1656779807 ecr 2834684505], length 1314
19:48:06.183835 IP 99.181.105.48.1935 > 10.8.3.4.33366: Flags [.], ack 17907, win 126, options [nop,nop,TS val 2834684612 ecr 1656779551], length 0
19:48:06.205301 IP 99.181.105.48.1935 > 10.8.3.4.33366: Flags [.], ack 18589, win 126, options [nop,nop,TS val 2834684633 ecr 1656779636], length 0
19:48:06.205323 IP 10.8.3.4.33366 > 99.181.105.48.1935: Flags [P.], seq 23845:24615, ack 0, win 501, options [nop,nop,TS val 1656779837 ecr 2834684633], length 770
19:48:06.239258 IP 10.8.3.4.33366 > 99.181.105.48.1935: Flags [.], seq 24615:25929, ack 0, win 501, options [nop,nop,TS val 1656779871 ecr 2834684633], length 1314
19:48:06.272283 IP 99.181.105.48.1935 > 10.8.3.4.33366: Flags [.], ack 21217, win 126, options [nop,nop,TS val 2834684700 ecr 1656779680], length 0
19:48:06.281981 IP 10.8.3.4.33366 > 99.181.105.48.1935: Flags [.], seq 25929:27243, ack 0, win 501, options [nop,nop,TS val 1656779913 ecr 2834684700], length 1314
19:48:06.324954 IP 10.8.3.4.33366 > 99.181.105.48.1935: Flags [.], seq 27243:28557, ack 0, win 501, options [nop,nop,TS val 1656779956 ecr 2834684700], length 1314
19:48:06.375468 IP 99.181.105.48.1935 > 10.8.3.4.33366: Flags [.], ack 23845, win 126, options [nop,nop,TS val 2834684803 ecr 1656779743], length 0
19:48:06.376081 IP 10.8.3.4.33366 > 99.181.105.48.1935: Flags [.], seq 28557:29871, ack 0, win 501, options [nop,nop,TS val 1656780007 ecr 2834684803], length 1314
19:48:06.405290 IP 99.181.105.48.1935 > 10.8.3.4.33366: Flags [.], ack 24615, win 126, options [nop,nop,TS val 2834684833 ecr 1656779837], length 0
19:48:06.405320 IP 10.8.3.4.33366 > 99.181.105.48.1935: Flags [P.], seq 29871:30557, ack 0, win 501, options [nop,nop,TS val 1656780037 ecr 2834684833], length 686
19:48:06.439574 IP 10.8.3.4.33366 > 99.181.105.48.1935: Flags [.], seq 30557:31871, ack 0, win 501, options [nop,nop,TS val 1656780071 ecr 2834684833], length 1314
19:48:06.474490 IP 10.8.3.4.33366 > 99.181.105.48.1935: Flags [.], seq 31871:33185, ack 0, win 501, options [nop,nop,TS val 1656780106 ecr 2834684833], length 1314
19:48:06.481807 IP 99.181.105.48.1935 > 10.8.3.4.33366: Flags [.], ack 27243, win 126, options [nop,nop,TS val 2834684909 ecr 1656779871], length 0
19:48:06.517219 IP 10.8.3.4.33366 > 99.181.105.48.1935: Flags [.], seq 33185:34499, ack 0, win 501, options [nop,nop,TS val 1656780149 ecr 2834684909], length 1314
19:48:06.575742 IP 99.181.105.48.1935 > 10.8.3.4.33366: Flags [.], ack 29871, win 126, options [nop,nop,TS val 2834685003 ecr 1656779956], length 0
19:48:06.581344 IP 10.8.3.4.33366 > 99.181.105.48.1935: Flags [.], seq 34499:35813, ack 0, win 501, options [nop,nop,TS val 1656780213 ecr 2834685003], length 1314
19:48:06.605324 IP 99.181.105.48.1935 > 10.8.3.4.33366: Flags [.], ack 30557, win 126, options [nop,nop,TS val 2834685033 ecr 1656780037], length 0
19:48:06.605351 IP 10.8.3.4.33366 > 99.181.105.48.1935: Flags [P.], seq 35813:36594, ack 0, win 501, options [nop,nop,TS val 1656780237 ecr 2834685033], length 781
19:48:06.645078 IP 10.8.3.4.33366 > 99.181.105.48.1935: Flags [.], seq 36594:37908, ack 0, win 501, options [nop,nop,TS val 1656780276 ecr 2834685033], length 1314
19:48:06.673781 IP 10.8.3.4.33366 > 99.181.105.48.1935: Flags [.], seq 37908:39222, ack 0, win 501, options [nop,nop,TS val 1656780305 ecr 2834685033], length 1314
19:48:06.673993 IP 99.181.105.48.1935 > 10.8.3.4.33366: Flags [.], ack 33185, win 126, options [nop,nop,TS val 2834685102 ecr 1656780071], length 0
19:48:06.729888 IP 10.8.3.4.33366 > 99.181.105.48.1935: Flags [.], seq 39222:40536, ack 0, win 501, options [nop,nop,TS val 1656780361 ecr 2834685102], length 1314
19:48:06.774975 IP 10.8.3.4.33366 > 99.181.105.48.1935: Flags [.], seq 40536:41850, ack 0, win 501, options [nop,nop,TS val 1656780406 ecr 2834685102], length 1314
19:48:06.780902 IP 99.181.105.48.1935 > 10.8.3.4.33366: Flags [.], ack 35813, win 126, options [nop,nop,TS val 2834685208 ecr 1656780149], length 0
19:48:06.805029 IP 99.181.105.48.1935 > 10.8.3.4.33366: Flags [.], ack 36594, win 126, options [nop,nop,TS val 2834685232 ecr 1656780237], length 0
19:48:06.805119 IP 10.8.3.4.33366 > 99.181.105.48.1935: Flags [P.], seq 41850:42532, ack 0, win 501, options [nop,nop,TS val 1656780436 ecr 2834685232], length 682
19:48:06.841257 IP 10.8.3.4.33366 > 99.181.105.48.1935: Flags [.], seq 42532:43846, ack 0, win 501, options [nop,nop,TS val 1656780473 ecr 2834685232], length 1314
19:48:06.873368 IP 99.181.105.48.1935 > 10.8.3.4.33366: Flags [.], ack 39222, win 126, options [nop,nop,TS val 2834685301 ecr 1656780276], length 0
19:48:06.879318 IP 10.8.3.4.33366 > 99.181.105.48.1935: Flags [.], seq 43846:45160, ack 0, win 501, options [nop,nop,TS val 1656780511 ecr 2834685301], length 1314
19:48:06.922365 IP 10.8.3.4.33366 > 99.181.105.48.1935: Flags [.], seq 45160:46474, ack 0, win 501, options [nop,nop,TS val 1656780554 ecr 2834685301], length 1314
19:48:06.974333 IP 10.8.3.4.33366 > 99.181.105.48.1935: Flags [.], seq 46474:47788, ack 0, win 501, options [nop,nop,TS val 1656780606 ecr 2834685301], length 1314
19:48:06.974615 IP 99.181.105.48.1935 > 10.8.3.4.33366: Flags [.], ack 41850, win 126, options [nop,nop,TS val 2834685402 ecr 1656780361], length 0
19:48:07.005827 IP 99.181.105.48.1935 > 10.8.3.4.33366: Flags [.], ack 42532, win 126, options [nop,nop,TS val 2834685432 ecr 1656780436], length 0
19:48:07.005884 IP 10.8.3.4.33366 > 99.181.105.48.1935: Flags [P.], seq 47788:48462, ack 0, win 501, options [nop,nop,TS val 1656780637 ecr 2834685432], length 674
19:48:07.050350 IP 10.8.3.4.33366 > 99.181.105.48.1935: Flags [.], seq 48462:49776, ack 0, win 501, options [nop,nop,TS val 1656780682 ecr 2834685432], length 1314
19:48:07.076074 IP 10.8.3.4.33366 > 99.181.105.48.1935: Flags [.], seq 49776:51090, ack 0, win 501, options [nop,nop,TS val 1656780707 ecr 2834685432], length 1314
19:48:07.078866 IP 99.181.105.48.1935 > 10.8.3.4.33366: Flags [.], ack 45160, win 126, options [nop,nop,TS val 2834685506 ecr 1656780473], length 0
19:48:07.114456 IP 10.8.3.4.33366 > 99.181.105.48.1935: Flags [.], seq 51090:52404, ack 0, win 501, options [nop,nop,TS val 1656780746 ecr 2834685506], length 1314
19:48:07.173830 IP 99.181.105.48.1935 > 10.8.3.4.33366: Flags [.], ack 47788, win 126, options [nop,nop,TS val 2834685601 ecr 1656780554], length 0
19:48:07.178479 IP 10.8.3.4.33366 > 99.181.105.48.1935: Flags [.], seq 52404:53718, ack 0, win 501, options [nop,nop,TS val 1656780810 ecr 2834685601], length 1314
19:48:07.205809 IP 99.181.105.48.1935 > 10.8.3.4.33366: Flags [.], ack 48462, win 126, options [nop,nop,TS val 2834685633 ecr 1656780637], length 0
19:48:07.205835 IP 10.8.3.4.33366 > 99.181.105.48.1935: Flags [P.], seq 53718:54495, ack 0, win 501, options [nop,nop,TS val 1656780837 ecr 2834685633], length 777
19:48:07.242365 IP 10.8.3.4.33366 > 99.181.105.48.1935: Flags [.], seq 54495:55809, ack 0, win 501, options [nop,nop,TS val 1656780874 ecr 2834685633], length 1314
19:48:07.275594 IP 99.181.105.48.1935 > 10.8.3.4.33366: Flags [.], ack 51090, win 126, options [nop,nop,TS val 2834685703 ecr 1656780682], length 0
19:48:07.284922 IP 10.8.3.4.33366 > 99.181.105.48.1935: Flags [.], seq 55809:57123, ack 0, win 501, options [nop,nop,TS val 1656780916 ecr 2834685703], length 1314
19:48:07.327447 IP 10.8.3.4.33366 > 99.181.105.48.1935: Flags [.], seq 57123:58437, ack 0, win 501, options [nop,nop,TS val 1656780959 ecr 2834685703], length 1314
19:48:07.373480 IP 10.8.3.4.33366 > 99.181.105.48.1935: Flags [.], seq 58437:59751, ack 0, win 501, options [nop,nop,TS val 1656781005 ecr 2834685703], length 1314
19:48:07.377838 IP 99.181.105.48.1935 > 10.8.3.4.33366: Flags [.], ack 53718, win 126, options [nop,nop,TS val 2834685806 ecr 1656780746], length 0
19:48:07.405160 IP 99.181.105.48.1935 > 10.8.3.4.33366: Flags [.], ack 54495, win 126, options [nop,nop,TS val 2834685833 ecr 1656780837], length 0
19:48:07.405217 IP 10.8.3.4.33366 > 99.181.105.48.1935: Flags [P.], seq 59751:60437, ack 0, win 501, options [nop,nop,TS val 1656781037 ecr 2834685833], length 686
19:48:07.438490 IP 10.8.3.4.33366 > 99.181.105.48.1935: Flags [.], seq 60437:61751, ack 0, win 501, options [nop,nop,TS val 1656781070 ecr 2834685833], length 1314
19:48:07.476263 IP 10.8.3.4.33366 > 99.181.105.48.1935: Flags [.], seq 61751:63065, ack 0, win 501, options [nop,nop,TS val 1656781108 ecr 2834685833], length 1314
19:48:07.484303 IP 99.181.105.48.1935 > 10.8.3.4.33366: Flags [.], ack 57123, win 126, options [nop,nop,TS val 2834685912 ecr 1656780874], length 0
19:48:07.518914 IP 10.8.3.4.33366 > 99.181.105.48.1935: Flags [.], seq 63065:64379, ack 0, win 501, options [nop,nop,TS val 1656781150 ecr 2834685912], length 1314
19:48:07.573920 IP 99.181.105.48.1935 > 10.8.3.4.33366: Flags [.], ack 59751, win 126, options [nop,nop,TS val 2834686001 ecr 1656780959], length 0
19:48:07.583505 IP 10.8.3.4.33366 > 99.181.105.48.1935: Flags [.], seq 64379:65693, ack 0, win 501, options [nop,nop,TS val 1656781215 ecr 2834686001], length 1314
19:48:07.604717 IP 99.181.105.48.1935 > 10.8.3.4.33366: Flags [.], ack 60437, win 126, options [nop,nop,TS val 2834686032 ecr 1656781037], length 0
19:48:07.604766 IP 10.8.3.4.33366 > 99.181.105.48.1935: Flags [P.], seq 65693:66376, ack 0, win 501, options [nop,nop,TS val 1656781236 ecr 2834686032], length 683
19:48:07.648038 IP 10.8.3.4.33366 > 99.181.105.48.1935: Flags [.], seq 66376:67690, ack 0, win 501, options [nop,nop,TS val 1656781279 ecr 2834686032], length 1314
19:48:07.675966 IP 99.181.105.48.1935 > 10.8.3.4.33366: Flags [.], ack 63065, win 126, options [nop,nop,TS val 2834686104 ecr 1656781070], length 0
19:48:07.676131 IP 10.8.3.4.33366 > 99.181.105.48.1935: Flags [.], seq 67690:69004, ack 0, win 501, options [nop,nop,TS val 1656781307 ecr 2834686104], length 1314
19:48:07.712579 IP 10.8.3.4.33366 > 99.181.105.48.1935: Flags [.], seq 69004:70318, ack 0, win 501, options [nop,nop,TS val 1656781344 ecr 2834686104], length 1314
19:48:07.777167 IP 10.8.3.4.33366 > 99.181.105.48.1935: Flags [.], seq 70318:71632, ack 0, win 501, options [nop,nop,TS val 1656781408 ecr 2834686104], length 1314
19:48:07.783083 IP 99.181.105.48.1935 > 10.8.3.4.33366: Flags [.], ack 65693, win 126, options [nop,nop,TS val 2834686211 ecr 1656781150], length 0
19:48:07.804167 IP 99.181.105.48.1935 > 10.8.3.4.33366: Flags [.], ack 66376, win 126, options [nop,nop,TS val 2834686232 ecr 1656781236], length 0
19:48:07.804192 IP 10.8.3.4.33366 > 99.181.105.48.1935: Flags [P.], seq 71632:72402, ack 0, win 501, options [nop,nop,TS val 1656781436 ecr 2834686232], length 770
19:48:07.840693 IP 10.8.3.4.33366 > 99.181.105.48.1935: Flags [.], seq 72402:73716, ack 0, win 501, options [nop,nop,TS val 1656781472 ecr 2834686232], length 1314
19:48:07.875611 IP 99.181.105.48.1935 > 10.8.3.4.33366: Flags [.], ack 69004, win 126, options [nop,nop,TS val 2834686303 ecr 1656781279], length 0
19:48:07.883205 IP 10.8.3.4.33366 > 99.181.105.48.1935: Flags [.], seq 73716:75030, ack 0, win 501, options [nop,nop,TS val 1656781515 ecr 2834686303], length 1314
19:48:07.926214 IP 10.8.3.4.33366 > 99.181.105.48.1935: Flags [.], seq 75030:76344, ack 0, win 501, options [nop,nop,TS val 1656781558 ecr 2834686303], length 1314
19:48:07.976288 IP 10.8.3.4.33366 > 99.181.105.48.1935: Flags [.], seq 76344:77658, ack 0, win 501, options [nop,nop,TS val 1656781608 ecr 2834686303], length 1314
19:48:07.976951 IP 99.181.105.48.1935 > 10.8.3.4.33366: Flags [.], ack 71632, win 126, options [nop,nop,TS val 2834686404 ecr 1656781344], length 0
19:48:08.004529 IP 99.181.105.48.1935 > 10.8.3.4.33366: Flags [.], ack 72402, win 126, options [nop,nop,TS val 2834686431 ecr 1656781436], length 0
19:48:08.004557 IP 10.8.3.4.33366 > 99.181.105.48.1935: Flags [P.], seq 77658:78344, ack 0, win 501, options [nop,nop,TS val 1656781636 ecr 2834686431], length 686
19:48:08.039171 IP 10.8.3.4.33366 > 99.181.105.48.1935: Flags [.], seq 78344:79658, ack 0, win 501, options [nop,nop,TS val 1656781670 ecr 2834686431], length 1314
19:48:08.075925 IP 10.8.3.4.33366 > 99.181.105.48.1935: Flags [.], seq 79658:80972, ack 0, win 501, options [nop,nop,TS val 1656781707 ecr 2834686431], length 1314
19:48:08.082742 IP 99.181.105.48.1935 > 10.8.3.4.33366: Flags [.], ack 75030, win 126, options [nop,nop,TS val 2834686510 ecr 1656781472], length 0
19:48:08.118680 IP 10.8.3.4.33366 > 99.181.105.48.1935: Flags [.], seq 80972:82286, ack 0, win 501, options [nop,nop,TS val 1656781750 ecr 2834686510], length 1314
19:48:08.175718 IP 99.181.105.48.1935 > 10.8.3.4.33366: Flags [.], ack 77658, win 126, options [nop,nop,TS val 2834686603 ecr 1656781558], length 0
19:48:08.183031 IP 10.8.3.4.33366 > 99.181.105.48.1935: Flags [.], seq 82286:83600, ack 0, win 501, options [nop,nop,TS val 1656781814 ecr 2834686603], length 1314
19:48:08.203965 IP 99.181.105.48.1935 > 10.8.3.4.33366: Flags [.], ack 78344, win 126, options [nop,nop,TS val 2834686631 ecr 1656781636], length 0
19:48:08.204008 IP 10.8.3.4.33366 > 99.181.105.48.1935: Flags [P.], seq 83600:84286, ack 0, win 501, options [nop,nop,TS val 1656781835 ecr 2834686631], length 686
19:48:08.247555 IP 10.8.3.4.33366 > 99.181.105.48.1935: Flags [.], seq 84286:85600, ack 0, win 501, options [nop,nop,TS val 1656781879 ecr 2834686631], length 1314
19:48:08.275779 IP 99.181.105.48.1935 > 10.8.3.4.33366: Flags [.], ack 80972, win 126, options [nop,nop,TS val 2834686703 ecr 1656781670], length 0
19:48:08.275784 IP 10.8.3.4.33366 > 99.181.105.48.1935: Flags [.], seq 85600:86914, ack 0, win 501, options [nop,nop,TS val 1656781907 ecr 2834686631], length 1314
19:48:08.311950 IP 10.8.3.4.33366 > 99.181.105.48.1935: Flags [.], seq 86914:88228, ack 0, win 501, options [nop,nop,TS val 1656781943 ecr 2834686703], length 1314
19:48:08.376490 IP 10.8.3.4.33366 > 99.181.105.48.1935: Flags [.], seq 88228:89542, ack 0, win 501, options [nop,nop,TS val 1656782008 ecr 2834686703], length 1314
19:48:08.382782 IP 99.181.105.48.1935 > 10.8.3.4.33366: Flags [.], ack 83600, win 126, options [nop,nop,TS val 2834686810 ecr 1656781750], length 0
19:48:08.403769 IP 99.181.105.48.1935 > 10.8.3.4.33366: Flags [.], ack 84286, win 126, options [nop,nop,TS val 2834686831 ecr 1656781835], length 0
19:48:08.403810 IP 10.8.3.4.33366 > 99.181.105.48.1935: Flags [P.], seq 89542:90319, ack 0, win 501, options [nop,nop,TS val 1656782035 ecr 2834686831], length 777
19:48:08.442712 IP 10.8.3.4.33366 > 99.181.105.48.1935: Flags [.], seq 90319:91633, ack 0, win 501, options [nop,nop,TS val 1656782074 ecr 2834686831], length 1314
19:48:08.475769 IP 99.181.105.48.1935 > 10.8.3.4.33366: Flags [.], ack 86914, win 126, options [nop,nop,TS val 2834686903 ecr 1656781879], length 0
19:48:08.484005 IP 10.8.3.4.33366 > 99.181.105.48.1935: Flags [.], seq 91633:92947, ack 0, win 501, options [nop,nop,TS val 1656782115 ecr 2834686903], length 1314
19:48:08.526671 IP 10.8.3.4.33366 > 99.181.105.48.1935: Flags [.], seq 92947:94261, ack 0, win 501, options [nop,nop,TS val 1656782158 ecr 2834686903], length 1314
19:48:08.575018 IP 10.8.3.4.33366 > 99.181.105.48.1935: Flags [.], seq 94261:95575, ack 0, win 501, options [nop,nop,TS val 1656782206 ecr 2834686903], length 1314
19:48:08.576382 IP 99.181.105.48.1935 > 10.8.3.4.33366: Flags [.], ack 89542, win 126, options [nop,nop,TS val 2834687004 ecr 1656781943], length 0
19:48:08.603399 IP 99.181.105.48.1935 > 10.8.3.4.33366: Flags [.], ack 90319, win 126, options [nop,nop,TS val 2834687031 ecr 1656782035], length 0
19:48:08.603441 IP 10.8.3.4.33366 > 99.181.105.48.1935: Flags [P.], seq 95575:96249, ack 0, win 501, options [nop,nop,TS val 1656782235 ecr 2834687031], length 674
19:48:08.655194 IP 10.8.3.4.33366 > 99.181.105.48.1935: Flags [.], seq 96249:97563, ack 0, win 501, options [nop,nop,TS val 1656782286 ecr 2834687031], length 1314
19:48:08.676547 IP 10.8.3.4.33366 > 99.181.105.48.1935: Flags [.], seq 97563:98877, ack 0, win 501, options [nop,nop,TS val 1656782308 ecr 2834687031], length 1314
19:48:08.683590 IP 99.181.105.48.1935 > 10.8.3.4.33366: Flags [.], ack 92947, win 126, options [nop,nop,TS val 2834687111 ecr 1656782074], length 0
19:48:08.719470 IP 10.8.3.4.33366 > 99.181.105.48.1935: Flags [.], seq 98877:100191, ack 0, win 501, options [nop,nop,TS val 1656782351 ecr 2834687111], length 1314
19:48:08.775039 IP 99.181.105.48.1935 > 10.8.3.4.33366: Flags [.], ack 95575, win 126, options [nop,nop,TS val 2834687203 ecr 1656782158], length 0
19:48:08.783993 IP 10.8.3.4.33366 > 99.181.105.48.1935: Flags [.], seq 100191:101505, ack 0, win 501, options [nop,nop,TS val 1656782415 ecr 2834687203], length 1314
19:48:08.802952 IP 99.181.105.48.1935 > 10.8.3.4.33366: Flags [.], ack 96249, win 126, options [nop,nop,TS val 2834687231 ecr 1656782235], length 0
19:48:08.802983 IP 10.8.3.4.33366 > 99.181.105.48.1935: Flags [P.], seq 101505:102187, ack 0, win 501, options [nop,nop,TS val 1656782434 ecr 2834687231], length 682
19:48:08.848280 IP 10.8.3.4.33366 > 99.181.105.48.1935: Flags [.], seq 102187:103501, ack 0, win 501, options [nop,nop,TS val 1656782480 ecr 2834687231], length 1314
19:48:08.876202 IP 99.181.105.48.1935 > 10.8.3.4.33366: Flags [.], ack 98877, win 126, options [nop,nop,TS val 2834687304 ecr 1656782286], length 0
19:48:08.890834 IP 10.8.3.4.33366 > 99.181.105.48.1935: Flags [.], seq 103501:104815, ack 0, win 501, options [nop,nop,TS val 1656782522 ecr 2834687304], length 1314
19:48:08.911988 IP 10.8.3.4.33366 > 99.181.105.48.1935: Flags [.], seq 104815:106129, ack 0, win 501, options [nop,nop,TS val 1656782543 ecr 2834687304], length 1314
19:48:08.975719 IP 10.8.3.4.33366 > 99.181.105.48.1935: Flags [.], seq 106129:107443, ack 0, win 501, options [nop,nop,TS val 1656782607 ecr 2834687304], length 1314
19:48:08.983762 IP 99.181.105.48.1935 > 10.8.3.4.33366: Flags [.], ack 101505, win 126, options [nop,nop,TS val 2834687411 ecr 1656782351], length 0
19:48:09.005055 IP 99.181.105.48.1935 > 10.8.3.4.33366: Flags [.], ack 102187, win 126, options [nop,nop,TS val 2834687430 ecr 1656782434], length 0
19:48:09.005093 IP 10.8.3.4.33366 > 99.181.105.48.1935: Flags [P.], seq 107443:108224, ack 0, win 501, options [nop,nop,TS val 1656782636 ecr 2834687430], length 781
19:48:09.042509 IP 10.8.3.4.33366 > 99.181.105.48.1935: Flags [.], seq 108224:109538, ack 0, win 501, options [nop,nop,TS val 1656782674 ecr 2834687430], length 1314
19:48:09.083017 IP 10.8.3.4.33366 > 99.181.105.48.1935: Flags [.], seq 109538:110852, ack 0, win 501, options [nop,nop,TS val 1656782714 ecr 2834687430], length 1314
19:48:09.090364 IP 99.181.105.48.1935 > 10.8.3.4.33366: Flags [.], ack 104815, win 126, options [nop,nop,TS val 2834687518 ecr 1656782480], length 0
19:48:09.126034 IP 10.8.3.4.33366 > 99.181.105.48.1935: Flags [.], seq 110852:112166, ack 0, win 501, options [nop,nop,TS val 1656782757 ecr 2834687518], length 1314
19:48:09.172370 IP 99.181.105.48.1935 > 10.8.3.4.33366: Flags [.], ack 106129, win 126, options [nop,nop,TS val 2834687600 ecr 1656782543], length 0
19:48:09.189639 IP 10.8.3.4.33366 > 99.181.105.48.1935: Flags [.], seq 112166:113480, ack 0, win 501, options [nop,nop,TS val 1656782821 ecr 2834687600], length 1314
19:48:09.204842 IP 99.181.105.48.1935 > 10.8.3.4.33366: Flags [.], ack 108224, win 126, options [nop,nop,TS val 2834687632 ecr 1656782607], length 0
19:48:09.204903 IP 10.8.3.4.33366 > 99.181.105.48.1935: Flags [P.], seq 113480:114162, ack 0, win 501, options [nop,nop,TS val 1656782836 ecr 2834687632], length 682
19:48:09.253552 IP 10.8.3.4.33366 > 99.181.105.48.1935: Flags [.], seq 114162:115476, ack 0, win 501, options [nop,nop,TS val 1656782885 ecr 2834687632], length 1314
19:48:09.275851 IP 10.8.3.4.33366 > 99.181.105.48.1935: Flags [.], seq 115476:116790, ack 0, win 501, options [nop,nop,TS val 1656782907 ecr 2834687632], length 1314
19:48:09.282733 IP 99.181.105.48.1935 > 10.8.3.4.33366: Flags [.], ack 110852, win 126, options [nop,nop,TS val 2834687710 ecr 1656782674], length 0
19:48:09.317981 IP 10.8.3.4.33366 > 99.181.105.48.1935: Flags [.], seq 116790:118104, ack 0, win 501, options [nop,nop,TS val 1656782949 ecr 2834687710], length 1314
19:48:09.381785 IP 10.8.3.4.33366 > 99.181.105.48.1935: Flags [.], seq 118104:119418, ack 0, win 501, options [nop,nop,TS val 1656783013 ecr 2834687710], length 1314
19:48:09.388889 IP 99.181.105.48.1935 > 10.8.3.4.33366: Flags [.], ack 113480, win 126, options [nop,nop,TS val 2834687817 ecr 1656782757], length 0
19:48:09.405904 IP 99.181.105.48.1935 > 10.8.3.4.33366: Flags [.], ack 114162, win 126, options [nop,nop,TS val 2834687832 ecr 1656782836], length 0
19:48:09.405930 IP 10.8.3.4.33366 > 99.181.105.48.1935: Flags [P.], seq 119418:120188, ack 0, win 501, options [nop,nop,TS val 1656783037 ecr 2834687832], length 770
19:48:09.446147 IP 10.8.3.4.33366 > 99.181.105.48.1935: Flags [.], seq 120188:121502, ack 0, win 501, options [nop,nop,TS val 1656783077 ecr 2834687832], length 1314
19:48:09.475676 IP 99.181.105.48.1935 > 10.8.3.4.33366: Flags [.], ack 116790, win 126, options [nop,nop,TS val 2834687903 ecr 1656782885], length 0
19:48:09.489100 IP 10.8.3.4.33366 > 99.181.105.48.1935: Flags [.], seq 121502:122816, ack 0, win 501, options [nop,nop,TS val 1656783120 ecr 2834687903], length 1314
19:48:09.532210 IP 10.8.3.4.33366 > 99.181.105.48.1935: Flags [.], seq 122816:124130, ack 0, win 501, options [nop,nop,TS val 1656783164 ecr 2834687903], length 1314
19:48:09.576082 IP 10.8.3.4.33366 > 99.181.105.48.1935: Flags [.], seq 124130:125444, ack 0, win 501, options [nop,nop,TS val 1656783207 ecr 2834687903], length 1314
19:48:09.581232 IP 99.181.105.48.1935 > 10.8.3.4.33366: Flags [.], ack 119418, win 126, options [nop,nop,TS val 2834688009 ecr 1656782949], length 0
19:48:09.605509 IP 99.181.105.48.1935 > 10.8.3.4.33366: Flags [.], ack 120188, win 126, options [nop,nop,TS val 2834688033 ecr 1656783037], length 0
19:48:09.605548 IP 10.8.3.4.33366 > 99.181.105.48.1935: Flags [P.], seq 125444:126131, ack 0, win 501, options [nop,nop,TS val 1656783237 ecr 2834688033], length 687
19:48:09.642774 IP 10.8.3.4.33366 > 99.181.105.48.1935: Flags [.], seq 126131:127445, ack 0, win 501, options [nop,nop,TS val 1656783274 ecr 2834688033], length 1314
19:48:09.682614 IP 10.8.3.4.33366 > 99.181.105.48.1935: Flags [.], seq 127445:128759, ack 0, win 501, options [nop,nop,TS val 1656783314 ecr 2834688033], length 1314
19:48:09.688705 IP 99.181.105.48.1935 > 10.8.3.4.33366: Flags [.], ack 122816, win 126, options [nop,nop,TS val 2834688116 ecr 1656783077], length 0
19:48:09.725710 IP 10.8.3.4.33366 > 99.181.105.48.1935: Flags [.], seq 128759:130073, ack 0, win 501, options [nop,nop,TS val 1656783357 ecr 2834688116], length 1314
19:48:09.775948 IP 10.8.3.4.33366 > 99.181.105.48.1935: Flags [.], seq 130073:131387, ack 0, win 501, options [nop,nop,TS val 1656783407 ecr 2834688116], length 1314
19:48:09.775948 IP 99.181.105.48.1935 > 10.8.3.4.33366: Flags [.], ack 125444, win 126, options [nop,nop,TS val 2834688203 ecr 1656783164], length 0
19:48:09.805221 IP 99.181.105.48.1935 > 10.8.3.4.33366: Flags [.], ack 126131, win 126, options [nop,nop,TS val 2834688233 ecr 1656783237], length 0
19:48:09.805260 IP 10.8.3.4.33366 > 99.181.105.48.1935: Flags [P.], seq 131387:132168, ack 0, win 501, options [nop,nop,TS val 1656783437 ecr 2834688233], length 781
19:48:09.838555 IP 10.8.3.4.33366 > 99.181.105.48.1935: Flags [.], seq 132168:133482, ack 0, win 501, options [nop,nop,TS val 1656783470 ecr 2834688233], length 1314
19:48:09.872191 IP 10.8.3.4.33366 > 99.181.105.48.1935: Flags [.], seq 133482:134796, ack 0, win 501, options [nop,nop,TS val 1656783504 ecr 2834688233], length 1314
19:48:09.882343 IP 99.181.105.48.1935 > 10.8.3.4.33366: Flags [.], ack 128759, win 126, options [nop,nop,TS val 2834688310 ecr 1656783274], length 0
19:48:09.918179 IP 10.8.3.4.33366 > 99.181.105.48.1935: Flags [.], seq 134796:136110, ack 0, win 501, options [nop,nop,TS val 1656783549 ecr 2834688310], length 1314
19:48:09.975562 IP 99.181.105.48.1935 > 10.8.3.4.33366: Flags [.], ack 131387, win 126, options [nop,nop,TS val 2834688403 ecr 1656783357], length 0
19:48:09.975991 IP 10.8.3.4.33366 > 99.181.105.48.1935: Flags [.], seq 136110:137424, ack 0, win 501, options [nop,nop,TS val 1656783607 ecr 2834688403], length 1314
19:48:10.004879 IP 99.181.105.48.1935 > 10.8.3.4.33366: Flags [.], ack 132168, win 126, options [nop,nop,TS val 2834688432 ecr 1656783437], length 0
19:48:10.004901 IP 10.8.3.4.33366 > 99.181.105.48.1935: Flags [P.], seq 137424:138197, ack 0, win 501, options [nop,nop,TS val 1656783636 ecr 2834688432], length 773
19:48:10.041425 IP 10.8.3.4.33366 > 99.181.105.48.1935: Flags [.], seq 138197:139511, ack 0, win 501, options [nop,nop,TS val 1656783673 ecr 2834688432], length 1314
19:48:10.071873 IP 99.181.105.48.1935 > 10.8.3.4.33366: Flags [.], ack 134796, win 126, options [nop,nop,TS val 2834688499 ecr 1656783470], length 0
19:48:10.076050 IP 10.8.3.4.33366 > 99.181.105.48.1935: Flags [.], seq 139511:140825, ack 0, win 501, options [nop,nop,TS val 1656783707 ecr 2834688499], length 1314
19:48:10.132433 IP 10.8.3.4.33366 > 99.181.105.48.1935: Flags [.], seq 140825:142139, ack 0, win 501, options [nop,nop,TS val 1656783764 ecr 2834688499], length 1314
19:48:10.174110 IP 10.8.3.4.33366 > 99.181.105.48.1935: Flags [.], seq 142139:143453, ack 0, win 501, options [nop,nop,TS val 1656783805 ecr 2834688499], length 1314
19:48:10.175709 IP 99.181.105.48.1935 > 10.8.3.4.33366: Flags [.], ack 137424, win 126, options [nop,nop,TS val 2834688603 ecr 1656783549], length 0
19:48:10.204624 IP 99.181.105.48.1935 > 10.8.3.4.33366: Flags [.], ack 138197, win 126, options [nop,nop,TS val 2834688632 ecr 1656783636], length 0
19:48:10.204657 IP 10.8.3.4.33366 > 99.181.105.48.1935: Flags [P.], seq 143453:144127, ack 0, win 501, options [nop,nop,TS val 1656783836 ecr 2834688632], length 674
19:48:10.238806 IP 10.8.3.4.33366 > 99.181.105.48.1935: Flags [.], seq 144127:145441, ack 0, win 501, options [nop,nop,TS val 1656783870 ecr 2834688632], length 1314
19:48:10.272115 IP 10.8.3.4.33366 > 99.181.105.48.1935: Flags [.], seq 145441:146755, ack 0, win 501, options [nop,nop,TS val 1656783903 ecr 2834688632], length 1314
19:48:10.275478 IP 99.181.105.48.1935 > 10.8.3.4.33366: Flags [.], ack 140825, win 126, options [nop,nop,TS val 2834688703 ecr 1656783673], length 0
19:48:10.324268 IP 10.8.3.4.33366 > 99.181.105.48.1935: Flags [.], seq 146755:148069, ack 0, win 501, options [nop,nop,TS val 1656783956 ecr 2834688703], length 1314
19:48:10.373988 IP 99.181.105.48.1935 > 10.8.3.4.33366: Flags [.], ack 143453, win 126, options [nop,nop,TS val 2834688801 ecr 1656783764], length 0
19:48:10.376036 IP 10.8.3.4.33366 > 99.181.105.48.1935: Flags [.], seq 148069:149383, ack 0, win 501, options [nop,nop,TS val 1656784007 ecr 2834688801], length 1314
19:48:10.404245 IP 99.181.105.48.1935 > 10.8.3.4.33366: Flags [.], ack 144127, win 126, options [nop,nop,TS val 2834688832 ecr 1656783836], length 0
19:48:10.404307 IP 10.8.3.4.33366 > 99.181.105.48.1935: Flags [P.], seq 149383:150069, ack 0, win 501, options [nop,nop,TS val 1656784036 ecr 2834688832], length 686
19:48:10.442855 IP 10.8.3.4.33366 > 99.181.105.48.1935: Flags [.], seq 150069:151383, ack 0, win 501, options [nop,nop,TS val 1656784074 ecr 2834688832], length 1314
19:48:10.472015 IP 99.181.105.48.1935 > 10.8.3.4.33366: Flags [.], ack 146755, win 126, options [nop,nop,TS val 2834688899 ecr 1656783870], length 0
19:48:10.476175 IP 10.8.3.4.33366 > 99.181.105.48.1935: Flags [.], seq 151383:152697, ack 0, win 501, options [nop,nop,TS val 1656784107 ecr 2834688899], length 1314
19:48:10.517404 IP 10.8.3.4.33366 > 99.181.105.48.1935: Flags [.], seq 152697:154011, ack 0, win 501, options [nop,nop,TS val 1656784149 ecr 2834688899], length 1314
19:48:10.574960 IP 10.8.3.4.33366 > 99.181.105.48.1935: Flags [.], seq 154011:155325, ack 0, win 501, options [nop,nop,TS val 1656784206 ecr 2834688899], length 1314
19:48:10.576139 IP 99.181.105.48.1935 > 10.8.3.4.33366: Flags [.], ack 149383, win 126, options [nop,nop,TS val 2834689004 ecr 1656783956], length 0
19:48:10.604253 IP 99.181.105.48.1935 > 10.8.3.4.33366: Flags [.], ack 150069, win 126, options [nop,nop,TS val 2834689032 ecr 1656784036], length 0
19:48:10.604290 IP 10.8.3.4.33366 > 99.181.105.48.1935: Flags [P.], seq 155325:156107, ack 0, win 501, options [nop,nop,TS val 1656784236 ecr 2834689032], length 782
19:48:10.643158 IP 10.8.3.4.33366 > 99.181.105.48.1935: Flags [.], seq 156107:157421, ack 0, win 501, options [nop,nop,TS val 1656784274 ecr 2834689032], length 1314
19:48:10.675999 IP 99.181.105.48.1935 > 10.8.3.4.33366: Flags [.], ack 152697, win 126, options [nop,nop,TS val 2834689103 ecr 1656784074], length 0
19:48:10.676180 IP 10.8.3.4.33366 > 99.181.105.48.1935: Flags [.], seq 157421:158735, ack 0, win 501, options [nop,nop,TS val 1656784307 ecr 2834689103], length 1314
19:48:10.731732 IP 10.8.3.4.33366 > 99.181.105.48.1935: Flags [.], seq 158735:160049, ack 0, win 501, options [nop,nop,TS val 1656784363 ecr 2834689103], length 1314
19:48:10.774626 IP 99.181.105.48.1935 > 10.8.3.4.33366: Flags [.], ack 155325, win 126, options [nop,nop,TS val 2834689202 ecr 1656784149], length 0
19:48:10.775657 IP 10.8.3.4.33366 > 99.181.105.48.1935: Flags [.], seq 160049:161363, ack 0, win 501, options [nop,nop,TS val 1656784407 ecr 2834689202], length 1314
19:48:10.804263 IP 99.181.105.48.1935 > 10.8.3.4.33366: Flags [.], ack 156107, win 126, options [nop,nop,TS val 2834689232 ecr 1656784236], length 0
19:48:10.804294 IP 10.8.3.4.33366 > 99.181.105.48.1935: Flags [P.], seq 161363:162045, ack 0, win 501, options [nop,nop,TS val 1656784436 ecr 2834689232], length 682
19:48:10.842230 IP 10.8.3.4.33366 > 99.181.105.48.1935: Flags [.], seq 162045:163359, ack 0, win 501, options [nop,nop,TS val 1656784474 ecr 2834689232], length 1314
19:48:10.874381 IP 10.8.3.4.33366 > 99.181.105.48.1935: Flags [.], seq 163359:164673, ack 0, win 501, options [nop,nop,TS val 1656784506 ecr 2834689232], length 1314
19:48:10.875727 IP 99.181.105.48.1935 > 10.8.3.4.33366: Flags [.], ack 158735, win 126, options [nop,nop,TS val 2834689303 ecr 1656784274], length 0
19:48:10.923924 IP 10.8.3.4.33366 > 99.181.105.48.1935: Flags [.], seq 164673:165987, ack 0, win 501, options [nop,nop,TS val 1656784555 ecr 2834689303], length 1314
19:48:10.975234 IP 99.181.105.48.1935 > 10.8.3.4.33366: Flags [.], ack 161363, win 126, options [nop,nop,TS val 2834689403 ecr 1656784363], length 0
19:48:10.975550 IP 10.8.3.4.33366 > 99.181.105.48.1935: Flags [.], seq 165987:167301, ack 0, win 501, options [nop,nop,TS val 1656784607 ecr 2834689403], length 1314
19:48:11.004702 IP 99.181.105.48.1935 > 10.8.3.4.33366: Flags [.], ack 162045, win 126, options [nop,nop,TS val 2834689431 ecr 1656784436], length 0
19:48:11.004744 IP 10.8.3.4.33366 > 99.181.105.48.1935: Flags [P.], seq 167301:167975, ack 0, win 501, options [nop,nop,TS val 1656784636 ecr 2834689431], length 674
19:48:11.042835 IP 10.8.3.4.33366 > 99.181.105.48.1935: Flags [.], seq 167975:169289, ack 0, win 501, options [nop,nop,TS val 1656784674 ecr 2834689431], length 1314
19:48:11.074407 IP 99.181.105.48.1935 > 10.8.3.4.33366: Flags [.], ack 164673, win 126, options [nop,nop,TS val 2834689502 ecr 1656784474], length 0
19:48:11.076020 IP 10.8.3.4.33366 > 99.181.105.48.1935: Flags [.], seq 169289:170603, ack 0, win 501, options [nop,nop,TS val 1656784707 ecr 2834689502], length 1314
19:48:11.116827 IP 10.8.3.4.33366 > 99.181.105.48.1935: Flags [.], seq 170603:171917, ack 0, win 501, options [nop,nop,TS val 1656784748 ecr 2834689502], length 1314
19:48:11.175297 IP 99.181.105.48.1935 > 10.8.3.4.33366: Flags [.], ack 167301, win 126, options [nop,nop,TS val 2834689603 ecr 1656784555], length 0
19:48:11.175680 IP 10.8.3.4.33366 > 99.181.105.48.1935: Flags [.], seq 171917:173231, ack 0, win 501, options [nop,nop,TS val 1656784807 ecr 2834689603], length 1314
19:48:11.204806 IP 99.181.105.48.1935 > 10.8.3.4.33366: Flags [.], ack 167975, win 126, options [nop,nop,TS val 2834689632 ecr 1656784636], length 0
19:48:11.204837 IP 10.8.3.4.33366 > 99.181.105.48.1935: Flags [P.], seq 173231:174012, ack 0, win 501, options [nop,nop,TS val 1656784836 ecr 2834689632], length 781
19:48:11.241845 IP 10.8.3.4.33366 > 99.181.105.48.1935: Flags [.], seq 174012:175326, ack 0, win 501, options [nop,nop,TS val 1656784873 ecr 2834689632], length 1314
19:48:11.275634 IP 99.181.105.48.1935 > 10.8.3.4.33366: Flags [.], ack 170603, win 126, options [nop,nop,TS val 2834689703 ecr 1656784674], length 0
19:48:11.275677 IP 10.8.3.4.33366 > 99.181.105.48.1935: Flags [.], seq 175326:176640, ack 0, win 501, options [nop,nop,TS val 1656784907 ecr 2834689632], length 1314
19:48:11.330483 IP 10.8.3.4.33366 > 99.181.105.48.1935: Flags [.], seq 176640:177954, ack 0, win 501, options [nop,nop,TS val 1656784962 ecr 2834689703], length 1314
19:48:11.375490 IP 99.181.105.48.1935 > 10.8.3.4.33366: Flags [.], ack 173231, win 126, options [nop,nop,TS val 2834689803 ecr 1656784748], length 0
19:48:11.375753 IP 10.8.3.4.33366 > 99.181.105.48.1935: Flags [.], seq 177954:179268, ack 0, win 501, options [nop,nop,TS val 1656785007 ecr 2834689803], length 1314
19:48:11.404449 IP 99.181.105.48.1935 > 10.8.3.4.33366: Flags [.], ack 174012, win 126, options [nop,nop,TS val 2834689832 ecr 1656784836], length 0
19:48:11.404491 IP 10.8.3.4.33366 > 99.181.105.48.1935: Flags [P.], seq 179268:179954, ack 0, win 501, options [nop,nop,TS val 1656785036 ecr 2834689832], length 686
19:48:11.442541 IP 10.8.3.4.33366 > 99.181.105.48.1935: Flags [.], seq 179954:181268, ack 0, win 501, options [nop,nop,TS val 1656785074 ecr 2834689832], length 1314
19:48:11.475436 IP 99.181.105.48.1935 > 10.8.3.4.33366: Flags [.], ack 176640, win 126, options [nop,nop,TS val 2834689903 ecr 1656784873], length 0
19:48:11.475946 IP 10.8.3.4.33366 > 99.181.105.48.1935: Flags [.], seq 181268:182582, ack 0, win 501, options [nop,nop,TS val 1656785107 ecr 2834689903], length 1314
19:48:11.523683 IP 10.8.3.4.33366 > 99.181.105.48.1935: Flags [.], seq 182582:183896, ack 0, win 501, options [nop,nop,TS val 1656785155 ecr 2834689903], length 1314
19:48:11.571611 IP 10.8.3.4.33366 > 99.181.105.48.1935: Flags [.], seq 183896:185210, ack 0, win 501, options [nop,nop,TS val 1656785203 ecr 2834689903], length 1314
19:48:11.575678 IP 99.181.105.48.1935 > 10.8.3.4.33366: Flags [.], ack 179268, win 126, options [nop,nop,TS val 2834690003 ecr 1656784962], length 0
19:48:11.604381 IP 99.181.105.48.1935 > 10.8.3.4.33366: Flags [.], ack 179954, win 126, options [nop,nop,TS val 2834690032 ecr 1656785036], length 0
19:48:11.604451 IP 10.8.3.4.33366 > 99.181.105.48.1935: Flags [P.], seq 185210:185893, ack 0, win 501, options [nop,nop,TS val 1656785236 ecr 2834690032], length 683
19:48:11.638936 IP 10.8.3.4.33366 > 99.181.105.48.1935: Flags [.], seq 185893:187207, ack 0, win 501, options [nop,nop,TS val 1656785270 ecr 2834690032], length 1314
19:48:11.675653 IP 99.181.105.48.1935 > 10.8.3.4.33366: Flags [.], ack 182582, win 126, options [nop,nop,TS val 2834690103 ecr 1656785074], length 0
19:48:11.675941 IP 10.8.3.4.33366 > 99.181.105.48.1935: Flags [.], seq 187207:188521, ack 0, win 501, options [nop,nop,TS val 1656785307 ecr 2834690103], length 1314
19:48:11.714873 IP 10.8.3.4.33366 > 99.181.105.48.1935: Flags [.], seq 188521:189835, ack 0, win 501, options [nop,nop,TS val 1656785346 ecr 2834690103], length 1314
19:48:11.771234 IP 99.181.105.48.1935 > 10.8.3.4.33366: Flags [.], ack 185210, win 126, options [nop,nop,TS val 2834690199 ecr 1656785155], length 0
19:48:11.775530 IP 10.8.3.4.33366 > 99.181.105.48.1935: Flags [.], seq 189835:191149, ack 0, win 501, options [nop,nop,TS val 1656785407 ecr 2834690199], length 1314
19:48:11.804443 IP 99.181.105.48.1935 > 10.8.3.4.33366: Flags [.], ack 185893, win 126, options [nop,nop,TS val 2834690232 ecr 1656785236], length 0
19:48:11.804485 IP 10.8.3.4.33366 > 99.181.105.48.1935: Flags [P.], seq 191149:191914, ack 0, win 501, options [nop,nop,TS val 1656785436 ecr 2834690232], length 765
