23:59:38.416692 IP 10.8.3.7.35362 > 99.181.89.230.1935: Flags [.], seq 2197274148:2197275462, ack 3235811149, win 501, options [nop,nop,TS val 2321482354 ecr 3169610392], length 1314
23:59:38.432664 IP 99.181.89.230.1935 > 10.8.3.7.35362: Flags [.], ack 4294952581, win 160, options [nop,nop,TS val 3169610457 ecr 2321481819], length 0
23:59:38.449996 IP 10.8.3.7.35362 > 99.181.89.230.1935: Flags [.], seq 1314:2628, ack 1, win 501, options [nop,nop,TS val 2321482387 ecr 3169610457], length 1314
23:59:38.465054 IP 99.181.89.230.1935 > 10.8.3.7.35362: Flags [.], ack 4294953895, win 165, options [nop,nop,TS val 3169610490 ecr 2321481852], length 0
23:59:38.487443 IP 10.8.3.7.35362 > 99.181.89.230.1935: Flags [.], seq 2628:3942, ack 1, win 501, options [nop,nop,TS val 2321482425 ecr 3169610490], length 1314
23:59:38.498020 IP 99.181.89.230.1935 > 10.8.3.7.35362: Flags [.], ack 4294955209, win 171, options [nop,nop,TS val 3169610522 ecr 2321481885], length 0
23:59:38.549130 IP 10.8.3.7.35362 > 99.181.89.230.1935: Flags [.], seq 3942:5256, ack 1, win 501, options [nop,nop,TS val 2321482486 ecr 3169610522], length 1314
23:59:38.565388 IP 99.181.89.230.1935 > 10.8.3.7.35362: Flags [.], ack 4294956523, win 175, options [nop,nop,TS val 3169610590 ecr 2321481952], length 0
23:59:38.583657 IP 10.8.3.7.35362 > 99.181.89.230.1935: Flags [.], seq 5256:6570, ack 1, win 501, options [nop,nop,TS val 2321482521 ecr 3169610590], length 1314
23:59:38.616710 IP 10.8.3.7.35362 > 99.181.89.230.1935: Flags [.], seq 6570:7884, ack 1, win 501, options [nop,nop,TS val 2321482554 ecr 3169610590], length 1314
23:59:38.630207 IP 99.181.89.230.1935 > 10.8.3.7.35362: Flags [.], ack 4294959151, win 175, options [nop,nop,TS val 3169610655 ecr 2321481988], length 0
23:59:38.653330 IP 99.181.89.230.1935 > 10.8.3.7.35362: Flags [.], ack 4294959412, win 176, options [nop,nop,TS val 3169610678 ecr 2321482040], length 0
23:59:38.653352 IP 10.8.3.7.35362 > 99.181.89.230.1935: Flags [P.], seq 7884:8888, ack 1, win 501, options [nop,nop,TS val 2321482591 ecr 3169610678], length 1004
23:59:38.715963 IP 10.8.3.7.35362 > 99.181.89.230.1935: Flags [.], seq 8888:10202, ack 1, win 501, options [nop,nop,TS val 2321482653 ecr 3169610678], length 1314
23:59:38.734295 IP 99.181.89.230.1935 > 10.8.3.7.35362: Flags [.], ack 4294962040, win 175, options [nop,nop,TS val 3169610759 ecr 2321482081], length 0
23:59:38.745802 IP 10.8.3.7.35362 > 99.181.89.230.1935: Flags [.], seq 10202:11516, ack 1, win 501, options [nop,nop,TS val 2321482683 ecr 3169610759], length 1314
23:59:38.779806 IP 10.8.3.7.35362 > 99.181.89.230.1935: Flags [.], seq 11516:12830, ack 1, win 501, options [nop,nop,TS val 2321482717 ecr 3169610759], length 1314
23:59:38.821856 IP 99.181.89.230.1935 > 10.8.3.7.35362: Flags [.], ack 4294963354, win 176, options [nop,nop,TS val 3169610846 ecr 2321482167], length 0
23:59:38.850300 IP 10.8.3.7.35362 > 99.181.89.230.1935: Flags [.], seq 12830:14144, ack 1, win 501, options [nop,nop,TS val 2321482788 ecr 3169610846], length 1314
23:59:38.866066 IP 99.181.89.230.1935 > 10.8.3.7.35362: Flags [.], ack 4294965982, win 176, options [nop,nop,TS val 3169610891 ecr 2321482220], length 0
23:59:38.882386 IP 10.8.3.7.35362 > 99.181.89.230.1935: Flags [.], seq 14144:15458, ack 1, win 501, options [nop,nop,TS val 2321482820 ecr 3169610891], length 1314
23:59:38.913240 IP 10.8.3.7.35362 > 99.181.89.230.1935: Flags [.], seq 15458:16772, ack 1, win 501, options [nop,nop,TS val 2321482851 ecr 3169610891], length 1314
23:59:38.967240 IP 99.181.89.230.1935 > 10.8.3.7.35362: Flags [.], ack 1314, win 175, options [nop,nop,TS val 3169610992 ecr 2321482296], length 0
23:59:38.979401 IP 10.8.3.7.35362 > 99.181.89.230.1935: Flags [.], seq 16772:18086, ack 1, win 501, options [nop,nop,TS val 2321482917 ecr 3169610992], length 1314
23:59:39.013795 IP 10.8.3.7.35362 > 99.181.89.230.1935: Flags [.], seq 18086:19400, ack 1, win 501, options [nop,nop,TS val 2321482951 ecr 3169610992], length 1314
23:59:39.037816 IP 99.181.89.230.1935 > 10.8.3.7.35362: Flags [.], ack 3942, win 175, options [nop,nop,TS val 3169611062 ecr 2321482387], length 0
23:59:39.048484 IP 10.8.3.7.35362 > 99.181.89.230.1935: Flags [.], seq 19400:20714, ack 1, win 501, options [nop,nop,TS val 2321482986 ecr 3169611062], length 1314
23:59:39.116224 IP 10.8.3.7.35362 > 99.181.89.230.1935: Flags [.], seq 20714:22028, ack 1, win 501, options [nop,nop,TS val 2321483054 ecr 3169611062], length 1314
23:59:39.134420 IP 99.181.89.230.1935 > 10.8.3.7.35362: Flags [.], ack 6570, win 175, options [nop,nop,TS val 3169611159 ecr 2321482486], length 0
23:59:39.145704 IP 10.8.3.7.35362 > 99.181.89.230.1935: Flags [.], seq 22028:23342, ack 1, win 501, options [nop,nop,TS val 2321483083 ecr 3169611159], length 1314
23:59:39.179662 IP 10.8.3.7.35362 > 99.181.89.230.1935: Flags [.], seq 23342:24656, ack 1, win 501, options [nop,nop,TS val 2321483117 ecr 3169611159], length 1314
23:59:39.203752 IP 99.181.89.230.1935 > 10.8.3.7.35362: Flags [.], ack 8888, win 176, options [nop,nop,TS val 3169611228 ecr 2321482554], length 0
23:59:39.203789 IP 10.8.3.7.35362 > 99.181.89.230.1935: Flags [P.], seq 24656:24909, ack 1, win 501, options [nop,nop,TS val 2321483141 ecr 3169611228], length 253
23:59:39.250275 IP 10.8.3.7.35362 > 99.181.89.230.1935: Flags [.], seq 24909:26223, ack 1, win 501, options [nop,nop,TS val 2321483188 ecr 3169611228], length 1314
23:59:39.283302 IP 10.8.3.7.35362 > 99.181.89.230.1935: Flags [.], seq 26223:27537, ack 1, win 501, options [nop,nop,TS val 2321483221 ecr 3169611228], length 1314
23:59:39.296646 IP 99.181.89.230.1935 > 10.8.3.7.35362: Flags [.], ack 11516, win 176, options [nop,nop,TS val 3169611321 ecr 2321482653], length 0
23:59:39.320675 IP 10.8.3.7.35362 > 99.181.89.230.1935: Flags [.], seq 27537:28851, ack 1, win 501, options [nop,nop,TS val 2321483258 ecr 3169611321], length 1314
23:59:39.383543 IP 10.8.3.7.35362 > 99.181.89.230.1935: Flags [.], seq 28851:30165, ack 1, win 501, options [nop,nop,TS val 2321483321 ecr 3169611321], length 1314
23:59:39.401085 IP 99.181.89.230.1935 > 10.8.3.7.35362: Flags [.], ack 14144, win 175, options [nop,nop,TS val 3169611425 ecr 2321482717], length 0
23:59:39.416584 IP 10.8.3.7.35362 > 99.181.89.230.1935: Flags [.], seq 30165:31479, ack 1, win 501, options [nop,nop,TS val 2321483354 ecr 3169611425], length 1314
23:59:39.449925 IP 10.8.3.7.35362 > 99.181.89.230.1935: Flags [.], seq 31479:32793, ack 1, win 501, options [nop,nop,TS val 2321483387 ecr 3169611425], length 1314
23:59:39.463632 IP 99.181.89.230.1935 > 10.8.3.7.35362: Flags [.], ack 16772, win 175, options [nop,nop,TS val 3169611488 ecr 2321482820], length 0
23:59:39.516751 IP 10.8.3.7.35362 > 99.181.89.230.1935: Flags [.], seq 32793:34107, ack 1, win 501, options [nop,nop,TS val 2321483454 ecr 3169611488], length 1314
23:59:39.550320 IP 10.8.3.7.35362 > 99.181.89.230.1935: Flags [.], seq 34107:35421, ack 1, win 501, options [nop,nop,TS val 2321483488 ecr 3169611488], length 1314
23:59:39.572034 IP 99.181.89.230.1935 > 10.8.3.7.35362: Flags [.], ack 19400, win 175, options [nop,nop,TS val 3169611596 ecr 2321482917], length 0
23:59:39.583752 IP 10.8.3.7.35362 > 99.181.89.230.1935: Flags [.], seq 35421:36735, ack 1, win 501, options [nop,nop,TS val 2321483521 ecr 3169611596], length 1314
23:59:39.651319 IP 10.8.3.7.35362 > 99.181.89.230.1935: Flags [.], seq 36735:38049, ack 1, win 501, options [nop,nop,TS val 2321483589 ecr 3169611596], length 1314
23:59:39.666775 IP 99.181.89.230.1935 > 10.8.3.7.35362: Flags [.], ack 22028, win 175, options [nop,nop,TS val 3169611691 ecr 2321482986], length 0
23:59:39.679927 IP 10.8.3.7.35362 > 99.181.89.230.1935: Flags [.], seq 38049:39363, ack 1, win 501, options [nop,nop,TS val 2321483617 ecr 3169611691], length 1314
23:59:39.713787 IP 10.8.3.7.35362 > 99.181.89.230.1935: Flags [.], seq 39363:40677, ack 1, win 501, options [nop,nop,TS val 2321483651 ecr 3169611691], length 1314
23:59:39.730182 IP 99.181.89.230.1935 > 10.8.3.7.35362: Flags [.], ack 24656, win 175, options [nop,nop,TS val 3169611755 ecr 2321483083], length 0
23:59:39.754091 IP 99.181.89.230.1935 > 10.8.3.7.35362: Flags [.], ack 24909, win 176, options [nop,nop,TS val 3169611778 ecr 2321483141], length 0
23:59:39.754135 IP 10.8.3.7.35362 > 99.181.89.230.1935: Flags [P.], seq 40677:41787, ack 1, win 501, options [nop,nop,TS val 2321483691 ecr 3169611778], length 1110
23:59:39.814741 IP 10.8.3.7.35362 > 99.181.89.230.1935: Flags [.], seq 41787:43101, ack 1, win 501, options [nop,nop,TS val 2321483752 ecr 3169611778], length 1314
23:59:39.833860 IP 99.181.89.230.1935 > 10.8.3.7.35362: Flags [.], ack 27537, win 175, options [nop,nop,TS val 3169611858 ecr 2321483188], length 0
23:59:39.849462 IP 10.8.3.7.35362 > 99.181.89.230.1935: Flags [.], seq 43101:44415, ack 1, win 501, options [nop,nop,TS val 2321483787 ecr 3169611858], length 1314
23:59:39.883160 IP 10.8.3.7.35362 > 99.181.89.230.1935: Flags [.], seq 44415:45729, ack 1, win 501, options [nop,nop,TS val 2321483820 ecr 3169611858], length 1314
23:59:39.934393 IP 99.181.89.230.1935 > 10.8.3.7.35362: Flags [.], ack 30165, win 175, options [nop,nop,TS val 3169611959 ecr 2321483258], length 0
23:59:39.946792 IP 10.8.3.7.35362 > 99.181.89.230.1935: Flags [.], seq 45729:47043, ack 1, win 501, options [nop,nop,TS val 2321483884 ecr 3169611959], length 1314
23:59:39.980440 IP 10.8.3.7.35362 > 99.181.89.230.1935: Flags [.], seq 47043:48357, ack 1, win 501, options [nop,nop,TS val 2321483918 ecr 3169611959], length 1314
23:59:40.000404 IP 99.181.89.230.1935 > 10.8.3.7.35362: Flags [.], ack 32793, win 175, options [nop,nop,TS val 3169612025 ecr 2321483354], length 0
23:59:40.017612 IP 10.8.3.7.35362 > 99.181.89.230.1935: Flags [.], seq 48357:49671, ack 1, win 501, options [nop,nop,TS val 2321483955 ecr 3169612025], length 1314
23:59:40.079598 IP 10.8.3.7.35362 > 99.181.89.230.1935: Flags [.], seq 49671:50985, ack 1, win 501, options [nop,nop,TS val 2321484017 ecr 3169612025], length 1314
23:59:40.101349 IP 99.181.89.230.1935 > 10.8.3.7.35362: Flags [.], ack 35421, win 175, options [nop,nop,TS val 3169612126 ecr 2321483454], length 0
23:59:40.113231 IP 10.8.3.7.35362 > 99.181.89.230.1935: Flags [.], seq 50985:52299, ack 1, win 501, options [nop,nop,TS val 2321484051 ecr 3169612126], length 1314
23:59:40.147722 IP 10.8.3.7.35362 > 99.181.89.230.1935: Flags [.], seq 52299:53613, ack 1, win 501, options [nop,nop,TS val 2321484085 ecr 3169612126], length 1314
23:59:40.202071 IP 99.181.89.230.1935 > 10.8.3.7.35362: Flags [.], ack 38049, win 175, options [nop,nop,TS val 3169612227 ecr 2321483521], length 0
23:59:40.218447 IP 10.8.3.7.35362 > 99.181.89.230.1935: Flags [.], seq 53613:54927, ack 1, win 501, options [nop,nop,TS val 2321484156 ecr 3169612227], length 1314
23:59:40.249260 IP 10.8.3.7.35362 > 99.181.89.230.1935: Flags [.], seq 54927:56241, ack 1, win 501, options [nop,nop,TS val 2321484187 ecr 3169612227], length 1314
23:59:40.264683 IP 99.181.89.230.1935 > 10.8.3.7.35362: Flags [.], ack 40677, win 175, options [nop,nop,TS val 3169612289 ecr 2321483617], length 0
23:59:40.281265 IP 10.8.3.7.35362 > 99.181.89.230.1935: Flags [.], seq 56241:57555, ack 1, win 501, options [nop,nop,TS val 2321484219 ecr 3169612289], length 1314
23:59:40.304645 IP 99.181.89.230.1935 > 10.8.3.7.35362: Flags [.], ack 41787, win 176, options [nop,nop,TS val 3169612329 ecr 2321483691], length 0
23:59:40.304666 IP 10.8.3.7.35362 > 99.181.89.230.1935: Flags [P.], seq 57555:57808, ack 1, win 501, options [nop,nop,TS val 2321484242 ecr 3169612329], length 253
23:59:40.346564 IP 10.8.3.7.35362 > 99.181.89.230.1935: Flags [.], seq 57808:59122, ack 1, win 501, options [nop,nop,TS val 2321484284 ecr 3169612329], length 1314
23:59:40.379455 IP 10.8.3.7.35362 > 99.181.89.230.1935: Flags [.], seq 59122:60436, ack 1, win 501, options [nop,nop,TS val 2321484317 ecr 3169612329], length 1314
23:59:40.400119 IP 99.181.89.230.1935 > 10.8.3.7.35362: Flags [.], ack 44415, win 176, options [nop,nop,TS val 3169612425 ecr 2321483752], length 0
23:59:40.432193 IP 10.8.3.7.35362 > 99.181.89.230.1935: Flags [.], seq 60436:61750, ack 1, win 501, options [nop,nop,TS val 2321484369 ecr 3169612425], length 1314
23:59:40.482986 IP 10.8.3.7.35362 > 99.181.89.230.1935: Flags [.], seq 61750:63064, ack 1, win 501, options [nop,nop,TS val 2321484420 ecr 3169612425], length 1314
23:59:40.497284 IP 99.181.89.230.1935 > 10.8.3.7.35362: Flags [.], ack 47043, win 175, options [nop,nop,TS val 3169612522 ecr 2321483820], length 0
23:59:40.513970 IP 10.8.3.7.35362 > 99.181.89.230.1935: Flags [.], seq 63064:64378, ack 1, win 501, options [nop,nop,TS val 2321484451 ecr 3169612522], length 1314
23:59:40.546278 IP 10.8.3.7.35362 > 99.181.89.230.1935: Flags [.], seq 64378:65692, ack 1, win 501, options [nop,nop,TS val 2321484484 ecr 3169612522], length 1314
23:59:40.568142 IP 99.181.89.230.1935 > 10.8.3.7.35362: Flags [.], ack 49671, win 175, options [nop,nop,TS val 3169612593 ecr 2321483918], length 0
23:59:40.603215 IP 10.8.3.7.35362 > 99.181.89.230.1935: Flags [.], seq 65692:67006, ack 1, win 501, options [nop,nop,TS val 2321484541 ecr 3169612593], length 1314
23:59:40.645875 IP 10.8.3.7.35362 > 99.181.89.230.1935: Flags [.], seq 67006:68320, ack 1, win 501, options [nop,nop,TS val 2321484583 ecr 3169612593], length 1314
23:59:40.663850 IP 99.181.89.230.1935 > 10.8.3.7.35362: Flags [.], ack 52299, win 175, options [nop,nop,TS val 3169612688 ecr 2321484017], length 0
23:59:40.683295 IP 10.8.3.7.35362 > 99.181.89.230.1935: Flags [.], seq 68320:69634, ack 1, win 501, options [nop,nop,TS val 2321484621 ecr 3169612688], length 1314
23:59:40.731941 IP 10.8.3.7.35362 > 99.181.89.230.1935: Flags [.], seq 69634:70948, ack 1, win 501, options [nop,nop,TS val 2321484669 ecr 3169612688], length 1314
23:59:40.769036 IP 99.181.89.230.1935 > 10.8.3.7.35362: Flags [.], ack 54927, win 175, options [nop,nop,TS val 3169612794 ecr 2321484085], length 0
23:59:40.774666 IP 10.8.3.7.35362 > 99.181.89.230.1935: Flags [.], seq 70948:72262, ack 1, win 501, options [nop,nop,TS val 2321484712 ecr 3169612794], length 1314
23:59:40.814634 IP 10.8.3.7.35362 > 99.181.89.230.1935: Flags [.], seq 72262:73576, ack 1, win 501, options [nop,nop,TS val 2321484752 ecr 3169612794], length 1314
23:59:40.831698 IP 99.181.89.230.1935 > 10.8.3.7.35362: Flags [.], ack 57555, win 175, options [nop,nop,TS val 3169612856 ecr 2321484187], length 0
23:59:40.855042 IP 99.181.89.230.1935 > 10.8.3.7.35362: Flags [.], ack 57808, win 176, options [nop,nop,TS val 3169612880 ecr 2321484242], length 0
23:59:40.855094 IP 10.8.3.7.35362 > 99.181.89.230.1935: Flags [P.], seq 73576:74672, ack 1, win 501, options [nop,nop,TS val 2321484792 ecr 3169612880], length 1096
23:59:40.903299 IP 10.8.3.7.35362 > 99.181.89.230.1935: Flags [.], seq 74672:75986, ack 1, win 501, options [nop,nop,TS val 2321484841 ecr 3169612880], length 1314
23:59:40.930067 IP 99.181.89.230.1935 > 10.8.3.7.35362: Flags [.], ack 60436, win 176, options [nop,nop,TS val 3169612955 ecr 2321484284], length 0
23:59:40.946107 IP 10.8.3.7.35362 > 99.181.89.230.1935: Flags [.], seq 75986:77300, ack 1, win 501, options [nop,nop,TS val 2321484883 ecr 3169612955], length 1314
23:59:40.983330 IP 10.8.3.7.35362 > 99.181.89.230.1935: Flags [.], seq 77300:78614, ack 1, win 501, options [nop,nop,TS val 2321484921 ecr 3169612955], length 1314
23:59:41.032213 IP 10.8.3.7.35362 > 99.181.89.230.1935: Flags [.], seq 78614:79928, ack 1, win 501, options [nop,nop,TS val 2321484970 ecr 3169612955], length 1314
23:59:41.033854 IP 99.181.89.230.1935 > 10.8.3.7.35362: Flags [.], ack 63064, win 176, options [nop,nop,TS val 3169613058 ecr 2321484369], length 0
23:59:41.074958 IP 10.8.3.7.35362 > 99.181.89.230.1935: Flags [.], seq 79928:81242, ack 1, win 501, options [nop,nop,TS val 2321485012 ecr 3169613058], length 1314
23:59:41.096609 IP 99.181.89.230.1935 > 10.8.3.7.35362: Flags [.], ack 65692, win 176, options [nop,nop,TS val 3169613121 ecr 2321484451], length 0
23:59:41.116583 IP 10.8.3.7.35362 > 99.181.89.230.1935: Flags [.], seq 81242:82556, ack 1, win 501, options [nop,nop,TS val 2321485054 ecr 3169613121], length 1314
23:59:41.180743 IP 10.8.3.7.35362 > 99.181.89.230.1935: Flags [.], seq 82556:83870, ack 1, win 501, options [nop,nop,TS val 2321485118 ecr 3169613121], length 1314
23:59:41.196397 IP 99.181.89.230.1935 > 10.8.3.7.35362: Flags [.], ack 68320, win 176, options [nop,nop,TS val 3169613221 ecr 2321484541], length 0
23:59:41.203355 IP 10.8.3.7.35362 > 99.181.89.230.1935: Flags [.], seq 83870:85184, ack 1, win 501, options [nop,nop,TS val 2321485141 ecr 3169613221], length 1314
23:59:41.246178 IP 10.8.3.7.35362 > 99.181.89.230.1935: Flags [.], seq 85184:86498, ack 1, win 501, options [nop,nop,TS val 2321485183 ecr 3169613221], length 1314
23:59:41.282835 IP 99.181.89.230.1935 > 10.8.3.7.35362: Flags [.], ack 70948, win 176, options [nop,nop,TS val 3169613307 ecr 2321484621], length 0
23:59:41.310403 IP 10.8.3.7.35362 > 99.181.89.230.1935: Flags [.], seq 86498:87812, ack 1, win 501, options [nop,nop,TS val 2321485248 ecr 3169613307], length 1314
23:59:41.331898 IP 10.8.3.7.35362 > 99.181.89.230.1935: Flags [.], seq 87812:89126, ack 1, win 501, options [nop,nop,TS val 2321485269 ecr 3169613307], length 1314
23:59:41.365310 IP 99.181.89.230.1935 > 10.8.3.7.35362: Flags [.], ack 73576, win 176, options [nop,nop,TS val 3169613390 ecr 2321484712], length 0
23:59:41.374774 IP 10.8.3.7.35362 > 99.181.89.230.1935: Flags [.], seq 89126:90440, ack 1, win 501, options [nop,nop,TS val 2321485312 ecr 3169613390], length 1314
23:59:41.405736 IP 99.181.89.230.1935 > 10.8.3.7.35362: Flags [.], ack 74672, win 176, options [nop,nop,TS val 3169613430 ecr 2321484792], length 0
23:59:41.405773 IP 10.8.3.7.35362 > 99.181.89.230.1935: Flags [P.], seq 90440:90704, ack 1, win 501, options [nop,nop,TS val 2321485343 ecr 3169613430], length 264
23:59:41.439119 IP 10.8.3.7.35362 > 99.181.89.230.1935: Flags [.], seq 90704:92018, ack 1, win 501, options [nop,nop,TS val 2321485376 ecr 3169613430], length 1314
23:59:41.482162 IP 10.8.3.7.35362 > 99.181.89.230.1935: Flags [.], seq 92018:93332, ack 1, win 501, options [nop,nop,TS val 2321485419 ecr 3169613430], length 1314
23:59:41.496879 IP 99.181.89.230.1935 > 10.8.3.7.35362: Flags [.], ack 77300, win 176, options [nop,nop,TS val 3169613521 ecr 2321484841], length 0
23:59:41.525050 IP 10.8.3.7.35362 > 99.181.89.230.1935: Flags [.], seq 93332:94646, ack 1, win 501, options [nop,nop,TS val 2321485462 ecr 3169613521], length 1314
23:59:41.568257 IP 10.8.3.7.35362 > 99.181.89.230.1935: Flags [.], seq 94646:95960, ack 1, win 501, options [nop,nop,TS val 2321485506 ecr 3169613521], length 1314
23:59:41.582728 IP 99.181.89.230.1935 > 10.8.3.7.35362: Flags [.], ack 79928, win 176, options [nop,nop,TS val 3169613607 ecr 2321484921], length 0
23:59:41.610946 IP 10.8.3.7.35362 > 99.181.89.230.1935: Flags [.], seq 95960:97274, ack 1, win 501, options [nop,nop,TS val 2321485548 ecr 3169613607], length 1314
23:59:41.653727 IP 10.8.3.7.35362 > 99.181.89.230.1935: Flags [.], seq 97274:98588, ack 1, win 501, options [nop,nop,TS val 2321485591 ecr 3169613607], length 1314
23:59:41.667251 IP 99.181.89.230.1935 > 10.8.3.7.35362: Flags [.], ack 82556, win 176, options [nop,nop,TS val 3169613692 ecr 2321485012], length 0
23:59:41.714297 IP 10.8.3.7.35362 > 99.181.89.230.1935: Flags [.], seq 98588:99902, ack 1, win 501, options [nop,nop,TS val 2321485652 ecr 3169613692], length 1314
23:59:41.739465 IP 10.8.3.7.35362 > 99.181.89.230.1935: Flags [.], seq 99902:101216, ack 1, win 501, options [nop,nop,TS val 2321485677 ecr 3169613692], length 1314
23:59:41.754046 IP 99.181.89.230.1935 > 10.8.3.7.35362: Flags [.], ack 85184, win 176, options [nop,nop,TS val 3169613779 ecr 2321485118], length 0
23:59:41.782311 IP 10.8.3.7.35362 > 99.181.89.230.1935: Flags [.], seq 101216:102530, ack 1, win 501, options [nop,nop,TS val 2321485720 ecr 3169613779], length 1314
23:59:41.846831 IP 10.8.3.7.35362 > 99.181.89.230.1935: Flags [.], seq 102530:103844, ack 1, win 501, options [nop,nop,TS val 2321485784 ecr 3169613779], length 1314
23:59:41.861102 IP 99.181.89.230.1935 > 10.8.3.7.35362: Flags [.], ack 87812, win 175, options [nop,nop,TS val 3169613886 ecr 2321485183], length 0
23:59:41.868141 IP 10.8.3.7.35362 > 99.181.89.230.1935: Flags [.], seq 103844:105158, ack 1, win 501, options [nop,nop,TS val 2321485805 ecr 3169613886], length 1314
23:59:41.913744 IP 10.8.3.7.35362 > 99.181.89.230.1935: Flags [.], seq 105158:106472, ack 1, win 501, options [nop,nop,TS val 2321485851 ecr 3169613886], length 1314
23:59:41.927398 IP 99.181.89.230.1935 > 10.8.3.7.35362: Flags [.], ack 90440, win 175, options [nop,nop,TS val 3169613952 ecr 2321485269], length 0
23:59:41.956237 IP 99.181.89.230.1935 > 10.8.3.7.35362: Flags [.], ack 90704, win 176, options [nop,nop,TS val 3169613981 ecr 2321485343], length 0
23:59:41.956251 IP 10.8.3.7.35362 > 99.181.89.230.1935: Flags [P.], seq 106472:107575, ack 1, win 501, options [nop,nop,TS val 2321485894 ecr 3169613981], length 1103
23:59:42.015846 IP 10.8.3.7.35362 > 99.181.89.230.1935: Flags [.], seq 107575:108889, ack 1, win 501, options [nop,nop,TS val 2321485953 ecr 3169613981], length 1314
23:59:42.033048 IP 99.181.89.230.1935 > 10.8.3.7.35362: Flags [.], ack 93332, win 176, options [nop,nop,TS val 3169614058 ecr 2321485376], length 0
23:59:42.038835 IP 10.8.3.7.35362 > 99.181.89.230.1935: Flags [.], seq 108889:110203, ack 1, win 501, options [nop,nop,TS val 2321485976 ecr 3169614058], length 1314
23:59:42.083063 IP 10.8.3.7.35362 > 99.181.89.230.1935: Flags [.], seq 110203:111517, ack 1, win 501, options [nop,nop,TS val 2321486020 ecr 3169614058], length 1314
23:59:42.118781 IP 99.181.89.230.1935 > 10.8.3.7.35362: Flags [.], ack 95960, win 176, options [nop,nop,TS val 3169614143 ecr 2321485462], length 0
23:59:42.145940 IP 10.8.3.7.35362 > 99.181.89.230.1935: Flags [.], seq 111517:112831, ack 1, win 501, options [nop,nop,TS val 2321486083 ecr 3169614143], length 1314
23:59:42.180575 IP 10.8.3.7.35362 > 99.181.89.230.1935: Flags [.], seq 112831:114145, ack 1, win 501, options [nop,nop,TS val 2321486118 ecr 3169614143], length 1314
23:59:42.204249 IP 99.181.89.230.1935 > 10.8.3.7.35362: Flags [.], ack 98588, win 176, options [nop,nop,TS val 3169614229 ecr 2321485548], length 0
23:59:42.212577 IP 10.8.3.7.35362 > 99.181.89.230.1935: Flags [.], seq 114145:115459, ack 1, win 501, options [nop,nop,TS val 2321486150 ecr 3169614229], length 1314
23:59:42.273445 IP 10.8.3.7.35362 > 99.181.89.230.1935: Flags [.], seq 115459:116773, ack 1, win 501, options [nop,nop,TS val 2321486211 ecr 3169614229], length 1314
23:59:42.290729 IP 99.181.89.230.1935 > 10.8.3.7.35362: Flags [.], ack 101216, win 176, options [nop,nop,TS val 3169614315 ecr 2321485652], length 0
23:59:42.316303 IP 10.8.3.7.35362 > 99.181.89.230.1935: Flags [.], seq 116773:118087, ack 1, win 501, options [nop,nop,TS val 2321486254 ecr 3169614315], length 1314
23:59:42.345776 IP 10.8.3.7.35362 > 99.181.89.230.1935: Flags [.], seq 118087:119401, ack 1, win 501, options [nop,nop,TS val 2321486283 ecr 3169614315], length 1314
23:59:42.397551 IP 99.181.89.230.1935 > 10.8.3.7.35362: Flags [.], ack 103844, win 175, options [nop,nop,TS val 3169614422 ecr 2321485720], length 0
23:59:42.401557 IP 10.8.3.7.35362 > 99.181.89.230.1935: Flags [.], seq 119401:120715, ack 1, win 501, options [nop,nop,TS val 2321486339 ecr 3169614422], length 1314
23:59:42.444419 IP 10.8.3.7.35362 > 99.181.89.230.1935: Flags [.], seq 120715:122029, ack 1, win 501, options [nop,nop,TS val 2321486382 ecr 3169614422], length 1314
23:59:42.464178 IP 99.181.89.230.1935 > 10.8.3.7.35362: Flags [.], ack 106472, win 175, options [nop,nop,TS val 3169614489 ecr 2321485805], length 0
23:59:42.479030 IP 10.8.3.7.35362 > 99.181.89.230.1935: Flags [.], seq 122029:123343, ack 1, win 501, options [nop,nop,TS val 2321486416 ecr 3169614489], length 1314
23:59:42.506823 IP 99.181.89.230.1935 > 10.8.3.7.35362: Flags [.], ack 107575, win 176, options [nop,nop,TS val 3169614531 ecr 2321485894], length 0
23:59:42.506840 IP 10.8.3.7.35362 > 99.181.89.230.1935: Flags [P.], seq 123343:123497, ack 1, win 501, options [nop,nop,TS val 2321486444 ecr 3169614531], length 154
23:59:42.549908 IP 10.8.3.7.35362 > 99.181.89.230.1935: Flags [.], seq 123497:124811, ack 1, win 501, options [nop,nop,TS val 2321486487 ecr 3169614531], length 1314
23:59:42.572210 IP 10.8.3.7.35362 > 99.181.89.230.1935: Flags [.], seq 124811:126125, ack 1, win 501, options [nop,nop,TS val 2321486510 ecr 3169614531], length 1314
23:59:42.589494 IP 99.181.89.230.1935 > 10.8.3.7.35362: Flags [.], ack 110203, win 176, options [nop,nop,TS val 3169614614 ecr 2321485953], length 0
23:59:42.616561 IP 10.8.3.7.35362 > 99.181.89.230.1935: Flags [.], seq 126125:127439, ack 1, win 501, options [nop,nop,TS val 2321486554 ecr 3169614614], length 1314
23:59:42.679771 IP 10.8.3.7.35362 > 99.181.89.230.1935: Flags [.], seq 127439:128753, ack 1, win 501, options [nop,nop,TS val 2321486617 ecr 3169614614], length 1314
23:59:42.696484 IP 99.181.89.230.1935 > 10.8.3.7.35362: Flags [.], ack 112831, win 175, options [nop,nop,TS val 3169614721 ecr 2321486020], length 0
23:59:42.716763 IP 10.8.3.7.35362 > 99.181.89.230.1935: Flags [.], seq 128753:130067, ack 1, win 501, options [nop,nop,TS val 2321486654 ecr 3169614721], length 1314
23:59:42.749792 IP 10.8.3.7.35362 > 99.181.89.230.1935: Flags [.], seq 130067:131381, ack 1, win 501, options [nop,nop,TS val 2321486687 ecr 3169614721], length 1314
23:59:42.763166 IP 99.181.89.230.1935 > 10.8.3.7.35362: Flags [.], ack 115459, win 175, options [nop,nop,TS val 3169614787 ecr 2321486118], length 0
23:59:42.808367 IP 10.8.3.7.35362 > 99.181.89.230.1935: Flags [.], seq 131381:132695, ack 1, win 501, options [nop,nop,TS val 2321486746 ecr 3169614787], length 1314
23:59:42.850153 IP 10.8.3.7.35362 > 99.181.89.230.1935: Flags [.], seq 132695:134009, ack 1, win 501, options [nop,nop,TS val 2321486787 ecr 3169614787], length 1314
23:59:42.866886 IP 99.181.89.230.1935 > 10.8.3.7.35362: Flags [.], ack 118087, win 175, options [nop,nop,TS val 3169614891 ecr 2321486211], length 0
23:59:42.883204 IP 10.8.3.7.35362 > 99.181.89.230.1935: Flags [.], seq 134009:135323, ack 1, win 501, options [nop,nop,TS val 2321486821 ecr 3169614891], length 1314
23:59:42.937221 IP 10.8.3.7.35362 > 99.181.89.230.1935: Flags [.], seq 135323:136637, ack 1, win 501, options [nop,nop,TS val 2321486875 ecr 3169614891], length 1314
23:59:42.952153 IP 99.181.89.230.1935 > 10.8.3.7.35362: Flags [.], ack 120715, win 175, options [nop,nop,TS val 3169614976 ecr 2321486283], length 0
23:59:42.980058 IP 10.8.3.7.35362 > 99.181.89.230.1935: Flags [.], seq 136637:137951, ack 1, win 501, options [nop,nop,TS val 2321486917 ecr 3169614976], length 1314
23:59:43.012355 IP 10.8.3.7.35362 > 99.181.89.230.1935: Flags [.], seq 137951:139265, ack 1, win 501, options [nop,nop,TS val 2321486950 ecr 3169614976], length 1314
23:59:43.029493 IP 99.181.89.230.1935 > 10.8.3.7.35362: Flags [.], ack 123343, win 175, options [nop,nop,TS val 3169615054 ecr 2321486382], length 0
23:59:43.057305 IP 99.181.89.230.1935 > 10.8.3.7.35362: Flags [.], ack 123497, win 176, options [nop,nop,TS val 3169615082 ecr 2321486444], length 0
23:59:43.057320 IP 10.8.3.7.35362 > 99.181.89.230.1935: Flags [P.], seq 139265:140376, ack 1, win 501, options [nop,nop,TS val 2321486995 ecr 3169615082], length 1111
23:59:43.107834 IP 10.8.3.7.35362 > 99.181.89.230.1935: Flags [.], seq 140376:141690, ack 1, win 501, options [nop,nop,TS val 2321487045 ecr 3169615082], length 1314
23:59:43.123005 IP 99.181.89.230.1935 > 10.8.3.7.35362: Flags [.], ack 126125, win 176, options [nop,nop,TS val 3169615147 ecr 2321486487], length 0
23:59:43.149045 IP 10.8.3.7.35362 > 99.181.89.230.1935: Flags [.], seq 141690:143004, ack 1, win 501, options [nop,nop,TS val 2321487086 ecr 3169615147], length 1314
23:59:43.182459 IP 10.8.3.7.35362 > 99.181.89.230.1935: Flags [.], seq 143004:144318, ack 1, win 501, options [nop,nop,TS val 2321487120 ecr 3169615147], length 1314
23:59:43.213936 IP 99.181.89.230.1935 > 10.8.3.7.35362: Flags [.], ack 127439, win 176, options [nop,nop,TS val 3169615238 ecr 2321486554], length 0
23:59:43.249160 IP 10.8.3.7.35362 > 99.181.89.230.1935: Flags [.], seq 144318:145632, ack 1, win 501, options [nop,nop,TS val 2321487186 ecr 3169615238], length 1314
23:59:43.267402 IP 99.181.89.230.1935 > 10.8.3.7.35362: Flags [.], ack 130067, win 176, options [nop,nop,TS val 3169615292 ecr 2321486617], length 0
23:59:43.279056 IP 10.8.3.7.35362 > 99.181.89.230.1935: Flags [.], seq 145632:146946, ack 1, win 501, options [nop,nop,TS val 2321487216 ecr 3169615292], length 1314
23:59:43.315637 IP 10.8.3.7.35362 > 99.181.89.230.1935: Flags [.], seq 146946:148260, ack 1, win 501, options [nop,nop,TS val 2321487253 ecr 3169615292], length 1314
23:59:43.359509 IP 99.181.89.230.1935 > 10.8.3.7.35362: Flags [.], ack 132695, win 175, options [nop,nop,TS val 3169615384 ecr 2321486687], length 0
23:59:43.382589 IP 10.8.3.7.35362 > 99.181.89.230.1935: Flags [.], seq 148260:149574, ack 1, win 501, options [nop,nop,TS val 2321487320 ecr 3169615384], length 1314
23:59:43.407467 IP 10.8.3.7.35362 > 99.181.89.230.1935: Flags [.], seq 149574:150888, ack 1, win 501, options [nop,nop,TS val 2321487345 ecr 3169615384], length 1314
23:59:43.434138 IP 99.181.89.230.1935 > 10.8.3.7.35362: Flags [.], ack 135323, win 175, options [nop,nop,TS val 3169615459 ecr 2321486787], length 0
23:59:43.449070 IP 10.8.3.7.35362 > 99.181.89.230.1935: Flags [.], seq 150888:152202, ack 1, win 501, options [nop,nop,TS val 2321487386 ecr 3169615459], length 1314
23:59:43.514235 IP 10.8.3.7.35362 > 99.181.89.230.1935: Flags [.], seq 152202:153516, ack 1, win 501, options [nop,nop,TS val 2321487452 ecr 3169615459], length 1314
23:59:43.530822 IP 99.181.89.230.1935 > 10.8.3.7.35362: Flags [.], ack 137951, win 175, options [nop,nop,TS val 3169615555 ecr 2321486875], length 0
23:59:43.545891 IP 10.8.3.7.35362 > 99.181.89.230.1935: Flags [.], seq 153516:154830, ack 1, win 501, options [nop,nop,TS val 2321487483 ecr 3169615555], length 1314
23:59:43.577954 IP 10.8.3.7.35362 > 99.181.89.230.1935: Flags [.], seq 154830:156144, ack 1, win 501, options [nop,nop,TS val 2321487515 ecr 3169615555], length 1314
23:59:43.607917 IP 99.181.89.230.1935 > 10.8.3.7.35362: Flags [.], ack 140376, win 175, options [nop,nop,TS val 3169615632 ecr 2321486950], length 0
23:59:43.607948 IP 10.8.3.7.35362 > 99.181.89.230.1935: Flags [P.], seq 156144:156401, ack 1, win 501, options [nop,nop,TS val 2321487545 ecr 3169615632], length 257
23:59:43.642274 IP 10.8.3.7.35362 > 99.181.89.230.1935: Flags [.], seq 156401:157715, ack 1, win 501, options [nop,nop,TS val 2321487580 ecr 3169615632], length 1314
23:59:43.680573 IP 10.8.3.7.35362 > 99.181.89.230.1935: Flags [.], seq 157715:159029, ack 1, win 501, options [nop,nop,TS val 2321487618 ecr 3169615632], length 1314
23:59:43.699833 IP 99.181.89.230.1935 > 10.8.3.7.35362: Flags [.], ack 143004, win 175, options [nop,nop,TS val 3169615724 ecr 2321487045], length 0
23:59:43.727542 IP 10.8.3.7.35362 > 99.181.89.230.1935: Flags [.], seq 159029:160343, ack 1, win 501, options [nop,nop,TS val 2321487665 ecr 3169615724], length 1314
23:59:43.783387 IP 10.8.3.7.35362 > 99.181.89.230.1935: Flags [.], seq 160343:161657, ack 1, win 501, options [nop,nop,TS val 2321487721 ecr 3169615724], length 1314
23:59:43.799918 IP 99.181.89.230.1935 > 10.8.3.7.35362: Flags [.], ack 145632, win 175, options [nop,nop,TS val 3169615824 ecr 2321487120], length 0
23:59:43.813493 IP 10.8.3.7.35362 > 99.181.89.230.1935: Flags [.], seq 161657:162971, ack 1, win 501, options [nop,nop,TS val 2321487751 ecr 3169615824], length 1314
23:59:43.856448 IP 10.8.3.7.35362 > 99.181.89.230.1935: Flags [.], seq 162971:164285, ack 1, win 501, options [nop,nop,TS val 2321487794 ecr 3169615824], length 1314
23:59:43.866330 IP 99.181.89.230.1935 > 10.8.3.7.35362: Flags [.], ack 148260, win 175, options [nop,nop,TS val 3169615891 ecr 2321487216], length 0
23:59:43.913029 IP 10.8.3.7.35362 > 99.181.89.230.1935: Flags [.], seq 164285:165599, ack 1, win 501, options [nop,nop,TS val 2321487850 ecr 3169615891], length 1314
23:59:43.941257 IP 10.8.3.7.35362 > 99.181.89.230.1935: Flags [.], seq 165599:166913, ack 1, win 501, options [nop,nop,TS val 2321487879 ecr 3169615891], length 1314
23:59:43.957896 IP 99.181.89.230.1935 > 10.8.3.7.35362: Flags [.], ack 150888, win 175, options [nop,nop,TS val 3169615982 ecr 2321487320], length 0
23:59:43.983859 IP 10.8.3.7.35362 > 99.181.89.230.1935: Flags [.], seq 166913:168227, ack 1, win 501, options [nop,nop,TS val 2321487921 ecr 3169615982], length 1314
23:59:44.047954 IP 10.8.3.7.35362 > 99.181.89.230.1935: Flags [.], seq 168227:169541, ack 1, win 501, options [nop,nop,TS val 2321487985 ecr 3169615982], length 1314
23:59:44.064900 IP 99.181.89.230.1935 > 10.8.3.7.35362: Flags [.], ack 153516, win 175, options [nop,nop,TS val 3169616089 ecr 2321487386], length 0
23:59:44.081940 IP 10.8.3.7.35362 > 99.181.89.230.1935: Flags [.], seq 169541:170855, ack 1, win 501, options [nop,nop,TS val 2321488019 ecr 3169616089], length 1314
23:59:44.116567 IP 10.8.3.7.35362 > 99.181.89.230.1935: Flags [.], seq 170855:172169, ack 1, win 501, options [nop,nop,TS val 2321488054 ecr 3169616089], length 1314
23:59:44.128497 IP 99.181.89.230.1935 > 10.8.3.7.35362: Flags [.], ack 156144, win 175, options [nop,nop,TS val 3169616153 ecr 2321487483], length 0
23:59:44.158468 IP 99.181.89.230.1935 > 10.8.3.7.35362: Flags [.], ack 156401, win 176, options [nop,nop,TS val 3169616183 ecr 2321487545], length 0
23:59:44.158500 IP 10.8.3.7.35362 > 99.181.89.230.1935: Flags [P.], seq 172169:173263, ack 1, win 501, options [nop,nop,TS val 2321488096 ecr 3169616183], length 1094
23:59:44.216227 IP 10.8.3.7.35362 > 99.181.89.230.1935: Flags [.], seq 173263:174577, ack 1, win 501, options [nop,nop,TS val 2321488154 ecr 3169616183], length 1314
23:59:44.231140 IP 99.181.89.230.1935 > 10.8.3.7.35362: Flags [.], ack 159029, win 176, options [nop,nop,TS val 3169616256 ecr 2321487580], length 0
23:59:44.240861 IP 10.8.3.7.35362 > 99.181.89.230.1935: Flags [.], seq 174577:175891, ack 1, win 501, options [nop,nop,TS val 2321488178 ecr 3169616256], length 1314
23:59:44.283950 IP 10.8.3.7.35362 > 99.181.89.230.1935: Flags [.], seq 175891:177205, ack 1, win 501, options [nop,nop,TS val 2321488221 ecr 3169616256], length 1314
23:59:44.334066 IP 99.181.89.230.1935 > 10.8.3.7.35362: Flags [.], ack 161657, win 176, options [nop,nop,TS val 3169616359 ecr 2321487665], length 0
23:59:44.345668 IP 10.8.3.7.35362 > 99.181.89.230.1935: Flags [.], seq 177205:178519, ack 1, win 501, options [nop,nop,TS val 2321488283 ecr 3169616359], length 1314
23:59:44.379411 IP 10.8.3.7.35362 > 99.181.89.230.1935: Flags [.], seq 178519:179833, ack 1, win 501, options [nop,nop,TS val 2321488317 ecr 3169616359], length 1314
23:59:44.407288 IP 99.181.89.230.1935 > 10.8.3.7.35362: Flags [.], ack 164285, win 176, options [nop,nop,TS val 3169616432 ecr 2321487751], length 0
23:59:44.416454 IP 10.8.3.7.35362 > 99.181.89.230.1935: Flags [.], seq 179833:181147, ack 1, win 501, options [nop,nop,TS val 2321488354 ecr 3169616432], length 1314
23:59:44.476226 IP 10.8.3.7.35362 > 99.181.89.230.1935: Flags [.], seq 181147:182461, ack 1, win 501, options [nop,nop,TS val 2321488414 ecr 3169616432], length 1314
23:59:44.491920 IP 99.181.89.230.1935 > 10.8.3.7.35362: Flags [.], ack 166913, win 176, options [nop,nop,TS val 3169616516 ecr 2321487850], length 0
23:59:44.515094 IP 10.8.3.7.35362 > 99.181.89.230.1935: Flags [.], seq 182461:183775, ack 1, win 501, options [nop,nop,TS val 2321488452 ecr 3169616516], length 1314
23:59:44.546269 IP 10.8.3.7.35362 > 99.181.89.230.1935: Flags [.], seq 183775:185089, ack 1, win 501, options [nop,nop,TS val 2321488484 ecr 3169616516], length 1314
23:59:44.598461 IP 99.181.89.230.1935 > 10.8.3.7.35362: Flags [.], ack 169541, win 175, options [nop,nop,TS val 3169616623 ecr 2321487921], length 0
23:59:44.612381 IP 10.8.3.7.35362 > 99.181.89.230.1935: Flags [.], seq 185089:186403, ack 1, win 501, options [nop,nop,TS val 2321488550 ecr 3169616623], length 1314
23:59:44.646573 IP 10.8.3.7.35362 > 99.181.89.230.1935: Flags [.], seq 186403:187717, ack 1, win 501, options [nop,nop,TS val 2321488584 ecr 3169616623], length 1314
23:59:44.667126 IP 99.181.89.230.1935 > 10.8.3.7.35362: Flags [.], ack 172169, win 175, options [nop,nop,TS val 3169616692 ecr 2321488019], length 0
23:59:44.682739 IP 10.8.3.7.35362 > 99.181.89.230.1935: Flags [.], seq 187717:189031, ack 1, win 501, options [nop,nop,TS val 2321488620 ecr 3169616692], length 1314
23:59:44.709143 IP 99.181.89.230.1935 > 10.8.3.7.35362: Flags [.], ack 173263, win 176, options [nop,nop,TS val 3169616734 ecr 2321488096], length 0
23:59:44.709177 IP 10.8.3.7.35362 > 99.181.89.230.1935: Flags [P.], seq 189031:189198, ack 1, win 501, options [nop,nop,TS val 2321488646 ecr 3169616734], length 167
23:59:44.749714 IP 10.8.3.7.35362 > 99.181.89.230.1935: Flags [.], seq 189198:190512, ack 1, win 501, options [nop,nop,TS val 2321488687 ecr 3169616734], length 1314
23:59:44.775478 IP 10.8.3.7.35362 > 99.181.89.230.1935: Flags [.], seq 190512:191826, ack 1, win 501, options [nop,nop,TS val 2321488713 ecr 3169616734], length 1314
23:59:44.791504 IP 99.181.89.230.1935 > 10.8.3.7.35362: Flags [.], ack 175891, win 176, options [nop,nop,TS val 3169616816 ecr 2321488154], length 0
23:59:44.818309 IP 10.8.3.7.35362 > 99.181.89.230.1935: Flags [.], seq 191826:193140, ack 1, win 501, options [nop,nop,TS val 2321488756 ecr 3169616816], length 1314
23:59:44.882849 IP 10.8.3.7.35362 > 99.181.89.230.1935: Flags [.], seq 193140:194454, ack 1, win 501, options [nop,nop,TS val 2321488820 ecr 3169616816], length 1314
23:59:44.896355 IP 99.181.89.230.1935 > 10.8.3.7.35362: Flags [.], ack 178519, win 175, options [nop,nop,TS val 3169616921 ecr 2321488221], length 0
23:59:44.913964 IP 10.8.3.7.35362 > 99.181.89.230.1935: Flags [.], seq 194454:195768, ack 1, win 501, options [nop,nop,TS val 2321488851 ecr 3169616921], length 1314
23:59:44.947378 IP 10.8.3.7.35362 > 99.181.89.230.1935: Flags [.], seq 195768:197082, ack 1, win 501, options [nop,nop,TS val 2321488885 ecr 3169616921], length 1314
23:59:44.967285 IP 99.181.89.230.1935 > 10.8.3.7.35362: Flags [.], ack 181147, win 175, options [nop,nop,TS val 3169616992 ecr 2321488317], length 0
23:59:45.010870 IP 10.8.3.7.35362 > 99.181.89.230.1935: Flags [.], seq 197082:198396, ack 1, win 501, options [nop,nop,TS val 2321488948 ecr 3169616992], length 1314
23:59:45.047599 IP 10.8.3.7.35362 > 99.181.89.230.1935: Flags [.], seq 198396:199710, ack 1, win 501, options [nop,nop,TS val 2321488985 ecr 3169616992], length 1314
23:59:45.065508 IP 99.181.89.230.1935 > 10.8.3.7.35362: Flags [.], ack 183775, win 175, options [nop,nop,TS val 3169617090 ecr 2321488414], length 0
23:59:45.080247 IP 10.8.3.7.35362 > 99.181.89.230.1935: Flags [.], seq 199710:201024, ack 1, win 501, options [nop,nop,TS val 2321489018 ecr 3169617090], length 1314
23:59:45.145667 IP 10.8.3.7.35362 > 99.181.89.230.1935: Flags [.], seq 201024:202338, ack 1, win 501, options [nop,nop,TS val 2321489083 ecr 3169617090], length 1314
23:59:45.162744 IP 99.181.89.230.1935 > 10.8.3.7.35362: Flags [.], ack 186403, win 175, options [nop,nop,TS val 3169617187 ecr 2321488484], length 0
23:59:45.179306 IP 10.8.3.7.35362 > 99.181.89.230.1935: Flags [.], seq 202338:203652, ack 1, win 501, options [nop,nop,TS val 2321489117 ecr 3169617187], length 1314
23:59:45.215947 IP 10.8.3.7.35362 > 99.181.89.230.1935: Flags [.], seq 203652:204966, ack 1, win 501, options [nop,nop,TS val 2321489153 ecr 3169617187], length 1314
23:59:45.233516 IP 99.181.89.230.1935 > 10.8.3.7.35362: Flags [.], ack 189031, win 175, options [nop,nop,TS val 3169617258 ecr 2321488584], length 0
