00:18:10.092359 IP 10.8.0.8.55214 > 52.223.243.57.1935: Flags [.], seq 4078554533:4078555847, ack 144885666, win 501, options [nop,nop,TS val 2213179017 ecr 3334208047], length 1314
00:18:10.092749 IP 52.223.243.57.1935 > 10.8.0.8.55214: Flags [.], ack 4294963354, win 126, options [nop,nop,TS val 3334208074 ecr 2213178808], length 0
00:18:10.092774 IP 10.8.0.8.55214 > 52.223.243.57.1935: Flags [P.], seq 1314:2096, ack 1, win 501, options [nop,nop,TS val 2213179018 ecr 3334208074], length 782
00:18:10.156807 IP 10.8.0.8.55214 > 52.223.243.57.1935: Flags [.], seq 2096:3410, ack 1, win 501, options [nop,nop,TS val 2213179082 ecr 3334208074], length 1314
00:18:10.181644 IP 10.8.0.8.55214 > 52.223.243.57.1935: Flags [.], seq 3410:4724, ack 1, win 501, options [nop,nop,TS val 2213179106 ecr 3334208074], length 1314
00:18:10.197200 IP 52.223.243.57.1935 > 10.8.0.8.55214: Flags [.], ack 4294965982, win 126, options [nop,nop,TS val 3334208178 ecr 2213178881], length 0
00:18:10.224696 IP 10.8.0.8.55214 > 52.223.243.57.1935: Flags [.], seq 4724:6038, ack 1, win 501, options [nop,nop,TS val 2213179150 ecr 3334208178], length 1314
00:18:10.289149 IP 10.8.0.8.55214 > 52.223.243.57.1935: Flags [.], seq 6038:7352, ack 1, win 501, options [nop,nop,TS val 2213179214 ecr 3334208178], length 1314
00:18:10.299598 IP 52.223.243.57.1935 > 10.8.0.8.55214: Flags [.], ack 1314, win 126, options [nop,nop,TS val 3334208281 ecr 2213178951], length 0
00:18:10.299746 IP 52.223.243.57.1935 > 10.8.0.8.55214: Flags [.], ack 2096, win 126, options [nop,nop,TS val 3334208281 ecr 2213179018], length 0
00:18:10.299760 IP 10.8.0.8.55214 > 52.223.243.57.1935: Flags [P.], seq 7352:8129, ack 1, win 501, options [nop,nop,TS val 2213179225 ecr 3334208281], length 777
00:18:10.352704 IP 10.8.0.8.55214 > 52.223.243.57.1935: Flags [.], seq 8129:9443, ack 1, win 501, options [nop,nop,TS val 2213179278 ecr 3334208281], length 1314
00:18:10.388866 IP 52.223.243.57.1935 > 10.8.0.8.55214: Flags [.], ack 4724, win 126, options [nop,nop,TS val 3334208370 ecr 2213179082], length 0
00:18:10.393555 IP 10.8.0.8.55214 > 52.223.243.57.1935: Flags [.], seq 9443:10757, ack 1, win 501, options [nop,nop,TS val 2213179318 ecr 3334208370], length 1314
00:18:10.427160 IP 10.8.0.8.55214 > 52.223.243.57.1935: Flags [.], seq 10757:12071, ack 1, win 501, options [nop,nop,TS val 2213179352 ecr 3334208370], length 1314
00:18:10.493152 IP 10.8.0.8.55214 > 52.223.243.57.1935: Flags [.], seq 12071:13385, ack 1, win 501, options [nop,nop,TS val 2213179418 ecr 3334208370], length 1314
00:18:10.496981 IP 52.223.243.57.1935 > 10.8.0.8.55214: Flags [.], ack 7352, win 126, options [nop,nop,TS val 3334208478 ecr 2213179150], length 0
00:18:10.506824 IP 52.223.243.57.1935 > 10.8.0.8.55214: Flags [.], ack 8129, win 126, options [nop,nop,TS val 3334208488 ecr 2213179225], length 0
00:18:10.506857 IP 10.8.0.8.55214 > 52.223.243.57.1935: Flags [P.], seq 13385:14154, ack 1, win 501, options [nop,nop,TS val 2213179432 ecr 3334208488], length 769
00:18:10.558195 IP 10.8.0.8.55214 > 52.223.243.57.1935: Flags [.], seq 14154:15468, ack 1, win 501, options [nop,nop,TS val 2213179483 ecr 3334208488], length 1314
00:18:10.588223 IP 10.8.0.8.55214 > 52.223.243.57.1935: Flags [.], seq 15468:16782, ack 1, win 501, options [nop,nop,TS val 2213179513 ecr 3334208488], length 1314
00:18:10.601043 IP 52.223.243.57.1935 > 10.8.0.8.55214: Flags [.], ack 10757, win 126, options [nop,nop,TS val 3334208582 ecr 2213179278], length 0
00:18:10.631350 IP 10.8.0.8.55214 > 52.223.243.57.1935: Flags [.], seq 16782:18096, ack 1, win 501, options [nop,nop,TS val 2213179556 ecr 3334208582], length 1314
00:18:10.692212 IP 10.8.0.8.55214 > 52.223.243.57.1935: Flags [.], seq 18096:19410, ack 1, win 501, options [nop,nop,TS val 2213179617 ecr 3334208582], length 1314
00:18:10.701024 IP 52.223.243.57.1935 > 10.8.0.8.55214: Flags [.], ack 13385, win 126, options [nop,nop,TS val 3334208682 ecr 2213179352], length 0
00:18:10.714168 IP 52.223.243.57.1935 > 10.8.0.8.55214: Flags [.], ack 14154, win 126, options [nop,nop,TS val 3334208695 ecr 2213179432], length 0
00:18:10.714193 IP 10.8.0.8.55214 > 52.223.243.57.1935: Flags [P.], seq 19410:20096, ack 1, win 501, options [nop,nop,TS val 2213179639 ecr 3334208695], length 686
00:18:10.758840 IP 10.8.0.8.55214 > 52.223.243.57.1935: Flags [.], seq 20096:21410, ack 1, win 501, options [nop,nop,TS val 2213179684 ecr 3334208695], length 1314
00:18:10.793514 IP 10.8.0.8.55214 > 52.223.243.57.1935: Flags [.], seq 21410:22724, ack 1, win 501, options [nop,nop,TS val 2213179718 ecr 3334208695], length 1314
00:18:10.795756 IP 52.223.243.57.1935 > 10.8.0.8.55214: Flags [.], ack 16782, win 126, options [nop,nop,TS val 3334208777 ecr 2213179483], length 0
00:18:10.825301 IP 10.8.0.8.55214 > 52.223.243.57.1935: Flags [.], seq 22724:24038, ack 1, win 501, options [nop,nop,TS val 2213179750 ecr 3334208777], length 1314
00:18:10.887828 IP 10.8.0.8.55214 > 52.223.243.57.1935: Flags [.], seq 24038:25352, ack 1, win 501, options [nop,nop,TS val 2213179813 ecr 3334208777], length 1314
00:18:10.899493 IP 52.223.243.57.1935 > 10.8.0.8.55214: Flags [.], ack 19410, win 126, options [nop,nop,TS val 3334208881 ecr 2213179556], length 0
00:18:10.921166 IP 52.223.243.57.1935 > 10.8.0.8.55214: Flags [.], ack 20096, win 126, options [nop,nop,TS val 3334208903 ecr 2213179639], length 0
00:18:10.921188 IP 10.8.0.8.55214 > 52.223.243.57.1935: Flags [P.], seq 25352:26134, ack 1, win 501, options [nop,nop,TS val 2213179846 ecr 3334208903], length 782
00:18:10.951415 IP 10.8.0.8.55214 > 52.223.243.57.1935: Flags [.], seq 26134:27448, ack 1, win 501, options [nop,nop,TS val 2213179876 ecr 3334208903], length 1314
00:18:10.993645 IP 10.8.0.8.55214 > 52.223.243.57.1935: Flags [.], seq 27448:28762, ack 1, win 501, options [nop,nop,TS val 2213179918 ecr 3334208903], length 1314
00:18:11.002448 IP 52.223.243.57.1935 > 10.8.0.8.55214: Flags [.], ack 22724, win 126, options [nop,nop,TS val 3334208982 ecr 2213179684], length 0
00:18:11.036711 IP 10.8.0.8.55214 > 52.223.243.57.1935: Flags [.], seq 28762:30076, ack 1, win 501, options [nop,nop,TS val 2213179962 ecr 3334208982], length 1314
00:18:11.090153 IP 10.8.0.8.55214 > 52.223.243.57.1935: Flags [.], seq 30076:31390, ack 1, win 501, options [nop,nop,TS val 2213180015 ecr 3334208982], length 1314
00:18:11.095163 IP 52.223.243.57.1935 > 10.8.0.8.55214: Flags [.], ack 25352, win 126, options [nop,nop,TS val 3334209077 ecr 2213179750], length 0
00:18:11.121892 IP 10.8.0.8.55214 > 52.223.243.57.1935: Flags [.], seq 31390:32704, ack 1, win 501, options [nop,nop,TS val 2213180047 ecr 3334209077], length 1314
00:18:11.128255 IP 52.223.243.57.1935 > 10.8.0.8.55214: Flags [.], ack 26134, win 126, options [nop,nop,TS val 3334209110 ecr 2213179846], length 0
00:18:11.128292 IP 10.8.0.8.55214 > 52.223.243.57.1935: Flags [P.], seq 32704:33012, ack 1, win 501, options [nop,nop,TS val 2213180053 ecr 3334209110], length 308
00:18:11.186372 IP 10.8.0.8.55214 > 52.223.243.57.1935: Flags [.], seq 33012:34326, ack 1, win 501, options [nop,nop,TS val 2213180111 ecr 3334209110], length 1314
00:18:11.201235 IP 52.223.243.57.1935 > 10.8.0.8.55214: Flags [.], ack 28762, win 126, options [nop,nop,TS val 3334209182 ecr 2213179876], length 0
00:18:11.225361 IP 10.8.0.8.55214 > 52.223.243.57.1935: Flags [.], seq 34326:35640, ack 1, win 501, options [nop,nop,TS val 2213180150 ecr 3334209182], length 1314
00:18:11.257459 IP 10.8.0.8.55214 > 52.223.243.57.1935: Flags [.], seq 35640:36954, ack 1, win 501, options [nop,nop,TS val 2213180182 ecr 3334209182], length 1314
00:18:11.297394 IP 52.223.243.57.1935 > 10.8.0.8.55214: Flags [.], ack 31390, win 126, options [nop,nop,TS val 3334209279 ecr 2213179962], length 0
00:18:11.326882 IP 10.8.0.8.55214 > 52.223.243.57.1935: Flags [.], seq 36954:38268, ack 1, win 501, options [nop,nop,TS val 2213180252 ecr 3334209279], length 1314
00:18:11.335591 IP 52.223.243.57.1935 > 10.8.0.8.55214: Flags [.], ack 33012, win 126, options [nop,nop,TS val 3334209317 ecr 2213180047], length 0
00:18:11.335625 IP 10.8.0.8.55214 > 52.223.243.57.1935: Flags [P.], seq 38268:38942, ack 1, win 501, options [nop,nop,TS val 2213180260 ecr 3334209317], length 674
00:18:11.393352 IP 10.8.0.8.55214 > 52.223.243.57.1935: Flags [.], seq 38942:40256, ack 1, win 501, options [nop,nop,TS val 2213180318 ecr 3334209317], length 1314
00:18:11.421699 IP 10.8.0.8.55214 > 52.223.243.57.1935: Flags [.], seq 40256:41570, ack 1, win 501, options [nop,nop,TS val 2213180347 ecr 3334209317], length 1314
00:18:11.432799 IP 52.223.243.57.1935 > 10.8.0.8.55214: Flags [.], ack 35640, win 126, options [nop,nop,TS val 3334209414 ecr 2213180111], length 0
00:18:11.460419 IP 10.8.0.8.55214 > 52.223.243.57.1935: Flags [.], seq 41570:42884, ack 1, win 501, options [nop,nop,TS val 2213180385 ecr 3334209414], length 1314
00:18:11.526908 IP 10.8.0.8.55214 > 52.223.243.57.1935: Flags [.], seq 42884:44198, ack 1, win 501, options [nop,nop,TS val 2213180452 ecr 3334209414], length 1314
00:18:11.534497 IP 52.223.243.57.1935 > 10.8.0.8.55214: Flags [.], ack 38268, win 126, options [nop,nop,TS val 3334209516 ecr 2213180182], length 0
00:18:11.543026 IP 52.223.243.57.1935 > 10.8.0.8.55214: Flags [.], ack 38942, win 126, options [nop,nop,TS val 3334209524 ecr 2213180260], length 0
00:18:11.543048 IP 10.8.0.8.55214 > 52.223.243.57.1935: Flags [P.], seq 44198:44979, ack 1, win 501, options [nop,nop,TS val 2213180468 ecr 3334209524], length 781
00:18:11.589578 IP 10.8.0.8.55214 > 52.223.243.57.1935: Flags [.], seq 44979:46293, ack 1, win 501, options [nop,nop,TS val 2213180514 ecr 3334209524], length 1314
00:18:11.624224 IP 10.8.0.8.55214 > 52.223.243.57.1935: Flags [.], seq 46293:47607, ack 1, win 501, options [nop,nop,TS val 2213180549 ecr 3334209524], length 1314
00:18:11.629211 IP 52.223.243.57.1935 > 10.8.0.8.55214: Flags [.], ack 41570, win 126, options [nop,nop,TS val 3334209611 ecr 2213180318], length 0
00:18:11.660573 IP 10.8.0.8.55214 > 52.223.243.57.1935: Flags [.], seq 47607:48921, ack 1, win 501, options [nop,nop,TS val 2213180585 ecr 3334209611], length 1314
00:18:11.721028 IP 10.8.0.8.55214 > 52.223.243.57.1935: Flags [.], seq 48921:50235, ack 1, win 501, options [nop,nop,TS val 2213180646 ecr 3334209611], length 1314
00:18:11.732677 IP 52.223.243.57.1935 > 10.8.0.8.55214: Flags [.], ack 42884, win 126, options [nop,nop,TS val 3334209714 ecr 2213180385], length 0
00:18:11.750227 IP 52.223.243.57.1935 > 10.8.0.8.55214: Flags [.], ack 44979, win 126, options [nop,nop,TS val 3334209732 ecr 2213180452], length 0
00:18:11.750254 IP 10.8.0.8.55214 > 52.223.243.57.1935: Flags [P.], seq 50235:51017, ack 1, win 501, options [nop,nop,TS val 2213180675 ecr 3334209732], length 782
00:18:11.785268 IP 10.8.0.8.55214 > 52.223.243.57.1935: Flags [.], seq 51017:52331, ack 1, win 501, options [nop,nop,TS val 2213180710 ecr 3334209732], length 1314
00:18:11.827197 IP 10.8.0.8.55214 > 52.223.243.57.1935: Flags [.], seq 52331:53645, ack 1, win 501, options [nop,nop,TS val 2213180752 ecr 3334209732], length 1314
00:18:11.831619 IP 52.223.243.57.1935 > 10.8.0.8.55214: Flags [.], ack 47607, win 126, options [nop,nop,TS val 3334209813 ecr 2213180514], length 0
00:18:11.871518 IP 10.8.0.8.55214 > 52.223.243.57.1935: Flags [.], seq 53645:54959, ack 1, win 501, options [nop,nop,TS val 2213180796 ecr 3334209813], length 1314
00:18:11.923953 IP 10.8.0.8.55214 > 52.223.243.57.1935: Flags [.], seq 54959:56273, ack 1, win 501, options [nop,nop,TS val 2213180849 ecr 3334209813], length 1314
00:18:11.928160 IP 52.223.243.57.1935 > 10.8.0.8.55214: Flags [.], ack 50235, win 126, options [nop,nop,TS val 3334209910 ecr 2213180585], length 0
00:18:11.956623 IP 10.8.0.8.55214 > 52.223.243.57.1935: Flags [.], seq 56273:57587, ack 1, win 501, options [nop,nop,TS val 2213180881 ecr 3334209910], length 1314
00:18:11.957613 IP 52.223.243.57.1935 > 10.8.0.8.55214: Flags [.], ack 51017, win 126, options [nop,nop,TS val 3334209939 ecr 2213180675], length 0
00:18:11.957633 IP 10.8.0.8.55214 > 52.223.243.57.1935: Flags [P.], seq 57587:57798, ack 1, win 501, options [nop,nop,TS val 2213180882 ecr 3334209939], length 211
00:18:12.020291 IP 10.8.0.8.55214 > 52.223.243.57.1935: Flags [.], seq 57798:59112, ack 1, win 501, options [nop,nop,TS val 2213180945 ecr 3334209939], length 1314
00:18:12.035063 IP 52.223.243.57.1935 > 10.8.0.8.55214: Flags [.], ack 53645, win 126, options [nop,nop,TS val 3334210016 ecr 2213180710], length 0
00:18:12.060421 IP 10.8.0.8.55214 > 52.223.243.57.1935: Flags [.], seq 59112:60426, ack 1, win 501, options [nop,nop,TS val 2213180985 ecr 3334210016], length 1314
00:18:12.093848 IP 10.8.0.8.55214 > 52.223.243.57.1935: Flags [.], seq 60426:61740, ack 1, win 501, options [nop,nop,TS val 2213181019 ecr 3334210016], length 1314
00:18:12.131045 IP 52.223.243.57.1935 > 10.8.0.8.55214: Flags [.], ack 56273, win 126, options [nop,nop,TS val 3334210112 ecr 2213180796], length 0
00:18:12.160488 IP 10.8.0.8.55214 > 52.223.243.57.1935: Flags [.], seq 61740:63054, ack 1, win 501, options [nop,nop,TS val 2213181085 ecr 3334210112], length 1314
00:18:12.164970 IP 52.223.243.57.1935 > 10.8.0.8.55214: Flags [.], ack 57798, win 126, options [nop,nop,TS val 3334210146 ecr 2213180881], length 0
00:18:12.164998 IP 10.8.0.8.55214 > 52.223.243.57.1935: Flags [P.], seq 63054:63827, ack 1, win 501, options [nop,nop,TS val 2213181090 ecr 3334210146], length 773
00:18:12.227208 IP 10.8.0.8.55214 > 52.223.243.57.1935: Flags [.], seq 63827:65141, ack 1, win 501, options [nop,nop,TS val 2213181152 ecr 3334210146], length 1314
00:18:12.256859 IP 10.8.0.8.55214 > 52.223.243.57.1935: Flags [.], seq 65141:66455, ack 1, win 501, options [nop,nop,TS val 2213181182 ecr 3334210146], length 1314
00:18:12.267862 IP 52.223.243.57.1935 > 10.8.0.8.55214: Flags [.], ack 60426, win 126, options [nop,nop,TS val 3334210249 ecr 2213180945], length 0
00:18:12.292262 IP 10.8.0.8.55214 > 52.223.243.57.1935: Flags [.], seq 66455:67769, ack 1, win 501, options [nop,nop,TS val 2213181217 ecr 3334210249], length 1314
00:18:12.357496 IP 10.8.0.8.55214 > 52.223.243.57.1935: Flags [.], seq 67769:69083, ack 1, win 501, options [nop,nop,TS val 2213181282 ecr 3334210249], length 1314
00:18:12.367772 IP 52.223.243.57.1935 > 10.8.0.8.55214: Flags [.], ack 63054, win 126, options [nop,nop,TS val 3334210349 ecr 2213181019], length 0
00:18:12.372007 IP 52.223.243.57.1935 > 10.8.0.8.55214: Flags [.], ack 63827, win 126, options [nop,nop,TS val 3334210354 ecr 2213181090], length 0
00:18:12.372015 IP 10.8.0.8.55214 > 52.223.243.57.1935: Flags [P.], seq 69083:69864, ack 1, win 501, options [nop,nop,TS val 2213181297 ecr 3334210354], length 781
00:18:12.424817 IP 10.8.0.8.55214 > 52.223.243.57.1935: Flags [.], seq 69864:71178, ack 1, win 501, options [nop,nop,TS val 2213181350 ecr 3334210354], length 1314
00:18:12.459303 IP 10.8.0.8.55214 > 52.223.243.57.1935: Flags [.], seq 71178:72492, ack 1, win 501, options [nop,nop,TS val 2213181384 ecr 3334210354], length 1314
00:18:12.464199 IP 52.223.243.57.1935 > 10.8.0.8.55214: Flags [.], ack 66455, win 126, options [nop,nop,TS val 3334210446 ecr 2213181152], length 0
00:18:12.493936 IP 10.8.0.8.55214 > 52.223.243.57.1935: Flags [.], seq 72492:73806, ack 1, win 501, options [nop,nop,TS val 2213181419 ecr 3334210446], length 1314
00:18:12.556058 IP 10.8.0.8.55214 > 52.223.243.57.1935: Flags [.], seq 73806:75120, ack 1, win 501, options [nop,nop,TS val 2213181481 ecr 3334210446], length 1314
00:18:12.564932 IP 52.223.243.57.1935 > 10.8.0.8.55214: Flags [.], ack 69083, win 126, options [nop,nop,TS val 3334210546 ecr 2213181217], length 0
00:18:12.579075 IP 52.223.243.57.1935 > 10.8.0.8.55214: Flags [.], ack 69864, win 126, options [nop,nop,TS val 3334210560 ecr 2213181297], length 0
00:18:12.579109 IP 10.8.0.8.55214 > 52.223.243.57.1935: Flags [P.], seq 75120:75902, ack 1, win 501, options [nop,nop,TS val 2213181504 ecr 3334210560], length 782
00:18:12.627075 IP 10.8.0.8.55214 > 52.223.243.57.1935: Flags [.], seq 75902:77216, ack 1, win 501, options [nop,nop,TS val 2213181552 ecr 3334210560], length 1314
00:18:12.660497 IP 10.8.0.8.55214 > 52.223.243.57.1935: Flags [.], seq 77216:78530, ack 1, win 501, options [nop,nop,TS val 2213181585 ecr 3334210560], length 1314
00:18:12.666663 IP 52.223.243.57.1935 > 10.8.0.8.55214: Flags [.], ack 72492, win 126, options [nop,nop,TS val 3334210648 ecr 2213181350], length 0
00:18:12.706246 IP 10.8.0.8.55214 > 52.223.243.57.1935: Flags [.], seq 78530:79844, ack 1, win 501, options [nop,nop,TS val 2213181631 ecr 3334210648], length 1314
00:18:12.760476 IP 10.8.0.8.55214 > 52.223.243.57.1935: Flags [.], seq 79844:81158, ack 1, win 501, options [nop,nop,TS val 2213181685 ecr 3334210648], length 1314
00:18:12.763684 IP 52.223.243.57.1935 > 10.8.0.8.55214: Flags [.], ack 75120, win 126, options [nop,nop,TS val 3334210745 ecr 2213181419], length 0
00:18:12.786429 IP 52.223.243.57.1935 > 10.8.0.8.55214: Flags [.], ack 75902, win 126, options [nop,nop,TS val 3334210768 ecr 2213181504], length 0
00:18:12.786456 IP 10.8.0.8.55214 > 52.223.243.57.1935: Flags [P.], seq 81158:81832, ack 1, win 501, options [nop,nop,TS val 2213181711 ecr 3334210768], length 674
00:18:12.824443 IP 10.8.0.8.55214 > 52.223.243.57.1935: Flags [.], seq 81832:83146, ack 1, win 501, options [nop,nop,TS val 2213181749 ecr 3334210768], length 1314
00:18:12.855865 IP 10.8.0.8.55214 > 52.223.243.57.1935: Flags [.], seq 83146:84460, ack 1, win 501, options [nop,nop,TS val 2213181781 ecr 3334210768], length 1314
00:18:12.867872 IP 52.223.243.57.1935 > 10.8.0.8.55214: Flags [.], ack 78530, win 126, options [nop,nop,TS val 3334210849 ecr 2213181552], length 0
00:18:12.898688 IP 10.8.0.8.55214 > 52.223.243.57.1935: Flags [.], seq 84460:85774, ack 1, win 501, options [nop,nop,TS val 2213181824 ecr 3334210849], length 1314
00:18:12.959134 IP 10.8.0.8.55214 > 52.223.243.57.1935: Flags [.], seq 85774:87088, ack 1, win 501, options [nop,nop,TS val 2213181884 ecr 3334210849], length 1314
00:18:12.968230 IP 52.223.243.57.1935 > 10.8.0.8.55214: Flags [.], ack 81158, win 126, options [nop,nop,TS val 3334210949 ecr 2213181631], length 0
00:18:12.992616 IP 10.8.0.8.55214 > 52.223.243.57.1935: Flags [.], seq 87088:88402, ack 1, win 501, options [nop,nop,TS val 2213181917 ecr 3334210949], length 1314
00:18:12.993855 IP 52.223.243.57.1935 > 10.8.0.8.55214: Flags [.], ack 81832, win 126, options [nop,nop,TS val 3334210975 ecr 2213181711], length 0
00:18:12.993884 IP 10.8.0.8.55214 > 52.223.243.57.1935: Flags [P.], seq 88402:88709, ack 1, win 501, options [nop,nop,TS val 2213181919 ecr 3334210975], length 307
00:18:13.060008 IP 10.8.0.8.55214 > 52.223.243.57.1935: Flags [.], seq 88709:90023, ack 1, win 501, options [nop,nop,TS val 2213181985 ecr 3334210975], length 1314
00:18:13.063168 IP 52.223.243.57.1935 > 10.8.0.8.55214: Flags [.], ack 84460, win 126, options [nop,nop,TS val 3334211045 ecr 2213181749], length 0
00:18:13.091891 IP 10.8.0.8.55214 > 52.223.243.57.1935: Flags [.], seq 90023:91337, ack 1, win 501, options [nop,nop,TS val 2213182017 ecr 3334211045], length 1314
00:18:13.126449 IP 10.8.0.8.55214 > 52.223.243.57.1935: Flags [.], seq 91337:92651, ack 1, win 501, options [nop,nop,TS val 2213182051 ecr 3334211045], length 1314
00:18:13.166438 IP 52.223.243.57.1935 > 10.8.0.8.55214: Flags [.], ack 87088, win 126, options [nop,nop,TS val 3334211148 ecr 2213181824], length 0
00:18:13.192224 IP 10.8.0.8.55214 > 52.223.243.57.1935: Flags [.], seq 92651:93965, ack 1, win 501, options [nop,nop,TS val 2213182117 ecr 3334211148], length 1314
00:18:13.201037 IP 52.223.243.57.1935 > 10.8.0.8.55214: Flags [.], ack 88709, win 126, options [nop,nop,TS val 3334211182 ecr 2213181917], length 0
00:18:13.201063 IP 10.8.0.8.55214 > 52.223.243.57.1935: Flags [P.], seq 93965:94746, ack 1, win 501, options [nop,nop,TS val 2213182126 ecr 3334211182], length 781
00:18:13.258711 IP 10.8.0.8.55214 > 52.223.243.57.1935: Flags [.], seq 94746:96060, ack 1, win 501, options [nop,nop,TS val 2213182184 ecr 3334211182], length 1314
00:18:13.293544 IP 10.8.0.8.55214 > 52.223.243.57.1935: Flags [.], seq 96060:97374, ack 1, win 501, options [nop,nop,TS val 2213182218 ecr 3334211182], length 1314
00:18:13.299037 IP 52.223.243.57.1935 > 10.8.0.8.55214: Flags [.], ack 91337, win 126, options [nop,nop,TS val 3334211281 ecr 2213181985], length 0
00:18:13.327537 IP 10.8.0.8.55214 > 52.223.243.57.1935: Flags [.], seq 97374:98688, ack 1, win 501, options [nop,nop,TS val 2213182252 ecr 3334211281], length 1314
00:18:13.391666 IP 10.8.0.8.55214 > 52.223.243.57.1935: Flags [.], seq 98688:100002, ack 1, win 501, options [nop,nop,TS val 2213182316 ecr 3334211281], length 1314
00:18:13.399641 IP 52.223.243.57.1935 > 10.8.0.8.55214: Flags [.], ack 93965, win 126, options [nop,nop,TS val 3334211381 ecr 2213182051], length 0
00:18:13.408409 IP 52.223.243.57.1935 > 10.8.0.8.55214: Flags [.], ack 94746, win 126, options [nop,nop,TS val 3334211390 ecr 2213182126], length 0
00:18:13.408434 IP 10.8.0.8.55214 > 52.223.243.57.1935: Flags [P.], seq 100002:100688, ack 1, win 501, options [nop,nop,TS val 2213182333 ecr 3334211390], length 686
00:18:13.459942 IP 10.8.0.8.55214 > 52.223.243.57.1935: Flags [.], seq 100688:102002, ack 1, win 501, options [nop,nop,TS val 2213182385 ecr 3334211390], length 1314
00:18:13.493459 IP 10.8.0.8.55214 > 52.223.243.57.1935: Flags [.], seq 102002:103316, ack 1, win 501, options [nop,nop,TS val 2213182418 ecr 3334211390], length 1314
00:18:13.501721 IP 52.223.243.57.1935 > 10.8.0.8.55214: Flags [.], ack 97374, win 126, options [nop,nop,TS val 3334211483 ecr 2213182184], length 0
00:18:13.526550 IP 10.8.0.8.55214 > 52.223.243.57.1935: Flags [.], seq 103316:104630, ack 1, win 501, options [nop,nop,TS val 2213182451 ecr 3334211483], length 1314
00:18:13.593303 IP 10.8.0.8.55214 > 52.223.243.57.1935: Flags [.], seq 104630:105944, ack 1, win 501, options [nop,nop,TS val 2213182518 ecr 3334211483], length 1314
00:18:13.599130 IP 52.223.243.57.1935 > 10.8.0.8.55214: Flags [.], ack 100002, win 126, options [nop,nop,TS val 3334211580 ecr 2213182252], length 0
00:18:13.615487 IP 52.223.243.57.1935 > 10.8.0.8.55214: Flags [.], ack 100688, win 126, options [nop,nop,TS val 3334211597 ecr 2213182333], length 0
00:18:13.615516 IP 10.8.0.8.55214 > 52.223.243.57.1935: Flags [P.], seq 105944:106714, ack 1, win 501, options [nop,nop,TS val 2213182540 ecr 3334211597], length 770
00:18:13.660190 IP 10.8.0.8.55214 > 52.223.243.57.1935: Flags [.], seq 106714:108028, ack 1, win 501, options [nop,nop,TS val 2213182585 ecr 3334211597], length 1314
00:18:13.691938 IP 10.8.0.8.55214 > 52.223.243.57.1935: Flags [.], seq 108028:109342, ack 1, win 501, options [nop,nop,TS val 2213182617 ecr 3334211597], length 1314
00:18:13.700626 IP 52.223.243.57.1935 > 10.8.0.8.55214: Flags [.], ack 103316, win 126, options [nop,nop,TS val 3334211682 ecr 2213182385], length 0
00:18:13.734500 IP 10.8.0.8.55214 > 52.223.243.57.1935: Flags [.], seq 109342:110656, ack 1, win 501, options [nop,nop,TS val 2213182659 ecr 3334211682], length 1314
00:18:13.791832 IP 10.8.0.8.55214 > 52.223.243.57.1935: Flags [.], seq 110656:111970, ack 1, win 501, options [nop,nop,TS val 2213182717 ecr 3334211682], length 1314
00:18:13.796591 IP 52.223.243.57.1935 > 10.8.0.8.55214: Flags [.], ack 104630, win 126, options [nop,nop,TS val 3334211778 ecr 2213182451], length 0
00:18:13.822656 IP 52.223.243.57.1935 > 10.8.0.8.55214: Flags [.], ack 106714, win 126, options [nop,nop,TS val 3334211804 ecr 2213182518], length 0
00:18:13.822684 IP 10.8.0.8.55214 > 52.223.243.57.1935: Flags [P.], seq 111970:112747, ack 1, win 501, options [nop,nop,TS val 2213182748 ecr 3334211804], length 777
00:18:13.856230 IP 10.8.0.8.55214 > 52.223.243.57.1935: Flags [.], seq 112747:114061, ack 1, win 501, options [nop,nop,TS val 2213182781 ecr 3334211804], length 1314
00:18:13.890780 IP 10.8.0.8.55214 > 52.223.243.57.1935: Flags [.], seq 114061:115375, ack 1, win 501, options [nop,nop,TS val 2213182816 ecr 3334211804], length 1314
00:18:13.899404 IP 52.223.243.57.1935 > 10.8.0.8.55214: Flags [.], ack 109342, win 126, options [nop,nop,TS val 3334211881 ecr 2213182585], length 0
00:18:13.947871 IP 10.8.0.8.55214 > 52.223.243.57.1935: Flags [.], seq 115375:116689, ack 1, win 501, options [nop,nop,TS val 2213182873 ecr 3334211881], length 1314
00:18:13.993805 IP 10.8.0.8.55214 > 52.223.243.57.1935: Flags [.], seq 116689:118003, ack 1, win 501, options [nop,nop,TS val 2213182919 ecr 3334211881], length 1314
00:18:14.000153 IP 52.223.243.57.1935 > 10.8.0.8.55214: Flags [.], ack 111970, win 126, options [nop,nop,TS val 3334211981 ecr 2213182659], length 0
00:18:14.024520 IP 10.8.0.8.55214 > 52.223.243.57.1935: Flags [.], seq 118003:119317, ack 1, win 501, options [nop,nop,TS val 2213182949 ecr 3334211981], length 1314
00:18:14.030007 IP 52.223.243.57.1935 > 10.8.0.8.55214: Flags [.], ack 112747, win 126, options [nop,nop,TS val 3334212011 ecr 2213182748], length 0
00:18:14.030024 IP 10.8.0.8.55214 > 52.223.243.57.1935: Flags [P.], seq 119317:119537, ack 1, win 501, options [nop,nop,TS val 2213182955 ecr 3334212011], length 220
00:18:14.093660 IP 10.8.0.8.55214 > 52.223.243.57.1935: Flags [.], seq 119537:120851, ack 1, win 501, options [nop,nop,TS val 2213183018 ecr 3334212011], length 1314
00:18:14.097827 IP 52.223.243.57.1935 > 10.8.0.8.55214: Flags [.], ack 115375, win 126, options [nop,nop,TS val 3334212079 ecr 2213182781], length 0
00:18:14.124422 IP 10.8.0.8.55214 > 52.223.243.57.1935: Flags [.], seq 120851:122165, ack 1, win 501, options [nop,nop,TS val 2213183049 ecr 3334212079], length 1314
00:18:14.157940 IP 10.8.0.8.55214 > 52.223.243.57.1935: Flags [.], seq 122165:123479, ack 1, win 501, options [nop,nop,TS val 2213183083 ecr 3334212079], length 1314
00:18:14.201284 IP 52.223.243.57.1935 > 10.8.0.8.55214: Flags [.], ack 118003, win 126, options [nop,nop,TS val 3334212183 ecr 2213182873], length 0
00:18:14.227251 IP 10.8.0.8.55214 > 52.223.243.57.1935: Flags [.], seq 123479:124793, ack 1, win 501, options [nop,nop,TS val 2213183152 ecr 3334212183], length 1314
00:18:14.258848 IP 10.8.0.8.55214 > 52.223.243.57.1935: Flags [.], seq 124793:126107, ack 1, win 501, options [nop,nop,TS val 2213183184 ecr 3334212183], length 1314
00:18:14.292731 IP 10.8.0.8.55214 > 52.223.243.57.1935: Flags [.], seq 126107:127421, ack 1, win 501, options [nop,nop,TS val 2213183218 ecr 3334212183], length 1314
00:18:14.331907 IP 52.223.243.57.1935 > 10.8.0.8.55214: Flags [.], ack 122165, win 126, options [nop,nop,TS val 3334212313 ecr 2213183018], length 0
00:18:14.331940 IP 10.8.0.8.55214 > 52.223.243.57.1935: Flags [P.], seq 127421:128490, ack 1, win 501, options [nop,nop,TS val 2213183257 ecr 3334212313], length 1069
00:18:14.389594 IP 10.8.0.8.55214 > 52.223.243.57.1935: Flags [.], seq 128490:129804, ack 1, win 501, options [nop,nop,TS val 2213183314 ecr 3334212313], length 1314
00:18:14.423064 IP 10.8.0.8.55214 > 52.223.243.57.1935: Flags [.], seq 129804:131118, ack 1, win 501, options [nop,nop,TS val 2213183348 ecr 3334212313], length 1314
00:18:14.432463 IP 52.223.243.57.1935 > 10.8.0.8.55214: Flags [.], ack 123479, win 126, options [nop,nop,TS val 3334212414 ecr 2213183083], length 0
00:18:14.458780 IP 10.8.0.8.55214 > 52.223.243.57.1935: Flags [.], seq 131118:132432, ack 1, win 501, options [nop,nop,TS val 2213183384 ecr 3334212414], length 1314
00:18:14.466270 IP 52.223.243.57.1935 > 10.8.0.8.55214: Flags [.], ack 126107, win 126, options [nop,nop,TS val 3334212448 ecr 2213183152], length 0
00:18:14.527316 IP 10.8.0.8.55214 > 52.223.243.57.1935: Flags [.], seq 132432:133746, ack 1, win 501, options [nop,nop,TS val 2213183452 ecr 3334212448], length 1314
00:18:14.539266 IP 52.223.243.57.1935 > 10.8.0.8.55214: Flags [.], ack 128490, win 126, options [nop,nop,TS val 3334212521 ecr 2213183218], length 0
00:18:14.539301 IP 10.8.0.8.55214 > 52.223.243.57.1935: Flags [P.], seq 133746:134515, ack 1, win 501, options [nop,nop,TS val 2213183464 ecr 3334212521], length 769
00:18:14.593797 IP 10.8.0.8.55214 > 52.223.243.57.1935: Flags [.], seq 134515:135829, ack 1, win 501, options [nop,nop,TS val 2213183519 ecr 3334212521], length 1314
00:18:14.627050 IP 10.8.0.8.55214 > 52.223.243.57.1935: Flags [.], seq 135829:137143, ack 1, win 501, options [nop,nop,TS val 2213183552 ecr 3334212521], length 1314
00:18:14.630473 IP 52.223.243.57.1935 > 10.8.0.8.55214: Flags [.], ack 131118, win 126, options [nop,nop,TS val 3334212612 ecr 2213183314], length 0
00:18:14.660789 IP 10.8.0.8.55214 > 52.223.243.57.1935: Flags [.], seq 137143:138457, ack 1, win 501, options [nop,nop,TS val 2213183586 ecr 3334212612], length 1314
00:18:14.724052 IP 10.8.0.8.55214 > 52.223.243.57.1935: Flags [.], seq 138457:139771, ack 1, win 501, options [nop,nop,TS val 2213183649 ecr 3334212612], length 1314
00:18:14.734833 IP 52.223.243.57.1935 > 10.8.0.8.55214: Flags [.], ack 133746, win 126, options [nop,nop,TS val 3334212716 ecr 2213183384], length 0
00:18:14.746408 IP 52.223.243.57.1935 > 10.8.0.8.55214: Flags [.], ack 134515, win 126, options [nop,nop,TS val 3334212728 ecr 2213183464], length 0
00:18:14.746422 IP 10.8.0.8.55214 > 52.223.243.57.1935: Flags [P.], seq 139771:140552, ack 1, win 501, options [nop,nop,TS val 2213183671 ecr 3334212728], length 781
00:18:14.789600 IP 10.8.0.8.55214 > 52.223.243.57.1935: Flags [.], seq 140552:141866, ack 1, win 501, options [nop,nop,TS val 2213183714 ecr 3334212728], length 1314
00:18:14.824648 IP 10.8.0.8.55214 > 52.223.243.57.1935: Flags [.], seq 141866:143180, ack 1, win 501, options [nop,nop,TS val 2213183749 ecr 3334212728], length 1314
00:18:14.834447 IP 52.223.243.57.1935 > 10.8.0.8.55214: Flags [.], ack 137143, win 126, options [nop,nop,TS val 3334212816 ecr 2213183519], length 0
00:18:14.867421 IP 10.8.0.8.55214 > 52.223.243.57.1935: Flags [.], seq 143180:144494, ack 1, win 501, options [nop,nop,TS val 2213183792 ecr 3334212816], length 1314
00:18:14.925641 IP 10.8.0.8.55214 > 52.223.243.57.1935: Flags [.], seq 144494:145808, ack 1, win 501, options [nop,nop,TS val 2213183850 ecr 3334212816], length 1314
00:18:14.931219 IP 52.223.243.57.1935 > 10.8.0.8.55214: Flags [.], ack 139771, win 126, options [nop,nop,TS val 3334212913 ecr 2213183586], length 0
00:18:14.953442 IP 52.223.243.57.1935 > 10.8.0.8.55214: Flags [.], ack 140552, win 126, options [nop,nop,TS val 3334212935 ecr 2213183671], length 0
00:18:14.953466 IP 10.8.0.8.55214 > 52.223.243.57.1935: Flags [P.], seq 145808:146591, ack 1, win 501, options [nop,nop,TS val 2213183878 ecr 3334212935], length 783
00:18:14.992770 IP 10.8.0.8.55214 > 52.223.243.57.1935: Flags [.], seq 146591:147905, ack 1, win 501, options [nop,nop,TS val 2213183918 ecr 3334212935], length 1314
00:18:15.026629 IP 10.8.0.8.55214 > 52.223.243.57.1935: Flags [.], seq 147905:149219, ack 1, win 501, options [nop,nop,TS val 2213183951 ecr 3334212935], length 1314
00:18:15.032037 IP 52.223.243.57.1935 > 10.8.0.8.55214: Flags [.], ack 143180, win 126, options [nop,nop,TS val 3334213013 ecr 2213183714], length 0
00:18:15.080723 IP 10.8.0.8.55214 > 52.223.243.57.1935: Flags [.], seq 149219:150533, ack 1, win 501, options [nop,nop,TS val 2213184006 ecr 3334213013], length 1314
00:18:15.125008 IP 10.8.0.8.55214 > 52.223.243.57.1935: Flags [.], seq 150533:151847, ack 1, win 501, options [nop,nop,TS val 2213184050 ecr 3334213013], length 1314
00:18:15.132926 IP 52.223.243.57.1935 > 10.8.0.8.55214: Flags [.], ack 145808, win 126, options [nop,nop,TS val 3334213114 ecr 2213183792], length 0
00:18:15.160557 IP 52.223.243.57.1935 > 10.8.0.8.55214: Flags [.], ack 146591, win 126, options [nop,nop,TS val 3334213142 ecr 2213183878], length 0
00:18:15.160606 IP 10.8.0.8.55214 > 52.223.243.57.1935: Flags [P.], seq 151847:152525, ack 1, win 501, options [nop,nop,TS val 2213184085 ecr 3334213142], length 678
00:18:15.193976 IP 10.8.0.8.55214 > 52.223.243.57.1935: Flags [.], seq 152525:153839, ack 1, win 501, options [nop,nop,TS val 2213184119 ecr 3334213142], length 1314
00:18:15.227253 IP 10.8.0.8.55214 > 52.223.243.57.1935: Flags [.], seq 153839:155153, ack 1, win 501, options [nop,nop,TS val 2213184152 ecr 3334213142], length 1314
00:18:15.233970 IP 52.223.243.57.1935 > 10.8.0.8.55214: Flags [.], ack 149219, win 126, options [nop,nop,TS val 3334213215 ecr 2213183918], length 0
00:18:15.273569 IP 10.8.0.8.55214 > 52.223.243.57.1935: Flags [.], seq 155153:156467, ack 1, win 501, options [nop,nop,TS val 2213184198 ecr 3334213215], length 1314
00:18:15.327239 IP 10.8.0.8.55214 > 52.223.243.57.1935: Flags [.], seq 156467:157781, ack 1, win 501, options [nop,nop,TS val 2213184252 ecr 3334213215], length 1314
00:18:15.332235 IP 52.223.243.57.1935 > 10.8.0.8.55214: Flags [.], ack 151847, win 126, options [nop,nop,TS val 3334213314 ecr 2213184006], length 0
00:18:15.360746 IP 10.8.0.8.55214 > 52.223.243.57.1935: Flags [.], seq 157781:159095, ack 1, win 501, options [nop,nop,TS val 2213184286 ecr 3334213314], length 1314
00:18:15.367889 IP 52.223.243.57.1935 > 10.8.0.8.55214: Flags [.], ack 152525, win 126, options [nop,nop,TS val 3334213349 ecr 2213184085], length 0
00:18:15.367922 IP 10.8.0.8.55214 > 52.223.243.57.1935: Flags [P.], seq 159095:159401, ack 1, win 501, options [nop,nop,TS val 2213184293 ecr 3334213349], length 306
00:18:15.425581 IP 10.8.0.8.55214 > 52.223.243.57.1935: Flags [.], seq 159401:160715, ack 1, win 501, options [nop,nop,TS val 2213184350 ecr 3334213349], length 1314
00:18:15.434636 IP 52.223.243.57.1935 > 10.8.0.8.55214: Flags [.], ack 155153, win 126, options [nop,nop,TS val 3334213416 ecr 2213184119], length 0
00:18:15.456209 IP 10.8.0.8.55214 > 52.223.243.57.1935: Flags [.], seq 160715:162029, ack 1, win 501, options [nop,nop,TS val 2213184381 ecr 3334213416], length 1314
00:18:15.490116 IP 10.8.0.8.55214 > 52.223.243.57.1935: Flags [.], seq 162029:163343, ack 1, win 501, options [nop,nop,TS val 2213184415 ecr 3334213416], length 1314
00:18:15.534701 IP 52.223.243.57.1935 > 10.8.0.8.55214: Flags [.], ack 157781, win 126, options [nop,nop,TS val 3334213516 ecr 2213184198], length 0
00:18:15.560204 IP 10.8.0.8.55214 > 52.223.243.57.1935: Flags [.], seq 163343:164657, ack 1, win 501, options [nop,nop,TS val 2213184485 ecr 3334213516], length 1314
00:18:15.575302 IP 52.223.243.57.1935 > 10.8.0.8.55214: Flags [.], ack 159401, win 126, options [nop,nop,TS val 3334213557 ecr 2213184286], length 0
00:18:15.575341 IP 10.8.0.8.55214 > 52.223.243.57.1935: Flags [P.], seq 164657:165438, ack 1, win 501, options [nop,nop,TS val 2213184500 ecr 3334213557], length 781
00:18:15.624666 IP 10.8.0.8.55214 > 52.223.243.57.1935: Flags [.], seq 165438:166752, ack 1, win 501, options [nop,nop,TS val 2213184549 ecr 3334213557], length 1314
00:18:15.660461 IP 10.8.0.8.55214 > 52.223.243.57.1935: Flags [.], seq 166752:168066, ack 1, win 501, options [nop,nop,TS val 2213184585 ecr 3334213557], length 1314
00:18:15.663594 IP 52.223.243.57.1935 > 10.8.0.8.55214: Flags [.], ack 162029, win 126, options [nop,nop,TS val 3334213645 ecr 2213184350], length 0
00:18:15.701876 IP 10.8.0.8.55214 > 52.223.243.57.1935: Flags [.], seq 168066:169380, ack 1, win 501, options [nop,nop,TS val 2213184627 ecr 3334213645], length 1314
00:18:15.760437 IP 10.8.0.8.55214 > 52.223.243.57.1935: Flags [.], seq 169380:170694, ack 1, win 501, options [nop,nop,TS val 2213184685 ecr 3334213645], length 1314
00:18:15.764703 IP 52.223.243.57.1935 > 10.8.0.8.55214: Flags [.], ack 163343, win 126, options [nop,nop,TS val 3334213746 ecr 2213184415], length 0
00:18:15.782651 IP 52.223.243.57.1935 > 10.8.0.8.55214: Flags [.], ack 165438, win 126, options [nop,nop,TS val 3334213764 ecr 2213184485], length 0
00:18:15.782666 IP 10.8.0.8.55214 > 52.223.243.57.1935: Flags [P.], seq 170694:171380, ack 1, win 501, options [nop,nop,TS val 2213184708 ecr 3334213764], length 686
00:18:15.830308 IP 10.8.0.8.55214 > 52.223.243.57.1935: Flags [.], seq 171380:172694, ack 1, win 501, options [nop,nop,TS val 2213184755 ecr 3334213764], length 1314
00:18:15.860507 IP 10.8.0.8.55214 > 52.223.243.57.1935: Flags [.], seq 172694:174008, ack 1, win 501, options [nop,nop,TS val 2213184785 ecr 3334213764], length 1314
00:18:15.867896 IP 52.223.243.57.1935 > 10.8.0.8.55214: Flags [.], ack 168066, win 126, options [nop,nop,TS val 3334213849 ecr 2213184549], length 0
00:18:15.894556 IP 10.8.0.8.55214 > 52.223.243.57.1935: Flags [.], seq 174008:175322, ack 1, win 501, options [nop,nop,TS val 2213184819 ecr 3334213849], length 1314
00:18:15.958335 IP 10.8.0.8.55214 > 52.223.243.57.1935: Flags [.], seq 175322:176636, ack 1, win 501, options [nop,nop,TS val 2213184883 ecr 3334213849], length 1314
00:18:15.967764 IP 52.223.243.57.1935 > 10.8.0.8.55214: Flags [.], ack 170694, win 126, options [nop,nop,TS val 3334213949 ecr 2213184627], length 0
00:18:15.989808 IP 52.223.243.57.1935 > 10.8.0.8.55214: Flags [.], ack 171380, win 126, options [nop,nop,TS val 3334213971 ecr 2213184708], length 0
00:18:15.989814 IP 10.8.0.8.55214 > 52.223.243.57.1935: Flags [.], seq 176636:177950, ack 1, win 501, options [nop,nop,TS val 2213184915 ecr 3334213949], length 1314
00:18:15.989823 IP 10.8.0.8.55214 > 52.223.243.57.1935: Flags [P.], seq 177950:178253, ack 1, win 501, options [nop,nop,TS val 2213184915 ecr 3334213971], length 303
00:18:16.060468 IP 10.8.0.8.55214 > 52.223.243.57.1935: Flags [.], seq 178253:179567, ack 1, win 501, options [nop,nop,TS val 2213184985 ecr 3334213971], length 1314
00:18:16.067697 IP 52.223.243.57.1935 > 10.8.0.8.55214: Flags [.], ack 174008, win 126, options [nop,nop,TS val 3334214049 ecr 2213184755], length 0
00:18:16.094059 IP 10.8.0.8.55214 > 52.223.243.57.1935: Flags [.], seq 179567:180881, ack 1, win 501, options [nop,nop,TS val 2213185019 ecr 3334214049], length 1314
00:18:16.129385 IP 10.8.0.8.55214 > 52.223.243.57.1935: Flags [.], seq 180881:182195, ack 1, win 501, options [nop,nop,TS val 2213185054 ecr 3334214049], length 1314
00:18:16.165668 IP 52.223.243.57.1935 > 10.8.0.8.55214: Flags [.], ack 176636, win 126, options [nop,nop,TS val 3334214147 ecr 2213184819], length 0
00:18:16.193126 IP 10.8.0.8.55214 > 52.223.243.57.1935: Flags [.], seq 182195:183509, ack 1, win 501, options [nop,nop,TS val 2213185118 ecr 3334214147], length 1314
00:18:16.197170 IP 52.223.243.57.1935 > 10.8.0.8.55214: Flags [.], ack 178253, win 126, options [nop,nop,TS val 3334214179 ecr 2213184915], length 0
00:18:16.197187 IP 10.8.0.8.55214 > 52.223.243.57.1935: Flags [P.], seq 183509:184282, ack 1, win 501, options [nop,nop,TS val 2213185122 ecr 3334214179], length 773
00:18:16.258758 IP 10.8.0.8.55214 > 52.223.243.57.1935: Flags [.], seq 184282:185596, ack 1, win 501, options [nop,nop,TS val 2213185184 ecr 3334214179], length 1314
00:18:16.293710 IP 10.8.0.8.55214 > 52.223.243.57.1935: Flags [.], seq 185596:186910, ack 1, win 501, options [nop,nop,TS val 2213185219 ecr 3334214179], length 1314
00:18:16.301782 IP 52.223.243.57.1935 > 10.8.0.8.55214: Flags [.], ack 180881, win 126, options [nop,nop,TS val 3334214283 ecr 2213184985], length 0
00:18:16.326725 IP 10.8.0.8.55214 > 52.223.243.57.1935: Flags [.], seq 186910:188224, ack 1, win 501, options [nop,nop,TS val 2213185252 ecr 3334214283], length 1314
00:18:16.389616 IP 10.8.0.8.55214 > 52.223.243.57.1935: Flags [.], seq 188224:189538, ack 1, win 501, options [nop,nop,TS val 2213185314 ecr 3334214283], length 1314
00:18:16.400598 IP 52.223.243.57.1935 > 10.8.0.8.55214: Flags [.], ack 183509, win 126, options [nop,nop,TS val 3334214382 ecr 2213185054], length 0
00:18:16.404627 IP 52.223.243.57.1935 > 10.8.0.8.55214: Flags [.], ack 184282, win 126, options [nop,nop,TS val 3334214386 ecr 2213185122], length 0
00:18:16.404637 IP 10.8.0.8.55214 > 52.223.243.57.1935: Flags [P.], seq 189538:190224, ack 1, win 501, options [nop,nop,TS val 2213185329 ecr 3334214386], length 686
