09:14:01.620280 IP 10.8.3.3.57480 > 185.42.206.39.1935: Flags [.], seq 1804028502:1804029816, ack 2794971412, win 501, options [nop,nop,TS val 2458865987 ecr 2107073383], length 1314
09:14:01.663029 IP 10.8.3.3.57480 > 185.42.206.39.1935: Flags [.], seq 1314:2628, ack 1, win 501, options [nop,nop,TS val 2458866029 ecr 2107073383], length 1314
09:14:01.668628 IP 185.42.206.39.1935 > 10.8.3.3.57480: Flags [.], ack 4294961915, win 126, options [nop,nop,TS val 2107073452 ecr 2458865724], length 0
09:14:01.701522 IP 185.42.206.39.1935 > 10.8.3.3.57480: Flags [.], ack 4294962040, win 126, options [nop,nop,TS val 2107073485 ecr 2458865789], length 0
09:14:01.701567 IP 10.8.3.3.57480 > 185.42.206.39.1935: Flags [P.], seq 2628:3602, ack 1, win 501, options [nop,nop,TS val 2458866068 ecr 2107073485], length 974
09:14:01.748606 IP 10.8.3.3.57480 > 185.42.206.39.1935: Flags [.], seq 3602:4916, ack 1, win 501, options [nop,nop,TS val 2458866115 ecr 2107073485], length 1314
09:14:01.770572 IP 185.42.206.39.1935 > 10.8.3.3.57480: Flags [.], ack 4294964668, win 126, options [nop,nop,TS val 2107073554 ecr 2458865815], length 0
09:14:01.790769 IP 10.8.3.3.57480 > 185.42.206.39.1935: Flags [.], seq 4916:6230, ack 1, win 501, options [nop,nop,TS val 2458866157 ecr 2107073554], length 1314
09:14:01.823755 IP 10.8.3.3.57480 > 185.42.206.39.1935: Flags [.], seq 6230:7544, ack 1, win 501, options [nop,nop,TS val 2458866190 ecr 2107073554], length 1314
09:14:01.869832 IP 185.42.206.39.1935 > 10.8.3.3.57480: Flags [.], ack 0, win 126, options [nop,nop,TS val 2107073654 ecr 2458865901], length 0
09:14:01.886443 IP 10.8.3.3.57480 > 185.42.206.39.1935: Flags [.], seq 7544:8858, ack 1, win 501, options [nop,nop,TS val 2458866253 ecr 2107073654], length 1314
09:14:01.919897 IP 10.8.3.3.57480 > 185.42.206.39.1935: Flags [.], seq 8858:10172, ack 1, win 501, options [nop,nop,TS val 2458866286 ecr 2107073654], length 1314
09:14:01.942528 IP 185.42.206.39.1935 > 10.8.3.3.57480: Flags [.], ack 2628, win 126, options [nop,nop,TS val 2107073726 ecr 2458865987], length 0
09:14:01.957357 IP 10.8.3.3.57480 > 185.42.206.39.1935: Flags [.], seq 10172:11486, ack 1, win 501, options [nop,nop,TS val 2458866324 ecr 2107073726], length 1314
09:14:01.981128 IP 185.42.206.39.1935 > 10.8.3.3.57480: Flags [.], ack 3602, win 126, options [nop,nop,TS val 2107073765 ecr 2458866068], length 0
09:14:01.981163 IP 10.8.3.3.57480 > 185.42.206.39.1935: Flags [P.], seq 11486:11620, ack 1, win 501, options [nop,nop,TS val 2458866347 ecr 2107073765], length 134
09:14:02.023948 IP 10.8.3.3.57480 > 185.42.206.39.1935: Flags [.], seq 11620:12934, ack 1, win 501, options [nop,nop,TS val 2458866390 ecr 2107073765], length 1314
09:14:02.048399 IP 10.8.3.3.57480 > 185.42.206.39.1935: Flags [.], seq 12934:14248, ack 1, win 501, options [nop,nop,TS val 2458866415 ecr 2107073765], length 1314
09:14:02.070812 IP 185.42.206.39.1935 > 10.8.3.3.57480: Flags [.], ack 6230, win 126, options [nop,nop,TS val 2107073854 ecr 2458866115], length 0
09:14:02.091117 IP 10.8.3.3.57480 > 185.42.206.39.1935: Flags [.], seq 14248:15562, ack 1, win 501, options [nop,nop,TS val 2458866457 ecr 2107073854], length 1314
09:14:02.153429 IP 10.8.3.3.57480 > 185.42.206.39.1935: Flags [.], seq 15562:16876, ack 1, win 501, options [nop,nop,TS val 2458866520 ecr 2107073854], length 1314
09:14:02.165806 IP 185.42.206.39.1935 > 10.8.3.3.57480: Flags [.], ack 8858, win 126, options [nop,nop,TS val 2107073950 ecr 2458866190], length 0
09:14:02.188194 IP 10.8.3.3.57480 > 185.42.206.39.1935: Flags [.], seq 16876:18190, ack 1, win 501, options [nop,nop,TS val 2458866554 ecr 2107073950], length 1314
09:14:02.223428 IP 10.8.3.3.57480 > 185.42.206.39.1935: Flags [.], seq 18190:19504, ack 1, win 501, options [nop,nop,TS val 2458866590 ecr 2107073950], length 1314
09:14:02.236794 IP 185.42.206.39.1935 > 10.8.3.3.57480: Flags [.], ack 11486, win 126, options [nop,nop,TS val 2107074020 ecr 2458866286], length 0
09:14:02.260562 IP 185.42.206.39.1935 > 10.8.3.3.57480: Flags [.], ack 11620, win 126, options [nop,nop,TS val 2107074044 ecr 2458866347], length 0
09:14:02.260578 IP 10.8.3.3.57480 > 185.42.206.39.1935: Flags [P.], seq 19504:20473, ack 1, win 501, options [nop,nop,TS val 2458866627 ecr 2107074044], length 969
09:14:02.321303 IP 10.8.3.3.57480 > 185.42.206.39.1935: Flags [.], seq 20473:21787, ack 1, win 501, options [nop,nop,TS val 2458866688 ecr 2107074044], length 1314
09:14:02.328152 IP 185.42.206.39.1935 > 10.8.3.3.57480: Flags [.], ack 14248, win 126, options [nop,nop,TS val 2107074112 ecr 2458866390], length 0
09:14:02.345919 IP 10.8.3.3.57480 > 185.42.206.39.1935: Flags [.], seq 21787:23101, ack 1, win 501, options [nop,nop,TS val 2458866712 ecr 2107074112], length 1314
09:14:02.389078 IP 10.8.3.3.57480 > 185.42.206.39.1935: Flags [.], seq 23101:24415, ack 1, win 501, options [nop,nop,TS val 2458866755 ecr 2107074112], length 1314
09:14:02.433599 IP 185.42.206.39.1935 > 10.8.3.3.57480: Flags [.], ack 16876, win 126, options [nop,nop,TS val 2107074217 ecr 2458866457], length 0
09:14:02.453665 IP 10.8.3.3.57480 > 185.42.206.39.1935: Flags [.], seq 24415:25729, ack 1, win 501, options [nop,nop,TS val 2458866820 ecr 2107074217], length 1314
09:14:02.490600 IP 10.8.3.3.57480 > 185.42.206.39.1935: Flags [.], seq 25729:27043, ack 1, win 501, options [nop,nop,TS val 2458866857 ecr 2107074217], length 1314
09:14:02.502941 IP 185.42.206.39.1935 > 10.8.3.3.57480: Flags [.], ack 19504, win 126, options [nop,nop,TS val 2107074286 ecr 2458866554], length 0
09:14:02.518295 IP 10.8.3.3.57480 > 185.42.206.39.1935: Flags [.], seq 27043:28357, ack 1, win 501, options [nop,nop,TS val 2458866885 ecr 2107074286], length 1314
09:14:02.540333 IP 185.42.206.39.1935 > 10.8.3.3.57480: Flags [.], ack 20473, win 126, options [nop,nop,TS val 2107074324 ecr 2458866627], length 0
09:14:02.540370 IP 10.8.3.3.57480 > 185.42.206.39.1935: Flags [P.], seq 28357:28580, ack 1, win 501, options [nop,nop,TS val 2458866907 ecr 2107074324], length 223
09:14:02.582437 IP 10.8.3.3.57480 > 185.42.206.39.1935: Flags [.], seq 28580:29894, ack 1, win 501, options [nop,nop,TS val 2458866949 ecr 2107074324], length 1314
09:14:02.623393 IP 10.8.3.3.57480 > 185.42.206.39.1935: Flags [.], seq 29894:31208, ack 1, win 501, options [nop,nop,TS val 2458866990 ecr 2107074324], length 1314
09:14:02.625649 IP 185.42.206.39.1935 > 10.8.3.3.57480: Flags [.], ack 23101, win 126, options [nop,nop,TS val 2107074409 ecr 2458866688], length 0
09:14:02.668115 IP 10.8.3.3.57480 > 185.42.206.39.1935: Flags [.], seq 31208:32522, ack 1, win 501, options [nop,nop,TS val 2458867034 ecr 2107074409], length 1314
09:14:02.723085 IP 10.8.3.3.57480 > 185.42.206.39.1935: Flags [.], seq 32522:33836, ack 1, win 501, options [nop,nop,TS val 2458867089 ecr 2107074409], length 1314
09:14:02.733208 IP 185.42.206.39.1935 > 10.8.3.3.57480: Flags [.], ack 25729, win 126, options [nop,nop,TS val 2107074517 ecr 2458866755], length 0
09:14:02.753920 IP 10.8.3.3.57480 > 185.42.206.39.1935: Flags [.], seq 33836:35150, ack 1, win 501, options [nop,nop,TS val 2458867120 ecr 2107074517], length 1314
09:14:02.796678 IP 10.8.3.3.57480 > 185.42.206.39.1935: Flags [.], seq 35150:36464, ack 1, win 501, options [nop,nop,TS val 2458867163 ecr 2107074517], length 1314
09:14:02.797793 IP 185.42.206.39.1935 > 10.8.3.3.57480: Flags [.], ack 28357, win 126, options [nop,nop,TS val 2107074581 ecr 2458866857], length 0
09:14:02.819825 IP 185.42.206.39.1935 > 10.8.3.3.57480: Flags [.], ack 28580, win 126, options [nop,nop,TS val 2107074603 ecr 2458866907], length 0
09:14:02.819896 IP 10.8.3.3.57480 > 185.42.206.39.1935: Flags [P.], seq 36464:37350, ack 1, win 501, options [nop,nop,TS val 2458867186 ecr 2107074603], length 886
09:14:02.881910 IP 10.8.3.3.57480 > 185.42.206.39.1935: Flags [.], seq 37350:38664, ack 1, win 501, options [nop,nop,TS val 2458867248 ecr 2107074603], length 1314
09:14:02.903112 IP 185.42.206.39.1935 > 10.8.3.3.57480: Flags [.], ack 31208, win 126, options [nop,nop,TS val 2107074687 ecr 2458866949], length 0
09:14:02.924952 IP 10.8.3.3.57480 > 185.42.206.39.1935: Flags [.], seq 38664:39978, ack 1, win 501, options [nop,nop,TS val 2458867291 ecr 2107074687], length 1314
09:14:02.956399 IP 10.8.3.3.57480 > 185.42.206.39.1935: Flags [.], seq 39978:41292, ack 1, win 501, options [nop,nop,TS val 2458867323 ecr 2107074687], length 1314
09:14:03.002776 IP 185.42.206.39.1935 > 10.8.3.3.57480: Flags [.], ack 33836, win 126, options [nop,nop,TS val 2107074786 ecr 2458867034], length 0
09:14:03.022501 IP 10.8.3.3.57480 > 185.42.206.39.1935: Flags [.], seq 41292:42606, ack 1, win 501, options [nop,nop,TS val 2458867389 ecr 2107074786], length 1314
09:14:03.052866 IP 10.8.3.3.57480 > 185.42.206.39.1935: Flags [.], seq 42606:43920, ack 1, win 501, options [nop,nop,TS val 2458867419 ecr 2107074786], length 1314
09:14:03.076386 IP 185.42.206.39.1935 > 10.8.3.3.57480: Flags [.], ack 36464, win 126, options [nop,nop,TS val 2107074860 ecr 2458867120], length 0
09:14:03.088445 IP 10.8.3.3.57480 > 185.42.206.39.1935: Flags [.], seq 43920:45234, ack 1, win 501, options [nop,nop,TS val 2458867455 ecr 2107074860], length 1314
09:14:03.099435 IP 185.42.206.39.1935 > 10.8.3.3.57480: Flags [.], ack 37350, win 126, options [nop,nop,TS val 2107074883 ecr 2458867186], length 0
09:14:03.099447 IP 10.8.3.3.57480 > 185.42.206.39.1935: Flags [P.], seq 45234:45451, ack 1, win 501, options [nop,nop,TS val 2458867466 ecr 2107074883], length 217
09:14:03.155777 IP 10.8.3.3.57480 > 185.42.206.39.1935: Flags [.], seq 45451:46765, ack 1, win 501, options [nop,nop,TS val 2458867522 ecr 2107074883], length 1314
09:14:03.190978 IP 10.8.3.3.57480 > 185.42.206.39.1935: Flags [.], seq 46765:48079, ack 1, win 501, options [nop,nop,TS val 2458867557 ecr 2107074883], length 1314
09:14:03.204425 IP 185.42.206.39.1935 > 10.8.3.3.57480: Flags [.], ack 39978, win 126, options [nop,nop,TS val 2107074988 ecr 2458867248], length 0
09:14:03.223058 IP 10.8.3.3.57480 > 185.42.206.39.1935: Flags [.], seq 48079:49393, ack 1, win 501, options [nop,nop,TS val 2458867589 ecr 2107074988], length 1314
09:14:03.287043 IP 10.8.3.3.57480 > 185.42.206.39.1935: Flags [.], seq 49393:50707, ack 1, win 501, options [nop,nop,TS val 2458867653 ecr 2107074988], length 1314
09:14:03.303067 IP 185.42.206.39.1935 > 10.8.3.3.57480: Flags [.], ack 42606, win 126, options [nop,nop,TS val 2107075086 ecr 2458867323], length 0
09:14:03.323798 IP 10.8.3.3.57480 > 185.42.206.39.1935: Flags [.], seq 50707:52021, ack 1, win 501, options [nop,nop,TS val 2458867690 ecr 2107075086], length 1314
09:14:03.357458 IP 10.8.3.3.57480 > 185.42.206.39.1935: Flags [.], seq 52021:53335, ack 1, win 501, options [nop,nop,TS val 2458867724 ecr 2107075086], length 1314
09:14:03.368112 IP 185.42.206.39.1935 > 10.8.3.3.57480: Flags [.], ack 45234, win 126, options [nop,nop,TS val 2107075151 ecr 2458867419], length 0
09:14:03.378876 IP 185.42.206.39.1935 > 10.8.3.3.57480: Flags [.], ack 45451, win 126, options [nop,nop,TS val 2107075162 ecr 2458867466], length 0
09:14:03.378896 IP 10.8.3.3.57480 > 185.42.206.39.1935: Flags [P.], seq 53335:53465, ack 1, win 501, options [nop,nop,TS val 2458867745 ecr 2107075162], length 130
09:14:03.415202 IP 10.8.3.3.57480 > 185.42.206.39.1935: Flags [.], seq 53465:54779, ack 1, win 501, options [nop,nop,TS val 2458867782 ecr 2107075162], length 1314
09:14:03.458185 IP 10.8.3.3.57480 > 185.42.206.39.1935: Flags [.], seq 54779:56093, ack 1, win 501, options [nop,nop,TS val 2458867824 ecr 2107075162], length 1314
09:14:03.470908 IP 185.42.206.39.1935 > 10.8.3.3.57480: Flags [.], ack 48079, win 126, options [nop,nop,TS val 2107075255 ecr 2458867522], length 0
09:14:03.501041 IP 10.8.3.3.57480 > 185.42.206.39.1935: Flags [.], seq 56093:57407, ack 1, win 501, options [nop,nop,TS val 2458867867 ecr 2107075255], length 1314
09:14:03.556678 IP 10.8.3.3.57480 > 185.42.206.39.1935: Flags [.], seq 57407:58721, ack 1, win 501, options [nop,nop,TS val 2458867923 ecr 2107075255], length 1314
09:14:03.566583 IP 185.42.206.39.1935 > 10.8.3.3.57480: Flags [.], ack 50707, win 126, options [nop,nop,TS val 2107075350 ecr 2458867589], length 0
09:14:03.586731 IP 10.8.3.3.57480 > 185.42.206.39.1935: Flags [.], seq 58721:60035, ack 1, win 501, options [nop,nop,TS val 2458867953 ecr 2107075350], length 1314
09:14:03.629685 IP 10.8.3.3.57480 > 185.42.206.39.1935: Flags [.], seq 60035:61349, ack 1, win 501, options [nop,nop,TS val 2458867996 ecr 2107075350], length 1314
09:14:03.636958 IP 185.42.206.39.1935 > 10.8.3.3.57480: Flags [.], ack 53335, win 126, options [nop,nop,TS val 2107075421 ecr 2458867690], length 0
09:14:03.658277 IP 185.42.206.39.1935 > 10.8.3.3.57480: Flags [.], ack 53465, win 126, options [nop,nop,TS val 2107075442 ecr 2458867745], length 0
09:14:03.658302 IP 10.8.3.3.57480 > 185.42.206.39.1935: Flags [P.], seq 61349:62330, ack 1, win 501, options [nop,nop,TS val 2458868025 ecr 2107075442], length 981
09:14:03.724028 IP 10.8.3.3.57480 > 185.42.206.39.1935: Flags [.], seq 62330:63644, ack 1, win 501, options [nop,nop,TS val 2458868090 ecr 2107075442], length 1314
09:14:03.737929 IP 185.42.206.39.1935 > 10.8.3.3.57480: Flags [.], ack 56093, win 126, options [nop,nop,TS val 2107075521 ecr 2458867782], length 0
09:14:03.757239 IP 10.8.3.3.57480 > 185.42.206.39.1935: Flags [.], seq 63644:64958, ack 1, win 501, options [nop,nop,TS val 2458868124 ecr 2107075521], length 1314
09:14:03.791012 IP 10.8.3.3.57480 > 185.42.206.39.1935: Flags [.], seq 64958:66272, ack 1, win 501, options [nop,nop,TS val 2458868157 ecr 2107075521], length 1314
09:14:03.836353 IP 185.42.206.39.1935 > 10.8.3.3.57480: Flags [.], ack 58721, win 126, options [nop,nop,TS val 2107075620 ecr 2458867867], length 0
09:14:03.856126 IP 10.8.3.3.57480 > 185.42.206.39.1935: Flags [.], seq 66272:67586, ack 1, win 501, options [nop,nop,TS val 2458868222 ecr 2107075620], length 1314
09:14:03.886754 IP 10.8.3.3.57480 > 185.42.206.39.1935: Flags [.], seq 67586:68900, ack 1, win 501, options [nop,nop,TS val 2458868253 ecr 2107075620], length 1314
09:14:03.909478 IP 185.42.206.39.1935 > 10.8.3.3.57480: Flags [.], ack 61349, win 126, options [nop,nop,TS val 2107075693 ecr 2458867953], length 0
09:14:03.921852 IP 10.8.3.3.57480 > 185.42.206.39.1935: Flags [.], seq 68900:70214, ack 1, win 501, options [nop,nop,TS val 2458868288 ecr 2107075693], length 1314
09:14:03.937513 IP 185.42.206.39.1935 > 10.8.3.3.57480: Flags [.], ack 62330, win 126, options [nop,nop,TS val 2107075721 ecr 2458868025], length 0
09:14:03.937549 IP 10.8.3.3.57480 > 185.42.206.39.1935: Flags [P.], seq 70214:70333, ack 1, win 501, options [nop,nop,TS val 2458868304 ecr 2107075721], length 119
09:14:03.990989 IP 10.8.3.3.57480 > 185.42.206.39.1935: Flags [.], seq 70333:71647, ack 1, win 501, options [nop,nop,TS val 2458868357 ecr 2107075721], length 1314
09:14:04.023927 IP 10.8.3.3.57480 > 185.42.206.39.1935: Flags [.], seq 71647:72961, ack 1, win 501, options [nop,nop,TS val 2458868390 ecr 2107075721], length 1314
09:14:04.036696 IP 185.42.206.39.1935 > 10.8.3.3.57480: Flags [.], ack 64958, win 126, options [nop,nop,TS val 2107075820 ecr 2458868090], length 0
09:14:04.058518 IP 10.8.3.3.57480 > 185.42.206.39.1935: Flags [.], seq 72961:74275, ack 1, win 501, options [nop,nop,TS val 2458868425 ecr 2107075820], length 1314
09:14:04.122821 IP 10.8.3.3.57480 > 185.42.206.39.1935: Flags [.], seq 74275:75589, ack 1, win 501, options [nop,nop,TS val 2458868489 ecr 2107075820], length 1314
09:14:04.136168 IP 185.42.206.39.1935 > 10.8.3.3.57480: Flags [.], ack 67586, win 126, options [nop,nop,TS val 2107075919 ecr 2458868157], length 0
09:14:04.157317 IP 10.8.3.3.57480 > 185.42.206.39.1935: Flags [.], seq 75589:76903, ack 1, win 501, options [nop,nop,TS val 2458868524 ecr 2107075919], length 1314
09:14:04.188083 IP 10.8.3.3.57480 > 185.42.206.39.1935: Flags [.], seq 76903:78217, ack 1, win 501, options [nop,nop,TS val 2458868554 ecr 2107075919], length 1314
09:14:04.201508 IP 185.42.206.39.1935 > 10.8.3.3.57480: Flags [.], ack 70214, win 126, options [nop,nop,TS val 2107075985 ecr 2458868253], length 0
09:14:04.216700 IP 185.42.206.39.1935 > 10.8.3.3.57480: Flags [.], ack 70333, win 126, options [nop,nop,TS val 2107076000 ecr 2458868304], length 0
09:14:04.216723 IP 10.8.3.3.57480 > 185.42.206.39.1935: Flags [P.], seq 78217:78346, ack 1, win 501, options [nop,nop,TS val 2458868583 ecr 2107076000], length 129
09:14:04.255125 IP 10.8.3.3.57480 > 185.42.206.39.1935: Flags [.], seq 78346:79660, ack 1, win 501, options [nop,nop,TS val 2458868621 ecr 2107076000], length 1314
09:14:04.290478 IP 10.8.3.3.57480 > 185.42.206.39.1935: Flags [.], seq 79660:80974, ack 1, win 501, options [nop,nop,TS val 2458868657 ecr 2107076000], length 1314
09:14:04.303361 IP 185.42.206.39.1935 > 10.8.3.3.57480: Flags [.], ack 72961, win 126, options [nop,nop,TS val 2107076087 ecr 2458868357], length 0
09:14:04.337040 IP 10.8.3.3.57480 > 185.42.206.39.1935: Flags [.], seq 80974:82288, ack 1, win 501, options [nop,nop,TS val 2458868703 ecr 2107076087], length 1314
09:14:04.390960 IP 10.8.3.3.57480 > 185.42.206.39.1935: Flags [.], seq 82288:83602, ack 1, win 501, options [nop,nop,TS val 2458868757 ecr 2107076087], length 1314
09:14:04.402322 IP 185.42.206.39.1935 > 10.8.3.3.57480: Flags [.], ack 75589, win 126, options [nop,nop,TS val 2107076186 ecr 2458868425], length 0
09:14:04.422991 IP 10.8.3.3.57480 > 185.42.206.39.1935: Flags [.], seq 83602:84916, ack 1, win 501, options [nop,nop,TS val 2458868789 ecr 2107076186], length 1314
09:14:04.465593 IP 10.8.3.3.57480 > 185.42.206.39.1935: Flags [.], seq 84916:86230, ack 1, win 501, options [nop,nop,TS val 2458868832 ecr 2107076186], length 1314
09:14:04.467519 IP 185.42.206.39.1935 > 10.8.3.3.57480: Flags [.], ack 78217, win 126, options [nop,nop,TS val 2107076251 ecr 2458868524], length 0
09:14:04.495873 IP 185.42.206.39.1935 > 10.8.3.3.57480: Flags [.], ack 78346, win 126, options [nop,nop,TS val 2107076280 ecr 2458868583], length 0
09:14:04.495893 IP 10.8.3.3.57480 > 185.42.206.39.1935: Flags [P.], seq 86230:87212, ack 1, win 501, options [nop,nop,TS val 2458868862 ecr 2107076280], length 982
09:14:04.557520 IP 10.8.3.3.57480 > 185.42.206.39.1935: Flags [.], seq 87212:88526, ack 1, win 501, options [nop,nop,TS val 2458868924 ecr 2107076280], length 1314
09:14:04.570196 IP 185.42.206.39.1935 > 10.8.3.3.57480: Flags [.], ack 80974, win 126, options [nop,nop,TS val 2107076354 ecr 2458868621], length 0
09:14:04.588004 IP 10.8.3.3.57480 > 185.42.206.39.1935: Flags [.], seq 88526:89840, ack 1, win 501, options [nop,nop,TS val 2458868954 ecr 2107076354], length 1314
09:14:04.623351 IP 10.8.3.3.57480 > 185.42.206.39.1935: Flags [.], seq 89840:91154, ack 1, win 501, options [nop,nop,TS val 2458868990 ecr 2107076354], length 1314
09:14:04.670533 IP 185.42.206.39.1935 > 10.8.3.3.57480: Flags [.], ack 83602, win 126, options [nop,nop,TS val 2107076454 ecr 2458868703], length 0
09:14:04.690896 IP 10.8.3.3.57480 > 185.42.206.39.1935: Flags [.], seq 91154:92468, ack 1, win 501, options [nop,nop,TS val 2458869057 ecr 2107076454], length 1314
09:14:04.721491 IP 10.8.3.3.57480 > 185.42.206.39.1935: Flags [.], seq 92468:93782, ack 1, win 501, options [nop,nop,TS val 2458869088 ecr 2107076454], length 1314
09:14:04.745237 IP 185.42.206.39.1935 > 10.8.3.3.57480: Flags [.], ack 86230, win 126, options [nop,nop,TS val 2107076529 ecr 2458868789], length 0
09:14:04.753808 IP 10.8.3.3.57480 > 185.42.206.39.1935: Flags [.], seq 93782:95096, ack 1, win 501, options [nop,nop,TS val 2458869120 ecr 2107076529], length 1314
09:14:04.775301 IP 185.42.206.39.1935 > 10.8.3.3.57480: Flags [.], ack 87212, win 126, options [nop,nop,TS val 2107076559 ecr 2458868862], length 0
09:14:04.775320 IP 10.8.3.3.57480 > 185.42.206.39.1935: Flags [P.], seq 95096:95215, ack 1, win 501, options [nop,nop,TS val 2458869142 ecr 2107076559], length 119
09:14:04.824188 IP 10.8.3.3.57480 > 185.42.206.39.1935: Flags [.], seq 95215:96529, ack 1, win 501, options [nop,nop,TS val 2458869190 ecr 2107076559], length 1314
09:14:04.855861 IP 10.8.3.3.57480 > 185.42.206.39.1935: Flags [.], seq 96529:97843, ack 1, win 501, options [nop,nop,TS val 2458869222 ecr 2107076559], length 1314
09:14:04.867926 IP 185.42.206.39.1935 > 10.8.3.3.57480: Flags [.], ack 89840, win 126, options [nop,nop,TS val 2107076651 ecr 2458868924], length 0
09:14:04.893871 IP 10.8.3.3.57480 > 185.42.206.39.1935: Flags [.], seq 97843:99157, ack 1, win 501, options [nop,nop,TS val 2458869260 ecr 2107076651], length 1314
09:14:04.956853 IP 10.8.3.3.57480 > 185.42.206.39.1935: Flags [.], seq 99157:100471, ack 1, win 501, options [nop,nop,TS val 2458869323 ecr 2107076651], length 1314
09:14:04.970777 IP 185.42.206.39.1935 > 10.8.3.3.57480: Flags [.], ack 92468, win 126, options [nop,nop,TS val 2107076754 ecr 2458868990], length 0
09:14:04.990206 IP 10.8.3.3.57480 > 185.42.206.39.1935: Flags [.], seq 100471:101785, ack 1, win 501, options [nop,nop,TS val 2458869357 ecr 2107076754], length 1314
09:14:05.022413 IP 10.8.3.3.57480 > 185.42.206.39.1935: Flags [.], seq 101785:103099, ack 1, win 501, options [nop,nop,TS val 2458869389 ecr 2107076754], length 1314
09:14:05.033722 IP 185.42.206.39.1935 > 10.8.3.3.57480: Flags [.], ack 95096, win 126, options [nop,nop,TS val 2107076817 ecr 2458869088], length 0
09:14:05.055409 IP 185.42.206.39.1935 > 10.8.3.3.57480: Flags [.], ack 95215, win 126, options [nop,nop,TS val 2107076839 ecr 2458869142], length 0
09:14:05.055438 IP 10.8.3.3.57480 > 185.42.206.39.1935: Flags [P.], seq 103099:103233, ack 1, win 501, options [nop,nop,TS val 2458869422 ecr 2107076839], length 134
09:14:05.089865 IP 10.8.3.3.57480 > 185.42.206.39.1935: Flags [.], seq 103233:104547, ack 1, win 501, options [nop,nop,TS val 2458869456 ecr 2107076839], length 1314
09:14:05.123240 IP 10.8.3.3.57480 > 185.42.206.39.1935: Flags [.], seq 104547:105861, ack 1, win 501, options [nop,nop,TS val 2458869490 ecr 2107076839], length 1314
09:14:05.135611 IP 185.42.206.39.1935 > 10.8.3.3.57480: Flags [.], ack 97843, win 126, options [nop,nop,TS val 2107076919 ecr 2458869190], length 0
09:14:05.172450 IP 10.8.3.3.57480 > 185.42.206.39.1935: Flags [.], seq 105861:107175, ack 1, win 501, options [nop,nop,TS val 2458869539 ecr 2107076919], length 1314
09:14:05.223325 IP 10.8.3.3.57480 > 185.42.206.39.1935: Flags [.], seq 107175:108489, ack 1, win 501, options [nop,nop,TS val 2458869590 ecr 2107076919], length 1314
09:14:05.236356 IP 185.42.206.39.1935 > 10.8.3.3.57480: Flags [.], ack 100471, win 126, options [nop,nop,TS val 2107077020 ecr 2458869260], length 0
09:14:05.256444 IP 10.8.3.3.57480 > 185.42.206.39.1935: Flags [.], seq 108489:109803, ack 1, win 501, options [nop,nop,TS val 2458869623 ecr 2107077020], length 1314
09:14:05.300975 IP 10.8.3.3.57480 > 185.42.206.39.1935: Flags [.], seq 109803:111117, ack 1, win 501, options [nop,nop,TS val 2458869667 ecr 2107077020], length 1314
09:14:05.301976 IP 185.42.206.39.1935 > 10.8.3.3.57480: Flags [.], ack 103099, win 126, options [nop,nop,TS val 2107077086 ecr 2458869357], length 0
09:14:05.334892 IP 185.42.206.39.1935 > 10.8.3.3.57480: Flags [.], ack 103233, win 126, options [nop,nop,TS val 2107077118 ecr 2458869422], length 0
09:14:05.334928 IP 10.8.3.3.57480 > 185.42.206.39.1935: Flags [P.], seq 111117:112094, ack 1, win 501, options [nop,nop,TS val 2458869701 ecr 2107077118], length 977
09:14:05.388360 IP 10.8.3.3.57480 > 185.42.206.39.1935: Flags [.], seq 112094:113408, ack 1, win 501, options [nop,nop,TS val 2458869755 ecr 2107077118], length 1314
09:14:05.402759 IP 185.42.206.39.1935 > 10.8.3.3.57480: Flags [.], ack 105861, win 126, options [nop,nop,TS val 2107077186 ecr 2458869456], length 0
09:14:05.423933 IP 10.8.3.3.57480 > 185.42.206.39.1935: Flags [.], seq 113408:114722, ack 1, win 501, options [nop,nop,TS val 2458869790 ecr 2107077186], length 1314
09:14:05.457379 IP 10.8.3.3.57480 > 185.42.206.39.1935: Flags [.], seq 114722:116036, ack 1, win 501, options [nop,nop,TS val 2458869824 ecr 2107077186], length 1314
09:14:05.502965 IP 185.42.206.39.1935 > 10.8.3.3.57480: Flags [.], ack 108489, win 126, options [nop,nop,TS val 2107077287 ecr 2458869539], length 0
09:14:05.521247 IP 10.8.3.3.57480 > 185.42.206.39.1935: Flags [.], seq 116036:117350, ack 1, win 501, options [nop,nop,TS val 2458869888 ecr 2107077287], length 1314
09:14:05.556381 IP 10.8.3.3.57480 > 185.42.206.39.1935: Flags [.], seq 117350:118664, ack 1, win 501, options [nop,nop,TS val 2458869923 ecr 2107077287], length 1314
09:14:05.580673 IP 185.42.206.39.1935 > 10.8.3.3.57480: Flags [.], ack 111117, win 126, options [nop,nop,TS val 2107077364 ecr 2458869623], length 0
09:14:05.589633 IP 10.8.3.3.57480 > 185.42.206.39.1935: Flags [.], seq 118664:119978, ack 1, win 501, options [nop,nop,TS val 2458869956 ecr 2107077364], length 1314
09:14:05.614270 IP 185.42.206.39.1935 > 10.8.3.3.57480: Flags [.], ack 112094, win 126, options [nop,nop,TS val 2107077398 ecr 2458869701], length 0
09:14:05.614303 IP 10.8.3.3.57480 > 185.42.206.39.1935: Flags [P.], seq 119978:120096, ack 1, win 501, options [nop,nop,TS val 2458869981 ecr 2107077398], length 118
09:14:05.656507 IP 10.8.3.3.57480 > 185.42.206.39.1935: Flags [.], seq 120096:121410, ack 1, win 501, options [nop,nop,TS val 2458870023 ecr 2107077398], length 1314
09:14:05.690322 IP 10.8.3.3.57480 > 185.42.206.39.1935: Flags [.], seq 121410:122724, ack 1, win 501, options [nop,nop,TS val 2458870057 ecr 2107077398], length 1314
09:14:05.703403 IP 185.42.206.39.1935 > 10.8.3.3.57480: Flags [.], ack 114722, win 126, options [nop,nop,TS val 2107077487 ecr 2458869755], length 0
09:14:05.729803 IP 10.8.3.3.57480 > 185.42.206.39.1935: Flags [.], seq 122724:124038, ack 1, win 501, options [nop,nop,TS val 2458870096 ecr 2107077487], length 1314
09:14:05.788997 IP 10.8.3.3.57480 > 185.42.206.39.1935: Flags [.], seq 124038:125352, ack 1, win 501, options [nop,nop,TS val 2458870155 ecr 2107077487], length 1314
09:14:05.800990 IP 185.42.206.39.1935 > 10.8.3.3.57480: Flags [.], ack 117350, win 126, options [nop,nop,TS val 2107077585 ecr 2458869824], length 0
09:14:05.823235 IP 10.8.3.3.57480 > 185.42.206.39.1935: Flags [.], seq 125352:126666, ack 1, win 501, options [nop,nop,TS val 2458870190 ecr 2107077585], length 1314
09:14:05.858117 IP 10.8.3.3.57480 > 185.42.206.39.1935: Flags [.], seq 126666:127980, ack 1, win 501, options [nop,nop,TS val 2458870224 ecr 2107077585], length 1314
09:14:05.869182 IP 185.42.206.39.1935 > 10.8.3.3.57480: Flags [.], ack 119978, win 126, options [nop,nop,TS val 2107077653 ecr 2458869923], length 0
09:14:05.893521 IP 185.42.206.39.1935 > 10.8.3.3.57480: Flags [.], ack 120096, win 126, options [nop,nop,TS val 2107077677 ecr 2458869981], length 0
09:14:05.893534 IP 10.8.3.3.57480 > 185.42.206.39.1935: Flags [P.], seq 127980:129056, ack 1, win 501, options [nop,nop,TS val 2458870260 ecr 2107077677], length 1076
09:14:05.955806 IP 10.8.3.3.57480 > 185.42.206.39.1935: Flags [.], seq 129056:130370, ack 1, win 501, options [nop,nop,TS val 2458870322 ecr 2107077677], length 1314
09:14:05.970385 IP 185.42.206.39.1935 > 10.8.3.3.57480: Flags [.], ack 122724, win 126, options [nop,nop,TS val 2107077753 ecr 2458870023], length 0
09:14:05.990857 IP 10.8.3.3.57480 > 185.42.206.39.1935: Flags [.], seq 130370:131684, ack 1, win 501, options [nop,nop,TS val 2458870357 ecr 2107077753], length 1314
09:14:06.021433 IP 10.8.3.3.57480 > 185.42.206.39.1935: Flags [.], seq 131684:132998, ack 1, win 501, options [nop,nop,TS val 2458870388 ecr 2107077753], length 1314
09:14:06.068595 IP 185.42.206.39.1935 > 10.8.3.3.57480: Flags [.], ack 125352, win 126, options [nop,nop,TS val 2107077852 ecr 2458870096], length 0
09:14:06.071909 IP 10.8.3.3.57480 > 185.42.206.39.1935: Flags [.], seq 132998:134312, ack 1, win 501, options [nop,nop,TS val 2458870438 ecr 2107077852], length 1314
09:14:06.114559 IP 10.8.3.3.57480 > 185.42.206.39.1935: Flags [.], seq 134312:135626, ack 1, win 501, options [nop,nop,TS val 2458870481 ecr 2107077852], length 1314
09:14:06.137779 IP 185.42.206.39.1935 > 10.8.3.3.57480: Flags [.], ack 127980, win 126, options [nop,nop,TS val 2107077921 ecr 2458870190], length 0
09:14:06.157364 IP 10.8.3.3.57480 > 185.42.206.39.1935: Flags [.], seq 135626:136940, ack 1, win 501, options [nop,nop,TS val 2458870524 ecr 2107077921], length 1314
09:14:06.172993 IP 185.42.206.39.1935 > 10.8.3.3.57480: Flags [.], ack 129056, win 126, options [nop,nop,TS val 2107077956 ecr 2458870260], length 0
09:14:06.173024 IP 10.8.3.3.57480 > 185.42.206.39.1935: Flags [P.], seq 136940:137071, ack 1, win 501, options [nop,nop,TS val 2458870539 ecr 2107077956], length 131
09:14:06.220976 IP 10.8.3.3.57480 > 185.42.206.39.1935: Flags [.], seq 137071:138385, ack 1, win 501, options [nop,nop,TS val 2458870587 ecr 2107077956], length 1314
09:14:06.242517 IP 10.8.3.3.57480 > 185.42.206.39.1935: Flags [.], seq 138385:139699, ack 1, win 501, options [nop,nop,TS val 2458870609 ecr 2107077956], length 1314
09:14:06.270505 IP 185.42.206.39.1935 > 10.8.3.3.57480: Flags [.], ack 131684, win 126, options [nop,nop,TS val 2107078054 ecr 2458870322], length 0
09:14:06.286645 IP 10.8.3.3.57480 > 185.42.206.39.1935: Flags [.], seq 139699:141013, ack 1, win 501, options [nop,nop,TS val 2458870653 ecr 2107078054], length 1314
09:14:06.352009 IP 185.42.206.39.1935 > 10.8.3.3.57480: Flags [.], ack 134312, win 126, options [nop,nop,TS val 2107078135 ecr 2458870388], length 0
09:14:06.356968 IP 10.8.3.3.57480 > 185.42.206.39.1935: Flags [.], seq 141013:142327, ack 1, win 501, options [nop,nop,TS val 2458870723 ecr 2107078135], length 1314
09:14:06.391664 IP 10.8.3.3.57480 > 185.42.206.39.1935: Flags [.], seq 142327:143641, ack 1, win 501, options [nop,nop,TS val 2458870758 ecr 2107078135], length 1314
09:14:06.419773 IP 10.8.3.3.57480 > 185.42.206.39.1935: Flags [.], seq 143641:144955, ack 1, win 501, options [nop,nop,TS val 2458870786 ecr 2107078135], length 1314
09:14:06.437380 IP 185.42.206.39.1935 > 10.8.3.3.57480: Flags [.], ack 136940, win 126, options [nop,nop,TS val 2107078221 ecr 2458870481], length 0
09:14:06.452384 IP 185.42.206.39.1935 > 10.8.3.3.57480: Flags [.], ack 137071, win 126, options [nop,nop,TS val 2107078236 ecr 2458870539], length 0
09:14:06.452458 IP 10.8.3.3.57480 > 185.42.206.39.1935: Flags [P.], seq 144955:145078, ack 1, win 501, options [nop,nop,TS val 2458870819 ecr 2107078236], length 123
09:14:06.490116 IP 10.8.3.3.57480 > 185.42.206.39.1935: Flags [.], seq 145078:146392, ack 1, win 501, options [nop,nop,TS val 2458870856 ecr 2107078236], length 1314
09:14:06.522018 IP 185.42.206.39.1935 > 10.8.3.3.57480: Flags [.], ack 139699, win 126, options [nop,nop,TS val 2107078305 ecr 2458870587], length 0
09:14:06.524457 IP 10.8.3.3.57480 > 185.42.206.39.1935: Flags [.], seq 146392:147706, ack 1, win 501, options [nop,nop,TS val 2458870891 ecr 2107078305], length 1314
09:14:06.562783 IP 10.8.3.3.57480 > 185.42.206.39.1935: Flags [.], seq 147706:149020, ack 1, win 501, options [nop,nop,TS val 2458870929 ecr 2107078305], length 1314
09:14:06.605545 IP 10.8.3.3.57480 > 185.42.206.39.1935: Flags [.], seq 149020:150334, ack 1, win 501, options [nop,nop,TS val 2458870972 ecr 2107078305], length 1314
09:14:06.636645 IP 185.42.206.39.1935 > 10.8.3.3.57480: Flags [.], ack 142327, win 126, options [nop,nop,TS val 2107078420 ecr 2458870653], length 0
09:14:06.648202 IP 10.8.3.3.57480 > 185.42.206.39.1935: Flags [.], seq 150334:151648, ack 1, win 501, options [nop,nop,TS val 2458871015 ecr 2107078420], length 1314
09:14:06.691015 IP 10.8.3.3.57480 > 185.42.206.39.1935: Flags [.], seq 151648:152962, ack 1, win 501, options [nop,nop,TS val 2458871057 ecr 2107078420], length 1314
09:14:06.699053 IP 185.42.206.39.1935 > 10.8.3.3.57480: Flags [.], ack 144955, win 126, options [nop,nop,TS val 2107078483 ecr 2458870758], length 0
09:14:06.731995 IP 185.42.206.39.1935 > 10.8.3.3.57480: Flags [.], ack 145078, win 126, options [nop,nop,TS val 2107078515 ecr 2458870819], length 0
09:14:06.732018 IP 10.8.3.3.57480 > 185.42.206.39.1935: Flags [P.], seq 152962:153943, ack 1, win 501, options [nop,nop,TS val 2458871098 ecr 2107078515], length 981
09:14:06.776568 IP 10.8.3.3.57480 > 185.42.206.39.1935: Flags [.], seq 153943:155257, ack 1, win 501, options [nop,nop,TS val 2458871143 ecr 2107078515], length 1314
09:14:06.804300 IP 185.42.206.39.1935 > 10.8.3.3.57480: Flags [.], ack 147706, win 126, options [nop,nop,TS val 2107078588 ecr 2458870856], length 0
09:14:06.819236 IP 10.8.3.3.57480 > 185.42.206.39.1935: Flags [.], seq 155257:156571, ack 1, win 501, options [nop,nop,TS val 2458871186 ecr 2107078588], length 1314
09:14:06.853592 IP 10.8.3.3.57480 > 185.42.206.39.1935: Flags [.], seq 156571:157885, ack 1, win 501, options [nop,nop,TS val 2458871220 ecr 2107078588], length 1314
09:14:06.885244 IP 185.42.206.39.1935 > 10.8.3.3.57480: Flags [.], ack 150334, win 126, options [nop,nop,TS val 2107078669 ecr 2458870929], length 0
09:14:06.923977 IP 10.8.3.3.57480 > 185.42.206.39.1935: Flags [.], seq 157885:159199, ack 1, win 501, options [nop,nop,TS val 2458871290 ecr 2107078669], length 1314
09:14:06.947547 IP 10.8.3.3.57480 > 185.42.206.39.1935: Flags [.], seq 159199:160513, ack 1, win 501, options [nop,nop,TS val 2458871314 ecr 2107078669], length 1314
09:14:06.970801 IP 185.42.206.39.1935 > 10.8.3.3.57480: Flags [.], ack 152962, win 126, options [nop,nop,TS val 2107078754 ecr 2458871015], length 0
09:14:06.987595 IP 10.8.3.3.57480 > 185.42.206.39.1935: Flags [.], seq 160513:161827, ack 1, win 501, options [nop,nop,TS val 2458871354 ecr 2107078754], length 1314
09:14:07.011524 IP 185.42.206.39.1935 > 10.8.3.3.57480: Flags [.], ack 153943, win 126, options [nop,nop,TS val 2107078795 ecr 2458871098], length 0
09:14:07.011535 IP 10.8.3.3.57480 > 185.42.206.39.1935: Flags [P.], seq 161827:162801, ack 1, win 501, options [nop,nop,TS val 2458871378 ecr 2107078795], length 974
09:14:07.075424 IP 10.8.3.3.57480 > 185.42.206.39.1935: Flags [.], seq 162801:164115, ack 1, win 501, options [nop,nop,TS val 2458871442 ecr 2107078795], length 1314
09:14:07.098838 IP 185.42.206.39.1935 > 10.8.3.3.57480: Flags [.], ack 156571, win 126, options [nop,nop,TS val 2107078882 ecr 2458871143], length 0
09:14:07.117940 IP 10.8.3.3.57480 > 185.42.206.39.1935: Flags [.], seq 164115:165429, ack 1, win 501, options [nop,nop,TS val 2458871484 ecr 2107078882], length 1314
09:14:07.139234 IP 10.8.3.3.57480 > 185.42.206.39.1935: Flags [.], seq 165429:166743, ack 1, win 501, options [nop,nop,TS val 2458871506 ecr 2107078882], length 1314
09:14:07.203760 IP 185.42.206.39.1935 > 10.8.3.3.57480: Flags [.], ack 159199, win 126, options [nop,nop,TS val 2107078987 ecr 2458871220], length 0
09:14:07.223750 IP 10.8.3.3.57480 > 185.42.206.39.1935: Flags [.], seq 166743:168057, ack 1, win 501, options [nop,nop,TS val 2458871590 ecr 2107078987], length 1314
09:14:07.246450 IP 10.8.3.3.57480 > 185.42.206.39.1935: Flags [.], seq 168057:169371, ack 1, win 501, options [nop,nop,TS val 2458871613 ecr 2107078987], length 1314
09:14:07.267193 IP 185.42.206.39.1935 > 10.8.3.3.57480: Flags [.], ack 161827, win 126, options [nop,nop,TS val 2107079051 ecr 2458871314], length 0
09:14:07.286972 IP 10.8.3.3.57480 > 185.42.206.39.1935: Flags [.], seq 169371:170685, ack 1, win 501, options [nop,nop,TS val 2458871653 ecr 2107079051], length 1314
09:14:07.290931 IP 185.42.206.39.1935 > 10.8.3.3.57480: Flags [.], ack 162801, win 126, options [nop,nop,TS val 2107079075 ecr 2458871378], length 0
09:14:07.290944 IP 10.8.3.3.57480 > 185.42.206.39.1935: Flags [P.], seq 170685:170901, ack 1, win 501, options [nop,nop,TS val 2458871657 ecr 2107079075], length 216
09:14:07.353106 IP 10.8.3.3.57480 > 185.42.206.39.1935: Flags [.], seq 170901:172215, ack 1, win 501, options [nop,nop,TS val 2458871719 ecr 2107079075], length 1314
09:14:07.374602 IP 10.8.3.3.57480 > 185.42.206.39.1935: Flags [.], seq 172215:173529, ack 1, win 501, options [nop,nop,TS val 2458871741 ecr 2107079075], length 1314
09:14:07.397405 IP 185.42.206.39.1935 > 10.8.3.3.57480: Flags [.], ack 165429, win 126, options [nop,nop,TS val 2107079181 ecr 2458871442], length 0
09:14:07.423929 IP 10.8.3.3.57480 > 185.42.206.39.1935: Flags [.], seq 173529:174843, ack 1, win 501, options [nop,nop,TS val 2458871790 ecr 2107079181], length 1314
09:14:07.475970 IP 185.42.206.39.1935 > 10.8.3.3.57480: Flags [.], ack 166743, win 126, options [nop,nop,TS val 2107079259 ecr 2458871506], length 0
09:14:07.482010 IP 10.8.3.3.57480 > 185.42.206.39.1935: Flags [.], seq 174843:176157, ack 1, win 501, options [nop,nop,TS val 2458871848 ecr 2107079259], length 1314
09:14:07.521991 IP 10.8.3.3.57480 > 185.42.206.39.1935: Flags [.], seq 176157:177471, ack 1, win 501, options [nop,nop,TS val 2458871888 ecr 2107079259], length 1314
09:14:07.525766 IP 185.42.206.39.1935 > 10.8.3.3.57480: Flags [.], ack 169371, win 126, options [nop,nop,TS val 2107079309 ecr 2458871590], length 0
09:14:07.556164 IP 10.8.3.3.57480 > 185.42.206.39.1935: Flags [.], seq 177471:178785, ack 1, win 501, options [nop,nop,TS val 2458871922 ecr 2107079309], length 1314
09:14:07.570186 IP 185.42.206.39.1935 > 10.8.3.3.57480: Flags [.], ack 170901, win 126, options [nop,nop,TS val 2107079354 ecr 2458871653], length 0
09:14:07.570219 IP 10.8.3.3.57480 > 185.42.206.39.1935: Flags [P.], seq 178785:178920, ack 1, win 501, options [nop,nop,TS val 2458871937 ecr 2107079354], length 135
09:14:07.610561 IP 10.8.3.3.57480 > 185.42.206.39.1935: Flags [.], seq 178920:180234, ack 1, win 501, options [nop,nop,TS val 2458871977 ecr 2107079354], length 1314
09:14:07.653562 IP 10.8.3.3.57480 > 185.42.206.39.1935: Flags [.], seq 180234:181548, ack 1, win 501, options [nop,nop,TS val 2458872020 ecr 2107079354], length 1314
09:14:07.654670 IP 185.42.206.39.1935 > 10.8.3.3.57480: Flags [.], ack 173529, win 126, options [nop,nop,TS val 2107079438 ecr 2458871719], length 0
09:14:07.696418 IP 10.8.3.3.57480 > 185.42.206.39.1935: Flags [.], seq 181548:182862, ack 1, win 501, options [nop,nop,TS val 2458872063 ecr 2107079438], length 1314
09:14:07.757129 IP 10.8.3.3.57480 > 185.42.206.39.1935: Flags [.], seq 182862:184176, ack 1, win 501, options [nop,nop,TS val 2458872123 ecr 2107079438], length 1314
09:14:07.759804 IP 185.42.206.39.1935 > 10.8.3.3.57480: Flags [.], ack 174843, win 126, options [nop,nop,TS val 2107079543 ecr 2458871790], length 0
09:14:07.782384 IP 10.8.3.3.57480 > 185.42.206.39.1935: Flags [.], seq 184176:185490, ack 1, win 501, options [nop,nop,TS val 2458872149 ecr 2107079543], length 1314
09:14:07.801349 IP 185.42.206.39.1935 > 10.8.3.3.57480: Flags [.], ack 177471, win 126, options [nop,nop,TS val 2107079585 ecr 2458871848], length 0
09:14:07.824764 IP 10.8.3.3.57480 > 185.42.206.39.1935: Flags [.], seq 185490:186804, ack 1, win 501, options [nop,nop,TS val 2458872191 ecr 2107079585], length 1314
09:14:07.849350 IP 185.42.206.39.1935 > 10.8.3.3.57480: Flags [.], ack 178920, win 126, options [nop,nop,TS val 2107079633 ecr 2458871922], length 0
09:14:07.849366 IP 10.8.3.3.57480 > 185.42.206.39.1935: Flags [P.], seq 186804:187682, ack 1, win 501, options [nop,nop,TS val 2458872216 ecr 2107079633], length 878
09:14:07.909568 IP 10.8.3.3.57480 > 185.42.206.39.1935: Flags [.], seq 187682:188996, ack 1, win 501, options [nop,nop,TS val 2458872276 ecr 2107079633], length 1314
09:14:07.933418 IP 185.42.206.39.1935 > 10.8.3.3.57480: Flags [.], ack 181548, win 126, options [nop,nop,TS val 2107079717 ecr 2458871977], length 0
09:14:07.952627 IP 10.8.3.3.57480 > 185.42.206.39.1935: Flags [.], seq 188996:190310, ack 1, win 501, options [nop,nop,TS val 2458872319 ecr 2107079717], length 1314
09:14:07.990595 IP 10.8.3.3.57480 > 185.42.206.39.1935: Flags [.], seq 190310:191624, ack 1, win 501, options [nop,nop,TS val 2458872357 ecr 2107079717], length 1314
