08:51:15.654659 IP 10.8.3.4.44172 > 52.223.246.10.1935: Flags [.], seq 3172914881:3172916195, ack 2110653159, win 501, options [nop,nop,TS val 1276805994 ecr 65132186], length 1314
08:51:15.666264 IP 52.223.246.10.1935 > 10.8.3.4.44172: Flags [.], ack 4294958040, win 126, options [nop,nop,TS val 65132251 ecr 1276805588], length 0
08:51:15.690515 IP 10.8.3.4.44172 > 52.223.246.10.1935: Flags [.], seq 1314:2628, ack 1, win 501, options [nop,nop,TS val 1276806030 ecr 65132251], length 1314
08:51:15.725442 IP 10.8.3.4.44172 > 52.223.246.10.1935: Flags [.], seq 2628:3942, ack 1, win 501, options [nop,nop,TS val 1276806065 ecr 65132251], length 1314
08:51:15.767253 IP 52.223.246.10.1935 > 10.8.3.4.44172: Flags [.], ack 4294960668, win 126, options [nop,nop,TS val 65132353 ecr 1276805673], length 0
08:51:15.782560 IP 10.8.3.4.44172 > 52.223.246.10.1935: Flags [.], seq 3942:5256, ack 1, win 501, options [nop,nop,TS val 1276806122 ecr 65132353], length 1314
08:51:15.825913 IP 10.8.3.4.44172 > 52.223.246.10.1935: Flags [.], seq 5256:6570, ack 1, win 501, options [nop,nop,TS val 1276806165 ecr 65132353], length 1314
08:51:15.836862 IP 52.223.246.10.1935 > 10.8.3.4.44172: Flags [.], ack 4294963296, win 126, options [nop,nop,TS val 65132422 ecr 1276805759], length 0
08:51:15.859713 IP 10.8.3.4.44172 > 52.223.246.10.1935: Flags [.], seq 6570:7884, ack 1, win 501, options [nop,nop,TS val 1276806199 ecr 65132422], length 1314
08:51:15.922831 IP 52.223.246.10.1935 > 10.8.3.4.44172: Flags [.], ack 4294965924, win 126, options [nop,nop,TS val 65132508 ecr 1276805866], length 0
08:51:15.927686 IP 10.8.3.4.44172 > 52.223.246.10.1935: Flags [.], seq 7884:9198, ack 1, win 501, options [nop,nop,TS val 1276806267 ecr 65132508], length 1314
08:51:15.954341 IP 10.8.3.4.44172 > 52.223.246.10.1935: Flags [.], seq 9198:10512, ack 1, win 501, options [nop,nop,TS val 1276806294 ecr 65132508], length 1314
08:51:15.978517 IP 52.223.246.10.1935 > 10.8.3.4.44172: Flags [.], ack 0, win 126, options [nop,nop,TS val 65132561 ecr 1276805931], length 0
08:51:15.978553 IP 10.8.3.4.44172 > 52.223.246.10.1935: Flags [P.], seq 10512:11021, ack 1, win 501, options [nop,nop,TS val 1276806318 ecr 65132561], length 509
08:51:16.018381 IP 10.8.3.4.44172 > 52.223.246.10.1935: Flags [.], seq 11021:12335, ack 1, win 501, options [nop,nop,TS val 1276806358 ecr 65132561], length 1314
08:51:16.057327 IP 10.8.3.4.44172 > 52.223.246.10.1935: Flags [.], seq 12335:13649, ack 1, win 501, options [nop,nop,TS val 1276806397 ecr 65132561], length 1314
08:51:16.069249 IP 52.223.246.10.1935 > 10.8.3.4.44172: Flags [.], ack 2628, win 126, options [nop,nop,TS val 65132651 ecr 1276805994], length 0
08:51:16.103293 IP 10.8.3.4.44172 > 52.223.246.10.1935: Flags [.], seq 13649:14963, ack 1, win 501, options [nop,nop,TS val 1276806443 ecr 65132651], length 1314
08:51:16.145677 IP 10.8.3.4.44172 > 52.223.246.10.1935: Flags [.], seq 14963:16277, ack 1, win 501, options [nop,nop,TS val 1276806485 ecr 65132651], length 1314
08:51:16.158857 IP 52.223.246.10.1935 > 10.8.3.4.44172: Flags [.], ack 5256, win 126, options [nop,nop,TS val 65132743 ecr 1276806065], length 0
08:51:16.188097 IP 10.8.3.4.44172 > 52.223.246.10.1935: Flags [.], seq 16277:17591, ack 1, win 501, options [nop,nop,TS val 1276806527 ecr 65132743], length 1314
08:51:16.230434 IP 10.8.3.4.44172 > 52.223.246.10.1935: Flags [.], seq 17591:18905, ack 1, win 501, options [nop,nop,TS val 1276806570 ecr 65132743], length 1314
08:51:16.243663 IP 52.223.246.10.1935 > 10.8.3.4.44172: Flags [.], ack 7884, win 126, options [nop,nop,TS val 65132820 ecr 1276806165], length 0
08:51:16.292360 IP 10.8.3.4.44172 > 52.223.246.10.1935: Flags [.], seq 18905:20219, ack 1, win 501, options [nop,nop,TS val 1276806632 ecr 65132820], length 1314
08:51:16.315854 IP 10.8.3.4.44172 > 52.223.246.10.1935: Flags [.], seq 20219:21533, ack 1, win 501, options [nop,nop,TS val 1276806655 ecr 65132820], length 1314
08:51:16.330649 IP 52.223.246.10.1935 > 10.8.3.4.44172: Flags [.], ack 10512, win 126, options [nop,nop,TS val 65132914 ecr 1276806267], length 0
08:51:16.353463 IP 52.223.246.10.1935 > 10.8.3.4.44172: Flags [.], ack 11021, win 126, options [nop,nop,TS val 65132939 ecr 1276806318], length 0
08:51:16.353491 IP 10.8.3.4.44172 > 52.223.246.10.1935: Flags [P.], seq 21533:21962, ack 1, win 501, options [nop,nop,TS val 1276806693 ecr 65132939], length 429
08:51:16.380363 IP 10.8.3.4.44172 > 52.223.246.10.1935: Flags [.], seq 21962:23276, ack 1, win 501, options [nop,nop,TS val 1276806720 ecr 65132939], length 1314
08:51:16.423093 IP 10.8.3.4.44172 > 52.223.246.10.1935: Flags [.], seq 23276:24590, ack 1, win 501, options [nop,nop,TS val 1276806762 ecr 65132939], length 1314
08:51:16.431860 IP 52.223.246.10.1935 > 10.8.3.4.44172: Flags [.], ack 13649, win 126, options [nop,nop,TS val 65133017 ecr 1276806358], length 0
08:51:16.465951 IP 10.8.3.4.44172 > 52.223.246.10.1935: Flags [.], seq 24590:25904, ack 1, win 501, options [nop,nop,TS val 1276806805 ecr 65133017], length 1314
08:51:16.520283 IP 52.223.246.10.1935 > 10.8.3.4.44172: Flags [.], ack 16277, win 126, options [nop,nop,TS val 65133106 ecr 1276806443], length 0
08:51:16.525334 IP 10.8.3.4.44172 > 52.223.246.10.1935: Flags [.], seq 25904:27218, ack 1, win 501, options [nop,nop,TS val 1276806865 ecr 65133106], length 1314
08:51:16.551586 IP 10.8.3.4.44172 > 52.223.246.10.1935: Flags [.], seq 27218:28532, ack 1, win 501, options [nop,nop,TS val 1276806891 ecr 65133106], length 1314
08:51:16.594500 IP 10.8.3.4.44172 > 52.223.246.10.1935: Flags [.], seq 28532:29846, ack 1, win 501, options [nop,nop,TS val 1276806934 ecr 65133106], length 1314
08:51:16.605441 IP 52.223.246.10.1935 > 10.8.3.4.44172: Flags [.], ack 18905, win 126, options [nop,nop,TS val 65133191 ecr 1276806527], length 0
08:51:16.658863 IP 10.8.3.4.44172 > 52.223.246.10.1935: Flags [.], seq 29846:31160, ack 1, win 501, options [nop,nop,TS val 1276806998 ecr 65133191], length 1314
08:51:16.680091 IP 10.8.3.4.44172 > 52.223.246.10.1935: Flags [.], seq 31160:32474, ack 1, win 501, options [nop,nop,TS val 1276807019 ecr 65133191], length 1314
08:51:16.690728 IP 52.223.246.10.1935 > 10.8.3.4.44172: Flags [.], ack 21533, win 126, options [nop,nop,TS val 65133276 ecr 1276806632], length 0
08:51:16.724814 IP 10.8.3.4.44172 > 52.223.246.10.1935: Flags [.], seq 32474:33788, ack 1, win 501, options [nop,nop,TS val 1276807064 ecr 65133276], length 1314
08:51:16.728288 IP 52.223.246.10.1935 > 10.8.3.4.44172: Flags [.], ack 21962, win 126, options [nop,nop,TS val 65133314 ecr 1276806693], length 0
08:51:16.728328 IP 10.8.3.4.44172 > 52.223.246.10.1935: Flags [P.], seq 33788:33826, ack 1, win 501, options [nop,nop,TS val 1276807068 ecr 65133314], length 38
08:51:16.786362 IP 10.8.3.4.44172 > 52.223.246.10.1935: Flags [.], seq 33826:35140, ack 1, win 501, options [nop,nop,TS val 1276807126 ecr 65133314], length 1314
08:51:16.798225 IP 52.223.246.10.1935 > 10.8.3.4.44172: Flags [.], ack 24590, win 126, options [nop,nop,TS val 65133383 ecr 1276806720], length 0
08:51:16.827480 IP 10.8.3.4.44172 > 52.223.246.10.1935: Flags [.], seq 35140:36454, ack 1, win 501, options [nop,nop,TS val 1276807167 ecr 65133383], length 1314
08:51:16.861450 IP 10.8.3.4.44172 > 52.223.246.10.1935: Flags [.], seq 36454:37768, ack 1, win 501, options [nop,nop,TS val 1276807201 ecr 65133383], length 1314
08:51:16.900274 IP 52.223.246.10.1935 > 10.8.3.4.44172: Flags [.], ack 27218, win 126, options [nop,nop,TS val 65133486 ecr 1276806805], length 0
08:51:16.914407 IP 10.8.3.4.44172 > 52.223.246.10.1935: Flags [.], seq 37768:39082, ack 1, win 501, options [nop,nop,TS val 1276807254 ecr 65133486], length 1314
08:51:16.957372 IP 10.8.3.4.44172 > 52.223.246.10.1935: Flags [.], seq 39082:40396, ack 1, win 501, options [nop,nop,TS val 1276807297 ecr 65133486], length 1314
08:51:16.969309 IP 52.223.246.10.1935 > 10.8.3.4.44172: Flags [.], ack 29846, win 126, options [nop,nop,TS val 65133555 ecr 1276806891], length 0
08:51:16.996743 IP 10.8.3.4.44172 > 52.223.246.10.1935: Flags [.], seq 40396:41710, ack 1, win 501, options [nop,nop,TS val 1276807336 ecr 65133555], length 1314
08:51:17.055147 IP 52.223.246.10.1935 > 10.8.3.4.44172: Flags [.], ack 32474, win 126, options [nop,nop,TS val 65133640 ecr 1276806998], length 0
08:51:17.058677 IP 10.8.3.4.44172 > 52.223.246.10.1935: Flags [.], seq 41710:43024, ack 1, win 501, options [nop,nop,TS val 1276807398 ecr 65133640], length 1314
08:51:17.085804 IP 10.8.3.4.44172 > 52.223.246.10.1935: Flags [.], seq 43024:44338, ack 1, win 501, options [nop,nop,TS val 1276807425 ecr 65133640], length 1314
08:51:17.103240 IP 52.223.246.10.1935 > 10.8.3.4.44172: Flags [.], ack 33826, win 126, options [nop,nop,TS val 65133688 ecr 1276807064], length 0
08:51:17.103272 IP 10.8.3.4.44172 > 52.223.246.10.1935: Flags [P.], seq 44338:44768, ack 1, win 501, options [nop,nop,TS val 1276807443 ecr 65133688], length 430
08:51:17.149829 IP 10.8.3.4.44172 > 52.223.246.10.1935: Flags [.], seq 44768:46082, ack 1, win 501, options [nop,nop,TS val 1276807489 ecr 65133688], length 1314
08:51:17.190682 IP 10.8.3.4.44172 > 52.223.246.10.1935: Flags [.], seq 46082:47396, ack 1, win 501, options [nop,nop,TS val 1276807530 ecr 65133688], length 1314
08:51:17.202503 IP 52.223.246.10.1935 > 10.8.3.4.44172: Flags [.], ack 36454, win 126, options [nop,nop,TS val 65133788 ecr 1276807126], length 0
08:51:17.225176 IP 10.8.3.4.44172 > 52.223.246.10.1935: Flags [.], seq 47396:48710, ack 1, win 501, options [nop,nop,TS val 1276807564 ecr 65133788], length 1314
08:51:17.289123 IP 52.223.246.10.1935 > 10.8.3.4.44172: Flags [.], ack 39082, win 126, options [nop,nop,TS val 65133874 ecr 1276807201], length 0
08:51:17.293398 IP 10.8.3.4.44172 > 52.223.246.10.1935: Flags [.], seq 48710:50024, ack 1, win 501, options [nop,nop,TS val 1276807633 ecr 65133874], length 1314
08:51:17.320444 IP 10.8.3.4.44172 > 52.223.246.10.1935: Flags [.], seq 50024:51338, ack 1, win 501, options [nop,nop,TS val 1276807660 ecr 65133874], length 1314
08:51:17.358859 IP 10.8.3.4.44172 > 52.223.246.10.1935: Flags [.], seq 51338:52652, ack 1, win 501, options [nop,nop,TS val 1276807698 ecr 65133874], length 1314
08:51:17.375677 IP 52.223.246.10.1935 > 10.8.3.4.44172: Flags [.], ack 41710, win 126, options [nop,nop,TS val 65133961 ecr 1276807297], length 0
08:51:17.423478 IP 10.8.3.4.44172 > 52.223.246.10.1935: Flags [.], seq 52652:53966, ack 1, win 501, options [nop,nop,TS val 1276807763 ecr 65133961], length 1314
08:51:17.447918 IP 10.8.3.4.44172 > 52.223.246.10.1935: Flags [.], seq 53966:55280, ack 1, win 501, options [nop,nop,TS val 1276807787 ecr 65133961], length 1314
08:51:17.460494 IP 52.223.246.10.1935 > 10.8.3.4.44172: Flags [.], ack 44338, win 126, options [nop,nop,TS val 65134046 ecr 1276807398], length 0
08:51:17.478019 IP 52.223.246.10.1935 > 10.8.3.4.44172: Flags [.], ack 44768, win 126, options [nop,nop,TS val 65134063 ecr 1276807443], length 0
08:51:17.478054 IP 10.8.3.4.44172 > 52.223.246.10.1935: Flags [P.], seq 55280:55789, ack 1, win 501, options [nop,nop,TS val 1276807817 ecr 65134063], length 509
08:51:17.527802 IP 10.8.3.4.44172 > 52.223.246.10.1935: Flags [.], seq 55789:57103, ack 1, win 501, options [nop,nop,TS val 1276807867 ecr 65134063], length 1314
08:51:17.555279 IP 10.8.3.4.44172 > 52.223.246.10.1935: Flags [.], seq 57103:58417, ack 1, win 501, options [nop,nop,TS val 1276807895 ecr 65134063], length 1314
08:51:17.565299 IP 52.223.246.10.1935 > 10.8.3.4.44172: Flags [.], ack 47396, win 126, options [nop,nop,TS val 65134151 ecr 1276807489], length 0
08:51:17.598225 IP 10.8.3.4.44172 > 52.223.246.10.1935: Flags [.], seq 58417:59731, ack 1, win 501, options [nop,nop,TS val 1276807938 ecr 65134151], length 1314
08:51:17.660932 IP 10.8.3.4.44172 > 52.223.246.10.1935: Flags [.], seq 59731:61045, ack 1, win 501, options [nop,nop,TS val 1276808000 ecr 65134151], length 1314
08:51:17.667875 IP 52.223.246.10.1935 > 10.8.3.4.44172: Flags [.], ack 50024, win 126, options [nop,nop,TS val 65134253 ecr 1276807564], length 0
08:51:17.683825 IP 10.8.3.4.44172 > 52.223.246.10.1935: Flags [.], seq 61045:62359, ack 1, win 501, options [nop,nop,TS val 1276808023 ecr 65134253], length 1314
08:51:17.726484 IP 10.8.3.4.44172 > 52.223.246.10.1935: Flags [.], seq 62359:63673, ack 1, win 501, options [nop,nop,TS val 1276808066 ecr 65134253], length 1314
08:51:17.733630 IP 52.223.246.10.1935 > 10.8.3.4.44172: Flags [.], ack 52652, win 126, options [nop,nop,TS val 65134319 ecr 1276807660], length 0
08:51:17.790717 IP 10.8.3.4.44172 > 52.223.246.10.1935: Flags [.], seq 63673:64987, ack 1, win 501, options [nop,nop,TS val 1276808130 ecr 65134319], length 1314
08:51:17.822567 IP 52.223.246.10.1935 > 10.8.3.4.44172: Flags [.], ack 55280, win 126, options [nop,nop,TS val 65134408 ecr 1276807763], length 0
08:51:17.823607 IP 10.8.3.4.44172 > 52.223.246.10.1935: Flags [.], seq 64987:66301, ack 1, win 501, options [nop,nop,TS val 1276808163 ecr 65134408], length 1314
08:51:17.852459 IP 52.223.246.10.1935 > 10.8.3.4.44172: Flags [.], ack 55789, win 126, options [nop,nop,TS val 65134438 ecr 1276807817], length 0
08:51:17.852473 IP 10.8.3.4.44172 > 52.223.246.10.1935: Flags [P.], seq 66301:66730, ack 1, win 501, options [nop,nop,TS val 1276808192 ecr 65134438], length 429
08:51:17.894722 IP 10.8.3.4.44172 > 52.223.246.10.1935: Flags [.], seq 66730:68044, ack 1, win 501, options [nop,nop,TS val 1276808234 ecr 65134438], length 1314
08:51:17.918694 IP 10.8.3.4.44172 > 52.223.246.10.1935: Flags [.], seq 68044:69358, ack 1, win 501, options [nop,nop,TS val 1276808258 ecr 65134438], length 1314
08:51:17.929928 IP 52.223.246.10.1935 > 10.8.3.4.44172: Flags [.], ack 58417, win 126, options [nop,nop,TS val 65134515 ecr 1276807867], length 0
08:51:17.961518 IP 10.8.3.4.44172 > 52.223.246.10.1935: Flags [.], seq 69358:70672, ack 1, win 501, options [nop,nop,TS val 1276808301 ecr 65134515], length 1314
08:51:18.025552 IP 10.8.3.4.44172 > 52.223.246.10.1935: Flags [.], seq 70672:71986, ack 1, win 501, options [nop,nop,TS val 1276808365 ecr 65134515], length 1314
08:51:18.035914 IP 52.223.246.10.1935 > 10.8.3.4.44172: Flags [.], ack 61045, win 126, options [nop,nop,TS val 65134621 ecr 1276807938], length 0
08:51:18.060389 IP 10.8.3.4.44172 > 52.223.246.10.1935: Flags [.], seq 71986:73300, ack 1, win 501, options [nop,nop,TS val 1276808400 ecr 65134621], length 1314
08:51:18.093679 IP 10.8.3.4.44172 > 52.223.246.10.1935: Flags [.], seq 73300:74614, ack 1, win 501, options [nop,nop,TS val 1276808433 ecr 65134621], length 1314
08:51:18.101276 IP 52.223.246.10.1935 > 10.8.3.4.44172: Flags [.], ack 63673, win 126, options [nop,nop,TS val 65134687 ecr 1276808023], length 0
08:51:18.153843 IP 10.8.3.4.44172 > 52.223.246.10.1935: Flags [.], seq 74614:75928, ack 1, win 501, options [nop,nop,TS val 1276808493 ecr 65134687], length 1314
08:51:18.191101 IP 10.8.3.4.44172 > 52.223.246.10.1935: Flags [.], seq 75928:77242, ack 1, win 501, options [nop,nop,TS val 1276808530 ecr 65134687], length 1314
08:51:18.198100 IP 52.223.246.10.1935 > 10.8.3.4.44172: Flags [.], ack 66301, win 126, options [nop,nop,TS val 65134784 ecr 1276808130], length 0
08:51:18.223626 IP 10.8.3.4.44172 > 52.223.246.10.1935: Flags [.], seq 77242:78556, ack 1, win 501, options [nop,nop,TS val 1276808563 ecr 65134784], length 1314
08:51:18.226881 IP 52.223.246.10.1935 > 10.8.3.4.44172: Flags [.], ack 66730, win 126, options [nop,nop,TS val 65134812 ecr 1276808192], length 0
08:51:18.226890 IP 10.8.3.4.44172 > 52.223.246.10.1935: Flags [P.], seq 78556:78602, ack 1, win 501, options [nop,nop,TS val 1276808566 ecr 65134812], length 46
08:51:18.281247 IP 10.8.3.4.44172 > 52.223.246.10.1935: Flags [.], seq 78602:79916, ack 1, win 501, options [nop,nop,TS val 1276808621 ecr 65134812], length 1314
08:51:18.293511 IP 52.223.246.10.1935 > 10.8.3.4.44172: Flags [.], ack 69358, win 126, options [nop,nop,TS val 65134879 ecr 1276808234], length 0
08:51:18.324254 IP 10.8.3.4.44172 > 52.223.246.10.1935: Flags [.], seq 79916:81230, ack 1, win 501, options [nop,nop,TS val 1276808664 ecr 65134879], length 1314
08:51:18.357016 IP 10.8.3.4.44172 > 52.223.246.10.1935: Flags [.], seq 81230:82544, ack 1, win 501, options [nop,nop,TS val 1276808696 ecr 65134879], length 1314
08:51:18.400212 IP 52.223.246.10.1935 > 10.8.3.4.44172: Flags [.], ack 71986, win 126, options [nop,nop,TS val 65134986 ecr 1276808301], length 0
08:51:18.427877 IP 10.8.3.4.44172 > 52.223.246.10.1935: Flags [.], seq 82544:83858, ack 1, win 501, options [nop,nop,TS val 1276808767 ecr 65134986], length 1314
08:51:18.452173 IP 10.8.3.4.44172 > 52.223.246.10.1935: Flags [.], seq 83858:85172, ack 1, win 501, options [nop,nop,TS val 1276808791 ecr 65134986], length 1314
08:51:18.468841 IP 52.223.246.10.1935 > 10.8.3.4.44172: Flags [.], ack 74614, win 126, options [nop,nop,TS val 65135054 ecr 1276808400], length 0
08:51:18.490827 IP 10.8.3.4.44172 > 52.223.246.10.1935: Flags [.], seq 85172:86486, ack 1, win 501, options [nop,nop,TS val 1276808830 ecr 65135054], length 1314
08:51:18.558684 IP 10.8.3.4.44172 > 52.223.246.10.1935: Flags [.], seq 86486:87800, ack 1, win 501, options [nop,nop,TS val 1276808898 ecr 65135054], length 1314
08:51:18.565625 IP 52.223.246.10.1935 > 10.8.3.4.44172: Flags [.], ack 77242, win 126, options [nop,nop,TS val 65135151 ecr 1276808493], length 0
08:51:18.594596 IP 10.8.3.4.44172 > 52.223.246.10.1935: Flags [.], seq 87800:89114, ack 1, win 501, options [nop,nop,TS val 1276808934 ecr 65135151], length 1314
08:51:18.601686 IP 52.223.246.10.1935 > 10.8.3.4.44172: Flags [.], ack 78602, win 126, options [nop,nop,TS val 65135187 ecr 1276808563], length 0
08:51:18.601698 IP 10.8.3.4.44172 > 52.223.246.10.1935: Flags [P.], seq 89114:89631, ack 1, win 501, options [nop,nop,TS val 1276808941 ecr 65135187], length 517
08:51:18.658446 IP 10.8.3.4.44172 > 52.223.246.10.1935: Flags [.], seq 89631:90945, ack 1, win 501, options [nop,nop,TS val 1276808998 ecr 65135187], length 1314
08:51:18.686692 IP 10.8.3.4.44172 > 52.223.246.10.1935: Flags [.], seq 90945:92259, ack 1, win 501, options [nop,nop,TS val 1276809026 ecr 65135187], length 1314
08:51:18.699175 IP 52.223.246.10.1935 > 10.8.3.4.44172: Flags [.], ack 81230, win 126, options [nop,nop,TS val 65135285 ecr 1276808621], length 0
08:51:18.729633 IP 10.8.3.4.44172 > 52.223.246.10.1935: Flags [.], seq 92259:93573, ack 1, win 501, options [nop,nop,TS val 1276809069 ecr 65135285], length 1314
08:51:18.792945 IP 10.8.3.4.44172 > 52.223.246.10.1935: Flags [.], seq 93573:94887, ack 1, win 501, options [nop,nop,TS val 1276809132 ecr 65135285], length 1314
08:51:18.802758 IP 52.223.246.10.1935 > 10.8.3.4.44172: Flags [.], ack 83858, win 126, options [nop,nop,TS val 65135388 ecr 1276808696], length 0
08:51:18.814975 IP 10.8.3.4.44172 > 52.223.246.10.1935: Flags [.], seq 94887:96201, ack 1, win 501, options [nop,nop,TS val 1276809154 ecr 65135388], length 1314
08:51:18.859539 IP 10.8.3.4.44172 > 52.223.246.10.1935: Flags [.], seq 96201:97515, ack 1, win 501, options [nop,nop,TS val 1276809199 ecr 65135388], length 1314
08:51:18.865294 IP 52.223.246.10.1935 > 10.8.3.4.44172: Flags [.], ack 86486, win 126, options [nop,nop,TS val 65135451 ecr 1276808791], length 0
08:51:18.921659 IP 10.8.3.4.44172 > 52.223.246.10.1935: Flags [.], seq 97515:98829, ack 1, win 501, options [nop,nop,TS val 1276809261 ecr 65135451], length 1314
08:51:18.958474 IP 10.8.3.4.44172 > 52.223.246.10.1935: Flags [.], seq 98829:100143, ack 1, win 501, options [nop,nop,TS val 1276809298 ecr 65135451], length 1314
08:51:18.969574 IP 52.223.246.10.1935 > 10.8.3.4.44172: Flags [.], ack 89114, win 126, options [nop,nop,TS val 65135555 ecr 1276808898], length 0
08:51:18.976294 IP 52.223.246.10.1935 > 10.8.3.4.44172: Flags [.], ack 89631, win 126, options [nop,nop,TS val 65135562 ecr 1276808941], length 0
08:51:18.976312 IP 10.8.3.4.44172 > 52.223.246.10.1935: Flags [P.], seq 100143:100566, ack 1, win 501, options [nop,nop,TS val 1276809316 ecr 65135562], length 423
08:51:19.027936 IP 10.8.3.4.44172 > 52.223.246.10.1935: Flags [.], seq 100566:101880, ack 1, win 501, options [nop,nop,TS val 1276809367 ecr 65135562], length 1314
08:51:19.049939 IP 10.8.3.4.44172 > 52.223.246.10.1935: Flags [.], seq 101880:103194, ack 1, win 501, options [nop,nop,TS val 1276809389 ecr 65135562], length 1314
08:51:19.061515 IP 52.223.246.10.1935 > 10.8.3.4.44172: Flags [.], ack 92259, win 126, options [nop,nop,TS val 65135647 ecr 1276808998], length 0
08:51:19.094590 IP 10.8.3.4.44172 > 52.223.246.10.1935: Flags [.], seq 103194:104508, ack 1, win 501, options [nop,nop,TS val 1276809434 ecr 65135647], length 1314
08:51:19.157442 IP 10.8.3.4.44172 > 52.223.246.10.1935: Flags [.], seq 104508:105822, ack 1, win 501, options [nop,nop,TS val 1276809497 ecr 65135647], length 1314
08:51:19.167561 IP 52.223.246.10.1935 > 10.8.3.4.44172: Flags [.], ack 94887, win 126, options [nop,nop,TS val 65135753 ecr 1276809069], length 0
08:51:19.191796 IP 10.8.3.4.44172 > 52.223.246.10.1935: Flags [.], seq 105822:107136, ack 1, win 501, options [nop,nop,TS val 1276809531 ecr 65135753], length 1314
08:51:19.223871 IP 10.8.3.4.44172 > 52.223.246.10.1935: Flags [.], seq 107136:108450, ack 1, win 501, options [nop,nop,TS val 1276809563 ecr 65135753], length 1314
08:51:19.234234 IP 52.223.246.10.1935 > 10.8.3.4.44172: Flags [.], ack 97515, win 126, options [nop,nop,TS val 65135820 ecr 1276809154], length 0
08:51:19.284801 IP 10.8.3.4.44172 > 52.223.246.10.1935: Flags [.], seq 108450:109764, ack 1, win 501, options [nop,nop,TS val 1276809624 ecr 65135820], length 1314
08:51:19.325951 IP 10.8.3.4.44172 > 52.223.246.10.1935: Flags [.], seq 109764:111078, ack 1, win 501, options [nop,nop,TS val 1276809665 ecr 65135820], length 1314
08:51:19.333358 IP 52.223.246.10.1935 > 10.8.3.4.44172: Flags [.], ack 100143, win 126, options [nop,nop,TS val 65135919 ecr 1276809261], length 0
08:51:19.350918 IP 52.223.246.10.1935 > 10.8.3.4.44172: Flags [.], ack 100566, win 126, options [nop,nop,TS val 65135936 ecr 1276809316], length 0
08:51:19.350945 IP 10.8.3.4.44172 > 52.223.246.10.1935: Flags [P.], seq 111078:112346, ack 1, win 501, options [nop,nop,TS val 1276809690 ecr 65135936], length 1268
08:51:19.423616 IP 10.8.3.4.44172 > 52.223.246.10.1935: Flags [.], seq 112346:113660, ack 1, win 501, options [nop,nop,TS val 1276809763 ecr 65135936], length 1314
08:51:19.424716 IP 52.223.246.10.1935 > 10.8.3.4.44172: Flags [.], ack 103194, win 126, options [nop,nop,TS val 65136010 ecr 1276809367], length 0
08:51:19.455163 IP 10.8.3.4.44172 > 52.223.246.10.1935: Flags [.], seq 113660:114974, ack 1, win 501, options [nop,nop,TS val 1276809794 ecr 65136010], length 1314
08:51:19.491085 IP 10.8.3.4.44172 > 52.223.246.10.1935: Flags [.], seq 114974:116288, ack 1, win 501, options [nop,nop,TS val 1276809830 ecr 65136010], length 1314
08:51:19.532216 IP 52.223.246.10.1935 > 10.8.3.4.44172: Flags [.], ack 105822, win 126, options [nop,nop,TS val 65136118 ecr 1276809434], length 0
08:51:19.560973 IP 10.8.3.4.44172 > 52.223.246.10.1935: Flags [.], seq 116288:117602, ack 1, win 501, options [nop,nop,TS val 1276809900 ecr 65136118], length 1314
08:51:19.583360 IP 10.8.3.4.44172 > 52.223.246.10.1935: Flags [.], seq 117602:118916, ack 1, win 501, options [nop,nop,TS val 1276809923 ecr 65136118], length 1314
08:51:19.598469 IP 52.223.246.10.1935 > 10.8.3.4.44172: Flags [.], ack 108450, win 126, options [nop,nop,TS val 65136184 ecr 1276809531], length 0
08:51:19.623854 IP 10.8.3.4.44172 > 52.223.246.10.1935: Flags [.], seq 118916:120230, ack 1, win 501, options [nop,nop,TS val 1276809963 ecr 65136184], length 1314
08:51:19.689830 IP 10.8.3.4.44172 > 52.223.246.10.1935: Flags [.], seq 120230:121544, ack 1, win 501, options [nop,nop,TS val 1276810029 ecr 65136184], length 1314
08:51:19.700668 IP 52.223.246.10.1935 > 10.8.3.4.44172: Flags [.], ack 111078, win 126, options [nop,nop,TS val 65136286 ecr 1276809624], length 0
08:51:19.725925 IP 52.223.246.10.1935 > 10.8.3.4.44172: Flags [.], ack 112346, win 126, options [nop,nop,TS val 65136311 ecr 1276809690], length 0
08:51:19.726007 IP 10.8.3.4.44172 > 52.223.246.10.1935: Flags [P.], seq 121544:122527, ack 1, win 501, options [nop,nop,TS val 1276810065 ecr 65136311], length 983
08:51:19.754284 IP 10.8.3.4.44172 > 52.223.246.10.1935: Flags [.], seq 122527:123841, ack 1, win 501, options [nop,nop,TS val 1276810094 ecr 65136311], length 1314
08:51:19.794683 IP 10.8.3.4.44172 > 52.223.246.10.1935: Flags [.], seq 123841:125155, ack 1, win 501, options [nop,nop,TS val 1276810134 ecr 65136311], length 1314
08:51:19.829868 IP 52.223.246.10.1935 > 10.8.3.4.44172: Flags [.], ack 114974, win 126, options [nop,nop,TS val 65136415 ecr 1276809763], length 0
08:51:19.839622 IP 10.8.3.4.44172 > 52.223.246.10.1935: Flags [.], seq 125155:126469, ack 1, win 501, options [nop,nop,TS val 1276810179 ecr 65136415], length 1314
08:51:19.882193 IP 10.8.3.4.44172 > 52.223.246.10.1935: Flags [.], seq 126469:127783, ack 1, win 501, options [nop,nop,TS val 1276810222 ecr 65136415], length 1314
08:51:19.925231 IP 10.8.3.4.44172 > 52.223.246.10.1935: Flags [.], seq 127783:129097, ack 1, win 501, options [nop,nop,TS val 1276810264 ecr 65136415], length 1314
08:51:19.935766 IP 52.223.246.10.1935 > 10.8.3.4.44172: Flags [.], ack 117602, win 126, options [nop,nop,TS val 65136521 ecr 1276809830], length 0
08:51:19.967402 IP 10.8.3.4.44172 > 52.223.246.10.1935: Flags [.], seq 129097:130411, ack 1, win 501, options [nop,nop,TS val 1276810307 ecr 65136521], length 1314
08:51:20.001735 IP 52.223.246.10.1935 > 10.8.3.4.44172: Flags [.], ack 120230, win 126, options [nop,nop,TS val 65136584 ecr 1276809923], length 0
08:51:20.028041 IP 10.8.3.4.44172 > 52.223.246.10.1935: Flags [.], seq 130411:131725, ack 1, win 501, options [nop,nop,TS val 1276810367 ecr 65136584], length 1314
08:51:20.053015 IP 10.8.3.4.44172 > 52.223.246.10.1935: Flags [.], seq 131725:133039, ack 1, win 501, options [nop,nop,TS val 1276810392 ecr 65136584], length 1314
08:51:20.096059 IP 10.8.3.4.44172 > 52.223.246.10.1935: Flags [.], seq 133039:134353, ack 1, win 501, options [nop,nop,TS val 1276810435 ecr 65136584], length 1314
08:51:20.100782 IP 52.223.246.10.1935 > 10.8.3.4.44172: Flags [.], ack 122527, win 126, options [nop,nop,TS val 65136686 ecr 1276810029], length 0
08:51:20.100816 IP 10.8.3.4.44172 > 52.223.246.10.1935: Flags [P.], seq 134353:134399, ack 1, win 501, options [nop,nop,TS val 1276810440 ecr 65136686], length 46
08:51:20.160467 IP 10.8.3.4.44172 > 52.223.246.10.1935: Flags [.], seq 134399:135713, ack 1, win 501, options [nop,nop,TS val 1276810500 ecr 65136686], length 1314
08:51:20.169527 IP 52.223.246.10.1935 > 10.8.3.4.44172: Flags [.], ack 125155, win 126, options [nop,nop,TS val 65136755 ecr 1276810094], length 0
08:51:20.191595 IP 10.8.3.4.44172 > 52.223.246.10.1935: Flags [.], seq 135713:137027, ack 1, win 501, options [nop,nop,TS val 1276810531 ecr 65136755], length 1314
08:51:20.227812 IP 10.8.3.4.44172 > 52.223.246.10.1935: Flags [.], seq 137027:138341, ack 1, win 501, options [nop,nop,TS val 1276810567 ecr 65136755], length 1314
08:51:20.259437 IP 52.223.246.10.1935 > 10.8.3.4.44172: Flags [.], ack 127783, win 126, options [nop,nop,TS val 65136842 ecr 1276810179], length 0
08:51:20.288821 IP 10.8.3.4.44172 > 52.223.246.10.1935: Flags [.], seq 138341:139655, ack 1, win 501, options [nop,nop,TS val 1276810628 ecr 65136842], length 1314
08:51:20.327619 IP 10.8.3.4.44172 > 52.223.246.10.1935: Flags [.], seq 139655:140969, ack 1, win 501, options [nop,nop,TS val 1276810667 ecr 65136842], length 1314
08:51:20.342242 IP 52.223.246.10.1935 > 10.8.3.4.44172: Flags [.], ack 130411, win 126, options [nop,nop,TS val 65136928 ecr 1276810264], length 0
08:51:20.361032 IP 10.8.3.4.44172 > 52.223.246.10.1935: Flags [.], seq 140969:142283, ack 1, win 501, options [nop,nop,TS val 1276810700 ecr 65136928], length 1314
08:51:20.417149 IP 10.8.3.4.44172 > 52.223.246.10.1935: Flags [.], seq 142283:143597, ack 1, win 501, options [nop,nop,TS val 1276810756 ecr 65136928], length 1314
08:51:20.427880 IP 52.223.246.10.1935 > 10.8.3.4.44172: Flags [.], ack 133039, win 126, options [nop,nop,TS val 65137013 ecr 1276810367], length 0
08:51:20.459078 IP 10.8.3.4.44172 > 52.223.246.10.1935: Flags [.], seq 143597:144911, ack 1, win 501, options [nop,nop,TS val 1276810798 ecr 65137013], length 1314
08:51:20.475404 IP 52.223.246.10.1935 > 10.8.3.4.44172: Flags [.], ack 134399, win 126, options [nop,nop,TS val 65137061 ecr 1276810435], length 0
08:51:20.475445 IP 10.8.3.4.44172 > 52.223.246.10.1935: Flags [P.], seq 144911:145341, ack 1, win 501, options [nop,nop,TS val 1276810815 ecr 65137061], length 430
08:51:20.524203 IP 10.8.3.4.44172 > 52.223.246.10.1935: Flags [.], seq 145341:146655, ack 1, win 501, options [nop,nop,TS val 1276810863 ecr 65137061], length 1314
08:51:20.560402 IP 10.8.3.4.44172 > 52.223.246.10.1935: Flags [.], seq 146655:147969, ack 1, win 501, options [nop,nop,TS val 1276810900 ecr 65137061], length 1314
08:51:20.566386 IP 52.223.246.10.1935 > 10.8.3.4.44172: Flags [.], ack 137027, win 126, options [nop,nop,TS val 65137152 ecr 1276810500], length 0
08:51:20.594706 IP 10.8.3.4.44172 > 52.223.246.10.1935: Flags [.], seq 147969:149283, ack 1, win 501, options [nop,nop,TS val 1276810934 ecr 65137152], length 1314
08:51:20.652525 IP 10.8.3.4.44172 > 52.223.246.10.1935: Flags [.], seq 149283:150597, ack 1, win 501, options [nop,nop,TS val 1276810992 ecr 65137152], length 1314
08:51:20.663507 IP 52.223.246.10.1935 > 10.8.3.4.44172: Flags [.], ack 139655, win 126, options [nop,nop,TS val 65137249 ecr 1276810567], length 0
08:51:20.690895 IP 10.8.3.4.44172 > 52.223.246.10.1935: Flags [.], seq 150597:151911, ack 1, win 501, options [nop,nop,TS val 1276811030 ecr 65137249], length 1314
08:51:20.724803 IP 10.8.3.4.44172 > 52.223.246.10.1935: Flags [.], seq 151911:153225, ack 1, win 501, options [nop,nop,TS val 1276811064 ecr 65137249], length 1314
08:51:20.735869 IP 52.223.246.10.1935 > 10.8.3.4.44172: Flags [.], ack 142283, win 126, options [nop,nop,TS val 65137321 ecr 1276810667], length 0
08:51:20.794414 IP 10.8.3.4.44172 > 52.223.246.10.1935: Flags [.], seq 153225:154539, ack 1, win 501, options [nop,nop,TS val 1276811134 ecr 65137321], length 1314
08:51:20.823514 IP 10.8.3.4.44172 > 52.223.246.10.1935: Flags [.], seq 154539:155853, ack 1, win 501, options [nop,nop,TS val 1276811163 ecr 65137321], length 1314
08:51:20.834147 IP 52.223.246.10.1935 > 10.8.3.4.44172: Flags [.], ack 144911, win 126, options [nop,nop,TS val 65137419 ecr 1276810756], length 0
08:51:20.850141 IP 52.223.246.10.1935 > 10.8.3.4.44172: Flags [.], ack 145341, win 126, options [nop,nop,TS val 65137436 ecr 1276810815], length 0
08:51:20.850163 IP 10.8.3.4.44172 > 52.223.246.10.1935: Flags [P.], seq 155853:156362, ack 1, win 501, options [nop,nop,TS val 1276811189 ecr 65137436], length 509
08:51:20.887643 IP 10.8.3.4.44172 > 52.223.246.10.1935: Flags [.], seq 156362:157676, ack 1, win 501, options [nop,nop,TS val 1276811227 ecr 65137436], length 1314
08:51:20.926495 IP 10.8.3.4.44172 > 52.223.246.10.1935: Flags [.], seq 157676:158990, ack 1, win 501, options [nop,nop,TS val 1276811266 ecr 65137436], length 1314
08:51:20.935156 IP 52.223.246.10.1935 > 10.8.3.4.44172: Flags [.], ack 147969, win 126, options [nop,nop,TS val 65137520 ecr 1276810863], length 0
08:51:20.973203 IP 10.8.3.4.44172 > 52.223.246.10.1935: Flags [.], seq 158990:160304, ack 1, win 501, options [nop,nop,TS val 1276811313 ecr 65137520], length 1314
08:51:21.023799 IP 10.8.3.4.44172 > 52.223.246.10.1935: Flags [.], seq 160304:161618, ack 1, win 501, options [nop,nop,TS val 1276811363 ecr 65137520], length 1314
08:51:21.027546 IP 52.223.246.10.1935 > 10.8.3.4.44172: Flags [.], ack 150597, win 126, options [nop,nop,TS val 65137613 ecr 1276810934], length 0
08:51:21.057168 IP 10.8.3.4.44172 > 52.223.246.10.1935: Flags [.], seq 161618:162932, ack 1, win 501, options [nop,nop,TS val 1276811396 ecr 65137613], length 1314
08:51:21.099679 IP 52.223.246.10.1935 > 10.8.3.4.44172: Flags [.], ack 153225, win 126, options [nop,nop,TS val 65137685 ecr 1276811030], length 0
08:51:21.101156 IP 10.8.3.4.44172 > 52.223.246.10.1935: Flags [.], seq 162932:164246, ack 1, win 501, options [nop,nop,TS val 1276811440 ecr 65137685], length 1314
08:51:21.160460 IP 10.8.3.4.44172 > 52.223.246.10.1935: Flags [.], seq 164246:165560, ack 1, win 501, options [nop,nop,TS val 1276811500 ecr 65137685], length 1314
08:51:21.186755 IP 10.8.3.4.44172 > 52.223.246.10.1935: Flags [.], seq 165560:166874, ack 1, win 501, options [nop,nop,TS val 1276811526 ecr 65137685], length 1314
08:51:21.198364 IP 52.223.246.10.1935 > 10.8.3.4.44172: Flags [.], ack 155853, win 126, options [nop,nop,TS val 65137784 ecr 1276811134], length 0
08:51:21.224976 IP 52.223.246.10.1935 > 10.8.3.4.44172: Flags [.], ack 156362, win 126, options [nop,nop,TS val 65137810 ecr 1276811189], length 0
08:51:21.225000 IP 10.8.3.4.44172 > 52.223.246.10.1935: Flags [P.], seq 166874:167304, ack 1, win 501, options [nop,nop,TS val 1276811564 ecr 65137810], length 430
08:51:21.259040 IP 10.8.3.4.44172 > 52.223.246.10.1935: Flags [.], seq 167304:168618, ack 1, win 501, options [nop,nop,TS val 1276811598 ecr 65137810], length 1314
08:51:21.290444 IP 10.8.3.4.44172 > 52.223.246.10.1935: Flags [.], seq 168618:169932, ack 1, win 501, options [nop,nop,TS val 1276811630 ecr 65137810], length 1314
08:51:21.301552 IP 52.223.246.10.1935 > 10.8.3.4.44172: Flags [.], ack 158990, win 126, options [nop,nop,TS val 65137887 ecr 1276811227], length 0
08:51:21.335519 IP 10.8.3.4.44172 > 52.223.246.10.1935: Flags [.], seq 169932:171246, ack 1, win 501, options [nop,nop,TS val 1276811675 ecr 65137887], length 1314
08:51:21.394491 IP 10.8.3.4.44172 > 52.223.246.10.1935: Flags [.], seq 171246:172560, ack 1, win 501, options [nop,nop,TS val 1276811734 ecr 65137887], length 1314
08:51:21.398343 IP 52.223.246.10.1935 > 10.8.3.4.44172: Flags [.], ack 161618, win 126, options [nop,nop,TS val 65137984 ecr 1276811313], length 0
08:51:21.421390 IP 10.8.3.4.44172 > 52.223.246.10.1935: Flags [.], seq 172560:173874, ack 1, win 501, options [nop,nop,TS val 1276811761 ecr 65137984], length 1314
08:51:21.464305 IP 10.8.3.4.44172 > 52.223.246.10.1935: Flags [.], seq 173874:175188, ack 1, win 501, options [nop,nop,TS val 1276811804 ecr 65137984], length 1314
08:51:21.476421 IP 52.223.246.10.1935 > 10.8.3.4.44172: Flags [.], ack 164246, win 126, options [nop,nop,TS val 65138062 ecr 1276811396], length 0
08:51:21.525327 IP 10.8.3.4.44172 > 52.223.246.10.1935: Flags [.], seq 175188:176502, ack 1, win 501, options [nop,nop,TS val 1276811865 ecr 65138062], length 1314
08:51:21.557107 IP 10.8.3.4.44172 > 52.223.246.10.1935: Flags [.], seq 176502:177816, ack 1, win 501, options [nop,nop,TS val 1276811896 ecr 65138062], length 1314
08:51:21.561523 IP 52.223.246.10.1935 > 10.8.3.4.44172: Flags [.], ack 166874, win 126, options [nop,nop,TS val 65138147 ecr 1276811500], length 0
08:51:21.592276 IP 10.8.3.4.44172 > 52.223.246.10.1935: Flags [.], seq 177816:179130, ack 1, win 501, options [nop,nop,TS val 1276811932 ecr 65138147], length 1314
08:51:21.599551 IP 52.223.246.10.1935 > 10.8.3.4.44172: Flags [.], ack 167304, win 126, options [nop,nop,TS val 65138185 ecr 1276811564], length 0
08:51:21.599579 IP 10.8.3.4.44172 > 52.223.246.10.1935: Flags [P.], seq 179130:179168, ack 1, win 501, options [nop,nop,TS val 1276811939 ecr 65138185], length 38
08:51:21.656658 IP 10.8.3.4.44172 > 52.223.246.10.1935: Flags [.], seq 179168:180482, ack 1, win 501, options [nop,nop,TS val 1276811996 ecr 65138185], length 1314
08:51:21.665188 IP 52.223.246.10.1935 > 10.8.3.4.44172: Flags [.], ack 169932, win 126, options [nop,nop,TS val 65138250 ecr 1276811598], length 0
08:51:21.694406 IP 10.8.3.4.44172 > 52.223.246.10.1935: Flags [.], seq 180482:181796, ack 1, win 501, options [nop,nop,TS val 1276812034 ecr 65138250], length 1314
08:51:21.725042 IP 10.8.3.4.44172 > 52.223.246.10.1935: Flags [.], seq 181796:183110, ack 1, win 501, options [nop,nop,TS val 1276812064 ecr 65138250], length 1314
08:51:21.769168 IP 52.223.246.10.1935 > 10.8.3.4.44172: Flags [.], ack 172560, win 126, options [nop,nop,TS val 65138355 ecr 1276811675], length 0
08:51:21.791862 IP 10.8.3.4.44172 > 52.223.246.10.1935: Flags [.], seq 183110:184424, ack 1, win 501, options [nop,nop,TS val 1276812131 ecr 65138355], length 1314
08:51:21.827564 IP 10.8.3.4.44172 > 52.223.246.10.1935: Flags [.], seq 184424:185738, ack 1, win 501, options [nop,nop,TS val 1276812167 ecr 65138355], length 1314
08:51:21.839221 IP 52.223.246.10.1935 > 10.8.3.4.44172: Flags [.], ack 175188, win 126, options [nop,nop,TS val 65138425 ecr 1276811761], length 0
08:51:21.860913 IP 10.8.3.4.44172 > 52.223.246.10.1935: Flags [.], seq 185738:187052, ack 1, win 501, options [nop,nop,TS val 1276812200 ecr 65138425], length 1314
08:51:21.928077 IP 10.8.3.4.44172 > 52.223.246.10.1935: Flags [.], seq 187052:188366, ack 1, win 501, options [nop,nop,TS val 1276812267 ecr 65138425], length 1314
08:51:21.931806 IP 52.223.246.10.1935 > 10.8.3.4.44172: Flags [.], ack 177816, win 126, options [nop,nop,TS val 65138517 ecr 1276811865], length 0
08:51:21.956434 IP 10.8.3.4.44172 > 52.223.246.10.1935: Flags [.], seq 188366:189680, ack 1, win 501, options [nop,nop,TS val 1276812296 ecr 65138517], length 1314
08:51:21.974141 IP 52.223.246.10.1935 > 10.8.3.4.44172: Flags [.], ack 179168, win 126, options [nop,nop,TS val 65138560 ecr 1276811932], length 0
08:51:21.974165 IP 10.8.3.4.44172 > 52.223.246.10.1935: Flags [P.], seq 189680:190109, ack 1, win 501, options [nop,nop,TS val 1276812313 ecr 65138560], length 429
08:51:22.020296 IP 10.8.3.4.44172 > 52.223.246.10.1935: Flags [.], seq 190109:191423, ack 1, win 501, options [nop,nop,TS val 1276812360 ecr 65138560], length 1314
08:51:22.059308 IP 10.8.3.4.44172 > 52.223.246.10.1935: Flags [.], seq 191423:192737, ack 1, win 501, options [nop,nop,TS val 1276812399 ecr 65138560], length 1314
08:51:22.069367 IP 52.223.246.10.1935 > 10.8.3.4.44172: Flags [.], ack 181796, win 126, options [nop,nop,TS val 65138655 ecr 1276811996], length 0
08:51:22.092478 IP 10.8.3.4.44172 > 52.223.246.10.1935: Flags [.], seq 192737:194051, ack 1, win 501, options [nop,nop,TS val 1276812432 ecr 65138655], length 1314
08:51:22.159123 IP 10.8.3.4.44172 > 52.223.246.10.1935: Flags [.], seq 194051:195365, ack 1, win 501, options [nop,nop,TS val 1276812498 ecr 65138655], length 1314
08:51:22.167785 IP 52.223.246.10.1935 > 10.8.3.4.44172: Flags [.], ack 184424, win 126, options [nop,nop,TS val 65138752 ecr 1276812064], length 0
08:51:22.191072 IP 10.8.3.4.44172 > 52.223.246.10.1935: Flags [.], seq 195365:196679, ack 1, win 501, options [nop,nop,TS val 1276812530 ecr 65138752], length 1314
08:51:22.223681 IP 10.8.3.4.44172 > 52.223.246.10.1935: Flags [.], seq 196679:197993, ack 1, win 501, options [nop,nop,TS val 1276812563 ecr 65138752], length 1314
08:51:22.236364 IP 52.223.246.10.1935 > 10.8.3.4.44172: Flags [.], ack 187052, win 126, options [nop,nop,TS val 65138822 ecr 1276812167], length 0
08:51:22.294698 IP 10.8.3.4.44172 > 52.223.246.10.1935: Flags [.], seq 197993:199307, ack 1, win 501, options [nop,nop,TS val 1276812634 ecr 65138822], length 1314
08:51:22.328038 IP 10.8.3.4.44172 > 52.223.246.10.1935: Flags [.], seq 199307:200621, ack 1, win 501, options [nop,nop,TS val 1276812667 ecr 65138822], length 1314
08:51:22.331148 IP 52.223.246.10.1935 > 10.8.3.4.44172: Flags [.], ack 189680, win 126, options [nop,nop,TS val 65138917 ecr 1276812267], length 0
08:51:22.348803 IP 52.223.246.10.1935 > 10.8.3.4.44172: Flags [.], ack 190109, win 126, options [nop,nop,TS val 65138934 ecr 1276812313], length 0
08:51:22.348836 IP 10.8.3.4.44172 > 52.223.246.10.1935: Flags [P.], seq 200621:201129, ack 1, win 501, options [nop,nop,TS val 1276812688 ecr 65138934], length 508
