03:35:02.733708 IP 52.223.202.122.1935 > 10.8.2.5.35986: Flags [.], ack 1460763458, win 135, options [nop,nop,TS val 476280433 ecr 4144210337], length 0
03:35:02.754956 IP 10.8.2.5.35986 > 52.223.202.122.1935: Flags [.], seq 14983:16297, ack 0, win 501, options [nop,nop,TS val 4144210904 ecr 476280433], length 1314
03:35:02.817849 IP 10.8.2.5.35986 > 52.223.202.122.1935: Flags [.], seq 16297:17611, ack 0, win 501, options [nop,nop,TS val 4144210967 ecr 476280433], length 1314
03:35:02.820656 IP 52.223.202.122.1935 > 10.8.2.5.35986: Flags [.], ack 1315, win 135, options [nop,nop,TS val 476280520 ecr 4144210400], length 0
03:35:02.853607 IP 10.8.2.5.35986 > 52.223.202.122.1935: Flags [.], seq 17611:18925, ack 0, win 501, options [nop,nop,TS val 4144211003 ecr 476280520], length 1314
03:35:02.866781 IP 52.223.202.122.1935 > 10.8.2.5.35986: Flags [.], ack 3943, win 135, options [nop,nop,TS val 476280566 ecr 4144210468], length 0
03:35:02.888931 IP 10.8.2.5.35986 > 52.223.202.122.1935: Flags [.], seq 18925:20239, ack 0, win 501, options [nop,nop,TS val 4144211038 ecr 476280566], length 1314
03:35:02.955136 IP 10.8.2.5.35986 > 52.223.202.122.1935: Flags [.], seq 20239:21553, ack 0, win 501, options [nop,nop,TS val 4144211104 ecr 476280566], length 1314
03:35:02.965350 IP 52.223.202.122.1935 > 10.8.2.5.35986: Flags [.], ack 6571, win 135, options [nop,nop,TS val 476280665 ecr 4144210537], length 0
03:35:02.988333 IP 10.8.2.5.35986 > 52.223.202.122.1935: Flags [.], seq 21553:22867, ack 0, win 501, options [nop,nop,TS val 4144211137 ecr 476280665], length 1314
03:35:03.021333 IP 10.8.2.5.35986 > 52.223.202.122.1935: Flags [.], seq 22867:24181, ack 0, win 501, options [nop,nop,TS val 4144211170 ecr 476280665], length 1314
03:35:03.084588 IP 10.8.2.5.35986 > 52.223.202.122.1935: Flags [.], seq 24181:25495, ack 0, win 501, options [nop,nop,TS val 4144211234 ecr 476280733], length 1314
03:35:03.121653 IP 10.8.2.5.35986 > 52.223.202.122.1935: Flags [.], seq 25495:26809, ack 0, win 501, options [nop,nop,TS val 4144211271 ecr 476280733], length 1314
03:35:03.134014 IP 52.223.202.122.1935 > 10.8.2.5.35986: Flags [.], ack 11827, win 135, options [nop,nop,TS val 476280834 ecr 4144210735], length 0
03:35:03.147979 IP 52.223.202.122.1935 > 10.8.2.5.35986: Flags [.], ack 12355, win 135, options [nop,nop,TS val 476280848 ecr 4144210785], length 0
03:35:03.148012 IP 10.8.2.5.35986 > 52.223.202.122.1935: Flags [P.], seq 26809:27337, ack 0, win 501, options [nop,nop,TS val 4144211297 ecr 476280848], length 528
03:35:03.188459 IP 10.8.2.5.35986 > 52.223.202.122.1935: Flags [.], seq 27337:28651, ack 0, win 501, options [nop,nop,TS val 4144211337 ecr 476280848], length 1314
03:35:03.221892 IP 10.8.2.5.35986 > 52.223.202.122.1935: Flags [.], seq 28651:29965, ack 0, win 501, options [nop,nop,TS val 4144211371 ecr 476280848], length 1314
03:35:03.232980 IP 52.223.202.122.1935 > 10.8.2.5.35986: Flags [.], ack 14983, win 135, options [nop,nop,TS val 476280933 ecr 4144210836], length 0
03:35:03.262726 IP 10.8.2.5.35986 > 52.223.202.122.1935: Flags [.], seq 29965:31279, ack 0, win 501, options [nop,nop,TS val 4144211412 ecr 476280933], length 1314
03:35:03.321742 IP 10.8.2.5.35986 > 52.223.202.122.1935: Flags [.], seq 31279:32593, ack 0, win 501, options [nop,nop,TS val 4144211471 ecr 476280933], length 1314
03:35:03.329837 IP 52.223.202.122.1935 > 10.8.2.5.35986: Flags [.], ack 17611, win 135, options [nop,nop,TS val 476281029 ecr 4144210904], length 0
03:35:03.353484 IP 10.8.2.5.35986 > 52.223.202.122.1935: Flags [.], seq 32593:33907, ack 0, win 501, options [nop,nop,TS val 4144211502 ecr 476281029], length 1314
03:35:03.391314 IP 10.8.2.5.35986 > 52.223.202.122.1935: Flags [.], seq 33907:35221, ack 0, win 501, options [nop,nop,TS val 4144211540 ecr 476281029], length 1314
03:35:03.400759 IP 52.223.202.122.1935 > 10.8.2.5.35986: Flags [.], ack 20239, win 135, options [nop,nop,TS val 476281100 ecr 4144211003], length 0
03:35:03.455742 IP 10.8.2.5.35986 > 52.223.202.122.1935: Flags [.], seq 35221:36535, ack 0, win 501, options [nop,nop,TS val 4144211605 ecr 476281100], length 1314
03:35:03.489822 IP 10.8.2.5.35986 > 52.223.202.122.1935: Flags [.], seq 36535:37849, ack 0, win 501, options [nop,nop,TS val 4144211639 ecr 476281100], length 1314
03:35:03.500168 IP 52.223.202.122.1935 > 10.8.2.5.35986: Flags [.], ack 22867, win 135, options [nop,nop,TS val 476281200 ecr 4144211104], length 0
03:35:03.521940 IP 10.8.2.5.35986 > 52.223.202.122.1935: Flags [.], seq 37849:39163, ack 0, win 501, options [nop,nop,TS val 4144211671 ecr 476281200], length 1314
03:35:03.584386 IP 10.8.2.5.35986 > 52.223.202.122.1935: Flags [.], seq 39163:40477, ack 0, win 501, options [nop,nop,TS val 4144211733 ecr 476281200], length 1314
03:35:03.596319 IP 52.223.202.122.1935 > 10.8.2.5.35986: Flags [.], ack 25495, win 135, options [nop,nop,TS val 476281296 ecr 4144211170], length 0
03:35:03.619153 IP 10.8.2.5.35986 > 52.223.202.122.1935: Flags [.], seq 40477:41791, ack 0, win 501, options [nop,nop,TS val 4144211768 ecr 476281296], length 1314
03:35:03.655392 IP 10.8.2.5.35986 > 52.223.202.122.1935: Flags [.], seq 41791:43105, ack 0, win 501, options [nop,nop,TS val 4144211804 ecr 476281296], length 1314
03:35:03.659598 IP 52.223.202.122.1935 > 10.8.2.5.35986: Flags [.], ack 27337, win 135, options [nop,nop,TS val 476281359 ecr 4144211271], length 0
03:35:03.659632 IP 10.8.2.5.35986 > 52.223.202.122.1935: Flags [P.], seq 43105:43183, ack 0, win 501, options [nop,nop,TS val 4144211809 ecr 476281359], length 78
03:35:03.721631 IP 10.8.2.5.35986 > 52.223.202.122.1935: Flags [.], seq 43183:44497, ack 0, win 501, options [nop,nop,TS val 4144211871 ecr 476281359], length 1314
03:35:03.733628 IP 52.223.202.122.1935 > 10.8.2.5.35986: Flags [.], ack 29965, win 135, options [nop,nop,TS val 476281433 ecr 4144211337], length 0
03:35:03.755516 IP 10.8.2.5.35986 > 52.223.202.122.1935: Flags [.], seq 44497:45811, ack 0, win 501, options [nop,nop,TS val 4144211904 ecr 476281433], length 1314
03:35:03.788506 IP 10.8.2.5.35986 > 52.223.202.122.1935: Flags [.], seq 45811:47125, ack 0, win 501, options [nop,nop,TS val 4144211937 ecr 476281433], length 1314
03:35:03.833629 IP 52.223.202.122.1935 > 10.8.2.5.35986: Flags [.], ack 32593, win 135, options [nop,nop,TS val 476281533 ecr 4144211412], length 0
03:35:03.855392 IP 10.8.2.5.35986 > 52.223.202.122.1935: Flags [.], seq 47125:48439, ack 0, win 501, options [nop,nop,TS val 4144212004 ecr 476281533], length 1314
03:35:03.886282 IP 10.8.2.5.35986 > 52.223.202.122.1935: Flags [.], seq 48439:49753, ack 0, win 501, options [nop,nop,TS val 4144212035 ecr 476281533], length 1314
03:35:03.903164 IP 52.223.202.122.1935 > 10.8.2.5.35986: Flags [.], ack 35221, win 135, options [nop,nop,TS val 476281603 ecr 4144211502], length 0
03:35:03.921811 IP 10.8.2.5.35986 > 52.223.202.122.1935: Flags [.], seq 49753:51067, ack 0, win 501, options [nop,nop,TS val 4144212071 ecr 476281603], length 1314
03:35:03.990749 IP 10.8.2.5.35986 > 52.223.202.122.1935: Flags [.], seq 51067:52381, ack 0, win 501, options [nop,nop,TS val 4144212140 ecr 476281603], length 1314
03:35:04.001898 IP 52.223.202.122.1935 > 10.8.2.5.35986: Flags [.], ack 37849, win 135, options [nop,nop,TS val 476281701 ecr 4144211605], length 0
03:35:04.017956 IP 10.8.2.5.35986 > 52.223.202.122.1935: Flags [.], seq 52381:53695, ack 0, win 501, options [nop,nop,TS val 4144212167 ecr 476281701], length 1314
03:35:04.054585 IP 10.8.2.5.35986 > 52.223.202.122.1935: Flags [.], seq 53695:55009, ack 0, win 501, options [nop,nop,TS val 4144212204 ecr 476281701], length 1314
03:35:04.096233 IP 52.223.202.122.1935 > 10.8.2.5.35986: Flags [.], ack 40477, win 135, options [nop,nop,TS val 476281796 ecr 4144211671], length 0
03:35:04.122730 IP 10.8.2.5.35986 > 52.223.202.122.1935: Flags [.], seq 55009:56323, ack 0, win 501, options [nop,nop,TS val 4144212272 ecr 476281796], length 1314
03:35:04.152639 IP 10.8.2.5.35986 > 52.223.202.122.1935: Flags [.], seq 56323:57637, ack 0, win 501, options [nop,nop,TS val 4144212302 ecr 476281796], length 1314
03:35:04.167156 IP 52.223.202.122.1935 > 10.8.2.5.35986: Flags [.], ack 43105, win 135, options [nop,nop,TS val 476281867 ecr 4144211768], length 0
03:35:04.171123 IP 52.223.202.122.1935 > 10.8.2.5.35986: Flags [.], ack 43183, win 135, options [nop,nop,TS val 476281871 ecr 4144211809], length 0
03:35:04.171136 IP 10.8.2.5.35986 > 52.223.202.122.1935: Flags [P.], seq 57637:58161, ack 0, win 501, options [nop,nop,TS val 4144212320 ecr 476281871], length 524
03:35:04.226158 IP 10.8.2.5.35986 > 52.223.202.122.1935: Flags [.], seq 58161:59475, ack 0, win 501, options [nop,nop,TS val 4144212375 ecr 476281871], length 1314
03:35:04.255362 IP 10.8.2.5.35986 > 52.223.202.122.1935: Flags [.], seq 59475:60789, ack 0, win 501, options [nop,nop,TS val 4144212404 ecr 476281871], length 1314
03:35:04.267473 IP 52.223.202.122.1935 > 10.8.2.5.35986: Flags [.], ack 45811, win 135, options [nop,nop,TS val 476281967 ecr 4144211871], length 0
03:35:04.290937 IP 10.8.2.5.35986 > 52.223.202.122.1935: Flags [.], seq 60789:62103, ack 0, win 501, options [nop,nop,TS val 4144212440 ecr 476281967], length 1314
03:35:04.355446 IP 10.8.2.5.35986 > 52.223.202.122.1935: Flags [.], seq 62103:63417, ack 0, win 501, options [nop,nop,TS val 4144212504 ecr 476281967], length 1314
03:35:04.360715 IP 52.223.202.122.1935 > 10.8.2.5.35986: Flags [.], ack 47125, win 135, options [nop,nop,TS val 476282060 ecr 4144211937], length 0
03:35:04.388526 IP 10.8.2.5.35986 > 52.223.202.122.1935: Flags [.], seq 63417:64731, ack 0, win 501, options [nop,nop,TS val 4144212537 ecr 476282060], length 1314
03:35:04.398003 IP 52.223.202.122.1935 > 10.8.2.5.35986: Flags [.], ack 49753, win 135, options [nop,nop,TS val 476282098 ecr 4144212004], length 0
03:35:04.421803 IP 10.8.2.5.35986 > 52.223.202.122.1935: Flags [.], seq 64731:66045, ack 0, win 501, options [nop,nop,TS val 4144212571 ecr 476282098], length 1314
03:35:04.488793 IP 10.8.2.5.35986 > 52.223.202.122.1935: Flags [.], seq 66045:67359, ack 0, win 501, options [nop,nop,TS val 4144212638 ecr 476282098], length 1314
03:35:04.502379 IP 52.223.202.122.1935 > 10.8.2.5.35986: Flags [.], ack 52381, win 135, options [nop,nop,TS val 476282202 ecr 4144212071], length 0
03:35:04.527316 IP 10.8.2.5.35986 > 52.223.202.122.1935: Flags [.], seq 67359:68673, ack 0, win 501, options [nop,nop,TS val 4144212676 ecr 476282202], length 1314
03:35:04.552661 IP 10.8.2.5.35986 > 52.223.202.122.1935: Flags [.], seq 68673:69987, ack 0, win 501, options [nop,nop,TS val 4144212702 ecr 476282202], length 1314
03:35:04.566416 IP 52.223.202.122.1935 > 10.8.2.5.35986: Flags [.], ack 55009, win 135, options [nop,nop,TS val 476282266 ecr 4144212167], length 0
03:35:04.621875 IP 10.8.2.5.35986 > 52.223.202.122.1935: Flags [.], seq 69987:71301, ack 0, win 501, options [nop,nop,TS val 4144212771 ecr 476282266], length 1314
03:35:04.655759 IP 10.8.2.5.35986 > 52.223.202.122.1935: Flags [.], seq 71301:72615, ack 0, win 501, options [nop,nop,TS val 4144212805 ecr 476282266], length 1314
03:35:04.664524 IP 52.223.202.122.1935 > 10.8.2.5.35986: Flags [.], ack 57637, win 135, options [nop,nop,TS val 476282364 ecr 4144212272], length 0
03:35:04.682749 IP 52.223.202.122.1935 > 10.8.2.5.35986: Flags [.], ack 58161, win 135, options [nop,nop,TS val 476282382 ecr 4144212320], length 0
03:35:04.682773 IP 10.8.2.5.35986 > 52.223.202.122.1935: Flags [P.], seq 72615:73147, ack 0, win 501, options [nop,nop,TS val 4144212832 ecr 476282382], length 532
03:35:04.722054 IP 10.8.2.5.35986 > 52.223.202.122.1935: Flags [.], seq 73147:74461, ack 0, win 501, options [nop,nop,TS val 4144212871 ecr 476282382], length 1314
03:35:04.763017 IP 10.8.2.5.35986 > 52.223.202.122.1935: Flags [.], seq 74461:75775, ack 0, win 501, options [nop,nop,TS val 4144212912 ecr 476282382], length 1314
03:35:04.767374 IP 52.223.202.122.1935 > 10.8.2.5.35986: Flags [.], ack 60789, win 135, options [nop,nop,TS val 476282467 ecr 4144212375], length 0
03:35:04.805607 IP 10.8.2.5.35986 > 52.223.202.122.1935: Flags [.], seq 75775:77089, ack 0, win 501, options [nop,nop,TS val 4144212955 ecr 476282467], length 1314
03:35:04.854970 IP 10.8.2.5.35986 > 52.223.202.122.1935: Flags [.], seq 77089:78403, ack 0, win 501, options [nop,nop,TS val 4144213004 ecr 476282467], length 1314
03:35:04.867415 IP 52.223.202.122.1935 > 10.8.2.5.35986: Flags [.], ack 63417, win 135, options [nop,nop,TS val 476282567 ecr 4144212440], length 0
03:35:04.891116 IP 10.8.2.5.35986 > 52.223.202.122.1935: Flags [.], seq 78403:79717, ack 0, win 501, options [nop,nop,TS val 4144213040 ecr 476282567], length 1314
03:35:04.933620 IP 52.223.202.122.1935 > 10.8.2.5.35986: Flags [.], ack 66045, win 135, options [nop,nop,TS val 476282633 ecr 4144212537], length 0
03:35:04.934239 IP 10.8.2.5.35986 > 52.223.202.122.1935: Flags [.], seq 79717:81031, ack 0, win 501, options [nop,nop,TS val 4144213083 ecr 476282633], length 1314
03:35:04.988331 IP 10.8.2.5.35986 > 52.223.202.122.1935: Flags [.], seq 81031:82345, ack 0, win 501, options [nop,nop,TS val 4144213137 ecr 476282633], length 1314
03:35:05.020430 IP 10.8.2.5.35986 > 52.223.202.122.1935: Flags [.], seq 82345:83659, ack 0, win 501, options [nop,nop,TS val 4144213169 ecr 476282633], length 1314
03:35:05.039204 IP 52.223.202.122.1935 > 10.8.2.5.35986: Flags [.], ack 68673, win 135, options [nop,nop,TS val 476282739 ecr 4144212638], length 0
03:35:05.062276 IP 10.8.2.5.35986 > 52.223.202.122.1935: Flags [.], seq 83659:84973, ack 0, win 501, options [nop,nop,TS val 4144213211 ecr 476282739], length 1314
03:35:05.126638 IP 10.8.2.5.35986 > 52.223.202.122.1935: Flags [.], seq 84973:86287, ack 0, win 501, options [nop,nop,TS val 4144213276 ecr 476282739], length 1314
03:35:05.132672 IP 52.223.202.122.1935 > 10.8.2.5.35986: Flags [.], ack 69987, win 135, options [nop,nop,TS val 476282832 ecr 4144212702], length 0
03:35:05.155922 IP 10.8.2.5.35986 > 52.223.202.122.1935: Flags [.], seq 86287:87601, ack 0, win 501, options [nop,nop,TS val 4144213305 ecr 476282832], length 1314
03:35:05.167647 IP 52.223.202.122.1935 > 10.8.2.5.35986: Flags [.], ack 72615, win 135, options [nop,nop,TS val 476282867 ecr 4144212771], length 0
03:35:05.190906 IP 10.8.2.5.35986 > 52.223.202.122.1935: Flags [.], seq 87601:88915, ack 0, win 501, options [nop,nop,TS val 4144213340 ecr 476282867], length 1314
03:35:05.194183 IP 52.223.202.122.1935 > 10.8.2.5.35986: Flags [.], ack 73147, win 135, options [nop,nop,TS val 476282894 ecr 4144212832], length 0
03:35:05.194201 IP 10.8.2.5.35986 > 52.223.202.122.1935: Flags [P.], seq 88915:88989, ack 0, win 501, options [nop,nop,TS val 4144213343 ecr 476282894], length 74
03:35:05.254968 IP 10.8.2.5.35986 > 52.223.202.122.1935: Flags [.], seq 88989:90303, ack 0, win 501, options [nop,nop,TS val 4144213404 ecr 476282894], length 1314
03:35:05.275063 IP 52.223.202.122.1935 > 10.8.2.5.35986: Flags [.], ack 75775, win 135, options [nop,nop,TS val 476282974 ecr 4144212871], length 0
03:35:05.297962 IP 10.8.2.5.35986 > 52.223.202.122.1935: Flags [.], seq 90303:91617, ack 0, win 501, options [nop,nop,TS val 4144213447 ecr 476282974], length 1314
03:35:05.321923 IP 10.8.2.5.35986 > 52.223.202.122.1935: Flags [.], seq 91617:92931, ack 0, win 501, options [nop,nop,TS val 4144213471 ecr 476282974], length 1314
03:35:05.366822 IP 52.223.202.122.1935 > 10.8.2.5.35986: Flags [.], ack 78403, win 135, options [nop,nop,TS val 476283066 ecr 4144212955], length 0
03:35:05.386898 IP 10.8.2.5.35986 > 52.223.202.122.1935: Flags [.], seq 92931:94245, ack 0, win 501, options [nop,nop,TS val 4144213536 ecr 476283066], length 1314
03:35:05.426321 IP 10.8.2.5.35986 > 52.223.202.122.1935: Flags [.], seq 94245:95559, ack 0, win 501, options [nop,nop,TS val 4144213575 ecr 476283066], length 1314
03:35:05.446217 IP 52.223.202.122.1935 > 10.8.2.5.35986: Flags [.], ack 81031, win 135, options [nop,nop,TS val 476283146 ecr 4144213040], length 0
03:35:05.455242 IP 10.8.2.5.35986 > 52.223.202.122.1935: Flags [.], seq 95559:96873, ack 0, win 501, options [nop,nop,TS val 4144213604 ecr 476283146], length 1314
03:35:05.520082 IP 10.8.2.5.35986 > 52.223.202.122.1935: Flags [.], seq 96873:98187, ack 0, win 501, options [nop,nop,TS val 4144213669 ecr 476283146], length 1314
03:35:05.532219 IP 52.223.202.122.1935 > 10.8.2.5.35986: Flags [.], ack 83659, win 135, options [nop,nop,TS val 476283232 ecr 4144213137], length 0
03:35:05.555439 IP 10.8.2.5.35986 > 52.223.202.122.1935: Flags [.], seq 98187:99501, ack 0, win 501, options [nop,nop,TS val 4144213704 ecr 476283232], length 1314
03:35:05.597809 IP 10.8.2.5.35986 > 52.223.202.122.1935: Flags [.], seq 99501:100815, ack 0, win 501, options [nop,nop,TS val 4144213747 ecr 476283232], length 1314
03:35:05.638470 IP 52.223.202.122.1935 > 10.8.2.5.35986: Flags [.], ack 86287, win 135, options [nop,nop,TS val 476283338 ecr 4144213211], length 0
03:35:05.662206 IP 10.8.2.5.35986 > 52.223.202.122.1935: Flags [.], seq 100815:102129, ack 0, win 501, options [nop,nop,TS val 4144213811 ecr 476283338], length 1314
03:35:05.688808 IP 10.8.2.5.35986 > 52.223.202.122.1935: Flags [.], seq 102129:103443, ack 0, win 501, options [nop,nop,TS val 4144213838 ecr 476283338], length 1314
03:35:05.702626 IP 52.223.202.122.1935 > 10.8.2.5.35986: Flags [.], ack 88915, win 135, options [nop,nop,TS val 476283402 ecr 4144213305], length 0
03:35:05.705633 IP 52.223.202.122.1935 > 10.8.2.5.35986: Flags [.], ack 88989, win 135, options [nop,nop,TS val 476283405 ecr 4144213343], length 0
03:35:05.705665 IP 10.8.2.5.35986 > 52.223.202.122.1935: Flags [P.], seq 103443:103968, ack 0, win 501, options [nop,nop,TS val 4144213855 ecr 476283405], length 525
03:35:05.755124 IP 10.8.2.5.35986 > 52.223.202.122.1935: Flags [.], seq 103968:105282, ack 0, win 501, options [nop,nop,TS val 4144213904 ecr 476283405], length 1314
03:35:05.791032 IP 10.8.2.5.35986 > 52.223.202.122.1935: Flags [.], seq 105282:106596, ack 0, win 501, options [nop,nop,TS val 4144213940 ecr 476283405], length 1314
03:35:05.809965 IP 52.223.202.122.1935 > 10.8.2.5.35986: Flags [.], ack 91617, win 135, options [nop,nop,TS val 476283510 ecr 4144213404], length 0
03:35:05.833960 IP 10.8.2.5.35986 > 52.223.202.122.1935: Flags [.], seq 106596:107910, ack 0, win 501, options [nop,nop,TS val 4144213983 ecr 476283510], length 1314
03:35:05.898991 IP 10.8.2.5.35986 > 52.223.202.122.1935: Flags [.], seq 107910:109224, ack 0, win 501, options [nop,nop,TS val 4144214048 ecr 476283510], length 1314
03:35:05.899061 IP 52.223.202.122.1935 > 10.8.2.5.35986: Flags [.], ack 94245, win 135, options [nop,nop,TS val 476283599 ecr 4144213471], length 0
03:35:05.921917 IP 10.8.2.5.35986 > 52.223.202.122.1935: Flags [.], seq 109224:110538, ack 0, win 501, options [nop,nop,TS val 4144214071 ecr 476283599], length 1314
03:35:05.963323 IP 10.8.2.5.35986 > 52.223.202.122.1935: Flags [.], seq 110538:111852, ack 0, win 501, options [nop,nop,TS val 4144214112 ecr 476283599], length 1314
03:35:05.967189 IP 52.223.202.122.1935 > 10.8.2.5.35986: Flags [.], ack 96873, win 135, options [nop,nop,TS val 476283667 ecr 4144213575], length 0
03:35:06.027460 IP 10.8.2.5.35986 > 52.223.202.122.1935: Flags [.], seq 111852:113166, ack 0, win 501, options [nop,nop,TS val 4144214176 ecr 476283667], length 1314
03:35:06.055042 IP 10.8.2.5.35986 > 52.223.202.122.1935: Flags [.], seq 113166:114480, ack 0, win 501, options [nop,nop,TS val 4144214204 ecr 476283667], length 1314
03:35:06.067260 IP 52.223.202.122.1935 > 10.8.2.5.35986: Flags [.], ack 99501, win 135, options [nop,nop,TS val 476283767 ecr 4144213669], length 0
03:35:06.091819 IP 10.8.2.5.35986 > 52.223.202.122.1935: Flags [.], seq 114480:115794, ack 0, win 501, options [nop,nop,TS val 4144214241 ecr 476283767], length 1314
03:35:06.156126 IP 10.8.2.5.35986 > 52.223.202.122.1935: Flags [.], seq 115794:117108, ack 0, win 501, options [nop,nop,TS val 4144214305 ecr 476283767], length 1314
03:35:06.173737 IP 52.223.202.122.1935 > 10.8.2.5.35986: Flags [.], ack 102129, win 135, options [nop,nop,TS val 476283874 ecr 4144213747], length 0
03:35:06.198665 IP 10.8.2.5.35986 > 52.223.202.122.1935: Flags [.], seq 117108:118422, ack 0, win 501, options [nop,nop,TS val 4144214348 ecr 476283874], length 1314
03:35:06.217828 IP 52.223.202.122.1935 > 10.8.2.5.35986: Flags [.], ack 103968, win 135, options [nop,nop,TS val 476283917 ecr 4144213838], length 0
03:35:06.217872 IP 10.8.2.5.35986 > 52.223.202.122.1935: Flags [P.], seq 118422:118862, ack 0, win 501, options [nop,nop,TS val 4144214367 ecr 476283917], length 440
03:35:06.262965 IP 10.8.2.5.35986 > 52.223.202.122.1935: Flags [.], seq 118862:120176, ack 0, win 501, options [nop,nop,TS val 4144214412 ecr 476283917], length 1314
03:35:06.286591 IP 10.8.2.5.35986 > 52.223.202.122.1935: Flags [.], seq 120176:121490, ack 0, win 501, options [nop,nop,TS val 4144214436 ecr 476283917], length 1314
03:35:06.302918 IP 52.223.202.122.1935 > 10.8.2.5.35986: Flags [.], ack 106596, win 135, options [nop,nop,TS val 476284002 ecr 4144213904], length 0
03:35:06.327073 IP 10.8.2.5.35986 > 52.223.202.122.1935: Flags [.], seq 121490:122804, ack 0, win 501, options [nop,nop,TS val 4144214476 ecr 476284002], length 1314
03:35:06.391041 IP 10.8.2.5.35986 > 52.223.202.122.1935: Flags [.], seq 122804:124118, ack 0, win 501, options [nop,nop,TS val 4144214540 ecr 476284002], length 1314
03:35:06.410783 IP 52.223.202.122.1935 > 10.8.2.5.35986: Flags [.], ack 109224, win 135, options [nop,nop,TS val 476284110 ecr 4144213983], length 0
03:35:06.433856 IP 10.8.2.5.35986 > 52.223.202.122.1935: Flags [.], seq 124118:125432, ack 0, win 501, options [nop,nop,TS val 4144214583 ecr 476284110], length 1314
03:35:06.455436 IP 10.8.2.5.35986 > 52.223.202.122.1935: Flags [.], seq 125432:126746, ack 0, win 501, options [nop,nop,TS val 4144214604 ecr 476284110], length 1314
03:35:06.475356 IP 52.223.202.122.1935 > 10.8.2.5.35986: Flags [.], ack 111852, win 135, options [nop,nop,TS val 476284175 ecr 4144214071], length 0
03:35:06.522425 IP 10.8.2.5.35986 > 52.223.202.122.1935: Flags [.], seq 126746:128060, ack 0, win 501, options [nop,nop,TS val 4144214671 ecr 476284175], length 1314
03:35:06.562546 IP 10.8.2.5.35986 > 52.223.202.122.1935: Flags [.], seq 128060:129374, ack 0, win 501, options [nop,nop,TS val 4144214711 ecr 476284175], length 1314
03:35:06.566984 IP 52.223.202.122.1935 > 10.8.2.5.35986: Flags [.], ack 114480, win 135, options [nop,nop,TS val 476284267 ecr 4144214176], length 0
03:35:06.586917 IP 10.8.2.5.35986 > 52.223.202.122.1935: Flags [.], seq 129374:130688, ack 0, win 501, options [nop,nop,TS val 4144214736 ecr 476284267], length 1314
03:35:06.668034 IP 52.223.202.122.1935 > 10.8.2.5.35986: Flags [.], ack 117108, win 135, options [nop,nop,TS val 476284368 ecr 4144214241], length 0
03:35:06.668990 IP 10.8.2.5.35986 > 52.223.202.122.1935: Flags [.], seq 130688:132002, ack 0, win 501, options [nop,nop,TS val 4144214818 ecr 476284368], length 1314
03:35:06.690269 IP 10.8.2.5.35986 > 52.223.202.122.1935: Flags [.], seq 132002:133316, ack 0, win 501, options [nop,nop,TS val 4144214839 ecr 476284368], length 1314
03:35:06.729676 IP 52.223.202.122.1935 > 10.8.2.5.35986: Flags [.], ack 118862, win 136, options [nop,nop,TS val 476284429 ecr 4144214348], length 0
03:35:06.729717 IP 10.8.2.5.35986 > 52.223.202.122.1935: Flags [P.], seq 133316:133948, ack 0, win 501, options [nop,nop,TS val 4144214879 ecr 476284429], length 632
03:35:06.755285 IP 10.8.2.5.35986 > 52.223.202.122.1935: Flags [.], seq 133948:135262, ack 0, win 501, options [nop,nop,TS val 4144214904 ecr 476284429], length 1314
03:35:06.797542 IP 10.8.2.5.35986 > 52.223.202.122.1935: Flags [.], seq 135262:136576, ack 0, win 501, options [nop,nop,TS val 4144214946 ecr 476284429], length 1314
03:35:06.798546 IP 52.223.202.122.1935 > 10.8.2.5.35986: Flags [.], ack 121490, win 136, options [nop,nop,TS val 476284498 ecr 4144214412], length 0
03:35:06.854439 IP 10.8.2.5.35986 > 52.223.202.122.1935: Flags [.], seq 136576:137890, ack 0, win 501, options [nop,nop,TS val 4144215003 ecr 476284498], length 1314
03:35:06.900667 IP 52.223.202.122.1935 > 10.8.2.5.35986: Flags [.], ack 122804, win 136, options [nop,nop,TS val 476284600 ecr 4144214476], length 0
03:35:06.904725 IP 10.8.2.5.35986 > 52.223.202.122.1935: Flags [.], seq 137890:139204, ack 0, win 501, options [nop,nop,TS val 4144215054 ecr 476284600], length 1314
03:35:06.919978 IP 10.8.2.5.35986 > 52.223.202.122.1935: Flags [.], seq 139204:140518, ack 0, win 501, options [nop,nop,TS val 4144215069 ecr 476284600], length 1314
03:35:06.945641 IP 52.223.202.122.1935 > 10.8.2.5.35986: Flags [.], ack 125432, win 136, options [nop,nop,TS val 476284645 ecr 4144214540], length 0
03:35:06.968910 IP 10.8.2.5.35986 > 52.223.202.122.1935: Flags [.], seq 140518:141832, ack 0, win 501, options [nop,nop,TS val 4144215118 ecr 476284645], length 1314
03:35:07.021136 IP 10.8.2.5.35986 > 52.223.202.122.1935: Flags [.], seq 141832:143146, ack 0, win 501, options [nop,nop,TS val 4144215170 ecr 476284645], length 1314
03:35:07.034263 IP 52.223.202.122.1935 > 10.8.2.5.35986: Flags [.], ack 128060, win 135, options [nop,nop,TS val 476284734 ecr 4144214604], length 0
03:35:07.051033 IP 10.8.2.5.35986 > 52.223.202.122.1935: Flags [.], seq 143146:144460, ack 0, win 501, options [nop,nop,TS val 4144215200 ecr 476284734], length 1314
03:35:07.096957 IP 10.8.2.5.35986 > 52.223.202.122.1935: Flags [.], seq 144460:145774, ack 0, win 501, options [nop,nop,TS val 4144215246 ecr 476284734], length 1314
03:35:07.098850 IP 52.223.202.122.1935 > 10.8.2.5.35986: Flags [.], ack 130688, win 135, options [nop,nop,TS val 476284798 ecr 4144214711], length 0
03:35:07.155348 IP 10.8.2.5.35986 > 52.223.202.122.1935: Flags [.], seq 145774:147088, ack 0, win 501, options [nop,nop,TS val 4144215304 ecr 476284798], length 1314
03:35:07.189339 IP 10.8.2.5.35986 > 52.223.202.122.1935: Flags [.], seq 147088:148402, ack 0, win 501, options [nop,nop,TS val 4144215338 ecr 476284798], length 1314
03:35:07.201850 IP 52.223.202.122.1935 > 10.8.2.5.35986: Flags [.], ack 133316, win 135, options [nop,nop,TS val 476284902 ecr 4144214818], length 0
03:35:07.225973 IP 10.8.2.5.35986 > 52.223.202.122.1935: Flags [.], seq 148402:149716, ack 0, win 501, options [nop,nop,TS val 4144215375 ecr 476284902], length 1314
03:35:07.241454 IP 52.223.202.122.1935 > 10.8.2.5.35986: Flags [.], ack 133948, win 136, options [nop,nop,TS val 476284941 ecr 4144214879], length 0
03:35:07.241480 IP 10.8.2.5.35986 > 52.223.202.122.1935: Flags [P.], seq 149716:149773, ack 0, win 501, options [nop,nop,TS val 4144215390 ecr 476284941], length 57
03:35:07.288083 IP 10.8.2.5.35986 > 52.223.202.122.1935: Flags [.], seq 149773:151087, ack 0, win 501, options [nop,nop,TS val 4144215437 ecr 476284941], length 1314
03:35:07.309534 IP 52.223.202.122.1935 > 10.8.2.5.35986: Flags [.], ack 136576, win 135, options [nop,nop,TS val 476285009 ecr 4144214904], length 0
03:35:07.321402 IP 10.8.2.5.35986 > 52.223.202.122.1935: Flags [.], seq 151087:152401, ack 0, win 501, options [nop,nop,TS val 4144215470 ecr 476285009], length 1314
03:35:07.354559 IP 10.8.2.5.35986 > 52.223.202.122.1935: Flags [.], seq 152401:153715, ack 0, win 501, options [nop,nop,TS val 4144215504 ecr 476285009], length 1314
03:35:07.421919 IP 10.8.2.5.35986 > 52.223.202.122.1935: Flags [.], seq 153715:155029, ack 0, win 501, options [nop,nop,TS val 4144215571 ecr 476285009], length 1314
03:35:07.455344 IP 10.8.2.5.35986 > 52.223.202.122.1935: Flags [.], seq 155029:156343, ack 0, win 501, options [nop,nop,TS val 4144215604 ecr 476285009], length 1314
03:35:07.480612 IP 52.223.202.122.1935 > 10.8.2.5.35986: Flags [.], ack 141832, win 135, options [nop,nop,TS val 476285180 ecr 4144215069], length 0
03:35:07.486027 IP 10.8.2.5.35986 > 52.223.202.122.1935: Flags [.], seq 156343:157657, ack 0, win 501, options [nop,nop,TS val 4144215635 ecr 476285180], length 1314
03:35:07.554607 IP 10.8.2.5.35986 > 52.223.202.122.1935: Flags [.], seq 157657:158971, ack 0, win 501, options [nop,nop,TS val 4144215704 ecr 476285180], length 1314
03:35:07.563361 IP 52.223.202.122.1935 > 10.8.2.5.35986: Flags [.], ack 144460, win 135, options [nop,nop,TS val 476285262 ecr 4144215170], length 0
03:35:07.587773 IP 10.8.2.5.35986 > 52.223.202.122.1935: Flags [.], seq 158971:160285, ack 0, win 501, options [nop,nop,TS val 4144215737 ecr 476285262], length 1314
03:35:07.621086 IP 10.8.2.5.35986 > 52.223.202.122.1935: Flags [.], seq 160285:161599, ack 0, win 501, options [nop,nop,TS val 4144215770 ecr 476285262], length 1314
03:35:07.667165 IP 52.223.202.122.1935 > 10.8.2.5.35986: Flags [.], ack 147088, win 135, options [nop,nop,TS val 476285367 ecr 4144215246], length 0
03:35:07.688653 IP 10.8.2.5.35986 > 52.223.202.122.1935: Flags [.], seq 161599:162913, ack 0, win 501, options [nop,nop,TS val 4144215838 ecr 476285367], length 1314
03:35:07.721999 IP 10.8.2.5.35986 > 52.223.202.122.1935: Flags [.], seq 162913:164227, ack 0, win 501, options [nop,nop,TS val 4144215871 ecr 476285367], length 1314
03:35:07.738362 IP 52.223.202.122.1935 > 10.8.2.5.35986: Flags [.], ack 149716, win 135, options [nop,nop,TS val 476285438 ecr 4144215338], length 0
03:35:07.753751 IP 10.8.2.5.35986 > 52.223.202.122.1935: Flags [.], seq 164227:165541, ack 0, win 501, options [nop,nop,TS val 4144215903 ecr 476285438], length 1314
03:35:07.753993 IP 52.223.202.122.1935 > 10.8.2.5.35986: Flags [.], ack 149773, win 136, options [nop,nop,TS val 476285454 ecr 4144215390], length 0
03:35:07.754013 IP 10.8.2.5.35986 > 52.223.202.122.1935: Flags [P.], seq 165541:165615, ack 0, win 501, options [nop,nop,TS val 4144215903 ecr 476285454], length 74
03:35:07.820010 IP 10.8.2.5.35986 > 52.223.202.122.1935: Flags [.], seq 165615:166929, ack 0, win 501, options [nop,nop,TS val 4144215969 ecr 476285454], length 1314
03:35:07.833270 IP 52.223.202.122.1935 > 10.8.2.5.35986: Flags [.], ack 152401, win 136, options [nop,nop,TS val 476285533 ecr 4144215437], length 0
03:35:07.854495 IP 10.8.2.5.35986 > 52.223.202.122.1935: Flags [.], seq 166929:168243, ack 0, win 501, options [nop,nop,TS val 4144216003 ecr 476285533], length 1314
03:35:07.887860 IP 10.8.2.5.35986 > 52.223.202.122.1935: Flags [.], seq 168243:169557, ack 0, win 501, options [nop,nop,TS val 4144216037 ecr 476285533], length 1314
03:35:07.933714 IP 52.223.202.122.1935 > 10.8.2.5.35986: Flags [.], ack 155029, win 135, options [nop,nop,TS val 476285633 ecr 4144215504], length 0
03:35:07.954506 IP 10.8.2.5.35986 > 52.223.202.122.1935: Flags [.], seq 169557:170871, ack 0, win 501, options [nop,nop,TS val 4144216103 ecr 476285633], length 1314
03:35:07.984680 IP 10.8.2.5.35986 > 52.223.202.122.1935: Flags [.], seq 170871:172185, ack 0, win 501, options [nop,nop,TS val 4144216134 ecr 476285633], length 1314
03:35:08.001881 IP 52.223.202.122.1935 > 10.8.2.5.35986: Flags [.], ack 157657, win 135, options [nop,nop,TS val 476285697 ecr 4144215604], length 0
03:35:08.018152 IP 10.8.2.5.35986 > 52.223.202.122.1935: Flags [.], seq 172185:173499, ack 0, win 501, options [nop,nop,TS val 4144216167 ecr 476285697], length 1314
03:35:08.088405 IP 10.8.2.5.35986 > 52.223.202.122.1935: Flags [.], seq 173499:174813, ack 0, win 501, options [nop,nop,TS val 4144216237 ecr 476285697], length 1314
03:35:08.100516 IP 52.223.202.122.1935 > 10.8.2.5.35986: Flags [.], ack 160285, win 135, options [nop,nop,TS val 476285799 ecr 4144215704], length 0
03:35:08.122257 IP 10.8.2.5.35986 > 52.223.202.122.1935: Flags [.], seq 174813:176127, ack 0, win 501, options [nop,nop,TS val 4144216271 ecr 476285799], length 1314
03:35:08.155636 IP 10.8.2.5.35986 > 52.223.202.122.1935: Flags [.], seq 176127:177441, ack 0, win 501, options [nop,nop,TS val 4144216305 ecr 476285799], length 1314
03:35:08.200526 IP 52.223.202.122.1935 > 10.8.2.5.35986: Flags [.], ack 162913, win 135, options [nop,nop,TS val 476285900 ecr 4144215770], length 0
03:35:08.221945 IP 10.8.2.5.35986 > 52.223.202.122.1935: Flags [.], seq 177441:178755, ack 0, win 501, options [nop,nop,TS val 4144216371 ecr 476285900], length 1314
03:35:08.253801 IP 10.8.2.5.35986 > 52.223.202.122.1935: Flags [.], seq 178755:180069, ack 0, win 501, options [nop,nop,TS val 4144216403 ecr 476285900], length 1314
03:35:08.266744 IP 52.223.202.122.1935 > 10.8.2.5.35986: Flags [.], ack 162913, win 135, options [nop,nop,TS val 476285966 ecr 4144215770,nop,nop,sack 1 {164227:165541}], length 0
03:35:08.266779 IP 52.223.202.122.1935 > 10.8.2.5.35986: Flags [.], ack 162913, win 135, options [nop,nop,TS val 476285966 ecr 4144215770,nop,nop,sack 1 {164227:165615}], length 0
03:35:08.287223 IP 10.8.2.5.35986 > 52.223.202.122.1935: Flags [.], seq 180069:181383, ack 0, win 501, options [nop,nop,TS val 4144216436 ecr 476285966], length 1314
03:35:08.331927 IP 52.223.202.122.1935 > 10.8.2.5.35986: Flags [.], ack 162913, win 135, options [nop,nop,TS val 476286031 ecr 4144215770,nop,nop,sack 1 {164227:166929}], length 0
03:35:08.331960 IP 10.8.2.5.35986 > 52.223.202.122.1935: Flags [.], seq 162913:164227, ack 0, win 501, options [nop,nop,TS val 4144216481 ecr 476286031], length 1314
03:35:08.366373 IP 52.223.202.122.1935 > 10.8.2.5.35986: Flags [.], ack 162913, win 135, options [nop,nop,TS val 476286066 ecr 4144215770,nop,nop,sack 1 {164227:168243}], length 0
03:35:08.366421 IP 10.8.2.5.35986 > 52.223.202.122.1935: Flags [.], seq 181383:182697, ack 0, win 501, options [nop,nop,TS val 4144216515 ecr 476286066], length 1314
03:35:08.400693 IP 52.223.202.122.1935 > 10.8.2.5.35986: Flags [.], ack 162913, win 135, options [nop,nop,TS val 476286099 ecr 4144215770,nop,nop,sack 1 {164227:169557}], length 0
03:35:08.400741 IP 10.8.2.5.35986 > 52.223.202.122.1935: Flags [.], seq 182697:184011, ack 0, win 501, options [nop,nop,TS val 4144216550 ecr 476286099], length 1314
03:35:08.467133 IP 52.223.202.122.1935 > 10.8.2.5.35986: Flags [.], ack 162913, win 135, options [nop,nop,TS val 476286166 ecr 4144215770,nop,nop,sack 1 {164227:170871}], length 0
03:35:08.467194 IP 10.8.2.5.35986 > 52.223.202.122.1935: Flags [.], seq 184011:185325, ack 0, win 501, options [nop,nop,TS val 4144216616 ecr 476286166], length 1314
03:35:08.497325 IP 52.223.202.122.1935 > 10.8.2.5.35986: Flags [.], ack 162913, win 135, options [nop,nop,TS val 476286196 ecr 4144215770,nop,nop,sack 1 {164227:172185}], length 0
03:35:08.497373 IP 10.8.2.5.35986 > 52.223.202.122.1935: Flags [.], seq 185325:186639, ack 0, win 501, options [nop,nop,TS val 4144216646 ecr 476286196], length 1314
03:35:08.536599 IP 52.223.202.122.1935 > 10.8.2.5.35986: Flags [.], ack 162913, win 135, options [nop,nop,TS val 476286229 ecr 4144215770,nop,nop,sack 1 {164227:173499}], length 0
03:35:08.536646 IP 10.8.2.5.35986 > 52.223.202.122.1935: Flags [.], seq 186639:187953, ack 0, win 501, options [nop,nop,TS val 4144216686 ecr 476286229], length 1314
03:35:08.601382 IP 52.223.202.122.1935 > 10.8.2.5.35986: Flags [.], ack 162913, win 135, options [nop,nop,TS val 476286300 ecr 4144215770,nop,nop,sack 1 {164227:174813}], length 0
03:35:08.601442 IP 10.8.2.5.35986 > 52.223.202.122.1935: Flags [.], seq 187953:189267, ack 0, win 501, options [nop,nop,TS val 4144216750 ecr 476286300], length 1314
03:35:08.634977 IP 52.223.202.122.1935 > 10.8.2.5.35986: Flags [.], ack 162913, win 135, options [nop,nop,TS val 476286334 ecr 4144215770,nop,nop,sack 1 {164227:176127}], length 0
03:35:08.635024 IP 10.8.2.5.35986 > 52.223.202.122.1935: Flags [.], seq 189267:190581, ack 0, win 501, options [nop,nop,TS val 4144216784 ecr 476286334], length 1314
03:35:08.668540 IP 52.223.202.122.1935 > 10.8.2.5.35986: Flags [.], ack 162913, win 135, options [nop,nop,TS val 476286367 ecr 4144215770,nop,nop,sack 1 {164227:177441}], length 0
03:35:08.668587 IP 10.8.2.5.35986 > 52.223.202.122.1935: Flags [.], seq 190581:191895, ack 0, win 501, options [nop,nop,TS val 4144216818 ecr 476286367], length 1314
03:35:08.735140 IP 52.223.202.122.1935 > 10.8.2.5.35986: Flags [.], ack 162913, win 135, options [nop,nop,TS val 476286433 ecr 4144215770,nop,nop,sack 1 {164227:178755}], length 0
03:35:08.735185 IP 10.8.2.5.35986 > 52.223.202.122.1935: Flags [.], seq 191895:193209, ack 0, win 501, options [nop,nop,TS val 4144216884 ecr 476286433], length 1314
03:35:08.766504 IP 52.223.202.122.1935 > 10.8.2.5.35986: Flags [.], ack 162913, win 135, options [nop,nop,TS val 476286465 ecr 4144215770,nop,nop,sack 1 {164227:180069}], length 0
03:35:08.766563 IP 10.8.2.5.35986 > 52.223.202.122.1935: Flags [.], seq 193209:194523, ack 0, win 501, options [nop,nop,TS val 4144216916 ecr 476286465], length 1314
03:35:08.800385 IP 52.223.202.122.1935 > 10.8.2.5.35986: Flags [.], ack 162913, win 135, options [nop,nop,TS val 476286499 ecr 4144215770,nop,nop,sack 1 {164227:181383}], length 0
03:35:08.800421 IP 10.8.2.5.35986 > 52.223.202.122.1935: Flags [.], seq 194523:195837, ack 0, win 501, options [nop,nop,TS val 4144216949 ecr 476286499], length 1314
03:35:08.843913 IP 52.223.202.122.1935 > 10.8.2.5.35986: Flags [.], ack 181383, win 111, options [nop,nop,TS val 476286543 ecr 4144216481], length 0
03:35:08.843952 IP 10.8.2.5.35986 > 52.223.202.122.1935: Flags [.], seq 195837:197151, ack 0, win 501, options [nop,nop,TS val 4144216993 ecr 476286543], length 1314
03:35:08.843954 IP 10.8.2.5.35986 > 52.223.202.122.1935: Flags [P.], seq 197151:197560, ack 0, win 501, options [nop,nop,TS val 4144216993 ecr 476286543], length 409
03:35:08.878906 IP 52.223.202.122.1935 > 10.8.2.5.35986: Flags [.], ack 182697, win 142, options [nop,nop,TS val 476286578 ecr 4144216515], length 0
03:35:08.887174 IP 10.8.2.5.35986 > 52.223.202.122.1935: Flags [.], seq 197560:198874, ack 0, win 501, options [nop,nop,TS val 4144217036 ecr 476286578], length 1314
03:35:08.912333 IP 52.223.202.122.1935 > 10.8.2.5.35986: Flags [.], ack 184011, win 148, options [nop,nop,TS val 476286612 ecr 4144216550], length 0
03:35:08.920343 IP 10.8.2.5.35986 > 52.223.202.122.1935: Flags [.], seq 198874:200188, ack 0, win 501, options [nop,nop,TS val 4144217069 ecr 476286612], length 1314
03:35:08.960681 IP 10.8.2.5.35986 > 52.223.202.122.1935: Flags [.], seq 200188:201502, ack 0, win 501, options [nop,nop,TS val 4144217110 ecr 476286612], length 1314
03:35:08.978867 IP 52.223.202.122.1935 > 10.8.2.5.35986: Flags [.], ack 185325, win 154, options [nop,nop,TS val 476286678 ecr 4144216616], length 0
03:35:09.009114 IP 52.223.202.122.1935 > 10.8.2.5.35986: Flags [.], ack 186639, win 159, options [nop,nop,TS val 476286709 ecr 4144216646], length 0
03:35:09.024814 IP 10.8.2.5.35986 > 52.223.202.122.1935: Flags [.], seq 201502:202816, ack 0, win 501, options [nop,nop,TS val 4144217174 ecr 476286709], length 1314
03:35:09.048132 IP 52.223.202.122.1935 > 10.8.2.5.35986: Flags [.], ack 187953, win 165, options [nop,nop,TS val 476286748 ecr 4144216686], length 0
03:35:09.051122 IP 10.8.2.5.35986 > 52.223.202.122.1935: Flags [.], seq 202816:204130, ack 0, win 501, options [nop,nop,TS val 4144217200 ecr 476286748], length 1314
03:35:09.088479 IP 10.8.2.5.35986 > 52.223.202.122.1935: Flags [.], seq 204130:205444, ack 0, win 501, options [nop,nop,TS val 4144217237 ecr 476286748], length 1314
03:35:09.113128 IP 52.223.202.122.1935 > 10.8.2.5.35986: Flags [.], ack 189267, win 171, options [nop,nop,TS val 476286813 ecr 4144216750], length 0
03:35:09.147166 IP 52.223.202.122.1935 > 10.8.2.5.35986: Flags [.], ack 190581, win 176, options [nop,nop,TS val 476286846 ecr 4144216784], length 0
03:35:09.155093 IP 10.8.2.5.35986 > 52.223.202.122.1935: Flags [.], seq 205444:206758, ack 0, win 501, options [nop,nop,TS val 4144217304 ecr 476286846], length 1314
03:35:09.180165 IP 52.223.202.122.1935 > 10.8.2.5.35986: Flags [.], ack 191895, win 182, options [nop,nop,TS val 476286880 ecr 4144216818], length 0
