10:52:22.615690 IP 99.181.89.37.1935 > 10.8.3.2.36808: Flags [.], ack 3275370540, win 126, options [nop,nop,TS val 1471422850 ecr 946282207], length 0
10:52:22.618161 IP 99.181.89.37.1935 > 10.8.3.2.36808: Flags [.], ack 808, win 126, options [nop,nop,TS val 1471422853 ecr 946282276], length 0
10:52:22.618183 IP 10.8.3.2.36808 > 99.181.89.37.1935: Flags [P.], seq 12634:13818, ack 0, win 501, options [nop,nop,TS val 946282725 ecr 1471422853], length 1184
10:52:22.667202 IP 10.8.3.2.36808 > 99.181.89.37.1935: Flags [.], seq 13818:15132, ack 0, win 501, options [nop,nop,TS val 946282774 ecr 1471422853], length 1314
10:52:22.697941 IP 10.8.3.2.36808 > 99.181.89.37.1935: Flags [.], seq 15132:16446, ack 0, win 501, options [nop,nop,TS val 946282805 ecr 1471422853], length 1314
10:52:22.717539 IP 99.181.89.37.1935 > 10.8.3.2.36808: Flags [.], ack 3436, win 126, options [nop,nop,TS val 1471422952 ecr 946282338], length 0
10:52:22.745243 IP 10.8.3.2.36808 > 99.181.89.37.1935: Flags [.], seq 16446:17760, ack 0, win 501, options [nop,nop,TS val 946282852 ecr 1471422952], length 1314
10:52:22.800528 IP 10.8.3.2.36808 > 99.181.89.37.1935: Flags [.], seq 17760:19074, ack 0, win 501, options [nop,nop,TS val 946282907 ecr 1471422952], length 1314
10:52:22.814474 IP 99.181.89.37.1935 > 10.8.3.2.36808: Flags [.], ack 6064, win 126, options [nop,nop,TS val 1471423049 ecr 946282407], length 0
10:52:22.833825 IP 10.8.3.2.36808 > 99.181.89.37.1935: Flags [.], seq 19074:20388, ack 0, win 501, options [nop,nop,TS val 946282941 ecr 1471423049], length 1314
10:52:22.873887 IP 10.8.3.2.36808 > 99.181.89.37.1935: Flags [.], seq 20388:21702, ack 0, win 501, options [nop,nop,TS val 946282981 ecr 1471423049], length 1314
10:52:22.882325 IP 99.181.89.37.1935 > 10.8.3.2.36808: Flags [.], ack 8692, win 126, options [nop,nop,TS val 1471423117 ecr 946282507], length 0
10:52:22.931307 IP 10.8.3.2.36808 > 99.181.89.37.1935: Flags [.], seq 21702:23016, ack 0, win 501, options [nop,nop,TS val 946283038 ecr 1471423117], length 1314
10:52:22.962876 IP 10.8.3.2.36808 > 99.181.89.37.1935: Flags [.], seq 23016:24330, ack 0, win 501, options [nop,nop,TS val 946283070 ecr 1471423117], length 1314
10:52:22.981313 IP 99.181.89.37.1935 > 10.8.3.2.36808: Flags [.], ack 11320, win 126, options [nop,nop,TS val 1471423216 ecr 946282606], length 0
10:52:23.001636 IP 10.8.3.2.36808 > 99.181.89.37.1935: Flags [.], seq 24330:25644, ack 0, win 501, options [nop,nop,TS val 946283108 ecr 1471423216], length 1314
10:52:23.066848 IP 99.181.89.37.1935 > 10.8.3.2.36808: Flags [.], ack 13818, win 126, options [nop,nop,TS val 1471423301 ecr 946282673], length 0
10:52:23.066887 IP 10.8.3.2.36808 > 99.181.89.37.1935: Flags [P.], seq 25644:26819, ack 0, win 501, options [nop,nop,TS val 946283174 ecr 1471423301], length 1175
10:52:23.100192 IP 10.8.3.2.36808 > 99.181.89.37.1935: Flags [.], seq 26819:28133, ack 0, win 501, options [nop,nop,TS val 946283207 ecr 1471423301], length 1314
10:52:23.129847 IP 10.8.3.2.36808 > 99.181.89.37.1935: Flags [.], seq 28133:29447, ack 0, win 501, options [nop,nop,TS val 946283237 ecr 1471423301], length 1314
10:52:23.146940 IP 99.181.89.37.1935 > 10.8.3.2.36808: Flags [.], ack 16446, win 126, options [nop,nop,TS val 1471423382 ecr 946282774], length 0
10:52:23.193436 IP 10.8.3.2.36808 > 99.181.89.37.1935: Flags [.], seq 29447:30761, ack 0, win 501, options [nop,nop,TS val 946283300 ecr 1471423382], length 1314
10:52:23.232661 IP 10.8.3.2.36808 > 99.181.89.37.1935: Flags [.], seq 30761:32075, ack 0, win 501, options [nop,nop,TS val 946283339 ecr 1471423382], length 1314
10:52:23.249713 IP 99.181.89.37.1935 > 10.8.3.2.36808: Flags [.], ack 19074, win 126, options [nop,nop,TS val 1471423484 ecr 946282852], length 0
10:52:23.264244 IP 10.8.3.2.36808 > 99.181.89.37.1935: Flags [.], seq 32075:33389, ack 0, win 501, options [nop,nop,TS val 946283371 ecr 1471423484], length 1314
10:52:23.320487 IP 10.8.3.2.36808 > 99.181.89.37.1935: Flags [.], seq 33389:34703, ack 0, win 501, options [nop,nop,TS val 946283427 ecr 1471423484], length 1314
10:52:23.322313 IP 99.181.89.37.1935 > 10.8.3.2.36808: Flags [.], ack 21702, win 126, options [nop,nop,TS val 1471423557 ecr 946282941], length 0
10:52:23.367596 IP 10.8.3.2.36808 > 99.181.89.37.1935: Flags [.], seq 34703:36017, ack 0, win 501, options [nop,nop,TS val 946283474 ecr 1471423557], length 1314
10:52:23.400345 IP 10.8.3.2.36808 > 99.181.89.37.1935: Flags [.], seq 36017:37331, ack 0, win 501, options [nop,nop,TS val 946283507 ecr 1471423557], length 1314
10:52:23.411599 IP 99.181.89.37.1935 > 10.8.3.2.36808: Flags [.], ack 24330, win 126, options [nop,nop,TS val 1471423646 ecr 946283038], length 0
10:52:23.449132 IP 10.8.3.2.36808 > 99.181.89.37.1935: Flags [.], seq 37331:38645, ack 0, win 501, options [nop,nop,TS val 946283556 ecr 1471423646], length 1314
10:52:23.496679 IP 10.8.3.2.36808 > 99.181.89.37.1935: Flags [.], seq 38645:39959, ack 0, win 501, options [nop,nop,TS val 946283603 ecr 1471423646], length 1314
10:52:23.515546 IP 99.181.89.37.1935 > 10.8.3.2.36808: Flags [.], ack 26819, win 126, options [nop,nop,TS val 1471423750 ecr 946283108], length 0
10:52:23.515557 IP 10.8.3.2.36808 > 99.181.89.37.1935: Flags [P.], seq 39959:40685, ack 0, win 501, options [nop,nop,TS val 946283622 ecr 1471423750], length 726
10:52:23.565408 IP 10.8.3.2.36808 > 99.181.89.37.1935: Flags [.], seq 40685:41999, ack 0, win 501, options [nop,nop,TS val 946283672 ecr 1471423750], length 1314
10:52:23.578219 IP 99.181.89.37.1935 > 10.8.3.2.36808: Flags [.], ack 29447, win 126, options [nop,nop,TS val 1471423813 ecr 946283207], length 0
10:52:23.600546 IP 10.8.3.2.36808 > 99.181.89.37.1935: Flags [.], seq 41999:43313, ack 0, win 501, options [nop,nop,TS val 946283707 ecr 1471423813], length 1314
10:52:23.641660 IP 10.8.3.2.36808 > 99.181.89.37.1935: Flags [.], seq 43313:44627, ack 0, win 501, options [nop,nop,TS val 946283748 ecr 1471423813], length 1314
10:52:23.681290 IP 99.181.89.37.1935 > 10.8.3.2.36808: Flags [.], ack 32075, win 126, options [nop,nop,TS val 1471423916 ecr 946283300], length 0
10:52:23.700446 IP 10.8.3.2.36808 > 99.181.89.37.1935: Flags [.], seq 44627:45941, ack 0, win 501, options [nop,nop,TS val 946283807 ecr 1471423916], length 1314
10:52:23.734213 IP 10.8.3.2.36808 > 99.181.89.37.1935: Flags [.], seq 45941:47255, ack 0, win 501, options [nop,nop,TS val 946283841 ecr 1471423916], length 1314
10:52:23.768833 IP 99.181.89.37.1935 > 10.8.3.2.36808: Flags [.], ack 34703, win 126, options [nop,nop,TS val 1471424003 ecr 946283371], length 0
10:52:23.770554 IP 10.8.3.2.36808 > 99.181.89.37.1935: Flags [.], seq 47255:48569, ack 0, win 501, options [nop,nop,TS val 946283877 ecr 1471424003], length 1314
10:52:23.833385 IP 10.8.3.2.36808 > 99.181.89.37.1935: Flags [.], seq 48569:49883, ack 0, win 501, options [nop,nop,TS val 946283940 ecr 1471424003], length 1314
10:52:23.849216 IP 99.181.89.37.1935 > 10.8.3.2.36808: Flags [.], ack 37331, win 126, options [nop,nop,TS val 1471424084 ecr 946283474], length 0
10:52:23.866759 IP 10.8.3.2.36808 > 99.181.89.37.1935: Flags [.], seq 49883:51197, ack 0, win 501, options [nop,nop,TS val 946283973 ecr 1471424084], length 1314
10:52:23.898812 IP 10.8.3.2.36808 > 99.181.89.37.1935: Flags [.], seq 51197:52511, ack 0, win 501, options [nop,nop,TS val 946284005 ecr 1471424084], length 1314
10:52:23.945206 IP 99.181.89.37.1935 > 10.8.3.2.36808: Flags [.], ack 39959, win 126, options [nop,nop,TS val 1471424180 ecr 946283556], length 0
10:52:23.964266 IP 99.181.89.37.1935 > 10.8.3.2.36808: Flags [.], ack 40685, win 126, options [nop,nop,TS val 1471424199 ecr 946283622], length 0
10:52:23.964298 IP 10.8.3.2.36808 > 99.181.89.37.1935: Flags [P.], seq 52511:53682, ack 0, win 501, options [nop,nop,TS val 946284071 ecr 1471424199], length 1171
10:52:24.001612 IP 10.8.3.2.36808 > 99.181.89.37.1935: Flags [.], seq 53682:54996, ack 0, win 501, options [nop,nop,TS val 946284108 ecr 1471424199], length 1314
10:52:24.033739 IP 10.8.3.2.36808 > 99.181.89.37.1935: Flags [.], seq 54996:56310, ack 0, win 501, options [nop,nop,TS val 946284140 ecr 1471424199], length 1314
10:52:24.049119 IP 99.181.89.37.1935 > 10.8.3.2.36808: Flags [.], ack 43313, win 126, options [nop,nop,TS val 1471424284 ecr 946283672], length 0
10:52:24.090328 IP 10.8.3.2.36808 > 99.181.89.37.1935: Flags [.], seq 56310:57624, ack 0, win 501, options [nop,nop,TS val 946284197 ecr 1471424284], length 1314
10:52:24.133161 IP 10.8.3.2.36808 > 99.181.89.37.1935: Flags [.], seq 57624:58938, ack 0, win 501, options [nop,nop,TS val 946284240 ecr 1471424284], length 1314
10:52:24.149115 IP 99.181.89.37.1935 > 10.8.3.2.36808: Flags [.], ack 45941, win 126, options [nop,nop,TS val 1471424384 ecr 946283748], length 0
10:52:24.165823 IP 10.8.3.2.36808 > 99.181.89.37.1935: Flags [.], seq 58938:60252, ack 0, win 501, options [nop,nop,TS val 946284273 ecr 1471424384], length 1314
10:52:24.217797 IP 10.8.3.2.36808 > 99.181.89.37.1935: Flags [.], seq 60252:61566, ack 0, win 501, options [nop,nop,TS val 946284324 ecr 1471424384], length 1314
10:52:24.219435 IP 99.181.89.37.1935 > 10.8.3.2.36808: Flags [.], ack 48569, win 126, options [nop,nop,TS val 1471424454 ecr 946283841], length 0
10:52:24.267758 IP 10.8.3.2.36808 > 99.181.89.37.1935: Flags [.], seq 61566:62880, ack 0, win 501, options [nop,nop,TS val 946284374 ecr 1471424454], length 1314
10:52:24.299347 IP 10.8.3.2.36808 > 99.181.89.37.1935: Flags [.], seq 62880:64194, ack 0, win 501, options [nop,nop,TS val 946284406 ecr 1471424454], length 1314
10:52:24.315784 IP 99.181.89.37.1935 > 10.8.3.2.36808: Flags [.], ack 51197, win 126, options [nop,nop,TS val 1471424550 ecr 946283940], length 0
10:52:24.345270 IP 10.8.3.2.36808 > 99.181.89.37.1935: Flags [.], seq 64194:65508, ack 0, win 501, options [nop,nop,TS val 946284452 ecr 1471424550], length 1314
10:52:24.401368 IP 10.8.3.2.36808 > 99.181.89.37.1935: Flags [.], seq 65508:66822, ack 0, win 501, options [nop,nop,TS val 946284508 ecr 1471424550], length 1314
10:52:24.413032 IP 99.181.89.37.1935 > 10.8.3.2.36808: Flags [.], ack 53682, win 126, options [nop,nop,TS val 1471424647 ecr 946284005], length 0
10:52:24.413071 IP 10.8.3.2.36808 > 99.181.89.37.1935: Flags [P.], seq 66822:67547, ack 0, win 501, options [nop,nop,TS val 946284520 ecr 1471424647], length 725
10:52:24.468050 IP 10.8.3.2.36808 > 99.181.89.37.1935: Flags [.], seq 67547:68861, ack 0, win 501, options [nop,nop,TS val 946284575 ecr 1471424647], length 1314
10:52:24.482446 IP 99.181.89.37.1935 > 10.8.3.2.36808: Flags [.], ack 56310, win 126, options [nop,nop,TS val 1471424717 ecr 946284108], length 0
10:52:24.500942 IP 10.8.3.2.36808 > 99.181.89.37.1935: Flags [.], seq 68861:70175, ack 0, win 501, options [nop,nop,TS val 946284608 ecr 1471424717], length 1314
10:52:24.538084 IP 10.8.3.2.36808 > 99.181.89.37.1935: Flags [.], seq 70175:71489, ack 0, win 501, options [nop,nop,TS val 946284645 ecr 1471424717], length 1314
10:52:24.581815 IP 99.181.89.37.1935 > 10.8.3.2.36808: Flags [.], ack 58938, win 126, options [nop,nop,TS val 1471424816 ecr 946284197], length 0
10:52:24.596436 IP 10.8.3.2.36808 > 99.181.89.37.1935: Flags [.], seq 71489:72803, ack 0, win 501, options [nop,nop,TS val 946284703 ecr 1471424816], length 1314
10:52:24.632132 IP 10.8.3.2.36808 > 99.181.89.37.1935: Flags [.], seq 72803:74117, ack 0, win 501, options [nop,nop,TS val 946284739 ecr 1471424816], length 1314
10:52:24.666498 IP 99.181.89.37.1935 > 10.8.3.2.36808: Flags [.], ack 61566, win 126, options [nop,nop,TS val 1471424901 ecr 946284273], length 0
10:52:24.667215 IP 10.8.3.2.36808 > 99.181.89.37.1935: Flags [.], seq 74117:75431, ack 0, win 501, options [nop,nop,TS val 946284774 ecr 1471424901], length 1314
10:52:24.730777 IP 10.8.3.2.36808 > 99.181.89.37.1935: Flags [.], seq 75431:76745, ack 0, win 501, options [nop,nop,TS val 946284837 ecr 1471424901], length 1314
10:52:24.747987 IP 99.181.89.37.1935 > 10.8.3.2.36808: Flags [.], ack 64194, win 126, options [nop,nop,TS val 1471424982 ecr 946284374], length 0
10:52:24.767226 IP 10.8.3.2.36808 > 99.181.89.37.1935: Flags [.], seq 76745:78059, ack 0, win 501, options [nop,nop,TS val 946284874 ecr 1471424982], length 1314
10:52:24.800470 IP 10.8.3.2.36808 > 99.181.89.37.1935: Flags [.], seq 78059:79373, ack 0, win 501, options [nop,nop,TS val 946284907 ecr 1471424982], length 1314
10:52:24.850011 IP 99.181.89.37.1935 > 10.8.3.2.36808: Flags [.], ack 66822, win 126, options [nop,nop,TS val 1471425085 ecr 946284452], length 0
10:52:24.861548 IP 99.181.89.37.1935 > 10.8.3.2.36808: Flags [.], ack 67547, win 126, options [nop,nop,TS val 1471425096 ecr 946284520], length 0
10:52:24.861589 IP 10.8.3.2.36808 > 99.181.89.37.1935: Flags [P.], seq 79373:80548, ack 0, win 501, options [nop,nop,TS val 946284968 ecr 1471425096], length 1175
10:52:24.900667 IP 10.8.3.2.36808 > 99.181.89.37.1935: Flags [.], seq 80548:81862, ack 0, win 501, options [nop,nop,TS val 946285007 ecr 1471425096], length 1314
10:52:24.932521 IP 10.8.3.2.36808 > 99.181.89.37.1935: Flags [.], seq 81862:83176, ack 0, win 501, options [nop,nop,TS val 946285039 ecr 1471425096], length 1314
10:52:24.949686 IP 99.181.89.37.1935 > 10.8.3.2.36808: Flags [.], ack 70175, win 126, options [nop,nop,TS val 1471425184 ecr 946284575], length 0
10:52:24.986618 IP 10.8.3.2.36808 > 99.181.89.37.1935: Flags [.], seq 83176:84490, ack 0, win 501, options [nop,nop,TS val 946285093 ecr 1471425184], length 1314
10:52:25.033382 IP 10.8.3.2.36808 > 99.181.89.37.1935: Flags [.], seq 84490:85804, ack 0, win 501, options [nop,nop,TS val 946285140 ecr 1471425184], length 1314
10:52:25.045009 IP 99.181.89.37.1935 > 10.8.3.2.36808: Flags [.], ack 72803, win 126, options [nop,nop,TS val 1471425280 ecr 946284645], length 0
10:52:25.067172 IP 10.8.3.2.36808 > 99.181.89.37.1935: Flags [.], seq 85804:87118, ack 0, win 501, options [nop,nop,TS val 946285174 ecr 1471425280], length 1314
10:52:25.115165 IP 10.8.3.2.36808 > 99.181.89.37.1935: Flags [.], seq 87118:88432, ack 0, win 501, options [nop,nop,TS val 946285222 ecr 1471425280], length 1314
10:52:25.116852 IP 99.181.89.37.1935 > 10.8.3.2.36808: Flags [.], ack 75431, win 126, options [nop,nop,TS val 1471425351 ecr 946284739], length 0
10:52:25.163236 IP 10.8.3.2.36808 > 99.181.89.37.1935: Flags [.], seq 88432:89746, ack 0, win 501, options [nop,nop,TS val 946285270 ecr 1471425351], length 1314
10:52:25.200184 IP 10.8.3.2.36808 > 99.181.89.37.1935: Flags [.], seq 89746:91060, ack 0, win 501, options [nop,nop,TS val 946285307 ecr 1471425351], length 1314
10:52:25.216245 IP 99.181.89.37.1935 > 10.8.3.2.36808: Flags [.], ack 78059, win 126, options [nop,nop,TS val 1471425451 ecr 946284837], length 0
10:52:25.243218 IP 10.8.3.2.36808 > 99.181.89.37.1935: Flags [.], seq 91060:92374, ack 0, win 501, options [nop,nop,TS val 946285350 ecr 1471425451], length 1314
10:52:25.300514 IP 10.8.3.2.36808 > 99.181.89.37.1935: Flags [.], seq 92374:93688, ack 0, win 501, options [nop,nop,TS val 946285407 ecr 1471425451], length 1314
10:52:25.314804 IP 99.181.89.37.1935 > 10.8.3.2.36808: Flags [.], ack 80548, win 126, options [nop,nop,TS val 1471425549 ecr 946284907], length 0
10:52:25.314838 IP 10.8.3.2.36808 > 99.181.89.37.1935: Flags [P.], seq 93688:94405, ack 0, win 501, options [nop,nop,TS val 946285422 ecr 1471425549], length 717
10:52:25.363017 IP 10.8.3.2.36808 > 99.181.89.37.1935: Flags [.], seq 94405:95719, ack 0, win 501, options [nop,nop,TS val 946285470 ecr 1471425549], length 1314
10:52:25.381064 IP 99.181.89.37.1935 > 10.8.3.2.36808: Flags [.], ack 83176, win 126, options [nop,nop,TS val 1471425616 ecr 946285007], length 0
10:52:25.399107 IP 10.8.3.2.36808 > 99.181.89.37.1935: Flags [.], seq 95719:97033, ack 0, win 501, options [nop,nop,TS val 946285506 ecr 1471425616], length 1314
10:52:25.435534 IP 10.8.3.2.36808 > 99.181.89.37.1935: Flags [.], seq 97033:98347, ack 0, win 501, options [nop,nop,TS val 946285542 ecr 1471425616], length 1314
10:52:25.482004 IP 99.181.89.37.1935 > 10.8.3.2.36808: Flags [.], ack 85804, win 126, options [nop,nop,TS val 1471425717 ecr 946285093], length 0
10:52:25.499060 IP 10.8.3.2.36808 > 99.181.89.37.1935: Flags [.], seq 98347:99661, ack 0, win 501, options [nop,nop,TS val 946285606 ecr 1471425717], length 1314
10:52:25.531696 IP 10.8.3.2.36808 > 99.181.89.37.1935: Flags [.], seq 99661:100975, ack 0, win 501, options [nop,nop,TS val 946285638 ecr 1471425717], length 1314
10:52:25.563816 IP 99.181.89.37.1935 > 10.8.3.2.36808: Flags [.], ack 88432, win 126, options [nop,nop,TS val 1471425798 ecr 946285174], length 0
10:52:25.567184 IP 10.8.3.2.36808 > 99.181.89.37.1935: Flags [.], seq 100975:102289, ack 0, win 501, options [nop,nop,TS val 946285674 ecr 1471425798], length 1314
10:52:25.633760 IP 10.8.3.2.36808 > 99.181.89.37.1935: Flags [.], seq 102289:103603, ack 0, win 501, options [nop,nop,TS val 946285740 ecr 1471425798], length 1314
10:52:25.648912 IP 99.181.89.37.1935 > 10.8.3.2.36808: Flags [.], ack 91060, win 126, options [nop,nop,TS val 1471425883 ecr 946285270], length 0
10:52:25.667155 IP 10.8.3.2.36808 > 99.181.89.37.1935: Flags [.], seq 103603:104917, ack 0, win 501, options [nop,nop,TS val 946285774 ecr 1471425883], length 1314
10:52:25.700475 IP 10.8.3.2.36808 > 99.181.89.37.1935: Flags [.], seq 104917:106231, ack 0, win 501, options [nop,nop,TS val 946285807 ecr 1471425883], length 1314
10:52:25.749481 IP 99.181.89.37.1935 > 10.8.3.2.36808: Flags [.], ack 93688, win 126, options [nop,nop,TS val 1471425984 ecr 946285350], length 0
10:52:25.763262 IP 99.181.89.37.1935 > 10.8.3.2.36808: Flags [.], ack 94405, win 126, options [nop,nop,TS val 1471425998 ecr 946285422], length 0
10:52:25.763312 IP 10.8.3.2.36808 > 99.181.89.37.1935: Flags [P.], seq 106231:107411, ack 0, win 501, options [nop,nop,TS val 946285870 ecr 1471425998], length 1180
10:52:25.799466 IP 10.8.3.2.36808 > 99.181.89.37.1935: Flags [.], seq 107411:108725, ack 0, win 501, options [nop,nop,TS val 946285906 ecr 1471425998], length 1314
10:52:25.833375 IP 10.8.3.2.36808 > 99.181.89.37.1935: Flags [.], seq 108725:110039, ack 0, win 501, options [nop,nop,TS val 946285940 ecr 1471425998], length 1314
10:52:25.848105 IP 99.181.89.37.1935 > 10.8.3.2.36808: Flags [.], ack 97033, win 126, options [nop,nop,TS val 1471426082 ecr 946285470], length 0
10:52:25.885242 IP 10.8.3.2.36808 > 99.181.89.37.1935: Flags [.], seq 110039:111353, ack 0, win 501, options [nop,nop,TS val 946285992 ecr 1471426082], length 1314
10:52:25.933794 IP 10.8.3.2.36808 > 99.181.89.37.1935: Flags [.], seq 111353:112667, ack 0, win 501, options [nop,nop,TS val 946286040 ecr 1471426082], length 1314
10:52:25.947832 IP 99.181.89.37.1935 > 10.8.3.2.36808: Flags [.], ack 99661, win 126, options [nop,nop,TS val 1471426182 ecr 946285542], length 0
10:52:25.967241 IP 10.8.3.2.36808 > 99.181.89.37.1935: Flags [.], seq 112667:113981, ack 0, win 501, options [nop,nop,TS val 946286074 ecr 1471426182], length 1314
10:52:26.014043 IP 10.8.3.2.36808 > 99.181.89.37.1935: Flags [.], seq 113981:115295, ack 0, win 501, options [nop,nop,TS val 946286121 ecr 1471426182], length 1314
10:52:26.015848 IP 99.181.89.37.1935 > 10.8.3.2.36808: Flags [.], ack 102289, win 126, options [nop,nop,TS val 1471426250 ecr 946285638], length 0
10:52:26.065413 IP 10.8.3.2.36808 > 99.181.89.37.1935: Flags [.], seq 115295:116609, ack 0, win 501, options [nop,nop,TS val 946286172 ecr 1471426250], length 1314
10:52:26.100333 IP 10.8.3.2.36808 > 99.181.89.37.1935: Flags [.], seq 116609:117923, ack 0, win 501, options [nop,nop,TS val 946286207 ecr 1471426250], length 1314
10:52:26.116104 IP 99.181.89.37.1935 > 10.8.3.2.36808: Flags [.], ack 104917, win 126, options [nop,nop,TS val 1471426351 ecr 946285740], length 0
10:52:26.142577 IP 10.8.3.2.36808 > 99.181.89.37.1935: Flags [.], seq 117923:119237, ack 0, win 501, options [nop,nop,TS val 946286249 ecr 1471426351], length 1314
10:52:26.196807 IP 10.8.3.2.36808 > 99.181.89.37.1935: Flags [.], seq 119237:120551, ack 0, win 501, options [nop,nop,TS val 946286304 ecr 1471426351], length 1314
10:52:26.212061 IP 99.181.89.37.1935 > 10.8.3.2.36808: Flags [.], ack 107411, win 126, options [nop,nop,TS val 1471426447 ecr 946285807], length 0
10:52:26.212077 IP 10.8.3.2.36808 > 99.181.89.37.1935: Flags [P.], seq 120551:121264, ack 0, win 501, options [nop,nop,TS val 946286319 ecr 1471426447], length 713
10:52:26.270782 IP 10.8.3.2.36808 > 99.181.89.37.1935: Flags [.], seq 121264:122578, ack 0, win 501, options [nop,nop,TS val 946286377 ecr 1471426447], length 1314
10:52:26.282279 IP 99.181.89.37.1935 > 10.8.3.2.36808: Flags [.], ack 110039, win 126, options [nop,nop,TS val 1471426517 ecr 946285906], length 0
10:52:26.301762 IP 10.8.3.2.36808 > 99.181.89.37.1935: Flags [.], seq 122578:123892, ack 0, win 501, options [nop,nop,TS val 946286408 ecr 1471426517], length 1314
10:52:26.335239 IP 10.8.3.2.36808 > 99.181.89.37.1935: Flags [.], seq 123892:125206, ack 0, win 501, options [nop,nop,TS val 946286442 ecr 1471426517], length 1314
10:52:26.382526 IP 99.181.89.37.1935 > 10.8.3.2.36808: Flags [.], ack 112667, win 126, options [nop,nop,TS val 1471426617 ecr 946285992], length 0
10:52:26.400552 IP 10.8.3.2.36808 > 99.181.89.37.1935: Flags [.], seq 125206:126520, ack 0, win 501, options [nop,nop,TS val 946286507 ecr 1471426617], length 1314
10:52:26.433549 IP 10.8.3.2.36808 > 99.181.89.37.1935: Flags [.], seq 126520:127834, ack 0, win 501, options [nop,nop,TS val 946286540 ecr 1471426617], length 1314
10:52:26.462593 IP 99.181.89.37.1935 > 10.8.3.2.36808: Flags [.], ack 115295, win 126, options [nop,nop,TS val 1471426697 ecr 946286074], length 0
10:52:26.467011 IP 10.8.3.2.36808 > 99.181.89.37.1935: Flags [.], seq 127834:129148, ack 0, win 501, options [nop,nop,TS val 946286574 ecr 1471426697], length 1314
10:52:26.533669 IP 10.8.3.2.36808 > 99.181.89.37.1935: Flags [.], seq 129148:130462, ack 0, win 501, options [nop,nop,TS val 946286640 ecr 1471426697], length 1314
10:52:26.549056 IP 99.181.89.37.1935 > 10.8.3.2.36808: Flags [.], ack 117923, win 126, options [nop,nop,TS val 1471426784 ecr 946286172], length 0
10:52:26.571454 IP 10.8.3.2.36808 > 99.181.89.37.1935: Flags [.], seq 130462:131776, ack 0, win 501, options [nop,nop,TS val 946286678 ecr 1471426784], length 1314
10:52:26.598103 IP 10.8.3.2.36808 > 99.181.89.37.1935: Flags [.], seq 131776:133090, ack 0, win 501, options [nop,nop,TS val 946286705 ecr 1471426784], length 1314
10:52:26.645359 IP 99.181.89.37.1935 > 10.8.3.2.36808: Flags [.], ack 120551, win 126, options [nop,nop,TS val 1471426880 ecr 946286249], length 0
10:52:26.660660 IP 99.181.89.37.1935 > 10.8.3.2.36808: Flags [.], ack 121264, win 126, options [nop,nop,TS val 1471426895 ecr 946286319], length 0
10:52:26.660693 IP 10.8.3.2.36808 > 99.181.89.37.1935: Flags [P.], seq 133090:134277, ack 0, win 501, options [nop,nop,TS val 946286767 ecr 1471426895], length 1187
10:52:26.701226 IP 10.8.3.2.36808 > 99.181.89.37.1935: Flags [.], seq 134277:135591, ack 0, win 501, options [nop,nop,TS val 946286808 ecr 1471426895], length 1314
10:52:26.732552 IP 10.8.3.2.36808 > 99.181.89.37.1935: Flags [.], seq 135591:136905, ack 0, win 501, options [nop,nop,TS val 946286839 ecr 1471426895], length 1314
10:52:26.752731 IP 99.181.89.37.1935 > 10.8.3.2.36808: Flags [.], ack 123892, win 126, options [nop,nop,TS val 1471426985 ecr 946286377], length 0
10:52:26.785509 IP 10.8.3.2.36808 > 99.181.89.37.1935: Flags [.], seq 136905:138219, ack 0, win 501, options [nop,nop,TS val 946286892 ecr 1471426985], length 1314
10:52:26.834008 IP 10.8.3.2.36808 > 99.181.89.37.1935: Flags [.], seq 138219:139533, ack 0, win 501, options [nop,nop,TS val 946286941 ecr 1471426985], length 1314
10:52:26.849523 IP 99.181.89.37.1935 > 10.8.3.2.36808: Flags [.], ack 126520, win 126, options [nop,nop,TS val 1471427084 ecr 946286442], length 0
10:52:26.871345 IP 10.8.3.2.36808 > 99.181.89.37.1935: Flags [.], seq 139533:140847, ack 0, win 501, options [nop,nop,TS val 946286978 ecr 1471427084], length 1314
10:52:26.913813 IP 10.8.3.2.36808 > 99.181.89.37.1935: Flags [.], seq 140847:142161, ack 0, win 501, options [nop,nop,TS val 946287021 ecr 1471427084], length 1314
10:52:26.918832 IP 99.181.89.37.1935 > 10.8.3.2.36808: Flags [.], ack 129148, win 126, options [nop,nop,TS val 1471427154 ecr 946286540], length 0
10:52:26.966217 IP 10.8.3.2.36808 > 99.181.89.37.1935: Flags [.], seq 142161:143475, ack 0, win 501, options [nop,nop,TS val 946287073 ecr 1471427154], length 1314
10:52:27.000480 IP 10.8.3.2.36808 > 99.181.89.37.1935: Flags [.], seq 143475:144789, ack 0, win 501, options [nop,nop,TS val 946287107 ecr 1471427154], length 1314
10:52:27.020156 IP 99.181.89.37.1935 > 10.8.3.2.36808: Flags [.], ack 131776, win 126, options [nop,nop,TS val 1471427255 ecr 946286640], length 0
10:52:27.042578 IP 10.8.3.2.36808 > 99.181.89.37.1935: Flags [.], seq 144789:146103, ack 0, win 501, options [nop,nop,TS val 946287149 ecr 1471427255], length 1314
10:52:27.107122 IP 10.8.3.2.36808 > 99.181.89.37.1935: Flags [.], seq 146103:147417, ack 0, win 501, options [nop,nop,TS val 946287214 ecr 1471427255], length 1314
10:52:27.109306 IP 99.181.89.37.1935 > 10.8.3.2.36808: Flags [.], ack 134277, win 126, options [nop,nop,TS val 1471427344 ecr 946286705], length 0
10:52:27.109340 IP 10.8.3.2.36808 > 99.181.89.37.1935: Flags [P.], seq 147417:148122, ack 0, win 501, options [nop,nop,TS val 946287216 ecr 1471427344], length 705
10:52:27.171019 IP 10.8.3.2.36808 > 99.181.89.37.1935: Flags [.], seq 148122:149436, ack 0, win 501, options [nop,nop,TS val 946287278 ecr 1471427344], length 1314
10:52:27.181285 IP 99.181.89.37.1935 > 10.8.3.2.36808: Flags [.], ack 136905, win 126, options [nop,nop,TS val 1471427416 ecr 946286808], length 0
10:52:27.198635 IP 10.8.3.2.36808 > 99.181.89.37.1935: Flags [.], seq 149436:150750, ack 0, win 501, options [nop,nop,TS val 946287305 ecr 1471427416], length 1314
10:52:27.234612 IP 10.8.3.2.36808 > 99.181.89.37.1935: Flags [.], seq 150750:152064, ack 0, win 501, options [nop,nop,TS val 946287341 ecr 1471427416], length 1314
10:52:27.282469 IP 99.181.89.37.1935 > 10.8.3.2.36808: Flags [.], ack 139533, win 126, options [nop,nop,TS val 1471427517 ecr 946286892], length 0
10:52:27.299058 IP 10.8.3.2.36808 > 99.181.89.37.1935: Flags [.], seq 152064:153378, ack 0, win 501, options [nop,nop,TS val 946287406 ecr 1471427517], length 1314
10:52:27.341090 IP 10.8.3.2.36808 > 99.181.89.37.1935: Flags [.], seq 153378:154692, ack 0, win 501, options [nop,nop,TS val 946287448 ecr 1471427517], length 1314
10:52:27.362915 IP 10.8.3.2.36808 > 99.181.89.37.1935: Flags [.], seq 154692:156006, ack 0, win 501, options [nop,nop,TS val 946287470 ecr 1471427517], length 1314
10:52:27.370840 IP 99.181.89.37.1935 > 10.8.3.2.36808: Flags [.], ack 142161, win 126, options [nop,nop,TS val 1471427597 ecr 946286978], length 0
10:52:27.433802 IP 10.8.3.2.36808 > 99.181.89.37.1935: Flags [.], seq 156006:157320, ack 0, win 501, options [nop,nop,TS val 946287540 ecr 1471427597], length 1314
10:52:27.449459 IP 99.181.89.37.1935 > 10.8.3.2.36808: Flags [.], ack 144789, win 126, options [nop,nop,TS val 1471427684 ecr 946287073], length 0
10:52:27.469543 IP 10.8.3.2.36808 > 99.181.89.37.1935: Flags [.], seq 157320:158634, ack 0, win 501, options [nop,nop,TS val 946287576 ecr 1471427684], length 1314
10:52:27.498838 IP 10.8.3.2.36808 > 99.181.89.37.1935: Flags [.], seq 158634:159948, ack 0, win 501, options [nop,nop,TS val 946287606 ecr 1471427684], length 1314
10:52:27.556040 IP 99.181.89.37.1935 > 10.8.3.2.36808: Flags [.], ack 147417, win 126, options [nop,nop,TS val 1471427790 ecr 946287149], length 0
10:52:27.557606 IP 99.181.89.37.1935 > 10.8.3.2.36808: Flags [.], ack 148122, win 126, options [nop,nop,TS val 1471427792 ecr 946287216], length 0
10:52:27.557621 IP 10.8.3.2.36808 > 99.181.89.37.1935: Flags [P.], seq 159948:161140, ack 0, win 501, options [nop,nop,TS val 946287664 ecr 1471427792], length 1192
10:52:27.600410 IP 10.8.3.2.36808 > 99.181.89.37.1935: Flags [.], seq 161140:162454, ack 0, win 501, options [nop,nop,TS val 946287707 ecr 1471427792], length 1314
10:52:27.640362 IP 10.8.3.2.36808 > 99.181.89.37.1935: Flags [.], seq 162454:163768, ack 0, win 501, options [nop,nop,TS val 946287747 ecr 1471427792], length 1314
10:52:27.647463 IP 99.181.89.37.1935 > 10.8.3.2.36808: Flags [.], ack 150750, win 126, options [nop,nop,TS val 1471427882 ecr 946287278], length 0
10:52:27.683331 IP 10.8.3.2.36808 > 99.181.89.37.1935: Flags [.], seq 163768:165082, ack 0, win 501, options [nop,nop,TS val 946287790 ecr 1471427882], length 1314
10:52:27.731274 IP 10.8.3.2.36808 > 99.181.89.37.1935: Flags [.], seq 165082:166396, ack 0, win 501, options [nop,nop,TS val 946287838 ecr 1471427882], length 1314
10:52:27.747662 IP 99.181.89.37.1935 > 10.8.3.2.36808: Flags [.], ack 153378, win 126, options [nop,nop,TS val 1471427982 ecr 946287341], length 0
10:52:27.768454 IP 10.8.3.2.36808 > 99.181.89.37.1935: Flags [.], seq 166396:167710, ack 0, win 501, options [nop,nop,TS val 946287875 ecr 1471427982], length 1314
10:52:27.810961 IP 10.8.3.2.36808 > 99.181.89.37.1935: Flags [.], seq 167710:169024, ack 0, win 501, options [nop,nop,TS val 946287918 ecr 1471427982], length 1314
10:52:27.819046 IP 99.181.89.37.1935 > 10.8.3.2.36808: Flags [.], ack 156006, win 126, options [nop,nop,TS val 1471428053 ecr 946287448], length 0
10:52:27.875387 IP 10.8.3.2.36808 > 99.181.89.37.1935: Flags [.], seq 169024:170338, ack 0, win 501, options [nop,nop,TS val 946287982 ecr 1471428053], length 1314
10:52:27.901457 IP 10.8.3.2.36808 > 99.181.89.37.1935: Flags [.], seq 170338:171652, ack 0, win 501, options [nop,nop,TS val 946288008 ecr 1471428053], length 1314
10:52:27.918488 IP 99.181.89.37.1935 > 10.8.3.2.36808: Flags [.], ack 158634, win 126, options [nop,nop,TS val 1471428153 ecr 946287540], length 0
10:52:27.939886 IP 10.8.3.2.36808 > 99.181.89.37.1935: Flags [.], seq 171652:172966, ack 0, win 501, options [nop,nop,TS val 946288047 ecr 1471428153], length 1314
10:52:28.003884 IP 10.8.3.2.36808 > 99.181.89.37.1935: Flags [.], seq 172966:174280, ack 0, win 501, options [nop,nop,TS val 946288111 ecr 1471428153], length 1314
10:52:28.008073 IP 99.181.89.37.1935 > 10.8.3.2.36808: Flags [.], ack 161140, win 126, options [nop,nop,TS val 1471428241 ecr 946287606], length 0
10:52:28.008108 IP 10.8.3.2.36808 > 99.181.89.37.1935: Flags [P.], seq 174280:174989, ack 0, win 501, options [nop,nop,TS val 946288115 ecr 1471428241], length 709
10:52:28.068209 IP 10.8.3.2.36808 > 99.181.89.37.1935: Flags [.], seq 174989:176303, ack 0, win 501, options [nop,nop,TS val 946288175 ecr 1471428241], length 1314
10:52:28.089235 IP 99.181.89.37.1935 > 10.8.3.2.36808: Flags [.], ack 163768, win 126, options [nop,nop,TS val 1471428324 ecr 946287707], length 0
10:52:28.100335 IP 10.8.3.2.36808 > 99.181.89.37.1935: Flags [.], seq 176303:177617, ack 0, win 501, options [nop,nop,TS val 946288207 ecr 1471428324], length 1314
10:52:28.133845 IP 10.8.3.2.36808 > 99.181.89.37.1935: Flags [.], seq 177617:178931, ack 0, win 501, options [nop,nop,TS val 946288241 ecr 1471428324], length 1314
10:52:28.179962 IP 99.181.89.37.1935 > 10.8.3.2.36808: Flags [.], ack 166396, win 126, options [nop,nop,TS val 1471428414 ecr 946287790], length 0
10:52:28.200499 IP 10.8.3.2.36808 > 99.181.89.37.1935: Flags [.], seq 178931:180245, ack 0, win 501, options [nop,nop,TS val 946288307 ecr 1471428414], length 1314
10:52:28.240094 IP 10.8.3.2.36808 > 99.181.89.37.1935: Flags [.], seq 180245:181559, ack 0, win 501, options [nop,nop,TS val 946288347 ecr 1471428414], length 1314
10:52:28.260307 IP 99.181.89.37.1935 > 10.8.3.2.36808: Flags [.], ack 169024, win 126, options [nop,nop,TS val 1471428495 ecr 946287875], length 0
10:52:28.265696 IP 10.8.3.2.36808 > 99.181.89.37.1935: Flags [.], seq 181559:182873, ack 0, win 501, options [nop,nop,TS val 946288372 ecr 1471428495], length 1314
10:52:28.333370 IP 10.8.3.2.36808 > 99.181.89.37.1935: Flags [.], seq 182873:184187, ack 0, win 501, options [nop,nop,TS val 946288440 ecr 1471428495], length 1314
10:52:28.350351 IP 99.181.89.37.1935 > 10.8.3.2.36808: Flags [.], ack 171652, win 126, options [nop,nop,TS val 1471428585 ecr 946287982], length 0
10:52:28.368626 IP 10.8.3.2.36808 > 99.181.89.37.1935: Flags [.], seq 184187:185501, ack 0, win 501, options [nop,nop,TS val 946288475 ecr 1471428585], length 1314
10:52:28.411406 IP 10.8.3.2.36808 > 99.181.89.37.1935: Flags [.], seq 185501:186815, ack 0, win 501, options [nop,nop,TS val 946288518 ecr 1471428585], length 1314
10:52:28.455718 IP 99.181.89.37.1935 > 10.8.3.2.36808: Flags [.], ack 174280, win 126, options [nop,nop,TS val 1471428690 ecr 946288047], length 0
10:52:28.457728 IP 99.181.89.37.1935 > 10.8.3.2.36808: Flags [.], ack 174989, win 126, options [nop,nop,TS val 1471428691 ecr 946288115], length 0
10:52:28.457762 IP 10.8.3.2.36808 > 99.181.89.37.1935: Flags [P.], seq 186815:188002, ack 0, win 501, options [nop,nop,TS val 946288564 ecr 1471428691], length 1187
10:52:28.500147 IP 10.8.3.2.36808 > 99.181.89.37.1935: Flags [.], seq 188002:189316, ack 0, win 501, options [nop,nop,TS val 946288607 ecr 1471428691], length 1314
10:52:28.539976 IP 10.8.3.2.36808 > 99.181.89.37.1935: Flags [.], seq 189316:190630, ack 0, win 501, options [nop,nop,TS val 946288647 ecr 1471428691], length 1314
10:52:28.549317 IP 99.181.89.37.1935 > 10.8.3.2.36808: Flags [.], ack 177617, win 126, options [nop,nop,TS val 1471428784 ecr 946288175], length 0
10:52:28.582894 IP 10.8.3.2.36808 > 99.181.89.37.1935: Flags [.], seq 190630:191944, ack 0, win 501, options [nop,nop,TS val 946288690 ecr 1471428784], length 1314
10:52:28.633799 IP 10.8.3.2.36808 > 99.181.89.37.1935: Flags [.], seq 191944:193258, ack 0, win 501, options [nop,nop,TS val 946288740 ecr 1471428784], length 1314
10:52:28.649129 IP 99.181.89.37.1935 > 10.8.3.2.36808: Flags [.], ack 180245, win 126, options [nop,nop,TS val 1471428884 ecr 946288241], length 0
10:52:28.668699 IP 10.8.3.2.36808 > 99.181.89.37.1935: Flags [.], seq 193258:194572, ack 0, win 501, options [nop,nop,TS val 946288775 ecr 1471428884], length 1314
10:52:28.711656 IP 10.8.3.2.36808 > 99.181.89.37.1935: Flags [.], seq 194572:195886, ack 0, win 501, options [nop,nop,TS val 946288818 ecr 1471428884], length 1314
10:52:28.715742 IP 99.181.89.37.1935 > 10.8.3.2.36808: Flags [.], ack 182873, win 126, options [nop,nop,TS val 1471428950 ecr 946288347], length 0
10:52:28.775856 IP 10.8.3.2.36808 > 99.181.89.37.1935: Flags [.], seq 195886:197200, ack 0, win 501, options [nop,nop,TS val 946288883 ecr 1471428950], length 1314
10:52:28.797751 IP 10.8.3.2.36808 > 99.181.89.37.1935: Flags [.], seq 197200:198514, ack 0, win 501, options [nop,nop,TS val 946288904 ecr 1471428950], length 1314
10:52:28.817329 IP 99.181.89.37.1935 > 10.8.3.2.36808: Flags [.], ack 185501, win 126, options [nop,nop,TS val 1471429052 ecr 946288440], length 0
10:52:28.831182 IP 10.8.3.2.36808 > 99.181.89.37.1935: Flags [.], seq 198514:199828, ack 0, win 501, options [nop,nop,TS val 946288938 ecr 1471429052], length 1314
10:52:28.899364 IP 10.8.3.2.36808 > 99.181.89.37.1935: Flags [.], seq 199828:201142, ack 0, win 501, options [nop,nop,TS val 946289006 ecr 1471429052], length 1314
10:52:28.907184 IP 99.181.89.37.1935 > 10.8.3.2.36808: Flags [.], ack 188002, win 126, options [nop,nop,TS val 1471429142 ecr 946288518], length 0
10:52:28.907216 IP 10.8.3.2.36808 > 99.181.89.37.1935: Flags [P.], seq 201142:201946, ack 0, win 501, options [nop,nop,TS val 946289014 ecr 1471429142], length 804
10:52:28.962760 IP 10.8.3.2.36808 > 99.181.89.37.1935: Flags [.], seq 201946:203260, ack 0, win 501, options [nop,nop,TS val 946289069 ecr 1471429142], length 1314
10:52:28.988661 IP 99.181.89.37.1935 > 10.8.3.2.36808: Flags [.], ack 190630, win 126, options [nop,nop,TS val 1471429223 ecr 946288607], length 0
10:52:28.996475 IP 10.8.3.2.36808 > 99.181.89.37.1935: Flags [.], seq 203260:204574, ack 0, win 501, options [nop,nop,TS val 946289103 ecr 1471429223], length 1314
10:52:29.033225 IP 10.8.3.2.36808 > 99.181.89.37.1935: Flags [.], seq 204574:205888, ack 0, win 501, options [nop,nop,TS val 946289140 ecr 1471429223], length 1314
10:52:29.082569 IP 99.181.89.37.1935 > 10.8.3.2.36808: Flags [.], ack 193258, win 126, options [nop,nop,TS val 1471429317 ecr 946288690], length 0
10:52:29.096769 IP 10.8.3.2.36808 > 99.181.89.37.1935: Flags [.], seq 205888:207202, ack 0, win 501, options [nop,nop,TS val 946289203 ecr 1471429317], length 1314
10:52:29.131132 IP 10.8.3.2.36808 > 99.181.89.37.1935: Flags [.], seq 207202:208516, ack 0, win 501, options [nop,nop,TS val 946289238 ecr 1471429317], length 1314
10:52:29.160682 IP 99.181.89.37.1935 > 10.8.3.2.36808: Flags [.], ack 195886, win 126, options [nop,nop,TS val 1471429395 ecr 946288775], length 0
10:52:29.166515 IP 10.8.3.2.36808 > 99.181.89.37.1935: Flags [.], seq 208516:209830, ack 0, win 501, options [nop,nop,TS val 946289273 ecr 1471429395], length 1314
10:52:29.233809 IP 10.8.3.2.36808 > 99.181.89.37.1935: Flags [.], seq 209830:211144, ack 0, win 501, options [nop,nop,TS val 946289340 ecr 1471429395], length 1314
10:52:29.246527 IP 99.181.89.37.1935 > 10.8.3.2.36808: Flags [.], ack 198514, win 126, options [nop,nop,TS val 1471429481 ecr 946288883], length 0
10:52:29.265283 IP 10.8.3.2.36808 > 99.181.89.37.1935: Flags [.], seq 211144:212458, ack 0, win 501, options [nop,nop,TS val 946289372 ecr 1471429481], length 1314
10:52:29.298811 IP 10.8.3.2.36808 > 99.181.89.37.1935: Flags [.], seq 212458:213772, ack 0, win 501, options [nop,nop,TS val 946289405 ecr 1471429481], length 1314
10:52:29.348218 IP 99.181.89.37.1935 > 10.8.3.2.36808: Flags [.], ack 201142, win 126, options [nop,nop,TS val 1471429583 ecr 946288938], length 0
10:52:29.355922 IP 99.181.89.37.1935 > 10.8.3.2.36808: Flags [.], ack 201946, win 126, options [nop,nop,TS val 1471429590 ecr 946289014], length 0
10:52:29.355954 IP 10.8.3.2.36808 > 99.181.89.37.1935: Flags [P.], seq 213772:214951, ack 0, win 501, options [nop,nop,TS val 946289463 ecr 1471429590], length 1179
10:52:29.397044 IP 10.8.3.2.36808 > 99.181.89.37.1935: Flags [.], seq 214951:216265, ack 0, win 501, options [nop,nop,TS val 946289504 ecr 1471429590], length 1314
10:52:29.431745 IP 10.8.3.2.36808 > 99.181.89.37.1935: Flags [.], seq 216265:217579, ack 0, win 501, options [nop,nop,TS val 946289538 ecr 1471429590], length 1314
10:52:29.445709 IP 99.181.89.37.1935 > 10.8.3.2.36808: Flags [.], ack 204574, win 126, options [nop,nop,TS val 1471429680 ecr 946289069], length 0
10:52:29.482679 IP 10.8.3.2.36808 > 99.181.89.37.1935: Flags [.], seq 217579:218893, ack 0, win 501, options [nop,nop,TS val 946289589 ecr 1471429680], length 1314
10:52:29.531981 IP 10.8.3.2.36808 > 99.181.89.37.1935: Flags [.], seq 218893:220207, ack 0, win 501, options [nop,nop,TS val 946289639 ecr 1471429680], length 1314
10:52:29.545287 IP 99.181.89.37.1935 > 10.8.3.2.36808: Flags [.], ack 207202, win 126, options [nop,nop,TS val 1471429780 ecr 946289140], length 0
10:52:29.565181 IP 10.8.3.2.36808 > 99.181.89.37.1935: Flags [.], seq 220207:221521, ack 0, win 501, options [nop,nop,TS val 946289672 ecr 1471429780], length 1314
10:52:29.610969 IP 10.8.3.2.36808 > 99.181.89.37.1935: Flags [.], seq 221521:222835, ack 0, win 501, options [nop,nop,TS val 946289718 ecr 1471429780], length 1314
10:52:29.615114 IP 99.181.89.37.1935 > 10.8.3.2.36808: Flags [.], ack 209830, win 126, options [nop,nop,TS val 1471429850 ecr 946289238], length 0
10:52:29.665360 IP 10.8.3.2.36808 > 99.181.89.37.1935: Flags [.], seq 222835:224149, ack 0, win 501, options [nop,nop,TS val 946289772 ecr 1471429850], length 1314
10:52:29.696419 IP 10.8.3.2.36808 > 99.181.89.37.1935: Flags [.], seq 224149:225463, ack 0, win 501, options [nop,nop,TS val 946289803 ecr 1471429850], length 1314
10:52:29.714142 IP 99.181.89.37.1935 > 10.8.3.2.36808: Flags [.], ack 212458, win 126, options [nop,nop,TS val 1471429949 ecr 946289340], length 0
