06:30:16.633242 IP 10.8.2.7.40570 > 99.181.67.81.1935: Flags [.], seq 2988281033:2988282347, ack 2304282996, win 501, options [nop,nop,TS val 3005086943 ecr 2840406687], length 1314
06:30:16.666087 IP 99.181.67.81.1935 > 10.8.2.7.40570: Flags [.], ack 4294958987, win 199, options [nop,nop,TS val 2840406760 ecr 3005086576], length 0
06:30:16.666123 IP 10.8.2.7.40570 > 99.181.67.81.1935: Flags [.], seq 1314:2628, ack 1, win 501, options [nop,nop,TS val 3005086976 ecr 2840406760], length 1314
06:30:16.697131 IP 10.8.2.7.40570 > 99.181.67.81.1935: Flags [.], seq 2628:3942, ack 1, win 501, options [nop,nop,TS val 3005087007 ecr 2840406760], length 1314
06:30:16.744901 IP 99.181.67.81.1935 > 10.8.2.7.40570: Flags [.], ack 4294960301, win 199, options [nop,nop,TS val 2840406851 ecr 3005086640], length 0
06:30:16.766567 IP 10.8.2.7.40570 > 99.181.67.81.1935: Flags [.], seq 3942:5256, ack 1, win 501, options [nop,nop,TS val 3005087076 ecr 2840406851], length 1314
06:30:16.793321 IP 99.181.67.81.1935 > 10.8.2.7.40570: Flags [.], ack 4294962929, win 199, options [nop,nop,TS val 2840406911 ecr 3005086706], length 0
06:30:16.800204 IP 10.8.2.7.40570 > 99.181.67.81.1935: Flags [.], seq 5256:6570, ack 1, win 501, options [nop,nop,TS val 3005087110 ecr 2840406911], length 1314
06:30:16.832874 IP 10.8.2.7.40570 > 99.181.67.81.1935: Flags [.], seq 6570:7884, ack 1, win 501, options [nop,nop,TS val 3005087143 ecr 2840406911], length 1314
06:30:16.891494 IP 99.181.67.81.1935 > 10.8.2.7.40570: Flags [.], ack 4294965557, win 198, options [nop,nop,TS val 2840407016 ecr 3005086775], length 0
06:30:16.897293 IP 10.8.2.7.40570 > 99.181.67.81.1935: Flags [.], seq 7884:9198, ack 1, win 501, options [nop,nop,TS val 3005087207 ecr 2840407016], length 1314
06:30:16.924539 IP 99.181.67.81.1935 > 10.8.2.7.40570: Flags [.], ack 0, win 199, options [nop,nop,TS val 2840407049 ecr 3005086872], length 0
06:30:16.924576 IP 10.8.2.7.40570 > 99.181.67.81.1935: Flags [P.], seq 9198:10083, ack 1, win 501, options [nop,nop,TS val 3005087234 ecr 2840407049], length 885
06:30:16.961842 IP 10.8.2.7.40570 > 99.181.67.81.1935: Flags [.], seq 10083:11397, ack 1, win 501, options [nop,nop,TS val 3005087272 ecr 2840407049], length 1314
06:30:16.996932 IP 10.8.2.7.40570 > 99.181.67.81.1935: Flags [.], seq 11397:12711, ack 1, win 501, options [nop,nop,TS val 3005087307 ecr 2840407049], length 1314
06:30:17.002813 IP 99.181.67.81.1935 > 10.8.2.7.40570: Flags [.], ack 2628, win 199, options [nop,nop,TS val 2840407126 ecr 3005086943], length 0
06:30:17.047105 IP 10.8.2.7.40570 > 99.181.67.81.1935: Flags [.], seq 12711:14025, ack 1, win 501, options [nop,nop,TS val 3005087357 ecr 2840407126], length 1314
06:30:17.096616 IP 10.8.2.7.40570 > 99.181.67.81.1935: Flags [.], seq 14025:15339, ack 1, win 501, options [nop,nop,TS val 3005087406 ecr 2840407126], length 1314
06:30:17.101208 IP 99.181.67.81.1935 > 10.8.2.7.40570: Flags [.], ack 3942, win 199, options [nop,nop,TS val 2840407223 ecr 3005087007], length 0
06:30:17.129721 IP 10.8.2.7.40570 > 99.181.67.81.1935: Flags [.], seq 15339:16653, ack 1, win 501, options [nop,nop,TS val 3005087439 ecr 2840407223], length 1314
06:30:17.145007 IP 99.181.67.81.1935 > 10.8.2.7.40570: Flags [.], ack 6570, win 199, options [nop,nop,TS val 2840407261 ecr 3005087076], length 0
06:30:17.174276 IP 10.8.2.7.40570 > 99.181.67.81.1935: Flags [.], seq 16653:17967, ack 1, win 501, options [nop,nop,TS val 3005087484 ecr 2840407261], length 1314
06:30:17.231534 IP 10.8.2.7.40570 > 99.181.67.81.1935: Flags [.], seq 17967:19281, ack 1, win 501, options [nop,nop,TS val 3005087541 ecr 2840407261], length 1314
06:30:17.234423 IP 99.181.67.81.1935 > 10.8.2.7.40570: Flags [.], ack 9198, win 198, options [nop,nop,TS val 2840407358 ecr 3005087143], length 0
06:30:17.259375 IP 10.8.2.7.40570 > 99.181.67.81.1935: Flags [.], seq 19281:20595, ack 1, win 501, options [nop,nop,TS val 3005087569 ecr 2840407358], length 1314
06:30:17.266431 IP 99.181.67.81.1935 > 10.8.2.7.40570: Flags [.], ack 10083, win 199, options [nop,nop,TS val 2840407385 ecr 3005087234], length 0
06:30:17.266458 IP 10.8.2.7.40570 > 99.181.67.81.1935: Flags [P.], seq 20595:20921, ack 1, win 501, options [nop,nop,TS val 3005087576 ecr 2840407385], length 326
06:30:17.333071 IP 99.181.67.81.1935 > 10.8.2.7.40570: Flags [.], ack 12711, win 199, options [nop,nop,TS val 2840407457 ecr 3005087272], length 0
06:30:17.333562 IP 10.8.2.7.40570 > 99.181.67.81.1935: Flags [.], seq 20921:22235, ack 1, win 501, options [nop,nop,TS val 3005087643 ecr 2840407457], length 1314
06:30:17.366921 IP 10.8.2.7.40570 > 99.181.67.81.1935: Flags [.], seq 22235:23549, ack 1, win 501, options [nop,nop,TS val 3005087677 ecr 2840407457], length 1314
06:30:17.398450 IP 10.8.2.7.40570 > 99.181.67.81.1935: Flags [.], seq 23549:24863, ack 1, win 501, options [nop,nop,TS val 3005087708 ecr 2840407457], length 1314
06:30:17.433293 IP 99.181.67.81.1935 > 10.8.2.7.40570: Flags [.], ack 15339, win 199, options [nop,nop,TS val 2840407557 ecr 3005087357], length 0
06:30:17.466648 IP 10.8.2.7.40570 > 99.181.67.81.1935: Flags [.], seq 24863:26177, ack 1, win 501, options [nop,nop,TS val 3005087776 ecr 2840407557], length 1314
06:30:17.495465 IP 10.8.2.7.40570 > 99.181.67.81.1935: Flags [.], seq 26177:27491, ack 1, win 501, options [nop,nop,TS val 3005087805 ecr 2840407557], length 1314
06:30:17.533017 IP 10.8.2.7.40570 > 99.181.67.81.1935: Flags [.], seq 27491:28805, ack 1, win 501, options [nop,nop,TS val 3005087843 ecr 2840407557], length 1314
06:30:17.538838 IP 99.181.67.81.1935 > 10.8.2.7.40570: Flags [.], ack 17967, win 199, options [nop,nop,TS val 2840407652 ecr 3005087439], length 0
06:30:17.599973 IP 10.8.2.7.40570 > 99.181.67.81.1935: Flags [.], seq 28805:30119, ack 1, win 501, options [nop,nop,TS val 3005087910 ecr 2840407652], length 1314
06:30:17.613311 IP 99.181.67.81.1935 > 10.8.2.7.40570: Flags [.], ack 20595, win 199, options [nop,nop,TS val 2840407738 ecr 3005087541], length 0
06:30:17.624916 IP 99.181.67.81.1935 > 10.8.2.7.40570: Flags [.], ack 20921, win 199, options [nop,nop,TS val 2840407747 ecr 3005087576], length 0
06:30:17.624950 IP 10.8.2.7.40570 > 99.181.67.81.1935: Flags [P.], seq 30119:31011, ack 1, win 501, options [nop,nop,TS val 3005087935 ecr 2840407747], length 892
06:30:17.664130 IP 10.8.2.7.40570 > 99.181.67.81.1935: Flags [.], seq 31011:32325, ack 1, win 501, options [nop,nop,TS val 3005087974 ecr 2840407747], length 1314
06:30:17.698753 IP 10.8.2.7.40570 > 99.181.67.81.1935: Flags [.], seq 32325:33639, ack 1, win 501, options [nop,nop,TS val 3005088008 ecr 2840407747], length 1314
06:30:17.750221 IP 99.181.67.81.1935 > 10.8.2.7.40570: Flags [.], ack 23549, win 198, options [nop,nop,TS val 2840407865 ecr 3005087643], length 0
06:30:17.752321 IP 10.8.2.7.40570 > 99.181.67.81.1935: Flags [.], seq 33639:34953, ack 1, win 501, options [nop,nop,TS val 3005088062 ecr 2840407865], length 1314
06:30:17.794732 IP 10.8.2.7.40570 > 99.181.67.81.1935: Flags [.], seq 34953:36267, ack 1, win 501, options [nop,nop,TS val 3005088104 ecr 2840407865], length 1314
06:30:17.832208 IP 10.8.2.7.40570 > 99.181.67.81.1935: Flags [.], seq 36267:37581, ack 1, win 501, options [nop,nop,TS val 3005088142 ecr 2840407865], length 1314
06:30:17.839521 IP 99.181.67.81.1935 > 10.8.2.7.40570: Flags [.], ack 26177, win 198, options [nop,nop,TS val 2840407959 ecr 3005087708], length 0
06:30:17.880148 IP 10.8.2.7.40570 > 99.181.67.81.1935: Flags [.], seq 37581:38895, ack 1, win 501, options [nop,nop,TS val 3005088190 ecr 2840407959], length 1314
06:30:17.911717 IP 99.181.67.81.1935 > 10.8.2.7.40570: Flags [.], ack 28805, win 198, options [nop,nop,TS val 2840408018 ecr 3005087805], length 0
06:30:17.932697 IP 10.8.2.7.40570 > 99.181.67.81.1935: Flags [.], seq 38895:40209, ack 1, win 501, options [nop,nop,TS val 3005088242 ecr 2840408018], length 1314
06:30:17.965735 IP 10.8.2.7.40570 > 99.181.67.81.1935: Flags [.], seq 40209:41523, ack 1, win 501, options [nop,nop,TS val 3005088275 ecr 2840408018], length 1314
06:30:17.991577 IP 99.181.67.81.1935 > 10.8.2.7.40570: Flags [.], ack 31011, win 199, options [nop,nop,TS val 2840408105 ecr 3005087910], length 0
06:30:17.991614 IP 10.8.2.7.40570 > 99.181.67.81.1935: Flags [P.], seq 41523:41940, ack 1, win 501, options [nop,nop,TS val 3005088301 ecr 2840408105], length 417
06:30:18.029847 IP 10.8.2.7.40570 > 99.181.67.81.1935: Flags [.], seq 41940:43254, ack 1, win 501, options [nop,nop,TS val 3005088340 ecr 2840408105], length 1314
06:30:18.060720 IP 99.181.67.81.1935 > 10.8.2.7.40570: Flags [.], ack 33639, win 199, options [nop,nop,TS val 2840408177 ecr 3005087974], length 0
06:30:18.066693 IP 10.8.2.7.40570 > 99.181.67.81.1935: Flags [.], seq 43254:44568, ack 1, win 501, options [nop,nop,TS val 3005088376 ecr 2840408177], length 1314
06:30:18.115520 IP 10.8.2.7.40570 > 99.181.67.81.1935: Flags [.], seq 44568:45882, ack 1, win 501, options [nop,nop,TS val 3005088425 ecr 2840408177], length 1314
06:30:18.157092 IP 99.181.67.81.1935 > 10.8.2.7.40570: Flags [.], ack 36267, win 199, options [nop,nop,TS val 2840408267 ecr 3005088062], length 0
06:30:18.164466 IP 10.8.2.7.40570 > 99.181.67.81.1935: Flags [.], seq 45882:47196, ack 1, win 501, options [nop,nop,TS val 3005088474 ecr 2840408267], length 1314
06:30:18.197421 IP 10.8.2.7.40570 > 99.181.67.81.1935: Flags [.], seq 47196:48510, ack 1, win 501, options [nop,nop,TS val 3005088507 ecr 2840408267], length 1314
06:30:18.235628 IP 99.181.67.81.1935 > 10.8.2.7.40570: Flags [.], ack 38895, win 199, options [nop,nop,TS val 2840408349 ecr 3005088142], length 0
06:30:18.242940 IP 10.8.2.7.40570 > 99.181.67.81.1935: Flags [.], seq 48510:49824, ack 1, win 501, options [nop,nop,TS val 3005088553 ecr 2840408349], length 1314
06:30:18.297316 IP 10.8.2.7.40570 > 99.181.67.81.1935: Flags [.], seq 49824:51138, ack 1, win 501, options [nop,nop,TS val 3005088607 ecr 2840408349], length 1314
06:30:18.320077 IP 99.181.67.81.1935 > 10.8.2.7.40570: Flags [.], ack 41523, win 199, options [nop,nop,TS val 2840408426 ecr 3005088242], length 0
06:30:18.327981 IP 10.8.2.7.40570 > 99.181.67.81.1935: Flags [.], seq 51138:52452, ack 1, win 501, options [nop,nop,TS val 3005088638 ecr 2840408426], length 1314
06:30:18.340285 IP 99.181.67.81.1935 > 10.8.2.7.40570: Flags [.], ack 41940, win 199, options [nop,nop,TS val 2840408452 ecr 3005088301], length 0
06:30:18.340305 IP 10.8.2.7.40570 > 99.181.67.81.1935: Flags [P.], seq 52452:52786, ack 1, win 501, options [nop,nop,TS val 3005088650 ecr 2840408452], length 334
06:30:18.400949 IP 10.8.2.7.40570 > 99.181.67.81.1935: Flags [.], seq 52786:54100, ack 1, win 501, options [nop,nop,TS val 3005088711 ecr 2840408452], length 1314
06:30:18.413882 IP 99.181.67.81.1935 > 10.8.2.7.40570: Flags [.], ack 44568, win 199, options [nop,nop,TS val 2840408529 ecr 3005088340], length 0
06:30:18.434443 IP 10.8.2.7.40570 > 99.181.67.81.1935: Flags [.], seq 54100:55414, ack 1, win 501, options [nop,nop,TS val 3005088744 ecr 2840408529], length 1314
06:30:18.464963 IP 10.8.2.7.40570 > 99.181.67.81.1935: Flags [.], seq 55414:56728, ack 1, win 501, options [nop,nop,TS val 3005088775 ecr 2840408529], length 1314
06:30:18.500702 IP 99.181.67.81.1935 > 10.8.2.7.40570: Flags [.], ack 47196, win 199, options [nop,nop,TS val 2840408624 ecr 3005088425], length 0
06:30:18.531749 IP 10.8.2.7.40570 > 99.181.67.81.1935: Flags [.], seq 56728:58042, ack 1, win 501, options [nop,nop,TS val 3005088841 ecr 2840408624], length 1314
06:30:18.562812 IP 10.8.2.7.40570 > 99.181.67.81.1935: Flags [.], seq 58042:59356, ack 1, win 501, options [nop,nop,TS val 3005088873 ecr 2840408624], length 1314
06:30:18.589695 IP 99.181.67.81.1935 > 10.8.2.7.40570: Flags [.], ack 49824, win 199, options [nop,nop,TS val 2840408703 ecr 3005088507], length 0
06:30:18.596966 IP 10.8.2.7.40570 > 99.181.67.81.1935: Flags [.], seq 59356:60670, ack 1, win 501, options [nop,nop,TS val 3005088907 ecr 2840408703], length 1314
06:30:18.666954 IP 10.8.2.7.40570 > 99.181.67.81.1935: Flags [.], seq 60670:61984, ack 1, win 501, options [nop,nop,TS val 3005088977 ecr 2840408703], length 1314
06:30:18.684521 IP 99.181.67.81.1935 > 10.8.2.7.40570: Flags [.], ack 49824, win 199, options [nop,nop,TS val 2840408792 ecr 3005088507,nop,nop,sack 1 {51138:52452}], length 0
06:30:18.692059 IP 99.181.67.81.1935 > 10.8.2.7.40570: Flags [.], ack 49824, win 199, options [nop,nop,TS val 2840408804 ecr 3005088507,nop,nop,sack 1 {51138:52786}], length 0
06:30:18.700281 IP 10.8.2.7.40570 > 99.181.67.81.1935: Flags [.], seq 61984:63298, ack 1, win 501, options [nop,nop,TS val 3005089010 ecr 2840408804], length 1314
06:30:18.730995 IP 10.8.2.7.40570 > 99.181.67.81.1935: Flags [.], seq 63298:64612, ack 1, win 501, options [nop,nop,TS val 3005089041 ecr 2840408804], length 1314
06:30:18.746225 IP 10.8.2.7.40570 > 99.181.67.81.1935: Flags [.], seq 49824:51138, ack 1, win 501, options [nop,nop,TS val 3005089056 ecr 2840408804], length 1314
06:30:18.757505 IP 99.181.67.81.1935 > 10.8.2.7.40570: Flags [.], ack 49824, win 199, options [nop,nop,TS val 2840408863 ecr 3005088507,nop,nop,sack 1 {51138:54100}], length 0
06:30:18.790623 IP 99.181.67.81.1935 > 10.8.2.7.40570: Flags [.], ack 49824, win 199, options [nop,nop,TS val 2840408895 ecr 3005088507,nop,nop,sack 1 {51138:55414}], length 0
06:30:18.798725 IP 10.8.2.7.40570 > 99.181.67.81.1935: Flags [.], seq 64612:65926, ack 1, win 501, options [nop,nop,TS val 3005089108 ecr 2840408895], length 1314
06:30:18.818317 IP 99.181.67.81.1935 > 10.8.2.7.40570: Flags [.], ack 49824, win 199, options [nop,nop,TS val 2840408926 ecr 3005088507,nop,nop,sack 1 {51138:56728}], length 0
06:30:18.833544 IP 10.8.2.7.40570 > 99.181.67.81.1935: Flags [.], seq 65926:67240, ack 1, win 501, options [nop,nop,TS val 3005089143 ecr 2840408926], length 1314
06:30:18.881290 IP 99.181.67.81.1935 > 10.8.2.7.40570: Flags [.], ack 49824, win 199, options [nop,nop,TS val 2840409004 ecr 3005088507,nop,nop,sack 1 {51138:58042}], length 0
06:30:18.881314 IP 10.8.2.7.40570 > 99.181.67.81.1935: Flags [.], seq 67240:68554, ack 1, win 501, options [nop,nop,TS val 3005089191 ecr 2840409004], length 1314
06:30:18.912873 IP 99.181.67.81.1935 > 10.8.2.7.40570: Flags [.], ack 49824, win 199, options [nop,nop,TS val 2840409036 ecr 3005088507,nop,nop,sack 1 {51138:59356}], length 0
06:30:18.933846 IP 10.8.2.7.40570 > 99.181.67.81.1935: Flags [.], seq 68554:69868, ack 1, win 501, options [nop,nop,TS val 3005089244 ecr 2840409036], length 1314
06:30:18.957124 IP 99.181.67.81.1935 > 10.8.2.7.40570: Flags [.], ack 49824, win 199, options [nop,nop,TS val 2840409078 ecr 3005088507,nop,nop,sack 1 {51138:60670}], length 0
06:30:18.966929 IP 10.8.2.7.40570 > 99.181.67.81.1935: Flags [.], seq 69868:71182, ack 1, win 501, options [nop,nop,TS val 3005089277 ecr 2840409078], length 1314
06:30:19.034115 IP 99.181.67.81.1935 > 10.8.2.7.40570: Flags [.], ack 49824, win 199, options [nop,nop,TS val 2840409156 ecr 3005088507,nop,nop,sack 1 {51138:61984}], length 0
06:30:19.034180 IP 10.8.2.7.40570 > 99.181.67.81.1935: Flags [.], seq 71182:72496, ack 1, win 501, options [nop,nop,TS val 3005089344 ecr 2840409156], length 1314
06:30:19.057696 IP 99.181.67.81.1935 > 10.8.2.7.40570: Flags [.], ack 49824, win 199, options [nop,nop,TS val 2840409180 ecr 3005088507,nop,nop,sack 1 {51138:63298}], length 0
06:30:19.066977 IP 10.8.2.7.40570 > 99.181.67.81.1935: Flags [.], seq 72496:73810, ack 1, win 501, options [nop,nop,TS val 3005089377 ecr 2840409180], length 1314
06:30:19.085311 IP 99.181.67.81.1935 > 10.8.2.7.40570: Flags [.], ack 49824, win 199, options [nop,nop,TS val 2840409208 ecr 3005088507,nop,nop,sack 1 {51138:64612}], length 0
06:30:19.098857 IP 99.181.67.81.1935 > 10.8.2.7.40570: Flags [.], ack 64612, win 180, options [nop,nop,TS val 2840409223 ecr 3005089056], length 0
06:30:19.098876 IP 10.8.2.7.40570 > 99.181.67.81.1935: Flags [.], seq 73810:75124, ack 1, win 501, options [nop,nop,TS val 3005089409 ecr 2840409208], length 1314
06:30:19.098911 IP 10.8.2.7.40570 > 99.181.67.81.1935: Flags [P.], seq 75124:75593, ack 1, win 501, options [nop,nop,TS val 3005089409 ecr 2840409223], length 469
06:30:19.197117 IP 99.181.67.81.1935 > 10.8.2.7.40570: Flags [.], ack 65926, win 200, options [nop,nop,TS val 2840409319 ecr 3005089108], length 0
06:30:19.197155 IP 10.8.2.7.40570 > 99.181.67.81.1935: Flags [.], seq 75593:76907, ack 1, win 501, options [nop,nop,TS val 3005089507 ecr 2840409319], length 1314
06:30:19.222213 IP 99.181.67.81.1935 > 10.8.2.7.40570: Flags [.], ack 65926, win 200, options [nop,nop,TS val 2840409345 ecr 3005089108,nop,nop,sack 1 {67240:68554}], length 0
06:30:19.222256 IP 10.8.2.7.40570 > 99.181.67.81.1935: Flags [.], seq 76907:78221, ack 1, win 501, options [nop,nop,TS val 3005089532 ecr 2840409345], length 1314
06:30:19.273595 IP 99.181.67.81.1935 > 10.8.2.7.40570: Flags [.], ack 65926, win 200, options [nop,nop,TS val 2840409397 ecr 3005089108,nop,nop,sack 1 {67240:69868}], length 0
06:30:19.273637 IP 10.8.2.7.40570 > 99.181.67.81.1935: Flags [.], seq 65926:67240, ack 1, win 501, options [nop,nop,TS val 3005089583 ecr 2840409397], length 1314
06:30:19.306906 IP 99.181.67.81.1935 > 10.8.2.7.40570: Flags [.], ack 65926, win 200, options [nop,nop,TS val 2840409431 ecr 3005089108,nop,nop,sack 1 {67240:71182}], length 0
06:30:19.306948 IP 10.8.2.7.40570 > 99.181.67.81.1935: Flags [.], seq 78221:79535, ack 1, win 501, options [nop,nop,TS val 3005089617 ecr 2840409431], length 1314
06:30:19.373927 IP 99.181.67.81.1935 > 10.8.2.7.40570: Flags [.], ack 65926, win 200, options [nop,nop,TS val 2840409494 ecr 3005089108,nop,nop,sack 1 {67240:72496}], length 0
06:30:19.412105 IP 99.181.67.81.1935 > 10.8.2.7.40570: Flags [.], ack 65926, win 200, options [nop,nop,TS val 2840409527 ecr 3005089108,nop,nop,sack 1 {67240:73810}], length 0
06:30:19.438953 IP 99.181.67.81.1935 > 10.8.2.7.40570: Flags [.], ack 65926, win 200, options [nop,nop,TS val 2840409559 ecr 3005089108,nop,nop,sack 1 {67240:75593}], length 0
06:30:19.439003 IP 10.8.2.7.40570 > 99.181.67.81.1935: Flags [.], seq 79535:80849, ack 1, win 501, options [nop,nop,TS val 3005089749 ecr 2840409559], length 1314
06:30:19.439007 IP 10.8.2.7.40570 > 99.181.67.81.1935: Flags [P.], seq 80849:82163, ack 1, win 501, options [nop,nop,TS val 3005089749 ecr 2840409559], length 1314
06:30:19.538310 IP 99.181.67.81.1935 > 10.8.2.7.40570: Flags [.], ack 65926, win 200, options [nop,nop,TS val 2840409661 ecr 3005089108,nop,nop,sack 1 {67240:76907}], length 0
06:30:19.538342 IP 10.8.2.7.40570 > 99.181.67.81.1935: Flags [.], seq 82163:83477, ack 1, win 501, options [nop,nop,TS val 3005089848 ecr 2840409661], length 1314
06:30:19.562301 IP 99.181.67.81.1935 > 10.8.2.7.40570: Flags [.], ack 65926, win 200, options [nop,nop,TS val 2840409686 ecr 3005089108,nop,nop,sack 1 {67240:78221}], length 0
06:30:19.562348 IP 10.8.2.7.40570 > 99.181.67.81.1935: Flags [.], seq 83477:84791, ack 1, win 501, options [nop,nop,TS val 3005089872 ecr 2840409686], length 1314
06:30:19.611356 IP 99.181.67.81.1935 > 10.8.2.7.40570: Flags [.], ack 78221, win 184, options [nop,nop,TS val 2840409736 ecr 3005089583], length 0
06:30:19.611400 IP 10.8.2.7.40570 > 99.181.67.81.1935: Flags [.], seq 84791:86105, ack 1, win 501, options [nop,nop,TS val 3005089921 ecr 2840409736], length 1314
06:30:19.728750 IP 99.181.67.81.1935 > 10.8.2.7.40570: Flags [.], ack 79535, win 200, options [nop,nop,TS val 2840409851 ecr 3005089617], length 0
06:30:19.728797 IP 10.8.2.7.40570 > 99.181.67.81.1935: Flags [.], seq 86105:87419, ack 1, win 501, options [nop,nop,TS val 3005090038 ecr 2840409851], length 1314
06:30:19.813156 IP 99.181.67.81.1935 > 10.8.2.7.40570: Flags [.], ack 82163, win 200, options [nop,nop,TS val 2840409937 ecr 3005089749], length 0
06:30:19.813201 IP 10.8.2.7.40570 > 99.181.67.81.1935: Flags [.], seq 87419:88733, ack 1, win 501, options [nop,nop,TS val 3005090123 ecr 2840409937], length 1314
06:30:19.813204 IP 10.8.2.7.40570 > 99.181.67.81.1935: Flags [P.], seq 88733:90047, ack 1, win 501, options [nop,nop,TS val 3005090123 ecr 2840409937], length 1314
06:30:19.920109 IP 99.181.67.81.1935 > 10.8.2.7.40570: Flags [.], ack 84791, win 200, options [nop,nop,TS val 2840410044 ecr 3005089848], length 0
06:30:19.920134 IP 10.8.2.7.40570 > 99.181.67.81.1935: Flags [.], seq 90047:91361, ack 1, win 501, options [nop,nop,TS val 3005090230 ecr 2840410044], length 1314
06:30:19.920136 IP 10.8.2.7.40570 > 99.181.67.81.1935: Flags [P.], seq 91361:92675, ack 1, win 501, options [nop,nop,TS val 3005090230 ecr 2840410044], length 1314
06:30:19.931097 IP 10.8.2.7.40570 > 99.181.67.81.1935: Flags [.], seq 92675:93989, ack 1, win 501, options [nop,nop,TS val 3005090241 ecr 2840410044], length 1314
06:30:20.050941 IP 99.181.67.81.1935 > 10.8.2.7.40570: Flags [.], ack 86105, win 200, options [nop,nop,TS val 2840410155 ecr 3005089921], length 0
06:30:20.050979 IP 10.8.2.7.40570 > 99.181.67.81.1935: Flags [.], seq 93989:95303, ack 1, win 501, options [nop,nop,TS val 3005090361 ecr 2840410155], length 1314
06:30:20.164675 IP 99.181.67.81.1935 > 10.8.2.7.40570: Flags [.], ack 88733, win 200, options [nop,nop,TS val 2840410277 ecr 3005090038], length 0
06:30:20.164691 IP 10.8.2.7.40570 > 99.181.67.81.1935: Flags [.], seq 95303:96617, ack 1, win 501, options [nop,nop,TS val 3005090474 ecr 2840410277], length 1314
06:30:20.164692 IP 10.8.2.7.40570 > 99.181.67.81.1935: Flags [P.], seq 96617:97931, ack 1, win 501, options [nop,nop,TS val 3005090474 ecr 2840410277], length 1314
06:30:20.258192 IP 99.181.67.81.1935 > 10.8.2.7.40570: Flags [.], ack 91361, win 198, options [nop,nop,TS val 2840410382 ecr 3005090123], length 0
06:30:20.258241 IP 10.8.2.7.40570 > 99.181.67.81.1935: Flags [.], seq 97931:99245, ack 1, win 501, options [nop,nop,TS val 3005090568 ecr 2840410382], length 1314
06:30:20.258244 IP 10.8.2.7.40570 > 99.181.67.81.1935: Flags [P.], seq 99245:100559, ack 1, win 501, options [nop,nop,TS val 3005090568 ecr 2840410382], length 1314
06:30:20.271333 IP 99.181.67.81.1935 > 10.8.2.7.40570: Flags [.], ack 93989, win 198, options [nop,nop,TS val 2840410396 ecr 3005090230], length 0
06:30:20.271377 IP 10.8.2.7.40570 > 99.181.67.81.1935: Flags [.], seq 100559:101873, ack 1, win 501, options [nop,nop,TS val 3005090581 ecr 2840410396], length 1314
06:30:20.271380 IP 10.8.2.7.40570 > 99.181.67.81.1935: Flags [P.], seq 101873:103187, ack 1, win 501, options [nop,nop,TS val 3005090581 ecr 2840410396], length 1314
06:30:20.472927 IP 99.181.67.81.1935 > 10.8.2.7.40570: Flags [.], ack 95303, win 200, options [nop,nop,TS val 2840410583 ecr 3005090361], length 0
06:30:20.472957 IP 10.8.2.7.40570 > 99.181.67.81.1935: Flags [.], seq 103187:104501, ack 1, win 501, options [nop,nop,TS val 3005090783 ecr 2840410583], length 1314
06:30:20.517581 IP 99.181.67.81.1935 > 10.8.2.7.40570: Flags [.], ack 97931, win 200, options [nop,nop,TS val 2840410625 ecr 3005090474], length 0
06:30:20.517631 IP 10.8.2.7.40570 > 99.181.67.81.1935: Flags [.], seq 104501:105815, ack 1, win 501, options [nop,nop,TS val 3005090827 ecr 2840410625], length 1314
06:30:20.517634 IP 10.8.2.7.40570 > 99.181.67.81.1935: Flags [P.], seq 105815:107129, ack 1, win 501, options [nop,nop,TS val 3005090827 ecr 2840410625], length 1314
06:30:20.612882 IP 99.181.67.81.1935 > 10.8.2.7.40570: Flags [.], ack 100559, win 200, options [nop,nop,TS val 2840410718 ecr 3005090568], length 0
06:30:20.612915 IP 10.8.2.7.40570 > 99.181.67.81.1935: Flags [.], seq 107129:108443, ack 1, win 501, options [nop,nop,TS val 3005090923 ecr 2840410718], length 1314
06:30:20.612918 IP 10.8.2.7.40570 > 99.181.67.81.1935: Flags [P.], seq 108443:109757, ack 1, win 501, options [nop,nop,TS val 3005090923 ecr 2840410718], length 1314
06:30:20.625663 IP 99.181.67.81.1935 > 10.8.2.7.40570: Flags [.], ack 103187, win 200, options [nop,nop,TS val 2840410732 ecr 3005090581], length 0
06:30:20.625686 IP 10.8.2.7.40570 > 99.181.67.81.1935: Flags [.], seq 109757:111071, ack 1, win 501, options [nop,nop,TS val 3005090935 ecr 2840410732], length 1314
06:30:20.625688 IP 10.8.2.7.40570 > 99.181.67.81.1935: Flags [P.], seq 111071:112385, ack 1, win 501, options [nop,nop,TS val 3005090935 ecr 2840410732], length 1314
06:30:20.864551 IP 99.181.67.81.1935 > 10.8.2.7.40570: Flags [.], ack 105815, win 200, options [nop,nop,TS val 2840410980 ecr 3005090783], length 0
06:30:20.864584 IP 10.8.2.7.40570 > 99.181.67.81.1935: Flags [.], seq 112385:113699, ack 1, win 501, options [nop,nop,TS val 3005091174 ecr 2840410980], length 1314
06:30:20.864587 IP 10.8.2.7.40570 > 99.181.67.81.1935: Flags [P.], seq 113699:115013, ack 1, win 501, options [nop,nop,TS val 3005091174 ecr 2840410980], length 1314
06:30:20.907949 IP 99.181.67.81.1935 > 10.8.2.7.40570: Flags [.], ack 107129, win 200, options [nop,nop,TS val 2840411031 ecr 3005090827], length 0
06:30:20.907982 IP 10.8.2.7.40570 > 99.181.67.81.1935: Flags [.], seq 115013:116327, ack 1, win 501, options [nop,nop,TS val 3005091218 ecr 2840411031], length 1314
06:30:20.948874 IP 99.181.67.81.1935 > 10.8.2.7.40570: Flags [.], ack 109757, win 200, options [nop,nop,TS val 2840411073 ecr 3005090923], length 0
06:30:20.948915 IP 10.8.2.7.40570 > 99.181.67.81.1935: Flags [.], seq 116327:117641, ack 1, win 501, options [nop,nop,TS val 3005091259 ecr 2840411073], length 1314
06:30:20.948918 IP 10.8.2.7.40570 > 99.181.67.81.1935: Flags [P.], seq 117641:118955, ack 1, win 501, options [nop,nop,TS val 3005091259 ecr 2840411073], length 1314
06:30:20.962220 IP 99.181.67.81.1935 > 10.8.2.7.40570: Flags [.], ack 112385, win 200, options [nop,nop,TS val 2840411086 ecr 3005090935], length 0
06:30:20.962272 IP 10.8.2.7.40570 > 99.181.67.81.1935: Flags [.], seq 118955:120269, ack 1, win 501, options [nop,nop,TS val 3005091272 ecr 2840411086], length 1314
06:30:20.962275 IP 10.8.2.7.40570 > 99.181.67.81.1935: Flags [P.], seq 120269:121583, ack 1, win 501, options [nop,nop,TS val 3005091272 ecr 2840411086], length 1314
06:30:21.201761 IP 99.181.67.81.1935 > 10.8.2.7.40570: Flags [.], ack 115013, win 200, options [nop,nop,TS val 2840411325 ecr 3005091174], length 0
06:30:21.201811 IP 10.8.2.7.40570 > 99.181.67.81.1935: Flags [.], seq 121583:122897, ack 1, win 501, options [nop,nop,TS val 3005091512 ecr 2840411325], length 1314
06:30:21.201814 IP 10.8.2.7.40570 > 99.181.67.81.1935: Flags [P.], seq 122897:124211, ack 1, win 501, options [nop,nop,TS val 3005091512 ecr 2840411325], length 1314
06:30:21.220254 IP 10.8.2.7.40570 > 99.181.67.81.1935: Flags [.], seq 124211:125525, ack 1, win 501, options [nop,nop,TS val 3005091530 ecr 2840411325], length 1314
06:30:21.284768 IP 99.181.67.81.1935 > 10.8.2.7.40570: Flags [.], ack 117641, win 198, options [nop,nop,TS val 2840411409 ecr 3005091218], length 0
06:30:21.284802 IP 10.8.2.7.40570 > 99.181.67.81.1935: Flags [.], seq 125525:126839, ack 1, win 501, options [nop,nop,TS val 3005091594 ecr 2840411409], length 1314
06:30:21.284804 IP 10.8.2.7.40570 > 99.181.67.81.1935: Flags [P.], seq 126839:128153, ack 1, win 501, options [nop,nop,TS val 3005091594 ecr 2840411409], length 1314
06:30:21.297971 IP 99.181.67.81.1935 > 10.8.2.7.40570: Flags [.], ack 120269, win 198, options [nop,nop,TS val 2840411422 ecr 3005091259], length 0
06:30:21.298007 IP 10.8.2.7.40570 > 99.181.67.81.1935: Flags [.], seq 128153:129467, ack 1, win 501, options [nop,nop,TS val 3005091608 ecr 2840411422], length 1314
06:30:21.298009 IP 10.8.2.7.40570 > 99.181.67.81.1935: Flags [P.], seq 129467:130781, ack 1, win 501, options [nop,nop,TS val 3005091608 ecr 2840411422], length 1314
06:30:21.339568 IP 99.181.67.81.1935 > 10.8.2.7.40570: Flags [.], ack 121583, win 200, options [nop,nop,TS val 2840411463 ecr 3005091272], length 0
06:30:21.339605 IP 10.8.2.7.40570 > 99.181.67.81.1935: Flags [.], seq 130781:132095, ack 1, win 501, options [nop,nop,TS val 3005091649 ecr 2840411463], length 1314
06:30:21.538346 IP 99.181.67.81.1935 > 10.8.2.7.40570: Flags [.], ack 124211, win 200, options [nop,nop,TS val 2840411662 ecr 3005091512], length 0
06:30:21.538378 IP 10.8.2.7.40570 > 99.181.67.81.1935: Flags [.], seq 132095:133409, ack 1, win 501, options [nop,nop,TS val 3005091848 ecr 2840411662], length 1314
06:30:21.538380 IP 10.8.2.7.40570 > 99.181.67.81.1935: Flags [P.], seq 133409:134723, ack 1, win 501, options [nop,nop,TS val 3005091848 ecr 2840411662], length 1314
06:30:21.610961 IP 99.181.67.81.1935 > 10.8.2.7.40570: Flags [.], ack 125525, win 200, options [nop,nop,TS val 2840411731 ecr 3005091530], length 0
06:30:21.611011 IP 10.8.2.7.40570 > 99.181.67.81.1935: Flags [.], seq 134723:136037, ack 1, win 501, options [nop,nop,TS val 3005091921 ecr 2840411731], length 1314
06:30:21.630185 IP 99.181.67.81.1935 > 10.8.2.7.40570: Flags [.], ack 128153, win 200, options [nop,nop,TS val 2840411749 ecr 3005091594], length 0
06:30:21.630232 IP 10.8.2.7.40570 > 99.181.67.81.1935: Flags [.], seq 136037:137351, ack 1, win 501, options [nop,nop,TS val 3005091940 ecr 2840411749], length 1314
06:30:21.630235 IP 10.8.2.7.40570 > 99.181.67.81.1935: Flags [P.], seq 137351:138665, ack 1, win 501, options [nop,nop,TS val 3005091940 ecr 2840411749], length 1314
06:30:21.640231 IP 99.181.67.81.1935 > 10.8.2.7.40570: Flags [.], ack 130781, win 200, options [nop,nop,TS val 2840411761 ecr 3005091608], length 0
06:30:21.640276 IP 10.8.2.7.40570 > 99.181.67.81.1935: Flags [.], seq 138665:139979, ack 1, win 501, options [nop,nop,TS val 3005091950 ecr 2840411761], length 1314
06:30:21.640279 IP 10.8.2.7.40570 > 99.181.67.81.1935: Flags [P.], seq 139979:141293, ack 1, win 501, options [nop,nop,TS val 3005091950 ecr 2840411761], length 1314
06:30:21.761217 IP 99.181.67.81.1935 > 10.8.2.7.40570: Flags [.], ack 132095, win 200, options [nop,nop,TS val 2840411867 ecr 3005091649], length 0
06:30:21.761282 IP 10.8.2.7.40570 > 99.181.67.81.1935: Flags [.], seq 141293:142607, ack 1, win 501, options [nop,nop,TS val 3005092071 ecr 2840411867], length 1314
06:30:21.761286 IP 10.8.2.7.40570 > 99.181.67.81.1935: Flags [P.], seq 142607:143921, ack 1, win 501, options [nop,nop,TS val 3005092071 ecr 2840411867], length 1314
06:30:21.874174 IP 99.181.67.81.1935 > 10.8.2.7.40570: Flags [.], ack 134723, win 200, options [nop,nop,TS val 2840411999 ecr 3005091848], length 0
06:30:21.874248 IP 10.8.2.7.40570 > 99.181.67.81.1935: Flags [.], seq 143921:145235, ack 1, win 501, options [nop,nop,TS val 3005092184 ecr 2840411999], length 1314
06:30:21.874252 IP 10.8.2.7.40570 > 99.181.67.81.1935: Flags [P.], seq 145235:146549, ack 1, win 501, options [nop,nop,TS val 3005092184 ecr 2840411999], length 1314
06:30:21.974323 IP 99.181.67.81.1935 > 10.8.2.7.40570: Flags [.], ack 137351, win 200, options [nop,nop,TS val 2840412098 ecr 3005091921], length 0
06:30:21.974337 IP 10.8.2.7.40570 > 99.181.67.81.1935: Flags [.], seq 146549:147863, ack 1, win 501, options [nop,nop,TS val 3005092284 ecr 2840412098], length 1314
06:30:21.974338 IP 10.8.2.7.40570 > 99.181.67.81.1935: Flags [P.], seq 147863:149177, ack 1, win 501, options [nop,nop,TS val 3005092284 ecr 2840412098], length 1314
06:30:21.988285 IP 99.181.67.81.1935 > 10.8.2.7.40570: Flags [.], ack 139979, win 200, options [nop,nop,TS val 2840412112 ecr 3005091940], length 0
06:30:21.988293 IP 10.8.2.7.40570 > 99.181.67.81.1935: Flags [.], seq 149177:150491, ack 1, win 501, options [nop,nop,TS val 3005092298 ecr 2840412112], length 1314
06:30:21.988293 IP 10.8.2.7.40570 > 99.181.67.81.1935: Flags [P.], seq 150491:151805, ack 1, win 501, options [nop,nop,TS val 3005092298 ecr 2840412112], length 1314
06:30:22.039227 IP 99.181.67.81.1935 > 10.8.2.7.40570: Flags [.], ack 141293, win 200, options [nop,nop,TS val 2840412159 ecr 3005091950], length 0
06:30:22.039261 IP 10.8.2.7.40570 > 99.181.67.81.1935: Flags [.], seq 151805:153119, ack 1, win 501, options [nop,nop,TS val 3005092349 ecr 2840412159], length 1314
06:30:22.121617 IP 99.181.67.81.1935 > 10.8.2.7.40570: Flags [.], ack 143921, win 200, options [nop,nop,TS val 2840412242 ecr 3005092071], length 0
06:30:22.121655 IP 10.8.2.7.40570 > 99.181.67.81.1935: Flags [.], seq 153119:154433, ack 1, win 501, options [nop,nop,TS val 3005092431 ecr 2840412242], length 1314
06:30:22.121658 IP 10.8.2.7.40570 > 99.181.67.81.1935: Flags [P.], seq 154433:155747, ack 1, win 501, options [nop,nop,TS val 3005092431 ecr 2840412242], length 1314
06:30:22.210244 IP 99.181.67.81.1935 > 10.8.2.7.40570: Flags [.], ack 146549, win 200, options [nop,nop,TS val 2840412334 ecr 3005092184], length 0
06:30:22.210280 IP 10.8.2.7.40570 > 99.181.67.81.1935: Flags [.], seq 155747:157061, ack 1, win 501, options [nop,nop,TS val 3005092520 ecr 2840412334], length 1314
06:30:22.210283 IP 10.8.2.7.40570 > 99.181.67.81.1935: Flags [P.], seq 157061:158375, ack 1, win 501, options [nop,nop,TS val 3005092520 ecr 2840412334], length 1314
06:30:22.319947 IP 99.181.67.81.1935 > 10.8.2.7.40570: Flags [.], ack 149177, win 200, options [nop,nop,TS val 2840412434 ecr 3005092284], length 0
06:30:22.319971 IP 10.8.2.7.40570 > 99.181.67.81.1935: Flags [.], seq 158375:159689, ack 1, win 501, options [nop,nop,TS val 3005092630 ecr 2840412434], length 1314
06:30:22.319972 IP 10.8.2.7.40570 > 99.181.67.81.1935: Flags [P.], seq 159689:161003, ack 1, win 501, options [nop,nop,TS val 3005092630 ecr 2840412434], length 1314
06:30:22.340975 IP 99.181.67.81.1935 > 10.8.2.7.40570: Flags [.], ack 151805, win 200, options [nop,nop,TS val 2840412449 ecr 3005092298], length 0
06:30:22.341009 IP 10.8.2.7.40570 > 99.181.67.81.1935: Flags [.], seq 161003:162317, ack 1, win 501, options [nop,nop,TS val 3005092651 ecr 2840412449], length 1314
06:30:22.341011 IP 10.8.2.7.40570 > 99.181.67.81.1935: Flags [P.], seq 162317:163631, ack 1, win 501, options [nop,nop,TS val 3005092651 ecr 2840412449], length 1314
06:30:22.418923 IP 99.181.67.81.1935 > 10.8.2.7.40570: Flags [.], ack 153119, win 200, options [nop,nop,TS val 2840412543 ecr 3005092349], length 0
06:30:22.418958 IP 10.8.2.7.40570 > 99.181.67.81.1935: Flags [.], seq 163631:164945, ack 1, win 501, options [nop,nop,TS val 3005092729 ecr 2840412543], length 1314
06:30:22.418960 IP 10.8.2.7.40570 > 99.181.67.81.1935: Flags [P.], seq 164945:166259, ack 1, win 501, options [nop,nop,TS val 3005092729 ecr 2840412543], length 1314
06:30:22.461027 IP 99.181.67.81.1935 > 10.8.2.7.40570: Flags [.], ack 155747, win 200, options [nop,nop,TS val 2840412585 ecr 3005092431], length 0
06:30:22.461093 IP 10.8.2.7.40570 > 99.181.67.81.1935: Flags [.], seq 166259:167573, ack 1, win 501, options [nop,nop,TS val 3005092771 ecr 2840412585], length 1314
06:30:22.461097 IP 10.8.2.7.40570 > 99.181.67.81.1935: Flags [P.], seq 167573:168887, ack 1, win 501, options [nop,nop,TS val 3005092771 ecr 2840412585], length 1314
06:30:22.547992 IP 99.181.67.81.1935 > 10.8.2.7.40570: Flags [.], ack 158375, win 200, options [nop,nop,TS val 2840412672 ecr 3005092520], length 0
06:30:22.548026 IP 10.8.2.7.40570 > 99.181.67.81.1935: Flags [.], seq 168887:170201, ack 1, win 501, options [nop,nop,TS val 3005092858 ecr 2840412672], length 1314
06:30:22.548027 IP 10.8.2.7.40570 > 99.181.67.81.1935: Flags [P.], seq 170201:171515, ack 1, win 501, options [nop,nop,TS val 3005092858 ecr 2840412672], length 1314
06:30:22.656232 IP 99.181.67.81.1935 > 10.8.2.7.40570: Flags [.], ack 161003, win 200, options [nop,nop,TS val 2840412780 ecr 3005092630], length 0
06:30:22.656276 IP 10.8.2.7.40570 > 99.181.67.81.1935: Flags [.], seq 171515:172829, ack 1, win 501, options [nop,nop,TS val 3005092966 ecr 2840412780], length 1314
06:30:22.656279 IP 10.8.2.7.40570 > 99.181.67.81.1935: Flags [P.], seq 172829:174143, ack 1, win 501, options [nop,nop,TS val 3005092966 ecr 2840412780], length 1314
06:30:22.677149 IP 99.181.67.81.1935 > 10.8.2.7.40570: Flags [.], ack 163631, win 200, options [nop,nop,TS val 2840412801 ecr 3005092651], length 0
06:30:22.677208 IP 10.8.2.7.40570 > 99.181.67.81.1935: Flags [.], seq 174143:175457, ack 1, win 501, options [nop,nop,TS val 3005092987 ecr 2840412801], length 1314
06:30:22.677212 IP 10.8.2.7.40570 > 99.181.67.81.1935: Flags [P.], seq 175457:176771, ack 1, win 501, options [nop,nop,TS val 3005092987 ecr 2840412801], length 1314
06:30:22.755027 IP 99.181.67.81.1935 > 10.8.2.7.40570: Flags [.], ack 166259, win 200, options [nop,nop,TS val 2840412879 ecr 3005092729], length 0
06:30:22.755059 IP 10.8.2.7.40570 > 99.181.67.81.1935: Flags [.], seq 176771:178085, ack 1, win 501, options [nop,nop,TS val 3005093065 ecr 2840412879], length 1314
06:30:22.755060 IP 10.8.2.7.40570 > 99.181.67.81.1935: Flags [P.], seq 178085:179399, ack 1, win 501, options [nop,nop,TS val 3005093065 ecr 2840412879], length 1314
06:30:22.797352 IP 99.181.67.81.1935 > 10.8.2.7.40570: Flags [.], ack 168887, win 200, options [nop,nop,TS val 2840412921 ecr 3005092771], length 0
06:30:22.797448 IP 10.8.2.7.40570 > 99.181.67.81.1935: Flags [.], seq 179399:180713, ack 1, win 501, options [nop,nop,TS val 3005093107 ecr 2840412921], length 1314
06:30:22.797454 IP 10.8.2.7.40570 > 99.181.67.81.1935: Flags [P.], seq 180713:182027, ack 1, win 501, options [nop,nop,TS val 3005093107 ecr 2840412921], length 1314
06:30:22.799320 IP 10.8.2.7.40570 > 99.181.67.81.1935: Flags [.], seq 182027:183341, ack 1, win 501, options [nop,nop,TS val 3005093109 ecr 2840412921], length 1314
06:30:22.884023 IP 99.181.67.81.1935 > 10.8.2.7.40570: Flags [.], ack 171515, win 200, options [nop,nop,TS val 2840413008 ecr 3005092858], length 0
06:30:22.884052 IP 10.8.2.7.40570 > 99.181.67.81.1935: Flags [.], seq 183341:184655, ack 1, win 501, options [nop,nop,TS val 3005093194 ecr 2840413008], length 1314
06:30:22.884054 IP 10.8.2.7.40570 > 99.181.67.81.1935: Flags [P.], seq 184655:185969, ack 1, win 501, options [nop,nop,TS val 3005093194 ecr 2840413008], length 1314
06:30:22.993364 IP 99.181.67.81.1935 > 10.8.2.7.40570: Flags [.], ack 174143, win 200, options [nop,nop,TS val 2840413117 ecr 3005092966], length 0
06:30:22.993392 IP 10.8.2.7.40570 > 99.181.67.81.1935: Flags [.], seq 185969:187283, ack 1, win 501, options [nop,nop,TS val 3005093303 ecr 2840413117], length 1314
06:30:22.993393 IP 10.8.2.7.40570 > 99.181.67.81.1935: Flags [P.], seq 187283:188597, ack 1, win 501, options [nop,nop,TS val 3005093303 ecr 2840413117], length 1314
06:30:23.015180 IP 99.181.67.81.1935 > 10.8.2.7.40570: Flags [.], ack 176771, win 200, options [nop,nop,TS val 2840413138 ecr 3005092987], length 0
06:30:23.015197 IP 10.8.2.7.40570 > 99.181.67.81.1935: Flags [.], seq 188597:189911, ack 1, win 501, options [nop,nop,TS val 3005093325 ecr 2840413138], length 1314
06:30:23.015198 IP 10.8.2.7.40570 > 99.181.67.81.1935: Flags [P.], seq 189911:191225, ack 1, win 501, options [nop,nop,TS val 3005093325 ecr 2840413138], length 1314
06:30:23.092184 IP 99.181.67.81.1935 > 10.8.2.7.40570: Flags [.], ack 179399, win 200, options [nop,nop,TS val 2840413216 ecr 3005093065], length 0
06:30:23.092262 IP 10.8.2.7.40570 > 99.181.67.81.1935: Flags [.], seq 191225:192539, ack 1, win 501, options [nop,nop,TS val 3005093402 ecr 2840413216], length 1314
06:30:23.092265 IP 10.8.2.7.40570 > 99.181.67.81.1935: Flags [P.], seq 192539:193853, ack 1, win 501, options [nop,nop,TS val 3005093402 ecr 2840413216], length 1314
06:30:23.133758 IP 99.181.67.81.1935 > 10.8.2.7.40570: Flags [.], ack 182027, win 200, options [nop,nop,TS val 2840413258 ecr 3005093107], length 0
06:30:23.133808 IP 10.8.2.7.40570 > 99.181.67.81.1935: Flags [.], seq 193853:195167, ack 1, win 501, options [nop,nop,TS val 3005093443 ecr 2840413258], length 1314
06:30:23.133810 IP 10.8.2.7.40570 > 99.181.67.81.1935: Flags [P.], seq 195167:196147, ack 1, win 501, options [nop,nop,TS val 3005093443 ecr 2840413258], length 980
06:30:23.182820 IP 99.181.67.81.1935 > 10.8.2.7.40570: Flags [.], ack 183341, win 200, options [nop,nop,TS val 2840413307 ecr 3005093109], length 0
