04:06:34.163589 IP 52.223.244.70.1935 > 10.8.2.7.60812: Flags [.], ack 615833124, win 126, options [nop,nop,TS val 1534126314 ecr 2845371412], length 0
04:06:34.168379 IP 10.8.2.7.60812 > 52.223.244.70.1935: Flags [.], seq 5662:6976, ack 0, win 501, options [nop,nop,TS val 2845371676 ecr 1534126314], length 1314
04:06:34.210353 IP 10.8.2.7.60812 > 52.223.244.70.1935: Flags [.], seq 6976:8290, ack 0, win 501, options [nop,nop,TS val 2845371718 ecr 1534126314], length 1314
04:06:34.264305 IP 52.223.244.70.1935 > 10.8.2.7.60812: Flags [.], ack 2629, win 126, options [nop,nop,TS val 1534126415 ecr 2845371483], length 0
04:06:34.267728 IP 10.8.2.7.60812 > 52.223.244.70.1935: Flags [.], seq 8290:9604, ack 0, win 501, options [nop,nop,TS val 2845371776 ecr 1534126415], length 1314
04:06:34.300540 IP 10.8.2.7.60812 > 52.223.244.70.1935: Flags [.], seq 9604:10918, ack 0, win 501, options [nop,nop,TS val 2845371808 ecr 1534126415], length 1314
04:06:34.315541 IP 52.223.244.70.1935 > 10.8.2.7.60812: Flags [.], ack 4348, win 126, options [nop,nop,TS val 1534126466 ecr 2845371578], length 0
04:06:34.315554 IP 10.8.2.7.60812 > 52.223.244.70.1935: Flags [P.], seq 10918:11233, ack 0, win 501, options [nop,nop,TS val 2845371823 ecr 1534126466], length 315
04:06:34.369628 IP 10.8.2.7.60812 > 52.223.244.70.1935: Flags [.], seq 11233:12547, ack 0, win 501, options [nop,nop,TS val 2845371877 ecr 1534126466], length 1314
04:06:34.397330 IP 52.223.244.70.1935 > 10.8.2.7.60812: Flags [.], ack 6976, win 126, options [nop,nop,TS val 1534126548 ecr 2845371643], length 0
04:06:34.402408 IP 10.8.2.7.60812 > 52.223.244.70.1935: Flags [.], seq 12547:13861, ack 0, win 501, options [nop,nop,TS val 2845371910 ecr 1534126548], length 1314
04:06:34.434812 IP 10.8.2.7.60812 > 52.223.244.70.1935: Flags [.], seq 13861:15175, ack 0, win 501, options [nop,nop,TS val 2845371943 ecr 1534126548], length 1314
04:06:34.496710 IP 52.223.244.70.1935 > 10.8.2.7.60812: Flags [.], ack 9604, win 126, options [nop,nop,TS val 1534126647 ecr 2845371718], length 0
04:06:34.502572 IP 10.8.2.7.60812 > 52.223.244.70.1935: Flags [.], seq 15175:16489, ack 0, win 501, options [nop,nop,TS val 2845372010 ecr 1534126647], length 1314
04:06:34.534802 IP 10.8.2.7.60812 > 52.223.244.70.1935: Flags [.], seq 16489:17803, ack 0, win 501, options [nop,nop,TS val 2845372043 ecr 1534126647], length 1314
04:06:34.544278 IP 52.223.244.70.1935 > 10.8.2.7.60812: Flags [.], ack 11233, win 126, options [nop,nop,TS val 1534126695 ecr 2845371808], length 0
04:06:34.544300 IP 10.8.2.7.60812 > 52.223.244.70.1935: Flags [P.], seq 17803:18205, ack 0, win 501, options [nop,nop,TS val 2845372052 ecr 1534126695], length 402
04:06:34.599554 IP 10.8.2.7.60812 > 52.223.244.70.1935: Flags [.], seq 18205:19519, ack 0, win 501, options [nop,nop,TS val 2845372107 ecr 1534126695], length 1314
04:06:34.631072 IP 52.223.244.70.1935 > 10.8.2.7.60812: Flags [.], ack 13861, win 126, options [nop,nop,TS val 1534126782 ecr 2845371877], length 0
04:06:34.633060 IP 10.8.2.7.60812 > 52.223.244.70.1935: Flags [.], seq 19519:20833, ack 0, win 501, options [nop,nop,TS val 2845372141 ecr 1534126782], length 1314
04:06:34.666854 IP 10.8.2.7.60812 > 52.223.244.70.1935: Flags [.], seq 20833:22147, ack 0, win 501, options [nop,nop,TS val 2845372175 ecr 1534126782], length 1314
04:06:34.731254 IP 52.223.244.70.1935 > 10.8.2.7.60812: Flags [.], ack 16489, win 126, options [nop,nop,TS val 1534126882 ecr 2845371943], length 0
04:06:34.733728 IP 10.8.2.7.60812 > 52.223.244.70.1935: Flags [.], seq 22147:23461, ack 0, win 501, options [nop,nop,TS val 2845372242 ecr 1534126882], length 1314
04:06:34.770530 IP 10.8.2.7.60812 > 52.223.244.70.1935: Flags [.], seq 23461:24775, ack 0, win 501, options [nop,nop,TS val 2845372278 ecr 1534126882], length 1314
04:06:34.772869 IP 52.223.244.70.1935 > 10.8.2.7.60812: Flags [.], ack 18205, win 126, options [nop,nop,TS val 1534126923 ecr 2845372043], length 0
04:06:34.772902 IP 10.8.2.7.60812 > 52.223.244.70.1935: Flags [P.], seq 24775:25177, ack 0, win 501, options [nop,nop,TS val 2845372281 ecr 1534126923], length 402
04:06:34.833062 IP 10.8.2.7.60812 > 52.223.244.70.1935: Flags [.], seq 25177:26491, ack 0, win 501, options [nop,nop,TS val 2845372341 ecr 1534126923], length 1314
04:06:34.862092 IP 52.223.244.70.1935 > 10.8.2.7.60812: Flags [.], ack 20833, win 126, options [nop,nop,TS val 1534127012 ecr 2845372107], length 0
04:06:34.870210 IP 10.8.2.7.60812 > 52.223.244.70.1935: Flags [.], seq 26491:27805, ack 0, win 501, options [nop,nop,TS val 2845372378 ecr 1534127012], length 1314
04:06:34.903730 IP 10.8.2.7.60812 > 52.223.244.70.1935: Flags [.], seq 27805:29119, ack 0, win 501, options [nop,nop,TS val 2845372412 ecr 1534127012], length 1314
04:06:34.962570 IP 52.223.244.70.1935 > 10.8.2.7.60812: Flags [.], ack 23461, win 126, options [nop,nop,TS val 1534127113 ecr 2845372175], length 0
04:06:34.968360 IP 10.8.2.7.60812 > 52.223.244.70.1935: Flags [.], seq 29119:30433, ack 0, win 501, options [nop,nop,TS val 2845372476 ecr 1534127113], length 1314
04:06:35.001557 IP 52.223.244.70.1935 > 10.8.2.7.60812: Flags [.], ack 25177, win 126, options [nop,nop,TS val 1534127152 ecr 2845372278], length 0
04:06:35.001585 IP 10.8.2.7.60812 > 52.223.244.70.1935: Flags [P.], seq 30433:31310, ack 0, win 501, options [nop,nop,TS val 2845372509 ecr 1534127152], length 877
04:06:35.035984 IP 10.8.2.7.60812 > 52.223.244.70.1935: Flags [.], seq 31310:32624, ack 0, win 501, options [nop,nop,TS val 2845372544 ecr 1534127152], length 1314
04:06:35.069100 IP 10.8.2.7.60812 > 52.223.244.70.1935: Flags [.], seq 32624:33938, ack 0, win 501, options [nop,nop,TS val 2845372577 ecr 1534127152], length 1314
04:06:35.099358 IP 52.223.244.70.1935 > 10.8.2.7.60812: Flags [.], ack 27805, win 126, options [nop,nop,TS val 1534127250 ecr 2845372341], length 0
04:06:35.126742 IP 10.8.2.7.60812 > 52.223.244.70.1935: Flags [.], seq 33938:35252, ack 0, win 501, options [nop,nop,TS val 2845372635 ecr 1534127250], length 1314
04:06:35.169591 IP 10.8.2.7.60812 > 52.223.244.70.1935: Flags [.], seq 35252:36566, ack 0, win 501, options [nop,nop,TS val 2845372677 ecr 1534127250], length 1314
04:06:35.197396 IP 52.223.244.70.1935 > 10.8.2.7.60812: Flags [.], ack 30433, win 126, options [nop,nop,TS val 1534127348 ecr 2845372412], length 0
04:06:35.203843 IP 10.8.2.7.60812 > 52.223.244.70.1935: Flags [.], seq 36566:37880, ack 0, win 501, options [nop,nop,TS val 2845372712 ecr 1534127348], length 1314
04:06:35.230244 IP 52.223.244.70.1935 > 10.8.2.7.60812: Flags [.], ack 31310, win 126, options [nop,nop,TS val 1534127381 ecr 2845372509], length 0
04:06:35.230272 IP 10.8.2.7.60812 > 52.223.244.70.1935: Flags [P.], seq 37880:38195, ack 0, win 501, options [nop,nop,TS val 2845372738 ecr 1534127381], length 315
04:06:35.270955 IP 10.8.2.7.60812 > 52.223.244.70.1935: Flags [.], seq 38195:39509, ack 0, win 501, options [nop,nop,TS val 2845372779 ecr 1534127381], length 1314
04:06:35.297921 IP 52.223.244.70.1935 > 10.8.2.7.60812: Flags [.], ack 33938, win 126, options [nop,nop,TS val 1534127448 ecr 2845372544], length 0
04:06:35.301144 IP 10.8.2.7.60812 > 52.223.244.70.1935: Flags [.], seq 39509:40823, ack 0, win 501, options [nop,nop,TS val 2845372809 ecr 1534127448], length 1314
04:06:35.340405 IP 10.8.2.7.60812 > 52.223.244.70.1935: Flags [.], seq 40823:42137, ack 0, win 501, options [nop,nop,TS val 2845372848 ecr 1534127448], length 1314
04:06:35.398431 IP 52.223.244.70.1935 > 10.8.2.7.60812: Flags [.], ack 36566, win 126, options [nop,nop,TS val 1534127549 ecr 2845372635], length 0
04:06:35.399907 IP 10.8.2.7.60812 > 52.223.244.70.1935: Flags [.], seq 42137:43451, ack 0, win 501, options [nop,nop,TS val 2845372908 ecr 1534127549], length 1314
04:06:35.433690 IP 10.8.2.7.60812 > 52.223.244.70.1935: Flags [.], seq 43451:44765, ack 0, win 501, options [nop,nop,TS val 2845372942 ecr 1534127549], length 1314
04:06:35.458731 IP 52.223.244.70.1935 > 10.8.2.7.60812: Flags [.], ack 38195, win 126, options [nop,nop,TS val 1534127609 ecr 2845372712], length 0
04:06:35.458766 IP 10.8.2.7.60812 > 52.223.244.70.1935: Flags [P.], seq 44765:45160, ack 0, win 501, options [nop,nop,TS val 2845372967 ecr 1534127609], length 395
04:06:35.505080 IP 10.8.2.7.60812 > 52.223.244.70.1935: Flags [.], seq 45160:46474, ack 0, win 501, options [nop,nop,TS val 2845373013 ecr 1534127609], length 1314
04:06:35.529892 IP 52.223.244.70.1935 > 10.8.2.7.60812: Flags [.], ack 40823, win 126, options [nop,nop,TS val 1534127680 ecr 2845372779], length 0
04:06:35.538418 IP 10.8.2.7.60812 > 52.223.244.70.1935: Flags [.], seq 46474:47788, ack 0, win 501, options [nop,nop,TS val 2845373046 ecr 1534127680], length 1314
04:06:35.575249 IP 10.8.2.7.60812 > 52.223.244.70.1935: Flags [.], seq 47788:49102, ack 0, win 501, options [nop,nop,TS val 2845373083 ecr 1534127680], length 1314
04:06:35.628470 IP 52.223.244.70.1935 > 10.8.2.7.60812: Flags [.], ack 43451, win 126, options [nop,nop,TS val 1534127779 ecr 2845372848], length 0
04:06:35.634240 IP 10.8.2.7.60812 > 52.223.244.70.1935: Flags [.], seq 49102:50416, ack 0, win 501, options [nop,nop,TS val 2845373142 ecr 1534127779], length 1314
04:06:35.667114 IP 10.8.2.7.60812 > 52.223.244.70.1935: Flags [.], seq 50416:51730, ack 0, win 501, options [nop,nop,TS val 2845373175 ecr 1534127779], length 1314
04:06:35.687732 IP 52.223.244.70.1935 > 10.8.2.7.60812: Flags [.], ack 45160, win 126, options [nop,nop,TS val 1534127838 ecr 2845372942], length 0
04:06:35.687750 IP 10.8.2.7.60812 > 52.223.244.70.1935: Flags [P.], seq 51730:52135, ack 0, win 501, options [nop,nop,TS val 2845373196 ecr 1534127838], length 405
04:06:35.738016 IP 10.8.2.7.60812 > 52.223.244.70.1935: Flags [.], seq 52135:53449, ack 0, win 501, options [nop,nop,TS val 2845373246 ecr 1534127838], length 1314
04:06:35.769939 IP 52.223.244.70.1935 > 10.8.2.7.60812: Flags [.], ack 47788, win 126, options [nop,nop,TS val 1534127920 ecr 2845373013], length 0
04:06:35.771759 IP 10.8.2.7.60812 > 52.223.244.70.1935: Flags [.], seq 53449:54763, ack 0, win 501, options [nop,nop,TS val 2845373280 ecr 1534127920], length 1314
04:06:35.809560 IP 10.8.2.7.60812 > 52.223.244.70.1935: Flags [.], seq 54763:56077, ack 0, win 501, options [nop,nop,TS val 2845373317 ecr 1534127920], length 1314
04:06:35.863089 IP 52.223.244.70.1935 > 10.8.2.7.60812: Flags [.], ack 50416, win 126, options [nop,nop,TS val 1534128013 ecr 2845373083], length 0
04:06:35.868263 IP 10.8.2.7.60812 > 52.223.244.70.1935: Flags [.], seq 56077:57391, ack 0, win 501, options [nop,nop,TS val 2845373376 ecr 1534128013], length 1314
04:06:35.903951 IP 10.8.2.7.60812 > 52.223.244.70.1935: Flags [.], seq 57391:58705, ack 0, win 501, options [nop,nop,TS val 2845373412 ecr 1534128013], length 1314
04:06:35.916131 IP 52.223.244.70.1935 > 10.8.2.7.60812: Flags [.], ack 52135, win 126, options [nop,nop,TS val 1534128067 ecr 2845373175], length 0
04:06:35.916168 IP 10.8.2.7.60812 > 52.223.244.70.1935: Flags [P.], seq 58705:59020, ack 0, win 501, options [nop,nop,TS val 2845373424 ecr 1534128067], length 315
04:06:35.968628 IP 10.8.2.7.60812 > 52.223.244.70.1935: Flags [.], seq 59020:60334, ack 0, win 501, options [nop,nop,TS val 2845373476 ecr 1534128067], length 1314
04:06:36.000662 IP 52.223.244.70.1935 > 10.8.2.7.60812: Flags [.], ack 54763, win 126, options [nop,nop,TS val 1534128151 ecr 2845373246], length 0
04:06:36.001562 IP 10.8.2.7.60812 > 52.223.244.70.1935: Flags [.], seq 60334:61648, ack 0, win 501, options [nop,nop,TS val 2845373509 ecr 1534128151], length 1314
04:06:36.034859 IP 10.8.2.7.60812 > 52.223.244.70.1935: Flags [.], seq 61648:62962, ack 0, win 501, options [nop,nop,TS val 2845373543 ecr 1534128151], length 1314
04:06:36.096883 IP 52.223.244.70.1935 > 10.8.2.7.60812: Flags [.], ack 57391, win 126, options [nop,nop,TS val 1534128247 ecr 2845373317], length 0
04:06:36.101462 IP 10.8.2.7.60812 > 52.223.244.70.1935: Flags [.], seq 62962:64276, ack 0, win 501, options [nop,nop,TS val 2845373609 ecr 1534128247], length 1314
04:06:36.135215 IP 10.8.2.7.60812 > 52.223.244.70.1935: Flags [.], seq 64276:65590, ack 0, win 501, options [nop,nop,TS val 2845373643 ecr 1534128247], length 1314
04:06:36.144579 IP 52.223.244.70.1935 > 10.8.2.7.60812: Flags [.], ack 59020, win 126, options [nop,nop,TS val 1534128295 ecr 2845373412], length 0
04:06:36.144613 IP 10.8.2.7.60812 > 52.223.244.70.1935: Flags [P.], seq 65590:65992, ack 0, win 501, options [nop,nop,TS val 2845373652 ecr 1534128295], length 402
04:06:36.203485 IP 10.8.2.7.60812 > 52.223.244.70.1935: Flags [.], seq 65992:67306, ack 0, win 501, options [nop,nop,TS val 2845373711 ecr 1534128295], length 1314
04:06:36.230361 IP 52.223.244.70.1935 > 10.8.2.7.60812: Flags [.], ack 61648, win 126, options [nop,nop,TS val 1534128381 ecr 2845373476], length 0
04:06:36.236731 IP 10.8.2.7.60812 > 52.223.244.70.1935: Flags [.], seq 67306:68620, ack 0, win 501, options [nop,nop,TS val 2845373745 ecr 1534128381], length 1314
04:06:36.270209 IP 10.8.2.7.60812 > 52.223.244.70.1935: Flags [.], seq 68620:69934, ack 0, win 501, options [nop,nop,TS val 2845373778 ecr 1534128381], length 1314
04:06:36.330352 IP 52.223.244.70.1935 > 10.8.2.7.60812: Flags [.], ack 64276, win 126, options [nop,nop,TS val 1534128481 ecr 2845373543], length 0
04:06:36.336097 IP 10.8.2.7.60812 > 52.223.244.70.1935: Flags [.], seq 69934:71248, ack 0, win 501, options [nop,nop,TS val 2845373844 ecr 1534128481], length 1314
04:06:36.367401 IP 10.8.2.7.60812 > 52.223.244.70.1935: Flags [.], seq 71248:72562, ack 0, win 501, options [nop,nop,TS val 2845373875 ecr 1534128481], length 1314
04:06:36.373185 IP 52.223.244.70.1935 > 10.8.2.7.60812: Flags [.], ack 65992, win 126, options [nop,nop,TS val 1534128524 ecr 2845373643], length 0
04:06:36.373203 IP 10.8.2.7.60812 > 52.223.244.70.1935: Flags [P.], seq 72562:72964, ack 0, win 501, options [nop,nop,TS val 2845373881 ecr 1534128524], length 402
04:06:36.437040 IP 10.8.2.7.60812 > 52.223.244.70.1935: Flags [.], seq 72964:74278, ack 0, win 501, options [nop,nop,TS val 2845373945 ecr 1534128524], length 1314
04:06:36.465601 IP 52.223.244.70.1935 > 10.8.2.7.60812: Flags [.], ack 68620, win 126, options [nop,nop,TS val 1534128616 ecr 2845373711], length 0
04:06:36.468590 IP 10.8.2.7.60812 > 52.223.244.70.1935: Flags [.], seq 74278:75592, ack 0, win 501, options [nop,nop,TS val 2845373976 ecr 1534128616], length 1314
04:06:36.501854 IP 10.8.2.7.60812 > 52.223.244.70.1935: Flags [.], seq 75592:76906, ack 0, win 501, options [nop,nop,TS val 2845374010 ecr 1534128616], length 1314
04:06:36.559117 IP 52.223.244.70.1935 > 10.8.2.7.60812: Flags [.], ack 69934, win 126, options [nop,nop,TS val 1534128709 ecr 2845373778], length 0
04:06:36.567474 IP 10.8.2.7.60812 > 52.223.244.70.1935: Flags [.], seq 76906:78220, ack 0, win 501, options [nop,nop,TS val 2845374075 ecr 1534128709], length 1314
04:06:36.596077 IP 52.223.244.70.1935 > 10.8.2.7.60812: Flags [.], ack 72562, win 126, options [nop,nop,TS val 1534128747 ecr 2845373844], length 0
04:06:36.600310 IP 10.8.2.7.60812 > 52.223.244.70.1935: Flags [.], seq 78220:79534, ack 0, win 501, options [nop,nop,TS val 2845374108 ecr 1534128747], length 1314
04:06:36.601866 IP 52.223.244.70.1935 > 10.8.2.7.60812: Flags [.], ack 72964, win 126, options [nop,nop,TS val 1534128752 ecr 2845373881], length 0
04:06:36.601875 IP 10.8.2.7.60812 > 52.223.244.70.1935: Flags [P.], seq 79534:79944, ack 0, win 501, options [nop,nop,TS val 2845374110 ecr 1534128752], length 410
04:06:36.670444 IP 10.8.2.7.60812 > 52.223.244.70.1935: Flags [.], seq 79944:81258, ack 0, win 501, options [nop,nop,TS val 2845374178 ecr 1534128752], length 1314
04:06:36.697639 IP 52.223.244.70.1935 > 10.8.2.7.60812: Flags [.], ack 75592, win 126, options [nop,nop,TS val 1534128848 ecr 2845373945], length 0
04:06:36.703809 IP 10.8.2.7.60812 > 52.223.244.70.1935: Flags [.], seq 81258:82572, ack 0, win 501, options [nop,nop,TS val 2845374212 ecr 1534128848], length 1314
04:06:36.737253 IP 10.8.2.7.60812 > 52.223.244.70.1935: Flags [.], seq 82572:83886, ack 0, win 501, options [nop,nop,TS val 2845374245 ecr 1534128848], length 1314
04:06:36.796375 IP 52.223.244.70.1935 > 10.8.2.7.60812: Flags [.], ack 78220, win 126, options [nop,nop,TS val 1534128947 ecr 2845374010], length 0
04:06:36.803854 IP 10.8.2.7.60812 > 52.223.244.70.1935: Flags [.], seq 83886:85200, ack 0, win 501, options [nop,nop,TS val 2845374312 ecr 1534128947], length 1314
04:06:36.830355 IP 52.223.244.70.1935 > 10.8.2.7.60812: Flags [.], ack 79944, win 126, options [nop,nop,TS val 1534128981 ecr 2845374108], length 0
04:06:36.830390 IP 10.8.2.7.60812 > 52.223.244.70.1935: Flags [P.], seq 85200:85981, ack 0, win 501, options [nop,nop,TS val 2845374338 ecr 1534128981], length 781
04:06:36.866208 IP 10.8.2.7.60812 > 52.223.244.70.1935: Flags [.], seq 85981:87295, ack 0, win 501, options [nop,nop,TS val 2845374374 ecr 1534128981], length 1314
04:06:36.899698 IP 10.8.2.7.60812 > 52.223.244.70.1935: Flags [.], seq 87295:88609, ack 0, win 501, options [nop,nop,TS val 2845374408 ecr 1534128981], length 1314
04:06:36.933059 IP 52.223.244.70.1935 > 10.8.2.7.60812: Flags [.], ack 82572, win 126, options [nop,nop,TS val 1534129083 ecr 2845374178], length 0
04:06:36.942046 IP 10.8.2.7.60812 > 52.223.244.70.1935: Flags [.], seq 88609:89923, ack 0, win 501, options [nop,nop,TS val 2845374450 ecr 1534129083], length 1314
04:06:37.004301 IP 10.8.2.7.60812 > 52.223.244.70.1935: Flags [.], seq 89923:91237, ack 0, win 501, options [nop,nop,TS val 2845374512 ecr 1534129083], length 1314
04:06:37.027000 IP 52.223.244.70.1935 > 10.8.2.7.60812: Flags [.], ack 83886, win 126, options [nop,nop,TS val 1534129177 ecr 2845374245], length 0
04:06:37.035484 IP 10.8.2.7.60812 > 52.223.244.70.1935: Flags [.], seq 91237:92551, ack 0, win 501, options [nop,nop,TS val 2845374543 ecr 1534129177], length 1314
04:06:37.059123 IP 52.223.244.70.1935 > 10.8.2.7.60812: Flags [.], ack 85981, win 126, options [nop,nop,TS val 1534129209 ecr 2845374312], length 0
04:06:37.059140 IP 10.8.2.7.60812 > 52.223.244.70.1935: Flags [P.], seq 92551:92946, ack 0, win 501, options [nop,nop,TS val 2845374567 ecr 1534129209], length 395
04:06:37.100938 IP 10.8.2.7.60812 > 52.223.244.70.1935: Flags [.], seq 92946:94260, ack 0, win 501, options [nop,nop,TS val 2845374609 ecr 1534129209], length 1314
04:06:37.128823 IP 52.223.244.70.1935 > 10.8.2.7.60812: Flags [.], ack 88609, win 126, options [nop,nop,TS val 1534129279 ecr 2845374374], length 0
04:06:37.136944 IP 10.8.2.7.60812 > 52.223.244.70.1935: Flags [.], seq 94260:95574, ack 0, win 501, options [nop,nop,TS val 2845374645 ecr 1534129279], length 1314
04:06:37.177247 IP 10.8.2.7.60812 > 52.223.244.70.1935: Flags [.], seq 95574:96888, ack 0, win 501, options [nop,nop,TS val 2845374685 ecr 1534129279], length 1314
04:06:37.233160 IP 52.223.244.70.1935 > 10.8.2.7.60812: Flags [.], ack 91237, win 126, options [nop,nop,TS val 1534129384 ecr 2845374450], length 0
04:06:37.237174 IP 10.8.2.7.60812 > 52.223.244.70.1935: Flags [.], seq 96888:98202, ack 0, win 501, options [nop,nop,TS val 2845374745 ecr 1534129384], length 1314
04:06:37.270171 IP 10.8.2.7.60812 > 52.223.244.70.1935: Flags [.], seq 98202:99516, ack 0, win 501, options [nop,nop,TS val 2845374778 ecr 1534129384], length 1314
04:06:37.287762 IP 52.223.244.70.1935 > 10.8.2.7.60812: Flags [.], ack 92946, win 126, options [nop,nop,TS val 1534129438 ecr 2845374543], length 0
04:06:37.287788 IP 10.8.2.7.60812 > 52.223.244.70.1935: Flags [P.], seq 99516:99922, ack 0, win 501, options [nop,nop,TS val 2845374796 ecr 1534129438], length 406
04:06:37.336010 IP 10.8.2.7.60812 > 52.223.244.70.1935: Flags [.], seq 99922:101236, ack 0, win 501, options [nop,nop,TS val 2845374844 ecr 1534129438], length 1314
04:06:37.366188 IP 52.223.244.70.1935 > 10.8.2.7.60812: Flags [.], ack 95574, win 126, options [nop,nop,TS val 1534129516 ecr 2845374609], length 0
04:06:37.369966 IP 10.8.2.7.60812 > 52.223.244.70.1935: Flags [.], seq 101236:102550, ack 0, win 501, options [nop,nop,TS val 2845374878 ecr 1534129516], length 1314
04:06:37.412668 IP 10.8.2.7.60812 > 52.223.244.70.1935: Flags [.], seq 102550:103864, ack 0, win 501, options [nop,nop,TS val 2845374920 ecr 1534129516], length 1314
04:06:37.466424 IP 52.223.244.70.1935 > 10.8.2.7.60812: Flags [.], ack 98202, win 126, options [nop,nop,TS val 1534129617 ecr 2845374685], length 0
04:06:37.467757 IP 10.8.2.7.60812 > 52.223.244.70.1935: Flags [.], seq 103864:105178, ack 0, win 501, options [nop,nop,TS val 2845374976 ecr 1534129617], length 1314
04:06:37.502385 IP 10.8.2.7.60812 > 52.223.244.70.1935: Flags [.], seq 105178:106492, ack 0, win 501, options [nop,nop,TS val 2845375010 ecr 1534129617], length 1314
04:06:37.516555 IP 52.223.244.70.1935 > 10.8.2.7.60812: Flags [.], ack 99922, win 126, options [nop,nop,TS val 1534129667 ecr 2845374778], length 0
04:06:37.516590 IP 10.8.2.7.60812 > 52.223.244.70.1935: Flags [P.], seq 106492:106807, ack 0, win 501, options [nop,nop,TS val 2845375024 ecr 1534129667], length 315
04:06:37.569873 IP 10.8.2.7.60812 > 52.223.244.70.1935: Flags [.], seq 106807:108121, ack 0, win 501, options [nop,nop,TS val 2845375078 ecr 1534129667], length 1314
04:06:37.598684 IP 52.223.244.70.1935 > 10.8.2.7.60812: Flags [.], ack 102550, win 126, options [nop,nop,TS val 1534129749 ecr 2845374844], length 0
04:06:37.603340 IP 10.8.2.7.60812 > 52.223.244.70.1935: Flags [.], seq 108121:109435, ack 0, win 501, options [nop,nop,TS val 2845375111 ecr 1534129749], length 1314
04:06:37.636742 IP 10.8.2.7.60812 > 52.223.244.70.1935: Flags [.], seq 109435:110749, ack 0, win 501, options [nop,nop,TS val 2845375145 ecr 1534129749], length 1314
04:06:37.696911 IP 52.223.244.70.1935 > 10.8.2.7.60812: Flags [.], ack 105178, win 126, options [nop,nop,TS val 1534129847 ecr 2845374920], length 0
04:06:37.701795 IP 10.8.2.7.60812 > 52.223.244.70.1935: Flags [.], seq 110749:112063, ack 0, win 501, options [nop,nop,TS val 2845375210 ecr 1534129847], length 1314
04:06:37.735186 IP 10.8.2.7.60812 > 52.223.244.70.1935: Flags [.], seq 112063:113377, ack 0, win 501, options [nop,nop,TS val 2845375243 ecr 1534129847], length 1314
04:06:37.745372 IP 52.223.244.70.1935 > 10.8.2.7.60812: Flags [.], ack 106807, win 126, options [nop,nop,TS val 1534129896 ecr 2845375010], length 0
04:06:37.745401 IP 10.8.2.7.60812 > 52.223.244.70.1935: Flags [P.], seq 113377:113779, ack 0, win 501, options [nop,nop,TS val 2845375253 ecr 1534129896], length 402
04:06:37.803809 IP 10.8.2.7.60812 > 52.223.244.70.1935: Flags [.], seq 113779:115093, ack 0, win 501, options [nop,nop,TS val 2845375312 ecr 1534129896], length 1314
04:06:37.832136 IP 52.223.244.70.1935 > 10.8.2.7.60812: Flags [.], ack 109435, win 126, options [nop,nop,TS val 1534129983 ecr 2845375078], length 0
04:06:37.834584 IP 10.8.2.7.60812 > 52.223.244.70.1935: Flags [.], seq 115093:116407, ack 0, win 501, options [nop,nop,TS val 2845375342 ecr 1534129983], length 1314
04:06:37.868480 IP 10.8.2.7.60812 > 52.223.244.70.1935: Flags [.], seq 116407:117721, ack 0, win 501, options [nop,nop,TS val 2845375376 ecr 1534129983], length 1314
04:06:37.930551 IP 52.223.244.70.1935 > 10.8.2.7.60812: Flags [.], ack 112063, win 126, options [nop,nop,TS val 1534130081 ecr 2845375145], length 0
04:06:37.935877 IP 10.8.2.7.60812 > 52.223.244.70.1935: Flags [.], seq 117721:119035, ack 0, win 501, options [nop,nop,TS val 2845375444 ecr 1534130081], length 1314
04:06:37.969215 IP 10.8.2.7.60812 > 52.223.244.70.1935: Flags [.], seq 119035:120349, ack 0, win 501, options [nop,nop,TS val 2845375477 ecr 1534130081], length 1314
04:06:37.974337 IP 52.223.244.70.1935 > 10.8.2.7.60812: Flags [.], ack 113779, win 126, options [nop,nop,TS val 1534130125 ecr 2845375243], length 0
04:06:37.974366 IP 10.8.2.7.60812 > 52.223.244.70.1935: Flags [P.], seq 120349:120751, ack 0, win 501, options [nop,nop,TS val 2845375482 ecr 1534130125], length 402
04:06:38.036966 IP 10.8.2.7.60812 > 52.223.244.70.1935: Flags [.], seq 120751:122065, ack 0, win 501, options [nop,nop,TS val 2845375545 ecr 1534130125], length 1314
04:06:38.063365 IP 52.223.244.70.1935 > 10.8.2.7.60812: Flags [.], ack 116407, win 126, options [nop,nop,TS val 1534130214 ecr 2845375312], length 0
04:06:38.070211 IP 10.8.2.7.60812 > 52.223.244.70.1935: Flags [.], seq 122065:123379, ack 0, win 501, options [nop,nop,TS val 2845375578 ecr 1534130214], length 1314
04:06:38.103581 IP 10.8.2.7.60812 > 52.223.244.70.1935: Flags [.], seq 123379:124693, ack 0, win 501, options [nop,nop,TS val 2845375611 ecr 1534130214], length 1314
04:06:38.158947 IP 52.223.244.70.1935 > 10.8.2.7.60812: Flags [.], ack 117721, win 126, options [nop,nop,TS val 1534130309 ecr 2845375376], length 0
04:06:38.169947 IP 10.8.2.7.60812 > 52.223.244.70.1935: Flags [.], seq 124693:126007, ack 0, win 501, options [nop,nop,TS val 2845375678 ecr 1534130309], length 1314
04:06:38.198164 IP 52.223.244.70.1935 > 10.8.2.7.60812: Flags [.], ack 120349, win 126, options [nop,nop,TS val 1534130348 ecr 2845375444], length 0
04:06:38.203154 IP 52.223.244.70.1935 > 10.8.2.7.60812: Flags [.], ack 120751, win 126, options [nop,nop,TS val 1534130354 ecr 2845375482], length 0
04:06:38.203210 IP 10.8.2.7.60812 > 52.223.244.70.1935: Flags [P.], seq 126007:126788, ack 0, win 501, options [nop,nop,TS val 2845375711 ecr 1534130354], length 781
04:06:38.235599 IP 10.8.2.7.60812 > 52.223.244.70.1935: Flags [.], seq 126788:128102, ack 0, win 501, options [nop,nop,TS val 2845375743 ecr 1534130354], length 1314
04:06:38.268601 IP 10.8.2.7.60812 > 52.223.244.70.1935: Flags [.], seq 128102:129416, ack 0, win 501, options [nop,nop,TS val 2845375776 ecr 1534130354], length 1314
04:06:38.299172 IP 52.223.244.70.1935 > 10.8.2.7.60812: Flags [.], ack 123379, win 126, options [nop,nop,TS val 1534130450 ecr 2845375545], length 0
04:06:38.311162 IP 10.8.2.7.60812 > 52.223.244.70.1935: Flags [.], seq 129416:130730, ack 0, win 501, options [nop,nop,TS val 2845375819 ecr 1534130450], length 1314
04:06:38.368431 IP 10.8.2.7.60812 > 52.223.244.70.1935: Flags [.], seq 130730:132044, ack 0, win 501, options [nop,nop,TS val 2845375876 ecr 1534130450], length 1314
04:06:38.399000 IP 52.223.244.70.1935 > 10.8.2.7.60812: Flags [.], ack 126007, win 126, options [nop,nop,TS val 1534130549 ecr 2845375611], length 0
04:06:38.402782 IP 10.8.2.7.60812 > 52.223.244.70.1935: Flags [.], seq 132044:133358, ack 0, win 501, options [nop,nop,TS val 2845375911 ecr 1534130549], length 1314
04:06:38.432037 IP 52.223.244.70.1935 > 10.8.2.7.60812: Flags [.], ack 126788, win 126, options [nop,nop,TS val 1534130582 ecr 2845375711], length 0
04:06:38.432078 IP 10.8.2.7.60812 > 52.223.244.70.1935: Flags [P.], seq 133358:133768, ack 0, win 501, options [nop,nop,TS val 2845375940 ecr 1534130582], length 410
04:06:38.469564 IP 10.8.2.7.60812 > 52.223.244.70.1935: Flags [.], seq 133768:135082, ack 0, win 501, options [nop,nop,TS val 2845375977 ecr 1534130582], length 1314
04:06:38.497866 IP 52.223.244.70.1935 > 10.8.2.7.60812: Flags [.], ack 129416, win 126, options [nop,nop,TS val 1534130648 ecr 2845375743], length 0
04:06:38.504098 IP 10.8.2.7.60812 > 52.223.244.70.1935: Flags [.], seq 135082:136396, ack 0, win 501, options [nop,nop,TS val 2845376012 ecr 1534130648], length 1314
04:06:38.546943 IP 10.8.2.7.60812 > 52.223.244.70.1935: Flags [.], seq 136396:137710, ack 0, win 501, options [nop,nop,TS val 2845376055 ecr 1534130648], length 1314
04:06:38.597135 IP 52.223.244.70.1935 > 10.8.2.7.60812: Flags [.], ack 132044, win 126, options [nop,nop,TS val 1534130748 ecr 2845375819], length 0
04:06:38.599597 IP 10.8.2.7.60812 > 52.223.244.70.1935: Flags [.], seq 137710:139024, ack 0, win 501, options [nop,nop,TS val 2845376107 ecr 1534130748], length 1314
04:06:38.633508 IP 10.8.2.7.60812 > 52.223.244.70.1935: Flags [.], seq 139024:140338, ack 0, win 501, options [nop,nop,TS val 2845376141 ecr 1534130748], length 1314
04:06:38.660594 IP 52.223.244.70.1935 > 10.8.2.7.60812: Flags [.], ack 133768, win 126, options [nop,nop,TS val 1534130811 ecr 2845375911], length 0
04:06:38.660631 IP 10.8.2.7.60812 > 52.223.244.70.1935: Flags [P.], seq 140338:140733, ack 0, win 501, options [nop,nop,TS val 2845376168 ecr 1534130811], length 395
04:06:38.703808 IP 10.8.2.7.60812 > 52.223.244.70.1935: Flags [.], seq 140733:142047, ack 0, win 501, options [nop,nop,TS val 2845376212 ecr 1534130811], length 1314
04:06:38.733164 IP 52.223.244.70.1935 > 10.8.2.7.60812: Flags [.], ack 136396, win 126, options [nop,nop,TS val 1534130883 ecr 2845375977], length 0
04:06:38.739130 IP 10.8.2.7.60812 > 52.223.244.70.1935: Flags [.], seq 142047:143361, ack 0, win 501, options [nop,nop,TS val 2845376247 ecr 1534130883], length 1314
04:06:38.781745 IP 10.8.2.7.60812 > 52.223.244.70.1935: Flags [.], seq 143361:144675, ack 0, win 501, options [nop,nop,TS val 2845376290 ecr 1534130883], length 1314
04:06:38.828427 IP 52.223.244.70.1935 > 10.8.2.7.60812: Flags [.], ack 139024, win 126, options [nop,nop,TS val 1534130979 ecr 2845376055], length 0
04:06:38.837226 IP 10.8.2.7.60812 > 52.223.244.70.1935: Flags [.], seq 144675:145989, ack 0, win 501, options [nop,nop,TS val 2845376345 ecr 1534130979], length 1314
04:06:38.870405 IP 10.8.2.7.60812 > 52.223.244.70.1935: Flags [.], seq 145989:147303, ack 0, win 501, options [nop,nop,TS val 2845376378 ecr 1534130979], length 1314
04:06:38.889353 IP 52.223.244.70.1935 > 10.8.2.7.60812: Flags [.], ack 140733, win 126, options [nop,nop,TS val 1534131040 ecr 2845376141], length 0
04:06:38.889380 IP 10.8.2.7.60812 > 52.223.244.70.1935: Flags [P.], seq 147303:147708, ack 0, win 501, options [nop,nop,TS val 2845376397 ecr 1534131040], length 405
04:06:38.934394 IP 10.8.2.7.60812 > 52.223.244.70.1935: Flags [.], seq 147708:149022, ack 0, win 501, options [nop,nop,TS val 2845376442 ecr 1534131040], length 1314
04:06:38.968180 IP 52.223.244.70.1935 > 10.8.2.7.60812: Flags [.], ack 143361, win 126, options [nop,nop,TS val 1534131119 ecr 2845376212], length 0
04:06:38.974318 IP 10.8.2.7.60812 > 52.223.244.70.1935: Flags [.], seq 149022:150336, ack 0, win 501, options [nop,nop,TS val 2845376482 ecr 1534131119], length 1314
04:06:39.017253 IP 10.8.2.7.60812 > 52.223.244.70.1935: Flags [.], seq 150336:151650, ack 0, win 501, options [nop,nop,TS val 2845376525 ecr 1534131119], length 1314
04:06:39.066014 IP 52.223.244.70.1935 > 10.8.2.7.60812: Flags [.], ack 145989, win 126, options [nop,nop,TS val 1534131216 ecr 2845376290], length 0
04:06:39.070320 IP 10.8.2.7.60812 > 52.223.244.70.1935: Flags [.], seq 151650:152964, ack 0, win 501, options [nop,nop,TS val 2845376578 ecr 1534131216], length 1314
04:06:39.104206 IP 10.8.2.7.60812 > 52.223.244.70.1935: Flags [.], seq 152964:154278, ack 0, win 501, options [nop,nop,TS val 2845376612 ecr 1534131216], length 1314
04:06:39.118048 IP 52.223.244.70.1935 > 10.8.2.7.60812: Flags [.], ack 147708, win 126, options [nop,nop,TS val 1534131269 ecr 2845376378], length 0
04:06:39.118079 IP 10.8.2.7.60812 > 52.223.244.70.1935: Flags [P.], seq 154278:154593, ack 0, win 501, options [nop,nop,TS val 2845376626 ecr 1534131269], length 315
04:06:39.168765 IP 10.8.2.7.60812 > 52.223.244.70.1935: Flags [.], seq 154593:155907, ack 0, win 501, options [nop,nop,TS val 2845376677 ecr 1534131269], length 1314
04:06:39.201873 IP 10.8.2.7.60812 > 52.223.244.70.1935: Flags [.], seq 155907:157221, ack 0, win 501, options [nop,nop,TS val 2845376710 ecr 1534131269], length 1314
04:06:39.203172 IP 52.223.244.70.1935 > 10.8.2.7.60812: Flags [.], ack 150336, win 126, options [nop,nop,TS val 1534131354 ecr 2845376442], length 0
04:06:39.235670 IP 10.8.2.7.60812 > 52.223.244.70.1935: Flags [.], seq 157221:158535, ack 0, win 501, options [nop,nop,TS val 2845376743 ecr 1534131354], length 1314
04:06:39.299320 IP 52.223.244.70.1935 > 10.8.2.7.60812: Flags [.], ack 152964, win 126, options [nop,nop,TS val 1534131450 ecr 2845376525], length 0
04:06:39.301565 IP 10.8.2.7.60812 > 52.223.244.70.1935: Flags [.], seq 158535:159849, ack 0, win 501, options [nop,nop,TS val 2845376809 ecr 1534131450], length 1314
04:06:39.338004 IP 10.8.2.7.60812 > 52.223.244.70.1935: Flags [.], seq 159849:161163, ack 0, win 501, options [nop,nop,TS val 2845376846 ecr 1534131450], length 1314
04:06:39.346947 IP 52.223.244.70.1935 > 10.8.2.7.60812: Flags [.], ack 154593, win 126, options [nop,nop,TS val 1534131497 ecr 2845376612], length 0
04:06:39.346982 IP 10.8.2.7.60812 > 52.223.244.70.1935: Flags [P.], seq 161163:161566, ack 0, win 501, options [nop,nop,TS val 2845376855 ecr 1534131497], length 403
04:06:39.402051 IP 10.8.2.7.60812 > 52.223.244.70.1935: Flags [.], seq 161566:162880, ack 0, win 501, options [nop,nop,TS val 2845376910 ecr 1534131497], length 1314
04:06:39.430742 IP 52.223.244.70.1935 > 10.8.2.7.60812: Flags [.], ack 157221, win 126, options [nop,nop,TS val 1534131581 ecr 2845376677], length 0
04:06:39.433125 IP 10.8.2.7.60812 > 52.223.244.70.1935: Flags [.], seq 162880:164194, ack 0, win 501, options [nop,nop,TS val 2845376941 ecr 1534131581], length 1314
04:06:39.468201 IP 10.8.2.7.60812 > 52.223.244.70.1935: Flags [.], seq 164194:165508, ack 0, win 501, options [nop,nop,TS val 2845376976 ecr 1534131581], length 1314
04:06:39.530538 IP 52.223.244.70.1935 > 10.8.2.7.60812: Flags [.], ack 159849, win 126, options [nop,nop,TS val 1534131681 ecr 2845376743], length 0
04:06:39.536950 IP 10.8.2.7.60812 > 52.223.244.70.1935: Flags [.], seq 165508:166822, ack 0, win 501, options [nop,nop,TS val 2845377045 ecr 1534131681], length 1314
04:06:39.572942 IP 10.8.2.7.60812 > 52.223.244.70.1935: Flags [.], seq 166822:168136, ack 0, win 501, options [nop,nop,TS val 2845377081 ecr 1534131681], length 1314
04:06:39.575714 IP 52.223.244.70.1935 > 10.8.2.7.60812: Flags [.], ack 161566, win 126, options [nop,nop,TS val 1534131726 ecr 2845376846], length 0
04:06:39.575733 IP 10.8.2.7.60812 > 52.223.244.70.1935: Flags [P.], seq 168136:168538, ack 0, win 501, options [nop,nop,TS val 2845377084 ecr 1534131726], length 402
04:06:39.637306 IP 10.8.2.7.60812 > 52.223.244.70.1935: Flags [.], seq 168538:169852, ack 0, win 501, options [nop,nop,TS val 2845377145 ecr 1534131726], length 1314
04:06:39.662235 IP 52.223.244.70.1935 > 10.8.2.7.60812: Flags [.], ack 164194, win 126, options [nop,nop,TS val 1534131812 ecr 2845376910], length 0
04:06:39.670285 IP 10.8.2.7.60812 > 52.223.244.70.1935: Flags [.], seq 169852:171166, ack 0, win 501, options [nop,nop,TS val 2845377178 ecr 1534131812], length 1314
04:06:39.703858 IP 10.8.2.7.60812 > 52.223.244.70.1935: Flags [.], seq 171166:172480, ack 0, win 501, options [nop,nop,TS val 2845377212 ecr 1534131812], length 1314
04:06:39.765625 IP 52.223.244.70.1935 > 10.8.2.7.60812: Flags [.], ack 166822, win 126, options [nop,nop,TS val 1534131916 ecr 2845376976], length 0
04:06:39.767818 IP 10.8.2.7.60812 > 52.223.244.70.1935: Flags [.], seq 172480:173794, ack 0, win 501, options [nop,nop,TS val 2845377276 ecr 1534131916], length 1314
04:06:39.804085 IP 52.223.244.70.1935 > 10.8.2.7.60812: Flags [.], ack 168538, win 126, options [nop,nop,TS val 1534131955 ecr 2845377081], length 0
04:06:39.804103 IP 10.8.2.7.60812 > 52.223.244.70.1935: Flags [P.], seq 173794:174671, ack 0, win 501, options [nop,nop,TS val 2845377312 ecr 1534131955], length 877
04:06:39.834177 IP 10.8.2.7.60812 > 52.223.244.70.1935: Flags [.], seq 174671:175985, ack 0, win 501, options [nop,nop,TS val 2845377342 ecr 1534131955], length 1314
04:06:39.872088 IP 10.8.2.7.60812 > 52.223.244.70.1935: Flags [.], seq 175985:177299, ack 0, win 501, options [nop,nop,TS val 2845377380 ecr 1534131955], length 1314
04:06:39.899398 IP 52.223.244.70.1935 > 10.8.2.7.60812: Flags [.], ack 171166, win 126, options [nop,nop,TS val 1534132050 ecr 2845377145], length 0
04:06:39.936417 IP 10.8.2.7.60812 > 52.223.244.70.1935: Flags [.], seq 177299:178613, ack 0, win 501, options [nop,nop,TS val 2845377444 ecr 1534132050], length 1314
04:06:39.968806 IP 10.8.2.7.60812 > 52.223.244.70.1935: Flags [.], seq 178613:179927, ack 0, win 501, options [nop,nop,TS val 2845377477 ecr 1534132050], length 1314
04:06:39.996522 IP 52.223.244.70.1935 > 10.8.2.7.60812: Flags [.], ack 173794, win 126, options [nop,nop,TS val 1534132147 ecr 2845377212], length 0
04:06:40.003012 IP 10.8.2.7.60812 > 52.223.244.70.1935: Flags [.], seq 179927:181241, ack 0, win 501, options [nop,nop,TS val 2845377511 ecr 1534132147], length 1314
04:06:40.032841 IP 52.223.244.70.1935 > 10.8.2.7.60812: Flags [.], ack 174671, win 126, options [nop,nop,TS val 1534132183 ecr 2845377312], length 0
04:06:40.032886 IP 10.8.2.7.60812 > 52.223.244.70.1935: Flags [P.], seq 181241:181555, ack 0, win 501, options [nop,nop,TS val 2845377541 ecr 1534132183], length 314
04:06:40.069726 IP 10.8.2.7.60812 > 52.223.244.70.1935: Flags [.], seq 181555:182869, ack 0, win 501, options [nop,nop,TS val 2845377578 ecr 1534132183], length 1314
04:06:40.101145 IP 52.223.244.70.1935 > 10.8.2.7.60812: Flags [.], ack 177299, win 126, options [nop,nop,TS val 1534132251 ecr 2845377342], length 0
04:06:40.107872 IP 10.8.2.7.60812 > 52.223.244.70.1935: Flags [.], seq 182869:184183, ack 0, win 501, options [nop,nop,TS val 2845377616 ecr 1534132251], length 1314
04:06:40.150385 IP 10.8.2.7.60812 > 52.223.244.70.1935: Flags [.], seq 184183:185497, ack 0, win 501, options [nop,nop,TS val 2845377658 ecr 1534132251], length 1314
04:06:40.197888 IP 52.223.244.70.1935 > 10.8.2.7.60812: Flags [.], ack 179927, win 126, options [nop,nop,TS val 1534132348 ecr 2845377444], length 0
04:06:40.203615 IP 10.8.2.7.60812 > 52.223.244.70.1935: Flags [.], seq 185497:186811, ack 0, win 501, options [nop,nop,TS val 2845377711 ecr 1534132348], length 1314
04:06:40.236024 IP 10.8.2.7.60812 > 52.223.244.70.1935: Flags [.], seq 186811:188125, ack 0, win 501, options [nop,nop,TS val 2845377744 ecr 1534132348], length 1314
04:06:40.261512 IP 52.223.244.70.1935 > 10.8.2.7.60812: Flags [.], ack 181555, win 126, options [nop,nop,TS val 1534132412 ecr 2845377511], length 0
04:06:40.261531 IP 10.8.2.7.60812 > 52.223.244.70.1935: Flags [P.], seq 188125:188520, ack 0, win 501, options [nop,nop,TS val 2845377769 ecr 1534132412], length 395
04:06:40.303664 IP 10.8.2.7.60812 > 52.223.244.70.1935: Flags [.], seq 188520:189834, ack 0, win 501, options [nop,nop,TS val 2845377811 ecr 1534132412], length 1314
04:06:40.336788 IP 52.223.244.70.1935 > 10.8.2.7.60812: Flags [.], ack 184183, win 126, options [nop,nop,TS val 1534132487 ecr 2845377578], length 0
04:06:40.343500 IP 10.8.2.7.60812 > 52.223.244.70.1935: Flags [.], seq 189834:191148, ack 0, win 501, options [nop,nop,TS val 2845377851 ecr 1534132487], length 1314
04:06:40.386155 IP 10.8.2.7.60812 > 52.223.244.70.1935: Flags [.], seq 191148:192462, ack 0, win 501, options [nop,nop,TS val 2845377894 ecr 1534132487], length 1314
04:06:40.432758 IP 52.223.244.70.1935 > 10.8.2.7.60812: Flags [.], ack 186811, win 126, options [nop,nop,TS val 1534132583 ecr 2845377658], length 0
04:06:40.435831 IP 10.8.2.7.60812 > 52.223.244.70.1935: Flags [.], seq 192462:193776, ack 0, win 501, options [nop,nop,TS val 2845377944 ecr 1534132583], length 1314
04:06:40.471953 IP 10.8.2.7.60812 > 52.223.244.70.1935: Flags [.], seq 193776:195090, ack 0, win 501, options [nop,nop,TS val 2845377980 ecr 1534132583], length 1314
04:06:40.489965 IP 52.223.244.70.1935 > 10.8.2.7.60812: Flags [.], ack 188520, win 126, options [nop,nop,TS val 1534132640 ecr 2845377744], length 0
04:06:40.489999 IP 10.8.2.7.60812 > 52.223.244.70.1935: Flags [P.], seq 195090:195400, ack 0, win 501, options [nop,nop,TS val 2845377998 ecr 1534132640], length 310
04:06:40.536179 IP 10.8.2.7.60812 > 52.223.244.70.1935: Flags [.], seq 195400:196714, ack 0, win 501, options [nop,nop,TS val 2845378044 ecr 1534132640], length 1314
04:06:40.572473 IP 52.223.244.70.1935 > 10.8.2.7.60812: Flags [.], ack 191148, win 126, options [nop,nop,TS val 1534132723 ecr 2845377811], length 0
