02:39:37.943695 IP 10.8.0.5.37068 > 99.181.89.230.1935: Flags [.], seq 3953111433:3953112747, ack 813847963, win 501, options [nop,nop,TS val 820909207 ecr 3265610023], length 1314
02:39:37.992702 IP 99.181.89.230.1935 > 10.8.0.5.37068: Flags [.], ack 4294955120, win 132, options [nop,nop,TS val 3265610129 ecr 820908716], length 0
02:39:38.007836 IP 10.8.0.5.37068 > 99.181.89.230.1935: Flags [.], seq 1314:2628, ack 1, win 501, options [nop,nop,TS val 820909272 ecr 3265610129], length 1314
02:39:38.014382 IP 99.181.89.230.1935 > 10.8.0.5.37068: Flags [.], ack 4294956784, win 132, options [nop,nop,TS val 3265610151 ecr 820908802], length 0
02:39:38.014422 IP 10.8.0.5.37068 > 99.181.89.230.1935: Flags [P.], seq 2628:3428, ack 1, win 501, options [nop,nop,TS val 820909278 ecr 3265610151], length 800
02:39:38.071860 IP 10.8.0.5.37068 > 99.181.89.230.1935: Flags [.], seq 3428:4742, ack 1, win 501, options [nop,nop,TS val 820909336 ecr 3265610151], length 1314
02:39:38.114360 IP 10.8.0.5.37068 > 99.181.89.230.1935: Flags [.], seq 4742:6056, ack 1, win 501, options [nop,nop,TS val 820909378 ecr 3265610151], length 1314
02:39:38.121184 IP 99.181.89.230.1935 > 10.8.0.5.37068: Flags [.], ack 4294959412, win 132, options [nop,nop,TS val 3265610258 ecr 820908866], length 0
02:39:38.135604 IP 10.8.0.5.37068 > 99.181.89.230.1935: Flags [.], seq 6056:7370, ack 1, win 501, options [nop,nop,TS val 820909399 ecr 3265610258], length 1314
02:39:38.219964 IP 10.8.0.5.37068 > 99.181.89.230.1935: Flags [.], seq 7370:8684, ack 1, win 501, options [nop,nop,TS val 820909484 ecr 3265610258], length 1314
02:39:38.226393 IP 99.181.89.230.1935 > 10.8.0.5.37068: Flags [.], ack 4294962040, win 132, options [nop,nop,TS val 3265610363 ecr 820908950], length 0
02:39:38.242448 IP 10.8.0.5.37068 > 99.181.89.230.1935: Flags [.], seq 8684:9998, ack 1, win 501, options [nop,nop,TS val 820909506 ecr 3265610363], length 1314
02:39:38.282986 IP 10.8.0.5.37068 > 99.181.89.230.1935: Flags [.], seq 9998:11312, ack 1, win 501, options [nop,nop,TS val 820909547 ecr 3265610363], length 1314
02:39:38.292250 IP 99.181.89.230.1935 > 10.8.0.5.37068: Flags [.], ack 4294964668, win 132, options [nop,nop,TS val 3265610429 ecr 820909036], length 0
02:39:38.349284 IP 10.8.0.5.37068 > 99.181.89.230.1935: Flags [.], seq 11312:12626, ack 1, win 501, options [nop,nop,TS val 820909613 ecr 3265610429], length 1314
02:39:38.370864 IP 10.8.0.5.37068 > 99.181.89.230.1935: Flags [.], seq 12626:13940, ack 1, win 501, options [nop,nop,TS val 820909635 ecr 3265610429], length 1314
02:39:38.378067 IP 99.181.89.230.1935 > 10.8.0.5.37068: Flags [.], ack 0, win 132, options [nop,nop,TS val 3265610514 ecr 820909144], length 0
02:39:38.413531 IP 10.8.0.5.37068 > 99.181.89.230.1935: Flags [.], seq 13940:15254, ack 1, win 501, options [nop,nop,TS val 820909677 ecr 3265610514], length 1314
02:39:38.476980 IP 10.8.0.5.37068 > 99.181.89.230.1935: Flags [.], seq 15254:16568, ack 1, win 501, options [nop,nop,TS val 820909741 ecr 3265610514], length 1314
02:39:38.484173 IP 99.181.89.230.1935 > 10.8.0.5.37068: Flags [.], ack 2628, win 132, options [nop,nop,TS val 3265610621 ecr 820909207], length 0
02:39:38.491002 IP 99.181.89.230.1935 > 10.8.0.5.37068: Flags [.], ack 3428, win 132, options [nop,nop,TS val 3265610627 ecr 820909278], length 0
02:39:38.491019 IP 10.8.0.5.37068 > 99.181.89.230.1935: Flags [P.], seq 16568:17484, ack 1, win 501, options [nop,nop,TS val 820909755 ecr 3265610627], length 916
02:39:38.540496 IP 10.8.0.5.37068 > 99.181.89.230.1935: Flags [.], seq 17484:18798, ack 1, win 501, options [nop,nop,TS val 820909804 ecr 3265610627], length 1314
02:39:38.582726 IP 10.8.0.5.37068 > 99.181.89.230.1935: Flags [.], seq 18798:20112, ack 1, win 501, options [nop,nop,TS val 820909846 ecr 3265610627], length 1314
02:39:38.590897 IP 99.181.89.230.1935 > 10.8.0.5.37068: Flags [.], ack 6056, win 132, options [nop,nop,TS val 3265610727 ecr 820909336], length 0
02:39:38.618861 IP 10.8.0.5.37068 > 99.181.89.230.1935: Flags [.], seq 20112:21426, ack 1, win 501, options [nop,nop,TS val 820909883 ecr 3265610727], length 1314
02:39:38.667781 IP 10.8.0.5.37068 > 99.181.89.230.1935: Flags [.], seq 21426:22740, ack 1, win 501, options [nop,nop,TS val 820909931 ecr 3265610727], length 1314
02:39:38.678818 IP 99.181.89.230.1935 > 10.8.0.5.37068: Flags [.], ack 7370, win 132, options [nop,nop,TS val 3265610815 ecr 820909399], length 0
02:39:38.710373 IP 10.8.0.5.37068 > 99.181.89.230.1935: Flags [.], seq 22740:24054, ack 1, win 501, options [nop,nop,TS val 820909974 ecr 3265610815], length 1314
02:39:38.719136 IP 99.181.89.230.1935 > 10.8.0.5.37068: Flags [.], ack 9998, win 132, options [nop,nop,TS val 3265610855 ecr 820909484], length 0
02:39:38.753583 IP 10.8.0.5.37068 > 99.181.89.230.1935: Flags [.], seq 24054:25368, ack 1, win 501, options [nop,nop,TS val 820910017 ecr 3265610855], length 1314
02:39:38.817678 IP 10.8.0.5.37068 > 99.181.89.230.1935: Flags [.], seq 25368:26682, ack 1, win 501, options [nop,nop,TS val 820910081 ecr 3265610855], length 1314
02:39:38.825873 IP 99.181.89.230.1935 > 10.8.0.5.37068: Flags [.], ack 12626, win 132, options [nop,nop,TS val 3265610962 ecr 820909547], length 0
02:39:38.839096 IP 10.8.0.5.37068 > 99.181.89.230.1935: Flags [.], seq 26682:27996, ack 1, win 501, options [nop,nop,TS val 820910103 ecr 3265610962], length 1314
02:39:38.882125 IP 10.8.0.5.37068 > 99.181.89.230.1935: Flags [.], seq 27996:29310, ack 1, win 501, options [nop,nop,TS val 820910146 ecr 3265610962], length 1314
02:39:38.889959 IP 99.181.89.230.1935 > 10.8.0.5.37068: Flags [.], ack 15254, win 132, options [nop,nop,TS val 3265611026 ecr 820909635], length 0
02:39:38.946303 IP 10.8.0.5.37068 > 99.181.89.230.1935: Flags [.], seq 29310:30624, ack 1, win 501, options [nop,nop,TS val 820910210 ecr 3265611026], length 1314
02:39:38.967341 IP 99.181.89.230.1935 > 10.8.0.5.37068: Flags [.], ack 17484, win 132, options [nop,nop,TS val 3265611104 ecr 820909741], length 0
02:39:38.967365 IP 10.8.0.5.37068 > 99.181.89.230.1935: Flags [P.], seq 30624:31427, ack 1, win 501, options [nop,nop,TS val 820910231 ecr 3265611104], length 803
02:39:39.010486 IP 10.8.0.5.37068 > 99.181.89.230.1935: Flags [.], seq 31427:32741, ack 1, win 501, options [nop,nop,TS val 820910274 ecr 3265611104], length 1314
02:39:39.053023 IP 10.8.0.5.37068 > 99.181.89.230.1935: Flags [.], seq 32741:34055, ack 1, win 501, options [nop,nop,TS val 820910317 ecr 3265611104], length 1314
02:39:39.059236 IP 99.181.89.230.1935 > 10.8.0.5.37068: Flags [.], ack 20112, win 132, options [nop,nop,TS val 3265611196 ecr 820909804], length 0
02:39:39.087229 IP 10.8.0.5.37068 > 99.181.89.230.1935: Flags [.], seq 34055:35369, ack 1, win 501, options [nop,nop,TS val 820910351 ecr 3265611196], length 1314
02:39:39.138539 IP 10.8.0.5.37068 > 99.181.89.230.1935: Flags [.], seq 35369:36683, ack 1, win 501, options [nop,nop,TS val 820910402 ecr 3265611196], length 1314
02:39:39.144299 IP 99.181.89.230.1935 > 10.8.0.5.37068: Flags [.], ack 22740, win 132, options [nop,nop,TS val 3265611281 ecr 820909883], length 0
02:39:39.181575 IP 10.8.0.5.37068 > 99.181.89.230.1935: Flags [.], seq 36683:37997, ack 1, win 501, options [nop,nop,TS val 820910445 ecr 3265611281], length 1314
02:39:39.220092 IP 10.8.0.5.37068 > 99.181.89.230.1935: Flags [.], seq 37997:39311, ack 1, win 501, options [nop,nop,TS val 820910484 ecr 3265611281], length 1314
02:39:39.230051 IP 99.181.89.230.1935 > 10.8.0.5.37068: Flags [.], ack 25368, win 132, options [nop,nop,TS val 3265611366 ecr 820909974], length 0
02:39:39.288369 IP 10.8.0.5.37068 > 99.181.89.230.1935: Flags [.], seq 39311:40625, ack 1, win 501, options [nop,nop,TS val 820910552 ecr 3265611366], length 1314
02:39:39.309621 IP 10.8.0.5.37068 > 99.181.89.230.1935: Flags [.], seq 40625:41939, ack 1, win 501, options [nop,nop,TS val 820910573 ecr 3265611366], length 1314
02:39:39.315660 IP 99.181.89.230.1935 > 10.8.0.5.37068: Flags [.], ack 27996, win 132, options [nop,nop,TS val 3265611452 ecr 820910081], length 0
02:39:39.351853 IP 10.8.0.5.37068 > 99.181.89.230.1935: Flags [.], seq 41939:43253, ack 1, win 501, options [nop,nop,TS val 820910616 ecr 3265611452], length 1314
02:39:39.416375 IP 10.8.0.5.37068 > 99.181.89.230.1935: Flags [.], seq 43253:44567, ack 1, win 501, options [nop,nop,TS val 820910680 ecr 3265611452], length 1314
02:39:39.422904 IP 99.181.89.230.1935 > 10.8.0.5.37068: Flags [.], ack 30624, win 132, options [nop,nop,TS val 3265611559 ecr 820910146], length 0
02:39:39.438003 IP 10.8.0.5.37068 > 99.181.89.230.1935: Flags [.], seq 44567:45881, ack 1, win 501, options [nop,nop,TS val 820910702 ecr 3265611559], length 1314
02:39:39.443753 IP 99.181.89.230.1935 > 10.8.0.5.37068: Flags [.], ack 31427, win 132, options [nop,nop,TS val 3265611580 ecr 820910231], length 0
02:39:39.443786 IP 10.8.0.5.37068 > 99.181.89.230.1935: Flags [P.], seq 45881:46224, ack 1, win 501, options [nop,nop,TS val 820910707 ecr 3265611580], length 343
02:39:39.502161 IP 10.8.0.5.37068 > 99.181.89.230.1935: Flags [.], seq 46224:47538, ack 1, win 501, options [nop,nop,TS val 820910766 ecr 3265611580], length 1314
02:39:39.529709 IP 99.181.89.230.1935 > 10.8.0.5.37068: Flags [.], ack 34055, win 132, options [nop,nop,TS val 3265611666 ecr 820910274], length 0
02:39:39.544963 IP 10.8.0.5.37068 > 99.181.89.230.1935: Flags [.], seq 47538:48852, ack 1, win 501, options [nop,nop,TS val 820910809 ecr 3265611666], length 1314
02:39:39.584788 IP 10.8.0.5.37068 > 99.181.89.230.1935: Flags [.], seq 48852:50166, ack 1, win 501, options [nop,nop,TS val 820910848 ecr 3265611666], length 1314
02:39:39.615029 IP 99.181.89.230.1935 > 10.8.0.5.37068: Flags [.], ack 36683, win 132, options [nop,nop,TS val 3265611751 ecr 820910351], length 0
02:39:39.651300 IP 10.8.0.5.37068 > 99.181.89.230.1935: Flags [.], seq 50166:51480, ack 1, win 501, options [nop,nop,TS val 820910915 ecr 3265611751], length 1314
02:39:39.672478 IP 10.8.0.5.37068 > 99.181.89.230.1935: Flags [.], seq 51480:52794, ack 1, win 501, options [nop,nop,TS val 820910936 ecr 3265611751], length 1314
02:39:39.696653 IP 99.181.89.230.1935 > 10.8.0.5.37068: Flags [.], ack 39311, win 132, options [nop,nop,TS val 3265611833 ecr 820910445], length 0
02:39:39.715399 IP 10.8.0.5.37068 > 99.181.89.230.1935: Flags [.], seq 52794:54108, ack 1, win 501, options [nop,nop,TS val 820910979 ecr 3265611833], length 1314
02:39:39.779381 IP 10.8.0.5.37068 > 99.181.89.230.1935: Flags [.], seq 54108:55422, ack 1, win 501, options [nop,nop,TS val 820911043 ecr 3265611833], length 1314
02:39:39.786072 IP 99.181.89.230.1935 > 10.8.0.5.37068: Flags [.], ack 41939, win 132, options [nop,nop,TS val 3265611922 ecr 820910552], length 0
02:39:39.819905 IP 10.8.0.5.37068 > 99.181.89.230.1935: Flags [.], seq 55422:56736, ack 1, win 501, options [nop,nop,TS val 820911084 ecr 3265611922], length 1314
02:39:39.843577 IP 10.8.0.5.37068 > 99.181.89.230.1935: Flags [.], seq 56736:58050, ack 1, win 501, options [nop,nop,TS val 820911107 ecr 3265611922], length 1314
02:39:39.893399 IP 99.181.89.230.1935 > 10.8.0.5.37068: Flags [.], ack 44567, win 132, options [nop,nop,TS val 3265612030 ecr 820910616], length 0
02:39:39.907232 IP 10.8.0.5.37068 > 99.181.89.230.1935: Flags [.], seq 58050:59364, ack 1, win 501, options [nop,nop,TS val 820911171 ecr 3265612030], length 1314
02:39:39.920298 IP 99.181.89.230.1935 > 10.8.0.5.37068: Flags [.], ack 46224, win 133, options [nop,nop,TS val 3265612057 ecr 820910702], length 0
02:39:39.920339 IP 10.8.0.5.37068 > 99.181.89.230.1935: Flags [P.], seq 59364:60271, ack 1, win 501, options [nop,nop,TS val 820911184 ecr 3265612057], length 907
02:39:39.971826 IP 10.8.0.5.37068 > 99.181.89.230.1935: Flags [.], seq 60271:61585, ack 1, win 501, options [nop,nop,TS val 820911236 ecr 3265612057], length 1314
02:39:40.014491 IP 10.8.0.5.37068 > 99.181.89.230.1935: Flags [.], seq 61585:62899, ack 1, win 501, options [nop,nop,TS val 820911278 ecr 3265612057], length 1314
02:39:40.018849 IP 99.181.89.230.1935 > 10.8.0.5.37068: Flags [.], ack 47538, win 133, options [nop,nop,TS val 3265612155 ecr 820910766], length 0
02:39:40.050893 IP 10.8.0.5.37068 > 99.181.89.230.1935: Flags [.], seq 62899:64213, ack 1, win 501, options [nop,nop,TS val 820911315 ecr 3265612155], length 1314
02:39:40.061499 IP 99.181.89.230.1935 > 10.8.0.5.37068: Flags [.], ack 50166, win 133, options [nop,nop,TS val 3265612198 ecr 820910809], length 0
02:39:40.120211 IP 10.8.0.5.37068 > 99.181.89.230.1935: Flags [.], seq 64213:65527, ack 1, win 501, options [nop,nop,TS val 820911384 ecr 3265612198], length 1314
02:39:40.142430 IP 10.8.0.5.37068 > 99.181.89.230.1935: Flags [.], seq 65527:66841, ack 1, win 501, options [nop,nop,TS val 820911406 ecr 3265612198], length 1314
02:39:40.149469 IP 99.181.89.230.1935 > 10.8.0.5.37068: Flags [.], ack 52794, win 133, options [nop,nop,TS val 3265612286 ecr 820910915], length 0
02:39:40.183311 IP 10.8.0.5.37068 > 99.181.89.230.1935: Flags [.], seq 66841:68155, ack 1, win 501, options [nop,nop,TS val 820911447 ecr 3265612286], length 1314
02:39:40.249303 IP 10.8.0.5.37068 > 99.181.89.230.1935: Flags [.], seq 68155:69469, ack 1, win 501, options [nop,nop,TS val 820911513 ecr 3265612286], length 1314
02:39:40.255993 IP 99.181.89.230.1935 > 10.8.0.5.37068: Flags [.], ack 55422, win 132, options [nop,nop,TS val 3265612392 ecr 820910979], length 0
02:39:40.270745 IP 10.8.0.5.37068 > 99.181.89.230.1935: Flags [.], seq 69469:70783, ack 1, win 501, options [nop,nop,TS val 820911534 ecr 3265612392], length 1314
02:39:40.313697 IP 10.8.0.5.37068 > 99.181.89.230.1935: Flags [.], seq 70783:72097, ack 1, win 501, options [nop,nop,TS val 820911577 ecr 3265612392], length 1314
02:39:40.320087 IP 99.181.89.230.1935 > 10.8.0.5.37068: Flags [.], ack 58050, win 132, options [nop,nop,TS val 3265612456 ecr 820911084], length 0
02:39:40.378365 IP 10.8.0.5.37068 > 99.181.89.230.1935: Flags [.], seq 72097:73411, ack 1, win 501, options [nop,nop,TS val 820911642 ecr 3265612456], length 1314
02:39:40.396812 IP 99.181.89.230.1935 > 10.8.0.5.37068: Flags [.], ack 60271, win 132, options [nop,nop,TS val 3265612533 ecr 820911171], length 0
02:39:40.396851 IP 10.8.0.5.37068 > 99.181.89.230.1935: Flags [P.], seq 73411:74216, ack 1, win 501, options [nop,nop,TS val 820911661 ecr 3265612533], length 805
02:39:40.442714 IP 10.8.0.5.37068 > 99.181.89.230.1935: Flags [.], seq 74216:75530, ack 1, win 501, options [nop,nop,TS val 820911706 ecr 3265612533], length 1314
02:39:40.485745 IP 10.8.0.5.37068 > 99.181.89.230.1935: Flags [.], seq 75530:76844, ack 1, win 501, options [nop,nop,TS val 820911749 ecr 3265612533], length 1314
02:39:40.491189 IP 99.181.89.230.1935 > 10.8.0.5.37068: Flags [.], ack 62899, win 132, options [nop,nop,TS val 3265612627 ecr 820911236], length 0
02:39:40.520368 IP 10.8.0.5.37068 > 99.181.89.230.1935: Flags [.], seq 76844:78158, ack 1, win 501, options [nop,nop,TS val 820911784 ecr 3265612627], length 1314
02:39:40.571428 IP 10.8.0.5.37068 > 99.181.89.230.1935: Flags [.], seq 78158:79472, ack 1, win 501, options [nop,nop,TS val 820911835 ecr 3265612627], length 1314
02:39:40.597109 IP 99.181.89.230.1935 > 10.8.0.5.37068: Flags [.], ack 65527, win 132, options [nop,nop,TS val 3265612733 ecr 820911315], length 0
02:39:40.614195 IP 10.8.0.5.37068 > 99.181.89.230.1935: Flags [.], seq 79472:80786, ack 1, win 501, options [nop,nop,TS val 820911878 ecr 3265612733], length 1314
02:39:40.651538 IP 10.8.0.5.37068 > 99.181.89.230.1935: Flags [.], seq 80786:82100, ack 1, win 501, options [nop,nop,TS val 820911915 ecr 3265612733], length 1314
02:39:40.659873 IP 99.181.89.230.1935 > 10.8.0.5.37068: Flags [.], ack 68155, win 132, options [nop,nop,TS val 3265612796 ecr 820911406], length 0
02:39:40.720019 IP 10.8.0.5.37068 > 99.181.89.230.1935: Flags [.], seq 82100:83414, ack 1, win 501, options [nop,nop,TS val 820911984 ecr 3265612796], length 1314
02:39:40.742538 IP 10.8.0.5.37068 > 99.181.89.230.1935: Flags [.], seq 83414:84728, ack 1, win 501, options [nop,nop,TS val 820912006 ecr 3265612796], length 1314
02:39:40.747363 IP 99.181.89.230.1935 > 10.8.0.5.37068: Flags [.], ack 70783, win 132, options [nop,nop,TS val 3265612884 ecr 820911513], length 0
02:39:40.785497 IP 10.8.0.5.37068 > 99.181.89.230.1935: Flags [.], seq 84728:86042, ack 1, win 501, options [nop,nop,TS val 820912049 ecr 3265612884], length 1314
02:39:40.849697 IP 10.8.0.5.37068 > 99.181.89.230.1935: Flags [.], seq 86042:87356, ack 1, win 501, options [nop,nop,TS val 820912113 ecr 3265612884], length 1314
02:39:40.855187 IP 99.181.89.230.1935 > 10.8.0.5.37068: Flags [.], ack 73411, win 132, options [nop,nop,TS val 3265612991 ecr 820911577], length 0
02:39:40.873596 IP 99.181.89.230.1935 > 10.8.0.5.37068: Flags [.], ack 74216, win 133, options [nop,nop,TS val 3265613010 ecr 820911661], length 0
02:39:40.873632 IP 10.8.0.5.37068 > 99.181.89.230.1935: Flags [P.], seq 87356:88266, ack 1, win 501, options [nop,nop,TS val 820912137 ecr 3265613010], length 910
02:39:40.914165 IP 10.8.0.5.37068 > 99.181.89.230.1935: Flags [.], seq 88266:89580, ack 1, win 501, options [nop,nop,TS val 820912178 ecr 3265613010], length 1314
02:39:40.953929 IP 10.8.0.5.37068 > 99.181.89.230.1935: Flags [.], seq 89580:90894, ack 1, win 501, options [nop,nop,TS val 820912218 ecr 3265613010], length 1314
02:39:40.962389 IP 99.181.89.230.1935 > 10.8.0.5.37068: Flags [.], ack 76844, win 133, options [nop,nop,TS val 3265613099 ecr 820911706], length 0
02:39:40.999672 IP 10.8.0.5.37068 > 99.181.89.230.1935: Flags [.], seq 90894:92208, ack 1, win 501, options [nop,nop,TS val 820912263 ecr 3265613099], length 1314
02:39:41.042059 IP 10.8.0.5.37068 > 99.181.89.230.1935: Flags [.], seq 92208:93522, ack 1, win 501, options [nop,nop,TS val 820912306 ecr 3265613099], length 1314
02:39:41.048009 IP 99.181.89.230.1935 > 10.8.0.5.37068: Flags [.], ack 79472, win 133, options [nop,nop,TS val 3265613184 ecr 820911784], length 0
02:39:41.083307 IP 10.8.0.5.37068 > 99.181.89.230.1935: Flags [.], seq 93522:94836, ack 1, win 501, options [nop,nop,TS val 820912347 ecr 3265613184], length 1314
02:39:41.127386 IP 10.8.0.5.37068 > 99.181.89.230.1935: Flags [.], seq 94836:96150, ack 1, win 501, options [nop,nop,TS val 820912391 ecr 3265613184], length 1314
02:39:41.128158 IP 99.181.89.230.1935 > 10.8.0.5.37068: Flags [.], ack 82100, win 133, options [nop,nop,TS val 3265613265 ecr 820911878], length 0
02:39:41.186786 IP 10.8.0.5.37068 > 99.181.89.230.1935: Flags [.], seq 96150:97464, ack 1, win 501, options [nop,nop,TS val 820912450 ecr 3265613265], length 1314
02:39:41.213034 IP 10.8.0.5.37068 > 99.181.89.230.1935: Flags [.], seq 97464:98778, ack 1, win 501, options [nop,nop,TS val 820912477 ecr 3265613265], length 1314
02:39:41.219317 IP 99.181.89.230.1935 > 10.8.0.5.37068: Flags [.], ack 84728, win 133, options [nop,nop,TS val 3265613356 ecr 820911984], length 0
02:39:41.255832 IP 10.8.0.5.37068 > 99.181.89.230.1935: Flags [.], seq 98778:100092, ack 1, win 501, options [nop,nop,TS val 820912520 ecr 3265613356], length 1314
02:39:41.320230 IP 10.8.0.5.37068 > 99.181.89.230.1935: Flags [.], seq 100092:101406, ack 1, win 501, options [nop,nop,TS val 820912584 ecr 3265613356], length 1314
02:39:41.326348 IP 99.181.89.230.1935 > 10.8.0.5.37068: Flags [.], ack 87356, win 132, options [nop,nop,TS val 3265613463 ecr 820912049], length 0
02:39:41.341854 IP 10.8.0.5.37068 > 99.181.89.230.1935: Flags [.], seq 101406:102720, ack 1, win 501, options [nop,nop,TS val 820912606 ecr 3265613463], length 1314
02:39:41.350131 IP 99.181.89.230.1935 > 10.8.0.5.37068: Flags [.], ack 88266, win 133, options [nop,nop,TS val 3265613487 ecr 820912137], length 0
02:39:41.350212 IP 10.8.0.5.37068 > 99.181.89.230.1935: Flags [P.], seq 102720:102963, ack 1, win 501, options [nop,nop,TS val 820912614 ecr 3265613487], length 243
02:39:41.420424 IP 10.8.0.5.37068 > 99.181.89.230.1935: Flags [.], seq 102963:104277, ack 1, win 501, options [nop,nop,TS val 820912684 ecr 3265613487], length 1314
02:39:41.430546 IP 99.181.89.230.1935 > 10.8.0.5.37068: Flags [.], ack 90894, win 133, options [nop,nop,TS val 3265613567 ecr 820912178], length 0
02:39:41.449507 IP 10.8.0.5.37068 > 99.181.89.230.1935: Flags [.], seq 104277:105591, ack 1, win 501, options [nop,nop,TS val 820912713 ecr 3265613567], length 1314
02:39:41.487561 IP 10.8.0.5.37068 > 99.181.89.230.1935: Flags [.], seq 105591:106905, ack 1, win 501, options [nop,nop,TS val 820912751 ecr 3265613567], length 1314
02:39:41.518719 IP 99.181.89.230.1935 > 10.8.0.5.37068: Flags [.], ack 93522, win 133, options [nop,nop,TS val 3265613655 ecr 820912263], length 0
02:39:41.552493 IP 10.8.0.5.37068 > 99.181.89.230.1935: Flags [.], seq 106905:108219, ack 1, win 501, options [nop,nop,TS val 820912816 ecr 3265613655], length 1314
02:39:41.577941 IP 10.8.0.5.37068 > 99.181.89.230.1935: Flags [.], seq 108219:109533, ack 1, win 501, options [nop,nop,TS val 820912842 ecr 3265613655], length 1314
02:39:41.603900 IP 99.181.89.230.1935 > 10.8.0.5.37068: Flags [.], ack 96150, win 133, options [nop,nop,TS val 3265613740 ecr 820912347], length 0
02:39:41.620283 IP 10.8.0.5.37068 > 99.181.89.230.1935: Flags [.], seq 109533:110847, ack 1, win 501, options [nop,nop,TS val 820912884 ecr 3265613740], length 1314
02:39:41.685355 IP 10.8.0.5.37068 > 99.181.89.230.1935: Flags [.], seq 110847:112161, ack 1, win 501, options [nop,nop,TS val 820912949 ecr 3265613740], length 1314
02:39:41.689551 IP 99.181.89.230.1935 > 10.8.0.5.37068: Flags [.], ack 98778, win 133, options [nop,nop,TS val 3265613826 ecr 820912450], length 0
02:39:41.719948 IP 10.8.0.5.37068 > 99.181.89.230.1935: Flags [.], seq 112161:113475, ack 1, win 501, options [nop,nop,TS val 820912984 ecr 3265613826], length 1314
02:39:41.750136 IP 10.8.0.5.37068 > 99.181.89.230.1935: Flags [.], seq 113475:114789, ack 1, win 501, options [nop,nop,TS val 820913014 ecr 3265613826], length 1314
02:39:41.796823 IP 99.181.89.230.1935 > 10.8.0.5.37068: Flags [.], ack 101406, win 132, options [nop,nop,TS val 3265613933 ecr 820912520], length 0
02:39:41.814389 IP 10.8.0.5.37068 > 99.181.89.230.1935: Flags [.], seq 114789:116103, ack 1, win 501, options [nop,nop,TS val 820913078 ecr 3265613933], length 1314
02:39:41.826576 IP 99.181.89.230.1935 > 10.8.0.5.37068: Flags [.], ack 102963, win 133, options [nop,nop,TS val 3265613963 ecr 820912606], length 0
02:39:41.826619 IP 10.8.0.5.37068 > 99.181.89.230.1935: Flags [P.], seq 116103:117011, ack 1, win 501, options [nop,nop,TS val 820913090 ecr 3265613963], length 908
02:39:41.878561 IP 10.8.0.5.37068 > 99.181.89.230.1935: Flags [.], seq 117011:118325, ack 1, win 501, options [nop,nop,TS val 820913142 ecr 3265613963], length 1314
02:39:41.917265 IP 10.8.0.5.37068 > 99.181.89.230.1935: Flags [.], seq 118325:119639, ack 1, win 501, options [nop,nop,TS val 820913181 ecr 3265613963], length 1314
02:39:41.926136 IP 99.181.89.230.1935 > 10.8.0.5.37068: Flags [.], ack 105591, win 132, options [nop,nop,TS val 3265614062 ecr 820912684], length 0
02:39:41.953401 IP 10.8.0.5.37068 > 99.181.89.230.1935: Flags [.], seq 119639:120953, ack 1, win 501, options [nop,nop,TS val 820913217 ecr 3265614062], length 1314
02:39:42.018718 IP 10.8.0.5.37068 > 99.181.89.230.1935: Flags [.], seq 120953:122267, ack 1, win 501, options [nop,nop,TS val 820913282 ecr 3265614062], length 1314
02:39:42.028999 IP 99.181.89.230.1935 > 10.8.0.5.37068: Flags [.], ack 108219, win 132, options [nop,nop,TS val 3265614165 ecr 820912751], length 0
02:39:42.049454 IP 10.8.0.5.37068 > 99.181.89.230.1935: Flags [.], seq 122267:123581, ack 1, win 501, options [nop,nop,TS val 820913313 ecr 3265614165], length 1314
02:39:42.085069 IP 10.8.0.5.37068 > 99.181.89.230.1935: Flags [.], seq 123581:124895, ack 1, win 501, options [nop,nop,TS val 820913349 ecr 3265614165], length 1314
02:39:42.096969 IP 99.181.89.230.1935 > 10.8.0.5.37068: Flags [.], ack 110847, win 132, options [nop,nop,TS val 3265614233 ecr 820912842], length 0
02:39:42.149780 IP 10.8.0.5.37068 > 99.181.89.230.1935: Flags [.], seq 124895:126209, ack 1, win 501, options [nop,nop,TS val 820913413 ecr 3265614233], length 1314
02:39:42.177014 IP 10.8.0.5.37068 > 99.181.89.230.1935: Flags [.], seq 126209:127523, ack 1, win 501, options [nop,nop,TS val 820913441 ecr 3265614233], length 1314
02:39:42.196603 IP 99.181.89.230.1935 > 10.8.0.5.37068: Flags [.], ack 113475, win 132, options [nop,nop,TS val 3265614333 ecr 820912949], length 0
02:39:42.219964 IP 10.8.0.5.37068 > 99.181.89.230.1935: Flags [.], seq 127523:128837, ack 1, win 501, options [nop,nop,TS val 820913484 ecr 3265614333], length 1314
02:39:42.284118 IP 10.8.0.5.37068 > 99.181.89.230.1935: Flags [.], seq 128837:130151, ack 1, win 501, options [nop,nop,TS val 820913548 ecr 3265614333], length 1314
02:39:42.291136 IP 99.181.89.230.1935 > 10.8.0.5.37068: Flags [.], ack 116103, win 132, options [nop,nop,TS val 3265614428 ecr 820913014], length 0
02:39:42.303132 IP 99.181.89.230.1935 > 10.8.0.5.37068: Flags [.], ack 117011, win 133, options [nop,nop,TS val 3265614439 ecr 820913090], length 0
02:39:42.303152 IP 10.8.0.5.37068 > 99.181.89.230.1935: Flags [P.], seq 130151:130963, ack 1, win 501, options [nop,nop,TS val 820913567 ecr 3265614439], length 812
02:39:42.348512 IP 10.8.0.5.37068 > 99.181.89.230.1935: Flags [.], seq 130963:132277, ack 1, win 501, options [nop,nop,TS val 820913612 ecr 3265614439], length 1314
02:39:42.386758 IP 10.8.0.5.37068 > 99.181.89.230.1935: Flags [.], seq 132277:133591, ack 1, win 501, options [nop,nop,TS val 820913650 ecr 3265614439], length 1314
02:39:42.393849 IP 99.181.89.230.1935 > 10.8.0.5.37068: Flags [.], ack 119639, win 133, options [nop,nop,TS val 3265614530 ecr 820913142], length 0
02:39:42.420130 IP 10.8.0.5.37068 > 99.181.89.230.1935: Flags [.], seq 133591:134905, ack 1, win 501, options [nop,nop,TS val 820913684 ecr 3265614530], length 1314
02:39:42.486752 IP 10.8.0.5.37068 > 99.181.89.230.1935: Flags [.], seq 134905:136219, ack 1, win 501, options [nop,nop,TS val 820913750 ecr 3265614530], length 1314
02:39:42.495044 IP 99.181.89.230.1935 > 10.8.0.5.37068: Flags [.], ack 120953, win 133, options [nop,nop,TS val 3265614631 ecr 820913217], length 0
02:39:42.520163 IP 10.8.0.5.37068 > 99.181.89.230.1935: Flags [.], seq 136219:137533, ack 1, win 501, options [nop,nop,TS val 820913784 ecr 3265614631], length 1314
02:39:42.526220 IP 99.181.89.230.1935 > 10.8.0.5.37068: Flags [.], ack 123581, win 133, options [nop,nop,TS val 3265614663 ecr 820913282], length 0
02:39:42.551669 IP 10.8.0.5.37068 > 99.181.89.230.1935: Flags [.], seq 137533:138847, ack 1, win 501, options [nop,nop,TS val 820913815 ecr 3265614663], length 1314
02:39:42.618096 IP 10.8.0.5.37068 > 99.181.89.230.1935: Flags [.], seq 138847:140161, ack 1, win 501, options [nop,nop,TS val 820913882 ecr 3265614663], length 1314
02:39:42.626369 IP 99.181.89.230.1935 > 10.8.0.5.37068: Flags [.], ack 126209, win 132, options [nop,nop,TS val 3265614763 ecr 820913349], length 0
02:39:42.648446 IP 10.8.0.5.37068 > 99.181.89.230.1935: Flags [.], seq 140161:141475, ack 1, win 501, options [nop,nop,TS val 820913912 ecr 3265614763], length 1314
02:39:42.684535 IP 10.8.0.5.37068 > 99.181.89.230.1935: Flags [.], seq 141475:142789, ack 1, win 501, options [nop,nop,TS val 820913948 ecr 3265614763], length 1314
02:39:42.696565 IP 99.181.89.230.1935 > 10.8.0.5.37068: Flags [.], ack 128837, win 132, options [nop,nop,TS val 3265614833 ecr 820913441], length 0
02:39:42.753290 IP 10.8.0.5.37068 > 99.181.89.230.1935: Flags [.], seq 142789:144103, ack 1, win 501, options [nop,nop,TS val 820914017 ecr 3265614833], length 1314
02:39:42.779759 IP 99.181.89.230.1935 > 10.8.0.5.37068: Flags [.], ack 130963, win 132, options [nop,nop,TS val 3265614916 ecr 820913548], length 0
02:39:42.779805 IP 10.8.0.5.37068 > 99.181.89.230.1935: Flags [P.], seq 144103:144998, ack 1, win 501, options [nop,nop,TS val 820914044 ecr 3265614916], length 895
02:39:42.818679 IP 10.8.0.5.37068 > 99.181.89.230.1935: Flags [.], seq 144998:146312, ack 1, win 501, options [nop,nop,TS val 820914082 ecr 3265614916], length 1314
02:39:42.853126 IP 10.8.0.5.37068 > 99.181.89.230.1935: Flags [.], seq 146312:147626, ack 1, win 501, options [nop,nop,TS val 820914117 ecr 3265614916], length 1314
02:39:42.863346 IP 99.181.89.230.1935 > 10.8.0.5.37068: Flags [.], ack 133591, win 132, options [nop,nop,TS val 3265615000 ecr 820913612], length 0
02:39:42.905528 IP 10.8.0.5.37068 > 99.181.89.230.1935: Flags [.], seq 147626:148940, ack 1, win 501, options [nop,nop,TS val 820914169 ecr 3265615000], length 1314
02:39:42.948506 IP 10.8.0.5.37068 > 99.181.89.230.1935: Flags [.], seq 148940:150254, ack 1, win 501, options [nop,nop,TS val 820914212 ecr 3265615000], length 1314
02:39:42.963232 IP 99.181.89.230.1935 > 10.8.0.5.37068: Flags [.], ack 136219, win 132, options [nop,nop,TS val 3265615100 ecr 820913684], length 0
02:39:42.986861 IP 10.8.0.5.37068 > 99.181.89.230.1935: Flags [.], seq 150254:151568, ack 1, win 501, options [nop,nop,TS val 820914251 ecr 3265615100], length 1314
02:39:43.028224 IP 99.181.89.230.1935 > 10.8.0.5.37068: Flags [.], ack 138847, win 132, options [nop,nop,TS val 3265615164 ecr 820913784], length 0
02:39:43.034211 IP 10.8.0.5.37068 > 99.181.89.230.1935: Flags [.], seq 151568:152882, ack 1, win 501, options [nop,nop,TS val 820914298 ecr 3265615164], length 1314
02:39:43.085674 IP 10.8.0.5.37068 > 99.181.89.230.1935: Flags [.], seq 152882:154196, ack 1, win 501, options [nop,nop,TS val 820914349 ecr 3265615164], length 1314
02:39:43.119811 IP 10.8.0.5.37068 > 99.181.89.230.1935: Flags [.], seq 154196:155510, ack 1, win 501, options [nop,nop,TS val 820914383 ecr 3265615164], length 1314
02:39:43.125195 IP 99.181.89.230.1935 > 10.8.0.5.37068: Flags [.], ack 141475, win 132, options [nop,nop,TS val 3265615261 ecr 820913882], length 0
02:39:43.162649 IP 10.8.0.5.37068 > 99.181.89.230.1935: Flags [.], seq 155510:156824, ack 1, win 501, options [nop,nop,TS val 820914426 ecr 3265615261], length 1314
02:39:43.218785 IP 10.8.0.5.37068 > 99.181.89.230.1935: Flags [.], seq 156824:158138, ack 1, win 501, options [nop,nop,TS val 820914482 ecr 3265615261], length 1314
02:39:43.229965 IP 99.181.89.230.1935 > 10.8.0.5.37068: Flags [.], ack 144103, win 132, options [nop,nop,TS val 3265615366 ecr 820913948], length 0
02:39:43.248386 IP 10.8.0.5.37068 > 99.181.89.230.1935: Flags [.], seq 158138:159452, ack 1, win 501, options [nop,nop,TS val 820914512 ecr 3265615366], length 1314
02:39:43.256623 IP 99.181.89.230.1935 > 10.8.0.5.37068: Flags [.], ack 144998, win 133, options [nop,nop,TS val 3265615393 ecr 820914044], length 0
02:39:43.256658 IP 10.8.0.5.37068 > 99.181.89.230.1935: Flags [P.], seq 159452:159806, ack 1, win 501, options [nop,nop,TS val 820914520 ecr 3265615393], length 354
02:39:43.319439 IP 10.8.0.5.37068 > 99.181.89.230.1935: Flags [.], seq 159806:161120, ack 1, win 501, options [nop,nop,TS val 820914583 ecr 3265615393], length 1314
02:39:43.329959 IP 99.181.89.230.1935 > 10.8.0.5.37068: Flags [.], ack 147626, win 133, options [nop,nop,TS val 3265615466 ecr 820914082], length 0
02:39:43.353081 IP 10.8.0.5.37068 > 99.181.89.230.1935: Flags [.], seq 161120:162434, ack 1, win 501, options [nop,nop,TS val 820914617 ecr 3265615466], length 1314
02:39:43.386098 IP 10.8.0.5.37068 > 99.181.89.230.1935: Flags [.], seq 162434:163748, ack 1, win 501, options [nop,nop,TS val 820914650 ecr 3265615466], length 1314
02:39:43.425225 IP 99.181.89.230.1935 > 10.8.0.5.37068: Flags [.], ack 150254, win 133, options [nop,nop,TS val 3265615562 ecr 820914169], length 0
02:39:43.452886 IP 10.8.0.5.37068 > 99.181.89.230.1935: Flags [.], seq 163748:165062, ack 1, win 501, options [nop,nop,TS val 820914717 ecr 3265615562], length 1314
02:39:43.484086 IP 10.8.0.5.37068 > 99.181.89.230.1935: Flags [.], seq 165062:166376, ack 1, win 501, options [nop,nop,TS val 820914748 ecr 3265615562], length 1314
02:39:43.510788 IP 99.181.89.230.1935 > 10.8.0.5.37068: Flags [.], ack 152882, win 133, options [nop,nop,TS val 3265615647 ecr 820914251], length 0
02:39:43.517564 IP 10.8.0.5.37068 > 99.181.89.230.1935: Flags [.], seq 166376:167690, ack 1, win 501, options [nop,nop,TS val 820914781 ecr 3265615647], length 1314
02:39:43.587057 IP 10.8.0.5.37068 > 99.181.89.230.1935: Flags [.], seq 167690:169004, ack 1, win 501, options [nop,nop,TS val 820914851 ecr 3265615647], length 1314
02:39:43.596658 IP 99.181.89.230.1935 > 10.8.0.5.37068: Flags [.], ack 155510, win 133, options [nop,nop,TS val 3265615733 ecr 820914349], length 0
02:39:43.617105 IP 10.8.0.5.37068 > 99.181.89.230.1935: Flags [.], seq 169004:170318, ack 1, win 501, options [nop,nop,TS val 820914881 ecr 3265615733], length 1314
02:39:43.651667 IP 10.8.0.5.37068 > 99.181.89.230.1935: Flags [.], seq 170318:171632, ack 1, win 501, options [nop,nop,TS val 820914915 ecr 3265615733], length 1314
02:39:43.695422 IP 99.181.89.230.1935 > 10.8.0.5.37068: Flags [.], ack 158138, win 133, options [nop,nop,TS val 3265615832 ecr 820914426], length 0
02:39:43.719059 IP 10.8.0.5.37068 > 99.181.89.230.1935: Flags [.], seq 171632:172946, ack 1, win 501, options [nop,nop,TS val 820914983 ecr 3265615832], length 1314
02:39:43.732983 IP 99.181.89.230.1935 > 10.8.0.5.37068: Flags [.], ack 159806, win 133, options [nop,nop,TS val 3265615869 ecr 820914512], length 0
02:39:43.733027 IP 10.8.0.5.37068 > 99.181.89.230.1935: Flags [P.], seq 172946:173751, ack 1, win 501, options [nop,nop,TS val 820914997 ecr 3265615869], length 805
02:39:43.783515 IP 10.8.0.5.37068 > 99.181.89.230.1935: Flags [.], seq 173751:175065, ack 1, win 501, options [nop,nop,TS val 820915047 ecr 3265615869], length 1314
02:39:43.820392 IP 10.8.0.5.37068 > 99.181.89.230.1935: Flags [.], seq 175065:176379, ack 1, win 501, options [nop,nop,TS val 820915084 ecr 3265615869], length 1314
02:39:43.829480 IP 99.181.89.230.1935 > 10.8.0.5.37068: Flags [.], ack 162434, win 133, options [nop,nop,TS val 3265615966 ecr 820914583], length 0
02:39:43.849550 IP 10.8.0.5.37068 > 99.181.89.230.1935: Flags [.], seq 176379:177693, ack 1, win 501, options [nop,nop,TS val 820915113 ecr 3265615966], length 1314
02:39:43.919996 IP 10.8.0.5.37068 > 99.181.89.230.1935: Flags [.], seq 177693:179007, ack 1, win 501, options [nop,nop,TS val 820915184 ecr 3265615966], length 1314
02:39:43.929592 IP 99.181.89.230.1935 > 10.8.0.5.37068: Flags [.], ack 165062, win 132, options [nop,nop,TS val 3265616066 ecr 820914650], length 0
02:39:43.953910 IP 10.8.0.5.37068 > 99.181.89.230.1935: Flags [.], seq 179007:180321, ack 1, win 501, options [nop,nop,TS val 820915218 ecr 3265616066], length 1314
02:39:43.985272 IP 10.8.0.5.37068 > 99.181.89.230.1935: Flags [.], seq 180321:181635, ack 1, win 501, options [nop,nop,TS val 820915249 ecr 3265616066], length 1314
02:39:43.994389 IP 99.181.89.230.1935 > 10.8.0.5.37068: Flags [.], ack 167690, win 132, options [nop,nop,TS val 3265616131 ecr 820914748], length 0
02:39:44.051803 IP 10.8.0.5.37068 > 99.181.89.230.1935: Flags [.], seq 181635:182949, ack 1, win 501, options [nop,nop,TS val 820915315 ecr 3265616131], length 1314
02:39:44.086992 IP 10.8.0.5.37068 > 99.181.89.230.1935: Flags [.], seq 182949:184263, ack 1, win 501, options [nop,nop,TS val 820915351 ecr 3265616131], length 1314
02:39:44.093403 IP 99.181.89.230.1935 > 10.8.0.5.37068: Flags [.], ack 170318, win 132, options [nop,nop,TS val 3265616230 ecr 820914851], length 0
02:39:44.119138 IP 10.8.0.5.37068 > 99.181.89.230.1935: Flags [.], seq 184263:185577, ack 1, win 501, options [nop,nop,TS val 820915383 ecr 3265616230], length 1314
02:39:44.185285 IP 10.8.0.5.37068 > 99.181.89.230.1935: Flags [.], seq 185577:186891, ack 1, win 501, options [nop,nop,TS val 820915449 ecr 3265616230], length 1314
02:39:44.194887 IP 99.181.89.230.1935 > 10.8.0.5.37068: Flags [.], ack 171632, win 133, options [nop,nop,TS val 3265616331 ecr 820914915], length 0
02:39:44.209458 IP 99.181.89.230.1935 > 10.8.0.5.37068: Flags [.], ack 173751, win 133, options [nop,nop,TS val 3265616346 ecr 820914983], length 0
02:39:44.209487 IP 10.8.0.5.37068 > 99.181.89.230.1935: Flags [P.], seq 186891:187703, ack 1, win 501, options [nop,nop,TS val 820915473 ecr 3265616346], length 812
02:39:44.253033 IP 10.8.0.5.37068 > 99.181.89.230.1935: Flags [.], seq 187703:189017, ack 1, win 501, options [nop,nop,TS val 820915517 ecr 3265616346], length 1314
02:39:44.284121 IP 10.8.0.5.37068 > 99.181.89.230.1935: Flags [.], seq 189017:190331, ack 1, win 501, options [nop,nop,TS val 820915548 ecr 3265616346], length 1314
02:39:44.297393 IP 99.181.89.230.1935 > 10.8.0.5.37068: Flags [.], ack 176379, win 133, options [nop,nop,TS val 3265616434 ecr 820915047], length 0
02:39:44.319882 IP 10.8.0.5.37068 > 99.181.89.230.1935: Flags [.], seq 190331:191645, ack 1, win 501, options [nop,nop,TS val 820915584 ecr 3265616434], length 1314
02:39:44.386878 IP 10.8.0.5.37068 > 99.181.89.230.1935: Flags [.], seq 191645:192959, ack 1, win 501, options [nop,nop,TS val 820915651 ecr 3265616434], length 1314
02:39:44.394854 IP 99.181.89.230.1935 > 10.8.0.5.37068: Flags [.], ack 177693, win 133, options [nop,nop,TS val 3265616531 ecr 820915113], length 0
02:39:44.418698 IP 10.8.0.5.37068 > 99.181.89.230.1935: Flags [.], seq 192959:194273, ack 1, win 501, options [nop,nop,TS val 820915682 ecr 3265616531], length 1314
02:39:44.430623 IP 99.181.89.230.1935 > 10.8.0.5.37068: Flags [.], ack 180321, win 133, options [nop,nop,TS val 3265616567 ecr 820915184], length 0
02:39:44.452593 IP 10.8.0.5.37068 > 99.181.89.230.1935: Flags [.], seq 194273:195587, ack 1, win 501, options [nop,nop,TS val 820915716 ecr 3265616567], length 1314
02:39:44.519646 IP 10.8.0.5.37068 > 99.181.89.230.1935: Flags [.], seq 195587:196901, ack 1, win 501, options [nop,nop,TS val 820915783 ecr 3265616567], length 1314
02:39:44.528389 IP 99.181.89.230.1935 > 10.8.0.5.37068: Flags [.], ack 182949, win 132, options [nop,nop,TS val 3265616665 ecr 820915249], length 0
02:39:44.553113 IP 10.8.0.5.37068 > 99.181.89.230.1935: Flags [.], seq 196901:198215, ack 1, win 501, options [nop,nop,TS val 820915817 ecr 3265616665], length 1314
02:39:44.586266 IP 10.8.0.5.37068 > 99.181.89.230.1935: Flags [.], seq 198215:199529, ack 1, win 501, options [nop,nop,TS val 820915850 ecr 3265616665], length 1314
02:39:44.595619 IP 99.181.89.230.1935 > 10.8.0.5.37068: Flags [.], ack 185577, win 132, options [nop,nop,TS val 3265616732 ecr 820915351], length 0
02:39:44.649372 IP 10.8.0.5.37068 > 99.181.89.230.1935: Flags [.], seq 199529:200843, ack 1, win 501, options [nop,nop,TS val 820915913 ecr 3265616732], length 1314
02:39:44.683149 IP 10.8.0.5.37068 > 99.181.89.230.1935: Flags [.], seq 200843:202157, ack 1, win 501, options [nop,nop,TS val 820915947 ecr 3265616732], length 1314
02:39:44.685918 IP 99.181.89.230.1935 > 10.8.0.5.37068: Flags [.], ack 187703, win 132, options [nop,nop,TS val 3265616822 ecr 820915449], length 0
02:39:44.685932 IP 10.8.0.5.37068 > 99.181.89.230.1935: Flags [P.], seq 202157:202594, ack 1, win 501, options [nop,nop,TS val 820915950 ecr 3265616822], length 437
02:39:44.753539 IP 10.8.0.5.37068 > 99.181.89.230.1935: Flags [.], seq 202594:203908, ack 1, win 501, options [nop,nop,TS val 820916017 ecr 3265616822], length 1314
02:39:44.760567 IP 99.181.89.230.1935 > 10.8.0.5.37068: Flags [.], ack 190331, win 132, options [nop,nop,TS val 3265616897 ecr 820915517], length 0
02:39:44.785051 IP 10.8.0.5.37068 > 99.181.89.230.1935: Flags [.], seq 203908:205222, ack 1, win 501, options [nop,nop,TS val 820916049 ecr 3265616897], length 1314
02:39:44.818693 IP 10.8.0.5.37068 > 99.181.89.230.1935: Flags [.], seq 205222:206536, ack 1, win 501, options [nop,nop,TS val 820916082 ecr 3265616897], length 1314
02:39:44.863691 IP 99.181.89.230.1935 > 10.8.0.5.37068: Flags [.], ack 192959, win 132, options [nop,nop,TS val 3265617000 ecr 820915584], length 0
