18:25:30.458918 IP 10.8.3.7.45438 > 99.181.89.139.1935: Flags [.], seq 1851433193:1851434507, ack 4012147879, win 501, options [nop,nop,TS val 1510722058 ecr 3720464332], length 1314
18:25:30.478031 IP 99.181.89.139.1935 > 10.8.3.7.45438: Flags [.], ack 4294959562, win 126, options [nop,nop,TS val 3720464433 ecr 1510721695], length 0
18:25:30.494814 IP 10.8.3.7.45438 > 99.181.89.139.1935: Flags [.], seq 1314:2628, ack 1, win 501, options [nop,nop,TS val 1510722094 ecr 3720464433], length 1314
18:25:30.538709 IP 10.8.3.7.45438 > 99.181.89.139.1935: Flags [.], seq 2628:3942, ack 1, win 501, options [nop,nop,TS val 1510722138 ecr 3720464433], length 1314
18:25:30.542208 IP 99.181.89.139.1935 > 10.8.3.7.45438: Flags [.], ack 4294962190, win 126, options [nop,nop,TS val 3720464497 ecr 1510721795], length 0
18:25:30.592875 IP 10.8.3.7.45438 > 99.181.89.139.1935: Flags [.], seq 3942:5256, ack 1, win 501, options [nop,nop,TS val 1510722192 ecr 3720464497], length 1314
18:25:30.600352 IP 99.181.89.139.1935 > 10.8.3.7.45438: Flags [.], ack 4294963354, win 126, options [nop,nop,TS val 3720464555 ecr 1510721884], length 0
18:25:30.600373 IP 10.8.3.7.45438 > 99.181.89.139.1935: Flags [P.], seq 5256:5867, ack 1, win 501, options [nop,nop,TS val 1510722200 ecr 3720464555], length 611
18:25:30.658633 IP 10.8.3.7.45438 > 99.181.89.139.1935: Flags [.], seq 5867:7181, ack 1, win 501, options [nop,nop,TS val 1510722258 ecr 3720464555], length 1314
18:25:30.677916 IP 99.181.89.139.1935 > 10.8.3.7.45438: Flags [.], ack 4294965982, win 126, options [nop,nop,TS val 3720464633 ecr 1510721924], length 0
18:25:30.693524 IP 10.8.3.7.45438 > 99.181.89.139.1935: Flags [.], seq 7181:8495, ack 1, win 501, options [nop,nop,TS val 1510722293 ecr 3720464633], length 1314
18:25:30.728760 IP 10.8.3.7.45438 > 99.181.89.139.1935: Flags [.], seq 8495:9809, ack 1, win 501, options [nop,nop,TS val 1510722328 ecr 3720464633], length 1314
18:25:30.774329 IP 99.181.89.139.1935 > 10.8.3.7.45438: Flags [.], ack 1314, win 126, options [nop,nop,TS val 3720464729 ecr 1510722010], length 0
18:25:30.791723 IP 10.8.3.7.45438 > 99.181.89.139.1935: Flags [.], seq 9809:11123, ack 1, win 501, options [nop,nop,TS val 1510722391 ecr 3720464729], length 1314
18:25:30.825880 IP 10.8.3.7.45438 > 99.181.89.139.1935: Flags [.], seq 11123:12437, ack 1, win 501, options [nop,nop,TS val 1510722425 ecr 3720464729], length 1314
18:25:30.854207 IP 99.181.89.139.1935 > 10.8.3.7.45438: Flags [.], ack 3942, win 126, options [nop,nop,TS val 3720464809 ecr 1510722094], length 0
18:25:30.858363 IP 10.8.3.7.45438 > 99.181.89.139.1935: Flags [.], seq 12437:13751, ack 1, win 501, options [nop,nop,TS val 1510722458 ecr 3720464809], length 1314
18:25:30.915848 IP 99.181.89.139.1935 > 10.8.3.7.45438: Flags [.], ack 5867, win 126, options [nop,nop,TS val 3720464870 ecr 1510722192], length 0
18:25:30.915861 IP 10.8.3.7.45438 > 99.181.89.139.1935: Flags [P.], seq 13751:14903, ack 1, win 501, options [nop,nop,TS val 1510722515 ecr 3720464870], length 1152
18:25:30.958696 IP 10.8.3.7.45438 > 99.181.89.139.1935: Flags [.], seq 14903:16217, ack 1, win 501, options [nop,nop,TS val 1510722558 ecr 3720464870], length 1314
18:25:30.993489 IP 10.8.3.7.45438 > 99.181.89.139.1935: Flags [.], seq 16217:17531, ack 1, win 501, options [nop,nop,TS val 1510722593 ecr 3720464870], length 1314
18:25:31.008759 IP 99.181.89.139.1935 > 10.8.3.7.45438: Flags [.], ack 8495, win 126, options [nop,nop,TS val 3720464963 ecr 1510722258], length 0
18:25:31.027939 IP 10.8.3.7.45438 > 99.181.89.139.1935: Flags [.], seq 17531:18845, ack 1, win 501, options [nop,nop,TS val 1510722627 ecr 3720464963], length 1314
18:25:31.091847 IP 10.8.3.7.45438 > 99.181.89.139.1935: Flags [.], seq 18845:20159, ack 1, win 501, options [nop,nop,TS val 1510722691 ecr 3720464963], length 1314
18:25:31.107218 IP 99.181.89.139.1935 > 10.8.3.7.45438: Flags [.], ack 11123, win 126, options [nop,nop,TS val 3720465062 ecr 1510722328], length 0
18:25:31.128973 IP 10.8.3.7.45438 > 99.181.89.139.1935: Flags [.], seq 20159:21473, ack 1, win 501, options [nop,nop,TS val 1510722728 ecr 3720465062], length 1314
18:25:31.162722 IP 10.8.3.7.45438 > 99.181.89.139.1935: Flags [.], seq 21473:22787, ack 1, win 501, options [nop,nop,TS val 1510722762 ecr 3720465062], length 1314
18:25:31.173621 IP 99.181.89.139.1935 > 10.8.3.7.45438: Flags [.], ack 13751, win 126, options [nop,nop,TS val 3720465128 ecr 1510722425], length 0
18:25:31.229077 IP 10.8.3.7.45438 > 99.181.89.139.1935: Flags [.], seq 22787:24101, ack 1, win 501, options [nop,nop,TS val 1510722828 ecr 3720465128], length 1314
18:25:31.231203 IP 99.181.89.139.1935 > 10.8.3.7.45438: Flags [.], ack 14903, win 126, options [nop,nop,TS val 3720465186 ecr 1510722515], length 0
18:25:31.231242 IP 10.8.3.7.45438 > 99.181.89.139.1935: Flags [P.], seq 24101:24807, ack 1, win 501, options [nop,nop,TS val 1510722831 ecr 3720465186], length 706
18:25:31.293172 IP 10.8.3.7.45438 > 99.181.89.139.1935: Flags [.], seq 24807:26121, ack 1, win 501, options [nop,nop,TS val 1510722892 ecr 3720465186], length 1314
18:25:31.309117 IP 99.181.89.139.1935 > 10.8.3.7.45438: Flags [.], ack 17531, win 126, options [nop,nop,TS val 3720465264 ecr 1510722558], length 0
18:25:31.325240 IP 10.8.3.7.45438 > 99.181.89.139.1935: Flags [.], seq 26121:27435, ack 1, win 501, options [nop,nop,TS val 1510722925 ecr 3720465264], length 1314
18:25:31.359867 IP 10.8.3.7.45438 > 99.181.89.139.1935: Flags [.], seq 27435:28749, ack 1, win 501, options [nop,nop,TS val 1510722959 ecr 3720465264], length 1314
18:25:31.407218 IP 99.181.89.139.1935 > 10.8.3.7.45438: Flags [.], ack 20159, win 126, options [nop,nop,TS val 3720465362 ecr 1510722627], length 0
18:25:31.429207 IP 10.8.3.7.45438 > 99.181.89.139.1935: Flags [.], seq 28749:30063, ack 1, win 501, options [nop,nop,TS val 1510723029 ecr 3720465362], length 1314
18:25:31.462786 IP 10.8.3.7.45438 > 99.181.89.139.1935: Flags [.], seq 30063:31377, ack 1, win 501, options [nop,nop,TS val 1510723062 ecr 3720465362], length 1314
18:25:31.478227 IP 99.181.89.139.1935 > 10.8.3.7.45438: Flags [.], ack 22787, win 126, options [nop,nop,TS val 3720465433 ecr 1510722728], length 0
18:25:31.494410 IP 10.8.3.7.45438 > 99.181.89.139.1935: Flags [.], seq 31377:32691, ack 1, win 501, options [nop,nop,TS val 1510723094 ecr 3720465433], length 1314
18:25:31.546597 IP 99.181.89.139.1935 > 10.8.3.7.45438: Flags [.], ack 24807, win 126, options [nop,nop,TS val 3720465501 ecr 1510722828], length 0
18:25:31.546614 IP 10.8.3.7.45438 > 99.181.89.139.1935: Flags [P.], seq 32691:33855, ack 1, win 501, options [nop,nop,TS val 1510723146 ecr 3720465501], length 1164
18:25:31.593167 IP 10.8.3.7.45438 > 99.181.89.139.1935: Flags [.], seq 33855:35169, ack 1, win 501, options [nop,nop,TS val 1510723192 ecr 3720465501], length 1314
18:25:31.625424 IP 10.8.3.7.45438 > 99.181.89.139.1935: Flags [.], seq 35169:36483, ack 1, win 501, options [nop,nop,TS val 1510723225 ecr 3720465501], length 1314
18:25:31.640641 IP 99.181.89.139.1935 > 10.8.3.7.45438: Flags [.], ack 27435, win 126, options [nop,nop,TS val 3720465595 ecr 1510722892], length 0
18:25:31.668250 IP 10.8.3.7.45438 > 99.181.89.139.1935: Flags [.], seq 36483:37797, ack 1, win 501, options [nop,nop,TS val 1510723268 ecr 3720465595], length 1314
18:25:31.729234 IP 10.8.3.7.45438 > 99.181.89.139.1935: Flags [.], seq 37797:39111, ack 1, win 501, options [nop,nop,TS val 1510723329 ecr 3720465595], length 1314
18:25:31.744640 IP 99.181.89.139.1935 > 10.8.3.7.45438: Flags [.], ack 30063, win 126, options [nop,nop,TS val 3720465699 ecr 1510722959], length 0
18:25:31.763193 IP 10.8.3.7.45438 > 99.181.89.139.1935: Flags [.], seq 39111:40425, ack 1, win 501, options [nop,nop,TS val 1510723363 ecr 3720465699], length 1314
18:25:31.796966 IP 10.8.3.7.45438 > 99.181.89.139.1935: Flags [.], seq 40425:41739, ack 1, win 501, options [nop,nop,TS val 1510723396 ecr 3720465699], length 1314
18:25:31.809778 IP 99.181.89.139.1935 > 10.8.3.7.45438: Flags [.], ack 32691, win 126, options [nop,nop,TS val 3720465764 ecr 1510723062], length 0
18:25:31.861145 IP 10.8.3.7.45438 > 99.181.89.139.1935: Flags [.], seq 41739:43053, ack 1, win 501, options [nop,nop,TS val 1510723460 ecr 3720465764], length 1314
18:25:31.861867 IP 99.181.89.139.1935 > 10.8.3.7.45438: Flags [.], ack 33855, win 126, options [nop,nop,TS val 3720465816 ecr 1510723146], length 0
18:25:31.861914 IP 10.8.3.7.45438 > 99.181.89.139.1935: Flags [P.], seq 43053:43654, ack 1, win 501, options [nop,nop,TS val 1510723461 ecr 3720465816], length 601
18:25:31.925063 IP 10.8.3.7.45438 > 99.181.89.139.1935: Flags [.], seq 43654:44968, ack 1, win 501, options [nop,nop,TS val 1510723524 ecr 3720465816], length 1314
18:25:31.940758 IP 99.181.89.139.1935 > 10.8.3.7.45438: Flags [.], ack 36483, win 126, options [nop,nop,TS val 3720465895 ecr 1510723192], length 0
18:25:31.962564 IP 10.8.3.7.45438 > 99.181.89.139.1935: Flags [.], seq 44968:46282, ack 1, win 501, options [nop,nop,TS val 1510723562 ecr 3720465895], length 1314
18:25:31.993603 IP 10.8.3.7.45438 > 99.181.89.139.1935: Flags [.], seq 46282:47596, ack 1, win 501, options [nop,nop,TS val 1510723593 ecr 3720465895], length 1314
18:25:32.044588 IP 99.181.89.139.1935 > 10.8.3.7.45438: Flags [.], ack 39111, win 126, options [nop,nop,TS val 3720465999 ecr 1510723268], length 0
18:25:32.061618 IP 10.8.3.7.45438 > 99.181.89.139.1935: Flags [.], seq 47596:48910, ack 1, win 501, options [nop,nop,TS val 1510723661 ecr 3720465999], length 1314
18:25:32.095971 IP 10.8.3.7.45438 > 99.181.89.139.1935: Flags [.], seq 48910:50224, ack 1, win 501, options [nop,nop,TS val 1510723695 ecr 3720465999], length 1314
18:25:32.112597 IP 99.181.89.139.1935 > 10.8.3.7.45438: Flags [.], ack 41739, win 126, options [nop,nop,TS val 3720466067 ecr 1510723363], length 0
18:25:32.131055 IP 10.8.3.7.45438 > 99.181.89.139.1935: Flags [.], seq 50224:51538, ack 1, win 501, options [nop,nop,TS val 1510723730 ecr 3720466067], length 1314
18:25:32.177169 IP 99.181.89.139.1935 > 10.8.3.7.45438: Flags [.], ack 43654, win 126, options [nop,nop,TS val 3720466132 ecr 1510723460], length 0
18:25:32.177184 IP 10.8.3.7.45438 > 99.181.89.139.1935: Flags [P.], seq 51538:52710, ack 1, win 501, options [nop,nop,TS val 1510723777 ecr 3720466132], length 1172
18:25:32.229026 IP 10.8.3.7.45438 > 99.181.89.139.1935: Flags [.], seq 52710:54024, ack 1, win 501, options [nop,nop,TS val 1510723828 ecr 3720466132], length 1314
18:25:32.260633 IP 10.8.3.7.45438 > 99.181.89.139.1935: Flags [.], seq 54024:55338, ack 1, win 501, options [nop,nop,TS val 1510723860 ecr 3720466132], length 1314
18:25:32.277724 IP 99.181.89.139.1935 > 10.8.3.7.45438: Flags [.], ack 46282, win 126, options [nop,nop,TS val 3720466232 ecr 1510723524], length 0
18:25:32.293044 IP 10.8.3.7.45438 > 99.181.89.139.1935: Flags [.], seq 55338:56652, ack 1, win 501, options [nop,nop,TS val 1510723892 ecr 3720466232], length 1314
18:25:32.362738 IP 10.8.3.7.45438 > 99.181.89.139.1935: Flags [.], seq 56652:57966, ack 1, win 501, options [nop,nop,TS val 1510723962 ecr 3720466232], length 1314
18:25:32.376804 IP 99.181.89.139.1935 > 10.8.3.7.45438: Flags [.], ack 48910, win 126, options [nop,nop,TS val 3720466331 ecr 1510723593], length 0
18:25:32.394416 IP 10.8.3.7.45438 > 99.181.89.139.1935: Flags [.], seq 57966:59280, ack 1, win 501, options [nop,nop,TS val 1510723994 ecr 3720466331], length 1314
18:25:32.427755 IP 10.8.3.7.45438 > 99.181.89.139.1935: Flags [.], seq 59280:60594, ack 1, win 501, options [nop,nop,TS val 1510724027 ecr 3720466331], length 1314
18:25:32.446398 IP 99.181.89.139.1935 > 10.8.3.7.45438: Flags [.], ack 51538, win 126, options [nop,nop,TS val 3720466401 ecr 1510723695], length 0
18:25:32.492428 IP 99.181.89.139.1935 > 10.8.3.7.45438: Flags [.], ack 52710, win 126, options [nop,nop,TS val 3720466447 ecr 1510723777], length 0
18:25:32.492461 IP 10.8.3.7.45438 > 99.181.89.139.1935: Flags [P.], seq 60594:61746, ack 1, win 501, options [nop,nop,TS val 1510724092 ecr 3720466447], length 1152
18:25:32.529226 IP 10.8.3.7.45438 > 99.181.89.139.1935: Flags [.], seq 61746:63060, ack 1, win 501, options [nop,nop,TS val 1510724129 ecr 3720466447], length 1314
18:25:32.559994 IP 10.8.3.7.45438 > 99.181.89.139.1935: Flags [.], seq 63060:64374, ack 1, win 501, options [nop,nop,TS val 1510724159 ecr 3720466447], length 1314
18:25:32.575799 IP 99.181.89.139.1935 > 10.8.3.7.45438: Flags [.], ack 55338, win 126, options [nop,nop,TS val 3720466530 ecr 1510723828], length 0
18:25:32.609297 IP 10.8.3.7.45438 > 99.181.89.139.1935: Flags [.], seq 64374:65688, ack 1, win 501, options [nop,nop,TS val 1510724209 ecr 3720466530], length 1314
18:25:32.661579 IP 10.8.3.7.45438 > 99.181.89.139.1935: Flags [.], seq 65688:67002, ack 1, win 501, options [nop,nop,TS val 1510724261 ecr 3720466530], length 1314
18:25:32.678065 IP 99.181.89.139.1935 > 10.8.3.7.45438: Flags [.], ack 57966, win 126, options [nop,nop,TS val 3720466633 ecr 1510723892], length 0
18:25:32.693751 IP 10.8.3.7.45438 > 99.181.89.139.1935: Flags [.], seq 67002:68316, ack 1, win 501, options [nop,nop,TS val 1510724293 ecr 3720466633], length 1314
18:25:32.737658 IP 10.8.3.7.45438 > 99.181.89.139.1935: Flags [.], seq 68316:69630, ack 1, win 501, options [nop,nop,TS val 1510724337 ecr 3720466633], length 1314
18:25:32.743180 IP 99.181.89.139.1935 > 10.8.3.7.45438: Flags [.], ack 60594, win 126, options [nop,nop,TS val 3720466698 ecr 1510723994], length 0
18:25:32.795887 IP 10.8.3.7.45438 > 99.181.89.139.1935: Flags [.], seq 69630:70944, ack 1, win 501, options [nop,nop,TS val 1510724395 ecr 3720466698], length 1314
18:25:32.808030 IP 99.181.89.139.1935 > 10.8.3.7.45438: Flags [.], ack 61746, win 126, options [nop,nop,TS val 3720466762 ecr 1510724092], length 0
18:25:32.808067 IP 10.8.3.7.45438 > 99.181.89.139.1935: Flags [P.], seq 70944:71650, ack 1, win 501, options [nop,nop,TS val 1510724407 ecr 3720466762], length 706
18:25:32.861909 IP 10.8.3.7.45438 > 99.181.89.139.1935: Flags [.], seq 71650:72964, ack 1, win 501, options [nop,nop,TS val 1510724461 ecr 3720466762], length 1314
18:25:32.875816 IP 99.181.89.139.1935 > 10.8.3.7.45438: Flags [.], ack 64374, win 126, options [nop,nop,TS val 3720466830 ecr 1510724129], length 0
18:25:32.895867 IP 10.8.3.7.45438 > 99.181.89.139.1935: Flags [.], seq 72964:74278, ack 1, win 501, options [nop,nop,TS val 1510724495 ecr 3720466830], length 1314
18:25:32.930828 IP 10.8.3.7.45438 > 99.181.89.139.1935: Flags [.], seq 74278:75592, ack 1, win 501, options [nop,nop,TS val 1510724530 ecr 3720466830], length 1314
18:25:32.977166 IP 99.181.89.139.1935 > 10.8.3.7.45438: Flags [.], ack 67002, win 126, options [nop,nop,TS val 3720466931 ecr 1510724209], length 0
18:25:32.993444 IP 10.8.3.7.45438 > 99.181.89.139.1935: Flags [.], seq 75592:76906, ack 1, win 501, options [nop,nop,TS val 1510724593 ecr 3720466931], length 1314
18:25:33.027422 IP 10.8.3.7.45438 > 99.181.89.139.1935: Flags [.], seq 76906:78220, ack 1, win 501, options [nop,nop,TS val 1510724627 ecr 3720466931], length 1314
18:25:33.052971 IP 99.181.89.139.1935 > 10.8.3.7.45438: Flags [.], ack 69630, win 126, options [nop,nop,TS val 3720467008 ecr 1510724293], length 0
18:25:33.058561 IP 10.8.3.7.45438 > 99.181.89.139.1935: Flags [.], seq 78220:79534, ack 1, win 501, options [nop,nop,TS val 1510724658 ecr 3720467008], length 1314
18:25:33.123503 IP 99.181.89.139.1935 > 10.8.3.7.45438: Flags [.], ack 71650, win 126, options [nop,nop,TS val 3720467078 ecr 1510724395], length 0
18:25:33.123543 IP 10.8.3.7.45438 > 99.181.89.139.1935: Flags [P.], seq 79534:80698, ack 1, win 501, options [nop,nop,TS val 1510724723 ecr 3720467078], length 1164
18:25:33.162648 IP 10.8.3.7.45438 > 99.181.89.139.1935: Flags [.], seq 80698:82012, ack 1, win 501, options [nop,nop,TS val 1510724762 ecr 3720467078], length 1314
18:25:33.193241 IP 10.8.3.7.45438 > 99.181.89.139.1935: Flags [.], seq 82012:83326, ack 1, win 501, options [nop,nop,TS val 1510724793 ecr 3720467078], length 1314
18:25:33.211429 IP 99.181.89.139.1935 > 10.8.3.7.45438: Flags [.], ack 74278, win 126, options [nop,nop,TS val 3720467166 ecr 1510724461], length 0
18:25:33.250751 IP 10.8.3.7.45438 > 99.181.89.139.1935: Flags [.], seq 83326:84640, ack 1, win 501, options [nop,nop,TS val 1510724850 ecr 3720467166], length 1314
18:25:33.295062 IP 10.8.3.7.45438 > 99.181.89.139.1935: Flags [.], seq 84640:85954, ack 1, win 501, options [nop,nop,TS val 1510724894 ecr 3720467166], length 1314
18:25:33.309139 IP 99.181.89.139.1935 > 10.8.3.7.45438: Flags [.], ack 76906, win 126, options [nop,nop,TS val 3720467264 ecr 1510724530], length 0
18:25:33.325120 IP 10.8.3.7.45438 > 99.181.89.139.1935: Flags [.], seq 85954:87268, ack 1, win 501, options [nop,nop,TS val 1510724924 ecr 3720467264], length 1314
18:25:33.373888 IP 99.181.89.139.1935 > 10.8.3.7.45438: Flags [.], ack 79534, win 126, options [nop,nop,TS val 3720467328 ecr 1510724627], length 0
18:25:33.378817 IP 10.8.3.7.45438 > 99.181.89.139.1935: Flags [.], seq 87268:88582, ack 1, win 501, options [nop,nop,TS val 1510724978 ecr 3720467328], length 1314
18:25:33.429261 IP 10.8.3.7.45438 > 99.181.89.139.1935: Flags [.], seq 88582:89896, ack 1, win 501, options [nop,nop,TS val 1510725029 ecr 3720467328], length 1314
18:25:33.439057 IP 99.181.89.139.1935 > 10.8.3.7.45438: Flags [.], ack 80698, win 126, options [nop,nop,TS val 3720467393 ecr 1510724723], length 0
18:25:33.439102 IP 10.8.3.7.45438 > 99.181.89.139.1935: Flags [P.], seq 89896:90499, ack 1, win 501, options [nop,nop,TS val 1510725038 ecr 3720467393], length 603
18:25:33.494260 IP 10.8.3.7.45438 > 99.181.89.139.1935: Flags [.], seq 90499:91813, ack 1, win 501, options [nop,nop,TS val 1510725094 ecr 3720467393], length 1314
18:25:33.508735 IP 99.181.89.139.1935 > 10.8.3.7.45438: Flags [.], ack 83326, win 126, options [nop,nop,TS val 3720467463 ecr 1510724762], length 0
18:25:33.528922 IP 10.8.3.7.45438 > 99.181.89.139.1935: Flags [.], seq 91813:93127, ack 1, win 501, options [nop,nop,TS val 1510725128 ecr 3720467463], length 1314
18:25:33.562744 IP 10.8.3.7.45438 > 99.181.89.139.1935: Flags [.], seq 93127:94441, ack 1, win 501, options [nop,nop,TS val 1510725162 ecr 3720467463], length 1314
18:25:33.610419 IP 99.181.89.139.1935 > 10.8.3.7.45438: Flags [.], ack 85954, win 126, options [nop,nop,TS val 3720467565 ecr 1510724850], length 0
18:25:33.628278 IP 10.8.3.7.45438 > 99.181.89.139.1935: Flags [.], seq 94441:95755, ack 1, win 501, options [nop,nop,TS val 1510725228 ecr 3720467565], length 1314
18:25:33.662709 IP 10.8.3.7.45438 > 99.181.89.139.1935: Flags [.], seq 95755:97069, ack 1, win 501, options [nop,nop,TS val 1510725262 ecr 3720467565], length 1314
18:25:33.694274 IP 99.181.89.139.1935 > 10.8.3.7.45438: Flags [.], ack 88582, win 126, options [nop,nop,TS val 3720467649 ecr 1510724924], length 0
18:25:33.695915 IP 10.8.3.7.45438 > 99.181.89.139.1935: Flags [.], seq 97069:98383, ack 1, win 501, options [nop,nop,TS val 1510725295 ecr 3720467649], length 1314
18:25:33.754212 IP 99.181.89.139.1935 > 10.8.3.7.45438: Flags [.], ack 90499, win 126, options [nop,nop,TS val 3720467709 ecr 1510725029], length 0
18:25:33.754235 IP 10.8.3.7.45438 > 99.181.89.139.1935: Flags [P.], seq 98383:99555, ack 1, win 501, options [nop,nop,TS val 1510725354 ecr 3720467709], length 1172
18:25:33.795823 IP 10.8.3.7.45438 > 99.181.89.139.1935: Flags [.], seq 99555:100869, ack 1, win 501, options [nop,nop,TS val 1510725395 ecr 3720467709], length 1314
18:25:33.828822 IP 10.8.3.7.45438 > 99.181.89.139.1935: Flags [.], seq 100869:102183, ack 1, win 501, options [nop,nop,TS val 1510725428 ecr 3720467709], length 1314
18:25:33.844428 IP 99.181.89.139.1935 > 10.8.3.7.45438: Flags [.], ack 93127, win 126, options [nop,nop,TS val 3720467799 ecr 1510725094], length 0
18:25:33.871701 IP 10.8.3.7.45438 > 99.181.89.139.1935: Flags [.], seq 102183:103497, ack 1, win 501, options [nop,nop,TS val 1510725471 ecr 3720467799], length 1314
18:25:33.928936 IP 10.8.3.7.45438 > 99.181.89.139.1935: Flags [.], seq 103497:104811, ack 1, win 501, options [nop,nop,TS val 1510725528 ecr 3720467799], length 1314
18:25:33.943431 IP 99.181.89.139.1935 > 10.8.3.7.45438: Flags [.], ack 95755, win 126, options [nop,nop,TS val 3720467898 ecr 1510725162], length 0
18:25:33.961908 IP 10.8.3.7.45438 > 99.181.89.139.1935: Flags [.], seq 104811:106125, ack 1, win 501, options [nop,nop,TS val 1510725561 ecr 3720467898], length 1314
18:25:33.999932 IP 10.8.3.7.45438 > 99.181.89.139.1935: Flags [.], seq 106125:107439, ack 1, win 501, options [nop,nop,TS val 1510725599 ecr 3720467898], length 1314
18:25:34.011204 IP 99.181.89.139.1935 > 10.8.3.7.45438: Flags [.], ack 98383, win 126, options [nop,nop,TS val 3720467966 ecr 1510725262], length 0
18:25:34.062565 IP 10.8.3.7.45438 > 99.181.89.139.1935: Flags [.], seq 107439:108753, ack 1, win 501, options [nop,nop,TS val 1510725662 ecr 3720467966], length 1314
18:25:34.069456 IP 99.181.89.139.1935 > 10.8.3.7.45438: Flags [.], ack 99555, win 126, options [nop,nop,TS val 3720468024 ecr 1510725354], length 0
18:25:34.069496 IP 10.8.3.7.45438 > 99.181.89.139.1935: Flags [P.], seq 108753:109442, ack 1, win 501, options [nop,nop,TS val 1510725669 ecr 3720468024], length 689
18:25:34.129142 IP 10.8.3.7.45438 > 99.181.89.139.1935: Flags [.], seq 109442:110756, ack 1, win 501, options [nop,nop,TS val 1510725728 ecr 3720468024], length 1314
18:25:34.144833 IP 99.181.89.139.1935 > 10.8.3.7.45438: Flags [.], ack 102183, win 126, options [nop,nop,TS val 3720468099 ecr 1510725395], length 0
18:25:34.161009 IP 10.8.3.7.45438 > 99.181.89.139.1935: Flags [.], seq 110756:112070, ack 1, win 501, options [nop,nop,TS val 1510725760 ecr 3720468099], length 1314
18:25:34.195250 IP 10.8.3.7.45438 > 99.181.89.139.1935: Flags [.], seq 112070:113384, ack 1, win 501, options [nop,nop,TS val 1510725795 ecr 3720468099], length 1314
18:25:34.249099 IP 99.181.89.139.1935 > 10.8.3.7.45438: Flags [.], ack 104811, win 126, options [nop,nop,TS val 3720468204 ecr 1510725471], length 0
18:25:34.262689 IP 10.8.3.7.45438 > 99.181.89.139.1935: Flags [.], seq 113384:114698, ack 1, win 501, options [nop,nop,TS val 1510725862 ecr 3720468204], length 1314
18:25:34.293258 IP 10.8.3.7.45438 > 99.181.89.139.1935: Flags [.], seq 114698:116012, ack 1, win 501, options [nop,nop,TS val 1510725893 ecr 3720468204], length 1314
18:25:34.315656 IP 99.181.89.139.1935 > 10.8.3.7.45438: Flags [.], ack 107439, win 126, options [nop,nop,TS val 3720468270 ecr 1510725561], length 0
18:25:34.328765 IP 10.8.3.7.45438 > 99.181.89.139.1935: Flags [.], seq 116012:117326, ack 1, win 501, options [nop,nop,TS val 1510725928 ecr 3720468270], length 1314
18:25:34.384761 IP 99.181.89.139.1935 > 10.8.3.7.45438: Flags [.], ack 109442, win 126, options [nop,nop,TS val 3720468339 ecr 1510725662], length 0
18:25:34.384799 IP 10.8.3.7.45438 > 99.181.89.139.1935: Flags [P.], seq 117326:118399, ack 1, win 501, options [nop,nop,TS val 1510725984 ecr 3720468339], length 1073
18:25:34.428596 IP 10.8.3.7.45438 > 99.181.89.139.1935: Flags [.], seq 118399:119713, ack 1, win 501, options [nop,nop,TS val 1510726028 ecr 3720468339], length 1314
18:25:34.459576 IP 10.8.3.7.45438 > 99.181.89.139.1935: Flags [.], seq 119713:121027, ack 1, win 501, options [nop,nop,TS val 1510726059 ecr 3720468339], length 1314
18:25:34.476443 IP 99.181.89.139.1935 > 10.8.3.7.45438: Flags [.], ack 112070, win 126, options [nop,nop,TS val 3720468431 ecr 1510725728], length 0
18:25:34.496626 IP 10.8.3.7.45438 > 99.181.89.139.1935: Flags [.], seq 121027:122341, ack 1, win 501, options [nop,nop,TS val 1510726096 ecr 3720468431], length 1314
18:25:34.562588 IP 10.8.3.7.45438 > 99.181.89.139.1935: Flags [.], seq 122341:123655, ack 1, win 501, options [nop,nop,TS val 1510726162 ecr 3720468431], length 1314
18:25:34.578102 IP 99.181.89.139.1935 > 10.8.3.7.45438: Flags [.], ack 114698, win 126, options [nop,nop,TS val 3720468533 ecr 1510725795], length 0
18:25:34.595961 IP 10.8.3.7.45438 > 99.181.89.139.1935: Flags [.], seq 123655:124969, ack 1, win 501, options [nop,nop,TS val 1510726195 ecr 3720468533], length 1314
18:25:34.629040 IP 10.8.3.7.45438 > 99.181.89.139.1935: Flags [.], seq 124969:126283, ack 1, win 501, options [nop,nop,TS val 1510726228 ecr 3720468533], length 1314
18:25:34.644371 IP 99.181.89.139.1935 > 10.8.3.7.45438: Flags [.], ack 117326, win 126, options [nop,nop,TS val 3720468599 ecr 1510725893], length 0
18:25:34.694462 IP 10.8.3.7.45438 > 99.181.89.139.1935: Flags [.], seq 126283:127597, ack 1, win 501, options [nop,nop,TS val 1510726294 ecr 3720468599], length 1314
18:25:34.700438 IP 99.181.89.139.1935 > 10.8.3.7.45438: Flags [.], ack 118399, win 126, options [nop,nop,TS val 3720468655 ecr 1510725984], length 0
18:25:34.700463 IP 10.8.3.7.45438 > 99.181.89.139.1935: Flags [P.], seq 127597:128299, ack 1, win 501, options [nop,nop,TS val 1510726300 ecr 3720468655], length 702
18:25:34.762461 IP 10.8.3.7.45438 > 99.181.89.139.1935: Flags [.], seq 128299:129613, ack 1, win 501, options [nop,nop,TS val 1510726362 ecr 3720468655], length 1314
18:25:34.775065 IP 99.181.89.139.1935 > 10.8.3.7.45438: Flags [.], ack 121027, win 126, options [nop,nop,TS val 3720468730 ecr 1510726028], length 0
18:25:34.795697 IP 10.8.3.7.45438 > 99.181.89.139.1935: Flags [.], seq 129613:130927, ack 1, win 501, options [nop,nop,TS val 1510726395 ecr 3720468730], length 1314
18:25:34.827755 IP 10.8.3.7.45438 > 99.181.89.139.1935: Flags [.], seq 130927:132241, ack 1, win 501, options [nop,nop,TS val 1510726427 ecr 3720468730], length 1314
18:25:34.878238 IP 99.181.89.139.1935 > 10.8.3.7.45438: Flags [.], ack 123655, win 126, options [nop,nop,TS val 3720468833 ecr 1510726096], length 0
18:25:34.900235 IP 10.8.3.7.45438 > 99.181.89.139.1935: Flags [.], seq 132241:133555, ack 1, win 501, options [nop,nop,TS val 1510726500 ecr 3720468833], length 1314
18:25:34.928573 IP 10.8.3.7.45438 > 99.181.89.139.1935: Flags [.], seq 133555:134869, ack 1, win 501, options [nop,nop,TS val 1510726528 ecr 3720468833], length 1314
18:25:34.944462 IP 99.181.89.139.1935 > 10.8.3.7.45438: Flags [.], ack 126283, win 126, options [nop,nop,TS val 3720468899 ecr 1510726195], length 0
18:25:34.964492 IP 10.8.3.7.45438 > 99.181.89.139.1935: Flags [.], seq 134869:136183, ack 1, win 501, options [nop,nop,TS val 1510726564 ecr 3720468899], length 1314
18:25:35.015819 IP 99.181.89.139.1935 > 10.8.3.7.45438: Flags [.], ack 128299, win 126, options [nop,nop,TS val 3720468970 ecr 1510726294], length 0
18:25:35.015844 IP 10.8.3.7.45438 > 99.181.89.139.1935: Flags [P.], seq 136183:137343, ack 1, win 501, options [nop,nop,TS val 1510726615 ecr 3720468970], length 1160
18:25:35.062480 IP 10.8.3.7.45438 > 99.181.89.139.1935: Flags [.], seq 137343:138657, ack 1, win 501, options [nop,nop,TS val 1510726662 ecr 3720468970], length 1314
18:25:35.092953 IP 10.8.3.7.45438 > 99.181.89.139.1935: Flags [.], seq 138657:139971, ack 1, win 501, options [nop,nop,TS val 1510726692 ecr 3720468970], length 1314
18:25:35.111274 IP 99.181.89.139.1935 > 10.8.3.7.45438: Flags [.], ack 130927, win 126, options [nop,nop,TS val 3720469066 ecr 1510726362], length 0
18:25:35.125690 IP 10.8.3.7.45438 > 99.181.89.139.1935: Flags [.], seq 139971:141285, ack 1, win 501, options [nop,nop,TS val 1510726725 ecr 3720469066], length 1314
18:25:35.196254 IP 10.8.3.7.45438 > 99.181.89.139.1935: Flags [.], seq 141285:142599, ack 1, win 501, options [nop,nop,TS val 1510726796 ecr 3720469066], length 1314
18:25:35.215654 IP 99.181.89.139.1935 > 10.8.3.7.45438: Flags [.], ack 133555, win 126, options [nop,nop,TS val 3720469170 ecr 1510726427], length 0
18:25:35.221202 IP 10.8.3.7.45438 > 99.181.89.139.1935: Flags [.], seq 142599:143913, ack 1, win 501, options [nop,nop,TS val 1510726821 ecr 3720469170], length 1314
18:25:35.262750 IP 10.8.3.7.45438 > 99.181.89.139.1935: Flags [.], seq 143913:145227, ack 1, win 501, options [nop,nop,TS val 1510726862 ecr 3720469170], length 1314
18:25:35.279887 IP 99.181.89.139.1935 > 10.8.3.7.45438: Flags [.], ack 136183, win 126, options [nop,nop,TS val 3720469234 ecr 1510726528], length 0
18:25:35.328379 IP 10.8.3.7.45438 > 99.181.89.139.1935: Flags [.], seq 145227:146541, ack 1, win 501, options [nop,nop,TS val 1510726928 ecr 3720469234], length 1314
18:25:35.331295 IP 99.181.89.139.1935 > 10.8.3.7.45438: Flags [.], ack 137343, win 126, options [nop,nop,TS val 3720469286 ecr 1510726615], length 0
18:25:35.331324 IP 10.8.3.7.45438 > 99.181.89.139.1935: Flags [P.], seq 146541:147342, ack 1, win 501, options [nop,nop,TS val 1510726931 ecr 3720469286], length 801
18:25:35.392549 IP 10.8.3.7.45438 > 99.181.89.139.1935: Flags [.], seq 147342:148656, ack 1, win 501, options [nop,nop,TS val 1510726992 ecr 3720469286], length 1314
18:25:35.408309 IP 99.181.89.139.1935 > 10.8.3.7.45438: Flags [.], ack 139971, win 126, options [nop,nop,TS val 3720469363 ecr 1510726662], length 0
18:25:35.429530 IP 10.8.3.7.45438 > 99.181.89.139.1935: Flags [.], seq 148656:149970, ack 1, win 501, options [nop,nop,TS val 1510727029 ecr 3720469363], length 1314
18:25:35.462570 IP 10.8.3.7.45438 > 99.181.89.139.1935: Flags [.], seq 149970:151284, ack 1, win 501, options [nop,nop,TS val 1510727062 ecr 3720469363], length 1314
18:25:35.511663 IP 99.181.89.139.1935 > 10.8.3.7.45438: Flags [.], ack 142599, win 126, options [nop,nop,TS val 3720469466 ecr 1510726725], length 0
18:25:35.521131 IP 10.8.3.7.45438 > 99.181.89.139.1935: Flags [.], seq 151284:152598, ack 1, win 501, options [nop,nop,TS val 1510727120 ecr 3720469466], length 1314
18:25:35.562859 IP 10.8.3.7.45438 > 99.181.89.139.1935: Flags [.], seq 152598:153912, ack 1, win 501, options [nop,nop,TS val 1510727162 ecr 3720469466], length 1314
18:25:35.578008 IP 99.181.89.139.1935 > 10.8.3.7.45438: Flags [.], ack 145227, win 126, options [nop,nop,TS val 3720469533 ecr 1510726821], length 0
18:25:35.596055 IP 10.8.3.7.45438 > 99.181.89.139.1935: Flags [.], seq 153912:155226, ack 1, win 501, options [nop,nop,TS val 1510727195 ecr 3720469533], length 1314
18:25:35.646745 IP 99.181.89.139.1935 > 10.8.3.7.45438: Flags [.], ack 147342, win 126, options [nop,nop,TS val 3720469601 ecr 1510726928], length 0
18:25:35.646782 IP 10.8.3.7.45438 > 99.181.89.139.1935: Flags [P.], seq 155226:156287, ack 1, win 501, options [nop,nop,TS val 1510727246 ecr 3720469601], length 1061
18:25:35.693036 IP 10.8.3.7.45438 > 99.181.89.139.1935: Flags [.], seq 156287:157601, ack 1, win 501, options [nop,nop,TS val 1510727292 ecr 3720469601], length 1314
18:25:35.726800 IP 10.8.3.7.45438 > 99.181.89.139.1935: Flags [.], seq 157601:158915, ack 1, win 501, options [nop,nop,TS val 1510727326 ecr 3720469601], length 1314
18:25:35.745230 IP 99.181.89.139.1935 > 10.8.3.7.45438: Flags [.], ack 149970, win 126, options [nop,nop,TS val 3720469700 ecr 1510726992], length 0
18:25:35.759936 IP 10.8.3.7.45438 > 99.181.89.139.1935: Flags [.], seq 158915:160229, ack 1, win 501, options [nop,nop,TS val 1510727359 ecr 3720469700], length 1314
18:25:35.821357 IP 10.8.3.7.45438 > 99.181.89.139.1935: Flags [.], seq 160229:161543, ack 1, win 501, options [nop,nop,TS val 1510727421 ecr 3720469700], length 1314
18:25:35.836904 IP 99.181.89.139.1935 > 10.8.3.7.45438: Flags [.], ack 152598, win 126, options [nop,nop,TS val 3720469791 ecr 1510727062], length 0
18:25:35.861055 IP 10.8.3.7.45438 > 99.181.89.139.1935: Flags [.], seq 161543:162857, ack 1, win 501, options [nop,nop,TS val 1510727460 ecr 3720469791], length 1314
18:25:35.894407 IP 10.8.3.7.45438 > 99.181.89.139.1935: Flags [.], seq 162857:164171, ack 1, win 501, options [nop,nop,TS val 1510727494 ecr 3720469791], length 1314
18:25:35.911426 IP 99.181.89.139.1935 > 10.8.3.7.45438: Flags [.], ack 155226, win 126, options [nop,nop,TS val 3720469866 ecr 1510727162], length 0
18:25:35.961877 IP 10.8.3.7.45438 > 99.181.89.139.1935: Flags [.], seq 164171:165485, ack 1, win 501, options [nop,nop,TS val 1510727561 ecr 3720469866], length 1314
18:25:35.962169 IP 99.181.89.139.1935 > 10.8.3.7.45438: Flags [.], ack 156287, win 126, options [nop,nop,TS val 3720469917 ecr 1510727246], length 0
18:25:35.962189 IP 10.8.3.7.45438 > 99.181.89.139.1935: Flags [P.], seq 165485:166186, ack 1, win 501, options [nop,nop,TS val 1510727562 ecr 3720469917], length 701
18:25:36.028725 IP 10.8.3.7.45438 > 99.181.89.139.1935: Flags [.], seq 166186:167500, ack 1, win 501, options [nop,nop,TS val 1510727628 ecr 3720469917], length 1314
18:25:36.042119 IP 99.181.89.139.1935 > 10.8.3.7.45438: Flags [.], ack 158915, win 126, options [nop,nop,TS val 3720469996 ecr 1510727292], length 0
18:25:36.056720 IP 10.8.3.7.45438 > 99.181.89.139.1935: Flags [.], seq 167500:168814, ack 1, win 501, options [nop,nop,TS val 1510727656 ecr 3720469996], length 1314
18:25:36.096111 IP 10.8.3.7.45438 > 99.181.89.139.1935: Flags [.], seq 168814:170128, ack 1, win 501, options [nop,nop,TS val 1510727695 ecr 3720469996], length 1314
18:25:36.136893 IP 99.181.89.139.1935 > 10.8.3.7.45438: Flags [.], ack 161543, win 126, options [nop,nop,TS val 3720470091 ecr 1510727359], length 0
18:25:36.160127 IP 10.8.3.7.45438 > 99.181.89.139.1935: Flags [.], seq 170128:171442, ack 1, win 501, options [nop,nop,TS val 1510727759 ecr 3720470091], length 1314
18:25:36.185304 IP 10.8.3.7.45438 > 99.181.89.139.1935: Flags [.], seq 171442:172756, ack 1, win 501, options [nop,nop,TS val 1510727785 ecr 3720470091], length 1314
18:25:36.210138 IP 99.181.89.139.1935 > 10.8.3.7.45438: Flags [.], ack 164171, win 126, options [nop,nop,TS val 3720470164 ecr 1510727460], length 0
18:25:36.228255 IP 10.8.3.7.45438 > 99.181.89.139.1935: Flags [.], seq 172756:174070, ack 1, win 501, options [nop,nop,TS val 1510727828 ecr 3720470164], length 1314
18:25:36.277425 IP 99.181.89.139.1935 > 10.8.3.7.45438: Flags [.], ack 166186, win 126, options [nop,nop,TS val 3720470232 ecr 1510727561], length 0
18:25:36.277459 IP 10.8.3.7.45438 > 99.181.89.139.1935: Flags [P.], seq 174070:175238, ack 1, win 501, options [nop,nop,TS val 1510727877 ecr 3720470232], length 1168
18:25:36.328433 IP 10.8.3.7.45438 > 99.181.89.139.1935: Flags [.], seq 175238:176552, ack 1, win 501, options [nop,nop,TS val 1510727928 ecr 3720470232], length 1314
18:25:36.356782 IP 10.8.3.7.45438 > 99.181.89.139.1935: Flags [.], seq 176552:177866, ack 1, win 501, options [nop,nop,TS val 1510727956 ecr 3720470232], length 1314
18:25:36.372141 IP 99.181.89.139.1935 > 10.8.3.7.45438: Flags [.], ack 168814, win 126, options [nop,nop,TS val 3720470327 ecr 1510727628], length 0
18:25:36.399693 IP 10.8.3.7.45438 > 99.181.89.139.1935: Flags [.], seq 177866:179180, ack 1, win 501, options [nop,nop,TS val 1510727999 ecr 3720470327], length 1314
18:25:36.461072 IP 10.8.3.7.45438 > 99.181.89.139.1935: Flags [.], seq 179180:180494, ack 1, win 501, options [nop,nop,TS val 1510728060 ecr 3720470327], length 1314
18:25:36.475468 IP 99.181.89.139.1935 > 10.8.3.7.45438: Flags [.], ack 171442, win 126, options [nop,nop,TS val 3720470430 ecr 1510727695], length 0
18:25:36.494998 IP 10.8.3.7.45438 > 99.181.89.139.1935: Flags [.], seq 180494:181808, ack 1, win 501, options [nop,nop,TS val 1510728094 ecr 3720470430], length 1314
18:25:36.527784 IP 10.8.3.7.45438 > 99.181.89.139.1935: Flags [.], seq 181808:183122, ack 1, win 501, options [nop,nop,TS val 1510728127 ecr 3720470430], length 1314
18:25:36.543587 IP 99.181.89.139.1935 > 10.8.3.7.45438: Flags [.], ack 174070, win 126, options [nop,nop,TS val 3720470498 ecr 1510727785], length 0
18:25:36.591916 IP 10.8.3.7.45438 > 99.181.89.139.1935: Flags [.], seq 183122:184436, ack 1, win 501, options [nop,nop,TS val 1510728191 ecr 3720470498], length 1314
18:25:36.592880 IP 99.181.89.139.1935 > 10.8.3.7.45438: Flags [.], ack 175238, win 126, options [nop,nop,TS val 3720470547 ecr 1510727877], length 0
18:25:36.592906 IP 10.8.3.7.45438 > 99.181.89.139.1935: Flags [P.], seq 184436:185034, ack 1, win 501, options [nop,nop,TS val 1510728192 ecr 3720470547], length 598
18:25:36.656361 IP 10.8.3.7.45438 > 99.181.89.139.1935: Flags [.], seq 185034:186348, ack 1, win 501, options [nop,nop,TS val 1510728256 ecr 3720470547], length 1314
18:25:36.672291 IP 99.181.89.139.1935 > 10.8.3.7.45438: Flags [.], ack 177866, win 126, options [nop,nop,TS val 3720470627 ecr 1510727928], length 0
18:25:36.695403 IP 10.8.3.7.45438 > 99.181.89.139.1935: Flags [.], seq 186348:187662, ack 1, win 501, options [nop,nop,TS val 1510728295 ecr 3720470627], length 1314
18:25:36.720590 IP 10.8.3.7.45438 > 99.181.89.139.1935: Flags [.], seq 187662:188976, ack 1, win 501, options [nop,nop,TS val 1510728320 ecr 3720470627], length 1314
18:25:36.776510 IP 99.181.89.139.1935 > 10.8.3.7.45438: Flags [.], ack 180494, win 126, options [nop,nop,TS val 3720470731 ecr 1510727999], length 0
18:25:36.795497 IP 10.8.3.7.45438 > 99.181.89.139.1935: Flags [.], seq 188976:190290, ack 1, win 501, options [nop,nop,TS val 1510728395 ecr 3720470731], length 1314
18:25:36.827886 IP 10.8.3.7.45438 > 99.181.89.139.1935: Flags [.], seq 190290:191604, ack 1, win 501, options [nop,nop,TS val 1510728427 ecr 3720470731], length 1314
18:25:36.843310 IP 99.181.89.139.1935 > 10.8.3.7.45438: Flags [.], ack 183122, win 126, options [nop,nop,TS val 3720470798 ecr 1510728094], length 0
18:25:36.862106 IP 10.8.3.7.45438 > 99.181.89.139.1935: Flags [.], seq 191604:192918, ack 1, win 501, options [nop,nop,TS val 1510728461 ecr 3720470798], length 1314
18:25:36.908282 IP 99.181.89.139.1935 > 10.8.3.7.45438: Flags [.], ack 185034, win 126, options [nop,nop,TS val 3720470863 ecr 1510728191], length 0
18:25:36.908323 IP 10.8.3.7.45438 > 99.181.89.139.1935: Flags [P.], seq 192918:194090, ack 1, win 501, options [nop,nop,TS val 1510728508 ecr 3720470863], length 1172
18:25:36.956556 IP 10.8.3.7.45438 > 99.181.89.139.1935: Flags [.], seq 194090:195404, ack 1, win 501, options [nop,nop,TS val 1510728556 ecr 3720470863], length 1314
18:25:36.994307 IP 10.8.3.7.45438 > 99.181.89.139.1935: Flags [.], seq 195404:196718, ack 1, win 501, options [nop,nop,TS val 1510728594 ecr 3720470863], length 1314
18:25:37.010968 IP 99.181.89.139.1935 > 10.8.3.7.45438: Flags [.], ack 187662, win 126, options [nop,nop,TS val 3720470965 ecr 1510728256], length 0
18:25:37.028192 IP 10.8.3.7.45438 > 99.181.89.139.1935: Flags [.], seq 196718:198032, ack 1, win 501, options [nop,nop,TS val 1510728627 ecr 3720470965], length 1314
18:25:37.095412 IP 10.8.3.7.45438 > 99.181.89.139.1935: Flags [.], seq 198032:199346, ack 1, win 501, options [nop,nop,TS val 1510728695 ecr 3720470965], length 1314
18:25:37.107132 IP 99.181.89.139.1935 > 10.8.3.7.45438: Flags [.], ack 188976, win 126, options [nop,nop,TS val 3720471062 ecr 1510728320], length 0
18:25:37.127914 IP 10.8.3.7.45438 > 99.181.89.139.1935: Flags [.], seq 199346:200660, ack 1, win 501, options [nop,nop,TS val 1510728727 ecr 3720471062], length 1314
18:25:37.143301 IP 99.181.89.139.1935 > 10.8.3.7.45438: Flags [.], ack 191604, win 126, options [nop,nop,TS val 3720471098 ecr 1510728395], length 0
18:25:37.162136 IP 10.8.3.7.45438 > 99.181.89.139.1935: Flags [.], seq 200660:201974, ack 1, win 501, options [nop,nop,TS val 1510728761 ecr 3720471098], length 1314
18:25:37.224135 IP 99.181.89.139.1935 > 10.8.3.7.45438: Flags [.], ack 194090, win 126, options [nop,nop,TS val 3720471179 ecr 1510728461], length 0
18:25:37.224166 IP 10.8.3.7.45438 > 99.181.89.139.1935: Flags [P.], seq 201974:203130, ack 1, win 501, options [nop,nop,TS val 1510728823 ecr 3720471179], length 1156
18:25:37.256452 IP 10.8.3.7.45438 > 99.181.89.139.1935: Flags [.], seq 203130:204444, ack 1, win 501, options [nop,nop,TS val 1510728856 ecr 3720471179], length 1314
18:25:37.295666 IP 10.8.3.7.45438 > 99.181.89.139.1935: Flags [.], seq 204444:205758, ack 1, win 501, options [nop,nop,TS val 1510728895 ecr 3720471179], length 1314
18:25:37.309649 IP 99.181.89.139.1935 > 10.8.3.7.45438: Flags [.], ack 196718, win 126, options [nop,nop,TS val 3720471264 ecr 1510728556], length 0
