21:36:42.486246 IP 10.8.1.8.53450 > 99.181.101.239.1935: Flags [.], seq 3380723301:3380724615, ack 2733379082, win 501, options [nop,nop,TS val 2274968214 ecr 3869581342], length 1314
21:36:42.524074 IP 10.8.1.8.53450 > 99.181.101.239.1935: Flags [.], seq 1314:2628, ack 1, win 501, options [nop,nop,TS val 2274968252 ecr 3869581342], length 1314
21:36:42.528465 IP 99.181.101.239.1935 > 10.8.1.8.53450: Flags [.], ack 4294957944, win 126, options [nop,nop,TS val 3869581410 ecr 2274967816], length 0
21:36:42.588710 IP 10.8.1.8.53450 > 99.181.101.239.1935: Flags [.], seq 2628:3942, ack 1, win 501, options [nop,nop,TS val 2274968316 ecr 3869581410], length 1314
21:36:42.620461 IP 10.8.1.8.53450 > 99.181.101.239.1935: Flags [.], seq 3942:5256, ack 1, win 501, options [nop,nop,TS val 2274968348 ecr 3869581410], length 1314
21:36:42.628809 IP 99.181.101.239.1935 > 10.8.1.8.53450: Flags [.], ack 4294960572, win 126, options [nop,nop,TS val 3869581507 ecr 2274967912], length 0
21:36:42.654386 IP 10.8.1.8.53450 > 99.181.101.239.1935: Flags [.], seq 5256:6570, ack 1, win 501, options [nop,nop,TS val 2274968382 ecr 3869581507], length 1314
21:36:42.691103 IP 99.181.101.239.1935 > 10.8.1.8.53450: Flags [.], ack 4294962040, win 126, options [nop,nop,TS val 3869581568 ecr 2274967983], length 0
21:36:42.691134 IP 10.8.1.8.53450 > 99.181.101.239.1935: Flags [P.], seq 6570:7551, ack 1, win 501, options [nop,nop,TS val 2274968419 ecr 3869581568], length 981
21:36:42.753826 IP 10.8.1.8.53450 > 99.181.101.239.1935: Flags [.], seq 7551:8865, ack 1, win 501, options [nop,nop,TS val 2274968482 ecr 3869581568], length 1314
21:36:42.760006 IP 99.181.101.239.1935 > 10.8.1.8.53450: Flags [.], ack 4294964668, win 126, options [nop,nop,TS val 3869581641 ecr 2274968045], length 0
21:36:42.787404 IP 10.8.1.8.53450 > 99.181.101.239.1935: Flags [.], seq 8865:10179, ack 1, win 501, options [nop,nop,TS val 2274968515 ecr 3869581641], length 1314
21:36:42.824060 IP 10.8.1.8.53450 > 99.181.101.239.1935: Flags [.], seq 10179:11493, ack 1, win 501, options [nop,nop,TS val 2274968552 ecr 3869581641], length 1314
21:36:42.859028 IP 99.181.101.239.1935 > 10.8.1.8.53450: Flags [.], ack 0, win 126, options [nop,nop,TS val 3869581741 ecr 2274968124], length 0
21:36:42.887570 IP 10.8.1.8.53450 > 99.181.101.239.1935: Flags [.], seq 11493:12807, ack 1, win 501, options [nop,nop,TS val 2274968615 ecr 3869581741], length 1314
21:36:42.919504 IP 10.8.1.8.53450 > 99.181.101.239.1935: Flags [.], seq 12807:14121, ack 1, win 501, options [nop,nop,TS val 2274968647 ecr 3869581741], length 1314
21:36:42.930248 IP 99.181.101.239.1935 > 10.8.1.8.53450: Flags [.], ack 2628, win 126, options [nop,nop,TS val 3869581812 ecr 2274968214], length 0
21:36:42.954944 IP 10.8.1.8.53450 > 99.181.101.239.1935: Flags [.], seq 14121:15435, ack 1, win 501, options [nop,nop,TS val 2274968683 ecr 3869581812], length 1314
21:36:43.018712 IP 10.8.1.8.53450 > 99.181.101.239.1935: Flags [.], seq 15435:16749, ack 1, win 501, options [nop,nop,TS val 2274968746 ecr 3869581812], length 1314
21:36:43.028811 IP 99.181.101.239.1935 > 10.8.1.8.53450: Flags [.], ack 5256, win 126, options [nop,nop,TS val 3869581910 ecr 2274968316], length 0
21:36:43.051606 IP 10.8.1.8.53450 > 99.181.101.239.1935: Flags [.], seq 16749:18063, ack 1, win 501, options [nop,nop,TS val 2274968779 ecr 3869581910], length 1314
21:36:43.084559 IP 10.8.1.8.53450 > 99.181.101.239.1935: Flags [.], seq 18063:19377, ack 1, win 501, options [nop,nop,TS val 2274968812 ecr 3869581910], length 1314
21:36:43.098024 IP 99.181.101.239.1935 > 10.8.1.8.53450: Flags [.], ack 7551, win 126, options [nop,nop,TS val 3869581979 ecr 2274968382], length 0
21:36:43.098037 IP 10.8.1.8.53450 > 99.181.101.239.1935: Flags [P.], seq 19377:19531, ack 1, win 501, options [nop,nop,TS val 2274968826 ecr 3869581979], length 154
21:36:43.151517 IP 10.8.1.8.53450 > 99.181.101.239.1935: Flags [.], seq 19531:20845, ack 1, win 501, options [nop,nop,TS val 2274968879 ecr 3869581979], length 1314
21:36:43.185163 IP 10.8.1.8.53450 > 99.181.101.239.1935: Flags [.], seq 20845:22159, ack 1, win 501, options [nop,nop,TS val 2274968913 ecr 3869581979], length 1314
21:36:43.193416 IP 99.181.101.239.1935 > 10.8.1.8.53450: Flags [.], ack 10179, win 126, options [nop,nop,TS val 3869582075 ecr 2274968482], length 0
21:36:43.217784 IP 10.8.1.8.53450 > 99.181.101.239.1935: Flags [.], seq 22159:23473, ack 1, win 501, options [nop,nop,TS val 2274968945 ecr 3869582075], length 1314
21:36:43.287223 IP 10.8.1.8.53450 > 99.181.101.239.1935: Flags [.], seq 23473:24787, ack 1, win 501, options [nop,nop,TS val 2274969015 ecr 3869582075], length 1314
21:36:43.299944 IP 99.181.101.239.1935 > 10.8.1.8.53450: Flags [.], ack 12807, win 126, options [nop,nop,TS val 3869582175 ecr 2274968552], length 0
21:36:43.320786 IP 10.8.1.8.53450 > 99.181.101.239.1935: Flags [.], seq 24787:26101, ack 1, win 501, options [nop,nop,TS val 2274969048 ecr 3869582175], length 1314
21:36:43.355643 IP 10.8.1.8.53450 > 99.181.101.239.1935: Flags [.], seq 26101:27415, ack 1, win 501, options [nop,nop,TS val 2274969083 ecr 3869582175], length 1314
21:36:43.364864 IP 99.181.101.239.1935 > 10.8.1.8.53450: Flags [.], ack 15435, win 126, options [nop,nop,TS val 3869582243 ecr 2274968647], length 0
21:36:43.420753 IP 10.8.1.8.53450 > 99.181.101.239.1935: Flags [.], seq 27415:28729, ack 1, win 501, options [nop,nop,TS val 2274969148 ecr 3869582243], length 1314
21:36:43.454311 IP 10.8.1.8.53450 > 99.181.101.239.1935: Flags [.], seq 28729:30043, ack 1, win 501, options [nop,nop,TS val 2274969182 ecr 3869582243], length 1314
21:36:43.459636 IP 99.181.101.239.1935 > 10.8.1.8.53450: Flags [.], ack 18063, win 126, options [nop,nop,TS val 3869582339 ecr 2274968746], length 0
21:36:43.487738 IP 10.8.1.8.53450 > 99.181.101.239.1935: Flags [.], seq 30043:31357, ack 1, win 501, options [nop,nop,TS val 2274969215 ecr 3869582339], length 1314
21:36:43.504662 IP 99.181.101.239.1935 > 10.8.1.8.53450: Flags [.], ack 19531, win 126, options [nop,nop,TS val 3869582386 ecr 2274968812], length 0
21:36:43.504694 IP 10.8.1.8.53450 > 99.181.101.239.1935: Flags [P.], seq 31357:31494, ack 1, win 501, options [nop,nop,TS val 2274969232 ecr 3869582386], length 137
21:36:43.554086 IP 10.8.1.8.53450 > 99.181.101.239.1935: Flags [.], seq 31494:32808, ack 1, win 501, options [nop,nop,TS val 2274969282 ecr 3869582386], length 1314
21:36:43.588524 IP 10.8.1.8.53450 > 99.181.101.239.1935: Flags [.], seq 32808:34122, ack 1, win 501, options [nop,nop,TS val 2274969316 ecr 3869582386], length 1314
21:36:43.591002 IP 99.181.101.239.1935 > 10.8.1.8.53450: Flags [.], ack 22159, win 126, options [nop,nop,TS val 3869582473 ecr 2274968879], length 0
21:36:43.621752 IP 10.8.1.8.53450 > 99.181.101.239.1935: Flags [.], seq 34122:35436, ack 1, win 501, options [nop,nop,TS val 2274969349 ecr 3869582473], length 1314
21:36:43.684625 IP 10.8.1.8.53450 > 99.181.101.239.1935: Flags [.], seq 35436:36750, ack 1, win 501, options [nop,nop,TS val 2274969412 ecr 3869582473], length 1314
21:36:43.685172 IP 99.181.101.239.1935 > 10.8.1.8.53450: Flags [.], ack 23473, win 126, options [nop,nop,TS val 3869582567 ecr 2274968945], length 0
21:36:43.720276 IP 10.8.1.8.53450 > 99.181.101.239.1935: Flags [.], seq 36750:38064, ack 1, win 501, options [nop,nop,TS val 2274969448 ecr 3869582567], length 1314
21:36:43.726461 IP 99.181.101.239.1935 > 10.8.1.8.53450: Flags [.], ack 26101, win 126, options [nop,nop,TS val 3869582608 ecr 2274969015], length 0
21:36:43.755581 IP 10.8.1.8.53450 > 99.181.101.239.1935: Flags [.], seq 38064:39378, ack 1, win 501, options [nop,nop,TS val 2274969483 ecr 3869582608], length 1314
21:36:43.820655 IP 10.8.1.8.53450 > 99.181.101.239.1935: Flags [.], seq 39378:40692, ack 1, win 501, options [nop,nop,TS val 2274969548 ecr 3869582608], length 1314
21:36:43.826831 IP 99.181.101.239.1935 > 10.8.1.8.53450: Flags [.], ack 28729, win 126, options [nop,nop,TS val 3869582708 ecr 2274969083], length 0
21:36:43.854054 IP 10.8.1.8.53450 > 99.181.101.239.1935: Flags [.], seq 40692:42006, ack 1, win 501, options [nop,nop,TS val 2274969582 ecr 3869582708], length 1314
21:36:43.889884 IP 10.8.1.8.53450 > 99.181.101.239.1935: Flags [.], seq 42006:43320, ack 1, win 501, options [nop,nop,TS val 2274969618 ecr 3869582708], length 1314
21:36:43.894017 IP 99.181.101.239.1935 > 10.8.1.8.53450: Flags [.], ack 31357, win 126, options [nop,nop,TS val 3869582775 ecr 2274969182], length 0
21:36:43.911414 IP 99.181.101.239.1935 > 10.8.1.8.53450: Flags [.], ack 31494, win 126, options [nop,nop,TS val 3869582793 ecr 2274969232], length 0
21:36:43.911425 IP 10.8.1.8.53450 > 99.181.101.239.1935: Flags [P.], seq 43320:43565, ack 1, win 501, options [nop,nop,TS val 2274969639 ecr 3869582793], length 245
21:36:43.953489 IP 10.8.1.8.53450 > 99.181.101.239.1935: Flags [.], seq 43565:44879, ack 1, win 501, options [nop,nop,TS val 2274969681 ecr 3869582793], length 1314
21:36:43.989299 IP 10.8.1.8.53450 > 99.181.101.239.1935: Flags [.], seq 44879:46193, ack 1, win 501, options [nop,nop,TS val 2274969717 ecr 3869582793], length 1314
21:36:43.994508 IP 99.181.101.239.1935 > 10.8.1.8.53450: Flags [.], ack 34122, win 126, options [nop,nop,TS val 3869582876 ecr 2274969282], length 0
21:36:44.039598 IP 10.8.1.8.53450 > 99.181.101.239.1935: Flags [.], seq 46193:47507, ack 1, win 501, options [nop,nop,TS val 2274969767 ecr 3869582876], length 1314
21:36:44.085465 IP 10.8.1.8.53450 > 99.181.101.239.1935: Flags [.], seq 47507:48821, ack 1, win 501, options [nop,nop,TS val 2274969813 ecr 3869582876], length 1314
21:36:44.090593 IP 99.181.101.239.1935 > 10.8.1.8.53450: Flags [.], ack 36750, win 126, options [nop,nop,TS val 3869582972 ecr 2274969349], length 0
21:36:44.120539 IP 10.8.1.8.53450 > 99.181.101.239.1935: Flags [.], seq 48821:50135, ack 1, win 501, options [nop,nop,TS val 2274969848 ecr 3869582972], length 1314
21:36:44.167866 IP 10.8.1.8.53450 > 99.181.101.239.1935: Flags [.], seq 50135:51449, ack 1, win 501, options [nop,nop,TS val 2274969896 ecr 3869582972], length 1314
21:36:44.170853 IP 99.181.101.239.1935 > 10.8.1.8.53450: Flags [.], ack 39378, win 126, options [nop,nop,TS val 3869583049 ecr 2274969448], length 0
21:36:44.220645 IP 10.8.1.8.53450 > 99.181.101.239.1935: Flags [.], seq 51449:52763, ack 1, win 501, options [nop,nop,TS val 2274969948 ecr 3869583049], length 1314
21:36:44.254130 IP 10.8.1.8.53450 > 99.181.101.239.1935: Flags [.], seq 52763:54077, ack 1, win 501, options [nop,nop,TS val 2274969982 ecr 3869583049], length 1314
21:36:44.264456 IP 99.181.101.239.1935 > 10.8.1.8.53450: Flags [.], ack 42006, win 126, options [nop,nop,TS val 3869583142 ecr 2274969548], length 0
21:36:44.296087 IP 10.8.1.8.53450 > 99.181.101.239.1935: Flags [.], seq 54077:55391, ack 1, win 501, options [nop,nop,TS val 2274970024 ecr 3869583142], length 1314
21:36:44.317387 IP 99.181.101.239.1935 > 10.8.1.8.53450: Flags [.], ack 43565, win 126, options [nop,nop,TS val 3869583199 ecr 2274969618], length 0
21:36:44.317459 IP 10.8.1.8.53450 > 99.181.101.239.1935: Flags [P.], seq 55391:55434, ack 1, win 501, options [nop,nop,TS val 2274970045 ecr 3869583199], length 43
21:36:44.351439 IP 10.8.1.8.53450 > 99.181.101.239.1935: Flags [.], seq 55434:56748, ack 1, win 501, options [nop,nop,TS val 2274970079 ecr 3869583199], length 1314
21:36:44.388319 IP 10.8.1.8.53450 > 99.181.101.239.1935: Flags [.], seq 56748:58062, ack 1, win 501, options [nop,nop,TS val 2274970116 ecr 3869583199], length 1314
21:36:44.398041 IP 99.181.101.239.1935 > 10.8.1.8.53450: Flags [.], ack 46193, win 126, options [nop,nop,TS val 3869583279 ecr 2274969681], length 0
21:36:44.424538 IP 10.8.1.8.53450 > 99.181.101.239.1935: Flags [.], seq 58062:59376, ack 1, win 501, options [nop,nop,TS val 2274970152 ecr 3869583279], length 1314
21:36:44.488748 IP 10.8.1.8.53450 > 99.181.101.239.1935: Flags [.], seq 59376:60690, ack 1, win 501, options [nop,nop,TS val 2274970216 ecr 3869583279], length 1314
21:36:44.491812 IP 99.181.101.239.1935 > 10.8.1.8.53450: Flags [.], ack 48821, win 126, options [nop,nop,TS val 3869583373 ecr 2274969767], length 0
21:36:44.518922 IP 10.8.1.8.53450 > 99.181.101.239.1935: Flags [.], seq 60690:62004, ack 1, win 501, options [nop,nop,TS val 2274970247 ecr 3869583373], length 1314
21:36:44.554914 IP 10.8.1.8.53450 > 99.181.101.239.1935: Flags [.], seq 62004:63318, ack 1, win 501, options [nop,nop,TS val 2274970283 ecr 3869583373], length 1314
21:36:44.573869 IP 99.181.101.239.1935 > 10.8.1.8.53450: Flags [.], ack 51449, win 126, options [nop,nop,TS val 3869583456 ecr 2274969848], length 0
21:36:44.620377 IP 10.8.1.8.53450 > 99.181.101.239.1935: Flags [.], seq 63318:64632, ack 1, win 501, options [nop,nop,TS val 2274970348 ecr 3869583456], length 1314
21:36:44.652117 IP 10.8.1.8.53450 > 99.181.101.239.1935: Flags [.], seq 64632:65946, ack 1, win 501, options [nop,nop,TS val 2274970380 ecr 3869583456], length 1314
21:36:44.661305 IP 99.181.101.239.1935 > 10.8.1.8.53450: Flags [.], ack 54077, win 126, options [nop,nop,TS val 3869583542 ecr 2274969948], length 0
21:36:44.686044 IP 10.8.1.8.53450 > 99.181.101.239.1935: Flags [.], seq 65946:67260, ack 1, win 501, options [nop,nop,TS val 2274970414 ecr 3869583542], length 1314
21:36:44.723855 IP 99.181.101.239.1935 > 10.8.1.8.53450: Flags [.], ack 55434, win 126, options [nop,nop,TS val 3869583605 ecr 2274970024], length 0
21:36:44.723876 IP 10.8.1.8.53450 > 99.181.101.239.1935: Flags [P.], seq 67260:68351, ack 1, win 501, options [nop,nop,TS val 2274970452 ecr 3869583605], length 1091
21:36:44.788605 IP 10.8.1.8.53450 > 99.181.101.239.1935: Flags [.], seq 68351:69665, ack 1, win 501, options [nop,nop,TS val 2274970516 ecr 3869583605], length 1314
21:36:44.794556 IP 99.181.101.239.1935 > 10.8.1.8.53450: Flags [.], ack 58062, win 126, options [nop,nop,TS val 3869583676 ecr 2274970079], length 0
21:36:44.822243 IP 10.8.1.8.53450 > 99.181.101.239.1935: Flags [.], seq 69665:70979, ack 1, win 501, options [nop,nop,TS val 2274970550 ecr 3869583676], length 1314
21:36:44.852566 IP 10.8.1.8.53450 > 99.181.101.239.1935: Flags [.], seq 70979:72293, ack 1, win 501, options [nop,nop,TS val 2274970580 ecr 3869583676], length 1314
21:36:44.896801 IP 99.181.101.239.1935 > 10.8.1.8.53450: Flags [.], ack 60690, win 126, options [nop,nop,TS val 3869583777 ecr 2274970152], length 0
21:36:44.921099 IP 10.8.1.8.53450 > 99.181.101.239.1935: Flags [.], seq 72293:73607, ack 1, win 501, options [nop,nop,TS val 2274970649 ecr 3869583777], length 1314
21:36:44.959087 IP 10.8.1.8.53450 > 99.181.101.239.1935: Flags [.], seq 73607:74921, ack 1, win 501, options [nop,nop,TS val 2274970687 ecr 3869583777], length 1314
21:36:44.960814 IP 99.181.101.239.1935 > 10.8.1.8.53450: Flags [.], ack 63318, win 126, options [nop,nop,TS val 3869583843 ecr 2274970247], length 0
21:36:44.988691 IP 10.8.1.8.53450 > 99.181.101.239.1935: Flags [.], seq 74921:76235, ack 1, win 501, options [nop,nop,TS val 2274970716 ecr 3869583843], length 1314
21:36:45.055143 IP 10.8.1.8.53450 > 99.181.101.239.1935: Flags [.], seq 76235:77549, ack 1, win 501, options [nop,nop,TS val 2274970783 ecr 3869583843], length 1314
21:36:45.058111 IP 99.181.101.239.1935 > 10.8.1.8.53450: Flags [.], ack 65946, win 126, options [nop,nop,TS val 3869583940 ecr 2274970348], length 0
21:36:45.088791 IP 10.8.1.8.53450 > 99.181.101.239.1935: Flags [.], seq 77549:78863, ack 1, win 501, options [nop,nop,TS val 2274970816 ecr 3869583940], length 1314
21:36:45.118970 IP 10.8.1.8.53450 > 99.181.101.239.1935: Flags [.], seq 78863:80177, ack 1, win 501, options [nop,nop,TS val 2274970847 ecr 3869583940], length 1314
21:36:45.129999 IP 99.181.101.239.1935 > 10.8.1.8.53450: Flags [.], ack 68351, win 126, options [nop,nop,TS val 3869584011 ecr 2274970414], length 0
21:36:45.130019 IP 10.8.1.8.53450 > 99.181.101.239.1935: Flags [P.], seq 80177:80223, ack 1, win 501, options [nop,nop,TS val 2274970858 ecr 3869584011], length 46
21:36:45.187831 IP 10.8.1.8.53450 > 99.181.101.239.1935: Flags [.], seq 80223:81537, ack 1, win 501, options [nop,nop,TS val 2274970916 ecr 3869584011], length 1314
21:36:45.222077 IP 10.8.1.8.53450 > 99.181.101.239.1935: Flags [.], seq 81537:82851, ack 1, win 501, options [nop,nop,TS val 2274970950 ecr 3869584011], length 1314
21:36:45.228500 IP 99.181.101.239.1935 > 10.8.1.8.53450: Flags [.], ack 70979, win 126, options [nop,nop,TS val 3869584110 ecr 2274970516], length 0
21:36:45.258761 IP 10.8.1.8.53450 > 99.181.101.239.1935: Flags [.], seq 82851:84165, ack 1, win 501, options [nop,nop,TS val 2274970986 ecr 3869584110], length 1314
21:36:45.322794 IP 10.8.1.8.53450 > 99.181.101.239.1935: Flags [.], seq 84165:85479, ack 1, win 501, options [nop,nop,TS val 2274971050 ecr 3869584110], length 1314
21:36:45.327243 IP 99.181.101.239.1935 > 10.8.1.8.53450: Flags [.], ack 73607, win 126, options [nop,nop,TS val 3869584209 ecr 2274970580], length 0
21:36:45.355531 IP 10.8.1.8.53450 > 99.181.101.239.1935: Flags [.], seq 85479:86793, ack 1, win 501, options [nop,nop,TS val 2274971083 ecr 3869584209], length 1314
21:36:45.388653 IP 10.8.1.8.53450 > 99.181.101.239.1935: Flags [.], seq 86793:88107, ack 1, win 501, options [nop,nop,TS val 2274971116 ecr 3869584209], length 1314
21:36:45.394830 IP 99.181.101.239.1935 > 10.8.1.8.53450: Flags [.], ack 76235, win 126, options [nop,nop,TS val 3869584276 ecr 2274970687], length 0
21:36:45.452865 IP 10.8.1.8.53450 > 99.181.101.239.1935: Flags [.], seq 88107:89421, ack 1, win 501, options [nop,nop,TS val 2274971181 ecr 3869584276], length 1314
21:36:45.494124 IP 10.8.1.8.53450 > 99.181.101.239.1935: Flags [.], seq 89421:90735, ack 1, win 501, options [nop,nop,TS val 2274971222 ecr 3869584276], length 1314
21:36:45.494730 IP 99.181.101.239.1935 > 10.8.1.8.53450: Flags [.], ack 78863, win 126, options [nop,nop,TS val 3869584376 ecr 2274970783], length 0
21:36:45.522040 IP 10.8.1.8.53450 > 99.181.101.239.1935: Flags [.], seq 90735:92049, ack 1, win 501, options [nop,nop,TS val 2274971250 ecr 3869584376], length 1314
21:36:45.535838 IP 99.181.101.239.1935 > 10.8.1.8.53450: Flags [.], ack 80223, win 126, options [nop,nop,TS val 3869584417 ecr 2274970847], length 0
21:36:45.535875 IP 10.8.1.8.53450 > 99.181.101.239.1935: Flags [P.], seq 92049:92199, ack 1, win 501, options [nop,nop,TS val 2274971264 ecr 3869584417], length 150
21:36:45.588557 IP 10.8.1.8.53450 > 99.181.101.239.1935: Flags [.], seq 92199:93513, ack 1, win 501, options [nop,nop,TS val 2274971316 ecr 3869584417], length 1314
21:36:45.622845 IP 10.8.1.8.53450 > 99.181.101.239.1935: Flags [.], seq 93513:94827, ack 1, win 501, options [nop,nop,TS val 2274971351 ecr 3869584417], length 1314
21:36:45.633007 IP 99.181.101.239.1935 > 10.8.1.8.53450: Flags [.], ack 82851, win 126, options [nop,nop,TS val 3869584510 ecr 2274970916], length 0
21:36:45.651057 IP 10.8.1.8.53450 > 99.181.101.239.1935: Flags [.], seq 94827:96141, ack 1, win 501, options [nop,nop,TS val 2274971379 ecr 3869584510], length 1314
21:36:45.721726 IP 10.8.1.8.53450 > 99.181.101.239.1935: Flags [.], seq 96141:97455, ack 1, win 501, options [nop,nop,TS val 2274971449 ecr 3869584510], length 1314
21:36:45.728940 IP 99.181.101.239.1935 > 10.8.1.8.53450: Flags [.], ack 85479, win 126, options [nop,nop,TS val 3869584610 ecr 2274970986], length 0
21:36:45.755530 IP 10.8.1.8.53450 > 99.181.101.239.1935: Flags [.], seq 97455:98769, ack 1, win 501, options [nop,nop,TS val 2274971483 ecr 3869584610], length 1314
21:36:45.793420 IP 10.8.1.8.53450 > 99.181.101.239.1935: Flags [.], seq 98769:100083, ack 1, win 501, options [nop,nop,TS val 2274971521 ecr 3869584610], length 1314
21:36:45.795488 IP 99.181.101.239.1935 > 10.8.1.8.53450: Flags [.], ack 88107, win 126, options [nop,nop,TS val 3869584676 ecr 2274971083], length 0
21:36:45.857459 IP 10.8.1.8.53450 > 99.181.101.239.1935: Flags [.], seq 100083:101397, ack 1, win 501, options [nop,nop,TS val 2274971585 ecr 3869584676], length 1314
21:36:45.888733 IP 10.8.1.8.53450 > 99.181.101.239.1935: Flags [.], seq 101397:102711, ack 1, win 501, options [nop,nop,TS val 2274971616 ecr 3869584676], length 1314
21:36:45.900464 IP 99.181.101.239.1935 > 10.8.1.8.53450: Flags [.], ack 90735, win 126, options [nop,nop,TS val 3869584782 ecr 2274971181], length 0
21:36:45.922034 IP 10.8.1.8.53450 > 99.181.101.239.1935: Flags [.], seq 102711:104025, ack 1, win 501, options [nop,nop,TS val 2274971650 ecr 3869584782], length 1314
21:36:45.950073 IP 99.181.101.239.1935 > 10.8.1.8.53450: Flags [.], ack 92199, win 126, options [nop,nop,TS val 3869584831 ecr 2274971250], length 0
21:36:45.950103 IP 10.8.1.8.53450 > 99.181.101.239.1935: Flags [P.], seq 104025:104257, ack 1, win 501, options [nop,nop,TS val 2274971678 ecr 3869584831], length 232
21:36:45.986557 IP 10.8.1.8.53450 > 99.181.101.239.1935: Flags [.], seq 104257:105571, ack 1, win 501, options [nop,nop,TS val 2274971714 ecr 3869584831], length 1314
21:36:46.028562 IP 10.8.1.8.53450 > 99.181.101.239.1935: Flags [.], seq 105571:106885, ack 1, win 501, options [nop,nop,TS val 2274971756 ecr 3869584831], length 1314
21:36:46.029753 IP 99.181.101.239.1935 > 10.8.1.8.53450: Flags [.], ack 94827, win 126, options [nop,nop,TS val 3869584910 ecr 2274971316], length 0
21:36:46.071006 IP 10.8.1.8.53450 > 99.181.101.239.1935: Flags [.], seq 106885:108199, ack 1, win 501, options [nop,nop,TS val 2274971799 ecr 3869584910], length 1314
21:36:46.119661 IP 10.8.1.8.53450 > 99.181.101.239.1935: Flags [.], seq 108199:109513, ack 1, win 501, options [nop,nop,TS val 2274971847 ecr 3869584910], length 1314
21:36:46.124999 IP 99.181.101.239.1935 > 10.8.1.8.53450: Flags [.], ack 96141, win 126, options [nop,nop,TS val 3869585007 ecr 2274971379], length 0
21:36:46.156443 IP 10.8.1.8.53450 > 99.181.101.239.1935: Flags [.], seq 109513:110827, ack 1, win 501, options [nop,nop,TS val 2274971884 ecr 3869585007], length 1314
21:36:46.162489 IP 99.181.101.239.1935 > 10.8.1.8.53450: Flags [.], ack 98769, win 126, options [nop,nop,TS val 3869585043 ecr 2274971449], length 0
21:36:46.199378 IP 10.8.1.8.53450 > 99.181.101.239.1935: Flags [.], seq 110827:112141, ack 1, win 501, options [nop,nop,TS val 2274971927 ecr 3869585043], length 1314
21:36:46.255401 IP 10.8.1.8.53450 > 99.181.101.239.1935: Flags [.], seq 112141:113455, ack 1, win 501, options [nop,nop,TS val 2274971983 ecr 3869585043], length 1314
21:36:46.264356 IP 99.181.101.239.1935 > 10.8.1.8.53450: Flags [.], ack 101397, win 126, options [nop,nop,TS val 3869585145 ecr 2274971521], length 0
21:36:46.288972 IP 10.8.1.8.53450 > 99.181.101.239.1935: Flags [.], seq 113455:114769, ack 1, win 501, options [nop,nop,TS val 2274972017 ecr 3869585145], length 1314
21:36:46.328225 IP 10.8.1.8.53450 > 99.181.101.239.1935: Flags [.], seq 114769:116083, ack 1, win 501, options [nop,nop,TS val 2274972056 ecr 3869585145], length 1314
21:36:46.332060 IP 99.181.101.239.1935 > 10.8.1.8.53450: Flags [.], ack 104025, win 126, options [nop,nop,TS val 3869585210 ecr 2274971616], length 0
21:36:46.358894 IP 99.181.101.239.1935 > 10.8.1.8.53450: Flags [.], ack 104257, win 126, options [nop,nop,TS val 3869585237 ecr 2274971678], length 0
21:36:46.358918 IP 10.8.1.8.53450 > 99.181.101.239.1935: Flags [P.], seq 116083:117081, ack 1, win 501, options [nop,nop,TS val 2274972087 ecr 3869585237], length 998
21:36:46.422635 IP 10.8.1.8.53450 > 99.181.101.239.1935: Flags [.], seq 117081:118395, ack 1, win 501, options [nop,nop,TS val 2274972150 ecr 3869585237], length 1314
21:36:46.441690 IP 99.181.101.239.1935 > 10.8.1.8.53450: Flags [.], ack 106885, win 126, options [nop,nop,TS val 3869585316 ecr 2274971714], length 0
21:36:46.456678 IP 10.8.1.8.53450 > 99.181.101.239.1935: Flags [.], seq 118395:119709, ack 1, win 501, options [nop,nop,TS val 2274972184 ecr 3869585316], length 1314
21:36:46.488888 IP 10.8.1.8.53450 > 99.181.101.239.1935: Flags [.], seq 119709:121023, ack 1, win 501, options [nop,nop,TS val 2274972217 ecr 3869585316], length 1314
21:36:46.527572 IP 99.181.101.239.1935 > 10.8.1.8.53450: Flags [.], ack 109513, win 126, options [nop,nop,TS val 3869585407 ecr 2274971799], length 0
21:36:46.564212 IP 10.8.1.8.53450 > 99.181.101.239.1935: Flags [.], seq 121023:122337, ack 1, win 501, options [nop,nop,TS val 2274972292 ecr 3869585407], length 1314
21:36:46.588528 IP 10.8.1.8.53450 > 99.181.101.239.1935: Flags [.], seq 122337:123651, ack 1, win 501, options [nop,nop,TS val 2274972316 ecr 3869585407], length 1314
21:36:46.605524 IP 99.181.101.239.1935 > 10.8.1.8.53450: Flags [.], ack 112141, win 126, options [nop,nop,TS val 3869585487 ecr 2274971884], length 0
21:36:46.628662 IP 10.8.1.8.53450 > 99.181.101.239.1935: Flags [.], seq 123651:124965, ack 1, win 501, options [nop,nop,TS val 2274972356 ecr 3869585487], length 1314
21:36:46.693330 IP 10.8.1.8.53450 > 99.181.101.239.1935: Flags [.], seq 124965:126279, ack 1, win 501, options [nop,nop,TS val 2274972421 ecr 3869585487], length 1314
21:36:46.695850 IP 99.181.101.239.1935 > 10.8.1.8.53450: Flags [.], ack 114769, win 126, options [nop,nop,TS val 3869585576 ecr 2274971983], length 0
21:36:46.715299 IP 10.8.1.8.53450 > 99.181.101.239.1935: Flags [.], seq 126279:127593, ack 1, win 501, options [nop,nop,TS val 2274972443 ecr 3869585576], length 1314
21:36:46.755305 IP 10.8.1.8.53450 > 99.181.101.239.1935: Flags [.], seq 127593:128907, ack 1, win 501, options [nop,nop,TS val 2274972483 ecr 3869585576], length 1314
21:36:46.764893 IP 99.181.101.239.1935 > 10.8.1.8.53450: Flags [.], ack 117081, win 126, options [nop,nop,TS val 3869585647 ecr 2274972056], length 0
21:36:46.764935 IP 10.8.1.8.53450 > 99.181.101.239.1935: Flags [P.], seq 128907:129143, ack 1, win 501, options [nop,nop,TS val 2274972493 ecr 3869585647], length 236
21:36:46.822577 IP 10.8.1.8.53450 > 99.181.101.239.1935: Flags [.], seq 129143:130457, ack 1, win 501, options [nop,nop,TS val 2274972550 ecr 3869585647], length 1314
21:36:46.855364 IP 10.8.1.8.53450 > 99.181.101.239.1935: Flags [.], seq 130457:131771, ack 1, win 501, options [nop,nop,TS val 2274972583 ecr 3869585647], length 1314
21:36:46.863015 IP 99.181.101.239.1935 > 10.8.1.8.53450: Flags [.], ack 119709, win 126, options [nop,nop,TS val 3869585744 ecr 2274972150], length 0
21:36:46.888949 IP 10.8.1.8.53450 > 99.181.101.239.1935: Flags [.], seq 131771:133085, ack 1, win 501, options [nop,nop,TS val 2274972617 ecr 3869585744], length 1314
21:36:46.951773 IP 10.8.1.8.53450 > 99.181.101.239.1935: Flags [.], seq 133085:134399, ack 1, win 501, options [nop,nop,TS val 2274972679 ecr 3869585744], length 1314
21:36:46.969089 IP 99.181.101.239.1935 > 10.8.1.8.53450: Flags [.], ack 121023, win 126, options [nop,nop,TS val 3869585851 ecr 2274972217], length 0
21:36:46.988632 IP 10.8.1.8.53450 > 99.181.101.239.1935: Flags [.], seq 134399:135713, ack 1, win 501, options [nop,nop,TS val 2274972716 ecr 3869585851], length 1314
21:36:46.995524 IP 99.181.101.239.1935 > 10.8.1.8.53450: Flags [.], ack 123651, win 126, options [nop,nop,TS val 3869585876 ecr 2274972292], length 0
21:36:47.020499 IP 10.8.1.8.53450 > 99.181.101.239.1935: Flags [.], seq 135713:137027, ack 1, win 501, options [nop,nop,TS val 2274972748 ecr 3869585876], length 1314
21:36:47.087178 IP 10.8.1.8.53450 > 99.181.101.239.1935: Flags [.], seq 137027:138341, ack 1, win 501, options [nop,nop,TS val 2274972815 ecr 3869585876], length 1314
21:36:47.102356 IP 99.181.101.239.1935 > 10.8.1.8.53450: Flags [.], ack 126279, win 126, options [nop,nop,TS val 3869585981 ecr 2274972356], length 0
21:36:47.120261 IP 10.8.1.8.53450 > 99.181.101.239.1935: Flags [.], seq 138341:139655, ack 1, win 501, options [nop,nop,TS val 2274972848 ecr 3869585981], length 1314
21:36:47.152119 IP 10.8.1.8.53450 > 99.181.101.239.1935: Flags [.], seq 139655:140969, ack 1, win 501, options [nop,nop,TS val 2274972880 ecr 3869585981], length 1314
21:36:47.164323 IP 99.181.101.239.1935 > 10.8.1.8.53450: Flags [.], ack 128907, win 126, options [nop,nop,TS val 3869586043 ecr 2274972443], length 0
21:36:47.174292 IP 99.181.101.239.1935 > 10.8.1.8.53450: Flags [.], ack 129143, win 126, options [nop,nop,TS val 3869586052 ecr 2274972493], length 0
21:36:47.174305 IP 10.8.1.8.53450 > 99.181.101.239.1935: Flags [P.], seq 140969:141115, ack 1, win 501, options [nop,nop,TS val 2274972902 ecr 3869586052], length 146
21:36:47.219633 IP 10.8.1.8.53450 > 99.181.101.239.1935: Flags [.], seq 141115:142429, ack 1, win 501, options [nop,nop,TS val 2274972947 ecr 3869586052], length 1314
21:36:47.250619 IP 10.8.1.8.53450 > 99.181.101.239.1935: Flags [.], seq 142429:143743, ack 1, win 501, options [nop,nop,TS val 2274972978 ecr 3869586052], length 1314
21:36:47.275885 IP 99.181.101.239.1935 > 10.8.1.8.53450: Flags [.], ack 131771, win 126, options [nop,nop,TS val 3869586143 ecr 2274972550], length 0
21:36:47.293569 IP 10.8.1.8.53450 > 99.181.101.239.1935: Flags [.], seq 143743:145057, ack 1, win 501, options [nop,nop,TS val 2274973021 ecr 3869586143], length 1314
21:36:47.355475 IP 10.8.1.8.53450 > 99.181.101.239.1935: Flags [.], seq 145057:146371, ack 1, win 501, options [nop,nop,TS val 2274973083 ecr 3869586143], length 1314
21:36:47.364683 IP 99.181.101.239.1935 > 10.8.1.8.53450: Flags [.], ack 134399, win 126, options [nop,nop,TS val 3869586239 ecr 2274972617], length 0
21:36:47.384383 IP 10.8.1.8.53450 > 99.181.101.239.1935: Flags [.], seq 146371:147685, ack 1, win 501, options [nop,nop,TS val 2274973112 ecr 3869586239], length 1314
21:36:47.421535 IP 10.8.1.8.53450 > 99.181.101.239.1935: Flags [.], seq 147685:148999, ack 1, win 501, options [nop,nop,TS val 2274973149 ecr 3869586239], length 1314
21:36:47.426640 IP 99.181.101.239.1935 > 10.8.1.8.53450: Flags [.], ack 137027, win 126, options [nop,nop,TS val 3869586308 ecr 2274972716], length 0
21:36:47.484739 IP 10.8.1.8.53450 > 99.181.101.239.1935: Flags [.], seq 148999:150313, ack 1, win 501, options [nop,nop,TS val 2274973212 ecr 3869586308], length 1314
21:36:47.521772 IP 10.8.1.8.53450 > 99.181.101.239.1935: Flags [.], seq 150313:151627, ack 1, win 501, options [nop,nop,TS val 2274973249 ecr 3869586308], length 1314
21:36:47.526333 IP 99.181.101.239.1935 > 10.8.1.8.53450: Flags [.], ack 139655, win 126, options [nop,nop,TS val 3869586408 ecr 2274972815], length 0
21:36:47.555403 IP 10.8.1.8.53450 > 99.181.101.239.1935: Flags [.], seq 151627:152941, ack 1, win 501, options [nop,nop,TS val 2274973283 ecr 3869586408], length 1314
21:36:47.580344 IP 99.181.101.239.1935 > 10.8.1.8.53450: Flags [.], ack 141115, win 126, options [nop,nop,TS val 3869586462 ecr 2274972880], length 0
21:36:47.580381 IP 10.8.1.8.53450 > 99.181.101.239.1935: Flags [P.], seq 152941:153082, ack 1, win 501, options [nop,nop,TS val 2274973308 ecr 3869586462], length 141
21:36:47.620083 IP 10.8.1.8.53450 > 99.181.101.239.1935: Flags [.], seq 153082:154396, ack 1, win 501, options [nop,nop,TS val 2274973348 ecr 3869586462], length 1314
21:36:47.651085 IP 10.8.1.8.53450 > 99.181.101.239.1935: Flags [.], seq 154396:155710, ack 1, win 501, options [nop,nop,TS val 2274973379 ecr 3869586462], length 1314
21:36:47.656923 IP 99.181.101.239.1935 > 10.8.1.8.53450: Flags [.], ack 143743, win 126, options [nop,nop,TS val 3869586538 ecr 2274972947], length 0
21:36:47.698377 IP 10.8.1.8.53450 > 99.181.101.239.1935: Flags [.], seq 155710:157024, ack 1, win 501, options [nop,nop,TS val 2274973426 ecr 3869586538], length 1314
21:36:47.755397 IP 10.8.1.8.53450 > 99.181.101.239.1935: Flags [.], seq 157024:158338, ack 1, win 501, options [nop,nop,TS val 2274973483 ecr 3869586538], length 1314
21:36:47.762476 IP 99.181.101.239.1935 > 10.8.1.8.53450: Flags [.], ack 146371, win 126, options [nop,nop,TS val 3869586643 ecr 2274973021], length 0
21:36:47.783991 IP 10.8.1.8.53450 > 99.181.101.239.1935: Flags [.], seq 158338:159652, ack 1, win 501, options [nop,nop,TS val 2274973512 ecr 3869586643], length 1314
21:36:47.826461 IP 10.8.1.8.53450 > 99.181.101.239.1935: Flags [.], seq 159652:160966, ack 1, win 501, options [nop,nop,TS val 2274973554 ecr 3869586643], length 1314
21:36:47.829072 IP 99.181.101.239.1935 > 10.8.1.8.53450: Flags [.], ack 148999, win 126, options [nop,nop,TS val 3869586709 ecr 2274973112], length 0
21:36:47.888583 IP 10.8.1.8.53450 > 99.181.101.239.1935: Flags [.], seq 160966:162280, ack 1, win 501, options [nop,nop,TS val 2274973616 ecr 3869586709], length 1314
21:36:47.921895 IP 10.8.1.8.53450 > 99.181.101.239.1935: Flags [.], seq 162280:163594, ack 1, win 501, options [nop,nop,TS val 2274973650 ecr 3869586709], length 1314
21:36:47.945681 IP 99.181.101.239.1935 > 10.8.1.8.53450: Flags [.], ack 151627, win 126, options [nop,nop,TS val 3869586809 ecr 2274973212], length 0
21:36:47.955411 IP 10.8.1.8.53450 > 99.181.101.239.1935: Flags [.], seq 163594:164908, ack 1, win 501, options [nop,nop,TS val 2274973683 ecr 3869586809], length 1314
21:36:47.986761 IP 99.181.101.239.1935 > 10.8.1.8.53450: Flags [.], ack 153082, win 126, options [nop,nop,TS val 3869586868 ecr 2274973283], length 0
21:36:47.986813 IP 10.8.1.8.53450 > 99.181.101.239.1935: Flags [P.], seq 164908:165053, ack 1, win 501, options [nop,nop,TS val 2274973715 ecr 3869586868], length 145
21:36:48.020061 IP 10.8.1.8.53450 > 99.181.101.239.1935: Flags [.], seq 165053:166367, ack 1, win 501, options [nop,nop,TS val 2274973748 ecr 3869586868], length 1314
21:36:48.052459 IP 10.8.1.8.53450 > 99.181.101.239.1935: Flags [.], seq 166367:167681, ack 1, win 501, options [nop,nop,TS val 2274973780 ecr 3869586868], length 1314
21:36:48.069861 IP 99.181.101.239.1935 > 10.8.1.8.53450: Flags [.], ack 155710, win 126, options [nop,nop,TS val 3869586951 ecr 2274973348], length 0
21:36:48.105386 IP 10.8.1.8.53450 > 99.181.101.239.1935: Flags [.], seq 167681:168995, ack 1, win 501, options [nop,nop,TS val 2274973833 ecr 3869586951], length 1314
21:36:48.154296 IP 10.8.1.8.53450 > 99.181.101.239.1935: Flags [.], seq 168995:170309, ack 1, win 501, options [nop,nop,TS val 2274973882 ecr 3869586951], length 1314
21:36:48.161896 IP 99.181.101.239.1935 > 10.8.1.8.53450: Flags [.], ack 158338, win 126, options [nop,nop,TS val 3869587043 ecr 2274973426], length 0
21:36:48.184430 IP 10.8.1.8.53450 > 99.181.101.239.1935: Flags [.], seq 170309:171623, ack 1, win 501, options [nop,nop,TS val 2274973912 ecr 3869587043], length 1314
21:36:48.233003 IP 10.8.1.8.53450 > 99.181.101.239.1935: Flags [.], seq 171623:172937, ack 1, win 501, options [nop,nop,TS val 2274973961 ecr 3869587043], length 1314
21:36:48.233686 IP 99.181.101.239.1935 > 10.8.1.8.53450: Flags [.], ack 160966, win 126, options [nop,nop,TS val 3869587114 ecr 2274973512], length 0
21:36:48.288528 IP 10.8.1.8.53450 > 99.181.101.239.1935: Flags [.], seq 172937:174251, ack 1, win 501, options [nop,nop,TS val 2274974016 ecr 3869587114], length 1314
21:36:48.318902 IP 10.8.1.8.53450 > 99.181.101.239.1935: Flags [.], seq 174251:175565, ack 1, win 501, options [nop,nop,TS val 2274974047 ecr 3869587114], length 1314
21:36:48.334607 IP 99.181.101.239.1935 > 10.8.1.8.53450: Flags [.], ack 163594, win 126, options [nop,nop,TS val 3869587209 ecr 2274973616], length 0
21:36:48.361563 IP 10.8.1.8.53450 > 99.181.101.239.1935: Flags [.], seq 175565:176879, ack 1, win 501, options [nop,nop,TS val 2274974089 ecr 3869587209], length 1314
21:36:48.398982 IP 99.181.101.239.1935 > 10.8.1.8.53450: Flags [.], ack 165053, win 126, options [nop,nop,TS val 3869587274 ecr 2274973683], length 0
21:36:48.399020 IP 10.8.1.8.53450 > 99.181.101.239.1935: Flags [P.], seq 176879:177874, ack 1, win 501, options [nop,nop,TS val 2274974127 ecr 3869587274], length 995
21:36:48.455489 IP 10.8.1.8.53450 > 99.181.101.239.1935: Flags [.], seq 177874:179188, ack 1, win 501, options [nop,nop,TS val 2274974183 ecr 3869587274], length 1314
21:36:48.462489 IP 99.181.101.239.1935 > 10.8.1.8.53450: Flags [.], ack 167681, win 126, options [nop,nop,TS val 3869587340 ecr 2274973748], length 0
21:36:48.486103 IP 10.8.1.8.53450 > 99.181.101.239.1935: Flags [.], seq 179188:180502, ack 1, win 501, options [nop,nop,TS val 2274974214 ecr 3869587340], length 1314
21:36:48.521775 IP 10.8.1.8.53450 > 99.181.101.239.1935: Flags [.], seq 180502:181816, ack 1, win 501, options [nop,nop,TS val 2274974249 ecr 3869587340], length 1314
21:36:48.560979 IP 99.181.101.239.1935 > 10.8.1.8.53450: Flags [.], ack 170309, win 126, options [nop,nop,TS val 3869587442 ecr 2274973833], length 0
21:36:48.588827 IP 10.8.1.8.53450 > 99.181.101.239.1935: Flags [.], seq 181816:183130, ack 1, win 501, options [nop,nop,TS val 2274974317 ecr 3869587442], length 1314
21:36:48.618844 IP 10.8.1.8.53450 > 99.181.101.239.1935: Flags [.], seq 183130:184444, ack 1, win 501, options [nop,nop,TS val 2274974347 ecr 3869587442], length 1314
21:36:48.639299 IP 99.181.101.239.1935 > 10.8.1.8.53450: Flags [.], ack 172937, win 126, options [nop,nop,TS val 3869587521 ecr 2274973912], length 0
21:36:48.651492 IP 10.8.1.8.53450 > 99.181.101.239.1935: Flags [.], seq 184444:185758, ack 1, win 501, options [nop,nop,TS val 2274974379 ecr 3869587521], length 1314
21:36:48.717686 IP 10.8.1.8.53450 > 99.181.101.239.1935: Flags [.], seq 185758:187072, ack 1, win 501, options [nop,nop,TS val 2274974445 ecr 3869587521], length 1314
21:36:48.725285 IP 99.181.101.239.1935 > 10.8.1.8.53450: Flags [.], ack 175565, win 126, options [nop,nop,TS val 3869587607 ecr 2274974016], length 0
21:36:48.752661 IP 10.8.1.8.53450 > 99.181.101.239.1935: Flags [.], seq 187072:188386, ack 1, win 501, options [nop,nop,TS val 2274974480 ecr 3869587607], length 1314
21:36:48.788327 IP 10.8.1.8.53450 > 99.181.101.239.1935: Flags [.], seq 188386:189700, ack 1, win 501, options [nop,nop,TS val 2274974516 ecr 3869587607], length 1314
21:36:48.807005 IP 99.181.101.239.1935 > 10.8.1.8.53450: Flags [.], ack 177874, win 126, options [nop,nop,TS val 3869587689 ecr 2274974089], length 0
21:36:48.807042 IP 10.8.1.8.53450 > 99.181.101.239.1935: Flags [P.], seq 189700:189845, ack 1, win 501, options [nop,nop,TS val 2274974535 ecr 3869587689], length 145
21:36:48.853849 IP 10.8.1.8.53450 > 99.181.101.239.1935: Flags [.], seq 189845:191159, ack 1, win 501, options [nop,nop,TS val 2274974582 ecr 3869587689], length 1314
21:36:48.886083 IP 10.8.1.8.53450 > 99.181.101.239.1935: Flags [.], seq 191159:192473, ack 1, win 501, options [nop,nop,TS val 2274974614 ecr 3869587689], length 1314
21:36:48.906630 IP 99.181.101.239.1935 > 10.8.1.8.53450: Flags [.], ack 180502, win 126, options [nop,nop,TS val 3869587782 ecr 2274974183], length 0
21:36:48.917796 IP 10.8.1.8.53450 > 99.181.101.239.1935: Flags [.], seq 192473:193787, ack 1, win 501, options [nop,nop,TS val 2274974645 ecr 3869587782], length 1314
21:36:48.988684 IP 10.8.1.8.53450 > 99.181.101.239.1935: Flags [.], seq 193787:195101, ack 1, win 501, options [nop,nop,TS val 2274974716 ecr 3869587782], length 1314
21:36:48.997691 IP 99.181.101.239.1935 > 10.8.1.8.53450: Flags [.], ack 183130, win 126, options [nop,nop,TS val 3869587877 ecr 2274974249], length 0
21:36:49.020206 IP 10.8.1.8.53450 > 99.181.101.239.1935: Flags [.], seq 195101:196415, ack 1, win 501, options [nop,nop,TS val 2274974748 ecr 3869587877], length 1314
21:36:49.052248 IP 10.8.1.8.53450 > 99.181.101.239.1935: Flags [.], seq 196415:197729, ack 1, win 501, options [nop,nop,TS val 2274974780 ecr 3869587877], length 1314
21:36:49.057450 IP 99.181.101.239.1935 > 10.8.1.8.53450: Flags [.], ack 185758, win 126, options [nop,nop,TS val 3869587939 ecr 2274974347], length 0
21:36:49.122051 IP 10.8.1.8.53450 > 99.181.101.239.1935: Flags [.], seq 197729:199043, ack 1, win 501, options [nop,nop,TS val 2274974850 ecr 3869587939], length 1314
21:36:49.152734 IP 10.8.1.8.53450 > 99.181.101.239.1935: Flags [.], seq 199043:200357, ack 1, win 501, options [nop,nop,TS val 2274974880 ecr 3869587939], length 1314
21:36:49.158358 IP 99.181.101.239.1935 > 10.8.1.8.53450: Flags [.], ack 188386, win 126, options [nop,nop,TS val 3869588040 ecr 2274974445], length 0
