11:55:53.701122 IP 10.8.0.2.38632 > 52.223.199.31.1935: Flags [.], seq 1942358860:1942360174, ack 1984457693, win 501, options [nop,nop,TS val 1304496570 ecr 495508664], length 1314
11:55:53.702359 IP 52.223.199.31.1935 > 10.8.0.2.38632: Flags [.], ack 4294960605, win 126, options [nop,nop,TS val 495508730 ecr 1304496270], length 0
11:55:53.705205 IP 52.223.199.31.1935 > 10.8.0.2.38632: Flags [.], ack 4294960726, win 126, options [nop,nop,TS val 495508733 ecr 1304496305], length 0
11:55:53.705229 IP 10.8.0.2.38632 > 52.223.199.31.1935: Flags [P.], seq 1314:1445, ack 1, win 501, options [nop,nop,TS val 1304496574 ecr 495508733], length 131
11:55:53.765601 IP 10.8.0.2.38632 > 52.223.199.31.1935: Flags [.], seq 1445:2759, ack 1, win 501, options [nop,nop,TS val 1304496634 ecr 495508733], length 1314
11:55:53.802630 IP 10.8.0.2.38632 > 52.223.199.31.1935: Flags [.], seq 2759:4073, ack 1, win 501, options [nop,nop,TS val 1304496671 ecr 495508733], length 1314
11:55:53.806327 IP 52.223.199.31.1935 > 10.8.0.2.38632: Flags [.], ack 4294963354, win 126, options [nop,nop,TS val 495508834 ecr 1304496370], length 0
11:55:53.833466 IP 10.8.0.2.38632 > 52.223.199.31.1935: Flags [.], seq 4073:5387, ack 1, win 501, options [nop,nop,TS val 1304496702 ecr 495508834], length 1314
11:55:53.900815 IP 10.8.0.2.38632 > 52.223.199.31.1935: Flags [.], seq 5387:6701, ack 1, win 501, options [nop,nop,TS val 1304496770 ecr 495508834], length 1314
11:55:53.904134 IP 52.223.199.31.1935 > 10.8.0.2.38632: Flags [.], ack 4294964668, win 126, options [nop,nop,TS val 495508932 ecr 1304496438], length 0
11:55:53.935476 IP 52.223.199.31.1935 > 10.8.0.2.38632: Flags [.], ack 0, win 126, options [nop,nop,TS val 495508963 ecr 1304496505], length 0
11:55:53.935863 IP 10.8.0.2.38632 > 52.223.199.31.1935: Flags [.], seq 6701:8015, ack 1, win 501, options [nop,nop,TS val 1304496805 ecr 495508963], length 1314
11:55:53.971197 IP 10.8.0.2.38632 > 52.223.199.31.1935: Flags [.], seq 8015:9329, ack 1, win 501, options [nop,nop,TS val 1304496840 ecr 495508963], length 1314
11:55:53.973415 IP 52.223.199.31.1935 > 10.8.0.2.38632: Flags [.], ack 1445, win 126, options [nop,nop,TS val 495509001 ecr 1304496570], length 0
11:55:53.973451 IP 10.8.0.2.38632 > 52.223.199.31.1935: Flags [P.], seq 9329:9368, ack 1, win 501, options [nop,nop,TS val 1304496842 ecr 495509001], length 39
11:55:54.037267 IP 10.8.0.2.38632 > 52.223.199.31.1935: Flags [.], seq 9368:10682, ack 1, win 501, options [nop,nop,TS val 1304496906 ecr 495509001], length 1314
11:55:54.070895 IP 10.8.0.2.38632 > 52.223.199.31.1935: Flags [.], seq 10682:11996, ack 1, win 501, options [nop,nop,TS val 1304496940 ecr 495509001], length 1314
11:55:54.071146 IP 52.223.199.31.1935 > 10.8.0.2.38632: Flags [.], ack 4073, win 126, options [nop,nop,TS val 495509099 ecr 1304496634], length 0
11:55:54.104269 IP 10.8.0.2.38632 > 52.223.199.31.1935: Flags [.], seq 11996:13310, ack 1, win 501, options [nop,nop,TS val 1304496973 ecr 495509099], length 1314
11:55:54.167512 IP 10.8.0.2.38632 > 52.223.199.31.1935: Flags [.], seq 13310:14624, ack 1, win 501, options [nop,nop,TS val 1304497036 ecr 495509099], length 1314
11:55:54.169468 IP 52.223.199.31.1935 > 10.8.0.2.38632: Flags [.], ack 6701, win 126, options [nop,nop,TS val 495509197 ecr 1304496702], length 0
11:55:54.200801 IP 10.8.0.2.38632 > 52.223.199.31.1935: Flags [.], seq 14624:15938, ack 1, win 501, options [nop,nop,TS val 1304497069 ecr 495509197], length 1314
11:55:54.233975 IP 10.8.0.2.38632 > 52.223.199.31.1935: Flags [.], seq 15938:17252, ack 1, win 501, options [nop,nop,TS val 1304497103 ecr 495509197], length 1314
11:55:54.240126 IP 52.223.199.31.1935 > 10.8.0.2.38632: Flags [.], ack 9329, win 126, options [nop,nop,TS val 495509268 ecr 1304496805], length 0
11:55:54.242102 IP 52.223.199.31.1935 > 10.8.0.2.38632: Flags [.], ack 9368, win 126, options [nop,nop,TS val 495509270 ecr 1304496842], length 0
11:55:54.242110 IP 10.8.0.2.38632 > 52.223.199.31.1935: Flags [P.], seq 17252:17373, ack 1, win 501, options [nop,nop,TS val 1304497111 ecr 495509270], length 121
11:55:54.298191 IP 10.8.0.2.38632 > 52.223.199.31.1935: Flags [.], seq 17373:18687, ack 1, win 501, options [nop,nop,TS val 1304497167 ecr 495509270], length 1314
11:55:54.336218 IP 10.8.0.2.38632 > 52.223.199.31.1935: Flags [.], seq 18687:20001, ack 1, win 501, options [nop,nop,TS val 1304497205 ecr 495509270], length 1314
11:55:54.341476 IP 52.223.199.31.1935 > 10.8.0.2.38632: Flags [.], ack 11996, win 126, options [nop,nop,TS val 495509368 ecr 1304496906], length 0
11:55:54.369918 IP 10.8.0.2.38632 > 52.223.199.31.1935: Flags [.], seq 20001:21315, ack 1, win 501, options [nop,nop,TS val 1304497239 ecr 495509368], length 1314
11:55:54.435660 IP 10.8.0.2.38632 > 52.223.199.31.1935: Flags [.], seq 21315:22629, ack 1, win 501, options [nop,nop,TS val 1304497304 ecr 495509368], length 1314
11:55:54.435979 IP 52.223.199.31.1935 > 10.8.0.2.38632: Flags [.], ack 14624, win 126, options [nop,nop,TS val 495509464 ecr 1304496973], length 0
11:55:54.468172 IP 10.8.0.2.38632 > 52.223.199.31.1935: Flags [.], seq 22629:23943, ack 1, win 501, options [nop,nop,TS val 1304497337 ecr 495509464], length 1314
11:55:54.502815 IP 52.223.199.31.1935 > 10.8.0.2.38632: Flags [.], ack 17252, win 126, options [nop,nop,TS val 495509531 ecr 1304497069], length 0
11:55:54.504495 IP 10.8.0.2.38632 > 52.223.199.31.1935: Flags [.], seq 23943:25257, ack 1, win 501, options [nop,nop,TS val 1304497373 ecr 495509531], length 1314
11:55:54.510288 IP 52.223.199.31.1935 > 10.8.0.2.38632: Flags [.], ack 17373, win 126, options [nop,nop,TS val 495509538 ecr 1304497111], length 0
11:55:54.510316 IP 10.8.0.2.38632 > 52.223.199.31.1935: Flags [P.], seq 25257:25289, ack 1, win 501, options [nop,nop,TS val 1304497379 ecr 495509538], length 32
11:55:54.569528 IP 10.8.0.2.38632 > 52.223.199.31.1935: Flags [.], seq 25289:26603, ack 1, win 501, options [nop,nop,TS val 1304497438 ecr 495509538], length 1314
11:55:54.604632 IP 10.8.0.2.38632 > 52.223.199.31.1935: Flags [.], seq 26603:27917, ack 1, win 501, options [nop,nop,TS val 1304497473 ecr 495509538], length 1314
11:55:54.604786 IP 52.223.199.31.1935 > 10.8.0.2.38632: Flags [.], ack 20001, win 126, options [nop,nop,TS val 495509632 ecr 1304497167], length 0
11:55:54.637657 IP 10.8.0.2.38632 > 52.223.199.31.1935: Flags [.], seq 27917:29231, ack 1, win 501, options [nop,nop,TS val 1304497506 ecr 495509632], length 1314
11:55:54.703713 IP 10.8.0.2.38632 > 52.223.199.31.1935: Flags [.], seq 29231:30545, ack 1, win 501, options [nop,nop,TS val 1304497572 ecr 495509632], length 1314
11:55:54.704128 IP 52.223.199.31.1935 > 10.8.0.2.38632: Flags [.], ack 21315, win 126, options [nop,nop,TS val 495509732 ecr 1304497239], length 0
11:55:54.737618 IP 52.223.199.31.1935 > 10.8.0.2.38632: Flags [.], ack 23943, win 126, options [nop,nop,TS val 495509765 ecr 1304497304], length 0
11:55:54.737679 IP 10.8.0.2.38632 > 52.223.199.31.1935: Flags [.], seq 30545:31859, ack 1, win 501, options [nop,nop,TS val 1304497606 ecr 495509765], length 1314
11:55:54.768033 IP 10.8.0.2.38632 > 52.223.199.31.1935: Flags [.], seq 31859:33173, ack 1, win 501, options [nop,nop,TS val 1304497637 ecr 495509765], length 1314
11:55:54.778256 IP 52.223.199.31.1935 > 10.8.0.2.38632: Flags [.], ack 25289, win 126, options [nop,nop,TS val 495509806 ecr 1304497373], length 0
11:55:54.778292 IP 10.8.0.2.38632 > 52.223.199.31.1935: Flags [P.], seq 33173:33307, ack 1, win 501, options [nop,nop,TS val 1304497647 ecr 495509806], length 134
11:55:54.831930 IP 10.8.0.2.38632 > 52.223.199.31.1935: Flags [.], seq 33307:34621, ack 1, win 501, options [nop,nop,TS val 1304497701 ecr 495509806], length 1314
11:55:54.871839 IP 10.8.0.2.38632 > 52.223.199.31.1935: Flags [.], seq 34621:35935, ack 1, win 501, options [nop,nop,TS val 1304497741 ecr 495509806], length 1314
11:55:54.873967 IP 52.223.199.31.1935 > 10.8.0.2.38632: Flags [.], ack 27917, win 126, options [nop,nop,TS val 495509902 ecr 1304497438], length 0
11:55:54.905525 IP 10.8.0.2.38632 > 52.223.199.31.1935: Flags [.], seq 35935:37249, ack 1, win 501, options [nop,nop,TS val 1304497774 ecr 495509902], length 1314
11:55:54.971762 IP 10.8.0.2.38632 > 52.223.199.31.1935: Flags [.], seq 37249:38563, ack 1, win 501, options [nop,nop,TS val 1304497840 ecr 495509902], length 1314
11:55:54.972545 IP 52.223.199.31.1935 > 10.8.0.2.38632: Flags [.], ack 30545, win 126, options [nop,nop,TS val 495510000 ecr 1304497506], length 0
11:55:55.003032 IP 10.8.0.2.38632 > 52.223.199.31.1935: Flags [.], seq 38563:39877, ack 1, win 501, options [nop,nop,TS val 1304497872 ecr 495510000], length 1314
11:55:55.036456 IP 10.8.0.2.38632 > 52.223.199.31.1935: Flags [.], seq 39877:41191, ack 1, win 501, options [nop,nop,TS val 1304497905 ecr 495510000], length 1314
11:55:55.036562 IP 52.223.199.31.1935 > 10.8.0.2.38632: Flags [.], ack 33173, win 126, options [nop,nop,TS val 495510064 ecr 1304497606], length 0
11:55:55.046503 IP 52.223.199.31.1935 > 10.8.0.2.38632: Flags [.], ack 33307, win 126, options [nop,nop,TS val 495510074 ecr 1304497647], length 0
11:55:55.046519 IP 10.8.0.2.38632 > 52.223.199.31.1935: Flags [P.], seq 41191:41313, ack 1, win 501, options [nop,nop,TS val 1304497915 ecr 495510074], length 122
11:55:55.103775 IP 10.8.0.2.38632 > 52.223.199.31.1935: Flags [.], seq 41313:42627, ack 1, win 501, options [nop,nop,TS val 1304497972 ecr 495510074], length 1314
11:55:55.137964 IP 10.8.0.2.38632 > 52.223.199.31.1935: Flags [.], seq 42627:43941, ack 1, win 501, options [nop,nop,TS val 1304498007 ecr 495510074], length 1314
11:55:55.141164 IP 52.223.199.31.1935 > 10.8.0.2.38632: Flags [.], ack 35935, win 126, options [nop,nop,TS val 495510169 ecr 1304497701], length 0
11:55:55.173054 IP 10.8.0.2.38632 > 52.223.199.31.1935: Flags [.], seq 43941:45255, ack 1, win 501, options [nop,nop,TS val 1304498042 ecr 495510169], length 1314
11:55:55.236491 IP 10.8.0.2.38632 > 52.223.199.31.1935: Flags [.], seq 45255:46569, ack 1, win 501, options [nop,nop,TS val 1304498105 ecr 495510169], length 1314
11:55:55.240675 IP 52.223.199.31.1935 > 10.8.0.2.38632: Flags [.], ack 37249, win 126, options [nop,nop,TS val 495510268 ecr 1304497774], length 0
11:55:55.270881 IP 10.8.0.2.38632 > 52.223.199.31.1935: Flags [.], seq 46569:47883, ack 1, win 501, options [nop,nop,TS val 1304498140 ecr 495510268], length 1314
11:55:55.271505 IP 52.223.199.31.1935 > 10.8.0.2.38632: Flags [.], ack 39877, win 126, options [nop,nop,TS val 495510299 ecr 1304497840], length 0
11:55:55.303180 IP 10.8.0.2.38632 > 52.223.199.31.1935: Flags [.], seq 47883:49197, ack 1, win 501, options [nop,nop,TS val 1304498172 ecr 495510299], length 1314
11:55:55.314826 IP 52.223.199.31.1935 > 10.8.0.2.38632: Flags [.], ack 41313, win 126, options [nop,nop,TS val 495510343 ecr 1304497905], length 0
11:55:55.314856 IP 10.8.0.2.38632 > 52.223.199.31.1935: Flags [P.], seq 49197:49232, ack 1, win 501, options [nop,nop,TS val 1304498184 ecr 495510343], length 35
11:55:55.364190 IP 10.8.0.2.38632 > 52.223.199.31.1935: Flags [.], seq 49232:50546, ack 1, win 501, options [nop,nop,TS val 1304498233 ecr 495510343], length 1314
11:55:55.404587 IP 10.8.0.2.38632 > 52.223.199.31.1935: Flags [.], seq 50546:51860, ack 1, win 501, options [nop,nop,TS val 1304498273 ecr 495510343], length 1314
11:55:55.406563 IP 52.223.199.31.1935 > 10.8.0.2.38632: Flags [.], ack 43941, win 126, options [nop,nop,TS val 495510434 ecr 1304497972], length 0
11:55:55.438415 IP 10.8.0.2.38632 > 52.223.199.31.1935: Flags [.], seq 51860:53174, ack 1, win 501, options [nop,nop,TS val 1304498307 ecr 495510434], length 1314
11:55:55.503836 IP 10.8.0.2.38632 > 52.223.199.31.1935: Flags [.], seq 53174:54488, ack 1, win 501, options [nop,nop,TS val 1304498373 ecr 495510434], length 1314
11:55:55.505109 IP 52.223.199.31.1935 > 10.8.0.2.38632: Flags [.], ack 46569, win 126, options [nop,nop,TS val 495510533 ecr 1304498042], length 0
11:55:55.536032 IP 10.8.0.2.38632 > 52.223.199.31.1935: Flags [.], seq 54488:55802, ack 1, win 501, options [nop,nop,TS val 1304498405 ecr 495510533], length 1314
11:55:55.569588 IP 10.8.0.2.38632 > 52.223.199.31.1935: Flags [.], seq 55802:57116, ack 1, win 501, options [nop,nop,TS val 1304498438 ecr 495510533], length 1314
11:55:55.572626 IP 52.223.199.31.1935 > 10.8.0.2.38632: Flags [.], ack 49197, win 126, options [nop,nop,TS val 495510600 ecr 1304498140], length 0
11:55:55.583585 IP 52.223.199.31.1935 > 10.8.0.2.38632: Flags [.], ack 49232, win 126, options [nop,nop,TS val 495510611 ecr 1304498184], length 0
11:55:55.583614 IP 10.8.0.2.38632 > 52.223.199.31.1935: Flags [P.], seq 57116:57250, ack 1, win 501, options [nop,nop,TS val 1304498452 ecr 495510611], length 134
11:55:55.636924 IP 10.8.0.2.38632 > 52.223.199.31.1935: Flags [.], seq 57250:58564, ack 1, win 501, options [nop,nop,TS val 1304498506 ecr 495510611], length 1314
11:55:55.667032 IP 10.8.0.2.38632 > 52.223.199.31.1935: Flags [.], seq 58564:59878, ack 1, win 501, options [nop,nop,TS val 1304498536 ecr 495510611], length 1314
11:55:55.673066 IP 52.223.199.31.1935 > 10.8.0.2.38632: Flags [.], ack 51860, win 126, options [nop,nop,TS val 495510701 ecr 1304498233], length 0
11:55:55.706713 IP 10.8.0.2.38632 > 52.223.199.31.1935: Flags [.], seq 59878:61192, ack 1, win 501, options [nop,nop,TS val 1304498575 ecr 495510701], length 1314
11:55:55.766900 IP 10.8.0.2.38632 > 52.223.199.31.1935: Flags [.], seq 61192:62506, ack 1, win 501, options [nop,nop,TS val 1304498636 ecr 495510701], length 1314
11:55:55.772306 IP 52.223.199.31.1935 > 10.8.0.2.38632: Flags [.], ack 54488, win 126, options [nop,nop,TS val 495510800 ecr 1304498307], length 0
11:55:55.800464 IP 10.8.0.2.38632 > 52.223.199.31.1935: Flags [.], seq 62506:63820, ack 1, win 501, options [nop,nop,TS val 1304498669 ecr 495510800], length 1314
11:55:55.833834 IP 10.8.0.2.38632 > 52.223.199.31.1935: Flags [.], seq 63820:65134, ack 1, win 501, options [nop,nop,TS val 1304498703 ecr 495510800], length 1314
11:55:55.838275 IP 52.223.199.31.1935 > 10.8.0.2.38632: Flags [.], ack 57116, win 126, options [nop,nop,TS val 495510866 ecr 1304498405], length 0
11:55:55.853145 IP 52.223.199.31.1935 > 10.8.0.2.38632: Flags [.], ack 57250, win 126, options [nop,nop,TS val 495510881 ecr 1304498452], length 0
11:55:55.853158 IP 10.8.0.2.38632 > 52.223.199.31.1935: Flags [P.], seq 65134:65160, ack 1, win 501, options [nop,nop,TS val 1304498722 ecr 495510881], length 26
11:55:55.898063 IP 10.8.0.2.38632 > 52.223.199.31.1935: Flags [.], seq 65160:66474, ack 1, win 501, options [nop,nop,TS val 1304498767 ecr 495510881], length 1314
11:55:55.935891 IP 52.223.199.31.1935 > 10.8.0.2.38632: Flags [.], ack 59878, win 126, options [nop,nop,TS val 495510963 ecr 1304498506], length 0
11:55:55.939195 IP 10.8.0.2.38632 > 52.223.199.31.1935: Flags [.], seq 66474:67788, ack 1, win 501, options [nop,nop,TS val 1304498808 ecr 495510963], length 1314
11:55:55.971911 IP 10.8.0.2.38632 > 52.223.199.31.1935: Flags [.], seq 67788:69102, ack 1, win 501, options [nop,nop,TS val 1304498841 ecr 495510963], length 1314
11:55:56.035316 IP 10.8.0.2.38632 > 52.223.199.31.1935: Flags [.], seq 69102:70416, ack 1, win 501, options [nop,nop,TS val 1304498904 ecr 495510963], length 1314
11:55:56.035545 IP 52.223.199.31.1935 > 10.8.0.2.38632: Flags [.], ack 62506, win 126, options [nop,nop,TS val 495511063 ecr 1304498575], length 0
11:55:56.069647 IP 10.8.0.2.38632 > 52.223.199.31.1935: Flags [.], seq 70416:71730, ack 1, win 501, options [nop,nop,TS val 1304498938 ecr 495511063], length 1314
11:55:56.102533 IP 52.223.199.31.1935 > 10.8.0.2.38632: Flags [.], ack 65134, win 126, options [nop,nop,TS val 495511130 ecr 1304498669], length 0
11:55:56.104422 IP 10.8.0.2.38632 > 52.223.199.31.1935: Flags [.], seq 71730:73044, ack 1, win 501, options [nop,nop,TS val 1304498973 ecr 495511130], length 1314
11:55:56.121394 IP 52.223.199.31.1935 > 10.8.0.2.38632: Flags [.], ack 65160, win 126, options [nop,nop,TS val 495511149 ecr 1304498722], length 0
11:55:56.121425 IP 10.8.0.2.38632 > 52.223.199.31.1935: Flags [P.], seq 73044:73170, ack 1, win 501, options [nop,nop,TS val 1304498990 ecr 495511149], length 126
11:55:56.170881 IP 10.8.0.2.38632 > 52.223.199.31.1935: Flags [.], seq 73170:74484, ack 1, win 501, options [nop,nop,TS val 1304499040 ecr 495511149], length 1314
11:55:56.204558 IP 10.8.0.2.38632 > 52.223.199.31.1935: Flags [.], seq 74484:75798, ack 1, win 501, options [nop,nop,TS val 1304499073 ecr 495511149], length 1314
11:55:56.208412 IP 52.223.199.31.1935 > 10.8.0.2.38632: Flags [.], ack 67788, win 126, options [nop,nop,TS val 495511236 ecr 1304498767], length 0
11:55:56.240963 IP 10.8.0.2.38632 > 52.223.199.31.1935: Flags [.], seq 75798:77112, ack 1, win 501, options [nop,nop,TS val 1304499110 ecr 495511236], length 1314
11:55:56.304423 IP 10.8.0.2.38632 > 52.223.199.31.1935: Flags [.], seq 77112:78426, ack 1, win 501, options [nop,nop,TS val 1304499173 ecr 495511236], length 1314
11:55:56.305135 IP 52.223.199.31.1935 > 10.8.0.2.38632: Flags [.], ack 70416, win 126, options [nop,nop,TS val 495511332 ecr 1304498841], length 0
11:55:56.337676 IP 10.8.0.2.38632 > 52.223.199.31.1935: Flags [.], seq 78426:79740, ack 1, win 501, options [nop,nop,TS val 1304499206 ecr 495511332], length 1314
11:55:56.369777 IP 10.8.0.2.38632 > 52.223.199.31.1935: Flags [.], seq 79740:81054, ack 1, win 501, options [nop,nop,TS val 1304499238 ecr 495511332], length 1314
11:55:56.373147 IP 52.223.199.31.1935 > 10.8.0.2.38632: Flags [.], ack 73044, win 126, options [nop,nop,TS val 495511401 ecr 1304498938], length 0
11:55:56.389896 IP 52.223.199.31.1935 > 10.8.0.2.38632: Flags [.], ack 73170, win 126, options [nop,nop,TS val 495511418 ecr 1304498990], length 0
11:55:56.389907 IP 10.8.0.2.38632 > 52.223.199.31.1935: Flags [P.], seq 81054:81094, ack 1, win 501, options [nop,nop,TS val 1304499259 ecr 495511418], length 40
11:55:56.433018 IP 10.8.0.2.38632 > 52.223.199.31.1935: Flags [.], seq 81094:82408, ack 1, win 501, options [nop,nop,TS val 1304499302 ecr 495511418], length 1314
11:55:56.467148 IP 10.8.0.2.38632 > 52.223.199.31.1935: Flags [.], seq 82408:83722, ack 1, win 501, options [nop,nop,TS val 1304499336 ecr 495511418], length 1314
11:55:56.473074 IP 52.223.199.31.1935 > 10.8.0.2.38632: Flags [.], ack 75798, win 126, options [nop,nop,TS val 495511501 ecr 1304499040], length 0
11:55:56.500535 IP 10.8.0.2.38632 > 52.223.199.31.1935: Flags [.], seq 83722:85036, ack 1, win 501, options [nop,nop,TS val 1304499369 ecr 495511501], length 1314
11:55:56.571216 IP 10.8.0.2.38632 > 52.223.199.31.1935: Flags [.], seq 85036:86350, ack 1, win 501, options [nop,nop,TS val 1304499440 ecr 495511501], length 1314
11:55:56.573659 IP 52.223.199.31.1935 > 10.8.0.2.38632: Flags [.], ack 78426, win 126, options [nop,nop,TS val 495511601 ecr 1304499110], length 0
11:55:56.603696 IP 10.8.0.2.38632 > 52.223.199.31.1935: Flags [.], seq 86350:87664, ack 1, win 501, options [nop,nop,TS val 1304499472 ecr 495511601], length 1314
11:55:56.637670 IP 10.8.0.2.38632 > 52.223.199.31.1935: Flags [.], seq 87664:88978, ack 1, win 501, options [nop,nop,TS val 1304499506 ecr 495511601], length 1314
11:55:56.638626 IP 52.223.199.31.1935 > 10.8.0.2.38632: Flags [.], ack 81054, win 126, options [nop,nop,TS val 495511666 ecr 1304499206], length 0
11:55:56.658249 IP 52.223.199.31.1935 > 10.8.0.2.38632: Flags [.], ack 81094, win 126, options [nop,nop,TS val 495511686 ecr 1304499259], length 0
11:55:56.658280 IP 10.8.0.2.38632 > 52.223.199.31.1935: Flags [P.], seq 88978:89100, ack 1, win 501, options [nop,nop,TS val 1304499527 ecr 495511686], length 122
11:55:56.703729 IP 10.8.0.2.38632 > 52.223.199.31.1935: Flags [.], seq 89100:90414, ack 1, win 501, options [nop,nop,TS val 1304499572 ecr 495511686], length 1314
11:55:56.737453 IP 52.223.199.31.1935 > 10.8.0.2.38632: Flags [.], ack 83722, win 126, options [nop,nop,TS val 495511764 ecr 1304499302], length 0
11:55:56.737575 IP 10.8.0.2.38632 > 52.223.199.31.1935: Flags [.], seq 90414:91728, ack 1, win 501, options [nop,nop,TS val 1304499606 ecr 495511764], length 1314
11:55:56.775515 IP 10.8.0.2.38632 > 52.223.199.31.1935: Flags [.], seq 91728:93042, ack 1, win 501, options [nop,nop,TS val 1304499644 ecr 495511764], length 1314
11:55:56.837361 IP 10.8.0.2.38632 > 52.223.199.31.1935: Flags [.], seq 93042:94356, ack 1, win 501, options [nop,nop,TS val 1304499706 ecr 495511764], length 1314
11:55:56.840002 IP 52.223.199.31.1935 > 10.8.0.2.38632: Flags [.], ack 86350, win 126, options [nop,nop,TS val 495511868 ecr 1304499369], length 0
11:55:56.870909 IP 10.8.0.2.38632 > 52.223.199.31.1935: Flags [.], seq 94356:95670, ack 1, win 501, options [nop,nop,TS val 1304499740 ecr 495511868], length 1314
11:55:56.904126 IP 10.8.0.2.38632 > 52.223.199.31.1935: Flags [.], seq 95670:96984, ack 1, win 501, options [nop,nop,TS val 1304499773 ecr 495511868], length 1314
11:55:56.906365 IP 52.223.199.31.1935 > 10.8.0.2.38632: Flags [.], ack 88978, win 126, options [nop,nop,TS val 495511934 ecr 1304499472], length 0
11:55:56.926384 IP 52.223.199.31.1935 > 10.8.0.2.38632: Flags [.], ack 89100, win 126, options [nop,nop,TS val 495511954 ecr 1304499527], length 0
11:55:56.926407 IP 10.8.0.2.38632 > 52.223.199.31.1935: Flags [P.], seq 96984:97114, ack 1, win 501, options [nop,nop,TS val 1304499795 ecr 495511954], length 130
11:55:56.968419 IP 10.8.0.2.38632 > 52.223.199.31.1935: Flags [.], seq 97114:98428, ack 1, win 501, options [nop,nop,TS val 1304499837 ecr 495511954], length 1314
11:55:57.004867 IP 10.8.0.2.38632 > 52.223.199.31.1935: Flags [.], seq 98428:99742, ack 1, win 501, options [nop,nop,TS val 1304499874 ecr 495511954], length 1314
11:55:57.007393 IP 52.223.199.31.1935 > 10.8.0.2.38632: Flags [.], ack 91728, win 126, options [nop,nop,TS val 495512034 ecr 1304499572], length 0
11:55:57.053909 IP 10.8.0.2.38632 > 52.223.199.31.1935: Flags [.], seq 99742:101056, ack 1, win 501, options [nop,nop,TS val 1304499923 ecr 495512034], length 1314
11:55:57.104285 IP 10.8.0.2.38632 > 52.223.199.31.1935: Flags [.], seq 101056:102370, ack 1, win 501, options [nop,nop,TS val 1304499973 ecr 495512034], length 1314
11:55:57.106823 IP 52.223.199.31.1935 > 10.8.0.2.38632: Flags [.], ack 94356, win 126, options [nop,nop,TS val 495512134 ecr 1304499644], length 0
11:55:57.138156 IP 10.8.0.2.38632 > 52.223.199.31.1935: Flags [.], seq 102370:103684, ack 1, win 501, options [nop,nop,TS val 1304500007 ecr 495512134], length 1314
11:55:57.173350 IP 52.223.199.31.1935 > 10.8.0.2.38632: Flags [.], ack 96984, win 126, options [nop,nop,TS val 495512201 ecr 1304499740], length 0
11:55:57.181814 IP 10.8.0.2.38632 > 52.223.199.31.1935: Flags [.], seq 103684:104998, ack 1, win 501, options [nop,nop,TS val 1304500051 ecr 495512201], length 1314
11:55:57.194597 IP 52.223.199.31.1935 > 10.8.0.2.38632: Flags [.], ack 97114, win 126, options [nop,nop,TS val 495512222 ecr 1304499795], length 0
11:55:57.194606 IP 10.8.0.2.38632 > 52.223.199.31.1935: Flags [P.], seq 104998:105037, ack 1, win 501, options [nop,nop,TS val 1304500063 ecr 495512222], length 39
11:55:57.237859 IP 10.8.0.2.38632 > 52.223.199.31.1935: Flags [.], seq 105037:106351, ack 1, win 501, options [nop,nop,TS val 1304500107 ecr 495512222], length 1314
11:55:57.267016 IP 10.8.0.2.38632 > 52.223.199.31.1935: Flags [.], seq 106351:107665, ack 1, win 501, options [nop,nop,TS val 1304500136 ecr 495512222], length 1314
11:55:57.274699 IP 52.223.199.31.1935 > 10.8.0.2.38632: Flags [.], ack 99742, win 126, options [nop,nop,TS val 495512303 ecr 1304499837], length 0
11:55:57.309494 IP 10.8.0.2.38632 > 52.223.199.31.1935: Flags [.], seq 107665:108979, ack 1, win 501, options [nop,nop,TS val 1304500178 ecr 495512303], length 1314
11:55:57.371113 IP 10.8.0.2.38632 > 52.223.199.31.1935: Flags [.], seq 108979:110293, ack 1, win 501, options [nop,nop,TS val 1304500240 ecr 495512303], length 1314
11:55:57.372961 IP 52.223.199.31.1935 > 10.8.0.2.38632: Flags [.], ack 102370, win 126, options [nop,nop,TS val 495512401 ecr 1304499923], length 0
11:55:57.402985 IP 10.8.0.2.38632 > 52.223.199.31.1935: Flags [.], seq 110293:111607, ack 1, win 501, options [nop,nop,TS val 1304500272 ecr 495512401], length 1314
11:55:57.437714 IP 10.8.0.2.38632 > 52.223.199.31.1935: Flags [.], seq 111607:112921, ack 1, win 501, options [nop,nop,TS val 1304500306 ecr 495512401], length 1314
11:55:57.451128 IP 52.223.199.31.1935 > 10.8.0.2.38632: Flags [.], ack 104998, win 126, options [nop,nop,TS val 495512478 ecr 1304500007], length 0
11:55:57.462682 IP 52.223.199.31.1935 > 10.8.0.2.38632: Flags [.], ack 105037, win 126, options [nop,nop,TS val 495512490 ecr 1304500063], length 0
11:55:57.462708 IP 10.8.0.2.38632 > 52.223.199.31.1935: Flags [P.], seq 112921:113038, ack 1, win 501, options [nop,nop,TS val 1304500331 ecr 495512490], length 117
11:55:57.502123 IP 10.8.0.2.38632 > 52.223.199.31.1935: Flags [.], seq 113038:114352, ack 1, win 501, options [nop,nop,TS val 1304500371 ecr 495512490], length 1314
11:55:57.535660 IP 52.223.199.31.1935 > 10.8.0.2.38632: Flags [.], ack 107665, win 126, options [nop,nop,TS val 495512563 ecr 1304500107], length 0
11:55:57.537640 IP 10.8.0.2.38632 > 52.223.199.31.1935: Flags [.], seq 114352:115666, ack 1, win 501, options [nop,nop,TS val 1304500406 ecr 495512563], length 1314
11:55:57.587811 IP 10.8.0.2.38632 > 52.223.199.31.1935: Flags [.], seq 115666:116980, ack 1, win 501, options [nop,nop,TS val 1304500457 ecr 495512563], length 1314
11:55:57.636745 IP 10.8.0.2.38632 > 52.223.199.31.1935: Flags [.], seq 116980:118294, ack 1, win 501, options [nop,nop,TS val 1304500505 ecr 495512563], length 1314
11:55:57.639943 IP 52.223.199.31.1935 > 10.8.0.2.38632: Flags [.], ack 110293, win 126, options [nop,nop,TS val 495512668 ecr 1304500178], length 0
11:55:57.669997 IP 10.8.0.2.38632 > 52.223.199.31.1935: Flags [.], seq 118294:119608, ack 1, win 501, options [nop,nop,TS val 1304500539 ecr 495512668], length 1314
11:55:57.706384 IP 52.223.199.31.1935 > 10.8.0.2.38632: Flags [.], ack 112921, win 126, options [nop,nop,TS val 495512734 ecr 1304500272], length 0
11:55:57.716187 IP 10.8.0.2.38632 > 52.223.199.31.1935: Flags [.], seq 119608:120922, ack 1, win 501, options [nop,nop,TS val 1304500585 ecr 495512734], length 1314
11:55:57.730857 IP 52.223.199.31.1935 > 10.8.0.2.38632: Flags [.], ack 113038, win 126, options [nop,nop,TS val 495512759 ecr 1304500331], length 0
11:55:57.730882 IP 10.8.0.2.38632 > 52.223.199.31.1935: Flags [P.], seq 120922:120957, ack 1, win 501, options [nop,nop,TS val 1304500600 ecr 495512759], length 35
11:55:57.759004 IP 10.8.0.2.38632 > 52.223.199.31.1935: Flags [.], seq 120957:122271, ack 1, win 501, options [nop,nop,TS val 1304500628 ecr 495512759], length 1314
11:55:57.801713 IP 10.8.0.2.38632 > 52.223.199.31.1935: Flags [.], seq 122271:123585, ack 1, win 501, options [nop,nop,TS val 1304500670 ecr 495512759], length 1314
11:55:57.806234 IP 52.223.199.31.1935 > 10.8.0.2.38632: Flags [.], ack 115666, win 126, options [nop,nop,TS val 495512834 ecr 1304500371], length 0
11:55:57.833553 IP 10.8.0.2.38632 > 52.223.199.31.1935: Flags [.], seq 123585:124899, ack 1, win 501, options [nop,nop,TS val 1304500702 ecr 495512834], length 1314
11:55:57.902978 IP 10.8.0.2.38632 > 52.223.199.31.1935: Flags [.], seq 124899:126213, ack 1, win 501, options [nop,nop,TS val 1304500772 ecr 495512834], length 1314
11:55:57.905816 IP 52.223.199.31.1935 > 10.8.0.2.38632: Flags [.], ack 118294, win 126, options [nop,nop,TS val 495512933 ecr 1304500457], length 0
11:55:57.938202 IP 10.8.0.2.38632 > 52.223.199.31.1935: Flags [.], seq 126213:127527, ack 1, win 501, options [nop,nop,TS val 1304500807 ecr 495512933], length 1314
11:55:57.971662 IP 10.8.0.2.38632 > 52.223.199.31.1935: Flags [.], seq 127527:128841, ack 1, win 501, options [nop,nop,TS val 1304500840 ecr 495512933], length 1314
11:55:57.984773 IP 52.223.199.31.1935 > 10.8.0.2.38632: Flags [.], ack 120922, win 126, options [nop,nop,TS val 495513013 ecr 1304500539], length 0
11:55:57.999069 IP 52.223.199.31.1935 > 10.8.0.2.38632: Flags [.], ack 120957, win 126, options [nop,nop,TS val 495513027 ecr 1304500600], length 0
11:55:57.999133 IP 10.8.0.2.38632 > 52.223.199.31.1935: Flags [P.], seq 128841:128976, ack 1, win 501, options [nop,nop,TS val 1304500868 ecr 495513027], length 135
11:55:58.035645 IP 10.8.0.2.38632 > 52.223.199.31.1935: Flags [.], seq 128976:130290, ack 1, win 501, options [nop,nop,TS val 1304500904 ecr 495513027], length 1314
11:55:58.070836 IP 52.223.199.31.1935 > 10.8.0.2.38632: Flags [.], ack 123585, win 126, options [nop,nop,TS val 495513098 ecr 1304500628], length 0
11:55:58.071433 IP 10.8.0.2.38632 > 52.223.199.31.1935: Flags [.], seq 130290:131604, ack 1, win 501, options [nop,nop,TS val 1304500940 ecr 495513098], length 1314
11:55:58.120899 IP 10.8.0.2.38632 > 52.223.199.31.1935: Flags [.], seq 131604:132918, ack 1, win 501, options [nop,nop,TS val 1304500990 ecr 495513098], length 1314
11:55:58.168908 IP 10.8.0.2.38632 > 52.223.199.31.1935: Flags [.], seq 132918:134232, ack 1, win 501, options [nop,nop,TS val 1304501038 ecr 495513098], length 1314
11:55:58.171780 IP 52.223.199.31.1935 > 10.8.0.2.38632: Flags [.], ack 126213, win 126, options [nop,nop,TS val 495513199 ecr 1304500702], length 0
11:55:58.204671 IP 10.8.0.2.38632 > 52.223.199.31.1935: Flags [.], seq 134232:135546, ack 1, win 501, options [nop,nop,TS val 1304501073 ecr 495513199], length 1314
11:55:58.240365 IP 52.223.199.31.1935 > 10.8.0.2.38632: Flags [.], ack 128841, win 126, options [nop,nop,TS val 495513268 ecr 1304500807], length 0
11:55:58.248685 IP 10.8.0.2.38632 > 52.223.199.31.1935: Flags [.], seq 135546:136860, ack 1, win 501, options [nop,nop,TS val 1304501117 ecr 495513268], length 1314
11:55:58.268084 IP 52.223.199.31.1935 > 10.8.0.2.38632: Flags [.], ack 128976, win 126, options [nop,nop,TS val 495513295 ecr 1304500868], length 0
11:55:58.268099 IP 10.8.0.2.38632 > 52.223.199.31.1935: Flags [P.], seq 136860:137734, ack 1, win 501, options [nop,nop,TS val 1304501137 ecr 495513295], length 874
11:55:58.338077 IP 10.8.0.2.38632 > 52.223.199.31.1935: Flags [.], seq 137734:139048, ack 1, win 501, options [nop,nop,TS val 1304501207 ecr 495513295], length 1314
11:55:58.340384 IP 52.223.199.31.1935 > 10.8.0.2.38632: Flags [.], ack 131604, win 126, options [nop,nop,TS val 495513368 ecr 1304500904], length 0
11:55:58.371064 IP 10.8.0.2.38632 > 52.223.199.31.1935: Flags [.], seq 139048:140362, ack 1, win 501, options [nop,nop,TS val 1304501240 ecr 495513368], length 1314
11:55:58.401636 IP 10.8.0.2.38632 > 52.223.199.31.1935: Flags [.], seq 140362:141676, ack 1, win 501, options [nop,nop,TS val 1304501270 ecr 495513368], length 1314
11:55:58.437919 IP 52.223.199.31.1935 > 10.8.0.2.38632: Flags [.], ack 134232, win 126, options [nop,nop,TS val 495513466 ecr 1304500990], length 0
11:55:58.471279 IP 10.8.0.2.38632 > 52.223.199.31.1935: Flags [.], seq 141676:142990, ack 1, win 501, options [nop,nop,TS val 1304501340 ecr 495513466], length 1314
11:55:58.503039 IP 10.8.0.2.38632 > 52.223.199.31.1935: Flags [.], seq 142990:144304, ack 1, win 501, options [nop,nop,TS val 1304501372 ecr 495513466], length 1314
11:55:58.517411 IP 52.223.199.31.1935 > 10.8.0.2.38632: Flags [.], ack 136860, win 126, options [nop,nop,TS val 495513545 ecr 1304501073], length 0
11:55:58.536439 IP 10.8.0.2.38632 > 52.223.199.31.1935: Flags [.], seq 144304:145618, ack 1, win 501, options [nop,nop,TS val 1304501405 ecr 495513545], length 1314
11:55:58.537334 IP 52.223.199.31.1935 > 10.8.0.2.38632: Flags [.], ack 137734, win 126, options [nop,nop,TS val 495513565 ecr 1304501137], length 0
11:55:58.537361 IP 10.8.0.2.38632 > 52.223.199.31.1935: Flags [P.], seq 145618:145748, ack 1, win 501, options [nop,nop,TS val 1304501406 ecr 495513565], length 130
11:55:58.604210 IP 10.8.0.2.38632 > 52.223.199.31.1935: Flags [.], seq 145748:147062, ack 1, win 501, options [nop,nop,TS val 1304501473 ecr 495513565], length 1314
11:55:58.637368 IP 10.8.0.2.38632 > 52.223.199.31.1935: Flags [.], seq 147062:148376, ack 1, win 501, options [nop,nop,TS val 1304501506 ecr 495513565], length 1314
11:55:58.640016 IP 52.223.199.31.1935 > 10.8.0.2.38632: Flags [.], ack 140362, win 126, options [nop,nop,TS val 495513668 ecr 1304501207], length 0
11:55:58.668325 IP 10.8.0.2.38632 > 52.223.199.31.1935: Flags [.], seq 148376:149690, ack 1, win 501, options [nop,nop,TS val 1304501537 ecr 495513668], length 1314
11:55:58.732336 IP 52.223.199.31.1935 > 10.8.0.2.38632: Flags [.], ack 141676, win 126, options [nop,nop,TS val 495513760 ecr 1304501270], length 0
11:55:58.738093 IP 10.8.0.2.38632 > 52.223.199.31.1935: Flags [.], seq 149690:151004, ack 1, win 501, options [nop,nop,TS val 1304501607 ecr 495513760], length 1314
11:55:58.771006 IP 10.8.0.2.38632 > 52.223.199.31.1935: Flags [.], seq 151004:152318, ack 1, win 501, options [nop,nop,TS val 1304501640 ecr 495513760], length 1314
11:55:58.771782 IP 52.223.199.31.1935 > 10.8.0.2.38632: Flags [.], ack 144304, win 126, options [nop,nop,TS val 495513800 ecr 1304501340], length 0
11:55:58.801945 IP 10.8.0.2.38632 > 52.223.199.31.1935: Flags [.], seq 152318:153632, ack 1, win 501, options [nop,nop,TS val 1304501671 ecr 495513800], length 1314
11:55:58.805953 IP 52.223.199.31.1935 > 10.8.0.2.38632: Flags [.], ack 145748, win 126, options [nop,nop,TS val 495513834 ecr 1304501405], length 0
11:55:58.805973 IP 10.8.0.2.38632 > 52.223.199.31.1935: Flags [P.], seq 153632:153766, ack 1, win 501, options [nop,nop,TS val 1304501675 ecr 495513834], length 134
11:55:58.870586 IP 10.8.0.2.38632 > 52.223.199.31.1935: Flags [.], seq 153766:155080, ack 1, win 501, options [nop,nop,TS val 1304501739 ecr 495513834], length 1314
11:55:58.903595 IP 10.8.0.2.38632 > 52.223.199.31.1935: Flags [.], seq 155080:156394, ack 1, win 501, options [nop,nop,TS val 1304501772 ecr 495513834], length 1314
11:55:58.906999 IP 52.223.199.31.1935 > 10.8.0.2.38632: Flags [.], ack 148376, win 126, options [nop,nop,TS val 495513934 ecr 1304501473], length 0
11:55:58.935040 IP 10.8.0.2.38632 > 52.223.199.31.1935: Flags [.], seq 156394:157708, ack 1, win 501, options [nop,nop,TS val 1304501804 ecr 495513934], length 1314
11:55:59.000387 IP 52.223.199.31.1935 > 10.8.0.2.38632: Flags [.], ack 149690, win 126, options [nop,nop,TS val 495514028 ecr 1304501537], length 0
11:55:59.003188 IP 10.8.0.2.38632 > 52.223.199.31.1935: Flags [.], seq 157708:159022, ack 1, win 501, options [nop,nop,TS val 1304501872 ecr 495514028], length 1314
11:55:59.033597 IP 10.8.0.2.38632 > 52.223.199.31.1935: Flags [.], seq 159022:160336, ack 1, win 501, options [nop,nop,TS val 1304501902 ecr 495514028], length 1314
11:55:59.039727 IP 52.223.199.31.1935 > 10.8.0.2.38632: Flags [.], ack 152318, win 126, options [nop,nop,TS val 495514068 ecr 1304501607], length 0
11:55:59.068477 IP 10.8.0.2.38632 > 52.223.199.31.1935: Flags [.], seq 160336:161650, ack 1, win 501, options [nop,nop,TS val 1304501937 ecr 495514068], length 1314
11:55:59.074349 IP 52.223.199.31.1935 > 10.8.0.2.38632: Flags [.], ack 153766, win 126, options [nop,nop,TS val 495514102 ecr 1304501671], length 0
11:55:59.074375 IP 10.8.0.2.38632 > 52.223.199.31.1935: Flags [P.], seq 161650:161673, ack 1, win 501, options [nop,nop,TS val 1304501943 ecr 495514102], length 23
11:55:59.137885 IP 10.8.0.2.38632 > 52.223.199.31.1935: Flags [.], seq 161673:162987, ack 1, win 501, options [nop,nop,TS val 1304502007 ecr 495514102], length 1314
11:55:59.167825 IP 10.8.0.2.38632 > 52.223.199.31.1935: Flags [.], seq 162987:164301, ack 1, win 501, options [nop,nop,TS val 1304502037 ecr 495514102], length 1314
11:55:59.172358 IP 52.223.199.31.1935 > 10.8.0.2.38632: Flags [.], ack 156394, win 126, options [nop,nop,TS val 495514200 ecr 1304501739], length 0
11:55:59.200591 IP 10.8.0.2.38632 > 52.223.199.31.1935: Flags [.], seq 164301:165615, ack 1, win 501, options [nop,nop,TS val 1304502069 ecr 495514200], length 1314
11:55:59.264275 IP 52.223.199.31.1935 > 10.8.0.2.38632: Flags [.], ack 157708, win 126, options [nop,nop,TS val 495514292 ecr 1304501804], length 0
11:55:59.271396 IP 10.8.0.2.38632 > 52.223.199.31.1935: Flags [.], seq 165615:166929, ack 1, win 501, options [nop,nop,TS val 1304502140 ecr 495514292], length 1314
11:55:59.302388 IP 52.223.199.31.1935 > 10.8.0.2.38632: Flags [.], ack 160336, win 126, options [nop,nop,TS val 495514330 ecr 1304501872], length 0
11:55:59.304337 IP 10.8.0.2.38632 > 52.223.199.31.1935: Flags [.], seq 166929:168243, ack 1, win 501, options [nop,nop,TS val 1304502173 ecr 495514330], length 1314
11:55:59.337923 IP 10.8.0.2.38632 > 52.223.199.31.1935: Flags [.], seq 168243:169557, ack 1, win 501, options [nop,nop,TS val 1304502207 ecr 495514330], length 1314
11:55:59.342597 IP 52.223.199.31.1935 > 10.8.0.2.38632: Flags [.], ack 161673, win 126, options [nop,nop,TS val 495514371 ecr 1304501937], length 0
11:55:59.342630 IP 10.8.0.2.38632 > 52.223.199.31.1935: Flags [P.], seq 169557:169687, ack 1, win 501, options [nop,nop,TS val 1304502211 ecr 495514371], length 130
11:55:59.404564 IP 10.8.0.2.38632 > 52.223.199.31.1935: Flags [.], seq 169687:171001, ack 1, win 501, options [nop,nop,TS val 1304502273 ecr 495514371], length 1314
11:55:59.436448 IP 52.223.199.31.1935 > 10.8.0.2.38632: Flags [.], ack 164301, win 126, options [nop,nop,TS val 495514464 ecr 1304502007], length 0
11:55:59.438214 IP 10.8.0.2.38632 > 52.223.199.31.1935: Flags [.], seq 171001:172315, ack 1, win 501, options [nop,nop,TS val 1304502307 ecr 495514464], length 1314
11:55:59.471149 IP 10.8.0.2.38632 > 52.223.199.31.1935: Flags [.], seq 172315:173629, ack 1, win 501, options [nop,nop,TS val 1304502340 ecr 495514464], length 1314
11:55:59.532262 IP 52.223.199.31.1935 > 10.8.0.2.38632: Flags [.], ack 165615, win 126, options [nop,nop,TS val 495514560 ecr 1304502069], length 0
11:55:59.536146 IP 10.8.0.2.38632 > 52.223.199.31.1935: Flags [.], seq 173629:174943, ack 1, win 501, options [nop,nop,TS val 1304502405 ecr 495514560], length 1314
11:55:59.566969 IP 10.8.0.2.38632 > 52.223.199.31.1935: Flags [.], seq 174943:176257, ack 1, win 501, options [nop,nop,TS val 1304502436 ecr 495514560], length 1314
11:55:59.573000 IP 52.223.199.31.1935 > 10.8.0.2.38632: Flags [.], ack 168243, win 126, options [nop,nop,TS val 495514601 ecr 1304502140], length 0
11:55:59.600924 IP 10.8.0.2.38632 > 52.223.199.31.1935: Flags [.], seq 176257:177571, ack 1, win 501, options [nop,nop,TS val 1304502470 ecr 495514601], length 1314
11:55:59.610819 IP 52.223.199.31.1935 > 10.8.0.2.38632: Flags [.], ack 169687, win 126, options [nop,nop,TS val 495514639 ecr 1304502207], length 0
11:55:59.610836 IP 10.8.0.2.38632 > 52.223.199.31.1935: Flags [P.], seq 177571:177610, ack 1, win 501, options [nop,nop,TS val 1304502480 ecr 495514639], length 39
11:55:59.671303 IP 10.8.0.2.38632 > 52.223.199.31.1935: Flags [.], seq 177610:178924, ack 1, win 501, options [nop,nop,TS val 1304502540 ecr 495514639], length 1314
11:55:59.703048 IP 10.8.0.2.38632 > 52.223.199.31.1935: Flags [.], seq 178924:180238, ack 1, win 501, options [nop,nop,TS val 1304502572 ecr 495514639], length 1314
11:55:59.707227 IP 52.223.199.31.1935 > 10.8.0.2.38632: Flags [.], ack 172315, win 126, options [nop,nop,TS val 495514735 ecr 1304502273], length 0
11:55:59.736024 IP 10.8.0.2.38632 > 52.223.199.31.1935: Flags [.], seq 180238:181552, ack 1, win 501, options [nop,nop,TS val 1304502605 ecr 495514735], length 1314
11:55:59.800129 IP 52.223.199.31.1935 > 10.8.0.2.38632: Flags [.], ack 173629, win 126, options [nop,nop,TS val 495514828 ecr 1304502340], length 0
11:55:59.802899 IP 10.8.0.2.38632 > 52.223.199.31.1935: Flags [.], seq 181552:182866, ack 1, win 501, options [nop,nop,TS val 1304502672 ecr 495514828], length 1314
11:55:59.833525 IP 10.8.0.2.38632 > 52.223.199.31.1935: Flags [.], seq 182866:184180, ack 1, win 501, options [nop,nop,TS val 1304502702 ecr 495514828], length 1314
